{"title":"CAMPOS, Jaime","cargoss":["Deputado federal"],"cargos_esp":[0],"datas_ini":[1989],"datas_fim":[1991],"estados":["RJ"],"autor":[0],"content":"**CAMPOS, Jaime**\n\n\\*dep. fed. RJ 1989-1991.\n\n \n\n*Jaime Mendonça de Campos* nasceu em São Gonçalo (RJ) no dia 26 de maio\nde 1935, filho de José de Sousa Campos e de Olímpia Cândida de Mendonça.\n\nFormado em direito pela Universidade Federal do Rio de Janeiro,\ningressou na política em 1963, sendo eleito vereador em São Gonçalo na\nlegenda do Partido Social Progressista (PSP). Com a instituição do\nbipartidarismo pelo Ato Institucional nº 2 (AI-2) em 27 de outubro de\n1965, Jaime Campos filiou-se ao Movimento Democrático Brasileiro (MDB),\nagremiação de oposição ao regime militar instalado no país em abril de\n1964, sendo eleito deputado estadual pelo Rio de Janeiro em 1966. Ainda\nnesse ano e nos dois subseqüentes, realizou diversos cursos na área de\ndireito, quase todos na Universidade Federal Fluminense (UFF).\n\nNos pleitos de novembro de 1970 e 1974 reelegeu-se deputado estadual na\nlegenda do MDB. Em 1975 foi presidente da mesa da Assembléia\nLegislativa. No ano seguinte, conseguiu sua eleição para a prefeitura de\nSão Gonçalo, exercendo o mandato entre 1977 e 1979. Nesse período,\nparticipou do seminário sobre administração municipal e desenvolvimento\nsocial realizado em Berlim.\n\nCom a extinção do MDB e da Aliança Renovadora Nacional (Arena) em 29 de\nnovembro de 1979 e a conseqüente reformulação partidária, transferiu-se\nem 1980 para o Partido do Movimento Democrático Brasileiro (PMDB),\nherdeiro político do MDB, no qual permaneceu até 1985. Nesse ano\nfiliou-se ao Partido Democrático Trabalhista (PDT), liderado por Leonel\nBrizola, então governador do estado do Rio de Janeiro. Candidatou-se a\ndeputado federal constituinte em novembro de 1986 obtendo, contudo,\napenas uma suplência.\n\nCom o licenciamento de Juarez Antunes para ocupar a prefeitura de Volta\nRedonda, Jaime Campos assumiu, em 3 de janeiro de 1989, uma cadeira na\nCâmara dos Deputados. Nesse mesmo ano desligou-se do PDT e filiou-se ao\nPartido da Juventude (PJ), agremiação que deu origem ao Partido da\nReconstrução Nacional (PRN). Em outubro de 1990, disputou mais um\nmandato mas não conseguiu sua eleição. Deixou a Câmara dos Deputados em\njaneiro de 1991, ao final da legislatura.\n\nFaleceu em São Gonçalo no dia 10 de outubro de 1992.\n\nEra casado com Adelice da Costa Campos, com quem teve três filhas.\n\n \n\nFONTES: ARQ. CÂMARA DOS DEPUTADOS; *Jornal do Brasil* (23/11/88).\n\n \n","ref":"FONTES: ARQ. CÂMARA DOS DEPUTADOS; *Jornal do Brasil* (23/11/88).\n\n \n","dic":"DHBB"}
