{"title":"CAMPOS, Ronaldo","cargoss":["Deputado federal"],"cargos_esp":[0],"datas_ini":[1983],"datas_fim":[1987],"estados":["PA"],"autor":[0],"content":"**CAMPOS, Ronaldo**\n\n\\*dep. fed. PA 1983-1987.\n\n*José Ronaldo Campos de Sousa* nasceu em Santarém (PA) no dia 21 de\nfevereiro de 1942, filho de Inácio Ubirajara Bentes de Sousa e de Ana\nMaria Campos de Sousa.\n\nComerciante, foi representante do Serviço Nacional dos Municípios\n(Senam) no Baixo Amazonas em 1961. Em outubro de 1962 foi eleito\nvereador em Santarém, tomando posse em janeiro do ano seguinte. Com a\nextinção dos partidos políticos pelo Ato Institucional nº 2 (27/10/1965)\ne a posterior instauração do bipartidarismo, filiou-se ao Movimento\nDemocrático Brasileiro (MDB), partido de oposição ao regime militar\ninstaurado em abril de 1964. Em 1967, quando terminou seu mandato de\nvereador, foi nomeado secretário de Obras da Prefeitura de Santarém. Foi\nnovamente eleito vereador em novembro de 1970, na legenda do MDB,\nassumindo sua cadeira em janeiro do ano seguinte. Reelegeu-se vereador\nno pleito de novembro de 1972.\n\nEm novembro de 1974 foi eleito deputado estadual. Encerrou seu mandato\nde vereador em janeiro, tomando posse na Assembléia Legislativa do Pará\nem fevereiro de 1975. Foi reeleito deputado estadual no pleito de\nnovembro de 1978. Com a extinção do bipartidarismo em novembro de 1979 e\na conseqüente reformulação partidária, filiou-se ao Partido do Movimento\nDemocrático Brasileiro (PMDB), sucessor do MDB. Foi líder do partido na\nAssembléia e membro da Comissão de Orçamento.\n\nEm novembro de 1982 conseguiu sua eleição para deputado federal pelo\nPará na legenda do PMDB. Encerrou seu mandato no Legislativo estadual em\njaneiro de 1983 e, no mês seguinte, foi empossado na Câmara dos\nDeputados. Em 25 de abril de 1984 votou a favor da emenda Dante de\nOliveira, que propunha o restabelecimento de eleições diretas para\npresidente da República em novembro daquele ano. Como a emenda não\nobteve o número de votos indispensáveis à sua aprovação — faltaram 22\npara que o projeto pudesse ser encaminhado à apreciação pelo Senado —,\nno Colégio Eleitoral, reunido em 15 de janeiro de 1985, Ronaldo Campos\nvotou no candidato oposicionista Tancredo Neves, eleito presidente da\nRepública pela Aliança Democrática, uma união do PMDB com a dissidência\ndo Partido Democrático Social (PDS) abrigada na Frente Liberal. Contudo,\nTancredo Neves não chegou a ser empossado na presidência, vindo a\nfalecer, por motivo de doença, em 21 de abril de 1985. Seu substituto no\ncargo foi o vice José Sarney, que já vinha exercendo interinamente o\ncargo desde 15 de março. Ainda durante essa legislatura, Ronaldo Campos\nfoi membro da Comissão do Interior e suplente da Comissão de Defesa do\nConsumidor.\n\nNo pleito de novembro de 1985, foi eleito prefeito de Santarém na\nlegenda do PMDB. Empossado em janeiro do ano seguinte, deixou a Câmara,\nsendo substituído pelo suplente Benedito Monteiro. Terminou seu mandato\nna prefeitura em 31 de dezembro de 1988.\n\nEm 1989, tornou-se diretor-presidente da Empresa de Navegação da\nAmazônia, que posteriormente passou a chamar-se Companhia Docas do Pará,\ncargo que ocupou até 1990. De 1991 a 1994, foi assessor especial do\ngovernador Jáder Barbalho (PMDB) e, nos dois anos seguintes, assessor do\nprefeito de Belém, Hélio Gueiros (PFL).\n\nEm janeiro de 1997, tornou-se assessor do prefeito de Santarém, Joaquim\nde Lira Maia, do PFL.\n\nCasou-se com Rosilda Campos de Sousa, com quem teve quatro filhos.\n\nFONTES: CÂM. DEP*. Deputados brasileiros.* *Repertório* (1983-1987);\nINF. BIOG.; *Jornal do Brasil* (20/6/85); TRIB. REG. ELEIT. PA. *Dados.*\n\n \n","ref":"FONTES: CÂM. DEP*. Deputados brasileiros.* *Repertório* (1983-1987);\nINF. BIOG.; *Jornal do Brasil* (20/6/85); TRIB. REG. ELEIT. PA. *Dados.*\n\n \n","dic":"DHBB"}
