{"title":"CAMURÇA, Carlos","cargoss":["Deputado federal","Prefeito"],"cargos_esp":[0,"Porto Velho"],"datas_ini":[1991,1998],"datas_fim":[1996,2004],"estados":["RO",0],"autor":[0],"content":"**CAMURÇA, Carlos**\n\n\\*dep. fed. RO 1991-1996; pref. Porto Velho 1998-2004.\n\n*Carlos Alberto de Azevedo Camurça* nasceu em Guajará-Mirim, no dia 20\nde julho de 1956, filho de Abel Camurça Filho e de Helena de Azevedo\nCamurça.\n\nEm 1976 ingressou no curso técnico em administração da Escola Carmela\nDutra, em Porto Velho, concluindo-o no ano seguinte.\n\nEm 1989, filiou-se ao Partido da Renovação Nacional (PRN), agremiação\nque lançou a candidatura vitoriosa de Fernando Collor de Melo à\npresidência da República no pleito de novembro/dezembro. No ano\nseguinte, porém, ingressou no Partido Trabalhista Brasileiro (PTB), sob\ncuja legenda foi eleito deputado federal, em outubro de 1990, assumindo\no mandato em fevereiro do 1991. Imediatamente, deixou o PTB, passando a\nfazer parte das fileiras do Partido Trabalhista Renovador (PTR).\n\nVice-líder do PTR, foi titular das comissões de Viação e Transportes, de\nDesenvolvimento Urbano e Interior, de Finanças e Tributação, e da\nComissão Mista de Planos, Orçamentos Públicos e Fiscalização. Como\nsuplente, participou da Comissão de Educação, Cultura e Desporto.\n\nNa sessão que a Câmara dos Deputados realizou a 29 de setembro de 1992,\nvotou a favor do *impeachment* do presidente Fernando Collor de Melo,\nacusado de crime de responsabilidade por ligações com um esquema de\ncorrupção liderado pelo ex-tesoureiro de sua campanha presidencial,\nPaulo César Farias. Afastado da presidência logo após a votação, Collor\nrenunciou ao mandato em 29 de dezembro de 1992, pouco antes da conclusão\ndo processo pelo Senado Federal. Em conseqüência, o vice Itamar Franco\nfoi efetivado na função que já vinha exercendo interinamente desde 2 de\noutubro.\n\nEm 1993, Carlos Camurça migrou para o Partido Progressista (PP). Foi sob\nesta legenda que exerceu a vice-presidência da Comissão de Minas e\nEnergia, e participou, como membro titular, da Comissão de\nDesenvolvimento Urbano e Interior e da comissão parlamentar de inquérito\n(CPI) acerca de grupos de extermínio e assassinos de aluguel nas regiões\nCentro-Oeste e Norte do país.\n\nNas principais matérias constitucionais apresentadas à Câmara dos\nDeputados, de 1991 a 1995, votou a favor da criação do Imposto\nProvisório sobre Movimentação Financeira (IPMF), fonte complementar de\nrecursos para a Saúde, e do Fundo Social de Emergência (FSE), que\npermitia ao governo gastar 20% dos recursos vinculados às áreas de Saúde\ne Educação. Na votação do projeto que previa a extinção do\nvoto****obrigatório, ausentou-se.\n\nNo pleito de outubro de 1994 foi reeleito deputado federal na legenda do\nPP de Rondônia, obtendo a maioria dos votos de bases eleitorais situadas\nna capital do estado. Em agosto do ano seguinte, devido à criação do\nPartido Progressista Brasileiro (PPB), resultado da fusão do PP com o\nPartido Progressista Reformador (PPR), trocou de legenda mais uma vez.\nNessa legislatura, foi titular da Comissão de Minas e Energia.\n\nNas votações das emendas constitucionais propostas pelo governo Fernando\nHenrique Cardoso, em 1995, votou a favor da quebra dos monopólios na\ndistribuição de gás canalizado, nos setores de telecomunicações e na\nexploração de petróleo; da abertura da navegação de cabotagem às\nnavegações estrangeiras e da mudança no conceito de empresa nacional.\n\nNo pleito de outubro de 1996, tendo-se coligado o Partido Democrático\nTrabalhista (PDT) e o PPB, candidatou-se a vice-prefeito de Porto Velho,\nna chapa vitoriosa de Francisco Chiquilito Erse, assumindo o cargo em 1º\nde janeiro de 1997. Na Câmara dos Deputados, sua vaga foi ocupada pelo\nsuplente Moisés Bennesby, do Partido Liberal (PL).\n\nEm 1998, quando Chiquilito Erse afastou-se do cargo para tratamento de\nsaúde, Carlinhos Camurça assumiu a prefeitura até o fim do mandato, em\n2000. Já em junho de 1999, porém, o Ministério Público de Rondônia moveu\numa ação civil pública contra Carlos Camurça, alegando que este havia\nofendido princípios da administração pública ao vincular seu nome às\nobras e serviços realizados em Porto Velho. Em vários locais da cidade,\nobras públicas ou veículos pertencentes ao município foram afixados os\ndizeres “Construindo a Capital”. Para o Ministério Público, os dois “C”\nda frase faziam expressa menção às iniciais do nome de Carlos Camurça,\nde maneira a identificar determinada obra, serviço, ato ou programa\npúblico com a sua gestão na prefeitura.\n\nCamurça se reelegeu prefeito da capital rondoniense no 1º turno das\neleições de 2000, na legenda do PDT, com 40,4% dos votos válidos,\niniciando nova gestão em 1º de janeiro do ano seguinte. Em 2003,\ncontudo, foi condenado na Justiça de Rondônia por ato de improbidade\nadministrativa e obrigado a reparar danos causados ao erário, além de\npagar multa correspondente em 4 vezes o valor de sua remuneração. Carlos\nCamurça entrou com recurso contra a decisão judicial, alegando\nilegitimidade do Ministério Público para propor a ação, mas o Superior\nTribunal de Justiça (STJ) rejeitou o seu recurso.\n\nNas eleições municipais de 2004, tentou fazer o seu sucessor, o\ncandidato Mauro Nazif, do Partido Socialista Brasileiro (PSB), mas ambos\nacabaram derrotados por Roberto Sobrinho, do Partido dos Trabalhadores\n(PT). Camurça entrou então nas fileiras do PSB, em 2005, partido pelo\nqual disputou as eleições do ano seguinte para o governo do estado de\nRondônia. O projeto não deu certo, contudo, e Camurça foi derrotado por\nIvo Cassol, do Partido Popular Socialista (PPS), que obteve 54,13% dos\nvotos válidos ainda no 1º turno.\n\nEm 2008, Carlos Camurça foi condenado pelo Tribunal de Contas da União\n(TCU) a devolver R\\$259.803,41 aos cofres públicos, sob acusação de ter\nusado recursos do Fundo Partidário do extinto Partido Progressista\nBrasileiro (PPB), atual PP, durante o período em que esteve na\npresidência do partido, para consertar seus veículos particulares e\nalugar carros de uma empresa “fantasma”. Além desse montante o TCU fixou\nmulta no valor de R\\$25 mil. Segundo o relatório do TCU, a gestão de\nCamurça no comando do PPB foi marcada pela falta de escrituração\ncontábil e pelo uso indevido dos recursos do fundo partidário.\n\nComerciante e empresário, tornou-se dono de uma revendedora de veículos.\n\nTeve dois filhos.\n\nFONTES: CÂM. DEP. *Deputados brasileiros. Repertório*(1995-1999); *Folha\nde S. Paulo*(18/9/94, 31/1/95, 14/1 e 16/10/96); *Jornal do Brasil*\n(4/6, 11/12/96); *Perfil Parlamentar*/*IstoÉ* (1991); *Rondoniagora. com\n– jornalismo em tempo real*(17/4/2008; disponível em:\nhttp://www.rondoniagora.com/web/ra/press.asp?data=17/4/2008&cod=17837;\nacessado em: 21/9/2009);  SUPERIOR TRIBUNAL DE JUSTIÇA (28/05/2003;\ndisponível em:\nhttp://www.stj.gov.br/portal\\_stj/publicacao/engine.wsp?tmp.area=368&tmp.texto=72590;\nacessado em: 21/09/2009); TRIBUNAL SUPERIOR ELEITORAL. *Resultado das\neleições.*(Disponível em: http://www.tse.gov.br/internet/eleicoes/;\nacessado em: 21/9/2009).\n\n \n","ref":"FONTES: CÂM. DEP. *Deputados brasileiros. Repertório*(1995-1999); *Folha\nde S. Paulo*(18/9/94, 31/1/95, 14/1 e 16/10/96); *Jornal do Brasil*\n(4/6, 11/12/96); *Perfil Parlamentar*/*IstoÉ* (1991); *Rondoniagora. com\n– jornalismo em tempo real*(17/4/2008; disponível em:\nhttp://www.rondoniagora.com/web/ra/press.asp?data=17/4/2008&cod=17837;\nacessado em: 21/9/2009);  SUPERIOR TRIBUNAL DE JUSTIÇA (28/05/2003;\ndisponível em:\nhttp://www.stj.gov.br/portal\\_stj/publicacao/engine.wsp?tmp.area=368&tmp.texto=72590;\nacessado em: 21/09/2009); TRIBUNAL SUPERIOR ELEITORAL. *Resultado das\neleições.*(Disponível em: http://www.tse.gov.br/internet/eleicoes/;\nacessado em: 21/9/2009).\n\n \n","dic":"DHBB"}
