{"title":"CAÓ","cargoss":["Deputado federal","Deputado federal","Constituinte"],"cargos_esp":[0,0,0],"datas_ini":[1987,1983,1987],"datas_fim":[1991,1983,1988],"estados":["RJ","RJ",0],"autor":["Eneida Lima"],"content":"**CAÓ**\n\n\\*jornalista; dep. fed. RJ 1983 e 1987-1991; const. 1987-1988.\n\n* *\n\n*Carlos Alberto Caó Oliveira dos Santos* (assim registrado no início da\ndécada de 1980, por razões de identificação política, em substituição ao\nnome natal, Carlos Alberto Oliveira dos Santos) nasceu em Salvador no\ndia 24 de novembro de 1941, filho de Temístocles Oliveira dos Santos e\nde Martinha Oliveira dos Santos.\n\nIniciou sua trajetória política aos 15 anos de idade na cidade natal,\nquando tornou-se secretário da Associação de Moradores do Bairro da\nFederação, cargo que exerceu de 1956 a 1959. Atuando também no movimento\nestudantil, de 1958 a 1959 foi vice-presidente do Centro Acadêmico Rui\nBarbosa, do Colégio Estadual da Bahia. Em 1960, ingressou na Faculdade\nde Direito da Universidade Federal da Bahia (Ufba) e, em 1962, foi\neleito vice-presidente de intercâmbio internacional da União Nacional\ndos Estudantes (UNE). Em 1963, no desempenho desta função, foi um dos\norganizadores do I Seminário Internacional dos Estudantes do Mundo\nSubdesenvolvido, realizado em Salvador. No segundo semestre daquele ano,\nassumiu a presidência da União dos Estudantes da Bahia (UEB), cargo que\nexerceu até a vitória do movimento político-militar de 31 de março de\n1964 que derrubou o presidente da República, João Goulart.\n\nPerseguido pelo regime militar instalado no país, Caó refugiou-se no Rio\nde Janeiro, onde passou a exercer a profissão de jornalista. Foi redator\ne editor político no jornal *Luta Democrática* até 1966, quando\nempregou-se na *Tribuna da Imprensa*, de onde viria a se licenciar em\n1968. Também trabalhou como tradutor na Editora Civilização Brasileira.\nAinda em 1966, retomou o curso de direito, transferindo-se para a\nFaculdade de Direito da Universidade Federal do Rio de Janeiro (UFRJ),\nonde, no ano seguinte, diplomou-se bacharel em ciências jurídicas. Em\nseguida, nesta mesma instituição, fez o curso de extensão em direito\ntributário e, em 1967, o curso de extensão em ciência política e\nadministração da Escola Brasileira de Administração Pública (EBAP) da\nFundação Getulio Vargas (FGV).\n\nA partir de 1968, ainda no Rio de Janeiro, trabalhou em *O Jornal* e na\nTV Tupi, também como redator e editor político. Foi um dos fundadores e\nprimeiro secretário-geral do Clube dos Repórteres Políticos, entidade\ncriada para enfrentar a censura imposta pelo regime militar.\n\nEm função das suas atividades no movimento estudantil, respondeu a\ninquéritos policiais militares. Em fevereiro de 1970, foi submetido a\njulgamento na 6ª Região Militar, em Salvador, sendo condenado a dois\nanos de prisão. Permaneceu preso nesta cidade por seis meses e 15 dias,\ntendo sido libertado por decisão do Superior Tribunal Militar (STM), que\nconsiderou a pena prescrita.\n\nLogo que foi libertado, retornou ao Rio de Janeiro. Demitido da TV Tupi\ndesde o seu julgamento, continuou a trabalhar como jornalista, tendo\nsido forçado, contudo, a abandonar a área política. Assim, transferiu-se\npara a reportagem econômica, indo trabalhar no*Jornal do Brasil* e, em\n1974, na revista *Veja*. Para escapar do rígido controle exercido pelo\nregime militar sobre o noticiário econômico, organizou com um grupo de\njornalistas, no início dos anos 1970, a Associação dos Jornalistas de\nEconomia e Finanças (AJEF), tendo presidido a entidade no biênio\n1975-1976.\n\nEnvolvido com a atividade sindical, em julho de 1978 elegeu-se\npresidente do Sindicato dos Jornalistas Profissionais do Rio de Janeiro,\nsendo reeleito em 1981, ano em que, a convite de Leonel Brizola,\nfiliou-se ao Partido Democrático Trabalhista (PDT). Disputou as eleições\nde novembro de 1982, obtendo a segunda suplência do PDT na Câmara dos\nDeputados. Assumiu o mandato parlamentar em março de 1983,\nlicenciando-se, no mesmo mês, para exercer o cargo de secretário de\nTrabalho e Habitação do primeiro governo Brizola no Rio de Janeiro\n(1983-1987). À frente da pasta, foi responsável pela implementação do\nprograma Cada família, um lote — uma política habitacional alternativa à\ndo Banco Nacional de Habitação (BNH) e dirigida às classes menos\nfavorecidas — e pela instalação de um plano inclinado nas favelas do\nPavão, Pavãozinho e Cantagalo, no Rio de Janeiro. Permaneceu no cargo\naté 1986, quando foi novamente suplente na eleição para deputado federal\nconstituinte, em novembro. Ainda em 1986, passou a integrar o diretório\nnacional do PDT.\n\nRetornou à Câmara em janeiro de 1987, antes do início dos trabalhos da\nAssembléia Nacional Constituinte, em virtude da morte do deputado Giulio\nCaruso. Empossado como constituinte em fevereiro seguinte, foi um dos\npoucos parlamentares negros a participar da elaboração da nova\nConstituição, consagrando-se pela aprovação da emenda Caó,\nposteriormente regulamentada pela Lei Caó, que tornou a prática do\nracismo crime inafiançável e imprescritível, sujeito à pena de reclusão.\nAlém desta, conseguiu incorporar aproximadamente mais 60 emendas à nova\nCarta. O direito de voto para cabos e soldados, a democratização dos\nmeios de comunicação, a definição da ruptura da legalidade democrática\ncomo crime imprescritível e o amplo exercício do direito de greve foram\nalguns de seus projetos de lei homologados.\n\nParticipou dos trabalhos de elaboração da nova Constituição como titular\nda Subcomissão do Poder Executivo, da Comissão da Organização dos\nPoderes e Sistema de Governo; e, como suplente, da Subcomissão de\nTributos, Participação e Distribuição das Receitas, da Comissão do\nSistema Tributário, Orçamento e Finanças.\n\nNas principais votações da Constituinte, pronunciou-se a favor do\nrompimento de relações diplomáticas com países de orientação racista, da\nlimitação do direito da propriedade privada, do mandado de segurança\ncoletivo, da legalização do aborto, da remuneração 50% superior para o\ntrabalho extra, da jornada semanal de 40 horas, do turno ininterrupto de\nseis horas, do aviso prévio proporcional, da unicidade sindical, da\nsoberania popular, do presidencialismo, da nacionalização do subsolo, da\nestatização do sistema financeiro, do limite de 12% ao ano para os juros\nreais, da proibição do comércio de sangue, da limitação dos encargos da\ndívida externa, da criação de um fundo de apoio à reforma agrária, da\nanistia aos micro e pequenos empresários, da legalização do jogo do\nbicho, da desapropriação da propriedade produtiva e da estabilidade no\nemprego. Votou contra a pena de morte e o mandato de cinco anos para o\npresidente José Sarney.\n\nCom o fim dos trabalhos constituintes em outubro de 1988, assumiu, no\nano seguinte, a presidência da Comissão de Trabalho da Câmara,\ncoordenando a elaboração da primeira legislação salarial sob a\nresponsabilidade do Congresso Nacional. Ainda em 1989, obteve a\naprovação do Congresso para a concessão a Nelson Mandela, líder negro\nsul-africano que se destacara na luta contra o *apartheid*, da comenda\nGrande Colar — honraria concedida pelo Legislativo a estadistas e\npersonalidades que se destacaram na defesa dos direitos humanos. Em\njunho de 1990, chefiou a primeira missão parlamentar brasileira à África\ndo Sul, quando Mandela e sua esposa Winnie Mandela foram convidados a\nvisitar o Brasil. Ainda nesse ano, foi eleito primeiro-vice-presidente\nda Comissão de Trabalho Administrativo e Serviços Públicos, denominação\nrecebida pela Comissão de Trabalho após a incorporação de novas funções.\n\nCandidato à reeleição no pleito de outubro de 1990, não foi\nbem-sucedido, deixando a Câmara dos Deputados em janeiro de 1991, ao\nfinal de seu mandato.\n\nCom o retorno de Leonel Brizola, em março de 1991, ao governo estadual\ndo Rio de Janeiro, foi convidado a ocupar mais uma vez a Secretaria de\nTrabalho e Ação Social do estado. No exercício deste cargo, foi\nresponsável pela restruturação do Sistema Nacional de Emprego do Rio de\nJaneiro (Sine-RJ). Na condição de presidente do Fórum Nacional de\nSecretários de Trabalho (Fonset), participou da coordenação da segunda\nfase da “Ação da cidadania contra a fome e a miséria e pela vida”,\ncomandada pelo sociólogo Herbert de Sousa, o “Betinho”.\n\nEm abril de 1994, Caó desincompatibilizou-se do cargo de secretário para\ncandidatar-se ao Senado no pleito de outubro. Com setecentos mil votos,\nfoi derrotado pelos candidatos Benedita da Silva, do Partido dos\nTrabalhadores (PT), e Artur da Távola, do Partido da Social Democracia\nBrasileira (PSDB). Em 1996, tornou-se secretário-executivo dos\nmovimentos partidários do diretório nacional do PDT. Candidato à Câmara\ndos Deputados no pleito de outubro de 1998, mais uma vez não obteve\nsucesso. Voltou a concorrer a deputado federal nas eleições de outubro\nde 2002, novamente não foi bem-sucedido. \n\nViúvo, foi casado com Teresa Maria Sarno de Oliveira, com quem teve dois\nfilhos.\n\nEneida Lima\n\nFONTES: ASSEMB. NAC. CONST. *Repertório*(1987);**CÂM. DEP. *Deputados\nbrasileiros. Repertório*(1983-1987, 1987-1991); COELHO, J. & OLIVEIRA,\nA. *Nova*; CURRIC. BIOG.; *Globo*(7/10/98); INF. DIRETÓRIO REGIONAL\nPDT/RJ; *Jornal do PDT* (9/98);**TRIB. SUP. ELEIT. Internet**(1998,\n2002).\n\n \n","ref":"FONTES: ASSEMB. NAC. CONST. *Repertório*(1987);**CÂM. DEP. *Deputados\nbrasileiros. Repertório*(1983-1987, 1987-1991); COELHO, J. & OLIVEIRA,\nA. *Nova*; CURRIC. BIOG.; *Globo*(7/10/98); INF. DIRETÓRIO REGIONAL\nPDT/RJ; *Jornal do PDT* (9/98);**TRIB. SUP. ELEIT. Internet**(1998,\n2002).\n\n \n","dic":"DHBB"}
