{"title":"ABRAMO, Marcos","cargoss":["Deputado federal"],"cargos_esp":[0],"datas_ini":[2003],"datas_fim":[2007],"estados":["SP"],"autor":["Harriete Tedeschi"],"content":"**ABRAMO, Marcos**\n\n\\*dep. fed. SP 2003-2007.\n\n*Marcos Roberto Abramo* nasceu em Porto Ferreira (SP) no dia\n22 de dezembro de 1969, filho de José Carlos Abramo e de Sebastiana\nLígia Piruzeli. Seu irmão, Gilberto Aparecido Abramo, bispo da Igreja\nUniversal do Reino de Deus, foi eleito deputado estadual em Minas Gerais\nem 2002 e 2006.\n\nEstudou teologia no Instituto Ecumênico de Ensino Superior (IEES), em\nSão Paulo, bacharelando-se em 2001. Nas eleições de 2002, candidatou-se\na deputado federal por São Paulo na legenda do Partido da Frente Liberal\n(PFL) com o nome de Marcos Abraão. Eleito, assumiu o mandato em\nfevereiro de 2003, passando a fazer parte da bancada evangélica. Em 15\nde abril voltou a usar o nome original, Marcos Abramo. Em maio de 2006,\nquando a Polícia Federal e o Ministério Público Federal denunciaram o\nchamado “escândalo das sanguessugas” – esquema de desvio de dinheiro\npúblico para a compra de ambulâncias a preços superfaturados –, teve seu\nnome incluído entre os parlamentares que teriam apresentado emendas ao\norçamento com tal finalidade. Em meio às denúncias de envolvimento,\ndesistiu de candidatar-se à reeleição. Concluiu o mandato em janeiro de\n2007 e migrou para a capital do Espírito Santo, onde assumiu um posto na\nIgreja Universal do Reino de Deus.\n\nEntre os anos de 2002 e 2008, pertenceu sucessivamente ao PFL, ao\nPartido Progressista (PP) e ao Partido Republicano Brasileiro (PRB).\nNessa última legenda disputou uma cadeira na Câmara de Vereadores de\nVitória em 2008, novamente com o nome de Marcos Abraão, mas não foi\neleito.\n\n*Harriete Tedeschi*\n\nFONTES:\n\n[http://www.tse.gov.br/internet/eleicoes/estatistica2008/est\\_result/pesquisaNominal.htm](http://www.tse.gov.br/internet/eleicoes/estatistica2008/est_result/pesquisaNominal.htm)\n\n[http://www.folhadecontagem.com.br/site/modules.php?name=News&file=article&sid=1624](http://www.folhadecontagem.com.br/site/modules.php?name=News&file=article&sid=1624)\n\n[http://www1.folha.uol.com.br/folha/brasil/ult96u78512.shtml](http://www1.folha.uol.com.br/folha/brasil/ult96u78512.shtml)\n\n[http://www.seade.gov.br/produtos/eleicoes/candidatos/index.php?page=pol\\_det&cand=13782252870](http://www.seade.gov.br/produtos/eleicoes/candidatos/index.php?page=pol_det&cand=13782252870)\n\n[http://www2.camara.gov.br/](http://www2.camara.gov.br/)\n","ref":"FONTES:\n\n[http://www.tse.gov.br/internet/eleicoes/estatistica2008/est\\_result/pesquisaNominal.htm](http://www.tse.gov.br/internet/eleicoes/estatistica2008/est_result/pesquisaNominal.htm)\n\n[http://www.folhadecontagem.com.br/site/modules.php?name=News&file=article&sid=1624](http://www.folhadecontagem.com.br/site/modules.php?name=News&file=article&sid=1624)\n\n[http://www1.folha.uol.com.br/folha/brasil/ult96u78512.shtml](http://www1.folha.uol.com.br/folha/brasil/ult96u78512.shtml)\n\n[http://www.seade.gov.br/produtos/eleicoes/candidatos/index.php?page=pol\\_det&cand=13782252870](http://www.seade.gov.br/produtos/eleicoes/candidatos/index.php?page=pol_det&cand=13782252870)\n\n[http://www2.camara.gov.br/](http://www2.camara.gov.br/)\n","dic":"DHBB"}
