{"title":"CARDOSO, Hunald Santaflor","cargoss":["Interventor"],"cargos_esp":[0],"datas_ini":[1945],"datas_fim":[1946],"estados":["SE"],"autor":[0],"content":"**CARDOSO, Hunald Santaflor**\n\n\\* interv. SE 1945-1946.\n\n \n\n* *\n\n*Hunald Santaflor Cardoso* nasceu em Aracaju no dia 2 de setembro de\n1894, filho do professor e deputado estadual Brício Cardoso e de Mirena\nCardoso. Seu irmão Maurício Graco Cardoso foi deputado federal pelo\nCeará de 1906 a 1911 e por Sergipe de 1921 a 1922, de 1927 a 1930 e de\n1946 a 1950, senador e presidente desse estado de 1922 a 1926. Seu tio\nFausto Cardoso, deputado federal por Sergipe de 1900 a 1902 e em 1906,\nmorreu assassinado por soldados do Exército durante um movimento\nrevolucionário contra o governo estadual.\n\nFez os estudos iniciais no Ateneu Sergipense, em sua cidade natal,\nconcluindo-os no Colégio Vieira, em Fortaleza. Após ingressar na\nFaculdade de Direito do Ceará em 1912, no ano seguinte transferiu-se\npara a Faculdade de Direito de Porto Alegre, por onde se bacharelou em\n1918.\n\nIniciou sua vida profissional como promotor em Cachoeira (RS), mas ainda\nem 1919 retornou a Aracaju, exercendo as mesmas funções. Nomeado no ano\nseguinte inspetor fiscal do Liceu Alagoano e chefe de polícia de\nSergipe, em 1921 tornou-se inspetor fiscal do Ateneu Sergipense e\nconsultor jurídico desse estado. Em outubro de 1922, durante a\npresidência de seu irmão, foi designado secretário-geral do governo\nsergipano, sendo exonerado do cargo em agosto de 1923 por ter aceito a\ndireção do Banco Estadual de Sergipe. Nesse mesmo ano elegeu-se deputado\nestadual e em 1925 foi escolhido prefeito de Aracaju. Em 1926, foi\nprofessor de direito comercial da Escola de Comércio Conselheiro\nOrlando. Concluiu o mandato na Assembléia em 1928 e em 1934 foi nomeado\nprocurador-geral do estado. No ano seguinte, tornou-se desembargador do\nTribunal de Justiça de Sergipe. Em 1943, tornou-se corregedor-geral da\nJustiça e dois anos depois ocupou a presidência do Tribunal de Justiça\nde Sergipe.\n\nCom a deposição de Getúlio Vargas em 29 de outubro de 1945 e a posse de\nJosé Linhares, presidente do Supremo Tribunal Federal (STF), na\npresidência da República, todos os interventores federais nos estados\nforam substituídos pelos presidentes dos tribunais de Justiça. Exercendo\nna época essa função em seu estado, Hunald Cardoso assumiu o governo de\nSergipe em novembro e presidiu as eleições realizadas no mês seguinte.\nDurante sua gestão, reajustou os vencimentos da magistratura, reintegrou\nfuncionários, abriu créditos para cumprimento de decisões judiciais,\npromoveu oficiais e baixou decretos dispondo sobre a aposentadoria de\nserventuários da Justiça não remunerados pelo estado. Chamado pela\noposição de “ditador togado” transmitiu o governo ao coronel Antônio de\nFreitas Brandão, nomeado interventor em março de 1946 pelo presidente\nEurico Dutra.\n\nPresidente do Tribunal Regional Eleitoral entre 1946 e 1948, cargo que\nocuparia novamente de 1952 a 1956. Voltou a presidir o Tribunal de\nJustiça do Estado de Sergipe de 1948 a 1950, em 1951 e de 1953 a 1957.\nAposentou-se compulsoriamente na presidência do Tribunal de Justiça de\nSergipe, em 1964. Em seguida dedicou-se ao exercício da advocacia até\n1970.\n\nFoi também catedrático de direito civil na Faculdade de Direito desse\nestado. Foi ainda membro da Academia Sergipense de Letras, do Instituto\nHistórico e Geográfico de Sergipe e da Associação Sergipense de\nImprensa.\n\nFaleceu em Aracaju no dia 24 de junho de 1973.\n\nEra casado com Maria José de Melo Góis, com quem teve três filhas.\n\nEntre outras obras, publicou *A mulher gaúcha* (1917), *O senhor de\nengenho* (1917), *Provimentos e diretrizes*; *Testemunhas do coração*;\n*Tobias*, *sol sem eclipses*; *Martinho Garcez, o Demóstenes sergipano*;\n*O nobile officium do Poder Judicial*; *A Constituição de 10 de novembro\nde 1937* e *Curso de direito penal*.\n\n \n\nFONTES: ARQ. PÚBL. EST. SE; CURRIC. BIOG.; *Encic. Mirador*; GUARANÁ, M.\n*Dic*. *internacional*; SILVA, R. *Bacharéis*; SOC. BRAS. EXPANSÃO\nCOMERCIAL. *Quem*; WYNNE, J. *História*.\n\n \n","ref":"FONTES: ARQ. PÚBL. EST. SE; CURRIC. BIOG.; *Encic. Mirador*; GUARANÁ, M.\n*Dic*. *internacional*; SILVA, R. *Bacharéis*; SOC. BRAS. EXPANSÃO\nCOMERCIAL. *Quem*; WYNNE, J. *História*.\n\n \n","dic":"DHBB"}
