{"title":"AVELINO, Igor","cargoss":["Deputado federal"],"cargos_esp":[0],"datas_ini":[1999],"datas_fim":[2003],"estados":["TO"],"autor":[0],"content":"**AVELINO, Igor**\n\n\\*dep. fed. TO 1999-2003.\n\n*Igor Avelino Pugliesi* nasceu em Goiânia no dia 20 de novembro de 1971,\nfilho de Moisés Nogueira Avelino e de Virgínia Constância Pugliesi\nAvelino. Seu pai, deputado federal de 1989 a 1991 e governador de\nTocantins de 1991 a 1995, voltou à Câmara dos Deputados em 2007.\n\nEm 1988, tornou-se assessor parlamentar na Câmara dos Deputados, em\nBrasília. Em 1992 filiou-se ao mesmo partido de seu pai, o Partido do\nMovimento Democrático Brasileiro (PMDB), e assumiu a presidência do\ndiretório estadual em Tocantins. Entre 1992 e 1994 trabalhou diretamente\ncom o pai, então governador, como seu secretário particular e depois\nchefe de gabinete, em Palmas. Em 1995 formou-se em turismo e em\npublicidade e propaganda pelo Instituto Superior de Educação de Brasília\n(IESB). No período 1995-1997 foi diretor da Tapajós Veículos, empresa de\npropriedade de sua família. Em 1998, fez o curso de relações públicas e\nrecursos humanos oferecido pelo Serviço Brasileiro de Apoio às Micro e\nPequenas Empresas (Sebrae), em Palmas.\n\nEm outubro de 1998, foi eleito deputado federal por Tocantins na legenda\ndo PMDB. Assumiu o mandato em fevereiro de 1999, e de 2001 a 2002\nreassumiu a presidência do diretório do PMDB em Tocantins. Também em\n2001 participou do I Simpósio Multidisciplinar de Turismo Sustentável do\nDistrito Federal, foi representante da Câmara dos Deputados em viagem a\nBerlim, para manter contatos oficiais, e a Madri, a convite do\nparlamento espanhol. Durante a legislatura, foi segundo vice-presidente\nda Comissão de Constituição, Justiça e de Redação, membro titular das\ncomissões Representativa do Congresso Nacional, de Agricultura e\nPolítica Rural, de Direitos Humanos e de Viação e Transportes, e\nsuplente das comissões da Amazônia e Desenvolvimento Regional, e de\nRelações Exteriores e de Defesa Nacional. Participou ainda de várias\ncomissões especiais e da comissão parlamentar de inquérito (CPI) sobre a\natuação da Fundação Nacional do Índio (Funai). Deixou a Câmara ao final\nda legislatura, em janeiro de 2003.\n\n \n\nFONTES: *Site* da Câmara dos Deputados (www.camara.gov.br); *Site*\n(www.eleicoes.uol.com.br).\n","ref":"FONTES: *Site* da Câmara dos Deputados (www.camara.gov.br); *Site*\n(www.eleicoes.uol.com.br).\n","dic":"DHBB"}
