{"title":"CARDOSO, Oscar ==============","cargoss":["Deputado federal"],"cargos_esp":[0],"datas_ini":[1963],"datas_fim":[1971],"estados":["BA"],"autor":[0],"content":"CARDOSO, Oscar\n==============\n\n\\*dep. fed. BA 1963-1971.\n\n \n\n*Oscar Cardoso da Silva*nasceu em Uauá (BA) no dia 19 de novembro de\n1913, filho de Olímpio Joaquim Cardoso e de Oliva Maria da Silva\nCardoso.\n\nFormou-se pela Faculdade de Medicina da Universidade da Bahia em 1939. \nPecuarista, foi também fiscal de ensino no estado antes de se eleger\nvereador à Câmara Municipal de Jequitinhonha (MG), onde exerceu o\nmandato de 1947 a 1950.\n\nEm outubro de 1950, elegeu-se deputado à Assembléia Legislativa da Bahia\nna legenda da União Democrática Nacional (UDN), as­sumindo o mandato em\nfevereiro de 1951. Ter­ceiro-secretário da Assembléia entre 1951 e 1952,\nreelegeu-se em 1954.  Segundo-secretá­rio de 1955 a 1956, tornou a\neleger-se em 1958, permanecendo na Assembléia Legislati­va baiana de\n1951 a 1963. Nesses 12 anos, integrou as comissões de Finanças, de\nOrça­mento, de Agricultura e de Saúde. Foi ainda vice-presidente do\ndiretório regional baiano da UDN de 1960 a 1962.\n\nNo pleito de outubro desse ano, elegeu-se deputado federal pela Bahia na\nlegenda da UDN, deixando a Assembléia em janeiro de 1963 para assumir,\nno mês seguinte, uma ca­deira na Câmara dos Deputados. Com a extin­ção\ndos partidos políticos pelo Ato Institucio­nal nº. 2 (27/10/1965) e a\nposterior instaura­ção do bipartidarismo, filiou-se à Aliança\nRe­novadora Nacional (Arena), agremiação de apoio ao regime militar\ninstalado no país em abril de 1964, em cuja legenda reelegeu-se em\nnovembro de 1966. Durante os dois mandatos federais, integrou as\ncomissões de Finanças, do Polígono das Secas e da Bacia do São Francisco\nda Câmara, além de ter pre­sidido a Comissão Parlamentar de Inquérito\nsobre a atuação do Departamento Nacional de Obras Contra as Secas\n(DNOCS) na Bahia.\n\nCandidatou-se a nova reeleição em novem­bro de 1970, conseguindo apenas\numa suplên­cia. Assim, deixou a Câmara em janeiro de 1971, ao final da\nlegislatura. Voltou a disputar uma cadeira de deputado federal pela\nlegenda da Arena em novembro de 1974 e de 1978, nas duas oportunidades\nnão foi bem sucedido. Com  a extinção do bipartidarismo em novembro de\n1979 e a posterior reorganização partidária, filiou-se ao Partido\nDemocrático Social (PDS), agremiação que deu continuidade à orientação\nda Arena. Pelo seu novo partido, disputou uma cadeira na Assembléia\nLegislativa baiana, mas não se elegeu. Assessor da Casa Civil durante o\ngoverno de João Durval Carneiro entre 1983 e 1987, nesse último ano\naposentou-se pelo Instituto de Previdência dos Congressistas.\n\nCasou-se com Jandira Martins Cardoso, com quem teve sete filhos.\n\n \n\nFONTES: CÂM. DEP. *Deputados;*CÂM. DEP. *Deputados brasileiros. \nRepertório*(1963-1967 e 1967-1971); INF. BIOG.; TRIB. SUP. ELEIT. \n*Dados*(2, 3, 4, 6, 8 e 9).\n","ref":"FONTES: CÂM. DEP. *Deputados;*CÂM. DEP. *Deputados brasileiros. \nRepertório*(1963-1967 e 1967-1971); INF. BIOG.; TRIB. SUP. ELEIT. \n*Dados*(2, 3, 4, 6, 8 e 9).\n","dic":"DHBB"}
