{"title":"CAMBRAIA, Antonio","cargoss":["Deputado federal"],"cargos_esp":[0],"datas_ini":[1999],"datas_fim":[2007],"estados":["CE"],"autor":["Luciana Pinheiro"],"content":"**CAMBRAIA, Antonio**\n\n\\* dep. fed. CE 1999-2007\n\n*Antonio Elbano Cambraia* nasceu em Senador Pompeu (CE),**no dia 1º de\nagosto de 1942, filho de Tertuliano Cambraia de Aquino e Elba Mota de\nAquino.\n\nBacharel em Ciências Econômicas, pela Universidade Federal do Ceará\n(UFC), e em Administração Pública, pela Universidade Estadual do Ceará\n(UECE), licenciou-se em Economia e Mercados, também na UFC. Antes de\ningressar na carreira política, assumiu diferentes funções,\ndesempenhadas em diversas instituições.\n\nNo ano de 1971 tornou-se membro do Conselho Regional de Contabilidade de\nFortaleza. Em 1976 passou a membro do Conselho Regional de Administração\nfortalezense. Nesse mesmo ano iniciou carreira docente, ao ingressar no\nDepartamento de Economia e Contabilidade da UECE, onde atuou como\nprofessor por mais de três décadas. Entre 1977 e 1986 trabalhou no Banco\nNacional de Habitação (BNH), exercendo as funções de economista e de\ngerente de poupança e empréstimo. Em 1987 passou a atuar como gerente\nadjunto do Departamento de Crédito Imobiliário, no Banco do Estado do\nCeará (BEC), permanecendo no cargo até 1990, ano em que assumiu a\nSecretaria Municipal de Finanças da capital cearense, a convite do então\nprefeito Juraci Magalhães (1990-1993).\n\nEm 1992 filiou-se ao Partido do Movimento Democrático Brasileiro (PMDB),\npelo qual se candidatou à prefeitura de Fortaleza nas eleições de\noutubro, sendo eleito com 374.600 votos. Tomou posse do cargo de\nprefeito da capital cearense em 1993. No ano seguinte tornou-se\ncoordenador-geral da Frente Nacional de Prefeitos, permanecendo nessa\nfunção até 1996. No ano seguinte foi escolhido para presidir o Diretório\nMunicipal do PMDB em Fortaleza, por dois anos. No decorrer de 1997\ntransferiu-se para os Estados Unidos, onde atuou como professor\nvisitante na Universidade de IIlinois, até 1998.\n\nDe volta ao Brasil, concorreu nas eleições gerais de outubro de 1998,\ncomo candidato a deputado federal. Nessa ocasião foi votado por 96.976\neleitores, que lhe garantiram a quarta melhor votação do Ceará para a\nCâmara dos Deputados. Tomou posse de seu primeiro mandato como\nparlamentar em fevereiro de 1999, ano em que se filiou ao Partido da\nSocial Democracia Brasileira (PSDB).\n\n Ao longo de 2001 foi membro da Comissão Parlamentar de Inquérito (CPI)\nque investigou a aplicação irregular de recursos do Fundo de\nInvestimento do Nordeste (FINOR). Nesse mesmo ano atuou também como\nmembro titular da comissão especial para proposta de emenda\nconstitucional (PEC), transformada em norma jurídica, para prorrogação\nda vigência da cobrança da Contribuição Provisória sobre Movimentação\nFinanceira (CPMF). Em novembro de 2001 licenciou-se do mandato de\ndeputado federal para assumir a Secretaria de Turismo do Estado do\nCeará, no mandato do governador Ciro Gomes (2001-2004).\n\nRetornou seus trabalhos na Câmara dos Deputados em abril de 2002,  ano\nem que atuou como membro titular da comissão especial para a PEC que\ninstituía o Plano Nacional de Cultura, transformada em emenda\nconstitucional aprovada pelo Congresso. Nas eleições de outubro\ncandidatou-se à reeleição, sendo vitorioso com  82.921 votos. Nesse\nmesmo mês solicitou à Câmara outra licença de seu mandato parlamentar,\npara novamente exercer o cargo de Secretário de Turismo do Estado do\nCeará, permanecendo nessa função até dezembro de 2002.\n\nNo mês de fevereiro de 2003 assumiu seu segundo mandato no Congresso\nNacional. Em agosto, por ocasião da votação da reforma da Previdência na\nCâmara dos Deputados, votou a favor da proposta apresentada pelo Governo\nLuís Inácio Lula da Silva (2003-2007), aprovada em dois turnos no\nCongresso e encaminhada ao Senado Federal. Em dezembro o então\npresidente do Senado, José Sarney (PMDB), promulgou a emenda\nconstitucional que alterou o sistema previdenciário do país,\nespecialmente quanto às regras relativas a aposentadorias e pensões,\nprevidência complementar, paridade entre funcionários públicos ativos e\ninativos, e contribuição de estados e municípios. Ao longo de 2003 atuou\ntambém como membro titular da comissão especial para PEC, transformada\nem emenda constitucional, que visava instituir a reforma tributária.\n\nNo decorrer de 2004, quando foi escolhido vice-líder do PSDB, tornou-se\nmembro da comissão externa criada pelo Congresso para avaliar o estado\nde calamidade pública provocado pelas enchentes em vários estados da\nregião Nordeste. Em outubro, candidatou-se novamente à prefeitura de\n[Fortaleza](http://pt.wikipedia.org/wiki/Fortaleza \"Fortaleza\") e obteve\na quarta colocação no pleito que elegeu, em segundo turno, a candidata\nLuizianne Lins, do Partido dos Trabalhadores (PT), prefeita da capital\ncearense.\n\nEm março de 2005, quando da formação de novas configurações nas\ncomissões permanentes da Câmara dos Deputados, tornou-se terceiro\nvice-presidente e membro titular da comissão de Finanças e Tributação.\nNa mesma ocasião passou a presidir as comissões permanentes de Minas e\nEnergia e de Turismo e Desporto.\n\nEm outubro de 2008 candidatou-se à Câmara dos Vereadores de Fortaleza e\nobteve 6271 votos, que lhe garantiram a condição de suplente.\n\nAo longo de sua trajetória no Congresso Nacional, Antonio Cambraia\npresidiu a comissão mista especial da Crise Energética, atuou como\nmembro das comissões especiais sobre precatórios e sobre assistência\nsocial e foi titular da comissão para PEC, transformada em norma\njurídica, que visava alterar o Sistema Tributário Nacional. Além disso,\nintegrou frentes parlamentares ligadas às questões da defesa da\nuniversidade pública e da agricultura, entre outras, e participou de\ngrupos de trabalho voltados aos temas das micro, pequenas e médias\nempresas e do crédito habitacional.\n\n*Luciana Pinheiro*\n\nFONTES: Portal da Câmara dos Deputados\n([http://www2.camara.gov.br/](http://www2.camara.gov.br/); acessado em\n18/05/2009); Portal Ceará Agora\n([http://www.cearaagora.com/](http://www.cearaagora.com/); acessado em\n18/05/2009); Portal Direito 2 – Notícias de Direito\n([http://www.direito2.com.br/](http://www.direito2.com.br/); acessado em\n18/05/2009); Portal do Tribunal Regional Eleitoral do Ceará\n([http://www.tre-ce.gov.br/](http://www.tre-ce.gov.br/); acessado em\n18/05/2009).\n","ref":"FONTES: Portal da Câmara dos Deputados\n([http://www2.camara.gov.br/](http://www2.camara.gov.br/); acessado em\n18/05/2009); Portal Ceará Agora\n([http://www.cearaagora.com/](http://www.cearaagora.com/); acessado em\n18/05/2009); Portal Direito 2 – Notícias de Direito\n([http://www.direito2.com.br/](http://www.direito2.com.br/); acessado em\n18/05/2009); Portal do Tribunal Regional Eleitoral do Ceará\n([http://www.tre-ce.gov.br/](http://www.tre-ce.gov.br/); acessado em\n18/05/2009).\n","dic":"DHBB"}
