{"title":"CELSO, Pedro","cargoss":["Deputado federal"],"cargos_esp":[0],"datas_ini":[1999],"datas_fim":[2003],"estados":["DF"],"autor":[0],"content":"**CELSO, Pedro**\n\n\\* dep. fed. DF 1999-2003.\n\n \n\n                *Pedro Celso* nasceu em Tiros (MG) no dia 7 de dezembro\nde 1958, filho de Ulisses Alves Pinto e Nazaré Alves de Souza.\n\n                Radicado em Brasília desde 1963, trabalhou como auxiliar\nde almoxarifado do Transporte Coletivo de Brasília (TCB), filiando-se ao\nPartido dos Trabalhadores (PT) em 1980.\n\nEm 1985 assumiu a presidência do Sindicato dos Trabalhadores em\nTransporte Rodoviário. Em 1986 tornou-se membro e secretário de formação\nsindical da Central Única dos Trabalhadores (CUT) nacional, passando a\nintegrar a Executiva da CUT como secretário-geral em 1988. \n\nIniciou sua carreira política como deputado distrital em 1991, exercendo\no cargo de primeiro-secretário da Mesa Diretora da Câmara Legislativa do\nDistrito Federal (CLDF) entre os anos 1991 e 1992, período em que\npresidiu o PT do Distrito Federal. Em 1993, tornou-se membro do\nDiretório Nacional do PT, no qual permaneceria até 1997.\n\nReeleito deputado distrital na legislatura de 1995-1998, licenciou-se da\nCâmara Legislativa em 1995, para ocupar o cargo de Secretário do\nTrabalho, Emprego e Renda do governo de Cristóvão Buarque, no qual\npermaneceria até 1997. Na sua gestão, foi responsável pela implantação\ndo Projeto BRB Trabalho/Banco do Trabalho em 1995, do Projeto Saber, da\nAgência do Trabalhador e do Programa de Desenvolvimento do Artesanato.\nEm 1997, viajou a Washington (EUA) como representante do governo do\nDistrito Federal no Seminário Internacional de Bancos do Povo e\nMicrocrédito. Entre os anos 1995 e 1997 integrou os conselhos de\nPolítica de Pessoal, de Anistia e do Trabalho do Governo do Distrito\nFederal.\n\nNo pleito de outubro de 1998, elegeu-se deputado federal na legenda do\nPT e foi empossado em março de 1999, assumindo a condição de líder do\npartido no governo. Na Câmara, participou das comissões do Trabalho, de\nAdministração e Serviço Público, de Viação e Transportes, de Fixação do\nSalário Mínimo, de Propriedade de Empresas Jornalísticas e de\nRadiodifusão Sonora e de Sons e Imagens, de Idade Mínima para Cargo\nEletivo, de Transportes, do Estatuto do Desporto e no Congresso\nNacional, da Comissão Mista de Planos, Orçamentos Públicos e\nFiscalização e da Comissão Representativa do Congresso Nacional.\n\n                Vice-líder do PT em 1999, foi segundo-vice-presidente e\ntitular da Comissão Externa Morte do Ex-Presidente Juscelino Kubitschek\ne da CPI CBF/NIKE. Em 2000, viajou ao Chile como representante da Câmara\ndos Deputados e membro da Comissão Externa sobre a morte do\nex-Presidente Juscelino Kubitschek, para participar de audiências com\nautoridades chilenas e foi à Lisboa (Portugal) e Milão (Itália), como\nmembro da CPI CBF/NIKE, para participar de diligências.\n\n                Exerceu a vice-liderança do PT até 2002 e em outubro\ndesse ano candidatou-se à reeleição na legenda do PT, não sendo\nbem-sucedido. Derrotado na eleição, em janeiro de 2003 foi convidado\npelo ministro do Planejamento, Guido Mantega, para o cargo de Secretário\nde Patrimônio da União. No entanto, em setembro desse ano foi demitido\npor contrariar orientação do governo na área em que atua. Pedro Celso\nhavia se desincompatibilizado com o ministro das Cidades, Olívio Dutra,\ne com parlamentares de Brasília, por adotar uma política favorável à\nregularização de condomínios urbanos construídos sobre terras da União.\n\n \n\n \n\nFONTES: Câmara Legislativa do Distrito Federal; Câmara dos Deputados;\n*Diário da Manhã*– GO - 06/09/2003.  \n","ref":"FONTES: Câmara Legislativa do Distrito Federal; Câmara dos Deputados;\n*Diário da Manhã*– GO - 06/09/2003.  \n","dic":"DHBB"}
