{"title":"CORUJA, Fernando ","cargoss":["Deputado federal",0],"cargos_esp":[0,0],"datas_ini":[1999,2004],"datas_fim":[2003,0],"estados":["SC",0],"autor":[0],"content":"**CORUJA, Fernando **\n\n\\*dep. fed. SC 1999-2003; 2004-\n\n \n\n*Carlos Fernando Agustini*, conhecido pelo pseudônimo *Fernando\nCoruja,*nasceu em Lages (SC) no dia 4 de dezembro de 1954, filho de\nVitorio Genuino Agustini e de Zilda Pacheco Agustini.\n\nIngressou em 1972 no curso de medicina na Universidade Federal de Santa\nCatarina (UFSC). Dois anos depois, passou a lecionar nos cursos\nprofissionalizantes do Serviço Nacional de Aprendizagem Comercial\n(SENAC) em Florianópolis e na Academia de Comércio de Santa Catarina.\nFormou-se em 1977, e logo após, foi morar no Rio de Janeiro, onde cursou\na residência médica no Instituto Estadual de Diabetes e Endocrinologia\nconcluída em 1980. Nesse ano também fez especializações em\nendocrinologia e em diabetes na Pontifícia Universidade Católica do Rio\nde Janeiro (PUC-Rio).\n\nRegressou à sua cidade natal e, entre 1981 e 1988, trabalhou no Hospital\nNossa Senhora dos Prazeres, tendo sido designado para a direção do\nDepartamento Científico da Associação Catarinense de Medicina. Nesse\nínterim, em 1983, exerceu a função de diretor do departamento de Saúde\nPública da prefeitura de Lages, em que permaneceria até 1988; atuou na\nimplantação do *Programa*****de*****Atenção Integral*****à*****Saúde*;\nintegrou a equipe da Secretaria de Saúde do Estado de Santa Catarina, no\nqual permaneceria até 1986, e foi aprovado para o cargo de médico do\nInstituto Nacional de Assistência Médica e Previdência Social em que\nficaria até 1998. Em 1985 tornou-se professor-colaborador de Química da\nUniversidade do Planalto Catarinense (UNIPLAC) e, no ano seguinte,\nocupou o cargo de médico-legista da Secretaria de Segurança Pública de\nSanta Catarina, que desempenharia até 1998.\n\nRetornou aos bancos universitários em 1986 e iniciou o bacharelado em\ndireito na UNIPLAC, que terminaria em 1993. Durante esse período,\npresidiu o Centro Acadêmico dessa faculdade. Ainda em 1986 fez a\nespecialização em instituições jurídico-políticas na UFSC.\n\nEm 1987, filiou-se ao Partido da Frente Liberal (PFL). No ano seguinte,\nassumiu a função de professor colaborador de Higiene e Puericultura, e\nde professor assistente de Medicina-Legal na UNIPLAC. Em outubro desse\nmesmo ano, disputou com sucesso uma vaga para vereador de Lages na\nlegenda do PFL. Foi líder do PFL de 1989 a 1990.\n\nAinda em 1990, ingressou no curso de ciências sociais na UNIPLAC, porém\nnão chegaria a concluí-lo. No decorrer desse mesmo ano, foi nomeado\nchefe de gabinete da Secretaria de Planejamento de Lajes. No ano\nseguinte, deixou o cargo e fez especialização em administração\nhospitalar na Faculdade São Camilo, em São Paulo. Nesse período, em sua\ncidade natal, foi empossado diretor do Hospital Geral e Maternidade\nTeresa Ramos, função que exerceria até 1992.\n\nEm relação à sua trajetória política, filiou-se ao Partido Democrático\nTrabalhista (PDT) ainda em 1991, tornando-se presidente do diretório\nmunicipal da agremiação. Em outubro de 1992, foi eleito prefeito de\nLages na legenda do PDT. Entre 1995 e 1997, ocupou a segunda\nvice-presidência do diretório estadual do PDT.\n\nMais uma vez voltou aos estudos e em 1996 concluiu a especialização em\ndireito processual na UFSC. Nesse mesmo ano, foi nomeado professor\ntitular de Introdução ao Estudo do Direito, de Direito Constitucional e\nde Ciência Política da UNIPLAC. Em 2001, viria também a concluir o\nmestrado em direito na UFSC.\n\nRetornou à disputa política nas eleições de outubro de 1998, tendo sido\neleito deputado federal pelo estado de Santa Catarina na legenda do PDT.\nAssumiu sua cadeira na Câmara dos Deputados em fevereiro seguinte e\nainda em 1999 foi indicado vice-líder do partido. Entre 2001 e 2003 foi\nvice-líder do bloco parlamentar que reuniu PDT e o Partido Popular\nSocialista (PPS). Reeleito em outubro de 2002. Logo após a posse, em\nfevereiro de 2003, licenciou-se do mandato para assumir a Secretaria de\nSaúde de Santa Catarina, no primeiro governo de Luís Henrique da\nSilveira (2003-2007) e ingressou no PPS. Fernando Coruja voltou ao\nexercício do mandato de deputado federal em abril de 2004 e dois anos\ndepois ocupou a liderança do PPS. No pleito de outubro de 2006, foi\nnovamente reeleito agora na legenda do PPS. Tomou posse de seu novo\nmandato em fevereiro de 2007.\n\n                Durante sua permanência na Câmara dos Deputados,\nparticipou da Comissão de Defesa do Consumidor, Meio Ambiente e\nMinorias; da Comissão de Constituição e Justiça e de Cidadania. Foi\nainda membro da Frente Parlamentar da Saúde e líder da Frente\nParlamentar do Idoso. Foi de sua autoria o projeto de criação do\nEstatuto do Idoso e em 2007 votou contra a prorrogação da Contribuição\nProvisória sobre Movimentação Financeira (CPMF).\n\nNo pleito de outubro de 2008, candidatou-se a prefeito de Lages na\nlegenda do PPS, contudo não obteve êxito.\n\nCasou-se com Ana Cristina de Oliveira Agustini, com quem teve dois\nfilhos.\n\n \n\nFONTES: CÂM.  DEP. *Deputados Brasileiros*(1999-2003), (2003-2007),\n(2007-2011). Site [www.saude.sc.gov.br](http://www.saude.sc.gov.br/);\n*Folha de Blumenau*03/10/2008.\n\n \n","ref":"FONTES: CÂM.  DEP. *Deputados Brasileiros*(1999-2003), (2003-2007),\n(2007-2011). Site [www.saude.sc.gov.br](http://www.saude.sc.gov.br/);\n*Folha de Blumenau*03/10/2008.\n\n \n","dic":"DHBB"}
