{"title":" COSTA, Jorge =============","cargoss":["Deputado federal"],"cargos_esp":[0],"datas_ini":[1999],"datas_fim":[2001],"estados":["PA"],"autor":[0],"content":" COSTA, Jorge\n=============\n\n\\*dep. fed. PA 1999-2001.\n\n*Jorge Neto da Costa* nasceu em Capanema (PA) no dia 3 de setembro de\n1931, filho de Joaquim Rodrigues da Costa e de Rosa Jorge da Costa.\n\nGraduou-se em medicina pela Universidade Federal do Pará (UFPA) em 1960\ne concluiu Residência Médica na Santa Casa de Misericórdia do Pará em\n1962, especializando-se na área de ginecologia e obstetrícia. Foi\nfuncionário da Secretaria de Saúde do Estado do Pará e Diretor do\nHospital Maternidade Povo de Castanhal entre 1964 e 1974. Fundou o\nHospital Dalmázia Pozzi, em Belém, em 1960, e trabalhou nos hospitais\nSão José, em Castanhal (1965-1992), São Joaquim, em Capanema (1972-1992)\ne no Hospital Central de São João de Pirabas, (desde 1997), dos quais\nera  também proprietário.\n\nEm 1992, filiou-se ao Partido do Movimento Democrático Brasileiro\n(PMDB), elegendo-se, no mesmo ano, para a prefeitura do município de\nCapanema, cargo que ocupou até o final do mandato, em 1997. No período\nde 1995 a 1997, ocupou também a presidência do Diretório Municipal do\nPMDB em Capanema e foi delegado do Diretório Regional do PMDB no estado\ndo Pará.\n\nEm 1998, foi eleito deputado federal na legenda do PMDB. Empossado em\nfevereiro de 1999, integrou as Comissões Permanentes Amazônia e de\nDesenvolvimento Regional e Seguridade Social e Família, e as Comissões\nespeciais de Patrimônio genético, de prorrogação da Contribuição\nProvisória sobre Movimentação Financeira (CPMF), e da atuação da\nFundação Nacional do Índio (FUNAI).\n\nEleito mais uma vez para a prefeitura de Capanema no pleito municipal de\n2000, renunciou ao mandato na Câmara em 1º de janeiro de 2001.\n\nFONTES: Portal da Câmara dos Deputados. Disponível em :\n\\<[http://www2.\ncamara.gov.br/deputados](http://www2.%20camara.gov.br/deputados)\\>.\nAcesso em : 25 ago. 2009.\n\n","ref":"FONTES: Portal da Câmara dos Deputados. Disponível em :\n\\<[http://www2.\ncamara.gov.br/deputados](http://www2.%20camara.gov.br/deputados)\\>.\nAcesso em : 25 ago. 2009.\n\n","dic":"DHBB"}
