{"title":"DOUTOR HÉLIO","cargoss":["Deputado federal"],"cargos_esp":[0],"datas_ini":[1999],"datas_fim":[2005],"estados":["SP"],"autor":["Mariana Joffily"],"content":"**DOUTOR HÉLIO**\n\n\\* dep. fed. SP 1999-2005.\n\n \n\n*Hélio de Oliveira Santos*nasceu em Corumbá (MS) no dia 6 de setembro de\n1950, filho de Manuel Belmiro dos Santos e de Dirce de Oliveira.\n\nFormou-se pela Faculdade de Medicina na Universidade de Campinas\n(Unicamp) em 1974. Doutorou-se em cirurgia ambulatorial pediátrica na\nmesma universidade em 1985. Concluiu um pós-doutorado em cirurgia\npediátrica no Children Memorial, em Chicago, nos Estados Unidos, em\n1986, além de participar de inúmeros cursos de atualização e\nespecialização no Brasil e no exterior, notadamente nos Estados Unidos e\nno México. De 1987 a 1989 foi diretor da Faculdade de Ciências Médicas\nda Pontifícia Universidade Católica de Campinas, e em 1988 tornou-se\nprofessor livre-docente da Unicamp.\n\nEnvolveu-se com causas sociais, como a violência contra crianças e\nadolescentes, e foi um dos fundadores em Campinas, em 1985, do Centro\nRegional de Atenção aos Maus Tratos na Infância, do qual veio a\ntornar-se presidente de honra. Também em Campinas foi vice-presidente do\ndiretório municipal do Partido do Movimento Democrático Brasileiro\n(PMDB) em 1989-1990 e presidente no biênio 1991-1992. No ano seguinte,\nassumiu a Secretaria Municipal da Saúde, Bem-Estar e Habitação do\nmunicípio de Hortolândia (SP), na gestão do prefeito Luís Antônio Dias\nda Silva, do PMDB, cargo que ocupou até 1996. Em 1995 transferiu-se para\no Partido Democrático Trabalhista (PDT) e tornou-se presidente do\ndiretório municipal em Campinas. Em 1997 foi convidado a ocupar o posto\nde secretário municipal de Saúde de Americana (SP), durante a\nadministração do prefeito Waldemar Tebaldi, do PDT.\n\nEleito deputado federal na legenda do PDT em 1998, assumiu o mandato em\nfevereiro de 1999 e foi indicado vice-líder do partido na Câmara.\nCandidatou-se a prefeito de Campinas em 2000 e, com uma votação de\n16,31%, ficou em terceiro lugar na disputa. No ano seguinte, ocupou a\nvice-liderança do bloco PDT/Partido Popular Socialista (PPS), até 2003.\n\nReelegeu-se deputado federal por São Paulo, ainda na legenda do PDT, em\n2002. Foi primeiro vice-líder do PDT entre 2003 e 2004, e líder de 2004\na 2005. Durante a legislatura, foi titular da Comissão Mista de Planos,\nOrçamentos Públicos e Fiscalização e da Comissão Parlamentar Mista de\nInquérito de Evasão de Divisas. Foi ainda terceiro vice-presidente da\nComissão de Ciência e Tecnologia, Comunicação e Informática e suplente\nda Comissão de Seguridade Social e Família.\n\nEm 2004 concorreu novamente à eleição para a prefeitura de Campinas, em\nchapa composta com o candidato a vice Guilherme Campos Júnior, do\nPartido da Frente Liberal (PFL), e derrotou no segundo turno o\nconcorrente Carlos Henrique Focesi Sampaio, do Partido da Social\nDemocracia Brasileira (PSDB), obtendo 52,63% dos votos válidos.\nTornou-se o primeiro prefeito afro-descendente da cidade. Renunciou ao\nmandato de deputado federal para assumir o cargo de prefeito de Campinas\nem janeiro de 2005, e ao tomar posse proclamou que sua administração\nsustentar-se-ia sobre três pilares: desenvolvimento sustentável,\ninclusão social e distribuição de renda e participação popular. Entre as\nrealizações de sua gestão destacam-se a construção do Complexo do\nHospital Ouro Verde, do Pronto-Socorro Campo Grande e do Centro de\nReferência da Saúde do Idoso, a edificação de Naves Mães – unidades de\neducação infantil aparelhadas para atender crianças e oferecer cursos\nprofissionalizantes e orientação a mães adolescentes –, a implantação do\nBilhete Único – inspirado na experiência da gestão da prefeita Marta\nSuplicy, em São Paulo –, a construção do Terminal Rodoviário Ramos de\nAzevedo e o tratamento de esgoto da cidade.\n\nEm 2007, foi acusado pelo Ministério Público e por sindicalistas de,\nassim como a Câmara Municipal, manter em sua folha de pagamento\nfuncionários “fantasmas”. Foi igualmente polêmico o projeto que\nsancionou, autorizando o aumento de seu salário em 56%. Em dezembro de\n2008, demitiu 550 funcionários comissionados, justificando a medida como\num passo necessário para disciplinar o setor.\n\nEm 2008, candidatou-se à reeleição para a prefeitura, ainda na legenda\ndo PDT, tendo como candidato a vice Demétrio Vilagra, do Partido dos\nTrabalhadores (PT). Na campanha eleitoral, afirmou a intenção de zerar o\ndéficit de vagas na educação infantil, assim como de proporcionar a\nCampinas um serviço de tratamento de esgoto que atendesse integralmente\nà demanda da cidade. A coligação “Unidos por Campinas” reuniu forças de\namplo espectro político, que ia do Partido Comunista do Brasil (PC do B)\nao Democratas (DEM), num total de 12 partidos. Doutor Hélio recebeu\nvotação expressiva, de 67,03% dos votos válidos, reelegendo-se já no\nprimeiro turno. Em segundo lugar ficaram praticamente empatados os\ncandidatos Carlos Henrique Focesi Sampaio, do PSDB, e Jonas Donizette\nFerreira, do Partido Socialista Brasileiro (PSB), ambos com cerca de 14%\ndos votos.\n\nCasou-se com a médica Rosely Nassim Jorge dos Santos, com quem teve três\nfilhas.\n\nRecebeu o Prêmio Criança Prioridade Nacional, da Unicef de Campinas, em\n1992, e o Prêmio Nacional Criança, da Fundação Abrinq de São Paulo, em\n1993. Em 1999, recebeu a medalha Ulisses Guimarães, da Ordem dos\nParlamentares do Brasil.\n\nPublicou várias obras, a maioria sobre a questão da criança: *Cirurgia\nambulatorial em pediatria* (1986); *Crianças espancadas* (1987);\n*Crianças acidentadas* (1988); *Crianças violadas* (1991), e *Crianças\nesquecidas*(1995). Foi igualmente responsável pela edição das obras *A\nemancipação da saúde de Hortolândia* (1993) e *Dr. Hélio: é Campinas\ncomo eu quero* (1998).\n\n \n\nMariana Joffily\n\nFONTES:\n\nFundação Seade, \\<[www.seade.gov.br](http://www.seade.gov.br/)\\>, acesso\nem jul. 2009.\n\nCâmara dos Deputados,\n\\<[www.camara.gov.br](http://www.camara.gov.br/)\\>, acesso em jul. 2009.\n\nWikipédia, “Hélio de Oliveira Santos”,\n\\<http://pt.wikipedia.org/wiki/H%C3%A9lio\\_de\\_Oliveira\\_Santos\\>,\nacesso em jul. 2009.\n\nMuito Mais, “Cuidando dos pobres, melhoramos a vida de todos”,\n18/02/2005,\n\\<http://www.mmais.com.br/pff.cfm/idedicao/18/tb/noticias/id/542\\>,\nacesso em jul. 2009.\n\nCentro Regional de Atenção Aos Maus Tratos na Infância,\n\\<http://www.cramicampinas.org.br/diretoria.htm\\>, acesso em jul. 2009.\n\nPrefeitura Municipal de Campinas, “Dr. Hélio toma posse e assume\nAdministração para gestão 2009/2012”, 01/01/2009,\n\\<www.campinas.sp.gov.br/impressao.php?codDiv=41&id=1&codCanal=62&link\\_rss=http://www.campinas.sp.gov.br/admin/ler\\_noticia.php?not\\_id=19789\\>,\nacesso em jul. 2009.\n\nTerra, “Dr. Hélio assume segundo mandato” em Campinas”, 01/01/2009,\n\\<http://www.mx.terra.com/tecnologia/interna/0,,OI3422725-EI7896,00.html\\>,\nacesso em jul. 2009.\n\n \n","ref":"FONTES:\n\nFundação Seade, \\<[www.seade.gov.br](http://www.seade.gov.br/)\\>, acesso\nem jul. 2009.\n\nCâmara dos Deputados,\n\\<[www.camara.gov.br](http://www.camara.gov.br/)\\>, acesso em jul. 2009.\n\nWikipédia, “Hélio de Oliveira Santos”,\n\\<http://pt.wikipedia.org/wiki/H%C3%A9lio\\_de\\_Oliveira\\_Santos\\>,\nacesso em jul. 2009.\n\nMuito Mais, “Cuidando dos pobres, melhoramos a vida de todos”,\n18/02/2005,\n\\<http://www.mmais.com.br/pff.cfm/idedicao/18/tb/noticias/id/542\\>,\nacesso em jul. 2009.\n\nCentro Regional de Atenção Aos Maus Tratos na Infância,\n\\<http://www.cramicampinas.org.br/diretoria.htm\\>, acesso em jul. 2009.\n\nPrefeitura Municipal de Campinas, “Dr. Hélio toma posse e assume\nAdministração para gestão 2009/2012”, 01/01/2009,\n\\<www.campinas.sp.gov.br/impressao.php?codDiv=41&id=1&codCanal=62&link\\_rss=http://www.campinas.sp.gov.br/admin/ler\\_noticia.php?not\\_id=19789\\>,\nacesso em jul. 2009.\n\nTerra, “Dr. Hélio assume segundo mandato” em Campinas”, 01/01/2009,\n\\<http://www.mx.terra.com/tecnologia/interna/0,,OI3422725-EI7896,00.html\\>,\nacesso em jul. 2009.\n\n \n","dic":"DHBB"}
