{"title":"ABI-RAMIA, Junot","cargoss":["Deputado federal"],"cargos_esp":[0],"datas_ini":[1991],"datas_fim":[1995],"estados":["RJ"],"autor":[0],"content":"**ABI-RAMIA, Junot**\n\n\\*dep. fed. RJ 1991-1995.\n\n** \n\n*Junot Abi-Ramia Antônio* nasceu na cidade do Rio de Janeiro, então\nDistrito Federal, no dia 1º de setembro de 1932, filho de Abdo Elias\nAntônio e de Adélia Abi-Ramia Antônio.\n\nEstudou engenharia civil na Universidade do Brasil, atual Universidade\nFederal do Rio de Janeiro, tendo concluído o curso em 1957. Funcionário\npúblico, construiu sua carreira na Companhia de Águas, Esgoto e\nSaneamento (CAES), em Niterói (RJ), onde começou, em 1963, como chefe do\nescritório de obras, acumulando cargos até chegar a diretor-presidente,\nem 1966. Dois anos depois assumiu a diretoria técnica da companhia.\n\nTrabalhou sempre na área de engenharia sanitária. Foi assessor-auxiliar\nda presidência da Saneamento do Rio de Janeiro (Sanerj), de 1972 a 1975,\ne na Companhia Estadual de Águas e Esgoto (Cedae) ocupou o cargo de\nencarregado-geral, de 1976 a 1983. Foi ainda diretor do Departamento de\nÁguas da Superintendência Central de Engenharia Sanitária (Sucesa) em\nNiterói e, de 1983 a 1985, superintendente de Obras do Interior. Em\n1985, voltou à Cedae como diretor do Interior.\n\nEm novembro de 1990 foi eleito deputado federal na legenda do Partido\nDemocrático Trabalhista (PDT). Na Câmara dos Deputados, foi titular da\nComissão de Viação e Transportes, Desenvolvimento Urbano e Interior e\nsuplente na Comissão de Agricultura e Política Rural.\n\nNa sessão da Câmara de 29 de setembro de 1992, votou a favor da abertura\ndo processo de *impeachment*do presidente Fernando Collor de Melo,\nacusado de crime de responsabilidade por ligações com o esquema de\ncorrupção liderado pelo ex-tesoureiro de sua campanha presidencial,\nPaulo César Farias. Afastado da presidência logo após a votação na\nCâmara, Collor renunciou ao mandato em 29 de dezembro de 1992, pouco\nantes da conclusão do processo pelo Senado Federal. Foi efetivado na\npresidência da República o vice Itamar Franco, que já vinha exercendo o\ncargo interinamente desde a decisão da Câmara.\n\nAinda nesta legislatura, nas votações importantes no Congresso Nacional,\nmanifestou-se a favor da criação do Imposto Provisório sobre\nMovimentação Financeira (IPMF) como fonte complementar de recursos para\na saúde. Foi contrário ao fim do voto obrigatório e à criação do Fundo\nSocial de Emergência (FSE), que dava ao governo mais liberdade na\nadministração de verbas, possibilitando a transferência de recursos de\náreas como saúde e educação para outras finalidades.\n\nCandidatou-se à reeleição em outubro de 1994, mas não obteve os votos\nnecessários. As suspeitas de fraude levaram o Tribunal Regional\nEleitoral (TRE) do estado a anular as eleições e marcar novo pleito para\nnovembro, mas Abi-Ramia decidiu abandonar a vida política no final do\nmandato, em janeiro de 1995.\n\nCasou-se com Maria Amélia Bianchini Antônio, com quem teve quatro\nfilhos.\n\n \n\nFONTES: CÂM. DEP.*****Deputados brasileiros*.*Repertório*(1991-1995);\n*Folha de S. Paulo* (18/9/94); *Perfil parlamentar/IstoÉ*(1991).\n\n \n","ref":"FONTES: CÂM. DEP.*****Deputados brasileiros*.*Repertório*(1991-1995);\n*Folha de S. Paulo* (18/9/94); *Perfil parlamentar/IstoÉ*(1991).\n\n \n","dic":"DHBB"}
