{"title":"FEITOSA, Chiquinho","cargoss":["Deputado federal"],"cargos_esp":[0],"datas_ini":[1999],"datas_fim":[2003],"estados":["CE"],"autor":["Luciana Pinheiro"],"content":"**FEITOSA, Chiquinho**\n\n\\* dep. fed. CE 1999-2003.\n\n*Francisco Feitosa de Albuquerque Lima* nasceu em Fortaleza no dia 3 de\njulho de 1964, filho de Carlos de Albuquerque Lima e de Maria da\nConceição Feitosa Carvalho Albuquerque.\n\nEmpresário, no ano de 1985 tornou-se vice-presidente do Sindicato das\nEmpresas de Transporte de Passageiros do Estado do Ceará (SINDIÔNIBUS),\ndo qual passou a presidente no ano de 1993, sendo reeleito para diversas\ngestões.\n\nEm outubro de 1998 candidatou-se a deputado federal na legenda do\nPartido da Social Democracia Brasileira (PSDB), e foi eleito com 116.499\nvotos, segunda melhor votação, no estado, para a Câmara dos Deputados.\nEm fevereiro de 1999 tomou posse como parlamentar.\n\nDurante o ano de 2001 foi titular da comissão especial para proposta de\nemenda constitucional (PEC), transformada em norma jurídica, sobre\nrecursos destinados à irrigação. Nesse mesmo ano atuou também como\nprimeiro vice-presidente e titular da Comissão Parlamentar de Inquérito\n(CPI) criada pela Câmara dos Deputados com o objetivo de investigar\nsuposta aplicação irregular de recursos do Fundo de Investimento do\nNordeste (FINOR). A CPI do FINOR foi alvo de polêmica, uma vez que na\nocasião da publicação de seu relatório final foram suprimidos dados e\nprovas documentais contra 600 empresas, do total de 653 investigadas.\n\nNo decorrer de seu mandato na Câmara exerceu também as funções de\nsegundo vice-presidente e titular da comissão permanente de Viação e\nTransportes, além de ter sido membro da comissão especial para aplicação\nda lei de Código de Trânsito Brasileiro. Como empresário, atuou na\nBrasilimp Transportes e Viação Urbana e foi diretor da Autoviária São\nVicente de Paulo, da Auto Viação São José e da Expresso Canindé, todas\nempresas fortalezenses.\n\n*Luciana Pinheiro*\n\nFONTES: Portal da Câmara dos Deputados\n([http://www2.camara.gov.br/](http://www2.camara.gov.br/); acessado em\n18/05/2009); Portal Chiquinho Feitosa\n([http://www.chiquinhofeitosa.com.br/](http://www.chiquinhofeitosa.com.br/);\nacessado em 04/06/2009); Portal G1\n([http://g1.globo.com](http://g1.globo.com/); acessado em 04/06/2009);\nPortal do Jornal *Diário do\nNordeste*([http://diariodonordeste.globo.com/](http://diariodonordeste.globo.com/);\nacessado em 05/06/2009); Portal do Jornal *O*Povo\n([www.opovo.com.br/](http://www.opovo.com.br/); acessado em 04/06/2009);\nPortal do\n([http://www.sindionibus.com.br/](http://www.sindionibus.com.br/);\nacessado em 01/06/2009); Portal do Tribunal Regional Eleitoral do Ceará\n([http://www.tre-ce.gov.br/](http://www.tre-ce.gov.br/); acessado em\n18/05/2009).\n","ref":"FONTES: Portal da Câmara dos Deputados\n([http://www2.camara.gov.br/](http://www2.camara.gov.br/); acessado em\n18/05/2009); Portal Chiquinho Feitosa\n([http://www.chiquinhofeitosa.com.br/](http://www.chiquinhofeitosa.com.br/);\nacessado em 04/06/2009); Portal G1\n([http://g1.globo.com](http://g1.globo.com/); acessado em 04/06/2009);\nPortal do Jornal *Diário do\nNordeste*([http://diariodonordeste.globo.com/](http://diariodonordeste.globo.com/);\nacessado em 05/06/2009); Portal do Jornal *O*Povo\n([www.opovo.com.br/](http://www.opovo.com.br/); acessado em 04/06/2009);\nPortal do\n([http://www.sindionibus.com.br/](http://www.sindionibus.com.br/);\nacessado em 01/06/2009); Portal do Tribunal Regional Eleitoral do Ceará\n([http://www.tre-ce.gov.br/](http://www.tre-ce.gov.br/); acessado em\n18/05/2009).\n","dic":"DHBB"}
