{"title":"FALCÃO, Rui","cargoss":["Deputado federal"],"cargos_esp":[0],"datas_ini":[2000],"datas_fim":[2001],"estados":["SP"],"autor":[0],"content":"**FALCÃO, Rui**\n\n\\* dep. fed. SP 2000-2001.\n\n \n\n*Rui Goethe da Costa Falcão* nasceu em Pitangui (MG) no dia 26 de\nnovembro de 1943, filho de Albino de Freitas Falcão e de Tarcila Costa\nde Almeida Gomes.\n\nEm 1963 ingressou na Faculdade de Direito da Universidade de São Paulo\n(USP) e em 1967 bacharelou-se, mas não chegou a exercer a advocacia.\nEntre 1963 e 1988 trabalhou em jornais paulistas como *A Gazeta*, *Folha\nde S. Paulo*, *Notícias Populares*, *Jornal da Tarde* e *Diário do\nComércio e Indústria*, e de 1977 a 1988 foi diretor de redação da\nrevista *Exame*. Ainda durante o regime militar (1964-1985) militou no\nPartido Comunista Brasileiro (PCB) e no grupo Vanguarda Armada\nRevolucionária Palmares (VAR-Palmares) e ficou três anos preso.\n\nA experiência como jornalista e a militância política levou-o a discutir\ntemas inerentes ao universo político e a filiar-se, em 1982, ao Partido\ndos Trabalhadores (PT). Interessou-se também pelas demandas de sua\ncategoria, tornando-se diretor estatutário do Sindicato dos Jornalistas\nProfissionais do Estado de São Paulo entre os anos de 1983 e 1985. De\n1983 a 1987 foi membro do diretório estadual, de 1989 a 1992 presidente\ndo diretório municipal de São Paulo, e de 1989 a 1996 membro do\ndiretório nacional do PT.\n\nEleito deputado estadual em 1990 e reeleito em 1994, ocupou uma cadeira\nna Assembleia Legislativa de fevereiro de 1991 a janeiro de 1999 e\nparticipou das comissões de Fiscalização e Controle (1991-1994) e de\nFinanças e Orçamento (1994-1998). Em 1992 coordenou a campanha para\nprefeito de São Paulo de Eduardo Suplicy, em 1994 chegou a assumir\ninterinamente a presidência do PT e coordenou a campanha presidencial de\nLuís Inácio Lula da Silva. Em 1995, foi líder do PT na Assembléia.\n\nEm 1998 candidatou-se a deputado federal por São Paulo e obteve uma\nsuplência. De 1999 a 2001 voltou a integrar o diretório municipal do PT\nem São Paulo e o diretório nacional do partido. Assumiu o mandato na\nCâmara em 28 de dezembro de 2000, mas dias depois, em 1° de janeiro de\n2001, licenciou-se para assumir a Secretaria de Governo da cidade de São\nPaulo, na administração da prefeita Marta Suplicy. No pleito de 2004\nlançou-se candidato a vice-prefeito de São Paulo na chapa de Marta\nSuplicy, que tentava a reeleição mas perdeu para o candidato do Partido\nda Social Democracia Brasileira (PSDB), José Serra. Foi então indicado\npor Marta para coordenar o processo de transição, que, segundo a *Folha\nde S. Paulo* de 23 de novembro, se caracterizou por conflitos pontuais\nentre as equipes. A equipe de José Serra reclamou do modelo adotado e\ndas informações recebidas da gestão petista, enquanto os assessores de\nMarta disseram que as críticas do PSDB buscavam justificar eventuais\ntropeços da nova administração no início do mandato.\n\nNas eleições de 2006, foi mais uma vez eleito deputado estadual com\n183.364 votos, figurando como o candidato mais votado do PT no estado de\nSão Paulo e o quarto colocado na classificação geral. Empossado na\nAssembleia Legislativa em fevereiro de 2007, aproveitou a absolvição do\nentão presidente do Senado Renan Calheiros, do Partido do Movimento\nDemocrático Brasileiro (PMDB), do processo a que respondia por quebra de\ndecoro parlamentar, para, em artigo publicado na *Folha de S. Paulo* em\n20 de setembro sob o título “Pela democracia, Senado deve acabar”,\ndefender a extinção do Senado Federal. No seu entender, a existência do\nSenado era um desserviço à democracia brasileira, pois as denúncias de\ncorrupção, a votação secreta, a abstenção nas votações, o poder revisor\ne a proposição de leis constituíam uma afronta pública ao pacto\nfederativo e ao sistema representativo.\n\n \n\n*Miliandre Garcia*\n\n \n\nFONTES: Portal da Câmara dos Deputados; FSP (16/05/2002, 25/10 e\n23/11/2004, 04/10/2006, 20/09/2007, 19/12/2008; 02/04 e 09/06/2009).\n","ref":"FONTES: Portal da Câmara dos Deputados; FSP (16/05/2002, 25/10 e\n23/11/2004, 04/10/2006, 20/09/2007, 19/12/2008; 02/04 e 09/06/2009).\n","dic":"DHBB"}
