{"title":"FELDMAN, Walter","cargoss":["Deputado federal","Deputado federal"],"cargos_esp":[0,0],"datas_ini":[2007,2003],"datas_fim":[2007,2004],"estados":["SP","SP"],"autor":["Mariana Joffily"],"content":"**FELDMAN, Walter**\n\n\\* dep. fed. SP 2003-2004 e 2007.\n\n \n\n*Walter Meyer Feldman*nasceu na cidade de São Paulo no dia 29 de janeiro\nde 1954, filho de Szloma Pinchos Feldman e de Feiga Feldman.\n\nAluno da Escola Paulista de Medicina, foi presidente do Diretório\nAcadêmico Pereira Barreto de 1976 a 1977, ano em que se formou. Fez\nresidência médica na mesma faculdade entre 1978 e 1980.\n\nNo início do anos 1980, foi militante do Partido Comunista Brasileiro\n(PCB), então na clandestinidade. Em 1982, apoiado por movimentos\npopulares da periferia de São Paulo, foi eleito para seu primeiro\nmandato de vereador, na legenda do Partido do Movimento Democrático\nBrasileiro (PMDB). Reelegeu-se em 1988, mas dessa vez na legenda do\nPartido da Social Democracia Brasileira (PSDB), que ajudou a fundar em\njunho daquele ano e cujo diretório municipal presidiu de 1988 a 1989.\nComo vereador, aprovou a lei que criou o Conselho Municipal dos Direitos\nda Criança e do Adolescente e os Conselhos Tutelares.\n\nEm 1994, elegeu-se deputado estadual em São Paulo na legenda do PSDB.\nAssumiu o mandato em fevereiro de 1995 e no ano seguinte foi coordenador\nde mobilização da campanha de José Serra, do PSDB, para a prefeitura de\nSão Paulo, em disputa vencida por Celso Pitta, do Partido Progressista\nBrasileiro (PPB). Escolhido por Mário Covas, então governador do estado,\npara ser líder do governo na Assembleia, em 1997 licenciou-se por ter\nsido nomeado chefe da Casa Civil do governo estadual. Foi reeleito em\n1998, e em 2000 foi mais uma vez coordenador da campanha do candidato do\nPSDB à prefeitura, agora Geraldo Alckmin, derrotado por Marta Suplicy,\ndo Partido dos Trabalhadores (PT). Exerceu a presidência da Assembleia\nLegislativa de 2000 a 2003, assumindo interinamente o cargo de\ngovernador do estado de São Paulo por duas vezes, em novembro de 2001 e\nnovembro de 2002.\n\nEleito deputado federal por São Paulo na legenda do PSDB em 2002,\nassumiu o mandato na Câmara em fevereiro de 2003. Defendeu a diminuição\nda carga tributária, integrando a Comissão Especial da Reforma\nTributária, que teve como uma de suas principais reivindicações a adição\nda emenda do Super Simples, imposto único que beneficiaria as pequenas e\nmédias empresas. Aprovou o projeto que criou o Conselho Parlamentar pela\nCultura de Paz e o que estabeleceu novas regras para licitações públicas\nde medicamentos. Vice-líder do PSDB na Câmara entre 2003 e 2005,\nparticipou ainda da Comissão de Desenvolvimento Territorial Urbano e\npresidiu a Subcomissão de Ordenamento Territorial das Regiões\nMetropolitanas. Foi suplente da Comissão de Fiscalização Financeira e\nControle e da Comissão de Seguridade Social e Família. Foi ainda titular\ndas comissões especiais de Parcelamento de Solo Urbano, de Política\nNacional dos Resíduos e de Tráfico de Órgãos Humanos. Participou como\nsuplente das comissões especiais de Recursos Assistência Social, de\nRevitalização da Bacia do São Francisco, de Licitações e Contratos, do\nEstatuto do Portador de Necessidades Especiais e de Planos de Saúde.\nIntegrou, igualmente, o Grupo de Trabalho Mata Atlântica II, na condição\nde suplente.\n\nCom a eleição de José Serra para prefeito de São Paulo em 2004,\nlicenciou-se da Câmara e assumiu, em janeiro de 2005, a Secretaria\nMunicipal das Subprefeituras, onde se manteve até o abril de 2006.\nReeleito em outubro desse ano, em janeiro de 2007 licenciou-se mais uma\nvez para assumir Secretaria de Esportes, Lazer e Recreação da cidade de\nSão Paulo. Em fevereiro assumiu o mandato, mas imediatamente voltou à\nsecretaria, onde desenvolveu programas como o Clube Escola, a Virada\nEsportiva e Revelar.\n\nCasou-se com Elcita Ravelli, com quem teve três filhos.\n\nPublicou três livros: *São Paulo: déficit zero*; *São Paulo: o bom\ncombate da paz*. *O papel de subprefeituras fortalecidas na\nadministração e reconciliação da cidade* (2006), e *Esporte, inclusão e\nmagia* (2008).\n\nMariana Joffily\n\nFONTES:\n\nSite do biografado, \\<www.walterfeldman.com.br\\>, acesso em jul. 2009.\n\nCâmara dos Deputados,\n\n\\<http://www.camara.gov.br/Internet/Deputado/DepNovos\\_Detalhe.asp?nome=WALTER%20FELDMAN&leg=52\\>,\nacesso em jul. 2009.\n\nAssembléia Legislativa de São Paulo, \\<http://www.al.sp.gov.br\\>, acesso\nem jul. 2009.\n\nPrefeitura de São Paulo,\n\\<http://www.prefeitura.sp.gov.br/portal/governo/equipe\\_de\\_governo/index.php?p=11987\\>\ne \\<www.prefeitura.sp.gov.br/portal/upload/esportes\\_1230841190.doc\\>,\nacesso em jul. 2009.\n\nTV Justiça, 16/07/2007,\n\\<http://www.tvjustica.gov.br/maisnoticias.php?id\\_noticias=4196\\>,\nacesso em jul. 2009.\n\nFolha *Online* especial 2006 eleições,\n\\<www1.folha.uol.com.br/folha/especial/2006/eleicoes/candidatos-deputado\\_federal-sp-4570.shtml\\>,\nacesso em jul. 2009.\n\n \n","ref":"FONTES:\n\nSite do biografado, \\<www.walterfeldman.com.br\\>, acesso em jul. 2009.\n\nCâmara dos Deputados,\n\n\\<http://www.camara.gov.br/Internet/Deputado/DepNovos\\_Detalhe.asp?nome=WALTER%20FELDMAN&leg=52\\>,\nacesso em jul. 2009.\n\nAssembléia Legislativa de São Paulo, \\<http://www.al.sp.gov.br\\>, acesso\nem jul. 2009.\n\nPrefeitura de São Paulo,\n\\<http://www.prefeitura.sp.gov.br/portal/governo/equipe\\_de\\_governo/index.php?p=11987\\>\ne \\<www.prefeitura.sp.gov.br/portal/upload/esportes\\_1230841190.doc\\>,\nacesso em jul. 2009.\n\nTV Justiça, 16/07/2007,\n\\<http://www.tvjustica.gov.br/maisnoticias.php?id\\_noticias=4196\\>,\nacesso em jul. 2009.\n\nFolha *Online* especial 2006 eleições,\n\\<www1.folha.uol.com.br/folha/especial/2006/eleicoes/candidatos-deputado\\_federal-sp-4570.shtml\\>,\nacesso em jul. 2009.\n\n \n","dic":"DHBB"}
