{"title":"FERREIRA, Ben-Hur","cargoss":["Deputado federal","Deputado federal"],"cargos_esp":[0,0],"datas_ini":[2002,1999],"datas_fim":[2003,2000],"estados":["MS","MS"],"autor":[0],"content":"**FERREIRA, Ben-Hur**\n\n\\*dep. fed. MS 1999-2000, 2002-2003.\n\n \n\n                *Eurídio Ben-Hur Ferreira* nasceu em Campo Grande,\nsituado no estado de Mato Grosso, no dia 11 de janeiro de 1964, filho de\nEurídio Ferreira e de Isolita Pereira Ferreira.\n\n                Formado em filosofia e direito pelas Faculdades Unidas\nCatólicas do Mato Grosso (FUCMT), atual Universidade Católica Dom Bosco\n(UCDB), em Campo Grande, concluiu a pós-graduação em filosofia e\nhistória da educação também na FUCMT, em 1987.\n\nAtivo participante do movimento estudantil, filiou-se ao Partido dos\nTrabalhadores (PT), em 1988. Nesse mesmo ano, começou a cursar o\nmestrado em direito constitucional na Pontifícia Universidade Católica\nde São Paulo (PUC/SP).\n\n                Durante esse período, exerceu as atividades\nprofissionais de magistério superior e advocacia. No pleito de outubro\nde 1992, foi o primeiro vereador eleito pelo PT em Campo Grande. Na\nCâmara Municipal da capital de Mato Grosso do Sul, assumiu a liderança\nda bancada petista e foi presidente da Comissão de Educação, Cultura e\nEsporte. Foi também membro do Conselho Estadual de Saúde (1992-1993) e\ndo Conselho da Criança e do Adolescente (1993).\n\nAinda em 1993, concluiu o curso de mestrado da PUC/SP. Cumpriu seu\nmandato de vereador até 1994, ano em que se candidatou a deputado\nestadual pelo PT, sendo o mais votado de Mato Grosso do Sul. Ligado ao\nmovimento negro, ainda em 1994 integrou o Grupo Trabalho e Estudos Zumbi\n(TEZ), voltado para a luta contra o racismo, e foi também fundador do\nCentro de Direitos Humanos Marçal de Souza.\n\nEmpossado na Assembleia Legislativa estadual em fevereiro de 1995,\nexerceu a liderança da bancada petista e participou das Comissões de\nCidadania, Trabalho e de Direitos Humanos (presidente); de Educação\n(presidente) e de Educação, Cultura, Desporto, Ciência e Tecnologia\n(membro e presidente). Em 1996, foi representante da Comissão de\nDireitos Humanos da Assembleia Legislativa do Estado do Mato Grosso do\nSul na Reunião Nacional de Direitos Humanos, em Brasília.\n\nNesse mesmo ano, no pleito municipal de outubro, concorreu ao cargo de\nvice-prefeito de Campo Grande pela chapa encabeçada por José Orcírio\nMiranda dos Santos, “o Zeca do PT”. A dupla levou o candidato da\nsituação, André Puccinelli, do Partido do Movimento Democrático\nBrasileiro (PMDB), para o segundo turno. Numa disputa acirrada, André\nvenceu pela diferença de apenas 411 votos.\n\nEm outubro de 1998, ano em que ingressou no doutorado da PUC/SP em\ndireito constitucional, foi eleito deputado federal pelo PT/MS. Deixou a\nAssembleia Legislativa em janeiro de 1999, e no mês seguinte iniciou seu\nmandato na Câmara Federal. Participou de cinco comissões permanentes, a\nsaber: Amazônia e de Desenvolvimento Regional (titular); Constituição e\nJustiça e de Redação (suplente); Defesa do Consumidor, Meio Ambiente e\nMinorias (titular); Finanças e Tributação (suplente) e Viação e\nTransportes (titular). Foi membro, igualmente, das comissões especiais\ndo Parlamentarismo (suplente); de Recursos Destinados à Irrigação\n(suplente); dos Precatórios (suplente); de Responsabilidade Fiscal\n(suplente) e do Estatuto da Igualdade Racial (suplente). Em 2000, foi\npresidente da Frente Parlamentar Brasil-África.\n\nLicenciou-se do mandato de deputado federal na legislatura de 1999 a\n2003, para exercer o cargo de secretário de Educação de Mato Grosso do\nSul, de 20 de outubro de 2000 a 9 de abril de 2002. De volta à Câmara,\nencerrou o mandato em janeiro de 2003, ao final da legislatura.\n\nEm 2005, depois de desistir de disputar a presidência do PT de Mato\nGrosso do Sul, filiou-se ao Partido da Social Democracia Brasileira\n(PSDB).  Em 2009, presidiu a seção de Mato Grosso do Sul do Instituto\nTeotônio Vilela (ITV).\n\n \n\nFONTES:\n\n*www.*psdbms.blogspot.com;*www.*progresso.com.br*/not\\_view.php?not\\_id=18222*\n*www.*marcoeusebio.com.br*/?a=colunas\\_geral&coluna=3&pagina=1*      \n","ref":"FONTES:\n\n*www.*psdbms.blogspot.com;*www.*progresso.com.br*/not\\_view.php?not\\_id=18222*\n*www.*marcoeusebio.com.br*/?a=colunas\\_geral&coluna=3&pagina=1*      \n","dic":"DHBB"}
