{"title":"GASQUES, Amauri","cargoss":["Deputado federal"],"cargos_esp":[0],"datas_ini":[2003],"datas_fim":[2007],"estados":["SP"],"autor":["Mariana Joffily"],"content":"**GASQUES, Amauri**\n\n\\* dep. fed. SP 2003-2007.\n\n* *\n\n*Amauri Robledo Gasques*nasceu no dia 17 de março de 1958 na cidade de\nSão Paulo (SP), filho de Julio Gasques Lopes e de Teresa Robledo\nGasques.\n\nFormou-se em medicina pela Universidade Gama Filho, no Rio de Janeiro,\nem 1982, com especialização em cardiologia, e concluiu sua pós-graduação\nno Colégio Brasileiro de Cardiologia, também no Rio, em 1984. Fez duas\nresidências médicas na Unincor, em São Paulo: a primeira, entre 1984 e\n1986, e a segunda, em hemodinâmica, entre 1986 e 1988. Realizou estágio\nem cateterismo cardíaco no Hospital Tenon, em Paris, em 1988. Tornou-se\nmembro titular da Sociedade Brasileira de Cardiologia do Rio de Janeiro,\nda Sociedade Brasileira de Hemodinâmica e Cardiologia Invasiva de São\nPaulo e da Sociedade de Cardiologia do Estado de São Paulo. Foi um dos\nfundadores da Sociedade Latino-Americana de Cardiologia Invasiva, criada\nem 1993.\n\nFiliado ao Partido da Reedificação da Ordem Nacional (Prona) desde 1989,\nfoi presidente de seu diretório regional em São Paulo desse ano até\n1991. Em 2002 elegeu-se deputado federal com uma baixa votação (18.421\nvotos), devido ao critério de proporcionalidade e à votação\nsignificativa (1.573.642 votos) recebida pelo candidato a deputado\nfederal do Prona Enéas Ferreira Carneiro. Assumindo o mandato em\nfevereiro de 2003, tornou-se vice-líder do Prona, mas nesse mesmo ano\ningressou no Partido Liberal (PL). Foi vice-líder do bloco PL/ Partido\nSocial Liberal (PSL) em 2005 e vice-líder do PL entre julho de 2005 e\nfevereiro de 2006. Durante a legislatura participou das comissões Mista\nde Planos, Orçamentos Públicos e Fiscalização; da Amazônia e de\nDesenvolvimento Regional; de Seguridade e da Família; e de Viação e\nTransportes. Foi suplente das comissões de Ciência e Tecnologia,\nComunicação e Informática, de Defesa do Consumidor, e ainda de Relações\nExteriores e de Defesa Nacional.\n\nEm 2006, teve grande repercussão o caso da chamada “máfia dos\nsanguessugas”, organização criminosa acusada de montar um esquema de\naliciamento de parlamentares para que fizessem emendas individuais ao\nOrçamento da União, destinando verbas a municípios específicos. Uma vez\ngarantidos os recursos, a organização, que também atuava no Ministério\nda Saúde, manipulava a licitação de compra de ambulâncias por parte dos\nmunicípios, fraudando a concorrência por meio de empresas de fachada. Os\npreços das licitações eram superfaturados, e o excedente, distribuído\nentre os participantes da trama.  \n\nSegundo os dados colhidos pela comissão parlamentar de inquérito (CPI)\ncriada em junho de 2006 para investigar o esquema, Amauri Gasques estava\nentre os parlamentares que receberam propina, por meio de depósito na\nconta bancária de sua então esposa e assessora Edna Gonçalves Sousa. Em\nsua defesa, o deputado afirmou que uma ex-assessora de fato havia\nrecebido o depósito da empresa Planan, envolvida no escândalo, mas negou\nsua participação no esquema. A ex-assessora em questão, Maria da Penha\nLino, trabalhara com o deputado entre março e agosto de 2005 e foi\nacusada de ser uma das peças-chave na operação do esquema de fraudes no\nMinistério da Saúde. A CPI presidida pelo deputado Antônio Carlos\nBiscaia, que investigou o escândalo dos Sanguessugas, concluiu seus\ntrabalhos em dezembro de 2006 sem apontar a prática de crimes por nenhum\ndeputado ou senador.\n\nEm outubro de 2006, voltou a se candidatar a deputado federal por São\nPaulo na legenda do PL, mas não conseguiu a reeleição.\n\nSeparou-se judicialmente de Edna Gonçalves Sousa.\n\nMariana Joffily\n\nFONTES:\n\nSite do biografado \\<www.camara.gov.br/amaurirg/\\>, acesso em jul. 2009.\n\nTribunal Superior Eleitoral \\<tre.gov.br\\>, acesso em jul. 2009.\n\nCâmara dos Deputados,\n\\<[www.camara.gov.br](http://www.camara.gov.br/)\\>, acesso em jul. 2009.\n\nFolha *Online* especial 2006 eleições,\n\\<www1.folha.uol.com.br/folha/especial/2006/eleicoes/candidatos-deputado\\_federal-sp-2222.shtml\\>,\nacesso em jul. 2009.\n\nIstoÉ, 09/08/2006, “As provas da propina de cada um”, \n\\<www.terra.com.br/istoe/1920/brasil/1920\\_as\\_provas\\_da\\_propina\\_de\\_cada\\_um.htm\\>,\nacesso em jul. 2009.\n\nWikipédia,\n\\<http://pt.wikipedia.org/wiki/Esc%C3%A2ndalo\\_dos\\_Sanguessugas\\>,\nacesso em jul. 2009.\n\nG1 “CPI dos sanguessugas chega ao fim sem indiciar um só parlamentar”,\n14/12/2006\n\\<http://g1.globo.com/Noticias/Politica/0,,AA1387918-5601,00.html\\>,\nacesso em jul. 2006\n\n \n","ref":"FONTES:\n\nSite do biografado \\<www.camara.gov.br/amaurirg/\\>, acesso em jul. 2009.\n\nTribunal Superior Eleitoral \\<tre.gov.br\\>, acesso em jul. 2009.\n\nCâmara dos Deputados,\n\\<[www.camara.gov.br](http://www.camara.gov.br/)\\>, acesso em jul. 2009.\n\nFolha *Online* especial 2006 eleições,\n\\<www1.folha.uol.com.br/folha/especial/2006/eleicoes/candidatos-deputado\\_federal-sp-2222.shtml\\>,\nacesso em jul. 2009.\n\nIstoÉ, 09/08/2006, “As provas da propina de cada um”, \n\\<www.terra.com.br/istoe/1920/brasil/1920\\_as\\_provas\\_da\\_propina\\_de\\_cada\\_um.htm\\>,\nacesso em jul. 2009.\n\nWikipédia,\n\\<http://pt.wikipedia.org/wiki/Esc%C3%A2ndalo\\_dos\\_Sanguessugas\\>,\nacesso em jul. 2009.\n\nG1 “CPI dos sanguessugas chega ao fim sem indiciar um só parlamentar”,\n14/12/2006\n\\<http://g1.globo.com/Noticias/Politica/0,,AA1387918-5601,00.html\\>,\nacesso em jul. 2006\n\n \n","dic":"DHBB"}
