{"title":"GRANDO, Sérgio","cargoss":["Prefeito"],"cargos_esp":["Florianópolis"],"datas_ini":[1993],"datas_fim":[1997],"estados":[0],"autor":["Bruno Marques"],"content":"**GRANDO, Sérgio**\n\n\\*pref. Florianópolis 1993-1997.\n\n*Sérgio José Grando* nasceu na cidade de Veranópolis (SC) no dia 7 de\nmarço de 1950.\n\nNa infância viveu em diversas cidades gaúchas e na adolescência\ntrabalhou nos acampamentos rodoviários, com o pai, fazendo buchas para\nexplosões em túneis e servindo café aos operários. A família residiu em\nLages (SC) e em 1968 mudou-se para Florianópolis.\n\nGraduou-se em matemática e física pela Universidade Federal de Santa\nCatarina (UFSC) e fez pós-graduação em físico-química na mesma\nuniversidade. Durante a graduação foi perseguido pelo regime militar\ninstaurado no país em 1964. Começou a dar aulas no ensino fundamental,\nmédio e superior em 1972. Foi também professor de cursos\npré-vestibulares e colégios particulares da cidade. Trabalhou ainda para\na Organização das Nações Unidas (ONU), de 1978 a 1980, e participou do\nPrograma das Nações Unidas para o Desenvolvimento na Guiné Bissau,\nÁfrica, lecionando metodologia para a estruturação das disciplinas de\nmatemática e física naquele país.\n\nNo pleito de 1982, elegeu-se vereador em Florianópolis na legenda do\nPartido do Movimento Democrático Brasileiro (PMDB), que fazia oposição\nao regime militar. Durante o mandato apresentou projeto de lei que criou\no passe do estudante, beneficiando os alunos do ensino fundamental à\npós-graduação com 50% de desconto na passagem de ônibus. Em 1990,\nelegeu-se deputado estadual e liderou a luta pela manutenção da capital\nem Florianópolis. Filiado ao Partido Popular Socialista (PPS), foi\neleito em 1992 prefeito de Florianópolis. Empossado em 1993, criou o\n“Cestão do Povo”, estabeleceu 16 linhas de ônibus nos morros, implantou\nrede de água e esgoto a partir das partes mais altas da cidade e\nrealizou um programa de pavimentação. Ao final da legislatura em 1996,\nfoi escolhido em pesquisa realizada pelo *Datafolha* e *Folha de São\nPaulo* um dos melhores prefeitos do país. Ainda em sua gestão,\nFlorianópolis obteve pela primeira vez o título de “Capital da Qualidade\nde Vida”, conferido pela ONU.\n\nNas eleições de 1998, candidatou-se ao Senado por Santa Catarina na\nlegenda do PPS, mas não foi eleito. Em 2000, tentou a reeleição, porém\nfoi derrotado por Ângela Amin, do Partido Progressista (PP). Em 2002,\ndisputou mais uma vez a prefeitura de Florianópolis, sendo derrotado por\nLuís Henrique da Silveira do PMDB. Em 2004,  mais uma vez concorreu a\nprefeito de Florianópolis e de novo foi derrotado por Dario Berger, do\nPartido da Social Democracia Brasileira (PSDB).\n\nDe 2005 a 2007, foi diretor-geral da Fundação do Meio Ambiente de Santa\nCatarina (Fatma), além de delegado brasileiro na Conferência Mundial\nsobre Mudanças Climáticas, realizada no Canadá e no Fórum Mundial das\nÁguas no México, eventos organizados pelas Nações Unidas. No pleito de\noutubro de 2006, concorreu a deputado estadual na legenda do PPS e\nobteve uma suplência. Assumiu o mandato em 2007 em substituição a Altair\nGuidi.\n\nFoi ainda presidente da Associação dos Licenciados de Santa Catarina\n(Alisc), que deu origem ao Sindicato dos Trabalhadores na Educação\n(Sinte),  entidade que veio a liderar, e participou das lutas que\nresultaram no plano de carreira do magistério.\n\nCasou-se com a socióloga e pedagoga Cleide Maria Marques Grando, com\nquem teve dois filhos.\n\nPublicou *Florianópolis de todos* (1998), *Versos\nda**l**iber**dade*(poesias) (1999) e *Ambientes da**d**emocracia\nambiental*(2006).\n\n*Bruno Marques*\n\nFONTES:\n\n[http://www.floripanews.com.br/ver\\_not.php?id=52698&ed=Pol%EDtica&cat=Not%EDcias](http://www.floripanews.com.br/ver_not.php?id=52698&ed=Pol%EDtica&cat=Not%EDcias) \nacesso em 8/11/2009.\n\n[http://www.alesc.sc.gov.br/deputados/deputados.php?id=5240](http://www.alesc.sc.gov.br/deputados/deputados.php?id=5240)\nacesso em 8/11/2009.\n\n[http://www.senagua.com.br/site/pub/index.pub.php?s=palestrantes](http://www.senagua.com.br/site/pub/index.pub.php?s=palestrantes) \nacesso em 8/11/2009.\n\n[http://www.professorgrando.com.br](http://www.professorgrando.com.br/) \nacesso em 8/11/2009.\n\n[http://noticias.terra.com.br/eleicoes/est/sc/sergiojosegrando.html](http://noticias.terra.com.br/eleicoes/est/sc/sergiojosegrando.html) \nacesso em 8/11/2009.\n\n[http://portal.pps.org.br/portal/showData/18155](http://portal.pps.org.br/portal/showData/18155) \nacesso em 8/11/2009.\n\n[http://www.alquimidia.org/fcc/index.php?id=3075&mod=noticia](http://www.alquimidia.org/fcc/index.php?id=3075&mod=noticia) \nacessoem 8/11/2009.\n\n[http://www.nead.com.br/hp-2.0/home/noticia\\_ler.php?c=19926](http://www.nead.com.br/hp-2.0/home/noticia_ler.php?c=19926) \nacesso em 8/11/2009.\n\n[http://www.tse.gov.br/internet/index.html](http://www.tse.gov.br/internet/index.html)\nacesso em 8/11/2009.\n\n[http://portal.pps.org.br/portal/showData/20130](http://portal.pps.org.br/portal/showData/20130) \nacesso em 8/11/2009.\n\n","ref":"FONTES:\n\n[http://www.floripanews.com.br/ver\\_not.php?id=52698&ed=Pol%EDtica&cat=Not%EDcias](http://www.floripanews.com.br/ver_not.php?id=52698&ed=Pol%EDtica&cat=Not%EDcias) \nacesso em 8/11/2009.\n\n[http://www.alesc.sc.gov.br/deputados/deputados.php?id=5240](http://www.alesc.sc.gov.br/deputados/deputados.php?id=5240)\nacesso em 8/11/2009.\n\n[http://www.senagua.com.br/site/pub/index.pub.php?s=palestrantes](http://www.senagua.com.br/site/pub/index.pub.php?s=palestrantes) \nacesso em 8/11/2009.\n\n[http://www.professorgrando.com.br](http://www.professorgrando.com.br/) \nacesso em 8/11/2009.\n\n[http://noticias.terra.com.br/eleicoes/est/sc/sergiojosegrando.html](http://noticias.terra.com.br/eleicoes/est/sc/sergiojosegrando.html) \nacesso em 8/11/2009.\n\n[http://portal.pps.org.br/portal/showData/18155](http://portal.pps.org.br/portal/showData/18155) \nacesso em 8/11/2009.\n\n[http://www.alquimidia.org/fcc/index.php?id=3075&mod=noticia](http://www.alquimidia.org/fcc/index.php?id=3075&mod=noticia) \nacessoem 8/11/2009.\n\n[http://www.nead.com.br/hp-2.0/home/noticia\\_ler.php?c=19926](http://www.nead.com.br/hp-2.0/home/noticia_ler.php?c=19926) \nacesso em 8/11/2009.\n\n[http://www.tse.gov.br/internet/index.html](http://www.tse.gov.br/internet/index.html)\nacesso em 8/11/2009.\n\n[http://portal.pps.org.br/portal/showData/20130](http://portal.pps.org.br/portal/showData/20130) \nacesso em 8/11/2009.\n\n","dic":"DHBB"}
