{"title":"GUIA, Mares","cargoss":["Deputado federal","min Tur","min Rel Inst"],"cargos_esp":[0,0,0],"datas_ini":[1999,2003,2006],"datas_fim":[2003,2006,2007],"estados":["MG",0,0],"autor":[0],"content":"**GUIA, Mares**\n\n\\*dep. fed. MG 1999-2003; min. Tur. 2003-2006; min. Rel. Inst.\n2006-2007.\n\n \n\n*Walfrido Silvino dos Mares Guia Neto* nasceu em Santa Bárbara (MG) no\ndia 24 de novembro de 1942, filho de José Maria dos Mares Guia e de\nJudith Pinto Coelho dos Mares Guia.\n\nConcluiu a graduação em engenharia química na Universidade Federal de\nMinas Gerais (UFMG) em 1966. Professor da UFMG de 1967 a 1971, cursou\nadministração de empresas na Fundação Mineira de Educação e Cultura\n(Fumec) de 1971 a 1973, e a partir de então fez cursos de\naperfeiçoamento em administração na Fundação João Pinheiro. Fundador,\nainda nos anos 1960, do Curso Pitágoras, presidiu o Sistema Pitágoras de\nEnsino Ltda. de 1973 a 1994. Foi ainda diretor do Sindicato dos\nEstabelecimentos Particulares de Ensino de Minas Gerais, de 1974 a 1982,\ne diretor da Biobrás S.A., em Belo Horizonte, entre 1971 e 1985. Em\nestágio no exterior em 1981, cumpriu a Praticum in Administration e\nSchool Leadership da University of San Francisco, nos Estados Unidos. De\nvolta ao país, participou em 1984 do curso sobre estratégias para o\naperfeiçoamento federalista do Brasil, da Escola Superior de Guerra\n(ESG), no Rio de Janeiro.\n\nIniciou sua carreira política em 1983, quando foi nomeado secretário\nmunicipal de Planejamento de Belo Horizonte, cargo em que permaneceu até\n1985. Daí em diante assumiu outros cargos públicos, como os de\nsecretário de Desburocratização e Reforma Administrativa do estado de\nMinas Gerais, em 1985 e 1986, presidente da Fundação Centro Tecnológico\nde Minas Gerais (Cetec), secretário de Ciência e Tecnologia em 1986 e\n1987, e secretário de Educação do governo Hélio Garcia (1991-1995).\nDepois de passar pelo Partido do Movimento Democrático Brasileiro (PMDB)\ne pelo Partido da Renovação Social (PRS), em 1994 formalizou o ingresso\nno Partido Trabalhista Brasileiro (PTB). Em outubro foi eleito\nvice-governador na chapa de Eduardo Azeredo, do Partido da Social\nDemocracia Brasileira (PSDB). Empossado em janeiro de 1995, foi\ncumulativamente secretário de Planejamento e coordenador-geral do estado\nde Minas Gerais.\n\nNo pleito de 1998, elegeu-se deputado federal por Minas Gerais na\nlegenda do PTB. Tomou posse em fevereiro de 1999 e tornou-se vice-líder\ndo PTB na Câmara dos Deputados por dois anos. Presidente da Comissão de\nEducação, Cultura e Desporto, integrou também as comissões especiais\nsobre teto salarial, reforma tributária e patrimônio genético, e a\ncomissão do projeto de lei de validação de assinaturas por meio\neletrônico.\n\nEm 2002, foi coordenador nacional da campanha de Ciro Gomes, do Partido\nPopular Socialista (PPS), que perdeu as eleições presidenciais no\nprimeiro turno. No segundo turno, apoiou o candidato vitorioso do\nPartido dos Trabalhadores (PT), Luís Inácio Lula da Silva. Em janeiro de\n2003, com a posse de Lula, renunciou ao mandato de deputado federal e\nassumiu o Ministério do Turismo.\n\nNa pasta do Turismo, apresentou um projeto voltado para a massificação\nde roteiros turísticos e a geração de empregos no setor. Atuou em três\nfrentes: 1) na promoção de pacotes turísticos em eventos especializados\nno Brasil e também no exterior; 2) no apoio à comercialização das\nempresas por meio da divulgação dos pacotes turísticos; e 3) na\nvisibilidade dos empreendimentos hoteleiros através de ferramentas como\no “Portal de Hospedagem”. Em 2003 lançou o Plano Nacional do Turismo,\nque buscava aumentar crédito dos empresários. Dois anos depois,\nimplantou o Programa de Regionalização do Turismo que visava a promover\nas regiões turísticas existentes no Brasil e coordenar a realização dos\neventos em todo país. Em sua gestão, os gastos com turismo bateram\nrecorde no país. Em janeiro de 2006, turistas estrangeiros em visita ao\nBrasil gastaram cerca de 400 milhões de dólares, maior valor já\nregistrado desde que o Banco Central (BC) iniciou os índices\nestatísticos.\n\nEm 2006, deixou o Ministério do Turismo e foi nomeado ministro de\nRelações Institucionais, cargo no qual permaneceu por pouco tempo, pois\nem fins de 2007 pediu demissão devido à acusação de envolvimento com o\npublicitário Marcos Valério e o senador Eduardo Azeredo no episódio\nconhecido como “mensalão mineiro”– suposto esquema de financiamento\nilegal da campanha de candidatos do PSDB no estado de Minas Gerais em\n1998, sobretudo de Eduardo Azeredo, então candidato à reeleição para\ngovernador. Acusado de ter efetuado, através da empresa Samos\nParticipações Ltda., um depósito de cerca de 500 mil reais na conta de\nMarcos Valério em setembro de 2002, Mares Guia afirmou que se tratava de\num empréstimo ao amigo Eduardo Azeredo que acumulava dívidas pessoais, e\nnegou envolvimento com o publicitário.\n\nCasado com Sheila Emrich dos Mares Guia, teve dois filhos.\n\n \n\n*Miliandre Garcia*\n\n \n\nFONTES: Portal da Câmara dos Deputados; Revista Ponto de Vista (a. 2, n.\n7); Época (22/11/2007); FSP (18/05/2004; 22/02, 04/03, 07/03 e\n08/03/2006; 23/11/2007).\n","ref":"FONTES: Portal da Câmara dos Deputados; Revista Ponto de Vista (a. 2, n.\n7); Época (22/11/2007); FSP (18/05/2004; 22/02, 04/03, 07/03 e\n08/03/2006; 23/11/2007).\n","dic":"DHBB"}
