{"title":"HERNANDES, Clodovil","cargoss":["Deputado federal"],"cargos_esp":[0],"datas_ini":[2007],"datas_fim":[2009],"estados":["SP"],"autor":["Mariana Joffily"],"content":"**HERNANDES, Clodovil**\n\n\\* dep. fed. SP 2007-2009.\n\n \n\n*Clodovil Hernandes*nasceu em Elisário (SP) no dia 17 de junho de 1937.\nFoi adotado por Domingos Hernandes e de Izabel Sanches Hernandes, casal\nde imigrantes espanhóis, sem nunca ter conhecido seus pais verdadeiros.\n\n Na infância, foi educado por padres católicos em um colégio interno.\nIniciou sua carreira de estilista aos 16 anos, desenhando vestidos\ncomprados pela gerente de uma loja no centro de São Paulo. Mudou para a\ncapital paulista aos 20 anos e aí construiu uma sólida carreira de\nestilista na década de 1960. Conquistou como clientes personalidades\ncomo a cantora Elis Regina, a atriz Cacilda Becker e as famílias Diniz e\nMatarazzo. Juntamente com seu colega Dener Pamplona de Abreu, foi um dos\npioneiros da “alta-costura” ou da “moda de ateliê” no Brasil, num\nperíodo em que a alta sociedade importava a moda parisiense. Os dois\nestilistas alimentavam na mídia uma aberta rivalidade, interpretada por\nalguns profissionais da moda como uma jogada de *marketing* para\nautopromoção. Além da alta-costura, Clodovil lançou coleções\n*prêt-à-porter*, usando tecidos menos nobres e conquistando o mercado\npopular. Nos inúmeros programas de televisão de que participou, seja\ncomo entrevistado, seja como apresentador, defendeu a idéia de que a\nconsciência estética não depende da condição social ou econômica.\n\nDestacou-se em 1976, ao ganhar o prêmio máximo no programa de perguntas\n*8 ou 800?*, da Rede Globo, respondendo questões sobre Dona Beja.\nParticipou, em 1979, da novela *Marron-Glacé*, exibida pela mesma\nemissora. No ano seguinte, estreou um quadro no programa *TV Mulher*,\ntambém da Rede Globo, no qual desenhava modelos exclusivos, atendendo\naos pedidos das telespectadoras. O programa era comandado por Marília\nGabriela e contava com participações como a do psicanalista Eduardo\nMascarenhas e da então sexóloga Marta Suplicy. Em 1983 iniciou o\n*Programa Clodovil*, na TV Bandeirantes. Também trabalhou como ator,\ntendo estreado em 1981 no espetáculo teatral *Seda pura e alfinetadas* e\nmontado, em 1987, a peça *Sabe quem dançou?*.\n\nNo início da década de 1990 passou a dedicar-se preferencialmente à\ntelevisão, deixando em suspenso a carreira de estilista. Em 1992 foi\ncontratado pela Rede Manchete para apresentar o programa *Clodovil abre\no jogo*. Em 1998 passou a apresentar *Clodovil Soft*, na TV\nBandeirantes. Em maio de 2001 integrou a equipe apresentadora da emissão\n*Mulheres*, na TV Gazeta, ao lado de Cristina Rocha. Dois anos depois,\nfoi contratado pela Rede TV para comandar o programa *A casa é sua*.\nPolemista, conhecido por suas declarações controversas, foi alvo de\ndiversos processos judiciais. Em março de 2004, ao entrevistar o cantor\nAgnaldo Timóteo, que se queixava de ser impedido pelos fiscais\nmunicipais de vender seus CDs no centro de São Paulo, afirmou: “Tem que\nvender disco na rua (...) Ele vai fazer o quê? Ele vai fazer o que todo\ncrioulo faz no Brasil? Vai virar ladrão, bandido ou o quê?”. Diante\ndessa intervenção, a vereadora Claudete Alves da Silva Sousa, do Partido\ndos Trabalhadores (PT), entrou com uma representação contra o\napresentador no Ministério Público, por racismo. Em entrevista ao jornal\n*Folha de S. Paulo*, indagado a respeito do caso, Clodovil disparou:\n“Aposto que essa vereadora é uma macaca de *tailleur* metida a besta”.\nPela declaração, foi condenado a pagar indenização por danos morais. Em\njaneiro de 2005, foi demitido da Rede TV após desentendimento com os\nhumoristas do programa *Pânico na TV*. Nesse ano realizou uma cirurgia\npara a remoção de um tumor na próstata.\n\nEm 2006 elegeu-se deputado federal por São Paulo na legenda do Partido\nTrabalhista Cristão (PTC), tendo sido o terceiro mais votado no estado,\ncom 493.951 votos. Diante da eleição de um homossexual assumido para a\nCâmara dos Deputados, Luiz Mott, antropólogo e dirigente do Grupo Gay da\nBahia, divulgou uma carta aberta a Clodovil Hernandes, convidando-o a\nser um representante na Câmara do movimento gay. Para prestigiar sua\nposse, em fevereiro de 2007, uma caravana com 50 ônibus com\nrepresentantes do movimento gay dirigiu-se a Brasília. O apresentador,\nentretanto, não atendeu aos apelos que lhe foram dirigidos, abstendo-se\nde atuar como defensor das reivindicações do movimento Gay, Lésbicas,\nBissexuais e Travestis (GLBT).\n\nAinda em 2007, migrou para o Partido da República (PR). Em maio,\nprotagonizou outra polêmica, ao afirmar no plenário da Câmara que as\nmulheres haviam se tornado muito “ordinárias, vulgares, cheias de\nsilicone”, e na atualidade “trabalham deitadas e descansam em pé”.\nDiante do pedido de explicações da deputada Cida Diogo, do PT, que se\nsentiu afrontada pela declaração, respondeu que ela não deveria\nofender-se por ser uma “mulher feia”, que não tinha condições de se\nprostituir. Dias depois, divulgou uma nota desculpando-se e reconhecendo\nter expressado “pensamentos polêmicos” a respeito das mulheres, embora\nnão tivesse a intenção de ofendê-las.\n\nA despeito de sua atuação controversa como deputado federal, Clodovil\nfoi objeto de declarações elogiosas por parte de colegas de plenário. O\nentão líder do Senado, Artur Virgílio, do Partido da Social Democracia\nBrasileira (PSDB), afirmou a seu respeito: “Ele é uma pessoa muito\nsincera, verdadeira, de boa fé. É uma figura ímpar.” Michel Temer, do\nPartido do Movimento Democrático Brasileiro (PMDB), então presidente da\nCâmara dos Deputados, declarou: “Foi uma passagem de muita presença\nporque ele é uma figura de muita personalidade e às vezes também gera\nmuitas contestações. Mas, ao mesmo tempo em que foi uma atuação de muita\npersonalidade, também teve uma atuação muito suave no que diz respeito\nàs relações e à amizade, inclusive comigo.”\n\nNa Câmara dos Deputados, participou das comissões de Direitos Humanos e\nMinorias, de Educação e Cultura e de Relações Exteriores e de Defesa\nNacional. Foi suplente da Comissão de Seguridade Social e Família.\n\nFaleceu no dia 17 de março de 2009, aos 71 anos, em Brasília, em\ndecorrência de um acidente vascular cerebral (AVC), seguido de parada\ncardíaca. Seu corpo foi velado no Salão Nobre da Assembleia Legislativa\ndo Estado de São Paulo e sepultado no Cemitério do Morumbi, na capital\npaulista.\n\n \n\nMariana Joffily\n\nFONTES:\n\nFundação Seade, \\<[www.seade.gov.br](http://www.seade.gov.br/)\\>, acesso\nem jul. 2009.\n\nCâmara dos Deputados,\n\\<[www.camara.gov.br](http://www.camara.gov.br/)\\>, acesso em jul. 2009.\n\nWikipédia, Clodovil Hernandes,\n\\<http://pt.wikipedia.org/wiki/Clodovil\\_Hernandes\\>, acesso em jul.\n2009.\n\nFolha *Online* especial 2006 eleições,\n\\<www1.folha.uol.com.br/folha/especial/2006/eleicoes/candidatos-deputado\\_federal-\n\nsp-2222.shtml\\>, acesso em jul. 2009.\n\nRevista Época, “Personagem da semana: Clodovil e seu gabinete”,\n26/04/2007,\n\\<http://revistaepoca.globo.com/Revista/Epoca/1,,EDG77029-6001,00.html\\>,\nacesso em jul. 2009.\n\nRevista Época, “Só córneas de Clodovil serão doadas”, 17/03/2009,\n\\<http://revistaepoca.globo.com/Revista/Epoca/0,,EMI64391-15223,00-SO+CORNEAS+DE+CLODOVIL+SERAO+DOADAS.html\\>,\nacesso em jul. 2009.\n\nEstadão.com.br, “Clodovil morre aos 71 anos vítima de AVC”, 17/03/2009,\n\\<http://www.estadao.com.br/noticias/nacional,equipe-medica-confirma-morte-cerebral-de-clodovil-,340367,0.htm\\>\n, acesso em jul. 2009.\n\nG1, “Deputada acusa Clodovil de agressão verbal”,\n\\<http://g1.globo.com/Noticias/Politica/0,,MUL33982-5601,00.html\\>,\nacesso em jul. 2009.\n\nUol Notícias, “Clodovil Hernandes morre em Brasília: polêmica marcou\ncarreira na TV e na política”, 17/03/2009,\n\\<http://noticias.uol.com.br/especiais/reportagens/2009/03/17/morre\\_clodovil.jhtm\\>,\nacesso em jul. 2009.\n\nConsulte Já,  “Clodovil é condenado por chamar vereador a de macaca”,\ns/d, \n\\<http://www.consulteja.com.br/index.php?option=com\\_content&task=view&id=337&Itemid=132\\>\nacesso em jul. 2009.\n\nFolha Online. “Veja os principais fatos da vida e carreira de Clodovil”,\n17/03/2009,\n\\<http://www1.folha.uol.com.br/folha/ilustrada/ult90u535756.shtml\\>,\nacesso em jul. 2009.\n\nFolha Online, “Clodovil conquistou fama na TV com talento e polêmica”,\n17/03/2009,\n\\<http://www1.folha.uol.com.br/folha/ilustrada/ult90u535430.shtml\\>,\nacesso em jul. 2007.\n\nFolha Online, “Candidato a deputado, Clodovil volta ao teatro em SP”,\n24/01/2006,\n\\<http://www1.folha.uol.com.br/folha/ilustrada/ult90u57117.shtml\\>,\nacesso em jul. 2009.\n\nGrupo gay da Bahia, “Carta aberta do decano do movimento homossexual\nbrasileiro ao deputado Clodovil”, 17/03/2009,\n\\<www.ggb.org.br/carta\\_aberta\\_clodovil\\_2009.html\\>, acesso em jul.\n2009.\n\nFolha de S.Paulo, “Câmara: em nota, Clodovil pede desculpas”,\n16/05/2007, \\<www1.folha.uol.com.br/fsp/brasil/fc1605200717.htm\\>,\nacesso em jul. 2009.\n\nFolha de S.Paulo,13/01/2007, Painel,\n\\<www1.folha.uol.com.br/fsp/brasil/fc3101200701.htm\\>, acesso em jul.\n2009.\n\nTerra Magazine, “Clodovil foi um ‘gay alienado’, diz Luiz Mott”,\n17/03/2009,\n\\<http://terramagazine.terra.com.br/interna/0,,OI3640479-EI6578,00-Clodovil+foi+um+gay+alienado+diz+Luiz+Mott.html\\>,\nacesso em jul. 2009.\n\n \n","ref":"FONTES:\n\nFundação Seade, \\<[www.seade.gov.br](http://www.seade.gov.br/)\\>, acesso\nem jul. 2009.\n\nCâmara dos Deputados,\n\\<[www.camara.gov.br](http://www.camara.gov.br/)\\>, acesso em jul. 2009.\n\nWikipédia, Clodovil Hernandes,\n\\<http://pt.wikipedia.org/wiki/Clodovil\\_Hernandes\\>, acesso em jul.\n2009.\n\nFolha *Online* especial 2006 eleições,\n\\<www1.folha.uol.com.br/folha/especial/2006/eleicoes/candidatos-deputado\\_federal-\n\nsp-2222.shtml\\>, acesso em jul. 2009.\n\nRevista Época, “Personagem da semana: Clodovil e seu gabinete”,\n26/04/2007,\n\\<http://revistaepoca.globo.com/Revista/Epoca/1,,EDG77029-6001,00.html\\>,\nacesso em jul. 2009.\n\nRevista Época, “Só córneas de Clodovil serão doadas”, 17/03/2009,\n\\<http://revistaepoca.globo.com/Revista/Epoca/0,,EMI64391-15223,00-SO+CORNEAS+DE+CLODOVIL+SERAO+DOADAS.html\\>,\nacesso em jul. 2009.\n\nEstadão.com.br, “Clodovil morre aos 71 anos vítima de AVC”, 17/03/2009,\n\\<http://www.estadao.com.br/noticias/nacional,equipe-medica-confirma-morte-cerebral-de-clodovil-,340367,0.htm\\>\n, acesso em jul. 2009.\n\nG1, “Deputada acusa Clodovil de agressão verbal”,\n\\<http://g1.globo.com/Noticias/Politica/0,,MUL33982-5601,00.html\\>,\nacesso em jul. 2009.\n\nUol Notícias, “Clodovil Hernandes morre em Brasília: polêmica marcou\ncarreira na TV e na política”, 17/03/2009,\n\\<http://noticias.uol.com.br/especiais/reportagens/2009/03/17/morre\\_clodovil.jhtm\\>,\nacesso em jul. 2009.\n\nConsulte Já,  “Clodovil é condenado por chamar vereador a de macaca”,\ns/d, \n\\<http://www.consulteja.com.br/index.php?option=com\\_content&task=view&id=337&Itemid=132\\>\nacesso em jul. 2009.\n\nFolha Online. “Veja os principais fatos da vida e carreira de Clodovil”,\n17/03/2009,\n\\<http://www1.folha.uol.com.br/folha/ilustrada/ult90u535756.shtml\\>,\nacesso em jul. 2009.\n\nFolha Online, “Clodovil conquistou fama na TV com talento e polêmica”,\n17/03/2009,\n\\<http://www1.folha.uol.com.br/folha/ilustrada/ult90u535430.shtml\\>,\nacesso em jul. 2007.\n\nFolha Online, “Candidato a deputado, Clodovil volta ao teatro em SP”,\n24/01/2006,\n\\<http://www1.folha.uol.com.br/folha/ilustrada/ult90u57117.shtml\\>,\nacesso em jul. 2009.\n\nGrupo gay da Bahia, “Carta aberta do decano do movimento homossexual\nbrasileiro ao deputado Clodovil”, 17/03/2009,\n\\<www.ggb.org.br/carta\\_aberta\\_clodovil\\_2009.html\\>, acesso em jul.\n2009.\n\nFolha de S.Paulo, “Câmara: em nota, Clodovil pede desculpas”,\n16/05/2007, \\<www1.folha.uol.com.br/fsp/brasil/fc1605200717.htm\\>,\nacesso em jul. 2009.\n\nFolha de S.Paulo,13/01/2007, Painel,\n\\<www1.folha.uol.com.br/fsp/brasil/fc3101200701.htm\\>, acesso em jul.\n2009.\n\nTerra Magazine, “Clodovil foi um ‘gay alienado’, diz Luiz Mott”,\n17/03/2009,\n\\<http://terramagazine.terra.com.br/interna/0,,OI3640479-EI6578,00-Clodovil+foi+um+gay+alienado+diz+Luiz+Mott.html\\>,\nacesso em jul. 2009.\n\n \n","dic":"DHBB"}
