{"title":"KAPAZ, Emerson","cargoss":["Deputado federal"],"cargos_esp":[0],"datas_ini":[1999],"datas_fim":[2003],"estados":["SP"],"autor":["Fabiane Popinigis"],"content":"**KAPAZ, Emerson**\n\n\\* dep. fed. SP 1999-2003.\n\n*Emerson Kapaz* nasceu em 5 de março de 1955 na cidade de São Paulo,\nfilho de Eliano Kapaz e de Claudete Lattuf Kapaz.\n\nCursou engenharia civil na Universidade Mackenzie de 1973 a 1978, e\nnesse último ano tornou-se sócio-gerente da empresa paulista Elka\nPlásticos. De 1983 a 1986 fez pós-graduação em administração de empresas\nna Fundação Getúlio Vargas (FGV).\n\nEmpresário do setor de brinquedos, de 1985 a 1989 foi presidente do\nSindicato das Indústrias de Instrumentos Musicais e Brinquedos de São\nPaulo. A partir do final dos anos 1980 foi um dos principais líderes do\nPensamento Nacional das Bases Empresariais (PNBE), e de 1992 a 1994 foi\npresidente da Associação Brasileira dos Fabricantes de Brinquedos\n(Abrinq). De 1995 e 1997 foi representante da sociedade civil no\nConselho da República, e de 1998 a 2001 foi vice-presidente do Centro\ndas Indústrias de São Paulo (CIESP).\n\nFiliado ao Partido da Social Democracia Brasileira (PSDB) desde 1995,\nfoi eleito deputado federal por São Paulo nessa legenda em 1998, com\n74.818 votos. Assumiu o mandato em fevereiro de 1999 e logo foi indicado\nvice-líder do partido na Câmara dos Deputados. Ao longo da legislatura\nparticipou de várias comissões: foi terceiro vice-presidente da comissão\nde Economia, Indústria e Comércio, membro da Comissão de Indústria,\nComércio e Turismo e suplente da Comissão de Finanças e Tributação.\nTambém fez parte de várias comissões especiais, como a da Área de Livre\nComércio das Américas (ALCA) e a de Combate à Violência, e da Frente\nParlamentar pela Criança.\n\nInteressado em concorrer à prefeitura de São Paulo nas eleições de 2000,\ndeixou o PSDB – que preferia lançar Geraldo Alckmin – pelo Partido\nPopular Socialista (PPS), aproveitando para criticar a gestão tucana no\ngoverno federal, e afirmando que o PSDB já não correspondia ao ideário\nsocial democrata. Apresentou-se pré-candidato e foi apontado como\npreferido em consulta aos membros do PPS, em detrimento do outro\npré-candidato, Mangabeira Unger. A direção do partido oficializou sua\ncandidatura, mas após lançá-la oficialmente, Kapaz desistiu dela para\nconcorrer a vice-prefeito na chapa de Luísa Erundina com o apoio da\ncoligação entre o Partido Socialista Brasileiro (PSB), o Partido\nDemocrático Trabalhista (PDT) e o PPS. A chapa acabou ficando em quinto\nlugar. Depois da derrota, Kapaz assumiu a vice-liderança do bloco\nPDT/PPS na Câmara no biênio 2001-2002. Em janeiro de 2003, ao fim da\nlegislatura, deixou a Câmara dos Deputados.\n\nAinda em 2003, criou a organização não governamental (ONG) Instituto\nBrasileiro de Ética Concorrencial (Etco), que tem entre seus\ncolaboradores a Shell, a AmBev, a Sousa Cruz e a BR Distribuidora, e\ndefendeu as ações antissonegação da Polícia Federal (PF).\n\nEm... foi citado pela comissão parlamentar de inquérito (CPI) que apurou\nas atividades da “máfia das ambulâncias”, quando vários deputados foram\nacusados de ter apresentado emendas ao Orçamento que permitiram fraudes\nem licitações para a compra de ambulâncias com dinheiro público a preços\nsuperfaturados. Afastou-se então da campanha de Geraldo Alckmin,\ncandidato do PSDB a governador de São Paulo, da qual era o principal\narrecadador de contribuições entre o empresariado paulista, e renunciou\ntambém ao cargo de diretor da Etco.\n\nEm 2008 seu nome foi informalmente cogitado para vice de Marta Suplicy\nna corrida pela prefeitura de São Paulo, numa tentativa de diminuir a\nrejeição do empresariado em relação à candidata Partido dos\nTrabalhadores (PT).\n\n*Fabiane Popinigis*\n\n\nFONTES:\n\nVarga, László*; Entrevista: Kapáz cria ONG para combater pirataria*.\nFolha Online, 07/04/2003:\n\\<[http://www1.folha.uol.com.br/folha/brasil/ult96u47787.shtml](http://www1.folha.uol.com.br/folha/brasil/ult96u47787.shtml)\\>,\nacessado em 18/11/2009.\n\n*Após denúncia, Kapaz pede afastamento do Etco*, Folha Online,\n26/07/2006.\n\n\\<[http://www1.folha.uol.com.br/folha/brasil/ult96u80750.shtml](http://www1.folha.uol.com.br/folha/brasil/ult96u80750.shtml)\\>,\nacessado em 18/11/2009.\n\n\\<[http://www.votebrasil.com/noticia/politica/lula-quer-empresario-para-vice-de-marta-em-sp](http://www.votebrasil.com/noticia/politica/lula-quer-empresario-para-vice-de-marta-em-sp)\\>\n\nBombig, José Alberto e Seabra, Cátia; *Baixas na tesouraria atrapalham\nAlkmin*, Folha Online, 29/07/2006:\n\\<[http://www1.folha.uol.com.br/folha/brasil/ult96u80834.shtml](http://www1.folha.uol.com.br/folha/brasil/ult96u80834.shtml)\\>,\nacessado em 18/11/2009.\n\nSpitz, Clarice; *Kapaz defende fortalecimento de ações da PF no combate\nao contrabando*, Folha Online, 17/08/2005:\n\\<[http://www1.folha.uol.com.br/folha/dinheiro/ult91u98295.shtml](http://www1.folha.uol.com.br/folha/dinheiro/ult91u98295.shtml)\\>.\nAcessado em 18/11/2009.\n\nEmerson Kapáz, Página do PPS:\\<[http://ppscapital.sites.uol.com.br/pre.htm](http://ppscapital.sites.uol.com.br/pre.htm)\\>. Acessada em 18/11/2009.\n\nEleições 2000, Tribunal Regional Eleitoral de São Paulo: \\<[http://www.tre-sp.gov.br/eleicoes/elei2000/res1t.htm](http://www.tre-sp.gov.br/eleicoes/elei2000/res1t.htm)\\>, acessado em 18/11/2008.\n\n","ref":"FONTES:\n\nVarga, László*; Entrevista: Kapáz cria ONG para combater pirataria*.\nFolha Online, 07/04/2003:\n\\<[http://www1.folha.uol.com.br/folha/brasil/ult96u47787.shtml](http://www1.folha.uol.com.br/folha/brasil/ult96u47787.shtml)\\>,\nacessado em 18/11/2009.\n\n*Após denúncia, Kapaz pede afastamento do Etco*, Folha Online,\n26/07/2006.\n\n\\<[http://www1.folha.uol.com.br/folha/brasil/ult96u80750.shtml](http://www1.folha.uol.com.br/folha/brasil/ult96u80750.shtml)\\>,\nacessado em 18/11/2009.\n\n\\<[http://www.votebrasil.com/noticia/politica/lula-quer-empresario-para-vice-de-marta-em-sp](http://www.votebrasil.com/noticia/politica/lula-quer-empresario-para-vice-de-marta-em-sp)\\>\n\nBombig, José Alberto e Seabra, Cátia; *Baixas na tesouraria atrapalham\nAlkmin*, Folha Online, 29/07/2006:\n\\<[http://www1.folha.uol.com.br/folha/brasil/ult96u80834.shtml](http://www1.folha.uol.com.br/folha/brasil/ult96u80834.shtml)\\>,\nacessado em 18/11/2009.\n\nSpitz, Clarice; *Kapaz defende fortalecimento de ações da PF no combate\nao contrabando*, Folha Online, 17/08/2005:\n\\<[http://www1.folha.uol.com.br/folha/dinheiro/ult91u98295.shtml](http://www1.folha.uol.com.br/folha/dinheiro/ult91u98295.shtml)\\>.\nAcessado em 18/11/2009.\n\nEmerson Kapáz, Página do PPS:\\<[http://ppscapital.sites.uol.com.br/pre.htm](http://ppscapital.sites.uol.com.br/pre.htm)\\>. Acessada em 18/11/2009.\n\nEleições 2000, Tribunal Regional Eleitoral de São Paulo: \\<[http://www.tre-sp.gov.br/eleicoes/elei2000/res1t.htm](http://www.tre-sp.gov.br/eleicoes/elei2000/res1t.htm)\\>, acessado em 18/11/2008.\n\n","dic":"DHBB"}
