{"title":"LESSA, Ronaldo","cargoss":["Prefeito","Governador de estado ou do Distrito Federal"],"cargos_esp":["Maceió",0],"datas_ini":[1993,1999],"datas_fim":[1996,2006],"estados":[0,"AL"],"content":"**LESSA, Ronaldo**\n\n\\* pref. Maceió 1993-1996; gov. AL 1999-2006.\n\n \n\n \n\n* Ronaldo Augusto Lessa Santos* nasceu em Maceió no dia 25 de abril de\n1949, filho de Geraldo Melo dos Santos e de Noélia Lessa Santos. Seu\nirmão, Geraldo Lessa, foi suplente do senador Teotônio Vilela Filho, e\nseu sobrinho, Maurício Lessa, foi deputado federal por Alagoas nas\nlegislaturas 2003-2007 e 2007-2011.\n\n                Iniciou sua militância política no Partido Comunista\nBrasileiro (PCB). Cursou engenharia civil na Universidade Federal de\nAlagoas (Ufal) e aí liderou os diretórios estudantis que se opunham ao\nregime militar instaurado em março de 1964. Com a instauração do\nbipartidarismo pelo Ato Institucional n° 2, em 1965, filiou-se ao\nMovimento Democrático Brasileiro (MDB), partido de oposição ao governo.\nPor causa de sua atuação nos meios estudantis ficou preso por alguns\ndias em 1969. Ainda nesse ano foi escolhido presidente da Federação\nAlagoana de Desporto Universitário (Fadu), função que exerceu até 1971.\nNo ano seguinte, formou-se em engenharia civil na Ufal.\n\n                Transferiu-se para o Rio de Janeiro em 1973 e trabalhou\nna reforma da refinaria de petróleo de Duque de Caxias, no terminal\nmarítimo da baía de Ilha Grande, na construção do metrô e na construção\nda ponte Rio-Niterói. Paralelamente, participou ativamente no Sindicato\ndos Engenheiros do Rio de Janeiro, tanto que em 1979 foi eleito\nvice-presidente na chapa encabeçada por Jorge Bittar. Ao mesmo tempo,\nfoi indicado para representar a Federação Nacional dos Engenheiros em\nBrasília, o que o levou a estreitar os laços políticos com o senador de\noposição Teotônio Vilela. Com o fim do bipartidarismo em 1979, filiou-se\nao Partido do Movimento Democrático Brasileiro (PMDB).\n\n                De volta a Alagoas em 1982, desenvolveu projetos da\nCompanhia de Desenvolvimento dos Vales do São Francisco e do Parnaíba\n(Codevasf) no município  de Penedo. Nas eleições de novembro desse ano,\nconcorreu com sucesso a uma vaga na Assembleia Legislativa na legenda do\nPMDB. Em 1985, anunciou que disputaria na convenção do PMDB sua\nindicação como candidato do partido à prefeitura de Maceió. Essa posição\nconfrontou-o com o então deputado federal Renan Calheiros, que já havia\narticulado sua candidatura pelo partido. A solução do PMDB foi retirar\nas duas pré-candidaturas e lançar o nome de Djalma Falcão. Após essa\ndecisão, deixou o PMDB e participou na reestruturação do Partido\nSocialista Brasileiro (PSB), do qual se tornou vice-presidente nacional.\n\nNas eleições de novembro de 1986, candidatou-se ao governo de Alagoas na\nlegenda do PSB, ficando em terceiro lugar. Dedicou-se então à direção do\njornal *A Tribuna*, que pertencia à família de Teotônio Vilela. No\npleito de novembro de 1988, elegeu-se vereador de Maceió na legenda do\nPSB. Conquistou a vaga por apenas um voto. Em 1990, disputou uma vaga na\nAssembleia Legislativa e obteve menos de 500 votos. Em outubro de 1992\nelegeu-se prefeito de Maceió e, nesse cargo, presidiu a Associação dos\nMunicípios Alagoanos (AMA). Em julho de 1995 tornou-se vice-presidente\nda Confederação dos Municípios e, em março do ano seguinte, coordenador\nda Frente Nacional de Prefeitos.\n\n                Nas eleições municipais de outubro de 1996, apoiou a\ncandidatura de Kátia Born à prefeitura de Maceió. Deixou a prefeitura em\njaneiro de 1997, com 91% de aprovação popular, e anunciou sua\ncandidatura ao governo do estado nas eleições seguintes. Ainda em 1997,\nprestou consultoria para o Banco Interamericano de Desenvolvimento\n(BID), em Washington, a convite do presidente da instituição, Enrique\nIglesias.\n\nRetornou ao Brasil e nas eleições de outubro de 1998 concorreu ao\ngoverno de Alagoas. Eleito no primeiro turno, tomou posse em janeiro de\n1999. Enfrentou ameaças de *impeachment*e pedidos de intervenção do\ngoverno federal devido à questão dos precatórios, criou o Conselho de\nSegurança e Cidadania e extinguiu a Secretaria de Segurança Pública,\ntransferindo suas atribuições para a Secretaria de Defesa Social,\nchefiada por um membro do Ministério Público. Reelegeu-se em outubro de\n2002, novamente no primeiro turno, e foi empossado em janeiro seguinte.\nEm 2005, filiou-se ao Partido Democrático Trabalhista (PDT).\n\nEm abril de 2006 renunciou ao governo do estado e em outubro disputou\numa cadeira no Senado por Alagoas na legenda pedetista, mas não foi\neleito. Nesse mesmo ano, foi condenado pelo Tribunal Superior Eleitoral\n(TSE) a três anos de inelegibilidade por abuso de poder político e de\nautoridade praticados nas eleições municipais de outubro de 2004. Com a\nnomeação do presidente do PDT, Carlos Lupi, para ministro do Trabalho em\nabril de 2007, assumiu o cargo de secretário-executivo desse ministério.\nPermaneceu na pasta até março seguinte, quando passou a exercer a função\nde assessor especial de Lupi.\n\nCasou-se com Gisele Maria Lessa, com quem teve uma filha.\n\n                Publicou *Alagoas para todos* (1997) e *Cor**agem para\nsonhar e vencer*(2002).\n\n \n\n*Alexandra Toste*\n\n \n\n**FONTES**: CIPOLA, A. *Coragem para sonhar e fazer*; *Estado de\nS.Paulo* (online) 21 out. e 07 nov. 2008. Disponível em :\n\\<[http://www.estadao.com.br](http://www.estadao.com.br/)\\>. Acesso em :\n15 nov. 2009; *Folha de S. Paulo* (6/3/08); *Folha de S.Paulo* (online)\n09 ago. 2006; 06 mar. e 26 abr. 2007; 05 set., 04,07 nov. e 12 dez.\n2008. Disponível em : \\<[http://\nwww1.folha.uol.com.br](http://%20www1.folha.uol.com.br/)\\>. Acesso em :\n15 nov. 2009; *Globo* (6/9 e 12/12/08); INF. BIOG.; NÉRY, S. *A eleição\nda reeleição*; Portal TERRA – Notícias (eleições). Disponível em :\n\\<http://eleições.uol.com.br\\>. *Revista do CONFEA*(jul./set. 2003);\nWikipédia. Disponível em :\n\\<[http://pt.wikipedia.org](http://pt.wikipedia.org/)\\>. Acesso em : 15\nnov. 2009.\n\n \n\n \n\n \n\n \n\n \n\n \n\n \n\n \n\n \n\n \n","ref":"","dic":"DHBB"}
