{"title":"CARNEIRO, Oziel","cargoss":["Senador"],"cargos_esp":[0],"datas_ini":[1990],"datas_fim":[1992],"estados":["PA"],"autor":[0],"content":"**CARNEIRO, Oziel**\n\n\\*sen. PA 1990-1992.\n\n*Oziel Carneiro* nasceu em Boa Vista de Goiás, atual Tocantinópolis\n(TO), no dia 18 de fevereiro de 1932, filho de Pedro Carneiro de Morais\ne Luísa Rodrigues Carneiro. Seu pai foi senador pelo Pará de 1963 a 1966\ne em 1968, e deputado federal em 1971 e 1972. Seu irmão, Armando\nCarneiro, foi deputado federal pelo Pará (1959-1971).\n\nFormado pela Faculdade de Medicina da Universidade Federal do Pará, em\n1957, não chegou a exercer a profissão de médico. Jornalista, banqueiro,\nindustrial e pecuarista, ocupou, entre 1958 e 1961, a presidência da\nCompanhia Pires Carneiro S.A., fábrica de cimento com sede em Capanema\n(PA). No ano seguinte transferiu-se para Belém para assumir a\nvice-presidência e, posteriormente, a presidência do Banco Comercial do\nPará. Entre 1970 e 1974, foi diretor das carteiras de crédito geral do\nBanco do Brasil com alçada na 1ª Região Operacional, que englobava\nestados da Amazônia, do Nordeste e territórios federais. No mesmo\nperíodo, foi membro do conselho deliberativo da Superintendência do\nDesenvolvimento da Amazônia (Sudam).\n\nLigado a instituições financeiras e industriais, em 1973 foi\nrepresentante do ministro da Fazenda, Antônio Delfim Neto, no encontro\nde bancos estaduais realizado em Belém. Presidente do Banco da Amazônia\nentre março de 1979 e abril de 1981, acumulou, neste período, o conselho\ndiretor do Instituto Brasileiro de Mineração e a comissão consultiva\nbancária do Conselho Monetário Nacional (CMN). Em 1981 foi designado\nsecretário executivo do Conselho Interministerial do programa Grande\nCarajás.\n\nEm novembro de 1982, concorreu ao governo do Pará pelo Partido\nDemocrático Social (PDS), sendo derrotado pelo candidato do Partido do\nMovimento Democrático Brasileiro (PMDB), Jáder Barbalho. Suplente de\nJarbas Passarinho, eleito senador pelo PDS em novembro de 1986, Oziel\nCarneiro tornou-se presidente da Associação Comercial do Pará em 1988,\npermanecendo no cargo por dois anos. Em novembro de 1990, assumiu a vaga\nde Jarbas Passarinho no Senado, pois este último havia sido nomeado para\na pasta da Justiça pelo então presidente da República Fernando Collor de\nMelo (1990-1992). Oziel exerceu o mandato de senador até abril de 1992.\n\nEra presidente do PDS no momento de sua fusão com o Partido Democrata\nCristão (PDC), em abril de 1993, dando origem ao Partido Progressista\nReformador (PPR). Convidado, pouco depois, a ingressar no Partido Social\nCristão (PSC), acabou abandonando a vida pública, concentrando-se em\nsuas atividades de industrial.\n\nAssinou artigos na imprensa do Pará e do Amazonas e publicou, entre\noutros trabalhos, *Juta, o problema seria crédito? O Banco do Brasil e\nsuas dificuldades operacionais na Amazônia* (1971).\n\nCasou-se com Altair Lemos Carneiro, com quem teve três filhos.\n\nFONTES: INF. BIOG.; SENADO.*Dados*(1991).\n\n \n","ref":"FONTES: INF. BIOG.; SENADO.*Dados*(1991).\n\n \n","dic":"DHBB"}
