{"title":"LUÍS, André","cargoss":["Deputado federal"],"cargos_esp":[0],"datas_ini":[2003],"datas_fim":[2005],"estados":["RJ"],"autor":["Sabrina Guerghe"],"content":"**LUÍS, André**\n\n\\*dep. fed. RJ 2003-2005.\n\n*André Luís Lopes da Silva* nasceu na cidade do Rio de Janeiro, então\nDistrito Federal, no dia 4 de fevereiro de 1959, filho de Luís José da\nSilva e de Floripes Lopes da Silva.\n\nBacharelou-se em direito na Sociedade Unificada de Ensino Superior\nAugusto Mota (Suam), no Rio de Janeiro.\n\nIniciou sua vida pública como técnico legislativo da Câmara Municipal do\nRio de Janeiro. Em 1983, filiou-se ao Partido do Movimento Democrático\nBrasileiro (PMDB) e, no ano seguinte, tornou-se delegado do diretório\nnacional do partido, função que exerceu até 1985. De 1986 a 1988, foi\nmembro do diretório do PMDB Jovem e presidente do diretório zonal 24 do\npartido. Em 1988, ingressou no Partido Trabalhista Reformador (PTR),\nfundado por dissidentes do Partido Democrático Trabalhista (PDT) e do\nPMDB carioca.\n\nNo pleito desse ano elegeu-se vereador pela cidade do Rio de Janeiro.\nDurante o mandato integrou, como presidente, a Comissão de Indústria,\nComércio, Abastecimento e Pesca e a Comissão dos Servidores Públicos.\nAinda em 1988 foi designado vice-líder do PTR no Rio de Janeiro e\nmembro do diretório regional do partido, cargo que ocupou até 1993. No\núltimo ano de sua legislatura, em 1992, o PTR fundiu-se com o Partido\nSocial Trabalhista (PST), formando o Partido Progressista (PP).\n\nExerceu a vice-presidência do diretório regional do PP de 1993 a 1994,\nano em que foi escolhido presidente do Grêmio Recreativo Escola de Samba\n(Gres) Mocidade Independente de Padre Miguel, escola de samba carioca\nque teve como seu principal patrono o “bicheiro” Castor de Andrade,\nfalecido em 11 de março de 1997. Segundo a revista *Veja*, André Luís\nfora segurança de Castor.\n\nEm outubro de 1994, disputou uma vaga na Assembleia Legislativa do Rio\nde Janeiro na legenda do PP, obtendo uma suplência. No ano seguinte, o\nPP fundiu-se com o Partido Progressista Renovador (PPR) formando o\nPartido Progressista Brasileiro (PPB), ao qual se filiou.\n\nTomou posse como deputado estadual em 1997 e nesse mesmo ano voltou para\no PMDB e tornou-se vice-líder do partido. Ainda em 1997 foi\nvice-presidente do Colégio de Líderes e Vice-Líderes do PMDB Sudeste.\nNas eleições de outubro de 1998 elegeu-se deputado estadual pelo PMDB e,\nmais uma vez, foi designado delegado do diretório nacional do partido.\nAinda em 1998 foi vice-presidente do diretório regional e conselheiro de\ncontas da União Nacional dos Legislativos Estaduais (Unale), em\nBrasília. Integrou a Comissão de Constituição e Justiça, a Comissão de\nRedação e a Comissão de Transportes. Como vice-presidente do diretório\nregional, participou da Comissão de Direito do Consumidor e da Comissão\nde Obras Públicas, e presidiu a Comissão de Indicação Legislativa, a\nComissão de Minas e Energia e a Comissão de Orçamento, Finanças,\nTributação Financeira e Controle.\n\nNo pleito de 2002 elegeu-se deputado federal pelo PMDB com 91.249 votos\ne, no ano seguinte, assumiu a vice-liderança do partido. Na Câmara dos\nDeputados foi vice-presidente das comissões permanentes de Fiscalização\nFinanceira e Controle, e de Legislação Participativa. Integrou também,\ncomo titular, a Comissão de Direitos Humanos.\n\nEm fevereiro de 2004, o assessor da Casa Civil Waldomiro Diniz foi\ndemitido pelo governo federal após a divulgação de uma gravação feita em\n2002, em que aparece negociando propina com o “bicheiro” e empresário de\njogos, Carlos Augusto Ramos, conhecido como Carlinhos Cachoeira, para a\ncampanha eleitoral do Partido dos Trabalhadores (PT). Antes de ocupar a\nsubchefia da Casa Civil, Diniz fora presidente da Loteria do Estado do\nRio (Loterj), de fevereiro de 2001 a dezembro de 2002, nos governos de\nAnthony Garotinho e Benedita da Silva. Esses acontecimentos levaram a\nAssembleia Legislativa a instalar uma Comissão Parlamentar de Inquérito\n(CPI) da Loterj. Em outubro de 2004, a revista *Veja* publicou gravações\nem que André Luís pedia quatro milhões de reais ao publicitário\nAlexandre Chaves, sócio de Carlinhos Cachoeira, para o pagamento de 40\ndeputados estaduais do Rio com o objetivo de retirar o nome de Cachoeira\nda lista de indiciados no relatório da CPI da Loterj.\n\nApós as denúncias publicadas pela imprensa, a Corregedoria da Câmara\nabriu um processo de investigação contra ele. Ainda em outubro, a\ninvestigação da Casa solicitou um laudo ao perito Ricardo Molina, da\nUniversidade de Campinas (Unicamp), que confirmou a autenticidade de sua\nvoz nas gravações com as supostas tentativas de extorsão. Em novas\ngravações divulgadas pelo *Programa**Fantástico*, da Rede Globo,\nconfessou o assassinato de oito pessoas Os trechos dessas gravações\nforam publicados na revista *Veja*.\n\nNa época, sofreu um acidente de automóvel e não apresentou sua defesa,\nnem prestou depoimento. Com isso, alegou sistematicamente cerceamento ao\namplo direito de defesa. A Mesa diretora da Câmara, contudo, acatou o\nparecer da relatora do processo de cassação, deputada Iriny Lopes, que\nalegou quebra de decoro parlamentar  e encaminhou o caso para o Conselho\nde Ética, para que este deliberasse sobre a cassação ou não de seu\nmandato. No dia 16 de novembro de 2004, encaminhou uma carta ao PMDB\npedindo seu afastamento até que as investigações fossem concluídas. A\ncarta foi apresentada justamente no momento em que o partido estudava\nsua expulsão. Em votação secreta, o plenário da Câmara cassou, em maio\nde 2005, seu mandato, com 311 votos favoráveis, 104 contra, 33\nabstenções e três votos em branco. Com isso, ficou também inelegível até\n2015. Em seu lugar assumiu Márcio Fortes. Antes de ser cassado, foi\nexpulso do partido. Essa foi a primeira cassação do mandato de um\ndeputado após a criação do Conselho de Ética e Decoro Parlamentar, em\noutubro de 2001.\n\nCasou-se com Eliana Marta Ribeiro da Silva, conhecida como vereadora\nEliana Ribeiro.\n\n*Sabrina Guerghe*\n\nFONTES: Câmara dos Deputados; Agência Estado (10/8/2004, 5/5/2005); *O\nNorte Online* (26/10/2004); Redação Terra (14/11/2004); *Folha Online*\n(16/11/2004, 8/3/2005); revista *Veja* (17/11/2004); Consultor Jurídico\n– Conjur (24/11/2004); revista *Época*(6/5/2005); Agência Senado\n(13/5/2005); TSE (Eleições 1994, 2002); site do PP; *Expresso da\nNot**ícia* (4/7/2005).\n\n","ref":"FONTES: Câmara dos Deputados; Agência Estado (10/8/2004, 5/5/2005); *O\nNorte Online* (26/10/2004); Redação Terra (14/11/2004); *Folha Online*\n(16/11/2004, 8/3/2005); revista *Veja* (17/11/2004); Consultor Jurídico\n– Conjur (24/11/2004); revista *Época*(6/5/2005); Agência Senado\n(13/5/2005); TSE (Eleições 1994, 2002); site do PP; *Expresso da\nNot**ícia* (4/7/2005).\n\n","dic":"DHBB"}
