{"title":"MAGALHÃES, Juraci","cargoss":["Prefeito","Prefeito"],"cargos_esp":["Fortaleza","Fortaleza"],"datas_ini":[1997,1990],"datas_fim":[2004,1992],"estados":[0,0],"autor":[0],"content":"**MAGALHÃES, Juraci**\n\n\\* pref. Fortaleza 1990-1992 e 1997-2004.\n\n* *\n\n*Juraci Vieira de Magalhães*nasceu em Senador Pompeu (CE)**no dia 20 de\nsetembro de 1931, filho de Antonio Ferreira de Magalhães.\n\nNo final da década de 1940, transferiu-se para Recife, onde cursou a\nFaculdade de Medicina e especializaou-se em dermatologia. De volta ao\nCeará, em 1966 filiou-se ao Movimento Democrático Brasileiro (MDB),\npartido de oposição ao regime militar instalado no país em 1964, onde\nexerceu funções administrativas antes de se candidatar a um cargo\neletivo.\n\nEm 1974, atuou como coordenador da campanha vitoriosa de Mauro Benevides\nao Senado Federal.  Em 1986, coordenou a campanha do então peemedebista\nTasso Jereissati, eleito em primeiro turno para o governo do estado\ncearense, com 52,32% dos votos. No ano de 1988, tornou-se\nsuperintendente do extinto Instituto Nacional da Previdência Social\n(INPS). Nesse mesmo ano, concorreu como candidato a vice-prefeito de\nFortaleza na chapa de Ciro Gomes, eleito para governar a capital\ncearense nas eleições municipais de novembro.\n\nNo decorrer de 1990, assumiu em definitivo a prefeitura fortalezense,\nquando Ciro Gomes solicitou renúncia do cargo para concorrer ao governo\nestadual. No decorrer de sua primeira gestão, Juraci Magalhães\nempreendeu uma série de grandes obras, aspecto que caracterizou sua\ntrajetória política. Com o término de seu mandato e a opção pelo retorno\nàs atividades médicas, apoiou a vitoriosa candidatura de seu\nex-secretário de finanças, o peemedebista Antonio Cambraia, eleito\nprefeito de Fortaleza no pleito eleitoral de 1992.\n\nNas eleições gerais de outubro de 1994, voltou ao cenário político como\ncandidato ao governo do estado do Ceará. Naquela ocasião, obteve 28,79%\ndos votos, tendo sido derrotado por Tasso Jereissati, escolhido por\n43,80% dos eleitores. No pleito eleitoral de 1996, concorreu como\ncandidato à prefeitura de Fortaleza, sendo novamente eleito, ainda no\nprimeiro turno, com 520.074 votos, correspondentes a 63% do eleitorado.\n\nEm janeiro de 1997, tomou posse de seu segundo mandato como prefeito da\ncapital cearense. Além das obras que caracterizaram sua maneira de atuar\nna política, no decorrer de sua segunda administração, Juraci Magalhães\nempreendeu medidas que visavam a qualificação de mão-de-obra e geração\nde emprego e renda, além da expansão de micro e pequenas empresas.\n\nNo pleito eleitoral realizado em outubro de 2000, concorreu à reeleição\ne obteve 306.643 votos, contra 282.094 votos obtidos por Inácio Arruda,\ndo Partido Comunista do Brasil (PC do B), contra quem disputou e venceu\no segundo turno das eleições municipais, com 512.655 votos,\ncorrespondentes a 53,97% do eleitorado fortalezense. Em janeiro de 2001,\ntomou posse de sua terceira gestão frente à prefeitura. No decorrer\ndesse mandato, recebeu duras acusações de corrupção que acabaram por\ndesgastar sua popularidade e aumentar o índice de rejeição referente à\nsua administração.\n\nEm 2005, tornou-se filiado ao Partido da República (PR), legenda pela\nqual disputou uma vaga na Câmara dos Deputados nas eleições realizadas\nem outubro de 2006. Nessa ocasião, foi votado por 31.226 eleitores, que\nlhe garantiram a segunda suplência.\n\nAo longo de sua trajetória profissional, Juraci Magalhães exerceu também\no cargo de médico do Instituto da Aposentadoria e Pensão dos\nComerciários (IAPC). No decorrer dos 39 anos que manteve-se filiado ao\nPMDB, foi eleito presidente da legenda em Fortaleza.\n\nFaleceu em Fortaleza, no dia 21 de janeiro de 2009.\n\nCasou-se com Zenaide Magalhães, com quem teve dois filhos.\n\n \n\n*Luciana Pinheiro*\n\n \n\nFONTES: Portal do Jornal Diário do Nordeste\n([http://diariodonordeste.globo.com/](http://diariodonordeste.globo.com/);\nacessado em 19/06/2009); Portal do Jornal *Folha de São\nPaulo*([http://www.folha.uol.com.br/](http://www.folha.uol.com.br/);\nacessado em 17/06/2009); Portal do Jornal *O\nPovo*([http://www.opovo.com.br/](http://www.opovo.com.br/); acessado em\n19/06/2009); Portal do Jornal *A\ntarde*([http://www.atarde.com.br/](http://www.atarde.com.br/); acessado\nem 19.06.2009);  Portal do Tribunal Regional Eleitoral do Ceará\n([http://www.tre-ce.gov.br/](http://www.tre-ce.gov.br/); acessado em\n16/06/2009).\n","ref":"FONTES: Portal do Jornal Diário do Nordeste\n([http://diariodonordeste.globo.com/](http://diariodonordeste.globo.com/);\nacessado em 19/06/2009); Portal do Jornal *Folha de São\nPaulo*([http://www.folha.uol.com.br/](http://www.folha.uol.com.br/);\nacessado em 17/06/2009); Portal do Jornal *O\nPovo*([http://www.opovo.com.br/](http://www.opovo.com.br/); acessado em\n19/06/2009); Portal do Jornal *A\ntarde*([http://www.atarde.com.br/](http://www.atarde.com.br/); acessado\nem 19.06.2009);  Portal do Tribunal Regional Eleitoral do Ceará\n([http://www.tre-ce.gov.br/](http://www.tre-ce.gov.br/); acessado em\n16/06/2009).\n","dic":"DHBB"}
