{"title":"MARINHO, Luís","cargoss":["Presidente de associação ou confederação de empregados ou empregadores","Ministro do Trabalho","min Prev Soc"],"cargos_esp":["CUT",0,0],"datas_ini":[2003,2005,2007],"datas_fim":[2003,2007,2008],"estados":[0,0,0],"content":"**MARINHO, Luís**\n\n\\* pres. CUT 2003; min. Trab. 2005-2007; min. Prev. Soc. 2007-2008.\n\n*Luís Marinho*nasceu em Cosmorama (SP) no dia 20 de maio de 1959, filho\nde Lourenço Marinho e de Maximina da Silva Marinho.\n\nPassou a infância em Santa Rita d’Oeste (SP) e foi trabalhador rural no\nsítio de seu pai até 1975, quando a família se mudou para a cidade de\nSão Paulo. Em 1978 começou a trabalhar como metalúrgico na fábrica da\nVolkswagen, em São Bernardo do Campo (SP), e participou dos movimentos\ngrevistas ocorridos na época na região industrial do ABC paulista ao\nlado de Luís Inácio Lula da Silva, então presidente do Sindicato dos\nMetalúrgicos do ABC.\n\nEm 1980, foi um dos fundadores do Partido dos Trabalhadores (PT). Dois\nanos depois, iniciou sua trajetória de líder sindical ao ser escolhido\nrepresentante dos trabalhadores na Comissão Interna de Prevenção de\nAcidentes (Cipa) da Volkswagen. Em 1984 foi eleito tesoureiro do\nSindicato dos Metalúrgicos do ABC, e de 1990 a 1993 foi secretário-geral\nda entidade. Eleito vice-presidente para o período de 1993 a 1996, na\nchapa encabeçada por Vicentinho, assumiu a presidência do Sindicato dos\nMetalúrgicos do ABC em 1994, com a eleição de Vicentinho para a\npresidência da Central Única dos Trabalhadores (CUT). Foi reeleito em\n1996, 1999 e 2002.\n\nDurante suas gestões, o sindicato enfrentou as consequências da política\neconômica do governo de Fernando Henrique Cardoso (1995-2002) e a\nconjuntura internacional de reestruturação do trabalho. O combate à\ninflação e os altos índices de desemprego provocados pela política\ngovernamental deram pouca margem para a negociação salarial. Além disso,\nfoi um período de redução de poder de iniciativa do movimento sindical\nbrasileiro, em razão da reestruturação por que passava o setor\nindustrial, necessitando de menos mão de obra e sofrendo a saída de\ndiversas empresas da região do ABC para outras regiões que ofereciam\nisenções fiscais e trabalhadores com menor nível de sindicalização.\nNesse período, o Sindicato dos Metalúrgicos realizou o Ato em Defesa do\nEmprego e Salário em 1997, a Maratona em Defesa do Emprego em 1998, além\nde apresentar propostas como a do acordo emergencial do setor\nautomotivo, que entrou em vigor em março de 1999, a de redução da\njornada de trabalho, e as dos acordos na Volks e Ford que garantiriam\naos trabalhadores emprego até 2006. Outro desafio foram as disputas\ninternas com os ex-diretores do Sindicato dos Metalúrgicos de Santo\nAndré, que tentaram romper a unificação do sindicato.\n\nAinda em 1999, prestou vestibular para economia e direito, passando no\nsegundo. No ano seguinte, ingressou no curso de direito da Universidade\nBandeirantes (Uniban), que concluiria em 2004.\n\nLicenciado da presidência do sindicato, em outubro de 2002 concorreu a\nvice-governador de São Paulo na chapa encabeçada por José Genoíno. No\nprimeiro turno Genoíno recebeu 6.361.747 votos, ou 32,44% dos votos\nválidos, ocupando a segunda posição e passando à disputa com Geraldo\nAlckmin, do Partido da Social Democracia Brasileira (PSDB), que venceu o\nsegundo turno.\n\nEm fevereiro de 2003, foi escolhido pelo presidente da República Luís\nInácio Lula da Silva, que havia tomado posse em janeiro, para compor o\nquadro de representantes da sociedade civil no Conselho de\nDesenvolvimento Econômico e Social (CDES) e para assumir a presidência\ndo Conselho Nacional de Segurança Alimentar (Consea), órgão consultivo\ndo programa de segurança alimentar Fome Zero, no qual permaneceu até\nmaio de 2004.\n\nEm junho de 2003 foi eleito presidente da CUT, a principal central\nsindical do país, deixando assim a direção do Sindicato dos Metalúrgicos\ndo ABC. À frente da CUT, propôs acordos coletivos entre o governo, os\nempresários e os trabalhadores, o que foi entendido tanto por apoiadores\nquanto por críticos da proposta como uma modalidade de “pacto social”.\nParticipou de negociações voltadas para a obtenção de crédito consignado\npara os trabalhadores, expandiu a área de atuação da CUT ao firmar\nconvênio com a Uniban, para que os sócios de sindicatos a ela ligados\ntivessem desconto na mensalidade, e defendeu as propostas de reformas\nconstitucionais encaminhadas pelo governo Lula ao Congresso Nacional.\n\n \n\nMinistro do governo Lula\n\n \n\nEm 8 de julho de 2005 foi convidado pelo presidente Lula para ocupar o\ncargo de ministro do Trabalho, em substituição a Ricardo Berzoini. O\nconvite se deu em um momento de crise política, em que membros do\ngoverno Lula eram acusados de pagar mesadas a parlamentares para que\nfossem aprovados projetos e emendas de interesse do governo. Marinho\ndeclarou ter sido “convocado” pelo presidente da República, e aceitou\nimediatamente a incumbência por considerar-se “um soldado” no projeto do\ngoverno e de seu partido. Foi empossado no dia 12 daquele mês. No\nMinistério do Trabalho, procurou dar continuidade à administração de seu\nantecessor, mas com maior ênfase na valorização do salário mínimo. Nesse\nsentido, iniciou uma negociação entre setores da sociedade e do governo.\nComo resultado dessa negociação houve um aumento real do salário mínimo\nem abril de 2006, fato que se repetiu nos anos seguintes.\n\nCom a reeleição de Lula em 2006, surgiu a necessidade de reformas\nministeriais para acomodar os novos partidos que haviam entrado na base\nde sustentação do governo. Inicialmente não foi cogitada mudança no\nMinistério do Trabalho, mas o Partido Democrático Trabalhista (PDT)\nacabou ficando responsável pela pasta, e Marinho foi nomeado para o\nMinistério da Previdência Social. Empossado na Previdência no dia 29 de\nmarço de 2007, foi substituído no Ministério do Trabalho pelo presidente\nnacional do PDT, Carlos Lupi. Por ocasião das negociações da reforma\nministerial, o presidente Lula justificou que teria sido “muito\ncomplicado” para alguém que não fosse do PT discutir temas relativos à\nreforma da previdência. Além disso, Lupi declarara-se contrário a\nqualquer reforma nessa área.\n\nAo tomar posse no Ministério da Previdência, defendeu a tese de que\neventuais reformas não deveriam atingir quem já estivesse trabalhando.\nOu seja, afirmou que mudanças nas regras só poderiam ser impostas a quem\nentrasse no mercado de trabalho a partir de então, transferindo para um\nprazo mais longo os efeitos práticos de possíveis reformas. Durante seu\nperíodo à frente do ministério, discutiu-se através do Fórum Nacional da\nPrevidência, integrado por empresários, trabalhadores e governo federal,\numa eventual reforma previdenciária focada em uma perspectiva de longo\nprazo. No entanto, o Fórum encerrou suas atividades sem propor\nefetivamente reformas no setor. Por fim, reformas imediatas foram\ndescartadas, alegando-se que elas não seriam imprescindíveis enquanto se\nmantivesse a conjunção de fatores caracterizada por população em\nexpansão aliada a crescimento econômico e aumento de arrecadação do\ngoverno federal. Em sua administração foi desenvolvido um novo modelo de\ngestão previdenciária, investindo-se na melhoria e maior agilidade de\nseu funcionamento e no combate à fraude. Investiu-se também na reforma e\nconstrução de agências do Instituto Nacional de Seguridade Social (INSS)\ne na capacitação dos servidores do ministério, visando a melhorar a\nqualidade do atendimento.\n\nEm 2008, desincompatibilizou-se do cargo de ministro para candidatar-se\nà prefeitura de São Bernardo do Campo na legenda do PT. Durante a\ncampanha, contou com o apoio do presidente Lula e fez uma ampla\ncoligação com dez legendas. Na eleição de outubro, obteve a primeira\ncolocação, com 194.966 votos, ou 48,27% dos votos válidos. No segundo\nturno conquistou 237.617 votos ou 58,19% dos votos válidos, derrotando o\nadversário Orlando Morando Júnior, do PSDB. Sua vitória foi uma\nconquista para o PT, que desde a década de 1980 não ganhava a prefeitura\nde São Bernardo do Campo, apesar de ser o local da residência de Lula,\npalco das greves mais importantes da história sindical do país na década\nde 1970, um dos celeiros da criação do PT e do Sindicato dos\nMetalúrgicos do ABC, e o reduto mais importante da CUT.  Tomou posse em\n1º de janeiro de 2009.\n\nFoi ainda coordenador do Movimento de Alfabetização Regional ABC (Mova),\npresidente de honra da União e Solidariedade das Cooperativas do Estado\nde São Paulo (Unisol) e um dos idealizadores da Câmara Regional do ABC.\n\nCasou-se com Nilza de Oliveira, com quem teve dois filhos.\n\nFabricio Pereira da Silva\n\n \n\n**FONTES**: Agência Brasil (29/3/07). Disponível em :\n\\<[http://www.agenciabrasil.gov.br/noticias/\n2007/03/29/materia.2007-03-29.6571849311/view](http://www.agenciabrasil.gov.br/noticias/%202007/03/29/materia.2007-03-29.6571849311/view)\\>.\nAcesso em : 20 set. 2009; *Época* (online) 22 jan. 2009. Disponível em :\n\\<[http://revistaepoca.globo.com/Revista/Epoca/0,,EMI24893-15\n223,00-FILHOS+DE+LULA+ARRANJAM+EMPREGO+EM+PREFEITURAS.html](http://revistaepoca.globo.com/Revista/Epoca/0,,EMI24893-15%20223,00-FILHOS+DE+LULA+ARRANJAM+EMPREGO+EM+PREFEITURAS.html)\\>.\nAcesso em : 20 set. 2009;*****Estado de S. Paulo*****(1/12/02;\n26/10/08);*****Folha de S.Paulo*****(8, 9/7/05; 30/3/07; 1/1/09);**\nPortal ABC de Luta. Disponível em :\n\\<[http://www.abcdeluta.org.br](http://www.abcdeluta.org.br/)\\>. Acesso\nem : 20 set. 2009; Portal FETECSP (4/12/03). Disponível em :\n\\<[http://www.fetecsp.org.br/index2.\nphp?option=com\\_content&do\\_pdf=1&id=17734](http://www.fetecsp.org.br/index2.%20php?option=com_content&do_pdf=1&id=17734)\\>.\nAcesso em : 20 set. 2009.****\n","ref":"","dic":"DHBB"}
