{"title":"MEIRELES, José","cargoss":["Prefeito"],"cargos_esp":["Cuiabá"],"datas_ini":[1994],"datas_fim":[1996],"estados":[0],"autor":[0],"content":"**MEIRELES, José**\n\n\\*militar; pref. Cuiabá 1994-1996.\n\n \n\n                *José Mauro Meireles* nasceu no município de Conselheiro\nLafaiete (MG) no dia 27 de março de 1923.\n\n                Cursou a Academia Militar das Agulhas Negras (Aman) em\nResende (RJ), e foi declarado aspirante a oficial da arma de engenharia\nem dezembro de 1946. Em junho do ano seguinte foi promovido a\nsegundo-tenente, em junho de 1949 a primeiro-tenente, em abril de 1952 a\ncapitão, em agosto de 1957 a major e em abril de 1966 a tenente-coronel.\n**Comandou o 2º Batalhão de Engenharia de Combate, sediado em\nPindamonhangaba (SP), no vale do Paraíba, de 1969 a 1971.****Em 1973,\npromovido a coronel,  comandou o 9º Batalhão de Engenharia de\nConstrução, sediado em Cuiabá, cuja missão era  construir a rodovia\nBR-163 (Cuiabá/Santarém) no trecho da Amazônia mato-grossense**. Por sua\natuação nessa obra, ficou conhecido como o “Pai da Cuiabá-Santarém”.\n**Foi** **instrutor da Aman, da Escola de Aperfeiçoamento de Oficiais e\nda Escola de Comando e de Estado-Maior do Exército.**\n\nEm 1992, foi vice-prefeito de Cuiabá no governo Dante de Oliveira,\nindicado pelo Partido da Social Democracia Brasileira (PSDB). Em 1994,\nassumiu a prefeitura por mais dois anos, quando o prefeito se\ndesincompatibilizou para concorrer ao governo do estado. Durante sua\nadministração teve muitos problemas com a desordem nas finanças do\nmunicípio. Não concluiu o mandato, afastando-se por problemas de saúde,\ne a prefeitura ficou a cargo do presidente da Câmara dos\nVereadores, Carlos Brito. Não mais se dedicou à política partidária.\n\n**Foi ainda secretário Municipal do Bem-Estar Social de Cuiabá,\nsuperintendente regional da**Legião Brasileira de Assistência******(LBA)\nem Mato-Grosso e presidente da Organização das Cooperativas do Estado.**\n\nCasou-se com Zulmira Meireles, com quem teve **oito filhos, sendo a\natriz**Maria Elvira Meireles, mais conhecida como **Totia Meireles, uma\nde suas filhas. **\n\n \n\n*Sabrina Guerghe*\n\n \n\nFONTES: Prefeitura de Cuiabá (15/2/06); *Tribuna do Norte* (16/5/08);\nSócio Ambiental - http://www.socioambiental.org/esp/BR163 - (13/4/09);\nIntelog - http://www.intelog.net/newsletter/go.asp?cod=187963 –\n(1/2/09); Página pessoal: Blog do Meireles, *Almanaque do Exército*\n1975.\n\n \n\n \n","ref":"FONTES: Prefeitura de Cuiabá (15/2/06); *Tribuna do Norte* (16/5/08);\nSócio Ambiental - http://www.socioambiental.org/esp/BR163 - (13/4/09);\nIntelog - http://www.intelog.net/newsletter/go.asp?cod=187963 –\n(1/2/09); Página pessoal: Blog do Meireles, *Almanaque do Exército*\n1975.\n\n \n\n \n","dic":"DHBB"}
