{"title":"MENDES, Silvio","cargoss":["Prefeito"],"cargos_esp":["Teresina"],"datas_ini":[2005],"datas_fim":[0],"estados":[0],"autor":[0],"content":"**MENDES, Silvio**\n\n\\*pref. Teresina 2005-\n\n* *\n\n*Silvio Mendes de Oliveira Filho* nasceu em Campo Maior (PI) no dia 31\nde agosto de 1949.\n\nGraduou-se em medicina na Universidade Federal de Pernambuco (UFPE) em\n1974 e especializou-se em ortopedia na Universidade de São Paulo (USP).\n\nEntre 1994 e 2004, foi presidente da Fundação Municipal nas gestões dos\nprefeitos Wall Ferraz (1993/1995) e Chico Gerardo (1995/1996) e nos dois\nperíodos de Firmino Filho (1996/2004). Acumulou esse cargo com a\npresidência do Conselho Nacional de Secretários Municipais de Saúde em\n1997, em 2001 e em 2003. Nesse período, implantou o Programa Saúde da\nFamília em Teresina.\n\nFiliado ao Partido da Social Democracia Brasileira (PSDB), concorreu à\nprefeitura de Teresina no pleito de outubro de 2004, sendo eleito no\nsegundo turno com mais de duzentos mil votos. Assumiu o cargo em 1° de\njaneiro de 2005. Reeleito em 2008, foi empossado em 1º de janeiro de\n2009.\n\nAo longo de sua trajetória, trabalhou no Pronto-Socorro e Hospital\nGetúlio Vargas de Teresina, no Ministério da Saúde. Presidiu o Conselho\nMunicipal de Saúde e o Conselho de Secretários de Saúde do Piauí. Foi\nainda membro da Sociedade Brasileira de Ortopedia e Traumatologia e do\nConselho do Centenário da Organização Pan-americana de Saúde (Opas).\n\nCasado com a médica Maria Inês Queiroz Mendes, teve três filhos. \n\n \n\nFONTES: SITE DA PREFEITURA DE TERESINA;*Folha Online* (31/10/04);\n*g1.globo.com***(5/10/08).\n\n \n\n \n\n* * * * *\n","ref":"FONTES: SITE DA PREFEITURA DE TERESINA;*Folha Online* (31/10/04);\n*g1.globo.com***(5/10/08).\n\n \n\n \n\n* * * * *\n","dic":"DHBB"}
