{"title":"CARUSO, Jiulio","cargoss":["Deputado federal","Deputado federal"],"cargos_esp":[0,0],"datas_ini":[1984,1983],"datas_fim":[1984,0],"estados":["RJ","RJ"],"autor":[0],"content":"**CARUSO, Jiulio**\n\n\\*dep. fed. RJ 1983, 1984.\n\n \n\n*Jiulio Caruso* nasceu em Volta Redonda (RJ) no dia 29 de julho de 1949,\nfilho de Siciliano Caruso e de Carmine Caruso.\n\nDe 1969 a 1974 cursou a Faculdade de Medicina na Escola de Ciências\nMédicas de Volta Redonda, onde depois de formado foi\nprofessor-assistente da cadeira de higiene e saúde pública. Fez o curso\nbásico de saúde pública no Instituto Presidente Castelo Branco e, a\npartir de 1975, trabalhou como médico do Instituto Nacional de\nAssistência Médica da Previdência Social (Inamps) e da Prefeitura\nMunicipal de Volta Redonda, onde permaneceria até 1983.\n\nIniciou-se na vida pública sendo eleito vereador em Volta Redonda, em\nnovembro de 1976, na legenda do Movimento Democrático Brasileiro (MDB),\npartido de oposição ao regime militar instaurado no país em abril de\n1964. Alguns meses antes de completar dois anos de mandato no\nLegislativo municipal, concorreu, em novembro de 1978, a uma vaga na\nCâmara dos Deputados representando a agremiação oposicionista.\nMalsucedido em seu intento, permaneceu no MDB até novembro de 1979, data\nda extinção do bipartidarismo no Brasil. Com a posterior reorganização\npartidária, ingressou no Partido do Movimento Democrático Brasileiro\n(PMDB), sucessor de sua agremiação anterior.\n\nEm novembro de 1982, conseguiu sua eleição para deputado federal na\nlegenda do Partido Democrático Trabalhista (PDT), no qual havia\ningressado naquele ano. Assumindo o mandato em fevereiro de 1983,\ntornou-se membro da Comissão de Saúde da Câmara dos Deputados. Em\nagosto, solicitou licença do mandato para substituir José Colagrossi\nFilho como secretário de Transportes do estado do Rio de Janeiro no\nprimeiro governo Leonel Brizola (1983-1987). Permaneceu à frente dessa\npasta até setembro de 1984, quando foi substituído por Délio dos Santos,\nretornando então à Câmara.\n\nEm dezembro daquele ano, sofreu um grave acidente de carro em Minas\nGerais que o deixou em coma até 1º de novembro de 1989, quando faleceu.\n\nEra casado com Glória Caruso, com quem teve três filhos.\n\n \n\nFONTES: *Boletim da Câmara* (6 e 9); CÂM. DEP. *Deputados brasileiros.\nRepertório* (1983-1987); INF. Glória Caruso; *Jornal do Brasil*\n(30/8/83, 10/12/84).\n\n \n","ref":"FONTES: *Boletim da Câmara* (6 e 9); CÂM. DEP. *Deputados brasileiros.\nRepertório* (1983-1987); INF. Glória Caruso; *Jornal do Brasil*\n(30/8/83, 10/12/84).\n\n \n","dic":"DHBB"}
