{"title":"PAULO, João","cargoss":["Prefeito"],"cargos_esp":["Recife"],"datas_ini":[2001],"datas_fim":[2009],"estados":[0],"content":"**PAULO, João**\n\n\\* pref. Recife 2001-2009.\n\n \n\n*João**Paulo Lima**e Silva*nasceu em Olinda (PE) em 31 de outubro de\n1952, filho  de  Manoel Messias Lima e Silva e de  Maria de Lourdes Lima\ne Silva.\n\nIniciou sua atuação política em 1972, durante o período da ditadura\nmilitar, participando dos movimentos Juventude Católica Operária (JOC)\ne  Ação Católica Operária (ACO).\n\nEm 1978, incentivado por Paulo Freire, recebeu uma bolsa de estudos  e\nparticipou de cursos de capacitação em Política Sindical na França,\nItália, Bélgica, Espanha e Portugal.\n\nTeve uma rápida passagem pelo Partido Comunista Revolucionário (PCR),\ndissidência formada por um grupo de ex-militantes do Partido Comunista\ndo Brasil (PCdoB), do Nordeste, após uma cisão ocorrida em 1966, durante\no Regime Militar de 1964, e que se envolveu em ações extralegais contra\na ditadura em vigor à época, sendo fortemente reprimido pelos militares\nao longo da década de 1970.\n\nSua atuação no movimento sindicalo conduziu em 1979, à presidência do\nSindicato dos Metalúrgicos de Pernambuco, que possuía então cerca de 10\nmil filiados.\n\nEm 1980, já desligado do PCR, participou do processo de fundação do\nPartido dos Trabalhadores (PT) em Pernambuco. Foi também um dos\nfundadores da Central Única dos Trabalhadores (CUT), tendo ocupado o\ncargo de primeiro presidente da entidade em seu estado no ano de 1983.\n\nEm 1986, depois de ter sido eleito presidente da Associação de Moradores\ndo Ibura, bairro onde constituiu parte de sua trajetória de militância,\ndecidiu disputar as eleições e candidatou-se a uma vaga para a\nAssembléia Legislativa pela legenda do PT, mas não conseguiu se eleger.\n\nNo pleito de 1988, foi eleito o primeiro vereador do PT no Recife, com\n2.723 votos. Dois anos depois, em 1990, disputou novamente as eleições\npara a Assembléia Legislativa e dessa vez elegeu-se deputado estadual\npela legenda do PT com 11 mil votos.\n\nEm outubro de 1992 disputou sua primeira eleição para o Executivo\ncandidatando-se a prefeito de Jaboatão dos Guararapes, região\nmetropolitana do Recife, mas não teve sucesso.\n\nNo pleito de 1994, João Paulo reelegeu-se deputado estadual pelo PT com\ncerca de 50 mil votos. Dois anos depois, em 1996, candidatou-se pela\nprimeira vez à prefeitura do Recife, obtendo 105 mil votos. Perdeu a\ndisputa, porém, para o candidato do Partido da Frente Liberal (PFL),\nRoberto Magalhães, ficando em terceiro lugar.\n\nEm 1998, João Paulo foi reeleito pela terceira vez deputado estadual,\nultrapassando 50 mil votos..\n\nNo pleito de 2000, candidatou-se novamente à prefeitura pela “Frente de\nEsquerda do Recife”, que além do PT reunia outras nove legendas, tendo\ncomo seu vice o médico Luciano Siqueira (PCdoB). Apoiado, no segundo\nturno, também pelo Partido Socialista Brasieliro (PSB), de Miguel\nArrais, pelo Partido Popular Socialista (PPS), e pelo Partido\nDemocrático Trabalhista (PDT), João Paulo derrotou o então prefeito\nRoberto Magalhães (1997-2001), que tentava a reeleição, apoiado então\npelo governador de Pernambuco, Jarbas Vasconcelos (1999-2006), do\nPartido do Movimento Demopcrático Brasileiro (PMDB), e pelo então\nvice-presidente da República Marco Maciel (1995-2002). Sua vitória foi\numa das maiores surpresas das eleições de 2000 em todo o país. A\ndiferença entre os candidatos foi de apenas 5.835 votos, ou seja, 0,76%\ndos votos válidos.\n\nEm 2004, reelegeu-se prefeito do Recife, dessa vez vencendo a disputa\nlogo no primeiro turno com 56,11% dos votos válidos e vitorioso em todas\nas zonas eleitorais da cidade.\n\nNas eleições municipais de 2008, deixando a prefeitura, conseguiu eleger\nseu sucessor, João da Costa (PT). \n\nEm 2005 foi eleito presidente da Frente Nacional dos Prefeitos (FNP),\ncargo para o qual seria reeleito em 2007.\n\nFormou-se em Edificações e Mecânica pela Escola Técnica Estadual\nProfessor Agamenon Magalhães (Etepam) e ingressou no curso de Economia\nda Faculdade Boa Viagem, em Recife.\n\nCasou-se com Luzia Jeanne, com quem teve três filhos.\n\n \n\n**FONTES**: Congresso em Foco. Disponível em :\n\\<[http://congressoemfoco.ig.com.br/\nDetQuestaodefoco.aspx?id=10](http://congressoemfoco.ig.com.br/%20DetQuestaodefoco.aspx?id=10)\\>.\nAcesso em : 13 jan. 2009; Portal da Câmara dos Deputados. Disponível em\n: \\<http://[www.camara.gov.br](http://www.camara.gov.br/)\\>. Acesso em\n10 jan. 2009; Portal da Prefeitura do Recife. Disponível em :\n\\<http://[www.recife.pe.gov.br/pr/\nprefeito\\_biografia.php](http://www.recife.pe.gov.br/pr/%20prefeito_biografia.php)\\>.\nAcesso em : 13 jan. 2009; Portal FNP - Frente Nacional dos Prefeitos.\nDisponível em : \\<http://[www.fnp.org.br](http://www.fnp.org.br/)\\>.\nAcesso em : 14 jan. 2009; Portal Sebrae (10 abr. 2007). Disponível em :\n\\<http://[www.agenciasebrae.com.br](http://www.agenciasebrae.com.br/)\\>.\nAcesso em: 13 jan. 2009; Portal Último Segundo (7/10/08). Disponível em\n: \\<http://[www. ultimosegun\ndo.ig.com.br](http://www.ultimosegun%20do.ig.com.br/)\\>. Acesso em : 13\njan. 2009; UOL Eleições 2004. Disponível em :\n\\<[http://noticias.uol.com.br/ultnot/eleicoes/eleito/recife.jhtm](http://noticias.uol.com.br/ultnot/eleicoes/eleito/recife.jhtm)\\>.\nAcesso em : 13 jan. 2009; *Veja* (online) 13 dez. 2000. Disponível em :\n\\<[http://veja.abril.com.br](http://veja.abril.com.br/)\\>. Acesso em :\n13 jan. 2009.\n\n \n\n \n\n \n\n \n\n \n\n \n\n \n\n \n\n \n\n \n\n \n","ref":"","dic":"DHBB"}
