{"title":"CARVALHO FILHO, Joaquim Inácio de","cargoss":["Senador"],"cargos_esp":[0],"datas_ini":[1935],"datas_fim":[1937],"estados":["RN"],"autor":[0],"content":"**CARVALHO FILHO, Joaquim Inácio de**\n\n\\*magistrado; sen. RN 1935-1937.\n\n \n\n*Joaquim Inácio de Carvalho Filho* nasceu em Imperatriz (RN), atual\nmunicípio de Martins, no dia 6 de fevereiro de 1888,****filho de Joaquim\nInácio de Carvalho e de Maria Gomes de Oliveira Carvalho.\n\nFez os estudos iniciais na escola pública de sua cidade, cursando depois\no Colégio 7 de Setembro, em Moçoró (RN), e o Colégio Ateneu, em Natal.\nMudando-se para Pernambuco, ingressou na Faculdade de Direito de Recife,\npela qual se bacharelou em 1908.\n\nDe volta ao Rio Grande do Norte, assumiu a direção do Grupo Escolar\nAlmino Afonso, em Martins, e nessa mesma cidade iniciou sua atividade\nprofissional como advogado. Entre 1909 e 1911, colaborou com o periódico\n*O Martins,*publicado em Natal, escrevendo artigos sobre a seca. Exerceu\no mandato de deputado estadual de 1913 a 1915 e de 1916 a 1917, e foi em\nseguida designado promotor público na comarca de Açu, tornando-se depois\njuiz distrital no município de Jardim do Seridó. Durante alguns meses do\nano de 1918, no governo de Joaquim Ferreira Chaves (1914-1920), ocupou a\nsecretaria geral do estado do Rio Grande do Norte, até o momento em que\nfoi nomeado juiz de direito na comarca de Caicó, de onde foi removido em\nfevereiro de 1924 para a comarca de Canguaretama, reinstalada por ele\nnessa ocasião.\n\nLogo após a reforma administrativa promovida em julho de 1924 pelo\ngoverno de José Augusto Bezerra de Medeiros, assumiu a direção do\nDepartamento de Fazenda e Tesouro, função que exerceu até 1927. Ainda\nnesse ano, participou das diligências realizadas contra a invasão da\ncidade de Apodi e de localidades vizinhas por um grupo de cangaceiros, e\nno mês de dezembro tornou-se desembargador do Tribunal de Justiça. Em\njaneiro do ano seguinte, foi colocado em disponibilidade para assumir a\nvice-presidência do estado, no governo de Juvenal Lamartine de Faria. No\nexercício dessas funções, chegou a ocupar interinamente a chefia do\ngoverno de abril a junho de 1928, de setembro a dezembro de 1929 e de\njunho a julho de 1930, tendo publicado nesse período artigos sobre\nquestões administrativas nos jornais da capital. Deixou a\nvice-presidência do estado deposto pelo movimento revolucionário de\noutubro de 1930.\n\nCom a reconstitucionalização do país em 1934, e já instaladas as\nconstituintes estaduais, em outubro de 1935 foi eleito senador pela\nAssembléia Constituinte do Rio Grande do Norte na legenda do Partido\nPopular. Assumindo o mandato no mês seguinte, permaneceu no Senado\nFederal até novembro de 1937, quando o advento do Estado Novo suprimiu\nos órgãos legislativos do país. No período de ditadura que se seguiu,\nfoi presidente do Conselho Administrativo de seu estado, prefeito de\nNatal e prefeito de Martins, aí dedicando-se também às atividades\nrurais.\n\nPertenceu a diversas instituições culturais e sociais, entre elas o\nInstituto Histórico e Geográfico do Rio Grande do Norte.\n\nFaleceu em sua cidade natal no mês de junho de 1948.\n\nSeu filho, Joaquim Inácio de Carvalho Neto, foi deputado federal pelo\nRio Grande do Norte em 1963 e 1964.\n\nDedicando-se às questões econômicas, publicou alguns estudos, entre os\nquais *O baixo Açu*, *Vale do Upanema*, *Relatório sobre serviços no\nvale do Ceará-mirim* e *Seridó.*\n\n \n\n \n\nFONTES:*Boletim Min. Trab.*(5/36*); Diário* *do Congresso\nNacional;*FICHÁRIO PESQ. M. AMORIM; *Grande encic. Delta;*SILVA,\nH.*1935.*\n\n \n","ref":"FONTES:*Boletim Min. Trab.*(5/36*); Diário* *do Congresso\nNacional;*FICHÁRIO PESQ. M. AMORIM; *Grande encic. Delta;*SILVA,\nH.*1935.*\n\n \n","dic":"DHBB"}
