{"title":"RAJÃO, José","cargoss":["Deputado federal"],"cargos_esp":[0],"datas_ini":[2003],"datas_fim":[2007],"estados":["DF"],"autor":[0],"content":"**RAJÃO, José**\n\n\\*dep.fed. DF 2003-2007.\n\n \n\n                *José Rajão Filho* nasceu no Rio de Janeiro, então\ncapital da República, no dia 25 de outubro de 1946, filho de José Maria\nRajão e Rute Gomes de Rajão.\n\n                Já radicado em Brasília, em 1968 entrou para a Escola de\nFormação de Oficiais do Corpo de Bombeiros, terminando o curso em 1970,\nano em que iniciou o curso de economia do Centro de Ensino Unificado de\nBrasília (CEUB), concluído em 1986. Nesse mesmo ano fez o curso Superior\nde Bombeiros, completando seus estudos com o curso de Perícia de\nIncêndio e pós-graduação em Técnica de Ensino do Exército Brasileiro.\n\n                Coronel-reformado do Corpo dos Bombeiros, entre os anos\n1994 e 1996 foi subcomandante e comandante geral da instituição em\nBrasília.\n\n                Filiado ao Partido da Social Democracia Brasileira\n(PSDB), em 1998 elegeu-se deputado distrital nessa legenda. Empossado em\njaneiro do ano seguinte. Ainda em 1999 foi nomeado presidente da\nOrganização Não-Governamental (ONG) Bombeiros Brasileiros em Brasília.\nEntre os anos 2001 e 2002 exerceu o cargo de vice-presidente do Conselho\nde Comandantes de Polícias Militares e Corpo de Bombeiros do Brasil.\n\nNo pleito de outubro de 2002, candidatou-se a uma vaga de deputado\nfederal pelo Distrito Federal na legenda do PSDB, alcançando uma\nsuplência. Assumiu o exercício do mandato em abril de 2003 em virtude do\nafastamento do titular. Deixou a Câmara dos Deputados em setembro desse\nmesmo ano. Retornou ao exercício do mandato em junho de 2004. No mês\nseguinte deixou novamente a Câmara dos Deputados. No pleito de outubro\nde 2006, não candidatou-se a deputado federal. Voltou ao exercício do\nmandato em 1º de janeiro de 2007, tendo permanecido até o dia 31 quando\nse encerrou a legislatura.\n\nNessa legislatura, foi membro da Comissão Financeira e Controle e\nsuplente da Comissão de Direitos Humanos e da Comissão Parlamentar de\nInquérito (CPI) Pirataria de Produtos Industrializados.\n\nPublicou *Bombeiro voluntário: solução para o Brasil continental*\n(2000); *Deus dos impossíveis* (2002).\n\n \n\nFONTES: Câmara dos Deputados; CLDF.\n\n** **\n\n** **\n\n** **\n\n** **\n","ref":"FONTES: Câmara dos Deputados; CLDF.\n\n** **\n\n** **\n\n** **\n\n** **\n","dic":"DHBB"}
