{"title":"CARVALHO, Alceu","cargoss":["Deputado federal"],"cargos_esp":[0],"datas_ini":[1963],"datas_fim":[1971],"estados":["SP"],"autor":[0],"content":"**CARVALHO, Alceu**\n\n\\*dep. fed. SP 1963-1971.\n\n*Alceu Barroso de Carvalho* nasceu em Jaú (SP) no dia 24 de julho de\n1923, filho de Júlio de Carvalho e de Leonor Barroso de Carvalho.\n\nEstudou no Ginásio Municipal de Jaú, no Instituto Granbery de Juiz de\nFora (MG) e no Colégio Osvaldo Cruz, na capital paulista. Em 1941, por\nconcurso, tornou-se escriturário do Ministério da Viação,\ntransferindo-se depois para o Instituto de Aposentadoria e Pensões dos\nComerciários (IAPC), onde exerceu a função de cobrador.\n\nBacharelou-se pela Faculdade de Direito de Niterói em 1947 e, ao se\nformar, deixou o serviço público e transferiu-se para Botucatu (SP),\nonde passou a advogar. Ao cabo de dois anos, mudou-se para Birigüi (SP),\nonde ingressou na carreira política, elegendo-se inicialmente vereador\ne, em 1958, vice-prefeito do município.\n\nNo pleito de outubro de 1962, elegeu-se deputado federal por São Paulo\nna legenda do Partido Republicano (PR). Assumindo o mandato em fevereiro\nde 1963, rompeu em seguida com o PR, ingressando no Partido Trabalhista\nBrasileiro (PTB). Católico, “doutrinariamente social-democrata e\nideologicamente esquerdista”, como se declarava em 1963, foi favorável\nàs reformas de base propostas durante o governo de João Goulart e\ndefendeu a extensão do direito de voto ao analfabeto e o monopólio\nestatal das riquezas do subsolo, das fontes de energia e das\ntelecomunicações.\n\nEm junho de 1964, após a derrubada de Goulart, tornou-se vice-líder do\nPTB na Câmara, onde já era membro da Comissão de Constituição e Justiça\ne suplente da Comissão de Política Rural. Com a extinção dos partidos\npolíticos pelo Ato Institucional nº 2 (27/10/1965) e a posterior\ninstauração do bipartidarismo, filiou-se ao Movimento Democrático\nBrasileiro (MDB). Vice-líder do novo partido na Câmara a partir de maio\nde 1966, em novembro do mesmo ano reelegeu-se deputado federal por São\nPaulo.\n\nNa nova legislatura, iniciada em fevereiro de 1967, permaneceu na\nComissão de Justiça e tornou-se membro da Comissão de Legislação Social.\nEm junho, foi novamente escolhido vice-líder do MDB na Câmara, e durante\no mandato integrou diversas comissões parlamentares de inquérito (CPI),\nprincipalmente as da carne congelada, da indústria cinematográfica, da\nenergia nuclear e do sistema bancário.\n\nCandidato a nova reeleição em novembro de 1970, conquistou apenas uma\nsuplência. Deixou a Câmara em janeiro de 1971 e a ela não retornou.\n\nCasou-se com Maria Ferrari de Carvalho, com quem teve dois filhos.\n\nFONTES: CÂM. DEP.*Deputados;*CÂM. DEP. *Deputados brasileiros.\nRepertório*(1963-1967**e 1967-1971); CÂM. DEP. *Relação nominal dos\nsenhores*; DEP. PESQ. EST. SP; TRIB. SUP. ELEIT. *Dados*(6, 8 e 9).\n\n \n","ref":"FONTES: CÂM. DEP.*Deputados;*CÂM. DEP. *Deputados brasileiros.\nRepertório*(1963-1967**e 1967-1971); CÂM. DEP. *Relação nominal dos\nsenhores*; DEP. PESQ. EST. SP; TRIB. SUP. ELEIT. *Dados*(6, 8 e 9).\n\n \n","dic":"DHBB"}
