{"title":"CARVALHO, Antônio Martins Fernandes de","cargoss":["Deputado federal","Deputado federal"],"cargos_esp":[0,0],"datas_ini":[1957,1956],"datas_fim":[1957,1956],"estados":["RN","RN"],"autor":[0],"content":"**CARVALHO, Antônio Martins Fernandes de**\n\n\\*dep. fed. RN 1956 e 1957.\n\n \n\n*Antônio Martins Fernandes de Carvalho* nasceu em Martins (RN) em 6 de\nsetembro de 1905, filho de Joaquim Inácio de Carvalho e de Maria Gomes\nde Oliveira Carvalho.\n\nFoi médico da Polícia Militar do Rio Grande do Norte e radiologista do\nHospital Jovino Barreto (atual Hospital Onofre Lopes, da Universidade\nFederal do Rio Grande do Norte). Depois de alguns anos nesses cargos,\ntransferiu-se para o Rio de Janeiro, então Distrito Federal, onde\nassumiu a gerência da firma Alfredo Fernandes e Cia.\n\nPrefeito de Portalegre (RN) em 1952, elegeu-se suplente de deputado\nfederal em outubro de 1954, pela União Democrática Nacional (UDN).\nOcupou uma cadeira na Câmara de 17 de abril a 30 de julho de 1956 e de\n24 de abril a 14 de novembro de 1957.\n\nSuicidou-se em Martins em 15 de novembro de 1957.\n\nEra casado com Maria Edite Fernandes, com quem teve um filho.\n\n \n\nFONTES: CÂM. DEP. *Deputados*; TRIB. SUP. ELEIT. *Dados*.\n\n \n","ref":"FONTES: CÂM. DEP. *Deputados*; TRIB. SUP. ELEIT. *Dados*.\n\n \n","dic":"DHBB"}
