{"title":"SAMPAIO, João","cargoss":["Deputado federal"],"cargos_esp":[0],"datas_ini":[1999],"datas_fim":[2003],"estados":["RJ"],"autor":["Sabrina Guerghe"],"content":"**SAMPAIO, João**\n\n\\*dep. fed. RJ 1999-2003.\n\n               \n\n                *João Carlos de Almeida Sampaio* nasceu em Niterói (RJ),\nno dia 24 de maio de 1941, filho de José Flávio de Almeida Sampaio e\nMaria Luísa da Cunha Sampaio.\n\n                Formou-se em construção civil no Serviço Nacional de\nAprendizagem Industrial (SENAI) em 1963. Bacharelou-se em arquitetura na\nUniversidade Federal do Rio de Janeiro (UFRJ), em 1964. Em 1968 realizou\num curso de programação habitacional e favelas no Centro Nacional de\nPesquisas Habitacionais. No ano seguinte, fez um curso de programação\ntécnica de avaliação e revisão de projetos, tempo-custo, aplicada à\nconstrução civil no Banco Nacional da Habitação (BNH).\n\n                Arquiteto da Secretaria de Obras do Estado do Rio de\nJaneiro de 1965 a 1966. Em 1967 trabalhou no Centro Interamericano de\nHabitação e Planejamento (CINVA), na Venezuela. Ainda em 1967, foi\naprovado em concurso para o BNH, onde exerceria a função de arquiteto\naté 1972. Entre 1969 e 1970 chefiou o Serviço de Projetos e a Divisão de\nProjetos Especiais, entre 1970 e 1972.\n\nEm 1974, deixou o BNH e tornou-se sócio-diretor da PRODIAN Consultores\nTécnicos Ltda. em Niterói, em que permaneceria até 1984. Nesse período\npresidiu o Núcleo Niterói, de 1982 a 1983.\n\nNesse ano, passou a prestar consultoria para o Instituto Brasileiro de\nAdministração Municipal (IBAM), função que exerceria até 1988, e passou\na lecionar na Universidade Federal Fluminense (UFF). Foi ainda\nvice-presidente do Instituto de Arquitetos do Brasil (IAB) entre 1986 e\n1987.\n\nEm 1986 filiou-se ao Partido Democrático Trabalhista (PDT) e foi nomeado\nsuperintendente de Planejamento Urbano da prefeitura do Rio de Janeiro\ndurante a gestão de Saturnino Braga (1986-1988). Em 1989 passou a\nintegrar o diretório municipal do PDT em Niterói.\n\nAinda em 1989, aceitou o convite do prefeito de Niterói Jorge Roberto da\nSilveira (1989-1992), e dirigiu a Secretaria de Urbanismo e Meio\nAmbiente da cidade fluminense. Nessa condição, coordenou a elaboração do\nPlano Diretor e outros projetos urbanos que terminaram por redesenhar a\ncidade. Entre 1990 e 1992, presidiu o diretório do PDT em Niterói.\n\n \n\nEm 1992, foi eleito no primeiro turno prefeito de Niterói. Durante seu\ngoverno foram construídos o Museu de Arte Contemporânea (MAC) e o\nterminal rodoviário João Goulart, também houve várias obras viárias.\n\nEm 1996 tornou-se membro do diretório regional, no mesmo ano tornou-se\nmembro do diretório nacional do PDT. Em dezembro desse ano, teve fim o\nmandato de prefeito e saiu do cargo com 86% de aprovação da população.\nNo ano seguinte, passou a presidir o Conselho Executivo Municipal,\nresponsável pelo planejamento estratégico do governo de Jorge Roberto\nSilveira (1997-2000). Em 1998 foi secretário-geral da Fundação Alberto\nPasqualini.\n\nAinda em 1998, João Sampaio foi eleito deputado federal pelo estado do\nRio de Janeiro na legenda pedetista. Obteve 80.489 votos. Assumiu o\nmandato em fevereiro de 1999 e licenciou-se em agosto e foi nomeado\nsecretário Extraordinário de Programas Estratégicos do Estado do Rio de\nJaneiro na gestão de Anthony Garotinho. Deixou esse cargo e outubro e\nfoi empossado secretário de Cultura do Estado do Rio de Janeiro,\npermaneceu nessa função até fevereiro de 2000 quando retornou ao\nexercício do mandato de deputado federal.\n\nNa Câmara dos Deputados, presidiu a Comissão de Desenvolvimento Urbano\npor ocasião da criação do Estatuto das Cidades. Foi ainda\nvice-presidente da Comissão de Economia, Indústria e Comércio. E a\npartir de 2000 ocupou a vice-liderança do PDT.\n\nEm outubro de 2002, disputou a reeleição e obteve uma suplência. Deixou\na Câmara dos Deputados em janeiro seguinte, ao final da legislatura. Em\n2004, candidatou-se mais uma vez a prefeitura de Niterói na legenda do\nPDT, tendo terminado em terceiro lugar. Contudo, com a desistência de\nMoreira Franco, que conquistara a segunda colocação, João Sampaio foi\npara o segundo turno, concorrendo contra Godofredo Pinto que venceu a\neleição. Em 2006, concorreu ao mandato de deputado estadual na legenda\npedetista e não obteve sucesso.\n\nPublicou *Desarrollo del proyecto San Francisco: perteneciente al\nprograma de autoconstrución en Venezuela* (1967); *Autoconstrução:\nsolução alternativa para as populações de baixa renda* (1968) e *O que é\npreciso saber sobre rodoviárias e terminais de carga* (1982).\n\n*Sabrina Guerghe*\n\nFONTES: PDT (28/10/2004); Câmara dos Deputados;\nhttp://www.asclaras.org.br/2006; http://www.asclaras.org.br/2004; Folha\nde São Paulo (5, 6 e 7/10/2004, 31/10/2004); Tribuna Impressa\n(6/10/2004);\n[http://www.tse.gov.br/internet/eleicoes/2002/result\\_blank.htm](http://www.tse.gov.br/internet/eleicoes/2002/result_blank.htm)\nacesso em 1/10/09;\n\n \n","ref":"FONTES: PDT (28/10/2004); Câmara dos Deputados;\nhttp://www.asclaras.org.br/2006; http://www.asclaras.org.br/2004; Folha\nde São Paulo (5, 6 e 7/10/2004, 31/10/2004); Tribuna Impressa\n(6/10/2004);\n[http://www.tse.gov.br/internet/eleicoes/2002/result\\_blank.htm](http://www.tse.gov.br/internet/eleicoes/2002/result_blank.htm)\nacesso em 1/10/09;\n\n \n","dic":"DHBB"}
