{"title":"SCHEID, Eusébio Oscar","cargoss":["Arcebispo"],"cargos_esp":["Rio de Janeiro"],"datas_ini":[2001],"datas_fim":[2007],"estados":[0],"content":"**SCHEID, Eusébio Oscar**\n\n\\*religioso; arceb. Rio de Janeiro 2001-2007.\n\n \n\n*Eusébio Oscar Scheid* nasceu em Lucerna (SC) no dia 8 de dezembro de\n1932, filho de Alberto Reinado Scheid e de Rosália Joana Scheid.\n\nRealizou seus estudos primários e secundários (ensino básico) no\nSeminário dos Padres do Coração de Jesus em Corupá (SC). Em 1954,\niniciou os estudos de filosofia em Brusque (SC). Continuou seus estudos\nfilosóficos na Pontifícia Universidade Gregoriana, em Roma, formando-se\nem 1964. Obteve o título de doutor em cristologia na mesma universidade.\n\nDe 1964 a 1965, foi professor no Seminário Cristo Rei e Seminário\nRegional do Nordeste, Recife (PE), e de “teologia dogmática e liturgia”\nno Instituto Teológico de Taubaté (SP), de 1966 a 1981. Trabalhou também\ncomo diretor da Faculdade de Teologia em Taubaté, e como professor\nconvidado da PUC-SP (Pontifícia Universidade Católica de São Paulo),\nonde lecionou “cultura religiosa”.\n\nEm julho de 1960 foi ordenado sacerdote. Foi eleito primeiro bispo de\nSão José dos Campos no dia 18 de fevereiro de 1981, pelo papa João Paulo\nII. Exerceu a pastoral na diocese de São José dos Campos no período de\n1981 a 1991. Fundou o Instituto de Filosofia Santa Teresinha e instalou\ntambém a residência teológica Padre Rodolfo. No dia 23 de janeiro de\n1991, foi nomeado arcebispo de Florianópolis. Encaminhou a criação de\nmais duas dioceses catarinenses: Criciúma (1998) e Blumenau (2000).\n\nEntre 12 e 28 de outubro de 1992, assistiu a IV Conferência Geral do\nEpiscopado Latino-americano (Celam) em Santo Domingo, na República\nDominicana que teve como tema a **“Nova evangelização, promoção humana e\ncultura cristã”**. Nomeado por João Paulo II, esteve presente também na\nIX Assembléia Ordinária do Sínodo de Bispos, ocorrida no Vaticano em\noutubro de 1994.\n\nDom Eusébio Scheid permaneceu à frente da arquidiocese de Florianópolis\naté julho de 2001 quando foi designado arcebispo de São Sebastião do Rio\nde Janeiro. Assumiu esse posto em 22 de setembro do mesmo ano em\nsubstituição ao cardeal dom Eugênio Sales. No caso da arquidiocese do\nRio de Janeiro a mudança de bispo não acontecia fazia 108 anos, uma vez\nque anteriormente todas as alterações decorreram da vacância do cargo\npor causa de morte.\n\nPouco depois da sua posse, participou da X Assembléia Ordinária do\nSínodo de Bispos que aconteceu no Vaticano. Em 2001, em entrevista a\n*Isto é*, declarou que sua oposição ao divórcio e ao aborto. Opinou\ntambém sobre a atuação do Movimento dos Trabalhadores Sem-Terra (MST),\nafirmando que a Igreja não estava de acordo com certas estratégias do\nmovimento, mas ressaltou que “muito do que se conseguiu em reforma\nagrária, que não é tanto assim, se deve bastante ao MST”. Foi nomeado\nconselheiro da Pontifícia Comissão para a América Latina em novembro de\n2002. Em outubro de 2003, foi nomeado cardeal pelo papa João Paulo II.\n\nEm 2005, a morte de João Paulo II e a abertura do conclave que\nescolheria o novo papa movimentaram a Igreja Católica. Por ocasião do\nenterro, o governo brasileiro definiu uma comitiva para participar da\ncelebração que foi integrada pelos ex-presidentes da República José\nSarney, Fernando Collor, Itamar Franco, Fernando Henrique Cardoso e o\npresidente Luís Inácio Lula da Silva, além de líderes de outras\nreligiões. Nas especulações que antecederam a definição do conclave,\nvários nomes do catolicismo brasileiro foram citados como candidatos a\npapa e o presidente Lula, em declarações à imprensa, afirmou que seu\ndesejo era que o novo papa fosse brasileiro, embora ressaltasse que isso\nera “um problema da Igreja Católica”. Essas iniciativas do presidente\nLula provocaram críticas de dom Eusébio que, ao desembarcar em Roma para\nas cerimônias, acusou o presidente de querer explorar politicamente a\nmorte de João Paulo II e acrescentou que o presidente não era “católico,\n[era] caótico. Ele e o Espírito Santo não se entende[ria]m bem”.\nExplicou ainda que o presidente não teria uma fé retilínea porque\nnascera “em um meio operário, com todas as confusões, nunca t[ivera] uma\nformação e um aprofundamento da própria fé\". O Palácio do Planalto não\ncomentou, à época, as declarações de dom Eusébio. Pouco meses depois,\nDom Eusébio criticou o ministro Marco Aurélio de Melo, do Supremo\nTribunal Federal (STF), que concedeu liminar permitindo o aborto de\nfetos com anencefalia (sem cérebro).\n\nEm fevereiro de 2007, foi um dos nomeados pelo papa Bento XVI para o\nConselho de Cardeais. O Conselho de Cardeais visa o estudo das questões\norganizativas e econômicas da Sé Apostólica e engloba 15 cardeais, todos\neles bispos de igrejas das diversas partes do mundo, nomeados pelo papa\npara um qüinqüênio.\n\nEm dezembro, dom Eusébio completou 75 anos. De acordo com o Código\nCanônico apresentou sua renúncia ao cargo, mas pediu para permanecer até\no fim de junho de 2009, quando terminariam as comemorações do Ano\nPaulino. Contudo, sua saída foi antecipada pelo papa e Dom Eusébio\ndeixou a liderança da arquidiocese do Rio de Janeiro no dia 19 de abril,\ntendo sido substituído por dom Orani João Tempesta.\n\nEm sua gestão, dom Eusébio lançou um cartão de crédito católico, com\nobjetivo de arrecadar recursos para obras sociais da Igreja em dezembro\nde 2006. Vinculado à Associação de Solidariedade Justiça e Paz (ASJP),\nentidade fundada em junho desse ano por Dom Eusébio e padre Edvino\nSteckel, responsável pela gerência econômica da arquidiocese, a\niniciativa causaria mal-estar no Vaticano. Além disso, demitiu 67\nfuncionários da Cúria Metropolitana, despejou da sede da Arquidiocese\nvárias comissões pastorais — entre elas, a dos refugiados, a de favelas,\na do trabalho e a do menor e, finalmente, comprou um apartamento\navaliado em 2,2 milhões de reais destinado a servir de residência a Dom\nEusébio quando viesse à cidade. Em maio de 2009, essas iniciativas foram\ndivulgadas e anuladas pelo novo arcebispo do Rio de Janeiro.\n\nEntre as suas principais obras estão: *Tese de láurea sobre a\nCristologia de Ubertino da Casale em seu contexto histórico*,\n*Preparação para o casamento e para a vida familiar* e *Introdução à\npastoral familiar*. Dom Eusébio lançou o livro *A voz do Pastor*,\nreunindo os artigos semanais escritos por ele no jornal *O testemunho de\nfé*e em outros veículos de comunicação impressa do Rio de Janeiro.\n\n** **\n\n*Bruno Marques*\n\n* *\n\nFontes:\n\n[http://www.cnbb.org.br/bispos/visual/index.php?nome=Scheid&diocese](http://www.cnbb.org.br/bispos/visual/index.php?nome=Scheid&diocese)=\n(Data de acesso: 21.09.2009)\n\n[http://noticias.cancaonova.com/noticia.php?id=6852](http://noticias.cancaonova.com/noticia.php?id=6852)\n(Data de acesso: 21.09.2009)\n\n[http://arquifln.org.br/lenoticia.php?codigo=299](http://arquifln.org.br/lenoticia.php?codigo=299)\n(Data de acesso: 21.09.2009)\n\n[http://www.arquidiocese.org.br/cgi/cgilua.exe/sys/start.htm?sid=317](http://www.arquidiocese.org.br/cgi/cgilua.exe/sys/start.htm?sid=317)\n(Data de acesso: 21.09.2009)\n\n[http://www1.folha.uol.com.br/folha/brasil/ult96u22730.shtml](http://www1.folha.uol.com.br/folha/brasil/ult96u22730.shtml)\n(Data de acesso: 21.09.2009)\n\n[http://www.cnbbsul1.org.br/index.php?link=news/read.php&id=5169](http://www.cnbbsul1.org.br/index.php?link=news/read.php&id=5169)\n(Data de acesso: 21.09.2009)\n\n[http://www1.folha.uol.com.br/folha/cotidiano/ult95u37467.shtml](http://www1.folha.uol.com.br/folha/cotidiano/ult95u37467.shtml)\n(Data de acesso: 21.09.2009)\n\n[http://pucriodigital.com.pucrio.br/cgi/cgilua.exe/sys/start.htm?sid=13&infoid=351](http://pucriodigital.com.pucrio.br/cgi/cgilua.exe/sys/start.htm?sid=13&infoid=351)\n(Data de acesso: 21.09.2009)\n\n[http://www.acidigital.com/Cardeais/SCHEID.htm](http://www.acidigital.com/Cardeais/SCHEID.htm)\n(Data de acesso: 21.09.2009)\n\n[http://www.cardinalrating.com/cardinal\\_96\\_\\_article\\_1004.htm](http://www.cardinalrating.com/cardinal_96__article_1004.htm)\n(Data de acesso: 21.09.2009)\n\n[http://www.terra.com.br/istoe/1670/brasil/1670\\_revolucao\\_pastoral.htm](http://www.terra.com.br/istoe/1670/brasil/1670_revolucao_pastoral.htm)\n(Data de acesso: 21.09.2009)\n\n[http://www.pjestigmatina.com/correio\\_daPJEst/paginas/2007/16.html](http://www.pjestigmatina.com/correio_daPJEst/paginas/2007/16.html)\n(Data de acesso: 5.10.2009)\n\n[http://veja.abril.com.br/130405/p\\_086.html](http://veja.abril.com.br/130405/p_086.html)\nacesso em 15/10/09\n\n[http://odia.terra.com.br/rio/htm/saida\\_de\\_d\\_eusebio\\_scheid\\_da\\_arquidiocese\\_foi\\_antecipada\\_204810.asp](http://odia.terra.com.br/rio/htm/saida_de_d_eusebio_scheid_da_arquidiocese_foi_antecipada_204810.asp)\nacesso em 15/10/09\n\n[http://youpode.com.br/blog/alguemmedisse/tag/dom-eusebio-scheid/](http://youpode.com.br/blog/alguemmedisse/tag/dom-eusebio-scheid/)\nacesso em 15/10/09\n","ref":"","dic":"DHBB"}
