{"title":"TANIGUCHI, Cássio","cargoss":["Prefeito","Deputado federal"],"cargos_esp":["Curitiba",0],"datas_ini":[1997,2007],"datas_fim":[2005,0],"estados":[0,"PR"],"autor":[0],"content":"**TANIGUCHI, Cássio**\n\n\\*pref. Curitiba 1997-2005; dep. fed. PR 2007-\n\n \n\n*Cássio Taniguchi* nasceu em Paraguaçu Paulista (SP) no dia 30 de\noutubro de 1941, filho de Masaji Taniguchi e de Masako Taniguchi.\n\nEm 1960 começou a frequentar o curso de engenharia elétrica no Instituto\nTecnológico de Aeronáutica (ITA), em São José dos Campos (SP),\nformando-se engenheiro eletrônico em 1964. Após formar-se, começou a\ntrabalhar no ano seguinte na Companhia de Desenvolvimento Econômico do\nParaná (Codepar) desempenhando as funções de engenheiro fiscal e chefe\nde setor, tornando-se chefe de departamento em 1968. Ainda em 1967,\nfreqüentou um curso de especialização intensivo de treinamento em\nproblemas de desenvolvimento econômico na Comissão Econômica para a\nAmérica Latina (CEPAL) tendo sido aprovado com distinção. Entre 1969 e\n1971 foi engenheiro e coordenador de projetos da DK Engenharia, empresa\nprivada especializada em sistema de telecomunicações sediada na capital\nparanaense, prestando neste último ano consultoria para a Companhia de\nUrbanização de Curitiba (URBS) empresa da qual se tornaria\ndiretor-presidente entre 1972 e 1975. Neste ano exerceu também o cargo\nde diretor de análise e programação da Fundação para o Desenvolvimento\nda Região Metropolitana do Rio de Janeiro (Fundrem). Entre 1975 e 1980\nfoi diretor e sócio-gerente da empresa de consultoria em Planejamento\nUrbano do ex-prefeito Jaime Lerner, em Curitiba, e começou a trabalhar\nno Instituto de Pesquisa e Planejamento de Curitiba (Ippuc). A partir de\nsua atuação profissional no Ippuc estreitou seu laços com o grupo\npolítico liderado por Jaime Lerner, que desempenharia importante papel\nna implantação de vários projetos de planejamento urbano, especialmente\nna cidade de Curitiba, entre as décadas de 1970 e 1990.\n\nNos anos seguintes exerceu diversas atividades no Ippuc ao mesmo tempo\nem que atuava em empresas privadas. Foi presidente do Ippuc entre 1980 e\n1983, trabalhou na empresa em sociedade com Jaime Lerner entre 1984 e\n1989, e exerceu novamente a presidência do Ippuc entre 1989 e 1994, na\nterceira gestão de Jaime Lerner na prefeitura de Curitiba. Em janeiro de\n1995, com a posse de Lerner no governo do Paraná, assumiu a secretaria\nestadual de Planejamento e Coordenação Geral, cargo que acumulou com a\nsecretaria de Indústria e Comércio do Paraná entre os anos de 1995 e\n1996. Durante sua gestão foi um dos mais destacados operadores da\npolítica de mudança do perfil econômico do estado posta em prática por\nJaime Lerner, atuando diretamente na atração e implantação do pólo\nautomobilístico com a construção das montadoras Audi/Volkswagen e\nRenault nas cercanias de Curitiba.\n\nEm março de 1996 licenciou-se de seus cargos no governo do estado para\ncandidatar-se à prefeitura de Curitiba na sucessão de Rafael Greca de\nMacedo, outro político oriundo do Ippuc e então estritamente vinculado\nao grupo de Jaime Lerner. No pleito de outubro do mesmo ano elegeu-se\nprefeito de Curitiba pelo Partido Democrático Trabalhista (PDT) ainda no\nprimeiro turno das eleições com 414.648 votos (54,7% dos votos válidos).\nNa ocasião, seu êxito eleitoral foi interpretado como uma significativa\nvitória de Jaime Lerner e de seus aliados em Curitiba e no estado do\nParaná. Em setembro de 1997, juntamente com o grupo político de Jaime\nLerner, transferiu-se do PDT para o Partido da Frente Liberal (PFL) a\nfim de facilitar as articulações para uma eventual candidatura de Lerner\nà presidência da República na sucessão do então presidente da República\nFernando Henrique Cardoso (PSDB). De 1998 a 2004 integrou a Comissão\nExecutiva do PFL no Paraná tendo sido eleito vice-presidente do partido\nno estado a partir de 2005.\n\nNo pleito de outubro de 2000 candidatou-se à reeleição para a prefeitura\nde Curitiba pelo PFL, indo ao segundo turno das eleições com o candidato\ndo Partido dos Trabalhadores (PT), Ângelo Vanhoni. Disputando as\neleições num contexto de ascensão do PT e demais partidos de oposição ao\ngoverno de Fernando Henrique Cardoso em nível municipal e estadual,\nVanhoni liderou as pesquisas durante quase toda a campanha eleitoral\nsendo ultrapassado por Taniguchi a poucos dias da realização do segundo\nturno em virtude de seu fraco desempenho nos debates transmitidos ao\nvivo pela televisão e do desempenho bastante superior de Taniguchi nos\nmesmos. Por esse motivo, Taniguchi terminou por vencer o pleito em\nCuritiba no segundo turno com 462.811 votos (49,87% dos votos válidos),\nao contrário de outras importantes cidades do Paraná tais como Londrina,\nPonta Grossa e Maringá, onde o PT elegeu o prefeito da cidade. Após\ntomar posse no cargo em janeiro do ano seguinte, exerceu também a\npresidência da Associação dos Municípios da Região Metropolitana de\nCuritiba (Assomec) entre 2001 e 2004.\n\nAo longo do ano de 2002 teve seu nome envolvido em irregularidades no\nuso de recursos não contabilizados (caixa 2) em sua campanha às eleições\npara a prefeitura de Curitiba, chegando a ser indiciado pela Justiça\nEleitoral por omissão de gastos na prestação de contas da campanha de\n2000. O desgaste provocado com as investigações pelo Ministério Público\nEleitoral levou Taniguchi, antes considerado um candidato natural à\nsucessão do governador Jaime Lerner (PFL), a ser excluído do quadro de\ncandidatos do PFL na disputa para o governo estadual no pleito de\noutubro de 2002. Em setembro deste ano licenciou-se do cargo para\ntrabalhar na campanha eleitoral do vice-prefeito de Curitiba Beto Richa\n(PSDB) nas eleições para o governo de estado. Com a derrota de Richa no\nprimeiro turno, declarou seu voto em Álvaro Dias (PDT), que acabou sendo\nderrotado no segundo turno do pleito por Roberto Requião (PMDB), antigo\nadversário de Taniguchi na política estadual.\n\nManteve-se na prefeitura de Curitiba até 1º de janeiro de 2005 quando\npassou o cargo a seu sucessor Beto Richa, do Partido da Social\nDemocracia Brasileira (PSDB), eleito em outubro do ano anterior. Após o\ntérmino do mandato, Taniguchi passou a proferir palestras em diversas\npartes do mundo e tornou-se consultor sênior do *United Nations\nInstitute for Training and Research*(Unitar), órgão vinculado à ONU com\nsede em Genebra e com o objetivo de apoiar programas especiais de\norientação aos administradores públicos. Ainda em 2005 assumiu a\npresidência do Instituto Tancredo Neves do Paraná, um centro de\npesquisas políticas, econômicas e sociais ligado ao PFL.\n\nNas eleições de outubro de 2006 candidatou-se ao mandato de deputado\nfederal pelo PFL elegendo-se com 67.821 votos. Assumiu o mandato no dia\n1º de fevereiro do ano seguinte, tendo renunciado cinco dias depois para\nexercer a função de secretário de Desenvolvimento Urbano e Meio Ambiente\ndo Distrito Federal, a convite do então governador José Roberto Arruda,\ntambém do PFL sendo substituído pelo suplente Airton Roveda. Em março de\n2007, com a transformação do antigo PFL em Partido dos Democratas (DEM)\nfiliou-se ao novo partido. Em junho 2008 os ministros do STF absolveram\npor unanimidade Cássio Taniguchi das acusações de fraude em licitação e\ndesvio de dinheiro público feitas contra ele pelo Ministério Público do\nParaná, tendo sido também rejeitada denúncia do procurador-geral da\nRepública para que fosse apurado o seu suposto envolvimento em caso de\ncorrupção. Em dezembro de 2009 Taniguchi afastou-se do cargo de\nsecretário de Desenvolvimento Urbano e Meio Ambiente do Distrito Federal\nem virtude das denúncias de corrupção contra o governador do estado,\nJosé Roberto Arruda. No mesmo mês reassumiu seu mandado como deputado\nfederal pelo PFL na Câmara dos Deputados.\n\nAo longo de sua trajetória foi também consultor de projetos urbanísticos\nno Brasil e no exterior, auxiliando a elaboração de projetos em cidades\ncomo Goiânia, Rio de Janeiro, Aracaju, Waitakere (Nova Zelândia),\nMelbourne (Austrália) e Abu-Dhabi (Emirados Árabes Unidos), Bogotá\n(Colômbia) e Lyon (França). Foi também membro do Instituto de Engenharia\ndo Paraná entre 1965 e 1996, e presidente do Conselho Deliberativo do\nIppuc entre 1997 e 2004.\n\nCasado com a socióloga Marina Klamas Taniguchi, teve dois filhos.\n\nPublicou artigos e trabalhos técnicos em diversos periódicos, dentre os\nquais: *Cidade Planejada ─ a Experiência de Curitiba* (Cadernos dos\nGrupos Temáticos do PFL, Brasília, 2004); *Curitiba and Sustainability:\nThe EcoEdge Conference* (Melboune, 2005); *The Future of the Cities and\nthe Role of Local Actors ─ the Case of Curitiba\"*(2006).\n\nFONTES: http://www2.camara.gov.br/ (último acesso em 12/12/2009);\n*http://www.tse.gov.br/* (último acesso em 12/12/2009);\n*http://www.parana-online.com.br/* (último acesso em: 12/12/2009);\n*http://www.folha.uol.com.br/*(último acesso em: 12/12/2009);\nhttp://www.transparencia.org.br/index.html (último acesso em:\n14/12/2009); http://www.cassiotaniguchi.com.br/ (último acesso em:\n14/12/2009).\n\n \n","ref":"FONTES: http://www2.camara.gov.br/ (último acesso em 12/12/2009);\n*http://www.tse.gov.br/* (último acesso em 12/12/2009);\n*http://www.parana-online.com.br/* (último acesso em: 12/12/2009);\n*http://www.folha.uol.com.br/*(último acesso em: 12/12/2009);\nhttp://www.transparencia.org.br/index.html (último acesso em:\n14/12/2009); http://www.cassiotaniguchi.com.br/ (último acesso em:\n14/12/2009).\n\n \n","dic":"DHBB"}
