{"title":"CARVALHO, Brabo de","cargoss":["Deputado federal"],"cargos_esp":[0],"datas_ini":[1979],"datas_fim":[1987],"estados":["PA"],"autor":[0],"content":"**CARVALHO, Brabo de**\n\n\\*dep. fed. PA 1979-1987.\n\n*Osvaldo Brabo de Carvalho* nasceu em Muaná (PA) no dia 4 de maio de\n1925, filho de José da Cunha Carvalho e de Francisca de Paula Brabo de\nCarvalho.\n\nBacharelou-se em ciências jurídicas e sociais pela Faculdade de Direito\ndo Pará em 1949. No ano seguinte assumiu a presidência do Tribunal de\nJustiça Desportiva (TJD) da Federação Paraense de Desportos (FPD), tendo\nsido também auditor desse tribunal. Em 1951 tornou-se procurador do\nInstituto Nacional da Previdência Social (INPS).\n\nIngressou na política filiando-se ao Partido Trabalhista Brasileiro\n(PTB). Nessa legenda, foi eleito deputado estadual no Pará no pleito de\noutubro de 1962, sendo empossado em fevereiro do ano seguinte. Foi\nmembro titular da Comissão de Constituição e Justiça e suplente da\nComissão de Obras, Terras e Viação. Foi também titular da Comissão de\nFinanças, Economia, Fiscalização Financeira e Orçamento.\n\nApós a vitória do movimento político-militar de 31 de março de 1964 que\ndepôs o presidente João Goulart (1961-1964), iniciou-se um processo de\npunição aos adversários do novo regime. No Pará, o governador do estado,\nAurélio do Carmo, foi cassado em junho desse ano e, para sucedê-lo, a\nAssembléia Legislativa elegeu indiretamente Jarbas Passarinho.\nFormou-se, na ocasião, no Legislativo paraense, um bloco parlamentar\napartidário de sustentação do governo de Passarinho que abrigou\nparlamentares oriundos dos diversos partidos existentes. Brabo de\nCarvalho tornou-se o vice-líder desse bloco, do qual somente os membros\ndo Partido Social Democrático (PSD) não participaram, atuando na\nAssembléia como oposição.\n\nEm 1965 integrou a delegação do Pará ao IV Congresso Brasileiro de\nAssembléias Legislativas. Com a extinção dos partidos políticos pelo Ato\nInstitucional nº 2 (27/10/1965) e a posterior instauração do\nbipartidarismo, filiou-se à Aliança Renovadora Nacional (Arena), partido\nde apoio ao regime militar vigente no país. Ainda nesta legislatura, foi\nmembro da Comissão Especial Interpartidária de estudo para o\nreajustamento dos vencimentos do funcionalismo estadual e as reformas\npolítico-tributária e fiscal do Pará.\n\nNo pleito de novembro de 1966 foi reeleito deputado estadual em sua nova\nlegenda. No ano seguinte integrou a delegação do Pará ao V Congresso\nBrasileiro de Assembléias Legislativas no Recife. Em 1968 foi eleito\nvice-presidente do TJD da Federação e em 1970 tornou-se vice-líder da\nArena e representou o Pará no Conselho Interestadual das Assembléias\nLegislativas em Salvador. Nessa legislatura foi ainda membro da comissão\nespecial para promover a adaptação do Regimento Interno da Assembléia.\n\nReelegeu-se deputado estadual pela segunda vez na legenda da Arena no\npleito de novembro de 1970. Dois anos depois integrou a delegação do\nPará ao VI Congresso Brasileiro das Assembléias Legislativas em\nFortaleza e em 1973 representou a Assembléia Legislativa no VII\nCongresso Brasileiro de Tribunais de Contas. Nessa legislatura tornou-se\nlíder do governo e da Arena, membro titular da Comissão de Turismo,\nCertames e Esportes, da qual foi presidente, e das comissões de Redação\nde Leis e de Constituição e Justiça.\n\nEm 1974 deixou a Federação Paraense de Desportos, reelegendo-se deputado\nestadual pela terceira vez no pleito de novembro desse ano. Em 1976 foi\nmembro da delegação paraense ao VII Congresso Brasileiro de Assembléias\nLegislativas em Belo Horizonte. Representou em 1977 o Pará na reunião do\nConselho  da União Parlamentar Interestadual, em Maceió, e foi também\nrepresentante da Assembléia na comissão mista de alto nível para revisão\nda Constituição política do Pará e no II Encontro de Vereadores do\nestado na capital paraense.\n\nEm outubro de 1978 integrou a delegação de deputados estaduais do Pará\nno Colégio Eleitoral que elegeu, naquele mês, o general João Batista\nFigueiredo presidente da República, em substituição ao general Ernesto\nGeisel.\n\nAutor do projeto de Regimento Interno da Assembléia Legislativa do Pará,\nOsvaldo Brabo de Carvalho foi ainda nesta legislatura presidente da\nComissão de Turismo, Certames e Esportes, vice-presidente da Comissão de\nConstituição e Justiça, membro da Comissão de Estudos de\nTeleprocessamento de Dados do Norte/Nordeste, membro da Comissão\nEspecial de Estudo para a adaptação da Lei Orgânica dos Municípios do\nPará, suplente da Comissão de Finanças, Economia, Fiscalização e\nOrçamento, além de presidente da Comissão Parlamentar de Inquérito (CPI)\ndo Consumidor da Assembléia Legislativa.\n\nNo pleito de novembro de 1978 foi eleito deputado federal pelo estado do\nPará na legenda da Arena. Após concluir seu mandato na Assembléia\nLegislativa em janeiro de 1979, assumiu no mês seguinte uma cadeira na\nCâmara dos Deputados. Tornou-se membro titular da Comissão de\nConstituição e Justiça (CCJ) e suplente das comissões de Trabalho e\nLegislação Social e de Transportes. Com a extinção do bipartidarismo em\nnovembro de 1979 e a conseqüente reformulação partidária, ingressou, no\nano seguinte, no Partido Democrático Social (PDS), sucessor da Arena no\napoio ao governo. Nesse ano tornou-se vice-presidente da CPI destinada a\ninvestigar as distorções ocorridas na execução dos planos de\ndesenvolvimento da Amazônia.\n\nEm fevereiro de 1981, no entanto, Brabo de Carvalho, juntamente com o\nchamado grupo “alacidista”, composto por 11 deputados estaduais ligados\nao governador Alacid Nunes, deixou o PDS e ingressou no Partido\nTrabalhista Brasileiro (PTB), liderado nacionalmente por Ivete Vargas,\ndo qual se tornou vice-líder na Câmara. Nessa época divulgava-se a\nversão de que o PTB teria sido fundado por Ivete Vargas com a ajuda do\nentão ministro-chefe do Gabinete Civil da Presidência da República,\ngeneral Golberi do Couto e Silva. Juntamente com os demais deputados\n“alacidistas”, Brabo de Carvalho negou que tivesse instruções de Golberi\npara organizar o PTB do Pará e arregimentar filiados ou que tivesse se\nfiliado por orientação do ministro. Paralelamente, o grupo ligado ao\nsenador Jarbas Passarinho, para quem Alacid Nunes perdera a liderança do\nPDS, articulava-se para evitar que vereadores e prefeitos paraenses\ntambém deixassem o partido.\n\nEm 1982, Brabo de Carvalho deixou o PTB para ingressar no Partido do\nMovimento Democrático Brasileiro (PMDB), do qual tornou-se vice-líder na\nCâmara. Reeleito deputado federal no pleito de novembro desse ano,\niniciou novo período legislativo em fevereiro do ano seguinte. Tornou-se\nvice-presidente da Comissão de Constituição e Justiça e manteve-se como\nsuplente da Comissão de Trabalho e Legislação Social.\n\nNa sessão da Câmara dos Deputados de 25 de abril de 1984, votou a favor\nda emenda Dante de Oliveira, que propunha o restabelecimento de eleições\ndiretas para presidente da República em novembro desse ano. Como a\nemenda não obteve o número de votos necessários****à sua aprovação —\nfaltaram 22 para que o projeto pudesse ser encaminhado à apreciação do\nSenado Federal —, a sucessão presidencial teve que ser mais uma vez\ndecidida por via indireta. No Colégio Eleitoral reunido em 15 de janeiro\nde 1985, Brabo de Carvalho, embora filiado ao PMDB, votou no candidato\ndo regime militar, Paulo Maluf, que acabou sendo derrotado pelo\noposicionista Tancredo Neves. Eleito novo presidente da República pela\nAliança Democrática, uma união do PMDB com a dissidência do PDS abrigada\nna Frente Liberal, Tancredo não chegou a ser empossado na presidência em\nfunção de uma enfermidade, vindo a falecer em 21 de abril de 1985. Seu\nsubstituto no governo foi o vice José Sarney, que já vinha exercendo\ninterinamente o cargo desde 15 de março deste ano.\n\nBrabo de Carvalho deixou de concorrer a nova reeleição no pleito de\nnovembro de 1986 e, em janeiro do ano seguinte, renunciou ao seu mandato\nna Câmara dos Deputados por ter sido nomeado procurador autárquico do\nInstituto de Administração Financeira da Previdência e Assistência\nSocial (Iapas). No dia 17 desse mês assumiu a superintendência do Iapas\nno seu estado, na qual permaneceu até 15 de março de 1990, quando se\naposentou como procurador autárquico.\n\nTornou-se assessor especial do gabinete do governador Almir Gabriel no\nseu primeiro período de governo (1995-1999).\n\nCasou-se com Leila Abud de Carvalho, com quem teve cinco filhos.\n\nAlan Carneiro/Vítor Gomes\n\nFONTES: CÂM. DEP.*Deputados brasileiros*.*Repertório*(1979-1983 e\n1983-1987); *Estado de* *S. Paulo* (20/2/81); *Globo*(16/1/85); INF.\nBIOG.;*Veja* (4 e 11/2/81).\n\n \n","ref":"FONTES: CÂM. DEP.*Deputados brasileiros*.*Repertório*(1979-1983 e\n1983-1987); *Estado de* *S. Paulo* (20/2/81); *Globo*(16/1/85); INF.\nBIOG.;*Veja* (4 e 11/2/81).\n\n \n","dic":"DHBB"}
