{"title":"TINOCO, Aldo","cargoss":["Prefeito"],"cargos_esp":["Natal"],"datas_ini":[1993],"datas_fim":[1997],"estados":[0],"content":"**TINOCO, Aldo**\n\n\\* pref. Natal 1993-1997.\n\n \n\n*Aldo Tinoco Filho*foi eleito prefeito de Natal, na legenda do Partido\nSocialista Brasileiro (PSB), no segundo turno das eleições de 1992,\nsuperando os candidatos das duas principais famílias políticas do Rio\nGrande do Norte: os irmãos Henrique Alves, do Partido do Movimento\nDemocrático Brasileiro (PMDB), apoiado pelos Alves, e Ana Catarina\nAlves, do Partido da Frente Liberal (PFL), apoiada pela família Maia.\nLigado inicialmente à então prefeita, Vilma Maia, Aldo Tinoco se\nafastaria dela logo início do exercício do mandato.\n\nTomou posse em janeiro de 1993, e sua gestão na prefeitura de Natal\nficou conhecida pelos investimentos em saneamento básico na capital.\nDeixou a prefeitura em janeiro de 1997, após o final do seu mandato.\n\nFormou-se em Engenharia Civil e se especializou em Engenharia Sanitária\ne Hidráulica.\n\n \n\n**FONTE**: *Tribuna do Norte* (online) 30 nov. 2008. Disponível em :\n\\<[http://tribunado\nnorte.com.br/motoresrn2008/noticias.php?id=77637](http://tribunado%20norte.com.br/motoresrn2008/noticias.php?id=77637)\\>.\nAcesso em : 09 dez. 2009.\n","ref":"","dic":"DHBB"}
