{"title":"CARVALHO, Edmar","cargoss":["Constituinte","Deputado federal profissional"],"cargos_esp":[0,0],"datas_ini":[1934,1935],"datas_fim":[1934,1937],"estados":[0,0],"autor":[0],"content":"**CARVALHO, Edmar**\n\n\\*const. 1934; dep. fed. prof. 1935-1937.\n\n*Edmar da Silva Carvalho* nasceu em Porto Alegre no dia 5 de outubro de\n1898, filho de Felisberto da Silva Carvalho e de Maria Perciliana de\nCarvalho.\n\nEstudou no Colégio Anchieta e no Instituto Eletrotécnico, anexo à Escola\nde Engenharia de Porto Alegre. Realizou seus estudos superiores apenas\npor dois anos, não podendo prossegui-los por falta de recursos.\n\nComerciário, trabalhou como auxiliar da firma Antônio Barcelos, de Porto\nAlegre, durante nove anos, e foi também viajante comercial da companhia\nAlberto Terra e Martíni Gaspori. Depois disso, tornou-se funcionário da\nCompanhia Swift no Rio Grande do Sul.\n\nEm 1929, identificado com os princípios liberais, apoiou a campanha\noposicionista da Aliança Liberal em torno da candidatura de Getúlio\nVargas à presidência da República no pleito marcado para o ano seguinte,\natuando sobretudo em São Gabriel (RS). Com a vitória do candidato\nsituacionista Júlio Prestes, aderiu às articulações que culminaram na\nRevolução de 1930. Filiou-se depois ao Partido Republicano Liberal (PRL)\ndo Rio Grande do Sul, fundado em novembro de 1932 pelo interventor José\nAntônio Flores da Cunha e dissidentes da Frente Única Gaúcha (FUG).\n\nDelegado eleitor do Sindicato dos Empregados do Comércio do Rio Grande\ndo Sul à Convenção dos Sindicatos dos Empregados reunida no Rio de\nJaneiro em julho de 1933, foi eleito deputado classista à Assembléia\nNacional Constituinte, tornando-se representante profissional dos\nempregados no comércio. Deixou a Swift para assumir uma cadeira na\nAssembléia ao se iniciarem os trabalhos em novembro de 1933. Ocupando a\ntribuna em 26 de dezembro seguinte, desculpou-se por não ser possuidor\nde “uma cultura que [correspondesse] à inteligência de todos” e\nprosseguiu com suas críticas às explorações feitas em nome da classe\noperária naquela casa, elogiando o Governo Provisório, do qual “...o\noperariado recebeu... tudo o que ele pôde dar”. Durante essa sessão,\nAcir Medeiros, representante dos empregados no Rio de Janeiro, acusou-o\nde servir aos interesses do “patrão e não dos operários”, episódio que\ndeu início a uma longa rivalidade entre os dois.\n\nEm outra de suas intervenções na tribuna, referindo-se aos derrotados na\nRevolução Constitucionalista de 1932, declarou-se contrário à liberdade\nou ao retorno dos “políticos profissionais” exilados no exterior,\nmanifestando-se a favor da “soltura de nossos companheiros e jornalistas\nque, pela defesa de suas idéias, estivessem no território nacional em\nprisões simples”. Em outra ocasião, declarou seu apoio à política do\nministro da Fazenda, Osvaldo Aranha, que, no seu entender, “não\npleiteava interesse para si”, mas, “sempre que [podia] — em benefício\ndas camadas pequeninas e da classe proletária”. Na sessão de 6 de\nfevereiro de 1934, travou uma longa discussão pessoal com Acir Medeiros,\na quem acusou de haver “revolucionado” Itaperuna (RJ). Este respondeu\nacusando-o de manter “ligações com a burguesia, explorando o\nproletariado”.\n\nCom a promulgação da nova Carta (16/7/1934), como os demais\nconstituintes, teve o mandato estendido até maio de 1935. Ainda em 1934,\nfoi eleito deputado federal classista, tornando-se suplente da mesa da\nCâmara durante a legislatura que se seguiu. Permaneceu na Câmara dos\nDeputados até novembro de 1937, quando o advento do Estado Novo suprimiu\ntodos os órgãos legislativos do país.\n\nCasou-se com Coradina Macedo Carvalho.\n\nFONTES: ASSEMB. NAC. CONST. 1934.*Anais*(1, 5 e 7); *Boletim Min. Trab.\n(*5/36)*;* CÂM. DEP. *Deputados; Diário do Congresso*\n*Nacional;*GODINHO, V. *Constituintes.*\n\n \n","ref":"FONTES: ASSEMB. NAC. CONST. 1934.*Anais*(1, 5 e 7); *Boletim Min. Trab.\n(*5/36)*;* CÂM. DEP. *Deputados; Diário do Congresso*\n*Nacional;*GODINHO, V. *Constituintes.*\n\n \n","dic":"DHBB"}
