{"title":"CABRAL, Domiciano","cargoss":["Deputado federal","Deputado federal"],"cargos_esp":[0,0],"datas_ini":[2004,1999],"datas_fim":[2007,2003],"estados":["PB","PB"],"autor":[0],"content":"**CABRAL, Domiciano**\n\n\\*dep. fed. PB 1999-2003, 2004-2007.\n\n \n\n*José Domiciano Cabral* nasceu em João Pessoa no dia 16 de março de\n1955, filho de Severino Alves Cabral e de Anadia Domiciano Cabral.\n\nIniciou a militância política em 1982, quando se filiou ao Partido do\nMovimento Democrático Brasileiro (PMDB), cujo diretório municipal na\ncapital paraibana presidiu entre 1985 e 1987. Eleito vereador em João\nPessoa em outubro de 1992, foi líder do partido na Câmara Municipal\nentre 1993 e 1995 e vice-líder em 1995. Em 1996, formou-se em\nadministração de empresas pelo Instituto Paraíba de Educação, em João\nPessoa.\n\nNo pleito de outubro de 1998 foi eleito deputado federal pela Paraíba,\nsempre na legenda do PMDB. Assumiu o mandato em fevereiro de 1999, e em\n2000 assumiu a vice-liderança do bloco formado pelo PMDB, o Partido\nSocial Trabalhista (PST) e o Partido Trabalhista Nacional (PTN). No ano\nseguinte, deixou o PMDB e se filiou ao Partido da Social Democracia\nBrasileira (PSDB). Ao longo da legislatura, foi vice-presidente Comissão\nda Execução Orçamentária, membro titular das comissões de Administração\ne Serviço Público, e de Educação, Cultura e Desporto, e suplente das\ncomissões de Constituição, Justiça e Redação, de Desenvolvimento, de\nSaúde, de várias comissões especiais e ainda do Conselho de Ética e\nDecoro Parlamentar.\n\nReelegeu-se deputado federal pelo PSDB em outubro de 2002, mas se\nlicenciou do mandato logo no início da legislatura, em fevereiro de\n2003, para exercer o cargo de secretário de Infraestrutura da Paraíba,\nno governo de Cássio Cunha Lima. Sua cadeira na Câmara dos Deputados foi\nocupada pelo suplente Marcondes Gadelha. Em janeiro de 2004 reassumiu o\nmandato, tornando a licenciar-se de 9 de maio a 8 de setembro de 2006.\nParticipou como titular das comissões de Ciência e Tecnologia,\nComunicação e Informática, de Desenvolvimento Urbano e Interior, e de\nViação e Transportes, e foi suplente das comissões de Agricultura e\nPolítica Rural, de Constituição, Justiça e Redação, e de Desenvolvimento\nUrbano, de Educação e Cultura. Em janeiro de 2007 deixou a Câmara, ao\nfinal do mandato.\n\n \n\nFONTES: *Site* da Câmara dos Deputados (www2.camara.gov.br); *Site* da\nCâmara dos Vereadores de João Pessoa (www.cmjp.pb.gov.br). Consultas\nrealizadas no dia 25 de outubro de 2009.\n","ref":"FONTES: *Site* da Câmara dos Deputados (www2.camara.gov.br); *Site* da\nCâmara dos Vereadores de João Pessoa (www.cmjp.pb.gov.br). Consultas\nrealizadas no dia 25 de outubro de 2009.\n","dic":"DHBB"}
