{"title":"ARRUDA, Avenzoar","cargoss":["Deputado federal"],"cargos_esp":[0],"datas_ini":[1999],"datas_fim":[2003],"estados":["PB"],"autor":[0],"content":"**ARRUDA, Avenzoar**\n\n\\* dep. fed. PB 1999-2003.\n\n \n\n                *José Avenzoar Arruda das Neves* nasceu na cidade de\nBonito da Fé (PB), no dia 13 de abril de 1962, filho de Francisco Arruda\nde Sousa e de Francisca Neves de Sousa.\n\nEm 1981, ingressou no curso de engenharia mecânica da Universidade\nFederal da Paraíba (UFPB). Nesse mesmo ano, foi eleito coordenador do\nCentro Acadêmico de Engenharia Mecânica. Membro do Conselho Superior de\nEnsino, Pesquisa e Extensão da universidade em 1981 e 1982, neste último\nano foi nomeado membro do Conselho de Transportes Urbanos da Prefeitura\nde João Pessoa, ocupando esse cargo até 1983. Entre 1983 e 1984, ocupou\na presidência do Diretório Central dos Estudantes (DCE) da UFPB e, nesse\nmesmo período, foi membro do Conselho Universitário. No ano seguinte,\nfoi eleito presidente da Associação Universitária de Bonito de Santa Fé,\nfunção que exerceu até 1985.\n\nEm 1986, filiou-se ao do Partido dos Trabalhadores (PT), dando início à\nsua trajetória político-partidária. Em 1987, ingressou no magistério\ncomo professor do Colégio Marista Pio X, em João Pessoa. Formou-se\nengenheiro mecânico pela UFPB em 1988 e no ano seguinte começou a\nlecionar na Escola Técnica Federal da Paraíba (ETFPB). Na área sindical,\npresidiu entre 1989 e 1992 o Sindicato dos Trabalhadores em\nEstabelecimentos de Ensino Privado (SINTEENP). \n\nEm outubro de 1992, foi eleito vereador pelo PT à Câmara Municipal de\nJoão Pessoa, iniciando o mandato em janeiro de 1993. Nesse mesmo ano,\nfoi indicado secretário-geral da Comissão Executiva Regional do partido\nna Paraíba, cargo que ocupou até 1995. Antes disso, em outubro de 1994,\ncandidatou-se ao governo estadual pelo PT, mas não se elegeu.\n\nAo longo da legislatura 1993-1997, foi presidente da Comissão de\nFinanças e Orçamento e da Comissão Parlamentar de Inquérito (CPI) de\nBolsas de Estudo, membro titular da comissão que discutiu o Projeto de\nEmenda Constitucional (PEC) de Segurança Pública, suplente do PEC de\nAlteração do Capítulo do Sistema Tributário Nacional.  Disputou mais um\nmandato de vereador no pleito de outubro de 1996, mas, por uma diferença\nde apenas 14 sufrágios, não conseguiu reeleger-se. Deixou a Câmara\nMunicipal de João Pessoa em 31 de dezembro de 1996. Nesse período, foi\ntambém membro do Diretório Nacional do PT e em seguida da Comissão\nExecutiva Municipal do partido.\n\n                Foi eleito, em outubro de 1998, o primeiro deputado\nfederal do PT paraibano, alcançando 16.649 votos, tomando posse em\nfevereiro de 1999. Nesse ano, atuou como titular de diversos PECs, a\nsaber: PEC nº 7/99 (Ações Trabalhistas); PEC nº 33/99 (Juízes\nClassistas); PEC nº PEC nº 56/99 (Fundo Nacional Desenvolvimento\nSemi-Árido); PEC nº 57/99 (Fundo Nacional Desenvolvimento Semi-Árido);\nPEC nº 76-A/99 (Recursos Ciência e Tecnologia); PEC nº 98/99\n(Atribuições de Vice-Prefeito); PEC nº 637/99 (Prorrogação da CPMF). No\nano seguinte, ainda como titular, atuou também no PEC nº 254/00\n(Recursos Destinados à Irrigação).\n\n                Ao longo do mandato de deputado federal, participou de\nsete Comissões Permanentes da Câmara: Agricultura e Política Rural\n(titular e suplente); Amazônia e Desenvolvimento Regional (suplente);\nEducação, Cultura e Desporto (suplente); Fiscalização Financeira e\nControle (suplente); Legislação Participativa (titular); Minas e Energia\n(suplente); Trabalho, Administração e Serviço Público (titular).\nParticipou também, na qualidade de titular, da Comissão Especial de\nFixação do Salário Mínimo e do Grupo de Trabalho de Transposição do Rio\nSão Francisco.\n\nEm outubro de 2002, não se candidatou à reeleição à Câmara dos\nDeputados, voltando a disputar o governo da Paraíba pela coligação Um\nNovo Caminho, liderada pelo PT. Obteve a terceira colocação no pleito,\nno qual Cássio Cunha Lima, do Partido da Social Democracia Brasileira\n(PSDB), sagrou-se vitorioso. Em outubro de 2004, foi o candidato do\nPartido dos Trabalhadores à prefeitura de João Pessoa, mais uma vez sem\nsucesso. Dois anos depois, disputou uma vaga para deputado estadual,\ntambém pelo PT, não sendo novamente bem sucedido.\n\n                Em abril de 2008, desligou-se do PT e filiou-se ao\nPartido Socialismo e Liberdade (PSOL).\n\n \n\n \n\nFONTES: *Site* da Câmara dos Deputados (www2.camara.gov.br); *Jornal\nParaíba Online* (paraibaonline.com.br); *Site* Terra Notícias (*Governo\nPB, eleições 2002*).\n\n \n","ref":"FONTES: *Site* da Câmara dos Deputados (www2.camara.gov.br); *Jornal\nParaíba Online* (paraibaonline.com.br); *Site* Terra Notícias (*Governo\nPB, eleições 2002*).\n\n \n","dic":"DHBB"}
