{"title":"CARVALHO, João Pedro de","cargoss":["Deputado federal"],"cargos_esp":[0],"datas_ini":[1975],"datas_fim":[1979],"estados":["SP"],"autor":[0],"content":"**CARVALHO, João Pedro de**\n\n\\*dep. fed. SP 1975-1979.\n\n \n\n*João Pedro de Carvalho Neto* nasceu em Lins (SP) no dia 26 de abril de\n1926, filho de João Pedro de Carvalho Júnior e de Zózima de Andrade\nCarvalho.\n\nFormou-se engenheiro civil pela Escola de Engenharia da Universidade\nMackenzie em 1952, tornando-se no mesmo ano diretor técnico da Sociedade\nde Engenharia Engevil Ltda.\n\nProfessor de geologia da Escola Técnica Mackenzie e de topografia na\nFaculdade de Arquitetura e na Escola de Engenharia da Universidade\nMackenzie (a partir de 1957), fez carreira nessa universidade, tendo\nparticipado do conselho técnico administrativo da Faculdade de\nArquitetura de 1958 a 1964. Lecionou também topografia na Escola de\nEngenharia Mauá, até 1967.\n\nEm 1966, ao mesmo tempo em que se tornava professor da Faculdade de\nTecnologia de Barretos (SP), foi designado diretor administrativo  das\ncentrais de Abastecimento S.A. (Ceasa). De 1967 a 1970, foi coordenador\ndo curso de engenharia civil da Faculdade de Barretos e, em 1968,\ntornou-se vice-diretor da Faculdade de Arquitetura da Universidade\nMackenzie. Diretor da mesma faculdade a partir de 1969, em setembro\ndesse mesmo ano foi eleito vice-reitor da Universidade, com mandato de\ntrês anos. Em 1970 e 1971, presidiu a comissão executiva do vestibular\nunificado da Mackenzie, e neste último ano chegou a ocupar a reitoria da\nuniversidade.\n\nAinda em 1971, foi nomeado coordenador executivo do Plano Nacional de\nEducação no estado de São Paulo, e tornou-se diretor executivo do Fundo\nEstadual de Construções Escolares (FECE), cargo no qual permaneceu até\n1973. Nesse ano, foi nomeado secretário municipal de Obras da capital\npaulista, deixando o cargo em maio do ano seguinte para concorrer às\neleições de novembro.\n\nNo pleito de novembro de 1974, elegeu-se deputado federal por São Paulo\nna legenda da Aliança Renovadora Nacional (Arena), partido de apoio ao\nregime militar instaurado no país em abril de 1964, assumindo o mandato\nem fevereiro de 1975. Na Câmara, integrou a Comissão de Minas e Energia\ne foi suplente da Comissão de Transportes. Foi ainda membro da Fundação\nMílton Campos para Pesquisas e Estudos Políticos, criada pela Arena em\n1975. Candidato à reeleição em novembro de 1978, não obteve novo\nmandato. Deixou a Câmara em janeiro do ano seguinte, ao final da\nlegislatura.\n\nFaleceu em São Paulo no dia 24 de dezembro de 1987.\n\nEra casado com Zélia Maia de Carvalho, com quem teve três filhas.\n\n \n\nFONTES: CÂM. DEP. *Deputados;*CÂM. DEP. *Deputados brasileiros.\nRepertório*(1975-1979); DEP. PESQ. ESTADO DE SÃO PAULO (1971); INF.\nFAM.; *Jornal da Tarde*(16/5/74); NÉRI, S. *16; Política*.**\n\n \n\n \n","ref":"FONTES: CÂM. DEP. *Deputados;*CÂM. DEP. *Deputados brasileiros.\nRepertório*(1975-1979); DEP. PESQ. ESTADO DE SÃO PAULO (1971); INF.\nFAM.; *Jornal da Tarde*(16/5/74); NÉRI, S. *16; Política*.**\n\n \n\n \n","dic":"DHBB"}
