{"title":"VIRGÍLIO, Artur","cargoss":["Deputado federal","Deputado federal","Prefeito","min chefe Sec Geral Presid","Senador"],"cargos_esp":[0,0,"Manaus",0,0],"datas_ini":[1995,1983,1989,2001,2003],"datas_fim":[1998,1987,1993,2002,0],"estados":["AM","AM",0,0,"AM"],"autor":["Eduardo Junqueira","Alan Carneiro","Adrianna Setemy"],"content":"**VIRGÍLIO, Artur**\n\n\\*diplomata; dep. fed. AM 1983-1987 e 1995-1998; pref. Manaus 1989-1993;\nmin.chefe Sec.Geral Presid. 2001-2002; sen. AM 2003-.\n\n*Artur Virgílio do Carmo Ribeiro Neto* nasceu em Manaus no dia 15 de\nnovembro de 1945, filho de Artur Virgílio do Carmo Ribeiro Filho e de\nIsabel Vitória de Matos Pereira do Carmo Ribeiro. Seu pai foi deputado\nfederal pelo Amazonas de 1959 a 1963 e senador pelo mesmo estado de 1963\na 1969, quando teve seu mandato cassado e os direitos políticos\nsuspensos por dez anos com base no Ato Institucional nº 5 (13/12/1968).\nFoi ainda presidente do Instituto Nacional da Previdência Social (INPS)\nde 1985 a 1987.\n\nBacharel em ciências jurídicas e sociais pela Faculdade de Direito da\nUniversidade Federal do Rio de Janeiro (UFRJ), Artur Virgílio Neto\ningressou na carreira política em 1966 filiando-se ao Movimento\nDemocrático Brasileiro (MDB), partido de oposição ao regime militar\ninstaurado em abril de 1964. Foi membro da primeira comissão provisória\ndo partido no Rio de Janeiro.\n\nEm 1975 ingressou no Instituto Rio Branco e no ano seguinte no\nMinistério das Relações Exteriores como terceiro-secretário. Participou\nde missões diplomáticas na Argentina (1976 e 1977), na Bolívia (1977) e\nna Venezuela (1977). Em 1979 foi promovido a segundo-secretário. Nesse\nposto, atuou no Departamento de Organismos Internacionais do ministério.\n\nCom a extinção do bipartidarismo em novembro de 1979 e a conseqüente\nreformulação partidária, filiou-se no ano seguinte ao Partido do\nMovimento Democrático Brasileiro (PMDB), sucessor do MDB. Já radicado no\nAmazonas, tornou-se vice-presidente da primeira comissão provisória do\npartido em seu estado. Nas eleições de novembro de 1982, elegeu-se\ndeputado federal pelo Amazonas. Assumindo uma cadeira na Câmara dos\nDeputados em fevereiro do ano seguinte, foi vice-líder do partido,\ntitular da Comissão de Economia, Indústria e Comércio e suplente da\nComissão de Relações Exteriores, da qual se tornou, posteriormente,\ntitular, e das comissões de Justiça e de Minas e Energia.\n\nNo início dessa legislatura, o deputado Dante de Oliveira (PMDB-MT)\napresentou na Câmara dos Deputados um projeto de emenda constitucional\nestabelecendo eleições diretas para a presidência da República a partir\nde novembro do ano seguinte. Encampado pelas oposições, esse projeto\najudou o desencadeamento de uma campanha nacional que ficou conhecida\ncomo das Diretas Já. Artur Virgílio foi o coordenador dessa campanha no\nAmazonas. Na sessão da Câmara dos Deputados de 25 de abril de 1984,\nvotou favoravelmente à emenda Dante de Oliveira, que, por falta de 22\nvotos, não foi aprovada nessa casa do Congresso, fato que impediu seu\nenvio para apreciação do Senado.\n\nCom esse resultado, foi reafirmado que o novo presidente da República\nseria eleito de forma indireta. Para concorrer com os candidatos a\npresidente e a vice apoiados pelo regime militar — Paulo Maluf e Flávio\nMarcílio — as oposições, reunidas na Aliança Democrática, lançaram\nTancredo Neves, governador de Minas Gerais, para presidente, e José\nSarney, então senador pelo Maranhão, para vice-presidente da República.\nArtur Virgílio foi o coordenador de Tancredo no Amazonas. Na reunião do\nColégio Eleitoral de 15 de janeiro de 1985, votou nos candidatos\noposicionistas, que foram os vencedores. Contudo, por motivo de doença,\nTancredo não chegou a ser empossado na presidência, vindo a falecer em\n21 de abril de 1985. Seu substituto no cargo foi Sarney, que já vinha\nexercendo interinamente a presidência da República desde 15 de março\ndaquele ano.\n\nEm maio de 1986, por discordar da escolha do nome de Amazonino Mendes\npelo PMDB para concorrer à sucessão de Gilberto Mestrinho no governo\nestadual nas eleições de novembro seguinte, Artur Virgílio ingressou no\nPartido Socialista Brasileiro (PSB), juntamente com vários políticos da\nchamada ala progressista do PMDB no Amazonas, que também haviam ficado\ndescontentes com a indicação.\n\nEscolhido candidato do PSB, que encabeçava a coligação Muda Amazonas —\nintegrada ainda pelos partidos Democrático Trabalhista (PDT), Comunista\ndo Brasil (PCdoB), Democrata Cristão (PDC) e Trabalhista Renovador (PTR)\n— para a sucessão estadual, Artur Virgílio Neto iniciou um movimento de\nintensa oposição a Mestrinho e Amazonino. No entanto, contando com o\napoio de Mestrinho, Amazonino derrotou Artur Virgílio, que denunciou\nirregularidades na contagem de votos.\n\nEm 1987 Artur Virgílio assumiu a presidência regional do PSB no\nAmazonas. Nas eleições municipais de novembro de 1988, elegeu-se\nprefeito de Manaus, derrotando o ex-governador Gilberto Mestrinho e\nassumiu o cargo em janeiro de 1989. Ainda em 1989 filiou-se ao PSDB e\ncoordenou em seu estado a campanha de Mário Covas, candidato do partido\nà presidência da República no pleito de novembro desse mesmo ano.\n\nVoltou a ser promovido no Itamarati em 1991, passando a\nprimeiro-secretário. Como prefeito de Manaus, Artur Virgílio Neto\nestreitou relações com políticos conservadores. Em fevereiro de 1991,\naproximou-se do presidente da República, Fernando Collor de Melo\n(1990-1992), do Partido da Reconstrução Nacional (PRN). No mês seguinte,\naproximou-se de Gilberto Mestrinho, que tinha sido eleito pelo PMDB\ngovernador do Amazonas em outubro de 1990, depois de ter rompido com\nAmazonino em 1989.\n\nArtur Virgílio Neto compôs um dossiê acusando Amazonino de\nirregularidades em seu governo. Em março de 1992, entregou o dossiê ao\nministro da Justiça, Jarbas Passarinho, solicitando a abertura de\ninvestigações, mas não obteve êxito.\n\nEm julho de 1992, para prevenir o desmatamento em reservas florestais,\nArtur Virgílio Neto nomeou guardas florestais os habitantes da\nlocalidade de Tupé, localidade às margens do Rio Negro onde havia\nimportantes sítios arqueológicos. A medida gerou polêmica, uma vez que\nos novos guardas eram remunerados pela prefeitura, quando a competência\npara isso seria do governo estadual.\n\nVirgílio permaneceu à frente da prefeitura de Manaus até 31 de dezembro\nde 1992, quando foi substituído por Amazonino Mendes, que tinha sido\neleito em outubro do mesmo ano.\n\nDepois de um breve período sem mandato, Virgílio candidatou-se, nas\neleições de outubro de 1994, a uma vaga na Câmara dos Deputados pelo\nestado do Amazonas na legenda do PSDB, que concorreu coligado ao PMDB.\nNesse mesmo ano coordenou a campanha de Fernando Henrique Cardoso,\ncandidato vitorioso do partido à presidência da República. Baseando sua\ncampanha na estabilidade econômica decorrente do lançamento do Plano\nReal, Artur Virgílio Neto foi eleito com a maior votação do estado.\nTomando posse na Câmara em fevereiro do ano seguinte, passou a integrar,\ncomo titular, a Comissão de Fiscalização Financeira e Controle.\n\nEm março de 1995, Virgílio desentendeu-se com deputados integrantes da\ncomissão conjunta da área econômica que ouviam explicações do presidente\ndo Banco Central (BC), Pérsio Arida, sobre a desvalorização da moeda\nocorrida dias antes. Ao sair em defesa de Arida e da política cambial\nimplementada pelo governo, atacou os deputados Delfim Neto, do Partido\nProgressista Brasileiro (PPB) de São Paulo, e Maria da Conceição\nTavares, do Partido dos Trabalhadores (PT) do Rio de Janeiro, que faziam\nobjeções às medidas tomadas pela área econômica do governo.\n\nEm abril, solidarizou-se com o ministro das Comunicações, Sérgio Mota,\nque criticara a política social do governo Fernando Henrique. Poucos\ndias depois, o presidente anunciou um extenso programa de auxílio aos\ntrabalhadores com renda inferior a três salários mínimos para a compra\nde casas populares. Virgílio, na ocasião, afirmou que o sucesso da\npolítica social do governo federal dependia de as reformas\nadministrativas serem aprovadas pelo Congresso. No mês seguinte, ele se\ntornou um dos principais defensores dessas reformas e atacou a bancada\ndo Partido da Frente Liberal (PFL), aliada do governo e partido do\nvice-presidente Marco Maciel, por achar que essa agremiação tentava\ncausar embaraços na votação dessa reforma, devido a interesses políticos\nem seus redutos eleitorais.\n\nO apoio incondicional ao projeto político governista lhe trouxe, em\njunho de 1995, a vice-liderança do PSDB na Câmara. Como um dos deputados\nmais solidários com a proposta das reformas defendidas pelo presidente\nFernando Henrique Cardoso, foi um dos responsáveis por uma reunião, no\nmês de setembro, em Brasília, onde foram expostas aos 27 governadores\npresentes as diretrizes do projeto de reforma do Estado. Em dezembro\nseguinte, teve atuação decisiva no Congresso, solicitando verificação de\nquórum para impedir que fosse instaurada uma auditoria para fiscalizar o\nTribunal de Contas da União (TCU) e a Receita Federal. O objetivo da\nauditoria era averiguar o envolvimento desses órgãos na manutenção de\nsaldos fictícios de instituições financeiras falidas, que em troca\nteriam financiado candidaturas de políticos governistas nas campanhas\neleitorais de 1990 e 1994.\n\nAo longo de 1995, votou a favor de todas as emendas de interesse do\ngoverno, tais como a que acabou com o monopólio dos estados na\ndistribuição do gás canalizado; a que permitiu que embarcações\nestrangeiras passassem a operar no transporte de cargas e passageiros\nentre portos do país; a que estabelecia um novo conceito de empresa\nnacional, acabando com todas as diferenças legais entre empresas\nbrasileiras e estrangeiras; a que acabava com o monopólio estatal das\ntelecomunicações; a que acabava com o monopólio da Petrobras na\nexploração do petróleo; e a que criava o Fundo Social de Emergência\n(FSE), rebatizado de Fundo de Estabilização Fiscal (FEF).\n\nEm abril de 1996, candidatou-se à presidência nacional do PSDB,\nconclamando os parlamentares do partido à união, tendo como adversário\nArtur da Távola, senador pelo Rio de Janeiro e então presidente da\nlegenda. A bancada do partido no Senado era favorável à continuidade de\nTávola, enquanto a bancada da Câmara pedia a renovação e apoiava o nome\nde Virgílio. Na convenção nacional do partido, no dia 20 de abril, Artur\nda Távola foi escolhido presidente nacional, ficando Artur Virgílio com\na secretaria geral do partido.\n\nDois dias depois da convenção do PSDB, Artur Virgílio, juntamente com o\ngovernador do Pará, Almir Gabriel, visitaram os sobreviventes da chacina\nde Eldorado do Carajás, que levou à morte 19 trabalhadores sem-terra.\nCansados de esperar por uma solução do governo para o assentamento de\nfamílias de sem-terra em terras desapropriadas, centenas de\ntrabalhadores rurais fizeram um protesto obstruindo a rodovia PA-150, em\nEldorado do Carajás (PA). A Polícia Militar enviou um destacamento para\nliberar a estrada, o que acabou por gerar o conflito e a chacina. Artur\nVirgílio responsabilizou a lentidão da Justiça pelo ocorrido, afirmando\nque era preciso acabar com a “chaga do latifúndio”.\n\nA adesão de Virgílio ao governo lhe valeu experiências constrangedoras\nnas comemorações do 1º de maio de 1996. Desconsiderando orientação da\nCentral Única dos Trabalhadores (CUT), ele compareceu a uma manifestação\nem Brasília convocada pelas centrais sindicais para o Dia do Trabalho e\ninsistiu em discursar para a multidão presente ao ato. Foi vaiado e, na\ncondição de secretário-geral do partido que estava no governo no Pará,\nresponsabilizado pelo massacre de Eldorado do Carajás. Sem conseguir\ndiscursar e chamado de assassino, afirmou que os sem-terra eram “urubus”\ne que a reivindicação de aumento do salário mínimo para 180 reais era\n“pura demagogia” (o valor do salário mínimo na época era de cem reais).\n\nAinda em maio de 1996, discordou da nomeação do deputado Francisco\nDornelles, do PPB, para o Ministério da Indústria e do Comércio, mesmo\nsabendo que se tratava de uma nomeação que buscava o apoio dos\npepebistas na votação dos projetos do governo no Congresso. Virgílio e a\nbancada do PSDB se recusaram a comparecer à posse do novo ministro, em\ncujo partido havia setores que defendiam a proteção da empresa nacional\ne que, por isso, eram contrários ao projeto de abertura da economia ao\ncapital internacional. Sempre fiel ao governo de Fernando Henrique\nCardoso, entrou em choque com a bancada do PFL e, particularmente, com\nos senadores Antônio Carlos Magalhães e Benito Gama, ambos da Bahia,\nquando o PFL negou apoio ao projeto de quebra do monopólio das\ncomunicações do ministro Sérgio Mota.\n\nNa derrota sofrida pelo governo na votação da reforma da Previdência, no\nfinal de maio de 1996, Virgílio apontou como causa a exigência de se ter\no voto de 3/5 da Câmara para reformar a Constituição. O custo, segundo o\nsecretário-geral do PSDB, teria sido muito alto para os resultados\nobtidos. O gasto efetuado pelo governo para tentar convencer os\ndeputados a se fazerem presentes em plenário e aprovar a reforma da\nPrevidência chegou a aproximadamente 13 bilhões de reais, divididos\nentre o atendimento dos pedidos da bancada ruralista de refinanciamento\ne a anistia de dívidas de agricultores com o Banco do Brasil e outros\nfavores. Na ocasião, Virgílio voltou a atacar os deputados de partidos\ngovernistas, como o PFL, pela demora na aprovação das medidas de reforma\ndo Estado.\n\nAo longo de 1996, votou a favor da reforma da previdência e da recriação\ndo imposto do cheque, que deixou de se chamar Imposto Provisório sobre\nMovimentação Financeira (IPMF) e foi rebatizado de Contribuição\nProvisória sobre Movimentação Financeira (CPMF), entre outras medidas\napresentadas pelo governo. Em janeiro do ano seguinte, quando tramitava\nna Câmara o projeto de emenda constitucional que permitia aos ocupantes\nde cargos no Poder Executivo concorrerem à reeleição, votou a favor do\nmesmo, ratificando sua posição em fevereiro, quando a proposta foi\naprovada em segundo turno de votação. Em novembro desse mesmo ano também\nvotou a favor do projeto do governo que, ao ser aprovado, acabou com a\nestabilidade do servidor público.\n\nNo pleito de outubro de 1998 reelegeu-se deputado federal na legenda da\ncoligação integrada pelo PSDB, tendo sido o único candidato do partido\nno Amazonas a conseguir uma cadeira no Congresso. No mês seguinte, votou\na favor do projeto do governo de reforma da Previdência que fixou um\nvalor máximo para aposentadorias no setor público, bem como instituiu\numa idade mínima e aumentou o tempo mínimo de contribuição no setor\nprivado.\n\nEm fevereiro do ano seguinte iniciou novo período legislativo na Câmara\ndos Deputados. Durante o seu novo mandato, foi líder do governo no\nCongresso Nacional.\n\nAinda ao final de 2001, porém, licenciou-se da Câmara para assumir, o\ncargo de ministro-chefe da Secretaria Geral da Presidência da República\ne Conselheiro de Governo na Presidência da República, no Governo\nFernando Henrique Cardoso (1995-2003). Virgílio retomou seu mandato de\ndeputado já em abril de 2002, ano em que se elegeria senador por\nAmazonas, na legenda do PSDB, com mais de 608 mil votos.\n\nAo iniciar-se a nova legislatura, em fevereiro de 2003, tornou-se líder\ndo PSDB no Senado, onde passou a atuar no comando das oposições ao\nrecém-iniciado Governo Luís Inácio Lula da Silva (2003-2007). Também\nparticipou no Senado como titular da Comissão Especial de Reforma do\nJudiciário; das Comissões Externas de Rondônia e do Ano Internacional da\nMulher Latino-Americana; da Comissão Parlamentar Mista de Inquérito\n(CPMI) das Ambulâncias; da Comissão de Direitos Humanos e Legislação\nParticipativa; da Comissão Parlamentar de Inquérito (CPI) das ONGs; da\nComissão de Serviços de Infra-Estrutura; de Meio Ambiente, Defesa do\nConsumidor e Fiscalização e Controle; de Assuntos Econômicos; e de\nArquitetura e Reforma Agrária.\n\nDurante seu mandato, eclodiu a crise de maior repercussão do primeiro\ngoverno Lula, que ficou conhecida como “escândalo do mensalão”.  O\nestopim da crise  ocorreu em maio de 2005, quando um funcionário dos\nCorreios, Maurício Marinho, foi flagrado recebendo propina de\nempresários. Apadrinhado do então deputado federal Roberto Jefferson, do\nPartido Trabalhista Brasileiro (PTB), Marinho passou a ser investigado e\nJefferson foi acusado de fazer parte do esquema de corrupção dos\nCorreios. Em junho de 2005, Jefferson concedeu uma entrevista a revista\n*Veja*denunciando um esquema de compra de votos de parlamentares no\nCongresso Nacional, que consistia no pagamento regular de deputados da\nbase governista, na quantia de R\\$30 mil reais por mês, para que eles\naprovassem as matérias em tramitação no Congresso que fossem a favor do\ngoverno. Os pagamentos seriam efetuados por Delúbio Soares, que na\nocasião era tesoureiro do PT, e pelo empresário Marcos Valério de Souza,\nproprietário de duas agências de publicidade que serviam de fachada para\nocultar o recebimento de depósitos irregulares destinados à campanha\neleitoral do PT. No auge do escândalo, Artur Virgílio exigiu que Lula\ndemitisse os auxiliares sob suspeita de corrupção, argumentando que,\npara o presidente, era mais fácil se livrar dos “políticos indesejáveis”\ndo que “o Brasil querer se livrar dele”.\n\nNa ocasião, parlamentares decidiram criar a CPI do Mensalão, a fim de\ninvestigar tanto as denúncias de pagamento do “mensalão” a deputados da\nbase aliada, quanto o suposto esquema montado em 1997, ainda no governo\nFernando Henrique Cardoso, para a compra de votos que garantissem a\naprovação da emenda constitucional que permitiria a reeleição\npresidencial. Artur Virgílio sugeriu então que a Comissão Parlamentar\nMista de Inquérito (CPMI) dos Correios, instalada desde maio de 2005, e\njá em pleno funcionamento, absorvesse a CPI do Mensalão, que ainda\ndeveria aguardar a nomeação de seus integrantes titulares e suplentes,\numa vez que as duas tratavam de assuntos inter-relacionados.\n\nApesar do empenho do senador Artur Virgílio em cobrar a investigação do\nenvolvimento de parlamentares membros do partido governista e mesmo do\npróprio presidente em escândalos de corrupção, explicou que não era\nfavorável a um pedido de *impeachment*do presidente da República, em\nprimeiro lugar, porque era preciso haver prova “mais cabal” de seu\nenvolvimento no processo de corrupção existente governo e, em segundo\nlugar, porque se houve corrupção na campanha eleitoral isso poderia\nenvolver também o vice-presidente da República, José Alencar e, nesse\ncaso, quem assumiria a presidência seria o então presidente da Câmara\ndos Deputados, Severino Cavalcanti, que na ocasião estava sendo acusado\nde ter recebido propina mensal de R\\$10 mil para estender a concessão de\num restaurante da Câmara sem licitação, entre os anos de 2002 e 2003,\nperíodo em que exercera o cargo de primeiro-secretário.\n\nEm 2006, Virgílio foi membro do Conselho Político da candidatura do\nex-governador de São Paulo, Geraldo Alckmin, à presidência da República,\nna legenda do PSDB. Em campanha marcada pelo desdobramentos do escândalo\ndo mensalão, no ano anterior, o candidato tucano conseguiu levar a\ndisputa para o 2º turno, sendo aí, porém, derrotado por Lula, que se\nreelegeu. Durante o segundo mandato de Lula, iniciado em janeiro de\n2007, Artur Virgílio manteve-se como líder da oposição no Senado.\n\n            Ainda em setembro de 2006, a queda de um avião da companhia\naérea Gol detonou uma crise no setor aéreo brasileiro que ficou\nconhecida na imprensa como “apagão aéreo”, em alusão ao episódio que\nafetou o fornecimento e distribuição de energia elétrica durante o 2º\ngoverno Fernando Henrique Cardoso (1999-2003). Após o acidente do vôo\nGol 1907, que resultou na morte de 154 pessoas, teve início uma\nsequência de colapsos no transporte aéreo nacional, resultante dos\natrasos causados pela chamada “operação-padrão” dos controladores de\ntráfego aéreo, que decidiram por conta própria aumentar o espaçamento\nentre as decolagens, sem a autorização de instâncias superiores, o que\nprovocou uma situação de caos nos principais aeroportos do país, com\natrasos e vôos cancelados. A isso, se seguiu a instalação de uma\ncomissão externa no Senado Federal, integrada pelos senadores Artur\nVirgílio, Antonio Carlos Magalhães (PFL-BA), Sibá Machado (PT-AC),\nJefferson Peres (PDT-AM) e Ney Suassuna (PMDB-PB), para discutir a crise\nnos aeroportos brasileiros e cobrar do governo agilidade nas\ninvestigações, bem como a instalação de uma CPI.\n\nEnquanto discutia-se a criação de uma CPI na Câmara dos Deputados para\ninvestigar as causas, conseqüências e responsáveis pela crise do sistema\nde tráfego aéreo brasileiro, Artur Virgílio anunciou que o  PSDB iria\ncomeçar, paralelamente, a colher as assinaturas necessárias para a\ncriação da CPI do Apagão no Senado Federal, que segundo Virgílio,\ndeveria ser mais ampla do que a proposta ela Câmara, investigando\ndenúncias de irregularidades na Infraero, controle de mercado por\ncompanhias aéreas e problemas no sistema de aviação civil. Em 18 de\nabril de 2007, os senadores da oposição protocolaram na Mesa Diretora do\nSenado um requerimento pedindo a abertura da CPI na Casa, com 34\nassinaturas, sendo 15 do Democratas (DEM) – legenda que substituíra o\nPFL –, 14 do PSDB, 4 do PMDB e uma do PDT. Duas semanas após a\ninstalação da CPI na Câmara dos Deputados, foi instalada no Senado a CPI\ndo Apagão Aéreo, na qual Virgílio atuou como suplente. Ao contrário da\nCPI da Câmara, em que membros da base governista ocuparam a presidência\ne a relatoria, na CPI do Apagão no Senado a oposição ficou com a\nrelatoria enquanto o governista Tião Viana (PT-AC) ocupou a presidência\nda comissão.\n\nDurante o desenvolvimento dos trabalhos da CPI, Artur Virgílio cobrou as\ndemissões do ministro da Defesa, Waldir Pires; da ministra do Turismo,\nMarta Suplicy; do assessor especial da Presidência da República, Marco\nAurélio Garcia; e do presidente da Empresa Brasileira de Infra-Estrutura\nAeroportuária (Infraer), José Carlos Pereira. Considerava recomendável,\ntambém, a saída do presidente da Agência Nacional de Aviação Civil\n(Anac), Milto Zuanazzi., afirmando que tais medidas eram “o mínimo que a\nNação, traumatizada” poderia esperar do presidente da República.\n\nEm 2007, Artur Virgílio foi uma das principais vozes a favor da renúncia\nou cassação do mandato do presidente do Senado, o peemedebista Renan\nCalheiros, que teve seu nome envolvido em denúncias de corrupção.  Após\nvirem a público as relações entre Renan Calheiros e lobistas de\nempreiteiras, em 25 de maio, o senador Artur Virgílio, durante uma\nsessão no Senado, informou que seu partido havia decidido pedir o\nafastamento de Calheiros da presidência da Casa até o momento final das\ninvestigações, tendo sido, portanto, o quarto partido a tomar tal\natitude. Daí em diante, outros senadores, de sete partidos diferentes,\nengrossaram o coro. Em novembro, Renan Calheiros renunciou à presidência\ndo Senado.\n\nEm fevereiro de 2008, Artur Virgílio encaminhou à Mesa do Senado um\nrequerimento com 33 assinaturas para a criação de uma CPI composta\napenas por senadores e destinada a investigar os gastos efetuados por\nmembros do governo federal detentores de cartão de crédito corporativo,\ndesde sua criação em 2001, caso que ficou conhecido na mídia como o\n“escândalo dos cartões corporativos”. Conforme o requerimento de\nVirgílio, as investigações deveriam abranger nome, cargo, lotação e\nendereço dos usuários dos cartões corporativos, bem como as denúncias de\nuso indevido e irregular dos mesmos, o que foi objeto de ampla\nveiculação e especulação pela imprensa, e que denunciou, dentre outros\nabusos, a compra de artigos pessoais sem justificativa. Após um acordo\ncom o PMDB, que cedeu a indicação da presidência da CPI para o PSDB,\nArtur Virgílio, indicou o nome da senadora Marisa Serrano (PSDB-MS),\npara ocupar o cargo na comissão que teve caráter misto, reunindo,\nportanto, parlamentares da Câmara e do Senado.\n\nAo fim da CPMI dos Cartões Corporativos, foi aprovado o relatório final\ndo deputado Luiz Sérgio (PT-RJ), que não pedia nenhum indiciamento,\nenquanto que a oposição apresentou relatório separado em que pedia cerca\nde 470 indiciamentos. Sem aprofundar as investigações, a CPMI ficou\nmarcada pela disputa entre governistas e oposição. Para Artur Virgílio,\na maioria governista impediu sistematicamente que as investigações\nfossem aprofundadas.\n\nEm junho de 2009, em caráter pessoal, Virgílio apresentou ao Conselho de\nÉtica uma denúncia contra o presidente do Senado, José Sarney, que se\nsomou às demais denúncias e representações feitas no Conselho de Ética\ncontra ele, pedindo que Sarney fosse investigado e responsabilizado pela\nedição de “atos secretos”, usados para nomear parentes de senadores e\naumentar os benefícios de alguns servidores; por irregularidades no\nintermédio em operações de crédito consignado para servidores do Senado,\nfeitas a partir da empresa do seu neto; por supostas irregularidades no\nrepasse de R\\$1,3 milhão da Petrobrás para a Fundação José Sarney; e,\nfinalmente, pela posse de uma mansão de R\\$4 milhões em Brasília, que\nnão teria sido declarada à Justiça Eleitoral, para não pagar tributos.\nNo total, foram seis as denúncias analisadas contra Sarney pelo Conselho\nde Ética, sendo que quatro foram apresentadas por Virgílio e duas em\nconjunto com o senador Cristovam Buarque (PDT-DF). Além disso, foram\nprotocoladas cinco representações contra Sarney: três pelo PSDB e duas\npelo Partido Socialismo e Liberdade (PSOL). Entretanto, todas as\nacusações contra o presidente do Senado foram arquivadas após uma\nvotação unânime no Conselho de Ética, de 15 votos a zero.\n\nNa mesma ocasião, Artur Virgílio também foi alvo de uma\nrepresentação                                 do PMDB com várias\nacusações. Uma delas referia-se ao pagamento de salário a um funcionário\ndo seu gabinete que estava morando na Europa. Virgílio também foi\nacusado de ultrapassar o limite do plano de saúde para pagar despesas\ncom um tratamento de saúde de sua mãe. Além disso, teria recebido\nempréstimo do ex-diretor geral do Senado, Agaciel Maia, para pagar\ngastos durante uma viagem a Paris. Na ocasião, Agaciel foi apontado como\num dos responsáveis pelo escândalo dos atos secretos utilizados\nprincipalmente para criar cargos e aumentar salários, e foi afastado de\nseu cargo depois da denúncia de que teria omitido em sua declaração à\nReceita Federal um imóvel avaliado em R\\$5 milhões. Virgílio defendeu-se\ndas acusações dizendo que devolveria o dinheiro público direcionado para\no pagamento ao funcionário afastado e afirmou que o empréstimo de\nAgaciel havia sido quitado. Assim como as ações contra Sarney, a\nrepresentação contra Virgílio também foi arquivada pelo Conselho de\nÉtica.\n\nFoi casado com Jacqueline Arduini Duarte do Carmo Ribeiro, com quem teve\num filho, Artur Virgílio do Carmo Ribeiro Bisneto, deputado estadual do\nAmazonas de 2003 a 2007. Contraiu segundas núpcias com Maria Gorete da\nCunha Garcia, com quem teve dois filhos.\n\nEduardo Junqueira/Alan Carneiro/Adrianna Setemy\n\nFONTES: CÂM. DEP. *Deputados brasileiros.* *Repertório*(1983-1987 e\n1995-1999); *Estado de S. Paulo* (24 e 25/3, 21/4, 8/5, 16/6, 16/7 e\n27/9/95, 4 e 7/4, 2, 16, 19 e 24/5, 5 e 19/6/96, 28/11/97); *Folha de S.\nPaulo*(25/3/91, 22 e 24/5, 5/6/96, *Especial* 6/11/98); *Globo* (6 e\n9/4, 2 e 22/5/96, 29/1/97); *Jornal do Brasil*(7 e 26/2, 5/4/91,\n25/7/92, 9/5/95, 22/4, 2, 8, 12, 21, 22, 24 e 26/5/96); *Olho no\nCongresso/Folha de S. Paulo* (14/1/96 e 30/1/97); PORTAL EXPRESSO DA\nNOTÍCIA (25/7/2007; disponível em:\n[http://74.125.113.132/search?q=cache:iLu8duoHm14J:www.expressodanoticia.com.br/index.php%3Fpagid%3DNA0mwme%26id%3D107%26tipo%3DYM2Uw%26esq%3DufxiCqf%26id\\_mat%3D5851+Arthur+Virgilio%2Brelat%C3%B3rio+final+CPI+apag%C3%A3o+aereo&cd=5&hl=pt-BR&ct=clnk&gl=br](http://74.125.113.132/search?q=cache:iLu8duoHm14J:www.expressodanoticia.com.br/index.php%3Fpagid%3DNA0mwme%26id%3D107%26tipo%3DYM2Uw%26esq%3DufxiCqf%26id_mat%3D5851+Arthur+Virgilio%2Brelat%C3%B3rio+final+CPI+apag%C3%A3o+aereo&cd=5&hl=pt-BR&ct=clnk&gl=br);\nacesso em: 10/2/2009); PORTAL FOLHA ON LINE (8/12/2006; disponível em:\n[http://www1.folha.uol.com.br/folha/cotidiano/ult95u129161.shtml](http://www1.folha.uol.com.br/folha/cotidiano/ult95u129161.shtml);\nacesso em: 10/02/2010); PORTAL DIREITO2. COM (11/7/2005, 18/4/2007;\nDisponível em: http://www.direito2.com.br; acesso em: 9/2/2010); PORTAL\nO ESTADO DE S. PAULO**(6/6/2005; disponível em:\n[http://aprendiz.uol.com.br/content/uemoswoste.mmp](http://aprendiz.uol.com.br/content/uemoswoste.mmp);\nacesso em: 9/2/2010); PORTAL O GLOBO (10/2/2010; disponível em:\n[http://oglobo.globo.com/pais/mat/2009/06/29/arthur-virgilio-apresenta-denuncia-ao-conselho-de-etica-contra-sarney-756570838.asp](http://oglobo.globo.com/pais/mat/2009/06/29/arthur-virgilio-apresenta-denuncia-ao-conselho-de-etica-contra-sarney-756570838.asp);\nacesso em: PORTAL VEJA (TRIB. REG. ELEIT. AM. *Relação* (1998).\n\n \n","ref":"FONTES: CÂM. DEP. *Deputados brasileiros.* *Repertório*(1983-1987 e\n1995-1999); *Estado de S. Paulo* (24 e 25/3, 21/4, 8/5, 16/6, 16/7 e\n27/9/95, 4 e 7/4, 2, 16, 19 e 24/5, 5 e 19/6/96, 28/11/97); *Folha de S.\nPaulo*(25/3/91, 22 e 24/5, 5/6/96, *Especial* 6/11/98); *Globo* (6 e\n9/4, 2 e 22/5/96, 29/1/97); *Jornal do Brasil*(7 e 26/2, 5/4/91,\n25/7/92, 9/5/95, 22/4, 2, 8, 12, 21, 22, 24 e 26/5/96); *Olho no\nCongresso/Folha de S. Paulo* (14/1/96 e 30/1/97); PORTAL EXPRESSO DA\nNOTÍCIA (25/7/2007; disponível em:\n[http://74.125.113.132/search?q=cache:iLu8duoHm14J:www.expressodanoticia.com.br/index.php%3Fpagid%3DNA0mwme%26id%3D107%26tipo%3DYM2Uw%26esq%3DufxiCqf%26id\\_mat%3D5851+Arthur+Virgilio%2Brelat%C3%B3rio+final+CPI+apag%C3%A3o+aereo&cd=5&hl=pt-BR&ct=clnk&gl=br](http://74.125.113.132/search?q=cache:iLu8duoHm14J:www.expressodanoticia.com.br/index.php%3Fpagid%3DNA0mwme%26id%3D107%26tipo%3DYM2Uw%26esq%3DufxiCqf%26id_mat%3D5851+Arthur+Virgilio%2Brelat%C3%B3rio+final+CPI+apag%C3%A3o+aereo&cd=5&hl=pt-BR&ct=clnk&gl=br);\nacesso em: 10/2/2009); PORTAL FOLHA ON LINE (8/12/2006; disponível em:\n[http://www1.folha.uol.com.br/folha/cotidiano/ult95u129161.shtml](http://www1.folha.uol.com.br/folha/cotidiano/ult95u129161.shtml);\nacesso em: 10/02/2010); PORTAL DIREITO2. COM (11/7/2005, 18/4/2007;\nDisponível em: http://www.direito2.com.br; acesso em: 9/2/2010); PORTAL\nO ESTADO DE S. PAULO**(6/6/2005; disponível em:\n[http://aprendiz.uol.com.br/content/uemoswoste.mmp](http://aprendiz.uol.com.br/content/uemoswoste.mmp);\nacesso em: 9/2/2010); PORTAL O GLOBO (10/2/2010; disponível em:\n[http://oglobo.globo.com/pais/mat/2009/06/29/arthur-virgilio-apresenta-denuncia-ao-conselho-de-etica-contra-sarney-756570838.asp](http://oglobo.globo.com/pais/mat/2009/06/29/arthur-virgilio-apresenta-denuncia-ao-conselho-de-etica-contra-sarney-756570838.asp);\nacesso em: PORTAL VEJA (TRIB. REG. ELEIT. AM. *Relação* (1998).\n\n \n","dic":"DHBB"}
