{"title":"CARVALHO, José Carlos Gomes","cargoss":["Senador"],"cargos_esp":[0],"datas_ini":[1989],"datas_fim":[1990],"estados":["PR"],"autor":[0],"content":"**CARVALHO, José Carlos Gomes**\n\n\\*sen. PR 1989-1990.\n\n \n\n*José Carlos Gomes Carvalho*, também conhecido como *Carvalhinho*,\nnasceu em Santo Antônio da Platina (PR), filho de José Domingos\nMarcondes Carvalho e de Josefina Gomes de Carvalho.\n\nEm 1959 bacharelou-se em ciências jurídicas e sociais pela Faculdade de\nDireito de Curitiba, especializando-se mais tarde em administração de\nempresas na Fundação Getulio Vargas (FGV). Empresário, atuou durante\nmuitos anos como presidente do grupo Corujão e da *holding* Rocar,\ncongregação de empresas dos setores de informática, automotivo,\nfinanceiro, agroflorestal, agropastoril e da indústria de plástico.\n\nFiliado ao Partido do Movimento Democrático Brasileiro (PMDB), no pleito\nde novembro de 1986 integrou como suplente a chapa do PMDB para o Senado\nFederal encabeçada por Afonso Camargo, afinal vitoriosa. No ano\nseguinte, foi nomeado secretário da Indústria e Comércio na gestão do\ngovernador Álvaro Dias (1987-1991). Em agosto de 1989, com a saída de\nCamargo do Senado para disputar a eleição presidencial, assumiu sua\ncadeira, ocupando-a até o retorno do titular, em janeiro de 1990. Nesse\nmesmo ano, acompanhando Camargo, transferiu-se do PMDB para o Partido\nTrabalhista Brasileiro (PTB), e em junho do ano seguinte assumiu a\npresidência do partido no estado.\n\nNo pleito de outubro de 1992, candidatou-se pelo PTB a vice-prefeito de\nCuritiba na chapa encabeçada por Rafael Grecca, do Partido Democrático\nTrabalhista (PDT). Ambos foram empossados em seus cargos em 1º de\njaneiro de 1993. Nesse ano, deixou a presidência do PTB.\n\nEm 1995, foi eleito presidente do Sistema Federação das Indústrias do\nParaná (Fiep) e vice-presidente da Confederação Nacional da Indústria\n(CNI). Em meados do ano seguinte transferiu-se do PTB para o Partido da\nFrente Liberal (PFL), tornando-se presidente do partido no estado a\npartir de novembro. Também em 1996 foi nomeado presidente do Conselho\nTemático de Infraestrutura da CNI, órgão responsável por estudos,\ndebates e soluções para os setores de energia, telecomunicações,\ntransportes, petróleo e portos. Membro do conselho da Coordenação de\nAperfeiçoamento do Pessoal de Ensino Superior (Capes) a partir de\noutubro de 1997, no ano seguinte tornou-se vice-presidente do conselho\nda Câmara de Indústria e Comércio Brasil-Ucrânia e membro do diretório\nnacional do PFL.\n\nEm janeiro de 1999, foi nomeado presidente do Conselho Empresarial\nBrasil-Paraguai e do Serviço Brasileiro de Apoio às Micro e Pequenas\nEmpresas (Sebrae) do Paraná. Em abril seguinte deixou a presidência do\nPFL paranaense e em dezembro tornou-se secretário do Emprego e Relações\nde Trabalho, no segundo governo de Jaime Lerner, permanecendo no cargo\naté abril de 2001. Em seguida tornou-se suplente de Osmar Dias, do PDT,\nque foi eleito senador no pleito de 6 de outubro de 2002.\n\nApós a posse do presidente Luís Inácio Lula da Silva em janeiro de 2003,\npassou a fazer parte do Conselho de Desenvolvimento Econômico e Social\n(CDES) da Presidência da República, órgão de caráter consultivo\nintegrado por representantes de vários segmentos da sociedade civil,\ndestinado a auxiliar o governo federal na elaboração de políticas\npúblicas.\n\nEm maio de 2003 resolveu não disputar a reeleição para a presidência da\nFiep, entidade da qual esteve à frente por cerca de oito anos. No dia 1º\nde outubro de 2003, no dia da posse da nova diretoria da Fiep, faleceu\nsubitamente devido a uma infecção generalizada ocasionada por uma\ngastentrerite infecciosa por alimento contaminado, deixando pronto o\ndiscurso com o qual passaria o cargo para o novo presidente eleito.\n\nAlguns meses após a sua morte, a nova diretoria da Fiep solicitou uma\nauditoria nas contas da instituição durante sua gestão, e foram\nconstatadas várias irregularidades financeiras, entre as quais o desvio\nde cerca de 36 milhões de reais do Instituto Euvaldo Lodi (IEL),\nentidade mantida pelas federações das indústrias como organismo de\nintegração entre empresas e escolas. Em virtude dessas irregularidades o\nMinistério Público do Paraná, em conjunto com outras entidades,\ninclusive a própria Fiep, entrou com uma ação civil pública de\nimprobidade administrativa contra Carvalho e seus herdeiros. De acordo\ncom a denúncia do Ministério Público, os recursos desviados\ncorrespondiam a contribuições parafiscais repassadas ao IEL pelo Sesi e\npelo Senai entre 1996 e 2003. Em fevereiro de 2007 o juizado da 3ª Vara\nda Fazenda Pública determinou o bloqueio em caráter liminar de seus\nbens, em consequência da ação movida pelo Ministério Público, que visava\nao ressarcimento dos valores aos cofres públicos, visto que as\ncontribuições parafiscais são consideradas verbas públicas.\n\nFoi ainda presidente do conselho do Centro de Integração Tecnológica do\nParaná (Citpar), membro do Conselho de Autoridade Portuária dos Portos\nde Paranaguá e Antonina, no Paraná, e presidente do Conselho Empresarial\nBrasil-Paraguai, organismo facilitador das relações empresariais e\ngovernamentais dos dois países entre si e com os parceiros do Mercado\nComum do Sul (Mercosul). Entre outras condecorações e homenagens recebeu\na Ordem do Rio Branco (Grau Comendador) do governo federal, a Comenda do\nMérito Industrial Nacional, da Confederação Nacional da Indústria e a\nComenda do Mérito da Administração, concedida pela Escola Brasileira de\nAdministração Pública e de Empresas da Fundação Getúlio Vargas (FGV).\n\nCasou-se com Eliane Loureiro Sousa de Carvalho, com quem teve dois\nfilhos.\n\n \n\nFONTES: *Estado do Paraná*(24/2/2007, 15/3/2007); *Folha de Londrina*\n(13/7/2007); Portal do Senado www.senado.gov.br acesso em 26/10/2009.\n\n \n\n \n","ref":"FONTES: *Estado do Paraná*(24/2/2007, 15/3/2007); *Folha de Londrina*\n(13/7/2007); Portal do Senado www.senado.gov.br acesso em 26/10/2009.\n\n \n\n \n","dic":"DHBB"}
