{"title":"ALMEIDA, Antônio Martins de","cargoss":["Revolucionário ou revoltoso","Interventor"],"cargos_esp":[0,0],"datas_ini":[1930,1933],"datas_fim":[1930,1935],"estados":[0,"MA"],"autor":[0],"content":"**ALMEIDA, Antônio Martins de**\n\n\\*militar; rev. 1930; interv. MA 1933-1935.\n\n* *\n\n*Antônio Martins de Almeida* nasceu no dia 22 de outubro de 1900.\n\nIngressou no Exército, assentando praça em dezembro de 1918 e\ntornando-se aspirante em janeiro de 1922. Em abril desse ano, foi\npromovido a segundo-tenente e classificado no 13º Batalhão de Caçadores,\nsediado em Joinville (SC). No ano seguinte, foi transferido para o 10º\nRegimento de Infantaria, em Juiz de Fora (MG).\n\nEm 1923 e 1924, cursou a Escola de Aperfeiçoamento de Oficiais do Rio de\nJaneiro. Promovido a primeiro-tenente em 2 de julho de 1924, nesse mesmo\nmês passou a participar da repressão à revolta irrompida em São Paulo\nsob o comando do general Isidoro Dias Lopes.\n\nEm 1925, retornou ao 10º Regimento de Infantaria, aí permanecendo até\n1928, quando foi enviado para o Colégio Militar do Ceará na função de\ninstrutor.\n\nConspirou e participou da Revolução de 1930 nos estados do Ceará e da\nParaíba. Em 1931, retomou suas tarefas no Colégio Militar em Fortaleza.\nEntre 1931 e 1932, foi colocado à disposição da interventoria no Piauí,\nocupando o cargo de secretário-geral desse estado. Ainda em 1932, foi\nenviado a São Paulo para combater a Revolução Constitucionalista\nirrompida em julho, que acabou derrotada pelas forças federais no mês de\noutubro.\n\nEm novembro de 1932, foi promovido a capitão.\n\nDe 29 de junho de 1933 a 22 de junho de 1935, foi interventor federal no\nMaranhão, recebendo o cargo do coronel Álvaro Jansen Serra Lima\nSaldanha, interventor interino. Seu governo foi marcado pela repressão\naos opositores e por ataques violentos da imprensa. Conflitos de ordem\nfiscal e orçamentária opuseram-se à Associação Comercial do estado, a\nqual, por ter decretado um lockout, teve seus diretores presos. Foi\nsubstituído no governo do Maranhão por Aquiles de Faria Lisboa, eleito\npela Assembléia Constituinte Estadual.\n\nEntre 1935 e 1936, Antônio Martins de Almeida serviu no Estado-Maior da\n1ª Região Militar, no Rio de Janeiro. Em 1936, foi transferido para a\nEscola de Armas, em Salvador. Nos anos de 1937 e 1938, serviu no 2º\nBatalhão de Caçadores, no estado do Rio de Janeiro, e em 1939 voltou a\nservir no Estado-Maior da 1ª Região Militar. Entre 1939 e 1940, serviu\nno 1º Batalhão de Caçadores, em Petrópolis (RJ).\n\nEm dezembro de 1941, foi promovido a major. Durante esse ano e o\nseguinte cursou a Escola do Estado-Maior do Exército. De 1943 a 1945,\nserviu no Estado-Maior da 10ª Região Militar, sediada em Fortaleza,\nrealizando durante o ano de 1944 um breve estágio nos Estados Unidos.\n\nDe 1945 a 1949, serviu novamente no Estado-Maior da 1ª Região Militar,\nno Rio. Em junho de 1946, foi promovido a tenente-coronel.\n\nEm 25 de outubro de 1951 foi promovido a coronel, passando seis dias\ndepois para a reserva no posto de general-de-brigada.\n\nFaleceu em 1963.\n\nPublicou Exposição apresentada ao presidente da República Getúlio Vargas\npelo interventor federal do estado do Maranhão, capitão Antônio Martins\nde Almeida (1935).\n\n \n\nFONTES: ARQ. GETÚLIO VARGAS; CONSULT MAGALHÃES, B; *Grande encic.\nDelta*; *Jornal do Comércio, Rio* (1/7/1933); MEIRELES, M. *História*;\nMIN. GUERRA. *Almanaque* (1947); POPPINO, *R. Federal*.\n\n \n","ref":"FONTES: ARQ. GETÚLIO VARGAS; CONSULT MAGALHÃES, B; *Grande encic.\nDelta*; *Jornal do Comércio, Rio* (1/7/1933); MEIRELES, M. *História*;\nMIN. GUERRA. *Almanaque* (1947); POPPINO, *R. Federal*.\n\n \n","dic":"DHBB"}
