{"title":"CARVALHO, Nélson Noronha de","cargoss":["Comandante do II Distrito Naval","comte-em-ch Esquadra"],"cargos_esp":[0,0],"datas_ini":[1949,1953],"datas_fim":[1950,1954],"estados":[0,0],"autor":[0],"content":"**CARVALHO, Nélson Noronha de**\n\n\\*militar; comte. II DN 1949-1950; comte-em-ch. Esquadra 1953-1954.\n\n \n\n*Nélson Noronha de Carvalho* nasceu no Rio de Janeiro, então Distrito\nFederal, no dia 19 de junho de 1891, filho de Manuel Pacheco de Carvalho\nJúnior e Alice Noronha de Carvalho.\n\nIngressando na Escola Naval em fevereiro de 1908, tornou-se\nsegundo-tenente em dezembro de 1912, primeiro-tenente em agosto de 1916\ne capitão-tenente em janeiro de 1923. Em junho de 1933 foi promovido a\ncapitão-de-corveta, em outubro de 1940 a capitão-de-fragata e em\ndezembro de 1944 a capitão-de-mar-e-guerra.\n\nAtingindo o posto de contra-almirante em dezembro de 1948, foi designado\ncomandante do II Distrito Naval (DN), sediado em Salvador, onde\npermaneceu de março do ano seguinte a novembro de 1950. Promovido a\nvice-almirante em julho de 1952, foi comandante-em-chefe da Esquadra de\nmaio de 1953 até setembro de 1954. Foi ainda presidente da Comissão de\nMarinha Mercante de novembro de 1955 a março de 1956.\n\nFaleceu no Rio de Janeiro, no dia 23 de setembro de 1969.\n\n \n\nFONTES: CORRESP. SERV. DOC. GER. MAR.; FICHÁRIO PESQ. M. AMORIM; MIN.\nMAR. *Almanaque* (1955).\n\n \n","ref":"FONTES: CORRESP. SERV. DOC. GER. MAR.; FICHÁRIO PESQ. M. AMORIM; MIN.\nMAR. *Almanaque* (1955).\n\n \n","dic":"DHBB"}
