{"title":"CARVALHO, Roberto","cargoss":["Deputado federal"],"cargos_esp":[0],"datas_ini":[1975],"datas_fim":[1983],"estados":["SP"],"autor":[0],"content":"**CARVALHO, Roberto**\n\n\\*dep. fed. SP 1975-1983.\n\n* *\n\n*Roberto Dahas de Carvalho* nasceu em Barretos (SP) no dia 6 de novembro\nde 1934, filho de Raul Dahas de Carvalho e de Zenária Dahas de Carvalho.\n\nBacharelou-se em ciências jurídicas e sociais pela Faculdade de Direito\nda Universidade de São Paulo em 1958.\n\nAdvogado, professor, pecuarista e proprietário agrícola, no pleito de\nnovembro de 1974 elegeu-se deputado federal por São Paulo na legenda do\nMovimento Democrático Brasileiro (MDB), partido de oposição ao regime\nmilitar instaurado no país em abril de 1964. Assumindo o mandato em\nfevereiro de 1975, nessa legislatura foi membro efetivo da Comissão de\nFinanças e suplente das comissões de Agricultura e Política Rural e de\nRelações Exteriores da Câmara dos Deputados. Reeleito em novembro de\n1978, voltou a participar como membro efetivo da Comissão de Finanças e\nda Comissão de Relações Exteriores da Câmara dos Deputados.\n\nCom a extinção do bipartidarismo em novembro de 1979 e a conseqüente\nreformulação partidária, filiou-se ao Partido Democrático Social (PDS),\nacompanhando o grupo de parlamentares oposicionistas que se vinculara ao\ngovernador paulista Paulo Maluf.\n\nNas eleições de novembro de 1982, recandidatou-se à Câmara dos Deputados\npelo estado de São Paulo, na legenda do PDS, obtendo apenas uma\nsuplência. Deixou a Câmara em janeiro do ano seguinte, ao final da\nlegislatura. Com a extinção do PDS em 1993, permaneceu sem partido.\nAtuando como advogado e pecuarista nos municípios de Pompéia e Iepê\n(SP), em 1996 filiou-se ao Partido Liberal (PL).\n\nFaleceu no dia 23 de fevereiro de 1998.\n\nEra casado com Maria do Carmo Dahas de Carvalho.\n\n* *\n\n*FONTES: CÂM. DEP. Deputados; CÂM. DEP. Deputados* brasileiros.\nRepertório (1975-1979); IPC. *Relação de parlamentares* (1/1/92 a\n18/11/98); NÉRI, S. *16*; *Perfil* (1980).\n\n \n","ref":"*FONTES: CÂM. DEP. Deputados; CÂM. DEP. Deputados* brasileiros.\nRepertório (1975-1979); IPC. *Relação de parlamentares* (1/1/92 a\n18/11/98); NÉRI, S. *16*; *Perfil* (1980).\n\n \n","dic":"DHBB"}
