{"title":"ALMEIDA, Artur Franklin de","cargoss":["Deputado federal"],"cargos_esp":[0],"datas_ini":[1947],"datas_fim":[1951],"estados":["SP"],"autor":[0],"content":"**ALMEIDA, Artur Franklin de**\n\n\\*dep. fed. SP 1947-1951.\n\n* *\n\n*Artur Franklin de Almeida* nasceu em Mogi-Mirim (SP) no dia 24 de\noutubro de 1902, filho de Artur Cândido de Almeida e de Maria Franklin\nde Massena.\n\nTabelião, elegeu-se deputado federal por São Paulo no pleito suplementar\nde 19 de janeiro de 1947, na legenda do Partido Social Progressista\n(PSP), iniciando seu mandato em 17 de março do mesmo ano.\n\nEm 7 de janeiro de 1948, votou contra a cassação dos mandatos dos\ndeputados comunistas, decorrente da cassação do registro do Partido\nComunista do Brasil (PCB) pelo Tribunal Superior Eleitoral no ano\nanterior. Deixou a Câmara ao fim de seu mandato, 31 de janeiro de 1951.\n\nFaleceu em Ribeirão Preto (SP) no dia 16 de junho de 1992.\n\nEra casado com Leonor Marzzola Almeida, com quem teve três filhos.\n\n \n\nFONTES: CÂM. DEP. *Deputados*; CÂM. DEP. *Deputados brasileiros.\nRepertório* (1946-1967); GALVÃO, F. *Fechamento*; INF. BIOG.; LEITE, A.\n*História*; TRIB. SUP. ELEIT. *Dados* (1).\n\n \n","ref":"FONTES: CÂM. DEP. *Deputados*; CÂM. DEP. *Deputados brasileiros.\nRepertório* (1946-1967); GALVÃO, F. *Fechamento*; INF. BIOG.; LEITE, A.\n*História*; TRIB. SUP. ELEIT. *Dados* (1).\n\n \n","dic":"DHBB"}
