{"title":"CASANOVA, Válter","cargoss":["Deputado federal"],"cargos_esp":[0],"datas_ini":[1983],"datas_fim":[1987],"estados":["RJ"],"autor":[0],"content":"**CASANOVA, Válter**\n\n\\*dep. fed. RJ 1983-1987.\n\n \n\n**Válter Ribeiro Casanova** nasceu em Santana do Livramento (RS) no dia\n12 de dezembro de 1937, filho de Fausto Casanova Sagues e de Noêmia\nRibeiro Casanova.\n\nGraduado em pedagogia e em ciências jurídicas e sociais, tornou-se\ndiretor-fundador do Colégio Professor Casanova e da Escola Técnica\nProfessor Casanova, no Rio de Janeiro.\n\nIniciou sua carreira política em outubro de 1982 elegendo-se para a\nCâmara dos Deputados na legenda do Partido Democrático Trabalhista (PDT)\ndo Rio de Janeiro. Empossado em fevereiro de 1983, em 25 de abril de\n1984 votou a favor da emenda Dante de Oliveira, que previa o\nrestabelecimento de eleições diretas para presidente da República em\nnovembro daquele ano. Como a emenda não obteve a votação necessária para\nser encaminhada ao Senado Federal, a sucessão presidencial teve que ser\ndecidida mais uma vez por via indireta. No Colégio Eleitoral, reunido em\n15 de janeiro de 1985 para escolher o novo presidente do país, apoiou a\nchapa oposicionista formada por Tancredo Neves e José Sarney, lançada\npela Aliança Democrática, coligação do Partido do Movimento Democrático\nBrasileiro (PMDB) com a dissidência do Partido Democrático Social (PDS),\nagrupada na Frente Liberal. Derrotando o candidato do PDS, Paulo Maluf,\npor ampla margem de votos, Tancredo, no entanto, não chegou a assumir a\npresidência. Gravemente enfermo, veio a falecer em 21 de abril de 1985,\nsendo substituído no cargo por Sarney, que vinha exercendo a função\ninterinamente desde o dia 15 de março.\n\nNão tendo concorrido à reeleição no pleito de novembro de 1986, Casanova\ndeixou a Câmara em janeiro do ano seguinte, ao final da legislatura.\nPosteriormente transferiu-se para o Partido Trabalhista do Brasil\n(PTdoB), pelo qual se candidatou sem sucesso a deputado federal, no\npleito de outubro de 1998.\n\nCasou-se com Neiva Martins Casanova, com quem teve três filhos.\n\n \n\n \n\nFONTES: CÂM. DEP. *Deputados brasileiros. Repertório*(1983-1987); DIR.\nREGIONAL PT DO B-RJ; TRIB. SUP. ELEIT. Internet.**\n\n \n","ref":"FONTES: CÂM. DEP. *Deputados brasileiros. Repertório*(1983-1987); DIR.\nREGIONAL PT DO B-RJ; TRIB. SUP. ELEIT. Internet.**\n\n \n","dic":"DHBB"}
