{"title":"CASSEL, Mílton","cargoss":["Deputado federal","Deputado federal","Deputado federal"],"cargos_esp":[0,0,0],"datas_ini":[1974,1969,1965],"datas_fim":[1975,1971,1966],"estados":["RS","RS","RS"],"autor":[0],"content":"**CASSEL, Mílton**\n\n\\*****dep. fed. RS 1965-1966, 1969-1971 e 1974-1975.\n\n \n\n*Mílton Albino Cassel*nasceu em Montene­gro (RS) no dia 2 de outubro de\n1931, filho de Max Cassel e de Maria Luísa Cassel.\n\nDiplomado em direito, em 1956, e em econo­mia, em 1957, pela\nUniversidade Federal do Rio Grande do Sul, no pleito de outubro de 1962\nelegeu-se suplente de deputado federal pelo Rio Grande do Sul na legenda\ndo Partido So­cial Democrático (PSD).  Convocado à Câma­ra, exerceu o\nmandato de setembro de 1965 a  fevereiro do ano seguinte, e de março a\njulho de 1966.\n\nCom a extinção dos partidos políticos pelo Ato Institucional nº 2\n(27/10/1965) e a pos­terior instauração do bipartidarismo, filiou-se à\nAliança Renovadora Nacional (Arena), partido de apoio ao regime militar\ninstaurado no país em abril de 1964, e em cuja legenda tornou a\neleger-se suplente de de­putado federal em novembro de 1966.  Nova­mente\nconvocado a assumir uma cadeira de deputado federal em outubro de 1969,\nexer­ceu o mandato até o final da legislatura (31/1/1971).  Nesse\nínterim, foi ainda uma vez eleito suplente de deputado em novembro de\n1970, exercendo o mandato na legislatura se­guinte entre abril de 1974 a\n31 de janeiro de 1975, quando deixou a Câmara.\n\nFora da vida pública desde então, passou a dedicar-se às suas duas\nempresas, Mark Produtos Químicos e Mercodistribuidora Comercial de\nPlásticos.\n\nCasou-se com Maria Madalena Cassel, com quem teve três filhos.\n\n \n\nFONTES:**ASSEMB. LEGISL.RS. *Parlamentares gaúchos*; CÂM.DEP*.\nDeputados;*CÂM.DEP. *Deputados brasileiros.  Repertório*(1971-1975);\nINF. BIOG.; TRIB.  SUP. ELEIT.  *Dados*(6, 7 e 8).\n\n \n\n-                     \n\n-                     \n","ref":"FONTES:**ASSEMB. LEGISL.RS. *Parlamentares gaúchos*; CÂM.DEP*.\nDeputados;*CÂM.DEP. *Deputados brasileiros.  Repertório*(1971-1975);\nINF. BIOG.; TRIB.  SUP. ELEIT.  *Dados*(6, 7 e 8).\n\n \n\n-                     \n\n-                     \n","dic":"DHBB"}
