{"title":"CASTELO BRANCO FILHO, Hermelindo de Gusmão","cargoss":["Constituinte","Deputado federal"],"cargos_esp":[0,0],"datas_ini":[1946,1946],"datas_fim":[1946,1951],"estados":[0,"AC"],"autor":[0],"content":"**CASTELO BRANCO FILHO, Hermelindo de Gusmão**\n\n\\*const. 1946; dep. fed. AC 1946-1951.\n\n*Hermelindo de Gusmão* *Castelo Branco Filho* formou-se em direito e\nexerceu importantes cargos na magistratura carioca.\n\nEmbora radicado no Rio de Janeiro, então Distrito Federal, em dezembro\nde 1945, ao lado de Hugo Ribeiro Carneiro, foi eleito deputado\nconstituinte pelo Acre na legenda do Partido Social Democrático (PSD).\nParticipou dos trabalhos constituintes desde fevereiro de 1946 e, com a\npromulgação da nova Carta (18/9/1946) e a transformação da Constituinte\nem Congresso ordinário, teve seu mandato estendido até janeiro de 1951.\nDurante essa legislatura, integrou a Comissão Especial de Valorização da\nAmazônia e presidiu a Comissão Permanente de Legislação Social da Câmara\ndos Deputados.\n\nFONTES: CÂM. DEP. *Deputados;*CÂM. DEP. *Relação dos dep.; Diário do\nCongresso Nacional;*NÉRI, S. *16;* SILVA, G. *Constituinte;* TRIB. SUP.\nELEIT. *Dados*(1).\n\n \n","ref":"FONTES: CÂM. DEP. *Deputados;*CÂM. DEP. *Relação dos dep.; Diário do\nCongresso Nacional;*NÉRI, S. *16;* SILVA, G. *Constituinte;* TRIB. SUP.\nELEIT. *Dados*(1).\n\n \n","dic":"DHBB"}
