{"title":"CASTRO, Célio de","cargoss":["Constituinte","Deputado federal","Prefeito"],"cargos_esp":[0,0,"Belo Horizonte"],"datas_ini":[1987,1987,1997],"datas_fim":[1988,1992,2001],"estados":[0,"MG",0],"content":"**CASTRO, Célio de**\n\n\\*const. 1987-1988; dep. fed. MG 1987-1992; pref. Belo Horizonte\n1997-2001.\n\n* *\n\n*Célio de Castro* nasceu em Carmópolis (MG) no dia 11 de julho de 1932,\nfilho do farmacêutico Antenor de Castro e de Maria de Lourdes Paulinelli\nde Castro.\n\nConcluiu os estudos secundários no Colégio Arnaldo, em Belo Horizonte,\nem 1951. No ano seguinte, ingressou no curso de medicina da Universidade\nFederal de Minas Gerais (UFMG), graduando-se em 1958 com especialização\nem clínica médica e medicina de urgência. No mesmo ano foi trabalhar no\nDepartamento de Estradas de Rodagem (DER), no qual permaneceu até 1970.\nAo longo desse período, participou da implantação dos primeiros centros\nde tratamento intensivo em Minas Gerais, no Hospital Semper e no\nHospital das Clínicas da UFMG.\n\nNos anos 1970 teve intensa atividade sindical e atuou no movimento\npolítico de oposição ao regime militar instaurado no país em abril de\n1964. Integrou a Ação Popular (AP) e, mais tarde, acompanhou os\ndissidentes que formaram a Ação Popular Marxista Leninista do Brasil\n(APMLdoB). A atuação em organizações clandestinas lhe valeu a detenção\npor uma semana no Departamento Estadual de Ordem Política e Social\n(DEOPS) da capital mineira. Por conta disso, foi submetido a inquérito\nem 1975, do qual foi absolvido. Em 1976, aderiu ao Partido Comunista do\nBrasil (PCdoB), também clandestino. No final da década, foi um dos\norganizadores, em Minas, da campanha pela anistia, que resultou na\npromulgação da Lei da Anistia em agosto de 1979. Com a extinção do\nbipartidarismo em novembro desse ano e a consequente reorganização\npartidária, filiou-se ao Partido do Movimento Democrático Brasileiro\n(PMDB), de oposição ao regime militar, cuja executiva estadual viria a\nintegrar.\n\n Paralelamente à participação política, prosseguiu em sua carreira\nprofissional. Em 1975, em convênio com a UFMG, exerceu no Hospital do\nPronto Socorro – onde trabalharia por 37 anos – atividade docente\nvoltada para a formação e treinamento de estudantes de medicina. Em\n1978, tornou-se chefe do Serviço de Urgência do Hospital do Pronto\nSocorro, cargo no qual permaneceria até 1980. Trabalhou também por\nvárias décadas no Hospital das Clínicas, onde, segundo o periódico\nmensal *República*, chegou a ter um dos consultórios mais requisitados\nda cidade. A participação em movimentos associativos da categoria médica\nlevou-o por duas vezes à presidência do Sindicato dos Médicos de Belo\nHorizonte: de 1980 a 1983 e de 1983 a 1986. Em 1983, tornou-se\nvice-presidente da Federação Nacional dos Médicos, membro efetivo da\nAssociação Médica e do Conselho Regional de Medicina de Minas Gerais.\n\nEm 1983-1984, foi um dos responsáveis, em Minas Gerais, pela campanha\ndas Diretas Já, que foi apoiada pelos mais diversos setores da sociedade\ncivil (artistas, sindicalistas, religiosos, políticos de oposição etc.)\ne que visava ao restabelecimento das eleições diretas para presidente.\nEm junho de 1984, enquanto discursava para sindicalistas em um auditório\nno centro de Belo Horizonte, teve seu carro danificado a marretadas por\nmembros do Comando de Caça aos Comunistas (CCC), grupo paramilitar de\ndireita. Ainda nessa época, recebeu dezenas de ameaças de morte.\n\nEm 1986, afastou-se das funções que exercia para dedicar-se\nexclusivamente à candidatura a deputado federal constituinte por Minas\nGerais. Embora formalmente filiado ao PMDB, legenda na qual concorria,\nassumiu compromissos com o PCdoB no sentido de defender as posições\ndessa agremiação na Assembléia Nacional Constituinte. Também se\ncomprometeu com a luta pela implantação do Sistema Único de Saúde (SUS)\ne declarou-se adversário da participação do capital estrangeiro no setor\nde saúde.\n\nEleito, tomou posse em 1º de fevereiro de 1987, quando foram iniciados\nos trabalhos da Constituinte. Titular da Subcomissão dos Direitos dos\nTrabalhadores e Servidores Públicos, da Comissão da Ordem Social, e\nsuplente da Subcomissão da Família, do Menor e do Idoso, da Comissão da\nFamília, da Educação, Cultura e Esportes, da Ciência e Tecnologia e da\nComunicação, votou a favor do rompimento de relações diplomáticas com\npaíses com política de discriminação racial, da limitação do direito de\npropriedade privada, do mandado de segurança coletivo, da remuneração\n50% superior para o trabalho extra, da jornada semanal de 40 horas, do\nturno ininterrupto de seis horas, do aviso prévio proporcional, do\naborto, da unicidade sindical, da soberania popular, do voto aos 16\nanos, da nacionalização do subsolo, da estatização do sistema\nfinanceiro, do limite de 12% ao ano para os juros reais, da proibição do\ncomércio de sangue, da limitação dos encargos da dívida externa, da\nanistia aos micro e pequenos empresários e da desapropriação da\npropriedade produtiva. Votou contra a pena de morte, a pluralidade\nsindical, o presidencialismo, o mandato de cinco anos para o então\npresidente José Sarney, a criação de um fundo de apoio à reforma agrária\ne a legalização do jogo do bicho.\n\nEm abril de 1987, uma bomba de fabricação caseira foi detonada na\ngaragem de sua residência. A explosão, que não deixou feridos, ocorreu\nminutos após ter chegado em casa. Na ocasião, declarou não ter dúvidas\nsobre a natureza política do atentado, creditando-o a grupos de direita.\nO deputado Ulisses Guimarães, presidente da Constituinte e do PMDB, tão\nlogo foi informado, solicitou providências ao Ministério da Justiça e ao\ngoverno de Minas para a abertura de inquérito e a apuração de\nresponsabilidades. Dias depois, Castro declarou à imprensa que o\nepisódio teria relação com as propostas que estava apresentando para a\nnova Constituição referentes à soberania nacional e à reserva de mercado\npara a informática e para as matrizes de medicamentos.\n\nEm maio de 1988, declarou que 75 constituintes do PMDB, entre os quais\nse incluía, pretendiam organizar um novo partido, a ser fundado no mês\nseguinte, e estavam empenhados em obter a aprovação do projeto do\ndeputado Ibsen Pinheiro (PMDB-RS), que regulamentava as eleições\nmunicipais e alterava o prazo de filiação a novos partidos, alargando-o\nem mais um mês. Em junho, uniu-se a parlamentares peemedebistas\ninsatisfeitos com os rumos que a agremiação havia tomado e ajudou a\nfundar o Partido da Social Democracia Brasileira (PSDB).\n\nSua atuação como constituinte garantiu-lhe a distinção “deputado nota\ndez” dada pelo Departamento Intersindical da Apoio Parlamentar (DIAP),\nque a conferiu a apenas quatro dos 53 deputados mineiros. Entre 1987 e\n1988, foi ainda um dos articuladores do acordo parlamentar que\npossibilitou a criação do SUS, e participou da elaboração da primeira\nlei complementar à nova Constituição — a Lei Orgânica da Saúde. Foi\nautor de vários projetos de lei na sua área profissional, entre eles o\nque instituiu o Sistema Nacional de Sangue, cujo objetivo era controlar\na coleta e distribuição de sangue em todo o território nacional.\n\nCom o final dos trabalhos constituintes, em 5 de outubro de 1988, e o\ninício das atividades ordinárias, integrou como titular a Comissão de\nSaúde, Previdência e Assistência Social e a Comissão de Trabalho e, como\nsuplente, a Comissão de Serviço Público da Câmara dos Deputados. Em\njaneiro de 1990, ecoando o sentimento de correligionários esquerdistas,\nqueixou-se da direção nacional do PSDB, que não estaria assumindo uma\nconduta firme de oposição ao governo do presidente Fernando Collor de\nMelo (1990-1992). Diante da reação do deputado Euclides Scalco, líder do\npartido na Câmara dos Deputados, e do senador José Richa, ambos eleitos\npelo Paraná, que aconselharam os insatisfeitos com as diretrizes\npartidárias a deixar a agremiação, descartou a sugestão e classificou-a\ncomo um “resquício do regime militar”. Meses mais tarde, contudo, não\nhouve alternativa: trocou novamente de partido, filiando-se ao Partido\nSocialista Brasileiro (PSB), de cuja executiva estadual se tornaria\npresidente.\n\nAinda na Câmara dos Deputados, foi, de 1990 a 1991, titular da Comissão\nde Trabalho, de Administração e Serviço Público, denominação recebida\npela Comissão de Trabalho após a incorporação de novas funções, e\nsuplente da Comissão de Seguridade Social e Família. Ainda no mesmo\nperíodo, foi vice-líder do PSB na Câmara.\n\nEm outubro de 1990, candidatou-se novamente a deputado federal na\nlegenda do PSB. Reeleito, iniciou o novo mandato em fevereiro de 1991.\nNesse ano, foi titular da Comissão Parlamentar Mista de Inquérito (CPMI)\nsobre Irregularidades na Previdência Social. Foi membro, entre outras,\nda Comissão de Saúde e autor do requerimento que criou a CPI, da qual\nfez parte, encarregada de investigar o extermínio de crianças no Brasil.\nA CPI obteve avanços na fiscalização de adoções internacionais e na\napuração do assassinato de menores em todo o país. Por sua atuação, foi\ncondecorado, junto com os demais membros da Comissão, com o diploma de\nhonra do Fundo das Nações Unidas para a Infância (Unicef).\n\nEm 1992, participou ativamente do movimento em favor do *impeachment* do\npresidente Fernando Collor, desencadeado a partir da entrevista\nconcedida em maio por Pedro Collor à revista *Veja*, denunciando um\nesquema de corrupção no governo de seu irmão, liderado pelo tesoureiro\nda campanha presidencial, Paulo César Farias. A gravidade das denúncias\nensejou a criação de uma CPI, cujas conclusões levaram a Câmara dos\nDeputados a aprovar, em 29 de setembro, com o voto de Célio de Castro, a\nabertura do processo de *impeachment* e o afastamento do presidente. Em\n2 de outubro, o vice Itamar Franco assumiu interinamente a presidência\nda República. Collor renunciou ao mandato em 29 de dezembro, mas horas\ndepois o Senado aprovou seu impedimento, o que o tornou inelegível por\noito anos. Itamar Franco foi então efetivado na presidência.\n\nAinda 1992, Célio de Castro foi eleito vice-prefeito de Belo Horizonte,\nna chapa encabeçada por Patrus Ananias. Em novembro, publicou um artigo\nno jornal *O Estado de S. Paulo* atacando a proposta da equipe econômica\nrecém-empossada pelo presidente Itamar de promover um aperto fiscal para\najustar as contas públicas. Afirmou que o combate à recessão, ao\ndesemprego e à sonegação seria a melhor forma de pôr fim ao déficit da\nUnião. Em 31 de dezembro, renunciou ao mandato de deputado federal,\nsendo substituído na Câmara pelo suplente Sérgio Miranda, filiado ao\nPCdoB.\n\nEm 1º de janeiro de 1993, tomou posse como vice-prefeito, acumulando o\ncargo com o de secretário de Desenvolvimento Social, que exerceria até\n1995. Ainda em 1993, idealizou o Projeto Miguilim, de assistência a\nmenores de rua, que viria a ser premiado pela Unicef no ano seguinte. Em\njulho de 1994, a três meses do pleito presidencial, circularam rumores\nde que o senador gaúcho José Paulo Bisol, candidato a vice-presidente na\ncoligação encabeçada por Luís Inácio Lula da Silva, deixaria a chapa.\nVeiculavam-se denúncias contra Bisol, e setores petistas ligados ao\nprefeito Patrus Ananias sugeriram, caso a vacância fosse concretizada, o\nnome de Célio de Castro.\n\nEm outubro de 1996, uma coligação formada pelo PSB, o Partido Popular\nSocialista (PPS) e o PMDB lançou-o candidato à prefeitura de Belo\nHorizonte. *O jingle* da campanha — “Doutor BH” — fazia referência à sua\natuação como médico. O favoritismo anunciado pelas sondagens de voto\nconfirmou-se: Célio de Castro venceu em todas as 14 zonas eleitorais com\n429.948 votos contra 279.055 do segundo colocado, o tucano Amílcar\nMartins, de quem já fora médico. No segundo turno, realizado em 15 de\nnovembro, juntaram-se à coligação de Castro o PT, o PCdoB, o Partido\nDemocrático Trabalhista (PDT), o Partido da Frente Liberal (PFL) e\nlegendas de menor porte, que lhe facilitaram a vitória por ampla\nmaioria, com cerca de 76,5% dos votos válidos.\n\nO anúncio do secretariado, em dezembro, refletiu o variado arco de\nforças que lhe tornou possível a eleição: a equipe acomodou sete\npartidos. A surpresa maior foi Paulino Cícero, que concorrera à\nprefeitura da capital mineira na legenda do PFL e a quem foi confiada a\nSecretaria de Administração. Em alusão às dificuldades que o cargo lhe\nimporia, iniciou o discurso de posse, em janeiro de 1997, com uma\npassagem do escritor mineiro Guimarães Rosa, segundo o qual “uma coisa é\npôr idéias arranjadas; outra é lidar com país de pessoas de carne e de\nsangue, de mil e tantas misérias”. Em seguida, passou à indignação, ao\nmanifestar a intenção de recorrer à Justiça contra medida da Câmara de\nVereadores que renovara, sem licitação e por dez anos, a concessão para\na exploração dos serviços de transporte coletivo. Por fim, declarou à\nrevista *República*que a rotina de prefeito não o impediria de continuar\natendendo à família mineira em sua clínica.\n\nEm março, o deputado federal Wellington Moreira Franco (PMDB-RJ),\ninfluenciado pelos trabalhos da CPI dos precatórios, que revelou o\nenvolvimento dos governadores de Santa Catarina, Paulo Afonso, e de\nPernambuco, Miguel Arrais, e do prefeito de São Paulo, Celso Pitta, na\nemissão irregular de títulos públicos, propôs a criação de uma lei que\nimpedisse a emissão de papéis por estados e municípios. Sob o argumento\nde que a iniciativa do parlamentar carioca dificultaria a captação de\nrecursos, Célio de Castro foi contra. “Não se pode corrigir uma\nilegalidade com uma arbitrariedade”, alegou. Investido na presidência da\nFrente Nacional de Prefeitos, liderou, em maio, protestos em Brasília\ncontra a prorrogação do Fundo de Estabilização Fiscal (FEF), cuja\nvigência implicava perda de receita para os municípios.\n\nEm abril de 1998, reuniu-se com o ministro da Saúde José Serra, de quem\ncobrou rapidez na liberação de recursos para conter a epidemia de dengue\nque assolava Belo Horizonte. A capital mineira, advertiu, registrava os\nmaiores índices de ocorrência da doença.\n\nEm outubro de 2000, reelegeu-se prefeito de Belo Horizonte, tendo como\ncompanheiro de chapa Fernando Pimentel, do PT. Seu segundo mandato como\nprefeito da capital mineira teve o início marcado por uma greve de\nprofessores da rede municipal de ensino que durou cerca de dois meses e\nchegou a um impasse após a suspensão dos pagamentos dos dias parados.\n\nEm 2001, após se desfiliar do PSB, legenda na qual se reelegera,\nconsiderou a possibilidade de filiar-se ao PDT ou ao PMDB, mas acabou\npor ingressar no PT, em outubro. Dois meses depois, sofreu um acidente\nvascular cerebral, motivo pelo qual se licenciou do cargo de prefeito.\nPosteriormente optou pela renúncia e o afastamento da vida pública. Foi\nsubstituído na prefeitura de Belo Horizonte pelo vice Fernando Pimentel.\n\nFaleceu no dia 20 de julho de 2008 em Belo Horizonte.\n\nPublicou inúmeros artigos, fruto de pesquisa sobre o atendimento aos\npolitraumatizados, e foi co-autor dos livros *Clínica médica* (1976) e\n*Emergências médicas* (1979).\n\nCasado com Maria das Dores da Mata Castro, teve quatro filhos.\n\n \n\nEneida Lima/Rogério Barros/ Letícia Nunes de Moraes\n\n \n\n**FONTES**: CÂM. DEP. *Deputados brasileiros*. Repertório (1991-1995);\nCOELHO, J. ; OLIVEIRA, A. *Nova*; *Correio Braziliense* (19/1/87);\nCURRIC. BIOG.; *Estado de S. Paulo* (16/4/87; 22/11/92 e 10/3/97);\n*Folha de S. Paulo* (19/1/87; 1/1/90; 23/7/94; 17/11/96; 2/1 e 9/5/97;\n2/4/98; 10/10/01; 28/11/02; 20/07/08); *Globo* (16, 19 e 21/4/87; 2/1/97\ne 1/4/98); *Jornal do Brasil* (16 e 18/4/87; 2/5/88; 16/12/96 e 2/1/97);\nMONTEIRO, N.G. *Dicionário biográfico de Minas Gerais*; *República*\n(1/97); *Veja* (13/5/92).\n","ref":"","dic":"DHBB"}
