{"title":"ALMEIDA, Elpídio Josué de","cargoss":["Deputado federal"],"cargos_esp":[0],"datas_ini":[1951],"datas_fim":[1955],"estados":["PB"],"autor":[0],"content":"**ALMEIDA, Elpídio Josué de**\n\n\\*dep. fed. PB 1951-1955.\n\n \n\n*Elpídio Josué de Almeida* nasceu em Areia (PB) em 1º de setembro de\n1893, filho de Rufino Augusto de Almeida e de Adelaide de Almeida.\n\nCursou o Colégio Pio X na cidade da Paraíba, atual João Pessoa.\nTransferindo-se para o Rio de Janeiro, ingressou na Faculdade de\nMedicina, diplomando-se em 1918.\n\nIntegrou o Conselho Municipal de Campina Grande (PB) de 1929 a 1930 e o\ncomitê de apoio ao programa da Aliança Liberal. Deixou o cargo de\nconselheiro após a vitória da Revolução de 1930, quando foram extintos\nos mandatos parlamentares de todos os níveis no país.\n\nCom a redemocratização após a queda do Estado Novo (1937-1945) e o\nsurgimento de novas agremiações, filiou-se ao Partido Libertador (PL).\nFoi eleito prefeito de Campina Grande no pleito suplementar de janeiro\nde 1947, exercendo o mandato até 1950. Desincompatibilizou-se para\nconcorrer à Câmara pela Coligação Democrática Paraibana, formada pelo PL\ne pelo Partido Social Democrático (PSD). No pleito suplementar de março\nde 1951 elegeu-se deputado federal, com 17.283 votos, o segundo mais\nvotado da coligação e do estado. Assumiu em setembro.\n\nEm outubro de 1954 voltou a se eleger prefeito de Campina Grande.\nExerceu o mandato até 1962. Desincompatibilizou-se e voltou a se\ncandidatar a deputado federal pelo PL em outubro desse ano, mas não\nconseguiu se eleger. Dedicou-se, a partir de então, à medicina.\n\nFoi membro do Instituto Histórico e Geográfico da Paraíba.\n\nMorreu em Campina Grande em 26 de março de 1971.\n\nEra casado com Adalgisa Almeida, com quem teve quatro filhos, dois dos\nquais, Orlando e Antônio Almeida, foram deputados estaduais na Paraíba.\n\nPublicou Esquistossomose mansônica, sua tese de doutoramento, e História\nde Campina Grande (1962).\n\n \n\nFONTES: ALMEIDA, E. *História*;****CÂM. DEP. *Deputados brasileiros.\nRepertório* (1946-1967); CÂM. DEP. *Relação dos deputados*; CISNEIROS,\nA. *Parlamentares*; PAIS, M.; TRIB. SUP. ELEIT. *Dados* (2).\n\n \n","ref":"FONTES: ALMEIDA, E. *História*;****CÂM. DEP. *Deputados brasileiros.\nRepertório* (1946-1967); CÂM. DEP. *Relação dos deputados*; CISNEIROS,\nA. *Parlamentares*; PAIS, M.; TRIB. SUP. ELEIT. *Dados* (2).\n\n \n","dic":"DHBB"}
