{"title":"CAVALCANTI, Carlos de Lima","cargoss":["Revolucionário ou revoltoso","Governador de estado ou do Distrito Federal","Interventor","Governador de estado ou do Distrito Federal","Constituinte","Deputado federal","Deputado federal"],"cargos_esp":[0,"prov",0,0,0,0,0],"datas_ini":[1930,1930,1930,1935,1946,1956,1946],"datas_fim":[1930,1930,1935,1937,1946,1959,1954],"estados":[0,"PE","PE","PE",0,"PE","PE"],"autor":[0],"content":"**CAVALCANTI, Carlos de Lima**\n\n\\*rev. 1930; gov. prov. PE 1930; interv. PE 1930-1935; gov. PE\n1935-1937; const. 1946; dep. fed. PE 1946-1954 e 1956-1959.\n\n \n\n*Carlos de Lima Cavalcanti* nasceu no engenho Caeté, em Amaraji (PE), no\ndia 7 de junho de 1892, filho de Artur de Siqueira Cavalcanti,\nproprietário rural, e de Elvira Clélia de Matos Lima.\n\nDescendente de tradicional família pernambucana, entre seus parentes\nafastados destacam-se as figuras de Pedro de Araújo Lima, o marquês de\nOlinda, que foi regente do Império (1837-1840); dom Joaquim Arcoverde de\nAlbuquerque Cavalcanti, arcebispo do Rio de Janeiro (1897-1905) e\nprimeiro cardeal da América Latina; e Pedro Ernesto Batista, que foi\ninterventor (1931-1935) e prefeito (1935-1936) do Distrito Federal.\n\nCarlos de Lima cursou o primário e o secundário no Colégio Aires Gama,\nem Recife, onde foi contemporâneo dos jornalistas e políticos Gilberto\nAmado e Assis Chateaubriand. Em 1910 ingressou na Faculdade de Direito\nde Recife, que freqüentou até o segundo ano. Vinculado ao Partido\nRepublicano Federal de Pernambuco, dedicou-se com grande entusiasmo à\ncampanha civilista desenvolvida naquele estado em 1911 por Estácio\nCoimbra em favor da candidatura de Francisco de Assis Rosa e Silva,\nrepresentante das tradicionais oligarquias açucareiras à presidência do\nestado. Essa candidatura foi combatida por seu pai, que apoiava o\nmovimento salvacionista, patrocinado pelo presidente marechal Hermes da\nFonseca e promovida pelo Partido Republicano Conservador, cujo candidato\nera o general Emídio Dantas Barreto. Embora Rosa e Silva saísse\nvitorioso nas urnas, o governo federal, apoiando o movimento popular\nirrompido em Recife, garantiu a posse de Dantas Barreto no governo do\nestado em dezembro de 1911.\n\nTransferindo-se em 1912 para São Paulo, Carlos de Lima bacharelou-se em\n1914 pela Faculdade de Direito daquela cidade, sendo a seguir nomeado\ndelegado de polícia no interior do estado. Seguiu depois para o Rio de\nJaneiro, onde se fixou por algum tempo. Com o intuito de ajudar seu pai\nna usina Pedrosa, de propriedade deste e situada no município de Cortês\n(PE), ali passou a residir. Após a morte do pai, em 1918, assumiu a\ndireção daquele estabelecimento, à frente do qual permaneceria até 1937.\n\nFiliado ao Partido Republicano Democrata (PRD), fundado em 1915 por\nEmídio Dantas Barreto e Manuel Borba, apoiou o governo deste último\n(19l5-1919), ao qual permaneceu vinculado mesmo depois da cisão do\npartido, em 1917, em duas facções: dantistas e borbistas. Dessa forma,\napoiou a candidatura de José Rufino Bezerra Cavalcanti, amigo e\ncorreligionário de Manuel Borba, que, eleito em julho de 1918, governou\nPernambuco de 1919 a 1922.\n\n \n\nA crise de 1922 em Pernambuco\n\nSolidário com José Bezerra, Carlos de Lima apoiou a Reação Republicana,\nmovimento que promoveu as candidaturas de Nilo Peçanha e de J. J. Seabra\nà presidência e à vice-presidência da República nas eleições de 1º de\nmarço de 1922 em oposição à chapa oficial formada por Artur Bernardes e\nUrbano Santos. Embora vitoriosos em Pernambuco, os candidatos da Reação\nRepublicana foram derrotados em âmbito nacional. Ainda por sugestão de\nJosé Bezerra, Carlos de Lima candidatou-se à Assembléia Legislativa na\nchapa Paz e Concórdia, elegendo-se deputado estadual.\n\nEntretanto, a morte de José Bezerra (28/3/1922) antes do final de seu\nmandato desencadeou uma luta acirrada entre os grupos que disputavam a\nsucessão estadual: de um lado, os partidários de Carlos de Lima Castro,\nentão prefeito de Recife, fortemente apoiado pelos chefes políticos\nEstácio Coimbra, Dantas Barreto e pelos Pessoa de Queirós, sobrinhos do\npresidente da República Epitácio Pessoa, e, de outro, os que defendiam o\nnome de José Henrique Carneiro da Cunha, apoiado por Manuel Borba,\nCarlos de Lima e seu irmão Caio, além do líder operário Joaquim Pimenta.\n\nCom a vitória de Carneiro da Cunha no pleito de 27 de maio, iniciaram-se\nos conflitos em Pernambuco e, a pretexto de manter a ordem, as forças\nfederais ocuparam Recife durante três dias. Esse fato acirrou os ânimos\nda população, em particular dos trabalhadores, que, mobilizados por\nJoaquim Pimenta, ocuparam vários prédios, desenvolvendo forte\nresistência.\n\nNo dia 29 de junho de 1922, diante dos constantes rumores sobre a\nparticipação do Exército na preparação de um golpe em Pernambuco, o\nmarechal Hermes da Fonseca, então presidente do Clube Militar,\ntelegrafou ao coronel Jaime Pessoa, comandante da 7ª Região Militar,\nsediada em Recife, solicitando aos militares pernambucanos que não se\nenvolvessem nas “manobras do Catete”. Esse telegrama teve como\nconseqüência a prisão do marechal Hermes em 1º de julho e o fechamento\ndo Clube Militar no dia seguinte. Essas medidas insuflaram o\ndescontentamento no Exército, especialmente entre os tenentes, que\nreagiram, deflagrando a Revolta de 5 de Julho, que envolveu contingentes\ndo forte de Copacabana, da Escola Militar e da Vila Militar, no Rio de\nJaneiro, além dos efetivos militares sediados em Mato Grosso.\n\nEnquanto isso, os grupos políticos pernambucanos entraram em acordo,\nescolhendo para governar o estado, de 1922 a 1926, um candidato de\nconciliação, o juiz federal Sérgio Loreto. A paz política pouco durou,\npois este último, entre outras medidas, decretou o fechamento das\norganizações sindicais de Pernambuco, levando Joaquim Pimenta, Manuel\nBorba e seus correligionários, entre os quais Carlos de Lima, a\npromoverem uma campanha contra seu governo.\n\nSegundo Guillermo Palacios, Carlos e Caio de Lima encabeçaram, a partir\nde 1922, uma facção agroindustrial dissidente, que aglutinava os maiores\nusineiros de Pernambuco e uma plêiade de pequenas usinas, aparentemente\nmarginalizadas pela cúpula da elite política proprietária dos antigos\nengenhos.\n\nA partir de 1922, essa facção promoveu intensas campanhas jornalísticas\ncontra a política econômica do governo federal e a liderança oligárquica\ndo estado de Pernambuco, a quem denunciava com freqüência pelas\narbitrariedades praticadas contra os plantadores de cana, os lavradores\ne os trabalhadores rurais que mantinha sob seu domínio.\n\n \n\nApoio aos ideais revolucionários\n\nReeleito para a Assembléia Legislativa em 1925, Carlos de Lima\npermaneceu na oposição, manifestando sua hostilidade com maior ênfase\napós a eleição de Estácio Coimbra para a presidência de Pernambuco no\nperíodo de 1926 a 1930. Dois anos depois, entretanto, Carlos de Lima\nabandonou suas atividades parlamentares juntamente com Caio, fundando em\n16 de abril de 1927 o *Diário da* *Manhã.*Na primeira edição do jornal,\nCarlos de Lima, identificado com os ideais revolucionários dos\n“tenentes”, que haviam promovido as revoltas de 5 de julho de 1922 e de\n1924 e participado da Coluna Prestes (1925-1927), proclamou Luís Carlos\nPrestes chefe da revolução em marcha no país contra os poderes\nestabelecidos de Washington Luís e das oligarquias locais.\nPosteriormente, Carlos de Lima fundou o *Diário da Tarde,* constituindo\nos dois jornais sob sua direção os principais porta-vozes da oposição em\nPernambuco aos governos federal e estadual.\n\nTendo arquitetado um plano revolucionário a ser posto em prática no\nNordeste, Carlos de Lima tentou convencer o líder tenentista Juarez\nTávora a assumir, em julho de 1927, o comando militar do movimento.\nEste, entretanto, considerando a fragilidade do projeto — que, àquela\népoca, contava basicamente com a adesão dos elementos oposicionistas do\nNorte —, conseguiu dissuadi-lo daquele intento, alegando a necessidade\nde aglutinação de forças em todo o país, manobra esta que já vinha sendo\nexecutada pelos ex-integrantes da Coluna Prestes, então no exílio. Em\nsetembro, Carlos de Lima deu asilo na usina Pedrosa a João Alberto Lins\nde Barros, um dos comandantes de destacamento da Coluna Prestes que\nseguira para Recife a fim de rever seus familiares e desenvolver\ncontatos para o movimento revolucionário então em andamento.\n\nPor outro lado, com a fundação do Partido Democrático Nacional (PDN), em\n21 de setembro de 1927, os principais representantes deste, Joaquim\nFrancisco de Assis Brasil e Maurício de Lacerda, organizaram uma\ncaravana ao Norte do país com o objetivo de congregar as oposições para\numa ação ampla contra o governo federal e as oligarquias locais. A\nchamada Caravana Democrática partiu do Rio de Janeiro em julho de 1928\nsob o comando de Assis Brasil. Por comungar do ideário do PDN, Carlos de\nLima, em companhia do irmão Caio, de Dantas Barreto e de Lacerda de\nAlmeida, fundou a seção pernambucana da agremiação. Paralelamente, foi\nfundado por correligionários de Manuel Borba o Partido Republicano\nDemocrático (PRD) de Pernambuco.\n\nEsses dois partidos, entretanto, fundiram-se em 1929, dando origem à\nFrente Liberal, que apoiou a Aliança Liberal em Pernambuco, defendendo\nas candidaturas de Getúlio Vargas, presidente do Rio Grande do Sul, e de\nJoão Pessoa, presidente da Paraíba, à sucessão presidencial de 1930, em\noposição à chapa oficial composta por Júlio Prestes e Vital Soares. A\nformação da Aliança Liberal, decorrente da ruptura política entre os\ngovernos de Minas Gerais, Rio Grande do Sul e Paraíba, de um lado, e o\npresidente Washington Luís, comandando os demais estados, do outro, deu\ninício aos entendimentos para um plano revolucionário entre os exilados\nque haviam participado dos movimentos tenentistas e os políticos que\ndivergiam do governo federal.\n\nUma vez estabelecido que caberia a Juarez Távora o comando militar do\nmovimento revolucionário em todo o Norte e Nordeste do país, foi\ndecidido que sua liderança civil   em Pernambuco seria exercida por\nCarlos de Lima, com o auxílio dos irmãos Caio e Rui. A atuação de Carlos\nde Lima passou então a se desenvolver em duas frentes: uma ostensiva,\natravés de artigos publicados em seus jornais, os quais, com penetração\nem todo o Nordeste, visavam preparar a opinião pública para o desfecho\ndo levante; e a outra secreta, enquanto articulador da revolução. Nesse\nsentido, Carlos de Lima empreendeu com Caio uma viagem ao centro-sul do\npaís, bem como à Argentina, a fim de estabelecer contatos com os\nprincipais líderes revolucionários, entre os quais Luís Carlos Prestes,\nJuarez Távora, João Alberto, Antônio de Siqueira Campos, Pedro Ernesto,\nPaulo Nogueira Filho, Miguel Costa e Osvaldo Aranha. Além disso, a usina\nPedrosa, de propriedade dos irmãos Lima Cavalcanti, tornou-se um dos\nprincipais redutos de conspiração no Nordeste.\n\nEntretanto, em fevereiro de 1930, eclodiu em Princesa, atual Princesa\nIsabel (PB), um movimento rebelde liderado por José Pereira em oposição\nao governo estadual de João Pessoa. Carlos e Caio de Lima auxiliaram\nJoão Pessoa a combater a revolta, fazendo passar pela divisa entre\nPernambuco e Paraíba munições enviadas por aliancistas do Rio Grande do\nSul e de Minas Gerais. Adotaram o recurso de esconder os pacotes em\nlatas de goiabada.\n\nNo dia 1º de março de 1930, realizaram-se as eleições que deram a\nvitória a Júlio Prestes e a Vital Soares. Os setores aliancistas que já\nesperavam por esse resultado intensificaram as articulações para a\ndeflagração do movimento armado. Em meados de março, Juarez Távora\nseguiu para o Nordeste. Chegando a Recife em 12 de abril, entrou\nimediatamente em contato com Carlos e Caio de Lima, que o informaram\nsobre a situação reinante em Pernambuco e na Paraíba, já que mantinham\nentendimentos constantes com João Pessoa e José Américo de Almeida,\nlíderes do movimento aliancista naquele último estado.\n\nEm maio, Prestes decidiu retirar seu apoio à Aliança Liberal por\ndivergir do programa que esta adotara e que, segundo ele, revelava\ncaráter acentuadamente burguês, refletindo apenas uma simples luta entre\nas oligarquias dominantes. Embora se houvesse comprometido a retardar de\num mês a publicação de um manifesto em que exporia ao país as razões de\nsua nova posição, em virtude da morte de Siqueira Campos num desastre\naéreo ocorrido em 10 de maio de 1930, Prestes decidiu romper aqueles\ncompromissos e antecipou a divulgação do documento. Assim, no dia 23 de\nmaio, escreveu aos irmãos Lima Cavalcanti, solicitando que fizessem\nchegar às mãos de Juarez Távora uma cópia do manifesto que pretendia\npublicar de imediato. Apesar das censuras que por isso lhe fizeram\nJuarez e os irmãos Lima Cavalcanti, Prestes não hesitou e o manifesto\nfoi publicado no dia 29 pelo jornal gaúcho *Diário da* *Noite,*órgão dos\nDiários Associados, o mesmo ocorrendo nos dois dias seguintes em outros\njornais do Rio de Janeiro e de São Paulo.\n\n \n\nParticipação na Revolução de 1930\n\nParalelamente ao afastamento de Prestes do comando militar do movimento,\nGetúlio Vargas e Antônio Carlos de Andrada, presidente de Minas Gerais,\ndecidiram recuar em relação à luta armada, o que implicava a paralisação\ndos preparativos para o levante. Entretanto, após o assassinato de João\nPessoa, ocorrido em julho de 1930 em Recife, o clima de revolta que se\nalastrou pelo país levou Getúlio e Antônio Carlos a decidirem por um\nnovo e decisivo apoio à conspiração revolucionária, para cuja chefia\nmilitar foi escolhido o tenente-coronel Pedro Aurélio de Góis Monteiro.\n\nApós alguns mal-entendidos entre Juarez Távora e Osvaldo Aranha quanto\nao dia, à hora, aos locais de sublevação das tropas e à própria forma de\nação sob a qual seria deflagrada a revolução, Juarez, ao desembarcar no\nRecife no dia 3 de outubro, recebeu da parte de Carlos e Caio de Lima a\ninformação de que o movimento revolucionário fora iniciado no Sul do\npaís, às 17:30h  daquele mesmo dia, e de que já haviam sido inteiradas\ndo fato as autoridades estaduais e federais. Em companhia de Carlos de\nLima e dos tenentes Sebastião Mendes de Holanda e Jair de Albuquerque\nLima, Juarez seguiu para o quartel do 21º Batalhão de Caçadores, sediado\nna capital pernambucana, e ali certificou-se de que a tropa se\nencontrava em rigorosa prontidão, não podendo assim os oficiais rebeldes\nsublevá-la. Frustravam-se, portanto, as ações militares previstas pelo\nprograma previamente estabelecido pelos revolucionários, segundo o qual\no início do levante ocorreria simultaneamente nas unidades militares do\nNorte e do Nordeste a uma hora da madrugada do dia 4 de outubro.\n\nPor entender que malograra por completo o plano de uma rápida ocupação\nde Recife, Juarez seguiu imediatamente para João Pessoa a fim de trazer\nreforços. Antes de deixar a capital pernambucana, porém, com o objetivo\nde ali criar focos rebeldes, determinou  que fossem inutilizados os\nequipamentos dos sistemas de comunicação da Central Telefônica e ocupado\no quartel da Soledade, onde estava instalado o depósito de material da\n7ª Região Militar. Essas duas determinações foram cumpridas com pleno\nêxito: a primeira, por um grupo de civis comandados por Rui e Caio de\nLima; e a segunda, por 17 homens sob as ordens do capitão Antônio Muniz\nde Faria.\n\nInstalado na Soledade o quartel-general dos revolucionários, Carlos de\nLima, seguindo instruções de Juarez, para lá se dirigiu a fim de\nprovidenciar a distribuição de armas e munições aos rebeldes.\nEntretanto, a situação permanecia indecisa devido à reação legalista do\n21º BC, da Brigada Militar, do Corpo de Bombeiros, do Batalhão de\nCavalaria e dos efetivos irregulares, os chamados  “provisórios” civis\narregimentados pelos irmãos Pessoa de Queirós.\n\nSomente na noite do dia 4 e na madrugada do dia seguinte é que dois\nepisódios vieram modificar o quadro até então esboçado: o contingente\nacantonado no 21º BC abandonou o quartel, aí permanecendo apenas praças\ne oficiais que já haviam aderido ao movimento, enquanto o presidente\nestadual Estácio Coimbra deixava o palácio do governo, retirando-se com\nseus familiares para Barreiros (PE), de onde seguiria para Salvador e,\ndaí, para a Europa. Os revolucionários ocuparam então o 21º BC e, às dez\nhoras da manhã do dia 5, o comando da Polícia Militar, sediado no\nquartel do Derby, afinal capitulou. Assim, a vanguarda das tropas de\nAgildo Barata e de Juraci Magalhães, procedentes da Paraíba e enviadas a\nPernambuco por ordem de Juarez, ao chegar a Recife às 17:30h já\nencontraram a cidade em poder dos rebeldes. Segundo Barbosa Lima\nSobrinho, “o movimento do Recife foi o único genuinamente popular...”,\npois ali teria sido o povo que, orientado por alguns poucos\nrevolucionários civis e militares, garantiu a vitória da revolução.\n\nÀs 21 horas do dia 5 de outubro, Carlos de Lima Cavalcanti foi empossado\ngovernador provisório de Pernambuco por Juraci Magalhães, em nome de\nJuarez Távora. A cerimônia de posse teve lugar no quartel do 21º BC,\nonde funcionou por alguns dias o governo revolucionário. No dia\nseguinte, Juarez seguiu com José Américo para Recife, a fim de se\nestabelecer ali o Quartel-General Revolucionário do Norte. Nos dias\nseguintes, os demais estados nordestinos foram caindo em mãos dos\nrebeldes. Vitoriosa a revolução em nível federal no dia 24 de outubro,\nVargas assumiria a chefia do Governo Provisório da República em 3 de\nnovembro. Por decreto do dia 14 desse mesmo mês, instituíram-se as\ninterventorias federais nos estados, sendo Carlos de Lima nomeado\ninterventor em Pernambuco.\n\n \n\nO papel do interventor\n\nCom o propósito de moralizar a administração municipal, Carlos de Lima,\nlogo ao tomar posse, nomeou uma comissão composta por João Cleofas, Alde\nSampaio e Arruda Falcão, e que procedeu a um remanejamento das chefias\nlocais, expurgando os elementos que se opunham ao novo regime. Instituiu\ntambém uma comissão de sindicância responsável por uma série de\ninquéritos sobre corrupção no governo anterior e nas diversas\nprefeituras municipais. Os principais alvos dessa comissão foram o\nex-presidente estadual Estácio Coimbra e seu chefe de polícia, Eurico de\nSousa Leão, acusados de crime de peculato. Além das prisões e\nperseguições políticas da antiga liderança governamental, Carlos de Lima\npromoveu o remanejamento do quadro técnico-administrativo, a reforma\neducacional e outras medidas saneadoras em todos os planos da vida\npública do estado, sobretudo no âmbito do Judiciário.\n\nA atuação de Carlos de Lima na interventoria federal em Pernambuco\ncaracterizou-se, posteriormente, pela defesa da sindicalização da classe\noperária, pelo uso da mobilização popular como tática política e pela\npreocupação manifesta de realizar um governo representativo de toda a\nsociedade. Nesse sentido, fez  vários apelos à classe operária a fim de\nobter maior participação e colaboração para seu governo.\n\nEm princípios de 1931, foi constituído o “Bloco do Norte”, que, sem\nexistência institucionalizada, visava obter junto ao Governo Provisório\num maior espaço político para os estados do Norte e do Nordeste, tendo\nsido Carlos de Lima  grande articulador seu. Entre seus objetivos\npolíticos, o Bloco do Norte opunha-se à idéia da constitucionalização do\npaís, defendida por Minas Gerais e o Rio Grande do Sul.\n\nA liderança revolucionária em 1931 era contrária à organização de\npartidos, alegando que estes iriam repetir os erros do passado.\nEntretanto, em agosto daquele ano, quando o debate sobre a necessidade\nde uma constituinte se intensificou, Lima Cavalcanti, após viagem\nrealizada ao Sul do país, colocou pela primeira vez a necessidade da\nformação de um “verdadeiro partido revolucionário” em Pernambuco que,\nnum segundo momento, fosse transformado em partido nacional. Por aquela\népoca, a oposição política pernambucana encontrava-se bastante\ndesarticulada, embora o *Diário de Pernambuco,*adquirido a partir de\nmeados de 1931 por Assis Chateaubriand, adversário de Carlos de Lima,\ndesencadeasse violento combate à gestão deste.\n\nAinda durante o ano de 1931, ocorreram em Recife três revoltas que não\ntrouxeram conseqüências mais sérias para o governo, não sendo possível à\noposição capitalizar o descontentamento por elas revelado. Assim, nos\ndias 8 e 9 de abril, desencadeou-se um motim de caráter “pretensamente”\nnacionalista entre os empregados brasileiros demitidos por uma casa\ncomercial portuguesa, a firma Teixeira Miranda; no dia 20 de maio,\nocorreu uma revolta militar no quartel do Derby, dirigida por\nrevolucionários de 1930 que, demitidos da Força Pública, tentaram\napoderar-se daquela praça militar; finalmente, nos dias 29 e 30 de\noutubro, eclodiu uma revolta no 21º BC. Os oficiais sublevados\nconquistaram o quartel-general do Derby, o quartel da Soledade, ocuparam\nOlinda e os bairros recifenses de Boa Vista e Afogados, enviando um\n*ultimatum*a Carlos de Lima para que este renunciasse ao governo do\nestado. Todas essas revoltas foram reprimidas e, no caso das duas\núltimas, Lima Cavalcanti recebeu efetivo apoio do governo central, bem\ncomo dos governos de Alagoas, da Paraíba e do Rio Grande do Norte.\n\nEm seu primeiro ano de interventoria, Lima Cavalcanti criou o Instituto\nde Pesquisas Agronômicas, o Serviço de Higiene Mental e a Escola Rural\nModelo, posteriormente denominada Escola Rural Alberto Torres. Em\noutubro de 1931, criou a Diretoria de Produção Animal, vinculada à\nSecretaria de Agricultura e Viação Pública. Visando à alimentação do\ngado, promoveu o cultivo da palma, obrigando as prefeituras a manter\ncampos especiais de plantio para fornecimento gratuito de mudas aos\ncriadores. Em fins de 1931 e princípios do ano seguinte, porém, ocorreu\ngrave desentendimento entre o ministro da Viação e Obras Públicas, José\nAmérico de Almeida, e Lima Cavalcanti em torno da distribuição do\ncrédito que o Governo Provisório concedeu à Inspetoria Federal de Obras\ncontra as Secas (IFOCS), órgão vinculado àquele ministério, para\nneutralizar os efeitos da longa estiagem que assolava o Nordeste. Lima\nCavalcanti acusou publicamente José Américo de proteger a Paraíba e o\nCeará em detrimento de Pernambuco, que ficara marginalizado naquele\nprograma assistencial.\n\nEm 9 de julho de 1932, diante da eclosão, em São Paulo, da Revolução\nConstitucionalista, Lima Cavalcanti organizou o Comitê Central\nRevolucionário de Pernambuco, visando articular as forças do estado para\nlutar contra os paulistas. Enviou então cerca de seis mil homens para\nauxiliar o governo federal, que conseguiu sufocar o movimento rebelde em\n2 de outubro.\n\nAo reestruturar a Secretaria de Agricultura, Viação e Obras Públicas de\nPernambuco, Lima Cavalcanti criou, em setembro de 1932, a Diretoria de\nAgricultura, através da qual foram introduzidas variedades de cana\nresistentes às pragas e promovido o aperfeiçoamento técnico da cultura\nalgodoeira.\n\n \n\nAs eleições de 1933-1934\n\nCom a resolução de Getúlio Vargas de marcar as eleições para a\nAssembléia Constituinte no dia 3 de maio de 1933, a reorganização dos\npartidos políticos tornou-se uma necessidade indiscutível. Carlos de\nLima, seguindo as instruções do governo central, colocou-se na vanguarda\nda reorganização partidária em seu estado, adotando em novembro de 1932\nmedidas necessárias à criação do Partido Social Democrático (PSD) de\nPernambuco. Fundada em 19 de dezembro desse ano, a agremiação congregava\nelementos dos dois antigos partidos de oposição ao grupo ligado a\nEstácio Coimbra (o PDN e o PRD) e defendia como ponto fundamental a\ninstauração no país do regime parlamentar.\n\nO fato de Lima Cavalcanti haver orientado e organizado a criação do PSD\nde Pernambuco suscitou severas críticas por parte de Antônio Muniz de\nFarias, que, além de ter sido escolhido presidente do Comitê Central\nRevolucionário de Pernambuco, havia representado este estado no I\nCongresso Nacional Revolucionário, reunido no Rio de Janeiro em novembro\nde 1932. Ao final dessa reunião, ficara decidida por consenso a fundação\ndo Partido Socialista Brasileiro (PSB), enquanto órgão catalisador da\nideologia revolucionária. Caberia aos congressistas a tarefa de\ninstituir seções desse partido em seus respectivos estados. Lima\nCavalcanti justificou sua posição afirmando que o PSD defendia teses\ncoerentes com os princípios adotados pelo PSB. De toda forma, em 3 de\njaneiro de 1933 seria fundado o Partido Socialista de Pernambuco,\nextinguindo-se em conseqüência o Comitê Revolucionário daquele estado.\n\nAinda em dezembro de 1932, o governo Lima Cavalcanti criou a Inspetoria\ndas Municipalidades e a Comissão de Melhoramentos Municipais, que se\nfundiram depois no Departamento Geral das Municipalidades, abolindo\nqualquer possibilidade de autonomia dos municípios. Passou assim à\nesfera da administração estadual fixar e fiscalizar as normas a serem\ncumpridas pelas prefeituras. A tributação passou, por sua vez, a ser\nuniformemente programada.\n\nEm fevereiro de 1933, quando da discussão sobre a conveniência do\nadiamento do pleito de maio daquele ano, ocorreu uma cisão entre os\nlíderes revolucionários. Por um lado, João Alberto e José Américo\nadvogavam em favor do adiamento em face do reduzido número de eleitores\nalistados. Por outro lado, Góis Monteiro, Protógenes Guimarães e Juraci\nMagalhães colocavam-se contra essa medida, contando com o apoio de Lima\nCavalcanti.\n\nNas eleições de 3 de maio de 1933, o PSD pernambucano venceu por\nesmagadora maioria, elegendo 15 dos 17 deputados que representariam o\nestado nos trabalhos da Assembléia Nacional Constituinte, os quais se\niniciariam ainda em novembro daquele ano. Devido à importância que\nassumira Minas Gerais no contexto da abertura dos trabalhos da\nConstituinte, Lima Cavalcanti e Juraci Magalhães, interventor federal na\nBahia, foram até Belo Horizonte negociar uma aliança com Antônio Carlos,\npropondo apoio à sua candidatura à presidência da Assembléia se, em\ncontrapartida, ele defendesse a tese da elegibilidade dos interventores.\nLima Cavalcanti e Juraci Magalhães manifestaram-se também favoráveis à\neleição de Vargas para a presidência da República.\n\nAo início dos trabalhos da Constituinte, seu Antônio Carlos foi eleito o\npresidente e, em 6 de julho de 1934, três dias depois de aprovada a tese\nda elegibilidade dos interventores, o PSD de Pernambuco lançou\noficialmente a candidatura Lima Cavalcanti ao governo constitucional do\nestado. Promulgada a Constituição em 16 de julho de 1934, a Assembléia\nelegeu no dia seguinte Getúlio Vargas à presidência da República para o\nperíodo de quatro anos.\n\nIniciando seu governo constitucional, Vargas delegou a Lima Cavalcanti a\nescolha do novo titular da pasta do Trabalho. Este indicou o nome de\nAgamenon Magalhães, então seu aliado político. Agamenon assumiu o\nministério em 25 de julho, tornando-se o grande intermediário de Lima\nCavalcanti junto ao Catete. Nas eleições para a Assembléia Constituinte\nde Pernambuco, em outubro de 1934, os candidatos de Lima Cavalcanti\nderrotaram a facção dissidente do PSD liderada por João Alberto. Tendo\nsido nessa ocasião cogitado o nome de José Américo de Almeida para a\npresidência do Senado, Lima Cavalcanti comunicou-se com Agamenon\nMagalhães em 19 de março de 1935 para solicitar-lhe que interviesse\njunto a Vargas no sentido****de impedir aquela candidatura. O pedido\naparentemente encontrou acolhida, pois José Américo desistiria****de\nconcorrer às eleições.\n\n \n\nO afastamento do poder central\n\nConcorrendo com João Alberto, Carlos de Lima foi eleito pela Assembléia\nConstituinte estadual governador constitucional de Pernambuco em 15 de\nabril de 1935, vencendo o pleito por maciça maioria de votos. Desde o\ninício de seu governo, embora enfatizasse em declarações oficiais sua\nsolidariedade a Vargas, Carlos de Lima procedeu a um gradual\ndistanciamento do poder central, estreitando relações com José Antônio\nFlores da Cunha e Juraci Magalhães, governadores do Rio Grande do Sul e\nda Bahia, e com Juarez Távora, que mantinham a mesma posição. Durante os\nmeses que se seguiram à sua posse, várias greves foram desencadeadas em\nPernambuco — destacando-se a da Rede Ferroviária —, todas elas porém\nrapidamente debeladas pelas forças estaduais.\n\nEm novembro de 1935, encontrando-se Carlos de Lima em viagem de recreio\nà Europa e o comandante da 7ª Região Militar, general Manuel Rabelo, no\nRio de Janeiro, eclodiram quase simultaneamente os levantes comunistas\nde Natal (23/11), de Recife (24/11) e do Rio de Janeiro (27/11),\npromovidos pela Aliança Nacional Libertadora (ANL). Segundo Hélio Silva,\na rebelião em Recife, por envolver sobretudo cabos e sargentos,\nencontrou ampla receptividade junto à população, muito embora a\npropaganda política não houvesse atingido senão alguns setores da massa\noperária sindicalizada e da classe média. Entretanto, a Brigada Militar\nde Recife, apoiada por forças procedentes da Paraíba e de Alagoas,\nsufocou o movimento no dia 26. Quase todos os rebeldes foram presos,\ninclusive os dois principais chefes: Silo Meireles, cunhado de Luís\nCarlos Prestes, e o tenente Lamartine Coutinho. Conquanto considerasse a\nrevolta em Recife “um simples levante de quartel, sem a menor\nparticipação da opinião pública”, Carlos de Lima, buscando maior\nlegitimidade junto ao poder central e em seu próprio estado, procedeu a\nprofundas modificações em seu secretariado, afastando em dezembro de\n1935 todos os elementos suspeitos de envolvimento na Revolta Comunista.\nAproveitou também a ocasião para renovar sua integral solidariedade a\nVargas e criticar severamente os que considerava como suspeitos de\nparticipação no levante, entre os quais Pedro Ernesto, prefeito do\nDistrito Federal, e o general Manuel Rabelo.\n\nApesar de todas essas medidas e precauções, Carlos de Lima não foi\npoupado por seus opositores políticos — entre os quais o deputado Eurico\nde Sousa Leão e o procurador Honorato Himalaia Virgulino —, que o\nacusaram de ter sido conivente com o movimento rebelde. Tentando\ndesgastar a imagem do governador frente à Câmara dos Deputados, Sousa\nLeão denunciou o fato de que este havia mantido em seu secretariado dois\nelementos tidos como favoráveis à ANL — Sílvio Granville, secretário da\nFazenda, e Nélson Coutinho, do Interior —, ambos detidos em conseqüência\ndo levante. Acrescentou ainda à sua denúncia o desejo manifestado —\nembora não realizado — pelo interventor, de visitar a União Soviética\ndurante sua viagem à Europa. Quanto ao procurador Himalaia Virgulino,\nchegaria mesmo a pedir, em maio de 1937, a prisão preventiva de Lima\nCavalcanti. Após longa batalha judiciária, Carlos de Lima, tendo a seu\nfavor a opinião pública, acabaria sendo absolvido pelo Tribunal de\nSegurança Nacional (17/8/1937).\n\n \n\nA sucessão presidencial e o Estado Novo\n\nEm 1936, quando do início das articulações à sucessão presidencial\nprevista para 1938, Carlos de Lima — convencido do argumento de Juarez\nTávora quanto à necessidade de se lançar um candidato único que,\nreunindo as simpatias do Norte e do Sul, fosse capaz de recuperar os\nrumos do movimento revolucionário de 1930 —, concordou em estabelecer\numa aliança, independente do apoio de Vargas, com São Paulo, Minas\nGerais, Rio Grande do Sul e Bahia em torno da candidatura do governador\nde São Paulo, Armando de Sales Oliveira, à presidência da República.\nTemia Carlos de Lima, porém, que a eleição deste pudesse implicar um\nretrocesso aos quadros vigentes antes de 1930, quando a hegemonia na\ncondução político-econômica do país cabia aos estados do Centro-Sul.\n\nPor outro lado, as relações entre Carlos de Lima e Agamenon Magalhães\nencontravam-se então bastante estremecidas, pois, enquanto o ministro do\nTrabalho, muito próximo a Vargas, interferia nas questões relativas a\nPernambuco, apoiando a política empreendida pelo poder central, o\ngovernador pernambucano sentia-se cada vez mais desprestigiado e\nmarginalizado. Além disso, a cisão no PSD pernambucano mostrava-se\ninevitável, com os opositores de Carlos de Lima apoiando a candidatura\nde Agamenon ao governo do estado.\n\nNutrindo interesse por um candidato que representasse as forças\npolíticas nordestinas e considerando a decisão do diretório central do\nPSD de Pernambuco de aderir à candidatura de José Américo de Almeida,\noficiosamente apoiada por Vargas, Carlos de Lima resolveu esquecer os\nantigos atritos e conceder, em 20 de maio de 1937, seu apoio a José\nAmérico. Manifestou oficialmente essa decisão cinco dias depois, quando\nda convenção coordenada pelo governador de Minas Gerais, Benedito\nValadares, à qual também compareceu Juraci Magalhães.\n\nEm outubro de 1937, em decorrência das denúncias feitas à nação pelos\nministros da Guerra, Eurico Dutra, e da Marinha, Henrique Guillen, sobre\na existência do Plano Cohen — pretenso plano comunista de tomada do\npoder —, Getúlio Vargas remeteu ao Congresso um pedido de reinstauração\ndo estado de guerra por 90 dias. Essa medida, que já havia vigorado de\nmarço de 1936 a junho de 1937, foi novamente aprovada pelo Congresso, e\nsua execução nos estados entregue aos respectivos chefes do Executivo,\ncom exceção do Rio Grande do Sul, São Paulo e Distrito Federal, onde era\nmais intensa a oposição ao governo federal. Nos dois estados, a execução\ndo estado de guerra coube aos chefes das unidades militares aí sediadas\ne, no Distrito Federal, ao chefe de polícia. Quanto a Pernambuco, com a\nintenção de esvaziar mais ainda a autoridade de Carlos de Lima, Vargas\ndeterminou que a execução do estado de guerra fosse atribuída a um\ntriunvirato composto pelo governador, pelo comandante da 7ª Região\nMilitar, o coronel Amaro de Azambuja Vilanova, e pelo capitão dos\nPortos, comandante Ildefonso Castilho.\n\nCarlos de Lima resolveu então escrever a Vargas para se queixar da\nmedida, bem como das atitudes arbitrárias que vinham sendo adotadas por\nVilanova. Denunciou a utilização do estado de guerra em Pernambuco para\nfins político-partidários por parte de seus adversários, assim como o\ncerco que vinha sendo exercido contra seu governo pelo poder central.\nNão obstante essas reclamações, a situação de Carlos de Lima tornava-se\ncada vez mais insustentável. Vargas decidiu requisitar toda a Brigada\nMilitar de Pernambuco e, internamente, os opositores do governador\nligados a Agamenon Magalhães intensificaram os ataques à sua pessoa e à\nsua administração.\n\nCom a implantação do Estado Novo em 10 de novembro de 1937, que permitiu\na Vargas permanecer na presidência com poderes ditatoriais, Carlos de\nLima foi afastado no mesmo dia do governo de Pernambuco, sendo\nsubstituído provisoriamente por Azambuja Vilanova. Em 3 de dezembro,\nAgamenon Magalhães foi nomeado interventor federal no estado.\nImpossibilitado de trabalhar na usina Pedrosa e de assumir a direção de\nseus jornais devido à exigência feita pelo novo governo de que se\nausentasse do estado, Carlos de Lima, financeiramente arruinado por suas\natividades políticas, aceitou o convite que lhe fez Vargas para exercer\no cargo de embaixador do Brasil na Colômbia, para o qual foi nomeado em\n13 de dezembro de 1938.\n\nPermaneceu em Bogotá até dezembro de 1939, quando foi designado\nembaixador no México, exercendo essa função até janeiro de 1945, sendo\nentão transferido para a embaixada em Cuba. Exerceu este último cargo\npor alguns meses, exonerando-se a pedido em março para participar do\nprocesso de redemocratização por que passava então o país.\n\n \n\nA redemocratização\n\nSolidário com a candidatura de Eduardo Gomes à presidência da República,\nCarlos de Lima participou, em abril de 1945, da elaboração dos estatutos\nda União Democrática Nacional (UDN), sendo nomeado membro da comissão de\norientação política desse movimento. Em agosto, quando foram aprovados\nos estatutos e foi nomeado o primeiro diretório do partido, com Otávio\nMangabeira na presidência, Carlos de Lima foi um dos escolhidos para\ncompor sua comissão executiva.   Candidato à Assembléia Nacional\nConstituinte por seu estado na legenda da UDN, conseguiu eleger-se no\npleito de 2 de dezembro de 1945. Nessas mesmas eleições, Eurico Dutra\nelegeu-se presidente da República, derrotando Eduardo Gomes.\n\nCom a promulgação da Constituição (18/9/1946) e a transformação da\nAssembléia em Congresso ordinário, Carlos de Lima teve seu mandato\nestendido pela legislatura que se seguiu, até janeiro de 1951, exercendo\na vice-presidência da Comissão Permanente de Diplomacia da Câmara. Nas\neleições de 3 de outubro de 1950, reelegeu-se deputado federal por\nPernambuco, apoiado pela Coligação Democrática Pernambucana, que\ncongregava a UDN, o Partido Republicano (PR), o Partido de Representação\nPopular (PRP), o Partido Democrata Cristão (PDC), o Partido Trabalhista\nBrasileiro (PTB) e o Partido Libertador (PL). Permaneceu na Câmara até\n23 de novembro de 1954, quando foi nomeado pelo presidente Café Filho\npresidente do Instituto do Açúcar e do Álcool (IAA), função que\nexerceria até dezembro de 1955. Nas eleições de 1954, concorreu ao\nlegislativo federal por Pernambuco com o apoio da Frente Democrática\nPernambucana, que congregava o PSD, o Partido Democrata Cristão (PDC), o\nPartido Social Progressista (PSP), o PL e o PRP, obtendo apenas a\nprimeira suplência. Com a vacância de uma cadeira, assumiu o mandato em\n3 de setembro de 1956, exercendo-o até o fim da legislatura, em 31 de\njaneiro de 1959.\n\n \n\nDepois de 1964\n\nApós o movimento político-militar de 31 de março de 1964, que depôs o\npresidente João Goulart e garantiu a ascensão do marechal Humberto\nCastelo Branco, Carlos de Lima voltou a exercer funções públicas,\nocupando o posto de membro do Conselho Superior das Caixas Econômicas.\n\nExercia essas funções quando faleceu no Rio de Janeiro, em 19 de\nsetembro de 1967. Foi casado com Helena Ganches, com quem teve três\nfilhos e de quem enviuvou em 1938, contraindo segundas núpcias com\nAlzira Rodrigues Costa Lima Cavalcanti. Era tio de Artur Melo de Lima\nCavalcanti, deputado federal por Pernambuco de 1963 a 1964 na legenda do\nPTB.\n\nSobre sua trajetória política e atuação frente ao governo de Pernambuco\npublicaram-se os livros de Luís Delgado, *Carlos de Lima* *Cavalcanti:\num “grande” de Pernambuco* (1975) e de José da Costa Porto, *Os tempos*\n*de Lima Cavalcanti*(1977).\n\nSílvia Pantoja\n\n \n\n \n\nFONTES: ARAÚJO, M. *Cronologia 1943*; ARQ. GETÚLIO VARGAS; BARROS, M.\n*Década*;**CALMON, P. *História*;**CÂM. DEP. *Deputados*;**CÂM. DEP.\n*Relação dos dep.*; CARONE, E. *Estado*;**CARONE, E. *República*\n*nova*;**CAVALCANTI JÚNIOR, A. *Reminiscências*;**CISNEIROS, A.\n*Parlamentares*;*Correio da Manhã* (18/7/45 e 20/9/67); *Correio* *do\nPovo*;**CORRESP. GOV. EST. PE; DELGADO, L. *Carlos*;*Diário da\nManhã*(21/9/67 e 5/10/70);*Diário de Pernambuco*(20 e 21/9/67); *Diário\ndo Congresso Nacional;* DULLES, J. *Anarquistas*;**DULLES, J.\n*Getúlio*;*Encic. Mirador*;*Estado de S. Paulo* (24/10/70); FONTOURA, J.\n*Memórias*; FUND. GETULIO VARGAS. *Cronologia da* *Assembléia*;*Grande\nencic. Delta*;**HEILBORN, M*. Oligarquia*;**HIRSCHOWICZ, E.\n*Contemporâneos*;*Jornal*(20/9/67);*Jornal do Comércio*, Recife (20 e\n26/9, 5, 6, 17 e 21/10/67 e 25/10/73); LEVINE, R. *Vargas*;**LIMA\nSOBRINHO, A. *Verdade*;**LIMA, J. *Como*;**MACEDO, N.\n*Aspectos*;**NABUCO,**C*. Vida*;**NOGUEIRA FILHO, P.\n*Ideais*;**OLIVEIRA, H. *Presidentes*;**PALÁCIOS, G. *Plantadores*;\nPANDOLFI, D. *Crise*;**PANDOLFI, D. *Trajetória*;**PEIXOTO, A.\n*Getúlio*;**POPPINO, R. *Federal*;**PORTO, J. *Tempos de Lima*;**SILVA,\nG*. Constituinte*;**SILVA, H. *1930*; SILVA, H. *1931*; SILVA, H.\n*1935*; SILVA, H. *1937*; TÁVORA, J. *Vida*;**WANDERLEY, N.\n*História*;**WYNNE, J. *História*.\n\n \n","ref":"FONTES: ARAÚJO, M. *Cronologia 1943*; ARQ. GETÚLIO VARGAS; BARROS, M.\n*Década*;**CALMON, P. *História*;**CÂM. DEP. *Deputados*;**CÂM. DEP.\n*Relação dos dep.*; CARONE, E. *Estado*;**CARONE, E. *República*\n*nova*;**CAVALCANTI JÚNIOR, A. *Reminiscências*;**CISNEIROS, A.\n*Parlamentares*;*Correio da Manhã* (18/7/45 e 20/9/67); *Correio* *do\nPovo*;**CORRESP. GOV. EST. PE; DELGADO, L. *Carlos*;*Diário da\nManhã*(21/9/67 e 5/10/70);*Diário de Pernambuco*(20 e 21/9/67); *Diário\ndo Congresso Nacional;* DULLES, J. *Anarquistas*;**DULLES, J.\n*Getúlio*;*Encic. Mirador*;*Estado de S. Paulo* (24/10/70); FONTOURA, J.\n*Memórias*; FUND. GETULIO VARGAS. *Cronologia da* *Assembléia*;*Grande\nencic. Delta*;**HEILBORN, M*. Oligarquia*;**HIRSCHOWICZ, E.\n*Contemporâneos*;*Jornal*(20/9/67);*Jornal do Comércio*, Recife (20 e\n26/9, 5, 6, 17 e 21/10/67 e 25/10/73); LEVINE, R. *Vargas*;**LIMA\nSOBRINHO, A. *Verdade*;**LIMA, J. *Como*;**MACEDO, N.\n*Aspectos*;**NABUCO,**C*. Vida*;**NOGUEIRA FILHO, P.\n*Ideais*;**OLIVEIRA, H. *Presidentes*;**PALÁCIOS, G. *Plantadores*;\nPANDOLFI, D. *Crise*;**PANDOLFI, D. *Trajetória*;**PEIXOTO, A.\n*Getúlio*;**POPPINO, R. *Federal*;**PORTO, J. *Tempos de Lima*;**SILVA,\nG*. Constituinte*;**SILVA, H. *1930*; SILVA, H. *1931*; SILVA, H.\n*1935*; SILVA, H. *1937*; TÁVORA, J. *Vida*;**WANDERLEY, N.\n*História*;**WYNNE, J. *História*.\n\n \n","dic":"DHBB"}
