{"title":"CAVALCANTI, Costa","cargoss":["Deputado federal","Ministro das Minas e Energia","Ministro do Interior","Presidente de associação ou confederação de empregados ou empregadores"],"cargos_esp":[0,0,0,"Eletrobrás"],"datas_ini":[1963,1967,1969,1980],"datas_fim":[1967,1969,1974,1985],"estados":["PE",0,0,0],"autor":[0],"content":"**CAVALCANTI, Costa**\n\n\\*militar; dep. fed. PE 1963-1967; min. Minas e En. 1967-1969; min.\nInterior 1969-1974; pres. Eletrobrás 1980-1985.\n\n* *\n\n*José Costa Cavalcanti* nasceu em Fortaleza no dia 6 de janeiro de 1918,\nfilho de Francisco Boaventura Cavalcanti e de Maria Estela Costa\nCavalcanti. Seu irmão Francisco Boaventura Cavalcanti Júnior seguiu a\ncarreira militar, alcançando o posto de coronel. Teve importante papel\nno movimento político-militar de 31 de março de 1964, destacando-se\ndepois como representante da chamada “linha dura”, até ser cassado pelo\nAto Institucional nº 5 (13/12/1968) em decorrência de suas ligações com\nCarlos Lacerda.\n\nDepois de fazer os estudos preparatórios no Colégio dos Irmãos Maristas,\nem sua cidade natal, Costa Cavalcanti sentou praça em maio de 1935,\ningressando na Escola Militar do Realengo, no Rio de Janeiro, então\nDistrito Federal. Formou-se aspirante-a-oficial da arma de infantaria em\nnovembro de 1937, sendo promovido, em dezembro do ano seguinte, a\nsegundo-tenente, em dezembro de 1940, a primeiro-tenente, e, em dezembro\nde 1944, a capitão. Entre 1946 e 1948, cursou a Escola de\nAperfeiçoamento de Oficiais (EsAO) e a Escola de Comando e Estado-Maior\ndo Exército (ECEME), onde, mais tarde, foi instrutor da cadeira de\ntática de infantaria. Foi oficial tríplice coroado, título dado ao\nprimeiro colocado na Escola Militar, na EsAO e na ECEME. Em 1950 e 1951,\ncursou o Infantary School Advanced Course, em Fort Benning, Geórgia, nos\nEstados Unidos.\n\nEm janeiro de 1952 foi promovido a major e, em abril de 1959, a\ntenente-coronel. Nesse mesmo ano, foi nomeado secretário de Segurança\nPública do estado de Pernambuco, indicado pelo ministro da Guerra,\ngeneral Henrique Lott, atendendo a um pedido do governador Cid Sampaio.\nApesar de cearense, Costa Cavalcanti tinha laços de parentesco com Cid\nSampaio, o que lhe facilitou****o trânsito na política pernambucana.\n\n \n\nCarreira parlamentar\n\nIniciou sua vida política em outubro de 1962, elegendo-se deputado\nfederal por Pernambuco na legenda da União Democrática Nacional (UDN).\nAssumiu o mandato em fevereiro de 1963, e, no período que se seguiu,\nparticipou ativamente das conspirações contra o governo João Goulart.\nNesse sentido, atuou como intermediário de um grupo de coronéis — entre\nos quais se encontravam seu irmão e João Batista Figueiredo — e a\nliderança da oposição parlamentar. Como sua condição de deputado\npermitia-lhe, ainda, desenvolver contatos em todo o país, coube-lhe\nobter a adesão do general Justino Alves Bastos, comandante do IV\nExército, sediado em Recife, à articulação golpista.\n\nEm 31 de março de 1964, foi deflagrado o movimento político-militar que\ndepôs João Goulart. Logo em seguida, o presidente da Câmara dos\nDeputados, Pascoal Ranieri Mazzilli, foi empossado, em caráter\nprovisório, na chefia da nação. O poder de fato, todavia, passou a ser\nexercido pelo autodenominado Comando Supremo da Revolução, constituído\npelos ministros militares. No dia 4 de abril de 1964, Costa Cavalcanti\nparticipou, juntamente com o general Juarez Távora e Nei Braga,\ngovernador do Paraná, de uma reunião com o general Artur da Costa e\nSilva, então ministro da Guerra e membro da junta militar, ocasião em\nque este manifestou a intenção de protelar as eleições presidenciais. No\nmesmo dia, participou de uma outra reunião com os generais Costa e Silva\ne Siseno Sarmento, e os governadores Carlos Lacerda, da Guanabara, José\nde Magalhães Pinto, de Minas Gerais, Ildo Meneghetti, do Rio Grande do\nSul, Mauro Borges, de Goiás, Ademar de Barros, de São Paulo, além de\nJuraci Magalhães e Juarez Távora. Nesse encontro, apesar das\nresistências de Costa e Silva, que relutava em aceitar um militar como\ncandidato à presidência da República, foi conseguida uma declaração sua\nde que não se oporia à candidatura do general Humberto Castelo Branco.\nAlguns dias mais tarde, essa candidatura foi apoiada pela UDN e pelo\nPartido Social Democrático (PSD), através de políticos como Olavo Bilac\nPinto, Aliomar Baleeiro, Pedro Aleixo, João Agripino, Paulo Sarasate,\nDaniel Krieger e Herbert Levy, além do próprio Costa Cavalcanti.\n\nNo dia 5 de abril de 1964, na casa de Castelo Branco, Costa Cavalcanti\ntomou conhecimento do texto que serviu de base para o Ato Institucional\nnº1 (AI-1). Estavam também presentes no local o deputado pessedista José\nMaria Alkmin e o jurista Carlos Medeiros Silva, e todos manifestaram\nconcordância com o teor do documento. Esse mesmo texto, com pequenas\nmodificações, foi editado no dia 9 de abril pela junta militar. O AI-1\nfoi o primeiro elemento formalizador das transformações políticas\nintroduzidas pelo movimento de 1964: permitiu punições extralegais dos\nadversários do novo regime (cassações dos direitos políticos, demissões,\nexpulsões etc.), determinou a eleição indireta do presidente da\nRepública e transferiu para o Executivo importantes atribuições do Poder\nLegislativo.\n\nLogo em seguida à posse de Castelo Branco na presidência da República em\n15 de abril de 1964, levantou-se o problema da continuidade das reformas\npretendidas pelo movimento vitorioso e o fato de que o novo governo\ndisporia apenas de dois anos para realizá-las. Essa questão foi\ndiscutida no dia 6 de maio, num jantar que contou com a presença de\nCastelo Branco, seu ajudante-de-ordens, major Murilo Santos, e os\ndeputados Paulo Sarasate e Costa Cavalcanti. Já no dia seguinte,\nSarasate começou a trabalhar pela prorrogação do mandato de Castelo,\nconversando com o presidente do Congresso, deputado Pedro Aleixo, que se\nposicionou contra a medida. No entanto, a posição favorável à\nprorrogação prevaleceu no Congresso, que em julho de 1964, aprovou a\nextensão do mandato de Castelo até março de 1967.\n\nEm agosto de 1964, Costa Cavalcanti foi promovido a coronel. Segundo o\njornalista Carlos Castelo Branco, tornou-se nesse período não\npropriamente um dissidente, mas um divergente da orientação do governo,\npor sua notória solidariedade à “linha dura” — setor militar partidário\nde um uso mais intenso de medidas de exceção —, e mais tarde, à\ncandidatura do general Costa e Silva à sucessão presidencial, que não\nera a preferida de Castelo Branco. Assim, mesmo depois que o projeto de\nlei das inelegibilidades foi derrotado na Comissão de Justiça da Câmara\ndos Deputados em junho de 1965, Costa Cavalcanti seguiu defendendo a\nproposição, caracterizando-a como fundamental para o aprofundamento do\nprocesso revolucionário.\n\nAs eleições de outubro de 1965 levaram a oposição a obter duas\nimportantes vitórias: Negrão de Lima conquistou o governo da Guanabara e\nIsrael Pinheiro o de Minas Gerais. Segundo a imprensa, em reunião\nrealizada no palácio das Laranjeiras, Costa Cavalcanti teria informado o\npresidente Castelo Branco sobre o descontentamento existente nos\nquartéis diante do resultado do pleito e pedindo medidas de\nendurecimento do regime. O presidente lhe respondera na ocasião que não\ntomaria nenhuma decisão sob pressão. Todavia, no decorrer da conversa,\nteria chegado ao palácio o ministro da Justiça Mílton Campos, trazendo\nseu pedido de exoneração e dizendo-se constrangido com a forma de reação\ndo governo diante da derrota eleitoral que sofrera.\n\nDias depois, em 27 de outubro, foi editado pelo presidente Castelo\nBranco o Ato Institucional nº 2, que reabriu o processo de punições\nextralegais de adversários do regime, cujo julgamento transferiu para a\nJustiça Militar, extinguiu os partidos políticos existentes e\nreinstaurou eleições indiretas para a presidência da República, além de\naumentar as limitações do Legislativo em benefício do Executivo.\n\nNo final de 1965, começaram a surgir as especulações em torno da\nsucessão presidencial. No dia 30 de dezembro, Costa e Silva comunicou a\nCosta Cavalcanti que pleiteava o cargo, dando-lhe liberdade para\ndivulgar a informação. Já nos primeiros dias de janeiro de 1966, após\nhaver conversado com Bilac Pinto e Nei Braga, Costa Cavalcanti deu uma\npequena entrevista à imprensa confirmando e manifestando-se favorável à\ncandidatura de Costa e Silva. Com a instituição do bipartidarismo,\nfiliou-se à Aliança Renovadora Nacional (Arena), de orientação\ngovernista.\n\nDe acordo com o estabelecido pelo Ato Institucional nº 3, editado em 5\nde fevereiro de 1966, as eleições de governadores seriam realizadas\nnaquele ano de forma indireta, através das Assembléias Legislativas.\nCosta Cavalcanti decidiu postular sua candidatura ao governo de\nPernambuco, mas o escolhido foi Nilo Coelho, afinal eleito em setembro.\nEm novembro, reelegeu-se deputado federal por Pernambuco na legenda da\nArena, obtendo, com mais de 35 mil votos, a segunda votação do partido e\ndo estado.\n\n \n\nMinistro das Minas e Energia e do Interior (1967-1974)\n\nEm 15 de março de 1967, no mesmo dia da posse de Costa e Silva na\npresidência da República, Costa Cavalcanti assumiu a pasta das Minas e\nEnergia, em substituição a Mário Thibau, o que o obrigou a interromper o\nmandato parlamentar. O segundo ano do governo Costa e Silva transcorreu\nem meio a crescentes manifestações de oposição ao regime. O aguçamento\ndesses conflitos culminou com a edição do Ato Institucional nº 5 (AI-5)\nem 13 de dezembro de 1968, medida que acentuou em escala inédita o\nautoritarismo vigente. Como todos os demais ministros, Costa Cavalcanti\nfoi signatário do AI-5. Com a demissão do ministro do Interior, general\nAfonso de Albuquerque Lima, em janeiro de 1969, Costa Cavalcanti foi\nindicado para substituí-lo, e transmitiu a pasta das Minas e Energia a\nAntônio Dias Leite, que ocupava a presidência da Companhia Vale do Rio\nDoce.\n\nNo dia 31 de agosto desse ano, o presidente Costa e Silva, gravemente\nenfermo, foi afastado do cargo. Os ministros militares general Aurélio\nde Lira Tavares, do Exército, brigadeiro Márcio de Sousa e Melo, da\nAeronáutica, e o almirante Augusto Rademaker, da Marinha, formaram uma\njunta militar que assumiu o governo, recusando-se a dar posse ao\nvice-presidente, o civil Pedro Aleixo. Costa Cavalcanti manteve-se na\npasta do Interior, e um dia após o afastamento de Costa e Silva,\nparticipou da abertura do I Congresso Brasileiro de Cooperativas de\nHabitação.\n\nEm 12 de outubro, respondeu publicamente aos ataques que a política\ngovernamental em relação aos índios sofria no exterior.\n\nAfirmou que antropólogos estrangeiros, “sequiosos de notoriedade e\nbaseados em notícias distorcidas pela imprensa mundial”, eram os\nresponsáveis pelas acusações de genocídio no Brasil e pela má imagem do\npaís no exterior. Disse ainda que a Fundação Nacional do Índio (Funai)\nagia em defesa do índio promovendo sua integração, principalmente\neconômica, e mantendo as instituições tribais conforme seus fundamentos.\nNegou a ocorrência de genocídio, declarando que havia apenas crimes\nesparsos, tratados pelos órgãos competentes. Suas afirmações fizeram\nparte de um documento enviado a todas as representações diplomáticas\nestrangeiras no Brasil.\n\nMenos de uma semana depois, a junta militar alterou, por decreto-lei, a\ndemarcação das áreas habitadas pelos índios xavantes, com o objetivo de\n“impedir inúteis e prejudiciais pendências com os proprietários\nestabelecidos a longos anos em terras no estado de Mato Grosso”,\nconforme justificativa do ministro do Interior. Em 30 de outubro, tomou\nposse na presidência da República o general Emílio Garrastazu Médici,\nque manteve Costa Cavalcanti na pasta do Interior, até o fim de seu\ngoverno, em 15 de março de 1974.\n\n \n\nNa presidência de empresas estatais\n\nEm maio de 1974, logo no início do governo do general Ernesto Geisel,\nCosta Cavalcanti foi nomeado presidente da Itaipu Binacional, empresa\nmista criada para construir e gerir uma gigantesca hidrelétrica no rio\nParaná, na fronteira do Brasil com o Paraguai. Seu interesse pela\nhidrelétrica de Itaipu surgira em 1967, quando era ministro das Minas e\nEnergia e acompanhara os trabalhos de preparação do projeto e as\nconversações com o governo paraguaio, sócio da empreitada. Na época de\nsua indicação para o cargo de presidente da Itaipu, a imprensa registrou\nque ela teria sido fruto de uma sugestão do general João Batista\nFigueiredo, ex-chefe do Gabinete Militar do governo Médici, e chefe do\nServiço Nacional de Informações (SNI) do governo Geisel.\n\nEm dezembro de 1977, rompendo com seus hábitos, deu uma entrevista à\nimprensa sobre temas políticos, afirmando que o momento não era oportuno\npara se pensar em anistia, medida que considerava dispensável ao\ndesenvolvimento econômico, social e político do país. Na ocasião, negou\nque o país estivesse sob uma ditadura, defendeu o AI-5 e afirmou a\nconveniência de que o próximo presidente da República fosse ainda um\nmilitar. Ao final do governo Geisel, foi apontado como um dos\narticuladores da candidatura à presidência da República do general João\nBatista Figueiredo, de quem fora colega de turma. No dia 15 de março de\n1979, o general Figueiredo tomou posse como presidente, e segundo a\nimprensa da época, Costa Cavalcanti encontrava-se tão envolvido com o\ntrabalho na Itaipu Binacional que teria recusado um posto no novo\nministério.\n\nEm 29 de setembro de 1980, assumiu também a presidência da Eletrobrás,\nsubstituindo Maurício Schulman, passando a responder de forma cumulativa\npelas presidências das duas grandes empresas estatais. Esse fato foi\nvisto como uma demonstração do seu grande prestígio junto ao governo\nfederal. Em janeiro de 1981, os jornais publicaram declarações suas\ndefendendo o programa nuclear brasileiro, que havia sido criticado pelo\npresidente do Partido do Movimento Democrático Brasileiro (PMDB),\ndeputado Ulisses Guimarães. “O programa nuclear é necessário para o\nBrasil” — disse Costa Cavalcanti — “porque o país vai precisar, sem\ndúvida, da eletricidade das usinas nucleares quando tivermos esgotado\nnossa capacidade hídrica, o que ocorrerá no final do século.” Disse\ntambém que “a energia produzida pelas centrais nucleares brasileiras\nsomente será utilizada a partir do ano 2000, quando o país terá\nconseguido absorver a tecnologia nuclear, principalmente a do ciclo do\ncombustível, e a capacitação industrial nesse campo”.\n\nEm novembro de 1981, após a extinção do bipartidarismo (29/11/1979) e a\nconseqüente reformulação partidária, filiou-se oficialmente ao Partido\nDemocrático Social (PDS), de orientação governista.\n\nPermaneceu na presidência da Itaipu Binacional e da Eletrobrás até março\nde 1985, quando findou o governo do presidente João Figueiredo. Em abril\nde 1986, foi indicado para a direção do Projeto Jari, no lugar do\nembaixador Edmundo Barbosa da Silva.\n\nAo longo de sua carreira militar, ocupou também os cargos de\noficial-de-gabinete do ministro da Guerra, adjunto do adido militar\nbrasileiro em Washington e, ainda na capital norte-americana, de\nassessor da Comissão Militar de Defesa Brasil-Estados Unidos.\n\nNa iniciativa privada foi diretor-presidente e conselheiro da Companhia\ndo Jari e membro do conselho de administração da Caemi Mineração e\nMetalurgia S.A.\n\nFaleceu no Rio de Janeiro no dia 10 de agosto de 1991.\n\nEra casado com Haida Correia Cavalcanti, com quem teve três filhos.\n\nFátima Valença atualização\n\n \n\nFONTES: CÂM. DEP. *Deputados*;**CÂM. DEP. *Deputados brasileiros.\nRepertório*(1963-1967 e 1967-1971); *Correio Brasiliense*\n(1/8/77);*Encic. Mirador*; *Globo* (12/11/81 e 11/8/91);*Grande encic.\nDelta*;*Jornal do Brasil* (9/8/75, 21/8 e 11/12/77, 13/12/78, 30/9/80,\n11 e 15/8/91); MAGALHÃES, I. *Segundo*; *Perfil* (1971 e 1972).\n\n \n\n \n\n* *\n","ref":"FONTES: CÂM. DEP. *Deputados*;**CÂM. DEP. *Deputados brasileiros.\nRepertório*(1963-1967 e 1967-1971); *Correio Brasiliense*\n(1/8/77);*Encic. Mirador*; *Globo* (12/11/81 e 11/8/91);*Grande encic.\nDelta*;*Jornal do Brasil* (9/8/75, 21/8 e 11/12/77, 13/12/78, 30/9/80,\n11 e 15/8/91); MAGALHÃES, I. *Segundo*; *Perfil* (1971 e 1972).\n\n \n\n \n\n* *\n","dic":"DHBB"}
