{"title":"CEARÁ, Ubirajara Índio","cargoss":["Deputado federal","Deputado federal"],"cargos_esp":[0,0],"datas_ini":[1966,1965],"datas_fim":[1966,1965],"estados":["CE","CE"],"autor":[0],"content":"**CEARÁ, Ubirajara Índio**\n\n\\*dep. fed. CE 1965 e 1966.\n\n \n\n*Ubirajara Índio do Ceará* nasceu em Quixadá (CE) no dia 20 de fevereiro\nde 1912, filho de Francisco Assis Ferreira Lima e de Felismina Holanda\nFerreira Lima. Seu avô paterno, Timóteo Epifânio Ferreira Lima, e seu\nbisavô paterno, André Epifânio Ferreira Lima, foram deputados estaduais.\n\nEstudou no Colégio São Luís e no Liceu do Ceará, ingressando em seguida\nna Faculdade de Direito do Ceará, pela qual se bacharelou em ciências\njurídicas e sociais no ano de 1932.\n\nEm seu estado, foi promotor-adjunto de Fortaleza (1931-1932), professor\nda Escola de Serviço Social e da Faculdade de Ciências Econômicas da\nuniversidade local, secretário da Faculdade de Direito (1932).\n\nFiscal do Ministério do Trabalho, entre 1933 e 1935, iniciou sua\ncarreira política concorrendo ao pleito de outubro de 1934, no qual foi\neleito deputado estadual na legenda da Liga Eleitoral Católica. Atuou na\nAssembléia Legislativa entre 1935 e 1937, quando foi decretado o Estado\nNovo e fechadas todas as assembléias estaduais.\n\nAtuando na Justiça do Trabalho, foi inspetor regional do Ministério do\nTrabalho no Piauí e no Pará (1937-1941), procurador do Departamento\nNacional do Trabalho (1941-1942), procurador regional do Trabalho na 1ª\ne na 7ª regiões, procurador junto ao Tribunal Superior do Trabalho,\ndelegado regional do Trabalho no Ceará e juiz do Tribunal Regional do\nTrabalho, 7ª Região. Procurador da Justiça do Trabalho, entre 1942 e\n1945, ainda neste ano foi transferido para o Ceará, onde permaneceu na\nProcuradoria até 1962.\n\nEm outubro de 1962, tornou a concorrer a eleições, dessa vez para\ndeputado federal. Eleito suplente pela Coligação União pelo Ceará,\naliança local entre o Partido Social Democrático (PSD) e a União\nDemocrática Nacional (UDN), ocupou uma cadeira na Câmara entre 7 de\nabril e 27 de dezembro de 1965. Em conseqüência de extinção dos partidos\npolíticos pelo Ato Institucional nº 2 (27/10/1965) e da posterior\nimplantação do bipartidarismo, filiou-se à Aliança Renovadora Nacional\n(Arena), agremiação de sustentação ao regime militar instaurado no país\nem abril de 1964, retomando o mandato de 23 de março a 18 de agosto de\n1966. Concorrendo a uma vaga de deputado federal, pela legenda da Arena,\nnas eleições de novembro de 1966, obteve novamente apenas uma suplência.\nNo ano seguinte assumiu a Secretaria de Educação no governo de Plácido\nCastelo (1967-1971).\n\nFoi também diretor regional do Serviço Social do Comércio (Sesc).\n\nFaleceu em Fortaleza, no dia 22 de março de 1979.\n\nEra casado com Maria Dolores Ferreira Lima, com quem teve nove filhos.\n\n \n\nFONTES: CÂM. DEP. *Deputados*; CÂM. DEP. *Deputados brasileiros.\nRepertório* (1946-1967); CARONE, E. *Primeira*; INF. Teresinha Lima\nRibeiro; *Who’s who in Brazil*.\n\n \n","ref":"FONTES: CÂM. DEP. *Deputados*; CÂM. DEP. *Deputados brasileiros.\nRepertório* (1946-1967); CARONE, E. *Primeira*; INF. Teresinha Lima\nRibeiro; *Who’s who in Brazil*.\n\n \n","dic":"DHBB"}
