{"title":"CECÍLIO, Jamel","cargoss":["Deputado federal"],"cargos_esp":[0],"datas_ini":[1979],"datas_fim":[1980],"estados":["GO"],"autor":[0],"content":"**CECÍLIO, Jamel**\n\n\\*dep. fed. GO 1979-1980.\n\n \n\n*Jamel Cecílio* nasceu em Anápolis (GO) no dia 24 de dezembro de 1933,\nfilho de Wadi Cecílio e de Adib Radi Cecílio.\n\nIngressou no curso de economia da Faculdade Anhangüera (GO), mas não\nchegou a concluí-lo.\n\nEmpresário e pecuarista, iniciou sua vida política filiando-se à Aliança\nRenovadora Nacional (Arena) — partido de apoio ao regime militar\ninstaurado no país em abril de 1964 — e candidatando-se em novembro de\n1974 como suplente na chapa de Manuel dos Reis, que não conseguiu se\neleger para o Senado.\n\nEm abril de 1975 foi nomeado prefeito de Anápolis, considerada área de\nsegurança nacional pelo governo militar por sediar a base aérea que\nsupervisionava a capital do país.\n\nEm novembro de 1978 foi eleito deputado federal por Goiás, sempre na\nlegenda da Arena. Deixou a prefeitura de Anápolis em dezembro desse ano\ne tomou posse na Câmara em fevereiro de 1979, passando a integrar a\nComissão de Finanças e, como suplente, a Comissão de Segurança Nacional.\nDurante a legislatura esteve em missão no exterior, em viagem de\nplanejamento de estudos socioeconômicos a países da Europa, Ásia e\nAmérica.\n\nEm novembro desse ano licenciou-se do mandato em conseqüência de um\ncâncer de pulmão. Não retornou mais à Câmara dos Deputados, falecendo em\nGoiânia no dia 19 de março de 1980. Assumiu sua vaga o suplente Guido\nArantes.\n\nJamel Cecílio foi fundador das empresas Cical, Cical Motonáutica e\nCevel, todas revendedoras de automóveis.\n\nEra casado com Valquíria Luna Cecílio, com quem teve quatro filhos.\n\n \n\nFONTES: CÂM. DEP. *Deputados brasileiros. Repertório* (1979-1983); CÂM.\nDEP. *Quadro de titulares e suplentes*; INF. FAM.\n\n \n","ref":"FONTES: CÂM. DEP. *Deputados brasileiros. Repertório* (1979-1983); CÂM.\nDEP. *Quadro de titulares e suplentes*; INF. FAM.\n\n \n","dic":"DHBB"}
