{"title":"CERANTO, Alexandre","cargoss":["Deputado federal","Deputado federal"],"cargos_esp":[0,0],"datas_ini":[1997,1995],"datas_fim":[1998,1996],"estados":["PR","PR"],"autor":[0],"content":"**CERANTO, Alexandre**\n\n\\*dep. fed. PR 1995-1996 e 1997-1998.\n\n** \n\n*Alexandre Ceranto* nasceu em Botucatu (SP) no dia 26 de junho de 1934,\nfilho de Bortolo Ceranto e de Leontina Conti Ceranto.\n\nCom apenas o curso primário concluído, em 1970 tornou-se\ndiretor-presidente do Frigorífico Umuarama, na cidade de mesmo nome, no\nParaná.\n\nEm 1976 passou a exercer a função de juiz de paz da comarca de Umuarama,\nna qual permaneceria até 1983. Ainda em 1976 foi nomeado vice-presidente\ndo Sindicato de Frios e Carnes do Paraná, em Curitiba, desempenhando a\nfunção até 1980. Presidente do Serviço Autárquico de Pavimentação\nAsfáltica de Umuarama em 1977, esteve à frente da entidade até o ano\nseguinte. Em 1982 assumiu a presidência da Associação Comercial e\nIndustrial de Umuarama, cargo que ocupou até 1986, tendo sido\nvice-presidente da Associação Comercial do Norte do Paraná, entidade\nsediada em Maringá,  de 1983 a 1984.\n\nFiliando-se ao recém-criado Partido da Frente Liberal (PFL) em 1985,\ntornou-se membro da comissão executiva do partido no ano seguinte. Nessa\nlegenda foi eleito deputado estadual constituinte no pleito de novembro\nde 1986. Empossado na Assembleia Legislativa do Paraná em março de 1987,\nintegrou as comissões de Segurança e de Finanças.\n\nEm 1987 foi nomeado presidente da Associação Rural Industrial de\nUmuarama,  cargo que exerceu por cerca de dois anos Nas eleições\nrealizadas em novembro de 1988, elegeu-se prefeito de Umuarama na\nlegenda do PFL. Renunciou ao mandato de deputado estadual e assumiu a\nprefeitura em 1º de janeiro do ano seguinte.\n\nEm 1990, passou a exercer a presidência do PFL em Umuarama. Nesse mesmo\nano, viajou a Portugal por ocasião de um evento que consagrou essa\ncidade paranaense como co-irmã da portuguesa Castelo Branco. Encerrou o\nmandato na prefeitura em 31 de dezembro de 1992.\n\nCandidatou-se a deputado federal pelo Paraná na legenda do PFL no pleito\nde outubro de 1994, obtendo uma suplência. Em 3 de fevereiro do ano\nseguinte foi empossado na Câmara dos Deputados em substituição a\nReinhold Stephanes, que assumiu a pasta da Previdência Social do\nprimeiro governo de Fernando Henrique Cardoso (1995-1999).\n\nIntegrou, em 1995, as comissões de Orçamento e de Seguridade Social e\nFamília, e foi terceiro-vice-presidente da comissão especial criada na\nCâmara para analisar a política nacional contra as drogas. Nas votações\ndas emendas constitucionais propostas pelo governo em 1995, seguindo a\norientação do seu partido, votou a favor da mudança no conceito de\nempresa nacional, da prorrogação do Fundo Social de Emergência (FSE), \nrebatizado de Fundo de Estabilização Fiscal (FEF), que permitia ao\ngoverno realocar 20% da arrecadação de impostos sem que estas verbas\nficassem obrigatoriamente vinculadas aos setores de saúde e educação, da\nquebra dos monopólios estatal nas telecomunicações, dos estados na\ndistribuição de gás canalizado, das embarcações nacionais na navegação\nde cabotagem e da Petrobras na exploração de petróleo.\n\nEm 1996, participou das comissões de Minas e Energia e de Fiscalização\nFinanceira e Controle da Câmara, e da Comissão Mista (Câmara e Senado)\nde Planos, Orçamentos Públicos e Fiscalização do Congresso. Em abril\ndesse último ano, voltou à condição de suplente. Retornou à Câmara em\njaneiro de 1997 em substituição a Vílson Santini, e participou dos\ntrabalhos legislativos como titular da Comissão de Agricultura e\nPolítica Rural. Afastou-se mais uma vez do exercício do mandato em abril\nde 1998, em virtude do retorno de Reinhold Stephanes à Câmara. Não\nconcorreu a um novo mandato em outubro de 1998.\n\nDisputou as eleições para a prefeitura de Umuarama em outubro de 2004\npelo Partido da Social Democracia Brasileira (PSDB), mas não se elegeu.\nNo pleito de outubro de 2006 apoiou a reeleição ao governo do estado de\nRoberto Requião, candidato do Partido do Movimento Democrático\nBrasileiro (PMDB), apesar de estar filiado ao PSDB que fazia oposição ao\ngoverno no plano estadual.\n\nPresidente do diretório municipal do PSDB de Umuarama, faleceu em\nCuritiba no dia 16 de fevereiro de 2008.\n\nEra casado e teve seis filhos. Seu genro, Nelson Garcia, foi deputado\nestadual pelo PSDB e secretário do Trabalho no governo de Roberto\nRequião (2006-2009).\n\n \n\nFONTES: CÂM. DEP*. Deputados brasileiros. Repertório*(1995-1999); *Folha\nde S. Paulo* (14/1/1996 e 5/2/1998); *Gazeta do Povo*(17/2/2008);\n*Umuarama Ilustrado*(2/10/2008).\n\n \n","ref":"FONTES: CÂM. DEP*. Deputados brasileiros. Repertório*(1995-1999); *Folha\nde S. Paulo* (14/1/1996 e 5/2/1998); *Gazeta do Povo*(17/2/2008);\n*Umuarama Ilustrado*(2/10/2008).\n\n \n","dic":"DHBB"}
