{"title":"CHAVES, Antônio de Carvalho","cargoss":["Deputado federal","Interventor"],"cargos_esp":[0,0],"datas_ini":[1904,1947],"datas_fim":[1914,1947],"estados":["PR","PR"],"autor":[0],"content":"**CHAVES, Antônio de Carvalho**\n\n\\*dep. fed. PR 1904-1914; interv. PR 1947.\n\n \n\n*Antônio Augusto de Carvalho Chaves* nasceu em Macaíba (RN) no dia 26 de\nmarço de 1875, filho de Joaquim Gonçalves Chaves Filho e de Francisca\nTeixeira de Carvalho Chaves.\n\nEm 1883, sua família transferiu-se para o Paraná. Fez os estudos\nprimários no Colégio Partenon Paranaense e os secundários no colégio do\nprofessor Artur Loiola, em Curitiba. Ingressou em seguida na Faculdade\nde Direito de São Paulo, pela qual bacharelou-se em 1895. Nesse ano,\nainda antes de se formar, foi promotor público em Ribeirão Preto (SP).\n\nRetornando ao Paraná, foi nomeado secretário do Interior, Justiça e\nInstrução Pública do estado em março de 1896. Deixou o cargo em 25 de\nfevereiro de 1900, assumindo no dia seguinte a Secretaria Estadual de\nFinanças, Comércio e Indústria, à frente da qual permaneceu até\nfevereiro de 1904. Tornou-se então advogado da Estrada de Ferro São\nPaulo-Rio Grande.\n\nEm junho de 1904, elegeu-se deputado federal pelo Paraná, obtendo três\nreeleições sucessivas e permanecendo até 1914 na Câmara Federal, onde\nintegrou a Comissão de Obras Públicas. De 1906 a 1907, cumpriu também\nmandato como deputado estadual.\n\nCom a vitória da Revolução de 1930, foi nomeado presidente da Comissão\nde Sindicância do Paraná.\n\nNo pleito de outubro de 1934, foi novamente eleito deputado estadual, na\nlegenda do Partido Social Democrático (PSD) do Paraná, exercendo o\nmandato de 1935 a 10 de novembro de 1937, quando o advento do Estado\nNovo suspendeu o funcionamento dos órgãos legislativos em todo o país.\nDurante essa legislatura, presidiu a Assembléia Legislativa e\nrepresentou o PSD paranaense na convenção nacional em que foi lançada a\ncandidatura de José Américo de Almeida à presidência da República\n(25/5/1937).\n\nEm 1947, foi nomeado interventor federal no Paraná, permanecendo no\ncargo até transmiti-lo, ainda no mesmo ano, ao governador eleito Moisés\nLupion.\n\nFoi membro da Sociedade Nacional de Agricultura desde 1907, e da\nSociedade de Geografia do Rio de Janeiro. Em Curitiba, colaborou nos\nperiódicos *A* *República*e *O Estado.*\n\nFaleceu na capital paranaense no dia 3 de junho de 1949.\n\nFoi casado com Rosa de Carvalho Chaves. Seu filho, Eduardo de Carvalho\nChaves, militar, foi chefe do Estado-Maior do Exército em 1963 e chefe\ndo Departamento Geral de Pessoal do Exército em 1963 e 1964.\n\n \n\n \n\nFONTES: ABRANCHES, J.*****Governos;*CÂM. DEP.*Deputados; Diário de\nNotícias,*Rio (26/5/37);*Grande encic. Delta;*NICOLAS, M. *Cem;\nPersonalidades;*VAMPRÉ, S. *Memórias.*\n\n \n","ref":"FONTES: ABRANCHES, J.*****Governos;*CÂM. DEP.*Deputados; Diário de\nNotícias,*Rio (26/5/37);*Grande encic. Delta;*NICOLAS, M. *Cem;\nPersonalidades;*VAMPRÉ, S. *Memórias.*\n\n \n","dic":"DHBB"}
