{"title":"CHAVES, Eduardo de Carvalho","cargoss":["Chefe do Estado-Maior do Exército","Chefe do Departamento Geral de Pessoal do Exército"],"cargos_esp":[0,0],"datas_ini":[1963,1963],"datas_fim":[1963,1964],"estados":[0,0],"autor":[0],"content":"**CHAVES, Eduardo de Carvalho**\n\n\\*militar; ch. EME 1963; ch. Depto. Ger. Pess. Ex. 1963-1964.\n\n \n\n*Eduardo de Carvalho Chaves* nasceu em Curitiba no dia 28 de março\nde****1900, filho****de Antônio Augusto de Carvalho Chaves e de Rosa de\nCarvalho Chaves. Seu pai foi deputado federal pelo Paraná de 1904 a 1914\ne interventor federal no estado em 1947.\n\nTransferindo-se com a família para o Rio de Janeiro, então Distrito\nFederal, estudou no Colégio Militar, pelo qual se formou em 1916. Em\nfevereiro do ano seguinte sentou praça na Escola Militar do Realengo,\nsempre no Rio, daí saindo aspirante da arma de infantaria em dezembro de\n1919. Foi promovido a segundo-tenente em abril de 1920 e a\nprimeiro-tenente em setembro de 1922. Formou-se depois pela Faculdade de\nEngenharia da Universidade do Paraná, publicando em 1927 as teses\n*Exame* *da estabilidade dos encontros e pilares de alvenaria*e*O\nemprego dos normogramas como* *simplificadores dos cálculos do\nengenheiro*-*arquiteto.*Em dezembro de 1929 atingiu o posto de capitão,\nem setembro de 1937 obteve sua promoção a major, em maio de 1942 a\ntenente-coronel e em dezembro de 1944 a coronel. Pertenceu a uma das\nprimeiras turmas da Escola Superior de Guerra, e em dezembro de 1952 foi\npromovido a general-de-brigada e nomeado comandante da Infantaria\nDivisionária (ID/7) da 7ª Região Militar (RM).\n\nServiu em vários estados durante sua longa carreira militar, tendo sido\ninstrutor da Escola Estadual de Exército, no Paraná, comandante da 4ª\nRM, em Juiz de Fora (MG), da 6ª RM, em Salvador, da 7ª RM, em Recife, e\nainda diretor da Divisão de Instrução e da Diretoria de Ensino e\nFormação do Exército, no Rio.\n\nJá no posto de general-de-exército, em abril de 1963, no governo de João\nGoulart, foi nomeado chefe do Estado-Maior do Exército (EME),\nsubstituindo o general José Machado Lopes, que retornou ao cargo em\njunho seguinte. Ainda em dezembro desse ano, assumiu a chefia do\nDepartamento Geral de Pessoal do Exército, anteriormente ocupada pelo\ngeneral Artur da Costa e Silva. Exerceu essas funções até abril de 1964,\npouco depois da eclosão do movimento político-militar que depôs João\nGoulart, ocasião em que foi substituído pelo general Valdemar Levi\nCardoso e passou para a reserva com a patente de marechal.\n\nFez os cursos de aperfeiçoamento de oficiais, de estado-maior, de\ncomando superior da Escola de Guerra Naval e durante muitos anos foi\nprofessor catedrático da atual Universidade Federal do Paraná.\n\nFaleceu no Rio de Janeiro em 30 de junho de 1981, tendo sido o primeiro\nmilitar paranaense a atingir o posto de marechal.\n\nFoi casado com Maria Alice Catalão de Carvalho Chaves, com quem teve um\nfilho.\n\n \n\n \n\nFONTES: CORRESP. SECRET. GER. EXÉRC.; COUTINHO, A. *Brasil; Estado de*\n*S. Paulo*(3/7/81);*Jornal do Brasil*(3/7/81); MIN. GUERRA*.\nAlmanaque*(1958); MOREIRA, J.*****Dic.*\n\n \n","ref":"FONTES: CORRESP. SECRET. GER. EXÉRC.; COUTINHO, A. *Brasil; Estado de*\n*S. Paulo*(3/7/81);*Jornal do Brasil*(3/7/81); MIN. GUERRA*.\nAlmanaque*(1958); MOREIRA, J.*****Dic.*\n\n \n","dic":"DHBB"}
