{"title":"ALMEIDA, Jaime de","cargoss":["ch Dir Mat Bél Ex","Comandante do III Exército","ch Depto Prov Ger Ex"],"cargos_esp":[0,0,0],"datas_ini":[1956,1956,1959],"datas_fim":[1956,1958,1960],"estados":[0,0,0],"autor":[0],"content":"**ALMEIDA, Jaime de**\n\n\\*militar; ch. Dir. Mat. Bél. Ex. 1956; comte. III Ex. 1956-1958; ch.\nDepto. Prov. Ger. Ex. 1959-1960.\n\n*Jaime de Almeida* nasceu no Rio de Janeiro, então Distrito Federal, no\ndia 19 de agosto de 1895, filho de Alberto Maximino de Almeida e de\nMaria da Glória Pereira Pinto de Almeida.\n\nSentou praça em novembro de 1911 no 2º Regimento de Infantaria (2º RI),\nna Vila Militar de sua cidade natal, tendo servido na secretaria dessa\nunidade. Em abril de 1912 foi transferido para o Grupo Provisório de\nObuses, na mesma cidade, sendo ali graduado aspirante-de-alçada e, logo\ndepois, cabo artilheiro. Em outubro desse mesmo ano foi promovido a\nterceiro-sargento, chegando no mês seguinte ao posto de\nsegundo-sargento. Ainda em 1912 passou a integrar o efetivo da Escola de\nArtilharia e Engenharia Civil, sendo transferido, em maio do ano\nseguinte, para a Escola Militar do Realengo, no Rio de Janeiro, em\nvirtude da extinção daquele estabelecimento militar de ensino. Em junho\nde 1917 passou a sargento, sendo declarado aspirante-a-oficial de\nartilharia em dezembro do ano seguinte. Em dezembro de 1919 recebeu a\npatente de segundo-tenente e no mês seguinte, tendo concluído o curso da\nEscola Militar do Realengo, passou a servir no 4º Regimento de\nArtilharia Montada (4º RAM) sediado em Itu (SP). Promovido a\nprimeiro-tenente em janeiro de 1921, foi transferido no mês de março\nseguinte para o 2º Grupo de Artilharia de Costa, sediado na Fortaleza de\nSão João, no Rio, ali exercendo as funções de secretário da 3ª Bateria e\nde comandante da 1ª Bateria. Em julho do mesmo ano, passou a servir no\n1º Grupo de Artilharia de Montanha (1º GAM), sediado em Campinho (ES),\nonde comandou as 1ª e 2ª baterias e, interinamente, em outubro, a\nfiscalização do grupo.\n\nEm junho de 1922 foi removido para o 1º RAM, na Vila Militar do Rio,\nonde realizou até agosto seguinte o curso de oficiais orientadores de\nantena, sendo em seguida transferido para o 6º Regimento de Artilharia,\nem Cruz Alta (RS). Nessa unidade comandou a 2ª Bateria do 1º Grupo, o 2º\nGrupo, a 6ª Bateria e a fiscalização do regimento. Em janeiro de 1923\npassou para o 1º GAM e em fevereiro do mesmo ano recebeu a patente de\ncapitão. No mês seguinte foi nomeado auxiliar do gabinete técnico do\nArsenal de Guerra do Rio de Janeiro, função na qual permaneceu até abril\ndo ano seguinte. Em junho de 1924 voltou a Itu para servir no 4º RAM,\nchegando ao comando do 1º Grupo dessa unidade.\n\nPermaneceu de janeiro de 1929 a maio do ano seguinte adido ao\nDepartamento de Pessoal de Guerra (DPG), no Rio de Janeiro, ingressando\ndepois na Escola de Aperfeiçoamento de Oficiais (EsAO). Retornando ao\nDPG em outubro de 1930, foi transferido em janeiro do ano seguinte para\no 4º GAM, em Juiz de Fora, onde passou a comandar a partir de junho a 1ª\nBateria dessa guarnição. Participou da repressão à Revolução\nConstitucionalista de São Paulo, irrompida em julho de 1932, que teve\norigem na marginalização imposta pelo Governo Provisório de Getúlio\nVargas à oligarquia política paulista após a vitória da Revolução de\n1930. Essa oligarquia, concentrada especialmente no Partido Democrático\n(PD), que tinha tomado parte no movimento revolucionário, aliou-se,\ndurante os anos de 1931 e 1932, a outros setores oligárquicos e passou a\nfazer acirrada oposição às forças tenentistas que apoiavam o governo\nfederal. Jaime de Almeida participou de diversos combates aos rebeldes\nna região de Passa Quatro, Manacá e no Túnel da Mantiqueira, onde\nprestou socorro ao 2º RI e ao 4º Regimento de Cavalaria Divisionária (4º\nRCD). Nessa oportunidade recebeu elogios do comandante da 4ª Divisão de\nInfantaria (4ª DI), com sede em Juiz de Fora, general Francisco Jorge\nPinheiro. Em setembro de 1932 recebeu a patente de major, sendo nomeado\ncomandante da artilharia do 1º Grupo de Destacamentos da 4ª DI e\nposteriormente comandante do 4º GAM, função que exerceu até novembro\nseguinte.\n\nEm janeiro de 1933 foi novamente transferido para o 4º RAM, ali\nexercendo por diversas vezes o subcomando do regimento. Deixando essa\nguarnição em março do mesmo ano, foi removido para o 2º Grupo de\nArtilharia Pesada (2º GAP), em Quitaúna (SP), onde exerceu o comando do\ngrupo. Em fevereiro de 1934 foi para o 7º GAP, permanecendo nessa\nunidade até março do ano seguinte, quando ingressou na Escola de\nEstado-Maior. Depois de concluir seu curso em março de 1937, tornou-se\noficial estagiário no quartel-general da 8ª Região Militar (8ª RM),\nsediada em Belém. Em maio desse mesmo ano foi promovido a\ntenente-coronel, retornando em julho seguinte ao Rio de Janeiro para\nestagiar na 4ª Seção do Estado-Maior do Exército (EME). Em novembro de\n1937 foi transferido para o quartel-general da 5ª RM, em Curitiba, tendo\nchefiado interinamente o estado-maior regional em janeiro e de fevereiro\na junho de 1938. Voltando ao Rio de Janeiro em outubro do mesmo ano,\npassou a chefiar interinamente o estado-maior da 1ª RM, função que\nexerceu até maio de 1939. De maio a dezembro desse ano comandou o 1º\nRegimento de Artilharia Mista, sediado em Curitiba.\n\nA partir de julho de 1940 passou a servir na Inspetoria do 2º Grupo de\nRegiões Militares, no Rio de Janeiro, tendo ali desempenhado as funções\nde fiscal e chefe do estado-maior. Em dezembro de 1941 chegou ao posto\nde coronel. Removido para Cruz Alta em janeiro do ano seguinte, serviu\naté o mês de abril na Artilharia Divisionária da 3ª RM, sediada em Porto\nAlegre, cuja chefia exerceu interinamente. Deixando essa função,\ntransferiu-se para o 5º RAM, em Santa Maria (RS), onde exerceu\ninterinamente, por diversas vezes, os comandos da guarnição e do\nregimento. Em março de 1943 foi transferido para o 1º RAM, no Rio de\nJaneiro, tendo comandado esse regimento e a Artilharia Divisionária da\n1ª RM até junho desse mesmo ano. De julho a dezembro de 1944 desempenhou\nas funções de adido militar junto à embaixada do Brasil na Inglaterra,\nsendo posteriormente designado para servir no EME.\n\nEm maio de 1946 recebeu a patente de general-de-brigada e em junho\nseguinte deixou o EME para ingressar dois meses depois na 2ª DI, em São\nPaulo, onde comandou, até dezembro de 1948, a Artilharia Divisionária.\nExerceu ainda interinamente o subcomando da 2ª DI e o comando da 2ª RM.\nEm fevereiro do ano seguinte, transferiu-se para o Rio de Janeiro, a fim\nde comandar a Artilharia Divisionária da 1ª DI, função que exerceu até\njunho de 1952. Nesse mesmo mês assumiu o comando da 1ª DI. Promovido a\ngeneral-de-divisão em agosto de 1952, em 1954 fez o curso da Escola\nSuperior de Guerra (ESG), tendo visitado nessa ocasião os Estados\nUnidos, a convite do governo norte-americano. Ainda em 1954 exerceu\nnovamente o comando da 1ª DI e da guarnição da Vila Militar.\n\nRemovido para o quartel-general da 4ª DI, em março de 1955 passou a\ncomandar essa unidade e, interinamente, a guarnição da capital mineira.\nRetornando em março de 1956 ao Rio de Janeiro, exerceu até outubro desse\nano o cargo de chefe da Diretoria Geral do Material Bélico do Exército.\nNesse mesmo mês chefiou ainda o Departamento Geral de Administração.\nAinda em outubro de 1956 foi nomeado comandante do III Exército, sediado\nem Porto Alegre, em substituição ao general-de-exército Edgar do Amaral.\nEm dezembro do mesmo ano chegou ao posto de general-de-exército.\n\nEm agosto de 1958 deixou o comando do III Exército, sendo substituído\npelo general-de-divisão Osvino Ferreira Alves. Voltando ao Rio de\nJaneiro, passou a servir no Departamento Geral de Pessoal, exercendo\nali, interinamente, de agosto a setembro de 1958 e de fevereiro a março\ndo ano seguinte, a sua chefia. Neste último mês passou a chefiar o\nDepartamento de Provisão Geral do Exército, atualmente Departamento\nGeral de Serviços do Exército, em substituição ao general-de-exército\nNicanor Guimarães de Sousa, ali permanecendo até dezembro de 1960,\nquando foi substituído pelo general-de-exército João de Segadas Viana.\nNesse mesmo mês passou para a reserva de primeira classe no posto de\nmarechal.\n\nCasou-se com Julieta Sovatini de Almeida, com quem teve três filhos.\n\nFONTES: ARQ. MIN. EXÉRC.; CORRESP. SECRET. GER. EXÉRC.; COUTINHO, A.\n*Brasil;*MIN. GUERRA. *Almanaque*(1959 e 1960).\n\n \n","ref":"FONTES: ARQ. MIN. EXÉRC.; CORRESP. SECRET. GER. EXÉRC.; COUTINHO, A.\n*Brasil;*MIN. GUERRA. *Almanaque*(1959 e 1960).\n\n \n","dic":"DHBB"}
