{"title":"CHAVES, Raimundo","cargoss":["Deputado federal","Deputado federal"],"cargos_esp":[0,0],"datas_ini":[1965,1959],"datas_fim":[1966,1963],"estados":["RS","RS"],"autor":[0],"content":"**CHAVES, Raimundo**\n\n\\*militar; dep. fed. RS 1959-1963 e 1965-1966.\n\n*Raimundo Lins de Vasconcelos Chaves* nasceu em Belém no dia 1º de\nsetembro de 1912, filho do advogado Alfredo Chaves e de Maria do Carmo\nChaves. Seu primo, Aluísio da Costa Chaves, foi governador do estado do\nPará de março de 1975 a agosto de 1978.\n\nGeneral do Exército, fez seus estudos na Escola Militar, na Escola do\nEstado-Maior, na Escola de Transmissões e na Escola de Aperfeiçoamento.\n\nRadicado no Rio Grande do Sul, chefiou a polícia do estado entre 1954 e\n1958. Foi eleito deputado federal pelo Rio Grande do Sul no pleito de 3\nde outubro deste último ano, na legenda do Partido Social Democrático\n(PSD), tendo exercido o mandato de 1º de fevereiro de 1959 a 31 de\njaneiro de 1963. No pleito de outubro de 1962, candidatou-se à\nreeleição, obtendo apenas uma suplência. Em conseqüência da extinção dos\npartidos políticos pelo Ato Institucional nº 2 (27/10/1965) e da\nposterior instauração do bipartidarismo, filiou-se à Aliança Renovadora\nNacional (Arena), partido de sustentação ao regime militar instaurado no\npaís em abril de 1964, tendo ocupado uma cadeira na Câmara dos Deputados\nde 7 de dezembro de 1965 a 13 de janeiro de 1966. Em novembro seguinte,\ncandidatou-se novamente à Câmara pela legenda arenista, conquistando\napenas uma suplência.\n\nCom o fim do bipartidarismo em 21 de novembro de 1979 e a conseqüente\nreformulação partidária, filiou-se ao Partido Trabalhista Brasileiro\n(PTB).\n\nCasou-se com Moema Chaves, com quem teve seis filhos.\n\nFONTES: CÂM. DEP. *Deputados;*CÂM. DEP. *Deputados* *brasileiros*.\n*Repertório*(1946-1967); *Estado de* *S. Paulo*(10/8/82); TRIB. SUP.\nELEIT. *Dados.*\n\n \n","ref":"FONTES: CÂM. DEP. *Deputados;*CÂM. DEP. *Deputados* *brasileiros*.\n*Repertório*(1946-1967); *Estado de* *S. Paulo*(10/8/82); TRIB. SUP.\nELEIT. *Dados.*\n\n \n","dic":"DHBB"}
