{"title":"CHEDID, Wilson ==============","cargoss":["Deputado federal"],"cargos_esp":[0],"datas_ini":[1963],"datas_fim":[1967],"estados":["PR"],"autor":[0],"content":"CHEDID, Wilson\n==============\n\n\\* dep. fed. PR 1963-1967.\n\n \n\n*Wilson Chedid*nasceu em Curitiba no dia 1º de abril de 1922, filho de\nEmiliano Chedid e de Francisca Rubin Chedid.\n\nFormado em Direito no ano de 1953 pela Faculdade de Direito da atual\nUniversidade Federal do Paraná, ingressou no Banco do Brasil em 1951, e\naí permaneceria até 1968. Foi eleito deputado federal pelo Paraná no\npleito de 7 de outubro de 1962, na legenda do Partido Trabalhista\nBra­sileiro (PTB), assumindo o mandato em lº de fevereiro de 1963. Em\nconseqüência da extinção dos partidos po­líticos pelo Ato Institucional\nn°. 2 (27/10/ 1965) e da posterior instauração do biparti­darismo,\nfiliou-se ao Movimento Democrá­tico Brasileiro (MDB), partido de\noposição ao regime militar instalado no país em abril de 1964.\nVice-presidente da Comissão de Finanças em 1966, candidatou-se à\nreeleição pelo MDB no pleito de novembro daquele ano, mas não foi bem\nsucedido. Deixou a Câmara dos Deputados em janeiro de 1967, ao final da\nlegislatura, abandonando a carreira política.\n\nAinda em 1967, reassumiu a função de escriturário no Banco do Brasil, em\nSão Paulo, aposentando-se em 1973.\n\nCasou-se com Eunice Stocchero Chedid, com quem teve três filhos.\n\n \n\nFONTES: CÂM. DEP. *Deputados*;**CÂM. DEP. *Deputados brasileiros.\nRepertório*(1946-1967); INF. BIOG.; TRIB. SUP. ELEIT. *Dados*.\n","ref":"FONTES: CÂM. DEP. *Deputados*;**CÂM. DEP. *Deputados brasileiros.\nRepertório*(1946-1967); INF. BIOG.; TRIB. SUP. ELEIT. *Dados*.\n","dic":"DHBB"}
