{"title":"CICOTE, José","cargoss":["Deputado federal"],"cargos_esp":[0],"datas_ini":[1991],"datas_fim":[1995],"estados":["SP"],"autor":["Nara Santana","Marcelo Costa"],"content":"**CICOTE, José**\n\n\\* dep. fed. SP 1991-1995\n\n*José Cicote* nasceu em Poloni (SP) no dia 29 de novembro de 1937, filho\nde Natal Cicote e de Ludovica Munhato.\n\nCursou o primário de 1945 a 1949 e profissionalizou-se como operador de\nmáquinas, mecânico de manutenção e técnico de alta tensão.\n\nEm 1972 ingressou no sindicalismo como suplente da diretoria do\nSindicato dos Metalúrgicos de Santo André (ABC/SP), sendo efetivado no\nano seguinte. Durante a década de 1970, participou de congressos e\nseminários estaduais e nacionais do movimento sindical, tais como o\nEncontro Nacional da Classe Trabalhadora (Enclat) e o Congresso Nacional\nda Classe Trabalhadora (Conclat), e foi também membro do Centro de\nEstudos Políticos e Sociais (CEPS) e do Comitê Brasileiro de Anistia\n(CBA) da região do ABC paulista. Em 1979, no início do governo do\ngeneral João Batista Figueiredo (1979-1985), foi provisoriamente\ndestituído do cargo por ter liderado movimentos grevistas juntamente com\nlideranças do “novo sindicalismo”, entre as quais Luís Inácio Lula da\nSilva. Neste mesmo ano foi um dos fundadores do Partido dos\nTrabalhadores (PT) e membro da comissão provisória nacional do partido.\nDepois de ser reconduzido à direção do Sindicato dos Metalúrgicos,\npermaneceu no cargo até 1980, sendo posteriormente enquadrado na Lei de\nSegurança Nacional (LSN).\n\nEm 1981, assumiu a presidência do Diretório Municipal do PT em Santo\nAndré e foi membro do Diretório Nacional desta agremiação.\n\nNas eleições de novembro de 1982 concorreu a deputado estadual pelo PT\nde São Paulo. Eleito, foi empossado em março de 1983, quando deixou a\npresidência do Diretório Municipal do partido e tornou-se membro dos\nDiretórios estadual e municipal. Como deputado estadual, foi\nsegundo-vice-presidente da Mesa, membro titular das comissões de\nPromoção Social, de Transportes e Comunicações e de Segurança Pública e\nsuplente das comissões de Assuntos Municipais e de Relações do Trabalho.\nReeleito deputado estadual constituinte em novembro de 1986 iniciou novo\nmandato em fevereiro do ano seguinte. Ainda em 1987, assumiu a\npresidência estadual do PT, cargo que exerceria até 1989.\n\nDurante os trabalhos da Assembléia Estadual Constituinte de São Paulo\n(1987-1988), foi membro titular da Comissão de Administração Pública e\nsuplente da Comissão de Sistematização. Participou dos trabalhos\nlegislativos ordinários da Assembléia Legislativa como quarto-secretário\nda Mesa, relator da comissão estadual de inquérito (CEI) da Usina Tamoio\ne outras empresas paulistas, presidente da CEI dos meios de transportes\ncoletivos e membro suplente das comissões de Agricultura e Pecuária, de\nAdministração Pública, de Serviços e Obras Públicas, de Transportes e\nComunicações, da CEI sobre os “bóias-frias” e sobre o desemprego no\nestado de São Paulo.\n\nNo pleito de novembro de 1988, concorreu, ainda na legenda do PT, ao\ncargo de vice-prefeito de Santo André na chapa encabeçada por Celso\nDaniel. Eleito, renunciou ao mandato de deputado estadual, sendo\nempossado vice-prefeito em fevereiro de 1989. Uma de suas bandeiras de\nluta era a criação de um banco dos trabalhadores, tal como o existente\nna Venezuela.\n\nDesincompatibilizando-se do cargo de vice-prefeito, disputou com sucesso\numa cadeira na Câmara dos Deputados no pleito de outubro de 1990, sempre\nna legenda do PT. Deixando a prefeitura de Santo André, iniciou seu\nmandato de deputado federal em fevereiro de 1991, sendo membro titular\nda Comissão de Defesa do Consumidor, Meio Ambiente e Minorias e suplente\nda Comissão de Viação e Transportes, Desenvolvimento Urbano e Interior\nda Câmara dos Deputados.\n\nNa sessão da Câmara dos Deputados de 29 de setembro de\n1992, votou a favor do *impeachment*do presidente Fernando Collor de\nMelo, acusado de crime de responsabilidade por ligações com um esquema\nde corrupção liderado pelo ex-tesoureiro de sua campanha presidencial,\nPaulo César Farias. Afastado da presidência logo após a votação na\nCâmara, Collor renunciou ao mandato em 29 de dezembro de 1992, pouco\nantes da conclusão do processo pelo Senado Federal, sendo efetivado na\npresidência da República o vice Itamar Franco, que já vinha exercendo o\ncargo interinamente desde o dia 2 de outubro.\n\nNas principais matérias constitucionais apresentadas na\nCâmara dos Deputados ao longo da legislatura 1991-1995, José Cicote\nvotou contra a criação do Imposto Provisório sobre Movimentação\nFinanceira (IPMF), imposto de 0,25% sobre transações bancárias criado\ncomo fonte complementar de recursos para a saúde, faltou à votação da\ncriação do Fundo Social de Emergência (FSE) que permitia ao governo\nretirar recursos de áreas como saúde e educação para ter maior liberdade\nde administração das verbas e votou a favor do fim do voto obrigatório.\n\nConcorreu à reeleição no pleito de outubro de 1994, mas obteve apenas\numa suplência. Deixou a Câmara dos Deputados em janeiro seguinte, ao\nfinal da legislatura.\n\nEm novembro de 1996 esteve envolvido num conflito entre sindicalistas\nligados à Força Sindical e à Central Única dos Trabalhadores (CUT) em\nSanto André, sendo acusado pelo presidente do Sindicato dos Metalúrgicos\ndo ABC, Luis Marinho, de ter sido um dos mentores do confronto, que\nresultou em tiros disparados contra um veículo da CUT e agressões\nfísicas. Cicote fazia parte de um grupo dissidente da CUT que resultou\nna divisão do Sindicato dos Metalúrgicos do ABC e na criação do\nSindicato dos Metalúrgicos de Santo André, ligado à Força Sindical.\n\nCasou-se com Inês de Carvalho Cicote, com quem teve quatro filhos.\n\n\nNara Santana/Marcelo Costa\n\n\nFONTES: CÂM. DEP. *Deputados brasileiros. Repertório* (1991-1995);\n*Estado de São Paulo* (12/11/96); *Folha de São Paulo* (18/9/94);*Perfil\nparlamentar/IstoÉ*.\n","ref":"FONTES: CÂM. DEP. *Deputados brasileiros. Repertório* (1991-1995);\n*Estado de São Paulo* (12/11/96); *Folha de São Paulo* (18/9/94);*Perfil\nparlamentar/IstoÉ*.\n","dic":"DHBB"}
