{"title":"COELHO, Carlos Gouveia","cargoss":["Arcebispo"],"cargos_esp":["Olinda e Recife"],"datas_ini":[1960],"datas_fim":[1964],"estados":[0],"autor":[0],"content":"**COELHO, Carlos Gouveia**\n\n\\*religioso; arceb. Olinda e Recife 1960-1964.\n\n \n\n*Carlos Gouveia Coelho* nasceu na cidade da Paraíba, atual João Pessoa,\nno dia 28 de dezembro de 1907, filho de José Vieira Coelho e de Maria\nEmerentina Gouveia Coelho.\n\nIngressou em fevereiro de 1922 no Seminário da Paraíba, onde fez os\nestudos preparatórios de filosofia e de teologia, ordenando-se em\nfevereiro de 1930. Ainda em 1930 foi designado secretário do Bispado e\nvigário cooperador em Cajazeiras (PB), funções que exerceu até o ano\nseguinte, quando assumiria a direção do Ginásio Padre Rolim, na mesma\ncidade. Em 1932 foi transferido como professor para o Seminário de João\nPessoa, atividade que manteria por 14 anos. Também na capital paraibana,\nfoi capelão do Colégio Pio X a partir de 1933, diretor da imprensa\noficial em 1933 e 1934 e capelão do Colégio Nossa Senhora de Lourdes de\n1940 a 1948.\n\nNomeado em 1947 diretor do Departamento de Educação da Paraíba pelo\ngovernador Osvaldo Trigueiro, ocupou esse cargo até janeiro de 1948,\nquando foi designado bispo de Nazaré da Mata (PE), sendo sacramentado em\nmaio seguinte. Permaneceu nessa cidade pernambucana até dezembro de\n1954, quando, transferido para Niterói, passou a bispo residencial da\nCúria.\n\nEm abril de 1960, foi designado arcebispo de Olinda e Recife, em\nsubstituição a dom Antônio de Almeida Morais Júnior, assumindo o cargo\nem agosto do mesmo ano. Na condição de padre conciliar, participou, em\n1962 e 1963, das sessões do Concílio Vaticano II, em Roma.\n\nFoi também presidente do Secretariado Nacional de Educação da\nConferência Nacional dos Bispos do Brasil (CNBB) e assistente da Ação\nCatólica.\n\nPublicou trabalhos literários em revistas e jornais.\n\nFaleceu em Recife, em pleno exercício da função de arcebispo, no dia 7\nde março de 1964. Foi substituído no posto por dom Hélder Câmara.\n\n \n\n \n\nFONTES: CONFERÊNCIA NAC. BISPOS DO BRASIL; COUTINHO, A. *Brasil;*GARDEL,\nL. *Armoiries.*\n\n \n","ref":"FONTES: CONFERÊNCIA NAC. BISPOS DO BRASIL; COUTINHO, A. *Brasil;*GARDEL,\nL. *Armoiries.*\n\n \n","dic":"DHBB"}
