{"title":"COELHO, Paulo","cargoss":["Senador","Deputado federal"],"cargos_esp":[0,0],"datas_ini":[1962,1963],"datas_fim":[1963,1967],"estados":["AM","AM"],"autor":[0],"content":"**COELHO, Paulo**\n\n\\*sen. AM 1962-1963; dep. fed. AM 1963-1967.\n\n \n\n*Paulo Ramos Coelho* nasceu em Humaitá (AM) no dia 23 de agosto de 1918,\nfilho de Francisco Plínio Coelho e de Ana Ramos Coelho. Seu irmão Plínio\nRamos Coelho foi deputado federal pelo Amazonas de 1951 a 1955 e\ngovernador do mesmo estado de 1955 a 1959 e de 1963 a 1964.\n\nIniciou o curso primário no interior do seu estado natal e concluiu-o em\nManaus, cursando o ginasial no Colégio Estadual do Amazonas. Trabalhou\npor nove anos como escrevente juramentado do 4º Ofício de Notas, em\nManaus, depois como chefe de escritório do Lóide Brasileiro naquela\ncidade e em Salvador, e agente da mesma empresa em Manaus e Belém. Em\n1943 diplomou-se em contabilidade e passou a contador no Lóide\nBrasileiro. Em 1948 bacharelou-se pela Faculdade de Direito da\nUniversidade do Pará, após****o que tornou-se procurador jurídico no\nLóide Brasileiro.\n\nEm outubro de 1950 elegeu-se suplente de deputado estadual no Amazonas\nna legenda do Partido Trabalhista Brasileiro (PTB). Exerceu o mandato\npor dois anos, deixando a Assembléia Legislativa amazonense para retomar\nas suas atividades no Lóide. Assumiu então****a gerência da empresa em\nManaus entre 1952 e 1956 e em Belém entre 1956 e 1963.\n\nEm outubro de 1954 elegeu-se suplente do senador pelo Amazonas Leopoldo\nTavares da Cunha Melo na legenda do PTB. Em fevereiro de 1962 assumiu o\nmandato, em virtude do falecimento do titular. No pleito de outubro do\nmesmo ano elegeu-se deputado federal pelo Amazonas na legenda do Partido\nLibertador (PL). Embora residisse há sete anos no Pará, foi o segundo\nmais votado no estado do Amazonas. Concluiu o mandato de senador em\njaneiro de 1963 e assumiu o de deputado federal no mês seguinte. Na\nCâmara, passou a integrar a bancada do Partido Democrata Cristão (PDC),\nlegenda pela qual seu irmão se elegeu governador do Amazonas, e integrou\nas comissões de Finanças, de Agricultura e de Valorização Econômica da\nAmazônia. Foi também suplente da Comissão de Orçamento. Com a extinção\ndos partidos políticos pelo Ato Institucional nº 2 (27/10/1965) e a\nconseqüente implantação do bipartidarismo, filiou-se ao Movimento\nDemocrático Brasileiro (MDB). Em novembro de 1966 concorreu novamente,\nna legenda do MDB, a uma cadeira de deputado federal pelo Amazonas,\nobtendo apenas uma suplência. Por ocasião do afastamento do deputado\nBernardo Cabral, assumiu uma cadeira na Câmara dos Deputados.\n\nPresidencialista e intervencionista, defendia, segundo o Correio\nBrasiliense, edição de maio****de 1965, a ampliação do monopólio estatal\naos transportes aéreos; a reforma bancária, com a instituição de um\nbanco central emissor, impondo-se à rede privada a função social do\ncrédito; e a reforma agrária cooperativista, com a desapropriação dos\nlatifúndios improdutivos mediante o prévio e justo pagamento de\nindenizações em dinheiro e assistência integral ao lavrador e o\nloteamento dos bens dominiais a serem doados aos lavradores que mais\nproduzissem. Defendia também a cédula única em todos os pleitos, como\nmeio para se eliminar a influência do poder estatal ou econômico nas\neleições, e, contrário ao sistema de maioria absoluta, era favorável à\ncoincidência dos mandatos sem prorrogação. Adepto da manutenção de\nrelações comerciais e diplomáticas com todos os povos, respeitados os\nprincípios da autodeterminação e da não-intervenção, era ainda\nmunicipalista e opunha-se a reformas na Constituição.\n\nFaleceu em Brasília no dia 30 de junho de 1968, vítima de acidente\nautomobilístico.\n\nEra casado com Olga Castanheiro Coelho, com quem teve cinco filhos.\n\n \n\nFONTES: CÂM. DEP. *Anais*;**CÂM. DEP. *Deputados*;**CAMPOS, Q.\n*Fichário*;**INF. FAM. PAULO RAMOS COELHO FILHO; ROQUE, C*. Grande*;\nSENADO*. Relação*; TRIB. SUP. ELEIT. *Dados*(3, 4, 6 e 8).\n\n \n\n \n","ref":"FONTES: CÂM. DEP. *Anais*;**CÂM. DEP. *Deputados*;**CAMPOS, Q.\n*Fichário*;**INF. FAM. PAULO RAMOS COELHO FILHO; ROQUE, C*. Grande*;\nSENADO*. Relação*; TRIB. SUP. ELEIT. *Dados*(3, 4, 6 e 8).\n\n \n\n \n","dic":"DHBB"}
