{"title":"ALMEIDA, Ludovico de","cargoss":["Governador de estado ou do Distrito Federal","Deputado federal"],"cargos_esp":[0,0],"datas_ini":[1955,1963],"datas_fim":[1959,1967],"estados":["GO","GO"],"autor":[0],"content":"**ALMEIDA, Ludovico de**\n\n\\*gov. GO 1955-1959; dep. fed. GO 1963-1967.\n\n* *\n\n*José Ludovico de Almeida* nasceu em Itaberaí (GO) no dia 6 de fevereiro\nde 1906, filho de Francisco Ludovico de Almeida e Eva Vieira de Almeida.\nEntre seus familiares, encontravam-se seu primo Mauro Borges, deputado\nfederal e governador de Goiás, e seu tio, Pedro Ludovico Teixeira, que\nfoi integrante da Aliança Liberal e participou da Revolução de 1930,\npassando, a partir de então, a exercer um domínio político no estado de\nGoiás que durou quase 40 anos: como interventor (1930-1935; 1937-1945),\ngovernador (1935-1937; 1951-1954), constituinte (1946) e senador\n(1946-1951; 1955-1969).\n\nFormou-se farmacêutico em 1925 pela Faculdade de Farmácia e Odontologia\nde Goiás e ingressou na vida política ao participar do governo de Pedro\nLudovico Teixeira, logo após a Revolução de 1930.\n\nEm 1933 foi eleito deputado estadual constituinte. Com a promulgação da\nConstituição, retornou aos trabalhos ordinários da Assembléia\nLegislativa até 1937, quando foi instaurado o Estado Novo.\n\nEm 1938 foi nomeado prefeito de Itaberaí, exercendo o cargo até 1940,\nquando tornou-se secretário de Fazenda de Goiás, função que desempenhou\naté 1945, ano em que ocorreu a redemocratização do país.\n\nNas eleições de janeiro de 1947 candidatou-se ao governo de Goiás na\nlegenda do Partido Social Democrático (PSD), mas foi derrotado por\nJerônimo Coimbra Bueno. Entre 1951 e 1954, voltou a ocupar o posto de\nsecretário de Fazenda de Goiás, sob a gestão de Pedro Ludovico.\n\nEm outubro de 1954 renovou sua candidatura e dessa vez foi eleito\ngovernador do estado na legenda do PSD. Exerceu seu mandato de 31 de\njaneiro de 1955 a 31 de janeiro de 1959, sucedendo a Bernardo Saião, que\ncompletava o mandato de Pedro Ludovico, e sendo substituído por José\nFeliciano Ferreira.\n\nEm outubro de 1960 concorreu pela terceira vez ao governo do estado,\ndessa vez na legenda da coligação do Partido Social Progressista (PSP)\ncom a União Democrática Nacional (UDN), mas foi derrotado por Mauro\nBorges, candidato do PSD.\n\nEm 7 de outubro de 1962 sua candidatura à Câmara dos Deputados foi\nlançada por uma coligação formada pelo PSP, a UDN e o Partido Democrata\nCristão (PDC). Eleito, iniciou seu mandato em 1º de fevereiro de 1963.\nCom a extinção dos partidos políticos pelo Ato Institucional nº 2\n(27/10/1965) e a posterior instauração do bipartidarismo, filiou-se à\nAliança Renovadora Nacional (Arena), partido de apoio ao regime militar\ninstaurado no país em abril de 1964. Encerrou seu mandato em 31 de\njaneiro de 1967.\n\nEm 1968 ocupou, mais uma vez, a Secretaria de Fazenda de Goiás, no\ngoverno de Otávio Laje Siqueira (1965-1971), da Arena, deixando o cargo\nao final do mandato do governador.\n\nFaleceu em Goiânia no dia 25 de agosto de 1989.\n\nEra casado com Iracema Caldas de Almeida, com quem teve um filho.\n\n \n\nFONTES: CÂM. DEP. *Anais*; CÂM. DEP. *Deputados brasileiros. Repertório*\n(1963-1967); *Grande encic. Delta*; *Legislativo em Goiás* (2);\nTEIXEIRA, P. *Memórias*; TRIB. SUP. ELEIT. *Dados* (6 e 7).\n\n \n","ref":"FONTES: CÂM. DEP. *Anais*; CÂM. DEP. *Deputados brasileiros. Repertório*\n(1963-1967); *Grande encic. Delta*; *Legislativo em Goiás* (2);\nTEIXEIRA, P. *Memórias*; TRIB. SUP. ELEIT. *Dados* (6 e 7).\n\n \n","dic":"DHBB"}
