{"title":"COIMBRA, Cesário","cargoss":["Deputado federal","Deputado federal","Deputado federal","Deputado federal"],"cargos_esp":[0,0,0,0],"datas_ini":[1966,1964,1962,1960],"datas_fim":[1967,1964,0,0],"estados":["MA","MA","MA","MA"],"autor":[0],"content":"**COIMBRA, Cesário**\n\n**\\***militar; dep. fed. MA 1960, 1962, 1964 e 1966-1967.\n\n*Cesário Guilherme Coimbra* nasceu no dia 25 de junho de 1908.\n\nFormou-se em medicina e ingressou no Exército como\nprimeiro-tenente-médico em janeiro de 1947. Foi promovido a\ncapitão-médico em março de 1952.\n\nNas eleições de outubro de 1954, elegeu-se à Assembléia Legislativa\nmaranhense na legenda do Partido Democrata Cristão (PDC), assumindo o\nmandato em fevereiro de 1955. A partir de julho de 1957 exerceu o cargo\nde secretário de Saúde e Assistência do Maranhão, no governo de José de\nMatos Carvalho (1957-1961). Em outubro de 1958, obteve a terceira\nsuplência de deputado federal pelo estado do Maranhão na****legenda do\nPartido Social Democrático (PSD). Assumiu uma cadeira na Câmara dos\nDeputados de agosto a outubro de 1960 e em junho e julho de 1962.\n\nNo pleito de outubro de 1962, alcançou a segunda suplência de deputado\nfederal, concorrendo dessa vez com o apoio das oposições coligadas, que\nincluíam o Partido Democrata Cristão (PDC), a União Democrática Nacional\n(UDN), o Partido Trabalhista Nacional (PTN) e o Partido Republicano\n(PR). Assumiu uma cadeira em março e abril de 1964, já pertencendo aos\nquadros do Partido Trabalhista Brasileiro (PTB). Com a extinção dos\npartidos políticos pelo Ato Institucional nº 2 (27/10/1965) e a\nposterior instauração do bipartidarismo, filiou-se ao grupo que no ano\nseguinte iria formar o Movimento Democrático Brasileiro (MDB). Ocupou\nnovamente uma cadeira na Câmara a partir de 1966, e, nas eleições de\nnovembro desse ano, ficou como quinto suplente de deputado federal pelo\nestado do Maranhão, na legenda do MDB.\n\nDeixou a Câmara em janeiro de 1967, não chegando a ocupar uma cadeira na\nlegislatura que se seguiu. Com a extinção do bipartidarismo em 29 de\nnovembro de 1979 e a conseqüente reformulação partidária, filiou-se ao\nnovo PTB, liderado por Ivete Vargas.\n\nNas eleições de novembro de 1982 candidatou-se ao governo do estado do\nMaranhão, na legenda do PTB, não conseguindo se eleger.\n\nFONTES: CÂM. DEP. *Deputados; Estado de* *S. Paulo*(10/8/82); MEIRELES,\nM. *História;*MIN. GUERRA. *Almanaque*(1956); TRIB. SUP. ELEIT.\n*Dados*(3, 4, 6 e 8).\n\n \n","ref":"FONTES: CÂM. DEP. *Deputados; Estado de* *S. Paulo*(10/8/82); MEIRELES,\nM. *História;*MIN. GUERRA. *Almanaque*(1956); TRIB. SUP. ELEIT.\n*Dados*(3, 4, 6 e 8).\n\n \n","dic":"DHBB"}
