{"title":"CONCEIÇÃO, José da ==================","cargoss":["Constituinte","Deputado federal"],"cargos_esp":[0,0],"datas_ini":[1987,1987],"datas_fim":[1988,1991],"estados":[0,"MG"],"autor":[0],"content":"CONCEIÇÃO, José da\n==================\n\n\\* const. 1987-1988; dep. fed. MG 1987-1991.\n\n \n\n*José da Conceição Santos* nasceu em Montes Claros (MG) no dia 8 de\ndezembro de 1943, filho dos comerciantes Pedro Martins de Sousa e Josefa\nMaria de Sousa.\n\nFez o curso secundário na Escola Estadual Professor Plínio Ribeiro, onde\niniciou sua militância como presidente do grêmio estudantil entre 1963 e\n1964. Membro da Juventude Estudantil Católica (JEC) de 1965 a 1966, foi\npresidente do Diretório dos Estudantes Secundaristas do Norte de Minas.\n\nEm novembro de 1966 iniciou sua carreira política ao eleger-se vereador\npelo Movimento Democrático Brasileiro (MDB), partido de oposição ao\nregime militar instaurado no país em abril de 1964. Assumindo a cadeira\nna Câmara Municipal em fevereiro de 1967, tornou-se membro titular da\nSociedade de São Vicente de Paulo e do Rotary Club de Montes Claros.\nReelegeu-se em novembro de 1970.\n\nEm 1971, graduou-se em direito pela Fundação de Ensino Superior do Norte\nde Minas (FUNM), localizada em sua cidade natal. Reeleito vereador em\nnovembro do ano seguinte, completou o mandato na Câmara Municipal em\njaneiro de 1977. Durante seus três mandatos, foi presidente da Comissão\nde Legislação e Justiça e Secretário da Câmara Municipal.\n\nCom a extinção do bipartidarismo em 29 de novembro de 1979 e a\nconseqüente reformulação partidária, filiou-se ao Partido do Movimento\nDemocrático Brasileiro (PMDB), agremiação que sucedeu ao MDB. Elegeu-se\ndeputado estadual em novembro de 1982. Na Assembléia Legislativa de\nMinas Gerais foi vice-líder do PMDB e dos governos Tancredo Neves\n(1983-1884) e Hélio Garcia (1984-1987). Presidiu ainda as Comissões de\nAssuntos da Superintendência de Desenvolvimento do Nordeste (Sudene) e\nde Estímulos Fiscais e foi membro da Comissão de Agropecuária.\n\nEm novembro de 1986, foi eleito deputado federal constituinte tendo como\nbase o norte de Minas. Tomou posse na Câmara dos Deputados em fevereiro\nseguinte e se licenciou para ser secretário dos Transportes no governo\nNewton Cardoso (1987-1991) de 15 de março a 4 de novembro de 1987.\nReassumiu o mandato a tempo de participar dos trabalhos de elaboração da\nAssembléia Nacional Constituinte, na qual foi suplente da Subcomissão\ndos Direitos Políticos, dos Direitos Coletivos e Garantias, da Comissão\nda Soberania e dos Direitos e Garantias do Homem e da Mulher.\n\nNas principais votações da Constituinte, foi a favor do rompimento de\nrelações diplomáticas com os países com política de discriminação\nracial, da limitação do direito de propriedade privada, do mandado de\nsegurança coletivo, da remuneração 50% superior para o trabalho extra,\nda jornada semanal de 40 horas, do turno ininterrupto de seis horas, do\naviso prévio proporcional, da soberania popular, do voto facultativo aos\n16 anos, do presidencialismo, da nacionalização do subsolo, do limite de\n12% ao ano para o juros reais, da proibição do comércio de sangue, do\nmandato de cinco anos para o presidente José Sarney, da limitação dos\nencargos da dívida externa, da criação de um fundo de apoio à reforma\nagrária, da anistia aos micro e pequenos empresários e da desapropriação\nda propriedade produtiva. Votou contra a pena de morte, a legalização do\naborto e do jogo do bicho e a estatização do sistema financeiro.\n\nPromulgada a Carta constitucional em 5 de outubro de 1988, passou a\nexercer apenas o mandato ordinário. Durante o restante da legislatura,\natuou como membro titular da Comissão de Trabalho e suplente da Comissão\nde Educação, Cultura, Esporte e Turismo.\n\nNão se candidatou à reeleição em outubro de 1990, deixando a Câmara ao\nfinal de seu mandato, em janeiro do ano seguinte. Ainda em 1991, foi\nnomeado diretor-administrativo da Distribuidora de Títulos e Valores de\nMinas Gerais (Diminas). Dois anos depois, foi incluído na lista tríplice\ndo Tribunal Regional do Trabalho de Minas Gerais (TRT/MG) da qual sairia\no juiz togado do órgão. À espera da escolha, José da Conceição\ndedicou-se à advocacia em Montes Claros.\n\nFoi também professor de direito administrativo e do trabalho da Fundação\nde Ensino Superior do Norte de Minas e consultor jurídico dos sindicatos\ndos Trabalhadores na Indústria do Açúcar e do Álcool, em Bocaiúva (MG),\ne Metalúrgicos, Comerciários e Construção Civil, em Montes Claros.\n\nCasou-se com Maria Enéas Mendes Miranda Santos, com quem teve cinco\nfilhos.\n\n* *\n\nFONTES: ASSEMB. LEGISL. MG. *Dicionário Biográfico*; ASSEMB. NAC. CONST.\n*Repertório*(1987-1988);**COELHO, J. & OLIVEIRA, A. *Nova*; INF. BIOG.\n","ref":"FONTES: ASSEMB. LEGISL. MG. *Dicionário Biográfico*; ASSEMB. NAC. CONST.\n*Repertório*(1987-1988);**COELHO, J. & OLIVEIRA, A. *Nova*; INF. BIOG.\n","dic":"DHBB"}
