{"title":"ALMEIDA, Mílton F.","cargoss":["Chefe do Estado-Maior do Exército","Embaixador do Brasil - Argentina"],"cargos_esp":[0,0],"datas_ini":[1946,1949],"datas_fim":[1948,1950],"estados":[0,0],"autor":[0],"content":"**ALMEIDA, Mílton F.******\n\n\\*militar; ch. EME 1946-1948; emb. Bras. Argentina 1949-1950.\n\n \n\n*Mílton de Freitas Almeida* nasceu em Porto Alegre no dia 3 de janeiro\nde 1888.\n\nSentou praça em março de 1904, tornando-se aspirante em fevereiro de\n1908. Em dezembro desse ano foi promovido a segundo-tenente, em novembro\nde 1915 a primeiro-tenente, em julho de 1920 a capitão, em junho de 1927\na major e em julho de 1929 a tenente-coronel.\n\nServindo no Rio Grande do Sul como comandante do 1º Regimento de\nCavalaria Independente, opôs-se à Revolução de 1930 e foi preso pelos\nrevolucionários. Promovido a coronel em agosto de 1933, em 1935 assumiu\no comando da Força Pública de São Paulo. Ascendeu à patente de\ngeneral-de-brigada em maio de 1939. Durante a Segunda Guerra Mundial,\nparticipou do Conselho Superior de Economia de Guerra de 1943 a 1945. Em\nabril deste ano, passou a general-de-divisão, assumindo no ano seguinte\no comando da 2ª Região Militar, sediada em São Paulo. Ainda em 1946, em\noutubro, foi nomeado chefe do Estado-Maior do Exército (EME), em\nsubstituição ao general Salvador Obino. Deixou o cargo em novembro de\n1948, sendo sucedido pelo general Álvaro Fiúza de Castro. Em seguida,\npassou a fazer parte do Conselho de Segurança Nacional. Entre 1947 e\ninício de 1949, foi presidente da Comissão de Promoções do Exército.\n\nEm janeiro de 1949, foi designado embaixador na Argentina, substituindo \nCiro de Freitas Vale. Permaneceu em Buenos Aires até novembro de 1950,\ncedendo o posto a João Batista Luzardo. Em dezembro desse ano, foi\npromovido a general-de-exército. Foi reformado em 1957 na patente de\nmarechal.\n\nBacharel em matemática e ciências físicas, fez os cursos de formação,\naperfeiçoamento, estado-maior, divisão de estado-maior e superior de\ninformações.\n\nFaleceu em 29 de novembro de 1962.\n\nEra casado com Marina Arcoverde de Freitas Almeida.\n\n \n\nFONTES: ALMEIDA, G. *Homens*; CORRESP. SECRET. GER. EXÉRC.; *Efemérides*\n*paulistas*; INST. HIST. GEOG. BRAS.; LAGO, L. *Generais*; MALVÁSIO, L.\n*História*; MIN. GUERRA. *Almanaque* (5); MIN. MAR.\n\n \n","ref":"FONTES: ALMEIDA, G. *Homens*; CORRESP. SECRET. GER. EXÉRC.; *Efemérides*\n*paulistas*; INST. HIST. GEOG. BRAS.; LAGO, L. *Generais*; MALVÁSIO, L.\n*História*; MIN. GUERRA. *Almanaque* (5); MIN. MAR.\n\n \n","dic":"DHBB"}
