{"title":"CORDEIRO, Aírton","cargoss":["Constituinte","Deputado federal"],"cargos_esp":[0,0],"datas_ini":[1987,1987],"datas_fim":[1988,1991],"estados":[0,"PR"],"autor":[0],"content":"**CORDEIRO, Aírton**\n\n\\*const. 1987-1988; dep. fed. PR 1987-1991.\n\n*Aírton Ravaglio Cordeiro* nasceu em Curitiba em 10 de agosto de 1942,\nfilho de Benjamim Pinto Cordeiro e Irene Ravaglio Cordeiro.\n\nFez sua formação escolar no Colégio Estadual do Paraná onde iniciou sua\natuação política concorrendo a presidente do Centro Estudantil na mesma\nchapa de Mussa José Assis, que posteriormente se tornaria uma importante\npersonalidade do jornalismo paranaense. Em 1959, foi indicado líder da\nbancada do Colégio Estadual no Congresso da União Paranaense de\nEstudantes (UPES).\n\nJornalista e advogado formado pela Universidade Federal do Paraná em\n1966. Nesse mesmo ano iniciou suas atividades profissionais em veículos\nde rádio do estado, trabalhando em várias emissoras tais como as rádios\nCuritibana, Colombo, Rádio Clube Paranaense B-2, Independência, dentre\noutras. Foi o primeiro radialista a ter o passe comprado quando a Rádio\nClube o contratou para fazer a cobertura da Copa do Mundo de 1974 na\nAlemanha, trabalho que efetuou ao lado, dentre outros, do então\ncomentarista esportivo Ibsen Pinheiro, num trabalho conjunto com a Rádio\nGaúcha. Na ocasião, foi o primeiro profissional de comunicação do Paraná\na transmitir e estar presente numa Copa do Mundo.\n\nEm novembro de 1976, elegeu-se vereador em Curitiba na legenda da\nAliança Renovadora Nacional (Arena), partido que apoiou o regime militar\ninstalado em abril de 1964. Empossado em fevereiro de 1977, no ano\nseguinte foi líder do partido na Câmara e do governo e presidente da\nComissão Especial de Revisão e Redação da Lei Orgânica.\n\nDeputado estadual eleito em novembro de 1978, tomou posse em fevereiro\nde 1979 e renunciou ao mandato de vereador. Com o fim do bipartidarismo\nem 29 de novembro daquele ano, filiou-se ao Partido Democrático Social\n(PDS), atuando no colégio de líderes da bancada e do governo Nei Braga e\nna Comissão de Educação, como relator. Reeleito em novembro de 1982,\niniciou novo mandato em fevereiro de 1983. Presidiu a comissão\nparlamentar de inquérito (CPI) sobre a Universidade Estadual de Londrina\ne foi o relator do Plano de Classificação de Cargos dos Servidores\nPúblicos do Paraná. Em 1985, entrou para o Partido Democrático\nTrabalhista (PDT), vinculando-se a Jaime Lerner, ex-prefeito de\nCuritiba.\n\nNas eleições de novembro de 1986, foi o único deputado federal\nconstituinte eleito pelo PDT no Paraná. Empossado em 1º de fevereiro de\n1987, quando tiveram início os trabalhos da Assembléia Nacional\nConstituinte, integrou a Subcomissão do Sistema Eleitoral e Partidos\nPolíticos, da Comissão da Organização Eleitoral, Partidária e Garantia\ndas Instituições, e foi suplente da Subcomissão dos Direitos e Garantias\nIndividuais, da Comissão da Soberania e dos Direitos Individuais do\nHomem e da Mulher. Foram de sua autoria a lei que assegurou o sigilo da\nfonte no exercício profissional, a que proibiu o uso de dinheiro público\npara a promoção pessoal dos governantes nos meios de comunicação e a que\nisentava os brasileiros com mais de 65 anos do pagamento do imposto de\nrenda.\n\nNa Constituinte, votou contra a pena de morte, a limitação do direito da\npropriedade privada, a remuneração 50% superior para o trabalho extra, a\njornada semanal de 40 horas, o mandato de cinco anos para o presidente\nJosé Sarney, a limitação dos encargos da dívida externa e a\ndesapropriação da propriedade produtiva. Absteve-se nas votações do\nturno ininterrupto de seis horas e do limite de 12% ao ano para juros\nreais. Votou a favor do rompimento de relações diplomáticas com países\ncom política de discriminação racial, do mandato de segurança coletivo,\nda proteção ao trabalho contra demissão sem justa causa, do aviso prévio\nproporcional, do presidencialismo, da nacionalização do subsolo, da\nanistia aos micro e pequenos empresários.\n\nCom a promulgação da nova Carta em 5 de outubro de 1988, passou a\nexercer apenas o mandato ordinário. Tornou-se vice-presidente e depois\npresidente da Comissão de Economia, Indústria e Comércio e\nvice-presidente da comissão que elaborou o Estatuto da Criança e do\nAdolescente. Durante o mandato, trocou o PDT pelo Partido da Frente\nLiberal (PFL).\n\nRetirou-se da Câmara dos Deputados em janeiro de 1991, no fim da\nlegislatura, para tornar-se diretor-presidente da CCI — Consultoria e\nComunicação, empresa de sua propriedade. Nesse mesmo ano retornou aos\nmeios de comunicação e nos anos seguintes exerceu a profissão de\nradialista e comentarista esportivo na rádio Transamérica em Curitiba,\npermanecendo intensamente envolvido com futebol e mantendo uma coluna\nregular abordando assuntos esportivos e futebolísticos no jornal *Gazeta\ndo Povo*, sediado em Curitiba.\n\n \n\nFONTES: ASSEMB. NAC. CONST. *Repertório*(1987); COELHO, J. & OLIVEIRA,\nA. *Nova*; INF. BIOG.\n","ref":"FONTES: ASSEMB. NAC. CONST. *Repertório*(1987); COELHO, J. & OLIVEIRA,\nA. *Nova*; INF. BIOG.\n","dic":"DHBB"}
