{"title":"CORREIA, Maurício","cargoss":["Constituinte","Senador","Ministro da Justiça","Ministro do Supremo Tribunal Federal"],"cargos_esp":[0,0,0,0],"datas_ini":[1987,1987,1992,1994],"datas_fim":[1988,1990,1994,0],"estados":[0,"DF",0,0],"autor":[0],"content":"**CORREIA, Maurício**\n\n\\* const. 1987-1988; sen. DF 1987-1990; min. Just. 1992-1994; min. STF\n1994-\n\n \n\n                *José Maurício Correia* nasceu em São João do Manhuaçu\n(MG) no dia 9 de maio de 1934, filho de Artur Aarão Corrêa e de Maria\nGarcia Corrêa.\n\n                Filho de família pobre, foi engraxate e vendeu queijo na\nestação de trem da sua cidade. Bacharelou-se pela Faculdade de Direito\nda Universidade de Minas Gerais em 1960 e nesse mesmo ano radicou-se em\nBrasília. Ao longo da década, Maurício Corrêa fez fortuna como advogado\nde grandes empresas e em investimentos imobiliários.\n\n                Em 1976 tornou-se membro do Instituto dos Advogados do\nDistrito Federal e do estado de Goiás. Três anos depois tornou-se\npresidente da Ordem dos Advogados do Brasil (OAB) seção Distrito\nFederal, cargo que exerceria até 1986. Durante a sua gestão instituiu a\nFundação de Assistência Judiciária, vinculada à OAB, que prestou\nserviços de assistência judiciária aos carentes. Militou na resistência\ndemocrática, defendendo presos políticos e organizando movimentos pela\nanistia, tendo sido o presidente da primeira Comissão de Direitos\nHumanos da OAB, criada durante o governo do general Ernesto Geisel\n(1974-1979). Maurício Corrêa ganhou notoriedade quando impediu a invasão\nda sede da OAB pelo general Newton Cruz, executor das medidas de\nemergência no período de votação da emenda Dante de Oliveira (25/4/84)\nna capital.\n\n                Presidente do Partido Democrático Trabalhista (PDT) do\nDistrito Federal, candidatou-se a uma vaga no Senado em novembro de\n1986. Sua campanha,  baseada no prestígio que adquiriu como presidente\nda OAB regional, teria recebido a contribuição de 500 mil dólares da\nOrganização para a Libertação da Palestina (OLP). Senador mais votado no\nDistrito Federal e único parlamentar do PDT na capital da República, foi\nempossado em 1º de fevereiro de 1987, quando começaram os trabalhos da\nAssembléia Nacional Constituinte. Tornou-se primeiro-vice-presidente da\nComissão da Organização dos Poderes e do Sistema de Governo e suplente\nda Subcomissão da União, Distrito Federal e Territórios da Comissão da\nOrganização do Estado na Constituinte.\n\n                Nas principais votações, pronunciou-se a favor do\nrompimento de relações diplomáticas com países com política de\ndiscriminação racial, do mandado de segurança coletivo, do aborto, da\nremuneração 50% superior para o trabalho extra, da jornada semanal de 40\nhoras, do turno ininterrupto de seis horas, do aviso prévio\nproporcional, da unicidade sindical, da soberania popular, do voto aos\n16 anos, do presidencialismo, da nacionalização do subsolo, da\nestatização do sistema financeiro, do limite de 12% ao ano para os juros\nreais, da proibição do comércio de sangue, da limitação dos encargos da\ndívida externa, da criação de um fundo de apoio à reforma agrária, da\nanistia aos micro e pequenos empresários e da desapropriação da\npropriedade produtiva. Votou contra o mandato de cinco anos para\npresidente José Sarney e a legalização do jogo do bicho.\n\n                No Senado Federal foi membro das comissões do Distrito\nFederal, de Constituição, Justiça e Cidadania, de Assuntos Econômicos,\nde Fiscalização e Controle e dos Serviços de Infra-Estrutura. Nessa\nlegislatura assumiu a liderança do PDT no Senado e participou da\ncomissão parlamentar de inquérito (CPI) da Corrupção do governo de José\nSarney da qual Itamar Franco, futuro presidente da República, foi\nvice-presidente.\n\n                Em outubro de 1990 disputou o governo do Distrito\nFederal. Derrotado por Joaquim Roriz (1991-1995), do Partido\nProgressista (PP), integrou a Mesa do Senado Federal e foi\nvice-presidente da comissão parlamentar de inquérito (CPI), denominada\n“Collorgate”, que investigou as atividades de Paulo César Farias,\nex-tesoureiro da campanha do presidente da República Fernando Collor de\nMelo. Collor foi acusado de crime de responsabilidade por ligações com\num esquema de corrupção liderado pelo seu ex-tesoureiro. Afastado da\npresidência logo após a votação na Câmara, renunciou ao mandato em 29 de\ndezembro de 1992, pouco antes da conclusão do processo pelo Senado\nFederal, sendo efetivado no Executivo federal o vice Itamar Franco, que\njá vinha exercendo o cargo interinamente desde 2 de outubro. Na votação\nrealizada no Senado no dia 29 de dezembro, Maurício Correia se\npronunciou a favor do *impeachment*.\n\n                Nomeado ministro da Justiça do governo do presidente da\nRepública Itamar Franco, seu amigo, licenciou-se do mandato de senador\npara assumir a pasta em outubro de 1992, afirmando ser a favor da\nlegalização do jogo do bicho e do aborto. Sua vaga no Senado foi ocupada\npelo primeiro suplente Pedro Teixeira. Em dezembro, abriu processo\nadministrativo contra quatro entidades representativas de laboratórios\nfarmacêuticos, para apurar a conduta dos sindicatos e das associações\nque levara a aumentos abusivos de preços, com reajustes médios de 3.770%\nentre outubro de 1991 e novembro de 1992.\n\n                No início de 1993, Maurício Corrêa tornou-se o novo\narticulador do governo Itamar Franco, assumindo o papel de mediador\nentre o presidente da República, o Congresso, empresários e demais\nsetores da sociedade civil organizada. Em maio anunciou sua saída do\nPDT, após constantes atritos com o presidente do partido, Leonel\nBrizola, afirmando não poder endossar a posição do partido contra as\nmedidas privatizantes do governo Itamar Franco.\n\n                Em janeiro de 1993, um advogado de Brasília protocolou\numa denúncia contra Maurício Corrêa por sonegação de imposto de renda. O\npresidente Itamar Franco determinou que a Receita Federal fizesse uma\nchecagem nas acusações. Descobriu-se que ele não tinha declarado entre\nseus bens a mansão onde morava, avaliada em 2 milhões de dólares, e que\nentre 1990 e 1991 seu patrimônio pessoal havia aumentado, mas não pagara\nimposto sobre isso. Um mês e meio após a denúncia, Maurício Corrêa pagou\numa pesada multa e recebeu um certificado de “nada consta” da Receita\nFederal. Meses depois, foi acusado de ter intercedido por três grandes\natacadistas de Brasília, presos pela Polícia Federal (PF) por sonegação\nde impostos. Foi a primeira das várias crises que Maurício Corrêa\nenfrentou durante a sua gestão.\n\n                Ainda em 1993, às voltas com uma greve na Polícia\nFederal (PF) e convocado pelo Congresso para explicar a fuga do país de\nPaulo César Farias, Maurício Corrêa acabou demitindo o diretor Amauri\nGaldino e o secretário nacional da PF, João Campelo. Como não encontrou\numa solução interna para a crise na PF, o presidente Itamar foi obrigado\na interferir, indicando um militar, o coronel reformado do Exército\nWilson Romão, para a direção do órgão, causando um desgaste muito grande\nno ministério.\n\n                Em julho de 1993, o jornal *Folha de São Paulo* acusou\nMaurício Corrêa de driblar a lei para não pagar impostos, afirmando que\nele teria utilizado artifícios da legislação tributária para fugir ao\nrecolhimento de impostos de transmissão e de lucro imobiliário sobre seu\npatrimônio, entre 1983 e 1985. No final desse mesmo ano, o escritório de\nadvocacia do qual Maurício Corrêa foi sócio até 1986 assinou contrato\ncom o fazendeiro gaúcho Bolívar Anoni, mediante o qual  receberia 13\nmilhões de dólares caso conseguisse obrigar o governo federal a\npagar-lhe 260 milhões de dólares pela desapropriação de uma fazenda em\n1972. O contrato acabou desfeito a pedido do presidente Itamar Franco,\nque temia que seu amigo fosse acusado de fazer tráfico de influência.\n\n                Em janeiro de 1994, em uma entrevista a uma rede de\ntelevisão, Maurício Corrêa declarou que presidente Itamar fora\nestimulado a dar um golpe de Estado por parte de oficiais da reserva, no\nestilo Alberto Fujimori no Peru, entre os meses de outubro e novembro do\nano anterior. Tal fato resultou na convocação de Maurício Corrêa para se\nexplicar no Congresso, criando um grande constrangimento por parte do\ngoverno e novo desgaste ao ministro.\n\n                Com a imagem já bastante arranhada, Maurício Corrêa\ntambém ganhou reputação negativa no carnaval de 1994, quando se\ncomportou como se tivesse bebido em excesso. Deixou a pasta da Justiça\nem março desse mesmo ano, sendo substituído por Alexandre Dupeyrat,\nretornando ao Senado.\n\n                Em outubro de 1994, o presidente Itamar Franco indicou-o\npara ministro do Superior Tribunal Federal (STF) em substituição a Paulo\nBrossard, que se aposentara ao completar 70 anos. O Senado Federal\naprovou seu nome, embora com críticas por parte de juízes. Assumiu o\nmandato no STF em 15 de dezembro desse mesmo ano. Sua vaga no\nLegislativo foi mais uma vez ocupada por Pedro Teixeira, que exerceu o\nmandato até o final da legislatura, em janeiro de 1995.\n\n                Maurício Correia casou-se com Alda Gontijo Correia, com\nquem teve três filhos.\n\n \n\n*Márcia Quarti*\n\n \n\nFONTES: INF. BIOG.; SENADO.*Dados biográficos*(1991);  *Veja* (21/7/93).\n\n \n\n \n\n               \n","ref":"FONTES: INF. BIOG.; SENADO.*Dados biográficos*(1991);  *Veja* (21/7/93).\n\n \n\n \n\n               \n","dic":"DHBB"}
