{"title":"ALMEIDA, Osvaldo","cargoss":["Constituinte","Deputado federal"],"cargos_esp":[0,0],"datas_ini":[1987,1987],"datas_fim":[1988,1991],"estados":[0,"RJ"],"autor":[0],"content":"**ALMEIDA, Osvaldo**\n\n\\*militar; const. 1987-1988; dep. fed. RJ 1987-1991.\n\n \n\n*Osvaldo Barreto de Almeida* nasceu em Campos (RJ), no dia 22 de outubro\nde 1933, filho de Manuel de Almeida Ferreira e de Francisca Barreto de\nAlmeida.\n\nIniciou a carreira militar em 1953, ingressando na Academia Militar das\nAgulhas Negras (AMAN), em Resende (RJ). Segundo-tenente em 1956, serviu\nna cidade de Alegrete (RS) até o ano de 1957. Promovido a\nprimeiro-tenente em 1958, cursou a Escola de Educação Física do\nExército, no Rio de Janeiro. Entre 1959 e 1961, foi transferido para a\n17ª Cavalaria, em Pirassununga (SP). De volta ao Rio de Janeiro, em\n1962, e designado para o 1º Batalhão de Carros de Combate, no ano\nseguinte foi promovido a capitão e transferido para a cidade natal, só\nretornando ao Rio de Janeiro em 1964, para servir no 1º Regimento de\nCavalaria da Guarda. Em 1966 passou a integrar a Comissão de Desportos\ndo Exército.\n\nRetornou a Campos em 1969, sendo promovido a major em 1971. Professor de\nestudos de problemas brasileiros na Faculdade de Filosofia de Campos de\n1972 a 1973, saiu do Exército em 1974.\n\nEntre 1974 e 1978 fundou e presidiu a Cooperativa de Crédito dos\nLavradores de Cana-de-Açúcar do Estado do Rio, a Associação Fluminense\ndos Plantadores de Cana e a Cooperativa Mista dos Plantadores de Cana do\nEstado do Rio de Janeiro.\n\nConhecido como major Almeida, no pleito de novembro de 1986 elegeu-se\ndeputado federal constituinte na legenda do Partido Liberal (PL), sendo\no segundo mais votado do partido graças ao apoio dos agricultores e\nplantadores de cana-de-açúcar do Norte Fluminense, especialmente de\nCampos e São João da Barra.\n\nTitular da Subcomissão de Saúde, Seguridade e Meio Ambiente, da Comissão\nda Ordem Social, e integrante do chamado Centrão, bloco parlamentar de\ntendência conservadora, votou a favor da nacionalização do subsolo, do\nmandado de segurança coletivo, da pluralidade sindical e da legalização\ndo jogo do bicho. E contra a pena de morte, a legalização do aborto, a\nlimitação do direito de propriedade, a estatização do sistema\nfinanceiro, a limitação dos encargos da dívida externa, o voto\nfacultativo aos 16 anos, o presidencialismo, a jornada semanal de 40\nhoras, o turno ininterrupto de seis horas, a estabilidade no emprego, o\naviso prévio proporcional, a criação de um fundo de apoio à reforma\nagrária, a desapropriação da propriedade produtiva e a anistia aos micro\ne pequenos empresários. Embora tenha assinado a emenda que previa um\nmandato de cinco anos para o então presidente José Sarney, absteve-se de\nvotá-la no plenário.\n\nSem disputar a reeleição, retirou-se da Câmara dos Deputados ao término\nda legislatura, em janeiro de 1991, dedicando-se às atividades de\nempresário rural.\n\nOsvaldo Almeida graduou-se pela Faculdade de Ciências Econômicas da\nUniversidade Cândido Mendes e fez pós-graduação em economia na Fundação\nGetulio Vargas (FGV), no Rio de Janeiro. Participou da Fundação\nNorte-Fluminense de Desenvolvimento Regional e foi fundador e presidente\nda Cooperativa Central dos Fornecedores de Cana do Brasil.\n\nCasado com Maria José Ribeiro Gomes de Almeida, teve cinco filhos.\n\n \n\nFONTES: ASSEMB. NAC. CONST. *Repertório* (1987); BELIDO, V.\n*Política;*COELHO, J. & OLIVEIRA, A.*Nova*; ENTREV. BIOG.; *Globo*\n(17/2/87); *Jornal do Brasil* (7/2/88).\n\n \n\n \n","ref":"FONTES: ASSEMB. NAC. CONST. *Repertório* (1987); BELIDO, V.\n*Política;*COELHO, J. & OLIVEIRA, A.*Nova*; ENTREV. BIOG.; *Globo*\n(17/2/87); *Jornal do Brasil* (7/2/88).\n\n \n\n \n","dic":"DHBB"}
