{"title":"CORREIA, Pedro","cargoss":["Deputado federal","Deputado federal"],"cargos_esp":["PE 1979 -1987,","PE 1979 -1987,"],"datas_ini":[1999,1991],"datas_fim":[2006,1999],"estados":[0,0],"content":"**CORREIA, Pedro**\n\n\\*dep. fed. PE 1979 -1987, 1991-1999, 1999-2006.\n\n* *\n\n*Pedro da Silva Correia de Oliveira Andrade Neto* nasceu no Rio de\nJaneiro, então Distrito Federal, no dia 7 de janeiro de 1948, filho de\nFábio Correia de Oliveira Andrade e Clarice Roma de Oliveira Andrade.\n\nPresidente do grêmio estudantil do Colégio Salesiano de Recife em 1963,\nnesse mesmo ano foi diretor de Intecâmbio e Coordenação da Associação\nRecifense dos Estudantes Secundaristas (ARES). Ainda em 1963, tornou-se\nassessor parlamentar da Assembléia Legislativa de Pernambuco e assessor\nda União Parlamentar Interestadual (UPI), cargos que iria exercer nos\npróximos dois anos. Ingressou no curso de medicina da Universidade\nFederal de Pernambuco (Ufpe), em 1966, concluindo-o cinco anos mais\ntarde.\n\nEm 1977 foi eleito presidente do Clube Internacional do Recife, cargo\nque ocuparia até 1979 e voltaria a exercer entre 1989 e 1991. Nas\neleições de novembro de 1978, elegeu-se deputado federal pela Aliança\nRenovadora Nacional (Arena), partido de sustentação do regime militar\ninstaurado no país em abril de 1964, assumindo seu mandato em fevereiro\nde 1979. Entre 1979 e 1980 foi membro da Comissão de Saúde, passando, em\n1981, à vice-presidência, cargo que ocupou até 1983. Em 1980, foi\nobservador parlamentar na Feira Internacional de Hannover (Alemanha) e\nna Feira Mundial da Madeira, em Paris.\n\nCom a extinção do bipartidarismo em novembro de 1979 e a conseqüente\nreformulação partidária, candidatou-se novamente a deputado federal nas\neleições de novembro de 1982, dessa vez pelo Partido Democrático Social\n(PDS), agremiação que sucedeu a Arena em seu apoio ao regime militar.\nReeleito, assumiu seu segundo mandato em fevereiro de 1983. No mesmo\nano, tornou-se coordenador do PDS, cargo que exerceria até 1987. No\nprimeiro ano desta legislatura foi membro do Diretório Nacional do PDS e\nda Comissão do Interior, exercendo estes dois cargos no biênio seguinte.\nAinda em 1983, foi membro da delegação parlamentar do Congresso Nacional\nque esteve na República Federal da Alemanha, a convite do governo\nalemão, e na URSS, a convite do Soviete Supremo. No ano seguinte,\nintegrou a delegação parlamentar que viajou à República Popular da\nChina, a convite do Partido Comunista daquele país.\n\nEm 25 de abril de 1984, esteve ausente da votação da emenda Dante de\nOliveira, que, apresentada na Câmara dos Deputados, propôs o\nrestabelecimento das eleições diretas para presidente da República em\nnovembro daquele ano. Como a emenda não obteve o número de votos\nindispensáveis à sua aprovação — faltaram 22 para que o projeto pudesse\nser encaminhado à apreciação pelo Senado Federal —, no Colégio\nEleitoral, reunido em 15 de janeiro de 1985, Pedro Correia votou no\ncandidato do regime militar, Paulo Maluf, que acabou sendo derrotado\npelo oposicionista Tancredo Neves, eleito novo presidente da República\npela Aliança Democrática, uma união do Partido do Movimento Democrático\nBrasileiro (PMDB) com a dissidência do PDS abrigada na Frente Liberal.\nTancredo Neves, porém, não chegou a ser empossado na presidência, vindo\na falecer em 21 de abril de 1985. Seu substituto no cargo foi o vice\nJosé Sarney, que já vinha exercendo interinamente o cargo desde 15 de\nmarço deste ano. Ainda nesta legislatura, entre 1984 e 1985, foi\nsecretário-geral do Grupo Interparlamentar Brasil-Austrália. Em 1985,\nfoi vice-líder do PDS na Câmara.\n\nNo pleito de outubro de 1986, Pedro Correia candidatou-se a deputado\nfederal constituinte, na legenda do Partido da Frente Liberal (PFL),\nobtendo apenas uma suplência. Deixou a Câmara em janeiro seguinte, ao\nfinal da legislatura. Entre 1987 e 1991, ocupou o cargo de diretor\nfinanceiro do Instituto do Açúcar e do Álcool (IAA). Ainda em 1987, foi\nsecretário-geral da Comissão Executiva Regional do PFL em Pernambuco,\nmantendo-se nesta atribuição até 1989. No ano seguinte, tornou-se\nvice-presidente da referida comissão.\n\nNas eleições de outubro de 1990, elegeu-se deputado federal pelo PFL,\nassumindo seu terceiro mandato em fevereiro do ano seguinte. Iniciou as\natividades parlamentares como membro titular da Comissão de Seguridade\nSocial e Família da Câmara, nela permanecendo até 1994. Em 1992, foi o\nrelator da Comissão Parlamentar de Inquérito CPI que investigou as\nirregularidade cometidas no processo de privatização da VASP e membro\ntitular da CPI Mista sobre a esterilização de mulheres no Brasil.\n\nNa sessão da Câmara dos Deputados de 29 de setembro de 1992, votou a\nfavor da abertura do processo de *impeachment* do presidente da\nRepública, Fernando Collor de Melo, acusado de crime de responsabilidade\npor manter ligações como um esquema de corrupção liderado pelo\nex-tesoureiro de sua campanha presidencial, Paulo César Farias. Afastado\nda presidência logo após a votação na Câmara, Fernando Collor renunciou\nao mandato pouco antes da conclusão do processo pelo Senado Federal,\nsendo efetivado na presidência da República o vice Itamar Franco, que já\nvinha exercendo o cargo interinamente desde 2 de outubro.\n\nMembro da delegação brasileira à XLIX Assembléia Geral das Nações\nUnidas, em Nova Iorque, em 1994, ainda nesta legislatura Pedro Correia\nvotou a favor da criação do Imposto Provisório sobre Movimentação\nFinanceira (IPMF), taxação de 0,25% sobre transações bancárias criada\ncomo fonte complementar de recursos para a área da saúde. Também foi\nfavorável à criação do Fundo Social de Emergência (FSE), que após ter\nsido aprovado permitiu que o governo realocasse 20% dos impostos das\nverbas de áreas como saúde e educação. Foi contrário ao projeto que\npropunha o fim do voto obrigatório.\n\nNas eleições de outubro de 1994, Pedro Correia recebeu o apoio de sua\nbase eleitoral, localizada na região metropolitana de Recife, no sertão\ndo Araripe e no sul da Zona da Mata, para se reeleger deputado federal.\nAssumiu seu quarto mandato em fevereiro de 1995. Nessa legislatura,\nparticipou da Comissão de Fiscalização Financeira e Controle da Câmara\ndos Deputados.\n\nNas votações das emendas constitucionais propostas pelo governo Fernando\nHenrique Cardoso, alinhou-se à base governista e votou a favor das\npropostas sobre a quebra do monopólio estatal das telecomunicações, a\nquebra do monopólio da Petrobras na exploração de petróleo, o fim do\nmonopólio dos governos estaduais na distribuição de gás canalizado, a\nabertura da navegação de cabotagem às embarcações estrangeiras e a\nmudança no conceito de empresa nacional, que eliminaria seus\nprivilégios, colocando-a em igualdade de condições com as empresas\nestrangeiras.\n\nEm dezembro de 1995, Pedro Correia deixou o PFL para integrar-se à\nlegenda do Partido Progressista Brasileiro (PPB). Por este partido\ndisputou a prefeitura de Recife, em outubro de 1996, não sendo\nbem-sucedido. A eleição foi vencida pelo candidato do PFL, Roberto\nMagalhães, ainda no primeiro turno.\n\nEm janeiro/fevereiro de 1997, nas sessões que votaram a emenda\nconstitucional que permitiu a reeleição para presidente da República,\ngovernadores e prefeitos, Pedro Correia optou pela abstenção no momento\ndo seu voto.\n\nDurante as votações da reforma da previdência e da administração\npública, o deputado pernambucano manteve o posicionamento favorável às\npropostas encaminhadas pelo Executivo federal. Votou a favor da criação\ndo teto de 1.200 reais para as aposentadorias do setor público, da\nexigência de idade mínima e tempo de contribuição para aposentadoria no\nsetor privado e da quebra da estabilidade dos servidores da União,\nestados e municípios.\n\nNas eleições de outubro de 1998, candidatou-se novamente a deputado\nfederal pela legenda do PPB, obtendo apenas a segunda suplência. Deixou\na Câmara dos Deputados em janeiro de 1999, ao final da legislatura.\nEntretanto, com a saída do deputado Carlos Eduardo Cadorca (PMDB-PE),\nque assumiu a Secretaria de Indústria, Comércio e Turismo, no governo de\nJarbas Vasconcelos, regressou à Câmara em fevereiro seguinte.\n\nReelegeu-se em 2002, ainda pela legenda do PPB. Ao iniciar-se a nova\nlegislatura, em 2003, transferiu-se para o Partido Progressista (PP),\nsigla que substituiu a do PPB.\n\nPedro Correia teve o seu mandato cassado em 2006 devido ao seu\nenvolvimento no escândalo do “mensalão”, grave crise política aberta por\ndenúncias do deputado Roberto Jefferson (PTB) de que haveria um esquema\nde compra de votos de parlamentares da base aliada do governo, pelo PT,\ne que seria capitaneado pelo então ministro da Casa Civil, José Dirceu.\nCorreia foi acusado de ter recebido dinheiro do publicitário Marcos\nValério de Souza, um dos proprietários da agência de comunicação DNA,\noperadora do “mensalão”.\n\nCasou-se com Maria Adélia Lemos Correia de Oliveira, com quem teve três\nfilhos.\n\nPublicou *Pneumopelvigrafia em ginecologia* (1974), *Radiol**ogia dos\ntumores da laringe*(1977), *Atuação parlamentar* (1979),\n*Pronunciamentos e projetos de lei* (1980), *Pernambuco no Congresso\nNacional* (1981), *Em defesa do Nordeste*(1983), *Sudene: a coordenação\ndo esforço de desenvolvimento do Nordeste* (1983), *Democra**cia\nsocial*(1984) e *Momento político*(1985).\n\nJuliana Sousa/Cláudia Montalvão\n\n \n\n**FONTES**: Agência Brasil. Disponível em :\n\\<[http://www.agenciabrasil.gov.br](http://www.agenciabrasil.gov.br/)\\>.\nAcesso em: 10 nov. 2009; *Boletim DIAP,*VIII (98); CÂM. DEP. *Deputados\nbrasileiros.*Repertórios (1979-1983, 1991-1995, 1995-1999); *Folha de S.\nPaulo* (18/9/94, 31/1/95, 14/1/96, 29/9/98); *Globo* (26/4/84, 16/1/85,\n29/1/97, 10/10/98); *IstoÉ*(14/10/92); Portal Direito2. Disponível em :\n\\<[http://www.direito2.com.br](http://www.direito2.com.br/)\\>. Acesso em\n: 10 nov. 2009; Portal do PP. Disponível em :\n\\<[http://www.pp.org.br](http://www.pp.org.br/)\\>. Acesso em : 10 nov.\n2009; TRIB. REG. ELEIT. PE. *Dados*(1998).\n","ref":"","dic":"DHBB"}
