{"title":"COSAC, Rubens","cargoss":["Deputado federal"],"cargos_esp":[0],"datas_ini":[1995],"datas_fim":[1999],"estados":[0],"autor":[0],"content":"**COSAC, Rubens**\n\n\\*dep. fed. 1995-1999.\n\n* *\n\n*Rubens Cosac* nasceu em Ipameri (GO) no dia 4 de março de 1946, filho\nde Munir Cosac e de Laura Edreira Cosac.\n\nFormou-se em medicina pela Escola de Medicina e Cirurgia de Uberlândia\n(MG) em 1974 e durante a graduação (1971-1972) foi presidente do Centro\nAcadêmico. Nesse mesmo ano ingressou na pós-graduação em pediatria no\nHospital do Servidor Público (SP), onde ficou por dois anos. No ano\nseguinte ingressou na pós-graduação em clínica médica no Hospital das\nForças Armadas (DF) e fez também pós-graduação em dermatologia no\nHospital de Base de Brasília. Entre os anos de 1981 e 1982 foi\npresidente da Associação Médica de Ipameri – GO e diretor-clínico do\nHospital São Paulo em Ipameri no biênio 1982-1983.\n\nIniciou sua carreira política em 1983, filiando-se ao Partido do\nMovimento Democrático Brasileiro (PMDB). Presidente do PMDB de Ipameri,\ntornou-se em 1985 superintendente regional da Legião Brasileira de\nAssistência (LBA) em Goiânia. Permaneceu em Goiânia até o ano seguinte,\nquando também deixou a presidência do PMDB de sua cidade.\n\nNas eleições de novembro de 1986 elegeu-se deputado estadual\nconstituinte, tendo como redutos eleitorais a região sudeste de Goiás e\na zona da estrada de ferro. Assumiu o mandato no início do ano seguinte\ne, neste mesmo ano, tornou-se presidente da Comissão de Saúde Pública e\nBem-Estar Social e vice-líder do PMDB, onde permaneceu até o ano\nseguinte. Foi vice-presidente da comissão parlamentar de inquérito (CPI)\nque investigou o caso do césio 137 — o mais grave acidente radioativo do\npaís causado pelo rompimento de uma cápsula dessa substância num\nferrro-velho em Goiânia, no mês de setembro de 1987 —, que levou à morte\nde quatro pessoas, atingiu mais de cem outras e obrigou o acompanhamento\nmédico, por toda a vida, de algumas centenas delas. Cosac integrou\ntambém a CPI que investigou o endividamento do estado de Goiás. Em 1989\niniciou o biênio como primeiro-secretário da mesa da Assembléia\nLegislativa de Goiás. Nas eleições de outubro de 1990 reelegeu-se\ndeputado estadual, reassumindo suas funções no início do ano seguinte,\nquando se tornou presidente da mesa da Assembléia.\n\nEm 1991 foi representante do presidente da ALGO junto a BIRD nos EUA e\nmembro da missão do Césio Radioativo na Itália. Em 1992 foi chefe da\ndelegação parlamentar da Assembléia Legislativa de Goiás à Conferência\ndas Nações Unidas para o Meio Ambiente e o Desenvolvimento (CNUMAD),\nrealizada entre\n[3](http://pt.wikipedia.org/wiki/3_de_junho \"3 de junho\") e [14 de\njunho](http://pt.wikipedia.org/wiki/14_de_junho \"14 de junho\") de\n[1992](http://pt.wikipedia.org/wiki/1992 \"1992\") no [Rio de\nJaneiro](http://pt.wikipedia.org/wiki/Rio_de_Janeiro \"Rio de Janeiro\").\n\nNo pleito de outubro de 1994 foi eleito deputado federal, tendo assumido\no mandato em fevereiro do ano seguinte. Dentre as principais emendas\nconstitucionais propostas pelo governo do presidente Fernando Henrique\nCardoso, votou a favor da quebra do monopólio dos estados na\ndistribuição de gás natural, da quebra do monopólio das embarcações\nnacionais na navegação de cabotagem, da mudança no conceito de empresa\nnacional, da quebra do monopólio estatal das telecomunicações e da\nquebra do monopólio da Petrobras na exploração de petróleo.\n\nEm junho de 1996 votou a favor da Contribuição Provisória sobre\nMovimentação Financeira (CPMF), tributo de 0,2% sobre transações\nbancárias criado como fonte complementar de recursos para a saúde, em\nsubstituição ao Imposto Provisório sobre Movimentação Financeira (IPMF).\n\nVotou a favor da emenda da reeleição para presidente da República,\ngovernadores e prefeitos em janeiro/fevereiro de 1997. Em novembro do\nmesmo ano, manifestou-se a favor da quebra da estabilidade do servidor\npúblico, item da reforma administrativa.\n\nEm novembro de 1998 votou a favor do teto de 1.200 reais para\naposentadorias no setor público e do estabelecimento de idade mínima e\ntempo de contribuição para o setor privado, itens que definiram a\nreforma da previdência.\n\nFoi representante da Câmara dos Deputados na viagem à República\nDemocrática da Coréia em 1996, na International Conference on the Safe\nand Resposible Use Chrysotyle, em 1997 no Canadá e na III Conferência\nInternacional dos Parlamentares de Origem Libanesa, em 1998 no Líbano.\n\nDeixou a Câmara dos Deputados em janeiro de 1999, ao fim da legislatura,\nsem ter concorrido à reeleição em outubro do ano anterior. Aposentou-se,\nem seguida, por motivo de doença.\n\nCasou-se com a libanesa Lamis Cheadraoui Cosac, com quem teve três\nfilhos. Sua esposa foi vice-prefeita (1989-1992) e prefeita de Ipameri\n(1993-1996) e deputada estadual (1999-2003). Em 2009 foi nomeada\nsecretária extraordinária do governo de Goiás pelo governador Alcides\nRodrigues.\n\n \n\n \n\nFONTES: CÂM. DEP. *Deputados brasileiros. Repertório* (1995-1999);\n*Folha de S.Paulo* (31/1/95, 14/1/96, 29/9/98); *Globo* (17 e 23/9/87).\n\n** **\n","ref":"FONTES: CÂM. DEP. *Deputados brasileiros. Repertório* (1995-1999);\n*Folha de S.Paulo* (31/1/95, 14/1/96, 29/9/98); *Globo* (17 e 23/9/87).\n\n** **\n","dic":"DHBB"}
