{"title":"COSTA, Fernando","cargoss":["Revolucionário ou revoltoso","Presidente de associação ou confederação de empregados ou empregadores","Ministro da Agricultura","Interventor"],"cargos_esp":[0,"DNC",0,0],"datas_ini":[1932,1937,1937,1941],"datas_fim":[1932,1937,1941,1945],"estados":[0,0,0,"SP"],"autor":[0],"content":"**COSTA, Fernando**\n\n\\*rev. 1932; pres. DNC 1937; min. Agric. 1937-1941; interv. SP\n1941-1945.\n\n \n\n*Fernando de Sousa Costa*nasceu na cidade de São Paulo no dia 10 de\njunho de 1886, filho de Querubim Febeliano da Costa e de Augusta de\nSousa Costa.\n\nCursou o primário e o secundário no Liceu do Sagrado Coração de Jesus,\nna capital paulista. Depois seguiu para Piracicaba (SP), onde, após\nfreqüentar a Escola Complementar, ingressou na Escola Superior de\nAgricultura Luís de Queirós. Devido aos escassos recursos de sua\nfamília, garantiu a continuidade desses estudos lecionando em curso\nprimário mantido pela Escola Igualitária. Por essa época, enveredou\ntambém pelo jornalismo, dirigindo a *Gazeta de Piracicaba.*\n\nApós diplomar-se engenheiro agrônomo em 1907, casou-se com Anita da\nSilveira Costa, indo residir em Piraçununga (SP), onde se dedicou à sua\nprofissão, construindo uma fazenda-modelo.\n\nTendo ingressado na política, elegeu-se prefeito municipal de\nPiraçununga em 1912. Graças a sucessivas reeleições, permaneceu 15 anos\nno cargo. À frente da administração municipal, ampliou e reconstruiu o\nsistema rodoviário, difundiu o ensino rural, remodelou a cidade,\nconstruiu uma rede de águas e esgotos, instalou uma usina hidrelétrica,\nfundou um asilo e um orfanato, restaurou a Santa Casa de Misericórdia,\nconstruiu prédios para o fórum, a cadeia e a escola normal, obtendo\nainda a instalação, em Piraçununga, do 2º Regimento de Cavalaria\nDivisionária. Também durante esse período, instalou uma indústria de\nfiação e tecelagem, de sua propriedade.\n\nPrescindindo do apoio político do governo, então controlado pelo Partido\nRepublicano Paulista (PRP), candidatou-se à Câmara Estadual em 1919.\nEleito deputado, exerceu o mandato até 1927, tendo apresentado projetos,\ndepois transformados em leis, relativos ao reflorestamento, à\nassistência dentária aos grupos escolares, aos bancos agrícolas, às\nestradas de rodagem, aos impostos territoriais, à extração de nitrogênio\ndo ar, à estatística da vida rural e à profilaxia da lepra. Preocupou-se\ntambém com a valorização e a defesa do pequeno agricultor, propondo a\nimplementação do crédito agrícola, com a divisão das grandes\npropriedades, a revitalização das terras cansadas e a irrigação do solo.\nAinda no Congresso Estadual, fez parte da Comissão de Obras Públicas,\nViação e Aviação, da qual foi presidente.\n\nEm 1927, o presidente de São Paulo, Júlio Prestes de Albuquerque,\ntransformou em organismo autônomo a Secretaria de Agricultura, Indústria\ne Comércio, até então parte da Secretaria de Viação e Obras Públicas.\nFernando Costa foi então indicado para chefiar o novo órgão. Nesse\ncargo, desenvolveu a policultura; promoveu uma campanha dos cafés finos;\nincentivou o interesse pela cultura do trigo; alargou o âmbito de\natuação do Serviço Florestal do Estado; reorganizou as diretorias de\nAgricultura, da Indústria Pastoril, e de Terras, Minas e Colonização,\ntransformando-as respectivamente nas diretorias de Inspeção do Fomento\nAgrícola, de Indústria Animal, e de Terras e Colonização; ampliou os\nserviços da Comissão Geográfica e Geológica; reorganizou o Serviço\nMeteorológico; criou leis referentes à caça e à pesca, bem como a que\nautorizava o estado a prestar auxílio à construção e à exploração de\nusinas hidrelétricas e de adubos sintéticos; reorganizou o Instituto\nAgronômico de Campinas (SP) e a Escola Veterinária de São Paulo. Foram\ntambém de sua inspiração as leis que criaram o Conselho Superior de\nAgricultura, o Instituto Biológico de Defesa Agrícola e Animal e o\nDepartamento de Indústria Animal, para o qual contratou grande número de\ntécnicos estrangeiros.\n\nCom a deposição de Júlio Prestes pela Revolução de 1930, Fernando Costa\ndesligou-se da Secretaria de Agricultura, regressando a Piraçununga a\nfim de dedicar-se a sua fábrica. Apesar de ocupar posição proeminente no\nPRP e ter apoiado a candidatura de Júlio Prestes à presidência da\nRepública nas eleições de 1930, mostrou-se simpático a Getúlio Vargas\nquando este assumiu a chefia do Governo Provisório. Entretanto, Vargas\nnão somente alijou o PRP do controle político como também contrariou as\nexpectativas do Partido Democrático (PD) de São Paulo, que apoiara o\nmovimento revolucionário, ao nomear como interventor federal no estado o\ncapitão João Alberto Lins de Barros, nome desvinculado das tradicionais\nlideranças paulistas. A partir de então, os paulistas acentuaram sua\noposição ao governo federal, até que o PD e o PRP se uniram, em\nfevereiro de 1932, em torno da Frente Única de São Paulo, que agiu\ndecisivamente no rompimento com Getúlio: em julho desse ano,\ndesencadeou-se um movimento armado cuja bandeira de luta era a\nconstitucionalização do país.\n\nFernando Costa, apesar de simpatizar com o governo Vargas, optou por\nseguir a política de seu partido, aderindo à Revolução\nConstitucionalista. Nesse sentido, em agosto de 1932, juntamente com\nMarcos Mélega e Aureliano Leite, foi enviado a Minas Gerais como\nemissário dos chefes revolucionários, a fim de estabelecer contatos com\nOlegário Maciel, então governador de Minas, em prol da causa rebelde.\nNão chegou a alcançar Belo Horizonte, mantendo contato porém com o\nsecretário do governo, Gustavo Capanema, que alegou que Minas não\npoderia aderir ao movimento, dados os compromissos do estado com Vargas.\n\nApós participar da Revolução Constitucionalista, reassumiu a direção de\nsua indústria têxtil em Piraçununga, até que, em 1937, tornou a exercer\nfunção pública, ocupando a presidência do Departamento Nacional do Café.\nNeste cargo deu início, agora em âmbito nacional, à campanha de cafés\nfinos.\n\n \n\nMinistro da Agricultura\n\nEnquanto membro do PRP, apoiou a implantação do Estado Novo (10/11/1937)\npor Vargas, na expectativa de que, após o golpe, seu partido pudesse\nassumir o governo estadual, então exercido pelo democrático José Joaquim\nCardoso de Melo Neto. Poucos dias depois, foi nomeado ministro da\nAgricultura, substituindo Odilon Braga, que havia abandonado a pasta por\ndiscordar do novo regime.\n\nNo início de dezembro de 1937, quando Cardoso de Melo Neto foi\nconfirmado na interventoria de São Paulo, Fernando Costa, a pedido da\ndireção do PRP, foi ao encontro de Vargas a fim de manifestar o\ndesagrado do partido com a manutenção do chefe do Executivo paulista.\nApós conversar com o presidente, e convencido da inconveniência de uma\nmudança no governo de São Paulo naquele momento — em face da\ninstabilidade política decorrente do golpe de novembro —, solicitou de\nseus correligionários o apoio ao interventor, como meio de assegurar o\nêxito da administração paulista e a cooperação do estado na consolidação\ndo regime. A direção do partido, entretanto, não aceitou essas\njustificativas e comunicou-lhe em carta que, embora solidária com o\nEstado Novo, solicitava do governo federal uma solução que satisfizesse\nsuas aspirações.\n\nO impasse durou alguns meses até que, em abril de 1938, Cardoso de Melo\nNeto pediu demissão, sendo substituído por Ademar de Barros. Entretanto,\na liderança do PRP — já extinto a essa altura — e o próprio Fernando\nCosta não viram com bons olhos esta escolha, pois o novo interventor era\npouco representativo do partido, já que pertencia à sua ala jovem.\n\nUma das primeiras medidas adotadas por Fernando Costa no Ministério da\nAgricultura foi o decreto-lei de 29 de fevereiro de 1938, autorizando o\nBanco do Brasil a emitir hipotecas através da Carteira de Crédito\nAgrícola. Em abril, criou o Instituto Nacional do Mate. Em agosto, com o\nobjetivo de fomentar as sociedades cooperativas, baixou um decreto-lei\nque dispunha sobre seu registro, fiscalização e assistência.\n\nEm dezembro do mesmo ano, instituiu novos órgãos no ministério,\nreagrupando e reconstituindo alguns dos já existentes. As novas\nentidades então criadas foram o Centro Nacional de Ensino e Pesquisas\nAgronômicas, com sede no quilômetro 47 da rodovia Rio-São Paulo, o\nServiço de Publicidade Agrícola, o Serviço de Economia Rural, o Serviço\nFlorestal, o Serviço de Meteorologia, o Departamento Nacional da\nProdução Vegetal, a Divisão de Terras e Colonização e a Superintendência\ndo Ensino Agrícola, órgão autônomo diretamente subordinado ao\nministério.\n\nAinda em 1938, lançou a campanha do gasogênio, medida que se mostrou\nbenéfica quando, com o advento da Segunda Guerra Mundial, ocorreram\nrestrições à importação de petróleo. Quanto a este combustível,\nincentivou pesquisas de exploração do subsolo que resultaram na\ndescoberta, em janeiro de 1939, do poço petrolífero de Lobato, no\nRecôncavo Baiano, pelo engenheiro Eugênio Bourdot Dutra, membro do\nDepartamento Nacional da Produção Mineral.\n\nFernando Costa promoveu a criação, em 1939, do Parque Nacional de\nIguaçu, do Instituto Agronômico do Norte, de cursos de aperfeiçoamento e\nespecialização e da Comissão de Abastecimento, subordinada ao Ministério\nda Agricultura.\n\nEssa comissão, composta por nove representantes de todos os ministérios,\nnomeados pelo presidente da República, tinha por finalidade controlar e\nfiscalizar a produção e o comércio de bens de primeira necessidade.\nCabia-lhe, ainda, determinar o valor máximo dos produtos, podendo\nadquirir e vender a preço de custo mercadorias consideradas de\nnecessidade pública pelo governo, numa tentativa de controlar a inflação\nque se avolumava, dado o início da guerra na Europa. Também previa\nsanções para os infratores, os quais viriam a ser processados e julgados\npelo Tribunal de Segurança Nacional.\n\nEm novembro de 1939, foi subordinado à pasta da Agricultura o Serviço de\nProteção aos Índios, sendo instituído dias depois, também no ministério,\no Conselho Nacional de Proteção ao Índios.\n\nAinda nesse ano, foi fundada em São Paulo a União dos Lavradores de\nAlgodão (ULA). Por aquela época, a produção algodoeira apresentava\nconsiderável aumento, em decorrência do incremento às exportações e do\ndeslocamento do centro produtor do Nordeste para o Sul do país, que,\napós a crise do café, passara a diversificar sua agricultura.\n\nEm 29 de janeiro de 1940, Fernando Costa instituiu novo Código de Minas,\naperfeiçoando o Código de 1934, de cuja estrutura não se afastou\nfundamentalmente.\n\nTambém nesse ano, presidiu a Comissão Nacional do Gasogênio, promovendo\na reorganização da campanha relativa a esse combustível. Empreendeu o\naproveitamento do fosfato de Ipanema, no município de Araçoiaba da Serra\n(SP), e de Sorocaba (SP), e nacionalizou as farinhas panificáveis. Criou\ntambém em São Paulo o Entreposto da Pesca.\n\nEm março de 1941, fundou o Instituto Nacional do Pinho. No mesmo ano,\napós dispor sobre a criação de colônias agrícolas, baixou em maio um\ndecreto que instituía a colonização, mediante a organização de granjas\nmodelo, e fundava um núcleo colonial.\n\nAlém dessas medidas, durante sua gestão incentivou a citricultura,\ninstituindo as casas da Laranja, e promoveu a exploração da apatita,\nutilizada como adubo.\n\n \n\nInterventor em São Paulo\n\nNo início de junho de 1941, foi nomeado interventor federal em São Paulo\ne afastou-se do ministério, o qual foi ocupado interinamente por Carlos\nde Sousa Duarte. Tomou posse de seu novo cargo no dia 4 desse mês,\nsubstituindo Ademar de Barros. Este, segundo Edgar Carone, fora afastado\nda interventoria em decorrência do volume de despesas que acarretava ao\nestado. Um dos primeiros atos de Fernando Costa na interventoria\npaulista foi a abertura de um inquérito para apurar as irregularidades\nda gestão anterior. Logo após os primeiros trâmites, porém, Vargas\nordenou a suspensão das investigações.\n\nAo nomear seu secretariado, Fernando Costa manteve Francisco Prestes\nMaia na prefeitura da capital. Durante o primeiro ano de interventoria,\npromoveu a criação do Presídio das Mulheres, junto à Penitenciária do\nEstado, instituiu a Comissão de Fiscalização dos Preços dos Gêneros\nAlimentícios de Primeira Necessidade, restabeleceu a Secretaria de\nSegurança Pública, extinguiu o Instituto do Café e delimitou, na Fazenda\nButantã, uma área para a construção da Cidade Universitária.\n\nEm janeiro de 1942, deu início à construção da Escola Profissional\nRural, em Ribeirão Preto. Mais tarde, construiu estabelecimentos do\nmesmo gênero em Bauru, Guaratinguetá, Rio Preto e Piraçununga, aplicando\nnessas obras o dinheiro resultante da liquidação do Instituto do Café.\nAlgumas dessas escolas foram posteriormente fechadas devido à\nsofisticação de suas instalações, que contrariava seus objetivos.\n\nAinda nesse mês, Fernando Costa criou o Departamento de Serviço Público.\nEm junho, extinguiu a Secretaria do Governo e instituiu as guardas\npoliciais. Promoveu, nesse mesmo ano, a criação do Lar Juquiá,\nestabelecimento de trabalho agrícola para os liberados condicionais e\negressos das prisões do estado, bem como a instituição dos fundos\nuniversitários de pesquisas, cuja chefia coube a Jorge Americano, então\nreitor da Universidade de São Paulo (USP).\n\nEntre as realizações efetuadas em São Paulo no ano de 1943 incluem-se a\ninauguração da rodovia Anhangüera, ligando a capital do estado a\nCampinas, e a criação da Bolsa de Café e Mercadorias de Santos.\n\nÀ mesma época, as diversas manifestações de protesto contra o regime\nocorridas em São Paulo provocaram o ressentimento de Vargas para com\nFernando Costa. Apesar disso, o interventor paulista empenhou-se\npessoalmente na recuperação de Getúlio Vargas Filho, que, residindo em\nSão Paulo, adoecera, vindo a falecer em 1943.\n\nPor outro lado, a nomeação do ex-chefe de polícia de Washington Luís,\nCoriolano de Araújo Góis Filho, para a Secretaria de Segurança paulista,\nefetuada por Fernando Costa nesse ano, suscitou protestos por parte da\npopulação, ressentida com as medidas repressivas adotadas pelo\nsecretário. O fato culminou em novembro com as perseguições aos\nestudantes da Faculdade de Direito e com a morte de um acadêmico em\nchoque com a polícia. Em face das pressões populares, Fernando Costa\ndecidiu destituir Coriolano de Góis daquele cargo.\n\nEm abril de 1944, por iniciativa dos líderes do movimento democrático,\nentrou em circulação a gazeta clandestina *Resistência.*Em outubro, o\nPartido Acadêmico Libertador lançou manifesto em favor da democracia,\nexigindo uma Assembléia Nacional Constituinte. Em dezembro, na tentativa\nde abrandar os ânimos dos paulistas, que cada vez mais demonstravam sua\ninsatisfação com o Estado Novo, Getúlio Vargas visitou São Paulo, não\nlogrando porém arrefecer a oposição ao regime.\n\nNo início de 1945, Vargas convidou o general Eurico Dutra para\ncandidatar-se à sucessão presidencial, incumbindo Benedito Valadares,\ninterventor em Minas Gerais, de articular as forças em torno desse nome.\nA primeira medida de Valadares foi procurar o apoio de São Paulo. De\ninício, Fernando Costa recebeu friamente a proposta, mas reconsiderou\nsua posição e decidiu aderir a ela. Assim, em fins de março, participou\nda instalação nos estados do Partido Social Democrático (PSD), destinado\na promover a candidatura Dutra.\n\nA criação do PSD foi precedida de grandes divergências acerca de sua\norganização. Enquanto Valadares e Fernando Costa defendiam as\norganizações estaduais, Ernâni Amaral Peixoto e Agamenon Magalhães eram\nfavoráveis aos partidos nacionais. Em função do apoio recebido do\npresidente Vargas, esta última posição veio a predominar. O fato, no\nentanto, em nada diminuiu a influência estadual das organizações\npartidárias, visto que da formação do PSD, por exemplo, participaram os\ninterventores e seus secretariados.\n\nA primeira convenção nacional do partido foi realizada a 17 de julho de\n1945, no Teatro Municipal do Rio de Janeiro. Fernando Costa foi\nescolhido para integrar o diretório nacional,****ao lado de Agamenon\nMagalhães e dos interventores Benedito Valadares, Ernâni Amaral Peixoto\ne Ismar de Góis Monteiro, entre outros. Também integrou, como segundo\nvice-presidente, a comissão diretora então constituída, a qual incluía\nainda Getúlio Vargas na presidência e Benedito Valadares na\nprimeira-vice-presidência.\n\nEm 10 de outubro de 1945, foi assinado o decreto-lei que antecipava as\neleições estaduais para 2 de dezembro, fazendo-as coincidir com as\nfederais. O decreto proporcionava aos interventores a possibilidade de\nse candidatarem e lhes dava um prazo de 30 dias para a\ndesincompatibilização. Interessado em candidatar-se ao governo de São\nPaulo, Fernando Costa exonerou-se em 27 de outubro do cargo que ocupava,\nno que foi acompanhado por outros interventores de vários estados.\n\nPorém, com a deposição de Vargas (29/10/1945), assumiu interinamente o\ngoverno do país o presidente do Supremo Tribunal Federal (STF), ministro\nJosé Linhares, cujos primeiros atos foram revogar o decreto que\nantecipava as eleições e nomear novos interventores, quase todos\nelementos do Poder Judiciário.\n\nFernando Costa dedicava-se à campanha eleitoral como candidato ao\nExecutivo paulista quando veio a falecer, em desastre de automóvel, na\nrodovia Anhangüera, no dia 21 de janeiro de 1946.\n\nEntre os inúmeros trabalhos que publicou, destacam-se: *Idealismo\nconstrutor*(1930), *Política do café*(1937),*As realizações do\npresidente Getúlio Vargas no Ministério da Agricultura*(1941),*Novas\nterras e terras cansadas*(1943) e *No governo de São Paulo*(1944).\n\nSílvia Pantoja\n\n \n\n \n\nFONTES: ARAÚJO, A. *Chefes;*ARAÚJO, M.*Cronologia 1943;*BELEZA,\nN.*Evolução;*CARONE, E. *Estado;*CONSULT. MAGALHÃES, B.; CORRESP. ARQ.\nEST. SP; COUTINHO, A.*Brasil;*DULLES, J. *Getúlio; Efemérides paulistas;\nEncic. Mirador;*ENTREV. PEIXOTO, A.; *Folha de S. Paulo*(22/1/46);\n*Grande encic. Delta; Grande encic. portuguesa;*GUERRA FILHO, R.\n*Ministério;*HENRIQUE, A. *Ascensão;*HIRSCHOWICZ, E, *Contemporâneos;\nJornal do Comércio,*Rio; LEITE, A. *História;*LEVINE, R. *Vargas;*MELO,\nL. *Dic.;*MIN.**GUERRA. *Almanaque;*MIN. MAR. *Almanaque;*MORAIS, A.\n*Introdução;*PEIXOTO, A*. Getúlio;*POPPINO, R. *Federal;*SILVA, H.\n*1926;*SILVA, H. *1932;*SILVA H. *1933;*SILVA, H. 1937*.*\n\n \n","ref":"FONTES: ARAÚJO, A. *Chefes;*ARAÚJO, M.*Cronologia 1943;*BELEZA,\nN.*Evolução;*CARONE, E. *Estado;*CONSULT. MAGALHÃES, B.; CORRESP. ARQ.\nEST. SP; COUTINHO, A.*Brasil;*DULLES, J. *Getúlio; Efemérides paulistas;\nEncic. Mirador;*ENTREV. PEIXOTO, A.; *Folha de S. Paulo*(22/1/46);\n*Grande encic. Delta; Grande encic. portuguesa;*GUERRA FILHO, R.\n*Ministério;*HENRIQUE, A. *Ascensão;*HIRSCHOWICZ, E, *Contemporâneos;\nJornal do Comércio,*Rio; LEITE, A. *História;*LEVINE, R. *Vargas;*MELO,\nL. *Dic.;*MIN.**GUERRA. *Almanaque;*MIN. MAR. *Almanaque;*MORAIS, A.\n*Introdução;*PEIXOTO, A*. Getúlio;*POPPINO, R. *Federal;*SILVA, H.\n*1926;*SILVA, H. *1932;*SILVA H. *1933;*SILVA, H. 1937*.*\n\n \n","dic":"DHBB"}
