{"title":"COUTINHO, Flávio Ribeiro","cargoss":["Deputado federal","Governador de estado ou do Distrito Federal"],"cargos_esp":[0,0],"datas_ini":[1930,1956],"datas_fim":[1930,1958],"estados":["PB","PB"],"autor":[0],"content":"**COUTINHO, Flávio Ribeiro**\n\n\\*dep. fed. PB 1930; gov. PB 1956-1958.\n\n \n\n*Flávio Ribeiro Coutinho*nasceu na fazenda Chaves, no município de Pilar\n(PB), no dia 20 de julho de 1882, filho do “coronel” João Ribeiro da\nSilva Coutinho e de Ana Ferreira de Castro Ribeiro Coutinho. Descendia\nde uma família de grandes produtores de cana-de-açúcar e de algodão na\nParaíba, na qual se destacaram João Úrsulo Ribeiro Coutinho Filho,\nconstituinte de 1946, deputado federal pela Paraíba de 1946 a 1951, e de\n1955 a 1963; Odilon Ribeiro Coutinho, deputado federal pelo Rio Grande\ndo Norte de 1963 a 1967; Flaviano Ribeiro Coutinho Filho, deputado\nfederal pela Paraíba de 1963 a 1971; e Renato Ribeiro Coutinho, deputado\nfederal pela Paraíba de 1967 a 1971.\n\nRealizou os primeiros estudos no Colégio Pio X e no Liceu Paraibano, em\nsua cidade natal, bacharelando-se pela Faculdade de Medicina da Bahia em\ndezembro de 1907.\n\nTransferiu-se em seguida para Belém, onde começou a clinicar, instalando\nseu consultório na Farmácia Galeno. De volta à Paraíba, dedicou-se à\nprodução açucareira, iniciando sua carreira política ao lado de Epitácio\nPessoa em 1915, quando chefiou o diretório do Partido Republicano da\nParaíba em Itabaiana, cuja prefeitura ocupou por pouco tempo. Em 1922\ntornou-se proprietário da usina Santa Helena.\n\nEleito deputado estadual para o período de 1924-1926, renunciou ao\nmandato por haver sido empossado como segundo-vice-presidente de seu\nestado durante a gestão de João Suassuna (1924-1928), permanecendo nesse\ncargo até 1928. Adversário da Aliança Liberal (1929-1930), elegeu-se\ndeputado federal em março de 1930, assumindo o mandato em maio do mesmo\nano. Com a vitória da Revolução de 1930, perdeu o mandato em virtude do\nfechamento de todos os órgãos legislativos do país, voltando então às\natividades industriais.\n\nConvidado por Otacílio de Albuquerque a integrar o diretório do Partido\nDemocrático da Paraíba, não aceitou, só retornando à vida política em\n1933, com a criação do Partido Progressista da Paraíba. Em 1937, já\ndurante o Estado Novo (1937-1945), integrou o Conselho de Administração\ndo Estado. De 1937 a 1941 presidiu a Associação Comercial da Paraíba,\ntendo ocupado ainda, de 1939 a 1940, a presidência do Departamento\nAdministrativo do Estado.\n\nCom a desagregação do Estado Novo e a conseqüente redemocratização do\npaís, participou em 1945, ao lado de José Américo de Almeida e de\nArgemiro de Figueiredo, da fundação da União Democrática Nacional (UDN)\nna Paraíba, tendo chegado, ainda nesse ano, à presidência do diretório\nregional do partido, na qual permaneceria até 1958. No pleito de janeiro\nde 1947 elegeu-se na legenda da UDN deputado à Assembléia Constituinte\nda Paraíba. Assumindo o mandato em março seguinte, foi escolhido\npresidente da Assembléia. Ainda em 1947 fundou o Banco Comércio e\nIndústria e durante dois dias, entre 30 de setembro e 2 de outubro, na\nqualidade de presidente da Assembléia Legislativa, substituiu Osvaldo\nTrigueiro de Albuquerque Melo no governo estadual. Após a promulgação da\nnova Carta estadual, permaneceu no exercício do mandato até janeiro de\n1951, tendo concorrido ainda à Câmara dos Deputados, sempre na legenda\nda UDN, no pleito de outubro de 1950. Obteve então apenas a segunda\nsuplência, não chegando a exercer o mandato.\n\nCom base num acordo pluripartidário articulado pelo então governador\nparaibano José Américo de Almeida, candidatou-se em 1955 ao governo do\nestado. Entretanto, surgiram algumas dificuldades para a obtenção do\nacordo, uma vez que o Partido Social Democrático (PSD) reivindicara\nindicar o candidato a governador, pois, no pleito de 1950, indicara o\nvice-governador, favorecendo com isso a UDN. O PSD acabou por aceitar a\ncandidatura de Flávio Ribeiro Coutinho em agosto de 1955, lançando para\na mesma chapa como vice-governador Pedro Moreno Gondim. O Partido\nRepublicano (PR) apoiou a chapa UDN-PSD, sagrando-se afinal Flávio\nRibeiro Coutinho candidato único dos grandes partidos.\n\nEleito governador em 3 de outubro de 1955, tomou posse em 31 de janeiro\ndo ano seguinte. Nomeou um secretariado que contava com a participação\nde representantes da UDN, do PSD e do Partido Libertador (PL),\nconsolidando assim a política de pacificação estadual iniciada por José\nAmérico. Durante sua gestão criou a empresa Armazéns e Silos do Estado\nda Paraíba (Casep) e ampliou a Universidade Federal da Paraíba, com a\ninclusão das escolas de Engenharia, de Farmácia, de Odontologia e de\nServiço Social, e a aquisição do terreno destinado à edificação da\nCidade Universitária. Suas medidas visaram sobretudo à área rural e à\neducação. Deixou o governo em 4 de dezembro de 1957 devido a problemas\nde saúde, viajando para o Rio de Janeiro, então Distrito Federal, a fim\nde tratar-se. Solicitou à Assembléia Legislativa licença de 180 dias\npara tratamento de saúde, sendo substituído pelo vice-governador Pedro\nGondim em 4 de janeiro do ano seguinte e não mais retornando ao\nexercício do cargo.\n\nFoi ainda fundador e presidente do Sindicato da Indústria do Açúcar.\n\nApós longo período de tratamento, faleceu no Rio de Janeiro no dia 26 de\nmaio de 1963.\n\nEra casado com sua sobrinha Berenice Mindelo Ribeiro Coutinho, com quem\nteve seis filhos.\n\nA seu respeito publicou-se em 1977 a obra *Flávio Ribeiro Coutinho,\nhistória de uma vida* *e uma época* e, em 2000, *Flávio Ribeiro\nCoutinho*, sétimo volume  da Série Histórica Paraíba — Nomes do Século\n—, iniciativa da Editora União, do governo da Paraíba.\n\n \n\n \n\nFONTES: *Almanaque da PB; Grande encic.* *Delta;*MAIA, B.\n*Governadores;*MAIA, S. *Crônicas;*NÓBREGA, A. *Chefes;*PINTO, L.\n*Fundamentos;*SILVA, R, *Bacharéis;* TRIB*.*SUP. ELEIT. *Dados*(1, 2 e\n3).\n\n \n","ref":"FONTES: *Almanaque da PB; Grande encic.* *Delta;*MAIA, B.\n*Governadores;*MAIA, S. *Crônicas;*NÓBREGA, A. *Chefes;*PINTO, L.\n*Fundamentos;*SILVA, R, *Bacharéis;* TRIB*.*SUP. ELEIT. *Dados*(1, 2 e\n3).\n\n \n","dic":"DHBB"}
