{"title":"COUTINHO, Joaquim Henrique","cargoss":["Ministro do Tribunal de Contas"],"cargos_esp":[0],"datas_ini":[1949],"datas_fim":[1964],"estados":[0],"autor":[0],"content":"**COUTINHO, Joaquim Henrique**\n\n\\*min. TCU 1949-1964.\n\n \n\n*Joaquim Henrique Coutinho* nasceu no Rio de Janeiro, então Distrito\nFederal, no dia 13 de setembro de 1894.\n\nEstudou no externato do Ginásio Nacional, denominação então adotada pelo\nColégio Pedro II, na Escola Normal do Distrito Federal e mais tarde se\nbacharelou pela Faculdade de Direito do Rio de Janeiro.\n\nAprovado em concurso para o Ministério da Guerra, serviu nas caixas\nmilitares das forças armadas em diversos estados, foi presidente da\nComissão de Eficiência e diretor-geral de contabilidade. Foi também\noficial-de-gabinete dos ministros da Guerra Nestor Sezefredo dos Passos\n(1926-1930) e Pedro Aurélio de Góis Monteiro (1934-1935). Em 1935\nassumiu a cadeira de direito público na Escola de Aperfeiçoamento de\nOficiais do Corpo de Bombeiros do Distrito Federal e posteriormente\ntornou a exercer as funções de oficial-de-gabinete dos ministros Eurico\nGaspar Dutra (1936-1945) e Canrobert Pereira da Costa (1946-1951).\n\nEm 1947 representou o Brasil no Congresso de Ciências Administrativas,\nrealizado em Berna, na Suíça, e ainda durante o governo Dutra\n(1946-1951) foi subchefe do Gabinete Civil da Presidência da República.\nEm 1949 foi nomeado ministro do Tribunal de Contas da União (TCU) e no\nano seguinte representou mais uma vez o Brasil no Congresso de Ciências\nAdministrativas, realizado agora em Florença, na Itália. Em 1950 foi\ndesignado presidente do TCU e permaneceu nesse cargo até o ano seguinte.\nOcupou novamente a presidência do TCU de 1955 a 1956 e de 1960 a 1961, e\nse aposentou em 1964.\n\nFaleceu no Rio de Janeiro, já capital do estado da Guanabara, no dia 1º\nde junho de 1965.\n\n \n\n \n\nFONTES: CORTÉS, C. *Homens;* MACEDO, R*. Efemérides; Perfil* (1972).\n\n \n","ref":"FONTES: CORTÉS, C. *Homens;* MACEDO, R*. Efemérides; Perfil* (1972).\n\n \n","dic":"DHBB"}
