{"title":"COUTO, Henrique","cargoss":["Deputado federal"],"cargos_esp":[0],"datas_ini":[1935],"datas_fim":[1937],"estados":["MA"],"autor":[0],"content":"**COUTO, Henrique**\n\n\\*magistrado; dep. fed. MA 1935-1937.\n\n* *\n\n*Henrique José Couto* nasceu em Teresina no dia 30 de junho de 1875,\nfilho de Marcelino José Couto e de Altina Alves de Noronha Couto.\n\nEstudou em Teresina no Colégio Nossa Senhora das Dores e no Liceu\nPiauiense, antes de ingressar na Faculdade de Direito de Recife, pela\nqual se bacharelou em 1898.\n\nFoi professor de história universal no Liceu Piauiense, delegado da\nDiretoria Geral de Estatística em 1900 e juiz distrital das comarcas de\nPicos (PI) e de Teresina. No Maranhão, para onde se transferiu em 1903,\nfoi promotor público na comarca de São Francisco, juiz de direito das\ncomarcas de Alto Itapicuru, Brejo e Caxias. Um dos fundadores da\nFaculdade de Direito do Maranhão, foi seu vice-diretor entre julho de\n1918 e 1922, e também professor catedrático de direito criminal e mais\ntarde diretor do estabelecimento. Foi também juiz federal substituto,\ninspetor-geral do Serviço de Terras, procurador-geral do estado, membro\ndo Conselho Penitenciário, desembargador do Tribunal de Justiça e\npresidente do mesmo tribunal em 1926. No governo do estado, ocupou as\nsecretarias de Justiça e Segurança e do Interior, chegando depois a\nsecretário-geral do estado. Aposentou-se em 1930.\n\nFoi um dos fundadores do Partido Social Democrático (PSD) do Maranhão,\ncriado para concorrer às eleições para a Assembléia Nacional\nConstituinte realizadas em maio de 1933. No pleito de outubro de 1934,\nelegeu-se deputado federal pelo Maranhão na legenda do PSD, exercendo o\nmandato de 3 de maio de 1935 a 10 de novembro de 1937, quando o advento\ndo Estado Novo suprimiu às câmaras legislativas do país.\n\nFoi ainda redator e secretário da revista Congresso Acadêmico, de\nRecife, redator do jornal A Notícia, de Teresina, e diretor da Revista\nda Faculdade de Direito do Maranhão.\n\nFaleceu no Rio de Janeiro no dia 2 de novembro de 1954.\n\nEra casado com Maria Raimunda de Nunes Couto, com quem teve sete filhos.\n\nPublicou *Lei Orgânica dos municípios do* *estado do Maranhão*e*CLT das\nleis* *de organização judiciária do estado do Maranhão*.**Foi ainda\nautor de diversos textos jurídicos convertidos em lei pelo Congresso\nLegislativo maranhense, como a reforma judiciária de 1927 e o regimento\nde custos.\n\n \n\nFONTES: *Boletim Min. Trab.*(5/36); CÂM. DEP*. Deputados*;**CÂM. DEP.\n*Relação dos dep.;*COSTA, S. *Faculdade;*HIRSCHOWICZ, E.\n*Contemporâneos*; INF. FAM.\n\n \n\n \n","ref":"FONTES: *Boletim Min. Trab.*(5/36); CÂM. DEP*. Deputados*;**CÂM. DEP.\n*Relação dos dep.;*COSTA, S. *Faculdade;*HIRSCHOWICZ, E.\n*Contemporâneos*; INF. FAM.\n\n \n\n \n","dic":"DHBB"}
