{"title":"COVELO, Antônio Augusto","cargoss":["Constituinte","Deputado federal"],"cargos_esp":[0,0],"datas_ini":[1934,1935],"datas_fim":[1934,1937],"estados":[0,"SP"],"autor":[0],"content":"**COVELO, Antônio Augusto**\n\n\\*jornalista; const. 1934; dep. fed. SP 1935-1937.\n\n \n\n*Antônio Augusto Covelo* nasceu em Rio Claro (SP) no dia 20 de dezembro\nde 1886, filho de Miguel Covelo e de Isabel Paulina Covelo.\n\nFez os primeiros estudos em sua cidade natal, prosseguindo-os na Escola\nComplementar de Itapetininga (SP). Cursou até o segundo ano de pedagogia\nna Escola Prudente de Morais, em São Paulo, tendo também freqüentado o\nInstituto de Ciências e Letras. Ingressou em 1903 na Academia de Direito\nde São Paulo, cursou por dois anos a Faculdade Livre de Direito do Rio\nde Janeiro, no então Distrito Federal, e, de volta à Academia de Direito\nde São Paulo, formou-se em 1908.\n\nIniciou-se no jornalismo em 1910 como diretor do jornal *Cruzeiro do\nSul*de Sorocaba (SP). Em plena Campanha Civilista (1909-1910), promoveu\nem seu jornal a candidatura de Rui Barbosa à presidência da República,\nem oposição à candidatura do marechal Hermes da Fonseca, afinal eleito\nem março de 1910. Em 1911 assumiu a direção do jornal *Comércio de\nJaú*onde permaneceu por um ano, quando atuou como advogado no foro da\ncapital paulista. Diretor-proprietário da *Gazeta de São Paulo*de 1918 a\n1921, atuou em seguida no *Correio Paulistano*onde foi redator político\naté 1923.\n\nNo pleito de 1924 elegeu-se deputado estadual em São Paulo, não sendo\nreconhecido em virtude da decretação do estado de sítio e do fechamento\ndo Congresso pelo presidente Artur Bernardes. Reeleito, atuou como\ndeputado estadual em duas legislaturas, de 1927 a 1930, tornando-se\nlíder da maioria e presidente da Comissão de Fazendas e Contas da\nAssembléia Legislativa. Apesar de manter-se afastado das lutas\npartidárias desde 1928, continuou a exercer seu mandato até 1930, quando\na revolução de 3 de outubro suprimiu todos os órgãos legislativos do\npaís.\n\nA imediata nomeação do tenente João Alberto Lins de Barros para\ninterventor em São Paulo significou a marginalização do segmento da\noligarquia política local que havia participado do movimento\nrevolucionário, em especial do Partido Democrático (PD). A oposição\nentre as correntes políticas tradicionais do estado, em cujas fileiras\nestava Antônio Augusto Covelo, e as forças tenentistas aliadas do\ngoverno federal acirrou-se ao longo de 1931-1932. Covelo voltou às lutas\npartidárias com a Revolução Constitucionalista de 1932. No ano seguinte,\ndevido a seus interesses como proprietário agrícola em Guarulhos (SP),\nfiliou-se ao Partido da Lavoura. Nessa legenda elegeu-se em maio\ndeputado por São Paulo à Assembléia Nacional Constituinte. Assumindo o\nmandato em novembro do mesmo ano, participou dos trabalhos constituintes\ne, após a promulgação da nova Carta (16/7/1934) e a eleição do\npresidente da República no dia seguinte, teve seu mandato prorrogado até\nmaio de 1935. Reeleito em outubro de 1934, para a legislatura ordinária\nque se seguiu, permaneceu na Câmara até novembro de 1937, quando o\nadvento do Estado Novo dissolveu todos os órgãos legislativos do país.\n\nCovelo foi ainda promotor público em Sorocaba (SP), tendo também\nlecionado lógica no Ginásio Hydecroft e fundado o Ginásio de Sorocaba.\n\nFaleceu na cidade de São Paulo no dia 23 de novembro de 1942.\n\nPublicou *O* *advogado; uma interessante* *questão forense e a fundação\ndo Instituto de* *Advogados de São Paulo: minuta de agravo* (1919), *O\njuiz é a vida do direito*(1942), *O Rio de Janeiro no tempo de Luís\nEdmundo* (1942), *O problema da lepra, Discursos, Coletânea de artigos,\nDo regime de bens no* *casamento*e A*concepção de Estado.*\n\n \n\n \n\nFONTES: CÂM. DEP. *Deputados; Câm. Dep.* *seus componentes;*GODINHO, V.\n*Constituintes; Grande encic. portuguesa;*LEITE, A. *História;*MELO, L.\n*Dic;*VELHO SOBRINHO, J.*Dic.*\n\n \n","ref":"FONTES: CÂM. DEP. *Deputados; Câm. Dep.* *seus componentes;*GODINHO, V.\n*Constituintes; Grande encic. portuguesa;*LEITE, A. *História;*MELO, L.\n*Dic;*VELHO SOBRINHO, J.*Dic.*\n\n \n","dic":"DHBB"}
