{"title":"CRESPO, Dario","cargoss":["Deputado federal"],"cargos_esp":[0],"datas_ini":[1935],"datas_fim":[1937],"estados":["RS"],"autor":[0],"content":"**CRESPO, Dario**\n\n\\*dep. fed. RS 1935-1937.\n\n*Dario Centeno Crespo* participou em 1929-1930 da campanha da Aliança\nLiberal, defendendo a candidatura de Getúlio Vargas à presidência da\nRepública nas eleições previstas para março de 1930. Em 23 de janeiro\ndesse ano embarcou no navio holandês *Orânia*, integrando a caravana que\npercorreria os estados do Norte sob a chefia de João Pessoa, candidato à\nvice-presidência na chapa aliancista. Foi orador em diversos comícios e\ntomou parte no grupo que, viajando em um trem da Estrada de Ferro\nLeste-Brasileiro, percorreu toda a região localizada entre Salvador e as\nmargens do rio São Francisco.\n\nApós a vitória da Revolução de 1930, foi nomeado em 1933, durante a\ninterventoria do general José Antônio Flores da Cunha, chefe de polícia\ndo Rio Grande do Sul em substituição a Agenor Barcelos Feio. Eleito\ndeputado federal por esse estado em outubro de 1934, exerceu o mandato\nde maio de 1935 a novembro de 1937, quando, com a instauração do Estado\nNovo, os órgãos legislativos do país foram suprimidos.\n\nEm 1943 foi membro da Câmara de Justiça do Trabalho, órgão do Conselho\nNacional do Trabalho constituído por representantes do Ministério do\nTrabalho e das instituições de previdência social. No ano seguinte\ntornou-se diretor da Caixa Econômica Federal do Rio de Janeiro, cuja\nvice-presidência exerceu de 1947 a 1949. Em 1950 passou a diretor do\nconselho superior das caixas econômicas federais, órgão que presidiu de\n1951 a 1952 e no qual permaneceu até 1954. Nesse ano reassumiu o cargo\nde diretor da Caixa Econômica Federal do Rio de Janeiro, exercendo suas\nfunções até 1958.\n\nFONTES: *Boletim Min. Trab.*(5/36); CÂM. DEP.*Deputados; Diário do\nCongresso Nacional;*ENTREV. PEIXOTO, A.; PINTO, A. *Caixa;*SILVA, H.\n*1930*; SILVA, H. *1933.*\n\n \n","ref":"FONTES: *Boletim Min. Trab.*(5/36); CÂM. DEP.*Deputados; Diário do\nCongresso Nacional;*ENTREV. PEIXOTO, A.; PINTO, A. *Caixa;*SILVA, H.\n*1930*; SILVA, H. *1933.*\n\n \n","dic":"DHBB"}
