{"title":"CRUCIANO, José","cargoss":["Deputado federal","Deputado federal","Deputado federal"],"cargos_esp":[0,0,0],"datas_ini":[1965,1964,1963],"datas_fim":[1965,1964,0],"estados":["GO","GO","GO"],"autor":[0],"content":"**CRUCIANO, José**\n\n\\*dep. fed. GO 1963, 1964 e 1965.\n\n \n\n*José Cruciano de Araújo* nasceu na cidade de Goiás, antiga capital do\nestado de Goiás, no dia 31 de janeiro de 1929, filho de Cileneu Marques\nde Araújo Vale e de Maria Madalena Reis de Araújo. Seu pai foi\njornalista, poeta, advogado, juiz e deputado estadual (1908-1909 e\n1914-1925). Seu tio Vasco dos Reis Gonçalves foi deputado estadual\n(1935-1937) e deputado federal por Goiás (1947-1948). Seu tio Benjamim\nda Luz Vieira foi secretário de estado e deputado federal por Goiás em\n1937.\n\nJosé Cruciano diplomou-se em farmácia em 1950 e formou-se em direito em\n1955, tendo exercido as profissões de advogado, jornalista e professor.\n\nIngressou na vida pública em 1953, quando ocupou a Secretaria de\nEducação de Goiás. Em 1956 ficou em primeiro lugar no concurso para o\nMinistério Público Estadual. Dois anos depois passou a integrar o Corpo\nde Consultores Jurídicos de Goiás, que posteriormente seria transformado\nem Procuradoria Geral do Estado. Ainda em 1958 ocupou a Secretaria de\nGoverno de Goiás em duas administrações, onde permaneceu até 1961.\n\nNo pleito de outubro de 1962 concorreu a uma vaga de deputado federal\npor Goiás na legenda do Partido Social Democrático (PSD), obtendo uma\nsuplência. Exerceu o mandato de abril a junho de 1963, de abril a junho\ne de julho a agosto de 1964, de maio a agosto e de setembro a outubro de\n1965. Com a intervenção no estado pelo governo federal e a nomeação de\nEmílio de Ribas Júnior (1965-1966) para governar Goiás, José Cruciano\nocupou a pasta da administração. Ainda em 1965, abandonou a vida\npolítica e foi aprovado no concurso para professor-assistente da Escola\nde Engenharia da Universidade Federal de Goiás (UFG).\n\nNo ano de 1973 ocupou a primeira sub-reitoria da UFG e entre 1978 e 1981\nfoi reitor da mesma instituição. Aposentou-se do cargo de\nprocurador-geral do estado em 1983 e da universidade em 1991. Entre 1993\ne 1995 exerceu os cargos de diretor-geral e de secretário da presidência\ndo Tribunal Regional do Trabalho (TRT) de Goiás.\n\nFaleceu em março de 2001.\n\nEra casado com Ana Teresa Carvalho de Araújo, com quem teve sete filhos.\n\nPublicou *Três contos que não são de réis* e *Poesia quase completa de\nLeo Lynce* com poemas de seu pai.\n\nFONTES: CÂM. DEP. *Deputados*; CÂM. DEP. *Deputados brasileiros*\n(1946-1967); *Grande encic. portuguesa*; INF. BIOG.; TRIB. SUP. ELEIT.\n*Dados*(6).\n","ref":"FONTES: CÂM. DEP. *Deputados*; CÂM. DEP. *Deputados brasileiros*\n(1946-1967); *Grande encic. portuguesa*; INF. BIOG.; TRIB. SUP. ELEIT.\n*Dados*(6).\n","dic":"DHBB"}
