{"title":"ALQUÉRES, José Luís","cargoss":["Presidente de associação ou confederação de empregados ou empregadores"],"cargos_esp":["Eletrobrás"],"datas_ini":[1993],"datas_fim":[1994],"estados":[0],"autor":["Gisela Moura","Paulo Brandi"],"content":"**ALQUÉRES, José Luís**\n\n\\*pres. Eletrobrás 1993-1994.\n\n \n\n*José Luís Alquéres* nasceu no Rio de Janeiro, então Distrito Federal,\nno dia 31 de março de 1944, filho do médico e professor Hugo Vitorino\nAlquéres Batista e de Eunice Aché Pilar Alquéres Batista. Entre outros\ncargos na administração pública federal, seu pai foi ministro interino\nda Saúde em 1972. Também exerceu a presidência do Sindicato dos Médicos\ndo Rio de Janeiro, da Sociedade Brasileira de Medicina e Cirurgia, da\nSociedade Brasileira de Cardiologia, e a vice-presidência da Organização\nPan-Americana da Saúde.\n\nEstudou no Colégio Santo Inácio entre 1953 e 1961 e em seguida prestou\nvestibular para o curso de engenharia civil da Pontifícia Universidade\nCatólica do Rio de Janeiro (PUC-Rio). Em 1964, ainda na faculdade, foi\nadmitido por concurso no Banco Nacional de Desenvolvimento Econômico\n(BNDE), atual Banco Nacional do Desenvolvimento Econômico e Social\n(BNDES), onde trabalhou durante três anos. Formou-se engenheiro em 1966,\ncom especialização em planejamento urbano, edificações, portos e\nestruturas hidráulicas. Selecionado para bolsa de estudos nos Estados\nUnidos na área de planejamento urbano e regional, fez estágios em\nprefeituras e órgãos públicos americanos ao longo de 1967. De volta ao\nBrasil, tornou-se professor da PUC-Rio, onde lecionaria durante sete\nanos, ingressando também na firma de engenharia carioca Severo e\nVillares. Em 1969, transferiu-se para o Serviço Federal de Habitação e\nUrbanismo. Depois de freqüentar o curso de extensão em planejamento e\ndesenvolvimento oferecido pela Organização dos Estados Americanos (OEA)\ne pelo Banco Interamericano de Desenvolvimento (BID), concluiu em 1972 o\nmestrado em planejamento urbano e regional da Universidade Federal do\nRio de Janeiro (UFRJ), tornando-se professor da Faculdade de Arquitetura\ne Urbanismo da mesma universidade.\n\nAinda em 1972, ingressou na Centrais Elétricas Brasileiras (Eletrobrás),\nempresa *holding* responsável pela execução da política de energia\nelétrica do governo federal. Foi o ponto de partida de sua longa\ncarreira no setor elétrico brasileiro. Em 1974, foi nomeado\nchefe-adjunto do departamento de estudos de mercado, então criado no\nâmbito da Eletrobrás. Paralelamente a essas atividades, realizou\nconsultorias na área imobiliária e foi sócio da firma Carioca\nEngenharia, Planejamento e Arquitetura (Cepar), da qual se retirou em\n1977. Pós-graduado em planejamento energético pela Universidade de\nChicago em 1979, nesse mesmo ano afastou-se da Eletrobrás para ocupar a\ndiretoria adjunta de planejamento e distribuição comercial da Light\nServiços de Eletricidade, maior distribuidora de energia elétrica do\npaís, logo após a compra dessa empresa pela *holding,*em operação que\nmarcou a quase completa estatização do setor. Ao longo do período em que\npermaneceu na Light, criou a superintendência de eletrificação de\ninteresse regional, que coordenou o programa de eletrificação das\nfavelas do Rio de Janeiro, e a superintendência de racionalização\nenergética.\n\nRetornou à Eletrobrás em 1983, como assistente da diretoria de\nplanejamento e engenharia, participando da elaboração de vários estudos\nsobre a expansão dos sistemas elétricos brasileiros, como o chamado\nPlano 2010, que procurou redefinir o programa nuclear, abrindo espaço\npara a discussão dos problemas ambientais nos estudos de planejamento.\nFoi ainda responsável pela coordenação do projeto brasileiro-argentino\nde construção da usina binacional de Garabi. Participou igualmente do\ngrupo responsável pela fundação do Centro da Memória da Eletricidade no\nBrasil.\n\nEm 1988 assumiu a presidência da Companhia de Eletricidade do Rio de\nJaneiro (CERJ), concessionária pública estadual atuante em Niterói,\nPetrópolis, Campos e outras cidades fluminenses, onde permaneceu por um\nano. Em fevereiro de 1989 regressou à Eletrobrás para ocupar o posto de\ndiretor de planejamento e engenharia. A despeito do remanejamento geral\nde cargos na administração pública federal ocorrido durante o governo\nFernando Collor de Melo (1990-1992), permaneceu na diretoria da\nEletrobrás até agosto de 1992. Nesse período, participou da elaboração\ndo Plano Diretor de Meio Ambiente, dos contatos para a interconexão dos\nsistemas elétricos na bacia do Prata e no Norte do país com a Venezuela\ne promoveu estudos de aprofundamento de tecnologias para a expansão do\nparque gerador brasileiro. Em 1991, tornou-se presidente do Comitê\nBrasileiro do Conselho Mundial de Energia.\n\nEm setembro de 1992, pouco antes do afastamento de Collor da presidência\nda República, foi nomeado secretário nacional de Energia pelo ministro\nda Infra-Estrutura, Marcus Pratini de Morais. Renunciou ao cargo dois\nmeses depois, já no governo Itamar Franco, tornando-se então diretor do\nBNDESpar, empresa *holding* de participações acionárias do BNDES.\n\nEm março de 1993, substituiu Eliseu Resende como presidente da\nEletrobrás, assumindo o compromisso de promover a modernização\ninstitucional e o saneamento financeiro do setor de energia elétrica.\nCuidou especialmente da implantação da Lei nº 8.631, sancionada em 4 de\nmarço, tendo em vista a recuperação tarifária, a regularização dos\nfluxos financeiros setoriais e o equacionamento dos débitos das empresas\ndo sistema Eletrobrás junto ao Tesouro Nacional. A Lei nº 8.631 suprimiu\no regime de remuneração garantida e a equalização tarifária, mas\nreconheceu créditos da ordem de 20 bilhões de dólares das\nconcessionárias junto à União, relativos à chamada Conta de Resultados a\nCompensar (CRC). O problema da dívida entre as concessionárias e destas\ncom a União seria resolvido mediante complexa operação contábil\nconcluída em junho de 1994, mas ainda nesse ano a Eletrobrás foi\nnovamente onerada com a grande inadimplência das empresas do estado de\nSão Paulo, que deixaram de quitar débitos da ordem de um bilhão de\nreais. Dívidas da Eletrobrás e de suas subsidiárias com grandes\nempreiteiros, empresas de consultoria de engenharia e fornecedores, no\nmontante de oitocentos milhões de dólares, foram compostas e quitadas no\nfinal de 1993. Todo o contencioso de atrasos de pagamentos ao Paraguai,\ndecorrentes da Itaipu Binacional, foi composto e pago até abril de 1994.\n\nParalelamente ao processo de saneamento financeiro, Alquéres buscou\nampliar a liquidez e diversificar a base acionária da Eletrobrás. A\nparticipação da *holding* no movimento das bolsas de valores tornou-se\nbastante significativa. Suas ações passaram a compor o índice oficial\ndessas instituições, transformando-se em *blue chips* para o mercado. A\nparticipação dos acionistas minoritários no capital social da empresa\nchegou a 24% no final de 1994 (mais que o dobro da participação\nanterior). Esse crescimento se deveu em parte à operação de conversão de\n360 milhões de dólares em debêntures, ocorrida em maio de 1993. Por\norientação do presidente Itamar Franco, Alquéres prestou esclarecimentos\nsobre a operação, que teria implicado prejuízo ao patrimônio público,\nsegundo denúncias da imprensa.\n\nA gestão de Alquéres também foi marcada por seu empenho em promover a\nparticipação do capital privado na expansão do parque gerador de energia\nelétrica e por grande expectativa em relação à desestatização das\nempresas do grupo Eletrobrás. Duas subsidiárias, a Light e a Espírito\nSanto Centrais Elétricas S.A. (Escelsa), já figuravam desde 1992 no\nPrograma Nacional de Desestatização (PND).\n\nEm dezembro de 1993, o presidente Itamar Franco assinou o Decreto nº\n1.009, instituindo o Sistema Nacional de Transmissão de Energia Elétrica\n(Sintrel) com base em proposta elaborada pela Eletrobrás. O principal\nobjetivo do Sintrel era acelerar a atração de investimentos privados na\nárea de geração, mediante a abertura da malha de transmissão das\nsubsidiárias da Eletrobrás. Em princípio, o livre acesso à rede de\ntransporte de energia, mediante pagamento de pedágio, estimularia a\nprodução independente, a co-geração e parcerias na área de geração, além\nde incentivar a concorrência entre as próprias empresas geradoras.\n\nEm abril de 1994, Alquéres encaminhou ao presidente Itamar Franco\nproposta de divisão da Eletrobrás em duas empresas. A Eletrobrás\nParticipações (Eletropart) abarcaria o controle acionário de Furnas\nCentrais Elétricas, da Companhia Hidro Elétrica do São Francisco\n(CHESF), das Centrais Elétricas do Sul do Brasil (Eletrosul) e das\nCentrais Elétricas do Norte do Brasil (Eletronorte) e, a partir dessa\nincorporação, passaria a poder abrir seu capital e colocar as ações\ndessas empresas à venda em bolsas de valores. A Eletrobrás remanescente\ncontinuaria a atuar como banco de investimentos e agente coordenador do\nplanejamento da expansão e da operação dos sistemas elétricos\nbrasileiros, além de manter o controle das usinas nucleares e da parte\nbrasileira da Itaipu Binacional. Ainda em abril, porém, o presidente\nItamar Franco desautorizou a proposta, deixando a cargo do governo de\nseu sucessor a montagem do arcabouço institucional para a venda das\nsubsidiárias da Eletrobrás.\n\nAlquéres renunciou à presidência da Eletrobrás em dezembro de 1994,\nsendo substituído interinamente por Mário Fernando de Melo Santos. Em\nfevereiro de 1995, retirou-se do quadro da empresa por aposentadoria e\npassou a exercer atividades no setor privado. Em 1996, tornou-se\ndiretor-executivo da Companhia Bozano Simonsen Comércio e Indústria,\nempresa *holding*do grupo Bozano, Simonsen, de forte atuação na área\nindustrial, financeira e de privatizações, integrante do consórcio\nInvestimento Energético S.A. (Iven), que, em associação com a GTD\nParticipações, vencera o leilão de venda da Escelsa em junho de 1995,\nmarcando o início efetivo da privatização do setor elétrico federal.\nAlquéres presidiu o presidiu o Conselho de Administração da Escelsa até\nfinal de 1996. Em janeiro de 1999 fundou a JL Alquéres Engenharia\nConsultiva e, em abril de 2000, assumiu a presidência da Alstom Brasil\nLtda., empresa multinacional fabricante de turbinas, geradores,\nequipamentos de transmissão e de distribuição e material de transporte\nmetroviário.\n\nFoi um dos principais articuladores do consórcio Rio Minas Energia (RME)\nque, em março de 2006, firmou acordo com a Electricité de France (EDF)\npara a aquisição do controle acionário das empresas do grupo Light,\nnomeadamente a Light Energia (geração e transmissão), a Light Serviços\nde Eletricidade (concessionária de distribuição no Rio de Janeiro) e a\nLight Esco (comercializadora). Em agosto de 2006, após deixar a\npresidência da Alstom Brasil, assumiu o cargo de diretor-presidente do\ngrupo Light, como representante do consórcio RME, composto pela\nCompanhia Energética de Minas Gerais (Cemig), Andrade Gutierrez\nConcessões (AG Concessões), Pactual Energia Participações (Pactual\nEnergia) e Luce Brasil Fundo de Investimento em Participações (Luce). A\nRME tornou-se a primeira sociedade privada de capital nacional a\nadministrar a concessionária de energia elétrica em seus cem anos de\nexistência\n\nEm junho de 2007, Alquéres tornou-se primeiro vice-presidente da\nAssociação Comercial do Rio de Janeiro (ACRJ).\n\nCasado Beatriz Campbell Pena Alquéres, teve cinco filhos.\n\nPublicou o livro *Petrópolis* (2002), ilustrado por Mario Penna Bhering,\nex-presidente da Eletrobrás.\n\n* *\n\n*Gisela Moura/Paulo Brandi*\n\nFONTES: CACHAPUZ, P.B. *Panorama*; CURRIC. BIOG.; Eletrobrás. *Carta\nquinzenal;*Eletrobrás. *Legislação*(1993); Eletrobrás.\n*Relatório*(1993-1994); *Estado de S. Paulo* (19 e 24/4/94); *Folha de\nS. Paulo*(24/6/93); *Gazeta Mercantil*(8/4/94); *Jornal do Comércio*\n(7/4/94); Portal Canal Energia. Disponível em: \\<http://www.\ncanalenergia.com.br/zpublisher/materias/Busca.asp?id=52323\\>;\nPRESIDENTES.\n","ref":"FONTES: CACHAPUZ, P.B. *Panorama*; CURRIC. BIOG.; Eletrobrás. *Carta\nquinzenal;*Eletrobrás. *Legislação*(1993); Eletrobrás.\n*Relatório*(1993-1994); *Estado de S. Paulo* (19 e 24/4/94); *Folha de\nS. Paulo*(24/6/93); *Gazeta Mercantil*(8/4/94); *Jornal do Comércio*\n(7/4/94); Portal Canal Energia. Disponível em: \\<http://www.\ncanalenergia.com.br/zpublisher/materias/Busca.asp?id=52323\\>;\nPRESIDENTES.\n","dic":"DHBB"}
