{"title":"CRUVINEL, Virmondes","cargoss":["Deputado federal","Deputado federal","Deputado federal","Deputado federal"],"cargos_esp":[0,0,0,0],"datas_ini":[1999,1998,1997,1991],"datas_fim":[1999,0,0,1995],"estados":["GO","GO","GO","GO"],"autor":[0],"content":"**CRUVINEL, Virmondes**\n\n\\*dep. fed. GO 1991-1995, 1997, 1998, 1999.\n\n*Virmondes Borges Cruvinel* nasceu em Hidrolândia (GO) no dia 11 de maio\nde 1951, filho de Antônio Cruvinel Borges e de Cesarina Batista de Melo.\n\nFormou-se em odontologia pela Faculdade de Odontologia Dom Prudente, em\nAnápolis (GO), em 1977.\n\nIngressou na vida política em 1983 ao filiar-se ao Partido do Movimento\nDemocrático Brasileiro (PMDB). Ainda nesse ano, tornou-se chefe de\ngabinete da Secretaria de Educação. Em 1985, foi nomeado secretário de\nEducação do estado no governo de Íris Resende (1983-1986). Com o fim do\nprazo para desincompatibilização em abril de 1986, Virmondes Cruvinel\ndeixou o cargo de secretário e no pleito de novembro desse ano foi\neleito deputado estadual constituinte pelo PMDB.\n\nAssumiu o mandato em fevereiro de 1987 e logo após licenciou-se a fim de\ntornar-se secretário de Governo na gestão de Henrique Santillo\n(1987-1991). Deixou esse cargo em 1988, retornando à Assembléia\nLegislativa.\n\nDurante os trabalhos da Assembléia Estadual Constituinte atuou como\nmembro da Comissão de Constituição e Justiça, da Comissão de Finanças,\nda Comissão de Elaboração da Constituição Estadual e da Comissão de\nOrganização dos Municípios. Ainda nesta legislatura, atuou como delegado\ndo diretório regional e nacional do PMDB e membro do diretório\nmetropolitano desta agremiação.\n\nNo pleito de outubro de 1990 foi eleito deputado federal, assumindo sua\ncadeira na Câmara dos Deputados em fevereiro de 1991. Durante esta\nlegislatura, foi terceiro- vice-presidente da Comissão de Constituição e\nJustiça e de Redação e da Comissão de Educação, Cultura e Desporto,\nsuplente e titular da Comissão de Agricultura e Política Rural, suplente\nda Comissão de Seguridade Social e Família, da Comissão de Relações\nExteriores, da Comissão Especial Legislação Eleitoral e Partidária, da\nComissão Especial Crimes de Responsabilidade do Presidente da República,\ntitular da Comissão de Defesa do Consumidor, Meio Ambiente e Minorias,\nsuplente da comissão de Defesa Nacional, da Comissão Parlamentar de\nInquérito (CPI) contra a Exploração e a Prostituição Infanto-Juvenil,\ntitular da Comissão de Ciência e Tecnologia, Comunicação e Informática e\nsuplente da Comissão de Desenvolvimento Urbano e Interior. Atuou ainda\ncomo membro do diretório regional e membro do diretório metropolitano do\nPMDB.\n\nNa sessão da Câmara dos Deputados de 29 de setembro de 1992, votou a\nfavor da abertura do processo de *impeachment* contra o presidente\nFernando Collor de Melo, acusado de crime de responsabilidade por\nligações com um esquema de corrupção liderado pelo ex-tesoureiro de sua\ncampanha presidencial, Paulo César Farias. Afastado da presidência logo\napós a votação na Câmara, Collor renunciou ao mandato em 29 de dezembro\nde 1992, pouco antes da conclusão do processo pelo Senado Federal, sendo\nefetivado na presidência da República o vice Itamar Franco, que já vinha\nexercendo o cargo interinamente desde 2 de outubro.\n\nNas principais matérias constitucionais apresentadas na Câmara dos\nDeputados ao longo da legislatura 1991-1995, votou a favor da criação do\nFundo Social de Emergência (FSE), que permitia ao governo retirar\nrecursos de áreas como saúde e educação para ter maior liberdade de\nadministração das verbas, e da criação do Imposto Provisório sobre\nMovimentação Financeira (IPMF), tributo de 0,25% sobre transações\nbancárias. Votou contra o fim do voto obrigatório.\n\nNo pleito de outubro de 1994, concorreu à reeleição, conseguindo a\nprimeira suplência. Deixou a Câmara dos Deputados no dia 2 de janeiro de\n1995, último mês do mandato, e foi empossado secretário de Governo e\nJustiça de Goiás no governo de Maguito Vilela (1995-1998). Assumiu sua\nvaga o suplente Antônio de Jesus.\n\nEm abril de 1995, com o afastamento do titular Josias Gonzaga, deixou o\ncargo de secretário e assumiu a vaga na Câmara dos Deputados. Ainda\nnesse mês, licenciou-se do mandato e retornou à secretaria, permanecendo\nà frente desta até novembro de 1997, quando assumiu novamente uma vaga\nno Legislativo federal em virtude do falecimento do titular João Natal.\nNesse mesmo mês, voltou a licenciar-se na Câmara e passou a atuar\nnovamente como secretário de estado. Assumiu sua vaga o segundo suplente\nCarlos Mendes.\n\nVirmondes Cruvinel retornou à Câmara dos Deputados em outubro de 1998,\ndias depois licenciou-se pela terceira vez, retornando ao cargo no\ngoverno do estado de Goiás, em que permaneceu até o final do mandato do\ngovernador Maguito Vilela em dezembro. Assumiu o mandato a suplente Nair\nXavier Lobo.\n\nEm janeiro de 1999 reassumiu a vaga na Câmara dos Deputados,\npermanecendo na mesma até o final da legislatura, encerrada no último\ndia desse mês.\n\nEm 2000, tornou-se conselheiro do Tribunal de Contas dos Municípios de\nGoiás (TCM).\n\nEm 2005, O juiz Ari Ferreira de Queiroz, da 3ª Vara da Fazenda Pública\nEstadual de Goiânia, condenou os deputados estaduais goianos da\nlegislatura 1988/92, entre eles Virmondes Cruvinel, à devolução dos\n*jetons* - gratificação por participação nas sessões extraordinárias -\nrecebidas no período de 1º de outubro de 1988 a 31 de janeiro de 1991,\nacrescidos de juros de mora e correção monetária desde a data do efetivo\npagamento.\n\nEm setembro de 2009, continuava atuando como conselheiro do TCM.\n\nCasou-se com Maria Roselene Deusdará Cruvinel, deputada estadual pelo\nPMDB na legislatura 1999-2003, com quem teve três filhos.\n\nFONTES: CÂM. DEP. *Deputados brasileiros. Repertórios* (1991-1995,\n1995-1999); CÂM. DEP. *Relação de suplentes;*INF. BIOG.\n\n** **\n","ref":"FONTES: CÂM. DEP. *Deputados brasileiros. Repertórios* (1991-1995,\n1995-1999); CÂM. DEP. *Relação de suplentes;*INF. BIOG.\n\n** **\n","dic":"DHBB"}
