{"title":"CRUZ, Aquiles","cargoss":["Deputado federal","Deputado federal","Senador"],"cargos_esp":[0,0,0],"datas_ini":[1962,1960,1968],"datas_fim":[1962,1960,1968],"estados":["MA","MA","MA"],"autor":[0],"content":"**CRUZ, Aquiles**\n\n\\*dep. fed. MA 1960 e 1962; sen. MA 1968.\n\n \n\n*Aquiles de Almeida Cruz* nasceu em Caxias (MA) no dia 21 de fevereiro\nde 1905, filho de José Castelo Branco da Cruz e de Martinha Nunes de\nAlmeida.\n\nFormou-se pela Faculdade de Medicina da Universidade do Rio de Janeiro,\nna capital da República, e especializou-se em ginecologia e obstetrícia,\ntendo trabalhado como médico em diversas instituições da administração\npública e privada.\n\nDedicou-se à política a partir de outubro de 1958, quando obteve uma\nsuplência de deputado federal pelo Maranhão na legenda das Oposições\nColigadas, constituídas pela União Democrática Nacional (UDN), o Partido\nDemocrata Cristão (PDC) e o Partido Republicano (PR). Chegou a exercer o\nmandato na Câmara de junho a outubro de 1960, de março a junho e de\njulho a outubro de 1962. Com a extinção dos partidos políticos pelo Ato\nInstitucional nº 2 (27/10/1965) e a posterior instauração do\nbipartidarismo, filiou-se ao partido governista, a Aliança Renovadora\nNacional. Nessa legenda foi eleito em novembro de 1966 suplente do\nsenador maranhense Clodomir Millet, a quem substituiu no Senado de março\na agosto de 1968.\n\nAfastado da vida pública desde então, solicitou sua transferência do\nInstituto Nacional de Assistência Médica e Previdência Social (INAMPS)\nde Caxias para Belo Horizonte, onde passou a executar somente trabalhos\nburocráticos. Devido a problemas de saúde, aposentou-se em 1984.\n\nFaleceu em Belo Horizonte no dia 11 de maio de 1987.\n\nEra casado com Carmelita Simão Cruz, com quem teve oito filhos.\n\nPublicou a tese *Ascite na patologia infantil*.\n\n \n\nFONTES: CÂM. DEP. *Deputados*; CÂM. DEP. *Súmulas*; INF. FAM.; SENADO.\n*Dados*; SENADO. *Relação*; TRIB. SUP. ELEIT. *Dados* (4 e 8).\n\n \n","ref":"FONTES: CÂM. DEP. *Deputados*; CÂM. DEP. *Súmulas*; INF. FAM.; SENADO.\n*Dados*; SENADO. *Relação*; TRIB. SUP. ELEIT. *Dados* (4 e 8).\n\n \n","dic":"DHBB"}
