{"title":"CRUZ, Benjamim","cargoss":["Ministro do Trabalho"],"cargos_esp":[0],"datas_ini":[1962],"datas_fim":[1963],"estados":[0],"autor":[0],"content":"**CRUZ, Benjamim**\n\n\\*min. Trab. 1962-1963.\n\n \n\n*Benjamim Eurico Cruz* nasceu no Rio de Janeiro, então Distrito Federal,\nno dia 2 de maio de 1915, filho de Eurico Torres Cruz, juiz de direito,\ne de Marta Cavalcanti Cruz. Seu avô paterno, Joaquim Antônio da Cruz,\nfoi senador de 1890 a 1899 e deputado federal de 1906 a 1912. Seu avô\nmaterno, Domingos Olímpio Braga Cavalcanti, foi advogado, jornalista e\nescritor consagrado pelo romance Luzia-homem (1903).\n\nRealizou os estudos primários no Colégio Batista e os secundários no\nColégio Mallet Soares, ambos do Rio de Janeiro, bacharelando-se pela\nFaculdade de Direito da Universidade do Brasil.\n\nEm 1940, foi nomeado promotor público, cargo que recusou, e, no ano\nseguinte, tornou-se procurador-adjunto da Justiça do Trabalho de São\nPaulo. Transferido para o Rio de Janeiro em 1942, foi nomeado procurador\nregional da Justiça do Trabalho na 1ª Região e, em 1955, cursou a Escola\nSuperior de Guerra. Em 1959, lecionou nos cursos mantidos pela\nConfederação Nacional dos Trabalhadores na Indústria (CNTI) e pelo\nMinistério do Trabalho. Nomeado em 1961 procurador de primeira categoria\nda Justiça do Trabalho, foi diretor do Departamento de Organização e\nAssistência Sindical (DOAS) e membro conselheiro do plenário da Comissão\nde Imposto Sindical, tornando-se seu presidente em 1962. Exerceu também\nas funções de diretor-geral do Departamento Nacional do Trabalho (DNT)\ne, ainda em 1962, foi presidente da Comissão Permanente de Direito\nSocial e da Comissão de Enquadramento Sindical.\n\nEm dezembro de 1962, substituindo João Pinheiro Neto, Benjamim Cruz foi\nnomeado ministro do Trabalho e Previdência Social do governo de João\nGoulart, cargo pelo qual respondeu até janeiro de 1963, quando cedeu o\nlugar a Almino Afonso. Ainda neste último ano, tornou-se assessor\ntrabalhista do Ministério de Viação e Obras Públicas.\n\nFoi ainda assessor trabalhista da IBM do Brasil, assessor do diretor do\nDepartamento de Portos e Vias Navegáveis, conselheiro representante do\nMinistério do Trabalho junto a esse mesmo órgão, assessor do Ministério\nde Transportes e diretor da Divisão de Organização Sindical.\n\nEm 1975 aposentou-se como procurador de primeira categoria no Ministério\nPúblico da União, junto à Justiça do Trabalho, no Rio de Janeiro.\n\nEm fins da década de 1970, foi contratado pela Itaipu Binacional como\nassessor trabalhista, para compatibilizar as muitas diferenças em\ndireitos trabalhistas dos dois países envolvidos na construção da\nhidrelétrica, Brasil e Paraguai. Exerceu este trabalho em Foz do Iguaçu\n(PR) até maio de 1980. Retornando ao Rio de Janeiro, advogou num\nescritório até 1986.\n\nFaleceu no Rio de Janeiro em 1º de julho de 1992.\n\nFoi casado com Alda Mallet Soares, com quem teve um filho, e com Estela\nMaria Luísa Lockie Silveira Cruz, com quem teve cinco filhos.\n\n \n\nFONTES: CORRESP. MIN. TRAB.; Encic. Mirador; INF. FAM.; *Súmulas*;\n*Who’s who in Brazil*.\n\n \n","ref":"FONTES: CORRESP. MIN. TRAB.; Encic. Mirador; INF. FAM.; *Súmulas*;\n*Who’s who in Brazil*.\n\n \n","dic":"DHBB"}
