{"title":"CRUZ, Durval Rodrigues da","cargoss":["Constituinte","Senador"],"cargos_esp":[0,0],"datas_ini":[1946,1946],"datas_fim":[1946,1955],"estados":[0,"SE"],"autor":[0],"content":"**CRUZ, Durval Rodrigues da**\n\n\\*const. 1946; sen. SE 1946-1955.\n\n \n\n*Durval Rodrigues da Cruz* nasceu em Capela (SE) no dia 6 de julho de\n1902, filho de Tomás Rodrigues da Cruz e de Clara Rollemberg da Cruz.\n\nDiplomou-se em 1924 pela Faculdade de Medicina da Bahia.\n\nNo pleito de dezembro de 1945, elegeu-se senador por Sergipe à\nAssembléia Nacional Constituinte na legenda da coligação da União\nDemocrática Nacional (UDN) e do Partido Republicano (PR), assumindo o\nmandato em fevereiro de 1946. Participou dos trabalhos constituintes e,\ncom a promulgação da nova Carta (18/9/1946), passou a exercer o mandato\nordinário. Durante sua permanência no Senado, foi membro da Comissão de\nFinanças e da Comissão Especial de Inquérito para a Indústria Têxtil.\nConcluiu o mandato em janeiro de 1955.\n\nIndustrial, foi sócio da firma Cruz Irmão & Cia., da Fábrica de Tecidos\nSergipe Industrial, da Companhia Usinas de Sergipe e da Agrícola Santa\nLuzia, em Campos (RJ).\n\nFaleceu no dia 12 de julho de 1971.\n\n \n\nFONTES: BRAGA, S. *Quem foi quem*; CISNEIROS, A. *Parlamentares*;\n*Diário do Congresso Nacional*; Grande encic. Delta; SENADO. *Relação*;\nSILVA, G. *Constituinte*; TRIB. SUP. ELEIT. *Dados* (1).\n\n \n","ref":"FONTES: BRAGA, S. *Quem foi quem*; CISNEIROS, A. *Parlamentares*;\n*Diário do Congresso Nacional*; Grande encic. Delta; SENADO. *Relação*;\nSILVA, G. *Constituinte*; TRIB. SUP. ELEIT. *Dados* (1).\n\n \n","dic":"DHBB"}
