{"title":"ABRÃO, José","cargoss":["Deputado federal"],"cargos_esp":[0],"datas_ini":[1993],"datas_fim":[1995],"estados":["SP"],"autor":[0],"content":"**ABRÃO, José**\n\n\\*dep. fed. SP 1993-1995.\n\nJosé Abrão nasceu em Cabrália Paulista (SP) no dia 31 de março de 1945,\nfilho de Fahed Abrão e de Alice Lorena Abrão.\n\nBacharel pela Faculdade de Direito de Bauru (SP), em 1972, dois anos\ndepois concluiu o curso da Fundação Brasileira de Marketing, em São\nPaulo.\n\nFiliado ao Partido da Social Democracia (PSDB) desde 1988, candidatou-se\na deputado federal em outubro de 1990, obtendo uma suplência. Com a\nrenúncia de André Benassi, eleito para a prefeitura de Jundiaí (SP),\nJosé Abrão tomou posse em 4 de janeiro de 1993, logo assumindo a\npresidência da Comissão de Ciência e Tecnologia, Comunicação e\nInformática, e de duas Comissões Especiais — a que elaborou a reforma do\nregimento interno da Câmara dos Deputados e a que deu parecer sobre o\nprograma de estabilização do governo federal. Titular das Comissões de\nConstituição e Justiça e de Redação, em 1994, exerceu ainda a\nvice-liderança do partido e foi relator da medida provisória sobre o\nreajuste das mensalidades escolares.\n\nDurante o mandato votou a favor da criação do Imposto Provisório sobre\nMovimentação Financeira (IPMF), fonte suplementar de recursos destinados\nà saúde, e pela criação do Fundo Social de Emergência (FSE), que\npermitia ao governo gastar até 20% da arrecadação vinculada às áreas de\nsaúde e de educação. Também apoiou o fim do voto obrigatório.\n\nNo pleito de outubro de 1994 concorreu sem êxito à reeleição. Em\ndezembro, deu parecer favorável ao pedido de licença para que o deputado\nSérgio Barcelos, do Partido da Frente Liberal (PFL) do Amapá, fosse\nprocessado por ter mandado seqüestrar e espancar dois líderes\noposicionistas do seu estado. José Abrão deixou a Câmara dos Deputados\nao término da legislatura, em janeiro de 1995. No mês seguinte foi\nnomeado subsecretário para assuntos políticos da Casa Civil, com a\nmissão de auxiliar o ministro Clóvis Carvalho e articular apoio\nparlamentar ao Palácio do Planalto.\n\nFundador da TV Comunitária de Itapetininga e proprietário da Rádio\nDifusora 2000 de São Paulo, José Abrão trabalhou como repórter em\njornais e emissoras de rádio.\n\nCasado com Telma Gambaro Abrão, teve três filhos.\n\nFONTES: CÂM. DEP. *Deputados brasileiros. Repertório* (1991-1995);\n*Folha de S. Paulo* (15/4 e 18/9/94, 18/2/95);*Globo*(28/10/96,\n25/5/97).\n\n \n\n \n","ref":"FONTES: CÂM. DEP. *Deputados brasileiros. Repertório* (1991-1995);\n*Folha de S. Paulo* (15/4 e 18/9/94, 18/2/95);*Globo*(28/10/96,\n25/5/97).\n\n \n\n \n","dic":"DHBB"}
