{"title":"CUNHA, Godofredo Xavier da","cargoss":["Ministro do Supremo Tribunal Federal"],"cargos_esp":[0],"datas_ini":[1909],"datas_fim":[1931],"estados":[0],"autor":[0],"content":"**CUNHA, Godofredo Xavier da**\n\n\\*magistrado; min. STF 1909-1931.\n\n \n\n*Godofredo Xavier de Cunha* nasceu em Porto Alegre no dia 25 de\nfevereiro de 1860, filho de Félix Xavier da Cunha e de Josefina Pinto\nBandeira. Seu pai, um dos principais líderes do Partido Liberal\nRio-Grandense, foi deputado federal de 1861 a 1864. Sua mãe descendia de\nRafael Pinto Bandeira, importante figura na luta para a expulsão dos\ncastelhanos da Colônia do Sacramento.\n\nTransferindo-se em 1872 para o Rio de Janeiro, então capital do Império,\naí iniciou o curso de humanidades, concluindo-o em São Paulo, onde\ningressou a seguir na Faculdade de Direito. Bacharelou-se em março de\n1884 pela Faculdade de Direito de Recife.\n\nAinda nesse ano foi nomeado promotor público da comarca de Nova Friburgo\n(RJ), função que exerceu até abril de 1885, quando se tornou juiz\nmunicipal e de órfãos de Campos (RJ). Abolicionista, enfrentou nessa\nocasião fortes pressões por parte dos senhores de engenho daquele\nmunicípio, que concentrava o maior contingente de escravos da província\ndo Rio de Janeiro.\n\nCom a proclamação da República em 15 de novembro de 1889, à qual deu seu\napoio, foi nomeado no mesmo dia, pelo Governo Provisório chefiado pelo\nmarechal Deodoro da Fonseca, chefe de polícia do estado do Rio de\nJaneiro. Afastado do cargo em janeiro do ano seguinte, assumiu o posto\nde juiz de direito da comarca de Santo Antônio de Pádua (RJ), exercendo\nem seguida idêntica função no Distrito Federal. Ainda em 1890 foi\nnomeado juiz federal da seção do estado do Rio de Janeiro. Em 1896, no\nexercício desse cargo, requisitou pela primeira vez no país a força\nfederal para garantir o cumprimento de um *habeas-corpus*preventivo\nconcedido aos presidentes das mesas eleitorais de Campos, ameaçados em\nsua liberdade pela polícia estadual. Responsável pela eclosão de uma\ncrise política, esse episódio ocasionou o pedido de demissão do ministro\nda Justiça Alberto Torres (1896-1897). Provocou também o protesto no\nSenado Federal de Quintino Bocaiúva — sogro do próprio Godofredo Cunha —\nquanto ao caráter de intervenção federal de que se teria revestido.\n\nTransferido em 1897 para a seção do Distrito Federal, alcançou grande\npopularidade defendendo a autonomia do Poder Judiciário. Em setembro de\n1909 foi nomeado ministro do Supremo Tribunal Federal (STF) na vaga de\nAlberto Torres, tornando-se vice-presidente dessa corte em 1924 e\npresidente em fevereiro de 1927, por ocasião do falecimento de André\nCavalcanti de Albuquerque. Após a Revolução de 1930, em fevereiro de\n1931 foi aposentado discricionariamente — embora sob alegação de que\natingira o limite de idade — pelo Governo Provisório de Getúlio Vargas,\njuntamente com mais cinco magistrados, tendo protestado em vão contra a\nmedida.\n\nFaleceu no Rio de Janeiro no dia 2 de agosto de 1936.\n\nEra casado com Emérita Bocaiúva Cunha, filha de Quintino Bocaiúva,\nimportante líder republicano que, após a proclamação da República,\nocupou os cargos de ministro da Agricultura (1889) e das Relações\nExteriores (1889-1891) e foi senador de 1890 a 1891, de 1892 a 1899 e de\n1909 a 1918. Seu filho Ranulfo Bocaiúva Cunha foi deputado federal de\n1924 a 1930 e ministro do Superior Tribunal Militar de 1946 a 1957. Seu\nneto Luís Fernando Bocaiúva Cunha foi deputado federal de 1959 a 1964 e\nnovamente a partir de 1983.\n\n \n\n \n\nFONTES: COSTA, E. *Grandes; Grande*e*ncic.* *Delta; Grande encic.*\n*portuguesa;*LAGO, L. *Supremo.*\n\n \n","ref":"FONTES: COSTA, E. *Grandes; Grande*e*ncic.* *Delta; Grande encic.*\n*portuguesa;*LAGO, L. *Supremo.*\n\n \n","dic":"DHBB"}
