{"title":"CUNHA, Marcus","cargoss":["Deputado federal"],"cargos_esp":[0],"datas_ini":[1979],"datas_fim":[1983],"estados":["PE"],"autor":[0],"content":"**CUNHA, Marcus**\n\n\\*dep. fed. PE 1979-1983.\n\n*Marcus Antônio Soares da Cunha* nasceu em Bezerros (PE) no dia 14 de\nmarço de 1941, filho de José Reginaldo Cunha e de Maria de Lurdes Soares\nda Cunha.\n\nBacharel em ciências jurídicas e sociais pela Faculdade de Direito da\nUniversidade Católica de Pernambuco, candidatou-se à Câmara Municipal em\n1972 na legenda do Movimento Democrático Brasileiro (MDB), partido de\noposição ao regime militar instalado no país em abril de 1964. Eleito,\ntomou posse no início do ano seguinte. Em 1974 elegeu-se deputado\nestadual pelo MDB, assumindo uma cadeira na Assembléia Legislativa de\nPernambuco em fevereiro de 1975. Ao longo deste mandato, foi membro da\nComissão de Justiça e vice-líder da minoria.\n\nEm agosto de 1977, após denunciar os maus-tratos ao preso político\nSamuel Firmino de Oliveira e de ser advertido pelo líder do governo no\nSenado, Eurico Resende, respondeu à recomendação do representante\ncapixaba com um telegrama no qual o aconselhava “a rever antecedentes de\nocorrências lamentáveis verificadas na penitenciária Barreto Campelo”,\nsituada na ilha de Itamaracá (PE). No telegrama, depois de indagar pelo\nparadeiro de estudantes desaparecidos, sugeriu que o governo reativasse\no Conselho de Defesa dos Direitos Humanos, “que há tanto tempo não se\n(reunia), porque o ministro da Justiça não (queria)”.\n\nEm novembro de 1978 foi eleito deputado federal, sempre na legenda do\nMDB, tomando posse em fevereiro seguinte. Durante este mandato foi\nmembro e presidente da Comissão de Agricultura e Política Rural e\nsuplente da Comissão de Relações Exteriores.\n\nCom relação ao governo do general João Batista Figueiredo, que tomava\nposse naquela mesma ocasião, Marcus Cunha declarou que suas expectativas\nnão eram nada otimistas, já que os nomes anunciados para os ministérios\n— Andreazza, Simonsen, Golberi, Delfim Neto e Rischbieter — significavam\na essência dos quatro governos anteriores e uma síntese perfeita do\nregime que tutelava a nação desde 1964: “Teremos o resumo do arbítrio,\nda tortura, da violência, da repressão, do entreguismo e da corrupção”,\nafirmou. Segundo o parlamentar, os nomes anunciados, além de nunca terem\nestado comprometidos com a normalidade democrática, representavam o\ninteresse das multinacionais: “Basta refrescar a memória para tirar\nessas conclusões: a ponte Rio-Niterói, a Transamazônica, a Dow Chemical,\no Projeto Jari, Angra dos Reis, o IBAD, os índices falsos do custo de\nvida, a repressão do IPMS e do Serviço Nacional de Informações (SNI) são\napenas alguns exemplos.” Na mesma entrevista, Marcus Cunha declarou que\nos parlamentares do MDB só acreditariam em redemocratização, quando se\ndesse atenção às exigências fundamentais do povo. Afirmou ainda que não\nacreditava num governo que se iniciava sob a ameaça de novos contratos\nde risco para a exploração “racional” da Amazônia, que recebeu como\nherança uma dívida de 42 bilhões de dólares, e que, *a* *priori*, se\nrecusava a pacificar a nação.\n\nCom o fim do bipartidarismo em novembro de 1979 e a conseqüente\nreorganização partidária, Marcus Cunha transferiu-se para o Partido do\nMovimento Democrático Brasileiro (PMDB), que substituiu o extinto MDB na\noposição ao regime militar. Deixou a Câmara dos Deputados em janeiro de\n1983, ao final da legislatura, sem disputar a reeleição. Candidatou-se,\nno entanto, a uma cadeira na Assembléia Legislativa de Pernambuco em\nnovembro de 1982. Eleito, assumiu o mandato em fevereiro de 1983.\n\nEm novembro de 1986 reelegeu-se deputado estadual na legenda\npeemedebista, assumindo o mandato em fevereiro seguinte. Entre 1987 e\n1988 foi secretário da Casa Civil, no governo Miguel Arrais (1987-1990),\ncargo que deixou para disputar a prefeitura de Recife em novembro de\n1988, sempre pelo PMDB. Mesmo contando com o apoio do então prefeito da\ncapital pernambucana, Jarbas Vasconcelos, foi derrotado ainda no\nprimeiro turno pelo candidato do Partido da Frente Liberal (PFL),\nJoaquim Francisco. Voltou então a exercer o mandato de deputado estadual\naté o término da legislatura, não tendo se candidatado à reeleição no\npleito de outubro do ano anterior.\n\nEntre 1990 e 1992 foi assessor da prefeitura de Jaboatão dos Guararapes\n(PE), na administração de Geraldo Melo (1989-1992), seu correligionário\ndo PMDB. Com a posse de Jarbas Vasconcelos na prefeitura do Recife em\n1993, passou a exercer o mesmo cargo, agora no governo da capital\npernambucana.\n\nLigado ao grupo político de Jarbas Vasconcelos, Marcus Cunha atuou em\nsua campanha para o governo do estado, no pleito de outubro de 1998,\nquando o candidato articulou uma ampla coligação, que envolveu,\ninclusive, o PFL, agremiação tradicionalmente rival do PMDB no estado.\nDesta vez, o candidato peemedebista foi eleito já no primeiro turno da\ndisputa, com cerca de 65% dos votos válidos, derrotando o governador\nMiguel Arrais, que tentava a reeleição.\n\nCom a posse de Jarbas Vasconcelos em janeiro de 1999, Marcus Cunha\npassou a ocupar o cargo de assessor da Secretaria de Governo do Estado\nde Pernambuco.\n\n \n\nSérgio Montalvão\n\nFONTES: CÂM. DEP.*Deputados brasileiros. Repertório* (1979-1983); INF.\nBIOG.; *Jornal do Brasil*(21/8/77, 21/1/79).\n\n \n","ref":"FONTES: CÂM. DEP.*Deputados brasileiros. Repertório* (1979-1983); INF.\nBIOG.; *Jornal do Brasil*(21/8/77, 21/1/79).\n\n \n","dic":"DHBB"}
