{"title":"ALVARENGA, Manuel Caldeira de","cargoss":["Deputado federal"],"cargos_esp":[0],"datas_ini":[1935],"datas_fim":[1937],"estados":["DF"],"autor":[0],"content":"**ALVARENGA, Manuel Caldeira de**\n\n\\*dep. fed. DF 1935-1937.\n\n \n\n*Manuel Caldeira de Alvarenga* nasceu na Fazenda de Grumaú, em\nGuaratiba, bairro da cidade do Rio de Janeiro, então capital do Império,\nno dia 3 de julho de 1875, filho de Francisco Caldeira de Alvarenga,\nfazendeiro, e de Mafalda Teixeira de Alvarenga, professora pública.\n\nEstudou humanidades no Colégio Santa Rosa, em Niterói. Ainda estudante,\nparticipou da Campanha Civilista, movimento de caráter antimilitarista\nque, em 1909-1910, promoveu a candidatura de Rui Barbosa à presidência\nda República em oposição à do marechal Hermes da Fonseca, afinal eleito\nem março de 1910. Concluiu o curso de humanidades em 1912, ingressando\nem seguida na Faculdade de Ciências Jurídicas e Sociais do Rio de\nJaneiro, pela qual se bacharelou em 1917.\n\nLogo após diplomar-se, instalou uma banca de advocacia no Rio de Janeiro\ne, em 1923, exerceu o cargo de chefe de polícia do Distrito Federal.\nNovamente no exercício da advocacia, foi nomeado em 1930 consultor\njurídico da Prefeitura do Distrito Federal, cargo que deixou com o\nadvento da Revolução de 1930 em virtude de sua ligação com o presidente\ndeposto, Washington Luís.\n\nEm março de 1933 participou da fundação do Partido Autonomista do\nDistrito Federal. Organizado por uma comissão integrada por Pedro\nErnesto Batista — então interventor no Distrito Federal —, Pedro Aurélio\nde Góis Monteiro, João de Mendonça Lima e João Alberto Lins de Barros, o\npartido obteve o apoio de Getúlio Vargas, que viu na nova organização\numa possibilidade de reconciliação entre os “tenentes” e os políticos\nque contestavam o Governo Provisório. Essa expectativa baseava-se no\ngrande prestígio de que gozava Pedro Ernesto tanto entre as forças\ntenentistas como entre a população do Distrito Federal.\n\nEm maio do mesmo ano concorreu a um mandato de deputado à Assembléia\nNacional Constituinte na legenda do Partido Autonomista do Distrito\nFederal, obtendo contudo apenas uma suplência. Concluídos os trabalhos\nconstituintes e proclamada a nova Constituição em 16 de julho de 1934,\nelegeu-se no pleito de outubro seguinte deputado federal na legenda do\nPartido Autonomista do Distrito Federal. Empossado em maio de 1935, foi\neleito secretário da mesa da Câmara, cargo a que renunciou em virtude da\nintervenção federal no Distrito Federal em abril de 1936, que resultou\nna cassação de Pedro Ernesto e no fim da autonomia do Distrito Federal.\nTeve o mandato suspenso em novembro de 1937 pelo golpe que implantou o\nregime do Estado Novo. Com o recesso das atividades políticas, retornou\nem 1939 à função de advogado da Prefeitura do Distrito Federal.\n\nAtuou também na Frente Única da Política Carioca, no Movimento\nLibertador da Terra Carioca e na União Autonomista Carioca, tendo\nintegrado ainda a comissão encarregada de estudar a reforma judiciária.\n\nFaleceu no Rio de Janeiro no dia 17 de janeiro de 1954.\n\nEra casado com Maria José da Costa Alvarenga.\n\n \n\nFONTES: ASSEMB. NAC. CONST. 1934. *Anais; Boletim*Min. Trab. (5/36);\nCÂM. DEP. *Deputados;*CÂM. DEP. *Relação nominal*; *Diário do Congresso\nNacional; Tribuna da* *Imprensa*(18/1/54).\n\n \n","ref":"FONTES: ASSEMB. NAC. CONST. 1934. *Anais; Boletim*Min. Trab. (5/36);\nCÂM. DEP. *Deputados;*CÂM. DEP. *Relação nominal*; *Diário do Congresso\nNacional; Tribuna da* *Imprensa*(18/1/54).\n\n \n","dic":"DHBB"}
