{"title":"CUNHA, Wilson","cargoss":["Deputado federal"],"cargos_esp":[0],"datas_ini":[1951],"datas_fim":[1955],"estados":["ES"],"autor":[0],"content":"**CUNHA, Wilson**\n\n\\*dep. fed. ES 1951-1955.\n\n*Wilson Neves da Cunha* nasceu em São Mateus (ES) no dia 13 de setembro\nde 1910, filho de Vantuil Rodrigues da Cunha e de Adélia Nunes da Cunha.\n\nRealizou seus estudos no Colégio Americano e no Colégio São Vicente de\nPaula.\n\nProprietário rural, iniciou sua vida política como prefeito municipal de\nColatina (ES). Nas eleições de janeiro de 1947, elegeu-se deputado à\nAssembléia Constituinte do Espírito Santo na legenda do Partido\nRepublicano (PR). Ocupando a cadeira em março desse ano, participou dos\ntrabalhos constituintes e, com a transformação da Constituinte estadual\nem Legislativo ordinário, permaneceu no exercício do mandato.\nElegendo-se em outubro de 1950 deputado federal pelo Espírito Santo na\nlegenda do Partido Social Democrático (PSD) deixou a Assembléia em\njaneiro de 1951 e em fevereiro seguinte assumiu o mandato na Câmara\nFederal. No pleito de outubro de 1954, candidatou-se à reeleição na\nlegenda da Coligação Democrática formada pelo Partido Trabalhista\nBrasileiro (PTB), o Partido Republicano (PR), o Partido de Representação\nPopular (PRP) e o Partido Social Progressista (PSP), obtendo apenas uma\nsuplência. Encerrou o mandato em janeiro de 1955, não mais retornando à\nCâmara dos Deputados.\n\nCandidato a senador pelo Partido Socialista Brasileiro (PSB) no pleito\nde outubro de 1958, não conseguiu se eleger.\n\nCasou-se com Maria Aparecida Neves da Cunha.\n\nPublicou*Possibilidades econômicas do Espírito Santo.*\n\nFONTES: CÂM. DEP. *Deputados;*CÂM. DEP.*Deputados brasileiros.\nRepertório*(1946-1967);**CÂM. DEP. *Relação dos dep.;* CISNEIROS, A.\n*Parlamentares;*SOC. BRAS. EXPANSÃO COMERCIAL. *Quem*.\n\n \n","ref":"FONTES: CÂM. DEP. *Deputados;*CÂM. DEP.*Deputados brasileiros.\nRepertório*(1946-1967);**CÂM. DEP. *Relação dos dep.;* CISNEIROS, A.\n*Parlamentares;*SOC. BRAS. EXPANSÃO COMERCIAL. *Quem*.\n\n \n","dic":"DHBB"}
