{"title":"CUNHA, Wilson","cargoss":["Deputado federal"],"cargos_esp":[0],"datas_ini":[1995],"datas_fim":[1999],"estados":["SE"],"autor":[0],"content":"**CUNHA, Wilson**\n\n\\*dep. fed. SE 1995-1999.\n\n \n\n*José Wilson**da**Cunha* nasceu em Itabaiana (SE) no dia 10 de agosto de\n1951, filho de Antônio Francisco da Cunha e de Joana Perpétua da Cunha.\n\nFiliado desde 1975 ao Movimento Democrático Brasileiro (MDB), partido de\noposição ao regime militar instaurado no país em abril de 1964. Com a\nextinção do bipartidarismo, em novembro de 1979, e a posterior\nreorganização partidária, ingressou no Partido Democrático Social (PDS).\nFuncionário público, elegeu-se vereador de Itabaiana nas eleições de\nnovembro de 1982, transferindo-se nesse mesmo ano para o Partido\nDemocrático Trabalhista (PDT). Reeleito em novembro de 1988, conquistou\no mandato de deputado estadual em outubro de 1990. Titular da Comissão\nde Constituição e Justiça, em 1991 migrou para o PMDB, assumindo a\nliderança do partido na Assembleia Legislativa.\n\nNas eleições de outubro de 1994, elegeu-se deputado federal. Em 1995\nfiliou-se ao Partido da Frente Liberal (PFL). Titular das comissões de\nDireitos Humanos e de Trabalho, Administração e Serviço Público, e\nsuplente da Comissão de Finanças e Tributação, votou a favor da quebra\ndo monopólio estatal nos setores de telecomunicações, exploração de\npetróleo e navegação de cabotagem; da mudança no conceito de empresa\nnacional; da prorrogação por 18 meses do Fundo Social de Emergência\n(FSE), rebatizado de Fundo de Estabilização Fiscal (FEF), que permitia\nao governo gastar até 20% da arrecadação vinculada às áreas de saúde e\nde educação.\n\nEm julho de 1996, votou a favor do projeto de emenda constitucional do\nsenador Antônio Carlos Valadares, do Partido Socialista Brasileiro\n(PSB-SE), que criou a Contribuição Provisória sobre Movimentação\nFinanceira (CPMF), substituindo o Imposto Provisório sobre Movimentação\nFinanceira como fonte suplementar de recursos destinados à saúde\npública.\n\nEm janeiro e fevereiro de 1997, votou a favor da emenda que permitia a\nreeleição de prefeitos, governadores e presidente da República. Em\nnovembro do mesmo ano, já filiado ao Partido Trabalhista Brasileiro\n(PTB), licenciou-se para ocupar a Secretaria Especial de Assuntos\nParlamentares do governo de Sergipe. Sua vaga foi ocupada pelo suplente\nMessias Góis. Voltou ao Legislativo Federal em 2 de abril de 1998,\nausentando-se novamente no dia seguinte, alegando motivos de saúde e a\nnecessidade de tratar de questões particulares. Substituído mais uma vez\npor Messias Góis, retornou somente em agosto quando expirou sua licença\nde 120 dias.\n\nEm novembro de 1998, votou a favor do teto de R\\$1.200 para\naposentadorias no setor público, e do estabelecimento de idade mínima e\ntempo de contribuição para os trabalhadores no setor privado, itens\nfundamentais da reforma da Previdência. Em janeiro de 1999,\nposicionou-se favoravelmente à aprovação da lei de cobrança\nprevidenciária de inativo. Sem tentar a reeleição, deixou a Câmara ao\ntérmino da legislatura em 31 de janeiro de 1999.\n\nEm 2002 candidatou-se novamente a deputado federal por Sergipe agora na\nlegenda do Partido Socialista Brasileiro (PSB). Obteve uma suplência.\nFiliado ao Partido da Frente Liberal (PFL), nas eleições municipais de\n2004, concorreu a vereador de Itabaiana e conquistou uma suplência.\n\nAo longo de sua vida fez o curso de contabilidade.\n\nCasou-se com Vânia Maria Barreto Cunha, com quem teve quatro filhos.\n\n \n\n \n\nFONTES: CÂM. DEP. *Deputados brasileiros. Repertório*(1995-1999); *Folha\nde S. Paulo* (14/1/96, 30/1 e 8/10/97); *Globo*(29/1 e 26/2/97),\nwww.tse.gov.br.\n\n \n","ref":"FONTES: CÂM. DEP. *Deputados brasileiros. Repertório*(1995-1999); *Folha\nde S. Paulo* (14/1/96, 30/1 e 8/10/97); *Globo*(29/1 e 26/2/97),\nwww.tse.gov.br.\n\n \n","dic":"DHBB"}
