{"title":"CURY, Sérgio","cargoss":["Deputado federal"],"cargos_esp":[0],"datas_ini":[1991],"datas_fim":[1995],"estados":["RJ"],"autor":[0],"content":"CURY, Sérgio\n\n\\*dep. fed. RJ 1991-1995.\n\nSérgio Roberto Pacheco Cury nasceu no Rio de Janeiro, então Distrito\nFederal, em 28 de dezembro de 1953, filho de Jorge Said Cury e de Judith\nPacheco Cury. Seu pai foi deputado federal pelo Rio de Janeiro\n(1963-1966 e 1976-1987).\n\nEm 1975, Sérgio Cury  iniciou o curso de direito na Faculdade Brasileira\nde Ciências Jurídicas, no Rio de Janeiro, concluindo-o em 1979.\nProcurador da Câmara Municipal de Niterói em 1981, no ano seguinte foi\nassessor de gabinete do prefeito Armando Barcelos, de Niterói. Filiado\ninicialmente ao Partido do Movimento Democrático Brasileiro (PMDB), mais\ntarde transferiu-se para o Partido Democrático Trabalhista (PDT), em\ncuja legenda concorreu a uma cadeira de deputado federal no pleito de\noutubro de 1990.\n\nEleito com o apoio do vereador Jorge Felipe, do PDT, e dos sindicatos\npara os quais advogava, tomou posse no cargo em fevereiro de 1991,\nparticipando dos trabalhos legislativos como titular da Comissão de\nRelações Exteriores e como suplente na Comissão de Constituição e\nJustiça e de Redação.\n\nEm 29 de setembro de 1992, votou a favor da abertura de um processo de\n*impeachment* contra o presidente da República, Fernando Collor de Melo,\nacusado de crime de responsabilidade por ligações com um esquema de\ncorrupção liderado pelo tesoureiro de sua campanha presidencial, Paulo\nCésar Farias. Afastado da presidência logo após a votação da Câmara,\nCollor renunciou ao mandato em 29 de dezembro de 1992, pouco antes da\nconclusão do processo pelo Senado Federal, sendo efetivado na\npresidência da República o vice Itamar Franco, que já vinha exercendo o\ncargo interinamente desde o dia 2 de outubro.\n\nNas principais matérias constitucionais apresentadas ao longo da\nlegislatura 1991-1995, Sérgio Cury esteve ausente nas votações do fim do\nvoto obrigatório, da criação do Imposto Provisório sobre Movimentação\nFinanceira (IPMF), imposto de 0,25% sobre transações bancárias criado\ncomo fonte complementar de recursos para a saúde, e da instituição do\nFundo Social de Emergência (FSE), que permitiu ao governo retirar\nrecursos de áreas como saúde e educação para ter maior liberdade de\nadministração das verbas.\n\nNo pleito de outubro de 1994 concorreu à reeleição, ainda na legenda do\nPDT, porém não teve sucesso. Devido a suspeitas de fraudes na apuração\ndos resultados, a eleição para deputados e senadores foi anulada por\ndeterminação do Tribunal Regional Eleitoral (TRE) e na nova votação,\nrealizada em novembro, mais uma vez Cury não se elegeu. Deixou, com\nisso, a Câmara em janeiro do ano seguinte, quando terminou seu mandato.\n\nCasou-se com Míriam Itabaiana Nicolau Cury, com quem teve dois filhos.\n\nFONTES:****CÂM. DEP.  *Deputados brasileiros. Repertório*(1991-1995);\n*Folha de S*.*Paulo* (18/9/94); *Globo* (20/3/96); *Perfil\nparlamentar/IstoÉ*(1991).\n\n \n","ref":"FONTES:****CÂM. DEP.  *Deputados brasileiros. Repertório*(1991-1995);\n*Folha de S*.*Paulo* (18/9/94); *Globo* (20/3/96); *Perfil\nparlamentar/IstoÉ*(1991).\n\n \n","dic":"DHBB"}
