{"title":"DANTAS, Cícero ==============","cargoss":["Governador de estado ou do Distrito Federal","Deputado federal"],"cargos_esp":[0,0],"datas_ini":[1955,1963],"datas_fim":[1955,1971],"estados":["BA","BA"],"autor":[0],"content":"DANTAS, Cícero\n==============\n\n\\*  gov.  BA 1955; dep. fed.  BA 1963-1971.\n\n \n\n*Cícero Dantas Martins*nasceu na Bahia em 29 de janeiro de 1897, filho\nde João da Costa Pinto Dantas, deputado federal de 1903 a 1905 e de 1935\na 1937, e de Ana Adelaide Ribeiro dos Santos Dantas. Seu avô paterno,\nCícero Dantas Martins, foi barão de Gerimoabo e deputado federal de 1869\na 1875 e em 1878. Seu irmão, João da Costa Pinto Dantas Júnior, foi\ndeputado estadual entre 1921 e 1922, constituinte em 1946, secretário da\nfazenda no governo de Otávio Mangabeira (1947-50) e deputado federal de\n1950 a 1959.\n\nFormou-se pela Faculdade de Medicina da Universidade da Bahia em 1919,\ningressando depois na vida política e elegendo-se deputado à Assembléia\nLegislativa baiana, na qual per­maneceu de 1923 a 1930, quando a vitória\ndo movimento revolucionário de outubro suspen­deu o funcionamento das\ncâmaras legislativas do país. Dedicou-se então às suas propriedades\nfundiárias em Mata de São João, na Bahia e demais regiões do nordeste,\ntrabalhando por um curto período como presidente delegado da comissão de\nsalário mínimo do Ministério do Trabalho.\n\nApós o fim do Estado Novo em 1945, voltou à política, elegendo-se\nnovamente  deputado estadual em 1947 na legenda da União Democrática\nNacional (UDN).  Sucessi­vamente reeleito em 1950 e em 1954, perma­neceu\nna Assembléia estadual até 1959.  Nesse período, exerceu a segunda\nvice-presidência da casa, a primeira vice-presidência de 1952 a 1954 e a\npresidência em 1955, ano em que chegou a assumir interinamente o governo\ndo estado por ocasião de licença de Antônio Balbino.\n\nCandidato a deputado federal no pleito de outubro de 1958, obteve apenas\na sétima su­plência pela Bahia na legenda da UDN, não chegando a exercer\no mandato na legislatura de 1959-1963. Tornou a candidatar-se nas\neleições seguintes no pleito de outubro de 1962, obten­do dessa vez a\nquarta suplência na legenda da Aliança Democrática Trabalhista Cristã da\nBahia, coligação entre o Partido Social Demo­crático (PSD), o Partido\nDemocrata Cristão (PDC), o Partido Trabalhista Nacional (PTN), o Partido\nSocial Progressista (PSP) e o Partido Socialista Brasileiro (PSB).\nAssumiu o manda­to  no início da legislatura, em 1^o^ de fevereiro de\n1963.\n\nEm conseqüência da extinção dos parti­dos políticos pelo Ato\nInstitucional nº. 2 (27/10/1965), e da posterior instauração do\nbipartidarismo, filiou-se à Aliança Renovadora Nacional (Arena), partido\nde sustentação ao regime militar instalado no país em abril de 1964. Por\nesta legenda concorreu à reeleição no pleito de novembro de 1966,\nobtendo a terceira suplência mas sendo recon­duzido à Câmara novamente\nno início da le­gislatura, em fevereiro de 1967.\n\nNo pleito de novembro de 1970, elegeu-se suplente do senador Heitor Dias\nPereira, da Arena baiana.  Deixou a Câmara em janeiro de 1971, não\nchegando a ser convocado para o Senado.\n\nFaleceu em Salvador no dia 16 de junho de 1981.\n\n         Era casado com Elza Correia Dantas e no segundo matrimônio com\nLeonor Soares Bahia Dantas, com quem teve dois filhos. Seu sobrinho,\nJoão Carlos Tourinho Dantas, foi deputado federal pela Bahia de 1963 a\n1975, e seu sobrinho-neto Sérgio Tourinho Dantas foi deputado federal,\ntambém pela Bahia, entre 1992 e 1995.\n\nPublicou, além de discursos, *Das mastites* *agudas*(tese, 1918) e\n*Profilaxia da sífilis*e *Moléstias venéreas do Exército*(1922).\n\n \n\nFONTES:               CÂM.  DEP.  *Deputados brasileiros.*\n*Repertório*(1946-1967, 1963-1967 e 1967-1971); INF. João Carlos\nTourinho Dantas; TRIB. SUP.  ELEIT.  Da­*dos*(1, 2, 3, 4, 6, 8 e 9).\n\n \n","ref":"FONTES:               CÂM.  DEP.  *Deputados brasileiros.*\n*Repertório*(1946-1967, 1963-1967 e 1967-1971); INF. João Carlos\nTourinho Dantas; TRIB. SUP.  ELEIT.  Da­*dos*(1, 2, 3, 4, 6, 8 e 9).\n\n \n","dic":"DHBB"}
