{"title":"DANTAS, Etelvir","cargoss":["Deputado federal"],"cargos_esp":[0],"datas_ini":[1983],"datas_fim":[1987],"estados":["BA"],"autor":[0],"content":"DANTAS, Etelvir\n\n\\*dep. fed. BA 1983-1987.\n\n*Francisco Etelvir Dantas* nasceu em Saboeiro (CE) no dia 16 de janeiro\nde 1935, filho de Francisco Estrela Dantas e de Francisca Egisa Alves.\n\nIniciou sua vida política em 1978, elegendo-se, em novembro deste ano,\ndeputado estadual pela Aliança Renovadora Nacional (Arena), partido de\nsustentação ao regime militar instaurado no país em abril de 1964.\nEmpossado em fevereiro de 1979, integrou, na Assembléia Legislativa da\nBahia, a Comissão de Desenvolvimento Econômico do Estado da Bahia, tendo\nsido ainda vice-presidente da Comissão de Turismo. Com o fim do\nbipartidarismo, ocorrido em novembro de 1979, e a conseqüente\nreformulação partidária, filiou-se ao Partido Democrático Social (PDS),\nagremiação que deu continuidade à Arena.\n\nEleito deputado federal pela Bahia, na legenda do PDS, em novembro de\n1982, iniciou o mandato na Câmara dos Deputados em fevereiro do ano\nseguinte. Nesse mesmo ano, foi membro titular da Comissão de Economia,\nIndústria e Comércio e suplente da Comissão de Finanças.\n\nEm 25 de abril de 1984 ausentou-se na votação da emenda Dante de\nOliveira, que, apresentada na Câmara dos Deputados, propôs o\nrestabelecimento das eleições diretas para presidente da República em\nnovembro daquele ano. Como a emenda não obteve o número de votos\nindispensáveis à sua aprovação — faltaram 22 para que o projeto pudesse\nser encaminhado à apreciação pelo Senado Federal —, no Colégio\nEleitoral, reunido em 15 de janeiro de 1985, Etelvir Dantas votou no\ncandidato oposicionista Tancredo Neves, eleito novo presidente da\nRepública pela Aliança Democrática, uma união do Partido do Movimento\nDemocrático Brasileiro (PMDB) com a dissidência do PDS abrigada na\nFrente Liberal. Contudo, por motivo de doença, Tancredo Neves não chegou\na ser empossado na presidência, vindo a falecer em 21 de abril de 1985.\nSeu substituto no cargo foi o vice José Sarney, que já vinha exercendo\ninterinamente o cargo, desde 15 de março deste ano.\n\nNo pleito de novembro de 1986, Etelvir Dantas concorreu, sem sucesso, a\numa vaga de deputado federal constituinte, desta vez pela legenda do\nPartido da Frente Liberal (PFL). Deixou a Câmara dos Deputados em\njaneiro de 1987, ao final da legislatura, abandonando a carreira\npolítica.\n\nEmpresário do setor de supermercados, ocupou a vice-presidência da\nAssociação Baiana e Sergipana de Supermercados. Foi diretor-presidente\nde várias empresas e, entre outras atividades empresariais, diretor da\nAssociação Nacional dos Produtores de Álcool, membro do Comitê\nInternacional das Empresas de Supermercados, sediada em Paris e do Food\nMarketing Institute, em Houston, Estados Unidos. Posteriormente, passou\na dedicar-se à produção de soja e à criação de gado.\n\nCasou-se com Zildene Rocha Dantas, com quem teve cinco filhos.\n\nFONTES: ASSEMB. NAC. CONST. *Repertório*(1987-1988); CÂM. DEP.\n*Deputados brasileiros. Repertório*(1983-1987); *Globo* (26/4/84,\n16/1/85); INF. Luci Dantas.\n\n \n","ref":"FONTES: ASSEMB. NAC. CONST. *Repertório*(1987-1988); CÂM. DEP.\n*Deputados brasileiros. Repertório*(1983-1987); *Globo* (26/4/84,\n16/1/85); INF. Luci Dantas.\n\n \n","dic":"DHBB"}
