{"title":"DANTAS, Orlando ===============","cargoss":["Deputado federal"],"cargos_esp":[0],"datas_ini":[1951],"datas_fim":[1955],"estados":["SE"],"autor":[0],"content":"DANTAS, Orlando\n===============\n\n\\*  dep. fed.  SE 1951-1955.\n\n \n\n*Orlando Vieira Dantas*****nasceu em Capela (SE) no dia 28 de setembro\nde 1900, filho de Manuel Correia Dantas, governador de Sergipe entre\n1926 e 1930, e de Adelina Vieira Dantas.\n\nProprietário rural e empresário da agroindústria açucareira, formou-se\nem engenharia civil, no Rio de Janeiro (então Distrito Federal), em\nmeados da década de 1920. De volta a Sergipe, em****1934 militou no\nPartido Social De­mocrático de Sergipe.  Em 1945, ingressou na União\nDemocrática Nacional (UDN) e mais tarde na Esquerda Democrática, em cuja\nlegenda ele­geu-se para a Assembléia Constituinte estadual em 1947. \nMais tarde, filiou-se ao Partido So­cialista Brasileiro (PSB), fusão da\nEsquerda Democrática com outras correntes políticas, do qual foi um dos\nfundadores em Sergipe.\n\n \n\nDeputado federal (1951-1953)\n\n \n\nEm outubro de 1950, elegeu-se deputado federal por Sergipe na legenda da\nAliança Popular, coligação do PSB com o Par­tido Trabalhista Brasileiro\n(PTB) e o Partido Social Progressista (PSP). Nesse mesma pleito, Getulio\nVargas foi eleito presidente da República. Deixando a Assembléia\nsergipana em janeiro de 1951, Orlando Dantas assumiu o mandato de\ndeputado fede­ral no mês seguinte.\n\nEm dezembro de 1951, Getulio en­viou ao Congresso um projeto propondo a\ncriação de uma sociedade de economia mista, a Petrobrás, para a\nexploração do petróleo no país. Dantas participou do debate em torno do\nprojeto como congressista e como homem de imprensa. Em maio de 1952,\nantes que o projeto começasse a ser discutido em plená­rio, o governo\napresentou um requerimento de emergência aprovado posteriormente,\nape­sar das manifestações contrárias da minoria, para o encaminhamento\ndos debates, de modo a evitar que o controle da matéria lhe escapas­se.\nOrlando Dantas declarou ser o requerimen­to suspeito, por estar em\nconsonância com a campanha feita pela imprensa, financiada pela Standard\nOil, visando a defesa de um projeto prejudicial à economia do país.\n\nNa sessão da Câmara de 6 de junho, a UDN encaminhou um substitutivo\nassinado por representantes dos principais partidos po­líticos.  Orlando\nDantas o assinou pelo PSB de Sergipe. Este substitutivo apresentava como\nproposta a criação de uma empresa estatal (Empresa Nacional de Petróleo\n- Enape) e incorporava diversas sugestões feitas no me­morando enviado à\nCâmara, em maio de 1952, pelo Centro de Estudos e Defesa do Pe­tróleo e\nda Economia Nacional (CEDPEN), um dos principais promotores da campanha\npelo monopólio estatal do petróleo.\n\nDepois de muita discussão, o projeto origi­nal saiu da Câmara com\nalterações significati­vas.  Foram aprovadas emendas que tornaram mais\nnítido o controle do Estado na nova em­presa.  Modificaram-se os\ndispositivos referen­tes à participação dos estados da Federação na\ndistribuição da receita do Imposto Único sobre Combustíveis Líquidos e\nLubrificantes.  Por outro lado, foram incluídos dispositivos relativos à\nparticipação dos estados produto­res nos resultados da atividade da\nempresa. A Petrobrás só viria a ser criada em 3 de outu­bro de 1953,\natravés da Lei nº. 2.004, sancio­nada por Getulio Vargas.\n\n                Líder do PSB na Câmara a partir de mar­ço de 1952,\ntentou a reeleição em outubro de 1954, dessa vez na legenda da Aliança\nSocial Democrática – coligação do PSB com o Parti­do Social Democrático\n(PSD) e o Partido Re­publicano (PR).  Obteve apenas a segunda suplência\ne, deixando a Câmara em janeiro de 1955, a ela não retornou na\nlegislatura seguin­te.\n\nNo pleito de outubro de 1962, elegeu-se quarto suplente de deputado à\nAssembléia Le­gislativa de Sergipe, na legenda do Partido Ru­ral\nTrabalhista (PRT), não chegando a exercer o mandato.  Com a extinção dos\npartidos polí­ticos pelo Ato Institucional n.º 2 (27/10/1965) e a\nposterior instauração do bipartidarismo, tentou candidatar-se a senador\nem 1966 por Sergipe na legenda do Movimento Democráti­co Brasileiro\n(MDB), partido de oposição ao regime militar instalado no país em abril\nde 1964, mas a agremiação não acolheu sua candidatura. Em 1968\ningressou  na Aliança Re­novadora Nacional (Arena), partido de\nsustentação ao regime militar.\n\nAlém de suas atividades no ramo açucareiro e na política, foi\ndiretor-presidente da *Gazeta de Sergipe*, jornal de sua propriedade.\n\n                Faleceu em Aracaju no dia 9 de abril de 1982.\n\nEra casado com Dulce Meneses Dantas, com quem teve quatro filhos. Um\ndeles, Hélio Dantas, também seguiu a carreira política\n\nPublicou *O problema açucareiro em Sergi*­*pe*(1944),*Aspectos da\npolítica sergipana* (1953), *Análises da inflação no Brasil*(2ª. ed.,\n1957),*Movimento cultural de Sergipe*,*Pla*­*nificação econômica de\nSergipe* e *A vida patriarcal em Sergipe*(1981)*.*\n\n \n\nFONTES: CÂM.  DEP.  *Deputados;*CÂM.  DEP. *Relação nominal dos\nsenhores;*CISNEIROS, A.*Parlamentares, Grande encic.  Delta;* NÉRI, S.\n*16;* TRIB.  SUP.  ELEIT.  *Dados*(1, 2, 3 e 6).\n\n \n\n \n","ref":"FONTES: CÂM.  DEP.  *Deputados;*CÂM.  DEP. *Relação nominal dos\nsenhores;*CISNEIROS, A.*Parlamentares, Grande encic.  Delta;* NÉRI, S.\n*16;* TRIB.  SUP.  ELEIT.  *Dados*(1, 2, 3 e 6).\n\n \n\n \n","dic":"DHBB"}
