{"title":"D’ARC, Joana ============","cargoss":["Deputado federal"],"cargos_esp":[0],"datas_ini":[1997],"datas_fim":[1999],"estados":["MG"],"autor":[0],"content":"D’ARC, Joana\n============\n\n\\* dep. fed. MG 1997-1999.\n\n \n\n*Joana d’Arc Carvalho Guimarães* nasceu em Cataguases (MG) no dia 19 de\njunho de 1957, filha de Ari Domingues Guimarães e de Júlia Carvalho\nGuimarães.\n\nEm 1976 começou a estudar história na Faculdade de Filosofia, Ciências e\nLetras Santa Maria, em Cataguases, concluindo o curso em 1980. Em 1981\niniciou o curso de direito na Faculdade Viana Júnior, em Juiz de Fora\n(MG), diplomando-se em 1986.\n\nFiliada ao Movimento Democrático Brasileiro (MDB), partido de oposição\nao regime militar instaurado no país em abril de 1964, elegeu-se\nvereadora de Cataguases em novembro de 1976. Assumindo o mandato no\ninício de 1977, participou dos trabalhos legislativos como membro da\nComissão de Serviços Públicos Municipais. Ainda em 1977, tornou-se\nsecretária do diretório municipal do MDB.\n\nCom o fim do bipartidarismo em novembro de 1979, filiou-se em 1981 ao\nPartido do Movimento Democrático Brasileiro (PMDB), que aglutinou os\nantigos membros do MDB, assumindo a secretaria do diretório municipal de\nCataguases. No início de 1982, terminou seu mandato de vereadora e\ndeixou o PMDB, ingressando no Partido dos Trabalhadores (PT). No mesmo\nano, tornou-se secretária do diretório municipal do PT de Cataguases e,\nem 1988, assumiu a presidência do partido na cidade.\n\nEm 1990 começou a trabalhar na Justiça do Trabalho. No mesmo ano\nconcorreu a uma cadeira na Câmara dos Deputados por Minas Gerais, na\nlegenda do PT, não sendo bem-sucedida. Em 1992, tornou-se delegada\nsindical do Sindicato dos Trabalhadores em Educação de Minas Gerais,\nfunção que exerceria até 1996.\n\nEm 1994, tornou-se membro do diretório nacional do PT, candidatando-se\nnovamente a uma cadeira na Câmara dos Deputados e obtendo a primeira\nsuplência. Em 1995 tornou-se membro da executiva do diretório estadual\ndo PT em Minas Gerais.\n\nCom a eleição e posse do deputado federal do PT de Minas Gerais Chico\nFerramenta na prefeitura de Ipatinga (MG), assumiu o mandato em 2 de\njaneiro de 1997. Participou dos trabalhos legislativos como integrante\nda Comissão de Relações Exteriores. Nas votações mais importantes de\n1997, pronunciou-se contra a emenda que permitiu a reeleição dos\nprefeitos, dos governadores e do presidente da República e a emenda que\nextinguiu a estabilidade dos servidores públicos. Em setembro de 1997,\ndurante o 11º Encontro Nacional do PT, realizado em São Paulo, foi\neleita para ocupar a segunda vice-presidência da comissão executiva\nnacional do partido.\n\nCandidatou-se à reeleição em outubro de 1998, não sendo bem-sucedida. Em\nnovembro, declarou-se contrária à reforma da previdência que fixou um\nteto salarial para a aposentadoria dos servidores públicos e estabeleceu\nidade e tempo de contribuição mínimos para os trabalhadores do setor\nprivado. Deixou a Câmara dos Deputados em fevereiro de 1999, ao final da\nlegislatura.\n\nCasou-se com Humberto Aguiar Resende, com quem teve um filho.\n\n \n\nFONTES: CÂM. DEP. *Deputados Brasileiros. Repertório*(1991-1995); CÂM.\nDEP. *Deputados Brasileiros. Repertório* (1995-1999); *Folha de São\nPaulo* (5/2/98 e 6/11/98).\n\n \n","ref":"FONTES: CÂM. DEP. *Deputados Brasileiros. Repertório*(1991-1995); CÂM.\nDEP. *Deputados Brasileiros. Repertório* (1995-1999); *Folha de São\nPaulo* (5/2/98 e 6/11/98).\n\n \n","dic":"DHBB"}
