{"title":"DÉDA, Marcelo","cargoss":["Deputado federal","Prefeito","Governador de estado ou do Distrito Federal"],"cargos_esp":[0,"Aracaju",0],"datas_ini":[1995,2001,2007],"datas_fim":[2000,2006,0],"estados":["SE",0,"SE"],"autor":[0],"content":"**DÉDA, Marcelo**\n\n\\*dep. fed. SE 1995-2000; pref. Aracaju 2001-2006; gov. SE 2007-\n\n \n\n*Marcelo Déda Chagas* nasceu em Simão Dias (SE) no dia 11 de março de\n1960, filho de Manuel Celestino Chagas e de Zilda Déda Chagas.\n\nCursou o segundo grau em Aracaju, no Ateneu Sergipense, onde iniciou sua\nmilitância política no grêmio estudantil. Ingressou no curso de direito\nda Universidade Federal de Sergipe em 1980. Nos dois anos seguintes,\nexerceu a vice-presidência e a presidência do diretório central dos\nestudantes, além de organizar a criação do Partido dos Trabalhadores\n(PT) no estado.\n\nNas eleições de novembro de 1982, disputou uma vaga na Assembleia\nLegislativa de Sergipe, mas não foi bem-sucedido. Após concluir a\ngraduação em 1984, foi advogado de diversos sindicatos e assessor\njurídico da Central Única dos Trabalhadores (CUT). Em 1985, voltou a\nparticipar de uma disputa eleitoral, pleiteando a prefeitura de Aracaju.\nApesar de derrotado, conseguiu uma expressiva votação, ficando atrás\nsomente de Jackson Barreto, candidato do Partido do Movimento\nDemocrático Brasileiro (PMDB). Ao longo desse ano e do seguinte, exerceu\nainda a função de chefe de gabinete da presidência do Conselho Regional\nde Engenharia e Arquitetura.\n\nJá como membro do diretório nacional do PT, disputou novamente, em\nnovembro de 1986, uma vaga na Assembleia Legislativa. Foi o candidato\nmais votado de toda a história de Sergipe até então, e no ano seguinte\niniciou seu mandato de deputado estadual constituinte. Líder de seu\npartido entre 1987 e 1990, presidiu a Comissão de Agricultura durante os\ndois primeiros anos do exercício legislativo. Vice-presidente da\nComissão de Justiça e Redação no biênio 1989-1990, integrou também as\ncomissões de Constituição e Justiça, de Redação, de Economia e Finanças,\ne de Serviço Civil. Foi primeiro-tesoureiro da comissão executiva\nnacional do PT entre 1987 e 1989, e no ano seguinte deixou o diretório\nnacional. Encerrou o mandato em janeiro de 1991, sem ter conseguido se\nreeleger em outubro do ano anterior.\n\nEm 1992, assumiu a presidência do diretório regional do PT e passou a\ntrabalhar como advogado do Sindicato dos Engenheiros de Sergipe e no\nescritório de advocacia Déda e Melo, em Aracaju. Assessor jurídico do\nConselho Federal de Engenharia e Arquitetura (Confea) de 1993 a 1994, em\noutubro desse último ano foi eleito deputado federal, tendo como\nprincipal base eleitoral a capital sergipana.\n\nEmpossado em fevereiro de 1995, iniciou um biênio como vice-líder de seu\npartido na Câmara dos Deputados. Nas votações das emendas\nconstitucionais propostas pelo governo Fernando Henrique Cardoso,\nacompanhando a orientação do PT, votou contra a quebra do monopólio das\nembarcações nacionais na navegação de cabotagem, a mudança no conceito\nde empresa nacional, o fim do monopólio estatal das telecomunicações e\nda Petrobras na exploração de petróleo. Em novembro, manifestou-se\ncontra a prorrogação por 18 meses do Fundo Social de Emergência (FSE),\nrebatizado de Fundo de Estabilização Fiscal (FEF), que permitia que o\ngoverno gastasse 20% da arrecadação de impostos sem que as verbas\nficassem obrigatoriamente vinculadas aos setores de educação e saúde.\n\nEm abril de 1996, participou de mobilização, ao lado de diversos\nparlamentares da oposição, para a aprovação de um projeto do deputado\nDomingos Dutra (PT-MA) que buscava estabelecer critérios para a\nconcessão de liminares judiciais em favor dos proprietários de terra em\náreas de conflito. Sofrendo grande contestação da bancada ruralista,\nresistente a qualquer lei que facilitasse as desapropriações para fins\nde reforma agrária, o projeto ganhou um substitutivo, mais moderado, do\ndeputado paulista Régis de Oliveira, do Partido da Frente Liberal (PFL),\nque acabou sendo aprovado na Comissão de Constituição e Justiça (CCJ).\n\nPreocupando-se também com as questões internas de seu partido em\nSergipe, ao lado do senador José Eduardo Dutra (PT-SE) ameaçou romper\ncom o candidato petista à prefeitura de Aracaju, Ismael Silva, quando\neste tentou obter o apoio da pefelista Maria do Carmo Alves no segundo\nturno da eleição municipal. Apesar de ter sido derrotada no primeiro\nturno, Maria do Carmo conseguiu um grande número de votos que poderiam\nser transferidos para Ismael caso houvesse a formalização de uma aliança\nentre PT e PFL. Anulada tal possibilidade, o pleito eleitoral foi\nrealizado no dia 15 de novembro de 1996, dando a vitória ao candidato do\nPMDB, João Augusto Gama da Silva.\n\nNas votações importantes ocorridas na Câmara dos Deputados nesse ano,\npronunciou-se contra a proposta do Executivo de reforma da Previdência\nSocial e contra o projeto de emenda constitucional do senador Antônio\nCarlos Valadares, do Partido Socialista Brasileiro (PSB-SE), que criou a\nContribuição Provisória sobre Movimentação Financeira (CPMF) em\nsubstituição ao Imposto Provisório sobre Movimentação Financeira (IPMF)\nem vigor desde 1994. A CPMF era um imposto de 0,2% sobre o valor das\ntransações bancárias a ser utilizado, teoricamente, como fonte\ncomplementar de recursos para a saúde pública.\n\nAo longo da legislatura, integrou como titular a Comissão de\nConstituição e Justiça e de Redação, e as comissões que definiriam\nprojetos de emenda constitucional (PECs) para os seguintes assuntos:\nmodificações no Poder Judiciário, monopólio do petróleo, imunidade\nparlamentar e regime constitucional dos militares. Como suplente\nintegrou, entre outras, a Comissão de Finanças e Tributação, a Comissão\nEspecial do projeto de lei da Política Nacional do Petróleo, e as\ncomissões especiais da reeleição e de emissão de medidas provisórias.\n\nEm janeiro/fevereiro de 1997, votou contra a emenda que permitia a\nreeleição de prefeitos, governadores e presidente da República. Além das\ndiscussões que giravam em torno da legitimidade de se aprovar uma\nproposta que poderia beneficiar os chefes do Executivo então em\nexercício, tal emenda trouxe outra polêmica quando, no mês de maio,\ncinco deputados federais do Acre foram acusados de receber dinheiro para\nvotar a seu favor. Mobilizados para a criação de uma comissão\nparlamentar de inquérito (CPI) para investigar as denúncias,\nparlamentares de oposição e alguns governistas esbarraram nos artifícios\nutilizados pela base do governo. Diminuindo o ritmo dos trabalhos na\nCâmara e pressionando diversos deputados a retirar suas assinaturas da\nlista que autorizava a abertura da CPI, os líderes de partidos\ngovernistas inviabilizaram a realização de investigações mais\naprofundadas sobre a venda de votos para a emenda da reeleição. No dia\n22 de maio, dois dos envolvidos, os deputados pefelistas Ronivon\nSantiago e João Maia, acabaram renunciando a seus mandatos para evitar\num processo de cassação que poderia torná-los inelegíveis. Nenhum dos\noutros acusados foi punido.\n\nTendo em vista as dificuldades de se obter informações que pudessem\nesclarecer os episódios de corrupção no Congresso, Marcelo Déda elaborou\num projeto de emenda constitucional que atribuía à CCJ poderes para\nconvocar depoentes, determinar busca e apreensão de documentos e\nobjetos, e quebrar sigilos bancário, fiscal e telefônico nos casos de\nprocesso por falta de decoro parlamentar. Aprovado pela CCJ, o projeto\nchegou ao plenário da Câmara para votação, mas acabou sendo retirado da\npauta a pedido dos líderes governistas.\n\nEm novembro, Marcelo Déda pronunciou-se contra a quebra da estabilidade\ndo servidor público, item polêmico da reforma administrativa que vinha\ntendo sua votação adiada desde julho. De acordo com a proposta, os\nfuncionários públicos poderiam ser demitidos por mau desempenho e/ou por\nexcesso de gastos com a folha de pagamentos.\n\nEm fevereiro de 1998, tornou-se líder do PT na Câmara dos Deputados,\nassumindo, em consequência, um cargo na executiva nacional do partido. O\ngrande prestígio adquirido com a resistência à reforma da Previdência\nSocial e com a atuação em defesa dos servidores públicos durante a\nreforma administrativa acabou lhe garantindo a reeleição com 82.464\nvotos, a segunda maior votação proporcional de todo o país no pleito de\noutubro de 1998. Em novembro, votou contra o teto de 1.200 reais para\naposentadorias no setor público e o estabelecimento de idade mínima e\ntempo de contribuição para o setor privado, itens fundamentais para a\ndefinição da reforma da Previdência. Ainda nesse ano integrou a Comissão\nde Economia, Indústria e Comércio.\n\nIniciou novo mandato em fevereiro de 1999, e em outubro de 2000\nelegeu-se prefeito de Aracaju na legenda petista. Entrou na disputa como\num dos últimos colocados, mas acabou ganhando a eleição ainda no\nprimeiro turno, com 52,8% dos votos válidos. Em 1º de janeiro de 2001\nrenunciou ao mandato de deputado federal para assumir a prefeitura. Em\n2004, foi reeleito prefeito da capital sergipana no primeiro turno,\nagora com 71,3% dos votos válidos. Com essas vitórias, foi se\nconsolidando como uma importante liderança na região. À frente da\nprefeitura de Aracaju investiu em saúde e em obras de infra-estrutura.\nConstruiu e reformou hospitais e postos de saúde, e promoveu a\nintegração de vários bairros através da construção de novas avenidas e\nde um novo viaduto. Revitalizou a cidade, que chegou a ser considerada a\ncapital com a melhor qualidade de vida do Nordeste.\n\nEm março de 2006, renunciou à prefeitura para se candidatar ao governo\ndo estado. Aliados em outros estados, PFL e PSDB enfrentavam conflitos\nde interesse em Sergipe, na Bahia e no Maranhão. Em Sergipe, ainda\ndurante a convenção estadual do partido, em junho, o presidente do PSDB\nno estado, Bosco Costa, rompeu com o PFL, seguido por sua substituta,\nMaria Mendonça.  Os dois deixaram o partido dos tucanos e passaram a\napoiar a campanha de Marcelo Déda, candidato do PT ao governo do estado,\ne de Luís Inácio Lula da Silva, candidato à presidência da República.\n\n Em outubro, favorecido por sua boa avaliação como prefeito junto aos\neleitores, Marcelo Déda obteve mais uma significativa vitória, vencendo\no pleito com 52,48% dos votos válidos e derrotando o então governador e\ncandidato pefelista à reeleição, João Alves Filho. Tal resultado alterou\no panorama político sergipano, tradicionalmente influenciado pelo PFL.\n\nEmpossado governador em janeiro de 2007, seguiu investindo na área de\nsaúde, com a construção de novos hospitais regionais e municipais.\nObteve junto ao governo federal autorização para a implantação de um\nnovo *campus* da Universidade Federal de Sergipe (UFS), para a formação\nde profissionais de saúde. Seguiu também investindo em infraestrutura,\ncom a recuperação de estradas no interior do estado.\n\nDivorciado, teve três filhas do casamento com Márcia Faria Barreto\nChagas. É compadre do presidente Luís Inácio Lula da Silva, que batizou\nsua filha caçula.\n\n* *\n\nMoisés Arioza/Márcio Magalhães/ Letícia Nunes de Moraes\n\n \n\n**FONTES:** CÂM. DEP.*Deputados brasileiros.*Repertório (1995-1999);\nCURRIC. BIOG.;*Estado de S. Paulo* (25/4 e 20/7/96; 3/7 e\n30/8/97);*Folha de S. Paulo* (14/1, 11/6 e 5/11/96; 30/1, 30/4, 23 e\n28/5, 8 e 11/7 e 6/9/97; 5/2, 29/9 e 6/11/98);*Globo* (15/3 e 15/6/96;\n24 e 30/4, 5 e 9/5, 8/6 e 4/9/97; 2/10/06); INF. BIOG.;*Jornal do\nBrasil*(8/3, 16/5, 25/7 e 17/10/96; 26/2, 4/4, 7 e 14/5/97); Portal do\nPT. Disponível em : \\<[http://www.pt.org.br](http://www.pt.org.br/)\\>.\nAcesso em : 27 set. 2009.\n\n \n","ref":"**FONTES:** CÂM. DEP.*Deputados brasileiros.*Repertório (1995-1999);\nCURRIC. BIOG.;*Estado de S. Paulo* (25/4 e 20/7/96; 3/7 e\n30/8/97);*Folha de S. Paulo* (14/1, 11/6 e 5/11/96; 30/1, 30/4, 23 e\n28/5, 8 e 11/7 e 6/9/97; 5/2, 29/9 e 6/11/98);*Globo* (15/3 e 15/6/96;\n24 e 30/4, 5 e 9/5, 8/6 e 4/9/97; 2/10/06); INF. BIOG.;*Jornal do\nBrasil*(8/3, 16/5, 25/7 e 17/10/96; 26/2, 4/4, 7 e 14/5/97); Portal do\nPT. Disponível em : \\<[http://www.pt.org.br](http://www.pt.org.br/)\\>.\nAcesso em : 27 set. 2009.\n\n \n","dic":"DHBB"}
