{"title":"ALVES, Aluísio","cargoss":["Constituinte","Deputado federal","Governador de estado ou do Distrito Federal","Deputado federal","min Adm","Deputado federal","Ministro da Integração Nacional"],"cargos_esp":[0,0,0,0,0,0,"Reg"],"datas_ini":[1946,1946,1961,1967,1985,1991,1994],"datas_fim":[1946,1961,1966,1969,1989,1994,1994],"estados":[0,"RN","RN","RN",0,"RN",0],"autor":[0],"content":"**ALVES, Aluísio**\n\n\\*const.1946; dep. fed. RN 1946-1961; gov. RN 1961-1966; dep. fed. RN\n1967-1969; min. Adm. 1985-1989; dep. fed. RN 1991-1994; min. Integr.\nReg. 1994.\n\n*Aluísio Alves* nasceu em Angicos (RN) no dia 11 de agosto de 1921,\nfilho de Manuel Alves Filho e de Maria Fernandes Alves.\n\nFez o curso primário em sua cidade entre 1926 e 1930 e, de 1936 a 1940,\nfez os estudos secundários em Natal.\n\nNa capital do estado, entre 1940 e 1945 foi redator político do jornal\n*A República,* diretor do Serviço Estadual de Reeducação e Assistência\nSocial, secretário, e depois presidente, da seção rio-grandense-do-norte\nda Legião Brasileira de Assistência (LBA). Tornou-se diretor da\nBiblioteca Norte-Rio-Grandense de História e da Sociedade Brasileira de\nFolclore. Ganhou projeção como organizador e especialista dos serviços\nde assistência social do estado. Membro da Sociedade de Higiene Mental\ndo Nordeste, participou do Congresso de Psiquiatria e Higiene Social do\nNordeste, realizado em Natal, e foi presidente do Centro de Estudos\nSociais do Rio Grande do Norte.\n\nDeputado federal (1946-1961)\n\nCom a queda do Estado Novo em 29 de outubro de 1945 e a realização de\neleições no dia 2 de dezembro seguinte, Aluísio Alves foi eleito\ndeputado pelo Rio Grande do Norte à Assembléia Nacional Constituinte, na\nlegenda da União Democrática Nacional (UDN). Tomou posse em fevereiro de\n1946, tornando-se então, aos 24 anos de idade, o mais jovem\nconstituinte.\n\nDurante os trabalhos da Assembléia, participou da comissão formada para\nresolver o problema da greve dos operários da Light, composta por dois\nsenadores (um da UDN e Luís Carlos Prestes, do Partido Comunista\nBrasileiro, então Partido Comunista do Brasil — PCB) e dois deputados\n(além de Aluísio Alves, um deputado do PCB).\n\nCom a promulgação da nova Carta (18/9/1946) passou a exercer mandato\nordinário. Nessa legislatura, formulou o projeto da Lei Orgânica da\nPrevidência Social, que só seria aprovado no segundo governo de Getúlio\nVargas (1951-1954). Manifestou-se contrário à emenda de José Augusto\nBezerra de Medeiros, seu patrono político e companheiro de bancada, que\nproibia a imigração de pessoas de raça amarela para o Brasil e\napresentou projeto — posteriormente transformado em lei — que transferia\na responsabilidade dos acidentes de trabalho, das companhias\nparticulares, para a órbita da previdência social.\n\nEm maio de 1948, tornou-se membro da Comissão Permanente de Legislação\nSocial da Câmara dos Deputados, tendo integrado também a Comissão de\nInquérito sobre Arrecadação e Aplicação das Rendas dos Institutos de\nPrevidência. Durante seu primeiro mandato ocupou ainda a secretaria\ngeral da UDN de seu estado.\n\nEm 1949, assumiu o cargo de redator-chefe da *Tribuna da\nImprensa,*jornal carioca de propriedade do udenista Carlos Lacerda. Em\nNatal, a partir de 1950, dirigiu a *Tribuna do* *Norte,*órgão de que se\ntornaria proprietário posteriormente. Ainda na capital do estado,\ndirigiu a Rádio Nordeste.\n\nSimultaneamente à sua participação política, realizou sua formação\nuniversitária, bacharelando-se pela Faculdade de Direito de Maceió em\n1950.\n\nEm outubro desse ano reelegeu-se deputado federal, sempre na legenda da\nUDN, pelo seu estado. Durante essa nova legislatura (1951-1955) fez\nparte das comissões de Legislação Social, Finanças e Orçamento e do\nPolígono das Secas. Licenciando-se do mandato entre 23 de outubro de\n1951 e 17 de fevereiro de 1952, sua cadeira foi ocupada pelo suplente\nDjalma Marinho. Sempre pela UDN, voltou a se reeleger deputado federal\npelo Rio Grande do Norte em outubro de 1954, recebendo a maior votação\nem sua legenda, alcançando mais de 18 mil votos.\n\nEm 1956 foi enviado a Genebra, na Suíça, como observador parlamentar à\nConferência Internacional do Trabalho. Em janeiro de 1958, tornou-se\nvice-líder da UDN e da minoria na Câmara dos Deputados. Ainda nesse ano,\nfoi contrário à criação da Superintendência do Desenvolvimento do\nNordeste (Sudene). O projeto de instalação desse órgão — sancionado em\ndezembro de 1959 —, a cargo de José Sete Câmara e Celso Furtado, tinha\ncomo principal objetivo promover a infra-estrutura adequada à\nimplantação, no Nordeste, do binômio industrialização-agricultura\nirrigada.\n\nCandidato a mais uma reeleição pela UDN, Aluísio Alves obteve a maior\nvotação do estado no pleito de outubro de 1958, conseguindo mais de 23\nmil votos. Desde junho desse ano, quando já se haviam iniciado as\narticulações para a campanha sucessória às eleições presidenciais que se\nrealizariam em outubro de 1960, a UDN apresentava-se dividida quanto à\nescolha do seu candidato. Uma ala, liderada por Carlos Lacerda, apoiava\no nome do ex-governador paulista Jânio Quadros; outra, à qual Aluísio\nAlves era ligado, indicava o nome do governador da Bahia, Juraci\nMagalhães.\n\nDurante as negociações entre os dois grupos, Aluísio seguiu, juntamente\ncom Carlos Lacerda, em agosto de 1959, para Londres, onde se encontraram\ncom Jânio, para discutir as possibilidades de unificação do partido.\nComo secretário do diretório nacional da UDN (1959-1961), participou, em\nnovembro de 1959, da mesa diretora que homologou o nome de Jânio Quadros\npara presidente.\n\nNo ano seguinte, lançou sua candidatura ao governo do Rio Grande do\nNorte com o apoio da coligação formada pelo Partido Social Democrático\n(PSD) e o Partido Trabalhista Brasileiro (PTB). Esta eleição marcou seu\nrompimento com o deputado Dinarte Mariz, uma das maiores lideranças\npolíticas do estado. Contrário à candidatura de Aluísio, Mariz levou a\nUDN a formalizar uma aliança com o Partido Republicano (PR) e o Partido\nSocial Trabalhista (PST) em torno do nome do deputado federal Djalma\nMarinho. Durante a campanha, Aluísio Alves liderou a “Cruzada da\nEsperança”, com a qual — de trem ou caminhão — percorreu todo o estado\nfazendo comícios “relâmpago”, organizando passeatas e pedindo votos de\ncasa em casa. Nessas caravanas, seus seguidores eram identificados pelos\ngalhos de árvore que traziam à mão e pela cor verde de suas bandeiras —\nem oposição ao vermelho adotado pelos partidários de Mariz. Apelidado de\n“Cigano” pelo povo potiguar, Aluísio inaugurava um estilo que marcaria\npara sempre sua biografia.\n\nNo pleito de 3 de outubro de 1960, elegeu-se governador do Rio Grande do\nNorte com 121.076 votos, contra 98.195 dados a Djalma Marinho. Na mesma\nocasião, Jânio Quadros derrotou o marechal Henrique Lott, da coligação\nPSD-PTB, e conquistou a presidência da República. Tendo como vice o\nmonsenhor Valfredo Gurgel, em janeiro de 1961 Aluísio renunciou ao\nmandato de deputado, sendo empossado no governo estadual no dia 31 do\nmesmo mês. Depois da eleição de 1960 — e por mais de uma década —, a\npolítica no Rio Grande do Norte passaria a ser dominada pelas disputas\nentre as famílias Alves e Mariz.\n\nGovernador do Rio Grande do Norte\n\nDurante a crise político-militar suscitada pela renúncia de Jânio\nQuadros em 25 de agosto de 1961 e a recusa dos ministros militares em\naceitar a posse do vice-presidente João Goulart, Aluísio Alves\nacompanhou de perto a evolução das negociações que resultaram na\naprovação pelo Congresso da Emenda Constitucional nº 4, no dia 2 de\nsetembro seguinte, instituindo o parlamentarismo no Brasil e permitindo\na posse de Goulart no dia 7 de setembro. Juntamente com outros\ngovernadores e o ministro da Fazenda, Clemente Mariani, entrevistou-se\ncom os ministros militares — marechal Odílio Denis (Guerra),\nvice-almirante Sílvio Heck (Marinha) e o brigadeiro Gabriel Grün Moss\n(Aeronáutica), que se opunham à posse de Goulart —, obtendo deles a\ngarantia de acatamento das decisões do Congresso.\n\nEm outubro de 1962, integrou um grupo de governadores — composto por\nPetrônio Portela (Piauí), Virgílio Távora (Ceará), João de Seixas Dória\n(Sergipe), Nei Braga (Paraná) — liderado por José de Magalhães Pinto,\ngovernador de Minas Gerais, disposto a dar cobertura à campanha do\nplebiscito, que colocaria em votação a volta ao presidencialismo. A\nposição favorável ao retorno à forma presidencialista de governo saiu\namplamente vitoriosa no plebiscito realizado em 6 de janeiro de 1963.\n\nEm maio desse ano convidou o embaixador norte-americano Lincoln Gordon a\nvisitar o seu estado, homenageando-o no palácio Potengi com banquete que\ncontou com a presença do general Antônio Carlos Murici, comandante da 7ª\nDivisão de Infantaria, sediada em Natal. Nessa ocasião, o embaixador\nnorte-americano e o chefe militar sofreram pesadas críticas do deputado\npetebista Leonel Brizola, que se encontrava na capital potiguar a\nconvite da Frente Nacionalista do Rio Grande do Norte.\n\nIntegrado às articulações que antecederam o movimento político-militar\nde 31 de março de 1964, foi avisado pelo governador Magalhães Pinto, em\n30 de março, do início das operações militares para a deposição do\npresidente Goulart. Vitorioso o movimento, esteve presente à reunião no\npalácio Guanabara em 2 de abril, onde o general Augusto César Muniz de\nAragão, chegando da Vila Militar, foi aplaudido por diversos\ngovernadores ao declarar que o Exército desejava a ascensão do general\nHumberto Castelo Branco à presidência da República e ao denunciar a ação\ndo general Artur da Costa e Silva como protelatória da decisão. Eleito\nno dia 11 de abril pelo Congresso, Castelo Branco foi empossado no dia\n15 seguinte.\n\nNa campanha para a escolha de seu sucessor no governo do Rio Grande do\nNorte, Aluísio Alves travou nova e acirrada luta com seu adversário,\nDinarte Mariz, que concorria ao cargo pela coligação UDN-PR. Seu\ncandidato, o vice-governador Valfredo Gurgel, apoiado pelo PTB, PSD e\nPDC, derrotou Mariz no pleito de outubro de 1965. Inconformada, a facção\nderrotada nas urnas interpôs recurso na justiça eleitoral, mas o\nresultado foi confirmado. Em seguida, membros de seu secretariado foram\nenvolvidos num inquérito policial-militar (IPM) instaurado para apurar\num atentado contra o comandante da Base Aérea de Natal. Aluísio\ndeslocou-se então para o Rio de Janeiro e depois de alcançar uma solução\npara o problema em negociações com os ministros da Justiça, Juraci\nMagalhães, e da Aeronáutica, Eduardo Gomes, declarou retornar ao seu\nestado sem temer a prisão, acusando seus adversários de distorcer as\nfinalidades do IPM com objetivos políticos. Deixou o governo do Rio\nGrande do Norte no dia 31 de janeiro de 1966, passando-o a seu sucessor\nValfredo Gurgel.\n\nCom a extinção dos partidos políticos pelo Ato Institucional nº 2\n(27/10/1965) e a posterior instauração do bipartidarismo, filiou-se à\nagremiação governista, a Aliança Renovadora Nacional (Arena), em cuja\nlegenda foi eleito deputado federal em novembro de 1966. Foi empossado\nem fevereiro do ano seguinte.\n\nEm abril de 1967 começaram a se delinear alguns problemas no interior da\nArena. Nessa ocasião, liderou um movimento dentro do partido, tentando\ndar expressão à rebelião das correntes pessedistas e trabalhistas contra\na hegemonia udenista. Sessenta arenistas no Congresso estavam\ninteressados na articulação e na formalização da dissidência, que\ndeveria reivindicar a criação da sublegenda, através da qual se tentaria\nforçar a alteração dos critérios partidários na seleção das lideranças\npolítico-parlamentares. Afirmou, na época, que mesmo alguns políticos da\nextinta UDN sentiam-se oprimidos e descontentes.\n\nPara melhor oficializar sua posição e a dos companheiros, redigiu um\nmanifesto e incumbiu-se de recolher assinaturas que esperava chegassem a\n80. Desenrolou-se uma vigorosa contra-articulação para impedir a\nassinatura dos deputados. Senadores e outros dirigentes estaduais foram\nconvocados a fazer apelos a seus correligionários, e alguns deles, que\njá haviam subscrito o documento, cancelaram a assinatura. A discussão da\nlei da sublegenda arrastou-se até abril de 1968, quando, finalmente, foi\naprovada.\n\nPor força do Ato Institucional nº 5 (13/12/1968) baixado pelo presidente\nArtur da Costa e Silva (1967-1969), Aluísio teve seu mandato cassado e\nseus direitos políticos suspensos em 7 de fevereiro de 1969, sob\nalegação de corrupção. De acordo com algumas versões, sua cassação teria\nsido articulada por Dinarte Mariz com o objetivo de reduzir a influência\nda família Alves na política potiguar. Anos mais tarde, Aluísio negaria\nque tivesse sido cassado por corrupção, afirmando que a suspensão de\nseus direitos políticos fora motivada por “agitação política”. De\nqualquer forma, suas atividades foram de fato investigadas pela Comissão\nGeral de Investigações do Ministério da Justiça entre 1969 e 1973, sendo\no processo arquivado por falta de provas em janeiro deste último ano.\n\nAfastado da vida pública, Aluísio dedicou-se à iniciativa privada,\nparticipando da União de Empresas Brasileiras Comércio e Indústria UEB\n(Grupo Bemoreira-Ducal). Nesta atividade, teve como companheiro o\ngeneral Afonso de Albuquerque Lima. Interessados em instalar uma\nindústria têxtil no Rio Grande do Norte, dentro do processo de contínua\nexpansão do grupo UEB, Aluísio e Albuquerque Lima empreenderam, em\nfevereiro de 1973, viagem a Tóquio, onde mantiveram entendimentos que\nresultaram na associação com o grupo japonês Ataka para montagem de uma\nfábrica de fios mistos no estado.\n\nNesse ínterim, transferiu sua influência política para o Movimento\nDemocrático Brasileiro (MDB), partido oposicionista, também criado em\n1966, patrocinando a eleição do filho, Henrique Eduardo Alves, à Câmara\ndos Deputados em 1970, sua reeleição em 1974 e condução, por duas vezes\nsucessivas, à presidência do MDB do Rio Grande do Norte. Ainda em 1974\ncoordenou a campanha da oposição no estado, elegendo, em novembro de\n1974, seu candidato ao Senado, Agenor Maria, que derrotou Djalma\nMarinho, da Arena. Nesta ocasião, entretanto, a hegemonia dos Alves e\ndos Dinarte foi rompida com a eleição indireta de Tarcísio Maia para o\ngoverno potiguar.\n\nEm janeiro de 1976, Aluísio Alves tornou-se vice-diretor do Grupo UEB.\nDois anos depois, em entrevista à revista *Veja*, vinculou sua filiação\nao MDB ao fato de o partido oposicionista apoiar sobretudo a luta contra\no Estado de exceção então existente. Indagado sobre opções de programa\npara um novo partido, recomendou a adoção de um novo modelo de\ndistribuição de renda e a renovação do processo de representação da\nclasse trabalhadora. Quanto ao restabelecimento do estado democrático,\nafirmou que alguns pontos precisariam ser garantidos: liberdade de\nimprensa, extinção da Lei Falcão, reformulação partidária e eliminação\ndo processo indireto na escolha de candidatos a cargos políticos.\n\nCom os direitos políticos ainda suspensos, participou, em setembro de\n1978, de dois comícios, um em Natal, e outro em Mossoró (RN). No mesmo\nmês, através de manifesto que ocupou uma página inteira de seu jornal, a\n*Tribuna do Norte,*definiu-se a favor da candidatura ao Senado de Jessé\nPinto Freire, da Arena, que acabou ganhando o pleito. Mais tarde,\njustificou essa atitude em entrevista à imprensa, afirmando que apoiara\no candidato arenista porque Radir Pereira, candidato do MDB, apoiado por\nDinarte Mariz, era exatamente o candidato das forças que representavam o\nretrocesso político no Rio Grande do Norte. Ainda na mesma entrevista,\nmanifestou-se favorável a uma anistia ampla e irrestrita. Enquanto\npreparava sua volta à política, sofreu mais um revés com a indicação de\nLavoisier Maia — primo de Tarcísio Maia — para o governo do estado.\n\nEm fevereiro de 1979 ingressou com uma queixa-crime no Supremo Tribunal\nFederal (STF) contra o senador Dinarte Mariz, acusando-o de calúnia,\ndifamação e injúria, por haver ele afirmado, em discurso no Senado, que\nAluísio Alves enriquecera ilicitamente. Entre as várias acusações feitas\npor Dinarte registra-se a de que o presidente Castelo Branco teria dito\nao senador Daniel Krieger que “de todos os executivos investigados pela\nRevolução, o mais desonesto é Aluísio Alves”.\n\nEm agosto de 1979, com a decretação da anistia pelo presidente João\nFigueiredo (1979-1985), Aluísio finalmente readquiriu seus direitos\npolíticos. No ano seguinte, em função do fim do bipartidarismo\n(29/11/1979) e a organização de novos partidos, ingressou no Partido\nPopular (PP), agremiação oposicionista presidida pelo senador Tancredo\nNeves. Em setembro de 1981 anunciou sua candidatura na legenda do PP ao\ngoverno do Rio Grande do Norte nas eleições marcadas para novembro do\nano seguinte, aceitando o desafio que lhe fora feito por Lavoisier Maia\nque, numa entrevista à imprensa, afirmara que o PP não tinha estrutura\npara enfrentar a agremiação governista, o Partido Democrático Social\n(PDS), agremiação que substituiu a Arena.\n\nEm fevereiro de 1982, com a incorporação do PP ao Partido do Movimento\nDemocrático Brasileiro (PMDB) — legenda que sucedeu ao MDB —, manteve\nsua candidatura ao governo estadual para as eleições de novembro desse\nano, tendo sido no entanto derrotado pelo seu oponente do PDS, José\nAgripino Maia — primo de Lavoisier e filho de Tarcísio Maia —, por cerca\nde 107 mil votos.\n\nCom a eleição de Tancredo Neves para o governo de Minas Gerais no pleito\nde 1982, Aluísio assumiu uma diretoria do Banco do Estado de Minas\nGerais (Bemge) no Rio de Janeiro.\n\nEm setembro de 1983, responsabilizou indiretamente Agripino Maia pelo\nassassinato de seu irmão Expedito Alves, prefeito de Angicos, ocorrido\nno dia 10 do mesmo mês. Afirmando que o crime fora cometido por razões\npolíticas, Aluísio Alves acusou Maia de estar acobertando as ações que\nos delegados de polícia, nomeados pelo governador, estariam promovendo\ncontra os 36 prefeitos do PMDB no Rio Grande do Norte. Expedito foi\nmorto dias depois de ter denunciado irregularidades no abastecimento de\nágua e nas frentes de emergência implantadas pelo governo estadual em\nAngicos.\n\nAlém dos conflitos regionais, as disputas entre PMDB e PDS também se\nmanifestaram durante a sucessão do presidente João Figueiredo,\nacentuando-se após a derrota, no Congresso, da emenda Dante de Oliveira,\nque previa o restabelecimento das eleições diretas para presidente já a\npartir de novembro de 1984. Com a rejeição da emenda, os dois partidos\niniciaram então as articulações para a escolha de seus candidatos ao\nColégio Eleitoral de 15 de janeiro do ano seguinte. Em agosto de 1984,\nenquanto o PDS lançava o nome do ex-governador de São Paulo e deputado\nfederal Paulo Maluf, a oposição reunida na Aliança Democrática —\ncoligação formada pelo PMDB e a dissidência do PDS reunida na Frente\nLiberal — escolhia Tancredo Neves como seu candidato.\n\nCom a vitória de Tancredo no Colégio Eleitoral, Aluísio Alves foi\nindicado para chefiar o Ministério da Administração, a ser criado pelo\nnovo governo. Eleito com uma expressiva votação sobre Maluf, Tancredo\nnão chegaria, entretanto, a assumir o cargo, sendo internado em Brasília\ncom uma grave doença na véspera de sua posse, marcada para o dia 15 de\nmarço de 1985. Empossado interinamente, o vice José Sarney seria\nefetivado na presidência no dia 21 de abril seguinte, quando Tancredo\nveio a falecer.\n\nMinistro da Administração\n\nConfirmado por Sarney, Aluísio Alves assumiu o Ministério da\nAdministração em março de 1985, juntamente com toda a equipe de\nTancredo. Logo no início de sua gestão, foi pressionado para extinguir\nprivilégios herdados do governo Figueiredo. Na época, a imprensa vinha\ndivulgando com insistência casos de mordomias existentes na\nadministração pública federal e cobrando providências das novas\nautoridades. Os exemplos citados iam desde o excesso de gastos com as\nverbas de manutenção das residências ministeriais, até o uso de carros\noficiais para fins particulares. Embora não chegasse a solucionar o\nproblema, ainda em 1985 o governo anunciou o desconto de 15% do salário\ndos ministros para pagamento das residências oficiais e determinou que\nas despesas com alimentação deveriam ser custeadas pelos próprios\ntitulares das pastas. Quanto ao uso dos carros de representação, Aluísio\napresentou um projeto que reduziu drasticamente a frota de veículos.\n\nAo mesmo tempo em que enfrentava os problemas da administração federal,\nAluísio consolidava sua base política no Rio Grande do Norte. No pleito\nde novembro de 1985, seu sobrinho, o deputado estadual peemedebista\nGaribaldi Alves Filho, elegeu-se prefeito de Natal ao vencer a disputa\ncom a candidata da coligação do Partido da Frente Liberal (PFL) com o\nPDS, Vilma Maia, esposa do ex-governador Lavoisier Maia.\n\nNesse momento, entretanto, as ações políticas de Aluísio apareciam mais\nclaramente no plano nacional, resultantes de sua atuação como ministro.\nEm dezembro de 1985, por influência sua, Sarney baixou um decreto\nefetivando cerca de 130 mil funcionários públicos não-concursados.\nConhecidos como “tabelistas”, esses servidores haviam sido contratados\nao longo dos anos — muitos deles tinham mais de dez anos de serviço\npúblico — para suprir necessidades emergenciais da administração. Frente\nàs críticas de que a medida iria inchar a máquina pública, Aluísio\nsustentou que o problema do Estado brasileiro não era a grande\nquantidade de funcionários, mas, sim, o excesso de órgãos que muitas\nvezes exerciam as mesmas funções. Segundo ele, além de aumentar os\níndices de desemprego, a demissão dos tabelistas iria inviabilizar o\nfuncionamento de várias repartições formadas, em sua maioria, por esse\ntipo de servidor.\n\nAinda no início de sua gestão, Aluísio foi indicado por Sarney para\npresidir uma comissão encarregada de elaborar um projeto de reforma\nadministrativa. Sua principal atribuição como ministro era, então,\napresentar uma proposta de modernização do Estado brasileiro capaz de\ndesburocratizar a máquina pública.\n\nParalelamente a esta tarefa, no entanto, Aluísio dedicou atenção à\npolítica de seu estado natal. Em maio de 1986, para a surpresa de\nmuitos, selou um acordo com o filho de Dinarte Mariz — falecido em 1984\n— Vanderlei Mariz, visando às eleições de novembro daquele ano.\nVanderlei foi, então, anunciado como candidato oficial do PMDB ao\nSenado, e Geraldo Melo indicado para a disputa do governo estadual.\nGaribaldi Alves, irmão de Aluísio, foi escolhido como candidato a\nvice-governador. Com o acordo, depois de 26 anos de afastamento as duas\nfamílias se uniram para enfrentar a coligação PDS-PFL, representada\npelas candidaturas de José Agripino Maia ao Senado e João Faustino ao\ngoverno do Estado. Na campanha eleitoral, Aluísio buscou reviver suas\nantigas aparições. Organizou a Cruzada da Vitória e, em viagens de trem,\npediu votos para seus candidatos. Geraldo Melo foi eleito governador, e\nAgripino Maia conquistou uma cadeira no Senado.\n\nSe no Rio Grande do Norte a disputa se dava com a família Maia, no\ngoverno federal as divergências de Aluísio eram com a equipe econômica.\nEm fevereiro de 1988, juntamente com o ministro-chefe do Estado-Maior\ndas Forças Armadas (EMFA), brigadeiro Paulo Roberto Camarinha, e o\nministro do Trabalho, Almir Pazzianotto, conseguiu evitar o congelamento\ndo salário dos funcionários públicos, pretendido pelos ministros da\nFazenda, Maílson da Nóbrega, e do Planejamento, João Batista de Abreu.\nEm parecer entregue ao presidente Sarney, Aluísio sustentava que o\nsalário dos servidores não contribuía tanto para o déficit público,\nsugerindo como alternativa a redução de subsídios e uma maior eficiência\nna arrecadação de impostos. Posteriormente, no entanto, frente à ameaça\nde atraso nos pagamentos, acabaria cedendo aos argumentos da equipe\neconômica e concordando com o congelamento por dois meses dos\nvencimentos dos funcionários. Com o aval de Sarney, a medida foi\nfinalmente aprovada pelo governo em abril de 1988.\n\nEm dezembro seguinte, Aluísio Alves finalmente entregou a Sarney seu\nprojeto de reforma administrativa. Entre outros pontos, a proposta\nprevia a instituição de um regime jurídico único para os funcionários da\nadministração direta; estendia a estabilidade no emprego aos servidores\ncontratados com base na Consolidação das Leis do Trabalho (os chamados\n“celetistas”); garantia o pagamento de aposentadorias integrais e de\nqüinqüênios; concedia licenças especiais; previa a criação da Escola\nNacional de Administração Pública (ENAP); e determinava a elaboração de\num plano de carreira para o funcionalismo. Foram também obra de sua\ngestão a concessão do décimo-terceiro salário para os funcionários\nestatutários e a elaboração do projeto do novo estatuto do funcionário\npúblico.\n\nAluísio deixou o governo em 15 de janeiro de 1989, quando uma reforma\nministerial comandada por Sarney pôs fim ao Ministério da Administração,\ntransferindo suas funções para a pasta do Planejamento. Logo após se\nafastar do cargo, o *Jornal do Brasil* publicou uma ampla reportagem\ndenunciando que seu último ato como ministro havia sido a efetivação de\n39 servidores não-concursados, entre eles Aluísio Alves Filho e Aluísio\nAlves Neto, além de outros parentes e amigos. Em seguida, o jornal *O\nGlobo* também divulgou que durante sua gestão haviam sido contratados\nmais de seiscentos funcionários. Em duas cartas enviadas aos jornais,\nAluísio refutou as informações de *O Globo* e alegou que as contratações\nhaviam sido feitas dentro das normas legais, para “atender as\nnecessidades de cada órgão” da administração. Mais tarde, outra denúncia\ncontra o ex-ministro levaria à instalação de um processo no Tribunal de\nContas da União (TCU) para investigar a contratação irregular de quatro\nempresas durante sua passagem pelo ministério. Em mais um processo,\ndessa vez no Supremo Tribunal Federal (STF), Aluísio seria também\ninvestigado por supostas irregularidades cometidas na compra e\ndistribuição de passagens aéreas para seus antigos funcionários.\n\nNo dia 14 de março de 1989, após ter seu nome aprovado pelo Senado,\nAluísio Alves foi nomeado ministro do Superior Tribunal Militar (STM)\npor José Sarney. Dias depois, no entanto, a indicação foi contestada\npela Ordem dos Advogados do Brasil (OAB) e pela maioria dos ministros do\nSTM. Em recurso ao Supremo, a OAB argumentou que Aluísio não havia\ncomprovado os dez anos de exercício da advocacia exigidos pela\nConstituição para ser empossado no cargo. Na ocasião, declarando que a\ndocumentação apresentada pelo ex-ministro era insuficiente, o STM\ndecidiu adiar a posse de Aluísio. Em junho de 1989, depois de tentar sem\nsucesso garantir sua indicação com recursos ao STF e ao próprio STM,\nAlves decidiu renunciar à vaga. Na ocasião, redigiu uma carta a Sarney,\nafirmando que fora vítima de perseguição por ter sido cassado.\n\nTrês meses depois, também por indicação de Sarney, assumiu o cargo de\ndiretor de contatos especiais e informática na Companhia Auxiliar de\nEmpresas Elétricas Brasileiras (CAEEB), empresa vinculada ao Ministério\ndas Minas e Energia.\n\nEm outubro de 1990, elegeu-se deputado federal pelo PMDB do Rio Grande\ndo Norte. Na mesma ocasião, Agripino Maia foi reconduzido ao governo do\nestado. Empossado na Câmara em fevereiro do ano seguinte, Aluísio Alves\ntornou-se membro titular da Comissão de Ciência e Tecnologia,\nComunicação e Informática e suplente da Comissão de Economia, Indústria\ne Comércio.\n\nNa sessão de 29 de setembro de 1992, votou favoravelmente à abertura do\nprocesso de *impeachment* por crime de responsabilidade contra o\npresidente da República, Fernando Collor de Melo, acusado de\nenvolvimento com um esquema de corrupção montado no governo pelo\ntesoureiro de sua campanha presidencial, Paulo César Farias. Afastado da\npresidência após a votação na Câmara, Collor renunciou ao mandato dois\nmeses depois, horas antes de ser cassado pelo Senado e de se tornar\ninelegível por oito anos. Seu substituto no cargo foi o vice-presidente\nItamar Franco, que vinha exercendo a função como interino desde o dia 2\nde outubro.\n\nNa eleição para a prefeitura de Natal em outubro/novembro de 1992,\nAluísio manifestou apoio a seu filho Henrique Alves (PMDB), em oposição\nà candidatura de sua filha Ana Catarina Alves, do Partido da Frente\nLiberal (PFL). Irmã gêmea de Henrique, Catarina recebeu o apoio da\nfamília Maia na eleição. Para os adversários de Aluísio, entretanto, a\ndisputa entre os dois seria apenas uma estratégia para aumentar ainda\nmais sua influência na política potiguar. No segundo turno, Henrique\nAlves foi derrotado por Aldo Tinoco, do Partido Socialista Brasileiro\n(PSB).\n\nMinistro da Integração Regional\n\nEm março de 1994, Aluísio Alves foi nomeado por Itamar Franco\n(1992-1994) ministro da Integração Regional, em substituição a Romildo\nCanhim. Licenciando-se do mandato de deputado, foi substituído na Câmara\npelo suplente Marcos Formiga.\n\nSua principal realização à frente do ministério foi o anúncio de um\npolêmico projeto de irrigação que previa a transposição de águas do rio\nSão Francisco para abastecer cerca de 220 cidades do Nordeste atingidas\npela seca. Orçada em cerca de dois bilhões de dólares, a obra era\ncombatida por seus altos custos e seus supostos fins eleitorais. Entre\naqueles que se opunham ao projeto estava a equipe econômica do governo\nfederal — que se recusava a dar aval para financiamentos externos para a\nobra — e os governos da Bahia e de Minas Gerais. Beneficiando os estados\nde Pernambuco, Ceará, Rio Grande do Norte e Paraíba, a obra, segundo\nseus críticos, serviria apenas para garantir a eleição — posteriormente\nconfirmada — de Garibaldi Alves Filho ao governo potiguar. Além disso, o\nprojeto era também questionado pelos impactos que poderia causar ao meio\nambiente.\n\nEm agosto de 1994, no lançamento da pedra fundamental do projeto em\nMossoró, Aluísio reconheceu o impacto eleitoral que teria o\nempreendimento, mas alertou que, se o próximo presidente não desse\ncontinuidade a ele, poderia haver uma convulsão social no Nordeste.\nApesar do tom dramático de suas declarações, a obra não chegou a sair do\npapel, sendo mais tarde abandonada por Itamar Franco. Aluísio deixou o\nMinistério da Integração Regional em 31 de dezembro de 1994, ao fim do\ngoverno de Itamar, sendo sucedido na pasta — que passou a ser denominada\nSecretaria de Políticas Regionais — por Cícero Lucena.\n\nCom a derrota do candidato do PMDB, João Faustino, nas eleições para a\nprefeitura de Natal em outubro de 1996, Aluísio declarou seu voto no\nsegundo turno em Fátima Bezerra, do Partido dos Trabalhadores (PT).\nApesar do apoio da família Alves, a candidata petista não foi eleita,\nsendo derrotada por Vilma Maia (PSB), que após se separar de Lavoisier\nMaia passara a se assinar Vilma Faria.\n\nEm maio de 1998, quando o sucessor de Itamar, Fernando Henrique Cardoso\n(1995-1998), anunciou a retomada do projeto de desvio do rio São\nFrancisco, Aluísio criticou as alterações feitas na proposta pelo\nex-titular da Secretaria de Políticas Regionais Fernando Catão. Segundo\nafirmou, as mudanças no projeto original teriam o objetivo de favorecer\no estado da Paraíba — terra natal de Catão — em detrimento do Rio Grande\ndo Norte.\n\nAlém do jornal *Tribunal do Norte*, Aluísio Alves tornou-se proprietário\nde emissoras de rádio no Rio Grande do Norte e da TV Cabugi de Natal,\nfiliada à Rede Globo.\n\nFaleceu em Natal no dia 6 de maio de 2006.\n\nCasou-se com Ivone Lira Alves, com quem teve quatro filhos. Henrique\nAlves tornou-se deputado federal em 1971, sendo reeleito pela sétima vez\nem 1998. Ana Catarina Alves ocupou uma cadeira na Câmara em 1997 e 1998,\niniciando novo mandato em 1999. O genro de Aluísio, Ismael Wanderley,\nfoi constituinte em 1987 e 1988 e deputado federal entre 1987 e 1991.\nGaribaldi Alves Filho exerceu o mandato de senador entre 1991 e 1994 e\nreelegeu-se governador em 1998.\n\nAluísio Alves publicou *A paróquia* *de* *São José de Angicos* (1939),\n*Angicos* (1940), *A Previdência* *Social no Brasil* (1940), *A\nPrevidência* *Social no Brasil e no mundo* (1950), *O seguro de\nacidentes — sua* *função social*(1951), *Nordeste: problemas de\nrecuperação* (1952), *Sem ódio e sem medo*(1970), *A verdade que não é\nsecreta* (1972), *Lutar pelos pobres*(1982) e *O que não esqueci*(2000,\nmemórias).\n\n*Luís Otávio de Sousa*atualização\n\nFONTES: ARQ. DEP. PESQ. JORNAL DO BRASIL; BENEVIDES, M.\n*Governo;*BENEVIDES, M. *UDN;*CACHAPUZ, P. *Cronologia;*CÂM. DEP.\n*Anais*(1961); CÂM. DEP. *Deputados brasileiros. Repertório*(1967-1971,\n1991-1995); CÂM. DEP. *Lista de suplentes*(1991-1995);**CÂM. DEP.\n*Relação dos deputados;*CÂM. DEP. *Relação nominal dos\nsenhores;*CASCUDO, L. *História;*CASTELO BRANCO, C.*Introdução;* CASTELO\nBRANCO, C. *Militares;*CISNEIROS, A. *Parlamentares; Correio do Povo*\n(8/12/65); COUTINHO, A. *Brasil; Diário do* *Congresso Nacional;*DINES,\nA. *Idos; Encic. Mirador; Estado de S. Paulo*(10/8/82, 7/4 e 30/12/88,\n28/3, 30/6 e 1/7/89, 18/6, 15/7 e 12/8/94); *Folha de S. Paulo*(16/4,\n31/7 e 26/12/85, 25/2/86, 27/3 e 20/4/88, 22/3/89, 8/3 e 25/8/94,\n13/11/96, 12/5/98); *Globo* (12/3/85, 4/2/86, 25 e 28/1, 4/4 e 1/7/89,\n30/9/92, 26/12/99; 7/5/06); *Grande encic. Delta; Grande encic.\nportuguesa;*HIRSCHOWICZ, E. *Contemporâneos*; *Jornal* *da\nTarde*(22/9/76);*Jornal do Brasil* (29/1, 22/4, 2/7 e 6/8/76, 9 e 22/9,\n19/11/78, 8 e 14/2/79, 11/9/81, 9/10/83, 31/12/85, 6/5, 25/9, 5 e\n13/11/86, 24 e 26/1, 2, 18 e 23/3, 6 e 24/4/89, 3/3, 12/7, 22 e\n23/8/94); KUBITSCHEK, J. *Meu* (3); MACEDO, N.*Aspectos;*NÉRI, S. *16;*\n*Senhor* (23/10/85); SILVA, G. *Constituintes;*SILVA, H.\n*História;*SILVA, H. *1964;*TRIB. SUP. ELEIT. *Dados*(1,**2, 3, 4 e 5*);\nVeja*(28/2/73, 2/8/78, 5/10/83, 8/8/84); VIANA FILHO, L.\n*Governo;*VÍTOR, M. *Cinco.*\n\n \n","ref":"FONTES: ARQ. DEP. PESQ. JORNAL DO BRASIL; BENEVIDES, M.\n*Governo;*BENEVIDES, M. *UDN;*CACHAPUZ, P. *Cronologia;*CÂM. DEP.\n*Anais*(1961); CÂM. DEP. *Deputados brasileiros. Repertório*(1967-1971,\n1991-1995); CÂM. DEP. *Lista de suplentes*(1991-1995);**CÂM. DEP.\n*Relação dos deputados;*CÂM. DEP. *Relação nominal dos\nsenhores;*CASCUDO, L. *História;*CASTELO BRANCO, C.*Introdução;* CASTELO\nBRANCO, C. *Militares;*CISNEIROS, A. *Parlamentares; Correio do Povo*\n(8/12/65); COUTINHO, A. *Brasil; Diário do* *Congresso Nacional;*DINES,\nA. *Idos; Encic. Mirador; Estado de S. Paulo*(10/8/82, 7/4 e 30/12/88,\n28/3, 30/6 e 1/7/89, 18/6, 15/7 e 12/8/94); *Folha de S. Paulo*(16/4,\n31/7 e 26/12/85, 25/2/86, 27/3 e 20/4/88, 22/3/89, 8/3 e 25/8/94,\n13/11/96, 12/5/98); *Globo* (12/3/85, 4/2/86, 25 e 28/1, 4/4 e 1/7/89,\n30/9/92, 26/12/99; 7/5/06); *Grande encic. Delta; Grande encic.\nportuguesa;*HIRSCHOWICZ, E. *Contemporâneos*; *Jornal* *da\nTarde*(22/9/76);*Jornal do Brasil* (29/1, 22/4, 2/7 e 6/8/76, 9 e 22/9,\n19/11/78, 8 e 14/2/79, 11/9/81, 9/10/83, 31/12/85, 6/5, 25/9, 5 e\n13/11/86, 24 e 26/1, 2, 18 e 23/3, 6 e 24/4/89, 3/3, 12/7, 22 e\n23/8/94); KUBITSCHEK, J. *Meu* (3); MACEDO, N.*Aspectos;*NÉRI, S. *16;*\n*Senhor* (23/10/85); SILVA, G. *Constituintes;*SILVA, H.\n*História;*SILVA, H. *1964;*TRIB. SUP. ELEIT. *Dados*(1,**2, 3, 4 e 5*);\nVeja*(28/2/73, 2/8/78, 5/10/83, 8/8/84); VIANA FILHO, L.\n*Governo;*VÍTOR, M. *Cinco.*\n\n \n","dic":"DHBB"}
