{"title":"ALVES, Cícero","cargoss":["Governador de estado ou do Distrito Federal","Deputado federal"],"cargos_esp":[0,0],"datas_ini":[1950,1955],"datas_fim":[1951,1959],"estados":["ES","ES"],"autor":[0],"content":"**ALVES, Cícero**\n\n\\*gov. ES 1950-1951; dep. fed. ES 1955-1959.\n\n \n\n*Cícero Alves* nasceu em Porciúncula (RJ) no dia 29 de abril de 1910,\nfilho de José Paulino Alves e de Teresa Carolina Pereira Alves.\n\nFez seus estudos primários em Muriaé (MG) e secundários no Colégio\nSalesiano de Santa Rosa, em Niterói (RJ), bacharelando-se pela Faculdade\nde Direito da Universidade do Brasil em 1932. Depois de formado,\ndedicou-se ao exercício da advocacia em Muniz Freire (ES), onde\npermaneceu por cinco anos.\n\nIniciou sua carreira política, elegendo-se deputado estadual pelo\nPartido Social Democrático (PSD) no pleito de novembro de 1946. Ocupou\num cadeira na Assembléia Legislativa do Espírito Santo (ALES) em março\ndo ano seguinte, vindo a exercer a presidência da casa entre os anos de\n1949 e 1950. Licenciou-se do mandato parlamentar em 1950 para concorrer\nàs eleições para deputado federal, sempre pelo PSD, mas não conseguiu se\neleger. Na qualidade de presidente da Assembléia Legislativa capixaba,\nassumiu o governo do estado no Espírito Santo, substituindo o governador\nCarlos Lindenberg. Permaneceu à frente do Executivo estadual até janeiro\nde 1951, sendo sucedido por Jones dos Santos Neves, eleito em outubro de\n1950. No governo do seu sucessor, foi secretário do Interior e Justiça\nnos anos de 1953 e 1954.\n\nElegeu-se deputado federal pelo Espírito Santo, sempre pelo PSD, nas\neleições de 3 de outubro de 1954. Exerceu o mandato de 1º de fevereiro\nde 1955 a 31 de janeiro de 1959, tornando-se vice-líder da bancada\npessedista na Câmara Federal em junho de 1958.\n\nAo longo de sua vida foi desembargador, exercendo a magistratura do\nTribunal de Justiça, e ocupou também a presidência desse Tribunal. Foi\nainda corregedor geral da Justiça e da Justiça Eleitoral e presidente do\nTribunal Regional Eleitoral no Espírito Santo.\n\nFoi ainda diretor da Companhia Vale do Rio Doce, procurador-geral do\nDepartamento de Portos e Vias Navegáveis e presidente do Conselho\nAdministrativo da Caixa Econômica.\n\nAntes de aposentar-se, em fevereiro de 1980, foi professor de direito\nfinanceiro e tributário do Centro de Ciências Jurídicas e Sociais da\nUniversidade Federal do Espírito Santo.\n\nFaleceu em Vitória no dia 3 de setembro de 1985.\n\nEra casado com Belmira Hartenreiter Alves, com quem teve quatro filhos.\nViúvo, contraiu segundas núpcias com Maria Helena Espíndula Alves,\nsobrinha de Asdrúbal Martins Soares, deputado federal pelo Espírito\nSanto de 1935 a 1937 e de 1946 a 1951, constituinte de 1946 e governador\ndo estado de 1962 a 1963.\n\n \n\nFONTES: CÂM DEP. *Deputados*; CÂM. DEP. *Deputados federais.\nInventário*; CÂM. DEP. *Relação dos dep*.; CÂM. DEP. *Relação nominal*;\nINF. FAM.\n\n \n","ref":"FONTES: CÂM DEP. *Deputados*; CÂM. DEP. *Deputados federais.\nInventário*; CÂM. DEP. *Relação dos dep*.; CÂM. DEP. *Relação nominal*;\nINF. FAM.\n\n \n","dic":"DHBB"}
