{"title":"ABRÃO, Moisés","cargoss":["Senador"],"cargos_esp":[0],"datas_ini":[1989],"datas_fim":[1995],"estados":["TO"],"autor":[0],"content":"**ABRÃO, Moisés**\n\n\\*sen. TO 1989-1995.\n\n*Moisés Abrão* nasceu em Cumari (TO), no então estado de Goiás, no dia\n11 de novembro de 1945, filho de Abdala Abrão e de Rita Gonçalves Abrão.\nSeu primo Pedrinho Abrão foi deputado federal por Goiás entre 1991 e\n1999.\n\nEmpresário, licenciado em ciências econômicas pela Faculdade de Economia\ne Finanças do Rio de Janeiro em 1971, Moisés Abrão foi presidente da\nAssociação Goiana de Fibra e Descaroçamento (Algofibra) em 1974,\nconselheiro da Associação Comercial e Industrial de Goiás de 1976 a 1978\ne presidente do Sindicato da Indústria do Arroz de Goiás por dois\nmandatos consecutivos (1978-1980 e 1981-1983).\n\nIniciou sua carreira política como deputado estadual em Goiás, eleito na\nlegenda do Partido do Movimento Democrático Brasileiro (PMDB) no pleito\nde novembro de 1982. Empossado em fevereiro de 1983, foi presidente da\nComissão de Finanças e membro da Comissão de Justiça da Assembleia\nLegislativa em 1984. Ainda nesse ano, foi eleito vice-presidente\nregional do PMDB.\n\nCom a criação de Tocantins pela Constituição de 1988, através do\ndesmembramento de Goiás, foram convocadas eleições gerais para o novo\nestado em outubro desse mesmo ano. Os mandatos de prefeitos e\nvereadores, deputados estaduais e federais e para os dois senadores\nmenos votados foram de dois anos, e para o senador mais votado de seis\nanos.\n\nNo pleito de novembro de 1988, concorrendo ao Senado pela legenda do\nPartido Democrata Cristão (PDC), Moisés Abrão foi o senador mais votado.\nEmpossado no início do ano seguinte, foi membro das comissões de\nFiscalização e Controle, Relações Exteriores e Defesa Nacional e Mista\nde Orçamento. Em 1990, concorreu ao governo de Tocantins, tendo sido\nderrotado pelo deputado federal Moisés Avelino.\n\nEm agosto de 1993, já filiado ao Partido Progressista Reformador (PPR),\nagremiação resultante da fusão do PDC com o Partido Democrático Social\n(PDS), apareceu na lista dos 50 maiores devedores da Companhia Nacional\nde Abastecimento, publicada no *Jornal do Brasil*. Sua dívida referia-se\na alimentos que teria desviado ou deixado deteriorar em seus armazéns em\nGoiânia. Eles faziam parte dos estoques estratégicos do governo para\nreduzir os preços dos alimentos básicos no mercado interno do país.\nEncerrou o mandato em janeiro de 1995, ocasião em que deixou o Senado,\nnão tendo disputado a reeleição em outubro do ano anterior.\n\nFundou a Transportadora Apoio, a Sociedade Algodoeira de Goiânia, a\nTransportes, Empreendimentos e Construções, e a Sociedade de Armazéns\nGerais.\n\nCasou-se com Sandra Paiva Abrão, com quem teve três filhas.\n\nFONTES: *Jornal do Brasil* (25/8/93); *Perfil parlamentar/IstoÉ*(1991);\nSENADO. *Dados biográficos*.\n\n \n","ref":"FONTES: *Jornal do Brasil* (25/8/93); *Perfil parlamentar/IstoÉ*(1991);\nSENADO. *Dados biográficos*.\n\n \n","dic":"DHBB"}
