{"title":"DIAS, Álvaro","cargoss":["Deputado federal","Senador","Constituinte","Governador de estado ou do Distrito Federal","Senador"],"cargos_esp":[0,0,0,0,0],"datas_ini":[1975,1983,1987,1987,1999],"datas_fim":[1983,1987,1987,1991,0],"estados":["PR","PR",0,"PR","PR"],"autor":[0],"content":"**DIAS, Álvaro**\n\n\\*dep. fed. PR 1975-1983; sen. PR 1983-1987; const. 1987; gov. PR\n1987-1991; sen. PR 1999-**\n\n \n\n*Álvaro Fernandes Dias* nasceu em Quatá (SP) no dia 7 de dezembro de\n1944, filho de Silvino Fernandes Dias e de Helena Fregadolli Dias. Seu\npai, originário do interior paulista, transferiu-se para a região de\nMaringá (PR) no norte do Paraná, onde se tornou proprietário de terras e\ncafeicultor. Seu irmão Osmar Dias foi senador pelo Paraná a partir de\n1995.\n\nFrequentou por dois anos o seminário em Botucatu (SP), após o que cursou\no ginásio, o secundário e a escola técnica de comércio no Colégio\nMarista de Maringá. Concluído o secundário, trabalhou na administração\ndas propriedades da família e a partir de 1964 frequentou a Faculdade de\nFilosofia, Ciências e Letras da Universidade Estadual de Londrina (PR),\ngraduando-se em história em 1967. Enquanto estudante universitário, foi\npresidente do diretório acadêmico da Faculdade de Filosofia e começou a\ntrabalhar como professor. Foi também apresentador de programas de\nauditório, locutor e redator de radioteatro nas emissoras Paiquerê e,\nposteriormente, na Rádio Atalaia. Escreveu diversas radionovelas, entre\nas quais*A mansão do ódio*, seu maior sucesso.\n\nEm 1968, foi eleito vereador em Londrina na legenda do Movimento\nDemocrático Brasileiro (MDB), partido de oposição ao regime militar\nvigente no país desde abril de 1964. Líder do partido e vice-presidente\nda Câmara Municipal, em novembro de 1970 elegeu-se deputado à Assembleia\nLegislativa do Paraná, ainda na legenda do MDB, deixando a cadeira de\nvereador e iniciando o mandato de deputado estadual em fevereiro de\n1971. Nesse período, atuou ainda como jornalista, mantendo um programa\nde comentários políticos na TV Tibagi, em Londrina. Em 1972\ncandidatou-se a prefeito de Londrina em uma sublegenda do MDB, nas\neleições em que foi vitorioso o então deputado estadual José Richa.\nLíder do MDB na Assembleia, integrou as comissões de Finanças, Instrução\nPública, Agricultura e Polícia.\n\nEm novembro de 1974, elegeu-se deputado federal pelo Paraná na legenda\ndo MDB com 175.434 votos, a maior votação em toda a história do estado.\nAssumiu sua cadeira na Câmara dos Deputados em fevereiro do ano\nseguinte, após encerrar seu mandato de deputado estadual, e durante a\nlegislatura teve seu nome incluído em diversas listas de cassação\nelaboradas pelo regime militar, em virtude de sua postura radicalmente\noposicionista ao governo federal.\n\nMembro efetivo da Comissão de Agricultura e Política Rural e suplente da\nComissão de Educação e Cultura da Câmara, reelegeu-se em novembro de\n1978, tendo sido novamente o candidato mais votado do estado, com\n127.903 votos. Na legislatura iniciada em fevereiro de 1979, integrou a\nComissão de Minas e Energia e tornou-se um dos vice-líderes do MDB na\nCâmara, destacando-se ainda por seus veementes discursos, em que\ndestacava a existência de corrupção no governo militar. Com a extinção\ndo bipartidarismo em 29 de novembro de 1979 e a consequente reformulação\npartidária, filiou-se ao Partido do Movimento Democrático Brasileiro\n(PMDB). Nessa legenda elegeu-se senador em novembro de 1982, num\ncontexto de ascensão das forças oposicionistas ao governo federal,\nderrotando o ex-governador paranaense Ney Braga, candidato do Partido\nDemocrático Social (PDS). No mesmo pleito, o ex-senador José Richa\nelegeu-se governador do estado do Paraná na legenda do PMDB, derrotando\no candidato pedessista Saul Raiz, antigo aliado de Ney Braga na política\nestadual.\n\nTomou posse no Senado em fevereiro de 1983, e foi designado presidente\nda Comissão de Educação e Cultura, da comissão parlamentar de inquérito\n(CPI) encarregada de investigar atos de terrorismo, além de suplente das\ncomissões de Legislação Social e de Relações Exteriores. Nesse período,\nexerceu a presidência do diretório regional do PMDB paranaense e\nconcentrou sua atuação no movimento pela redemocratização do país,\nparticipando ativamente da Campanha das Diretas para a presidência da\nRepública. Foi um dos principais organizadores do primeiro comício pelas\ndiretas em uma grande cidade, realizado em 12 de janeiro de 1984 em\nCuritiba, contrariando a opinião de setores moderados do partido que\nrelutavam em levar a campanha às ruas. Durante a legislatura foi ainda\npresidente da Comissão de Agricultura (1983-1984), vice-presidente da\nComissão de Economia (1985-1986) e vice-líder do PMDB (1985-1986), além\nde suplente das comissões de Legislação Social (1983-1986), de Relações\nExteriores (1983-1986) e de Finanças (1985-1986) do Senado Federal. Fez\ntambém parte do grupo de parlamentares que visitou o México para estudos\nde população e desenvolvimento em 1983, da comitiva brasileira que\nparticipou das reuniões do Parlamento Europeu e do Parlamento\nLatino-Americano em Estrasburgo, na França, em 1984, e da delegação\nbrasileira à XL Sessão da Assembléia Geral das Nações Unidas, em Nova\nIorque, em 1985.\n\nEm 15 de novembro de 1986, foi eleito governador do estado do Paraná com\n2.347.795 votos, na legenda do PMDB, derrotando o candidato da Frente\nPopular de Oposições, o ex-deputado federal Alencar Furtado, que\nconcorreu na legenda do Partido Municipalista Brasileiro (PMB), apoiado\npelo Partido da Frente Liberal (PFL) e pelo Partido Democrático\nTrabalhista (PDT), legenda do candidato a vice-governador, o ex-prefeito\nde Curitiba Jaime Lerner. No mesmo pleito, elegeram-se senadores na\nlegenda do PMDB o ex-governador José Richa e Afonso Camargo. Após a\ninstalação da Assembleia Nacional Constituinte em fevereiro de 1987,\nexerceu por um curto período o mandato de senador constituinte, até ser\nempossado no governo do Paraná no dia 15 março. Foi substituído no\nSenado pelo suplente Francisco Leite Chaves.\n\nGovernador do Paraná\n\nÁlvaro Dias foi um dos 22 governadores eleitos pelo PMDB nas 23 unidades\nda Federação onde houve eleições em 1986, num contexto de grande\ncrescimento da legenda em nível nacional, e o primeiro governador\nparanaense do pós-1964 não egresso de quadros políticos ligados ao\nex-governador Ney Braga.\n\nLogo após tomar posse, empreendeu uma reforma administrativa no estado,\nque redundou na redução para 50% da parcela do orçamento estadual gasta\ncom pagamento do funcionalismo público. Tomou várias medidas de impacto,\ntais como a demissão de “funcionários fantasmas” e o cancelamento de\ngratificações irregulares, entrando em conflito com o Judiciário\nparanaense ao invalidar as aposentadorias e nomeações feitas por\ngovernos anteriores para o Tribunal de Contas do Estado. Em consequência\ndessas medidas, chegou a receber ameaças de morte no início de seu\ngoverno. Além disso, promoveu a criação de duas universidades estaduais\npúblicas no oeste e centro-oeste do estado, a implantação do programa\nParaná Rural, posteriormente adotado em diversos países do mundo, e a\nanulação, por suspeitas de irregularidade, da concorrência de 263\nmilhões de dólares para a construção da usina de Segredo, em Quinhão,\nganha pela empreiteira C. R. Almeida. Sua atitude de cancelar a\nlicitação e determinar a abertura de novo processo de concorrência\nchegou a ser considerada pela imprensa da época como “um exemplo de zelo\ncom o dinheiro público”. Por outro lado, a iniciativa, que conseguiu\nbaixar o preço inicial de cerca de 263 milhões de dólares para 170\nmilhões, o que propiciou a economia significativa aos cofres estaduais,\nocasionou conflitos com os proprietários da empresa preterida.\n\nEm abril de 1989 licenciou-se do mandato de governador para postular a\ncandidatura às eleições presidenciais de 15 de novembro na convenção do\nPMDB, sendo derrotado pelo deputado Ulysses Guimarães. Passou então a\nliderar um movimento dentro do partido para apoiar o candidato do\nPartido da Social Democracia Brasileira (PSDB), Mário Covas, visando a\nevitar que a disputa final se desse entre os dois candidatos então\nfavoritos nas pesquisas: Luís Inácio Lula da Silva, do Partido dos\nTrabalhadores (PT), e Fernando Collor de Melo, do Partido da\nReconstrução Nacional (PRN). No entanto, Covas foi derrotado no primeiro\nturno, e Collor foi eleito presidente da República no segundo turno das\neleições, em 17 de dezembro de 1989.\n\nNa eleição para governador em 1990, participou ativamente da campanha,\ndesempenhando papel decisivo na vitória de seu candidato, o então\nprefeito de Curitiba Roberto Requião, sobre os concorrentes, o\nex-governador José Richa (PSDB) e José Carlos Martinez (PRN), apoiado\npelo presidente Fernando Collor. Pouco antes de transmitir o governo em\n15 março de 1991, decretou a extinção do Banco de Desenvolvimento do\nParaná (Badep), instituição de financiamento criada durante o primeiro\ngoverno de Ney Braga no início dos anos 1960, transferindo suas funções\npara o Banco do Estado do Paraná (Banestado).\n\nApós o término de seu governo, combateu a corrente do PMDB liderada por\nOrestes Quércia, por divergir do rumo dado pelo ex-governador paulista\nao partido, e opôs-se à sua eleição para a presidência do diretório\nnacional. Devido a essas divergências, desligou-se do PMDB em agosto de\n1991 e foi um dos organizadores do Partido Social Trabalhista (PST), que\npassou a presidir. Durante o governo de Itamar Franco (1992-1994) foi\nsondado para ocupar diversos postos, entre os quais o de ministro da\nIndústria e Comércio, mas não chegou a assumir nenhum cargo público,\npreferindo dedicar-se à organização do novo partido.\n\nEm janeiro de 1993 foi um dos organizadores do Partido Progressista\n(PP), nascido da fusão do PST com o Partido Trabalhista Renovador (PTR),\nliderado pelo ex-governador de Brasília Joaquim Roriz, e permaneceu na\npresidência da nova agremiação. Nesse período o partido teve rápida\nexpansão, chegando a ter a quinta maior bancada do Congresso Nacional,\ncom seis senadores e 45 deputados. Em janeiro de 1994, teve sua\ncandidatura à presidência da República lançada pelo PP na convenção do\npartido, mas logo a seguir renunciou à indicação para apoiar o candidato\ndo PSDB, Fernando Henrique Cardoso, que foi eleito no primeiro turno das\neleições, em outubro daquele ano. No mesmo pleito, concorreu novamente\nao governo do Paraná na coligação PP-PMDB, mas foi derrotado já no\nprimeiro turno pelo pedetista Jaime Lerner, que assumiu o governo em 1º\nde janeiro de 1995. Nessas eleições, seu irmão e ex-secretário da\nAgricultura, Osmar Dias, elegeu-se senador na legenda do PP, filiando-se\nem seguida ao PSDB, do qual veio a exercer a vice-liderança no Senado.\n\nEm junho de 1995, após uma longa disputa com o ex-governador do Distrito\nFederal Joaquim Roriz pelo comando do PP, e discordando da fusão deste\ncom o Partido Progressista Renovador (PPR), liderado por Paulo Maluf,\nque se consumaria pouco depois dando origem ao Partido Progressista\nBrasileiro (PPB), transferiu-se para o PSDB. Dedicou-se então à\nreestruturação do partido no Paraná, trazendo para a legenda vários\ndeputados estaduais e federais. Consolidou sua posição como principal\nliderança tucana no Paraná ao impedir, com êxito, a filiação ao partido\ndo governador Jaime Lerner, que, em setembro de 1997, se transferiria\npara o PFL.\n\nEm fevereiro de 1997, coordenou a mobilização da bancada paranaense\nvisando à aprovação da emenda que permitiu a reeleição do presidente da\nRepública. Em abril do mesmo ano assumiu a presidência da Companhia\nTelefônica do Paraná (Telepar). Durante esse período, além de suas\natividades administrativas na empresa, participou de inúmeras\narticulações políticas referentes às próximas eleições para o governo do\nestado e para o Senado Federal, a serem realizadas no ano seguinte.\n\nNo Senado\n\nEm outubro de 1998 disputou uma vaga no Senado na legenda do PSDB.\nVitorioso — obteve 2.532.023 sufrágios, ou 65,13% dos votos válidos —,\nassumiu o mandato em 1º de fevereiro de 1999. No período seguinte\nparticipou, como membro titular, da Comissão de Educação, da Comissão de\nConstituição, Justiça e Cidadania, e da Comissão de Relações Exteriores\ne Defesa Nacional do Senado, presidiu a Comissão Parlamentar de\nInquérito (CPI) do Futebol e a Comissão Parlamentar Mista de Inquérito\n(CPMI) da Terra, e integrou também as CPMIs dos Bingos e dos Correios.\nNotabilizou-se exatamente por sua participação ativa em investigações\nque apuravam denúncias dos mais variados tipos de ilícitos e\nirregularidades lesivas à administração pública.\n\nNa CPI do Futebol, entre setembro de 2000 e dezembro de 2001, tomou\nparte nas investigações que revelaram vários crimes na gestão desse\nesporte. A CPI ouviu depoimentos dos principais dirigentes esportivos\nbrasileiros e teve ampla repercussão na imprensa e na opinião pública.\nSeu relatório final denunciou 17 dirigentes de clubes e propôs regras\ncomo o Estatuto do Torcedor e a Lei de Responsabilidade Social do\nDesporto Brasileiro.\n\nEm setembro de 2001, após assinar requerimento pedindo a abertura de uma\nCPI para investigar denúncias de corrupção no governo do presidente\nFernando Henrique Cardoso, foi expulso do PSDB. Na ocasião, declarou que\ntanto sua decisão quanto a de seu irmão, Osmar Dias, de apoiar a CPI\nrefletiam o desejo popular de investigar a corrupção no governo, bem\ncomo a fidelidade às diretrizes programáticas de seu partido. Após ser\nexpulso do PSDB filiou-se ao PDT, partido de Osmar Dias.\n\nNo pleito de outubro de 2002 foi candidato ao governo do Paraná na\nlegenda do PDT em coligação com o Partido Trabalhista Brasileiro (PTB),\no Partido Trabalhista Nacional (PTN), o PPB, o Partido Republicano\nProgressista (PRP) e o Partido Trabalhista do Brasil (PTdoB). Foi o mais\nvotado no primeiro turno, com 1.616.047 votos, o equivalente a 31,4% dos\nvotos válidos, mas no segundo turno a situação se inverteu, e foi\nderrotado por seu adversário Roberto Requião, do PMDB, que foi eleito\ncom 2.681.811 de votos, equivalentes a 55,2% dos votos válidos,\nsuperando os seus 2.180.922 de sufrágios, ou 44,8% dos votos válidos.\nApós as eleições, atribuiu sua derrota ao crescimento eleitoral de Luís\nInácio Lula da Silva e do PT naquele ano – em sua quarta tentativa, Lula\nfoi então eleito presidente da República – e licenciou-se por um curto\nperíodo, reassumindo o mandato no Senado em março de 2003. Na ocasião,\nfoi substituído pelo suplente Olivir Gabardo.\n\nApós a posse de Lula na presidência da República, em 1º de janeiro de\n2003, permaneceu na oposição ao governo. Ocupou frequentemente a tribuna\ndo Senado para fazer pronunciamentos nos quais criticava a gestão de\nLula no plano nacional, e a administração de Roberto Requião no plano\nestadual, acusando ambos os governos de não cumprir as promessas de\ncampanha e de se apropriar indevidamente de projetos criados por seus\nantecessores. Em agosto de 2003, em discurso na tribuna, anunciou sua\ndesfiliação do PDT e seu retorno ao PSDB, tornando-se em seguida\nprimeiro vice-líder do partido no Senado. Nesse período, foi sancionada\npelo presidente Lula lei de sua autoria aumentando em 120% os repasses\ndo salário educação para o ensino fundamental, que ficou conhecida como\n“Lei Álvaro Dias”; em consequência, ocorreu um grande aumento nos\nrepasses da verba de educação para as prefeituras municipais.\n\nDurante o período em que presidiu a CPMI da Terra, entre outubro de 2003\ne novembro de 2005, foi um dos principais responsáveis pela aprovação de\num relatório que propôs, entre outras coisas, o indiciamento de\nrepresentantes de associações por desvio de verbas públicas e\nirregularidades na efetivação da reforma agrária. O relatório teve\ngrande repercussão na época, provocando veementes protestos de\nassociações de trabalhadores rurais, especialmente do Movimento dos\nTrabalhadores Rurais Sem Terra (MST). Na ocasião, reagiu aos protestos\nafirmando que a CPMI já havia reunido indícios suficientes de\nenvolvimento de coordenadores do MST em desvio de verbas públicas que\ndeveriam ter sido aplicadas em assentamentos rurais, e contestou as\ndeclarações de deputados petistas segundo as quais seu objetivo, ao\napurar as denúncias de desvios verbas públicas, seria a “criminalização\ndos movimentos sociais”. Negou também o uso político da CPMI contra o\ngoverno Lula.\n\nNa última sessão, os integrantes da CPMI derrubaram por 13 votos a 8 o\ntexto final produzido pelo relator deputado João Alfredo, do Partido\nSocialismo e Liberdade (PSOL) e ligado a movimentos de trabalhadores\nrurais, e aprovaram por 12 votos a 1 um texto alternativo de autoria do\ndeputado Abelardo Lupion, do PFL, que classificava a invasão de terra\ncomo \"ato terrorista\". No relatório de João Alfredo, a causa apontada\npara os conflitos de terra era a falta da reforma agrária, enquanto no\nrelatório de Abelardo Lupion a reforma agrária era identificada como uma\nameaça ao direito de propriedade da terra. O relatório final, aprovado\nem 29 de novembro de 2005, propunha ainda o indiciamento de 11 pessoas,\nsendo 8 do MST, entre elas João Pedro Stédile, José Rainha e Gilmar\nMauro, os principais dirigentes do movimento, além de diretores da\nAssociação Nacional de Cooperação Agrícola (Anca) e da Confederação das\nCooperativas de Reforma Agrária (Concrab), entidades a ele ligadas. Na\nocasião, Álvaro Dias afirmou que não concordava inteiramente com os\ntermos do relatório aprovado e que encaminharia ambos os relatórios ao\nMinistério Público para a tomada de providências, embora só o relatório\naprovado tivesse validade legal.\n\nNesse mesmo período, participou ativamente da CPMI dos Bingos, que\nfuncionou no Senado entre junho de 2005 e novembro de 2006 para\ninvestigar a atuação do ex-assessor da Casa Civil da Presidência da\nRepública, Waldomiro Diniz, filmado negociando propina com um empresário\ndo ramo de jogos. Apelidada de \"CPI do Fim do Mundo\", a comissão passou\na investigar diversas denúncias surgidas contra o governo, tais como a\nde um suposto vínculo entre o assassinato do prefeito de Santo André\n(SP) Celso Daniel (PT) e o esquema de financiamento de campanhas do PT,\na de possíveis irregularidades na prefeitura de Ribeirão Preto (SP)\ndurante a gestão de Antônio Palocci (PT), e a de doação de casas de\nbingo, ou de remessa de dólares vindos de Cuba para a campanha de Lula,\nentre outras. Álvaro Dias participou em várias frentes de atuação da\nCPMI, especialmente da que investigava o assassinato de Celso Daniel e a\nviolação do sigilo bancário do caseiro Francenildo Costa, após este ter\ndeclarado que Antônio Palocci, então ministro da Fazenda, frequentava\ncasa alugada em Brasília para que seus antigos assessores em Ribeirão\nPreto organizassem a prática de *lobby*. Na ocasião, liderou a\nsubcomissão que foi à Caixa Econômica cobrar explicações dos diretores,\nque mais tarde foram afastados, enquanto Palocci se demitiu do\nministério. Por ocasião da apresentação do relatório final da CPMI em\nplenário, apresentou voto em separado pedindo o indiciamento do\nex-assessor especial da Presidência da República, Gilberto Carvalho, e\ndo ex-chefe da Casa Civil, José Dirceu, ambos excluídos do relatório.\n\nLogo após a instalação da CPMI dos Bingos, foi criada, em maio de 2005,\na chamada CPMI dos Correios, com o objetivo de investigar denúncias de\ncorrupção e desvio de verbas em empresas estatais, particularmente na\nEmpresa Brasileira de Correios e Telégrafos. Entretanto, após o início\ndas investigações, o foco deslocou-se para o \"mensalão\", suposto esquema\nde desvio de verbas públicas para o pagamento mensal de deputados da\nbase aliada do governo em troca de apoio parlamentar, denunciado pelo\ndeputado federal Roberto Jefferson (PTB). As acusações se prolongaram\ndurante todo o ano de 2005 e envolveram vários integrantes do primeiro\nescalão do governo Lula, provocando grave crise política. Durante os\ntrabalhos da CPMI, Álvaro Dias destacou-se por levantar dados sobre\ncontratos irregulares de publicidade e remessas ilegais de dinheiro para\no exterior. Por ocasião da votação do relatório final da CPMI em\nplenário, em abril de 2006, apresentou voto em separado pedindo a\nresponsabilização e a abertura de um processo de *impeachment*contra o\npresidente em caso de confirmação das denúncias. Posteriormente, com\nbase nas investigações da CPMI dos Correios, o procurador-geral da\nRepública denunciaria 40 pessoas que seriam transformadas em réus pelo\nSupremo Tribunal Federal (STF).\n\nNo pleito de outubro de 2006 conquistou a única vaga de senador pelo\nestado do Paraná então em disputa com 2.572.481 votos (50,9%), pouco à\nfrente da segunda colocada e grande surpresa das eleições daquele ano,\nGleisi Hoffman, que obteve 2.299.088 votos (45,1%).\n\nAo longo desse período, foi indicado por duas vezes consecutivas como um\ndos mais influentes parlamentares do país pelo Departamento\nIntersindical de Assessoria Parlamentar (DIAP). Em dezembro de 2006 foi\no senador mais votado na primeira consulta pública eletrônica realizada\npelo *site* Congresso em Foco para eleger os melhores parlamentares da\nlegislatura. Recebeu 624.381 votos, 14.180 a mais que o segundo\ncolocado, Eduardo Suplicy (PT-SP). \n\nAssumiu o terceiro mandato de senador em fevereiro de 2007 e, logo no\ninício da legislatura, foi escolhido para representar o PSDB na CPI das\nONGs, encarregada de apurar a liberação pelo governo federal de recursos\npúblicos para organizações não governamentais (ONGs) e organizações da\nsociedade civil de interesse público (OSCIPs), bem como a utilização,\npor essas entidades, desses recursos e de outros por elas recebidos do\nexterior entre os anos de 1999 e 2006. Foi eleito por unanimidade\nvice-presidente do Senado, e em julho ano recebeu em San Diego, na\nCalifórnia, o diploma de doutor *honoris causa* em administração\ngovernamental da Southern States University. Na ocasião, a universidade\ndestacou diversos programas bem-sucedidos durante sua gestão no governo\ndo Paraná, especialmente aqueles voltados para a preservação ambiental,\napontando-o como exemplo de administração pública eficiente. Ainda em\n2007 foi novamente considerado um dos políticos mais influentes do país\npor um estudo da consultoria Arko Advice. Nesse período, foi\nvice-presidente nacional do PSDB, e membro da Comissão de Constituição,\nJustiça e Cidadania, e da Comissão de Relações Exteriores e Defesa\nNacional do Senado.\n\nComo vice-líder do bloco de oposição ao governo Lula, apresentou várias\nproposições legislativas que tiveram grande repercussão na opinião\npública, tais como a Proposta de Emenda Constitucional (PEC) 5/2006,\nobrigando o plenário do STF, e não um único ministro, a analisar\nliminares de assuntos exclusivos do Congresso Nacional; a PEC 29/2006,\ntornando obrigatória a instituição do plano de carreira para os\nservidores públicos da administração pública direta, das autarquias e\ndas fundações públicas; o Projeto de Lei do Senado (PLS) 134/2006,\nproibindo o governo de contingenciar verbas para programas de segurança\npública e estabelecendo que os ministros da Justiça, da Fazenda e os\nordenadores de despesas respondessem por crime de responsabilidade em\ncaso de descumprimento da determinação; as PECs 67, 68, 69 e 70/2007,\nreduzindo progressivamente o número de parlamentares federais, estaduais\ne municipais, e a PEC 86/2007, acabando com o voto secreto em plenário.\n\nEm março de 2009, diante de novas denúncias referentes ao repasse\nirregular de verbas ao MST pelo governo federal, decidiu encaminhar ao\nministro do Desenvolvimento Agrário, Guilherme Cassel, à Procuradoria\nGeral da República, e ao presidente do STF, Gilmar Mendes, cópia do\nrelatório final da CPMI da Terra, que havia apontado irregularidades\nenvolvendo entidades ligadas ao MST, e cujo texto final mencionava um\ndesvio de 18 milhões de reais das entidades Associação Nacional de\nCooperação Agrícola (Anca), Confederação das Cooperativas de Reforma\nAgrária do Brasil (Concrab) e Instituto Técnico de Capacitação e\nPesquisa da Reforma Agrária (Iterra).\n\nEm maio, foi o autor do requerimento solicitando a formação de uma CPI\npara apurar irregularidades envolvendo a empresa Petróleo Brasileiro S/A\n(Petrobras) e a Agência Nacional de Petróleo, Gás Natural e\nBicombustíveis (ANP). Com a aprovação da proposição e a posterior\ninstalação da CPI em julho do mesmo ano, tornou-se um de seus\nintegrantes, passando a concentrar suas atividades nos trabalhos da\ncomissão.\n\nCasou-se com Débora de Almeida Fernandes Dias, com quem teve dois\nfilhos.\n\nPublicou*A história pede passagem* (3v.) e manteve regularmente um blog\nsobre assuntos políticos em seu website pessoal:\nhttp://www.senadoralvarodias.com/.**\n\n \n\nSérgio Soares Braga\n\n \n\n**FONTES:** CÂM. DEP.*Deputados brasileiros.*Repertório\n(1983-1987);*Correio Braziliense* (23/11/86); ENTREV. Álvaro\nDias;*Estado de S. Paulo* (20/6/80, 10/12/81, 31/7 e 18/11/82, 28/9 e\n20/11/86);*Estado de S.Paulo* (online). Disponível em :\n\\<[http://www.estadao.com.br](http://www.estadao.com.br/)\\>. Acesso em :\n14 out. 2009;*Estado do Paraná*(30/11/97 e 21/11/05)*;* *Estado do\nParaná* (online). Disponível em :\n\\<[http://www.parana-online.com.br](http://www.parana-online.com.br/)\\>.\nAcesso em : 14 out. 2009; FARIA, E. ; SEBASTIANI, S. *Governadores*;\nFLEISCHER, D. *Conseqüências*;*Folha de S. Paulo* (25/2/87, 15/7/98 e\n22/9/09);\n*[](/dhbb/verbete/www.folha.com.br%20(acesso%20em%2014/10/2009))Folha de\nS.Paulo* (online). Disponível em :\n\\<[http://www.folha.uol.com.br](http://www.folha.uol.com.br/)\\>. Acesso\nem : 14 out. 2009;*Globo* (26/4/87, 23/6/95);*Jornal do Brasil*\n(18/4/84, 8/4 e 4/5/87)*;* Portal do sen. Álvaro Dias. Disponível em :\n\\<[http://www.senadoralvarodias.com](http://www.senadoralvarodias.com/)\\>.\nAcesso em : 18 out. 2009; Portal do Senado Federal. Disponível em :\n\\<[http://www.senado.gov.br](http://www.senado.gov.br/)\\>. Acesso em :\n15 out. 2009; Portal do TSE. Dis- ponível em :\n\\<[http://www.tse.gov.br](/dhbb/verbete/,%20http:/www.tse.gov.br/)\\>.\nAcesso em : 14 out. 2009; SENADO. *Dados bio- gráficos*\n(1991-1999);*Veja* (13/7/83, 6/8 e 5/11/86, 18/2/87, 13/4/88, 8/3, 19/4,\n24/5 e 13/9/89, 9/6/93, 20 e 27/4 e 14/9/94).\n\n \n\n \n\n \n\n \n\n \n\n \n\n \n\n \n\n \n\n \n\n \n","ref":"**FONTES:** CÂM. DEP.*Deputados brasileiros.*Repertório\n(1983-1987);*Correio Braziliense* (23/11/86); ENTREV. Álvaro\nDias;*Estado de S. Paulo* (20/6/80, 10/12/81, 31/7 e 18/11/82, 28/9 e\n20/11/86);*Estado de S.Paulo* (online). Disponível em :\n\\<[http://www.estadao.com.br](http://www.estadao.com.br/)\\>. Acesso em :\n14 out. 2009;*Estado do Paraná*(30/11/97 e 21/11/05)*;* *Estado do\nParaná* (online). Disponível em :\n\\<[http://www.parana-online.com.br](http://www.parana-online.com.br/)\\>.\nAcesso em : 14 out. 2009; FARIA, E. ; SEBASTIANI, S. *Governadores*;\nFLEISCHER, D. *Conseqüências*;*Folha de S. Paulo* (25/2/87, 15/7/98 e\n22/9/09);\n*[](/dhbb/verbete/www.folha.com.br%20(acesso%20em%2014/10/2009))Folha de\nS.Paulo* (online). Disponível em :\n\\<[http://www.folha.uol.com.br](http://www.folha.uol.com.br/)\\>. Acesso\nem : 14 out. 2009;*Globo* (26/4/87, 23/6/95);*Jornal do Brasil*\n(18/4/84, 8/4 e 4/5/87)*;* Portal do sen. Álvaro Dias. Disponível em :\n\\<[http://www.senadoralvarodias.com](http://www.senadoralvarodias.com/)\\>.\nAcesso em : 18 out. 2009; Portal do Senado Federal. Disponível em :\n\\<[http://www.senado.gov.br](http://www.senado.gov.br/)\\>. Acesso em :\n15 out. 2009; Portal do TSE. Dis- ponível em :\n\\<[http://www.tse.gov.br](/dhbb/verbete/,%20http:/www.tse.gov.br/)\\>.\nAcesso em : 14 out. 2009; SENADO. *Dados bio- gráficos*\n(1991-1999);*Veja* (13/7/83, 6/8 e 5/11/86, 18/2/87, 13/4/88, 8/3, 19/4,\n24/5 e 13/9/89, 9/6/93, 20 e 27/4 e 14/9/94).\n\n \n\n \n\n \n\n \n\n \n\n \n\n \n\n \n\n \n\n \n\n \n","dic":"DHBB"}
