{"title":"DIAS, Estélio","cargoss":["Deputado federal","Constituinte"],"cargos_esp":[0,0],"datas_ini":[1983,1987],"datas_fim":[1991,1988],"estados":["ES",0],"autor":[0],"content":"**DIAS, Estélio**\n\n\\*dep. fed. ES 1983-1991; const. 1987-1988.\n\n*Estélio Dias* nasceu em Vitória em 8 de maio de 1939, filho de Zaluar\nDias e de Deocelina Dias.\n\nIngressou na Faculdade de Direito da atual Universidade Federal do\nEspírito Santo (UFES) em 1958 e em 1960 já trabalhava como\nsegundo-oficial judiciário do Tribunal de Justiça, função que\ndesempenhou até 1961. Em seguida, assumiu a secretaria da Presidência da\nAssembléia Legislativa, na qual permaneceu até 1962, ano em que\nbacharelou-se em ciências jurídicas e sociais. Em 1966 fez o curso de\nespecialização em planejamento econômico através de um intercâmbio entre\na UFES e a Comissão Econômica para a América Latina (CEPAL).\n\nDiretor do Departamento de Educação e Cultura, professor e membro da\nComissão de Planejamento da UFES, na qual permaneceria até 1969,\nparticipou em 1968 da visita oficial aos Estados Unidos pelo convênio\nUFES-AID (Agency for International Development), fazendo nesse mesmo ano\nestágios em administração universitária na Universidad de Guadalajara\n(México) e na Universidade de Houston, Texas (EUA). Entre janeiro de\n1970 e junho de 1971 fez o mestrado em educação pela Universidade de\nHouston e em agosto iniciou o doutorado em educação e administração. Em\n1972 foi representante dessa universidade, a convite do governo\namericano, na visita oficial à Guatemala e ao México, tornando-se PhD em\neducação e administração no ano seguinte.\n\nEm 1974, de volta ao Brasil, tornou-se professor titular da UFES, função\nque exerceria até 1991. Membro do Conselho Estadual de Educação, em 1976\nassumiu o cargo de diretor-superintendente da Fundação Jones dos Santos\nNeves, órgão de planejamento do governo estadual, transformado\nposteriormente em instituto, no qual permaneceria até 1978, durante o\ngoverno Élcio Álvares (1975-1979). Em 1979, com a posse do governador\nEurico Resende (1979-1983), foi nomeado secretário de Educação e\nCultura. Durante a sua gestão esteve em visita oficial à Alemanha, a\nconvite do governo alemão, e ao Canadá. Voltou ao México em 1981 a\nserviço da Organização das Nações Unidas (ONU), como consultor de\nprogramas.\n\nDeixou a secretaria em 1982 para candidatar-se à Câmara dos Deputados em\nnovembro. Eleito pelo Partido Democrático Social (PDS), assumiu em março\nde 1983. Tornou-se membro efetivo da Comissão de Educação e Cultura. Em\n25 de abril de 1984, votou a favor da emenda Dante de Oliveira, que\npropunha o restabelecimento de eleições diretas para a escolha do\npresidente da República em novembro daquele ano. A emenda não obteve o\nnúmero de votos necessário para ser aprovada (faltaram 22 para que\npudesse ser enviada ao Senado).\n\nEm 15 de janeiro de 1985, no Colégio Eleitoral que elegeu o sucessor do\npresidente João Figueiredo, foi o único membro do PDS capixaba a seguir\na dissidência do partido, a Frente Liberal, no apoio à candidatura\nvitoriosa de Tancredo Neves, lançada pela frente oposicionista Aliança\nDemocrática, que, além da Frente, contava com o Partido do Movimento\nDemocrático Brasileiro (PMDB). Por motivo de doença, Tancredo não chegou\na tomar posse e morreu em 21 de abril de 1985. Seu substituto foi o vice\nJosé Sarney, que vinha exercendo interinamente o cargo desde 15 de\nmarço.\n\nUm dos fundadores do Partido da Frente Liberal (PFL) no Espírito Santo,\ncriado em 25 de janeiro de 1985, elegeu-se deputado federal constituinte\nem novembro de 1986. Candidato mais votado do partido no estado, com\nquase 48 mil votos, foi empossado em 1º de fevereiro de 1987, quando\ncomeçaram os trabalhos da Assembléia Nacional Constituinte. Nesse mesmo\nano participou como titular da Subcomissão dos Direitos dos\nTrabalhadores e Servidores Públicos, da Comissão da Ordem Social, e foi\nsuplente da Subcomissão de Princípios Gerais, Intervenção do Estado,\nRegime da Propriedade do Subsolo e da Atividade Econômica, da Comissão\nda Ordem Econômica.\n\nNas principais votações da Constituinte, pronunciou-se contra a pena de\nmorte, a limitação do direito de propriedade privada, a remuneração 50%\nsuperior para o trabalho extra, a jornada semanal de 40 horas, o turno\nininterrupto de seis horas, a nacionalização do subsolo, o limite de 12%\nao ano para os juros reais, a limitação dos encargos da dívida externa,\na criação de um fundo de apoio à reforma agrária, a anistia aos micro e\npequenos empresários, a legalização do jogo do bicho e a desapropriação\nda propriedade produtiva. Votou a favor do mandado de segurança\ncoletivo, da proteção ao emprego contra a despedida sem justa causa, da\npluralidade sindical, da soberania popular, do presidencialismo e do\nmandato de cinco anos para Sarney.\n\nCom a promulgação da nova Carta Constitucional em 5 de outubro de 1988,\nvoltou a participar dos trabalhos legislativos ordinários da Câmara.\nMembro da executiva nacional do PFL e vice-presidente regional do\npartido, candidatou-se à reeleição em outubro de 1990, mas obteve apenas\numa suplência. Deixou a Câmara em janeiro de 1991, no fim da\nlegislatura. Ao longo desse ano foi chefe de gabinete do ministro da\nSaúde, Alceni Guerra (1990-1992), e, em 1992, tornou-se assessor\nespecial da Secretaria de Governo da Presidência da República, cargo que\ncontinuou a exercer no Ministério da Indústria e Comércio de 1993 a\n1994.\n\nEm outubro de 1994, voltou a candidatar-se a deputado federal, pelo\nPartido Democrático Trabalhista (PDT), mas novamente alcançou apenas uma\nsuplência.\n\nEntre 1995 e 1996 foi chefe da assessoria do Ministério da Previdência.\n\nEm outubro de 1998 candidatou-se novamente à Câmara, não sendo de novo\nbem- sucedido. Em 1999 assumiu a função de coordenador de programas e\nprojetos da área de desenvolvimento social da UNESCO (Organização das\nNações Unidas para a Educação, a Ciência e a Cultura), em Brasília.\n\nExerceu o cargo de secretário de Educação durante o governo de José\nInácio Ferreira (1999-2003), permanecendo à frente da pasta até meados\nde 2002. Durante a sua gestão, defendeu o fim da exigência de fiador\npara a matrícula nas escolas e faculdades privadas no estado, e promoveu\na mudança na periodicidade no exame supletivom que passou a ser\noferecido três vezes por ano, entre outras iniciativas.\n\nEm 2007 foi indiciado pelo Ministério Público do Espírito Santo –\njuntamente com o ex-governador Inácio Ferreira, o ex-presidente da\nAssembléia Legislativa José Carlos Gratz, e João Luiz de Mendes Tovar e\nJosé Carlos da Fonseca Júnior (ex-secretários de Fazenda), Milton Gomes\nde Oliveira (ex-secretário de Saúde), Jorge Hélio Leal (ex-secretário de\nTransportes), entre outros – por improbidade administrativa, praticada\nquando exerceu a função de secretário de Educação.\n\nFoi também jornalista provisionado, técnico em administração e membro\ndos conselhos do Controle do Meio Ambiente, do Desenvolvimento\nFlorestal, e de Ensino e Pesquisa da UFES.\n\nCasou-se com Rita de Cássia de Resende Dias, com quem teve duas filhas.\n\nPublicou Teoria geral dos sistemas em busca de uma ciência (1972),\nAnálise sócio-econômica e cultural do vestibular (1975) e Conseqüências\nsócio-econômicas decorrentes da implantação da rodovia Belém-Brasília\n(1975).\n\nMárcia Quarti\n\n        Mirna Aragão atualização\n\nFONTES: CÂM. DEP. Deputados brasileiros. Repertório (1983-1987); Folha\nde S. Paulo (13/1/85; 19 e 31/1 e 3/3/1987); Globo (6/6/85); INF. BIOG.\n\n \n","ref":"FONTES: CÂM. DEP. Deputados brasileiros. Repertório (1983-1987); Folha\nde S. Paulo (13/1/85; 19 e 31/1 e 3/3/1987); Globo (6/6/85); INF. BIOG.\n\n \n","dic":"DHBB"}
