{"title":"DIAS, Juvêncio","cargoss":["Deputado federal","Senador","Senador"],"cargos_esp":[0,0,0],"datas_ini":[1967,1998,1992],"datas_fim":[1979,1999,1993],"estados":["PA","PA","PA"],"autor":[0],"content":"**DIAS, Juvêncio**\n\n\\*dep. fed. PA 1967-1979; sen. PA 1992-1993, 1998-1999.\n\n* *\n\n*                Juvêncio Antônio Vergolino Dias*nasceu em Belém no dia\n16 de outubro de 1929, fi­lho de Juvêncio de Figueiredo Dias e de Ma­ria\nDorila Vergolino Dias.\n\n            Formado pela Faculdade de Medicina da Universidade do Pará\nem 1953, fez cursos de pós-graduação no Instituto Penido Burnier, de\nCampinas (SP), no Hospital das Clínicas de São Paulo e na Clínica Kós,\ndo Rio de Ja­neiro.\n\n            Em novembro de 1966, elegeu-se deputa­do federal pelo Pará\nna legenda da Aliança Renovadora Nacional (Arena), partido de apoio ao\nregime militar instalado em abril de 1964, assumindo o mandato em\nfevereiro de 1967.  Reeleito em 1970, a partir de 1971 integrou as\ncomissões de Transportes, de Comunicações e Obras Públicas e de\nValorização Econômica da Ama­zônia da Câmara. Novamente reeleito em\n1974, a partir do ano seguinte tornou-se mem­bro da Comissão de\nAgricultura e Política Ru­ral, além de suplente da Comissão de Relações\nExteriores da Câmara. Candidatou-se à reeleição em novembro de 1978,\nmas, obten­do apenas uma suplência, deixou a Câmara em janeiro de 1979.\n\n            Em seguida, tornou-se diretor do Banco da Amazônia, cargo\nque ocupou até 1990. Neste último ano, no pleito de outubro, elegeu-se\nsuplente de senador, na chapa do Partido do Movimento Democrático\nBrasileiro (PMDB) encabeçada por Coutinho Jorge.\n\nNo início de outubro de 1992, Itamar Franco assumiu o governo, em\ncaráter interino, após a Câmara dos Deputados aprovar a admissibilidade\nde abertura do  processo de afastamento do presidente Fernando Collor\n(1990-1992), acusado de várias irregularidades. Com a nomeação de\nCoutinho Jorge, pelo presidente recém-empossado, para o novo Ministério\nda Amazônia Legal e Meio Ambiente, Juvêncio Dias assumiu a cadeira do\ntitular no Senado. Quando do julgamento do *impeachment*de Collor, em 29\nde  dezembro desse ano, por essa casa do Congresso, pouco antes da\nvotação, o presidente afastado apresentou sua renúncia, que não foi\naceita pela Mesa do Senado. Horas depois, com voto favorável de Juvêncio\nDias, o plenário da Câmara Alta aprovou o afastamento definitivo de\nFernando Collor, que, em conseqüência, teve seus direitos políticos\nsuspensos por oito anos. Com esse resultado, Itamar foi efetivado na\nchefia do Executivo brasileiro.\n\n            Com o retorno de Coutinho Jorge ao Senado em setembro de\n1993, Juvêncio Dias voltou à condição de suplente. Em junho de 1998,\nmais uma vez assumiu o mandato de senador, desta vez devido à saída de\nCoutinho Jorge para o Tribunal de Contas do Estado do Pará. Em janeiro\nde 1999, ao término da legislatura, deixou o Senado.\n\n            Foi casado com Anete Teixeira Dias, com quem teve dois\nfilhos. Seu filho André Teixeira Dias foi vereador em Belém pelo PMDB\nentre 1993 e 1994, ano em que se elegeu deputado estadual na legenda do\nPartido da Frente Liberal (PFL). Reelegeu-se, no mesmo partido, em\noutubro de 1998.\n\n \n\nFONTES: CÂM. DEP. *Deputados Brasileiros. Repertórios*(1967-1971,\n1971-1975 e 1975-1979); INF. Jacqueline Dias; *Jornal do\nSenado*(25/6/98); NÉRI, S. *16; Perfil*(1972).\n","ref":"FONTES: CÂM. DEP. *Deputados Brasileiros. Repertórios*(1967-1971,\n1971-1975 e 1975-1979); INF. Jacqueline Dias; *Jornal do\nSenado*(25/6/98); NÉRI, S. *16; Perfil*(1972).\n","dic":"DHBB"}
