{"title":"DIVINO, João","cargoss":["Deputado federal"],"cargos_esp":[0],"datas_ini":[1983],"datas_fim":[1987],"estados":["GO"],"autor":[0],"content":"**DIVINO, João**\n\n\\*dep. fed. GO 1983-1987.\n\n \n\n*João Divino Dorneles* nasceu em Goiânia no dia 25 de maio de 1933,\nfilho de José Dorneles dos Santos e de Benvinda Gonçalves de Resende.\n\nAos 18 anos foi aprovado num concurso para a Prefeitura de Goiânia, para\nexecutar trabalhos braçais, mudando de função várias vezes, vindo a\nocupar a presidência da Associação Municipal da cidade.\n\nIngressou na política ao filiar-se ao Partido Social Democrático (PSD)\ne, com a instauração do regime militar em abril de 1964, foi preso, em\nvirtude do cargo que ocupava na Associação Municipal e do papel de\ncomando na greve dos funcionários públicos que explodiu na cidade ainda\nnesse ano.\n\nCom a extinção dos partidos políticos pelo Ato Institucional nº 2\n(27/10/1965) e a posterior instauração do bipartidarismo, ingressou na\nlegenda oposicionista Movimento Democrático Brasileiro (MDB), ainda que\nmantivesse ligações com o Partido Comunista Brasileiro (PCB).\n\nEm 1968 bacharelou-se em ciências jurídicas e sociais pela Faculdade de\nDireito da Universidade Federal de Goiás e tornou-se procurador da\nPrefeitura de Goiânia.\n\nEm novembro de 1974 foi eleito deputado estadual na legenda emedebista,\nassumindo o mandato em fevereiro do ano seguinte, e em novembro de 1978\nreelegeu-se, sendo empossado em fevereiro de 1979.\n\nCom a extinção do bipartidarismo em novembro de 1979 e a conseqüente\nreorganização partidária, ingressou no Partido do Movimento Democrático\nBrasileiro (PMDB), agremiação que deu continuidade ao extinto MDB. Na\nAssembléia Legislativa, foi membro da Comissão de Constituição e Justiça\ne da Comissão de Finanças, Serviço Público e Bem-Estar do Menor. Neste\nperíodo foi o fundador e primeiro presidente do Comitê Goiano pela\nAnistia.\n\nNas eleições de novembro de 1982, foi um dos coordenadores da campanha\nvitoriosa de Íris Resende ao governo do estado e concorreu a uma cadeira\nde deputado federal pelo PMDB. Eleito, foi empossado em fevereiro de\n1983 e tornou-se membro da Comissão de Constituição e Justiça.\n\nEm 25 de abril de 1984 manifestou-se a favor da emenda Dante de\nOliveira, que, apresentada na Câmara dos Deputados, propôs o\nrestabelecimento das eleições diretas para presidente da República em\nnovembro daquele ano. Como a emenda não obteve o número de votos\nindispensáveis à sua aprovação — faltaram 22 para que o projeto pudesse\nser encaminhado à apreciação pelo Senado —, no Colégio Eleitoral,\nreunido em 15 de janeiro de 1985, João Divino votou no candidato\noposicionista Tancredo Neves, eleito novo presidente da República pela\nAliança Democrática, uma união do PMDB com a dissidência do Partido\nDemocrático Social (PDS) abrigada na Frente Liberal. Tancredo derrotou o\ncandidato do regime militar, Paulo Maluf, contudo não chegou a ser\nempossado na presidência, vindo a falecer em 21 de abril de 1985. Seu\nsubstituto foi o vice José Sarney, que já vinha exercendo interinamente\no cargo desde 15 de março.\n\nJoão Divino deixou a Câmara dos Deputados em janeiro de 1987, ao final\nda legislatura, não tendo conseguido se reeleger em novembro anterior.\n\nEm 1988 assumiu a presidência da Companhia Urbanizadora de Goiânia. No\nano seguinte aposentou-se da função de procurador, continuando a atuar\nnos bastidores da política do estado.\n\nFaleceu em Goiânia no dia 20 de março de 1993.\n\nEra casado com Sebastiana de Oliveira Dorneles, com quem teve quatro\nfilhos.\n\n \n\nFONTES: CÂM. DEP. *Deputados brasileiros. Repertório* (1983-1987);\n*Globo* (26/4/84; 16/1/85).\n\n \n","ref":"FONTES: CÂM. DEP. *Deputados brasileiros. Repertório* (1983-1987);\n*Globo* (26/4/84; 16/1/85).\n\n \n","dic":"DHBB"}
