{"title":"DORNELLES, Argemiro","cargoss":["Revolucionário ou revoltoso","Constituinte"],"cargos_esp":[0,0],"datas_ini":[1930,1934],"datas_fim":[1930,1934],"estados":[0,0],"autor":[0],"content":"**DORNELLES, Argemiro**\n\n\\*militar; rev. 1930; const. 1934.\n\n \n\n*Argemiro Dornelles* nasceu em Encruzilhada (RS) no dia 3 de janeiro de\n1887.\n\nSentou praça em abril de 1903 e cursou a Escola Tática e de Tiro de Rio\nPardo (RS). Aspirante-a-oficial em janeiro de 1909, foi classificado no\nRegimento de Infantaria de Porto Alegre, onde permaneceu até 1911.\nSegundo-tenente em novembro desse ano, de 1912 a 1913 serviu no 16º\nGrupo de Artilharia a Cavalo, ainda em Porto Alegre, transferindo-se em\nseguida para o 3º Regimento de Artilharia Montada, sediado em Cruz Alta\n(RS), no qual permaneceu até 1915.\n\nAinda em 1915, serviu sucessivamente no 4º Regimento de Artilharia\nMontada e no 8º Grupo de Obuses, ambos em São Gabriel (RS). De volta ao\n4º Regimento de Artilharia Montada em 1916, em novembro desse ano foi\npromovido a primeiro-tenente. Deixou a unidade em 1918, sendo\ntransferido para o 5º Grupo de Obuses. No ano seguinte, foi incorporado\nao 2º Grupo de Obuses, sediado em Jundiaí (SP), e em setembro alcançou a\npatente de capitão. Transferiu-se para o Rio de Janeiro, então Distrito\nFederal, em 1921, ingressando na Escola de Aperfeiçoamento de Oficiais\ndo Exército.\n\nDe volta à tropa e ao Rio Grande do Sul em 1922, foi classificado no 3º\nRegimento de Artilharia Pesada e, no ano seguinte, durante a Revolução\nGaúcha de 1923, serviu na 2ª Divisão de Cavalaria e no 13º Regimento de\nCavalaria. Ainda em 1923, passou a integrar o 3º Grupo Independente de\nArtilharia Pesada, no qual permaneceu até 1930. Nesse período, combateu\na Coluna Relâmpago, movimento sedicioso deflagrado no Rio Grande do Sul\nem novembro de 1926 sob o comando dos irmãos Alcides e Nélson\nEtchegoyen, tenentes do Exército.\n\nPromovido a major, por antigüidade, em maio de 1930, integrou o\nestado-maior das forças militares envolvidas no movimento revolucionário\nde outubro do mesmo ano. Classificado no 1º Regimento de Artilharia\nMontada, no Distrito Federal, ainda em 1930 foi nomeado diretor do\nArsenal de Guerra de Porto Alegre. Tenente-coronel em outubro de 1931,\nno ano seguinte combateu a Revolução Constitucionalista de São Paulo.\nPromovido a coronel em fevereiro de 1933, por merecimento, em maio do\nmesmo ano elegeu-se deputado pelo Rio Grande do Sul à Assembléia\nNacional Constituinte, na legenda do Partido Republicano Liberal (PRL).\n\nAssumiu a cadeira em novembro de 1933 e participou dos trabalhos\nconstituintes até o dia 12 de março de 1934, quando renunciou ao\nmandato. Em seguida, no pleito de outubro do mesmo ano, elegeu-se\ndeputado à Assembléia Constituinte do Rio Grande do Sul. Assumiu o\nmandato em abril de 1935, tendo sido primeiro-vice-presidente da\nAssembléia. Ainda em 1935, promulgada a Constituição gaúcha, retornou à\ndireção do Arsenal de Guerra de Porto Alegre. De 1936 a 1937, serviu no\nestado-maior da 3ª Divisão de Infantaria, sediada no Rio Grande do Sul.\nTransferido ainda em 1937 para o quartel-general da 9ª Região Militar,\nem Campo Grande — hoje capital de Mato Grosso do Sul —, tornou a servir\nna direção do Arsenal de Guerra de Porto Alegre de 1938 a 1940.\n\nApós servir na Diretoria de Material Bélico do Exército, no Rio de\nJaneiro, entre 1940 e 1941, retornou à direção do Arsenal de Guerra de\nPorto Alegre, na qual permaneceu até passar para a reserva, em abril de\n1942, na patente de general-de-brigada.\n\nFaleceu no Rio Grande do Sul em 1945.\n\nEra casado com Edília Lopes de Almeida Dornelles, com quem teve seis\nfilhos.\n\n \n\nFONTES: ARQ. GETÚLIO VARGAS; ASSEMB. NAC. CONST. 1934. *Anais* (1); CÂM.\nDEP. *Deputados*; INF. Nízia Leivas Otero; LAGO, L. *Generais*; MIN.\nGUERRA. *Almanaque*; SILVA, H. *1935*; SILVA, R. *Notas*.\n\n \n","ref":"FONTES: ARQ. GETÚLIO VARGAS; ASSEMB. NAC. CONST. 1934. *Anais* (1); CÂM.\nDEP. *Deputados*; INF. Nízia Leivas Otero; LAGO, L. *Generais*; MIN.\nGUERRA. *Almanaque*; SILVA, H. *1935*; SILVA, R. *Notas*.\n\n \n","dic":"DHBB"}
