{"title":"DORNELLES, Dinarte","cargoss":["Presidente de associação ou confederação de empregados ou empregadores"],"cargos_esp":["PTB"],"datas_ini":[1951],"datas_fim":[1952],"estados":[0],"autor":[0],"content":"**DORNELLES, Dinarte**\n\n\\*pres. PTB 1951-1952.\n\n \n\n*Dinarte Rei Dornelles* nasceu em São Borja (RS) no dia 20 de março de\n1894, filho de Modesto Dornelles. Seu pai era irmão de Cândida Dornelles\nVargas, mãe de Getúlio Vargas.\n\nAté 1930 foi opositor da política desenvolvida por Getúlio no Rio Grande\ndo Sul. No período de junho de 1935 a novembro de 1937 foi designado\ncônsul privativo em Santo Tomé, cidade argentina fronteiriça a São\nBorja. Em dezembro do ano seguinte, foi transferido para Monte Caseros,\nna Argentina, permanecendo no posto de janeiro a maio de 1939. Durante o\nperíodo de maio a outubro do ano seguinte esteve à disposição da\nSecretaria da Presidência da República.\n\nEm maio de 1945, com a fundação do Partido Trabalhista Brasileiro (PTB),\najudou a organizar essa agremiação no Rio Grande do Sul. Em 1950\nmudou-se para o Rio de Janeiro, ocupando a partir de junho do ano\nseguinte a presidência nacional do PTB, em substituição a Danton Coelho,\nque deixou o cargo após tomar algumas medidas contra importantes líderes\npaulistas do partido. Durante sua permanência no cargo enfrentou a\noposição dos partidários de Danton Coelho, que por diversas vezes\ntentaram impugnar sua eleição. Em junho de 1952 deixou a presidência do\nPTB, sendo substituído por João Goulart.\n\nFaleceu em Porto Alegre no dia 1º de abril de 1963.\n\n \n\nFONTES: ENTREV. PEIXOTO, A.; INF. FAM.; MIN. REL. EXT. *Almanaque*\n(1942).\n\n \n","ref":"FONTES: ENTREV. PEIXOTO, A.; INF. FAM.; MIN. REL. EXT. *Almanaque*\n(1942).\n\n \n","dic":"DHBB"}
