{"title":"DUARTE, Montenegro","cargoss":["Deputado federal"],"cargos_esp":[0],"datas_ini":[1967],"datas_fim":[1969],"estados":["PA"],"autor":[0],"content":"**DUARTE, Montenegro**\n\n\\*dep. fed.  PA 1967-1969.\n\n \n\n*            Camilo Silva Montenegro Duarte* nasceu em Belém no dia 13\nde maio de 1932, filho de Vicente Severino Duarte e de Anita Silva\nMontenegro Duarte.\n\n            Bacharelou-se em ciências jurídicas e sociais pela antiga\nFaculdade de Direito do Pará no ano de 1955. Fez os cursos de\nplanejamento econômico regional na Fundação Getúlio Vargas e de\nespeciali­zação para professores de economia, no Conselho Nacional de\nEconomia.\n\n             Foi membro da comissão de planejamento da Superintendência\ndo Plano de Valorização Econômica da Amazônia (SPVEA), dire­tor-geral da\nFazenda e secretário municipal das Finanças de Belém.  Diretor e depois\npre­sidente do Banco da Amazônia S.A. (Basa), exercia esse cargo quando,\nno pleito de novembro de 1966, elegeu-se deputado federal pelo Pará na\nlegenda da Aliança Renovadora Na­cional (Arena), tendo sido o candidato\nmais votado de sua legenda no estado.  Assumiu uma cadeira de deputado\nfederal em fevereiro de 1967, integrando a Comissão de Justiça e\nLegislação da Câmara antes de ter seu manda­to cassado e seus direitos\npolíticos suspensos, no dia 7 de fevereiro de 1969, com base no Ato\nInstitucional nº. 5, promulgado em 13 de dezembro do ano anterior.\n\n             Afastado da política, exerceu as atividades de consultor\njurídico de diversas empresas nacionais e do estado do Pará, entre as\nquais Federação da Agricultura do Estado do Pará (Faepa), Sindicato da\nIndústria da Construção Civil do Estado do Pará (Sinduscon) e Associação\nComercial do Pará (ACP).\n\n             Montenegro Duarte foi ainda professor titular de direito da\nUniversidade Federal do Pará,  membro da Comissão Consultiva Bancária do\nConselho Monetário Nacional (CMN), do Conselho Seccional do Pará,\nConselho Federal da Ordem dos Advogados do Brasil (OAB), e membro\nefetivo do Instituto dos Advogados do Rio de Janeiro (IAB/RJ).\n\n             Casou-se com Teresinha Azevedo Monte­negro Duarte, com quem\nteve três filhos.\n\n \n\nFONTES:  ARQ.  DEP.  PESQ.  JORNAL DO BRASIL; CÂM.  DEP.  *Deputados\nbrasileiros.* *Repertório*(1967-1971); CURRIC. BIOG.; ROQUE, C.\n*Grande*.\n\n \n","ref":"FONTES:  ARQ.  DEP.  PESQ.  JORNAL DO BRASIL; CÂM.  DEP.  *Deputados\nbrasileiros.* *Repertório*(1967-1971); CURRIC. BIOG.; ROQUE, C.\n*Grande*.\n\n \n","dic":"DHBB"}
