{"title":"DUARTE, Ovídio","cargoss":["Deputado federal","Deputado federal"],"cargos_esp":[0,0],"datas_ini":[1957,1954],"datas_fim":[1957,1955],"estados":["PB","PB"],"autor":[0],"content":"**DUARTE, Ovídio**\n\n\\*dep. fed. PB 1954-1955 e 1957.\n\n \n\n*Ovídio Borba Duarte* nasceu em Serraria, então Pilões (PB), no dia 4 de\njulho de 1915, filho de Ovídio Duarte dos Santos Lima e de Laura Borba\nDuarte.\n\nEstudou no Colégio Pio X, na capital paraibana, antes de ingressar na\nFaculdade de Medicina de Recife, pela qual se formou em 1938,\nespecializando-se em neuropsiquiatria. De volta à Paraíba, foi\npresidente da caixa dos ferroviários da Great Western Railway Company,\ndiretor do Manicômio Judiciário, diretor do Departamento de Educação e\nsecretário estadual de Educação e Saúde.\n\nNo pleito de outubro de 1950, elegeu-se segundo suplente de deputado\nfederal pela Paraíba na legenda da Coligação Democrática Paraibana,\nformada pelo Partido Social Democrático (PSD) e o Partido Libertador\n(PL). Assumiu uma cadeira na Câmara em março de 1954. Eleito primeiro\nsuplente em outubro de 1954, ainda na legenda da coligação PSD-PL,\ndeixou a Câmara ao fim de seu primeiro mandato (31/1/1955), retornando\npor um curto período, de junho a julho de 1957. A partir desse ano\nradicou-se em Pernambuco e foi eleito presidente do Santa Cruz Futebol\nClube, de Recife, cargo que exerceria até 1962.\n\nNo pleito de outubro de 1958 elegeu-se deputado estadual em Pernambuco\nna legenda do Partido Trabalhista Brasileiro (PTB). Assumindo sua\ncadeira na Assembléia Legislativa em fevereiro do ano seguinte,\nconcorreu à reeleição no pleito de outubro de 1962, na legenda da\ncoligação denominada Frente Popular Democrática, formada pelo PSD com a\nUnião Democrática Nacional (UDN), mas não conseguiu se eleger.\nPermaneceu no Legislativo pernambucano até o fim de janeiro do ano\nseguinte, quando se encerraram o seu mandato e a legislatura. A partir\nde então, dedicou-se à medicina.\n\nFoi ainda gerente do Banco Lar Brasileiro S.A. em Recife, presidente do\nConselho Regional de Desportos, da Federação Carnavalesca de Pernambuco\ne membro fundador da Academia Paraibana de Medicina.\n\nFaleceu em Recife no dia 29 de agosto de 1994.\n\nEra casado com Angélica Alves Duarte, com quem adotou uma filha.\n\nPublicou *Cardiosol na esquizofrenia* (tese) e *Pedra rosada* (romance).\n\n \n\nFONTES: CÂM. DEP. *Deputados*; CISNEIROS, A. *Parlamentares*; INF.\nMarcelo Renato de Cerqueira Pais; TRIB. SUP. ELEIT. *Dados* (2, 3, 4 e\n6).\n\n \n","ref":"FONTES: CÂM. DEP. *Deputados*; CISNEIROS, A. *Parlamentares*; INF.\nMarcelo Renato de Cerqueira Pais; TRIB. SUP. ELEIT. *Dados* (2, 3, 4 e\n6).\n\n \n","dic":"DHBB"}
