{"title":"DUARTE, Paulo","cargoss":["Deputado federal"],"cargos_esp":[0],"datas_ini":[1991],"datas_fim":[1995],"estados":["SC"],"autor":[0],"content":"**DUARTE, Paulo**\n\n\\*dep. fed. SC 1991-1995.\n\n* *\n\n*Paulo Alberto Duarte* nasceu em Lajes (SC) no dia 25 de setembro de\n1941, filho de Galdino João Duarte e de Maria Antonieta Nerbass Duarte.\n\nFormado em medicina pela Universidade Federal do Rio Grande do Sul em\n1968, em 1972 assumiu a direção do Hospital e Maternidade Teresa Ramos,\nem sua cidade natal, cargo que ocuparia até 1982.\n\nEstreou na política em 1975, como presidente do diretório municipal da\nAliança Renovadora Nacional (Arena), partido de apoio ao regime militar\ninstalado no país em abril de 1964. Nessa legenda disputou em novembro\nde 1976 a prefeitura de Lajes, sendo derrotado por Dirceu Carneiro,\ncandidato do Movimento Democrático Brasileiro (MDB), partido\noposicionista. Em novembro de 1982, voltou a candidatar-se a prefeito de\nLajes, dessa vez na legenda do Partido Democrático Social (PDS), que\nsucedeu à Arena após a extinção do bipartidarismo (29/11/1979),\nconseguindo então eleger-se. Empossado em 31 de janeiro de 1983, exerceu\no mandato até 31 de dezembro de 1988. Nesse período, transferiu-se para\no Partido da Frente Liberal (PFL) e foi presidente da Associação dos\nPrefeitos do PFL em Santa Catarina e, por duas vezes, da Associação dos\nMunicípios da Região Serrana.\n\nEm outubro de 1990, elegeu-se deputado federal por Santa Catarina na\nlegenda do PFL, sendo empossado em 1º de fevereiro do ano seguinte. Na\nCâmara, participou das comissões de Seguridade Social e Família, de\nDefesa Nacional e de Ciência e Tecnologia, Comunicação e Informática. Na\nsessão de 29 de setembro de 1992, votou a favor da abertura do processo\nde*impeachment* do presidente Fernando Collor de Melo, que era acusado\nde crime de responsabilidade por ligações com um esquema de corrupção\ncomandado pelo ex-tesoureiro de sua campanha, Paulo César Farias.\nAfastado da presidência logo após a votação na Câmara, Collor renunciou\nao mandato em 29 de dezembro de 1992, pouco antes da conclusão do\nprocesso pelo Senado. Em seu lugar assumiu o vice Itamar Franco, que já\nvinha exercendo o cargo interinamente desde 2 de outubro.\n\nNas votações dos principais projetos encaminhados ao Congresso durante o\ngoverno de Itamar Franco (1992-1995), foi contra a criação do Imposto\nProvisório sobre Movimentações Financeiras (IPMF) e do Fundo Social de\nEmergência (FSE), e foi favorável ao fim do voto obrigatório. Não se\ncandidatou no pleito de outubro de 1994 e deixou a Câmara em janeiro de\n1995, ao final da legislatura. Embora não tenha mais concorrido,\npassando a dedicar-se à medicina em Lajes, no pleito de outubro de 2008\nparticipou ativamente da campanha do Partido Progressista (PP) na\ncidade.\n\nCasou-se com Maria Lúcia César da Costa Duarte, com quem teve três\nfilhos.\n\n \n\nFONTES: CÂM. DEP*. Deputados brasileiros.*Repertório (1991-1995);*Perfil\nparlamentar/Istoé*; TODOS querem.\n","ref":"FONTES: CÂM. DEP*. Deputados brasileiros.*Repertório (1991-1995);*Perfil\nparlamentar/Istoé*; TODOS querem.\n","dic":"DHBB"}
