{"title":"DURÃO, Luís","cargoss":["Deputado federal"],"cargos_esp":[0],"datas_ini":[1995],"datas_fim":[1999],"estados":["ES"],"autor":[0],"content":"**DURÃO, Luís**\n\n\\*dep. fed. ES 1995-1999.\n\n \n\n*Luís Cândido Durão* nasceu em Linhares (ES) no dia 12 de setembro de\n1947, filho de José Cândido Durão e Graciosa Garcia Durão.\n\nEm 1976, ingressou no curso de direito na Faculdade de Direito de\nColatina (Fadic), o qual concluiria em 1979. Ainda em 1976, filiou-se ao\nMovimento Democrático Brasileiro (MDB), partido de oposição ao regime\nmilitar instalado no país em abril de 1964, pelo qual se elegeu, em\nnovembro daquele ano, vice-prefeito de Linhares. Eleito prefeito deste\nmunicípio em novembro de 1978, assumiu o novo cargo em fevereiro do ano\nseguinte. Ainda em 1979, participou do V Seminário de Direito Civil, em\nColatina; do II Seminário da Sociedade de Ensino Integrado de Vitória e\nColatina; do Encontro Estadual de Dirigentes Municipais, em Guarapari\n(ES); e também do I Seminário de Prefeitos e Administradores Municipais,\nno Rio de Janeiro.\n\nCom a extinção do bipartidarismo, em novembro de 1979, e a conseqüente\nreorganização partidária, filiou-se em 1980 ao Partido do Movimento\nDemocrático Brasileiro (PMDB), que deu continuidade ao antigo MDB. Ainda\nem 1980, tomou parte do I Encontro Municipalista da Economia Cafeeira do\nEspírito Santo, em Santa Teresa (ES) e foi o vice-presidente do 4º\nCongresso Estadual de Municípios, ocorrido em Serra (ES).\n\nEm 1982, deixou a prefeitura de Linhares, tendo, nesse mesmo ano,\ningressado no Partido Democrático Trabalhista (PDT). Afastado\ntemporariamente da carreira política, voltou a disputar a prefeitura de\nLinhares no pleito de novembro de 1988, na legenda pedetista. Eleito,\nfoi empossado em janeiro do ano seguinte. Em 1989, tornou-se presidente\nda Associação Nacional de Municípios Limítrofes e Produtores de\nPetróleo, reunida em Guarapari. Ocupou a prefeitura até dezembro de\n1993.\n\nEm outubro de 1994, disputou uma vaga na Câmara dos Deputados pelo\nEspírito Santo, na legenda do PDT. Eleito com votação obtida sobretudo\nno seu município natal, iniciou o mandato de deputado federal em\nfevereiro do ano seguinte. Membro das comissões de Agricultura e\nPolítica Rural e de Desenvolvimento Urbano e Interior, nas votações das\nemendas constitucionais propostas pelo governo Fernando Henrique Cardoso\nem 1995, seguindo a orientação do seu partido, votou contra a quebra do\nmonopólio dos estados na distribuição de gás canalizado, a mudança no\nconceito de empresa nacional, a quebra do monopólio estatal das\ntelecomunicações, a prorrogação do Fundo Social de Emergência (FSE),\nrebatizado de Fundo de Estabilização Fiscal (FEF), que permitia que o\ngoverno gastasse 20% da arrecadação de impostos sem que estas verbas\nficassem obrigatoriamente vinculadas aos setores de saúde e educação\n(nesta votação votou apenas no 1º turno, pois faltou às votações em 2º\nturno), a quebra do monopólio das embarcações nacionais na navegação de\ncabotagem e a quebra do monopólio da Petrobras na exploração de\npetróleo.\n\nEm 1996 assumiu a vice-liderança do PDT, e em janeiro/fevereiro de 1997\nvotou a favor da emenda da reeleição para presidente da República,\ngovernadores e prefeitos. Em novembro deste mesmo ano, Luís Durão\npronunciou-se favoravelmente à quebra da estabilidade do servidor\npúblico, item da reforma administrativa.\n\nMembro da Comissão de Seguridade Social e Família desde o início de\n1998, no pleito de outubro deste ano, candidatou-se à reeleição pela\nlegenda do Partido da Frente Liberal (PFL), não sendo bem-sucedido. Em\nnovembro deste ano, votou a favor do teto de 1.200 reais para\naposentadorias no setor público e do estabelecimento de idade mínima e\ntempo de contribuição para o setor privado, itens que definiram a\nreforma da previdência. Votou contra a cobrança previdenciária dos\ninativos.\n\nDeixou a Câmara em janeiro de 1999, ao final da legislatura.\n\nNo pleito de 2006 candidatou-se ao cargo de deputado federal pela\nlegenda do PDT, obtendo apenas uma suplência.\n\nFoi membro do conselho titular da Ordem dos Advogados do Brasil (OAB) -\nVila Velha (ES).\n\nRecebeu homenagem da Assembléia Legislativa do Estado do Espírito Santo\n(ALES), em agosto de 2008, pela atuação como agricultor e pecuarista. \n\nCasou-se com Nadir Sônia Sponfeldner Durão, com quem teve três filhos.\n\nFONTES: CÂM. DEP. Deputados brasileiros. Repertório (1995-1999); Folha\nde S. Paulo (31/1/95, 14/1/96, 29/9/98). Folha OnLine (22/01/99)\n\n \n\n \n","ref":"FONTES: CÂM. DEP. Deputados brasileiros. Repertório (1995-1999); Folha\nde S. Paulo (31/1/95, 14/1/96, 29/9/98). Folha OnLine (22/01/99)\n\n \n\n \n","dic":"DHBB"}
