{"title":"ALVES, João José","cargoss":["Constituinte","Deputado federal"],"cargos_esp":[0,0],"datas_ini":[1934,1935],"datas_fim":[1934,1935],"estados":[0,"MG"],"autor":[0],"content":"**ALVES, João José**\n\n\\*const. 1934; dep. fed. MG 1935.\n\n \n\n*João José Alves* nasceu em Diamantina (MG) no dia 12 de agosto de 1872,\nfilho de Marciano José Alves e de Antônia Josefina de Oliveira Alves.\nSeu irmão, Honorato José Alves, foi deputado federal por Minas Gerais de\n1906 a 1929, e seu sobrinho-neto, o jornalista Márcio Moreira Alves, foi\ndeputado federal, eleito pelo antigo estado da Guanabara.\n\nFez os primeiros estudos no Colégio do Caraça, em Mariana (MG), onde foi\ncolega de futuros líderes de projeção estadual e nacional, como Raul\nSoares e Artur Bernardes. Estudou engenharia na Escola de Minas de Ouro\nPreto (MG), mas formou-se em 1901 pela Faculdade de Medicina do Rio de\nJaneiro, no então Distrito Federal, defendendo a tese *Blenorragia*\n*aguda no homem e seu tratamento.*Exerceu a medicina no norte de Minas\nGerais e no sul da Bahia.\n\nFiliado ao Partido Republicano Mineiro (PRM), iniciou-se na política\ndurante a campanha que, em 1909, conduziu Júlio Bueno Brandão à\npresidência do estado de Minas Gerais. Em 1918 participou do combate ao\nsurto epidêmico de gripe em Montes Claros (MG), onde atuou como delegado\nde higiene. Vereador nessa cidade, presidiu a Câmara Municipal durante\ntrês legislaturas.\n\nParticipou da campanha da Aliança Liberal (1929-1930) em Minas Gerais,\nnão tendo obtido muito apoio em Montes Claros. Após a Revolução de 1930,\ndeixou o PRM e colaborou em janeiro de 1933 na fundação do Partido\nProgressista (PP) de Minas Gerais, cuja comissão executiva integrou. Em\nmaio de 1933 elegeu-se suplente de deputado na legenda do PP à\nAssembléia Nacional Constituinte, assumindo o mandato com a morte de\nJoão Pandiá Calógeras em maio do ano seguinte. Participou dos trabalhos\nconstituintes e, após a promulgação da nova Carta (16/7/1934) e a\neleição do presidente da República no dia seguinte, teve o mandato\nestendido até maio de 1935. Reeleito em outubro de 1934, sempre na\nlegenda do PP, permaneceu na Câmara dos Deputados.\n\nProfessor de ciências naturais na Escola Normal de Montes Claros, foi\nainda diretor e provedor da Santa Casa de Misericórdia de Montes Claros.\n\nFaleceu em Belo Horizonte a 4 de novembro de 1934, em pleno exercício do\nmandato.\n\nEra casado com Tributina de Andrade Alves.\n\n \n\n \n\nFONTES: ASSEMB. LEGISL. MG. *Dicionário biográfico;*ASSEMB. NAC. CONST.\n1934. *Anais;*CÂM. DEP. *Deputados; Câm. dep. seus*\n*componentes;*GODINHO, V. *Constituintes;* VIANA, N. *Efemérides.*\n\n \n","ref":"FONTES: ASSEMB. LEGISL. MG. *Dicionário biográfico;*ASSEMB. NAC. CONST.\n1934. *Anais;*CÂM. DEP. *Deputados; Câm. dep. seus*\n*componentes;*GODINHO, V. *Constituintes;* VIANA, N. *Efemérides.*\n\n \n","dic":"DHBB"}
