{"title":"DUVAL, Joaquim","cargoss":["Deputado federal"],"cargos_esp":[0],"datas_ini":[1955],"datas_fim":[1963],"estados":["RS"],"autor":[0],"content":"**DUVAL, Joaquim**\n\n\\*dep. fed. RS 1955-1963.\n\n* *\n\n*Joaquim Duval* nasceu em Pelotas (RS) no dia 2 de maio de 1904, filho\nde José Fernandes Duval Júnior e de Ercília dos Santos Duval.\n\nRealizou seus primeiros estudos em sua cidade natal e formou-se em 1925\npela Faculdade de Direito do Rio de Janeiro, então Distrito Federal.\n\nElegeu-se vereador em Pelotas no pleito de novembro de 1935, assumindo\nsua cadeira no início do ano seguinte. Ocupou o cargo até novembro de\n1937, quando a instauração do Estado Novo fechou os órgãos legislativos\ndo país. Foi também consultor jurídico da Associação Comercial e da\nPrefeitura de Pelotas e ocupou a cátedra de direito administrativo na\nFaculdade de Direito da Universidade do Rio Grande do Sul. Eleito\ndeputado à Constituinte gaúcha de 1947, ocupou a primeira\nvice-presidência da mesa da Assembléia.\n\nDe 1948 a 1951, foi prefeito municipal de Pelotas. Elegeu-se duas vezes\nconsecutivas deputado federal pelo Partido Social Democrático (PSD) do\nRio Grande do Sul, exercendo os mandatos de fevereiro de 1955 a janeiro\nde 1963.\n\nFaleceu no dia 7 de novembro de 1971.\n\nEra casado com Fani Oliveira Duval, com quem teve sete filhos.\n\n \n\nFONTES: CÂM. DEP. *Deputados*; CÂM. DEP. *Deputados brasileiros.\nRepertório* (1946-1967); CÂM. DEP. *Relação dos dep*.; COUTINHO, A.\n*Brasil*; SILVA, R. *Notas*.\n\n \n","ref":"FONTES: CÂM. DEP. *Deputados*; CÂM. DEP. *Deputados brasileiros.\nRepertório* (1946-1967); CÂM. DEP. *Relação dos dep*.; COUTINHO, A.\n*Brasil*; SILVA, R. *Notas*.\n\n \n","dic":"DHBB"}
