{"title":"ELIAS, José ===========","cargoss":["Constituinte","Deputado federal"],"cargos_esp":[0,0],"datas_ini":[1987,1987],"datas_fim":[1988,1995],"estados":[0,"MS"],"autor":[0],"content":"ELIAS, José\n===========\n\n\\*const. 1987-1988; dep. fed. MS 1987-1995.\n\n \n\n                *José Elias Moreira* nasceu em Poços de Caldas (MG) no\ndia 20 de julho de 1940, filho de Joaquim José Moreira e de Francisca\nLopes Moreira.\n\n                Radicado desde 1958 em Dourados (MS), então Mato Grosso,\nformou-se engenheiro agrônomo pela Escola Nacional de Agronomia, no Rio\nde Janeiro, em 1967. Foi chefe do escritório do antigo Instituto\nNacional do Desenvolvimento Agrário (INDA), o atual Instituto Nacional\nde Colonização e Reforma Agrária (Incra) em Dourados, fundando várias\ncooperativas e sindicatos rurais na região e no Mato Grosso, além de ter\ntrabalhado para a criação da primeira cooperativa de eletrificação rural\nno estado.\n\n                Delegado regional da antiga Aliança Renovadora Nacional\n(Arena), partido de sustentação ao regime militar instalado no país em\nabril de 1964, foi eleito prefeito de Dourados em novembro de 1976.\n\n                Com a extinção do bipartidarismo em 29 de novembro de\n1979, José Elias filiou-se ao Partido Democrático Social (PDS),\nagremiação que sucedeu a Arena. Em junho de 1981, disputou a indicação\ndo partido com Levi Dias para a sucessão do governador Pedro Pedrossian,\nque o apoiou. Escolhido candidato do partido ao governo do estado nas\neleições de novembro de 1982, acabou derrotado por Wilson Barbosa\nMartins, do Partido do Movimento Democrático Brasileiro (PMDB).\n\n                Nomeado secretário-geral da Confederação Nacional de\nMunicípios em 1982, permaneceu na entidade até 1984. Em 1983, encerrou o\nmandato na prefeitura de Dourados, tornando-se presidente regional do\nPDS e delegado junto à convenção nacional do partido. Em 1986, deixou o\nPDS e filiou-se ao Partido Trabalhista Brasileiro (PTB), passando a\ndelegado junto à convenção nacional.\n\nEmpresário, proprietário de um canal de televisão em Campo Grande e\nfazendeiro, ajudou a fundar a União Democrática Ruralista (UDR),\nentidade defensora dos interesses dos grande proprietários fundiários,\nna região da Grande Dourados. Foi eleito deputado federal constituinte\npelo Mato Grosso do Sul na legenda do PTB em novembro de 1986, recebendo\no apoio ostensivo da UDR. Empossado em fevereiro do ano seguinte, quando\ntiveram início os trabalhos da Assembléia Nacional Constituinte, foi\nprimeiro-vice-presidente da Comissão da Família, da Educação, Cultura e\nEsportes, da Ciência e Tecnologia e da Comunicação e membro da\nSubcomissão da Ciência e Tecnologia e da Comunicação, da Comissão da\nFamília, da Educação, Cultura e Esportes, da Ciência e Tecnologia e da\nComunicação.\n\n                Nas principais votações da Constituinte, pronunciou-se\ncontra o rompimento de relações diplomáticas com países com política de\ndiscriminação racial, a pena de morte, o mandado de segurança coletivo,\no aborto, o turno ininterrupto de seis horas, o aviso prévio\nproporcional, a soberania popular, o voto aos 16 anos, a nacionalização\ndo subsolo, a estatização do sistema financeiro, o limite de 12% ao ano\npara os juros reais, a limitação dos encargos da dívida externa, a\ncriação de um fundo de apoio à reforma agrária, a legalização do jogo do\nbicho e a desapropriação da propriedade produtiva.\n\nVotou a favor da limitação do direito de propriedade privada, da\nproteção ao emprego contra despedida sem justa causa, da jornada semanal\nde 40 horas, da pluralidade sindical, da unicidade sindical, do\npresidencialismo, da proibição do comércio de sangue, e da anistia ao\nmicro e pequenos empresários. Também pronunciou-se favoravelmente ao\nmandato de cinco anos para o presidente José Sarney, que assumira o\ngoverno em 15 de março de 1985, por motivo de doença de Tancredo Neves,\npresidente eleito no Colégio Eleitoral.\n\nCom a promulgação da nova carta constitucional em 5 de outubro de 1988,\nJosé Elias voltou a participar dos trabalhos legislativos ordinários da\nCâmara, integrando em 1989 a Comissão de Ciência e Tecnologia,\nComunicação e Informática e, na condição de suplente, as comissões de\nAgricultura e Política Rural e de Minas e Energia.\n\n                Reeleito deputado federal pelo Mato Grosso do Sul em\noutubro de 1990, assumiu em fevereiro do ano seguinte, tornando-se\nvice-líder do PTB na Câmara dos Deputados.\n\n                Na sessão de 29 de setembro de 1992, votou a favor do\n*impeachment* do presidente Fernando Collor de Melo. Collor fora acusado\nde crime de responsabilidade por ligações com um esquema de corrupção\nliderado pelo ex-tesoureiro de sua campanha presidencial Paulo César\nFarias. Afastado da presidência após a votação na Câmara, renunciou ao\nmandato em 29 de dezembro de 1992, pouco antes da conclusão do processo\npelo Senado Federal, sendo efetivado na presidência da República o vice\nItamar Franco, que já vinha exercendo o cargo interinamente desde o dia\n2 de outubro.\n\nNas principais matérias constitucionais apresentadas na Câmara dos\nDeputados ao longo da legislatura 1991-1995, José Elias votou a favor da\ncriação do Fundo Social de Emergência (FSE), que permitia ao governo\nretirar recursos de áreas como saúde e educação para ter maior liberdade\nde administração das verbas; do fim do voto obrigatório e da criação do\nImposto de 0,25% sobre transações bancárias – o Imposto Provisório sobre\nMovimentação Financeira (IPMF).\n\n                Deixou a Câmara dos Deputados em janeiro de 1995, ao\nfinal da legislatura, sem ter concorrido à reeleição em outubro do ano\nanterior. Em outubro de 1998, disputou uma vaga para a Assembléia\nLegislativa do Mato Grosso do Sul, não obtendo sucesso.     \n\n                José Elias foi, ainda, presidente da Cooperativa\nHabitacional dos Funcionários Públicos e Bancários de Dourados;\nvice-presidente da Associação de Engenheiros Agrônomos da Grande\nDourados; presidente da Associação Sul-Mato-Grossense de Municípios;\npresidente do Conselho Deliberativo da Confederação Nacional de\nMunicípios; diretor-presidente da TV Cainás, e chefe do Departamento de\nEstradas de Rodagem da Municipalidade Douradense.\n\n                Casou-se com Adenil Carneiro Moreira, com quem teve três\nfilhos.\n\n \n\n*Márcia Quarti*\n\n \n\nFONTES: CÂM. DEP. *Deputados brasileiros. Repertório*(1991-1995);\n*Perfil parlamentar/IstoÉ;* TSE. *Candidatos*(1998).\n\n \n","ref":"FONTES: CÂM. DEP. *Deputados brasileiros. Repertório*(1991-1995);\n*Perfil parlamentar/IstoÉ;* TSE. *Candidatos*(1998).\n\n \n","dic":"DHBB"}
