{"title":"EL-JAICK, Humberto","cargoss":["Deputado federal","Deputado federal"],"cargos_esp":[0,0],"datas_ini":[1966,1964],"datas_fim":[1966,1965],"estados":["RJ","RJ"],"autor":[0],"content":"**EL-JAICK, Humberto**\n\n\\*dep. fed. RJ 1964-1965 e 1966.\n\n \n\n*Humberto El-Jaick* nasceu em Nova Friburgo (RJ) no dia 11 de fevereiro\nde 1922, filho de José El-Jaick e de Rachel El-Jaick.\n\nAdvogado, professor, jornalista e escritor, foi um dos fundadores do\nPartido Socialista Brasileiro (PSB), presidindo-o em sua cidade natal.\nEm 1960, ingressou no Partido Trabalhista Brasileiro (PTB), legenda pela\nqual candidatou-se em 1962 a deputado federal pelo Rio de Janeiro,\nobtendo apenas uma suplência.\n\nCom a instauração do regime militar em 31 de março de 1964, esteve preso\npor dois meses, depois do que foi chamado a assumir uma cadeira na\nCâmara, de agosto de 1964 a janeiro de 1965. Com a extinção dos partidos\npolíticos pelo Ato Institucional nº 2 (27/10/1965) e a posterior\ninstauração do bipartidarismo, filiou-se ao Movimento Democrático\nBrasileiro (MDB), partido de oposição ao regime militar, e voltou a\nocupar uma cadeira na Câmara em junho de 1966. Nos períodos em que atuou\ncomo parlamentar, foi membro da Comissão de Constituição e Justiça e da\nComissão de Educação e Cultura da Câmara dos Deputados.\n\nPretendia candidatar-se à reeleição em outubro de 1966, mas seu nome foi\nimpugnado pelo Tribunal Regional Eleitoral (TRE), atendendo a um\nprocesso que partiu da Procuradoria da República no estado, segundo o\nJornal do Brasil por recomendação do Serviço Nacional de Informações\n(SNI). Além da impugnação, teve os direitos políticos cassados por dez\nanos.\n\nCom o fim do bipartidarismo e a anistia aos políticos cassados pelo\nregime militar, em novembro de 1979, atuou na fundação do novo PTB,\njunto a Leonel Brizola. Devido, porém, à disputa pela legenda entre o\ngrupo liderado por Brizola e aquele liderado por Ivete Vargas, e a\nvitória desta junto ao Tribunal Superior Eleitoral (TSE), participou da\nfundação do Partido Democrático Trabalhista (PDT). Por esta legenda\ncandidatou-se, sem êxito, a prefeito de Nova Friburgo em novembro de\n1982.\n\nDurante o governo de Leonel Brizola (1983-1987), foi presidente da\nCompanhia de Eletricidade do Estado do Rio de Janeiro (CERJ), de 1983 a\n1984, e da Junta Comercial do Estado do Rio de Janeiro (Jucerja), de\n1985 a 1986. Foi ainda presidente do conselho fiscal da Companhia de\nNavegação do Estado do Rio de Janeiro.\n\nComo escritor, teve suas poesias e contos publicados em jornais e\nrevistas, e foi presidente da Academia Friburguense de Letras.\n\nFaleceu em Nova Friburgo, no dia 3 de julho de 1990.\n\nEra casado com Zeir Maria El-Jaick, com quem teve seis filhos.\n\n \n\nFONTES: ARQ. DEP. PESQ. JORNAL DO BRASIL; CÂM. DEP. *Deputados\nbrasileiros*; CÂM. DEP. *Deputados*; INF. FAM.; *Jornal do Brasil* (9 e\n13/10/66); *Visão* (4).\n\n \n","ref":"FONTES: ARQ. DEP. PESQ. JORNAL DO BRASIL; CÂM. DEP. *Deputados\nbrasileiros*; CÂM. DEP. *Deputados*; INF. FAM.; *Jornal do Brasil* (9 e\n13/10/66); *Visão* (4).\n\n \n","dic":"DHBB"}
