{"title":"ERUNDINA, Luísa","cargoss":["Prefeito","min ch SAF","Deputado federal"],"cargos_esp":["São Paulo",0,0],"datas_ini":[1989,1993,1999],"datas_fim":[1993,1993,0],"estados":[0,0,"SP"],"content":"**ERUNDINA, Luísa**\n\n**\\***pref. São Paulo 1989-1993; min. ch. SAF 1993; dep. fed. SP 1999-\n\n*Luísa Erundina de Sousa* nasceu em Uiraúna (PB) no dia 30 de novembro\nde 1934, filha de Antônio Evangelista de Sousa, camponês e artesão, e de\nEnedina de Sousa Carvalho.\n\nEstudou nas cidades de Patos e de Campina Grande, em seu estado natal, e\ndesde menina trabalhou para ajudar no sustento da família, pobre e\nnumerosa. Professora primária, em 1958, com 23 anos, foi diretora de\nEducação e Cultura da prefeitura de Campina Grande. Após um intervalo de\nnove anos retomou os estudos e em 1966 graduou-se pela Escola de Serviço\nSocial da Paraíba, em João Pessoa. Começou em seguida a trabalhar, na\ncapital paraibana, junto à Igreja Católica, ajudando no atendimento a\nfavelados.\n\nEm 1968 deixou a Paraíba para fazer o mestrado em ciências sociais na\nFundação Escola de Sociologia e Política de São Paulo. Concluído o curso\nem 1970, regressou a João Pessoa, onde fez concurso para professora da\nUniversidade Federal da Paraíba. Apesar de ter sido aprovada em primeiro\nlugar, não pôde assumir seu posto devido à acusação de “subversiva”.\nTransferiu-se então definitivamente para São Paulo, onde foi aprovada em\nconcurso para assistente social da Prefeitura e iniciou paralelamente a\ncarreira de professora universitária.\n\nA convite de Luís Inácio Lula da Silva, foi uma das fundadoras, em 1980,\ndo Partido dos Trabalhadores (PT). Nessa legenda foi eleita em novembro\nde 1982 vereadora à Câmara Municipal de São Paulo. Empossada em\nfevereiro do ano seguinte, nas eleições municipais de 1985 candidatou-se\na vice-prefeita de São Paulo na chapa do PT, encabeçada por Eduardo\nSuplicy, que recebeu 20% dos votos. Na eleição de 1986, elegeu-se\ndeputada estadual constituinte, sempre na legenda do PT. Em janeiro de\n1987 concluiu seu mandato de vereadora e no mês seguinte tomou posse na\nAssembléia Legislativa paulista.\n\nEm junho de 1988, disputou na convenção de seu partido a indicação de\ncandidata à prefeitura de São Paulo com o deputado federal Plínio de\nArruda Sampaio, preferido pela direção petista. Apoiada por grupos\nconsiderados radicais, representantes das bases de militantes, recebeu\n55% dos votos dos convencionais. Tendo a seu lado, como candidato a\nvice-prefeito, Luís Eduardo Greenhalgh, advogado de presos políticos\ndurante o regime militar, lançou-se à disputa pela prefeitura com Paulo\nMaluf, do Partido Democrático Social (PDS), João Osvaldo Leiva, do\nPartido do Movimento Democrático Brasileiro (PMDB), e José Serra, do\nPartido da Social Democracia Brasileira (PSDB). Embora não contasse com\nrecursos nem com o estímulo da direção partidária, tinha o apoio da\nmilitância petista, o que lhe permitiu vencer o pleito com 1.534.592\nvotos — quase 30% do eleitorado paulistano. A partir de 1º de janeiro de\n1989, iria governar a maior cidade da América Latina, com a\nresponsabilidade de gerir o terceiro orçamento da União. Seu antecessor,\no ex-presidente Jânio Quadros, não compareceu à cerimônia de transmissão\ndo cargo.\n\nNa prefeitura de São Paulo\n\nO setor de transportes constituiria o “centro nervoso” da administração\nde Luísa Erundina, eleita com a proposta de estatizar os transportes\ncoletivos. Como o ex-prefeito Jânio Quadros não reajustara as tarifas\nnos 45 dias que antecederam a troca de comando na prefeitura, a nova\nprefeita foi obrigada a determinar um aumento impopular logo nos\nprimeiros dias de governo, o que ocasionou seu primeiro conflito com o\nPT. Em março, declarou apoio à greve geral convocada pelas centrais\nsindicais e determinou a paralisação dos ônibus da Companhia Municipal\nde Transporte Coletivo (CMTC). Seis meses após a posse, enfrentou uma\ngreve dos funcionários municipais, convocada pela Central Única dos\nTrabalhadores (CUT) e apoiada por lideranças do PT, e concedeu reajustes\nsalariais aos servidores.\n\nEm dezembro de 1989, conseguiu transferir o Grande Prêmio Brasil de\nFórmula 1 de 1990 para o autódromo de Interlagos, na capital paulista.\nPara executar as reformas necessárias, assinou acordo, sem licitação\npública, com a Shell, que se responsabilizou pelas obras e pela compra\nde ônibus para a CMTC em troca da cessão de terrenos municipais para\ninstalar postos de gasolina. Em 1992, o Tribunal de Justiça do Estado de\nSão Paulo acolheria denúncia do Ministério Público contra a prefeita por\ncrime de responsabilidade na assinatura do contrato com a Shell. O\nprocesso seria suspenso ainda no mesmo ano, por decisão do Superior\nTribunal de Justiça, mas voltaria a tramitar em fevereiro de 1996.\n\nCom a constituição da Frente Nacional de Prefeitos de Capitais, Luísa\nErundina passou a exercer liderança nacional, participando da direção\ncolegiada e do esforço de captação de recursos. Ainda em 1989 participou\nda campanha presidencial, apoiando Luís Inácio Lula da Silva. Em 1990,\nno segundo turno da eleição para governador de São Paulo, em oposição a\nseu permanente adversário Paulo Maluf, apoiou o candidato do PMDB, Luís\nAntônio Fleury Filho, afinal vitorioso.\n\nTambém em 1990, um documento do diretório municipal do PT acusou\nErundina de não dar prioridade à área social e de se preocupar demais\ncom o saneamento das finanças. As dificuldades foram parcialmente\ncontornadas a partir da constituição de um conselho político que reunia\nas instâncias municipal, regional e nacional do partido com membros do\ngoverno paulistano. Mesmo assim, ao longo de sua gestão, sucederam-se\nconflitos com o diretório municipal, o que, por duas vezes, levou-a a\nameaçar deixar o partido.\n\nEm dois anos de governo, Luísa Erundina precisou fazer várias mudanças\nem seu secretariado, algumas motivadas por denúncias de corrupção não\nconfirmadas posteriormente. Foi o caso do vice-prefeito Luís Eduardo\nGreenhalgh, que ainda em 1989 foi exonerado do cargo de secretário dos\nNegócios Extraordinários depois de uma denúncia de envolvimento na\ncobrança de propina da empresa Lubeca durante a campanha de Luís Inácio\nLula da Silva para a presidência da República. Em maio de 1991, Erundina\ndesaprovou as restrições que o vice-prefeito fazia a seus assessores\ndiretos e suspendeu a posse interina planejada para reabilitá-lo\npoliticamente.\n\nNesse mesmo período a Secretaria de Transportes teve três titulares, e a\nCMTC, quatro presidentes. Depois disso Erundina implementou a\nmunicipalização dos serviços de transporte, obtendo bons resultados:\nelevou a frota de ônibus comuns, pôs em circulação 70 ônibus a gás,\nsubsidiou fortemente as tarifas, criou 17 linhas de ônibus especiais,\ndiminuiu o número de passageiros transportados por metro quadrado e\nimplantou faixas exclusivas em 18 avenidas. Em 1992, porém, condenou a\ngreve dos transportes coletivos, por considerá-la prejudicial aos\ntrabalhadores e contrária ao interesse público.\n\nPor força da reforma tributária promovida pela Constituição de 1988, a\nadministração de Luísa Erundina contou com mais recursos orçamentários\ndo que as de seus antecessores. A prefeita tentou promover uma reforma\ntributária municipal com a cobrança de alíquotas progressivas para o\nIPTU de 1992, mas o Tribunal de Justiça de São Paulo obrigou-a a mudar a\nbase de cálculo, o que reduziu em quatrocentos milhões de dólares a\nprevisão de arrecadação de recursos daquele ano. Ainda assim, após ter\nassumido o cargo herdando de seu antecessor um déficit de 36%, Erundina\nencerrou o ano de 1992 com um déficit de 6%, o menor dos últimos dez\nanos.\n\nApesar das críticas do próprio PT, Luísa Erundina promoveu uma profunda\ninversão de prioridades, aumentando o percentual do orçamento destinado\nà área social. No setor de abastecimento, lançou campanhas de venda de\nprodutos alimentícios a preços mais baixos, criou 33 sacolões e 41\ncomboios de alimentos. Construiu 48 creches, 32 centros de convivência e\n60 campos de futebol de várzea e instalou 86 ruas de lazer.\n\nA despeito da canalização de 33 quilômetros de córregos, as enchentes\ncontinuaram castigando a cidade de São Paulo, inclusive com\ndeslizamentos de terras que soterraram a favela Nova República. Tal fato\nlevou Erundina à elaboração, junto com 16 prefeitos da Região\nMetropolitana de São Paulo, de um plano para o enfrentamento de\nsituações de enchente.\n\nA administração de Luísa Erundina aumentou o número de leitos\nhospitalares, internações, médicos e unidades de saúde. A taxa de\nmortalidade hospitalar, que chegara a 7 ,4% em 1990, caiu para 5% no\nprimeiro trimestre de 1992, ao passo que o índice anual de mortalidade\ninfantil foi reduzido em 7%. Foram construídos seis novos hospitais de\ngrande e médio portes, 31 unidades especializadas e 33 prontos-socorros,\nambulatórios ou postos de saúde.\n\nNo setor cultural, Erundina iniciou sua gestão com a polêmica decisão de\ndeclarar de utilidade pública, para fins de desapropriação, a mansão da\nfamília Matarazzo na avenida Paulista. A idéia era instalar ali o Museu\ne a Casa da Cultura do Trabalhador, mas a iniciativa não foi levada\nadiante. Na realidade, as principais realizações no setor, que\nresultaram inclusive no recebimento de prêmios de organismos\ninternacionais, foram a construção de casas de cultura na periferia e a\nampliação da oferta de serviços das bibliotecas municipais através da\nutilização de dez ônibus-bibliotecas, da construção de oito bibliotecas\ne da aquisição de 530 mil livros.\n\nLuísa Erundina destinou ao setor de obras a metade dos recursos\norçamentários alocados por seu antecessor, Jânio Quadros, paralisando\nobras de grande porte como o túnel sob o rio Pinheiros. Ainda assim,\nconcluiu várias obras iniciadas na gestão anterior e promoveu uma\nrevitalização do centro da cidade com a reurbanização do vale do\nAnhangabaú e a reforma do palácio das Indústrias, no parque dom Pedro\nII, para abrigar a sede da prefeitura. No setor habitacional foram\nconstruídas 36 mil moradias populares, dez mil das quais em regime de\nmutirão.\n\nForam realizados concursos públicos para o preenchimento de vagas, ainda\nque em caráter provisório, aumentando assim o número de funcionários\nmunicipais, que passou de 110.455 em 1988 para 137.536 em 1992. Os\nmaiores aumentos ocorreram nas áreas de saúde, habitação, planejamento,\nbem-estar social e educação. Ao deixar a prefeitura, Erundina tinha\nencaminhado à Câmara Municipal projetos de lei que criavam cerca de\n6.600 vagas na administração direta, visando à regularização dos\nfuncionários concursados admitidos em caráter provisório e ao\nfuncionamento de creches e unidades de saúde em vias de inauguração.\n\nO maior legado da gestão de Luísa Erundina na prefeitura de São Paulo\nforam as realizações na área da Secretaria de Educação, cujo titular foi\no renomado educador Paulo Freire. Merecem destaque o aumento do número\nde matrículas, a criação de 70 novas escolas, a redução do percentual de\nevasão e de repetência, a alfabetização de adultos e a instalação de\nmicrocomputadores em 50 escolas da periferia. A administração petista\npromoveu mudanças no processo educacional, eliminando a avaliação por\nnotas e a divisão do primeiro grau em oito séries, estabelecendo três\nciclos e restringindo a possibilidade de reprovação apenas ao término\ndos terceiro, sexto ou oitavo anos.\n\nAo final de seu mandato, Luísa Erundina diria que entre suas falhas na\nadministração da cidade de São Paulo estava a política de comunicação.\n“Hoje entendo a comunicação como sendo uma política pública”, declarou\nao jornal *O Estado de S. Paulo* em 1º de janeiro de 1993. No entanto,\nos pareceres do Tribunal de Contas do Município (TCM) de São Paulo\nreprovaram particularmente os gastos da prefeitura com publicidade,\nentre os quais os destinados à contratação do ator americano Jack\nPalance para parodiar a série de fenômenos sobrenaturais *Acredite... se\nquiser*.\n\nNa verdade, o TCM reprovou sistematicamente suas contas anuais. O órgão\nrejeitou a relação de gastos de 1990, sustou contratos de publicidade e\nnão aprovou as contas de 1991, apontando diversas irregularidades, entre\nas quais a abertura de crédito suplementar com base num excesso de\narrecadação que não ocorrera, a prorrogação de contratos temporários\ndesrespeitando a Lei Orgânica do Município, a transferência de dotações\nde recursos para gastos de pessoal, os gastos excessivos com\npublicidade, e a inversão de prioridades do orçamento. Os cinco\nauditores independentes contratados pela prefeitura foram unânimes em\ndeclarar não ter havido improbidade administrativa, e sim pequenos erros\nformais, insuficientes para a rejeição das contas. Outro obstáculo às\nações da prefeita foi a Câmara Municipal. Em duas ocasiões a maioria\noposicionista aprovou em plenário os pareceres do TCM, rejeitando as\ncontas da prefeitura, o que significava a possibilidade de*impeachment*\ne, ao término da gestão da prefeita, a perda de seus direitos políticos.\n\nNo plano nacional, o ano de 1992 foi agitado por acusações de corrupção\nao presidente da República Fernando Collor de Melo, que desencadearam\numa ampla campanha popular exigindo sua destituição. Em setembro, Luísa\nErundina associou-se ao senador Mário Covas, do PSDB, para realizar no\nvale do Anhangabaú um ato suprapartidário em defesa do *impeachment* do\npresidente. No final desse mês, a Câmara dos Deputados aprovou abertura\ndo processo de *impeachment*, Collor afastou-se provisoriamente da\npresidência, e assumiu o governo, em 2 de outubro, o vice-presidente\nItamar Franco.\n\nNo segundo semestre de 1992, ao longo da campanha eleitoral para sua\nsucessão, Luísa Erundina voltou a manter uma relação conflituosa com seu\npartido. O PT ignorou as realizações da prefeita e preferiu centrar a\ncampanha na questão nacional. A derrota eleitoral do candidato petista à\nprefeitura, Eduardo Suplicy , para Paulo Maluf ocorreu em todas as\nfaixas de renda, inclusive naquelas mais baixas. Luísa Erundina\nconstituiu um grupo de trabalho para prestar esclarecimentos aos\nrepresentantes do prefeito eleito e declarou que entregaria a prefeitura\ncom as finanças saneadas. No último mês de seu mandato, dezembro de\n1992, 29% dos paulistanos aprovavam a gestão petista e 38% a avaliavam\ncomo ruim ou péssima. Erundina, que entrara na prefeitura sendo\nconsiderada uma radical de esquerda, “xiita”, ao término de sua\nadministração tinha posições consideradas de “direita” no interior do\nPT. Ela própria declararia: “O poder temperou a radicalidade e minha\nprópria estrutura pessoal. Continuo socialista, mas acho que devemos\noptar por uma oposição mais consequente nas várias esferas de governo.”\n\nApós a posse de Paulo Maluf, em janeiro de 1993, seriam instaladas\nvárias auditorias e sindicâncias sobre a administração de Luísa\nErundina, que resultariam em acusações de irregularidades na utilização\nde verbas públicas em viagens internacionais, ligações telefônicas,\ncompra de alimentos para a merenda escolar etc. Em julho de 1993 Luísa\nErundina já respondera a 51 ações populares. Em novembro de 1995, o\nTribunal de Justiça a inocentou no processo aberto contra supostas\nirregularidades na aquisição de leite em pó e, por unanimidade, decidiu\narquivar o processo por crime de responsabilidade pelo uso irregular de\nverbas públicas no exercício de 1991.\n\nAinda nos últimos dias de 1992, quando Collor renunciou, horas antes de\nter o *impeachment* aprovado pelo Senado, Luísa Erundina defendeu o\napoio do PT ao governo Itamar Franco, que então deixava a interinidade\npara se tornar efetivo, declarando: “O PT foi o primeiro partido a\npropor o *impeachment* do presidente Fernando Collor; é, portanto,\nresponsável também pelo governo do presidente Itamar Franco. Somos\nco-responsáveis, o país precisa de nossa ajuda, temos que ajudar esse\ngoverno.”\n\nNa Secretaria de Administração Federal\n\nDesde novembro de 1992, o diretório nacional do PT decidira, por 26\nvotos contra 25, declarar-se em oposição ao governo Itamar Franco e\nmanifestar-se contrário à participação de seus membros na administração\nfederal. Luísa Erundina defendeu a opinião de que a reunião do diretório\nnacional, a ser realizada em fevereiro de 1993, deveria rever essa\nposição, mas antes mesmo que isso acontecesse recebeu e aceitou o\nconvite de Itamar para, em caráter pessoal, assumir o cargo de\nministra-chefe da Secretaria de Administração Federal (SAF). Na ocasião\ndeclarou considerar a SAF um ministério estratégico para a realização de\nmudanças no país, principalmente em 1993, ano em que seriam realizados o\nplebiscito sobre o sistema de governo e a revisão constitucional.\n\nLuísa Erundina permaneceria à frente da SAF de 28 de janeiro a 20 de\nmaio de 1993, e sua curta gestão seria caracterizada por conflitos com o\npróprio governo Itamar Franco, com o funcionalismo federal e com o PT.\nEmbora, ao deixar a prefeitura de São Paulo, tivesse negado ser\ncandidata ao governo do estado nas eleições de 1994, pouco depois\ndeclarou ser a candidata “natural” do PT. Ainda antes de tomar posse na\nSAF, foi repreendida pelo presidente Itamar Franco por tal declaração.\n\nTambém antes da posse da nova ministra-chefe, o presidente Itamar Franco\ndeterminara uma reforma ministerial que retirou a SAF de sua anterior\nsituação de subordinação ao Ministério do Trabalho e elevou-a à\ncategoria de ministério. Contudo, ao assumir o cargo, Luísa Erundina\nencontrou uma secretaria totalmente desorganizada, ainda sem sua nova\nestrutura regulamentada, sem controle sobre a qualidade e distribuição\nde um quadro funcional de cerca de 1,1 milhão de servidores ativos e com\numa herança de perto de cem mil servidores colocados em disponibilidade\npelo governo Collor. Além da política salarial e do plano de cargos e\ncarreira do funcionalismo federal, as responsabilidades da SAF abrangiam\nos imóveis funcionais dentro e fora do país, as licitações e compras do\ngoverno, a Escola Nacional de Administração Pública e a participação nas\nreformas administrativas dos demais ministérios. Apesar de anunciar\npropostas em todas as áreas de atuação da SAF, Erundina concentrou-se na\npolítica salarial dos servidores públicos. Manifestou-se favorável à\nprofissionalização do serviço público, defendeu a revisão do estatuto da\nestabilidade e, entre as propostas de modernização do aparelho de\nEstado, defendeu a descentralização do poder, a democratização da\nmáquina administrativa, tornando-a aberta ao controle da sociedade, a\nagilidade nos seus procedimentos e a modernização de seus sistemas de\ngerenciamento\n\nA entrada no governo de Luísa Erundina, que se aposentara do serviço\npúblico após 38 anos de trabalho, representou o fortalecimento de um\ngrupo de ministros e líderes de centro-esquerda constituído por Válter\nBarelli no Ministério do Trabalho, Jutaí Magalhães Júnior (PSDB) no\nMinistério do Bem-Estar Social, Jamil Haddad, do Partido Socialista\nBrasileiro (PSB), no Ministério da Saúde, Antônio Brito (PMDB) no\nMinistério da Previdência Social, o deputado Roberto Freire, do Partido\nPopular Socialista (PPS), na liderança do governo na Câmara dos\nDeputados e o senador Pedro Simon (PMDB) na liderança do governo no\nSenado. Durante os primeiros meses de 1993 esse grupo disputou a\ncondução do governo contra a base de apoio conservadora e,\nprincipalmente, contra o “grupo palaciano” constituído por colaboradores\ndo presidente, em sua maioria oriundos de Juiz de Fora.\n\nNo início de março de 1993, a substituição de Paulo Haddad no Ministério\nda Fazenda por Eliseu Resende, identificado com a base governista\nconservadora, provocou reações do grupo de centro-esquerda e sua\narticulação para oferecer alternativas políticas a Itamar Franco. Na\nocasião, Luísa Erundina criticou a forma como o presidente substituíra o\nministro e cobrou a elaboração de um plano estratégico de governo com\nconotação social, afirmando que “a equipe de governo, suprapartidária e\nde transição, não tem uma composição que lhe assegure base consistente e\npermanente”.\n\nLogo após a posse de Eliseu Resende, estabeleceu-se um impasse\nintragovernamental em relação ao reajuste dos servidores. Erundina e\nBarelli defenderam um reajuste de 36%, similar ao percentual obtido pelo\nsetor privado, contra a proposta de Resende e Ieda Crusius, do\nPlanejamento, de 10%. A determinação de um reajuste de 33% para os\nservidores públicos federais angariou para Luísa Erundina a simpatia dos\nmilitares. A definição do índice do reajuste quadrimestral provocou novo\nconflito. A defesa de Luísa Erundina de um reajuste de 97%, quando a\nFazenda não pretendia conceder mais que 35%, levou-a a receber nova\nrepreensão pública do presidente Itamar. Em pouco mais de um mês Luísa\nErundina ameaçou deixar o cargo por três vezes.\n\nO início das investigações, em maio de 1993, sobre o suposto\nenvolvimento de Eliseu Resende com a empreiteira Norberto Odebrecht\nlevou a ministra-chefe da SAF a declarar que não poderia conviver com um\nministro sob suspeição de tráfico de influência e que se demitiria do\nministério por motivos éticos. Uma articulação do grupo de\ncentro-esquerda dissuadiu Erundina de suas intenções mas, poucos dias\ndepois, em um telefonema, Itamar Franco pediu-lhe o cargo alegando a\nnecessidade de uma reforma ministerial.\n\nEm abril de 1993 a ministra-chefe da SAF determinara a abertura de\nauditoria para investigar a ocorrência de centenas de nomeações\nirregulares nos ex-territórios, denúncia que reapresentou quando de sua\ndemissão da SAF, em 20 de maio, juntamente com outras relacionadas ao\nprocesso de liquidação da Siderbrás, à contratação irregular de\nservidores para cargos de confiança no Executivo e ao uso e ocupação dos\nimóveis funcionais. Erundina transmitiu o cargo ao general reformado\nRonaldo Canhim, juntamente com um dossiê sobre as irregularidades\nconstatadas e as pressões de membros do governo e de parlamentares\ncontrárias às apurações e punições. Na mesma ocasião, o senador Fernando\nHenrique Cardoso (PSDB) deixou o Ministério das Relações Exteriores para\nsubstituir Eliseu Resende na Fazenda.\n\nAs relações Luísa Erundina na SAF com o funcionalismo federal, cujas\nentidades eram em sua maioria ligadas ao PT, foram ambíguas. Ao receber\no cargo do ministro-chefe da Secretaria Geral da Presidência, Mauro\nDurante, manifestou-se favorável à revisão da estabilidade do\nfuncionalismo e a um tratamento do serviço público similar ao das\nempresas privadas. Assim que tomou posse, o Sindicato dos Servidores\nPúblicos Federais (Sindsep) pediu audiência com a nova ministra e\napresentou-lhe 43 reivindicações. Em 12 de fevereiro, no primeiro\nencontro entre a ministra-chefe e os sindicatos dos servidores, Erundina\ndefendeu a busca conjunta de soluções estruturais e descartou qualquer\npossibilidade de aumento imediato para o funcionalismo. No final de\nfevereiro anunciou uma proposta de antecipações salariais bimestrais e\nreajustes quadrimestrais para reposição das perdas. Em março, tornou-se\numa defensora aguerrida dos índices de reajuste salarial que zerassem as\nperdas acumuladas pelos servidores públicos federais entre janeiro e\nmarço daquele ano. Na greve do funcionalismo, decretada a partir de 13\nde maio, mandou descontar os dias parados dos salários e não recebeu a\ncomissão de greve para discutir o movimento. No dia de sua demissão,\npela primeira vez, expressou apoio ao movimento grevista dos servidores\nfederais. Fez comício na manifestação dos servidores, de quem recebeu\nsolidariedade, criticando o governo e denunciando casos de corrupção.\n\nFinalmente, em relação ao PT, a entrada de Luísa Erundina no governo\nItamar provocou uma grave crise interna e uma deterioração das já\nabaladas relações entre a ex-prefeita e seu partido. Na reunião da\ndireção nacional, em 6 fevereiro de 1993, o PT decidiu manter uma\n“oposição ativa e propositiva” ao governo Itamar Franco, o que não\nimpediria o partido de apresentar propostas ao governo como o programa\nde combate à fome. Na mesma reunião, a ex-prefeita de São Paulo foi\nsuspensa por um ano de seus direitos e deveres partidários. Erundina\nconsiderou a punição excessivamente rigorosa e uma vitória dos grupos\nmais sectários e radicais do partido. Reconhecendo ter desobedecido\napenas uma norma partidária e não um princípio, declarou que iria\nrecorrer da decisão no encontro nacional do partido.\n\nExcluída das discussões internas do PT sobre o sistema de governo, Luísa\nErundina, que já declarara ser parlamentarista em 1992, manteve sua\nposição, mesmo com a vitória do presidencialismo no plebiscito interno\ndo PT, e participou dos programas de rádio e TV da Frente\nParlamentarista. Durante o período em que vigorou sua suspensão do PT a\nex-prefeita de São Paulo recebeu convites para ingressar no PSB, no PPS\ne no Partido Democrático Trabalhista (PDT).\n\nDe volta ao PT\n\nNo dia seguinte à saída de Luísa Erundina do governo Itamar, o\npresidente do PT, Luís Inácio Lula da Silva, iniciou o processo de\nreabilitação da ex-ministra, promovendo uma articulação para a revogação\nde sua suspensão. Na primeira quinzena de junho de 1993, no VIII\nEncontro Nacional do PT, o plenário aprovou por um placar apertado a\ndecisão do diretório nacional de reintegrar Luísa Erundina. Ainda nesse\nano, a ex-ministra-chefe da SAF participou da Caravana da Cidadania,\nacompanhando Luís Inácio Lula da Silva em sua campanha para a\npresidência da República, e manifestou-se favorável a uma política de\nalianças dos partidos de centro-esquerda nas eleições para os governos\nestaduais e para a presidência da República.\n\nCandidata do PT ao Senado em outubro de 1994, recebeu votação expressiva\n— cerca de 4,2 milhões de votos — mas insuficiente para eleger-se,\nficando atrás de José Serra, do PSDB, e Romeu Tuma, do PFL.\nResponsabilizou pelo seu insucesso a direção do PT, a falta de recursos\nfinanceiros e a oposição das alas mais radicais do partido por ter\nocupado cargo no governo Itamar Franco. “Boa parte da campanha foi feita\ncom um olho na sociedade e outro na luta interna do partido”, declarou à\n*Folha de S. Paulo*. No segundo turno das eleições estaduais defendeu o\nengajamento do PT na campanha de Mário Covas, do PSDB, contra Francisco\nRossi, do PDT, mas o partido decidiu apenas votar em Covas e declarar-se\nem oposição ao governo estadual.\n\nEm fevereiro de 1995 recusou convite de Rute Cardoso, mulher do\npresidente Fernando Henrique Cardoso, para integrar, como representante\nda sociedade civil, o conselho do programa Comunidade Solidária, criado\npara coordenar as políticas sociais do governo federal. Ainda nesse ano\nlecionou na Universidade Federal de Juiz de Fora e foi assessora\nespecial do prefeito de Petrópolis (RJ), Sérgio Fadel, do PDT, com o\n*status* de secretária e a incumbência de opinar sobre os assuntos\ncomunitários da prefeitura e colaborar na montagem do orçamento\nparticipativo.\n\nEm julho de 1995 iniciou sua campanha para ser candidata do PT à\nprefeitura de São Paulo nas eleições de outubro de 1996. As pesquisas\neleitorais na ocasião revelavam que seu nome tinha o primeiro lugar na\npreferência da população da capital. Em agosto do mesmo ano, durante o X\nEncontro Nacional do PT, foi indicada e aceitou uma das 85 vagas do\ndiretório nacional, mas recusou o convite formulado pelo novo presidente\nnacional do partido, o deputado federal José Dirceu, para integrar a\nexecutiva nacional.\n\nPara a escolha do candidato do partido à prefeitura de São Paulo, o PT\npromoveu uma série de 13 debates entre os candidatos, que se estenderam\nde fevereiro a março de 1996, quando foi realizada a consulta prévia\nentre os militantes. Luísa Erundina apresentou-se como candidata das\nbases, enfrentando o candidato da direção, o ex-deputado federal e\ncandidato a vice-presidente na chapa de Luís Inácio Lula da Silva à\npresidência da República, Aluísio Mercadante, e ainda a vereadora Teresa\nLajolo, ex-secretária de Transportes em sua própria gestão na\nprefeitura, apoiada pelas correntes mais à esquerda do partido. Durante\no ciclo de debates com os militantes, foi necessária a intervenção da\ndireção nacional do PT, que repreendeu publicamente os três candidatos\npor terem ultrapassado os limites nas agressões mútuas. Em 26 de março\nde 1996, Luísa Erundina venceu a consulta prévia do partido com 55,57%\ndos votos válidos, derrotando Aluísio Mercadante (36,76%) — que se\ntornou seu companheiro de chapa, disputando a vice-prefeitura — e Teresa\nLajolo (3,79%). Candidata do PT à sucessão de Paulo Maluf na prefeitura\npaulistana, a candidata declarou que articularia uma política de aliança\neleitoral e um governo de coalizão para retomar o governo popular e\ndemocrático, com prioridade para o setor social.\n\nSeis meses antes da eleição as pesquisas continuavam a indicar a\npreferência do eleitorado paulistano pela ex-prefeita, mas também a\napontavam como campeã de rejeição, com cerca de 40% do eleitorado\ncontrário ao seu retorno à prefeitura. Em maio de 1996 a convenção do PT\noficializou a chapa Erundina-Mercadante e a coligação Frente Brasil\nPopular – PT, PSB, Partido Comunista do Brasil (PCdoB), Partido\nComunista Brasileiro (PCB), Partido da Mobilização Nacional (PMN) e PPS\n– para concorrer às eleições municipais. Durante a campanha eleitoral\nErundina buscou caracterizar-se como “o PT que diz sim”, abandonando o\nperfil radical e apresentando propostas em que enfatizava a retórica da\neficiência social com o *slogan* “onde o PT governa, dá certo”. Não\nconseguiu baixar seus índices de rejeição e foi muito criticada pela\ndireção e pela militância partidária por suas estratégias de\n*marketing*.\n\nEm 3 de outubro recebeu 1.291.120 votos (23%), o que garantiu sua ida ao\nsegundo turno das eleições municipais. No entanto, em 15 de novembro,\nrecebendo 1.924.630 votos (34,7%), foi derrotada por seu adversário\nCelso Pitta — secretário de Finanças e afilhado político do prefeito\nPaulo Maluf, do Partido Progressista Brasileiro (PPB).\n\nCriticada pela direção estadual do PT pela linha política adotada na\ncampanha — sobretudo a fragilidade da oposição a Maluf e a campanha na\nTV —, Erundina viu suas chances de disputar o governo do estado no\npleito de outubro de 1998 diminuírem bastante. Em sua primeira\nentrevista à imprensa depois das eleições, em dezembro de 1996, declarou\nque o PT não tinha projeto para se contrapor às políticas dominantes.\n\nEm março de 1997 a 11ª Vara da Fazenda Pública abriu ação civil contra\nErundina, sob acusação de ato de improbidade administrativa quando na\nprefeitura de São Paulo. Documento do Ministério Público acusou a\nex-prefeita de ter contratado entre agosto de 1991 e agosto de 1992, sem\nlicitação, quatro escritórios de juristas e auditores para emitir\npareceres sobre suas contas — execução orçamentária e balanço financeiro\n— referentes aos anos de 1990 e 1991 que haviam sido rejeitadas pelo TCM\nde São Paulo.\n\nAinda em março de 1997, começou a participar de um movimento organizado\npelo PT e outros partidos de oposição pedindo a criação de uma comissão\nparlamentar de inquérito (CPI) na Câmara Municipal de São Paulo a fim de\napurar a emissão irregular de títulos públicos para pagamento de\nprecatórios na gestão de Celso Pitta (1997-2000) na prefeitura de São\nPaulo, investigação que também estava ocorrendo numa CPI instaurada na\nCâmara dos Deputados. Dispondo-se a comparecer perante a CPI federal,\ndeclarou que tanto Paulo Maluf quanto Celso Pitta deveriam ter\nconhecimento das irregularidades na emissão de títulos públicos.\nContudo, de acordo com reportagem da revista *IstoÉ*, a emissão\nsuperestimada de títulos públicos para pagamento de precatórios\niniciou-se no final do governo Erundina, em setembro de 1992, quando um\ngrande pacote de Letras Financeiras do Tesouro Municipal (LFTM) foi\naprovado pelo Senado, apesar do veto do Banco Central. No parecer do\nrelator da CPI dos Precatórios, senador Roberto Requião (PMDB),\napresentado em maio, Erundina foi responsabilizada pela não utilização\nde 43,5 milhões de reais arrecadados com a venda de títulos públicos\npara pagamento de precatórios. Contestando o parecer do relator,\nErundina declarou que não houve desvio, pois os recursos que sobraram\nforam utilizados para o pagamento de complementos de precatórios\ndeterminados pelo Tribunal de Justiça, argumento posteriormente refutado\npelo TCM de São Paulo.\n\nNa Câmara dos Deputados\n\n \n\nSentindo seu espaço político dentro do PT diminuir progressivamente, em\nsetembro de 1997 Luísa Erundina deixou o partido. Em sua carta de\ndesfiliação, justificou a saída argumentando que o partido tinha\n“perdido eficácia, devido à dificuldade de se reciclar e de se adaptar\nàs exigências dos novos tempos” e que “a luta fratricida entre as\ntendências” teria sido responsável pelo distanciamento entre a cúpula e\nas bases partidárias.\n\nAinda no mesmo mês filiou-se ao PSB, na presença das maiores lideranças\nda agremiação, como o governador de Pernambuco Miguel Arrais. Cotada\npara se candidatar ao governo de São Paulo ou até à presidência da\nRepública por uma frente de centro-esquerda em outubro de 1998, passou,\nno entanto, a defender o apoio do PSB à reeleição de Mário Covas para o\ngoverno paulista e os nomes de Itamar Franco ou Ciro Gomes para\npresidente. No início de 1998 tornou-se vice-presidente do PSB.  Com o\nlançamento das candidaturas de Ciro Gomes à presidência da República,\npelo PPS, e de Itamar Franco para o governo de Minas Gerais, pelo PMDB,\no PSB acabou decidindo apoiar a candidatura presidencial de Lula.\nErundina decidiu, então, disputar uma cadeira na Câmara dos Deputados\nnas eleições de outubro seguinte. Foi eleita com mais de 187 mil votos —\na maior votação da legenda socialista e a sexta entre todos os\ncandidatos.\n\n  Em janeiro de 1999, foi convidada pelo governador reeleito Mário Covas\na assumir a Secretaria da Criança, Família e Bem-Estar Social de São\nPaulo. Nesse período, foi a principal interlocutora de Covas dentro do\nPSB, nas negociações sobre a participação dos socialistas,que o haviam\napoiado, no governo do estado. Acabou por recusar a secretaria,\npreferindo exercer, a partir de fevereiro, o mandato na Câmara. Entre\n1999 e 2000, foi, simultaneamente, vice-líder do bloco PSB-PC do B e\nlíder do PSB.\n\nAinda em 1999, apresentou um projeto de extinção dos tribunais de contas\ndos municípios de São Paulo e do Rio de Janeiro. Em sua justificativa,\nafirmava que esses tribunais “consomem, injustificadamente, fortunas do\nerário” e que as Câmaras de Vereadores estavam aparelhadas para\nfiscalizar os gastos do Executivo municipal. Contudo, ao apreciar a\nproposta, a Comissão de Constituição e Justiça da Câmara considerou que\ncompetia aos municípios legislar sobre o assunto. No segundo semestre de\n1999, participou das mobilizações dos partidos de oposição no sentido de\nque fosse feita uma investigação sobre a privatização da Telebrás\nrealizada por Fernando Henrique Cardoso. Na ocasião defendeu a\ninstalação de uma CPI para apurar as denúncias de irregularidade no\nprocesso e, caso estas ficassem comprovadas, a abertura de um processo\nde *impeachment* contra o presidente.\n\nEm 2000, foi lançada candidata à prefeitura de São Paulo pelo PSB. No\ninício da campanha foi pressionada pelo PT a abrir mão da candidatura em\nprol de uma aliança com a candidata petista, Marta Suplicy. Entretanto,\nmanteve sua candidatura, apoiada por uma frente de partidos que reunia,\nalém do PSB, o PDT, o PPS e o PMN. Centrou boa parte das atividades de\ncampanha na periferia de São Paulo. Ficou em quinto lugar na votação do\nprimeiro turno. No segundo, apoiou Marta Suplicy contra Paulo Maluf,\ndepois que a candidata petista incorporou a seu programa os três pontos\nque exigia: a municipalização da segurança, o aumento da carga horária\nno ensino fundamental e a nomeação dos subprefeitos com base numa lista\ntríplice elaborada com participação popular. Após a vitória de Marta\nSuplicy, descartou sua participação direta na nova gestão, mas declarou\nque a apoiaria: “Todos nós que apoiamos a Marta e fizemos derrotar o\nmalufismo de uma vez por todas temos a responsabilidade de ajudar a\ngovernar a cidade. Mas quero ser uma interlocutora entre o governo e a\nsociedade, sobretudo os setores mais marginalizados.”\n\nEm janeiro de 2002, declarou-se candidata às eleições para o governo do\nestado que aconteceriam em outubro. Na ocasião, propôs uma aliança com o\nPT desde o primeiro turno. Sugeriu que o critério para a escolha do\ncabeça de chapa fosse a posição dela própria ou do candidato petista,\nJosé Genoíno, nas pesquisas de intenção de voto que seriam realizadas\ndentro de três meses. No final de março, anunciou sua decisão de\ndesistir de concorrer, em nome da união da esquerda nas disputas dos\ngovernos dos estados e da presidência. Mesmo assim, o PSB lançou\ncandidato próprio ao governo de São Paulo, Carlos Roberto Pittoli.\nErundina tornou público seu apoio a José Genoíno ainda no primeiro\nturno. Antes disso, já havia declarado seu voto em Lula, ainda que seu\npartido concorresse ao pleito presidencial com Anthony Garotinho.\n\nEm outubro, foi reeleita deputada federal para o período 2003-2007.\nConcorreu novamente, em 2004, à prefeitura de São Paulo, numa aliança\nentre o PSB, o PMDB e o PMN. Obteve pouco menos de 4% dos votos válidos,\nficando em quarto lugar no primeiro turno. Durante a campanha, enfatizou\nsuas propostas voltadas para as mulheres. No segundo turno, apesar da\nrecomendação da executiva nacional PSB de apoio a Marta Suplicy,\nabsteve-se de apoiar a candidata petista ou mesmo seu concorrente, José\nSerra, do PSDB. Durante a legislatura, foi vice-líder do PSB em 2006 e\nmembro da Comissão de Ciência e Tecnologia, Comunicação e Informática, e\nda Comissão de Legislação Participativa.\n\nEm 2006 foi reeleita deputada federal para a legislatura 2007-2011. No\ninício de 2007, quando se organizou na Câmara um grupo de parlamentares\nde vários partidos, chamado pela imprensa de “grupo dos 30”, para lançar\numa candidatura à presidência da casa alternativa aos dois nomes\nlançados pela bancada governista – Aldo Rebelo (PC do B) e Arlindo\nChinaglia (PT) – foi sondada como possível candidata, assim como os\ndeputados José Eduardo Cardoso (PT) e Osmar Serraglio (PMDB). No ano\nseguinte, Marta Suplicy lançou-se mais uma vez candidata à prefeitura de\nSão Paulo e a convidou para compor sua chapa. No entanto, o bloco de\npartidos que apoiava a candidatura petista – incluindo o PSB, o PDT e o\nPC do B – preferiu o nome de Aldo Rebelo, que acabou oficializado. Desde\no início da legislatura, Erundina participou da Comissão de Ciência e\nTecnologia, Comunicação e Informática, da Comissão de Legislação\nParticipativa, da Comissão Especial da Reforma Política e, também, foi\nintegrante do Conselho de Ética e Decoro Parlamentar da Câmara.\n\nFoi membro ainda da Subcomissão dos Direitos da Criança e do Adolescente\nda seção São Paulo da Ordem dos Advogados do Brasil (OAB).\n\nPublicou *Exercício de paixão política* (1991). A seu respeito, José\nNêumane escreveu *Erundina — a mulher que veio com a chuva* (1989).\nSobre sua gestão à frente da prefeitura de São Paulo, Paul Singer\npublicou *Um governo de esquerda para todos* (1996), e Cláudio Gonçalves\nCouto, *O desafio de ser governo: o PT na Prefeitura de São Paulo\n(1989-1992)* (1995).\n\nSarah Escorel/Marcelo Costa/\n\n*Marco Aurélio Vannuchi Leme de Mattos*\n\n* *\n\n**FONTES**: CÂM. DEP. *Deputados brasileiros.*Repertório**(1999-2003);\n*Estado de S. Paulo* (1/2/93, 18/3, 17 e 26/11/96, 9/3, 21/4, 24/5 e\n19/9/97); *Folha de S. Paulo* (31/12/92, 14/10/94, 19 e 23/11 e 1/12/96,\n11/4, 23/5, 11/6, 23/7 e 11/9/97, 2/1/99, 21/1/99, 26/1/99, 14/4/99,\n27/8/99, 7/12/99, 5/2/00, 22/2/00, 18/3/00, 16/8/00, 10/10/00, 30/10/00,\n19/1/02, 28/3/02, 3/10/02, 15/10/02, 3/8/04, 8/10/04, 9/1/07, 9/5/08,\n10/5/08, 28/6/08); *Globo* (27/1/93, 23/5, 5/6, 6 e 18/9/97, 2 e 13/3 e\n10/10/98);*IstoÉ* (30/4/97); *Jornal do Brasil* (9/3/93, 24/3 e 5/9/97,\n13/3/98); Portal da Câmara dos Deputados. Disponível em :\n\\<[http://www2.câmara.gov.br](http://%20(www2.câmara.gov.br)\\>. Acesso\nem : 05 set. 2009; Portal do TSE. Disponível em :\n\\<http://[www.tse.gov.br](http://www.tse.gov.br/)\\>. Acesso em : 05 set.\n2009; Site Luiza Erundina. Disponível em :\n\\<http://[www.deputadaluizaerundina.com.br](http://www.deputadaluizaerundina.com.br/)\\>.\nAcesso em : 05 set. 2009.\n\n \n","ref":"","dic":"DHBB"}
