{"title":"EUGÊNIO, Mário","cargoss":["Deputado federal","Deputado federal"],"cargos_esp":[0,0],"datas_ini":[1955,1951],"datas_fim":[1959,1953],"estados":["SP","SP"],"autor":[0],"content":"**EUGÊNIO, Mário**\n\n\\*dep. fed. SP 1951-1953 e 1955-1959.\n\n \n\n*Mário Eugênio* nasceu em Campinas (SP) no dia 8 de outubro de 1913,\nfilho de Manuel Eugênio e de Ana Francisca Eugênio.\n\nRealizou seus estudos no Ginásio Anglo-Latino e no Instituto Comercial\ndo Rio de Janeiro, diplomando-se em contabilidade.\n\nIniciou sua carreira política elegendo-se, em janeiro de 1947, deputado\nà Assembléia Constituinte do estado de São Paulo na legenda do Partido\nSocial Progressista (PSP). Participou da elaboração da Constituição\npaulista e candidatou-se a deputado federal nas eleições de outubro de\n1950 na legenda do PSP, obtendo apenas uma suplência. Em janeiro de 1951\ndeixou a Assembléia paulista e em abril foi chamado à Câmara Federal,\nonde ocupou uma cadeira até abril de 1952. Novamente convocado em agosto\ndesse ano, exerceu mandato até maio de 1953, voltando uma terceira vez à\nCâmara entre agosto e setembro do mesmo ano.\n\nAo lado dessa atuação parlamentar intermitente, exerceu, durante três\nanos, o cargo de diretor da Caixa Econômica de São Paulo, no período em\nque Lucas Nogueira Garcez ocupou o governo paulista (1951-1955). Durante\nsua gestão foram inauguradas mais de 40 agências no interior do estado e\nconcedidos muitos empréstimos às prefeituras de várias cidades para a\nsolução de problemas de água, esgoto e calçamento.\n\nNas eleições de outubro de 1954 candidatou-se a deputado federal, dessa\nvez na legenda do Partido Social Democrático (PSD). Tomou assento na\nCâmara dos Deputados em fevereiro do ano seguinte, cumprindo o mandato\naté o fim da legislatura, em janeiro de 1959.\n\nParticipou da Associação Paulista de Municípios desde a fundação do\nórgão. Banqueiro e destacado financista, teve seu nome cogitado, durante\no governo do presidente Juscelino Kubitschek (1956-1961), para a\npresidência do Banco do Brasil.\n\nFaleceu em Presidente Prudente (SP) no dia 18 de outubro de 1977.\n\nEra casado com Mirda Sandoval Eugênio, com quem teve quatro filhos.\n\n \n\nFONTES: CÂM. DEP. *Deputados*; CÂM. DEP. *Relação dos dep*.; CISNEIROS,\nA. *Parlamentares*;*****Eleitos*; INF. Maria Mônica Eugênio da Paz; SOC.\nBRAS. EXPANSÃO COMERCIAL. *Quem*.\n\n \n","ref":"FONTES: CÂM. DEP. *Deputados*; CÂM. DEP. *Relação dos dep*.; CISNEIROS,\nA. *Parlamentares*;*****Eleitos*; INF. Maria Mônica Eugênio da Paz; SOC.\nBRAS. EXPANSÃO COMERCIAL. *Quem*.\n\n \n","dic":"DHBB"}
