{"title":"FABRÍCIO, José Daudt","cargoss":["Comandante da Escola Superior de Guerra"],"cargos_esp":[0],"datas_ini":[1960],"datas_fim":[1961],"estados":[0],"autor":[0],"content":"**FABRÍCIO, José Daudt**\n\n\\*militar; comte. ESG 1960-1961.\n\n \n\n*José Daudt Fabrício* nasceu em Porto Alegre no dia 20 de abril de 1898,\nfilho de José Luís Fabrício Júnior e de Ida Daudt Fabrício.\n\nIngressou na Escola Militar do Realengo no Rio de Janeiro, então\nDistrito Federal, em fevereiro de 1916, tornando-se aspirante em\ndezembro de 1918. Foi promovido a segundo-tenente em dezembro de 1919, a\nprimeiro-tenente em janeiro de 1921, a capitão em dezembro de 1922 e a\nmajor em outubro de 1934.\n\nRecebendo a patente de tenente-coronel em março de 1940, passou a\ncoronel em abril de 1943, exercendo nesse posto, de 1948 a 1949, a\nchefia de gabinete do general Canrobert Pereira da Costa, então ministro\nda Guerra. Promovido em fevereiro deste último ano a general-de-brigada,\ncomandou a Escola de Comando e Estado-Maior do Exército (ECEME) em 1951\ne a Infantaria Divisionária da 5ª Região Militar (RM), sediada em\nCuritiba, em 1952. Em 1954 assumiu o comando da 5ª RM.\n\nFoi promovido a general-de-divisão em junho de 1955, ocupando nesse ano\na primeira subchefia do Estado-Maior do Exército. Atingiu a patente de\ngeneral-de-exército em julho de 1959 e em março do ano seguinte foi\nnomeado comandante da Escola Superior de Guerra (ESG), sucedendo ao\nmarechal Artur Hescket Hall. Exerceu essa função até outubro de 1961,\ntransferindo o cargo ao almirante Luís Teixeira Martins. Em julho de\n1963, foi promovido a marechal.\n\nJosé Daudt Fabrício foi ainda engenheiro-chefe e comandante do\n1º****Batalhão Rodoviário, adido militar junto à embaixada do Brasil na\nArgentina e diretor de Armas do Exército. Fez os cursos de engenharia,\nde aperfeiçoamento de oficiais, de estado-maior do Exército, de geodésia\ne astronomia e de grandes estruturas da Escola Nacional de Engenharia.\nBacharelou-se em matemática e ciências físicas e cursou a Escola\nSuperior de Guerra. Foi o responsável pela construção da rodovia que\nliga Curitiba a Ponta Grossa, no Paraná, e da hidrelétrica de Piquete,\nno Rio de Janeiro. Bacharelou-se em ciências físicas e cursou a ESG.\n\nFaleceu no Rio de Janeiro, no dia 2 de dezembro de 1991.\n\nEra casado com Marina Ferraz Fabrício, com quem teve uma filha adotiva.\n\n \n\n \n\nFONTES: CORRESP. ESC. SUP. GUERRA; FICHÁRIO PESQ. M. AMORIM; *Jornal do\nBrasil* (3/12/91); MIN. GUERRA. *Almanaque* (1946).****\n\n \n","ref":"FONTES: CORRESP. ESC. SUP. GUERRA; FICHÁRIO PESQ. M. AMORIM; *Jornal do\nBrasil* (3/12/91); MIN. GUERRA. *Almanaque* (1946).****\n\n \n","dic":"DHBB"}
