{"title":"FAGUNDES NETO, José Carlos","cargoss":["Deputado federal"],"cargos_esp":[0],"datas_ini":[1979],"datas_fim":[1987],"estados":["MG"],"autor":[0],"content":"FAGUNDES NETO, José Carlos\n\n\\*dep. fed. MG 1979-1987.\n\nJosé Carlos Raposo Fagundes Neto nasceu em Juiz de Fora (MG) no dia 28\nde abril de 1945, filho de Francisco Fagundes Neto e de Elza Raposo\nFagundes Neto.\n\nRealizou os estudos primários no Educandário Santa Rita de Cássia, em\nsua cidade natal, transferindo-se em seguida para Belo Horizonte, onde\nfreqüentou o curso ginasial no Colégio Militar. De volta a Juiz de Fora,\nfez o científico no Colégio Cristo Redentor e ingressou no curso de\nciências sociais da Universidade Federal de Juiz de Fora (UFJF), sem\nchegar a concluí-lo.\n\nEm novembro de 1978 foi eleito deputado federal na legenda da Aliança\nRenovadora Nacional (Arena), partido que deu suporte institucional ao\nregime militar instaurado no país em abril de 1964. Empossado em\nfevereiro de 1979, com a extinção do bipartidarismo em novembro do mesmo\nano e a conseqüente reorganização partidária, filiou-se ao Partido\nDemocrático Social (PDS), agremiação que deu continuidade à extinta\nArena.\n\nNa Câmara dos Deputados, foi membro da Comissão de Finanças e suplente\nda Comissão de Trabalho e Legislação Social (1979-1981) e da Comissão\nParlamentar de Inquérito (CPI) destinada a investigar as causas das\nelevadas taxas de juros nos diversos setores do sistema financeiro\nnacional (1980).\n\nEm novembro de 1982 foi reeleito deputado federal na legenda pedessista,\nassumindo o mandato em fevereiro do ano seguinte. Nessa legislatura, foi\nvice-presidente da Comissão de Finanças e suplente da Comissão de\nAgricultura e Política Rural (1983).\n\nNa sessão da Câmara dos Deputados de 25 de abril de 1984, votou a favor\nda emenda Dante de Oliveira, que propunha o restabelecimento das\neleições diretas para presidente da República em novembro daquele ano.\nConstatada a insuficiência de votos para que a emenda fosse submetida à\napreciação do Senado, convocou-se o Colégio Eleitoral em 15 de janeiro\nde 1985. Na ocasião, José Carlos Fagundes Neto votou em Tancredo Neves,\ncandidato da Aliança Democrática, uma união do Partido do Movimento\nDemocrático Brasileiro (PMDB) com a dissidência do PDS abrigada na\nFrente Liberal. Tancredo derrotou Paulo Maluf, candidato pedessista, mas\nem virtude de uma grave enfermidade, que o levou à morte em 21 de abril\nde 1985, não chegou a ser empossado na chefia do Executivo. Substituiu-o\nno cargo o vice José Sarney, que já vinha exercendo interinamente a\npresidência da República desde 15 de março.\n\nEm novembro de 1986, José Carlos Fagundes Neto candidatou-se a uma\ncadeira de deputado federal constituinte na legenda do Partido da Frente\nLiberal (PFL), não sendo bem-sucedido. Deixou a Câmara dos Deputados em\njaneiro de 1987, ao final da legislatura.\n\nDurante o período em que residiu em Brasília freqüentou o curso de\neconomia numa faculdade local, mas não chegou a concluí-lo.\n\nDecidido a não mais candidatar-se a cargos eletivos, em junho de 1991\ntornou-se supervisor da Junta Comercial do Estado de Minas Gerais, cargo\nem que permaneceu até fevereiro de 1999.\n\nCasou-se com Maria Isabel Resende Fagundes Neto, com quem teve dois\nfilhos.\n\nFONTES: CÂM. DEP. *Deputados brasileiros. Repertório*(1983-1987); INF.\nBIOG.\n\n \n","ref":"FONTES: CÂM. DEP. *Deputados brasileiros. Repertório*(1983-1987); INF.\nBIOG.\n\n \n","dic":"DHBB"}
