{"title":"FAGUNDES, João","cargoss":["Deputado federal","Deputado federal"],"cargos_esp":[0,0],"datas_ini":[1991,1983],"datas_fim":[1995,1987],"estados":["RR","RR"],"autor":["Marcelo Costa"],"content":"**FAGUNDES, João**\n\n\\*militar; dep. fed. RR 1983-1987 e 1991-1995.\n\n* *\n\n*João Batista da Silva Fagundes* nasceu em Uruguaiana (RS) no dia 5 de\nabril de 1936, filho de Euclides Fagundes e de Florentina da Silva\nFagundes.\n\nIniciou carreira militar ao ingressar na Escola Preparatória de Cadetes\nde Porto Alegre, transferindo-se em seguida para a Academia Militar das\nAgulhas Negras (AMAN), em Resende (RJ), onde fez curso de formação de\noficiais do Exército entre 1956 e 1958, diplomando-se engenheiro\nmilitar. Estudou também na Escola de Educação Física do Exército.\n\nBacharel em ciências jurídicas e sociais pela antiga Faculdade Nacional\nde Direito, no Rio de Janeiro, em 1965, em 1968 e 1969 fez doutorado em\ndireito penal na Universidade Federal do Rio de Janeiro (UFRJ). Em 1971,\nfreqüentou a Escola de Aperfeiçoamento de Oficiais, no Rio, e no ano\nseguinte ingressou na Associação dos Diplomados da Escola Superior de\nGuerra (ADESG), em Belo Horizonte, onde participou do ciclo de estudos\nsobre política.\n\nPosteriormente, em Brasília, foi chefe de gabinete do Superior Tribunal\nMilitar (STM), dedicando-se também ao magistério como professor de\ndireito penal na Associação de Ensino Unificado do Distrito Federal e\ntitular da cadeira de ciências sociais do Colégio Militar, do curso de\nformação de oficiais da Polícia Militar e da Academia Nacional de\nPolícia.\n\nNo pleito de novembro de 1982, elegeu-se deputado federal na legenda do\nPartido Democrático Social (PDS) pelo então território de Roraima.\nEmpossado em fevereiro de 1983, integrou várias comissões na Câmara,\nentre as quais as de Minas e Energia, da qual foi vice-presidente\n(1983-1985), de Segurança Nacional e do Índio (1983-1987). Em 1984,\nparticipou, em Madri, do debate sobre a legislação referente aos\nproblemas das minorias étnicas, particularmente os índios.\n\nEm 25 de abril de 1984, ausentou-se da votação da emenda Dante de\nOliveira, que, apresentada na Câmara dos Deputados, propôs o\nrestabelecimento das eleições diretas para presidente da República em\nnovembro daquele ano. Como a emenda não obteve o número de votos\nindispensáveis à sua aprovação — faltaram 22 para que o projeto pudesse\nser encaminhado à apreciação pelo Senado Federal —, no Colégio\nEleitoral, reunido em 15 de janeiro de 1985, João Fagundes votou em\nTancredo Neves, eleito novo presidente da República pela Aliança\nDemocrática, coligação formada entre o Partido do Movimento Democrático\nBrasileiro (PMDB) com a dissidência do PDS abrigada na Frente Liberal.\nTancredo Neves, porém, não chegou a tomar posse, vindo a falecer em 21\nde abril de 1985. A presidência foi assumida pelo vice, José Sarney, que\ndesde 15 de março vinha exercendo-a em caráter de interinidade.\n\nJoão Fagundes desligou-se do PDS em 1986, filiando-se ao PMDB. Em\nnovembro desse ano, candidatou-se a uma cadeira na Assembléia\nConstituinte, mas foi derrotado. Cumpriu o mandato ordinário até o final\nda legislatura, em janeiro de 1987, tendo chefiado, nesse período, a\nrepresentação de Roraima na capital federal. Embora afastado da vida\nparlamentar, permaneceu em Brasília, trabalhando como consultor jurídico\ndo STM.\n\nEm outubro de 1990, candidatou-se a deputado federal por Roraima, que se\ntornaria estado com a posse do seu primeiro governador eleito\ndiretamente naquele pleito. Desta vez conseguiu se eleger graças à sua\nparticipação na coligação partidária União Municipalista, do PDS, que\nelegeu Teresa Jucá deputada federal, esposa do então gover-nador Romero\nJucá Filho, também do PDS. Empossado em março de 1991, tornou-se membro\nda Comissão de Minas e Energia da Câmara e da Comissão de Defesa\nNacional, na qual criticou o acordo entre Brasil e Estados Unidos na\nárea de combate ao narcotráfico, alegando que este poderia ser utilizado\npara o envio de tropas americanas à Amazônia, abrindo “a porta para\nWashington fazer na Amazônia o que já fez no Panamá e na Bolívia”.\n\nEm 29 de setembro de 1992, votou a favor do *impeachment* do presidente\nFernando Collor de Melo, acusado de crime de responsabilidade por\nligações com um esquema de corrupção liderado pelo ex-tesoureiro de sua\ncampanha presidencial, Paulo César Farias. Com a vitória desta posição,\nCollor foi afastado da presidência e, em 29 de dezembro, pouco antes da\nconclusão do processo pelo Senado Federal, renunciou ao mandato, sendo\nefetivado no cargo o vice-presidente, Itamar Franco, que desde 2 de\noutubro vinha ocupando-o interinamente.\n\nAinda em dezembro de 1992, João Fagundes declarou não se opor à revisão\nda proporcionalidade na representação dos estados e à redução de vagas,\ne sim ao critério único de população para o estabelecimento do número de\nrepresentantes. Engajou-se na campanha contra a demarcação da reserva\ndos índios ianomâmis e moveu ação popular, em 1994, contra a Telebrás,\nacusando a empresa de gastar mais de duzentos milhões de dólares na\ncompra de terminais telefônicos, sem abrir concorrência pública.\n\nAlinhou-se entre os parlamentares que votaram a favor da criação do\nImposto Provisório sobre Movimentação Financeira (IPMF) de 0,25% como\nfonte complementar de recursos para a saúde, bem como do Fundo Social de\nEmergência (FSE), que permitia ao governo gastar 20% da arrecadação de\nimpostos sem que estas verbas ficassem obrigatoriamente vinculadas aos\nsetores de saúde e educação, mas não compareceu à sessão sobre o fim do\nvoto obrigatório.\n\nDeixou a Câmara dos Deputados em janeiro de 1995, ao final da\nlegislatura, não tendo se candidatado à reeleição no pleito de outubro\nde 1994.\n\nEm maio de 1998, foi indicado pelo presidente da República, Fernando\nHenrique Cardoso, para ocupar o cargo de ministro civil do Superior\nTribunal Militar (STM) para a vaga aberta em decorrência da\naposentadoria do ministro civil Paulo Cesar Cataldo. Seu nome foi\naprovado pelo Senado Federal após ter sido submetido a uma sabatina dos\nsenadores. Entretanto, sua indicação foi questionada pela Ordem dos\nAdvogados do Brasil (OAB), que impetrou mandato de segurança contra a\nsua nomeação, A OAB alegou, em 1º lugar ques a vaga no STM se destinava\na um civil, e que o fato de Fagundes ser militar da reserva não lhe\ntirava a qualificação de militar. Em segundo, que Fagundes era irmão de\noutro ministro do STM, Aldo da Silva Fagundes, o que era\ninconstitucional, conforme os termos de uma lei complementar à\nConstituição que proibia cônjuges e parentes consangüíneos de terem\nassento na mesma sessão dos tribunais. Por essas razões, os ministros do\nSuperior Tribunal Federal (STF) decidiram anular a indicação do nome de\nJoão Fagundes para o STM, através de uma liminar concedida pelo ministro\nMarco Aurélio de Mello.\n\nFoi Secretário de Estado da Segurança Pública do estado de Roraima e\nrepresentante do governo do estado de Roraima em Brasília, durante o\ngoverno de Ottomar de Souza Pinto (2004-2007).\n\nCasou-se com Irene Korst Fagundes, com quem teve três filhos.\n\nPublicou diversos artigos sobre direito penal em revistas especializadas\ndurante os anos de 1970, além das obras *Processo e julgamento dos\ncrimes de deserção e insubmissão* (1976), *Organização social e política\ndo Brasil* (1981), *A verdade sobre o índio* (1985) e *A justiça do\ncomandante* (1988).\n\nMarcelo Costa\n\nFONTES: CÂM. DEP*. Deputados brasileiros. Repertórios* (1983-1987,\n1991-1995); *Estado de S. Paulo* (12/4/83); *Folha de S. Paulo*(26/7/91,\n14/12/92 e 18/9/94); *Gazeta Mercantil*(11/11/1999; Disponível em:\nhttp://indexet.investimentosenoticias.com.br/arquivo/1999/11/11/310/STF-Indicacao-de-militar-da-reverva-para-STM-e-anulada.html;\nacessado em: 28/10/2009); *Globo*(9/2/94).\n\n \n","ref":"FONTES: CÂM. DEP*. Deputados brasileiros. Repertórios* (1983-1987,\n1991-1995); *Estado de S. Paulo* (12/4/83); *Folha de S. Paulo*(26/7/91,\n14/12/92 e 18/9/94); *Gazeta Mercantil*(11/11/1999; Disponível em:\nhttp://indexet.investimentosenoticias.com.br/arquivo/1999/11/11/310/STF-Indicacao-de-militar-da-reverva-para-STM-e-anulada.html;\nacessado em: 28/10/2009); *Globo*(9/2/94).\n\n \n","dic":"DHBB"}
