{"title":"FALCÃO, Hildebrando Martins ===========================","cargoss":["Revolucionário ou revoltoso","Deputado federal"],"cargos_esp":[0,0],"datas_ini":[1930,1954],"datas_fim":[1930,1955],"estados":[0,"AL"],"autor":[0],"content":"FALCÃO, Hildebrando Martins\n===========================\n\n\\*jornalista; rev. 1930; dep. fed.  AL 1954-­1955.\n\n \n\n*Hildebrando Martins Falcão*nasceu em Igreja Nova (AL) no dia 25 de\noutubro de 1904.\n\nEstudou no Colégio Diocesano de Maceió e ingressou em seguida na\nFaculdade de Direi­to de Salvador, vindo a bacharelar-se no Rio de\nJaneiro, então Distrito Federal. Ainda estu­dante iniciou a carreira de\njornalista, colabo­rando com o *Diário da Bahia*e, no Rio de Ja­neiro,\ncom *A Esquerda e A Batalha*.* *Mais tar­de, fundou O *Tempo,*que deixou\nde circular em 1930.\n\nAtivo militante da Aliança Liberal, ficou extremamente visado no Rio de\nJaneiro por sua atuação na imprensa oposicionista e em comícios da\nAliança, o que lhe valeu várias en­tradas na prisão.  Retornou então a\nseu estado natal, com a tarefa de lá chefiar o movimento aliancista. \nRadicado em Penedo (AL), reorga­nizou o jornal *A Semana,*que pouco\ndepois foi empastelado por situacionistas estaduais, simpáticos ao\ngoverno federal de Washington Luís.  Preso e expulso de Alagoas,\ntransferiu-­se para Minas Gerais.  Nomeado professor da Escola Normal de\nRio Branco (MG) pelo pre­sidente mineiro Antônio Carlos Ribeiro de\nAndrada, colaborou com diversos jornais do estado.  No auge da campanha\naliancista em Minas, foi encarregado pelo presidente Antônio Carlos de\nassumir a direção do jornal O *Libertador,*em Mar de Espanha (MG).\n\nCom a eclosão da Revolução de 1930, par­ticipou do movimento como\noficial comba­tente e após a vitória das forças revolucioná­rias voltou\na transferir-se para Alagoas, seu estado natal, onde integrou o governo\nestadual chefiado pelo interventor Hermilo de Freitas Melro, nomeado em\n14 de novembro de 1930.  Entretanto, discordando da orienta­ção do\ninterventor, abandonou o cargo que exercia antes do fim do governo deste\n(9/8/1931), vindo a ocupar uma das secretarias da Prefeitura Municipal\nde Niterói, então capital do estado do Rio de Janeiro.\n\nFiscal do Imposto de Consumo, nas elei­ções disputadas em outubro de\n1934, após a promulgação da nova Carta Constitucional, elegeu-se\ndeputado à Assembléia Legislativa alagoana como candidato sem partido,\nfato inédito na história das eleições em seu estado.  Interrompido seu\nmandato pela instauração do Estado Novo (10/11/1937), que suspendeu\ntodas as câmaras legislativas do país, retomou às funções de fiscal,\ntrabalhando no estado do Rio, no Rio Grande do Sul (no cargo de\ninspe­tor-geral) e depois em São Paulo.  Com o fim do Estado Novo e a\npromulgação da nova Constituição (16/9/1946), elegeu-se suplente de\nsenador por Alagoas na legenda do Partido Social Democrático (PSD) no\npleito suple­mentar de janeiro de 1947, como companhei­ro de chapa do\nsenador eleito, o general Pedro Aurélio de Góis Monteiro.\n\nNos últimos meses do governo do general Eurico Dutra, em fins de 1950,\nreeditou o se­manário *O ABC,* juntamente com os jornalis­tas Murilo\nMarroquim, Joel Silveira e Rafael Correia de Oliveira.  Nas eleições de\noutubro do mesmo ano, embora tivesse sido convoca­do por Getúlio Vargas,\ncandidato à presidên­cia da República, para reorganizar o Partido\nTrabalhista Brasileiro (PTB) em Alagoas, can­didatou-se a deputado\nfederal por seu estado na legenda do Partido Social Democrático (PSD),\nficando com a segunda suplência.  Logo após a posse de Vargas na\npresidência (31/1/1951), foi promovido em sua carreira funcio­nal e\nremovido para o Rio de Janeiro, onde foi nomeado presidente da Fundação\nRádio Mauá.\n\nAssumindo uma cadeira na Câmara Fede­ral em julho de 1954, em outubro do\nmesmo ano tornou a candidatar-se a deputado, dessa vez na legenda da\nUnião Democrática Nacio­nal (UDN).  Obteve novamente a suplência e\ndeixou a Câmara em janeiro de 1955 para não voltar na legislatura\nseguinte (1955-1959).  Mais uma vez candidato no pleito de outubro de\n1958, na legenda da Coligação Nacionalista Democrática - composta pelo\nPartido Demo­crata Cristão (PDC), o Partido Social Progres­sista (PSP),\no Partido Social Trabalhista (PST) e o Partido Socialista Brasileiro\n(PSB), ficou novamente na suplência, não tendo retornado à Câmara\nFederal\n\n \n\nFONTES:  CÂM. DEP. *Deputados;*MORAIS, T.*  Resumo;*TRIB. SUP. ELEIT.\n*Dados*(2, 3 e 4).\n\n \n","ref":"FONTES:  CÂM. DEP. *Deputados;*MORAIS, T.*  Resumo;*TRIB. SUP. ELEIT.\n*Dados*(2, 3 e 4).\n\n \n","dic":"DHBB"}
