{"title":"FANSTONE, Henrique","cargoss":["Deputado federal"],"cargos_esp":[0],"datas_ini":[1971],"datas_fim":[1979],"estados":["GO"],"autor":[0],"content":"**FANSTONE, Henrique**\n\n\\*dep. fed. GO 1971-1979.\n\n*Henrique Maurício Fanstone*nasceu em Anápolis (GO) no dia 16 de janeiro\nde 1926, filho de James Fanstone e de Ethel Marguerite Fanstone.\n\nFormado pela Faculdade de Medicina de Minas Gerais em 1951, de volta a\nGoiás elegeu-se vereador à Câmara Municipal de Anápolis em 1954 e, em\n1960, vice-prefeito da cidade. Em 1965, durante a interventoria de\nEmílio Rodrigues Ribas Júnior em Goiás, ocupou a Secretaria do Trabalho\ndo estado. Integrou ainda o Conselho Estadual de Educação. Filiado à\nAliança Renovadora Nacional (Arena), partido de sustentação ao regime\nmilitar instalado no país em abril de 1964, presidiu o diretório do\npartido em sua cidade.\n\nNo pleito de novembro de 1970, elegeu-se deputado federal por Goiás na\nlegenda da Arena, assumindo o mandato em fevereiro do ano seguinte.\nAinda em 1971, foi escolhido vice-presidente da Comissão de Fiscalização\nFinanceira e Tomada de Contas da Câmara, além de figurar como suplente\ndas comissões de Saúde e de Desenvolvimento da Região Centro-Oeste. Em\nnovembro de 1974 elegeu-se primeiro suplente de deputado federal por\nGoiás e, deixando a câmara em janeiro de 1975, voltou a ocupar uma\ncadeira em outubro. No governo de Irapuã Costa Júnior (1975-1979),\nocupou as secretarias de Administração (fevereiro a junho de 1976) e de\nSaúde (junho de 1976 a maio de 1978) de Goiás.\n\nPreferiu não disputar a reeleição em 1978 e em janeiro do ano seguinte\nencerrou seu mandato. Com a extinção do bipartidarismo em 29 de novembro\nde 1979 e a conseqüente reformulação partidária, filiou-se ao Partido\nDemocrático Social (PDS), e nessa legenda concorreu a uma cadeira na\nCâmara dos Deputados pelo estado de Goiás, no pleito de novembro de\n1982, obtendo apenas uma suplência.\n\nEmbora não tenha disputado mais nenhum cargo eletivo, permaneceu filiado\nao PDS. No plano profissional, dedicou-se à direção executiva do\nHospital Evangélico Goiano.\n\nEm 1993, com a fusão do PDS ao Partido Democrático Cristão (PDC) criando\no Partido Progressista Reformador (PPR), filiou-se à nova agremiação.\nDois anos depois, novamente em virtude de uma nova fusão, desta vez do\nPPR com o Partido Progressista (PP), passou a militar na nova agremiação\nentão criada, o Partido Progressista Brasileiro (PPB), vindo a tornar-se\no primeiro presidente do partido na sua cidade natal. Renunciou à\npresidência do PPB municipal em 1998, discordando da decisão do partido\nem apoiar o candidato do Partido da Social Democracia Brasileira (PSDB),\nMarconi Perillo, ao governo do estado, e não a Íris Resende, do Partido\ndo Movimento Democrático Brasileiro (PMDB).\n\nFanstone tornou-se diretor do Hospital Evangélico Goiano e seu acionista\nmajoritário.\n\nEm agosto de 2009 foi homenageado pela Assembléia Legislativa goiana,\njuntamente com mais 29 maçons, com a medalha do Mérito Legislativo Pedro\nLudovico Teixeira\n\nEra casado com Dorothy Downing Fanstone, com teve quatro filhos. Viúvo,\ncontraiu segundas núpcias com Miraci Moreira, com quem teve dois filhos.\nDo seu terceiro casamento com Jacifa Issac Fanstone teve uma filha.\nNovamente viúvo, casou-se com Irene Cardoso Fanstone.\n\nFONTES: CÂM. DEP*. Deputados;*CÂM. DEP. *Deputados brasileiros.\nRepertório* (1971-1975); INF. BIOG.;*Jornal do Brasil (*5/6/76 e\n15/11/78); NÉRI, S. *16; Perfil*(1972).\n\n \n\n \n","ref":"FONTES: CÂM. DEP*. Deputados;*CÂM. DEP. *Deputados brasileiros.\nRepertório* (1971-1975); INF. BIOG.;*Jornal do Brasil (*5/6/76 e\n15/11/78); NÉRI, S. *16; Perfil*(1972).\n\n \n\n \n","dic":"DHBB"}
