{"title":"FARABULINI JÚNIOR","cargoss":["Deputado federal","Constituinte"],"cargos_esp":[0,0],"datas_ini":[1983,1987],"datas_fim":[1991,1988],"estados":["SP",0],"autor":[0],"content":"FARABULINI JÚNIOR\n\n\\*dep. fed. SP 1983-1991; const. 1987-1988.\n\nAnselmo Farabulini Júnior nasceu em São Paulo no dia 10 de outubro de\n1921, filho de Anselmo Farabulini e de Maria Farabulini.\n\nEm 1945 formou-se em química pela Escola Americana de Química Aplicada\nMackenzie e, três anos depois, concluiu o curso de contabilidade na\nEscola Técnica de Comércio 30 de Outubro. Em 1949 ingressou na Faculdade\nde Direito da Universidade de São Paulo, curso que concluiu em 1954.\n\nExerceu mandato de vereador em São Paulo na legenda do Partido\nRepublicano (PR), entre 1952 e 1954, e de deputado estadual por três\nlegislaturas (de 1954 a 1964) no Partido Trabalhista Nacional (PTN) e no\nMovimento Trabalhista Renovador (MTR). Com a vitória do movimento\npolítico-militar de 31 de março de 1964 que depôs o presidente João\nGoulart (1961-1964), teve seu mandato cassado em junho seguinte, com\nbase no Ato Institucional nº 1 (AI-1). Afastado da política, foi\nfundador e diretor da Faculdade de Filosofia 9 de Julho e da Faculdade\nNova Piratininga, entre 1972 e 1974.\n\nCom a extinção do bipartidarismo em 1979, filiou-se ao Partido\nTrabalhista Brasileiro (PTB), em cuja legenda elegeu-se deputado federal\npor São Paulo em novembro de 1982. Empossado em fevereiro do ano\nseguinte, integrou como titular a Comissão de Segurança Nacional da\nCâmara dos Deputados e, como suplente, a Comissão de Relações\nExteriores.\n\nEm 25 de abril de 1984 votou a favor da emenda Dante de Oliveira, que,\napresentada na Câmara dos Deputados, propôs o restabelecimento das\neleições diretas para presidente da República em novembro daquele ano.\nComo a emenda não obteve o número de votos indispensáveis à sua\naprovação – faltaram 22 para que o projeto pudesse ser encaminhado à\napreciação pelo Senado Federal – no Colégio Eleitoral, reunido em 15 de\njaneiro de 1985, Farabulini Júnior votou no candidato oposicionista,\nTancredo Neves, eleito novo presidente da República pela Aliança\nDemocrática, uma união do Partido do Movimento Democrático Brasileiro\n(PMDB) com a dissidência do Partido Democrático Social (PDS) abrigada na\nFrente Liberal. Contudo, por motivo de doença, Tancredo Neves não chegou\na ser empossado na presidência, vindo a falecer em 21 de abril de 1985.\nSeu substituto no cargo foi o vice José Sarney, que já vinha exercendo\ninterinamente o cargo desde 15 de março.\n\nAinda em 1985, Farabulini Júnior integrou a Comissão de Serviço Público.\nElegeu-se deputado federal constituinte em novembro de 1986, na legenda\ndo PTB. Assumiu o mandato em fevereiro do ano seguinte, quando se\niniciaram os trabalhos da Assembléia Nacional Constituinte, integrando,\ncomo membro titular, a Subcomissão do Poder Legislativo, da Comissão da\nOrganização dos Poderes e Sistema de Governo, além de suplente na\nSubcomissão dos Direitos e Garantias Individuais, da Comissão da\nSoberania e dos Direitos e Garantias do Homem e da Mulher.\n\nEm abril de 1987, da tribuna da Câmara, acusou o presidente José Sarney\nde incompetente, por não demitir o seu ministério, que, a seu ver, se\nrevelava incapaz e já provocava desilusão na população.\n\nNas votações mais importantes da Constituinte, pronunciou-se contra o\nrompimento de relações diplomáticas com países com política de\ndiscriminação racial, a limitação do direito de propriedade privada, o\nmandado de segurança coletivo, a legalização do aborto, a estatização do\nsistema financeiro e o mandato de cinco anos para o presidente José\nSarney. Votou a favor da pena de morte, da unicidade sindical, do\npresidencialismo, da criação de um fundo de apoio à reforma agrária e da\nlegalização do jogo do bicho. Também colocou-se a favor de várias\nemendas de cunho trabalhista, como a estabilidade no emprego, a\nremuneração 50% superior para o trabalho extra e a jornada semanal de 40\nhoras. Nacionalista, defendia a elaboração de um programa de\nprivatização que reduzisse ao mínimo a presença do Estado na economia,\nbem como a do capital estrangeiro nas atividades econômicas do país.\nApós a promulgação da nova Constituição, em 5 de outubro de 1988, voltou\na participar dos trabalhos legislativos ordinários na Câmara dos\nDeputados.\n\nCandidatou-se à reeleição em outubro de 1990, não foi bem-sucedido.\nDeixou a Câmara dos Deputados em janeiro do ano seguinte, ao final da\nlegislatura.\n\nAmigo e correligionário de Jânio Quadros, em março de 1992, com mais 40\njanistas históricos, filiou-se ao PMDB, seguindo uma orientação dada\npelo ex-presidente pouco tempo antes de falecer. Em 1994 deixou o PMDB e\ningressou no novo PTN, criado alguns anos após o fim do bipartidarismo.\nAfastando-se da vida pública, voltando a exercer suas atividades de\nadvogado.\n\nCasou-se com Conceição Casciano Farabulini, com quem teve um filho.\n\nFONTES: ASSEMB. NAC. CONST. *Repertório* (1987-1988); COELHO, J. &\nOLIVEIRA, A. *Nova*;*Estado de S. Paulo*(16/4/87); *Globo* (12/3/92);\nINF. BIOG.\n\n \n","ref":"FONTES: ASSEMB. NAC. CONST. *Repertório* (1987-1988); COELHO, J. &\nOLIVEIRA, A. *Nova*;*Estado de S. Paulo*(16/4/87); *Globo* (12/3/92);\nINF. BIOG.\n\n \n","dic":"DHBB"}
