{"title":"FARHAT, Chafic","cargoss":["Deputado federal"],"cargos_esp":[0],"datas_ini":[1993],"datas_fim":[1994],"estados":["SP"],"autor":[0],"content":"FARHAT, Chafic\n\n\\*dep. fed. SP 1993-1994.\n\nChafic Wady Farhat nasceu na cidade de São Paulo no dia 30 de novembro\nde 1941, filho de Wady Neme Farhat e de Nagibe Salim Ribal.\n\nEntre 1963 e 1965, cursou a Faculdade de Medicina de Sorocaba (SP) e a\nFaculdade de Medicina da Pontifícia Universidade Católica de São Paulo,\ntendo exercido nesta última a presidência do centro acadêmico Vital\nBrasil. Em 1966, começou a clinicar no Instituto Nacional de Assistência\nMédica da Previdência Social (INAMPS), onde trabalharia até se\naposentar, em 1992. Naquele mesmo ano, tornou-se professor de cirurgia\ntorácica, na escola em que se formara, e presidente da Associação dos\nProfessores Assistentes, de 1966 a 1968. Em 1970, abandonou a carreira\nacadêmica para dedicar-se à administração de estabelecimentos de saúde.\nPresidente do Instituto de Moléstias Pulmonares Pronto-Ar e diretor do\nHospital Santa Cruz, ambos sediados em São Paulo, em 1981 tornou-se\nlíder sindical.\n\nEm 1986, filiou-se ao Partido da Frente Liberal (PFL) e, pouco depois,\nassumiu a presidência do Sindicato dos Hospitais de São Paulo, cargo\npara o qual foi reeleito sucessivamente, em 1989 e 1992. Em novembro de\n1986 concorreu a deputado federal constituinte, obtendo uma suplência.\n\nRepresentando o Sindicato dos Médicos do Estado de São Paulo e a\nFederação Nacional dos Estabelecimentos de Saúde, participou dos\ncongressos da Federação Internacional de Hospitais realizados na Haia,\nHolanda, em 1988, e em Washington, Estados Unidos, em 1990.\n\nTransferindo-se para o Partido Democrático Social (PDS), em 1990,\ncandidatou-se novamente à Câmara dos Deputados, em outubro, sendo mais\numa vez arrolado entre os suplentes. Em 1993, ingressou no Partido\nProgressista Reformador (PPR), resultante da fusão do PDS com o PDC.\n\nExerceu interinamente o mandato em dois períodos distintos, de 5 de\njaneiro a 24 de setembro de 1993 e de 7 de outubro de 1993 a 7 de abril\nde 1994, sempre no lugar de Arnaldo Faria de Sá, secretário de Esporte,\nLazer e Recreação, na prefeitura de Paulo Maluf (1993-1997). Como\nparlamentar, foi titular da Comissão de Seguridade Social e Família, e\nsuplente da Comissão de Trabalho, Administração e Serviço Público.\n\nAinda em 1993, passou ao Partido Progressista Reformador, resultado da\nfusão do PDS com o PDC. Representando esta legenda, integrou a Comissão\nParlamentar de Inquérito (CPI) sobre as concessões de benefícios\nprevidenciários e a CPI mista sobre a situação do setor farmacêutico.\n\nConcorreu à reeleição em outubro de 1994, sem sucesso. Filiando-se ao\nPartido Progressista Brasileiro (PPB), resultado da fusão do PPR com o\nPartido Progressista (PP), em agosto de 1995, tentou retornar à Câmara\nno pleito de outubro de 1998, também sem êxito.\n\nFoi membro da Academia Brasileira de Administração Hospitalar, do\nConselho Nacional de Saúde e do Conselho de Saúde de São Paulo.\n\nCasado com Stela Maris Carneiro Farhat, teve três filhos.\n\nFONTES: ASSEMB. NAC. CONST. *Repertório*(1987-1988); CÂM. DEP.\n*Deputados brasileiros. Repertórios*(1991-1995, Suplemento; 1991-1995;\n1995-1999).\n\n \n","ref":"FONTES: ASSEMB. NAC. CONST. *Repertório*(1987-1988); CÂM. DEP.\n*Deputados brasileiros. Repertórios*(1991-1995, Suplemento; 1991-1995;\n1995-1999).\n\n \n","dic":"DHBB"}
