{"title":"FARIA, Anapolino de","cargoss":["Deputado federal"],"cargos_esp":[0],"datas_ini":[1967],"datas_fim":[1975],"estados":["GO"],"autor":[0],"content":"**FARIA, Anapolino de**\n\n\\*dep. fed. GO 1967-1975.\n\n* *\n\n*Anapolino Silvério de Faria n*asceu em Anápolis (GO), no dia 14 de\noutubro de 1921, filho de Francisco Silvério de Faria e de Benedita\nFontes de Faria. Seu irmão, Iron Silvério de Faria, foi várias vezes\nprefeito do município.\n\nDiplomado em 1947 pela Faculdade Nacional de Medicina na Universidade do\nBrasil, no Rio de Janeiro, retornou a Anápolis, onde fundou a Clínica\nDom Bosco, em 1950.\n\nIniciou a vida política em outubro de 1954, elegendo-se vereador. Foi o\nmais votado do estado na legenda do Partido Social Democrático (PSD).\nDurante o mandato presidiu a Câmara Municipal**,**durante três anos.\n\nEm outubro de 1962, elegeu-se deputado à Assembléia Legislativa de Goiás\nna legenda do PSD. Foi vice-líder do governo e vice-presidente da\nAssembléia até o final da legislatura. Em conseqüência da extinção dos\npartidos políticos pelo Ato Institucional nº 2 (27/10/1965) e da\nposterior instauração do bipartidarismo, filiou-se ao Movimento\nDemocrático Brasileiro (MDB), partido de oposição ao regime militar\ninstaurado no país em abril de 1964. Elegeu-se deputado federal por\nGoiás no pleito de novembro de 1966. Foi o fundador e o primeiro\npresidente do diretório regional do partido.\n\nDeixou a Assembléia Legislativa em janeiro de 1967 para assumir o\nmandato na Câmara dos Deputados no mês seguinte. Foi membro e,\nposteriormente, presidente da Comissão de Saúde, em 1970. Reeleito,\nintegrou a Comissão de Relações Exteriores da Câmara. Não se candidatou\nà reeleição em novembro de 1974**,**devido a problemas de saúde. Nesse\nperíodo presidiu novamente o diretório regional do MDB de Goiás.\n\nNo pleito de novembro de 1978, disputou novamente uma vaga na Câmara dos\nDeputados, na legenda do MDB, mas não conseguiu reeleger-se. Com o fim\ndo bipartidarismo e a conseqüente reorganização partidária, filiou-se ao\nPartido do Movimento Democrático Brasileiro (PMDB), em novembro de 1979.\n\nEm 29 de dezembro de 1983****Anapolino de Faria foi indicado para ocupar\no cargo de prefeito de Anápolis. O município era considerado área de\nsegurança nacional pela legislação eleitoral do regime militar e, por\nisso, o Executivo local não era escolhido por eleição direta. Durante\nseu mandato lutou para que a cidade pudesse eleger seus representantes\npor meio do voto direto.****Permaneceu no cargo até dezembro de 1985.\n\nEm novembro de 1986 concorreu a uma vaga na Assembléia Legislativa de\nGoiás, tendo sido eleito com a maior votação do estado. No pleito de\nnovembro de 1988 disputou a prefeitura de Anápolis. Eleito, renunciou ao\nmandato legislativo e em janeiro de 1989 tomou posse. Deixou a\nprefeitura em dezembro de 1992. Nesse mesmo ano, ocupou a direção do\nPMDB municipal e tornou-se diretor administrativo da Clínica Dom Bosco.\nDesde então não disputou mais eleições, mas continuou fazendo parte do\ndiretório municipal do partido.\n\nFaleceu em Goiânia, no dia 16 de dezembro de 2008.\n\nEra casado com Dulce Pereira de Faria, com quem teve cinco filhos.\n\nAnapolino de Faria fundou a Associação Médica de Anápolis e foi objeto\nde livro escrito por Vanderic Filho, intitulado***Memórias – Anapolino\nde Faria.*\n\n*** ***\n\nFONTES: ASSEMB. LEGISL. GO. *Legislativo;*CÂM. DEP. *Deputados;*CÂM.\nDEP. *Deputados brasileiros. Repertórios*(1971-1975, 1975-1979);\nFOLHETO; INF. FAM..\n\n \n","ref":"FONTES: ASSEMB. LEGISL. GO. *Legislativo;*CÂM. DEP. *Deputados;*CÂM.\nDEP. *Deputados brasileiros. Repertórios*(1971-1975, 1975-1979);\nFOLHETO; INF. FAM..\n\n \n","dic":"DHBB"}
