{"title":"FARIA, Gustavo de","cargoss":["Deputado federal","Constituinte"],"cargos_esp":[0,0],"datas_ini":[1983,1987],"datas_fim":[1990,1988],"estados":["RJ",0],"autor":["Lorenzo Aldé"],"content":"FARIA, Gustavo de\n\n\\*militar; dep. fed. RJ 1983-1990; const. 1987-1988.\n\nPaulo Gustavo Coutinho de Faria nasceu no Rio de Janeiro, então Distrito\nFederal, no dia 15 de fevereiro de 1937, filho de Gustavo de Faria e de\nIsabel Maria Dale de Faria. O pai foi general e o tio materno, general\nVicente de Paulo Dale Coutinho, ministro do Exército no governo Ernesto\nGeisel (1974-1979).\n\nGustavo de Faria foi aluno da High School Joan Darc, em Nova Iorque, e\ndo Colégio Militar do Rio de Janeiro. Fez curso de formação de oficiais\ndo Exército na Academia Militar das Agulhas Negras (AMAN), em Resende\n(RJ), e de especialização na Escola de Educação Física do Exército.\nPromovido a segundo-tenente em agosto de 1958, a primeiro-tenente em\nagosto de 1961 e a capitão em dezembro de 1965.\n\nAliado político do general Afonso Augusto de Albuquerque Lima — ministro\ndo Interior no governo de Artur da Costa e Silva (1967-1969), que se\ndemitiu do cargo em janeiro de 1969 por desavenças com a equipe\neconômica —, Faria foi compulsoriamente transferido para a reserva em\njulho do mesmo ano. A punição decorreu do Ato Institucional nº 10\n(AI-10), que atingiu cerca de quinhentas pessoas, entre políticos,\nprofessores, jornalistas, diplomatas, médicos, advogados e militares,\ncom a cassação de mandatos e suspensão de direitos políticos,\naposentadorias compulsórias e afastamento das forças armadas.\n\nNa vida civil, fundou a Editora Guavira, tornando-se seu\ndiretor-presidente. Mais tarde, bacharelou-se em ciências jurídicas e\nsociais pela Faculdade de Direito da Universidade do Rio de Janeiro\n(UFRJ).\n\nEm agosto de 1979, beneficiado pela Lei da Anistia, Gustavo de Faria foi\npromovido ao posto de coronel, sem retornar à ativa.\n\nVinculado ao chaguismo, corrente política liderada pelo então governador\ndo estado do Rio de Janeiro, Antônio de Pádua Chagas Freitas\n(1979-1983), no pleito de novembro de 1982 candidatou-se a uma cadeira\nna Câmara dos Deputados pelo Rio de Janeiro pela legenda do Partido do\nMovimento Democrático Brasileiro (PMDB). Eleito, iniciou o mandato em\nfevereiro do ano seguinte, participando dos trabalhos legislativos como\ntitular da Comissão de Economia, Indústria e Comércio e suplente da\nComissão de Relações Exteriores da Câmara.\n\nEm 25 de abril de 1984, votou a favor da emenda Dante de Oliveira, que\nprevia a realização de eleições diretas para a presidência da República\nem novembro daquele ano, mas que não passou — faltaram 22 votos para que\nfosse levada à apreciação do Senado.\n\nEm agosto, contrário ao projeto da Lei de Informática apresentado ao\nCongresso pelo governo e sujeito à aprovação por decurso de prazo,\nafirmou que a proposta, em vez de estabelecer reserva de mercado\nfavorável à indústria nacional, pretendia eternizar o poder do Serviço\nNacional de Informações (SNI), órgão criado pelo regime militar. O texto\nprevia a criação de uma comissão nacional de informática, deixando todas\nas decisões a cargo da Secretaria Especial de Informática (SEI),\ncontrolada por militares egressos dos serviços de informações e\nsubordinada ao Conselho de Segurança Nacional. Foi afinal aprovado em\noutubro de 1984 graças a um acordo de lideranças que assegurou a\nincorporação de duas emendas do Partido dos Trabalhadores (PT),\nrelativas à privacidade do cidadão e à garantia de emprego pela adoção\nde novas tecnologias de automação.\n\nNo Colégio Eleitoral, reunido em 15 de janeiro de 1985, Gustavo de Faria\nvotou no candidato oposicionista Tancredo Neves, eleito pela Aliança\nDemocrática, uma união do PMDB com a dissidência do Partido Democrático\nSocial (PDS) abrigada na Frente Liberal. Doente, Tancredo Neves não\nchegou a ser empossado, vindo a falecer em 21 de abril de 1985. Seu\nsubstituto foi o vice José Sarney, que já vinha exercendo o cargo\ninterinamente, desde 15 de março deste ano.\n\nNo pleito de novembro de 1986, aliado à corrente do PMDB liderada pelo\nsenador Nélson Carneiro, foi eleito deputado federal constituinte pelo\nRio de Janeiro. Empossado em fevereiro do ano seguinte, em maio de 1987\nassumiu a presidência do Instituto de Previdência dos Congressistas\n(IPC). Titular na Subcomissão de Princípios Gerais, Intervenção do\nEstado, Regime da Propriedade do Subsolo e da Atividade Econômica, da\nComissão da Ordem Econômica, e suplente na Subcomissão do Poder\nJudiciário e do Ministério Público, da Comissão da Organização dos\nPoderes e Sistema de Governo, votou a favor do rompimento de relações\ndiplomáticas com países que praticassem políticas de discriminação\nracial, da pena de morte, da manutenção do sistema presidencialista, da\nadoção do voto facultativo aos 16 anos, do aviso prévio proporcional, da\nunicidade sindical, da nacionalização do subsolo, da anistia aos micro e\npequenos empresários, da legalização do jogo do bicho e do mandato de\ncinco anos para o então presidente Sarney. Foi contra a limitação do\ndireito de propriedade, a descriminilização do aborto, a proibição do\ncomércio de sangue, a remuneração 50% superior para o trabalho extra, a\njornada semanal de 40 horas, a manutenção da estabilidade de emprego, a\nlimitação dos encargos da dívida externa e a criação de um fundo de\napoio à reforma agrária.\n\nEm março de 1989 foi substituído pelo deputado Rui Bacelar na\npresidência do IPC. Um mês depois a imprensa acusou-o de ter adquirido\nsem autorização do conselho deliberativo da entidade, em dezembro de\n1988, debêntures da empresa Rural e Colonização S.A. no valor aproximado\nde dez milhões de dólares. Auditoria instaurada pelo próprio IPC indicou\noutras operações suspeitas. Em agosto de 1988 o deputado vendera títulos\nda dívida agrária (TDAs), para comprar obrigações da Eletrobrás por um\npreço 475% acima da cotação de mercado. Posteriormente, e apenas uma\nsemana antes de deixar o cargo, voltara a comprar as TDAs com ágio\nsuperior a 40%. Chamado a depor, Faria argumentou que sua gestão fora\nlucrativa, mas mesmo assim o relatório final da auditoria o considerou\nculpado de fraude e o caso passou à alçada da Polícia Federal.\n\nEm 28 de junho de 1989 Gustavo de Faria desligou-se do PMDB, cuja\nExecutiva Nacional já decidira por sua expulsão. No dia 3 de abril de\n1990, a Comissão de Constituição e Justiça (CCJ) da Câmara aprovou por\nunanimidade a cassação do seu mandato. A questão, contudo, não chegou a\nser votada em plenário, pois o deputado renunciou ao mandato, sob a\nalegação de que não tivera a oportunidade de se defender, nem de ter as\ncontas do IPC periciadas por auditores isentos. Substituído pelo\nsuplente Ernâni Boldrim, também do PMDB, publicou um livro intitulado\n*Eu acuso — ou a farsa do IPC*, no qual contestava todas as acusações,\nalém de apresentar resultados de auditorias que o inocentavam.\n\nEm agosto de 1990 o Tribunal Regional Eleitoral (TRE) do Rio de Janeiro\naceitou o registro de sua candidatura a deputado federal no pleito de\noutubro, na legenda do Partido Trabalhista Brasileiro (PTB).\nMalsucedido, obteve uma suplência.\n\nAfastado da carreira política continuou a trabalhar em sua editora. No\nintuito de provar inocência contratou advogado e moveu processos contra\nos que o haviam acusado, defendendo-se dos que foram movidos contra ele.\nContudo, em março de 1993 foi condenado a devolver 3,2 bilhões de\ncruzeiros aos cofres do IPC. Em agosto por decisão unânime do Superior\nTribunal Federal (STF) tornou-se réu de ação penal na qual era acusado\nde desvio de verbas e de crime de apropriação indébita. A denúncia foi\nformulada pelo procurador-geral da República Aristides Junqueira.\n\nAlém do livro citado, Gustavo de Faria publicou, entre outros, *Filiação\npartidária*, *Soletre Mobral e leia Brasil,* *Amazônia é novo Brasil,*\n*Alagoas — o grande avanço*, *Maceió — modelo urbanístico do Nordeste*,\n*Mato Grosso — do garimpo ao computador*.\n\nGustavo de Faria foi casado com Djane Bouças de Faria, com quem teve\ntrês filhos. O tio de sua ex-esposa, Valentim Bouças, foi um dos maiores\nempresários brasileiros nas décadas de 1930, 1940 e 1950, fundador da\nrevista *O Observador Econômico e Financeiro*, representante da IBM no\nBrasil, diretor-consultivo da Coca-Cola e presidente da Panair, entre\noutras ocupações.\n\nLorenzo Aldé\n\nFONTES: *Almanaque* *Exérc.* (1969); ASSEMB. NAC. CONST. *Repertório*\n(1987-1988); CÂM. DEP. *Deputados brasileiros*. *Repertório*(1983-1987);\nCoelho, J. & Oliveira, A. *Nova*; ENTREV. BIOG.; *Estado de S.\nPaulo*(31/8 e 4/10/84, 5/4/90 e 5/9/91); *Folha de S. Paulo*(19/1/87, 28\ne 30/4, 5 e 12/5 e 11/7/89); *Globo*(26/4 e 31/8/84, 16/1/85, 10/4/87,\n10/5, 9/6 e 29/6/89, 4/4 e 16/8/90 e 20/8/93); *Jornal do\nBrasil*(26/2/88, 4/4 e 9/8/90 e 30/3/93); *Veja*(12/9/84).\n\n \n","ref":"FONTES: *Almanaque* *Exérc.* (1969); ASSEMB. NAC. CONST. *Repertório*\n(1987-1988); CÂM. DEP. *Deputados brasileiros*. *Repertório*(1983-1987);\nCoelho, J. & Oliveira, A. *Nova*; ENTREV. BIOG.; *Estado de S.\nPaulo*(31/8 e 4/10/84, 5/4/90 e 5/9/91); *Folha de S. Paulo*(19/1/87, 28\ne 30/4, 5 e 12/5 e 11/7/89); *Globo*(26/4 e 31/8/84, 16/1/85, 10/4/87,\n10/5, 9/6 e 29/6/89, 4/4 e 16/8/90 e 20/8/93); *Jornal do\nBrasil*(26/2/88, 4/4 e 9/8/90 e 30/3/93); *Veja*(12/9/84).\n\n \n","dic":"DHBB"}
