{"title":"FARIA, Rocha","cargoss":["Constituinte","Presidente de associação ou confederação de empregados ou empregadores"],"cargos_esp":[0,"FIRJ"],"datas_ini":[1934,1935],"datas_fim":[1934,1936],"estados":[0,0],"autor":[0],"content":"**FARIA, Rocha**\n\n\\*const. 1934; pres. FIRJ 1935-1936.\n\n \n\n*Carlos Teles de Rocha Faria* nasceu no Rio de Janeiro, então capital do\nImpério, no dia 13 de outubro de 1883, filho do professor Benjamim da\nRocha Faria, catedrático da Faculdade de Medicina, e de Joaquina da\nRocha Faria.\n\nEm 1907, diplomou-se pela Faculdade de Medicina do Rio de Janeiro, tendo\nlogo começado a clinicar junto com seu pai. Na faculdade onde estudou,\nfoi assistente do professor Miguel Pereira, que assumiu a cátedra de\nclínica médica em 1910. Após seu casamento, e em virtude do parentesco\nde sua esposa com o industrial Alfredo Rocha, abandonou a clínica para\ndedicar-se às atividades industriais. Em 1923, foi nomeado diretor da\nCompanhia de Tecidos América Fabril.\n\nEm agosto de 1929, Rocha Faria e Vicente Galliez, representando o Centro\ndos Industriais de Fiação e Tecelagem de Algodão (CIFTA), Francisco de\nOliveira Passos, pelo Centro Industrial do Brasil (CIB), e a diretoria\nda Associação Comercial do Rio de Janeiro entregaram ao então presidente\nWashington Luís uma mensagem de solidariedade das classes conservadoras.\nAntes da Revolução de 1930, a participação dos industriais na vida\npolítica do país se fazia através das entidades de classe ou de\nmanifestações individuais. Depois da revolução, os industriais\npreocuparam-se em ter uma participação de maior peso, buscando influir\nmais diretamente sobre o governo. Em fins de 1931, as lideranças\nempresariais que desejavam uma atuação mais decisiva lançaram a idéia da\nformação de um partido político que congregasse toda a classe.\n\nA questão foi amplamente debatida por Serafim Valandro e João Daudt\nd’Oliveira, que assumiram a chefia do movimento. Deste participaram\nativamente várias entidades, como o Centro dos Industriais de Fiação e\nTecelagem de São Paulo, o CIFTA e a Federação Industrial do Rio de\nJaneiro (FIRJ), fundada em 1931 para suceder ao Centro Industrial do\nBrasil. Francisco de Oliveira Passos, seu primeiro presidente, foi quem\nteve a atuação individual mais destacada nesse período. Rocha Faria,\nentão presidente do CIFTA e primeiro vice-presidente da FIRJ, justificou\npor essa época a formação do futuro Partido Economista, que seria\nfundado em 1932. Em sua opinião, participar da direção dos negócios do\npaís era um direito da classe empresarial, já que, por suas atividades\nagrária, manufatureira e comercial, era ela quem fornecia os recursos\npara a administração pública. Ainda segundo Rocha Faria, a falta de\nparticipação direta dos empresários na política, durante a República\nVelha, decorrera do caráter vicioso do processo eleitoral de então.\nDepois da Revolução de 1930, a nova lei eleitoral e a alteração das\ncircunstâncias no país possibilitavam a arregimentação política da\nclasse.\n\nEm 1933, Rocha Faria assumiu também a função de segundo vice-presidente\nda Confederação Industrial do Brasil, cuja sigla — CIB — não deve ser\nconfundida com a do extinto Centro Industrial do Brasil. Nessa\nqualidade, ao lado de Vicente Galliez, secretário-geral da CIB e seu\ncompanheiro no CIFTA, foi nomeado representante dos industriais na\nComissão Revisora da Lei de Férias. A Lei de Férias fora promulgada em\n1925, em benefício dos empregados do comércio, e estabelecia um descanso\nde 15 dias por ano. A extensão dessa lei ao operariado, por ocasião de\nsua regulamentação, causou grande polêmica. Na oportunidade, a CIB levou\nao conhecimento do poder público a situação da indústria nacional,\ndefinindo-a como “aflitiva”. Alarmados, os empresários se queixavam do\naumento de despesas e da desorganização dos serviços, fatos decorrentes,\na seu ver, da “injustificada”**extensão das férias à classe operária.\n\nEm maio de 1933, Rocha Faria obteve 267 votos dos empregadores e\ntornou-se deputado classista à Assembléia Nacional Constituinte.\nParticipou dos trabalhos de elaboração da Constituição de 1934 e ocupou\na cadeira até abril de 1935, quando renunciou ao mandato, voltando-se\ndefinitivamente para as atividades industriais.\n\nEm 30 de abril de 1935, assumiu a presidência da FIRJ, após a renúncia\ndo titular, Oliveira Passos. Em 1935 foi terceiro vice-presidente da CIB\ne no ano seguinte primeiro-tesoureiro da entidade.\n\nRocha Faria também presidiu, durante 20 anos, o Sindicato das Indústrias\nde Fiação e Tecelagem do Rio de Janeiro, do qual se tornaria sócio\nbenemérito. Em sua atividade empresarial, participou ainda das comissões\ndiretoras de vários bancos.\n\nFaleceu no dia 26 de fevereiro de 1959.\n\nSônia Dias\n\n \n\n \n\nFONTES: ASSEMB. NAC. CONST. 1934. *Anais*(1);**CÂM. DEP.\n*Deputados;*CERQUEIRA, E. *Empresário;*CONF. INDUSTRIAL DO\nBRASIL.*Relatório* (1933 e 1934); CONF. NAC. IND.; CONSULT. MAGALHÃES,\nB.; FED. INDUSTRIAL DO RJ. *Relatório;*FED. INDÚSTRIAS DO EST. RJ.\n*Relatório;*GODINHO, V. *Constituintes; Jornal*(27/2/59); LEME, M.\n*Ideologia.*\n\n \n","ref":"FONTES: ASSEMB. NAC. CONST. 1934. *Anais*(1);**CÂM. DEP.\n*Deputados;*CERQUEIRA, E. *Empresário;*CONF. INDUSTRIAL DO\nBRASIL.*Relatório* (1933 e 1934); CONF. NAC. IND.; CONSULT. MAGALHÃES,\nB.; FED. INDUSTRIAL DO RJ. *Relatório;*FED. INDÚSTRIAS DO EST. RJ.\n*Relatório;*GODINHO, V. *Constituintes; Jornal*(27/2/59); LEME, M.\n*Ideologia.*\n\n \n","dic":"DHBB"}
