{"title":"FARIAS, Esperidião","cargoss":["Constituinte","Senador"],"cargos_esp":[0,0],"datas_ini":[1946,1954],"datas_fim":[1946,1954],"estados":[0,"AL"],"autor":[0],"content":"**FARIAS, Esperidião**\n\n\\*const. 1946; sen. AL 1954.\n\n \n\n*Esperidião Lopes de Farias Júnior* nasceu em São Luís do Quitunde (AL)\nno dia 28 de setembro de 1899, filho de Esperidião Lopes de Farias e de\nCândida Lopes Lamenha Lins.\n\nFez seus primeiros estudos no Colégio 15 de Maio, ingressando depois na\nEscola de Agronomia de Socorro (PE), pela qual se diplomou engenheiro\nagrônomo em 1920.\n\nProprietário rural em Alagoas, foi ajudante de inspetor agrícola em\nMinas Gerais e diretor da Fazenda de Sementes de União dos Palmares\n(AL), antes de tornar-se prefeito do município alagoano de Murici.\nDurante a permanência de Ismar de Góis Monteiro no cargo de interventor\nfederal em Alagoas (1941-1945), exerceu o cargo de secretário da Fazenda\ndo estado. Com a redemocratização do país que se seguiu ao final do\nEstado Novo, elegeu-se em dezembro de 1945 deputado por Alagoas à\nAssembléia Nacional Constituinte na legenda do Partido Social\nDemocrático (PSD). Iniciando o mandato em fevereiro de 1946, renunciou\nno mês seguinte a fim de assumir, em abril, a presidência do Instituto\ndo Açúcar e do Álcool (IAA).\n\nNo início de sua gestão à frente do IAA, enfrentou dificuldades\ndecorrentes da identificação que então se fazia entre o dirigismo\neconômico característico da entidade e o regime ditatorial que acabara\nde ser abolido. Embora tenham surgido em sua administração boatos de que\no IAA seria extinto, conseguiu manter o equilíbrio entre produção e\nconsumo por meio da política intervencionista do instituto. Ao mesmo\ntempo, introduziu algumas mudanças na administração do IAA, entre elas a\nreestruturação de todos os serviços e do quadro de pessoal, a revisão\ndas promoções, a introdução de contabilidade pública e a criação de uma\ncomissão permanente de inspeção nos órgãos regionais da autarquia.\n\nEm janeiro de 1947 foi eleito suplente do senador Ismar de Góis\nMonteiro, permanecendo na presidência do IAA até maio do ano seguinte.\nEm abril de 1954, foi convocado a assumir uma cadeira no Senado,\nocupando-a apenas até outubro do mesmo ano.\n\nAbandonando a vida política passou a se dedicar à administração da sua\nfazenda em Murici (AL).\n\nFaleceu em Maceió no dia 28 de setembro de 1987.\n\nEra casado com Carmelita Omena.\n\n \n\nFONTES: CÂM. DEP. *Deputados*; CISNEIROS, A. *Parlamentares*; *Grande\nencic. Delta*; INF. Eraldo Farias; OLIVEIRA, H. *Presidentes*.\n\n \n","ref":"FONTES: CÂM. DEP. *Deputados*; CISNEIROS, A. *Parlamentares*; *Grande\nencic. Delta*; INF. Eraldo Farias; OLIVEIRA, H. *Presidentes*.\n\n \n","dic":"DHBB"}
