{"title":"ALVES, Oscar","cargoss":["Deputado federal"],"cargos_esp":[0],"datas_ini":[1983],"datas_fim":[1987],"estados":["PR"],"autor":[0],"content":"**ALVES, Oscar**\n\n\\*dep. fed. PR 1983-1987.\n\n \n\n*Oscar Alves* nasceu em Birigui (SP) no dia 10 de março de 1938, filho\nde Emílio Alves e de Germina Ceolin Alves.\n\nMédico formado pela Faculdade de Ciências Médicas da Universidade\nCatólica do Paraná em 1965, ao longo do curso, entre 1963 e 1964, foi\noficial de gabinete do secretário dos Negócios da Saúde Pública,\ntornando-se em seguida, de 1964 a 1965, assessor técnico do gabinete do\nvice-governador durante o governo de Ney Braga. Em 1970 fez curso de\nespecialização em ginecologia e obstetrícia, e nos dois anos seguintes\nfoi diretor do Sanatório Noel Nutels, em Londrina (PR).\n\nDoutor na área de tocoginecologia pela Faculdade de Medicina de Ribeirão\nPreto, da Universidade de São Paulo, foi professor adjunto de\nginecologia e obstetrícia e reitor da Universidade Estadual de Londrina,\nentre 1974 e 1978. Em seguida, de 1979 a 1982, ocupou o cargo de\nsecretário da Saúde e do Bem-Estar Social, durante o segundo governo de\nNeyaga. Em 1980, fez curso de administração em saúde a convite do Johns\nHopkins Program for International Education in Gynecology and\nObstetrics, em Baltimore, nos Estados Unidos.\n\nNo pleito de novembro de 1982, elegeu-se deputado federal pelo Paraná na\nlegenda do Partido Democrático Social (PDS). Empossado em fevereiro do\nano seguinte, integrou a Comissão de Saúde Câmara. No dia 25 de abril de\n1984, absteve-se em relação à emenda Dante de Oliveira, que previa o\nrestabelecimento de eleições diretas para presidente da República em\nnovembro daquele ano, argumentando que defendia a eleição direta para\npresidente da República em regime parlamentarista, e não em regime\npresidencialista “imperial”. No Colégio Eleitoral reunido em 15 de\njaneiro de 1985, votou no candidato oposicionista Tancredo Neves, da\nAliança Democrática, união do Partido do Movimento Democrático\nBrasileiro (PMDB) com a dissidência do PDS abrigada na Frente Liberal.\nTancredo foi eleito presidente da República, mas, por motivo de doença,\nnão chegou a ser empossado na presidência, vindo a falecer em 21 de\nabril de 1985. Seu substituto foi o vice José Sarney, que já vinha\nexercendo interinamente o cargo desde 15 de março.\n\nEm janeiro de 1987, com o término da legislatura, deixou a Câmara dos\nDeputados, passando a se dedicar às atividades acadêmicas na\nUniversidade Estadual de Londrina, como professor-doutor de ginecologia\ne obstetrícia, e à clínica médica privada. Após se aposentar dessa\nuniversidade foi escolhido diretor da Faculdade de Ciências Biológicas e\nda Saúde da Universidade Norte do Paraná (Unopar), instituição privada\nde ensino. De dezembro de 1999 a 2001 foi reitor da Unopar. No início de\n2009 foi nomeado presidente da Câmara de Educação Superior do Conselho\nEstadual de Educação do Paraná.\n\nCasou-se com Sílvia Maria Braga Alves, com quem teve três filhos.\n\n \n\nFONTES: CÂM. DEP. *Deputados brasileiros. Repertório*(1983-1987); *Folha\nde Londrina* (10/3/09); INF. BIOG.\n","ref":"FONTES: CÂM. DEP. *Deputados brasileiros. Repertório*(1983-1987); *Folha\nde Londrina* (10/3/09); INF. BIOG.\n","dic":"DHBB"}
