{"title":"FEITOSA, Abigail","cargoss":["Constituinte","Deputado federal"],"cargos_esp":[0,0],"datas_ini":[1987,1987],"datas_fim":[1988,1991],"estados":[0,"BA"],"autor":[0],"content":"**FEITOSA, Abigail**\n\n\\*const. 1987-1988; dep. fed. BA 1987-1991.\n\n \n\n*Maria Abigail Freitas Feitosa* nasceu em Tauá (CE) no dia 17 de abril\nde 1933, filha de Francisco de Aragão Freitas e de Maria Leitão Freitas.\n\nEm 1951 ingressou na Faculdade de Medicina da Universidade Federal da\nBahia (Ufba). Diplomada em 1956 com especialização em ginecologia,\ndesenvolveu, como médica do Hospital Ana Néri, vinculado ao Instituto\nNacional de Assistência Médica da Previdência Social (INAMPS), e da rede\npública estadual, um trabalho assistencial que a projetou entre as\ncomunidades carentes de Salvador. Desenvolveu ainda intensa militância\nem grupos feministas baianos, como o Movimento Brasil Mulher. Entre 1980\ne 1982 foi vice-presidente da Associação Baiana de Medicina.\n\nPartindo de suas bases junto às comunidades carentes e ao movimento\nfeminista, às quais agregou antigas ligações com a corrente prestista do\nPartido Comunista Brasileiro (PCB) e o apoio político do então ministro\nda Saúde Roberto Santos, elegeu-se, em novembro de 1982, deputada\nestadual pelo Partido do Movimento Democrático Brasileiro (PMDB),\niniciando o mandato em fevereiro de 1983. Participou dos trabalhos\nlegislativos como presidente da Comissão de Saúde, titular da Comissão\nde Proteção ao Meio Ambiente e suplente das comissões de Agricultura e\nde Finanças, Orçamento e Desenvolvimento Econômico. Paralelamente ao\nexercício do mandato, tornou-se tesoureira da Fundação João Mangabeira\nem 1984 e integrou, no ano seguinte, o grupo que estruturou a Comissão\nNacional dos Direitos da Mulher. Ainda em 1985 tornou-se\ncoordenadora-geral do Movimento de Unidade Popular, uma ala da esquerda\nnacionalista do PMDB baiano que contava também com os deputados Uldurico\nPinto e Domingos Leonelli, entre outros.\n\nEm novembro de 1986 foi eleita deputada federal constituinte. Deixando a\nAssembléia Legislativa em janeiro do ano seguinte, ao final da\nlegislatura, tomou posse na Câmara em fevereiro, quando se iniciaram os\ntrabalhos da Assembléia Nacional Constituinte (ANC). Em 1988 deixou o\nPMDB e ingressou no Partido Socialista Brasileiro (PSB). Representando\nesta legenda, participou dos trabalhos constituintes como titular da\nComissão de Sistematização e suplente da Subcomissão de Saúde,\nSeguridade e do Meio Ambiente da Comissão da Ordem Social.\n\nNas principais votações, pronunciou-se favoravelmente ao rompimento de\nrelações diplomáticas com países com política de discriminação racial, à\nlimitação do direito de propriedade privada, ao mandado de segurança\ncoletivo, ao acréscimo de 50% na remuneração do trabalho extra, à\njornada semanal de 40 horas de trabalho, ao turno ininterrupto de seis\nhoras, ao aviso prévio proporcional, à unicidade sindical, à soberania\npopular, ao voto aos 16 anos, à nacionalização das riquezas do subsolo,\nà estatização do sistema financeiro, à limitação dos juros reais em 12%\nao ano, à proibição do comércio de sangue, à limitação dos encargos da\ndívida externa, à anistia aos micro e pequenos empresários e à\ndesapropriação da propriedade produtiva. Votou contra o\npresidencialismo, o mandato de cinco anos para o presidente José Sarney,\na pena de morte e a legalização do jogo do bicho. Após a promulgação da\nnova Carta Constitucional (5/10/1988) voltou a participar dos trabalhos\nlegislativos ordinários na Câmara dos Deputados.\n\nAbigail Feitosa aspirava por uma possível candidatura à prefeitura de\nSalvador em 1988, na legenda do PSB. Contudo, a agremiação decidiu\napoiar a candidatura do radialista Fernando José, do PMDB, que acabou\nvencendo as eleições.\n\nRetirou-se da Câmara dos Deputados em janeiro de 1991, ao final da\nlegislatura, depois de disputar a reeleição, sem êxito, em outubro do\nano anterior.\n\nMorreu no dia 14 de agosto de 1991.\n\nEra casada com José de Ribamar Feitosa, com quem teve um filho.\n\n \n\n \n\nFONTES: ASSEMB. NAC. CONST. *Repertório* (1987-1988); COELHO, J. &\nOLIVEIRA, A. *Nova*; *Correio Brasiliense* (20/1/87); *Jornal do Brasil*\n(21/12/87).\n\n \n","ref":"FONTES: ASSEMB. NAC. CONST. *Repertório* (1987-1988); COELHO, J. &\nOLIVEIRA, A. *Nova*; *Correio Brasiliense* (20/1/87); *Jornal do Brasil*\n(21/12/87).\n\n \n","dic":"DHBB"}
