{"title":"FENDER, Paulo","cargoss":["Senador"],"cargos_esp":[0],"datas_ini":[1960],"datas_fim":[1963],"estados":["PA"],"autor":[0],"content":"**FENDER, Paulo**\n\n\\*sen. PA 1960-1963.\n\n \n\n*Paulo Fender* nasceu em Belém no dia 14 de abril de 1912, filho de\nLucílio Fender, médico, poeta e jornalista, e de Maria Nazaré Fender.\n\nDiplomou-se em medicina, especializando-se em cardiologia na Policlínica\nGeral do Rio de Janeiro, no então Distrito Federal.\n\nIngressou na vida política na década de 1930, filiando-se ao Partido\nRepublicano Mineiro (PRM), extinto após a implantação do Estado Novo, em\nnovembro de 1937. Nessa época foi médico da antiga Caixa de\nAposentadoria e Pensões dos Serviços de Mineração do Estado de Minas\nGerais. Com a redemocratização do país em 1945, ingressou no Partido\nTrabalhista Brasileiro (PTB), cujo diretório presidiu no estado do Pará.\n\nNo pleito de outubro de 1954 elegeu-se suplente de deputado federal pelo\nPará na legenda do PTB, não chegando a assumir o mandato. Em fevereiro\nde 1960, entretanto, ocupou uma cadeira no Senado devido à morte do\nsenador João Guilherme Lameira Bittencourt, que por sua vez assumira o\nmandato como suplente do senador Joaquim de Magalhães Cardoso Barata.\nAinda nesse ano foi escolhido vice-líder de seu partido, tornando-se em\nseguida suplente das comissões de Finanças, de Educação e Cultura, de\nServiço Público e de Redação e atuando como titular da Comissão de\nLegislação Social do Senado.\n\nEm novembro de 1961 acompanhou o grupo dissidente do PTB que, sob a\nliderança de Fernando Ferrari, constituiu o Movimento Trabalhista\nRenovador (MTR). Como líder desse movimento no Senado em 1962,\nparticipou da campanha pelo reconhecimento do direito de greve, sendo\ndesignado relator do projeto de regulamentação da matéria na Comissão de\nLegislação Social. Participou também das campanhas pelo povoamento da\nAmazônia, através da imigração indistinta em massa — sem visar à raça ou\nà qualidade individual —, e pela reformulação da previdência social\nbrasileira, tendo concluído seu mandato em janeiro de 1963.\n\nMembro do Conselho Nacional de Economia de 1964 a 1966, integrou a\ndelegação do Brasil às reuniões da XXXVII Conferência do Desarmamento,\nem Genebra, na Suíça. Foi também médico da Previdência Social e do\nConselho de Imigração e Colonização, além de auxiliar técnico do\nLaboratório do Estado do Pará, diretor de imigração na ilha das Flores,\nno estado do Rio de Janeiro, e delegado do Instituto de Aposentadoria e\nPensões dos Comerciários (IAPC) do Pará. Lecionou clínica médica na\nFaculdade Fluminense de Medicina e foi sócio fundador da Sociedade\nBrasileira de Cardiologia.\n\nFaleceu no Rio de Janeiro no dia 6 de julho de 1981.\n\nFoi casado com Zuleica Temporal Fender.\n\nJornalista, poeta e conferencista, publicou em jornais e revistas vários\ntrabalhos de ciência médica, crônicas e poesias, além de duas edições de\n*Sonetos.*\n\n \n\n \n\nFONTES: SENADO. *Dados;*SENADO. *Rela*ção; SENADO. *Relação dos\nlíderes.*\n\n \n","ref":"FONTES: SENADO. *Dados;*SENADO. *Rela*ção; SENADO. *Relação dos\nlíderes.*\n\n \n","dic":"DHBB"}
