{"title":"FERNANDES, Aristófanes","cargoss":["Deputado federal"],"cargos_esp":[0],"datas_ini":[1963],"datas_fim":[1965],"estados":["RN"],"autor":[0],"content":"**FERNANDES, Aristófanes**\n\n\\*dep. fed. RN 1963-1965.\n\n \n\n*Aristófanes Fernandes e Silva* nasceu em Santana do Matos (RN) no dia 5\nde março de 1911, filho de José Fernandes e Silva e Genuína Fernandes e\nSilva.\n\nPrefeito por duas vezes de sua cidade natal, foi eleito em janeiro de\n1947 deputado à Assembléia Constituinte do Rio Grande do Norte pela\ncoligação formada pela União Democrática Nacional (UDN), agremiação à\nqual era filiado, e pelo Partido Social Progressista (PSP), sendo um dos\nsignatários da Constituição estadual de 25 de novembro de 1947. Em\noutubro de 1954, lançado candidato pela coligação Aliança Democrata\nCristã, elegeu-se deputado estadual, vindo a tomar assento na Assembléia\nLegislativa do Rio Grande do Norte no começo de 1955. Deixou a\nAssembléia no início de 1959, ao término da legislatura, tendo tentado,\nsem êxito, a reeleição em outubro de 1958, pela UDN.\n\nElegeu-se deputado federal pelo Rio Grande do Norte no pleito de outubro\nde 1962 na legenda da coligação Cruzada da Esperança, formada pelo\nPartido Social Democrático (PSD) e pelo Partido Democrata Cristão (PDC).\nExerceu o mandato de fevereiro de 1963 a dezembro de 1965.\n\nFaleceu no Rio de Janeiro no dia 8 de dezembro de 1965, em pleno\nexercício do mandato.\n\nEra casado com Maria do Céu Pereira Fernandes, com quem teve dois\nfilhos.\n\n \n\n \n\nFONTES: CÂM. DEP. *Deputados brasileiros. Repertório* (1946-1967);\nCASCUDO, L. *História*; TRIB. SUP. ELEIT. *Dados* (6).\n\n \n","ref":"FONTES: CÂM. DEP. *Deputados brasileiros. Repertório* (1946-1967);\nCASCUDO, L. *História*; TRIB. SUP. ELEIT. *Dados* (6).\n\n \n","dic":"DHBB"}
