{"title":"FERNANDES, Célio Marques","cargoss":["Deputado federal"],"cargos_esp":[0],"datas_ini":[1971],"datas_fim":[1979],"estados":["RS"],"autor":[0],"content":"**FERNANDES, Célio Marques**\n\n\\*dep. fed. RS 1971-1979.\n\n \n\n*Célio Marques Fernandes* nasceu em Porto Alegre no dia 4 de junho de\n1913, filho de Tito Marques Fernandes e de Joaquina Ferreira Fernandes.\n\nBacharel em direito pela Universidade do Rio Grande do Sul e técnico em\nadministração pela Escola de Administração Pública da mesma\nuniversidade, foi delegado de carreira da polícia do Rio Grande do Sul,\ne depois juiz municipal.\n\nEm 1956, elegeu-se vereador à Câmara Municipal de Porto Alegre,\nreelegendo-se sucessivas vezes e permanecendo no cargo até 1964. Nesse\nperíodo, foi presidente da Comissão de Justiça e da Câmara Municipal,\nque representou no Congresso Ibero-Luso-Americano de Municípios,\nrealizado em Lisboa em 1959, no Congresso Mundial de Vereadores,\nrealizado em Washington em 1961, e no Congresso Sul-Americano de\nMunicipalismo, reunido em Punta del Este, Uruguai, em 1962.\n\nPrefeito de Porto Alegre de 1964 a 1969, em novembro de 1970 elegeu-se\ndeputado federal pelo Rio Grande do Sul na legenda da Aliança Renovadora\nNacional (Arena), partido de apoio ao regime militar instaurado no país\nem abril de 1964, assumindo o mandato em fevereiro do ano seguinte.\nNessa legislatura, foi suplente das comissões de Segurança Nacional e de\nTrabalho e Legislação Social, além de membro da Comissão de Relações\nExteriores e da comissão especial para estudo do problema da poluição\nambiental. Reeleito em novembro de 1974, em 1975 tornou-se suplente da\nComissão de Ciência e Tecnologia e vice-presidente da Comissão de\nSegurança Nacional da Câmara. Em abril de 1977, criticou algumas das\nreformas promulgadas pelo Executivo com o Congresso fechado (o chamado\n“pacote de abril”). Atacou a permanência do dispositivo conhecido como\n“denúncia vazia”, que facilitava os despejos de locatários, e a criação\nda figura do senador eleito pelo voto indireto, o “senador biônico”.\n\nAinda em 1977, defendeu o adiamento para 1980 das eleições parlamentares\nprevistas para 1978, criticando na mesma ocasião os tecnocratas do\ngoverno e a direção de seu partido. Até a demissão do ministro do\nExército, general Sílvio Frota (setembro de 1977), integrou o grupo de\nparlamentares que apoiou a candidatura deste à presidência da República.\nEm 1978, foi um dos arenistas que votou na Câmara a favor da Emenda\nAcióli Filho, que propunha a extinção dos “senadores biônicos”.\nCandidato à reeleição em novembro do mesmo ano, obteve apenas uma\nsuplência, deixando a Câmara em janeiro de 1979.\n\nDe volta a Porto Alegre, ainda em 1979 tornou-se juiz civil do Tribunal\nMilitar no Rio Grande do Sul, função na qual permaneceu até se\naposentar, em 1983.\n\nFoi ainda presidente da 6ª Junta de Conciliação e Julgamento e diretor\nda Companhia Industrial de Silos e Armazéns.\n\nFaleceu em Porto Alegre no dia 9 de novembro de 1989.\n\nCasou-se com Maria Scalzilli Marques Fernandes, com quem teve três\nfilhos.\n\n \n\n \n\nFONTES: CÂM. DEP. *Deputados*; CÂM. DEP. *Deputados brasileiros.\nRepertório* (1967-1971); INF. FAM.; *Jornal do Brasil* (16/4/77, 22/9, 6\ne 8/10/78); NÉRI, S. *16*; *Perfil* (1972); *Veja* (19/10/77).\n\n \n","ref":"FONTES: CÂM. DEP. *Deputados*; CÂM. DEP. *Deputados brasileiros.\nRepertório* (1967-1971); INF. FAM.; *Jornal do Brasil* (16/4/77, 22/9, 6\ne 8/10/78); NÉRI, S. *16*; *Perfil* (1972); *Veja* (19/10/77).\n\n \n","dic":"DHBB"}
