{"title":"FERNANDES, Emanuel","cargoss":["Deputado federal"],"cargos_esp":[0],"datas_ini":[1996],"datas_fim":[1997],"estados":["SP"],"autor":[0],"content":"FERNANDES, Emanuel\n\n\\*dep. fed. SP 1996-1997.\n\nEmanuel Fernandes nasceu em Valentim Gentil (SP), no dia 6 de março de\n1956, filho de Mário Fernandes Sobrinho e de Laurinda Gavioli Sobrinho.\n\nIniciou sua formação universitária em 1977, no Instituto Tecnológico da\nAeronáutica (ITA), em São José dos Campos (SP), e em 1980 filiou-se ao\nPartido do Movimento Democrático Brasileiro (PMDB), fundado após o fim\ndo bipartidarismo, em novembro de 1979, reunindo a maioria dos\nremanescentes do antigo Movimento Democrático Brasileiro (MDB).\n\nGraduado como engenheiro aeronáutico em 1981, no ano seguinte\nempregou-se no Instituto Nacional de Pesquisas Espaciais (INPE), onde\ntambém realizou o curso de mestrado em análise de sistemas, concluído em\n1987. Em 1988, trocou o PMDB pelo Partido da Social Democracia\nBrasileira (PSDB). Eleito presidente diretório municipal de São José dos\nCampos, em 1989, exerceu o cargo por dois anos, até ser indicado para o\ndiretório regional, onde atuou até 1993.\n\nNo pleito de outubro de 1994, elegeu-se suplente de deputado federal na\nlegenda do PSDB paulista, e um ano depois retornou à direção estadual.\nEmpossado na Câmara dos Deputados em 11 de junho de 1996, no lugar de\nAntônio Kandir, nomeado ministro do Planejamento do governo Fernando\nHenrique Cardoso (1995-), Emanuel Fernandes participou da Comissão de\nDesenvolvimento Urbano e Interior.\n\nEm outubro de 1996 elegeu-se prefeito de São José dos Campos, sendo\nsubstituído na Câmara dos Deputados pela suplente Dalila Figueiredo.\n\nCasado com Juana Blanco Gomez, teve três filhos.\n\nFONTES: CÂM. DEP. *Deputados brasileiros. Repertório* (1995-1999);\n*Estado de S. Paulo* (20/11/96); *Jornal do Brasil* (30/5/96).\n\n \n","ref":"FONTES: CÂM. DEP. *Deputados brasileiros. Repertório* (1995-1999);\n*Estado de S. Paulo* (20/11/96); *Jornal do Brasil* (30/5/96).\n\n \n","dic":"DHBB"}
