{"title":"FERNANDES, José (AM)","cargoss":["Deputado federal","Deputado federal","Constituinte"],"cargos_esp":[0,0,0],"datas_ini":[1982,1979,1987],"datas_fim":[1991,0,1988],"estados":["AM","AM",0],"autor":["Eduardo Junqueira","Alan Carneiro"],"content":"**FERNANDES, José (AM)**\n\n\\*dep. fed. AM 1979, 1982-1991; const. 1987-1988.\n\n*José de Oliveira Fernandes* nasceu em Careiro (AM) no dia 1º de\ndezembro de 1943, filho de Benjamim Matias Fernandes e de Maria de\nOliveira Fernandes.\n\nFormado em economia pela Universidade Federal do Amazonas (Ufam) em\n1968, iniciou o curso de engenharia na mesma universidade em 1969, mas\nnão chegou a concluí-lo. No ano seguinte fez curso de especialização e\ndesenvolvimento na Comissão Econômica para a América Latina (CEPAL).\n\nEm 1970 tornou-se professor titular de análises econômicas da\nUniversidade Federal do Amazonas (Ufam) e foi nomeado assessor\nfinanceiro do Departamento de Estradas de Rodagem (DER) do Amazonas,\ncargo que exerceu até 1971. Nesse ano, tornou-se diretor da comissão de\nconstrução da BR-319, função que desempenhou até 1973. Dois anos depois\nfoi nomeado secretário de Transportes do Estado do Amazonas pelo\nrecém-empossado governador Enoc Reis (1975-1979), da Aliança Renovadora\nNacional (Arena), agremiação que dava apoio ao regime militar em voga no\npaís desde abril de 1964, quando o presidente João Goulart (1961-1964)\nfoi deposto. Permaneceu nessa secretaria até maio de 1978, quando se\ndesincompatibilizou do cargo para concorrer a uma cadeira na Câmara dos\nDeputados.\n\nNas eleições de novembro desse ano conquistou a cadeira de deputado\nfederal pelo Amazonas, na legenda da Arena. Tomando posse em fevereiro\nde 1979, no mês seguinte licenciou-se do mandato por ter sido nomeado\nprefeito de Manaus pelo novo governador do estado, José Lindoso\n(1979-1982). Sua cadeira na Câmara foi ocupada pelo suplente Ubaldino\nMeireles.\n\nCom o fim do bipartidarismo em novembro de 1979 e a conseqüente\nreorganização partidária, ingressou no ano seguinte no Partido\nDemocrático Social (PDS), agremiação sucessora da Arena no apoio ao\ngoverno. Permaneceu à frente da prefeitura de Manaus até março de 1982,\nquando foi obrigado a se desincompatibilizar do cargo, pois concorreria\na mais um mandato de deputado federal. De volta à Câmara, integrou, como\nsuplente, a Comissão de Minas e Energia.\n\nNo pleito de novembro desse ano reelegeu-se deputado federal na legenda\ndo PDS. Logo após as eleições, declarou-se contrário à reforma agrária,\naos votos distrital e vinculado, à legalização do jogo e do aborto, e\nmanifestou-se favorável a uma reforma tributária, à redução da censura,\nà eleição direta para prefeitos de capitais e áreas de segurança\nnacional e à eleição indireta para presidente da República. Iniciando\nnovo mandato em fevereiro do ano seguinte, passou a integrar, como\ntitular, a Comissão de Transportes e, como suplente, a Comissão de Minas\ne Energia da Câmara dos Deputados e a Comissão Parlamentar de Inquérito\n(CPI) que investigou irregularidades no Banco Nacional da Habitação\n(BNH), bem como, na condição de titular, a CPI do Índio.\n\nNo início dessa legislatura, o deputado Dante de Oliveira, do Partido do\nMovimento Democrático Brasileiro (PMDB) de Mato Grosso, apresentou na\nCâmara um projeto de emenda constitucional restabelecendo eleições\ndiretas para a presidência da República no ano seguinte. Este projeto,\nencampado pelas oposições, proporcionou o desencadeamento de uma\ncampanha nacional nesse sentido, que ficou conhecida como Diretas Já. Na\nsessão da Câmara dos Deputados de 25 de abril de 1984, à qual o deputado\nJosé Fernandes, atendendo à determinação do seu partido, não compareceu,\na emenda Dante de Oliveira acabou não sendo aprovada por falta de 22\nvotos, fato que impediu seu envio à apreciação do Senado.\n\nCom esse resultado, ficou definido que o próximo presidente da República\nseria mesmo eleito por via indireta. Vários eram os postulantes à\ncondição de candidato oficial do partido do governo. A falta de consenso\nquanto à forma de escolha provocou uma cisão na agremiação e os\ndissidentes formaram a Frente Liberal. Para resolver o impasse, o PDS\nrealizou em agosto seguinte sua convenção, na qual o deputado José\nFernandes votou em Paulo Maluf, que venceu o então ministro do Interior\nMário Andreazza. Na mesma oportunidade, o deputado cearense Flávio\nMarcílio derrotou o então governador de Alagoas Divaldo Suruagi e\ntornou-se o candidato a vice de Maluf.\n\nPara concorrer com os candidatos da situação, os partidos de oposição,\ncom exceção do Partido dos Trabalhadores (PT), liderados pelo PMDB, e a\nFrente Liberal, reunidos na Aliança Democrática, lançaram o então\ngovernador de Minas Gerais Tancredo Neves e o então senador maranhense\nJosé Sarney, respectivamente, para presidente e vice-presidente da\nRepública. Na reunião do Colégio Eleitoral, realizada em 15 de janeiro\nde 1985, José Fernandes ratificou seu voto em Paulo Maluf, que acabou\nderrotado pelos candidatos oposicionistas. Porém, a doença de Tancredo\nna véspera de sua posse fez com que o seu vice assumisse o governo, em\ncaráter interino, no dia 15 de março desse ano e fosse efetivado no mês\nseguinte, após a morte do titular. Ainda nesse ano tornou-se membro\ntitular da Comissão de Ciência e Tecnologia e passou a integrar as CPIs\ndo Sistema Bancário, como titular, e da Mineração, como suplente.\n\nCom o esvaziamento do PDS em seu estado, José Fernandes deixou essa\nagremiação em maio de 1986 e filiou-se em seguida ao Partido Democrático\nTrabalhista (PDT). Nas eleições de novembro desse ano, concorrendo a\nmais uma reeleição, desta feita na nova legenda, foi o único candidato\ndo partido no Amazonas que se elegeu deputado federal constituinte.\nIniciou sua terceira legislatura ao tomar posse em 1º de fevereiro de\n1987, quando se instalou a Assembléia Nacional Constituinte (ANC), na\nqual passou a integrar, como titular, a Subcomissão dos Direitos e\nGarantias da Comissão da Soberania e dos Direitos e Garantias do Homem e\nda Mulher e, como suplente, a Subcomissão de Orçamento e Fiscalização\nFinanceira da Comissão do Sistema Tributário, Orçamento e Finanças,\nambas em 1987, e a Comissão de Sistematização, de 1987 a 1988.\n\nDurante os trabalhos de elaboração da Constituição, votou a favor do\nrompimento de relações diplomáticas com países com política de\ndiscriminação racial, da limitação do direito de propriedade privada, da\nremuneração 50% superior para o trabalho extra, da jornada de trabalho\nde 40 horas semanais, do turno ininterrupto de seis horas, do aviso\nprévio proporcional, da unicidade sindical, do presidencialismo, da\nnacionalização do subsolo, da proibição do comércio de sangue e da\ndesapropriação da propriedade produtiva para fins de reforma agrária.\nVotou contra a pena de morte, o mandado de segurança coletivo, o aborto,\no mandato de cinco anos para o então presidente José Sarney (1985-1990)\ne o jogo do bicho.\n\nApós a promulgação da nova Carta em 5 de outubro de 1988, continuou a\nexercer o seu mandato ordinário de deputado federal. Em março de 1990,\natendendo solicitação do deputado licenciado e então ministro da Justiça\nBernardo Cabral, deixou o PDT e filiou-se ao Partido Social Trabalhista\n(PST), do qual tornou-se líder na Câmara. No pleito de outubro desse ano\nconcorreu a mais uma reeleição, desta feita na nova legenda, coligada a\npartidos menores, mas, por não atingir o quociente eleitoral exigido\npela legislação, não conseguiu se eleger. Permaneceu na Câmara dos\nDeputados até o fim de janeiro de 1991, quando se encerraram o seu\nmandato e a legislatura, não tendo voltado a concorrer a qualquer cargo\npúblico eletivo. A partir de então passou a atuar na iniciativa privada.\n\nAinda em 1991 deixou a Ufam e tornou-se diretor operacional da empresa\nPlanejamento e Construções Ltda., função que exerceu até o ano seguinte,\nquando passou a diretor jurídico da empresa. Permaneceu nesse cargo até\nsetembro de 1994, quando se tornou diretor-geral da Rede Boas Novas de\nTelevisão, uma rede evangélica, na qual permaneceu até outubro de 1996.\nNesse mês foi nomeado pelo governador Amazonino Mendes para o cargo de\nsecretário de Habitação e Urbanismo. Em abril de 1997 assumiu,\ncumulativamente, a Secretaria de Obras do estado. Dois meses depois\ndeixou a de Habitação e Urbanismo. Permaneceu na Secretaria de Obras até\no fim de dezembro de 1998, quando se encerrou o primeiro período de\ngoverno de Amazonino, que acabara de se reeleger no pleito de outubro\ndesse ano. Em maio do ano seguinte retornou à Planub como diretor de\nobras da região Norte.\n\nCasou-se com Cleide Maria de Oliveira Fernandes, com quem teve quatro\nfilhos.\n\n Publicou *Problemas de economia regional* (1970), *Estudo da\nviabilidade da rodovia AM-285* (1971), *Estradas na Amazônia ocidental*\n(1972), *Projetos do subsistema de rodovia BR-319* (1973) e *Estradas de\npenetração* (1976).\n\nEduardo Junqueira/Alan Carneiro\n\nFONTES:**ASSEMB. NAC. CONST.*Repertório*(1987-1988); CÂM. DEP.\n*Deputados brasileiros. Repertórios* (1979-1983, 1983-1987 e\n1991-1995);*Folha de S. Paulo* (31/1/85, 31/1 e 31/3/87); INF. BIOG.;\n*Jornal do Brasil* (16/3/82); *Jornal do Comércio* (23/11/86).\n\n \n","ref":"FONTES:**ASSEMB. NAC. CONST.*Repertório*(1987-1988); CÂM. DEP.\n*Deputados brasileiros. Repertórios* (1979-1983, 1983-1987 e\n1991-1995);*Folha de S. Paulo* (31/1/85, 31/1 e 31/3/87); INF. BIOG.;\n*Jornal do Brasil* (16/3/82); *Jornal do Comércio* (23/11/86).\n\n \n","dic":"DHBB"}
