{"title":"ALVES, Tobias =============","cargoss":["Deputado federal"],"cargos_esp":[0],"datas_ini":[1983],"datas_fim":[1987],"estados":["GO"],"autor":[0],"content":"ALVES, Tobias\n=============\n\n\\* dep. fed. GO 1983-1987.\n\n \n\n                *Tobias Alves Rodrigues* nasceu em Miguelópolis (SP) no\ndia 23 de julho de 1935, filho de Tobias Alves Rodrigues e Aurora Alves\ndo Nascimento.\n\n                Radicado em Goiás desde 1951, após o movimento\npolítico-militar de 31 de março de 1964, a extinção dos partidos\npolíticos pelo Ato Institucional n.º 2 (27/10/1965) e a posterior\ninstauração do bipartidarismo, filiou-se ao Movimento Democrático\nBrasileiro (MDB), partido de oposição ao regime militar instaurado no\npaís em abril de 1964. No pleito de novembro de 1965, foi eleito\nvereador à Câmara Municipal de Goiânia pelo MDB, assumindo uma cadeira\nno início do ano seguinte. Em 1967, bacharelou-se em ciências jurídicas\ne sociais pela Faculdade de Direito da Universidade Federal de Goiás.\n\n                Em novembro de 1970, candidatou-se a uma vaga na\nAssembléia Legislativa. Eleito, tomou posse em fevereiro de 1971. No\npleito seguinte, em novembro de 1974, reelegeu-se deputado estadual,\niniciando seu segundo mandato em fevereiro de 1975. Com a reorganização\npartidária provocada pelo fim do bipartidarismo em 1979, filiou-se ao\nPartido do Movimento Democrático Brasileiro (PMDB), agremiação que deu\ncontinuidade ao MDB. Nesse mesmo ano, foi secretário municipal e\npresidente do diretório metropolitano do PMDB. Em novembro de 1982,\nelegeu-se deputado federal, assumindo sua vaga na Câmara dos Deputados\nem fevereiro do ano seguinte. Ao longo desse mandato, foi membro da\nComissão de Educação e Cultura e suplente da Comissão de Relações\nExteriores.\n\n                Em 25 de abril de 1984, votou a favor da emenda Dante de\nOliveira, que, apresentada na Câmara dos Deputados, propôs o\nrestabelecimento das eleições diretas para presidente da República em\nnovembro daquele ano. Como a emenda não obteve o número de votos\nindispensáveis a sua aprovação – faltaram 22 para que o projeto pudesse\nser encaminhado à apreciação do Senado Federal –, no Colégio Eleitoral,\nreunido em 15 de janeiro de 1985, Tobias Alves votou no candidato\noposicionista Tancredo Neves, eleito presidente da República pela\nAliança Democrática, uma união do PMDB com a dissidência do Partido\nDemocrático Social (PDS) abrigada na Frente Liberal, que derrotou o\ncandidato do regime militar, Paulo Maluf. Contudo, Tancredo Neves não\nchegou a ser empossado na presidência, vindo a falecer em 21 de abril de\n1985. Seu substituto no cargo foi o vice José Sarney, que já vinha\nexercendo interinamente a função, desde 15 de março desse ano.\n\nNas eleições de novembro de 1986, Tobias Alves concorreu à reeleição na\nlegenda peemedebista, não obtendo sucesso. Deixou a Câmara dos Deputados\nem janeiro de 1987, ao final da legislatura.\n\nNo ano de 1987, ocupou a pasta de secretário de Educação no governo de\nHenrique Santillo (1987-1991). Permaneceu à frente da pasta até 1988,\nquando foi nomeado para o Tribunal de Contas dos Municípios (TCM) de\nGoiás. Durante os anos de 1996 e 1997 ocupou a presidência desse\ntribunal. Logo após deixar a presidência da casa, aposentou-se, passando\na dedicar-se a atividades particulares.\n\n                Casou-se com Ana Maria Silva Rodrigues, com quem teve\nquatro filhos.\n\n \n\nFONTES: CÂM. DEP.  *Deputados Brasileiros.* *Repertório* (1983-1987);\n*Folha de São Paulo* (15/11/84); *Globo* (26/4/84, 16/1/85); INF. BIOG.\n","ref":"FONTES: CÂM. DEP.  *Deputados Brasileiros.* *Repertório* (1983-1987);\n*Folha de São Paulo* (15/11/84); *Globo* (26/4/84, 16/1/85); INF. BIOG.\n","dic":"DHBB"}
