{"title":"FERRAZ, Figueiredo","cargoss":["Prefeito"],"cargos_esp":["São Paulo"],"datas_ini":[1971],"datas_fim":[1973],"estados":[0],"autor":[0],"content":"**FERRAZ, Figueiredo**\n\n\\*pref. São Paulo 1971-1973.\n\n \n\n*José Carlos de Figueiredo Ferraz* nasceu em Campinas (SP) no dia 16 de\nsetembro de 1918, filho do engenheiro Odon Carlos de Figueiredo Ferraz e\nde Julieta Martins de Figueiredo Ferraz. Sua irmã, Ester de Figueiredo\nFerraz, foi durante seis anos reitora da Universidade Mackenzie, na\ncapital paulista, secretária da Educação de São Paulo entre 1971 e 1973\ne ministra da Educação entre agosto de 1982 e abril de 1985.\n\nFez seus estudos no Liceu Nacional Rio Branco, no Colégio Universitário\nda Universidade de São Paulo (USP) e no Ginásio São Bento, todos na\ncapital bandeirante. Tornou-se professor do curso pré-politécnico do\nGinásio São Bento em 1937. Em 1940, formou-se em engenharia pela Escola\nPolitécnica da USP e lecionou, como assistente, física, cálculo vetorial\ne análise matemática na Faculdade de Filosofia, Ciências e Letras de São\nBento, da Pontifícia Universidade Católica (PUC) de São Paulo. Em 1941\nfundou a empresa Figueiredo Ferraz Consultoria e Engenharia de Projetos.\n\nNo período de 1941 a 1945 foi engenheiro do Departamento de Estradas de\nRodagem (DER), seção Obras-de-Arte da via Anchieta. Em 1946 ingressou na\nfirma Dácio A. de Morais como diretor-técnico, sendo nesse mesmo ano\nconvidado para lecionar resistência dos materiais, como assistente, na\nEscola Politécnica. Em 1948, assumiu a mesma cadeira na Faculdade de\nEngenharia Industrial da PUC, onde permaneceu até 1951, quando prestou\nexame para livre-docente da cadeira de pontes e grandes estruturas da\nEscola Politécnica da USP. Em 1954 deixou o cargo de assistente na\nEscola Politécnica.\n\nNa década de 1950 doutourou-se em ciências físicas e matemáticas e foi\nainda catedrático de concreto armado da Faculdade de Arquitetura de São\nPaulo e professor da Escola de Engenharia Mackenzie. Em 1957 foi\nsecretário municipal de Obras, no governo de Ademar de Barros\n(1957-1958). Em 1967 tornou-se secretário Estadual de Transportes, no\ngoverno de Roberto de Abreu Sodré (1967-1971), permanecendo no cargo até\no ano seguinte.\n\nEm 1971 foi indicado pelo governador de São Paulo, Laudo Natel\n(1971-1975), para ocupar a prefeitura da capital. Sendo aprovado pela\nCâmara Municipal, tomou posse em março do mesmo ano, substituindo Paulo\nMaluf. Em entrevista ao semanário Veja, alguns dias depois de iniciar\nsua administração, afirmou que São Paulo era uma cidade “até certo ponto\nclandestina” por não possuir uma boa infra-estrutura de serviços básicos\ne crescer desordenadamente, apontando como solução a aplicação efetiva\ndo Plano Urbanístico Básico e do Plano Metropolitano de Desenvolvimento\nIntegrado. Ressaltou ainda a instabilidade econômica e financeira da\nPrefeitura, o que, a seu ver, limitaria suas perspectivas de trabalho.\nIndagado sobre a eleição direta para prefeito, afirmou que a escolha do\npovo é bastante conscienciosa, mas numa situação de emergência achava\nnecessária a presença de um técnico capaz de corrigir eventuais falhas\nadministrativas.\n\nDurante sua permanência no cargo,****ampliou o Plano Urbanístico Básico\npara abranger a área social do município, modificou a estrutura\nburocrática da Prefeitura e centralizou o setor de transportes. Ao dar\nprioridade às obras do metrô recebeu críticas do governo estadual, mais\ninteressado nos projetos do anel rodoviário. Devido aos gastos vultosos\ncom essas obras, os impostos foram aumentados e a desorganização\nadministrativa das outras áreas não foi corrigida. Suas divergências com\no governador Laudo Natel acentuaram-se devido à sua recusa em ingressar\nna Aliança Renovadora Nacional (Arena), partido de apoio ao regime\nmilitar instaurado no país em abril de 1964, alegando ser um homem\ndedicado exclusivamente ao setor administrativo. Essa posição lhe valeu\na demissão do cargo em agosto de 1973, sendo indicado como seu\nsubstituto o secretário de Economia e Planejamento, Miguel Colasuonno.\nEm nota oficial, Figueiredo Ferraz afirmou desconhecer as razões de sua\ndemissão e disse ter cumprido seu dever. Ester Figueiredo Ferraz, que na\népoca ocupava a Secretaria de Educação do estado, demitiu-se também, em\nsolidariedade ao irmão.\n\nEm declaração ao *Jornal*do *Brasil*de 4 de agosto de 1976, afirmou que\no crescimento desordenado das áreas metropolitanas no Brasil deveria ser\ncontido através da reforma agrária, que fixaria o homem no campo,\nevitando a imigração, e do surgimento de novos pólos de desenvolvimento.\n\nFoi professor do Instituto Militar de Engenharia (IME), secretário da\nAssociação Brasileira de Concreto Protendido e Urbanismo da USP e membro\nde várias outras agremiações, como o Conselho Regional de Engenharia e\nArquitetura (CREA), a Sociedade Matemática de São Paulo, a Association\nInternationale des Ponts et Charpentes, o Grupo de Desenvolvimento do\nConcreto Protendido, da Inglaterra, e a Associação Brasileira de\nMecânica dos Solos. Dentre as obras de seu escritório técnico de\nengenharia destacaram-se a Catedral da Sé, o Museu de Arte de São Paulo,\no edifício Casper Líbero e estruturas da Cidade Universitária, todos na\ncapital paulista.\n\nFaleceu na cidade de São Paulo no dia 25 de junho de 1994.\n\nFoi casado, em primeiras núpcias com****Lígia Chagas de Figueiredo\nFerraz e, em segundas núpcias, com Leda Figueiredo Ferraz. Teve três\nfilhos.\n\nPublicou *Contribuição ao estudo das grelhas*(tese) e *São Paulo e seu\nfuturo — antes que seja tarde*(1976).\n\n \n\nFONTES: COUTINHO, A. *Brasil; Encic. Mirador; Folha de S.\nPaulo*(27/6/94); *Grande encic. Delta; Jornal do Brasil*(22/8/73,\n16/9/75, 4/8/76); SOC. BRAS. EXPANSÃO COMERCIAL. *Quem; Veja*(31/3/71,\n29/8/73).\n\n \n","ref":"FONTES: COUTINHO, A. *Brasil; Encic. Mirador; Folha de S.\nPaulo*(27/6/94); *Grande encic. Delta; Jornal do Brasil*(22/8/73,\n16/9/75, 4/8/76); SOC. BRAS. EXPANSÃO COMERCIAL. *Quem; Veja*(31/3/71,\n29/8/73).\n\n \n","dic":"DHBB"}
