{"title":"FERRAZ, Paulo","cargoss":["Deputado federal"],"cargos_esp":[0],"datas_ini":[1967],"datas_fim":[1981],"estados":["PI"],"autor":[0],"content":"**FERRAZ, Paulo**\n\n\\*dep. fed. PI 1967-1981.\n\n \n\n*Paulo da Silva**Ferraz* nasceu em Teresina no dia 7 de abril de 1919,\nfilho de Luís Ferraz e de Raimunda da Silva Ferraz.\n\nAdvogado, iniciou sua carreira política em outubro de 1954, elegendo-se\ndeputado estadual no Piauí na legenda da Aliança Democrática\nProgressista, coligação que reunia o Partido Social Progressista (PSP),\no Partido Libertador (PL) e a União Democrática Nacional (UDN). Iniciou\no mandato em fevereiro do ano seguinte e reelegeu-se em outubro de 1958\nna legenda da UDN, deixando a Assembléia para assumir a Secretaria de\nEducação e Cultura do Piauí na gestão do governador Francisco Chagas\nRodrigues (1959-1963). Novamente reeleito em 1962, mais uma vez\nlicenciou-se para assumir o cargo de secretário de Educação e Cultura,\nagora no governo de Petrônio Portela (1963-1966). Nessa época foi também\nmembro do Conselho Estadual de Educação.\n\nCom a extinção dos partidos políticos pelo Ato Institucional nº 2\n(27/10/1965) e a posterior instauração do bipartidarismo, filiou-se à\nAliança Renovadora Nacional (Arena). Nessa legenda elegeu-se deputado\nfederal pelo Piauí em novembro de 1966, assumindo sua cadeira na Câmara\nem fevereiro de 1967. Reeleito nos pleitos de novembro de 1970 e de\n1974, sempre na legenda da Arena, durante essas duas legislaturas foi\nvice-presidente da Comissão de Serviço Público e suplente da Comissão de\nEducação e Cultura da Câmara dos Deputados. No pleito seguinte, de\nnovembro de 1978, foi mais uma vez eleito, na mesma legenda, passando a\natuar como membro efetivo da Comissão do Interior e como suplente da\nComissão de Serviço Público. Com a extinção do bipartidarismo em 29 de\nnovembro de 1979 e a conseqüente reformulação partidária, filiou-se ao\nPartido Democrático Social (PDS).\n\nEm janeiro de 1981, juntamente com mais cinco deputados federais e com o\ngovernador da Paraíba Tarcísio Buriti (1979-1982), recusou a Ordem do\nIpiranga, concedida pelo governador Paulo Maluf (1979-1982), de São\nPaulo, por discordar do significado da condecoração.\n\nFoi também secretário de Fazenda do estado do Piauí.\n\nFaleceu em Brasília no dia 7 de novembro de 1981, em pleno exercício do\nmandato.\n\nCasou-se com Isolete Alves Cavalcanti Ferraz, com quem teve quatro\nfilhos.\n\n \n\n \n\nFONTES: CÂM. DEP. *Deputados;*CÂM.**DEP. *Deputados brasileiros.\nRepertório*(6, 7, 8 e 9);*Globo* (8/11/81);*Jornal do Brasil* (25/1/\n81); NÉRI, S. *16;*TRIB. SUP. ELEIT. *Dados*(3, 4, 6, 8 e 9).\n\n \n","ref":"FONTES: CÂM. DEP. *Deputados;*CÂM.**DEP. *Deputados brasileiros.\nRepertório*(6, 7, 8 e 9);*Globo* (8/11/81);*Jornal do Brasil* (25/1/\n81); NÉRI, S. *16;*TRIB. SUP. ELEIT. *Dados*(3, 4, 6, 8 e 9).\n\n \n","dic":"DHBB"}
