{"title":"FERREIRA, Ézio","cargoss":["Constituinte","Deputado federal"],"cargos_esp":[0,0],"datas_ini":[1987,1987],"datas_fim":[1988,1995],"estados":[0,"AM"],"autor":["Eduardo Junqueira","Alan Carneiro"],"content":"**FERREIRA, Ézio**\n\n\\*const. 1987-1988; dep. fed. AM 1987-1995.\n\n*Ézio Ferreira de Sousa* nasceu em Benjamim Constant (AM) no dia 1º de\nmaio de 1940, filho de Manuel Oliveira de Sousa e de Rosina Ferreira de\nSousa.\n\nIndustrial e empresário da construção civil, iniciou sua carreira\npolítica filiando-se ao Partido da Frente Liberal (PFL), em cuja legenda\nse elegeu deputado federal constituinte pelo Amazonas nas eleições de\nnovembro de 1986, tendo sido o candidato mais votado no seu partido, com\n37.466 votos, e o segundo no estado. Tomou posse em 1º de fevereiro do\nano seguinte, mesma data em que foi instalada a Assembléia Nacional\nConstituinte (ANC), tornando-se titular da Subcomissão de Defesa do\nEstado, da Sociedade e da Segurança, da Comissão da Organização\nEleitoral, Partidária e Garantia das Instituições e suplente da\nSubcomissão da Ciência e Tecnologia, da Comissão da Família, da\nEducação, Cultura e Esportes, da Ciência e Tecnologia e da Comunicação.\n\nDurante os trabalhos de elaboração da Constituição, votou a favor da\npena de morte, da proteção ao emprego contra a despedida sem justa\ncausa, da unicidade sindical, do presidencialismo, da proibição do\ncomércio de sangue e dos cinco anos de mandato para o então presidente\nJosé Sarney (1985-1990). Votou contra o rompimento de relações\ndiplomáticas com países de orientação política racista, a limitação do\ndireito de propriedade privada, a remuneração 50% superior para o\ntrabalho extra, a jornada semanal de 40 horas, a limitação dos encargos\nda dívida externa, a criação de um fundo de apoio à reforma agrária e a\ndesapropriação da propriedade produtiva. Conservador, apesar de\npertencer ao setor da construção civil, não era favorável à proteção das\nempresas nacionais.\n\nApós a promulgação da Constituição em 5 de outubro de 1988, passou a\nexercer somente o mandato ordinário de deputado federal. No ano\nseguinte, integrou, como titular, as comissões de Transportes, de\nEconomia, Indústria e Comércio, da qual se tornou\nsegundo-vice-presidente, e de Minas e Energia e, como suplente, a\nComissão Mista de Orçamento do Congresso Nacional, nas quais permaneceu\naté 1990.\n\nReeleito deputado federal no pleito de outubro desse ano na legenda do\nPFL, obtendo 41.073 votos, a maior votação em todo o estado, iniciou\nnovo período legislativo na Câmara em fevereiro do ano seguinte. Em sua\nsegunda legislatura, passou a integrar, como titular, a Comissão de\nEconomia, Indústria e Comércio, da qual se tornou\nprimeiro-vice-presidente, e, como suplente, a Comissão de Finanças e\nTributação.\n\nAs denúncias de irregularidades no governo do presidente Fernando Collor\n(1990-1992), publicadas na imprensa ao longo de 1991, atingiram o clímax\nem maio de 1992, quando a revista *Veja* publicou uma entrevista de\nPedro Collor, irmão do presidente, denunciando um esquema de corrupção\nexistente no governo sob o comando de Paulo César Farias, o PC,\nex-tesoureiro da campanha presidencial. Para apurar tal denúncia, o\nCongresso instaurou uma comissão parlamentar de inquérito (CPI) no mês\nseguinte. As conclusões dessa comissão levaram ao envolvimento do\npresidente e foi pedido o seu *impeachment.* Na sessão da Câmara dos\nDeputados de 29 de setembro desse ano, com voto contrário do deputado\nÉzio Ferreira, foi aprovada a admissibilidade de abertura do processo de\nafastamento do presidente.\n\nNo início de outubro, Collor deixou o governo, sendo substituído pelo\nvice Itamar Franco, em caráter interino, até que o caso fosse julgado\npelo Senado, para onde o processo foi encaminhado. No dia 29 de dezembro\ndesse ano, pouco antes da votação, o presidente afastado apresentou sua\nrenúncia, que não foi aceita pela mesa dessa casa do Congresso. Em\nseguida, o plenário da Câmara Alta aprovou o afastamento definitivo de\nCollor e ainda lhe suspendeu os direitos políticos por oito anos. Com\nesse resultado, Itamar foi efetivado na chefia do Executivo brasileiro.\n\nEm setembro de 1993, o economista e ex-assessor do Senado, José Carlos\nAlves dos Santos, denunciou a chamada “máfia do orçamento”. Nela\nestariam envolvidos 24 parlamentares, entre os quais o deputado Ézio\nFerreira, sete ministros e três governadores em um esquema de corrupção,\nem conluio com empresas da construção civil, cujo objetivo era o desvio\nde verbas públicas, mediante inclusão de gastos no orçamento da União\npara obras que não eram realizadas. Diante desse fato, o Congresso\ninstituiu uma CPI para apurar tal denúncia. Vários dos parlamentares\nincriminados renunciaram a seus mandatos durante a apuração do\nescândalo. Concluídos os trabalhos dessa comissão, outros foram\ncassados, mas o deputado Ézio Ferreira acabaria sendo inocentado.\n\nComo o prazo para o registro de candidaturas acabava antes de seu\njulgamento pela Câmara, para garantir sua vaga, Ézio Ferreira registrou\nsua mulher como candidata a deputada federal. Inocentado pelo plenário\nda Câmara, ela renunciou em favor do marido. Livrou-se então da\ncassação, mas não dos prejuízos eleitorais que lhe custaram mais um\nmandato. No pleito de outubro de 1994, concorrendo a nova reeleição por\numa coligação formada, além do PFL, pelo Partido Progressista Reformador\n(PPR), Partido Democrático Trabalhista (PDT), Partido Trabalhista\nBrasileiro (PTB) e Partido Progressista (PP), foi o último colocado com\npouco mais de oito mil votos, ficando assim com a última suplência.\n\nDurante essa segunda legislatura, entre as principais votações ocorridas\nna Câmara, votou a favor da criação do Imposto Provisório sobre\nMovimentação Financeira (IPMF), que ficou conhecido como imposto do\ncheque, e do Fundo Social de Emergência (FSE), entre outros.\n\nConcluiu seu mandato no fim de janeiro de 1995, quando se encerrou a\nlegislatura. Não voltou a concorrer no pleito de 1998.\n\nFoi ainda presidente regional do PFL, e por esta legenda candidatou-se,\nem 2002, a novo mandato de deputado federal, obtendo uma suplência.\n\nCasou-se com Maria das Graças Teixeira de Sousa, com quem teve três\nfilhos.\n\nEduardo Junqueira/Alan Carneiro\n\nFONTES:****ASSEMB. NAC. CONST.*****Repertório*****(1987-1988); CÂM. DEP.\n*Deputados brasileiros. Repertório*(1991-1995 e 1995-1999); COELHO, J. &\nOLIVEIRA, A. *Nova*; *Jornal do B**rasil* (22/10/93); *Olho no\nvoto*/*Folha de S. Paulo*(18/9/94); *Perfil parlamentar/**Istoé;*Portal\nda Câmara Municipal de Manaus\n([http://www.cmm.am.gov.br](http://www.cmm.am.gov.br/); acessado em\n30/11/2009); Portal do Tribunal Regional Eleitoral do Amazonas\n([http://www.tre-am.jus.br](http://www.tre-am.jus.br/); acessado em\n30/11/2009).\n\n \n","ref":"FONTES:****ASSEMB. NAC. CONST.*****Repertório*****(1987-1988); CÂM. DEP.\n*Deputados brasileiros. Repertório*(1991-1995 e 1995-1999); COELHO, J. &\nOLIVEIRA, A. *Nova*; *Jornal do B**rasil* (22/10/93); *Olho no\nvoto*/*Folha de S. Paulo*(18/9/94); *Perfil parlamentar/**Istoé;*Portal\nda Câmara Municipal de Manaus\n([http://www.cmm.am.gov.br](http://www.cmm.am.gov.br/); acessado em\n30/11/2009); Portal do Tribunal Regional Eleitoral do Amazonas\n([http://www.tre-am.jus.br](http://www.tre-am.jus.br/); acessado em\n30/11/2009).\n\n \n","dic":"DHBB"}
