{"title":"FERREIRA, José Feliciano","cargoss":["Governador de estado ou do Distrito Federal","Senador","Senador"],"cargos_esp":[0,0,0],"datas_ini":[1959,1963,1961],"datas_fim":[1961,1971,1962],"estados":["GO","GO","GO"],"autor":[0],"content":"**FERREIRA, José Feliciano**\n\n\\*gov. GO 1959-1961; sen. GO 1961-1962 e 1963-1971.\n\n* *\n\n*José Feliciano Ferreira* nasceu em Jataí (GO) no dia 15 de dezembro de\n1916, filho de Davi Ferreira e de Risolete de Carvalho Ferreira.\n\nApós concluir os estudos primários com sua mãe, na fazenda onde residia,\nfreqüentou o Ginásio Mineiro, em Uberlândia (MG), onde presidiu a\nAssociação dos Estudantes Secundaristas, e o Colégio Universitário da\nPraia Vermelha, no Rio de Janeiro, então Distrito Federal. Ingressando\ndepois na Faculdade de Direito da Universidade do Brasil, tornou-se um\ndos diretores da União dos Estudantes do Rio de Janeiro e participou\nativamente do movimento estudantil que defendia a declaração de guerra\nao Eixo, o fim do Estado Novo e a redemocratização do país. Após\nbacharelar-se em 1944, regressou à sua cidade natal.\n\nEleito vereador em 1947, tornou-se líder da maioria e presidente das\ncomissões de Constituição e Justiça e de Educação da Câmara Municipal de\nJataí. No pleito de outubro de 1950 elegeu-se deputado estadual em Goiás\nna legenda do Partido Social Democrático (PSD), assumindo o mandato em\nfevereiro do ano seguinte. Durante essa legislatura, concluída em\njaneiro de 1955, presidiu a Assembléia goiana, exerceu a liderança do\nPSD e da maioria e integrou também as comissões permanentes de Finanças,\nde Transportes e de Educação.\n\nSecretário de Educação de Goiás a partir de 1955, exerceu essa função\naté 1958, durante o governo de José Ludovico de Almeida (1955-1959). No\npleito de outubro desse ano elegeu-se governador do estado, sempre na\nlegenda do PSD, derrotando César da Cunha Bastos, da União Democrática\nNacional (UDN). Durante seu governo, que se iniciou em fevereiro de\n1959, realizou obras dentro do trinômio “estradas, energia, escolas” e\ndeu cobertura ao governo federal nas medidas necessárias à construção de\nBrasília, principalmente na desapropriação da área do novo Distrito\nFederal e na instalação da rede de transmissão elétrica para a sede\nadministrativa do país. Permaneceu no cargo até fevereiro de 1961,\nquando foi substituído por Mauro Borges Teixeira.\n\nVice-presidente do diretório regional do PSD em 1961, concorreu às\neleições extraordinárias, realizadas em julho desse ano, para o\npreenchimento de uma vaga por Goiás no Senado Federal, elegendo-se\nsuplente de Juscelino Kubitschek e derrotando Valdir Castro Quinta, do\nPartido Democrata Cristão (PDC). Assumindo o mandato em setembro\nseguinte, destacou-se nas articulações que resultaram na aprovação da\nEmenda Constitucional nº 5 em novembro de 1961, que alterou os critérios\nde distribuição da renda nacional em favor dos municípios. Retornando à\ncondição de suplente em fevereiro de 1962, voltou a substituir o titular\nde março a julho do mesmo ano.\n\nNo pleito de outubro de 1962 elegeu-se senador por Goiás, sempre na\nmesma legenda. Assumindo o mandato em fevereiro do ano seguinte,\ntornou-se vice-líder da maioria em 1964. Com a extinção dos partidos\npolíticos pelo Ato Institucional nº 2 (27/10/1965) e a posterior\ninstauração do bipartidarismo, filiou-se à Aliança Renovadora Nacional\n(Arena), legenda na qual concluiu o mandato em janeiro de 1971.\nAbandonando a vida político-partidária, exilou-se na sua fazenda em\nJataí, no Sudoeste Goiano, atuando como pecuarista.\n\nIntegrou a Associação Goiana de Imprensa e a Associação de Radialistas\nde Goiás e foi presidente do Banco do Estado de Goiás - BEG. Seu nome\nbatizou escolas em Itumbiara e Mara Rosa (GO) e no Setor Central (TO).\n\nFaleceu aos 92 anos de idade em 23 de março de 2009.\n\nEra casado com Alda de Carvalho Ferreira, de quem teve três filhos.\n\n** **\n\nFONTES: COUTINHO, A. *Brasil; Grande encic. Delta*; INF. BIOG.;\nSENADO.*Dados*; SENADO. *Dados GO* (1826-1996); SENADO.*Relação*;\nSENADO.*Relação dos líderes*;**TRIB. SUP. ELEIT. *Dados*(7).\n","ref":"FONTES: COUTINHO, A. *Brasil; Grande encic. Delta*; INF. BIOG.;\nSENADO.*Dados*; SENADO. *Dados GO* (1826-1996); SENADO.*Relação*;\nSENADO.*Relação dos líderes*;**TRIB. SUP. ELEIT. *Dados*(7).\n","dic":"DHBB"}
