{"title":"FERREIRA, José Inácio","cargoss":["Senador","Constituinte","Presidente de associação ou confederação de empregados ou empregadores","Senador","Governador de estado ou do Distrito Federal"],"cargos_esp":[0,0,"Telebrás",0,0],"datas_ini":[1983,1987,1991,1995,1999],"datas_fim":[1991,1988,1992,1998,2003],"estados":["ES",0,0,"ES","ES"],"content":"**FERREIRA, José Inácio**\n\n\\*sen. ES 1983-1991; const. 1987-1988; pres. Telebrás 1991-1992; sen. ES\n1995-1998; gov. ES 1999-2003.\n\n*José Inácio Ferreira* nasceu em Vitória, no dia 18 de maio de 1939,\nfilho de Aristóbulo Inocêncio Ferreira e de Jurandi Leite Ferreira.\n\nBacharel em ciências jurídicas e sociais pela Faculdade de Direito do\nEspírito Santo e especialista em direito imobiliário e penal, iniciou a\ncarreira política elegendo-se vereador em Vitória, no pleito de 1962,\nsendo o mais votado dessa cidade. Na Câmara Municipal foi titular das\ncomissões de Justiça e de Reforma do Sistema Tributário. No pleito de\nnovembro de 1966 elegeu-se deputado estadual pela legenda do Movimento\nDemocrático Brasileiro (MDB), partido de oposição ao regime militar\ninstaurado no país em abril de 1964. Na Assembléia Legislativa integrou\na comissão especial encarregada de elaborar o texto constitucional do\nestado e a Comissão de Constituição e Justiça. Em 13 de março de 1969\nfoi atingido pelo Ato Institucional nº 5 (13/12/1968) e teve os direitos\npolíticos cassados, sendo obrigado a afastar-se da vida política.\n\nConselheiro da seccional capixaba da Ordem dos Advogados do Brasil (OAB)\ndo Espírito Santo, em 1973, assumiu a presidência da entidade em 1979.\nRestaurada a sua cidadania plena graças à Lei de Anistia de 28 de agosto\nde 1979, assinada pelo presidente da República, general João Batista\nFigueiredo, com a extinção do bipartidarismo e a conseqüente\nreformulação partidária filiou-se ao Partido do Movimento Democrático\nBrasileiro (PMDB), sucessor do MDB. Ainda em 1979 tornou-se membro da\nComissão de Justiça e Paz da Arquidiocese de Vitória.\n\nNa presidência da OAB-ES criou o jornal *Ordem Jurídica* e realizou o\nCongresso Estadual dos Advogados. Na sua gestão fundaram-se as subseções\nde Colatina, Linhares e Cachoeiro. Nomeado em 1980 vice-presidente da\nUnião Internacional dos Advogados, órgão da Organização das Nações\nUnidas (ONU), deixou a presidência da OAB-ES em 1982.\n\nNo Senado, para o qual foi eleito na legenda do PMDB, em novembro,\npresidiu a comissão do anteprojeto do novo Código de Processo Penal\nBrasileiro, relatou o capítulo referente às obrigações do Código Civil\nBrasileiro e o projeto da nova Lei de Contravenções Penais, além de\nfazer parte das comissões de Municípios e de Legislação Social.\n\nEm 1983 elegeu-se conselheiro federal da OAB e esteve em missão oficial\nna União Soviética, visitando Moscou e Leningrado.\n\nEm 1984 integrou a delegação brasileira que compareceu à reunião anual\nda Organização Internacional do Café, em Londres, e representou o\nCongresso Nacional como observador nas eleições gerais realizadas na\nNicarágua.\n\nCom a derrota da emenda Dante de Oliveira apresentada à Câmara dos\nDeputados em 25 de abril de 1984 propondo o restabelecimento das\neleições diretas para presidente da República — faltaram 22 para que\nfosse levada à apreciação do Senado — no Colégio Eleitoral, reunido em\n15 de janeiro de 1985, José Inácio Ferreira apoiou o candidato\noposicionista Tancredo Neves, eleito pela Aliança Democrática, uma união\ndo PMDB com a dissidência do Partido Democrático Social (PDS) abrigada\nna Frente Liberal. Doente, Tancredo Neves não chegou a ser empossado,\nvindo a falecer em 21 de abril de 1985. Seu substituto foi o vice José\nSarney, que já vinha exercendo o cargo interinamente, desde 15 de março\ndesse ano.\n\nEntre 1984 e 1985 José Inácio presidiu a comissão especial do Corredor\nde Exportação (Cerrados-Tubarão), e de 1985 a 1986 a Comissão de\nConstituição e Justiça, integrando também a Comissão de Redação. Em 1986\nparticipou da 41ª Assembléia Geral da ONU, em Nova Iorque, como\nobservador parlamentar, e visitou as instalações do Programa Antártico\nBrasileiro de pesquisa científica e cooperação internacional, no\ncontinente antártico.\n\nVice-líder da bancada do PMDB no Senado, declarou em 1985 que só\naceitaria os poderes constituintes concedidos aos senadores eleitos em\n1982, cujos mandatos se estenderiam até 1991, caso o eleitorado os\nreferendasse nas eleições de novembro de 1986. Todavia, não deixou de\nassumi-los em 1º de fevereiro de 1987, quando tiveram início os\ntrabalhos da Assembléia Nacional Constituinte, no curso dos quais\nparticipou como suplente da subcomissão dos Direitos Políticos, dos\nDireitos Coletivos e Garantias, da Comissão da Soberania e dos Direitos\ne Garantias do Homem e da Mulher, tendo sido um dos quatro principais\nadjuntos do deputado federal Bernardo Cabral (PMDB-AM), relator da\nComissão de Sistematização.\n\nNo plenário, votou a favor da soberania popular, do voto facultativo aos\n16 anos, do limite de 12% ao ano para os juros reais, da limitação dos\nencargos da dívida externa, do mandado de segurança coletivo, da\nremuneração 50% superior para o trabalho extra, da jornada semanal de 40\nhoras, do turno ininterrupto de seis horas e do aviso prévio\nproporcional. E contra a pena de morte, a limitação do direito de\npropriedade privada, a estatização do sistema financeiro, a\ndesapropriação da propriedade produtiva, o presidencialismo, o mandato\nde cinco anos para o então presidente José Sarney, a pluralidade\nsindical e a demissão sem justa causa.\n\nCom a promulgação da nova Carta Constitucional em 5 de outubro de 1988,\nvoltou a participar dos trabalhos legislativos ordinários, passando de\nvice-presidente do Senado a membro do Conselho da Ordem do Congresso\nNacional. De 1987 a 1988 integrou os diretórios regional e nacional do\nPMDB.\n\nAinda em 1988 presidiu a Comissão Parlamentar de Inquérito (CPI) que\ninvestigou casos de corrupção, apurando denúncias de irregularidades na\nSecretaria de Planejamento do ex-ministro Aníbal Teixeira (1987-1988).\nSob o comando de José Inácio e a vice-presidência de Itamar Franco\n(PMDB-MG), a CPI adotou métodos de interrogatório previstos no Código de\nProcesso Penal e foi a primeira a deslocar funcionários para os estados,\na fim de intimar testemunhas. As investigações concluíram que havia\nintermediações de verbas, revelando uma forte burocratização do processo\ndecisório e um apelo ao sistema de favor no governo. Mesmo assim, causou\npolêmica a solicitação de enquadramento por crime de responsabilidade do\npresidente José Sarney, do consultor-geral da República Saulo Ramos e\ndos ministros José Reinaldo Tavares, dos Transportes, João Batista de\nAbreu, do Planejamento, Maílson da Nóbrega, da Fazenda, e Antônio Carlos\nMagalhães, das Comunicações. A CPI solicitou o testemunho do presidente\npor ofício, com 67 indagações, nunca respondidas. O processo acabou\narquivado em dezembro de 1988 por ato do deputado Inocêncio de Oliveira\n(PFL-PE), no exercício da presidência da Câmara dos Deputados.\n\nNo início de 1989 José Inácio deixou o PMDB e filiou-se ao recém-criado\nPartido da Social Democracia Brasileira (PSDB). Cerca de um ano depois,\ntendo aceitado a liderança do governo Collor no Senado e ante as\ndivergências que tal fato suscitou, ingressou no Partido Social\nTrabalhista (PST).\n\nNa eleição de outubro de 1990 candidatou-se ao governo do Espírito Santo\nnuma ampla coligação liderada pelo Partido da Reconstrução Nacional\n(PRN) que elegera Collor presidente da República em dezembro de 1989,\nmas foi derrotado por Albuíno Azeredo, do Partido Democrático\nTrabalhista (PDT), coligado com o Partido Comunista do Brasil (PCdoB).\n\nJosé Inácio apresentou projeto de lei que obrigava os senadores,\ndeputados federais, deputados estaduais e vereadores a prestarem contas\nde suas atividades parlamentares por meio de um relatório a ser\nproduzi-do ao término do mandato, e um outro que permitia às pessoas\njurídicas deduzir do imposto de renda em dobro as despesas realizadas\ncom assistência médico-sanitária dos empregados.\n\nApós deixar o Senado, substituiu em abril de 1991 Jost van Damme na\npresidência das Telecomunicações do Brasil S.A. (Telebrás), cargo que\nmanteve até novembro de 1992, quando o passou a Adir da Silva.\n\nDe volta ao PSDB, no pleito de outubro de 1994 elegeu-se mais uma vez\nsenador pelo Espírito Santo, integrando as comissões de Constituição e\nJustiça e de Infra-Estrutura, nas quais permaneceria até 1998.\n\nNas votações das emendas constitucionais propostas pelo governo Fernando\nHenrique Cardoso em 1995, obediente à orientação do partido, votou a\nfavor da quebra do monopólio estatal nos setores de telecomunicações,\nexploração de petróleo, distribuição de gás canalizado e navegação de\ncabotagem, e pela mudança no conceito de empresa nacional, e a\nprorrogação do Fundo Social de Emergência (FSE), rebatizado de Fundo de\nEstabilização Fiscal (FEF), que permitia ao governo gastar até 20% da\narrecadação vinculada às áreas de saúde e de educação.\n\nEm 1996 tornou-se membro efetivo da Comissão de Orçamento no Senado. Em\njunho votou pela criação da Contribuição Provisória sobre Movimentação\nFinanceira (CPMF), que substituiu o Imposto Provisório sobre\nMovimentação Financeira (IPMF), fonte suplementar de recursos destinados\nà saúde.\n\nEm janeiro de 1997 votou a favor da emenda que previa a reeleição de\npresidente da República, governadores e prefeitos, e em novembro pela\nquebra da estabilidade do servidor público, item da reforma\nadministrativa.\n\nNas eleições de outubro de 1998, depois de ter se imposto a Paulo\nHartung na convenção do PSDB que escolheu o candidato do partido ao\ngoverno do Espírito Santo, José Inácio Ferreira saiu vitorioso no\nprimeiro turno, obtendo mais de 60% dos votos válidos.****\n\nDeixou o Senado em 31 de dezembro de 1998, sendo sua vaga ocupada pelo\nprimeiro suplente Ricardo Santos. No dia seguinte assumiu o governo\ncapixaba, sucedendo a Vítor Buaiz.****\n\nEm julho de 2001, o Ministério Público Federal encaminhou ao Superior\nTribunal de Justiça (STJ) um pedido de instauração de inquérito penal\noriginário contra José Inácio. O pedido tinha por base documentos que\napontavam uma série de irregularidades que teriam ocorrido na\nadministração do governador, dentre elas, liberação irregular de verbas\npúblicas, prática de crimes de malversação de dinheiro público, ilícitos\npenais eleitorais e tributários, além de enriquecimento ilícito. Em\nagosto, o Superior Tribunal Federal determinou que o governador, bem\ncomo as outras pessoas apontadas pelo Ministério Público como envolvidas\nna denúncia fossem interrogadas com o objetivo de apurar os indícios de\nprática de irregularidades no governo capixaba. Dentre os envolvidos,\nalém de José Inácio,estavam ainda o vice-governador capixaba Celso\nVasconcelos e a ex-secretária de Ação Social e esposa do governador,\nMaria Helena Rui Ferreira. Dois meses depois, em depoimento, José Inácio\nafirmou que desconhecia os detalhes técnicos da operação financeira que\nresultou na quitação dos débitos de sua conta de campanha.\n\nCumpriu seu mandato e deixou o governo ao final de 2002, sendo sucedido\npor Paulo Hartung, do Partido Socialista Brasileiro (PSB).\n\n Em agosto de 2003, uma nova denúncia contra José Inácio foi encaminhada\npara o STJ. Dessa vez, afirmava-se que parte dos valores desviados por\nele teria sido usado para o financiamento de aliados seus no estado, na\ncampanha eleitoral municipal de 2000. Esses valores seriam oriundos da\nFundação Augusto Ruschi, do Departamento de Estradas de Rodagens do\nEspírito Santo (DER/ES), e da Secretaria de Educação do estado. Os\nsaques teriam sido realizados diretamente na boca do caixa do Banco do\nEstado do Espírito Santo (Banestes).\n\nEm 2008, a Justiça Federal condenou José Ignácio Ferreira a cinco anos\nde prisão em regime semi-aberto e ao pagamento de multa no valor de 180\nsalários mínimos por ter concorrido para a prática do crime de gestão\ntemerária no Banestes quando era candidato ao governo estadual, em 1998,\nnuma transação bancária que teria envolvido um empréstimo a descoberto\nde R\\$ 2,6 milhões. Em 2009, foi condenado a nove anos de prisão por\ndesvio de dinheiro de um projeto social destinado a distribuir sopa a\nfamílias carentes. José Ignácio, foi condenado por formação de\nquadrilha, apropriação indébita e lavagem de dinheiro, tendo recorrido\nda sentença.\n\nAlém de advogado e professor, José Inácio Ferreira foi procurador da\nPrefeitura de Vitória; promotor de justiça nas comarcas de Santa\nLeopoldina, Alfredo Chaves, Vila Velha, Aracruz, Ibiraçu, São Mateus,\nItapemirim e Vitória; conselheiro da Comissão de Abastecimento e Preços\ndo Espírito Santo; membro da comissão especial da reforma da legislação\nda Polícia Militar do Espírito Santo.\n\nCasado com Maria Helena Rui Ferreira, teve dois filhos.\n\nPublicou *Anistia — caminho e solução*(estudo sobre hipótese de\ndesconstituição dos atos punitivos da Revolução de 1964 no Brasil);\n*Doação, não*(estudo sobre a privatização da Cia. Ferro e Aço de Vitória\n— Cofavi);*Privatização e monopólio*(estudo sobre a privatização da\nCofavi);*Dos cerrados a Tubarão*(estudo sobre a viabilização do\n“corredor de exportação” com terminal no Espírito Santo);*País das\ne**mergências*(análise da crise político-jurídico-institucional durante\no governo João Figueiredo);*O empresário na sociedade nova*; *Em favor\nda pequena empresa*; *A nova dominação*, *reflexões sobre a economia de\nmercado*;*Ação política do vereador*;*Tancredo Neves**e o Brasil\nNovo*;*Mineração e soberania nacional*;*O BNH e a reforma urbana*;*Fome\ne controle da natalidade*.\n\nRejane Araújo\n\n \n\n \n\n \n\n**FONTES**:*Folha de S. Paulo* (19/1 e 16/5/87, 29/9/98);*Folha Espírito\nSanto*. Disponível em :\n\\<[http://www.folhaes.com.br](http://www.folhaes.com.br/)\\>. Acesso em :\n20 nov. 2009;*Gazeta* (online). Disponível em :\n\\<[http://gazetaonline.globo.com](http://gazetaonline.globo.com/_conteudo/2009/05/513432-justica+condena+jose+ignacio+a+quatro+anos+de+prisao.html)\\>.\nAcesso em :  20 nov. 2009;*Globo* (7/11/92); *Jornal do Brasil*\n(15/2/85); *Jornal do Senado* (7/1/99); *Perfil parlamentar brasileiro;*\nSENADO.*Dados biográficos* (1983-1991,~~e~~ 1995-2002); Portal Direito2.\nDisponível em : \\<[http://www.\ndireito2.com.br](http://www.%20direito2.com.br/)\\>. Acesso em : 20 nov.\n2009. ~~ ~~*~~Portal~~**~~Folha\nEspírito~~**~~Santo~~*~~(~~~~[http://www.folhaes.com.br/](http://www.folhaes.com.br/)~~~~;\nacessado em 20/11/2009);~~~~~~~~Portal\nDireito~~~~~~~~2~~~~(~~~~[http://www.direito2.com.br/](http://www.direito2.com.br/stj/2001/jul/17/chega_ao_stj_pedido_do_mpf_para_instauracao_de_inquerito_penal)~~~~;\nacessado em 20/11/2009);~~*~~~~**~~Portal Gazeta\non-line.~~*~~(~~~~[http://gazetaonline.globo.com/](http://gazetaonline.globo.com/_conteudo/2009/05/513432-justica+condena+jose+ignacio+a+quatro+anos+de+prisao.html)~~~~acessado\nem 20/11/2009);~~\n\n \n\n \n","ref":"","dic":"DHBB"}
