{"title":"FERREIRA, Marcos","cargoss":["Deputado federal"],"cargos_esp":[0],"datas_ini":[1954],"datas_fim":[1955],"estados":["SE"],"autor":[0],"content":"**FERREIRA, Marcos**\n\n\\*dep. fed. SE 1954-1955.\n\n \n\n*Marcos Ferreira de Jesus*****nasceu em Simão Dias (SE) no dia 24 de\nmarço de 1893, filho de Marcos Ferreira de Jesus e de Maria de Araújo\nFerreira.\n\nCursou o Colégio Bizarria e o Ginásio da Bahia, em Salvador, antes de\ningressar na Faculdade de Medicina da Bahia, concluindo o curso de\nfarmácia em 1915.\n\nFarmacêutico e professor, colaborou na imprensa sergipana, tendo chegado\na diretor do Diário de Sergipe. Foi inspetor-geral do ensino primário e\nnormal, diretor de um grupo escolar e prefeito de Simão Dias por duas\nvezes. Ocupou ainda a diretoria do Departamento de Municipalidades, a\nsubsecretaria e o cargo de secretário-geral do estado. Entre 1946 e\n1947, durante a interventoria de Antônio de Freitas Brandão, ocupou\ninterinamente o governo estadual. Em janeiro de 1947, elegeu-se deputado\nà Assembléia Legislativa de Sergipe e suplente de senador pelo mesmo\nestado, na legenda do Partido Social Democrático (PSD). Presidente da\nAssembléia Legislativa, logo depois renunciou ao mandato para assumir a\nprefeitura de Aracaju, durante o governo de José Rollemberg Leite\n(1947-1951).\n\nEm outubro de 1950, elegeu-se suplente de deputado federal por Sergipe\nna legenda do PSD. Assumiu uma cadeira na Câmara em abril de 1954, com a\nmorte de Antônio Manuel de Carvalho Neto, nela permanecendo até o\nfinal****da legislatura (31/1/1955). Abandonando a vida pública, passou\na dedicar-se a atividades intelectuais e à maçonaria.\n\nMarcos Ferreira foi ainda membro e vice-presidente da Academia Sergipana\nde Letras, presidente da Associação Sergipana de Imprensa, do Instituto\nHistórico e Geográfico Sergipano e do Conselho Regional de Farmácia,\nsecretário-geral de cultura artística e executivo da Caixa Econômica\nFederal de seu estado.\n\nFaleceu em Sergipe, no dia 1º de dezembro de 1983.\n\nEra casado com Olga de Sá Ferreira, com quem teve três filhos.\n\n \n\nFONTES: CÂM. DEP. *Deputados*; CISNEIROS, A. *Parlamentares*; INF.\nCordélia de Sá Ferreira e Luís Antônio Barreto.\n\n \n","ref":"FONTES: CÂM. DEP. *Deputados*; CISNEIROS, A. *Parlamentares*; INF.\nCordélia de Sá Ferreira e Luís Antônio Barreto.\n\n \n","dic":"DHBB"}
