{"title":"FERREIRA, Sebastião","cargoss":["Deputado federal"],"cargos_esp":[0],"datas_ini":[1991],"datas_fim":[1992],"estados":["BA"],"autor":[0],"content":"**FERREIRA, Sebastião**\n\n\\*dep. fed. BA 1991-1992.\n\n \n\n*Sebastião Ferreira Silva* nasceu em Barreiras (BA), no dia 20 de\njaneiro de 1941, filho de Solon José Ferreira e de Almira Silva\nFerreira.\n\nElegeu-se deputado estadual na legenda do Partido do Movimento\nDemocrático Brasileiro (PMDB) em novembro de 1982. Empossado em\nfevereiro do ano seguinte foi titular da Comissão de Agricultura.\nExerceu o mandato até o final da legislatura, em janeiro de 1987.\n\nEm 1990 candidatou-se a deputado federal. Vitorioso, tomou posse em\nfevereiro de 1991. Titular da Comissão de Agricultura e Política Rural e\nsuplente da Comissão de Viação e Transportes, Desenvolvimento Urbano e\nInterior, faleceu num acidente aéreo, no dia 28 de fevereiro de 1992,\njuntamente com seus três filhos, mais a tripulação, quando viajava de\nGoiânia para Paraguarina (TO). Sua vaga na Câmara foi ocupada por Sérgio\nTourinho Dantas.\n\nEra casado com Marina Castro Silva.\n\n \n\nFONTES: CÂM. DEP. *Deputados brasileiros. Repertório* (1991-1995);\n*Globo* (1/3/92).\n\n \n","ref":"FONTES: CÂM. DEP. *Deputados brasileiros. Repertório* (1991-1995);\n*Globo* (1/3/92).\n\n \n","dic":"DHBB"}
