{"title":"FIALHO, Argemiro","cargoss":["Constituinte","Deputado federal"],"cargos_esp":[0,0],"datas_ini":[1946,1946],"datas_fim":[1946,1951],"estados":[0,"MT"],"autor":[0],"content":"**FIALHO, Argemiro**\n\n\\*const. 1946; dep. fed. MT 1946-1951.\n\n \n\n*Argemiro de Arruda Fialho* nasceu em Campo Grande, então no estado de\nMato Grosso, no dia 29 de dezembro de 1908, filho de Argemiro Arruda\nFialho e de Amélia Pereira Arruda Fialho.\n\nBacharel pela Faculdade Nacional de Direito do Rio de Janeiro, então\nDistrito Federal, em 1932, advogou por algum tempo em sua cidade natal.\n\nEm dezembro de 1945, elegeu-se deputado por Mato Grosso à Assembléia\nNacional Constituinte na legenda do Partido Social Democrático (PSD),\nassumindo o mandato em fevereiro de 1946. Participou dos trabalhos\nconstituintes e, após a promulgação da nova Carta Constitucional\n(setembro de 1946) e a transformação da Assembléia em Congresso\nordinário, tornou-se membro da Comissão Permanente de Legislação Social.\nCandidatou-se à reeleição em outubro de 1950 e, obtendo apenas uma\nsuplência, deixou a Câmara ao final da legislatura (31/1/1951).\n\nFaleceu em 1975.\n\n \n\nFONTES: CÂM. DEP. *Deputados*; CÂM. DEP. *Relação dos dep.;* *Diário do\nCongresso Nacional*; INF. Louremberger Alves; MENDONÇA, R. *Dic*.;\nSILVA, G. *Constituinte*.\n\n \n","ref":"FONTES: CÂM. DEP. *Deputados*; CÂM. DEP. *Relação dos dep.;* *Diário do\nCongresso Nacional*; INF. Louremberger Alves; MENDONÇA, R. *Dic*.;\nSILVA, G. *Constituinte*.\n\n \n","dic":"DHBB"}
