{"title":"ABREU, Dorival de ","cargoss":["Deputado federal"],"cargos_esp":[0],"datas_ini":[1967],"datas_fim":[1969],"estados":["SP"],"autor":[0],"content":"**ABREU, Dorival de **\n\n\\* dep. fed. SP 1967-1969.\n\n*Dorival Masci de Abreu*nasceu na cidade de São Paulo em 26 de julho de\n1933, filho de José Guimarães de Abreu e de Joana Masci de Abreu. Seu\nirmão, José Masci de Abreu, foi deputado federal por São Paulo entre\n1995 e 1999, reeleito em outubro de 1998.\n\nEm 1947 tornou-se radialista e três anos depois passou a exercer também\na atividade de jornalista. Iniciou o curso da Faculdade de Direito de\nBragança (SP), que não concluiu, formando-se em administração de\nempresas no início da década de 1960. Em novembro de 1966 elegeu-se\ndeputado federal por São Paulo na legenda do Movimento Democrático\nBrasileiro (MDB), partido de oposição ao regime militar instaurado no\npaís em abril de 1964, assumindo o mandato em fevereiro do ano seguinte.\nEm conseqüência do Ato Institucional nº 5 (13/12/68), foi cassado e teve\nsuspensos os seus direitos políticos em 16 de janeiro de 1969.\n\nAfastado da vida pública, durante a década de 1970 retomou sua atividade\nde radialista e passou também a trabalhar na siderúrgica Sidelpa e na\nempresa de fundição de aço Eletroaço Marconi, ambas de sua propriedade.\nEm 1976 foi fundador da Rádio Marconi em São Paulo.\n\nNas eleições de novembro de 1982, candidatou-se à Câmara dos Deputados\nna legenda do PMDB, obtendo uma suplência. Em 1986 foi fundador do\nrecriado Partido Trabalhista Nacional (PTN), assumindo a presidência\nnacional da agremiação. Nesta legenda, candidatou-se à prefeitura de São\nPaulo no pleito de outubro de 1996, obtendo a penúltima colocação. Em\n1998 chegou a ser indicado pelo PTN candidato à presidência da\nRepública, porém acabou sendo substituído por Teresa Ruiz, que alcançou\napenas a décima colocação.\n\nDorival de Abreu casou-se com Teresa Oliveira de Abreu.\n\n\nFONTES: ARQ. DEP. PESQ. JORNAL DO BRASIL;**CÂM. DEP*. Deputados\nbrasileiros. Repertório* (1967-1971); INF. BIOG.; *Folha de São Paulo*\n(23/9 e 16/12/96); NICOLAU, J. *Dados.*\n","ref":"FONTES: ARQ. DEP. PESQ. JORNAL DO BRASIL;**CÂM. DEP*. Deputados\nbrasileiros. Repertório* (1967-1971); INF. BIOG.; *Folha de São Paulo*\n(23/9 e 16/12/96); NICOLAU, J. *Dados.*\n","dic":"DHBB"}
