{"title":"FIGUEIREDO, Feliciano de","cargoss":["Deputado federal"],"cargos_esp":[0],"datas_ini":[1967],"datas_fim":[1969],"estados":["MT"],"autor":[0],"content":"**FIGUEIREDO, Feliciano de**\n\n\\*dep. fed. MT 1967-1969.\n\n \n\n*José Feliciano de Figueiredo* nasceu em Cuiabá no dia 29 de outubro de\n1916, filho de Agostinho Simplício de Figueiredo e de Manuela Botelho de\nFigueiredo.\n\nBacharelou-se pela Faculdade de Direito de Niterói em 1940, retornando\nmais tarde à capital mato-grossense. Professor de direito comercial na\nEscola Técnica de Comércio de Cuiabá, foi assessor técnico e jurídico da\nAssembléia Legislativa de Mato Grosso. Em 1950, foi nomeado procurador\nfiscal do Tesouro de Mato Grosso, elegendo-se, em outubro, suplente de\ndeputado à Assembléia do estado na legenda da União Democrática Nacional\n(UDN).\n\nNovamente candidato a deputado estadual no pleito de 1954, elegeu-se,\nainda na legenda da UDN, assumindo o mandato em fevereiro de 1955. Em\noutubro de 1958, voltou a eleger-se suplente de deputado estadual.\nAssessor Legislativo do estado de Mato Grosso, licencou-se do cargo a\nfim de concorrer às eleições de novembro de 1966.\n\nEm conseqüência da extinção dos partidos políticos pelo Ato\nInstitucional nº 2 (27/10/1965) e da posterior instauração do\nbipartidarismo, filiou-se ao Movimento Democrático Brasileiro (MDB),\npartido de oposição ao regime militar instaurado no país em abril de\n1964, em cuja legenda elegeu-se deputado federal por Mato Grosso. Ocupou\numa cadeira na Câmara de fevereiro de 1967 a 29 de abril de 1969, quando\nteve seu mandato cassado e os direitos políticos suspensos com base no\nAto Institucional nº 5, de 13 de dezembro do ano anterior, retornando\nentão ao cargo de assessor da presidência da Assembléia Legislativa do\nestado. Com a revogação do AI-5 teve os seus direitos políticos\nrestaurados.\n\nDedicou-se ao cargo de assessor legislativo, não disputando, porém, mais\nnenhum mandato eletivo.\n\nFaleceu em Cuiabá no dia 1º de junho de 1988.\n\nEra casado com Dirce Ferreira de Figueiredo.\n\n \n\nFONTES: ARQ. DEP. PESQ. JORNAL DO BRASIL; CÂM. DEP. *Deputados*; CÂM.\nDEP. *Deputados brasileiros. Repertório* (1967-1971); INF. FAM.\n\n \n","ref":"FONTES: ARQ. DEP. PESQ. JORNAL DO BRASIL; CÂM. DEP. *Deputados*; CÂM.\nDEP. *Deputados brasileiros. Repertório* (1967-1971); INF. FAM.\n\n \n","dic":"DHBB"}
