{"title":"FILOMENO, Sérgio","cargoss":["Deputado federal","Deputado federal"],"cargos_esp":[0,0],"datas_ini":[1984,1983],"datas_fim":[1987,0],"estados":["CE","CE"],"autor":[0],"content":"**FILOMENO, Sérgio**\n\n\\*dep. fed. CE 1983, 1984-1987.\n\n \n\n*Sérgio Moreira Filomeno Gomes* nasceu em Fortaleza no dia 2 de março de\n1941, filho de José Maria Filomeno Gomes e de Susana Moreira Filomeno\nGomes. Seu irmão Cláudio Filomeno foi deputado federal pelo Ceará de\n1979 a 1987.\n\nIndustrial, formou-se em economia pela Universidade Federal do Ceará em\n1965.\n\nNas eleições de novembro de 1982, apoiado pelo irmão e após uma das mais\ncaras campanhas já registradas no estado, elegeu-se deputado federal\npela legenda do Partido Democrático Social (PDS). Tomou posse em\nfevereiro de 1983. Em abril, advogados do Partido do Movimento\nDemocrático Brasileiro (PMDB) entraram com recurso junto ao Tribunal\nRegional Eleitoral do Ceará, solicitando a sua impugnação.\n\nCaracterizado o abuso de poder econômico e a conseqüente infração ao\nCódigo Eleitoral, Sérgio Filomeno teve o mandato cassado pelo TRE-CE.\nPor conta disso, não compareceu à sessão da Câmara dos Deputados reunida\nno dia 25 de abril de 1984, em que a Câmara rejeitou a emenda Dante de\nOliveira, que previa o restabelecimento das eleições diretas para\npresidente da República já em novembro.\n\nFilomeno recorreu, alegando ter sido diplomado, e em dezembro de 1984\nfoi reinvestido no cargo por decisão do Tribunal Superior Eleitoral\n(TSE). Mesmo assim, perplexos diante das “estarrecedoras denúncias sobre\no comportamento dos candidatos na condução de suas campanhas” no Ceará,\nos ministros do TSE insistiram para que as investigações prosseguissem,\na fim de averiguar a existência de outros crimes.\n\nTitular da Comissão de Economia, no Colégio Eleitoral, reunido em 15 de\njaneiro de 1985, apoiou o candidato oposicionista Tancredo Neves, eleito\npela Aliança Democrática, uma união do PMDB com a dissidência do PDS\nabrigada na Frente Liberal. Doente, Tancredo Neves não chegou a ser\nempossado, vindo a falecer em 21 de abril de 1985. Seu substituto foi o\nvice José Sarney, que já vinha exercendo o cargo interinamente, desde 15\nde março desse ano.\n\nEm agosto de 1985 Sérgio Filomeno participou da fundação do Partido\nLiberal (PL), tornando-se presidente do diretório da agremiação no\nCeará. Em convenção realizada no dia 4 de agosto de 1985 foi lançado\ncandidato à prefeitura de Fortaleza.\n\nNo dia 20 de agosto, porém, o Ministério Público, representado pela\npromotora de justiça Francisca Odília Fontenele, apresentou ao juiz da\n1ª Zona Eleitoral de Fortaleza pedido de impugnação da sua candidatura,\nbaseado na condenação de 1983 que não teria perdido a validade. Ainda\nassim, Sérgio Filomeno conseguiu disputar as eleições municipais de\nnovembro de 1985, sendo derrotado pela candidata do Partido dos\nTrabalhadores (PT), Maria Luísa Fontenele.\n\nDeixou a Câmara dos Deputados ao término da legislatura, em janeiro de\n1987, vindo a falecer no Rio de Janeiro, em 24 de abril de 1987.\n\nEra casado com Ana Maria Fontenele Filomeno Gomes, com quem teve dois\nfilhos.\n\n \n\nFONTES: CÂM. DEP. *Deputados brasileiros. Repertório* (1983-1987);\n*Folha de S. Paulo* (12/12/84, 4/8/85); *Globo* (27/4/83, 21/8 e\n21/9/85, 25 e 26/4/87); *Jornal do Brasil* (21/7 e 5/8/85).\n\n \n","ref":"FONTES: CÂM. DEP. *Deputados brasileiros. Repertório* (1983-1987);\n*Folha de S. Paulo* (12/12/84, 4/8/85); *Globo* (27/4/83, 21/8 e\n21/9/85, 25 e 26/4/87); *Jornal do Brasil* (21/7 e 5/8/85).\n\n \n","dic":"DHBB"}
