{"title":"FIQUENE, José de Ribamar","cargoss":["Governador de estado ou do Distrito Federal","Senador","Senador"],"cargos_esp":[0,0,0],"datas_ini":[1994,2005,2000],"datas_fim":[1994,2005,0],"estados":["MA","MA","MA"],"autor":[0],"content":"**FIQUENE, José de Ribamar**\n\n\\*gov. MA 1994; sen. MA 2000, 2005.\n\n** \n\n*José de Ribamar Fiquene* nasceu em Itapecuru-Mirim (MA) no dia 27 de\ndezembro de 1930, filho de Wady Fiquene e de Delaê Correia Fiquene.\n\nEstudou nos colégios Maranhense e São Luís, na capital do estado, e\nbacharelou-se pela Faculdade de Direito de São Luís, atualmente\nintegrante da Universidade Federal do Maranhão (UFMA). Tornou-se\nadvogado do estado e em 1959 foi nomeado promotor público, função que\nexerceu até 1962, quando ingressou na magistratura.\n\nProfessor de língua portuguesa e literatura em diversas escolas da\ncapital e do interior do estado, bem como professor titular das cadeiras\nde teoria geral do Estado e de estudos dos problemas brasileiros da\nFaculdade de Educação de Imperatriz (MA), da qual foi fundador, Fiquene\nfundou várias unidades de ensino em diversos municípios do estado, entre\nos quais Presidente Dutra, Tuntum e Graça Aranha. Em 1979 foi nomeado\nreitor da Universidade Estadual do Maranhão (UEMA).\n\nIngressou na política em 1982 filiando-se ao Partido Democrático Social\n(PDS), agremiação que dava apoio ao regime militar vigente no país, em\ncuja legenda foi eleito prefeito de Imperatriz no pleito de novembro de\n1982. Assumindo sua cadeira no Executivo municipal em janeiro de 1983,\ncom a desintegração do PDS em 1984, cuja dissidência proporcionou o\nsurgimento do Partido da Frente Liberal (PFL) em 1985, Fiquene filiou-se\na essa nova legenda. Ganhou mais dois anos na chefia do Executivo de\nImperatriz com a prorrogação dos mandatos de prefeitos e vereadores,\npara que suas eleições voltassem a ocorrer em período diferente das\ndemais. Exerceu seu mandato até 31 de dezembro de 1988, passando a\nchefia da prefeitura do município ao seu sucessor em 1º de janeiro do\nano seguinte. Nesse ano de 1989 tornou-se superintendente da Legião\nBrasileira de Assistência (LBA) no Maranhão.\n\nDiante das articulações para a escolha dos candidatos do PFL para\nconcorrer ao governo do estado em 1990, Fiquene foi indicado para\nintegrar, como vice, a chapa dessa agremiação encabeçada pelo senador\nEdson Lobão. No pleito de outubro desse ano foi eleito vice-governador\ndo estado na legenda da coligação comandada pelo PFL e integrada pelos\npartidos Trabalhista Brasileiro (PTB) e Social Cristão (PSC). Tomando\nposse do seu novo cargo em março do ano seguinte, exerceu essa função\naté abril de 1994, quando assumiu o governo do estado, já que Lobão\ndeixara o cargo, desincompatibilizando-se do mesmo para concorrer a uma\ncadeira no Senado. Em 1º de janeiro de 1995 passou a chefia do Executivo\nmaranhense a Roseana Sarney, eleita governadora em outubro do ano\nanterior. Passou, então, a colaborar com artigos e crônicas para jornais\nde São Luís e Imperatriz, bem como a proferir palestras e conferências\nna capital e no interior do estado.\n\nEm 1998, ainda filiado ao PFL, teve o seu nome escolhido para compor,\ncomo primeiro suplente, a chapa para o Senado, cujo titular era João\nAlberto de Sousa, do Partido do Movimento Democrático Brasileiro (PMDB).\nCom a eleição do titular no pleito de outubro desse ano, tornou-se\nsuplente de senador. Em maio de 2000, foi empossado no cargo, devido à\nlicença obtida por seu titular, João Alberto, para realizar um\ntratamento de saúde. Em seu primeiro pronunciamento como senador,\nFiquene afirmou que pretendia dar continuidade ao trabalho desenvolvido\npelo seu antecessor. Neste mandato, votou a favor da alteração na\nConstituição Federal para assegurar os recursos mínimos para o\nfinanciamento das ações e serviços públicos de saúde; da prorrogação,\npor dez anos, da aplicação, por parte da União, de percentuais mínimos\ndo total dos recursos destinados à irrigação nas Regiões Centro-Oeste e\nNordeste; e da alteração sobre o imposto dos Estados e do Distrito\nFederal sobre operações relativas à circulação de mercadorias e sobre\nprestações de serviços de transporte interestadual e intermunicipal e de\ncomunicação. Votou contra a criação da Agência Nacional de Águas (ANA)\nentidade federal de implementação da Política Nacional de Recursos\nHídricos e de coordenação do Sistema Nacional de Gerenciamento de\nRecursos Hídricos. Fiquene permaneceu no cargo até outubro de 2000,\nquando João Alberto retornou da licença médica.\n\nEm junho de 2005, João Alberto afastou-se novamente do Senado para\ntratamento médico, e Fiquene mais uma vez assumiu seu assento. Nesse\nsegundo mandato, apresentou, em plenário, proposta de emenda à\nConstituição (PEC) para conceder às Câmaras Municipais o poder de fixar\no número de seus vereadores, de acordo com os critérios de extensão\nterritorial, dimensão populacional e a realidade socioeconômica de cada\nmunicípio. Além disso, votou a favor da modificação do limite de idade\npara a aposentadoria compulsória do servidor público em geral; do\nprojeto que beneficiava, com licença-maternidade, as mulheres que\nadotarem crianças; e da ampliação da vigência do Fundo de Manutenção e\nDesenvolvimento do Ensino Fundamental e de Valorização do Magistério\n(Fundef). Fiquene permaneceu no cargo até outubro de 2005, quando a\nlicença médica de João Alberto chegou ao fim.\n\nNas eleições de outubro de 2006, João Alberto foi indicado para ser\ncandidato a vice-governador na chapa encabeçada por Roseana Sarney,\ntambém do PMDB. Nesse mesmo pleito, Fiquene foi escolhido para compor a\nchapa de Epitácio Cafeteira, candidato ao Senado pelo PTB. Com a eleição\ndo titular, tornou-se seu segundo suplente.\n\nFoi ainda fundador da Academia Imperatrizense de Letras.\n\nCasou-se com Cenira Massoli Fiquene, com quem teve oito filhos.\n\nFaleceu em São Luís no dia 2 de janeiro de 2011.\n\nPublicou *O Alvorecer*(crônicas, 1992), *Lampejos*(poesias, 1994) e\n*Luzes do Amanhã* (crônicas, 2004).\n\n \n\n \n\nFONTES: CURRIC. BIOG.; INF. BIOG.; *Agência Senado* (26/05/00); Jornal\nPequeno (4/1/11); Tribunal Regional Eleitoral do Maranhão. *Eleições\n2006.*\n\n \n","ref":"FONTES: CURRIC. BIOG.; INF. BIOG.; *Agência Senado* (26/05/00); Jornal\nPequeno (4/1/11); Tribunal Regional Eleitoral do Maranhão. *Eleições\n2006.*\n\n \n","dic":"DHBB"}
