{"title":"AMADO, Ariosto","cargoss":["Deputado federal"],"cargos_esp":[0],"datas_ini":[1963],"datas_fim":[1967],"estados":["SE"],"autor":[0],"content":"**AMADO, Ariosto**\n\n\\*dep. fed. SE 1963-1967.\n\n* *\n\n*Ariosto Mesquita Amado* nasceu em Aracaju no dia 27 de outubro de 1920,\nfilho de José Montalvão Amado e de Amália Mesquita Amado.\n\nFormado em direito em 1945, em Salvador, nesse mesmo ano transferiu-se\npara o Rio de Janeiro, onde dedicou-se ao exercício da advocacia.\n\nIngressando na carreira política, candidatou-se a deputado federal por\nSergipe na legenda do Partido Trabalhista Brasileiro (PTB) nas eleições\nde outubro de 1950, mas não foi bem-sucedido. Quatro anos depois, voltou\na disputar uma vaga na Câmara dos Deputados, desta feita pela União\nDemocrática Nacional (UDN), mas novamente não conseguiu se eleger.\n\nArmador, fundou em 1958, no Rio de Janeiro, a Companhia de Navegação\nMarítima Netumar, uma das maiores empresas brasileiras do setor e da\nqual tornou-se diretor executivo. Foi também fundador e presidente por\ndiversas vezes da Associação dos Armadores Brasileiros de Longo Curso e\ndo Sindicato dos Armadores de Marinha Mercante.\n\nNo pleito de outubro de 1962, tentou mais uma vez ingressar na carreira\npolítica, concorrendo novamente pelo PTB a um mandato de deputado\nfederal por Sergipe. Contudo, obteve apenas uma suplência. Foi empossado\nna Câmara em 10 de maio de 1963, substituindo Armando Rollemberg, que\ndeixara sua cadeira na Câmara para ser ministro do Tribunal Federal de\nRecursos.\n\nEm conseqüência da extinção dos partidos políticos pelo Ato\nInstitucional nº 2 (27/10/1965) e da posterior instauração do\nbipartidarismo, filiou-se em 1966 ao Movimento Democrático Brasileiro\n(MDB), partido de oposição ao regime militar instaurado no país em abril\nde 1964. Por essa legenda, candidatou-se à reeleição no pleito de\noutubro de 1966, mas não foi bem-sucedido. Deixou a Câmara dos Deputados\nem janeiro de 1967, ao final da legislatura.\n\nAbandonou a carreira política, voltando a dedicar-se a suas atividades\nempresariais na Netumar.\n\nFoi também jornalista, assinando uma coluna no jornal A Gazeta, de\nAracaju.\n\nFaleceu em Petrópolis (RJ), no dia 15 de dezembro de 1985, vítima de\nacidente automobilístico.\n\n Era casado com Maria Auxiliadora Amado, com quem teve um filho.\n\n \n\nFONTES:****CÂM. DEP. *Deputados*; CÂM. DEP. *Deputados brasileiros.\nRepertório* (1963-1967); *Globo* (16/12/85); INF. FAM.; *Jornal do\nBrasil* (17/12/85).\n\n \n","ref":"FONTES:****CÂM. DEP. *Deputados*; CÂM. DEP. *Deputados brasileiros.\nRepertório* (1963-1967); *Globo* (16/12/85); INF. FAM.; *Jornal do\nBrasil* (17/12/85).\n\n \n","dic":"DHBB"}
