{"title":"FONSECA, Genervino","cargoss":["Deputado federal"],"cargos_esp":[0],"datas_ini":[1975],"datas_fim":[1979],"estados":["GO"],"autor":[0],"content":"**FONSECA, Genervino**\n\n\\*dep. fed. GO 1975-1979.\n\n* *\n\n*Genervino Evangelista Fonseca* nasceu em Catalão (GO) no dia 4 de\nsetembro de 1919, filho de João Alfredo da Fonseca e de Erondina\nEvangelista da Fonseca.\n\nIndustrial e fazendeiro, em 1949 fundou o Frigorífico Vale do Paranaíba,\nna sua cidade natal.\n\nFoi secretário da Indústria e Comércio de seu estado antes de eleger-se\ndeputado federal em novembro de 1974, na legenda do Movimento\nDemocrático Brasileiro (MDB), partido de oposição ao regime militar\ninstalado no país em abril de 1964. Assumindo o mandato em fevereiro de\n1975, participou na Câmara da Comissão de Economia, Indústria e\nComércio, e foi suplente da Comissão de Desenvolvimento da Região\nCentro-Oeste. Em maio de 1977, tornou-se presidente da Comissão\nParlamentar de Inquérito (CPI) do Sistema Fundiário, instalada na Câmara\nFederal para apurar denúncias de grilagem e violência em litígios\nrelativos à posse da terra. Em agosto desse ano, destacou-se nessa CPI\npor sua atuação favorável a quatro posseiros de Formosa (GO) contra o\nfazendeiro Alair Rosa Ribeiro.\n\nAinda em 1977, no mês de novembro, integrando a ala radical do MDB,\nparticipou de uma reunião com o marechal Osvaldo Cordeiro de Farias, com\no objetivo de discutir as propostas de reforma institucional do governo.\nRealizado o encontro, os radicais oposicionistas, embora denunciassem a\ninexistência de fatos concretos que pudessem fundamentar qualquer\nexpectativa de abertura do regime, reafirmaram por outro lado sua\ndisposição de lutar por pressupostos democráticos que viessem, numa\nreabertura por etapas, garantir a convocação de uma assembléia nacional\nconstituinte, condenando “remanejos que busquem apenas reciclar o atual\nsistema”.\n\nCandidatou-se à reeleição no pleito de novembro de 1978, mas obteve\napenas uma suplência e concluiu seu mandato anterior em janeiro de 1979.\nEm novembro, com o fim do bipartidarismo e a conseqüente reorganização\npartidária, filiou-se ao Partido do Movimento Democrático Brasileiro\n(PMDB).\n\nNo ano seguinte, juntamente com os irmãos Henrique e Ademar Santillo,\ncom quem formava um dos grupos de oposição mais fortes de Goiás, deixou\nesta agremiação para filiar-se e fundar o Partido dos Trabalhadores (PT)\nno estado, onde permaneceu por apenas oito meses. Esta troca deveu-se à\nexistência de duas candidaturas declaradas ao governo do estado — as de\nHenrique Santillo e do ex-prefeito de Goiânia, Íris Resende que,\naliando-se ao ex-governador Mauro Borges, conseguiu o apoio de 11 dos 14\ndeputados estaduais e cinco dos federais, além de um senador. Essa\nacumulação de forças fez com que seu grupo influísse decisivamente na\nformação da Executiva Nacional, provocando o afastamento do grupo dos\nirmãos Santillo.\n\nDe volta ao PMDB, continuou atuando nos bastidores da vida política e,\nno pleito de novembro de 1986, foi um dos coordenadores da campanha\nvitoriosa de Henrique Santillo ao governo do estado. Ainda nesse ano,\nfoi nomeado vice-presidente e diretor econômico-financeiro das Centrais\nElétricas de Goiás (Celg), cargo em que permaneceu até 1987. Nesse ano,\ntransferiu-se para Brasília, vindo a ocupar o cargo de secretário do\nescritório de representação de Goiás na capital federal. Deixou o cargo\nem 1991, ao final da gestão de Santillo. Por motivos de saúde, não mais\nocupou qualquer cargo público.\n\nEm 2003, seu nome foi incluído em uma lista de 316 beneficiários da Lei\nde Anistia, objetivando a reparação de danos causados às vítimas de\nperseguição da ditadura militar em Goiás. Mas a Comissão de Anistia,\npresidida pelo deputado João da Silva Neto, deu início a uma\ncontrovérsia, pois o montante da dívida de reparação a ser paga pelos\ncofres do estado – 6.248.547,64 reais – ultrapassava em muito os limites\nestabelecidos pela própria Lei de Anistia de Goiás. O artigo 21 da mesma\nprevia que “em nenhuma hipótese a soma dos pagamentos das reparações\neconômicas poderá exceder a quantia anual de 1.140.000,00 reais, valor\nestimado do respectivo impacto orçamentário-financeiro”. A polêmica\naumentou com a denúncia do Jornal Opção de que a lista contemplava\npessoas – não declaradas – que não foram perseguidas pelo regime\nmilitar. Com base no referido artigo da Lei de Anistia, e argumentando\nque a efetivação das indenizações comprometeria áreas essenciais da\nadministração, o então governador Marconi Perillo suspendeu os\npagamentos. A Genervino Fonseca e a outros beneficiários foi estipulada\numa indenização no valor de 6.000 reais, a mais alta da lista, que\npartia de 900 reais.\n\nCasou-se com Edite Ulhoa Fonseca, com quem teve quatro filhos.\n\nFONTES: CÂM. DEP. Deputados; CÂM. DEP. Deputados brasileiros. Repertório\n(1975-1979); INF. FAM.; Jornal do Brasil (23/8, 11 e 12/11/77); NÉRI, S.\n16; Opção On-line (15 a 21/6/2003).\n\n \n","ref":"FONTES: CÂM. DEP. Deputados; CÂM. DEP. Deputados brasileiros. Repertório\n(1975-1979); INF. FAM.; Jornal do Brasil (23/8, 11 e 12/11/77); NÉRI, S.\n16; Opção On-line (15 a 21/6/2003).\n\n \n","dic":"DHBB"}
