{"title":"FONSECA, José Carlos","cargoss":["Deputado federal","Deputado federal"],"cargos_esp":[0,0],"datas_ini":[1983,1971],"datas_fim":[1987,1975],"estados":["ES","ES"],"autor":[0],"content":"**FONSECA, José Carlos**\n\n\\*dep. fed. ES 1971-1975 e 1983-1987.\n\n* *\n\n*José Carlos da Fonseca* nasceu em São José do Calçado (ES) no dia 21 de\njulho de 1931, filho de Luís Teixeira da Fonseca e de Carolina Nunes da\nFonseca.\n\nOficial-de-gabinete do governador do Espírito Santo em 1954 e secretário\ndo jornal *O Diário* e da sucursal de *O Jornal* em Vitória em 1955,\nbacharelou-se pela Faculdade de Direito de Vitória em 1957. No ano\nseguinte foi nomeado chefe de gabinete do presidente do Serviço Social\nRural (atual Instituto Nacional de Colonização e Reforma Agrária —\nINCRA), no Rio de Janeiro, então Distrito Federal, e, em 1959, tornou-se\nprocurador autárquico e chefe do serviço jurídico desse órgão. Em 1960\nconcluiu o curso de pós-graduação em sociologia, realizado em Vitória.\nFez ainda, no Rio, o curso de filosofia na Academia Brasileira de\nLetras, em 1962, e de direito agrário na Pontifícia Universidade\nCatólica (PUC) em 1963.\n\nMembro do Conselho Nacional de Cooperativismo, depois do movimento\npolítico-militar de 31 de março de 1964, que depôs o presidente João\nGoulart (1961-1964), foi nomeado presidente de diversos inquéritos\nadministrativos na Superintendência para a Reforma Agrária (Supra).\nDurante toda a década de 1960 presidiu a Campanha Nacional de Escolas da\nComunidade (CNEC) no Espírito Santo.\n\nNo pleito de novembro de 1966, elegeu-se deputado à Assembléia\nLegislativa espírito-santense (ALES) na legenda da Aliança Renovadora\nNacional (Arena), partido de sustentação ao regime militar, iniciando o\nmandato no início do ano seguinte, quando então viajou à Alemanha, a\nconvite do respectivo governo, integrando um grupo de parlamentares da\nALES em visita ao Parlamento alemão. Ainda em 1967 presidiu a Comissão\nEspecial de Adaptação Constitucional e foi membro da Comissão de\nJustiça, além de tornar-se líder da maioria governista na Assembléia,\nantes de ser nomeado em 1968, no governo de Cristiano Dias Lopes\n(1967-1971), chefe do Gabinete Civil do estado, cargo que exerceu até\n1970.\n\nEleito deputado federal pelo Espírito Santo em novembro de 1970, com a\nsegunda maior votação dada a um candidato arenista no estado, assumiu o\nmandato na Câmara em fevereiro de 1971. Nesse ano participou da Comissão\nde Relações Exteriores, presidiu a Comissão Mista incumbida de Estudo e\nParecer sobre a Mensagem nº 48, que trata da legislação sobre Imposto\nÚnico sobre Minerais, e viajou a Pádua, na Itália, a convite dos padres\njesuítas do Espírito Santo, para participar do Congresso Internacional\nde Escolas Comunitárias e realizar o curso de desenvolvimento\ncomunitário e Escolas-Família. Em 1972 passou a integrar os diretórios\nregional e nacional da Arena, tornando-se vice-presidente da Comissão de\nRelações Exteriores e membro da Comissão Especial para Elaboração das\nLeis Complementares à Constituição na Câmara dos Deputados. Nesse mesmo\nano viajou como delegado do Congresso Nacional para a 60ª Conferência\nInterparlamentar em Roma (Itália).\n\nLigado ao senador Filinto Müller, presidente da Arena até falecer em\n1973, foi o primeiro parlamentar capixaba a integrar a mesa da Câmara,\ntornando-se terceiro-secretário em 1973. Ainda nesse ano esteve em\nviagem oficial ao Oriente, convidado pelos governos da Coréia, Formosa e\nJapão para visitar os parlamentos desses países e foi nomeado\ndiretor-secretário da Confederação Nacional de Agricultura, cargo que\nocuparia até 1985.\n\nEm 1974 disputou a indicação para candidato arenista ao pleito indireto\npara o governo de seu estado, tendo sido o segundo mais votado na\neleição realizada no diretório estadual do partido, que escolheu Artur\nCarlos Gerhardt Santos. A fim de unificar o partido, foi indicado\ncandidato ao Senado no pleito de novembro, tendo sido contudo derrotado\nnas urnas pelo emedebista Dirceu Cardoso. Deixou a Câmara em janeiro de\n1975.\n\nNomeado em 1975 assessor especial do ministro da Agricultura, Alysson\nPaulinelli (1975-1979), nesse mesmo ano assumiu a diretoria do Instituto\nBrasileiro do Café (IBC). Em 1976, tornou-se diretor da Federação de\nAgricultura do Espírito Santo (FAES) e delegado representante da FAES\njunto à Confederação Nacional de Agricultura (CNA), tendo viajado à\nItália como representante da CNA para participar da conferência da\nOrganização das Nações Unidas para a Agricultura e a Alimentação (FAO).\nNo ano seguinte — depois de ter exercido a função de presidente\nsubstituto e de ter representado o órgão junto ao Grupo Executivo\nRenovação Econômica do Espírito Santo (GERES), Decreto-Lei nº 880, e de\nter tomado parte do Grupo Executivo Renovação Cafeicultura (Gerca) —,\ndeixou o IBC para assumir uma diretoria do Banco do Estado do Espírito\nSanto, cargo que exerceu até 1978. Nesse mesmo período, foi membro do\nConselho Estadual da Campanha Nacional de Escolas da Comunidade (CNEC).\n\nIntegrante da chapa arenista de Eurico Resende, em novembro de 1978 foi\nescolhido vice-governador do estado pela Assembléia Legislativa do\nEspírito Santo, assumindo o mandato em março do ano seguinte. Ainda em\n1979 exerceu o cargo de coordenador da Comissão Estadual de Energia. Com\na extinção do bipartidarismo em 29 de novembro de 1979 e a conseqüente\nreformulação partidária, filiou-se ao Partido Democrático Social (PDS),\nagremiação situacionista que sucedeu a Arena. No ano seguinte, tornou-se\nmembro do diretório regional do partido e foi designado supervisor da\nJunta Estadual de Política Salarial (JPES) e das entidades indiretas da\nAdministração Estadual.\n\nEm 1981 passou a membro suplente do diretório nacional do PDS e no ano\nseguinte participou como delegado das convenções estadual e nacional do\npartido. Ainda em 1982 desincompatibilizou-se do cargo de\nvice-governador para concorrer a uma vaga na Câmara dos Deputados.\nEleito deputado federal pelo Espírito Santo na legenda do PDS no pleito\nde novembro desse ano, ocupou a cadeira em março de 1983, quando\ntornou-se vice-líder do seu partido na Câmara dos Deputados.\n\nEm 25 de abril de 1984 esteve ausente na votação da emenda Dante de\nOliveira, votada na Câmara dos Deputados, e que propunha o\nrestabelecimento de eleições diretas para a escolha do novo presidente\nda República em novembro daquele ano. No entanto, a emenda não obteve a\nvotação necessária para ser aprovada pelo plenário da Câmara (faltaram\n22 votos para que o projeto pudesse ser encaminhado à apreciação pelo\nSenado Federal).\n\nNo Colégio Eleitoral, reunido em 15 de janeiro de 1985 para escolher o\nsucessor do presidente da República João Batista Figueiredo, José Carlos\nFonseca votou em Paulo Maluf, candidato apoiado pela situação, que foi\nderrotado por Tancredo Neves, lançado pela oposicionista Aliança\nDemocrática, que reunia o Partido do Movimento Democrático Brasileiro\n(PMDB) e a Frente Liberal, grupo dissidente do PDS. Contudo, por motivo\nde doença, Tancredo Neves não chegou a ser empossado na presidência,\nvindo a falecer em 21 de abril de 1985. Seu substituto no cargo foi o\nvice José Sarney, que já vinha exercendo interinamente o cargo, desde 15\nde março deste ano.\n\nCandidatou-se à reeleição na legenda do Partido da Frente Liberal (PFL)\nno pleito de novembro de 1986, mas obteve apenas uma suplência. Deixou a\nCâmara dos Deputados em janeiro de 1987, ao final da legislatura.\n\nCasou-se com Regina Maria da Costa Fonseca, com quem teve três filhos.\n\n \n\nFONTES: CÂM. DEP. *Deputados*;**CÂM. DEP. *Deputados brasileiros.\nRepertório* (1971-1975);*Globo*(25/4/84 e 16/1/85); *Jornal do\nBrasil*(20/12/75 e 21/12/77); NÉRI, S. *16*; *Perfil*(1972).\n\n \n","ref":"FONTES: CÂM. DEP. *Deputados*;**CÂM. DEP. *Deputados brasileiros.\nRepertório* (1971-1975);*Globo*(25/4/84 e 16/1/85); *Jornal do\nBrasil*(20/12/75 e 21/12/77); NÉRI, S. *16*; *Perfil*(1972).\n\n \n","dic":"DHBB"}
