{"title":"FONSECA, Leopoldo Néri da","cargoss":["Revolucionário ou revoltoso","Revolucionário ou revoltoso"],"cargos_esp":[0,0],"datas_ini":[1922,1930],"datas_fim":[1922,1930],"estados":[0,0],"autor":["Helena Faria"],"content":"**FONSECA, Leopoldo Néri da**\n\n\\*militar; rev. 1922; rev. 1930.\n\n*Leopoldo Néri da Fonseca Júnior* nasceu no Amazonas em 6 de janeiro de\n1885.\n\nSentou praça em 1901. Tornou-se aspirante em 1908, sendo sucessivamente\npromovido a segundo-tenente (1909), primeiro-tenente (1914) e capitão\n(1919), bacharelando-se ainda em ciências físicas e matemáticas durante\neste período.\n\nEm 5 de julho de 1922, participou do levante do forte de Copacabana,\ndeflagrado no Rio de Janeiro, então Distrito Federal, em protesto contra\na eleição de Artur Bernardes à presidência da República e as punições\nimpostas a militares pelo governo de Epitácio Pessoa.\n\nO levante, que iniciou o ciclo de revoltas tenentistas da década de\n1920, deu origem ao episódio dos 18 do Forte, do qual Leopoldo Néri da\nFonseca não participou diretamente por ter sido incumbido de vigiar o\ngeneral Bonifácio da Costa, comandante do 1º Distrito de Artilharia da\nCosta, que estava detido no forte. Debelada a revolta no mesmo dia,\nLeopoldo Néri foi aprisionado e enviado para o Hospital Central do\nExército, de onde conseguiu fugir. Reintegrou-se então ao movimento\ntenentista, conspirando sob os cognomes de Marcos da Frota e Clóvis\nGarcez. Preso novamente, mais uma vez conseguiu evadir-se.\n\nEm 2 de maio de 1925, junto com outros oficiais, atacou o quartel do 3º\nRegimento de Infantaria na Praia Vermelha, no Rio, visando conquistar\nseus efetivos para uma marcha sobre o palácio do Catete, sede do governo\nfederal. O golpe fracassou logo na fase inicial, com a debandada dos\nsoldados do 3º RI. Durante a rápida troca de tiros, morreu o tenente\nrebelde Jansen de Melo.\n\nEm 1928 foi condenado a um ano e quatro meses de reclusão pelos\nacontecimentos de 1922.\n\nNa fase de preparação da Revolução de 1930, Leopoldo Néri da Fonseca foi\nconvidado para a chefia militar do movimento em Minas Gerais, em\nsubstituição ao coronel João Maria Xavier de Brito, gravemente doente.\nAceitando o convite, demitiu-se do cargo de diretor da 4ª Seção das\nObras de Saneamento, em Campos (RJ), rumando para Minas Gerais.\n\nSegundo seu próprio relato, nas vésperas da eclosão do movimento recebeu\nde Lindolfo Collor, um dos líderes gaúchos da revolução, uma missão\nsecreta que exigia sua presença na capital federal. Assim, encarregou\nAristarco Pessoa de substituí-lo nas suas funções em Minas Gerais.\n\nSua ausência em Minas durante a revolução deu margem a que fosse acusado\nde traição, o que, entretanto, foi desmentido posteriormente por vários\nrevolucionários, como Virgílio de Melo Franco, José Antônio Flores da\nCunha e Aristarco Pessoa. Todos confirmaram a existência da missão de\nNéri na capital federal, sem que, entretanto, tenha sido revelada sua\nfinalidade.\n\nCom a vitória da Revolução de 1930, foi promovido a major em 15 de\nnovembro do mesmo ano e, logo depois, nomeado ajudante-de-ordens de\nAfrânio de Melo Franco no Ministério das Relações Exteriores.\n\nEm 1932, combateu a Revolução Constitucionalista em Mato Grosso.\n\nEm 1933, foi eleito suplente de deputado à Assembléia Nacional\nConstituinte, na legenda da Aliança Trabalhista Liberal do Amazonas.\n\nEm 1934, escreveu a seguinte obra: *Agora, eu!*... *Defesa do major Néri\nda Fonseca.*\n\nHelena Faria\n\nFONTES: ASSEMB. NAC. CONST. 1934. *Anais;*CONSULT. MAGALHÃES, B.;\nFONSECA, L. *Agora;*FRANCO, V. *Outubro;*MIN. GUERRA.\n*Almanaque;*NOGUEIRA FILHO, P. *Ideais;*SILVA, H. *1922;*SILVA, H.\n*1930.*\n\n \n","ref":"FONTES: ASSEMB. NAC. CONST. 1934. *Anais;*CONSULT. MAGALHÃES, B.;\nFONSECA, L. *Agora;*FRANCO, V. *Outubro;*MIN. GUERRA.\n*Almanaque;*NOGUEIRA FILHO, P. *Ideais;*SILVA, H. *1922;*SILVA, H.\n*1930.*\n\n \n","dic":"DHBB"}
