{"title":"FONTENELLE, Manuel Benício","cargoss":["Constituinte","Deputado federal"],"cargos_esp":[0,0],"datas_ini":[1946,1946],"datas_fim":[1946,1951],"estados":[0,"DF"],"autor":[0],"content":"**FONTENELLE, Manuel Benício**\n\n\\*const. 1946; dep. fed. DF 1946-1951.\n\n*Manuel Benício Fontenelle* nasceu em Itaocara (RJ) no dia 22 de\nfevereiro de 1902, filho de Fernando Bacelar Fontenelle e de Maria Viana\nFontenelle.\n\nCursou o Colégio Pedro II, no Rio de Janeiro, então Distrito Federal.\nEmpregado na indústria têxtil, foi professor da Escola Técnica\nFluminense e da Escola Normal de Comércio. Organizador dos trabalhadores\ntêxteis, presidiu o Sindicato de Mestres e Contramestres na Indústria de\nFiação e Tecelagem do Rio de Janeiro, além de colaborar na fundação de\nsindicatos da categoria em diversas cidades dos estados do Rio, Minas\nGerais e São Paulo. Secretário da União Geral dos Sindicatos de\nEmpregados do Rio de Janeiro, então Distrito Federal, participou do I\nCongresso Nacional de Delegados-Eleitores.\n\nFiliado ao recém-fundado Partido Trabalhista Brasileiro (PTB), de que\nfoi o primeiro presidente no Distrito Federal, elegeu-se em dezembro de\n1945 deputado à Assembléia Nacional Constituinte pelo Distrito Federal.\nAssumiu o mandato em fevereiro do ano seguinte, participou dos trabalhos\nconstituintes e, após a promulgação da nova Constituição (setembro de\n1946), passou a exercer o mandato ordinário. Membro da Comissão de\nTomada de Contas da Câmara, em 1949 tornou-se integrante do conselho\ndeliberativo e do conselho consultivo do Centro de Estudos e Defesa do\nPetróleo e da Economia Nacional (CEDPEN), que se batia pelo monopólio\nestatal do petróleo. Na Câmara Federal, foi ainda vice-líder e líder\ninterino do PTB.\n\nCandidato à reeleição em 1950, obteve apenas uma suplência, deixando o\nmandato de deputado em janeiro de 1951. Vice-presidente regional do PTB,\ntornou-se em seguida delegado regional do Instituto de Aposentadoria e\nPensões dos Comerciários (IAPC) no Distrito Federal.\n\nFaleceu no Rio de Janeiro em fevereiro de 1978.\n\nFoi casado com Jacira Gomes Fontenelle, com quem teve cinco filhos.\n\nFONTES: CÂM. DEP. *Deputados;*CÂM. DEP. *Relação dos dep.;*CARVALHO, E.\n*Petróleo; Diário do Congresso Nacional; Jornal do Brasil*(13/2/78);\nTRIB. SUP. ELEIT. *Dados* (1 e 2).\n\n","ref":"FONTES: CÂM. DEP. *Deputados;*CÂM. DEP. *Relação dos dep.;*CARVALHO, E.\n*Petróleo; Diário do Congresso Nacional; Jornal do Brasil*(13/2/78);\nTRIB. SUP. ELEIT. *Dados* (1 e 2).\n\n","dic":"DHBB"}
