{"title":"FONTES, Amando","cargoss":["Deputado federal","Constituinte","Deputado federal"],"cargos_esp":[0,0,0],"datas_ini":[1935,1946,1946],"datas_fim":[1937,1946,1955],"estados":["SE",0,"SE"],"autor":[0],"content":"**FONTES, Amando**\n\n\\*dep. fed. SE 1935-1937; const. 1946; dep. fed. SE 1946-1955.\n\n*Amando Fontes* nasceu em Santos (SP) no dia 15 de maio de 1899, filho\ndo farmacêutico Turíbio da Silveira Fontes e da professora Rosa do\nNascimento Fontes.\n\nCom a morte do pai, quando contava apenas cinco meses, sua família\nmudou-se para Aracaju, de onde era oriunda. Nessa cidade fez os\nprimeiros estudos numa escola particular, ingressando em 1909 no Ateneu\nSergipense. Em 1914 tornou-se revisor do *Diário da Manhã,*também em\nAracaju, e, em 1919, entrou para a Escola de Medicina no Rio de Janeiro,\nno então Distrito Federal, abandonando-a mais tarde. Em 1922, através de\nconcurso público, tornou-se agente fiscal do imposto de consumo do\nMinistério da Fazenda, em Salvador. Bacharelou-se em 1928 pela Faculdade\nde Direito da Bahia.\n\nApós a vitória da Revolução de 1930, transferiu-se mais uma vez para o\nRio de Janeiro, onde dedicou-se à advocacia e passou a freqüentar o\ncírculo do pensador católico Jackson de Figueiredo, de quem era amigo.\nRetornando à capital sergipana, elegeu-se deputado federal por Sergipe\nno pleito de outubro de 1934. Empossado em maio do ano seguinte,\npermaneceu na Câmara até o dia 10 de novembro de 1937, quando, com o\nadvento do Estado Novo (1937-1945), os órgãos legislativos do país foram\nsuprimidos.\n\nCom a reconstitucionalização do país, elegeu-se, em dezembro de 1945,\ndeputado por Sergipe à Assembléia Nacional Constituinte na legenda da\ncoligação formada pela União Democrática Nacional (UDN) e o Partido\nRepublicano (PR). Assumindo sua cadeira em fevereiro de 1946, participou\ndos trabalhos constituintes e, com a promulgação da nova Carta\n(18/9/1946) e a transformação da Constituinte em Congresso ordinário,\npermaneceu no exercício do mandato na legislatura que se seguiu. No\npleito de outubro de 1950 reelegeu-se na legenda do PR, exercendo o\nmandato até janeiro de 1955, quando deixou definitivamente a Câmara dos\nDeputados.\n\nFoi professor de escolas técnicas secundárias no Distrito Federal e\npertenceu à Academia Petropolitana de Letras.\n\nFaleceu no Rio de Janeiro no dia 1º de dezembro de 1967.\n\nEra casado com Corália Teixeira Fontes, com quem teve seis filhos.\n\nPublicou *Os corumbás*(romance, 8ª ed., 1933) e *Rua do Siriri*(romance,\n1937).\n\nFONTES: COUTINHO, A. *Brasil; Grande encic.**Delta;*MENESES, R.\n*Dic.;*TRIB. SUP. ELEIT. *Dados* (1 e 2); VELHO SOBRINHO, J.*Dic.*\n\n","ref":"FONTES: COUTINHO, A. *Brasil; Grande encic.**Delta;*MENESES, R.\n*Dic.;*TRIB. SUP. ELEIT. *Dados* (1 e 2); VELHO SOBRINHO, J.*Dic.*\n\n","dic":"DHBB"}
