{"title":"FONTES, João Camilo Teixeira","cargoss":["Deputado federal"],"cargos_esp":[0],"datas_ini":[1953],"datas_fim":[1954],"estados":["MG"],"autor":[0],"content":"**FONTES, João Camilo Teixeira**\n\n\\*dep. fed. MG 1953-1954.\n\n*João Camilo Teixeira Fontes* nasceu em Rio Casca (MG) no dia 29 de maio\nde 1890, filho de Antônio Camilo Teixeira Fontes e de Ana Alves\nTeixeira. Descendia de Ângelo Vieira de Sousa, fundador de seu município\nnatal, e era sobrinho de José Vieira de Sousa, chefe político local.\n\nJoão Camilo Fontes cursou o Ginásio Pio Americano, no Rio de Janeiro,\nentão Distrito Federal, e diplomou-se, em 1915, pela Faculdade de\nMedicina do Rio de Janeiro. Médico especializado em clínica geral,\nretornou a Rio Casca, onde foi vereador e presidente da Câmara\nMunicipal.\n\nEm outubro de 1934, elegeu-se deputado à Assembleia Constituinte de\nMinas Gerais pela legenda do Partido Progressista (PP). Após participar\nda elaboração da Constituição do estado e da eleição que confirmou no\ncargo o governador mineiro Benedito Valadares, continuou a exercer o\nmandato de deputado estadual até o advento do Estado Novo (10/11/1937),\nque suprimiu os órgãos legislativos do país. No Legislativo mineiro,\nfora membro da Comissão de Agricultura, Indústria, Comércio e Trabalho.\nApós 1937, foi prefeito por duas vezes seguidas de sua cidade natal.\n\nCom o fim do regime de exceção, elegeu-se, em dezembro de 1945, deputado\nà Assembleia Nacional Constituinte mineira, pela legenda do recém-criado\nPartido Social Democrático (PSD). Assumiu o mandato em fevereiro de\n1946, e, após a promulgação da nova Constituição (18/9/1946), passou a\nexercer o mandato ordinário. Candidatou-se a uma vaga de deputado\nfederal por Minas Gerais em outubro de 1950, obtendo apenas uma\nsuplência. Deixando a Assembleia Legislativa em janeiro de 1951, ao\nfinal de seu mandato, assumiu uma cadeira na Câmara, em junho de 1953,\nna vaga deixada pelo deputado Tancredo Neves, que assumiu o Ministério\nda Justiça. Permaneceu em seu lugar até agosto de 1954, quando Tancredo\nretornou à Câmara. Novamente candidato no pleito de 1954, uma vez mais\nobteve uma suplência, não mais retornando à Câmara.\n\nFaleceu em Belo Horizonte no dia 20 de novembro de 1963.\n\nEra casado com sua prima Ana Martins Teixeira. Seu tio e sogro, José\nCupertino Teixeira Fontes, foi senador estadual em Minas entre 1918 e\n1922.\n\nFONTES: ASSEMB. LEGISL. MG. *Dicionário biográfico*; CÂM. DEP.\n*Deputados*; CISNEIROS, A. *Parlamentares*; HORTA, C. *Famílias*; *Rev.\nArq. Públ. Mineiro* (12/76).\n\n","ref":"FONTES: ASSEMB. LEGISL. MG. *Dicionário biográfico*; CÂM. DEP.\n*Deputados*; CISNEIROS, A. *Parlamentares*; HORTA, C. *Famílias*; *Rev.\nArq. Públ. Mineiro* (12/76).\n\n","dic":"DHBB"}
