{"title":"AMADO, Humberto","cargoss":["Deputado federal"],"cargos_esp":[0],"datas_ini":[1957],"datas_fim":[1958],"estados":["SE"],"autor":[0],"content":"**AMADO, Humberto**\n\n\\*dep. fed. SE 1957-1958.\n\n \n\n                *Humberto de Andrade Amado* nasceu no dia 19 de\nfevereiro de 1918 em Aracaju, filho de Pedro Montalvão Amado e Maria\nAlice de Andrade Amado.\n\n                Estudou no Colégio Antônio Vieira, na Bahia e no Colégio\nAnglo-Americano no Rio de Janeiro. Graduou-se em direito pela Faculdade\nde Direito de Niterói e pela Columbia University, nos Estados Unidos.\n\n                Tendo alcançado uma suplência de deputado federal pelo\nPartido Trabalhista Brasileiro (PTB) nas eleições de novembro de 1954,\nassumiu uma cadeira na Câmara dos Deputados de julho a outubro de 1957 e\nde agosto a outubro de 1958. Não logrou êxito em eleger-se quando\ncandidatou-se novamente pelo PTB no pleito de novembro de 1958 .\n\n                Durante sua vida profissional foi assessor técnico da\nComissão Executiva Têxtil, conselheiro da Delegacia do Trabalho Marítimo\ndo Rio de Janeiro, diretor-gerente da Navegação e Comércio\nSergipe-Paraná S/A, diretor-gerente da firma Pedro Amado & Cia.,\ndiretor-tesoureiro da Companhia de Fiação e Tecidos Cometa,\ndiretor-secretário da Cia. Armadora Brasileira.\n\n                Casou-se com Iara Maria da Silva Tavares Amado, com quem\nteve três filhos.\n\n                Publicou *Aspectos sociais da Suécia contemporânea*\n(1947) e *Sergipe, a terra e o homem*, além de vários artigos publicados\nna imprensa sergipana.\n\n \n\nFONTES: CÂM. DEP. *Deputados Brasileiros. Repertório* (1946-1967).\n\n \n","ref":"FONTES: CÂM. DEP. *Deputados Brasileiros. Repertório* (1946-1967).\n\n \n","dic":"DHBB"}
