{"title":"AMADO, Jorge","cargoss":["Constituinte","Deputado federal"],"cargos_esp":[0,0],"datas_ini":[1946,1946],"datas_fim":[1946,1948],"estados":[0,"SP"],"autor":["Carneiro."],"content":"**AMADO, Jorge**\n\n\\*jornalista; const. 1946; dep.****fed. SP 1946-1948.\n\n*Jorge Leal Amado de Faria* nasceu na fazenda Auricídia, em Ferradas, no\nmunicípio de Itabuna (BA) — embora conste no registro civil como nascido\nem Ilhéus (BA) —, no dia 10 de agosto de 1912, filho de João Amado de\nFaria, um dos desbravadores da região cacaueira, e de Eulália Leal\nAmado. Sua família produziu uma série de escritores, entre os quais seu\nirmão, James Amado, e seus primos Genolino, Gildásio e Gílson Amado. Era\ntambém seu primo Gilberto Amado, jornalista, deputado federal por\nSergipe de 1915 a 1917 e de 1921 a 1926, senador de 1927 a 1930 e\nembaixador do Brasil no Chile, de 1936 a 1937, e na Itália, de 1939 a\n1942.\n\nCom apenas um ano de idade Jorge Amado seguiu com a família para Ilhéus,\nonde passou a infância em meio a um ambiente de lutas pela posse da\nterra, que mais tarde viria a influenciá-lo na produção de algumas obras\nliterárias. Recebendo em casa a instrução primária, aos dez anos passou\na escrever no jornalzinho da cidade, *A* *Luneta*. Em 1923 ingressou\ncomo interno no Colégio Antônio Vieira, em Salvador, de padres jesuítas,\nmas em 1926 fugiu e foi para a casa do avô, em Itaporanga (SE). Alguns\nmeses depois retornou a Salvador para continuar os estudos, agora no\nGinásio Ipiranga, onde foi contemporâneo de Adonias Filho e de Rômulo de\nAlmeida.\n\nParticipou em seguida da Academia dos Rebeldes, movimento liderado por\nJoão Amaro Pinheiro Viegas em defesa de uma literatura brasileira com\nsentido universal e contrário à Semana de Arte Moderna, cujo espírito\nrenovador, entretanto, aceitava. Em 1927 dirigiu a revista *A Pátria,*do\nGinásio Ipiranga, e fundou com os irmãos Imbassay o jornal *A Folha,*de\noposição à diretoria do grêmio literário da escola. Nesse mesmo ano fez\nsua estréia literária na revista *A Luva,*publicando um pequeno poema\nmodernista, e iniciou sua carreira profissional como repórter no*Diário\nda Bahia.*\n\nLigado ao movimento modernista baiano, passou a colaborar em 1928 nas\nrevistas *Samba, Meridiano*e*A Semana.*No ano seguinte foi colaborador\nem *O Momento***e no suplemento literário de *O Jornal*—**órgão\nvinculado à campanha da Aliança Liberal —, no qual lançou em co-autoria\ncom Édison Carneiro e Osvaldo Dias Costa a novela em fascículos\n*Lenita*.**Nesse período, colaborou ainda com o *Diário de Notícias, A\nGazeta de Notícias*e o *Correio do Povo.*\n\nEm 1930 mudou-se para o Rio de Janeiro, então Distrito Federal, e no ano\nseguinte matriculou-se na Faculdade de Direito da Universidade do Rio de\nJaneiro, onde travou conhecimento com Otávio de Faria e Almir de\nAndrade. Também em 1931, contando apenas 19 anos, publicou seu primeiro\nromance, *O país* *do Carnaval.*Em 1932 escreveu seu segundo romance,\n*Rui Barbosa número dois,*que desistiu de publicar, e integrou-se à\nJuventude Comunista, setor do Partido Comunista Brasileiro — então\nPartido Comunista do Brasil (PCB) — voltado para o meio estudantil,\ntornando-se então amigo de Graciliano Ramos e José Lins do Rego. Ainda\nem 1932 retornou a Ilhéus, entrando de novo em contato com a realidade\nhumana e social da região cacaueira. Dessa sua experiência, aliada à\nleitura de autores estrangeiros expoentes da tendência literária\nconhecida como realismo socialista, resultou o polêmico romance\n*Cacau,*que foi publicado em 1933 mas teve a edição apreendida.\n\nDe volta ao Rio, tornou-se, também em 1933, redator-chefe da revista*Rio\nMagazine.*No ano seguinte foi eleito membro do comitê dirigente da\nJuventude Comunista e começou a trabalhar na Editora José Olímpio. Em\n1935 concluiu o curso universitário, mas jamais chegaria a exercer a\nadvocacia.\n\nFiliado à Aliança Nacional Libertadora (ANL), foi redator de *A\nManhã,*um dos principais órgãos de divulgação do programa e das\natividades daquela organização. Fundada oficialmente em 12 de março de\n1935, a ANL constituiu uma frente ampla de composição variada contra o\nfascismo, o latifúndio, o imperialismo e a miséria, congregando\nelementos dos mais diferentes escalões sociais, desde operários até\nmilitares.\n\nParticipou também do corpo editorial da revista *Movimento,*editada pelo\nCentro de Cultura Moderna, que, juntamente com a Liga de Defesa da\nCultura Popular e a União Feminina do Brasil, teve sua criação inspirada\nna ANL. De modo geral, as publicações de interesse cultural ligadas\nàquela organização reproduziam artigos publicados pela imprensa\nantifascista européia. A ANL foi posta na ilegalidade em julho de 1935,\nmas continuou funcionando principalmente pela ação dos comunistas\nliderados por Luís Carlos Prestes. Após a tentativa de insurreição, em\nnovembro de 1935, prontamente derrotada pelas forças governistas, Jorge\nAmado foi acusado de subversão na onda repressiva que se seguiu.\n\nDurante quase todo o ano de 1937 viajou pelo México — onde proferiu\nconferências sobre literatura brasileira e política — e pelos Estados\nUnidos. Regressou ao Brasil em 2 de novembro e logo em seguida recebeu a\ncomunicação de que seu romance *Capitães de areia,*que acabara de ser\nlançado, fora apreendido em todo o país e queimado. No dia 6 de novembro\nfoi preso em Manaus e enviado para o Rio de Janeiro, onde, após ter sido\nsubmetido a interrogatórios, foi posto em liberdade.\n\nA partir de 10 de novembro de 1937, quando foi instaurado o Estado Novo,\ne até 1943, seus livros já editados seriam retirados de circulação. De\n1938 a 1939 foi redator-chefe de *Dom Casmurro*e**neste último ano\npassou a trabalhar na revista *Diretrizes,* que em 1940 começou a\npublicar em****capítulos a biografia de sua autoria *ABC de Castro\nAlves*. A publicação foi suspensa por ordem da polícia no terceiro\nnúmero.\n\nApós seguidas prisões, viajou novamente para o exterior e viveu de 1941\na 1942 no Uruguai e na Argentina, onde escreveu a biografia de Luís\nCarlos Prestes, *O cavaleiro da esperança***,**publicada neste último\nano. Posteriormente morou na França e em seguida na União Soviética. Ao\nvoltar ao Brasil foi detido e, em outubro de 1943, após três meses de\nprisão, obteve liberdade, condicionada, todavia, pela obrigatoriedade de\npermanecer na Bahia. Ainda em 1943 tornou-se cronista do “Diário da\nGuerra” em *O Imparcial*.\n\nMesmo durante o Estado Novo, visitou comunistas presos na ilha Grande e\nentrevistou-se com Prestes na prisão no primeiro dia do rompimento de\nsua incomunicabilidade. Em 1945 foi delegado da Bahia e um dos\nvice-presidentes do I Congresso Brasileiro de Escritores, promovido pela\nAssociação Brasileira de Escritores. Esse congresso, realizado em São\nPaulo de 22 a 27 de janeiro, reuniu expressivo número de intelectuais de\ndiversas tendências políticas e emitiu declaração em favor da democracia\ne das liberdades públicas, numa contundente tomada de posição contra o\nEstado Novo. Nessa ocasião Jorge Amado transferiu-se para São Paulo,\nonde passou a dirigir o diário *Hoje,*ao lado de Clóvis Graciano e Caio\nPrado Júnior.\n\nCom a desagregação do Estado Novo e a legalização do PCB, foi eleito\nnessa legenda, no pleito de dezembro de 1945, deputado por São Paulo à\nAssembléia Nacional Constituinte. Assumiu o mandato em fevereiro de 1946\ne assinou, juntamente com Prestes e os demais parlamentares comunistas,\nos 15 pontos apresentados pelo PCB à Constituinte dentro de seu Programa\nMínimo de União Nacional. Esse programa defendia, entre outros pontos, a\nproteção aos pequenos fazendeiros e industriais, a autonomia dos\nmunicípios e do Distrito Federal, a unificação da Justiça e a ampliação\ndo direito de voto aos analfabetos, soldados e marinheiros, e se opunha\nao trabalho do menor e ao estabelecimento do estado de sítio preventivo,\naceitando-o apenas “em caso de agressão estrangeira”. Nesse período foi\nainda membro da Comissão de Indicações. Com a promulgação da nova Carta\nem 18 de setembro de 1946, passou a exercer o mandato ordinário,\nparticipando como membro efetivo da Comissão de Educação e Cultura da\nCâmara dos Deputados.\n\nEm maio de 1947 o PCB foi colocado na ilegalidade. Em decorrência dessa\nmedida, assim como os demais parlamentares comunistas, Jorge Amado teve\nseu mandato cassado em janeiro de 1948. Nesse mesmo ano exilou-se mais\numa vez, fixando residência em Paris e depois em Praga, na\nTchecoslováquia. Em 1952 retornou ao Brasil.\n\nEm 1954 foi eleito vice-presidente da União Brasileira, e em 1955\nescreveu o argumento do filme *O solar dos azulejos,*a ser realizado em\nBerlim, na Alemanha Ocidental, pelo cineasta Alberto Cavalcanti. Em 1956\nfundou o jornal de arte e literatura *Para Todos,*que dirigiria até\n1958, quando deixou de ser publicado. Ainda em 1956, após a divulgação\npública do relatório de Nikita Kruschev ao XX Congresso do Partido\nComunista da União Soviética (PCUS), em que o líder comunista denunciou\nos crimes cometidos por Josef Stalin, Jorge Amado apoiou os militantes\ndo PCB que acusaram a direção do partido de omissão diante das\nrevelações soviéticas.\n\nEm julho de 1960, juntamente com o escritor e médico Peregrino Júnior,\norganizou o I Festival do Escritor Brasileiro. Na ocasião conseguiu que\no governo federal decretasse o dia 25 de julho, data da realização do\nevento, como o Dia do Escritor. Em 1961 tornou-se membro da Academia\nBrasileira de Letras.\n\nApós a renúncia de Jânio Quadros à presidência da República (25/8/1961),\nengajou-se no movimento pela posse do vice-presidente João Goulart,\nvetada pelos ministros militares, e assinou, juntamente com centenas de\noutros intelectuais, um manifesto de apoio aos parlamentares que\nresistiam no Legislativo às pressões golpistas. Goulart acabou assumindo\na presidência em 7 de setembro de 1961, já sob o regime parlamentarista.\n\nNa década de 1980 Jorge Amado passou a morar definitivamente em Paris,\nquando foi convidado a assumir as funções de embaixador da cultura\nbrasileira junto ao governo francês. Ao participar da inauguração da\nexposição comemorativa do 50º aniversário de sua carreira literária, em\njulho de 1982, defendeu o socialismo com liberdade e firmou posição em\nfavor da convocação de uma assembléia nacional constituinte. Em 1986\ntomou posse na Academia Baiana de Letras. Mantendo-se sempre atento à\npolítica brasileira, nunca deixou de emitir sua opinião nos principais\nmomentos de mudança ou nas crises nacionais. Em 1993, por ocasião do\nplebiscito em que se decidiu a manutenção do presidencialismo como forma\nde governo, declarou seu voto a favor do parlamentarismo, manifestando\npreocupação com a fragilidade partidária brasileira e com as políticas\ngovernamentais que perpetuam a pobreza no país.\n\nJorge Amado tornou-se um dos escritores brasileiros mais famosos, com\nobras publicadas em mais de 60 países e traduzidas em 46 idiomas. Seus\nromances e novelas foram adaptados com freqüência para cinema, teatro,\ntelevisão e rádio. Recebeu inúmeros prêmios e condecorações, entre os\nquais se destacam o Prêmio Internacional Stalin (Rússia, 1951), o Prêmio\nInternacional Dimitrov (Bulgária, 1986) e a comenda da Legião de Honra\n(França, 1985). Ao longo da vida tornou-se membro de diversas academias\nnacionais e internacionais, associações e conselhos, e participou de\ngrande número de congressos de escritores e intelectuais.\n\nFaleceu em Salvador no dia 5 de agosto de 2001.\n\nTeve uma filha do primeiro casamento. Contraiu segundas núpcias com\nZélia Gattai Amado, também escritora, com quem teve dois filhos.\n\nAlém das obras já citadas, publicou *Suor*(romance, 1934),\n*Jubiabá*(romance, 1935), *Mar morto*(1936), *A estrada do mar*(poesia,\n1938)*, Philadelpho*(comédia teatral, 1940)*, Terras do sem\nfim*(romance, 1943)*, São Jorge dos Ilhéus*(romance, 1944)*, Bahia de\nTodos os Santos* (guia turístico e literário, 1945)*, Seara\nVermelha*(romance, 1946),*O amor de Castro Alves*(teatro, 1947)*, O\nmundo da paz* (relato de viagens, 1951)*, Os subterrâneos da\nliberdade*(romance, 1954)*, Gabriela cravo e canela*(romance, 1958)*, De\ncomo o mulato Porciúncula descarregou seu defunto*(novela, 1959)*, A\nmorte e a morte de Quincas Berro d’Água*(novela, 1961)*, Os velhos\nmarinheiros*(novela, 1961)*, Brandão entre o mar e o amor*(em\nco-autoria, 1961*), Os pastores da noite*(romance, 1964*), Dona Flor e\nseus dois maridos*(romance, 1966)*, Tenda dos milagres*(romance,\n1966),*Teresa Batista cansada de guerra*(romance, 1972), *Gato Malhado e\nandorinha Sinhá* (novela infantil, 1976),*Tieta do Agreste*(romance,\n1977),*Farda, fardão, camisola de dormir*(1979)*, O menino\ngrapiúna*(1980*)*,*Tocaia grande*(romance, 1984)*, O sumiço da\nsanta*(romance, 1988),*Navegação de cabotagem — apontamentos de uma\nautobiografia que jamais escreverei*(1992)*,* *A descoberta da América\npelos turcos*(romance, 1994).\n\nA seu respeito foram publicados os livros *Jorge Amado, vida e\nobra*(1960), de Miécio Táti, *Jorge Amado, 30 anos de literatura*(1961),\n*Jorge Amado* (1964), de Alexandre Pinheiro Torres, *Jorge Amado:\npolítica e literatura* (1979), de Alfredo Wagner Berno de Almeida, e\n*Jorge Amado, 80 anos de vida e obra* (1992), de Rosane Rubim e Maried\nCarneiro.\n\nFONTES: ACAD. BRAS. LETRAS. *Anuário* (1973 e 1974); AMADO, J. *Homens;\nBancada;*BEHAR, E. *Vultos;*BRINCHES, V. *Dic.;* CÂM. DEP.\n*Deputados;*CÂM. DEP. *Relação* *dos dep.;*COELHO, J. *Dic.;*CONG. BRAS.\nESCRITORES, I; COUTINHO, A. *Brasil; Encic. Mirador; Grande encic.\nDelta; Grande* *encic. portuguesa;*HIRSCHOWICZ, E. *Contemporâneos;\nJornal do Brasil*(21/7/82); LEITE, A. *História;*LEVINE, R.\n*Vargas;*MENESES, R. *Dic.;*MOREIRA, J. *Dic.;*OLIVEIRA,\nC.*Biografias;*PERALVA, O. *Retrato;*POERNER, A. *Poder;*REIS, A.\n*Bibliografia bras.;* SILVA, G. *Constituinte;*SILVA, H. *1934;* SILVA,\nH. *1935;*SOUSA, J.*Teatro; Súmulas; Who’s who in Brazil; Who’s who in\nLatin.*\n\n\n","ref":"FONTES: ACAD. BRAS. LETRAS. *Anuário* (1973 e 1974); AMADO, J. *Homens;\nBancada;*BEHAR, E. *Vultos;*BRINCHES, V. *Dic.;* CÂM. DEP.\n*Deputados;*CÂM. DEP. *Relação* *dos dep.;*COELHO, J. *Dic.;*CONG. BRAS.\nESCRITORES, I; COUTINHO, A. *Brasil; Encic. Mirador; Grande encic.\nDelta; Grande* *encic. portuguesa;*HIRSCHOWICZ, E. *Contemporâneos;\nJornal do Brasil*(21/7/82); LEITE, A. *História;*LEVINE, R.\n*Vargas;*MENESES, R. *Dic.;*MOREIRA, J. *Dic.;*OLIVEIRA,\nC.*Biografias;*PERALVA, O. *Retrato;*POERNER, A. *Poder;*REIS, A.\n*Bibliografia bras.;* SILVA, G. *Constituinte;*SILVA, H. *1934;* SILVA,\nH. *1935;*SOUSA, J.*Teatro; Súmulas; Who’s who in Brazil; Who’s who in\nLatin.*\n\n\n","dic":"DHBB"}
