{"title":"FORTES, Heráclito","cargoss":["Deputado federal","Constituinte","Prefeito","Deputado federal","Senador"],"cargos_esp":[0,0,"Teresina",0,0],"datas_ini":[1982,1987,1989,1995,2003],"datas_fim":[1988,1988,1993,2002,0],"estados":["PI",0,0,"PI","PI"],"autor":[0],"content":"**FORTES, Heráclito**\n\n\\*dep. fed. PI 1982-1988; const. 1987-1988; pref. Teresina 1989-1993;\ndep. fed. PI 1995-2002; sen. PI 2003-\n\n \n\nHeráclito de Sousa Fortes nasceu em Teresina no dia 1º de agosto de\n1950, filho de Valdir de Carvalho Fortes e de Ceci de Sousa Fortes. Seu\nprimo em segundo grau Antônio de Almendra Freitas Neto foi deputado\nfederal pelo Piauí em 1983 e de 1986 a 1987; governador desse estado de\n1991 a 1994; senador de 1995 a 1998 e de 1999 a 2003, além de ministro\nextraordinário das Reformas Institucionais em 1998 e secretário\nmunicipal de Planejamento e Coordenação da Prefeitura Municipal de\nTeresina (SEMPLAM) em 2007.\n\nIniciou seus estudos superiores no Centro de Ensino Unificado de\nBrasília (CEUB), mas não chegou a completar o curso de ciências\njurídicas e sociais.\n\nFuncionário público de carreira ingressou na política em 1970\nfiliando-se****à Aliança Renovadora Nacional (Arena), partido de apoio\nao regime militar vigente no país. Transferiu-se para Recife e, em 1971,\nfoi nomeado oficial de gabinete do vice-governador de Pernambuco Barreto\nGuimarães. Ocupou esse cargo até 1973, quando se transferiu para\nBrasília, onde se tornou assessor do presidente do Instituto Nacional de\nColonização e Reforma Agrária (INCRA), função que desempenhou até 1975.\nNesse ano, transferiu-se, também na capital federal, para a assessoria\ndo recém-nomeado presidente da Empresa Brasileira de Transportes Urbanos\n(EBTU), o ex-governador piauiense Alberto Silva. Em 1978, deixou o cargo\npara disputar uma vaga na Câmara dos Deputados.\n\nNas eleições de novembro de 1978 concorreu pela Arena obteve a segunda\nsuplência. No ano seguinte, foi nomeado assessor parlamentar do ministro\nda Educação e Cultura, Eduardo Portela (1979-1980). Com a extinção do\nbipartidarismo em novembro de 1979 e a consequente reformulação\npartidária, filiou-se no ano seguinte ao Partido Popular (PP). Quando o\ngeneral Rubem Ludwig (1980-1982) foi nomeado ministro, permaneceu no\nMinistério da Educação e Cultura, com a função de assessor parlamentar e\ncoordenador de assuntos parlamentares. Deixou a assessoria em 1982,\nquando se desincompatibilizou para concorrer a mandato eletivo.  Também\nnesse ano, com a incorporação do PP ao Partido do Movimento Democrático\nBrasileiro (PMDB), filiou-se a esse partido.\n\nNo pleito de novembro de 1982 foi eleito deputado federal pelo Piauí em\nsua nova legenda. Pouco depois das eleições, no dia 21 de novembro,\nassumiu ainda como suplente a vaga aberta na Câmara com a morte do\ndeputado José Pinheiro Machado e passou a integrar, como titular, a\nComissão do Interior e, como suplente, a Comissão de Comunicação. Com o\ninício da nova legislatura em fevereiro de 1983, assumiu sua cadeira na\nCâmara dos Deputados e continuou como membro titular da Comissão do\nInterior, da qual se tornou segundo-vice-presidente, e como suplente da\nComissão de Comunicação, participando ainda da Comissão de Esporte e\nTurismo, da qual também seria vice-presidente.\n\nTambém no início da legislatura, o deputado Dante de Oliveira (PMDB-MT)\napresentou à Câmara um projeto de emenda constitucional restabelecendo\neleições diretas para a presidência da República já no ano seguinte.\nEncampado pelas forças de oposição, o projeto desencadeou uma campanha\nnacional que ficou conhecida como Diretas Já. Na sessão da Câmara dos\nDeputados do dia 25 de abril de 1984, a emenda Dante de Oliveira recebeu\no voto favorável Heráclito Fortes, mas não foi aprovada, por falta de 22\nvotos. Isso significou que a sucessão presidencial seria mais uma vez\ndecidida por via indireta. Em agosto, a convenção nacional do PDS\naprovou a candidatura do ex-governador de São Paulo e deputado federal\nPaulo Maluf, que derrotou o ministro do Interior, coronel Mário\nAndreazza. Por seu lado, a oposição, reunida na Aliança Democrática —\ncoligação do PMDB com a Frente Liberal, dissidência da agremiação\ngovernista, o Partido Democrático Social (PDS) —, lançou a candidatura\ndo ex-governador de Minas Gerais Tancredo Neves, tendo como vice o\nsenador José Sarney.\n\nHeráclito Fortes tornou-se um dos articuladores da campanha de Tancredo.\nComo coordenador político da bancada do Piauí na Câmara e membro da\ncomissão executiva nacional do PMDB, em meados do segundo semestre de\n1984 ofereceu, em seu apartamento em Brasília, um jantar de\nconfraternização entre membros do PMDB e da Frente Liberal, unidos em\ntorno da candidatura do ex-governador mineiro. No dia 15 de janeiro de\n1985, na reunião do Colégio Eleitoral, votou em Tancredo Neves, que\nderrotou Paulo Maluf. Porém, o presidente eleito adoeceu na véspera da\nposse, fato que levou o vice José Sarney a assumir o governo em caráter\ninterino no dia 15 de março, e ser efetivado no mês seguinte, após a\nmorte do titular.\n\nCom o fim do ciclo de presidentes militares, o Congresso tratou de\nrestabelecer eleições diretas para as prefeituras das capitais e dos\nmunicípios considerados áreas de segurança nacional. Em sessão realizada\nno dia 13 de junho de 1985, Heráclito Fortes votou a favor do projeto,\nque foi aprovado, bem como da realização de dois turnos nessas eleições,\nquando o candidato mais votado não atingisse a maioria absoluta. Na\ndiscussão sobre a convocação de uma Assembléia Nacional Constituinte,\nvotou pela delegação de poderes constituintes ao Congresso Nacional que\nseria eleito em novembro de 1986, proposta que terminou vencedora.\n\n Nesse pleito, reelegeu-se deputado federal constituinte. Iniciando seu\nnovo mandato na Câmara em 1º de fevereiro de 1987, tornou-se\nterceiro-secretário da mesa e vice-líder do governo. Instalada a\nAssembléia Nacional Constituinte (ANC) nesse mesmo dia, passou a\nintegrar, como titular, a Subcomissão do Sistema Eleitoral e Partidos\nPolíticos, vinculada à Comissão da Organização Eleitoral, Partidária e\nGarantia das Instituições. Foi também suplente da Subcomissão dos\nNegros, Populações Indígenas, Pessoas Deficientes e Minorias,\nsubordinada à Comissão da Ordem Social.\n\nFavorável à adoção do parlamentarismo no Brasil, em artigo publicado em\njunho de 1987 no jornal *O Globo*, procurou demonstrar não haver\nincompatibilidade entre o federalismo como forma de organização do\nEstado e o parlamentarismo como sistema de governo. Tentou também provar\nsua eficácia através de exemplos de países que já haviam adotado o\nparlamentarismo. Via, então, a possibilidade de se instaurar tal sistema\nde governo no Brasil, devendo-se apenas encontrar uma forma de adaptação\nem função das tradições políticas e condições socioeconômicas e\nculturais específicas do país.\n\nDurante o período de elaboração da Constituição, votou a favor do\nmandado de segurança coletivo, da proteção ao emprego contra a despedida\nsem justa causa, do turno ininterrupto de seis horas, da unicidade\nsindical, da soberania popular, do voto aos 16 anos, da nacionalização\ndo subsolo, da estatização do sistema financeiro, do limite de 12% ao\nano para os juros reais, da proibição do comércio de sangue, do mandato\nde cinco anos para o então presidente José Sarney (1985-1990), da\nanistia aos micro e pequenos empresários e do aborto. Votou contra a\npena de morte, a limitação do direito de propriedade privada, a\nremuneração 50% superior para o trabalho extra, a jornada semanal de 40\nhoras, a pluralidade sindical, o presidencialismo, a limitação dos\nencargos da dívida externa, a criação de um fundo de apoio à reforma\nagrária e a legalização do jogo do bicho. Absteve-se de votar sobre o\nrompimento de relações diplomáticas com países com política de\ndiscriminação racial e sobre a desapropriação da propriedade produtiva.\n\nApós a promulgação da Constituição em 5 de outubro de 1988, nas eleições\nmunicipais no mês seguinte elegeu-se prefeito de Teresina na legenda do\nPMDB. Deixou a Câmara dos Deputados em dezembro desse ano, e foi\nempossado na prefeitura da capital piauiense em 1º de janeiro de 1989 em\nsubstituição a Raimundo Wall Ferraz. Sua cadeira no Legislativo foi\nocupada por Manuel Domingos Neto, do PMDB, que mais tarde se\ntransferiria para o Partido Comunista do Brasil (PCdoB).****Exerceu seu\nmandato de prefeito até 1º de janeiro de 1993, quando passou o cargo a\nseu sucessor Wall Ferraz. Nesse ano assumiu a presidência do Postalis\nInstituto de Seguridade Social dos Correios e Telégrafos, em Brasília,\nno qual permaneceu até o ano seguinte, quando se desincompatibilizou\npara disputar uma vaga na Câmara dos Deputados.\n\nEm outubro de 1994, já filiado ao Partido da Frente Liberal\n(PFL),****elegeu-se deputado federal, iniciando seu mandato em fevereiro\ndo ano seguinte. Ainda em 1995 tornou-se Presidente do Instituto de\nPrevidência dos Congressistas (IPC). Tornou-se membro titular da\nComissão de Fiscalização e Controle, vice-líder do seu partido e do\nbloco composto pelo PFL e o Partido Trabalhista Brasileiro (PTB).\n\nDurante os trabalhos legislativos, apoiou todos os projetos de emenda\nconstitucional de interesse do governo. Assim, votou a favor do fim do\nmonopólio dos estados na distribuição de gás canalizado, da liberação da\nnavegação de cabotagem para as embarcações estrangeiras no país, da\nmudança no conceito de empresa nacional, do fim do monopólio estatal das\ntelecomunicações, do fim do monopólio da Petrobras na exploração do\npetróleo e da prorrogação por 18 meses do Fundo Social de Emergência\n(FSE), rebatizado de Fundo de Estabilização Fiscal (FEF). No ano\nseguinte, votou a favor da recriação do imposto do cheque, que deixou de\nse chamar Imposto Provisório sobre Movimentação Financeira (IPMF) e\nganhou o novo nome de Contribuição Provisória sobre Movimentação\nFinanceira (CPMF).\n\nEm janeiro de 1997, votou a favor do projeto de emenda constitucional\nque permitia aos ocupantes do Poder Executivo concorrerem à reeleição,\nratificando sua posição em fevereiro seguinte, quando foi aprovada a\nreeleição no segundo turno de votação na Câmara dos Deputados. Nesse\nmesmo mês deixou a vice-liderança do PFL e foi eleito para a mesa\ndiretora da Câmara como primeiro-vice-presidente, função que exerceria\npor dois anos. Em novembro de1997 votou a favor do projeto de reforma\nadministrativa do governo que acabou com a estabilidade do servidor\npúblico.\n\nNo pleito de outubro de 1998 reelegeu-se deputado federal com 88.602\nvotos, obtendo a maior votação do partido e a segunda de todo o estado.\nNo mês seguinte, votou a favor do projeto do governo de reforma da\nPrevidência que estabeleceu um valor máximo para aposentadorias no setor\npúblico, bem como a idade mínima e o tempo de contribuição no setor\nprivado. Em fevereiro de 1999 iniciou novo período legislativo na Câmara\ndos Deputados. Nesse mesmo ano voltou ser eleito primeiro\nvice-presidente da Câmara dos Deputados, cargo que ocupou até 2001,\nquando passou a ocupar a função de líder do governo no Congresso.\n\nNo pleito de outubro de 2002, foi eleito senador pelo Piauí na legenda\ndo PFL. Teve 600 mil votos, o que lhe assegurou a maior votação do\nestado. Em dezembro deixou o mandato de deputado federal e assumiu a\nsecretaria Estadual de Defesa Civil do Piauí, na qual permaneceu até\njaneiro de 2003. Em fevereiro foi empossado senador e eleito\nterceiro-secretário da Mesa Diretora. Ocupou essa posição até 2005,\nquando foi eleito presidente da Comissão de Infra-Estrutura do Senado\nFederal, para um mandato de dois anos. Participou da Comissão\nParlamentar Mista de Inquérito (CPMI) dos Correios e foi suplente da\nCPMI da Compra de Votos (Mensalão), da CPI dos Bingos e da CPMI do\nBanestado.\n\nDe 2005 a 2006 presidiu o Grupo Brasileiro da União Interparlamentar. Em\n2007, com a extinção do PFL e a criação do Democratas (DEM), filiou-se a\nessa agremiação. Foi sexto vice-líder do Bloco Parlamentar da Minoria no\nSenado Federal desse ano até maio de 2008, quando foi eleito primeiro\nvice-líder do Bloco. Ainda em 2007 votou pelo fim da CPMF, que acabou\nsendo extinta pelo Senado. Presidiu a Comissão de Relações Exteriores e\nDefesa Nacional até 2009, integrou como titular a CPI das ONGs, o\nConselho da Ordem do Congresso Nacional, a Comissão de Serviços de\nInfraestrutura, a Comissão de Meio Ambiente, Defesa do Consumidor e\nFiscalização e Controle e a Comissão de Educação, Cultura e Esporte, e\nfoi suplente das comissões de Direitos Humanos e Legislação\nParticipativa, de Assuntos Sociais, de Assuntos Econômicos, e de\nAgricultura e Reforma Agrária.   \n\nAinda em 2009 foi eleito primeiro-secretário do Senado. Assumiu o cargo\nem meio a uma crise marcada por denúncias sobre atos secretos realizados\npelo diretor-geral da casa, Agaciel Maia. Responsável pela investigação\ndas denúncias, criou, em maio, uma comissão de sindicância que revelou\nque o mecanismo fora usado 663 vezes entre os anos de 1995 e 2009. Em\njunho, os partidos DEM, PSDB e PDT pediram, no plenário, o afastamento\ndo presidente do Senado José Sarney. Na ocasião, Heráclito Fortes\nsugeriu a renúncia coletiva de todos os dirigentes do Senado e\ndeclarou-se contrário à proposta de seu partido de pedir o afastamento\nde Sarney.\n\nCasou-se com Mariana Brennand Fortes, com quem teve três filhas.\n\nGiana Araújo/Alan Carneiro\n\n \n\nFONTES: ASSEMB. NAC. CONST.*Repertório.*(1987-1988); CÂM. DEP.\n*Deputados brasileiros.*Repertório (1983-1987, 1995-1999); *Estado de S.\nPaulo*(28/11/97); *Estado d*e *S. Paulo* (online), 13 dez. 2007.\nDisponível em : \\<http://www.estadao.com.br\\>; *Folha de S. Paulo*\n(12/10/86, 19/1 e 31/3/87, 14/1/96, 30/1/97, 10/4 e 6/11/98); *Globo*\n(16/1/85, 20/6/87 e 15/11/96, 29/1/97,10/10/98, 19,24,26/6 e\n1/7/09);Homepage do senador Heráclito Fortes. Disponível em :\n\\<http://www.senado.gov.br/web/senador/heraclitofortes/index.htm\\>; INF.\nBIOG.; *Jornal do Brasil* (17/3/85, 16/1/86); Portal do Senado Federal.\nDisponível em :\n\\<[http://www.senador.gov.br](http://www.senador.gov.br/)\\>. Acesso em :\n28 set. 2009; TRIB. REG. ELEIT. PI. *Eleições 1998*. Disponível em :\n\\<http://www.tre-pi.gov.br/novo/home/resultado1998.jsp\\>; *Veja*\n(1/8/84).\n\n \n","ref":"FONTES: ASSEMB. NAC. CONST.*Repertório.*(1987-1988); CÂM. DEP.\n*Deputados brasileiros.*Repertório (1983-1987, 1995-1999); *Estado de S.\nPaulo*(28/11/97); *Estado d*e *S. Paulo* (online), 13 dez. 2007.\nDisponível em : \\<http://www.estadao.com.br\\>; *Folha de S. Paulo*\n(12/10/86, 19/1 e 31/3/87, 14/1/96, 30/1/97, 10/4 e 6/11/98); *Globo*\n(16/1/85, 20/6/87 e 15/11/96, 29/1/97,10/10/98, 19,24,26/6 e\n1/7/09);Homepage do senador Heráclito Fortes. Disponível em :\n\\<http://www.senado.gov.br/web/senador/heraclitofortes/index.htm\\>; INF.\nBIOG.; *Jornal do Brasil* (17/3/85, 16/1/86); Portal do Senado Federal.\nDisponível em :\n\\<[http://www.senador.gov.br](http://www.senador.gov.br/)\\>. Acesso em :\n28 set. 2009; TRIB. REG. ELEIT. PI. *Eleições 1998*. Disponível em :\n\\<http://www.tre-pi.gov.br/novo/home/resultado1998.jsp\\>; *Veja*\n(1/8/84).\n\n \n","dic":"DHBB"}
