{"title":"FRAGA, Antônio Magalhães","cargoss":["Deputado federal"],"cargos_esp":[0],"datas_ini":[1959],"datas_fim":[1963],"estados":["BA"],"autor":[0],"content":"**FRAGA, Antônio Magalhães**\n\n\\*dep. fed. BA 1959-1963.\n\n \n\n*Antônio Magalhães Fraga* nasceu em Santo Antônio de Jesus (BA) no dia\n1º de setembro de 1906, filho de Francisco Magalhães Fraga e Maria\nAugusta Fraga.\n\nEstudou nos colégios Antônio Vieira e Carneiro Ribeiro, ambos em\nSalvador.\n\nFoi prefeito de sua cidade natal de 1947 a 1950. Em outubro desse ano,\ndisputou uma cadeira na Assembléia Legislativa da Bahia pela legenda do\nPartido Republicano (PR). Eleito, exerceu o mandato entre 1951 e 1955.\nNovamente prefeito de Santo Antônio de Jesus entre os anos de 1955 e\n1958, em outubro deste ano candidatou-se com êxito a deputado federal\npela Bahia pelo PR. Iniciou o mandato em fevereiro de 1959. Deixou a\nCâmara dos Deputados em janeiro de 1963, ao término da legislatura, não\ntendo conseguido reeleger-se em outubro de 1962.\n\nProprietário de fazenda de criação de gado e culturas cítricas, Antônio\nMagalhães Fraga foi também exportador de fumo em associação com a\ncompanhia inglesa Carleoni Ltda.\n\nFaleceu em Salvador no dia 22 de novembro de 1964.\n\nEra casado com Maria da Conceição Argolo Fraga, com quem teve cinco\nfilhos.\n\n \n\n \n\nFONTES: CÂM. DEP. *Deputados*; CÂM. DEP. *Deputados brasileiros.\nRepertório* (1946-1967); CÂM. DEP. *Relação dos dep*.; INF. BIOG. Maria\nLuísa Argolo Fraga; TRIB. SUP. ELEIT. *Dados* (4).\n\n \n","ref":"FONTES: CÂM. DEP. *Deputados*; CÂM. DEP. *Deputados brasileiros.\nRepertório* (1946-1967); CÂM. DEP. *Relação dos dep*.; INF. BIOG. Maria\nLuísa Argolo Fraga; TRIB. SUP. ELEIT. *Dados* (4).\n\n \n","dic":"DHBB"}
