{"title":"FRAGA, Hélio","cargoss":["Reitor"],"cargos_esp":["UFRJ"],"datas_ini":[1973],"datas_fim":[1977],"estados":[0],"autor":[0],"content":"**FRAGA, Hélio**\n\n\\*reitor UFRJ 1973-1977.\n\n \n\n*Hélio Fraga* nasceu em Salvador no dia 22 de abril de 1911, filho de\nClementino da Rocha Fraga Júnior e de Olindina da Silva Fraga. Seu pai\nfoi médico, professor universitário, deputado federal pela Bahia de 1921\na 1926 e de 1954 a 1955 e membro da Academia Brasileira de Letras. Seu\nirmão, Clementino Fraga Filho, foi vice-reitor da Universidade Federal\ndo Rio de Janeiro (UFRJ), além de diretor do Hospital Universitário,\ncatedrático de clínica médica e diretor da Faculdade de Medicina dessa\nuniversidade.\n\nDiplomado em 1933 pela Faculdade de Medicina do Rio de Janeiro, então\nDistrito Federal, afastou-se logo depois da vida profissional por\nmotivos de saúde. Posteriormente, entretanto, voltou à prática médica.\nFoi chefe de clínica tisiológica dos hospitais Santa Maria e São\nSebastião, no Rio de Janeiro, iniciando-se no campo do ensino em 1952\ncomo professor-assistente de tisiologia na Universidade do Brasil. Em\n1959, participou do XIV Congresso Brasileiro de Higiene, realizado em\nNiterói, e da XV Conferência Internacional de Tuberculose, em Istambul,\nna Turquia. Em 1962, tornou-se chefe da divisão de ensino do Instituto\nde Tisiologia e Pneumologia da UFRJ, cargo no qual permaneceu até 1973.\n\nIngressou na administração pública como assessor do ministro da Saúde\nRaimundo de Brito (abril de 1964 a março de 1967), atuando também na\ncondição de membro do Conselho Nacional de Saúde entre 1965 e 1968. No\nano seguinte, foi nomeado vice-reitor da UFRJ e, quatro anos mais tarde,\nindicado para assumir o cargo de reitor dessa universidade, sucedendo a\nDjacir Meneses em agosto de 1973. Permaneceu no cargo até setembro de\n1977, quando foi substituído por Luís Renato Caldas.\n\nHélio Fraga foi diretor da Campanha Nacional contra a Tuberculose,\npresidente da Comissão Técnica do Departamento de Tuberculose do Estado\nda Guanabara, membro da Sociedade Brasileira de Tuberculose, da União\nInternacional de Combate à Tuberculose e da American Trudeau Society.\nParticipou dos oitavo, nono e décimo congressos nacionais de\ntuberculose, trabalhando também como tisiologista consultor no\nLaboratório Central de Tuberculose. Coube-lhe ainda promover e coordenar\no Fórum de Ciência e Cultura da UFRJ.\n\nFaleceu no Rio de Janeiro no dia 18 de maio de 1982.\n\nFoi casado com Maria Helena Alves Pinto Fraga, com quem teve três\nfilhos.\n\nEscreveu diversas obras sobre sua especialidade.\n\n \n\n \n\nFONTES: COUTINHO, A. *Brasil; Encic. Mirador; Grande encic. Delta.;\nJornal do Brasil*(9/1/71; 16/8/73; 19/10/77 e 27/5/78);*Perfil*(1974).\n\n \n","ref":"FONTES: COUTINHO, A. *Brasil; Encic. Mirador; Grande encic. Delta.;\nJornal do Brasil*(9/1/71; 16/8/73; 19/10/77 e 27/5/78);*Perfil*(1974).\n\n \n","dic":"DHBB"}
