{"title":"FRANÇA, Erivan","cargoss":["Deputado federal"],"cargos_esp":[0],"datas_ini":[1968],"datas_fim":[1969],"estados":["RN"],"autor":[0],"content":"**FRANÇA, Erivan**\n\n\\*dep. fed. RN 1968-1969.\n\n \n\n*Erivan Santiago França* nasceu em Natal no dia 12 de dezembro de 1925,\nfilho de Adolfo Elias França e de Cleópatra Santiago França.\n\nCompletou seus estudos no Colégio Marista de Natal.\n\nSecretário particular e auxiliar de gabinete do presidente João Café\nFilho (agosto de 1954 a novembro de 1955), foi jornalista\nprofissional****do Jornal do Brasil desde****1958,****e da Tribuna da\nImprensa.****Também fez parte da Revista da Semana.\n\nDiretor do Departamento de Pessoal do Estado do Rio Grande do Norte, de\n1960 a 1962, foi chefe do Gabinete Civil no governo de Aluísio Alves\n(1961-1965), no Rio Grande do Norte, de 1961 a 1962.\n\nEm outubro de 1962, elegeu-se deputado estadual no Rio Grande do Norte\nna legenda da Cruzada da Esperança, coligação formada pelo Partido\nSocial Democrático (PSD) e o Partido Democrata Cristão (PDC),****sendo\nvice-líder da bancada do governo,****e assumindo o mandato em fevereiro\nde 1963. Em outubro de 1965, disputou uma vaga na Câmara dos Deputados\npor seu estado natal na legenda da Aliança Renovadora Nacional (Arena),\nagremiação de apoio ao regime militar instalado no país em abril de\n1964, mas obteve apenas uma suplência. Em janeiro do ano seguinte,\ndeixou a Assembléia Legislativa do Rio Grande do Norte, ao final da\nlegislatura.\n\nVeio a ocupar uma cadeira de deputado federal em abril de 1968, tendo\npresidido a Comissão de Finanças da Câmara. Em 12 de dezembro de 1968\nvotou contra a concessão de licença para processar o deputado Márcio\nMoreira Alves. Com base no Ato Institucional nº 5, editado no dia\nseguinte, teve seu mandato cassado em fevereiro de 1969.\n\nApós a perda do mandato, transferiu-se para o Rio de Janeiro, onde\ntrabalhou na Editora Nosso Tempo, exercendo o cargo de diretor\ncomercial. Pouco depois, transferiu-se para a União de Empresas\nBrasileiras (UEB), sediada na mesma cidade,****onde permaneceu de 1969 a\n1979.\n\nCom a extinção do bipartidarismo em novembro de 1979 e a conseqüente\nreformulação partidária, filiou-se ao Partido do Movimento Democrático\nBrasileiro (PMDB), e nessa legenda concorreu a uma cadeira na Câmara dos\nDeputados pelo estado do Rio Grande do Norte no pleito de novembro de\n1982, obtendo apenas uma suplência. Desde então, não voltou mais a\ndisputar nenhum mandato eletivo.\n\nEm 1981 ocupou o cargo de diretor administrativo e financeiro da\nFundação Rio, órgão da Prefeitura do Rio de Janeiro, a convite do então\npresidente dessa instituição, Gerardo Melo Mourão. Em 1985 assumiu a\nassessoria especial do ministro da Administração, Aluísio Alves, no\ngoverno de José Sarney. Em 1987, convidado pelo prefeito Garibaldi Alves\nFilho, tornou-se secretário municipal da Prefeitura de Natal.\n\nFaleceu em Natal no dia 30 de maio de 1988.\n\nFoi casado com Marilda Carneiro França, com quem teve três filhos.\nContraiu segundas núpcias com Neli Maria Fanfa Ribas França, com quem\nteve mais três filhos. O pai de sua segunda esposa, João Fanfa Ribas,\nfoi constituinte de 1934 e deputado federal pelo Rio Grande do Sul entre\n1935 e 1937.\n\n \n\nFONTES: ARQ. DEP. PESQ. JORNAL DO BRASIL; CÂM. DEP. *Deputados*; CÂM.\nDEP. *Deputados brasileiros. Repertório*; INF. Andréia Lucia Fanfa Ribas\nFrança; *Jornal do Brasil* (14/2/78).\n\n \n","ref":"FONTES: ARQ. DEP. PESQ. JORNAL DO BRASIL; CÂM. DEP. *Deputados*; CÂM.\nDEP. *Deputados brasileiros. Repertório*; INF. Andréia Lucia Fanfa Ribas\nFrança; *Jornal do Brasil* (14/2/78).\n\n \n","dic":"DHBB"}
