{"title":"FRANÇA, João","cargoss":["Senador"],"cargos_esp":[0],"datas_ini":[1991],"datas_fim":[1999],"estados":["RR"],"autor":[0],"content":"**FRANÇA, João**\n\n\\*sen. RR 1991-1999.\n\n*João França Alves* nasceu em Missão Velha (CE) no dia 8 de outubro de\n1939, filho de Antônio França Alves e de Adelaide Fernandes Gonçalves.\n\nComeçou sua vida profissional no Maranhão, onde trabalhou, de 1954 a\n1959, como agente fiscal e deu início à sua atuação política como cabo\neleitoral de José Sarney, candidato a deputado federal ligado à União\nDemocrática Nacional (UDN), nos pleitos de 1955 e 1958. De 1966 a 1970,\nfoi juiz de paz.\n\nEm 1971, transferiu-se para Boa Vista, capital do então território de\nRoraima, exercendo a profissão de mestre-de-obras e participando, no\ninício dos anos 1980, da fundação do Partido Democrático Trabalhista\n(PDT). Nessa legenda, candidatou-se, sem êxito, a uma cadeira na Câmara\nMunicipal de Boa Vista em novembro de 1982.\n\nEm 1988, abriu uma microempresa na área da construção civil, a J. F.\nAlves. Manteve-se, todavia, vinculado à política e, em outubro de 1990,\nnas primeiras eleições diretas para governador e senadores de Roraima,\nque se tornaria estado a partir de então, elegeu-se primeiro suplente de\nsenador na chapa de Hélio Campos, lançado pelo Partido Democrático\nSocial (PDS) e o mais votado dos candidatos ao Senado no estado. Com a\nmorte do titular, em 25 de abril de 1991, ocupou sua vaga, herdando um\nmandato de oito anos. Ao tomar posse, no dia 30 de abril, afirmou que\nseu ideal político seria trabalhar por Roraima e, como membro de um\npartido que compunha a base governista, ajudar o presidente Fernando\nCollor de Melo, eleito em dezembro de 1989. Posteriormente, desligou-se\ndo PDS e passou a integrar a bancada do Partido Progressista (PP), do\nqual se tornaria mais tarde vice-líder no Senado.\n\nEm 29 de dezembro de 1992, votou favoravelmente ao *impeachment* de\nCollor, acusado de crime de responsabilidade por ligações com um esquema\nde corrupção liderado pelo ex-tesoureiro de sua campanha presidencial,\nPaulo César Farias. Afastado da presidência logo após a votação na\nCâmara, Collor renunciou ao mandato em 29 de dezembro, pouco antes da\nconclusão do processo pelo Senado Federal. Com a renúncia, o vice,\nItamar Franco, que desde 2 de outubro exercia o cargo interinamente, foi\nefetivado na presidência da República.\n\nEm 1995, João França mudou novamente de legenda, filiando-se ao Partido\ndo Movimento Democrático Brasileiro (PMDB). No mesmo ano, votou a favor\ndas propostas de reforma do Estado, apresentadas pelo presidente\nFernando Henrique Cardoso, que incluíam a quebra do monopólio estatal\ndas telecomunicações, bem como da Petrobras na exploração do petróleo.\nFoi igualmente favorável à criação da Contribuição Provisória sobre\nMovimentação Financeira (CPMF), imposto de 0,2% sobre transações\nbancárias, criado como fonte complementar de recursos para a saúde, e\nque viria a substituir o Imposto Provisório sobre Movimentação\nFinanceira (IPMF), votado em novembro.\n\nEm fevereiro de 1996, votou a favor da prorrogação do Fundo Social de\nEmergência (FSE), rebatizado de Fundo de Estabilização Fiscal (FEF), que\npermitia ao governo gastar 20% da arrecadação de impostos, sem\nvinculação obrigatória aos setores de saúde e educação.\n\nNo ano de 1997, desligou-se do PMDB e ingressou no Partido Progressista\nBrasileiro (PPB). Em maio-junho, votou favoravelmente à reeleição para\npresidente, governadores e prefeitos e, em outubro, ao fim da\naposentadoria por tempo de serviço, item fundamental da reforma da\nprevidência que permitiria estabelecer novas regras de aposentadoria,\ncombinando idade mínima (60 anos para homem e 55 para mulher) com tempo\nde contribuição (35 anos para homem e 30 para mulher). Em março de 1998,\nvotou a favor do projeto de emenda constitucional da reforma\nadministrativa permitindo a demissão de servidores públicos por mau\ndesempenho e/ou excesso de gastos com a folha de pagamento.\n\nNo pleito de outubro de 1998, não se candidatou a cargo eletivo,\ndeixando o Senado ao final da legislatura, em fevereiro de 1999.\n\nCasou-se com Lucimar Miranda Silva Alves, com quem teve seis filhos.\n\nFONTES:*****Estado de S. Paulo*(1/5/91 e 17/10/93); *Folha de S.\nPaulo*(1/5/91, 5/2 e 29/9/98); *Jornal do Brasil* (27/4 e 1/5/91);\nSENADO*. Dados biográficos* (1991-1999); *Veja* (8/5/96).\n\n \n","ref":"FONTES:*****Estado de S. Paulo*(1/5/91 e 17/10/93); *Folha de S.\nPaulo*(1/5/91, 5/2 e 29/9/98); *Jornal do Brasil* (27/4 e 1/5/91);\nSENADO*. Dados biográficos* (1991-1999); *Veja* (8/5/96).\n\n \n","dic":"DHBB"}
