{"title":"FRANÇA, Roberto","cargoss":["Deputado federal"],"cargos_esp":[0],"datas_ini":[1991],"datas_fim":[1995],"estados":["PE"],"autor":[0],"content":"**FRANÇA, Roberto**\n\n\\*dep. fed. PE 1991-1995.\n\n*Roberto França Filho* nasceu em Recife no dia 20 de maio de 1951, filho\nde Roberto da Fonte Moreira França e Ângela Trocoli França.\n\nEm 1968 iniciou sua atividade política como diretor da Associação\nRecifense dos Estudantes Secundaristas. Ingressou no curso de direito da\nUniversidade Federal de Pernambuco (Ufpe) em 1970, tendo se formado\nquatro anos mais tarde.\n\nEm 1975 tornou-se secretário de gabinete parlamentar do senador Marcos\nFreire, do Movimento Democrático Brasileiro (MDB) — partido de oposição\nao regime militar instalado no país em abril de 1964 —, posição que\nocuparia durante três anos. Ainda em 1975 tornou-se membro da comissão\nexecutiva do diretório regional do MDB, permanecendo no cargo até 1977.\nDe 1978 a 1981 foi secretário de gabinete na Assembléia Legislativa de\nPernambuco.\n\nCom a extinção do bipartidarismo em novembro de 1979 e a conseqüente\nreformulação partidária, no ano seguinte, foi um dos fundadores do\nPartido do Movimento Democrático Brasileiro (PMDB) em Olinda. Em 1980\npassou a presidir o Centro de Cultura Professor Luís Freire, em Olinda,\ncargo no qual permaneceria durante dois anos. Em 1981 assumiu a\nsecretaria geral do diretório municipal do PMDB, passando a presidente\nno ano seguinte.\n\nNão teve sucesso ao candidatar-se a prefeito de Olinda em 1982. No ano\nseguinte, participou do I Curso Interdisciplinar em Direitos Humanos no\nInstituto Interamericano de Direitos Humanos (IIDH), em São José, Costa\nRica. De 1985 até 1991 foi procurador judicial da prefeitura de Recife.\nAinda em 1985 participou do Colóquio Internacional Estado de Exceção e o\nRespeito aos Direitos Humanos nos Países do Cone Sul, promovido pelo\nIIDH em Montevidéu, Uruguai, da comissão estadual permanente para\nassuntos relativos à prevenção e repressão da violência, de Pernambuco,\ne passou a presidir a Comissão de Justiça e Paz da Arquidiocese de\nOlinda e Recife, mantendo-se no cargo até o ano seguinte.\n\nEm 1986 coordenou o programa Mutirão contra a Violência, idealizado pela\nPrefeitura de Recife na gestão de Jarbas Vasconcelos. Foi secretário de\nJustiça de Pernambuco de 1988 a 1990, quando passou a comandar a\nSecretaria de Segurança Pública. Ainda em 1990 foi o fundador e primeiro\ncoordenador do gabinete de assessoria jurídica às organizações populares\nde Olinda. Transferiu-se para o Partido Socialista Brasileiro (PSB),\ntornando-se vice-presidente do diretório regional.\n\nEm 1990 foi eleito deputado federal na legenda do PSB. No primeiro ano\nde mandato atuou como membro titular das comissões de Viação e\nTransportes, Desenvolvimento Urbano e Interior e de Defesa Nacional da\nCâmara.\n\nNa sessão da Câmara dos Deputados de 29 de setembro de 1992 votou a\nfavor da abertura do processo de *impeachment* do presidente da\nRepública, Fernando Collor de Melo, acusado de crime de responsabilidade\npelo envolvimento em um amplo esquema de corrupção liderado pelo\nex-tesoureiro de sua campanha presidencial, Paulo César Farias. Afastado\nda presidência logo após a decisão da Câmara, Collor renunciou ao\nmandato pouco antes da conclusão do processo, pelo Senado Federal, em 29\nde dezembro de 1992. O vice Itamar Franco, que já vinha exercendo o\ncargo interinamente desde 2 de outubro, foi então efetivado na\npresidência da República.\n\nAinda nesta legislatura, Roberto França votou a favor da criação do\nFundo Social de Emergência (FSE), que permitiu ao governo gastar 20% da\narrecadação de impostos sem que esta verba ficasse vinculada aos setores\nde saúde e educação. Ausentou-se nas votações sobre a criação do Imposto\nProvisório sobre Movimentações Financeiras (IPMF) — taxação de 0,25%\nsobre transações bancárias criada como fonte complementar de recursos\npara a área da saúde — e sobre o fim do voto obrigatório.\n\nNão conseguiu se reeleger deputado federal em 1994 e deixou a Câmara ao\ntérmino do seu mandato, em janeiro de 1995.\n\nAssumiu o cargo de secretário de Justiça de Pernambuco, na gestão do\ngovernador Miguel Arrais (1995-1999). Com o término deste governo voltou\na exercer o cargo de procurador judicial da Prefeitura de Recife.\n\nPublicou *Travessia*(1994).\n\nCasou-se com Janeide Maria Gomes França, com quem teve três filhas.\n\nFONTES: CÂM. DEP. *Deputados brasileiros. Repertório*(1991-1995);\nENTREV. BIOG.; *Folha de S. Paulo*(18/9/94).\n\n \n","ref":"FONTES: CÂM. DEP. *Deputados brasileiros. Repertório*(1991-1995);\nENTREV. BIOG.; *Folha de S. Paulo*(18/9/94).\n\n \n","dic":"DHBB"}
