{"title":"FRANÇA, Tadeu","cargoss":["Deputado federal","Constituinte"],"cargos_esp":[0,0],"datas_ini":[1987,1987],"datas_fim":[1991,1988],"estados":["PR",0],"autor":[0],"content":"**FRANÇA, Tadeu**\n\n\\*dep. fed. PR 1987-1991; const. 1987-1988.\n\n \n\n                *José Tadeu França* nasceu em Santa Fé (PR) no dia 21 de\nabril de 1946, filho de Militão Bento França e Maria Gonçalves da Silva.\n\n                Cursou letras na Universidade Estadual de Londrina, onde\nse diplomou em 1970. No ano seguinte, foi admitido no curso de filosofia\nda Universidade de Passo Fundo (RS) e se graduou em 1973.\n\n                Professor da rede estadual de ensino do Paraná, em\nnovembro de 1976 elegeu-se vereador de Maringá (PR) na legenda do\nMovimento Democrático Brasileiro (MDB), agremiação política de oposição\nao regime militar instaurado no país em abril de 1964. Seu mandato teve\ninício em fevereiro de 1977, ano em que também concluiu o mestrado em\nletras pelo Centro de Pós-Graduação de Bauru (SP).\n\nCom a extinção do bipartidarismo em novembro de 1979, filiou-se ao\nPartido do Movimento Democrático Brasileiro (PMDB). Em 1981, iniciou seu\nterceiro curso universitário, ingressando na Faculdade de Direito de\nItapetinga (SP), pela qual se formou bacharel em 1985.\n\n                Em novembro de 1982, Tadeu França elegeu-se deputado\nestadual do Paraná, pela legenda do PMDB. Presidente da Comissão de\nEducação e integrante da Comissão de Recursos Humanos, candidatou-se,\nnas eleições de novembro de 1986, a deputado federal constituinte pela\nlegenda do PMDB. Eleito, assumiu sua cadeira na Assembléia Nacional\nConstituinte em 1º de fevereiro de 1987, após o término de seu mandato\nna Assembléia em janeiro. Em março seguinte, filiou-se ao Partido\nDemocrático Trabalhista (PDT).\n\n                Na Constituinte, integrou a Subcomissão da Educação,\nCultura e Esportes, as comissões da Família, da Educação, Cultura e\nEsportes, da Ciência e Tecnologia e da Comunicação e foi suplente da\nSubcomissão de Garantia da Constituição, Reformas e Emendas, da Comissão\nde Organização Eleitoral, Partidária e Garantia das Instituições. Votou\na favor do rompimento de relações diplomáticas com países com política\nde discriminação racial, da limitação do direito de propriedade privada,\ndo mandado de segurança coletivo, da remuneração 50% superior para o\ntrabalho extra, da jornada semanal de 40 horas, do turno ininterrupto de\nseis horas, da unicidade sindical, da soberania popular, do voto aos 16\nanos, da nacionalização do subsolo, da estatização do sistema\nfinanceiro, do limite de 12% ao ano para os juros reais, da proibição do\ncomércio de sangue, da limitação dos encargos da dívida externa, da\ncriação de um fundo de apoio à reforma agrária, da anistia a micro e\npequenos empresários e da desapropriação da propriedade produtiva. Foi\ncontra a pena de morte, o presidencialismo, o mandato de cinco anos para\no presidente José Sarney e a legalização do jogo do bicho.\n\nConsiderado um dos representantes da esquerda no Congresso Nacional,\ndefendeu a estabilidade do emprego e a realização de ampla reforma\nagrária e urbana. Foi um dos articuladores da Frente Pró-Índio, que\npresidiu até o final da legislatura, e um dos mentores do acordo que\ngarantiu os direitos indígenas nos artigos 231 e 232 do texto\nconstitucional.\n\nCom a promulgação da nova Carta em 5 de outubro de 1988, voltou a\nparticipar dos trabalhos legislativos ordinários da Câmara, integrando a\nComissão de Educação, Cultura e Esportes. Deixou a Câmara dos Deputados\nem janeiro de 1991, ao final da legislatura, sem ter disputado novo\nmandato no pleito de outubro do ano anterior.\n\nAinda no PDT, foi secretário estadual do Meio Ambiente do Paraná, entre\n1991 e 1993, no governo de Roberto Requião (1991-1994). Retirando-se da\nvida pública, tornou-se professor de literatura brasileira na\nUniversidade Estadual de Maringá.\n\nCasou-se com  Clarice Bedim França, com quem teve três filhos.\n\n \n\nFONTES: ASSEMB. NAC. CONST.*Repertório*(1987-1988); COELHO, J. &\nOLIVEIRA, A*. Nova; Folha de São Paulo*(19/1/1987); INF. BIOG.\n","ref":"FONTES: ASSEMB. NAC. CONST.*Repertório*(1987-1988); COELHO, J. &\nOLIVEIRA, A*. Nova; Folha de São Paulo*(19/1/1987); INF. BIOG.\n","dic":"DHBB"}
