{"title":"FRANCO, Moacir","cargoss":["Deputado federal"],"cargos_esp":[0],"datas_ini":[1983],"datas_fim":[1987],"estados":["SP"],"autor":[0],"content":"**FRANCO, Moacir**\n\n\\*dep. fed. SP 1983-1987.\n\n*Moacir de Oliveira Franco* nasceu em Ituiutaba (MG) no dia 5 de outubro\nde 1936, filho de Antônio Franco Sobrinho e de Jovina de Oliveira\nFranco.\n\nRealizou seus estudos primários e secundários na Escola Rural na Fazenda\nMonte Azul, em sua cidade natal, e posteriormente no Grupo Escolar João\nPinheiro e no Colégio Estadual de Uberlândia.\n\nEm 1956 iniciou sua carreira de radialista em São José do Rio Preto\n(SP), ingressando, três anos depois, na TV Paulista. Nesta emissora\nganhou notoriedade ao participar da *Praça da alegria*, um programa\nhumorístico de grande audiência. Autor da música *Me dá um dinheiro aí*,\ncampeã do carnaval carioca de 1960, iniciou sua carreira de cantor em\n1962.\n\nRadialista, cantor, compositor e ator, aventurou-se na política em 1982,\nelegendo-se em novembro deputado federal por São Paulo na legenda do\nPartido Trabalhista Brasileiro (PTB) e tomando posse em fevereiro de\n1983.\n\nNa sessão da Câmara dos Deputados de 25 de abril de 1984, votou a favor\nda emenda Dante de Oliveira, que propunha a realização de eleições\ndiretas para a presidência da República em novembro daquele ano. Como a\nemenda não obteve o número de votos necessários à sua aprovação, no\nColégio Eleitoral, reunido em 15 de janeiro de 1985, Moacir Franco votou\nem Tancredo Neves, eleito novo presidente da República pela Aliança\nDemocrática, uma união do Partido do Movimento Democrático Brasileiro\n(PMDB) com a dissidência do Partido Democrático Social (PDS) abrigada na\nFrente Liberal. Tancredo, contudo, adoeceu e não chegou a ser empossado\nna presidência, vindo a falecer em 21 de abril de 1985. Seu substituto\nfoi o vice José Sarney, que já vinha exercendo interinamente o cargo\ndesde 15 de março daquele ano.\n\nNa Câmara, Moacir Franco foi vice-presidente da Comissão de Comunicação\ne suplente das comissões de Educação e Cultura e de Minas e Energia.\n\nCandidatou-se à reeleição no pleito de novembro de 1986 na legenda do\nPDS, mas não obteve êxito. Encerrou seu mandato em janeiro de 1987, ao\nfinal da legislatura.\n\nDesiludido com a política, voltou a se dedicar apenas às atividades\nartísticas, trabalhando, inclusive, num circo durante dois anos. Em 1997\nfoi convidado pelo empresário Sílvio Santos para trabalhar no Sistema\nBrasileiro de Televisão (SBT) como diretor de criação e apresentador,\natividade que ainda exercia em 1999.\n\nViúvo de seu primeiro matrimônio, no qual teve dois filhos, casou-se\nmais três vezes. Com sua segunda mulher teve uma filha e com Daniele\nGariani de Oliveira Franco, sua quarta esposa, teve mais um filho.\n\n \n\nFONTES: CÂM. DEP. *Deputados brasileiros. Repertório*(1983-1987); INF.\nASSESS. BIOG.\n\n \n","ref":"FONTES: CÂM. DEP. *Deputados brasileiros. Repertório*(1983-1987); INF.\nASSESS. BIOG.\n\n \n","dic":"DHBB"}
