{"title":"FRANCO, Válter do Prado","cargoss":["Constituinte","Senador","Deputado federal"],"cargos_esp":[0,0,0],"datas_ini":[1946,1946,1955],"datas_fim":[1946,1955,1957],"estados":[0,"SE","SE"],"autor":[0],"content":"**FRANCO, Válter do Prado**\n\n\\*const. 1946; sen. SE 1946-1955; dep. fed. SE 1955-1957.\n\n \n\n*Válter do Prado Franco* nasceu em Laranjeiras (SE) no dia 21 de abril\nde 1908, filho de Albano do Prado Pimentel Franco e de Adélia do Prado\nFranco. Seu irmão, Augusto do Prado Franco, foi deputado federal de 1967\na 1971, senador de 1971 a 1979 e governador de Sergipe de 1979 a 1982.\n\nFoi aluno de engenharia da Escola Politécnica da Bahia, não chegando,\ncontudo, a concluir o curso.\n\nNo pleito de dezembro de 1945, elegeu-se senador por Sergipe à\nAssembléia Nacional Constituinte (ANC) na legenda da coligação entre a\nUnião Democrática Nacional (UDN) e o Partido Republicano (PR). Assumindo\nsua cadeira em março de 1946, participou dos trabalhos constituintes e,\ncom a transformação da Assembléia em Congresso ordinário, passou a\nintegrar a Comissão de Agricultura, Indústria e Comércio do Senado.\nEleito deputado federal por Sergipe na legenda da UDN em outubro de\n1954, ao deixar o Senado em janeiro de 1955 assumiu seu mandato na\nCâmara, exercendo-o até agosto de 1957.\n\nAlém da política, Válter do Prado Franco dedicou-se a atividades\nindustriais em seu estado.\n\nFaleceu em Aracaju, no dia 16 de agosto de 1957.\n\nEra casado com Maria Amélia Fonseca Franco. Seu sobrinho, Albano Franco,\nfilho de Augusto Franco, foi presidente da Confederação Nacional da\nIndústria (1980-1994), senador por Sergipe (1982-1991), constituinte\n(1987-1988) e governador de Sergipe desde 1995. Outro sobrinho, Antônio\nCarlos Franco, também seguiu a carreira política, tendo sido\nconstituinte (1987-1988) e deputado federal por Sergipe (1987-1988).\n\n \n\n \n\nFONTES: CÂM. DEP. *Deputados*; CÂM. DEP. *Relação dos dep.;* CISNEIROS,\nA. *Parlamentares*; *Diário do Congresso Nacional*; INF. FAM.; SENADO.\n*Relação*; SILVA, G. *Constituinte*.\n\n \n","ref":"FONTES: CÂM. DEP. *Deputados*; CÂM. DEP. *Relação dos dep.;* CISNEIROS,\nA. *Parlamentares*; *Diário do Congresso Nacional*; INF. FAM.; SENADO.\n*Relação*; SILVA, G. *Constituinte*.\n\n \n","dic":"DHBB"}
