{"title":"AMARAL, Celso","cargoss":["Deputado federal"],"cargos_esp":[0],"datas_ini":[1963],"datas_fim":[1969],"estados":["SP"],"autor":[0],"content":"**AMARAL, Celso**\n\n\\*dep. fed. SP 1963-1969.\n\n*Celso Fortes Amaral* nasceu em Assis (SP) no dia 16 de junho de 1924,\nfilho de Alberto K. Amaral e de Ana Fortes Amaral.\n\nNo pleito de outubro de 1962, elegeu-se deputado federal por São Paulo\nna legenda do Partido Trabalhista Brasileiro (PTB), exercendo o mandato\nde 1º de fevereiro de 1963 a 31 de janeiro de 1967.\n\nEm conseqüência da extinção dos partidos políticos pelo Ato\nInstitucional nº 2 (27/10/1965) e da posterior instauração do\nbipartidarismo, filiou-se à Aliança Renovadora Nacional (Arena), partido\nde apoio ao regime militar instaurado no país em abril de 1964, em cuja\nlegenda reelegeu-se em novembro de 1966. No dia 7 de fevereiro de 1969,\nteve seu mandato cassado com base no Ato Institucional nº 5 (AI-5),\npromulgado em 13 de dezembro do ano anterior.\n\nDurante sua vida parlamentar, foi vice-presidente da Comissão de\nTransportes, Comunicações e Obras Públicas da Câmara.\n\nCom a extinção do bipartidarismo em 29 de novembro de 1979 e a\nconseqüente reformulação partidária, filiou-se ao Partido Trabalhista\nBrasileiro (PTB), e nessa legenda concorreu a uma cadeira na Câmara dos\nDeputados pelo estado de São Paulo no pleito de novembro de 1982,\nobtendo apenas uma suplência. No pleito de novembro de 1986, voltou a\ncandidatar-se, dessa vez, à Assembléia Nacional Constituinte, pela\nlegenda do PTB, não obtendo êxito.\n\nFONTES: ARQ. DEP. PESQ. JORNAL DO BRASIL; ASSEMB. NAC. CONST.\n*Repertório* (1987-1988); CÂM. DEP. *Deputados;*CÂM. DEP. *Deputados\nbrasileiros. Repertório*(1967-1971).\n\n \n","ref":"FONTES: ARQ. DEP. PESQ. JORNAL DO BRASIL; ASSEMB. NAC. CONST.\n*Repertório* (1987-1988); CÂM. DEP. *Deputados;*CÂM. DEP. *Deputados\nbrasileiros. Repertório*(1967-1971).\n\n \n","dic":"DHBB"}
