{"title":"FREIRE, Luna","cargoss":["Deputado federal","Deputado federal"],"cargos_esp":[0,0],"datas_ini":[1963,1955],"datas_fim":[1971,1957],"estados":["BA","BA"],"autor":[0],"content":"**FREIRE, Luna**\n\n\\*dep. fed. BA 1955-1957 e 1963-1971.\n\n \n\n*Oscar de Luna Freire* nasceu em Juazeiro (BA) no dia 3 de setembro de\n1904, filho de Landelino de Luna Freire e de Ana Maria Marcico Freire.\n\nFormado em contabilidade em 1932 pela Academia de Comércio do Rio de\nJaneiro, então Distrito Federal, foi diretor administrativo nacional do\nServiço Social da Indústria (Sesi) entre 1951 e 1954. Nesse período, foi\ntambém diretor executivo da Confederação Nacional da Indústria (CNI)\nentre 1952 e 1954, e, no ano de 1953, diretor do Serviço de\nAbastecimento do Sesi.\n\nNo pleito de outubro de 1954, elegeu-se deputado federal pela Bahia, na\nlegenda da coligação Aliança Republicana Cristã, formada pelo Partido\nRepublicano (PR) e pelo Partido Democrata Cristão (PDC), sendo empossado\nem fevereiro de 1955. No ano seguinte assumiu as funções de diretor do\nBanco da Prefeitura do Distrito Federal e, em julho de 1957, interrompeu\nseu mandato, deixando a Câmara Federal. Em 1961, afastou-se do Banco do\nEstado da Guanabara (BEG), nova denominação do Banco da Prefeitura do\nDistrito Federal, em função da criação do estado da Guanabara e da\ntransferência da capital federal para Brasília. Em outubro de 1962,\ntornou a se eleger deputado federal pela Bahia, dessa vez na legenda da\nAliança Trabalhista, coligação formada pelo PR, pelo Partido Trabalhista\nBrasileiro (PTB) e pelo Partido de Representação Popular (PRP),\nassumindo o mandato na Câmara em fevereiro de 1963.\n\nCom a extinção dos partidos políticos pelo Ato Institucional nº 2\n(27/10/1965) e a posterior instauração do bipartidarismo, filiou-se à\nAliança Renovadora Nacional (Arena), partido de apoio ao regime militar\nimplantado no país após a deposição do presidente João Goulart\n(31/3/1964). Nas eleições de novembro de 1966, reelegeu-se deputado\nfederal pela Bahia, já na legenda arenista, e tornou-se, em 1967, membro\nefetivo das comissões parlamentares de inquérito sobre a Petrobras e\nsobre a alta do dólar, além de relator da comissão parlamentar de\ninquérito (CPI) sobre o território do Amapá.\n\nDurante sua carreira parlamentar, integrou as comissões de Economia, de\nFinanças, de Fiscalização Financeira e Tomada de Contas, do Serviço\nPúblico e de Legislação Social na Câmara dos Deputados. Em janeiro de\n1971, encerrou seu mandato, deixando a Câmara.\n\nFaleceu no Rio de Janeiro no dia 4 de junho de 1976.\n\nFoi casado com Helena Blawatsky de Melo Freire, com quem teve três\nfilhos.\n\n \n\n \n\nFONTES: CÂM. DEP.*Deputados;*CÂM. DEP. *Deputados brasileiros.\nRepertório*(5**e 6); CÂM. DEP. *Relação dos dep.; Jornal do\nBrasil*(9/6/76); TRIB. SUP. ELEIT. *Dados*(3, 6 e 8).\n\n \n","ref":"FONTES: CÂM. DEP.*Deputados;*CÂM. DEP. *Deputados brasileiros.\nRepertório*(5**e 6); CÂM. DEP. *Relação dos dep.; Jornal do\nBrasil*(9/6/76); TRIB. SUP. ELEIT. *Dados*(3, 6 e 8).\n\n \n","dic":"DHBB"}
