{"title":"FREIRE, Vítor Amaral","cargoss":["Ministro do Tribunal de Contas"],"cargos_esp":[0],"datas_ini":[1966],"datas_fim":[1974],"estados":[0],"autor":[0],"content":"**FREIRE, Vítor Amaral**\n\n\\*min. TCU 1966-1974.\n\n*Vítor Amaral Freire* nasceu em Jaú (SP) no dia 6 de novembro de 1908,\nfilho de Hilário Freire e Francisca Amaral Freire.\n\nFez seus primeiros estudos no Ateneu Jauense e diplomou-se pela\nFaculdade de Direito da Universidade de São Paulo, em 1931.\n\nEm 1941, ingressou no Instituto de Previdência do Estado de São Paulo,\nonde permaneceria até 1946. Nesse órgão, foi chefe de avaliação e\nassistente técnico-jurídico da Carteira Predial e assistente técnico da\nAssistência Técnica e Atuarial. Em 1947, transferiu-se para o Tribunal\nde Contas do Estado (TCE) de São Paulo, onde exerceu vários cargos,\ninclusive o de chefe do gabinete da presidência (1951-1952, 1959-1960,\n1961-1962). Nesse período, em 1957, foi encarregado de proceder a\nestudos preliminares de uma reforma do TCE.\n\nAssessor de gabinete do secretário de Fazenda do governo de São Paulo e\nintegrante do grupo de estudos de normas orçamentárias e de\nadministração financeira em 1963, três anos depois integrou a Comissão\nde Reforma Administrativa da Secretaria de Educação do Estado de São\nPaulo. Ainda em 1966, foi nomeado ministro do Tribunal de Contas da\nUnião, permaneceu no cargo até 1974, quando se aposentou. Foi\nvice-presidente da entidade em 1969, 1970 e 1973.\n\nPrimeiro superintendente do Instituto Rui Barbosa, em São Paulo, de 1974\na 1975, presidiu o Conselho Estadual de Auxílios e Subvenções, da\nSecretaria da Promoção Social, entre 1975 e 1979.\n\nAo longo de sua trajetória profissional, participou de vários seminários\ne conclaves sobre administração municipal e finanças públicas, no Brasil\ne no exterior.\n\nCasou-se com Iolanda Sales Freire.\n\nPublicou, entre outros trabalhos, *Despesa pública do estado, São Paulo*\n(1958) e *Parecer prévio sobre as contas do governo da República*\n(1967).\n\nFONTES: *Perfil*(1974); SOC. BRAS. EXPANSÃO COMERCIAL. *Quem*; TCU.\n*Dados* (1893-1990).\n","ref":"FONTES: *Perfil*(1974); SOC. BRAS. EXPANSÃO COMERCIAL. *Quem*; TCU.\n*Dados* (1893-1990).\n","dic":"DHBB"}
