{"title":"AMARAL, Evaldo","cargoss":["Deputado federal"],"cargos_esp":[0],"datas_ini":[1979],"datas_fim":[1987],"estados":["SC,"],"autor":[0],"content":"**AMARAL, Evaldo**\n\n\\*dep. fed. SC, 1979-1987.\n\n \n\n*Evaldo Amaral* nasceu em Lajes (SC), no dia 9 de julho de 1924, filho\nde Eduardo P. Amaral e de Luísa F. Amaral.\n\nBancário desde 1942, em outubro de 1954 elegeu-se vereador em\nCuritibanos (SC) na legenda da União Democrática Nacional (UDN), tomando\nposse em fevereiro do ano seguinte. Dois anos depois, deixou a Câmara\npara assumir a prefeitura municipal, onde permaneceu até 1958. Em\noutubro desse ano, sempre na legenda da UDN, elegeu-se deputado à\nAssembléia Legislativa de Santa Catarina. Assumiu sua cadeira em\nfevereiro de 1959 e, finda a legislatura, em 1963, dedicou-se à\nadministração de empresas no setor madeireiro.\n\nCom a extinção dos partidos políticos pelo Ato Institucional nº 2\n(27/10/1965) e a posterior instauração do bipartidarismo, filiou-se à\nAliança Renovadora Nacional (Arena), legenda de apoio ao regime militar\ninstaurado no país em 1964, e retornou à disputa eleitoral,\ncandidatando-se mais uma vez a deputado estadual no pleito de outubro de\n1966. Assumiu o mandato em fevereiro de 1967 e exerceu a\nvice-presidência da Assembléia em 1970-1971. Reeleito em outubro 1970,\npresidiu as comissões de Educação e Saúde e de Ciência e Tecnologia, e\nfoi vice-presidente da Comissão de Orçamento e Contas do Estado. Líder\ndo governo entre 1972 e 1973, licenciou-se para assumir a secretaria\nestadual de Administração durante o governo de Colombo Sales\n(1971-1975), permanecendo no cargo de 1973 a 1974. Nas eleições de\nnovembro desse ano, sempre na legenda da Arena, disputou uma vaga na\nCâmara dos Deputados, obtendo uma suplência. Em 1975, no início do\ngoverno de Antônio Carlos Konder Reis (1975-1979), foi nomeado\nvice-presidente do Banco do Estado de Santa Catarina, função que\nexerceria até 1977. Em novembro de 1976, disputou a prefeitura de Lajes,\nsendo derrotado pelo candidato do Movimento Democrático Brasileiro\n(MDB), Dirceu Carneiro.\n\nEm novembro de 1978 voltou a candidatar-se a deputado federal,\nconseguindo dessa vez eleger-se. Empossado em fevereiro de 1979,\npresidiu a Comissão de Educação e Cultura e integrou as comissões de\nEconomia, Indústria e Comércio, e de Agricultura e Política Rural. Com a\nextinção do bipartidarismo em novembro de 1979, e a posterior\nreorganização dos partidos políticos, filiou-se ao Partido Democrático\nSocial (PDS), que reuniu a maioria dos antigos arenistas.\n\nEm novembro de 1982 tentou reeleger-se, retornando à lista de suplentes.\nIniciada nova legislatura em 1983, assumiu o mandato na vaga aberta pela\nsaída de Vílson Kleinübing, nomeado secretário de Agricultura de Santa\nCatarina no governo de Esperidião Amin (1983-1987). Na sessão que a\nCâmara dos Deputados realizou no dia 25 de abril de 1984, apoiou a\nemenda Dante de Oliveira, que restabelecia eleições diretas para\npresidente da República já em novembro daquele ano. Derrotada a\nproposição — faltaram 22 votos para que se atingisse o quórum mínimo\nexigido e o projeto fosse encaminhado à apreciação do Senado Federal —,\nmanteve-se a eleição indireta. Dentro do PDS surgiram vários postulantes\nà sucessão do presidente João Figueiredo (1979-1985), nenhum deles em\ncondições de unir o partido. Após a convenção que indicou candidato\nPaulo Maluf em detrimento de Mário Andreazza, ocorreu uma cisão no\npartido, formando-se a chamada Frente Liberal. Evaldo Amaral alinhou-se\naos dissidentes e, aos 15 de janeiro de 1985, reunido o Colégio\nEleitoral, ajudou a derrotar Maluf e a eleger Tancredo Neves, candidato\nda Aliança Democrática, formada pelo PMDB e pela Frente Liberal.\nContudo, hospitalizado para uma operação de urgência, Tancredo Neves não\nchegou a tomar posse e faleceu em 21 de abril de 1985. Substituiu-o José\nSarney, vice-presidente, que já vinha exercendo interinamente o cargo\ndesde 15 de março.\n\nAinda em abril de 1985 Evaldo Amaral efetivou-se na Câmara dos\nDeputados. No exercício do mandato efetivo, foi membro das comissões de\nMinas e Energia e de Ciência e Tecnologia. Ao término da legislatura, em\njaneiro de 1987, sem disputar a reeleição, retirou-se da vida pública e\ndedicou-se a negócios particulares.\n\nCasado com Teresinha Ribas Amaral, teve três filhos.\n\nFONTES: CÂM. DEP. *Deputados brasileiros. Repertório*(1979-1983,\n1983-1987);**INF. BIOG.; PIAZZA, W. *Dicionário*.\n","ref":"FONTES: CÂM. DEP. *Deputados brasileiros. Repertório*(1979-1983,\n1983-1987);**INF. BIOG.; PIAZZA, W. *Dicionário*.\n","dic":"DHBB"}
