{"title":"ABREU, Hugo","cargoss":["Chefe do Gabinete Militar da Presidência da República"],"cargos_esp":[0],"datas_ini":[1974],"datas_fim":[1978],"estados":[0],"autor":[0],"content":"**ABREU, Hugo**\n\n\\*militar; ch. Gab. Mil. Pres. Rep. 1974-1978.\n\n** \n\n*Hugo de Andrade Abreu*nasceu em Juiz de Fora (MG) no dia 27 de dezembro\nde 1916, filho de José Ribeiro de Abreu e de Antônia de Andrade Abreu.\nSeu irmão, Sílvio de Andrade Abreu, foi deputado federal por Minas\nGerais de 1971 a 1975, e seu sobrinho Sílvio de Andrade Abreu Júnior,\npassou igualmente a representar esse estado na Câmara dos Deputados a\npartir de 1975.\n\nApós concluir o curso ginasial na Academia de Comércio, em sua cidade\nnatal, transferiu-se para o Rio de Janeiro, então Distrito Federal, onde\nsentou praça em março de 1934, ingressando na Escola Militar do\nRealengo. Em 1935 participou pela primeira vez de uma missão ao\nexterior, como membro da comitiva do presidente Getúlio Vargas que\nvisitou a Argentina e o Uruguai. Em janeiro de 1937 foi declarado\naspirante-a-oficial da arma de infantaria e, em novembro do mesmo ano,\ntornou-se segundo-tenente, sendo promovido a primeiro-tenente em\nsetembro de 1938.\n\nEm dezembro de 1943 alcançou o posto de capitão e, no ano seguinte, por\nocasião da entrada do Brasil na Segunda Guerra Mundial, integrou a Força\nExpedicionária Brasileira, (FEB) na Itália como comandante da 9ª\nCompanhia do 13º Regimento de Infantaria. Por sua atuação no combate de\nMontese recebeu a mais alta condecoração do Exército, a Cruz de Combate\nde Primeira Classe, conferida àqueles que são considerados heróis de\nguerra.\n\nEntre 1946 e 1948 cursou a Escola de Estado-Maior do Exército e, em\noutubro de 1951, passou a major, tendo viajado em seguida para os EUA,\nonde fez o curso avançado de infantaria em Fort Benning, na Geórgia.\nPromovido a tenente-coronel em dezembro de 1957, em 1962 fez o curso de\ncomando e estado-maior das forças armadas na Escola Superior de Guerra\n(ESG).\n\nQuando eclodiu em 31 de março de 1964 o movimento político-militar que\ndepôs o presidente João Goulart, Hugo Abreu, alinhado às forças\nsublevadas, encontrava-se na chefia da subseção da Diretoria Geral de\nEnsino do Exército. No dia seguinte, por ordem do general Augusto Muniz\nde Aragão, passou a chefiar o estado-maior do Grupamento de Unidades\nEscolas e, ainda em abril, foi promovido a coronel e designado chefe do\nestado-maior da 1ª Divisão de Infantaria, na Vila Militar do Rio,\nassumindo posteriormente o comando do 1º Batalhão de Guardas, também\nsediado nessa cidade. Em 1968 realizou o curso de Atualização da Escola\nde Comando e Estado-Maior do Exército.\n\nAinda como coronel, Hugo Abreu foi para os EUA, onde atuou como assessor\nda delegação brasileira na Junta Interamericana de Defesa e na Comissão\nMista de Defesa Brasil-Estados Unidos. Na mesma época serviu como\nadjunto do adido militar do Exército junto à embaixada do Brasil em\nWashington, substituindo-o no período de outubro a novembro de 1968. Em\nmarço do ano seguinte foi promovido a general-de-brigada, e em agosto,\npassou a comandar a 2ª Brigada Mista, sediada em Corumbá (MS), então no\nestado de Mato Grosso, onde permaneceu durante quatro meses.\n\nDe volta ao Rio de Janeiro, assumiu em janeiro de 1970 o comando da\nBrigada Pára-quedista, tendo viajado em seguida novamente, para os EUA,\nonde, ainda uma vez em Fort Benning, fez os cursos básico de\npára-quedista, de transmissões, de mestre em saltos e avançado de\npára-quedista.\n\nFoi como comandante da Brigada Pára-quedista que, em 1973, Hugo Abreu\nparticipou das operações do Exército para neutralizar focos\nguerrilheiros que, desde 1966, vinham sendo instalados por núcleos de\nmilitantes do clandestino Partido Comunista do Brasil (PCdoB) em regiões\nsituadas ao sul do Pará e norte de Goiás. Esses focos — que, em 1972,\nquando se iniciaram as operações do Exército, contavam com cerca de 70\nguerrilheiros — tinham como objetivo organizar militarmente a população\nlocal para um futuro levante armado, considerando que, naquela região,\nse registrava então um dos mais sérios conflitos relativos à posse da\nterra no país. O clima de tensão aí reinante se agravara ainda mais a\npartir de 1970 com a criação do Programa de Integração Nacional,\nexpresso na construção da Transamazônica e na implementação dos\nprogramas de colonização. A chamada guerrilha do Araguaia — que, da\nmesma forma que os movimentos de guerrilha urbana, manifestava a\nradicalização dos grupos de oposição ao regime — foi inteiramente\ndizimada pela ação das forças armadas, terminando com a prisão e a morte\nda maioria de seus organizadores e a incorporação da região do Araguaia\nàs áreas consideradas de segurança nacional.\n\nHugo Abreu se achava ainda no comando da Brigada Pára-quedista quando,\nno dia 7 de março de 1974, recebeu do general Ernesto Geisel, que fora\neleito pelo Congresso Nacional para suceder ao general Emílio Médici na\nchefia do governo, o convite para ocupar o cargo de chefe do Gabinete\nMilitar da Presidência da República. O convite fora feito anteriormente\nao general Dilermando Gomes Monteiro, que entretanto ficara\nimpossibilitado de assumir o cargo em virtude de haver fraturado a\nperna.\n\nChefe do Gabinete Militar\n\nHugo Abreu foi empossado no Gabinete Militar no dia 15 de março de 1974,\nquando teve início o governo do presidente Geisel. Durante o período em\nque esteve à frente do Gabinete Militar— além de fazer parte, ao lado\ndos chefes do Gabinete Civil, general Golberi do Couto e Silva, e do\nServiço Nacional de Informações, general João Batista de Figueiredo, e\ndo ministro do Planejamento, João Paulo dos Reis Veloso, do principal\ngrupo de assessoramento das decisões presidenciais — destacou-se por sua\nparticipação no episódio da exoneração do ministro do Exército, general\nSílvio Frota, ocorrida em 12 de outubro de 1977. A exoneração resultou\nda dissensão do ministro com o governo, agravada por ocasião do debate\ninterno sobre a sucessão presidencial, quando a imprensa começou a dar\ndestaque ao nome de Frota como possível candidato à presidência.\n\nOcupando, na qualidade de chefe do Gabinete Militar, a secretaria geral\ndo Conselho de Segurança Nacional, Hugo Abreu comandou, em nome do\npresidente Geisel, todo o processo de demissão de Frota, desde a leitura\nda nota oficial comunicando o fato à nação até as articulações dentro do\nExército, com o intuito de eliminar possíveis indícios de resistência de\ndeterminadas unidades militares solidárias ao ex-ministro. Frota foi\nsubstituído pelo general Fernando Belfort Bethlem que comandava o III\nExército.\n\nNo dia 3 de janeiro de 1978, em conseqüência da indicação do general\nJoão Figueiredo como candidato oficial do governo às eleições\npresidenciais indiretas que se realizariam em 15 de outubro seguinte,\nHugo Abreu apresentou seu pedido de demissão alegando que, quando\nprovidenciou a demissão de Sílvio Frota, garantira que tal medida não\nbeneficiaria nenhuma outra candidatura à presidência, propósito esse que\nsentiu burlado com a indicação de Figueiredo. Acrescentou ainda que a\nescolha desse nome pelo presidente Geisel contrariava a orientação\nfixada pelo sistema revolucionário de 1964, que exigia um nome\nresultante de consenso dentro das forças armadas. No dia seguinte deixou\no cargo, sendo substituído pelo general Gustavo de Morais Rego. Em\nfevereiro do mesmo ano foi nomeado subchefe do Departamento Geral de\nPessoal do Exército em substituição ao general Luís Serff Sellmann, que,\npreterido nas listas de promoções por duas vezes consecutivas,\nsolicitara transferência para a reserva.\n\nAinda em 1978 intensificaram-se as dissidências que desde o ano anterior\nvinham ocorrendo no seio das forças que tradicionalmente apoiavam o\nregime implantado em 1964. Na legenda do próprio partido do governo, a\nAliança Renovadora Nacional (Arena), o senador José de Magalhães Pinto\nlançou-se como candidato civil à sucessão do presidente Geisel, passando\na percorrer o país a fim de dar ímpeto à sua campanha e iniciando nesse\nmesmo período um movimento para a formação da Frente Nacional de\nRedemocratização, que reuniria setores civis e militares dissidentes. A\ncandidatura de Magalhães Pinto, todavia, ficou isolada em seu próprio\npartido, não conseguindo a adesão das forças oposicionistas.\n\nAo mesmo tempo, entre os grupos militares que se opunham ao nome do\ngeneral Figueiredo, começou-se a articular a candidatura do general da\nreserva Euler Bentes Monteiro. Hugo Abreu — que, naquele momento, já\nassumia uma postura deliberadamente antigovernista — destacou-se então\ncomo um dos principais articuladores da candidatura de Euler Bentes.\nEssa candidatura, lançada a princípio pela Frente Nacional de\nRedemocratização, acabou recebendo o apoio do partido de oposição, o\nMovimento Democrático Brasileiro (MDB), que a aprovou oficialmente em\nsua convenção nacional de 28 de agosto de 1978. Como candidato à\nvice-presidência, foi lançado o senador Paulo Brossard, do MDB gaúcho.\nNão obstante o esforço dos setores oposicionistas empenhados na\ncampanha, o número de dissidentes arenistas foi pequeno, sendo Euler\nBentes derrotado nas eleições realizadas pelo colégio eleitoral em 15 de\noutubro seguinte; enquanto o general Figueiredo somava 355 votos, o\ncandidato da oposição recebia apenas 226.\n\nPouco antes das eleições, no dia 2 de outubro, foi decretada pela\nSecretaria Geral do Exército a prisão disciplinar de Hugo Abreu durante\n20 dias sob a acusação de haver transgredido o regulamento militar ao\nenviar a outros generais um documento onde esclarecia o motivo de sua\ndemissão do Gabinete Militar, acusando de corrupção e abuso de poder\nvárias personalidades do governo Geisel. Entretanto, depois de cumprir o\nperíodo de prisão que lhe fora imposto, Hugo Abreu declarou à imprensa\nque considerava a punição um ato político em represália ao fato de haver\nele assumido uma posição definida em favor da redemocratização do país.\n\nAtravés de decreto assinado pelo presidente Geisel em 5 de março de\n1979, Hugo Abreu foi transferido para a reserva. Sua transferência\ndecorreu do fato de o seu nome “ter sido retirado pela segunda vez da\nlista de oficiais candidatos à promoção, o que, de acordo com o\nregulamento do Exército, implica a passagem obrigatória para a reserva”.\nEm 14 de março, um dia antes da posse do general Figueiredo na\npresidência da República, deixou a subchefia do Departamento Geral de\nPessoal do Exército, onde foi substituído pelo general Geraldo Knaak de\nSousa, passando então oficialmente à reserva.\n\nEm abril de 1979 lançou, no Rio de Janeiro, seu primeiro livro,\nintitulado *O outro* *lado do poder*— depoimento sobre o período em que\nservira no Gabinete Militar da Presidência da República —, em cujas\npáginas figuravam novas acusações contra colaboradores do presidente\nGeisel. No dia 7 de maio seguinte teve decretada sua prisão pelo\nministro do Exército do governo Figueiredo, general Válter Pires, sob a\nalegação de que as revelações contidas no livro infringiam as normas\nhierárquicas e disciplinares do Exército. Após cumprir pena de 20 dias\nnas dependências do quartel-general da 1ª Divisão do Exército, na Vila\nMilitar do Rio de Janeiro, declarou em entrevista à imprensa, no dia 27\nde maio, seu intuito de escrever outro livro, seguindo a mesma linha do\nanterior, do qual já possuía inclusive um esboço, elaborado durante o\nperíodo em que estivera preso. Na mesma ocasião manifestou-se favorável\nà anistia e contrário à reforma eleitoral, que considerou inútil se\nprocessada fora de um regime democrático.\n\nHugo Abreu pertenceu à Associação dos Ex-combatentes do Brasil e foi\nmembro do conselho deliberativo do Clube Militar e do conselho\ndeliberativo da Associação dos Veteranos da FEB.\n\nFaleceu no Rio de Janeiro em 5 de dezembro de 1979.\n\nEra casado com Consuelo Procópio de Abreu, com quem teve três filhos, um\ndos quais, Olavo Procópio de Abreu, também oficial do Exército, foi\ndurante muito tempo seu ajudante-de-ordens.\n\nSeu segundo livro, *Tempo de crise*, foi editado postumamente, tendo\nsido lançado em fevereiro de 1980.\n\n \n\nFONTES: CORRESP. GAB. MIL. PRES. REP.; GÓIS, V. *Brasil*; *Jornal do\nBrasil* (6/12/79); *Perfil*(1974 e 1975); *Who’s who in Brazil*.\n\n \n","ref":"FONTES: CORRESP. GAB. MIL. PRES. REP.; GÓIS, V. *Brasil*; *Jornal do\nBrasil* (6/12/79); *Perfil*(1974 e 1975); *Who’s who in Brazil*.\n\n \n","dic":"DHBB"}
