{"title":"AMARAL, Ferreira do","cargoss":["Deputado federal"],"cargos_esp":[0],"datas_ini":[1971],"datas_fim":[1974],"estados":["PR"],"autor":[0],"content":"**AMARAL, Ferreira do**\n\n\\*dep. fed. PR 1971-1974.\n\n \n\n*Ivan Ferreira do Amaral e Silva Filho* nasceu em Curitiba no dia 9 de\nagosto de 1940, filho de Ivan Ferreira do Amaral e Silva e de Raquel\nCarneiro do Amaral e Silva.\n\nFormou-se em ciências jurídicas e sociais pela Pontifícia Universidade\nCatólica do Rio de Janeiro, onde também especializou-se em direito\nagrário em curso promovido pelo Instituto Brasileiro de Reforma Agrária\n(IBRA), atual Instituto Nacional de Colonização e Reforma Agrária\n(INCRA). Estudou ainda na Fundação de Estudos Superiores do Mar, no Rio\nde Janeiro, e na St. Francis High School, nos Estados Unidos, onde fez\ncurso de extensão.\n\nDurante a gestão de Edmundo Macedo Soares e Silva no Ministério da\nIndústria e Comércio (1967-1969), exerceu as funções de\nassistente-adjunto e de assessor da instituição. Em 1969 integrou a\ncomissão organizadora da Reunião da Organização das Nações Unidas (ONU)\npara o Desenvolvimento Industrial, realizada no Rio de Janeiro. Radicado\nno Paraná, elegeu-se no pleito de novembro de 1970 deputado federal por\nesse estado, na legenda da Aliança Renovadora Nacional (Arena), partido\nde sustentação ao regime militar instaurado no país em abril de 1964.\nEmpossado em fevereiro de 1971, passou a integrar, como membro efetivo,\na Comissão de Constituição e Justiça e, na condição de suplente, as\ncomissões de Economia e de Finanças da Câmara dos Deputados, além da\ncomissão especial destinada a estudar globalmente o problema da poluição\nambientar.\n\nFoi também oficial-de-gabinete, tradutor da Junta Administrativa,\nassistente do secretário-geral e assessor do presidente do Instituto\nBrasileiro do Café (IBC), além de representante do Ministério da\nIndústria e Comércio junto ao Grupo Executivo de Movimentação de Safras\ne ao Conselho Nacional de Turismo.\n\nFaleceu em Ponta Grossa (PR) no dia 9 de novembro de 1974, em pleno\nexercício do mandato.\n\nPublicou *O* *sal na economia dos povos*e *Trabalho sobre café\nliofilizado.*\n\n \n\nFONTES: CÂM. DEP. *Deputados;*CÂM. DEP. *Deputados brasileiros.\nRepertório*(1971-1975)*; Jornal* *do Brasil*(10/11/74);*Perfil*(1972);\nTRIB. SUP. ELEIT. *Dados*(9).\n\n \n","ref":"FONTES: CÂM. DEP. *Deputados;*CÂM. DEP. *Deputados brasileiros.\nRepertório*(1971-1975)*; Jornal* *do Brasil*(10/11/74);*Perfil*(1972);\nTRIB. SUP. ELEIT. *Dados*(9).\n\n \n","dic":"DHBB"}
