{"title":"FRÖHLICH, Willy","cargoss":["Deputado federal","Deputado federal","Deputado federal","Deputado federal","Deputado federal","Deputado federal"],"cargos_esp":[0,0,0,0,0,0],"datas_ini":[1961,1959,1958,1957,1956,1951],"datas_fim":[1963,1959,0,0,0,1955],"estados":["RS","RS","RS","RS","RS","RS"],"autor":[0],"content":"**FRÖHLICH, Willy**\n\n\\*dep. fed. RS 1951-1955, 1956, 1957, 1958, 1959 e 1961-1963.\n\n \n\n*Willy Carlos Fröhlich* nasceu em Santa Cruz do Sul (RS) no dia 11 de\nagosto de 1913, filho de Pedro Fröhlich Filho e de Maria Rie del\nFröhlich.\n\nFez o curso de contabilidade no Colégio Marista em sua cidade natal e\ncursou a Faculdade de Ciências Políticas e Econômicas de Porto Alegre,\ndiplomando-se em economia no ano de 1937.\n\nEntre 1935 e 1937, ainda estudante universitário exerceu o mandato de\nvereador em sua cidade natal, tendo sido presidente da Câmara Municipal.\nFoi ainda prefeito de Santa Cruz do Sul a partir de 1947 e, em outubro\nde 1950, elegeu-se deputado federal pelo Rio Grande do Sul na legenda do\nPartido Social Democrático (PSD), assumindo sua cadeira em fevereiro do\nano seguinte, após deixar as funções de prefeito. Elegeu-se primeiro\nsuplente de deputado federal em outubro de 1954 na legenda do PSD,\ntomando assento na Câmara de fevereiro a junho do ano seguinte e em\ndiversos curtos períodos entre 1956 e 1958. Tornou a ser eleito primeiro\nsuplente de deputado federal na legenda do PSD em outubro de 1958,\nocupando uma cadeira na Câmara de abril a maio de 1959 e de fevereiro de\n1961 a janeiro de 1963.\n\nTornou-se membro em seu estado do Sindicato dos Jornalistas, da\nAssociação Rio-Grandense de Imprensa, da Sociedade de Economia e do\nSindicato dos Contabilistas. Foi também diretor do Banco do Estado do\nRio Grande do Sul e do Instituto Nacional do Mate.\n\nFaleceu no dia 6 de novembro de 1971.\n\nEra casado com Laura Horn Fröhlich, com quem teve dois filhos.\n\n \n\nFONTES: CÂM. DEP. *Deputados*; CÂM. DEP. *Deputados brasileiros.\nRepertório* (1946-1967); CÂM. DEP. *Relação dos dep*.; CISNEIROS, A.\n*Parlamentares*; TRIB. SUP. ELEIT. *Dados* (2, 3 e 4).\n\n \n","ref":"FONTES: CÂM. DEP. *Deputados*; CÂM. DEP. *Deputados brasileiros.\nRepertório* (1946-1967); CÂM. DEP. *Relação dos dep*.; CISNEIROS, A.\n*Parlamentares*; TRIB. SUP. ELEIT. *Dados* (2, 3 e 4).\n\n \n","dic":"DHBB"}
