{"title":"AMARAL, Gomes do","cargoss":["Deputado federal"],"cargos_esp":[0],"datas_ini":[1975],"datas_fim":[1979],"estados":["PR"],"autor":[0],"content":"**AMARAL, Gomes do**\n\n\\*dep. fed. PR 1975-1979.\n\n \n\n*José Gomes do Amaral* nasceu em Taquarituba (SP), em 14 de outubro de\n1937, filho de Armando Amaral e de Elisina Gomes do Amaral.\n\nFormado em 1962 pela Faculdade de Ciências Econômicas de Marília (SP),\nnesse mesmo ano tornou-se economista do Banco do Brasil. Dois anos\ndepois, graduou-se em administração de empresas pela mesma faculdade.\nRadicado em Ponta Grossa (PR), participou de grupo responsável pela\nreestruturação financeira da prefeitura e pelo plano diretor da cidade.\nCandidatou-se a vice-prefeito em novembro de 1970, na chapa encabeçada\npor Eurico Batista Rosas, pelo Movimento Democrático Brasileiro (MDB),\npartido de oposição ao regime militar vigente desde abril de 1964.\n\nElegeu-se deputado federal pelo Paraná em novembro de 1974, na legenda\noposicionista. Iniciando seu mandato em fevereiro de 1975, ainda nesse\nano presidiu a Comissão de Finanças da Câmara. Disputou a reeleição em\nnovembro de 1978, mas obteve apenas uma suplência. Deixou a Câmara em\njaneiro de 1979, ao término da legislatura. Com o fim do bipartidarismo,\nem novembro daquele ano, e a conseqüente reorganização partidária,\nfiliou-se ao Partido do Movimento Democrático Brasileiro (PDMB), que deu\ncontinuidade ao extinto MDB. Por essa legenda, disputou a prefeitura de\nPonta Grossa em novembro de 1982, mas não conseguiu eleger-se.\n\nFoi diretor-financeiro do Frigorífico Buritis, de Brasília, da\nReflorestadora Rio das Ondas, da Barreiras Florestal e da Reflorestadora\ne Administradora Buritis. Criador e instalador (por decreto do governo\nestadual) da Faculdade de Ciências Econômicas e Administração de Ponta\nGrossa e curador e instalador da Universidade Estadual de Ponta Grossa,\nfoi o primeiro diretor da faculdade, o primeiro chefe do Departamento de\nEconomia e Administração da universidade, professor concursado de\neconomia e administração da universidade e professor do ensino médio\ncomercial.\n\nFaleceu em Ponta Grossa em 21 de outubro de 1983. Seu nome foi dado a\numa escola da rede estadual.\n\nEra casado com Antônia Edméia Gomes do Amaral, com quem teve três\nfilhos.\n\n \n\nFONTES: CÂM. DEP. *Deputados brasileiros. Repertório* (1975-1979,\n1979-1983); CURRIC. BIOG.; INF. BIOG.\n\n \n","ref":"FONTES: CÂM. DEP. *Deputados brasileiros. Repertório* (1975-1979,\n1979-1983); CURRIC. BIOG.; INF. BIOG.\n\n \n","dic":"DHBB"}
