{"title":"FURTADO, Heitor Alencar","cargoss":["Deputado federal"],"cargos_esp":[0],"datas_ini":[1979],"datas_fim":[1982],"estados":["PR"],"autor":[0],"content":"**FURTADO, Heitor Alencar**\n\n\\*dep. fed. PR 1979-1982.\n\n \n\n*Heitor Cavalcanti Alencar Furtado* nasceu em Paranavaí (PR) no dia 1º\nde maio de 1956, filho de José Alencar Furtado e de Miriam Cavalcanti\nAlencar. Seu pai foi líder na Câmara dos Deputados do Movimento\nDemocrático Brasileiro (MDB), partido de oposição ao regime militar\ninstalado no país em abril de 1964, tendo sido cassado em 1977.\n\nAdvogado, bacharelou-se em ciências jurídicas e sociais pela Associação\nde Ensino Unificado do Distrito Federal em 1977.\n\nHerdeiro político do pai, em novembro de 1978, com apenas 22 anos, foi\neleito deputado federal pelo Paraná na legenda do MDB. Empossado em\nfevereiro de 1979, tornou-se líder de seu partido na Câmara dos\nDeputados. Com o fim do bipartidarismo (29/11/1979) e a conseqüente\nreorganização partidária, ingressou no Partido do Movimento Democrático\nBrasileiro (PMDB), agremiação que sucedeu ao MDB. Atuou nos trabalhos\nlegislativos como vice-presidente e presidente da Comissão de Serviço\nPúblico.\n\nEm 22 outubro de 1982, quando disputava uma vaga na Assembleia\nLegislativa do Paraná, Heitor Alencar Furtado foi assassinado por um\npolicial entre as cidades de Jandaia do Sul e Mandaguari, no norte do\nParaná. Seu assassinato representou um golpe na candidatura a governador\nde Saul Raiz, do Partido Democrático Social (PDS), em função do clima de\nviolência que se estabeleceu durante a campanha eleitoral.\n\n \n\nFONTES: CÂM. DEP. *Deputados brasileiros. Repertório* (1979-1983);\n*Veja* (27/10/82).\n\n \n","ref":"FONTES: CÂM. DEP. *Deputados brasileiros. Repertório* (1979-1983);\n*Veja* (27/10/82).\n\n \n","dic":"DHBB"}
