{"title":"GADELHA, José","cargoss":["Deputado federal","Deputado federal"],"cargos_esp":[0,0],"datas_ini":[1967,1964],"datas_fim":[1971,1964],"estados":["PB","PB"],"autor":[0],"content":"**GADELHA, José**\n\n\\*dep. fed. PB 1964 e 1967-1971.\n\n \n\n*José de Paiva Gadelha* nasceu em Sousa (PB) no dia 11 de abril de 1916,\nfilho de Manuel Gadelha Filho e de Joaquina de Paiva Gadelha.\n\nComerciante, iniciou sua carreira política como vereador na Câmara\nMunicipal de Sousa em 1950. No pleito de outubro de 1962, elegeu-se\nsuplente de deputado federal pela Paraíba na legenda da União\nDemocrática Nacional (UDN). Após a vitória do movimento político-militar\nde 31 de março de 1964 que depôs o presidente João Goulart (1961-1964) e\niniciou um período de governos comandados por militares, Gadelha exerceu\no mandato de deputado federal de agosto a setembro de 1964. Com a\npromulgação do Ato Institucional nº 2 (27/10/1965), que extinguiu os\npartidos políticos, e a instauração do bipartidarismo, filiou-se ao\nMovimento Democrático Brasileiro (MDB), partido de oposição ao regime\nmilitar vigente no país, em cuja legenda foi eleito deputado federal no\npleito de novembro de 1966.\n\nAssumindo sua cadeira no Legislativo federal em fevereiro de 1967, em\nnovembro de 1970 concorreu como suplente de senador pela Paraíba, na\nchapa encabeçada pelo deputado Humberto Lucena, mas não foi eleito.\nPermaneceu na Câmara dos Deputados até o final do mandato, em janeiro do\nano seguinte. A partir de então dedicou-se às suas atividades na\nindústria e a dar apoio à carreira política dos filhos.\n\nFaleceu em Sousa no dia 14 de novembro de 1981.\n\nEra casado com Míriam Benevides Gadelha, com quem teve oito filhos, um\ndos quais, Marcondes Gadelha, foi deputado federal pela Paraíba de 1971\na 1983, senador de 1983 a 1991, constituinte de 1987 a 1988 e novamente\ndeputado federal a partir de 1999.\n\n \n\nFONTES: CÂM. DEP. *Deputados*; CÂM. DEP. *Deputados brasileiros.\nRepertório* (1967-1971); INF. Marcelo R. C. Pais; TRIB. SUP. ELEIT.\n*Dados* (8 e 9).\n\n \n\n \n","ref":"FONTES: CÂM. DEP. *Deputados*; CÂM. DEP. *Deputados brasileiros.\nRepertório* (1967-1971); INF. Marcelo R. C. Pais; TRIB. SUP. ELEIT.\n*Dados* (8 e 9).\n\n \n\n \n","dic":"DHBB"}
