{"title":"AMARAL, Irnack Carvalho do","cargoss":["Presidente de associação ou confederação de empregados ou empregadores"],"cargos_esp":["Petrobras"],"datas_ini":[1966],"datas_fim":[1967],"estados":[0],"autor":[0],"content":"**AMARAL, Irnack Carvalho do**\n\n\\*pres. Petrobras 1966-1967.\n\n \n\n*Irnack Carvalho do Amaral* nasceu no Rio de Janeiro, então Distrito\nFederal, no dia 6 de outubro de 1905, filho de Alípio Augusto do Amaral\nJúnior e de Iná Carvalho do Amaral.\n\nEstudou, no Rio de Janeiro, no Colégio Santo Inácio e no Liceu Francês,\nformando-se em 1931 engenheiro de minas e engenheiro civil pela Escola\nde Minas de Ouro Preto (MG). Iniciou suas atividades profissionais em\n1932 como engenheiro do Serviço Geológico e Mineralógico do Brasil, no\nRio, função que exerceria até 1934. No ano seguinte tornou-se\nengenheiro-chefe da equipe de prospecção da Divisão de Fomento da\nProdução Mineral, ainda no antigo Distrito Federal, e, nessa condição,\ncolaborou com o Departamento Geográfico e Geológico de São Paulo na\nelaboração de um plano geral de pesquisas geofísicas a serem realizadas\nem território paulista.\n\nEm 1938 viajou para os Estados Unidos, a fim de familiarizar-se com o\nfuncionamento e a aplicação da aparelhagem geofísica adquirida pela\ndivisão onde trabalhava, percorrendo campos de petróleo norte-americanos\ne estudando a possibilidade da implantação no Brasil dos sistemas de\nperfuração lá utilizados. De volta ao país ainda em 1938, trabalhou até\no ano seguinte junto ao presidente do Conselho Nacional do Petróleo,\ngeneral Júlio Caetano Horta Barbosa, como assistente especial. Tornou-se\nentão chefe da seção de geofísica da Divisão de Fomento da Produção\nMineral. Nessa condição foi encarregado em 1941 dos serviços de\nclassificação e avaliação do quartzo e do controle da exportação de\nminerais, atribuições que manteria até 1951, mesmo após ter deixado, em\n1946, a chefia pela qual respondia.\n\nEm 1948 tornou-se membro da Comissão Mista Brasileiro-Americana de\nEstudos Econômicos, integrando até o ano seguinte a Comissão de\nExploração Mineral e a Subcomissão do Manganês. Em 1949 e 1950 foi\nrepresentante do Departamento Nacional de Produção Mineral junto às\nautoridades norte-americanas, no trato de questões relativas ao comércio\nde minerais, em particular do quartzo.\n\nCom a posse do presidente Getúlio Vargas em janeiro de 1951, foi nomeado\nem abril desse mesmo ano diretor da divisão de fomento do Departamento\nNacional de Produção Mineral. Criada a Petrobras em outubro de 1953,\ntornou-se em maio de 1954 membro de sua diretoria, situação em que\nesteve até 1957. Nesse ano retornou aos quadros da Divisão de Fomento da\nProdução Mineral, atuando como engenheiro de minas até abril de 1958,\nquando passou a representar o órgão no Conselho Nacional de Energia\nNuclear, onde permaneceria até março de 1961. Em outubro de 1958 passou\na dirigir a Divisão de Fomento do Departamento Nacional de Produção\nMineral e, ainda nesse ano, tornou-se consultor do Banco Nacional do\nDesenvolvimento Econômico (BNDE) para assuntos relativos ao petróleo e à\nmineração. Em 1959 foi designado para representar o Departamento\nNacional de Produção Mineral no Conselho da Comissão do Plano de Carvão\nNacional, onde esteve até 1961.\n\nNovamente nomeado diretor da Petrobras, exerceu a função de abril de\n1961 a setembro de 1963, quando assumiu a direção geral do Departamento\nNacional de Produção Mineral, cargo que ocuparia até junho de 1966.\nAinda em 1963, retornou à Comissão do Plano Nacional do Carvão como\nmembro do seu conselho consultivo, condição em que se manteria até 1966.\nEm julho desse ano foi designado para substituir o marechal Ademar de\nQueirós na presidência da Petrobras, cargo que ocupou até abril de 1967,\nquando foi substituído pelo general Artur Duarte Candal Fonseca e\naposentou-se do serviço público. Em 1970 voltou a atuar na Petrobras,\ncomo membro de seu conselho de administração.\n\nFoi também presidente do conselho consultivo da Petroquímica União S.A.\ne membro do Clube de Engenharia e da Sociedade Mineira de Engenheiros.\n\nFaleceu no Rio de Janeiro no dia 8 de janeiro de 1983.\n\nFoi casado com Elza Carvalho do Amaral, com quem teve duas filhas.\n\nPublicou artigos e pareceres em revistas técnicas, e na revista do\nDepartamento Nacional de Produção Mineral.\n\n \n\nFONTES: BULHÕES, O.*Margem;*CORRESP. PETROBRAS; LIMA, M.\n*Petróleo;*MOREIRA, J. *Dic.; Perfil*(1972); SOC. BRAS. EXPANSÃO\nCOMERCIAL. *Quem; Who’s who* *in Brazil.*\n\n \n","ref":"FONTES: BULHÕES, O.*Margem;*CORRESP. PETROBRAS; LIMA, M.\n*Petróleo;*MOREIRA, J. *Dic.; Perfil*(1972); SOC. BRAS. EXPANSÃO\nCOMERCIAL. *Quem; Who’s who* *in Brazil.*\n\n \n","dic":"DHBB"}
