{"title":"GALE, Natal","cargoss":["Deputado federal"],"cargos_esp":[0],"datas_ini":[1979],"datas_fim":[1987],"estados":["SP"],"autor":[0],"content":"**GALE, Natal**\n\n\\*dep. fed. SP 1979-1987.\n\n*Natal Gale* nasceu em Orlândia (SP) no dia 23 de dezembro de 1937,\nfilho de David Gale e de Neusa de Matos Lavrador Gale.\n\nEm 1962 tornou-se bacharel em ciências jurídicas e sociais pela\nFaculdade de Direito do Vale do Paraíba, em São José dos Campos (SP).\nSeis anos depois, em novembro de 1968, foi eleito vereador em Campinas\nna legenda do Movimento Democrático Brasileiro (MDB), partido de\noposição ao regime militar instaurado no país em abril de 1964. Reeleito\npelo mesmo partido em 1972, foi o candidato mais votado neste pleito,\nexercendo, tanto neste mandato como no anterior, a presidência da Câmara\nMunicipal.\n\nEm novembro de 1974, candidatou-se a uma cadeira na Assembléia\nLegislativa de São Paulo, ainda na legenda oposicionista. Eleito,\nassumiu o mandato no início do ano seguinte, participando dos trabalhos\nlegislativos como presidente da mesa da Assembléia e tornando-se\npresidente do MDB de São Paulo. Representando esta mesma agremiação,\ncandidatou-se à prefeitura de Campinas em 1976, mas não logrou êxito.\n\nEleito deputado federal pelo MDB em novembro de 1978, assumiu o mandato\nem fevereiro do ano seguinte. Nesta legislatura, foi membro titular da\nComissão de Constituição e Justiça e da Comissão Parlamentar de\nInquérito (CPI) destinada a apurar atos de corrupção praticados por\nórgãos da administração direta e indireta da União. Como suplente,\nintegrou a Comissão de Trabalho e Legislação Social. Com o fim do\nbipartidarismo em novembro de 1979 e a conseqüente reformulação\npartidária, filiou-se ao Partido Democrático Social (PDS), agremiação\nsucessora da Aliança Renovadora Nacional (Arena), partido de sustentação\npolítica ao regime militar.\n\nReeleito deputado federal na legenda do PDS no pleito de novembro de\n1982, assumiu seu mandato no início do ano seguinte, tornando-se,\ndurante esta legislatura, vice-líder de seu partido. Em 25 de abril de\n1984, ausentou-se na votação da emenda Dante de Oliveira, que propunha a\nrealização de eleições diretas para a presidência da República em\nnovembro daquele ano. A não-aprovação da emenda pela Câmara definiu que\no sucessor do presidente João Figueiredo (1979-1985) seria eleito por\nvia indireta. Vários eram os postulantes à condição de candidato oficial\ndo partido governista. A falta de consenso quanto à forma de escolha\nprovocou uma cisão no PDS e os dissidentes formaram a Frente Liberal.\nPara decidir a questão, a agremiação governista realizou uma convenção\nem agosto, quando o deputado paulista Paulo Maluf, tendo como vice o\ndeputado cearense Flávio Marcílio, derrotou o ministro do Interior Mário\nAndreazza, cujo vice era o deputado alagoano Divaldo Suruagi.\n\nPara concorrer com os candidatos do governo, o Partido do Movimento\nDemocrático Brasileiro (PMDB), principal agremiação oposicionista, e a\nFrente Liberal, reuniram-se na chamada Aliança Democrática e lançaram\nTancredo Neves, governador de Minas Gerais, e José Sarney, senador\nmaranhense, respectivamente, candidatos à presidência e à\nvice-presidência da República. Na reunião do Colégio Eleitoral,\nrealizada em 15 de janeiro de 1985, Natal Gale votou no candidato\noposicionista Tancredo Neves. Este, contudo, não chegou a ser empossado\nna presidência, por motivo de doença, vindo a falecer em 21 de abril de\n1985. Seu substituto no cargo foi o vice José Sarney, que já vinha\nexercendo interinamente o cargo desde 15 de março deste último ano.\n\nAinda em abril, Natal Gale transferiu-se para o recém-formado Partido da\nFrente Liberal (PFL). Disputou uma vaga de deputado federal constituinte\nno pleito do novembro de 1986, mas não foi bem-sucedido. Deixou a Câmara\nem janeiro do ano seguinte, ao final da legislatura.\n\nAfastado do cenário político desde então, passou a dedicar-se\nexclusivamente aos seus serviços de assessoria jurídica, atividade que\nexerceu ao longo de 25 anos, e às rádios Morena FM e Jequitibá AM, de\nsua propriedade desde 1982. Em 1999, Natal Gale ainda era o responsável\npela administração dessas rádios, localizadas na cidade de Campinas.\n\nCasou-se com Maria Inês de Carvalho Gervino Gale, com quem teve dois\nfilhos. Fora de seu matrimônio teve uma filha com Zélia Artini Romeiro.\n\n \n\nFONTES: CÂM. DEP. *Deputados brasileiros. Repertórios*(1979-1983;\n1983-1987; 1987-1991); INF. BIOG.\n\n \n","ref":"FONTES: CÂM. DEP. *Deputados brasileiros. Repertórios*(1979-1983;\n1983-1987; 1987-1991); INF. BIOG.\n\n \n","dic":"DHBB"}
