{"title":"GALVÃO, Georges","cargoss":["Deputado federal"],"cargos_esp":[0],"datas_ini":[1955],"datas_fim":[1959],"estados":["DF"],"autor":[0],"content":"**GALVÃO, Georges**\n\n\\*dep. fed. DF 1955-1959.\n\n \n\n*Georges Galvão* nasceu no Rio de Janeiro, então Distrito Federal, no\ndia 8 de março de 1913, filho de Miguel Ricardo Galvão e de Louise\nGalvão.\n\nResidiu e estudou em diversas cidades dos estados do Rio de Janeiro,\nParaná e Mato Grosso, sempre acompanhando o pai, engenheiro. Em 1941, no\nRio de Janeiro, participou dos estudos de preparação do terreno\ndestinado à construção da Fábrica Nacional de Motores (FNM), em Duque de\nCaxias, supervisionados pelo futuro governador de São Paulo, Lucas\nNogueira Garcez.\n\nCasando-se em 1942 com Rosalina Carvalho Galvão, trabalhou na área\ngerencial e financeira de O Radical, fundado em 1932 e dirigido pelo\nsogro, Rodolfo de Carvalho. Em 1946, com a sua morte, assumiu a direção\ndo jornal. Defensor do governo Getúlio Vargas a partir de 1950, o\nperiódico deixou de circular em outubro de 1954, por não conseguir\nsaldar as dívidas acumuladas no Banco do Brasil.\n\nNesse mesmo mês, Georges Galvão elegeu-se deputado federal pela legenda\ndo Partido Trabalhista Brasileiro (PTB). Empossado em fevereiro de 1955,\nparticipou da Comissão de Finanças. Em outubro de 1958 tentou a\nreeleição pela mesma legenda, obtendo uma suplência. Deixou a Câmara ao\ntérmino da legislatura, em janeiro de 1959.\n\nFoi ainda assessor político na área de finanças.\n\nFaleceu no Rio de Janeiro no dia 2 de outubro de 1979.\n\nDe seu casamento com Rosalina Carvalho Galvão teve três filhos.\n\n \n\nFONTES: CÂM. DEP. *Deputados*; CÂM. DEP. *Deputados federais —\nInventário*; ENTREV. Rosalina Galvão.\n\n \n","ref":"FONTES: CÂM. DEP. *Deputados*; CÂM. DEP. *Deputados federais —\nInventário*; ENTREV. Rosalina Galvão.\n\n \n","dic":"DHBB"}
