{"title":"GALVÃO, João Frederico Abbott","cargoss":["Deputado federal","Deputado federal"],"cargos_esp":[0,0],"datas_ini":[1961,1960],"datas_fim":[1963,1960],"estados":["RN","RN"],"autor":[0],"content":"**GALVÃO, João Frederico Abbott**\n\n\\*dep. fed. RN 1960 e 1961-1963.\n\n \n\n*João Frederico Abbott Galvão* nasceu em Natal no dia 26 de abril de\n1926, filho de Solon de Miranda Galvão e de Heloísa Abbot Galvão.\n\nIniciou sua trajetória política em outubro de 1950, quando se elegeu\nvereador à Câmara Municipal de Natal na legenda do Partido Social\nProgressista (PSP). Empossado no ano seguinte, disputou uma vaga na\nAssembléia Legislativa do Rio Grande do Norte (ALRN) no pleito de\noutubro de 1954. Eleito, assumiu o mandato de deputado estadual no\ninício de 1955, tendo antes encerrado sua passagem pela vereança.\n\nJá filiado à União Democrática Nacional (UDN), foi eleito em outubro de\n1958 suplente de deputado federal pelo Rio Grande do Norte na legenda da\nFrente Democrática Nacional, integrada por sua agremiação, pelo Partido\nSocial Trabalhista (PST) e pelo Partido Trabalhista Nacional (PTN).\nDeixou a ALRN no início de 1959, ao término da legislatura. Exerceu o\nmandato de deputado federal de maio a agosto de 1960 e de março de 1961\na janeiro de 1963, ocupando, neste último período a vaga de Aluísio\nAlves, governador do Rio Grande do Norte a partir de 1961.\n\nDeixou a Câmara dos Deputados em janeiro de 1963, não tendo conseguido\nse reeleger, pela UDN, no pleito de outubro do ano anterior. Em seguida,\nfez o curso de direito na Faculdade de Direito de Sousa (PB). Presidente\nda Federação das Indústrias do Estado do Rio Grande do Norte, entre 1970\ne 1974 foi diretor comercial da Companhia de Serviços Elétricos do Rio\nGrande do Norte (Cosern), porém acabou demitido em razão de denúncias\nenvolvendo irregularidades administrativas na gestão do governador\nCortez Pereira (1971-1975). Posteriormente, passou a advogar em Natal.\n\nCom a extinção do bipartidarismo em 29 de novembro de 1979 e a\nconseqüente reformulação partidária, filiou-se ao Partido do Movimento\nDemocrático Brasileiro (PMDB), e nessa legenda concorreu a uma cadeira\nna Câmara dos Deputados pelo estado do Rio Grande do Norte, no pleito de\nnovembro de 1982, obtendo apenas uma suplência.\n\nFaleceu no dia 27 de maio de 1992.\n\n \n\nFONTES: CÂM. DEP. *Anais* (1960-1); CÂM. DEP. *Deputados*; CÂM. DEP.\n*Deputados brasileiros. Repertório*(1946-1967); CÂM. DEP. *Súmulas*;\nIPC. *Relação de parlamentares* (1/1/92 a 18/8/98).\n\n \n","ref":"FONTES: CÂM. DEP. *Anais* (1960-1); CÂM. DEP. *Deputados*; CÂM. DEP.\n*Deputados brasileiros. Repertório*(1946-1967); CÂM. DEP. *Súmulas*;\nIPC. *Relação de parlamentares* (1/1/92 a 18/8/98).\n\n \n","dic":"DHBB"}
