{"title":"GARCIA, Gílton","cargoss":["Deputado federal","Governador de estado ou do Distrito Federal"],"cargos_esp":[0,0],"datas_ini":[1983,1990],"datas_fim":[1987,1991],"estados":["SE","AP"],"autor":["Marcelo Costa"],"content":"**GARCIA, Gílton**\n\n\\*dep. fed. SE 1983-1987; gov. AP 1990-1991.\n\n*José Gílton Pinto Garcia* nasceu em Aracaju no dia 5 de janeiro de\n1941, filho de Luís Garcia e de Emília Marques Pinto Garcia.\n\nDiplomou-se bacharel em ciências jurídicas e sociais em 1963 pela\nUniversidade Federal de Sergipe (Ufse). Em novembro de 1966, elegeu-se\ndeputado estadual na legenda da Aliança Renovadora Nacional (Arena),\npartido de apoio ao regime militar instaurado no país em abril de 1964.\nAssumiu o mandato no início do ano seguinte, tornando-se presidente da\nAssembléia Legislativa. Em 1968 tornou-se professor titular de direito\nda Ufse. Encerrou seu mandato em fevereiro de 1971.\n\nEm 1975, assumiu a presidência da Ordem dos Advogados do Brasil (OAB),\nseção Sergipe, ocupando esse cargo por duas gestões consecutivas, até\n1979. Nesse ano, tornou-se procurador do Tribunal de Contas de Sergipe,\nfunção que ocuparia até 1982. Em 1981, participou do Seminário\nInternacional de Administração Pública, realizado em Berlim, Alemanha.\nNo ano seguinte, tornou-se procurador-geral da Justiça do estado de\nSergipe.\n\nNo pleito de novembro de 1982, foi eleito deputado federal na legenda do\nPartido Democrático Social (PDS), agremiação sucessora da Arena,\nafastando-se, dessa maneira, do cargo de procurador-geral da Justiça do\nestado. Empossado em fevereiro de 1983, participou dos trabalhos\nlegislativos como segundo-vice-presidente da Comissão Especial do\nProjeto de Código Civil, membro titular da Comissão do Interior e\nsuplente da Comissão de Relações Exteriores.\n\nEm 25 de abril de 1984, votou a favor da emenda Dante de Oliveira que,\napresentada na Câmara dos Deputados, propôs o restabelecimento das\neleições diretas para presidente da República em novembro daquele ano.\nComo a emenda não obteve o número de votos indispensáveis à sua\naprovação — faltaram 22 para que pudesse ser encaminhada à apreciação\npelo Senado —, no Colégio Eleitoral, reunido em 15 de janeiro de 1985,\nGílton Garcia se absteve de votar na eleição indireta para a presidência\nda República, afinal vencida pelo candidato oposicionista Tancredo\nNeves, eleito novo presidente da República pela Aliança Democrática, uma\nunião do Partido do Movimento Democrático Brasileiro (PMDB) com a\ndissidência do PDS abrigada na Frente Liberal. Contudo, Tancredo Neves\nnão chegou a ser empossado na presidência, vindo a falecer em 21 de\nabril de 1985. Seu substituto foi o vice José Sarney, que já vinha\nexercendo interinamente o cargo desde 15 de março.\n\nEm novembro de 1985, Gílton Garcia candidatou-se à prefeitura de\nAracaju, na legenda do PDS, em coligação com o Partido Trabalhista\nBrasileiro (PTB), mas não obteve sucesso. Deixou a Câmara dos Deputados\nem janeiro de 1987, ao final da legislatura, não tendo disputado a\nreeleição em novembro do ano anterior.\n\nChefe da assessoria parlamentar do palácio do Planalto, em abril de 1990\nfoi indicado pelo presidente da República Fernando Collor de Melo\n(1991-1992), com quem trabalhara como assessor legislativo da Secretaria\nGeral da Presidência da República, para assumir em caráter provisório o\ngoverno do Amapá, elevado a categoria de estado pela Constituição de\n1988, no lugar de Jorge Nova da Costa, nomeado pelo ex-presidente José\nSarney. Assumiu o governo em maio e deixou o cargo em 1º de janeiro de\n1991, passando-o para Aníbal Barcelos, o primeiro governador eleito, no\npleito de outubro de 1990, cuja candidatura foi apoiada por Collor.\nRetornou à chefia da assessoria parlamentar do palácio do Planalto.\n\nNo pleito de outubro de 1994, candidatou-se a uma cadeira no Senado pelo\nAmapá, pela legenda do Partido Progressista Reformador (PPR), não\nobtendo êxito. Em 1995, tornou-se assessor da presidência do Senado na\ngestão de José Sarney (1995-1996).\n\nCasou-se com Maria Helena de Albuquerque Garcia, com quem teve quatro\nfilhos.\n\nMarcelo Costa\n\nFONTES: CÂM. DEP. *Deputados brasileiros. Repertório*(1983-1987);\nCURRIC. BIOG.; *Estado de S. Paulo* (24/4/84 e 20/4/90); *Folha de S.\nPaulo* (2/1/91); *Globo* (26/4/84, 16/1/85 e 4/5/90); *Jornal do Brasil*\n(15/8/85 e 27/4/91); NICOLAU, J. *Dados*; TRIB. SUP. ELEIT.\n*Da**dos*(8).\n\n \n","ref":"FONTES: CÂM. DEP. *Deputados brasileiros. Repertório*(1983-1987);\nCURRIC. BIOG.; *Estado de S. Paulo* (24/4/84 e 20/4/90); *Folha de S.\nPaulo* (2/1/91); *Globo* (26/4/84, 16/1/85 e 4/5/90); *Jornal do Brasil*\n(15/8/85 e 27/4/91); NICOLAU, J. *Dados*; TRIB. SUP. ELEIT.\n*Da**dos*(8).\n\n \n","dic":"DHBB"}
