{"title":"GASPARINI, Alfeu","cargoss":["Deputado federal"],"cargos_esp":[0],"datas_ini":[1971],"datas_fim":[1975],"estados":["SP"],"autor":[0],"content":"**GASPARINI, Alfeu**\n\n\\*dep. fed.****SP 1971-1975.\n\n \n\n*Alfeu Luís Gasparini* nasceu em Batatais (SP) no dia 4 de janeiro de\n1927, filho de Vitório Gasparini e de Deolinda Gasparini.\n\nEstudou no Grupo Escolar Washington Luís, em Batatais, no Instituto de\nCiências e Letras, na cidade de São Paulo, e no Instituto de Educação\nOtoniel Meta, em Ribeirão Preto (SP), onde concluiu o curso normal.\nTendo feito ainda o curso de aperfeiçoamento de professores primários na\nEscola Normal de São Joaquim da Barra (SP), lecionou em escolas\nprimárias e secundárias em Batatais, Ribeirão Preto, São Joaquim da\nBarra e Ipuã (SP).\n\nBacharelou-se pela Faculdade de Direito do Triângulo Mineiro, em Uberaba\n(MG), no ano de 1958, passando a advogar na mesma região onde lecionava.\nNessa época iniciou também sua carreira política, elegendo-se\nsucessivamente vereador às câmaras municipais de São Joaquim da Barra e\nde Batatais. Foi assessor jurídico da Prefeitura de São Joaquim da Barra\ne em 1964 era chefe de gabinete e secretário de Educação e Cultura da\nPrefeitura de Ribeirão Preto, durante a gestão de seu irmão, Wilson\nGasparini.\n\nNo pleito de novembro de 1966 elegeu-se deputado à Assembléia\nLegislativa de São Paulo na legenda da Aliança Renovadora Nacional\n(Arena), assumindo o mandato em fevereiro do ano seguinte. Nessa\nlegislatura integrou a Comissão de Turismo, presidiu a Comissão de\nEducação e Cultura e foi vice-líder do governo em 1968, durante a\nadministração de Roberto de Abreu Sodré. Diplomou-se em sociologia pela\nUniversidade Moura Lacerda, em Ribeirão Preto, e em 1969 concluiu o\ncurso de auditor da Escola de Administração de Empresas da Fundação\nGetulio Vargas, em São Paulo.\n\nEm novembro de 1970 elegeu-se deputado federal por São Paulo na legenda\nda Arena, deixando a Assembléia Legislativa em janeiro de 1971 e\nassumindo seu mandato na Câmara em fevereiro seguinte. Nessa legislatura\nfoi membro da Comissão de Educação e Cultura e suplente da Comissão de\nRelações Exteriores e da Comissão de Constituição e Justiça. No pleito\nde novembro de 1974 voltou a candidatar-se a deputado federal, obtendo\napenas a 26ª suplência. Deixou a Câmara em janeiro de 1975, ao concluir\nseu mandato.\n\nFaleceu em São Paulo em setembro de 1976.\n\nFoi casado com Leonor Coscrato Gasparini, com quem teve dois filhos.\n\n \n\n \n\nFONTES: CÂM. DEP. Deputados; CÂM. DEP. Deputados brasileiros. Repertório\n(7); Jornal do Brasil (10/9/76); NÉRI, S. 16; Perfil (1972); SOC. BRAS.\nEXPANSÃO COMERCIAL. Quem; Who’s who in Brazil (1972).\n\n \n","ref":"FONTES: CÂM. DEP. Deputados; CÂM. DEP. Deputados brasileiros. Repertório\n(7); Jornal do Brasil (10/9/76); NÉRI, S. 16; Perfil (1972); SOC. BRAS.\nEXPANSÃO COMERCIAL. Quem; Who’s who in Brazil (1972).\n\n \n","dic":"DHBB"}
