{"title":"GATO, Marcelo  ==============","cargoss":["Deputado federal"],"cargos_esp":[0],"datas_ini":[1975],"datas_fim":[1976],"estados":["SP"],"autor":[0],"content":"GATO, Marcelo \n==============\n\n\\* dep. fed. SP 1975-1976.\n\n \n\n*Alberto Marcelo Gato*nasceu em  Sertão­zinho (SP) no dia 16 de janeiro\nde 1941, filho de Antônio Gato Júnior e de Dolores Rodrigues da Silva.\n\nPara custear seus estudos, em 1957 passou a trabalhar como radialista em\nRibeirão Preto. Em 1962 formou-se em química industrial nesta cidade e\nno ano seguinte ingressou na  Com­panhia Siderúrgica Paulista  (\nCosipa), sendo eleito, em 1968, para a presidência do Sindicado dos\nTrabalhadores nas Indústrias Metalúrgicas, Mecânicas e de Material\nElétrico de Santos, São Vicente, Cubatão e Guarujá, no estado de São\nPaulo. De 1970 a 1972 foi presidente do Departamento Intersindical de\nEstatística e Estudos Sócio-Econômicos (Dieese), na capital paulista  e\nnesse último ano bacharelou-se em ciências jurídicas e sociais pela\nFaculdade Católica de Direito, em Santos.\n\nEleito vereador naquela cidade em  no­vembro de 1972, na legenda do\nMovimento Democrático Brasileiro (MDB), partido de oposição ao regime\nmilitar instaurado no país em abril de 1964, assumiu o mandato no mês de\njaneiro de 1973 e duran­te a legislatura foi segundo-secretário da\nCâmara Municipal. Em 1974 deixou suas ativi­dades sindicais para\ncandidatar-se, no pleito de novembro, a deputado federal por São Paulo,\nainda na legenda do MDB. Conseguiu eleger-se, obtendo a maior parte dos\nvotos entre os operários de Santos e da grande São Paulo, notadamente no\nchamado ABC (Santo André, São Bernardo do Campo e São Caetano do Sul).\nEm fevereiro de 1975 renunciou ao mandato municipal para assumir sua\ncadeira na Câmara dos deputados. Durante o curto período em que a\nocupou, foi um crítico sistemático da política salarial do governo,\nevidenciando através de dados, especialmente os elaborados pelo Dieese,\na diminuição do poder aquisitivo dos trabalha­dores. Propôs a criação de\numa comissão parlamentar de inquérito (CPI) para debater essa política e\nfoi membro da Comissão de Trabalho e Legislação Social da Câmara,\ndes­tacando-se ainda no combate à censura.\n\nNum relatório do Departamento de Or­dem Política e Social (Dops) sobre\nas ativi­dades do Partido Comunista Brasileiro (PCB), enviado em\ndezembro de 1975 à 2ª. Auditoria de Guerra, em São Paulo, foi acu­sado,\njuntamente com outros dois parlamen­tares oposicionistas, Alberto\nGoldmann e Nélson Fabiano Sobrinho, deputados esta­duais em São Paulo,\nde ligações com aquela organização política clandestina, que os teria\nauxiliado a se eleger. Tal acusação veio a público dois meses depois da\nmorte do jor­nalista Vladimir Herzog no cárcere do Depar­tamento de\nOperações e Investigações-­Centro de Operações de Defesa Interna\n(Doi-CODI), na capital paulista, em meio a uma intensa campanha de\nrepressão ao PCB. O relatório \"observou a infiltração do ex-PCB na\npolítica nacional, objetivando a ocupação de posições de destaque nos\ndiver­sos setores da atividade humana\", para o que estaria utilizando o\nconcurso do MDB, atra­vés do Instituto de Estudos Políticos, Econô­micos\ne Sociais (Iepes) e da preparação de \"juventudes democráticas\".\n\nO*Jornal do Brasil*(27/12/1975) publicou declaração do advogado de\nMarcelo Gato segundo a qual o nome do deputado, assim como os dos outros\ndois parlamentares, fora suprimido do inquérito por falta de provas de\nsua ligação com o PCB. Chamado, no en­tanto, a comparecer ao Dops, o\nrepresen­tante paulista disse que só o faria se a con­vocação fosse\naprovada pela Câmara Federal, conforme obriga a lei em defesa das\nprerro­gativas parlamentares, sendo nisso apoiado pelo presidente\nnacional do MDB, deputado Ulisses Guimarães. Gato contestou as\nacusa­ções do relatório e o classificou de \"pseudo­-inquérito\" para\n\"comprometer o MDB e iso­lá-lo do povo brasileiro\", afirmando ainda que\ncontinuaria a defender \"a democracia, a liberdade, os direitos humanos e\na justiça so­cial\". Em reunião, por essa época, com o então secretário\nde Segurança Pública de São Paulo, coronel Antônio Erasmo Dias, e\ndele­gados do Departamento Estadual de Ordem Política e Social (Deops),\nreiterou suas de­núncias contra os órgãos de segurança,  decla­rando não\nretirar uma palavra do que já dis­sera.  Por essa razão foi sugerido seu\nenqua­dramento no artigo 16 da Lei de Segurança Nacional.  No dia 5 de\njaneiro de 1976, o presidente da República, general Ernesto Geisel\n(1974-1979), assinou decreto, com ba­se no Ato Institucional nº. 5,\ncassando seu mandato parlamentar e suspendendo seus di­reitos políticos\npor dez anos. Outro dos acusados, Nélson Fabiano Sobrinho, foi\nigualmente cassado nesta ocasião.\n\nMarcelo Gato foi beneficiado pela anistia de agosto de 1979 e, com a\nextinção do bi­partidarismo em 29 de novembro desse ano e a conseqüente\nreformulação partidária, fi­liou-se ao Partido do Movimento Democráti­co\nBrasileiro (PMDB), agremiação sucessora do MDB. Nessa legenda foi\nelei­to suplente de deputado federal por São Paulo no pleito de novembro\nde 1982.\n\nCom o retorno do PCB à legalidade em 1985, filiou-se a esta legenda e no\npleito de novembro do ano seguinte candidatou-se a uma cadeira na\nCâmara, não logrando êxito.\n\nAbandonando a vida pública, retomou suas atividades de advogado\ntrabalhista na Baixada Santista. Em 1992 foi fundador, em Santos, do\nPartido Popular Socialista (PPS), agremiação resultante das mudanças\nefetuadas nos estatutos do  PCB.\n\nCasou-se com Andréa  Angerami Correia da Silva. Teve quatro filhas.\n\n \n\nFONTES: CÂM. DEP. *Deputados;*CÂM. DEP.*Deputados brasileiros. \nRepertório*(1975-1979); *Estado de São Paulo* (23/12/75); INF.\nBIOG.;*Jornal do* *Brasil* (23 e 27/12/75 e 6/1/76); NÉRI, S. *16*.\n\n \n","ref":"FONTES: CÂM. DEP. *Deputados;*CÂM. DEP.*Deputados brasileiros. \nRepertório*(1975-1979); *Estado de São Paulo* (23/12/75); INF.\nBIOG.;*Jornal do* *Brasil* (23 e 27/12/75 e 6/1/76); NÉRI, S. *16*.\n\n \n","dic":"DHBB"}
