{"title":"GAYER, Plínio","cargoss":["Deputado federal"],"cargos_esp":[0],"datas_ini":[1951],"datas_fim":[1953],"estados":["GO"],"autor":[0],"content":"**GAYER, Plínio**\n\n\\*dep. fed. GO 1951-1953.\n\n \n\n*Plínio Gayer* nasceu em Santiago (RS) no dia 20 de julho de 1898, filho\nde Frederico Gayer e de Maria Fausta Gayer.\n\nFormou-se pela Faculdade de Medicina da Universidade do Rio de Janeiro,\nna capital federal.\n\nIniciou sua carreira política como vereador e prefeito de Camanducaia\n(MG) e de Caiapônia (GO). No pleito de outubro de 1950 elegeu-se\ndeputado federal por Goiás na legenda do Partido Social Democrático\n(PSD), assumindo o mandato em fevereiro do ano seguinte.\n\nSuicidou-se nas dependências da Câmara dos Deputados, no Rio de Janeiro,\nem 8 de julho de 1953.\n\n \n\n \n\nFONTES: CÂM. DEP. Deputados; CÂM. DEP. Relação dos dep.; CISNEIROS, A.\nParlamentares; FRANCO, A. Escalada.\n\n \n","ref":"FONTES: CÂM. DEP. Deputados; CÂM. DEP. Relação dos dep.; CISNEIROS, A.\nParlamentares; FRANCO, A. Escalada.\n\n \n","dic":"DHBB"}
