{"title":"GIAVARINA, Valmor","cargoss":["Deputado federal"],"cargos_esp":[0],"datas_ini":[1983],"datas_fim":[1987],"estados":["PR"],"autor":[0],"content":"**GIAVARINA, Valmor**\n\n\\*dep. fed. PR 1983-1987.\n\n \n\n*Valmor Santos Giavarina* nasceu em Capinzal (SC) no dia 26 de outubro\nde 1933, filho de Inácio Giavarina e Otacília Bittencourt Giavarina.\n\nEm 1956, formou-se pela Escola de Odontologia da Faculdade de Medicina\nda Universidade do Paraná. Professor de química e física no Colégio Nilo\nCairo, em Apucarana (PR), de 1958 a 1964, trabalhou também como\nradialista na Rádio Cultura de Apucarana, entre 1959 e 1966, fazendo\ncomentários políticos no programa *Crônica do meio-dia*.\n\nIniciou sua carreira política, elegendo-se vereador em Apucarana na\nlegenda do Partido Libertador (PL), em outubro de 1964. Empossado em\njaneiro de 1965, tornou-se líder da bancada. Em 27 de outubro de 1965,\ncom a extinção dos partidos políticos pelo Ato Institucional nº 2 e a\nposterior instauração do bipartidarismo, filiou-se ao Movimento\nDemocrático Brasileiro (MDB), partido de oposição ao regime militar.\n\nEm 1966, bacharelou-se em ciências jurídicas e sociais pela Faculdade\nEstadual de Direito de Londrina (PR). Nesse mesmo ano, no pleito de\nnovembro, elegeu-se deputado estadual. Empossado em fevereiro de 1967,\nfoi líder da bancada. Nas eleições municipais de novembro de 1968,\ncandidatou-se à prefeitura de Apucarana, na legenda do MDB. Eleito,\ndeixou a Assembléia Legislativa em fevereiro seguinte para ser empossado\ncomo prefeito. Exerceu o mandato de prefeito até janeiro de 1973.\n\nNos anos seguintes, dedicou-se às atividades jornalísticas, trabalhando\nna TV Tibagi, de Apucarana, filiada à Rede Globo, na qual apresentava um\nprograma diário de entrevistas (*O negócio é o seguinte*), que foi ao ar\naté 1975, quando foi enquadrado na Lei de Segurança Nacional por ofensa\nàs forças armadas (processara um capitão do Exército acusado de ter\ntorturado um vereador). O episódio o manteria afastado por muito tempo\nda vida política.\n\nCom a extinção do bipartidarismo em novembro de 1979 e a conseqüente\nreformulação partidária, filiou-se ao Partido do Movimento Democrático\nBrasileiro (PMDB). Delegado da Comissão Pontifícia Justiça e Paz entre\n1980 e 1982, em novembro deste último ano elegeu-se deputado federal na\nlegenda peemedebista.\n\nEmpossado em fevereiro do ano seguinte, integrou a Comissão de\nConstituição e Justiça. Membro do grupo Só Diretas, composto por 61\nparlamentares, em 25 de abril de 1984 votou a favor da emenda Dante de\nOliveira que propunha o restabelecimento das eleições diretas para\npresidente da República em novembro daquele ano. A emenda não obteve o\ntotal de votos indispensáveis à aprovação, pois faltaram 22 para que o\nprojeto pudesse ser encaminhado à apreciação pelo Senado. No Colégio\nEleitoral, reunido em 15 de janeiro de 1985, Valmor Giavarina votou no\ncandidato oposicionista Tancredo Neves, eleito presidente da República\npela Aliança Democrática — união do PMDB com a dissidência do PDS\nreunida na Frente Liberal — que derrotou o candidato do regime militar,\nPaulo Maluf. Contudo, por motivo de doença, Tancredo Neves não chegou a\nser empossado na presidência, vindo a falecer em 21 de abril de 1985. O\ncargo foi ocupado pelo vice José Sarney, que já o exercia interinamente\ndesde 15 de março deste ano.\n\nAinda em 1985, Giavarina foi relator da emenda constitucional que\ninstituiu a Assembléia Nacional Constituinte (ANC). Tentou se reeleger\nno pleito de novembro de 1986, sempre pelo PMDB, e conseguiu uma\nsuplência. Deixou a Câmara dos Deputados em janeiro de 1987, ao final da\nlegislatura.\n\nA convite do então governador Álvaro Dias passou a responder pelo\nEscritório de Representação Política do Paraná, em Brasília. Tentou\nvoltar à carreira política na década de 1990, candidatando-se a deputado\nfederal pelo Paraná na legenda do Partido da Renovação Nacional (PRN) no\npleito de 1994, não conseguindo eleger-se.\n\nTornou-se em 1995 consultor jurídico do Partido Progressista Brasileiro\n(PPB), que viria a transformar-se posteriormente no Partido Progressista\n(PP), atividade que exerceu até sua morte. Durante esse período,\nespecializou-se em direito eleitoral tendo escrito vários trabalhos\nsobre o assunto e atuado em diversos processos jurídicos relacionados às\neleições.\n\nFaleceu em Apucarana (PR) no dia 25 de fevereiro de 2005.\n\nCasou-se com Carla Maria Agnes Giavarina, com quem teve três filhos.\n\nPublicou *O visionário*(1962)*, Inelegibilidade, Desincompatibilização,\nTudo sobre as eleições municipais*(todos em 1966),*Eleições 98*(1997*) e\nEleições 98 — ampliada e revisada (*1998), *Constituinte originada e\ninstituída* (com prefácio de Tancredo Neves, 2000) e *Eleições\nmunicipais* (2004), dentre outros trabalhos na área de direito\neleitoral.\n\n \n\nFONTES: CÂM. DEP. *Deputados brasileiros. Repertório* (1983-1987); INF.\nBIOG. *Folha de Londrina*(26/02/2005).\n\n \n","ref":"FONTES: CÂM. DEP. *Deputados brasileiros. Repertório* (1983-1987); INF.\nBIOG. *Folha de Londrina*(26/02/2005).\n\n \n","dic":"DHBB"}
