{"title":"AMARANTE, Geová","cargoss":["Constituinte"],"cargos_esp":[0],"datas_ini":[1987],"datas_fim":[1988],"estados":[0],"autor":[0],"content":"**AMARANTE, Geová**\n\n\\*const. 1987-1988.\n\n \n\n*Geová José de Freitas Amarante* nasceu em São Francisco do Sul (SC) em\n14 de março de 1936, filho de Braulino Ezequiel Amarante e de Eliziária\nde Freitas Amarante.\n\nDiretor da empresa Ouro Promoções de 1964 a 1979, formou-se em\nadministração de empresas pela Pontifícia Universidade Católica do Rio\nde Janeiro em 1970.\n\nUm dos fundadores da seção catarinense do Movimento Democrático\nBrasileiro (MDB) — partido de oposição ao regime militar criado após a\ninstauração do bipartidarismo pelo Ato Institucional nº 2 (27/10/1965)\n—, iniciou-se na vida pública em 1971, como secretário de Turismo de\nBlumenau (SC), função que exerceu até 1973. Em 1976 e 1978 foi\nsecretário de Cultura, Esporte e Turismo de Joinville (SC). Após deixar\no cargo, elegeu-se deputado estadual no pleito de novembro de 1978, na\nlegenda do MDB. Assumiu o mandato na Assembléia Legislativa no início de\n1979 e, com a extinção do bipartidarismo (29/11/1979) e a conseqüente\nreformulação partidária, filiou-se ao Partido do Movimento Democrático\nBrasileiro (PMDB), sucessor do MDB. No decorrer da legislatura presidiu\na Comissão de Ciência, Tecnologia, Agricultura, Economia e\nDesenvolvimento e a Comissão de Viação, Obras Públicas e Comunicações.\nEm 1982 reelegeu-se deputado estadual. No segundo mandato foi líder da\nbancada, participou das comissões de Viação, Obras Públicas e\nComunicações e de Ciência, Tecnologia, Agricultura, Economia. Foi,\ntambém, presidente de comissões externas e especiais da Assembléia\nLegislativa.\n\nEm novembro de 1986 candidatou-se a deputado constituinte por Santa\nCatarina, sempre na legenda do PMDB, e obteve a primeira suplência. Com\na posse de Pedro Ivo Campos no governo catarinense em março de 1987,\ntornou-se secretário especial de Comunicação Social do Governo. Ocupou\nesse cargo até outubro de 1987, quando assumiu o mandato no lugar de\nLuís Henrique da Silveira, então nomeado ministro da Ciência e\nTecnologia pelo presidente José Sarney (1985-1990). Nas principais\nvotações da Assembléia Nacional Constituinte de que participou,\npronunciou-se favoravelmente à pena de morte, ao aborto, ao mandado de\nsegurança coletivo, ao turno ininterrupto de seis horas, ao aviso prévio\nproporcional, à unicidade sindical, ao presidencialismo, à\nnacionalização do subsolo, ao limite de 12% ao ano para os juros reais,\nao mandato de cinco anos para o presidente Sarney, à proibição do\ncomércio de sangue e à anistia aos micro e pequenos empresários. Votou\ncontra a remuneração 50% superior para o trabalho extra, a limitação do\ndireito de propriedade privada, a estabilidade no emprego, a estatização\ndo sistema financeiro, a limitação dos encargos da dívida externa e a\ncriação de um fundo de apoio à reforma agrária. Foi também membro\ntitular das comissões de Relações Exteriores e de Economia e Finanças e\ncoordenador da bancada do PMDB. Exerceu o mandato até julho de 1988,\nquando Luís Henrique reassumiu, e em outubro de 1988 foi nomeado diretor\nfinanceiro da Telecomunicações de Santa Catarina (Telesc), empresa\nsubsidiária da *holding*federal, Telecomunicações Brasileiras\n(Telebrás), permanecendo no cargo até abril de 1989.\n\nDepois disso, passou a se dedicar às atividades de coordenação política\nna cidade de Joinville, onde se tornou, em 1991, presidente do diretório\nmunicipal do PMDB. Em junho de 1993 reassumiu a diretoria financeira da\nTelesc, e no ano seguinte exerceu interinamente a presidência da\nempresa. Em julho de 1995 tornou-se vice-presidente da Telesc,\npermanecendo no cargo até julho de 1998, quando assumiu a\nvice-presidência do Banco do Estado de Santa Catarina (BESC).\nParalelamente às suas atividades no BESC, continuou a prestar\nconsultoria financeira e política em Joinville. Foi diretor do Banco\nRegional de Desenvolvimento do Extremo Sul (BRDE) no primeiro governo de\nLuís Henrique da Silveira em Santa Catarina (2003-2006), e em 2005\ntornou-se presidente do Instituto de Planejamento Urbano de Joinville\n(Ipuj), na gestão do prefeito Marco Tebaldi.\n\nFoi membro da Associação Brasileira de Marketing.\n\nFaleceu em Joinville no dia 8 de fevereiro de 2009.\n\nCasado com Dirce Olsen Sapucaia de Amarante, teve três filhos.\n\nFONTES: ALVES*,*C. *72 anos*; COELHO, J. ; OLIVEIRA, A. *Nova*; CURRIC.\nBIOG.; INF. BIOG.\n","ref":"FONTES: ALVES*,*C. *72 anos*; COELHO, J. ; OLIVEIRA, A. *Nova*; CURRIC.\nBIOG.; INF. BIOG.\n","dic":"DHBB"}
