{"title":"GIUBERTI, Raul","cargoss":["Senador"],"cargos_esp":[0],"datas_ini":[1963],"datas_fim":[1971],"estados":["ES"],"autor":[0],"content":"**GIUBERTI, Raul**\n\n\\*sen. ES 1963-1971.\n\n \n\n*Raul Giuberti* nasceu em Colatina (ES) no dia 21 de abril de 1914,\nfilho de Ângelo Giuberti e de Adélia Giuberti.\n\nFez seus estudos primários na Escola Singular Masculina, em sua cidade\nnatal, e os secundários no ginásio anexo à Academia de Comércio de Juiz\nde Fora (MG), bacharelando-se mais tarde pela Escola de Medicina e\nCirurgia do Rio de Janeiro, no então Distrito Federal.\n\nDe volta a Colatina, dedicou-se à prática médica e iniciou sua carreira\npolítica como vereador à Câmara Municipal, da qual foi presidente entre\n1950 e 1954. Foi ainda prefeito de Colatina de 1954 a 1958, período em\nque o município foi classificado como o de maior progresso do Brasil, em\nconcurso promovido pelo Instituto Brasileiro de Administração Municipal\n(IBAM) em 1956.\n\nNo pleito de outubro de 1958, foi eleito vice-governador do Espírito\nSanto na chapa do Partido Social Democrático (PSD), encabeçada por\nCarlos Lindenberg. Empossado no dia 31 de janeiro de 1959, chegou a\nexercer interinamente o governo do estado em outubro do mesmo ano. Nas\neleições de outubro de 1962, foi eleito senador pelo Espírito Santo na\nlegenda da Coligação Democrática, que reunia o Partido Social\nProgressista (PSP), o Partido Trabalhista Brasileiro (PTB), o Partido de\nRepresentação Popular (PRP), o Partido Democrata Cristão (PDC) e a União\nDemocrática Nacional (UDN). Em janeiro de 1963 deixou o cargo de\nvice-governador do estado, assumindo um mês depois o mandato de senador.\n\nEm março de 1963 foi indicado para a vice-liderança do PSP no Senado,\nfunção que voltou a exercer em 1964 e 1965. Com a extinção dos partidos\npolíticos pelo Ato Institucional nº 2 (27/10/1965) e a posterior\ninstauração do bipartidarismo, filiou-se à Aliança Renovadora Nacional\n(Arena).\n\nEm janeiro de 1971, ao final de seu mandato deixou o Senado Federal. Com\na extinção do bipartidarismo em 29 de novembro de 1979 e a conseqüente\nreformulação partidária, filiou-se ao Partido do Movimento Democrático\nBrasileiro (PMDB), tornando-se presidente de seu diretório no município\nde Colatina.\n\nFaleceu no Rio de Janeiro no dia 16 de fevereiro de 1981.\n\nFoi casado com Arlete Tardin Giuberti, com quem teve três filhos.\n\n \n\n \n\nFONTES: Jornal do Brasil (17 e 18/2/81); NOVAIS, M. História; OLIVEIRA,\nJ. História; SENADO. Dados; SENADO. Relação; SENADO. Relação dos\nlíderes; TRIB. SUP. ELEIT. Dados (4 e 6).\n\n \n","ref":"FONTES: Jornal do Brasil (17 e 18/2/81); NOVAIS, M. História; OLIVEIRA,\nJ. História; SENADO. Dados; SENADO. Relação; SENADO. Relação dos\nlíderes; TRIB. SUP. ELEIT. Dados (4 e 6).\n\n \n","dic":"DHBB"}
