{"title":"GOBBI, Humberto","cargoss":["Deputado federal","Deputado federal","Deputado federal","Deputado federal"],"cargos_esp":[0,0,0,0],"datas_ini":[1960,1956,1955,1952],"datas_fim":[1961,1959,0,0],"estados":["RS","RS","RS","RS"],"autor":[0],"content":"**GOBBI, Humberto**\n\n\\*dep.****fed. RS 1952, 1955, 1956-1959 e 1960-1961.\n\n \n\n*Humberto Gobbi*nasceu em Garibaldi (RS) no dia 24 de novembro de 1904,\nfilho de José Gobbi e de Veneranda Simonaggio.\n\nAdvogado, comerciante e industrial, iniciou sua carreira política\nelegendo-se no pleito de janeiro de 1947 deputado à Assembléia\nConstituinte do Rio Grande do Sul na legenda do Partido Trabalhista\nBrasileiro (PTB). Assumindo o mandato no mesmo ano, foi um dos 39\ndeputados que assinaram a Constituição do estado, promulgada em 8 de\njulho de 1947. Com a transformação da Constituinte em Assembléia\nordinária, permaneceu no exercício de seu mandato e, no pleito de\noutubro de 1950, elegeu-se suplente de deputado federal por seu estado,\nsempre na legenda do PTB. Deixando a Assembléia gaúcha em janeiro de\n1951, ocupou uma cadeira na Câmara dos Deputados no período de julho a\ndezembro de 1952.\n\nEm outubro de 1954, novamente candidato, alcançou a primeira suplência\nde deputado federal, ainda na legenda do PTB. Exerceu o mandato em\ndiversas ocasiões durante o ano de 1955 e a partir de janeiro de 1956.\nReeleito suplente em outubro de 1958, deixou a Câmara em janeiro de 1959\ne voltou a ocupar uma cadeira de abril a junho e novamente de julho a\nnovembro desse ano, e de maio de 1960 a janeiro de 1961. No pleito de\noutubro de 1962 obteve mais uma vez uma suplência de deputado federal na\nlegenda do PTB, não chegando contudo a assumir uma cadeira na Câmara dos\nDeputados.\n\nFoi presidente do Sindicato da Indústria de Trigo e do Sindicado da\nIndústria da Mandioca. Fundou e dirigiu as empresas José Gobbi e Filhos\ne Secularia Santo Antônio, ambas em Carazinho (RS), além da empresa\nCerealista, sediada na capital do estado.\n\nFaleceu em Porto Alegre no dia 27 de outubro de 1981.\n\nFoi casado com Sílvia Silvestre Gobbi, com quem teve quatro filhos.\n\n \n\n \n\nFONTES: CÂM. DEP. Deputados; CISNEIROS, A.****Parlamentares; Jornal do\nBrasil (1/12/76 e 28/10/81); SILVA, R. Notas; TRIB. SUP. ELEIT. Dados\n(1, 2, 3, 4 e 6).\n\n \n","ref":"FONTES: CÂM. DEP. Deputados; CISNEIROS, A.****Parlamentares; Jornal do\nBrasil (1/12/76 e 28/10/81); SILVA, R. Notas; TRIB. SUP. ELEIT. Dados\n(1, 2, 3, 4 e 6).\n\n \n","dic":"DHBB"}
