{"title":"GOMES, Carlos","cargoss":["Deputado federal"],"cargos_esp":[0],"datas_ini":[1959],"datas_fim":[1963],"estados":["AL"],"autor":[0],"content":"**GOMES, Carlos**\n\n\\*dep. fed. AL 1959-1963.\n\n \n\n*Carlos Gomes**de Barros* nasceu em Passo de Camaragibe (AL) no dia 25\nde julho de 1906, filho de Laurentino Gomes de Barros e de Amália Gomes\nde Barros. Seus irmãos, Mário Gomes de Barros e Antônio Gomes de Barros\nexerceram cargos políticos. O primeiro foi deputado federal entre 1946 a\n1955, o segundo deputado estadual. Seu sobrinho, Osvaldo Gomes de Barros\ntambém foi deputado estadual.\n\nCursou os colégios 15 de Março e 11 de Janeiro, concluindo os estudos\npreparatórios no Liceu Alagoano. Ingressou a seguir na Faculdade de\nDireito de Recife e, ainda acadêmico, apoiou a campanha da Aliança\nLiberal e a Revolução de 1930. Em 1931 trabalhou como adjunto de\npromotor público em São Miguel dos Campos (AL) e como delegado de\npolícia em Maceió, e no ano seguinte concluiu o curso universitário,\natuando ainda como voluntário na repressão à Revolução\nConstitucionalista de São Paulo.\n\nApós exercer a função de chefe de polícia do estado de Alagoas, foi\nnomeado em 1936 promotor público em São Luís do Quitunde (AL), cargo em\nque permaneceria até 1942. Contrário ao golpe que implantou o Estado\nNovo em novembro de 1937, colocou-se a partir de então na oposição ao\ngoverno de Getúlio Vargas. Com a desagregação desse regime em 1945 e a\nreorganização partidária, participou da fundação da União Democrática\nNacional (UDN), legenda na qual foi eleito deputado à Assembléia\nConstituinte de seu estado no pleito de janeiro de 1947. Ainda nesse ano\nassumiu o mandato, o qual exerceu, após a promulgação da nova Carta\nestadual, até janeiro de 1951. Reeleito para a Assembléia Legislativa\nalagoana nos pleitos de outubro de 1950 e de 1954, durante o exercício\ndesse último mandato foi ferido, em setembro de 1957, num conflito\nocorrido no recinto da Assembléia por ocasião do pedido de impeachment\ndo governador Sebastião Muniz Falcão.\n\nNo pleito de outubro de 1958 elegeu-se deputado federal por seu estado\nmais uma vez na legenda da UDN. Deixando a Assembléia estadual em\njaneiro de 1959, em fevereiro seguinte ocupou sua cadeira na Câmara,\npassando a integrar a Comissão de Constituição e Justiça. Durante o\ngoverno de Jânio Quadros (janeiro a agosto de 1961), manifestou-se\ncontra a intenção oficial de reatamento das relações diplomáticas com a\nUnião Soviética, rompidas desde 1947. Por outro lado, definiu-se também\ncontrariamente à proposta norte-americana de intervenção em Cuba. Após a\nrenúncia de Quadros em 25 de agosto de 1961, votou a favor da\nimplantação do parlamentarismo, solução conciliatória aprovada pelo\nCongresso para contornar a crise política resultante do veto dos\nministros militares à posse de João Goulart, vice-presidente e sucessor\nlegal do presidente demissionário. Favorável à Emenda Constitucional nº\n5, de novembro do mesmo ano, que ampliou a participação dos municípios\nna renda tributária nacional, no ano seguinte assumiu posição contrária\nà antecipação do plebiscito, que, previsto para princípios de 1965,\nacabaria sendo realizado em janeiro de 1963, decidindo por ampla maioria\nde votos o retorno do país ao presidencialismo.\n\nAinda nessa legislatura, conforme declarou ao *Correio\nBrasiliense,*apoiou a adoção da cédula única em todos os pleitos e a\nimplantação dos distritos eleitorais, defendeu a reforma agrária com\ndesapropriação dos latifúndios, desde que esta fosse acompanhada por\nindenização em dinheiro ou em títulos sujeitos à correção monetária, e\nfoi favorável à criação de um sistema cooperativista com base na\nassistência ao lavrador e à pequena propriedade. Declarou-se também\npartidário da fundação de um banco central emissor e de um banco rural\ncomo fórmula capaz de evitar a centralização do Banco do Brasil na\ndistribuição do crédito.\n\nEm outubro de 1962 tentou a reeleição, mas obteve apenas uma suplência.\nDeixando a Câmara em janeiro de 1963, voltou a exercer o mandato de\nabril a junho desse ano, quando deixou definitivamente a casa.\n\nEntre 1963 e 1967, foi membro do Conselho Nacional de Telecomunicações.\n\nFaleceu no dia 25 de outubro de 1973.\n\nEra casado com Laura Lima Gomes de Barros, com quem teve quatro filhos.\n\n \n\nFONTES: CÂM. DEP. *Deputados;*CÂM. DEP. *Deputados brasileiros.\nRepertório* (1946-1967); CÂM.**DEP. *Relação dos dep.;*CAMPOS, Q.\n*Fichário;*COUTINHO, A.*Brasil;*TRIB. SUP. ELEIT. *Dados*(4 e 6).\n\n \n\n \n","ref":"FONTES: CÂM. DEP. *Deputados;*CÂM. DEP. *Deputados brasileiros.\nRepertório* (1946-1967); CÂM.**DEP. *Relação dos dep.;*CAMPOS, Q.\n*Fichário;*COUTINHO, A.*Brasil;*TRIB. SUP. ELEIT. *Dados*(4 e 6).\n\n \n\n \n","dic":"DHBB"}
