{"title":"AMERICANO, Jorge","cargoss":["Revolucionário ou revoltoso","Constituinte","Reitor"],"cargos_esp":[0,0,"USP"],"datas_ini":[1932,1934,1941],"datas_fim":[1932,1934,1946],"estados":[0,0,0],"autor":[0],"content":"**AMERICANO, Jorge**\n\n\\*rev**.**1932; const. 1934; reitor USP 1941-1946.\n\n \n\n*Jorge Americano* nasceu na cidade de São Paulo no dia 25 de agosto de\n1891, filho de Luís Americano e de Amélia Cardoso Americano. Seu pai,\nque possuía originalmente o sobrenome Almeida, suprimiu-o depois,\nadotando para a família seu segundo nome.\n\nEstudou na Escola Modelo Caetano de Campos e no Ginásio de São Bento,\ningressando mais tarde na Faculdade de Direito de sua cidade natal, pela\nqual se bacharelou em 1912.\n\nEm 1915 tornou-se promotor público em Bebedouro (SP), aí permanecendo\naté 1918, quando se transferiu para Atibaia (SP), onde continuou a\nexercer a mesma função. No ano seguinte passou a lecionar na Escola de\nComércio Álvares Penteado, na capital paulista, e em 1921 transferiu-se\npara Santos (SP), onde exerceu a advocacia. Em 1927 foi nomeado\nlivre-docente da Faculdade de Direito de São Paulo, assumindo também\nnesse ano uma cadeira de deputado na Assembléia estadual, para a qual\nfoi eleito na legenda do Partido Republicano Paulista (PRP). No ano\nseguinte deixou a Assembléia e tornou-se procurador-geral da Justiça do\nDistrito Federal, cargo que exerceu até 1930. Em 1931 passou a lecionar\nno Ginásio São Bento e, em 1932, participou da Revolução\nConstitucionalista, em São Paulo, organizando o serviço de propaganda e\ndirigindo o curso para oficiais de emergência.\n\nNo pleito de maio de 1933 elegeu-se deputado por São Paulo à Assembléia\nNacional Constituinte, na legenda da Chapa Única por São Paulo Unido.\nAssumindo o mandato em novembro do mesmo ano, renunciou no mês seguinte\npor ser contrário a uma política de aproximação entre os governos\nfederal e estadual.\n\nEm 1934 conquistou por concurso a cátedra de direito civil da Faculdade\nde Direito de São Paulo, onde participou da Bucha, organização\nestudantil de caráter secreto que desde o século XIX exerceu forte\ninfluência na Faculdade de Direito de São Paulo, desempenhando\nimportante papel na política do estado.\n\nEm 1937 foi eleito presidente da seção de São Paulo do Instituto dos\nAdvogados do Brasil e no ano seguinte, já no Estado Novo, passou a\nconselheiro da seção paulista da Ordem dos Advogados. Ainda em 1938 foi\nfeito diretor da Faculdade de Direito de São Paulo, exercendo essa\nfunção até o ano seguinte. Tornou-se então membro do Conselho\nPenitenciário da capital paulista, nele permanecendo até 1941, quando\nvisitou os EUA a convite do governo norte-americano. Ainda nesse ano foi\nnomeado reitor da Universidade de São Paulo (USP), passando a integrar\ntambém o conselho da Fundação da Escola Livre de Sociologia e Política\nde São Paulo, do qual foi presidente e onde permaneceu até 1957. Na\ninterventoria de Fernando Costa (1941-1945) exerceu interinamente a\nfunção de secretário estadual da Educação e Saúde Pública.\n\nCom a declaração de guerra do Brasil aos países do Eixo em 1942, chefiou\no grupo de professores da USP responsável pela criação do Fundo\nUniversitário de Pesquisas, destinado a financiar, através de subscrição\npopular, a ciência e a tecnologia universitárias em favor da defesa\nnacional. Em setembro de 1946 deflagrou-se uma crise no ensino superior\npaulista, em decorrência da qual Jorge Americano, acompanhado de todo o\nconselho universitário, abandonou seu posto de reitor. Nesse mesmo ano\nocupou a presidência do Instituto Cultural Brasil-Itália, assumindo em\n1950 uma cadeira de professor na Escola Livre de Sociologia e de\nPolítica de São Paulo.\n\nFoi ainda escriturário do Tesouro do Estado de São Paulo,\noficial-de-gabinete do secretário da Fazenda, subprocurador fiscal\ninterino****da Fazenda, presidente da União Cultural Brasil- Estados\nUnidos, professor e diretor da Faculdade de Direito e membro do conselho\nsuperior da Universidade Mackenzie, e juiz da Corte Internacional de\nArbitragem de Haia. Presidente da Fundação Moinho Santista, foi também\ndiretor das Molas-no-Sag do Brasil e da Vidros Corning do Brasil, além\nde membro da diretoria da Vidraria Santa Marina e da Associação Paulista\nde Assistência aos Paraplégicos.\n\nFaleceu em São Paulo no dia 6 de janeiro de 1969.\n\nEra casado com Maria Rafaela de Paula Sousa Americano, com quem teve um\nfilho.\n\nEnsaísta, biógrafo e jurisconsulto, publicou as seguintes obras: *Da\nação rescisória dos* *julgados no direito brasileiro*(1922),*A lição*\n*dos fatos*(1924),*Do ato ilícito nos acidentes* *de\ntrabalho*(1925),*Processo civil e comercial* *no direito\nbrasileiro*(1925),*Dos direitos que* *se exteriorizam pela\nposse*(1926),*Aplicação* *do direito*(1929),*Ensaios sobre o\nenriquecimento sem causa*(1930), *Do abuso do direito* *no exercício de\ndemanda*(1930),*Comentários ao Código de Processo Civil e Comercial* *do\nestado de São Paulo*(1934), *Coletâneas de* *jurisprudência: pareceres,\nrazões e outros trabalhos jurídicos para cursos de direito civil*\n(1935),*Estudo teórico e prático da ação rescisória do direito\nbrasileiro*(1936),*Comentários ao Código de Processo Civil do Brasil*\n(4v., 1936), *O novo fundamento do direito* *internacional*(1947),*São\nPaulo naquele tempo:1895-1915*(memórias, 1957), *São Paulo* *nesse\ntempo: 1915-1935*(memórias, 1962), *São Paulo atual —\n1935-1962*(memórias, 1963), *Da ação pauliana, A Universidade de São*\n*Paulo*e*O conselheiro Ribas*(dados biográficos).\n\n \n\n \n\nFONTES: ARAÚJO, A. *Chefes;*ARQ. GETÚLIO VARGAS; CÂM. DEP.\n*Deputados;*CONSULT. MAGALHÃES, B.; COUTINHO, A. *Brasil;*DEP. PESQ.\nESTADO DE SÃO PAULO;*Estado de S. Paulo*****(7/2/69);*Grande* *encic.\nDelta; Grande encic. portuguesa;*HIRSCHOWICZ, E. *Contemporâneos;*LEITE,\nA. *História;*MELO, L. *Dic.*;**MENESES, R. *Dic.;* MOREIRA,\nJ.*****Dic.; Personalidades;*SILVA*,* H. *1930;*SOC. BRAS. EXPANSÃO\nCOMERCIAL. *Quem.*\n\n \n","ref":"FONTES: ARAÚJO, A. *Chefes;*ARQ. GETÚLIO VARGAS; CÂM. DEP.\n*Deputados;*CONSULT. MAGALHÃES, B.; COUTINHO, A. *Brasil;*DEP. PESQ.\nESTADO DE SÃO PAULO;*Estado de S. Paulo*****(7/2/69);*Grande* *encic.\nDelta; Grande encic. portuguesa;*HIRSCHOWICZ, E. *Contemporâneos;*LEITE,\nA. *História;*MELO, L. *Dic.*;**MENESES, R. *Dic.;* MOREIRA,\nJ.*****Dic.; Personalidades;*SILVA*,* H. *1930;*SOC. BRAS. EXPANSÃO\nCOMERCIAL. *Quem.*\n\n \n","dic":"DHBB"}
