{"title":"GONÇALVES NETO, Bertolino Joaquim =================================","cargoss":["Chefe do Estado-Maior da Aeronáutica"],"cargos_esp":[0],"datas_ini":[1982],"datas_fim":[1985],"estados":[0],"autor":[0],"content":"GONÇALVES NETO, Bertolino Joaquim\n=================================\n\n\\* militar; comte. VI Comar****1977-1979; ch. EMaer 1982-1985.\n\n \n\n                *Bertolino Joaquim Gonçalves Neto* nasceu em Barra Mansa\n(RJ), no dia 2 de março de 1922, filho de Bertolino Joaquim Gonçalves\nJúnior e de Maria Calderaro Gonçalves.\n\n                Sentou praça em março de 1942 e saiu aspirante a oficial\nem agosto de 1944. Segundo-tenente em março de 1945 e primeiro-tenente\nem maio de 1946, foi promovido a capitão em outubro de 1950. Ascendeu a\nmajor em janeiro de 1956, a tenente-coronel em janeiro de 1959, e a\ncoronel em julho de 1966.\n\n          Brigadeiro-do-ar em julho de 1973, em 1977 tornou-se\ncomandante do VI Comando Aéreo Regional, sediado em Brasília, em\nsubstituição ao brigadeiro José Luís da Fonseca Peyon. Exerceu este\ncomando até 1979, senso sucedido pelo brigadeiro Saulo de Matos Macedo.\nNesse período, em março de 1978, foi promovido a\nmajor-brigadeiro-do-ar.  Nessa patente, assumiu, em janeiro de 1981, a\nchefia do Comando-Geral do Pessoal (CONGEP) da Força Aérea Brasileira\n(FAB), sediado no Rio de Janeiro. Dois meses depois, passou a\ntenente-brigadeiro-do-ar.\n\n           Em março de 1982, tornou-se chefe do Estado-Maior da\nAeronáutica, em substituição ao brigadeiro Rodolfo Becker Reifschneider.\nOcupou o cargo até março de 1985, por ocasião da passagem da presidência\nda República do general João Batista Figueiredo, último presidente do\nregime militar inaugurado em abril de 1974, para o civil José Sarney.\nNessa ocasião, o brigadeiro Bertolino foi para a reserva e  em maio\nseguinte, assumiu a presidência da Empresa Brasileira de Infra-Estrutura\nAeroportuária (Infraero). Permaneceu à frente da Infraero até fevereiro\nde 1987. Desde então, retirou-se para a vida privada, não exercendo\nnenhuma atividade profissional. Em junho de 2000, residia no Rio de\nJaneiro.\n\n           Ao longo de sua carreira militar, freqüentou os cursos de\nformação de oficiais aviadores, de aperfeiçoamento de oficiais da\nAeronáutica, de estado-maior, superior de comando, estado-maior\n(realizado no Colégio Interamericano de Defesa) e o de pilotagem\n(realizado nos EUA). Freqüentou também cursos de caráter operacionais,\ncomo o de tática anti-submarino e o de piloto de transporte. Ocupou\ndiversos cargos, entre os quais os de chefe do Serviço de Informações da\nAeronáutica, das seções de Operações, Planejamento e Organização do\nEMAER. Foi também subcomandante da base aérea de Fortaleza, vice-diretor\ndo Centro Técnico Aeroespacial (CTA), chefe do subdepartamento de\nOperações do Departamento de Aviação Civil e vice-chefe do Estado-Maior\nda Aeronáutica.     \n\n           Casou-se com Sild da  Silva Campos Gonçalves e teve dois\nfilhos.\n\n \n\nFONTES: CURRIC. BIOG.; *Estado de São Paulo* (9/1/81 e 1/4/81);*Globo*\n(1/4/82); INF. BIOG..\n","ref":"FONTES: CURRIC. BIOG.; *Estado de São Paulo* (9/1/81 e 1/4/81);*Globo*\n(1/4/82); INF. BIOG..\n","dic":"DHBB"}
