{"title":"GONÇALVES, Abdon","cargoss":["Deputado federal"],"cargos_esp":[0],"datas_ini":[1975],"datas_fim":[1979],"estados":["RJ"],"autor":[0],"content":"**GONÇALVES, Abdon**\n\n\\*dep. fed. RJ 1975-1979.\n\n \n\n*Abdon Gonçalves Nanhay*****nasceu em São João de Meriti (RJ) no dia 1º\nde agosto de 1928, filho de Mohamed Nanhay e de Lazarina Gonçalves\nNanhay.\n\nDiplomado pela Faculdade Fluminense de Medicina, em Niterói (RJ), no\npleito de novembro de 1974 foi eleito deputado federal pelo estado do\nRio de Janeiro na legenda do Movimento Democrático Brasileiro (MDB),\npartido de oposição ao regime militar instaurado no país em abril de\n1964. Assumindo o mandato em fevereiro de 1975, foi membro efetivo da\nComissão de Saúde e suplente da Comissão de Ciência e Tecnologia.\nDisputou a reeleição, sempre pelo MDB, em novembro de 1978, mas obteve\napenas uma suplência. Deixou a Câmara dos Deputados em janeiro de 1979,\nao final da legislatura.\n\nAbdon Gonçalves faleceu em São João de Meriti, no dia 10 de março de\n1983.\n\nEra casado com Carmita Filha Ferreira e não teve filhos.\n\n \n\nFONTES: CÂM. DEP. *Deputados*; CÂM. DEP. *Deputados brasileiros.\nRepertório*; INF. FAM.; NÉRI, S. *16*.\n\n \n","ref":"FONTES: CÂM. DEP. *Deputados*; CÂM. DEP. *Deputados brasileiros.\nRepertório*; INF. FAM.; NÉRI, S. *16*.\n\n \n","dic":"DHBB"}
