{"title":"GRACIANO, Paulo","cargoss":["Presidente do Instituto Brasileiro do Café"],"cargos_esp":[0],"datas_ini":[1986],"datas_fim":[1987],"estados":[0],"autor":[0],"content":"**GRACIANO, Paulo**\n\n\\*pres. IBC 1986-1987.\n\n \n\n*Paulo Sérgio Portugal Graciano* nasceu na cidade de São Paulo no dia 25\nde maio de 1937, filho de Clóvis Graciano, um dos pioneiros da pintura\nmoderna no Brasil, e de Maria Aparecida Portugal Graciano.\n\nEconomista formado pela Universidade Federal do Rio de Janeiro e\njornalista profissional desde 1962, começou a carreira como pesquisador\neconômico da Editora Banas, assumindo logo depois o cargo de redator\neconômico, função que exerceu também no jornal *Correio da Manhã* entre\n1964 e 1965 e na revista *Visão* em 1966. Neste mesmo ano, começou sua\nvinculação com o meio político como assessor do secretário da Fazenda de\nSão Paulo, Antônio Delfim Neto, no governo Laudo Natel (1966-1967),\ncargo no qual permaneceu até 1967. Nesse mesmo ano, acompanhou Delfim\nNeto, alçado a titular do Ministério da Fazenda no governo do general\nArtur da Costa e Silva (1967-1969), de cuja pasta tornou-se subchefe de\ngabinete até 1971.\n\nEm 1974, Graciano voltou a atuar como redator econômico do *Correio da\nManhã*. De 1978 a 1979, foi diretor financeiro e comercial da Alumínio\nBrasileiro (Albrás), subsidiária da Companhia Vale do Rio Doce. Entre\n1979 e 1980, chefiou o gabinete da Secretaria da Agricultura e\nAbastecimento de São Paulo. Ingressando, ainda em 1980, no grupo\nMatarazzo como diretor-superintendente da Companhia de Café Solúvel e\nDerivado (Cocan), ocupou posteriormente a vice-presidência do grupo.\nEntre 1983 e 1984, presidiu a Associação Brasileira da Indústria de Café\nSolúvel.\n\nEm fevereiro de 1986, no governo de José Sarney (1985-1990), foi nomeado\npresidente do Instituto Brasileiro do Café (IBC), sucedendo a Carlos\nAlberto Leite Barbosa. Graciano comprometeu-se a valorizar os preços do\ncafé no mercado exportador, fortalecer as cotações ao produtor,\nrenegociar os contratos com torrefadores estrangeiros e evitar altas\nexcessivas de preço para o consumidor. Desde que assumiu, Graciano\nadotou previsões de safra pessimistas, reeditando estratégia que fora\nrealizada com sucesso por Delfim Neto. Em meados de 1986, durante a\nreunião da Organização Internacional do Café (OIC) em Londres, o próprio\nministro da Indústria e Comércio, José Hugo Castelo Branco, anunciou que\no Brasil estava adquirindo 1,5 milhão de sacas no mercado internacional\npara abastecimento interno, mas os preços continuaram em queda e as\nexportações reduziram-se.\n\nEm julho, em reunião com empresários envolvidos na produção e\ncomercialização de café, Graciano desmentiu a possibilidade de extinção\ndo IBC, admitindo, contudo, a possibilidade de o órgão ser substituído\npor outro organismo, de forma a garantir maior participação do setor\nprivado na formulação da política cafeeira.\n\nEm setembro, o mercado assustou-se com a notícia de que o IBC negociara\nna Bolsa de Londres uma importação de café, numa manobra que teria sido\nrealizada para propiciar lucro a poucas empresas. Um mês depois, houve a\nevidência da venda de cerca de seiscentas mil sacas de café com\ndescontos para a General Foods e a Taloca. A operação fora conduzida\ndiretamente por Graciano, que se encontrava na Europa. Diante do caso,\nos compradores do café brasileiro reagiram aos privilégios dados a\napenas dois importadores e exigiram descontos ainda maiores, negados\npelo IBC. Agravou a situação o fato de as cotações internacionais terem\ndespencado e os preços oferecidos pelo Brasil tornarem o produto\nproibitivo, o que paralisou os embarques.\n\nGraciano também foi responsável pela chamada “Operação Patrícia”,\ntransação efetuada em novembro em conjunto com o ministro José Hugo\nCastelo Branco, mediante a qual 17 empresas privadas e mais a Interbrás,\nsubsidiária da Petróleo Brasileiro S.A. (Petrobras), adquiriram na Bolsa\nde Londres cerca de seiscentas mil sacas de café no valor aproximado de\n150 milhões de dólares. A operação revelou-se um fiasco — o café ficou\nestocado e os preços acabaram despencando no mercado internacional meses\ndepois, contraindo o IBC uma dívida de aproximadamente 60 milhões de\ndólares.\n\nAs sucessivas operações malsucedidas comprometeram a permanência de\nGraciano à frente da presidência do IBC, levando-o a colocar o cargo à\ndisposição, em novembro. Ademais, eram conturbadas suas relações com os\nprodutores, que reivindicavam a troca de comando no órgão em razão da\nqueda dos preços do café no Brasil e no exterior e da diminuição pela\nmetade das exportações. Sua última iniciativa — a importação de\naproximadamente seiscentas mil sacas de café africano para tentar\nreverter o quadro de queda de preços no exterior — foi insuficiente para\nreverter o descrédito de cafeicultores e exportadores.\n\nEm janeiro de 1987, os exportadores de café de Santos solicitaram ao\npresidente Sarney que nomeasse um presidente “mais competente” para o\nIBC, responsabilizando Graciano pelas dificuldades que o setor\natravessava. Acreditavam que o IBC errara ao apostar na falta do produto\nno mercado internacional, o que alijou o Brasil da competição\ninternacional, alegando, por fim, que as empresas estavam\ndescapitalizadas e com dificuldades para obtenção de crédito. No mesmo\nperíodo, o diretor de exportação do IBC, Joaquim Libânio Ferreira Leite,\ndisse que a diretoria do órgão estaria disposta a entregar os cargos.\nGraciano afirmou desconhecer a demissão coletiva e acrescentou que não\nacompanharia a decisão. Dias depois, Graciano recuou e ressalvou que a\ncolocação dos cargos à disposição do ministro José Hugo Castelo Branco\nseria fundamental para que o CNPC pudesse traçar linhas mais duradouras\npara o setor. No final de janeiro, Graciano foi finalmente afastado da\npresidência do IBC e substituído em seguida por Jório Dauster.\n\nApós deixar o IBC, Graciano não voltou a ocupar cargos públicos,\ndedicando-se a serviços de consultoria na área econômica.\n\nGraciano também dirigiu a Companhia Cacique, empresa produtora de café\nsolúvel.\n\nCasou-se com Maria de Lurdes Graciano, com quem teve três filhos.\n\n \n\nDaniela Duarte/Rogério Barros\n\n \n\n \n\nFONTES: *Estado de S. Paulo* (9 e 13/1/87); *Folha de S. Paulo*\n(30/1/87); *Globo* (15/2/86, 7 e 30/1/87); *Jornal do Brasil* (16 e\n19/2, 11/7 e 21/11/86); *Veja* (19/2/86).\n\n \n","ref":"FONTES: *Estado de S. Paulo* (9 e 13/1/87); *Folha de S. Paulo*\n(30/1/87); *Globo* (15/2/86, 7 e 30/1/87); *Jornal do Brasil* (16 e\n19/2, 11/7 e 21/11/86); *Veja* (19/2/86).\n\n \n","dic":"DHBB"}
