{"title":"GRILO, Lincoln  ===============","cargoss":["Deputado federal"],"cargos_esp":[0],"datas_ini":[1975],"datas_fim":[1979],"estados":["SP"],"autor":[0],"content":"GRILO, Lincoln \n===============\n\n\\* dep. fed. SP 1975-1979.\n\n \n\n*Lincoln dos Santos Grilo*nasceu em Uberlândia (MG) no dia 3 de maio de\n1926, filho de João Ribeiro Grilo e de Maria dos Santos Grilo.\n\nEm 1949 trabalhou em bancos da capital paulista, militando no \nmovimento  sindical da categoria e chegando à presidência  da Federação\ndos Bancários, em 1951. Bacharel em ciências  jurídicas e sociais pela\nfaculdade de direito da Universidade de São Paulo, em 1962, fez os\ncursos de especialização em direito penal, criminologia e legislação\nsocial.\n\nIniciou carreira política em 1963, elegendo-se vereador em Santo André\nna legenda do Partido Socialista Brasileiro (PSB). Poucos meses depois,\no advento do movimento civil-militar que depôs o presidente João Goulart\n(1961-1964), foi cassado sob acusação de subversão, sem contudo perder\nos direitos políticos.\n\nNo pleito de novembro de 1966 elegeu-se deputado estadual de São Paulo\npela legenda do Movimento Democrático Brasileiro (MDB), partido de\noposição criado após a extinção dos partidos políticos pelo Ato\nInstitucional n°.2 (27/10/65). Tentando a reeleição, em novembro de\n1970, obteve a segunda suplência.\n\nEm novembro de 1974, sempre pelo MDB, elegeu-se deputado federal por São\nPaulo, integrando como titular a Comissão de Segurança Nacional e na\ncondição de suplente a de Educação e Cultura.\n\nNas eleições de novembro de 1976 conquistou a prefeitura de Santo André.\nCom o fim do bipartidarismo, em novembro de 1979, e a conseqüente\nreformulação partidária, filiou-se ao Partido do Movimento Democrático\nBrasileiro (PMDB), sucessor do MDB. Seu mandato foi prorrogado pelo\nCongresso Nacional, em setembro de 1980, a fim de que se estabelecesse a\nsimultaneidade das eleições. À frente do Executivo municipal, presidiu o\nConselho de Desenvolvimento da Grande São Paulo, entidade que reunia 37\nmunicípios da região.\n\nEm novembro de 1986 tentou sem êxito retornar à Câmara dos Deputados. Da\nmesma forma, no pleito de novembro de 1988 foi derrotado ao pretender\nreconquistar a prefeitura de Santo André – perdeu para o candidato do\nPartido dos Trabalhadores (PT), Celso Daniel – e passou a se dedicar à\nadvocacia.\n\nEm 1998 voltou ao Partido Socialista Brasileiro (PSB).\n\nCasou-se com Maria do Carmo Peduto Grilo, com quem teve quatro filhos.\n\n \n\nFONTES: CÂM. DEP. *Deputados*;**CÂM. DEP. *Deputados brasileiros.\nRepertório*(1975-1979); INF. BIOG.; *Jornal* *do Brasil*(5/7/65); NÉRI,\nS. *16*.\n","ref":"FONTES: CÂM. DEP. *Deputados*;**CÂM. DEP. *Deputados brasileiros.\nRepertório*(1975-1979); INF. BIOG.; *Jornal* *do Brasil*(5/7/65); NÉRI,\nS. *16*.\n","dic":"DHBB"}
