{"title":"GROSS, Darci","cargoss":["Constituinte","Deputado federal"],"cargos_esp":[0,0],"datas_ini":[1946,1946],"datas_fim":[1946,1951],"estados":[0,"RS"],"autor":[0],"content":"**GROSS, Darci**\n\n\\*const. 1946; dep. fed. RS 1946-1951.\n\n*Darci Gross* nasceu em Veranópolis (RS) no dia 30 de junho de 1906,\nfilho de Carlos Augusto Gross e de Núncia Vieira Gross.\n\nEm 2 de dezembro de 1945, candidatou-se à Assembléia Nacional\nConstituinte (ANC) na legenda do Partido Social Democrático (PSD) do Rio\nGrande do Sul, porém só obteve uma suplência. Assumiu a cadeira em 5 de\nfevereiro de 1946. Promulgada a Constituição e transformada a Assembléia\nem Congresso ordinário, assumiu a vice-presidência da Comissão de Viação\ne Obras Públicas da Câmara, função que exerceu entre 1948 e 1950. No\npleito de outubro desse último ano, candidatou-se à reeleição pelo PSD,\nmas novamente só obteve uma suplência. Cumpriu seu mandato até o final\nda legislatura em 31 de janeiro de 1951, quando deixou a Câmara.\n\nFONTES: CÂM. DEP. *Deputados;*CÂM. DEP. *Deputados brasileiros.\nRepertório* (1946-1967); *Diário* *do Congresso Nacional;*TRIB. SUP.\nELEIT. *Dados* (1).\n\n \n","ref":"FONTES: CÂM. DEP. *Deputados;*CÂM. DEP. *Deputados brasileiros.\nRepertório* (1946-1967); *Diário* *do Congresso Nacional;*TRIB. SUP.\nELEIT. *Dados* (1).\n\n \n","dic":"DHBB"}
