{"title":"GUABIROBA, Vicente","cargoss":["Deputado federal"],"cargos_esp":[0],"datas_ini":[1979],"datas_fim":[1987],"estados":["MG"],"autor":[0],"content":"**GUABIROBA, Vicente**\n\n\\*dep. fed. MG 1979-1987.\n\n* *\n\n*Vicente Fernandes Guabiroba* nasceu em Itamarandiba (MG) no dia 15 de\nabril de 1922, filho do funcionário público Marcos Fernandes Guabiroba e\nde Ubaldina Campos Guabiroba.\n\nRealizou os estudos secundários em Diamantina (MG) e, posteriormente,\ningressou como funcionário no Banco da Lavoura de Minas Gerais S.A. Em\n1945, tornou-se professor do Ginásio Estadual Dr. Odilon Behrens, em\nGuanhães (MG), do qual também foi diretor e onde trabalharia por 21\nanos.\n\nIniciou sua carreira política em outubro de 1962, ao eleger-se prefeito\nde Guanhães pelo Partido Social Democrático (PSD), sendo empossado no\ncargo em janeiro do ano seguinte. Em 1966, assumiu a função de diretor\nda Companhia Agrícola de Minas Gerais (Camig), e, no final do mesmo ano,\nencerrou sua passagem pela prefeitura de Guanhães. Deixou a Camig em\n1968, passando a presidir a Companhia de Desenvolvimento do Vale do\nJequitinhonha (Codevale), atribuição que exerceu por dois anos.\n\nEm novembro de 1970, foi eleito deputado à Assembléia Legislativa do\nEstado de Minas Gerais pela Aliança Renovadora Nacional (Arena), partido\nde apoio ao regime militar instaurado no país em abril de 1964.\nEmpossado em fevereiro do ano seguinte, foi vice-presidente das\ncomissões do Polígono das Secas (1971), de Assuntos da Superintendência\ndo Desenvolvimento do Nordeste (Sudene) e de Estímulos Fiscais (1972),\nalém de ter participado como membro efetivo das comissões de Serviço\nPúblico (1972) e de Finanças e Orçamento (1973). Reeleito em novembro de\n1974, assumiu a presidência da Comissão de Finanças e Orçamento da Casa.\n\nEm 1977, bacharelou-se em direito pela Faculdade de Direito do Oeste de\nMinas em Divinópolis (MG) e, em novembro do ano seguinte, concorreu com\nêxito a uma vaga de deputado federal pela legenda da Arena mineira.\nEmpossado em fevereiro de 1979, com a extinção do bipartidarismo em 29\nde novembro seguinte e a conseqüente reformulação partidária, filiou-se\nao Partido Democrático Social (PDS), partido governista que deu\ncontinuidade à extinta Arena.\n\nDurante este mandato, foi membro (1979-1982) e vice-presidente da\nComissão de Finanças, suplente da Comissão de Segurança Nacional\n(1979-1982) e vice-presidente (1980-1981) da Comissão Parlamentar de\nInquérito (CPI) destinada a investigar a situação do Patrimônio\nHistórico e Artístico Nacional e a avaliar a política do Governo Federal\npara sua defesa e conservação. No ano de 1981, integrou a representação\nbrasileira à União Interparlamentar, reunida em Havana, Cuba. No pleito\nde novembro de 1982, reelegeu-se à Câmara dos Deputados pelo PDS.\nAssumindo sua cadeira em fevereiro do ano seguinte, integrou-se\nnovamente aos trabalhos da Comissão de Finanças.\n\nNa sessão da Câmara dos Deputados de 25 de abril de 1984, votou a favor\nda emenda Dante de Oliveira, que restabelecia as eleições diretas para\npresidente da República, marcando-as para novembro seguinte. Constatada\na insuficiência de votos para que a emenda fosse submetida à apreciação\ndo Senado, convocou-se, em 15 de janeiro de 1985, o Colégio Eleitoral.\nVicente Guabiroba votou em Tancredo Neves para presidente e José Sarney\npara vice, ambos eleitos pela Aliança Democrática, coligação do Partido\ndo Movimento Democrático Brasileiro (PMDB) com a dissidência do PDS\nreunida na Frente Liberal. Acometido por uma grave enfermidade, que o\nvitimou em 21 de abril de 1985, Tancredo Neves não chegou a ser\nempossado na presidência da República. Substituiu-o no cargo o vice, que\njá vinha exercendo em caráter interino a chefia do Executivo desde 15 de\nmarço.\n\nCandidato a uma cadeira de deputado federal constituinte pela legenda\npedessista no pleito de novembro de 1986, Vicente Guabiroba não obteve\nvotação suficiente para garantir-lhe o assento, deixando a Câmara\nFederal em janeiro de 1987, ao final da legislatura. Não mais\ncandidatando-se a cargos eletivos, Vicente Guabiroba chefiou no leste de\nMinas, no segundo semestre de 1998, a campanha à reeleição do governador\nmineiro Eduardo Azeredo (1995-1998), que, credenciado a disputar o\nsegundo turno, não obteve votação suficiente para vencer Itamar Franco,\ncandidato do PMDB.\n\nAlém da carreira política, tornou-se fazendeiro e comerciante em\nGuanhães e Governador Valadares (MG).\n\nCasou-se com Ondina Coelho Guabiroba, com quem teve cinco filhos.\n\n \n\nFONTES:****ASSEMB. LEGISL. MG. *Dicionário biográfico*;****CÂM.\nDEP.*Deputados brasileiros. Repertório* (1983-1987); *Globo* (26/4/84 e\n16/1/85); INF. Vicente Fernandes Guabiroba Júnior.\n","ref":"FONTES:****ASSEMB. LEGISL. MG. *Dicionário biográfico*;****CÂM.\nDEP.*Deputados brasileiros. Repertório* (1983-1987); *Globo* (26/4/84 e\n16/1/85); INF. Vicente Fernandes Guabiroba Júnior.\n","dic":"DHBB"}
