{"title":"GUANAIS, Oliveiros","cargoss":["Presidente da União Nacional dos Estudantes"],"cargos_esp":[0],"datas_ini":[1960],"datas_fim":[1961],"estados":[0],"autor":["Anestesiologia."],"content":"**GUANAIS, Oliveiros**\n\n\\*pres. UNE 1960-1961.\n\n*Oliveiros Guanais de Aguiar* nasceu em Caetité (BA) no dia 19 de agosto\nde 1936, filho de Galdino Borges de Aguiar, proprietário agrícola, e de\nEtelvina Guanais de Aguiar.\n\nCursou o primário em sua cidade natal e os preparatórios em Salvador,\ncomo aluno interno do Colégio Jesuíta Antônio Vieira. Aprovado em\nprimeiro lugar no vestibular para a Faculdade de Medicina da\nUniversidade da Bahia, desde o começo de seu curso universitário\nparticipou ativamente da política estudantil. Quando estava no quarto\nano, foi eleito presidente da União dos Estudantes da Bahia (UEB).\n\nDurante sua gestão, a UEB promoveu campanha em defesa da\nSuperintendência do Desenvolvimento do Nordeste (Sudene), autarquia\nfederal criada em dezembro de 1959 e que vinha sofrendo pressões dos\nlatifundiários nordestinos, editou uma seção intitulada “Unidade” no\njornal *A Tarde,*de Salvador, e organizou o I Seminário Estudantil sobre\nProblemas Econômicos do Nordeste. Sob o patrocínio da União Nacional dos\nEstudantes (UNE), realizou o I Seminário Latino-Americano sobre Reforma\ne Democratização do Ensino, encontro que reuniu em Salvador\nrepresentantes de 13 países da América Latina e do qual surgiram as\nbases políticas para o lançamento do Movimento de Reforma Universitária.\n\nO período em que Guanais permaneceu à frente da UEB foi também\ncaracterizado pela eclosão de vários conflitos na Universidade da Bahia,\nque culminaram numa greve geral que duraria 120 dias. No decorrer da\nparalisação, realizou-se em Belo Horizonte, em julho de 1960, o XXIII\nCongresso da UNE, quando Guanais foi eleito presidente da entidade.\nAssumiu o cargo no mês seguinte, no Rio de Janeiro — então Distrito\nFederal — antes do término do seu mandato na UEB, sucedendo a João\nManuel Conrado.\n\nLogo no início do seu mandato de presidente da UNE, ainda em agosto de\n1960, a greve deflagrada na Bahia e em outros estados resultou numa\ngreve nacional que, embora sem alcançar seus objetivos, obteve grande\nrepercussão no país. Sob a liderança da UNE, os estudantes\nuniversitários participaram de inúmeros movimentos, inclusive do\nprotesto contra a participação de Pedro Calmon, reitor da Universidade\ndo Brasil, atual Universidade Federal do Rio de Janeiro (UFRJ), na\ncomitiva do presidente da República, Juscelino Kubitschek, em sua visita\na Portugal, então sob a ditadura salazarista, em agosto de 1960.\n\nA gestão de Guanais foi marcada pela luta pela reforma universitária,\nembora a campanha eleitoral para a presidência da República tenha\npolarizado o debate político no país e atraído as atenções dos\nestudantes. Nas eleições presidenciais de outubro de 1960, o vencedor\nfoi Jânio Quadros, que derrotou por expressiva margem o marechal\nHenrique Lott, apoiado pela UNE, pela maior parte das organizações\nsindicais e pelo Partido Comunista Brasileiro (PCB), então Partido\nComunista do Brasil.\n\nDurante a presidência de Guanais, foi criado no ano de 1961 um grupo\ndenominado UNE Volante, cujo objetivo era percorrer os estados para\npromover um movimento nacional de cultura popular e, ao mesmo tempo,\ndiscutir os problemas ligados à unidade da organização estudantil. Ainda\nem 1961, a UNE realizou em Recife o I Seminário de Estudos do Nordeste\ne, em Salvador, o I Seminário Nacional de Reforma Universitária, no qual\nfoi elaborada a *Declaração da Bahia,* documento que propunha mudanças\nradicais para a universidade brasileira. Naquele ano, conflitos entre\nalunos e a direção da Faculdade de Direito de Pernambuco levaram Guanais\na Recife para participar das negociações entre as partes. O movimento\nfoi encerrado após a intervenção direta do governo do presidente Jânio\nQuadros, que enviou para a capital pernambucana aviões a jato para\nintimidar os manifestantes e tanques para reprimir passeatas.\n\nEm julho de 1961, ao terminar seu mandato, Guanais passou a presidência\nda UNE a Aldo Arantes. De volta à Bahia, concluiu o curso de medicina,\nespecializando-se em anestesiologia. Desenvolveu intensa atuação nos\nórgãos de representação de sua especialidade, sobretudo na Sociedade\nBrasileira de Anestesiologia, de cuja seção regional do estado da Bahia\nfoi presidente em 1968 e 1969, diretor científico de 1976 a 1977 e\npresidente da comissão de estatutos, regulamentos e regimentos, de 1979\na 1980. Tornou-se membro do conselho editorial da *Revista Brasileira de\nAnestesiologia.*\n\nFONTES: CURRIC. BIOG.; POERNER, A. *Poder.*\n\n \n","ref":"FONTES: CURRIC. BIOG.; POERNER, A. *Poder.*\n\n \n","dic":"DHBB"}
