{"title":"GUAZELLI, Eloar","cargoss":["Deputado federal"],"cargos_esp":[0],"datas_ini":[1979],"datas_fim":[1983],"estados":["RS"],"autor":[0],"content":"**GUAZELLI, Eloar**\n\n\\*dep. fed. RS 1979-1983.\n\n \n\n*Eloar Guazzelli* nasceu em Vacaria (RS) no dia 12 de agosto de 1922,\nfilho de Francisco Guazzelli e de Virgulina Branco Guazzelli. Seu primo\nSinval Guazzelli foi governador do Rio Grande do Sul de 1975 a 1979 e de\n1990 a 1991; deputado federal de 1971 a 1975 e de 1983 a 1985; e\nministro da Agricultura de 1994 a 1995.\n\nAinda jovem, Eloar iniciou-se na política como militante do Partido\nComunista Brasileiro, então Partido Comunista do Brasil (PCB), legenda\ncriada em 1922 e que esteve na clandestinidade durante o período do\nEstado Novo (1937-1945). Nos últimos meses da era Vargas, com a\nlegalização do PCB, Eloar, ainda estudante de direito, passou a atuar\ncomo advogado do partido até 1947, quando a agremiação novamente entrou\nna ilegalidade.\n\nEm 1948,****bacharelou-se em ciências jurídicas e sociais pela\nUniversidade Federal do Rio Grande do Sul (UFRGS). Recém-formado, passou\na advogar na capital gaúcha, onde permaneceu até 1955, quando retornou à\nsua terra natal. Em Vacaria, exerceu a profissão até 1962, ano em que\nregressou a Porto Alegre.\n\nAo longo do regime militar (1964-1985) — instaurado no país em abril de\n1964 —, notabilizou-se por ter sido o advogado que mais defendeu presos\npolíticos no Rio Grande do Sul. Sua atuação rendeu-lhe popularidade e,\nno pleito de novembro de 1978 Guazzelli foi eleito deputado federal na\nlegenda do Movimento Democrático Brasileiro (MDB), partido de oposição\nao regime militar vigente no país. Empossado em fevereiro de 1979,\nparticipou dos trabalhos legislativos como membro titular da Comissão de\nSegurança Nacional e como suplente das comissões de Constituição e\nJustiça e de Trabalho e Legislação Social da Câmara.\n\nCom a extinção do bipartidarismo em novembro desse ano e a conseqüente\nreorganização partidária, filiou-se ao Partido do Movimento Democrático\nBrasileiro (PMDB), sucessor do extinto MDB. Disputou um novo mandato\nfederal em novembro de 1982, mas não foi bem-sucedido. Com isso, deixou\na Câmara dos Deputados em janeiro do ano seguinte, ao fim da\nlegislatura, não mais concorrendo a cargos eletivos.\n\nDe volta a Porto Alegre, em 1989 deixou o PMDB, desligando-se\ndefinitivamente da vida partidária. Permaneceu no exercício da advocacia\naté o fim da vida.\n\nFaleceu em Porto Alegre no dia 6 de julho de 1994.\n\nEra casado com Lisabel Barcelos Guazzelli, com quem teve quatro filhos.\n\n \n\nFONTES: CÂM. DEP. *Deputados brasileiros. Repertório* (1979-1983); INF.\nFAM. CARLOS FREDERICO GUAZZELLI.\n\n \n","ref":"FONTES: CÂM. DEP. *Deputados brasileiros. Repertório* (1979-1983); INF.\nFAM. CARLOS FREDERICO GUAZZELLI.\n\n \n","dic":"DHBB"}
