{"title":"GUEDES, Jaime Fernandes","cargoss":["Presidente de associação ou confederação de empregados ou empregadores"],"cargos_esp":["DNC"],"datas_ini":[1938],"datas_fim":[1944],"estados":[0],"autor":[0],"content":"**GUEDES, Jaime Fernandes**\n\n\\*pres. DNC 1938-1944.\n\n \n\n*Jaime Fernandes Guedes* nasceu em São Luís de Cáceres, atual município\nde Cáceres (MT), no dia 7 de setembro de 1899.\n\nFuncionário do Banco do Brasil, foi designado em outubro de 1935 chefe\nde inspeção dos serviços do Departamento Nacional do Café (DNC), mais\ntarde Instituto Brasileiro do Café (IBC). Foi também encarregado de\npresidir a comissão de inquérito administrativo na agência de Santos,\ncom poderes para dirigir seu serviço.\n\nCom o advento do Estado Novo em novembro de 1937, ocupou interinamente a\npresidência do DNC — em substituição a Luís Piza Sobrinho —, cargo em\nque veio a ser efetivado no ano seguinte. Dedicou-se inicialmente à\nreforma do departamento, bem como ao saneamento de suas dívidas.\nDesvinculado dos cafeicultores paulistas, seguiu a política definida\npela Conferência do Café, realizada em Havana em agosto de 1937 — a\nchamada política agressiva do café —, tomando medidas para vender a\nmaior quantidade possível do produto. Em 1939, um grupo de agricultores\n— a Comissão de Lavradores — enviou um memorial ao presidente Getúlio\nVargas manifestando seu desacordo com a política de baixa de preços e de\nquota de sacrifício instituída em 1932. Essa quota consistia na\narrecadação, pelo governo, de uma percentagem sobre o café exportado,\nque poderia ser armazenado ou queimado. Contudo, em maio desse mesmo ano\num relatório do DNC reafirmaria a política definida pelo governo.\n\nCom a eclosão da Segunda Guerra Mundial ainda em 1939 e a conseqüente\nqueda vertiginosa dos preços do café, a política cafeeira, seguida até\nentão com relativo sucesso, passou a sofrer uma oposição crescente. Em\n1940, a situação do produto foi agravada pelas chuvas, e o governo\ndecidiu aumentar para 25% a quota de sacrifício, além de impor uma cota\nsuplementar de 30% aos cafeicultores de São Paulo, que logo reagiram à\nmedida. Dois anos depois, pressionado pelos produtores paulistas, o DNC\ndiminuiu a quota de sacrifício da safra 1942-1943, parcialmente\nestragada pela geada. Em 1943, atingidos por nova geada, e com a queda\nnos preços ocasionada pela assinatura dos acordos de Washington (1942),\nos cafeicultores conseguiram que Vargas extinguisse a quota de 15%\nestabelecida para a safra 1943-1944. Em dezembro de 1944 Jaime Fernandes\nGuedes foi exonerado da presidência do DNC, sendo substituído por Ovídio\nde Abreu. Nesse mesmo mês foi designado para presidir a comissão mista\nde aquisição da United Nations Relief and Rehabilitation Agency (UNRRA)\nno Brasil.\n\nFaleceu no dia 2 de novembro de 1974.\n\nFoi casado com Helena Gurgel Guedes, com quem teve cinco filhos.\n\n \n\n \n\nFONTES: CARONE, E. Estado; CONSULT. MAGALHÃES, B.; CURRIC. BIOG.; INST.\nBRAS. CAFÉ.\n\n \n","ref":"FONTES: CARONE, E. Estado; CONSULT. MAGALHÃES, B.; CURRIC. BIOG.; INST.\nBRAS. CAFÉ.\n\n \n","dic":"DHBB"}
