{"title":"GUEDES, Jorge","cargoss":["Prefeito","Deputado federal"],"cargos_esp":["São Paulo",0],"datas_ini":[1931,1935],"datas_fim":[1932,1937],"estados":[0,"SP"],"autor":[0],"content":"**GUEDES, Jorge**\n\n\\*pref. São Paulo 1931-1932; dep. fed. SP 1935-1937.\n\n \n\n*Henrique Jorge Guedes* nasceu em São José dos Campos (SP) no dia 17 de\ndezembro de 1887, filho de Joaquim Camilo Guedes e de Amélia Martins\nGuedes.\n\nEstudou no Ginásio Nogueira Gama e formou-se em engenharia pela Escola\nPolitécnica de São Paulo, da qual se tornou professor substituto em 1920\ne posteriormente professor catedrático e emérito, lecionando ao longo de\n37 anos. Nos anos seguintes, tornar-se-ia também sócio e diretor-técnico\nda Construtora Malta e Guedes, diretor-técnico da Companhia Pinhalense\nde Força e Luz e da Empresa Pinhal Telefônica, ambas em Pinhal (SP), e\nda Companhia Carbonífera Cambuí, no Paraná, e presidente da Comissão\nPaulista de Limites entre o estado de São Paulo e o estado do Rio de\nJaneiro.\n\nDe dezembro de 1931 a maio de 1932, no período conturbado que se seguiu\nem São Paulo à vitória da Revolução de 1930, foi prefeito da capital\npaulista. Sua gestão transcorreu durante a interventoria de Manuel\nRabelo, que se estendeu de novembro de 1931 a março de 1932, e a de\nPedro de Toledo, iniciada a seguir.\n\nCom a reconstitucionalização do país após a Revolução de 1932, elegeu-se\nem outubro de 1934 deputado federal por seu estado na legenda do Partido\nRepublicano Paulista (PRP). Exerceu o mandato de maio de 1935 até\nnovembro de 1937, quando o golpe do Estado Novo suprimiu todos os órgãos\nlegislativos do país.\n\nInteressado em geografia e topografia, doutorou-se ainda em ciências\nfísicas e matemáticas. Foi secretário, diretor, e, entre 1947 e 1949,\nvice-reitor da Escola Politécnica de São Paulo e reitor interino da\nuniversidade. Em 1948 tornou-se professor catedrático da Faculdade de\nArquitetura e Urbanismo. Foi um dos fundadores da Faculdade de\nEngenharia Industrial da Pontifícia Universidade Católica de São Paulo,\npresidiu o Instituto de Pesquisas Técnicas e foi membro do Conselho\nUniversitário. Em 1957 aposentou-se pela Escola Politécnica da USP.\n\nFaleceu em Pinhal no dia 11 de abril de 1973.\n\nEra casado com Águeda Leite Guedes, com quem teve cinco filhos.\n\n \n\nFONTES: ARAÚJO, A. *Chefes*; ARQ. GETÚLIO VARGAS; *Boletim Min. Trab*.\n(5/36); CÂM. DEP. *Deputados*; *Diário do Congresso Nacional*; *Encic.\nMirador*; INF. FAM. NETO BIOG.; SOC. BRAS. EXPANSÃO COMERCIAL. *Quem*.\n\n \n","ref":"FONTES: ARAÚJO, A. *Chefes*; ARQ. GETÚLIO VARGAS; *Boletim Min. Trab*.\n(5/36); CÂM. DEP. *Deputados*; *Diário do Congresso Nacional*; *Encic.\nMirador*; INF. FAM. NETO BIOG.; SOC. BRAS. EXPANSÃO COMERCIAL. *Quem*.\n\n \n","dic":"DHBB"}
