{"title":"GUEDES, Valdenor","cargoss":["Deputado federal"],"cargos_esp":[0],"datas_ini":[1991],"datas_fim":[1999],"estados":["AP"],"autor":["Marcelo Costa"],"content":"**GUEDES, Valdenor**\n\n\\*dep. fed. AP 1991-1999.\n\n*Valdenor Guedes Soares* nasceu em Macapá no dia 31 de janeiro de 1954,\nfilho de Pitágoras da Mota Soares e de Nelga Guedes Soares.\n\nEm 1977, iniciou o curso de química industrial da Universidade Federal\ndo Amapá/Núcleo de Educação em Macapá (Ufap/NEM), que seria concluído em\n1981. Em 1979, realizou um curso de fabricação e controle dos\nmedicamentos no Laboratório Químico do Exército, na cidade do Rio de\nJaneiro.\n\nNo pleito de novembro de 1986 candidatou-se a uma vaga na Câmara dos\nDeputados pelo Amapá, na legenda do Partido da Frente Liberal (PFL), mas\nnão obteve sucesso. Ainda neste ano, desligou-se do PFL e ingressou no\nPartido Democrático Trabalhista (PDT).\n\nNo pleito de outubro de 1988 concorreu a uma vaga na Câmara de\nVereadores de Macapá, não sendo bem-sucedido. Ainda neste ano, tornou-se\ndiretor-técnico da Companhia de Águas e Esgotos do Amapá (Caesa) e\ndesfiliou-se do PDT para retornar em seguida ao PFL. Em 1990, tornou-se\ncoordenador estadual do meio ambiente da Secretaria Especial de Meio\nAmbiente do Amapá (SEMA-AP) e deixou novamente o PFL, filiando-se ao\nPartido Trabalhista Brasileiro (PTB).\n\nNo pleito de outubro de 1990, foi eleito deputado federal pelo Amapá, na\nlegenda do PTB. Ao assumir o mandato em fevereiro do ano seguinte, saiu\ndo PTB e ingressou no Partido Trabalhista Renovador (PTR), participando\ndos trabalhos legislativos como membro titular das comissões de Ciência\ne Tecnologia, Comunicação e Informática e de Defesa Nacional, e como\nsuplente da Comissão de Minas e Energia.\n\nNa sessão da Câmara dos Deputados de 29 de setembro de 1992, votou a\nfavor do *impeachment* do presidente Fernando Collor de Melo, acusado de\ncrime de responsabilidade por ligações com um esquema de corrupção\nliderado pelo ex-tesoureiro de sua campanha presidencial Paulo César\nFarias. Afastado da presidência logo após a votação na Câmara, Collor\nrenunciou ao mandato em 29 de dezembro de 1992, pouco antes da conclusão\ndo processo pelo Senado Federal, sendo efetivado na presidência da\nRepública o vice Itamar Franco, que já vinha exercendo o cargo\ninterinamente desde 2 de outubro.\n\nNo ano seguinte, Valdenor Guedes deixou o PTR e filiou-se ao Partido\nProgressista (PP), exercendo o restante do mandato nesta agremiação.\nNesse período, foi vice-líder da bancada do PP na Câmara, membro titular\ndas comissões de Defesa Nacional, de Constituição e Justiça e de\nRedação, e suplente da Comissão Parlamentar de Inquérito (CPI) do\nsistema penitenciário brasileiro, da CPI sobre exploração e prostituição\ninfanto-juvenil e da Comissão de Trabalho, de Administração e Serviço\nPúblico. Em maio de 1993, foi agredido pela primeira-dama do Amapá,\nMaria Barcelos, por ter denunciado o desvio de verbas públicas na\nFundação Mariinha Barcelos, entidade de amparo a carentes.\n\nNas principais matérias constitucionais apresentadas na Câmara dos\nDeputados ao longo da legislatura 1991-1995, votou a favor da criação do\nImposto Provisório sobre Movimentação Financeira (IPMF), imposto de\n0,25% sobre transações bancárias criado como fonte complementar de\nrecursos para a saúde, da criação do Fundo Social de Emergência (FSE),\nque permitia ao governo retirar recursos de áreas como saúde e educação\npara ter maior liberdade de administração das verbas, e votou contra o\nfim do voto obrigatório.\n\nNo pleito de outubro de 1994, foi reeleito na legenda do PP, obtendo a\nmaioria dos votos provenientes de suas bases eleitorais na capital do\nestado e no município de Santana. Assumiu novo mandato em fevereiro\nseguinte e com a criação do Partido Progressista Brasileiro (PPB) em\nagosto de 1995, resultado da fusão do PP com o Partido Progressista\nRenovador (PPR), ingressou na nova legenda. Participou dos trabalhos\nlegislativos como membro titular da Comissão de Constituição e Justiça.\n\nNas votações das emendas constitucionais propostas pelo governo Fernando\nHenrique Cardoso em 1995, votou a favor da quebra do monopólio dos\ngovernos estaduais na distribuição de gás canalizado, da quebra do\nmonopólio das embarcações nacionais na navegação de cabotagem, da\nmudança no conceito de empresa nacional, da quebra do monopólio estatal\ndas telecomunicações e da quebra do monopólio da Petrobras na exploração\nde petróleo.\n\nEm 1996 fez parte, como membro titular, das comissões de Defesa Nacional\ne de Defesa do Consumidor, e foi vice-líder do bloco parlamentar formado\npelo PPB e pelo Partido Liberal (PL). Em dezembro deste ano, foi citado\nnuma lista de membros da comissão executiva nacional do PPB que deviam\ndinheiro ao Banco do Brasil. Contudo, nem todos os citados eram\ndevedores e ao lado do nome de Guedes aparecia uma ressalva com a\nmensagem de que não possuía negócio com o referido banco. Segundo\nlideranças do PPB, esta lista teria sido elaborada por membros do\ngoverno federal com o intuito de “chantagear os deputados contrários à\nemenda da reeleição para presidente da República, governadores e\nprefeitos”.\n\nNa votação em plenário da emenda da reeleição, faltou à votação em\nprimeiro turno, realizada em 26 de janeiro de 1997. No segundo turno\nacabou votando a favor da emenda, sendo um dos 47 parlamentares que\nmudaram sua posição em relação ao primeiro turno. Em novembro seguinte\npronunciou-se contrário à quebra da estabilidade do servidor público,\nitem da reforma administrativa. Durante 1997, foi membro titular das\ncomissões de Trabalho e Administração e da Amazônia e Desenvolvimento\nRegional.\n\nNo pleito de outubro de 1998, candidatou-se à reeleição, na legenda do\nPPB, não sendo bem-sucedido. Em novembro deste ano votou a favor do teto\nde mil e duzentos reais para aposentadorias no setor público e do\nestabelecimento de idade mínima e tempo de contribuição para o setor\nprivado, itens que definiram a reforma da previdência. Deixou a Câmara\nem janeiro de 1999, ao final da legislatura.\n\nNo pleito de 2002, concorreu novamente a uma vaga na Câmara dos\nDeputados na legenda do PPB, mas obteve apenas uma suplência. Valdenor\nGuedes fez outra tentativa nesse sentido, nas eleições de 2006, desta\nvez na legenda do Partido Social Cristão (PSC). Mais uma vez obteve uma\nsuplência.\n\nEm 2008, foi candidato a vereador por Macapá, na legenda do PSC, mas não\nobteve êxito.\n\nExerceu também a atividade de pastor evangélico da Igreja Assembléia de\nDeus.\n\nCasou-se com Roseni das Graças Silva Soares, com quem teve dois filhos.\n\nMarcelo Costa\n\nFONTES: CÂM. DEP. *Dep**utados brasileiros. Repertório*(1995-1999);\n*Folha de S. Paulo* (*Especial* 6/11/98); *Jornal do Brasil*\n(11/12/96);*Globo* (30/9/92, 29/1 e 26/2/97, 10/10/98); *Olho no\nCongresso/Folha de S. Paulo*(31/1/95 e 14/1/96), *Olho no voto/Folha de\nS. Paulo*(18/9/94 e**29/9/98); *Perfil parlamentar/IstoÉ;*TRIB. SUP.\nELEIT*. Resultado das eleições.*(Disponível em:\nhttp://www.tse.gov.br/internet/eleicoes; acessado em: 21/10/2009);\n*Veja* (19/5/93).\n\n \n","ref":"FONTES: CÂM. DEP. *Dep**utados brasileiros. Repertório*(1995-1999);\n*Folha de S. Paulo* (*Especial* 6/11/98); *Jornal do Brasil*\n(11/12/96);*Globo* (30/9/92, 29/1 e 26/2/97, 10/10/98); *Olho no\nCongresso/Folha de S. Paulo*(31/1/95 e 14/1/96), *Olho no voto/Folha de\nS. Paulo*(18/9/94 e**29/9/98); *Perfil parlamentar/IstoÉ;*TRIB. SUP.\nELEIT*. Resultado das eleições.*(Disponível em:\nhttp://www.tse.gov.br/internet/eleicoes; acessado em: 21/10/2009);\n*Veja* (19/5/93).\n\n \n","dic":"DHBB"}
