{"title":"GUERRA, Paulo (1)","cargoss":["Deputado federal","Senador"],"cargos_esp":[0,0],"datas_ini":[1979,1998],"datas_fim":[1987,1999],"estados":["AP","AP"],"autor":[0],"content":"**GUERRA, Paulo (1)**\n\n\\*dep. fed. AP 1979-1987; sen. AP 1998-1999.\n\n*Paulo Fernando Batista Guerra* nasceu em Macapá (AP), no dia 11 de\noutubro de 1946, filho de João de Campos Guerra e de Laurinda Batista\nGuerra.\n\nFormado em Letras pela Faculdade de Filosofia da Universidade Federal do\nPará em 1971, dois anos depois concluiu a pós-graduação em administração\nde sistemas educacionais na Fundação Getulio Vargas, no Rio de Janeiro.\n\nEm novembro de 1978 elegeu-se deputado federal pelo Amapá, na legenda da\nAliança Renovadora Nacional (Arena), partido de sustentação do regime\nmilitar instaurado no país desde abril de 1964. Com a extinção do\nbipartidarismo em novembro de 1979, filiou-se ao Partido Democrático\nSocial (PDS), sucessor da Arena. Vice-presidente da Comissão do Interior\ne suplente da Comissão de Segurança Nacional, rompeu com o então\ngovernador nomeado do território do Amapá, Aníbal Barcelos (1979-1985),\nao se opor ao projeto de transformação do território em estado, alegando\nque, dessa maneira, o Amapá perderia o auxílio financeiro do governo\nfederal, que garantia a manutenção da rede de primeiro e segundo graus e\no pagamento do funcionalismo público.\n\nNo pleito de novembro de 1982 foi reeleito, assumindo o mandato em\nfevereiro do ano seguinte. Titular da Comissão do Interior e suplente\ndas comissões de Defesa do Consumidor e de Relações Exteriores, em 1984\nelaborou um projeto de lei que propunha a dispensa da habilitação\ntécnico-profissional para o exercício da profissão de corretor de\nseguros.\n\nAusente da sessão em que a Câmara dos Deputados deixou de aprovar a\nemenda Dante de Oliveira, prevendo eleições diretas para presidente da\nRepública — faltaram 22 votos para que fosse levada à apreciação do\nSenado — no Colégio Eleitoral, reunido em 15 de janeiro de 1985, Paulo\nGuerra votou no candidato oficial do regime, Paulo Maluf, derrotado pelo\noposicionista Tancredo Neves, eleito pela Aliança Democrática, uma união\ndo PMDB com a dissidência do Partido Democrático Social (PDS) abrigada\nna Frente Liberal. Doente, Tancredo Neves não chegou a ser empossado,\nvindo a falecer em 21 de abril de 1985. Seu substituto foi o vice José\nSarney, que já vinha exercendo o cargo interinamente, desde 15 de março\ndeste ano.\n\nAinda em 1985, Paulo Guerra deixou o PDS e ingressou no Partido do\nMovimento Democrático Brasileiro (PMDB). Candidato à reeleição em\nnovembro de 1986, obteve a segunda suplência, retirando-se da Câmara ao\ntérmino da legislatura, em janeiro do ano seguinte.\n\nNo pleito de outubro de 1990 concorreu ao Senado como suplente do eleito\nJosé Sarney. Em outubro de 1998 candidatou-se à Assembléia Legislativa\ndo Estado do Amapá, não logrando êxito. Com o pedido de licença do\nsenador José Sarney, exerceu o mandato entre outubro de 1998 e janeiro\nde 1999.\n\nFoi ainda presidente do diretório regional do PDS do Amapá, professor da\nUfpa, secretário e assessor de planejamento da Secretaria de Educação e\nCultura e governador interino do território do Amapá em diversas\noportunidades.\n\nPublicou *Plano quadrienal de educação do Território Federal d**o Amapá*\n(1974-1977) e *Projetos sobre recursos humanos*e*Melhoria da rede física\npara o ensino de 1º e 2º graus do Território Federal do Amapá*\n(1974-1978).**\n\nCasou-se com Marieta Martins Guerra, com quem teve dois filhos.\n\nFONTES: CÂM. DEP. *Deputados brasilei**ros. Repertório*(1983-1987);\n*Estado de S. Paulo*(2/11/82);*Globo* (26/4/84 e 16/1/85); *Jornal do\nBrasil* (6/4/86); TRIB. SUP. ELEIT. *Relação* (1998).\n\n \n","ref":"FONTES: CÂM. DEP. *Deputados brasilei**ros. Repertório*(1983-1987);\n*Estado de S. Paulo*(2/11/82);*Globo* (26/4/84 e 16/1/85); *Jornal do\nBrasil* (6/4/86); TRIB. SUP. ELEIT. *Relação* (1998).\n\n \n","dic":"DHBB"}
