{"title":"GUERRA, Pio Genésio","cargoss":["Deputado federal"],"cargos_esp":[0],"datas_ini":[1955],"datas_fim":[1959],"estados":["PE"],"autor":[0],"content":"**GUERRA, Pio Genésio**\n\n\\*dep. fed. PE 1955-1959.\n\n \n\n*Pio Genésio Guerra* nasceu em Umbuzeiro (PB) em 11 de julho de 1907,\nfilho de Severino Guerra e de Joana Genésio Guerra.\n\nIndustrial e agricultor, formou-se em engenharia pela atual Universidade\nFederal de Pernambuco (Ufpe).\n\nIniciou sua carreira política como prefeito da cidade de Orogó (PE),\nsendo depois eleito deputado estadual em 1935, na legenda do Partido\nLiberal (PL). Após o fim do Estado Novo (1937-1945) e a redemocratização\ndo país, foi eleito deputado estadual constituinte no pleito de janeiro\nde 1947 na legenda da União Democrática Nacional (UDN). Assumindo sua\ncadeira no Legislativo estadual em março seguinte, após a promulgação da\nCarta estadual passou a exercer o seu mandato ordinário. No pleito de\noutubro de 1950 foi reeleito deputado estadual, sempre na legenda da\nUDN, iniciando novo período legislativo em fevereiro do ano seguinte.\n\nEm outubro de 1954 foi eleito deputado federal na legenda do Movimento\nPopular Autonomista, aliança do Partido Trabalhista Brasileiro com o\nPartido Social Trabalhista. Concluindo seu mandato na Assembléia\npernambucana de seu estado em janeiro de 1955, assumiu sua cadeira na\nCâmara dos Deputados em maio seguinte. No pleito de outubro de 1958\nvoltou a concorrer a uma cadeira na Assembléia Legislativa de\nPernambuco, mas não conseguiu se eleger. Permaneceu no Legislativo\nFederal até o fim de janeiro de 1959, quando se encerraram o seu mandato\ne a legislatura.\n\nFoi também presidente da Companhia de Armazenamento Geral do Estado de\nPernambuco (CAGEP).\n\nFaleceu em Recife no dia 3 de novembro de 1965.\n\nEra casado com Jaci Estelita Guerra. Dois de seus filhos atuaram na\npolítica. José Carlos Estelita Guerra foi deputado federal por\nPernambuco de 1963 a 1968. Severino Sérgio Estelita Guerra também foi\ndeputado federal por esse estado (1991-1997 e 1998-).\n\n \n\nFONTES: CÂM. DEP. *Deputados*; CÂM. DEP. *Deputados brasileiros.\nRepertório* (1946-1967); CÂM. DEP. *Relação dos dep*.; INF. FAM. JOSÉ\nCARLOS GUERRA; TRIB. SUP. ELEIT. *Dados* (3).\n\n \n","ref":"FONTES: CÂM. DEP. *Deputados*; CÂM. DEP. *Deputados brasileiros.\nRepertório* (1946-1967); CÂM. DEP. *Relação dos dep*.; INF. FAM. JOSÉ\nCARLOS GUERRA; TRIB. SUP. ELEIT. *Dados* (3).\n\n \n","dic":"DHBB"}
