{"title":"GUERRA, Valdir","cargoss":["Deputado federal"],"cargos_esp":[0],"datas_ini":[1991],"datas_fim":[1995],"estados":["MS"],"autor":[0],"content":"**GUERRA, Valdir**\n\n\\* dep. fed. MS 1991-1995.\n\n \n\n*Valdir Francisco Guerra* nasceu em Soledade (RS) no dia 16 de julho de\n1935, filho de Prosdócimo Guerra e de Adele Fumagalli Guerra. Seus\nirmãos Alceni Guerra e Ivânio Guerra também seguiram a carreira\npolítica: o primeiro foi deputado federal pelo Paraná de 1983 a 1990,\nministro da Saúde de 1990 a 1992 e prefeito de Pato Branco (PR) a partir\nde 1997; o segundo foi deputado federal pelo Paraná na legislatura\n1991-1995.\n\nValdir iniciou-se na política como vereador em Pato Branco na legenda\ndo  Partido Social Democrático (PSD), exercendo o mandato entre os anos\n1961 e 1965. Com a extinção dos partidos políticos pelo Ato\nInstitucional nº.2 (27/10/1965) e a posterior instauração do\nbipartidarismo, filiou-se à Aliança Renovadora Nacional (Arena), partido\nde sustentação ao regime militar instaurado no Brasil em abril de 1964.\n\nTransferindo-se para Mato Grosso do Sul em 1971, radicou-se em Dourados\n(MS). Com o fim do bipartidarismo em novembro de 1979 e a conseqüente\nreorganização partidária, deixou a Arena, não se filiando a nenhum outro\npartido até 1985, quando ingressou no Partido da Frente Liberal (PFL),\ncriado em janeiro daquele ano.\n\nBacharel em direito pela Sociedade Civil de Educação Grande Dourados em\n1986, no ano seguinte tornou-se presidente municipal do PFL. Ainda em\n1987 foi nomeado secretário de Indústria e Comércio do Mato Grosso do\nSul, durante o governo de Marcelo Miranda (1987-1991), permanecendo no\ncargo até 1990. Nesse ano deixou o PFL, junto com Flávio Derzi, em razão\nde uma desavença com o diretório regional do partido, que não concordara\nem apoiar o nome de Pedro Pedrossian para o governo do estado. Ingressou\nna legenda do Partido Social Trabalhista (PST).\n\nVice-presidente do PST, foi eleito deputado federal pelo Mato Grosso do\nSul em outubro de 1990, ocupando a cadeira na Câmara dos Deputados em\nfevereiro de 1991. Ainda  nesse ano participou da Comissão de Economia,\nIndústria e Comércio e foi suplente da Comissão de Finanças e\nTributação. Logo após a posse no mandato, deixou o PST e retornou ao\nPFL.        \n\nIntegrante da chamada “tropa de choque” que defendia o presidente\nFernando Collor de Melo no Congresso Nacional das acusações de\nenvolvimento em amplo esquema de corrupção no interior do governo,\ncomandado pelo ex-tesoureiro de sua campanha presidencial, Paulo César\nFarias (conhecido por PC Farias), Valdir Guerra foi acusado, em agosto\nde 1992, de ter recebido dinheiro de PC Farias para a sua campanha\neleitoral. Ainda assim, na sessão da Câmara dos Deputados de 29 de\nsetembro de 1992, votou a favor da abertura do processo de *impeachment*\nde Collor, acusado de crime de responsabilidade. Afastado da presidência\napós a votação na Câmara, Collor renunciou ao mandato em 29 de dezembro\nde 1992, horas antes da conclusão do processo pelo Senado Federal, que\ndecidiu pelo seu envolvimento. Foi então efetivado na presidência da\nRepública o vice Itamar Franco, que já vinha exercendo o cargo\ninterinamente desde 2 de outubro.\n\nNas principais matérias constitucionais apresentadas na Câmara dos\nDeputados ao longo da legislatura 1991-1995, votou a favor da criação do\nFundo Social de Emergência (FSE), que permitia ao governo retirar\nrecursos de áreas como saúde e educação para ter maior liberdade de\nadministração das verbas, e da criação do Imposto de 0,25%  sobre\ntransações bancárias, o Imposto Provisório sobre Movimentação Financeira\n(IPMF). O parlamentar votou contra o fim do voto obrigatório.\n\nDisputou a reeleição em outubro de 1994, desta vez na legenda do Partido\nda Frente Liberal (PFL), mas obteve apenas uma suplência. Deixou a\nCâmara dos Deputados em janeiro de 1995, ao final da legislatura.\n\nEm outubro de 1998 disputou a vice-governadoria de Mato Grosso do Sul na\nchapa encabeçada por Pedro Pedrossian, do Partido Trabalhista Brasileiro\n(PTB), que acabou não sendo eleito. Ainda nesse ano tornou-se membro do\ndiretório regional do PFL.\n\nFoi também piloto privado e contador.\n\n \n\nFONTES: CÂM. DEP. *Deputados brasileiros. Repertório*(1991-1995 e\n1995-1999); *Globo*(30/9/92);** INF. BIOG.; *Perfil Parlamentar/IstoÉ*;\nTRIB. SUP. ELEIT. *Relação* (1998); *Veja*(30/12/92 e 7/7/93).\n","ref":"FONTES: CÂM. DEP. *Deputados brasileiros. Repertório*(1991-1995 e\n1995-1999); *Globo*(30/9/92);** INF. BIOG.; *Perfil Parlamentar/IstoÉ*;\nTRIB. SUP. ELEIT. *Relação* (1998); *Veja*(30/12/92 e 7/7/93).\n","dic":"DHBB"}
