{"title":"GUIMARÃES, Alô Ticoulat","cargoss":["Deputado federal","Senador"],"cargos_esp":[0,0],"datas_ini":[1954,1955],"datas_fim":[1955,1963],"estados":["PR","PR"],"autor":[0],"content":"**GUIMARÃES, Alô Ticoulat**\n\n\\*dep. fed. PR 1954-1955; sen. PR 1955-1963.\n\n \n\n*Alô Ticoulat Guimarães* nasceu em Curitiba no dia 12 de dezembro de\n1903, filho do general Teodorico Gonçalves Guimarães e de Estela\nTicoulat Guimarães. Seu irmão Acir Guimarães foi deputado federal pelo\nParaná de 1946 a 1948.\n\nDiplomou-se pela Faculdade de Medicina da Universidade do Paraná em\n1927, especializando-se em psiquiatria.\n\nFoi um dos fundadores, em 15 de novembro de 1932, da Confederação dos\nTinguis, partido político que tinha como principal objetivo combater o\nambiente de desprestígio dos valores paranaenses e apoiar os princípios\nda Revolução de 1930. Em 1935, no governo de Manuel Ribas (1932-1945),\nassumiu a diretoria do Serviço Médico-Legal do estado do Paraná e, a\npartir de 1936, foi professor da cadeira de clínica psiquiátrica da\nFaculdade de Medicina pela qual se formara.\n\nSua carreira política iniciou-se quando, em 1945, assumiu a prefeitura\nde Curitiba. Vice-presidente do Conselho Administrativo do Estado do\nParaná entre 1946 e 1947, no ano seguinte , foi secretário de Saúde e\nAssistência Social, no governo de Moisés Lupion (1947-1951). No pleito\nde outubro de 1950 foi eleito primeiro suplente de deputado federal pelo\nParaná, na legenda do Partido Social Democrático (PSD). Assumiu a\nSecretaria do Interior e Justiça em 1951, e mais tarde, a diretoria do\nServiço Médico-Legal, cargo que deixou em 1952.\n\nNo pleito de outubro de 1954, sempre na legenda do PSD, elegeu-se ao\nmesmo tempo deputado federal por seu estado e suplente de Moisés Lupion,\nigualmente eleito senador. Convocado à Câmara dos Deputados, aí ocupou\numa cadeira no final da legislatura, entre novembro de 1954 e janeiro de\n1955, iniciando em seguida o mandato no Senado. Vice-líder do PSD nessa\ncasa em 1962 e vice-presidente da Comissão de Saúde, concluiu o mandato\nem janeiro de 1963.\n\nApós o movimento político-militar de 31 de março de 1964, que depôs o\npresidente João Goulart (1961-1964), deixou a carreira política,\npassando a dedicar-se ao exercício da medicina e do magistério\nuniversitário. Trabalhou em sua clínica psiquiátrica até o seu\nfalecimento.\n\nProprietário do Haras Paraná, foi um dos responsáveis pelo incremento da\ncriação de cavalos de corrida no estado, tendo, para tal, importado\nreprodutores ingleses. Foi presidente do Jóquei Clube Paranaense em\ndiversas oportunidades.\n\nFoi ainda diretor do Hospital Psiquiátrico Nossa Senhora da Luz e do\nSanatório Bom Retiro e secretário do Interior e Justiça do Paraná. Foi\nmembro e presidente da Associação Médica do Paraná e do Conselho da Cruz\nVermelha desse estado e pertenceu ainda ao Centro de Estudos Franco da\nRocha de São Paulo, à Sociedade de Medicina do Rio de Janeiro e ao\nCentro de Letras do Paraná.\n\nFaleceu em Curitiba no dia 4 de março de 1985.\n\nEra casado com Nazira Surugi Guimarães, com quem teve dois filhos.\n\nPublicou as seguintes obras: *Cirrose hepática de Laenec combinada com\nmal de Bauti* (1927), *A ciência psiquiátrica* (1938),*Penitenciária\nAgrícola do Estado*(1941), *O significado humano da carreira\nmédica*(1947),*O valor da cultura na formação espiritual dos*\n*médicos*(1949) e *O valor da previdência na* *vida do homem moderno.*\n\n \n\nFONTES: CÂM. DEP. *Deputados;*COUTINHO, A. *Brasil;*MOREIRA, J.\n*Dic.;*NICOLAS, M. *Cem;*SENADO*. Relação;*SENADO. *Relação dos\nlíderes;*TRIB. SUP. ELEIT. *Dados*(2 e 3).\n\n \n","ref":"FONTES: CÂM. DEP. *Deputados;*COUTINHO, A. *Brasil;*MOREIRA, J.\n*Dic.;*NICOLAS, M. *Cem;*SENADO*. Relação;*SENADO. *Relação dos\nlíderes;*TRIB. SUP. ELEIT. *Dados*(2 e 3).\n\n \n","dic":"DHBB"}
