{"title":"GUIMARÃES, Hildebrando","cargoss":["Deputado federal","Deputado federal","Deputado federal"],"cargos_esp":[0,0,0],"datas_ini":[1971,1968,1967],"datas_fim":[1973,1969,0],"estados":["CE","CE","CE"],"autor":[0],"content":"**GUIMARÃES, Hildebrando**\n\n\\*dep. fed. CE 1967, 1968-1969 e 1971-1973.\n\n \n\n*Hildebrando Almeida Guimarães nasceu em Maceió no dia 9 de novembro de\n1928, filho de José Marcolino Guimarães e de Maria Almeida Guimarães.*\n\nBacharelou-se em ciências jurídicas e sociais pela Faculdade de Direito\ndo Ceará em 1956.\n\nNomeado diretor-geral do Departamento Administrativo da Secretaria do\nTrabalho do estado do Ceará em 1963, no ano seguinte passou a dirigir o\nDepartamento de Pesquisa de Mercado da mesma secretaria. Em novembro de\n1966 candidatou-se a deputado federal pelo Ceará na legenda da Aliança\nRenovadora Nacional (Arena), obtendo a segunda suplência. Tomou assento\nna Câmara dos Deputados de maio a julho de 1967 e de abril de 1968 a\njaneiro do ano seguinte, tornando-se suplente da Comissão de Segurança\nNacional.\n\nNo pleito de novembro de 1970 elegeu-se deputado federal pelo Ceará\nsempre na legenda da Arena, assumindo sua cadeira em fevereiro do ano\nseguinte. Foi membro da Comissão de Constituição e Justiça e suplente da\nComissão de Serviço Público e da Comissão do Polígono das Secas. Nomeado\nmembro vitalício do Conselho de Contas dos Municípios do Ceará pelo\ngovernador César Cals, renunciou a seu mandato em novembro de 1973.\n\nPermaneceu no exercício desse cargo até sua morte, ocorrida em\nFortaleza, no dia 22 de fevereiro de 1990.\n\nEra casado com Nise Magalhães Guimarães, com quem teve três filhas.\n\n \n\nFONTES: CÂM. DEP. *Deputados*; CÂM. DEP. *Deputados brasileiros.\nRepertório* (1967-1971 e 1971-1975); INF. FAM.; *Jornal do Brasil*\n(15/11/73); *Perfil* (7).\n\n \n","ref":"FONTES: CÂM. DEP. *Deputados*; CÂM. DEP. *Deputados brasileiros.\nRepertório* (1967-1971 e 1971-1975); INF. FAM.; *Jornal do Brasil*\n(15/11/73); *Perfil* (7).\n\n \n","dic":"DHBB"}
