{"title":"GUIMARÃES, José","cargoss":["Deputado federal"],"cargos_esp":[0],"datas_ini":[1951],"datas_fim":[1959],"estados":["BA"],"autor":[0],"content":"**GUIMARÃES, José**\n\n\\*dep. fed. BA 1951-1959.\n\n*José Gomes de Oliveira Guimarães* nasceu em Salvador no dia 7 de\nnovembro de 1902, filho de Venceslau de Oliveira Guimarães e de Maria\nGomes de Oliveira Guimarães.\n\nFormou-se pela Faculdade de Medicina da Universidade da Bahia,\nespecializando-se em pediatria.\n\nFoi inspetor técnico de propaganda e educação sanitária e diretor de\nSaúde do estado da Bahia. No pleito de janeiro de 1947, elegeu-se\ndeputado à Assembléia Legislativa estadual na legenda da União\nDemocrática Nacional (UDN).\n\nEm outubro de 1950, foi eleito deputado federal pela Bahia na legenda da\nAliança Democrática, coligação da UDN com o Partido Republicano (PR), o\nPartido Socialista Brasileiro (PSB), o Partido Social Progressista (PSP)\ne o Partido Democrata Cristão (PDC). Deixando o mandato estadual em\njaneiro de 1951, no mês seguinte assumiu uma cadeira na Câmara dos\nDeputados. Filiado agora ao PR, em 1954 foi secretário da mesa da\nCâmara. Reeleito em outubro do mesmo ano na legenda da Aliança\nRepublicana Cristã (PR e PDC), tentou nova reeleição em outubro de 1958,\ndessa vez na legenda do PR, obtendo apenas a quinta suplência. Deixou a\nCâmara em 31 de janeiro de 1959, a ela não mais retornando.\n\nFONTES: CÂM. DEP. *Deputados;*CÂM. DEP. *Relação dos dep.;*CISNEIROS, A.\n*Parlamentares;*TRIB. SUP. ELEIT. *Dados* (1, 2, 3 e 4).\n\n \n","ref":"FONTES: CÂM. DEP. *Deputados;*CÂM. DEP. *Relação dos dep.;*CISNEIROS, A.\n*Parlamentares;*TRIB. SUP. ELEIT. *Dados* (1, 2, 3 e 4).\n\n \n","dic":"DHBB"}
