{"title":"GUIMARÃES, Magnus","cargoss":["Deputado federal"],"cargos_esp":[0],"datas_ini":[1975],"datas_fim":[1983],"estados":["RS"],"autor":[0],"content":"**GUIMARÃES, Magnus**\n\n\\*dep. fed. RS 1975-1983.\n\n*Magnus Francisco Antunes Guimarães* nasceu em Santo Ângelo (RS) no dia\n31 de outubro de 1942, filho de Francisco Sales Guimarães e de Nadir\nAntunes Guimarães.\n\nApós bacharelar-se em ciências jurídicas e sociais pela Universidade de\nPasso Fundo, em seu estado, dedicou-se à advocacia criminal e tomou\nparte em júris no interior gaúcho, em Mato Grosso, no Paraná e em Santa\nCatarina.\n\nIngressou na política após o movimento político-militar de 31 de março\nde 1964, filiando-se ao Movimento Democrático Brasileiro (MDB), partido\nde oposição ao regime militar, criado com a extinção do\npluripartidarismo pelo Ato Institucional nº 2 (27/10/1965). Presidente\ndo diretório municipal do MDB em Três de Maio (RS), aproximou-se do\nex-governador gaúcho Leonel Brizola (1959-1963), exilado desde 1964, por\nintermédio de Nei Brito, que havia sido chefe do Gabinete Civil de seu\ngoverno.\n\nNo pleito de novembro de 1974 foi eleito deputado federal pelo Rio\nGrande do Sul na legenda do MDB, assumindo seu mandato em fevereiro de\n1975. Na Câmara foi membro da Comissão de Fiscalização Financeira e\nTomada de Contas, suplente das comissões de Relações Exteriores e de\nEducação e Cultura e vice-presidente das comissões Especial sobre a\nEstabilidade da Família Brasileira e Parlamentar de Inquérito sobre o\nConsumidor. Vice-líder da bancada de seu partido em 1978, reelegeu-se\ndeputado federal por seu estado em novembro desse mesmo ano, sempre na\nlegenda do MDB.\n\nEm sua atuação parlamentar dividiu com o deputado Getúlio Dias a\ncondição de “porta-voz” de Leonel Brizola no Congresso. Com a volta do\nex-governador ao Brasil em setembro de 1979, tornou-se um dos\ncoordenadores do grupo “brizolista”, na tentativa de reorganizar o\nPartido Trabalhista Brasileiro (PTB), dentro do quadro da reformulação\npartidária decorrente da extinção do bipartidarismo determinada em\nnovembro do mesmo ano. Com a perda da sigla do PTB para a deputada Ivete\nVargas, filiou-se à legenda criada por Brizola, o Partido Democrático\nTrabalhista (PDT), tornando-se seu líder na Câmara.\n\nEm janeiro de 1982 divulgou uma nota de seu partido repudiando a\nprorrogação dos mandatos parlamentares. Nessa legislatura foi membro das\ncomissões de Relações Exteriores e de Minas e Energia e suplente das\ncomissões de Trabalho e Legislação Social e de Educação e Cultura da\nCâmara, além de suplente da comissão parlamentar de inquérito destinada\na apurar atos de corrupção praticados por órgãos da administração direta\ne indireta da União. No pleito de novembro desse ano concorreu à\nreeleição na legenda do PDT, conseguindo apenas uma suplência. Deixou a\nCâmara dos Deputados em janeiro de 1983, ao final da legislatura.\n\n                Manteve-se no diretório do PDT, e, em 1996 foi eleito\npara a prefeitura do município de Itapema/SC. Assumiu em 1997 e\npermaneceu no cargo até 2001. No ano seguinte, candidatou-se, pelo mesmo\npartido e Estado ao Senado Federal. Não obteve sucesso. Retornou em\n2008, para desta vez candidatar-se à vereador, pelo município de\nItapema, porém teve a candidatura indeferida pelo Tribunal de Contas da\nUnião(TCU).\n\nCasou-se com Maria Eronita Luckmeyer Guimarães, com quem teve três\nfilhos.\n\n \n\nFONTES: CÂM. DEP. *Deputados;*CÂM. DEP. *Deputados brasileiros.\nRepertório*(1975-1979 e 1979-1983); *Jornal do Brasil*(28 e 30/1, 7 e\n17/4, 2/6, 25/7 e 28/8/79 e 12/1/82); NÉRI, S. *16; Perfil*(1980).\n\n \n","ref":"FONTES: CÂM. DEP. *Deputados;*CÂM. DEP. *Deputados brasileiros.\nRepertório*(1975-1979 e 1979-1983); *Jornal do Brasil*(28 e 30/1, 7 e\n17/4, 2/6, 25/7 e 28/8/79 e 12/1/82); NÉRI, S. *16; Perfil*(1980).\n\n \n","dic":"DHBB"}
