{"title":"GUIMARÃES, Vilmar","cargoss":["Deputado federal","Deputado federal","Deputado federal","Deputado federal"],"cargos_esp":[0,0,0,0],"datas_ini":[1979,1967,1960,1959],"datas_fim":[1981,1975,1962,0],"estados":["GO","GO","GO","GO"],"autor":[0],"content":"**GUIMARÃES, Vilmar**\n\n\\*dep. fed. GO 1959, 1960-1962, 1967-1975, 1979-1981.\n\n \n\n*Vilmar da Silva Guimarães* nasceu em Rio Verde (GO) no dia 28 de julho\nde 1917, filho de José da Silva Guimarães e de Maria Coelho Guimarães.\n\nBacharelou-se em ciências jurídicas e sociais pela Faculdade de Direito\nde Goiás.\n\nInimigo político de Pedro Ludovico, interventor federal e governador de\nGoiás de 1930 a 1945, combateu o regime do Estado Novo, durante o qual\nfoi preso várias vezes. Com a redemocratização do país em 1945, foi um\ndos fundadores da União Democrática Nacional (UDN), iniciando sua\ncarreira política no pleito de janeiro de 1947, quando se elegeu\ndeputado à Assembléia Constituinte de seu estado. Membro da grande\ncomissão de elaboração da Constituição, foi relator de vários capítulos\nda nova Carta, e, com a promulgação desta, passou a exercer o mandato\nordinário. Nos pleitos de outubro de 1950 e de 1954 reelegeu-se deputado\nestadual na legenda da UDN, tornando-se membro da Comissão de Justiça e\nda Comissão de Finanças, primeiro-secretário da mesa e líder do governo\nna Assembléia.\n\nEm outubro de 1958 candidatou-se a deputado federal por Goiás na legenda\nda Coligação Democrática, formada pela UDN e pelo Partido Social\nProgressista (PSP), obtendo a primeira suplência. Deixou a Assembléia\nLegislativa em janeiro de 1959, tomando assento na Câmara dos Deputados\nde agosto a dezembro desse ano, e entre agosto de 1960 e junho de 1962.\nEm outubro seguinte voltou a obter uma suplência de deputado federal na\ncoligação constituída pela UDN, o PSP e o Partido Democrata Cristão\n(PDC), e, com a extinção dos partidos políticos pelo Ato Institucional\nnº 2 (27/10/1965) e a posterior instauração do bipartidarismo, filiou-se\nà Aliança Renovadora Nacional (Arena).\n\nNo pleito de outubro de 1966 elegeu-se deputado federal por Goiás na\nlegenda da Arena, assumindo sua cadeira em fevereiro seguinte. Durante\nessa legislatura foi membro da Comissão de Finanças, suplente da\nComissão de Legislação Social e relator da comissão parlamentar de\ninquérito sobre o déficit orçamentário da Estrada de Ferro Santa\nCatarina. Em outubro de 1970 tentou a reeleição, obtendo apenas uma\nsuplência. Assumiu contudo o mandato no ano seguinte e integrou as\ncomissões de Relações Exteriores e do Desenvolvimento da região\nCentro-Oeste. Nos pleitos de outubro de 1974 e de 1978 voltou a obter\numa suplência de deputado federal, tendo assumido uma cadeira na Câmara\nem fevereiro de 1979. Com a extinção do bipartidarismo em novembro desse\nano e a conseqüente reformulação partidária, filiou-se ao Partido\nDemocrático Social (PDS), agremiação situacionista que sucedeu à Arena.\nNos últimos anos criticou as cassações de mandatos, os casuísmos\neleitorais e outros atos de exceção.\n\nFaleceu em Goiânia no dia 14 de janeiro de 1981.\n\nFoi casado com Judite de Bastos Guimarães, com quem teve cinco filhos.\n\nPublicou Razões do nosso rompimento (1946), Aumento da magistratura\n(1947), A responsabilidade da ONU na guerra entre árabes e judeus\n(1967), Elas nas cem horas seculares (1967) e Problemas de Goiás e do\nBrasil Central (1969).\n\n \n\n \n\nFONTES: CÂM. DEP. Deputados; CÂM. DEP. Deputados brasileiros. Repertório\n(6 e 7); NÉRI, S. 16; Perfil (1972); TRIB. SUP. ELEIT. Dados; Veja\n(21/1/81).\n\n \n","ref":"FONTES: CÂM. DEP. Deputados; CÂM. DEP. Deputados brasileiros. Repertório\n(6 e 7); NÉRI, S. 16; Perfil (1972); TRIB. SUP. ELEIT. Dados; Veja\n(21/1/81).\n\n \n","dic":"DHBB"}
