{"title":"GUSMÃO, Carlos Cavalcanti de","cargoss":["Deputado federal"],"cargos_esp":[0],"datas_ini":[1935],"datas_fim":[1937],"estados":["AL"],"autor":[0],"content":"**GUSMÃO, Carlos Cavalcanti de**\n\n\\*dep. fed. AL 1935-1937.\n\n \n\n*Carlos Cavalcanti de Gusmão* nasceu no engenho Castanha Grande em São\nLuís do Quitunde (AL) no dia 11 de setembro de 1885, filho de Manuel\nMessias de Gusmão Lira.\n\nEstudou no Liceu Alagoano entre 1900 e 1903 e diplomou-se em direito no\nRio de Janeiro, então Distrito Federal, em 1909. Durante o curso,\ntrabalhou no Cartório de Registro de Títulos e Documentos de José\nMariano Carneiro da Cunha, na capital federal.\n\nDe volta a Alagoas, tornou-se delegado de polícia em Murici e auxiliar\nde auditor de guerra. Foi ainda oficial-de-gabinete no governo de\nClodoaldo da Fonseca (1912-1915), secretário de Fazenda no governo\nBatista Acióli (1918-1919), consultor jurídico de Alagoas e\ndelegado-geral do recenseamento em 1920. Foi diretor do Pavilhão de\nEstatísticas na Exposição Internacional do Centenário (1922-1923).\n\nIntegrou a comissão diretora do Partido Economista Democrático de\nAlagoas, criado a partir da reorganização do Partido Democrata alagoano\n(extinto em 1930), decidida na convenção de 2 de dezembro de 1932.\nContudo, nas eleições para a Assembléia Nacional Constituinte de 1933, o\npartido não conseguiu eleger nenhum candidato.\n\nEm outubro de 1934 foi eleito deputado federal por Alagoas, exercendo o\nmandato de julho de 1935 a novembro de 1937, quando, com a instauração\ndo Estado Novo, foram extintas todas as câmaras legislativas do país.\n\nEm 1947 foi nomeado desembargador do Tribunal de Justiça de Alagoas.\n\nFoi fiscal de ensino do Liceu Alagoano, professor da Faculdade de\nDireito de Alagoas, fundador da Academia Alagoana de Letras e membro do\nInstituto Histórico de Alagoas.\n\nAtuou como colaborador no *Jornal do Comércio* e publicou *Do\narrendamento e da parceria agrícola* (1929), *Defendendo a\nverdade*(1950) e *Boca da grota: reminiscências* (1970).\n\nFaleceu em 1974.\n\n \n\nFONTES: *Boletim Min. Trab.* (5/36); CÂM. DEP. *Deputados*; INF.\nFRANCISCO AMORIM.\n\n \n","ref":"FONTES: *Boletim Min. Trab.* (5/36); CÂM. DEP. *Deputados*; INF.\nFRANCISCO AMORIM.\n\n \n","dic":"DHBB"}
