{"title":"HADDAD, Mário =============","cargoss":["Deputado federal","Deputado federal"],"cargos_esp":[0,0],"datas_ini":[1982,1979],"datas_fim":[1983,1979],"estados":["AM","AM"],"autor":[0],"content":"HADDAD, Mário\n=============\n\n\\* dep. fed. AM 1979 e 1982-1983.\n\n \n\n*Mário Haddad* nasceu em Manaus no dia 23 de dezembro de 1939, filho de\nJorge Haddad e de Nazaré Haddad.\n\nAdvogado e empresário, ingressou na política filiando-se, em 1967, à\nAliança Renovadora Nacional (Arena), agremiação surgida após a extinção\ndos partidos políticos pelo Ato Institucional n^o^2 (27/10/65), que\npassou a dar sustentação ao regime militar instituído no país pelo\nmovimento político-militar de 31 de março de 1964, que depôs o\npresidente João Goulart (1961-1964). Em 1968 bacharelou-se em ciências\njurídicas e sociais pela Faculdade de Direito da Universidade do\nAmazonas. No pleito de novembro desse ano, foi eleito vereador em Manaus\nnessa legenda, tomando posse na Câmara Municipal em janeiro do ano\nseguinte e passou a integrar, como titular, a Comissão de Constituição e\nJustiça.\n\nEm novembro de 1970 elegeu-se deputado estadual na legenda da Arena.\nRenunciando ao mandato na Câmara Municipal em janeiro de 1971, em\nfevereiro seguinte assumiu sua cadeira na Assembléia Legislativa,\ntornando-se vice-líder do governo. Em 1973, com a eleição da nova mesa\ndiretora, foi eleito segundo secretário. Deixando de concorrer à\nreeleição no pleito de novembro de 1974, concluiu seu mandato no\nLegislativo amazonense em janeiro do ano seguinte, quando se encerrou a\nlegislatura.\n\nVoltou a disputar novo cargo eletivo no pleito de novembro de 1978, no\nqual se elegeu deputado federal, sempre na legenda da Arena. Assumindo\nsua cadeira em fevereiro do ano seguinte, em março licenciou-se do\nmandato na Câmara por ter sido nomeado secretário do Interior e Justiça\ndo Amazonas no governo José Lindoso (1979-1982). Sua cadeira na Câmara\ndos Deputados foi ocupada pelo primeiro suplente Rafael Faraco.\n\nCom a extinção do bipartidarismo em novembro de 1979 e a conseqüente\nreorganização partidária, ingressou no ano seguinte no Partido\nDemocrático Social (PDS), agremiação continuadora da Arena. Permaneceu\nna Secretaria de Justiça até maio de 1982, quando se desincompatibilizou\ndo cargo após ter seu nome homologado pelo partido para candidatar-se a\nvice-governador na chapa para o governo do estado, encabeçada por Josué\nFilho. Em seguida, reassumiu seu mandato de deputado federal. No pleito\nde novembro desse ano não conseguiu se eleger, pois a chapa vencedora\nfoi a do Partido do Movimento Democrático Brasileiro (PMDB), encabeçada\npor Gilberto Mestrinho. Mário Haddad permaneceu na Câmara dos Deputados\naté o fim de janeiro de 1983, quando se encerraram seu mandato e a\nlegislatura.\n\nNas eleições de novembro de 1986 para a Assembléia Nacional\nConstituinte, tentou novamente retornar à Câmara dos Deputados, desta\nvez na legenda do Partido Democrático Trabalhista (PDT), mas obteve\napenas a primeira suplência, não tendo chegado a exercer o mandato na\nlegislatura seguinte. A partir de então, abandonou a política e passou a\nse dedicar às atividades particulares de empresário nas áreas da\nconstrução civil e de drogarias.\n\nCasou-se com Maria Rocenilda de Sousa Haddad, com quem teve três filhos.\n\n \n\nFONTES: ASSEMB. NAC. CONST. *Repertório* (1987-1988); CÂM. DEP.\n*Deputados brasileiros.  Repertório* (1979-1983); INF. BIOG.\n\n \n","ref":"FONTES: ASSEMB. NAC. CONST. *Repertório* (1987-1988); CÂM. DEP.\n*Deputados brasileiros.  Repertório* (1979-1983); INF. BIOG.\n\n \n","dic":"DHBB"}
