{"title":"HENKIN, Henrique ================","cargoss":["Deputado federal"],"cargos_esp":[0],"datas_ini":[1967],"datas_fim":[1968],"estados":["RS"],"autor":[0],"content":"HENKIN, Henrique\n================\n\n\\*dep. fed. RS 1967-1968.\n\n \n\n*         Henrique Henkin* nasceu em Erexim (RS) no dia 13 de janeiro de\n1917, filho dos colonos russos Hillel Henkin e Elisa Henkin.\n\nApós o advento do Estado Novo em outubro de 1937 e a nomeação do general\nDaltro Filho (1937-1938) como interventor do Rio Grande do Sul, Henkin\ningressou na polícia gáucha, logo se tornando um dos principais líderes\nda classe. Bacharando-se pela Faculdade de Direito de Por­to Alegre em\n1943, passou em seguida a advogar na capital gaúcha. No pleito de\noutubro de 1958, com o apoio dos policiais do estado, elegeu-se suplente\nde deputado estadual na legenda do Partido Trabalhista Brasileiro (PTB).\nChefe de polícia do estado do Rio Grande do Sul de 1959 a 1960, no\ngoverno de Leonel Brizola, ao deixar o cargo assumiu uma cadeira na\nAssembléia Legislativa gaúcha.\n\nReconduzido à Assembléia no pleito de outubro de 1962, com a extinção\ndos partidos políticos pelo Ato Institucional nº 2 (27/10/1965) e a\nposterior instauração do bipartida­rismo, filiou-se ao Movimento\nDemocrático Brasileiro (MDB), partido de oposição ao regime militar\ninstaurado no país em abril de 1964, e em cuja legenda foi eleito\ndeputado federal pelo Rio Grande do Sul no pleito de novembro de 1966.\nDeixando a Assembléia em janeiro de 1967, assumiu no mês seguinte uma\ncadeira na Câmara.  Em 30 de dezembro de 1968 teve seu mandato cas­sado\ne os direitos políticos suspensos por dez anos com base no Ato\nInstitucional nº 5, pro­mulgado no dia 13 do mesmo mês.\n\nDe volta a Porto Alegre em janeiro de 1969, reabriu seu antigo\nescritório e voltou a exercer a advocacia.\n\nCom o fim do bipartidarismo, em 21 de novembro de 1979, e a conseqüente\nreformulação partidária, foi um dos fundadores do Partido Democrático\nTrabalhista (PDT).\n\nEm 1993, tornou-se presidente do Conselho de Ética do Diretório Estadual\ndo PDT no Rio Grande do Sul.\n\nCasou-se com Berta Henkin, com quem te­ve três filhos.\n\n \n\nFONTES:  ARQ. DEP. PESQ. JORNAL DO BRASIL; CÂM. DEP. *Deputados;*CÂM.\nDEP. *Deputados brasileiros. Repertório*(1967-1971); INF. BIOG.; TRIB.\nSUP. ELEIT. *Dados*(4,****6 e 8).\n","ref":"FONTES:  ARQ. DEP. PESQ. JORNAL DO BRASIL; CÂM. DEP. *Deputados;*CÂM.\nDEP. *Deputados brasileiros. Repertório*(1967-1971); INF. BIOG.; TRIB.\nSUP. ELEIT. *Dados*(4,****6 e 8).\n","dic":"DHBB"}
