{"title":"HENNING, Geraldo de Azevedo","cargoss":["Comandante do II Distrito Naval","Comandante do I Distrito Naval","Ministro da Marinha"],"cargos_esp":[0,0,0],"datas_ini":[1969,1972,1974],"datas_fim":[1972,1973,1979],"estados":[0,0,0],"autor":[0],"content":"**HENNING, Geraldo de Azevedo**\n\n\\*militar; comte. II DN 1969-1972; comte. I DN 1972-1973; min. Mar.\n1974-1979.\n\n \n\n*Geraldo de Azevedo Henning* nasceu no Rio de Janeiro, então Distrito\nFederal, no dia 16 de dezembro de 1917, filho de Artur Francisco Henning\ne de Edite da Rocha Azevedo Henning. Seu irmão, Artur de Azevedo\nHenning, oficial de Marinha, foi governador do Amapá entre 1974 e 1979.\n\nHenning fez seus****estudos preparatórios no Colégio São Bento, no Rio,\ne em 1934 ingressou na Escola Naval, de onde saiu guarda-marinha em\nabril de 1937. No ano seguinte, embarcou no navio-escola *Almirante\nSaldanha*em viagem de instrução ao exterior. Em setembro de 1938 passou\npara a Esquadra, sendo designado para embarcar no encouraçado *São\nPaulo*,**e foi promovido a segundo-tenente. Tendo servido em diferentes\nembarcações, em setembro de 1940 foi promovido a primeiro-tenente. Em\ndezembro de 1942 passou para a Flotilha de Submarinos, designado para o\n*Tamoio*.**Em abril de 1943 foi promovido a capitão-tenente e em outubro\ndo mesmo ano, após ser aprovado nos testes de adaptação em submarinos,\nembarcou no *Timbira*.\n\nDurante a Segunda Guerra Mundial (1939-1945), Henning especializou-se em\nforça submarina, tomando parte no patrulhamento das costas brasileiras e\ndo Atlântico Sul, além de participar do adestramento de navios e aviões\npara essa tarefa. Em julho de 1946 foi designado para o *Duque de\nCaxias*e em outubro, tornou-se ajudante-de-ordens do comando do III\nDistrito Naval (DN), sediado em Natal. Em fevereiro do ano seguinte\nassumiu interinamente a função de assistente daquele comando,\nexercendo-a durante um período de quatro meses.\n\nEm abril de 1948, designado comandante do navio hidrográfico *Aspirante\nNascimento*, foi incumbido da missão de construir dois faróis na ilha de\nFernando de Noronha. Um ano depois, nomeado assistente do diretor de\nHidrografia e Navegação, transmitiu o comando daquela embarcação e em\ndezembro de 1949 foi promovido a capitão-de-corveta. Em janeiro de 1952\npassou a servir no navio-escola*Almirante Saldanha*,**onde permaneceu\naté maio do ano seguinte, quando foi designado assistente do chefe do\nEstado-Maior da Armada (EMA), almirante-de-esquadra Átila Aché. Em\ndezembro de 1953 foi promovido a capitão-de-fragata e em outubro do ano\nseguinte iniciou o curso da Escola de Guerra Naval, concluindo-o em maio\nde 1955. A partir daí foi empossado como subchefe do estado-maior do\ncomando da Esquadra, chefiado pelo almirante Carlos Pena Boto.\n\nEm 11 de novembro de 1955 eclodiu o movimento militar encabeçado pelo\ngeneral Henrique Lott, ministro da Guerra demissionário, que depôs o\npresidente interino Carlos Luz, acusado de participar de uma suposta\nconspiração para impedir a posse do presidente eleito, Juscelino\nKubitschek. Carlos Luz embarcou em seguida no cruzador *Tamandaré*,\nsendo acompanhado, entre outros, pelo comandante-em-chefe da Esquadra,\nPena Boto. Geraldo Henning, servindo no estado-maior deste último,\ntambém se encontrava a bordo do cruzador.\n\nAinda em novembro foi designado para servir na Escola de Guerra Naval,\nonde permaneceu até o final do ano de 1957. Em dezembro desse ano foi\ndestacado para a Junta Interamericana de Defesa (JID), sediada em\nWashington, como membro do comitê de informações de seu estado-maior. Em\nagosto de 1958, ainda na JID, assumiu as funções de membro do comitê\nsocial do estado-maior e em novembro tornou-se presidente do comitê*ad\nhoc*para a preparação do índice e errata do manual de terminologia da\njunta. Em setembro de 1959 deixou suas funções na JID e, voltando ao\nBrasil, foi promovido a capitão-de-mar-e-guerra.\n\nEm fevereiro de 1960 foi nomeado chefe do estado-maior do IV DN, sediado\nem Belém. Ocupou o cargo até abril de 1961, quando foi designado\ninstrutor da Escola de Guerra Naval, onde, em dezembro de 1962, passou a\nchefe do Departamento de Ensino. Ao lado da imensa maioria dos oficiais\nda Marinha, apoiou o movimento político-militar de 31 de março de 1964,\nque depôs o presidente João Goulart. No mês seguinte passou a comandar a\nFlotilha de Submarinos, e ocupou o cargo até agosto de 1965, quando foi\nnomeado subdiretor da Escola Naval.\n\nEm setembro de 1966 foi designado subchefe do EMA e promovido a\ncontra-almirante, tornando-se também membro efetivo do Conselho de\nPromoções de Oficiais da Marinha. Em março de 1968 saiu da subchefia do\nEMA, indo cursar a Escola Superior de Guerra (ESG). Desligado da ESG, em\ndezembro de 1968 foi designado comandante naval de Brasília.****Nesse\nmesmo mês, como culminância de uma crise política que dominava o país,\nfoi editado o Ato Institucional nº 5 (AI-5), instrumento de exceção que\nprovocou um enérgico fechamento do regime político vigente.\n\nEm abril de 1969, foi promovido a vice-almirante e assumiu o comando do\nII DN, sediado em Salvador, substituindo o vice-almirante Mauro\nBaloussier. Em fevereiro de 1972 foi designado comandante do I DN,\nsediado no Rio de Janeiro, substituindo o vice-almirante José Uzeda de\nOliveira. Em março do ano seguinte foi promovido a almirante-de-esquadra\ne em abril tornou-se diretor-geral do Pessoal da Marinha, passando o\ncomando do I****DN ao vice-almirante Joaquim Coelho Lobo. Ocupou o cargo\naté março de 1974, quando foi convidado pelo presidente Ernesto Geisel\npara assumir o Ministério da Marinha no****governo que então se\niniciava.\n\nMinistro da Marinha (1974-1979)\n\nSubstituindo o almirante Adalberto de Barros Nunes, titular da pasta\ndurante o governo do general Emílio Garrastazu Médici, Henning encontrou\na Marinha em amplo processo de modernização de seu equipamento, com a\nincorporação de novos barcos comprados no exterior e um ambicioso\nprograma de construção naval militar no próprio Brasil. Na época, o\ngoverno Geisel deu bastante ênfase à indústria naval, setor incluído no\nII Plano Nacional de Desenvolvimento (II PND), que previa a construção\nde 750 navios no período 1975-1979.\n\nEm março de 1976 Henning foi transferido para a reserva remunerada, por\nhaver completado seu tempo de serviço. Na qualidade de ministro, visitou\na Argentina no mês seguinte, com o objetivo, segundo fontes militares,\nde discutir com autoridades navais argentinas o estabelecimento de uma\nestratégia comum de defesa das rotas do Atlântico Sul, consideradas\nameaçadas pela influência soviética em Angola depois que esse país se\nlibertou do colonialismo português. A visita do almirante Henning\ncoincidiu com a dos almirantes James Sagerholm e George Ellis,\nrespectivamente comandante e subcomandante da Frota do Atlântico Sul dos\nEstados Unidos. Oficialmente, o motivo da visita dos dois oficiais\nnorte-americanos à capital argentina era estudar os detalhes da Operação\nUnitas — um exercício conjunto de marinhas de diferentes países do\ncontinente — que seria efetuada meses mais tarde. Na época, essa visita\nde Henning deu margem a muitas discussões, pois havia a suspeita de que\no regime racista da África do Sul poderia vir a participar de uma\naliança que porventura viesse a ser feita. Isto teria repercussões\nextremamente negativas dentro e fora do Brasil, com reflexos nas\nrelações com os países africanos, com os quais o governo brasileiro se\nesforçava em estreitar laços. Em outubro do mesmo ano, sete meses\ndepois, o próprio Henning se encarregou de pôr um ponto final nas\nespeculações, ao dar uma entrevista à imprensa onde afirmava que o\nBrasil não via necessidade de novas alianças no Atlântico Sul, afastando\nqualquer possibilidade de que elas viessem a ser formadas. Disse,\ntambém, que a presença soviética na África era um problema de\ncompetência exclusiva dos africanos e que o Brasil não tinha qualquer\nintenção hegemônica no continente americano ou fora dele.\n\nEm maio de 1978 lançou uma nota pública reiterando seu apoio à\ncandidatura do general João Batista Figueiredo à sucessão de Geisel na\npresidência da República — candidatura apoiada pela Aliança Renovadora\nNacional (Arena). O ministro, também ele filiado à Arena, justificou\nessa atitude pela necessidade de esclarecer sua posição e pôr um\nfim****às especulações que o colocavam como simpático ao candidato\noposicionista, general Euler Bentes Monteiro, lançado pelo Movimento\nDemocrático Brasileiro (MDB). Com o término do mandato do presidente\nGeisel, em 15 de março de 1979, retirou-se da vida pública transferindo\na pasta ao novo ministro, almirante Maximiano Eduardo da Fonseca.\n\nFaleceu no Rio de Janeiro, no dia 7 de novembro de 1995.\n\nEra casado com Ieda Salgado Henning, com quem teve dois filhos. Um de\nseus filhos, Fernando Antônio, casou-se com Maria Luísa Duarte Pinto,\nfilha de Paulo de Bonoso Duarte Pinto, comandante do I Distrito Naval\nentre 1978 e 1979 e comandante-em-chefe da Esquadra brasileira de 1979 a\n1981.\n\n \n\nFONTES: BALÉM, J.*****Bispos*;**CURRIC .BIOG.; MIN. MAR. *Almanaque*\n(1971);*Perfil* (1974**e 1975); SERV. DOC. GER. MARINHA; *Súmulas*;\n*Tribuna da Imprensa*(18/3/76); *Who’s who in* *Brazil*.**\n\n \n\n \n","ref":"FONTES: BALÉM, J.*****Bispos*;**CURRIC .BIOG.; MIN. MAR. *Almanaque*\n(1971);*Perfil* (1974**e 1975); SERV. DOC. GER. MARINHA; *Súmulas*;\n*Tribuna da Imprensa*(18/3/76); *Who’s who in* *Brazil*.**\n\n \n\n \n","dic":"DHBB"}
