{"title":"HOLANDA, Antônio","cargoss":["Deputado federal"],"cargos_esp":[0],"datas_ini":[1991],"datas_fim":[1995],"estados":["AL"],"autor":[0],"content":"**HOLANDA, Antônio**\n\n\\*dep. fed. AL 1991-1995.\n\n \n\n*Antônio Holanda Costa* nasceu em União dos Palmares (AL), no dia 10 de\njaneiro de 1948, filho de Otacílio Holanda de Andrade e de Alice Costa\nAndrade.\n\nFormado em medicina pela Universidade Federal de Alagoas em 1975, em\nnovembro do ano seguinte elegeu-se vereador de Maceió na legenda da\nAliança Renovadora Nacional (Arena), partido de sustentação do regime\nmilitar instaurado no país desde abril de 1964. Líder da bancada\n(1977-1978) e depois vice-presidente da Câmara Municipal, com o fim do\nbipartidarismo em novembro de 1979, e a conseqüente reorganização\npartidária, ingressou no Partido Democrático Social (PDS), sucessor da\nArena.\n\nEm novembro de 1982 elegeu-se deputado estadual. Vice-presidente\n(1983-1984) e secretário (1985-1986) da Assembléia Legislativa, e, já\nfiliado ao Partido do Movimento Democrático Brasileiro (PMDB), elegeu-se\ndeputado estadual constituinte em novembro de 1986. Presidente da\nComissão de Justiça, licenciou-se do mandato para ocupar a Secretaria de\nSaneamento e Energia do governo de Fernando Collor de Melo (1987-1988).\nEm 1990 voltou a se licenciar, ocupando a pasta da Saúde, no governo de\nMoacir Andrade (1989-1991).\n\nEm outubro de 1990 elegeu-se deputado federal na legenda do Partido\nSocial Cristão (PSC). Líder da bancada, titular da Comissão de Relações\nExteriores e suplente da Comissão de Ciência e Tecnologia, Comunicação e\nInformática, faltou à sessão que a Câmara dos Deputados realizou em 29\nde setembro de 1992, para votar a abertura do processo de *impeachment*\ndo presidente Fernando Collor de Melo (1990-1992), acusado de crime de\nresponsabilidade por ligações com um esquema de corrupção liderado pelo\nex-tesoureiro de sua campanha presidencial Paulo César Farias. Afastado\nda presidência logo após a votação na Câmara, Collor renunciou ao\nmandato em 29 de dezembro de 1992, pouco antes da conclusão do processo\npelo Senado Federal, sendo efetivado na presidência da República o vice\nItamar Franco, que já vinha exercendo o cargo interinamente desde 2 de\noutubro.\n\nDurante a legislatura Antônio Holanda votou a favor do reajuste de\nsalário dos deputados, do redutor para os salários e do Fundo Social de\nEmergência (FSE).\n\nNo pleito de outubro de 1994 disputou uma vaga no Senado na legenda do\nPSC, mas foi malsucedido. Deixou a Câmara ao término da legislatura, em\njaneiro de 1995.\n\nCasado com Deise de Fátima Macedo Holanda, teve quatro filhos. Um deles,\nAntônio Holanda Costa Júnior foi eleito deputado estadual em 2006, mas\nteve o mandato cassado pela Justiça Eleitoral em 2008.\n\n \n\n \n\nFONTES: CÂM. DEP. *Deputados brasileiros. Repertório*(1991-1995);*Folha\nde S. Paulo*(18/9/84);**NICOLAU, J. *Dados*.\n\n \n","ref":"FONTES: CÂM. DEP. *Deputados brasileiros. Repertório*(1991-1995);*Folha\nde S. Paulo*(18/9/84);**NICOLAU, J. *Dados*.\n\n \n","dic":"DHBB"}
