{"title":"ISSLER, Vítor","cargoss":["Deputado federal","Deputado federal","Deputado federal","Deputado federal"],"cargos_esp":[0,0,0,0],"datas_ini":[1964,1961,1955,1952],"datas_fim":[1974,1962,1960,0],"estados":["RS","RS","RS","RS"],"autor":[0],"content":"**ISSLER, Vítor**\n\n\\*dep. fed. RS 1952, 1955-1960, 1961-1962 e 1964-1974.\n\n \n\n*Vítor Loureiro Issler* nasceu em Passo Fundo (RS) no dia 12 de março de\n1901, filho de Artur Schell Issler e de Josefina Loureiro Issler.\n\nFez o curso de humanidades no Ginásio Anchieta, em Porto Alegre,\ndedicando-se posteriormente ao comércio, à agricultura e à indústria.\n\nEm outubro de 1950 candidatou-se a deputado federal pelo Rio Grande do\nSul na legenda do Partido Trabalhista Brasileiro (PTB), obtendo a\nsegunda suplência, o que lhe permitiu tomar assento na Câmara entre\njulho e dezembro de 1952. No pleito de outubro de 1954 conseguiu\neleger-se deputado federal por seu estado, sempre na legenda do PTB,\niniciando seu mandato em fevereiro do ano seguinte. Reelegeu-se no\npleito de outubro de 1958, passando a integrar a Frente Parlamentar\nNacionalista (FPN), entidade suprapartidária criada em 1957 com o\nobjetivo de controlar a participação do capital estrangeiro no país e\ndefender uma política de desenvolvimento autônomo da economia nacional.\nInterrompeu seu mandato de maio de 1960 a abril do ano seguinte para\nexercer as funções de secretário da Fazenda do Rio Grande do Sul, no\ngoverno de Leonel Brizola.\n\nVoltou a reeleger-se deputado federal em outubro de 1962, e, de novembro\ndesse ano a abril de 1964, quando ocorreu a deposição do presidente João\nGoulart, foi diretor da Carteira de Crédito Geral do Banco do Brasil.\nDeixando o cargo no estabelecimento oficial de crédito, reassumiu sua\ncadeira na Câmara e, com a extinção dos partidos políticos pelo Ato\nInstitucional nº 2 (27/10/1965) e a posterior instauração do\nbipartidarismo, filiou-se ao Movimento Democrático Brasileiro (MDB),\npartido de oposição ao regime militar instalado no país em abril do ano\nanterior, e em cuja legenda reelegeu-se novamente nos pleitos de\nnovembro de 1966 e de 1970. Nesta última legislatura tornou-se membro da\nComissão de Orçamento e suplente das comissões de Economia e de\nAgricultura e Política Rural.\n\nFoi ainda presidente do Sindicato do Mate Rio-Grandense e do Instituto\nInterestadual do Mate, em Santa Catarina, e membro das juntas\ndeliberativas do Instituto Nacional do Mate e do Instituto Nacional do\nPinho.\n\nFaleceu em Brasília no dia 20 de setembro de 1974, sendo sua cadeira na\nCâmara ocupada por Léo Benhard Riffel.\n\nEra casado com Maria Célia Magalhães Issler, com quem teve quatro\nfilhos.\n\nPublicou Estrada do trigo (1956).\n\n \n\n \n\nFONTES: CÂM. DEP. Deputados brasileiros. Repertório (1971-1975);\nCISNEIROS, A. Parlamentares; Correio do Povo (8/12/65); Estado de S.\nPaulo (5/9/62); Jornal do Brasil (21/9/74); Perfil (1972).\n\n \n","ref":"FONTES: CÂM. DEP. Deputados brasileiros. Repertório (1971-1975);\nCISNEIROS, A. Parlamentares; Correio do Povo (8/12/65); Estado de S.\nPaulo (5/9/62); Jornal do Brasil (21/9/74); Perfil (1972).\n\n \n","dic":"DHBB"}
