{"title":"JABBUR, Neif","cargoss":["Deputado federal","Deputado federal"],"cargos_esp":[0,0],"datas_ini":[1997,1991],"datas_fim":[1999,1995],"estados":["MG","MG"],"autor":["Marcelo Costa"],"content":"**JABBUR, Neif**\n\n\\*dep. fed. MG 1991-1995, 1997-1999.\n\n*José Neif Jabbur* nasceu em Passos (MG) no dia 26 de abril de 1926,\nfilho do comerciante Abrão Jabbur e de Nazle Esper Jabbur.\n\nEm 1953, formou-se técnico em contabilidade pela Escola Técnica de\nComércio São José, em sua cidade natal, e ingressou na Faculdade de\nDireito do Triângulo Mineiro, em Uberaba (MG), que concluiu em 1958,\nespecializando-se em direito do menor. No pleito de novembro de 1954,\ncandidatou-se a uma cadeira na Câmara dos Vereadores de Passos, na\nlegenda do Partido Trabalhista Brasileiro (PTB). Eleito, assumiu o\nmandato no início do ano seguinte, participando dos trabalhos\nlegislativos como presidente da Câmara. Em 1958, saiu do PTB, deixando\ntambém o Parlamento ao final de seu mandato no início do ano seguinte.\n\nEm 1965, tornou-se diretor e presidente da empresa Daude Jabur\nEngenharia e Construções Ltda., com sede no Rio de Janeiro, onde\npermaneceu até 1973. Com o advento do bipartidarismo decorrente do Ato\nInstitucional nº 2 (AI-2), de 27 de outubro de 1965, filiou-se, no ano\nseguinte, ao Movimento Democrático Brasileiro (MDB), partido de oposição\nao regime militar instaurado no país em abril de 1964. Em 1970, foi\nassessor jurídico da Prefeitura Municipal de Passos, exercendo esse\ncargo por dois anos.\n\nNo pleito de novembro de 1974, elegeu-se deputado estadual por Minas\nGerais, na legenda do MDB, assumindo o mandato no início do ano\nseguinte. Reelegeu-se no pleito de novembro de 1978. Em virtude do fim\ndo bipartidarismo e da conseqüente reformulação partidária, em novembro\nde 1979, saiu do MDB e filiou-se ao Partido Popular (PP), liderado por\nTancredo Neves. Com a incorporação do PP ao Partido do Movimento\nDemocrático Brasileiro (PMDB), agremiação que aglutinou os antigos\nmembros do MDB, ingressou nessa legenda. No exercício do mandato,\nparticipou dos trabalhos legislativos como segundo-secretário da mesa\n(1979-1980).\n\nNas eleições de novembro de 1982 e de 1986, reelegeu-se deputado\nestadual — constituinte no segundo pleito —, exercendo a vice-liderança\ndo partido na Assembléia Legislativa (1985) e sendo vice-presidente da\nComissão de Turismo, Patrimônio Histórico e Artístico, membro titular da\nComissão de Agropecuária e Política Rural, da Comissão de Assuntos\nMunicipais e Planejamentos Regionais, da Comissão de Constituição e\nJustiça, da Comissão de Fiscalização Financeira e Tomada de Contas e\nrelator da Comissão Parlamentar de Inquérito (CPI) do Menor Abandonado\nem Minas Gerais. Em 1987, foi eleito presidente da mesa da Assembléia,\ncargo que exerceu até o ano seguinte, e tornou-se vice-presidente da\nUnião Parlamentar Interestadual (UPI), permanecendo nessa função por\ntrês anos.\n\nNo pleito de outubro de 1990, candidatou-se a uma cadeira na Câmara dos\nDeputados, na legenda do PMDB. Eleito, assumiu seu mandato no início de\n1991, participando dos trabalhos legislativos como\nprimeiro-vice-presidente e membro titular da Comissão de Relações\nExteriores e suplente da Comissão de Constituição e Justiça e de Redação\ne da CPI sobre a NEC do Brasil S.A. e o envolvimento do Ministério das\nComunicações e da Telebrás.\n\nVotou a favor do *impeachment* do presidente Fernando Collor de Melo na\nsessão da Câmara de 29 de setembro de 1992, acusado de crime de\nresponsabilidade por se envolver num amplo esquema de corrupção\ncomandado por Paulo César Farias, seu tesoureiro durante a campanha\neleitoral. Assumiu interinamente a presidência, tão logo a Câmara dos\nDeputados aprovou o afastamento de Collor, o vice Itamar Franco. Com o\nprocesso ainda em andamento no Senado, e vislumbrando escassas\npossibilidades de recuperar o cargo, Collor renunciou ao mandato em 29\nde dezembro, esperando livrar-se de uma pena de oito anos de\ninelegibilidade, manobra afinal frustrada. Acolhida a renúncia, Itamar\nFranco foi efetivado na presidência da República.\n\nAinda nessa legislatura, nas votações importantes no Congresso Nacional,\nJabbur declarou-se favorável à cobrança do Imposto Provisório sobre\nMovimentação Financeira (IPMF), contribuição de 0,25% que incidiu sobre\noperações bancárias, e à criação do Fundo Social de Emergência (FSE),\nque concedeu ao Executivo Federal uma margem de autonomia na alocação de\nrecursos, autorizando-o a aplicar verbas inicialmente previstas para os\nministérios da Educação e da Saúde em outras áreas. Esteve ausente na\nvotação do fim do voto obrigatório (rejeitado).\n\nNo pleito de outubro de 1994, candidatou-se à reeleição, na legenda do\nPMDB, mas obteve apenas a segunda suplência, deixando a Câmara ao final\nde seu mandato, no início de 1995. Em janeiro do ano seguinte, saiu do\nPMDB e filiou-se ao Partido Progressista Brasileiro (PPB), agremiação\ncriada em agosto de 1995 a partir da fusão do Partido Progressista (PP)\ncom o Partido Progressista Reformador (PPR), tornando-se presidente do\ndiretório municipal de Passos e membro do diretório regional de Minas\nGerais do novo partido.\n\nEm 2 de janeiro de 1997, tomou posse e foi efetivado no mandato de\ndeputado federal, pela legenda do PPB, ocupando a cadeira que pertencera\na Newton Cardoso, ex-governador de Minas Gerais (1983-1987), empossado\nna prefeitura de Contagem (MG). Participou dos trabalhos legislativos\ncomo terceiro-vice-presidente da Comissão de Desenvolvimento Urbano e\nInterior. Ainda em 1997, votou a favor da emenda que permitiu que\nprefeitos, governadores e o presidente da República disputassem um\nmandato consecutivo e da emenda que pôs fim à estabilidade dos\nservidores públicos.\n\nEm 1998, manifestou-se a favor da reforma da previdência, que fixou um\nteto salarial para a aposentadoria dos servidores públicos e estabeleceu\nidade e tempo de contribuição mínimos para os trabalhadores do setor\nprivado.\n\nCandidatou-se à reeleição no pleito de outubro de 1998, na legenda do\nPMDB mineiro, não obtendo, contudo, votação suficiente para novo\nmandato. Deixou a Câmara dos Deputados em fevereiro de 1999, ao final da\nlegislatura.\n\nFaleceu em 15 de dezembro de 2003.\n\nCasou-se com Maria Eni Siqueira Jabbur, com quem teve três filhos.\n\nMarcelo Costa\n\nFONTES: ASSEMB. LEGISL. MG.*Dicionário biográfico*; CÂM. DEP. *Deputados\nbrasileiros. Repertório* (1991-1995, 1995-1999, suplemento); *Folha de\nS. Paulo* (6/11/98); *Olho no Congresso/Folha de S. Paulo* (5/2/98);\n*Olho no voto/Folha de S. Paulo* (18/9/94); *Perfil\nparlamentar/IstoÉ*(1991); Portal da ASSEMB. LEGISL. MG.***20 anos da\nConstituição Mineira*.**\n\n \n","ref":"FONTES: ASSEMB. LEGISL. MG.*Dicionário biográfico*; CÂM. DEP. *Deputados\nbrasileiros. Repertório* (1991-1995, 1995-1999, suplemento); *Folha de\nS. Paulo* (6/11/98); *Olho no Congresso/Folha de S. Paulo* (5/2/98);\n*Olho no voto/Folha de S. Paulo* (18/9/94); *Perfil\nparlamentar/IstoÉ*(1991); Portal da ASSEMB. LEGISL. MG.***20 anos da\nConstituição Mineira*.**\n\n \n","dic":"DHBB"}
