{"title":"JATOBÁ, José","cargoss":["Deputado federal","Deputado federal","Deputado federal"],"cargos_esp":[0,0,0],"datas_ini":[1958,1955,1947],"datas_fim":[1958,1956,1950],"estados":["BA","BA","BA"],"autor":[0],"content":"**JATOBÁ, José**\n\n\\*dep. fed. BA 1947-1950, 1955-1956 e 1958.\n\n \n\n*José de Freitas Jatobá* nasceu em Campo Formoso (BA) no dia 22 de\nnovembro de 1895, filho de Guilhermino de Freitas Jatobá e Cecília de\nFreitas Jatobá.\n\nEstudou nos colégios Carneiro Ribeiro e Marista de Salvador. Diplomou-se\nem engenharia civil pela Escola Politécnica da Bahia em 1916.\n\nExerceu a profissão no estado de Mato Grosso, onde foi prefeito de\nSantana do Parambu entre 1919 e 1923. De volta à Bahia em 1925, exerceu\no mesmo cargo no município de Senhor do Bonfim, de 1930 a 1934, durante\na interventoria de Juraci Magalhães (1931-1935). Nesse período,\norganizou e presidiu em 1933 a Aliança Social e Política Municipal.\n\nNo pleito de outubro de 1934 elegeu-se deputado estadual constituinte,\npermanecendo no cargo até novembro de 1937, quando o Estado Novo fechou\nas representações parlamentares. Com a redemocratização, foi suplente de\ndeputado federal pela Bahia em dezembro de 1945, na legenda da União\nDemocrática Nacional (UDN).  Exerceu o mandato de abril de 1947 a julho\nde 1950. No ano seguinte, assumiu o posto de diretor financeiro da\nCompanhia Vale do Rio Doce, função que exerceu até 1952.\n\nFoi também suplente nos pleitos de 1950 e 1954. Primeiro na legenda da\nAliança Democrática, coligação da UDN com o Partido Republicano (PR), o\nPartido Socialista Brasileiro (PSB), o Partido Social Progressista (PSP)\ne o Partido Democrata Cristão (PDC), e em 1954 concorrendo na legenda da\nUDN.  Ocupou uma cadeira na Câmara de novembro de 1955 a fevereiro de\n1956, de maio a julho de 1956 e de abril a junho de 1958. No pleito de\noutubro de 1958 candidatou-se a uma vaga para a Câmara dos Deputados mas\nnão obteve êxito.\n\nEm 8 de abril de 1960, assumiu a Secretaria de Fazenda no segundo\ngoverno de Juraci Magalhães (1958-1963), em substituição a Aliomar\nBaleeiro. Nesse mesmo período, tornou-se o primeiro presidente da\nCompanhia de Eletricidade da Bahia (Coelba), permanecendo no cargo até o\nfim da gestão de Juraci, em abril de 1963.\n\nAo deixar a vida pública, dedicou-se à pecuária e foi membro da\nAssociação Baiana de Criadores (Abac).\n\nFaleceu em Salvador no ano de 1993.\n\nEra casado com Helena de Lima Jatobá.\n\n \n\nFONTES: CÂM. DEP. *Deputados*; CÂM. DEP.*Deputados brasileiros*\n(1946-1967);*Diário do* *Congresso Nacional*;**INF. DIV. DOC. COELBA;\nTRIB. SUP. ELEIT. *Dados* (1, 2 e 3).\n\n \n","ref":"FONTES: CÂM. DEP. *Deputados*; CÂM. DEP.*Deputados brasileiros*\n(1946-1967);*Diário do* *Congresso Nacional*;**INF. DIV. DOC. COELBA;\nTRIB. SUP. ELEIT. *Dados* (1, 2 e 3).\n\n \n","dic":"DHBB"}
