{"title":"JORDAN, Hans","cargoss":["Constituinte","Deputado federal"],"cargos_esp":[0,0],"datas_ini":[1946,1946],"datas_fim":[1946,1951],"estados":[0,"SC"],"autor":[0],"content":"**JORDAN, Hans**\n\n\\*const. 1946; dep. fed. SC 1946-1951.\n\n \n\n*Hans Jordan* nasceu em Joinville (SC) no dia 3 de março de 1892, filho\nde Henrique Jordan e de Geni Jordan. Seu pai integrou o Clube\nRepublicano de Joinville.\n\nCursou o Ginásio Catarinense, em Florianópolis, e concluiu seus estudos\nna Suíça. Retornando a Joinville, assumiu a direção da empresa da\nfamília a H. Jordan & Cia.\n\nComeçou sua carreira política como vice-prefeito de sua cidade natal,\nocupando em 1927 uma cadeira de deputado na Assembléia Legislativa de\nSanta Catarina. Foi também diretor do Instituto Nacional do Mate.\n\nNo pleito de dezembro de 1945, candidatou-se a deputado por seu estado à\nAssembléia Nacional Constituinte na legenda do Partido Social\nDemocrático (PSD), obtendo a segunda suplência. Ocupando sua cadeira em\nfevereiro do ano seguinte, participou dos trabalhos constituintes e, com\na promulgação da nova Carta (18/9/1946) e a transformação da Assembléia\nem Congresso ordinário, exerceu o mandato até janeiro de 1951, tendo\nintegrado a Comissão Permanente de Tomada de Contas.\n\nEm seguida voltou a dedicar-se às atividades empresariais, tendo\npresidido a Associação Comercial e Industrial de Joinville.\n\nFaleceu em Joinville, no dia 21 de março de 1967.\n\nEra casado com Rose Tamm Jordan e teve duas filhas.\n\n \n\nFONTES: ASSEMB. LEGISL. SC. *Dicionário político*; CABRAL,\nO.*Breve*;**CABRAL, O. *Era*;**CABRAL, O.*História*; *Diário do\nCongresso Nacional*;*Grande encic. Delta*;**SILVA, G.*Constituinte*.**\n\n \n\n \n","ref":"FONTES: ASSEMB. LEGISL. SC. *Dicionário político*; CABRAL,\nO.*Breve*;**CABRAL, O. *Era*;**CABRAL, O.*História*; *Diário do\nCongresso Nacional*;*Grande encic. Delta*;**SILVA, G.*Constituinte*.**\n\n \n\n \n","dic":"DHBB"}
