{"title":"JORDÃO, José de Carvalho","cargoss":["Comandante do V Distrito Naval","Comandante do I Distrito Naval","comte -em-ch Esquadra","Chefe do Estado-Maior da Armada"],"cargos_esp":[0,0,0,0],"datas_ini":[1966,1968,1969,1973],"datas_fim":[1967,1969,1971,1975],"estados":[0,0,0,0],"autor":[0],"content":"**JORDÃO, José de Carvalho**\n\n\\*militar; comte. V DN 1966-1967; comte. I DN 1968-1969; comte.-em-ch.\nEsquadra 1969-1971; ch. EMA 1973-1975.\n\n \n\n*José de Carvalho Jordão* nasceu no Rio de Janeiro, então Distrito\nFederal, no dia 16 de novembro de 1912.\n\nDepois de concluir os estudos secundários, ingressou em abril de 1930 na\nEscola Naval, de onde saiu guarda-marinho em 1934. Promovido a\nsegundo-tenente em dezembro desse ano, recebeu a patente de\nprimeiro-tenente em julho de 1936 e a de capitão-tenente em julho de\n1940. Chegou a capitão-de-corveta em maio de 1946 e a capitão-de-fragata\nem setembro de 1952.\n\nAlcançando a patente de capitão-de-mar-e-guerra em julho de 1958, foi\nnomeado diretor da Escola de Guerra Naval em 1965. Promovido, em\ndezembro desse ano, a contra-almirante, sucedeu ao contra-almirante\nÁureo Dantas Torres no comando do V Distrito Naval, sediado em\nFlorianópolis, de fevereiro de 1966 a junho de 1967, quando foi\nsubstituído pelo vice-almirante João Batista Francisconi Serram.\n\nChegando ao posto de vice-almirante em agosto de 1968, sucedeu ao\nvice-almirante Maurício Dantas Torres no comando do I Distrito Naval,\nsediado no Rio de Janeiro. Passou esse comando em dezembro de 1969 ao\nvice-almirante Otávio José Sampaio Fernandes, assumindo o cargo de\ncomandante-em-chefe da Esquadra, em substituição ao vice-almirante\nMaurício Dantas Torres. Promovido a almirante-de-esquadra em dezembro de\n1970, em janeiro do ano seguinte passou aquele comando ao vice-almirante\nOtávio José Sampaio Fernandes. Em abril de 1972 assumiu o cargo de\nsecretário-geral da Marinha. Nomeado chefe do Estado-Maior da Armada\n(EMA) em abril de 1973, em substituição ao almirante-de-esquadra\nFrancisco Augusto Simas de Alcântara, em 1974 foi comissionado\ncomandante de Operações Navais. Em janeiro de 1975 deixou a chefia do\nEMA, transmitindo o cargo ao almirante-de-esquadra Guálter Maria Meneses\nde Magalhães e passando para a reserva.\n\nFaleceu no dia 20 de janeiro de 1987.\n\n \n\nFONTES: *Boletim de Oficiais;* CORRESP*.*SERV. DOC. GER. MAR.; *Jornal\ndo Brasil* (19/4/74); MIN. MAR. *Almanaque* (1971); *Perfil*(1972 e\n1974); *Veja*(1/8/73).\n\n \n","ref":"FONTES: *Boletim de Oficiais;* CORRESP*.*SERV. DOC. GER. MAR.; *Jornal\ndo Brasil* (19/4/74); MIN. MAR. *Almanaque* (1971); *Perfil*(1972 e\n1974); *Veja*(1/8/73).\n\n \n","dic":"DHBB"}
