{"title":"JORGE, Artur Guimarães de Araújo","cargoss":["Embaixador do Brasil - Chile","Secretário-geral da Presidência da República","Embaixador do Brasil - Portugal"],"cargos_esp":[0,0,0],"datas_ini":[1935,1935,1936],"datas_fim":[1935,1935,1943],"estados":[0,0,0],"autor":["Brasileiro."],"content":"**JORGE, Artur Guimarães de Araújo**\n\n\\*diplomata; emb. Bras. Chile 1935; secr. Pres. Rep. 1935; emb. Bras.\nPortugal 1936-1943.\n\n*Artur Guimarães de Araújo Jorge* nasceu em Paulo Afonso (AL) no dia 29\nde setembro de 1884, filho de Rodrigo Afonso Araújo Jorge e de Emília\nGuimarães de Araújo Jorge.\n\nMatriculou-se em 1900 na Faculdade de Direito de Recife, pela qual se\nbacharelou em 1904. A partir desse ano tornou-se professor de história\nnatural e filosofia do direito do Instituto Leibnitz, onde foi diretor\nda *Revista* *Jurídica,*além de colaborar por dois anos na revista\n*Cultura Acadêmica,*ambas em Recife. Ainda nessa cidade fundou o\nsemanário *A Tribuna.*\n\nNomeado em junho de 1905 secretário-auxiliar do Tribunal Arbitral\nBrasileiro-Boliviano, sediado no Rio de Janeiro, então Distrito Federal,\nem janeiro do ano seguinte exerceu a mesma função no Tribunal Arbitral\nBrasileiro-Peruano, também com sede no Rio de Janeiro. Os objetivos\ndessas cortes eram fixar de comum acordo as fronteiras entre os países\ninteressados.\n\nEm abril de 1906 entrou para o serviço regular do Ministério das\nRelações Exteriores como amanuense, sendo designado em julho seguinte\nsecretário da delegação brasileira à III Conferência Internacional\nAmericana. Promovido a terceiro-oficial em agosto de 1907, passou a\natuar como oficial-de-gabinete do ministro José Maria da Silva Paranhos,\nbarão do Rio Branco (1902-1912), de quem se tornou secretário particular\ne acompanhante em suas missões diplomáticas. Graças ao patrocínio de\nParanhos, fundou em 1909 a *Revista* *Americana,*editada mensalmente no\nRio de Janeiro, sendo promovido a segundo-oficial em março de 1911.\n\nCom a morte do barão do Rio Branco no ano seguinte, deixou a função de\noficial-de-gabinete, seguindo em fevereiro de 1913 para a Alemanha em\ncomissão. Em maio do mesmo ano foi promovido a primeiro-oficial e, após\nvisitar o Oriente, o Egito e o norte da África, retornou à Secretaria do\nItamarati, no Rio de Janeiro, em março de 1914, aí assumindo, por alguns\nmeses, a direção da Seção de Negócios Políticos e Diplomáticos da\nEuropa, função que exerceu até 1915. De abril a junho desse ano atuou\ncomo secretário do ministro das Relações Exteriores Lauro Müller\n(1912-1917) em sua viagem à Argentina e ao Chile por ocasião da\nassinatura, por esses países, do Tratado do ABC. Em agosto seguinte\ntornou-se oficial-de-gabinete do subsecretário Gastão da Cunha, tendo\nestado em comissão nos Estados Unidos entre novembro de 1915 e janeiro\ndo ano seguinte, quando assistiu ao II Congresso Científico\nPan-Americano, reunido em Washington.\n\nEntre 1916 e 1917 exerceu na Secretaria do Itamarati a função de diretor\ndos Negócios Políticos e Diplomáticos da América, tornando-se chefe de\nseção em abril de 1918, quando foi designado para chefiar a Seção de\nNegócios Econômicos e Comerciais. No ano seguinte assumiu a chefia da\nSeção dos Negócios Consulares e Comerciais, passando também a responder\npela direção geral dos Negócios Econômicos e Consulares. Permaneceu\nnessa última seção até 1920, quando foi nomeado diretor-geral da Seção\ndos Negócios Políticos e Diplomáticos, ocupando esse cargo até o ano\nseguinte. Em dezembro de 1923 voltou a ser designado para a Seção dos\nNegócios Políticos e Diplomáticos da América e, em março do ano\nseguinte, para a Seção de Limites e Atos Internacionais.\n\nNomeado em julho de 1925 enviado extraordinário e ministro\nplenipotenciário do Brasil em missão especial em La Paz, na Bolívia,\npermaneceu no posto por dois meses, retornando então ao Rio de Janeiro.\nEm novembro de 1926 foi novamente designado enviado especial e ministro\nplenipotenciário, dessa vez para servir em Cuba e na América Central,\nassumindo o posto em Havana em fevereiro de 1927. A partir desse ano\nvisitou diversos países centro-americanos, tendo representado o Brasil\nem 1928 na Conferência de Conciliação e Arbitragem, realizada em\nWashington. Removido para Assunção, no Paraguai, assumiu o posto em\njulho do ano seguinte, sendo transferido em fevereiro de 1931 para a\nembaixada brasileira em Montevidéu. Permaneceu na capital uruguaia até\nagosto de 1933, sendo removido para Berlim em outubro do mesmo ano.\n\nPromovido a embaixador em fevereiro de 1935, foi comissionado em\nSantiago do Chile, onde substituiu Carlos Celso de Ouro Preto,\npermanecendo no posto até o mês seguinte, quando retornou ao Brasil para\nse tornar secretário do presidente Getúlio Vargas. Exerceu essa função\nde abril a julho de 1935, data a partir da qual reassumiu o posto em\nSantiago. Deixou a capital chilena em dezembro do mesmo ano, sendo\nsubstituído por Gilberto Amado e transferido ainda nesse mês para a\nembaixada brasileira em Lisboa, onde assumiu suas funções em maio de\n1936 em substituição a Luís Guimarães Fernandes Pinheiro. Em 1941\nrepresentou o Brasil no Congresso Luso-Brasileiro de História, reunido\nem Lisboa. Aposentado por limite de idade em abril de 1943, foi\nsubstituído por João Neves da Fontoura à frente da embaixada brasileira\nem Portugal.\n\nHistoriador e escritor, foi membro do Instituto de Coimbra e da Academia\nPortuguesa de História, além de sócio-correspondente da Academia de\nCiências de Portugal e secretário, no Brasil, da Carnegie Endowment for\nInternational Peace.\n\nCasou-se com Helena Caneco de Araújo Jorge, com quem teve um filho.\n\nPublicou *Problemas de filosofia biológica*(1905),*Jesus Cristo e a\npsicologia mórbida*(1909),*Ensaios da história diplomática* *do Brasil\nno regime republicano: 1ª série 1889-1902*(1912),*História diplomática\ndo* *Brasil holandês*(1914),*História diplomática* *do Brasil\nfrancês*(1915),*Ensaios de história e* *crítica*(1915) e *Introdução às\nobras do barão* *do Rio Branco*(1945), além de artigos que escreveu para\na *Revista Americana*e a*Revista* *do Instituto Histórico e Geográfico\nBrasileiro.*\n\nFONTES: ARQ. GETÚLIO VARGAS; COUTINHO, A. *Brasil; Diário do Congresso\nNacional*;**GUIMARÃES, A. *Dic.*;**MIN. REL. EXT. *Anuário*;**OLIVEIRA,\nJ. *Dic.*; PEIXOTO, A. *Getúlio*;**SILVA, I. *Dic.*\n\n \n\n \n","ref":"FONTES: ARQ. GETÚLIO VARGAS; COUTINHO, A. *Brasil; Diário do Congresso\nNacional*;**GUIMARÃES, A. *Dic.*;**MIN. REL. EXT. *Anuário*;**OLIVEIRA,\nJ. *Dic.*; PEIXOTO, A. *Getúlio*;**SILVA, I. *Dic.*\n\n \n\n \n","dic":"DHBB"}
