{"title":"JUREMA, Otacílio              ","cargoss":["Senador"],"cargos_esp":[0],"datas_ini":[1955],"datas_fim":[1958],"estados":["PB"],"autor":[0],"content":"**JUREMA, Otacílio              **\n\n\\*sen. PB 1955-1958.\n\n \n\n*Otacílio Guimarães Jurema* nasceu em São João do Rio do Peixe, hoje\nmunicípio de Antenor Navarro (PB), no dia 8 de março de 1898, filho de\nJoaquim Vítor Jurema e de Cecília Guimarães Jurema. Pouco depois de seu\nnascimento, o pai foi nomeado juiz de direito da comarca de Cajazeiras\n(PB).\n\nEm 1913, seus pais mudaram-se para a cidade da Paraíba, atual João\nPessoa. Ali Otacílio Jurema concluiu o primário e fez o curso ginasial\nno Ginásio Pio X, onde teve como colega e amigo José Lins do Rego.\nDurante o ano de 1915 não pôde estudar, devido às dificuldades\nfinanceiras de seu pai, reflexo da forte seca que assolou o sertão\nnordestino naquele período. Terminou o curso secundário no ano seguinte.\n\nEm 1917 mudou-se para Salvador, onde foi aprovado no vestibular da\nFaculdade de Medicina da Bahia. Em 1918, pediu transferência para a\nEscola Anatômica, Cirúrgica e Médica, que no mesmo ano passou a\nchamar-se Faculdade de Medicina do Rio de Janeiro, então Distrito\nFederal, formando-se  em 1923. Entre seus colegas de turma destacaram-se\nAdemar Pereira de Barros, futuro governador São Paulo (1947-1951), e\nLavoisier Maia, que viria a ser governador do Rio Grande do Norte\n(1979-1983). Otacílio Jurema defendeu sua tese de doutoramento,\nTerapêutica dos fibromas uterinos, em 1924.\n\nEm setembro de 1923 foi eleito vereador em Cajazeiras, destacando-se na\nCâmara Municipal pela defesa dos pobres e oprimidos. Foi o primeiro\nmédico a fixar residência na cidade. Entre 1927 e 1928, em sociedade com\num amigo, fundou a Casa de Saúde Miguel Couto, que funcionou apenas sete\nmeses. Em 1929, após a morte da mãe, passou cerca de um ano trabalhando\nna cidade de Bauru (SP), retornando depois à Paraíba.\n\nParticipou da Revolução de 1930, servindo como médico no 23º Batalhão de\nCaçadores, em Fortaleza. Com o fim do Governo Provisório de Getúlio\nVargas e a redemocratização do país em 1934, Otacílio Jurema foi eleito\nvereador em Cajazeiras, no final de 1935. Assumiu o mandato em 27 de\njaneiro do ano seguinte, tornando-se secretário da mesa da Câmara\nMunicipal. Com o advento do Estado Novo, em 10 de novembro de 1937,\nJurema teve o seu mandato de vereador interrompido pelo fechamento dos\nlegislativos de todo o país. Continuou a exercer a medicina, sem\ndiscriminar aqueles que não podiam pagar as consultas.\n\nFindo o Estado Novo (29/10/1945) e a redemocratização do país, Osvaldo\nTrigueiro elegeu-se governador da Paraíba em janeiro de 1947 e nomeou\nJurema secretário estadual da Educação e Saúde, cargo que exerceu até\njunho de 1949. Durante esse período, na área da educação, construiu\ncolégios, salas de aula, desapropriou prédios para transformá-los em\nescolas e preocupou-se com a qualificação e seleção do quadro de\nprofessores. Na área da saúde, sua grande preocupação foi o\ndesenvolvimento da medicina social e o atendimento qualificado nos\npostos de saúde espalhados por todo o estado. No ano seguinte, instalou\num consultório em Campina Grande (PB) e tornou-se médico do Hospital do\nInstituto de Previdência e Assistência aos Servidores do Estado (IPASE)\nnesta cidade e do Departamento Nacional de Obras contra as Secas\n(DNOCS), na cidade de São Gonçalo (PB).\n\nFiliado à União Democrática Nacional (UDN), elegeu-se prefeito de\nCajazeiras (PB), em agosto de 1951. Transferiu-se depois para o Partido\nSocial Progressista (PSP) e, em outubro de 1954, foi eleito suplente do\nsenador João Cavalcanti de Arruda, candidato da coligação UDN e PSP. Em\n30 de novembro de 1955, deixou a prefeitura de Cajazeiras e, no mês\nseguinte, foi convocado para substituir o titular da cadeira no Senado.\nExerceu o mandato até março de 1956, tendo participado da Comissão de\nFinanças. Retornou, em dezembro, ao Congresso, onde permaneceu até março\nde 1957. Reassumiu em novembro e exerceu o mandato até abril de 1958,\nquando integrou a Comissão de Legislação Social, como suplente, e a\nComissão de Educação e Cultura, em substituição ao senador Reginaldo\nFernandes.\n\nEm agosto de 1959, tornou-se mais uma vez prefeito de Cajazeiras.\nExecutou, então, obras  importantes para melhoria da qualidade de vida\nda população, como o abastecimento de água do açude de Boqueirão e de\nenergia elétrica proveniente da hidrelétrica de Paulo Afonso. Em\nsetembro de 1962, licenciou-se por um mês para concorrer a uma cadeira\nna Assembléia Legislativa de seu estado, sendo substituído no cargo pelo\npresidente da Câmara Municipal, Francisco Rolim. Eleito deputado\nestadual na legenda do Partido Socialista Brasileiro (PSB), reassumiu em\nseguida a prefeitura. Voltou a licenciar-se em 31 de janeiro de 1963,\npara assumir sua cadeira no Legislativo estadual. Após o ato formal de\nposse, licenciou-se da Assembléia e reassumiu o cargo de prefeito até o\nfinal do mandato, em 30 de novembro, quando transferiu a chefia do\ngoverno municipal a Francisco Matias Rolim, eleito em agosto de 1963.\n\nNo início do ano seguinte voltou à Assembléia Legislativa. Devido ao\nmovimento político-militar de 31 de março de 1964 que depôs o presidente\nJoão Goulart (1961-1964), extinguiu os partidos políticos com o Ato\nInstitucional nº 2 (27/10/1965) e instaurou o bipartidarismo, filiou-se\nao Movimento Democrático Brasileiro (MDB), partido de oposição ao regime\nmilitar. Concorreu à reeleição no pleito de novembro de 1966, mas não\nobteve êxito. Permaneceu na Assembléia Legislativa até o fim de janeiro\nde 1967, final de seu mandato.\n\nAbandonou a política para dedicar-se exclusivamente à medicina. Foi\nmembro da Sociedade de Medicina e Cirurgia da Paraíba.\n\nFaleceu em Cajazeiras no dia 10 de agosto de 1987.\n\nNão era casado e não teve filhos.\n\nEm sua homenagem, a Câmara Municipal de Cajazeiras passou a se chamar\n“Casa Otacílio Jurema.”\n\nPublicou *Aspectos do Nordeste* e*Seca no* *Nordeste*. Sobre sua vida,\nfoi publicado *Centenário Otacílio Jurema. Cem anos de honestidade*.\n\nAlan Carneiro atualização\n\n \n\nFONTES: *Almanaque da PB*; COUTINHO, A.*Brasil*; INF. MARCELO R. C.\nPAIS; ROLIM, A. *Centenário*; SENADO. *Dados*; SENADO. *Relação*; TRIB.\nSUP. ELEIT. *Dados* (7 e 8).\n\n \n\n \n","ref":"FONTES: *Almanaque da PB*; COUTINHO, A.*Brasil*; INF. MARCELO R. C.\nPAIS; ROLIM, A. *Centenário*; SENADO. *Dados*; SENADO. *Relação*; TRIB.\nSUP. ELEIT. *Dados* (7 e 8).\n\n \n\n \n","dic":"DHBB"}
