{"title":"KFFURI, Ari","cargoss":["Deputado federal"],"cargos_esp":[0],"datas_ini":[1975],"datas_fim":[1987],"estados":["PR"],"autor":[0],"content":"**KFFURI, Ari**\n\n\\*dep. fed. PR 1975-1987.\n\n \n\n*Ari Kffuri* nasceu em Irati (PR) no dia 10 de outubro de 1929, filho de\nNagib João Kffuri e Jovita Silva Kffuri.\n\nBancário, comerciante e industrial, vinculou-se inicialmente à União\nDemocrática Nacional (UDN). Elegeu-se em novembro de 1974 suplente de\ndeputado federal pelo Paraná na legenda da Aliança Renovadora Nacional\n(Arena), partido de apoio ao regime militar instalado no país em abril\nde 1964, ocupando uma cadeira na Câmara a partir de março de 1975. Entre\n1976 e 1977, foi membro da Comissão de Serviço Público e suplente da\nComissão de Ciência e Tecnologia da Câmara.\n\nReeleito nas eleições de 1978, ainda pela Arena paranaense, iniciou seu\nsegundo mandato em fevereiro de 1979. No mesmo ano, elegeu-se\nterceiro-secretário da mesa da Câmara. Com a extinção dos partidos\npolíticos em novembro de 1979, filiou-se ao Partido Democrático Social\n(PDS) agremiação situacionista que sucedeu à Arena.\n\nNas eleições de novembro de 1982, elegeu-se à Câmara dos Deputados pelo\nestado do Paraná na legenda do PDS. Deixou a Câmara em janeiro de 1987,\nao término da legislatura, sem ter disputado a reeleição em novembro\nanterior.\n\nAfastado definitivamente da vida pública por motivo de doença, veio a\nfalecer em Brasília no dia 25 de janeiro de 1990.\n\nEra casado com Azioléa Teresinha Moreira Kffuri, com quem teve dois\nfilhos.\n\n \n\nFONTES: CÂM. DEP. *Deputados*; CÂM. DEP. *Deputados brasileiros.\nRepertório* (1979-1983); INF. FAM.; *Jornal do Brasil* (26/11/78); NÉRI,\nS. *16*; *Perfil* (1980).\n\n \n","ref":"FONTES: CÂM. DEP. *Deputados*; CÂM. DEP. *Deputados brasileiros.\nRepertório* (1979-1983); INF. FAM.; *Jornal do Brasil* (26/11/78); NÉRI,\nS. *16*; *Perfil* (1980).\n\n \n","dic":"DHBB"}
