{"title":"KUSSLER, Ildemar","cargoss":["Deputado federal"],"cargos_esp":[0],"datas_ini":[1995],"datas_fim":[1997],"estados":["RO"],"autor":[0],"content":"**KUSSLER, Ildemar**\n\n\\*dep. fed. RO 1995-1997.\n\n*Ildemar Kussler* nasceu em Palmitos (SC) no dia 6 de fevereiro de 1957,\nfilho de Gido Alves Kussler e de Célia Cecília Kussler.\n\nFez os cursos primário e secundário na cidade natal, onde, em 1976,\ncomeçou a trabalhar como auxiliar administrativo e, no ano seguinte,\ncomo oficial maior do cartório. Em 1978, iniciou o curso de direito na\nAssociação dos Professores de Cruz Alta (RS), diplomando-se em 1983. A\npartir de 1981 foi escrivão no cartório criminal de São Carlos (SC) até\ntransferir-se, em 1986, para Ji-Paraná (RO), como promotor de Justiça.\nEm 1987 participou do VII Congresso Nacional do Ministério Público, em\nBelo Horizonte, e, no ano seguinte, do II Simpósio do Ministério Público\nde Rondônia, realizado em Vilhena.\n\nEm 1992, filiou-se ao Partido da Social Democracia Brasileira (PSDB) e\npassou a lecionar na Universidade Luterana do Brasil, em Ji-Paraná.\n\nEm outubro de 1994 foi eleito deputado federal, obtendo a maioria dos\nvotos na região de Ji-Paraná. Assumindo o mandato em fevereiro do ano\nseguinte, integrou a Comissão Mista do Orçamento e as comissões do\nTrabalho, Administração e Serviço Público e a de Direitos Humanos.\n\nNas votações das emendas constitucionais propostas pelo governo Fernando\nHenrique Cardoso em 1995, votou a favor da quebra do monopólio estatal\ndas telecomunicações, dos estados na distribuição de gás canalizado, das\nembarcações nacionais na navegação de cabotagem e da Petrobras na\nexploração de petróleo; da mudança no conceito de empresa nacional\ne****da prorrogação do Fundo Social de Emergência (FSE), rebatizado de\nFundo de Estabilização Fiscal (FEF), que permitia que o governo gastasse\n20% da arrecadação de impostos sem que estas verbas ficassem\nobrigatoriamente vinculadas aos setores de saúde e educação.\n\nEm junho de 1996, votou a favor da criação da Contribuição Provisória\nsobre Movimentação Financeira (CPMF), que substituiu o Imposto\nProvisório sobre Movimentação Financeira (IPMF), de 0,25% sobre\ntransações bancárias, criada como fonte complementar de recursos para a\nsaúde.\n\nEm outubro de 1996, elegeu-se prefeito de Ji-Paraná e deixou sua vaga na\nCâmara para Oscar Andrade, do Partido da Frente Liberal (PFL).\n\nCasou-se com Míriam de Sousa Kussler, com quem teve três filhos.\n\nFONTES: CÂM. DEP. *Deputados bra**sileiros. Repertório*(1995-1999);\n*Estado de S. Paulo*(20/11/96); *Folha de S. Paulo*(31/1/95, 14/1 e\n16/10/96, 30/1/97); *Jornal do Brasil* (4/6/96).\n\n \n","ref":"FONTES: CÂM. DEP. *Deputados bra**sileiros. Repertório*(1995-1999);\n*Estado de S. Paulo*(20/11/96); *Folha de S. Paulo*(31/1/95, 14/1 e\n16/10/96, 30/1/97); *Jornal do Brasil* (4/6/96).\n\n \n","dic":"DHBB"}
