{"title":"LACERDA, Maurício de","cargoss":["Deputado federal","Revolucionário ou revoltoso","Revolucionário ou revoltoso","Deputado federal","Revolucionário ou revoltoso","Revolucionário ou revoltoso"],"cargos_esp":[0,0,0,0,0,0],"datas_ini":[1912,1922,1924,1930,1930,1935],"datas_fim":[1920,1922,1924,1930,1930,1935],"estados":["RJ",0,0,"DF",0,0],"autor":["Robert Pechman"],"content":"**LACERDA, Maurício de**\n\n\\*jornalista; dep. fed. RJ 1912-1920; rev. 1922; rev. 1924; dep. fed. DF\n1930; rev. 1930; rev. 1935.\n\n*Maurício Paiva de Lacerda* nasceu em Vassouras (RJ) no dia 1º de junho\nde 1888, filho de Sebastião Eurico Gonçalves de Lacerda, deputado\nconstituinte em 1891, deputado federal de 1894 a 1896, ministro da\nIndústria, Viação e Obras Públicas de 1897 a 1898, no governo Prudente\nde Morais, e ministro do Supremo Tribunal Federal em 1912, e de Maria da\nGlória Paiva de Lacerda. Era irmão de Fernando de Lacerda e Paulo de\nLacerda, líderes do Partido Comunista do Brasil, depois chamado Partido\nComunista Brasileiro (PCB).\n\nIniciou seus estudos no Colégio Alfredo Gomes, no Rio de Janeiro, então\nDistrito Federal, em 1895, transferindo-se em 1897 para o Ginásio\nFluminense, em Petrópolis (RJ), onde concluiu em 1899 o curso primário.\nCursou o secundário no Colégio Paula Freitas, no Rio de Janeiro, de 1900\na 1904 e, em 1905, ingressava na Faculdade de Direito dessa cidade.\n\nJá no primeiro ano de faculdade, estreou no Tribunal do Júri como um dos\nadvogados de dois companheiros de turma, acusados do assassinato do\nmonsenhor Olímpio de Campos, senador por Sergipe. Quando decretada a Lei\ndo Sorteio Militar, foi um dos primeiros estudantes a alistar-se como\nvoluntário de manobras. Em 1907, tornou-se diretor do jornal Agrário, de\nMiracema (RJ), função que manteria até 1913. Em 1908, participou do I\nCongresso Sul Americano de Estudantes, realizado em Montevidéu.\n\nEm janeiro de 1909, invadiu sua terra natal em companhia de soldados que\ncom ele se haviam apresentado na condição de voluntários, a fim de\nimpedir que se realizassem as eleições em que seu pai seria derrotado.\nFoi então processado pela Justiça Federal, mas a ação criminal\nprescreveu. Ainda em 1909, último ano em que freqüentou a faculdade,\nassumiu a direção de O Município, de Vassouras — cargo em que se\nmanteria até 1910 —, e aderiu, juntamente com outros estudantes, à\ncandidatura do marechal Hermes da Fonseca à presidência da República.\nCom a eleição deste em 1910, tornou-se seu oficial-de-gabinete, ao mesmo\ntempo em que passou a dirigir a revista O Vassourense. Foi eleito\ndeputado à Assembléia Legislativa do estado do Rio de Janeiro, e em 1912\ndeixou o gabinete presidencial para eleger-se deputado federal pelo\nestado do Rio. A partir dessa época, acompanhou os movimentos\nreivindicatórios do proletariado no Distrito Federal, iniciando-se no\nestudo da doutrina socialista. Em 1915 e 1918, foi reeleito deputado\nfederal pelo estado do Rio de Janeiro, tornando-se então ardoroso\ndefensor do nacionalismo. Durante sua permanência na Câmara Federal,\nacumulou os cargos de vereador de Vassouras (1913-1923) e de prefeito\ndessa cidade (1915-1920). Em 1915, foi escolhido como líder de uma\ntentativa malograda de levante conhecida por Conspiração dos Sargentos,\nsó não sendo processado devido à intervenção do presidente Venceslau\nBrás. Essa conspiração foi promovida por alguns oposicionistas que\npretendiam proclamar, através de uma quartelada, a República\nParlamentar. O candidato dos sargentos à presidência da República era o\ngeneral Emídio Dantas Barreto. Descoberta a conspiração pela polícia,\ninstaurou-se o inquérito pertinente, que poupou os políticos e\ndeterminou a expulsão dos subalternos das fileiras do Exército.\n\nEm 1917, Maurício de Lacerda elegeu-se presidente do Aeroclube\nBrasileiro, à frente do qual permaneceria até 1920. Muito o influenciou\no triunfo da Revolução Russa de 1917 e, a partir de então, passou a\nestimular movimentos grevistas e operários e a desdobrar-se numa\npermanente luta pelas reivindicações proletárias, participando,\ninclusive, da fundação da Liga Socialista. Devido a essa atuação, foi\nexcluído em 1921 do Partido Republicano Fluminense. Ainda nesse ano,\nintegrou a redação da revista Clarté, que reunia os intelectuais\nsimpatizantes da Revolução de Outubro. Por essa época, tornou-se também\namigo de Lima Barreto.\n\nDurante o governo de Artur Bernardes (1922-1926), Maurício de Lacerda\ntornou-se proprietário do jornal carioca Avante (1922-1923).\n\n \n\nO apoio às revoltas de 1922 e 1924\n\nJuntamente com alguns outros civis, Maurício de Lacerda participou das\narticulações para o levante militar de 5 de julho de 1922. Esse\nmovimento, que iniciou o ciclo de revoltas tenentistas da década de\n1920, eclodiu no Rio de Janeiro e em Mato Grosso em protesto contra a\neleição de Artur Bernardes para a presidência da República e contra as\npunições impostas pelo governo de Epitácio Pessoa aos militares,\nparticularmente o fechamento do Clube Militar e a prisão do marechal\nHermes da Fonseca. A revolta, que foi rapidamente debelada, envolveu, no\nRio de Janeiro, o forte de Copacabana, a Escola Militar e efetivos da\nVila Militar, e, em Mato Grosso, o contingente local do Exército. Por\nsua participação no levante, Maurício de Lacerda teve cassado seu\nmandato de vereador. De 1923 a 1924, dirigiu, no Rio de Janeiro, o\nvespertino A Nação.\n\nAo se iniciarem as articulações para a revolta de julho de 1924,\ntentaram os militares superar as barreiras que os separavam dos civis,\nprogramando a execução de um esforço conjunto que pudesse contar com a\nadesão de alguns políticos e o apoio da classe operária. Os\nintermediários escolhidos para essa aproximação foram Maurício de\nLacerda e Everardo Dias, líder anarco-sindicalista.\n\nNo encontro que manteve com o chefe revolucionário paulista Isidoro Dias\nLopes, Maurício de Lacerda demonstrou a possibilidade dessa união. Viu\nele em Isidoro um homem “singelo” e “claro”, que, segundo suas palavras,\n“gradativamente foi me interessando naqueles planos de uma revolta que\nera o esboço sensato da futura nação brasileira”. Todavia, os militares\nse foram fechando em suas posições, enquanto os civis iam sendo aos\npoucos marginalizados, abandonando o movimento cuja eclosão, em 5 de\njulho, chegou mesmo a surpreendê-los. Assim é que, ao ser comunicado de\nque a revolução se iniciara em São Paulo, Maurício de Lacerda considerou\na notícia como um boato. Seguiu então para a redação de A Rua e lá\ndeixou escrito um artigo sob o título de “A sombra da revolução”, em\nresposta à acusação, feita pelo Jornal do Comércio, de que se encontrava\ninfiltrado num movimento fascista. Em seu artigo, que levou A Rua a ser\nimediatamente apreendida, dizia ele que não participaria de motins\nfascistas e que somente daria apoio a uma revolução social. Por suas\ndeclarações, foi preso pouco depois.\n\nA revolta, deflagrada também em Sergipe e no Amazonas, foi aí debelada\nem pouco tempo. Em São Paulo, contudo, os rebeldes ocuparam a capital\npor três semanas, deslocando-se então para o interior. No ano seguinte,\nesse grupo se uniria ao contingente gaúcho que em outubro de 1924\nsublevou unidades militares no Rio Grande do Sul, constituindo dessa\nforma a Coluna Miguel Costa-Prestes.\n\nEm 1926, apesar de ainda se encontrar detido e após se recuperar de\nsérios problemas de saúde provocados por mau atendimento médico,\nMaurício de Lacerda foi eleito intendente do Conselho Municipal do\nDistrito Federal. Em 1927, disputou também pelo Distrito Federal as\neleições para a Câmara dos Deputados, participando, além da sua, da\ncampanha de Adolfo Bergamini, o que o levaria a perder o pleito para\neste e para João Batista de Azevedo Lima. Segundo Everardo Dias, que\nesteve preso com Maurício de Lacerda, “a massa, constituída em sua\ngrande maioria da classe média e pequena burguesia, foi buscá-lo às\nportas da prisão para conduzi-lo à escadaria do Congresso Nacional”.\nEnquanto esteve preso, Maurício de Lacerda redigiu um conjunto de notas\nsobre o estado de sítio, sobre o autoritarismo e sobre seu\nencarceramento, que viria a ser publicado em 1927, sob forma de livro,\ncom o título de História de uma covardia.\n\nEm março de 1928, Maurício de Lacerda compareceu ao Congresso de Bajé\n(RS), onde foi fundado o Partido Libertador (PL), liderado por Joaquim\nFrancisco de Assis Brasil. Em Porto Alegre, foi recebido por membros do\nPL e do Centro dos Estudantes Libertadores e pela delegação do Partido\nTrabalhista. Na ocasião, declarou que o congresso era o primeiro passo\npara a formação da frente única nacional contra o presidente Washington\nLuís.\n\nEm dezembro de 1928, Maurício de Lacerda — pouco antes reeleito para o\nConselho Municipal do Distrito Federal — foi o principal orador do\ncomício convocado para protestar contra a anulação da eleição do\noposicionista Ferdinando Labouriau para intendente do mesmo conselho.\nLabouriau, que falecera dias antes sem haver tomado posse do cargo,\nhavia sido também o “relator do pleito”, encarregado de dar parecer\nsobre o preenchimento da última cadeira do conselho. A vaga era\ndisputada por Minervino de Oliveira, do Bloco Operário e Camponês (BOC),\nfrente eleitoral do Partido Comunista do Brasil (PCB), e Sirínio\nCarreiro de Oliveira, situacionista. A pequena diferença de votos entre\nos dois provocara uma luta acirrada pela impugnação das urnas. Os\ngovernistas propuseram então anular a eleição de Labouriau, o que\npermitiria o aproveitamento dos dois postulantes à cadeira. Apesar das\nacusações de fraude lançadas pela oposição, esta foi a medida aprovada.\n\n \n\nO apoio à Aliança Liberal\n\nEm 1929, Maurício de Lacerda participou ativamente da campanha da\nAliança Liberal, movimento organizado para apoiar as candidaturas\noposicionistas de Getúlio Vargas e João Pessoa, presidentes\nrespectivamente dos estados do Rio Grande do Sul e da Paraíba, nas\neleições para a presidência da República marcadas para março de 1930.\n\nRealizado o pleito, o candidato governista Júlio Prestes saiu vitorioso.\nNa mesma ocasião, entretanto, Maurício de Lacerda foi eleito deputado\nfederal pelo Distrito Federal, iniciando seu mandato no início de maio.\nDe sua tribuna, juntamente com outros políticos da oposição, combateu os\nrebeldes de Princesa (PB), que no mês de fevereiro haviam-se insurgido\ncontra o governo estadual de João Pessoa. O movimento servira de\npretexto para que o governo federal concentrasse tropas na Paraíba, o\nque foi denunciado pelos aliancistas como uma forma de intervenção.\n\nNo dia 29 de maio, o jornal gaúcho Diário da Noite publicou um manifesto\nde Luís Carlos Prestes, então exilado em Buenos Aires, retirando o apoio\nao programa defendido pela Aliança Liberal. Esse manifesto significou\nseu rompimento com Maurício de Lacerda, Isidoro Dias Lopes e Juarez\nTávora, entre outros, que se mantiveram ao lado dos aliancistas,\narticulando um movimento armado para depor o presidente Washington Luís.\nEssas articulações se intensificaram após o assassinato de João Pessoa,\nocorrido em julho. No dia 13 de setembro, os jornais cariocas estamparam\numa veemente declaração de Maurício de Lacerda, que dizia: “Levanta-te,\nRio Grande!... O Rio Grande tem sido de uma prudência que toca às raias\nda covardia.”\n\nEm 3 de outubro, com a eclosão do movimento revolucionário no Rio Grande\ndo Sul, Maurício de Lacerda foi detido no Rio de Janeiro juntamente com\nAdolfo Bergamini e Cândido Pessoa, ficando preso alguns dias no quartel\ndo corpo de bombeiros. No dia 24, diante das vitórias dos\nrevolucionários e de seu avanço em direção ao Rio, os principais chefes\nmilitares lotados no Distrito Federal depuseram Washington Luís e\nassumiram o governo, formando uma junta governativa provisória que\npropôs o cessar-fogo. Enquanto essas medidas eram tomadas, os populares\nque desceram às ruas, aproximando-se do palácio Guanabara, residência\noficial do presidente da República, eram instados por Maurício de\nLacerda a não consumarem uma invasão. No dia 3 de novembro, a junta\ngovernativa entregou a chefia da nação a Getúlio Vargas.\n\nAvaliando esses acontecimentos, Maurício de Lacerda declarou que sua\natuação na preparação do movimento revolucionário foi guiada pela idéia\nde que antes de mais nada era necessário tornar impopular a pessoa de\nWashington Luís, que ainda cristalizava as esperanças nacionais.\n\nAinda em 1930, Maurício de Lacerda foi nomeado embaixador extraordinário\nno Uruguai, de onde regressou em janeiro de 1931, encontrando presos\nseus irmãos Fernando e Paulo, acusados de participar de movimentos\ncomunistas. Procurou então Osvaldo Aranha, na época ministro da Justiça,\ngraças a quem conseguiu a libertação de ambos.\n\nEm março de 1931, Luís Carlos Prestes publicou uma carta aberta\nafirmando entre outras coisas que a crise econômica que o Brasil\natravessava era conseqüência do imperialismo. A seu ver, dois\nestratagemas haviam sido empregados pelos imperialistas: o primeiro\nconsistira em encarregar Maurício de Lacerda de dizer ao público que a\nvelha política fora abandonada em nome de outra “completamente nova”; o\nsegundo, em utilizar o Ministério do Trabalho numa obra mistificadora e\nenganosa.\n\nAinda em 1931, Maurício de Lacerda filiou-se ao Clube 3 de Outubro,\norganização criada em maio desse ano para reunir as correntes\ntenentistas partidárias da manutenção e do aprofundamento das reformas\nintroduzidas pela Revolução de 1930. Foi também designado membro do\nConselho Consultivo do Estado do Rio de Janeiro, órgão que em alguns\nestados fez as vezes do Legislativo após a revolução, e nomeado\nprocurador fiscal da Fazenda Municipal do Distrito Federal. Nessa\ncondição, coube-lhe estudar, autorizado por Vargas, a compra pela\nprefeitura carioca do morro de Santo Antônio, que pertencia à União.\nMaurício de Lacerda descobriu que Washington Luís em seu governo\ncondenara em despacho essa transação. Ainda como procurador fiscal,\nacusou publicamente não só os políticos “regeneradores” (aliancistas),\nmas também o próprio Vargas no “caso do morro do Castelo”. Em artigo\npublicado na imprensa, denunciou ainda a censura que se aplicava a seus\ntextos jornalísticos, nos quais advertia contra a corrupção na República\nNova. Maurício de Lacerda começava a afastar-se daqueles cuja ascensão\npolítica favorecera.\n\nEm 1932, tornou-se prefeito de Vassouras.\n\n \n\nO afastamento do poder\n\nEm março de 1935, foi formada a Aliança Nacional Libertadora (ANL),\nfrente ampla que reuniu comunistas, socialistas, católicos e democratas\nem****torno de um programa que propunha a luta contra o fascismo, o\nimperialismo, o****latifúndio e a miséria. Em ligação com a ANL, foi\nconstituído um movimento de intelectuais antifascistas denominado Clube\nda Cultura Moderna. Maurício de Lacerda, ao lado de Rubem Braga, Brasil\nGérson, Genolino Amado, Maria Werneck de Castro e Aparício Torelli,\nentre outros, assinou o manifesto lançado pela organização no jornal A\nPátria.\n\nEm meados do ano, surgiram divergências no interior da ANL quanto à\nprogramação do ato que no dia 5 de julho comemoraria o aniversário dos\nlevantes de 1922 e 1924. O presidente da organização, Herculino\nCascardo, foi informado de que seus correligionários pretendiam ler um\nmanifesto assinado por Luís Carlos Prestes, o que provocaria uma\nimediata reação repressiva da parte do governo. Reunindo em assembléia,\nna qual discursaram Jorge Amado, Valério Konder, Aníbal Machado e o\npróprio Maurício de Lacerda, o Clube da Cultura Moderna apoiou a facção\nda ANL favorável à leitura do manifesto. Realizado o ato, no dia 11 de\njulho a ANL foi fechada por decreto do governo.\n\nEm 22 de agosto, para dar continuidade à ANL, Maurício de Lacerda fundou\nao lado de outros políticos a Aliança Popular por Pão, Terra e\nLiberdade. Em 15 de novembro, escreveu a Prestes comunicando que havia\nsido designado presidente da organização, a qual se propunha a\nfortalecer as forças congregadas em torno do nome de Prestes.\n\nEntretanto, atuando na ilegalidade, a ANL, com o apoio dos comunistas,\npromoveu uma série de levantes deflagrados nos dias 23, 24 e 27 de\nnovembro em Natal, Recife e Rio de Janeiro respectivamente, todos\ndominados em pouco tempo. Já no dia 26 foi decretado o estado de sítio,\niniciando-se uma violenta campanha de repressão aos participantes na\nRevolta Comunista e ocorrendo inúmeras prisões.\n\nEm janeiro de 1936, criou-se um órgão que pretendia coordenar todo o\nmovimento anticomunista: a Comissão de Repressão ao Comunismo,\nidealizada por Vicente Rao, ministro da Justiça. Integrada por civis e\nmilitares, a comissão estava autorizada a “propor a prisão ou a detenção\nde qualquer pessoa cuja atividade [fosse] reputada prejudicial às\ninstituições políticas e sociais”. Sua ação inicial foi pedir, em\nfevereiro de 1936, as prisões de Pedro Ernesto Batista, prefeito do\nDistrito Federal, além de Felipe Moreira Lima, Maurício de Lacerda,\nAnísio Teixeira, Eliezer Magalhães e Odilon Batista.\n\nDetido pouco depois, Maurício de Lacerda foi julgado junto com o segundo\ngrupo de indiciados na Revolta Comunista de 1935 somente em julho de\n1937, sendo absolvido ao lado de Odilon Batista, Raul Riff, Valério\nKonder, Luís Gonzaga Lins de Barros e João Batista Barreto Leite Filho.\nO juiz Antônio Pereira Braga jurou suspeição quanto a seu julgamento.\n\nEm outubro de 1938, Maurício de Lacerda publicou na imprensa de Paris um\nartigo em favor da anistia de Prestes e de outros comunistas. Em 1939,\ntornou-se advogado-chefe da Caixa Econômica do Distrito Federal.\n\nCom o início do processo de redemocratização que levaria ao fim do\nEstado Novo, em 1945 Maurício de Lacerda aderiu à União Democrática\nNacional (UDN), cuja seção carioca presidiu ate 1946. Voltou também a\nassumir suas funções de procurador da Fazenda Municipal do Distrito\nFederal, das quais se aposentaria em 1958.\n\nMembro efetivo da Academia Fluminense de Letras, da Academia Niteroiense\nde Letras, do Instituto e da Ordem dos Advogados do Distrito Federal e\ndo estado do Rio de Janeiro, da Cruz Vermelha Brasileira e da\nPoliclínica Brasileira, Maurício de Lacerda colaborou intensamente na\nimprensa diária do Rio de Janeiro e dos estados.\n\nFaleceu no Rio de Janeiro em 23 de novembro de 1959.\n\nFoi casado em primeiras núpcias com Olga Werneck Lacerda, com quem teve\ntrês filhos, entre os quais Carlos Lacerda, destacado jornalista,\ndeputado federal pelo Distrito Federal de 1956 a 1959 e governador da\nGuanabara de 1960 a 1965. Casou-se depois com Aglaiss Caminha, com quem\nteve um filho, Maurício Caminha de Lacerda, também jornalista.\n\nEscreveu as seguintes obras: História de uma covardia (1927, 2ª ed.\n1980), Entre duas revoluções (1927, 2ª ed. 1932), A Segunda República\n(1931), A aviação no tratado da paz, Flor de lótus (teatro), Amor de um\ncondenado (teatro), Da masmorra, Política profissional, O morro de Santo\nAntônio, Escola e latifúndio, Bibliotecas e museus escolares, Discursos\nparlamentares, A evolução legislativa do direito social brasileiro,\nMemórias ou a formação de um homem público e Meu pai.\n\nRobert Pechman\n\nFONTES: ABRANCHES, J. Governos; CÂM. DEP. Anais (1959-29); CARNEIRO, G.\nHistória; CARONE, E. República nova; CONSULT. MAGALHÃES, B.; Encic.\nMirador; FONTOURA, J. Memórias; Grande encic. Delta; HIRSCHOWICZ, E.\nContemporâneos; INST. NAC. LIVRO. Índice; JARDIM, R. Aventura; Jornal do\nComércio, Rio (4/6/67); LEVINE, R. Vargas; MORAIS, A. Minas; NOGUEIRA\nFILHO, P. Ideais; Personalidades; PORTO, E. Insurreição; REIS, A.\nBibliografia nac.; Rev. Brasiliense (27); SILVA, H. 1935; SILVA, H.\n1937; SILVA, H. 1938; SOUSA, J. Teatro.\n\n","ref":"FONTES: ABRANCHES, J. Governos; CÂM. DEP. Anais (1959-29); CARNEIRO, G.\nHistória; CARONE, E. República nova; CONSULT. MAGALHÃES, B.; Encic.\nMirador; FONTOURA, J. Memórias; Grande encic. Delta; HIRSCHOWICZ, E.\nContemporâneos; INST. NAC. LIVRO. Índice; JARDIM, R. Aventura; Jornal do\nComércio, Rio (4/6/67); LEVINE, R. Vargas; MORAIS, A. Minas; NOGUEIRA\nFILHO, P. Ideais; Personalidades; PORTO, E. Insurreição; REIS, A.\nBibliografia nac.; Rev. Brasiliense (27); SILVA, H. 1935; SILVA, H.\n1937; SILVA, H. 1938; SOUSA, J. Teatro.\n\n","dic":"DHBB"}
