{"title":"LAGO, Benedito","cargoss":["Deputado federal"],"cargos_esp":[0],"datas_ini":[1951],"datas_fim":[1952],"estados":["MA"],"autor":[0],"content":"**LAGO, Benedito**\n\n\\*dep. fed. MA 1951-1952.\n\n \n\n*Benedito de Carvalho Lago* nasceu em Chapadinha (MA) no dia 1º de abril\nde 1904, filho de José Luís Teixeira do Lago e de Elisa Barbosa de\nCarvalho Lago.\n\nFormado pela Escola de Farmácia e Odontologia do Maranhão, foi\ncomerciante e tabelião.\n\nVereador e suplente de deputado à Assembléia Legislativa do Maranhão, no\npleito de outubro de 1950 elegeu-se deputado federal por seu estado na\nlegenda do Partido Social Trabalhista (PST). Assumiu uma cadeira na\nCâmara em fevereiro de 1951, mas em novembro de 1952 afastou-se da\nCâmara, sendo substituído por Antônio Eusébio da Costa Rodrigues. Na\ngestão do governador Eugênio de Barros (1951-1956), esteve à frente da\nSecretaria do Interior e Justiça do Maranhão. Rompendo com o PST,\nafastou-se temporariamente da carreira política e passou a se dedicar às\nsuas indústrias de beneficiamento de algodão e arroz localizadas em\nPedreiras (MA) e em São Luís.\n\nEm 1960, foi eleito prefeito de Bacabal (MA), numa coligação entre a\nUnião Democrática Nacional (UDN) e o Partido Trabalhista Brasileiro\n(PTB).\n\nEm 1965, afasta-se da vida pública, exercendo a atividade de advogado\nprovisionado.\n\nFaleceu em São Luís no dia 1º de abril de 1988.\n\nEra casado com Maria Luísa Pestanha Lago, com quem teve sete\nfilhos.****Sua filha, Lenita Carvalho Belo, casou-se com Newton de\nBarros Belo Filho, filho de Newton Belo, que governou o Maranhão entre\n1961 e 1966.****Seu filho, Eduardo de Carvalho Lago, foi chefe do\nGabinete Civil no governo de Epitácio Cafeteira (1987-1990). Seu\nsobrinho Jackson Lago foi deputado estadual e elegeu-se prefeito de São\nLuís em outubro de 1996.\n\n \n\nFONTES: CÂM. DEP. *Deputados*; CÂM. DEP. *Relação dos dep.*;**CISNEIROS,\nA. *Parlamentares*;**INF. Eduardo de Carvalho Lago; MACEDO, N.\n*Aspectos*;**MEIRELES, M. *História*.\n\n \n","ref":"FONTES: CÂM. DEP. *Deputados*; CÂM. DEP. *Relação dos dep.*;**CISNEIROS,\nA. *Parlamentares*;**INF. Eduardo de Carvalho Lago; MACEDO, N.\n*Aspectos*;**MEIRELES, M. *História*.\n\n \n","dic":"DHBB"}
