{"title":"ABREU, Mário de","cargoss":["Deputado federal"],"cargos_esp":[0],"datas_ini":[1967],"datas_fim":[1971],"estados":["RJ"],"autor":[0],"content":"**ABREU, Mário de**\n\n\\*dep. fed. RJ 1967-1971.****\n\n \n\n*Mário Monteiro de Abreu Pinto*****nasceu no Rio de Janeiro, então\nDistrito Federal, no dia 30 de janeiro de 1914, filho de Augusto\nMonteiro de Abreu Pinto e de Laura da Silva Resende Pinto.\n\nEngenheiro civil e eletricista formado pela Escola Politécnica, hoje\nFaculdade de Engenharia da Universidade Federal do Rio de Janeiro,\nelegeu-se em 1958 deputado à Assembléia Legislativa do estado do Rio na\nlegenda do Partido Social Democrático (PSD). Candidato à reeleição em\noutubro de 1962, ficou na primeira suplência da bancada de seu partido.\n\nFoi secretário estadual de Comunicação e Transportes e de Energia\nElétrica e Desenvolvimento Econômico, além de diretor da Companhia\nNacional de Álcalis. Em novembro de 1966, já na legenda da Aliança\nRenovadora Nacional (Arena), partido de sustentação ao regime militar\ninstalado no país em abril de 1964, elegeu-se deputado federal pelo\nestado do Rio, cumprindo o mandato de fevereiro de 1967 a janeiro de\n1971. Após deixar a Câmara dos Deputados, retirou-se da vida pública e\npassou a viver de sua aposentadoria.\n\nMário de Abreu foi ainda presidente da 5ª Região do Conselho Regional de\nEngenharia e Arquitetura (CREA).\n\nFaleceu na cidade do Rio de Janeiro, em 27 de agosto de 1997.\n\nSolteiro, não teve filhos.\n\n \n\nFONTES: CÂM. DEP. *Deputados*; CÂM. DEP. *Deputados brasileiros.\nRepertório* (1967-1971); INF. FAM.\n\n \n","ref":"FONTES: CÂM. DEP. *Deputados*; CÂM. DEP. *Deputados brasileiros.\nRepertório* (1967-1971); INF. FAM.\n\n \n","dic":"DHBB"}
