{"title":"LAGO, Wagner","cargoss":["Deputado federal","Constituinte"],"cargos_esp":[0,0],"datas_ini":[1983,1987],"datas_fim":[1991,1988],"estados":["MA",0],"autor":[0],"content":"**LAGO, Wagner**\n\n\\* dep. fed. MA 1983-1991; const. 1987-1988.\n\n \n\n*Ricardo Wagner de Carvalho Lago*nasceu em Pedreiras (MA) no dia 15 de\nfevereiro de 1944, filho de José Ribamar de Carvalho Lago e de Neuza\nGarcez Lago.\n\nBacharel em ciências jurídicas e sociais pela Faculdade de Direito de\nSão Luís, foi advogado e promotor de Justiça na capital maranhense até\n1982, quando se desincompatibilizou do cargo para concorrer a mandato\neletivo. Ligado ao grupo do deputado Epitácio Cafeteira, ingressou na\npolítica com a filiação ao Partido do Movimento Democrático Brasileiro\n(PMDB), em cuja legenda concorreu e foi eleito deputado federal no\npleito de novembro desse ano, com principal base eleitoral no município\nde Bacabal. Assumiu a cadeira na Câmara dos Deputados em fevereiro do\nano seguinte e passou a integrar,****como titular, a Comissão do\nInterior e, como suplente, a Comissão de Constituição e Justiça, além de\nse tornar coordenador da bancada do Maranhão na casa. No Congresso\nNacional, integrou a Comissão Mista de Orçamento.\n\nNo início dessa legislatura, o deputado mato-grossense Dante de Oliveira\n(PMDB-MT) apresentou na Câmara um projeto de emenda constitucional que\nrestabelecia eleições diretas para a presidência da República já no ano\nseguinte. Encampado pelas oposições, o projeto desencadeou uma campanha\nnacional nesse sentido, que ficou conhecida como diretas-já.  Na sessão\nda Câmara dos Deputados do dia 25 de abril de 1984, Wagner Lago votou a\nfavor da emenda, que, por falta de 22 votos, não atingiu a votação\nnecessária ao encaminhamento para apreciação do Senado.\n\nCom esse resultado, ficou decidido que o próximo presidente da República\nainda seria eleito por via indireta. Para concorrer com os candidatos da\nsituação Paulo Maluf  e Flávio Marcílio, os partidos de oposição,\nliderados pelo PMDB, e a Frente Liberal - dissidência da agremiação\ngovernista, o Partido Democrático Social (PDS) -, reunidos na Aliança\nDemocrática, lançaram o então governador de Minas Gerais, Tancredo\nNeves, e o então senador pelo Maranhão, José Sarney, respectivamente,\ncandidatos a presidente e a vice-presidente da República. Na reunião do\nColégio Eleitoral em 15 de janeiro de 1985, Wagner Lago votou em\nTancredo, que derrotou Maluf. Na véspera da posse em março, Tancredo\nadoeceu e quem assumiu, interinamente, foi o vice-presidente José\nSarney, até ser efetivado após a morte do titular em 21 de abril desse\nano.   \n\nNo pleito de novembro de 1986, Wagner Lago reelegeu-se deputado federal\nna mesma legenda, como constituinte. Assumiu sua cadeira na Câmara dos\nDeputados no dia 1^º^ de fevereiro de 1987, quando foi instalada a\nAssembléia Nacional Constituinte, em que passou a integrar, como\ntitular, a Subcomissão da União, Distrito Federal e Territórios da\nComissão da Organização do Estado e, como suplente, a Subcomissão do\nPoder Judiciário e do Ministério Público da Comissão da Organização dos\nPoderes e Sistema de Governo.\n\nNa Constituinte, votou a favor do rompimento de relações diplomáticas\ncom países com política de discriminação racial, do mandado de segurança\ncoletivo, da estabilidade no emprego, do turno ininterrupto de seis\nhoras, do aviso prévio proporcional, da soberania popular, do\npresidencialismo, da nacionalização do subsolo, da limitação dos\nencargos da dívida externa, da criação de fundo de apoio à reforma\nagrária, da anistia a micro e pequenos empresários, da desapropriação da\npropriedade produtiva e do mandato de cinco anos para o presidente José\nSarney. Votou contra a pena de morte, o aborto, a jornada semanal de 40\nhoras, a pluralidade sindical, o voto aos 16 anos, a estatização do\nsistema financeiro e a legalização do jogo do bicho.\n\nApós a promulgação da nova Carta no dia 8 de outubro de 1988, passou a\nexercer somente o seu mandato ordinário. Deixou de concorrer à reeleição\nno pleito de outubro de 1990 e concluiu seu mandato no fim de janeiro do\nano seguinte, quando também se encerrou a legislatura. Filiado ao\nPartido Democrático Trabalhista (PDT), no pleito de outubro de 1994\nconcorreu a uma cadeira no Senado por essa legenda, mas não conseguiu se\neleger. \n\nFoi casado com Maria Marta Oliveira Lago, com quem teve dois filhos.\n\n \n\nFONTES: ASSEMB. NAC. CONST. *Repertório*(1987-1988); CÂM. DEP.*Deputados\nbrasileiros. Repertório.*(1983-1987); *Correio Brasiliense* (21/1/1987);\n*Folha de São Paulo* (13/1/1987).\n","ref":"FONTES: ASSEMB. NAC. CONST. *Repertório*(1987-1988); CÂM. DEP.*Deputados\nbrasileiros. Repertório.*(1983-1987); *Correio Brasiliense* (21/1/1987);\n*Folha de São Paulo* (13/1/1987).\n","dic":"DHBB"}
