{"title":"LAGOA, Rocha","cargoss":["Ministro da Saúde"],"cargos_esp":[0],"datas_ini":[1969],"datas_fim":[1972],"estados":[0],"autor":[0],"content":"**LAGOA, Rocha**\n\n\\*min. Saúde 1969-1972.\n\n*Francisco de Paula Rocha Lagoa* nasceu em Ouro Preto (MG) no dia 16 de\noutubro de 1919, filho do médico João Pereira Rocha Lagoa e de Maria\nAmélia d’Abreu Rocha Lagoa. Seu tio, Francisco de Paula Rocha Lagoa\nFilho, foi ministro do Supremo Tribunal Federal (STF) de 1950 a 1960.\n\nFormado em 1940 pela Faculdade Fluminense de Medicina, em Niterói, nesse\nmesmo ano iniciou o curso de aplicação do Instituto Osvaldo Cruz,\nconcluindo-o em 1941. Em 1942 ingressou naquela instituição de pesquisa\ncomo biologista, em caráter interino, sendo efetivado em 1943 mediante\nconcurso. Entre 1944 e início de 1949 foi secretário do instituto, sendo\nneste último ano enviado ao Paraguai em missão científica, encarregado\nde organizar o Instituto de Higiene de Assunção. De volta ao Instituto\nOsvaldo Cruz em 1950, lá permaneceu até 1953, quando, a convite do\ngoverno de Minas Gerais, assumiu a direção do Instituto Ezequiel Dias,\nem Belo Horizonte. Em 1956 retornou mais uma vez ao Instituto Osvaldo\nCruz, sendo nomeado chefe da Seção de Rickettsias da Divisão de\nVirologia. Em 1963 fez o curso da Escola Superior de Guerra (ESG) como\nrepresentante do Ministério da Saúde.\n\nApós o movimento político-militar de 31 de março de 1964, que depôs o\npresidente João Goulart, foi nomeado diretor do Instituto Osvaldo Cruz,\nassumindo o cargo em junho seguinte. Nesse período, em depoimento\nprestado à comissão de inquérito formada para apurar supostas atividades\nsubversivas na instituição, lembrou, segundo o *Jornal do Brasil,* que o\ngrupo de cientistas acusados de subversão havia assinado em 1946 um\ntelegrama de solidariedade a Luís Carlos Prestes, senador pelo Partido\nComunista Brasileiro, então Partido Comunista do Brasil (PCB).\nAcrescentou ainda que esses cientistas gozavam de privilégios na\ninstituição, como melhores condições de trabalho, maior número de\npessoas ligadas às suas pesquisas e material abundante. Ao concluir o\ninquérito, porém, nada de mais grave foi apurado, não tendo ocorrido\nnenhuma punição.\n\nAinda em 1964 tornou-se membro do conselho deliberativo do Conselho\nNacional de Pesquisa (CNPq), como representante do Instituto Osvaldo\nCruz. Em 1966, em viagem aos Estados Unidos, conheceu as principais\ninstituições científicas privadas e oficiais do país. Dois anos depois\nvisitou os mais avançados centros de ciências médicas da Itália, Suíça,\nAlemanha Ocidental, Bélgica, Inglaterra e França. Ainda em 1968\nrepresentou o Brasil no XI Congresso Internacional da Estandartização\nMicrobiológica, realizado em Milão, na Itália, deixando nesse mesmo ano\no conselho deliberativo do CNPq. Segundo o *Jornal do* *Brasil*de 9 de\nmarço de 1978, durante o ano de 1968 Rocha Lagoa tentou encaminhar\nvárias vezes ao então ministro da Saúde, Leonel Miranda, que exerceu o\ncargo entre 1967 e 1969, o pedido de punição para uma relação de\ncientistas do Instituto Osvaldo Cruz, não obtendo êxito em sua\nreivindicação.\n\nFoi empossado no Ministério da Saúde em 30 de outubro de 1969, data da\nposse do general Emílio Garrastazu Médici na presidência da República.\nPara assumir o ministério deixou a direção do instituto e aposentou-se\ndo serviço público. Durante sua gestão, o governo promoveu a cassação\ndos direitos políticos e aposentou compulsoriamente dez pesquisadores do\nInstituto Osvaldo Cruz, uma velha reivindicação sua. Os cientistas\npunidos — entre os quais Haiti Moussatché, Herman Lent, Masao Goto e\nFernando Braga Ubatuba — estavam, em sua maioria, arrolados no inquérito\ninstaurado em 1964. Em junho de 1972 pediu demissão do Ministério da\nSaúde, pressionado pelo governo, depois que o Tribunal de Contas da\nUnião detectou irregularidades na utilização das verbas do ministério.\nFoi substituído por Mário Machado de Lemos.\n\nAinda em 1972 foi contratado pela Johnson & Johnson como consultor\ncientífico da empresa, tornando-se no ano seguinte membro do conselho de\ndesenvolvimento da Pontifícia Universidade Católica (PUC) do Rio de\nJaneiro. Deixou a Johnson & Johnson em 1974, sendo contratado no mesmo\nano pela Silva Araújo-Russel, mais uma vez como consultor científico,\nexercendo essa função até 1976. Fixando residência em Petrópolis neste\núltimo ano, lecionou saúde pública na Faculdade de Ciências Médicas de\nNova Iguaçu (RJ) de 1978 a 1995. Em 1979 passou a integrar o conselho de\npatronos da Universidade Católica de Petrópolis, cargo que ocupava em\njulho de 2000. Em 1990, tornou-se membro do Instituto\nHistórico-Geográfico de Petrópolis e em junho de 1999 foi eleito para a\nAcademia Petropolitana de Letras, sendo empossado um ano depois.\n\nCasou-se com Beatriz Toja Rocha Lagoa, com quem teve um casal de filhos.\n\nPublicou 65 trabalhos nas áreas de imunologia, virologia e saúde pública\nem geral.\n\n \n\nFONTES: *Encic. Mirador*;*Estado de S. Paulo*(29/10/69); *Grande encic.\nDelta*; INF. BIOG.; *Jornal do* *Brasil*(19/2 e 9/3/78).\n\n \n","ref":"FONTES: *Encic. Mirador*;*Estado de S. Paulo*(29/10/69); *Grande encic.\nDelta*; INF. BIOG.; *Jornal do* *Brasil*(19/2 e 9/3/78).\n\n \n","dic":"DHBB"}
