{"title":"LAVINAS, Alberto","cargoss":["Deputado federal","Senador"],"cargos_esp":[0,0],"datas_ini":[1971,1980],"datas_fim":[1979,1980],"estados":["RJ","RJ"],"autor":[0],"content":"**LAVINAS, Alberto**\n\n\\*dep. fed. RJ 1971-1979; sen. RJ 1980.\n\n \n\n*Alberto da Silva Lavinas* nasceu em Três Rios (RJ) no dia 10 de maio de\n1930, filho de Aníbal Peixoto Lavinas e de Nadir da Silva Lavinas.\n\nFormado em 1951 pela Faculdade de Odontologia de Juiz de Fora (MG),\ndedicou-se também ao comércio.\n\nIngressou na política elegendo-se vereador em Três Rios no pleito de\noutubro de 1958 e vice-prefeito do município em 1962. Encerrou o mandato\nde vereador no início de 1963 e, em seguida, assumiu o novo cargo. Em\n1966 elegeu-se prefeito, sendo empossado no cargo no ano seguinte. Em\n1970 desincompatibilizou-se do cargo executivo para candidatar-se à\nCâmara dos Deputados pelo estado do Rio no pleito de novembro daquele\nano. Eleito na legenda do Movimento Democrático Brasileiro (MDB),\npartido de oposição ao regime militar instaurado no país em abril de\n1964, assumiu o mandato em fevereiro de 1971. Na legislatura então\niniciada, integrou a Comissão de Saúde e foi suplente da Comissão de\nTransportes, Comunicações e Obras Públicas da Câmara, tornando-se ainda\nvice-presidente da Comissão de Ciência e Tecnologia em 1973.\n\nReeleito em novembro de 1974, continuou a integrar a Comissão de Ciência\ne Tecnologia da Câmara na legislatura iniciada em 1975. Nesse mesmo ano,\napós a fusão do estado do Rio com o estado da Guanabara, vinculou-se ao\ngrupo político liderado pelo deputado Ário Teodoro, adversário do grupo\nliderado no MDB pelo senador Ernâni Amaral Peixoto. Aderiu então à\ncorrente do ex-governador da Guanabara Antônio de Pádua Chagas Freitas.\n\nMesmo ante a possibilidade de uma reeleição tranqüila, em 1978 Alberto\nLavinas aceitou figurar como suplente na chapa de Amaral Peixoto,\nescolhido senador por via indireta. Essa decisão fazia parte de um\nacordo entre as duas facções do MDB, o qual garantia ao líder de seu\ngrupo, Chagas Freitas, o retorno ao governo do estado do Rio. Assim,\ndeixou a Câmara ao final da legislatura, em janeiro de 1979. Com a\nextinção do bipartidarismo em 29 de novembro deste ano e a conseqüente\nreformulação partidária, filiou-se ao Partido Democrático Social (PDS),\nagremiação sucessora da Aliança Renovadora Nacional (Arena), legenda de\nsustentação do regime militar.\n\nEmpossado senador em junho de 1980, em virtude da licença do titular\nAmaral Peixoto, foi membro da Comissão de Finanças. Deixou o Senado em\noutubro seguinte, com o retorno do titular.\n\nEm 1988, ingressou no Partido Democrático Trabalhista (PDT), liderado\npelo ex-governador do Rio de Janeiro, Leonel Brizola. Nessa legenda,\ncandidatou-se à prefeitura de Três Rios, elegendo-se, no pleito de\nnovembro daquele ano, com 70% dos votos do município. Assumiu seu\nmandato em janeiro de 1989. Fiel ao seu estilo administrativo voltado\npara a execução de obras, Lavinas implantou o serviço de tratamento de\nágua da cidade, construiu cerca de mil casas populares e modernizou ruas\ne avenidas para implantar o novo plano viário da cidade. Além disso,\nconcluiu a avenida Beira-Rio, obra iniciada havia 21 anos e que passou a\nlevar o seu nome.\n\nFaleceu no Rio de Janeiro no dia 2 de fevereiro de 1991.\n\nEra casado com Itaci dos Santos Lavinas, com quem teve cinco filhos.\n\n \n\nFONTES: CÂM. DEP. *Deputados brasileiros. Repertório* (1971-1975 e\n1975-1979); *Jornal do Brasil* (16 e 24/10 e 15/11/78, 3/2/91); NÉRI,\nS.*16*; *Perfil* (1972).\n\n \n","ref":"FONTES: CÂM. DEP. *Deputados brasileiros. Repertório* (1971-1975 e\n1975-1979); *Jornal do Brasil* (16 e 24/10 e 15/11/78, 3/2/91); NÉRI,\nS.*16*; *Perfil* (1972).\n\n \n","dic":"DHBB"}
