{"title":"LEAL, Albanir","cargoss":["Deputado federal"],"cargos_esp":[0],"datas_ini":[1966],"datas_fim":[1967],"estados":["AC"],"autor":[0],"content":"**LEAL, Albanir**\n\n\\*dep. fed. AC 1966-1967.\n\n \n\n*Albanir Leal* nasceu em Eirunepé (AM) no dia 6 de janeiro de 1927,\nfilho do comerciante português Avelino Leal e de Maria Assunção Morais\nLeal. Seu irmão Altevir Leal foi senador pelo Acre de 1975 a 1979 e de\n1983 a 1987.\n\nDepois de fazer os primeiros estudos e o curso secundário em Manaus e\nBelém, ingressou na Faculdade de Medicina da capital paraense, pela qual\ngraduou-se em 1955. Dois anos depois, foi um dos fundadores da\nSuperintendência de Controle Ambiental (Sucam), órgão no qual\ntrabalharia até 1972.\n\nIngressou na carreira política concorrendo a uma cadeira de deputado\nfederal pelo Acre no pleito de outubro de 1962 na legenda do Partido\nSocial Democrático (PSD), mas só obteve uma suplência. Após a vitória do\nmovimento político-militar de 31 de março de 1964 que depôs o presidente\nJoão Goulart (1961-1964), com a extinção dos partidos políticos pelo Ato\nInstitucional nº 2 (27/10/1965) e a posterior instauração do\nbipartidarismo, filiou-se à Aliança Renovadora Nacional (Arena), partido\nde apoio ao regime militar, exercendo o mandato de maio a agosto de\n1966, reassumindo em setembro seguinte. No pleito de novembro desse ano\nobteve nova suplência de deputado federal pelo Acre na legenda da Arena.\nPermaneceu na Câmara dos Deputados até o final de janeiro de 1967,\nquando se encerraram o seu mandato e a legislatura.\n\nFaleceu em 1972.\n\nEra casado com Teresinha Gondim Leal, com quem teve três filhos.\n\n \n\nFONTES: CÂM. DEP. *Deputados*; CÂM. DEP. *Deputados brasileiros.\nRepertório* (1946-1967); TRIB. SUP. ELEIT. *Dados* (1967-1971).\n\n \n","ref":"FONTES: CÂM. DEP. *Deputados*; CÂM. DEP. *Deputados brasileiros.\nRepertório* (1946-1967); TRIB. SUP. ELEIT. *Dados* (1967-1971).\n\n \n","dic":"DHBB"}
