{"title":"ANDRADE, Sebastião ==================","cargoss":["Deputado federal","Deputado federal"],"cargos_esp":[0,0],"datas_ini":[1979,1972],"datas_fim":[1983,1975],"estados":["PA","PA"],"autor":[0],"content":"ANDRADE, Sebastião\n==================\n\n\\* dep. fed. PA 1972-1975, 1979-1983.\n\n \n\n*            Sebastião Andrade*nasceu em Belém no dia 10 de dezembro de\n1928, filho de José Luís de Andrade e de Etelvina Ribeiro de An­drade.\n\n            Engenheiro agrônomo, formado em 1954 pela Faculdade de\nCiências Agrárias do Pará, chefiou a Estação Experimental de Pedreiras -\ndepois Instituto de Pesquisas Agropecuárias do Norte (Ipean) - entre\n1955 e 1960, ao mesmo tempo em que lecionava na Escola de Agronomia da\nAmazônia (1955-1966).  Diretor do Estabele­cimento Rural do Tapajós de\n1964 a 1968, entre 1968 e 1970 presidiu o Conselho Esta­dual de\nAgricultura e a junta administrativa da Associação de Crédito e\nAssistência Rural (ACAR) do Pará, além de integrar o Conselho Rodoviário\nEstadual, o Conselho de Desenvol­vimento do Pará, o Conselho do Fundo de\nDe­senvolvimento Agrário e a diretoria executiva de Trabalho com a\nJuventude. Titular da Secretaria de Estado da Agricultura do Pará em\n1968, no governo de Alacid Nunes (1966-1971), ocupou o cargo até 1970. \n\n            Candidato a deputado federal pelo Pará em novembro de 1970,\nna legenda da Alian­ça Renovadora Nacional (Arena), partido de\nsustentação ao regime militar vigente no país desde abril de 1964,\nobteve a pri­meira suplência. Assessor do presidente do Instituto\nNacional de Colonização e Reforma Agrária (Incra), entre 1971 e 1972,\nfoi convocado, em abril deste último ano, para na qualidade de suplente\nexercer o mandato de deputado federal, ocupando o lugar de Pedro\nCarneiro, falecido neste mesmo mês. Permanecendo na Câmara até 31 de\njaneiro de 1975, neste período exerceu a vice-presidência da Comissão da\nAmazônia e integrou a Comissão de Orçamento da Câmara.\n\n            No pleito de novembro de 1974 tentou novamente se eleger,\nainda na legenda da Arena paraense, obtendo apenas a terceira suplência.\nEncerrando seu mandato em janeiro de 1975, não voltou à Câmara na\nlegislatura seguinte.\n\n            Entre 1975 e 1978, foi diretor presidente da Companhia\nParaense de Mecanização, Industrialização e Comercialização Agropecuária\n(Copagro). Concorreu, nas eleições de novembro de 1978, a uma vaga na\nCâmara dos Deputados, novamente pelo Pará na legenda da Arena. Eleito,\ntomou posse em fevereiro do ano seguinte, integrando a Comissão de\nAgri­cultura e Política Rural da Câmara dos Deputados. Com a aprovação,\nem dezembro deste ano, da Nova Lei Orgânica dos Partidos, que extinguia\no bipartidarismo, ingressou no Partido Democrático Social (PDS),\nagremiação situa­cionista que sucedeu à Arena.\n\n                Funcionário do Ministério da Agricultura, aposentou-se\nem 1982. Nas eleições de novembro do mesmo ano, can­didatou-se à Câmara\ndos Deputados pelo es­tado do Pará, na legenda do PDS, obtendo apenas\numa suplência. Deixou a Câmara dos Deputados em janeiro de 1983, ao\nfinal da legislatura, não mais retornando ao cenário político.\n\n                Em abril de 2000, Sebastião Andrade residia em\nBrasília.   \n\n            Casou-se com Conceição de Maria Medei­ros de Andrade, com\nquem teve quatro filhas.\n\n \n\nFONTES: CÂM.  DEP.  *Deputados,*CÂM.  DEP. *Deputados brasileiros.\nRepertório*(1979-1983); INF. BIOG.; NÉRI, *S. 16; Perfil*(1980); TRIB.\nSUP. ELEIT.  *Da­dos*(9).\n\n               \n","ref":"FONTES: CÂM.  DEP.  *Deputados,*CÂM.  DEP. *Deputados brasileiros.\nRepertório*(1979-1983); INF. BIOG.; NÉRI, *S. 16; Perfil*(1980); TRIB.\nSUP. ELEIT.  *Da­dos*(9).\n\n               \n","dic":"DHBB"}
