{"title":"LEÃO, Luís Cedro Carneiro","cargoss":["Deputado federal","Constituinte"],"cargos_esp":[0,0],"datas_ini":[1921,1934],"datas_fim":[1923,1934],"estados":["PE",0],"autor":[0],"content":"**LEÃO, Luís Cedro Carneiro**\n\n\\*dep. fed. PE 1921-1923; const. 1934.\n\n*Luís Cedro Carneiro Leão* nasceu no Engenho do Cedro, município de Cabo\n(PE), no dia 5 de outubro de 1885, filho de Pedro Carneiro Leão e de\nMinervina Carneiro Leão. Descendia de grandes proprietários rurais.\n\nFez os estudos preparatórios no Ginásio Pernambucano, bacharelando-se em\n1908 pela Faculdade de Direito de Recife.\n\nAgricultor e advogado, viveu alheio às lutas políticas até que, após\nrecusar por diversas vezes convite para assumir o cargo de\nprocurador-geral de seu estado, aceitou a indicação do governador José\nBezerra para integrar a chapa de deputados federais para a legislatura\nde 1921 a 1923, para a qual foi eleito. Nessa época, participou da\nReação Republicana, movimento que promoveu a candidatura de Nilo Peçanha\nà presidência da República em oposição à de Artur Bernardes, afinal\neleito em março de 1922. Participou da campanha da Aliança Liberal\n(1929-1930) através de colaborações para o jornal *Diário da Manhã.*\n\nApós a Revolução de 1930, elegeu-se, em maio de 1933, deputado à\nAssembléia Nacional Constituinte na legenda do Partido Social\nDemocrático (PSD) de seu estado. Empossado em novembro desse mesmo ano,\nparticipou dos trabalhos constituintes e, com a promulgação da nova\nCarta em 16 de julho de 1934 e a eleição do presidente da República no\ndia seguinte, teve o mandato prorrogado, assim como os demais deputados,\naté maio de 1935.\n\nJornalista e escritor, trabalhou no *Diário* *de Pernambuco,*no *Jornal\nPequeno*e em outros órgãos pernambucanos, bem como na revista\n*Ilustração Brasileira*, do Rio de Janeiro.\n\nCasou-se com Júlia Solano Carneiro Leão.\n\nFONTES: ASSEMB. NAC. CONST. 1934. *Anais* (1); CÂM. DEP.*Deputados; Câm.\nDep.* *seus componentes;*GODINHO, V. *Constituintes; Ilustração\nBrasileira*(11/22).\n\n \n","ref":"FONTES: ASSEMB. NAC. CONST. 1934. *Anais* (1); CÂM. DEP.*Deputados; Câm.\nDep.* *seus componentes;*GODINHO, V. *Constituintes; Ilustração\nBrasileira*(11/22).\n\n \n","dic":"DHBB"}
