{"title":"LEDOUX, Albert","cargoss":["Representante de classe"],"cargos_esp":["França no Brasil"],"datas_ini":[1942],"datas_fim":[1943],"estados":[0],"autor":[0],"content":"**LEDOUX, Albert**\n\n\\*diplomata francês; repr. França no Brasil 1942-1943.\n\n*Albert Frédéric Edmond Ledoux* nasceu em Sheffield, na Inglaterra, no\ndia 5 de junho de 1901, filho de Édouard Ledoux e de Marie Villaret\nLedoux.\n\nEstudou inicialmente na Inglaterra, onde cursou o Bowdon College e o\nBrighton College. Em seguida, na França, freqüentou o Lycée\nJanson-de-Sailly, em Paris, e a École de Hautes Études Commerciales.\n\nIngressando na carreira diplomática, foi adido em Constantinopla,\nIstambul, em 1927, e secretário no Rio de Janeiro, então Distrito\nFederal, em 1928. De volta à França, permaneceu no Ministério das\nRelações Exteriores, em Paris, de 1930 a 1932, ano em que se casou com\nGeneviève Birot, com quem viria a ter um filho. Em seguida, foi\nsecretário em Madri, Bruxelas, na Bélgica, e Montevidéu.\n\nEm 1940, durante a Segunda Guerra Mundial, demitiu-se e aderiu à França\nLivre (governo francês no exílio). De 1940 a 1942, foi representante\npessoal do general Charles de Gaulle para a América do Sul,\ninstalando-se em Montevidéu. Em março de 1942, foi nomeado representante\nno Rio de Janeiro do Comité Français de Libération Nationale (Comitê\nFrancês de Libertação Nacional), sediado em Londres. Permaneceu no cargo\naté o ano seguinte, quando foi substituído por Jules Blondel.\n\nDe 1944 a 1945, foi diretor de Pessoal do Ministério das Relações\nExteriores em Argel, na Argélia, e depois em Paris. Foi ainda embaixador\nno Peru (1945-1949) e no Uruguai (1949-1952), antes de chegar a ministro\ndas Relações Exteriores da França, cargo que ocupou entre 1953 e 1954.\nEm 1954 integrou a delegação de seu país ao Conselho Econômico e Social\nda Organização das Nações Unidas (ONU) (Ecosoc — Economic and Social\nCouncil), sediado em Genebra, na Suíça, e à Assembléia Geral da ONU. A\npartir de março de 1955, assumiu a embaixada da França na Noruega, onde\npermaneceu até setembro de 1957. No mês seguinte retornou à França,\npassando a trabalhar na administração central de seu país e assumindo,\nem outubro de 1959, o cargo de conselheiro diplomático do governo\nfrancês. De 1962 a 1966, foi ainda embaixador na Dinamarca.\n\nFONTES: CORRESP. EMB. FRANÇA; *International who’s*\n*who*(1969-1971);*Who’s who in* *France*(1961).\n\n \n","ref":"FONTES: CORRESP. EMB. FRANÇA; *International who’s*\n*who*(1969-1971);*Who’s who in* *France*(1961).\n\n \n","dic":"DHBB"}
