{"title":"LEITE, Armando ==============","cargoss":["Deputado federal"],"cargos_esp":[0],"datas_ini":[1963],"datas_fim":[1967],"estados":["AC"],"autor":[0],"content":"LEITE, Armando\n==============\n\n\\*dep. fed.  AC 1963-1967.\n\n \n\n*Armando Leite*nasceu em 20 de fevereiro de 1924, em Boca do Acre (AC),\nfilho de Antônio Leite da Fonseca e Castro e de Cecília Uchoa Leite.\n\n   Estudou no Colégio Dom Bosco, em Manaus, ingressando posteriormente\nna Faculdade Nacional de Medicina, no Rio de Janeiro, então Distrito\nFederal, pela qual se graduou em 1949. Dois anos depois, ingressou na\nPolícia Militar do Distrito Federal como tenente-médico.\n\nTransferindo-se para o Acre, no início da década de 1960 trabalhou na\nestruturação e no atendimento de postos médicos ao longo da rodovia\nfederal Brasília-Rio Branco, então em construção.  \n\nEleito deputado federal pelo Acre no pleito de outubro de 1962 na\nlegenda do Partido Social Democrático (PSD), cumprindo o mandato a\npartir de fevereiro de 1963, o que o levou a deixar a polícia. Com a\nextinção dos partidos políticos pelo Ato Institucional nº. 2\n(27/10/1965) e a posterior instauração do bipartidarismo, filiou­-se à\nAliança Renovadora Nacional (Arena), partido de sustentação do regime\nmilitar instaurado no país em abril de 1964.  No pleito de novembro de\n1966 obteve a segunda suplência de deputado fede­ral pelo Acre na\nlegenda da Arena, deixando a Câmara ao final da legislatura, em janeiro\nde 1967, não mais retornando ao cenário político.\n\nEm 1967, aposentou-se como tenente-coronel-médico da Polícia Militar do Rio de Janeiro.\n---------------------------------------------------------------------------------------\n\nEm maio de 2000, Armando Leite residia no Rio de Janeiro.\n---------------------------------------------------------\n\nFoi casado com Clóris Souto Leite, com quem teve uma filha. Divorciado,\ncontraiu segundas núpcias com Maria Helena Vebler de Abreu, com quem\nteve uma filha.\n\n \n\nFONTES:  CÂM. DEP. *Anais*;**CÂM. DEP. *De*­*putados*; CÂM.\nDEP.*Deputados brasileiros. Repertório*(1946-1967); INF. BIOG.; TRIB.\nSUP. ELEIT. *Dados*(**6 e 8).\n\n \n\n \n","ref":"FONTES:  CÂM. DEP. *Anais*;**CÂM. DEP. *De*­*putados*; CÂM.\nDEP.*Deputados brasileiros. Repertório*(1946-1967); INF. BIOG.; TRIB.\nSUP. ELEIT. *Dados*(**6 e 8).\n\n \n\n \n","dic":"DHBB"}
