{"title":"LEITE, Bezerra","cargoss":["Deputado federal"],"cargos_esp":[0],"datas_ini":[1959],"datas_fim":[1967],"estados":["PE"],"autor":[0],"content":"**LEITE, Bezerra**\n\n\\*jornalista; dep. fed. PE 1959-1967.\n\n*Edgar Bezerra Leite* nasceu em Bonito (PE) no dia 11 de janeiro de\n1914, filho de Aristides Bezerra Leite e de Maria Amélia Bezerra Leite.\n\nDiplomado em engenharia química, foi diretor do Serviço de Fiscalização\nBromatológica de Pernambuco e pertenceu ao Instituto de Pesquisa\nAgronômica, lecionando ainda na Escola Superior de Agricultura de\nRecife. Jornalista, ocupou também o cargo de redator-chefe do *Correio\ndo Povo,*de Recife, do qual era proprietário.\n\nNo pleito de outubro de 1954 elegeu-se deputado à Assembléia Legislativa\nde Pernambuco na legenda do Partido Trabalhista Brasileiro (PTB),\niniciando o mandato em fevereiro do ano seguinte. Em outubro de 1958\nelegeu-se deputado federal por seu estado na legenda da coligação\nOposições Unidas de Pernambuco, formada pelo PTB, a União Democrática\nNacional (UDN), o Partido Social Progressista (PSP), o Partido\nTrabalhista Nacional (PTN) e o Partido Socialista Brasileiro (PSB).\nDeixando a Assembléia em janeiro de 1959, assumiu o mandato na Câmara\nFederal em fevereiro seguinte e, em outubro de 1962, reelegeu-se\ndeputado federal mais uma vez na legenda do PTB.\n\nCom a extinção dos partidos políticos pelo Ato Institucional nº 2\n(27/10/1965) e a posterior instauração do bipartidarismo, filiou-se à\nAliança Renovadora Nacional (Arena), partido de sustentação do regime\nmilitar instalado no país em abril de 1964. Por essa legenda tentou\nreeleger-se no pleito de novembro de 1966, obtendo porém apenas uma\nsuplência. Em janeiro de 1967 deixou a Câmara dos Deputados e, em abril\nde 1969, teve os direitos políticos suspensos por dez anos em\ndecorrência do Ato Institucional nº 5 (13/12/1968).\n\nCasou-se com Geni Bezerra Leite, com quem teve quatro filhos.\n\nPublicou *Noções de alimentação, Rumos* *industriais da mandioca*e\n*Tecnologia do couro.*\n\nFONTES: ARQ. DEP. PESQ. JORNAL DO BRASIL; CÂM. DEP. *Deputados\nbrasileiros.* *Repertório*(1967-1971); COUTINHO, A. *Brasil;*\nTRIB.**SUP. ELEIT. *Dados*(3, 4, 6 e 8).\n\n \n","ref":"FONTES: ARQ. DEP. PESQ. JORNAL DO BRASIL; CÂM. DEP. *Deputados\nbrasileiros.* *Repertório*(1967-1971); COUTINHO, A. *Brasil;*\nTRIB.**SUP. ELEIT. *Dados*(3, 4, 6 e 8).\n\n \n","dic":"DHBB"}
