{"title":"LEITE, Cláudio","cargoss":["Deputado federal","Deputado federal"],"cargos_esp":[0,0],"datas_ini":[1971,1958],"datas_fim":[1975,1958],"estados":["PB","PB"],"autor":[0],"content":"**LEITE, Cláudio**\n\n\\*dep. fed. PB 1958 e 1971-1975.\n\n* *\n\n*Cláudio de Paiva Leite* nasceu na cidade da Paraíba, atual João Pessoa,\nentão no dia 14 de julho de 1923, filho de João Batista Leite de Araújo\ne de Liliosa de Paiva Leite. Seu irmão, Cleanto de Paiva Leite, fez\nparte da assessoria econômica da Presidência da República de 1951 a\n1954, durante o segundo governo constitucional de Getúlio Vargas.\n\nBacharel em ciências jurídicas e sociais pela Faculdade de Direito de\nAlagoas em 1953, dirigiu o Serviço Social do Comércio (Sesc) e o Serviço\nNacional de Aprendizagem Comercial (Senac). Representante do Instituto\nBrasileiro de Administração Municipal (IBAM) e membro da junta\ngovernativa da Associação Nordestina de Crédito e Assistência Rural\n(ANCAR), além de presidente da Associação dos Criadores, foi vereador e\npresidiu a Câmara Municipal de João Pessoa.\n\nNo pleito de outubro de 1954, na legenda da União Democrática Nacional\n(UDN), tentou eleger-se deputado federal. Obtendo a terceira suplência,\nocupou uma cadeira na Câmara dos Deputados de março a abril e de outubro\na dezembro de 1958. De novo suplente, nas eleições de outubro deste ano,\nnão chegou a exercer o mandato. Em outubro de 1962 ficou em quinto na\nlista dos suplentes.\n\nCom a instauração do bipartidarismo pelo Ato Institucional nº 2\n(27/10/1965) filiou-se à Aliança Renovadora Nacional (Arena), assumindo\na presidência do diretório regional do partido, na Paraíba. No pleito de\nnovembro de 1970 elegeu-se deputado federal, assumindo o mandato em\nfevereiro do ano seguinte. Titular da Comissão de Relações Exteriores e\nsuplente das comissões de Legislação Social e de Constituição e Justiça,\nparticipou do Colégio Eleitoral que elegeu o general Ernesto Geisel\npresidente da República em setembro de 1973.\n\nEm novembro de 1974 concorreu à reeleição, obtendo uma suplência. Deixou\ndefinitivamente a Câmara ao término do mandato, em janeiro de 1975.\n\nDiretor-adjunto da Companhia Brasileira de Entrepostos e Comércio\n(Cobec), em Brasília, de 1975 a 1979, e chefe do escritório da empresa\nem Paris, de 1979 a 1981, de volta ao Brasil assumiu a diretoria\nadministrativa até 1982. De 1985 a 1986 foi chefe de gabinete da\ndiretoria de desenvolvimento urbano do Banco Nacional da Habitação\n(BNH), na gestão do ex-deputado Antônio Mariz. Em 1994, quando Mariz foi\neleito governador da Paraíba, nomeou Cláudio Leite seu chefe de\ngabinete. Todavia, com a morte de Mariz, em setembro de 1995, e a posse\nde seu vice, José Maranhão, Cláudio Leite afastou-se da pasta, voltando\na exercer suas atividades empresariais.\n\nEm outubro de 2009, residia em João Pessoa.\n\nCasou-se com Célia Gomes de Paiva Leite, com quem teve duas filhas.\n\nFONTES: CÂM. DEP. *Deputados brasileiros. Repertório*(1971-1975); INF.\nBIOG.; NÉRI, S.*16*;*Perfil*(1972); TRIB. SUP. ELEIT. *Dados* (3, 4, 6,\n9 e 11).\n\n \n\n \n","ref":"FONTES: CÂM. DEP. *Deputados brasileiros. Repertório*(1971-1975); INF.\nBIOG.; NÉRI, S.*16*;*Perfil*(1972); TRIB. SUP. ELEIT. *Dados* (3, 4, 6,\n9 e 11).\n\n \n\n \n","dic":"DHBB"}
