{"title":"LEITE, Dias ===========","cargoss":["Presidente de associação ou confederação de empregados ou empregadores","Ministro das Minas e Energia"],"cargos_esp":["CVRD",0],"datas_ini":[1967,1969],"datas_fim":[1969,1974],"estados":[0,0],"autor":[0],"content":"LEITE, Dias\n===========\n\n\\*  pres. CVRD 1967-1969; min. Minas e En. 1969-1974.\n\n \n\n*Antônio Dias Leite Júnior*****nasceu no Rio de Janeiro, então Distrito\nFederal, no dia 29 de janeiro de 1920, filho de Antônio Dias Lei­te,\nempresário têxtil, e de Georgeta Lahmeyer Leite. Sua irmã Eulália Maria\nLahmeyer Lobo tornou-se im­portante historiadora.\n\nCursou o secundário no Colégio Anglo-­Americano, no Rio, concluindo-o em\n1935.  No início de 1937 ingressou na Escola Nacio­nal de Engenharia da\nUniversidade do Brasil, pela qual se formou engenheiro civil e mecânico\nem 1941. Em dezembro do mesmo ano viajou aos Estados Unidos para fazer\nestágio em engenharia mecânica e, em seguida, exercer uma função\npermanente de engenheiro na Worthington Pump and Machinery Co. De volta\nao Rio em 1943 em função da declaração de guerra do Brasil à Alema­nha e\nà Itália, foi convocado para o Exército com a patente de\nsegundo-tenente, servindo no cais do porto do Rio de Janeiro como\ntradutor de faturas e manuais de equi­pamentos da Força Expedicionária\nBrasileira (FEB).\n\nNo final de 1944 foi nomeado assessor da primeira Comissão de\nPlanejamento Econômi­co criada no Brasil, vinculada ao Conselho de\nSegurança Nacional, e em 1946 tornou-se pro­fessor assistente das\ncadeiras de estatística, economia política e finanças da Escola de\nEn­genharia, onde se formara.  No mesmo ano, assumiu a chefia da Equipe\nde Renda Nacio­nal da Fundação Getúlio Vargas — grupo en­carregado da\nelaboração das primeiras estima­tivas sobre a renda nacional realizada\nno país — da qual participaria até 1949.\n\nNomeado em 1948 professor titular de economia da Faculdade de Ciências\nEconômicas da Universidade do Brasil, mais tarde Universidade Federal do\nRio de Janeiro (UFRJ), ainda nesse ano prestou concurso para\nlivre-docência na Escola Nacional de Engenharia, pela qual se doutorou\nem 1950. Doutorou-se também pela Faculdade de Ciências Econômicas em\n1952, ano em que foi aprovado no concurso para catedrático de economia\ndessa mesma fa­culdade. Paralelamente, assumiu em 1955 o cargo de\ndiretor da Ecotec - Economia e Engenharia Indus­trial S.A. Consultores\n-, fundada por Jorge F. Kafuri, tornando-se posteriormente seu\nvice-presidente. Em 1960 viajou para os Es­tados Unidos como professor\nconvidado da Eisenhower Exchange Fellowships Inc.\n\nEm 1963, durante o governo João Gou­lart, foi subsecretário para\nassuntos econômicos do ministro da Fazenda, Francis­co Clementino de San\nTiago Dantas durante seis meses, até a queda do ministro, ainda no\ngoverno João Goulart.\n\nNo início de 1965, já no governo do general Humberto Castelo Branco —\nguindado à presidência da República, após o movimento político-militar\nde 31 de março de 1964, que afastou João Goulart do poder — Dias Leite\nfoi indicado para integrar o Conselho Consultivo do Pla­nejamento\n(Consplan), órgão criado em março por Castelo Branco com o objeti­vo de\ndebater os problemas relacionados com a política econômica do governo\nestipulada pelo Plano de Ação Econômica do Governo (Paeg), de 1964.  Na\nprimeira sessão do Consplan, realizada em abril de 1965, afirmou que as\nmedidas econômicas adotadas pelo go­verno não correspondiam às\nnecessidades reais do país. Criticou o Paeg, considerando-o\nin­consistente e com objetivos incompatíveis en­tre si. Nessa mesma\nocasião, levantou a ques­tão de que a ajuda proporcionada pelos\ninves­timentos externos no país dependia das deci­sões políticas dos\ngovernos estrangeiros, esca­pando portanto ao controle do governo\nbrasi­leiro.  Nesse sentido, propôs que o capital es­trangeiro fosse\nsubstituído pelo aumento for­çado da propensão à poupança interna, por\numa maior apropriação do Estado sobre os bens produzidos no país e pela\nmaior eficácia do sistema econômico.  Defendeu ainda o con­trole do\nEstado sobre os setores petrolífero, de energia nuclear, de energia\nelétrica, side­rúrgico de minério de ferro e de transportes.\n\nEm fins de 1965 voltou a criticar a políti­ca econômica do governo e\napresentou ao Consplan um programa de ação econômica em face da\nrealidade nacional, de sua autoria. Contudo, tanto as críticas que fez\ncomo o programa que elaborou foram rebatidos pelos demais membros do\nConsplan, entre eles os economistas Antônio Delfim Neto, Glycon de Paiva\ne Roberto Campos, secretário executivo do conselho e então ministro do\nPlanejamento.  Em 1966, a pedido dos ministros Otávio de Bu­lhões, da\nFazenda, e Nei Braga, da Agricultu­ra, elaborou a minuta que se\ntransformaria na Lei de Incentivos ao Reflorestamento.\n\nNa iniciativa privada, trabalhou durante a década de 1960 na Ecotec. Em\n1967, neste escritório, surgiu a iniciativa de se fazer uma empresa de\nreflorestamento, a Aracruz Florestal, logo depois Aracruz Celulose,\nempresa de sociedade aberta que, recém-fundada, comercializou ações na\nBolsa de Nova Iorque, e da qual Dias Leite teve participação desde o\ninício.\n\nEm março de 1967, logo após a posse do marechal Artur da Costa e Silva\nna presidên­cia da República, Dias Leite foi nomeado presidente da\nCompanhia Vale do Rio Doce (CVRD).  Sua administração incentivou\nprincipalmente o se­tor exportador, buscando um contato direto com as\nindústrias consumidoras e entrando em entendimentos com algumas para a\ncons­trução conjunta de usinas de pelotização de minérios. No final de\n1968, deixou a direção da companhia para se tornar ministro das Minas e\nEnergia.\n\n \n\nMinistro das Minas e Energia (1969-1974)\n\n \n\nNomeado ministro das Minas e Energia em janeiro de 1969 pelo presidente\nCosta e Silva, em substituição a José Costa Cavalcan­ti. Nessa ocasião,\ndeixou a Aracruz Celulose. Em maio seguinte, Dias Leite, ao reu­nir-se\ncom o ministro do Planejamento, Hé­lio Beltrão, para instalar uma\ncomissão con­sultiva para o planejamento econômico, afirmou que o\ngoverno não pensava em tomar medidas favoráveis à descentrali­zação da\nPetrobrás.  Referindo-se aos minerais atômicos, acrescentou que as\nalterações que seriam feitas no setor não implicavam a perda do\nmonopólio governamental sobre a utilização do urânio.\n\nÀ frente do ministério, tomou várias medi­das, entre as quais a\nrevogação, em maio de 1969, do Decreto-Lei nº 59.430, de outubro de\n1966, que obrigava os fornecedores de pe­tróleo bruto e derivados à\nPetrobrás a investi­rem parte de suas divisas em atividades especí­ficas\nno país. Tal medida foi justificada pela finalidade de compensar o ônus\nda aplicação de capital a que ficavam obrigados os fornece­dores\nestrangeiros.  Ainda nesse mês, foi assi­nado um decreto pelo presidente\nCosta e Silva ampliando de quatrocentos para dez mil hecta­res as áreas\na serem consignadas a empresas de mineração. Em junho desse ano, o\nministro da Fazenda, Delfim Neto, firmou um emprésti­mo com um consórcio\nbancário da Alemanha Ocidental, visando o desenvolvimento do sis­tema\nenergético brasileiro.\n\nCom o objetivo de incentivar a pesquisa no setor mineral, em agosto\nseguinte, foi criada a Companhia de Pesquisas de Recursos Minerais, que,\nalém de dar apoio aos serviços de campo do Departamento Nacional de\nPesquisas Mine­rais, apoiaria a realização de pesquisas por ter­ceiros,\ncriando condições para o funcionamen­to dessas atividades junto aos\nbancos de de­senvolvimento. Dois anos depois, a Companhia Vale do Rio\nDoce foi autorizada a criar uma subsidiária — a Do­cegeo ­— para\npesquisar outros minerais, princi­palmente na serra de Carajás, no Pará.\n\nEm outubro de 1969, o general Emílio Garrastazu Médici foi empossado na\npresidên­cia da República, em substituição ao marechal Costa e Silva,\nafastado por problemas de saú­de em agosto anterior, e Dias Leite foi\nmanti­do na pasta das Minas e Energia.  Ainda em 1969, foram lançadas as\nbases que conduzi­ram ao acordo para o aproveitamento do rio Paraná, no\nlocal previsto para a futura insta­lação da usina hidrelétrica de\nItaipu.\n\nCom relação às pesquisas no campo da energia nuclear, foi criada em\ndezembro de 1971, pela Lei nº 5.740, a Companhia Brasi­leira de\nTecnologia Nuclear, encarregada de executar  pesquisas nessa área,\nreservando à Comissão Nacional de Energia Nuclear as funções de natureza\npolítica.\n\nNo setor petrolífero, foi feita uma revisão dos planos de pesquisa de\npetróleo pela Petro­brás. Ainda no final de 1971, foi proposto um plano\nque envolvia: 1) o incentivo às ativida­des de pesquisa pela Petrobrás,\ndando maior ênfase aos gastos com a busca de novas áreas produtoras no\npaís; 2) a criação de subsidiárias da Petrobrás no exterior, associadas\na em­presas locais; 3) o convite a empresas estran­geiras especializadas\nem pesquisa petrolífera para reforçar as tarefas da Petrobrás, através\nde contratos de prestação de serviço com cláu­sula de risco.  Na\nocasião, os contratos de risco foram vetados pelo presidente da\nPetrobrás, general Ernesto Geisel, apoiado pelo ministro do Exército,\ngeneral Orlando Geisel.  Contudo, esses contratos viriam a ser firmados\npelo pró­prio general Ernesto Geisel, quando presiden­te da República,\nem 1975.\n\nOs estudos sobre o rio Tocantins, em Tu­curuí (PA), tiveram início em\nabril de 1972, buscando ali instalar uma fonte geradora de energia\nelétrica que viesse a suprir as necessi­dades surgidas com as\ndescobertas de bauxita e minério de ferro na região.  Em outubro\nseguin­te, foram assinados os decretos-leis nº 71.248 e 1.240, visando a\nestimular as atividades de mi­neração com incentivos à indústria de\ntrans­formação primária de minerais carentes e às empresas de exportação\nde minerais abundan­tes.  Ainda no final do ano consolidaram-se os\nentendimentos entre a Companhia Vale do Rio Doce e a empresa canadense\nAlcan, para desenvolvimento do projeto da bauxita na re­gião do rio\nTrombetas, às quais se associaram mais cinco empresas estrangeiras e o\ngrupo Votorantim.\n\n Terminados os trabalhos de pros­pecção e preparadas as bases para a\nmoderni­zação da indústria carbonífera de Santa Cata­rina em maio de\n1973, foi lançada a licitação para que se implantassem unidades\nmineradoras integradas e mecanizadas na bacia carbonífera da região. Na\nmesma época foi estabeleci­do um entendimento com a Polônia para a troca\nde minério de ferro por carvão metalúr­gico, objetivando diminuir a\ndependência em que se encontrava o setor com relação aos Es­tados\nUnidos.\n\nNo campo da energia elétrica, ainda em maio de 1973, após a assinatura\ndo tratado entre Brasil e Paraguai para a construção da usina de Itaipu,\nfoi enviada ao Congresso uma mensagem, que resultou na Lei nº  5.899,\npro­mulgada em julho do mesmo ano, definindo as condições da usina e a\ndistribuição de sua energia no território nacional.\n\nCom relação ao treinamento e aperfeiçoa­mento do pessoal do ministério,\nfoi organiza­do, durante a gestão Dias Leite, o Plano de Aperfeiçoamento\nde Pessoal de Nível Supe­rior, com dotação específica de verbas para os\ncursos de especialização, que passaram a ser realizados através de\nconvênios com as univer­sidades.  Dias Leite voltou-se também para o\ntrabalho de revisão do Código de Águas e em março de 1974, no fim do\ngoverno do general Médici, deixou a pasta das Minas e Energia, sendo\nsubstituído por Shigeaki Ueki.\n\n \n\nNa Universidade e na iniciativa privada\n---------------------------------------\n\n \n\nNo mesmo mês retornou de Brasília para o Rio de Janeiro e, mais tarde,\nreingressando na UFRJ, passou a exercer funções administra­tivas na\ninstituição e a lecionar na Faculdade de Economia e Administração\n(FEA).  Dedicou-se também a atividades de con­sultoria econômica.\n\nEm 1975 foi convidado por Celso Rocha Miranda, dono da Companhia\nInternacional de Seguros, para fazer uma revisão administrativa em sua\ncompanhia. Essa revisão lhe rendeu, meses depois, a presidência da\ncompanhia, cargo que ocupou por mais de três anos e que o aproximou do\nsetor de seguros, no qual voltou a trabalhar prestando consultoria por\ndiversas vezes.\n\nEm entrevista ao *Jornal do* *Brasil,*publicada em agosto de 1977,\ndefen­deu a \"necessidade de uma nova estrutura po­lítica\", mostrando-se\ncontrário ao sistema par­tidário existente, que considerava inadequado,\ne favorável ao pluripartidarismo como forma de tornar nítidas \"as\npreocupações e posições políticas\" e de evitar os \"extremismos\".\n\nDias Leite teve papel relevante na organização da Fundação Universitária\nJosé Bonifácio, da UFRJ, tendo, em janeiro de 1980, assumido a\npresidência do seu Conselho de Administração. Em abril de 1982 foi\nnomeado diretor da FEA. Foi durante muitos anos colaborador do cader­no\nespecial do *Jornal do Brasil*e da *Folha de* *São Paulo,*e responsável\npela síntese econômi­ca da revista *SPES,*da Pontifícia Universidade\nCatólica (PUC).\n\nEm 1985 se aposentou da FEA, após 40 anos de serviços prestados à UFRJ.\nDois anos depois foi titulado professor emérito daquela universidade.\n\nEm 1994 foi coordenador dos trabalhos de revisão da estrutura do setor\nde seguros privados, na Federação Nacional dos Seguros Privados\n(Fenaseg).\n\nConsultor do Ministério das Minas e Energia sobre a reforma do setor\nelétrico e sobre a questão das usinas térmicas e sua relação com o meio\nambiente durante os anos de 1996 e 1997, ganhou o Prêmio Jabuti de\nLiteratura em 1998, com o livro *A energia do Brasil* (1997), trabalho\nsobre o qual se debruçou por quatro anos.\n\nCasou-se com Manira Alcure Dias Leite, com quem teve seis filhos.\n\nAlém da obra citada, publicou *Renda nacional*(1948),*Teoria* *da\nprodução*(1952), *Caminhos do desenvolvi*­*mento: contribuições para um\nprojeto brasilei*­*ro*(1965), *Política mineral e energética*(1973),\n*Equilíbrio financeiro das empresas de crescimento regular e\ncontinuado*(1976), *Caminhos da reconstrução*(1983), *Uma investigação\nde alternativas de reequilíbrio simultâneo de preços relativos* (1985),\n*A transição para a Nova República* (1985),*Plano Cruzado – esperança e\ndecepção*(1987) e *Em busca de novos caminhos* (1990).\n\n \n\nFONTES: CACHAPUZ,P. *Cronologia;*CURRIC.BIOG.; *Encic.\nMirador,*FI­ECHTER, G. *Regime; Grande encic. Portugue*­*sa;*INF.BIOG.;\nMAGALHÃES, I. *Segundo;*MIN.MINAS E ENERG. *Cor­respondência*; SILVA,\nF.  *His*­*tória;*VIANA FILHO, L. *Governo; Who's who in Brazil.*\n","ref":"FONTES: CACHAPUZ,P. *Cronologia;*CURRIC.BIOG.; *Encic.\nMirador,*FI­ECHTER, G. *Regime; Grande encic. Portugue*­*sa;*INF.BIOG.;\nMAGALHÃES, I. *Segundo;*MIN.MINAS E ENERG. *Cor­respondência*; SILVA,\nF.  *His*­*tória;*VIANA FILHO, L. *Governo; Who's who in Brazil.*\n","dic":"DHBB"}
