{"title":"LEITE, Jorge da Silva","cargoss":["Chefe do Estado-Maior da Armada"],"cargos_esp":[0],"datas_ini":[1958],"datas_fim":[1960],"estados":[0],"autor":[0],"content":"**LEITE, Jorge da Silva**\n\n\\*militar; ch. EMA 1958-1960.\n\n \n\n*Jorge da Silva Leite* nasceu em Petrópolis (RJ) no dia 1º de julho de\n1895, filho de Alfredo Francisco da Silva Leite e de Clotilde Barcelos\nda Silva Leite.\n\nEstudou no Colégio Militar e sentou praça em maio de 1912, ingressando\nna Escola Naval no Rio de Janeiro, então Distrito Federal. Participou da\nPrimeira Guerra Mundial (1914-1918), tendo sido promovido a\nsegundo-tenente em janeiro de 1916. Em 1918 fez o curso de submarinos na\nEscola Profissional da Marinha e, em agosto desse ano, foi promovido a\nprimeiro-tenente. Chegou a capitão-tenente em outubro de 1924 e assumiu\no cargo de chefe da 3ª Seção da Divisão de Hidrografia da Marinha em\noutubro de 1933. Tornou-se capitão-de-corveta em agosto de 1934 e\ncapitão-de-fragata em dezembro de 1942, participando, entre 1944 e 1945,\nda Segunda Guerra Mundial. Foi promovido a capitão-de-mar-e-guerra em\nmaio de 1946, a contra-almirante em março de 1952 e a vice-almirante em\nfevereiro de 1956.\n\nJá depois de ter ocupado os cargos de diretor-geral de Hidrografia e\nNavegação da Marinha e de subchefe do Estado-Maior da Armada (EMA), em\njulho de 1958 foi promovido a almirante-de-esquadra, tornando-se, no mês\nseguinte, chefe do EMA. Permaneceu no cargo durante o governo de\nJuscelino Kubitschek (1956-1961), sucedendo ao almirante-de-esquadra\nJorge Matoso Maia, e, nessa qualidade, foi ministro interino da Marinha\nde novembro a dezembro de 1958 e de julho a agosto de 1959, na gestão de\nMatoso Maia. Deixou o EMA em maio de 1960, sendo substituído pelo\nvice-almirante Heitor Doyle Maia.\n\nDurante sua carreira militar comandou diversos navios e submarinos, além\nda força de contratorpedeiros. Fez cursos superiores na Escola Superior\nde Guerra, presidiu a delegação brasileira à VIII Reunião de Consulta\nsobre Cartografia do Instituto Pan-Americano de Geografia e História,\nrealizada em Cuba, e integrou as delegações brasileiras à VI Assembléia\ndo mesmo instituto, reunida no México, e à VII Conferência do Bureau\nHidrográfico Internacional, realizada em Mônaco. Foi ainda chefe\ninterino do Estado-Maior das Forças Armadas (EMFA).\n\nFaleceu na cidade do Rio de Janeiro, no dia 13 de maio de 1988.\n\nEra casado com Iolanda Eiras da Silva Leite, com quem teve dois filhos.\n\n \n\nFONTES: CORRESP. SERV. DOC. GER. MAR.; COUTINHO, A. *Brasil; Encic.\nMirador; Jornal do Brasil* (17/5/88); MIN. MAR. *Almanaque*(1934, 1936 e\n1961).\n\n \n","ref":"FONTES: CORRESP. SERV. DOC. GER. MAR.; COUTINHO, A. *Brasil; Encic.\nMirador; Jornal do Brasil* (17/5/88); MIN. MAR. *Almanaque*(1934, 1936 e\n1961).\n\n \n","dic":"DHBB"}
