{"title":"LEITE, Josias","cargoss":["Deputado federal"],"cargos_esp":[0],"datas_ini":[1967],"datas_fim":[1987],"estados":["PE"],"autor":[0],"content":"**LEITE, Josias**\n\n\\* dep. fed. PE 1967-1987\n\n \n\n*            Josias Ferreira Leite*nasceu em São José do Egito (PE) no\ndia 17 de novembro de 1929, filho de José Agostinho Leite e de Elídia\nMaria Vidal.\n\n            Bacharelou-se pela Faculdade de Direito do Recife em 1957,\nlicenciando-se três anos depois em geografia e história pela\nUniversidade Católica de Pernambuco. Promotor de justiça e curador de\nmenores indiciados, foi ainda funcionário da Assembléia Legislativa de\nPernambuco e do Instituto de Aposentadoria e Pensões dos Comerciários\n(IAPC).\n\n            Iniciou sua carreira política em 1966, ao se eleger deputado\nfederal por Pernambuco na legenda da Aliança Renovadora Nacional\n(Arena), partido de sustentação do regime militar instalado no país em\nabril de 1964. Assumiu o mandato em fevereiro de 1967. Reelegeu-se em\nnovembro de 1970, sempre na legenda da Arena, tornando-se membro efetivo\ndas comissões de Fiscalização Financeira e Tomada de Contas e da Bacia\ndo São Francisco e suplente das comissões de Orçamento e de Saúde da\nCâmara dos Deputados.\n\n            No pleito de novembro de 1974 voltou a se reeleger na mesma\nlegenda, exercendo a vice-presidência e a presidência da Comissão de\nFiscalização Financeira e Tomada de Contas e tornando-se suplente da\nComissão de Finanças. Em novembro de 1978 reelegeu-se mais uma vez,\niniciando novo mandato em fevereiro do ano seguinte. Com a extinção do\nbipartidarismo em 29 de novembro de 1979 e a conseqüente reformulação\npartidária, filiou-se ao Partido Democrático Social (PDS), legenda que\nsucedeu a Arena em seu apoio ao regime militar. Nesta legislatura,\npermaneceu na Comissão de Fiscalização como vice-presidente e tornou-se\nsuplente da Comissão do Interior.\n\n                Nas eleições de novembro de 1982, foi reeleito à Câmara\ndos Deputados pelo estado de Pernambuco na legenda do PDS.\n\nEm 25 de abril de 1984, esteve ausente da votação da emenda Dante de\nOliveira, que, apresentada na Câmara dos Deputados, propôs o\nrestabelecimento das eleições diretas para presidente da República em\nnovembro daquele ano. Como a emenda não obteve o número de votos\nindispensáveis à sua aprovação – faltaram 22 para que o projeto pudesse\nser encaminhado à apreciação pelo Senado –, no Colégio Eleitoral,\nreunido em 15 de janeiro de 1985, Josias Leite votou no candidato do\nregime militar, Paulo Maluf, que acabou sendo derrotado pelo\noposicionista Tancredo Neves, eleito novo presidente da República pela\nAliança Democrática, uma união do Partido do Movimento Democrático\nBrasileiro (PMDB) com a dissidência do PDS abrigada na Frente Liberal.\nContudo, Tancredo Neves não chegou a ser empossado na presidência, vindo\na falecer em 21 de abril de 1985. Seu substituto foi o vice-presidente\nJosé Sarney, que já vinha exercendo interinamente o cargo desde 15 de\nmarço daquele ano.\n\n                Josias Leite deixou a Câmara dos Deputados em janeiro de\n1987, ao final da legislatura, não tendo se candidatado à reeleição no\npleito de novembro do ano anterior. A partir de então, passou a se\ndedicar exclusivamente à advocacia em seu escritório particular, situado\nem Brasília.\n\n            Casou-se com Zuleide de Siqueira Ferreira Leite.\n\n \n\nFONTES: CÂM. DEP. *Deputados brasileiros. Repertório*(1967-1971,\n1971-1975 e 1975-1979); *Globo* (26/4/84 e 16/1/85); INF.BIOG.; NÉRI, S.\n*16*;*Perfil*(1972 e 1980).\n\n \n","ref":"FONTES: CÂM. DEP. *Deputados brasileiros. Repertório*(1967-1971,\n1971-1975 e 1975-1979); *Globo* (26/4/84 e 16/1/85); INF.BIOG.; NÉRI, S.\n*16*;*Perfil*(1972 e 1980).\n\n \n","dic":"DHBB"}
