{"title":"LEITE, Júlio César","cargoss":["Senador","Senador"],"cargos_esp":[0,0],"datas_ini":[1963,1951],"datas_fim":[1971,1959],"estados":["SE","SE"],"autor":[0],"content":"**LEITE, Júlio César**\n\n** **\\*sen. SE 1951-1959 e 1963-1971.\n\n \n\n*Júlio César Leite* nasceu em Riachuelo (SE) no dia 6 de novembro de\n1896, filho de Francisco Rubens****Leite e de Maria Virgínia Acióli\nLeite. Seu irmão Augusto César Leite foi constituinte em 1934 por\nSergipe e senador pelo mesmo estado de 1935 a 1937.\n\nTransferindo-se para o Rio de Janeiro, então Distrito Federal, estudou\nno Colégio Alfredo Gomes e bacharelou-se em Ciências Jurídicas e Sociais\npela Faculdade Livre de Direito dessa cidade em 1917. De volta a\nSergipe, dedicou-se à advocacia e tornou-se industrial, exercendo também\nas funções de chefe de polícia e de secretário-geral do governo\nestadual.\n\nNo pleito de outubro de 1950 elegeu-se senador por seu estado na legenda\nda coligação formada pelo Partido Republicano (PR), ao qual pertencia, e\no Partido Social Democrático (PSD). Exerceu o mandato de março de 1951 a\njaneiro de 1959, ao longo do qual integrou a Comissão de Finanças, da\nqual foi relator, tendo sido também presidente da Comissão de Economia.\nAlém disso, cursou nesse período a Escola Superior de Guerra.\n\nAinda em 1959, passou a integrar o Conselho Nacional de Economia, tendo\nsido seu vice-presidente de 1959 a 1960, presidente de 1960 a 1961, e\nconselheiro no ano seguinte.\n\nReeleito senador por Sergipe na legenda da mesma coligação em outubro de\n1962, assumiu o mandato em fevereiro de 1963 e licenciou-se por diversas\nvezes, sendo substituído pelo suplente Dílton Costa. Único representante\ndo PR no Senado em 1963 e 1964, foi conseqüentemente líder de seu\npartido, tornando-se em junho deste último ano vice-líder do Bloco\nParlamentar Independente. Foi membro efetivo da Comissão de Legislação\nSocial e suplente da Comissão do Polígono das Secas do Senado, deixando\na casa ao final do mandato, em janeiro de 1971, afastando-se em\ndefinitivo da política.\n\nFaleceu no Rio de Janeiro, no dia 6 de fevereiro de 1990.\n\nEra casado com Maria Carmem da Cruz Prado, com quem teve dez filhos. Seu\nsobrinho José Rollemberg Leite foi governador de Sergipe de 1947 a 1951\ne de 1975 a 1979.\n\n \n\nFONTES: CISNEIROS, A. *Parlamentares*; INF. Ivan Santos Leite; *Jornal\ndo Brasil* (12/2/90); SENADO. *Dados*; SENADO. *Relação*; SENADO.\n*Relação dos líderes*.\n\n \n","ref":"FONTES: CISNEIROS, A. *Parlamentares*; INF. Ivan Santos Leite; *Jornal\ndo Brasil* (12/2/90); SENADO. *Dados*; SENADO. *Relação*; SENADO.\n*Relação dos líderes*.\n\n \n","dic":"DHBB"}
