{"title":"LEITE, Luís Tadeu","cargoss":["Deputado federal"],"cargos_esp":[0],"datas_ini":[1991],"datas_fim":[1995],"estados":["MG"],"autor":[0],"content":"**LEITE, Luís Tadeu**\n\n\\*dep. fed. MG 1991-1995.\n\n*Luís Tadeu Leite* nasceu em Montes Claros (MG) no dia 19 de fevereiro\nde 1953, filho de Pedro Leite Vieira e de Rita Fernandes Medeiros.\n\nComeçou na política pelo movimento estudantil, quando em 1974 iniciou o\ncurso na Faculdade de Direito do Norte de Minas em sua cidade natal. Em\nnovembro de 1976, elegeu-se vereador em Montes Claros na legenda do\nMovimento Democrático Brasileiro (MDB), partido de oposição ao regime\nmilitar instaurado no país em abril de 1964. Empossado na Câmara\nMunicipal em fevereiro de 1977, assumiu a liderança da bancada\nemedebista.\n\nFormado em direito em 1978, com a extinção do bipartidarismo em 29 de\nnovembro seguinte, filiou-se ao Partido do Movimento Democrático\nBrasileiro (PMDB), agremiação oposicionista que sucedeu o MDB. Nessa\nlegenda, foi eleito prefeito de Montes Claros no pleito de novembro de\n1982. Encerrado o mandato de vereador em janeiro de 1983, foi empossado\nna prefeitura de sua cidade natal em março seguinte.\n\nComo prefeito, participou dos seminários Objetivos e Tarefas das\nAdministrações Municipais em Proteção Ambiental em Berlim, em 1986, e\nLíderes Municipais do Nordeste em Washington, no ano de 1987. Deixou o\ncargo em 31 de dezembro de 1988.\n\nElegeu-se deputado federal por Minas Gerais no pleito de outubro de\n1990, sempre na legenda do PMDB, assumindo a cadeira em fevereiro de\n1991. Nesse ano, foi membro da Comissão de Ciência e Tecnologia,\nComunicação e Informática e suplente da Comissão de Constituição e\nJustiça e de Redação.\n\nNa sessão da Câmara dos Deputados de 29 de setembro de 1992, votou a\nfavor da abertura do processo de *impeachment* do presidente Fernando\nCollor de Melo (1990-1992), acusado de crime de responsabilidade por\nter-se envolvido num amplo esquema de corrupção liderado por Paulo César\nFarias, que lhe servira como tesoureiro durante a campanha eleitoral.\nAssumiu interinamente a presidência, tão logo a Câmara aprovou o\nafastamento de Collor, o vice Itamar Franco. Com o processo ainda em\nandamento no Senado, e vislumbrando escassas possibilidades de recuperar\no cargo, Collor apresentou sua renúncia ao mandato, em 29 de dezembro,\nmanobra afinal rejeitada pela mesa da casa. Em seguida, o plenário\naprovou o seu *impeachment* e, em conseqüência, lhe cassou os direitos\npolíticos por oito anos. Com esse resultado, Itamar foi efetivado na\nchefia do Executivo brasileiro.\n\nDurante o mandato, Luís Tadeu Leite foi favorável à criação do Imposto\nProvisório sobre Movimentação Financeira (IPMF), contribuição de 0,25%\nsobre transações bancárias, e do Fundo Social de Emergência (FSE), que\npermitiu ao governo retirar recursos de áreas como saúde e educação.\nVotou contra o fim do voto obrigatório.\n\nDeixou a Câmara dos Deputados em janeiro de 1995 ao final da\nlegislatura, sem ter disputado a reeleição em outubro do ano anterior.\n\nEleito deputado estadual no pleito de outubro de 1998 na legenda do\nPMDB, tornou-se titular da Secretaria de Justiça e Direitos Humanos em\n1º de janeiro do ano seguinte, por ocasião da posse de Itamar Franco no\ngoverno mineiro. Em fevereiro, assumiu o mandato de deputado estadual,\nlicenciando-se em seguida para continuar exercendo o cargo de secretário\nde Justiça. Em 2000 retornou ao seu mandato na Assembléia Legislativa de\nMinas (ALMG) tornou-se vice-líder do governo do Estado. Em 2002,\ndisputou a reeleição e obteve uma suplência. Deixou a ALMG em janeiro de\n2003.\n\nNo pleito de outubro de 2004 candidatou-se a prefeito de Montes Claros e\nfoi derrotado, no segundo turno, por Atos Avelino, do Partido Popular\nSocialista (PPS). Nas eleições de 2006, novamente foi eleito deputado\nestadual. Empossado em janeiro de 2007, foi vice-presidente da Comissão\ndos Direitos Humanos e titular da Comissão de Segurança. Em outubro de\n2008, voltou a candidatar-se a prefeito de Montes Claros. Eleito,\nrenunciou ao mandato de deputado estadual em 31 de dezembro e no dia 1°\nde janeiro de 2009 tomou posse à frente da prefeitura de Montes Claros.\n\nDurante sua vida profissional, foi também professor titular da cadeira\nde direito penal da Faculdade de Direito do Norte de Minas, locutor e\napresentador do programa *Boca no trombone*, na Rádio Sociedade Norte de\nMinas, e correspondente do *Diário de Minas*, de Belo Horizonte, no\nnorte do estado.\n\nCasou-se com Estela Gleide Martins Leite, com quem teve dois filhos.\n\nFONTES: ASSEMB. LEGISL. MG.*Dicionário biográfico*; CÂM.DEP. *Deputados\nbrasileiros. Repertório*(1991-1995);*Folha Online* (26/10/08); *Perfil\nparlamentar*/*IstoÉ*; Portal da ASSEMB. LEGISL. MG.\n","ref":"FONTES: ASSEMB. LEGISL. MG.*Dicionário biográfico*; CÂM.DEP. *Deputados\nbrasileiros. Repertório*(1991-1995);*Folha Online* (26/10/08); *Perfil\nparlamentar*/*IstoÉ*; Portal da ASSEMB. LEGISL. MG.\n","dic":"DHBB"}
