{"title":"LEITE, Sales","cargoss":["Deputado federal"],"cargos_esp":[0],"datas_ini":[1983],"datas_fim":[1987],"estados":["SP"],"autor":[0],"content":"**LEITE, Sales**\n\n\\*dep. fed. SP 1983-1987.\n\n*Antônio Sales Leite* nasceu na cidade de São Paulo no dia 21 de junho\nde 1931, filho de Floriano Leite e de Otília de Camargo Sales Leite.\n\nDurante a década de 1940 fez seus estudos básicos na capital paulista e,\nem 1951, formou-se no curso de contabilidade e administração da Escola\nTécnica de Comércio Álvares Penteado, também em São Paulo.\n\nEm 1952 tornou-se exator da secretaria da Fazenda de São Paulo, cargo\nque exerceria até 1957. Bacharelou-se em ciências econômicas pela\nUniversidade de São Paulo (USP), em 1956. Dois anos depois passou a\ntrabalhar como chefe da divisão de economia da Walita S.A.\nEletro-Indústria, de onde saiu em 1964. Em 1962 realizou estágios e\ncursos no Instituto de Organización y Administración de Empresas, em\nSantiago do Chile. Ainda em 1964 tornou-se gerente-geral de economia e\nfinanças da Wapsa Autopeças S.A. e, três anos depois, passou a acumular\ntambém a função de gerente da Wasa Administração S.A., cargos que\nexerceria até 1970. Em 1968, realizou o curso de administração por\nobjetivos no Management Center do Brasil, em São Paulo.\n\nEm 1970, foi designado chefe do Departamento de Finanças da Companhia\nMetropolitana de Água de São Paulo (Comasp) e, no ano seguinte, assumiu\no cargo de diretor econômico-financeiro do antigo grupo Companhia\nTelefônica Brasileira, função que exerceria até 1973. Em sua gestão\nchefiou a equipe que preparou a viabilidade econômico-financeira do I\nPlano Nacional de um milhão de telefones e, em 1972, foi o representante\nbrasileiro no Seminário sobre Administração de Telecomunicação,\nrealizado em Tóquio.\n\nAinda em 1973 tornou-se presidente da Companhia de Telecomunicações de\nSão Paulo (Telesp), cargo que ocuparia até 1979. Em 1974 assumiu a\npresidência do Instituto Brasileiro de Executivos Financeiros (IBEF) da\nseção São Paulo e a vice-presidência da seção do Rio de Janeiro, tendo\nchefiado a delegação brasileira do instituto no congresso da\nInternational Association of Financial Executives, realizado em 1977 em\nDublin, na Irlanda. Ainda este ano tornou-se presidente da Associação\nBrasileira de Telecomunicações (Telebrasil), função que exerceria até\n1980. Em 1978 assumiu a presidência do conselho consultivo do IBEF e, no\nano seguinte, tornou-se diretor-presidente da Companhia Brasileira de\nAlimentos (Cobal), onde permaneceria até 1982. Em 1980 assumiu a\nvice-presidência da União de Mercados Atacadistas, de onde saiu em 1982.\n\nNo pleito de novembro deste ano, candidatou-se a uma cadeira na Câmara\ndos Deputados por São Paulo, na legenda do Partido Democrático Social\n(PDS). Eleito, assumiu o mandato em fevereiro seguinte, participando dos\ntrabalhos legislativos como membro titular da Comissão de Comunicação e\nsuplente da Comissão de Agricultura e Política Rural.\n\nNa sessão da Câmara de 25 de abril de 1984, votou contra a emenda Dante\nde Oliveira que, apresentada na Câmara dos Deputados, propôs o\nrestabelecimento das eleições diretas para presidente da República em\nnovembro daquele ano. Como a emenda não obteve o número de votos\nindispensáveis à sua aprovação — faltaram 22 para que o projeto pudesse\nser encaminhado à apreciação pelo Senado —, no Colégio Eleitoral,\nreunido em 15 de janeiro de 1985, Sales Leite votou no candidato do\nregime militar, Paulo Maluf, que acabou sendo derrotado pelo candidato\noposicionista Tancredo Neves, eleito novo presidente da República pela\nAliança Democrática, uma união do Partido do Movimento Democrático\nBrasileiro (PMDB) com a dissidência do PDS abrigada na Frente Liberal.\nContudo, por motivo de doença, Tancredo Neves não chegou a ser empossado\nna presidência, vindo a falecer em 21 de abril de 1985. Seu substituto\nno cargo foi o vice José Sarney, que já vinha exercendo interinamente o\ncargo desde 15 de março desse ano.\n\nNo pleito de novembro de 1986, Sales Leite candidatou-se a uma vaga de\ndeputado federal constituinte, na legenda do PDS, mas não logrou êxito,\ndeixando a Câmara em janeiro seguinte, ao término da legislatura.\nAbandonando a vida pública, passou a se dedicar à atividade agropecuária\nem sua fazenda localizada no município de Angatuba (SP).\n\nFaleceu em São Paulo no dia 14 de julho de 2007.\n\nCasou-se com Neide Sales Leite, com quem teve três filhas.\n\nFONTES: ASSEMB. NAC. CONST. *Repertório*(1987); CÂM. DEP. *Deputados\nbrasileiros. Repertório*(1983-1987); *Globo* (26/4/84, 16/1/85); INF.\nBIOG; Portal do IBEF-SP.\n","ref":"FONTES: ASSEMB. NAC. CONST. *Repertório*(1987); CÂM. DEP. *Deputados\nbrasileiros. Repertório*(1983-1987); *Globo* (26/4/84, 16/1/85); INF.\nBIOG; Portal do IBEF-SP.\n","dic":"DHBB"}
