{"title":"LELO, Maia","cargoss":["Deputado federal"],"cargos_esp":[0],"datas_ini":[1955],"datas_fim":[1963],"estados":["SP"],"autor":[0],"content":"**LELO, Maia**\n\n\\*dep. fed. SP 1955-1963.\n\n \n\n \n\n*Arlindo José Maia Lelo* nasceu em Santa Rita, atual Santa Rita do Passa\nQuatro (SP), no dia 16 de outubro de 1903, filho de Afonso Lelo e de\nFrancisca Maia Lelo.\n\nDepois de fazer o curso técnico comercial no colégio Mackenzie, na\ncidade de São Paulo, dedicou-se a atividades empresariais, tornando-se\ndiretor do Sindicato das Serrarias do Estado de São Paulo. Durante o\nprimeiro governo de Ademar de Barros (1947-1951), ocupou a\nvice-presidência do Banco do Estado de São Paulo (Banespa) por oito\nmeses, assumindo a seguir a presidência da instituição. O final de sua\ngestão coincidiu com o término do governo de Ademar, em janeiro de 1951.\n\nIniciou a vida política ao se eleger deputado federal por São Paulo em\noutubro de 1954 na legenda do Partido Social Progressista (PSP),\nagremiação liderada por Ademar de Barros. Empossado em fevereiro do ano\nseguinte, reelegeu-se no pleito de outubro de 1958 na mesma legenda.\nDurante essa legislatura apoiou o governo do presidente Juscelino\nKubitschek (1956-1961), manifestando-se favoravelmente à instalação das\nindústrias automobilística e naval, à ampliação do parque siderúrgico\nnacional e ao ingresso do capital estrangeiro. Foi também partidário da\ntransferência da capital do Rio de Janeiro para Brasília, concretizada\nem abril de 1960, e da construção de rodovias ligando a nova capital ao\nNorte e ao Nordeste do país.\n\nNo decorrer do curto governo de Jânio Quadros (janeiro a agosto de\n1961), fez restrições à política externa independente empreendida pelo\npresidente, aceitando o estabelecimento de relações comerciais do Brasil\ncom todos os países do mundo, inclusive com os do bloco socialista,\ncontanto que o país respeitasse os compromissos assumidos com o bloco\nocidental liderado pelos Estados Unidos. Após a renúncia de Quadros em\n25 de agosto de 1961, votou a favor da Emenda Constitucional nº 4, de 2\nde setembro, que, ao instituir o parlamentarismo no país, permitiu a\nposse do vice-presidente João Goulart no dia 7 do mesmo mês, cujo nome\nfora vetado pelos ministros militares. Posteriormente admitiria o\nretorno do país ao presidencialismo, efetivado através do plebiscito de\njaneiro de 1963.\n\nPartidário do municipalismo, votou a favor da Emenda Constitucional nº\n5, de dezembro de 1961, que delegou aos municípios a competência para\narrecadar o imposto territorial. Defensor de uma reforma agrária em\nmoldes cooperativistas, que incluísse a desapropriação dos latifúndios\nimprodutivos e a prévia indenização em dinheiro aos estrangeiros, foi\ntambém favorável a uma reforma tributária e à criação de um banco\ncentral emissor. Concluiu o mandato em janeiro de 1963, não mais\nretornando à Câmara dos Deputados.\n\nAlém de político, foi também empresário, tendo dirigido diversas firmas\ncomerciais, industriais e imobiliárias. Em São Paulo foi diretor da\nBolsa de Cereais, da Bolsa de Mercadorias e da Associação dos Usineiros\nde Algodão do estado, atuando ainda como presidente do Banco Paulista e\nvice-presidente da Companhia de Cimento Santa Rita. Foi também\nincorporador imobiliário e um dos primeiros construtores de condomínios\nna capital paulista, tendo presidido no Paraná a Companhia Carbonífera\ndo Cambuí.\n\nFaleceu no Rio de Janeiro no dia 2 de abril de 1983.\n\nEra casado com Jaci Ribeiro Lelo.\n\n \n\n \n\n \n\n \n\nFONTES: CÂM. DEP. Deputados; CÂM. DEP. Deputados federais. Inventário;\nCÂM. DEP. Relação dos dep.; CAMPOS, Q. Fichário; Eleitos; SOC. BRAS.\nEXPANSÃO COMERCIAL. Quem; TRIB. SUP. ELEIT. Dados (4 e 5).\n\n \n","ref":"FONTES: CÂM. DEP. Deputados; CÂM. DEP. Deputados federais. Inventário;\nCÂM. DEP. Relação dos dep.; CAMPOS, Q. Fichário; Eleitos; SOC. BRAS.\nEXPANSÃO COMERCIAL. Quem; TRIB. SUP. ELEIT. Dados (4 e 5).\n\n \n","dic":"DHBB"}
