{"title":"LEME, Hugo","cargoss":["Ministro da Agricultura"],"cargos_esp":[0],"datas_ini":[1964],"datas_fim":[1965],"estados":[0],"autor":[0],"content":"**LEME, Hugo**\n\n\\*min. Agric. 1964-1965.\n\n*Hugo de Almeida Leme* nasceu em Piracicaba (SP) no dia 24 de outubro de\n1917, filho de Francisco de Almeida Leme e de Maria Francisca de Almeida\nLeme.\n\nEstudou no Colégio Piracicaba e formou-se engenheiro agrônomo pela\nEscola Superior de Agricultura Luís de Queirós, da Universidade de São\nPaulo, da qual se tornou professor catedrático em 1944 e diretor em\n1960.\n\nEm 16 de junho de 1964 foi nomeado ministro da Agricultura pelo\npresidente Humberto Castelo Branco. O início de sua gestão foi marcado\npela retomada do debate parlamentar sobre a reforma agrária, que fora\nsuspenso pela ocorrência do movimento político-militar de 1964, e pela\nelaboração, na esfera governamental, de uma lei sobre o assunto. As\ndiretrizes da política de desenvolvimento agrícola foram fixadas no\nPrograma de Ação Econômica do Governo (PAEG), sob a direção do ministro\ndo Planejamento e Coordenação Econômica, Roberto Campos, dando\nprioridade à lavoura de subsistência e à grande lavoura, em parte\ndestinada à exportação.\n\nEm setembro de 1964, Hugo Leme adotou várias medidas, como a\nintensificação do uso de adubos, objeto de convênio com a United States\nAgency for International Development (USAID), destinando 37 milhões de\ndólares à compra de fertilizantes. Foi também fortalecido, com a\ncooperação da Aliança para o Progresso, o crédito rural. Por seu turno,\na Carteira Agrícola do Banco do Brasil, dirigida por Severo Gomes,\npassou a financiar produtos básicos, como milho, feijão e arroz: entre\n1964 e 1966, os custeios e financiamentos agrícolas apresentaram um\ncrescimento de 75%.\n\nEm 21 de outubro do mesmo ano o governo apresentou ao Congresso um\nprojeto de lei de reforma agrária e uma emenda alterando parcialmente os\nartigos 141 e 147 da Constituição, para tornar possível a\n“desapropriação da propriedade territorial rural, mediante pagamento da\nprévia e justa indenização em títulos especiais da dívida pública, com\ncláusula de exata correção monetária”. A emenda constitucional tomou o\nnº 10 e foi aprovada em 9 de novembro de 1964, rompendo, no plano\njurídico, com uma tradição de muitas décadas do Poder Legislativo,\nsempre intransigente quanto à indenização prévia em dinheiro.\n\nA lei da reforma agrária foi elaborada por um grupo de assessores da\npresidência, entre os quais Mário Henrique Simonsen e Luís Gonzaga do\nNascimento e Silva, com base em estudos realizados pelo Instituto de\nPlanejamento Econômico e Aplicado (IPEA). Suscitou, como a emenda\nconstitucional, intensos debates no Congresso e fora dele. Notadamente,\nmanifestaram sua oposição frontal às medidas propostas pelo governo o\npresidente da União Democrática Nacional (UDN), deputado Olavo Bilac\nPinto, os governadores Carlos Lacerda, da Guanabara, Ademar de Barros,\nde São Paulo, e José de Magalhães Pinto, de Minas Gerais, e várias\nentidades rurais, inclusive através de um manifesto e de uma proposta de\nmarcha sobre Brasília. A Lei da Reforma Agrária, que tomou o nº 4.504 e\npassou a denominar-se Estatuto da Terra, foi aprovada pelo Congresso em\n30 de novembro de 1964.\n\nEm 1965, ainda durante a gestão de Hugo Leme, o governo, visando a\naplicar uma política de incentivo à boa colheita, adquiriu grandes\nquantidades de arroz, milho e amendoim, o que exigiu um significativo\nesforço de armazenamento. A safra abundante de 1965 inundou o mercado e\ncongestionou portos e ferrovias. Foi necessário que o Banco do Brasil\naumentasse extraordinariamente suas aquisições para sustar a queda dos\npreços.\n\nApós a crise que culminou na edição do Ato Institucional nº 2, em 27 de\noutubro de 1965, o presidente Castelo Branco viu-se na contingência de\npromover uma reformulação ministerial, a fim de reforçar seu governo com\na participação de figuras de prestígio político, entre as quais vários\nmilitares da reserva. Foi o caso da pasta da Agricultura, na qual Hugo\nLeme foi substituído em 18 de novembro de 1965 por Nei Braga, que\nterminava seu mandato de governador do Paraná.\n\nEm 1967, Hugo Leme passou a ser também professor da Escola de Agronomia\nda Faculdade de Ciências Médicas e Biológicas de Botucatu (SP). Foi\nainda presidente da indústria de tratores Valmet do Brasil.\n\nCasou-se com Aglaê de Lurdes Piffer Leme, com quem teve quatro filhos.\n\nFaleceu em 12 de Fevereiro de 1992.\n\nFONTES: CACHAPUZ, P. *Cronologia;*COUTINHO, A. *Brasil;*FIECHTER, G.\n*Regime;* *Súmulas;*VIANA FILHO, L. *Governo.*\n\n \n","ref":"FONTES: CACHAPUZ, P. *Cronologia;*COUTINHO, A. *Brasil;*FIECHTER, G.\n*Regime;* *Súmulas;*VIANA FILHO, L. *Governo.*\n\n \n","dic":"DHBB"}
