{"title":"ABREU, Ovídio de","cargoss":["Presidente de associação ou confederação de empregados ou empregadores","Presidente do Banco do Brasil","Deputado federal"],"cargos_esp":["DNC",0,0],"datas_ini":[1944,1949,1951],"datas_fim":[1946,1950,1967],"estados":[0,0,"MG"],"autor":[0],"content":"**ABREU, Ovídio de**\n\n\\*pres. DNC 1944-1946; pres. Bco. Bras. 1949-1950; dep. fed. MG\n1951-1967.\n\n \n\n*Ovídio Xavier de Abreu* nasceu em Pará de Minas (MG) no dia 28 de\nsetembro de 1898, filho de Alexandre Abreu e Silva, pequeno fazendeiro,\ne de Rosina Amélia Xavier de Abreu.\n\nEstudou no grupo escolar de Pará de Minas, no Externato Professor José\nPereira da Costa e no Instituto Lafayette, no Rio de Janeiro. Obteve\nmais tarde o diploma de técnico em economia e finanças.\n\nIngressou em 1919 no Banco do Brasil, mediante concurso. Ocupou cargos\nem agências do banco em outros estados do país. Permaneceu em Goiás até\n1926, quando retornou ao Distrito Federal, sendo designado em seguida\ngerente do banco em Bajé (RS). Ainda a serviço do Banco do Brasil, fez\nviagens à Inglaterra, ao México e aos Estados Unidos, para o estudo da\norganização de entidades públicas ligadas à economia, às finanças e à\nadministração.\n\nEm fins de 1933, com a nomeação de Benedito Valadares para o cargo de\ninterventor federal em Minas Gerais, foi convidado para as funções de\nchefe de gabinete do novo interventor, como ele, natural de Pará de\nMinas e seu amigo de juventude. Exerceu a chefia do gabinete apenas por\ndois meses, sendo em seguida nomeado secretário de Finanças de Minas\nGerais devido à sua experiência anterior no Banco do Brasil. Assumiu o\nnovo cargo em fevereiro de 1934.\n\nNa qualidade de secretário de Finanças, ocupou interinamente a\ninterventoria no período em que Valadares dela se afastou para poder ser\neleito governador do estado pela Assembléia Constituinte mineira (abril\nde 1935). Em seguida, permaneceu à frente da secretaria até maio de\n1941, e em sua gestão participou dos congressos cafeeiros de 1934 e\n1940, da Conferência de Secretários da Fazenda reunida no Rio de Janeiro\nem 1938 e da Conferência Nacional sobre Assuntos Tributários, realizada\nem 1941.\n\nEm maio de 1941, deixou a Secretaria de Finanças para assumir o cargo de\nsecretário estadual de Interior e Justiça, o qual ocupou até dezembro de\n1944, quando o presidente Getúlio Vargas nomeou-o para a presidência do\nDepartamento Nacional do Café (DNC), no lugar de Jaime Fernandes Guedes.\nEm sua gestão, enfrentou grave crise provocada pela insatisfação dos\ncafeicultores com a política nacional para o produto, o que ficou claro\ndurante o VII Congresso da Lavoura realizado em junho de 1945. Os\nprodutores criticavam o Acordo de Washington, de 1940, o qual fixara\npreços estáveis para o café até 1946. Reivindicavam ainda que o DNC não\nvendesse seus estoques próprios, permitindo o escoamento da produção dos\nfazendeiros, chegando mesmo a defender a própria extinção do\ndepartamento. A crise se aguçou durante a elaboração do Convênio\nCafeeiro de 1945 em São Paulo. Nessa ocasião, entre outras\nreivindicações, a Comissão de Mobilização da Lavoura insistiu no aumento\ndo preço do produto, esbarrando mais uma vez na impossibilidade de\nrevisão dos termos do Acordo de Washington, o que já havia sido tentado\npelo governo brasileiro em junho de 1944.\n\nO impasse persistia quando, com a deposição de Getúlio Vargas\n(29/10/1945), Ovídio de Abreu pediu exoneração da presidência do DNC. No\nano seguinte, o general Eurico Gaspar Dutra, recém-empossado na\npresidência da República, convidou-o a reassumir o cargo, o que aceitou.\nEm sua nova gestão, porém, cuidou praticamente apenas da liquidação do\nórgão, que foi finalmente extinto em junho de 1946.\n\nDe volta a Minas Gerais após a extinção do DNC, Ovídio de Abreu\ndedicou-se aos trabalhos de organização em seu estado do Partido Social\nDemocrático (PSD), do qual havia sido um dos fundadores em abril do ano\nanterior. Em outubro de 1946, foi nomeado diretor da Carteira de\nRedescontos do Banco do Brasil. Tendo ocupado interinamente a chefia de\ngabinete do ministro da Fazenda, Pedro Luís Correia de Castro, assumiu a\npasta, também em caráter interino, entre setembro e novembro de 1948,\npor motivo de doença do titular. Em julho do ano seguinte, foi nomeado\npresidente do Banco do Brasil.\n\nEm fins de 1949, seu nome passou a ser cogitado por setores do PSD\nmineiro — e nacional — para candidato à presidência da República na\nlegenda do partido, no pleito de outubro do ano seguinte. Na sessão da\nCâmara do dia 11 de novembro, João Café Filho afirmou que um dos grupos\npolíticos mineiros que pretendiam apontar o candidato à presidência\ndefendia a sua candidatura. Ainda em novembro, no dia 21, sua indicação\nfoi discutida na reunião do conselho nacional do PSD, e seu nome\nincluído na relação de possíveis candidatos do partido à presidência.\n\nNo início de 1950, enquanto o PSD ainda não se havia definido quanto ao\nnome que apresentaria nas eleições, a União Democrática Nacional (UDN)\nlançou seu candidato, o brigadeiro Eduardo Gomes. Nesse momento,\ncomentou-se que se estabelecera uma aliança entre o PSD e o Partido\nTrabalhista Brasileiro (PTB), a qual apoiaria Ovídio de Abreu para\npresidente e o petebista gaúcho Joaquim Pedro Salgado Filho para vice.\nAfirma-se que Getúlio Vargas prometeu, em abril, apoiar a candidatura de\nOvídio, desde que a vice-presidência coubesse ao PTB e que a maioria do\nPSD e Ademar de Barros o apoiassem.\n\nFinalmente, em maio de 1950, o diretório nacional do PSD definiu-se pela\ncandidatura de Cristiano Machado à presidência. Em junho a coalizão\nentre o PTB e o Partido Social Progressista (PSP), de Ademar, lançou o\nnome do próprio Getúlio Vargas, que conseguiu o apoio de boa parcela do\nPSD. Desse modo, a candidatura do partido se viu consideravelmente\nesvaziada. No pleito de outubro, a presidência foi conquistada por\nVargas, e Ovídio de Abreu, candidato a deputado federal por Minas na\nlegenda do PSD, elegeu-se com a maior votação do estado (43.115 votos).\nEm dezembro de 1950, deixou a presidência do Banco do Brasil, para\nassumir seu mandato na Câmara em fevereiro do ano seguinte.\n\nEm 1952, casou-se com Júlia de Abreu, filha de um comerciante de Araxá\n(MG). Sucessivamente reeleito em 1954, 1958 e 1962, sempre na legenda do\nPSD, em novembro de 1964 tornou-se líder de seu partido na Câmara. Nesse\nínterim, ingressou em 1957 na Faculdade Nacional de Direito, no Rio de\nJaneiro, bacharelando-se em 1961. Realizava assim um projeto que\nalimentava desde a juventude, e que a carreira no Banco do Brasil e na\npolítica haviam impedido. Entre 1959 e 1960, coordenou o setor\nfinanceiro da campanha eleitoral do marechal Henrique Teixeira Lott,\ncandidato à presidência da República apoiado pelo PSD e o PTB.\n\nEm 1961 foi favorável à instituição do parlamentarismo como forma de\npossibilitar a posse de João Goulart na presidência da República. A\npartir de 1962, no entanto, apoiou a antecipação do plebiscito que, em\njaneiro seguinte, restaurou o presidencialismo. Nesse período,\nmanifestou-se partidário de uma reforma agrária cooperativista,\nadmitindo a desapropriação de latifúndios, desde que previamente\nindenizados em dinheiro. Defendeu o monopólio estatal do petróleo, dos\nminérios atômicos e das telecomunicações.\n\nCom a extinção dos partidos políticos pelo Ato Institucional nº 2\n(27/10/1965) e a posterior instauração do bipartidarismo, filiou-se ao\npartido situacionista, a Aliança Renovadora Nacional (Arena), em cuja\nlegenda tornou a reeleger-se deputado federal em novembro de 1966.\nEntretanto, em março de 1967, um mês depois do início da nova\nlegislatura, deixou a Câmara por ter sido nomeado secretário da Fazenda\nde Minas Gerais, na gestão do governador Israel Pinheiro, cargo em que\npermaneceu até 1970, exonerando-se antes do final do mandato do\ngovernador.\n\nFoi diretor da Companhia de Cimento Portland Paraíso em 1972 e,\nanteriormente, diretor do Serviço de Defesa Civil de Minas Gerais.\nDepois de retirar-se da vida pública, fixou residência no Rio de\nJaneiro.\n\nOvídio de Abreu foi autor de inúmeros planos, regulamentações e\ninstruções, publicados em órgãos especializados e na imprensa. Escreveu\ntambém trabalhos sobre economia e finanças, especialmente questões\ntributárias.\n\nFaleceu no Rio de Janeiro no dia 13 de dezembro de 1990.\n\nDo seu casamento com Júlia Santos de Abreu, teve quatro filhos.\n\n*Robert Pechman*\n\n \n\nFONTES: ANDRADE, F. *Relação*; ARQ. GETÚLIO VARGAS; BULHÕES, A.\n*Ministros*; CAFÉ FILHO, J. *Sindicato*; CÂM. DEP. *Deputados*; CÂM.\nDEP. *Deputados* *brasileiros. Repertório*; CÂM. DEP. *Relação dos\ndep*.; CÂM. DEP. *Relação nominal dos senhores*; CAMPOS, Q. *Fichário*;\nCARONE, E. *Estado*; CISNEIROS, A. *Parlamentares*; CONSULT. MAGALHÃES,\nB.; DULLES, J. *Getúlio*; *Encic. Mirador*; ENTREV. BIOG.;*****Globo*\n(14/12/90); *Grand encic. Delta*; *Grande encic. portuguesa;* HIPÓLITO,\nL. *Campanha*; HIRSCHOWICZ, E. *Contemporâneos*; INST. BRAS. CAFÉ;\n*Jornal do Brasil* (14/12/90); MIN. FAZ. *Ministros*; MONTEIRO, F.\n*Banco*; MOURÃO, M. *Dutra*; MUSEU DO BANCO DO BRASIL; *Rev. Arq. Públ.\nMineiro* (12/76), *Rev. Comércio do Café* (12/44); ROQUE, C. *Grande*;\nSOARES, E. *Instituições*; TRIB. SUP. ELEIT. *Dados* (2).\n\n \n","ref":"FONTES: ANDRADE, F. *Relação*; ARQ. GETÚLIO VARGAS; BULHÕES, A.\n*Ministros*; CAFÉ FILHO, J. *Sindicato*; CÂM. DEP. *Deputados*; CÂM.\nDEP. *Deputados* *brasileiros. Repertório*; CÂM. DEP. *Relação dos\ndep*.; CÂM. DEP. *Relação nominal dos senhores*; CAMPOS, Q. *Fichário*;\nCARONE, E. *Estado*; CISNEIROS, A. *Parlamentares*; CONSULT. MAGALHÃES,\nB.; DULLES, J. *Getúlio*; *Encic. Mirador*; ENTREV. BIOG.;*****Globo*\n(14/12/90); *Grand encic. Delta*; *Grande encic. portuguesa;* HIPÓLITO,\nL. *Campanha*; HIRSCHOWICZ, E. *Contemporâneos*; INST. BRAS. CAFÉ;\n*Jornal do Brasil* (14/12/90); MIN. FAZ. *Ministros*; MONTEIRO, F.\n*Banco*; MOURÃO, M. *Dutra*; MUSEU DO BANCO DO BRASIL; *Rev. Arq. Públ.\nMineiro* (12/76), *Rev. Comércio do Café* (12/44); ROQUE, C. *Grande*;\nSOARES, E. *Instituições*; TRIB. SUP. ELEIT. *Dados* (2).\n\n \n","dic":"DHBB"}
