{"title":"LEMOS, Eraldo","cargoss":["Deputado federal","Deputado federal"],"cargos_esp":[0,0],"datas_ini":[1971,1967],"datas_fim":[1975,1968],"estados":["SE","SE"],"autor":[0],"content":"**LEMOS, Eraldo**\n\n\\*dep. fed. SE 1967-1968 e 1971-1975.\n\n*Eraldo Machado de Lemos* nasceu em Brejo Grande (SE) no dia 6 de maio\nde 1922, filho de Manuel Machado de Lemos e de Isaura Machado de Lemos.\n\nIngressando na Faculdade de Ciências Médicas do Rio de Janeiro, em 1943\nrepresentou a União Nacional dos Estudantes (UNE) no Congresso\nPan-Americano de Estudantes, reunido em Santiago do Chile, e em 1945 foi\npresidente da delegação universitária brasileira à Conferência Mundial\nda Juventude, realizada em Londres, e ao Congresso Mundial de\nEstudantes, em Praga, na Tchecoslováquia.\n\nNo pleito de janeiro de 1947 — ano em que se diplomou em medicina —\nelegeu-se suplente de deputado à Assembléia Constituinte de Sergipe na\nlegenda da União Democrática Nacional (UDN), tendo exercido o mandato.\nPecuarista, cursou ainda a Faculdade de Direito de Alagoas,\nbacharelando-se em ciências jurídicas e sociais em 1954. Foi\nmédico-chefe do Instituto de Aposentadoria e Pensões dos Bancários\n(IAPB) na Bahia, médico do Serviço de Assistência Médica Domiciliar e de\nUrgência (SAMDU) e presidente do Instituto de Aposentadoria e Pensões\ndos Comerciários (IAPC) no biênio 1958-1959, além de diretor da\nAssociação Médica Brasileira (AMB) e da Associação Baiana de Medicina.\n\nCom a extinção dos partidos políticos pelo Ato Institucional nº 2\n(27/10/1965) e a posterior instauração do bipartidarismo, filiou-se ao\nMovimento Democrático Brasileiro (MDB), partido de oposição ao regime\nmilitar instalado no país em abril de 1964, e, no pleito de novembro de\n1966, elegeu-se primeiro suplente de deputado federal por Sergipe na\nlegenda desse partido. Ocupou uma cadeira na Câmara dos Deputados de\nagosto de 1967 a janeiro de 1968 e de abril a julho desse ano. Por essa\népoca, deixou o MDB e filiou-se à Aliança Renovadora Nacional (Arena),\nem cuja legenda se elegeu deputado federal por seu estado no pleito de\nnovembro de 1970, assumindo o mandato em fevereiro do ano seguinte.\nParticipou na Câmara das Comissões de Agricultura e Política Rural, de\nSegurança Nacional, de Transportes, Comunicações e Obras Públicas, do\nPolígono das Secas, de Valorização Econômica da Amazônia, de Saúde, de\nOrçamento e da Bacia do São Francisco. No pleito de novembro de 1974,\nelegeu-se segundo suplente de deputado federal por Sergipe na mesma\nlegenda. Deixou a Câmara dos Deputados em janeiro de 1975, não voltando\na exercer mandato.\n\nFoi também procurador do Instituto Nacional de Previdência Social\n(INPS).\n\nCasou-se com Ana Maria de Oliveira Lemos.\n\nFONTES: CÂM. DEP. *Deputados;*CÂM. DEP. *Deputados brasileiros.\nRepertório*(1967-1971 e 1971-1975); NÉRI, S. *16; Perfil*(1972); TRIB.\nSUP. ELEIT. *Dados* (1,**8 e 9).\n\n \n","ref":"FONTES: CÂM. DEP. *Deputados;*CÂM. DEP. *Deputados brasileiros.\nRepertório*(1967-1971 e 1971-1975); NÉRI, S. *16; Perfil*(1972); TRIB.\nSUP. ELEIT. *Dados* (1,**8 e 9).\n\n \n","dic":"DHBB"}
