{"title":"LEOMIL, José de Carvalho","cargoss":["Constituinte","Deputado federal"],"cargos_esp":[0,0],"datas_ini":[1946,1946],"datas_fim":[1946,1951],"estados":[0,"RJ"],"autor":[0],"content":"**LEOMIL, José de Carvalho**\n\n\\*const. 1946; dep. fed. RJ 1946-1951.\n\n* *\n\n*José de Carvalho Leomil* nasceu em Niterói no dia 2 de abril de 1909,\nfilho de José Bonifácio Godfray Leomil e de Evangelina de Carvalho\nLeomil.\n\nEstudou no Colégio Pedro II, no Rio de Janeiro, então Distrito Federal e\nbacharelou-se em ciências jurídicas e sociais pela Faculdade de Direito\nda Universidade do Rio de Janeiro em 1932. Durante sete anos, foi\nfuncionário da Biblioteca Municipal de Niterói. Como advogado, tornou-se\nmembro efetivo do Instituto dos Advogados Fluminenses e conselheiro da\nOrdem dos Advogados do Brasil, seção do Rio de Janeiro.\n\nDepois da Revolução de 1930, ingressou no Partido Republicano Fluminense\n(PRF), pelo qual candidatou-se à Assembléia Constituinte estadual no\npleito de outubro de 1934, quando obteve a primeira suplência da\nlegenda. Assumiu o mandato com a indicação do deputado Arnaldo Tavares\npara o Tribunal de Contas do Estado.\n\nNo pleito de dezembro de 1945, elegeu-se deputado pelo estado do Rio à\nAssembléia Nacional Constituinte na legenda da União Democrática\nNacional (UDN). Assumindo sua cadeira em fevereiro do ano seguinte,\nparticipou dos trabalhos constituintes, e, com a promulgação da nova\nCarta (18/9/1946), exerceu o mandato ordinário, participando da Comissão\nPermanente de Indústria e Comércio da Câmara. No pleito de outubro de\n1950, elegeu-se oitavo suplente de deputado federal pelo Rio de Janeiro,\nsempre na legenda da UDN. Deixando a Câmara em janeiro do ano seguinte,\na ela não mais retornou, embora tenha sido eleito ainda uma vez, no\npleito de outubro de 1954, suplente de deputado federal na mesma\nlegenda.\n\nEm 1º janeiro de 1955, nomeado pelo governador Ernâni Amaral Peixoto\n(1951-1955), assumiu o cargo de primeiro defensor público do estado do\nRio de Janeiro, do qual se aposentou em janeiro de 1963.\n\nJosé Leomil faleceu em Niterói no dia 12 de julho de 1969.\n\nEra casado com Juraci de Oliveira Leomil, com quem teve dois filhos.\n\n \n\nFONTES: CÂM. DEP. *Deputados*; CÂM. DEP. *Relação dos dep*.; *Diário do\nCongresso Nacional*; *Grande encic. Delta*; INF. FAM.; SILVA, G.\n*Constituinte*.\n\n \n","ref":"FONTES: CÂM. DEP. *Deputados*; CÂM. DEP. *Relação dos dep*.; *Diário do\nCongresso Nacional*; *Grande encic. Delta*; INF. FAM.; SILVA, G.\n*Constituinte*.\n\n \n","dic":"DHBB"}
