{"title":"LEONEL, Ataliba","cargoss":["Deputado federal","Revolucionário ou revoltoso"],"cargos_esp":[0,0],"datas_ini":[1926,1932],"datas_fim":[1930,1932],"estados":["SP",0],"autor":[0],"content":"**LEONEL, Ataliba**\n\n\\*dep. fed. SP 1926-1930; rev. 1932.\n\n \n\n*Ataliba Leonel* nasceu em Itapetininga (SP) no dia 15 de maio de 1875.\n\nEstudou no Seminário Episcopal e no Colégio Ateneu Paulista,\nbacharelando-se em ciências jurídicas e sociais pela Faculdade de\nDireito de São Paulo.\n\nProprietário de terras, foi vereador e presidente da Câmara Municipal de\nPiraju (SP) e fundador do diretório político do Partido Republicano\nPaulista (PRP) dessa cidade. Eleito deputado estadual em São Paulo,\npresidiu durante os trabalhos legislativos a Comissão de Obras Públicas\ne Viação da Assembléia. No início dos anos 1920 liderou uma corrente\npolítica do PRP em Palmital (SP) que, durante a realização de um pleito\nmunicipal, entrou em choque com a corrente, também perrepista, dirigida\npor Olavo Egídio de Sousa Aranha. A luta resultou na chacina de 11\noposicionistas na cidade, sendo os criminosos chefiados na ocasião pelo\ncoronel Cândido Dias Melo. Em 1923 realizou-se na cidade de São Paulo\numa sessão do Júri Federal para proceder ao julgamento do crime,\nresultando na absolvição de seus responsáveis.\n\nEntre 1926 e 1930 foi deputado federal por São Paulo, perdendo o mandato\nem outubro desse último ano, em decorrência da vitória da Revolução de\n1930, que depôs o presidente Washington Luís e suspendeu o funcionamento\ndos órgãos legislativos do país. No dia 16 de fevereiro de 1932 assinou\no manifesto de lançamento da Frente Única Paulista (FUP), no qual os\ndois principais partidos desse estado, o PRP e o Partido Democrático\n(PD), proclamavam sua união na luta pela pronta reconstitucionalização\ndo país e pela restituição da autonomia estadual. Em maio desse mesmo\nano participou como representante do PRP, juntamente com Antônio de\nPádua Sales e Altino Arantes, de uma reunião promovida por Pedro de\nToledo, então interventor federal em São Paulo, para discutir uma\npossível composição política no governo estadual. Em seguida, Osvaldo\nAranha, então ministro da Fazenda (1931-1934), enviou de São Paulo um\ntelegrama a Getúlio Vargas, em que denunciava a gravidade da situação\nnaquele estado, alertando que o comércio, as academias e os colégios\niriam aderir ao movimento. Nesse mesmo telegrama afirmou ser favorável a\nque Pedro de Toledo organizasse um governo de frente única, acreditando\nque dessa forma o interventor receberia o apoio integral de Ataliba\nLeonel, Francisco Morato e Paulo de Morais Barros.\n\nCedendo à pressão das forças constitucionalistas, Vargas fez publicar em\n14 de maio de 1932 o decreto que criava uma comissão encarregada de\nelaborar o anteprojeto de Constituição e marcava eleições para o dia 3\nde maio do ano seguinte. Por essa época, entretanto, já se consolidara\nentre os políticos da FUP a idéia de recurso a um levante armado contra\no Governo Provisório como o único caminho possível para alcançar sua\nreivindicação de volta ao estado de direito. O general Isidoro Dias\nLopes e o coronel reformado Euclides de Oliveira Figueiredo coordenavam,\ndesde o início do ano, com a colaboração de Ataliba Leonel, o\nplanejamento militar do movimento. Com a deflagração do conflito no dia\n9 de julho de 1932 e sua posterior derrota em outubro do mesmo ano,\nAtaliba Leonel, juntamente com vários revoltosos, foi levado para o Rio\nde Janeiro, então Distrito Federal, onde permaneceu preso na Casa de\nCorreção durante todo o mês de outubro. Em novembro foi deportado para\nPortugal juntamente com os principais líderes constitucionalistas civis\ne militares.\n\nDe volta ao Brasil já após as eleições de maio de 1933, encontrou em São\nPaulo um grande debate em torno da sucessão ao governo estadual. A\nvitória da Chapa Única por São Paulo Unido — coligação formada pelo PRP,\no PD, a Federação dos Voluntários e a Liga Eleitoral Católica — nas\neleições para a Constituinte havia levado Vargas a iniciar negociações\nvisando a substituição do interventor Valdomiro Castilho de Lima\n(1932-1933) por um civil paulista. Após diversas indicações, chegou-se\nao nome de Armando de Sales Oliveira. Ataliba Leonel, contudo,\nmanifestou-se contrário à Chapa Única, preferindo que o PRP disputasse\nos postos isoladamente. Passou então a dar declarações em favor da\nmanutenção da situação política vigente no estado, fortalecendo a\nposição de Valdomiro de Lima, que não concordava com a indicação de\nArmando Sales. A situação porém caminhou rapidamente para um desfecho\ncontrário à sua posição, com a intervenção de outras autoridades\nfederais, como o general Pedro Aurélio de Góis Monteiro e o interventor\ngaúcho José Antônio Flores da Cunha, francamente favoráveis à entrega do\npoder à Chapa Única.\n\nAtaliba Leonel faleceu em Piraju no dia 29 de outubro de 1934.\n\n \n\n \n\nFONTES: CÂM. DEP. Deputados; Efemérides paulistas; ENTREV. PEIXOTO, A.;\nFIGUEIREDO, E. Contribuição; LEITE, A. História; Personalidades; SILVA,\nH. 1932; SILVA, H. 1933.\n\n \n","ref":"FONTES: CÂM. DEP. Deputados; Efemérides paulistas; ENTREV. PEIXOTO, A.;\nFIGUEIREDO, E. Contribuição; LEITE, A. História; Personalidades; SILVA,\nH. 1932; SILVA, H. 1933.\n\n \n","dic":"DHBB"}
