{"title":"LESSA, Sá","cargoss":["Presidente de associação ou confederação de empregados ou empregadores","Prefeito"],"cargos_esp":["CVRD",0],"datas_ini":[1952,1955],"datas_fim":[1961,1956],"estados":[0,"DF"],"autor":[0],"content":"**LESSA, Sá**\n\n\\*pres. CVRD 1952-1961; pref. DF 1955-1956.\n\n \n\n*Francisco de Sá Lessa*nasceu em Diamantina (MG) no dia 20 de maio de\n1887, filho de Gustavo Soares de Vasconcelos Lessa e de Jacinta de Sá\nLessa.\n\nApós concluir os primeiros estudos em Minas Gerais, transferiu-se para o\nRio de Janeiro, então Distrito Federal, a fim de cursar a Escola\nPolitécnica, pela qual se diplomou em engenharia civil em 1914.\nPermaneceu ligado à escola depois de formado, exercendo aí as funções de\npreparador e assistente.\n\nInspetor-geral de Iluminação do Rio de Janeiro entre 1922 e 1930, foi\nseu diretor-geral de 1940 a 1943. Nesse período substituiu o sistema de\niluminação a gás e com lâmpadas de arco por sistema mais moderno.\n\nCatedrático de química industrial da Escola Politécnica do Rio de\nJaneiro, além de seu diretor por dois períodos consecutivos a partir de\n1951, tornou-se no ano seguinte presidente da Companhia Vale do Rio\nDoce, em substituição a Juraci Magalhães. Permaneceria à frente da\nempresa estatal de mineração até janeiro de 1961, quando foi substituído\npor Eliézer Batista da Silva. No exercício do cargo, dirigiu a comissão\nde vendas e minérios, dedicando-se ao estudo das questões técnicas\nrelativas ao aumento da capacidade de produção, transporte e exportação\ndo minério de ferro de Itabira (MG), bem como da questão comercial\nreferente à colocação desse minério nos mercados consumidores\ninternacionais em condições mais favoráveis.\n\nEnquanto presidente da CVRD, foi nomeado, em 1955, pelo presidente da\nRepública Nereu Ramos, para substituir o prefeito interino do Distrito\nFederal, Eitel de Oliveira Lima, que ocupava o cargo desde a saída de\nAlim Pedro. Exerceu a função até março de 1956, já no início do governo\nde Juscelino Kubitschek, quando foi substituído pelo embaixador\nFrancisco Negrão de Lima. Durante sua breve gestão assinou importantes\nprojetos, dos quais se concretizaram mais tarde o do alargamento da\navenida Atlântica e o da construção da avenida Perimetral e dos túneis\nFreire Alvim e Major Rubens Vaz, em Copacabana. Ordenou ainda o início\ndos estudos para a criação da Companhia do Metropolitano.\n\nDiretor da Itambé — Administração de Bens Próprios em 1972, Sá Lessa foi\nmembro do conselho curador da Universidade do Brasil, atual Universidade\nFederal do Rio de Janeiro (UFRJ), do Conselho Nacional de Pesquisas\n(CNPq), da Liga de Defesa Nacional, da Associação Brasileira de Educação\ne da Fundação Politécnica. Pronunciou conferências sobre tecnologia e,\ncomo representante do Brasil, participou do International Illuminations\nCongress, realizado nos EUA.\n\nFaleceu no Rio de Janeiro no dia 26 de junho de 1977.\n\nEra casado com Déia de Sá Lessa, com quem teve três filhos.\n\nPublicou O ensino moderno da química, Aspectos da cultura americana (em\ncolaboração), O que deve ser o ensino da engenharia no Brasil, A\ndestilação da madeira, Indústrias de nitratos do ácido nítrico e O\nensino moderno de química e a indústria química brasileira.\n\n \n\n \n\nFONTES: CONSULT. MAGALHÃES, B.; CORRESP. GOV. EST. GB; CORTÉS, C.\nHomens; COUTINHO, A. Brasil; Grande encic. Delta; Jornal do Brasil (27 e\n28/7/77): REIS, J. Rio; SOC. BRAS. EXPANSÃO COMERCIAL. Quem; Who’s who\nin Brazil (5).\n\n \n","ref":"FONTES: CONSULT. MAGALHÃES, B.; CORRESP. GOV. EST. GB; CORTÉS, C.\nHomens; COUTINHO, A. Brasil; Grande encic. Delta; Jornal do Brasil (27 e\n28/7/77): REIS, J. Rio; SOC. BRAS. EXPANSÃO COMERCIAL. Quem; Who’s who\nin Brazil (5).\n\n \n","dic":"DHBB"}
