{"title":"LEVY, Artur","cargoss":["Revolucionário ou revoltoso","Presidente de associação ou confederação de empregados ou empregadores"],"cargos_esp":[0,"Petrobras"],"datas_ini":[1922,1954],"datas_fim":[1922,1956],"estados":[0,0],"autor":[0],"content":"**LEVY, Artur**\n\n\\*militar; rev. 1922; pres. Petrobras 1954-1956.\n\n* *\n\n*Artur Levy* nasceu em Cuiabá no dia 8 de outubro de 1902, filho de\nHenrique Levy e de Joselina Castelo Levy.\n\nCursou o Colégio Militar de Barbacena (MG) de 1913 a 1919, ingressando\nno ano seguinte na Escola Militar do Realengo, no Rio de Janeiro, então\nDistrito Federal. Aí participou da Revolta de 5 de Julho de 1922,\nmovimento que deu origem ao ciclo de revoltas tenentistas da década de\n1920. Deflagrado no Rio de Janeiro e em Mato Grosso em protesto contra a\neleição de Artur Bernardes para a presidência da República e as punições\nimpostas aos militares pelo governo Epitácio Pessoa com a prisão do\nmarechal Hermes da Fonseca e fechamento do Clube Militar, o movimento\nfoi prontamente debelado pelas forças federais e, em conseqüência de sua\nparticipação, Artur Levy foi afastado da Escola Militar.\n\nProsseguiu seus estudos de engenharia no Instituto Eletrotécnico e\nMecânico de Itajubá (MG) entre 1923 e 1925. Diplomado engenheiro,\nretomou nesse último ano a Mato Grosso, onde trabalhou na construção da\nprimeira usina hidrelétrica do rio da Casca. Durante a execução dessa\nobra foi encarregado da construção da linha de transmissão da usina até\nCuiabá e da subestação daquela cidade. De 1925 a 1926 chefiou a\nconstrução da rede de distribuição de energia elétrica e água da capital\nmato-grossense, chefiando no ano seguinte as obras destinadas à\nconstrução da estação de bombas para o abastecimento de água de sua\ncidade natal. Exerceu ainda a função de inspetor de luz e água de\nCuiabá, tendo unificado todos os serviços de água e luz da cidade\ndurante o período de 1926 a 1928. Nos dois anos seguintes dedicou-se à\nmedição de terras no sul de Mato Grosso.\n\nCom a vitória da Revolução de 1930, foi anistiado e retornou à vida\nmilitar no posto de primeiro-tenente. Ainda em 1930 fez um estágio de\natualização e revisão do curso de engenharia no 1º Batalhão de\nEngenharia (1º BE), com sede no Rio de Janeiro. De 1931 ao ano seguinte\nserviu no 6º BE, sediado em Aquidauana (MT), onde exerceu interinamente\nas funções de comandante e subcomandante. Comandou também o destacamento\nda unidade encarregada da construção das rodovias Corumbá (MS)-Porto\nSuarez (Bolívia) e Porto Murtinho (MS)-Bela Vista (MS).\n\nServia no Destacamento Néri da Fonseca, em Porto Murtinho, quando, em\njulho de 1932, eclodiu a Revolução Constitucionalista de São Paulo,\nmovimento que se estendeu ao território do atual estado de Mato Grosso\ndo Sul. Participou da repressão aos rebeldes nos combates de Porto\nEsperança, Porto Murtinho e São Roque e tomou parte ainda em todos os\nreconhecimentos aéreos na região, bem como nas operações fluviais a\nbordo dos navios *Oiapoque*e *Pernambuco,*da flotilha de Ladário (MS).\nFoi promovido a capitão no mesmo mês em que eclodiu a revolução, afinal\ndebelada em outubro.\n\nEm 1933 realizou o curso da Escola de Aperfeiçoamento de Oficiais,\nservindo no ano seguinte, e em 1936 como instrutor de oficiais na Escola\nde Armas. De 1937 a 1939 fez o curso da Escola de Estado-Maior, sendo\npromovido a major nesse ínterim, em maio de 1938. Após concluir o curso,\nestagiou durante o ano de 1940 no Estado-Maior do Exército (EME) e no\nestado-maior regional da 3ª Região Militar (3ª RM), sediada no Rio\nGrande do Sul.\n\nTransferido ainda em 1940 para o 2º Batalhão Ferroviário em Rio Negro\n(PR), ali serviu como subcomandante, primeiro-engenheiro e fiscal\nadministrativo. Ainda em 1940 representou seu batalhão no III Congresso\nde Engenharia e Legislação Ferroviária, realizado em Belo Horizonte,\nsendo promovido a tenente-coronel em dezembro do ano seguinte. Durante a\nconstrução do Tronco-Principal-Sul, pelo 2º Batalhão Ferroviário, foi\nsubchefe de uma parte da obra, a estrada de ferro Rio Negro-Caxias (RS).\nRemovido em seguida para o estado-maior-regional da 5ª RM, com sede em\nCuritiba, exerceu a função de chefe de seção de 1941 a 1942. Ainda neste\núltimo ano chefiou o Serviço de Engenharia da 5ª RM, tendo participado\nde todas as obras militares, desapropriações e tombamentos de\nfortificações nos estados do Paraná e de Santa Catarina. Chefiou também\nem 1942 o curso de engenharia do Curso Regional de Aperfeiçoamento de\nOficiais (CRAO/5ª RM), dirigindo ainda o Círculo Militar de Curitiba.\n\nDe volta ao Rio de Janeiro em 1942, foi designado para servir no 1º BE,\nlogo depois transformado em 7º BE, transferindo-se depois para Petrolina\n(PE), que passou a ser sua sede provisória. No 7º BE exerceu a função de\ncomandante da unidade e, nessa condição chefiou a construção da rodovia\nPetrolina-Leopoldina (Parnamirim), do porto fluvial de Petrolina e da\nrede ferroviária do campo de instrução de Engenho Aldeia (PR).\n\nCom a declaração de guerra do governo brasileiro aos países do Eixo em\nagosto de 1942 — já em plena Segunda Guerra Mundial — e a criação da\nForça Expedicionária Brasileira (FEB), para combater ao lado dos países\naliados na Europa, o 7º BE, pertencente à 7ª Divisão de Infantaria (7ª\nDI), iniciou os preparativos para a campanha. Em 1944, Artur Levy\nestagiou durante três meses em Fort Belvoir, nos EUA, como parte do\ntreinamento para a campanha, mas não chegou a seguir para o teatro de\noperações na Itália.\n\nNo CNP\n\nDe volta ao Brasil após o treinamento, serviu no EME como adjunto da 4ª\nSeção no período de 1944 a 1945, freqüentando nessa época o curso de\ntransportes do Exército. Foi também representante do EME no Plano\nRodoviário Nacional, que levou à constituição da comissão responsável\npela elaboração da Lei nº 8.463, de 27 de dezembro de 1945, Lei Joppert\n—, que possibilitou o desenvolvimento da rede rodoviária brasileira.\nAinda em 1945 foi nomeado representante do Ministério da Guerra junto ao\nConselho Nacional do Petróleo (CNP), sendo transferido no ano seguinte\npara a Diretoria de Engenharia como chefe da 2ª Divisão, que passara por\numa reestruturação, cabendo-lhe a direção de todas as comissões\nmilitares da rede, anteriormente sob responsabilidade do EME. Promovido\na coronel em março de 1946, chefiou também a Comissão de Estudos do\nOleoduto Santos-São Paulo-Campinas, do CNP, entre 1946 e 1947.\n\nEm fevereiro deste último ano foi nomeado pelo presidente da República,\nEurico Dutra (1946-1951), membro de uma comissão especial para a\nelaboração de um anteprojeto de legislação sobre o petróleo. A comissão\nera presidida por Odilon Braga e dela também faziam parte os engenheiros\nGlycon de Paiva, Avelino Inácio de Oliveira, Antônio José Alves de Sousa\ne Rui de Lima e Silva. O objetivo básico do anteprojeto era dispor sobre\na concessão do direito de exploração do petróleo a empresas estrangeiras\ne regular a formação de empresas brasileiras para a exploração de\nrefinarias, levando em conta o artigo 153 da Constituição de 1946 e as\ndiretrizes já traçadas pelo CNP. O texto enviado ao Congresso Nacional\nem fevereiro de 1948 determinava como disposições básicas que as jazidas\nde petróleo continuariam no domínio privado da União como bens\ninalienáveis e imprescindíveis; a pesquisa e lavra dessas jazidas seriam\ndeclaradas de utilidade pública e da exclusiva competência da União, o\nmesmo ocorrendo com a refinação do petróleo nacional ou importado e o\ntransporte do mesmo.\n\nO ponto central do anteprojeto referia-se à execução dessas operações\npela União, considerando, em seu texto, duas possibilidades por\nadministração direta ou por via de subordinações e concessões a serem\nexploradas por uma empresa privada, o que assegurava um direito real de\nposse, administração e exploração econômica pelo capital privado. Houve\ngrande resistência no Congresso e os debates em torno do anteprojeto\nchegaram a um impasse quanto ao controle estatal sobre os trustes, ao\ngrau de participação estrangeira, à necessidade de atração de capitais\nestrangeiros para o país e aos prazos das concessões de jazidas, tendo o\nanteprojeto sido arquivado.\n\nArtur Levy permaneceu na Diretoria de Engenharia até 1948, quando foi\nlicenciado do Exército e posto à disposição do Ministério da Viação.\nAinda em 1948 tornou-se membro da comissão dos recursos do Brasil no\nsetor de combustíveis na Missão Abbink, nome pelo qual ficou conhecida a\nComissão Brasileiro-Americana de Estudos Econômicos. Constituída nesse\nano por um grupo de técnicos norte-americanos enviados ao Brasil sob a\ndireção de John Abbink e por um grupo de técnicos brasileiros chefiados\npor Otávio Gouveia de Bulhões, essa comissão mista tinha por objetivo\nanalisar os fatores que tendiam a promover ou a retardar o\ndesenvolvimento econômico brasileiro e retomava o princípio da\ncooperação econômica estabelecido pela Missão Cooke em 1942. O resultado\ndos trabalhos da comissão foram publicados em fevereiro de 1949,\ntornando-se conhecidos como *Relatório Abbink.*\n\nTambém em 1948, Artur Levy assumiu a chefia dos trabalhos de construção\nda rede de oleodutos Santos-São Paulo, da estrada de ferro\nSantos-Jundiaí, função que exerceu até 1952. No ano seguinte passou a\nintegrar a Comissão de Localização da Refinaria de 45 mil barris\ndiários, criada pelo CNP e depois transformada em Comissão de\nLocalização da Refinaria de Cubatão (SP), na Baixada Santista. Designado\nassessor da Comissão Interestadual da Bacia Paraná-Uruguai em 1952, no\nano seguinte assumiu a presidência da Comissão de Estudos da Rede de\nOleodutos Nacionais do CNP, que iniciou seus trabalhos pelo oleoduto\nParanaguá (PR)-Curitiba. Foi também chefe da Comissão de Estudos da Rede\nMilitar de Oleodutos, do Ministério da Guerra, e, no período de 1953 a\n1954, presidiu a I Comissão Especial das Indústrias Petroquímicas, órgão\ndo CNP, chefiando ainda as obras de construção da fábrica de\nfertilizantes de Cubatão.\n\nPresidente da Petrobras\n\nCom a criação da Petrobras em outubro de 1953, Artur Levy foi escolhido\npelo então presidente da República, Getúlio Vargas, para integrar a\nprimeira diretoria da empresa, tornando-se no ano seguinte membro da\nComissão de Incorporação de Bens da empresa, ocasião em que deixou a\nfunção de representante do Ministério da Guerra junto ao CNP.\n\nEm setembro de 1954 substituiu Juraci Magalhães na presidência da\nPetrobras e, durante sua gestão, inaugurou a refinaria Presidente\nBernardes e a fábrica de asfalto, ambas em Cubatão, e a usina\nexperimental de xisto, em Tremembé (SP). Firmou também o contrato de\nmontagem de uma fábrica de fertilizantes, descobriu petróleo na bacia\nAmazônica, iniciou um esquema de reserva de dólares para os programas da\nPetrobras e intensificou as pesquisas de petróleo em território\nbrasileiro. Em 1955 integrou a Comissão de Implantação das Indústrias\nPesadas e presidiu a Associação dos Refinadores Nacionais, entidade que\ncongregava os refinadores de petróleo particulares e estatais. Deixou a\npresidência da Petrobras em 1º de fevereiro do ano seguinte, quando foi\nsubstituído por Janari Nunes. Ainda em 1956 fez o curso da Escola\nSuperior de Guerra (ESG), ao término do qual apresentou a monografia\n*Combustíveis, um grave problema nacional.*\n\nAo retornar ao Exército após o período de licença, serviu na Diretoria\nde Comunicações do Exército, do Departamento Geral de Material Bélico,\ncomo chefe de gabinete, tendo ocupado interinamente o cargo de diretor\npor diversas vezes entre 1957 e 1958. Neste último ano freqüentou o\ncurso de treinamento em problemas de desenvolvimento da Comissão\nEconômica para a América Latina (CEPAL), passando para a reserva em\ndezembro de 1958 na patente de general-de-divisão. Chefiou em seguida a\nconstrução da refinaria Duque de Caxias, em Duque de Caxias (RJ), a\npartir de 1959, e foi presidente da Casa de Mato Grosso de 1960 a 1962.\nCom a entrada em operação da refinaria Duque de Caxias em 1961,\ntornou-se superintendente da mesma, atuando ainda como diretor-técnico\nda Empresa de Construção e Pavimentação de 1963 a 1964.\n\nEm 1964 foi chefe de gabinete da presidência da Petrobras, ocupada então\npelo general Osvino Ferreira Alves, apoiando nessa condição o movimento\npolítico-militar de março desse ano, que derrubou o governo de João\nGoulart (1961-1964). De 1965 a 1967 foi superintendente-geral do\nDepartamento Industrial da Petrobras, tendo participado ainda do VII\nCongresso Mundial do Petróleo, realizado em 1967 na cidade do México,\ncomo chefe da delegação da Petrobras.\n\nPresidente da Associação Brasileira de Normas Técnicas (ABNT), cuja\nestrutura dinamizou de 1967 a 1969, freqüentou em agosto do ano seguinte\no curso de atualização doutrinária da ESG. No campo da iniciativa\nprivada foi diretor da Eletrossiderúrgica (Sibra), em Aratu (BA), de\n1968 a 1973, da Estamparia Metalúrgica Vitória, no Rio de Janeiro, de\n1968 a 1971, e da Betanil Indústrias Químicas, em Alcântara, no\nmunicípio de São Gonçalo (RJ), a partir de 1973, tendo atuado ainda como\nassistente-técnico da Empreendimentos Técnicos de Estradas (Etec) a\npartir de 1974.\n\nTornou-se membro da Associação dos Diplomados da Escola Superior de\nGuerra (ADESG), do Instituto Brasileiro de Petróleo (IBP), do Clube de\nEngenharia e do Clube Militar.\n\nArtur Levy faleceu no Rio de Janeiro no dia 18 de novembro de 1993.\n\nEra casado com Dulce Alves Baeta Levy.\n\nAlém de artigos e conferências sobre a questão energética publicados nas\nrevistas *Petróleo,****Boletim da Associação de* *Engenheiros* e*Boletim\nda ADESG,*publicou*Energia não se importa* (1962).\n\nO arquivo de Artur Levy encontra-se depositado no Centro de Pesquisa e\nDocumentação de História Contemporânea do Brasil (Cpdoc) da Fundação\nGetulio Vargas.\n\n \n\nFONTES: BULHÕES, O*. Margem;*COHN, G. *Petróleo;*CORRESP. PETROBRAS;\nENTREV. BIOG.; *Globo*(23/11/93); MIN. GUERRA. *Almanaque*(1958); REIS,\nA. *Bibliografia nac.*\n\n \n","ref":"FONTES: BULHÕES, O*. Margem;*COHN, G. *Petróleo;*CORRESP. PETROBRAS;\nENTREV. BIOG.; *Globo*(23/11/93); MIN. GUERRA. *Almanaque*(1958); REIS,\nA. *Bibliografia nac.*\n\n \n","dic":"DHBB"}
