{"title":"LIMA FILHO, Leopoldo Cesar de","cargoss":["Consultor-geral da República"],"cargos_esp":[0],"datas_ini":[1960],"datas_fim":[1961],"estados":[0],"autor":[0],"content":"**LIMA FILHO, Leopoldo Cesar de**\n\n\\*consult.-ger. Rep. 1960-1961.\n\n*Leopoldo César de Miranda Lima Filho* nasceu no Rio de Janeiro, então\nDistrito Federal, em 11 de maio de 1916, filho de Leopoldo César de\nMiranda Lima e de Diva de Miranda Lima.\n\nFez seu curso secundário no Colégio Arte e Instrução, concluindo-o em\n1933. Bacharelou-se em ciências jurídicas e sociais pela Faculdade de\nDireito da Universidade do Brasil em 1943.\n\nA partir desse ano, além de exercer a advocacia, atuou como redator da\n*Revista Forense,* dos*Arquivos do Ministério da Justiça e Negócios\nInteriores*e de *Jurisprudência,*editada pelo Departamento de Imprensa\nNacional. Foi também redator-secretário da *Revista de* *Direito\nAdministrativo*e entre janeiro de 1945 e fevereiro de 1946 lecionou\ndireito do trabalho na Faculdade de Direito da Pontifícia Universidade\nCatólica do Rio de Janeiro.\n\nDe setembro de 1949 a agosto de 1950 exerceu o cargo de\nsubsecretário-geral do conselho federal da Ordem dos Advogados do Brasil\n(OAB). Em 1951 passou a servir no gabinete do ministro da Justiça\nFrancisco Negrão de Lima, prestando-lhe colaboração em matéria jurídica.\nPermaneceria nessa função nas gestões subseqüentes, dos ministros\nTancredo Neves, de 1953 a 1954, e Miguel Seabra Fagundes, de 1954 a\n1955.\n\nPor ocasião da assembléia geral da OAB realizada em dezembro de 1952,\nfoi eleito membro do conselho secional dessa entidade no Rio de Janeiro\npara o biênio 1953-1955, tornando-se seu primeiro-secretário em março de\n1953. A partir de 1956 passou a representar o Ministério da Justiça na\nassessoria parlamentar da Presidência da República, exercendo ainda a\nfunção de consultor jurídico daquele ministério de junho a agosto de\n1956, de junho de 1957 a agosto do ano seguinte, e de setembro a outubro\nde 1959. Voltou a servir no gabinete do ministro da Justiça durante a\ngestão de Armando Falcão, de 1959 a 1961.\n\nNesse período, em 1960 deixou de representar o Ministério da Justiça na\nassessoria parlamentar da Presidência, sendo nomeado em outubro\nconsultor-geral da República. No mês seguinte foi eleito presidente do\nprimeiro conselho da seção da OAB em Brasília. Em fevereiro de 1961 foi\nexonerado, a pedido, da consultoria geral da República, e ainda nesse\nano representou a seção da OAB de Brasília na comissão examinadora do\nconcurso para juiz-substituto da Justiça do Distrito Federal.\n\nCasou-se com Maria Helena de Sousa Miranda Lima, com quem teve uma\nfilha.\n\nAlém de seus pareceres como consultor jurídico do Ministério da Justiça,\npublicou artigos e comentários em diversas revistas de direito.\n\nFONTES: CORRESP. CONSULT. GER. REP.; COUTINHO, A. *Brasil.*\n\n \n","ref":"FONTES: CORRESP. CONSULT. GER. REP.; COUTINHO, A. *Brasil.*\n\n \n","dic":"DHBB"}
