{"title":"LIMA, Ari de","cargoss":["Deputado federal"],"cargos_esp":[0],"datas_ini":[1971],"datas_fim":[1975],"estados":["PR"],"autor":[0],"content":"**LIMA, Ari de**\n\n\\*dep. fed. PR 1971-1975.\n\n*Ari de Lima* nasceu em São Sebastião do Paraíso (MG) no dia 10 de\noutubro de 1914, filho de João Emídio de Lima e de Maria Alcina de Lima.\n\nTransferindo-se para o Paraná, foi vereador em Maringá (PR) por oito\nanos a partir de 1963 e ocupou a presidência da Câmara Municipal dessa\ncidade em 1969. No pleito de novembro de 1970, elegeu-se deputado\nfederal pelo Paraná na legenda da Aliança Renovadora Nacional (Arena),\nassumindo o mandato em fevereiro do ano seguinte e integrando, como\nmembro efetivo, a Comissão de Educação e Cultura da Câmara dos\nDeputados. Elegendo-se décimo-segundo suplente de deputado federal pelo\nParaná em novembro de 1974, sempre na legenda da Arena, deixou a Câmara\nem janeiro de 1975, e não mais voltou a exercer mandato.\n\nCasou-se com Helena Radaelli de Lima.\n\nPublicou *Sol poente*(poemas, 1945), *O sertão ressuscitou*(poemas,\n1950) e *Maringá;* *versos épicos*(1957), tendo também composto as\nletras para as partituras dos hinos a Maringá (1960), a São Sebastião do\nParaíso (1968) e a Luanda (1969), outra cidade paranaense.\n\nFONTES: CÂM. DEP. *Deputados;*CÂM. DEP. *Deputados brasileiros.\nRepertório*(1971-1975); NÉRI, S.*16;* OLIVEIRA, M. *História;\nPerfil*(1972).\n\n \n","ref":"FONTES: CÂM. DEP. *Deputados;*CÂM. DEP. *Deputados brasileiros.\nRepertório*(1971-1975); NÉRI, S.*16;* OLIVEIRA, M. *História;\nPerfil*(1972).\n\n \n","dic":"DHBB"}
