{"title":"LIMA, Joel","cargoss":["Deputado federal"],"cargos_esp":[0],"datas_ini":[1975],"datas_fim":[1983],"estados":["RJ"],"autor":[0],"content":"**LIMA, Joel**\n\n\\*dep. fed. RJ 1975-1983.\n\n* *\n\n*Joel Pereira Lima* nasceu em Manhumirim (MG) no dia 2 de janeiro de\n1933, filho de Antônio Pereira Lima e de Elisa Silva Lima.\n\nIniciou sua vida profissional como arrais, trabalhando depois como\ncorretor de imóveis. Bacharel em ciências jurídicas e sociais pela\nfaculdade de direito da atual Universidade Federal Fluminense, em\nNiterói, ingressou na política em 1971, elegendo-se vereador por São\nGonçalo (RJ) na legenda do Movimento Democrático Brasileiro (MDB),\npartido de oposição ao regime militar instaurado no país em abril de\n1964. Líder da bancada e secretário da comissão executiva municipal,\nassumiu em 1974 a presidência do diretório regional do partido.\n\nNo pleito de novembro de 1974 elegeu-se deputado federal pelo estado do\nRio de Janeiro. Vice-presidente da Comissão de Educação e titular da\nComissão de Trabalho e Legislação Social, reelegeu-se em novembro de\n1978 e no ano seguinte deixou a presidência do diretório regional,\nassumindo uma suplência na direção da Câmara dos Deputados.\n\nCom a extinção do bipartidarismo, em novembro de 1979, e a conseqüente\nreformulação partidária, filiou-se ao Partido Popular (PP),\ntransferindo-se para o Partido do Movimento Democrático Brasileiro\n(PMDB), sucessor do MDB, quando em fevereiro de 1982 houve a\nincorporação das duas agremiações.\n\nAo longo da legislatura exerceu a vice-presidência da Comissão de\nFiscalização Financeira e Tomada de Contas, e foi titular das comissões\nde Finanças e de Transportes, atuando como suplente da Comissão de\nTrabalho e Legislação Social. Sem concorrer a reeleição em novembro de\n1982, deixou a Câmara dos Deputados ao término do mandato, em janeiro de\n1983.\n\nEm janeiro de 1986 foi nomeado superintendente do Instituto Nacional de\nPrevidência Social (INPS), no Rio de Janeiro, substituindo Moacir\nLafaiete Formiga, temporariamente afastado durante as investigações da\nmorte de Letícia Lage, envolvida em fraudes contra a Previdência.\n\nEm outubro de 1994, de novo na legenda do PMDB, Joel Lima tentou sem\nsucesso retornar à Câmara dos Deputados. Nas eleições de novembro,\nrealizadas em virtude da anulação do pleito por suspeita de fraude,\ntambém não logrou êxito.\n\nCasado com Anete Tomás Lima, teve cinco filhos.\n\n \n\n \n\nFONTES: CÂM. DEP. *Deputados brasileiros. Repertório* (1975-1979,\n1979-1983 e 1995-1999); *Globo* (20/3/96); NÉRI, S. *16*;*Perfil*\n(1980).\n\n \n","ref":"FONTES: CÂM. DEP. *Deputados brasileiros. Repertório* (1975-1979,\n1979-1983 e 1995-1999); *Globo* (20/3/96); NÉRI, S. *16*;*Perfil*\n(1980).\n\n \n","dic":"DHBB"}
