{"title":"LIMA, José Vicente Faria","cargoss":["Presidente de associação ou confederação de empregados ou empregadores","Prefeito"],"cargos_esp":["BNDE","São Paulo"],"datas_ini":[1961,1965],"datas_fim":[1961,1969],"estados":[0,0],"autor":[0],"content":"**LIMA, José Vicente Faria**\n\n\\*militar; pres. BNDE 1961; pref. São Paulo 1965-1969.\n\n \n\n*José Vicente Faria Lima* nasceu no Rio de Janeiro, então Distrito\nFederal, no dia 7 de outubro de 1909, filho de João Soares Lima,\nimigrante português que trabalhava no Arsenal de Marinha, e de Castorina\nFaria Lima. Um de seus irmãos, o almirante Floriano Peixoto Faria Lima,\nfoi presidente da Petrobras de 1973 a 1974 e governador do estado do Rio\nde Janeiro de 1975 a 1979. Outro irmão, o brigadeiro Roberto Faria Lima,\nfoi inspetor-geral da Aeronáutica em 1974.\n\nSentou praça em março de 1928, ingressando na Escola Militar do\nRealengo, no Rio de Janeiro. Após ter concluído o curso da Escola de\nAviação Militar do Campo dos Afonsos, saiu aspirante-a-oficial da arma\nde aviação em novembro de 1930, logo após a vitória do movimento\nrevolucionário que levou Getúlio Vargas ao poder. Promovido a\nsegundo-tenente em junho de 1931, tornou-se nesse mesmo ano integrante\ndo recém-inaugurado Correio Aéreo Militar (CAM), participando do serviço\nde transporte de correspondência em aviões militares. Ainda em 1931,\ncursou a Escola de Engenharia Aeronáutica em Paris.\n\nEncarregado de executar o serviço postal no interior de Goiás no começo\nde 1932, tomou parte na repressão à Revolução Constitucionalista de São\nPaulo, transcorrida entre julho e outubro desse ano, efetuando missões\naéreas na frente do vale do Paraíba. Recebeu a patente de\nprimeiro-tenente em novembro, depois de cessadas as hostilidades, e em\ndezembro de 1933 passou a capitão. Em maio de 1935, comandou a\nesquadrilha acrobática da Aviação Militar do Exército que tomou parte na\ncomitiva que acompanhou o presidente Getúlio Vargas em viagem ao Uruguai\ne à Argentina e fez exibições naqueles dois países.\n\nCom a criação do Ministério da Aeronáutica e da Força Aérea Brasileira\n(FAB) em janeiro de 1941, transferiu-se para a nova força armada, a\nexemplo da quase-totalidade dos oficiais do Exército e da Marinha\nligados à aviação. Em agosto do mesmo ano, integrou a comitiva do\npresidente Vargas em visita oficial ao Paraguai. Promovido a\nmajor-aviador em dezembro, foi assessor do primeiro ministro da\nAeronáutica, o civil Joaquim Pedro Salgado Filho. Em março de 1944,\nrecebeu a patente de tenente-coronel-aviador e, em abril de 1945, seguiu\npara os Estados Unidos, chefiando a Comissão de Compras de Material\nAeronáutico, com sede em Washington. Permaneceu nesse cargo até dezembro\nde 1947, quando retornou ao Brasil.\n\nEm janeiro de 1948 passou a ocupar a direção do Parque de Aeronáutica de\nSão Paulo, o Campo de Marte, do qual foi, o principal organizador. Em\nsetembro de 1950, foi promovido a coronel-aviador. Seu trabalho à frente\ndo Parque de Aeronáutica chamou a atenção de Jânio Quadros, que,\nempossado no governo de São Paulo em janeiro de 1955, designou-o\npresidente da Viação Aérea São Paulo (VASP), empresa aérea do governo\npaulista. Este foi seu primeiro cargo fora da carreira militar e nele\nrecuperou as finanças e ampliou as linhas em operação.\n\nSaindo da VASP, foi nomeado por Jânio secretário de Viação e Obras\nPúblicas do estado, realizando o asfaltamento de dois mil quilômetros de\nestradas, considerada uma das obras mais importantes da administração de\nQuadros. Em 1958, ainda secretário de Viação e Obras Públicas, foi\npromovido a brigadeiro-do-ar. Quando Jânio transferiu o governo, em\njaneiro de 1959, a Carlos Alberto de Carvalho Pinto, eleito em outubro\ndo ano anterior, foi mantido à frente da Secretaria de Viação e Obras\nPúblicas, onde permaneceu até o início de 1961. Nessa ocasião, Jânio,\nempossado na presidência da República (31/1/1961), nomeou-o presidente\ndo Banco Nacional de Desenvolvimento Econômico (BNDE), um dos órgãos\nmais importantes da estrutura administrativa do governo federal. Nome\npraticamente desconhecido em termos nacionais e intimamente ligado a\nJânio e a Carvalho Pinto, Faria Lima assumiu a presidência do BNDE em\nmarço e deixou-a em setembro, após a renúncia de Quadros (25/8/1961) e a\nposse do vice-presidente João Goulart (7/9/1961).\n\n \n\nPrefeito de São Paulo (1965-1969)\n\nRetomou sua carreira política após o movimento político-militar de março\nde 1964, que depôs o presidente João Goulart, concorrendo à prefeitura\nde São Paulo nas eleições realizadas em 22 de março de 1965. Este pleito\nfoi o último em que a população da capital paulista elegeu seu prefeito\npelo voto direto. Lançado pela legenda da União Democrática Nacional\n(UDN), disputou as eleições com o vice-governador Laudo Natel, do\nPartido Republicano (PR), o senador Auro de Moura Andrade, do Partido\nSocial Democrático (PSD), o deputado federal Franco Montoro, do Partido\nDemocrata Cristão (PDC), o senador Lino de Matos, do Partido Trabalhista\nNacional (PTN), e o engenheiro Paulo Egídio Martins. Com o apoio de\nJânio Quadros — que tivera seus direitos políticos suspensos pelo Ato\nInstitucional nº 1 (AI-1), editado em abril de 1964 —, de Carvalho Pinto\ne da UDN, a principal base política do governo federal, chefiado pelo\nmarechal Humberto Castelo Branco, obteve mais de 30% dos votos,\nderrotando seus cinco adversários. Assumiu a prefeitura de São Paulo em\nabril seguinte, substituindo Francisco Prestes Maia.\n\nSua administração foi considerada excepcional pelo volume de obras e\npela profunda alteração que promoveu na paisagem urbana da cidade. Essas\nobras valeram-se do saneamento financeiro encetado por Prestes Maia e da\nalteração da Constituição federal, realizada no governo de Castelo\nBranco, que permitiu à municipalidade absorver maior parcela dos\nimpostos gerados na capital paulista. A Prefeitura contratou a\nelaboração do Plano Urbanístico Básico para São Paulo, considerado o\nprimeiro estado de vulto para o planejamento da cidade e que permitiu um\norganograma de obras de racionalidade inédita e resultados\ncompensadores. Para descentralizar a ação administrativa, a cidade foi\ndividida em 12 regiões, contando cada uma delas com uma espécie de\nsubprefeito e funcionários encarregados de acompanhar as obras e fazer\nlevantamentos das necessidades da região.\n\nDurante sua gestão foram abertas grandes avenidas, entre as quais a 23\nde Maio, projetada mais de 40 anos antes; a Cruzeiro do Sul, ligando a\nZona Norte ao Centro da cidade; a Radial Oeste, projetada por Prestes\nMaia; a Rubem Berta e as marginais dos rios Tietê e Pinheiros. Foram\nconstruídos também inúmeros viadutos — como o Alcântara Machado, um dos\nmaiores da América Latina —, mercados distritais e logradouros públicos,\ncomo a praça Roosevelt. Ainda nesse setor, mais de dez milhões de metros\nquadrados de vias públicas foram pavimentados e a iluminação da cidade\nfoi melhorada. A Companhia do Metrô foi organizada e iniciou os\ntrabalhos de perfuração.\n\nNo setor cultural-educacional, Faria Lima construiu mais de duas mil\nsalas de aula e criou o corpo de baile do Teatro Municipal, a Orquestra\nJovem Sinfônica e a primeira Casa de Cultura, no bairro da Penha. Sua\neficiência administrativa na prefeitura de São Paulo conferiu-lhe grande\nprestígio político, mesmo em nível nacional. Já em julho de 1967, seu\nnome começou a ser cogitado para a sucessão de Roberto Abreu Sodré no\ngoverno do estado em 1970.\n\nApesar de identificado com as diretrizes do governo do presidente Artur\nda Costa e Silva, não se filiou imediatamente à Aliança Renovadora\nNacional (Arena), partido de apoio ao regime criado em abril de 1966 em\nconseqüência do AI-2, que, editado em outubro de 1965, extinguiu os\npartidos políticos então existentes e abriu caminho para o\nbipartidarismo no país. Faria Lima chegou mesmo a contar com auxiliares\nligados ao Movimento Democrático Brasileiro (MDB), a agremiação\noposicionista. Considerado, ao lado do senador Carvalho Pinto e do\ngovernador Abreu Sodré, uma das três maiores forças políticas do estado,\nsó veio a filiar-se à Arena em maio de 1968, segundo o jornalista Carlos\nCastelo Branco, visando garantir sua chance de disputar o governo de São\nPaulo. No mês seguinte, já se falava abertamente em seu nome para a\nsucessão paulista.\n\nEm julho de 1968, o ministro da Justiça, Luís Antônio da Gama e Silva,\ndecretou o confinamento de Jânio Quadros em Corumbá (MS), fato que\nprovocou comentários na imprensa devido às conhecidas ligações políticas\ne pessoais do ex-presidente com Faria Lima. Ao mesmo tempo, seu\nprincipal auxiliar, o secretário de Finanças, Francisco de Paula\nQuintanilha Ribeiro, solidarizou-se com Jânio. Em dezembro seguinte, a\nedição do AI-5 alterou profundamente o quadro político nacional e, entre\noutros pontos, tornou indiretas as eleições para governadores. Mesmo com\na mudança das regras do jogo, Faria Lima continuou sendo um sério\npretendente ao governo de São Paulo. Deixou a prefeitura no dia 8 de\nabril de 1969, sendo substituído pelo empresário e ex-presidente da\nCaixa Econômica Federal (CEF) em São Paulo, Paulo Salim Maluf, nomeado\npelo governador Abreu Sodré.\n\nFaleceu no Rio de Janeiro no dia 4 de setembro de 1969, quase um ano\nantes das eleições a que pretendia concorrer.\n\nFoi casado com Iolanda Faria Lima, prima do general Sizeno Sarmento,\ninterventor federal no Amazonas entre 1946 e 1947, comandante do II\nExército entre 1967 e 1968 e do I Exército de 1968 a 1971. Teve três\nfilhos. Seu sobrinho José Roberto Faria Lima foi deputado federal por\nSão Paulo de 1971 a 1979.\n\n \n\n \n\nFONTES: CASTELO BRANCO, C. Militares; CORRESP. BANCO NAC. DESENV. ECON.;\nEncic. Mirador; Grande encic. Delta; MIN. GUERRA. Almanaque; SKIDMORE,\nT. Brasil; Veja (13/11/68 e 10/9/69); WANDERLEY, N. História.\n\n \n","ref":"FONTES: CASTELO BRANCO, C. Militares; CORRESP. BANCO NAC. DESENV. ECON.;\nEncic. Mirador; Grande encic. Delta; MIN. GUERRA. Almanaque; SKIDMORE,\nT. Brasil; Veja (13/11/68 e 10/9/69); WANDERLEY, N. História.\n\n \n","dic":"DHBB"}
