{"title":"LIMA, Marcílio","cargoss":["Deputado federal"],"cargos_esp":[0],"datas_ini":[1967],"datas_fim":[1975],"estados":["MT"],"autor":[0],"content":"**LIMA, Marcílio**\n\n\\*dep. fed. MT 1967-1975.\n\n*Marcílio de Oliveira Lima*nasceu em Campo Grande, à época cidade do\nestado de Mato Grosso e hoje capital do Mato Grosso do Sul, no dia 15 de\nmaio de 1915, filho de Antônio de Oliveira Lima e de Ovídia Maria de\nLima.\n\nFormado pela Faculdade de Medicina da Universidade do Brasil, atual\nUniversidade Federal do Rio de Janeiro (UFRJ), voltou a seu estado, onde\nse dedicou à agropecuária e trabalhou no Serviço de Saúde de Mato Grosso\nem 1945.\n\nIniciou-se na política como vereador à Câmara Municipal de Campo Grande,\nonde atuou de 1951 a 1954. No mesmo período, foi chefe do Centro de\nSaúde de Mato Grosso. Prefeito de Campo Grande de 1955 a 1959, retornou\nà Câmara Municipal neste último ano para novo mandato até 1963. Ainda em\n1959, voltou também à chefia do Centro de Saúde, cargo em que permaneceu\naté 1962.\n\nNo pleito de novembro de 1966, elegeu-se deputado federal por Mato\nGrosso pela legenda da Aliança Renovadora Nacional (Arena), partido de\napoio ao regime militar instalado no país em abril de 1964, assumindo o\nmandato em fevereiro de 1967. Reeleito pela mesma legenda no pleito de\nnovembro de 1970, tornou-se membro efetivo das comissões de Saúde e de\nDesenvolvimento da Região Centro-Oeste e suplente da Comissão de\nAgricultura e Política Rural da Câmara dos Deputados.\n\nNo pleito de novembro de 1974, conseguiu apenas uma suplência de\ndeputado federal por seu estado, sempre pela legenda da Arena. Em\njaneiro de 1975, ao final de seu segundo mandato, deixou definitivamente\na Câmara.\n\nCasou-se com Iolanda Peres Lima, com quem teve um casal de filhos.\n\nFONTES: CÂM. DEP. *Deputados*; CÂM. DEP. *Deputados brasileiros.\nRepertório* (1967-1971 e 1971-1975); INF. Ísis Catarino; NÉRI, S. *16*;\n*Perfil* (1972).\n\n \n","ref":"FONTES: CÂM. DEP. *Deputados*; CÂM. DEP. *Deputados brasileiros.\nRepertório* (1967-1971 e 1971-1975); INF. Ísis Catarino; NÉRI, S. *16*;\n*Perfil* (1972).\n\n \n","dic":"DHBB"}
