{"title":"LIMA, Milvernes","cargoss":["Deputado federal","Deputado federal"],"cargos_esp":[0,0],"datas_ini":[1981,1959],"datas_fim":[1983,1971],"estados":["PE","PE"],"autor":[0],"content":"**LIMA, Milvernes**\n\n\\*dep. fed. PE 1959-1971, 1981-1983.\n\n \n\n*Milvernes Cruz Lima* nasceu em Caraçá (BA) no dia 1º de abril de 1919,\nfilho de Policarpo Rodrigues Lima e de Sinforosa Cruz Lima.\n\nProprietário agrícola e pecuarista, iniciou sua carreira política\nelegendo-se, no pleito de outubro de 1958, deputado federal por\nPernambuco na legenda da Frente Democrática Pernambucana, coligação\nformada pelos partidos Social Democrático (PSD), Democrata Cristão\n(PDC), de Representação Popular (PRP), Social Trabalhista (PST) e\nLiberal (PL). Assumiu o mandato em fevereiro do ano seguinte e\nreelegeu-se em outubro de 1962, na legenda do Partido Trabalhista\nBrasileiro (PTB). Com a extinção dos partidos políticos pelo Ato\nInstitucional nº 2 (27/10/1965) e a posterior instauração do\nbipartidarismo, filiou-se à Aliança Renovadora Nacional (Arena), partido\nde sustentação ao regime militar instalado no país em abril de 1964, em\ncuja legenda voltou a eleger-se no pleito de novembro de 1966. Ao\nterminar seu mandato, em janeiro de 1971, deixou a Câmara dos Deputados.\n\nNo pleito de novembro de 1978 voltou a disputar uma cadeira na Câmara na\nlegenda da Arena, conseguindo apenas uma suplência.\n\nCom a extinção do bipartidarismo em novembro de 1979 e a conseqüente\nreformulação partidária, filiou-se ao Partido Democrático Social (PDS),\nque sucedeu a Arena no apoio ao governo. Retornou à Câmara dos Deputados\nem março de 1981, na vaga aberta com a morte do deputado Joaquim\nCoutinho. Não tendo concorrido no pleito de novembro de 1982, teve seu\nmandato encerrado em janeiro do ano seguinte.\n\nFoi ainda presidente da Companhia de Desenvolvimento do Vale do São\nFrancisco (Codevasf).\n\nFaleceu em Almenara (MG) no dia 1º de janeiro de 1985.\n\nEra casado com Josima de Carvalho Lima, com quem teve quatro filhos.\n\n \n\nFONTES: CÂM. DEP. *Deputados*; CÂM. DEP. *Deputados brasileiros.\nRepertório* (1967-1971 e 1979-1983); CÂM. DEP. *Relação dos dep*.;\n*Jornal do Brasil* (2/1/85); TRIB. SUP. ELEIT. *Dados* (4, 6 e 8).\n\n \n","ref":"FONTES: CÂM. DEP. *Deputados*; CÂM. DEP. *Deputados brasileiros.\nRepertório* (1967-1971 e 1979-1983); CÂM. DEP. *Relação dos dep*.;\n*Jornal do Brasil* (2/1/85); TRIB. SUP. ELEIT. *Dados* (4, 6 e 8).\n\n \n","dic":"DHBB"}
