{"title":"LIMA, Nilo Augusto Guerreiro","cargoss":["Chefe do Departamento Geral de Pessoal do Exército"],"cargos_esp":[0],"datas_ini":[1964],"datas_fim":[1965],"estados":[0],"autor":[0],"content":"**LIMA, Nilo Augusto Guerreiro**\n\n\\*militar; ch. Depto. Ger. Pess. Ex. 1964-1965.\n\n* *\n\n*Nilo Augusto Guerreiro Lima* nasceu em Niterói (RJ) no dia 9 de julho\nde 1902.\n\nSentou praça em março de 1918 ingressando na Escola Militar do Realengo,\nno Rio de Janeiro, então Distrito Federal. Aspirante em janeiro de 1921,\nfoi promovido a segundo-tenente em maio seguinte, a primeiro-tenente em\noutubro de 1922, a capitão em agosto de 1931, a major em setembro de\n1937 e a tenente-coronel em dezembro de 1941.\n\nEm 1943 serviu no Estado-Maior do Exército. Recebeu a patente de coronel\nem junho do ano seguinte e assumiu o comando do 4º Regimento de\nInfantaria, em Quitaúna (SP), em 1946. Promovido a general-de-brigada em\nsetembro de 1952, no ano seguinte foi designado comandante da Infantaria\nDivisionária da 3ª Divisão de Infantaria (ID/3). Em novembro de 1959\nrecebeu a promoção a general-de-divisão, tornando-se em 1961 comandante\nda 7ª Região Militar, com sede em Recife.\n\nPouco após a vitória do movimento político-militar de 31 de março de\n1964 que depôs o presidente João Goulart (1961-1964), foi designado, em\njunho, chefe do Departamento Geral de Pessoal do Exército, em\nsubstituição ao general Valdemar Levi Cardoso, e no mês seguinte recebeu\na patente de general-de-exército. Permaneceu naquele cargo até junho de\n1965, quando foi sucedido pelo general Rafael de Sousa Aguiar. Em\nnovembro seguinte foi agregado, passando em 1967 para a reserva. Em maio\nde 1971 foi reformado no posto de marechal.\n\nAo longo de sua vida militar, Nilo Guerreiro Lima cursou a Escola de\nAperfeiçoamento de Oficiais, a Escola de Comando e Estado-Maior do\nExército e a Escola Superior de Guerra.\n\nFaleceu em 21 de junho de 1982.\n\nViúvo de Carmen Alair Guerreiro Lima, com quem teve um filho, foi casado\nem segundas núpcias com Anete Hosken Guerreiro Lima.\n\n \n\nFONTES: CORRESP. SECRET. GER. EXÉRC.; MIN. GUERRA. *Almanaque*.\n\n \n","ref":"FONTES: CORRESP. SECRET. GER. EXÉRC.; MIN. GUERRA. *Almanaque*.\n\n \n","dic":"DHBB"}
