{"title":"LIMA, Orestes da Rocha","cargoss":["Interventor","ch Dir Mat Bél Ex"],"cargos_esp":[0,0],"datas_ini":[1947,1949],"datas_fim":[1947,1952],"estados":["RN",0],"autor":[0],"content":"**LIMA, Orestes da Rocha**\n\n\\*militar; interv. RN 1947; ch. Dir. Mat. Bél. Ex. 1949-1952.\n\n*Orestes da Rocha Lima* nasceu no dia 15 de dezembro de 1893, filho de\nAntônio Correia Lima.\n\nSentou praça em março de 1911, sendo declarado aspirante-a-oficial pela\nEscola Militar do Realengo no Rio de Janeiro, então Distrito Federal, em\njaneiro de 1914. Ingressou a seguir no 1º Regimento de Artilharia\nMontada (1º RAM) da Vila Militar, sendo promovido a segundo-tenente em\nfevereiro de 1916, data em que deixou o 1º RAM.\n\nDe volta à Escola Militar do Realengo em março seguinte, aí permaneceu\naté fevereiro de 1918, quando retornou ao 1º RAM, sendo então promovido\na primeiro-tenente. Durante esse período alternou serviços na Escola\nMilitar do Realengo e no 1º RAM, deixando aquele estabelecimento de\nensino em fevereiro de 1921 para ingressar na Escola de Aperfeiçoamento\nde Oficiais (EsAO), na Vila Militar do Rio de Janeiro. Promovido a\ncapitão em agosto deste último ano, deixou a EsAO em fevereiro de 1922,\nquando entrou para a Escola de Estado-Maior (EEM), também no Distrito\nFederal.\n\nEm julho de 1924 irrompeu em São Paulo a revolta conhecida como o\nSegundo 5 de Julho. Comandados por Isidoro Dias Lopes, o, rebeldes\nocuparam a capital paulista por três semanas antes de abandonar a cidade\ne deslocar-se para o interior de estado. Rocha Lima foi então designado\npara o estado-maior do Destacamento Misto, comandado pelo general\nFloriano Ramos com o objetivo de atuar em São Paulo durante esse\nperíodo.\n\nDeixando a EEM em janeiro de 1925, ingressou no Estado-Maior do Exército\n(EME), no Rio de Janeiro, onde permaneceu como estagiário até fevereiro\nde 1926 e como adjunto desse mês a maio do mesmo ano. Nessa data\nretornou à Escola Militar do Realengo, passando a atuar como instrutor\nde artilharia até abril de 1929, quando deixou essa escola para\ningressar no 1º Distrito de Artilharia de Costa (1º DAC), também no Rio\nde Janeiro. Aí serviu como adjunto até outubro do ano seguinte.\n\nApós a deflagração do movimento revolucionário de outubro de 1930,\nparticipou do golpe que, no dia 24 desse mês, depôs o presidente\nWashington Luís no Rio de Janeiro e colocou no poder uma junta\ngovernativa constituída pelos generais Tasso Fragoso e João de Deus Mena\nBarreto e pelo almirante Isaías de Noronha. Participou do movimento do\n1º DAC contra os governos federal e estadual fluminense, colaborando nas\nprovidências para a ocupação de Niterói, então capital do estado do Rio,\ne para a derrubada do governo. Ainda no dia 24 de outubro acompanhou o\ngeneral José Fernandes Leite de Castro aos estabelecimentos federais e\nestaduais de Niterói, já ocupados, regressando em seguida à capital\nfederal, onde se apresentou no palácio do Catete.\n\nEm 27 do mesmo mês providenciou a repressão ao movimento ocorrido no Rio\nde Janeiro, que incluía assaltos às casas de comércio de armas a\npretexto de ajuda popular às forças armadas para defender a revolução\nvitoriosa. Houve uma tentativa de levante num dos batalhões da polícia,\ntendo a junta governativa se preparado para resistir no palácio do\nCatete diante da possibilidade de uma contra-revolução. Em três ou\nquatro pontos da cidade foram colocados carros de combate e as tropas da\n1ª Região Militar (1ª RM) ficaram de prontidão.\n\nIniciado o Governo Provisório de Getúlio Vargas em 3 de novembro de\n1930, Rocha Lima foi designado oficial-de-gabinete do ministro da\nGuerra, general Leite de Castro, função que exerceria até junho de 1932.\nPromovido a major em maio de 1931, ingressou em julho seguinte na\nFábrica de Cartuchos e Artefatos de Guerra, em Realengo, na qualidade de\nfiscal administrativo, ocupando esse cargo até outubro de 1933. Dessa\ndata até maio de 1935 integrou a Comissão de Estudos para a Indústria\nMilitar Brasileira na Europa, participando nesse período da Subcomissão\nde Projetores e Tratores em Paris, no segundo semestre de 1933, e da\nSubcomissão de Projetores e Tratores em Bruxelas, no segundo semestre do\nano seguinte. Chefiou ainda a subcomissão que, com idênticos propósitos,\nvisitou a Holanda entre novembro de 1934 e maio de 1935. Em agosto desse\núltimo ano foi removido para o DAC da 1ª RM, tendo servido também na 1ª\nInspetoria de Defesa da Costa do Rio de Janeiro. Foi promovido a\ntenente-coronel em maio de 1936 e em agosto seguinte passou a comandante\ndo 6º RAM, em Cruz Alta (RS), exercendo essas funções até março de 1937.\nEm agosto desse ano ingressou no Centro de Instrução de Artilharia de\nCosta (CIAC), na fortaleza de São João no Rio de Janeiro, aí\npermanecendo ate janeiro de 1938.\n\nEm fevereiro seguinte assumiu o comando do 2º Grupo de Artilharia de\nCosta, exercendo-o, até junho do mesmo ano, cumulativamente com o\nconferido da fortaleza de São João. Em abril de 1939 passou a comandar o\nestado-maior da Inspetoria Geral do 3º Grupo de Regiões Militares no Rio\nde Janeiro, função pela qual respondeu até janeiro de 1941, sendo nesse\nínterim promovido a coronel em dezembro de 1940. Em fevereiro de 1942\ntornou-se comandante do 3º RAM, com sede em Curitiba, exercendo essa\nfunção até dezembro. Ainda nesse mês passou a servir no EME, exercendo a\nsubchefia desse órgão de julho a agosto de 1945, em fevereiro de 1946 e\nde março a junho desse ano. Em maio de 1946 foi promovido a\ngeneral-de-brigada.\n\nCom o fim do Estado Novo (29/10/1945) e o conseqüente processo de\nredemocratização do país, Rocha Lima foi designado em janeiro de 1947,\njá no governo do presidente Eurico Gaspar Dutra o último interventor no\nRio Grande do Norte em substituição a Ubaldo Bezerra de Melo (1946).\nGovernou o estado até julho seguinte e nesse curto período criou a\nFaculdade de Farmácia e Odontologia. Foi substituído pelo governador\nconstitucional do estado, José Augusto Varela (1947-1951).\n\nEm dezembro de 1948 ingressou na Diretoria Geral de Material Bélico, que\ndirigiu de janeiro de 1949 a abril de 1952, chefiando interinamente a\nDiretoria Geral de Artilharia de março a maio de 1949 e em julho desse\nmesmo ano. Cursou ainda a Escola Superior de Guerra (ESG), no Rio de\nJaneiro, de março a agosto de 1952, sendo promovido nesse último mês a\ngeneral-de-divisão e a general-de-exército. Em abril do ano seguinte\npassou para a reserva no posto de marechal.\n\nFONTES: ARQ. MIN. EXÉRC.; CASCUDO, L*. História*; COUTINHO, A. *Brasil*;\n*Grande* *encic. Delta*; MIN. GUERRA. *Almanaque*.\n\n \n","ref":"FONTES: ARQ. MIN. EXÉRC.; CASCUDO, L*. História*; COUTINHO, A. *Brasil*;\n*Grande* *encic. Delta*; MIN. GUERRA. *Almanaque*.\n\n \n","dic":"DHBB"}
