{"title":"LIMA, Osmir","cargoss":["Constituinte","Deputado federal","Deputado federal","Deputado federal"],"cargos_esp":[0,0,0,0],"datas_ini":[1987,1995,1990,1987],"datas_fim":[1988,1999,1991,1989],"estados":[0,"AC","AC","AC"],"autor":["Alan Carneiro"],"content":"**LIMA, Osmir**\n\n\\*const. 1987-1988; dep. fed. AC 1987-1989, 1990-1991 e 1995-1999.\n\n* *\n\n*Osmir d’Albuquerque Lima Filho* nasceu em Cruzeiro do Sul (AC) no dia\n30 de março de 1945, filho de Osmir d’Albuquerque Lima e de Marfiza\nNunes de Melo.\n\nIngressou na política filiando-se, em 1962, ao Partido Social\nDemocrático (PSD). Após a vitória do movimento político-militar de 31 de\nmarço de 1964 que depôs o presidente João Goulart (1961-1964), a\nextinção dos partidos políticos pelo Ato Institucional nº 2 (27/10/1965)\ne a posterior instauração do bipartidarismo, filiou-se no ano seguinte à\nAliança Renovadora Nacional (Arena), partido de apoio ao regime militar\nque se instaurara no país. Em 1968 iniciou o curso de técnico em\ncontabilidade no Colégio Comercial Professor Flodoardo Cabral, em sua\ncidade natal, que concluiu em 1971. Em 1969 foi delegado à convenção\nregional do partido, o mesmo ocorrendo no ano seguinte.\n\nBancário, foi funcionário de carreira do Banco do Brasil, do qual\nchegaria à função de administrador da instituição, tendo ocupado ainda o\ncargo de gerente em 1970. Em 1974 deixou a Arena e se filiou ao\nMovimento Democrático Brasileiro (MDB), partido de oposição ao regime\nmilitar em voga no país. Com a extinção do bipartidarismo em novembro de\n1979 e a conseqüente reformulação partidária, filiou-se no ano seguinte\nao Partido do Movimento Democrático Brasileiro (PMDB), sucessor do MDB,\ntornando-se membro do seu diretório nacional. Em 1983, desligou-se do\nBanco do Brasil, assumindo em março desse ano a presidência do Banco do\nEstado do Acre (Banacre) no governo de Nabor Júnior (1983-1986) e, nessa\ncondição, tornou-se membro da Comissão Financeira do estado e\nrepresentante da instituição na Associação Brasileira dos Bancos\nComerciais Estaduais. Também nesse mesmo período assumiu a presidência\ndo Centro de Apoio à Média e Pequena Empresa do Acre. Ainda nesse ano,\nparticipou da delegação oficial acreana que viajou ao Peru buscando a\nintegração da região amazônica na América Latina.\n\nEm 1984, tornou-se membro da Comissão Nacional das Entidades Estatais de\nCrédito Imobiliário, do Conselho Estadual de Ciência e Tecnologia,\nvice-presidente da Associação Brasileira de Bancos de Desenvolvimento\n(Abde) e presidente do Conselho de Administração do Banacre — Crédito\nImobiliário. No ano seguinte passou a integrar, como membro efetivo, o\nConselho Fiscal da Abde e o Conselho Efetivo da Associação Brasileira\ndas Entidades de Crédito Imobiliário e Poupança (ABECIP). Ainda em 1985,\nrealizou uma viagem a Washington (EUA), como parte dos trabalhos do\nPrograma de Desenvolvimento do Acre, e tornou-se membro do Instituto\nHistórico e Geográfico do estado.\n\nEm maio de 1986 deixou a presidência do Banacre e os demais cargos que\nocupava no estado para concorrer, na legenda do PMDB, a deputado federal\nem novembro desse ano. Apoiado por bancos e outras entidades do setor\nfinanceiro de seu estado, elegeu-se deputado federal nesse pleito e\ntomou posse na Câmara dos Deputados em 1º de fevereiro de 1987,\ntornando-se vice-líder do seu partido. Nessa mesma data, foi instalada a\nAssembléia Nacional Constituinte (ANC).\n\nLigado ao grupo liderado pelo ex-governador e então senador Nabor Júnior\n(PMDB), na Constituinte tornou-se titular da Subcomissão de Garantia da\nConstituição, Reformas e Emendas da Comissão da Organização Eleitoral,\nPartidária e Garantia das Instituições e suplente da Subcomissão dos\nNegros, Populações Indígenas, Pessoas Deficientes e Minorias da Comissão\nda Ordem Social. Durante o período de elaboração da Constituição, votou\na favor da jornada de trabalho semanal de 40 horas, do turno\nininterrupto de seis horas, do direito de greve, do aviso prévio\nproporcional, do rompimento de relações diplomáticas com países com\npolítica de discriminação racial, do mandado de segurança coletivo, da\nproteção do emprego contra a dispensa sem justa causa, da remuneração\n50% superior para o trabalho extra, da nacionalização do subsolo e da\npena de morte. Votou contra a criminalização do aborto, a estatização do\nsistema financeiro e o limite de 12% ao ano para os juros reais.\n\nApós a promulgação da nova Carta em 5 de outubro de 1988, passou a\nexercer somente o seu mandato ordinário. No ano seguinte, retornou à\nvice-liderança do PMDB e, em fevereiro desse ano, licenciou-se do\nmandato, no qual foi substituído pelo suplente João Maia, para assumir a\nSecretaria de Desenvolvimento Agrário do seu estado no governo de\nFlaviano Melo (1987-1990). Exerceu esse cargo até fevereiro de 1990,\nquando se desincompatibilizou do mesmo para concorrer ao governo do\nestado, reassumindo em seguida sua cadeira na Câmara.\n\nNo pleito de outubro de 1990 foi o terceiro colocado na disputa para a\nchefia do Executivo estadual na legenda do PMDB, perdendo para Jorge\nViana, da coligação comandada pelo Partido dos Trabalhadores (PT), que\nfoi o segundo colocado, e para o vencedor Edmundo Pinto, do Partido\nDemocrático Social (PDS). Permaneceu na Câmara dos Deputados até o fim\nde janeiro de 1991, quando se encerraram o seu mandato e a legislatura.\nNesse mesmo ano assumiu a secretaria geral de seu partido no estado.\n\nVoltou a disputar uma cadeira na Câmara dos Deputados na legenda do\nPMDB, coligado ao Partido Democrático Trabalhista (PDT) e ao Partido da\nSocial Democracia Brasileira (PSDB), nas eleições de outubro de 1994,\nmas não conseguiu se eleger, obtendo somente a primeira suplência. Com a\nascensão de Orleir Cameli ao governo do Acre em janeiro de 1995, Osmir\nLima foi nomeado chefe de gabinete da Casa Civil, exercendo essa função\naté dezembro desse ano, quando o governador nomeou o deputado Francisco\nDiógenes para o cargo vitalício de conselheiro do Tribunal de Contas do\nEstado (TCE), abrindo assim uma vaga no Legislativo Federal. No dia 4\ndesse mês, Osmir Lima assumiu sua cadeira, de forma efetiva, na Câmara\ndos Deputados e, nessa mesma data, ingressou no Partido da Frente\nLiberal (PFL).\n\nTornou-se, ainda em 1995, membro titular da Comissão de Relações\nExteriores, passando a suplente da mesma no ano seguinte, quando se\ntornou titular da Comissão de Minas e Energia, da qual foi\nterceiro-vice-presidente e suplente da Comissão de Defesa do Consumidor,\nMeio Ambiente e Minorias. Dentre as comissões especiais, integrou, como\ntitular, a do Projeto de Emenda Constitucional (PEC) sobre Anistia dos\nMilitares, a do PEC que fixava o número de deputados por estado, do que\ntratava de recursos para irrigação da ilha de Marajó e, como suplente, a\ndo PEC que alterava o capítulo do Sistema Tributário Nacional e a do que\ndava competência à União para recriar o imposto do cheque com a nova\ndenominação de Contribuição Provisória sobre Movimentação Financeira\n(CPMF), entre outras. No plenário da Câmara, votou a favor da criação da\nCPMF.\n\nQuando o assunto reeleição se tornou o principal tema de discussão no\nCongresso, Osmir Lima se disse, inicialmente, favorável somente para os\nfuturos governantes. Mesmo assim, em janeiro de 1997, votou a favor da\nreeleição dos que se encontravam com mandato em vigor e ratificou sua\nposição no mês seguinte, quando a emenda foi aprovada no segundo turno\nde votação na Câmara. Justificou-se dizendo que o seu estado estava\nacima de suas convicções pessoais e ideológicas e que o governo havia se\nmostrado sensível às suas reivindicações, principalmente à construção de\numa rodovia que ligaria o Acre ao Pacífico e seria a salvação econômica\ndo estado. Acabou sendo um dos deputados acusados de haver recebido\nvantagens financeiras para se posicionar favoravelmente à emenda. Nesse\nepisódio, foi inocentado pela Câmara. Em novembro desse ano, votou a\nfavor do projeto de reforma administrativa do governo que, ao ser\naprovado, quebrou a estabilidade do servidor público.\n\nNo pleito de outubro de 1998 concorreu a novo mandato de deputado\nfederal na legenda do PFL, mas só obteve uma suplência. No mês seguinte\nvotou a favor do projeto do governo de reforma da previdência que fixou\num valor máximo para aposentadorias no setor público, bem como a idade\nmínima e o tempo de contribuição no setor privado. Permaneceu na Câmara\ndos Deputados até o fim de janeiro do ano seguinte, quando se encerraram\no seu mandato e a legislatura.\n\nEm 2005, voltou a prestar depoimento na Comissão Parlamentar Mista de\nInquérito (CPMI) da Compra de Votos, segunda etapa de trabalho para a\ninvestigação da suposta compra de votos para aprovação da Emenda da\nReeleição, em 1997. Na ocasião, confirmou que teve suas contas bancárias\ne seu sigilo telefônico investigados pela Polícia Federal em 1997, mas\nque o processo fora arquivado, e reafirmou não ter envolvimento no caso.\n\nEm 2009, filiou-se ao PTB assumindo o cargo de secretário-geral do\ndiretório dessa agremiação no Acre. Nesse mesmo ano, foi citado em ação\ncivil pública por improbidade administrativa, movida pelo Ministério\nPúblico do Acre, que condenou o ex-governador Orleir Cameli. A juíza\nresponsável pelo caso reconheceu, entretanto, a prescrição da ação em\nfavor de Osmir Lima.\n\n         Casou-se com Maria Elizabeth do Vale Lima, com quem teve quatro\nfilhos.\n\nAlan Carneiro\n\nFONTES: ASSEMB. NAC. CONST. *Repertório.*(1987-1988); CÂM. DEP.\n*Deputados brasileiros. Repertório*(1995-1999); *Correio Brasiliense*\n(19/1/1987); *Estado de S. Paulo*(28/11/97); *Folha de S. Paulo* (19 e\n30/1/87,**30/1/97, 6/11/98); *Globo*(29/1/1997); INF. BIOG.; TRIB. REG.\nELEIT. AC. *Relação*(1998); *Página 20* (7/7/2005), INTERNET. Portal da\nCâmara dos Deputados. Disponível\nem****[http://www2.camara.gov.br/](http://www2.camara.gov.br/) Portal\nAcre 24horas. Disponível em****www.ac24horas.com/ .\n\n \n\n \n","ref":"FONTES: ASSEMB. NAC. CONST. *Repertório.*(1987-1988); CÂM. DEP.\n*Deputados brasileiros. Repertório*(1995-1999); *Correio Brasiliense*\n(19/1/1987); *Estado de S. Paulo*(28/11/97); *Folha de S. Paulo* (19 e\n30/1/87,**30/1/97, 6/11/98); *Globo*(29/1/1997); INF. BIOG.; TRIB. REG.\nELEIT. AC. *Relação*(1998); *Página 20* (7/7/2005), INTERNET. Portal da\nCâmara dos Deputados. Disponível\nem****[http://www2.camara.gov.br/](http://www2.camara.gov.br/) Portal\nAcre 24horas. Disponível em****www.ac24horas.com/ .\n\n \n\n \n","dic":"DHBB"}
