{"title":"LINS, Antônio Dávila","cargoss":["Deputado federal","Deputado federal"],"cargos_esp":[0,0],"datas_ini":[1966,1965],"datas_fim":[1966,1965],"estados":["PB","PB"],"autor":[0],"content":"**LINS, Antônio Dávila**\n\n\\*dep. fed. PB 1965 e 1966.\n\n \n\n*Antônio Dávila Lins* nasceu em Areia (PB) no dia 31 de março de 1903,\nfilho de Remígio Veríssimo Dávila Lins e de Miguelina O. Dávila Lins.\n\nMédico, ingressou na política filiando-se ao Partido Republicano (PR),\nem cuja legenda se elegeu deputado estadual, no pleito de outubro de\n1950. Assumindo uma cadeira na Assembléia Legislativa do seu estado em\njaneiro do ano seguinte, reelegeu-se nos pleitos de 1954 e 1958. Em 1960\nfoi candidato a vice-governador, mas não conseguiu se eleger.\n\nTransferindo-se para o Partido Social Democrático (PSD), no pleito de\noutubro de 1962 concorreu a uma cadeira de deputado federal pela\nParaíba, conseguindo apenas uma suplência. Exerceu o mandato de abril a\njulho de 1965 e de maio a agosto de 1966. Em conseqüência da extinção\ndos partidos políticos pelo Ato Institucional nº 2 (27/10/1965) e da\nposterior instauração do bipartidarismo, filiou-se, em 1966, ao\nMovimento Democrático Brasileiro (MDB), partido de oposição ao regime\nmilitar instituído no país após a vitória do movimento político-militar\nde março de 1964 que depôs o presidente João Goulart (1961-1964). No\npleito de novembro de 1966 voltou a concorrer a uma cadeira de deputado\nfederal por seu estado, na legenda do MDB, mas conseguiu, novamente,\napenas uma suplência. A partir de então dedicou-se às suas atividades\nmédicas.\n\nFaleceu em São Paulo no dia 23 de junho de 1983.\n\nEra casado com Helena da Silveira Dávila Lins, com quem teve quatro\nfilhos.\n\n \n\nFONTES: CÂM. DEP. *Deputados*; CÂM. DEP. *Deputados brasileiros.\nRepertório*(1946-1967); INF. Marcelo Renato de Cerqueira Pais; TRIB.\nSUP. ELEIT.*Dados* (6 e 8).\n\n \n","ref":"FONTES: CÂM. DEP. *Deputados*; CÂM. DEP. *Deputados brasileiros.\nRepertório*(1946-1967); INF. Marcelo Renato de Cerqueira Pais; TRIB.\nSUP. ELEIT.*Dados* (6 e 8).\n\n \n","dic":"DHBB"}
