{"title":"LYRA FILHO, João","cargoss":["Deputado federal"],"cargos_esp":[0],"datas_ini":[1967],"datas_fim":[1971],"estados":["PE"],"autor":[0],"content":"**LYRA FILHO, João**\n\n\\*dep. fed. PE 1967-1971.\n\n \n\n*João Lyra Filho* nasceu em Lagoa dos Patos (CE), no dia 12 de março de\n1913, filho de João Soares Lyra e de Alice de Albuquerque Lyra.\n\nComerciante, iniciou a vida política como prefeito do município\npernambucano de Caruaru, em 1959. No pleito de novembro de 1966,\nelegeu-se deputado federal por Pernambuco na legenda do Movimento\nDemocrático Brasileiro (MDB), partido de oposição ao regime militar\ninstaurado no país em abril de 1964. Ao término do mandato, em janeiro\nde 1971, deixou a Câmara dos Deputados.\n\nElegeu-se novamente prefeito de Caruaru em 1972. Com o fim do\nbipartidarismo imposto pelo governo militar, em novembro de 1979, e a\nreorganização partidária, filiou-se ao Partido do Movimento Democrático\nBrasileiro (PMDB), que deu continuidade à linha política oposicionista\ndo MDB.\n\nElegeu-se deputado estadual em novembro de 1982. Foi reeleito em\nnovembro de 1986. Três anos depois trocou o PMDB pelo Partido\nDemocrático Trabalhista (PDT), acompanhando o filho Fernando Lyra, que\nse candidatara a vice-presidente por este partido na chapa encabeçada\npor Leonel Brizola. Deixou a Assembleia Legislativa de Pernambuco em\njaneiro de 1991.\n\nPassou a dedicar-se apenas às suas atividades privadas como empresário\ndo ramo de transportes coletivos.\n\nFaleceu em Caruaru, em 16 de novembro de 1999.\n\nEra casado com Guiomar Fonseca Farias Lira, com quem teve quatro filhos.\nUm deles, Fernando Lyra, foi deputado federal por Pernambuco (1971-1985,\n1986-1991, 1992-1999), ministro da Justiça (1985-1986) e deputado\nconstituinte (1987-1988).\n\n \n\nFONTES: CÂM. DEP. *Deputados*; CÂM. DEP. *Deputados brasileiros.\nRepertório* (1967-1971); INF. FAM. Socorro Lira e Fernando Lyra; SILVA,\nR. *Bacharéis*.\n\n \n","ref":"FONTES: CÂM. DEP. *Deputados*; CÂM. DEP. *Deputados brasileiros.\nRepertório* (1967-1971); INF. FAM. Socorro Lira e Fernando Lyra; SILVA,\nR. *Bacharéis*.\n\n \n","dic":"DHBB"}
