{"title":"LYRA, Carlos","cargoss":["Senador"],"cargos_esp":[0],"datas_ini":[1981],"datas_fim":[1987],"estados":["AL"],"autor":[0],"content":"**LYRA, Carlos**\n\n\\*sen. AL 1981-1987.\n\n \n\n*Carlos Benigno Pereira de Lyra Neto* nasceu em Recife no dia 20 de\njunho de 1925, filho de Salvador Pereira de Lyra e de Maria da Conceição\nDiniz Pereira de Lyra. Seu irmão, João Lyra, foi senador por Alagoas\nentre 1989 e 1991.\n\nMembro de família que desde 1892 se dedica à agroindústria açucareira,\ncursou engenharia química de 1947 a 1951 em Indiana, nos Estados Unidos.\nVoltando ao Brasil, ainda em 1951 assumiu o controle acionário da\nAlgodoeira Lagense. Dando continuidade a suas atividades empresariais,\nem 1965 assumiu o controle acionário da usina Caeté. Anos mais tarde, em\n1976, fundou a Agropecuária Varrela.\n\nEm setembro de 1978 foi eleito, pelo colégio eleitoral de Alagoas,\nsuplente do senador indireto — ou biônico, nome consagrado pela imprensa\n— em chapa encabeçada por Arnon de Melo, político filiado à Aliança\nRenovadora Nacional (Arena), partido de sustentação do regime militar\ninstaurado no país em abril de 1964. No ano seguinte, Lyra fundou a\nAgroindustrial Marituba Ltda. Com a extinção do bipartidarismo em 29 de\nnovembro de 1979, e a conseqüente reformulação partidária, filiou-se à\nnova agremiação governista, o Partido Democrático Social (PDS).\n\nEm 1981, assumiu a vaga de Arnon de Melo, que se licenciara do Senado\npor motivo de saúde. Com a morte do titular em setembro de 1983, foi\nefetivado no mandato. No Colégio Eleitoral, reunido em 15 de janeiro de\n1985, Carlos Lyra**votou no oposicionista Tancredo Neves, eleito novo\npresidente da República pela Aliança Democrática, união do Partido do\nMovimento Democrático Brasileiro (PMDB) com a dissidência do PDS\nabrigada na Frente Liberal que derrotou o candidato do regime militar,\nPaulo Maluf. Contudo, por motivo de doença, Tancredo Neves não chegou a\nser empossado na presidência, vindo a falecer em 21 de abril de 1985.\nSeu substituto no cargo foi o vice José Sarney, que já vinha exercendo\ninterinamente o cargo, desde 15 de março deste ano. Ainda em 1985,\nCarlos Lyra saiu do PDS para filiar-se ao Partido da Frente Liberal\n(PFL).\n\nDurante seu mandato, Lyra participou da reunião da Junta Diretora do\nParlamento Latino-Americano em Buenos Aires, em 1985. Ainda no mesmo\nano, integrou a delegação brasileira à Assembléia Extraordinária do\nParlamento Latino-Americano em Punta del Leste, no Uruguai.\n\nEm 1986, assumiu o controle acionário da Usina Cachoeira e fundou a\nSociedade de Táxi-Aéreo do Nordeste. Permaneceu no Senado até janeiro de\n1987, ao final da legislatura e afastou-se das atividades políticas.\n\nEm 1991, assumiu o controle da Produtos Químicos e Fertilizantes e, no\nano seguinte, da Fábrica da Pedra, empresa do setor têxtil. Três anos\ndepois, fundou a Rádio Pioneira de Delmiro Gouveia (AM e FM) e a\nAgro-Industrial Volta Grande, empresa açucareira localizada em Minas\nGerais. Em 1995 fundou a *holding* do seu grupo empresarial, a Lagense\nS.A — Administração e Participação, sediada em Maceió.\n\nConselheiro da Confederação Nacional da Indústria (CNI), da Associação\nBrasileira dos Criadores de Zebu, em Uberaba (MG), tornou-se membro do\nConselho Empresarial Brasil-Estados Unidos e vice-presidente da\nAssociação dos Criadores de Alagoas.\n\nCasou-se com Nancy Virgínia Karns Lyra, com quem teve dois filhos.\n\n \n\n \n\nFONTES: CURRIC. BIOG.; *Globo* (16/1/85).\n\n \n","ref":"FONTES: CURRIC. BIOG.; *Globo* (16/1/85).\n\n \n","dic":"DHBB"}
