{"title":"LIRA, Fernando","cargoss":["Deputado federal","Ministro da Justiça","Constituinte","Deputado federal","Deputado federal"],"cargos_esp":[0,0,0,0,0],"datas_ini":[1971,1985,1987,1992,1986],"datas_fim":[1985,1986,1988,1999,1991],"estados":["PE",0,0,"PE","PE"],"autor":["Maria Carmina Monteiro","André Couto"],"content":"**LIRA, Fernando**\n\n\\*dep. fed. PE 1971-1985; min. Just. 1985-1986; const. 1987-1988; dep.\nfed. PE 1986-1991 e 1992-1999.\n\n*Fernando Soares Lira* nasceu em Recife no dia 8 de outubro de 1938,\nfilho de João Lira Filho e de Guiomar Fonseca Faria Lira. Seu pai foi\ndeputado federal por Pernambuco de 1967 a 1971.\n\nFormou-se em ciências jurídicas e sociais pela Faculdade de Direito de\nCaruaru (PE).\n\nIniciou a carreira política em novembro de 1966, ao eleger-se deputado\nestadual na legenda do Movimento Democrático Brasileiro (MDB), partido\nde oposição ao regime militar instaurado no país em abril de 1964. Na\nAssembléia Legislativa de Pernambuco, integrou as comissões de Justiça,\nde Finanças e de Adaptação do Regimento Interno e foi líder da bancada\ndo partido.\n\nNo pleito de novembro de 1970 elegeu-se deputado federal. Na Câmara dos\nDeputados, foi membro titular da comissão de Transportes, Comunicações e\nObras Públicas, e suplente das comissões de Constituição e Justiça e do\nPolígono das Secas. Até 1973 atuou como vice-líder da bancada. Fez parte\ndo chamado “grupo autêntico” do MDB, que defendia um posicionamento mais\nfirme do partido no combate ao regime militar, em contraposição à\npostura conciliadora preconizada pelo “grupo moderado”.\n\nReelegeu-se quatro anos depois, retornando à Câmara em abril do ano\nseguinte para ocupar a vice-liderança do PMDB. Nessa legislatura, voltou\na integrar as comissões de Transportes, Comunicações e Obras Públicas e\ndo Polígono das Secas. Reeleito mais uma vez em novembro de 1978, foi\nconfirmado na vice-liderança de seu partido e permaneceu na comissão de\nTransportes, Comunicações e Obras Públicas.\n\nEm abril de 1979 fez declarações à imprensa contra a criação de novos\npartidos políticos por considerar um fator de enfraquecimento da\noposição. Defendeu a convocação de uma assembléia nacional constituinte\n(ANC) como o caminho mais adequado ao processo de redemocratização.\n\nCom o fim do bipartidarismo, em 29 de novembro de 1979, e a reformulação\npartidária, filiou-se ao Partido do Movimento Democrático Brasileiro\n(PMDB), agremiação que incorporou a maioria dos membros do antigo MDB.\nEm setembro de 1980 chamou a atenção para a necessidade de a oposição,\nem especial o PMDB, formular “uma alternativa viável” para tirar o\nBrasil da crise. Criticou a tese de união nacional preconizada por\nlideranças governistas, sob a alegação de que o governo não tinha mais\ncredibilidade para continuar no comando do país. No mês seguinte, porém,\nlançou a proposta de entendimento da oposição com todas as forças\nrepresentativas da sociedade, inclusive os militares, recebendo o apoio\ndo general Florimar Campelo, comandante do IV Exército. A proposta foi\ncriticada pelo governador da Bahia, Antônio Carlos Magalhães, para quem\no diálogo com os militares deveria ser intermediado pelo presidente da\nRepública, para não ter conotação conspirativa.\n\nNas eleições de novembro de 1982, reelegeu-se para a Câmara dos\nDeputados, passando a ocupar o cargo de primeiro-secretário da mesa\ndiretora. Defendeu uma postura de maior moderação em relação ao governo\nfederal, argumentando que o momento político era diferente dos anos\nanteriores. Segundo Lira, o processo de abertura política iniciado pelo\npresidente Ernesto Geisel e que teve continuidade no governo do general\nJoão Batista Figueiredo exigia negociação e entendimento. Na sua\nopinião, a convocação de eleições diretas para presidente da República\ndeveria ser antecedida pelo reordenamento constitucional do país. Nesse\nsentido, alinhava-se ao “grupo moderado” do PMDB, que tinha como\nprincipal liderança o governador mineiro Tancredo Neves, e\ndistanciava-se da ala liderada pelo presidente nacional do partido,\ndeputado Ulisses Guimarães, que defendia a convocação imediata de\neleições presidenciais diretas.\n\nNos primeiros meses de 1984, com o apoio maciço da sociedade, a oposição\ndeflagrou a campanha das Diretas Já. Apesar da pressão social, em abril,\na Câmara dos Deputados rejeitou a emenda constitucional apresentada pelo\ndeputado Dante de Oliveira (PMDB-MT), que previa o restabelecimento do\npleito direto em novembro daquele mesmo ano. Acompanhando a posição do\nconjunto da bancada peemedebista, Fernando Lira votou a favor da\nproposta.\n\nDiante da derrota da emenda, Fernando Lira empenhou-se no lançamento da\ncandidatura de Tancredo Neves à presidência da República pela via\nindireta, tornando-se um de seus principais articuladores. Participou\ndas negociações visando à formação da Aliança Democrática — frente que\nenglobava o PMDB e dissidentes do Partido Democrático Social (PDS),\nreunidos na Frente Liberal. Em 15 de janeiro de 1985, o Colégio\nEleitoral encarregado de escolher o novo presidente da República elegeu\na chapa da Aliança Democrática, formada por Tancredo Neves e José\nSarney, ex-presidente do PDS que se filiara ao PMDB, derrotando assim o\ncandidato governista, Paulo Maluf.\n\nPouco antes da posse, prevista para 15 de março de 1985, Tancredo ficou\ngravemente doente e morreu no dia 21 de abril. O vice José Sarney, que\njá assumira interinamente, foi efetivado na presidência da República. Na\ncomposição do novo ministério, optou por manter os nomes que já haviam\nsido definidos por Tancredo, entre os quais o de Fernando Lira para a\npasta da Justiça.\n\nNo Ministério da Justiça\n\nEm seu discurso de posse, Lira rechaçou a possibilidade de um retrocesso\ninstitucional e frisou que a Nova República, nome pelo qual ficou\nconhecido o período de transição pós-regime militar, consolidaria a\ndemocracia através da “participação de todo o povo”. Uma de suas\nprimeiras iniciativas como ministro foi a formação do Conselho Político\ndo Governo, com a incumbência de promover mudanças na legislação\npolítica, entre as quais a extinção da fidelidade partidária, da\nsublegenda e da Lei Falcão, bem como a permissão de coligações\npartidárias. Em abril de 1985 foi extinto o Conselho Nacional de\nCensura. Seguindo as diretrizes traçadas por Tancredo Neves, Fernando\nLira criou, ainda em abril, uma comissão composta por juristas, cuja\ntarefa era tornar mais flexível a Lei dos Estrangeiros, aprovada no\nCongresso Nacional durante o governo Figueiredo. Promoveu ainda uma\nreformulação na Comissão de Defesa dos Direitos da Pessoa Humana (CDDPH)\n— órgão originalmente encarregado de apurar denúncias de tortura contra\npresos políticos — no sentido de fazê-la agir no combate a toda forma de\nviolência, dotando-a de um procurador responsável pela apuração das\ndenúncias de violação dos direitos humanos em cada estado.\n\nEm maio de 1985, ocorreram os primeiros atritos entre Lira e o\npresidente Sarney em torno do controle da Comissão da Reforma\nConstitucional, encarregada de elaborar um anteprojeto de Constituição\npara o país. Para Lira, a comissão — formada por eminentes juristas e\npresidida pelo ex-ministro Afonso Arinos — deveria ficar subordinada ao\nMinistério da Justiça. Sarney e Arinos queriam que fosse vinculada\ndiretamente à presidência da República. Lira defendia ainda maior\nparticipação de membros da sociedade civil na referida comissão, o que\ntambém o colocava em choque com o presidente.\n\nPressionado ainda por setores militares que criticavam publicamente\nSarney pela presença de “comunistas” no primeiro escalão do ministério,\nLira acabou por deixar a pasta em fevereiro de 1986, reassumindo em\nseguida sua cadeira na Câmara dos Deputados. Substituído por Paulo\nBrossard, deixou como legado importantes anteprojetos que visavam à\nplena consolidação do estado de direito, entre os quais uma nova lei de\nsegurança nacional, concebida a partir de bases conceituais que incluíam\ngarantias ao exercício das liberdades públicas e individuais, e a Lei de\nAcesso à Informação, que garantia aos cidadãos acesso aos arquivos dos\nórgãos responsáveis pela repressão política durante o regime militar,\ndentre os quais o Serviço Nacional de Informações (SNI).\n\nDe volta à Câmara\n\nEm fevereiro de 1986, a equipe econômica do governo federal, tentando\nconter a inflação que chegava a 80% ao mês, lançou o Plano de\nEstabilização Econômica — batizado de Plano Cruzado — que, entre outras\nmedidas, promoveu o congelamento de preços e salários. O grande apoio\npopular conquistado inicialmente se refletiu nas eleições para os\ngovernos estaduais e para a Assembléia Nacional Constituinte, em\nnovembro de 1986. O PMDB obteve vitória esmagadora em todo o país:\nelegeu 22 dos 23 governadores e conquistou maioria absoluta na Câmara\ndos Deputados. Fernando Lira foi reeleito deputado federal pelo PMDB\npernambucano, sendo o constituinte mais votado em seu estado, com mais\nde 90 mil votos.\n\nIniciados os trabalhos da nova legislatura, em 1º de fevereiro de 1987,\nLira candidatou-se à presidência da Assembléia Constituinte, mas foi\nderrotado por Ulisses Guimarães (PMDB-SP) por 299 a 155 votos. Durante\nos trabalhos da Constituinte, atuou como membro titular na Comissão de\nSistematização (1987-1988) e, como suplente, na Subcomissão do Poder\nExecutivo da Comissão de Organização dos Poderes e Sistema de Governo\n(1988).\n\nEm 1987, ainda na Constituinte, rompeu com o PMDB e filiou-se ao Partido\nDemocrático Trabalhista (PDT), liderado pelo ex-governador fluminense\nLeonel Brizola.\n\nVotou a favor do regime parlamentarista, da limitação do direito de\npropriedade privada, do mandado de segurança coletivo, da proteção ao\nemprego contra a demissão sem justa causa, da jornada semanal de\ntrabalho de 40 horas, do estabelecimento do limite máximo de seis horas\npara os turnos de trabalho ininterrupto, do aviso prévio proporcional,\nda unicidade sindical, do direito de voto aos 16 anos, da nacionalização\ndo subsolo, do limite de 12% ao ano para os juros reais e da limitação\ndos encargos da dívida externa. Opôs-se à adoção da pena de morte e\nvotou contra o mandato presidencial de cinco anos para Sarney. Após a\npromulgação da nova Carta Constitucional (5 de outubro de 1988), voltou\na participar dos trabalhos legislativos ordinários na Câmara dos\nDeputados.\n\nNas eleições presidenciais de 1989, a primeira pelo voto direto desde\n1960, Lira foi candidato a vice-presidente na chapa do PDT encabeçada\npor Leonel Brizola, que ficou em terceiro lugar, com 11.166.016 votos.\nDerrotado, acompanhou a posição do PDT, que no segundo turno apoiou o\ncandidato Luís Inácio Lula da Silva, do Partido dos Trabalhadores (PT).\nPorém, o eleito foi Fernando Collor de Melo, do Partido da Reconstrução\nNacional (PRN).\n\nEm outubro de 1990, Lira candidatou-se a novo mandato de deputado\nfederal, mas obteve apenas uma suplência. Voltou à Câmara dos Deputados\nem dezembro de 1992, na vaga de Fernando Bezerra Coelho. Com a renúncia\ndeste parlamentar ao mandato, foi efetivado em 1º de janeiro de 1993. Em\nagosto, alegando divergências com a cúpula do PDT, filiou-se ao Partido\nSocialista Brasileiro (PSB), que tinha como líder o ex-governador de\nPernambuco e deputado federal Miguel Arrais.\n\nNo cargo de corregedor-geral da Câmara dos Deputados, Lira foi\nresponsável, em outubro de 1993, pela apuração de denúncias de corrupção\nna adesão de deputados federais ao Partido Social Democrático (PSD). Ao\nfinal do seu trabalho, redigiu um parecer recomendando a cassação de\ntrês parlamentares do PSD por falta de ética e decoro parlamentar. Em\ndezembro seguinte, o plenário da Câmara decidiu pela cassação de\nOnaireves Moura (PR), Nobel Moura (RO) e Itsuo Takayama (MT), acatando o\nparecer de Lira.\n\nEm setembro de 1993, novo escândalo de corrupção abalou a vida política\ndo país. Desta vez, as denúncias envolviam um grupo de deputados,\nacusados de fraudes na Comissão de Orçamento da Câmara. A Comissão\nParlamentar de Inquérito (CPI) instalada para apurar as denúncias\nrecomendou a cassação de alguns parlamentares, mas por falta de\nevidências conclusivas o relator, deputado Roberto Magalhães (PFL-PE),\noptou por encaminhar relatório à Corregedoria da Câmara, em fevereiro de\n1994, pedindo o aprofundamento das investigações sobre outros nove\nparlamentares. Fernando Lira, que de início criticou o relator da CPI\npor achar que existiam elementos jurídicos suficientes sobre a\nculpabilidade dos suspeitos, optou mais tarde por inocentar quatro dos\nenvolvidos — Gastone Righi (PTB-SP), Roberto Jefferson (PTB-RJ),\nUldorico Pinto (PSB-BA) e Mussa Demes (PFL-PI) — e enviar ao ministério\npúblico as denúncias sobre os cinco restantes — José Luís Maia (PPR-PI),\nPais Landim (PFL-PI), Pinheiro Landim (PMDB-CE), José Carlos Aleluia\n(PFL-BA) e José Carlos Vasconcelos (PRN-PE).\n\nNas principais matérias constitucionais apresentadas na Câmara dos\nDeputados ao longo da legislatura 1991-1995, faltou às votações que\naprovaram a criação do Imposto Provisório sobre Movimentação Financeira\n(IPMF) — tributo de 0,25% sobre transações bancárias a ser utilizado\ncomo fonte complementar de recursos para a saúde — e do Fundo Social de\nEmergência (FSE), que permitia ao governo retirar recursos de áreas como\nsaúde e educação, ficando assim com maior liberdade de administração das\nverbas. Não compareceu também à sessão que decidiu sobre o fim do voto\nobrigatório.\n\nEm outubro de 1994, foi reeleito deputado federal pela sétima vez e\nparticipou dos trabalhos legislativos como líder do bloco formado pelo\nPSB e pelo Partido da Mobilização Nacional (PMN). Atuou também como\ntitular das comissões de Trabalho, Administração e Serviço Público e de\nRelações Exteriores e Defesa Nacional.\n\nNas votações das emendas constitucionais propostas pelo governo federal\nem 1995, manifestou-se contra a quebra do monopólio estatal nas\ntelecomunicações, na exploração do petróleo e na distribuição de gás\ncanalizado pelos governos estaduais, a mudança no conceito de empresa\nnacional e a abertura da navegação de cabotagem a embarcações\nestrangeiras.\n\nDesde o início do governo, o presidente Fernando Henrique Cardoso\niniciou articulações junto à sua base de apoio parlamentar visando à\naprovação de emenda constitucional que permitia a reeleição dos\nocupantes de cargo executivo.\n\nEm outubro de 1996, Lira ocupava a liderança do PSB na Câmara Federal e\nse autonomeou representante do partido na comissão especial criada para\napreciar a emenda da reeleição. Favorável à proposta, aproveitou o\nmomento político para reaproximar o governador Miguel Arrais (PSB-PE) de\nFernando Henrique.\n\nAinda em outubro, conhecidos os resultados do pleito municipal realizado\nem todo o Brasil — no qual o PSB conquistou importantes prefeituras,\ncomo as de Belo Horizonte, Maceió e Natal — passou a pregar a\nnecessidade de o partido assumir um papel mais destacado entre as\nagremiações de esquerda. Defendeu o não alinhamento do partido a uma\neventual candidatura do PT nas eleições presidenciais de 1998.\n\nNo mês seguinte, a executiva nacional do PSB decidiu posicionar-se\ncontra a emenda da reeleição, provocando a saída de Fernando Lira da\nliderança do partido na Câmara. Isto, porém, não impediu que, em janeiro\nde 1997, ainda na condição de membro da comissão especial da Câmara\ncriada para analisar a questão, votasse a favor, enquanto todos os\ndemais representantes dos partidos de esquerda manifestaram-se contra.\nNas votações em plenário nos dois turnos, em janeiro/fevereiro de 1997,\nFernando Lira pronunciou-se favoravelmente à emenda. Em novembro, faltou\nà votação que aprovou o fim da estabilidade do servidor público, item da\nreforma administrativa.\n\nNo primeiro semestre de 1998, contrariando a posição de Lira, o PSB\ndecidiu integrar-se à coligação que lançou o nome de Lula para disputar\nmais uma vez a presidência da República na eleição de outubro. Mas\nFernando Henrique, candidato da coligação PSDB-PFL, foi reeleito\npresidente. Fernando Lira optou por não disputar novo mandato.\n\nAntes de deixar a Câmara dos Deputados, votou contra o teto de 1.200\nreais para aposentadorias no setor público e o estabelecimento de idade\nmínima e de tempo de contribuição para o setor privado, itens que\ndefiniram a reforma da previdência. Deixou o Congresso em janeiro de\n1999, ao final da legislatura.\n\nEm 2003, assumiu a presidência da Fundação Joaquim Nabuco (Fundaj), do\nMinistério da Educação, em Recife, cuja missão consistia em promover\natividades científicas e culturais, tendo em vista a compreensão e o\ndesenvolvimento da  sociedade brasileira, prioritariamente a do Norte e\ndo Nordeste.\n\nCasou-se com Márcia Maria Teixeira Lira, com quem teve três filhos.\n\nPublicou o livro *Daquilo que eu sei – Tancredo e a transição\ndemocrática*(2009).\n\nMaria Carmina Monteiro/André Couto\n\nFONTES: CÂM. DEP. *Deputados;*CÂM. DEP. *Deputados brasileiros.\nRepertório* (1971-1975 e 1975-1979); CÂM. DEP. *Relação nominal dos\nsenhores; Estado de S. Paulo* (30/10 e 19/11/96);*Folha de S. Paulo*\n(4/3/94 e 6/11/98); *Globo*(20/10/80, 15/1/81, 3/8/93, 28 e 30/1/94, 18\ne 29/11/96);*Jornal do Brasil* (2/7/77, 14/4 e 12/8/79, 15/9 e 1/11/80,\n22/10/93, 11/10 e 21/11/96, 16/1/97, 4/10/98); NÉRI, S. *16; Olho no\nCongresso/Folha de S. Paulo* (14/1/96); *Olho no voto/Folha de S.\nPaulo*(18/9/94 e 29/9/98);*Perfil*(1980).\n\n \n","ref":"FONTES: CÂM. DEP. *Deputados;*CÂM. DEP. *Deputados brasileiros.\nRepertório* (1971-1975 e 1975-1979); CÂM. DEP. *Relação nominal dos\nsenhores; Estado de S. Paulo* (30/10 e 19/11/96);*Folha de S. Paulo*\n(4/3/94 e 6/11/98); *Globo*(20/10/80, 15/1/81, 3/8/93, 28 e 30/1/94, 18\ne 29/11/96);*Jornal do Brasil* (2/7/77, 14/4 e 12/8/79, 15/9 e 1/11/80,\n22/10/93, 11/10 e 21/11/96, 16/1/97, 4/10/98); NÉRI, S. *16; Olho no\nCongresso/Folha de S. Paulo* (14/1/96); *Olho no voto/Folha de S.\nPaulo*(18/9/94 e 29/9/98);*Perfil*(1980).\n\n \n","dic":"DHBB"}
