{"title":"LOBÃO, Dermeval","cargoss":["Deputado federal"],"cargos_esp":[0],"datas_ini":[1951],"datas_fim":[1955],"estados":["PI"],"autor":[0],"content":"**LOBÃO, Dermeval**\n\n\\*dep. fed. PI 1951-1955.\n\n* *\n\n*Dermeval Lobão Veras* nasceu em Campo Maior (PI) no dia 17 de fevereiro\nde 1915, filho de Pergentino Lobão Veras e de Lina Fortes Lobão.\n\nCursou o Ginásio Municipal de São Francisco de Sales e o Liceu\nPiauiense, ambos em Teresina. Transferindo-se para São Luís, em 1936\nbacharelou-se em ciências jurídicas e sociais pela Faculdade de Direito\ndo Maranhão.\n\nRetornando a seu estado natal, passou a exercer a advocacia e tornou-se\nainda inspetor do ensino secundário, diretor do Liceu Piauiense e\ndiretor-geral do Departamento Estadual da Fazenda. Iniciou-se na\npolítica concorrendo ao pleito de dezembro de 1945 para a Assembléia\nNacional Constituinte na legenda da União Democrática Nacional (UDN).\nObtendo apenas uma suplência, não exerceu mandato. Em 1946 assumiu o\ncargo de juiz do Tribunal de Contas do Piauí e em 1949 foi designado\ndelegado regional do Serviço Nacional de Recenseamento.\n\nNo pleito de outubro de 1950 elegeu-se deputado federal pelo Piauí na\nlegenda da UDN, tomando assento na Câmara em fevereiro do ano seguinte.\nEm outubro de 1954 tentou a reeleição na legenda da Coligação\nDemocrática Trabalhista, formada pelo Partido Social Democrático (PSD) e\no Partido Trabalhista Brasileiro (PTB), mas obteve apenas uma suplência.\nEm janeiro de 1955 deixou a Câmara dos Deputados, não voltando a exercer\nmandato.\n\nFoi membro do Instituto dos Advogados Piauienses e da Associação\nPiauiense de Imprensa.\n\nFaleceu em Teresina no dia 4 de setembro de 1958, vitimado por desastre\naéreo juntamente com o deputado federal Marcos Parente, quando realizava\nsua campanha eleitoral para o governo do estado na legenda da UDN.\n\n \n\n \n\nFONTES: CÂM. DEP. Anais (1958/16); CÂM. DEP. Deputados; CÂM. DEP.\nRelação dos dep.; CISNEIROS, A. Parlamentares.\n\n \n","ref":"FONTES: CÂM. DEP. Anais (1958/16); CÂM. DEP. Deputados; CÂM. DEP.\nRelação dos dep.; CISNEIROS, A. Parlamentares.\n\n \n","dic":"DHBB"}
