{"title":"ANUNCIAÇÃO, Manuel","cargoss":["Deputado federal","Deputado federal"],"cargos_esp":[0,0],"datas_ini":[1953,1947],"datas_fim":[1953,1951],"estados":["AM","AM"],"autor":[0],"content":"**ANUNCIAÇÃO, Manuel**\n\n\\*dep. fed. AM 1947-1951 e 1953.\n\n*Manuel Elias de Almeida Anunciação* nasceu em Pernambuco no dia 20 de\njulho de 1902, filho de Antônio Ferreira Anunciação e de Maria Luísa de\nAlmeida Anunciação.\n\nFuncionário público federal, candidatou-se a deputado à Assembléia\nNacional Constituinte pelo Amazonas, na legenda do Partido Trabalhista\nBrasileiro (PTB) no pleito de dezembro de 1945, obtendo uma suplência.\n\nAssumiu uma cadeira na Câmara dos Deputados somente depois de promulgada\na Constituição, em 3 de maio de 1947, e durante seu mandato integrou a\nComissão de Obras Públicas e a Comissão de Valorização Econômica da\nAmazônia.\n\nNo pleito de outubro de 1950, elegeu-se novamente suplente de deputado\nfederal pelo Amazonas, dessa vez na legenda da Aliança Popular\nPró-Getúlio Vargas, coligação composta pelo PTB e pelo Partido Social\nProgressista (PSP). Encerrando seu primeiro mandato em janeiro de 1951,\ntornou a ocupar uma cadeira na Câmara entre 16 de outubro e 14 de\ndezembro de 1953. Em outubro de 1954, disputou uma vaga no Senado, mas\nnão logrou se eleger.\n\nFONTES: CÂM. DEP. *Deputados;*CÂM. DEP. *Deputados\nbrasileiros*(1946-1967); CISNEIROS, A. *Parlamentares; Diário do\nCongresso* *Nacional;*TRIB. SUP. ELEIT. *Dados*(1**e 2).\n\n \n","ref":"FONTES: CÂM. DEP. *Deputados;*CÂM. DEP. *Deputados\nbrasileiros*(1946-1967); CISNEIROS, A. *Parlamentares; Diário do\nCongresso* *Nacional;*TRIB. SUP. ELEIT. *Dados*(1**e 2).\n\n \n","dic":"DHBB"}
