{"title":"LOBO, Lélio Viana","cargoss":["Ministro da Aeronáutica","Presidente de associação ou confederação de empregados ou empregadores","Ministro da Aeronáutica"],"cargos_esp":[0,"Telebrás",0],"datas_ini":[1992,1995,1995],"datas_fim":[1995,1995,1998],"estados":[0,0,0],"autor":[0],"content":"**LOBO, Lélio Viana**\n\n\\*militar; min. Aer. 1992-1995; pres. Telebrás 1995; min. Aer.\n1995-1998.\n\n \n\n*Lélio Viana Lobo*nasceu no dia 19 de julho de 1931, em Formosa (GO).\n\nIngressou na Academia da Força Aérea, então Escola de Aeronáutica, em\nabril de 1948, diplomando-se oficial-aviador em dezembro de 1951.\n\nDurante vários anos atuou como piloto de patrulha e de transporte. Entre\nas funções exercidas ao longo de sua trajetória, destacam-se as de\ninstrutor da Escola de Comando e Estado-Maior da Aeronáutica (Emaer),\nchefe da Assessoria de Logística do gabinete do Ministro da Aeronáutica,\nadido aeronáutico junto à embaixada do Brasil na França, subchefe do\nEmaer, presidente da comissão coordenadora do Programa Aeronave de\nCombate, chefe da delegação brasileira na comissão diretora do programa\nconjunto AMX (com a Itália), vice-chefe do Emaer, secretário de Economia\ne Finanças da Aeronáutica, diretor-geral do Departamento de Pesquisas e\nDesenvolvimento, chefe do Emaer, presidente da Empresa Brasileira de\nInfra-Estrutura Aeroportuária (Infraero).\n\nLélio Lobo atingiu o generalato em julho de 1980, sendo promovido a\nmajor-brigadeiro em julho de 1984 e a tenente-brigadeiro do ar em julho\nde 1988. Em julho de 1992 passou para a reserva remunerada.\n\n Ministério da Aeronáutica (1992-1995)\n\nConsiderado um oficial extremamente voltado para a profissionalização da\nforça, sendo um dos principais articuladores do projeto de construção do\ncaça AMX, Lélio Lobo assumiu o cargo de ministro da Aeronáutica em 9 de\noutubro de 1992, em substituição ao brigadeiro Sócrates Monteiro. Em seu\ndiscurso de posse garantiu que iria “lutar pela justiça salarial entre\nos servidores da União”. Em novembro, criticou a criação do Ministério\nda Defesa, considerando a iniciativa inoportuna ante a gravidade dos\nproblemas enfrentados pelo país naquele momento.\n\nEm abril de 1993, juntamente com os ministros da Marinha e do Exército,\nLélio Lobo reagiu negativamente à proposta de indenização das famílias\ndos desaparecidos políticos durante o regime militar implantado pelo\nmovimento de 31 de março de 1964 por entenderem que eles haviam\nenfrentado uma guerra com os grupos de esquerda e por temerem que se\nlevantasse “uma discussão desnecessária, neste momento, sobre o\npassado”. No mesmo mês o jornal *The New York Times* publicou\ninformações sobre a hipótese de um golpe militar no Brasil em\nconseqüência do descontrole inflacionário vivido pelo país. O ministro\nda Aeronáutica, a exemplo dos ministros do Exército e da Marinha,\ndesmentiu a notícia, afirmando que o país já gozava de “maturidade\nsuficiente para garantirmos a democracia no mais alto nível”.\n\nNo mês seguinte, Lélio Lobo reagiu à denúncia feita por militares do\nExército de instalação de bases americanas nas fronteiras do Brasil com\nSuriname, Guiana e Colômbia. Ele afirmou desconhecer o fato e defendeu a\nimplantação do Sistema de Vigilância da Amazônia (Sivam) — projeto\ngovernamental voltado para o monitoramento do espaço físico da Amazônia\nLegal brasileira, mediante um sistema integrado de radares e\nsofisticados equipamentos de comunicação, meteorologia e sensoreamento\nremoto. O ministro negou que o Sivam representasse uma reação do Brasil\ncontra a ação americana e que tivesse qualquer finalidade militar.\nDefendeu o projeto enfatizando a finalidade de coletar informações que\npermitiriam ao Governo tomar ações integradas na preservação do\nequilíbrio ambiental aliado ao desenvolvimento sustentado, no combate às\natividades ilegais como o contrabando e o narcotráfico, na fiscalização\ndas reservas indígenas, bem como no acompanhamento das atividades de\nsaúde, vigilância de fronteiras e apoio ao tráfego aéreo e naval.\nSegundo o ministro, por ser um sistema que envolvia a segurança e defesa\nnacional, seria dispensada a licitação pública para aquisição de\nequipamentos, de acordo com a lei que regulamenta o assunto. Ao Conselho\nde Defesa Nacional (CDN), convocado pelo presidente Itamar Franco para\ntratar da implantação do Sivam, caberia dar o aval para a liberação dos\nrecursos necessários.\n\nEm outubro de 1993, em discurso no Clube da Aeronáutica, Lélio Lobo\ninformou que os ministros militares apresentariam ao ministro da\nJustiça, Maurício Correia, um documento contendo as posições das forças\narmadas em relação à revisão da Constituição. Segundo ele, os militares\nnão admitiam perder a competência que lhes fora assegurada pelo Artigo\n142 da Constituição, para cuidar da lei e da ordem, quando essas se\nencontravam ameaçadas. Os militares queriam ser enquadrados como\nservidores do Estado, o que resolveria sua questão salarial, e defendiam\na manutenção do serviço militar obrigatório.\n\nEm cerimônia comemorativa do aniversário do Correio Aéreo Nacional, em\njunho de 1994, o ministro classificou de aflitiva a situação da tropa\ndiante dos baixos soldos, mas assegurou que a “disciplina e o respeito à\nhierarquia” não seriam transgredidos pelas forças armadas. Afirmou que\ntorcia pelo sucesso do Plano Real, plano de estabilização econômica\nimplantado no início do ano, para a superação da crise provocada pela\ninflação. Em novembro, defendeu a ampliação da presença militar nas\nfronteiras brasileiras e elogiou o projeto Calha Norte, na Amazônia,\nregião onde “a civilização só chega de avião”. Alguns setores da Igreja\nCatólica, entretanto, acusavam o projeto de promover uma ocupação\ndesordenada da floresta.\n\nLélio Lobo transmitiu a pasta em 1º de janeiro de 1995 ao brigadeiro\nMauro José Miranda Gandra, que passou a integrar a equipe do presidente\nFernando Henrique Cardoso, eleito no pleito de outubro do ano anterior.\n\nEm fevereiro de 1995, assumiu a presidência da Telebrás, cargo que\ndeixou em novembro do mesmo ano para tomar posse, mais uma vez, da pasta\nda Aeronáutica, desta feita a convite do presidente da República\nFernando Henrique Cardoso, para substituir o brigadeiro Mauro Gandra. A\nescolha de Lélio Lobo demonstrou que o Sivam se mantinha como prioridade\ndo governo Fernando Henrique, apesar das denúncias envolvendo o projeto,\nàs quais se ligara a própria exoneração de Gandra.\n\nO Alto Comando da Aeronáutica, apesar de não consultado na escolha do\nnovo ministro, mostrou-se satisfeito com a designação de Lélio Lobo. Em\nnota oficial de apoio a Gandra divulgada pela cúpula da Aeronáutica,\nficava patente que a troca de ministro não provocaria uma crise na área\nmilitar. O apoio à escolha do presidente foi uma decisão política para\nsalvar o Sivam, cuja implantação, a cargo da empresa americana Raytheon,\nera tratada como tarefa prioritária no Ministério da Aeronáutica. Fora\nLélio Lobo, quando à frente dessa pasta, e Mário César Flores, então\nchefe da Secretaria de Assuntos Estratégicos (SAE), que convenceram\nItamar Franco a tirar o Sivam da gaveta. Por causa desse envolvimento\ncom o projeto, parte da cúpula da Aeronáutica considerava que sua volta\najudaria a articular a salvação do Sivam. Isso, por si só, justificaria\na quebra na linha natural de sucessão, que previa a entrega do\nministério ao então chefe do Alto Comando da Força, o brigadeiro Ulisses\nPinto Correia Neto, que fora designado como ministro interino por\nFernando Henrique Cardoso. Ao grupo insatisfeito com isso desagradou\ntambém o fato de o presidente ter aceitado a exoneração de Mauro Gandra\nsem ter provas que o incriminassem.\n\nTambém pesara na indicação de Lobo seu conhecido temperamento\nconciliador, demonstrado no governo de Itamar Franco, quando foi o único\nministro militar a não pressionar o Planalto por mais verbas e por\naumento para os militares. Ministro da Fazenda nessa época, Fernando\nHenrique tivera atritos com Exército e Marinha nas discussões sobre\nreajuste salarial dos militares. Essa atitude assumida por Lélio Lobo\nfez com que uma parte dos oficiais da Aeronáutica desaprovasse sua\nindicação para o cargo.\n\nMinistério da Aeronáutica (1995-1998)\n\nLélio Lobo tomou posse no cargo de ministro da Aeronáutica no dia 21 de\nnovembro de 1995, em meio a uma crise causada pela demissão de seu\nantecessor. Ulisses Pinto Correia Neto pediu transferência para a\nreserva em protesto pela saída de Gandra do ministério. Todo o Alto\nComando da Aeronáutica estava irritado com a demissão de Gandra e exigia\numa investigação sobre o grampeamento do telefone do embaixador Júlio\nCésar dos Santos, ambos os episódios ligados às denúncias de\nirregularidades do Sivam. Motivo do descontentamento foi também a\nsolicitude com que Lobo aceitara o convite em meio à crise.\n\nLélio Lobo teve ainda que administrar o descontentamento da cúpula da\nAeronáutica com a proposta, em estudo pela Presidência da República, de\nretirada do Departamento de Aviação Civil (DAC) da órbita militar. Outro\nmotivo de apreensão era a criação do Ministério da Defesa, que reuniria\nAeronáutica, Exército, Marinha e EMFA numa só pasta, parte do programa\nde governo de Fernando Henrique divulgado durante sua campanha eleitoral\nem 1994.\n\nA saída de Gandra foi um dos episódios ligados à série de denúncias\ncontra o Sivam. Vencido por um consórcio liderado pela firma americana\nRaytheon, o processo fora posto sob suspeição após várias denúncias de\nsuperfaturamento, corrupção e fraudes contra a Previdência Social,\nenvolvendo a participação do Ministério da Aeronáutica, a Secretaria de\nAssuntos Estratégicos, a embaixada brasileira nos Estados Unidos, bem\ncomo empresas nacionais e estrangeiras.\n\nEm novembro de 1995, instalou-se uma supercomissão do Senado para\ninvestigar o Sivam, presidida por Antônio Carlos Magalhães (PFL-BA) e\ntendo como relator Ramez Tebet (PMDB-MS). Inquirido por ela a respeito\ndo processo de licitação, Lobo informou que o governo brasileiro\nrealizara concorrência sigilosa para a escolha da empresa que executaria\no projeto, em “um processo licitatório especial”, no qual a americana\nRaytheon Company saiu vencedora. No mesmo mês, vetou a revisão do Sivam\ne um eventual cancelamento do contrato com a Raytheon. Em audiência a\nlíderes do PMDB, declarou que o cancelamento do contrato teria forte\nrepercussão internacional e poderia afetar a credibilidade do país, e\nque em caso de anulação do contrato o processo de escolha da empresa que\nexecutaria o Sivam teria de seguir o mesmo procedimento, pois a\nexistência de informações sigilosas impedia uma concorrência pública\nconvencional. Lobo anunciou que faria uma defesa férrea do projeto junto\nao CDN, convocado pelo presidente da República. Tratava-se do mesmo\nórgão que autorizara, no governo anterior, a dispensa de concorrência\npara o projeto, e que aprovara o afastamento da Engenharia de Sistemas\nde Controle e Automação (ESCA) — única empresa nacional habilitada para\nassimilar a tecnologia de radares desenvolvida pelos fornecedores\nestrangeiros escolhida para gerenciar o Sivam — fraudara a previdência\nsocial. Tentava-se evitar a criação de uma comissão parlamentar de\ninquérito para investigar o projeto.\n\n Em dezembro de 1995, o governo fez um relatório em defesa da manutenção\ndo projeto original, que seria confrontado com o relatório do senador\nGilberto Miranda (PMDB-AM). O relator Ramez Tebet declarou-se satisfeito\ncom tal material e com os depoimentos dados à comissão por três\nmilitares ligados à SAE, ao Estado-Maior da Aeronáutica, e à Comissão\nCoordenadora do Sivam. O último passo na apuração de denúncias contra o\nprojeto seria o depoimento de Lobo. A *Folha de S. Paulo* apurara,\nentretanto, que mesmo antes desse depoimento o parecer de Tebet já\nestava pronto — ele considerava correto o pedido de financiamento para o\nSivam (1,4 bilhão de reais), e que a dispensa de licitação se dera\nconforme a legislação, recomendando que uma comissão especial do Senado\nacompanhasse a implantação do projeto. As únicas irregularidades, as\nrelacionadas à ESCA já estariam superadas uma vez que a empresa fora\nafastada do gerenciamento do projeto.\n\nA estratégia do governo para encerrar a polêmica em torno do Sivam\nfracassou com o depoimento do ministro da Aeronáutica, em 12 de dezembro\nde 1995. Sua atuação ao tentar explicar as irregularidades apontadas no\nprojeto e no contrato deixou mais dúvidas, desarticulou os líderes\ngovernistas e naufragou diante de novas denúncias contidas em relatório\ndo TCU sobre o Sivam. A explicação quanto ao aumento de recursos para a\nESCA no contrato, por exemplo, foi desmentida pelo relator do Sivam,\nsenador Gilberto Miranda (PMDB-AM), e mostrou que o próprio ministério\nnão tinha controle sobre a escolha dos equipamentos e seus preços. Lélio\nLobo se recusou a comentar as irregularidades apontadas no contrato pelo\nTCU sob a alegação de que o relatório era documento confidencial.\n\nO depoimento convenceu os militares de que o assunto era uma questão\npolítica e que a manutenção do contrato com a Raytheon poderia causar\ndesgaste ao governo que Fernando Henrique Cardoso não estaria disposto a\ncarregar. Havia o temor de que a insistência dos parlamentares em ouvir\noutros envolvidos e a instalação de uma comissão parlamentar de\ninquérito desse ao Sivam um contorno mais explosivo. Na opinião de\nalguns militares, depois desse depoimento Lélio Lobo só seria mantido no\ncargo por causa do apoio do presidente e da falta de outro nome capaz de\nevitar maior tensão nos quartéis.\n\nEm dezembro de 1995 Lélio Lobo assinou a segunda renovação do contrato\ncomercial com a Raytheon, que fora firmado em 27 de maio, validando o\ndocumento por mais 30 dias. Uma das cláusulas do contrato especificava\nque ele somente seria efetivado depois que o Senado autorizasse o\nfinanciamento de 1,4 bilhão de reais através de créditos externos — o\nque só seria decidido em 1996. A renovação indicava a disposição do\ngoverno de brigar pela implantação do projeto.\n\nEm janeiro de 1996, o ministro da Aeronáutica apresentou ao presidente\ndo Senado e ao presidente e ao relator da supercomissão documentação\nque, segundo ele, explicaria todas as irregularidades apontadas no\nrelatório do TCU. O relatório foi considerado inconsistente pelos\nsenadores por não esclarecer questões consideradas fundamentais. Diante\ndisso, o governo montou uma estratégia, que se revelou bem-sucedida,\npara que a supercomissão só pusesse em votação esse relatório depois da\napresentação da tréplica pelo TCU. Em 23 de maio de 1996, o Senado\naprovou projeto que autorizou a captação do empréstimo de 1,4 bilhão de\nreais para o Sivam e, numa jogada ensaiada, os líderes de partidos\naliados se desdobraram em declarações favoráveis à retomada da reforma\nda previdência na casa. Em meados de 1997, a Raytheon começaria a\nimplantar o projeto, uma das mais polêmicas iniciativas do governo e que\nmotivou protestos de partidos de oposição, que eram contrários à atuação\nde uma empresa estrangeira em assunto que consideravam estratégico para\no país.\n\nEm abril de 1998, Lélio Lobo pediu ao presidente da República a demissão\ndo major-brigadeiro Adir Silva do comando da Infraero, numa reação à a\nestratégia que Fernando Henrique pretendia utilizar caso se reelegesse\nno pleito de outubro daquele ano. Tendo por objetivo a desmilitarização\nda aviação civil, planejava-se implantar o Ministério da Defesa, o que\nextinguiria os ministérios militares, deixando o governo livre para\nimpor a saída do DAC e da Infraero da Aeronáutica, podendo em seguida\nprivatizar esta última. Adir Silva defendia a abertura do setor de\naviação civil, tema que se tornou objeto de uma queda-de-braço entre o\nPlanalto e Lélio Lobo.\n\nAinda em abril o Ministério da Aeronáutica e a Casa Civil da Presidência\ncomeçavam a discutir o aumento da participação do capital estrangeiro\nnas companhias aéreas brasileiras e a transferência das atribuições do\nDAC para a Agência Nacional de Aviação Civil (ANAC), ainda não\nimplantada. Lélio Lobo e o Alto-Comando se manifestaram contra a criação\nda agência. Na opinião de Lobo, para quem a Aeronáutica deveria ficar\ncom tudo ou sem nada, a privatização se restringiria aos cinco\naeroportos que davam lucro.\n\n Lélio Viana Lobo deixou o cargo em 31 de dezembro de 1998 sendo\nsubstituído pelo brigadeiro Paulo Brauer.\n\nO Ministério da Defesa começou a existir no dia 1º de janeiro de 1999,\nquando o ex-governador e ex-senador pelo Espírito Santo, Élcio Álvares,\npolítico das fileiras do Partido da Frente Liberal (PFL), foi nomeado\nministro extraordinário, investido da missão de implantar a nova pasta.\nOs três ministros militares — além do brigadeiro Paulo Brauer, o\nalmirante Sérgio Chagasteles (Marinha) e o general Gleuber Vieirano\n(Exército) — seriam mantidos à frente das futuras secretarias. No dia 10\nde junho, foi oficialmente criado o novo ministério.\n\nÚltimo ministro efetivo da Aeronáutica, Lélio Lobo fez os cursos de\ngraduação em carreiras de oficiais de engenharia na U.S. Army\nEngineering School, de engenharia de fortificação e construção, no\nInstituto Militar de Engenharia, pós-graduação em engenharia econômica\nna Universidade do Brasil, atual Universidade Federal do Rio de Janeiro.\n\nCasou-se com Maria Lúcia Marques Lobo, com quem teve três filhas.\n\n \n\nSônia Zylberberg\n\n \n\nFONTES: CURRIC. BIOG.; *Estado de S. Paulo*(17/4/93, 9/12/95, 9/1/96);\n*Folha de S. Paulo* (21, 22 e 23/11, 1, 12, 15/12/95, 29/7/97, 16/4/98);\n*Globo* (3 e 10/10/92, 14/8/93, 13/6/94, 22/11, 13/12/95, 10/1/96,\n28/4/98); *Jornal do Brasil*(28/7/93, 2/11/94, 21 e 30/11, 7, 13 e\n26/12/95, 10/1/96).\n\n \n","ref":"FONTES: CURRIC. BIOG.; *Estado de S. Paulo*(17/4/93, 9/12/95, 9/1/96);\n*Folha de S. Paulo* (21, 22 e 23/11, 1, 12, 15/12/95, 29/7/97, 16/4/98);\n*Globo* (3 e 10/10/92, 14/8/93, 13/6/94, 22/11, 13/12/95, 10/1/96,\n28/4/98); *Jornal do Brasil*(28/7/93, 2/11/94, 21 e 30/11, 7, 13 e\n26/12/95, 10/1/96).\n\n \n","dic":"DHBB"}
