{"title":"LOYOLA, Henrique","cargoss":["Senador","Senador"],"cargos_esp":[0,0],"datas_ini":[2000,1996],"datas_fim":[2000,0],"estados":["SC","SC"],"autor":[0],"content":"**LOYOLA, Henrique**\n\n\\*sen. SC 1996, 2000.\n\n \n\nJosé Henrique Carneiro de Loyola nasceu em Joinville (SC) no dia 12 de\noutubro de 1932, filho de Lauro Carneiro de Loyola e de Regina Duat de\nLoyola.\n\nFormou-se em economia, em novembro de 1962, na Faculdade de Ciências\nEconômicas do Paraná, em Curitiba.\n\nEmpresário e representante de classe, fundou diversas empresas nas áreas\nde seguro, mercado de capitais, processamento de dados, hotelaria,\nturismo, representações comerciais, assessoria e planejamento.\n\nEm 1964 passou a dirigir a Companhia Fabril Lepper de Joinville e desde\n1972 responde pela Fiação São Bento, em São Bento do Sul. Em 1979,\najudou a fundar a JHCL — Administradora de Bens Ltda., tornando-se\nsócio-gerente da empresa.\n\n Em 1987, assumiu a presidência do Sindicato das Indústrias de Fiação e\nTecelagem de São Bento do Sul. Nomeado, em 1989, secretário da\nIndústria, Comércio e Turismo de Santa Catarina pelo então governador\nPedro Ivo Campos, integrou entre 1990 e 1991 o conselho de administração\ndo Banco de Desenvolvimento do Estado de Santa Catarina. Neste último\nano, já sob a gestão de Casildo Maldaner, afastou-se da secretaria.\n\nApós deixar o cargo, retomou suas atividades como líder empresarial,\npresidindo desde este ano a Associação Comercial e Industrial de\nJoinville (ACIJ). Frente a esta agremiação instituiu a Fundação\nEmpreender, órgão da ACIJ para treinamento e perenização da competência\nempresarial. Em 1993, deixou a presidência da ACIJ e passou a integrar o\nConselho Consultivo Empresarial de Competitividade (Consec) — vinculado\nao Ministério da Indústria, Comércio e Turismo — onde permaneceu até\n1995.\n\nEm 1994, tornou-se vice-presidente da Federação Industrial do Estado de\nSanta Catarina (FIESC). Primeiro suplente do senador Casildo Maldaner,\neleito em outubro deste ano, na legenda do Partido do Movimento\nDemocrático Brasileiro (PMDB), assumiu o mandato em 29 de agosto de\n1996, em virtude do afastamento do titular para participar da campanha\npolítica para as eleições municipais. Em outubro deste ano concorreu à\nvaga de vice-prefeito de Joinville na legenda do PMDB encabeçada pelo\nex-deputado Luís Henrique da Silveira, tendo sido esta chapa vitoriosa.\nDeixou o Senado em****28 dezembro deste ano,****retomando suas\natividades de representante da classe empresarial.\n\nTomou posse como vice-prefeito de Joinville em janeiro de 1997. Em 1998,\ndeixou a presidência do Sindicato das Indústrias de Fiação e Tecelagem\nde São Bento do Sul. Atualmente, além de atuar em suas empresas e na\nprefeitura também foi vice-presidente da ACIJ e delegado do PMDB-SC na\nConvenção Nacional deste partido.\n\nEm agosto de 2000, reassumiu a cadeira no Senado na vaga de Casildo\nMaldaner (PMDB). Deixou o exercício do mandato de senador em outubro\ndesse mesmo ano e retomou suas atividades empresariais.\n\nFoi ainda presidente e vice-presidente dos Bombeiros Voluntários de\nJoinville e da Associação dos Bombeiros Voluntários do Estado de Santa\nCatarina.\n\nCasou-se com Helga de Loyola, com quem teve duas filhas.\n\n \n\n \n\nFONTES: *Globo* (30/8/96); INF. BIOG.; SENADO. *Dados\nbiográficos*(1826-1996); *Agência Senado* (18/08/2000)\n\n \n","ref":"FONTES: *Globo* (30/8/96); INF. BIOG.; SENADO. *Dados\nbiográficos*(1826-1996); *Agência Senado* (18/08/2000)\n\n \n","dic":"DHBB"}
