{"title":"LOMBA, Sérgio","cargoss":["Deputado federal"],"cargos_esp":[0],"datas_ini":[1983],"datas_fim":[1987],"estados":["RJ"],"autor":[0],"content":"**LOMBA, Sérgio**\n\n\\*dep. fed. RJ 1983-1987.\n\n* *\n\n*Sérgio Antônio Lessa Lomba* nasceu no Rio de Janeiro, então Distrito\nFederal, no dia 1º de junho de 1944, filho de Valentim Cebidanez Lomba e\nAmélia Lessa Lomba.\n\nBacharelou-se em ciências jurídicas e sociais pela Faculdade de Direito\nCândido Mendes, no ano de 1977. Iniciou sua carreira política nas\neleições de novembro de 1982, quando se candidatou a deputado federal\npelo Partido Democrático Trabalhista (PDT) do Rio de Janeiro. Obtendo a\nprimeira suplência da legenda, assumiu uma cadeira na Câmara dos\nDeputados em março de 1983 na vaga aberta com a nomeação do deputado\nJosé Colagrossi para a Secretaria de Transportes do Rio de Janeiro, no\nprimeiro governo de Leonel Brizola (1983-1987). Durante a legislatura,\nfoi membro titular da Comissão de Agricultura e Política Rural e da\nComissão de Redação da Câmara.\n\nEm 25 de abril de 1984, votou a favor da emenda Dante de Oliveira, que\npropunha o restabelecimento das eleições diretas para presidente da\nRepública em novembro daquele ano. Com a não aprovação da emenda pelo\nCongresso, participou, em 15 de janeiro de 1985, da sessão do Colégio\nEleitoral para a eleição indireta do presidente da República, votando no\nex-governador de Minas Gerais, Tancredo Neves, da Aliança Democrática,\ncoligação oposicionista formada pelo Partido do Movimento Democrático\nBrasileiro (PMDB) e pela dissidência do Partido Democrático Social (PDS)\nreunida na Frente Liberal. Tancredo foi eleito com expressiva vitória\nsobre o candidato governista Paulo Maluf, mas não chegaria contudo a\ntomar posse. Empossado como interino, o vice-presidente José Sarney\nseria depois confirmado no cargo em conseqüência do falecimento de\nTancredo, a 21 de abril de 1985.\n\nEm maio de 1986, com o retorno de alguns deputados pedetistas ao\nLegislativo federal, Sérgio Lomba deveria ter voltado à suplência. No\nentanto, continuou exercendo o mandato em virtude da decisão da mesa da\nCâmara de expedir licença para o deputado Jiulio Caruso, que se\nencontrava em coma desde dezembro de 1984, após ter sido vítima de\nacidente automobilístico.\n\nNo pleito de novembro seguinte, Lomba candidatou-se à Assembléia\nNacional Constituinte pelo PDT, mas não conseguiu se eleger. Em razão do\nfalecimento do deputado J. G. de Araújo Jorge, foi efetivado como\ndeputado federal em 28 de janeiro de 1987. Três dias depois, ao findar a\nlegislatura 1983-1987, deixou em definitivo a Câmara.\n\nEm 1990, saiu do PDT para ingressar no Partido da Social Democracia\nBrasileira (PSDB). Pela nova legenda, candidatou-se novamente a deputado\nfederal pelo Rio de Janeiro, no pleito de outubro de 1994. Obteve apenas\numa suplência, mas teria nova chance, em virtude da decisão do Tribunal\nRegional Eleitoral do estado de anular a eleição por suspeitas de\nfraude. Realizado o novo pleito no mês de novembro, Lomba também não\nconseguiu se eleger.\n\nParalelamente às atividades políticas, exerceu a advocacia e se tornou\ndiretor da Dunoir Indústria e Comércio de Placas e Brindes Ltda.,\nempresa de propriedade de seus filhos.\n\nCasou-se com Jurema Gonçalves Lomba, com quem teve três filhos.\n\nFONTES: CÂM. DEP. *Deputados brasileiros* (1826-1976); CÂM. DEP.\n*Deputados brasileiros*. *Repertório* (1983-1987); *Globo* (26/4/84,\n16/1/85, 21/11/94); INF. BIOG.\n\n \n","ref":"FONTES: CÂM. DEP. *Deputados brasileiros* (1826-1976); CÂM. DEP.\n*Deputados brasileiros*. *Repertório* (1983-1987); *Globo* (26/4/84,\n16/1/85, 21/11/94); INF. BIOG.\n\n \n","dic":"DHBB"}
