{"title":"LOPES, Lucas","cargoss":["Ministro da Viação e Obras Públicas","Ministro da Viação e Obras Públicas","Presidente de associação ou confederação de empregados ou empregadores","Ministro da Fazenda"],"cargos_esp":[0,0,"BNDE",0],"datas_ini":[1955,1954,1956,1958],"datas_fim":[1956,1955,1958,1959],"estados":[0,0,0,0],"content":"**LOPES, Lucas**\n\n\\*min. Viação 1954-1955 e 1955-1956; pres. BNDE 1956-1958; min. Faz.\n1958-1959.\n\n*Lucas Lopes* nasceu em Ouro Preto (MG) no dia 25 de junho de 1911,\nfilho de Francisco Antônio Lopes e de Maria da Conceição Mosqueira\nLopes. Seu pai, engenheiro e professor, era primo de Ildefonso Simões\nLopes, ministro da Agricultura de 1919 a 1922, deputado federal pelo Rio\nGrande do Sul em várias legislaturas durante a República Velha e\nparticipante da Revolução de 1930. Luís Simões Lopes, filho de\nIldefonso, foi chefe do Departamento Administrativo do Serviço Público\n(DASP) de 1938 a 1945, fundador e presidente da Fundação Getúlio Vargas\nde 1944 a 1992.\n\nFez os estudos primários em sua cidade natal e concluiu o secundário no\nColégio Arnaldo, em Belo Horizonte . Ingressou em 1927 na Escola de\nEngenharia da Universidade de Minas Gerais e ainda estudante começou a\ntrabalhar, primeiro como repórter no jornal *O* *Estado de Minas* e\ndepois como desenhista na seção técnica da Estrada de Ferro Oeste de\nMinas, que logo após a Revolução de 1930 foi transferida do governo\nfederal para o governo de Minas, juntamente com a Estrada de Ferro Sul\nMineira e a Estrada de Ferro Paracatu, formando a Rede Mineira de\nViação. Formado em engenharia civil em 1932, ocupou os cargos de\nengenheiro-chefe de oficina, chefe de tração e chefe da divisão de\ntransportes da Rede Mineira de Viação. Sem perder o vínculo com a Rede,\nlicenciou-se em 1940, trabalhou na Companhia Auxiliar das Empresas\nElétricas Brasileiras (CAEEB), no Rio de Janeiro, e em seguida na\nSociedade Técnica de Materiais (Sotema), para a qual montou em Ladário,\njunto a Corumbá (MT), uma oficina para vagões destinados à Estrada de\nFerro Brasil-Bolívia. De Corumbá transferiu-se para Vitória, a convite\nde Israel Pinheiro, então presidente da Companhia Vale do Rio Doce, para\npreparar a Estrada de Ferro Vitória-Minas para receber e montar vagões a\nserem utilizados no transporte de minério.\n\nEm 1943, por indicação de Israel Pinheiro, foi convidado Benedito\nValadares, interventor federal em Minas, para ocupar a Secretaria da\nAgricultura, Indústria e Comércio do estado. Passou então a exercer\nimportante papel no planejamento dos investimentos governamentais, dando\ncontinuidade, entre outros, aos projetos da Cidade Industrial e da usina\nde Gafanhoto, destinada a fornecer energia elétrica para o pólo\nindustrial de Belo Horizonte. Além disso, assumiu o cargo de diretor da\nseção mineira da Coordenação da Mobilização Econômica, órgão criado em\n1942 sob a chefia de João Alberto Lins de Barros para ajustar o\nfuncionamento da economia brasileira à situação mundial, marcada pelo\nprolongamento da Segunda Guerra Mundial. A principal atividade da\nCoordenação em Minas foi a distribuição de cotas de consumo, segundo o\nplanejamento estabelecido para atender às necessidades da economia de\nguerra.\n\nCom a deposição de Getúlio Vargas em outubro de 1945, Benedito Valadares\ne sua equipe foram afastados do governo mineiro. Mesmo assim, Lucas\nLopes voltou a chefiar uma secretaria — desta vez a de Viação e Obras\nPúblicas — entre fevereiro e agosto de 1946, durante o governo do\ninterventor João Tavares Correia Beraldo. Tornou-se ainda nesse ano, até\n1948, professor catedrático de geografia econômica da Faculdade de\nCiências Econômicas da Universidade de Minas Gerais, passando a integrar\nem seguida a recém-criada Comissão do Vale do São Francisco (CVSF),\nórgão diretamente subordinado à Presidência da República encarregado de\nformular e executar um projeto de desenvolvimento para essa região.\nInicialmente, a CVSF teve uma direção colegiada que definiu seu\nregimento interno e fixou o programa básico de trabalho, voltado\nprincipalmente para a distribuição das águas, a utilização do potencial\nhidrelétrico e a modernização dos transportes. Foram criadas em seguida,\nno âmbito da própria comissão, as secretarias de Produção e Assistência\ne de Plano de Obras. Lucas Lopes assumiu a chefia desta última, que\ncontou com a participação dos engenheiros Oscar Espínola Guedes, Galdino\nMendes Filho, Salomão Serebrenick, John Cotrin, Mauro Thibau, Domício de\nFigueiredo e outros, além de sanitaristas e agrônomos. Parelelamente a\nessas atividades, coordenou uma equipe de técnicos da Companhia\nBrasileira de Engenharia (CBE) que elaborou uma revisão no Plano de\nEletrificação de Minas para o governo Mílton Campos.\n\nO Plano Geral para o Aproveitamento Econômico do Vale do São Francisco\nfoi apresentado à consideração do Congresso Nacional em dezembro de\n1950, recomendando, entre outras obras, a construção de uma barragem em\nTrês Marias (MG) e reservatórios de grande e médio porte em diversos\npontos da bacia superior e do trecho submédio do rio São Francisco,\nentre as cidades baianas de Sobradinho e Paulo Afonso. O plano só seria\naprovado em 1955, depois de longa tramitação legislativa.\n\nO início da colaboração com Kubitschek\n\nA política de desenvolvimento adotada por Juscelino Kubitschek no início\nde seu mandato à frente do governo mineiro, em janeiro de 1951, teve\ncomo eixo o binômio “energia e transportes”, considerado básico para\nviabilizar o processo de industrialização de Minas. Lucas Lopes foi\nescolhido para formular um plano de eletrificação no estado, enquanto o\nengenheiro Celso Murta planejava a ação governamental no setor de\ntransportes. Em virtude da relativa carência de recursos e do grande\ndéficit existente na geração e distribuição de energia em Minas, a\niniciativa privada foi chamada a participar de companhias mistas e\nsociedades anônimas organizadas para realizar as principais obras então\niniciadas: a construção das usinas de Itutinga (destinada a alimentar as\nregiões oeste e sul do estado) e do Paredão (no Alto Parnaíba), a\nampliação da capacidade da usina Pai Joaquim (na região de Uberaba), a\nconclusão da usina de Governador Valadares e o planejamento da usina de\nSalto Grande (no rio Santo Antônio). Esses trabalhos levaram à criação\nda Companhia do Médio Rio Doce, da Companhia de Eletricidade do Alto Rio\nGrande e da Central Elétrica do Piau, unificadas em setembro de 1951 em\ntorno de uma empresa *holding*,**a Centrais Elétricas de Minas Gerais\n(Cemig), presidida até o fim do governo Kubitschek por Lucas Lopes. No\nperíodo seguinte, o sistema de distribuição de energia elétrica foi\norientado prioritariamente para apoiar a industrialização, estendendo\ndepois seus serviços às pequenas e médias cidades do interior.\n\nDevido à sua importante participação no programa energético de Minas\nGerais, Lucas Lopes foi também convidado, em 1951, a integrar a Comissão\nMista Brasil-Estados Unidos, cuja seção brasileira era dirigida por Ari\nFrederico Torres e contava com Roberto Campos, Glycon de Paiva, José\nSoares Maciel Filho e Valentim Bouças. A comissão mantinha contato\npermanente com Horácio Lafer, ministro da Fazenda do segundo governo\nVargas, e era encarregada de verificar a disponibilidade de\nfinanciamento externo para superar os pontos de estrangulamento da\nexpansão industrial no Brasil, sobretudo nas áreas de energia elétrica e\nde transportes, além de estudar projetos vinculados a máquinas agrícolas\ne armazenamento de cereais.\n\nO trabalho da comissão e as gestões de Horácio Lafer no exterior\nresultaram na elaboração do Plano Nacional de Reaparelhamento Econômico,\na ser financiado em partes iguais por instituições estrangeiras e pelo\ngoverno brasileiro, num total de um bilhão de dólares. Vargas enviou em\nseguida uma mensagem ao Congresso, aprovada em junho de 1952, propondo a\ncriação do Banco Nacional de Desenvolvimento Econômico (BNDE),\nencarregado de gerir a aplicação desses recursos de acordo com o plano\ntraçado. A primeira equipe de direção do novo órgão aproveitou os\nintegrantes da seção brasileira da Comissão Mista, cabendo a Lucas Lopes\num lugar no conselho de administração. Para a superintendência geral foi\nnomeado Maciel Filho, industrial do ramo têxtil que fazia restrições à\nparticipação do capital estrangeiro na economia nacional. A Comissão\nMista completou seus estudos técnicos em julho de 1953 e encerrou\noficialmente suas atividades em dezembro seguinte, deixando trabalhos\nque seriam incorporados mais tarde à preparação do Plano de Metas de\nJuscelino Kubitschek. Entre 1953 e 1955, a equipe do BNDE realizou\ntambém um importante estudo, coordenado pelo economista Celso Furtado\njuntamente com a Comissão Econômica para a América Latina (CEPAL), órgão\nda Organização das Nações Unidas (ONU), cujos resultados seriam\nigualmente aproveitados no Plano de Metas.\n\nNesse período — primeira metade da década de 1950 —, acentuou-se a\npolarização entre correntes nacionalistas e aquelas que defendiam maior\nabertura à participação do capital estrangeiro na economia nacional.\nComo decorrência do peso da primeira posição durante o governo de\nVargas, o Banco Mundial e outras instituições estrangeiras reduziram ou\nsuprimiram o financiamento ao Brasil. Ao mesmo tempo, a luta política\ninterna se acirrou com o fortalecimento da alternativa golpista contra o\npresidente, que se suicidou em agosto de 1954. Seu sucessor foi o\nvice-presidente João Café Filho, que organizou um ministério onde\npredominavam elementos mais favoráveis ao capital estrangeiro,\nvinculados à União Democrática Nacional (UDN). Entretanto, preocupado em\nmanter vínculos com o Partido Social Democrático (PSD), o novo\npresidente pediu que Juscelino Kubitschek indicasse um nome para ocupar\no Ministério da Viação e Obras Públicas. A escolha recaiu sobre Lucas\nLopes, nomeado em 27 de agosto de 1954.\n\nSua participação no governo de Café Filho foi curta. Em janeiro de 1955,\no presidente endossou um documento assinado por vários chefes militares\nque defendiam a necessidade de equacionar o problema sucessório em um\nquadro de colaboração interpartidário, criticando assim, implicitamente,\na candidatura de Juscelino Kubitschek, articulada pelo PSD. Discordando\ndos termos do documento, Lucas Lopes pediu demissão em 29 de janeiro,\nsendo substituído pelo coronel Rodrigo Otávio de Jordão Ramos.\n\nA convenção nacional do PSD lançou oficialmente o nome de Juscelino em\n10 de fevereiro de 1955, apesar da resistência das seções estaduais de\nPernambuco, Santa Catarina e Rio Grande do Sul, que formaram uma\ndissidência e apresentaram, sem êxito, quatro alternativas a essa\nescolha: Lucas Lopes, Etelvino Lins, Nereu Ramos e Carlos Luz. Juscelino\nrecebeu ainda o apoio do Partido Trabalhista Brasileiro (PTB), que\nlançou João Goulart para disputar a vice-presidência, recompondo assim a\naliança das forças alijadas do poder depois do suicídio de Vargas.\n\nA vitória da coligação PSD-PTB no pleito presidencial de 3 de outubro de\n1955 acirrou a crise política, pois a UDN e setores militares se\nposicionaram contra a posse dos eleitos. A tensão chegou ao clímax com a\ndeflagração, em 11 de novembro, de um movimento militar liderado pelo\ngeneral Henrique Lott, ministro da Guerra demissionário, visando,\nsegundo seus promotores, a barrar uma conspiração em preparo no governo\ne assegurar a posse de Kubitschek. O movimento provocou o impedimento\ndos presidentes da República Carlos Luz, em exercício, e Café Filho,\nlicenciado, empossando na chefia do governo o vice-presidente do Senado,\nNereu Ramos. No dia 14 de novembro, Lucas Lopes retornou ao Ministério\nda Viação e Obras Públicas, onde permaneceu até a posse de Kubitschek em\n31 de janeiro de 1956.\n\nNo governo de Kubitschek\n\nJuscelino assumiu a presidência disposto a aplicar o Plano de Metas\nelaborado por uma equipe de técnicos sob a direção de Lucas Lopes e\nRoberto Campos, integrantes de um grupo de economistas que defendia a\nnecessidade do planejamento econômico governamental para acelerar o\nprocesso de industrialização, diferenciando-se assim dos adeptos da\nescola liberal, como Eugênio Gudin e Otávio Gouveia de Bulhões. Todos\nesses economistas estavam de acordo, entretanto, em relação à\nimportância da estabilidade monetária e ao papel positivo do capital\nestrangeiro, combatendo juntos, entre outros, o projeto de criação da\nEletrobrás, que desde 1954 tramitava no Congresso Nacional. Em seu\nlugar, propunham a formação de um fundo nacional de eletrificação e de\numa comissão nacional de energia elétrica que, atuando junto com o BNDE,\nprestasse assistência às empresas concessionárias do setor energético,\nem sua maioria estrangeiras.\n\nCoerente com as posições de seus coordenadores, o Plano de Metas\npretendia mobilizar grande soma de recursos públicos e de capital\nestrangeiro para atingir, em cinco anos, 36 objetivos setoriais ligados\nà constituição de uma infra-estrutura básica e à diversificação do\nparque industrial brasileiro. Além disso, contrariando a opinião de\nLucas Lopes e Roberto Campos, o presidente acrescentou ao plano a\nchamada “meta-síntese”: a construção de Brasília.\n\nLogo no início do governo, em fevereiro de 1956, Lucas Lopes foi nomeado\npresidente do BNDE, acumulando esse cargo com o de secretário-executivo\ndo então criado Conselho do Desenvolvimento, órgão que passou a\ncentralizar a aplicação do Plano de Metas. Contando com a participação\nde todos os ministros de Estado, representantes do Estado-Maior das\nForças Armadas (EMFA) e consultores especiais, o Conselho formou grupos\nde trabalho que elaboravam projetos ligados a metas específicas do plano\ne os submetiam aos grupos executivos, formados por administradores e\ntécnicos ligados ao Estado e à iniciativa privada. Esses organismos,\ncriados por decreto, atuavam com grande autonomia financeira e estavam\nfora da alçada do Poder Legislativo. Os mais importantes foram o Grupo\nExecutivo para a Indústria Automobilística (GEIA), o Grupo Executivo\npara a Indústria da Construção Naval (Geicon) e o Grupo Executivo para a\nIndústria de Bens de Capital e Maquinaria Pesada (Geimape).\n\nComo secretário-executivo do Conselho de Desenvolvimento, Lucas Lopes\ncoordenou a elaboração de um programa de exportação de minério de ferro\n— aprovado em agosto de 1957 — que, segundo René Armand Dreyfuss,\nconcedeu diversas vantagens à empresa norte-americana Hanna Mining\nCorporation. Anos mais tarde, em depoimento para o Centro de Pesquisa e\nDocumentação de História Contemporânea do Brasil (Cpdoc) e para o Centro\nda Memória da Eletricidade no Brasil, Lucas Lopes refutaria essas\ninformações, sustentando que a Hanna, naquela época, não havia formulado\nnenhum projeto de exportação de minério.\n\nEntre 1957 e 1961, o BNDE chegou a dispor anualmente de um montante de\nrecursos superior a 5% de toda a poupança nacional, concentrando-se,\npela ordem, em investimentos no setor de transportes, nas indústrias de\nbase e na produção de energia elétrica. Praticamente todas as demandas\nde financiamento para investimentos industriais públicos ou privados\nligados ao Plano de Metas passavam pelo banco, que, depois de analisar\nsua viabilidade técnico-financeira e sua conveniência macroeconômica,\nacompanhava de perto a aplicação dos projetos, chegando muitas vezes a\ncontrolar o funcionamento das novas unidades de produção. Sua atuação,\nportanto, foi muito importante na criação de condições favoráveis à\nintensa penetração do capital estrangeiro no parque industrial\nbrasileiro, fator decisivo para a obtenção de altas taxas de crescimento\neconômico e a concretização de cerca de 80% das metas planejadas pelo\ngoverno Kubitschek.\n\nOs dois aspectos mais delicados na aplicação do plano foram a\ndeterioração do balanço de pagamentos, agravada a partir de 1955, e o\ncrescimento do déficit orçamentário. O primeiro resultava do crescimento\ndas importações e da queda dos preços dos produtos exportados, em\nparticular o café, enquanto o segundo decorria do aumento dos gastos\npúblicos, financiados com emissão de moeda e, portanto, causadores de\ntaxas crescentes de inflação. Essas dificuldades reforçavam a oposição\nda UDN à política econômica, a inquietação de setores da classe média e\no descontentamento dos cafeicultores, atingidos por um confisco cambial\nque os tornava financiadores indiretos do processo de industrialização.\n\nNo início de 1958, o Export Import Bank (Eximbank) condicionou a\nliberação de um empréstimo solicitado pelo governo brasileiro à obtenção\nde um aval do Fundo Monetário Internacional (FMI) para a operação. Esta\núltima instituição exigiu então uma rigorosa política de contenção dos\ngastos públicos e do crédito, maior rigidez nos reajustes salariais, a\nadoção de uma reforma cambial e o fim do programa de compra de\nexcedentes de café pelo governo, medidas consideradas necessárias para o\ncombate à inflação e a restauração do balanço de pagamentos. Nas\ndiscussões subsequentes no Congresso e no interior do governo, a UDN\ncriticou duramente o ministro da Fazenda José Maria Alkmin, e o general\nLott, ministro da Guerra, o responsabilizou pela crise financeira. Pouco\ndepois, Alkmin pediu demissão, alegando que precisava\ndesincompatibilizar-se para concorrer a uma cadeira de deputado federal\nem outubro seguinte. Lucas Lopes assumiu então a chefia do Ministério da\nFazenda, em 25 de junho de 1958, sendo substituído por Roberto Campos na\npresidência do BNDE.\n\nO Plano de Estabilização\n\nLucas Lopes e Roberto Campos foram os responsáveis pela elaboração do\nPlano de Estabilização Monetária, que foi apresentado ao Congresso em\noutubro e tinha como base quatro medidas principais: limitação da oferta\nde meios de pagamento, através de restrição ao crédito; maior controle\ndos gastos públicos, conjugado com o aumento nos impostos sobre a renda\ne o consumo; menores reajustes salariais; e eliminação dos subsídios\ncambiais. O plano acirrou imediatamente a controvérsia entre\nmonetaristas e estruturalistas, que localizavam as principais causas da\ninflação nos desequilíbrios estruturais da economia brasileira e\nconsideravam ineficaz qualquer programa que significasse a liquidação de\num plano estratégico de investimentos públicos nos setores fundamentais\nda economia. Além disso, a política estabilizadora de Lucas Lopes\nameaçava a continuidade da aplicação do Plano de Metas, incluindo a\nconstrução de Brasília nos prazos previstos.\n\nAs resistências ao programa estabilizador não se restringiram apenas aos\nmeios políticos e acadêmicos. Os cafeicultores intensificaram suas\npressões, programando imediatamente a chamada “marcha da produção” até o\npalácio do Catete, sede do governo, para exigir o aumento das compras de\nestoques pelo governo. Esse projeto não chegou a ser concretizado em\nvirtude da mobilização preventiva de contingentes militares, ordenada\npelo general Lott com o apoio de Lucas Lopes. Por outro lado,\nempresários paulistas iniciaram forte oposição à limitação do crédito,\nsendo apoiados pelo presidente do Banco do Brasil, Sebastião Pais de\nAlmeida, que se recusou a suspender operações ligadas ao fornecimento de\ncapital de giro para as indústrias. A perspectiva de elevação de\nimpostos também não foi bem recebida por setores conservadores, enquanto\no movimento sindical avançava em suas articulações horizontais\nnão-oficiais (os “pactos de ação conjunta”), inclusive em áreas do\ninterior, para resistir às anunciadas restrições salariais.\n\nA luta contra o Plano de Estabilização ganhou um matiz nacionalista, com\no crescimento dos ataques a Lucas Lopes e Roberto Campos, acusados de\n“entreguistas”. Essa polêmica adquiriu novos contornos a partir do\nprimeiro semestre de 1959, quando o debate sucessório começou a\ndelinear-se. A UDN aumentou seus ataques contra as medidas “demagógicas\ne populistas” do governo, como o aumento de 30% do salário mínimo,\nenquanto grupos nacionalistas e de esquerda reforçavam sua pressão\ncontra as vantagens concedidas ao capital estrangeiro, sendo apoiados\npelo próprio vice-presidente João Goulart. As exigências do FMI para dar\nseu aval ao empréstimo solicitado pelo governo brasileiro ao Eximbank\neram consideradas inaceitáveis, inclusive por pessoas favoráveis à\nabertura da economia brasileira às empresas estrangeiras, como Augusto\nFrederico Schmidt. Kubitschek tentou criar uma alternativa com a\nproposta de formação da Operação Pan-Americana, que consistiria num\namplo programa de colaboração financeira dos Estados Unidos para o\ndesenvolvimento da América Latina. Entretanto, esse projeto ficou sem\nresposta por parte dos Estados Unidos, enquanto o FMI permanecia\ninflexível em suas exigências.\n\nNesse quadro, Lucas Lopes sofreu um infarto em 30 de maio, e em 4 de\njunho foi substituído interinamente no Ministério da Fazenda por\nSebastião Pais de Almeida. Nesse mesmo dia Juscelino suspendeu\nprovisoriamente as negociações com o FMI e em 17 de junho anunciou\noficialmente o rompimento com o Fundo. A iniciativa foi saudada por\nvários setores como uma reafirmação da autonomia política e econômica do\npaís, levando Thomas Skidmore a escrever: “O contentamento parecia maior\ndo que se o Brasil tivesse realmente recebido o empréstimo de trezentos\nmilhões, adiado havia tanto tempo.”\n\nComo era previsto, o rompimento das negociações com o FMI foi\nacompanhado pelo abandono do Plano de Estabilização e o afastamento dos\nseus principais coordenadores. Em 28 de julho Sebastião Pais de Almeida\nfoi efetivado no Ministério da Fazenda, e no mesmo mês Roberto Campos\npassou a presidência do BNDE para Lúcio Meira. Apesar disso, o Plano de\nEstabilização voltaria a desempenhar importante papel na política\neconômica do efêmero governo de Jânio Quadros, em 1961.\n\nDepois de deixar o ministério, Lucas Lopes foi nomeado titular do 4º\nOfício de Imóveis do Rio de Janeiro em substituição a Olegário Mariano.\nAcumulou essa função com a de diretor da fábrica Civilit de cimento e\namianto, de propriedade do empresário italiano Maurício Cattaneo Adorno,\ne integrou o conselho de administração de Furnas S.A., cuja presidência\nchegou a ocupar. Em setembro de 1959, juntamente com antigos\ncolaboradores do BNDE, ajudou a fundar a Consultec — Sociedade Civil de\nPlanejamento e Consultas Técnicas Ltda. Do grupo de consultores da\nempresa vieram a participar Roberto Campos, Otávio Dias Carneiro, Jorge\nOscar de Melo Flores, Mário da Silva Pinto, Otávio Gouveia de Bulhões e\nMário Henrique Simonsen, entre outros. Vinculada à empresa, e sob a\norientação de Lucas Lopes, foi criada posteriormente a Apec Editora\nS.A., responsável durante vários anos pela publicação do periódico\n*Análise e perspectiva econômica*.\n\nEm 1962, Lucas Lopes passou a trabalhar para a Hanna, inicialmente como\nconsultor e, depois, como administrador. Três anos mais tarde,\nparticipou da assinatura do acordo de fusão da St. John del Rey Mining\nCompany — controlada pela Hanna — com o grupo Caemi, de propriedade de\nAugusto Azevedo Antunes. A negociação deu origem às Minerações\nBrasileiras Reunidas S.A. (MBR), empresa que, no início dos anos 1970,\ndesenvolveu o projeto Águas Claras, voltado para a exploração e\nexportação de minério de ferro em larga escala, e que, entre outros\nempreendimentos, levou à construção de um terminal marítimo em Sepetiba\n(RJ), inaugurado em novembro de 1973.\n\nDurante sua vida profissional, integrou também os conselhos de\nadministração do Banco Denasa de Investimento e os conselhos consultivos\ndo Banco de Investimento Credisan, da Magnesita S.A. e da Companhia de\nCimento Nacional de Minas Gerais S.A. Foi ainda diretor da Sociedade\nAnônima Mineração de Amianto (SAMA), da Companhia Mineira de Alumínio\n(Aluminas) e da Morro do Níquel, além de gerente da Hannaco\nEmpreendimentos e Participações.\n\nFaleceu no Rio de Janeiro, vítima de uma parada cardíaca, no dia 29 de\njaneiro de 1994.\n\nEra casado com Ester de Pádua Lopes, com quem teve três filhos. Um\ndeles, Rodrigo de Paula Lopes, casado com Maria Estela Kubitschek, filha\nde Juscelino Kubitschek, foi secretário de Indústria e Comércio do\nestado do Rio de Janeiro entre 1988 e 1990, durante o governo Moreira\nFranco (1987-1991). Outro filho, Francisco Lopes, um dos idealizadores\ndo Plano Cruzado (1986) e do Plano Real (1994), ocupou interinamente a\npresidência do Banco Central entre janeiro e fevereiro de 1999.\n\nAlém de inúmeros artigos publicados em revistas especializadas, Lucas\nLopes foi autor de vários trabalhos e publicações, entre eles: *O vale\ndo São* *Francisco*(1955), *Plano de eletrificação de Minas Gerais*,\n*Memorial da capital federal*, *Estudos de política do Brasil — à margem\nda mudança da capital*, *O Programa de Metas* e *Programa de\nEstabilização Monetária*. Seu depoimento ao Cpdoc e ao Centro da Memória\nda Eletricidade no Brasil foi publicado sob o título *Memórias do\ndesenvolvimento* (1991).\n\nO arquivo de Lucas Lopes encontra-se depositado no Cpdoc da Fundação\nGetulio Vargas.\n\nJorge Miguel Mayer/Alzira Alves de Abreu\n\n \n\n**FONTES**: ANDRADE, F. *Relação*;**BENEVIDES, M. *Governo\nKubitschek*;**CAFÉ FILHO, J.*Sindicato*;**CONF. NAC. COMÉRCIO. *20*;\nCONSULT. MAGALHÃES, B.; CORRESP. BANCO NAC. DESENV. ECON.; CORTÉS,\nC.*Homens*;**COSTA, M. *Cronologia*;**COUTINHO, A. *Brasil*;**DREYFUSS,\nR. A. *1964*;*Encic. Mirador*; *Estado de* *S.\nPaulo*(18/2/76);*Globo*(31/1/94); *Grande encic. Delta*; HORTA, C.\n*Famílias*;**INST. NAC. LIVRO. *Índice*;*Jornal do Brasil*(30/7/75,\n15/1, 1/6, 15/7/76, 30/1/94); KUBITSCHEK, J. *Meu*;**LESSA, C. *Quinze*;\nLOPES, L. *Memórias*; MARANHÃO, R. *Governo*;**MARTINS, L.\n*Pouvoir*;**MIN. FAZ. *Ministros*; MIN.**GUERRA. *Almanaque*(1959); MIN.\nVIAÇÃO.*Dados*;*Nosso*(4); QUADROS, J. *História*;**SKIDMORE, T.\n*Brasil*;**SOARES, E. *Instituições*.\n","ref":"","dic":"DHBB"}
