{"title":"FERREIRA FILHO, Cosme","cargoss":["Constituinte","Deputado federal"],"cargos_esp":[0,0],"datas_ini":[1946,1946],"datas_fim":[1946,1955],"estados":[0,"AM"],"autor":[0],"content":"**FERREIRA FILHO, Cosme**\n\n\\*const. 1946; dep. fed. AM 1946-1955.\n\n \n\n*Cosme Alves Ferreira Filho* nasceu em Fortaleza no dia 18 de novembro\nde 1893, filho de Cosme Alves Ferreira e de Maria de Albuquerque\nFerreira.\n\nRadicado em Manaus, foi tradutor público, despachante aduaneiro, redator\ndo *Jornal do Comércio*local**e comerciante. Foi também um dos\nfundadores da Associação Comercial do Amazonas, da qual se tornou sócio\nbenemérito e assessor técnico.\n\nEm dezembro de 1945, elegeu-se deputado pelo Amazonas à Assembléia\nNacional Constituinte, na legenda do Partido Social Democrático (PSD).\nAssumiu a cadeira em março de 1946, participando dos trabalhos que\nresultaram na Constituição promulgada em setembro do mesmo ano, e\ndepois, com a transformação da Assembléia em Congresso ordinário,\ntornou-se membro da Comissão de Valorização da Amazônia e da Comissão de\nTransporte e Comunicações da Câmara. Reelegeu-se em outubro de 1950 na\nlegenda da Aliança Frente Libertadora, composta pelo PSD e o Partido\nDemocrata Cristão (PDC). No pleito de outubro de 1954, candidatou-se à\nAssembléia Legislativa do Amazonas na legenda do PSD, conquistando\napenas uma suplência e deixando a Câmara ao final do mandato em janeiro\nde 1955.\n\nPresidente da Companhia Nacional de Borrachas e da Companhia Brasileira\nde Plantações, com a extinção dos partidos políticos pelo Ato\nInstitucional nº 2 (27/10/1965) e a posterior instauração do\nbipartidarismo filiou-se à Aliança Renovadora Nacional (Arena), em cuja\nlegenda tornou a eleger-se, em novembro de 1966, suplente de deputado\nestadual. Foi também membro da Associação Amazonense de Imprensa, do\nInstituto Geográfico e Histórico do Amazonas, da Academia Amazonense de\nLetras e da Associação Brasileira de Imprensa.\n\nFaleceu no Rio de Janeiro em 1º (ou 2) de outubro de 1976.\n\nFoi casado em primeiras núpcias com Guiomar Meneses Ferreira e, depois,\ncom Francisca Canindé de Sousa Cruz Ferreira, e teve quatro filhos.\n\nPublicou *Em defesa da borracha silvestre sul-americana; A borracha,\nproblema brasileiro; Problemas da Amazônia*e*A borracha na economia\namazônica.*\n\n \n\n \n\nFONTES: CÂM. DEP. *Deputados;*CÂM. DEP. *Relação dos dep.;*COUTINHO, A.\n*Brasil; Diário do Congresso Nacional;*GIRÃO, R. *Ceará; Jornal do\nBrasil*(3/10/76); SILVA, G. *Constituinte.*\n\n \n","ref":"FONTES: CÂM. DEP. *Deputados;*CÂM. DEP. *Relação dos dep.;*COUTINHO, A.\n*Brasil; Diário do Congresso Nacional;*GIRÃO, R. *Ceará; Jornal do\nBrasil*(3/10/76); SILVA, G. *Constituinte.*\n\n \n","dic":"DHBB"}
