{"title":"LOUREIRO, Alberto Trigo de","cargoss":["Deputado federal"],"cargos_esp":[0],"datas_ini":[1935],"datas_fim":[1937],"estados":["MT"],"autor":[0],"content":"**LOUREIRO, Alberto Trigo de**\n\n\\*dep. fed. MT 1935-1937.\n\n \n\n*Alberto Trigo de Loureiro* nasceu em Cuiabá no dia 27 de agosto de\n1899.\n\nBacharel em ciências jurídicas e sociais, exerceu a advocacia e mais\ntarde tornou-se procurador regional da República. Embora se candidatasse\nem 1933 à Assembléia Nacional Constituinte na legenda do Partido\nConstitucionalista de Mato Grosso, não pôde concorrer às eleições em\nvirtude de essa agremiação ter tido seu registro cassado pelo Tribunal\nSuperior Eleitoral.\n\nIngressando no Partido Liberal ainda em 1933, pouco depois transferiu-se\npara o Partido Evolucionista, em cuja legenda elegeu-se afinal deputado\nfederal por Mato Grosso no pleito de outubro de 1934. Assumiu o mandato\nem maio do ano seguinte, permanecendo na Câmara dos Deputados até 10 de\nnovembro de 1937, quando a instauração do Estado Novo suprimiu os órgãos\nlegislativos do país.\n\nFundador da União Democrática Nacional (UDN), em abril de 1945\nparticipou da reunião de seu diretório nacional em que se nomearam as\ncomissões que elaborariam o primeiro projeto de estatutos do partido. Na\nocasião foi indicado para integrar a Comissão de Estudos de Problemas\nEstaduais e Municipais.\n\nFaleceu em 1977.\n\n \n\nFONTES: *Boletim Min. Trab*. (5/36); CÂM. DEP. *Deputados*; *Diário do\nCongresso* *Nacional*; INF. Louremberger Alves; MENDONÇA, R. *Dic*.;\nNABUCO, C. *Vida*.\n\n \n","ref":"FONTES: *Boletim Min. Trab*. (5/36); CÂM. DEP. *Deputados*; *Diário do\nCongresso* *Nacional*; INF. Louremberger Alves; MENDONÇA, R. *Dic*.;\nNABUCO, C. *Vida*.\n\n \n","dic":"DHBB"}
