{"title":"LÚCIO, João","cargoss":["Senador"],"cargos_esp":[0],"datas_ini":[1981],"datas_fim":[1983],"estados":["AL"],"autor":[0],"content":"**LÚCIO, João**\n\n\\*sen. AL 1981-1983.\n\n* *\n\n*João Lúcio da Silva* nasceu em Arapiraca (AL) no dia 7 de março de\n1914, filho de Salustiano José dos Santos e de Rosa Maria da Silva.\n\nAgricultor e comerciante, iniciou sua carreira política no pleito\nmunicipal de outubro de 1956, elegendo-se prefeito de sua cidade natal,\npela União Democrática Nacional (UDN), tendo exercido o mandato entre\n1957 e 1960. No pleito de outubro de 1965 voltou a disputar, pela\nlegenda udenista, a prefeitura de Arapiraca. Eleito, tomou posse no\ninício do ano seguinte, já pela legenda da Aliança Renovadora Nacional\n(Arena), partido que apoiava o regime militar instalado no país em abril\nde 1964 e criado após a extinção dos partidos políticos pelo Ato\nInstitucional nº 2 (27/10/1965) e a posterior instauração do\nbipartidarismo. Exerceu o mandato até 1970.\n\nEm novembro desse ano, candidatou-se a suplente de senador em chapa\nvitoriosa, encabeçada por Arnon de Melo. Contudo não chegou a exercer o\nmandato. Em setembro de 1978 foi eleito, pelo colégio eleitoral de\nAlagoas, suplente do senador indireto — ou biônico, nome consagrado pela\nimprensa — mais uma vez em chapa encabeçada por Arnon de Melo. Com a\nextinção do bipartidarismo em 29 de novembro de 1979 e a conseqüente\nreformulação partidária, filiou-se à nova agremiação governista, o\nPartido Democrático Social (PDS).\n\nEm 1981, assumiu a vaga do titular, que se licenciara do Senado por\nmotivo de saúde. Com a morte de Arnon de Melo em setembro de 1983, foi\nefetivado no mandato. Todavia, no final daquele ano, também se afastou\ndo Senado por motivo de saúde. Seu lugar foi ocupado pelo segundo\nsuplente de Arnon de Melo, Carlos Lira.\n\nJoão Lúcio faleceu em Arapiraca no dia 17 de julho de 1985.\n\nEra casado com Inês Nunes da Silva, com quem teve dez filhos.\n\n \n\nFONTES: *Globo* (18/7/85); INF. FAM. Ana Alice da Silva.\n\n \n","ref":"FONTES: *Globo* (18/7/85); INF. FAM. Ana Alice da Silva.\n\n \n","dic":"DHBB"}
