{"title":"LÚCIO, Pereira","cargoss":["Deputado federal"],"cargos_esp":[0],"datas_ini":[1963],"datas_fim":[1971],"estados":["AL"],"autor":[0],"content":"**LÚCIO, Pereira**\n\n**\\***dep. fed. AL 1963-1971.\n\n \n\n*José Pereira Lúcio* nasceu em Arapiraca (AL) no dia 29 de janeiro de\n1931, filho de José Lúcio da Silva e de Júlia Pereira Lúcio.\n\nProprietário rural e pecuarista, iniciou sua carreira política como\nvereador à Câmara Municipal de sua cidade, da qual chegou depois a\nprefeito. No pleito de outubro de 1958 foi eleito deputado à Assembléia\nLegislativa alagoana na legenda da União Democrática Nacional (UDN),\nassumindo o mandato em fevereiro de 1959. Em outubro de 1962 elegeu-se\ndeputado federal por Alagoas, sempre na legenda da UDN.\n\nDeixando a Assembleia em janeiro de 1963, no mês seguinte ocupou uma\ncadeira na Câmara dos Deputados e tornou-se membro da Comissão de\nAgricultura. Exercia o mandato parlamentar quando, em 31 de março de\n1964, eclodiu o movimento político-militar que depôs o presidente João\nGoulart. Com a extinção dos partidos políticos pelo Ato Institucional nº\n2 (27/10/1965) e a posterior instauração do bipartidarismo, filiou-se ao\npartido governista, a Aliança Renovadora Nacional (Arena). Nessa legenda\nfoi reeleito em 1966 e permaneceu na Câmara até o final da nova\nlegislatura, em janeiro de 1971. Ainda nesse ano, retornou a Maceió e\ntrabalhou na Companhia de Desenvolvimento Estadual de Alagoas (Codeal)\ncomo assessor técnico de projetos industriais, função na qual viria a se\naposentar anos mais tarde.\n\nEm 1974, pleiteou a indicação da Arena para se candidatar à eleição\nindireta para o governo de Alagoas, em substituição a Afrânio Lajes\n(1971-1975), mas foi preterido por Divaldo Suruagi, indicado pelo\npresidente da República general Ernesto Geisel (1974-1979). Afastado da\nvida pública, em 1987 tornou-se membro do Instituto Parlamentar dos\nCongressistas (IPC).\n\nFaleceu em Maceió no dia 12 de abril de 2005.\n\nCasou-se com Margarida Carvalho Lúcio, com quem teve dois filhos.\n\nFONTES: CÂM. DEP. *Deputados;*CÂM. DEP. *Deputados brasileiros.\nRepertório*(1967-1971); INF. BIOG.; TRIB. SUP. ELEIT. *Dados*(4, 6 e 8).\n\n \n","ref":"FONTES: CÂM. DEP. *Deputados;*CÂM. DEP. *Deputados brasileiros.\nRepertório*(1967-1971); INF. BIOG.; TRIB. SUP. ELEIT. *Dados*(4, 6 e 8).\n\n \n","dic":"DHBB"}
