{"title":"LUPO, Aldo","cargoss":["Deputado federal"],"cargos_esp":[0],"datas_ini":[1971],"datas_fim":[1974],"estados":["SP"],"autor":[0],"content":"**LUPO, Aldo**\n\n\\*dep. fed. SP 1971-1974.\n\n* *\n\n*Aldo Lupo* nasceu em Araraquara (SP) no dia 19 de dezembro de 1911,\nfilho de Henrique Lupo e de Judite Bonini Lupo.\n\nEm 1935 bacharelou-se em ciências jurídicas Globo (30/8/91); /e sociais\npela Faculdade de Direito da Universidade de São Paulo.\n\nIniciou sua vida pública como secretário de Higiene da Prefeitura de São\nPaulo, tendo sido também superintendente das estâncias balneárias do\nestado e presidente da Comissão Estadual de Preços e da Companhia de\nEntrepostos e Armazéns Gerais do Estado de São Paulo (CEAGESP).\n\nEm outubro de 1950, elegeu-se primeiro suplente de deputado estadual na\nlegenda do Partido Trabalhista Nacional (PTN), assumindo uma cadeira na\nAssembléia Legislativa paulista em 1951. No ano seguinte viajou à Itália\npara tratar de assuntos relacionados com imigração. Voltando ao Brasil,\nretornou à Assembléia, deixando-a ao final da legislatura, em janeiro de\n1955.\n\nApós o movimento político-militar de março de 1964, com a extinção dos\npartidos políticos pelo Ato Institucional nº 2 (AI-2), de 27 de outubro\nde 1965, e a posterior instauração do bipartidarismo, filiou-se à\nAliança Renovadora Nacional (Arena). Nessa legenda elegeu-se deputado\nfederal por São Paulo em novembro de 1970, assumindo o mandato em\nfevereiro de 1971. Durante a legislatura foi membro da Comissão de\nFinanças e suplente da Comissão de Orçamento da Câmara dos Deputados. Em\nagosto de 1974 renunciou ao mandato parlamentar por “não ter tido\ncondições de opor-se à decisão de seu partido em São Paulo de lançá-lo\ncomo candidato a suplente na chapa ao Senado”. Segundo ele, “realizar\nmeia campanha ou meio mandato” eram soluções que repugnavam à sua “moral\npessoal”.\n\nNão mais retornando ao cenário político, foi diretor das Meias Lupo,\nempresa na qual tinha participação, trabalhou na Usina São Manuel, além\nde se dedicar as suas fazendas.\n\nFaleceu em Araraquara no dia 9 de agosto de 1978.\n\nEra casado com Ernestina Somenzari Lupo, com quem teve quatro filhos.\n\n \n\nFONTES: CÂM. DEP. *Deputados*; CÂM. DEP. *Deputados brasileiros.\nRepertório*; INF. FAM.; *Jornal do Brasil* (15/8/74); *Perfil* (1972);\nTRIB. SUP. ELEIT. *Dados* (2 e 9).\n\n \n","ref":"FONTES: CÂM. DEP. *Deputados*; CÂM. DEP. *Deputados brasileiros.\nRepertório*; INF. FAM.; *Jornal do Brasil* (15/8/74); *Perfil* (1972);\nTRIB. SUP. ELEIT. *Dados* (2 e 9).\n\n \n","dic":"DHBB"}
