{"title":"MACEDO, Araripe","cargoss":["comte -em-ch Esquadra","Ministro da Marinha"],"cargos_esp":[0,0],"datas_ini":[1964,1965],"datas_fim":[1965,1967],"estados":[0,0],"autor":["Gavet (1940)."],"content":"**MACEDO, Araripe**\n\n\\*militar; comte.-em-ch. Esquadra 1964-1965; min. Mar. 1965-1967.\n\n*Zilmar Campos de Araripe Macedo* nasceu no Rio de Janeiro, então\nDistrito Federal, no dia 15 de fevereiro de 1908, filho do coronel José\nAraripe Macedo e de Zulmira Campos de Araripe Macedo. Seu irmão, Joelmir\nCampos de Araripe Macedo, foi ministro da Aeronáutica de 1971 a 1979.\n\nCursou o secundário no Colégio Militar do Rio de Janeiro. Em abril de\n1925 ingressou no primeiro ano da Escola Naval, passando a\nguarda-marinha em dezembro de 1927. Em novembro do ano seguinte embarcou\nno cruzador *Rio Grande do Sul*para o ensino prático de aplicação.\nConcluído o curso na Escola Naval, foi promovido a segundo-tenente em\nsetembro de 1929 e em seguida designado para se apresentar no\nencouraçado *São Paulo*.\n\nEm outubro de 1930 — mês em que irrompeu a revolução que destituiu o\npresidente Washington Luís trazendo ao poder Getúlio Vargas — foi\npromovido a primeiro-tenente e transferido para a Flotilha de\nContratorpedeiros. A bordo do cruzador *Rio Grande* *do Sul*,**partiu em\noutubro de 1931 para Recife, onde, em apoio ao interventor em Pernambuco\nCarlos de Lima Cavalcanti, participou da repressão ao 21º Batalhão de\nCaçadores que se havia sublevado. Após a rendição dos revoltosos,\ntransportou-os para o presídio da ilha de Fernando de Noronha. Retornou\nao Rio em dezembro do mesmo ano, ainda a bordo do *Rio Grande do\nSul*,**que compunha juntamente com os contratorpedeiros *Paraná*\ne*Paraíba*a 1ª Divisão Naval.\n\nEm 12 de julho de 1932, logo após a eclosão da Revolução\nConstitucionalista de São Paulo, embarcou mais uma vez no *Rio Grande do\nSul*em direção a Santos a fim de tomar parte no bloqueio ao porto\ndaquela cidade. Ajudante-de-ordens do comando da 1ª Divisão Naval, foi\ndispensado do cargo em setembro e transferido para o contratorpedeiro\n*Mato Grosso*,**a bordo do qual voltou a Santos para dar continuidade ao\nbloqueio. Cessadas as hostilidades no início de outubro com a derrota\ndos paulistas, regressou ao Rio, sendo designado em dezembro\najudante-de-ordens do comandante-em-chefe da Esquadra brasileira, o\ncontra-almirante Américo dos Reis, e transferido para o encouraçado *São\nPaulo*.\n\nPromovido a capitão-tenente em março de 1933, foi destacado em agosto do\nmesmo ano para o tênder *Belmonte*.**Voltou a servir no *Rio Grande do\nSul*em janeiro de 1934 e em novembro desse ano comandou o rebocador\n*Aníbal de Mendonça*.**Regressando ao cruzador *Rio Grande do Sul*em\nnovembro de 1935, seguiu para o Rio Grande do Norte. Nessa viagem\nparticipou da repressão à Revolta Comunista que agitou Natal entre os\ndias 23 e 27 daquele mês. O levante, promovido pela Aliança Nacional\nLibertadora (ANL), organização integrada por comunistas,\nsociais-democratas, antifascistas e setores militares descontentes,\neclodiu também em Recife, no dia 24 de novembro, e no Rio de Janeiro, no\ndia 27.\n\nRetornando ao Rio em janeiro de 1936, iniciou no mês seguinte o curso de\nhidrografia e navegação. Concluído o curso, foi desligado da 1ª Divisão\nNaval e designado para a Diretoria de Navegação, embarcando, ainda em\nfevereiro, no navio hidrográfico *Jaceguai*,**no qual assumiu a função\nde imediato. Em abril de 1938, após a instalação do Estado Novo, tendo à\nfrente Getúlio Vargas (10/11/1937), apresentou-se na Escola Naval, onde\nserviu como instrutor de navegação e hidrografia. Em janeiro de 1939\nembarcou no vapor *Pedro II*como instrutor de aspirantes.\n\nApós a declaração de guerra do Brasil à Alemanha e à Itália em agosto de\n1942, durante a Segunda Guerra Mundial (1939-1945), participou de\noperações de patrulhamento da costa brasileira. Promovido a\ncapitão-de-corveta em dezembro de 1942, voltou a servir na Escola Naval\nentre janeiro de 1943 e janeiro de 1945, tendo sido nesse período\ninstrutor de navegação e hidrografia do quarto ano. Desligado da Escola\nNaval, foi designado imediato do contratorpedeiro *Mariz e Barros* em\nfevereiro de 1945. Em novembro desse ano, após a deposição do presidente\nGetúlio Vargas pelos chefes militares em 29 de outubro, foi nomeado\noficial-de-gabinete do ministro da Marinha, o vice-almirante Jorge\nDodsworth Martins. Assumindo o cargo em fevereiro de 1946, foi designado\npara representar o Ministério da Marinha junto ao presidente da Comissão\nMista Militar Brasil-Estados Unidos. Em abril passou a desempenhar a\nfunção de assessor técnico do Ministério da Marinha, junto ao\nrepresentante do governo brasileiro, para liquidação dos compromissos\nreferentes à lei de empréstimos e arrendamentos.\n\nCom a substituição de Dodsworth Martins pelo almirante-de-esquadra\nSílvio de Noronha, foi desligado do gabinete do ministro da Marinha em\nsetembro de 1946 e nomeado comandante do contratorpedeiro *Bracuí*,\nfunção que exerceu até janeiro de 1948. Em junho desse ano matriculou-se\nno curso fundamental da Escola de Guerra Naval (EGN).\n\nCapitão-de-fragata em dezembro de 1948, concluiu o curso fundamental da\nEGN em outubro de 1949, sendo designado em seguida auxiliar de ensino da\nmesma escola. Desligado da EGN em janeiro em 1951, viajou logo depois\npara os EUA, integrando a Comissão de Cruzadores. No mês seguinte foi\ndesligado da comissão para assumir o Departamento de Operações do\ncruzador *Barroso*,**no qual voltou ao Rio em dezembro de 1951, já no\nsegundo governo de Getúlio Vargas.\n\nPromovido a capitão-de-mar-e-guerra em março de 1953, em abril tornou-se\nsuperintendente de ensino da Escola Naval. Em 1954 — ano do suicídio de\nGetúlio Vargas, ocorrido a 24 de agosto —, fez dois cursos de\ntreinamento nos EUA. Dispensado das funções de superintendente da Escola\nNaval em março de 1955, foi designado chefe do estado-maior do comando\nda Força de Contratorpedeiros.\n\nNomeado diretor do Colégio Naval em fevereiro de 1956, foi transferido\nem janeiro de 1957 para o Corpo Permanente da Escola Superior de Guerra\n(ESG), assumindo em fevereiro as funções de adjunto da Divisão de\nAssuntos Psicossociais e em seguida a chefia dessa mesma divisão. Em\nmarço foi designado presidente da comissão encarregada de elaborar o\nanteprojeto de lei dispondo sobre o exercício do magistério da Marinha,\nem todos os graus de ensino.\n\nEm junho de 1958, assumiu o comando do cruzador *Barroso*,**nele\npermanecendo até janeiro de 1959, quando foi promovido a\ncontra-almirante. Em fevereiro seguinte assumiu o comando da Flotilha de\nContratorpedeiros, no qual se manteve até abril de 1960. Entre maio e\nagosto foi subchefe do Estado-Maior das Forças Armadas (EMFA).\n\nEm dezembro de 1960, assumiu a subchefia do Estado-Maior da Armada (EMA)\ne em fevereiro de 1961, já no governo de Jânio Quadros, foi nomeado\ndiretor-geral de Pessoal da Marinha, sendo então desligado do EMA.\n\nNomeado em abril de 1961 membro da Junta Administrativa do Fundo Naval,\nem outubro — após a renúncia de Jânio Quadros (25/8/1961) e a posse do\nvice-presidente João Goulart (7/9/1961) na presidência da República —,\nassumiu a direção da Escola Naval. Em novembro seguinte foi designado\npara integrar o Conselho de Promoções da Marinha, na qualidade de membro\nefetivo.\n\nEm agosto de 1962, após ser exonerado da direção da Escola Naval, foi\npromovido a vice-almirante. No mês seguinte, foi nomeado para a chefia\ndo núcleo de comando da Zona de Defesa do Atlântico, deixando essa\nfunção em agosto de 1963. Em outubro desse ano, assumiu o cargo de\ndiretor-geral de Eletrônica da Marinha, pedindo exoneração em fevereiro\nde 1964 para se apresentar como adido no Departamento de Pessoal da\nMarinha.\n\nApós o movimento político-militar de 31 de março de 1964, que destituiu\nJoão Goulart da presidência da República, tomou posse em 2 de abril no\ncargo de comandante-em-chefe da Esquadra, em substituição ao\nvice-almirante Norton Demaria Boiteux. Manteve-se nesse cargo até\noutubro de 1965, quando foi substituído pelo almirante-de-esquadra\nSílvio Monteiro Moutinho. Em seguida foi nomeado diretor-geral de\nHidrografia e Navegação. Essa nomeação foi porém tornada sem efeito em\nnovembro porque Araripe Macedo foi nomeado secretário-geral da Marinha.\n\nEm dezembro de 1965, em virtude do pedido de exoneração do ministro\nPaulo Bosísio, Araripe Macedo foi escolhido pelo presidente da\nRepública, marechal Humberto de Alencar Castelo Branco, para assumir a\npasta da Marinha. Na ocasião foi promovido a almirante-de-esquadra e\npassou para a reserva remunerada.\n\nEm novembro de 1966, Araripe Macedo assinou um decreto presidencial pelo\nqual seriam aumentados os limites do mar territorial brasileiro de três\npara seis milhas. Manteve-se como ministro da Marinha até o final do\ngoverno Castelo Branco, em março de 1967, tendo sido substituído pelo\nalmirante Augusto Hamann Rademaker, nomeado já sob o governo Costa e\nSilva.\n\nFaleceu no Rio de Janeiro\n\nPublicou dois livros: *Neutralização magnética dos navios e seus efeitos\nsobre a agulha* (1944) e *A batalha de Midway*(1950). Além disso,\ntraduziu duas obras clássicas da literatura militar: *Filosofia\nmilitar*,**de André Roujon (1939) e *A arte de comandar*,**de André\nGavet (1940).\n\nFONTES: ARQ. MIN. MAR.; CACHAPUZ, P. *Cronologia;*CORRESP. SERV. DOC.\nGER. MAR.; COUTINHO, A. *Brasil; Encic. Mirador;*FIECHTER, G*. Regime;\nGrande encic. Delta;*MIN. MAR. *Almanaque*(1965);*Rev. Arq. Públ.\nMineiro;* SERV. DOC. GER. MARINHA; TEIXEIRA, F*. História;*VIANA FILHO,\nL. *Governo*.\n\n \n","ref":"FONTES: ARQ. MIN. MAR.; CACHAPUZ, P. *Cronologia;*CORRESP. SERV. DOC.\nGER. MAR.; COUTINHO, A. *Brasil; Encic. Mirador;*FIECHTER, G*. Regime;\nGrande encic. Delta;*MIN. MAR. *Almanaque*(1965);*Rev. Arq. Públ.\nMineiro;* SERV. DOC. GER. MARINHA; TEIXEIRA, F*. História;*VIANA FILHO,\nL. *Governo*.\n\n \n","dic":"DHBB"}
