{"title":"MACEDO, Osvaldo","cargoss":["Deputado federal","Deputado federal","Constituinte"],"cargos_esp":[0,0,0],"datas_ini":[1987,1979,1987],"datas_fim":[1991,1983,1988],"estados":["PR","PR",0],"autor":[0],"content":"**MACEDO, Osvaldo**\n\n\\*dep. fed. PR 1979-1983, 1987-1991; const. 1987-1988.\n\n \n\n*Osvaldo Evangelista de Macedo* nasceu em Sertanópolis, hoje Bela Vista\ndo Paraíso (PR), no dia 28 de junho de 1941, filho de Cirilo Evangelista\nde Macedo e de Maria Floriana de Macedo.\n\nQuando cursava direito na Universidade Federal do Paraná, onde se formou\nem 1965, participou ativamente do movimento estudantil e foi\nvice-presidente da União Paranaense dos Estudantes. Nesse período,\ntrabalhou nos jornais *O Estado do Paraná* e *A Gazeta do Povo*e foi\nassessor da Secretaria de Finanças e do Conselho de Desenvolvimento do\nExtremo Sul. Em julho de 1965, após concurso, foi nomeado promotor\npúblico substituto na comarca de Londrina (PR), cargo que deixou meses\ndepois para se estabelecer com escritório de advocacia. Na Universidade\nEstadual de Londrina, lecionou direito penal no curso de direito e\ndireito público no curso de economia. Por duas vezes, foi presidente da\nAssociação dos Advogados de Londrina, além de ter sido o primeiro\npresidente local do Movimento Brasileiro de Alfabetização (Mobral).\n\nEm 1967, ingressou no serviço público federal como procurador do\nInstituto Brasileiro do Café (IBC) em Londrina. Três anos depois,\niniciou suas atividades políticas como presidente do diretório municipal\nde Londrina do Movimento Democrático Brasileiro (MDB), partido de\noposição ao regime militar instalado no país em abril de 1964, e exerceu\na função até 1975.\n\nEm novembro de 1974, foi eleito deputado estadual do Paraná pela legenda\ndo MDB. Tomou posse em fevereiro de 1975 e se tornou líder da agremiação\nna Assembleia Legislativa. No pleito de novembro de 1978, elegeu-se\ndeputado federal pelo Paraná na legenda do MDB, foi empossado em\nfevereiro de 1979 e integrou a Comissão de Constituição e Justiça\ndurante todo o mandato. Em novembro desse ano, com o fim do\nbipartidarismo, filiou-se ao Partido do Movimento Democrático Brasileiro\n(PMDB), agremiação oposicionista que sucedeu ao MDB e da qual foi um dos\nfundadores nacionais, pois acompanhou Ulysses Guimarães na implantação\ndo novo partido nos estados do norte do país.\n\nVice-líder do PMDB até o encerramento da legislatura, defendeu\npublicamente a convocação imediata da Assembleia Nacional Constituinte\nque, em sua opinião, representava o restabelecimento da plenitude\ndemocrática. Propôs emenda constitucional que fixava em um salário\nmínimo o menor benefício previdenciário, para permitir o aumento da\naposentadoria do trabalhador rural que, na época, equivalia à metade do\nsalário mínimo. Outra emenda constitucional almejava tornar gratuito o\nensino nas universidades estaduais. Um dos projetos de sua autoria, que\nse tornou lei, dispensava a autorização do marido para a mulher fazer\nrepresentação criminal. Foi também relator do projeto que criou o estado\nde Rondônia.\n\nEm novembro de 1982 concorreu à prefeitura de Londrina mas não se\nelegeu. Deixou a Câmara dos Deputados em janeiro de 1983. Meses depois,\nfoi nomeado pelo governador José Richa, do PMDB, responsável pela\ncoordenação política do governo e para a Procuradoria-Geral do Estado\njunto ao Tribunal de Contas do Paraná. Todavia, permaneceu pouco tempo\nno exercício dessas funções, voltando a advogar no seu escritório em\nLondrina. Nessa cidade, ao lado dos jornalistas Marcelo Oikawa e Valmor\nMacarini, lançou e foi o coordenador da campanha de renovação da\ncafeicultura e da diversificação agrícola, promovida pelo jornal *Folha\nde Londrina*.\n\nNo pleito de novembro de 1986, Osvaldo Macedo se elegeu deputado federal\nconstituinte pelo Paraná na legenda do PMDB. No exercício do mandato —\niniciado em fevereiro de 1987, quando começaram os trabalhos da\nConstituinte —, tornou-se membro da Subcomissão do Poder Executivo, da\nComissão da Organização dos Poderes e Sistema de Governo, e suplente da\nSubcomissão dos Direitos e Garantias Individuais, da Comissão da\nSoberania e da Comissão dos Direitos e Garantias do Homem e da Mulher.\n\nNas principais votações da Constituinte, foi a favor do rompimento de\nrelações diplomáticas com países com política de discriminação racial,\ndo mandado de segurança coletivo, do aborto, da proteção ao trabalho\ncontra a demissão sem justa causa, do turno ininterrupto de seis horas,\ndo aviso prévio proporcional, da unicidade sindical, da soberania\npopular, do voto aos 16 anos, da nacionalização do subsolo, do limite de\n12% ao ano para os juros reais, da criação de fundo de apoio à reforma\nagrária e da anistia aos micro e pequenos empresários. Votou contra a\npena de morte, a limitação do direito à propriedade privada, a jornada\nsemanal de 40 horas, o presidencialismo e o mandato de cinco anos para o\npresidente José Sarney.\n\nDefendeu ainda a tipificação da tortura, do tráfico de entorpecentes e\ndos crimes hediondos; a proteção do mercado de trabalho da mulher; a\nfixação de percentual de cargos e empregos públicos para deficientes e a\ndisciplina em relação às reclamações dos usuários dos serviços públicos.\nFoi autor e redator da emenda popular apresentada à Constituinte com\nmilhares de assinaturas, recolhidas em vários estados, que propunha o\nprazo de quatro anos para o mandato presidencial.\n\nOsvaldo Macedo disputou a reeleição em outubro de 1990 pelo PMDB, mas\nobteve apenas uma suplência. Deixou a Câmara dos Deputados em janeiro de\n1991, ao final da legislatura, retornando à advocacia em Londrina. Ainda\nem 1991, assumiu a diretoria de expansão da *Folha de Londrina*,\ndeixando-a em 1992, após eleger-se presidente do diretório municipal do\nPMDB. Em outubro desse ano, disputou novamente a eleição para prefeito\nde Londrina, mas não foi bem-sucedido.\n\nEm seguida, reassumiu seu cargo de carreira no serviço público, agora\ncomo procurador autárquico do Ministério da Fazenda, lotado na\nProcuradoria da Fazenda Nacional. Aposentou-se em dezembro de 1995.\nDesde então, passou a exercer a advocacia em Curitiba, dedicando-se\nespecialmente ao direito constitucional e ao direito administrativo.\n\nAo longo do mandato, publicou três livros com trabalhos parlamentares:\n*A revolta dos fatos*, *O poder nas ruas* e *O valor do trabalho\ndoméstico*. Também publicou *Em defesa da mulher* e duas teses\njurídicas: *Salário mínimo e salário móvel* e *Incidência simultânea de\nimpostos*.\n\nFoi casado com Marlise Ribeiro Macedo, com quem teve três filhos.\nCasou-se pela segunda vez com Nilda Infante Vieira.\n\n \n\nEdnílson Cruz\n\n \n\nFONTES: ASSEMB. NAC. CONST. *Repertório* (1987-1988); CÂM. DEP.\n*Deputados brasileiros*. *Repertório* (1979-1983); INF. BIOG.\n","ref":"FONTES: ASSEMB. NAC. CONST. *Repertório* (1987-1988); CÂM. DEP.\n*Deputados brasileiros*. *Repertório* (1979-1983); INF. BIOG.\n","dic":"DHBB"}
