{"title":"MACHADO NETO, Brasílio","cargoss":["Revolucionário ou revoltoso","Presidente de associação ou confederação de empregados ou empregadores","Deputado federal","Presidente de associação ou confederação de empregados ou empregadores","Deputado federal"],"cargos_esp":[0,"CNC",0,"CNC",0],"datas_ini":[1932,1952,1955,1956,1959],"datas_fim":[1932,1954,1959,1959,1963],"estados":[0,0,"SP",0,"SP"],"autor":[0],"content":"**MACHADO NETO, Brasílio**\n\n\\*rev. 1932; pres. CNC 1952-1954; dep. fed. SP 1955-1959; pres. CNC\n1956-1959; dep. fed. SP 1959-1963.\n\n \n\n*Brasílio Augusto Machado de Oliveira Neto* nasceu em São Paulo no dia\n12 de março de 1900, filho do advogado e político José de Alcântara\nMachado de Oliveira e de Maria Emília de Castilho Machado. Seu pai foi\nprofessor da Faculdade de Direito de São Paulo, deputado à Constituinte\nde 1934 e senador por São Paulo de 1935 a 1937. Seu avô, Brasílio\nMachado de Oliveira, igualmente advogado e professor, e seu bisavô, José\nJoaquim Machado de Oliveira, foi político de grande prestígio durante a\nMonarquia, tendo presidido várias províncias do Império. Era irmão do\nescritor modernista Antônio de Alcântara Machado (1901-1935), autor de\nLaranja da China e de Brás, Bexiga e****Barra Funda. Fez seus estudos em\nSão Paulo, inicialmente no Colégio Stafford (1907-1911), e depois, até\n1917, no Ginásio São Bento. Ingressou na Faculdade de Direito em 1919,\nbacharelando-se em 1923. Trabalhou como serventuário da Justiça quando\nestudante, e ainda antes de formar-se fundou a Empresa Paulista de\nPropaganda, iniciando então sua atividade empresarial. Após o\nbacharelato, foi trabalhar no escritório de advocacia de seu pai. Entre\n1926 e 1930, foi sócio e gerente da firma Amaral César Cia. Ltda. Em\n1928, foi um dos fundadores da Sociedade Harmonia de Tênis, que dirigiu\naté 1932. Entre 1931 e 1940, foi ainda diretor, e depois presidente, da\nAssociação dos Serventuários da Justiça de São Paulo.\n\n \n\nNa política\n\nEm 1932, participou da Revolução Constitucionalista, integrando a\ndireção dos Serviços de Abastecimento das Tropas em Operação,\nencarregados do apoio logístico às forças rebeldes. Em fins desse mesmo\nano, foi um dos fundadores da Ação Nacional, dissidência do Partido\nRepublicano Paulista que, em 1934, fundiu-se com o Partido Democrático e\ncom a Federação dos Voluntários para formar o Partido\nConstitucionalista. Fundado o partido, foi membro de sua comissão\nmunicipal de 1934****a****1937.\n\nEm 1943, exerceu o cargo de diretor-secretário da Associação Comercial\nde São Paulo (ACSP) e presidiu o Sindicato do Comércio Varejista de\nMaterial Elétrico de São Paulo. Na ACSP, fundou duas publicações: o\nBoletim Semanal, órgão especializado em informações comerciais, que\ndirigiu, e o Digesto Econômico, revista mensal de análise de temas\neconômicos e financeiros. No ano seguinte, foi eleito presidente da\nACSP, permanecendo no cargo até 1948. Durante sua gestão, criou o\nInstituto de Economia Gastão Vidigal.\n\nAinda em 1944, foi eleito também presidente da Federação do Comércio do\nEstado de São Paulo, o que implicava ocupar simultaneamente a\npresidência dos conselhos regionais paulistas do Serviço Social do\nComércio (Sesc) e do Serviço Nacional de Aprendizagem Comercial (Senac).\nEnquanto presidente da federação — cargo em que permaneceu até 1952 —,\nfoi um dos fundadores da Confederação Nacional do Comércio (CNC) em\nsetembro de 1945, integrando a junta diretiva provisória que dirigiu o\nórgão até a posse de sua primeira diretoria eleita, em janeiro de 1946.\n\n \n\nNa Assembléia Legislativa\n\nNas eleições de janeiro de 1947, Machado Neto elegeu-se, na legenda do\nPartido Social Democrático (PSD), deputado à Assembléia Constituinte de\nSão Paulo, depois transformada em Assembléia Legislativa. Em 1948,\npresidiu a Comissão de Finanças e Orçamento e, em 1949 e 1950, ocupou a\npresidência da Assembléia.\n\nNas eleições de 1950, o PSD apresentou sua candidatura ao Senado, como\nparte de um arranjo político que alinhava o PSD, a União Democrática\nNacional (UDN), o Partido Republicano (PR) e o Partido Socialista\nBrasileiro (PSB) no apoio ao seu nome e aos de Francisco Prestes Maia\ncomo candidato ao governo e João Gomes Martins como candidato a\nvice-governador. Contudo, foram todos derrotados nas urnas pelos\ncandidatos da frente formada pelo Partido Trabalhista Brasileiro (PTB) e\no Partido Social Progressista (PSP).\n\n \n\nPresidente da Confederação Nacional do Comércio\n\nEncerrando-se seu mandato, deixou a Assembléia Legislativa em janeiro de\n1951. Continuava porém presidente da Federação do Comércio do Estado de\nSão Paulo, cargo que só abandonou ao ser eleito (10/10/1952) presidente\nda CNC.\n\nEmpossado no dia 6 de novembro de 1952, ocupou também a presidência dos\nconselhos nacionais do Sesc e do Senac, tendo iniciado a construção das\nsedes regionais desses órgãos nas capitais dos estados. Já****em seu\ndiscurso de posse, marcou posição contrária à criação da Petrobras,\ndefendendo a entrega da prospecção e exploração do petróleo a empresas\nestrangeiras, a exemplo da Venezuela.\n\nAinda em 1952, participou em Lima, no Peru, da VI Reunião do Conselho\nInteramericano de Comércio e Produção. Durante o conclave, colocou-se\ncontra a intervenção do Estado na economia. Nos últimos dias do ano, fez\nnovos pronunciamentos, responsabilizando os aumentos salariais pela alta\ndo custo de vida e atacando o “jacobinismo vesgo” que, ao invés de\npossibilitar a aplicação de capital estrangeiro no país, preferia\naumentar os impostos, conceder abonos e determinar a participação dos\ntrabalhadores nos lucros das empresas.\n\nEm 1953 Brasílio Machado Neto criou o Conselho Técnico Consultivo da\nCNC, integrado basicamente por economistas e juristas de prestígio. Este\nconselho, por sua vez, era responsável pela publicação da revista Carta\nMensal. Na época da votação das emendas nacionalistas que visavam a\nimplantar a Petrobras (maio de 1953), criticou o Código de Minas, e em\njulho de 1953, apoiando a argumentação de Juarez Távora, voltou a\ndefender a participação da livre empresa na indústria petrolífera. Em\nagosto, convidado por Juarez, reiterou esses pontos de vista em\nconferência que realizou na Escola Superior de Guerra.\n\nEm outubro de 1954, como conseqüência de campanha pela integração do\nempresariado na política, Basílio Machado Neto se elegeu deputado\nfederal por São Paulo na legenda do PSD, recusando ao mesmo tempo sua\nindicação à reeleição na CNC. Nesta entidade, foi sucedido por João de\nVasconcelos, empossado em novembro.\n\nEm fevereiro de 1955, assumiu sua cadeira na Câmara, com mandato até\njaneiro de 1959. Durante a legislatura, integrou a Comissão de Economia\ne, depois, a Comissão de Finanças.\n\nVoltando a ocupar a presidência da CNC em 1956, permaneceu no cargo por\ndois mandatos sucessivos, o último interrompido em outubro de 1959.\n\nEm 1958 participou na Câmara da Comissão Parlamentar de Inquérito que\nficou conhecida como CPI da American Can Co. instalada para investigar\nos efeitos da Instrução nº 113 da Superintendência da Moeda e do Crédito\n(Sumoc) na economia nacional. A Instrução nº 113, baixada em 1955,\nfacilitava o ingresso de capitais estrangeiros no país.\n\nEm outubro de 1958, foi lançada em Brasília a pedra fundamental da nova\nsede da CNC — primeira entidade da classe a adotar providências para se\ninstalar na nova capital. No mesmo mês, Brasílio****Machado Neto foi\nreeleito deputado federal por São Paulo, dessa vez na legenda do Partido\nSocial Progressista (PSP).\n\nReconduzido à presidência da CNC em novembro de 1958, tomou posse\napoiando a Operação Pan-Americana (OPA) lançada pelo governo Juscelino\nKubitschek. No ano seguinte, combateu a criação da Superintendência de\nAbastecimento e Preços, que considerava “restritiva” à iniciativa\nprivada.\n\nAinda em 1959, grave crise interna se instalou na CNC, com as notícias\nde irregularidades no Sesc e no Senac no Rio e em São Paulo. Os\ndirigentes de cinco entidades patronais solicitaram ao Ministério do\nTrabalho que interviesse na entidade, acusando a diretoria da CNC de\nutilização irregular de verbas e também de ter renunciado à\nrepresentação da classe. Em decorrência disso, Brasílio Machado Neto\nrenunciou à presidência da CNC em outubro de 1959, sendo substituído por\nCharles Edgar Moritz, que concluiu o mandato e foi****depois eleito para\nperíodos subseqüentes.\n\nEm 1960, Brasílio Machado Neto foi novamente eleito presidente da\nFederação do Comércio do Estado de São Paulo para o biênio 1960-1961,\nocupando conseqüentemente a presidência dos conselhos regionais do Sesc\ne do Senac. Após terminar seu mandato de deputado federal (1963), foi\nreconduzido a esses cargos, que ocupou em dois biênios consecutivos, de\n1963 a 1966. Nesse período, criou cursos e centros sociais para os\nfiliados do Sesc, fundando ainda a colônia de férias Rui Fonseca e\ninstalando a nova sede das entidades em São Paulo.\n\nEm 1964, foi eleito também presidente do Centro do Comércio do Estado de\nSão Paulo. Em 1966, passou a integrar o conselho técnico consultivo da\nCNC e foi eleito vice-presidente da entidade, com mandato até 1968.\n\nBrasílio Machado Neto foi ainda professor da Faculdade de Direito de São\nPaulo, diretor-superintendente e sócio da firma Indústria e Comércio\nAssunção S.A., membro empregador adjunto da Organização Internacional do\nTrabalho (com sede em Genebra), vice-presidente da Câmara Internacional\ndo Comércio, membro da Câmara Internacional de Empregados e da Comissão\nInteramericana de Arbitragem Comercial (com sede em Nova Iorque).\nPresidiu a Legião Brasileira de Assistência (LBA) e a seção brasileira\ndo Conselho Interamericano de Comércio e Produção, tendo sido também\nvice-presidente internacional da comissão executiva desta organização.\nDurante sua militância no PSD, participou da comissão executiva do\npartido.\n\nFaleceu em São Paulo, no dia 28 de novembro de 1968.\n\nFoi casado com Luísa Assunção Machado, Seu filho, Caio de Alcântara\nMachado, foi presidente do Instituto Brasileiro do Café de 1968 a 1969.\n\nAlém de discursos, entrevistas e conferências, publicou:\nDescentralização administrativa e discriminação de rendas (1946), Em\ndefesa das classes produtoras (discursos e entrevistas, 1948), O futuro\ndo regime federativo no Brasil e a discriminação de rendas na\nConstituição de 1946 (1949), Petróleo, comércio, especulado e\nexploração, Inflação e outros estudos e Aspectos atuais da economia\nbrasileira.\n\nSônia Dias\n\n \n\n \n\nFONTES: ARQ. CONF. NAC. COMÉRCIO; CÂM. DEP. Deputados; CÂM. DEP. Relação\ndos dep.; CARVALHO, E. Petróleo; CONF. NAC. COMÉRCIO. 20; CORRESP. CONF.\nNAC. COMÉRCIO; CORTÉS, C. Homens; COUTINHO, A. Brasil (2); Eleitos;\nGlobo (5/3/59 e 29/11/68; Grande encic. Delta; HIRSCHOWICZ, E.\nContemporâneos (1949); INST. NAC. LIVRO. Índice; LEITE, A. História;\nSALES, D. Razões; SOC. BRAS. EXPANSÃO COMERCIAL. Quem; Who’s who in\nBrazil (1969).\n\n \n","ref":"FONTES: ARQ. CONF. NAC. COMÉRCIO; CÂM. DEP. Deputados; CÂM. DEP. Relação\ndos dep.; CARVALHO, E. Petróleo; CONF. NAC. COMÉRCIO. 20; CORRESP. CONF.\nNAC. COMÉRCIO; CORTÉS, C. Homens; COUTINHO, A. Brasil (2); Eleitos;\nGlobo (5/3/59 e 29/11/68; Grande encic. Delta; HIRSCHOWICZ, E.\nContemporâneos (1949); INST. NAC. LIVRO. Índice; LEITE, A. História;\nSALES, D. Razões; SOC. BRAS. EXPANSÃO COMERCIAL. Quem; Who’s who in\nBrazil (1969).\n\n \n","dic":"DHBB"}
