{"title":"MACHADO, Lisboa","cargoss":["Deputado federal","Deputado federal","Deputado federal"],"cargos_esp":[0,0,0],"datas_ini":[1965,1964,1963],"datas_fim":[1971,1964,0],"estados":["GO","GO","GO"],"autor":[0],"content":"**MACHADO, Lisboa**\n\n\\*dep.****fed. GO 1963, 1964 e 1965-1971.\n\n \n\n*Antônio de Lisboa Machado* nasceu em Monte Alegre de Minas (MG) no dia\n28 de agosto de 1916, filho de José Caetano Machado e de América Machado\nBraga.\n\nBacharelou-se pela Faculdade de Direito da Universidade de Goiás em\n1944. Em outubro de 1950, elegeu-se deputado estadual em Goiás na\nlegenda da União Democrática Nacional (UDN), iniciando o mandato em\njaneiro de 1951. Reeleito na legenda da UDN em outubro de 1954, exerceu\nnovo mandato até janeiro de 1959, atuando na Assembleia Legislativa\ngoiana como líder da oposição.\n\nEleito em outubro de 1962 suplente de deputado federal por Goiás na\nlegenda da coligação formada pela UDN, o Partido Social Progressista\n(PSP) e o Partido Democrata Cristão (PDC), assumiu o mandato nessa\nlegislatura entre agosto e novembro de 1963, entre agosto e novembro de\n1964, entre março e junho de 1965 e entre julho e outubro de 1965. Ainda\nnesse mês voltou à Câmara, e, com a extinção dos partidos políticos pelo\nAto Institucional nº 2 (27/10/1965) e a posterior instauração do\nbipartidarismo, filiou-se à Aliança Renovadora Nacional (Arena), partido\nque deu sustentação ao regime militar instalado no país em abril de\n1964. Nessa legenda foi reeleito em novembro de 1966. Permaneceu na\nCâmara durante toda a legislatura seguinte, de fevereiro de 1967 a\njaneiro de 1971.\n\nFaleceu no dia 5 de outubro de 1997.\n\nEra casado com Edmeia Jordão Machado.\n\n \n\nFONTES: CÂM DEP. *Deputados*; CÂM. DEP. *Deputados brasileiros.\nRepertório* (1963-1967 e 1967-1971); IPC. *Relação*; TRIB. SUP. ELEIT.\n*Dados* (2, 3, 6 e 8).\n\n \n","ref":"FONTES: CÂM DEP. *Deputados*; CÂM. DEP. *Deputados brasileiros.\nRepertório* (1963-1967 e 1967-1971); IPC. *Relação*; TRIB. SUP. ELEIT.\n*Dados* (2, 3, 6 e 8).\n\n \n","dic":"DHBB"}
