{"title":"MACIEL, Artur Antunes","cargoss":["Interventor"],"cargos_esp":[0],"datas_ini":[1931],"datas_fim":[1932],"estados":["MT"],"autor":[0],"content":"**MACIEL, Artur Antunes**\n\n\\*interv. MT 1931-1932.\n\n \n\n*Artur Antunes Maciel* nasceu em Pelotas (RS) no dia 6 de julho de 1879,\nfilho de Artur Antunes Maciel e Leonídia Moreira Maciel. Seu avô por\nparte de mãe era o barão de Butuí. Seu tio paterno, ligado ao Partido\nLiberal de Gaspar Silveira Martins, foi deputado-geral de 1881 a 1889 e\nministro do Império em 1883. Proclamada a República, participou da\nRevolução Federalista (1893-1895), esteve exilado no Uruguai e foi\ndeputado federal de 1906 a 1911. Seu primo, Francisco Antunes Maciel\nJúnior, foi deputado federal de 1915 a 1917, de 1921 a 1926 e em 1930,\nrevolucionário de 1923 e de 1930 e ministro da Justiça de 1932 a 1934,\ndurante o Governo Provisório de Getúlio Vargas.\n\nArtur Antunes Maciel estudou na Escola Politécnica de São Paulo, por\nonde se formou em 1904. Dedicando-se à engenharia, foi um dos\nplanejadores da reforma da rede ferroviária brasileira.\n\nApós a vitória da Revolução de 1930, por ser ligado a Osvaldo Aranha,\nfoi designado em março de 1931 interventor federal em Mato Grosso em\nsubstituição ao coronel Antonino Mena Gonçalves. Tomando posse em abril\ndo mesmo ano, teve seu governo abalado desde o início pela ação de\nmilitares pertencentes ao 16º Batalhão de Caçadores e de****setores da\nimprensa local contrários ao governo revolucionário no estado. Além\ndisso, acatando a orientação governamental no sentido de que os membros\nda administração pública não desenvolvessem atividades\npolítico-partidárias, recusou-se a apoiar oficialmente o Partido União\nLiberal de Mato Grosso, organizado pelos revolucionários sob a liderança\nde Leônidas Antero de Matos, Vespasiano Martins e João Leite.\nDescontentes, os liberais que o apoiavam articularam seu afastamento da\ninterventoria, o que ocorreu em junho de 1932, quando Leônidas de Matos\nfoi nomeado em seu lugar.\n\nDurante o ano de 1943, Artur Antunes Maciel foi membro do conselho\nadministrativo da Caixa Econômica Federal do Rio de Janeiro e\nposteriormente diretor do Departamento de Estradas de Rodagem (DER) de\nSão Paulo. Presidente da Caixa Econômica Federal de São Paulo nos anos\nde 1945, 1948, e de 1951 a 1954, tornou-se em 1955 diretor desse mesmo\nórgão.\n\nFaleceu em São Paulo no dia 4 de outubro de 1955.\n\nEra casado com Francisca Leite Antunes Maciel.\n\n \n\n \n\nFONTES: ARQ. GETÚLIO VARGAS; CORRESP. GOV. EST. MT; Grande encic. Delta;\nGrande encic. portuguesa; INF. FAM.; MENDONÇA, R. História; PEIXOTO, A.\nGetúlio; POPPINO, R. Federal.\n\n \n","ref":"FONTES: ARQ. GETÚLIO VARGAS; CORRESP. GOV. EST. MT; Grande encic. Delta;\nGrande encic. portuguesa; INF. FAM.; MENDONÇA, R. História; PEIXOTO, A.\nGetúlio; POPPINO, R. Federal.\n\n \n","dic":"DHBB"}
