{"title":"MACIEL, Marco","cargoss":["Deputado federal","Governador de estado ou do Distrito Federal","Senador","Senador","Ministro da Educação","min -chefe Casa Civil","Constituinte","Vice-presidente da República","Senador"],"cargos_esp":[0,0,0,0,"e Cultura",0,0,0,0],"datas_ini":[1971,1979,1987,1983,1985,1986,1987,1995,2003],"datas_fim":[1979,1982,1994,1985,1986,1987,1988,2003,0],"estados":["PE","PE","PE","PE",0,0,0,0,"PE"],"autor":[0],"content":"**MACIEL, Marco**\n\n\\*dep. fed. PE 1971-1979; gov. PE 1979-1982; sen. PE 1983-1985,\n1987-1994,; min. Educ. e Cultura 1985-1986; min.-chefe Casa Civil\n1986-1987; const. 1987-1988; vice-pres. Rep. 1995-2003; sen. PE 2003-\n\n* *\n\n*Marco Antônio de Oliveira Maciel* nasceu em Recife no dia 21 de julho\nde 1940, filho de José do Rego Maciel, deputado federal por Pernambuco\nde 1955 a 1959, e de Carmem Sílvia Cavalcanti de Oliveira Maciel.\n\nEstudou na Faculdade de Direito da Universidade de Pernambuco,\nconcluindo o curso em 1963. Por duas vezes dirigiu o diretório central\ndos estudantes da instituição e, em 1963, assumiu a presidência da União\ndos Estudantes de Pernambuco. Sua atuação na política estudantil\ncaracterizou-se pela oposição à linha ideológica de esquerda então\npredominante na União Nacional dos Estudantes (UNE), entidade da qual se\ndesligou naquele mesmo ano por intermédio de manifesto publicado na\nimprensa. Na mesma época, alinhou-se às forças políticas que se opunham\nao governo de Miguel Arrais em Pernambuco (1962-1964).\n\nApós o movimento político-militar de março de 1964 que depôs o\npresidente João Goulart e cassou o mandato de Arrais, Marco Maciel foi\nconvidado pelo governador Paulo Guerra (1964-1967) para exercer o cargo\nde secretário-assistente do governo de Pernambuco. Devido à pouca idade,\nnão pôde aceitar o convite, mas atuou como assessor do governador. No\npleito de novembro de 1966 elegeu-se deputado estadual em Pernambuco na\nlegenda da Aliança Renovadora Nacional (Arena), partido de sustentação\ndo regime militar. Empossado em fevereiro do ano seguinte, exerceu a\nliderança da bancada governista durante toda a administração do\ngovernador Nilo Coelho (1967-1971).\n\nNo pleito de novembro de 1970 elegeu-se deputado federal por Pernambuco,\nna legenda da Arena, assumindo em fevereiro seguinte sua cadeira na\nCâmara dos Deputados. Membro efetivo da Comissão de Minas e Energia e\nsuplente das comissões de Economia, de Relações Exteriores e da Bacia do\nSão Francisco, integrou ainda o grupo de trabalho formado para estudar a\natualização do regimento interno da Câmara. Em 1972 tornou-se\nsegundo-secretário do diretório nacional da Arena, passando no ano\nseguinte a primeiro-secretário. Nessa época, o partido era presidido\npelo senador Filinto Müller.\n\nNo pleito de novembro de 1974 reelegeu-se deputado federal por\nPernambuco. No ano seguinte seu nome foi cogitado pela corrente liderada\npelo ex-governador Nilo Coelho para ser o candidato arenista à sucessão\nde Eraldo Leite no governo de Pernambuco, ao mesmo tempo que seu pai era\nindicado para o mesmo cargo pelo também ex-governador Paulo Guerra. O\nnome escolhido, no entanto, acabou sendo o de José Francisco de Moura\nCavalcanti, eleito por via indireta e empossado em março de 1975.\n\nEm novembro de 1976, Maciel foi eleito presidente da Câmara dos\nDeputados para o biênio 1977-1978 e assumiu o cargo em 28 de fevereiro\nde 1977. Em abril daquele ano, o presidente Ernesto Geisel decretou o\nfechamento provisório do Congresso Nacional, sob o pretexto de\nimplementar a reforma no Poder Judiciário proposta pelo governo, cujo\nencaminhamento vinha sendo sistematicamente obstruído pela oposição.\nImpotente diante da decisão do Executivo, Maciel procurou minimizar a\nimportância do fato, declarando tratar-se de mera rearrumação\ninstitucional. O “recesso” do Congresso vigorou por 14 dias e resultou\nna decretação do chamado “pacote de abril”, conjunto de medidas\ndestinadas a garantir a hegemonia da Arena no cenário político nacional,\nameaçada pelos resultados das eleições legislativas de 1974 e municipais\nde 1976, que revelaram notável crescimento do partido oposicionista, o\nMovimento Democrático Brasileiro (MDB).\n\nIndicado pelo presidente Ernesto Geisel e pelo futuro presidente João\nBatista Figueiredo para assumir o governo pernambucano, Maciel foi\neleito para o cargo pela Assembléia Legislativa do estado em setembro de\n1978. Tomou posse em março do ano seguinte, após concluir seu mandato na\nCâmara dos Deputados.\n\nCom a extinção do bipartidarismo em novembro seguinte e a conseqüente\nreformulação partidária, participou da organização do Partido\nDemocrático Social (PDS), agremiação que substituiu a Arena na\nsustentação ao regime militar.\n\nEntre as principais iniciativas de seu governo em Pernambuco,\ndestacou-se o projeto Asa Branca, que visava ao desenvolvimento\neconômico da região semi-árida do estado por meio de perenização de\nrios, construção de estradas vicinais e eletrificação rural. Executou\ntambém o projeto Viver, programa de apoio às populações da zona\ncanavieira financiado pela Superintendência do Desenvolvimento do\nNordeste (Sudene) e pelo Banco Nacional da Habitação (BNH), destinado a\nminimizar as tensões sociais naquela área com a construção de casas e\nestradas vicinais.\n\nEm abril de 1982, Marco Maciel deixou o governo de Pernambuco para se\ncandidatar a uma vaga no Senado e foi substituído na chefia do Executivo\nestadual pelo presidente da Assembléia Legislativa, José Muniz Ramos.\nDurante a campanha eleitoral, defendeu reforma tributária para\nconsolidar a abertura política e fortalecer o federalismo.\n\nRealizado o pleito em novembro, sagrou-se vencedor com aproximadamente\n90 mil votos de vantagem sobre seu principal adversário, Cid Sampaio, do\nPartido do Movimento Democrático Brasileiro (PMDB). Na ocasião, o PDS\nvenceu também a disputa pelo governo estadual com a candidatura do\nsenador Roberto Magalhães. A derrota do PMDB pernambucano, apontado como\nfavorito durante a campanha pelas pesquisas de opinião, foi creditada em\nparte às regras eleitorais vigentes naquele pleito, em especial a\ninstituição do voto vinculado — particularidade do pleito de 1982 — que\nobrigava o eleitor a escolher candidatos do mesmo partido para todos os\ncargos então em disputa — vereador, prefeito, deputado estadual,\ndeputado federal, senador e governador.\n\nMarco Maciel assumiu sua cadeira no Senado em fevereiro de 1983 e passou\na se dedicar à articulação do lançamento de sua candidatura à sucessão\ndo presidente Figueiredo, prevista para se realizar por via indireta em\njaneiro de 1985. Com esse objetivo, estabeleceu contatos com diversos\nsegmentos da sociedade brasileira, entre os quais dirigentes do clero\ncatólico e importantes líderes empresariais. Em novembro de 1983, em\ndiscurso no Senado, lançou o que considerou ser sua “pré-plataforma\neleitoral”. Em janeiro do ano seguinte, informou oficialmente sua\npostulação ao presidente do PDS, senador José Sarney.\n\nContando ainda com outros três pré-candidatos à sucessão de Figueiredo —\no vice-presidente Aureliano Chaves, o ministro Mário Andreazza e o\ndeputado Paulo Maluf — o PDS tinha maioria absoluta no Colégio Eleitoral\ndesignado para eleger o novo presidente integrado pelos membros do\nCongresso Nacional e por delegações designadas por cada uma das\nassembléias legislativas. Por conta disso, prevalecia nos meios\npolíticos a convicção de que o candidato vitorioso na convenção nacional\ndo partido venceria com facilidade a disputa presidencial.\n\nNo final de 1983, porém, começou a ganhar corpo nos meios políticos de\noposição a proposta de deflagração de campanha popular pelo\nrestabelecimento das eleições diretas para presidente da República. No\nCongresso Nacional, o deputado Dante de Oliveira (PMDB-MT) apresentou\nemenda constitucional que propunha o restabelecimento das eleições\npresiden-ciais diretas já para a sucessão de Figueiredo e recebeu apoio\ndos partidos de oposição e de amplos segmentos da sociedade civil. A\nmobilização pela aprovação da emenda Dante de Oliveira resultou na\ncampanha das Diretas Já, que reuniu milhões de pessoas nas praças\npúblicas nos primeiros meses de 1984 e repercutiu até mesmo dentro do\nPDS, onde um grupo de parlamentares se manifestou explicitamente pelo\nrestabelecimento imediato do pleito presidencial direto.\n\nEm janeiro de 1984, Marco Maciel divulgou o documento *Participação* e\n*compromisso*, onde defendia, entre outros pontos, a tese da realização\nde eleições diretas em todos os níveis, inclusive para presidente da\nRepública. Primeiro presidenciável do PDS a incluir tal posicionamento\nnas diretrizes de seu programa, Maciel não explicitava em sua proposta,\nporém, se o restabelecimento da eleição direta deveria se dar já na\nsucessão de Figueiredo ou somente no pleito seguinte. Ao se aproximar,\nno entanto, a data de votação da emenda Dante de Oliveira na Câmara dos\nDeputados, e diante das reais possibilidades de sua aprovação, Maciel\nafirmou sua posição em defesa da disputa pela via indireta. Em seguida,\nassumiu papel de destaque nas articulações que visavam à aprovação de\nproposta alternativa apresentada pelo presidente Figueiredo, que\nmantinha o calendário do processo sucessório em andamento e adiava o\nrestabelecimento das eleições presidenciais diretas para 1988.\n\nLevada à votação na Câmara no dia 25 de abril de 1984, a emenda Dante de\nOliveira não obteve o quórum mínimo de 2/3 dos votos favoráveis para\naprovação, e por isso não chegou a ser apreciada pelo Senado. Com esse\nresultado, o debate sucessório voltou a se deslocar para o Colégio\nEleitoral, apesar das tentativas de setores minoritários da oposição de\nretomar a campanha de rua pelas Diretas Já.\n\nA essa altura, a disputa interna no PDS caminhava para uma polarização\nentre as candidaturas de Paulo Maluf e Mário Andreazza. Diante desse\nquadro, Maciel integrou-se ao grupo dissidente do partido, do qual\ntambém fazia parte o vice-presidente Aureliano Chaves, que articulava o\napoio a um nome do PMDB para concorrer no Colégio Eleitoral. Em maio,\nMaciel declarou concordar com a retirada de sua candidatura, desde que\ntal atitude facilitasse o entendimento entre o governo e a oposição e\ncontribuísse “para uma sucessão sem traumas”. Dois meses depois, rompeu\npublicamente com o PDS e assumiu, ao lado de José Sarney, Aureliano\nChaves e outros pedessistas dissidentes, o trabalho de articulação do\nmovimento da Frente Liberal. Paralelamente, os dissidentes aprofundaram\nas negociações com a direção do PMDB com vistas à escolha de um\ncandidato de consenso para disputar a eleição. Esses entendimentos\nresultaram na formação da Aliança Democrática, frente que oficializou,\nem agosto de 1984, o lançamento do governador mineiro Tancredo Neves à\npresidência da República, tendo o ex-pedessista José Sarney como\nvice-presidente. A chapa da Aliança Democrática disputou e venceu o\npleito presidencial indireto realizado em 15 de janeiro de 1985,\nderrotando no Colégio Eleitoral o candidato do PDS, Paulo Maluf.\n\nApós a vitória da Aliança Democrática, o movimento da Frente Liberal\nevoluiu para se estruturar em partido político, dando origem ao Partido\nda Frente Liberal (PFL), que teve Marco Maciel como presidente de sua\ncomissão provisória. Ao mesmo tempo, Maciel foi convidado por Tancredo\nNeves para assumir a pasta da Educação no futuro governo.\n\nEm março de 1985, pouco antes de sua posse, Tancredo Neves foi acometido\npor súbito e grave problema de saúde que o impediu de assumir a\npresidência. Em seu lugar, o vice José Sarney foi empossado\nprovisoriamente no dia 15 de março, mantendo a composição do ministério\nantecipada por Tancredo, com Marco Maciel à frente da pasta da Educação.\nCom a morte de Tancredo em 21 de abril, Sarney foi efetivado na\npresidência da República, confirmando o ministério empossado no mês\nanterior. No Senado, a indicação de Maciel como ministro abriu vaga para\nseu suplente, Nivaldo Machado.\n\nAo assumir o MEC, Maciel manifestou seu inconformismo com a situação\neducacional do país e se comprometeu a implementar política educacional\nbaseada na valorização do ensino de primeiro grau. Anunciou também que o\nensino profissionalizante, então obrigatório em todas as escolas de\nsegundo grau, deixaria de receber o tratamento privilegiado que tivera\ndurante os governos militares e passaria a ser ministrado apenas nas\nescolas técnicas. O ministro comprometeu-se ainda com a legalização da\nUnião Nacional dos Estudantes (UNE), posta na ilegalidade durante o\nregime militar.\n\nPor iniciativa de Maciel, em setembro de 1985, no Dia Nacional da\nEducação, as quase 210 mil escolas oficiais do país interromperam suas\natividades para debater os problemas do ensino de primeiro e segundo\ngraus e receber dos pais, alunos e professores sugestões para\nresolvê-los. Em novembro foi extinto o Movimento Brasileiro de\nAlfabetização (Mobral), após 15 anos de funcionamento. Para substituí-lo\nfoi criada a Fundação Educar, encarregada de oferecer educação básica a\njovens e adultos excluídos do sistema formal de ensino. Em dezembro, o\nministério realizou debate em torno do ensino universitário, abordando\ntemas como currículos, autonomia universitária, piso salarial de\nprofessores e servidores e incentivos à pesquisa.\n\nA reforma ministerial promovida pelo presidente Sarney no início de\n1986, destinada a ampliar o espaço do PFL no governo, resultou na saída\nde Maciel do Ministério da Educação — onde foi substituído pelo também\npefelista Jorge Bornhausen — e em sua ida para a chefia do Gabinete\nCivil da Presidência da República. No novo posto tornou-se o principal\narticulador do governo com o Congresso Nacional.\n\nEm fevereiro do mesmo ano o governo federal lançou um plano de\nestabilização econômica — o Plano Cruzado — que tentava combater a\ninflação pelo congelamento de preços e salários. Os altos índices de\npopularidade conquistados pelo presidente Sarney após a decretação do\nplano resultaram em ampla vitória dos setores políticos que o apoiavam\nno pleito de novembro de 1986, quando foram eleitos os novos\ngovernadores estaduais e os membros da Assembléia Nacional Constituinte.\nApesar de eleger uma grande bancada para o Congresso Nacional, o PFL\nsaiu vitorioso na disputa de apenas um governo estadual, o de Sergipe,\nficando todos os demais executivos estaduais sob o controle do PMDB,\npartido ao qual se filiara o presidente. Em Pernambuco, sua base\npolítica, Maciel trabalhou pela formação de uma frente de apoio ao\ncandidato pefelista José Múcio ao governo estadual que buscava reunir de\nusineiros até o antigo líder das ligas camponesas, Francisco Julião. A\ndisputa, porém, foi vencida pelo peemedebista Miguel Arrais,\nex-governador cassado e exilado pelo regime militar. Para projetar seu\nnome nacionalmente com vistas à sucessão de Sarney, Maciel empenhou-se\ntambém pela eleição do empresário Antônio Ermírio de Morais ao governo\ndo estado de São Paulo, que concorreu na legenda do Partido Trabalhista\nBrasileiro (PTB). Ermírio de Morais foi, porém, derrotado pelo candidato\ndo PMDB, Orestes Quércia.\n\nPassadas as eleições, o Plano Cruzado começou a dar sinais de\nesgotamento. Houve aumentos dos preços, o que desencadeou uma onda de\nprotestos em todo o país, com desgaste do governo e forte queda da\npopularidade de Sarney. Paralelamente, o excelente desempenho eleitoral\ndo PMDB nas eleições de 1986 aumentou o cacife do partido no governo\nfederal e enfraqueceu a posição de Maciel como articulador político. Em\nabril de 1987, Maciel pediu demissão da chefia do Gabinete Civil, sendo\nsubstituído por Ronaldo Costa Couto no início do mês seguinte. Assumiu\nentão a presidência nacional do PFL e retornou ao Senado,\nincorporando-se aos trabalhos da Assembléia Nacional Constituinte.\n\nCom destacado papel na articulação dos setores liberais e conservadores\nno interior da Constituinte, Maciel combateu o estabelecimento de\nlimites ao direito de propriedade privada, a remuneração adicional de\n50% para o jornada extra de trabalho, a redução da jornada semanal de\ntrabalho para 40 horas, a nacionalização do subsolo, a estatização do\nsistema financeiro, o limite de 12% ao ano para os juros reais, a\nlimitação dos encargos da dívida externa, a criação de fundo de apoio à\nreforma agrária e a possibilidade de desapropriação da propriedade\nprodutiva. Foi contrário também à liberação do aborto e à instituição da\npena de morte. No plano da política externa, votou contra o rompimento\ndiplomático do governo brasileiro com países promotores de políticas de\ndiscriminação racial. Pronunciou-se favoravelmente ao mandado de\nsegurança coletivo, à adoção do aviso prévio proporcional ao tempo de\nserviço, à pluralidade sindical, ao direito de voto aos 16 anos, ao\nsistema presidencialista de governo e à concessão de anistia aos débitos\nde pequenos e micro empresários. Politicamente afastado de Sarney na\nocasião, manifestou-se contrário ao mandato de cinco anos para o\npresidente.\n\nEm abril de 1989, lançou seu nome como pré-candidato à presidência da\nRepública. Porém, no mês seguinte, a convenção nacional do PFL aprovou o\nnome do ministro das Minas e Energia, Aureliano Chaves, como candidato à\nsucessão de Sarney. Diante do fraco desempenho eleitoral de Aureliano,\nMaciel manifestou apoio apenas discreto à sua campanha. Realizado o\npleito em novembro de 1989, o pefelista terminou a disputa na nona\ncolocação, obtendo pouco mais de seiscentos mil votos. No segundo turno,\nMaciel engajou-se na campanha do ex-governador alagoano Fernando Collor\nde Melo, do Partido da Reconstrução Nacional (PRN), que venceu a disputa\napós acirrado confronto com Luís Inácio Lula da Silva, candidato da\nFrente Brasil Popular, coligação de esquerda formada pelo Partido dos\nTrabalhadores (PT), Partido Socialista Brasileiro (PSB) e Partido\nComunista do Brasil (PCdoB).\n\nEm outubro de 1990, Maciel obteve novo mandato de senador pelo estado de\nPernambuco na legenda do PFL. No início da nova legislatura, em\nfevereiro de 1991, assumiu a liderança do governo Collor no Senado e\nimediatamente iniciou articulações para a formalização de um bloco\ngovernista naquela casa. Essa medida, conforme tinha previsto,\neliminaria o fisiologismo nas relações dos senadores com o governo, já\nque estimularia atitude mais programática dos parlamentares. Em seu\nprimeiro ano como líder governista, Maciel se manifestou contrário à\nantecipação da revisão constitucional, prevista pela Constituição de\n1988 para ocorrer cinco anos após a promulgação. Segundo as regras\nprevistas nesse dispositivo da Carta de 1988, durante a revisão o texto\nconstitucional poderia ser modificado pela maioria simples dos votos dos\ncongressistas, sem que fosse necessária a maioria qualificada de 2/3\nexigida nos períodos de funcionamento ordinário do Congresso. Apesar de\nse opor à antecipação da revisão, Maciel defendeu a busca de acordo dos\ndiversos segmentos políticos que permitisse a aprovação imediata de\nemendas constitucionais por ele consideradas essenciais para o\ndesenvolvimento do país. Entre elas, destacava a necessidade de ajuste\nfiscal para superar a crise do Estado brasileiro e de maior abertura da\neconomia nacional, na sua opinião, excessivamente controlada por\nmonopólios e corporações.\n\nEm maio de 1992, o governo Collor foi abalado por denúncias feitas pelo\nirmão do presidente Pedro Collor de Melo, que apontavam a existência de\namplo esquema de corrupção e tráfico de influência no interior da\nadministração federal. Segundo a denúncia, o esquema era comandado pelo\nempresário Paulo César Farias, o PC, ex-tesoureiro de campanha de\nFernando Collor, e contava com a conivência do presidente da República.\nNo final daquele mês, diante da pressão dos partidos oposicionistas e de\namplos setores da imprensa e da opinião pública, instalou-se no\nCongresso uma comissão parlamentar de inquérito encarregada de apurar as\ndenúncias. Em agosto, quando o desgaste do presidente era evidente,\nMarco Maciel declarou sua “lealdade” a Collor, justificando sua posição\nem virtude da “responsabilidade funcional” que assumira como líder do\ngoverno. Declarou na ocasião estar ainda aguardando os resultados das\ninvestigações da CPI para se pronunciar sobre o assunto, mas acusou os\nintegrantes da comissão de tentar promover um julgamento político do\npresidente.\n\nTodavia, como a tese do *impeachment*presidencial ganhava terreno entre\nos próprios parlamentares de seu partido, propôs que o PFL não fechasse\nquestão sobre o assunto e permitisse que cada congressista se\nposicionasse de acordo com sua consciência. Logo em seguida, diante da\nevidente desagregação da base de sustentação política de Collor,\nencampou a proposta apresentada pelo senador Jorge Bornhausen, que\nconsistia numa saída negociada para a crise com a renúncia do presidente\napós a aprovação, pelo Congresso, dos projetos de modernização econômica\ndefendidos pelo presidente.\n\nO relatório final da CPI, apresentado no dia 29 de agosto, enquadrou o\npresidente por crime de responsabilidade sob a acusação de corrupção\npassiva e formação de quadrilha e sugeriu a sua cassação ao plenário da\nCâmara. No dia 1º de setembro, Marco Maciel demitiu-se da liderança do\ngoverno no Senado e, criticado por Collor, declarou-se impossibilitado\nde permanecer defendendo o governo por não ter recebido do palácio do\nPlanalto qualquer informação ou prova em contrário ao que tinha sido\napurado pela CPI. O pedido de abertura do processo de *impeachment*de\nCollor foi votado e aprovado na Câmara em 29 de setembro, com 441 votos\nfavoráveis e 38 contrários. Afastado da presidência após a votação na\nCâmara, Collor renunciou ao mandato em 29 de dezembro de 1992, pouco\nantes da conclusão do processo pelo Senado, que confirmou o\n*impeachment* e cassou seus direitos políticos por oito anos. O vice\nItamar Franco, que já vinha exercendo o cargo interinamente desde o dia\n2 de outubro, foi efetivado na presidência da República. Imediatamente,\nMaciel passou a defender o apoio do PFL ao novo governo.\n\nNo final de 1992, Maciel iniciou contatos para aglutinar líderes e\npersonalidades políticas em torno da campanha pela manutenção do sistema\nde governo presidencialista no plebiscito previsto para abril do ano\nseguinte. Nesse plebiscito, além do sistema de governo (parlamentarismo\nou presidencialismo), o eleitorado manifestaria sua preferência também\npela forma de governo (monarquia ou república) a ser adotada no país.\nEscolhido como coordenador da Frente Republicana Presidencialista,\nMaciel defendeu o modelo de presidencialismo previsto pela Constituição\nde 1988, que segundo ele garantia o equilíbrio entre os poderes.\nAdmitiu, porém, que aperfeiçoamentos poderiam ser adotados e sugeriu que\na indicação dos ministros pelo presidente da República tivesse,\nobrigatoriamente, a aprovação do Senado. Realizado o plebiscito, as\nopções pela república e pelo presidencialismo saíram vencedoras por\nampla margem de votos.\n\nNos meses seguintes, Maciel assumiu a defesa da revisão constitucional,\nprevista para se realizar a partir de outubro de 1993.\n\nEm fevereiro de 1994, propôs que o PFL abrisse mão de lançar candidato\npróprio às eleições presidenciais previstas para outubro daquele ano. Na\nocasião, propôs o lançamento de uma candidatura apoiada por amplos\nsegmentos políticos, entre os quais incluía o Partido Democrático\nTrabalhista (PDT), do governador fluminense Leonel Brizola. Na época, as\npesquisas eleitorais indicavam ampla vantagem do candidato do PT, Luís\nInácio Lula da Silva, na corrida presidencial. Após alguns meses de\nnegociações, o PFL, o Partido da Social Democracia Brasileira (PSDB) e o\nPartido Trabalhista Brasileiro (PTB) acertaram a composição de uma chapa\npara concorrer às eleições presidenciais, encabeçada por Fernando\nHenrique Cardoso, do PSDB, ministro da Economia do governo Itamar\nFranco. A gestão de Fernando Henrique à frente do ministério fora\nmarcada pela adoção de um bem-sucedido plano de controle da inflação, o\nPlano Real, que projetara seu nome como alternativa eleitoral.\n\nPelo acordo então firmado pelos três partidos, caberia ao PFL a\nindicação do nome do vice da chapa. Entre os nomes então cogitados para\no posto estava o de Marco Maciel, mas o PSDB inicialmente não aceitou\nsua indicação, temendo os efeitos que um nome tão ligado aos governos\nanteriores pudessem causar à campanha. A escolha do vice pefelista\nacabou recaindo então sobre o senador alagoano Guilherme Palmeira. Marco\nMaciel, um dos primeiros líderes de seu partido a defender o apoio do\nPFL ao nome de Fernando Henrique, integrou-se ao comando nacional da\ncampanha tucana.\n\nNo início de agosto, porém, quando o candidato do PSDB já assumia a\nprimeira colocação nas pesquisas de intenção de voto, o nome do senador\nGuilherme Palmeira foi atingido por denúncias que apontavam o\nenvolvimento de membros de seu gabinete num esquema de favorecimento a\numa empreiteira por meio de emendas ao Orçamento da União. Temendo\ndesgastes eleitorais, a direção do PSDB exigiu que o PFL rapidamente\nsubstituísse Palmeira. A cúpula pefelista indicou então o nome de Maciel\npara o cargo e o PSDB, que meses antes havia vetado seu nome, dessa vez\nacatou rapidamente a indicação, por temer que o prolongamento das\ndiscussões resultasse em prejuízos para a campanha de Fernando Henrique.\n\nA indicação de Maciel passou a ser imediatamente explorada pelo\nprincipal candidato adversário, Lula, que destacou a vinculação do\nsenador pernambucano com todos os governos da história recente do país e\nprocurou caracterizá-lo como representante político da elite brasileira.\nLula e seu comando de campanha destacaram que Maciel era o presidente da\nCâmara dos Deputados quando a Casa foi fechada pelo presidente Geisel em\nabril de 1977; e que sua colaboração com o regime militar se estendeu\npraticamente até o fim do governo Figueiredo, quando desempenhou papel\ndestacado nas articulações contrárias à aprovação das Diretas Já, em\n1984. O líder petista também enfatizou que Maciel fora líder de Collor\nno Senado até poucos dias antes da aprovação do *impeachment*\npresidencial, em 1992.\n\nAntecipando-se à possibilidade de crise em sua candidatura, Fernando\nHenrique declarou publicamente que a indicação de Maciel era\nresponsabilidade do PFL; caracterizando-a como decisão legítima e\nsoberana de um aliado político, à qual não cabia ao PSDB fazer reparos.\nPor precaução, porém, o comando da campanha tucana optou por não incluir\na presença de Maciel nos programas do horário eleitoral gratuito na\ntelevisão.\n\nDiante das críticas ao seu nome, Maciel defendeu-se afirmando que jamais\ncolaborara diretamente com o regime militar, visto não ter ocupado\nqualquer cargo no Executivo federal durante aqueles governos. Afirmou\nainda que lutara para que o “recesso” do Congresso no governo Geisel\nfosse o mais breve possível e que fora um dos principais articuladores\nda candidatura presidencial de Tancredo Neves. Realizadas as eleições em\noutubro, a chapa Fernando Henrique-Marco Maciel recebeu 34.362.726\nvotos, mais da metade do total dos votos válidos, o que lhe garantiu a\nvitória já no primeiro turno.\n\nLogo após a confirmação da vitória, Maciel declarou que caberia ao\ngoverno de Fernando Henrique promover o “resgate da dívida social\nbrasileira”, tarefa para a qual, segundo o novo vice-presidente, o PFL\nnão seria um obstáculo. Ao contrário, o partido desempenhara papel de\nrelevo na formulação do programa de governo do candidato tucano, além de\nter oferecido ao novo presidente sólida base parlamentar. Maciel\ndefendeu ainda o entendimento entre as forças políticas para viabilizar\numa reforma fiscal e chamou a atenção para a necessidade de realizar\nreforma política e eleitoral no país para fortalecer os partidos e\ncorrigir as distorções existentes na representação dos estados no\nCongresso. Manifestou-se ainda contrário à aprovação da reeleição para\ncargos executivos, afirmando não haver no país uma “cultura da\nreeleição”. Seu discurso de despedida do Senado, proferido em dezembro\ndaquele ano, teve como tema central a defesa da necessidade de reformas\npolíticas e econômicas no país. Assumiu sua vaga no Senado Joel de\nHolanda.\n\nEm 1º de janeiro de 1995, Maciel tomou posse como vice-presidente da\nRepública. No exercício do cargo, manteve seu prestígio como negociador\npolítico, a um só tempo discreto e influente. Com bom trânsito no\nCongresso Nacional, foi designado pelo presidente Fernando Henrique como\n“articulador político do governo”, função até então tradicionalmente\nexercida no país pelo chefe do Gabinete Civil. Dessa forma, coube a\nMaciel coordenar as negociações em torno da aprovação das reformas\nconstitucionais defendidas pelo novo governo, entre as quais se\ndestacavam as reformas administrativa e fiscal voltada para o controle\ndo déficit público, a reforma da previdência social, a quebra do\nmonopólio estatal sobre o petróleo e as telecomunicações, o fim da\nestabilidade para os servidores públicos e a extinção dos obstáculos à\natuação de empresas estrangeiras no país.\n\nEm janeiro de 1996, criticou publicamente o envolvimento de ministros\nnas eleições municipais previstas para outubro daquele ano, receando\npossíveis abalos na base de sustentação do governo federal. Ao mesmo\ntempo, voltou a criticar a reeleição para a Presidência da República e\ndemais cargos executivos, tese que então ganhava força nos\npronunciamentos de destacados líderes governistas. Ainda em junho\ndaquele ano, entrou em atrito com o ministro das Comunicações, Sérgio\nMota, um dos mais entusiasmados defensores da aprovação da emenda\nconstitucional que abriria caminho a um possível segundo mandato\npresidencial consecutivo de Fernando Henrique. Dois meses depois, porém,\nacompanhando a mudança de posicionamento de seu partido, Maciel aderiu à\ntese da reeleição, tornando-se um dos principais defensores de sua\naprovação no Congresso, afinal efetivada.\n\nMaciel teve seu nome confirmado como candidato a vice na chapa de\nFernando Henrique Cardoso nas eleições presidenciais de outubro de 1998.\nA reeleição do presidente foi, então, defendida pelos mesmos partidos\nque o apoiaram no pleito anterior e teve ainda a adesão do Partido\nProgressista Brasileiro (PPB), liderado pelo ex-governador paulista\nPaulo Maluf.\n\nRealizado o pleito, a chapa Fernando Henrique/Marco Maciel venceu a\ndisputa novamente no primeiro turno, com 53% dos votos válidos,\nderrotando, mais uma vez, Luís Inácio Lula da Silva, candidato de uma\ncoligação de esquerda comandada pelo PT.\n\nEm 1º de janeiro de 1999, Marco Maciel iniciou seu segundo mandato como\nvice-presidente da República, tendo como principal bandeira a urgente\nnecessidade de iniciar uma ampla reforma política no país, que deveria\nir além de mudanças na legislação eleitoral e partidária e discutir o\ncaráter das instituições republicanas brasileiras.\n\nEm 2002, apoiou a candidatura de José Serra (PSDB) à presidência da\nRepública e foi autor de uma proposta que levou o partido a aprovar uma\nresolução que recomendava que os diretórios estaduais do PFL apoiassem o\ncandidato tucano no segundo turno, que disputou com Lula. Com a vitória\nde Lula que derrotou Serra, o PFL assumiu o exercício da oposição e, em\nentrevista a imprensa, afirmou que o novo presidente herdaria um país\ncom todas as condições de crescimento em 2003. Na mesma eleição, foi\neleito senador pelo estado de Pernambuco, na legenda do PFLpara a. Em 1º\ndejaneiro de 2003, deixou a vice-presidência da República e, no mês\nseguinte, assumiu sua vaga no Senado. Nesta legislatura, foi titular das\nComissões do Senado de Reforma do Regimento Interno; de Reforma do\nCódigo de Processo Penal; do Conselho do Diploma da Mulher-Cidadã Berta\nLutz; da Comissão Mista Permanente sobre Mudanças Climáticas; da\nComissão de Relações Exteriores e Defesa Nacional; da Comissão de\nEducação, Cultura e Esporte; da Comissão de Desenvolvimento Regional e\nTurismo; da Comissão de Constituição, Justiça e Cidadania; da Comissão\nEspecial de Reforma do Regimento Interno; da Comissão Especial do Ano da\nMulher Latino-Americana; e da Comissão de Acompanhamento da Crise\nFinanceira e da Empregabilidade.\n\nEm maio de 2005, com a eclosão do “escândalo do mensalão” - esquema de\ncompra de votos de parlamentares da base aliada do governo Lula para que\neles aprovassem as matérias de interesse do governo.. Diante da crise,\nMaciel afirmava que aquela poderia ser uma boa oportunidade para\nmodificar seu sistema partidário, fortalecendo mais as legendas em\ndetrimento dos candidatos. Favorável à realização de investigações do\nenvolvimento de parlamentares membros do partido governista e do próprio\npresidente em escândalos de corrupção e à adoção de medidas legais\ncontra os acusados, mostrou-se refratário aos rumores de *impeachment*do\npresidente Lula, considerando que tal medida poderia afetar\nnegativamente o país.\n\nEm 2007, Marco Maciel foi uma das vozes a favor da renúncia ou cassação\ndo mandato do presidente do Senado, o peemedebista Renan Calheiros, que\na partir de 25 de maio daquele ano teve seu nome envolvido em denúncias\nde corrupção, após virem a público as relações que mantinha com lobistas\nde empreiteiras. Ainda em 2007, filiou-se ao Democratas (DEM), criado a\npartir da refundação do PFL.\n\nEm outubro, o Senado encaminhou o texto da Proposta de Emenda\nConstitucional (PEC) que prorrogava a cobrança da Contribuição\nProvisória sobre Movimentação Financeira (CPMF) até 2011 à Comissão de\nConstituição e Justiça (CCJ), presidida por Marco Maciel, para que a\ncomissão avaliasse a admissibilidade constitucional do texto. Pela\nConstituição Federal, a vigência da cobrança da CPMF acabaria em 31 de\ndezembro daquele ano e, por esse motivo o governo tinha pressa para\naprovar a proposta, que precisaria passar por dois turnos de votação no\nSenado. Na ocasião, declarou que o DEM era contra a continuidade do\ntributo. Ao ser questionado quanto a uma possível contradição da\noposição, que no governo do presidente Fernando Henrique Cardoso\ndefendia a manutenção da CPMF assim como o governo atual, respondeu que\nas condições eram diferentes, e que a partir do Plano Real o país\ncomeçou a conquistar estabilidade econômica por meio de uma série de\nreformas e que isso tornava possível a redução da carga tributária. Em\ndezembro, por 45 votos a 34, a prorrogação da CPMF foi rejeitada pelo\nSenado.\n\nMarco Maciel foi fundador e primeiro presidente da Fundação de Estudos\nPolíticos e Econômicos Mílton Campos, órgão de pesquisa da Arena e do\nPDS. Membro do Instituto Histórico e Geográfico Brasileiro (IHGB) e da\nAcademia da Brasileira de Letras, onde ocupa a cadeira 39.\n\nCasou-se com Ana Maria Ferreira Maciel, com quem teve três filhos.\n\nPublicou *Algumas co**nsiderações sobre* *organizações internacionais —\na ONU*(1970), *Missão do político*(1970) e *Vocação e compromisso*(1982)\n\n \n\nMaria Carmina Monteiro/André Coutoatualização\n\n \n\nFONTES: CÂM. DEP. *Deputados brasileiros. Repertório* (1971-1975 e\n1975-1979); *Estado de S.**Paulo* (10/8/82, 26/2, 4 e 8/8/94,\n11/6/96);*Folha de S. Paulo* (4/4; 8/9/91, 17/8 e 1/9/92, 24/1 e\n18/6/93, 4/8/94, 27 e 28/1 e 21/8/96); *Globo* (9 e 11/2/91, 2 e 5/9 e\n6/10/92, 1/2, 3 e 4/8 e 25/11/94, 27/1e 24/9/96); *Jornal do Brasil*\n(27/2 e 2/4/77, 22/4 e 5/5/87, 13/11/92, 24/4/93, 3, 4 e 6/8, 9 e 23/10\ne 13 e 22/12/94); NÉRI, S. *16;* *Perfil*(1972); PORTAL AGÊNCIA DO\nSENADO (13/12/2007; disponível em:\n[http://www.senado.gov.br/agencia/verNoticia.aspx?codNoticia=70420&codAplicativo=2](http://www.senado.gov.br/agencia/verNoticia.aspx?codNoticia=70420&codAplicativo=2);\nacesso em: 22/2/2009); PORTAL DIREITO 2 (4/11/1998; Disponível em:\n[http://proc.direito2.com.br/asen/1998/nov/4/joel-de-hollanda-destaca-entrevista-de-marco-maciel](http://proc.direito2.com.br/asen/1998/nov/4/joel-de-hollanda-destaca-entrevista-de-marco-maciel);\nacesso em: 22/02/2009); PORTAL G1 (27/10/2002; disponível em:\n[http://64.233.163.132/search?q=cache:JGDQUCAXygcJ:cbn.globoradio.globo.com/grandescoberturas/ELEICOES-PRESIDENCIAIS-2002.htm+Marco+Maciel%2B+elei%C3%A7%C3%A3o+Lula+2002&cd=1&hl=pt-BR&ct=clnk&gl=br](http://64.233.163.132/search?q=cache:JGDQUCAXygcJ:cbn.globoradio.globo.com/grandescoberturas/ELEICOES-PRESIDENCIAIS-2002.htm+Marco+Maciel%2B+elei%C3%A7%C3%A3o+Lula+2002&cd=1&hl=pt-BR&ct=clnk&gl=br);\nacesso em: 22/10/2010); (11/10/2007; disponível em:\n[http://www.direito2.com.br/asen/2007/out/11/marco-maciel-confirma-a-indicacao-de-katia-abreu-para-relatar-cpmf](http://www.direito2.com.br/asen/2007/out/11/marco-maciel-confirma-a-indicacao-de-katia-abreu-para-relatar-cpmf);\nacesso em: 22/02/2009); SENADO FEDERAL. *Biografia de\nSenadores*(disponível em:\nhttp://www.senado.gov.br/sf/SENADORES/senadores\\_institucional.asp?leg=a&codparl=86;\nacessado em:5/10/2009).\n\n \n","ref":"FONTES: CÂM. DEP. *Deputados brasileiros. Repertório* (1971-1975 e\n1975-1979); *Estado de S.**Paulo* (10/8/82, 26/2, 4 e 8/8/94,\n11/6/96);*Folha de S. Paulo* (4/4; 8/9/91, 17/8 e 1/9/92, 24/1 e\n18/6/93, 4/8/94, 27 e 28/1 e 21/8/96); *Globo* (9 e 11/2/91, 2 e 5/9 e\n6/10/92, 1/2, 3 e 4/8 e 25/11/94, 27/1e 24/9/96); *Jornal do Brasil*\n(27/2 e 2/4/77, 22/4 e 5/5/87, 13/11/92, 24/4/93, 3, 4 e 6/8, 9 e 23/10\ne 13 e 22/12/94); NÉRI, S. *16;* *Perfil*(1972); PORTAL AGÊNCIA DO\nSENADO (13/12/2007; disponível em:\n[http://www.senado.gov.br/agencia/verNoticia.aspx?codNoticia=70420&codAplicativo=2](http://www.senado.gov.br/agencia/verNoticia.aspx?codNoticia=70420&codAplicativo=2);\nacesso em: 22/2/2009); PORTAL DIREITO 2 (4/11/1998; Disponível em:\n[http://proc.direito2.com.br/asen/1998/nov/4/joel-de-hollanda-destaca-entrevista-de-marco-maciel](http://proc.direito2.com.br/asen/1998/nov/4/joel-de-hollanda-destaca-entrevista-de-marco-maciel);\nacesso em: 22/02/2009); PORTAL G1 (27/10/2002; disponível em:\n[http://64.233.163.132/search?q=cache:JGDQUCAXygcJ:cbn.globoradio.globo.com/grandescoberturas/ELEICOES-PRESIDENCIAIS-2002.htm+Marco+Maciel%2B+elei%C3%A7%C3%A3o+Lula+2002&cd=1&hl=pt-BR&ct=clnk&gl=br](http://64.233.163.132/search?q=cache:JGDQUCAXygcJ:cbn.globoradio.globo.com/grandescoberturas/ELEICOES-PRESIDENCIAIS-2002.htm+Marco+Maciel%2B+elei%C3%A7%C3%A3o+Lula+2002&cd=1&hl=pt-BR&ct=clnk&gl=br);\nacesso em: 22/10/2010); (11/10/2007; disponível em:\n[http://www.direito2.com.br/asen/2007/out/11/marco-maciel-confirma-a-indicacao-de-katia-abreu-para-relatar-cpmf](http://www.direito2.com.br/asen/2007/out/11/marco-maciel-confirma-a-indicacao-de-katia-abreu-para-relatar-cpmf);\nacesso em: 22/02/2009); SENADO FEDERAL. *Biografia de\nSenadores*(disponível em:\nhttp://www.senado.gov.br/sf/SENADORES/senadores\\_institucional.asp?leg=a&codparl=86;\nacessado em:5/10/2009).\n\n \n","dic":"DHBB"}
