{"title":"MACIEL, Paulo","cargoss":["Deputado federal"],"cargos_esp":[0],"datas_ini":[1967],"datas_fim":[1971],"estados":["PE"],"autor":[0],"content":"**MACIEL, Paulo**\n\n\\*dep. fed. PE 1967-1971.\n\n \n\n*Paulo Frederico do Rego Maciel* nasceu em Recife no dia 15 de abril de\n1924, filho de Frederico do Rego Maciel Filho e de Maria d’Anunciação\nMaia Maciel.\n\nBacharelou-se em 1946 pela Faculdade de Direito de Recife e em 1954\nfreqüentou o curso da Faculdade de Direito e Ciências Econômicas de\nParis.\n\nDurante o governo de Cid Sampaio (1959-1962) ocupou a Secretaria de\nFinanças de Pernambuco. Após o movimento político-militar de 31 de março\nde 1964, foi nomeado em maio seguinte pelo presidente Humberto Castelo\nBranco para a presidência do Instituto do Açúcar e do Álcool (IAA).\nDurante sua administração foi responsável, entre outras medidas, pelo\nestabelecimento de cotas mensais de comercialização para as usinas e\npelo decreto, baixado em outubro de 1965, que dispôs sobre a concessão\nde terras ao trabalhador rural da lavoura canavieira com mais de um ano\nde serviço contínuo na mesma empresa.\n\nEm junho de 1966 deixou a presidência do IAA para candidatar-se a\ndeputado federal por seu estado. Eleito em novembro desse mesmo ano na\nlegenda da Aliança Renovadora Nacional (Arena), assumiu o mandato em\nfevereiro do ano seguinte e, nessa legislatura, integrou na Câmara as\ncomissões de Agricultura e Política Rural e de Economia, da qual foi\nvice-presidente. Concluiu o mandato em janeiro de 1971, não mais\nvoltando à Câmara dos Deputados. Em 1974 teve seu nome indicado pelo\nex-governador Cid Sampaio como candidato à eleição indireta para a\nsucessão do governador Eraldo Gueiros. No entanto, foi derrotado na\nconvenção da Arena por José Francisco de Moura Cavalcanti, que tomou\nposse em março de 1975.\n\nFoi ainda professor de sociologia na Faculdade de Filosofia de Recife,\nprofessor-assistente de economia internacional na Escola de Ciências\nEconômicas da Universidade de Recife e de técnicas de pesquisa social na\nEscola de Serviço Social de Pernambuco, e diretor do Instituto Joaquim\nNabuco de Pesquisas Sociais, também em Recife. Presidente do Banco do\nEstado de Pernambuco e da delegação brasileira à Conferência\nInternacional dos Dirigentes Açucareiros, realizada em Washington, atuou\ntambém como consultor econômico da Federação das Indústrias do Estado de\nPernambuco.\n\nCasou-se com Telma de Sousa Maciel.\n\nPublicou *Personalidade e sociedade*(1946), *Sobre a situação do crédito\nbancário em Pernambuco*(1961),*Migrações para o Recife aspectos\neconômico-sociais do setor açucareiro*(1962) e *Análise econômica e\ndemográfica* *de um município.*\n\n \n\nFONTES: CÂM. DEP. *Deputados;*CÂM. DEP. *Deputados brasileiros.\nRepertório*(1967-1971); NÉRI, S*. 16*; OLIVEIRA, H. *Presidentes; Who’s\nwho* *in Brazilian.*\n\n \n","ref":"FONTES: CÂM. DEP. *Deputados;*CÂM. DEP. *Deputados brasileiros.\nRepertório*(1967-1971); NÉRI, S*. 16*; OLIVEIRA, H. *Presidentes; Who’s\nwho* *in Brazilian.*\n\n \n","dic":"DHBB"}
