{"title":"MAGALHÃES, Diógenes","cargoss":["Constituinte","Deputado federal"],"cargos_esp":[0,0],"datas_ini":[1946,1946],"datas_fim":[1946,1951],"estados":[0,"GO"],"autor":[0],"content":"**MAGALHÃES, Diógenes**\n\n\\*const. 1946; dep. fed. GO 1946-1951.\n\n \n\n*Diógenes Magalhães da Silveira*nasceu em Minas Gerais. Seu cunhado,\nPedro Ludovico, foi interventor federal e governador de Goiás de 1930 a\n1945 e de 1950 a 1954.\n\nFormou-se pela Faculdade de Medicina de Belo Horizonte.\n\nEm dezembro de 1945, foi eleito deputado por Goiás à Assembléia Nacional\nConstituinte na legenda do Partido Social Democrático (PSD). Assumiu sua\ncadeira em fevereiro do ano seguinte, participando dos trabalhos\nconstituintes. Com a promulgação da nova Carta em setembro de 1946,\nexerceu o mandato ordinário até janeiro de 1951, quando deixou a Câmara.\nNessa legislatura defendeu a mudança da capital federal para Goiânia.\n\nFaleceu em Goiânia no mês de janeiro de 1981.\n\nFoi casado com Maria Borges Magalhães, filha do senador goiano Antônio\nMartins Borges, conhecido como Totônio Borges, político influente em seu\nestado.\n\n \n\n \n\nFONTES: CÂM. DEP. Deputados; CÂM. DEP. Relação dos dep.; Grande encic.\nDelta; Jornal do Brasil (15/2/81); SILVA, G. Constituinte; TRIB. SUP.\nELEIT. Dados (1).\n\n \n","ref":"FONTES: CÂM. DEP. Deputados; CÂM. DEP. Relação dos dep.; Grande encic.\nDelta; Jornal do Brasil (15/2/81); SILVA, G. Constituinte; TRIB. SUP.\nELEIT. Dados (1).\n\n \n","dic":"DHBB"}
