{"title":"MAGALHÃES, Joaquim Pimenta de","cargoss":["Revolucionário ou revoltoso","Constituinte"],"cargos_esp":[0,0],"datas_ini":[1930,1934],"datas_fim":[1930,1934],"estados":[0,0],"autor":[0],"content":"**MAGALHÃES, Joaquim Pimenta de**\n\n\\*rev. 1930; const. 1934.\n\n*Joaquim Pimenta de Magalhães* nasceu em Belém no dia 25 de dezembro de\n1885, filho de José Joaquim Pimenta de Magalhães e de Isabel de Oliveira\nMagalhães.\n\nFez seus estudos no Colégio da Imaculada Conceição e no Ateneu Paraense,\nambos em Belém, no Salesiano Santa Rosa, em Niterói, e no Colégio\nAlfredo Gomes, no Rio de janeiro, então Distrito Federal. Formou-se pela\nFaculdade de Medicina do Rio de Janeiro em 1912.\n\nIniciou suas atividades políticas ainda como estudante de medicina,\nparticipando da Campanha Civilista, movimento que promoveu, entre 1909 e\n1910, a candidatura de Rui Barbosa à presidência da República, em\noposição à do marechal Hermes da Fonseca, afinal vitoriosa. Mais tarde\nintegrou, ainda sem compromisso partidário, o movimento conhecido como\nReação Republicana, que entre 1921 e 1922 apoiou a candidatura de Nilo\nPeçanha à presidência da República, em oposição à de Artur Bernardes. A\nReação Republicana foi derrotada nas urnas.\n\nEm 1930, tomou parte ativa em toda a campanha da Aliança Liberal,\nmovimento que lançou a candidatura de Getúlio Vargas à presidência da\nRepública, em oposição ao situacionista Júlio Prestes. Derrotada no\npleito de 1º de março de 1930, a Aliança Liberal passou a articular um\nmovimento armado destinado a depor o presidente Washington Luís. Joaquim\nPimenta de Magalhães foi designado pelo capitão Eurico de Castilho\nFrança, chefe militar da rebelião no Pará, para tomar de assalto a\nInspetoria da Alfândega em Belém e aprisionar a força ali destacada, e\nainda ocupar a Companhia Telefônica, o que asseguraria o controle do\nestado. Entretanto, devido a uma denúncia levada ao governador Eurico\nVale, fiel ao presidente da República, a ação fracassou e ocorreram\ndiversas prisões de civis conspiradores. Também não logrou êxito o\nprimeiro ataque ao 26º Batalhão de Caçadores, morrendo durante o assalto\no comandante Castilho França. No dia 6 de outubro, contudo, essa unidade\nmilitar foi tomada pelos rebeldes. Ainda assim, Eurico Vale manteve-se\nno governo do estado até a deposição de Washington Luís, em 24 de\noutubro.\n\nNo período imediatamente posterior à vitória do movimento\nrevolucionário, Joaquim Pimenta de Magalhães foi o primeiro diretor da\nSaúde Pública em seu estado, nomeado pela junta governativa provisória\ndo Pará. Em 1931, quando o interventor Joaquim de Magalhães Barata criou\na Secretaria de Educação e Saúde Pública do Pará, foi designado para\nocupar o cargo de diretor de Saúde desse órgão. No ano seguinte,\ncombateu em Belém os revoltosos que apoiavam o movimento\nconstitucionalista de São Paulo.\n\nEm 1933 foi designado pelo diretório do Partido Liberal do Pará, ao qual\nera filiado, para representar as forças políticas do estado no Congresso\ndos Interventores e Partidos Políticos do Norte, realizado em Recife. Em\nmaio do mesmo ano, elegeu-se deputado à Assembléia Nacional\nConstituinte, assumindo sua cadeira em novembro de 1933 e participando\ndos trabalhos de elaboração da nova Carta. Deixou a Câmara em maio de\n1935, quando terminou a prorrogação dos mandatos dos constituintes e\ntomaram assento os deputados eleitos em outubro anterior.\n\nFoi vice-presidente do Sindicato Médico Paraense, médico adjunto do\nPavilhão da Infância da Santa Casa da Misericórdia, sócio da Sociedade\nMédico-Cirúrgica do Pará, membro do conselho técnico da Liga contra a\nLepra, inspetor sanitário municipal de Belém e em diversas ocasiões\ndiretor interino desse serviço.\n\nCasou-se com Marina Lameira Bittencourt de Magalhães, com quem teve uma\nfilha.\n\nEscreveu *Do estudo médico-legal dos crimes passionais*(tese de\ndoutoramento) e publicou *Medicina legal.*\n\nFONTES: ASSEMB. NAC. CONST. 1934. *Anais*(1);**CÂM. DEP. *Deputados;\nCâm. Dep.* *seus componentes;*GODINHO, V. *Constituintes;\nPersonalidades;*ROQUE, C. *Grande.*\n\n \n","ref":"FONTES: ASSEMB. NAC. CONST. 1934. *Anais*(1);**CÂM. DEP. *Deputados;\nCâm. Dep.* *seus componentes;*GODINHO, V. *Constituintes;\nPersonalidades;*ROQUE, C. *Grande.*\n\n \n","dic":"DHBB"}
