{"title":"MAGALHÃES, Juraci","cargoss":["Revolucionário ou revoltoso","Interventor","Governador de estado ou do Distrito Federal","Constituinte","Deputado federal","Presidente de associação ou confederação de empregados ou empregadores","Senador","Governador de estado ou do Distrito Federal","Embaixador do Brasil - EUA","Ministro da Justiça","Ministro das Relações Exteriores"],"cargos_esp":[0,0,0,0,0,"Petrobras",0,0,0,0,0],"datas_ini":[1930,1931,1935,1946,1946,1954,1955,1959,1964,1965,1966],"datas_fim":[1930,1935,1937,1946,1951,1954,1959,1963,1965,1966,1967],"estados":[0,"BA","BA",0,"BA",0,"BA","BA",0,0,0],"autor":[0],"content":"**MAGALHÃES, Juraci**\n\n\\*militar; rev. 1930; interv. BA 1931-1935; gov. BA 1935-1937; const.\n1946; dep. fed. BA 1946-1951; pres. Petrobras 1954; sen. BA 1955-1959;\ngov. BA 1959-1963; emb. Bras. EUA 1964-1965; min. Just. 1965-1966; min.\nRel. Ext. 1966-1967.\n\n \n\n*Juraci Montenegro Magalhães* nasceu em Fortaleza no dia 4 de agosto de\n1905, filho do contador Joaquim Magalhães e de Júlia Montenegro\nMagalhães.\n\nCursou o primário no Colégio Sagrado Coração de Jesus entre 1912 e 1917\ne o secundário no Liceu do Ceará, entre 1918 e 1922, ambas as escolas em\nFortaleza. Em julho de 1922 sentou praça no 23º Batalhão de Caçadores\n(23º BC), na capital cearense, e em fevereiro do ano seguinte partiu\npara o Rio de Janeiro, então Distrito Federal, onde ingressou na Escola\nMilitar do Realengo. Saiu aspirante-a-oficial da arma de cavalaria em\njaneiro de 1927, sendo logo em seguida designado para o 23º BC, em sua\nterra natal.\n\n \n\nNo tenentismo\n\nEntusiasta do movimento tenentista surgido na década de 1920, Juraci\nMagalhães integrou-se na sua rede conspirativa, servindo como ponto de\napoio para oficiais foragidos que percorriam o Nordeste levando\nmensagens de Juarez Távora e Luís Carlos Prestes. Em entrevista\nconcedida ao Centro de Pesquisa e Documentação de História Contemporânea\ndo Brasil (Cpdoc), esclareceu que foi escolhido pelos colegas aspirantes\n(Jurandir de Bizarria Mamede e Landri Sales, entre outros) para liderar\no movimento revolucionário no Ceará por não existirem entre os oficiais\nsuperiores adeptos da revolução.\n\nPromovido a segundo-tenente em julho de 1927, foi em seguida transferido\npara o 1º Regimento de Infantaria (1º RI) conhecido como Regimento\nSampaio, na Vila Militar do Rio de Janeiro. Por essa época conheceu\nJuarez Távora que, foragido da prisão, estava escondido na casa de Silo\nMeireles. Sempre no Regimento Sampaio, passou a comandante de companhia\ne em julho de 1929 foi promovido a primeiro-tenente.\n\nAinda em julho de 1929, a comissão executiva do Partido Republicano\nMineiro (PRM) lançou a candidatura do presidente do Rio Grande do Sul,\nGetúlio Vargas, e do presidente da Paraíba, João Pessoa, respectivamente\nà presidência e vice-presidência da República. Essas candidaturas,\napoiadas pela chamada Aliança Liberal, opunham-se à candidatura oficial\nde Júlio Prestes, presidente de São Paulo.\n\nEm fevereiro de 1930, no mesmo mês em que irrompeu no município de\nPrincesa, atual Princesa Isabel, na Paraíba, um movimento rebelde em\noposição ao governo de João Pessoa, Juraci foi designado, juntamente com\nJurandir Mamede, Paulo Cordeiro de Melo e Agildo Barata, para o 22º BC,\nnaquele estado, sob o comando do coronel Maurício Cardoso. Antes de\nviajar para a Paraíba, esteve com Juarez, na ocasião preso na fortaleza\nde Santa Cruz, que considerou providencial sua ida para o Nordeste, já\nque pretendia dirigir-se para aquela região após a fuga que estava\nplanejando.\n\nNa Paraíba, Juraci dividiu uma casa com seus colegas Mamede e Humberto\nde Moura Ferreira e efetivamente hospedou Juarez depois que este fugiu\nda prisão nos últimos dias de fevereiro de 1930. Nessa época Juarez\nrecebeu uma carta de Prestes, exilado em Buenos Aires, comunicando seu\ndesligamento do movimento conspirativo em curso e a adesão a um projeto\nde revolução agrária e antiimperialista. Após consultar outros líderes,\ncomo Pedro Aurélio de Góis Monteiro, Osvaldo Aranha e João Alberto Lins\nde Barros, Juarez decidiu pela continuação da conspiração\nrevolucionária, designando o secretário do Interior do governo da\nParaíba, José Américo de Almeida, chefe civil da revolução no estado, e\nnomeando Juraci seu lugar-tenente. Pouco depois, em função de uma\ndenúncia, Juraci e Mamede foram acusados de ocultar Juarez em sua\nresidência e a polícia procedeu a uma investigação, não encontrando,\nporém, o fugitivo, que conseguiu escapar auxiliado por Antenor Navarro.\n\n \n\nNa Revolução de 1930\n\nA vitória de Júlio Prestes nas eleições de 1º de março de 1930 levou a\numa divergência entre os integrantes da Aliança Liberal a respeito da\noportunidade de se organizar um levante armado. Os adeptos da revolução\nno meio militar, no entanto, não se deixaram impressionar com a derrota\nde Getúlio Vargas. Segundo Juraci, os “tenentes” não estavam muito\ninteressados no resultado das urnas: “Sabíamos que tudo não passava de\numa farsa... Queríamos a revolução mesmo, em termos militares. E não\ntínhamos Vargas como um revolucionário, mas como um acomodado.”\n\nDepois do assassinato de João Pessoa, ocorrido em Recife no dia 26 de\njulho, os preparativos para o levante foram intensificados e as forças\npolíticas de oposição se unificaram em torno desse objetivo. Responsável\npelo Norte e Nordeste, Juarez foi incumbido de escolher a data do\nlevante em função das possibilidades da 22º BC, principal ponto de apoio\ndo movimento na região. Juarez fixou a madrugada de 4 de outubro, quando\nestava previsto que Agildo Barata estaria servindo como oficial-de-dia e\nJuraci Magalhães como comandante interino da companhia, que seria\ncolocada em prontidão. No dia 3 de outubro, Juraci procurou o tenente\nAfonso de Albuquerque Lima, que estava a bordo de um navio com destino\nao Norte, expôs-lhe a situação e convenceu-o a desembarcar para\nparticipar do levante.\n\nA revolução foi deflagrada no Sul às 17 horas do dia 3, antes do horário\ndefinido para sua eclosão no Nordeste, devido a um erro de interpretação\ndo telegrama que Juarez havia enviado a Osvaldo Aranha. A partir daí, o\ngoverno federal alertou as principais unidades do Norte do país, mas o\ntelegrama enviado ao general Alberto Lavenère Wanderley — comandante da\n7ª Região Militar (7ª RM), sediada em Recife, que instalara seu posto do\ncomando no 22º BC — foi interceptado por Agildo Barata. Os\nrevolucionários deram então início ao movimento, tomando o 22º BC depois\nde um tiroteio que resultou na morte do general Lavenère. Acusado de\nhaver alvejado o general, Juraci defendeu-se alegando que a bala que o\nhavia atingido partira de um soldado não-identificado.\n\nDevido ao insucesso do movimento em Recife, partiram da Paraíba para\naquela cidade três destacamentos, comandados respectivamente por Agildo\nBarata, Paulo Cordeiro de Melo e Anacleto Tavares. No destacamento\ncomandado por este último estava integrado Juraci. No dia 5 de outubro\nessas tropas entraram em Recife, e Juraci, na qualidade de representante\nde Juarez Távora, empossou no governo do estado de Pernambuco Carlos de\nLima Cavalcanti.\n\nNo dia 9 de outubro, comandando a Brigada Leste, Juraci partiu com\ndestino a Aracaju, onde chegou no dia 13. Dois dias depois marchou em\ndireção a Salvador. Após atravessar o nordeste baiano, no dia 24 de\noutubro a brigada chegou a Alagoinhas, já no Recôncavo, onde seus 6.500\nhomens encontraram forte resistência. Segundo informações de Juraci, os\nrevolucionários chegaram a preparar um ataque às forças legalistas\nsediadas em Salvador, mas o confronto não se concretizou devido à\ndeposição de Washington Luís naquele mesmo dia.\n\nEm 26 de outubro, Juarez entrou em Salvador, nomeando como interventor\nno estado Leopoldo Amaral, cuja posse se deu a 1º de novembro. Ainda em\nnovembro, em companhia de Juarez e José Américo, Juraci viajou para o\nRio, onde deu entrevista à imprensa e foi apresentado ao chefe do\nGoverno Provisório, Getúlio Vargas. Regressando dias depois à Paraíba\npara reassumir seu posto no 22º BC, foi logo em seguida convidado por\nJuarez para fixar-se no Rio, com a função de oficial de ligação entre o\nExército e a Marinha, ficando a partir de maio de 1931 à disposição\ndessa última corporação. Ainda por essa época viajou a Porto Alegre, a\nconvite de Osvaldo Aranha, com o objetivo de desfazer a má impressão que\nos gaúchos tinham dos “tenentes” em geral. Nessa ocasião, segundo o\npróprio Juraci, teria ocorrido seu lançamento político.\n\n \n\nInterventor na Bahia\n\nArtur Neiva, que substituíra Leopoldo Amaral como interventor na Bahia\nem fevereiro de 1931, também não se manteve muito tempo no cargo. A\noligarquia local resistia à proposta de renovação política trazida pela\nrevolução, o que exigia da interventoria grande habilidade na condução\nda política estadual e no relacionamento com o poder central. Pouco\nafeito à atividade política, Neiva acabou deixando a interventoria em\nagosto de 1931, sendo substituído interinamente pelo comandante da 6ª\nRM, general Raimundo Rodrigues Barbosa. Por sugestão de Juarez, o nome\nde Juraci foi indicado para o cargo, numa lista da qual também faziam\nparte Jurandir Mamede e Landri Sales, e que foi enviada a Vargas.\nEscolhido pelo presidente após a consulta a Juarez, Juraci escreveu a\nVargas aceitando o cargo, no qual tomou posse no dia 21 de setembro de\n1931.\n\nAo assumir a interventoria, Juraci deparou-se com uma situação bastante\ndelicada. A revolução tinha poucos adeptos no estado, sendo apoiada\napenas por um pequeno grupo de jovens estudantes reunidos no Partido\nUniversitário da Bahia, que tinham como patrono o septuagenário José\nJoaquim Seabra, antigo chefe do Partido Republicano Democrata. Seabra,\nno entanto, esperava ser nomeado interventor e, ao ver frustrada essa\nexpectativa, passou a fazer oposição a Juraci, que já tinha contra si o\nmaior partido do estado, o Partido Republicano da Bahia, contrário à\nrevolução. A oposição reivindicava um interventor baiano e civil,\ncombatendo Juraci que era cearense e militar. Nesse quadro, Juraci\niniciou seu governo tentando articular-se politicamente com alguns\ngrupos ligados à antiga oligarquia e com os jovens políticos que haviam\naderido à revolução.\n\nA partir de 1932, quando se desencadeou a campanha pela\nconstitucionalização do país, com base principalmente em São Paulo, os\nestudantes baianos promoveram atos de solidariedade aos paulistas que\nculminaram com o movimento conhecido como o 22 de Agosto. Esse movimento\nconsistiu num protesto contra o interventor e contra o Governo\nProvisório, realizado dentro da Faculdade de Medicina com a participação\ndos professores. Juraci deu ordens à polícia para cercar e invadir a\nfaculdade, sendo presos na ocasião mais de quinhentos estudantes. O\nmovimento constitucionalista acirrou as tensões políticas na Bahia,\ndeterminando uma definição mais nítida entre situação e oposição.\n\nAo final de 1932, já se preparando para as eleições à Assembléia\nNacional Constituinte, Juraci iniciou as articulações para a organização\nde um novo partido. Diante das dificuldades encontradas para solidificar\nbases de apoio mais amplas em Salvador, estabeleceu alianças políticas\ncom os “coronéis” do interior, em particular com os do vale do São\nFrancisco, visando à consolidação de seu poder. Assim, em janeiro de\n1933, 21 “coronéis” representando 20 municípios do vale do São Francisco\ne de Lavras reuniram-se para proclamar lealdade ao interventor, fundando\nna ocasião a Coligação Sertaneja, cujo principal objetivo era apoiar um\nnovo partido ainda em gestação, o Partido Social Democrático (PSD) da\nBahia. A Coligação Sertaneja era presidida por Nélson Xavier, tinha como\nvice-presidente o coronel Franklin de Albuquerque e, como secretário,\nAbílio Wolney. Por outro lado, Juraci procurou desarticular os partidos\npolíticos tradicionais, buscando eliminar a influência dos velhos\nlíderes como J. J. Seabra e atrair parcelas da intelectualidade baiana e\ndos grupos políticos dominantes em Salvador, representados entre outros\npor Antônio Garcia de Medeiros Neto, Alfredo Amorim, Edgar Ribeiro\nSanches, Francisco Prisco de Sousa Paraíso, João Marques dos Reis,\nFrancisco Magalhães Neto, Gileno Amado, Clemente Mariani Bittencourt,\nAliomar Baleeiro e Albérico Fraga.\n\nO PSD da Bahia foi criado oficialmente em 24 de janeiro de 1933 e seu\ndiretório central foi integrado por Manuel Matos Correia Meneses, João\nPacheco de Oliveira, Antônio Garcia de Medeiros Neto, João Marques dos\nReis, Átila do Amaral, o cônego Manuel Leôncio Galvão, o coronel Eudoro\nRude, Artur Lavigne de Lemos, Alfredo Pereira Mascarenhas, Nélson Xavier\ne Gileno Amado. Em fevereiro, Juraci foi promovido a capitão.\n\nNas eleições para a Assembléia Nacional Constituinte, realizadas em maio\nde 1933, o PSD obteve uma ampla vitória: dos 22 deputados eleitos pela\nBahia, 20 pertenciam às suas fileiras. A oposição, liderada por J. J.\nSeabra, fez apenas dois representantes: o próprio Seabra e Aluísio de\nCarvalho Filho, da Liga de Ação Social e Política (LASP) da Bahia.\n\nAinda em 1933 Vargas visitou a Bahia, acompanhado de José Américo e Góis\nMonteiro, e, segundo Juraci, disse-lhe que as duas melhores escolhas de\ninterventor haviam sido as que fizera sozinho — “a de Juraci na Bahia e\na de Armando Sales em São Paulo”.\n\nEm outubro de 1933 Juraci encontrou-se em Belo Horizonte com o\ninterventor em Pernambuco Carlos de Lima Cavalcanti. Acompanhados de\nJuarez, os dois foram negociar com Antônio Carlos Ribeiro de Andrada o\napoio mineiro às suas candidaturas a governadores constitucionais dos\nestados onde ocupavam a interventoria. Em troca, ofereciam apoio à\ncandidatura de Antônio Carlos à presidência da Assembléia Constituinte,\na ser instalada no mês seguinte. Em dezembro, Juraci pronunciou-se a\nfavor de Virgílio de Melo Franco para a interventoria em Minas Gerais —\nvaga com a morte de Olegário Maciel — mas o escolhido foi Benedito\nValadares.\n\nEm janeiro de 1934, Juraci apoiou publicamente o nome de Medeiros Neto,\nlíder do PSD baiano, para a liderança da maioria na Assembléia\nConstituinte, cargo para o qual Medeiros foi de fato escolhido e no qual\ntomou posse ainda no mesmo mês. Continuando suas articulações políticas,\nem fevereiro Juraci participou de uma reunião no gabinete de José\nAmérico, com a presença deste, do interventor gaúcho José Antônio Flores\nda Cunha e de Medeiros Neto, com o objetivo de discutir a eleição\npresidencial. Na ocasião, duas correntes se delinearam: uma, liderada\npor Flores, Juraci e Lima Cavalcanti, queria eleger Vargas presidente da\nRepública, e a outra, encabeçada por João Alberto, era favorável à\neleição de Afrânio de Melo Franco.\n\nQuando, no dia 21 de fevereiro, Medeiros Neto propôs a inversão da ordem\ndos trabalhos na Assembléia e a imediata eleição de Vargas para\npresidente constitucional do país, Juraci apoiou publicamente a\nproposta, que se tornaria conhecida como Indicação Medeiros Neto. No dia\n23, entretanto, realizou-se uma reunião no gabinete do ministro da\nGuerra, general Góis Monteiro, da qual participaram Juraci, Benedito\nValadares e os deputados Antônio Carlos, Medeiros Neto, Augusto Simões\nLopes (líder da bancada do Rio Grande do Sul), Alfredo de Arruda Câmara\n(líder da bancada de Pernambuco) e Augusto Amaral Peixoto (do Partido\nAutonomista do Distrito Federal). Na ocasião ficou decidido que os\npresentes, juntamente com o interventor no estado do Rio de Janeiro, Ari\nParreiras, deveriam promover um encontro com o deputado Levi Carneiro,\nmembro da Comissão Constitucional, para consultá-lo sobre uma fórmula\njurídica que permitisse a constitucionalização imediata do país. O\nencontro foi realizado ainda no mesmo dia e nele se concordou com que a\neleição presidencial fosse realizada 15 ou 20 dias após a aprovação em\nbloco do projeto da Comissão Constitucional, que seria adotado como\nconstituição provisória, e dos atos do Governo Provisório.\n\nColocando-se contra esse projeto, Simões Lopes telegrafou a Flores da\nCunha propondo uma nova fórmula, que consistiria na promulgação da\nConstituição em 34 dias, com eleições imediatamente após. No dia 28 de\nfevereiro, Flores telegrafou ao ministro da Justiça, Francisco Antunes\nMaciel, dizendo que não concordaria com nenhuma fórmula que não\nobtivesse o apoio de Valadares, Lima Cavalcanti e Juraci, com os quais\nestava comprometido.\n\nEnquanto se faziam essas articulações, em carta datada de 5 de abril\nJuraci alertou Vargas sobre a existência de uma conspiração no Norte,\ninformando-o sobre encontros de João Alberto com Ernesto Simões Filho e\nCavalcanti Melo e ainda sobre a criação de unidades militares no\ninterior da Bahia. De abril a junho Juraci escreveria quatro vezes ao\npresidente no mesmo sentido, pedindo-lhe que enviasse munições e\narmamentos. Em carta datada de 25 de maio, Juraci informou ainda a\nGetúlio que o general Colatino Marques, comandante da 6ª RM, havia\nrecebido uma circular “pessoal e secreta” do general Valdomiro Lima.\nEssa circular, datada de 14 de maio de 1934, havia sido expedida com o\nconhecimento do general Góis Monteiro e teria sido enviada a todos os\ngenerais do Exército. Ela tratava da reunião de um “conselho de\ngenerais”, que deveria apontar três nomes incumbidos de depor Vargas,\nassumir o governo e em seguida marcar eleições, permitindo que Vargas se\ncandidatasse normalmente. O movimento, porém, só seria desencadeado pela\nvontade do “conselho de generais” como um todo.\n\nA despeito de todas as fórmulas propostas, somente nos primeiros dias de\njunho o texto constitucional, com mais de cinco mil emendas, entrou em\nprocesso de votação. A Constituição foi promulgada em 16 de junho e no\ndia seguinte realizou-se a eleição presidencial, ficando Vargas\nconfirmado na presidência da República.\n\n \n\nGovernador constitucional da Bahia\n\nEm outubro de 1934, demonstrando seu prestígio político, o PSD baiano\nconseguiu novamente maioria nas eleições realizadas para a Assembléia\nConstituinte estadual e para a Câmara Federal, elegendo 32 deputados\nestaduais e 14 federais, estes numa bancada de 24. A Assembléia\nestadual, além de elaborar a nova Carta, deveria eleger dois senadores e\no governador constitucional do estado, cargo a que concorriam o próprio\nJuraci e Otávio Mangabeira, candidato da LASP.\n\nNuma carta a Vargas datada de janeiro de 1935, Juraci manifestou-se a\nfavor da candidatura de José Américo para a presidência do Senado. Em\noutra, escrita em fevereiro, abordou o problema das eleições para os\ngovernos do Espírito Santo e Sergipe, apoiando respectivamente as\ncandidaturas dos interventores João Punaro Bley e Augusto Maynard Gomes.\nNessa mesma carta Juraci pedia a intervenção de Vargas no Ceará. No\ninício de abril, Juarez Távora, preocupado com o crescimento da Aliança\nNacional Libertadora (ANL) e da Ação Integralista Brasileira (AIB),\nescreveu a Juraci defendendo a necessidade da criação de um “verdadeiro\npartido nacional”, onde São Paulo tivesse um lugar de destaque, pois só\nassim seria possível fazer frente às duas agremiações de âmbito nacional\njá atuantes.\n\nInstalada a Constituinte baiana em abril de 1935, Juraci foi eleito\ngovernador do estado, recebendo um mandato que se iniciou no dia 23 do\nmesmo mês. Em novembro seguinte, ao irromper a Revolta Comunista, entrou\nem contato com Lima Cavalcanti, governador de Pernambuco, Nélson de Melo\ne Afonso de Albuquerque Lima, em Recife, articulando a reação ao\nmovimento. A insurreição teve início no dia 23 em Natal, cidade em que\nfoi vitoriosa durante quatro dias, no dia 24 em Recife e no dia 27 no\nRio de Janeiro, onde foi esmagada em poucas horas. Na ocasião, quando o\ngoverno pediu ao Congresso o estabelecimento do estado de sítio, Juraci\nfoi favorável à medida e o PSD baiano deu total apoio a Vargas. Em carta\ndatada de 23 de dezembro, Juraci relatou ao presidente a repercussão da\nrevolta na Bahia, informando que havia prendido inúmeros simpatizantes\ndo comunismo, inclusive professores do ginásio e das escolas superiores.\nJuraci afirmaria mais tarde que, por ocasião da insurreição, recebeu um\ntelegrama de Filinto Müller, chefe de polícia do Distrito Federal,\npedindo-lhe que prendesse seu irmão, o médico Eliezer Magalhães, por\nsuas ligações com a Aliança Nacional Libertadora, promotora da revolta\nde novembro. O governador baiano, que esteve com seu irmão foragido,\nrespondeu desaforadamente ao pedido, dizendo que não admitia que lhe\nfosse imposta aquela humilhação e que cabia ao chefe de polícia prender\nseu irmão, se quisesse fazê-lo.\n\nDepois da repressão aos comunistas, o governo baiano voltou-se contra os\nintegralistas e, em setembro de 1936, ordenou a invasão dos centros\nintegralistas do estado, ocasião em que vários militantes foram presos e\ninúmeros documentos confiscados. Os funcionários da polícia e da guarda\ncivil do estado cujos nomes foram encontrados no fichário integralista\nforam expulsos e, em conseqüência dessa onda repressiva, o desfile\nintegralista marcado no Rio para o dia 7 de setembro foi cancelado.\n\nPor essa época, a sucessão de Vargas começava a dividir os partidos\npolíticos situacionistas. Na Bahia, Juraci recusou-se a aceitar a\nproposta de Agamenon Magalhães no sentido de prorrogar o mandato do\npresidente da República, tentando formar uma lista tríplice composta por\nMedeiros Neto, José Américo e Armando Sales (governador de São Paulo)\npara a escolha do futuro candidato oficial à presidência. Sua posição\nera apoiada por Lima Cavalcanti, Benedito Valadares e Nereu Ramos (os\ndois últimos, governadores de Minas e Santa Catarina) e foi levada a\nVargas através de Clemente Mariani. Pela correspondência mantida na\népoca entre o governador baiano e Juarez Távora, Armando Sales e Flores\nda Cunha (governador do Rio Grande do Sul), entre outros, fica\nevidenciado que Juraci defendia uma candidatura única que fosse apoiada\npor São Paulo, Rio Grande do Sul, Pernambuco e Bahia.\n\nA intervenção no Distrito Federal, decretada em março de 1937, e logo em\nseguida as intervenções em Mato Grosso e no Maranhão despertaram\nsuspeitas de que Vargas procurava intimidar os governadores que assumiam\numa postura independente no exame da questão sucessória. Sentindo-se\nameaçados, os governadores da Bahia, do Rio Grande do Sul e de São Paulo\nfirmaram um compromisso de união contra o Catete em caso de intervenção\nem qualquer desses três estados. Em abril de 1937 Flores da Cunha\nescreveu a Juraci pedindo o apoio para a candidatura oposicionista de\nArmando Sales, recebendo como resposta o pedido do governador baiano de\nque fosse realizada uma reunião entre os governadores de São Paulo, Rio\nGrande do Sul, Pernambuco e Bahia a fim de se buscar uma solução comum\npara o problema sucessório. Juraci acrescentava ainda que, se não\nconseguisse chegar a qualquer resultado nessa reunião, “cada um deveria\ntomar seu próprio rumo”.\n\nGetúlio fixou-se na candidatura de José Américo de Almeida, que foi\nlançada oficialmente pelo governador mineiro Benedito Valadares em maio\nde 1937, dias depois da apresentação oficial do candidato oposicionista\nArmando Sales. Paralelamente, a partir da hierarquia militar e do\ngoverno federal, cresciam as articulações para um golpe de Estado. No\nfinal de setembro o Estado-Maior do Exército (EME) anunciou a apreensão\nde um plano com “instruções da Internacional Comunista (Comintern) para\na ação de seus agentes no Brasil” no sentido da tomada do poder. Esse\nplano, batizado de “Plano Cohen”, fora na verdade elaborado pelo capitão\nOlímpio Mourão Filho, chefe do serviço secreto da AIB e oficial lotado\nno EME, mas serviu de pretexto no golpe em marcha, que tinha uma\ninspiração anticomunista com claras tinturas anti-semitas. Com base\nnesse documento, o estado de guerra, que fora suspenso em julho, foi\nreinstalado em outubro. Ainda nos últimos dias de outubro, com o golpe\njá marcado para 15 de novembro, teve início a Missão Negrão de Lima,\ncujo objetivo era contatar os governadores do Norte e Nordeste,\nsondando-os a respeito do golpe e comunicando-lhes os pontos básicos das\nmudanças institucionais em preparação. Conhecedor da posição de Juraci,\nque era contrário ao continuísmo de Vargas no poder, a Missão Negrão de\nLima sequer visitou a Bahia. Pelos mesmos motivos, Pernambuco foi também\nevitado pela missão.\n\nO golpe ocorreu no dia 10 de novembro, sendo dissolvidos o Senado, a\nCâmara Federal, as câmaras estaduais e municipais, e sofrendo alguns\nestados a intervenção federal. Juraci discursou na Rádio Sociedade da\nBahia comunicando sua renúncia ao governo estadual por não concordar com\no golpe de Estado. A 11 de novembro transmitiu o governo ao comandante\nda 6ª RM, coronel Antônio Fernandes Dantas, declarando na oportunidade\nque voltaria às fileiras do Exército.\n\nEnquanto interventor e governador da Bahia, as principais obras da\nadministração de Juraci no campo da educação foram a criação da\nSecretaria de Educação, a construção, em Salvador, do Instituto de\nEducação e das escolas Góis Calmon e Duque de Caxias, a ampliação do\nGinásio da Bahia e a federalização da Escola Politécnica da Bahia, além\nda construção de escolas no interior. No setor assistencial,\ndestacaram-se a criação do Conselho de Assistência Social e do\nDepartamento Estadual da Criança, o início da construção do Hospital\nDantas Bião, em Alagoinhas, e do Hospital de Pronto Socorro, a\nconstrução dos postos de puericultura do Rio Vermelho e da Estrada da\nLiberdade, também na capital, e o melhoramento da situação do Hospício\ndos Alienados. Foram ainda construídos em Salvador os prédios das\nsecretarias de Governo, na praça da Piedade, e da Agricultura, o\nedifício do Instituto do Cacau, a Vila Militar, em Dendezeiros, o\nquartel dos Aflitos e um pavilhão na Penitenciária do Estado. Foram\nfeitos melhoramentos no serviço de águas em Salvador e nas condições da\nEstrada de Ferro Santo Amaro, que retornou à administração do estado,\nbem como no serviço de navegação do rio São Francisco. Foi também\naprovado o Plano Rodoviário do Estado, que disciplinou a construção de\nestradas de rodagem. Criaram-se o Instituto Central de Fomento Econômico\nda Bahia, que mais tarde se transformaria no Banco do Estado da Bahia, e\nas estações experimentais de citricultura, em Alagoinhas, de\nsericicultura, em Serrinha, e de fruticultura, em Itaparica. Finalmente,\nfoi instituído o “selo policial”, cuja renda era destinada ao\nmelhoramento de vários serviços sociais.\n\n \n\nDe volta ao Exército\n\nNo dia 17 de novembro de 1937 Juraci Magalhães embarcou para o Rio e,\ncinco dias depois, foi destacado para servir no 18º BC, em Campo Grande,\nhoje capital do estado do Mato Grosso do Sul. Para evitar essa\ndesignação, contra a qual protestara, matriculou-se na Escola de\nAperfeiçoamento de Oficiais, cujo curso completaria em 1938 como segundo\ncolocado de sua turma.\n\nComandante de um batalhão no Regimento Sampaio na Vila Militar do Rio de\nJaneiro em 1939, no ano seguinte matriculou-se na Escola de Estado-Maior\ndo Exército. Promovido a major em janeiro de 1942, nesse mesmo ano\ningressou no quadro de estado-maior da ativa. Em 1943 foi transferido\npara o estado-maior da 7ª RM, sediada em Recife, onde, sob o comando do\ngeneral Newton Cavalcanti, organizou um campo de instrução intensiva.\nNesse mesmo ano, quando se preparava a Força Expedicionária Brasileira\n(FEB), que iria participar na Itália da Segunda Guerra Mundial, seguiu\npara os Estados Unidos para cursar o Command and General Staff School,\nem Fort Leavenworth. Durante o período em que esteve nos Estados Unidos,\nencontrou-se em Nova Iorque com Otávio Mangabeira, então exilado naquele\npaís, e com ele discutiu a redemocratização nacional e a derrubada do\ngoverno Vargas.\n\nDe volta ao Brasil, Juraci serviu no 21º BC em Recife. Com a proximidade\ndo final da Segunda Guerra Mundial e o crescimento da pressão social\npara o retorno à normalidade democrática, ao final de 1944 fez várias\nviagens a Natal para convencer o brigadeiro Eduardo Gomes a\ncandidatar-se à presidência da República. A partir de janeiro de 1945,\nserviu no 14º BC, em Florianópolis, onde permaneceu até maio, primeiro\ncomo subcomandante e depois como comandante de batalhão.\n\nNesse período, por sugestão sua a Virgílio de Melo Franco, foi elaborado\num manifesto condenando a ditadura e lançando a candidatura de Eduardo\nGomes à presidência. Assinado por Virgílio, Eduardo Gomes, Ari Parreiras\n(chefe naval de Recife), Juarez Távora e Olímpio Falconière da Cunha,\nentre outros, o manifesto foi publicado no dia 22 de fevereiro no\nCorreio da Manhã e em O Globo. Nesse mesmo dia José Américo de Almeida\ndeu uma entrevista ao jornalista Carlos Lacerda, publicada no Correio da\nManhã no dia 24, condenando a ditadura de Vargas. A publicação da\nentrevista de José Américo foi considerada um marco na política\nbrasileira e representou na prática o fim da censura à imprensa.\n\nPromovido a tenente-coronel em junho de 1945, Juraci encontrou-se com o\nlíder comunista Luís Carlos Prestes, que havia sido libertado da prisão\nno dia 18 de abril em função da anistia aos presos políticos. Durante\nesse encontro Prestes revelou-se disposto a apoiar Vargas na condução do\nprocesso de democratização, o que levou Juraci a acusá-lo de estar\nfazendo o jogo do “queremismo” — movimento que propunha a convocação de\numa assembléia constituinte com Getúlio ainda no poder e que era\ndiscretamente apoiado pelos comunistas.\n\nEm seguida, Juraci obteve licença sem vencimentos do Exército para\nparticipar da campanha eleitoral e voltou à Bahia, com objetivo de\norganizar naquele estado a União Democrática Nacional (UDN) e de\narticular a campanha de Eduardo Gomes. Em agosto, os estatutos do novo\npartido foram aprovados. Otávio Mangabeira e Virgílio de Melo Franco\nforam escolhidos por aclamação presidente e secretário-geral, e, para\ncompor a comissão executiva, foram indicados Juraci Magalhães, Valdemar\nFerreira, Raul Fernandes, Odilon Braga, João Carlos Machado, Carlos de\nLima Cavalcanti, José Augusto Bezerra de Medeiros e Filipe Moreira Lima.\n\nAo lado de outros membros da UDN, Juraci aproximou-se também, por essa\népoca, da Esquerda Democrática (ED), movimento igualmente contrário ao\nEstado Novo, mas mais voltado para a problemática social do país.\nReunindo vários intelectuais e políticos de prestígio, como João\nMangabeira, Herculino Cascardo, Filipe Moreira Lima, José Lins do Rego,\nAparício Torelli, Hermes Lima, Domingos Velasco, Osório Borba e Jurandir\nPires Ferreira, a ED reclamava um programa com “espírito social” e\npretendia livrar a UDN de “ranços conservadores”, ampliando as\nconquistas sociais do getulismo. A aliança de Juraci com a ED foi breve,\nassim como seria breve a aliança da ED com a UDN: nos dois anos\nseguintes o movimento se transformaria em partido político e adotaria o\nnome de Partido Socialista Brasileiro (PSB).\n\n \n\nNa Constituinte de 1946 e no Congresso Nacional\n\nNo dia 29 de outubro de 1945 Vargas foi derrubado do poder e, em 2 de\ndezembro, de acordo com o calendário previsto, realizaram-se eleições\npara a presidência da República e para a Assembléia Nacional\nConstituinte. O general Eurico Gaspar Dutra, ex-ministro da Guerra de\nVargas e apoiado por este, candidato do Partido Social Democrático\n(PSD), saiu vitorioso, derrotando por ampla margem de votos Eduardo\nGomes. Para a Assembléia Nacional Constituinte, de um total de 24\nrepresentantes eleitos pela Bahia, a UDN elegeu 12, entre eles Juraci.\n\nDurante os trabalhos da Constituinte, iniciados em fevereiro de 1946,\nJuraci teve com Prestes, no dia 26 de março, uma discussão que ficou\nfamosa, quando perguntou ao líder comunista se “no caso de uma guerra a\nque fosse arrastado o Brasil por força de obrigações internacionais e\nlegais que regeriam a declaração de guerra, o PCB lutaria pela pátria ou\nincitaria uma guerra civil”. Dado o acirramento dos ânimos motivado pela\npergunta, Prestes confundiu-se na resposta, dando margem a\ninterpretações que o qualificavam de antipatriota. Esse episódio teria\nsido um fator determinante no cancelamento do registro do PCB em maio do\nano seguinte e na posterior cassação dos mandatos dos comunistas eleitos\npara a Assembléia Nacional Constituinte, cassação essa que contaria com\no voto do próprio Juraci.\n\nPresidente da Sociedade Amigos da América entre 1946 e 1947, Juraci\nparticipou ativamente da campanha anticomunista desenvolvida no país.\nCom a promulgação da nova Carta (18/9/1946), passou a exercer o mandato\nordinário de deputado federal, participando das comissões de Segurança,\nde Finanças e de Diplomacia da Câmara. Em 1948 integrou a delegação do\nBrasil à III Assembléia Geral da Organização das Nações Unidas (ONU), em\nParis, fazendo parte da divisão econômica. Na ocasião leu um discurso\ncontra o Plano Marshall, preparado por Roberto Campos, seu auxiliar.\n\nPara as eleições presidenciais de 3 de outubro de 1950, Juraci foi\ncontra o relançamento da candidatura de Eduardo Gomes, considerando que\nela “marcharia para outro fracasso eleitoral”. Na época chegou a tentar\num acordo com o PSD, que não prosperou. Ao final acabou participando da\ncampanha do brigadeiro, ao mesmo tempo em que fazia sua própria campanha\npara o governo da Bahia. Eduardo Gomes foi derrotado por Getúlio e\nJuraci por Régis Pacheco, candidato do PSD.\n\nRetornando à Câmara, Juraci nela permaneceu até concluir seu mandato, em\njaneiro de 1951. Nesse mesmo mês foi convidado por Vargas para ocupar a\npresidência do Conselho Nacional do Petróleo, mas declinou do convite,\naceitando porém em seguida assumir a presidência da Companhia Vale do\nRio Doce. Foi assim um dos poucos udenistas que admitiu cooperar com o\ngoverno de Vargas. Promovido a coronel em outubro de 1951, deixou a\npresidência da Vale do Rio Doce em dezembro de 1952, sendo dois meses\ndepois nomeado adido militar em Washington. A partir de maio de 1954,\nfoi o primeiro presidente da Petrobras, empresa criada em 3 de outubro\nde 1953 pela Lei nº 2.004. Ocuparia esse cargo até 2 de setembro de\n1954, poucos dias depois do suicídio de Getúlio Vargas, quando João Café\nFilho assumiu a presidência da República. Segundo suas próprias\ndeclarações, Juraci entrou em conflito com o novo presidente porque este\nnão apoiava Antônio Balbino, seu candidato ao governo da Bahia, nas\neleições de 3 de outubro de 1954.\n\nCandidato da coligação formada pela UDN, o Partido Trabalhista\nBrasileiro (PTB) e o Partido Social Trabalhista (PST), nesse pleito\nJuraci elegeu-se senador pela Bahia e Balbino, lançado por esses mesmos\npartidos com o apoio de uma ala dissidente do PSD, derrotou o candidato\npessedista oficial, Pedro Calmon, na disputa pelo governo do estado.\nEmpossado no Senado em fevereiro de 1955, Juraci foi convidado por Café\nFilho para ocupar o Ministério da Agricultura, recusando porém o\nconvite. Entre março e dezembro de 1955 cursou a Escola Superior de\nGuerra (ESG), ocasião em que fez parte também da direção executiva da\ncampanha eleitoral de Juarez Távora, candidato à presidência da\nRepública nas eleições de outubro de 1955, apoiado pela coligação\nformada entre a UDN e o Partido Democrata Cristão (PDC).\n\n \n\nNo 11 de Novembro\n\nRealizadas as eleições de 1955, o candidato da coligação PSD-PTB,\nJuscelino Kubitschek, derrotou Juarez Távora por cerca de quatrocentos\nmil votos, ficando Ademar de Barros em terceiro lugar e Plínio Salgado\nem último. A UDN — que na sua última convenção, em abril de 1955,\nelegera Mílton Campos como seu presidente e Juraci Magalhães, Manuel do\nNascimento Fernandes Távora e Adauto Lúcio Cardoso como vice-presidentes\n— abriu campanha contra a posse dos candidatos eleitos. Seu argumento\nera que as eleições haviam sido fraudulentas e que, além disso,\nKubitschek não obtivera maioria absoluta, exigência que tinha sido\nobjeto de uma emenda constitucional apresentada pelo deputado udenista\nAfonso Arinos de Melo Franco e derrotada no Congresso um mês antes das\neleições. As forças armadas também se dividiram: o ministro da Guerra,\nHenrique Teixeira Lott, defendia o respeito à Constituição e à posse de\nKubitschek, mas os ministros da Aeronáutica, Eduardo Gomes, e da\nMarinha, Edmundo Amorim do Vale, endossavam a tese da “maioria\nabsoluta”.\n\nA crise político-militar agravou-se e no dia 11 de novembro eclodiu um\nmovimento militar liderado por Lott, a essa altura demissionário do\nMinistério da Guerra, visando, segundo alegava, assegurar a posse do\npresidente eleito. Com a situação no Rio logo definida em favor das\nforças ligadas a Lott, o presidente interino Carlos Luz, que substituíra\nCafé Filho, internado por problemas de saúde, juntamente com 27\npersonalidades, embarcou no cruzador *Tamandaré*com destino a Santos, na\nexpectativa de contar com apoio no estado de São Paulo. As forças\nmilitares de São Paulo, no entanto, colocaram-se a favor de Lott e,\nainda no dia 11, o ministro da Guerra exigiu e obteve do Congresso o\nimpedimento de Carlos Luz, que no mesmo dia foi substituído por Nereu\nRamos na presidência da República.\n\nDepois que ficou clara a inutilidade da resistência, no dia 13 o\n*Tamandaré*retornou ao Rio e fundeou na baía de Guanabara. Autorizado\npelo novo governo, Juraci dirigiu-se ao cruzador juntamente\ncom****Afonso Arinos e Rafael Correia de Oliveira, conduzindo em seguida\nCarlos Lacerda à residência do embaixador de Cuba, que concedeu asilo ao\nudenista carioca. Dias depois, quando Café Filho restabeleceu-se da\nenfermidade e foi impedido de reassumir o governo, Juraci prestou-lhe\nsolidariedade. O impedimento de Café foi referendado pelo Congresso em\n22 de novembro e Nereu Ramos confirmado como presidente legítimo até a\nposse de Juscelino, marcada para o dia 31 de janeiro de 1956. Empossado\nJuscelino na data prevista, Juraci, no Senado, esteve na linha de frente\nda oposição ao governo.\n\nEm junho de 1956 Juraci foi transferido para a reserva no posto de\ngeneral-de-divisão e, no ano seguinte, quando Mílton Campos encerrou seu\nmandato na presidência da UDN, elegeu-se presidente do partido, apoiado\npelo Norte e Nordeste, derrotando Odilon Braga, candidato de Mílton\nCampos. Durante sua gestão na presidência da UDN, procurando popularizar\no partido, criou as “caravanas da liberdade”, constituídas por líderes\nudenistas que percorriam os estados falando ao povo.\n\nNovamente no governo da Bahia\n\nNas eleições de 3 de outubro de 1958 Juraci foi eleito para o governo da\nBahia, tirando proveito da crise que envolvia o PSD naquele estado e que\nfez com que fossem lançados dois candidatos oriundos das fileiras\ndaquele partido: José Pedreira de Freitas e Tarcilo Vieira de Melo.\nDeixando o Senado Federal, tomou posse em fevereiro de 1959 e, pouco\ndepois, segundo Maria Vitória Benevides, foi cogitado por Juscelino\nKubitschek para candidatar-se à presidência nas eleições de 1960, com o\napoio de uma coligação que envolveria a UDN, o PTB e o PSD, numa\ntentativa de estabilizar a vida política do país. Ainda de acordo com a\nautora citada, por trás da proposta de Kubitschek estava sua intenção de\nvoltar à presidência em 1965, após o inepto governo que necessariamente\nfaria Juraci, devido à difícil situação econômica do país naquele\nperíodo.\n\nNo entanto, o crescimento da candidatura de Jânio Quadros —\nex-governador de São Paulo e então deputado federal pelo Paraná  —\nacabou por inviabilizar a coligação dos três maiores partidos. Em abril\nde 1959 Jânio foi lançado candidato pelo Movimento Popular Jânio Quadros\n(MPJQ), com o apoio de Carlos Lacerda, e em novembro do mesmo ano, na\nconvenção da UDN, recebeu 250 votos contra 83 dados a Juraci Magalhães.\nDerrotado, Juraci recusou o convite para compor a chapa como candidato a\nvice-presidente, permanecendo no governo da Bahia. No dia 3 de outubro\nde 1960 Jânio foi eleito, tomando posse em 31 de janeiro do ano\nseguinte. Em seguida, Juraci Magalhães Júnior, filho do governador\nbaiano, foi chamado para ocupar o cargo de subchefe do Gabinete Civil da\nPresidência da República. Entretanto, quando, em 25 de agosto de 1961,\nJânio renunciou à presidência, Juraci afirmou: “A renúncia foi um plano\nde Jânio Quadros que fracassou, pois o que ele queria era dar o golpe e\nvoltar mais forte; jamais pensou em abandonar o poder, mas em dar um\npasso para o absolutismo.”\n\nNessa ocasião, Leonel Brizola, governador do Rio Grande do Sul,\norganizou a “luta pela legalidade” com o objetivo de defender a posse do\nvice-presidente João Goulart, que se encontrava na China em missão\noficial e cujo nome era vetado pelos ministros militares.\n\nRespondendo a um telegrama de Brizola, Juraci afirmou que estava de\nacordo com a posse de Goulart. Em seguida viajou ao Rio de Janeiro para\nparticipar de uma reunião de governadores, onde encontrou-se também com\nos ministros da Guerra e da Marinha, respectivamente o marechal Odílio\nDenis e o almirante Sílvio Heck, ambos contrários à posse de Goulart.\nContinuando a defender uma solução legal, esteve depois com o general\nOsvaldo Cordeiro de Farias, chefe do Estado-Maior das Forças Armadas\n(EMFA), que o encarregou de conversar de novo com Denis para tentar\ndissuadi-lo do veto a Goulart.\n\nNa Bahia Juraci não permitiu qualquer manifestação pública de\nsolidariedade à posse do vice-presidente, mas transmitiu à Câmara\nFederal, através do deputado Antônio Carlos Magalhães, a sua posição\nfavorável à posse de Goulart.\n\nGraças ao movimento a favor da posse concentrado principalmente no Rio\nGrande do Sul sob a liderança de Brizola e do general José Machado\nLopes, comandante do III Exército, duas semanas mais tarde João Goulart\nassumiu a presidência da República. Antes, porém, como solução\nconciliatória, o Congresso votou a Emenda Constitucional nº 4, pela qual\no regime presidencialista vigente foi substituído pelo parlamentarismo.\nNessa época o nome de Juraci Magalhães chegou a ser lembrado pelo\nescritor Jorge Amado para ocupar o cargo de primeiro-ministro.\n\nLançado por Carlos Lacerda, então governador da Guanabara, para\nconcorrer ao Senado por esse estado na legenda da UDN, Juraci foi\nderrotado nas eleições de outubro de 1962 por Aurélio Viana, candidato\nda coligação entre o PTB e o Partido Socialista Brasileiro (PSB) que\ntinha o apoio das ascendentes forças nacionalistas de esquerda, e ainda\npor Gilberto Marinho, do Partido Trabalhista Nacional (PTN). Completando\nseu mandato em abril de 1963, Juraci deixou a chefia do governo da\nBahia, passando o cargo ao udenista Antônio Lomanto Júnior, candidato\nvitorioso que contara com seu apoio nas eleições de outubro anterior.\nLomanto Júnior havia derrotado Valdir Pires, apresentado pela coligação\nentre o PDC, o PSD, o PTN e o Partido Social Progressista (PSP).\n\nEm sua segunda gestão no governo da Bahia, Juraci concluiu as\nhidrelétricas de****Funil e Barranco, implantou a Companhia de\nEletricidade da Bahia (Coelba), prosseguiu as obras para o abastecimento\nde água em Salvador, construiu mais de três mil quilômetros de estradas,\nfortaleceu a Companhia de Navegação Baiana e construiu parte da avenida\ndo Contorno, ligando a Cidade Alta à Cidade Baixa, em Salvador.\nTransformou o Banco de Fomento Econômico da Bahia no Banco do Estado da\nBahia, construiu o Colégio Manuel Devoto, além de vários outros colégios\nna capital e no interior, criou o Setor de Educação Especializada para\ncrianças excepcionais, surdos, mudos e cegos, instituiu dez cursos de\naperfeiçoamento do professorado, promoveu a instalação de cursos de\nmétodos audiovisuais e construiu postos de saúde, além de racionalizar o\nsistema de pronto-socorro. Estimulou também a Plantação de seringueiras\nno sul do estado, conseguindo condições de financiamento vantajosas\njunto ao Banco do Brasil.\n\nNo movimento de 1964\n\nDe acordo com sua entrevista ao Cpdoc, já citada, no final de 1963\nJuraci foi procurado pelos generais Joaquim Ribeiro Monteiro e Alcindo\nMonteiro Avidos para participar da conspiração em curso contra o\npresidente Goulart, recusando-se entretanto a aderir ao movimento. No\nentanto, mais tarde, a crescente radicalização política do governo\nlevou-o a mudar de idéia. Sua adesão total à conspiração deu-se,\nentretanto, após o comício de 13 de março no Rio de Janeiro, que ficou\nconhecido como o Comício das Reformas. Nesse dia, ao lado de seus\nministros, inclusive os três ministros militares, de vários governadores\ne representantes sindicais, e diante de duzentas mil pessoas, Goulart\ndiscursou e assinou decretos-leis de interesse social. Entre estes, os\nmais importantes foram os que desapropriavam terras com mais de\nquinhentos hectares situadas à margem das rodovias e ferrovias federais,\no de tabelamento de aluguéis de imóveis e o da encampação das refinarias\nprivadas de petróleo.\n\nApós o comício, na casa do general Ademar de Queirós e estando também\npresente Cordeiro de Farias, Juraci encontrou-se com o chefe do EME,\ngeneral Humberto de Alencar Castelo Branco, a quem entregou uma lista de\npessoas dispostas a participar da conspiração.\n\nQuando o movimento eclodiu em 31 de março de 1964, Juraci seguiu para o\npalácio Guanabara, colocando-se ao lado de Lacerda, que ainda chefiava o\ngoverno do estado. No dia seguinte, consumada a deposição de Goulart,\ndirigiu-se à Escola de Comando e Estado-Maior do Exército, cujo\ncomandante era o general-de-brigada Jurandir Mamede, para discutir a\nnecessidade de “se evitar que o governo caísse em mãos inconvenientes”.\n\nApesar de o presidente da Câmara, Pascoal Ranieri Mazzilli, ter sido\nempossado formalmente na presidência da República, o poder de fato\nestava nas mãos do chamado Comando Supremo da Revolução, integrado pelo\ngeneral Artur da Costa e Silva, o almirante Augusto Rademaker e o\nbrigadeiro Francisco Correia de Melo. A essa altura, a busca de um nome\npara ocupar a presidência da República era a preocupação central da\nliderança do movimento. Autorizado por Lacerda, Juraci — segundo\ndeclarou — estava disposto a conversar sobre a candidatura do general\nDutra nos meios políticos e militares, quando ouviu dos deputados da\nbancada udenista da Bahia a informação de que no meio parlamentar a\ncandidatura de Castelo Branco encontrava grande aceitação. Após\ntransmitir essa informação a Castelo, Juraci recebeu a tarefa de\narticular seu nome.\n\nPouco depois Lacerda entrou em choque com Costa e Silva, decidindo em\nfunção disso renunciar ao governo da Guanabara. Formalizou a renúncia\natravés de uma carta datada de 5 de abril ao próprio Costa e Silva, o\nqual porém não acusou seu recebimento. Segundo Juraci, a carta acabou\nficando em poder do general Sizeno Sarmento, que a entregou a Cordeiro\nde Farias, “ambos interessados em encerrar o incidente sem outras\nconseqüências”. A partir desse episódio, Juraci passou a representar\nLacerda nas reuniões dos governadores de estado com Costa e Silva.\n\nFixado o nome de Castelo para a presidência da República, os\ngovernadores foram a Costa e Silva saber como o Exército receberia a\nindicação. Segundo Juraci, apesar de não apoiar efetivamente essa\ncandidatura, Costa e Silva não se opôs a ela.\n\nNos governos pós-1964\n\nEleito indiretamente no dia 11 de abril, Castelo consultou Juraci sobre\na nomeação de Luís Viana Filho para a chefia do Gabinete Civil e, em\nseguida, o convidou para ocupar o cargo de embaixador em Washington. Foi\nnessa ocasião que, homenageado pela Câmara de Comércio Norte-Americana\nde São Paulo, Juraci proferiu uma frase que ficou célebre: “O que é bom\npara os Estados Unidos é bom para o Brasil.” Permanecendo como\nembaixador em Washington de junho de 1964 a outubro de 1965, nesse\nperíodo encontrou-se em Nova Iorque com Lacerda, que viajava com a\nmissão de “explicar a Revolução” no exterior. De acordo com seu\ndepoimento, Juraci tentou na ocasião colocar Lacerda em contato com\nautoridades norte-americanas, mas o governador carioca não compareceu ao\nencontro devido aos rumores de que Castelo Branco estaria pregando a\ncandidatura de Juraci à sua sucessão, em detrimento da de Lacerda. Por\nseu lado, Lacerda afirma em suas memórias ter havido somente um\ndesencontro, em função de um atraso de poucos minutos, justificando\nainda sua volta apressada ao Brasil pelo estado de saúde de sua esposa.\nDois meses depois Juraci enviou uma carta a Lacerda afirmando não ser\ncandidato e mantendo seu compromisso com a candidatura do governador\ncarioca.\n\nAinda em 1964 Juraci intercedeu junto ao subsecretário norte-americano\nThomas Mann no sentido de que este facilitasse a renegociação da dívida\nexterna brasileira. Pediu ainda a Mann, através de uma carta cuja minuta\nfora aprovada por Castelo, que atuasse junto aos congressistas\nnorte-americanos para que fosse efetivado o Convênio Internacional do\nCafé, cuja inoperância se devia à não-aprovação de medidas\ncomplementares pelo Congresso dos Estados Unidos. O subsecretário\nnorte-americano solicitou, então, que Juraci conseguisse uma carta\nidêntica do governo colombiano, o que foi feito. A partir das duas\ncartas, Mann conseguiu do Congresso a votação do acordo e das medidas\ncomplementares.\n\nMuito ligado aos Estados Unidos, em abril de 1965 Juraci escreveu a\nCastelo afirmando estar temeroso das propaladas posições de algumas\ndelegações que compareceriam à III Conferência Interamericana de\nEconomia (CIE) sobre cooperação econômica no hemisfério. Juraci antevia\na formação de uma corrente antiamericana, que poderia transformar a\nAmérica Latina num “bloco desligado da tradicional política\npan-americana”.\n\nEm resposta à carta de Castelo datada de 27 de agosto de 1965\nconvidando-o para a pasta das Relações Exteriores ou a da Justiça,\nJuraci aceitou assumir esta última. Chegando ao Rio a 7 de outubro,\ntomou posse no ministério poucos dias depois, recebendo o cargo das mãos\nde Luís Viana Filho, chefe do Gabinete Civil, que o ocupava\ninterinamente desde a saída de Mílton Campos. Mílton Campos renunciara\npor não concordar com a idéia de se editar o Ato Institucional nº 2\n(AI-2), motivada pela eleição, em 3 de outubro, de candidatos\noposicionistas para os governos da Guanabara e de Minas Gerais, eleição\nvigorosamente contestada pelos setores militares conhecidos como “linha\ndura”.\n\nTentando encontrar uma saída antes da edição do ato institucional,\nJuraci enviou ao Congresso no dia 13 de outubro um projeto de lei\nvisando dotar o governo de poderes de defesa revolucionária, como a\nampliação da possibilidade de intervenção federal nos estados, a\nextensão aos civis do foro especial previsto para o julgamento de\nmilitares e a possibilidade de cassação de direitos políticos. Lacerda,\nque de início parecia dar apoio a essas medidas, acabou por recuar e\nromper com Juraci. Prevendo que o Congresso não aprovaria o projeto, já\nque o PTB e o PSD haviam firmado posição contrária, Juraci alertou os\npessedistas afirmando que o governo precisava desses instrumentos, que o\nmodo de consegui-los era secundário e que, “se necessário, abriria\ncaminho à força”. No dia 22 de outubro participou de uma reunião com\nCastelo Branco, Ernesto Geisel, chefe do Gabinete Militar, Golberi do\nCouto e Silva, chefe do Serviço Nacional de Informações (SNI), Cordeiro\nde Farias, ministro do Interior, e Luís Viana Filho, chefe do Gabinete\nCivil. Nessa reunião ficou acertado que, num esforço para a aprovação\ndas emendas, Juraci falaria na televisão sobre a situação política e\nprocuraria mais uma vez a cúpula do PSD para que esta modificasse a\nposição do partido. Não conseguindo os resultados esperados, no dia 26,\napós ter discutido no dia anterior o esboço do AI-2 preparado por\nNehemias Gueiros, Juraci levou seu texto final a Castelo, que o assinou\nno dia seguinte.\n\nPelo AI-2 foi reaberto o processo de punições extralegais de adversários\ndo regime, cujo julgamento passou a ser da alçada da Justiça Militar,\nforam extintos os partidos políticos existentes e estabelecidas as\neleições indiretas para a presidência da República, e foram\nacrescentadas limitações ao Poder Legislativo em benefício do Executivo.\nAinda no dia 27 de outubro foi editado o Ato Complementar nº 1,\nestabelecendo a pena de três meses a um ano de detenção para as pessoas\nque, privadas de seus direitos políticos, participassem de atividades ou\nmanifestações sobre assuntos de natureza política. Segundo Juraci, no\nperíodo em que se articulava o ato institucional, o ministro da Guerra\nCosta e Silva entregou-lhe um trabalho do professor Luís Antônio da Gama\ne Silva que “estabelecia pura e simplesmente uma ditadura brutal no\nBrasil, começando por dissolver o Legislativo e o Judiciário, além de\ndestituir todos os governadores estaduais”.\n\nNo dia 3 de novembro Juraci reafirmou que o governo estava disposto a\npunir com as sanções previstas os jornais e jornalistas que continuavam\ninfringindo o AI-2. Ainda no mês de novembro, depois de reunir-se com\nPedro Aleixo, Paulo Sarasate, Rui Santos e Antônio Carlos Magalhães,\nJuraci concluiu o texto sobre a nova legislação eleitoral, assinado em\nseguida pelo presidente Castelo Branco. No texto ficou estabelecido que\num número não inferior a 120 deputados e 20 senadores promoveria dentro\nde 45 dias a criação de organizações partidárias provisórias, que, até\nas eleições de 1966, teriam as atribuições dos antigos partidos e, um\nano depois disso, poderiam transformar-se em partidos definitivos. O\nprazo de 45 dias seria mais tarde prorrogado até 15 de março de 1966\natravés do Ato Complementar nº 6, assinado por Castelo em 3 de janeiro\ndo mesmo ano.\n\nAinda no mês de novembro de 1965, chamado pelo comandante do I Exército,\ngeneral Ururaí Magalhães, que queria saber sua opinião sobre a\npossibilidade de se impedir a posse dos três governadores da oposição\neleitos em outubro, respectivamente Francisco Negrão de Lima, na\nGuanabara, Israel Pinheiro, em Minas Gerais, e Pedro Pedrossian, em Mato\nGrosso, Juraci respondeu que a posse dos eleitos era “ponto de honra\npara o presidente Castelo Branco”. Em seguida a esse incidente,\ndirigiu-se ao presidente solicitando demissão de seu cargo, mas Castelo\no dissuadiu. Dias depois, a 17 de dezembro, representou Castelo Branco\nna posse de Negrão de Lima.\n\nPouco mais tarde, no dia 14 de janeiro de 1966, Juraci deixou o\nMinistério da Justiça, substituído por Mem de Sá. Três dias depois foi\nnomeado ministro das Relações Exteriores, recebendo o cargo das mãos do\nchanceler interino, Antônio Borges Castelo Branco. À frente da pasta das\nRelações Exteriores, assinou com o Paraguai a Ata das Cataratas, que\nestabeleceu o princípio da exploração conjunta pelos dois países da\nenergia de Sete Quedas, base para a futura construção da hidrelétrica de\nItaipu. Restabeleceu também as relações diplomáticas do Brasil com a\nVenezuela, rompidas por aquele país em conseqüência da deposição do\npresidente constitucional brasileiro em 1964. Em agosto, quando viajou à\nEuropa, a imprensa noticiou que um dos seus objetivos era expor ao\nVaticano a versão do governo brasileiro acerca dos problemas existentes\nna época entre a Igreja e o Exército, centrados principalmente na figura\ndo arcebispo de Olinda e Recife, dom Hélder Câmara. Um mês depois,\nJuraci abriu a XXI Sessão da Assembléia Geral das Nações Unidas.\n\nDefensor do princípio das “fronteiras ideológicas” para justificar a\níntima vinculação do Brasil em relação aos Estados Unidos, Juraci\npromoveu durante sua gestão no Ministério das Relações Exteriores uma\nintensa aproximação entre os dois países. Em novembro de 1966, numa\nreunião do Conselho da Organização dos Estados Americanos (OEA)\nrealizada em Washington, chegou mesmo a defender a criação de uma força\narmada interamericana permanente no hemisfério, com o objetivo de\ncombater as ameaças revolucionárias. Em seguida viajou para a Argentina,\nonde foi debater essa proposta.\n\nEm dezembro de 1966 participou da reunião da Associação Latino-Americana\nde Livre Comércio (ALALC). Na ocasião foi criado por unanimidade o\nConselho de Ministros das Relações Exteriores, como órgão da ALALC.\n\nEm fevereiro de 1967 Juraci participou em Buenos Aires da III\nConferência Interamericana de Chanceleres, onde foi debatida a Carta da\nOEA. Na ocasião foi marcada para os dias 12, 13 e 14 de abril a\nconferência de cúpula dos presidentes americanos, a ser realizada em\nPunta del Este, no Uruguai.\n\nAinda como chanceler, Juraci promoveu a Conferência dos Embaixadores do\nBrasil nos Países Amazônicos, participou da reunião de consulta dos\nministros das Relações Exteriores das repúblicas americanas em Buenos\nAires, onde defendeu a eliminação dos gastos militares desnecessários,\nimpulsionou a construção do palácio Itamarati, em Brasília, e assinou o\ntratado de assistência técnica entre Brasil e França, instalando a\nComissão Mista Franco-Brasileira.\n\nCom a passagem da presidência da República das mãos de Castelo Branco\npara o general Costa e Silva em 15 de março de 1967, Juraci Magalhães\ndeixou o Ministério das Relações Exteriores, sendo substituído por José\nde Magalhães Pinto. A partir de então dedicou-se essencialmente à vida\nprivada, interferindo apenas de maneira indireta na política,\nprincipalmente através de seu único filho vivo, Jutaí Magalhães,\nvereador de Itaparica (1959-1963), deputado estadual pela UDN na Bahia\nde 1963 a 1967 e de 1971 a 1975, deputado federal pela Aliança\nRenovadora Nacional (Arena) de 1975 a 1979, senador indireto de 1979 a\n1987, senador constituinte eleito diretamente de 1987 a 1988 e de 1987 a\n1995.\n\nJuraci Magalhães ocupou ainda diferentes cargos em várias empresas\nnacionais e estrangeiras. Foi presidente da  United Breweries, da\nPolímeros de Aratu, da Deltec, da Ericsson do Brasil e da Companhia de\nBebidas da Bahia (Cibeb). Foi também diretor da Companhia City de\nDesenvolvimento, da Mercedes Benz, da Companhia City Paulista de\nMelhoramentos, da Companhia Industrial São Paulo e Rio (CISPER), da\nSystemas, da Crefinan — Crédito, Financiamentos e Investimentos e da\nMonteiro Aranha Engenharia, Comércio e Indústria, empresa com\nparticipação na Volkswagen do Brasil e em diversos outros\nempreendimentos. Foi membro do conselho da Refinaria União, do conselho\nfiscal da Companhia de Bebidas da Bahia (Cibeb), do conselho de\nadministração da Light, do conselho consultivo da Sanbra, do conselho do\nFundo Crescinco e do Condomínio Crescinco do Unibanco, do conselho da\nCarlsberg do Brasil, do conselho da Companhia de Seguros da Bahia, do\nconselho de administração da Aracruz Celulose, do conselho fiscal da\nCompanhia Cervejaria Brahma, do conselho da  Sidney Ross Company e do\nconselho fiscal da Miranda Estância S.A., além de presidente do conselho\nda Eletroprojetos S.A. Foi vice-presidente da Associação Comercial do\nRio de Janeiro e recebeu o título de doutor *honoris* *causa*em leis\npelo Rollins College Winter Park, na Flórida, Estados Unidos.\n\nCasou-se com Lavínia Borges Magalhães, com quem teve seus filhos Jutaí e\nJuraci Júnior. Este último foi deputado estadual na Bahia de 1959 a\n1963, quando faleceu, cumprindo o segundo mandato. Seu neto, Jutaí\nMagalhães Júnior, foi deputado federal pela Bahia (1983-1988, 1989-1992,\n1993-1995 e 1999-), constituinte (1987-1988) e ministro do Bem-Estar\nSocial (1992-1993).\n\nAlém de inúmeras mensagens e discursos, Juraci Magalhães publicou as\nseguintes obras: *Minha vida pública na Bahia*(1957),*Minha*\n*experiência diplomática* (1971),*Minhas memórias\nprovisórias*(depoimento prestado a Alzira Alves de Abreu, do Cpdoc,\n1982), *O último tenente*(depoimento prestado a J. A. Gueiros, 1996 ). A\nseu respeito J. J. Seabra escreveu *Humilhação* *e devastação da Bahia*\n(1933).\n\nO arquivo de Juraci Magalhães encontra-se depositado no Cpdoc da\nFundação Getulio Vargas.\n\nAmélia Coutinho\n\n \n\nFONTES: ARQ. CLUBE 3 DE OUTUBRO; ARQ. NAC. *Relação;*BARATA, A. *Vida;*\nBROXSON, E. Plínio; CACHAPUZ, P. *Cronologia;*CAFÉ FILHO, J.\n*Sindicato;*CÂM. DEP. *Deputados;*CÂM. DEP. *Relação dos dep.;*\nCARNEIRO, G. *História;*CORRESP. GOV. EST. BA; CORTÉS, C*.\nHomens;*COSTA, M. *Cronologia;*COUTINHO, A. *Brasil; Diário do*\n*Congresso Nacional;*DULLES, J.*Getúlio; Encic. Mirador;*ENTREV. BIOG.;\nEULSOO PANG*. Coronelismo;*FONTOURA, J. *Memórias;*FUND. GETULIO VARGAS.\n*Cronologia da Assembléia;*GALVÃO, F. *Fechamento;*GIRÃO; R. *Ceará;\nGrande encic. Delta;* HEILBORN, M. *Oligarquia;*HIPÓLITO, L. *Campanha;\nJornal do Brasil* (29/8 e 2/9/75); KUBITSCHEK, J. *Meu;* LEITE,**A.\n*Páginas;* LEVINE, R. *Vargas;*LIMA, M. *Petróleo;*MAGALHÃES, J.*Minha\nexperiência;*MAGALHÃES, J. *Minha vida;*MELO, A. *Cartilha;* MIN.\nGUERRA. *Almanaque;*MIN. REL. EXT. *Anuário;*MOURÃO, M.*Dutra;*NÉRI, S.\n*16;* PERALVA, O. *Retrato;*POPPINO, R. *Federal;\nQuem;*SENADO.*Dados;*SENADO. *Relação;*SILVA, G. *Constituinte;*SILVA,\nH. *História;*SILVA, H. *1930;* SILVA, H. *1931;* SILVA, H.\n*1932;*SILVA, H. *1933;*SILVA, H. *1934;*SILVA, H. *1935;*SILVA, H.\n*1936;*SILVA, H. *1937;*SILVA, H.*1945;*SKIDMORE, T*. Brasil;\nSúmulas;*TÁVORA, J. *Vida.*\n\n \n\n \n","ref":"FONTES: ARQ. CLUBE 3 DE OUTUBRO; ARQ. NAC. *Relação;*BARATA, A. *Vida;*\nBROXSON, E. Plínio; CACHAPUZ, P. *Cronologia;*CAFÉ FILHO, J.\n*Sindicato;*CÂM. DEP. *Deputados;*CÂM. DEP. *Relação dos dep.;*\nCARNEIRO, G. *História;*CORRESP. GOV. EST. BA; CORTÉS, C*.\nHomens;*COSTA, M. *Cronologia;*COUTINHO, A. *Brasil; Diário do*\n*Congresso Nacional;*DULLES, J.*Getúlio; Encic. Mirador;*ENTREV. BIOG.;\nEULSOO PANG*. Coronelismo;*FONTOURA, J. *Memórias;*FUND. GETULIO VARGAS.\n*Cronologia da Assembléia;*GALVÃO, F. *Fechamento;*GIRÃO; R. *Ceará;\nGrande encic. Delta;* HEILBORN, M. *Oligarquia;*HIPÓLITO, L. *Campanha;\nJornal do Brasil* (29/8 e 2/9/75); KUBITSCHEK, J. *Meu;* LEITE,**A.\n*Páginas;* LEVINE, R. *Vargas;*LIMA, M. *Petróleo;*MAGALHÃES, J.*Minha\nexperiência;*MAGALHÃES, J. *Minha vida;*MELO, A. *Cartilha;* MIN.\nGUERRA. *Almanaque;*MIN. REL. EXT. *Anuário;*MOURÃO, M.*Dutra;*NÉRI, S.\n*16;* PERALVA, O. *Retrato;*POPPINO, R. *Federal;\nQuem;*SENADO.*Dados;*SENADO. *Relação;*SILVA, G. *Constituinte;*SILVA,\nH. *História;*SILVA, H. *1930;* SILVA, H. *1931;* SILVA, H.\n*1932;*SILVA, H. *1933;*SILVA, H. *1934;*SILVA, H. *1935;*SILVA, H.\n*1936;*SILVA, H. *1937;*SILVA, H.*1945;*SKIDMORE, T*. Brasil;\nSúmulas;*TÁVORA, J. *Vida.*\n\n \n\n \n","dic":"DHBB"}
