{"title":"MAGRI, Antônio","cargoss":["Presidente de associação ou confederação de empregados ou empregadores","Ministro do Trabalho"],"cargos_esp":["CGT","e Prev Soc"],"datas_ini":[1989,1990],"datas_fim":[1990,1992],"estados":[0,0],"autor":[0],"content":"**MAGRI, Antônio**\n\n\\*pres. CGT 1989-1990; min. Trab. e Prev. Soc. 1990-1992.\n\n \n\n*Antônio Rogério Magri*nasceu na cidade de Guarulhos (SP) no dia 26 de\noutubro de 1940, filho de Antônio Magri e Teresa Borsari Magri.\n\nSua vida profissional iniciou-se aos 15 anos de idade, quando ingressou\nna empresa São Paulo Light Serviços de Eletricidade incorporada,\nposteriormente, à Eletropaulo Serviços de Eletricidade S.A. Naquela\nempresa, Magri, que tinha o curso primário completo, cavava valetas por\nonde passavam os fios elétricos, ocupando essa função durante 18 anos.\n\nParticipando do movimento sindical, em 1977 tornou-se vice-presidente do\nSindicato dos Eletricitários de São Paulo. Em 1978, já como técnico\nadministrativo da Eletropaulo, Magri assumiu a presidência da entidade,\nque congregava cerca de 18 mil sócios, permanecendo na direção central\ndurante 12 anos consecutivos.\n\nAdepto do “sindicalismo de resultados” — corrente do movimento sindical\ndefensora da independência dos sindicatos em relação aos partidos\npolíticos, visando apenas à conquista das reivindicações econômicas dos\ntrabalhadores —, Magri passou a acumular em 1978 a secretaria geral do\nInstituto Cultural do Trabalho (ICT), entidade criada em 1963 sob o\npatrocínio do Departamento de Estado norte-americano com o objetivo de\nformar líderes sindicais no Brasil e ligada à American Federation of\nLabor e ao Congress of Industrial Organizations (AFL-CIO), poderosa\ncentral sindical norte-americana. Ao longo de sua gestão, os\neletricitários conquistaram o direito a estabilidade no emprego; jornada\nde 40 horas, em 1982; adicional de periculosidade (30% a mais no\nsalário) e delegados sindicais com direito a 30 dias de liberação por\nano por conta da empresa para exercer atividades no movimento sindical.\n\nEm maio de 1989, no II Congresso da Confederação Geral dos Trabalhadores\n(CGT), Magri foi eleito por aclamação presidente da entidade, que\nagregava mais de mil sindicatos de todo o país num total de 18 milhões\nde trabalhadores. Na ocasião, o candidato derrotado, o veterano\nsindicalista Joaquim dos Santos Andrade, acusou-o de receber ajuda\nfinanceira da AFL-CIO e de utilizar a violência para vencê-lo. Em\nsetembro, Magri, que acumulava a presidência do Sindicato dos\nEletricitários e a da CGT, desistiu de concorrer à reeleição para o\nsindicato sob o argumento de que precisava se dedicar mais à entidade\nnacional. Contudo, não deixou de prestar o seu apoio à chapa encabeçada\npor Elir Severino da Silva, que saiu vencedora no pleito.\n\nEm 1989, o país preparava-se para a realização das eleições diretas para\na presidência da República, após 25 anos de eleições pela via indireta.\nLançaram-se, no primeiro turno, candidatos de diferentes partidos.\nMagri, apesar de defender uma postura de independência da CGT em relação\nà eleição presidencial, manifestou, em novembro, o seu apoio pessoal ao\ncandidato Fernando Collor de Melo, do Partido da Reconstrução Nacional\n(PRN), por considerá-lo “o mais confiável” dos postulantes à\npresidência. Collor e o candidato do Partido dos Trabalhadores (PT), o\nlíder sindical Luís Inácio Lula da Silva, disputaram o segundo turno em\ndezembro seguinte, sagrando-se vencedor do pleito o candidato do PRN,\ncom 35 milhões de votos.\n\nAssumindo a presidência em 15 de março de 1990, Collor convidou Magri\npara compor seu ministério oferecendo-lhe a pasta do Trabalho e da\nPrevidência Social. Magri afastou-se, então, da presidência da CGT, que\npassou a ser ocupada por Francisco Canindé Pegado do Nascimento.\n\nApós o anúncio pela equipe econômica do governo do Plano de\nEstabilização Econômica (que ficou conhecido por Plano Collor), cujo\nobjetivo central era combater a inflação e reduzir o déficit público,\nMagri — que não fora consultado durante a sua elaboração — declarou\ntemer que o novo plano pudesse causar desemprego. Porém, ao receber, em\nBrasília, representantes de confederações de trabalhadores de todo o\npaís que tinham uma proposta para que o governo obrigasse o empresariado\na dar estabilidade por seis meses aos trabalhadores, o ministro do\nTrabalho, em nome do governo, negou-se a discutir essa reivindicação.\n\nNa prática, Magri mostrava-se afinado com a política trabalhista\nimplementada pelo governo, defendendo a livre negociação entre patrões e\nempregados sem a interferência do Estado e a não intromissão em greves\ndos trabalhadores motivadas pelas perdas salariais do Plano Collor. Como\nexemplo dessa nova postura, o ministro recusou-se a promover\ncomemorações no Dia do Trabalho. Em junho de 1990, contudo, a imprensa\nnoticiou o pedido de demissão de Magri, logo desmentido pelo ministro,\nque afirmava não se considerar discriminado pelo governo.\n\nEm julho, apesar da oposição de líderes sindicais, como Jair Meneguelli\nda Central Única dos Trabalhadores (CUT), Magri apoiou a Medida\nProvisória nº 193 que instituía uma política salarial provisória até o\nmês de agosto. A concessão de um abono para os trabalhadores que\nganhassem até três salários mínimos, não obstante ter sido inicialmente\naceita pelo ministro, foi em seguida rejeitada por Magri que a\nconsiderou negativa, “pois trazia de volta a memória inflacionária”. A\npolítica do ministro na área da Previdência Social pautou-se por essa\nmesma preocupação. Convencido pela ministra da Economia Zélia Cardoso de\nMelo, desistiu de reivindicar um abono de um salário mínimo, em agosto\nde 1990, para os aposentados. Com o objetivo de arrecadar recursos para\no pagamento das aposentadorias, o ministro propôs, no mesmo mês, um novo\nindexador para o cálculo das aposentadorias, baseado na cesta básica, e\nestender o piso de um salário mínimo para os trabalhadores rurais.\n\nDando início a essa nova política de benefícios, em novembro de 1990\nanunciou que os reajustes do 13º salário dos aposentados passariam a ser\nfeitos pelo cálculo da cesta básica e não pelo cálculo do salário mínimo\ncomo previa o projeto aprovado pelo Congresso Nacional, que para ele era\ninviável pois quadruplicariam os gastos da Previdência. Em dezembro,\ncontudo, voltou atrás. Na falta de uma decisão final sobre o projeto de\nconversão aprovado no Congresso, o governo optou por adotar a legislação\nanterior que mandava aplicar o mesmo reajuste concedido ao salário\nmínimo.\n\nEm março de 1991, denúncias sobre irregularidades na Previdência Social\nlevaram o presidente Collor a nomear o secretário da Administração, João\nSantana, interventor no Ministério do Trabalho e da Previdência Social e\nformar uma comissão para apurar as fraudes no Instituto Nacional de\nSeguridade Social (INSS). Em abril, um dossiê elaborado por Volnei\nÁvila, diretor de arrecadação e fiscalização do INSS, denunciou fraudes\nna Previdência, envolvendo procuradores, advogados e juízes, que,\nsegundo Volnei, já eram do conhecimento de Magri desde fevereiro.\n\nEm abril ainda, Magri depôs na Comissão de Seguridade da Câmara dos\nDeputados antecedendo à comissão parlamentar de inquérito (CPI) que se\ninstalou no mesmo período para averiguar as denúncias de irregularidades\nna Previdência. Após concluir seus trabalhos em maio, a CPI julgou Magri\ne o presidente do INSS, José Arnaldo Rossi, “passíveis de indiciamento\npor crime de responsabilidade”. A acusação contra o ministro referia-se\nao fato de ele não ter cumprido a obrigação legal de fazer publicar\ntrimestralmente a lista dos devedores da Previdência.\n\nA imagem do ministro, já desgastada por essas denúncias, agravou-se\nquando, em junho de 1991, ele viajou para Genebra, na Suíça, para\nparticipar da LXXVIII Conferência da Organização Internacional do\nTrabalho (OIT). Enquanto ocorria a cerimônia de abertura, Magri foi\nvisto fazendo compras nas ruas da cidade, quando deveria estar\nparticipando da solenidade como o principal representante do Brasil.\nNessa ocasião, Collor cogitou demitir o ministro. Porém, Magri\npermaneceu no cargo, mas uma importante função de sua pasta que era a de\nsupervisão do grupo gestor do Cadastro Nacional de Trabalhadores passou\nao encargo do secretário de Administração Federal, Carlos Garcia. Essa\nfoi a segunda “intervenção branca” que o ministério sofreu. A primeira\nfoi a entrega, para o então secretário de Administração João Santana, da\npresidência da comissão criada para investigar as fraudes na\nPrevidência, ocorridas poucos meses antes.\n\nNo mês seguinte, a equipe do ministério, liderada por Aluísio Azevedo,\npediu demissão. Aluísio foi o principal responsável pela formação da\nequipe de Magri e um dos ideólogos do chamado “sindicalismo de\nresultados”. Segundo Aluísio, as causas de sua saída estavam ligadas a\ndivergências com o grupo comandado por João Santana que vinha\ndificultando o trabalho de modernização que sua equipe tentava\nimplantar. Aluísio afirmou ainda que o ministro também deveria se\nretirar do governo, pois as fraudes haviam sido denunciadas\nindevidamente e tiveram como intenção atingi-lo. Magri contudo\npermaneceu no governo, mas à margem das principais discussões que\nenvolviam sua área, entre as quais a política salarial.\n\nEm agosto, o jornal *O Globo* noticiou que na ocasião em que o irmão do\npresidente, Leopoldo Collor, assumiu a presidência do PRN, o ministro\nAntônio Magri filiou-se a esse partido. Mais tarde, entretanto, Magri\nnegou ter se filiado a esse ou a qualquer partido político.\n\nEm janeiro de 1992, Volnei Ávila apresentou uma fita à imprensa, onde\nestava gravada uma conversa com Magri, em que o ministro confirmava o\nrecebimento de 30 mil dólares da construtora Norberto Odebrecht para a\nliberação de recursos do FGTS destinados a obras de saneamento do canal\nda Maternidade, no estado do Acre, obra orçada em 110 milhões de\ndólares. Magri foi demitido ainda em janeiro por Collor, sendo\nsubstituído por Reinhold Stephanes. Após deixar o governo, Magri voltou\na trabalhar na Eletropaulo.\n\nEm março de 1992, novas denúncias eram publicadas pela imprensa. Segundo\num ex-integrante da 1ª Junta de Recursos da Previdência Social, Nelson\nAntunes, o recesso de cinco meses do Conselho de Recursos da\nPrevidência, por decisão de Magri, publicada no *Diário Oficial*, fez\ncom que 20 mil processos relativos a dívidas com o INSS e pedidos de\nbenefícios em todo o país ficassem parados entre dezembro de 1990 e\nabril de 1991.\n\nEm outubro de 1992, após a saída de Collor da presidência, acusado de\nenvolvimento num amplo esquema de corrupção, Magri foi denunciado ao\nSupremo Tribunal Federal (STF), pelo procurador-geral da República\nAristides Junqueira, por crime de corrupção passiva no caso do\nfavorecimento da construtora Odebrecht. Porém, só em outubro de 1993 o\nSTF aceitou por unanimidade a denúncia do procurador.\n\nEm janeiro de 1993, Magri foi condenado a devolver aos cofres públicos\nos salários recebidos entre 15 de março de 1990 e 20 de janeiro de 1992\ncomo funcionário da Eletropaulo, pois era ministro e não podia acumular\ndois cargos públicos. Essa sentença foi anulada em 1995, por\nunanimidade, pela 8ª Câmara Cível do Tribunal de Justiça (TJ) de São\nPaulo, por considerar que a empresa não deveria ser considerada uma\nestatal, já que embora o Tesouro do Estado detivesse 51% das ações e o\ngoverno estadual tivesse o controle total sobre sua administração a\nEletropaulo estava sujeita ao regime jurídico das empresas privadas.\n\nEm fevereiro de 1996, a imprensa chegou a noticiar que Magri articulava\ncom um setor da Força Sindical a sua volta à direção da CGT, o que,\nentretanto, não ocorreu. Em agosto, aposentou-se na Eletropaulo e passou\na prestar consultorias a sindicatos, entre os quais o Sindicato dos\nTrabalhadores da Construção Civil de São Paulo e a Confederação Nacional\ndos Trabalhadores Metalúrgicos (CNTM).\n\nEm abril de 1997, a *Folha de S. Paulo* anunciava a sua possível\nabsolvição do crime de corrupção passiva por causa da precariedade das\nprovas da acusação.\n\nEm 1º de maio de 1998, compareceu às comemorações do Dia do Trabalho\npromovidas pela Força Sindical. Na ocasião, declarou taxativamente que\nnão voltaria à militância sindical.\n\n \n\nAntônio Rogério Magri casou-se com Isabel Magri, com quem teve um casal\nde filhos.\n\nMaria Carmina Monteiro\n\n \n\nFONTES:*Estado de S. Paulo* (9/7/91, 15/3/92, 1/10/93, 24/2/95, 22/6/97\ne 2/5/98);*Folha de S. Paulo* (26/6, 3, 10 e 12/7, 5/9/91, 1/10/93,\n23/2/94, 3/2/96, 15/6/97);*Globo* (7, 8 e 26/7, 20/8/91, 15/5, 6/8 e\n12/9/92), INF. BIOG.; *Jornal do Brasil* (8/8 e 4/9/91; 6/7 e 1/10/93,\n28/1/94); *Veja* (25/11/98, 5/5/00).\n\n \n","ref":"FONTES:*Estado de S. Paulo* (9/7/91, 15/3/92, 1/10/93, 24/2/95, 22/6/97\ne 2/5/98);*Folha de S. Paulo* (26/6, 3, 10 e 12/7, 5/9/91, 1/10/93,\n23/2/94, 3/2/96, 15/6/97);*Globo* (7, 8 e 26/7, 20/8/91, 15/5, 6/8 e\n12/9/92), INF. BIOG.; *Jornal do Brasil* (8/8 e 4/9/91; 6/7 e 1/10/93,\n28/1/94); *Veja* (25/11/98, 5/5/00).\n\n \n","dic":"DHBB"}
