{"title":"MAIA, Bonaparte","cargoss":["Deputado federal"],"cargos_esp":[0],"datas_ini":[1959],"datas_fim":[1963],"estados":["CE"],"autor":[0],"content":"**MAIA, Bonaparte**\n\n\\*dep. fed. CE 1959-1963.\n\n* *\n\n*Bonaparte São Domingos Pinheiro Maia* nasceu em Russas (CE) no dia 9 de\njaneiro de 1923, filho de Francisco Demondas Maia e Maria Carlota de\nSousa Andrade. Seu irmão, Salomão Mussolini Pinheiro Maia, foi deputado\nestadual no Ceará na legislatura 1959-1963.\n\nEstudou na Faculdade de Direito do Ceará. Em 1953 estabeleceu-se com uma\nfirma de importação e exportação de algodão, cera de carnaúba, máquinas\nde costura, arame farpado, arsênico, tecidos de linho e conhaque, entre\noutros artigos. Obteve algumas licenças da Carteira de Exportação e\nImportação (Cexim) do Banco do Brasil, mas pouco depois da extinção\ndesse órgão, em dezembro de 1953, e de sua substituição pela Carteira de\nComércio Exterior (Cacex), foi acusado de realizar contrabando e\nimportações fraudulentas. Seguiram-se outras denúncias da mesma natureza\ne o caso alcançou repercussão na imprensa e no Legislativo estadual e\nnacional. Levado ao tribunal, este concluiu pela lisura das negociações\nde Bonaparte Maia, isentando-o de qualquer responsabilidade criminal.\n\nNo pleito de outubro de 1958, elegeu-se deputado federal pelo Ceará na\nlegenda da Coligação Democrática, constituída pela União Democrática\nNacional (UDN), o Partido Social Progressista (PSP), o Partido de\nRepresentação Popular (PRP), o Partido Republicano (PR) e o Partido\nTrabalhista Nacional (PTN). Assumindo o mandato em fevereiro do ano\nseguinte, defendeu a valorização do vale do rio Jaguaribe mediante a\nextração, por métodos técnicos e científicos, da cera de carnaúba,\nabundante naquele local, bem como o incentivo à cultura do algodão-mocó.\nPregou também a pressão sobre os poderes competentes para que o combate\nà seca deixasse de ser feito apenas no sentido de remediar esse flagelo\ne se tornasse capaz de superar o fenômeno cíclico, evitando assim que se\ndepauperasse a economia cearense. Concluiu o mandato em janeiro de 1963,\nnão mais voltando a concorrer a cargos eletivos. A partir do ano\nseguinte, tornou-se corretor de imóveis no Rio de Janeiro, atividade a\nque se dedicou até 1987, ano em que se aposentou.\n\nFoi também jornalista e fundador de *O Jornal,*de Fortaleza, dirigido\npor seu irmão Salomão Maia.\n\nFaleceu no início de março de 2002.\n\nEra casado com Maria Amélia Maia, com quem teve 11 filhos. Seu sobrinho\nBismarck Pinheiro Maia exerceu mandato de deputado estadual e, em 2002,\nelegeu-se deputado federal pelo Ceará na legenda do Partido da Social\nDemocracia Brasileira (PSDB).\n\nFONTES: CÂM. DEP. *Deputados;*CÂM. DEP. *Relação dos dep.;*CÂM. DEP.\n*Deputados brasileiros. Repertório* (1946-1967); INF. BIOG.; TRIB. SUP.\nELEIT. *Dados* (4); VAITSMAN, M. *Sangue*.\n\n \n","ref":"FONTES: CÂM. DEP. *Deputados;*CÂM. DEP. *Relação dos dep.;*CÂM. DEP.\n*Deputados brasileiros. Repertório* (1946-1967); INF. BIOG.; TRIB. SUP.\nELEIT. *Dados* (4); VAITSMAN, M. *Sangue*.\n\n \n","dic":"DHBB"}
