{"title":"MAIA, César","cargoss":["Constituinte","Deputado federal","Prefeito","Prefeito"],"cargos_esp":[0,0,"Rio de Janeiro","Rio de Janeiro"],"datas_ini":[1987,1987,2001,1993],"datas_fim":[1988,1992,2009,1997],"estados":[0,"RJ",0,0],"autor":[0],"content":"**MAIA, César**\n\n\\*const. 1987-1988; dep. fed. RJ 1987-1992; pref. Rio de Janeiro\n1993-1997, 2001-2009.\n\n \n\n*César Epitácio Maia* nasceu na cidade do Rio de Janeiro, então Distrito\nFederal, no dia 18 de junho de 1945, filho do engenheiro e ex-diretor da\nCasa da Moeda Felinto Epitácio Maia e de Dalila Maia. Seu primo,\nLavosier Maia foi governador do Rio Grande do Norte (1979-1983),\nconstituinte (1987-1988), senador (1987-1991) e deputado federal eleito\nem outubro de 1998.\n\nCésar Maia fez o curso primário no Instituto de Educação entre 1950 e\n1954 e o ginásio nos colégios Santo Inácio e Padre Antônio Vieira, entre\nos anos de 1955 e 1960, todos no Rio de Janeiro. Iniciou o curso\ncientífico em 1960, no Colégio Padre Antônio Vieira, concluindo-o em\n1964. No ano seguinte, fez o vestibular no curso Vetor, ingressando em\n1966 no curso de engenharia da Escola de Minas de Ouro Preto (MG), no\nqual permaneceu até 1968.\n\nIniciou suas atividades políticas na União Nacional dos Estudantes (UNE)\ntendo sido preso e processado em 1969. Na ocasião, abandonou a faculdade\nde engenharia de Ouro Preto e exilou-se no Chile, onde permaneceu de\n1969 a 1973. Nesse período, casou-se com a chilena Mariangeles Ibarra\nPizarro, com quem teve os gêmeos Rodrigo Felinto e Daniela Dalila.\n\nDe volta ao Brasil, ratificou seu curso de economia na Faculdade\nBennett, no Rio (1973-1974). Em 1974 passou a trabalhar no grupo Klabin\ne no ano seguinte ingressou na Universidade Federal Fluminense como\nprofessor licenciado em macroeconomia, lecionando até 1976. Neste\nperíodo foi diretor do Instituto dos Economistas do Rio de Janeiro\n(IERJ).\n\nEm 1982 saiu do grupo Klabin e filiou-se ao Partido Democrático\nTrabalhista (PDT), onde assumiu a coordenação econômica da campanha de\nLeonel Brizola, candidato da agremiação ao governo do Rio de Janeiro.\nTeve atuação decisiva na descoberta do esquema Proconsult, montado para\nfraudar a contagem de votos nessa eleição, em benefício de Wellington\nMoreira Franco, candidato do Partido Democrático Social (PDS). Com a\nvitória de Brizola, Maia ocupou o cargo de secretário de Fazenda no\nperíodo 1983-1986.\n\nEm sua gestão, César Maia desenvolveu um programa de saneamento\nfinanceiro do governo e tomou uma série de medidas visando ao\ndesenvolvimento econômico do estado, destacando-se o incentivo a\nempresas de médio e pequeno portes próximas da insolvência e a\nredistribuição do Imposto sobre Circulação de Mercadorias (ICM) em\nbenefício de municípios anteriormente marginalizados. Foi também membro\ndos conselhos administrativos da Companhia Metropolitana do Estado do\nRio de Janeiro (Metrô) e do Banco de Desenvolvimento do Rio de Janeiro\ndurante o período 1982-1985. Em 1986, César Maia cumpriu missão oficial\nna Grã-Bretanha, a convite do governo daquele país.\n\nFrustrado em sua tentativa de sair candidato à sucessão de Brizola — a\nconvenção do PDT lançou o então secretário da Ciência e Cultura e\nvice-governador, Darci Ribeiro — César Maia disputou uma cadeira na\nCâmara Federal. A expressiva votação obtida no pleito de novembro de\n1986 — obteve 93.045 votos —, o situava como o deputado mais votado do\nPDT e o terceiro entre todos os candidatos do estado.\n\nLogo depois de eleito, em dezembro, César Maia assumiu interinamente a\npresidência do Banco do Estado do Rio de Janeiro (Banerj), substituindo\nCarlos Augusto de Carvalho, que se demitira devido a divergências quanto\nà venda de um terreno do banco localizado na avenida Paulista, em São\nPaulo. Sua permanência no Banerj teve duração breve, até o final deste\nmês, quando o Tribunal Regional Eleitoral (TRE) concedeu diploma aos\ndeputados eleitos. Durante este curto período, Maia agilizou a venda do\nterreno em questão.\n\nNA CÂMARA DOS DEPUTADOS\n\nAssumindo o mandato em fevereiro de 1987, quando se iniciaram os\ntrabalhos da Assembléia Nacional Constituinte, integrou como membro\ntitular a Subcomissão de Defesa do Estado, da Sociedade e de sua\nSegurança, da Comissão da Organização Eleitoral, Partidária e Garantia\ndas Instituições e, como suplente, a Subcomissão do Sistema Financeiro,\nda Comissão do Sistema Tributário, Orçamento e Finanças e da Comissão de\nSistematização.\n\nDurante o exercício do mandato, Maia notabilizou-se pelas discussões de\ntemas econômicos, tendo apresentado à Comissão de Orçamento e Finanças\ndo Congresso Nacional uma série de emendas ao texto da Lei Orçamentária\nproposta pelo Executivo. Em linhas gerais, estas emendas visavam\ndiminuir a flexibilidade da execução do orçamento pelo governo,\nprevendo, entre outras medidas, a restrição dos 25% de créditos\nadicionais a que o governo tinha direito na execução do orçamento, além\ndo valor aprovado pelo Congresso. Também foi proposta a proibição da\nincidência de correção monetária nas faturas de empreiteiras que\nfizessem obras para a União e nos precatórios.\n\nNo que se refere ao debate constituinte, Maia foi favorável ao\nrompimento de relações diplomáticas com países com política de\ndiscriminação racial, à limitação ao direito de propriedade privada, ao\nmandado de segurança coletivo, à remuneração 50% superior para o\ntrabalho extra, à jornada semanal de 40 horas, ao turno ininterrupto de\nseis horas, ao aviso prévio proporcional, à unicidade sindical, à\nsoberania popular, ao voto aos 16 anos, ao presidencialismo, à\nestatização do sistema financeiro, à nacionalização do subsolo, à\nproibição do comércio de sangue, à desapropriação da propriedade\nprodutiva e à estabilidade no emprego; votou contra a pena de morte, a\npluralidade sindical, o limite de 12% ao ano para os juros reais, o\nmandato de cinco anos para o presidente José Sarney, a limitação para os\nencargos da dívida externa e a anistia aos micro e pequenos empresários.\nAbsteve-se na votação sobre o aborto. Após a promulgação da nova Carta\nConstitucional (5 de outubro de 1988), voltou a participar dos trabalhos\nlegislativos ordinários na Câmara dos Deputados, como vice-presidente da\nComissão Mista (Câmara e Senado) de Orçamento, membro titular da\nComissão de Finanças e Tributação e suplente da Comissão de Defesa\nNacional.\n\nA partir de agosto de 1989, tornou-se evidente o progressivo\ndistanciamento de César Maia da linha de conduta definida pelo PDT.\nNeste mês, a assessoria do candidato à presidência da República pelo\nPartido da Reconstrução Nacional (PRN), Fernando Collor de Melo,\ninformou à imprensa o encontro ocorrido entre este e César Maia.\nSurpreendido com o vazamento da informação, Maia, que estava\nmarginalizado da campanha presidencial de Brizola, não desmentiu a\nnotícia. Segundo ele, Collor teria mostrado interesse em conhecer seu\nprograma econômico intitulado “Desobstrução”, que futuramente iria\npropor ao PDT para que fosse incorporado ao plano de governo. Maia\ndeclarou, na ocasião, ter efetivamente recebido um convite de Collor\npara compor sua assessoria econômica, ao lado de Zélia Cardoso de Melo.\nNa verdade, segundo Maia confidenciaria um ano depois desse episódio,\nCollor chegara a lhe fazer um convite para acompanhá-lo como assessor a\nNova Iorque, que não foi aceito. No pleito de novembro/dezembro de 1989,\nFernando Collor foi eleito presidente da República, derrotando, no\nsegundo turno, o candidato do Partido dos Trabalhadores (PT), Luís\nInácio Lula da Silva. Leonel Brizola, do PDT, tinha alcançado a terceira\ncolocação no primeiro turno.\n\nEm campanha pela reeleição, em setembro de 1990, Maia defendeu\npublicamente o plano econômico implementado pela então ministra Zélia\nCardoso de Melo, o Plano Collor II, tornando-se alvo de pesadas críticas\ndo PDT. Reeleito para a Câmara dos Deputados por esta legenda em outubro\ndeste ano, César Maia iniciou novo mandato em fevereiro de 1991,\nparticipando dos trabalhos legislativos como membro titular da Comissão\nde Economia, Indústria e Comércio e suplente da Comissão de Finanças e\nTributação.\n\nEnquanto isso, as divergências entre Maia e a bancada do PDT\nampliavam-se para além das considerações sobre medidas econômicas,\npassando a envolver questões relativas à ética e à fidelidade\npartidária. Por diversas vezes, César Maia contrariou a bancada regional\ndo PDT. Em janeiro de 1991, a bancada foi surpreendida com o lançamento\nde sua candidatura à liderança do partido, quando todos davam como certa\na vitória do até então candidato único Vivaldo Barbosa. A posição\nindependente de Maia chegou a contrariar até a executiva nacional do\nPDT, principalmente com sua insistência em disputar o governo do Rio de\nJaneiro, que o partido reservara para Leonel Brizola. As divergências\nentre Maia e a liderança do PDT resultaram no seu desligamento\nespontâneo ainda no segundo bimestre de 1991.\n\nApós o rompimento com o PDT, César Maia filiou-se ao Partido do\nMovimento Democrático Brasileiro (PMDB) em maio de 1991. No ano\nseguinte, candidatou-se à prefeitura do Rio de Janeiro, apoiado pela\ncoligação Pensa Rio, que reunia o PMDB e o Partido Liberal (PL). Durante\na campanha, Maia procurou desvincular sua imagem de duas importantes\nlideranças nacionais do PMDB que estavam sendo duramente contestadas\npela opinião pública, o ex-governador Wellington Moreira Franco, que\nterminara a sua gestão com uma imagem bastante desgastada no Rio de\nJaneiro, e o ex-governador de São Paulo, Orestes Quércia, envolvido no\nescândalo financeiro no caso VASP. Tentando neutralizar estas\ninfluências, César Maia se esforçou em relacionar a sua filiação ao PMDB\na articulações com Ulisses Guimarães e Ibsen Pinheiro.\n\nDisputando a prefeitura com as favoritas Cidinha Campos, candidata do\nPDT, e Benedita da Silva, candidata do PT, César Maia surpreendeu ao\nobter votos suficientes para concorrer ao segundo turno das eleições,\njuntamente com Benedita da Silva. Fator importante neste processo foi o\napoio das principais lideranças regionais do Partido da Social\nDemocracia Brasileira (PSDB), arregimentadas pelo candidato da legenda,\no deputado estadual Sérgio Cabral Filho, derrotado no primeiro turno,\nmais o vereador Sérgio Cabral e o ex-jogador de futebol do Vasco da Gama\ne também vereador Roberto Dinamite. Em novembro, no segundo turno das\neleições, Maia obteve a adesão dos “marcelistas” — militantes pedetistas\nligados ao prefeito do Rio, Marcelo Alencar.\n\nCom o acirramento da disputa eleitoral no segundo turno, César Maia\nadotou uma postura mais agressiva contra a candidata do PT. Procurando\nassociar o partido ao crime organizado no Rio de Janeiro, César Maia\nchegou a acusar um vereador eleito pelo PT de ter tido sua campanha\nfinanciada por traficantes de drogas. A liderança do PT na Câmara reagiu\nprometendo entrar com uma interpelação judicial contra Maia que, no\nentanto, jamais citou o nome do vereador acusado, limitando-se apenas a\nexcluir da acusação o vereador Jorge Bittar, que havia sido campeão\nabsoluto da eleição para o Legislativo municipal. Maia acusou ainda a\nCentral Única dos Trabalhadores (CUT) e o PT como responsáveis pela\ngreve ocorrida naquele período no Banerj. No entanto, se Maia perdeu\nvotos dos sindicalistas ligados à CUT, em outubro de 1992 o presidente\nda Força Sindical, Luís Antônio Medeiros, anunciou apoio oficial à sua\ncandidatura. Dessa forma, abria-se para César Maia a adesão de cerca de\n30 federações e sindicatos importantes no Rio de Janeiro, entre eles os\nrodoviários e os funcionários da saúde, filiados à Força Sindical, bem\ncomo a ala sindical ligada ao PDT.\n\nNo pleito de novembro****de****1992,****César****Maia elegeu-se prefeito\ndo Rio com 1.430.797 votos (51,89%) contra 1.362.678 votos (48,11%) para\nBenedita da Silva. Renunciando ao mandato na Câmara dos Deputados em\ndezembro, assumiu o executivo municipal em 1º de janeiro de 1993, munido\nde blocos de multa, capa de chuva e botas. Desta forma, procurava\ndemonstrar a intenção de se aproximar do cotidiano da cidade, multando\nos infratores do trânsito e acompanhando de perto os possíveis danos\ncausados pelos temporais que a cada verão causavam mais estragos à\ncidade.\n\n \n\nA PRIMEIRA VEZ À FRENTE DA PREFEITURA DO RIO DE JANEIRO\n\nÀ frente da prefeitura, César Maia se esforçou por buscar espaço nos\nmeios de comunicação, a fim de fixar uma imagem de homem político que\nassociava o estilo “fiscal de costumes de Jânio Quadros” ao de\n“estrategista e tocador de obras de Carlos Lacerda”. Nessa linha,\ncompletou o segundo ano de mandato (1993-1994) tendo acumulado uma boa\nquantia em caixa (quase um bilhão de reais) como resultado de um\nrigoroso controle das despesas da prefeitura, seja pela contenção de\nobras, seja pelo aumento e pela revisão de tributos. A intenção de Maia\ncom toda essa economia era concluir, até o final de 1996, um volume de\nobras quatro vezes superior ao realizado pela administração do seu\nantecessor Marcelo Alencar.\n\nNo que se refere ao programa de obras, a prefeitura implementou o\nProjeto Rio Cidade, que compreendeu a urbanização de 19 bairros das\nzonas Sul, Norte e Oeste, com mudanças na iluminação e sinalização,\nreformas de praças e calçadas, melhoria do sistema viário, ampliação do\nhorário comercial, construção de marcos e monumentos, entre outras\nobras. O projeto previa ainda a conclusão da Linha Amarela, rodovia de\nligação entre a Barra da Tijuca e a ilha do Fundão e também a ampliação\ndo Metrô, entre os bairros de Botafogo e Copacabana. Idealizados pelo\nsecretário de Urbanismo do município, Luís Paulo Conde, o Rio Cidade e o\nFavela Bairro deram grande visibilidade à administração de César Maia. O\nRio Cidade tinha como meta a requalificação dos eixos estratégicos de\ncirculação viária, promovendo a melhoria da infra-estrutura e o\nfuncionamento característico daquelas áreas; por sua vez, o projeto\nFavela-Bairro visava integrar as comunidades de baixa renda aos bairros\nnos quais encontravam-se inseridas, com a implementação de serviços como\nágua e esgoto, calçamento e arborização dos espaços públicos, construção\nde postos de saúde e creches entre outros serviços.\n\nCésar Maia recebeu críticas pela forma como foram utilizados os recursos\nque conseguiu economizar durante os dois primeiros anos de mandato. O\nSindicato Estadual dos Profissionais de Educação do Rio de Janeiro\n(SEPE) e o Sindicato dos Médicos do Rio de Janeiro (Sinmed) chegaram a\nanunciar, em abril de 1995, a intenção de impetrar uma ação judicial\ncontra o prefeito, denunciando a aplicação de um enorme volume de verbas\nem obras de remodelação da cidade (71,45 % do saldo do Tesouro\nmunicipal), em detrimento do investimento na manutenção de hospitais e\nescolas e na melhoria dos salários de médicos e professores.\n\nOutra questão polêmica que envolveu o programa Rio Cidade foi a\ninsatisfação gerada pelo transtorno causado no trânsito, com a execução\nde obras simultâneas em diferentes pontos da cidade. Por sua vez, os\nprofissionais favoráveis ao Plano Estratégico da Cidade, avaliaram que\nas ações encampadas pela prefeitura apresentavam como pontos positivos a\neliminação de barreiras à mobilidade dos pedestres, o resgate da\nidentidade de cada bairro e a valorização do meio ambiente,\nredimensionando toda a cidade segundo parâmetros técnicos brasileiros de\nacessibilidade para deficientes físicos e visuais e também para\ngestantes e idosos.\n\nUma das prioridades de seu governo e que gerou muita polêmica, foi o\ncombate ao comércio ambulante, que acabou sendo reduzido de 40 mil para\ndez mil ao longo de quatro anos de fiscalização intensiva. Depois de\ninaugurar um espaço reservado para os vendedores ambulantes, chamado de\n“camelódromo” na rua Uruguaiana, no centro da cidade, o prefeito\nimplementou uma política de repressão ao comércio ambulante. Além disso,\npromoveu uma ação de fiscalização e reassentamento dos camelôs,\nrecadastrando-os por meio do Serviço de Licenciamento e Fiscalização do\nMunicípio, desobstruindo vários logradouros públicos, em especial nos\nbairros da Zona Sul, Ilha do Governador e subúrbios da cidade.\n\nEm termos administrativos, sua gestão na prefeitura foi marcada por um\nprograma de terceirização que consistiu no repasse de serviços públicos\na empresas privadas, e pela adoção de medidas na linha da reengenharia —\ndefendendo a substituição do modelo verticalizado, com muitas funções de\ncontrole e altamente burocratizado, por uma organização supostamente\nmais flexível, ágil e descentralizada.\n\nEm maio de 1995, César Maia desligou-se do PMDB, alegando que a\nagremiação não possuía um programa de governo definido. Em seguida,\nassinou sua ficha de filiação ao Partido da Frente Liberal (PFL).\n\nNa sucessão para a prefeitura do Rio, declarou-se, inicialmente,\nfavorável a uma coligação entre o PSDB, o PFL e o Partido Progressista\nBrasileiro (PPB), com o intuito de derrotar nas urnas os partidos de\nesquerda como o PT, o PDT, o Partido Comunista do Brasil (PCdoB) e o\nPartido Socialista Brasileiro (PSB). Frente ao apoio explícito do\ngovernador do estado, Marcelo Alencar (PSDB) à candidatura de Sérgio\nCabral Filho, como cabeça de chapa da coligação, César Maia expressou\nsua rejeição ao nome de Cabral, optando por lançar candidatura própria\ndo PFL.\n\nEm 21 de agosto de 1996, aproveitando uma visita à ilha de Paquetá para\ninauguração do Parque Darke de Matos, lançou como candidato à sua\nsucessão o secretário de Urbanismo Luís Paulo Conde, qualificando-o como\no nome ideal para o cargo, “por ser técnico com experiência política e o\núnico capaz de dar continuidade aos principais projetos de meu governo”.\n\nPrincipal estrategista da campanha de Conde, César Maia promoveu a\npolarização prefeito/governador, fazendo pesadas críticas à\nadministração de Marcelo Alencar no governo do estado. Dessa forma,\nvalorizava a administração municipal em detrimento da estadual, deixando\npara Conde a tarefa de apresentar projetos de continuidade e de\nrenovação urbanas, evitando assim o desgaste político de seu candidato.\nPor outro lado, as inaugurações de obras do Rio Cidade como a\nremodelação da praça Sãens Pena, na Tijuca, e do campo de São Cristóvão,\nrealizadas em setembro de 1996, com a presença de Maia e Conde, foram\noutra estratégia favorável à ascensão do candidato do PFL.\n\nAinda em setembro, César Maia foi agraciado com o Prêmio “Prefeito para\na Paz”, da UNESCO, criado para estimular trabalhos executados em âmbito\nmunicipal no aprimoramento da democracia, através da educação. Nessa\nmesma época reinaugurou o Museu da Cidade, na Gávea, cujo prédio,\npraticamente em ruínas, fora repassado pelo governo estadual à\nprefeitura, que executou as obras de restauração. Entre outras medidas\nde relevo na área cultural, César Maia determinou o tombamento de obras\nde arte e de documentos históricos e literários de órgãos públicos,\nvisando preservar os acervos das empresas públicas do município\npassíveis de privatização. A medida, publicada no *Diário Oficial*\n(Decreto nº 14.998 de 25/10/1996) tinha em vista, sobretudo, regrar o\nuso (comercialização, transferência para outros locais etc.) de acervos\ncomo os do Banerj, composto por obras de Di Cavalcanti, Goeldi e Cícero\nDias.\n\nCésar Maia chegou ao final de seu mandato com alto índice de aprovação\n(cerca de 68%), segundo pesquisa realizada pelo Ibope e publicada no\njornal *O Globo* do dia 26 de maio de 1996.\n\nA vitória de Luís Paulo Conde em novembro de 1996, no segundo turno das\neleições, representou uma ampliação do espaço político de César Maia,\nconquistando um lugar junto ao seleto grupo de lideranças nacionais do\nPFL. Graças à popularidade alcançada por Maia, o PFL logrou eleger um\nprefeito numa região na qual não tinha a menor tradição: o Sudeste. Por\nesse motivo, ele foi apontado pela executiva nacional do PFL como\nalternativa do partido à sucessão ao governo estadual de 1998, sendo\naventado, inclusive, para concorrer à sucessão presidencial em 2002.\n\nEm 5 de dezembro de 1996, César Maia foi escolhido para coordenar o\nprojeto PFL 2000, cujo objetivo era articular o partido nacionalmente,\nconquistando espaço no Sudeste e no Sul, e levar o partido à sucessão\npresidencial, em 2002. Na ocasião, Maia defendeu o uso de *marketing*\neleitoral já no ano seguinte, como estratégia para preparar candidaturas\nbem-sucedidas nas eleições de outubro de 1998. Assumiu ainda a tarefa de\ncoordenar uma ação localizada no Espírito Santo, Rio de Janeiro, São\nPaulo e Minas Gerais, para eleger o maior número possível de deputados\nfederais e estaduais.\n\nAinda este mês, César Maia formalizou seu apoio à reeleição do\npresidente Fernando Henrique Cardoso, dispondo-se a assumir o papel de\narticulador de sua recondução à presidência da República em outubro de\n1998, junto aos parlamentares do Rio de Janeiro.\n\nNA CAMPANHA PARA O GOVERNO DO ESTADO\n\nEm janeiro de 1997, César Maia iniciou a campanha ao governo do estado,\nprocurando ampliar suas bases eleitorais no interior do estado, onde o\nPFL obtivera um desempenho insignificante do ponto de vista eleitoral.\nAinda este mês, passou a trabalhar em sua agência de *marketing*\npolítico, a Factóides e Factóides, procurando garantir uma exposição\ncontínua na mídia. Em uma de suas primeiras declarações de campanha,\nCésar Maia destacou três metas prioritárias: emprego, segurança e a\nquestão social, subdividida em habitação e saúde, demonstrando o empenho\nna formulação de um plano de segurança baseado na combinação de medidas\ncomo a prevenção e a repressão, tal como atuavam as polícias de Nova\nIorque e Túnis. Outra preocupação do candidato foi a ampliação de suas\nbases eleitorais nas regiões da baixada fluminense e no interior do\nestado, anunciando dois grandes trunfos políticos de sua campanha: a\nextensão dos programas de remodelação urbanística Rio Cidade e Favela\nBairro para essas regiões.\n\nVisando evitar constrangimentos à reeleição do presidente Fernando\nHenrique Cardoso, as lideranças dos dois partidos que constituíam a base\nde sustentação do governo federal (o PSDB e o PFL) buscaram promover, no\nRio de Janeiro, a aproximação entre Maia e o governador Marcelo Alencar,\nproposta que feria as estratégias de campanha do candidato do PFL. No\nentanto, a retirada de Marcelo Alencar da disputa pelo governo do estado\nem maio de 1998, abrindo mão de sua reeleição, atenuou o embate entre os\ndois partidos, que, mesmo assim, não se aliariam na eleição. Ao mesmo\ntempo, a aliança entre o PT e o PDT em nível nacional — com a\ncandidatura de Lula (PT) para presidente e de Leonel Brizola (PDT) para\nvice — e, em nível estadual, com Anthony Garotinho (PDT) ao governo do\nestado do Rio de Janeiro e Benedita da Silva (PT) como vice, depois da\nanulação, pelo diretório nacional do PT, da candidatura de Vladimir\nPalmeira —, modificaram o quadro da disputa eleitoral.\n\nMesmo com a entrada na disputa do vice-governador do Rio de Janeiro,\nLuís Paulo Correia da Rocha, indicado por Marcelo Alencar para assumir\nseu lugar como candidato da chapa Rio Real, formada pelo PSDB, PMDB, PL\ne Partido Social Democrático (PSD), a campanha acabou ficando polarizada\nentre César Maia (candidato da chapa Governo de Verdade, formada pelo\nPFL, Partido Trabalhista Brasileiro (PTB) e PPB) e Anthony Garotinho\n(representante da chapa Muda Rio, formada pelo PDT, PT, PSB, Partido\nComunista Brasileiro (PCB) e PCdoB), com vantagem para este último, que\nlideraria a maioria das pesquisas eleitorais até o pleito de outubro.\nContando com o apoio do presidente Fernando Henrique Cardoso, César\nMaia, contudo, teve que dividi-lo com Luís Paulo Correia da Rocha, em\nnome da aliança nacional entre PSDB e PFL. Em suas visitas ao Rio, o\npresidente teria que subir nos dois palanques eleitorais e pedir voto\npara os dois candidatos nos programas de rádio e televisão.\n\nUtilizando-se bastante do *marketing* político durante a campanha\neleitoral, através de declarações polêmicas, no que ficou conhecido como\n“os factóides do César Maia”. Durante o horário eleitoral gratuito de\nrádio e televisão, Maia procurou sempre associar seu principal\nadversário ao ex-governador Leonel Brizola, enfatizando principalmente o\nsuposto fracasso daquele governo na questão da segurança pública.\n\nApesar das previsões de alguns institutos de pesquisa de derrota já no\nprimeiro turno do pleito, César Maia foi indiretamente beneficiado pela\nexpressiva votação de Luís Paulo Correia da Rocha, que obteve 1.020.765\nvotos (15,51%). Dessa forma, os 2.256.815 votos (34,30%) dados a Maia\nforam suficientes para que ele disputasse o segundo turno com Anthony\nGarotinho, que alcançou o primeiro lugar, com 3.083.441 votos (46,86%).\nCom a divisão dos partidários da candidatura de Luís Paulo Correia da\nRocha no apoio aos dois concorrentes, no segundo turno, realizado ainda\nem outubro, César Maia acabou sendo derrotado por Anthony Garotinho por\num placar de 3.087.117 (42,02%) a 4.259.344 votos (57,98%).\n\n \n\nAPÓS DEIXAR A PREFEITURA\n\nEm março de 1999 César Maia tornou-se membro do Conselho da Petrobras.\nDurante o primeiro semestre deste ano, Maia começou a se desentender com\no prefeito do Rio e até então seu afilhado político, Luís Paulo Conde,\nque conquistava progressivamente mais espaço no PFL do Rio, praticamente\ncindido entre dois grupos políticos. Declarando-se sem espaço na\nagremiação e, sobretudo, sem apoio majoritário para lançar-se candidato\nà prefeitura do Rio no pleito de outubro de 2000, Maia deixou o PFL em\nagosto de 1999, logo ingressando no PTB, juntamente com seu filho,\nRodrigo Maia, e alguns deputados estaduais e vereadores do seu grupo\npolítico.\n\nEm junho de 2000 o PTB homologou a candidatura de César Maia para a\nPrefeitura do Rio nas eleições de outubro daquele ano. Formada por uma\nfrente de partidos, que incluía o PL e o Partido Popular Socialista\n(PPS), entre outras dez pequenas legendas, a candidatura de Maia recebeu\no apoio, em julho, do candidato a presidente da República pelo PPS, Ciro\nGomes. Em outubro, realizado o pleito, Maia ficou em segundo lugar,\ncredenciando-se para a disputa do segundo turno com Conde. Leonel\nBrizola, candidato pelo PDT, ficou apenas em quarto lugar na disputa.\n\nEm busca de apoios para o segundo turno, Maia cortejou o PV, que o\napoiou, além de PT e PDT, que preferiram a neutralidade. Ainda em\noutubro, Maia anunciou que entraria com uma representação no TRE,\nsolicitando o envio de tropas federais para assegurar a realização do\nsegundo turno das eleições, marcadas para o dia 29 daquele mês, sob a\nalegação de que o então governador, Anthony Garotinho (1999-2002), do\nPDT, que declarou apoio a Conde, estaria interferindo indevidamente no\nprocesso eleitoral. O ex-prefeito acusou o governador de insultá-lo.\n\n \n\nA SEGUNDA VEZ À FRENTE DA PREFEITURA DO RIO DE JANEIRO\n\nRealizado o pleito, Maia elegeu-se prefeito da cidade do Rio pela\nsegunda vez, com pequena margem de votos sobre o seu concorrente.\nConfirmada a sua vitória pelo TRE, o prefeito eleito afirmou que a\nsegurança e o meio-ambiente seriam as prioridades do seu governo. Maia\ndisse ainda, na ocasião, que pretendia colaborar com o governo do Estado\npara reduzir os índices de violência na capital e, ainda, transformaria\na cidade em um pólo de desenvolvimento com dimensão nacional. No último\ndia do mês de outubro, Maia foi convidado pelo presidente nacional do\nPPS, Roberto Freire, para ingressar nas fileiras da legenda. Descartou a\nmudança de partido, mas reafirmou o compromisso com a candidatura à\npresidência da República de Ciro Gomes.\n\nNo dia 6, o presidente nacional do PTB, o deputado federal Roberto\nJefferson, ameaçou Maia de expulsão da legenda caso mantivesse o seu\napoio à candidatura de Inocêncio de Oliveira (PFL) para a presidência da\nCâmara dos Deputados, contra a candidatura de Aécio Neves (PSDB),\napoiada pelo partido. Maia, porém, classificou o seu apoio como de\ncaráter estritamente pessoal e disse não ver motivos para a sua saída\nespontânea ou expulsão do partido.\n\nEm maio, no entanto, com vistas às eleições presidenciais do ano\nseguinte, já estavam avançadas as articulações para o retorno de Maia ao\nPFL como possível candidato a presidente da República em 2002. Seu\nretorno, porém, esbarrava na objeção declarada de Conde no diretório do\nRio. Ainda assim, em junho consumou-se o retorno de Maia à antiga sigla,\na despeito de Conde, que tentou impugnar a filiação do desafeto, sem\nsucesso, o que ocasionou, em seguida, a sua saída da legenda.\n\nAinda neste mês o prefeito assumiu publicamente que estava se\naproximando politicamente do presidente Fernando Henrique Cardoso, no\nmesmo passo em que se distanciava da candidatura à presidência do antigo\naliado, Ciro Gomes. Ainda em junho demitiu, por e-mail, o secretário de\nSaúde Sérgio Arouca (PPS-RJ), nomeando em seguida para o cargo o\ndeputado federal Ronaldo César Coelho (PSDB-RJ).\n\nComo um dos principais nomes da executiva nacional do PFL e articulador\nda oposição ao governador do Rio e presidenciável, Anthony Garotinho, em\noutubro Maia lançou o deputado federal e então secretário de Meio\nAmbiente da cidade do Rio, Eduardo Pais (PFL-RJ), à sucessão estadual de\n2002.\n\nEm dezembro de 2001, como um dos mentores e principal articulador da\npré-candidatura da então governadora do Maranhão, e filha do senador\nJosé Sarney (PMDB-AP), Roseana Sarney (PFL-MA), à presidência da\nRepública, Maia admitiu a intenção do partido por uma candidatura\nprópria em 2002, mas não descartou a costura de alianças e uma possível\ndesistência em favor de um candidato melhor colocado e com chances reais\nde vitória à época do pleito. Maia, no entanto, considerou inexistente a\npossibilidade de apoio do PFL à candidatura de José Serra (SP), virtual\ncandidato, à época, pelo PSDB, à sucessão de Fernando Henrique.\n\nEm 1º de março, uma investigação da Polícia Federal descobriu,\nsupostamente escondidos, 1,34 milhões de reais, em dinheiro, na sede da\nempresa Lunus Serviço e Participações Ltda., em São Luís, Maranhão, de\npropriedade de Roseana e seu marido, Jorge Murad. As suspeitas ligavam a\norigem do dinheiro ao esquema de corrupção, descoberto e investigado na\nmesma época, na Superintendência do Desenvolvimento da Amazônia (SUDAM),\ncontrolada pelo grupo político do senador Jader Barbalho (PMDB-PA).\nDiante da imensa repercussão negativa, Maia acusou o candidato do PSDB à\npresidência, José Serra, o Palácio do Planalto e a revista *Época* –\nquem primeiro publicou as denúncias – de participação no episódio, como\nforma de minar a candidatura de Roseana, que vinha apresentando bons\níndices de intenção de voto, conforme atestavam os institutos de\npesquisa de opinião. No dia 4, a posição de Maia saiu vitoriosa e o PFL\nrompeu com o governo entregando todo o primeiro escalão em solidariedade\nà candidata. No dia 5, Maia denunciou o que qualificou de \"KGBeização da\nPolícia Federal\" e informou que tinha conhecimento de que um político\npróximo ao governo havia, dias antes, oferecido um dossiê com\ninformações comprometedoras em relação à Roseana, a um candidato a\npresidente.\n\nApesar dos esforços de César Maia em provar o contrário, a queda no\ndesempenho de Roseana nas pesquisas de opinião, em face do escândalo,\nminaram os argumentos da cúpula favoráveis à candidatura própria. Em 13\nde abril Roseana renunciou à candidatura.\n\nEm 22 de abril de 2002, Maia afirmou que a tendência do partido era não\nlançar ou apoiar nenhum candidato a presidente e liberar os estados para\nfazerem as coligações que preferissem. Na mesma ocasião, Maia lançou a\ncandidatura de Solange Amaral para o governo do estado do Rio. No mês\nseguinte, anunciou o apoio do diretório fluminense do PFL a Serra e\naventou a possibilidade do posicionamento regional se estender para o\nâmbito nacional. Em outubro, realizadas as eleições, Serra foi derrotado\npor Lula, no segundo turno, e Solange Amaral ficou apenas com o quarto\nlugar no pleito vencido, em primeiro turno, por Rosinha Matheus (PSB),\nmulher do ex-governador Garotinho.\n\nNo mês de dezembro, nove meses antes das eleições municipais, pesquisas\nde opinião apontavam que Maia liderava as intenções de voto com índices\nexpressivos, que variavam entre os 45 e 55%. Sua candidatura à reeleição\nfoi oficializada em junho de 2004.\n\nEm setembro, o candidato o PT à prefeitura, Jorge Bittar, apresentou\ndenúncias acerca do rompimento de dois convênios firmados entre a\nPrefeitura e o Ministério da Saúde, em 2001, para a realização de obras\nem dois hospitais e uma maternidade da cidade. Segundo Bittar, a\nPrefeitura recebeu os recursos, aplicou o dinheiro no mercado de\ncapitais e rompeu o contrato sem realizar as obras previstas.\n\nNo mês seguinte, a um dia das eleições, em almoço com jornalistas no\nPalácio da Cidade, Maia declarou que se sentia 90% preparado para ser\npresidente da República. Os 10% a menos, acrescentou, deviam-se ao fato\nde não falar inglês. No entanto, disse ainda que não fazia parte do seu\nprojeto político disputar a presidência, embora não descartasse a\npossibilidade. Afirmou também nesta ocasião que pretendia exercer\nintegralmente o seu mandato de prefeito caso fosse reeleito. No dia 3,\nainda no primeiro turno, Maia venceu as eleições.\n\n \n\nA TERCEIRA VEZ À FRENTE DA PREFEITURA DO RIO DE JANEIRO\n\nEm novembro, na tentativa de consolidar a sua posição de líder nacional\nda sigla, produziu uma cartilha com o que seriam os “mandamentos do bom\nadministrador” para os prefeitos eleitos do PFL. Entre outras\nrecomendações, aconselhava que as “medidas drásticas” fossem tomadas\nlogo no início dos mandatos. No dia 22 deste mesmo mês, anunciou o\nlançamento de sua pré-candidatura à presidência da República pelo\npartido. Recuou, no entanto, diante das críticas que recebera pela\nantecipação da campanha. Em sua cerimônia de posse, em janeiro de 2005,\nafirmou que era “baixa” a probabilidade de sua candidatura à\npresidência.\n\nEm março, diante do fracasso das negociações entre o Ministério da Saúde\ne a Prefeitura do Rio para resolver a crise na rede hospitalar da cidade\nque levara ao fechamento de emergências e à desativação de leitos, o\ngoverno federal promoveu uma intervenção direta sobre seis unidades\nhospitalares, como forma de aplacar a gravidade do problema. O\npresidente nacional do PFL, no entanto, o senador Jorge Bornhausen (SC),\nqualificou de “conspiração política” a intervenção federal, em face do\ncrescimento das intenções de voto em César Maia numa eventual disputa\npela presidência da República com o presidente Lula. Maia, por sua vez,\napesar dos elogios à atuação do presidente pela intervenção, entrou com\nmandado de segurança no STF para suspender a ação sobre os hospitais\nMiguel Couto e Souza Aguiar. O STF acatou a solicitação da Prefeitura,\nno mês seguinte, e restituiu as unidades ao controle administrativo do\ngoverno municipal.\n\nEm agosto de 2005, ante o desenrolar das denúncias feitas pelo então\npresidente do PTB, Roberto Jefferson (RJ), sobre o suposto pagamento de\n“mesadas” a deputados da base aliada pelo governo Lula, em troca da\naprovação das matérias de interesse do Executivo na Câmara dos Deputados\n– e que abriram a maior crise política do primeiro governo Lula – Cesar\ndefendeu a necessidade de se promover a investigação do presidente Lula\ne o seu *impeachment*.\n\nEm dezembro, Maia afirmou que abriria mão de sua candidatura à\npresidência se o candidato do PSDB fosse José Serra. Na mesma ocasião,\nMaia disse que não poderia sair candidato porque isto significaria\ndeixar a Prefeitura nas mãos do PSDB, que vinha lhe fazendo oposição na\nCâmara dos Vereadores. Meses mais tarde, em março de 2006, o PFL, com a\nanuência de Maia, anunciou que apoiaria o candidato do PSDB escolhido\npara disputar a presidência, que não fora, no entanto, José Serra, mas\nGeraldo Alckmin, então governador de São Paulo. Maia decidiu também que\nnão disputaria o governo do estado, como chegara a ser cogitado, nem\nqualquer outro cargo nas eleições daquele ano.\n\nAo longo de toda a campanha, Cesar Maia e parte da cúpula pefelista\ndivergiram publicamente dos rumos impressos à campanha de Alckmin, pela\ntom morno das críticas a Lula, pela suposta falta de comunicação interna\nno PSDB, pela desorganização dos palanques estaduais e pela falta de\ninterlocução entre as lideranças regionais e a liderança da campanha.\nRealizado o pleito, Alckmin foi derrotado em segundo turno por Lula, que\nconquistou o seu segundo mandato consecutivo. As eleições para o governo\ndo estado do Rio, para a qual o partido não lançou candidato próprio,\nforam vencidas pelo peemedebista Sérgio Cabral.\n\nAinda em março, o PFL passou por uma reestruturação que já vinha se\nanunciando há algum tempo, pelas mãos do presidente da legenda, Jorge\nBornhausen. Com o propósito de promover a “refundação” do partido, que\nperdera espaço político nos últimos anos, Rodrigo Maia (RJ), deputado\nfederal e filho de César, assumiu a presidência da agremiação,\nsimbolizando a renovação da legenda. Tal processo refletiu ainda uma\ndisputa interna pelo controle da máquina partidária entre os senadores\nBornhausen e Antônio Carlos Magalhães (BA). Tal processo redundou ainda\nna mudança de nome da legenda, que passou a se chamar Democratas (DEM),\ncom a intenção declarada de encaminhar-se para uma posição de “centro”.\n\nNo mês de agosto, com a decisão do STF de proibir a prática de nepotismo\nna administração pública, em suas três esferas, o prefeito Cesar Maia,\nsegundo reportagem do jornal *Folha de S. Paulo* publicada no dia 26,\ncriou uma nova secretaria para manter a irmã, Ana Maria Maia, na\nprefeitura, haja visto que a súmula do STF proibia a contratação de\nparentes, mas admitia como exceção os cargos de ministro e secretário de\nestado. Ana Maria, de subsecretária de Eventos, vinculada ao gabinete de\nMaia, passou a secretária especial de Eventos. Maia afirmou ainda à\nreportagem que tentava encontrar uma solução para o seu sobrinho, Carlos\nAndré Xavier Bonel Júnior, na mesma situação. O prefeito, no entanto,\nnegou que tivesse criado uma nova secretaria e afirmou ter apenas mudado\no nome da pasta, “sem aumento de despesas”. Ainda segundo o jornal, além\nda irmã e do sobrinho, outros três familiares de Cesar Maia ocupavam\ncargos públicos na ocasião da matéria: Carmem Adela Ibarra Pizzarro\n(cunhada e presidente da Fundação Planetário), Anita Carolina Levy\nIbarra (sobrinha da primeira-dama e presidente da Fundação Riozôo) e\nSebastian Ibarra (sobrinho da primeira-dama e assessor do secretário de\nAssistência Social, Marcelo Garcia).\n\nAinda neste mês, Maia descartou a possibilidade de aceitar um convite\npara continuar na administração municipal caso a candidata do seu\npartido, Solange Amaral, vencesse o pleito. Maia declarou que\npossivelmente concorreria ao governo do estado em 2010.\n\nEm setembro, pesquisa divulgada pelo Instituto Datafolha, apontou os\níndices de aprovação popular das prefeituras de oito grandes capitais\nbrasileiras. Cesar Maia foi o último colocado. Segundo o instituto, foi\no único cuja taxa de reprovação (40%) superou a aprovação (26%).\n\nRealizado o pleito de outubro, a candidata Solange Amaral obteve 128.596\nvotos, ficando apenas com a sexta colocação. Dias depois, reunida a\nExecutiva regional do partido, a legenda decidiu apoiar o candidato\nFernando Gabeira, do PV, que no segundo turno foi derrotado pelo\npeemedebista e ex-secretário de Maia, Eduardo Paes.\n\nMaia, em entrevista à rádio CBN, no dia 8 de dezembro de 2008, atribuiu\nnota 4 para o seu terceiro mandato à frente da cidade do Rio. Ressaltou\na importância para a capital fluminense da realização dos Jogos\nPan-americanos de 2007, mas colocou na conta do evento a derrocada da\ncapacidade de investimento da Prefeitura e, consequentemente, o seu\npercalço político. Maia especulou ainda sobre o seu futuro próximo, que\nincluía a possibilidade de voltar à docência universitária: \"O tempo irá\ndizer se sou candidato a governador, se sou candidato a senador, se sou\ncandidato a professor e volto a ser candidato a prefeito em 2012\".\n\nEm fevereiro de 2009, Maia tornou-se colunista semanal do jornal *Folha\nde S. Paulo*.\n\nCésar Maia publicou seis livros, todos sobre economia: *Entre a teoria e\na prática* (1989), *Analisando a transição* (1989), *Apontando caminhos\nà crise da economia brasileira* (1990), *Crítica com coerência* (1990),\n*O tom desafinado* (1990) e *Uma vocação carioca* (1992).\n\nLibânia Xavier(2001)/André Dantas (2009)\n\n \n\nFONTES: CÂM. DEP.*Deputados brasileiros. Repertório*(1991-1995); COELHO,\nJ. & OLIVEIRA, A. *Nova*;*Estado de S. Paulo* (13/10/88, 17/4/90, 2 e\n22/2/91, 30/5 e 23/8/94); *Folha de S. Paulo* (14/1/87, 26/8/88, 2/8/89,\n6/2/91, 17/10, 5, 18 e 30/11/92, 1/1/93, 3/5 e 10/7/95, 14/10/98);\n*Folha de S. Paulo – on line*(25/6, 11, 30/7, 1/9, 1, 3, 5, 6, 16, 21,\n25 e 29/10/00, 5, 6, 19/1, 2, 28/5, 1, 2, 13, 15/6, 5/10, 1 e 13/12/01,\n29/1, 4, 5, 6, 8/3, 11, 19, 22/4 e 18/5/02, 26/9 e 28/12/03, 27, 28/6,\n22/9, 2, 3/10, 10/11 e 1/12/04, 1, 10/1, 11/2, 19, 22/3, 28/4, 11/8,\n5/12 e 29/12/05, 23/2, 15, 16, 21, 23, 24/3, 25, 26, 31/5, 22/6 e\n18/9/06, 10/9/07, 27/3, 9/6, 27/8, 12/9, 7/10, 8 e 21/12/08, 13/2/09);\n*Globo* (6, 10, 17 e 22/2/91, 17 e 20/10 e 17/11/92, 16/5/93, 2/2, 8 e\n15/4, 9/5, 5/6 e 25/12/94, 18, 23 e 30/5 e 24/9/95, 13/1, 21/5, 26, 27 e\n31/7/, 20/8, 20 e 30/12/96, 5/3 e 29/4/97, 9 e 10/5, 14 e 29/7, 21/8,\n2/9/98, 25/8/99); *Jornal do Brasil* (13/10/88, 31/1 e 6/2/91, 19 e\n21/10 e 8/11/92, 12/3, 8, 9, 12 e 24/4/94, 22/4, 30/5 e 14/8, 24/11 e\n10/12/95, 21/5, 26 e 27/7, 21, 26, 27, 29/8, 3, 18, 21, 27/9, 10, 20,\n31/10, 16, 21, 22, 28/11 e 31/12/96, 11/5/97; 9 e 11/5 e 23/6/98,\n25/8/99); TRIB. REG. ELEIT. RJ. *Dados* (1998); TRIB. SUP. ELEIT.\n*Dados*(1998); *Veja* (24/3/99);\nhttp://[www.qprocura.com.br](http://www.qprocura.com.br/);\nhttp://[www.tse.gov.br](http://www.tse.gov.br/).\n\n \n","ref":"FONTES: CÂM. DEP.*Deputados brasileiros. Repertório*(1991-1995); COELHO,\nJ. & OLIVEIRA, A. *Nova*;*Estado de S. Paulo* (13/10/88, 17/4/90, 2 e\n22/2/91, 30/5 e 23/8/94); *Folha de S. Paulo* (14/1/87, 26/8/88, 2/8/89,\n6/2/91, 17/10, 5, 18 e 30/11/92, 1/1/93, 3/5 e 10/7/95, 14/10/98);\n*Folha de S. Paulo – on line*(25/6, 11, 30/7, 1/9, 1, 3, 5, 6, 16, 21,\n25 e 29/10/00, 5, 6, 19/1, 2, 28/5, 1, 2, 13, 15/6, 5/10, 1 e 13/12/01,\n29/1, 4, 5, 6, 8/3, 11, 19, 22/4 e 18/5/02, 26/9 e 28/12/03, 27, 28/6,\n22/9, 2, 3/10, 10/11 e 1/12/04, 1, 10/1, 11/2, 19, 22/3, 28/4, 11/8,\n5/12 e 29/12/05, 23/2, 15, 16, 21, 23, 24/3, 25, 26, 31/5, 22/6 e\n18/9/06, 10/9/07, 27/3, 9/6, 27/8, 12/9, 7/10, 8 e 21/12/08, 13/2/09);\n*Globo* (6, 10, 17 e 22/2/91, 17 e 20/10 e 17/11/92, 16/5/93, 2/2, 8 e\n15/4, 9/5, 5/6 e 25/12/94, 18, 23 e 30/5 e 24/9/95, 13/1, 21/5, 26, 27 e\n31/7/, 20/8, 20 e 30/12/96, 5/3 e 29/4/97, 9 e 10/5, 14 e 29/7, 21/8,\n2/9/98, 25/8/99); *Jornal do Brasil* (13/10/88, 31/1 e 6/2/91, 19 e\n21/10 e 8/11/92, 12/3, 8, 9, 12 e 24/4/94, 22/4, 30/5 e 14/8, 24/11 e\n10/12/95, 21/5, 26 e 27/7, 21, 26, 27, 29/8, 3, 18, 21, 27/9, 10, 20,\n31/10, 16, 21, 22, 28/11 e 31/12/96, 11/5/97; 9 e 11/5 e 23/6/98,\n25/8/99); TRIB. REG. ELEIT. RJ. *Dados* (1998); TRIB. SUP. ELEIT.\n*Dados*(1998); *Veja* (24/3/99);\nhttp://[www.qprocura.com.br](http://www.qprocura.com.br/);\nhttp://[www.tse.gov.br](http://www.tse.gov.br/).\n\n \n","dic":"DHBB"}
