{"title":"MAIA, Emílio","cargoss":["Deputado federal"],"cargos_esp":[0],"datas_ini":[1935],"datas_fim":[1937],"estados":["AL"],"autor":[0],"content":"**MAIA, Emílio**\n\n\\*dep. fed. AL 1935-1937.\n\n \n\n*Emílio Eliseu de Maia* nasceu em Atalaia (AL) no dia 25 de junho de\n1906, filho de Alfredo de Maia, senhor do engenho Patrocínio (AL) e\ndeputado federal entre 1914 e 1918, e Regina Clarc Acióli de Maia.\n\nEstudou no Colégio Higino Belo em Maceió, onde fundou o jornal O\nIndependente. Jornalista e poeta, graduou-se pela Faculdade de Direito\nde Recife em 1929. Partidário da Revolução de 1930 e simpatizante da\ndoutrina social da Igreja Católica, defendia os interesses dos usineiros\nnordestinos e a fabricação no Brasil do álcool automotor.\n\nIniciou sua carreira política elegendo-se deputado federal por Alagoas,\nem outubro de 1934. Exerceu o mandato de maio de 1935 a 10 de novembro\nde 1937, quando todas as câmaras legislativas do país foram fechadas com\na instauração do Estado Novo.\n\nFundador e presidente da Liga Eleitoral Católica em Alagoas e membro da\nAssociação Alagoana de Imprensa, foi também um dos fundadores do Círculo\nOperário Católico de Maceió.\n\nFaleceu no Rio de Janeiro, então Distrito Federal, no dia 13 de março de\n1939.\n\nCasou-se com Nazira Cabral, com quem teve dois filhos.\n\nPublicou O Brasil e o drama do petróleo (1938) e um volume de discursos\nparlamentares. Escreveu também artigos no jornal católico O Semeador.\n\nSobre ele foi publicado “Emílio de Maia, um pioneiro”, em Cadernos\nAlagoanos (1964) e Pétalas esparsas — poemas de Emílio de Maia (1999).\n\n \n\n \n\nFONTES: Boletim Min. Trab. (5/36); CÂM. DEP. Deputados; Diário do\nCongresso Nacional; INF. José Fernando de Maia Pedrosa; MORAIS, T.\nResumo.\n\n \n","ref":"FONTES: Boletim Min. Trab. (5/36); CÂM. DEP. Deputados; Diário do\nCongresso Nacional; INF. José Fernando de Maia Pedrosa; MORAIS, T.\nResumo.\n\n \n","dic":"DHBB"}
