{"title":"MAIA, Heitor","cargoss":["Deputado federal"],"cargos_esp":[0],"datas_ini":[1935],"datas_fim":[1937],"estados":["PE"],"autor":[0],"content":"**MAIA, Heitor**\n\n\\*dep. fed. PE 1935-1937.\n\n \n\n*Heitor da Silva Maia* nasceu em Recife no dia 1º de outubro de 1873,\nfilho de Antônio Bruno da Silva Maia e de Francisca Olímpia da Silva\nMaia.\n\nEngenheiro civil, foi fundador da Escola de Engenharia do Estado de\nPernambuco, na qual foi professor e diretor.\n\nSecretário de Fazenda de Pernambuco no governo de Carlos Lima Cavalcanti\n(1930-1935), elegeu-se deputado federal no pleito de outubro de 1934 na\nlegenda do Partido Social Democrático (PSD) de Pernambuco. Exerceu o\nmandato de maio de 1935 a 10 de novembro de 1937, quando, com a\ninstauração do Estado Novo, as câmaras legislativas do país foram\nsuprimidas.\n\nFaleceu em Recife no dia 17 de fevereiro de 1942.\n\nEra casado com Elvira Araújo Maia, com quem teve cinco filhos.\n\n \n\nFONTES: *Boletim Min. Trab*. (5/36); CÂM. DEP. *Deputados*; CÂM. DEP.\n*Relação nominal*; *Diário do Congresso Nacional*; INF. Heitor da Silva\nMaia Neto.\n\n \n","ref":"FONTES: *Boletim Min. Trab*. (5/36); CÂM. DEP. *Deputados*; CÂM. DEP.\n*Relação nominal*; *Diário do Congresso Nacional*; INF. Heitor da Silva\nMaia Neto.\n\n \n","dic":"DHBB"}
