{"title":"MAIA, José Agripino","cargoss":["Governador de estado ou do Distrito Federal","Constituinte","Senador","Governador de estado ou do Distrito Federal"],"cargos_esp":[0,0,0,"RN 1991-1994, sen"],"datas_ini":[1983,1987,1987,1995],"datas_fim":[1986,1988,1991,0],"estados":["RN",0,"RN","RN"],"autor":[0],"content":"**MAIA, José Agripino**\n\n\\*gov. RN 1983-1986; const. 1987-1988; sen. RN 1987-1991; gov. RN\n1991-1994, sen. RN 1995- **.**\n\n           \n\n            *José Agripino Maia* nasceu em Mossoró (RN) no dia 23 de\nmaio de 1945, filho de Tarcísio de Vasconcelos Maia e Joseresa Tavares\nMaia. Seu pai foi deputado federal pelo Rio Grande do Norte entre 1959 e\n1963, em 1964 e em 1965, e governador do estado entre 1975 e 1979. Seu\ntio João Agripino Filho foi constituinte de 1946; deputado federal pela\nParaíba (1946-1961, 1961-1963, 1983-1987), ministro das Minas e Energia\n(1961), senador pela Paraíba (1963-1966), governador da Paraíba\n(1966-1971) e ministro do Tribunal de Contas da União (1972-1974). Seu\nprimo, Lavoisier Maia, foi governador do Rio Grande do Norte (1979-1983)\ne senador (1987-1995).\n\n            Formado em engenharia, em 1967, pela Faculdade de Engenharia\nda Universidade do Estado da Guanabara, atual Universidade do Estado do\nRio de Janeiro (UERJ), Agripino Maia pós-graduou-se em estabilização de\ntaludes pela mesma universidade.\n\n            Diretor-presidente da empresa Mossoró Agroindustrial S.A.,\nfabricante dos sucos de frutas Maisa, em 1968, trabalhou como\nengenheiro-chefe de obras da Empresa Industrial Técnicas (EIT), entre\n1969 e 1972. Neste último ano, tornou-se gerente regional da EIT para os\nestados da Bahia, Sergipe, Alagoas, Pernambuco e Paraíba, função que\nexerceu até 1975.\n\n            Também diretor-superintendente da Companhia Industrial\nTécnica (CIT), pioneira no aproveitamento integral do babaçu no país,\nfoi nomeado prefeito de Natal em 1979, por Lavoisier Maia, seu primo,\nentão governador do estado, na legenda da Aliança Renovadora Nacional\n(Arena), agremiação política de apoio ao regime militar instalado no\npaís em abril de 1964. Com a promulgação da nova Lei Orgânica dos\nPartidos, que extinguiu o bipartidarismo em novembro de 1979, e a\nposterior reorganização partidária, filiou-se ao Partido Democrático\nSocial (PDS).\n\n            Nas eleições de novembro de 1982, candidatou-se ao governo\ndo Rio Grande do Norte, na legenda do PDS. Eleito, assumiu o governo em\nmarço de 1983. Nesse mesmo ano, tornou-se presidente do Conselho de\nDesenvolvimento do Estado do Rio Grande do Norte, função que exerceria\naté 1986.\n\n            No processo de abertura do regime militar, aliou-se aos\ndissidentes do PDS que formalizaram a Frente Liberal, contribuindo\ndecisivamente para a eleição, no Colégio Eleitoral reunido em 15 de\njaneiro de 1985, de Tancredo Neves. Lançado pela Aliança Democrática,\nfrente oposicionista que reunia a Frente Liberal e o Partido do\nMovimento Democrático Brasileiro (PMDB), Tancredo derrotou Paulo Maluf,\ncandidato situacionista, na disputa pela sucessão do general João\nFigueiredo na presidência da República. Contudo, por motivo de doença,\nTancredo Neves não chegou a ser empossado na presidência, vindo a\nfalecer em 21 de abril de 1985. Seu substituto no cargo foi o vice José\nSarney, que já vinha exercendo interinamente o cargo desde 15 de março\ndeste ano.\n\n            Nas eleições para a prefeitura de Natal, em novembro de\n1985, José Agripino apoiou Vilma Maia, então esposa de seu primo\nLavoisier Maia, candidata na legenda do PDS. Foi acusado de fraude\neleitoral por Aluísio Alves — ministro da Administração e tio de\nGaribaldi Alves, candidato à prefeitura na legenda do PMDB — que\ndivulgou uma fita na qual o governador instruía prefeitos\ncorreligionários a utilizarem carros oficiais na campanha a favor de\nVilma Maia e a comprarem votos para garantir sua eleição, e negou a\nveracidade da gravação. Vilma acabou sendo derrotada por Garibaldi\nAlves.\n\n            Agripino desincompatibilizou-se do governo do estado em maio\nde 1986, sendo substituído pelo vice-governador Radir Pereira de Araújo,\npara concorrer, no pleito de novembro seguinte, a uma vaga de senador\nconstituinte na legenda do Partido da Frente Liberal (PFL). Eleito,\nassumiu sua cadeira na Assembleia Nacional Constituinte em fevereiro do\nano seguinte. Ainda em 1987, representou o PFL na comemoração do\ncentenário da fundação do Partido Colorado, no Paraguai, e foi\nobservador parlamentar na XLII Sessão da Assembleia Geral da Organização\ndas Nações Unidas (ONU).\n\n            Titular da Subcomissão do Sistema Eleitoral e Partidos\nPolíticos, da Comissão da Organização Eleitoral, Partidária e de\nGarantia das Instituições, e suplente da Subcomissão dos Estados, da\nComissão da Organização do Estado, votou contra o rompimento de relações\ndiplomáticas com países com política de discriminação racial, a pena de\nmorte, a limitação do direito de propriedade privada, a jornada semanal\nde 40 horas, a nacionalização do subsolo, a estatização do sistema\nfinanceiro, a limitação de 12% para os juros reais, o mandato de cinco\nanos para o presidente José Sarney, a limitação para os encargos da\ndívida externa, a criação de um fundo de apoio à reforma agrária, a\nlegalização do jogo do bicho, a desapropriação da propriedade produtiva\ne o aborto. Pronunciou-se favoravelmente ao mandado de segurança\ncoletivo e à proteção ao emprego. Votou contra a demissão sem justa\ncausa, o aviso prévio proporcional, a pluralidade sindical, a soberania\npopular, o voto aos 16 anos, o presidencialismo e a proibição do\ncomércio de sangue.\n\n            Com a promulgação da nova Carta Constitucional em 5 de\noutubro de 1988, passou a participar apenas dos trabalhos legislativos\nordinários do Senado. Neste mesmo ano, integrou a delegação brasileira\nda Associação Interparlamentar de Turismo na reunião do Comitê de\nMembros Filiados da Organização Mundial de Turismo, na França.\nParticipante da Conferência Interparlamentar de Turismo, em Haia,\nHolanda, em 1989, esteve, nesse mesmo ano, no Encontro do Parlamento\nLatino-americano pela soberania do Panamá, tendo ainda visitado a França\ne a então República Federal da Alemanha para obter subsídios para a\nComissão Mista de Defesa do Consumidor. No ano seguinte, esteve nos EUA\ne na França, participando do ciclo internacional de debates sobre defesa\ndo consumidor.\n\n            Nas eleições de outubro de 1990, candidatou-se ao governo do\nRio Grande do Norte na legenda do PFL. Eleito — derrotando seu primo\nLavoisier Maia, que se candidatara pela legenda do Partido Democrático\nTrabalhista (PDT) com o apoio do governador Geraldo Melo (1987-1991),\npolítico ligado à família Alves —, deixou sua cadeira no Senado, sendo\nsubstituído pelo suplente Dario Pereira. Assumiu o governo em março de\n1991, no lugar de Geraldo Melo.\n\n                Desincompatibilizou-se do governo em abril de 1994 para\ncandidatar-se novamente ao Senado na legenda do PFL, sendo substituído\nna ocasião pelo vice-governador Vivaldo Costa. Eleito com base eleitoral\nem Natal, iniciou seu segundo mandato em fevereiro de 1995. Presidente\nda Comissão de Serviços de Infraestrutura e integrante da Comissão de\nRelações Exteriores e Defesa Nacional, votou contra o fim do monopólio\ndos estados na distribuição do gás canalizado e a favor da liberação da\nnavegação de cabotagem, do fim do conceito de empresa nacional e do fim\ndos monopólios estatal das telecomunicações e da Petrobras na exploração\ndo petróleo.\n\n            Em dezembro de 1995, reportagem da *Veja* revelou que\ndocumentos encontrados na chamada “pasta rosa” do Banco Econômico\nregistravam contribuições de 64,9 mil dólares do banco à campanha de\nAgripino ao governo estadual, em 1990.\n\n            Em fevereiro de 1996, cobrou do governo Fernando Henrique\nCardoso uma ação mais efetiva para ajudar o desenvolvimento do Nordeste.\nEm maio, propôs a elaboração de um substitutivo ao projeto do senador\nJosé Eduardo Dutra, do Partido dos Trabalhadores (PT) de Sergipe, que\ncondicionava a privatização da Companhia Vale do Rio Doce à autorização\ndo Congresso, determinando que os recursos obtidos com sua venda fossem\naplicados em obras de infraestrutura. Em troca, o governo ficaria\nliberado para privatizar a empresa, prescindindo de autorização do\nCongresso. Em novembro, passou a integrar a Comissão Parlamentar de\nInquérito dos Títulos Públicos, encarregada de investigar a participação\nde alguns municípios e estados na emissão irregular de títulos para\npagamento de precatórios.\n\n            Em outubro de 1998, disputou o governo potiguar à frente de\numa coligação liderada pelo seu partido, o PFL, e mais os partidos da\nSocial Democracia Brasileira (PSDB), o Socialista Brasileiro (PSB), o\nTrabalhista Brasileiro (PTB) e outras agremiações de menor vulto. No\nentanto, foi derrotado por Garibaldi Alves, do PMDB, que, assim,\nconseguiu reeleger-se. José Agripino deu então continuidade ao seu\nmandato de senador.\n\n            No Senado, em 1999, tornou-se membro do Conselho da Ordem do\nCongresso Nacional. Também foi eleito suplente da Comissão de Assuntos\nEconômicos e de Assuntos Sociais, presidente da Comissão de\nConstituição, Justiça e Cidadania e titular da Comissão de Serviços de\nInfraestrutura, atribuições exercidas até 2001. Ainda integrou a CPI do\nJudiciário, instaurada para averiguar suspeitas de irregularidades\ncometidas por funcionários de Tribunais Superiores, Regionais e de\nJustiça.\n\n            Em 2000 foi eleito presidente do Grupo Parlamentar\nBrasil-Espanha, atividade ainda mantida em 30 de abril de 2002, quando\nem reunião, ao falar para 16 deputados e senadores espanhóis, analisou o\nquadro político brasileiro, enfocando principalmente a eleição\npresidencial que se aproximava.\n\n            Em 2001 assumiu a liderança do PFL no Senado Federal, além\nde ser indicado, em 21 de março, titular da Comissão de Relações\nExteriores e Defesa Nacional (com funções até janeiro de 2003), suplente\nda Comissão de Assuntos Sociais (até fevereiro de 2003) e titular da\nComissão de Assuntos Econômicos (até novembro de 2002). Como observador\nparlamentar, participou da reunião anual da Assembleia de Governadores\nda Corporação Interamericana de Investimentos, realizada em Santiago, no\nChile, da Assembleia de Governadores do Banco Interamericano de\nDesenvolvimento (BID) e, a convite do presidente Fernando Henrique\nCardoso, foi à Nova York participar da Assembleia Geral das Nações\nUnidas (ONU).\n\n            Nas eleições de outubro de 2002 candidatou-se novamente a\nsenador pelo Rio Grande do Norte. Reeleito pela legenda do PFL, assumiu\nseu terceiro mandato em 1º de fevereiro de 2003. Dezoito dias depois,\nfoi mais uma vez empossado titular da Comissão de Relações Exteriores e\nDefesa Nacional e da Comissão de Assuntos Sociais, e suplente das\nComissões de Educação e de Assuntos Econômicos, atribuições que foram\ndesenvolvidas até 17 de fevereiro de 2005. Ainda em 2003 foi reeleito\nlíder do PFL no Senado.  \n\n            Em dezembro de 2004 passou a integrar a Comissão Mista\nEspecial da Reforma do Judiciário, que pressupunha, dentre alguns\nprojetos, mudanças nos Códigos de Processo Penal e Civil e a diminuição\nde possibilidades de impetrar recursos ao Supremo Tribunal Federal. Em\nfevereiro de 2005, reassumiu a função de suplente das Comissões de\nAssuntos Econômicos e de Educação, voltando a exercer ambas as\natividades também em 2007.\n\n                Em 2006 votou no Senado a proposta de reajuste de 16%\naos beneficiários da Previdência Social que ganhavam mais de um salário\nmínimo. No entanto, sua proposta foi derrotada, entrando em vigor a\nmedida provisória que concedeu reajuste de 5% aos aposentados e\npensionistas.\n\n                No ano seguinte, disputou a presidência do Senado,\nobtendo 28 votos contra 51 do candidato reeleito Renan Calheiros\n(PMDB-AL). Mesmo com a derrota, José Agripino não deixou de ser\nreconduzido à liderança do partido, que neste ano de 2007 passou a se\ndenominar Democratas (DEM).\n\n                Ainda líder do DEM em 2009, depois de ter apoiado a\ncandidatura do senador José Sarney (PMDB-AP) para a presidência da Casa\nno biênio 2009-2010, defendeu o afastamento temporário deste parlamentar\naté que fossem esclarecidas as denúncias de irregularidades\nadministrativas no Senado.\n\n                Casou-se com Anita Louise Catalão Maia, com quem teve\ndois filhos, um dos quais, Felipe Catalão Maia, elegeu-se deputado\nfederal pelo Rio Grande do Norte pelo FL em 2006.\n\n*                                                                                                                                                                                                Gisela\nMoura/**Patrícia S. Monnerat* atualização\n\n \n\nFONTES: COELHO, J. & OLIVEIRA, A. Nova; *Estado de S. Paulo* (3/2/96);\n*Folha de S. Paulo* (31/1/95, 14/1 e 15/5/96, 15/7/98); *Jornal do\nBrasil* (8/5/96); SENADO. Dados biográficos (1995); *Veja*(13/11/85 e\n20/12/95); [www.agenciabrasil.gov.br](http://www.agenciabrasil.gov.br/)\n(Acesso em 25/8/09. Notícias divulgadas em 6/12/06, 1/2/07, 29/1/09,\n30/6/09); [www.agripino.com.br](http://www.agripino.com.br/) (Acesso em\n25/8/09);\n[www.camara.gov.br/bioconstituintes](http://www.camara.gov.br/bioconstituintes)\n(Acesso em 24/8/09);\n[www.senado.gov.br/Agencia](http://www.senado.gov.br/Agencia) (Acesso em\n25/8/09. Biografia e Reportagem de 30/4/02 e de  29/1/09);\n[www.tse.gov.br](http://www.tse.gov.br/) (Acesso em 31/8/09).\n\n \n","ref":"FONTES: COELHO, J. & OLIVEIRA, A. Nova; *Estado de S. Paulo* (3/2/96);\n*Folha de S. Paulo* (31/1/95, 14/1 e 15/5/96, 15/7/98); *Jornal do\nBrasil* (8/5/96); SENADO. Dados biográficos (1995); *Veja*(13/11/85 e\n20/12/95); [www.agenciabrasil.gov.br](http://www.agenciabrasil.gov.br/)\n(Acesso em 25/8/09. Notícias divulgadas em 6/12/06, 1/2/07, 29/1/09,\n30/6/09); [www.agripino.com.br](http://www.agripino.com.br/) (Acesso em\n25/8/09);\n[www.camara.gov.br/bioconstituintes](http://www.camara.gov.br/bioconstituintes)\n(Acesso em 24/8/09);\n[www.senado.gov.br/Agencia](http://www.senado.gov.br/Agencia) (Acesso em\n25/8/09. Biografia e Reportagem de 30/4/02 e de  29/1/09);\n[www.tse.gov.br](http://www.tse.gov.br/) (Acesso em 31/8/09).\n\n \n","dic":"DHBB"}
