{"title":"MALAN, Alfredo Souto","cargoss":["Comandante do IV Exército","ch Depto Prov Ger Ex","Chefe do Estado-Maior do Exército"],"cargos_esp":[0,0,0],"datas_ini":[1968,1969,1971],"datas_fim":[1969,1971,1972],"estados":[0,0,0],"autor":[0],"content":"**MALAN, Alfredo Souto**\n\n\\*militar; comte. IV Ex. 1968-1969; ch. Depto. Prov. Ger. Ex. 1969-1971;\nch. EME 1971-1972.\n\n \n\n*Alfredo Souto Malan* nasceu em Porto Alegre no dia 8 de junho de 1908,\nfilho de Alfredo Malan D’Angrogne e de Clementina Souto Malan\nD’Angrogne. Seu pai era natural de Gênova, Itália, e, já naturalizado\nbrasileiro, foi um dos signatários do manifesto que intimou o presidente\nWashington Luís a renunciar logo após a eclosão do movimento\nrevolucionário de outubro de 1930. Foi também chefe do Estado-Maior do\nExército (EME) entre novembro de 1930 e março de 1931.\n\nAlfredo Souto Malan iniciou sua vida militar aos 16 anos, ingressando em\nabril de 1924 na Escola Militar do Realengo, no Rio de Janeiro, então\nDistrito Federal, de onde saiu aspirante-a-oficial da arma de engenharia\nem janeiro de 1929. Foi promovido a segundo-tenente em julho seguinte e\na primeiro-tenente em fevereiro de 1931. Fez o curso de especialização\nem transmissões da Escola de Armas de 1933 a 1934 e em outubro desse\núltimo ano foi promovido a capitão. Nessa patente fez os cursos da\nEscola de Aperfeiçoamento de Oficiais em 1935 e da Escola de Comando e\nEstado-Maior do Exército (ECEME) entre 1939 e 1940. Promovido a major em\ndezembro de 1942, entre 1943 e 1945 serviu como adjunto do adido militar\nem Washington e integrou, durante dois meses, a delegação brasileira que\nfoi a São Francisco, também nos EUA, para estabelecer as bases da\nOrganização das Nações Unidas (ONU).\n\nDe volta ao Brasil em 1945, passou a instrutor da ECEME, sendo promovido\na tenente-coronel em dezembro do ano seguinte. Deixou a escola em 1947,\nao ingressar no curso da Escola Superior de Guerra na França, onde\ntambém estagiou durante três meses em seu corpo de instrutores. Retornou\nao Brasil em 1949 e em junho desse ano passou a integrar o corpo\npermanente que organizou a Escola Superior de Guerra (ESG) brasileira.\nDe 1951 a 1952, já no segundo governo do presidente Getúlio Vargas,\ncomandou o Batalhão-Escola de Engenharia. Neste último ano serviu\ndurante alguns meses no gabinete do ministro da Guerra, general Ciro do\nEspírito Santo Cardoso. Em setembro de 1952 foi promovido a coronel e\ndois meses depois assumiu o posto de subcomandante da Academia Militar\ndas Agulhas Negras (AMAN), sediada em Resende (RJ), onde permaneceu até\n1954.\n\nEm fevereiro deste último ano foi divulgado um documento assinado por 82\ncoronéis e tenentes-coronéis, entre os quais Souto Malan, dirigido à\nalta hierarquia das forças armadas em protesto contra a exigüidade de\nrecursos destinados ao Exército e a promessa governamental de elevar em\n100% o salário mínimo. O documento ficou conhecido como Manifesto dos\ncoronéis e contribuiu decisivamente para a demissão dos ministros Ciro\ndo Espírito Santo Cardoso, da Guerra, e João Goulart, do Trabalho. Em\njulho de 1954, Malan foi convidado para chefiar a 3ª Seção do\nEstado-Maior das Forças Armadas (EMFA). Exerceu essa função até 1960,\nquando assumiu a chefia da 7ª Região Militar (7ª RM), em Recife. Em\nnovembro desse último ano, foi promovido a general-de-brigada,\npermanecendo em Recife como chefe do estado-maior do IV Exército.\n\nEm setembro de 1962 passou a ocupar o cargo de subchefe do EMFA, no Rio.\nPartidário do movimento político-militar de março de 1964, que depôs o\npresidente João Goulart, em maio desse ano deixou a subchefia do EMFA\npara comandar a AMAN. Em julho foi promovido a general-de-divisão e em\noutubro, por ocasião da visita do general Charles de Gaulle ao Brasil,\nfoi designado pelo ministro da Guerra, general Artur da Costa e Silva,\npara acompanhar o presidente da França durante sua permanência no país.\nNo final de 1964 passou a comandar a 4ª Região Militar e a 4ª Divisão de\nInfantaria, ambas com sede em Juiz de Fora (MG). Voltou ao Rio em 1967\npara chefiar a Diretoria Geral de Engenharia e Comunicações. Em março do\nano seguinte passou a general-de-exército e dois meses depois assumiu o\ncargo de comandante do IV Exército, sediado em Recife, substituindo o\ngeneral Rafael de Sousa Aguiar. Ocupou esse comando até setembro de\n1969, quando foi substituído pelo general Artur Duarte Candal Fonseca.\n\nAssumiu a chefia do Departamento de Provisão Geral do Exército em\noutubro de 1969, substituindo o general Augusto César de Castro Muniz\nAragão. Em janeiro de 1971 passou o cargo para o general Artur Duarte\nCandal Fonseca e nesse mesmo mês foi empossado na chefia do Estado-Maior\ndo Exército (EME), no lugar do general Antônio Carlos da Silva Murici.\nNa qualidade de chefe do EME, fez uma série de declarações que tiveram\ngrande repercussão. Em abril de 1971, em cerimônia de entrega de espadas\naos novos generais-de-brigada, realizada no Quartel-General do Exército\nem Brasília, alertou para o perigo do isolamento e da arrogância do\npoder e defendeu a necessidade do diálogo para evitar um divórcio entre\nchefes e subordinados e garantir a transmissão de idéias aos mais\njovens. Em junho desse ano realizou uma viagem de 20 dias à França e a\nPortugal, durante a qual visitou, como convidado, a Exposição de\nAeronáutica e Armamentos de Paris e estabeleceu contatos com os\nexércitos francês e português, além de proferir diversas conferências\nsobre o Brasil, destacando as realizações do movimento político-militar\nde 1964.\n\nEm dezembro de 1971, mais uma vez em cerimônia de entrega de espadas aos\nnovos generais, proferiu um discurso no qual destacou a necessidade de\nque se fortalecessem os quadros civis na cúpula do governo federal, para\nfacilitar um “desengajamento lento e progressivo dos militares”, que\ndeveriam dar uma maior dedicação às atividades profissionais. Em maio de\n1972 deixou a chefia do EME, passando para a reserva, e foi substituído\nno cargo pelo general Bruno Borges Fortes. Em junho de 1975 tomou posse\nna Comissão de Publicações da Biblioteca do Exército.\n\nFoi também vice-presidente da Associação dos Amigos da Escola Superior\nde Guerra da França.\n\nFaleceu no Rio de Janeiro no dia 5 de novembro de 1982.\n\nFoi casado com Heloísa Sampaio Malan, com quem teve cinco filhos.\n\nPublicou Uma escolha, um destino: vida do general Malan D’Angrogne\n(1979).\n\n \n\n \n\nFONTES: CHAGAS, C. 113; CORRESP. SECRET. GER. EXÉRC.; Grande encic.\nDelta; Jornal do Brasil (17/4, 25/6 e 18/8/71 e 11/6/75); MIN. GUERRA.\nAlmanaque; Perfil (1972); Veja (22/12/71).\n\n \n","ref":"FONTES: CHAGAS, C. 113; CORRESP. SECRET. GER. EXÉRC.; Grande encic.\nDelta; Jornal do Brasil (17/4, 25/6 e 18/8/71 e 11/6/75); MIN. GUERRA.\nAlmanaque; Perfil (1972); Veja (22/12/71).\n\n \n","dic":"DHBB"}
