{"title":"MALAQUIAS, Guilherme","cargoss":["Senador"],"cargos_esp":[0],"datas_ini":[1954],"datas_fim":[1955],"estados":["DF"],"autor":[0],"content":"**MALAQUIAS, Guilherme**\n\n\\*sen. DF 1954-1955.\n\n \n\n*Guilherme Malaquias dos Santos Júnior* nasceu no Rio de Janeiro, então\nDistrito Federal, no dia 11 de fevereiro de 1907, filho de Guilherme\nMalaquias dos Santos e de Maria Acióli Santos.\n\nCursou o Ginásio 28 de Setembro e diplomou-se, em 1930, pela Faculdade\nNacional de Medicina da Universidade do Brasil, no Rio de Janeiro,\nespecializando-se em dermatologia.\n\nIngressou na política participando da fundação do Partido Trabalhista\nBrasileiro (PTB), criado em 1945 pelo presidente da República Getúlio\nVargas.\n\nNo pleito de outubro de 1950, elegeu-se suplente do senador Napoleão\nAlencastro Guimarães, eleito pelo Distrito Federal na legenda do PTB.\nOcupou uma cadeira no Senado de fevereiro a abril de 1954 e de agosto\ndesse ano a novembro do ano seguinte. Nesse período foi vice-presidente\nda Comissão de Legislação Social e membro da Comissão de Saúde do\nSenado. No campo trabalhista, conseguiu a aprovação do salário mínimo\nprofissional para os médicos e foi o autor da emenda que estendia a\nLegislação Trabalhista aos porteiros e empregados de edifícios.\nParticipou do Assembleia Mundial da Paz, realizada na então União\nSoviética, e em discurso no Senado relatou o encontro, defendendo uma\npolítica pacifista internacional, com prioridade à extinção das armas\natômicas.\n\nEm outubro de 1958, elegeu-se primeiro suplente de vereador no Distrito\nFederal, sempre na legenda do PTB, e, no pleito de outubro de 1962, foi\neleito suplente de deputado estadual no então estado da Guanabara, ainda\nna mesma legenda.\n\nCom a extinção dos partidos políticos pelo Ato Institucional nº 2\n(27/10/1965) e a posterior implantação do bipartidarismo, filiou-se ao\nMovimento Democrático Brasileiro (MDB), partido de oposição ao regime\nmilitar instalado no país em abril de 1964. No pleito de novembro de\n1966, obteve uma nova suplência de deputado estadual pela Guanabara na\nlegenda do MDB.\n\nComo médico, foi diretor do Hospital Eduardo Rabelo, diretor do\ndepartamento de Higiene e Saúde Pública da Guanabara e diretor-geral do\nServiço de Assistência Médica Domiciliar de Urgência (SAMDU); secretário\nda Sociedade Brasileira de Dermatologia, tesoureiro da Sociedade\nBrasileira de Sifilografia e membro titular do Colégio Latino-Americano\nde Dermatologia e Leprologia. Foi professor e atuou intensamente no\ncampo da deficiência visual. Foi eleito presidente do Conselho Estadual\npara o Bem-Estar dos Cegos, representou o estado da Guanabara na V\nAssembléia Geral do Conselho Mundial para o Bem-Estar dos Cegos,\npromovida pela Unesco, apresentou teses e coordenou simpósios sobre a\ncegueira, e tornou-se benemérito do Conselho Nacional para o Bem-Estar\ndos Cegos e da União dos Cegos no Brasil. Foi também membro do conselho\nsuperior da Associação Geral dos Cegos e representante do estado do Rio\nde Janeiro no IV Congresso Brasileiro de Educação de Deficientes\nVisuais, realizado em julho de 1975 em Curitiba, onde apresentou o\ntrabalho “A situação jurídica do cego na atual legislação do estado do\nRio de Janeiro”.\n\nFaleceu no Rio de Janeiro, no dia 12 de novembro de 1975.\n\nEra casado com Ivone Rodrigues dos Santos, com quem teve duas filhas.\n\nApós a sua morte, foi dado o nome de Guilherme Malaquias Júnior a uma\nrua de Jacarepaguá, no município do Rio de Janeiro.\n\nTeve os seguintes trabalhos publicados: *Moderno tratamento das\nqueimaduras* (1945), *Tratamento da sífilis pela penicilina* (1947),\n*Combate à sífilis sob o ponto de vista epidemiológico* (1947), *Estudo\nsobre mortalidade infantil* (1948), *Aspectos da lepra do Distrito\nFederal* (1951).\n\n \n\nFONTES: CISNEIROS, A. *Parlamentares*; INF. FAM.; SENADO. *Relação*;\nTRIB. SUP. ELEIT. *Dados* (2, 4, 6 e 8).\n\n \n","ref":"FONTES: CISNEIROS, A. *Parlamentares*; INF. FAM.; SENADO. *Relação*;\nTRIB. SUP. ELEIT. *Dados* (2, 4, 6 e 8).\n\n \n","dic":"DHBB"}
