{"title":"MALUF, Paulo","cargoss":["Prefeito","Governador de estado ou do Distrito Federal","Deputado federal","Candidato a presidência da República","Prefeito","Deputado federal"],"cargos_esp":["São Paulo",0,0,0,"São Paulo",0],"datas_ini":[1969,1979,1983,1989,1993,2007],"datas_fim":[1971,1982,1987,1989,1997,0],"estados":[0,"SP","SP",0,0,"SP"],"autor":[0],"content":"**MALUF, Paulo**\n\n\\*pref. São Paulo 1969-1971; gov. SP 1979-1982; dep. fed. SP 1983-1987;\ncand. pres. Rep. 1989; pref. São Paulo 1993-1997; dep. fed. SP 2007-\n\n \n\n*Paulo Salim Maluf* nasceu na cidade de São Paulo no dia 3 de setembro\nde 1931, filho do empresário Salim Farah Maluf e de Maria Estefno Maluf,\nambos de origem libanesa.\n\nFez o curso primário no Externato Elvira Brandão e o secundário no\nColégio São Luís, ambos na capital paulista. Seu pai morreu em 1943,\nquando era proprietário de uma serraria em São Paulo. Essa serraria foi\no ponto de partida para um conglomerado de 14 empresas encabeçado pela\nEucatex, sob o comando de seu irmão Roberto Maluf.\n\n Em 1954 graduou-se engenheiro civil pela Escola Politécnica da\nUniversidade de São Paulo (USP). No ano seguinte casou-se com Sílvia\nLutfalla, com quem teria quatro filhos. Iniciou então suas atividades\ncomo empresário, assumindo importantes cargos em diversas empresas da\nfamília: foi vice-presidente da Serraria Americana Salim Maluf S.A.,\ndiretor-superintendente da Imobiliária Santa Teresinha S.A.,\ndiretor-superintendente da Loma S.A. Agricultura, Administração e\nComércio, diretor-gerente da Salfema Ltda e diretor-superintendente da\nEucatex S.A. Indústria e Comércio.\n\nEm 1967 foi nomeado pelo secretário de Fazenda de São Paulo, Antônio\nDelfim Neto, presidente da Caixa Econômica Federal no estado, e no ano\nseguinte assumiu a vice-presidência da Associação Comercial de São\nPaulo, que tinha como titular o empresário Boaventura Farina, passando\ntambém a integrar o conselho da associação como membro vitalício.\n\nEm abril de 1969, graças ao apoio do presidente da República, marechal\nArtur da Costa e Silva, tornou-se prefeito de São Paulo, nomeado a\ncontragosto pelo governador do estado, Roberto Abreu Sodré (1967-1971),\nem substituição ao brigadeiro José Vicente Faria Lima (1965-1969).\n\nSua gestão na prefeitura foi marcada particularmente pela ênfase dada às\nobras viárias, pela ampliação da rede de escolas primárias e de nível\nmédio, e pela extensão da iluminação a vapor de mercúrio a quase toda a\ncidade. Ainda como prefeito, por ocasião das comemorações da vitória da\nseleção brasileira de futebol na Copa do Mundo realizada no México em\n1970, presenteou cada jogador com um automóvel. Em março de 1971 deixou\na prefeitura, sendo substituído por José Carlos de Figueiredo Ferraz\n(1971-1973), e assumiu a Secretaria de Transportes do estado, a convite\ndo governador Laudo Natel, empossado naquele mês. Esteve à frente da\nsecretaria até março de 1975, quando Natel foi substituído por Paulo\nEgídio Martins (1975-1979) no governo de São Paulo.\n\nNas eleições realizadas em março de 1976 para a presidência da\nAssociação Comercial de São Paulo, como candidato da situação, obteve\ncerca de 79% dos votos, derrotando o candidato oposicionista Felipe\nKehirallah Neto. Em seu discurso durante a cerimônia de posse, realizada\nno dia 31 de março, criticou a ineficiência das empresas estatais e\nreivindicou maior participação do empresariado nacional nas diretrizes\nda economia brasileira.\n\nEm conferência realizada para empresários mineiros em dezembro de 1977 —\nano marcado pelas discussões em torno da redemocratização do país, com a\nqual o governo do general Ernesto Geisel (1974-1979) vinha se\ncomprometendo — declarou-se radicalmente contra a extinção do Ato\nInstitucional nº 5 (AI-5), editado em dezembro de 1968, por considerá-lo\num instrumento imprescindível ao combate à corrupção e à subversão, que,\nem vez de extinto, deveria ser institucionalizado, como defendiam outras\nlideranças políticas. Contudo, dois meses depois, percebendo a\nirreversibilidade do processo de democratização, já declarado prioridade\ndo governo federal, e procurando evitar um distanciamento do poder\ncentral, reconsiderou a questão. Em encontro com Cláudio Lembo,\npresidente da seção paulista da Aliança Renovadora Nacional (Arena),\npartido de apoio ao regime militar, manifestou-se favorável à\nsubstituição do AI-5 por salvaguardas constitucionais, uma vez que,\ndesde a época de sua decretação, o país já havia evoluído, tornando\ninjustificada a sua manutenção.\n\n \n\nNo governo de São Paulo\n\nNo início de 1978 lançou-se candidato às eleições internas da Arena\npaulista, para a escolha do candidato à sucessão do governador Paulo\nEgídio Martins. Em fevereiro, licenciou-se dos cargos de presidente da\nAssociação Comercial de São Paulo e da Federação das Associações\nComerciais do Estado de São Paulo, e de suas empresas particulares, para\ndedicar-se exclusivamente à promoção de sua candidatura. Seu principal\nadversário era o ex-governador Laudo Natel, cujo nome, apoiado pelo\npalácio do Planalto, era recomendado pela direção nacional da Arena aos\nconvencionais. Não obstante, a convenção estadual do partido, reunida em\njunho de 1978, contando com grande quantidade de dissidentes, deu a\nPaulo Maluf a maioria dos votos e garantiu sua candidatura às eleições\nindiretas marcadas para setembro seguinte.\n\nLogo que foi conhecido o resultado da convenção, tiveram início\narticulações entre os setores que se opunham à sua eleição, com o\nobjetivo de impedir que esta se concretizasse. Assim, voltou a figurar\nnas páginas dos principais jornais do país o caso da Fiação e Tecelagem\nLutfalla. A empresa, de propriedade do sogro de Maluf e da qual ele\npróprio era um dos principais acionistas, estava envolvida desde 1977\ncom problemas na Justiça Federal, por ter contraído um empréstimo ao\nBanco Nacional de Desenvolvimento Econômico (BNDE) numa ocasião em que\nse encontrava em situação de pré-insolvência. O BNDE interveio na\nempresa em 1978 e bloqueou os bens dos acionistas. Os grupos contrários\nà candidatura de Maluf valeram-se do caso para declará-lo inelegível.\nMaluf argumentou não ter vínculos com a empresa atingida, e o recurso\nimpetrado por Laudo Natel no Tribunal Superior Eleitoral (TSE) foi\nderrotado em 17 de julho por quatro votos a dois.\n\nNo dia 1º de setembro de 1978, Maluf foi eleito governador de São Paulo\npelo Colégio Eleitoral****paulista, tendo como vice José Maria Marín. Na\nocasião, proferiu um discurso em que apontou como prioridades de seu\ngoverno a transferência da capital para o interior, definida como um\nimperativo para o desenvolvimento harmônico do estado, a defesa da\npequena e média empresa, assim como do pequeno e médio produtor, com a\npromessa de criação da Secretaria de Indústria e Comércio, e o\nestabelecimento do governo itinerante, de modo a percorrer\nsistematicamente o interior de São Paulo. Tomou posse em****15 de março\nde 1979, concomitantemente com o início do mandato presidencial do\ngeneral João Batista Figueiredo.\n\nEm decorrência do início das discussões em torno da reorganização\npartidária, uma vez que se cogitava extinguir os partidos existentes,\nArena e Movimento Democrático Brasileiro (MDB), este de oposição ao\nregime militar, os setores alinhados ao governo federal passaram a\narticular a formação da nova agremiação que lhes servisse de apoio.\nAssim, em setembro de 1979, Paulo Maluf apresentou a Figueiredo um\nmanifesto de apoio ao futuro partido do governo, assinado por 480\nprefeitos do estado de São Paulo. No dia 29 de novembro foi aprovada a\nextinção do bipartidarismo, o que abriu caminho para a formação de novos\npartidos. Surgiram o Partido Democrático Social (PDS), composto em sua\nmaioria por ex-integrantes da Arena, e ao qual Maluf se filiou, o\nPartido do Movimento Democrático Brasileiro (PMDB), sucessor do MDB, o\nPartido Trabalhista Brasileiro (PTB), o Partido Democrático Trabalhista\n(PDT), o Partido dos Trabalhadores (PT) e o Partido Popular (PP), que\nseria incorporado ao PMDB em fevereiro de 1982.\n\nDurante a greve dos metalúrgicos do ABC paulista em abril de 1980, que\nsignificou uma grave crise social para o estado devido ao impasse das\nnegociações, Maluf, em entrevista à imprensa, procurou diminuir a\nimportância do acontecimento, afirmando que se tratava de uma\nparalisação de apenas quatro fábricas montadoras de veículos. A greve\ndos metalúrgicos redundou na prisão dos seus líderes — entre os quais\nLuís Inácio da Silva, conhecido como Lula —, que foram incursos na Lei\nde Segurança Nacional e destituídos de seus cargos sindicais.\n\nEm junho de 1980, durante um comício de Maluf no bairro paulista da\nFreguesia do Ó, manifestantes que protestavam contra seu governo foram\nagredidos, segundo depoimentos de testemunhas, por agentes de órgãos de\nsegurança. O episódio teve grande repercussão estadual e nacional, por\nenvolver deputados de oposição, líderes populares e padres.\n\nSeu governo caracterizou-se pela implementação de grandes obras viárias,\ncomo a construção da rodovia dos Trabalhadores, ligando São Paulo a\nGuararema, a duplicação da via Anhanguera, o prolongamento da rodovia\nCastelo Branco e a construção do aeroporto de Cumbica. Entre outros\nfeitos de sua administração, destacam-se também a modernização de trens\ne estações e a eletrificação de ferrovias, a construção de usinas\nhidrelétricas, assegurando ao estado 99,37% de autonomia energética, a\nimplantação do sistema Cantareira, para fornecer água a nove milhões de\npessoas, e a criação do Grupo de Assessoria e Participação (GAP), para\nintegrar estado e comunidade. Maluf passou a ser considerado, pelo vulto\ndos recursos que empenhou na promoção de seu nome, um dos mais fortes\ncandidatos civis à sucessão de Figueiredo. Esmerou-se em articular um\nforte apoio no Congresso e notabilizou-se por distribuir ambulâncias a\nmunicípios pobres do Nordeste. Na área econômica, criou duas empresas\ndurante seu governo: a Eletropaulo, uma *holding*reunindo usinas\nhidrelétricas do estado, e a Paulipetro, voltada para a pesquisa de\npetróleo em São Paulo e outros pontos do território nacional. Apesar dos\nesforços, até o final de seu governo a Paulipetro encontrou apenas\ndepósitos de gás. O insucesso dessa empresa acabaria por provocar sua\nextinção em 1983 pelo governador André Franco Montoro (1983-1987).\n\nMaluf desincompatibilizou-se do governo do estado em maio de 1982,\npassando-o ao vice-governador José Maria Marín, e candidatou-se a\ndeputado federal por São Paulo na legenda do PDS. Em 15 de novembro\nelegeu-se com mais de seiscentos mil votos, tendo sido o deputado mais\nvotado do país. No entanto, seu candidato ao governo de São Paulo,\nReinaldo de Barros, foi derrotado, por 2,4 milhões de votos de\ndiferença, por Franco Montoro, candidato do PMDB.\n\n \n\nA sucessão de Figueiredo\n\nEm fevereiro de 1983, Maluf assumiu o mandato na Câmara dos Deputados e,\nsaindo na frente, apresentou-se como candidato à sucessão de João\nFigueiredo na presidência da República. Contava, então, com a simpatia\ndo ex-presidente Emílio Médici e a desaprovação do ex-presidente Ernesto\nGeisel, do ex-ministro do Gabinete Civil Golbery do Couto e Silva e do\npresidente Figueiredo. Este, apesar de desaprovar a candidatura do\nex-governador paulista, e não obstante o papel que lhe fora outorgado\npelo PDS de coordenador do processo sucessório, não só não estabeleceu\nnenhum veto formal à candidatura Maluf, como recusou-se a indicar um\ncandidato preferido, abrindo espaço para o avanço da disputa\nintrapartidária. Nesse contexto, apresentando-se como candidato\nindependente dentro do partido e estando fora do *staff*governamental,\nMaluf pôde levar à frente sua campanha livre dos embaraços que tolhiam\nseus principais adversários, o então ministro do Interior Mário\nAndreazza, preferido de Figueiredo, e o vice-presidente da República\nAureliano Chaves, que se viam obrigados a, pelo menos formalmente,\naguardar a definição oficial do palácio do Planalto. O outro candidato a\ncandidato do PDS era Marco Maciel.\n\nA campanha de Maluf ganhou novo alento em dezembro de 1983, quando,\nalegando a impossibilidade de alcançar o consenso que almejava, o\npresidente Figueiredo abdicou da coordenação da escolha do candidato do\nPDS à sua sucessão, devolvendo ao partido a responsabilidade de\ndescobrir um nome capaz de reunir a maioria das preferências. Essa\nreviravolta no jogo sucessório beneficiou diretamente a candidatura de\nMaluf, que tinha melhores condições de disputar a convenção do PDS.\n\nEm janeiro de 1984 Maluf apresentou ao PDS o documento Brasil-Esperança,\nsua plataforma política e programa de governo, centrado na defesa da\niniciativa privada, do crescimento econômico do Nordeste e da\nausteridade econômica (contra as mordomias). O candidato posicionava-se\ntambém contra a redução do mandato presidencial e a favor da elaboração\nde uma nova constituição para o país.\n\nNo mês seguinte participou de uma reunião a que estiveram presentes,\nalém do presidente e dos principais ministros, os outros três virtuais\ncandidatos do PDS. Buscando retomar a condução do processo de sucessão,\nFigueiredo se disse disposto a conter, inclusive por meio da repressão\nmilitar, a campanha então em curso das Diretas Já. Promovida\npoliticamente pelo PMDB e marcada por grandes comícios e mobilização\npopular, a campanha era favorável à emenda Dante de Oliveira, que\npropunha a escolha do presidente pelo voto popular em novembro daquele\nano. Na mesma reunião, o presidente deu um recado aos candidatos do PDS:\nou os perdedores se comprometiam a apoiar o nome vitorioso na convenção,\nou os quatro deveriam retirar a candidatura em favor de um nome de\nconsenso.\n\nNão obstante a intensa mobilização popular em favor das eleições\ndiretas, na sessão da Câmara realizada em 25 abril de 1984, a emenda\nDante de Oliveira não obteve o número de votos indispensáveis à sua\naprovação — faltaram 22 para que pudesse ser encaminhada à apreciação\npelo Senado Federal. A votação transcorreu sob fortes restrições às\nliberdades individuais, garantidas pela decretação do estado de\nemergência em Brasília e pela intimidação promovida pelo Comando Militar\ndo Planalto, liderado pelo general Newton Cruz. Maluf se ausentou da\nvotação da emenda.\n\nA oposição a Maluf dentro do governo, ancorada no Gabinete Civil de\nLeitão de Abreu, e no interior do PDS — desde seu presidente, o senador\nJosé Sarney, até o líder do partido na Câmara, Nélson Marchezan —\nensejou algumas medidas tentando detê-lo. Uma delas foi a emenda\nFigueiredo, formulada pelo ministro Leitão de Abreu e apresentada pelo\npresidente, regulamentando as eleições presidenciais indiretas de 1985 e\nrestabelecendo as eleições diretas para 1988. A proposta do governo,\naprovada pelo Congresso em junho, além de possibilitar o registro de uma\ncandidatura presidencial sem filiação partidária, retirava a exigência\nde maioria absoluta para a eleição do presidente pelo Colégio Eleitoral.\nEsta última medida enfraquecia as candidaturas tanto de Maluf como de\nAndreazza, pois, na prática, representava mais um estímulo para os\npedessistas que não desejassem votar em nenhum dos dois postulantes.\n\nAinda em junho de 1984, José Sarney, apoiado pelo presidente Figueiredo,\nanunciou a decisão de promover uma prévia entre os cerca de cem mil\nfiliados que ocupassem postos eletivos ou cargos em diretórios, desde os\nmunicipais, para saber quem era o preferido da legenda para sair\ncandidato na convenção marcada para setembro. Esta seria uma versão\nbrasileira das eleições primárias americanas e uma clara tentativa de\nunir as várias facções partidárias contra Maluf. Em nota oficial, Maluf\ninformou que não permitiria a inclusão de seu nome nesse tipo de\nconsulta, fórmula sobre a qual sequer havia sido consultado e que\nqualificou de mais um casuísmo de seus adversários, prova de sua\nfraqueza.\n\nO bloco malufista logo organizou sua contra-ofensiva. Ainda em junho,\napós convencer o presidente Figueiredo a retirar seu apoio à proposta,\nalegando que ela só beneficiaria Aureliano Chaves, com quem o presidente\nvinha se desentendendo, Maluf conseguiu o apoio necessário para vetar as\nprévias na reunião do diretório nacional do partido convocada justamente\npara planejar sua realização. A reviravolta na posição de Figueiredo e\nda direção do PDS levou José Sarney a abandonar o partido. Reunidos na\nFrente Liberal, Sarney e outros dissidentes antimalufistas, liderados\npelo vice-presidente Aureliano Chaves — que desistira de concorrer na\nconvenção do PDS —, passaram a apoiar a candidatura do então governador\nde Minas Gerais, Tancredo Neves, que foi lançada oficialmente pelo PMDB\nem julho e contou desde então com o apoio dos demais partidos de\noposição. O partido governista rachara de vez, e Maluf e seu grupo, o\nque sobrou de organizado na agremiação, estavam livres para seguir em\nfrente.\n\nMesmo sem o apoio do Planalto e da maioria dos governadores eleitos pelo\nvoto popular em 1982, Maluf tornou-se o candidato oficial do PDS à\npresidência em 12 de agosto de 1984, após conquistar 493 votos na\nconvenção partidária, contra os 350 dados a Mário Andreazza, que logo\nintegraria, com seu grupo, a campanha oposicionista.\n\nA vitória de Maluf na convenção pode ser creditada a um trabalho\npersistente de convencimento — visitou ao menos duas vezes cada estado\nbrasileiro em busca de votos dos convencionais — e às suas boas\ncondições financeiras, bem como a seus métodos pouco ortodoxos de\ntrabalho. Sua campanha, coordenada pelo empresário Calim Eid, seu\nassessor desde que fora prefeito, caracterizou-se pelo uso de\nexpedientes tais como o envio de telegramas de cumprimento àqueles que\naniversariavam, a oferta de presentes a autoridades, a promoção de\nbanquetes e outras práticas consideradas clientelistas, incluindo a\najuda a convencionais em casos de doença, e também a membros do Colégio\nEleitoral filiados a outros partidos.\n\nUma vez lançada oficialmente a chapa do PDS — que apresentava, como\ncandidato a vice, o deputado federal cearense Flávio Marcílio, então\npresidente da Câmara — Maluf procurou ampliar as adesões dentro do\ngoverno. Apesar de seu esforço para unificar o partido em torno de seu\nnome, e da mobilização que conseguiu na máquina administrativa do\ngoverno federal — inclusive com a demissão de alguns funcionários\nestratégicos, que haviam sido nomeados por políticos que agora\nintegravam a Frente Liberal —, a candidatura malufista não chegou a se\ntransformar em uma real opção para o governo. Tentativas de\ndesestabilização do processo sucessório eram promovidas pelo próprio\npalácio do Planalto, como ameaças de prorrogação do mandato do\npresidente Figueiredo, de lançamento de candidaturas militares e mesmo\nde veto ao candidato oficial do PDS. De toda forma, em setembro,\nFigueiredo fez um pronunciamento ao país, por cadeia nacional de rádio e\ntelevisão, em que reiterou seu apoio a Maluf. Na mesma época, foram\ndivulgadas notas oficiais dos ministros militares acusando a oposição de\nradicalizar a campanha de sucessão e colocar em risco a estabilidade do\nregime e o futuro da abertura, referindo-se aos comícios e ao apoio\nostensivo das organizações clandestinas de esquerda à candidatura\nTancredo Neves.\n\nEm seguida, porém, Maluf recebeu dois duros golpes. Ainda em setembro, o\nempresário paulista Armando Ferraz de Almeida Prado, dono da construtora\nAlmeida Prado, apresentou à comissão parlamentar de inquérito (CPI) da\nAssembleia Legislativa de São Paulo que apurava denúncias de\nirregularidades no governo Maluf provas de que pagara comissão ao\ngoverno para receber em dia faturas de obras executadas. O segundo golpe\npartiu do ex-governador da Bahia Antônio Carlos Magalhães, também\nconhecido como ACM, dissidente pedessista, que o acusou publicamente de\ncorrupto, dando início a uma longa querela judicial entre os dois.\n\nDocumentos apresentados por ACM sustentavam que Maluf havia oferecido\nfavores e dinheiro a delegados da antiga Arena em 1978, em troca de\nvotos na convenção que escolheria, entre ele e Laudo Natel, o governador\nde São Paulo. ACM ressuscitou o “caso Lutfalla” e retomou acusações\nfeitas em abril de 1984 pelo vereador carioca Hélio Fernandes Filho, que\nentão movia contra o deputado um processo pelo recebimento indevido de\nsubsídios do Congresso Nacional sem ter comparecido às sessões. O\nex-governador baiano reportou-se ainda a duas sentenças judiciais\ncondenando Maluf pelo mau uso de verbas oficiais: em 1982 fora\nresponsabilizado por gastar dinheiro público na compra de flores e\npresentes para mulheres de políticos, e em 1984, condenado por utilizar\nrecursos da Imprensa Oficial em benefício de sua candidatura a deputado\nfederal.\n\nSem apoio popular — fez pouquíssimos comícios, sendo o primeiro em\nnovembro de 1984, e chegou a ser vítima de agressões populares nas ruas\nde Aracaju —, Maluf viu-se cada dia mais isolado politicamente. Foi\nacusado pelo deputado pedessista Alceni Guerra e pelo cacique Mário\nJuruna, deputado do PDT, de tentar comprar-lhes os votos. No final de\noutubro, a maioria dos governadores do PDS havia aderido à candidatura\noposicionista, restando a Maluf apenas o apoio de Jorge Teixeira, de\nRondônia, Júlio Campos, de Mato Grosso, e Wilson Braga, da Paraíba. No\ninício de novembro, o TSE determinou que a fidelidade partidária não\nvaleria para o Colégio Eleitoral, decisão que liberava os parlamentares\ndo PDS para votar em Tancredo. Segundo a revista *Veja*, ainda em\nnovembro Maluf chegou a ser procurado pelo ministro Delfim Neto, que\ntentou, inutilmente, convencê-lo a renunciar à candidatura.\n\nNo pleito indireto de 15 de janeiro de 1985, o Colégio Eleitoral (686\nmembros) deu a Maluf 180 votos, cifra bem maior do que as previsões\nfeitas no final da campanha. Com 480 votos, Tancredo Neves foi eleito\npresidente da República, em chapa com o vice José Sarney, já transferido\npara o PMDB. Abstiveram-se 26 parlamentares.\n\nEm 19 de janeiro Maluf embarcou com a família para a Europa para um mês\nde férias. Antes, porém, deu uma demonstração de força partidária no\nPDS: conseguiu aprovar a decisão de que caberia à executiva nacional —\nna qual seu grupo tinha maioria —, e não mais ao líder do partido na\nCâmara, negociar com as outras legendas a composição da futura mesa da\ncasa, infligindo uma derrota ao então líder pedessista Nélson Marchezan,\nque se abstivera de votar no Colégio Eleitoral para não apoiá-lo. Em\nfevereiro reassumiu seu lugar na Câmara dos Deputados, prometendo fazer\numa oposição vigilante.\n\n \n\nAs derrotas em eleições diretas\n\nNas eleições de novembro de 1986 Maluf candidatou-se ao governo do\nestado de São Paulo na legenda da coligação União Popular, capitaneada\npelo PDS e abrigando o Partido da Frente Liberal (PFL) — que reunia,\nbasicamente, os ex-pedessistas que apoiaram Tancredo Neves — e mais seis\npequenos partidos. Embora a coligação PDS-PFL se tivesse efetivado então\nem oito estados, a opção do PFL paulista por sua candidatura não foi\npartilhada pela direção nacional do partido, que preferia apoiar o\nempresário Antônio Ermírio de Morais, candidato do PTB.\n\nMaluf centrou sua campanha na defesa da segurança dos cidadãos,\nprometendo o construir cadeias e “colocar a polícia nas ruas”, em uma\ncrítica direta ao governo de Franco Montoro, do PMDB, que teria feito\n“dos direitos humanos dos bandidos a lei de seu governo”. Não obstante\nter figurado durante quase toda a campanha como o preferido nas\npesquisas eleitorais, ficou em terceiro lugar na disputa, vencida pelo\ncandidato do PMDB Orestes Quércia. Nesse pleito, o PMDB conquistou o\ngoverno de mais de 21 estados brasileiros e mais da metade das cadeiras\nna Assembleia Nacional Constituinte, desempenho atribuído ao sucesso\ninicial do programa de estabilização econômica implementado pelo governo\ndo presidente José Sarney, conhecido como Plano Cruzado.\n\nAinda em 1986 Maluf reassumiu seu posto na Eucatex — então o segundo\nmaior fabricante de conglomerados de madeira do país, exportados para\nmais de 50 países, com quase seis mil funcionários —, lá permanecendo,\nporém, por pouco tempo, em função dos desentendimentos com seu irmão,\nRoberto Maluf, diretor-presidente da empresa, e sua mãe, Maria Maluf.\n\nEm janeiro de 1987, ao final da legislatura, deixou a Câmara dos\nDeputados. Durante todo o seu mandato como deputado federal, apresentou\noito projetos e duas emendas à Constituição, não conseguindo, no\nentanto, aprovar essas propostas. O principal projeto que formulou, de\n1985, garantia o direito de greve por atraso de pagamento de salários.\n\nDiante da retirada, à última hora, da candidatura do empresário Sílvio\nSantos, proprietário do Sistema Brasileiro de Televisão (SBT), à\nsucessão de Jânio Quadros na prefeitura de São Paulo no pleito de\nnovembro de 1988, foi lançado candidato por uma coligação entre o PDS e\ncinco pequenos partidos. Disputando com Luísa Erundina, do PT, João\nOsvaldo Leiva, do PMDB, e José Serra, do Partido da Social Democracia\nBrasileira (PSDB), Maluf — considerado favorito pelas pesquisas e pelos\npróprios adversários até uma semana antes da eleição — acabou sendo\nderrotado pela candidata petista, que, apesar de não contar com recursos\nnem apoio da direção partidária, mas com o suporte da militância,\nconquistou quase 30% do eleitorado paulistano, recebendo mais de 1,5\nmilhão de votos. Maluf ficou em segundo lugar, com cerca de 1,3 milhão\nde votos.\n\nCandidatando-se à presidência da República na legenda do PDS no pleito\nde novembro de 1989, primeira eleição direta para presidente desde 1960,\nconcorreu com Leonel Brizola, do PDT, Mário Covas, do PSDB, Fernando\nCollor de Melo, do Partido da Reconstrução Nacional (PRN), Lula, do PT,\nUlisses Guimarães, do PMDB, Guilherme Afif Domingos, do partido Liberal\n(PL), e Roberto Freire, do Partido Comunista Brasileiro (PCB), entre\noutros candidatos.\n\nSua campanha ganhou amplo espaço na mídia, nem sempre pelas propostas\npolíticas. Algumas de suas declarações tiveram repercussão negativa,\nprincipalmente o conselho que dirigiu a acusados de abusos sexuais: “Se\ntem vontade sexual, tudo bem: estupra, mas não mata.” A frase seria\nrepetidamente utilizada contra Maluf pela imprensa e por seus opositores\na partir de então. No plano político, defendeu a privatização das\nestatais, a demissão de funcionários públicos “fantasmas”, não\nconcursados e com duplo emprego, a livre negociação salarial entre\nempresas e sindicatos e a isenção de imposto de renda para os\ntrabalhadores com renda até 20 salários mínimos. Prometeu também\nrenegociar com os credores internacionais as condições para o pagamento\nda dívida externa.\n\nDerrotado já no primeiro turno, em 15 de novembro, foi o segundo\ncolocado no estado de São Paulo, ficando atrás apenas Fernando Collor de\nMelo. Na votação nacional foi o quinto colocado, com 5.986.012 votos\n(8,9%). Manifestou a intenção de apoiar o candidato do PRN no segundo\nturno, que seria disputado em dezembro com o candidato do PT. No\nentanto, Collor, cujo discurso pregava a renovação e a moralidade na\npolítica, declarou não aceitar o apoio de Maluf, que fora seu padrinho\nde casamento em 1984. Realizado o segundo turno, Collor derrotou Lula e\niniciou seu governo em janeiro de 1990. Maluf apoiou as principais\nmedidas do novo governo, sobretudo aquelas destinadas a reduzir os\ngastos públicos e de efeito moralizante, como o leilão das casas dos\nministros e dos carros oficiais, embora fizesse críticas a vários pontos\ndo plano econômico então posto em prática, como o bloqueio da poupança\ndos pequenos poupadores.\n\nMaluf voltou a candidatar-se ao governo de São Paulo nas eleições de\noutubro de 1990, sempre na legenda do PDS. Assumiu, nessa campanha, um\nnovo estilo político, construído com o auxílio do marqueteiro José\nEduardo (Duda) Mendonça, que participaria de todas as suas campanhas\nseguintes e se tornaria um dos mais requisitados profissionais de\n*marketing* para campanhas políticas. A orientação dos “marqueteiros”\ntornou-se, durante a década de 1990, estratégia fundamental para a\nconstrução da imagem pública dos candidatos e políticos. Preferindo não\naparecer em debates na TV e falando o mínimo possível, Maluf prometeu\nmaior austeridade nos gastos públicos e concentrou-se na defesa da\nsegurança global, novo conceito de segurança que abrangia a garantia de\neducação, saúde, segurança no emprego e na habitação, prometendo\nconstruir quatrocentas mil casas populares em quatro anos. Apesar de\nfavorito — chegou a ter 42% nas pesquisas — perdeu as eleições para o\ncandidato do PMDB Luís Antônio Fleury Filho, apoiado pelo governador\nOrestes Quércia.\n\nEm junho de 1992, Maluf foi confirmado como candidato do PDS à\nprefeitura de São Paulo no pleito de outubro seguinte, em coligação que\nincluía o PL e o PTB. Em setembro defendeu que o PDS fechasse questão em\nrelação ao afastamento do presidente Collor, cuja situação tornava-se\ncada vez mais difícil desde que o irmão Pedro Collor divulgara acusações\nassociando o presidente a transações ilegais e tráfico de influência,\nexercidos por um suposto “testa-de-ferro”, Paulo César Farias, o PC.\nApós a aprovação da abertura do processo de *impeachment* pela Câmara em\n29 de setembro, o presidente renunciaria ao cargo em 29 de dezembro,\npouco antes de o Senado julgar seu destino político, sendo então\nefetivado o vice Itamar Franco, já então presidente interino.\n\nNo primeiro turno das eleições municipais, realizado em outubro, Maluf\nfoi o candidato mais votado. Disputou o segundo turno, em 15 de\nnovembro, com o senador Eduardo Suplicy, do PT, sendo eleito com 58,07%\ndos votos. Obteve assim sua primeira condução direta a um cargo\nmajoritário, após quatro derrotas consecutivas. Assumiu a prefeitura de\nSão Paulo em janeiro de 1993, prometendo fazer da cidade “um canteiro de\nobras”.\n\n \n\nDenúncias na corrida para a presidência em 1994\n\nEm fevereiro de 1993, a dois meses do plebiscito marcado para abril,\nMaluf anunciou seu apoio ao sistema de governo parlamentarista, com\neleição direta para presidente da República, embora ressalvando que o\nsucesso do regime dependeria de algumas garantias, como o voto\ndistrital, a limitação do número de partidos, a fidelidade partidária e\na possibilidade de o Congresso ser dissolvido. Para defender essas\ngarantias, solicitou um espaço próprio na campanha pró-parlamentarismo.\nÀs vésperas do plebiscito, porém, reverteu sua posição, anunciando que\ndefenderia a manutenção do regime presidencialista.\n\nAinda em abril criou o Partido Progressista Reformador (PPR), fusão do\nPDS com o Partido Democrata Cristão (PDC), à qual se juntaram também 14\nparlamentares do PFL, Partido Social Cristão (PSC), PTB, PL e PRN. A\nnova legenda tornava-se assim a terceira bancada da Câmara, maior que as\ndo PSDB, do PDT e do PT, contando com 72 deputados e dez senadores, além\nde 865 prefeitos em todo o país. O esforço pessoal de Maluf para\nconquistar deputados para a nova agremiação foi interpretado pela\nimprensa e pela classe política como uma estratégia visando à ampliação\ndo seu tempo no programa eleitoral gratuito dos candidatos às eleições\npresidenciais de 1994, em que julgava poder surgir como polo aglutinador\ndo eleitorado conservador.\n\nA estratégia de Maluf para chegar à presidência da República foi, no\nentanto, minada por seu envolvimento em uma série de escândalos. Em\njunho de 1993, como decorrência de investigações da Receita Federal,\nquatro auxiliares diretos do prefeito — seu tesoureiro de campanha,\nCalim Eid, o pianista João Carlos Martins, dono da empresa Paubrasil, e\nseus sócios, Ettore Gagliardi e Ricardo Freire — foram denunciados à\nJustiça por crime eleitoral, acusados de haver levantado, entre 1990 e\n1992, 19 milhões de dólares para o caixa das campanhas de Maluf,\nburlando a legislação eleitoral em vigor na época, que proibia\nempresários de contribuir para o cofre dos candidatos. O caso Paubrasil,\ncomo ficou conhecido na imprensa, envolveu também a denúncia do\nempresário David Fischel, um dos diretores da Montreal Engenharia, de\nque pagava à empresa de Martins uma comissão de 3,5% sobre tudo o que a\nMontreal, com o auxílio da Paubrasil, conseguisse receber de pagamentos\natrasados da Companhia Siderúrgica Paulista (Cosipa), da qual era\nfornecedora. Sem negar seus vínculos com Martins, que admitiu ter\nlevantado dinheiro para custear as despesas da campanha malufista de\n1990, Maluf preferiu, ao invés de tentar provar sua inocência, atacar o\nPT e a Central Única dos Trabalhadores (CUT), questionando a origem de\nseu dinheiro. Em seu entendimento a Receita não chegara à Paubrasil por\nacaso, mas sim em decorrência de uma conspiração maquinada para quebrar\nsua candidatura à presidência da República. As empreiteiras seriam\nmultadas pela Receita Federal, e os envolvidos denunciados pela\nProcuradoria da República por falsidade ideológica e sonegação. Apenas\nem outubro de 1996 o Supremo Tribunal Federal (STF) extinguiria o\nprocesso, passando-o à Justiça Eleitoral.\n\nEm abril de 1994, novo escândalo: o nome do prefeito figurava nos livros\ncontábeis do banqueiro do jogo do bicho do Rio de Janeiro, Castor de\nAndrade, encontrados pela polícia em operação comandada pelo Ministério\nPúblico num dos escritórios do “bicheiro”, ao lado de mais de cem\npolíticos, delegados, juízes, policiais civis e militares e jornalistas\nque, supostamente, recebiam dinheiro da contravenção, como propina,\nverba de campanha ou filantropia. Pelos livros, Maluf teria recebido\n10.700 dólares como contribuição para sua campanha para a presidência em\n1989. A acusação foi veementemente negada pelo prefeito, que encaminhou\nà Justiça queixa-crime por difamação contra o procurador-geral Antônio\nCarlos Biscaia, autor da denúncia.\n\nCom sua imagem abalada em consequência de todas essas acusações, Maluf\ndesistiu de disputar as eleições presidenciais de 1994, alegando não\nquerer deixar a prefeitura paulista. Em seu lugar, concorreu pelo PPR o\nex-governador de Santa Catarina Esperidião Amin, que foi derrotado. O\nex-ministro da Fazenda do presidente Itamar Franco, senador Fernando\nHenrique Cardoso, candidato da coligação PSDB-PFL, conquistou o palácio\ndo Planalto já no primeiro turno eleitoral, em 3 de outubro.\n\nNa disputa pelo governo de São Paulo, sem contar com um candidato de seu\npartido, Maluf liberou seus eleitores para apoiar o sindicalista Luís\nAntônio de Medeiros, candidato do PTB, que não chegou a obter 3% dos\nvotos. No segundo turno das eleições, realizado em 15 de novembro, o\nprefeito e o PPR deram seu apoio formal a Mário Covas, candidato do\nPSDB, apoiado também pelo PT e pelo PMDB, alegando que o “senador tucano\ntem mais experiência e mais equilíbrio que seu adversário”, o candidato\ndo PDT Francisco Rossi, que fora seu secretário de Esportes em 1980.\n\nEm agosto de 1995, Maluf criou o Partido Progressista Brasileiro (PPB),\nresultado da fusão do PPR com o Partido Progressista (PP).\n\n \n\nNa prefeitura de São Paulo\n\nA segunda gestão de Maluf na prefeitura de São Paulo, iniciada em 1993,\nfoi marcada pela realização de grandes obras, sobretudo viárias. Em 1995\ndeu início ao que seria uma das marcas de sua administração, o Projeto\nCingapura, de “verticalização de favelas”. Com um empréstimo de 150\nmilhões de dólares do Banco Interamericano de Desenvolvimento (BID), fez\nconstruir, no lugar de favelas, prédios de apartamentos com\ninfraestrutura básica, rompendo com a tradição dos governos anteriores\nde transferir favelados para a periferia. Das 38 favelas beneficiadas,\napenas dez tiveram todos os barracos eliminados; nos demais casos,\nsomente uma parcela dos favelados foi escolhida para se transferir para\nos apartamentos, ao custo de uma prestação mensal de aproximadamente\nmeio salário mínimo, comprometendo-se a prefeitura com a urbanização do\nresto da favela.\n\nApesar de atender a um número relativamente pequeno de pessoas, o\nProjeto Cingapura tornou-se assunto nacional, fez parte do programa\neleitoral dos candidatos do PPB em todo o país e foi até elogiado pelos\nadversários. Não obstante seu sucesso, muitos reconheceram no projeto\numa estratégia de promoção pessoal do prefeito, pelo fato de a maioria\ndos prédios ter sido construída à beira de grandes avenidas,\ngarantindo-lhes visibilidade. Em muitos casos, a parte da favela\nescondida atrás dos prédios continuou abandonada, não tendo sido\ncumprida a promessa de levar água, luz, esgoto e ruas asfaltadas até os\nbarracos.\n\nOutro trunfo de Maluf na área social foi a criação, em 1994, do Plano de\nAtendimento à Saúde (PAS), promovendo uma reestruturação do setor de\nsaúde municipal, cujos hospitais e postos de saúde passaram a ser\ngeridos por cooperativas de médicos. Apesar de ter sido acusado pela\nbancada do PT de ser a ponta-de-lança para a privatização dos hospitais\nmunicipais, o PAS foi avaliado positivamente pela população.\n\nAo longo de sua gestão na prefeitura paulista, orientado por Duda\nMendonça, Maluf procurou “amplificar” sua imagem de tocador de obras,\napresentando-se também como governante preocupado com o meio ambiente e\na saúde dos cidadãos, autor de projetos como o programa Leve-Leite — que\ncontemplava cada aluno da rede municipal com 90% de frequência às aulas\ncom uma lata de dois quilos de leite em pó por mês — e dos decretos\nproibindo a venda de armas de brinquedo hiper-realistas, obrigando ao\nuso do cinto de segurança nos automóveis, e proibindo fumar nos bares e\nrestaurantes de São Paulo, entre outros.\n\nSua campanha de autopromoção envolveu ainda a contratação pela\nprefeitura, por 1,2 milhão de reais, da Rede Globo de Televisão para\norganizar e transmitir para todo o país a I Maratona Internacional de\nSão Paulo, realizada em 8 de outubro de 1995, cujo trajeto passava junto\nde nove das principais obras do prefeito — inclusive o túnel Aírton\nSena, inaugurado um dia antes. A cobertura integral da maratona — que\ndurou três horas e incluiu a entrega, pelo prefeito, dos troféus — foi\ndenunciada pelos adversários de Maluf como mais um caso de utilização de\nverba pública para promover a imagem do presumível candidato às eleições\npresidenciais de 1998.\n\n \n\nAs eleições municipais e presidenciais\n\nPara o último ano de sua gestão na prefeitura, Maluf acalentava dois\nobjetivos complementares: eleger seu sucessor e articular apoios para\nsua possível candidatura presidencial em 1998. Em abril de 1996, lançou\ncomo candidato à sua sucessão, na legenda do PPB, seu secretário de\nFinanças Celso Pitta. No campo das articulações políticas, valeu-se da\nforça do PPB no Congresso para pressionar o presidente Fernando Henrique\nCardoso, ameaçando não colaborar em votações importantes, principalmente\nna da emenda constitucional da reeleição, prevista para o ano seguinte.\n\nAinda em abril de 1996, o PPB aceitou a oferta da pasta da Indústria,\nComércio e Turismo, assumida pelo deputado federal pelo Rio de Janeiro,\nFrancisco Dornelles. Maluf liderara o grupo pepebista contrário à\naceitação do ministério, temendo que o partido perdesse sua autonomia,\numa vez que passaria a integrar o governo federal. O presidente nacional\ndo PPB, Esperidião Amin, em reunião da bancada do partido na Câmara com\na Executiva Nacional, liderou o processo de aceitação da pasta. Mesmo\ncom o acordo, Maluf deixou claro que a presença do PPB no ministério de\nFernando Henrique não significava adesão à proposta da reeleição.\n\nEmbora mantendo-se favorável às reformas propostas pelo Executivo, Maluf\npassou a posicionar-se criticamente em relação a algumas políticas do\ngoverno, tentando distanciar-se da imagem de governista. Nesse sentido,\ncondenou publicamente a ajuda federal aos bancos, através do Programa de\nEstímulo à Reestruturação e ao Fortalecimento do Sistema Financeiro\nNacional (Proer), e a política cambial adotada com o plano de\nestabilização econômica do governo, o Plano Real, a qual, em sua\nopinião, ao tornar o produto importado mais barato, prejudicava o\nexportador e estimulava o desemprego.\n\nAo lado de Lula, do PT, de Leonel Brizola, do PDT, e de Orestes Quércia,\ndo PMDB, Maluf foi um dos articuladores da campanha contra a aprovação\nda emenda constitucional proposta pelo governo permitindo a reeleição\npara cargos executivos já nas eleições de 1998. Embora fosse defensor da\ntese em princípio, condenou a proposta por entender que ela só\nbeneficiaria o presidente: “Ou a mudança vale para todo mundo, ou não\nvale para ninguém. Reeleição apenas para presidente é tornar mesquinha,\negoísta e casuística a discussão de uma tese política.”\n\nCom esse tipo de “apoio crítico”, Maluf conseguiu manter o governo\nfederal relativamente neutro quanto às eleições em São Paulo em outubro\nde 1996. Nem mesmo a troca de farpas entre o prefeito e o ministro das\nComunicações, Sérgio Mota — do PSDB e amigo pessoal do presidente, que\ndefendia a candidatura do também tucano e amigo José Serra —, afetou o\npoder de influência política de Maluf junto ao Planalto. No segundo\nturno das eleições paulistanas, a ser disputado por Celso Pitta e Luísa\nErundina, do PT, uma vez que José Serra ficara em terceiro lugar no\nprimeiro turno, Fernando Henrique divulgou nota liberando seus ministros\npara apoiar quem desejassem. A “carta branca” favoreceu o candidato\nmalufista, que recebeu a adesão formal do ministro da Articulação\nPolítica, Luís Carlos Santos, do PMDB. Em 15 de novembro, Pitta foi\neleito prefeito de São Paulo, confirmando a liderança nas urnas obtida\nno primeiro turno. A eleição do sucessor foi uma vitória política de\nMaluf, que voltou a ambicionar o posto mais alto da República.\n\nEm dezembro, Paulo Maluf assumiu as ações da Eucatex que pertenciam a\nseus irmãos, a maior parte a Roberto Maluf, em troca de imóveis. A\nsolução teria posto fim a anos de disputa na família. Paulo Maluf passou\nassim a ser o único dono da empresa e destinou a presidência do grupo ao\nfilho Flávio.\n\nA aproximação do fim de seu mandato na prefeitura suscitou críticas da\nimprensa, pelas obras inacabadas e a enorme dívida pública que deixava\npara o sucessor. Passou o cargo de prefeito de São Paulo a Celso Pitta\nem 1º de janeiro de 1997.\n\nCandidato ao governo de São Paulo\n\nEm janeiro e fevereiro de 1997, o governo Fernando Henrique conseguiu a\naprovação, na Câmara dos Deputados, da emenda constitucional que\npermitiria ao presidente candidatar-se à reeleição. Não obstante o\nesforço de Maluf junto aos deputados do PPB para tentar impedir a\nvitória do governo, os votos de seu partido foram amplamente favoráveis\nà emenda. Embora esta não estivesse definitivamente aprovada — só o\nseria em junho, após a votação pelo Senado —, foi um mau início de ano\npara as pretensões presidenciais do ex-prefeito.\n\nEm viagem de férias ao Oriente Médio desde 5 de março, Maluf acompanhou\nà distância o início da repercussão na opinião pública do caso dos\nprecatórios, que ainda em março gerou a criação de uma CPI pelo Senado.\nA CPI passou a investigar a responsabilidade de diversos governadores e\nprefeitos em irregularidades na emissão de títulos públicos para o\npagamento de precatórios (dívidas resultantes de sentenças judiciais).\nNo caso da prefeitura de São Paulo durante a gestão Maluf, havia\nindícios de desvio em grande parte dos recursos levantados para esse\nfim. O prefeito Celso Pitta figurava entre os possíveis depoentes à CPI,\numa vez que naquele período era secretário de Finanças do município.\n\nDe volta das férias, Maluf procurou aproximar-se do Planalto, uma vez\nque a emenda da reeleição dificultaria sua candidatura presidencial.\nEfetivamente, em 4 de junho o Senado aprovou a emenda em definitivo. A\nnegociação entre Maluf e Fernando Henrique passava, agora, pela\nneutralidade do governo federal nas eleições para o governo paulista em\n1998, em troca da qual o ex-prefeito de São Paulo abriria mão da disputa\npela presidência e procuraria manter a bancada pepebista na Câmara fiel\nao governo. Parecia certa a possibilidade de o governador tucano Mário\nCovas tentar a reeleição, e o fato preocupava Maluf, que temia o uso da\nmáquina federal e a identificação, por parte do eleitorado, entre as\nfiguras do presidente e do governador. Os encontros “sigilosos” entre\nFernando Henrique e Maluf causaram forte reação negativa no PSDB, em\nespecial no governador Mário Covas.\n\nEm junho, Maluf foi convidado a depor na CPI dos Precatórios, à qual\nPitta já havia comparecido. Alegando compromissos inadiáveis, faltou à\nconvocação e apresentou mais tarde um extenso documento de defesa. A CPI\napresentou seu relatório final em fins de julho, atenuando acusações\ncontra políticos contidas anteriormente no documento. Maluf foi um dos\nque se beneficiaram do relatório final, que suprimiu a referência à sua\n“omissão” no desvio de verbas na prefeitura de São Paulo.\n\nSe, por um lado, viu-se livre das acusações dos precatórios, continuava\nna mira da imprensa e da Justiça, agora devido a transações suspeitas,\nentre 1996 e 1997, envolvendo a prefeitura e duas empresas: a Obelisco,\npertencente a Sílvia e Lígia Maluf, sua esposa e filha, e a Ad’Oro, de\nseu cunhado Fuad Lutfalla, irmão de Sílvia. A Obelisco vendia à Ad’Oro\nfrangos que eram revendidos para a prefeitura e eram consumidos em suas\nescolas e creches. Nicéia Pitta, mulher de Celso Pitta, também fora\nfuncionária da Ad’Oro no período. As acusações de esquema de\ntriangulação entre familiares, de improbidade administrativa, de\nirregularidades nas empresas envolvidas e de lavagem de dinheiro de\n“caixa dois”, mais uma vez, comprometiam a imagem pública que o\nex-prefeito tanto se esforçara para reconstruir. Os próprios advogados\nde Paulo Maluf contabilizariam, em maio de 1998, mais de cem processos\naos quais ele teria respondido. Até aquele momento, no entanto, não\nhavia sido condenado, em instância final, em nenhum deles.\n\nCandidato ao governo de São Paulo por uma coligação que incluía o PPB, o\nPFL, o PL e outros partidos menores, Maluf tinha como candidato a vice\nLuís Carlos Santos, do PFL. Ainda no primeiro semestre de 1998,\nultrapassou o candidato do PDT, Francisco Rossi, nas pesquisas de\nopinião. Seu *marketing* político investiu em mensagens de um Maluf\nmoderno, com diversas propostas para as áreas sociais e ênfase em suas\niniciativas bem-sucedidas, como o projeto Cingapura e a realização de\ngrandes obras. Como estratégia para enfrentar a baixa popularidade de\nPitta na prefeitura, reconheceu que o sucessor fazia uma má\nadministração, argumentando que ela melhoraria se ele, Maluf, fosse\neleito o governador. Suas críticas à gestão Pitta provocariam o\nrompimento político entre os dois.\n\nPara tentar inverter a associação natural entre Fernando Henrique e\nCovas para o eleitor, Maluf espalhou pela cidade *outdoors* em que\naparecia ao lado do presidente. A consistente campanha garantiu-lhe o\nprimeiro lugar no primeiro turno, realizado em 3 de outubro. Sua boa\nperformance fez com que o candidato do PPB ao Senado, o ex-jogador de\nbasquete e estreante na política Oscar Schmidt, obtivesse o segundo\nlugar, perdendo para Eduardo Suplicy, do PT. O crescimento de Mário\nCovas na reta final da campanha, em coligação com o PTB e outros\npartidos menores, assegurou ao governador licenciado a ida para o\nsegundo turno, com apenas 0,5% mais votos do que Marta Suplicy, do PT.\nAntes mesmo de oficializado o resultado, Covas e Marta prometeram\napoiar-se no segundo turno. Em compensação, Francisco Rossi, o quarto\ncolocado, surpreendeu ao abandonar o PDT para aliar-se à candidatura\nMaluf.\n\nOs dois debates televisivos que antecederam o segundo turno foram\nmarcados por acusações, principalmente da parte de Covas, que se\nreportava a questões éticas para desabonar o adversário, lembrando os\nescândalos em que Maluf estivera envolvido. Covas valeu-se ainda das\ndeclarações do presidente do Senado Antônio Carlos Magalhães, do PFL,\napoiando a candidatura de Maluf, para lembrar depoimentos anteriores em\nque o líder baiano fizera fortes restrições ao caráter e à capacidade de\nMaluf. A chamada “frente antimalufista” ganhou adesões importantes em\nvários partidos, como o PMDB, o PT e outras agremiações de esquerda,\ndeterminando a reeleição de Covas para o governo paulista no segundo\nturno, realizado em 25 de outubro, com 9.880.253 votos (55,37%) contra\n7.900.598 (44,63%) dados a Maluf.\n\nEm 2000, Maluf candidatou-se mais uma vez a prefeito de São Paulo, mas\nfoi derrotado por Marta Suplicy no segundo turno. Ambos protagonizaram\ncombates acalorados no final da campanha. Maluf usou a tática de atacar\nfrontalmente Marta em seu programa eleitoral, enquanto a candidata do PT\nmanteve-se, ao menos ao longo do primeiro turno, distante de disputas\nmais francas. Os ânimos se acirraram quando, em debate promovido pela\nRede Bandeirantes, Maluf chamou Marta de desqualificada e, em tom\nirônico, disse: “Fica quietinha, dona Marta”. Esta, por sua vez, revidou\ncom um: “Cala boca, Maluf!” Marta, que ainda não havia tocado no assunto\ndurante a campanha, relembrou a ligação entre Celso Pitta e Maluf, tão\nabordada pelos demais candidatos. Apesar de as pesquisas apontarem uma\ndiferença maior entre os dois adversários, Maluf perdeu a eleição com\n41,5% dos votos, contra 58,5% de Marta.\n\n \n\nVolta à Câmara dos Deputados\n\nA partir de então, Maluf começou a ocupar um lugar secundário nas\neleições majoritárias que disputou. Na eleição para governador de São\nPaulo em 2002, ainda que começasse a campanha com aproximadamente 40%\ndas intenções de voto segundo diversos institutos de pesquisa, não\nchegou ao segundo turno, sendo derrotado por José Genoínio, candidato do\nPT, e Geraldo Alckmin, candidato do PSDB e então governador, em\nsubstituição a Mário Covas, que falecera em março de 2001. Alckmin\nganhou a eleição no segundo turno, com 57% das intenções de voto,\ncalcado principalmente no espólio político de Covas.\n\nEm 2003, buscando aumentar suas possibilidades diante do crescimento dos\ndemais partidos, o PPB estabeleceu uma política de alianças com o\nrecém-eleito presidente Lula e mudou seu para Partido Progressista (PP).\n\nMesmo com a derrota em 2002, Maluf não desistiu de tentar, em 2004, a\neleição para a prefeitura de São Paulo. Iniciou a campanha empatado nas\npesquisas com Marta Suplicy, candidata à reeleição pelo PT, e José\nSerra, candidato do PSDB, que nas eleições presidenciais de 2002 fora\nderrotado por Lula. Mais uma vez Maluf foi derrotado ainda no primeiro\nturno, e Serra ganhou a eleição no segundo, com 55% dos votos válidos.\nÀquela altura, a rejeição de Maluf, segundo várias pesquisas, batia na\ncasa dos 60%.\n\nEm 2005, sem ocupar nenhum cargo eletivo, Maluf foi preso pela Polícia\nFederal, acusado de intimidar uma testemunha em processo que apurava\ndenúncias de lavagem de dinheiro, formação de quadrilha, corrupção e\ncrime contra o sistema financeiro (evasão fiscal). Ficou preso no\ncárcere da sede da Polícia Federal de São Paulo de 10 de setembro a 20\nde outubro, num total de 40 dias. Pediu ao STF a revogação de sua prisão\nalegando fragilidade de seu estado de saúde, o STF julgou procedente o\npedido e o liberou da prisão preventiva. Contra ele, porém, continuaram\npesando diversas acusações.\n\nEm 2006, diante da pressão que as denúncias lhe causavam, Maluf desistiu\nde disputar o governo de São Paulo, preferindo a candidatura a deputado\nfederal. Foi o deputado federal mais votado do país, com 739.827 votos,\ne assumiu o mandato na Câmara em fevereiro de 2007 e tornou-se titular\nda Comissão de Constituição, Justiça e Cidadania.\n\nEm 2008, tentou mais uma vez a eleição para a prefeitura de São Paulo.\nContinuou calcando suas campanhas na transformação da cidade num\ncanteiro de obras, propondo a construção de uma *freeway* sobre o rio\nTietê e o rio Pinheiros. Recebeu menos de 6% dos votos válidos, ficando\nem quarto lugar, atrás de Gilberto Kassab, do Democratas (DEM), Marta\nSuplicy e Geraldo Alckmin, que então ocupava a prefeitura em\nsubstituição a José Serra, que deixara o cargo para se tornar governador\ndo estado de São Paulo. No início de 2009assumiu ainda a vice-liderança\ndo PP na Câmara.\n\n \n\nPatrícia Campos/Lorenzo Aldé /Manoel Dourado Bastos (atualização)\n\n \n\nFONTES: *Encic. Mirador*;*Estado de S. Paulo* (28/9/79, 17/11/92, 29/1,\n3/3, 14/7, 6 e 7/9, 3/10 e 17/11/96, 28/04, 26/10, 13/10 e 10/12/2004,\n16/04, 25/05, 10/09, 13/09, 15/09, 21/10 e 22/11/2005, 30/03 e\n13/05/2006);*Folha de S. Paulo*(3/2/93, 30/3, 25 e 26/4, 11/5, 19/6, 5 e\n23/7, 21/9, 13 e 21/12/96 e 20/3 e 16/7/97, 15/7, 20/11/98,\n17-18/10/2000, 30/09/2001, 02/11/2005); *Globo*(27/11/88, 27/9/89,\n15/6/92, 13 e 24/7/97); *IstoÉ* (1/8/90, 20/10/200); *Jornal do Brasil*\n(8/10/75, 16 e 31/3 e 8/12/76, 2 e 28/2, 5, 6 e 7/6, 18/7, 2/9 e\n29/12/78, 16/3/79, 26/5, 8/10 e 5/12/96, 29/1, 26/2 e 14/7/97); NICOLAU,\nJ. *Dados; Perfil* (1972); *Súmulas;* *Veja* (16/2, 18/5 e 10/8/83,\n25/1, 22/2, 25/4, 13 e 27/6, 15 e 22/8, 12 e 26/9, 10, 17, 24 e 31/10,\n14 e 21/11, 22/12/84, 16 e 23/1/85, 28/5, 6/8, 3/9 e 8/10/86, 11/5 e\n16/11/88, 5/4, 11/10 e 15/11/89, 2 e 30/9, 25/11/92, 14/4 e 28/7/93, 16\ne 23/11/94, 12/7, 16 e 23/8, 18/10/95, 27/3, 8/5, 31/7 e 4/9/96,\n20/8/97, 16/9/98); *Veja São Paulo*(02/07/2008); *Who’s who in Brazil*.\n","ref":"FONTES: *Encic. Mirador*;*Estado de S. Paulo* (28/9/79, 17/11/92, 29/1,\n3/3, 14/7, 6 e 7/9, 3/10 e 17/11/96, 28/04, 26/10, 13/10 e 10/12/2004,\n16/04, 25/05, 10/09, 13/09, 15/09, 21/10 e 22/11/2005, 30/03 e\n13/05/2006);*Folha de S. Paulo*(3/2/93, 30/3, 25 e 26/4, 11/5, 19/6, 5 e\n23/7, 21/9, 13 e 21/12/96 e 20/3 e 16/7/97, 15/7, 20/11/98,\n17-18/10/2000, 30/09/2001, 02/11/2005); *Globo*(27/11/88, 27/9/89,\n15/6/92, 13 e 24/7/97); *IstoÉ* (1/8/90, 20/10/200); *Jornal do Brasil*\n(8/10/75, 16 e 31/3 e 8/12/76, 2 e 28/2, 5, 6 e 7/6, 18/7, 2/9 e\n29/12/78, 16/3/79, 26/5, 8/10 e 5/12/96, 29/1, 26/2 e 14/7/97); NICOLAU,\nJ. *Dados; Perfil* (1972); *Súmulas;* *Veja* (16/2, 18/5 e 10/8/83,\n25/1, 22/2, 25/4, 13 e 27/6, 15 e 22/8, 12 e 26/9, 10, 17, 24 e 31/10,\n14 e 21/11, 22/12/84, 16 e 23/1/85, 28/5, 6/8, 3/9 e 8/10/86, 11/5 e\n16/11/88, 5/4, 11/10 e 15/11/89, 2 e 30/9, 25/11/92, 14/4 e 28/7/93, 16\ne 23/11/94, 12/7, 16 e 23/8, 18/10/95, 27/3, 8/5, 31/7 e 4/9/96,\n20/8/97, 16/9/98); *Veja São Paulo*(02/07/2008); *Who’s who in Brazil*.\n","dic":"DHBB"}
