{"title":"MANSUR, Paulo","cargoss":["Deputado federal"],"cargos_esp":[0],"datas_ini":[1963],"datas_fim":[1964],"estados":["SP"],"autor":[0],"content":"**MANSUR, Paulo**\n\n\\*dep. fed. SP 1963-1964.\n\n*Paulo Jorge Mansur* nasceu em Igarapava (SP) no dia 4 de dezembro de\n1915, filho de Jorge Mansur e de Maria Gomes Mansur.\n\nResidiu na Síria dos quatro aos 12 anos de idade e, ao voltar para o\nBrasil, cursou o secundário no Instituto Mackenzie, em São Paulo,\nconcluindo-o em 1933. Radialista, trabalhou na Rádio Difusora Paulista,\nonde transmitiu programas musicais. Lançou o primeiro rádio-teatro em\nlíngua árabe através de emissoras paulistas e, em 1946, tornou-se\nproprietário da Rádio Cultura de São Vicente (SP).\n\nNo pleito de outubro de 1958 candidatou-se a uma cadeira na Câmara dos\nDeputados na legenda do Partido Socialista Brasileiro (PSB), mas não\nteve êxito. Em outubro de 1962, com o apoio majoritário de imigrantes\nnordestinos da Baixada Santista, onde foi o candidato mais votado,\nelegeu-se deputado federal por São Paulo na legenda da coligação entre o\nPSB e o Partido Trabalhista Brasileiro (PTB. Assumindo o mandato em\nfevereiro do ano seguinte, tornou-se membro da Comissão de Relações\nExteriores da Câmara dos Deputados. Conforme declarou ao *Correio\nBrasiliense,*manifestou-se favoravelmente à manutenção de relações\ncomerciais com todos os países, ao regime presidencialista com eleições\nindiretas do presidente da República e dos governadores, à reforma\neleitoral com a extensão do direito de voto a todos os cidadãos, e à\nreforma agrária cooperativista, com a desapropriação dos latifúndios\nimprodutivos mediante o pagamento de uma indenização em títulos da\ndívida pública. Defendeu também o intervencionismo econômico e o\nmonopólio estatal dos minérios atômicos, da energia elétrica, das\ntelecomunicações e do petróleo, bem como a participação dos municípios\nna renda tributária nacional e a criação de um banco dos municípios,\ndestinado a fomentar o desenvolvimento interno do país. Apoiou ainda a\nunificação das pastas militares, a criação do Ministério do Planejamento\ne as reformas tributária e bancária.\n\nApós a vitória do movimento político-militar de 31 de março de 1964, que\ndepôs o presidente João Goulart (1961-1964), teve o mandato cassado em\njunho com base no Ato Institucional nº 1 (9/4/1964), abandonando então a\nvida pública. Com a extinção do bipartidarismo em novembro de 1979 e a\nconsequente reformulação partidária, filiou-se ao Partido Trabalhista\nBrasileiro (PTB). Nessa legenda concorreu a uma cadeira na Câmara dos\nDeputados em novembro de 1982 e obteve uma suplência.\n\nFaleceu no dia 8 de fevereiro de 2007.\n\nCasado com Maria Gomes Mansur, teve quatro filhos, entre eles Beto\nMansur, que foi prefeito de Santos e deputado federal.\n\n \n\nFONTES: ARQ. DEP. PESQ. JORNAL DO BRASIL; CÂM. DEP. *Anais;*CÂM. DEP.\n*Deputados;*CÂM. DEP. *Deputados brasileiros. Repertório*(1946-1967);\nCAMPOS, Q. *Fichário;*TRIB.**SUP. ELEIT. *Dados*(6).\n\n \n","ref":"FONTES: ARQ. DEP. PESQ. JORNAL DO BRASIL; CÂM. DEP. *Anais;*CÂM. DEP.\n*Deputados;*CÂM. DEP. *Deputados brasileiros. Repertório*(1946-1967);\nCAMPOS, Q. *Fichário;*TRIB.**SUP. ELEIT. *Dados*(6).\n\n \n","dic":"DHBB"}
