{"title":"MARANHÃO, Paulo","cargoss":["Deputado federal","Deputado federal"],"cargos_esp":[0,0],"datas_ini":[1951,1924],"datas_fim":[1955,1930],"estados":["PA","PA"],"autor":[0],"content":"**MARANHÃO, Paulo**\n\n\\*jornalista; dep. fed. PA 1924-1930 e 1951-1955.\n\n* *\n\n*João Paulo de Albuquerque Maranhão*nasceu em Belém no dia 11 de abril\nde 1872, filho de Manuel de Albuquerque Maranhão e de Luísa Francisca de\nAlbuquerque Maranhão. Seu irmão, Raimundo Rodrigues Barbosa, general do\nExército, foi interventor federal na Bahia em 1931 e ministro do\nSuperior — então Supremo — Tribunal Militar (STM) de 1938 a 1943.\n\nApós completar os estudos primários, cursou o Colégio Marquês de Santa\nCruz e o Liceu Paraense, ambos na capital do estado. Órfão desde cedo,\ncomeçou a trabalhar, ainda estudante, como aprendiz de torneiro e\nserralheiro e como distribuidor da revista Arena, impressa nas oficinas\ndo Diário de Belém, no qual passou também a colaborar gratuitamente.\nDevido a dificuldades financeiras, tornou-se embarcadiço em vapores das\nlinhas fluviais amazonenses até 1889, quando passou a suplente de\nrepórter do Diário do Grão-Pará. Transferiu-se a seguir desse jornal\npara A República, órgão do Partido Conservador, onde exerceu as funções\nde revisor, repórter, secretário e, finalmente, diretor. Por essa época,\nfez concurso para regência de turmas primárias, obtendo aprovação e\nsendo nomeado professor em fevereiro de 1892. Lecionou provisoriamente\nna escola elementar de Maú, município de Marapanin (PA), depois em Capi\n(PA) e, um ano mais tarde, já como professor efetivo, passou a dar aulas\nem Quitéria, município de Viseu (PA).\n\nEm 1896 começou trabalhar como revisor no jornal Folha do Norte, fundado\nno mesmo ano por Enéias Martins, que fora seu padrinho de casamento.\nNesse órgão da imprensa, no qual permaneceria durante toda sua vida,\nchegou mais tarde a redator-chefe. Nessa função, participou intensamente\nda oposição ao governo de Augusto Montenegro (1901-1909), político do\nPartido Republicano do Pará apoiado por Antônio Lemos, importante chefe\npolítico no estado e proprietário do jornal A Província. Devido a\ndesentendimentos com Augusto Montenegro, Enéias Martins transferiu-se\npara o estado do Amazonas, por onde se elegeu deputado federal, passando\na propriedade de seu jornal a Cipriano Santos. Paulo Maranhão foi\nmantido como redator-chefe da Folha do Norte, mas, devido à forte\npressão de Antônio Lemos sobre os opositores do governo, foi obrigado a\nrefugiar-se com sua família nos altos do prédio do jornal. Aí permaneceu\ndurante 12 anos a salvo de possíveis atentados cometidos por homens de\nAntônio Lemos.\n\nEm 1912 o governador João Coelho (1909-1913), sucessor de Augusto\nMontenegro, rompeu com Antônio Lemos, que, perseguido, fugiu do Pará.\nNesse mesmo ano, Paulo Maranhão deixou o seu refúgio e obteve nomeação\ncomo professor de literatura da Escola Normal. No ano seguinte assumiu o\ngoverno do estado Enéias Martins (1913-1917), que tentou conciliar os\ndiversos partidos. Cipriano Santos, proprietário da Folha do Norte,\nrompeu com o governador e foi apoiado por Paulo Maranhão, que redigiu e\npublicou naquele jornal uma carta intitulada “A você, Enéias”,\nrecriminando sua estratégia política e reafirmando a solidariedade a\nCipriano Martins.\n\nA agitação política culminou com a deposição de Enéias Martins em 1917 e\nsua substituição por Lauro Sodré (1917-1921). Nomeado então secretário\nestadual de Instrução Pública, Paulo Maranhão adquiriu em 1919 a\npropriedade da Folha do Norte, empreendendo no jornal importantes\nmodificações que o levaram à liderança, não só no Pará, como em toda a\nAmazônia. No governo seguinte de Antônio Emiliano de Sousa Castro\n(1921-1925), foi senador estadual no Pará e diretor da Recebedoria de\nRendas.\n\nEm 1924 elegeu-se deputado federal pelo Pará, sendo reeleito em 1927 e\n1930. Deixou a Câmara dos Deputados em outubro desse ano, quando, com a\nvitória da Revolução de 1930, os órgãos legislativos do país foram\nsuprimidos. Nessa época a Folha do Norte voltou a sofrer perseguições e,\nem 1934, o interventor federal no Pará, Joaquim de Magalhães Barata\n(1930-1935), prendeu Paulo Maranhão e deportou seu filho, João Maranhão,\nque era gerente do jornal. Após a queda de Magalhães Barata em 1935, a\nsituação política readquiriu uma certa estabilidade, mas, em 1943,\nquando Barata retornou ao Pará como interventor, mandou prender\nnovamente Paulo Maranhão e nomeou um interventor para a Folha, Pedro\nTimóteo. Este foi substituído por Paulo Eleutério, que permaneceu no\ncargo até setembro de 1943. Nesse momento, Getúlio Vargas ordenou a\nrestituição do jornal a Paulo Maranhão, o qual, mesmo assim, continuou a\nsofrer perseguições.\n\nCom a queda do Estado Novo em outubro de 1945, e, conseqüentemente, do\ngoverno de Magalhães Barata, Paulo Maranhão candidatou-se ao Senado pelo\nPará no pleito suplementar de janeiro de 1947 na legenda do Partido\nSocial Progressista (PSP), sendo derrotado por José Augusto Meira\nDantas, do Partido Social Democrático (PSD).\n\nNa campanha eleitoral para o governo do estado em 1950, moveu forte\noposição a Magalhães Barata através da Folha do Norte, conseguindo que\neste fosse derrotado por Alexandre Zacarias de Assunção. Nesse mesmo\npleito elegeu-se deputado federal pelo Pará na legenda da Coligação\nDemocrática Paraense, formada pela União Democrática Nacional (UDN), o\nPartido Libertador (PL), o Partido Social Trabalhista (PST) e o PSP.\nAssumindo o mandato em fevereiro de 1951, nas eleições de outubro de\n1954 candidatou-se novamente ao Senado pelo Pará na legenda do PSP, mas\nfoi derrotado por Magalhães Barata, do PSD. Deixou a Câmara dos\nDeputados em janeiro de 1955. Em outubro desse mesmo ano, Magalhães\nBarata foi reeleito governador do Pará, continuando a sofrer forte\noposição por parte de Paulo Maranhão através da Folha.\n\nEm abril de 1964, Paulo Maranhão apoiou o movimento político-militar que\ndepôs o presidente João Goulart (1961-1964), mas opôs-se ao primeiro\ngovernador do Pará após o movimento, o coronel Jarbas Passarinho\n(1964-1966), que, na época, se disse admirador de Magalhães Barata.\n\nAo longo de sua vida, foi também membro fundador da Academia Paraense de\nLetras, diretor do semanário Marapaniense, do interior do estado, e\ndiretor-proprietário da Folha Vespertina. Seus últimos escritos foram\npublicados na Folha do Norte sob o título “Sócios de um espírito\nsonolento” e na coluna diária “Vozes da rua”.\n\nFaleceu em Belém no dia 19 de abril de 1966.\n\nEra casado com Antônia Oeiras, com quem teve oito filhos.\n\n \n\n \n\nFONTES: BORGES, R. Vultos; CÂM. DEP. Deputados; CÂM. DEP. Relação dos\ndep.; CISNEIROS, A. Parlamentares; ENTREV. BIOG.; Grande encic. Delta;\nROQUE, C. Grande; TRIB. SUP. ELEIT. Dados (2 e 7).\n\n \n","ref":"FONTES: BORGES, R. Vultos; CÂM. DEP. Deputados; CÂM. DEP. Relação dos\ndep.; CISNEIROS, A. Parlamentares; ENTREV. BIOG.; Grande encic. Delta;\nROQUE, C. Grande; TRIB. SUP. ELEIT. Dados (2 e 7).\n\n \n","dic":"DHBB"}
