{"title":"MARÃO FILHO","cargoss":["Deputado federal","Deputado federal"],"cargos_esp":[0,0],"datas_ini":[1975,1967],"datas_fim":[1982,1971],"estados":["MA","MA"],"autor":[0],"content":"**MARÃO FILHO**\n\n\\*dep. fed. MA 1967-1971 e 1975-1982.\n\n*José Ribamar Marão Filho* nasceu em São Luís no dia 10 de março de\n1940, filho de José Ribamar Marão e de Lindalva de Castro Marão.\n\nComerciante e industrial, no pleito de novembro de 1966 elegeu-se\ndeputado federal pelo Maranhão na legenda da Aliança Renovadora Nacional\n(Arena), agremiação de apoio ao regime militar vigente no país desde\nabril de 1964, assumindo seu mandato em fevereiro do ano seguinte.\nCandidato à reeleição, nessa mesma legenda, no pleito de novembro de\n1970 obteve apenas uma suplência, encerrando seu mandato em janeiro de\n1971. Voltou a concorrer a uma cadeira na Câmara em novembro de 1974,\nsempre na legenda da Arena, tendo sido eleito. Assumiu sua cadeira no\nLegislativo federal em fevereiro de 1975. Nessa legislatura integrou a\nComissão de Economia, Indústria e Comércio como membro efetivo, e a\nComissão de Finanças da Câmara dos Deputados como suplente.\n\nNo pleito de novembro de 1978 concorreu à reeleição, ainda pela Arena,\nmas conseguiu apenas uma suplência. Entretanto, com a saída do deputado\nTemístocles Teixeira para ocupar a Secretaria de Justiça do Maranhão em\nmarço de 1979, assumiu uma cadeira na Câmara dos Deputados. Com a\nextinção do bipartidarismo em novembro desse ano e a conseqüente\nreformulação partidária, filiou-se à nova agremiação governista, o\nPartido Democrático Social (PDS), que sucedeu à Arena.\n\nEm 1980 o deputado Temístocles Teixeira deixou a Secretaria de Justiça e\nretornou à Câmara, sendo substituído naquela secretaria pelo deputado\nfederal Magno Bacelar. Este fato possibilitou a permanência de Marão\nFilho na Câmara até fevereiro de 1982, quando o titular reassumiu seu\nmandato.\n\nEm 1981, formou-se em direito pela Universidade de Brasília.\n\nEm abril de 1982, passou a compor o quadro do Tribunal de Contas do\nMunicípio no estado do Maranhão, tendo sido primeiramente nomeado\nconselheiro e, em fevereiro de 1987, vice-presidente, permanecendo neste\ncargo até novembro de 1989, quando foi eleito presidente. Reeleito em\n1991, exerceu a presidência até 1993, quando voltou a ser conselheiro.\nAposentou-se em janeiro de 1995.\n\nA partir de então, dedicou-se ao exercício da advocacia em São Luís.\n\nCasou-se com Marisa Morais Correia Marão, com quem teve quatro filhos.\n\nFONTES: CÂM. DEP.*Deputados*; CÂM. DEP.*Deputados brasileiros.\nRepertório* (1967-1971 e 1975-1979); INF. BIOG.; NÉRI, S. *16;\nPerfil*(1980); TRIB. SUP. ELEIT. *Dados* (8 e 9).\n\n \n","ref":"FONTES: CÂM. DEP.*Deputados*; CÂM. DEP.*Deputados brasileiros.\nRepertório* (1967-1971 e 1975-1979); INF. BIOG.; NÉRI, S. *16;\nPerfil*(1980); TRIB. SUP. ELEIT. *Dados* (8 e 9).\n\n \n","dic":"DHBB"}
