{"title":"MARÃO, Pedro","cargoss":["Deputado federal"],"cargos_esp":[0],"datas_ini":[1963],"datas_fim":[1971],"estados":["SP"],"autor":[0],"content":"**MARÃO, Pedro**\n\n\\*dep. fed. SP 1963-1971.\n\n \n\n*Pedro Marão*nasceu em Taquaritinga (SP) no dia 20 de agosto de 1918,\nfilho de Gabriel Marão e de Emília Marão.\n\nFormou-se dentista em 1944 e farmacêutico em 1947 pela Faculdade de\nOdontologia e Farmácia de Araraquara (SP), bacharelando-se ainda pela\nFaculdade de Direito de Niterói em 1951.\n\nAdvogado e professor, foi vereador à Câmara Municipal de Araraquara,\ntendo sido presidente e vice-presidente dessa casa, além de exercer a\npresidência de sua Comissão de Justiça. No pleito de outubro de 1962,\nelegeu-se primeiro suplente de deputado federal pelo estado de São Paulo\nna legenda da Coligação Janista, formada pelo Partido Trabalhista\nNacional (PTN) e o Movimento Trabalhista Renovador (MTR). Assumiu uma\ncadeira na Câmara dos Deputados em fevereiro de 1963, tornando-se, a\npartir desse ano, membro da Comissão de Constituição e Justiça.\n\nCom a extinção dos partidos políticos pelo Ato Institucional nº 2\n(27/10/1965) e a posterior implantação do bipartidarismo, filiou-se ao\nMovimento Democrático Brasileiro (MDB), partido de oposição ao regime\nmilitar instaurado no país em abril de 1964, e, no pleito de novembro de\n1966, reelegeu-se deputado federal por São Paulo na legenda desse\npartido, integrando as comissões de Justiça, de Fiscalização Financeira\ne de Economia da Câmara dos Deputados. Em novembro de 1970, tentou a\nreeleição, na legenda do MDB, obtendo apenas a quarta suplência,\ndeixando a Câmara em janeiro do ano seguinte, ao final da legislatura.\nPassou a trabalhar no Instituto de Previdência do Estado de São Paulo\n(IPESP). No pleito de novembro de 1974, disputou novamente uma cadeira\nna Câmara, sempre pelo MDB, não conseguindo se eleger. Não mais\ndisputando nenhum outro cargo eletivo, retornou às suas atividades\nprofissionais, como advogado em escritório próprio.\n\nFaleceu no Guarujá (SP) no dia 18 de fevereiro de 1983.\n\nEra casado com Nair Girardi Marão, com quem teve dois filhos.\n\n \n\nFONTES: CÂM. DEP. *Deputados*; CÂM. DEP. *Deputados brasileiros.\nRepertório* (1963-1967 e 1967-1971); INF. FAM.; TRIB. SUP. ELEIT.\n*Dados* (6, 8 e 9).\n\n \n","ref":"FONTES: CÂM. DEP. *Deputados*; CÂM. DEP. *Deputados brasileiros.\nRepertório* (1963-1967 e 1967-1971); INF. FAM.; TRIB. SUP. ELEIT.\n*Dados* (6, 8 e 9).\n\n \n","dic":"DHBB"}
