{"title":"MARCÍLIO, Benedito","cargoss":["Deputado federal"],"cargos_esp":[0],"datas_ini":[1979],"datas_fim":[1983],"estados":["SP"],"autor":[0],"content":"**MARCÍLIO, Benedito**\n\n\\*dep. fed. SP 1979-1983.\n\n* *\n\n*Benedito Marcílio Alves da Silva* nasceu em Serra Negra (SP) no dia 30\nde março de 1938, filho de Benedito Pereira da Silva e de Joana Vicente\nAlves.\n\nOperário metalúrgico, em novembro de 1978 elegeu-se deputado federal\npelo estado de São Paulo, na legenda do Movimento Democrático Brasileiro\n(MDB), partido de oposição ao regime militar instaurado no país em abril\nde 1964, vindo a iniciar seu mandato em fevereiro do ano seguinte.\n\nNa Câmara integrou, já em 1979, a Comissão de Trabalho e Legislação\nSocial e foi suplente da Comissão de Agricultura e Política Rural.\n\nCom a extinção do bipartidarismo em novembro de 1979 e a conseqüente\nreorganização partidária, ingressou no Partido dos Trabalhadores (PT).\nNo ano seguinte, tornou-se vice-presidente da Comissão de Trabalho e\nLegislação Social.\n\nCandidatou-se à reeleição no pleito de novembro de 1982, pela legenda do\nPT, obtendo apenas a terceira suplência. Deixou a Câmara em janeiro do\nano seguinte, ao final da legislatura. Não voltou mais a disputar cargo\npolítico eletivo, mas continuou filiado ao PT.\n\nAinda em 1983, aposentou-se por tempo de serviço e nesse mesmo ano\nparticipou da organização do movimento dos aposentados em São Paulo,\nfundando a Federação dos Aposentados do Estado de São Paulo.\nVice-presidente da entidade entre 1983 e 1985, em outubro desse ano foi\num dos fundadores da Confederação Brasileira de Aposentados e\nPensionistas (Cobap), ocupando durante muitos anos cargos de direção da\nconfederação.\n\nEm 1998, assumiu a presidência da Associação dos Metalúrgicos\nAposentados de Santo André. Nesse mesmo ano, em março, a entidade passou\na abranger todos os aposentados e pensionistas do ABC paulista, e\nBenedito Marcílio permaneceu na presidência. Em outubro de 1999, foi\neleito terceiro-secretário da Cobap, sendo encarregado de cuidar dos\nassuntos relativos à seguridade social. No pleito de 2006 foi candidato\na deputado federal na legenda do Partido Humanista da Solidariedade\n(PHS), contudo não obteve êxito. Em 2007 tornou-se presidente da Cobap.\nEm outubro de 2008 disputou o mandato de vereador em Santo André, agora\nna legenda do Partido Trabalhista Brasileiro (PTB), obteve uma\nsuplência.\n\nCasou-se com Vilma Martini da Silva, com quem teve quatro filhos.\n\n \n\nFONTES: CÂM. DEP. *Deputados brasileiros. Repertório*(1979-1983 e\n1983-1987); INF. BIOG; Portal da Fundação SEADE.\n\n \n","ref":"FONTES: CÂM. DEP. *Deputados brasileiros. Repertório*(1979-1983 e\n1983-1987); INF. BIOG; Portal da Fundação SEADE.\n\n \n","dic":"DHBB"}
