{"title":"MARIA, Otávio","cargoss":["Deputado federal"],"cargos_esp":[0],"datas_ini":[1963],"datas_fim":[1964],"estados":["SP"],"autor":[0],"content":"**MARIA, Otávio**\n\n\\*dep. fed. SP 1963-1964.\n\n*Otávio Rodrigues Maria* nasceu em Botucatu (SP) no dia 19 de dezembro\nde 1921, filho de José Rodrigues Maria e de Leontina Rodrigues Maria.\n\nFerroviário da Estrada de Ferro Sorocabana, iniciou em 1945 sua vida\npolítica em Botucatu, militando no movimento sindical da categoria.\nPelas atividades que desenvolveu, foi demitido da empresa, acentuando, a\npartir de então, sua liderança nos meios trabalhistas. Colaborou nesse\nperíodo, juntamente com Olavo Previatti — que viria a presidir a\nConfederação Nacional dos Trabalhadores na Indústria (CNTI) entre 1968 e\n1970 —, na organização do Partido Trabalhista Brasileiro (PTB) em São\nPaulo.\n\nParticipou do esquema sindical getulista durante o segundo governo de\nGetúlio Vargas (1951-1954) e comandou diversas campanhas do PTB\npaulista. Homem de confiança de João Goulart, liderou em São Paulo a\ncampanha que o conduziu à vice-presidência da República em 1960, sendo\npor isso considerado o seu maior “eleitor” no estado. No mesmo pleito,\nempenhou-se pela eleição do candidato de Goulart, Cantídio Sampaio, à\nprefeitura paulistana. No entanto, com a vitória de Francisco Prestes\nMaia para o cargo, a nova administração instaurou uma série de\ninquéritos para apurar irregularidades da gestão anterior, de Ademar de\nBarros, no Executivo municipal. Otávio Maria foi envolvido num desses\ninquéritos, acusado de promover transações comerciais irregulares com a\nCompanhia Municipal de Transportes Coletivos (CMTC). Essas acusações\nforam depois consideradas insubsistentes.\n\nNas eleições de outubro de 1962, foi um dos que encabeçou em São Paulo a\nFrente Janguista, defendendo as reformas de base propostas por Goulart,\njá então presidente da República. Elegeu-se nessa ocasião primeiro\nsuplente de deputado federal pelo estado na legenda do Partido\nRepublicano (PR). Com Olavo Previatti e outros líderes sindicais, criou\no movimento denominado Resistência Nacional, dedicado a combater os\n“radicalismos da esquerda e da direita”, denunciando tanto a ação\ncomunista, o Comando Geral dos Trabalhadores (CGT) e o Pacto de Unidade\ne Ação (PUA), como os grupos econômicos internacionais e o Instituto\nBrasileiro de Ação Democrática (IBAD), a quem acusava de comprar\n“traidores por meio do dinheiro”.\n\nEm 10 de dezembro de 1963, assumiu uma cadeira na Câmara dos Deputados,\nem virtude da recontagem de votos promovida pelo Tribunal Regional\nEleitoral de São Paulo, que anulou sufrágios do deputado Millo\nCammarosano, rebaixado por isso à condição de suplente. Opôs-se em\nseguida às greves articuladas pelo CGT e o PUA, conclamando os\ntrabalhadores a recorrer à Justiça do Trabalho para dirimir seus\nconflitos com os patrões. Em janeiro de 1964, lamentou a vitória das\nforças de esquerda na CNTI, advertindo que esse resultado aceleraria a\n“comunicação do país”.\n\nCom a vitória do movimento político-militar de 31 de março de 1964,\nprocurou ressaltar sua atuação anticomunista, respondendo, em longa\ncarta aberta (21/4/1964), às acusações de corrupção e subversão que lhe\nforam feitas pelo deputado federal udenista Herbert Levy. No entanto, em\n13 de junho daquele ano, teve seu mandato cassado com base no Ato\nInstitucional nº 1, editado em 9 de abril de 1964 pela junta militar que\nassumiu o poder após a derrubada do presidente João Goulart.\n\nRetirado da vida pública, em 1969 foi acusado de estelionato e envolvido\nem inquérito sobre compra fraudulenta de propriedades rurais e de\ntratores. Nesse mesmo ano, no dia 8 de novembro, no interior de um\nveículo, assassinou a tiros uma mulher e tentou o suicídio, sendo\nhospitalizado.\n\nFONTES: ARQ. DEP. PESQ. JORNAL DO BRASIL; CÂM. DEP*. Anais;*CÂM. DEP.\n*Deputados; Cruzeiro*(6/10/62);*Estado de S.* *Paulo*(6/12/63 e\n14/11/69); TRIB. SUP. ELEIT. *Dados*(6);*Última Hora*(21/4/64).\n\n \n","ref":"FONTES: ARQ. DEP. PESQ. JORNAL DO BRASIL; CÂM. DEP*. Anais;*CÂM. DEP.\n*Deputados; Cruzeiro*(6/10/62);*Estado de S.* *Paulo*(6/12/63 e\n14/11/69); TRIB. SUP. ELEIT. *Dados*(6);*Última Hora*(21/4/64).\n\n \n","dic":"DHBB"}
