{"title":"MAROJA NETO, Manuel","cargoss":["Interventor"],"cargos_esp":[0],"datas_ini":[1945],"datas_fim":[1946],"estados":["PA"],"autor":[0],"content":"**MAROJA NETO, Manuel**\n\n\\*magistrado; interv. PA 1945-1946.\n\n \n\n*Manuel Maroja Neto* nasceu na antiga Vila do Pilar (PB) no dia 17 de\njulho de 1880, filho de José Maria Ferreira da Silva e Débora Emília\nFerreira da Silva.\n\nCursou o primário na sua cidade natal e o secundário em João Pessoa. Em\n1901 bacharelou-se pela Faculdade de Direito de Recife.\n\nTransferindo-se em seguida para o estado do Pará, aí iniciou sua\ncarreira profissional em janeiro de 1902, quando foi nomeado promotor\npúblico na comarca de Baião, pelo governador Augusto Montenegro.\nPermaneceu nesta função até 18 de abril de 1906, tornando-se juiz de\ndireito da recém-criada comarca do Amapá, sendo transferido\nposteriormente para a comarca de Igarapé-Miri. Ainda no Pará, em\ndezembro de 1912 foi transferido para a comarca de Bragança e em março\nde 1919 para a comarca de Belém. Após ter servido nas quatro varas da\ncapital paraense, foi nomeado em outubro de 1930 membro do Tribunal de\nJustiça do Pará. Foi procurador-geral do estado de novembro desse ano a\nfevereiro de 1932, quando se elegeu presidente do Tribunal de Justiça,\ncargo que ocuparia durante os seis anos subseqüentes.\n\nEm 1945 presidia o Tribunal de Justiça e o Tribunal Regional Eleitoral.\nCom a queda do presidente Getúlio Vargas em 29 de outubro daquele ano,\nque foi substituído pelo ministro José Linhares, os governos estaduais\nforam ocupados pelos chefes do Poder Judiciário local. Logo, Maroja Neto\nfoi nomeado em novembro de 1945 interventor federal no Pará, em\nsubstituição ao general Alexandre Zacarias Assunção. Presidiu o pleito\nde dezembro de 1945 no estado, permanecendo em suas funções até\nfevereiro do ano seguinte, quando foi substituído por Otávio Bastos\nMeira. Aposentou-se como desembargador em julho de 1950 por limite de\nidade.\n\nFaleceu no Rio de Janeiro em 21 de fevereiro de 1964.\n\nFoi casado em primeiras núpcias com Inês de Mendonça Maroja, com quem\nteve cinco filhos. Era casado em segundas núpcias com Alzira de Mendonça\nMaroja. Seu filho, Estélio de Mendonça Maroja, foi deputado federal pelo\nPará de 1963 a 1966 e de 1971 a 1975.\n\n \n\nFONTES: *Almanaque da PB*; CORRESP. GOV. EST. PA; *Encic. Mirador*; INF.\nVirgínia Maroja; POPPINO, R. *Federal*; ROQUE, C. *Grande*.\n\n \n","ref":"FONTES: *Almanaque da PB*; CORRESP. GOV. EST. PA; *Encic. Mirador*; INF.\nVirgínia Maroja; POPPINO, R. *Federal*; ROQUE, C. *Grande*.\n\n \n","dic":"DHBB"}
