{"title":"MARQUES, Cleto","cargoss":["Deputado federal"],"cargos_esp":[0],"datas_ini":[1967],"datas_fim":[1971],"estados":["AL"],"autor":[0],"content":"**MARQUES, Cleto**\n\n\\*dep. fed. AL 1967-1971.\n\n \n\n*Cleto Marques Luz* nasceu em Maceió no dia 26 de abril de 1924, filho\nde Joaquim Marques da Luz e de Diamantina Marques da Luz.\n\nCursou o primário nos grupos escolares Tomás Espíndola e Tavares Bastos\ne o ginasial na Escola de Aprendizes Artífices (atual Escola Técnica\nFederal de Alagoas) e no Colégio Guido de Fontgalland. Fez o curso\ntécnico em contabilidade na Escola Técnica de Comércio de Maceió.\n\nAuxiliar de comércio das firmas M. Lobo & Cia. e Leão & Cia. entre 1942\ne 1950, em 1946 prestou concurso para conferencista de bordo da\nCapitania dos Portos. Em junho de 1948, formou-se pela Faculdade de\nDireito da atual Universidade Federal de Alagoas.\n\nIniciou sua carreira política elegendo-se vereador em Maceió, em outubro\nde 1950. Nessa legislatura, foi vice-presidente da Câmara em 1951, 1953\ne 1954. Reeleito em outubro de 1954, foi reconduzido à Câmara no início\ndo ano seguinte. Entre 30 de março e 23 de novembro de 1955, devido ao\nfato de ocupar a presidência da Câmara, assumiu interinamente o cargo de\nprefeito de Maceió. Presidiu novamente a Câmara Municipal em 1957 e\n1958. Durante as duas legislaturas foi presidente das comissões de\nJustiça e de Orçamento.\n\nParalelamente à sua trajetória política, em 1957 prestou concurso para\njuiz de direito do Tribunal de Justiça de Alagoas, ficando em segundo\nlugar. Nesse mesmo ano, voltou a prestar concurso realizado pelo\nTribunal e pela Procuradoria de Justiça de Alagoas a promotor de\njustiça, conseguindo a primeira colocação.\n\nNo pleito de outubro de 1958, elegeu-se deputado estadual na legenda do\nPartido Social Progressista (PSP). Em fevereiro de 1959, após concluir o\nmandato de vereador na Câmara Municipal de Maceió, assumiu sua cadeira\nna Assembleia Legislativa. Reelegeu-se em outubro de 1962, iniciando\nnovo mandato em 1963. Líder da bancada do PSP na Assembléia, em outubro\nde 1965 candidatou-se a vice-governador de Alagoas na chapa encabeçada\npor Sebastião Muniz Falcão. Embora vitoriosos, os candidatos do PSP não\nobtiveram a maioria absoluta exigida pela Emenda Constitucional nº 13.\nEm conseqüência, não foram empossados à frente do governo do estado, que\nfoi entregue ao interventor federal coronel João José Batista Tubino.\n\nCom a extinção dos partidos políticos pelo Ato Institucional nº 2\n(27/10/1965) e a posterior instauração do bipartidarismo, Cleto Marques\nfiliou-se ao Movimento Democrático Brasileiro (MDB), partido de oposição\nao regime militar instalado no país em abril de 1964, e por essa legenda\nfoi eleito deputado federal por Alagoas em novembro de 1966. Encerrou\nseu mandato de deputado estadual em janeiro de 1967. Na Assembleia\nalagoana, foi presidente da Comissão de Orçamento, e membro das\ncomissões de Justiça, Reforma Administrativa e Redação Final.\n\nEm fevereiro de 1967, assumiu sua cadeira na Câmara. Membro da Comissão\nde Justiça e da Comissão do Polígono da Seca, em 1968 participou da\nConferência do Parlamento Sul-Americano em Brasília. Deixou a Câmara em\njaneiro de 1971, ao final da legislatura, não tendo disputado a\nreeleição no pleito de novembro de 1970.\n\nPosteriormente, foi secretário-assistente do Trabalho de Alagoas nos\ngovernos Divaldo Suruagy (1975-1978) e Geraldo Melo (1978-1979).\n\nAo longo de sua trajetória política, Cleto Marques foi ainda secretário\nda Agricultura, Indústria e Comércio de Alagoas no governo de Sebastião\nMuniz Falcão, membro da Comissão de Reforma Administrativa e da Comissão\nde Saúde de Alagoas e presidente regional do Partido Rural Trabalhista\n(PRT). Presidente da Federação Alagoana de Desportos por três mandatos\nconsecutivos, foi consultor jurídico do Instituto dos Funcionários\nPúblicos de Alagoas, da Assembleia Legislativa de Alagoas e da\nprefeitura municipal de Anadias (AL). Foi professor de direito usual da\nEscola Técnica de Comércio de Maceió e Escola Técnica de Comércio de\nAlagoas.\n\nFundador, redator e gerente do jornal *Diário de Alagoas*, foi\nsócio-benemérito da Associação Alagoana de Imprensa, membro do conselho\nconsultivo das Organizações Arnon de Melo e conselheiro da Ordem dos\nAdvogados do Brasil (OAB), seção de Alagoas.\n\nFaleceu em Maceió no dia 7 de fevereiro de 1979.\n\n \n\nFONTES: CÂM. DEP. *Deputados brasileiros. Repertório* (1967-1971);\nCURRIC. BIOG.; TRIB. SUP. ELEIT. *Dados* (4, 6 e 8).\n\n \n","ref":"FONTES: CÂM. DEP. *Deputados brasileiros. Repertório* (1967-1971);\nCURRIC. BIOG.; TRIB. SUP. ELEIT. *Dados* (4, 6 e 8).\n\n \n","dic":"DHBB"}
