{"title":"MARTINI, Luís Teixeira","cargoss":["Comandante do III Distrito Naval","Comandante do I Distrito Naval","Comandante da Escola Superior de Guerra","Chefe do Estado-Maior das Forças Armadas"],"cargos_esp":[0,0,0,0],"datas_ini":[1958,1960,1961,1965],"datas_fim":[1959,1961,1965,1966],"estados":[0,0,0,0],"autor":[0],"content":"**MARTINI, Luís Teixeira**\n\n\\*militar; comte. III DN 1958-1959; comte. I DN 1960-1961; comte. ESG\n1961-1965; ch. EMFA 1965-1966.\n\n*Luís Teixeira Martini* nasceu no Rio de Janeiro, então Distrito\nFederal, no dia 28 de maio de 1903, filho de Marcos Luís Martini e de\nAlice Teixeira Martini.\n\nDepois de concluir os estudos secundários no Colégio São Bento,\ningressou em abril de 1920 na Escola Naval como aspirante-a-oficial.\nPromovido a guarda-marinha em janeiro de 1924, embarcou no navio-escola\n*Benjamim* *Constant*para a viagem regulamentar de fim de curso. Após a\nviagem, em dezembro desse mesmo ano, recebeu a patente de\nsegundo-tenente.\n\nDepois de desempenhar diversas funções em belonaves da Armada, foi\npromovido em janeiro de 1927 ao posto de primeiro-tenente e a\ncapitão-tenente em maio de 1931. Em 1933 fez o curso de especialização\npara oficiais, na área de comunicação, assumindo em seguida o comando do\nrebocador *Raimundo* *Nonato.*Deixou esse comando em 1935, passando a\ninstrutor da Escola Naval, função que desempenhou até 1938, quando foi\ncomissionado instrutor de guardas-marinhas na viagem de instrução do\nnavio-escola *Almirante Saldanha.*\n\nDe volta ao Brasil em 1939, assumiu o comando do rebocador *Heitor\nPerdigão,*sendo promovido a capitão-de-corveta em setembro do ano\nseguinte. Durante a Segunda Guerra Mundial (1939-1945), exerceu, de maio\na setembro de 1944, o comando da corveta *Cabedelo,*tendo participado de\ncomboios aliados juntamente com navios da Marinha de Guerra dos Estados\nUnidos. Destacado em seguida para exercer novamente as funções de\ninstrutor da Escola Naval, recebeu em agosto de 1945 a patente de\ncapitão-de-fragata. No ano seguinte fez o curso de comando da Escola de\nGuerra Naval, sendo comissionado para a função de capitão dos portos do\nRio Grande do Norte, em Natal. Ali permaneceu até junho de 1948, quando\nfoi nomeado vice-diretor do Serviço de Reserva Naval. Em novembro desse\nano passou a comandar o navio-tanque *Marajó,* que deixou em janeiro de\n1950 para fazer o curso superior da Escola de Guerra Naval.\n\nDesignado instrutor-chefe da Escola de Guerra Naval em março de 1951,\nfoi promovido no mês seguinte a capitão-de-mar-e-guerra. De abril de\n1952 a fevereiro de 1954, foi comissionado capitão dos portos do\nDistrito Federal e do estado do Rio de Janeiro. Em seguida fez o curso\nda Escola Superior de Guerra (ESG). Em fevereiro de 1955 assumiu o\ncomando do navio-escola *Duque de Caxias,*sendo designado em abril do\nano seguinte vice-diretor de Portos e Costas. Promovido em junho de 1957\nao posto de contra-almirante, foi nomeado no mês seguinte subchefe do\nEstado-Maior da Armada (EMA). Nessa função, chefiou a representação da\nMarinha nas comemorações da fundação da cidade de Assunção, no Paraguai.\n\nEm abril de 1958 foi nomeado comandante do III Distrito Naval (III DN),\nsediado em Recife. Promovido a vice-almirante em janeiro de 1959, deixou\naquele comando em maio desse mesmo ano, quando foi nomeado diretor-geral\nde Portos e Costas. Em abril de 1960 foi designado para o comando do I\nDN, sediado no Rio, em substituição ao vice-almirante José Luís da Silva\nJúnior. Em março de 1961 foi substituído nessa chefia pelo\nvice-almirante Mário da Costa Furtado de Mendonça. Nesse mesmo mês\npassou a integrar o conselho do EMA. Em novembro de 1961 foi nomeado\npara o comando da ESG, em substituição ao general Emílio Maurell Filho.\nPromovido a almirante-de-esquadra em agosto de 1962, permaneceu naquele\ncomando até fevereiro de 1965, quando o país já****se encontrava sob uma\nnova ordem institucional instaurada pelo movimento político-militar de\n31 de março de 1964, sendo substituído pelo tenente-brigadeiro Henrique\nFleiuss.\n\nEm março de 1965 assumiu o comando do Estado-Maior das Forças Armadas\n(EMFA), substituindo o general Peri Bevilacqua. Nesse período foi\ndelegado do Brasil na II****Conferência Interamericana Extraordinária,\nrealizada em 1965 no Rio de Janeiro. Ainda em 1965 integrou o Grupo de\nEstudos para Integração da Política de Transportes (Geipot). Em 1966 foi\nembaixador extraordinário e plenipotenciário da missão especial à posse\ndo presidente da República da Costa Rica e em abril desse ano passou o\ncomando do EMFA ao tenente-brigadeiro Nélson Freire Lavenère Wanderley.\nEm agosto foi transferido para a reserva no posto de almirante.\n\nEra casado com Dinorá Criciúma Martini.\n\nFONTES: CORRESP. ESC. SUP. GUERRA; CORRESP. ESTADO-MAIOR FORÇAS ARMADAS;\nCORRESP. SERV. DOC. GER. MAR.; ENTREV. BIOG.; FICHÁRIO PESQ. M. AMORIM;\nMIN. MAR. *Almanaque* (1966).\n\n \n","ref":"FONTES: CORRESP. ESC. SUP. GUERRA; CORRESP. ESTADO-MAIOR FORÇAS ARMADAS;\nCORRESP. SERV. DOC. GER. MAR.; ENTREV. BIOG.; FICHÁRIO PESQ. M. AMORIM;\nMIN. MAR. *Almanaque* (1966).\n\n \n","dic":"DHBB"}
