{"title":"MARTINS, Antônio Augusto","cargoss":["Deputado federal"],"cargos_esp":[0],"datas_ini":[1947],"datas_fim":[1951],"estados":["RR"],"autor":[0],"content":"**MARTINS, Antônio Augusto**\n\n\\*dep. fed. RR 1947-1951.\n\n \n\n*Antônio Augusto Martins* nasceu em Cametá (PA) em 7 de março de 1898,\nfilho de Júlio Augusto Martins e Maria Luísa Martins.\n\nEmpresário com atuação no comércio, em 1944 fundou a Associação\nComercial de Rio Branco, atual Associação Comercial e Industrial de\nRoraima, nome dado ao território de Rio Branco em dezembro de 1962. Seu\nprimeiro cargo político foi o de prefeito de Boa Vista entre 1945 e\n1946. Neste último ano, em janeiro, elegeu-se, em pleito suplementar,\ndeputado federal na legenda do Partido Social Democrático (PSD).\nEmpossado em março de 1947, integrou a Comissão Permanente de Tomada de\nContas e a Comissão Especial de Valorização da Amazônia. Em 1950, tentou\nreeleger-se, mas não obteve êxito.\n\nMorreu em Manaus em 7 de agosto de 1957. Em 1990, o prédio da Assembleia\nLegislativa de Roraima passou a ser chamado, em sua homenagem, palácio\nAntônio Martins.\n\nFoi casado com Euclides Magalhães Martins, com quem teve um filho, e com\nJulieta Albuquerque Freire Martins. Seu filho, Júlio Augusto Magalhães\nMartins, foi deputado federal de 1979 a 1987.\n\n \n\n \n\nFONTES: CÂM. DEP. *Deputados brasileiros. Repertório* (1946-1967); INF.\nFAM.\n\n \n","ref":"FONTES: CÂM. DEP. *Deputados brasileiros. Repertório* (1946-1967); INF.\nFAM.\n\n \n","dic":"DHBB"}
