{"title":"MARTINS, Arnaldo","cargoss":["Deputado federal","Constituinte"],"cargos_esp":[0,0],"datas_ini":[1987,1987],"datas_fim":[1991,1988],"estados":["RO",0],"autor":[0],"content":"**MARTINS, Arnaldo**\n\n\\*militar; dep. fed. RO 1987-1991; const. 1987-1988.\n\n \n\n*Arnaldo Lopes Martins* nasceu no Rio de Janeiro, então Distrito\nFederal, no dia 11 de novembro de 1934, filho de Durval de Sousa Martins\ne de Maria Madalena Lopes Martins.\n\nFormado em engenharia pela Academia Militar das Agulhas Negras (1956) e\npela Escola de Educação Física do Exército (1957), diplomou-se em\neconomia pela Sociedade Universitária de Ensino Superior e Cultura\n(1960). Fez ainda o curso da Escola de Aperfeiçoamento de Oficiais e foi\ninstrutor do curso de engenharia do Centro de Preparação dos Oficiais da\nReserva, Rio de Janeiro, comandante da Companhia de Engenharia de\nConstrução, em Lajes (RN), instrutor-chefe da Escola de Instrução\nEspecializada, no Rio de Janeiro. Formado em administração de empresas\npela Faculdade Morais Júnior, no Rio de Janeiro (1978), lecionou na\nFaculdade de Economia e Finanças do Rio de Janeiro.\n\nComandante do Batalhão de Engenharia e Construção (1978-1980),\ntransferiu-se para a reserva no posto de tenente-coronel e foi nomeado\npelo governador Jorge Teixeira de Oliveira prefeito do município de\nVilhena (1980-1982).\n\nDepois da transformação de Rondônia em estado, elegeu-se para a\nAssembléia Legislativa em novembro de 1982 na legenda do Partido\nDemocrático Social (PDS). Vice-líder da bancada, autor de projeto de lei\nque se transformou na primeira lei do estado de Rondônia e do projeto\npara a construção de miniusinas hidrelétricas no estado, presidiu as\ncomissões de Economia e Finanças, e de Estudos dos Problemas Energéticos\nde Rondônia, tendo sido titular das comissões de Revisão Final e de\nConstituição e Justiça.\n\nEm novembro de 1986 concorreu a uma vaga de deputado federal\nconstituinte na legenda do Partido do Movimento Democrático Brasileiro\n(PMDB), obtendo a primeira suplência. Descontente com o resultado,\nrecorreu ao Tribunal Superior Eleitoral, pedindo a recontagem de votos.\nEnquanto aguardava o pronunciamento da justiça, exerceu o mandato na\ncondição de suplente entre 24 de março e 4 de junho de 1987. Favorecido\npela decisão do TSE — foram impugnados 501 votos do candidato\npeemedebista Expedito Júnior, quinto colocado no estado e já em pleno\nexercício de suas funções legislativas —, Arnaldo Martins acabou\nassumindo o mandato constituinte em 28 de agosto de 1987.\n\nMembro do diretório nacional do PMDB, titular da Subcomissão de Defesa\ndo Estado, da Sociedade e de sua Segurança, da Comissão da Organização\nEleitoral, Partidária e Garantia das Instituições, e suplente da\nSubcomissão dos Municípios e Regiões, da Comissão da Organização do\nEstado, votou a favor da pena de morte, do presidencialismo, do mandato\nde cinco anos para o então presidente José Sarney, do turno ininterrupto\nde seis horas, do aviso prévio proporcional, da unicidade sindical, da\nlimitação dos juros reais em 12% ao ano, da criação de um fundo de apoio\nà reforma agrária e da legalização do jogo do bicho. E contra a\nlimitação do direito de propriedade, o voto facultativo aos 16 anos, a\nnacionalização do subsolo, a desapropriação da propriedade produtiva, a\nremuneração 50% superior para o trabalho extra, a jornada semanal de 40\nhoras.\n\nNo pleito de outubro de 1990 concorreu à reeleição na legenda do Partido\nda Social Democracia Brasileira (PSDB), obtendo a quarta suplência.\nDeixou a Câmara dos Deputados ao término da legislatura, em janeiro do\nano seguinte.\n\nAfastado da vida pública, retornou ao Rio de Janeiro, onde exerceu a\nvice-presidência do Clube Helênico, tendo presidido por duas vezes a\nAssociação Atlética de Vila Isabel.\n\nFaleceu em Porto Velho no dia 3 de janeiro de 1999, quando fazia uma\nvisita a Rondônia a fim de prestigiar o recém-eleito governador José de\nAbreu Bianco.\n\nEra casado com Telma Regina Nunes de Melo Martins, com quem teve um\nfilho.\n\n \n\nFONTES: ASSEMB. NAC. CONST. *Repertório* (1987-1988); COELHO, J. &\nOLIVEIRA, A. *Nova*; INF. Arnaldo Lopes Martins Filho.\n\n \n","ref":"FONTES: ASSEMB. NAC. CONST. *Repertório* (1987-1988); COELHO, J. &\nOLIVEIRA, A. *Nova*; INF. Arnaldo Lopes Martins Filho.\n\n \n","dic":"DHBB"}
