{"title":"MARTINS, Júlio","cargoss":["Deputado federal"],"cargos_esp":[0],"datas_ini":[1979],"datas_fim":[1987],"estados":["RR"],"autor":[0],"content":"**MARTINS, Júlio**\n\n\\*dep. fed. RR 1979-1987.\n\n \n\n                *Júlio Augusto Magalhães Martins*nasceu em Boa Vista, no\ndia 24 de setembro de 1937, filho de Antônio Augusto Martins e Euclides\nMagalhães Martins. Seu pai foi deputado federal pelo antigo território\nde Rio Branco, atual estado de Roraima, entre 1947 e 1951.\n\n                Iniciou a carreira política como secretário do governo\ndo território de Roraima, de 1962 a 1964, nas gestões de Clóvis Nova da\nCosta (1961-1963) e de Francisco de Assis Albuquerque Peixoto\n(1963-1964).\n\n                Filiado à Aliança Renovadora Nacional (Arena), partido\nque apoiou o regime militar instaurado em abril de 1964, elegeu-se \nvereador de Boa Vista, em 1972. Empossado em fevereiro do ano seguinte,\npresidiu a Câmara Municipal neste período. Em 1974, renunciou ao mandato\npor ter sido nomeado prefeito do município pelo governador Fernando\nRamos Pereira.\n\nAo final do  mandato, em 1978, candidatou-se nas eleições do mesmo ano a\ndeputado federal. Na Câmara, integrou a Comissão do Interior até  1981.\nEm novembro de 1979, com a reformulação partidária, filiou-se ao Partido\nDemocrático Social (PDS), substituto da Arena, tornando-se seu\nvice-líder durante o ano de 1982. Participou também da Comissão de\nComunicação.\n\n                Em novembro de 1982, reelegeu-se deputado federal e\ndurante esta legislatura integrou a Comissão de Constituição e Justiça.\nEm 25 de abril de 1984, esteve ausente da votação da emenda Dante de\nOliveira, que propunha o restabelecimento de eleição direta para\npresidente da República em novembro daquele ano. Porém, a emenda não\nobteve o número de votos indispensáveis à sua aprovação – faltaram 22\npara que o projeto fosse encaminhado à apreciação pelo Senado. No\nColégio Eleitoral, reunido em 15 de janeiro de 1985, Júlio Martins votou\nno candidato do regime militar, Paulo Maluf, que acabou sendo derrotado\npelo oposicionista Tancredo Neves, eleito presidente da República pela\nAliança Democrática, união do Partido do Movimento Democrático\nBrasileiro (PMDB) com a dissidência do PDS abrigada na Frente Liberal.\nMas Tancredo não chegou a tomar posse, porque ficou gravemente doente e\nmorreu em 21 de abril de 1985. Assumiu o vice-presidente José Sarney,\nque já exercia interinamente o cargo desde 15 de março.\n\nTransferiu-se para o Partido Trabalhista Brasileiro (PTB) e no pleito de\nnovembro de 1986 concorreu a uma vaga de deputado federal constituinte.\nNão se elegeu e em janeiro de 1987 deixou a Câmara dos Deputados.\n\nEm 1992, saiu do PTB para ingressar no Partido Democrático Trabalhista\n(PDT). Candidatou-se, em outubro de 1994, a uma vaga no Senado. Mais uma\nvez não se elegeu. Em 1997, saiu do PDT e filiou-se ao Partido da Social\nDemocracia Brasileira (PSDB).\n\n                Casou-se com Maria Leitão Martins, com quem teve três\nfilhos.\n\n                Publicou  *Mensagem à Câmara Municipal*(1978).\n\n \n\nFONTES: CÂM. DEP. *Deputados brasileiros Repertório* (1983-1987); INF.\nBIOG.\n\n \n","ref":"FONTES: CÂM. DEP. *Deputados brasileiros Repertório* (1983-1987); INF.\nBIOG.\n\n \n","dic":"DHBB"}
