{"title":"MARTINS, Plínio","cargoss":["Deputado federal","Constituinte","Deputado federal"],"cargos_esp":[0,0,0],"datas_ini":[1983,1987,1988],"datas_fim":[1987,1988,1991],"estados":["MS",0,"MS"],"autor":[0],"content":"**MARTINS, Plínio**\n\n\\*dep. fed. MS 1983-1987; const. 1987-1988; dep. fed. MS 1988-1991.\n\n \n\n*Plínio Barbosa Martins* nasceu em Campo Grande, então no estado do Mato\nGrosso e atual capital de Mato Grosso do Sul, no dia 16 de setembro de\n1926, filho de Henrique Martins e de Adelaide Barbosa Martins. Era\noriundo de uma família de políticos: seu tio Vespasiano Barbosa Martins\nparticipou da Revolução de 1930, foi senador por Mato Grosso entre 1935\ne 1937, constituinte de 1946 e novamente senador entre 1946 e 1955. Seu\nirmão, Wilson Martins, foi deputado federal por Mato Grosso entre 1963 e\n1969, governador de Mato Grosso do Sul de 1983 a 1986 e em 1995 e\nsenador entre 1988 e 1994.\n\nNo início da década de 1950, bacharelou-se pela Pontifícia Universidade\nCatólica, em São Paulo.\n\nIngressou na política em novembro de 1962 ao eleger-se vereador em Campo\nGrande, na legenda da União Democrática Nacional (UDN), e assumir o\nmandato em março seguinte. Com a extinção dos partidos políticos pelo\nAto Institucional nº 2 (27/10/1965) e a posterior instauração do\nbipartidarismo, Plínio Martins filiou-se ao Movimento Democrático\nBrasileiro (MDB), partido de oposição ao governo. Terminando o mandato\nem janeiro de 1966, elegeu-se prefeito de Campo Grande em novembro\nseguinte e foi empossado em março de 1967. Em 1969 esteve no Estados\nUnidos a convite do Departamento de Estado daquele país. Deixou a\nprefeitura de Campo Grande em dezembro desse ano.\n\nDurante 1972 exerceu o cargo de auditor militar na cidade. Em 1975,\ntornou-se professor de direito civil da Faculdade de Direito de Campo\nGrande, na qual permaneceu até 1979.\n\nEm novembro de 1976 foi novamente eleito vereador, tendo assumido o\nsegundo mandato em março seguinte. Em outubro de 1977 foi sancionada a\nlei que dividiu em dois o estado de Mato Grosso. Surgiu assim, a partir\nde janeiro de 1979, o estado de Mato Grosso do Sul, tendo Campo Grande\ncomo capital e um governador nomeado. A capital de Mato Grosso\npermaneceu em Cuiabá.\n\nCom a extinção do bipartidarismo em 29 de novembro de 1979 e a\nconseqüente reformulação partidária, filiou-se ao Partido do Movimento\nDemocrático Brasileiro (PMDB) e nessa legenda foi eleito deputado\nfederal pelo Mato Grosso do Sul em novembro de 1982, com o apoio do\nPartido Comunista Brasileiro (PCB). Deixando a Câmara Municipal de Campo\nGrande em janeiro de 1983, tomou assento na Câmara dos Deputados em\nmarço seguinte. Ainda nesse ano tornou-se membro da executiva nacional\ndo PMDB.\n\nEntre os anos de 1983 e 1984 foi membro da Comissão de Constituição e\nJustiça e suplente da Comissão do Interior. Nesse mesmo ano, esteve em\nvisita oficial à Bulgária e à Romênia, como representante da Câmara.\n\nEm 25 de abril de 1984 votou a favor da emenda Dante de Oliveira, que,\napresentada na Câmara dos Deputados, propunha o restabelecimento das\neleições diretas para presidente da República em novembro daquele ano.\nComo a emenda não obteve o número de votos indispensáveis à sua\naprovação — faltaram 22 para que o projeto pudesse ser encaminhado à\napreciação pelo Senado —, no Colégio Eleitoral, reunido em 15 de janeiro\nde 1985, Plínio Martins votou no oposicionista Tancredo Neves, candidato\nda Aliança Democrática, uma união do Partido do Movimento Democrático\nBrasileiro (PMDB) com a dissidência do PDS abrigada na Frente Liberal.\nEleito, Tancredo não chegou a ser empossado na presidência, vindo a\nfalecer em 21 de abril de 1985. Seu substituto foi o vice José Sarney,\nque já vinha exercendo interinamente o cargo desde 15 de março.\n\nReeleito deputado federal constituinte pelo Mato Grosso do Sul em\nnovembro de 1986, assumiu a cadeira em fevereiro seguinte, quando\ntiveram início os trabalhos da Assembléia Nacional Constituinte. Ainda\nem 1987, foi segundo-vice-presidente da Subcomissão do Poder Judiciário\ne do Ministério Público, da Comissão da Organização dos Poderes e\nSistema de Governo.\n\nNas principais votações da Constituinte, foi contra a pena de morte, a\nproteção ao emprego contra a demissão sem justa causa, o aborto, a\npluralidade sindical, o presidencialismo e a limitação dos encargos da\ndívida externa. Pronunciou-se a favor do rompimento de relações\ndiplomáticas com países que adotem política de discriminação racial, da\nlimitação do direito de propriedade privada, da jornada semanal de 40\nhoras, do turno ininterrupto de seis horas, do aviso prévio\nproporcional, da unicidade sindical, da soberania popular, do voto aos\n16 anos, da nacionalização do subsolo e da proibição do comércio de\nsangue. Esteve ausente das seguintes votações: mandado de segurança\ncoletivo, estatização do sistema financeiro, limite de 12% ao ano para\nos juros reais, limitação dos encargos da dívida externa, criação de um\nfundo de apoio à reforma agrária, anistia aos micro e pequenos\nempresários, legalização do jogo do bicho e desapropriação da\npropriedade produtiva.\n\nCom a promulgação da Constituição em 5 de outubro de 1988, voltou a\nparticipar dos trabalhos legislativos ordinários da Câmara dos\nDeputados.\n\nDeixou a Câmara em janeiro de 1991, sem ter concorrido à reeleição em\noutubro do ano anterior, devido a uma divergência com o PMDB, que\ndecidira apoiar Gandi Jamil, do Partido Democrático Trabalhista (PDT),\npara governador do estado. Afastando-se da vida política, dedicou-se a\natividades privadas.\n\nFaleceu em São Paulo no dia 5 de outubro de 1998.\n\nEra casado com Rute Martins, com quem teve quatro filhos. Um deles,\nMarcelo Barbosa Martins, foi vereador em Campo Grande.\n\nMárcia Quarti/Cristiane Jalles\n\n \n\nFONTES: ASSEMB. NAC. CONST. (1987-1988); COELHO, J. & OLIVEIRA, A.\n*Nova*; *Globo* (26/4/84 e 16/1/85); INF. Rute Martins.\n\n \n","ref":"FONTES: ASSEMB. NAC. CONST. (1987-1988); COELHO, J. & OLIVEIRA, A.\n*Nova*; *Globo* (26/4/84 e 16/1/85); INF. Rute Martins.\n\n \n","dic":"DHBB"}
