{"title":"MASINI, Jovani","cargoss":["Constituinte","Deputado federal"],"cargos_esp":[0,0],"datas_ini":[1987,1987],"datas_fim":[1988,1991],"estados":[0,"PR"],"autor":[0],"content":"**MASINI, Jovani**\n\n\\*const. 1987-1988; dep. fed. PR 1987-1991.\n\n \n\n*Jovani Pedro Masini* nasceu em Campinas (SP) no dia 26 de junho de\n1930, filho de Carlos Masini e de Margherita Sanini Masini.\n\nAdvogado, industrial, fazendeiro e comerciante, cursou a Faculdade de\nDireito da Universidade Federal do Paraná (Ufpr), na qual bacharelou-se\nem 1954. Após formar-se abriu escritório de advocacia em Ponta Grossa\n(PR). Na década de 1960 tornou-se empresário da indústria madeireira e\nem 1970 dedicou-se à agropecuária. A partir de 1977 dedicou-se ao\ncomércio de automóveis.\n\nIniciou sua carreira política como deputado federal constituinte na\nlegenda do Partido do Movimento Democrático Brasileiro (PMDB) do Paraná,\neleito no pleito de novembro de 1986. Durante o mandato, iniciado em\nfevereiro de 1987, atuou nos trabalhos da Assembleia Nacional\nConstituinte como titular da Subcomissão do Orçamento e Fiscalização\nFinanceira, da Comissão do Sistema Tributário, Orçamento e Finanças, e\nsuplente da Subcomissão de Ciência e Tecnologia e da Comunicação, da\nComissão da Família, da Educação, Cultura e Esportes, da Ciência e\nTecnologia e da Comunicação. Foi um dos poucos deputados federais a\nassumir publicamente ser representante e dirigente regional da União\nDemocrática Ruralista (UDR), entidade que atuou na Constituinte em favor\ndos interesses dos latifundiários e contra a reforma agrária.\n\nAusente em mais da metade das votações, manifestou-se contra a limitação\ndo direito de propriedade privada, a remuneração 50% superior para o\ntrabalho extra, a jornada semanal de 40 horas, o turno ininterrupto de\nseis horas, a nacionalização do subsolo, a estatização do sistema\nfinanceiro, o limite de 12% ao ano para os juros reais, a proibição do\ncomércio de sangue, a limitação dos encargos da dívida externa e a\ncriação de um fundo de apoio à reforma agrária. Votou também contra a\nregulamentação do salário mínimo, do aviso prévio, do direito de greve e\ndo piso salarial. Manifestou-se a favor do mandado de segurança\ncoletivo, da proteção ao trabalho contra despedida sem justa causa, do\naborto, da unicidade sindical, do voto aos 16 anos, do presidencialismo,\ndo mandato de cinco anos para o presidente José Sarney e da anistia para\nos micro e pequenos empresários. Defendeu ainda o tratamento especial à\npropriedade produtiva e procedimentos inibitórios para a desapropriação.\nManifestou-se contra a existência das empresas estatais por considerar o\ncapital estrangeiro necessário para o desenvolvimento do país. Com a\npromulgação da Constituição em 5 de outubro de 1988, voltou a participar\ndos trabalhos legislativos ordinários da Câmara dos Deputados.\n\nConcorreu à reeleição em outubro de 1990, obtendo apenas uma suplência.\nDeixou a Câmara dos Deputados em janeiro de 1991, ao término da\nlegislatura.\n\nEm outubro de 1992, elegeu-se vice-prefeito de Ponta Grossa (PR) na\nchapa encabeçada por Paulo Cunha Nascimento, tomando posse em 1º de\njaneiro de 1993. Deixou o cargo em 31 de dezembro de 1996.\n\nDevido a problemas de saúde, deixou a carreira política e passou a se\ndedicar apenas à administração de suas duas empresas, uma concessionária\nde automóveis e uma locadora de veículos, ambas sediadas em Ponta\nGrossa.\n\nFoi ainda vice-presidente da Associação Brasileira de Distribuidores de\nVeículos.\n\n \n\nFONTES: ASSEMB. NAC. CONST. *Repertório* (1987-1988); COELHO, J. &\nOLIVEIRA, A.*Nova*.\n\n \n\n \n","ref":"FONTES: ASSEMB. NAC. CONST. *Repertório* (1987-1988); COELHO, J. &\nOLIVEIRA, A.*Nova*.\n\n \n\n \n","dic":"DHBB"}
