{"title":"MATA, João da","cargoss":["Constituinte","Deputado federal"],"cargos_esp":[0,0],"datas_ini":[1987,1987],"datas_fim":[1988,1991],"estados":[0,"PB"],"autor":[0],"content":"**MATA, João da**\n\n    \\*const. 1987-1988; dep. fed. PB 1987-1991.\n\n \n\nJoão da Mata de Sousa nasceu em Pombal (PB), no dia 8 de fevereiro de\n1941, filho de Jeremias Camilo de Sousa e de Alice Bandeira de Sousa.\n\nFez os estudos secundários no Seminário Franciscano de Campina Grande.\nFuncionário administrativo da Superintendência do Desenvolvimento do\nNordeste (Sudene) em 1960, bacharel pela faculdade de direito da\nUniversidade Federal de Pernambuco (Ufpe), em 1968, com estágio na\nUniversidade de Harvard, nos Estados Unidos, manteve escritório de\nadvocacia no Recife até 1975, e a partir daí dedicou-se a seus negócios\nparticulares.\n\nEm 1979 fundou a Nutribrás S.A. Carnes e Derivados, que se transformou\nna Lechef S.A. Indústrias Alimentícias, empresa nordestina pioneira na\nindustrialização de carnes. Proprietário da Artobrás, fabricante de\nrações e concentrados, e da Estrutural, Construções, Incorporações e\nComércio.\n\nIngressou na política em 1986, filiado ao Partido da Frente Liberal\n(PFL) e apoiando o senador Marcondes Gadelha, candidato ao governo do\nestado que acabou derrotado pelo deputado Tarcísio Buriti, do Partido do\nMovimento Democrático Brasileiro (PMDB). Nesse mesmo pleito João da Mata\nelegeu-se deputado federal constituinte pela Paraíba.\n\nTitular da Subcomissão dos Direitos dos Trabalhadores e Servidores\nPúblicos, da Comissão da Ordem Social, e suplente da Subcomissão do\nPoder Executivo, da Comissão da Organização dos Poderes e Sistema de\nGoverno, votou a favor da soberania popular, do voto facultativo aos 16\nanos, do presidencialismo, do mandato de cinco anos para o então\npresidente da República José Sarney, da nacionalização do subsolo, da\nlimitação dos encargos da dívida externa, do limite de 12% ao ano para\nos juros reais e da proibição do comércio de sangue. E contra o\nrompimento de relações diplomáticas com países que praticassem políticas\nde discriminação racial, a pena de morte, a limitação do direito de\npropriedade, a estatização do sistema financeiro, a desapropriação da\npropriedade produtiva, o mandado de segurança coletivo, a jornada\nsemanal de 40 horas, o turno ininterrupto de seis horas, a demissão sem\njusta causa e a legalização do jogo do bicho. Absteve-se quanto à\ncriação de um fundo para a reforma agrária.\n\nConservador a ponto de discordar de algumas propostas “avançadas” do\nPFL, acabou deixando o partido em agosto de 1987, filiando-se ao Partido\nDemocrata Cristão (PDC). Adepto do “Centrão”, grupo de parlamentares de\ntendência conservadora, mostrou-se favorável às leis que reduziam a\nparticipação do Estado na economia e propiciavam incentivos à\npropriedade rural produtiva.\n\nEm agosto de 1989, porém, retornou ao PFL, e no pleito de outubro de\n1990 tentou reeleger-se, obtendo a primeira suplência. Permaneceu na\nCâmara dos Deputados até o término da legislatura, em janeiro do ano\nseguinte. Em março foi nomeado pelo governador Ronaldo Cunha Lima\nsecretário estadual da Indústria, Comércio, Ciência e Tecnologia, cargo\nno qual permaneceu até o fim de agosto de 1992.\n\nCom a eleição de Cássio Cunha Lima do PSDB para o governo da Paraíba em\n2002, João da Mata assumiu a secretaria da Indústria, Comércio, Turismo,\nCiência e Tecnologia em 2003, representando o seu partido, PFL. Mas não\nexerceu durante muito tempo a secretaria, se afastando em seguida para\nse dedicar a atividade empresarial.\n\nDesde 1991, exerceu em diversas oportunidades a presidência do Centro\ndas Indústrias do Estado da Paraíba.\n\nCasado com Maria do Socorro de Brito e Silva, de quem se divorciou, teve\ntrês filhos.\n\n \n\nFONTES: ASSEMB. NAC. CONST. *Repertório*(1987-1988); CÂM. DEP.\n*Deputados brasileiros. Repertório*(1991-1995); COELHO, J. & OLIVEIRA,\nA.*Nova*; INF. Marcelo Renato de Cerqueira Pais.\n\n \n\n \n","ref":"FONTES: ASSEMB. NAC. CONST. *Repertório*(1987-1988); CÂM. DEP.\n*Deputados brasileiros. Repertório*(1991-1995); COELHO, J. & OLIVEIRA,\nA.*Nova*; INF. Marcelo Renato de Cerqueira Pais.\n\n \n\n \n","dic":"DHBB"}
