{"title":"MATA, João Nogueira da","cargoss":["Governador de estado ou do Distrito Federal","Governador de estado ou do Distrito Federal","Deputado federal"],"cargos_esp":[0,0,0],"datas_ini":[1947,1946,1948],"datas_fim":[1947,1946,1950],"estados":["AM","AM","AM"],"autor":[0],"content":"**MATA, João Nogueira da**\n\n\\*gov. AM 1946 e 1947; dep. fed. AM 1948-1950.\n\n* *\n\n*João Nogueira da Mata* nasceu em Manaus no dia 27 de dezembro de 1909,\nfilho de Joaquim José da Mata e de Raulina Nogueira da Mata.\n\nAdvogado, elegeu-se suplente de deputado federal pelo Amazonas no pleito\nde 2 de dezembro de 1945, na legenda do Partido Social Democrático\n(PSD).\n\nFoi também presidente do Conselho Administrativo do Amazonas e, em\nfunção desse cargo, governou o estado de 31 de agosto a 13 de setembro\nde 1946, sucedendo ao interventor federal Raimundo Nicolau Silva. Em\nseguida, passou o cargo ao novo interventor, o tenente-coronel Siseno\nSarmento. Ainda na qualidade de presidente do Conselho Administrativo do\nestado tornou a assumir a chefia do governo amazonense com a saída de\nSiseno Sarmento, em 1º de fevereiro de 1947. No dia 8 de maio do mesmo\nano, passou o cargo para o governador eleito Leopoldo Amorim da Silva\nNeves.\n\nOcupou uma cadeira na Câmara dos Deputados entre dezembro de 1948 e\nmarço de 1950. Em outubro desse ano, candidatou-se a deputado federal\npelo Partido Trabalhista Brasileiro (PTB), mas alcançou apenas uma\nsuplência.\n\nPublicou *Cancioneiro Manauara* (1981).\n\n \n\nFONTES: CÂM. DEP. *Deputados;*CÂM. DEP. *Deputados brasileiros.\nRepertório* (1946-1967); *Grande* *encic. Delta;*TRIB. SUP. ELEIT.\n*Dados* (1).\n\n \n","ref":"FONTES: CÂM. DEP. *Deputados;*CÂM. DEP. *Deputados brasileiros.\nRepertório* (1946-1967); *Grande* *encic. Delta;*TRIB. SUP. ELEIT.\n*Dados* (1).\n\n \n","dic":"DHBB"}
