{"title":"MATOS, Heitor Furtado Arnizaut de","cargoss":["Comandante Militar","comte Deptº Eng e Comunic"],"cargos_esp":["Planalto",0],"datas_ini":[1977,1981],"datas_fim":[1978,1982],"estados":[0,0],"autor":[0],"content":"**MATOS, Heitor Furtado Arnizaut de**\n\n\\*militar ; comte mil. Planalto 1977-1978; comte Deptº Eng. e Comunic.\n1981-1982;\n\ncomte IV Ex. 1982-1983.\n\n \n\n                *Heitor Furtado de Arnizaut de Matos* nasceu em Salvador\nno dia 26 de fevereiro de 1919, filho de José Augusto Arnizaut de Matos\ne Beatriz Amália Arnizaut de Matos.\n\n                 Iniciou sua carreira militar em maio de 1935 e, como\ncadete, fez parte da tropa que enfrentou a rebelião da Escola de Aviação\nMilitar, durante a Revolta Comunista de novembro de 1935. Foi declarado\naspirante a oficial em novembro de 1937, na mesma turma do futuro\npresidente João Batista Figueiredo. No ano seguinte, foi promovido a 1º\ntenente e, em dezembro de 1940 a 2º tenente.\n\n                Serviu durante a 2ª Guerra Mundial, no Regimento\nSampaio, sendo o primeiro oficial da Força Expedicionária Brasileira\n(FEB) a atingir o cume do monte Castelo, em fevereiro de 1944. Promovido\nem dezembro do mesmo ano a  capitão, recebeu a patente de major em\njaneiro de 1952.\n\n                Serviu junto ao Núcleo de Comando da Zona de Defesa Sul,\ndo Estado Maior das Forças Armadas, saindo em abril de 1964, logo após o\ntriunfo do movimento político-militar que depôs o presidente João\nGoulart, para trabalhar como oficial de gabinete do Ministério do\nExército, então Ministério da Guerra. Permaneceu neste cargo até julho,\nquando assumiu o comando da Polícia do Exército de Brasília.\nGeneral-de-brigada em julho de 1971, neste posto exerceu os comandos da\nArtilharia Divisionária da 3ª Divisão de Exército e da  6ª Brigada.\n\n                Em junho de 1977, durante o governo do general  Ernesto\nGeisel (1974-1979), tornou-se o primeiro titular do Comando Militar do\nPlanalto, criado nessa ocasião. Quatro meses após ter assumido este\ncargo,  viveu momentos delicados, quando declarou ao até então ministro\ndo Exército,  general  Sílvio Frota, no dia da demissão deste, que\nobedecia às ordens do presidente Geisel. Frota quis prendê-lo e tentou\nimpedir que Arnizaut deixasse a sala em que ocorreu o tenso diálogo. O\nministro foi demitido porque resistia ao projeto de redemocratização\npromovido pelo governo Geisel, tendo inclusive articulado sua\ncandidatura à presidência da República, apoiado pela “linha dura”\nmilitar.\n\nAo deixar a chefia do Comando Militar do Planalto em  fevereiro de 1979,\nquando foi substituído pelo general Heitor Luís Gomes de Almeida, \nArnizaut acusou  a imprensa de dar “muito apoio aos comunistas”. Dias\ndepois, o general esclareceu que essa declaração fora feita “dentro de\num contexto específico, sem o objetivo de uma crítica generalizada à\nimprensa”. Assumiu em seguida a Diretoria de Especialização e Extensão,\nsaindo em agosto do mesmo ano, quando foi nomeado para a vice-chefia do\nDepartamento de Ensino e Pesquisa.\n\n                Em março de 1981 foi promovido a general-de-exército,\nsendo o único integrante do alto comando com o curso de opinão pública e\nrelações públicas, realizado na Pontifícia Universidade Católica do Rio\nde Janeiro, além do curso de historiografia do Brasil, na Academia\nBrasileira de Letras. Em maio de 1981, assumiu o comando de Departamento\nde Engenharia e Comunicações (DEC), em substituição ao\ngeneral-de-divisão Ivan de Sousa Mendes. Nessa ocasião,  Arnizaut\ndefendeu a decretação da pena de morte para os bandidos irrecuperáveis.\n\n                Em setembro de 1982, deixou o comando do DEC, entrando\nem seu lugar o seu próprio antecessor, o general Ivan de Sousa Mendes.\nNeste mesmo mês,  assumiu o comando do IV Exército, com sede em Recife,\nsubstituindo o general Ênio Gouveia. Permaneceu no cargo até setembro de\n1983, quando passou à reserva, por ter completado 12 anos de generalato.\nFoi substituído pelo general Jorge Sá Freire de Pinho. Depois de ter ido\npara a reserva, o general não exerceu mais nenhuma atividade\nprofissional.\n\n                Casou-se com Lurdes Gonçalves Arnizaut de Matos, com\nteve quatro filhos.\n\n \n\nFONTES: *Estado de São Paulo* (26/12/76, 1/4/81, 5/5/81, 29/7/82);\n*Globo*(2/4/81, 22/4/81); *Jornal do Brasil*(16/7/79, 9/8/79, 2/4/81,\n9/2/82, 12/9/83).\n\n \n\n \n\n \n\n \n\n \n","ref":"FONTES: *Estado de São Paulo* (26/12/76, 1/4/81, 5/5/81, 29/7/82);\n*Globo*(2/4/81, 22/4/81); *Jornal do Brasil*(16/7/79, 9/8/79, 2/4/81,\n9/2/82, 12/9/83).\n\n \n\n \n\n \n\n \n\n \n","dic":"DHBB"}
