{"title":"MATOS, Horácio","cargoss":["Deputado federal"],"cargos_esp":[0],"datas_ini":[1975],"datas_fim":[1987],"estados":["BA"],"autor":[0],"content":"**MATOS, Horácio**\n\n\\*  dep. fed. BA 1975-1987.\n\n \n\n*                Horácio Matos Júnior*nasceu em Lençóis (BA) no dia 13\nde março de 1927, filho de Horácio de Queirós Matos e de Augusta Medrado\nMatos.  Seu pai, poderoso \"coronel\" da região de Lavras Diamantinas (BA)\nentre 1923 e 1930, participou da revolta de 1919 para depor o então\ngovernador da Bahia, José Joaquim Seabra, foi um dos organizadores dos\nBatalhões Patrióticos, constituídos para combater a Coluna Prestes em\n1926, e apoiou o presidente Washington Luís na Revolução de 1930, tendo\nsido assassinado pouco tempo depois.\n\n                Fez seus estudos primários no colégio César Zama no\nmunicípio de Piatã, concluindo o curso ginasial em 1943 no Instituto\nPonte Nova de Itacira, atual município de Wagner. Neste período, fez\ncurso técnico de contabilidade no colégio Hugo Baltazar da Silveira, em\nSalvador.\n\n                Funcionário público federal, em 1946 foi escrivão\ninterino da Coletoria Federal de Piatã, tendo prestado concurso três\nanos depois para o cargo de escrivão coletor. Em 1951 assumiu a\ncoletoria Federal de Piatã, tornando-se inspetor alguns anos depois.\nPermaneceu no cargo até o ano de 1958, quando ingressou na vida política\ncomo vereador e presidente da Câmara Municipal de Piatã (BA) pelo\npartido da União Democrática Nacional (UDN). Deixou o cargo para\nconcorrer, no pleito de outubro de 1962, a uma vaga de deputado na\nAssembléia Legislativa da Bahia, na legenda do Partido Social\nTrabalhista (PST). Bem-sucedido, assumiu o mandato em fevereiro do ano\nseguinte e, com a extinção dos partidos políticos pelo Ato Institucional\nnº. 2 (27/10/65) e a posterior instauração do bipartidarismo, filiou-se\nà Aliança Renovadora Nacional (Arena), partido de sustentação ao regime\nmilitar instalado no país em abril de 1964.  Reeleito em novembro de\n1966 e em novembro de 1970, chegou a ocupar como deputado estadual a\nvice-presidência da Assembléia, a presidência da Comissão de Assuntos\nMunicipais e a primeira secretaria da mesa.\n\n                Em novembro de 1974, foi eleito deputado federal.\nDeixando a Assembléia em janeiro de 1975, no mês seguinte assumiu o\nmandato na Câmara, e durante aquele ano foi membro titular da Comissão\nde Minas e Energia e suplente da Comissão de Agricultura e Política\nRural. Em novembro de 1978, foi reeleito deputado federal e, após a\nextinção do bipartidarismo (29/11/1979) e a conseqüente reformulação\npartidária, filiou-se ao Partido Democrático Social (PDS), que passou a\ncongregar as forças políticas da extinta Arena. Entre 1979 e 1981,\nparticipou da Comissão de Minas e Energia, da qual foi presidente\ndurante o ano de 1982, e vice-presidente em 1979, 1981 e 1983. Neste\nmesmo período, foi também suplente da Comissão de Serviço Público.\n\nFoi reeleito em novembro de 1982. Esteve ausente da sessão de 25 de\nabril de 1984 em que se votou a emenda Dante de Oliveira. Ela propunha o\nrestabelecimento das eleições diretas para presidente da República para\nnovembro seguinte, mas não atingiu a votação necessária para ser\nencaminhada ao Senado. Assim, a sucessão de Figueiredo ficou para ser\ndecidida pelo Colégio Eleitoral, solução adotada desde a instauração do\nregime militar, em março de 1964. Em agosto de 1984, a convenção\nnacional do PDS aprovou a candidatura do ex-governador de São Paulo e\ndeputado federal Paulo Maluf, que derrotou a pré-candidatura do ministro\ndo Interior, o coronel Mário Andreazza. No mesmo período, a oposição\nreunida na Aliança Democrática – coligação do PMDB com a dissidência do\nPDS batizada de Frente Liberal – lançou o ex-governador de Minas Gerais\nTancredo Neves, tendo como vice o senador José Sarney. Horácio Matos\nvotou em Maluf no Colégio Eleitoral que, reunido em 15 de janeiro de\n1985,  elegeu Tancredo Neves. Gravemente enfermo, no entanto, Tancredo\nnão chegou a assumir a presidência em 15 de março. Com isso, José Sarney\ntornou-se o novo presidente do país, sendo efetivado no cargo após a\nmorte do ex-governador de Minas em 21 de abril de 1985.\n\n                Horácio Matos renunciou ao mandato na Câmara em janeiro\nde 1986, um ano antes do término da legislatura, sendo substituído pelo\nsuplente Vasco Neto. Sem concorrer a mais nenhum cargo político, assumiu\na função de conselheiro do Tribunal de Contas do Estado da Bahia, que\nexerceria até junho de 1987. Ainda em 1986, formou-se em teologia pela\nUniversidade Fundamentalista de São Paulo.\n\n                Em 1987 assumiu o cargo de diretor regional do Serviço\nNacional de Assistência Rural (Senar), no qual permaneceu por dois anos.\n\n                De 1994 a 1998 foi diretor imobiliário da Urbis\n(Habitação e Urbanização da Bahia S.A.), aposentando-se em 1999 pelo\nTribunal de Contas do Estado e pela Câmara dos Deputados. Em setembro\ndeste último ano filiou-se ao Partido Liberal (PL).\n\n                Foi casado com Magnólia Xavier Matos, com quem teve oito\nfilhos e, em segundo matrimônio, com Maria Alice Gomes da Costa Matos,\ncom quem teve dois filhos. Um de seus filhos, Horácio Matos Neto, foi\neleito deputado estadual por quatro vezes consecutivas (1986, 1990, 1994\ne 1998), sendo presidente do PL e primeiro-secretário da Assembléia\nLegislativa em 1999.\n\n \n\nFONTES:  CÂM. DEP. *Deputados;* CÂM. DEP*. Deputados brasileiros.\nRepertório*(1975-1979, 1979-1983 e 1983-1987); INF. BIOG.; NÉRI, S. *16;\nPopular*(9/12/77); TRIB SUP. ELEIT. *Dados* (6, 8 e 9).\n\n \n\n \n\n \n\n \n","ref":"FONTES:  CÂM. DEP. *Deputados;* CÂM. DEP*. Deputados brasileiros.\nRepertório*(1975-1979, 1979-1983 e 1983-1987); INF. BIOG.; NÉRI, S. *16;\nPopular*(9/12/77); TRIB SUP. ELEIT. *Dados* (6, 8 e 9).\n\n \n\n \n\n \n\n \n","dic":"DHBB"}
