{"title":"MATOS, Lino de","cargoss":["Revolucionário ou revoltoso","Revolucionário ou revoltoso","Revolucionário ou revoltoso","Senador","Prefeito","Senador"],"cargos_esp":[0,0,0,0,"São Paulo",0],"datas_ini":[1924,1930,1932,1955,1955,1956],"datas_fim":[1924,1930,1932,1955,1956,1971],"estados":[0,0,0,"SP",0,"SP"],"autor":[0],"content":"**MATOS, Lino de**\n\n\\*rev. 1924; rev. 1930; rev. 1932; sen. SP 1955; pref. São Paulo\n1955-1956; sen. SP 1956-1971.\n\n \n\n*Juvenal Lino de Matos* nasceu em Ipuaçu (SP) no dia 28 de março de\n1904, filho de Bento Lino de Matos e de Elisa Conceição Matos.\n\nConcluiu o primário no Grupo Escolar de Santa Cruz do Rio Pardo, no\nestado de São Paulo. Ainda adolescente, trabalhou com seus pais, colonos\nde uma fazenda de café, na mesma cidade. Mais tarde transferiu-se para a\ncapital paulista, matriculando-se no Instituto de Ciências e Letras,\npelo qual se formou em ciências econômicas. Tornou-se professor desse\ninstituto e posteriormente diretor e proprietário do mesmo\nestabelecimento.\n\nCorretor de imóveis, foi diretor-geral da Escola Técnica de Comércio e\nda Escola Comercial de São Paulo. Participou, em seu estado, dos\nmovimentos revolucionários de 1924 e de 1930. Durante a Revolução\nConstitucionalista de 1932, tomou parte em combates e comandou tropas,\nsendo comissionado no posto de tenente-coronel. Com a derrota da\nrevolução, engajou-se no movimento sindical de São Paulo, entre 1934 e\n1937, chegando a presidente da União dos Sindicatos dos Trabalhadores.\nApós a implantação do Estado Novo (10/11/1937), foi também um dos\nresponsáveis pela escolha de Ademar de Barros para interventor federal\nno estado, em abril de 1938.\n\nEm janeiro de 1947 elegeu-se deputado à Assembléia Constituinte paulista\nna legenda do Partido Social Progressista (PSP), chefiado por Ademar.\nParticipou dos trabalhos constituintes e, com a promulgação da nova\nCarta estadual e a transformação da Constituinte em Assembléia\nLegislativa ordinária, permaneceu no exercício do mandato. Ainda no\ngoverno de Eurico Gaspar Dutra (1946-1951), atuou na campanha contra a\nintervenção federal em São Paulo. Reeleito deputado estadual em outubro\nde 1950 na legenda do PSP, no início de 1951 deixou a Assembléia para\nassumir, a convite do governador Lucas Nogueira Garcez, o cargo de\nsecretário de Educação do estado de São Paulo. Mais tarde, ao retornar\nde uma viagem à Europa, voltou à Assembléia e liderou uma campanha\ncontra o governador Lucas Garcez. Participou ainda do movimento de\ndefesa da cafeicultura, da luta contra o confisco cambial e da defesa\ndos trabalhadores do campo e da cidade.\n\nEm outubro de 1954 foi eleito senador por São Paulo, sempre na legenda\ndo PSP. Deixando o Legislativo estadual em janeiro de 1955, no mês\nseguinte assumiu uma cadeira no Senado. Em maio do mesmo ano elegeu-se\nprefeito de São Paulo em pleito extraordinário, convocado em virtude da\neleição do prefeito Jânio Quadros para o governo paulista, e em junho\nafastou-se do Senado para assumir a prefeitura da capital. Em abril de\n1956, entretanto, renunciou ao cargo, devido ao parecer contrário à\nacumulação dos dois mandatos emitido pela Comissão de Constituição e\nJustiça do Senado. Substituído pelo vice-prefeito Vladimir de Toledo\nPiza, voltou a cumprir o mandato de senador.\n\nVice-líder do PSP em 1958, em 1960 foi designado para acompanhar, como\nobservador do Senado, os trabalhos da XXXII Reunião do Conselho da\nOrganização para a Alimentação e a Agricultura (FAO), em Roma. Foi\nmembro das comissões de Finanças, de Reforma Constitucional, da Mudança\nda Capital da República, de Educação e Cultura e de Transportes,\nComunicação e Obras Públicas do Senado. A convite do Parlamento\nitaliano, participou da delegação de senadores brasileiros que em 1962\nvisitou a Itália. Ainda nesse ano, passou à liderança do Partido\nTrabalhista Nacional (PTN) no Senado, ao qual se vinculara, e em outubro\nreelegeu-se senador por São Paulo na coligação formada pelo PTN e pelo\nMovimento Trabalhista Renovador (MTR).\n\nEm 1963 voltou à liderança do PTN no Senado e, logo após o movimento\npolítico-militar de 31 de março de 1964, que depôs o presidente João\nGoulart, endossou a candidatura do general Amauri Kruel — comandante do\nII Exército, sediado em São Paulo — à presidência da República. O\nlançamento do nome de Kruel foi interpretado como uma tentativa de\nenfraquecer a candidatura do general Humberto de Alencar Castelo Branco,\nchefe do Estado-Maior do Exército e eleito afinal pelo Congresso ainda\nem abril. Entre junho de 1964 e meados de 1965, Lino de Matos foi líder\ndo Bloco Parlamentar Independente no Senado.\n\nEm março de 1965 candidatou-se à prefeitura de São Paulo, na última\neleição direta realizada para a chefia do Executivo da capital paulista,\nmas foi derrotado pelo brigadeiro José Vicente de Faria Lima, que contou\ncom o apoio do ex-presidente Jânio Quadros. Com a extinção dos partidos\npolíticos pelo Ato Institucional nº 2 (27/10/1965) e a posterior\ninstauração do bipartidarismo, filiou-se ao Movimento Democrático\nBrasileiro (MDB), partido de oposição ao regime militar, sendo escolhido\npara presidir o diretório paulista da agremiação.\n\nVice-líder do MDB no Senado a partir de março de 1967, concluiu o\nmandato de senador em janeiro de 1971. Em agosto de 1974, ainda como\npresidente do MDB paulista, disputou com Orestes Quércia e José Freitas\nNobre a indicação da convenção do partido para concorrer ao Senado nas\neleições de novembro seguinte, sendo derrotado por Quércia, que obteve\n80% dos votos.\n\nParticipou de congressos educacionais em Portugal, Espanha, França,\nSuíça, Itália, Alemanha, Inglaterra, Bélgica, Holanda, Uruguai, Chile e\nPeru.\n\nFaleceu em São Paulo, no dia 4 de junho de 1991.\n\nEra casado com Leonilda Lino de Matos.\n\n \n\nFONTES: CASTELO BRANCO, C. *Militares* (1); *Eleitos*; *Encic. Mirador*;\n*Grande encic. Delta*; *Maquis*; NÉRI, S. *16*; SENADO. *Dados*; SENADO.\n*Relação dos líderes*;*****Veja* (12/6/91).\n\n \n","ref":"FONTES: CASTELO BRANCO, C. *Militares* (1); *Eleitos*; *Encic. Mirador*;\n*Grande encic. Delta*; *Maquis*; NÉRI, S. *16*; SENADO. *Dados*; SENADO.\n*Relação dos líderes*;*****Veja* (12/6/91).\n\n \n","dic":"DHBB"}
