{"title":"ARAÚJO, Ernesto de","cargoss":["Comandante da Escola Superior de Guerra"],"cargos_esp":[0],"datas_ini":[1954],"datas_fim":[1955],"estados":[0],"autor":[0],"content":"**ARAÚJO, Ernesto de**\n\n\\*militar; comte. ESG 1954-1955.\n\n \n\n*Ernesto de Araújo* nasceu em Porto Alegre no dia 13 de fevereiro de\n1892, filho de Eleutério de Castro Araújo e de Elvira Fonseca de Araújo.\n\nIngressou em abril de 1908 na Escola Naval, no Rio de Janeiro, então\nDistrito Federal, sendo declarado guarda-marinha em janeiro de 1911.\nPromovido a segundo-tenente em agosto de 1912, durante a Primeira Guerra\nMundial (1914-1918) participou de operações de guerra, servindo no\ncomando da ilha de Trindade, no litoral do Espírito Santo, e como\noficial do contratorpedeiro *Rio Grande do Norte.*Nesse ínterim, foi\npromovido, em maio de 1916, a primeiro-tenente.\n\nElevado sucessivamente às patentes de capitão-tenente, em fevereiro de\n1922, capitão-de-corveta, em setembro de 1932, e capitão-de-fragata, em\nnovembro de 1938, foi designado em 1939 para integrar a Comissão\nRevisora do Regulamento Disciplinar da Armada e, em 1942, para a\nOrdenança Geral para o Serviço da Armada. Promovido a\ncapitão-de-mar-e-guerra em maio de 1944, presidiu no ano seguinte a\nOrganização do Plano de Ensino para o Pessoal Subalterno da Armada.\n\nTornou-se contra-almirante em setembro de 1946, sendo designado, em\n1948, delegado naval na representação brasileira à IX Conferência\nInteramericana e membro do Conselho do Almirantado. Em março de 1952 foi\npromovido a vice-almirante e, em setembro de 1954, nomeado comandante da\nEscola Superior de Guerra (ESG), em substituição ao marechal Juarez\nTávora. Em novembro de 1955 deixou o posto que foi assumido pelo\nmarechal-do-ar Ajalmar Vieira Vasconcelos. Em fevereiro de 1956 passou à\nreserva na patente de almirante-de-esquadra.\n\nNo curso da sua carreira militar, serviu como oficial subalterno no\naviso *Tefé*e como oficial superior nos contratorpedeiros *Mato*\n*Grosso*e *Greenhalgh.*Exerceu, também, as funções de vice-diretor de\nensino naval; comandante do V Distrito Naval, sediado em Santa Catarina;\ndiretor da Escola de Guerra Naval, no Rio de Janeiro; adido naval e\ndelegado brasileiro junto à Junta Interamericana de Defesa em\nWashington; vice-chefe do Estado-Maior da Armada, e inspetor-geral da\nMarinha. Fez também os cursos de engenharia de estradas, de guerra\nnaval, de submarinos e armas submarinas, de comando e curso superior da\nEscola de Guerra Naval da ESG.\n\nFaleceu em 15 de outubro de 1964.\n\nFoi casado com Catarina Coelho de Araújo, com quem teve uma filha.\n\n \n\nFONTES: CORRESP. ESC. SUP. GUERRA; COSTA, M. *Cronologia; Eleitos;*MIN.\nGUERRA.*Subsídios,*MIN. MAR. *Almanaque* (1956); SOC. BRAS. EXPANSÃO\nCOMERCIAL. *Quem.*\n\n \n","ref":"FONTES: CORRESP. ESC. SUP. GUERRA; COSTA, M. *Cronologia; Eleitos;*MIN.\nGUERRA.*Subsídios,*MIN. MAR. *Almanaque* (1956); SOC. BRAS. EXPANSÃO\nCOMERCIAL. *Quem.*\n\n \n","dic":"DHBB"}
