{"title":"MAYNARD, Jorge","cargoss":["Senador"],"cargos_esp":[0],"datas_ini":[1957],"datas_fim":[1963],"estados":["SE"],"autor":[0],"content":"**MAYNARD, Jorge**\n\n\\*sen. SE 1957-1963.\n\n \n\n*Jorge Campos Maynard* nasceu em Aracaju no dia 3 de agosto de 1909,\nfilho do desembargador João Maynard e de Deruchette Campos Maynard. Seu\navô, Guilherme de Sousa Campos, foi senador por Sergipe de 1909 a 1918.\n\nFez os primeiros estudos no Colégio Camerino, em Estância (SE), no\nGrêmio Escolar e no Ateneu Pedro II, ambos em sua cidade natal. Em 1933\nformou-se em engenharia de minas pela Escola de Minas e Metalurgia de\nOuro Preto (MG).\n\nIngressou em 1935 no Ministério da Viação, onde exerceu até 1938 a\nfunção de engenheiro-auxiliar no Departamento de Portos, Rios e Canais,\nsediado na região do vale do rio São Francisco. Em 1941, passou a servir\nno Departamento de Engenharia do recém-criado Ministério da Aeronáutica,\nocupando em seguida os cargos de engenheiro-chefe das obras do aeroporto\nSalgado Filho, em Porto Alegre, da base aérea de Santa Cruz, no Rio de\nJaneiro, então Distrito Federal, e da Escola de Aeronáutica de\nPirassununga (SP). Chefe do Serviço de Engenharia da V Zona Aérea,\nsediada em Porto Alegre, chefiou também a Seção de Edificações, de\nInstalações e de Orçamentos e foi diretor das divisões de Edificações e\nde Infra-Estruturas da Diretoria da Aeronáutica, tornando-se em 1949\nengenheiro-assistente da Comissão do Vale do Rio São Francisco, onde\npermaneceu até 1952.\n\nAinda neste último ano, foi eleito prefeito da capital sergipana,\nassumindo seu mandato no início de 1953. Pouco tempo depois, em outubro\nde 1954, disputou uma vaga para o Senado, sendo representante de uma\ncoligação formada pelo Partido Social Progressista (PSP) e pela União\nDemocrática Nacional (UDN). Malsucedido em seu intento, permaneceu na\nprefeitura de Aracaju até 1955, e foi suplente do senador por Sergipe\nAugusto Maynard Gomes até agosto de 1957, quando este último veio a\nfalecer. Exercendo, desde então, o mandato de senador, veio a integrar,\nno ano seguinte, a delegação brasileira à VI Conferência da Organização\nda Aviação Civil Internacional (OACI), no Canadá. Presidente da Comissão\nde Transportes, Comunicações e Obras Públicas e vice-presidente da\nComissão Especial do Vale do Rio Doce, foi membro das comissões de\nJustiça, de Estudos dos Problemas do Nordeste, Mista da Revisão da\nConsolidação das Leis do Trabalho, de Finanças, de Segurança, de\nAgricultura, Pecuária, Caça e Pesca, de Códigos de Telecomunicações e\nEspecial de Emendas Constitucionais. Em 1961 assumiu a liderança do PSP\nna casa, tornando-se, em março do ano seguinte, vice-líder da maioria.\nPermaneceu no Senado até o fim do mandato, em janeiro de 1963.\n\nDurante este último ano e o seguinte, foi chefe das obras da Aeronáutica\nem Brasília. Em meados da década de 1960, transferiu-se para Belo\nHorizonte, passando a lecionar na cadeira de hidráulica e saneamento na\nEscola Federal de Minas de Ouro Preto. Durante a gestão de Israel\nPinheiro da Silva, governador de Minas Gerais de 1966 a 1971, trabalhou\nna Secretaria de Viação e Obras Públicas do estado.\n\nAo longo de sua trajetória, foi ainda engenheiro-chefe das obras do\nmunicípio de Aracaju, diretor-geral das Obras Públicas do estado de\nSergipe e engenheiro da Secretaria de Desenvolvimento do estado de Minas\nGerais. No Rio de Janeiro, cursou a Escola Superior de Guerra (ESG).\n\nTornou-se membro do Instituto Histórico e Geográfico de Sergipe, da\nAssociação Sergipana de Imprensa, do Instituto Brasileiro de Aeronáutica\ne da Associação dos Diplomados da ESG.\n\nFaleceu em Itabirito (MG) no dia 13 de julho de 1985, juntamente com sua\nesposa, Ana Florinda Jacob Maynard, vitimados por um acidente\nautomobilístico ocorrido quando retornavam de uma homenagem que haviam\nlhe prestado na UFOP.\n\n \n\nFONTES: COUTINHO, A. *Brasil*; INF. Vanda e Valter Maynard; SENADO.\n*Dados*; SENADO. *Relação*; SENADO. *Relação dos líderes*.\n\n \n","ref":"FONTES: COUTINHO, A. *Brasil*; INF. Vanda e Valter Maynard; SENADO.\n*Dados*; SENADO. *Relação*; SENADO. *Relação dos líderes*.\n\n \n","dic":"DHBB"}
