{"title":"MAZUREK, Antônio","cargoss":["Deputado federal"],"cargos_esp":[0],"datas_ini":[1979],"datas_fim":[1987],"estados":["PR"],"autor":[0],"content":"**MAZUREK, Antônio**\n\n\\*dep. fed. PR 1979-1987.\n\n \n\n*Antônio Mazurek* nasceu em Londrina (PR) no dia 8 de agosto de 1942,\nfilho de Casemiro Mazurek e de Sofia Mazurek.\n\nContabilista e comerciante, iniciou sua carreira política em novembro de\n1968 como vereador em Toledo (PR) na legenda da Aliança Renovadora\nNacional (Arena), partido de sustentação do regime militar instalado no\npaís em abril de 1964. Empossado em fevereiro de 1969, concluiu seu\nmandato em janeiro de 1973.\n\nEm novembro de 1978 elegeu-se deputado federal, tomando posse em\nfevereiro de 1979. Com o fim do bipartidarismo, em novembro daquele ano,\ne a conseqüente reorganização partidária, ingressou no Partido\nDemocrático Social (PDS), agremiação que sucedeu a Arena. Atuou nos\ntrabalhos legislativos como membro da Comissão de Agricultura e Política\nRural.\n\nReeleito deputado federal em novembro de 1982, foi empossado em\nfevereiro de 1983 e integrou a Comissão do Interior.\n\nEm 25 de abril de 1984 votou a favor da emenda Dante de Oliveira, que\nfoi apresentada na Câmara dos Deputados e propôs o restabelecimento das\neleições diretas para presidente da República a partir de novembro\ndaquele ano. Como a emenda não obteve o número de votos necessários para\nsua aprovação na Câmara — faltaram 22 para que pudesse ser encaminhada à\napreciação pelo Senado Federal — o novo presidente foi eleito de forma\nindireta, pelo Colégio Eleitoral, que se reuniu em 15 de janeiro de\n1985. Antônio Mazurek votou no candidato do regime militar, Paulo Maluf,\nque acabou sendo derrotado pelo oposicionista Tancredo Neves, eleito\nnovo presidente da República com o apoio da Aliança Democrática, uma\nunião do Partido do Movimento Democrático Brasileiro (PMDB) com a\ndissidência do PDS abrigada na Frente Liberal. Contudo, por motivo de\ndoença, Tancredo Neves não chegou a ser empossado na presidência, vindo\na falecer em 21 de abril de 1985. Seu substituto no cargo foi o vice\nJosé Sarney, que já vinha exercendo interinamente o cargo, desde 15 de\nmarço desse ano.\n\nAntônio Mazurek concorreu à reeleição no pleito de novembro de 1986 e,\nembora tenha sido o mais votado do PDS, a legenda não atingiu o\nquociente eleitoral e, por conseguinte, não elegeu nenhum deputado\nfederal. Mazurek deixou a Câmara em janeiro de 1987, ao final da\nlegislatura.\n\nA partir de então, dedicou-se a atividades agropastoris no norte do\nestado. Em 1994, foi um dos coordenadores no Paraná das campanhas\nvitoriosas de Fernando Henrique Cardoso, candidato do Partido da Social\nDemocracia Brasileira (PSDB) à presidência, e de Jaime Lerner, então\nfiliado ao Partido Democrático Trabalhista (PDT), ao governo estadual.\nPosteriormente, Mazurek transferiu-se para Brasília, atuando como\nrepresentante da Federação Nacional das Empresas de Seguros Privados\n(Fenaseg), junto à área governamental e ao Congresso Nacional,\nvice-presidente do Sindicato Rural do Distrito Federal e membro do\nConselho de Desenvolvimento Econômico (CDE) do Distrito Federal.****Foi\ntambém diretor de assuntos governamentais da Fenaseg e presidente da\nCooperativa de Crédito Rural Ltda. (Credibrasília), entidade destinada\nao financiamento de empreendimentos voltados ao agronegócio. Em outubro\nde 2009 filiou-se ao Partido Popular Socialista (PPS) de Cascavel.\n\nCasou-se com Ivanir Lurdes Mazurek, com quem teve duas filhas.\n\n \n\nFONTES: CÂM. DEP. *Deputados brasileiros*(1979-1983 e 1983-1987); INF.\nBIOG.; *Jornal Hoje*(6/10/09).\n\n \n","ref":"FONTES: CÂM. DEP. *Deputados brasileiros*(1979-1983 e 1983-1987); INF.\nBIOG.; *Jornal Hoje*(6/10/09).\n\n \n","dic":"DHBB"}
