{"title":"MAZZA, Otávio Saldanha","cargoss":["ch Dir Mat Bél Ex","comte Zona Mil Sul","Chefe do Departamento Geral de Administração do Exército","Chefe do Estado-Maior do Exército","Chefe do Estado-Maior das Forças Armadas"],"cargos_esp":[0,0,0,0,0],"datas_ini":[1953,1954,1955,1956,1956],"datas_fim":[1954,1955,1956,1956,1958],"estados":[0,0,0,0,0],"autor":[0],"content":"**MAZZA, Otávio Saldanha**\n\n\\*militar; ch. Dir. Mat. Bél. Ex. 1953-1954; comte. Zona Mil. Sul\n1954-1955; ch. Depto. Ger. Admin. Ex. 1955-1956; ch. EME 1956; ch. EMFA\n1956-1958.\n\n \n\n*Otávio Saldanha Mazza* nasceu no Paraná no dia 9 de junho de 1892,\nfilho de Antônio Catão Mazza.\n\nSentou praça em maio de 1907 no 2º Regimento de Artilharia Montada (2º\nRAM), sediado em Curitiba, ingressando ainda nesse ano na Escola de\nGuerra de Porto Alegre. Declarado aspirante-a-oficial em janeiro de\n1910, entrou a seguir para a Escola de Artilharia e Engenharia, na qual\npermaneceria até 1913, quando foi promovido a segundo-tenente. Durante\nesse período, sob o comando do general Fernando Setembrino de Carvalho,\nparticipou da repressão à Revolta do Contestado, movimento popular de\ncunho messiânico ocorrido na região fronteiriça do Paraná com Santa\nCatarina, cuja posse era disputada pelos dois estados. A partir de\noutubro de 1912, o governo enviou sucessivas expedições militares para\ndebelar a rebelião, afinal sufocada em 1916.\n\nContinuou a servir em Curitiba até dezembro de 1917, quando foi\npromovido a primeiro-tenente, ingressando em abril de 1919 na Escola de\nAperfeiçoamento de Oficiais (EsAO), no Rio de Janeiro, então Distrito\nFederal. Promovido a capitão em dezembro de 1920, em março do ano\nseguinte deixou a EsAO para ingressar em abril na Escola de\nEstado-Maior, também no Rio de Janeiro, onde permaneceria até janeiro de\n1924.\n\nAinda neste último mês passou a servir na 5ª Região Militar (5ª RM) e na\n5ª Divisão de Infantaria (5ª DI), ambas sediadas em Curitiba. Participou\nda repressão à Revolta de 5 de Julho de 1924, irrompida em Sergipe, no\nAmazonas e em São Paulo. Dominada com rapidez nos dois primeiros\nestados, em São Paulo os rebeldes, comandados por Isidoro Dias Lopes,\nocuparam a capital por três semanas, abandonando então a cidade e\ndeslocando-se a seguir para o interior. Em abril de 1925, no oeste do\nParaná, esse grupo juntou-se ao contingente revolucionário que, em\noutubro do ano anterior, sublevara unidades militares no Rio Grande do\nSul, constituindo assim a Coluna Miguel Costa-Prestes.\n\nDe setembro de 1924 a julho do ano seguinte atuou junto ao estado-maior\ndo Destacamento Almada, então em operações sob o comando do general\nCândido Rondon, tendo servido de novembro de 1926 a fevereiro de 1927 no\nestado-maior das forças que lutavam contra os rebeldes da Coluna Miguel\nCosta-Prestes nos estados do Paraná e de Santa Catarina. Em 1929 deixou\na 5ª RM e a 5ª DI.\n\nApós a Revolução de 1930, ingressou em janeiro de 1931 no Estado-Maior\ndo Exército (EME), no Rio de Janeiro, sendo promovido a major em\ndezembro desse ano. Permaneceu no EME até janeiro de 1932, quando\nretornou à 5ª RM e à 5ª DI. De março a outubro do mesmo ano serviu no 5º\nGrupo de Artilharia de Montanha, em Curitiba, tendo atuado de outubro a\ndezembro seguintes junto à 2ª RM, sediada em São Paulo, como chefe da 1ª\nseção de seu estado-maior.\n\nChefe do estado-maior da 5ª RM de fevereiro de 1933 a janeiro de 1935 e\nde abril a junho deste último ano, voltou a servir também durante esse\nperíodo na 5ª DI. Promovido a tenente-coronel em setembro de 1935, foi\ndesignado comandante do 5º Grupo de Artilharia de Dorso, também em\nCuritiba, exercendo essa função de outubro seguinte a setembro de 1936.\nDe então até outubro de 1937 comandou a Escola de Educação Física do\nExército, no Rio de Janeiro, exercendo de janeiro a dezembro de 1937 a\nfunção de diretor de ensino dessa instituição.\n\nEm 1939 retornou à 5ª RM e à 5ª DI, chefiando o estado-maior dessa\nregião militar de novembro a dezembro do mesmo ano. Sub-chefe desse\nestado-maior de 10 a 31 de dezembro, voltou a chefiá-lo de janeiro a\njulho de 1940, sendo promovido a coronel em agosto. De outubro seguinte\na abril de 1941 serviu no 4º RAM, em Itu (SP), exercendo a função de\ncomandante da Escola Preparatória de Cadetes de São Paulo de abril a\njulho de 1943. De setembro a dezembro desse ano atuou junto à 2ª RM e à\n2ª DI, também em São Paulo, servindo de dezembro de 1943 a julho do ano\nseguinte no quartel-general de Cruz Alta (RS). Nessa cidade exerceu o\ncomando da Artilharia Divisionária-3 no mesmo período, e o da guarnição\nlocal de janeiro a junho de 1944.\n\nTransferido para o EME em agosto seguinte, aí serviu até maio de 1945,\num mês depois de ter sido promovido a general-de-brigada. De agosto de\n1945 a janeiro de 1946 atuou junto ao quartel-general do Destacamento de\nNatal, cujo comando exerceu de setembro a dezembro de 1945. De janeiro\nde 1946 a dezembro de 1948 serviu na 1ª RM e na 1ª DI, com sede no Rio\nde Janeiro, tendo sido durante esse período comandante da Artilharia\nDivisionária daquela região militar. Promovido a general-de-divisão em\nfevereiro de 1949, de março desse ano a julho de 1951 comandou a 3ª DI,\nem Santa Maria (RS), tendo exercido em diversas ocasiões, entre julho de\n1949 e julho de 1951, o comando da 3ª RM, em Porto Alegre.\n\nEm março de 1952 ingressou como estagiário na Escola Superior de Guerra\n(ESG), da qual saiu em dezembro do mesmo ano, tendo servido ainda na\nDiretoria Geral de Material Bélico de setembro de 1952 a dezembro de\n1954. De fevereiro de 1953 a agosto do ano seguinte, foi chefe da\nDiretoria Geral de Material Bélico, servindo, em seguida, de setembro a\ndezembro de 1954, no Departamento Geral de Administração. Neste último\nmês, quando servia no quartel-general de Ajudância Geral de Porto\nAlegre, assumiu o comando da Zona Militar Sul, atual III Exército, em\nsubstituição ao general Anor Teixeira dos Santos. Permaneceu nesse posto\naté junho de 1955, quando foi promovido a general-de-exército, e passou\no cargo ao general Edgar do Amaral. Desse mês a janeiro do ano seguinte,\nfoi chefe do Departamento Geral de Administração do Exército.\n\nEm janeiro de 1956 assumiu a chefia do EME em substituição ao general\nAnor Teixeira dos Santos, ocupando esse cargo até outubro seguinte,\nquando foi substituído pelo general João Valdetaro de Amorim e Melo.\nExerceu também a chefia do Estado-Maior das Forças Armadas (EMFA), em\nsubstituição ao general Anor Teixeira dos Santos, de outubro de 1956 a\njaneiro de 1958, quando foi substituído pelo general Edgar do Amaral.\nNesse ínterim foi designado, em março de 1957, membro da comissão que\nestudaria as providências para as negociações entre os governos do\nBrasil e da Bolívia relativas ao tratado “sobre a saída e aproveitamento\ndo petróleo boliviano” firmado no Rio de Janeiro por esses dois países\nem 1938.\n\nFaleceu no dia 17 de maio de 1958.\n\nFoi promovido post mortem a marechal por decreto de 11 de junho de 1958.\n\n \n\n \n\nFONTES: ARQ. MIN. EXÉRC.; CORRESP. ESTADO-MAIOR DAS FORÇAS ARMADAS;\nCORRESP. SECRET. GER. EXÉRC.; MIN. GUERRA. Almanaque.\n\n \n","ref":"FONTES: ARQ. MIN. EXÉRC.; CORRESP. ESTADO-MAIOR DAS FORÇAS ARMADAS;\nCORRESP. SECRET. GER. EXÉRC.; MIN. GUERRA. Almanaque.\n\n \n","dic":"DHBB"}
