{"title":"MEDEIROS, Lucílio","cargoss":["Deputado federal"],"cargos_esp":[0],"datas_ini":[1952],"datas_fim":[1955],"estados":["MT"],"autor":[0],"content":"**MEDEIROS, Lucílio**\n\n\\*dep. fed. MT 1952-1955.\n\n*Lucílio Medeiros* nasceu em Corumbá, à época cidade do estado de Mato\nGrosso e hoje pertencente ao Mato Grosso do Sul, no dia 20 de setembro\nde 1909, filho de Antônio Gregório de Medeiros e de Mariana de\nFigueiredo Medeiros.\n\nCursou o Ginásio Anglo-Latino de São Paulo, graduando-se pela Faculdade\nde Farmácia do Rio de Janeiro em 1929. Foi inspetor federal de ensino e\nprefeito de sua cidade natal.\n\nNo pleito de outubro de 1950, obteve a primeira suplência de deputado\nfederal por Mato Grosso pela legenda da União Democrática Nacional\n(UDN), ocupando uma cadeira na Câmara dos Deputados em novembro de 1952,\npor ocasião da morte do deputado Aral Moreira. Em 1954, cursou a Escola\nSuperior de Guerra e, em outubro deste ano, candidatou-se a novo mandato\nde deputado federal, conseguindo novamente uma suplência. Deixou a\nCâmara em janeiro de 1955, ao final da legislatura.\n\nCasou-se com Zélia de Barros Medeiros, com quem teve três filhos.\n\nFONTES: CÂM. DEP. *Deputados*; CISNEIROS, A. *Parlamentares*; COUTINHO,\nA. *Brasil;*TRIB. SUP. ELEIT*.* *Dados* (2 e 3).\n\n \n","ref":"FONTES: CÂM. DEP. *Deputados*; CISNEIROS, A. *Parlamentares*; COUTINHO,\nA. *Brasil;*TRIB. SUP. ELEIT*.* *Dados* (2 e 3).\n\n \n","dic":"DHBB"}
