{"title":"MEIRA JÚNIOR, João Alves","cargoss":["Deputado federal","Deputado federal"],"cargos_esp":[0,0],"datas_ini":[1935,1924],"datas_fim":[1937,1926],"estados":["SP","SP"],"autor":[0],"content":"**MEIRA JÚNIOR, João Alves**\n\n\\*dep. fed. SP 1924-1926 e 1935-1937.\n\n \n\n*João Alves Meira Júnior* nasceu em Barra do Piraí (RJ) em 1875, filho\nde João Alves Meira e Margarida Rubião Alves Meira.\n\nDepois de graduar-se em ciências jurídicas e sociais pela faculdade de\nDireito do Largo de São Francisco (SP) em 1895, transferiu-se para o\nmunicípio paulista de Ribeirão Preto, onde passou a exercer a advocacia.\n\nProfissional renomado na região, foi eleito senador estadual de São\nPaulo pelo Partido Republicano Paulista (PRP), exercendo o mandato\ndurante a gestão de seu amigo pessoal Washington Luís Pereira de Sousa,\npresidente do estado de 1920 a 1924. Ainda neste último ano, João Alves\nMeira Júnior candidatou-se pelo mesmo partido a uma vaga para a Câmara\ndos Deputados. Bem-sucedido no pleito, exerceu o mandato de novembro de\n1924 a dezembro de 1926.\n\nCom o fim da Revolução Constitucionalista em outubro de 1932, Getúlio\nVargas, chefe do Governo Provisório (1930-1934), criou a Câmara do\nReajustamento Econômico que, entre outras funções, teria de analisar a\nsituação dos fazendeiros de café individados, cujas dívidas poderiam ser\nabatidas em 50% perante os bancos. Meira Júnior presidiu tal câmara até\n14 de outubro de 1934, quando foi novamente eleito deputado federal,\ndesta vez pelo Partido Constitucionalista de São Paulo. Exerceu o seu\nsegundo mandato de 3 de maio de 1935 a 10 de novembro de 1937, data de\ninstauração do Estado Novo (1937-1945) que suprimiu as câmaras\nlegislativas de todo o país.\n\nAfastado do cenário político desde então, voltou-se exclusivamente para\nas suas atividades particulares. Além do exercício da advocacia,\ndedicou-se à Cervejaria Paulista, empresa que havia fundado juntamente\ncom outros sócios em 1914.\n\nFaleceu em Ribeirão Preto no dia 17 de julho de 1952.\n\nEra casado com Maria Antonieta Loiola Alves Meira, com quem teve oito\nfilhos.\n\nPublicou, com a colaboração de Fábio Barreto e Camilo Matos, *O crime de\nCravinhos* (1920).\n\n \n\nFONTES: *Boletim Min. Trab.* (5/36); CÂM. DEP. *Deputados*; *Diário do\nCongresso Nacional*; INF. João Antônio Alves Meira; LEITE, A.\n*História*.\n\n \n","ref":"FONTES: *Boletim Min. Trab.* (5/36); CÂM. DEP. *Deputados*; *Diário do\nCongresso Nacional*; INF. João Antônio Alves Meira; LEITE, A.\n*História*.\n\n \n","dic":"DHBB"}
