{"title":"MELÃO NETO, João","cargoss":["Deputado federal","Ministro do Trabalho","Deputado federal","Deputado federal"],"cargos_esp":[0,"Admin",0,0],"datas_ini":[1991,1992,1993,1992],"datas_fim":[1992,1992,1999,1993],"estados":["SP",0,"SP","SP"],"autor":[0],"content":"**MELÃO NETO, João**\n\n\\*jornalista; dep. fed. SP 1991-1992; min. Trab. Admin. 1992; dep. fed.\nSP 1992-1993 e 1993-1999.\n\n*João Melão Neto* nasceu na cidade de São Paulo no dia 6 de novembro de\n1955, filho de João Avelino Pinho Melão e de Catucha Maria Andrade\nMelão.\n\nPertenceu à Juventude Janista e combateu os grupos de esquerda no\nmovimento estudantil. Entre 1977 e 1979, cursou a Escola de\nAdministração de Empresas de São Paulo da Fundação Getúlio Vargas\n(EAESP-FGV), mas não completou o curso. Cursou também jornalismo na\nFaculdade de Comunicação Social Cásper Líbero entre 1983 e 1985.\nTrabalhou como articulista do jornal *O Estado de S. Paulo* e de\ndiversos jornais da capital e do interior paulista e como comentarista\nde economia e política dos programas *Record em notícias*, da TV Record,\ne *Jornal da manhã*, da Rádio Jovem Pan. Empresário do setor de\nagropecuária e de serviços, foi consultor de várias empresas e assessor\nespecial de planejamento da presidência do Banco Mercantil de São Paulo.\n\nEm 1986 foi nomeado secretário da Coordenação Governamental e chefe da\nAssessoria Especial do prefeito de São Paulo, Jânio Quadros (1985-1989).\nNo ano seguinte, filiou-se ao Partido Trabalhista Brasileiro (PTB), no\nqual permaneceu até 1988, quando se transferiu para o Partido Liberal\n(PL). Nesse período, coordenou a reforma administrativa da Prefeitura de\nSão Paulo. Em novembro de 1988 candidatou-se a prefeito, mas não foi\neleito.\n\nEm outubro de 1990 elegeu-se deputado federal na legenda do PL, com mais\nde 260 mil votos, sendo o mais votado da legenda e o segundo em todo o\nestado. Empossado em fevereiro de 1991, tornou-se vice-líder da bancada\ne presidente do PL em São Paulo. Nesse mesmo ano, participou da comissão\nparlamentar destinada a oferecer à Mesa estudos e sugestões objetivando\no aperfeiçoamento dos trabalhos administrativos e legislativos da\nCâmara; foi membro titular da Comissão de Constituição e Justiça e de\nRedação e suplente da Comissão de Finanças e Tributação. Em 1992, passou\na membro titular dessa comissão, além de suplente da Comissão de\nEconomia e Comércio, da comissão especial para o Projeto de Lei nº\n824/91, sobre propriedade industrial, e da comissão especial para o\nprojeto de lei sobre legislação tributária. Ainda em 1992, participou,\ncomo titular, da comissão parlamentar de inquérito (CPI) mista sobre\nciência e tecnologia e da comissão especial mista sobre desequilíbrio\neconômico interregional.\n\nLicenciou-se do mandato de deputado federal para exercer o cargo de\nministro do Trabalho e Administração do governo Fernando Collor de Melo\nde 13 de abril a 4 de outubro de 1992, sendo substituído por Paulo Lima,\ndo Partido da Frente Liberal (PFL). Durante sua passagem pelo\nministério, opôs-se à demissão em massa de funcionários públicos\npromovida pelo governo federal, uma das medidas de impacto anunciadas\npelo presidente Collor. Em agosto, considerou a iniciativa um equívoco,\natribuindo a suposta ineficiência do serviço público no Brasil não ao\nnúmero excessivo de funcionários, mas sim à sua baixa qualificação. No\nseu entender, a superação dessa situação só poderia ser garantida\nmediante o treinamento e a reciclagem do funcionalismo. Coordenou,\nainda, o processo de isonomia salarial entre os três poderes.\nParticipou, como ministro convidado, da Conferência Internacional do\nTrabalho, promovida pela Organização Internacional do Trabalho (OIT).\n\nCom a aprovação pela Câmara dos Deputados, na sessão de 29 de setembro,\nda abertura do processo de *impeachment*contra Fernando Collor, que\nimplicou seu afastamento da presidência, Melão reassumiu seu mandato de\ndeputado federal no início de outubro. Collor renunciou ao mandato em 29\nde dezembro de 1992, pouco antes da conclusão do processo pelo Senado\nFederal, sendo então efetivado na presidência o vice Itamar Franco, que\njá vinha exercendo o cargo interinamente desde o dia 2 de outubro.\n\nEm janeiro de 1993, Melão licenciou-se novamente da Câmara para assumir\no cargo de secretário Municipal de Habitação e Desenvolvimento Urbano de\nSão Paulo na prefeitura de Paulo Maluf (1993-1997), permanecendo até 28\nde julho do mesmo ano. Foi substituído na Câmara novamente por Paulo\nLima. De volta à Câmara, ainda em 1993 foi membro titular da Comissão de\nEconomia, Indústria e Comércio, e suplente da Comissão de Defesa\nNacional e da Comissão de Ciência, Tecnologia, Comunicação e\nInformática. Nas principais matérias constitucionais apresentadas na\nCâmara dos Deputados ao longo da legislatura, votou a favor da criação\ndo Fundo Social de Emergência (FSE) que permitia ao governo retirar\nrecursos de áreas como saúde e educação para ter maior liberdade de\nadministração das verbas, e do fim do voto obrigatório.\n\nReeleito deputado federal em outubro de 1994, com votos provenientes de\nsuas bases eleitorais na capital e na região do grande ABC, iniciou novo\nmandato em fevereiro de 1995. No mesmo mês, mudou de legenda pela\nsegunda vez, filiando-se ao PFL. Tornou-se membro da executiva nacional\ne diretor do Instituto Tancredo Neves de Estudos Econômicos e Sociais,\nórgão de formulação política do partido, posições que ocuparia até 1996.\nAinda em 1995, foi primeiro-vice-presidente da CPI sobre entidades de\nprevidência privada, membro titular das comissões de Trabalho,\nAdministração e Serviço Público, e de Desenvolvimento Urbano e Interior,\ne presidente da comissão especial responsável pela análise da proposta\nde emenda constitucional da reforma administrativa.\n\nNas votações das emendas constitucionais propostas pelo governo Fernando\nHenrique Cardoso em 1995, votou a favor da quebra dos monopólios dos\nestados na distribuição de gás canalizado, das embarcações nacionais na\nnavegação de cabotagem, do Estado nas telecomunicações e da Petrobras na\nexploração do petróleo. Aprovou também a mudança no conceito de empresa\nnacional. Em outubro de 1996, como presidente da Comissão Especial da\nReforma Administrativa, votou a favor do parecer do relator Moreira\nFranco, do Partido do Movimento Democrático Brasileiro (PMDB) do Rio de\nJaneiro, que afinal foi aprovado por 18 votos a 11. Ainda nesse ano\nparticipou da elaboração do novo programa do PFL, sendo o redator do\n*Manual do PFL*, e tornou-se membro da Comissão Coordenadora do Projeto\nPFL-2000.\n\nEm janeiro/fevereiro de 1997, votou a favor da emenda da reeleição para\npresidente da República, governadores e prefeitos. Ainda em fevereiro,\nrecusou o convite para integrar uma delegação de 22 parlamentares que\nviajou para a Europa, com as despesas pagas pela Federação Nacional dos\nCorretores de Seguros e de Capitalização (Fenacor) e pela Federação\nNacional das Empresas de Seguros Privados e de Capitalização (Fenaseg),\ninteressadas em interferir na regulamentação do sistema financeiro\nnacional, a fim de analisar o mercado europeu de seguros. Em novembro\nseguinte, pronunciou-se favoravelmente à quebra da estabilidade do\nservidor público, item da reforma administrativa.\n\nNo pleito de outubro de 1998, candidatou-se à reeleição na legenda do\nPFL, mas não foi eleito. Em novembro seguinte, votou a favor do teto de\n1.200 reais para aposentadorias no setor público e do estabelecimento de\nidade mínima e tempo de contribuição para o setor privado, itens que\ndefiniram a reforma da Previdência. Deixou a Câmara em janeiro de 1999,\nao final da legislatura.\n\nEm 2003, assumiu a Secretaria de Comunicação do governo de São Paulo, na\nadministração de Geraldo Alckmin. Ficou à frente da pasta pouco mais de\num ano. Em 2006, candidatou-se a deputado estadual na legenda do PFL,\nsendo eleito com 79.903 votos. Assumiu o mandato em fevereiro de 2007, e\nem março, quando o PFL mudou seu nome para Democratas (DEM), acompanhou\na nova legenda. Na Assembleia Legislativa do Estado de São Paulo,\ntornou-se suplente da Comissão de Administração Pública e apresentou\nprojeto propondo novas normas para o funcionalismo público.\n\nMantém um blog, em que publica seus textos para o jornal *O Estado de S.\nPaulo*, além de outros artigos sobre a política nacional. Foi também\ncolaborador do jornal *Correio Brasiliense* e articulista do jornal\n*Florida Review*, em Miami, Estados Unidos.\n\nCasou-se com Dora di Lello Melão, com quem teve três filhos.\n\nPublicou *Três histórias para uma história* (1981), *Nu com a mão no\nbolso — Brasil: uma visão liberal* (1989), *O pensamento liberal\nmoderno* (1990),*Uma visão liberal do Brasil* (1994),*Loreley e a\ncondição humana: a democracia no Brasil e no mundo* (1995), *O mundo que\nnós temos, o mundo que nós queremos*(1998), *Aproximar políticos e\ncidadãos*(1998) e *O que enriquece e o que empobrece uma nação* (2004).\n\nCristiano Sanches/Marcelo Costa/Manoel Dourado Bastos (atualização)\n\nFONTES: CÂM. DEP. *Deputados brasileiros. Repertório*(1995-1999);\n*Estado de S. Paulo* (4/9/92); *Folha de S. Paulo* (19/8 e 8/9/92, 31/1,\n23/2/95, 14/1 e 16/6/96, 30/1, 8 e 9/2/97, 29/9/98); *Globo* (19/8/92,\n8/2/97); *Jornal do Brasil* (17/10/96); *Perfil\nparlamentar/IstoÉ*;**TRIB. SUP. ELEIT.*Dados*(1998), Arquivo Alesp\n(2006), *Folha Online* (30/12/2002), Arquivo TSE (2006).\n\n \n\n \n","ref":"FONTES: CÂM. DEP. *Deputados brasileiros. Repertório*(1995-1999);\n*Estado de S. Paulo* (4/9/92); *Folha de S. Paulo* (19/8 e 8/9/92, 31/1,\n23/2/95, 14/1 e 16/6/96, 30/1, 8 e 9/2/97, 29/9/98); *Globo* (19/8/92,\n8/2/97); *Jornal do Brasil* (17/10/96); *Perfil\nparlamentar/IstoÉ*;**TRIB. SUP. ELEIT.*Dados*(1998), Arquivo Alesp\n(2006), *Folha Online* (30/12/2002), Arquivo TSE (2006).\n\n \n\n \n","dic":"DHBB"}
