{"title":"MELLES, Carlos","cargoss":["Deputado federal","Ministro do Esporte e Turismo"],"cargos_esp":[0,"2000-2002, dep fed"],"datas_ini":[1995,2002],"datas_fim":[2000,0],"estados":["MG","MG"],"autor":[0],"content":"**MELLES, Carlos**\n\n\\*dep. fed. MG 1995-2000; min. Esporte 2000-2002, dep. fed. MG 2002-\n\n*Carlos Carmo Andrade Melles* nasceu em São Sebastião do Paraíso (MG) no\ndia 11 de março de 1947, filho de Antônio Carmo Melles e de Alice\nAndrade Melles.\n\nEm 1972 bacharelou-se em engenharia agrônoma pela Universidade Federal\nde Viçosa (MG). Foi produtor rural em São Sebastião do Paraíso (MG),\ncoordenador do projeto café da Empresa de Pesquisa Agropecuária de Minas\nGerais, chefe do departamento técnico da Cooperativa Regional dos\nCafeicultores de São Sebastião do Paraíso e presidente da Cooperativa de\nCrédito Rural da cidade.\n\nPós-graduado em fitotécnica na Universidade Estadual Paulista Júlio\nMesquita Filho (Unesp), foi vice-presidente da Federação de Agricultura\nde Minas Gerais (1989-1990), diretor da Comissão Nacional de Café\n(1989-1993), presidente do departamento das cooperativas exportadoras de\ncafé da Associação Comercial de Santos (1990-1991), conselheiro do\nCentro de Comércio de Café de Varginha (1990-1992) e diretor-conselheiro\nda Federação Brasileira dos Exportadores de Café em 1991. Em 1990 foi\ncoordenador de produção da Comissão Estadual de Planejamento Agrícola\npara o setor cafeeiro.\n\nEm 1992 filiou-se ao Partido da Frente Liberal (PFL) e, no ano seguinte,\nfoi presidente do diretório municipal do partido em sua cidade natal. Em\noutubro de 1994, concorreu a uma vaga de deputado federal na legenda do\nPFL. Eleito com a maioria dos votos provenientes de sua base eleitoral\nna região sul de Minas, assumiu o mandato em fevereiro seguinte,\nparticipando dos trabalhos legislativos como membro titular da Comissão\nde Agricultura e Política Rural e da Comissão Especial de Débitos nas\nOperações de Crédito Rural, cuja primeira vice-presidência ocupou; e\nsuplente da Comissão de Economia, Indústria e Comércio e da Comissão\nEspecial de Concessão e Distribuição do Gás Canalizado. Coube-lhe,\nainda, o cargo de relator da Subcomissão Permanente de Política do Café,\nLeite, Cana-de-Açúcar e Cacau, da Comissão de Agricultura e Política\nRural.\n\nNo ano legislativo de 1995, votou a favor da liberação do transporte de\ncarga e passageiros entre portos do país às embarcações estrangeiras; da\nemenda que alterou o conceito de empresa nacional, equiparando-as\njuridicamente às empresas estrangeiras; do fim dos monopólios dos\nestados na distribuição de gás canalizado, da Petrobras na exploração do\npetróleo e do estatal nas telecomunicações; e da prorrogação do Fundo\nSocial de Emergência (FSE), cujo nome foi modificado para Fundo de\nEstabilização Fiscal (FEF), que permitiu ao governo retirar recursos de\náreas como educação e saúde para serem aplicados em outros setores.\n\nEm julho de 1996, pronunciou-se a favor da criação da Contribuição\nProvisória sobre Movimentação Financeira (CPMF), imposto que garantiu ao\nMinistério da Saúde uma fonte suplementar de recursos.\n\nNo ano legislativo de 1997, declarou-se favorável à emenda\nconstitucional que permitiu a reeleição do presidente da República, dos\ngovernadores e dos prefeitos, e à emenda que extinguiu a estabilidade\ndos funcionários públicos.\n\nReelegeu-se deputado federal no pleito de outubro de 1998, na legenda do\nPFL mineiro. Em novembro, ajudou a aprovar a reforma da previdência, que\nfixou um teto salarial para a aposentadoria dos servidores públicos e\nestabeleceu idade e tempo de contribuição mínimos para os trabalhadores\ndo setor privado. Iniciou novo mandato na Câmara dos Deputados em\nfevereiro de 1999 e foi indicado relator do Orçamento da União para\n2000. Convidado pelo então presidente Fernando Henrique Cardoso, do\nPartido da Social Democracia Brasileira (PSDB) para assumir o Ministério\ndo Esporte e Turismo, no dia 9 de maio de 2000 licenciou-se do mandato e\nfoi empossado nesse cargo. Como ministro criou a Comissão Nacional de\nAtletas, a Secretaria Nacional de Esportes e a Câmara Setorial de\nEsporte. Transferiu ainda à Caixa Econômica Federal a responsabilidade\npelos bingos e pelo gerenciamento dos recursos para infra-estrutura\nesportiva. Aprovou a Política Nacional de Esporte e regulamentou a Lei\nPelé.\n\nEm março de 2002, deixou o Ministério em função de um racha entre o PFL\ne PSDB. Voltou à Câmara e em outubro, reelegeu-se deputado federal por\nMinas Gerais na legenda do PFL. Assumiu o novo mandato em fevereiro de\n2003 e tornou-se vice-líder do partido. Em 2003 foi r**elator da\nComissão Parlamentar de Inquérito (CPI) dos Combustíveis e, no ano\nseguinte, presidiu a******Comissão de Relações Exteriores e de Defesa\nNacional. Nas votações das reformas da Previdência e tributária\nencaminhadas pelo presidente Luís Inácio Lula da Silva, do Partido dos\nTrabalhadores (PT) de oposição ao PFL, ausentou-se do plenário.\n\nNas eleições de 2006 foi reeleito deputado federal. Ainda em 2006,\npresidiu a **Comissão Especial da Microempresa da Câmara**. Assumiu o\nnovo mandato em fevereiro de 2007 e em novembro tornou-se presidente do\ndiretório mineiro do Democratas (DEM), criado a partir da refundação do\nPFL. Tornou-se ainda membro **da Frente Parlamentar da Micro e Pequena\nempresa**.\n\nCasou-se com Marilda Petrus Melles, prefeita eleita de São Sebastião do\nParaíso em 2008, com quem teve três filhos.\n\nPublicou as obras *Efeito de culturas intercalares na formação do\ncafeeiro* (1979), *Influência do gesso e do calcário como corretivos e\nfornecedores de cálcio e enxofre para o cafeeiro* (1983), *Estudo da\nação de glifosfate em cafeeiros* (1983), *Manejo de cafeeiros atingidos\npor geada severa através da poda* (1985) e *Culturas intercalares em\nlavouras cafeeiras nas fases de formação e produção* (1985).\n\nFONTES: CÂM. DEP. *Deputados brasileiros. Repertório* (1995-1999,\n1999-2003, 2003-2007, 2007-2011); *Folha de S. Paulo* (31/1/95, 14/1/96,\n30/1/97, 5/2 e 5/11/98, 2/2, 5, 8 e 20/3/02)\n\n \n","ref":"FONTES: CÂM. DEP. *Deputados brasileiros. Repertório* (1995-1999,\n1999-2003, 2003-2007, 2007-2011); *Folha de S. Paulo* (31/1/95, 14/1/96,\n30/1/97, 5/2 e 5/11/98, 2/2, 5, 8 e 20/3/02)\n\n \n","dic":"DHBB"}
