{"title":"MELO FILHO, Vieira de","cargoss":["Deputado federal"],"cargos_esp":[0],"datas_ini":[1974],"datas_fim":[1975],"estados":["BA"],"autor":[0],"content":"**MELO FILHO, Vieira de**\n\n\\*  dep. fed.  BA 1974-1975.\n\n* *\n\n*Tarcilo Vieira de Melo Filho*nasceu em Salvador no dia 8 de agosto de\n1945, filho de Tarcilo Vieira de Melo e de Dina Faria Vieira de Melo. \nSeu pai participou da Constituinte de 1946 e foi deputado federal em\nquatro le­gislaturas, de 1946 a 1959 e de 1963 a 1967.\n\nDiplomou-se em direito pela Pontifícia Universidade Católica do Rio de\nJaneiro no ano de 1970, rea­lizando ainda o curso de mercado de capitais\nnessa mesma universidade.\n\nNo pleito de novembro de 1970, elegeu-se segundo suplente de deputado\nfederal pela Bahia na legenda do Movimento Democrático Brasileiro (MDB),\npartido de oposição ao regime militar instalado no país em abril de\n1964, ocupando uma cadeira na Câmara dos Deputados em novembro de 1974\nna vaga aberta por Francisco Pinto, que fora condenado pelo Supremo\nTribunal Fe­deral (STF) e tivera o seu mandato cassado.  Mais uma vez\neleito segundo suplente em no­vembro de 1974, deixou a Câmara em janeiro\nde 1975, abandonando a carreira política.\n\n                Diretor-financeiro e superintendente da Fertilizantes\nNitrogenados do Nordeste (Nitrofértil), subsidiária da Petrobrás, em\n1985 assumiu a presidência da empresa. Permaneceu à frente da\nNitrofértil até 1990, quando foi nomeado vice-presidente da Petrobrás\nFertilizantes S. A. (Petrofértil), com sede do Rio de Janeiro, também\nsubsidiária da Petrobrás. Paralelamente ao exercício desse cargo,\ntornou-se diretor-superintentende da Fosfértil, da Nitrofértil, da\nUltrafértil, da Indústria Carboquímica Catarinense (ICC) e da\nGoiásfértil. Em 1991, afastou-se de todas essas atribuições, passando\ndesde então a atuar na área do direito tributário.\n\n                Casou-se com Andréa Buffara Vieira.\n\n \n\nFONTES:  CÂM.  DEP.  *Deputados*; CÂM. DEP*.  Deputados brasileiros. \nRepertório*(1971-1975); INF. BIOG.; *Jornal do Brasil*(26/11/74); NÉRI,\nS. *16.*\n\n \n","ref":"FONTES:  CÂM.  DEP.  *Deputados*; CÂM. DEP*.  Deputados brasileiros. \nRepertório*(1971-1975); INF. BIOG.; *Jornal do Brasil*(26/11/74); NÉRI,\nS. *16.*\n\n \n","dic":"DHBB"}
