{"title":"MELO NETO, Cardoso de","cargoss":["Prefeito","Revolucionário ou revoltoso","Constituinte","Deputado federal","Governador de estado ou do Distrito Federal","Interventor","Deputado federal","Deputado federal","Deputado federal","Superintendente da Sumoc"],"cargos_esp":["São Paulo",0,0,0,0,0,0,0,0,0],"datas_ini":[1930,1932,1934,1935,1937,1937,1951,1948,1946,1957],"datas_fim":[1930,1932,1934,1937,1937,1938,1951,1950,1947,1958],"estados":[0,0,0,"SP","SP","SP","SP","SP","SP",0],"autor":[0],"content":"**MELO NETO, Cardoso de**\n\n\\*pref. São Paulo 1930; rev. 1932; const. 1934; dep. fed. SP 1935-1937;\ngov. SP 1937; interv. SP 1937-1938; dep. fed. SP 1946-1947, 1948-1950 e\n1951; superint. Sumoc 1957-1958.\n\n \n\n*José Joaquim Cardoso de Melo Neto* nasceu na cidade de São Paulo no dia\n19 de julho de 1883, filho do advogado José Joaquim Cardoso de Melo\nJúnior e de Adalgisa Pinto Cardoso de Melo.\n\nConhecido nos círculos íntimos por Cazuza, Cardoso de Melo Neto estudou\nna Escola Modelo Caetano de Faria e na escola complementar anexa à\nEscola Normal, na capital paulista. Formou-se professor primário, tendo\ncomeçado a exercer essa função aos 16 anos no grupo escolar do bairro\npaulistano da Bela Vista. Em 1901, ingressou na Faculdade de Direito de\nSão Paulo, pela qual bacharelou-se em 1905. Durante sua passagem pela\nFaculdade, ocupou a presidência do Círculo Jurídico Acadêmico.\n\nAdvogado da Companhia Telefônica Brasileira, em 1910 assumiu a\npresidência da Sociedade Anônima Elétrica Rio Claro, uma das maiores\nempresas fornecedoras de energia elétrica do estado de São Paulo.\nPermaneceria nesse cargo até 1934. Aprovado no concurso para professor\nsubstituto das cadeiras de economia política, ciência das finanças,\ndireito administrativo e ciência de administração na faculdade pela qual\nse formara, tomou posse em 1917 e em 1920 tornou-se professor\ncatedrático.\n\nFoi um dos fundadores da Liga Nacionalista, organização criada em 1917\npor inspiração do poeta Olavo Bilac e de Rui Barbosa. A liga preconizava\na adoção do voto secreto e do serviço militar obrigatório, e por ela\npassaram na juventude diversos homens que mais tarde se destacariam na\nvida política de São Paulo.\n\nEm 1926, foi um dos fundadores do Partido Democrático (PD) de São Paulo,\ntomando-se membro de seu primeiro diretório central. Liderado pelo\nconselheiro Antônio Prado, o PD defendia um programa liberal, com base\nno voto secreto, e reunia muitos políticos paulistas que haviam\npertencido à Liga Nacionalista. Num momento em que crescia a oposição ao\nregime, manifestada nas rebeliões tenentistas, na emergência do\nmovimento operário e na insatisfação política crescente nos grandes\ncentros urbanos, o PD aglutinou a oposição liberal ao Partido\nRepublicano Paulista (PRP), hegemônico desde o início da República na\nvida política do estado e com uma poderosa influência no âmbito\nnacional.\n\nO PD empenhou-se vigorosamente na campanha das eleições estaduais de\nfevereiro de 1928, conseguindo eleger vários deputados. Cardoso de Melo\nNeto integrou a chapa do PD, tendo sido eleito pelo 5º Distrito de São\nPaulo. Entretanto, como vários outros candidatos de seu partido, não\nteve sua eleição reconhecida. Os líderes do PD, que num primeiro momento\ncelebraram os bons resultados obtidos nas urnas, passaram a denunciar\nenfaticamente a prática de fraude e abuso de poder pelo PRP, encastelado\nno governo estadual. Com a frustração eleitoral, por outro lado, uma\nfacção considerável do PD inclinou-se em favor da aproximação com as\nlideranças tenentistas, que depois das tentativas de 1922, 1924 e da\nColuna Prestes vinham preparando um novo movimento armado para derrubar\no regime.\n\nCom o início, em 1929, da campanha para a sucessão presidencial do ano\nseguinte, o PD integrou-se à Aliança Liberal, coligação de forças\npolíticas de oposição ao governo de Washington Luís que apresentou as\ncandidaturas de Getúlio Vargas e de João Pessoa à presidência e à\nvice-presidência da República. Escolhido para representar o PD, Cardoso\nde Melo Neto participou da convenção da Aliança Liberal que, reunida no\nRio de Janeiro — então Distrito Federal — em setembro, homologou as\ncandidaturas oposicionistas. Em seguida, participou da campanha liberal\naté a realização das eleições (1/3/1930), das quais saiu vitorioso o\ncandidato situacionista Júlio Prestes.\n\nDerrotada a Aliança Liberal, estreitaram-se os laços entre seus vários\nsetores, inclusive o PD, e os “tenentes”. O processo de preparação de um\nmovimento armado acelerou-se com o assassínio de João Pessoa (26/7/1930)\ne, no dia 3 de outubro, eclodiu a revolução. Em 24 de outubro, o\npresidente Washington Luís era deposto no Rio de Janeiro, assumindo o\ngoverno uma junta composta de três oficiais-generais das forças armadas.\n\n \n\nA disputa pelo poder em São Paulo\n\nPor determinação da junta, no próprio dia 24 o governo de São Paulo foi\nentregue ao general Hastínfilo de Moura, comandante da 2ª Região\nMilitar. Tendo governado provisoriamente o estado por apenas quatro dias\n(até 28/10/1930), o general Hastínfilo formou entretanto um secretariado\ndo qual participavam membros do PD, o qual ficou conhecido como o\n“governo dos 40 dias”. Nesse período, em que se sucederam no governo\nestadual o general Hastínfilo de Moura, José Maria Whitaker, Plínio\nBarreto e, finalmente, o capitão João Alberto Lins de Barros, Cardoso de\nMelo Neto exerceu o cargo de prefeito da capital paulista.\n\nLogo no início do “governo dos 40 dias”, ao cabo da curtíssima\npermanência do general Hastínfilo no palácio dos Campos Elísios, começou\na desenvolver-se em São Paulo a disputa pelo poder estadual, opondo os\ndemocráticos, que se julgavam credenciados para ocupar o governo em\nvirtude do apoio que haviam prestado à revolução, e os “tenentes”, que\napoiados pelo chefe da revolução Getúlio Vargas — interessado em manter\nsob controle as forças políticas paulistas —, propunham-se a aprofundar\nas medidas revolucionárias, manifestando profunda desconfiança em\nrelação aos “políticos profissionais”.\n\nNo dia 30 de outubro, João Alberto, um dos líderes dos “tenentee”, foi\nnomeado delegado militar do Governo Provisório em São Paulo, ficando\nresponsável por todos os assuntos relacionados à área militar e à\npolícia. Embora o PD tenha lançado no mesmo dia nota assinada por sua\ndireção comprometendo-se a colaborar com o governo constituído, logo as\nrelações entre as forças políticas paulistas e o líder tenentista\nforam-se deteriorando, agravando-se depois que este assumiu a\ninterventoria federal no estado (25/11/1930). O PD censurava João\nAlberto por entregar prefeituras municipais a militares de sua confiança\ne preterir “paulistas ilustres” em favor de elementos de fora.\nQueixava-se também de perseguições promovidas pela Legião\nRevolucionária, organização tenentista chefiada por Miguel Costa, então\nno comando da Força Pública do estado.\n\nNo dia 5 de dezembro, o secretariado integrado por elementos do PD\ndemitiu-se, bem como Cardoso de Melo Neto, que deixou a Prefeitura\nMunicipal de São Paulo. Com o acirramento da crise, no dia 6 de abril de\n1931 o órgão do PD, o Diário Nacional, publicou um manifesto em que a\ndireção do partido afirmava seu rompimento com o interventor João\nAlberto e conclamava os paulistas à luta pela convocação de uma\nassembléia constituinte e pelo fim da “ocupação militar” de São Paulo.\nCardoso de Melo Neto encontrava-se entre os signatários do documento.\n\nÀ publicação do manifesto seguiu-se uma luta política intensa que acabou\nresultando na demissão do interventor em 24 de julho de 1931. Isso não\nsignificou, entretanto, que o governo federal tivesse abdicado do\ncontrole direto sobre a política paulista, ou que se houvessem criado as\ncondições para a atenuação do conflito entre as grandes forças políticas\npaulistas e o tenentisrno. As proporções desse confronto continuaram a\ncrescer, e em 13 de janeiro de 1932 o PD lançou manifesto — no qual\nconstava novamente a assinatura de Cardoso de Melo Neto — rompendo dessa\nvez com o governo federal, a quem responsabilizava pela situação do\nestado. Na proclamação, tornava a exortar os paulistas a lutar pela\nconstitucionalização do país e pela liberdade de São Paulo escolher seus\ngovernantes.\n\nA partir de então, o PD iniciou sua atividade francamente oposicionista.\nNum primeiro momento, aproximou-se do PRP, seu grande adversário até a\nRevolução de 1930. Cardoso de Melo Neto foi um dos principais\narticuladores da união entre PD e PRP, que se concretizou no dia 16 de\nfevereiro de 1932 com a formação da Frente Única Paulista (FUP). A\naliança foi consagrada por um manifesto lançado naquela data — contando\nmais uma vez com a assinatura de Cardoso de Melo Neto —, e comemorada\ncom manifestações nas ruas de São Paulo, em regozijo pela “união\nsagrada” dos dois partidos paulistas.\n\nEm junho, o PD formou uma comisão integrada por Cardoso de Melo Neto,\nHenrique Bayma, José Adriano Marrey Júnior e Vicente Rao — para elaborar\no anteprojeto do programa do partido. O programa preparado era\nfundamentalmente federalista, prevendo a divisão da União em estados —\nque receberiam maior autonomia —, províncias e territórios. O Senado\npassaria a denominar-se Conselho Federal. Haveria eleições diretas para\nas prefeituras e câmaras municipais, e deputados estaduais e federais,\nenquanto a escolha de senadores, governadores dos estados e presidentes\nda República se faria por eleições indiretas. O anteprojeto defendia a\nnacionalização de minas e fontes de energia, a discriminação de rendas\nentre União e estados nos termos da Constituição de 1891 e a supressão\ngradual dos impostos de exportação, além de prever uma proteção de\nemergência à lavoura do café. O programa se completava com a defesa da\nliberdade sindical, da regulamentação do trabalho do menor, da concessão\nde férias anuais remuneradas e da limitação do horário de trabalho.\n\n \n\nA Revolução Constitucionalista\n\nNo dia 9 de julho de 1932, o conflito entre as forças políticas\npaulistas e o Governo Provisório da República se transformou em guerra\ncivil. Durante o desenrolar da luta, Cardoso de Melo Neto, que pertencia\nentão à direção do PD, teve atuação política destacada, mantendo-se em\ncontato permanente com Pedro de Toledo, chefe do governo paulista. Foi\nessa proximidade que o levou, por exemplo, a debater com Pedro de Toledo\ne outros, no palácio do governo, propostas para um acordo de paz\nsugeridas por Maurício Cardoso, enviado pelo governo federal a São\nPaulo. Na ocasião, João Neves da Fontoura chegou a enunciar uma proposta\na ser levada a Vargas, prevendo a constituição em São Paulo de um\ngoverno coletivo, formado de juízes. A sugestão de João Neves foi\nveementemente repudiada por Cardoso de Melo Neto e Joaquim Sampaio\nVidal.\n\nApós o armistício que selou a sorte dos paulistas no dia 2 de outubro,\nCardoso de Melo Neto foi um dos políticos que se reuniram com Pedro de\nToledo para discutir a possibilidade de prosseguimento na luta. O\nencontro terminou com a constatação de que nada restava a fazer, e Pedro\nde Toledo recomendou a Valdemar Ferreira, seu secretário de Justiça, que\nredigisse um manifesto explicando as razões do revés constitucionalista.\n\n \n\nNa Constituinte de 1934\n\nEmbora derrotado pelas armas, o movimento paulista conseguiu conquistar\num de seus objetivos: a constitucionalização do país. O governo federal\nfixou a data de 3 de maio de 1933 para a realização de eleições para a\nAssembléia Nacional Constituinte.\n\nCardoso de Melo Neto, que além de prosseguir lecionando — ministrou um\ncurso de doutorado na Faculdade de Direito em 1933 —, assumira a\npresidência do PD, representou o partido nas articulações para a\nformação da Chapa única por São Paulo Unido. A legenda da Chapa Única,\nque reunia o PD, o PRP, a Liga Eleitoral Católica e a Federação dos\nVoluntários (organização de ex-combatentes de 1932), defendia princípios\nliberais e federalistas, opondo-se à centralização política e econômica\npromovida pelo governo federal e apoiada pelo interventor em São Paulo,\ngeneral Valdomiro Lima. O interventor, por sua vez, patrocinou a\nformação de dois partidos: o Partido Socialista e o Partido da Lavoura.\n\nCardoso de Melo Neto foi um dos candidatos da Chapa única, que obteve\nexpressiva vitória, conseguindo eleger 17 deputados contra três do\nPartido Socialista e apenas dois do Partido da Lavoura. Ficando na\nprimeira suplência, assumiu uma cadeira na Constituinte em virtude da\nrenúncia de José Manuel de Azevedo Marques, que foi proclamado deputado,\nmas não chegou a tomar posse do cargo.\n\nNa Assembléia Constituinte, Cardoso de Melo Neto foi vice-líder da\nbancada paulista, que pautou sua atuação pela defesa do liberalismo e do\nfederalismo, lutando pelo fortalecimento do Legislativo em relação ao\nExecutivo e pela autonomia política dos estados. Além da obrigatoriedade\ndo comparecimento dos ministros à Assembléia, propôs que fossem\nconcedidos ao Legislativo poderes para apurar erros dos membros do\nministério e até mesmo para destituí-los. Contrária à supressão do\nSenado, a bancada paulista influiu decisivamente na manutenção do órgão\ne na rejeição do conselho federal previsto no anteprojeto governamental.\n\nNa Constituinte, Cardoso de Melo Neto foi um grande defensor do\nfederalismo tributário, procurando limitar o alcance fiscal da União de\nmodo a assegurar aos estados e municípios o máximo de autonomia\nfinanceira, afirmando claramente que havia uma relação entre esta e a\ndescentralização política. Apesar de, no conjunto, a Constituição de\n1934 ter representado um avanço na centralização econômica e na\nampliação das responsabilidades estatais a cargo da União, os paulistas\nlograram que os impostos de exportação e sobre vendas e consignações\npermanecessem de competência dos estados. Cardoso de Melo Neto também\nteve influência na adoção pela bancada paulista da posição de silenciar\nante o decreto federal que previa a redução da dívida dos agricultores\naos bancos existente em 1º de dezembro de 1933. Os constituintes\npaulistas defenderam ainda a concessão de ampla anistia política,\nfinalmente sancionada por Getúlio Vargas em 29 de maio de 1934.\n\nEm fevereiro de 1934, foi fundado em São Paulo o Partido\nConstitucionalista, resultante da fusão do PD com a Ação Nacional\nRepublicana (dissidência do PRP) e a Federação de Voluntários. Cardoso\nde Melo Neto filiou-se ao novo partido, liderado por Armando de Sales\nOliveira, e candidatou-se a deputado federal no pleito de outubro de\n1934 em sua legenda. Eleito, emendou seu mandato de constituinte com o\nde deputado federal, iniciado em maio de 1935. Integrou então a Comissão\nMista de Reforma Econômico-Financeira, e acumulou suas funções\nparlamentares com a presidência do Banco Mercantil de São Paulo e da\nEmpresa de Luz e Força de Jundiaí.\n\n \n\nNo governo de São Paulo\n\nQuando Armando de Sales Oliveira se exonerou do cargo de governador para\nconcorrer às eleições presidenciais programadas para 1938, Cardoso de\nMelo Neto foi eleito pela Assembléia Legislativa estadual para\nsubstituí-lo, no dia 30 de dezembro de 1936. Para tanto, teve de\nenfrentar a oposição do PRP, que tentou inclusive impugnar sua\ncandidatura por meio de recurso ao Tribunal Superior Eleitoral.\n\nEmpossado no governo de São Paulo no dia 5 de janeiro de 1937, manteve o\nmesmo secretariado do governo anterior. Iniciou sua gestão numa\nconjuntura nacional grandemente marcada pela fracassada revolta\ncomunista de 1935, em que o governo federal se fortalecia, munindo-se de\npoderes discricionários com o aumento da legislação repressiva e a\nmanutenção do estado de guerra, seguidas vezes prorrogado pela Câmara a\npedido do Executivo.\n\nNo dia 10 de março de 1937, o governador pediu pessoalmente à bancada\npaulista que votasse a favor de nova prorrogação do estado de guerra, o\nque se concretizou. Por essa época, estabeleceu-se uma divergência entre\nArmando de Sales Oliveira e Cardoso de Melo Neto em torno do apoio do\ngoverno paulista a Vargas, envolvido então nas articulações que levariam\nà instauração do Estado Novo.\n\nO golpe de Estado foi desferido no dia 10 de novembro, frustrando as\ncandidaturas presidenciais de Armando Sales e de seus principais\ncompetidores. Cardoso de Melo Neto, que já tinha assegurado seu apoio ao\nemissário de Vargas, Francisco Negrão de Lima, solidarizou-se com o\ngoverno federal imediatamente após o golpe, declarando confiar “na\nafirmação de que o país entra num regime novo, no qual são devidamente\nassegurados os interesses da nação” e oferecendo sua colaboração. No dia\nseguinte, 11 de novembro, foi confirmado no governo do estado, na\nqualidade de interventor federal.\n\nEntretanto, continuava a enfrentar em São Paulo a oposição do PRP, que\ntentava de todas as maneiras retirá-lo do poder. Sem o apoio do Partido\nConstitucionalista, que tivera muitos de seus líderes — inclusive\nArmando Sales — presos e exilados, Cardoso de Melo Neto ficou muito mais\nvulnerável às pressões perrepistas. Na esperança de uma conciliação e\npor instigação do próprio Vargas, convidou o PRP a colaborar com o\ngoverno, oferecendo ao partido algumas vagas em seu secretariado. O PRP,\nporém, recusou taxativamente a oferta.\n\nDurante sua interventoria, promoveu duas modificações no secretariado. A\nprimeira ocorreu no mesmo dia de sua nomeação e a segunda no dia 20 de\ndezembro. Em março de 1938, criou o Departamento Central de Estatística\ndo Estado de São Paulo.\n\nPouco depois, Getúlio Vargas decidiu atender à antiga reivindicação do\nPRP, exonerando Cardoso de Melo Neto e nomeando para a interventoria o\nex-deputado estadual perrepista Ademar de Barros. No dia 25 de abril de\n1938, Cardoso de Melo Neto transmitiu o cargo ao general Francisco José\nda Silva Júnior, que no dia 27 o passou a Ademar de Barros.\n\nApós sua saída do governo de São Paulo, Cardoso de Melo Neto dedicou-se\nexclusivamente a seus negócios particulares. Associado a Gastão Vidigal,\nfundou o Banco Mercantil de São Paulo em novembro de 1938, e de 1940 a\n1942 exerceu o cargo de diretor da Faculdade de Direito de São Paulo.\n\n \n\nDe volta à política\n\nCom o fim do Estado Novo e a reorganização política e partidária do\npaís, Cardoso de Melo Neto filiou-se ao Partido Social Democrático\n(PSD), que se formara em São Paulo sob a liderança do interventor\nFernando Costa. Candidato na legenda do PSD às eleições para a\nAssembléia Nacional Constituinte (2/12/1945), obteve a quarta suplência,\ne só assumiu o mandato em 19 de novembro de 1946, cerca de dois meses\ndepois da promulgação da nova Carta Constitucional. Permaneceu na Câmara\naté abril de 1947, retornando depois de 16 de setembro de 1948 a 5 de\njulho de 1950 e de 19 a 31 de janeiro de 1951.\n\nPresidente do Banco Mercantil de São Paulo e da Fiação e Tecelagem de\nPiraçununga, aposentou-se do magistério na Faculdade de Direito de São\nPaulo em 1953, aos 70 anos.\n\nEntretanto, ocupou ainda um importante cargo, tendo sido nomeado em\nnovembro de 1957 para dirigir a Superintendência da Moeda e do Crédito\n(Sumoc) pelo presidente da República Juscelino Kubitschek. Extinta em\n1964, quando foi substituída pelo Banco Central, a Sumoc era o órgão\nresponsável pela coordenação da política monetária, creditícia e\ncambial, além do comércio exterior do país. Cardoso de Melo Neto ocupou\no cargo até julho de 1958, após o que retirou-se em definitivo da vida\npública.\n\nAlém de permanecer à frente do Banco Mercantil, integrava o conselho de\nadministração do Banco Comercial do Estado de São Paulo, da Companhia\nAgrícola Rodrigues Alves S.A. e da Fiação e Tecelagem de Piraçununga.\n\nMorreu em São Paulo no ano de 1965.\n\nFoi casado com Celina Rodrigues Alves Cardoso de Melo (filha do\nex-presidente Francisco de Paula Rodrigues Alves), com quem teve duas\nfilhas.\n\nPublicou Distribuição e responsabilidade entre um novo município e o\nantigo prejudicado pelo desmembramento daquele (1922), O fascismo e a\neconomia política (1933), Ação da bancada paulista (1935) e Ação social\ndo Estado, além de discursos e artigos.\n\nJorge Miguel Mayer\n\n \n\n \n\nFONTES: ARAÚJO, A. Chefes; ARQ. GETÚLIO VARGAS; ASSEMB. NAC. CONST.\n1934. Anais (1); Boletim Min. Trab. (5/36); CÂM. DEP. Deputados; Câm.\nDep. seus componentes; CARONE, E. Estado; Encic. Mirador; FIGUEIREDO, E.\nContribuição; FRANCO, A. Escalada; GODINHO, V. Constituintes; GOMES, A.\nRevolução; Grande encic. Delta; Grande encic. portuguesa; HIRSCHOWICZ,\nE. Contemporâneos; JARDIM, R. Aventura; LEITE, A. História; LEITE, A.\nMemórias; LEVINE, R. Vargas; MORAIS, A. Minas; NOGUEIRA FILHO, P.\nIdeais; PEIXOTO, A. Getúlio; SILVA, H. 1932; SILVA, H. 1933; SILVA, H.\n1934; SILVA, H. 1935; SILVA, H. 1937; SILVA, H. 1938; SOC. BRAS.\nEXPANSÃO COMERCIAL. Quem; VAMPRÉ, S. Memórias.\n\n \n","ref":"FONTES: ARAÚJO, A. Chefes; ARQ. GETÚLIO VARGAS; ASSEMB. NAC. CONST.\n1934. Anais (1); Boletim Min. Trab. (5/36); CÂM. DEP. Deputados; Câm.\nDep. seus componentes; CARONE, E. Estado; Encic. Mirador; FIGUEIREDO, E.\nContribuição; FRANCO, A. Escalada; GODINHO, V. Constituintes; GOMES, A.\nRevolução; Grande encic. Delta; Grande encic. portuguesa; HIRSCHOWICZ,\nE. Contemporâneos; JARDIM, R. Aventura; LEITE, A. História; LEITE, A.\nMemórias; LEVINE, R. Vargas; MORAIS, A. Minas; NOGUEIRA FILHO, P.\nIdeais; PEIXOTO, A. Getúlio; SILVA, H. 1932; SILVA, H. 1933; SILVA, H.\n1934; SILVA, H. 1935; SILVA, H. 1937; SILVA, H. 1938; SOC. BRAS.\nEXPANSÃO COMERCIAL. Quem; VAMPRÉ, S. Memórias.\n\n \n","dic":"DHBB"}
