{"title":"MELO, Cesário de","cargoss":["Deputado federal","Deputado federal","Senador"],"cargos_esp":[0,0,0],"datas_ini":[1930,1924,1935],"datas_fim":[1930,1926,1937],"estados":["DF","DF","DF"],"autor":[0],"content":"**MELO, Cesário de**\n\n\\*dep. fed. DF 1924-1926 e 1930; sen. DF 1935-1937.\n\n \n\n*Júlio Cesário de Melo* nasceu em Recife no dia 6 de setembro de 1876,\nfilho de José Cesário de Melo e de Vicentina de Paula Cesário de Melo.\n\nDepois de formado em medicina, exerceu mandatos de deputado federal pelo\nDistrito Federal de novembro de 1924 a dezembro de 1926 e de maio a\noutubro de 1930, quando a revolução vitoriosa neste último mês dissolveu\nos órgãos legislativos do país.\n\nFiliado ao Partido Autonomista do Distrito Federal, em fevereiro de 1935\nelegeu-se senador pelo voto dos deputados constituintes cariocas.\nEmpossado em maio de 1935 para a legislatura que findaria em 1942,\nexerceu o mandato apenas até novembro de 1937, data da implantação do\nEstado Novo, que dissolveu os órgãos legislativos no país.\n\nSeu filho, Júlio Cesário de Melo, em outubro de 1958 elegeu-se vereador\nno Distrito Federal, na legenda do Partido Socialista Brasileiro (PSB).\nFoi empossado em fevereiro de 1959, exercendo o mandato até a sua morte,\nem janeiro de 1963.\n\n \n\n \n\nFONTES: Boletim Min. Trab. (5/36); CÂM. DEP. Deputados; Diário do\nCongresso Nacional; NÉRI, S. 16; SENADO. Anais (1935); SENADO. Dados;\nTRIB. SUP. ELEIT. Dados (4).\n\n \n","ref":"FONTES: Boletim Min. Trab. (5/36); CÂM. DEP. Deputados; Diário do\nCongresso Nacional; NÉRI, S. 16; SENADO. Anais (1935); SENADO. Dados;\nTRIB. SUP. ELEIT. Dados (4).\n\n \n","dic":"DHBB"}
