{"title":"ARAÚJO, Joaquim Machado de","cargoss":["Interventor"],"cargos_esp":[0],"datas_ini":[1946],"datas_fim":[1947],"estados":["GO"],"autor":[0],"content":"**ARAÚJO, Joaquim Machado de**\n\n\\*interv. GO 1946-1947.\n\n* *\n\n*Joaquim Machado de Araújo* nasceu em Santa Luzia, atual Luziânia (GO),\nno dia 12 de maio de 1894, filho de Benedito Machado de Araújo e de\nLibânia de Araújo Roriz.\n\nIniciou seu curso de direito na Faculdade de Direito do Rio de Janeiro,\nem 1922 diplomando-se pela Faculdade de Direito de Goiás. Nesse período,\nexerceu a função de promotor de justiça na sua cidade natal, cargo do\nqual exonerou-se para poder concluir seus estudos.\n\nIniciou sua carreira política elegendo-se, em 1923, deputado estadual\npor Goiás, sendo reeleito no pleito seguinte. Em 1929 foi nomeado juiz\nde direito da comarca de Santa Luzia, função que desempenhou até 1932.\nEm março de 1934 foi novamente nomeado promotor público de Santa Luzia.\n\n Na qualidade de presidente do Conselho Administrativo de Goiás, em 22\nde outubro de 1946 foi nomeado pelo então presidente da República,\nEurico Gaspar Dutra, para o cargo de interventor federal em Goiás, cargo\nque exerceu até 23 de março de 1947, data em que abandonou\ndefinitivamente a vida política.\n\nFoi ainda professor da Faculdade de Filosofia da Pontifícia Universidade\nCatólica; professor da faculdade católica de Goiás; membro do conselho\ndiretor da Ordem dos Advogados do Brasil (OAB), seção de Goiás; membro\ndo Rotary Club Goiânia centro e membro do conselho administrativo da\nCaixa Econômica Federal, cargo no qual se aposentou em 1961.\n\nFaleceu em Goiânia no dia 15 de janeiro de 1976.\n\nEra casado com Guiomar de Grammont Machado, com quem teve quatro filhos.\n\n \n\nFONTES: *Encic. Mirador*; *Grande encic. Delta*.; INF. FAM.\n\n \n","ref":"FONTES: *Encic. Mirador*; *Grande encic. Delta*.; INF. FAM.\n\n \n","dic":"DHBB"}
