{"title":"MELO, Públio de","cargoss":["Senador"],"cargos_esp":[0],"datas_ini":[1957],"datas_fim":[1959],"estados":["MA"],"autor":[0],"content":"**MELO, Públio de**\n\n\\*sen. MA 1957-1959.\n\n \n\n*Raimundo Públio Bandeira de Melo* nasceu em Itapicuru-mirim (MA) no dia\n21 de janeiro de 1888, filho de Catão Clímaco Bandeira de Melo e de\nTeresa de Jesus Moreira.\n\nFormou-se em direito e foi nomeado em 1913 promotor público na comarca\nde Viana (MA). Tornou-se ainda nesse ano delegado de polícia em São\nLuís, atuando em seguida como juiz municipal da 4ª Vara de São Luís,\ndepois na comarca de Flores, atual Timon (MA), e finalmente na 2ª Vara\nde São Luís.\n\nElegeu-se na legenda do Partido Social Democrático (PSD) suplente do\nsenador Francisco de Assis Chateaubriand Bandeira de Melo, seu parente,\nno pleito suplementar realizado em 1955. Assumindo o mandato em dezembro\nde 1957 em decorrência da nomeação do titular para a embaixada\nbrasileira em Londres, foi membro das comissões de Redação e de Educação\ndo Senado e integrou também a comissão mista incumbida de relatar o veto\npresidencial ao projeto de lei que autorizava o Poder\nExecutivo****a****emitir letras e obrigações do Tesouro Nacional. No\npleito de outubro de 1958 voltou a eleger-se suplente do senador na\nlegenda do PSD, dessa vez na chapa encabeçada por Eugênio de Barros,\ntendo exercido o mandato de agosto a outubro de 1959.\n\nFoi também professor de direito.\n\nFaleceu no Rio de Janeiro no dia 22 de fevereiro de 1966.\n\nEra casado com Maria de Lurdes Silva Bandeira de Melo, com quem teve\nseis filhos.\n\n \n\nFONTES: INF. Liziane Bandeira de Melo; SENADO. *Dados*; SENADO.\n*Relação*; TRIB. SUP. ELEIT. *Dados* (7).\n\n \n","ref":"FONTES: INF. Liziane Bandeira de Melo; SENADO. *Dados*; SENADO.\n*Relação*; TRIB. SUP. ELEIT. *Dados* (7).\n\n \n","dic":"DHBB"}
