{"title":"MELO, Ubaldo Bezerra de","cargoss":["Interventor"],"cargos_esp":[0],"datas_ini":[1946],"datas_fim":[1947],"estados":["RN"],"autor":[0],"content":"**MELO, Ubaldo Bezerra de**\n\n\\*interv. RN 1946-1947.\n\n \n\n*Ubaldo Bezerra de Melo* nasceu em Recife no dia 17 de maio de 1894,\nfilho de João Bezerra de Melo e Idalina Bezerra de Melo.\n\nEm 1905 transferiu-se com a família para Natal, onde fez seus estudos\nprimários no Colégio Santo Antônio e secundários no Ateneu\nNorte-Rio-Grandense.\n\nFuncionário do Departamento dos Correios e Telégrafos, em 1917 ingressou\nna Inspetoria Federal de Obras contra as Secas, onde trabalhou até 1927,\nchegando a desempenhar as funções de pagador. Em outubro de 1930, com o\nadvento do movimento revolucionário que levou Getúlio Vargas ao poder,\nfoi escolhido para presidir o Banco do Rio Grande do Norte.\n\nIndustrial, entre 1939 e 1945 foi membro do Conselho Administrativo do\nEstado, órgão colegiado que substituiu a Assembléia Legislativa durante\no Estado Novo (1937-1945). Em fevereiro de 1946 foi nomeado interventor\nfederal no Rio Grande do Norte em substituição ao desembargador Miguel\nSeabra Fagundes. Arrecadou a maior receita financeira até então\nrecolhida no Rio Grande do Norte e em janeiro de 1947 deixou a\ninterventoria, sendo substituído pelo general Orestes da Rocha Lima.\n\nNo pleito de outubro de 1954, elegeu-se deputado estadual no Rio Grande\ndo Norte na legenda do Partido Social Democrático (PSD), assumindo o\nmandato em fevereiro do ano seguinte. De 1954 a 1955, foi membro do\nconselho consultivo do Banco do Nordeste. Foi primeiro vice-presidente\nda Assembléia Legislativa de 1955 a 1956 e encerrou seu mandato em\njaneiro de 1959, quando deixou a carreira política.\n\nUbaldo Bezerra de Melo foi ainda diretor do Lóide Brasileiro em Natal,\ndiretor-presidente da Caixa Econômica Federal naquela cidade. Como\nempresário, foi diretor da firma Bezerra & Cia., pioneira na indústria\naçucareira potiguar, sendo responsável pela instalação das usinas Ilha\nBela e Santa Teresinha no vale do Ceará-Mirim.\n\nFaleceu em Natal no dia 19 de agosto de 1974.\n\nFoi casado com Haydée Bezerra de Melo, falecida anteriormente, com quem\nteve nove filhos.\n\nEm sua homenagem, foi inaugurada, em 1979, em Ceará-Mirim, a Escola\nEstadual Interventor Ubaldo Bezerra de Melo.\n\n \n\nFONTES: CASCUDO. L. *História*: CASCUDO, L. *História da Assembléia*;\n*Grande encic. Delta*; INF. Cléa Bezerra de Melo Centeno; INF. Maria do\nSocorro Lopes de Sousa; TRIB. SUP. ELEIT. *Dados* (3).\n\n \n","ref":"FONTES: CASCUDO. L. *História*: CASCUDO, L. *História da Assembléia*;\n*Grande encic. Delta*; INF. Cléa Bezerra de Melo Centeno; INF. Maria do\nSocorro Lopes de Sousa; TRIB. SUP. ELEIT. *Dados* (3).\n\n \n","dic":"DHBB"}
