{"title":"MENDES, Edilson Lamartine","cargoss":["Deputado federal"],"cargos_esp":[0],"datas_ini":[1979],"datas_fim":[1983],"estados":["MG"],"autor":[0],"content":"**MENDES, Edilson Lamartine**\n\n\\*dep. fed. MG 1979-1983.\n\n \n\n*Edilson Lamartine Mendes* nasceu em Uberaba (MG) no dia 12 de janeiro\nde 1937, filho de Lamartine Mendes dos Santos e Hermínia Batista Mendes.\n\nCursou o secundário em São Paulo e no Colégio Andrews do Rio de Janeiro,\nentão Distrito Federal. Em 1960, graduou-se em medicina veterinária pela\nEscola Nacional de Veterinária da Universidade Federal Rural do Rio de\nJaneiro (UFRRJ). No ano seguinte, fez um curso sobre nutrição e\nreprodução animal na Escola Superior de Agricultura de Piracicaba (SP).\nEm 1962 tornou-se diretor-tesoureiro dos Serviços de Registro\nGenealógico da Associação Brasileira de Criadores de Zebu em Uberaba,\ncargo que ocuparia por dois anos. Em 1963, viajou a convite do\nDepartamento de Agricultura dos Estados Unidos da América, realizando\nestudos no Texas Agricultural and Mechanical College System e na\nLouisiana State University Agricultural and Mechanical College.\n\nDe volta ao Brasil, em 1966 assumiu a presidência dos Serviços de\nRegistro Genealógico da Associação Brasileira de Criadores de Zebu,\nfunção que exerceria até 1968. Em 1967, viajou à Venezuela em missão\noficial do governo brasileiro.\n\nFiliado à Aliança Renovadora Nacional (Arena), partido de sustentação do\nregime militar vigente no país desde abril de 1964, foi membro do\ndiretório municipal da agremiação em Uberaba de 1971 a 1974. Ainda em\nsua cidade natal, neste último ano participou do ciclo de estudos sobre\nsegurança nacional e desenvolvimento promovido pela Associação de\nDiplomados pela Escola Superior de Guerra (ADESG).\n\nEm novembro de 1978 candidatou-se a deputado federal pela Arena, mas\nobteve apenas uma suplência. Assumiu o mandato em março do ano seguinte,\nem substituição a Paulino Cícero de Vasconcelos, nomeado secretário de\nEducação em Minas Gerais no governo Francelino Pereira (1979-1983).\n\nCom o fim do bipartidarismo em novembro de 1979, filiou-se ao Partido\nDemocrático Social (PDS), que abrigou a maioria dos remanescentes da\nArena. Por sua nova legenda, disputou a reeleição em novembro de 1982,\nobtendo, mais uma vez, a suplência. Deixou a Câmara dos Deputados em\njaneiro de 1983, ao final da legislatura. Como deputado, foi membro da\nComissão de Agricultura e Política Rural e suplente da Comissão de\nEconomia, Indústria e Comércio.\n\nFoi também presidente do Sindicato Rural de Uberaba, vice-presidente da\nFederação da Agricultura de Minas Gerais, diretor da Confederação\nNacional de Agricultura e fez parte do Conselho Nacional de\nDesenvolvimento da Pecuária, além de ter participado de várias entidades\nligadas à pecuária.\n\nMorreu em Uberaba, no dia 25 de fevereiro de 1984, vítima de acidente\nautomobilístico.\n\nFoi casado com Maria Inês Machado Mendes, com quem teve três filhos.\n\n \n\nFONTES: ASSEMB. LEGISL. MG. *Dicionário biográfico*; CÂM. DEP.\n*Deputados brasileiros. Repertório*(1979-1983); *Globo* (27/2/84).\n\n \n","ref":"FONTES: ASSEMB. LEGISL. MG. *Dicionário biográfico*; CÂM. DEP.\n*Deputados brasileiros. Repertório*(1979-1983); *Globo* (27/2/84).\n\n \n","dic":"DHBB"}
