{"title":"MENDES, Ivan de Sousa =====================","cargoss":["Interventor","min ch SNI"],"cargos_esp":[0,0],"datas_ini":[1964,1985],"datas_fim":[1964,1990],"estados":["DF",0],"autor":[0],"content":"MENDES, Ivan de Sousa\n=====================\n\n\\*  militar; interv.  DF 1964; min. ch. SNI 1985-1990.\n\n* *\n\n*Ivan de Sousa Mendes*nasceu em Cordeiro (RJ) no dia 23 de fevereiro de\n1922, filho de Alfredo de Sousa Mendes e de Celeste Freitas de Sousa\nMendes.\n\nSentou praça no Exército em abril de 1940 ingressando na Escola Militar\ndo Realen­go, no Rio de Janeiro, então Distrito Federal, da qual saiu\naspirante da arma de engenharia em março de 1943.  Em setembro desse ano\nfoi promovido a segundo-tenente, em dezem­bro de 1944 a primeiro-tenente\ne em junho de 1948 a capitão.  Em outubro de 1952 atin­giu o posto de\nmajor e em agosto de 1962 o de tenente-coronel.\n\nDepois de servir no 9º Batalhão de Engenharia de Combate, em Mato\nGrosso, em janeiro de 1964 veio para o Rio de Janeiro, onde passou a\nintegrar o grupo de militares liderados pelo general Humberto de Alencar\nCastelo Branco, envolvido em conspiração para derrubar o presidente João\nGoulart (1961-1964). Com a vitória do movimento político-mili­tar de 31\nde março de 1964, em abril seguinte Ivan Mendes foi nomeado interventor\nna Prefeitura de Brasília em substituição a Luís Carlos Vítor Pujol, que\nocupara por sua vez esse cargo apenas du­rante seis dias, após a\ndestituição de Ivo de Magalhães.  Permaneceu como interventor até maio\ndesse mesmo ano, quando foi substituí­do por Plínio Cantanhede.\n\nServiu em seguida no Gabinete Militar, sob as ordens do general Ernesto\nGeisel, e em julho foi nomeado adido militar na embaixada do Brasil no\nPeru. Em agosto de 1966 foi promovido a coro­nel. De volta ao Brasil em\n1967, durante todo o governo do marechal Artur da Costa e Silva\n(1967-1969) esteve lotado no gabinete do ministro do Exército, general\nAugusto de Lira Tavares. Durante o governo do general Emílio Garrastazu\nMédici (1969-1974), esteve no gabinete do presidente da Petrobrás,\ngeneral Ernesto Geisel\n\nPromovido em julho de 1974 a general-de-brigada, comandou nesse posto a\n8ª. Região Mi­litar, sediada em Belém, e a Escola de Comando e\nEstado-Maior do Exército (ECEME), tendo ainda integrado o corpo\npermanente da Escola Superior de Guerra (ESG). Em 1979 foi promovido a\ngeneral-de-divisão. Após exercer vários comandos e chefias, em março de\n1985, sucedendo ao general Otávio Medeiros, foi empossado no cargo de \nministro-chefe do Serviço Nacional de Informações (SNI) do presidente\nJosé Sarney, primeiro governo civil após 21 anos de regime militar.\nPassou para a reserva em 1986,  no posto de general-de-exército.\nPermaneceu à frente do SNI até março de 1990, ao findar o governo\nSarney. Nessa ocasião, o SNI foi extinto.\n\nDepoimento prestado em 1992 pelo biografado ao Centro de Pesquisa e\nDocumentação de História Contemporânea do Brasil (CPDOC), da Fundação\nGetúlio Vargas, veio a integrar a trilogia organizada pelos\npesquisadores Maria Celina D’Araújo, Gláucio Ary Dillon Soares e Celso\nCastro e lançada em 1994-1995, composta pelos livros *Visões do golpe –\na memória militar sobre 1964*, *Os anos de chumbo – a memória  militar\nsobre a repressão* e *A volta aos quartéis - a memória militar sobre a\nabertura*.\n\nCursou a Escola de Aperfeiçoamento de Oficiais e a Escola de Comando e\nEstado-Mai­or do Exército.\n\nFaleceu no Rio de Janeiro no dia 18 de fevereiro de 2010.\n\nCasou-se com Maria Estela de Sousa Mendes, com quem teve três filhas.\nUma delas, Márcia Mendes Mamede casou-se com Jurandir Dantas Mamede,\nfilho do general Jurandir Bizarria Mamede, que além de ter participado\nda Revolução de 1930 e do movimento político-militar de 31 de março de\n1964, foi  comandante do II Exército (1966-1967),  chefe do \nDepartamento de Produção e Obras do Exército  (1967-1970) e ministro do \nSuperior Tribunal Militar (1970-1976).\n\n \n\nFONTES: ARAÚJO, M. *Visões*; *Correio Brasiliense*(5/11/69, 19/2/10);\nCORRESP. GOV. DF; MIN. GUERRA.  *Alma­naque*;**INF. BIOG.; *Perfil*.\n\n \n","ref":"FONTES: ARAÚJO, M. *Visões*; *Correio Brasiliense*(5/11/69, 19/2/10);\nCORRESP. GOV. DF; MIN. GUERRA.  *Alma­naque*;**INF. BIOG.; *Perfil*.\n\n \n","dic":"DHBB"}
