{"title":"MENDES, Leônidas Pereira","cargoss":["Deputado federal"],"cargos_esp":[0],"datas_ini":[1947],"datas_fim":[1951],"estados":["MT"],"autor":[0],"content":"**MENDES, Leônidas Pereira**\n\n\\*dep. fed. MT 1947-1951.\n\n*Leônidas Pereira Mendes* nasceu em Cuiabá no dia 4 de abril de 1892,\nfilho de Manuel Pereira Mendes e Maria da Glória Pereira Mendes.\n\nOcupou os cargos de engenheiro civil e funcionário da prefeitura de sua\ncidade natal. No pleito suplementar de janeiro de 1947, foi eleito\ndeputado federal por Mato Grosso pela legenda do Partido Social\nDemocrático (PSD). No exercício de seu mandato, de 24 de março de 1947 a\n31 de janeiro de 1951, integrou a Comissão Permanente de Agricultura e a\nComissão de Valorização Econômica da Amazônia. Nas eleições de outubro\nde 1950, candidatou-se à reeleição pela legenda pessedista sem obter\nsucesso. Deixou a Câmara dos Deputados em 1951.\n\nNo pleito de outubro de 1954, disputou uma vaga no Senado pela legenda\ndo Partido Social Progressista (PSP), novamente não conseguindo\neleger-se.\n\nFONTES: CÂM. DEP. *Deputados*; CÂM. DEP*.* *Deputados brasileiros.\nRepertório* (1946-1967); *Diário* *do Congresso Nacional*;**TRIB. SUP.\nELEIT. *Dados* (1).\n\n \n","ref":"FONTES: CÂM. DEP. *Deputados*; CÂM. DEP*.* *Deputados brasileiros.\nRepertório* (1946-1967); *Diário* *do Congresso Nacional*;**TRIB. SUP.\nELEIT. *Dados* (1).\n\n \n","dic":"DHBB"}
