{"title":"ARAÚJO, Pedro Xavier d’","cargoss":["Deputado federal","Deputado federal"],"cargos_esp":[0,0],"datas_ini":[1958,1956],"datas_fim":[1959,1956],"estados":["DF","DF"],"autor":[0],"content":"**ARAÚJO, Pedro Xavier d’**\n\n\\*dep. fed. DF 1956 e 1958-1959.\n\n* *\n\n*Pedro Xavier d’Araújo* nasceu em Gameleira, no município de Capela\n(AL), em 10 de fevereiro de 1906.\n\nFez os estudos primários em Viçosa (AL) e os secundários em Maceió, no\nColégio São Luís e no Colégio 15 de Março. Ainda em Maceió iniciou-se no\njornalismo, sob a orientação de Povina Cavalcanti.\n\nTransferindo-se em 1921 para o Rio de Janeiro, então Distrito Federal,\ningressou na Faculdade de Direito da Universidade do Rio de Janeiro,\npela qual se bacharelou. Sempre na capital federal, foi redator de\njornais como A Notícia e o Diário de Notícias e fundou e dirigiu a\nRevista Municipal e o diário A Tarde. Ocupou também na prefeitura da\ncidade os cargos de auxiliar da procuradoria, advogado, inspetor e\ndiretor do contencioso e coordenador de desapropriações.\n\nEntre 1924 e 1925, foi oficial-de-gabinete do presidente de Alagoas,\nPedro Costa Rego. Foi ainda consultor jurídico da Prefeitura de Maceió e\npresidente do Centro Alagoano.\n\nEm 1947, foi candidato a vereador no Rio de Janeiro na legenda da União\nDemocrática Nacional (UDN), obtendo, no entanto, apenas uma suplência.\nNo pleito de outubro de 1950, candidatou-se à Câmara Federal pelo Rio de\nJaneiro, mas também não conseguiu se eleger. Em outubro de 1954,\nvinculado à UDN, obteve mais uma suplência de deputado federal na\nlegenda da coligação Aliança Popular, tendo exercido o mandato de agosto\na outubro de 1956 e de junho de 1958 a janeiro de 1959.\n\nTornou-se sócio benemérito da Associação Brasileira de Imprensa (ABI).\n\nFaleceu no dia 28 de julho de 1984.\n\n \n\nFONTES: ABI. *Sindic. Jornalistas Profissionais RJ*; CÂM. DEP.\n*Deputados*; MORAIS, T. *Resumo*; TRIB. SUP. ELEIT. *Dados* (3); TRIB.\nSUP. ELEIT. *Dados estatísticos*.\n\n \n","ref":"FONTES: ABI. *Sindic. Jornalistas Profissionais RJ*; CÂM. DEP.\n*Deputados*; MORAIS, T. *Resumo*; TRIB. SUP. ELEIT. *Dados* (3); TRIB.\nSUP. ELEIT. *Dados estatísticos*.\n\n \n","dic":"DHBB"}
