{"title":"MENDONÇA NETO","cargoss":["Deputado federal","Deputado federal"],"cargos_esp":[0,0],"datas_ini":[1991,1979],"datas_fim":[1995,1983],"estados":["AL","AL"],"autor":[0],"content":"**MENDONÇA NETO**\n\n\\*dep. fed. AL 1979-1983, 1991-1995.\n\n \n\n*Antônio Saturnino de Mendonça Neto* nasceu em Rio Novo (MG) no dia 10\nde março de 1945, filho de Antônio Saturnino de Mendonça Júnior e\nCloripes Matos Mendonça. Seu pai foi deputado federal por Alagoas entre\n1951 e 1959.\n\nAinda jovem, sua família passou a residir em Maceió.\n** **Posteriormente, mudam-se para o Rio de Janeiro. Nesta cidade,\niniciou seus estudos superiores em 1961 na Faculdade Brasileira de\nCiências Jurídicas, onde, cinco anos mais tarde, formou-se em ciências\njurídicas e sociais. Em 1970, ainda no Rio, lecionou na Pontifícia\nUniversidade Católica do Rio de Janeiro (PUC-Rio) durante dois anos.\n\nMudou-se para Maceió e candidatou-se em 1974 a uma vaga na Assembléia\nLegislativa de Alagoas pelo Movimento Democrático Brasileiro (MDB),\npartido de oposição ao regime militar instalado no país em abril de\n1964. Eleito em novembro desse mesmo ano, tomou posse em fevereiro de\n1975. Durante essa legislatura foi membro da Comissão de Constituição e\nJustiça e da Comissão de Orçamento e de Finanças e Tomada de Contas e\nlíder da bancada do seu partido. Foi ainda primeiro-vice-presidente do\ndiretório regional do MDB.\n\nEm novembro de 1978, concorreu a uma vaga na Câmara dos Deputados.\nEleito, tomou posse no início do ano seguinte. Em novembro de 1979, com\na extinção do bipartidarismo e a conseqüente reorganização partidária,\nfiliou-se ao Partido do Movimento Democrático Brasileiro (PMDB),\nfundado, entre outros e na grande maioria, pelos membros do antigo MDB.\nAo longo desse mandato, foi membro e segundo-vice-presidente da Comissão\nde Constituição e Justiça, membro da Comissão de Trabalho e Legislação\nSocial, suplente da Comissão de Relações Exteriores, membro da Comissão\nParlamentar de Inquérito (CPI) sobre o empobrecimento dos municípios, da\nCPI sobre as irregularidades nos órgãos da administração direta e\nindireta da União e vice-líder da bancada do PMDB.\n\nEm novembro de 1982, voltou a disputar uma cadeira para o Legislativo\nalagoano. Foi eleito e tomou posse no início do ano seguinte, tendo\ndeixado a Câmara dos Deputados em janeiro de 1983. No exercício desse\nmandato, foi presidente da CPI sobre as irregularidades no Departamento\nde Estradas e Rodagem (DER), presidente da CPI sobre a distribuição do\nImposto sobre a Circulação de Mercadorias (ICM) no estado e\nsegundo-vice-presidente da mesa. Em 1984, viajou à Espanha como\nprofessor convidado da Universidade de Salamanca e foi a Madri como\nobservador parlamentar pela Assembléia Legislativa.\n\nRetirou-se da Assembléia em janeiro de 1987 ao final da legislatura, não\ntendo disputado a reeleição em novembro do ano anterior. Ainda em 1987,\nassumiu a Secretaria de Planejamento do governo de Fernando Collor\n(1987-1989). Por conta dessa atribuição, presidiu o Conselho Estadual de\nInformática e o Conselho de Programação Financeira do governo alagoano.\n\nEm novembro de 1990, depois de filiar-se ao Partido Democrático\nTrabalhista (PDT), tornou a disputar uma cadeira na Câmara dos\nDeputados. Vitorioso, assumiu seu mandato no início do ano seguinte.\nNessa legislatura, foi vice-líder do PDT, titular da Comissão de\nEconomia, Indústria e Comércio e suplente da Comissão de Ciência e\nTecnologia, Comunicação e Informática.\n\nNo processo político desencadeado pelo Poder Legislativo federal durante\no ano de 1992 e que resultou no afastamento de Collor da presidência,\nsob a acusação de envolvimento em esquema de corrupção e tráfico de\ninfluência organizado pelo ex-tesoureiro de sua campanha eleitoral,\nPaulo César Farias, Mendonça Neto votou a favor da abertura do processo\nde *impeachment* na sessão da Câmara dos Deputados de 29 de\nsetembro.****Afastado da presidência logo após a votação na Câmara,\nCollor renunciou ao mandato em 29 de dezembro de 1992, pouco antes da\nconclusão do processo pelo Senado, sendo efetivado na presidência da\nRepública o vice Itamar Franco, que já vinha exercendo o cargo\ninterinamente desde 2 de outubro.\n\nEm maio de 1993, com a saída do deputado federal Valdir Pires, acusou a\ndireção nacional do PDT de “incompetência política”, por não impedir que\nparlamentares baianos deixassem o partido. Nesse mesmo mês, iniciou\ncoleta de assinaturas para a criação de uma CPI para investigar as\natividades do ministro Eliseu Resende no governo, suspeito de estar\npraticando tráfico de influência em função do cargo que ocupava.\n\nPermaneceu até o fim do mandato em janeiro de 1995, e não concorreu à\nreeleição em outubro de 1994. Voltou a disputar uma vaga na Câmara dos\nDeputados pelo PDT em outubro de 1998, obtendo, contudo, apenas a\nsuplência.\n\nFaleceu no dia 10 de novembro de 2010.\n\nFoi casado com Ângela Maria Moreira Canuto Mendonça, filha de Rubens de\nMendonça Canuto, que foi deputado estadual de 1958 a 1970, e que nas\neleições de 1994 foi candidata a governador, pelo PDT. Teve dois filhos.\n\nPublicou inumeros livros, entre os quais *A luta continua (1979), Um\nolhar no coração (1986), Alagoas: histórias de um sobrevivente (1992),\nEm nome de Alagoas (1994);* *Pequeno Tratado das Vontades Humanas*\n(2000), *Do Alto da Gávea* (2001), *Os Contos de Alagoas: uma\nAntologia*(2001), *O Emparedado* (2004) e *O Ministro que virou garçon*\n(2006).\n\n** \n\n** \n\n \n\nFONTES: CÂM. DEP. *Deputados brasileiros. Repertório*(1991-1995); *Folha\nde S. Paulo* (12/11/10); INF. Francisco Amorim.\n\n \n\n \n","ref":"FONTES: CÂM. DEP. *Deputados brasileiros. Repertório*(1991-1995); *Folha\nde S. Paulo* (12/11/10); INF. Francisco Amorim.\n\n \n\n \n","dic":"DHBB"}
