{"title":"MENDONÇA, Fernando Augusto","cargoss":["Deputado federal"],"cargos_esp":[0],"datas_ini":[1961],"datas_fim":[1962],"estados":["PE"],"autor":[0],"content":"**MENDONÇA, Fernando Augusto**\n\n\\*dep. fed. PE 1961-1962.\n\n \n\n*Fernando Augusto Mendonça* nasceu em Canhotinho (PE) no dia 22 de\ndezembro de 1906, filho de Antônio Baltazar Mendonça, prefeito de Maceió\napós a vitória do movimento revolucionário de 1930 e deputado estadual\nem Alagoas, e Maria Olímpia de Carvalho Mendonça.\n\nFormou-se pela Faculdade de Direito de Recife no início da década de\n1930. Ainda universitário, foi oficial-de-gabinete do secretário de\nSegurança Pública de Pernambuco, Adolfo Ciríaco. Em seguida, tornou-se\ndelegado de polícia na capital pernambucana. Mais tarde, foi promotor\npúblico no Recife.\n\nPresidente da seção pernambucana do Partido Social Progressista (PSP) no\ninício da década de 1950, filiou-se posteriormente à União Democrática\nNacional (UDN) e candidatou-se a deputado federal por Pernambuco em\noutubro de 1958 na legenda das Oposições Unidas de Pernambuco, coligação\npartidária formada pela UDN, o Partido Trabalhista Brasileiro (PTB), o\nPSP, o Partido Trabalhista Nacional (PTN) e o Partido Socialista\nBrasileiro (PSB). Todavia, não conseguiu eleger-se, alcançando a\nprimeira suplência.\n\nPresidente do Instituto de Previdência dos Servidores do Estado de\nPernambuco entre 1959 e 1960, assumiu o mandato de deputado federal em\nsetembro de 1961 na vaga aberta pela saída de Estácio Souto Maior,\nnomeado para o Ministério da Saúde. Deixou a Câmara em julho do ano\nseguinte, com o retorno do titular.\n\nAbandonando a carreira política, voltou a advogar. Foi procurador-geral\ndo Estado durante o governo de Eraldo Gueiros (1971-1975).\n\nFaleceu no Recife em 1996.\n\nEra casado com Maria de Nazaré Barreto de Mendonça, com quem teve cinco\nfilhos.\n\nCompletou a obra *História da Faculdade de Direito de Recife*, de Clóvis\nBevilacqua.\n\n \n\nFONTES: CÂM. DEP. *Deputados*; CÂM. DEP. *Deputados brasileiros.\nRepertório* (1946-1967); INF. Fernando Augusto Mendonça Filho; PEREIRA,\nN. *Faculdade*; TRIB. SUP. ELEIT. *Dados* (6).\n\n \n","ref":"FONTES: CÂM. DEP. *Deputados*; CÂM. DEP. *Deputados brasileiros.\nRepertório* (1946-1967); INF. Fernando Augusto Mendonça Filho; PEREIRA,\nN. *Faculdade*; TRIB. SUP. ELEIT. *Dados* (6).\n\n \n","dic":"DHBB"}
