{"title":"MENDONÇA, Leoni","cargoss":["Senador"],"cargos_esp":[0],"datas_ini":[1974],"datas_fim":[1975],"estados":["GO"],"autor":[0],"content":"**MENDONÇA, Leoni**\n\n\\*sen. GO 1974-1975.\n\n \n\n*Leoni Mendonça* nasceu em Pirenópolis (GO) no dia 20 de abril de 1916,\nfilho de Joaquim Mendonça e de Isabel de Siqueira Mendonça.\n\nIniciou a vida profissional aos 16 anos como tropeiro em Goiás,\nengajando-se no comércio de minérios um ano depois. Mais tarde\nestabeleceu-se como comerciante de tecidos e armarinhos em sua cidade\nnatal, instalando filiais nas cidades goianas da Lagolândia, Jaraguá e\nAnápolis, e tornou-se também um dos pioneiros na extração de minérios de\nrutílio no estado, estendendo suas atividades no setor a Minas Gerais e\nao Ceará. Instalou ainda uma usina de moagem e beneficiamento desse\nminério em São Paulo, atendendo não só às exigências do mercado interno\ncomo também às da exportação para diversos países.\n\nDeu início ao garimpo de cristal de rocha de Pinhum (GO), realizando o\ntransporte do produto para o Rio de Janeiro, então Distrito Federal, em\navião particular. Já durante a Segunda Guerra Mundial, era o maior\nexportador de cristal de rocha do país e, ao final do conflito, em 1945,\nrecebeu cartas da comissão de compras dos governos da Inglaterra e dos\nEUA em agradecimento à ajuda que prestara àqueles países através da\nexportação de um material considerado matéria-prima estratégica. Ainda\nem 1945, fundou a Química Leoni Ltda., fábrica de cafeína vendida três\nanos depois. Criou também a Companhia Hudson Distribuidora do Brasil,\ndepois Hudson Brasileira de Petróleo S.A., da qual foi\ndiretor-presidente. Explorou ainda o ramo agroexportador em Goiás e no\nTriângulo Mineiro, com produção de arroz e feijão destinada aos mercados\nde Minas Gerais, Rio de Janeiro, São Paulo, e, entre outros países,\nÁfrica do Sul, Argentina e Inglaterra.\n\nNo pleito de novembro de 1970, elegeu-se suplente de senador por Goiás\nna legenda da Aliança Renovadora Nacional (Arena), partido de\nsustentação do regime militar instalado no país em abril de 1964. Com a\nrenúncia do titular, Emival Caiado, passou a ocupar uma cadeira no\nSenado em junho de 1974, sendo designado membro efetivo da Comissão de\nServiço Público Civil e suplente das comissões de Finanças e de Relações\nExteriores. Deixou o Senado em janeiro de 1975, quando abandonou a vida\npública e passou a dedicar-se à sua firma Hudson Brasileira de Petróleo\nS.A.\n\nFaleceu em Goiânia no dia 25 de agosto de 1998.\n\nFoi casado em primeiras núpcias com Maria das Dores Fleury de Mendonça,\ncom quem teve quatro filhos. Contraiu novo matrimônio com Maria Dalcy\nLobo.\n\n \n\nFONTES: INF. FAM.; SENADO. *Dados*; SENADO. *Relação*; SOC. BRAS.\nEXPANSÃO COMERCIAL. *Quem*.\n\n \n","ref":"FONTES: INF. FAM.; SENADO. *Dados*; SENADO. *Relação*; SOC. BRAS.\nEXPANSÃO COMERCIAL. *Quem*.\n\n \n","dic":"DHBB"}
