{"title":"MENESES, Godofredo Costa","cargoss":["Constituinte","Deputado federal"],"cargos_esp":[0,0],"datas_ini":[1934,1935],"datas_fim":[1934,1937],"estados":[0,"ES"],"autor":[0],"content":"**MENESES, Godofredo Costa**\n\n\\*const. 1934; dep. fed. ES 1935-1937.\n\n* *\n\n*Godofredo Costa Meneses* nasceu em Mar de Espanha (MG) no dia 10 de\njunho de 1890, filho de José Caetano Meneses, médico sanitarista, e de\nTeresa Costa Meneses.\n\nFez seus estudos no Colégio Paula Freiras e no Ginásio Nacional, ambos\nno Rio de Janeiro, então Distrito Federal, e em seguida ingressou na\nFaculdade de Medicina do Rio de Janeiro, pela qual se formou em dezembro\nde 1914. Iniciou sua carreira como médico em Angustura (MG), de onde se\ntransferiu para o Espírito Santo, fixando residência em Alegre. Nessa\ncidade estabeleceu-se profissionalmente e exerceu ainda as funções de\ndelegado de instrução e de higiene, de inspetor federal de ensino e de\nmédico escolar, chegando a ocupar em 1927 o cargo de prefeito.\n\nNo pleito de maio de 1933 foi eleito deputado à Assembléia Nacional\nConstituinte pelo Espírito Santo na legenda do Partido Social\nDemocrático (PSD). Participou dos trabalhos constituintes a partir de\ndezembro desse mesmo ano, e, com a promulgação da nova Carta (16/7/1934)\ne a eleição do presidente da República, teve seu mandato estendido até\nmaio de 1935. Reeleito deputado federal nas eleições de outubro de 1934,\npermaneceu na Câmara até novembro de 1937, quando, com****o advento do\nEstado Novo, os órgãos legislativos do país foram suprimidos.\n\nPertenceu ainda ao serviço médico do Banco do Brasil.\n\nFaleceu no Rio de Janeiro em 11 de janeiro de 1954.\n\nFoi casado com Helena Matos Meneses.\n\n \n\n \n\nFONTES: CÂM. DEP. Deputados; Câm. Dep. seus componentes; GODINHO, V.\nConstituintes.\n\n \n","ref":"FONTES: CÂM. DEP. Deputados; Câm. Dep. seus componentes; GODINHO, V.\nConstituintes.\n\n \n","dic":"DHBB"}
