{"title":"MERGULHÃO, Benedito","cargoss":["Deputado federal"],"cargos_esp":[0],"datas_ini":[1951],"datas_fim":[1955],"estados":["DF"],"autor":[0],"content":"**MERGULHÃO, Benedito**\n\n\\*jornalista; dep. fed. DF 1951-1955.\n\n \n\n*Benedito Mansos Mergulhão* nasceu no Rio de Janeiro, então Distrito\nFederal, em 21 de maio de 1901, filho do comerciante Eduardo Augusto\nMergulhão e de Adelina Costa Mergulhão.\n\nBacharelou-se em ciências e letras em 1929. Exerceu as funções de\njornalista e tipógrafo, foi um dos fundadores do jornal *A Vanguarda* e\nredator do diário *A Noite*. Enquanto comentarista político dirigiu o\nprograma *Astros* e ostras nas rádios *Cruzeiro* *do* *Sul* e *Mayrink\nVeiga*.\n\nIniciou sua vida política elegendo-se em janeiro de 1947 vereador à\nCâmara Municipal do Distrito Federal na legenda do Partido Republicano\n(PR). Contudo, no ano seguinte renunciou ao seu mandato e assumiu a\ndiretoria da Divisão de Rádio da Agência Nacional. No pleito de 1950\nelegeu-se primeiro suplente de deputado federal pelo Distrito Federal na\nlegenda do Partido Trabalhista Brasileiro (PTB), tomando posse em março\nde 1951. Em 1954 tornou-se funcionário do Instituto Brasileiro do Café\n(IBC), onde chegaria ao cargo de diretor. No pleito de outubro deste\nano, tentou a reeleição, pela legenda do PTB, não sendo bem-sucedido. Ao\nfinal da legislatura, em janeiro de 1955, deixou a Câmara dos Deputados,\nnão voltando a concorrer a cargos públicos eletivos.\n\nFoi também subdiretor da Renda Mercantil.\n\nFaleceu em 25 de setembro de 1966, na cidade do Rio de Janeiro.\n\nEra casado com Ondina Verol Mergulhão, com quem teve três filhos.\n\nPublicou *Filosofia de um caipora*, *Salamaleques e pontapés*, *Ramo de\nurtiga*, *Maridos transviados*, *As mulheres não querem amor*, *A hora H\ndo café*, *A santa inquisição do café*, O *general café na revolução\nbranca de 1937*, *O homem caiu do céu*, *Olho de Moscou*, *O bagageiro\nde Stalin* e *O drama de Denise* (1963).\n\n \n\nFONTES: CÂM. DEP. *Deputados*; CÂM. DEP. *Deputados brasileiros*\n(1946-1967); INF. Fernando Mergulhão.\n\n \n","ref":"FONTES: CÂM. DEP. *Deputados*; CÂM. DEP. *Deputados brasileiros*\n(1946-1967); INF. Fernando Mergulhão.\n\n \n","dic":"DHBB"}
