{"title":"MIBIELLI, Pedro Afonso","cargoss":["Ministro do Supremo Tribunal Federal"],"cargos_esp":[0],"datas_ini":[1912],"datas_fim":[1931],"estados":[0],"autor":[0],"content":"**MIBIELLI, Pedro Afonso**\n\n\\*magistrado; min. STF 1912-1931.\n\n* *\n\n*Pedro Afonso Mibielli* nasceu em Encruzilhada do Sul (RS) no dia 6 de\njulho de 1866, filho de Afonso Mibielli da Fontoura e de Leopoldina\nPrates da Fontoura.\n\nCursou a Faculdade de Direito de São Paulo, por onde se formou em\ndezembro de 1886 em ciências jurídicas e sociais.\n\nIniciou sua vida profissional em 1887 como promotor público em\nUruguaiana (RS). Em dezembro de 1890 foi nomeado juiz de direito em\nItaqui (RS). Exerceu a mesma função em Uruguaiana até 1903, quando foi\nremovido para Porto Alegre, onde integrou o Tribunal de Relação do\nEstado e chefiou a polícia gaúcha.\n\nNomeado ministro do Supremo Tribunal Federal (STF) em outubro de 1912,\nassumiu o cargo no mês seguinte. Após a Revolução de 1930, foi\naposentado discricionariamente, junto com mais cinco magistrados, em\nfevereiro de 1931.\n\nFoi deputado à Assembléia Legislativa do Rio Grande do Sul em duas\noportunidades. Foi também professor da Faculdade de Direito de Porto\nAlegre e, como jornalista, redator de O Republicano e de O 14 de Julho,\nperiódicos de Uruguaiana.\n\nFaleceu no Rio de Janeiro, então Distrito Federal, no dia 8 de setembro\nde 1945.\n\n \n\n \n\nFONTES: BALEEIRO, A. Supremo; CONSULT. MAGALHÃES, B.; COSTA, E. Grandes;\nGrande encic. Delta; LAGO, L. Supremo; MACEDO, R. Efemérides; MELO, L.\nEfemérides; SILVA, H. 1931.\n\n \n","ref":"FONTES: BALEEIRO, A. Supremo; CONSULT. MAGALHÃES, B.; COSTA, E. Grandes;\nGrande encic. Delta; LAGO, L. Supremo; MACEDO, R. Efemérides; MELO, L.\nEfemérides; SILVA, H. 1931.\n\n \n","dic":"DHBB"}
