{"title":"MIGUEL, Nazir","cargoss":["Deputado federal"],"cargos_esp":[0],"datas_ini":[1967],"datas_fim":[1971],"estados":["SP"],"autor":[0],"content":"**MIGUEL, Nazir**\n\n\\*dep. fed. SP 1967-1971.\n\n \n\n*Nazir Miguel* nasceu em Conceição de Aparecida (MG) no dia 19 de\noutubro de 1922, filho de Abrão Jorge Miguel e de Suria Abrão.\n\nDiplomou-se em medicina pela Faculdade de Ciências Médicas do Rio de\nJaneiro.\n\nLigado ao Partido Social Democrático (PSD), foi vereador à Câmara\nMunicipal de São Paulo a partir de 1959, sendo reeleito em novembro de\n1962. Com a extinção dos partidos políticos pelo Ato Institucional nº 2\n(27/10/1965) e a posterior instauração do bipartidarismo, filiou-se à\nAliança Renovadora Nacional (Arena). No pleito de novembro de 1966,\nelegeu-se deputado federal por seu estado na legenda desse partido,\niniciando o mandato em fevereiro de 1967, tão logo deixou a Câmara\nMunicipal paulistana. Tentou a reeleição no pleito de novembro de 1970,\nmas obteve apenas uma suplência. Encerrando seu mandato anterior em\njaneiro de 1971, não mais voltou à Câmara Federal.\n\nFaleceu na cidade de São Paulo no dia 13 de março de 1980, quando\nexercia a função de médico do Tribunal de Contas do município.\n\nEra casado com Dulce Maria Pinheiro de Miguel, de quem teve dois filhos.\n\n \n\n \n\nFONTES: CÂM. DEP. Deputados; CÂM. DEP. Deputados brasileiros. Repertório\n(6); Folha de S. Paulo (13/3/80); TRIB. SUP. ELEIT. Dados (8 e 9).\n\n \n","ref":"FONTES: CÂM. DEP. Deputados; CÂM. DEP. Deputados brasileiros. Repertório\n(6); Folha de S. Paulo (13/3/80); TRIB. SUP. ELEIT. Dados (8 e 9).\n\n \n","dic":"DHBB"}
