{"title":"MILHOMEM, Gumercindo","cargoss":["Constituinte","Deputado federal"],"cargos_esp":[0,0],"datas_ini":[1987,1987],"datas_fim":[1988,1991],"estados":[0,"SP"],"autor":[0],"content":"**MILHOMEM, Gumercindo**\n\n\\*const. 1987-1988; dep. fed. SP 1987-1991.\n\n*Gumercindo de Sousa Milhomem Neto* nasceu em Imperatriz (MA) no dia 27\nde novembro de 1949, filho de Nestor Gomes de Abreu Milhomem e de Clara\nAraújo Milhomem.\n\nDe 1969 a 1976 cursou geografia na Universidade de São Paulo (USP),\ntornando-se em 1978 professor dessa disciplina na rede estadual de\nensino. Fundador do Partido dos Trabalhadores (PT) em 1980, no ano\nseguinte elegeu-se presidente da Associação dos Professores do Ensino\nOficial do Estado de São Paulo (APEOESP), cargo que ocupou por três\nvezes consecutivas até 1986.\n\nEm novembro desse ano concorreu a uma vaga de deputado federal\nconstituinte. Eleito, foi empossado em fevereiro, quando se iniciaram os\ntrabalhos da Assembléia Nacional Constituinte. Líder da bancada do PT na\nCâmara, participou dos trabalhos constituintes como membro titular da\nSubcomissão do Poder Executivo, da Comissão da Organização dos Poderes e\nSistema de governo, e como suplente da Subcomissão da Educação, Cultura\ne Esportes, da Comissão da Família, da Educação, Cultura e Esportes, da\nCiência e Tecnologia e da Comunicação.\n\nNas principais votações da Constituinte pronunciou-se a favor do\nrompimento de relações diplomáticas com países com política de\ndiscriminação racial, da limitação do direito de propriedade privada, do\nmandado de segurança coletivo, do aborto, da estabilidade no emprego, da\njornada semanal de 40 horas, do turno ininterrupto de seis horas, do\naviso prévio proporcional, da pluralidade sindical, da soberania\npopular, do voto aos 16 anos, do presidencialismo, da nacionalização do\nsubsolo, da estatização do sistema financeiro, do limite de 12% ao ano\npara os juros reais, da proibição do comércio de sangue, da limitação\npara os encargos da dívida externa, da criação de um fundo de apoio à\nreforma agrária, da legalização do jogo do bicho, da anistia aos micro e\npequenos empresários e da desapropriação da propriedade produtiva. Votou\ncontra a pena de morte e o mandato de cinco anos para o presidente José\nSarney. Após a promulgação da nova Carta Constitucional em 5 de outubro\nde 1988, voltou a participar dos trabalhos legislativos ordinários na\nCâmara dos Deputados.\n\nCandidato à reeleição em outubro de 1990, obteve uma suplência\nencerrando o mandato em janeiro de 1991. Assessor da prefeita de São\nPaulo, Luísa Erundina, foi candidato a vice-prefeito em chapa encabeçada\npelo senador Eduardo Suplicy nas eleições municipais de outubro de 1992.\nEmbora os candidatos do PT tenham chegado ao segundo turno, acabaram\nsendo derrotados pelo candidato do Partido Progressista Reformador\n(PPR), Paulo Maluf.\n\nFoi ainda diretor da Estudo, Estratégia e Informação.\n\nDivorciado de Margarete Eliane Costa, com ela teve um filho.\n\nFONTES: CÂM. DEP.*****Deputados brasileiros. Repertório*\n(1987-1991);**INF. BIOG.;*Jornal do Brasil* (25/6/92).\n\n \n","ref":"FONTES: CÂM. DEP.*****Deputados brasileiros. Repertório*\n(1987-1991);**INF. BIOG.;*Jornal do Brasil* (25/6/92).\n\n \n","dic":"DHBB"}
