{"title":"MINAHIM, Menandro","cargoss":["Deputado federal"],"cargos_esp":[0],"datas_ini":[1975],"datas_fim":[1983],"estados":["BA"],"autor":[0],"content":"**MINAHIM, Menandro**\n\n\\*dep. fed. BA 1975-1983.\n\n \n\n*Menandro José Minahim* nasceu em Salvador no dia 27 de março de 1919,\nfilho de Samuel Minahim e de Almerinda Lima Minahim.\n\nGraduou-se pela Faculdade de Medicina da Bahia em 1940. Médico do\nServiço Social da Indústria (Sesi), iniciou sua carreira política\ntornando-se prefeito de Serrinha (BA) em 1946, e de Jaguaquara (BA) em\n1951. No pleito de outubro de 1954 elegeu-se deputado à Assembléia\nLegislativa baiana na legenda do Partido Democrata Cristão (PDC),\nassumindo o mandato em fevereiro de 1955. Reeleito em outubro de 1958 e\nde 1962, foi primeiro-vice-presidente e líder do PDC na Assembléia. Com\na extinção dos partidos políticos pelo Ato Institucional nº 2\n(27/10/1965) e a posterior instauração do bipartidarismo, filiou-se à\nAliança Renovadora Nacional (Arena), partido de sustentação do regime\nmilitar instalado no país em abril de 1964, voltando a eleger-se\ndeputado estadual nessa legenda em novembro de 1966. Em sua atividade\nparlamentar foi ainda primeiro-vice-presidente da mesa diretora e\npresidente da Comissão de Educação e Cultura da Assembléia baiana.\n\nEm setembro de 1970 foi eleito, indiretamente, vice-governador da Bahia,\nna chapa encabeçada por Antônio Carlos Magalhães. Em janeiro do ano\nseguinte encerrou seu mandato na Assembléia. Em março assumiu o cargo de\nvice-governador e, como tal, presidiu a Comissão Estadual do\nSesquicentenário da Independência do Brasil. Em 1973, representou o\ngoverno baiano na investidura cardinalícia de dom Avelar Brandão Vilela,\nem Roma.\n\nNo pleito de novembro de 1974 elegeu-se deputado federal pela Bahia na\nlegenda da Arena, assumindo o mandato em fevereiro do ano seguinte.\nDurante essa legislatura, foi vice-presidente da Comissão Especial da\nBacia do São Francisco, membro da Comissão de Educação e Cultura e\nsuplente da Comissão de Agricultura e Política Rural. Reelegendo-se em\nnovembro de 1978, tornou-se presidente do diretório regional da Arena na\nBahia, membro da Comissão de Saúde e suplente das comissões do Interior\ne de Educação e Cultura. Com a extinção do bipartidarismo em 29 de\nnovembro de 1979 e a conseqüente reformulação partidária, filiou-se ao\nPartido Democrático Social (PDS), agremiação situacionista que sucedeu à\nArena. Concluiu seu mandato em janeiro de 1983.\n\nFaleceu em junho de 1996.\n\nEra casado com Isete Monteiro de Almeida Minahim, com quem teve uma\nfilha.\n\n \n\nFONTES: CÂM. DEP. *Deputados*; CÂM. DEP. *Deputados brasileiros.\nRepertório* (1975-1979 e 1979-1983); IPC. *Relação*; NÉRI S. *16*;\n*Perfil* (1980); TRIB. SUP. ELEIT. *Dados* (3, 4, 6 e 8).\n\n \n","ref":"FONTES: CÂM. DEP. *Deputados*; CÂM. DEP. *Deputados brasileiros.\nRepertório* (1975-1979 e 1979-1983); IPC. *Relação*; NÉRI S. *16*;\n*Perfil* (1980); TRIB. SUP. ELEIT. *Dados* (3, 4, 6 e 8).\n\n \n","dic":"DHBB"}
