{"title":"MIRANDA, Décio Meireles de","cargoss":["Procurador-geral da República","Ministro do Supremo Tribunal Federal"],"cargos_esp":[0,0],"datas_ini":[1967,1978],"datas_fim":[1969,1985],"estados":[0,0],"autor":[0],"content":"**MIRANDA, Décio Meireles de**\n\n\\*proc.-geral Rep. 1967-1969; min. STF 1978-1985.\n\n \n\n*Décio Meireles de Miranda* nasceu em Belo Horizonte no dia 26 de junho\nde 1916, filho de José Ribeiro de Miranda e de Nair Meireles de Miranda.\nSeu pai foi um advogado de renome na cidade mineira de Carangola durante\na Primeira República.\n\nEm 1933, iniciou o curso jurídico na Faculdade de Direito da\nUniversidade de Minas Gerais, vindo a concluí-lo na Faculdade Nacional\nde Direito da Universidade do Brasil em 1937. Logo a seguir passou ao\nexercício da advocacia, atuando em causas no foro do Rio de Janeiro,\nentão Distrito Federal. Em 1943, tornou-se membro efetivo do Instituto\ndos Advogados do Brasil (IAB), vindo a tornar-se segundo-secretário na\ngestão de Trajano de Miranda Valverde. No período 1949-1950 e 1951-1952,\nfoi membro do Conselho da Ordem dos Advogados do Brasil (OAB), seção do\nDistrito Federal, e da Comissão de Disciplina do mesmo Conselho, durante\nas gestões de Alcino Salazar e Jorge Diott Fontenelle. A partir de 1953,\ntornou-se membro do Conselho Superior do IAB.\n\nEm 1960, integrou a comissão examinadora do último concurso para\njuiz-substituto no Distrito Federal, realizado no Rio de Janeiro. Em\nabril desse mesmo ano, com a transferência da Capital Federal para\nBrasília, as instituições de representação dos advogados tiveram que\nmudar-se para a nova capital por força de dispositivos contidos nos seus\nregimentos. Inaugurada a seção da OAB no novo Distrito Federal, Décio\nMiranda passou a integrar seu Conselho Superior.\n\nEm outubro de 1961, tornou-se presidente do referido Conselho,\npermanecendo nesse cargo até o ano seguinte. Entre 1962 e 1963, foi\nprocurador designado ad hoc, por decisão do procurador-geral da\nRepública. Em 1964, integrou a comissão de redação do Tribunal Superior\nEleitoral (TSE), encarregada do ante-projeto de Código Eleitoral. Em\n1967, foi nomeado procurador-geral da República pelo presidente Artur da\nCosta e Silva, segundo general a assumir a presidência desde o movimento\npolítico-militar que derrubou o presidente João Goulart em abril de\n1964. Permaneceu nesse cargo até o ano de 1969.\n\nTomou posse no Tribunal Federal de Recursos (TFR) em 1970, por indicação\ndo presidente Emílio Garrastazu Médici (1969-1974). Permanecendo neste\ncargo até maio de 1978, foi indicado para o Supremo Tribunal Federal\n(STF) pelo presidente Ernesto Geisel (1974-1979). Depois de examinado\npelo Senado, tomou posse em junho desse mesmo ano.\n\nEm agosto de 1984, assumiu a presidência do TSE. Sob sua gestão o\ntribunal decidiu que não seria obrigatória a fidelidade partidária para\neleição, por via indireta, do presidente da República no Colégio\nEleitoral de janeiro de 1985. Tal decisão possibilitou que parlamentares\nda legenda governista, o Partido Democrático Social (PDS), votassem no\ncandidato da oposição, dado fundamental para a vitória de Tancredo\nNeves, candidato lançado pela coligação oposicionista Aliança\nDemocrática, sobre o candidato oficial, Paulo Maluf. Com a doença de\nTancredo antes de tomar posse em 15 de março, o vice eleito, José\nSarney, foi empossado provisoriamente na presidência. Morto Tancredo em\n21 de abril, abriu-se uma discussão sobre a possibilidade de Sarney ser\nconfirmado na presidência. Tendo o TSE se manifestado favoravelmente à\nposse, Sarney assumiu a presidência ainda em abril.\n\nEm setembro de 1985, em decorrência de sua aposentadoria, Décio Meireles\nde Miranda deixou o STF e a presidência do TSE, passando a advogar em\nBrasília até 1994, quando, por motivo de doença, afastou-se de todas as\natividades profissionais.\n\nFaleceu em Brasília no dia 12 de março de 2000.\n\nEra casado com Maria Alice Moura Costa de Miranda, com quem teve duas\nfilhas.\n\n \n\nFONTES: INF. FAM.; *Jornal do Brasil* (18/3/00); SUP. TRIB. FED.\n*Dados*.\n\n \n","ref":"FONTES: INF. FAM.; *Jornal do Brasil* (18/3/00); SUP. TRIB. FED.\n*Dados*.\n\n \n","dic":"DHBB"}
