{"title":"ARCHER, Remi   ","cargoss":["Senador","Senador","Senador","Senador","Senador"],"cargos_esp":[0,0,0,0,0],"datas_ini":[1962,1961,1959,1958,1955],"datas_fim":[1962,1961,0,0,1957],"estados":["MA","MA","MA","MA","MA"],"autor":[0],"content":"**ARCHER, Remi   **\n\n\\*sen. MA 1955-1957, 1958, 1959, 1961 e 1962.\n\n* *\n\n*Remi Bayma Archer da Silva* nasceu em São Luís no dia 5 de julho de\n1914, filho de Sebastião Archer da Silva e de Maria José Bayma Archer da\nSilva. Seu pai foi governador do Maranhão de 1947 a 1951 e senador de\n1955 a 1971. Seu irmão Renato Archer foi deputado federal por esse\nestado de 1955 a 1968, quando foi cassado, ministro da Ciência e\nTecnologia de 1985 a 1987 e da Previdência Social de 1987 a 1988.\n\nRemi Archer fez o curso primário na Escola Modelo Benedito Leite, em sua\ncidade natal, e o secundário no Colégio Antônio Vieira, na Bahia. Em\n1938 formou-se engenheiro civil pela Escola Politécnica do Rio de\nJaneiro, na capital da República, e especializou-se nas áreas de\nconstrução civil e de estradas de ferro, tendo trabalhado ainda na\nindústria têxtil.\n\nEm 1942 foi nomeado diretor da Estrada de Ferro Central do Piauí e em\n1943 da Estrada de Ferro São Luís-Teresina, tendo ocupado\nconcomitantemente os dois cargos até 1945. Desse ano a 1946 foi diretor\nda Estrada de Ferro Bragança e, em 1947, dirigiu a Viação Férrea Federal\nLeste Brasileiro. Ainda em 1947 assumiu a presidência do Instituto de\nAposentadoria e Pensões dos Comerciários (IAPC), cargo que exerceu até\n1951.\n\nNo pleito de outubro de 1954 foi eleito suplente de seu pai, que\nconquistou uma cadeira no Senado pelo Maranhão, na legenda do Partido\nSocial Democrático (PSD). Assumiu o mandato de senador de agosto de 1955\na janeiro de 1956, de julho seguinte a fevereiro de 1957, de maio a\nagosto desse mesmo ano, de junho a novembro de 1958 e de agosto a\nsetembro de 1959.\n\nRecém-empossado na presidência do Banco da Amazônia, em dezembro de 1959\nviajava no avião da Panair que foi seqüestrado por um grupo de militares\nparticipantes da Revolta de Aragarças (GO), movimento desencadeado em\nprotesto contra os rumos políticos do governo de Juscelino Kubitschek.\nLibertado em Buenos Aires ao final da revolta, retornou ao Brasil, tendo\nocupado a presidência do banco até 1960.\n\nNovamente convocado para assumir o mandato de senador de abril a julho e\nde setembro a outubro de 1961 e de julho a novembro de 1962, durante seu\nperíodo no Senado foi membro das comissões de Serviço Público, da\nEconomia, de Legislação Social, de Relações Exteriores, de Redação e\nEspecial de Reforma Administrativa. Foi o autor do substitutivo sobre a\ntransformação das estradas de ferro da União em sociedades anônimas,\naprovado pelo Congresso.\n\nComo empresário, foi dono de fábricas de óleos de babaçu e de algodão.\nFoi ainda presidente do Banco Nacional de Crédito Cooperativo (BNCC) e\ndo Conselho Rodoviário do Maranhão, bem como fiscal, designado pelo\nDepartamento Nacional de Estradas de Ferro, da construção de locomotivas\nencomendadas pelo governo brasileiro à empresa norte-americana Baldwin\nLocomotive Works.\n\nFaleceu em Petrópolis (RJ) no dia 1º de junho de 1997.\n\nEra casado****com Léia de Castro Figueiredo Archer, com quem teve três\nfilhos.\n\n \n\nFONTES: CARNEIRO, G. *História*; *Globo* (2/6/97); *Grande encic.\nDelta*; SENADO. *Dados*; SENADO. *Relação*; TRIB. SUP. ELEIT. *Dados*\n(3).\n\n \n\n \n","ref":"FONTES: CARNEIRO, G. *História*; *Globo* (2/6/97); *Grande encic.\nDelta*; SENADO. *Dados*; SENADO. *Relação*; TRIB. SUP. ELEIT. *Dados*\n(3).\n\n \n\n \n","dic":"DHBB"}
