{"title":"MOACIR, Antônio Pereira da Silva","cargoss":["Senador"],"cargos_esp":[0],"datas_ini":[1947],"datas_fim":[1951],"estados":["BA"],"autor":[0],"content":"**MOACIR, Antônio Pereira da Silva**\n\n\\*sen. BA 1947-1951.\n\n \n\n*Antônio Pereira da Silva Moacir* nasceu em Riacho de Santana (BA) no\ndia 14 de abril de 1880, filho de João Pereira da Silva e de Maria\nAmélia Pereira da Silva.\n\nFormou-se em medicina e farmácia pela Faculdade de Medicina e\nFarmacologia da Bahia em dezembro de 1900, defendendo tese sobre\noftalmologia. Durante este curso, foi interno em diversos hospitais,\nentre os quais o Hospital de Sangue de Canudos, região que, àquela\naltura, virara palco de um sangrento conflito envolvendo sertanejos,\nliderados pelo líder messiânico Antônio Conselheiro, e tropas dos\ngovernos federal e estadual.\n\nDepois de formado, exerceu medicina geral por cerca de dez anos na\nregião do rio São Francisco, especialmente na cidade de Bom Jesus da\nLapa (BA). Por conta deste seu trabalho nesta região, foi eleito\ndeputado estadual, senador estadual e deputado federal em duas ocasiões,\ndurante a Primeira República (1889-1930).\n\nCom a Revolução de 1930, afastou-se da política, só voltando a se\ndedicar a essa atividade em 1945, após o fim do Estado Novo e a\ndeposição de Getúlio Vargas. Nestes 15 anos de afastamento, Antônio\nMoacir dedicou-se a atividades comerciais relacionadas com a compra e\nvenda de algodão. Nesta época, chegou a ser o maior comprador do produto\nno eixo Norte-Nordeste, convertendo-se num grande exportador,\nprincipalmente para a Inglaterra. No início da década de 1940 tornou-se\npresidente da bolsa de mercadorias da Bahia. Ainda na primeira metade\ndesta década, assumiu a Superintendência da Comissão de Abastecimento da\nBahia.\n\nCom a redemocratização do país em 1946, Antônio Pereira da Silva Moacir\nretornou à política, sendo convidado pelo interventor federal na Bahia,\ngeneral Renato Onório Pinto Aleixo, para organizar o PSD (Partido Social\nDemocrático) neste estado. Neste último ano, tornou-se secretário-geral\ndo PSD da Bahia, cargo que ocuparia até 1948. No pleito suplementar de\njaneiro de 1947 elegeu-se senador pela Bahia, na legenda do Partido\nSocial Democrático (PSD). Assumiu o mandato em abril do mesmo ano, e\ndurante sua permanência no Senado (até janeiro de 1951) integrou, entre\noutras, a Comissão de Saúde e foi vice-presidente da comissão especial\nde inquérito sobre a indústria têxtil.\n\nCandidatou-se a deputado federal pelo mesmo estado no pleito de outubro\nde 1950, na legenda Coligação Baiana, que reunia o PSD, o Partido de\nRepresentação Popular (PRP) e o Partido Social Trabalhista (PST).\nConquistando apenas uma suplência, afastou-se da vida parlamentar.\n\nEm 1951 foi convidado pelo então presidente da República, general Eurico\nGaspar Dutra (1946-1951), para assumir a presidência do Instituto de\nCacau da Bahia. Permaneceu neste cargo até 1955, quando foi afastado por\nAntônio Balbino, recém-empossado no governo da Bahia. Desta data em\ndiante não mais desempenhou cargos públicos.\n\nFoi ainda membro do conselho consultivo do Banco do Nordeste.\n\nFaleceu em Salvador no dia 5 de dezembro de 1966.\n\nEra casado com Maria Rosa de Moncorvo Moacir, com quem teve uma filha.\nSeu sogro, Álvaro Tibério de Moncorvo Lima, foi presidente da província\nda Bahia no Segundo Império.\n\n \n\nFONTES: CÂM. DEP. Deputados; INF. Angelita Pereira da Silva Moacir;\nSENADO. *Dados*; SENADO. *Relação*; TRIB. SUP. ELEIT. *Dados* (2).\n\n \n","ref":"FONTES: CÂM. DEP. Deputados; INF. Angelita Pereira da Silva Moacir;\nSENADO. *Dados*; SENADO. *Relação*; TRIB. SUP. ELEIT. *Dados* (2).\n\n \n","dic":"DHBB"}
