{"title":"MOLETTA, Aroldo","cargoss":["Deputado federal"],"cargos_esp":[0],"datas_ini":[1979],"datas_fim":[1987],"estados":["PR"],"autor":[0],"content":"**MOLETTA, Aroldo**\n\n\\*dep. fed. PR 1979-1987.\n\n \n\n*Aroldo José Moletta* nasceu em Palmeira (PR) no dia 14 de junho de\n1936, filho de Deraldo Sebastião Moletta e de Judite Carbonar Moletta.\n\nFazendeiro, foi chefe do escritório regional do Instituto Brasileiro de\nReforma Agrária (IBRA) em Guarapuava (PR) de 1966 a 1968. Neste último\nano, tornou-se assistente geral do Centro Regional de Cadastro e\nTributação, com sede em Porto Alegre e jurisdição no Paraná, em Santa\nCatarina e no Rio Grande do Sul. Formou-se pela Faculdade de Ciências\nEconômicas do Paraná, em 1969. Foi ainda chefe do Centro Estadual de\nCadastro e Tributação do IBRA, em 1971; membro do Conselho Municipal da\nAgricultura de Guarapuava, de 1971 a 1972; coordenador regional do\nInstituto Nacional de Colonização e Reforma Agrária (INCRA), de 1974 a\n1978; membro do Conselho Administrativo da Associação de Crédito e\nAssistência Rural do Paraná, de 1974 a 1978, e do Conselho de\nAdministração do Instituto de Terras e Cartografia do Paraná, de 1977 a\n1978.\n\nNo pleito de novembro de 1978, concorreu a uma vaga na Câmara dos\nDeputados na legenda da Aliança Renovadora Nacional (Arena), partido de\nsustentação ao regime militar instaurado no país em abril de 1964. Como\nobteve a segunda suplência, assumiu o mandato em 1980, em virtude do\nafastamento do titular Arnaldo Busatto, por motivo de saúde, e da morte\ndo primeiro suplente, Mário Stamm. Quando ocupou sua cadeira na Câmara\njá havia se filiado ao Partido do Movimento Democrático Brasileiro\n(PDMB), criado com a extinção do bipartidarismo, em novembro de 1979, e\na posterior reorganização partidária.\n\nNessa legislatura foi membro da Comissão de Agricultura e Política Rural\ne da comissão parlamentar de inquérito das tarifas dos serviços públicos\nde transporte coletivo urbano. Reeleito deputado federal em novembro de\n1982, na legenda peemedebista, tomou posse em fevereiro do ano seguinte.\n\nEm 25 de abril de 1984, votou a favor da emenda Dante de Oliveira,\napresentada na Câmara dos Deputados, que propunha o restabelecimento das\neleições diretas para presidente da República em novembro daquele ano.\nComo a emenda não obteve o número de votos necessários para aprovação —\nfaltaram 22 para que o projeto pudesse ser apreciado pelo Senado —,\nAroldo Moletta votou no oposicionista Tancredo Neves no Colégio\nEleitoral, reunido em 15 de janeiro de 1985. Tancredo foi eleito\npresidente da República na legenda da Aliança Democrática, união do PMDB\ncom a dissidência do PDS abrigada na Frente Liberal, que derrotou o\ncandidato do regime militar, Paulo Maluf. Por motivo de doença, Tancredo\nnão chegou a ser empossado na presidência e faleceu em 21 de abril de\n1985. Seu substituto no cargo foi o vice José Sarney, que já o exercia\ninterinamente desde 15 de março daquele ano.\n\nAroldo Moletta não concorreu à reeleição no pleito de novembro de 1986 e\ndeixou a Câmara dos Deputados em janeiro de 1987. Em seguida, como era\nfuncionário de carreira do INCRA, assumiu, ainda em 1987, a\nsuperintendência do órgão no Paraná, cargo que ocupou até 1989, quando\nse aposentou. Desde então, passou a se dedicar a atividades\nagropecuárias em sua propriedade em Piraquara, na região metropolitana\nde Curitiba.\n\nFaleceu em Curitiba no dia 9 de novembro de 2007.\n\nEra casado com Dulcirene Montanha Moletta, com quem teve três filhos.\n\n \n\nFONTES: CÂM. DEP. Deputados brasileiros. Repertório (1983-1987); INF.\nBIOG.\n\n \n","ref":"FONTES: CÂM. DEP. Deputados brasileiros. Repertório (1983-1987); INF.\nBIOG.\n\n \n","dic":"DHBB"}
