{"title":"MONDIM, Guido","cargoss":["Deputado federal","Deputado federal","Senador","Ministro do Tribunal de Contas","Presidente de associação ou confederação de empregados ou empregadores"],"cargos_esp":[0,0,0,0,"TCU"],"datas_ini":[1958,1956,1959,1975,1978],"datas_fim":[1958,1956,1975,1978,1982],"estados":["RS","RS","RS",0,0],"autor":[0],"content":"**MONDIM, Guido**\n\n\\* dep. fed. RS 1956 e 1958; sen. RS 1959-­1975; min. TCU 1975-1978;\npres. TCU 1978-1982.\n\n \n\n*Guido Fernando Mondim*nasceu em Porto Alegre no dia 6 de maio de 1912,\nfilho de Guido Mondim e de Romana Ongarato Mondim.\n\nCursou o primário no Colégio São João Batista de la Salle, em Porto\nAlegre, interrom­pendo os estudos em 1924 para trabalhar. In­gressou\ndepois no curso de guarda-livros do Instituto Isael Torres Barcelos, que\nconcluiu em 1928. Foi aluno da Escola Técnica de Co­mércio de Porto\nAlegre e diplomou-se conta­dor pelo Instituto Comercial do Sindicato dos\nEmpregados no Comércio, formando-se mais tarde em ciências políticas e\neconômicas pela Pontifícia Universidade Católica (PUC) de Porto Alegre.\nNessa época cursou ainda o Instituto de Belas-Artes.\n\nIniciou sua vida política em outubro de 1950, elegendo-se deputado\nestadual na le­genda do Partido de Representação Popular (PRP). Assumiu\no mandato em fevereiro do ano seguinte e, nessa legislatura, foi\npresidente da Comissão de Obras Públicas, membro da Comissão de Finanças\ne líder de sua bancada na Assembléia Legislativa do Rio Grande do Sul.\nCandidatando-se a deputado federal pelo seu estado natal em outubro de\n1954, na legenda do PRP, obteve a primeira suplência. Deixando a\nAssembléia Legislativa em janeiro de 1955, foi eleito vice-prefeito de\nCaxias do Sul (RS) nesse mesmo ano, exerceu o manda­to na Câmara dos\nDeputados de março a maio de 1956 e o cargo de prefeito municipal de\n1957 a 1958. Novamente convocado, assumiu as atividades parlamentares em\njulho desse úl­timo ano, permanecendo no exercício do mandato até o mês\nseguinte. Como deputado, participou de inúmeras viagens em missões e\nintercâmbios culturais a países da Europa e América Latina.\n\nNo pleito de outubro de 1958, elegeu-se para o Senado Federal pelo Rio\nGrande do Sul, com o apoio da coligação formada pelo PRP e o Partido\nTrabalhista Brasileiro (PTB). Iniciando o mandato em fevereiro de 1959,\nfoi eleito, no ano seguinte, membro suplente da mesa diretora. Em 1960,\nparticipou, como delegado do Brasil, da Conferência Interparlamentar\nrealizada na Grécia.****Exerceu, em 1962, a vice-­liderança de sua\nbancada e, de 1964 a 1965, as funções de quarto-secretário da Comissão\nDiretora do Senado Federal. Nessa legjslatu­ra, integrou ainda as\ncomissões de Economia, de Serviço Público Civil e de Finanças. Foi\npresidente do diretório regional gaúcho e do diretório municipal de\nPorto Alegre do PRP.****Ainda como delegado brasileiro, compareceu à\nConferência Interparlamentar na Iugoslávia, em 1963.\n\nCom a extinção dos partidos políticos pelo Ato institucional n° 2\n(27/10/1965) e o pos­terior estabelecimento do bipartidarismo, ingressou\nna Aliança Renovadora Nacional (Arena), partido de sutentação do regime\nmilitar instaurado no país em março de 1964. Candidato à reeleição para\no Senado em novembro de 1966 na legenda da Arena, derrotou seu oponente\ndo Movimento Demo­crático Brasileiro (MDB), Siegfried Henser. Nessa\nlegislatura foi vice-líder da Arena e do governo federal e\nterceiro-secretário da mesa do Se­nado. Foi também vice-presidente da\nComis­são de Educação e Cultura; membro efetivo das comissões do\nDistrito Federal, dos Estados para Alienação e Concessão de Terras\nPú­blicas e Povoamento e de Legislação Social; e suplente das comissões\nde Minas e Energia, de Relações Exteriores, de Transportes,\nComu­nicações e Obras Públicas e de Constituição e Justiça. Além disso,\nsubstituiu o senador Flá­vio Brito na Comissão Mista do Congresso\nen­carregada de dar parecer sobre o projeto de lei referente ao Estatuto\ndos Militares.****Em 1967, foi delegado à Conferência de Governos Locais\nna Tailândia e, no ano seguinte, participou de viagem de intercâmbio\ncultural aos Estados Unidos. Em 1972, como delegado do Brasil, também\nparticipou da Conferência Interparlamentar realizada na Itália.\n\nEncerrando seu mandato em janeiro de 1975, em março foi nomeado pelo\npresidente Ernesto Geisel ministro do Tribunal de Contas da União (TCU),\nna vaga decorrente da apo­sentadoria do ministro Amaral Freire. Em 1977,\ntornou-se vice-presidente do TCU e chefiou a delegação brasileira ao\nCongresso Mundial de Instituições Superiores de Fiscalização Financeira,\nno Peru, evento ao qual também estaria presente no seguinte e em 1980 e\n1981. Assumiu a presidência do TCU em 1978, tendo ocupado o cargo até\n1982, data em que se aposentou de suas funções no tribunal, sendo\nsubstituído pelo ministro Ewald Sizenando Pinheiro. A partir de então,\npassou a dedicar-se às artes, em especial à pintura de quadros. Realizou\nvárias exposi­ções, possuindo obras em museus estrangeiros.\n\nTornou-se membro da Academia Brasileira de Arte e presidente da\nAssociação Rio-Grandense de Artes Plásticas. Atuando ainda no campo do\njornalismo e da literatura, foi fundador e diretor do jornal\n*Querer,*diretor do *Boletim* *Rural,*da Federação das Associações\nRurais do Rio Grande do Sul e membro da Associação Brasiliense de\nEscritores e das academias de Letras do Rio Grande do Sul, da Espanha e\nda Argentina.\n\nMondim cursou ainda a Escola Superior de Guerra (ESG), foi presi­dente\ndo Instituto Histórico e Geográfico do Distrito Federal e membro do\nconselho da Fe­deração das Associações Comerciais do Rio Grande do Sul,\ndos conselhos hidroviário e rodoviário do Rio Grande do Sul, do conselho\nda Fundação Educacional do Distrito Federal e do Serviço de Proteção ao\níndio. Foi também presidente da Campal S.A. e da União dos Es­coteiros\ndo Brasil e professor de contabilidade geral na Escola Técnica do\nSindicato dos Em­pregados do Comércio, em Porto Alegre.\n\nFaleceu em 20 de maio de 2000.\n\nFoi casado com Vera Gentz Mondim, com quem teve dois filhos.\n\nPublicou *Plano contábil para associações* *rurais e Manual de\ncontabilidade para o agri*­*cultor,*além de poemas e crônicas.\n\n \n\nFONTES:  CÂM. DEP. *Deputados;*CÂM.  DEP. *Deputados brasileiros*.\n*Repertório*(1946-1967); COUTI­NHO, A. *Brasil; Diário do Congresso\nNacional;* INF. BIOG.; * Jornal do Brasil*(16/10/66; 26/2/75 e\n17/12/76); *Perfil*(1972);*Rev. Ciência Pol.*(66); SENADO.\n*Dados;*SENADO.*Dados biográfico*s;\nSENADO.*Endereços;*SENADO.*Endereços;*SENADO*. Rela­ção*;\nSENADO.*Relação dos líderes; Súmulas;* TCU. *Dados* (1983-1990); TRIB.\nUP.  ELEIT. *Dados*(2, 3, 7 e 8).\n\n \n\n \n","ref":"FONTES:  CÂM. DEP. *Deputados;*CÂM.  DEP. *Deputados brasileiros*.\n*Repertório*(1946-1967); COUTI­NHO, A. *Brasil; Diário do Congresso\nNacional;* INF. BIOG.; * Jornal do Brasil*(16/10/66; 26/2/75 e\n17/12/76); *Perfil*(1972);*Rev. Ciência Pol.*(66); SENADO.\n*Dados;*SENADO.*Dados biográfico*s;\nSENADO.*Endereços;*SENADO.*Endereços;*SENADO*. Rela­ção*;\nSENADO.*Relação dos líderes; Súmulas;* TCU. *Dados* (1983-1990); TRIB.\nUP.  ELEIT. *Dados*(2, 3, 7 e 8).\n\n \n\n \n","dic":"DHBB"}
