{"title":"ARCOVERDE, Valdir","cargoss":["Ministro da Saúde"],"cargos_esp":[0],"datas_ini":[1979],"datas_fim":[1985],"estados":[0],"autor":[0],"content":"**ARCOVERDE, Valdir**\n\n\\*min. Saúde 1979-1985.\n\n \n\n*Valdir Mendes Arcoverde* nasceu em Amarante (PI) em 23 de setembro de\n1932, filho de Miguel Arcoverde Vieira e de Augusta Mendes Arcoverde.\nSeu irmão Dirceu Arcoverde foi governador do Piauí (1975-1978) e senador\npor esse estado (1979).\n\nMudou-se para Curitiba, onde se diplomou em medicina pela Universidade\nFederal do Paraná (Ufpr) em 1959.\n\nEm 1962 tornou-se médico sanitarista no Rio Grande do Sul. Foi também\nmédico do posto de saúde de Aratiba (RS). Fez cursos de pós-graduação em\nplanejamento de saúde na Faculdade de Higiene e Saúde Pública de São\nPaulo, da Universidade de São Paulo (USP), e de atualização em técnicas\nde saúde pública na Escola Nacional de Saúde Pública, no Rio de Janeiro,\nem 1968. Nesse mesmo ano, integrou a equipe da Secretaria de Saúde\ngaúcha, no período em que Jair Soares esteve à frente da pasta, tendo\nsubstituído o secretário em diversas ocasiões. Em 1969, fez outro curso\nde especialização em saúde pública, também na USP. No ano seguinte,\ntornou-se chefe da unidade de planejamento do sul da Fundação Serviço de\nSaúde Pública, do Ministério da Saúde, cargo que ocuparia por vários\nanos. Quando Sinval Guazelli assumiu o governo do Rio Grande do Sul, em\nmarço de 1975, Arcoverde tornou-se secretário estadual de Saúde.\n\nEm janeiro de 1979, Arcoverde tornou-se presidente do Instituto Nacional\nda Previdência Social (INPS), nomeado por Jair Soares, então ministro da\nPrevidência Social no governo do general João Batista Figueiredo\n(1979-1985). Em outubro, substituiu Mário Augusto de Castro Lima no\nMinistério da Saúde. Sua indicação foi mais uma vez associada a Jair\nSoares, seu amigo e correligionário político, bem como à sua amizade com\no ministro da Justiça, o piauiense Petrônio Portela. Segundo avaliação\nda imprensa na época, sua designação era a confirmação da tese de que se\ndeveria escolher nomes do Nordeste para ministérios da área social. Em\nsua posse, fez um balanço da saúde pública, dizendo que pretendia\ninteriorizar as ações básicas nas regiões mais pobres, sobretudo as\nperiferias das grandes cidades e a zona rural. Seu projeto mais\nambicioso era ampliar as redes de saneamento básico e desenvolver um\nprograma de imunização, sobretudo ligado à área de vacinação.\n\nEm abril de 1980, o Ministério de Saúde foi informado de que Albert\nSabin — conceituado imunologista, inventor de uma vacina contra a\nparalisia infantil — viria ao Brasil e que se dispunha a oferecer seus\nserviços, sem qualquer ônus para o governo, tendo em vista a campanha de\nvacinação em massa que as autoridades médicas tencionavam fazer.\nArcoverde aceitou a oferta, informando que Sabin viria na condição de\nassessor. Contudo, Sabin acabou deixando o país sem ter levado a cabo\nnenhum projeto na área de imunologia. Técnicos ligados ao ministério\nafirmaram que Sabin desconhecia a realidade brasileira na proposição dos\nmétodos para levantamento de dados estatísticos dos casos de\npoliomielite. O episódio foi amplamente divulgado pela imprensa e\ncriticado pela oposição do governo Figueiredo e pela comunidade\ncientífica. Arcoverde acabou sendo convocado a comparecer à Câmara,\nainda em abril de 1980, para prestar esclarecimentos. Suas explicações\nsobre a partida de Sabin e os possíveis constrangimentos causados ao\ncientista pelo governo não foram aceitas pelos parlamentares da\noposição, os quais acusaram o Ministério da Saúde de estar defendendo\ninteresses privados e de produzir estatísticas falsas sobre a ocorrência\nde doenças infecciosas e de epidemias.\n\nPouco depois do caso Sabin, Arcoverde reapareceu na imprensa para\ndefender as campanhas de vacinação em massa, afirmando que haveria,\ndentro de cinco anos, sensível melhoria no quadro sanitário. Em janeiro\nde 1981, questionou a obrigatoriedade da renovação, de dois em dois\nanos, do exame de abreugrafia por trabalhadores assalariados, afirmando\nser este um método ineficaz de diagnóstico da tuberculose. Em abril, ao\nfazer balanço sobre a ação de seu ministério, destacou a baixa renda\ncomo uma das principais causas para o problema da saúde. Durante sua\ngestão, iniciaram-se as pesquisas na Fundação Osvaldo Cruz, mediante o\nauxílio de tecnologia japonesa, para a produção de vacina contra\nsarampo. Em dezembro de 1981, ao anunciar esse projeto, destacou a falta\nde verbas da pasta, a de menor orçamento entre os ministérios.\n\nEm setembro de 1984, declarou seu apoio ao ministro Mário Andreazza, que\ndisputava com Paulo Maluf a candidatura à presidência pelo Partido\nDemocrático Social (PDS) e que seria levada ao Colégio Eleitoral em\njaneiro de 1985. Apesar de não ter votos na convenção do partido, o\napoio de Arcoverde foi considerado importante e inesperado. Apesar de\ntodo o ministério ter começado a declarar publicamente o apoio a\nAndreazza, segundo o próprio ministro, sua decisão foi tomada de livre\nconsciência, sem a interferência do presidente Figueiredo, partidário da\ncandidatura de Andreazza.\n\nArcoverde deixou o Ministério da Saúde no fim do governo Figueiredo, em\nmarço de 1985, voltando para o Rio Grande do Sul. Em abril, assumiu um\nposto de assessor do diretor-geral da Organização Pan-Americana de Saúde\n(OPAS), órgão ligado à Organização Mundial de Saúde (OMS).\n\nEm maio de 1990, durante o governo Fernando Collor (1990-1992), o\nministro da Saúde, Alceni Guerra, nomeou-o presidente da Fundação de\nServiços de Saúde Pública e diretor da Superintendência de Campanhas de\nSaúde Pública (Sucam), tendo por principal missão fundir esses órgãos. A\nfusão se efetivou, dando origem à Fundação Nacional de Saúde, da qual\nArcoverde tornou-se presidente. Permaneceu no cargo durante três meses.\nAinda em 1991, retornou à OPAS, tornando-se consultor nacional da\nentidade no Brasil. Nesse mesmo ano, tornou-se presidente da Fundação\nServiços da Saúde Pública.\n\nCasou-se com Deusina Pinheiro Arcoverde, com quem teve três filhos. Seu\nfilho Dirceu Arcoverde casou-se com Adriana Rezek, filha de Francisco\nRezek, ministro do Supremo Tribunal Federal de 1983 a 1990 e de 1992 a\n1997, ministro das Relações Exteriores de 1990 a 1992 e ministro no\nTribunal Internacional de Justiça, em Haia, a partir de março de 1997.\n\nPublicou *40 anos de Saúde Pública: 1942-1982*(1982), *Atenção à Saúde\nno Brasil: contrução e tentativa de árvore de problemas*(co-autoria,\n1995)\n\n* *\n\n*Eduardo Junqueira/Elizabeth Cardoso*\n\n \n\nFONTES: CURRIC. BIOG.; INF. BIOG.\n\n \n","ref":"FONTES: CURRIC. BIOG.; INF. BIOG.\n\n \n","dic":"DHBB"}
