{"title":"MONTEIRO, Rafael de Barros","cargoss":["Ministro do Supremo Tribunal Federal"],"cargos_esp":[0],"datas_ini":[1967],"datas_fim":[1974],"estados":[0],"autor":[0],"content":"**MONTEIRO, Rafael de Barros**\n\n\\*magistrado; min. STF 1967-1974.\n\n \n\n*Rafael de Barros Monteiro* nasceu em Areias (SP), no dia 26 de outubro\nde 1908.\n\nEm 1930 bacharelou-se em ciências jurídicas e sociais pela Faculdade de\nDireito de São Paulo, passando, a seguir, a dedicar-se à advocacia. Em\n1935 ingressou por concurso na magistratura estadual, servindo em várias\ncomarcas do interior até ser nomeado, em 1949, desembargador do Tribunal\nde Justiça de São Paulo. Em 1956 tornou-se professor da Faculdade de\nDireito e da Pontifícia Universidade Católica de São Paulo.\n\nFez parte do Tribunal Regional Eleitoral de seu estado, que presidiu de\n1961 a 1963. Em 1965 foi eleito presidente do Tribunal de Justiça de São\nPaulo, tornando-se, em julho de 1967, ministro do Supremo Tribunal\nFederal (STF), nomeado pelo presidente da República, general Artur da\nCosta e Silva, em substituição ao ministro Pedro Chaves, que se\naposentara.\n\nEm 1971 chegou à vice-presidência do Tribunal Superior Eleitoral (TSE),\ndo qual se tornou presidente em 1973. Em fevereiro do ano seguinte,\nlicenciou-se desse cargo para tratamento de saúde.\n\nFaleceu em São Paulo no dia 3 de maio de 1974.\n\n \n\n \n\nFONTES: BALEEIRO, A. Supremo; Grande encic. Delta; Jornal do Brasil\n(4/5/74).\n\n \n","ref":"FONTES: BALEEIRO, A. Supremo; Grande encic. Delta; Jornal do Brasil\n(4/5/74).\n\n \n","dic":"DHBB"}
