{"title":"MONTENEGRO, Benedito","cargoss":["Reitor"],"cargos_esp":["USP"],"datas_ini":[1941],"datas_fim":[1947],"estados":[0],"autor":[0],"content":"**MONTENEGRO, Benedito**\n\n\\*reitor USP 1941-1947.\n\n* *\n\n*Benedito Augusto de Freitas Montenegro* nasceu em Jaú (SP) no dia 7 de\nabril de 1888, filho de Henrique Montenegro e de Olímpia de Freitas\nMontenegro.\n\nCursou o primário na Escola Americana, concluindo o secundário em 1904\nno Mackenzie College, ambos na cidade de São Paulo. No ano seguinte\nviajou para os EUA, onde se formou em 1909 pela Faculdade de Medicina da\nUniversidade da Pensilvânia. Em 1910 revalidou seu diploma no Rio de\nJaneiro, então Distrito Federal, passando no ano seguinte a clinicar em\nSão Paulo.\n\nEm 1911 tornou-se cirurgião adjunto da Santa Casa de Misericórdia de São\nPaulo e do Sanatório Santa Catarina, função que exerceria até 1918.\nSegundo-secretário da Sociedade de Medicina e Cirurgia de São Paulo de\n1913 a 1914, neste último ano foi nomeado assistente de anatomia\ndescritiva da Faculdade de Medicina de São Paulo. Durante o biênio\n1915-1917 ocupou o cargo de tesoureiro da Sociedade de Medicina e\nCirurgia de São Paulo e, em 1916, foi professor substituto de anatomia\ndescritiva, anatomia topográfica e operações e aparelhos na Faculdade de\nMedicina.\n\nDurante a Primeira Guerra Mundial (1914-1918) serviu em 1918 no Exército\nfrancês pelo período de oito meses na condição de tenente-coronel e\nchefe da Missão Médica Brasileira. Logo após regressou ao Brasil, e em\nmarço de 1919 deixou a Santa Casa de Misericórdia para dedicar-se à sua\nclínica na Beneficência Portuguesa e no Sanatório Santa Catarina. Ainda\nem 1919 visitou vários países europeus em viagens de estudo, tornando-se\nem 1923 o pioneiro no Brasil da cirurgia radical das úlceras gástricas e\nduodenais ao realizar a primeira intervenção no gênero. Nomeado para\nintegrar a comissão de estudos para a construção dos edifícios da\nFaculdade de Medicina, inclusive o Hospital das Clínicas, partiu em 1925\nem viagem de estudos aos EUA, Canadá, França, Inglaterra e Bélgica. Em\n1931 conquistou a cátedra de técnica cirúrgica e cirurgia experimental\nda Faculdade de Medicina de São Paulo, à frente da qual permaneceria até\n1934.\n\nEm 1932 participou da Revolução Constitucionalista, durante a qual,\ncomissionado no posto de tenente-coronel-médico, chefiou ao lado dos\ninsurretos a Unidade Cirúrgica Itália. Terminado o conflito com a\nvitória das forças federais em outubro daquele ano, foi eleito diretor\nda Federação dos Voluntários de São Paulo. Fundada logo após a derrota\nda insurreição e liderada por um grupo de oficiais e suboficiais\npaulistas, a organização tinha como objetivo congregar os voluntários\nque haviam participado do movimento rebelde.\n\nEm 1933 foi um dos nomes cogitados para substituir o interventor federal\nem São Paulo, Valdomiro Castilho de Lima, mas a escolha recaiu sobre o\ngeneral Manuel de Cerqueira Daltro Filho. Em fevereiro de 1934, quando a\nFederação dos Voluntários se fundiu com o Partido Democrático e com a\nAção Nacional para formar o Partido Constitucionalista de São Paulo, foi\neleito o primeiro vice-presidente do novo partido. Ainda em 1934\ntornou-se professor de cirurgia da boca, organizador e diretor da\nFaculdade de Farmácia e Odontologia da Universidade de São Paulo (USP),\nalém de diretor do Sanatório Santa Catarina. Nesse período exerceria\nintensa atividade médica e científica, representando São Paulo e o país\nem diversos congressos internacionais.\n\nEm outubro de 1934 elegeu-se deputado à Assembléia Constituinte de São\nPaulo na legenda do Partido Constitucionalista. Assumiu sua cadeira no\nano seguinte, participou dos trabalhos constituintes como\nvice-presidente da Assembléia e, após a promulgação da nova Carta\nestadual, passou a exercer o mandato ordinário, perdendo-o, contudo, em\n10 de novembro de 1937, quando o advento do Estado Novo suprimiu todos\nos órgãos legislativos do país.\n\nDiretor da Faculdade de Medicina da USP a partir de 1941, ainda nesse\nano tornou-se também reitor dessa universidade, função que exerceria até\n1947. Foi secretário de Educação e Saúde Pública, diretor do\nDepartamento de Educação e Saúde Pública e diretor-clínico do Hospital\ndas Clínicas, todos em São Paulo, e fazendeiro em São João da Bocaina,\natual Bocaina (SP). Dirigiu ainda a Revista de Cirurgia, da capital\npaulista, atuando como editor para o Brasil do Surgery, Ginecology and\nObstetrics e da América Clinica.\n\nBenedito Montenegro foi membro do Colégio Brasileiro de Cirurgiões, do\nAmerican College of Surgeons, da Société Internationale de Chirurgie, do\nInternational College of Surgeons, da Asociación Argentina de Cirugía,\nda Association for the****Study of Internal Secretions, da Sociedade de\nMedicina e Cirugía de São Paulo e da Associação Paulista de Medicina,\nmembro honorário da Faculdade de Biologia e Ciências Médicas da\nUniversidade do Chile, da Academia Nacional de Medicina, da Comissão\nPermanente da Asociación Argentina de Cirugía, da Sociedad de Cirugía\ndel Chile, da Sociedad Argentina de Cirujanos e da Sociedade de Medicina\nde Pernambuco, membro correspondente da New York Academy of Medicine, da\nSociété des Chirurgiens de Paris, da Sociedad de Cirugía del Uruguay, da\nAcademia Brasileira de Medicina Militar, da Sociedade de Medicina e\nCirurgia de Campos, da Società Piemontesa di Chirugia e da Académie de\nChirurgie de Paris. Pertenceu ainda ao Ômega Upsilon Phi Medical\nFraternity, à Tyson Medical Society e à General Alermni Society, da\nUniversidade de Pensilvânia. Membro fundador da União Cultural\nBrasil-Estados Unidos, foi também sócio do Instituto Cultural\nÍtalo-Brasileiro e do Comité France-Amérique.\n\nFaleceu na cidade de São Paulo no dia 23 de agosto de 1979.\n\nEra casado com Inês de Carvalho Montenegro, com quem teve quatro filhos.\n\nPublicou Cruzar paulistas (1936), Livro jubilar (1943) e Tumores da\nsupra-renal (1950), além de artigos nos Anais Paulistas de Medicina e\nCirurgia, no Boletim da Sociedade de Medicina e Cirurgia de São Paulo e\nno São Paulo Médico.\n\n \n\n \n\nFONTES: ARQ. GETÚLIO VARGAS; COUTINHO, A. Brasil; Estado de S. Paulo\n(24/8/79); Grande encic. Delta; HIRSCHOWICZ, E. Contemporâneos; LEITE,\nA. História; MELO, L. Dic.; Personalidades; SILVA, H. 1932; SOC. BRAS.\nEXPANSÃO COMERCIAL. Quem; VELHO SOBRINHO, J. Dic.\n\n \n","ref":"FONTES: ARQ. GETÚLIO VARGAS; COUTINHO, A. Brasil; Estado de S. Paulo\n(24/8/79); Grande encic. Delta; HIRSCHOWICZ, E. Contemporâneos; LEITE,\nA. História; MELO, L. Dic.; Personalidades; SILVA, H. 1932; SOC. BRAS.\nEXPANSÃO COMERCIAL. Quem; VELHO SOBRINHO, J. Dic.\n\n \n","dic":"DHBB"}
