{"title":"MORAIS JÚNIOR, Antônio de Almeida","cargoss":["Arcebispo"],"cargos_esp":["Olinda e Recife"],"datas_ini":[1952],"datas_fim":[1960],"estados":[0],"autor":[0],"content":"**MORAIS JÚNIOR, Antônio de Almeida**\n\n\\*religioso; arceb. Olinda e Recife 1952-1960.\n\n \n\n*Antônio de Almeida Morais Júnior* nasceu em Sapucaí-Mirim (MG) no dia\n26 de junho de 1904, filho de Antônio de Almeida Morais e de Julieta\nEusébia de Oliveira Morais.\n\nTendo manifestado sua vocação sacerdotal desde o curso primário,\ningressou, em fevereiro de 1918, no Ginásio e Seminário Diocesano de\nTaubaté (SP), onde terminou o secundário e estudou filosofia e teologia.\nOrdenou-se sacerdote no dia 2 de outubro de 1927, passando a lecionar\nlógica, eloqüência sacra, grego, filosofia e apologética científica no\nseminário em que estudara.\n\nEm 1935, assumiu as funções de vice-secretário do bispado de Taubaté,\nonde permaneceu durante três anos. Convidado por dom André Arcoverde,\ntomou posse no vicariato da paróquia de Santo Antônio de Guaratinguetá\n(SP) por ocasião do *Te-Deum*de 31 de dezembro de 1938. Permaneceu em\nSão Paulo até ser designado pelo papa Pio XII (através da bula*Commissum\nHumilitati Nostrae)*bispo da cidade mineira de Montes Claros em 29 de\nsetembro de 1948. Recebeu sua sagração episcopal no dia 12 de dezembro,\nchegando à sede do bispado em fins de janeiro do ano seguinte.\n\nAo cabo de quase três anos de atuação na diocese de Montes Claros, dom\nAntônio foi elevado a arcebispo e transferido, em novembro de 1951, para\na arquidiocese de Olinda (PE) e Recife. Assumiu suas novas funções em\nmarço do ano seguinte. Segundo Márcio Moreira Alves, sua transferência\npara a capital pernambucana inscreveu-se numa série de indicações feitas\nentre 1947 e 1954 pelo núncio apostólico no Brasil, monsenhor Carlo\nChiari, de orientação extremamente conservadora, compartilhada nessa\népoca pelo papa Pio XII.\n\nDurante o ano de 1952, chegavam à fase final****os trabalhos\npreparatórios para a criação da Conferência Nacional dos Bispos do\nBrasil (CNBB), idéia lançada em 1949 por dom Chiari e desenvolvida desde\nentão pela Ação Católica Brasileira. Essa proposta correspondia também à\nlinha aprovada no Congresso Mundial de Leigos, realizado em Roma no ano\nde 1950, onde foi defendida, entre outros, pelo monsenhor Montini,\nassessor do sumo pontífice e, mais tarde, papa Paulo VI. No dia 14 de\noutubro de 1952, dom Antônio participou da primeira sessão da reunião\nextraordinária de instalação da CNBB, realizada no palácio São Joaquim,\nsede da arquidiocese do Rio de Janeiro, onde foi eleito membro da\ncomissão permanente responsável pela direção da entidade. Junto com ele,\nforam escolhidos dom Vicente Scherer, dom Mário de Miranda Vilas Boas e\ndom Carlos Carmelo de Vasconcelos Mora, indicado para a presidência.\n\nDom Antônio participou dos dois primeiros encontros dos bispos, e\ntécnicos do Nordeste, realizados em 1957 e 1959 nas cidades de Campina\nGrande (PB) e Natal, respectivamente. Essas reuniões, num total de três,\nresultaram da política aplicada pelo governo de Juscelino Kubitschek,\nque propunha a mobilização conjunta dos esforços de vários órgãos da\nadministração federal e do episcopado brasileiro para promover o\ndesenvolvimento da região Nordeste. Das duas primeiras reuniões,\nresultou a assinatura de vários decretos presidenciais organizando\ngrupos de trabalho encarregados de executar os planos aprovados, ligados\nespecialmente à educação rural e ao fomento da produção agropecuária.\nEssa iniciativa esteve também na origem da formação da Operação Nordeste\n(Openo) e, em seguida, da Superintendência do Desenvolvimento do\nNordeste (Sudene).\n\nA reunião de Campina Grande foi considerada, por várias razões, um marco\nna história das preocupações sociais da Igreja no Brasil, pois nela os\nbispos declararam sua solidariedade fundamental com as camadas mais\npobres da população. Além disso, foi a primeira reunião organizada pela\nCNBB, que, a partir de então, afirmou-se progressivamente como porta-voz\nda hierarquia eclesiástica brasileira, formulando uma nova estratégia\npara aumentar a influência da Igreja através da elaboração de um\nconjunto de propostas econômicas desenvolvidas em colaboração com um\ngrupo de jovens técnicos.\n\nEm 23 de abril de 1960, dom Antônio foi transferido para a arquidiocese\nmetropolitana de Niterói (RJ), que engloba dez municípios do estado do\nRio de Janeiro. Seu lugar na capital pernambucana foi ocupado por dom\nCarlos Gouveia Coelho. Em 1976, por motivos de saúde, dom Antônio pediu\nao Vaticano a designação de um bispo auxiliar, sendo atendido com a\nnomeação de dom José Gonçalves da Costa. Três anos depois, pelas mesmas\nrazões, renunciou ao cargo — que passou a ser ocupado pelo antigo\nauxiliar — e foi residir com a família****em Guaratinguetá (SP).\n\nMembro das academias Mineira e Fluminense de Letras, do Instituto de\nDireito Social de São Paulo, dos institutos históricos de Pernambuco e\nMinas Gerais, além do Instituto Brasileiro de História da Medicina, foi\ndoutor *honoris causa* da Universidade Federal Fluminense (UFF).\n\nFaleceu em Guaratinguetá no dia 12 de novembro de 1984.\n\nDom Antônio publicou, entre outras, as seguintes obras: *Capital e\ntrabalho*(1928),*Eloqüência dos* *tempos novos*(1930),*A doutrina de\nFreud* (1942),*Problemas atuais*(1958),*Evolução e* *espiritismo, No\nlimiar do casamento, Ciência e* *fé* e*Civilização em crise. Foi\ncolaborador assíduo da revista A Ordem,*vinculada ao Centro Dom Vital.\n\nRegina da Luz Moreira\n\n \n\nFONTES: ALVES, M. *Igreja*;*Anuário Católico*;**COELHO, J.\n*Coisas*;**CONFERÊNCIA NAC. BISPOS DO BRASIL; COUTINHO, A.\n*Brasil*;**ENCONTRO DOS BISPOS DO NE, 1*;* ENCONTRO DOS BISPOS DO NE,\n2*;*GARDEL, L. *Armoiries; Grande encic. Delta;* *Grande encic.\nportuguesa; Jornal do Brasil* (13/11/84); MOURA, O.*Idéias;* OLIVEIRA,\nM. *História;*PAULA, H. *Montes;*SOC. BRAS. EXPANSÃO COMERCIAL. *Quem*;\n*Veja*(21/11/84).\n\n \n\n \n","ref":"FONTES: ALVES, M. *Igreja*;*Anuário Católico*;**COELHO, J.\n*Coisas*;**CONFERÊNCIA NAC. BISPOS DO BRASIL; COUTINHO, A.\n*Brasil*;**ENCONTRO DOS BISPOS DO NE, 1*;* ENCONTRO DOS BISPOS DO NE,\n2*;*GARDEL, L. *Armoiries; Grande encic. Delta;* *Grande encic.\nportuguesa; Jornal do Brasil* (13/11/84); MOURA, O.*Idéias;* OLIVEIRA,\nM. *História;*PAULA, H. *Montes;*SOC. BRAS. EXPANSÃO COMERCIAL. *Quem*;\n*Veja*(21/11/84).\n\n \n\n \n","dic":"DHBB"}
