{"title":"MORAIS, Antônio","cargoss":["Deputado federal"],"cargos_esp":[0],"datas_ini":[1975],"datas_fim":[1987],"estados":["CE"],"autor":[0],"content":"**MORAIS, Antônio**\n\n\\*dep. fed. CE 1975-1987.\n\n*Antônio Alves de Morais* nasceu em Pereiro (CE), no dia 14 de julho de\n1942, filho de José Mílton de Morais e de Olindina Alves de Carvalho.\n\nFoi carteiro e cobrador da Sociedade Bandeirante de Assistência\nFilantrópica. Em 1966 elegeu-se vereador em Fortaleza, na legenda do\nMovimento Democrático Brasileiro (MDB). Iniciou o mandato na Câmara\nMunicipal em 1967 e no ano seguinte bacharelou-se em letras clássicas\npela Faculdade de Filosofia do Ceará, conquistando a fama de melhor\norador universitário. Líder da bancada de seu partido, em 1970 foi\nescolhido melhor orador do V Congresso de Vereadores Brasileiros e no\npleito de novembro voltou a candidatar-se à Câmara Municipal. Obtendo\napenas uma suplência, deixou essa casa em janeiro de 1971 mas voltou a\nocupar uma cadeira por duas vezes, nesse ano e no seguinte.\n\nArtista e professor de folclore na rede estadual de ensino do Ceará,\nonde se tornou também responsável pela manutenção de uma escola para\nquatrocentas crianças, ficou conhecido como “o professor” a partir de\nsua campanha para o pleito de novembro de 1974, como candidato a\ndeputado federal na legenda do MDB. Sua campanha através da televisão,\nseu comportamento público e seus inflamados discursos transformaram-no\nem uma figura “folclórica” no meio parlamentar. Eleito, assumiu o\nmandato na Câmara dos Deputados em fevereiro de 1975 e, nesse mesmo ano,\nfoi eleito pelo Comitê de Imprensa da Câmara o melhor deputado federal\ndo Ceará. Durante a legislatura foi suplente da mesa da Câmara e membro\nda Comissão de Relações Exteriores.\n\nNo pleito de novembro de 1978 reelegeu-se deputado federal e foi o mais\nvotado do MDB cearense. Com a extinção do bipartidarismo em 29 de\nnovembro de 1979 e a conseqüente reformulação partidária, filiou-se ao\nPartido Popular (PP). Com a incorporação do PP ao Partido do Movimento\nDemocrático Brasileiro (PMDB), em fevereiro de 1982, passou a integrar\nesta última legenda. Nessa legislatura foi presidente da Comissão de\nComunicação, membro da Comissão de Transportes e suplente das comissões\nde Educação e Cultura e de Minas e Energia. No pleito de novembro de\n1982 conseguiu nova reeleição na legenda do PMDB. Deixou a Câmara dos\nDeputados em janeiro de 1987, ao final da legislatura.\n\nCasou-se com Sílvia Helena Medeiros de Morais, com quem teve dois\nfilhos.\n\nFONTES: CÂM. DEP. *Deputados brasileiros.* *Repertório*(8 e 9); *Jornal\ndo Brasil*(18/11/ 74 e 7/4/75); NÉRI, S. *16*; *Perfil*(1980).\n\n \n","ref":"FONTES: CÂM. DEP. *Deputados brasileiros.* *Repertório*(8 e 9); *Jornal\ndo Brasil*(18/11/ 74 e 7/4/75); NÉRI, S. *16*; *Perfil*(1980).\n\n \n","dic":"DHBB"}
