{"title":"MORAIS, Ricardo","cargoss":["Deputado federal"],"cargos_esp":[0],"datas_ini":[1991],"datas_fim":[1995],"estados":["AM"],"autor":[0],"content":"**MORAIS, Ricardo**\n\n**\\***dep. fed. AM 1991-1995.\n\n*Ricardo Morais de Sousa* nasceu em Manicoré (AM) no dia 9 de junho de\n1958, filho de Luís Moreira de Sousa e de Teresinha Morais de Sousa.\n\nOperário numa indústria da Zona Franca de Manaus, foi coordenador da\nPastoral Operária de Manaus de 1980 a 1983. No ano seguinte, tornou-se\npresidente do Sindicato dos Metalúrgicos de seu estado e, em 1986, da\nCentral Única dos Trabalhadores (CUT) amazonense. Nas eleições\nmunicipais de novembro de 1988, disputou pelo Partido dos Trabalhadores\n(PT) uma cadeira na Câmara de Vereadores de Manaus. Apesar de ter sido o\nsegundo candidato mais votado no partido, não conseguiu se eleger,\nporque a legenda não alcançou o coeficiente eleitoral determinado pela\nlegislação. No ano seguinte, deixou a presidência do sindicato dos\nmetalúrgicos, tornando-se, em seguida, secretário de formação política\ndesse sindicato. Nesse mesmo ano de 1989 foi eleito, na convenção do PT,\npresidente do diretório regional do partido.\n\nNas eleições de outubro de 1990, elegeu-se o primeiro deputado federal\ndo PT no Amazonas. Assumindo seu mandato na Câmara dos Deputados em\nfevereiro do ano seguinte, tornou-se membro titular da Comissão de Minas\ne Energia e suplente da Comissão de Ciência e Tecnologia, Comunicação e\nInformática.\n\nEm maio de 1992, a revista *Veja*publicou entrevista de Pedro Collor,\nirmão do então presidente da República Fernando Collor (1990-1992), na\nqual denunciava um esquema de corrupção existente no governo sob o\ncomando de Paulo César Farias, o PC, ex-tesoureiro de campanha do\npresidente. No mês seguinte, o Congresso instaurou uma comissão\nparlamentar de inquérito (CPI) para apurar a denúncia. As conclusões da\nCPI levaram ao envolvimento do presidente num amplo esquema de corrupção\nliderado por Paulo César Farias, e foi pedido o afastamento de Collor.\nNa sessão realizada no dia 29 de setembro daquele ano, a Câmara dos\nDeputados aprovou a admissibilidade do *impeachment* do presidente, com\nvoto favorável de Ricardo Morais. Afastado da presidência após a votação\nna Câmara, renunciou ao mandato em 29 de dezembro de 1992, pouco antes\nda conclusão do processo pelo Senado, que decidiu pelo impedimento do\npresidente. Foi então efetivado na presidência da República o vice\nItamar Franco, que já exercia o cargo interinamente desde 2 de outubro.\n\nEm abril de 1993, a executiva nacional do PT cogitou expulsar Ricardo\nMorais do partido, em razão de suspeitas de irregularidades em sua\ngestão à frente do Sindicato dos Metalúrgicos do Amazonas e do diretório\nregional do partido. Foi acusado de obter empréstimos pessoais em nome\nda entidade sindical que presidia para a construção de sua residência,\nalém de haver efetuado compras particulares utilizando o prestígio de\nque desfrutava como presidente regional do PT. Morais pediu seu\nafastamento temporário da****agremiação,****a fim de que fossem\nesclarecidas as suspeitas nas quais estaria envolvido. Ainda durante\nessa legislatura, desligou-se definitivamente do PT e ingressou no\nPartido Socialista Brasileiro (PSB).\n\nEm outubro de 1994, concorreu à reeleição na legenda do PSB, mas obteve\napenas uma suplência. Deixou a Câmara dos Deputados em janeiro de 1995,\nao término da legislatura. Não disputou nenhum cargo eletivo no pleito\nde outubro de 1998.\n\nCasou-se com Maria Auxiliadora Silva de Sousa, com quem teve dois\nfilhos.\n\nFONTES: CÂM. DEP. *Deputados brasileiros. Repertório*(1991-1995);\n*Jornal do Brasil*(18/5/93); *Olho no voto/Folha de S.\nPaulo*(18/9/94).**\n\n \n","ref":"FONTES: CÂM. DEP. *Deputados brasileiros. Repertório*(1991-1995);\n*Jornal do Brasil*(18/5/93); *Olho no voto/Folha de S.\nPaulo*(18/9/94).**\n\n \n","dic":"DHBB"}
