{"title":"MOREIRA, Eliéser","cargoss":["Deputado federal"],"cargos_esp":[0],"datas_ini":[1935],"datas_fim":[1937],"estados":["MA"],"autor":[0],"content":"**MOREIRA, Eliéser**\n\n\\*dep. fed. MA 1935-1937.\n\n \n\n*Eliéser Rodrigues Moreira* nasceu em Santa Quitéria (MA) no dia 22 de\nfevereiro de 1899, filho de Francisco Rodrigues Moreira e de Joana de\nSousa Moreira.\n\nTransferiu-se para São Paulo, onde iniciou o curso de engenharia\nagronômica em Piracicaba. Em seguida, mudou-se para Minas Gerais, onde\nconcluiu o curso superior em Belo Horizonte. Após a Revolução de 1930,\nque levou Getúlio Vargas ao poder, ingressou na política em 1934, quando\nfoi eleito deputado federal pelo Maranhão em outubro desse ano. Ocupou\nsua cadeira na Câmara dos Deputados em maio de 1935 e cumpriu seu\nmandato até 10 de novembro de 1937, quando o Estado Novo suprimiu os\nórgãos legislativos do país.\n\nFoi engenheiro-agrônomo do Ministério da Agricultura, no qual foi\ndiretor do Departamento de Terras e Colonização, diretor do Instituto\nNacional de Imigração e Colonização (INIC) e de diversas comissões desse\nórgão nos estados do Maranhão e Piauí, diretor da Confederação Rural\nBrasileira, vice-presidente da Associação Brasileira de Agronomia,\nconselheiro do Departamento Nacional de Obras de Saneamento (DNOS) e do\nServiço Social Rural.\n\nMorreu no Rio de Janeiro no dia 12 de setembro de 1971.\n\nEra casado com Eudes Hohmann de Albuquerque Moreira, com quem teve dois\nfilhos, um dos quais, Eliéser Moreira Filho, foi constituinte de 1987 a\n1988 e deputado federal pelo Maranhão de 1987 a 1991.\n\n \n\nFONTES: *Boletim Min. Trab*. (5/36); CÂM. DEP. *Deputados*; *Diário do\nCongresso Nacional*; INF. Eliéser Moreira Filho.\n\n \n","ref":"FONTES: *Boletim Min. Trab*. (5/36); CÂM. DEP. *Deputados*; *Diário do\nCongresso Nacional*; INF. Eliéser Moreira Filho.\n\n \n","dic":"DHBB"}
