{"title":"MOREIRA, Manuel","cargoss":["Constituinte","Deputado federal"],"cargos_esp":[0,0],"datas_ini":[1987,1987],"datas_fim":[1988,1994],"estados":[0,"SP"],"autor":["Nara Santana","Marcelo Costa"],"content":"**MOREIRA, Manuel**\n\n\\*const. 1987-1988; dep. fed. SP 1987-1994.\n\n*Manuel Moreira de Araújo Filho* nasceu em Vitorino Freire (MA) no dia\n28 de agosto de 1949, filho de Manuel Moreira de Araújo e de Laudelina\nAlves de Araújo.\n\nEm 1974 ingressou no curso de economia da Pontifícia Universidade\nCatólica (PUC) de Campinas (SP), onde foi eleito vereador em novembro de\n1976, sob a legenda do Movimento Democrático Brasileiro (MDB), partido\nde oposição ao regime militar instaurado no país em abril de 1964. Tomou\nposse em fevereiro de 1977 e no ano seguinte concluiu o curso de\neconomia.\n\nEm novembro de 1979, com a extinção do bipartidarismo, ingressou no\nPartido do Movimento Democrático Brasileiro (PMDB), que sucedeu o MDB.\nFoi diretor de finanças da Câmara Municipal de Indaiatuba (SP) até 1981,\nquando se licenciou para exercer os cargos de secretário municipal de\nAdministração e de Finanças em Campinas, nos quais permaneceu até 1982.\n\nLigado ao então senador e governador eleito de São Paulo Franco Montoro\n(1983-1987), no pleito de novembro de 1982 Manuel Moreira elegeu-se\ndeputado estadual por São Paulo na legenda do PMDB. Durante o mandato\nfoi líder do governo e da bancada, vice-líder do governo, titular das\nComissões de Administração Pública, de Fiscalização e Controle da\nAdministração Direta e Indireta, de Cultura, Ciência e Tecnologia e de\nSistematização; e presidente da Comissão de Economia e Planejamento da\nAssembléia Legislativa. Em 1985 participou do I Congresso\nIbero-Americano sobre Forças Armadas promovido pela Associação\nInternacional de Sociologia no Instituto de Cooperação Ibero-Americana\nem Madri, Espanha.\n\nNas eleições de novembro de 1986 conquistou uma vaga de deputado federal\nconstituinte, tendo assumido o cargo em 1º de fevereiro de 1987, quando\ntiveram início os trabalhos da Assembléia Nacional Constituinte. Foi\ntitular da Comissão de Sistematização e suplente da Subcomissão do Poder\nExecutivo (da Comissão da Organização dos Poderes e Sistema de Governo).\n\nNas principais votações da Constituinte, pronunciou-se contra a pena de\nmorte, a legalização do aborto, a estabilidade para o funcionalismo\npúblico, a remuneração 50% superior para o trabalho extra e a\nestatização do sistema financeiro. Votou a favor da limitação do direito\nde propriedade privada, do mandado de segurança coletivo, da jornada\nsemanal de 40 horas, do turno ininterrupto de seis horas, do aviso\nprévio proporcional, da unicidade sindical, da soberania popular, do\nvoto aos 16 anos, do presidencialismo, da nacionalização do subsolo, do\nlimite de 12% ao ano para juros reais, da proibição do comércio de\nsangue e do mandato de cinco anos para o presidente José Sarney.\n\nApós a promulgação da nova Carta Constitucional (5/10/1988) voltou a\nparticipar dos trabalhos legislativos ordinários na Câmara dos\nDeputados, como vice-líder do PMDB, membro titular das comissões de\nDefesa Nacional e de Trabalho, Administração e Serviço Público e da\nComissão Mista do Orçamento.\n\nNão conseguiu eleger-se prefeito de Campinas em novembro de 1988, mas\nfoi reeleito deputado federal em outubro de 1990. Participou como\ntitular na Comissão de Relações Exteriores e, na sessão de 29 de\nsetembro de 1992, votou a favor da abertura do processo de *impeachment*\ndo presidente Fernando Collor de Melo, acusado de crime de\nresponsabilidade por ligações com um esquema de corrupção liderado pelo\nex-tesoureiro de sua campanha presidencial, Paulo César Farias. Collor\nfoi afastado da presidência logo após a votação na Câmara e renunciou ao\nmandato em 29 de dezembro de 1992, pouco antes da conclusão do processo\npelo Senado Federal, sendo efetivado na presidência da República o vice\nItamar Franco, que já vinha exercendo o cargo interinamente desde o dia\n2 de outubro.\n\nEm outubro de 1993, Manuel Moreira, aliado do ex-governador de São Paulo\nOrestes Quércia (1987-1991) no Congresso Nacional, foi citado pelo\neconomista José Carlos Alves dos Santos como um dos sete integrantes do\nesquema de corrupção na Comissão de Orçamento, caso de grande\nrepercussão nacional que ficou conhecido como o escândalo dos “anões do\nOrçamento”. Acusado por sua ex-mulher Marinalva Soares da Silva, que\napresentou diversas provas documentais na comissão parlamentar de\ninquérito que investigou as denúncias — a CPI do Orçamento —, Manuel\nMoreira teve de responder pelo aumento irregular de patrimônio através\nda compra de imóveis, fazendas e participação acionária em empresas;\npela inclusão no orçamento da União de uma subvenção de milhões de reais\npara 21 instituições de ensino; pela sonegação de impostos; pelo\nenvolvimento com várias empreiteiras (entre elas a Servaz, de São Paulo,\na FGR, de Goiás, e a OAS, da Bahia) em troca de benefícios políticos e\neconômicos; e pela participação em um esquema de “lavagem” de dinheiro.\n\nEm dezembro desse ano, o Ministério Público de São Paulo determinou a\nabertura de inquérito civil para investigar os empréstimos ilegais\nconcedidos entre dezembro de 1987 e abril de 1988 pelo Banco do Estado\nde São Paulo (Banespa) ao deputado e ao Instituto de Estudos Políticos,\nEconômicos e Sociais (IEPES), do qual foi sócio. Uma das principais\nacusações contra o parlamentar foi o desvio de orçamento e o abatimento\nde 64% no pagamento de uma dívida sua com o Banespa, que a contabilizou\ncomo prejuízo.\n\nCom a divulgação pela imprensa das acusações de sua ex-mulher, com quem\nfora casado durante 19 anos e tivera três filhos, e com a perda do apoio\npolítico do sogro Marinésio Soares da Silva, pastor da região de\nCampinas, o parlamentar renunciou ao mandato em 22 de março de 1994,\nfugindo assim da cassação. O suplente Paulo Novais assumiu o mandato.\nManuel Moreira respondeu a diversos inquéritos na Subcomissão de\nPatrimônio da CPI do Orçamento e, de volta a Campinas, passou a\ntrabalhar como consultor empresarial e a estudar direito.\n\nCandidatou-se a uma cadeira na Assembléia Legislativa de São Paulo em\noutubro de 1998, na legenda do PMDB, não tendo sucesso.\n\nFoi diácono da Igreja Evangélica Assembléia de Deus de Campinas.\n\nCasou-se em segundas núpcias com Maria Isabel Fuzaro Moreira de Araújo.\n\nNara Santana/Marcelo Costa\n\nFONTES: CÂM. DEP. *Deputados brasileiros.\nRepertório*(1991-1995);**COELHO, J. & OLIVEIRA, A. *Nova*;*Estado de S.\nPaulo* (8/12/93, 15/1/95, 22/5/97, 8/10/98); *Folha de S. Paulo*\n(25/8/88, 4, 16 e 17/11 e 31/12/93, 14/10/96); *Jornal do Brasil*\n(22/10, 5 e 16/11/93);*Perfil parlamentar/IstoÉ*; TRIB. SUP.\nELEIT.*Dados*(1998).\n\n \n","ref":"FONTES: CÂM. DEP. *Deputados brasileiros.\nRepertório*(1991-1995);**COELHO, J. & OLIVEIRA, A. *Nova*;*Estado de S.\nPaulo* (8/12/93, 15/1/95, 22/5/97, 8/10/98); *Folha de S. Paulo*\n(25/8/88, 4, 16 e 17/11 e 31/12/93, 14/10/96); *Jornal do Brasil*\n(22/10, 5 e 16/11/93);*Perfil parlamentar/IstoÉ*; TRIB. SUP.\nELEIT.*Dados*(1998).\n\n \n","dic":"DHBB"}
