{"title":"MOREIRA, Zuca","cargoss":["Deputado federal","Deputado federal"],"cargos_esp":[0,0],"datas_ini":[1992,1991],"datas_fim":[1995,1991],"estados":["PB","PB"],"autor":[0],"content":"MOREIRA, Zuca\n\n\\*dep. fed. PB 1991 e 1992-1995.\n\nJosé Moreira Lustosa*,* conhecido como**Zuca Moreira*,* nasceu em\nCajazeiras (PB) no dia 7 de setembro de 1935, filho de Alvino Moreira\nLustosa e de Francisca Moreira Lustosa.\n\nMédico e professor, em 1959 ingressou na Faculdade de Medicina da\nUniversidade Federal da Paraíba (Ufpb), em João Pessoa, a qual viria a\nconcluir em 1964. No ano seguinte fez um curso de especialização em\nanestesia em Salvador. Em 1980 assumiu a presidência da Cooperativa de\nTrabalho Médico da Unimed em João Pessoa, na qual permaneceria até 1982.\nNesse ano, após deixar essa função, tornou-se diretor-técnico da\nMaternidade do Instituto Nacional de Assistência Médica da Previdência\nSocial (INAMPS) da capital paraibana. Em 1985 assumiu o cargo de\ndiretor-técnico do Hospital Universitário, no qual permaneceria até o\nano seguinte, e a chefia do Departamento de Cirurgia do Centro de\nControle da Saúde (CCS) da Ufpb, também em João Pessoa.\n\nFiliando-se ao Partido do Movimento Democrático Brasileiro (PMDB), em\n1990 deixou o cargo de diretor-técnico da Maternidade do INAMPS e a\nchefia do Departamento de Cirurgia do CCS da Ufpb, para concorrer a uma\ncadeira na Câmara dos Deputados. No pleito de outubro desse ano\nelegeu-se deputado federal pela Paraíba, na legenda peemedebista.\nAssumindo seu mandato em fevereiro de 1991, no dia 16 de março seguinte\nlicenciou-se da Câmara para exercer o cargo de secretário de Saúde de\nseu estado no governo de Ronaldo Cunha Lima (1991-1994). Permaneceria à\nfrente dessa secretaria até agosto de 1992, quando reassumiu seu\nmandato.\n\nNa sessão da Câmara dos Deputados de 29 de setembro desse ano, votou a\nfavor da abertura do processo de *impeachment* do presidente Fernando\nCollor (1990-1992), acusado de envolvimento num amplo esquema de\ncorrupção no governo, sob o comando de Paulo César Farias, o PC,\nex-tesoureiro de campanha do presidente. Em 2 de outubro, Collor deixou\no governo, sendo substituído interinamente pelo vice-presidente Itamar\nFranco. No dia 29 de dezembro desse ano, horas antes da votação, pelo\nSenado, do seu afastamento, Collor apresentou sua renúncia, que não foi\naceita pela mesa diretora dessa casa do Congresso. Em seguida, o\nplenário da Câmara Alta aprovou o *impeachment*, e, em conseqüência,\nCollor teve os seus direitos políticos suspensos por oito anos e Itamar\nfoi efetivado na chefia do Executivo brasileiro.\n\nDeixando de concorrer à reeleição no pleito de outubro de 1994, Zuca\nMoreira exerceu seu mandato até o fim de janeiro de 1995, quando se\nencerrou a legislatura, retomando, em seguida, suas atividades de\nmédico.\n\nCasou-se com Maria de Lurdes Fernandes Moreira, com quem teve quatro\nfilhos.\n\nFONTES: CÂM. DEP. *Deputados brasileiros. Repertório* (1991-1995);\n*Globo*(30/9/92).\n\n \n\n** **\n","ref":"FONTES: CÂM. DEP. *Deputados brasileiros. Repertório* (1991-1995);\n*Globo*(30/9/92).\n\n \n\n** **\n","dic":"DHBB"}
