{"title":"MORHY, Hegel","cargoss":["Deputado federal"],"cargos_esp":[0],"datas_ini":[1964],"datas_fim":[1967],"estados":["RO"],"autor":[0],"content":"**MORHY, Hegel**\n\n\\*dep. fed. RO 1964-1967\n\n \n\n*Hegel Morhy*****nasceu em Manaus no dia 3 de novembro de 1925, filho de\nOmar Abdon Morhy e de Pedrina Hayden Morhy.\n\nEm 1928 sua família transferiu-se para o território de Rondônia,\nradicando-se na cidade de Guajará-Mirim. Para completar seus estudos,\nHegel retornou à sua cidade natal, onde formou-se contador, em 1946,\npela Escola de Comércio Solon de Lucena.\n\nDe volta a Rondônia, iniciou sua carreira política elegendo-se suplente\nde deputado federal na legenda do Partido Social Progressista (PSP), em\noutubro de 1962. Ainda nesse ano foi gerente do Banco de Crédito da\nAmazônia em Xapuri (AC) e em Rio Branco. Em 1963 tornou-se diretor do\nServiço de Administração Geral de Rondônia e chefe de gabinete do\ngoverno do território. Assumiu uma cadeira na Câmara dos Deputados em\njulho de 1964, depois, portanto, da eclosão do movimento\npolítico-militar de abril desse ano, que derrubou o presidente João\nGoulart. Com a extinção dos partidos políticos pelo Ato Institucional\nnº. 2 (AI-2), em 1965, e a instauração do bipartidarismo, filiou-se ao\npartido governista, a Aliança Renovadora Nacional (Arena). Nessa\nlegislatura foi membro das comissões de Finanças e de Valorização da\nAmazônia na Câmara. Encerrou seu mandato em janeiro de 1967. Em\nfevereiro do ano seguinte, foi designado inspetor de crédito geral do\nBanco da Amazônia.\n\nEm novembro de 1970 candidatou-se novamente a deputado federal, na\nlegenda da Arena, mas obteve apenas uma suplência, não chegando a\nexercer o mandato. Em agosto do ano seguinte aposentou-se por tempo de\nserviço.\n\nEm fevereiro de 1977 foi nomeado gerente do Banco do Estado do Pará, em\nBrasília, cargo que exerceria até março de 1984. Em dezembro de 1983\nconcluiu o curso de direito da Universidade do Distrito Federal, em\nBrasília. A partir de junho de 1984 passou a dedicar-se às atividades\nprivadas de compra e venda e administração mobiliária e na área de\ncomércio de materiais de construção, constituindo com sua esposa a firma\nConstrumor, Ferragens e Ferramentas Ltda., na capital federal.\n\nCasou-se com Neida Nicolau Morhy, com quem teve seis filhos.\n\n \n\nFONTES: CÂM. DEP. *Deputados*;**CÂM. DEP. *Deputados brasileiros.\nRepertório*(1963-1967); CURRIC. BIOG.; TRIB. SUP. ELEIT.  *Dados* (6 e\n9).\n","ref":"FONTES: CÂM. DEP. *Deputados*;**CÂM. DEP. *Deputados brasileiros.\nRepertório*(1963-1967); CURRIC. BIOG.; TRIB. SUP. ELEIT.  *Dados* (6 e\n9).\n","dic":"DHBB"}
