{"title":"MORITZ, Charles Edgar","cargoss":["Presidente de associação ou confederação de empregados ou empregadores"],"cargos_esp":["CNC"],"datas_ini":[1959],"datas_fim":[1964],"estados":[0],"autor":[0],"content":"**MORITZ, Charles Edgar**\n\n\\*pres. CNC 1959-1964.\n\n \n\n*Charles Edgar Moritz* nasceu em Florianópolis no dia 21 de novembro de\n1912, filho de João Moritz e de Maria da Glória Moritz.\n\nRealizou seus estudos em sua cidade natal, diplomando-se em\ncontabilidade no Instituto Politécnico. Começou então a trabalhar na\nJoão Moritz Indústria e Comércio, estabelecimento fundado por seu avô e\ndirigido por seu pai, sendo eleito em 1936 vice-presidente da Associação\nComercial de Florianópolis. Nesse período, foi um dos fundadores do\nSindicato do Comércio Atacadista, da Federação das Indústrias e da\nFederação de Associações Comerciais de seu estado.\n\nUm dos fundadores da Federação do Comércio do Estado de Santa Catarina\n(Fecomércio) em 1948, tornou-se o primeiro presidente da entidade ainda\nnaquele ano, função que exerceria até 1964. Por força do cargo,\ningressou na Confederação Nacional do Comércio (CNC), sediada no Rio de\nJaneiro (então Distrito Federal). Em 1950, participou da fundação de\noutra entidade de classe, a Federação das Indústrias do Estado de Santa\nCatarina (FIESC). Eleito segundo-vice-presidente da CNC em 1952, iniciou\nentão longa permanência e progressiva ascensão em sua diretoria.\nReelegeu-se para o mesmo cargo em 1956, tornando-se\nprimeiro-vice-presidente em 1958.\n\nNo ano seguinte, o presidente da CNC, Brasílio Machado Neto, renunciou\nem virtude de uma representação ao Ministro do Trabalho na qual cinco\nsindicatos pleiteavam intervenção na entidade, acusando sua direção de\nutilização irregular das verbas do Serviço Social do Comércio (Sesc) e\ndo Serviço Nacional de Aprendizagem Comercial (Senac), e de ter\nrenunciado à representação do setor. Em outubro de 1959 Charles Moritz\ntomou posse na presidência da CNC, assumindo também em decorrência as do\nSesc e do Senac. Na ocasião, negou que essa representação ao ministério\ntivesse expressado os anseios do conjunto dos associados.\n\nNesse período, por indicação do presidente Juscelino Kubitschek\n(1956-1961), de quem era amigo, presidiu a Legião Brasileira de\nAssistência (LBA). Depois de sanear as finanças do órgão, passou a\npresidência em 31 de janeiro de 1961 a Eloá Quadros, esposa do\npresidente Jânio Quadros, empossado naquele dia.\n\nNos primeiros anos da década de 1960 — período em que Moritz esteve à\nfrente da CNC — a conjuntura nacional foi marcada pela queda na taxa de\ncrescimento econômico conseguida no período anterior e o acirramento da\ncrise política e social. Aguçou-se a polarização entre as forças que\ndefendiam reformas de cunho social e nacionalista, agrupadas\nprincipalmente em torno do programa de reformas de base (agrária,\nurbana, constitucional e de disciplina da ação do capital estrangeiro),\ne tendências de cunho conservador que reagiam a elas e enfatizavam a\nnecessidade de contenção das reivindicações trabalhistas e da busca de\nestabilidade monetária. Pretendiam assim a superação da crise econômica\nsem a realização de mudanças estruturais na sociedade brasileira,\nespecialmente no que dizia respeito às formas tradicionais de\npropriedade.\n\nMoritz participou ativamente dos debates da época, posicionando-se em\ndefesa da iniciativa privada, contra o atendimento das reivindicações\ntrabalhistas e combatendo o crescente número de projetos em tramitação\nno Congresso Nacional com o sentido de ampliar o poder de intervenção do\nEstado na economia.\n\nDurante seu primeiro período à frente****da CNC, afirmou que o direito\nde greve não podia “ferir o de propriedade” e que, por suas\nconseqüências sempre prejudiciais à nação, deveria ser regulamentado.\nManifestou-se radicalmente contra as greves de caráter político, de\nsolidariedade e outras mais “que a imaginação fértil dos agitadores\nsaberá encontrar”. Por ferirem o princípio de livre iniciativa, combateu\nos projetos de proibição de depósitos em bancos estrangeiros, de criação\nda Eletrobrás, (que seria aprovado em 1961), de estatização da casa\npopular e de implantação do monopólio sobre o seguro de acidentes de\ntrabalho.\n\nEm julho de 1960 Moritz elogiou publicamente o programa econômico do\ngoverno Juscelino Kubitschek (1956-1961), particularmente seu Plano de\nMetas. Em 10 de setembro foi eleito presidente da CNC para o biênio\n1960-1962. Fazendo então um balanço da economia brasileira no final\ndaquele governo, considerou positivo o acelerado desenvolvimento\neconômico obtido, mas apontou a queda das exportações, o aumento das\nemissões de papel-moeda, o crescimento da dívida externa e a alta do\ncusto de vida como aspectos negativos da conjuntura econômica nacional.\nCriticou também o anteprojeto de lei de 1958 sobre o direito de greve,\nespecialmente no que dizia respeito à proibição de substituir os\nempregados grevistas, à liberdade de propaganda e aliciamento para os\nmovimentos e ao pagamento dos dias paralisados.\n\nMoritz admitiu ainda que o tratamento dado pelo Brasil ao capital\nestrangeiro era dos mais favoráveis, possibilitando sua ampla\nmovimentação através do mercado livre de câmbio, sem que fosse colocada\nnenhuma restrição à remessa de lucros para o exterior ou a seu\nreinvestimento. Em sua opinião, essa situação havia sido instaurada a\npartir de 1955, com a Instrução nº 113 da Superintendência da Moeda e do\nCrédito (Sumoc), que permitia a importação de máquinas e equipamentos\nsem cobertura cambial.\n\nEm 9 de novembro de 1960 eclodiu uma importante greve nos transportes\nmarítimos e ferroviários, controlados pelo Estado, reivindicando\nparidade de vencimentos com o funcionalismo militar. A crise ameaçou\nassumir graves proporções. Moritz atribuiu sua responsabilidade a uma\n“minoria subversiva e organizada” que pretendia pressionar o\nLegislativo, e pediu, em nome da entidade que presidia, firmeza do\ngoverno para acabar com a paralisação, alinhando-se dessa forma com os\nque propugnavam uma política de endurecimento contra o movimento\nsindical. Pressionado pelos ministros militares, Kubitschek chegou a\ncogitar o envio ao Congresso de um pedido de decretação do estado de\nsítio. Entretanto, no terceiro dia a greve foi suspensa, diante da\npromessa de que as reivindicações seriam estudadas.\n\nAinda em 1960, Moritz comandou a campanha contra o projeto de lei de\nrepressão aos abusos do poder econômico, fazendo veemente pronunciamento\nem dezembro desse ano defendendo a iniciativa privada e postando-se\ncontra a criação de uma agência administradora para supervisionar a\naplicação da lei. Segundo ele, essa idéia representava um “expediente\ntotalitário, incompatível com a democracia”.\n\nEm 25 de agosto de 1961 o presidente Jânio Quadros renunciou, depois de\ngovernar pouco menos de sete meses. Abriu-se então uma grave crise\npolítica em virtude da oposição dos ministros militares à posse do seu\nsubstituto legal, o vice-presidente João Goulart, comprometido com as\nreformas de base e o movimento sindical. Depois de intensos debates, o\nCongresso Nacional aprovou a Emenda Constitucional nº 4 que, instituindo\no regime parlamentarista, viabilizou a sucessão no quadro da legalidade.\nCharles Moritz opôs-se tenazmente desde o início ao novo governo, que,\nsegundo ele, administrava o país “em estilo de comício”. Lutou contra o\nque considerava a “comunização” do Brasil, enfatizando sua oposição à\nintervenção do Estado na economia, denunciando a ação dos organismos\nintersindicais Comando Geral dos Trabalhadores (CGT) e Pacto de Unidade\ne Ação (PUA) e advertindo sobre as “tentativas de minar a disciplina e a\nunidade das forças armadas”. Combateu também as medidas restritivas à\nação do capital estrangeiro, que se multiplicavam no governo de João\nGoulart. Em novembro de 1961 enviou memorial ao Congresso apontando os\nprejuízos que, a seu ver, a Lei da Remessa de Lucros acarretaria à\neconomia nacional caso fosse aprovada.\n\nEm fins de 1961 a CNC reestruturou seu conselho de turismo, para\nincorporar inúmeras entidades ligadas ao setor. Em março do ano\nseguinte, quando a nacionalização dos serviços públicos era uma das\ngrandes questões debatidas no país, Moritz pronunciou-se contra a\nencampação das concessionárias de serviço telefônico.\n\nEm maio de 1962 a CNC, a Confederação Nacional da Indústria (CNI) e as\nfederações da Indústria e do Comércio de Pernambuco promoveram, em\nRecife, a primeira Reunião de Estudos do Nordeste, onde foram debatidos\nos incentivos fiscais para investimentos na região, tema que voltaria à\npauta em novo encontro, realizado em janeiro de 1964.\n\nNesse período, a desorganização da economia se acentuara. Em agosto de\n1962, a CNC e outras entidades patronais lançaram manifesto solicitando\nmedidas efetivas de fomento à produção como meio de combater a crise de\nabastecimento em que o país se encontrava. Pediam garantia de preços\nmínimos, amplo financiamento, transporte e armazenagem, e\nposicionavam-se contra as despesas públicas “suntuárias”, propondo como\nobjetivo da política econômica a conquista da estabilidade monetária.\n\nMoritz foi reeleito presidente da CNC em 17 de setembro de 1962, mês\nem****que o Congresso aprovou a Lei nº 4.137, de repressão ao abuso do\npoder econômico, contra a qual tanto se empenhava. No final do ano\npronunciou-se contra a aprovação de lei do imposto único de energia\nelétrica, que previa o fim da participação privada no setor. Declarou\ntambém ser impossível implementar uma política de combate à inflação e,\nao mesmo tempo, prosseguir no atendimento indiscriminado às\nreivindicações trabalhistas, no processo incontrolado de aumento das\ndespesas estatais e no controle das tarifas dos serviços de utilidade\npública.\n\nEm junho de 1963, a CNC propôs ao governo a criação de um organismo\ncoordenador e executor do comércio externo, a fim****de ampliar e\ndiversificar as exportações brasileiras. No mesmo ano, a entidade deu\nparecer contrário à criação****da Aerobrás, à estatização do transporte\naéreo e à encampação das refinarias particulares de petróleo. Criticou\nainda o Plano Trienal elaborado pelo governo para o período 1963-1965,\nno tocante à política cambial, ao comércio externo, à reforma tributária\ne à política monetária e creditícia.\n\nNo mesmo período, marcado pelo crescimento dos movimentos\nreivindicatórios dos trabalhadores, a CNC bateu-se contra a participação\ndestes nos lucros das empresas, os aumentos “arbitrários” do salário\nmínimo, as escalas móveis de salário, a concessão de privilégios a\ndeterminadas categorias profissionais e a quebra da hierarquia salarial.\nPara Moritz, apenas um trabalho como o desenvolvido pelo Sesc poderia\ncontribuir para a elevação do nível de vida do comerciário.\n\nCharles Moritz apoiou o movimento político-militar que derrubou João\nGoulart em 31 de março de 1964, lançando um manifesto ao comércio logo\napós a queda do presidente. Empenhou-se então na revisão da Lei de\nRemessa de Lucros, que foi efetivamente reformulada em 29 de agosto de\n1964. Nessa ocasião, entre outros dispositivos, foram revogados os\nartigos 31 (que limitava em 10% sobre o capital registrado as remessas\nde lucros ao exterior), 32 (que considerava as remessas acima desse\nlimite como retorno de capital) e 33 (que determinava que os lucros\nexcedentes não remetidos seriam registrados como capital suplementar,\nnão****dando direito a serem contabilizados em futuras remessas). Moritz\napoiou a política econômica do governo do general Humberto Castelo\nBranco (1964-1967), baseada na contenção dos aumentos salariais,\nabertura ao capital estrangeiro, racionalização dos gastos estatais e\nreorganização do sistema tributário.\n\nEm 1964, com a eleição de Jessé Pinto Freire para a presidência da CNC,\nMoritz tornou-se diretor-secretário dessa entidade, cargo que ocupou\nnovamente em 1966, 1968, 1971 e 1974. Nesse último ano, assumiu a\npresidência da FIESC, cargo que ocuparia até 1994.\n\nFoi também ministro do Tribunal Superior do Trabalho.\n\nParticipou diversas vezes da delegação oficial do Brasil nas\nconferências da Organização Internacional do Trabalho (OIT), em Genebra,\nSuíça, entre 1978 e 1988.\n\nFaleceu em Florianópolis, no dia 1º de maio de 1998.\n\nEra casado com Manuela Goeldner Moritz, com quem teve quatro filhos.\n\nSônia Dias\n\n \n\nFONTES: ARQ. CONF. NAC. COMÉRCIO; CONF. NAC. COMÉRCIO. *20*; CONSULT.\nMAGALHÃES, B.; CORRESP. CONF. NAC. COMÉRCIO; *Globo* (6/5/98).\n\n \n","ref":"FONTES: ARQ. CONF. NAC. COMÉRCIO; CONF. NAC. COMÉRCIO. *20*; CONSULT.\nMAGALHÃES, B.; CORRESP. CONF. NAC. COMÉRCIO; *Globo* (6/5/98).\n\n \n","dic":"DHBB"}
