{"title":"MOTA, Carlos Carmelo de Vasconcelos","cargoss":["Arcebispo"],"cargos_esp":["São Paulo"],"datas_ini":[1944],"datas_fim":[1964],"estados":[0],"autor":[0],"content":"**MOTA, Carlos Carmelo de Vasconcelos**\n\n\\*religioso; arceb. São Paulo 1944-1964.\n\n* *\n\n*Carlos Carmelo de Vasconcelos Mota* nasceu em Bom Jesus do Amparo, no\nmunicípio de Caeté (MG), no dia 16 de julho de 1890, filho de João de\nVasconcelos Teixeira da Mota, deputado no Império, e de Francisca Josina\ndos Santos Mota. Seu avô paterno, o coronel Joaquim Camilo Teixeira da\nMota, foi o primeiro presidente constitucional da província de Minas\nGerais (1824-1827) e seu bisavô materno era o doutor José Teixeira da\nFonseca Vasconcelos, visconde de Caeté.\n\nIniciou os estudos no Colégio dos Irmãos Maristas de Congonhas do Campo\n(MG), onde em 1903 concluiu o curso de humanidades. No ano seguinte,\ningressou no Seminário de Mariana (MG), ainda sem intenção de se fazer\npadre, buscando apenas complementar seus estudos. Terminando o curso de\nciências e filosofia em 1909, retornou à fazenda dos pais. Três anos\ndepois, aos 22 anos de idade, elegeu-se vereador à Câmara Municipal de\nCaeté. No ano seguinte, porém, interrompeu a carreira política e\ningressou na Faculdade de Direito de Belo Horizonte. Cursou-a apenas por\num ano, voltando então ao Seminário de Mariana, já decidido a ser padre.\n\nOrdenado em junho de 1918, no ano seguinte auxiliou o monsenhor Domingos\nEvangelista Pinheiro na fundação da Congregação das Irmãs Auxiliares de\nNossa Senhora da Piedade e foi coadjutor em Taquaraçu de Minas (MG). Em\nseguida foi reitor do Santuário da Piedade e do Convento das\nEnclausuradas Concepcionistas de Macaúbas, e pároco de Caeté e Sabará\n(MG). Em 1926 exerceu no Vaticano a função de camareiro do papa Pio XI.\nDe volta ao Brasil, foi designado reitor do Seminário do Coração\nEucarístico, em Minas Gerais.\n\nEm julho de 1932 foi nomeado bispo titular de Algisa e bispo auxiliar de\ndom Joaquim Silvério de Sousa, arcebispo de Diamantina (MG). Em outubro\nseguinte foi sagrado bispo de Belo Horizonte. Três anos mais tarde, em\ndezembro de 1935, foi elevado a arcebispo de São Luís do Maranhão. Nessa\narquidiocese, criou a seção estadual da Ação Católica Brasileira (ACB),\nfundou um leprosário e, com a ajuda dos lazaristas, restaurou o cabido\nmetropolitano. Reconstruiu o seminário local e reformou a catedral e\noutras igrejas. Criou ainda mais de 20 novas paróquias e fundou a\ndiocese de Caxias e prelazia de Pinheiros. Inaugurou também o Colégio\ndos Maristas. Permaneceu no Maranhão até 1944, quando foi nomeado, em\nagosto, para a arquidiocese de São Paulo, substituindo dom José Gaspar\nde Afonseca e Silva, falecido no Rio de Janeiro um ano antes.\n\n \n\nArcebispo de São Paulo (1944-1964)\n\nAssumindo a arquidiocese paulista no final do Estado Novo (1937-1945),\ndom Carlos assistiu em 1945 à aglutinação das forças políticas em novos\npartidos, preparando-se para a sucessão presidencial e para as eleições\nlegislativas que se realizariam em dezembro daquele ano. Especulava-se\nsobre a legalização do Partido Comunista Brasileiro (PCB), então Partido\nComunista do Brasil, cujos militantes, anteriormente perseguidos pela\npolícia política do presidente Getúlio Vargas e agora beneficiados pela\nanistia concedida em abril de 1945, voltavam a atuar abertamente,\ndestacando-se entre eles a figura de Luís Carlos Prestes. Nessas\ncircunstâncias, dom Carlos divulgou uma pastoral contra as idéias\ncomunistas, recomendando também ao clero igual distanciamento dos demais\npartidos.\n\nEm fevereiro de 1946, foi elevado a cardeal pelo papa Pio XII, tendo\nsido o primeiro arcebispo brasileiro a receber o título. Em abril\nseguinte criou em São Paulo a primeira universidade católica do país —\na****Pontifícia Universidade Católica de São Paulo —, que veio a ser\ninstalada em agosto. No mês seguinte participou do lançamento da pedra\nfundamental da nova basílica de Aparecida do Norte (SP).\n\nTendo como uma das preocupações básicas de seu trabalho pastoral a\npreservação da família, fundou em 1948 a Confederação das Famílias\nCristãs, entidade que lhe conferiria mais tarde o título de defensor\nperpétuo da família brasileira. Em 1951 foi promotor de uma semana de\nestudos sobre a família, da qual participaram Lucas Nogueira Garcez,\ngovernador de São Paulo, e o general José Bina Machado. Foi um dos\nfundadores da Conferência Nacional dos Bispos do Brasil (CNBB), entidade\nmáxima da Igreja Católica no país, tendo participado da sessão de sua\ninstalação em junho de 1952. Nessa ocasião foi escolhido o primeiro\npresidente da CNBB.\n\nEm janeiro de 1954, por ocasião do quarto centenário da fundação de São\nPaulo, inaugurou a nova catedral da cidade. Ainda nesse ano promoveu o I\nCongresso da Padroeira do Brasil e, no ano seguinte, deu início à\nconstrução da nova basílica de Aparecida. Em maio de 1957 celebrou a\nprimeira missa em Brasília, futura capital do país, então em construção.\nAinda em 1957 obteve uma emissora de rádio para a cidade de Aparecida.\nPara a arquidiocese de São Paulo, adquiriu a Rádio 9 de Julho e lançou o\njornal O São Paulo, além de criar a Faculdade Teológica Nossa Senhora da\nAssunção. Em 1958 deixou a presidência da CNBB, cargo que voltou a\nocupar de 1963 a 1964.\n\n \n\nArcebispo de Aparecida (1964-1982)\n\nAlegando avançada idade e pouca saúde, pediu ao papa Paulo VI exoneração\ndas funções e responsabilidades ligadas à arquidiocese de São Paulo.\nSubstituído na capital pelo cardeal Agnelo Rossi, foi transferido para\nAparecida em abril de 1964. Essa transferência coincidiu com o início do\ngoverno do marechal Humberto Castelo Branco, que assumira a presidência\napós a vitória do movimento político-militar de março de 1964.\nSabidamente ligado ao presidente deposto, João Goulart, e ao\nex-presidente Juscelino Kubitschek, teve sua transferência atribuída na\népoca, por setores da imprensa, a pressões do governo federal, versão\nque sempre desmentiu. Antidivorcista ardoroso — já em 1943 enviara a\nGetúlio Vargas um protesto contra a primeira tentativa de legalização do\ndivórcio, em janeiro de 1977 —, após a aprovação da emenda\nconstitucional que instituiu o divórcio no país, enviou aos senadores e\ndeputados um manifesto em que qualificava a medida de “vergonha para o\nBrasil”.\n\nEm entrevista concedida ao Jornal do Brasil (29/6/1978), rompendo um\nsilêncio que remontava a 1964 — pois a imprensa, dizia ele, manipulava\nseus pensamentos —, esclareceu sua saída da arquidiocese de São Paulo.\nInformou que sua carta ao papa datava de nove dias antes da queda de\nJoão Goulart. Sobre o ex-presidente, afirmou ser ele “um homem\npessoalmente bom”, mas sem “o preparo necessário para a política”.\nComparou-o a Vargas, destacando a popularidade de que ambos gozavam\nentre os operários, e explicou: “Não é que tenham feito grandes\nmelhoras. Ganharam amigos fazendo o bem, é normal, não é?” Negou que\ntivesse ido ao palácio das Laranjeiras no dia 24 de março de 1964, em\ncompanhia do recém-designado arcebispo de Olinda e Recife, dom Hélder\nCâmara, para prestar apoio a Goulart, conforme a imprensa divulgara.\nAfirmou que apenas uma vez interviera junto a políticos após a\ninstauração do regime militar, ao interceder em favor de “um advogado\nmuito conhecido, amigo dos operários, católico de comunhão diária”, que\nfora preso. Telefonara para o “amigo” Ademar de Barros, então governador\ndo estado de São Paulo, e conseguira a soltura do advogado. Na mesma\nentrevista, referiu-se à construção da nova capital do país, realizada\nno governo Kubitschek, como “a obra mais importante que um governo podia\nfazer”. Estudioso do direito eclesiástico e interessado sobretudo nas\nrelações entre a Igreja e o Estado, afirmou ainda que o divórcio fora\ndecretado contra o direito da Igreja. Chamou atenção, porém, para as\ndiferenças existentes entre a Igreja e o Estado em relação a essa\nquestão, afirmando que é direito do Estado permitir o divórcio, cabendo\nao católico não aceitá-lo. Sobre a atuação política dos religiosos,\nafirmou: “Padre na política, ou é bom padre e mau político, ou será bom\npolítico, mas um mau padre.” Observou que a missão dos religiosos diante\ndas torturas e das prisões políticas deveria ser, antes de mais nada,\nespiritual. Além disso, os religiosos deveriam procurar intervir em\nnível pessoal (“falar com o governo, com os amigos”), evitando  atitudes\npúblicas. Declarou ainda que o trabalhador deveria trabalhar “não como\nservo, mas como senhor” e condenou o lucro obtido “para fazer a\nescravidão do trabalhador”.\n\nEm entrevista ao jornal O Globo (26/7/1981), elogiou a Carta\nConstitucional de 1946 — que marcou o início da redemocratização do país\napós o Estado Novo —, afirmando ter sido ela “a primeira Lei Maior\nrealmente cristã do Brasil”. Indagado sobre as perspectivas políticas do\nmomento, referiu-se ao presidente João Batista Figueiredo como “homem\nsincero e cheio de boa vontade”, ressalvando, porém, que “só boa vontade\nnão basta”. Condenou a dependência econômica ao exterior, ressaltando a\nnecessidade de se fazer uma política voltada para o aspecto social.\n\nFoi membro da Academia Mineira de Letras e dos institutos históricos e\ngeográficos de São Paulo e de Minas Gerais.\n\nFaleceu em Aparecida do Norte no dia 18 de setembro de 1982 e foi\nenterrado na cripta da nova catedral da cidade.\n\n \n\n \n\nFONTES: CONFERÊNCIA NAC. BISPOS DO BRASIL; Encic. Mirador; Fatos e Fotos\n(7/10/82); GARDEL, L. Armoiries; Globo (26/7/81); Grande encic. Delta;\nJornal do Brasil (29/6/78); LEITE, A. História.\n\n \n","ref":"FONTES: CONFERÊNCIA NAC. BISPOS DO BRASIL; Encic. Mirador; Fatos e Fotos\n(7/10/82); GARDEL, L. Armoiries; Globo (26/7/81); Grande encic. Delta;\nJornal do Brasil (29/6/78); LEITE, A. História.\n\n \n","dic":"DHBB"}
