{"title":"MOTA, Fróis da","cargoss":["Constituinte","Deputado federal"],"cargos_esp":[0,0],"datas_ini":[1946,1946],"datas_fim":[1946,1951],"estados":[0,"BA"],"autor":[0],"content":"**MOTA, Fróis da**\n\n\\*const. 1946; dep. fed. BA 1946-1951.\n\n \n\n*Eduardo Fróis da Mota* nasceu em Monte Rolo (BA), no dia 12 de maio de\n1891, filho do coronel Agostinho Fróis da Mota e de Maximiana de Almeida\nMota. Seu pai foi fazendeiro e intendente de Feira de Santana.\n\nFez o curso primário no Colégio São Luís, em sua cidade natal, e o\nsecundário no Ginásio Carneiro Ribeiro, em Salvador. Graduou-se pela\nFaculdade de Medicina da Bahia, concluindo o curso no ano de 1912.\nDepois de formado, fixou residência na cidade de Mogi das Cruzes (SP),\nonde exerceu medicina clínica até 1917, ano em que retornou a Feira de\nSantana, a fim de gerir os negócios da família.\n\nParticipou da fundação do Partido Social Democrático (PSD) em 1933.\nEleito vereador em 1936, teve seu mandato cassado com o golpe do Estado\nNovo (10/11/1937), que fechou todas as casas legislativas do país. Foi\ntambém prefeito de Feira de Santana no período de 1944 a 1945.\n\nNo pleito de 2 de dezembro de 1945, obteve uma suplência de deputado\npela Bahia na Assembléia Nacional Constituinte, concorrendo na legenda\ndo PSD. Assumiu o mandato em março de 1946, um mês após a instalação da\nAssembléia. Depois de ter participado dos trabalhos constituintes,\npassou a exercer o mandato ordinário com a promulgação da nova Carta em\n18 de setembro de 1946. Participou da Comissão Permanente de Saúde\nPública e atuou na Câmara até o fim do mandato, em janeiro de 1951.\n\nEm conseqüência da extinção dos partidos políticos pelo Ato\nInstitucional nº 2 (27/10/1965) e a posterior instauração do\nbipartidarismo, tornou-se membro do diretório municipal do\nMovimento****Democrático Brasileiro (MDB), partido de oposição ao regime\nmilitar instaurado no país em abril de 1964.\n\nFoi o fundador da Rádio Cultura e do jornal A Gazeta do Povo em Feira de\nSantana. Como presidente da Fundação Coronel Agostinho Fróis da Mota,\nconstruiu o Centro de Educação e Cultura, que recebeu mais tarde o seu\nnome.\n\nConcorreu em dois pleitos para prefeito de Feira de Santana, mas não\nconseguiu se eleger.\n\nFaleceu em 18 de setembro de 1988, em Feira de Santana.\n\nEra casado com Maria Lambert de Brito Mota, com quem teve seis filhos.\n\n \n\nFONTES: CÂM. DEP. *Deputados*; CÂM. DEP. *Relação dos deputados*;\n*Diário do Congresso Nacional*; INF. Lili Fróis da Mota Mascarenhas;\nSILVA, G. *Constituinte*; TRIB. SUP. ELEIT. *Dados* (1).\n\n \n","ref":"FONTES: CÂM. DEP. *Deputados*; CÂM. DEP. *Relação dos deputados*;\n*Diário do Congresso Nacional*; INF. Lili Fróis da Mota Mascarenhas;\nSILVA, G. *Constituinte*; TRIB. SUP. ELEIT. *Dados* (1).\n\n \n","dic":"DHBB"}
