{"title":"MOTA, João","cargoss":["Deputado federal","Senador"],"cargos_esp":[0,0],"datas_ini":[1991,2002],"datas_fim":[1992,2007],"estados":["ES","ES"],"autor":[0],"content":"**MOTA, João**\n\n\\*dep. fed. ES 1991-1992; sen. ES 2002-2007\n\n*João Batista da Mota* nasceu em Ibiraçu (ES) no dia 24 de junho de\n1937, filho de José Gomes da Mota e de Conceição Soares da Mota.\n\nFiliado em 1966 ao Movimento Democrático Brasileiro (MDB), partido de\noposição ao regime militar instaurado no país em abril de 1964, concluiu\no curso de direito pela Universidade Federal do Espírito Santo em 1971.\nCom a extinção do bipartidarismo em 29 de novembro de 1979, filiou-se ao\nPartido do Movimento Democrático Brasileiro (PMDB), em cuja legenda\nelegeu-se prefeito de Serra (ES) em novembro de 1982. Empossado em\nfevereiro de 1983, em sua gestão promoveu a instalação de unidades de\neducação (creches e escolas de primeiro e segundo graus) e saúde (postos\nmédicos e centros de saúde), atuando também nas áreas de urbanização e\nmelhoria do sistema viário urbano. Permaneceu no cargo até dezembro de\n1988.\n\nFiliado desde junho de 1988 ao recém-criado Partido da Social Democracia\nBrasileira (PSDB), elegeu-se nesta legenda deputado federal pelo\nEspírito Santo em outubro de 1990. Assumindo o mandato em março de 1991,\nno mesmo ano foi membro da Comissão de Viação e Transporte,\nDesenvolvimento Urbano e Interior, além de suplente da Comissão de\nAgricultura e Política Rural na Câmara dos Deputados.\n\nCandidatou-se pela segunda vez a prefeito da cidade de Serra, na legenda\ndo PSDB, em outubro de 1992. Eleito, renunciou ao seu mandato na Câmara\ndos Deputados em janeiro do ano seguinte para ocupar a prefeitura. Sua\nvaga foi ocupada por Helvécio Castelo. Permaneceu na prefeitura até\ndezembro de 1996.\n\nNo pleito de 1998, foi eleito suplente do senador Paulo Hartung. Em\n2002, Hartung foi eleito governador do Estado do Espírito Santo pelo\nPartido Socialista Brasileiro (PSB) e renunciou ao cargo de senador.\nApós a renúncia de Hartung, Batista Mota efetivou-se no cargo de\nsenador.\n\nEm 2003 com a instalação da Comissão Parlamentar Mista de Inquérito\n(CPMI) para investigar o esquema de lavagem de dinheiro, que teria\nmovimentado US\\$ 30 bilhões por meio do Banco do Estado do Paraná\n(Banestado), entre 1996 e 1999. Foi nomeado titular da CPI do Banestado.\n No mesmo ano, atuou como suplente da CPMI de Exploração Sexual e da\nCPMI do Desmanche. Ainda em outubro deste ano retornou à legenda do\nPMDB.\n\nNas eleições de 2004, candidatou-se para disputar a prefeitura de Serra\n(ES), mas dessa vez não teve sucesso.\n\nNo Senado Federal participou também como titular da CPMI da Compra de\nVotos, em 2005, e no ano seguinte como suplente da CPMI das Ambulâncias.\n\nNas discussões do Senado defendeu entre outros assuntos: a melhoria da\npolítica de exportações do país, visando às vendas externas de produtos\ncom maior valor agregado, ao invés da venda de produtos *in natura*; a\ncriação de camarão em cativeiro; a liberação da zona de amortecimento do\nParque Nacional Marinho dos Abrolhos; e a proteção do mercado interno\nbrasileiro das importações chinesas. Votou a favor da cobrança\nprevidenciária dos servidores inativos, um dos pontos da reforma da\nprevidência.\n\nEm dezembro de 2005 filiou-se ao Partido da Social Democracia Brasileira\n(PSDB).\n\nFoi também pequeno empresário, exerceu atividades nas áreas de indústria\nserralheira e transporte de cargas, atuando no setor de indústria,\ncomércio e exportação de madeiras.  Presidiu a Cooperativa dos Criadores\nde Camarão do Extremo Sul da Bahia.\n\nCasou-se com Marilda da Silva Mota, com quem teve três filhos.\n\nFONTES: CÂM. DEP. *Deputados brasileiros. Repertório*(1991-1995);\n*Perfil Parlamentar/IstoÉ*; *Senado Federal. Senadores; Folha On Line* (\n21/10/2003, 18/06/2003, 4/10/2004, 21/11/2004, 12/04/2006).\n\n \n","ref":"FONTES: CÂM. DEP. *Deputados brasileiros. Repertório*(1991-1995);\n*Perfil Parlamentar/IstoÉ*; *Senado Federal. Senadores; Folha On Line* (\n21/10/2003, 18/06/2003, 4/10/2004, 21/11/2004, 12/04/2006).\n\n \n","dic":"DHBB"}
