{"title":"MOTA, Lourival Seroa da                                          ","cargoss":["Interventor"],"cargos_esp":[0],"datas_ini":[1931],"datas_fim":[1933],"estados":["MA"],"autor":["Janeiro."],"content":"**MOTA, Lourival Seroa da                                          **\n\n\\*militar; interv. MA 1931-1933.\n\n*Lourival Seroa da Mota*nasceu na Bahia no dia 13 de abril de 1901.\n\nIngressou na carreira militar sentando praça na Escola Militar do\nRealengo, no Rio de Janeiro, então Distrito Federal, em abril de 1919.\nAspirante-a-oficial em janeiro de 1922, foi promovido a segundo-tenente\nem abril desse ano e a primeiro-tenente em janeiro de 1924.\n\nEm fevereiro de 1926 organizou na Paraíba um levante reunindo civis e\nmilitares, por ocasião da passagem da Coluna Prestes. Liderada por Luís\nCarlos Prestes e Miguel Costa, a coluna percorreu o interior do país\natravés de 13 estados, dando combate às tropas legais até internar-se em\n1927 na Bolívia (fevereiro) e no Paraguai (março).\n\nApós a Revolução de 1930 foi nomeado, em agosto de 1931, interventor\nfederal no Maranhão, no lugar de Astolfo de Barros Serra. Em dezembro\ndesse mesmo ano foi promovido a      capitão. Permaneceu à frente do\ngoverno maranhense até junho de 1933, quando foi substituído pelo\ncapitão Antônio Martins de Almeida. Nesse período passou a integrar o\nClube 3 de Outubro, organização criada em maio de 1931 congregando as\ncorrentes tenentistas partidárias do aprofundamento das reformas\ninstituídas pela Revolução de 1930.\n\nEm 1936 ingressou na Escola de Estado-Maior do Exército, da qual foi\ndesligado no ano seguinte por ter sido reprovado. Em seguida serviu no\n15º Batalhão de Caçadores (15º BC), em Curitiba. Promovido a major em\njulho de 1938, nesse mesmo ano voltou à Escola de Estado-Maior do\nExército, concluindo o curso no ano seguinte. Serviu no 9º BC, em Caxias\n(RS), de 1940 a 1941. No ano seguinte serviu na inspetoria do 1º Grupo\nde Regiões Militares.\n\nEm abril de 1943 foi promovido a tenente-coronel. Ainda nesse ano foi\nnomeado auxiliar do chefe da Comissão Mista de Defesa Brasil-Estados\nUnidos, instalada em Washington. Serviu, de 1947 a 1950, no Estado-Maior\ndo Exército (EME). Coronel em 1950, durante esse ano foi membro efetivo\ndo conselho fiscal do Clube Militar do Rio de Janeiro, sob a direção do\ngeneral Newton Estillac Leal, identificado como um dos líderes da\ncorrente nacionalista do Exército. Em 1951 assumiu o comando do 28º BC,\nem Aracaju. Em 1952 tornou-se comandante do Colégio Militar do Rio de\nJaneiro.\n\nFONTES: ARQ. CLUBE 3 DE OUTUBRO; ARQ. GETÚLIO VARGAS; *Grande\nencic*.*Delta*;**MEIRELES, M. *História*;**MIN.\nGUERRA.*Almanaque*(1952); PEIXOTO, A. *Getúlio*;**POPPINO, R.\n*Federal*;*Rev. Clube Militar*;**TÁVORA, J. *Vida*.\n\n \n","ref":"FONTES: ARQ. CLUBE 3 DE OUTUBRO; ARQ. GETÚLIO VARGAS; *Grande\nencic*.*Delta*;**MEIRELES, M. *História*;**MIN.\nGUERRA.*Almanaque*(1952); PEIXOTO, A. *Getúlio*;**POPPINO, R.\n*Federal*;*Rev. Clube Militar*;**TÁVORA, J. *Vida*.\n\n \n","dic":"DHBB"}
