{"title":"ARNS, Paulo Evaristo","cargoss":["Arcebispo"],"cargos_esp":["São Paulo"],"datas_ini":[1970],"datas_fim":[1998],"estados":[0],"autor":[0],"content":"**ARNS, Paulo Evaristo**\n\n\\*religioso; arceb. São Paulo 1970-1998.\n\n \n\n*Paulo Evaristo Arns* nasceu em Criciúma (SC) no dia 14 de dezembro de\n1921, filho de Gabriel Arns e de Helena Steiner Arns. Seu pai foi\nnegociante e proprietário de serrarias, tendo chegado a criar uma\ncooperativa para a venda de madeira. Desenvolveu essa atividade até a\népoca em que Paulo Evaristo tinha oito anos de idade, quando, devido a\ndificuldades financeiras, viu-se forçado a vender seu negócio. Daí em\ndiante, toda a família passou a ajudar nos trabalhos da roça, inclusive\no menino Paulo Evaristo. Tanto seus avós paternos quanto maternos eram\nimigrantes alemães.\n\nFez o curso primário em sua cidade natal, prosseguindo os estudos no\nParaná, onde frequentou o Colégio São Luís, em Rio Negro. Ainda nessa\ncidade estudou no seminário dos franciscanos de 1934 a 1940, e em\nseguida cursou a Faculdade de Filosofia de Curitiba. Em 1944 ingressou\nna Faculdade de Teologia de Petrópolis, no estado do Rio de Janeiro.\nOrdenou-se sacerdote em novembro do ano seguinte e concluiu o curso de\nteologia em 1947. Entre esse ano e 1952 estudou em Paris, onde, após\nlicenciar-se em letras pela Universidade da Sorbonne, doutorou-se pela\nAcademia de Paris com a tese *A técnica do livro em São Jerônimo,* com a\nqual obteve o grau máximo. Fez ainda cursos de especialização em\npedagogia na Escola Superior de Pedagogia de Paris e em literatura na\nÉcole des Hautes Études da Sorbonne.\n\nDe volta ao Brasil, lecionou no Seminário Menor de Agudos, em São Paulo,\nde 1953 a 1955, fundando ainda a cadeira de língua e literatura francesa\nna Faculdade de Filosofia, Ciências e Letras de Bauru (SP). Em seguida\ntrabalhou durante dez anos e meio em Petrópolis, como professor de\nteologia no seminário onde estudara, e de didática geral na Universidade\nCatólica. Nessa mesma cidade dedicou-se à atividade apostólica no bairro\noperário de Itamarati, ocupando-se das escolas e da promoção social, o\nque lhe proporcionou estreito contato com a população. Foi também\nvice-provincial dos franciscanos, desenvolvendo ainda outras atividades,\ncomo a de redator da revista *Vozes* e de outras publicações da editora\ndos franciscanos.\n\nEm maio de 1966 foi nomeado bispo pelo papa Paulo VI, que o indicou para\ntrabalhar com o cardeal dom Agnelo Rossi na Arquidiocese de São Paulo.\nDesse ano até 1970, atuou como vigário episcopal em Santana, distrito\nlocalizado na zona norte da cidade de São Paulo. Lá trabalhou integrado\ncom padres, religiosos e leigos, preocupado com a formação permanente do\nclero e do povo. Criou a Missão do Povo de Deus, passando um tempo em\ncada paróquia da região com uma equipe para multiplicar os ensinos do\nConcílio Ecumênico Vaticano II. A partir dessa missão, avançou na\nevangelização das ruas da Arquidiocese, estimulando a formação das\nComunidades Eclesiais de Base (CEBs).\n\nComo bispo auxiliar de São Paulo, foi designado em abril de 1968 membro\ndo secretariado do Vaticano para os não-crentes, e foi eleito secretário\nnacional de educação da Conferência Nacional dos Bispos do Brasil\n(CNBB), entidade que congrega todos os bispos brasileiros e que\ncentraliza as principais resoluções relativas à atuação da Igreja.\nPertenceu também à comissão teológica da CNBB. Em 22 de outubro de 1970,\ndevido à nomeação de dom Agnelo Rossi para a prefeitura da Sagrada\nCongregação para a Evangelização dos Povos, no Vaticano, foi nomeado\narcebispo metropolitano de São Paulo, e em 1º de novembro seguinte tomou\nposse.\n\n            ****\n\nGoverno Médici (1969-1974): contra as prisões e as torturas\n\nEm sua atuação à frente da Arquidiocese de São Paulo, dom Paulo Evaristo\nArns guiou-se pelo princípio da defesa dos direitos humanos. Assumindo o\narcebispado num momento em que a vida política nacional era marcada pela\nluta armada movida por grupos de oposição ao regime e pela repressão por\nparte dos órgãos de segurança do governo do presidente Emílio Garrastazu\nMédici, manifestou grande preocupação com as vítimas das torturas e dos\nabusos policiais. Logo no início de seu arcebispado, começou a\ndesenvolver esforços no sentido de apurar denúncias de prisões e de\ntorturas. Assim, interferiu no caso dos frades dominicanos presos em\n1969 sob a acusação de envolvimento com Carlos Marighela, dirigente da\norganização clandestina Ação Libertadora Nacional, fazendo-lhes uma\nvisita de apoio, a primeira desse tipo da parte de uma autoridade da\nIgreja.\n\nAinda em novembro de 1970, por ocasião da prisão e da denúncia de\ntorturas infligidas ao padre Giulio Vicini e à assistente social Iara\nSpadini, exigiu das autoridades militares que ambos fossem examinados\npor três membros da Associação Médica de São Paulo. Diante da recusa do\ncomandante do II Exército, general Humberto de Sousa Melo, chegou a\nrecorrer ao governador do estado, Roberto de Abreu Sodré, com resultado\nigualmente desfavorável. Impedido pelas autoridades de visitar presos\npolíticos que faziam greve de fome num presídio paulista, por ocasião\ndas comemorações do dia de Pentecostes, em 1971, fez afixar em centenas\nde igrejas de São Paulo uma carta na qual lamentava que “neste país\ncristão, quando estão em jogo vidas humanas, aquele que de Deus recebeu\no múnus de pastor seja impedido de cumprir sua missão específica, aliás\ngarantida por nossa Carta Magna”.\n\nEm junho de 1972, ocupando o cargo de presidente regional da CNBB,\nesteve à frente do lançamento pelo episcopado paulista, reunido em\nBrodósqui (SP), do documento *Testemunho de* *paz,*em que eram de\ndenunciadas as formas pelas quais se vinham processando as prisões\npolíticas — muitas delas revestindo-se “do aspecto de verdadeiros\nsequestros” — e os métodos de tortura utilizados nos interrogatórios. O\ndocumento tornou-se alvo de forte censura por parte do governo federal,\nsendo proibida sua divulgação no semanário da Arquidiocese, *O* *São\nPaulo,*que, como os demais órgãos de imprensa, se encontrava submetido à\ncensura prévia.\n\nChamado ao Rio de Janeiro para um encontro com autoridades militares,\nouviu do general Antônio Carlos Muricy, ex-chefe do Estado-Maior do\nExército (EME), que o documento fazia uma acusação “muito grave” e que\npoderia ser processado por isso. Respondeu que “aceitava o processo,\ncontanto que fosse público e que ele pudesse dar garantia às testemunhas\nque, nos hospitais e outros lugares, acompanharam pessoas que foram\ntorturadas e morreram”.\n\nLogo no início de 1973, em 2 de fevereiro, foi feito cardeal com o\ntítulo de Santo Antônio de Via Tuscolana, sendo sagrado no consistório\nde 5 de março do mesmo ano. Devido às suas atitudes pessoais em defesa\ndos direitos humanos, prosseguiram os confrontos com autoridades do\ngoverno, o que suscitou reprovações dos setores mais conservadores da\nIgreja. Cogitava-se de que pressões estariam sendo feitas também junto\nao Vaticano. Ao procurar averiguar o fato, obteve garantias contrárias.\n\nEm 30 de março, junto com dom José Melhado Campos, bispo de Sorocaba\n(SP), e mais 24 padres, reuniu cerca de três mil pessoas na Catedral da\nSé para a celebração da missa de sétimo dia do estudante Alexandre\nVanucchi Leme, assassinado pelas forças de segurança do governo, em ato\nque representou a primeira grande manifestação política de estudantes\ndesde 1969, e que foi considerado pelo brasilianista Kenneth Serbin o\ndespertar da Igreja Católica para a luta pelos direitos humanos no país.\n\nTambém em 1973, criou na Arquidiocese de São Paulo a Comissão de Justiça\ne Paz, organismo encarregado de cuidar dos assuntos jurídicos em defesa\ndos direitos da pessoa humana, especialmente dos que competiam aos\npresos políticos, e que se constituiria em um dos principais\ninstrumentos de proteção às vítimas da repressão policial no país.\nAssumiu também a prelazia de Itacoatiara, no Amazonas, enviando padres e\nagentes de educação para desenvolver projetos com as comunidades\npredominantemente indígenas da região.\n\nAinda em maio de 1973, efetuou a venda do palácio episcopal em São Paulo\ne mudou-se para uma residência no bairro do Sumaré. O dinheiro obtido\ncom essa transação imobiliária seria utilizado na chamada Operação\nPeriferia, que idealizou com o objetivo de criar centros comunitários\nnos bairros mais afastados da cidade, consolidando assim as bases do\ntrabalho pastoral voltado para os pobres. Em outubro seguinte, promoveu\nem São Paulo a Semana dos Direitos Humanos, divulgando-a através de 150\nmil folhetos e da Rádio 9 de Julho, que pertencia à Arquidiocese e teve\nsua concessão logo cancelada pelo governo. A semana foi de grande\nimportância para a denúncia das prisões e torturas que, segundo se\nafirmava, continuavam a ser executadas pelos órgãos de repressão.\n\nTambém nesse período, participou de dois dos encontros da chamada\nComissão Bipartite, fórum de discussão secreto que se reuniu entre 1971\ne 1974 com o objetivo de impedir a deterioração das relações\nIgreja-Estado e que era integrado por importantes lideranças da Igreja\nCatólica, como dom Aluísio Lorscheider, secretário-geral e depois\npresidente da CNBB, dom Ivo Lorscheiter, dom Avelar Brandão,\nvice-presidente da CNBB, dom Lucas Moreira Neves, bispo auxiliar de São\nPaulo, e por oficiais das forças armadas, do Serviço Nacional de\nInformações (SNI) e do Centro de Informações do Exército (CIE). Nessas\nreuniões, o primeiro escalão do clero cobrou da cúpula militar a\ninvestigação dos casos de violação de direitos humanos e o fim do\ncerceamento da liberdade de expressão e da perseguição política.\n\nEntre setembro de 1974 e o início do ano seguinte, obteve dois cargos no\nVaticano: em setembro foi eleito membro da Sagrada Congregação para o\nCulto Divino e, em janeiro de 1975, foi nomeado consultor da Comissão\nPontifícia para a América Latina, organismo do Vaticano cuja finalidade\né dar assistência aos programas religiosos do continente.\n\n \n\nGoverno Geisel (1974-1979): pela liberdade de expressão\n\nEntre julho e agosto de 1975 foram efetuadas numerosas prisões em São\nPaulo. Em outubro, foi preso o jornalista Vladimir Herzog, que poucos\ndias depois morreu nas dependências do II Exército, comandado pelo\ngeneral Ednardo D’Ávila Melo. Desde que recebera denúncias da prisão e\ndas torturas que o jornalista estaria sofrendo, dom Paulo Evaristo se\nencarregara de apurá-las pessoalmente, exigindo mais uma vez o\nposicionamento das autoridades responsáveis. Procurou estabelecer\ncontato direto com o chefe do Gabinete Civil da Presidência da\nRepública, general Golbery do Couto e Silva, com o qual já se avistara\nem outras ocasiões semelhantes. Recebeu, todavia, através do governador\ndo estado, Paulo Egydio Martins, a recomendação do general de que\nutilizasse o “escalão normal” para aquele contato, ou seja, o próprio\ngovernador.\n\nCom a morte do jornalista, realizou-se ato ecumênico na Catedral da Sé,\ntendo dom Paulo concordado em celebrá-lo, apesar das pressões contrárias\ndo governo federal. O presidente Geisel, que se encontrava na ocasião em\nSão Paulo, designou dois secretários do governo estadual para tentar\ndissuadi-lo, mas o arcebispo manteve sua decisão. Ainda em outubro de\n1975, o episcopado paulista, reunido em Itaici (SP), lançou o documento\n*Não oprimas teu irmão,*condenando os atos de violência dos órgãos de\nrepressão e “sobretudo os graves acontecimentos” que vinham\n“estarrecendo e inquietando a população de São Paulo”.\n\nEm maio de 1976, foi empossado como jornalista militante pela Associação\nBrasileira de Imprensa (ABI) em São Paulo. Em março de 1977, assinou\nnota prestando a solidariedade dos bispos de São Paulo a dom Tomás\nBalduíno, bispo de Goiás (GO), e a dom Pedro Casaldáliga, bispo de\nConceição do Araguaia (PA), e expressando ao mesmo tempo a descrença do\nepiscopado paulista em relação às acusações de subversão que teriam sido\nfeitas àqueles religiosos por dom Geraldo Proença Sigaud, bispo de\nDiamantina (MG). Ainda nessa oportunidade, fez-se portador da carta dos\ndois bispos endereçada ao papa Paulo VI, reiterando assim seu\nincondicional apoio a ambos.\n\nEm maio de 1977, juntamente com o presidente dos EUA, Jimmy Carter, o\nsecretário-geral da Organização das Nações Unidas (ONU), Kurt Waldheim,\ne mais quatro religiosos de outros países, recebeu em Washington o\ntítulo de doutor *honoris causa*pela defesa dos direitos humanos,\nconferido pela Universidade de Notre-Dame. Durante a solenidade,\ndeclarou que recebia a honraria “em nome de muitos que mereciam muito\nmais, como o cardeal dom Henriques”, que criara o Vicariato da\nSolidariedade em Santiago do Chile, organismo de defesa dos direitos\nhumanos naquele país. Em seu discurso, referiu-se à situação de grande\nparte da humanidade que vivia sem a garantia de seus direitos\nfundamentais, exortando à construção de sociedades baseadas na justiça e\nna paz na América Latina e no mundo. Destacou também a violação dos\ndireitos humanos no Brasil, chamando atenção para três pontos que o\nvinham preocupando: a inconstitucionalidade, as torturas e a diferença\nna distribuição de renda.\n\nDe volta ao Brasil, encontrou no plenário do Congresso a discussão sobre\no divórcio. Fiel à posição da Igreja, pronunciou-se contrário ao projeto\nque instituía a medida, adotando porém uma atitude de reserva e\ninsistindo no aspecto pouco relevante da questão para a sociedade\nbrasileira naquele momento, ao mesmo tempo que advertia para “os reais\nproblemas da grande maioria da população”.\n\nEm setembro de 1977, a Comissão de Justiça e Paz, com o apoio da\nArquidiocese de São Paulo e juntamente com outras entidades religiosas e\nleigas, lançou o documento *Pela justiça e pela libertação*em ato\npúblico realizado na praça da Sé. O documento anunciava as perseguições\ne agressões praticadas contra religiosos no exercício de suas funções\npastorais, apresentando um dossiê completo, até aquela data, dos\nacontecimentos ocorridos. No mesmo mês de setembro, a invasão da\nPontifícia Universidade Católica de São Paulo (PUC-SP) pela polícia do\nestado suscitou enérgica atitude do arcebispo em defesa da instituição e\ndos estudantes. Dom Paulo responsabilizou os policiais pelos tumultos\nregistrados na universidade. Quanto aos estudantes enquadrados na Lei de\nSegurança Nacional, garantiu-lhes o apoio da Comissão de Justiça e Paz.\nAinda nesse mês, apoiou a Ato da Penha, em solidariedade aos perseguidos\npela ditadura militar, organizado por 20 entidades laicas que produziram\no documento *Epístola dos leigos pela justiça e libertação*.\n\nEm novembro de 1977 perdurava ainda a censura prévia ao jornal da\nArquidiocese, *O* *São Paulo.*Dom Paulo recorreu à Justiça, impetrando\nmandado de segurança contra o veto que havia sido imposto à circulação\nde um número do semanário. Acompanhou-o na ação judicial o senador\noposicionista André Franco Montoro, já que os trechos censurados faziam\nparte do discurso por ele proferido no Congresso. Entretanto, o recurso\nnão recebeu parecer favorável da Justiça, sendo mantida a censura prévia\nao jornal por mais algum tempo.\n\nAinda em novembro, dom Paulo manifestou sua incredulidade quanto ao\nprocesso de abertura política no país, deixando clara a pouca esperança\nque depositava no diálogo que o senador governista Petrônio Portela\nvinha desenvolvendo com representantes da sociedade civil. Para o\ncardeal, “a proposta de diálogo só seria útil se feita amplamente com o\npovo”. Em dezembro, redigiu a apresentação do documento*Violência contra\nos humildes,*elaborado pela Pastoral dos Marginalizados e divulgado pela\nComissão dos Direitos Humanos da Arquidiocese de São Paulo. O documento\ndenunciava a violência cometida por setores da polícia, especialmente\ncontra a população dos bairros mais pobres, advertindo que “a violência\ncontra os humildes é o mais pesado sintoma de estruturas sociais\ninteiramente falhas”.\n\nAinda no ano de 1977, foi o primeiro cardeal a visitar o Paraguai, para\nconhecer o trabalho do Comitê Ecumênico de Igrejas. Nesse período, cedeu\numa sala da Cúria Metropolitana de São Paulo para o Alto Comissariado\ndas Nações Unidas para Refugiados, a fim de atender ao crescente fluxo\nde perseguidos políticos vindos de países vizinhos (Argentina, Chile e\nUruguai, principalmente) onde também havia repressão militar.\n\nEm março de 1978, por ocasião da visita do presidente dos EUA, Jimmy\nCarter, ao Brasil, dom Paulo foi convidado a participar no Rio de\nJaneiro de um encontro restrito com o presidente norte-americano e\noutras cinco personalidades brasileiras. Na ocasião recebeu de Carter o\nassentimento para que tornasse pública a carta que anteriormente lhe\nenviara, relacionando os nomes de 27 brasileiros desaparecidos, e além\ndisso entregou ao visitante um memorando em que abordava três questões:\na segurança nacional, as multinacionais e as minorias oprimidas.\n\nEm junho do mesmo ano foi suspensa a censura prévia a *O São\nPaulo*,**última publicação a ser liberada desse tipo de controle\noficial. Imediatamente, o cardeal iniciou uma campanha para recuperar a\nRádio 9 de Julho.\n\nEm meados de 1978 tramitava no Congresso o projeto de anistia do\ngoverno, excluindo os envolvidos em ações armadas. Essa restrição gerou\nprotestos dos presos políticos, que realizaram várias greves de fome\nentre setembro e outubro desse ano. A situação era tensa, mas dom Paulo\nafirmou não acreditar em radicalização, primeiro porque “o povo não\nquer” e, depois, porque “precisamos estar unidos no momento em que a\nvolta ao estado democrático se anuncia para logo”. Em outubro, ao\ncomentar a sentença declaratória proferida em favor da família do\njornalista Vladimir Herzog, o cardeal declarou ser hora de “todos os\nparentes de pessoas desaparecidas iniciarem processo semelhante para\nresponsabilizar o Estado por aqueles que desapareceram” e “para que não\nse repitam mais tais coisas na história da nação”. Ainda em outubro, foi\neleito presbítero das Congregações Gerais dos Cardeais, entidade que\nseria responsável pela preparação do conclave que elegeria o novo papa,\nem substituição a João Paulo I (Albino Luciani), eleito em agosto e\nfalecido menos de dois meses depois. No conclave de outubro foi eleito\nKarol Wojtyla (João Paulo II).\n\nNos últimos meses de 1978 especulava-se que a candidatura do general\nJoão Batista Figueiredo à sucessão presidencial poderia significar a\nviabilização do projeto de abertura iniciado durante o governo Geisel.\nEm novembro realizaram-se também eleições para cargos legislativos,\ncujos resultados, nos principais centros do país, foram favoráveis aos\ncandidatos da oposição. Dom Paulo manifestou seu otimismo diante dos\nresultados eleitorais, afirmando que os candidatos eleitos poderiam\nchegar “a uma nova Constituinte”, assim como “a uma reformulação de todo\no sistema político e econômico”. Ao mesmo tempo, tornou público um\npedido aos candidatos vitoriosos dos dois partidos para que “se\nmantivessem em contato com as bases”.\n\nNos primeiros meses de 1979 ultimavam-se os preparativos para a\nrealização da III Conferência Episcopal Latino-Americana (Celam) em\nPuebla, no México. Os resultados desse encontro eram esperados com\ngrande expectativa pelos setores mais progressistas da Igreja, que\nansiavam por uma confirmação das teses da II Celam, realizada em\nMedellín, na Colômbia. Dom Paulo Evaristo participou da reunião, tendo\napresentado o documento *Repressão à Igreja* *no Brasil,*com o objetivo\nde “servir de subsídio aos grupos de trabalho” que discutiriam “os\ndiversos aspectos da evangelização”. Durante sua permanência no México,\nmanteve contatos com exilados brasileiros residentes nesse país.\n\n \n\nGoverno Figueiredo (1979-1985): pela justiça social\n\nEm 15 de março de 1979, o general João Figueiredo tomou posse como\npresidente da República, reiterando seu propósito de promover o retorno\ndo país à normalidade democrática. Paralelamente, iniciou-se um período\nde constantes movimentos reivindicatórios populares, destacando-se as\ngreves sindicais. Em maio, dom Paulo divulgou o documento *A Igreja e as\nreivindicações populares*em resposta às acusações do delegado regional\ndo Trabalho de São Paulo, Vinícius Ferraz Torres, de que o clero estaria\ndando “cobertura exagerada” aos movimentos grevistas. O documento,\nsubscrito pelos bispos de São Paulo, defendia a reformulação da\nlegislação social, a negociação direta entre patrões e empregados e o\ndireito de greve dos operários, reafirmando ainda o direito do clero de\n“estar presente ao lado dos mais humildes e desprotegidos”.\n\nEm agosto seguinte, dom Paulo lançou uma campanha mundial para a\nlocalização de cerca de cem menores, principalmente argentinos e\nuruguaios, sequestrados e desaparecidos juntamente com seus pais ou\nsozinhos. A campanha foi lançada através do Comitê de Defesa dos\nDireitos Humanos para os Países do Cone Sul, órgão vinculado à Comissão\nArquidiocesana de Direitos Humanos e Marginalizados. Na ocasião, o\ncardeal divulgou uma lista parcial de 45 menores desaparecidos na\nArgentina, no Uruguai e na Bolívia. ****\n\nEm setembro, dom Paulo se pronunciou a favor de uma reforma agrária,\nadvertindo que ela não poderia ser feita “sem sindicatos autônomos, bem\nestruturados”, nos quais, “em vez de apoio às grandes empresas e às\nmultinacionais”, haveria “o apoio às empresas pequenas e médias” em\ntodos os setores, “tanto na agricultura como na indústria”.\n\nAinda em setembro de 1979, às vésperas da aprovação do projeto de\nreformulação partidária do governo, que extinguiria o bipartidarismo,\nacirraram-se os debates em torno da formação dos novos partidos, ao\nmesmo tempo que se especulava acerca da legalização do Partido Comunista\nBrasileiro (PCB). Em 29 de setembro, a Aliança Renovadora Nacional\n(Arena), situacionista, e o Movimento Democrático Brasileiro (MDB), de\noposição, foram afinal extintos. Quanto à legalização do PCB, dom Paulo\nconsiderou-a “inevitável” no processo de redemocratização em curso no\npaís, afirmando que não se devia “ver fantasmas onde eles não existem”.\nEm sua opinião, “o povo brasileiro não quer[ia] comunismo ou marxismo”,\nalmejando apenas “viver em paz e dignamente”. Sobre a criação do Partido\ndos Trabalhadores (PT), agremiação que reunia lideranças expressivas do\nmovimento sindical, declarou considerar “normal a articulação de um\npartido operário”, acrescentando que entendia “ser necessário que todos\nos setores da sociedade se articulassem” para que “não se perdesse o\nbonde no momento em que o país passava por uma situação que exigia\nmudanças reais e não apenas reformismo”.\n\nNo início de 1980 registrou-se forte movimento grevista na região do ABC\nde São Paulo. Os metalúrgicos iniciaram um processo reivindicatório de\naumento salarial junto à Justiça do Trabalho e sustentaram uma greve\ndemorada. Todo o clero paulista — e, em especial, os padres e freiras\nligados à pastoral operária — prestou ajuda aos grevistas. Em apoio às\ngreves operárias, foi realizado no mês de abril um ato litúrgico que\nreuniu cerca de sete mil pessoas na Catedral da Sé, oficiado pelo\ncardeal dom Paulo Evaristo Arns e nove bispos auxiliares. Em decorrência\nda greve, as diretorias dos sindicatos do ABC, entre elas a do sindicato\nde São Bernardo do Campo, encabeçada por Luís Inácio da Silva, o Lula,\nforam destituídas, sendo alguns de seus membros enquadrados na Lei de\nSegurança Nacional.\n\nAinda em 1980, com o estímulo de dom Paulo, estudantes, professores e\nfuncionários da PUC de São Paulo realizaram a primeira eleição para\nescolha do reitor da universidade.\n\nEm abril de 1981, quando se publicou a decisão do governo de incluir\nalterações na Lei dos Estrangeiros — conjunto de normas que regulam as\natividades públicas dos estrangeiros no Brasil —, dom Paulo se\npronunciou contrário às propostas anunciadas pelo ministro da Justiça,\nIbraim Abi-Ackel, afirmando que elas “não favoreciam aqueles que já se\nencontravam entre nós, sofrendo sem poderem contar com o apoio do país\nonde se exilaram”. Na ocasião pediu, ainda, “uma ampla anistia para\ntodos os estrangeiros que viviam no Brasil em situação irregular”.\n\nTambém nesse mês, ao ensejo da Páscoa, dom Paulo divulgou uma mensagem\ncujos temas centrais foram a inflação e o desemprego. Aludindo à crise\neconômica por que passava a sociedade brasileira, chamou a atenção para\n“a injustiça na distribuição de seus encargos, que vinham pesando, em\nprimeiro lugar, sobre as famílias que já viviam com o estritamente\nnecessário”. Por outro lado, alertou para a responsabilidade “das\ngrandes empresas”, salientando a “estratégia perigosa” de “retirar-se de\nonde o lucro é menor e investir em outros lugares”.\n\nAinda em abril, foi a Roma participar da sessão plenária do secretariado\ndos não-crentes. Nessa oportunidade avistou-se com o papa João Paulo II\ne discorreu sobre os problemas da sociedade brasileira que mereciam\nmaior atenção no momento. A propósito da posição da Igreja frente aos\nsindicatos, declarou ao papa que julgava necessário “salvaguardar a\nunidade sindical, dar maior atenção aos que ganham menos, dando-lhes\npreferência nas negociações”. Relatou ainda ao sumo pontífice seu\nprojeto de subdividir a diocese da capital paulista em dez ou 11\ndioceses metropolitanas, cada qual com seu próprio bispo, mas com uma\nadministração comum, “para que os bairros mais ricos possam auxiliar os\nmais pobres”.\n\nNo mês de maio, a série de atentados que vinham ocorrendo desde meados\nde 1980 culminou com o episódio do Riocentro, no Rio de Janeiro, durante\nas comemorações do Dia do Trabalho. Na ocasião, uma bomba explodiu no\ninterior de um automóvel, causando a morte de um sargento e ferindo\ngravemente um capitão do Exército que se encontravam dentro do veículo.\nComo das vezes anteriores, as investigações policiais se desenvolviam\nsem que fossem indicados os responsáveis. A gravidade do acontecimento —\na imprensa aventou a hipótese de os autores do atentado serem suas\npróprias vítimas — fez com que se considerasse sob ameaça o projeto de\nabertura do governo, o que suscitou manifestações de apoio dos partidos\nde oposição ao presidente João Figueiredo. Dom Paulo reiterou esse\napoio, acrescentando, porém, que ele devia significar também “um\nultimato sério e definitivo para que a verdade fosse publicada” e para\nque “terminasse esta fase de combate covarde à redemocratização”.\n\nEm agosto de 1981, apresentou aos padres os 149 *slides*do trabalho *Fé\ne política — povo de Deus e participação política*, destinado às CEBs,\nque haviam tido grande desenvolvimento desde a década de 1970,\nespecialmente junto à população mais pobre, e a outros núcleos cristãos,\ncomo subsídio para incentivar a discussão sobre o assunto. Criticou as\nmatérias que vinham sendo publicadas na imprensa sobre o caráter\npolítico-ideológico do trabalho, explicando que “o decisivo é despertar\no povo para a grande política e incentivar a ação partidária dos leigos\na partir dos critérios apresentados”, sempre com o cuidado de “não se\ndeixar instrumentalizar, nem instrumentalizar a Igreja”.\n\nEm 1982, foi membro fundador da Comissão Independente Internacional das\nNações Unidas para Questões Humanitárias, criada em decorrência da\nAssembléia Geral da ONU de 1981, sendo o único religioso em todo o mundo\neleito para compô-la.\n\nEm janeiro de 1983, divulgou na Cúria Metropolitana de São Paulo a mais\ncompleta lista até então elaborada de desaparecidos políticos na\nArgentina, durante o regime militar naquele país. O trabalho, prefaciado\npelo próprio dom Paulo e intitulado *Desaparecidos en Argentina*, fora\nrealizado pelo Comitê de Defesa dos Direitos Humanos no Cone Sul\n(Clamor) e relacionava os nomes de 7.791 pessoas desaparecidas entre\n1977 e 1982, englobando cidadãos de 27 países, sendo 13 brasileiros. Na\nmesma ocasião, divulgaram-se os nomes de três brasileiros desaparecidos\nno Chile em 1973, além da lista de 128 brasileiros desaparecidos no\nBrasil a partir de 1964. O dossiê foi enviado à ONU e à Organização dos\nEstados Americanos (OEA), sendo encaminhado indiretamente ao governo\nargentino por intermédio de sua representação diplomática na Dinamarca.\nEm audiência privada no Vaticano, o próprio dom Paulo o entregou ao papa\nJoão Paulo II.\n\nEm março do mesmo ano, ao ensejo da Páscoa, dom Paulo proclamou a\nnecessidade de se fortalecer o processo de redemocratização do país, com\na realização de eleições diretas em todos os níveis, e a distribuição de\nterras para permitir a volta do homem ao campo. Afirmou que uma política\nvoltada para a terra seria também “uma política voltada para a Justiça”,\ndefendendo a continuidade da luta das instituições da sociedade civil em\nprol dos direitos humanos, mesmo após a consolidação da abertura\ndemocrática.\n\nEm setembro de 1984, dom Paulo Evaristo Arns, dom Aluísio Lorscheider e\ndom Ivo Lorscheiter solidarizaram-se com o teólogo brasileiro Leonardo\nBoff, acusado pela Santa Sé de cometer erros teológicos em seu livro\n*Igreja**: carisma e poder*, ao afirmar que a Igreja nos países do\nTerceiro Mundo deveria contribuir para a “libertação dos oprimidos”, e\nnão limitar-se ao papel de “espectadora dos dramas sociais”. Os prelados\nintercederam por Boff junto ao papa João Paulo II, mas no início de 1985\no teólogo foi compelido ao silêncio por um período de 11 meses.\n\n \n\nGoverno Sarney (1985-1990): pela reforma agrária\n\nO início do ano de 1984 foi marcado por uma intensa mobilização popular\nem favor da aprovação da emenda Dante de Oliveira, que previa a\nrealização de eleições diretas para a presidência da República ainda\nnaquele ano. Com a derrota da proposta na Câmara dos Deputados em abril,\ntiveram início os entendimentos que culminaram na eleição pelo Colégio\nEleitoral, em janeiro do ano seguinte, da chapa formada por Tancredo\nNeves e José Sarney. A posse de Sarney em 15 de março de 1985,\ndeterminada pela doença Tancredo, e confirmada em abril pela morte\ndeste, foi um marco do processo de transição democrática no país, com o\nretorno de um civil à presidência da República.\n\nDom Paulo Evaristo Arns tornou-se então um dos principais interlocutores\nda sociedade civil junto ao novo governo. Assim, foi procurado pelo\npresidente Sarney com vistas à discussão de um “entendimento nacional” —\nexpressão escolhida pelo palácio do Planalto para substituir “pacto\nsocial” — envolvendo empresários, trabalhadores, Igreja e intelectuais a\nfim de viabilizar medidas econômicas e sociais em face da situação de\ncrise do país. Sarney afirmou reconhecer a influência da Igreja\nCatólica, em especial da ala progressista representada pelo cardeal\nArns, sobre muitos dos sindicatos filiados à Central Única dos\nTrabalhadores (CUT), através das CEBs. No período que se seguiu, dom\nPaulo destacou-se sobretudo por sua atuação na defesa da luta pela\nterra, apontando em diversas ocasiões a necessidade de realização da\nreforma agrária no país.\n\nAinda em 1985, no mês de junho, dom Paulo foi impedido de viajar para a\nÁfrica do Sul por se recusar a assinar um documento comprometendo-se a\nnão participar de manifestação contra a política racista do *apartheid*,\nexigido pela representação diplomática daquele país. O incidente gerou a\ndivulgação de uma nota do Itamaraty lamentando a atitude do governo da\nÁfrica do Sul, já que, para a concessão do visto de entrada do cardeal\narcebispo, havia sido exigida uma carta de apresentação do próprio\nministro das Relações Exteriores do Brasil, Olavo Setúbal.\n\nEm julho seguinte, foi divulgado pela Arquidiocese de São Paulo o mais\namplo dossiê sobre a tortura política praticada no Brasil entre abril de\n1964 e março de 1979, consolidado no livro *Brasil — nunca mais*. Sob a\ncoordenação do próprio dom Paulo Evaristo Arns, uma equipe de 30 pessoas\n— cujos nomes foram mantidos em segredo — pesquisou 707 processos\nenvolvendo presos políticos analisados no Superior Tribunal Militar\n(STM) em Brasília. Todo o material obtido junto ao STM foi coligido,\nselecionado e microfilmado, tendo o projeto previsto, a princípio, a\norganização de uma enciclopédia da tortura no Brasil e de uma biblioteca\nformada por cerca de dez mil publicações da esquerda brasileira\n(jornais, panfletos e manifestos) que haviam sido anexadas aos processos\nda Justiça Militar, além do próprio livro. Quando do lançamento de\n*Brasil — nunca mais*, dom Paulo negou qualquer ânimo revanchista que\npudesse ser atribuído à publicação e ressaltou o objetivo do livro, de\nrealizar um registro histórico e objetivo dos fatos políticos do país.\nTrês anos depois, a Arquidiocese paulista lançaria um novo dossiê\nintitulado *O perfil dos atingidos*, com o objetivo de apresentar os\nexemplos típicos das pessoas que haviam sido vítimas da repressão\ndurante os governos militares, resgatando o conteúdo das publicações de\noposição então existentes.\n\nA publicação de *Brasil — nunca mais* levou à abertura, em janeiro de\n1986, de um processo contra a Editora Vozes, responsável pela edição do\nlivro, movido pelo médico-legista Elias Freitas, do Instituto Médico\nLegal (IML) do Rio de Janeiro. Citado no dossiê como um dos médicos que\nforneciam laudos falsos para acobertar mortes sob tortura durante o\nregime militar, Freitas apresentou queixa-crime com base na Lei de\nImprensa, que previa a condenação dos responsáveis por publicações\ncaluniosas, com pena de detenção de até três anos. Dom Paulo foi\nconvocado a depor em agosto, e seus advogados, Hélio Bicudo e Mário\nSimas, impetraram um *habeas-corpus* junto à Justiça de Petrópolis. Em\noutubro seguinte, o Tribunal de Alçada do Rio de Janeiro determinou o\narquivamento da ação penal, por entender que a queixa-crime não era a\nmedida adequada para o caso, tendo em vista que os processos por abuso\ndo exercício da liberdade de manifestação pressupunham crimes cometidos\nem publicações periódicas, não se enquadrando nessa categoria o livro\n*Brasil — nunca mais*.\n\nAo longo de 1986, com a definição do tema da Campanha da Fraternidade\ndaquele ano, “Terra de Deus, terra de irmãos”, dom Paulo intensificou\nsua campanha em favor da realização de uma reforma agrária profunda,\nradical e pacífica. Lembrou que o Brasil figurava entre os países de\nmaior concentração fundiária do mundo e, utilizando-se de dados da\nComissão Pastoral da Terra (CPT) que informavam sobre a morte de 115\nlavradores em 1984 e 189 em 1985, propôs a mobilização das comunidades\npara obter das autoridades “o que lhes compete por direito”. Em novembro\ndo mesmo ano, declarou acreditar que o quadro criado com os conflitos no\ncampo e com a crescente violência urbana poderia ser revertido, se o\ngoverno promovesse o assentamento das cem ou duzentas mil famílias\nacampadas, que se ofereciam para produzir alimentos. Reconhecendo que\nhavia ocorrido um aumento efetivo dos crimes contra a pessoa humana e\ntambém contra o patrimônio, reafirmou a defesa dos direitos humanos\nmovida pela Arquidiocese paulista — ação que vinha sendo\nresponsabilizada pelo aumento da criminalidade —, atribuindo as causas\ndo fenômeno à falta de polícia preventiva, à política carcerária vigente\ne também à situação do povo mais pobre, agravada pela crise econômica. A\nposição da Igreja Católica sobre a reforma agrária suscitou reações de\nRonaldo Caiado, presidente da União Democrática Ruralista (UDR),\nentidade fundada no final de 1985 que congregava os grandes\nproprietários de terras no país, o qual acusou os membros do clero de\nutilizar o tema para promover a discórdia e o confronto no campo.\n\nEm outubro de 1986, às vésperas da eleição para governador e para o\nCongresso Nacional — que assumiria também as funções de Congresso\nConstituinte —, dom Paulo afirmou ter considerado “um erro histórico de\nconsequências incalculáveis para o nosso futuro” não se ter convocado\numa Assembleia Constituinte pura e independente da eleição geral.\nManifestou seu temor de que a prevalência do poder econômico\ndesvirtuasse a composição do Congresso e que, em consequência, o texto\nconstitucional não respeitasse “os anseios do povo mais sofrido”. Em seu\nmodo de ver, a Constituição deveria seguir o exemplo de brevidade da\nDeclaração Universal dos Direitos Humanos da ONU, abordando apenas\npontos num nível de fácil compreensão popular. Embora a Igreja Católica\ntenha reafirmado sua posição de não apoiar abertamente candidatos,\ncreditou-se a dom Paulo o apoio aos candidatos ao Senado Mário Covas, do\nPartido do Movimento Democrático Brasileiro (PMDB), e Hélio Bicudo, do\nPT, aos postulantes à Câmara dos Deputados José Gregori, do PMDB, Plínio\nde Arruda Sampaio, Luís Eduardo Greenhalgh e Valdemar Rossi, do PT, bem\ncomo ao candidato a deputado estadual Mário Simas, do Partido\nDemocrático Trabalhista (PDT).\n\nNo início de 1987, dom Paulo manifestou seu otimismo em relação à\npresença popular, diretamente ou por organismos intermediários, nos\ntrabalhos da Assembleia Nacional Constituinte que se iniciariam em 1º de\nfevereiro próximo, reiterando mais uma vez a urgência da reforma\nagrária. Na mesma época, condicionou seu apoio à Nova República à\nrealização de reformas efetivas nos campos social e econômico,\ncriticando os pacotes econômicos conhecidos como Plano Cruzado I e Plano\nCruzado II, elaborados pela equipe econômica do governo de José Sarney\nem 1986-1987, com o objetivo principal de controlar a inflação.\nReconheceu, na ocasião, que o processo de transição política iniciado\ncom a Nova República teria sido certamente difícil, e aconselhou o\nempenho do governo na solução dos principais problemas socioeconômicos\ndo país.\n\nAinda em 1987 lançou na Arquidiocese de São Paulo o Projeto Esperança,\ncampanha de conscientização sobre a AIDS. Em maio, recebeu do governo\nfrancês o título de Comendador da Legião de Honra, entregue na Cúria\npelo embaixador da França no Brasil. Em janeiro de 1988, foi nomeado\npara o Comitê Honorário da Campanha Européia pela Interdependência e\nSolidariedade Norte-Sul, mantida pelo Conselho da Europa, a convite do\nrei da Espanha, Juan Carlos I.\n\nEm maio de 1988, lamentou a derrota da reforma agrária na Assembleia\nConstituinte, o que considerou um retrocesso, e previu que, se a\nConstituição a ser promulgada fosse contrária aos interesses do povo,\ncertamente teria curtíssima duração. No mês seguinte, divulgou seu\nrepúdio à aplicação da Lei de Segurança Nacional contra os acusados de\nenvolvimento nas agressões sofridas pelo presidente José Sarney durante\ndistúrbios verificados na cidade do Rio de Janeiro. Apoiou a proposta de\nparalisação imediata dos trabalhos da Constituinte, apresentada pelo\nsenador José Richa (PMDB), e a convocação do Congresso Nacional para que\nse manifestasse sobre o assunto. Preocupado com o arrocho salarial\nembutido no mais recente pacote econômico, conhecido como Plano Bresser,\ndivulgado em junho de 1987 pelo ministro da Fazenda Luís Carlos Bresser\nPereira, defendeu na mesma ocasião a concessão de um imediato aumento de\nsalários.\n\nAinda no ano de 1988, foram retomadas as discussões em torno da divisão\nda Arquidiocese de São Paulo, considerada então a maior arquidiocese do\nmundo e principal referência, nos últimos 18 anos, para outras igrejas\nlocais, pela introdução de pastorais como a dos direitos humanos e as de\nperiferia. A proposta original nesse sentido havia sido apresentada pelo\npróprio dom Paulo ao papa Paulo VI em 1974, e consistia em promover a\ndivisão da Arquidiocese em regiões episcopais, com bispos auxiliares\ntrabalhando de forma autônoma, sob a coordenação de um arcebispo. O\nprojeto agora em tramitação na Cúria Romana, preparado pela Congregação\nVaticana de Bispos, previa, diferentemente, a criação de quatro dioceses\nautônomas, vinculadas diretamente ao Vaticano. A iniciativa de proceder\nà divisão fora do modelo proposto pelo arcebispo foi recebida com\nreservas na Arquidiocese paulista, tendo sido considerada pelo sociólogo\nPedro Ribeiro de Oliveira como parte de “uma ampla estratégia de setores\nda Cúria Romana para diminuir a colegialidade episcopal e destruir a\nproposta da Igreja como comunidade, ligando cada diocese mais\ndiretamente ao papa”. Em abril do mesmo ano, outra medida que procurou\natingir diretamente a ação de dom Paulo foi a designação de dom Luciano\nMendes de Almeida — então presidente da CNBB e bispo-auxiliar da região\nepiscopal de Belém, na Zona Leste de São Paulo, além de um dos\nprincipais colaboradores do arcebispo — para dirigir a diocese da cidade\nde Mariana, em Minas Gerais.\n\nA divisão da Arquidiocese de São Paulo seria concretizada pelo Vaticano\nem março de 1989, quando foram criadas as novas dioceses de Campo Limpo,\nOsasco, Santo Amaro e São Miguel Paulista. As novas dioceses passavam a\ncontar com 155 paróquias, para uma população de 6,8 milhões de\nhabitantes, enquanto, sob a influência direta do arcebispo, permaneciam\n244 paróquias, servindo a 7,9 milhões de habitantes. A influência do\ncardeal, além de reduzida praticamente à metade, passou a concentrar-se\nnas áreas privilegiadas da capital, nas quais, segundo observadores,\nrestavam poucas possibilidades para a expansão da linha pastoral\nprogressista. As antigas regiões, agora transformadas em dioceses, ao\ncontrário, reuniam o maior contingente de população de baixa renda da\nGrande São Paulo, em grande parte morando em favelas e conjuntos\nhabitacionais, e com graves problemas sociais, como invasões de terras e\ncriminalidade. A pretensão manifestada por dom Paulo de que os antigos\nbispos auxiliares fossem mantidos tampouco foi atendida pelo Vaticano,\ntendo sido designados para as novas dioceses prelados não vinculados\ndiretamente ao arcebispo.\n\n Ainda em 1989, dom Paulo deixou de exercer funções no Vaticano — apenas\nseis cardeais em atividade na Igreja Católica em todo o mundo\nencontravam-se na mesma situação — depois que a Congregação do Culto\nDivino, da qual fazia parte, foi integrada à Congregação dos\nSacramentos, por reforma da Cúria Romana. Contudo, mais tarde, em março\nde 1990, voltaria a ocupar praticamente o mesmo cargo no Vaticano,\nnomeado pelo papa João Paulo II para a Congregação para o Culto Divino e\na Disciplina dos Sacramentos.\n\nEm janeiro de 1989, fora divulgada uma carta de dom Paulo a Fidel\nCastro, cuja transcrição fora publicada no *Granma*, órgão oficial do\nPartido Comunista Cubano. No documento, entregue ao chefe de Estado pelo\nteólogo frei Beto, dom Paulo elogiva as conquistas da Revolução Cubana e\nsaudava o povo daquele país pelos 30 anos da revolução. O incidente\ngerou protestos por parte de setores conservadores da Igreja Católica e\nde bispos cubanos exilados nos Estados Unidos, que alegaram\ndesconhecimento do arcebispo brasileiro sobre a realidade do país e\nsobre as violações aos direitos humanos praticadas pelo regime\ncomunista. Segundo declarações de dom Paulo, que já se havia\ncorrespondido com Fidel Castro em outras ocasiões, o objetivo da carta\nteria sido favorecer o diálogo entre a Igreja e o Estado em Cuba, bem\ncomo contribuir na preparação da visita do papa àquele país, então\nprevista para 1992.\n\nTambém em 1989, foram realizadas no Brasil as primeiras eleições diretas\npara presidente da República após o regime militar, o que assinalou o\nencerramento da transição democrática no país. A primeira etapa do\nprocesso eleitoral, em 15 de novembro, concentrou a disputa entre Luís\nInácio Lula da Silva, da Frente Brasil Popular, e Fernando Collor de\nMelo, do Partido da Renovação Nacional (PRN), tendo a campanha se\ncaracterizado por uma aguda polarização entre os dois candidatos. A\nconfirmação da vitória de Collor se verificou no segundo turno do\npleito, realizado em 17 de dezembro.\n\nNesse mesmo dia, foi libertado pela polícia de São Paulo o empresário\nAbílio Diniz, do grupo Pão de Açúcar, que havia sido sequestrado dias\nantes. Os dez sequestradores, entre os quais se incluíam os canadenses\nChristine Lamont e David Spencer, haviam sido cercados pela polícia em\numa casa da Zona Leste de São Paulo, e exigiram a presença de dom Paulo,\nque compareceu ao local para negociar a libertação do empresário. Na\nocasião, tentou-se imputar uma conotação política ao episódio, tendo a\npolícia paulista divulgado ter sido encontrado material de propaganda do\nPT em posse dos sequestradores. Anos depois, em 1993, o arcebispo se\ndeclararia convencido da inocência dos canadenses, ainda presos em São\nPaulo, e manifestaria apoio à sua libertação, fazendo constar seu nome\nnum abaixo-assinado que reuniu cerca de 20 mil assinaturas. Mais tarde,\nem abril de 1998, concordaria em intermediar as negociações com o\ngoverno brasileiro visando à expulsão dos prisioneiros estrangeiros,\npara que seus processos fossem reavaliados pelos governos de seus\nrespectivos países.\n\nAinda em 1989, foi organizado o Movimento Nobel da Paz D. Paulo,\nproposta de iniciativa do argentino Adolfo Pérez Esquivel, em nome do\nServiço Paz e Justiça na América Latina (Serpaj). Cerca de 30 entidades\nparticiparam da campanha, destacando-se a Frente Nacional dos\nTrabalhadores, o Movimento dos Trabalhadores Rurais Sem Terra (MST) e a\nComissão de Justiça e Paz, e quase quatrocentas entidades em todo o país\nprestaram apoio à indicação do arcebispo de São Paulo para a premiação.\n\nEm 1990, dom Paulo recebeu o Prêmio Juca Pato de intelectual do ano,\npelo livro *Clamor do povo pela paz*. \\\n\\\n\nGoverno Collor (1990-1992): denúncias de corrupção\n\nEm maio de 1992, a partir da divulgação das denúncias do empresário\nPedro Collor, irmão do presidente Fernando Collor, sobre a existência de\num grande esquema de corrupção no governo, teve início uma grave crise\npolítica no país. Tendo em vista que as declarações de Pedro Collor\nenvolviam o próprio presidente da República e o tesoureiro da campanha\npresidencial, Paulo César Farias, no mesmo mês foi instalada uma\ncomissão parlamentar de inquérito (CPI) para averiguá-las. Dom Paulo\nEvaristo Arns teve participação ativa no movimento então iniciado em\nfavor da ética na política, tornando-se um dos mais severos críticos do\ngoverno.\n\nEm setembro do mesmo ano, quando das comemorações da Semana da Pátria,\nlançou o manifesto intitulado “A pátria merece melhor sorte”, publicado\nem *O São Paulo* e divulgado na Cúria Metropolitana daquela cidade, que\nfoi considerado um dos mais duros ataques desfechados por um membro da\nhierarquia católica contra um presidente da República no país. Nas\npalavras do arcebispo, os que sobrevivessem à “crise total” iriam\n“maldizer a geração que levou dois anos e meio para abrir os olhos e\ndenunciar a farsa, o roubo e a degradação moral”. Amplos setores da\nIgreja apoiaram a averiguação das denúncias e a punição dos envolvidos,\ntendo o Conselho Permanente da CNBB convidado os católicos a fazer jejum\ne orações “pelo bem da nação” nas comemorações do Dia de Independência.\nNo final de setembro, o cardeal Arns saudou a decisão do Congresso\nNacional de aprovar a abertura do processo de *impeachment* de Fernando\nCollor, declarando estar “certo e confiante que o Brasil vai melhorar\nafastando de vez a corrupção de todos os níveis da vida pública”.\n\nEm outubro seguinte, um conflito com policiais na prisão do Carandiru,\nem São Paulo, causou a morte de 111 presos. Diversas entidades de defesa\ndos direitos humanos condenaram a ação e exigiram o afastamento do\nsecretário de Segurança Pública do estado, Pedro Franco de Campos. A\nmissa de sétimo dia em intenção aos mortos foi celebrada na Catedral da\nSé, em São Paulo, por dom Paulo, que exigiu na ocasião a apuração\nrigorosa dos fatos e determinou o acompanhamento dos trabalhos de\ninvestigação pela Comissão de Justiça e Paz e por outros órgãos da\nArquidiocese.\n\nAinda em outubro, dom Paulo Evaristo sofreu um grave acidente de carro\nna República Dominicana, que trouxe prejuízos para seu estado de saúde,\ngerando especulações sobre uma possível renúncia à direção da\nArquidiocese.\n\nNo início de 1993, ao completar 20 anos como cardeal, dom Paulo divulgou\na intenção da Igreja Católica de esclarecer a população sobre o\nplebiscito sobre o sistema de governo, convocado para 21 de abril.\nDedicou-se então à defesa da opção pelo parlamentarismo, que na sua\nopinião havia trazido “mudanças favoráveis” para os países que o\nadotaram. Em junho do mesmo ano, publicou artigo intitulado “No Brasil\nsobrevive a escravidão” no *L’Unitá*, órgão oficial do Partido\nDemocrático de Esquerda (antigo Partido Comunista Italiano), no qual\nfazia dura análise da realidade brasileira, com a apresentação de fatos\ne estatísticas, e com críticas violentas às elites do país e ao Estado.\nTambém em 1993, construiu a Casa do Clero de São Paulo, para receber os\npadres aposentados e até então desamparados.\n\nCom o desenvolvimento da campanha eleitoral de 1994, creditou-se a dom\nPaulo o apoio à candidatura de Fernando Henrique Cardoso à presidência\nda República na legenda do Partido da Social Democracia Brasileira\n(PSDB). O arcebispo havia defendido anteriormente o Plano Real,\ndesenvolvido pela área econômica do governo do presidente Itamar Franco\ne implementado por Fernando Henrique durante sua gestão como ministro da\nFazenda. Embora não tenha declarado publicamente seu voto — seguindo\norientação geralmente adotada pela hierarquia católica —, dom Paulo\nlembrou em diversas oportunidades seus vínculos de amizade com o\nsociólogo, nascidos da convivência na fase da luta pelos direitos\nhumanos e pela abertura política do país. Ao longo da campanha,\nentretanto, dom Paulo reafirmou também sua admiração pelo candidato Luís\nInácio Lula da Silva, do PT, e chegou a sugerir a união entre os dois\npartidos após as eleições.\n\n \n\nGoverno Fernando Henrique (1995-2002): sob a égide do neoliberalismo\n\nLogo após a vitória e a posse de Fernando Henrique Cardoso, em 1º de\njaneiro de 1995, dom Paulo revelou seu desapontamento diante de uma das\nprimeiras ações do novo governo: o veto do presidente da República ao\nreajuste do salário mínimo para cem reais, aprovado pelo Congresso\nNacional. Declarou na ocasião ter a impressão de que “o cargo de\npresidente está mudando as idéias de um homem” e destacou a necessidade\nde “manter os salários dos pobres à altura da dignidade humana”.\n\nEm agosto de 1995, manifestou-se sobre o encaminhamento da questão dos\ndesaparecidos políticos durante o regime militar, defendendo a adoção de\nmedidas no sentido de localizar os corpos para que os restos mortais\npudessem ser devolvidos às famílias, bem como a abertura de processo\ncontra os responsáveis pelas mortes e desaparecimentos.\n\nEm 3 de dezembro de 1995, por ocasião dos 50º aniversário da ordenação\nde dom Paulo Evaristo Arns, foi celebrada missa no Ginásio do\nIbirapuera, em São Paulo, a que compareceram oito mil pessoas. Estiveram\npresentes, entre outras autoridades, o vice-presidente da República\nMarco Maciel, o governador do estado Mário Covas e os ministros de\nEstado Paulo Renato de Sousa, da Educação, Sérgio Mota, das\nComunicações, e José Serra, do Planejamento. Na mesma ocasião, foram\ncomemorados os 250 anos da criação da Diocese de São Paulo.\n\nEm fevereiro seguinte, durante a missa de abertura da Campanha da\nFraternidade de 1996, dom Paulo lançou um apelo pela libertação dos\nlíderes do MST presos no Pontal do Paranapanema, no extremo-oeste do\nestado de São Paulo. Aproveitando o ensejo da solenidade, voltou a\nrecomendar uma política voltada para as pequenas empresas e para a\nrealização da reforma agrária. Em abril, manifestou seu apoio à\npretensão das famílias de Carlos Marighela e Carlos Lamarca de obter o\nreconhecimento oficial do assassinato dos dois militantes de esquerda\npela ditadura militar. Considerou o reconhecimento do governo e a\nindenização das famílias uma “questão de justiça”, declarando-se\nsatisfeito com o acolhimento do caso do jornalista Vladimir Herzog pela\nComissão Especial de Desaparecidos Políticos, formada por membros da\nsociedade civil e do governo federal.\n\nEm setembro de 1996, tendo completado 75 anos, dom Paulo encaminhou ao\nVaticano pedido de renúncia à Arquidiocese de São Paulo. O procedimento\né previsto pelo Código de Direito Canônico, que determina que, ao chegar\na essa idade, os bispos devem apresentar sua renúncia, podendo o papa\naceitá-la ou solicitar ao religioso que permaneça no cargo. Ainda em\n1996, a Rádio 9 de Julho foi devolvida à Arquidiocese paulista pelo\npresidente Fernando Henrique Cardoso.\n\nEm fevereiro de 1997, dom Paulo e seus cinco bispos auxiliares\ndivulgaram carta em apoio à marcha pela reforma agrária promovida pelo\nMST, iniciada em Governador Valadares (MG), São Paulo e Rondonópolis\n(MT), em direção a Brasília. O documento foi considerado uma resposta a\ndeclarações do presidente Fernando Henrique Cardoso, que afirmara ter\nreclamado ao papa João Paulo II do comportamento de alguns padres em\nrelação ao seu governo. Ainda nesse ano, foi concluída a Casa da Oração\ndo Povo da Rua.\n\nEm abril de 1998, dom Cláudio Hummes foi nomeado arcebispo de São Paulo,\nem substituição a dom Paulo Evaristo Arns, verificando-se a cerimônia de\ntransferência do cargo em 23 de maio seguinte, na Catedral da Sé. Em 24\nde maio dom Paulo tornou-se arcebispo emérito de São Paulo e passou a se\ndedicar às atividades de jornalista e religioso. Em 28 anos de\narcebispado, criou 43 paróquias, construiu 1.200 centros comunitários,\nincentivou e apoiou o surgimento de mais de duas mil CEBs na periferia\nda metrópole paulistana, e assinou sete Planos de Pastoral, com\nprioridades sempre eleitas democraticamente pelas comunidades.\n\nEm 1999 coordenou, a convite do Ministério da Previdência Social, a\nparte religiosa dos eventos do Ano Internacional do Idoso, com destaque\npara a celebração multirreligiosa que ocorreu na igreja da Consolação em\n18 de novembro. Participou, em março, da pré-inauguração das instalações\nda nova fase da Rádio 9 de Julho e da reinauguração da emissora em\noutubro, 26 anos após o silêncio imposto pela ditadura militar e a árdua\nluta da Arquidiocese para reaver a sua rádio.\n\nEm 2005, sofreu um infarto e se recuperou em sua residência no Jaçanã,\nem São Paulo. Em agosto de 2009, em meio à crise política que atingiu o\nSenado brasileiro, enviou um telegrama a seu sobrinho, o senador Flávio\nArns, parabenizando-o pela “atitude coerente” de se desligar do PT\ndepois que o partido decidiu retroceder de sua posição favorável ao\nafastamento temporário de José Sarney (PMDB-AP) da presidência do Senado\ndurante as investigações das denúncias que haviam sido feitas ao\nsenador.\n\n \n\nPrêmios, títulos e publicações\n\nDom Paulo Evaristo Arns foi grão-chanceler da PUC-SP e da Faculdade de\nTeologia Nossa Senhora da Assunção entre 1970 e 1998. Nesse mesmo\nperíodo, foi também presidente do Amparo Maternal, maternidade mantida\npela Arquidiocese de São Paulo para acolher as mães carentes ou\nsolteiras que não eram assistidas por nenhum tipo de previdência social\npública ou privada.\n\nDurante sua longa permanência na direção da Arquidiocese de São Paulo,\nfoi homenageado em diversas oportunidades por sua atuação na luta pelos\ndireitos humanos. Em 1983, recebeu o título de doutor *honoris causa* da\nFaculdade de Teologia Católica da Universidade de Münster, na Alemanha\nOcidental. Em 1985, foi agraciado com o Prêmio Nansen, em Genebra,\nconcedido anualmente pelo Alto Comissariado das Nações Unidas para\nRefugiados, e passou a fazer parte, em junho, do comitê de direção da\norganização católica Pax Christi, com sede na Holanda, dedicada a\npromover a reconciliação entre os povos e a defender a justiça e a paz\nmundial. Em março de 1988, recebeu em Houston, nos Estados Unidos, o\nPrêmio Oscar Romero, assim denominado para homenagear o arcebispo de El\nSalvador, assassinado em 1980 por forças paramilitares de direita em seu\npaís. Em dezembro de 1988, recebeu o 1º Prêmio Nacional de Direitos\nHumanos, concedido pelo Movimento Nacional de Defesa dos Direitos\nHumanos (MNDDH), entidade fundada em 1982, com sede em Brasília, que\nreúne cerca de 350 entidades de direitos humanos de todo o país.\n\nAinda em 1988, recebeu o título de doutor *honoris causa* das\nuniversidades Católica de Goiânia, do Extremo Sul Catarinense (Criciúma)\ne Federal do Acre (Rio Branco), e em 1999, das universidades Federal do\nParaná (Curitiba) e Federal de Viçosa (MG), e ainda da Pontifícia\nFaculdade de Teologia Nossa Senhora da Assunção (São Paulo). Voltou a\nreceber o mesmo título em 2000, das universidades Estadual de Campinas\n(Unicamp) e de Sorocaba (São Paulo), e entre os anos de 2001 e 2005, das\nFaculdades Integradas Alcântara Machado (São Paulo), Universidade de\nBrasília (UnB), Universidade Estadual de Londrina (PR) e PUC-SP.\n\nEm 2001, foi nomeado representante da sociedade civil no conselho\ndeliberativo e membro titular do conselho da Cátedra Unesco do Instituto\nde Estudos Avançados (IEA) da Universidade de São Paulo (USP). Em 2004,\nrecebeu o prêmio Luta pela Terra, destinado àqueles que defenderam a\nreforma agrária e as lutas sociais no Brasil nos últimos 20 anos. Em\n2006, foi condecorado pelo governo argentino com a *Orden del Libertador\nSan Martin**.*A homenagem foi um reconhecimento à sua contribuição na\nluta em favor dos direitos humanos naquele país e ao apoio aos que\nsofreram perseguições durante a ditadura argentina, de março de 1976 a\ndezembro de 1983.\n\nDom Paulo Evaristo Arns publicou as seguintes obras: *La technique du\nlivre d’après* *Saint Jerôme*(1953);*Liberdade de ensino* (1960);*Por\nque escolas católicas?* (1963);*Rumo ao casamento*(1965);*A quem viemos,\nSenhor?*(1968); *A humanidade caminha* *para a\nfraternidade*(1968);*Paulo VI: você é a favor ou contra?*(1970);*De\nesperança em* *esperança na sociedade, hoje*(1971);*Comunidade: união e\nação*(1972);*Viver é participar*(1974);*Cristãos em plena vida*(1974);\n*Você é chamado a evangelizar*(1974);*Nova* *forma da consagração da\nmulher*(1974); *O Evangelho: incomoda? Inquieta? Interessa? Sínodo da\nevangelização*(1975);*Sê fiel* (1977); *Em defesa dos direitos humanos,*\n*encontro com o repórter*(1978); *O rosário na Bíblia e na vida do povo*\n(1988); *Corintiano, graças a Deus* (2004); *Conversa com São Francisco*\n(2004); *Mulheres da Bíblia*, (2004); *La tecnica del libro secondo San\nGerolamo* (2005); *Dez caminhos para a perfeita alegria* (2005); *Um\npadre em sete morros abençoados* (2005); *Estrelas na noite escura:\npensamentos*(2006); *Vamos a Aparecida: com Maria, pela Paz* (2007). Em\n2001, lançou sua autobiografia *Da esperança à utopia: testemunho de uma\nvida*.\n\nA seu respeito, foram publicadas as obras de Getúlio Bittencourt e Paulo\nSérgio Markum, *O* *cardeal do* *povo*(1979); Mauro Santayana, *No meio\ndo povo*(1983);****Michael Albus, *Ich trage Keinen Purpur* (1985);\nHorst Goldstein, *Kardinal der Ausgebeuteten* (1987); Helcion Ribeiro\n(org.), *Paulo Evaristo Arns, cardeal da esperança e pastor da Igreja de\nSão Paulo*(1989); Marilda Ferri e Evanize Sydow, *Dom Paulo Evaristo\nArns: um homem amado e perseguido*(1999), e**Elza Ajzenberg, *Paulo\nEvaristo Arns, pastor dos pobres, cardeal da Igreja* (1999).\n\n \n\nMaria Letícia Correia/ Bruno Marques (atualização)\n\n** **\n\nFONTES:AGOSTINE, C. *Evaristo.;*ALBUQUERQUE, F. *Governo*; ARNS, P.E.\n*Depoimentos*; Arquidiocese de São Paulo. Disponível em:\n\\<http://www.arquidiocese-sp.org.br\\>. Acesso em: 10 set.2009; CIMI.\nDisponível em:\n\\<http://www.cimi.org.br/?system=news&action=read&id=2550&eid=376\\>.\nAcesso em: 10 set. 2009; CONFERÊNCIA NAC. BISPOS DO BRASIL;\n*Dia*(22/5/88); *Encic. Mirador; Estado de S.* *Paulo* (24/2 e 1/3/77,\n25/4, 28/6, 23/10/80, 4, 16/4, 10/5, 17, 22, 24/7 e 5/8/81, 17/3/89,\n23/3/90, 10/1 e 31/3/94, 4/12/95, 3/3 e 4/4/96, 15/2/97, 16/4/98);\n*Folha* *de S. Paulo*(5/6/77, 1/12/80, 10, 16/4, 1, 13/5, 19/7 e 4/9/81,\n14 e 20/1/83, 20, 27/6, 11/8 e 12/10/85, 11/1, 13/2, 12/7, 10/8 e\n31/10/86, 1/1, 15/2, 7/4 e 21/10/87, 26/4, 7, 8/5, 3, 30/9, 16/11 e\n12/12/88, 23, 25/1, 17/3, 7 e 28/7/89, 8, 30/9 e 6/10/92, 9/3 e 6/7/93,\n16/4 e 22/12/95, 22/2 e 11/9/96, 30/3/97, 16/4 e 7/6/98);\n*Globo*(7/5/87, 31/3 e 7/10/88, 20/1, 18 e 22/12/89, 5/7 e 10/10/92,\n1/3/93, 27/9/94, 19/2/97); *Grande* *encic. Delta;*INST. NAC. LIVRO.\n*Índice; Jornal do Brasil*(17/1/75, 23, 25/5, 26 e 28/9/77, 1/4, 6/5/78,\n23/7, 24, 29/10, 3, 8, 21, 28, 30/11, 12, 30/12/79, 22, 24/4, 25, 30/7,\n21/9, 21 e 26/10/80, 11/3, 17/7 e 22/9/81, 18/1/83, 28/7/85, 7/8 e\n9/11/86, 6/7/87, 25/3, 31/5 e 12/6/88, 16/3 e 27/7/89, 30/6, 5/11 e\n24/12/93, 17/3, 14 e 23/12/94, 6/2 e 10/8/95, 4/4/96, 26/4/98,\n10/11/99); MST; NASCIMENTO, G. *Angústia*; Pasquim**(4/78); PINTO, L.\n*Antologia;*Portal Algosobre. Disponível em:\n\\<http://www.algosobre.com.br/biografias/dom-paulo-evaristo-arns.html\\>.\nAcesso em: 10 set. 2009; *Senhor*(23/9/88); *Súmulas; Veja* (5/10/77,\n24/7 e 27/11/85, 8/5/88, 14/3/90); UnB; *Who’s* *who in Brazil.*\n","ref":"FONTES:AGOSTINE, C. *Evaristo.;*ALBUQUERQUE, F. *Governo*; ARNS, P.E.\n*Depoimentos*; Arquidiocese de São Paulo. Disponível em:\n\\<http://www.arquidiocese-sp.org.br\\>. Acesso em: 10 set.2009; CIMI.\nDisponível em:\n\\<http://www.cimi.org.br/?system=news&action=read&id=2550&eid=376\\>.\nAcesso em: 10 set. 2009; CONFERÊNCIA NAC. BISPOS DO BRASIL;\n*Dia*(22/5/88); *Encic. Mirador; Estado de S.* *Paulo* (24/2 e 1/3/77,\n25/4, 28/6, 23/10/80, 4, 16/4, 10/5, 17, 22, 24/7 e 5/8/81, 17/3/89,\n23/3/90, 10/1 e 31/3/94, 4/12/95, 3/3 e 4/4/96, 15/2/97, 16/4/98);\n*Folha* *de S. Paulo*(5/6/77, 1/12/80, 10, 16/4, 1, 13/5, 19/7 e 4/9/81,\n14 e 20/1/83, 20, 27/6, 11/8 e 12/10/85, 11/1, 13/2, 12/7, 10/8 e\n31/10/86, 1/1, 15/2, 7/4 e 21/10/87, 26/4, 7, 8/5, 3, 30/9, 16/11 e\n12/12/88, 23, 25/1, 17/3, 7 e 28/7/89, 8, 30/9 e 6/10/92, 9/3 e 6/7/93,\n16/4 e 22/12/95, 22/2 e 11/9/96, 30/3/97, 16/4 e 7/6/98);\n*Globo*(7/5/87, 31/3 e 7/10/88, 20/1, 18 e 22/12/89, 5/7 e 10/10/92,\n1/3/93, 27/9/94, 19/2/97); *Grande* *encic. Delta;*INST. NAC. LIVRO.\n*Índice; Jornal do Brasil*(17/1/75, 23, 25/5, 26 e 28/9/77, 1/4, 6/5/78,\n23/7, 24, 29/10, 3, 8, 21, 28, 30/11, 12, 30/12/79, 22, 24/4, 25, 30/7,\n21/9, 21 e 26/10/80, 11/3, 17/7 e 22/9/81, 18/1/83, 28/7/85, 7/8 e\n9/11/86, 6/7/87, 25/3, 31/5 e 12/6/88, 16/3 e 27/7/89, 30/6, 5/11 e\n24/12/93, 17/3, 14 e 23/12/94, 6/2 e 10/8/95, 4/4/96, 26/4/98,\n10/11/99); MST; NASCIMENTO, G. *Angústia*; Pasquim**(4/78); PINTO, L.\n*Antologia;*Portal Algosobre. Disponível em:\n\\<http://www.algosobre.com.br/biografias/dom-paulo-evaristo-arns.html\\>.\nAcesso em: 10 set. 2009; *Senhor*(23/9/88); *Súmulas; Veja* (5/10/77,\n24/7 e 27/11/85, 8/5/88, 14/3/90); UnB; *Who’s* *who in Brazil.*\n","dic":"DHBB"}
