{"title":"MOURA, Aluísio de Andrade","cargoss":["Revolucionário ou revoltoso","Interventor"],"cargos_esp":[0,0],"datas_ini":[1930,1931],"datas_fim":[1930,1931],"estados":[0,"RN"],"autor":["Norte(1947)."],"content":"**MOURA, Aluísio de Andrade**\n\n\\*militar; rev. 1930; interv. RN 1931.\n\n*Aluísio de Andrade Moura* nasceu em Natal em 1905.\n\nSentou praça no Exército em janeiro de 1923, tornando-se\naspirante-a-oficial em janeiro de 1928. A partir desse ano serviu no 29º\nBatalhão de Caçadores (29º BC), sediado em Natal, sendo promovido, ainda\nem agosto, a segundo-tenente e, em agosto de 1930, a primeiro-tenente.\n\nApós ter participado da Revolução de 1930, em janeiro do ano seguinte,\nquando ocupava o cargo de comandante do Regimento da Polícia Militar do\nRio Grande do Norte, assumiu interinamente a interventoria federal no\nestado em substituição a Irineu Joffily, por indicação de Juarez Távora,\nentão a mais prestigiada autoridade no Nordeste. Efetivado em março do\nmesmo ano, permaneceu no cargo até junho seguinte, após haver decretado\nas regras iniciais da administração revolucionária, dando os primeiros\npassos para a restauração financeira do estado. Foi então substituído\npor Herculino Cascardo.\n\nPromovido a capitão em outubro de 1934, em 1936 serviu no 22º BC,\nsediado em João Pessoa, no 25º BC, em Teresina, no 24º BC, com sede em\nSão Luís, permanecendo neste último até 1938. Transferido no ano\nseguinte para o 5º Regimento de Infantaria (RI), em Pindamonhangaba\n(SP), freqüentou, ainda em 1939, a Escola de Armas, no Rio de Janeiro,\nentão Distrito Federal, permanecendo desse ano até 1942 à disposição do\ninterventor federal no Maranhão, Paulo Martins de Sousa Ramos, como\ncomandante de polícia daquele estado.\n\nPromovido a major em setembro de 1943, serviu no 16º RI, em Natal, e,\nainda nesse ano, tornou-se comandante da 24ª Circunscrição de\nRecrutamento, também em Natal, exercendo essa função até 1946. De então\naté 1951 comandou a Força Policial do Rio Grande do Norte e, nesse\nínterim, foi promovido em setembro de 1950 a tenente-coronel. Entre 1952\ne 1953 permaneceu à disposição do secretário-geral do Conselho de\nSegurança Nacional, tendo atuado na Comissão Federal de Abastecimento e\nPreços (Cofap). Ainda em 1953 serviu no gabinete do ministro do\nTrabalho, João Goulart, transferindo-se no ano seguinte para a Diretoria\nGeral de Pessoal do Exército. Promovido a coronel em março de 1955, foi\nreformado no posto de general-de-brigada em junho do ano seguinte.\n\nEm 1962 tornou-se presidente do Instituto de Aposentadoria e Pensões dos\nFerroviários e Empregados em Serviços Públicos (IAPFESP). Ingressou na\npolítica partidária filiando-se ao Partido Trabalhista Brasileiro (PTB),\nmas não chegou a disputar cargos eletivos.\n\nFaleceu em 15 de Novembro de 1973.\n\nPublicou um *Relatório das atividades comunistas no Rio Grande do\nNorte*(1947).\n\nFONTES: ARQ GETÚLIO VARGAS; CASCUDO, L. *História; Grande encic.\nDelta;*POPPINO, R*. Federal;*SILVA, H. *1935.*\n\n \n","ref":"FONTES: ARQ GETÚLIO VARGAS; CASCUDO, L. *História; Grande encic.\nDelta;*POPPINO, R*. Federal;*SILVA, H. *1935.*\n\n \n","dic":"DHBB"}
