{"title":"MOURÃO, Benjamin","cargoss":["Deputado federal"],"cargos_esp":[0],"datas_ini":[1955],"datas_fim":[1957],"estados":["PR"],"autor":[0],"content":"**MOURÃO, Benjamin**\n\n\\*dep. fed. PR 1955-1957.\n\n*Benjamim de Andrade Mourão* nasceu em Campo Largo (PR) no dia 5 de\nmarço de 1902, filho de Lourenço Mourão e de Florência de Andrade\nMourão.\n\nEstudou no Ginásio Paranaense e se diplomou em engenharia civil pela\nUniversidade do Paraná, em 1926. Inspetor federal de ensino, engenheiro\nmunicipal e da Caixa Econômica Federal no Paraná, elegeu-se deputado\nestadual pelo Partido da Representação Popular (PRP), ocupando um\nassento na Assembléia Legislativa paranaense no início de 1947. Em\nseguida, licenciou-se do mandato para assumir a Secretaria de Viação do\ngoverno Moisés Lupion (1947-1951). Retornou à Assembléia em 1950 e, em\njaneiro do ano seguinte deixou aquela casa, ao final da legislatura, não\ntendo disputado a reeleição em outubro de 1950.\n\nGerente da Caixa Econômica Federal no Paraná, no pleito de outubro de\n1954, elegeu-se deputado federal pelo Paraná na legenda do Partido\nSocial Democrático. Tendo assumido o mandato em 2 de fevereiro de 1955,\nrenunciou em 25 de junho de 1957 para assumir a presidência da Companhia\nde Energia Elétrica do estado (Copel).\n\n \n\nFONTES: CÂM. DEP. *Deputados;*CÂM. DEP. *Deputados brasileiros.\nRepertório* (1946-1967); CÂM. DEP. *Deputados federais. Inventário;*CÂM.\nDEP. *Relação dos dep.;*MOREIRA, J. *Dic.*\n\n \n","ref":"FONTES: CÂM. DEP. *Deputados;*CÂM. DEP. *Deputados brasileiros.\nRepertório* (1946-1967); CÂM. DEP. *Deputados federais. Inventário;*CÂM.\nDEP. *Relação dos dep.;*MOREIRA, J. *Dic.*\n\n \n","dic":"DHBB"}
