{"title":"MOURÃO, João Martins de Carvalho","cargoss":["Reitor","Ministro do Supremo Tribunal Federal"],"cargos_esp":["Univ",0],"datas_ini":[1930,1931],"datas_fim":[1931,1940],"estados":["RJ",0],"autor":[0],"content":"**MOURÃO, João Martins de Carvalho**\n\n\\*reitor Univ. RJ 1930-1931; min. STF 1931-1940.\n\n \n\n*João Martins de Carvalho Mourão*nasceu em São João del Rei (MG) no dia\n2 de julho de 1872, filho de Aureliano Martins de Carvalho Mourão e de\nAna Isabel de Castro Mourão. Seu pai foi advogado e deputado geral em\n1884 e de 1886 a 1889, ainda no regime monárquico.\n\nApós concluir os estudos primários e secundários em Ouro Preto (MG),\ningressou em 1888 na Faculdade de Direito de São Paulo, onde foi redator\nda Folha Acadêmica, jornal literário que fez época naquela instituição e\nno qual teve como companheiros Edmundo Lins, Afonso de Carvalho, Rodrigo\nBretas, Teodoro Machado e Francisco Brandt. Bacharelou-se em agosto de\n1892.\n\nLogo após diplomar-se, passou a advogar em São Paulo e em Minas Gerais.\nFixou-se em seguida no Rio de Janeiro, então Distrito Federal, onde teve\ncomo orientador Carlos de Carvalho e como colegas de escritório Rodrigo\nOtávio Langaard Meneses, Vilela dos Santos e Joaquim de Morais Jardim.\n\nIngressando no Instituto dos Advogados Brasileiros, aí foi por muitos\nanos orador oficial, além de primeiro-secretário, vice-presidente e\npresidente eleito por três biênios, com intervalos nos quais a\npresidência foi exercida por Alfredo Bernardes e Rodrigo Otávio.\nAdvogado do Banco do Brasil de 1900 a 1905, teve a seu cargo algumas das\nmais difíceis e rumorosas causas daquele estabelecimento, entre as quais\na da liquidação forçada da Companhia União Sorocabana e Ituana. Integrou\nainda a comissão de jurisconsultos incumbida por Esmeraldino Bandeira,\nministro da Justiça no governo de Nilo Peçanha (1904-1910), de elaborar\nos projetos de códigos de processo civil e comercial e de processo penal\npara o Distrito Federal, tarefa essa levada a termo, embora os projetos\nresultantes não tenham sido convertidos em lei.\n\nExerceu por vários anos o cargo de membro da junta administrativa da\nCaixa de Amortizações e, a partir de 1914, tornou-se professor\nsubstituto de direito civil e catedrático de direito penal da Faculdade\nLivre de Ciências Jurídicas e Sociais, que mais tarde se fundiu com a\nFaculdade Livre de Direito do Rio de Janeiro e foi incorporada à\nUniversidade do Rio de Janeiro. Com Caetano Montenegro e Cesário\nPereira, participou da comissão nomeada por João Luís Alves, ministro da\nJustiça no governo do presidente Artur Bernardes (1922-1926), para a\nelaboração do projeto, convertido em lei, do Código de Processo Civil e\nComercial do Distrito Federal.\n\nEm 1930 foi nomeado diretor da Faculdade de Direito e reitor da\nUniversidade do Rio de Janeiro, cargos dos quais se afastou em virtude\nde sua indicação para o Supremo Tribunal Federal (STF) em maio de 1931.\nEm junho seguinte foi sorteado para servir no Tribunal Superior\nEleitoral (TSE), instituição que acabara de ser criada no contexto da\norganização da Justiça Eleitoral e do alistamento eleitoral em bases\nnovas. No STF foi nomeado, em maio de 1932, procurador-geral do Tribunal\nSuperior de Justiça. Com Artur Ribeiro e Levi Carneiro, integrou a\ncomissão criada em cumprimento do disposto na Constituição de 1934 para\nelaborar um código uniforme, válido para todo o país, de processo civil\ne comercial. A comissão tinha seus trabalhos em fase de conclusão quando\no governo federal, já sob o Estado Novo (1937-1945), resolveu realizar\nobra nova. Em 1940, Carvalho Mourão deixou o STF.\n\nFoi membro do Instituto Histórico e Geográfico Brasileiro.\n\nFaleceu no Rio de Janeiro no dia 24 de dezembro de 1951.\n\n \n\n \n\nFONTES: CONSULT. MAGALHÃES, B.; Grande encic. Delta; LAGO, L. Supremo;\nMACEDO, R. Efemérides; Rev. Arq. Públ. Mineiro (12/76).\n\n \n","ref":"FONTES: CONSULT. MAGALHÃES, B.; Grande encic. Delta; LAGO, L. Supremo;\nMACEDO, R. Efemérides; Rev. Arq. Públ. Mineiro (12/76).\n\n \n","dic":"DHBB"}
