{"title":"MÜLLER, José Eugênio","cargoss":["Deputado federal","Deputado federal"],"cargos_esp":[0,0],"datas_ini":[1935,1957],"datas_fim":[1937,1957],"estados":["SC","RJ"],"autor":[0],"content":"**MÜLLER, José Eugênio**\n\n\\*dep. fed. SC 1935-1937; dep. fed. RJ 1957.\n\n \n\n*José Eugênio Müller* nasceu no município de Itajaí (SC), no dia 28 de\nnovembro de 1889, filho do tabelião Eugênio L. Müller e de Guilhermina\nB. Müller. O tio paterno Lauro Müller foi ministro de Viação e Obras\nPúblicas no governo de Rodrigues Alves e, posteriormente, deputado\nfederal e governador de Santa Catarina.\n\nAutodidata, industrial do setor têxtil, iniciou a vida política\nparticipando da fundação da Aliança Liberal em Santa Catarina e tomando\nparte na Revolução de 1930. Em 1932, por ocasião da Revolução\nConstitucionalista de São Paulo, organizou e comandou o 8º Batalhão de\nSanta Catarina, que defendeu o governo provisório de Getúlio Vargas.\n\nEm outubro de 1934 elegeu-se deputado federal por Santa Catarina na\nlegenda do Partido Evolucionista Brasileiro (PEB), assumindo o mandato\nem maio de 1935. Embora tenha perdido o mandato em virtude do golpe do\nEstado Novo, em 10 de novembro de 1937, integrou a comitiva de\nparlamentares que foi cumprimentar Getúlio, no palácio do Catete.\n\nTransferindo-se de Santa Catarina para o Rio de Janeiro, fixou\nresidência no município de Nova Friburgo, onde investiu na construção de\numa fábrica de biscoitos e retomou a carreira política.\n\nNomeado pelo governador fluminense, coronel Edmundo Macedo Soares e\nSilva, para prefeito de Nova Friburgo, permaneceu no cargo de 28 de\nmarço a 12 de abril de 1947. Em 1950, juntamente com Luís Simões Lopes,\nfundou o Colégio de Nova Friburgo, vinculado à Fundação Getulio Vargas.\nNesse mesmo ano elegeu-se prefeito de Nova Friburgo, exercendo o mandato\naté janeiro de 1955.\n\nNo pleito de outubro de 1954 concorreu a uma vaga na Câmara dos\nDeputados na legenda do Partido Social Democrático (PSD), obtendo uma\nsuplência. A convite do governador Miguel Couto Filho presidiu o Banco\ndo Estado do Rio de Janeiro de 1954 a 1957, quando tomou assento na\nCâmara, lá permanecendo até dezembro de 1958. Desgostoso com a morte de\numa filha retirou-se da vida pública e retornou a Nova Friburgo.\n\nComo empresário, criou a Companhia de Hóteis Sans-Souci e a Rádio\nSociedade de Friburgo.\n\nFaleceu na cidade do Rio de Janeiro no dia 3 de maio de 1973.\n\nEra casado com Maria Augusta Amaral Müller, com quem teve cinco filhos.\n\n \n\nFONTES: ASS. NAC. CONST.; *Boletim Min. Trab*. (5/36); CÂM. DEP.\n*Deputados*; *Diário do Congresso Nacional*; INF. Oscar Müller; LEITE,\nA. *Páginas*; TRIB. SUP. ELEIT. *Dados* (3).\n\n \n","ref":"FONTES: ASS. NAC. CONST.; *Boletim Min. Trab*. (5/36); CÂM. DEP.\n*Deputados*; *Diário do Congresso Nacional*; INF. Oscar Müller; LEITE,\nA. *Páginas*; TRIB. SUP. ELEIT. *Dados* (3).\n\n \n","dic":"DHBB"}
