{"title":"NABUCO, José Tomás","cargoss":["Deputado federal","Embaixador do Brasil - Uruguai","Embaixador do Brasil - Peru"],"cargos_esp":[0,0,0],"datas_ini":[1906,1924,1937],"datas_fim":[1924,1926,1937],"estados":["RS",0,0],"autor":[0],"content":"**NABUCO, José Tomás**\n\n\\*diplomata; dep. fed. RS 1906-1924; emb. Bras. Uruguai 1924-1926; emb.\nBras. Peru 1937.\n\n*José Tomás Nabuco de Gouveia*nasceu em Leopoldina (MG) no dia 11 de\noutubro de 1872, filho de Hilário Soares de Gouveia, médico, e de Rita\nNabuco de Gouveia. Seu avô materno, José Tomás Nabuco de Araújo,\nestadista durante a Monarquia, exerceu diversas funções públicas, entre\nas quais a de ministro da Justiça (1853-1857, 1858, 1859 e 1865-1866) e\na de conselheiro de Estado (1866). Seu primo Maurício Nabuco foi\nembaixador do Brasil em Santiago do Chile (1937-1939) e em Washington\n(1948-1951), e seu tio Joaquim Aurélio Barreto Nabuco de Araújo,\npolítico, diplomata e historiador brasileiro, foi deputado pela\nprovíncia de Pernambuco (1858, 1885, 1886-1889) e lutou no Parlamento\npela emancipação dos escravos.\n\nFez os cursos preparatórios no Rio de Janeiro, então capital do Império,\nmatriculando-se em 1890 na Faculdade de Medicina dessa cidade. Em 1893\nfoi residir em Paris em companhia de seu pai, que deixou o país por ter\nparticipado de tentativas de revolução contra o governo de Floriano\nPeixoto (1891-1894), concluindo o curso de medicina na capital francesa.\n\nEm 1899 voltou ao Brasil e prestou exames que o habilitaram ao exercício\nda medicina no país. Fixando residência em Bajé (RS), passou a clinicar\ne a participar de atividades políticas. Realizou várias viagens à Europa\ne foi diretor de serviços do Hospital de Genebra, na Suíça. Em Bajé,\nocupou o cargo de vice-intendente, chegando a governar o município\ndurante algum tempo.\n\nEm 1906, 1909 e 1912, elegeu-se pelo Rio Grande do Sul para a Câmara\nFederal na legenda do Partido Republicano Rio-Grandense (PRR), passando\na integrar as comissões de Diplomacia e Tratados e de Instrução Pública.\nEm abril de 1912 foi aprovado em concurso para livre-docente da\nFaculdade de Medicina do Rio de Janeiro e em agosto de 1914 tornou-se\ndiretor da Maternidade do Rio de Janeiro. Em março do ano seguinte foi\nnomeado professor-substituto da cadeira de ginecologia e obstetrícia da\nFaculdade de Medicina do Rio de Janeiro. Ainda em 1915 reelegeu-se uma\nvez mais deputado federal e em julho de 1918 foi chefe da Missão Médica\nBrasileira durante a Primeira Guerra Mundial (1914-1918). Nesse mesmo\nano voltou a se reeleger deputado federal.\n\nEm 1923 foi ao Rio Grande do Sul, por delegação do presidente Artur\nBernardes (1922-1926), tentar promover um acordo entre republicanos e\nfederalistas, que se encontravam em luta armada desde o início do ano. A\npacificação foi consumada em dezembro desse mesmo ano, através da\nintervenção do general Fernando Setembrino de Carvalho, quando foi\nassinado o Pacto de Pedras Altas.\n\nEm novembro de 1924 José Tomás Nabuco entrou para a diplomacia como\nembaixador extraordinário e ministro plenipotenciário, assumindo no mês\nseguinte a missão brasileira em Montevidéu, substituindo Luís Guimarães\nFilho. Também nesse ano reelegeu-se mais uma vez deputado federal. Em\n1925 negociou e assinou o Convênio de Cooperação Recíproca\nBrasil-Uruguai, para os casos de alteração da ordem nos territórios\nfronteiriços. Permaneceu em Montevidéu até junho de 1926, sendo\nsubstituído por Hélio Lobo. Foi ministro no Paraguai em outubro de 1926\ne atuou como ministro plenipotenciário em Berna, na Suíça, e em\nBucareste, na Romênia.\n\nDurante a campanha eleitoral de 1929, ficou ao lado de Júlio Prestes,\ncandidato situacionista, e contra a Aliança Liberal (1929-1930). Com a\nvitória dos partidários da Aliança Liberal na Revolução de 1930, foi mal\nrecebido no Ministério das Relações Exteriores e afastou-se das\natividades diplomáticas. Em agosto de 1932 foi delegado do Brasil ao IX\nCongresso Internacional de História da Medicina. Retornou à diplomacia\nem abril de 1937, quando foi nomeado pelo presidente Getúlio Vargas para\nsubstituir Alberto Jorge de Ipanema Moreira como embaixador do Brasil no\nPeru. Exerceu essa função até 26 de novembro do mesmo ano, sendo\nsubstituído pelo embaixador Lucílio Antônio da Cunha Bueno.\n\nCasou-se em segundas núpcias com Clotilde Paranhos do Rio Branco, filha\nde José Maria da Silva Paranhos Júnior — barão do Rio Branco — que foi\nministro das Relações Exteriores de 1902 a 1912.\n\nFONTES: ABRANCHES, J. *Governos*;**CÂM. DEP.*Deputados*;**CONSULT.\nMAGALHÃES, B.; GUIMARÃES, J. *Dic.*;*Ilustração Brasileira* (10/22);\nMIN. REL. EXT. *Anuário*;**PEIXOTO, A. *Getúlio*.\n\n \n","ref":"FONTES: ABRANCHES, J. *Governos*;**CÂM. DEP.*Deputados*;**CONSULT.\nMAGALHÃES, B.; GUIMARÃES, J. *Dic.*;*Ilustração Brasileira* (10/22);\nMIN. REL. EXT. *Anuário*;**PEIXOTO, A. *Getúlio*.\n\n \n","dic":"DHBB"}
