{"title":"NADAF, Antônio Moisés","cargoss":["Deputado federal","Deputado federal"],"cargos_esp":[0,0],"datas_ini":[1962,1959],"datas_fim":[1962,1960],"estados":["MT","MT"],"autor":[0],"content":"**NADAF, Antônio Moisés**\n\n\\*dep. fed. MT 1959-1960 e 1962.\n\n \n\n*Antônio Moisés Nadaf* nasceu em Várzea (MT) no dia 23 de fevereiro de\n1924, filho de Moisés Salim Nadaf e Escolástica Rodrigues Nadaf.\n\nFoi técnico em contabilidade. Exerceu o mandato de vereador em Cuiabá\ndurante os anos de 1947 a 1951, ocupando a secretaria da mesa da Câmara\nMunicipal. Neste último ano, tornou-se diretor da Comissão de\nPlanejamento da produção do estado de Mato Grosso, cargo que ocuparia\naté 1955.\n\nEm outubro de 1954 concorreu a uma vaga na Assembléia Legislativa do\nestado na legenda da União Democrática Nacional (UDN), foi eleito e\ntomou posse do mandato no ano seguinte. Integrou a vice-presidência da\nComissão de Constituição e Justiça e a presidência da Comissão de\nOrçamento e Finanças.\n\nElegeu-se suplente de deputado federal por Mato Grosso no pleito de\noutubro de 1958 e exerceu o mandato nos períodos de setembro a dezembro\nde 1959 e de julho a outubro de 1960.\n\nEm 1961, tornou-se membro da Comissão de Planejamento da\nSuperintendência do Plano de Valorização Econômica da Amazônia (SPVEA) e\nassumiu a presidência do Conselho Técnico do Banco de Crédito da\nAmazônia, cargos em que permaneceria até 1966. Ao longo desse período,\nvoltou a ocupar a vaga de deputado federal entre agosto a novembro de\n1962. Ainda nesse ano, formou-se em direito pela Universidade Federal do\nPará.\n\nEm 1967, foi contratado para a chefia do escritório da Superintendência\ndo Desenvolvimento da Amazônia (Sudam) em Mato Grosso. Nesse mesmo ano,\ntornou-se diretor do Banco da Amazônia (BASA), tendo sido responsável\npor todas as carteiras de crédito atendidas pelo banco (crédito geral,\nborracha, industrial, superintendência de serviços e pela presidência).\nComo atribuição da função na BASA integrou a Comissão Consultiva de\nCrédito Rural do Conselho Monetário Nacional (CMN), cargo que deixou em\n1971.\n\nNo ano seguinte, tornou-se assessor técnico e chefe de gabinete do\nreitor da Fundação Universitária Federal do Mato Grosso, cargo que\nocupou até 1975 quando passou a ocupar a presidência da Companhia do\nDesenvolvimento do Estado do Mato Grosso (Codemat) no governo de Garcia\nNeto (1975-1978).\n\nAinda durante o governo de Garcia Neto, deixou a Codemat em 1977 e\ntornou-se presidente do Instituto de Terras de Mato Grosso (Intermat),\nentidade autárquica encarregada da execução da política de disposição de\nterras e regularização fundiária do governo estadual. Deixou o cargo\nnesse mesmo ano e assumiu a presidência do Conselho de Administração de\nEmpresa Matogrossense de Turismo (Turimat), cargo que ocupou até 1979\nquando passou a dedicar-se às atividades privadas, na firma Irmãos Nadaf\ne na sua fazenda, até o seu falecimento, ocorrido em Cuiabá no dia 14 de\nagosto de 1994.\n\nEra casado com Oracilde Correia Nadaf, com quem teve quatro filhos. Um\ndos quais, Mário Nadaf, foi vereador por Cuiabá (1992-1996) e reeleito\nem 1996.\n\nPublicou *Desenvolvimento econômico da região norte-leste\nmatogrossense*, *O problema de abastecimento de leite na cidade de\nCuiabá*, *Expansão da economia rural e o progresso econômico de Mato\nGrosso*, *Caracterização dos benefícios de ordem rural a que se refere a\nConstituição Federal* (1947).\n\n \n\nFONTES: CÂM. DEP. *Deputados*; CÂM. DEP. *Deputados brasileiros.\nRepertório* (1946-1967); CURRIC. BIOG.; ENTREV. FAM.; TRIB. SUP. ELEIT.\n*Dados* (4)\n\n \n","ref":"FONTES: CÂM. DEP. *Deputados*; CÂM. DEP. *Deputados brasileiros.\nRepertório* (1946-1967); CURRIC. BIOG.; ENTREV. FAM.; TRIB. SUP. ELEIT.\n*Dados* (4)\n\n \n","dic":"DHBB"}
