{"title":"NASCIMENTO, César","cargoss":["Deputado federal","Deputado federal"],"cargos_esp":[0,0],"datas_ini":[1977,1973],"datas_fim":[1980,1975],"estados":["SC","SC"],"autor":[0],"content":"**NASCIMENTO, César**\n\n\\*dep. fed. SC 1973-1975, 1977-1980.\n\n \n\n*César Correia do Nascimento* nasceu em Laguna (SC) no dia 25 de\ndezembro de 1929, filho de Elias Júlio Correia e de Maria Correia da\nSilva.\n\nFuncionário da Caixa Econômica Federal, no pleito de novembro de 1970\ncandidatou-se a deputado federal por Santa Catarina na legenda do\nMovimento Democrático Brasileiro (MDB), partido de oposição ao regime\nmilitar instaurado no país em abril de 1964. Alcançou a primeira\nsuplência, mas, com a eleição de Pedro Ivo Campos à prefeitura de\nJoinville (SC) em novembro de 1972, ocupou uma cadeira na Câmara dos\nDeputados de fevereiro de 1973 a janeiro de 1975.\n\nNo pleito de novembro de 1974 tentou novamente eleger-se deputado\nfederal, mas conquistou outra vez apenas uma suplência e deixou a Câmara\nem janeiro de 1975, ao fim da legislatura. Retornou à casa em fevereiro\nde 1977, em substituição a Luís Henrique da Silveira, também do MDB,\neleito em novembro do ano anterior prefeito de Joinville. Contudo, por\nproblemas de saúde, César Nascimento não conseguiu levar o mandato até o\nfim.\n\nFaleceu em São Paulo no dia 25 de dezembro de 1980.\n\nEra casado com Zulma Silva Correia, com quem teve três filhos.\n\n \n\nFONTES: ASSEMB. LEGISL. *SC. Dicionário político; CÂM. DEP. Deputados;\nCÂM. DEP. Deputados* brasileiros. Repertório (1971-1975); INF. FAM.;\nTRIB. SUP. ELEIT. *Dados* (9).\n\n \n","ref":"FONTES: ASSEMB. LEGISL. *SC. Dicionário político; CÂM. DEP. Deputados;\nCÂM. DEP. Deputados* brasileiros. Repertório (1971-1975); INF. FAM.;\nTRIB. SUP. ELEIT. *Dados* (9).\n\n \n","dic":"DHBB"}
