{"title":"NASCIMENTO, Paulo","cargoss":["Deputado federal","Deputado federal","Deputado federal"],"cargos_esp":[0,0,0],"datas_ini":[1999,1998,1997],"datas_fim":[1999,0,0],"estados":["RJ","RJ","RJ"],"autor":[0],"content":"**NASCIMENTO, Paulo**\n\n\\*dep. fed. RJ 1997, 1998, 1999.\n\n*Paulo Américo de Oliveira Nascimento* nasceu em Teresópolis (RJ) no dia\n27 de agosto de 1936, filho de Eduardo Pereira do Nascimento e de\nAclimea de Oliveira Nascimento.\n\nFormou-se em direito na Universidade Federal do Rio de Janeiro (UFRJ),\nem 1964.\n\nAdvogado e professor, iniciou suas atividades profissionais como\ntesoureiro-auxiliar do Instituto de Aposentadorias e Pensões dos\nTrabalhadores no Comércio (IAPETC), em 1956, ano em que se filiou ao\nPartido Social Democrático (PSD). Eleito vereador em 1958, foi membro da\nComissão de Constituição e Justiça e Redação, e primeiro secretário da\nmesa. Em outubro de 1962 elegeu-se prefeito de Teresópolis. Com a edição\ndo Ato Institucional nº 2 (AI-2), em 27 de outubro de 1965, que\nextinguiu os partidos políticos e implantou o bipartidarismo, ingressou\nna Aliança Renovadora Nacional (Arena), partido de sustentação do regime\nmilitar instaurado em abril de 1964. Deixou a prefeitura no início de\n1967, quando passou a trabalhar como tesoureiro e agente substituto do\nINPS em Teresópolis, função que exerceu até 1974. Durante este período\nfoi indicado procurador do diretório municipal da Arena (1968) e fez\nvários cursos nas áreas de arrecadação e fiscalização (1970), benefícios\n(1971), acidente de trabalho (1971) e relações públicas (1972), no INPS,\ne de direito usual e legislação — concluído em 1973 — na Faculdade\nPlínio Leite, em Niterói (RJ).\n\nEm novembro de 1974 foi eleito deputado estadual. Empossado em fevereiro\ndo ano seguinte, atuou como membro das comissões de Transportes e\nEspecial de Despoluição da Baía de Guanabara. Vice-líder da Arena,\ndeixou a Assembléia Legislativa em janeiro de 1979, ao final da\nlegislatura.\n\nCom a extinção do bipartidarismo, em 21 de novembro de 1979, ingressou\nno Partido Democrático Social (PDS), agremiação que sucedeu à Arena. No\nperíodo de 1979 a 1982, assumiu a superintendência regional do IAPAS,\natuando também como membro da Associação Nacional dos Fiscais de\nContribuições Previdenciárias e da Associação dos Fiscais da Previdência\ndo Estado do Rio de Janeiro, em 1990.\n\nEm 1993, ingressou no Partido Progressista Reformador (PPR), resultado\nda fusão do PDS com o Partido Democrata Cristão (PDC), tendo sido membro\ndo diretório regional até 1994. Indicado secretário municipal de\nPlanejamento de Teresópolis em 1993, deixou o cargo pouco tempo depois\npara assumir, no mesmo ano, a Secretaria de Esportes, na qual permaneceu\naté 1996.\n\nNa eleição de 3 de outubro de 1994, disputou uma vaga para a Câmara dos\nDeputados pela legenda do PPR, mas conseguiu apenas uma suplência. O\npleito foi anulado por determinação do Tribunal Regional Eleitoral (TRE)\ndo Rio de Janeiro devido à suspeita de fraude. A nova votação, em 15 de\nnovembro do mesmo ano, confirmou sua condição de suplente.\n\nEm 1996, ingressou no Partido Progressista Brasileiro (PPB), agremiação\nresultante da fusão do PPR com o Partido Progressista (PP), tornando-se\nmembro dos diretórios municipal e estadual no Rio de Janeiro. Entre 2 de\njaneiro e 17 de fevereiro de 1997 exerceu o mandato de deputado federal\nem substituição ao suplente Osmar Leitão. Nesta última data, contudo,\nteve de deixar a Câmara em virtude da decisão do Tribunal Superior\nEleitoral (TSE) de diplomar novamente a bancada do Rio de Janeiro, de\nacordo com o resultado da eleição de 3 de outubro de 1994.\n\nCom a morte do deputado José Carlos Lacerda em 30 dezembro de 1997 e a\nefetivação do suplente Osmar Leitão, Nascimento assumiu uma cadeira na\nCâmara, em 6 de janeiro de 1998, permanecendo até o mês de março, quando\no titular Francisco Dornelles reassumiu suas funções parlamentares. No\npleito de outubro, Nascimento concorreu novamente a um mandato federal\npelo PPB, mas não conseguiu eleger-se. Voltou a ocupar uma cadeira de\ndeputado em 1º de janeiro de 1999, ainda na legislatura 1995-1999, em\nsubstituição ao próprio Dornelles, que fora nomeado ministro do Trabalho\ne do Emprego, no segundo governo Fernando Henrique Cardoso (1999-).\nParalelamente a esta efetivação ou não de sua suplência, Paulo\nNascimento ocupou pastas da Prefeitura de Teresópolis, como Secretário\nde Assistência Jurídica, e, de Governo e Coordenação.\n\nSeu último intento na política se deu em 2008, quando tentou, pelo PSC,\neleger-se vereador, em Teresópolis, mas não obteve sucesso.\n\nCasou-se com Emilce Freitas Nascimento, com quem teve cinco\nfilhos.                  \n\nFONTES: CÂM. DEP*. Deputados brasileiros. Repertório*(1995-1999); CÂM.\nDEP. *Lista de suplentes* (1995-1999);*Globo* (20/3/96 e 5/2/97).\n\nhttp://apuracao.ig.com.br/primeiro-turno/RJ/59153/index.html\n","ref":"FONTES: CÂM. DEP*. Deputados brasileiros. Repertório*(1995-1999); CÂM.\nDEP. *Lista de suplentes* (1995-1999);*Globo* (20/3/96 e 5/2/97).\n\nhttp://apuracao.ig.com.br/primeiro-turno/RJ/59153/index.html\n","dic":"DHBB"}
