{"title":"NASSIF, Tufy","cargoss":["Deputado federal"],"cargos_esp":[0],"datas_ini":[1963],"datas_fim":[1967],"estados":["SP"],"autor":[0],"content":"**NASSIF, Tufy**\n\n\\*dep. fed. SP 1963-1967.\n\n*Tufy Nassif*nasceu em Franca (SP) no dia 14 de junho de 1928, filho de\nAniz Nassif e de Adélia Isper Nassif.\n\nBacharel em ciências jurídicas e sociais, economista, técnico em\ncontabilidade e funcionário público federal, no pleito de outubro de\n1954 elegeu-se vereador em Franca, assumindo o mandato em fevereiro do\nano seguinte. Em outubro de 1958 reelegeu-se vereador.\n\nNo pleito de outubro de 1962 foi eleito deputado federal por São Paulo\nna legenda do Partido Trabalhista Nacional (PTN), deixando sua cadeira\nna Câmara Municipal de Franca em janeiro de 1963 e assumindo o mandato\nna Câmara Federal em fevereiro seguinte. Nessa legislatura foi\nvice-líder de seu partido e primeiro suplente da mesa da Câmara. Com a\nextinção dos partidos políticos pelo ato Institucional nº 2 (27/10/1965)\ne a posterior instauração do bipartidarismo, filiou-se à Aliança\nRenovadora Nacional (Arena), partido de apoio ao regime militar\ninstaurado no país em abril de 1964. Em novembro de 1966 tentou a\nreeleição, pela Arena, obtendo apenas a sétima suplência. Deixou a\nCâmara dos Deputados em janeiro de 1967, ao final da legislatura. Em\nnovembro de 1970 disputou novamente uma cadeira na Câmara, pela Arena,\nnão obtendo sucesso. Desde então não mais disputou nenhum cargo eletivo.\n\nRadicado em Brasília, foi auditor fiscal do Tesouro Nacional até 1996,\nano em que se aposentou.\n\nCasou-se com Marlene Nacif, com quem teve cinco filhos.\n\nFONTES: ARQ. GETÚLIO VARGAS (8); CÂM. DEP. *Deputados;*CÂM. DEP.\n*Deputados brasileiros. Repertório*(1946-1967 e 1963-1967); CÂM. DEP.\n*Relação nominal dos senhores*; INF. Marlene Nacif.\n\n \n","ref":"FONTES: ARQ. GETÚLIO VARGAS (8); CÂM. DEP. *Deputados;*CÂM. DEP.\n*Deputados brasileiros. Repertório*(1946-1967 e 1963-1967); CÂM. DEP.\n*Relação nominal dos senhores*; INF. Marlene Nacif.\n\n \n","dic":"DHBB"}
