{"title":"NAZARÉ, Rui","cargoss":["Deputado federal","Deputado federal","Deputado federal","Deputado federal","Deputado federal"],"cargos_esp":[0,0,0,0,0],"datas_ini":[1961,1960,1957,1956,1955],"datas_fim":[1961,1960,0,0,0],"estados":["SP","SP","SP","SP","SP"],"autor":[0],"content":"**NAZARÉ, Rui**\n\n\\*dep. fed. SP 1955, 1956, 1957, 1960 e 1961.\n\n \n\n*Rui Nazaré*nasceu em Salvador no dia 8 de julho de 1919, filho de\nLeonam Sellman Nazaré e de Isaura Nazaré.\n\nAdvogado formado pela Faculdade de Direito de São Paulo em 1945, no\npleito de outubro de 1954, obteve uma suplência de deputado federal por\nSão Paulo, pela legenda do Partido Trabalhista Nacional (PTN) e\nnovamente no pleito de outubro de 1958, desta vez pela coligação entre o\nPTN e o Partido Socialista Brasileiro (PSB). Durante este período,\nassumiu o mandato em diversas ocasiões entre março de 1955 e maio de\n1961.\n\nObteve novamente uma suplência de deputado por São Paulo nas eleições\nrealizadas em outubro de 1962, na legenda da coligação janista composta\npelo PTN e o Movimento Trabalhista Renovador (MTR).\n\nAfastado da vida pública desde então, atuou profissionalmente como\nadvogado.\n\nFaleceu em São José do Rio Preto no dia 4 de abril de 1979.\n\nEra casado com Araci Baltazar Nazaré, com quem teve dois filhos.\n\n \n\nFONTES: CÂM. DEP. *Deputados*; CÂM. DEP. *Deputados brasileiros.\nRepertório* (1926-1996 e 1946-1967); INF. Rui Sellmann Nazaré; TRIB.\nSUP. ELEIT. *Dados* (4 e 6).\n\n \n","ref":"FONTES: CÂM. DEP. *Deputados*; CÂM. DEP. *Deputados brasileiros.\nRepertório* (1926-1996 e 1946-1967); INF. Rui Sellmann Nazaré; TRIB.\nSUP. ELEIT. *Dados* (4 e 6).\n\n \n","dic":"DHBB"}
