{"title":"NEDEL, Rui","cargoss":["Constituinte","Deputado federal"],"cargos_esp":[0,0],"datas_ini":[1987,1987],"datas_fim":[1988,1991],"estados":[0,"RS"],"autor":[0],"content":"**NEDEL, Rui**\n\n\\*const. 1987-1988; dep. fed. RS 1987-1991.\n\n*Rui Germano Nedel* nasceu em Cerro Largo (RS) no dia 5 de junho de\n1937, filho de José Aluísio Nedel e de Erna Josefina Scherf.\n\nDiplomado em medicina pela Faculdade Federal de Ciências Médicas, em\nPorto Alegre, em 1966, ainda durante seus estudos, trabalhou como\nservidor público na Secretaria Estadual de Administração. Em 1967,\ntransferiu-se para o Tribunal Regional do Trabalho (TRT), desempenhando\nas funções de serventuário da Justiça do Trabalho até o ano de 1970.\n\nDesenvolveu atividades na região das Missões e, embora não tenha ocupado\ncargos eletivos, sempre esteve ligado à política regional, como\nmilitante do Movimento Democrático Brasileiro (MDB), partido de oposição\nao regime militar instaurado no país em abril de 1964.\n\nCom o fim do bipartidarismo, em novembro de 1979, e a conseqüente\nreorganização partidária, foi um dos fundadores do Partido do Movimento\nDemocrático Brasileiro (PMDB), em Missões.\n\nCandidatou-se à Câmara dos Deputados pelo Rio Grande do Sul no pleito de\nnovembro de 1982, obtendo a primeira suplência. Em 1985, ocupou a\nSuperintendência Regional do Instituto Nacional de Assistência Médica da\nPrevidência Social (INAMPS), na gestão do ministro Valdir Pires, cargo\nque lhe rendeu a popularidade necessária para eleger-se deputado federal\nconstituinte em novembro de 1986. Na campanha eleitoral defendeu o\ncooperativismo; o estabelecimento de um percentual mínimo do orçamento\npara a área de saúde; o desenvolvimento de tecnologia para a indústria\nde medicamentos.\n\nEmpossado em fevereiro de 1987, na Assembléia Nacional Constituinte\n(ANC) foi titular da Subcomissão dos Negros, Populações Indígenas,\nPessoas Deficientes e Minorias, da Comissão da Ordem Social; e suplente\nda Subcomissão de Garantia da Constituição, Reformas e Emendas, da\nComissão da Organização Eleitoral, Partidária e Garantia das\nInstituições.\n\nVotou a favor do rompimento de relações diplomáticas com países que\npraticassem políticas racistas, da nacionalização do subsolo, da\nlimitação dos encargos da dívida externa, da soberania popular, do\nmandado de segurança coletivo, da adoção do voto facultativo aos 16\nanos, do turno ininterrupto de seis horas, do aviso prévio proporcional,\nda unicidade sindical, do limite de 12% ao ano para os juros reais, da\ncriação de um fundo de apoio à reforma agrária, da anistia aos micro e\npequenos empresários, da legalização do jogo do bicho e do mandato de\ncinco anos para o presidente José Sarney. Opôs-se à estabilidade no\nemprego e à jornada de 40 horas semanais, medidas a seu ver prematuras;\nà pena de morte; à legalização do aborto; à limitação do direito de\npropriedade; à remuneração 50% superior para o trabalho extra; ao\npresidencialismo. Defendeu ainda a criação de mecanismos legais que\npossibilitassem a qualquer pessoa denunciar irregularidades junto ao\nTribunal de Contas da União (TCU).\n\nCom a promulgação da nova Carta Constitucional, em 5 de outubro de 1988,\ncontinuou exercendo o mandato ordinário de deputado federal.\nTransferindo-se para o Partido da Social Democracia Brasileira (PSDB),\ntentou a reeleição no pleito de outubro de 1990, mas não obteve sucesso.\nDeixou a Câmara ao término da legislatura, em janeiro do ano seguinte.\nVoltou a disputar uma indicação ao Legislativo federal pelo PSDB em\noutubro de 1994, mas também não conseguiu se eleger.\n\nCasado com Ione Borges Nedel, teve quatro filhos.\n\nPublicou *Esta terra tem dono* e *Te arranca, alemão batata**,*e***Porto\nAlegre dos Casais e a Medicina da Santa Casa*”.\n\n* *\n\nFONTES: ASSEMB. NAC. CONST. *Repertório* (1987-1988); CÂM. DEP.\n*Deputados brasileiros. Repertório* (1991-1995, 1995-1999); COELHO, J. &\nOLIVEIRA, A. *Nova*; *Correio do Povo* (1/2/87).\n\n \n","ref":"FONTES: ASSEMB. NAC. CONST. *Repertório* (1987-1988); CÂM. DEP.\n*Deputados brasileiros. Repertório* (1991-1995, 1995-1999); COELHO, J. &\nOLIVEIRA, A. *Nova*; *Correio do Povo* (1/2/87).\n\n \n","dic":"DHBB"}
