{"title":"NEDER, Antônio","cargoss":["Ministro do Supremo Tribunal Federal"],"cargos_esp":[0],"datas_ini":[1971],"datas_fim":[1981],"estados":[0],"autor":[0],"content":"**NEDER, Antônio**\n\n\\*magistrado; min. STF 1971-1981.\n\n* *\n\n*Antônio Neder*nasceu em Além-Paraíba (MG) no dia 22 de junho de 1911,\nfilho de João José Neder e de Zahie S’lameh Neder, naturais da Síria.\n\nFez os estudos primários em sua cidade natal e os secundários em\nLeopoldina (MG). Transferindo-se para o Rio de Janeiro, então Distrito\nFederal, bacharelou-se em 1937 pela Faculdade Nacional de Direito da\nUniversidade do Brasil.\n\nLogo em seguida foi nomeado promotor na comarca de Teresópolis (RJ),\npassando mais tarde a exercer as funções de pretor nas comarcas de\nSumidouro (RJ) e Mangaratiba (RJ). Aprovado em concurso para juiz de\ndireito no estado do Rio de Janeiro, já exercia efetivamente a função e\nestava prestes a ser nomeado quando foi exonerado pelo governo\nditatorial de Getúlio Vargas por ter assinado, em outubro de 1943, o\n*Manifesto dos* *mineiros*, documento de autoria de importantes nomes da\npolítica mineira, que reivindicava a redemocratização do país. Foi essa\na primeira manifestação ostensiva de oposição ao Estado Novo (1937-1945)\npartida das lideranças políticas liberais e conservadoras. Com a queda\nde Getúlio Vargas (29/10/1945) e a consequente redemocratização do país,\nfoi nomeado juiz de direito na comarca do Carmo (RJ) e em seguida na de\nNova Friburgo (RJ) e Campos (RJ) — onde atuou na 3ª Vara Criminal — e,\nfinalmente, na de Petrópolis (RJ), onde também lecionou direito\nconstitucional na Faculdade de Direito da Universidade Católica.\n\nPromovido a desembargador com atuação na 1ª Câmara Cível do Rio de\nJaneiro, em Niterói, participou intensamente, com vários militares de\nalta patente, da conspiração contra João Goulart, intensificada a partir\nde 1963. Em outubro desse ano, procurou o governador de Minas Gerais,\nJosé de Magalhães Pinto (1961-1966), para lhe apresentar os planos do\ngeneral Odílio Denis, chefe da conspiração, que não aparecia\nabertamente. Articulou também, a pedido desse general, uma reunião\nrealizada em março de 1964 em Juiz de Fora (MG), na qual diversas\nautoridades civis e militares decidiram marcar o dia em que se\ndesencadearia o movimento. No dia 31 de março de 1964 eclodiu o\nmovimento político-militar que culminou com a deposição de João Goulart.\nTendo angariado grande prestígio nos meios militares por sua atuação\nnesse episódio, Antônio Neder foi nomeado em setembro de 1964 ministro\ndo Tribunal Federal de Recursos (TFR) pelo presidente da República,\nmarechal Humberto de Alencar Castelo Branco (1964-1967), na vaga aberta\ncom a aposentadoria compulsória de Aguiar Dias com base no Ato\nInstitucional nº 1, de 9 de abril de 1964. Nesse período, foi ainda\ncorregedor e membro do Conselho de Justiça.\n\nNomeado em abril de 1971 ministro do Supremo Tribunal Federal (STF) pelo\npresidente Emílio Garrastazu Médici (1969-1974), assumiu o cargo no dia\n28 desse mesmo mês. Em fevereiro de 1978 foi eleito vice-presidente\ndessa corte, chegando à sua presidência em dezembro do mesmo ano, em\nsubstituição a Carlos Thompson Flores. No seu discurso de posse em\nfevereiro de 1979, pronunciado na presença do general João Batista\nFigueiredo, já escolhido para suceder ao general Ernesto Geisel na\npresidência da República, e de diversos ministros de Estado e\nrepresentantes do Poder Judiciário, referiu-se à situação do país logo\napós a extinção do Ato Institucional nº 5 (AI-5), de 13 de dezembro de\n1968, saudando a restauração do texto constitucional e o advento da\nnormalidade institucional e manifestando suas preocupações quanto ao que\nchamou de crise social existente naquele momento. Condenou a crise de\nvalores do mundo contemporâneo e o intervencionismo estatal que, pelo\nexcesso de regulamento, desvalorizava as normas jurídicas e produzia a\ndesobediência a elas, dificultando a aplicação da lei. Essa intervenção,\nno seu entender, seria ainda a causadora do choque entre o indivíduo e o\nEstado, entre liberdade e autoridade, mal dos países onde as grandes\nmassas reclamam o desenvolvimento econômico. Nessa situação, a seu ver,\no direito teria que ser adaptado à realidade, obra à qual deveriam\ndedicar-se os tribunais de cúpula, para preservar a certeza e a\nsegurança jurídicas. Afirmou ainda que não compreendia a liberdade\ndissociada da autoridade e que o direito seria a ciência da liberdade,\nlivrando o homem do abuso da autoridade, e a autoridade, dos abusos\nliberticidas.\n\nEm maio de 1979 instalou, como presidente do STF, o Conselho Nacional da\nMagistratura, órgão criado para julgar em sessões secretas atos\npraticados por juízes e desembargadores. Na cerimônia de instalação do\nconselho, segundo o *Jornal do Brasil* (22/5/1979), declarou que aquela\ncorte permitiria disciplinar o comportamento dos magistrados e, para\njustificar a sua existência, lembrou que dois fatores ofendiam a\nJustiça: as influências na judicatura e as fraquezas humanas inerentes\nao magistrado. Em sua opinião, a Constituição oferecia ao juiz condições\nde resistir às influências, mesmo as que viessem dos poderosos e dos\ngovernantes. Quanto às fraquezas humanas, as garantias constitucionais\nnão produziam efeito corretivo. À instalação do conselho, criado pela\nLei Orgânica da Magistratura, recém-aprovada pelo Congresso e muito\ncontestada na época por advogados e juízes, não compareceu nenhum\nmagistrado.\n\nEm junho, ainda em meio à discussão provocada pela aprovação da Lei\nOrgânica da Magistratura, considerou a lei ótima, segundo o mesmo jornal\n(12/6), por atender às necessidades da Justiça brasileira. Afirmou que a\nabertura política promovida pelo governo federal fortalecia o Poder\nJudiciário, pois os juízes haviam readquirido garantias inexistentes no\nperíodo de vigência do AI-5. Ressalvou, porém, que o regime de exceção\nnão havia influído no funcionamento da Justiça. Ainda nesse mês, ao\nresponder por escrito às perguntas formuladas pelos jornalistas sobre a\nnegativa do STF em conceder a extradição do alemão nazista Gustav Franz\nWagner, requerida pela Alemanha, Áustria, Polônia e Israel, considerou\ncompreensíveis as reações desses países à sentença do tribunal por\nrefletirem a paixão quase delirante neles existente em relação aos\ncrimes do nazismo, e ressaltou que o STF se ateve aos aspectos jurídicos\nda questão, negando a extradição em virtude de os crimes do alemão já\nestarem prescritos.\n\nEm fevereiro de 1981, no final de seu biênio como presidente do STF,\npassou o cargo ao seu sucessor, Francisco Manuel Xavier de Albuquerque.\nEm junho seguinte, aposentou-se do cargo de ministro do STF, por ter\natingido a idade-limite de 70 anos. Depois que se aposentou, dedicou-se\na prestar assistência jurídica a empresas, notadamente multinacionais,\nvisto ser sua área de especialização o direito internacional privado.\n\nFaleceu em Petrópolis no dia 1° de agosto de 2003.\n\nCasado com Petzolda Lemos Passos. Teve uma filha.\n\n \n\nFONTES: CONSULT. MAGALHÃES, B.; COUTINHO, A.\n*Brasil*;*Globo*(7/8/03);**INF. BIOG.; *Jornal do Brasil*(12 e 14/12/78,\n14 e 15/2, 18 e 22/5, 12 e 24/6/79); SILVA, H. *1964*;**SUP. TRIB. FED.\n*Supremo*.\n\n \n","ref":"FONTES: CONSULT. MAGALHÃES, B.; COUTINHO, A.\n*Brasil*;*Globo*(7/8/03);**INF. BIOG.; *Jornal do Brasil*(12 e 14/12/78,\n14 e 15/2, 18 e 22/5, 12 e 24/6/79); SILVA, H. *1964*;**SUP. TRIB. FED.\n*Supremo*.\n\n \n","dic":"DHBB"}
