{"title":"NEVES, Antônio ==============","cargoss":["Deputado federal"],"cargos_esp":[0],"datas_ini":[1967],"datas_fim":[1971],"estados":["PE"],"autor":[0],"content":"NEVES, Antônio\n==============\n\n\\*  dep. fed. PE 1967-1971.\n\n \n\n*Antônio Cavalcanti Neves*nasceu em Tam­bé (PE) no dia 7 de dezembro de\n1926, fi­lho do magistrado José Neves Filho, interventor em Pernambuco\nem 1945-1946,  e de Júlia Cavalcanti Neves.\n\nBacharelou-se em ciências jurídicas e soci­ais pela Faculdade de Direito\ndo Recife em 1951.\n\nEm 1952 tornou-se oficial-de-gabinete do secretário de Segurança do\nestado e em 1955 assumiu a chefia de gabinete da Prefeitura de Recife. \nNo pleito de outubro de 1958 elegeu-­se deputado estadual em Pernambuco\nna le­genda do Partido Trabalhista Brasileiro (PTB), assumindo o mandato\nem fevereiro do ano se­guinte. De 1959 a 1961 presidiu a Assembléia\nLegislativa pernambucana, e, a partir desse úl­timo ano, durante o\ngoverno de Cid Sampaio, tornou-se líder da oposição. Em outubro de 1962\nreelegeu-se deputado estadual na legen­da da Frente Popular Democrática,\nconstituí­da pelo Partido Social Democrático (PSD) e pela União\nDemocrática Nacional (UDN). Dei­xou a liderança da oposição em 1963, e,\ncom a extinção dos partidos políticos pelo Ato Ins­titucional nº. 2\n(27/10/1965) e a posterior ins­tauração do bipartidarismo, filiou-se ao\nMovi­mento Democrático Brasileiro (MDB), partido de oposição ao regime\nmilitar instalado no país em abril de 1964.\n\nEm novembro de 1966 elegeu-se deputado federal por Pernambuco na legenda\ndo MDB, deixando a Assembléia pernambucana em ja­neiro de 1967 e\nassumindo no mês seguinte uma cadeira na Câmara Federal. A partir de\nmaio de 1970 passou a ser vice-líder do MDB, terminando seu mandato em\njaneiro de 1971.\n\nAbandonando a carreira política, a partir dos anos 1970 exerceu apenas\natividades ligadas à sua formação universitária. Assim, foi procurador\nda Prefeitura do Recife e professor adjunto de direito administrativo da\nFaculdade de Ciências Econômicas da Universidade Federal de Pernambuco,\npelas quais se aposentaria no final da década de 1990. Paralelamente,\ndedicou-se a seu escritório de advocacia na capital pernambucana.\n\nFoi casado com Aládia da Costa Lima Neves, já falecida, com quem teve\nquatro filhos.\n\n \n\nFONTES:      CÂM. DEP.  *Deputados;*CÂM. DEP. *Deputados brasileiros. \nRepertório*(1967-1971); CÂM. DEP. *Relação nominal dos senhores;*INF.\nBIOG.; TRIB.* *SUP.  ELEIT.  *Dados* (4,6 e 9).\n\n \n\n \n\n \n\n \n\n \n","ref":"FONTES:      CÂM. DEP.  *Deputados;*CÂM. DEP. *Deputados brasileiros. \nRepertório*(1967-1971); CÂM. DEP. *Relação nominal dos senhores;*INF.\nBIOG.; TRIB.* *SUP.  ELEIT.  *Dados* (4,6 e 9).\n\n \n\n \n\n \n\n \n\n \n","dic":"DHBB"}
