{"title":"NEVES, Lucas Moreira","cargoss":["Arcebispo","Presidente da Confederação Nacional dos Bispos do Brasil"],"cargos_esp":["Salvador e primaz Brasil",0],"datas_ini":[1987,1995],"datas_fim":[1998,1998],"estados":[0,0],"autor":[0],"content":"**NEVES, Lucas Moreira**\n\n\\*arceb. Salvador e primaz Brasil 1987-1998; pres. CNBB 1995-1998.\n\n* *\n\n*Luís Moreira Neves* nasceu no município de São João del Rei (MG) no dia\n16 de setembro de 1925, filho de Telêmaco Vítor Neves, sapateiro,\nbibliotecário municipal, professor de música e regente da Orquestra\nRibeiro Bastos, e de Margarida Alacoque Moreira Neves, professora\nprimária.\n\nFez o primário no Grupo Escolar João dos Santos (1933-1936), cursando\nnos dois anos seguintes o secundário no Colégio Santo Antônio dos frades\nfranciscanos em sua cidade natal, quando foi contemporâneo dos\nescritores Paulo Mendes Campos e Oto Lara Resende. Iniciou seus estudos\nreligiosos no seminário de Mariana (MG), ingressando em 1944 na Ordem\ndos Dominicanos em São Paulo, onde fez o noviciado e o curso de\nfilosofia. Em 1947 viajou para a França, graduando-se em teologia na\nEscola de Filosofia e Teologia de Saint Maximin La Saint Baume, em\nToulouse, em 1951. Em julho de 1950 ordenou-se sacerdote, quando mudou\nseu nome para Lucas.\n\nDe volta ao Brasil, entre 1952 e 1953 foi vice-mestre de noviços e\nassistente eclesiástico da Juventude Estudantil Católica (JEC) em São\nPaulo. Transferindo-se para o Rio, de 1954 a 1967 residiu no Convento de\nSanto Tomás de Aquino tornando-se seu vice-prior e assistente da\nJuventude Universitária Católica (JUC), cargo que ocupou até 1959. Ainda\nnaquele período ensinou na Escola de Teatro da Ação Social\nArquidiocesana (ASA), coordenando a escola até 1959, com o apoio do\ncardeal dom Jaime de Barros Câmara. Na ocasião, teve contato com\nartistas, críticos e professores, entre os quais Maria Clara Machado,\nBárbara Heliodora e Napoleão Muniz Freire. Em 1959 ano começou a atuar\nno Movimento Familiar Cristão (MFC), tornando-se seu vice-presidente\nnacional, cargo que ocupou até 1965. Nessa época iniciou os contatos com\nlíderes religiosos dos países da América Latina. Também nesse período\ndirigiu a revista *Mensageiro do Santo Rosário,*dos frades dominicanos,\nfunção que exerceu até 1962.\n\nIniciando seu trabalho na Conferência Nacional dos Bispos do Brasil\n(CNBB) em 1965, dois anos depois foi designado bispo-auxiliar em São\nPaulo, na arquidiocese dirigida pelo cardeal-arcebispo dom Agnelo Rossi.\nConsagrado em agosto de 1967, em cerimônia realizada em São João del Rei\ne celebrada por dom Agnelo Rossi, teve como padrinhos um primo distante,\no então deputado federal Tancredo Neves; o crítico literário Alceu\nAmoroso Lima; e um negro da favela Morro do Chapéu conhecido como\nNhonhô*.* Foi assistente nacional do MFC (1967-1970) e assistente\nlatino-americano (1970-1973) e, ainda, vigário episcopal para a Pastoral\nFamiliar (1967-1971).\n\nAtuando como vigário-geral para a Pastoral dos Meios de Comunicação\nSocial da CNBB entre 1971 e 1974, durante o governo do general Emílio\nGarrastazu Médici e o início do mandato do general Ernesto Geisel,\nparticipou de reuniões secretas de representantes da Igreja Católica e\ndas forças armadas. Estas reuniões, nas quais o primeiro escalão do\nclero cobrava da cúpula militar a investigação dos casos de violação de\ndireitos humanos e o fim do cerceamento da liberdade de expressão e das\nperseguições políticas, constituiu-se o que ficou conhecido como a\nComissão Bipartite. Numa de suas últimas atividades naquela\narquidiocese, dom Lucas visitou presos políticos no antigo Departamento\nde Ordem Política e Social (DOPS), em julho de 1973, e defendeu a\napuração da morte do estudante Alexandre Vannuchi Leme na Comissão\nBipartite.\n\nEm 1971 foi nomeado pelo papa Paulo VI membro do Conselho Pontifício\npara os Leigos, transferindo-se para Roma em 1974, quando trabalhou no\nVaticano ao lado do cardeal Karol Wojtila, que em 1978 se tornaria Papa.\n\nEm outubro de 1979, já sob o papado de João Paulo II, foi promovido a\nsecretário da Sagrada Congregação dos Bispos e, no mês seguinte,\ncumulativamente a secretário do Sacro Colégio dos Cardeais, entidades\nque participavam do mecanismo de nomeações e transferências de bispos\ndecididas pelo papa. Tornando-se amigo de João Paulo II, dom Lucas\nensinou-lhe português antes de sua viagem ao Brasil, em 1980. Naquele\nano, quando foi escolhido para ser o pregador do retiro espiritual do\npapa, teve sua consagração definitiva como bispo.\n\nSendo seu cargo no Vaticano correspondente ao de um ministro de Estado,\nesteve na União Soviética, na China e no Japão representando João Paulo\nII na década de 1980. Em janeiro de 1985 conseguiu que Tancredo Neves,\ncandidato à presidência da República no Colégio Eleitoral, fosse\nrecebido pelo papa. No dia 24 de abril — após o falecimento, três dias\nantes, de Tancredo Neves, que tinha sido eleito presidente, mas por\nmotivo de doença não chegara a tomar posse, sendo substituído pelo vice\nJosé Sarney — dom Lucas encomendou o corpo de seu primo em São João del\nRei.\n\nNa Cúria romana foi ainda consultor do Concilium de Laicis (1971-74);\nmembro do Comitê para a Família (1971-76), do Conselho do Sínodo dos\nBispos (1976-77) e da Comissão Pontifícia Justiça e Paz (1976-81),\nconsultor da Congregação para a Doutrina da Fé (1978-87), e membro da\nPontifícia Comissão para a Pastoral da Migração e do Turismo (1980-87),\nda Pontifícia Comissão para a América Latina (1980-87) e do Comitê para\nos Congressos Eucarísticos Internacionais (1982).\n\nArcebispo de Salvador e primaz do Brasil\n\nNo dia 15 de julho de 1987 dom Lucas foi nomeado pelo papa arcebispo de\nSalvador e primaz do Brasil, em substituição a dom Avelar Brandão\nVilela, falecido em dezembro do ano anterior. O título de primaz se\njustificava porque Salvador foi a primeira diocese do país, criada em 25\nde fevereiro de 1551 pelo papa Júlio III. Dom Lucas anunciou que sua\nmissão na arquidiocese seria “a de todo bispo: evangelizar no sentido\npleno e radical que este verbo tem na *Evangeli Nuntiandi*, e continuar\na aplicar todo o Concílio Vaticano II”.\n\nSua indicação foi bem-aceita pelas autoridades da Bahia e pela CNBB, e\nele passou a ser visto como um importante interlocutor nas relações\nIgreja-Estado no Brasil, devido a suas boas relações com o Vaticano.\n\nDepois de 13 anos afastado do Brasil, dom Lucas chegou ao Rio em\nsetembro de 1987, tendo recebido às vésperas de sua posse uma carta da\nComissão dos Padres, Seminaristas e Religiosos Negros do Rio de Janeiro,\nafirmando que sua presença reforçaria a luta dos negros, e que a Igreja\nassumira o tema da comunidade negra na Campanha da Fraternidade de 1988,\nano do centenário da Lei Áurea. A cerimônia de posse se realizou no dia\n27 de setembro, tendo comparecido a ela tanto representantes do chamado\nclero progressista quanto do chamado clero conservador. Como\narcebispo-primaz tornou-se, então, responsável pelo comando de 97\nparóquias constituídas por 515 capelas e igrejas**,**números que\ncontrastavam com os setecentos terreiros de candomblé existentes na\nBahia. Com relação ao sincretismo religioso baiano, considerou-o “um\ndesafio pastoral”, prometendo “grande respeito por tudo que há de\nverdade e até de semente de cristianismo nos cultos afro-brasileiros”.\nDestacou como prioridade de seu trabalho a promoção humana, definindo-a\ncomo “alfabetizar e instruir” e “pôr de pé toda uma massa de\nmarginalizados”, pois “não se liberta o homem sem lhe dar instrução”.\n\nDizendo-se contrário aos rótulos, rejeitou ser identificado como\nconservador ou progressista. Afirmou que as etiquetas “são boas para\ninsetos nos laboratórios e não para pessoas humanas, menos ainda para\nbispos”. Entrevistado sobre sua atitude frente à Teologia da Libertação,\nainda em setembro, respondeu que havia duas correntes: uma definida pelo\npapa João Paulo II como “oportuna e necessária” inserindo-se na doutrina\nda Igreja; a outra seria “inaceitável”, por se basear na análise\nmarxista da sociedade.\n\nNo mês seguinte ao de sua posse, no Dia Mundial da Moradia, dom Lucas,\nem visita a Alagados, a maior favela da Bahia, fez um apelo aos\ngovernantes em favor de uma política mais humana, que desse prioridade a\neducação, saúde, moradia e trabalho.\n\nChamando a atenção para o crescimento das seitas pentecostais, entre\nelas a Assembléia de Deus, em fevereiro de 1988 observou que elas\nprosperavam à medida que a Igreja Católica se dedicava mais à ação\nsocial, descuidando-se de sua missão religiosa.\n\nDurante a 26ª Assembléia Geral da CNBB, realizada no mesmo ano,\nmostrou-se preocupado com “a crise moral, política e econômica” vivida\npelo país, sugerindo “um amplo saneamento nacional”. Entre os sintomas\ndesta crise, destacou “a sensação de frustração da juventude, a\ndesagregação familiar, o erotismo e a pornografia, a indústria das\ndrogas e uma terrível corrupção e imoralidade no trato da coisa\npública”.\n\nPor ocasião da visita da comitiva do rei dos ketus, Adé Tutu, do Benin,\npaís africano de onde se originou parte dos negros brasileiros, em maio\nde 1988 dom Lucas a recebeu presenteando o rei com um rosário e\ndistribuindo catecismos para os demais membros da comitiva. No entanto,\nnão compareceu à inauguração da Casa do Benin, no Pelourinho. Ainda em\nmaio de 1988 foi anunciada a sua nomeação como cardeal. No dia 29 de\njunho recebeu no Vaticano o barrete cardinalício, integrando o primeiro\ngrupo do clero brasileiro ordenado cardeal por João Paulo II.\n\nTambém em 1988, no mês de novembro, nas vésperas das eleições, dom Lucas\napelou contra a violência conclamando candidatos, políticos, autoridades\ne até mesmo religiosos que tivessem sua parcela de responsabilidade a\nelevar o nível da campanha. A violência, a seu ver, seria resultado da\n“deseducação política da população”, em decorrência do período longo sem\neleições.\n\nNo mês seguinte, contestou as acusações do empresário Orlando Moscozo\nBarreto, presidente da Federação das Indústrias da Bahia, de que a\nIgreja e sindicatos estrangeiros estivessem financiando a desordem no\nBrasil. Em nota oficial da arquidiocese, assegurou à opinião pública que\ntoda ajuda externa enviada pela comunidade católica estrangeira era para\na finalidade das atividades pastorais e da vasta obra social realizada\npela Igreja.\n\nEm janeiro de 1989 Dom Lucas entrou em atrito com representantes do\ncandomblé baiano, ao ameaçar impedir a lavagem do adro da Igreja do\nSenhor do Bonfim pelas baianas, filhas de santo. Acabou por permitir a\nrealização do ritual fazendo, no entanto, um apelo aos participantes\npara “não profanarem o espaço da basílica”.\n\nDois meses mais tarde, quando foi exibido no Brasil o filme *A última\ntentação de Cristo*, do diretor Martin Scorsese, dom Lucas o criticou\npor apresentar uma figura humanizada de Cristo, considerando-o expressão\nde uma “nova irrupção do fenômeno de dessacralização que caracterizou os\nanos 1960”.\n\nEm março de 1990, próximo à posse do novo presidente da República,\nFernando Collor de Melo, dom Lucas declarou que a Igreja, embora\nafastada da política partidária, pretendia ajudá-lo usando sua\nautoridade moral e uma visão ética dos problemas do país. Em junho\ncondenou o projeto de lei do deputado Nélson Seixas, que propunha a\nlegalização da esterilização masculina e feminina, afirmando que\ncontrariava os princípios cristãos. No mês seguinte foi designado por\nJoão Paulo II relator do Sínodo dos Bispos que se reuniu em Roma em\noutubro para discutir a formação sacerdotal.\n\nNo ano seguinte, em abril, participou juntamente com outros cardeais\nbrasileiros e do mundo inteiro de um encontro no Vaticano, no qual foram\ndiscutidas soluções para os problemas de evasão de fiéis da Igreja\nCatólica para as seitas pentecostais e de falta de padres no Brasil. No\nmesmo mês, como candidato da ala conservadora, foi derrotado na disputa\npela presidência da CNBB, por dom Luciano Mendes, considerado\nprogressista.\n\nNo 3º Encontro de Bispos promovido pela arquidiocese do Rio de Janeiro,\nem fevereiro de 1992, dom Lucas defendeu o aproveitamento da tecnologia\nda comunicação para a evangelização, com a utilização de vídeos e\náudios. Obtendo apoio do Papa na sua luta em defesa de um maior controle\nsobre a programação das emissoras de televisão, declarou que não\ndesistiria da campanha por uma TV melhor. Em fevereiro de 1994, no\nlançamento da Campanha da Fraternidade que teve como lema “A família\ncomo vai?”, propôs uma mudança no código de ética da Associação\nBrasileira de Empresas de Rádio e Televisão (ABERT), de forma a que\nfossem impostas barreiras à “excessiva permissividade” veiculada por\naqueles meios de comunicação. Segundo ele, “a mensagem nociva passada\npela televisão” contribuía para a “desagregação da família”.\n\nSobre o tema da Campanha da Fraternidade de 1995 — a “exclusão social” –\ndisse que um dos primeiros da lista de excluídos eram os privados da\ninstrução e da educação, os analfabetos. Destacou o papel da Igreja como\neducadora, propondo sua colaboração para o enfrentamento do problema.\n\nPresidente da CNBB\n\nEm maio de 1995, dom Lucas foi eleito presidente da CNBB, substituindo\ndom Luciano Mendes. Após 22 anos de hegemonia dos “progressistas”, sua\nvitória representou a ascensão das alas “conservadora” e “moderada” do\nepiscopado na direção da entidade. Mas embora considerado “conservador”,\no cardeal era visto como um homem atento às questões sociais.\n\nOcupando oito cargos na Cúria Romana, atuando nas congregações para a\nDoutrina da Fé e para os Bispos, a vitória de dom Lucas foi vista também\npelos partidários de sua candidatura como a possibilidade de uma maior\naproximação com o Vaticano e, conseqüentemente, o aumento do prestígio\nda CNBB. Além disso, dom Lucas fora apontado como um dos candidatos a\nsucessor de João Paulo II. Ainda em maio, entrevistado pela imprensa,\ndeclarou que a Igreja daria prioridade à sua missão religiosa, não\ndescuidando dos pobres e dos direitos humanos. Voltando a rechaçar os\nrótulos de “conservador” ou “progressista”, declarou-se apreensivo com\nas reformas propostas pelo presidente eleito em outubro do ano anterior,\nFernando Henrique Cardoso, por temer que elas anulassem as conquistas da\nConstituição de 1988.\n\nEm setembro de 1995 dom Lucas fez um apelo ao ministro da Saúde, Adib\nJatene, para que este suspendesse a campanha contra a AIDS que tinha um\npênis como personagem principal. Em contraposição, chamou a atenção para\no fato de não terem sido abordados na campanha de prevenção os casos de\ncontágio entre viciados em drogas ou por transfusão de sangue.\n\nNo mês seguinte, diante da agressão a uma imagem de Nossa Senhora da\nAparecida cometida por um pastor da Igreja Universal do Reino de Deus e\ntransmitida por um programa da TV Record, de propriedade\ndaquela****seita, dom Lucas ressaltou a necessidade de se criar uma TV\ncatólica que divulgasse a evangelização. Divulgou uma nota da CNBB\ncontendo dez pontos sobre a agressão e conclamou os membros da Igreja\nCatólica a perdoarem aquela ofensa e a rejeitarem qualquer impulso de\nrevanchismo. Ainda em outubro decidiu promover manifestações católicas\nna Bahia, assinalando que a Igreja deveria ter mais presença nas ruas.\n\nApós a imprensa ter noticiado que o arcebispo-cardeal dom Paulo Evaristo\nArns teria defendido o aborto em caso de estupro, em janeiro de 1996 dom\nLucas escreveu artigo sobre a questão, afirmando que ninguém tem o poder\nde suprimir a vida humana, nem mesmo em caso de estupro, e afirmando que\no aborto é moralmente ilícito. Em fevereiro, comparando o carnaval às\nantigas festas de Sodoma e Gomorra, considerou a extensão das\ncomemorações até a Quarta-Feira de Cinzas um desrespeito aos preceitos\nda Igreja, já que naquele dia começa o período da Quaresma. Em março,\nreuniu milhares de baianos na Romaria do Bonfim, quando celebrou missa\nem cima de trio elétrico num percurso de quatro quilômetros. Conclamou\nos fiéis a integrarem ao cotidiano o lema da Campanha da Fraternidade\ndaquele ano — “Justiça e paz se abraçarão”.\n\nNa 34ª Assembléia Geral do episcopado brasileiro em abril, o cardeal, em\nnome da CNBB, divulgou nota protestando contra o massacre dos\ntrabalhadores sem-terra em Eldorado do Carajás, no Pará, e exigindo a\nimediata apuração do crime e a responsabilização dos culpados.\nManifestou, ainda, a disposição da Igreja de participar do Conselho da\nTerra, órgão de assessoria que seria criado pelo novo Ministério\nExtraordinário da Reforma Agrária, na busca de solução para a questão\nfundiária. Embora declarando o apoio da Igreja à luta do Movimento dos\nTrabalhadores Rurais Sem Terra (MST), advertiu quanto a invasões de\nterras, declarando que esta prática não fazia parte de sua doutrina\nsocial.\n\nElogiando a iniciativa do governo brasileiro de doar parte das terras do\nExército para a reforma agrária, em maio considerou a possibilidade de\ndoações, por parte da Igreja, de terras improdutivas e aráveis, caso\nelas existissem. Em maio, criticou a Lei do Concubinato, sancionada pelo\npresidente da República, considerando-a desestruturadora da família,\nassim como a legalização dos cassinos e a possibilidade de se\noficializar a união entre homossexuais. Por outro lado, foi a favor de\nque os seminaristas e mulheres participassem do serviço civil\nobrigatório, desde que com tarefas próprias.\n\nAtravés de convênio entre a Fundação Roberto Marinho, a Federação das\nIndústrias do Estado de São Paulo (FIESP) e a CNBB, firmado em junho de\n1996, a Rede Vida, emissora de televisão da Igreja Católica, passou a\ntransmitir para todo o Brasil os programas educativos do Telecurso 2000.\nDom Lucas considerou a parceria de extrema importância, lembrando que o\nlema da Campanha da Fraternidade daquele ano era a respeito da educação.\nNo mesmo mês, apelou ao Congresso para que este viabilizasse os\ninstrumentos para a reforma agrária como a votação do rito sumário para\na desapropriação de terras. Ressaltou, na ocasião, a necessidade de os\nassentamentos serem acompanhados de assistência técnica. Quanto às\nterras que a Igreja poderia doar, observou que elas não permitiriam\nassentar um número significativo de famílias.\n\nEm julho seguinte dom Lucas foi eleito para ocupar a vaga de Abgar\nRenault na Academia Brasileira de Letras (ABL).\n\nEm 25 de junho de 1998, foi nomeado prefeito da Congregação para os\nBispos, um dos ministérios mais importantes da Santa Sé. Na mesma\nocasião, foi nomeado cardeal-bispo de uma das sete dioceses situadas no\nVaticano, a de Sabina Poggio Mirteto. Assumiu o cargo em 25 de julho\nseguinte, tendo sido substituído na presidência da CNBB pelo vice dom\nJaime Chemello, bispo de Pelotas, vinculado ao clero progressista. Seu\nlugar no arcebispado de Salvador só foi ocupado em janeiro de 1999, com\na nomeação do cardeal Geraldo Majela Agnelo pelo papa João Paulo II.\n\nFaleceu em Roma no dia 8 de setembro de 2002, tendo sido sepultado em\nSalvador.\n\nDom Lucas publicou, entre outras obras, *Com o olhar do\npastor*(1990),*Restaurar a família em Cristo, Vigilante desde a\naurora*(1991), *Pôr-de-sol em Reritiba* (1992), *O homem descartável e\noutras crônicas* (1995) e *O alferes e o presidente*(1996).\n\nVerônica Veloso\n\n \n\nFONTES: *Estado de S. Paulo* (16 e 17/7, 16, 17 e 27/9 e 18/11/87, 12/11\ne 10/12/88, 12/1 e 26/12/89, 28/7/90, 27/8/92, 5/1, 16 e 17/2, 30/3,\n31/8, 28/9, 23 e 30/11/94, 15/3, 3 e 16/5, 28/6, 6/9, 8 e 29/11,\n13/12/95, 31/1, 7/2, 3, 6 e 27/3, 4 e 26/6, 3 e 17/7/96, 26 e 28/6/98);\n*Folha de S. Paulo*(4/6, 16 e 31/7, 15, 16 e 27/9 e 26/12/87, 9/2, 15/4,\n9 e 31/5/88, 8/5/90, 19/4/91, 19/3/93, 17/5, 6 e 25/10/95, 1/3 e\n25/4/96); *Globo*(4/6, 21 e 26/7, 16 e 20/9/87, 9 e 30/5/88, 27/12/89,\n9/3, 28/6 e 28/9/90, 31/3/91, 20/5, 22 e 31/10, 26/11/95, 19/2, 30/3,\n31/5, 25 e 28/6 e 19/7/96; 9/9/02); *Jornal do Brasil* (18 e 27/7, 28/9\ne 6/10/87, 27/4, 30/5, 1, 20 e 30/6/88, 11/1, 29/3 e 3/8/89, 24/1 e\n12/2/93, 5/1, 2/2, 27/4 e 23/11/94, 16/5, 7 e 13/6, 19 e 26/7, 16 e\n30/8, 18/10, 22/11 e 27/12/95, 19/4/96, 10 e 14/1/99); *Veja*\n(19/10/88).\n\n \n","ref":"FONTES: *Estado de S. Paulo* (16 e 17/7, 16, 17 e 27/9 e 18/11/87, 12/11\ne 10/12/88, 12/1 e 26/12/89, 28/7/90, 27/8/92, 5/1, 16 e 17/2, 30/3,\n31/8, 28/9, 23 e 30/11/94, 15/3, 3 e 16/5, 28/6, 6/9, 8 e 29/11,\n13/12/95, 31/1, 7/2, 3, 6 e 27/3, 4 e 26/6, 3 e 17/7/96, 26 e 28/6/98);\n*Folha de S. Paulo*(4/6, 16 e 31/7, 15, 16 e 27/9 e 26/12/87, 9/2, 15/4,\n9 e 31/5/88, 8/5/90, 19/4/91, 19/3/93, 17/5, 6 e 25/10/95, 1/3 e\n25/4/96); *Globo*(4/6, 21 e 26/7, 16 e 20/9/87, 9 e 30/5/88, 27/12/89,\n9/3, 28/6 e 28/9/90, 31/3/91, 20/5, 22 e 31/10, 26/11/95, 19/2, 30/3,\n31/5, 25 e 28/6 e 19/7/96; 9/9/02); *Jornal do Brasil* (18 e 27/7, 28/9\ne 6/10/87, 27/4, 30/5, 1, 20 e 30/6/88, 11/1, 29/3 e 3/8/89, 24/1 e\n12/2/93, 5/1, 2/2, 27/4 e 23/11/94, 16/5, 7 e 13/6, 19 e 26/7, 16 e\n30/8, 18/10, 22/11 e 27/12/95, 19/4/96, 10 e 14/1/99); *Veja*\n(19/10/88).\n\n \n","dic":"DHBB"}
