{"title":"NEVES, Paulo Baeta","cargoss":["Constituinte","Deputado federal","Presidente de associação ou confederação de empregados ou empregadores","Deputado federal"],"cargos_esp":[0,0,"CNTC","GB"],"datas_ini":[1946,1946,1951,1964],"datas_fim":[1946,1951,1955,1966],"estados":[0,"DF",0,0],"autor":[0],"content":"**NEVES, Paulo Baeta**\n\n\\*const. 1946; dep. fed. DF 1946-1951; pres. CNTC 1951-1955; dep. fed.\nGB 1964-1966.\n\n \n\n*Paulo Baeta Neves* nasceu em Conselheiro Lafaiete (MG) no dia 2 de\nagosto de 1898, filho de José Francisco Baeta Neves e de Julieta\nTeixeira Baeta Neves.\n\nFez os estudos primários no Grupo Escolar Domingos Beliano e no Colégio\nSão José, em Queluz (MG), cursando o secundário no Colégio\nAnglo-Brasileiro e no curso anexo à Faculdade de Direito do Rio de\nJaneiro, no então Distrito Federal, onde se formou em 1921.\n\nEm 1927 começou a trabalhar no comércio, tornando-se diretor, em Belo\nHorizonte, da União dos Empregados do Comércio e do Sindicato de\nVendedores e Viajantes e presidindo em 1932 a Federação dos\nTrabalhadores de Minas Gerais. Durante o Estado Novo (1937-1945),\nsecretariou, de 1938 a 1942, a Federação das Uniões dos Vendedores e\nViajantes Comerciários do Brasil. Em 1941 participou do Congresso dos\nComerciários, realizado em São Paulo, e do II Congresso Pan-Americano de\nViajantes e Vendedores Comerciários, tornando-se em 1944 membro do\nconselho de representantes da Federação dos Sindicatos dos Empregados do\nComércio do Rio de Janeiro e suplente da 1ª Região de Justiça.\n\nCom a desagregação do Estado Novo, participou em meados de 1945 da\nfundação do Partido Trabalhista Brasileiro (PTB), em cuja legenda foi\neleito em dezembro desse ano deputado pelo Distrito Federal à Assembléia\nNacional Constituinte. Empossado em fevereiro de 1946, foi indicado para\na Comissão de Constituição, integrando a subcomissão encarregada do\ncapítulo “Da ordem econômica e social”. Após a promulgação da nova Carta\n(18/9/1946), passou a exercer o mandato ordinário, integrando a Comissão\nPermanente de Legislação Social da Câmara.\n\nNo pleito de outubro de 1950 voltou a disputar um mandato federal,\nobtendo apenas uma suplência. Deixando a Câmara em janeiro de 1951,\nnesse mesmo ano foi eleito para a presidência da Confederação Nacional\ndos Trabalhadores no Comércio, cargo para o qual foi reeleito dois anos\ndepois, no qual exerceria até 1955. No pleito de outubro de 1954\ncandidatou-se a uma cadeira na Câmara, pela legenda do PTB, não obtendo\nêxito. Integrou de 1957 a 1958 o Conselho Superior das Caixas Econômicas\nFederais, para onde voltaria em 1960. Em outubro de 1958 disputou\nnovamente uma cadeira na Câmara, não obtendo sucesso.\n\nEm outubro de 1962 voltou a concorrer à Câmara dos Deputados, agora pelo\nnovo estado da Guanabara e na legenda da Aliança Social Trabalhista,\ncoligação formada pelo PTB e o Partido Socialista Brasileiro (PSB),\nobtendo novamente apenas uma suplência. Após a vitória do movimento\npolítico-militar de 31 de março de 1964, que depôs o presidente João\nGoulart e cassou inúmeros mandatos, assumiu no mês seguinte uma cadeira\nna Câmara. Com a extinção dos partidos políticos por força do Ato\nInstitucional nº 2 (27/10/1965) e a posterior instauração do\nbipartidarismo, filiou-se ao Movimento Democrático Brasileiro (MDB),\npartido de oposição ao regime militar instalado no país em abril de\n1964.\n\nBacharel em ciências e letras, dedicou-se também ao magistério e dirigiu\no Colégio Felisberto de Meneses.\n\nFaleceu em pleno exercício do mandato, na cidade do Rio de Janeiro, em\njulho de 1966.\n\nEra casado com Marina Sevilha Baeta Neves, com quem teve dois filhos.\n\n \n\n \n\nFONTES: CÂM. DEP. Deputados; CÂM. DEP. Deputados brasileiros. Repertório\n(1946-1967); CÂM. DEP. Relação dos dep.; COUTINHO, A. Brasil; Diário do\nCongresso Nacional; Estado de S. Paulo (19/9/76); Grande encic. Delta;\nHIPÓLITO, L. Campanha; HIRSCHOWICZ, E. Contemporâneos; Jornal dos Trab.\nComércio do Brasil (12/75); SILVA, G. Constituinte; TRIB. SUP. ELEIT.\nDados (1, 2 e 6).\n\n \n","ref":"FONTES: CÂM. DEP. Deputados; CÂM. DEP. Deputados brasileiros. Repertório\n(1946-1967); CÂM. DEP. Relação dos dep.; COUTINHO, A. Brasil; Diário do\nCongresso Nacional; Estado de S. Paulo (19/9/76); Grande encic. Delta;\nHIPÓLITO, L. Campanha; HIRSCHOWICZ, E. Contemporâneos; Jornal dos Trab.\nComércio do Brasil (12/75); SILVA, G. Constituinte; TRIB. SUP. ELEIT.\nDados (1, 2 e 6).\n\n \n","dic":"DHBB"}
