{"title":"NEVES, Tancredo","cargoss":["Deputado federal","Ministro da Justiça","Deputado federal","Presidente de associação ou confederação de empregados ou empregadores","Primeiro ministro","Deputado federal","Senador","Governador de estado ou do Distrito Federal","Presidente da República"],"cargos_esp":[0,0,0,"BNDE",0,0,0,0,"eleito"],"datas_ini":[1951,1953,1954,1960,1961,1963,1979,1983,1985],"datas_fim":[1953,1954,1955,1961,1962,1979,1983,1984,1985],"estados":["MG",0,"MG",0,0,"MG","MG","MG",0],"autor":[0],"content":"**NEVES, Tancredo**\n\n\\*dep. fed. MG 1951-1953; min. Just. 1953-1954; dep. fed. MG 1954-1955;\npres. BNDE 1960-1961; prim.-min. 1961-1962; dep. fed. MG 1963-1979; sen.\nMG 1979-1983; gov. MG 1983-1984; pres. Rep. eleito 1985.\n\n \n\n*Tancredo de Almeida Neves* nasceu em São João del Rei (MG) no dia 4 de\nmarço de 1910, quinto dos 12 filhos de Francisco de Paula Neves e de\nAntonina de Almeida Neves. Descendia, por parte de pai, do comendador\nportuguês José Antônio das Neves, que se estabelecera na cidade antes da\nindependência do Brasil. A família Neves teve ativa participação na vida\npolítica do município, destacando-se o comerciante José Juvêncio das\nNeves, avô de Tancredo, ativista fervoroso da causa republicana.\n\nTancredo freqüentou o grupo escolar João dos Santos entre 1917 e 1920 e\ningressou em seguida no Colégio Santo Antônio, dirigido por frades\nfranciscanos, concluindo o curso de humanidades em 1927. No ano\nseguinte, transferiu-se para Belo Horizonte e matriculou-se na Faculdade\nde Direito, onde teve seu primeiro contato com a luta política ao\nparticipar da campanha da Aliança Liberal, coligação oposicionista\narticulada por Minas Gerais e Rio Grande do Sul que lançou a chapa\nGetúlio Vargas-João Pessoa para a presidência da República nas eleições\nde março de 1930. A vitória, considerada fraudulenta, do situacionista\nJúlio Prestes, levou à deflagração em outubro de um movimento armado\nque, vitorioso, resultou na formação do Governo Provisório chefiado por\nVargas.\n\nDiplomado em 1932, Tancredo retornou a São João del Rei, onde montou um\nescritório de advocacia. No mesmo ano, foi nomeado promotor da comarca\nlocal, mas afastou-se do cargo em 1933 para voltar à banca de advogado,\npassando a atuar também em áreas próximas de seu município natal.\n\nEm janeiro de 1933, Olegário Maciel, Antônio Carlos Ribeiro de Andrada e\nVenceslau Brás fundaram em Belo Horizonte o Partido Progressista (PP),\ndestinado a organizar as correntes políticas dominantes no estado com\nvistas às eleições para a Assembléia Nacional Constituinte e a apoiar o\nGoverno Provisório. O representante de São João del Rei na comissão\nexecutiva do novo partido foi Augusto Viegas, chefe político de maior\nexpressão local e admirador do “talento sem par” de Tancredo, que também\nse filiou ao PP. Viegas indicou o nome de Tancredo para concorrer a\ndeputado estadual, mas a norma partidária exigia que as indicações desse\ntipo fossem endossadas por um determinado número de diretórios\nmunicipais. Devido à grande quantidade de candidatos na região, Tancredo\nnão conseguiu cumprir essa exigência, ficando fora da chapa do PP que\nconcorreu às eleições para a Assembléia Constituinte estadual em outubro\nde 1934. Em junho de 1935, depois da promulgação da Constituição\nmineira, foi eleito vereador em São João del Rei com a maior votação\nentre todos os concorrentes, tornando-se assim presidente do Legislativo\nmunicipal.\n\nEm agosto de 1936, a sobrevivência do PP deixou de interessar ao\ngovernador mineiro Benedito Valadares, que rompera relações com Antônio\nCarlos e pretendia criar uma agremiação capaz de atrair os dissidentes\ndo Partido Republicano Mineiro (PRM). Para testar a fidelidade das bases\ndo interior, o governador promoveu uma grande reunião em Belo Horizonte\nno dia 4 de outubro. Tancredo, então com 26 anos de idade, foi o orador\noficial da solenidade, falando em nome de todas as representações\nmunicipais presentes. Pouco depois, o PP foi extinto. Em 1937, Valadares\nfundou uma nova agremiação situacionista, o Partido Nacionalista Mineiro\n(PNM), para conduzir no estado a candidatura de José Américo de Almeida\nàs eleições presidenciais previstas para janeiro de 1938. Filiado à nova\nagremiação, Tancredo passou a liderar a campanha eleitoral em São João\ndel Rei até sua interrupção em novembro de 1937 devido à implantação do\nEstado Novo pelo presidente Vargas, que cancelou as eleições e decretou\no fechamento dos órgãos legislativos do país. Tancredo perdeu então seu\nmandato de vereador, voltando a se dedicar à advocacia. Paralelamente,\narriscou-se como empresário, tornando-se diretor-proprietário da Fiação\ne Tecelagem Matozinhos S.A., em atividade entre 1936 e 1950, e da\nTecelagem São João Ltda., que fundara no final dos anos 1930 em\nsociedade com os irmãos João e Acíbio Hallack, de vida breve.\n\n \n\nA política mineira pós-1945\n\nNo início de 1945, diante do enfraquecimento do Estado Novo e o aumento\ndas pressões pela redemocratização do país, Vargas começou a aplicar um\nprojeto de reformas políticas que incluía a reorganização dos partidos e\na convocação de eleições para a formação de uma assembléia nacional\nconstituinte e a escolha do seu sucessor na chefia do governo. Coube ao\ninterventor federal Benedito Valadares aglutinar as forças\nsituacionistas em Minas Gerais em torno de uma nova agremiação, lançada\noficialmente em 8 de abril de 1945 com o nome de Partido Social\nDemocrático (PSD). Tancredo aderiu então ao PSD, começando a participar\nda campanha do general Eurico Dutra para a presidência da República.\n\nApesar das reformas, o Estado Novo foi derrubado por um golpe militar em\n29 de outubro de 1945. As eleições foram mantidas para a data prevista,\n2 de dezembro, resultando na vitória de Dutra sobre o brigadeiro Eduardo\nGomes, candidato da União Democrática Nacional (UDN). O PSD venceu\ntambém por larga margem em Minas, elegendo 20 deputados à Assembléia\nNacional Constituinte. Com a entrada em vigor da nova Constituição em 18\nde setembro de 1946, a atenção dos meios políticos se voltou para a\nnormalização das instituições estaduais, pois a nova Carta determinava a\nrealização de eleições em 19 de janeiro de 1947 para os governos dos\nestados, as assembléias legislativas (dotadas de poderes constituintes a\nnível estadual) e a complementação das bancadas no Senado e na Câmara\ndos Deputados.\n\nO PSD mineiro não marchou unido para as eleições estaduais. A maioria da\ncomissão executiva propunha o nome de José Francisco Bias Fortes para o\ngoverno, mas um grupo liderado pelos senadores Levindo Eduardo Coelho e\nFernando Melo Viana apoiava Carlos Luz, ministro da Justiça e condutor\nda política de coalizão preconizada pelo presidente Dutra.\nPosteriormente, as duas alas conflitantes chegaram a um acordo em torno\nda indicação do ex-presidente Venceslau Brás, que seria apoiado também\npela UDN e o Partido Republicano (PR). No entanto, os adeptos de Bias\nFortes romperam o acordo e indicaram-no como candidato na convenção\npessedista realizada em Belo Horizonte no dia 13 de dezembro de 1946,\nderrotando Venceslau Brás por 167 votos de diferença. Com esse\nresultado, a ala chefiada pelo senador Melo Viana formou uma dissidência\ne decidiu, junto com o PR e o Partido Trabalhista Nacional (PTN), dar\napoio ao udenista Mílton Campos. A grande maioria do partido, que\npermaneceu ao lado de Bias Fortes, passou então a ser conhecida como PSD\nortodoxo, em contraposição ao PSD dissidente, ou independente, liderado\npor Melo Viana.\n\nTancredo Neves, prestigiado por Benedito Valadares em seu município\nnatal, permaneceu ligado ao PSD ortodoxo e foi eleito deputado estadual\ncom 5.266 votos em 19 de janeiro de 1947. Nesse mesmo dia, Mílton Campos\nderrotou Bias Fortes na disputa pelo governo estadual, tomando posse\ndois meses depois. A Constituinte mineira iniciou seus trabalhos em 20\nde março sob a presidência de Feliciano Pena, do PR, sendo Tancredo\ndesignado relator da comissão especial composta em plenário para\nelaborar o texto constitucional, promulgado em 14 de julho seguinte.\n\nNa fase final dos trabalhos constituintes, Tancredo participou\nativamente das articulações que resultaram na eleição de José Ribeiro\nPena, indicado pela coligação do PSD ortodoxo com o Partido Trabalhista\nBrasileiro (PTB), para vice-governador do estado, causando um sério\nrevés nas pretensões udenistas de lançar o nome de Mílton Campos para a\npresidência da República no pleito de 3 de outubro de 1950. A vitória de\nRibeiro Pena só foi possível com a adesão dos deputados Jason\nAlbergaria, do Partido Democrata Cristão (PDC), e Armando Ziller, do\nPartido Comunista Brasileiro, então Partido Comunista do Brasil (PCB),\npois a coligação oposicionista PSD ortodoxo-PTB contava com 35 dos 72\ndeputados constituintes.\n\nCom o início da legislatura ordinária, Tancredo Neves tornou-se\nvice-líder e, em seguida, líder da oposição. Nesse período, Mílton\nCampos estava preocupado em ampliar sua maioria na Assembléia para\nevitar surpresas semelhantes à eleição do vice-governador. Pedro Aleixo,\nsecretário do Interior, começou a exercer pressões sobre os deputados do\nPSD ortodoxo que haviam sido prefeitos durante o Estado Novo, ameaçando\ncom a abertura de inquéritos administrativos, enquanto o deputado\nfederal Luís Martins Soares, ex-chefe de Polícia no governo de Valadares\ne tio de Mílton Campos, também usava sua influência para que a\nAssembléia não criasse dificuldades ao governador. Da fusão desses dois\nfatores surgiu uma “ala liberal” do PSD mineiro, comandada por Martins\nSoares e composta por antigos prefeitos da época do Estado Novo,\nreduzindo a bancada liderada por Tancredo Neves. O compromisso dessa\nnova corrente não era propriamente fundir-se na maioria governamental,\nmas apoiar o governador nas questões relevantes para sua administração.\nCom esse desfalque, a liderança de Tancredo perdeu parte de sua força.\n\nApesar disso, o PSD saiu fortalecido das eleições municipais de 23 de\nnovembro de 1947 e passou a trabalhar para conquistar o governo do\nestado em outubro de 1950, marcando sua política pela preocupação de não\nhostilizar os dissidentes ou os liberais e explorar o descontentamento\ndo PR com o governo de Mílton Campos. Tancredo Neves não apareceu com\nevidência no curso das negociações conduzidas pela comissão executiva do\nPSD no estado visando à recomposição das alas ortodoxa, independente e\nliberal em torno da questão sucessória a fim de fortalecer a perspectiva\nde vitória do partido. Bias Fortes pleiteava nova indicação para\nconcorrer ao governo estadual, mas a candidatura de Juscelino Kubitschek\nobteve o apoio do presidente Dutra e saiu vitoriosa por 13 votos contra\ndez na comissão executiva do PSD mineiro.\n\nEm 3 de outubro de 1950, Juscelino foi eleito governador com 714.664\nvotos contra 544.068 dados ao udenista Gabriel Passos, ao mesmo tempo\nque Tancredo Neves (com 11.515 votos), Crispim Jacques, Bias Fortes,\nGuilhermino de Oliveira, Jaeder Albergaria e Uriel de Resende Alvim\nconquistaram seus primeiros mandatos de deputado federal. No mesmo\npleito, Getúlio Vargas foi eleito presidente da República.\n\nEntre 1º de fevereiro de 1951, quando tomou posse na Câmara, e 25 de\njunho de 1953, quando se licenciou para assumir a chefia do Ministério\nda Justiça, Tancredo foi membro da Comissão de Transportes, Comunicações\ne Obras Públicas e ocupou a liderança da bancada mineira do PSD na\nCâmara Federal. Nesse período, sua atividade política começou a obter\nressonância fora de Minas, fazendo com que no meio do seu primeiro\nmandato federal ele fosse escolhido para substituir o ministro Francisco\nNegrão de Lima, possuidor de grande experiência parlamentar e\ndiplomática.\n\n \n\nNo Ministério da Justiça\n\nTancredo assumiu o novo cargo por ocasião de uma reforma parcial do\nministério de Vargas, cujo governo enfrentava cerrada oposição da UDN,\nda maioria dos grandes jornais do país e de importantes setores das\nforças armadas e do empresariado. Logo no início de sua gestão, o novo\nministro se defrontou com duas questões relacionadas com a agressiva\ncampanha oposicionista em curso: a Comissão Parlamentar de Inquérito\n(CPI) instaurada para apurar as transações do vespertino carioca *Última\nHora*com o Banco do Brasil e o chamado “esquema Etelvino”, sugerido pelo\ngovernador de Pernambuco, Etelvino Lins, para encontrar uma solução\npolítico-militar de conteúdo centrista para o problema da sucessão\npresidencial.\n\nO inquérito parlamentar havia sido requerido pelo deputado baiano\nAliomar Baleeiro, da UDN, com base em denúncias formuladas pelo\njornalista Carlos Lacerda na *Tribuna da Imprensa,*segundo as quais\nSamuel Wainer fora favorecido pelo Banco do Brasil com empréstimos\nirregulares para fundar a *Última Hora*, órgão**situacionista, e\nutilizava sua influência junto ao governo para pleitear apoio financeiro\ndo grupo Matarazzo e da Confederação Nacional da Indústria, então sob a\npresidência do deputado federal Euvaldo Lodi, do PSD mineiro. O “esquema\nEtelvino” também se ligava ao mesmo esforço de desgaste do governo, pois\ndeslocava a condução do debate sucessório para o entendimento entre\npartidos de centro com o aval das forças armadas. O governador\npernambucano já possuía inclusive uma chapa “de união nacional” para\noferecer aos partidos que considerava confiáveis, formada pelo general\nJuarez Távora para a presidência e Juscelino Kubitschek para a\nvice-presidência. A UDN aceitava plenamente essa fórmula, pois a eleição\nde Juarez significaria sua presença no poder, mas o PSD preferia\ninverter a chapa, lançando Juscelino para presidente. As contradições\neram, portanto, significativas e exigiam um trabalho paciente de\nTancredo para desativar o “esquema Etelvino”.\n\nAlém dessa atuação no terreno político, o ministro cuidava também das\natribuições administrativas de sua pasta. Suas principais medidas nesse\nperíodo foram a supressão de diversos cargos considerados excedentes nos\nquadros do ministério, a desapropriação dos bens da Companhia Indústria\ne Viação de Pirapora e da Empresa Fluvial Limitada para permitir a\ncriação de uma empresa de economia mista encarregada do transporte de\ncargas e passageiros no baixo e médio São Francisco, e a ampliação e\nmodernização dos estabelecimentos que integravam a rede do Serviço de\nAssistência ao Menor (SAM).\n\nNão obstante, a crise político-militar continuava em andamento,\nresultando no progressivo enfraquecimento do governo federal junto às\nsuas bases populares. A eleição de Jânio Quadros para prefeito de São\nPaulo, representando a aliança do PDC e do Partido Socialista Brasileiro\n(PSB), e a derrota do candidato petebista Leonel Brizola à prefeitura de\nPorto Alegre mostravam o declínio da força eleitoral das correntes\npolíticas ligadas ao governo. Em fevereiro de 1954, a divulgação do\n*Manifesto dos coronéis*provocou a queda do ministro do Trabalho, João\nGoulart, acusado de incitar os sindicatos contra o empresariado, e a\nsubstituição do general Ciro do Espírito Santo Cardoso por seu colega\nEuclides Zenóbio da Costa no Ministério da Guerra. Na Câmara Federal, a\noposição comandada por Afonso Arinos de Melo Franco, Olavo Bilac Pinto e\nAliomar Baleeiro elevava o grau de agressividade contra o governo e\nprocurava a adesão dos militares para um golpe de Estado.\n\nCom a recomposição parcial do ministério e a posterior nomeação do\ngeneral Newton Estillac Leal para o comando da guarnição sediada em São\nPaulo, a crise parecia serenada. Entretanto, na madrugada de 5 de agosto\nde 1954 o jornalista Carlos Lacerda foi baleado na rua Tonelero, no\nbairro carioca de Copacabana, em um atentado que provocou a morte do\nmajor-aviador Rubens Florentina Vaz, que dava segurança ao diretor da\n*Tribuna da* *Imprensa* em suas palestras e comícios.\n\nA crise de agosto de 1954\n\nO atentado da Toneleros, como ficou conhecido, convulsionou a\nAeronáutica e os meios políticos do país, abrindo a fase final do\nconfronto entre a oposição e o governo, logo apontado como responsável\npelo crime. O brigadeiro Eduardo Gomes, que exercia forte liderança\nsobre a maioria dos oficiais de sua arma, pronunciou-se publicamente\npela punição dos culpados, enquanto Lacerda denunciava o envolvimento de\n“elementos da alta esfera governamental” no atentado.\n\nTancredo Neves soube do episódio ainda pela madrugada, informado por um\noficial da Polícia Militar do Distrito Federal. Transmitiu então ao\npresidente Vargas a gravidade da situação e emitiu em seguida um\ncomunicado aos jornais afirmando a disposição do governo de elucidar o\ncrime a qualquer custo. Sua primeira providência foi ordenar a\ninstauração de um inquérito policial chefiado pelo delegado Jorge Luís\nPastor de Oliveira, titular do distrito onde ocorrera o crime, e\nacompanhado por um representante do Ministério Público, promotor João\nBatista Cordeiro Guerra, e um do Ministério da Aeronáutica,\ncoronel-aviador João Adil de Oliveira.\n\nOs resultados das primeiras investigações não tardaram a aparecer. No\npróprio dia 5, o motorista profissional Nélson Raimundo dos Santos\napresentou-se ao delegado Pastor afirmando que, na noite anterior,\nconduzira à rua Tonelero dois membros da guarda pessoal do presidente\nVargas, Climério Euribes de Almeida e Alcino João do Nascimento. Seu\ndepoimento incriminou ambos e abriu a pista fundamental para solucionar\no crime. Ao tomar conhecimento desse fato, Tancredo procurou evitar o\nagravamento da crise político-militar em curso. Transmitiu a informação\nao general Aguinaldo Caiado de Castro, chefe do Gabinete Militar de\nVargas, e rumou para o quartel-general da Polícia Militar, na rua\nEvaristo da Veiga, onde estavam o motorista, os integrantes da comissão\nde inquérito e o chefe de Polícia do Distrito Federal, general Armando\nde Morais Âncora. Em seguida, acompanhado pelo ministro da Aeronáutica,\nNero Moura, e os membros da comissão de inquérito, dirigiu-se ao palácio\ndo Catete. Nessa ocasião, o general Cajado de Castro já havia\ninterrogado o chefe da guarda pessoal do presidente, Gregório Fortunato,\nexigindo a presença de Climério — que estava foragido — no palácio.\n\nCom o objetivo de provar a inocência do governo no atentado, Tancredo\npropôs a Vargas a dissolução da guarda, medida rapidamente posta em\nprática pelo presidente depois de ouvir as opiniões favoráveis do\ngeneral Caiado de Castro e do ministro das Relações Exteriores, Osvaldo\nAranha. Ao lado disso, o ministro da Justiça considerava necessário\nreforçar o dispositivo de defesa do governo, pois a oposição não\npretendia apenas elucidar um crime, mas também fortalecer uma\nconspiração articulada nos meios civis e militares para depor Vargas\npela força. O primeiro passo nesse sentido foi a substituição, em 10 de\nagosto, do general Âncora pelo coronel Paulo Francisco Torres na chefia\nde Polícia do Distrito Federal, ocasião em que Tancredo Neves e Euclides\nZenóbio da Costa fizeram pronunciamento em defesa da ordem e da\nlegalidade, sustentando que o mandato do presidente seria preservado de\nqualquer maneira.\n\nA firmeza das declarações dos dois ministros, principais responsáveis\npela manutenção da ordem pública, não deteve as investidas dos\nadversários do governo. No dia 11, com o apoio da grande maioria dos\noficiais da Aeronáutica, o coronel João Adil solicitou ao ministro Nero\nMoura a instauração de um inquérito policial-militar (IPM) sobre o\natentado da Toneleros, justificando esse pedido com o fato de que a arma\nutilizada era de uso privativo das forças armadas e a vítima havia sido\num militar. Além disso, o Código de Processo Penal Militar permitia a\nprisão preventiva dos suspeitos por 30 dias, prorrogáveis depois por\nmais 20, concedendo portanto muito mais tempo do que o código comum para\nos interrogatórios e a obtenção de confissões. Nero Moura cedeu à\nsolicitação e, em 12 de agosto, baixou portaria instituindo o IPM a ser\nconduzido pelo próprio coronel Adil. Daí por diante, as investigações se\ntransferiram para o âmbito da Aeronáutica e as diligências passaram a\nser dirigidas da Base Aérea do Galeão, que ficou conhecida como\nRepública do Galeão devido à independência de atuação dos encarregados\ndo IPM.\n\nNo mesmo dia 12, Vargas estava em Belo Horizonte junto com Tancredo\nNeves para participar da inauguração dos novos fornos da Siderúrgica\nMannesmann. Depois de proferir um discurso enérgico em defesa da\nlegalidade, que considerava ameaçada, retornou ao Rio, onde tomou\nconhecimento de que seu filho, o deputado federal Lutero Vargas, estava\nsob suspeita de ter financiado a fuga de ex-membros da guarda. Tancredo\naconselhou o presidente a convencer Lutero a renunciar às imunidades\nparlamentares e colocar-se à disposição do IPM para qualquer tipo de\nesclarecimento. Lutero aceitou a recomendação e anunciou em discurso\ntransmitido pelo rádio seu propósito de apresentar-se no Galeão ao\nresponsável pelo inquérito. Ao mesmo tempo, Vargas franqueou as\ndependências do palácio do Catete para as investigações militares.\n\nApesar dessas medidas, a intensidade da crise não diminuiu. Os jornais\nde oposição passaram a divulgar depoimentos dos presos do Galeão, que\nincriminavam Lutero Vargas, o deputado Euvaldo Lodi e o general Ângelo\nMendes de Morais, prefeito do Distrito Federal durante o governo do\npresidente Dutra. Em 21 de agosto, o vice-presidente João Café Filho\ndiscursou no Senado propondo a Vargas a renúncia simultânea de ambos\npara permitir a superação da crise através da posse de Nereu Ramos,\npresidente da Câmara dos Deputados, e a convocação de eleições indiretas\n30 dias depois para completar os mandatos do presidente e do\nvice-presidente.\n\nVargas convocou Tancredo para debater com ele o discurso de Café Filho.\nO ministro da Justiça afirmou então que considerava o vice-presidente\ncomprometido com a conspiração em curso e que seu pronunciamento apenas\ntransmitia uma exigência dos chefes militares sublevados. A negativa\nsubseqüente de Vargas em relação a essa proposta reacendeu a crise. Na\nnoite de 22 de agosto os brigadeiros se reuniram no Clube de Aeronáutica\nsob a presidência de Eduardo Gomes e ouviram a leitura dos depoimentos\ndos implicados no atentado da Toneleros, todos presos no Galeão.\nAprovaram em seguida uma nota dirigida a Vargas e entregue ao chefe do\nEstado-Maior das Forças Armadas, marechal João Batista Mascarenhas de\nMorais, exigindo a renúncia do presidente.\n\nAo tomar conhecimento desse documento, Tancredo propôs a prisão de todos\nos signatários e o envio de mensagem ao Congresso pedindo a decretação\ndo estado de sítio, mas sua sugestão foi rejeitada pelos três ministros\nmilitares — Zenóbio da Costa (da Guerra), Renato Guillobel (da Marinha)\ne Epaminondas dos Santos (que substituíra Nero Moura na pasta da\nAeronáutica) — sob o argumento de que ela precipitaria o desenlace da\ncrise. Nessa mesma noite, Tancredo divulgou comunicado pedindo ao povo\nque se acautelasse contra boatos espalhados pela cidade com o intuito de\ncausar a “perturbação da ordem pública” e acrescentando que o governo\ndispunha de meios para controlar a situação. Não obstante, correu o\nboato de que o governo estaria preparando a decretação do estado de\nsítio e a conseqüente suspensão das garantias constitucionais.\n\nNo dia seguinte, 23 de agosto, o general Zenóbio da Costa declarou que o\nExército não permitiria agitações, ficando implícito que sua advertência\nse dirigia às manifestações de rua encabeçadas pela UDN e outros grupos\npolíticos para exigir a renúncia de Vargas. À noite, os almirantes se\nreuniram no Clube Naval e endossaram o manifesto dos brigadeiros.\nAvisado da posição da Marinha, Tancredo se dirigiu ao palácio do Catete,\nonde encontrou os ministros Epaminondas dos Santos, Renato Guillobel e\nOsvaldo Aranha. Zenóbio da Costa chegou a seguir, acompanhado do\nmarechal Mascarenhas de Morais e do general Odílio Denis (comandante da\nZona Militar Leste, atual I Exército), e comunicou que 37 dos 80\ngenerais lotados no Distrito Federal estavam declaradamente solidários\ncom os brigadeiros e almirantes.\n\nDiante dessa notícia, Vargas convocou uma reunião ministerial de\nurgência. Tancredo defendia até então que o Congresso e os governadores\nfossem ouvidos, mas a nova e inesperada situação militar levou-o a\npropor, junto com Osvaldo Aranha, a alternativa da resistência a\nqualquer ataque ao palácio do Catete. Nesse ponto, as discussões se\ngeneralizaram com a participação de Alzira Vargas do Amaral Peixoto,\nfilha do presidente, Danton Coelho, ex-ministro do Trabalho, e outras\npessoas presentes no salão em que o ministério se reunia. Vargas\nreiterou seu propósito de não renunciar, concordando entretanto em\nlicenciar-se até a completa apuração dos fatos relacionados com o\natentado e pedindo aos ministros militares que garantissem a manutenção\nda ordem pública e o respeito à Constituição. Por volta das cinco horas\nda manhã de 24 de agosto, Tancredo redigiu uma nota comunicando a\ndecisão presidencial, enquanto Café Filho organizava seu ministério\njunto com líderes oposicionistas civis e militares. Pouco depois, chegou\nao palácio do Catete a notícia de que um grupo de generais reunido com\nZenóbio da Costa na sede do Ministério da Guerra recomendara o\nafastamento definitivo do presidente, e não apenas temporário, como\nafirmava a nota redigida por Tancredo. Portanto, Getúlio Vargas estava\nvirtualmente deposto. No início da manhã, seu irmão Benjamim Vargas\nchegou ao palácio do Catete comunicando que fora intimado a depor no\nGaleão.\n\nNesse contexto, o presidente, recolhido em seus aposentos, suicidou-se.\nTancredo não retornou mais ao Ministério da Justiça, entregando a pasta\na um oficial-de-gabinete. Junto com Osvaldo Aranha e João Goulart,\nacompanhou o corpo de Vargas até São Borja (RS), onde presenciou o\nsepultamento e pronunciou violento discurso contra o novo governo\nchefiado por Café Filho.\n\nNa assessoria de Juscelino\n\nTancredo Neves reassumiu em 30 de agosto sua cadeira na Câmara dos\nDeputados, dedicando-se à articulação da candidatura do governador\nmineiro Juscelino Kubitschek à presidência da República como forma de se\ncontrapor às forças políticas que haviam desestabilizado o governo\nanterior. Como não se desincompatibilizara a tempo, não pôde concorrer\nàs eleições de outubro de 1954, deixando a Câmara ao final de seu\nmandato, em janeiro de 1955. Em fevereiro, a convenção nacional do PSD\nhomologou a candidatura de Juscelino, que passou a chefia do governo\nestadual em 3 de abril seguinte para seu substituto legal, Clóvis\nSalgado, do Partido Republicano (PR). No fim desse mês, o novo\ngovernador nomeou Tancredo diretor do Banco de Crédito Real de Minas\nGerais. Juscelino venceu o pleito presidencial realizado em outubro,\nconquistando a maioria absoluta de votos em seu estado, mas apenas 36%\ndos votos nacionais.\n\nEsse resultado abriu um período de crises sucessivas que culminaram no\nmovimento militar de 11 de novembro de 1955, chefiado pelo general\nHenrique Lott e voltado, segundo seus promotores, para barrar uma\nconspiração em curso no governo Café Filho e garantir a posse de\nJuscelino, que veio a ocorrer em 31 de janeiro de 1956. Sem cargo\nparlamentar, Tancredo Neves tornou-se um conselheiro político solicitado\npelo novo presidente nos momentos de decisões relevantes. Em 17 de\nmarço, ainda na condição de diretor do Banco de Crédito Real de Minas\nGerais, participou de uma reunião convocada por Juscelino para debater a\nconveniência da adoção da reforma cambial que havia sido sugerida pelo\nministro da Fazenda do governo de Café Filho, José Maria Whitaker. Ela\nimplicava a supressão dos subsídios governamentais a vários produtos\nimportados, como o petróleo, o trigo e o papel, que teriam seus preços\nsensivelmente alimentados porque os recursos aplicados até então pelo\ngoverno seriam inevitavelmente repassados ao consumidor. Tancredo e\noutros auxiliares do presidente foram contra a adoção dessa medida, e\nseu ponto de vista prevaleceu na decisão oficial.\n\nEm 26 de abril de 1956 Tancredo deixou seu cargo no Banco de Crédito\nReal de Minas Gerais para assumir a direção da Carteira de Redescontos\ndo Banco do Brasil, que seria, mais tarde, um dos principais pontos de\napoio para a formação do Banco Central.\n\nEm novembro de 1956 a agitação militar voltou a intranqüilizar o\ngoverno. De um lado, a Frente de Novembro, fundada pelo coronel Nemo\nCanabarro Lucas e defendida na Câmara Federal pelo deputado Humberto\nMolinaro, vinha promovendo intenso trabalho de proselitismo nos quartéis\na pretexto de reforçar a posição do general Lott no Ministério da\nGuerra. Do lado oposto, o Clube da Lanterna, criado em 1953 pelos\nadeptos de Carlos Lacerda e presidido pelo jornalista Fidélis Amaral\nNeto, diretor da revista *Maquis*,**centralizava a violência dos seus\nataques nos chefes militares que haviam desencadeado o movimento de 11\nde novembro de 1955 para garantir a posse de Juscelino. Os generais mais\natingidos eram Lott e Odílio Denis, comandante do recém-criado I\nExército. Esses conflitos entre os dois lados estavam criando\nintranqüilidade nos quartéis e ameaçavam afetar a estabilidade do\nregime. Juscelino reuniu então os ministros Nereu Ramos (da Justiça),\nJosé Maria Alkmin (da Fazenda) e Lúcio Meira (da Viação), além de\nFelisberto Batista Teixeira (chefe de Polícia do Distrito Federal) e\nTancredo Neves, para debater o assunto em todas as suas implicações. Ao\nfinal, decidiu-se adotar a proposta de Tancredo, decretando o imediato\nfechamento das duas organizações.\n\nTancredo deixou a diretoria do Banco do Brasil em julho de 1958 para\nassumir, no dia 17 desse mês, a Secretaria de Finanças do governo de\nMinas Gerais na gestão de Bias Fortes. Essa indicação, que provocou seu\nafastamento da disputa direta das eleições legislativas de 1958, visava\nreaproximar Bias Fortes de Juscelino, uma vez que as relações entre\nambos estavam estremecidas em virtude de o governo federal não ter\natendido a uma série de reivindicações de Minas Gerais. Além disso,\nTancredo era o candidato natural do PSD à sucessão de Bias Fortes e seu\ningresso no secretariado mineiro permitiria uma atuação mais próxima de\nsuas bases eleitorais.\n\nAs eleições de 1958 não foram favoráveis ao PSD. Em Minas, onde o\nmandato era de cinco anos, não houve eleições para governador, mas o\npartido situacionista perdeu prefeituras importantes, especialmente na\nZona da Mata, além de uma vaga no Senado, conquistada pelo udenista\nMílton Campos. Esse resultado agravou o descontentamento dos principais\nlíderes pessedistas mineiros com Juscelino, considerado omisso na\ncampanha eleitoral e devedor de maior dedicação aos interesses do PSD.\nDiante dessas divergências, Tancredo viajou para o Rio para tentar\nrestabelecer a unidade partidária, reforçando ao mesmo tempo sua\nsolidariedade ao presidente da República e ao governo.\n\nA candidatura ao governo mineiro\n\nEm julho de 1960, Tancredo deixou a Secretaria de Finanças para\ncandidatar-se ao governo do estado, enfrentando uma série de\ndificuldades para consolidar sua campanha. O deputado estadual José\nRibeiro Pena também pleiteava a indicação do PSD para esse cargo e,\nderrotado na convenção estadual, liderou uma dissidência com o apoio dos\ndeputados federais José Maria Alkmin e Paulo Pinheiro Chagas. Os\ndissidentes registraram a chapa Ribeiro Pena-Alkmin na legenda do PDC e,\ncom o apoio dos partidos Social Progressista (PSP) e Social Trabalhista\n(PST), iniciaram a campanha. Assim, a chapa Tancredo Neves-Clóvis\nSalgado (republicano de Leopoldina e ministro da Educação do governo de\nJuscelino) não conservou a unidade pessedista, apesar de apoiada pelo\nPTB e o PR.\n\nMinas Gerais passava nessa época por uma fase de grandes dificuldades\nfinanceiras. Para enfrentar essa situação, Tancredo criara em sua gestão\nna Secretaria de Finanças uma frota de veículos que percorria as\nprincipais regiões produtoras do estado para efetuar a cobrança de\ncontribuintes faltosos, multando os atrasados e punindo os infratores.\nDurante a campanha eleitoral, as caravanas eleitorais do candidato\nudenista José de Magalhães Pinto passavam depois dos cobradores da\nReceita Estadual e, em cada discurso, Magalhães intercalava a frase de\nefeito que ficou famosa: “Em vez dos jipes de fiscalização eu vos\nenviarei os caminhões da produção.”\n\nOutra dificuldade da campanha de Tancredo foi a escolha dos candidatos a\nvice-governador. O PTB, em permanente desavença com o PR, lançou o nome\ndo deputado federal Francisco Clementino de San Tiago Dantas, mas Nélson\nThibau, também petebista, candidatou-se ao mesmo cargo pelo Partido\nRural Trabalhista (PRT), partido integrante da coligação que apoiava\nMagalhães Pinto. Este não apresentou nenhum nome udenista para a\nvice-governança, preferindo beneficiar-se das divisões existentes no\ncampo da aliança PSD-PTB.\n\nA campanha eleitoral foi polarizada também pela divisão, em nível\nnacional, entre as candidaturas do general Lott, apoiado pela maior\nparte da coligação PSD-PTB, e de Jânio Quadros, candidato da UDN. A\ndisputa se desenvolveu em meio a grande tensão e agressividade dos dois\nlados, controladas várias vezes pela imparcialidade de Juscelino,\nasperamente censurada pelos partidários de Lott. O petebista João\nGoulart, candidato à reeleição para a vice-presidência, também adotou\numa posição moderada por não desejar chocar-se diretamente com Jânio\nQuadros. Com isso, os governadores do PSD e do PTB, assim como seus\ncandidatos às sucessões, mantiveram muitas vezes atitudes evasivas em\nrelação à candidatura do ex-ministro da Guerra. Tancredo Neves foi uma\nexceção, situando-se durante a campanha francamente a favor de Lott.\nRealizado o pleito em 3 de outubro de 1960, os resultados em Minas\nfavoreceram a UDN. Jânio obteve 692.044 votos contra 679.951 dados a\nLott; para a vice-presidência, Mílton Campos alcançou 667.573 votos e\nseu principal competidor, João Goulart, ficou com 660.337. Para o\ngoverno estadual, a diferença foi maior: 760.427 votos para Magalhães\nPinto e 680.538 para Tancredo Neves. Entretanto, a aliança PSD-PR\nconseguiu eleger Clóvis Salgado vice-governador com 580.830 votos contra\n304.395 dados a San Tiago Dantas, segundo colocado.\n\nAntes de concluir seu mandato, Juscelino pretendeu assegurar posições em\nvárias empresas públicas federais. Em 19 de novembro de 1960, nomeou\nTancredo para a presidência do Banco Nacional de Desenvolvimento\nEconômico (BNDE). Jânio Quadros reagiu à pretensão de Kubitschek, dando\na entender em entrevista que não aceitaria em sua administração\ninterferências de pessoas que não detivessem sua inteira confiança.\nDepois da posse do novo governo federal, em 31 de janeiro de 1961, o\nnome de Tancredo foi cogitado para chefiar a embaixada brasileira na\nBolívia, mas as incompatibilidades crescentes entre o presidente e o PSD\ninterromperam as negociações. Contudo, permaneceu à frente do BNDE até\nmarço daquele ano.\n\nAtuação como primeiro-ministro\n\nA ação política de Tancredo em nível nacional voltou a ganhar destaque\ndurante a crise político-militar resultante da renúncia de Jânio Quadros\nà presidência da República em 25 de agosto de 1961. Seu substituto\nlegal, o vice-presidente João Goulart, encontrava-se em visita oficial à\nChina, fazendo com que a sessão conjunta do Congresso Nacional\nempossasse interinamente na chefia do governo o deputado Pascoal Ranieri\nMazzilli, presidente da Câmara. Goulart iniciou então sua viagem de\nvolta ao Brasil, mas os três ministros militares — general Odílio Denis,\nalmirante Sílvio Heck e brigadeiro Gabriel Grün Moss — decidiram vetar\nsua posse, alegando que o vice-presidente tinha ligações com os\ncomunistas e desenvolvia atividades subversivas junto ao movimento\nsindical.\n\nAvisado por Denis sobre o veto militar à sucessão prevista na\nConstituição, Ranieri Mazzilli resolveu levar o assunto ao conhecimento\ndas principais lideranças políticas do país. Reuniu-se então com Ernâni\nAmaral Peixoto (presidente nacional do PSD), Ulisses Guimarães, Nélson\nCarneiro, José Maria Alkmin, José Martins Rodrigues e Tancredo Neves.\nDepois de várias horas de debates, Mazzilli pediu a presença dos\nministros militares, que, através de Denis, reiteraram sua decisão\nanterior e se retiraram enquanto os políticos prosseguiam buscando uma\nfórmula para evitar a quebra da ordem constitucional.\n\nCom a aproximação de Goulart — que vinha fazendo escalas sucessivas em\nvários aeroportos em direção a Montevidéu — e a adesão das tropas do III\nExército ao movimento pela legalidade liderado pelo governador gaúcho\nLeonel Brizola, a crise se agravou. Contingentes do II Exército, sediado\nem São Paulo, chegaram a deslocar-se para o Sul com o objetivo de\nbloquear um possível avanço das tropas legalistas.\n\nDepois de mais de uma semana de incertezas, todos os setores diretamente\nenvolvidos na crise verificaram que a solução do impasse teria de ser de\nnatureza política e não militar. Com o desenvolvimento das negociações,\nfoi apresentada a proposta de uma emenda constitucional que convertia o\nregime presidencialista em parlamentarista, reduzindo bastante os\npoderes do presidente da República. Esta fórmula foi considerada\nsatisfatória pelos ministros militares. Em seguida, Tancredo Neves\nviajou para Montevidéu a fim de obter a concordância de Goulart,\nretornando a Brasília no dia 1º de setembro com a missão cumprida. A\nemenda foi aprovada pelo Congresso no dia 2, abrindo o caminho para a\nvolta de Goulart, que assumiu a presidência em 7 de setembro.\n\nNo dia seguinte, o novo presidente enviou mensagem ao Congresso,\naprovada imediatamente por 259 contra 22 votos, indicando Tancredo Neves\npara primeiro-ministro. O primeiro gabinete parlamentarista, buscando\nconstruir uma base política ampla, capaz de reconstruir o diálogo entre\nos principais partidos do país, era composto por Antônio de Oliveira\nBrito (Educação), Armando Monteiro Filho (Agricultura) e Ulisses\nGuimarães (Indústria e Comércio), do PSD; Francisco Clementino de San\nTiago Dantas (Relações Exteriores) e Estácio Souto Maior (Saúde), do\nPTB; Virgílio Távora (Viação e Obras Públicas) e Gabriel Passos (Minas e\nEnergia), da UDN; André Franco Montoro (Trabalho e Previdência Social),\ndo PDC; Válter Moreira Sales (Fazenda), sem partido; general João de\nSegadas Viana (Guerra), almirante Ângelo Nolasco (Marinha) e brigadeiro\nClóvis Travassos (Aeronáutica). De 8 de setembro a 13 de outubro,\nTancredo ocupou interinamente a pasta da Justiça, aguardando que o\nPartido Social Progressista (PSP), presidido pelo ex-governador paulista\nAdemar de Barros, indicasse um nome para concretizar seu apoio ao\ngabinete. Ademar sugeriu o deputado goiano Alfredo Nasser, que tomou\nposse em seguida.\n\nO programa do gabinete, submetido à Câmara em 28 de setembro e aprovado\nno mesmo dia, foi relativamente genérico na formulação dos seus temas.\nSua apresentação teve mais a finalidade de cumprir uma formalidade\nindissociável da natureza do novo regime do que propriamente de\ndeterminar uma política de governo. Defendia a prática de reajustes\nsalariais periódicos compatíveis com os índices de expansão\ninflacionária, acolhia a tese da “política externa independente”,\nelogiava a Operação Pan-Americana e a pastoral pontifícia*Mater et\nmagistra*e**reiterava o apoio ao recurso da mediação como forma de\nsolução de conflitos internacionais. Apontava a reforma agrária “como\npasso inicial e precípuo para a integração do homem do campo em nossa\nvida econômica” e proclamava sua identificação com uma política de\nportas abertas ao capital estrangeiro, frisando: “O Brasil reclama\ncapitais alienígenas para consolidar e ampliar sua estrutura econômica.”\nO novo governo defendia ainda a existência de uma lei de controle de\nremessa de lucros, desde que não desencorajasse os investimentos\nestrangeiros considerados indispensáveis ao custeio do desenvolvimento\neconômico nacional.\n\nSurgido em meio a uma grave crise político-militar, o primeiro gabinete\nparlamentarista conseguiu diminuir as rivalidades entre as principais\ncorrentes políticas do país. Entretanto, a insatisfação social crescia,\ncom a multiplicação de protestos contra a inflação e por maiores\nreajustes salariais. A crise decorrente da renúncia de Jânio Quadros\nhavia paralisado o país durante 13 dias, contribuindo para o agravamento\nda crise econômica, e os repetidos impasses nas negociações trabalhistas\nlevaram à deflagração de sucessivas greves. Várias unidades de produção\nda Petrobras estiveram paradas nessa época durante 40 dias, enquanto o\nministro Gabriel Passos enfrentava dificuldades dentro do próprio\ngoverno para promover a substituição do presidente e de um diretor dessa\nempresa.\n\nSegundo Tancredo, o gabinete parlamentarista considerou a reforma\nagrária “item de prioridade absoluta na agenda do governo” e orientou o\nministro da Agricultura para criar uma comissão encarregada de levantar\ne apreciar os estudos e propostas existentes sobre o tema. Em janeiro de\n1962, o governo recebeu um projeto de autoria do senador mineiro Mílton\nCampos, da UDN, e no mês seguinte o Ministério da Agricultura apresentou\ntambém o seu. No dia 15 de fevereiro, o governo criou o Conselho\nNacional de Reforma Agrária, composto por dom Hélder Câmara\n(bispo-auxiliar do Rio de Janeiro), Pompeu Acióli Borges, Paulo\nSchilling e Edgar Teixeira Leite, encarregado de fixar as áreas\nprioritárias para efeito de reforma agrária. Enquanto isso, a tensão\nsocial crescia no campo, especialmente na região Nordeste. Em abril, o\nassassinato do presidente da Liga Camponesa de Sapé (PB), João Pedro\nTeixeira, provocou manifestações de protesto logo proibidas pelo\ncomandante do IV Exército, general Artur da Costa e Silva. Tancredo\nNeves atribuiu a movimentação camponesa à existência de “uma estrutura\nrural arcaica” e tomou a iniciativa de propor medidas políticas para\nenfrentar o problema, especialmente o Plano de Sindicalização Rural,\naprovado em seguida pelo conselho de ministros, abrangendo\npotencialmente um contingente de 16 milhões de trabalhadores agrícolas,\ninclusive analfabetos.\n\nNesse período, ao lado do aprofundamento da crise econômica, crescia a\nradicalização da luta política entre as correntes defensoras das\nchamadas reformas de base (constitucional, agrária, urbana, bancária e\ntributária) e as forças conservadoras que se opunham a elas e acusavam o\ngoverno de patrocinar a agitação social. No dia 1º de maio de 1962,\nGoulart pronunciou um discurso em Volta Redonda (RJ) defendendo o\ncaráter inadiável das reformas e pregando o retorno ao regime\npresidencialista para garantir a ação de um poder executivo forte e mais\nestável. Cresceu então a desconfiança dos setores conservadores em\nrelação às intenções do governo. Nesse contexto, o gabinete de Tancredo\nNeves — que se caracterizava por uma política de compromisso para obter\num amplo consenso nacional — começou a perder sua razão de existir. No\ndia 6 de junho seguinte, o gabinete se demitiu em bloco, inclusive o\nprimeiro-ministro, e seus membros ficaram em condições de concorrer às\neleições parlamentares de outubro seguinte. Na sua prestação de contas\nao Congresso, Tancredo salientou que a previsão do déficit orçamentário\ngirava em torno de duzentos bilhões de cruzeiros, mas o aumento previsto\ndos vencimentos do funcionalismo público federal elevaria esse montante\na 330 bilhões.\n\nNas eleições de outubro de 1962, Tancredo foi o segundo mais votado da\nbancada mineira do PSD, com 58.090 votos. Em 6 de janeiro de 1963, antes\ndo início da nova legislatura, o regime presidencialista foi\nreinstaurado através de um plebiscito convocado pelo Congresso,\ndevolvendo a João Goulart os poderes definidos na Constituição de 1946.\n\nA volta ao Congresso e a atuação no MDB\n\nDepois de oito anos de afastamento do Legislativo, Tancredo retornou à\nCâmara Federal em 1º de fevereiro de 1963, sendo escolhido líder da\nmaioria formada pelo PSD e o PTB. O período seguinte foi marcado por\ngrandes convulsões políticas e sociais, tornando-se crescente a\ninfluência do movimento sindical em decisões administrativas do governo,\ncomo a nomeação de presidentes e diretores de empresas públicas. A\noposição usou alguns exemplos dessa influência para denunciar as\nsupostas intenções de Goulart de violar a ordem constitucional e\ninstituir uma “república sindicalista” no país. Com isso, setores do\nempresariado, círculos políticos liberais e algumas importantes chefias\nmilitares começaram a se articular para depor pela força o governo\nfederal.\n\nTancredo procurava, nos limites de sua formação pessedista, suavizar os\nimpactos causados pelo envolvimento de Goulart com o movimento sindical.\nEm 30 de março de 1964, quando o clima de confronto atingiu o ápice,\ntentou evitar que o presidente comparecesse a um ato público promovido\npelos sargentos no Automóvel Clube, no Rio, argumentando que sua\npresença iria inflamar a animosidade militar contra o governo. Não\nobteve êxito, mas suas ponderações revelaram-se fundadas. No dia\nseguinte foi deflagrado o movimento político-militar que depôs Goulart e\nlevou o general Humberto Castelo Branco ao poder. Tancredo afastou-se\nentão da liderança parlamentar, mas continuou exercendo o mandato.\n\nO novo regime inaugurou em 9 de abril de 1964, através do Ato\nInstitucional nº 1 (AI-1), punições extralegais aos seus adversários,\ncomo a suspensão de direitos políticos e a cassação de mandatos\nparlamentares. Ameaçado de ser incluído em várias listas de punições,\nTancredo se manteve em posição de reserva, embora sem se distanciar dos\nacontecimentos políticos. Como membro do PSD, apoiou em 1965 a\ncandidatura vitoriosa de Israel Pinheiro à sucessão de Magalhães Pinto\nno governo de Minas Gerais. No entanto, após a dissolução dos partidos\ndecretada pelo AI-2 em 27 de outubro desse ano, Tancredo não acompanhou\na quase totalidade de seus correligionários mineiros, que ingressaram no\nbloco parlamentar da maioria e, nessa condição, ajudaram a fundar em\nseguida a Aliança Renovadora Nacional (Arena), novo partido\nsituacionista. Ingressando no bloco parlamentar da oposição, o\nex-primeiro-ministro filiou-se depois****ao Movimento Democrático\nBrasileiro (MDB).\n\nNas eleições de 15 de novembro de 1966, já concorrendo na nova legenda,\nfoi reeleito deputado federal com 55.209 votos, a segunda maior votação\nda bancada oposicionista mineira. Apesar de indicado para presidente do\ndiretório do MDB em Minas e para líder da minoria na Câmara Federal,\nTancredo não aceitou nenhuma posição de relevo nessa legislatura. Em\n1968 representou a Câmara na XXIII Assembléia Geral da Organização das\nNações Unidas (ONU), realizada em Nova Iorque.\n\nEm 15 de novembro de 1970 renovou seu mandato com a maior votação do MDB\nem seu estado: 57.094 votos. No ano seguinte foi designado presidente da\ncomissão executiva estadual do seu partido e da Comissão de Economia da\nCâmara dos Deputados. Adversário da política econômica em vigor, numa\népoca em que a censura à imprensa impedia a divulgação dos discursos de\nparlamentares da oposição, Tancredo adotou como norma convidar ministros\nda área para prestar depoimentos à comissão sobre as principais medidas\ngovernamentais. Na maioria das vezes os ministros não compareciam,\nenviando assessores para cumprir essa função.\n\nNesta legislatura, Tancredo participou como conselheiro das delegações\nbrasileiras às conferências interparlamentares de Caracas (1971), Paris\n(1971), Abidjan (1973), Genebra (1973) e Bucareste (1974).\n\nEm fins de 1973, juntamente com o secretário-geral do MDB, Tales\nRamalho, velho companheiro do PDS, lançou a “anticandidatura” do\ndeputado Ulisses Guimarães à sucessão do presidente Emílio Garrastazzu\nMédici no pleito indireto de 15 de janeiro de 1974. Embora sem ilusão de\nvitória no Colégio Eleitoral, onde Ulisses disputaria com o general\nErnesto Geisel, candidato do partido do governo, a campanha emedebista,\nsob o lema “Navegar é preciso”, procurou levar ao país uma mensagem de\nresistência e, segundo muitos analistas, teria sido****a mola-mestra da\nvitória eleitoral alcançada pelo MDB em novembro, quando o partido\nconquistou 16 das 22 cadeiras em jogo no Senado.\n\nNestas eleições, não obstante o****convite para candidatar-se ao Senado\npor Minas na legenda emedebista, Tancredo preferiu concorrer novamente à\nCâmara Federal, sendo reeleito com 71.950 votos, a terceira maior\nvotação da representação mineira do seu partido. Eleito em 21 de\nsetembro de 1975 terceiro-vice-presidente nacional do MDB, desempenhou\npapel conciliador em meio aos conflitos entre as correntes “autêntica” e\n“moderada” que lutavam pela hegemonia na agremiação.\n\nEm 22 de dezembro de 1976, pronunciou violento discurso a propósito da\ndivulgação da correspondência mantida entre o Departamento de Estado do\ngoverno norte-americano e sua embaixada no Brasil durante o governo de\nLyndon Johnson. Depositados na cidade de Austin, no Texas, esses\ndocumentos incluíam as mensagens trocadas durante a crise que precedeu a\nqueda de Goulart e traçavam o perfil de vários políticos brasileiros\nsegundo seu grau de devotamento ou antagonismo às posições\ninternacionais dos Estados Unidos. Entre outras informações, foi\nrevelado que a esquadra norte-americana baseada no canal do Panamá havia\nsido colocada em estado de alerta em seguida à deflagração do movimento\npolítico-militar de 31 de março de 1964 para assegurar o abastecimento\nde combustível aos revoltosos na hipótese de luta prolongada pelo poder,\no que não se verificou. Tancredo protestou de forma veemente contra a\ninterferência do serviço secreto do governo norte-americano (a Central\nIntelligence Agency, CIA) na vida política brasileira e qualificou de\nirresponsável a insinuação contra sua honestidade contida em um dos\ndocumentos revelados.\n\nNesta legislatura, foi conselheiro das delegações brasileiras às\nconferências interparlamentares de Bogotá (1975), Londres (1975), Madri\n(1976) e Sófia (1977). Apesar de sua postura nitidamente oposicionista,\nTancredo condenava os setores do MDB que se negavam a dialogar com o\ngoverno em questões consideradas básicas, afirmando-se como liderança da\nala moderada do partido e como****interlocutor do regime na discussão do\nprojeto de distensão “lenta, gradual e segura” do presidente Geisel. Em\njulho de 1977, declarou-se a favor da convocação de uma assembléia\nnacional constituinte e, em março do ano seguinte, foi eleito líder da\nbancada emedebista na Câmara, derrotando o deputado paulista José\nFreitas Nobre, representante dos “autênticos”, pela diferença de dois\nvotos. Em seu primeiro discurso como líder, criticou duramente a\nestreiteza de visão política dos governantes, que resistiam às pressões\nda nação pela volta do estado de direito.\n\nEm 30 de julho de 1978, a convenção estadual do MDB mineiro, reunida em\nBelo Horizonte, lançou a candidatura de Tancredo Neves ao Senado. No\ncurso da campanha eleitoral, o candidato defendeu a adoção de eleições\ndiretas em todos os níveis como fundamento para a pacificação nacional e\nressaltou a necessidade de uma anistia ampla, geral e irrestrita para os\nperseguidos políticos desde 1964. Defendeu a iniciativa privada como\nfundamento da atividade econômica nacional, embora considerasse\nimprescindível o controle do Estado sobre os setores vinculados à\nsegurança nacional, e declarou aceitar a implantação de multinacionais\nno Brasil, desde que elas não adotassem políticas de esmagamento das\nempresas nacionais.\n\nEm 15 de novembro de 1978 elegeu-se senador por Minas Gerais com\n1.267.500 votos, derrotando os candidatos arenistas Israel Pinheiro\nFilho, outro pessedista histórico, e o ex-udenista Fernando Fagundes\nNeto. Em fevereiro de 1979 assumiu sua cadeira no Senado, onde\nintegraria as comissões de Finanças e de Relações Exteriores. Como\nsenador, Tancredo reforçou sua autoridade como interlocutor no projeto\nde transição pacífica, “sem revanchismos e sem radicalismos”, para a\ndemocracia articulado pelo senador Petrônio Portela, ministro da Justiça\nde Geisel e intérprete,****junto aos parlamentares, do projeto de\nreforma política do governo. Neste debate, manifestou-se contrário à\nadoção do voto distrital, por acreditar que este sistema enseja maior\ninfluência do poder econômico.\n\nApesar de sua lealdade ao MDB, Tancredo sempre esteve convencido da\nartificialidade do sistema bipartidário autoritariamente imposto ao\nBrasil pelo AI-2, que segundo ele ignorava uma divisão real das forças\npolíticas nacionais. Por um lado, condenava a invasão do partido, após a\nanistia de 1979, por oposicionistas dos mais variados matizes, inflando\npara a esquerda a ampla frente construída em torno do MDB. “O meu MDB\nnão é o MDB do ex-governador Miguel Arrais”, teria afirmado na época.\nPor outro lado, julgava que as antigas bases do PSD poderiam dar origem\na um novo partido que não fosse mera repetição do modelo da antiga\nagremiação.\n\nCom a extinção do bipartidarismo em novembro de 1979, aproximou-se do\ndeputado Magalhães Pinto, seu antigo adversário na política mineira,\nvisando à formação de um partido de centro, liberal, tendo Minas Gerais\ncomo base,**com o papel de equilibrar a balança na passagem do poder aos\ncivis e de fornecer o candidato à sucessão do presidente Figueiredo.**A\ndecisão de Tancredo de não integrar o partido sucedâneo de MDB foi\nconsolidada depois do veto dos não-alinhados e autênticos do MDB ao\ningressso no novo partido do governador do Rio de Janeiro, Chagas\nFreitas, e do ex-governador do Rio Grande do Norte, Aluísio Alves e seus\ncorreligionários.\n\nAinda em fins de novembro foi selada a aliança entre os dois grupos\nmineiros — os moderados do ex-MDB, representados por Tancredo, e os\ndissidentes da antiga Arena, liderados por Magalhães Pinto — para a\nformação do “partido independente”, que de início foi chamado de Partido\nDemocrático Brasileiro (PDB) e em dezembro firmou-se com a denominação\nde Partido Popular (PP). Na opinião de Tancredo, “teria de ser um PSD de\ncentro-esquerda, um partido sintonizado com as realidades sociais, com\nconotação social-democrata mais acentuada, em busca da justiça social,\nsem radicalismo e sem compromissos ideológicos”. Para ele, o que\ncaracterizaria o radical é que ele “se desinteressa do governo e critica\no regime, a ordem social [...] Faço uma política de oposição que visa o\ngoverno”.\n\nEm 20 de dezembro foi divulgado oficialmente o manifesto de lançamento\ndo PP, onde eram definidos os seguintes pontos programáticos básicos:\nvoto livre, geral e direto para todos os cargos eletivos, abrangendo o\nDistrito Federal; reforma constitucional que restaure as prerrogativas\ndo Congresso na iniciativa das leis, elimine todos os resíduos do\narbítrio, afirme em toda a sua plenitude a soberania nacional e proíba\nas sublegendas; restabelecimento efetivo do sistema federativo de\ngoverno e conseqüente correção dos desequilíbrios setoriais e regionais;\nplena liberdade de imprensa e de expressão; competência exclusiva da\nJustiça sobre excessos cometidos e supressão do controle governamental\ndas fontes de informação; revisão da Lei de Segurança Nacional (LSN) e\nrecomposição do Conselho de Segurança a Nacional, visando a\ncompatibilizá-lo com o Estado democrático; julgamento por tribunais\ncivis de todos os crimes não militares. Ao novo partido alinhavam-se,\nalém do grupo mineiro, o governador do Rio de Janeiro, Chagas Freitas,\nos ex-governadores Jaime Canet (PR), Paulo Egídio Martins (SP), Aluísio\nAlves (RN) e Roberto Santos (BA), o ex-prefeito de São Paulo e\nex-arenista Olavo Setúbal, os deputados Tales Ramalho (PE) e Miro\nTeixeira (RJ), do antigo MDB, dentre muitos outros. Os deputados\n“autênticos” e os “não-alinhados” do ex-MDB uniram-se no Partido do\nMovimento Democrático Brasileiro (PMDB), liderado por Ulisses Guimarães.\n\nPor contar em seus quadros com Magalhães Pinto, Olavo Setúbal e Herbert\nLevy, o PP foi denominado depreciativamente pela imprensa de “partido\ndos banqueiros”. Foi chamado também de “Partido do Petrônio”, por\nsupostamente seguir os termos de um acordo tácito firmado entre\nTancredo, o deputado Tales Ramalho e o ministro Petrônio Portela, grande\nincentivador da criação de um partido de centro, e como tal visto não\ncomo um partido de oposição, mas como uma agremiação auxiliar do PDS.\n\nO PP realizou sua sessão inaugural no palácio do Congresso, em Brasília,\nno dia 10 de janeiro de 1980, sob a presidência conjunta de Tancredo\nNeves e Magalhães Pinto. Foi formada, na ocasião, uma comissão\norganizadora provisória e aprovado um programa mínimo defendendo a\nconvocação de uma assembléia constituinte, eleições diretas, revisão da\nLSN e proteção aos pequenos e médios proprietários rurais. Em 15 de\nmarço de 1981****os deputados do PP apoiaram a candidatura de Djalma\nMarinho, dissidente do Partido Democrático Social (PDS), à presidência\nda Câmara Federal, em oposição ao candidato oficial do partido\nsituacionista, Nélson Marchezan, finalmente eleito.\n\nEm 7 de junho, em convenção nacional realizada em Brasília, Tancredo foi\neleito presidente do PP, cabendo a Magalhães Pinto a presidência de\nhonra da agremiação. Na ocasião, o senador mineiro afirmou que a nação\nestava amordaçada por uma pequena minoria que usurpou o poder pela força\ne dele não queria sair senão pela força.**A partir daí, todas as suas\nmanifestações públicas foram ardentemente oposicionistas.\n\nEm julho de 1981 Tancredo foi lançado em Montes Claros (MG) como\ncandidato ao governo de Minas Gerais pelo PP e em outubro tiveram início\nas negociações com o senador Itamar Franco, do PMDB, visando uma\npossível aliança estadual para enfrentar o PDS. Em novembro, reuniu-se\ncom o ministro da Justiça Ibrahim Abi-Ackel em busca de um acordo que\nagilizasse a aprovação dos projetos de reforma eleitoral em tramitação\nno Congresso.\n\nQuando o governo, em 25 de novembro de 1981, enviou à Câmara projeto de\nproibição das coligações partidárias e estabelecimento do voto vinculado\npara as eleições de 1992 *—*uma inesperada alteração no curso da\nabertura —, Tancredo decidiu enterrar o sonho do PP e passou a defender\na fusão de todas as correntes oposicionistas em uma só legenda. A tese\nfoi rechaçada pelo PTB, o PDT e o PT, mas teve acolhida favorável da\nmaioria dos membros do PMDB e do PP. Para o senador, não havia\ndivergência radical de programa entre o PMDB e o PP: “A divergência está\nna metodologia da ação política. O PMDB é muito mais agressivo em busca\nde suas metas e o PP um partido de ação mais moderada, mais serena, que\ntenta buscar os seus objetivos em clima de compreensão, de entendimento\ne de conciliação.”\n\nA fusão do PP com o PMDB foi oficializada em convenção realizada em 14\nde fevereiro de 1982, quando Tancredo foi eleito vice-presidente\nnacional do novo PMDB. A decisão não teve o apoio de importantes\nlideranças pepistas, como Herbert Levy, Magalhães Pinto e Tales Ramalho,\nque após tentarem impugnar a incorporação, acabaram indo para o PDS. No\nnovo partido, Tancredo continuou liderando a ala moderada, organizada no\ngrupo Unidade.\n\nGovernador de Minas\n\nNo pleito de novembro de 1982, elegeu-se governador do estado de Minas\nGerais, o primeiro por voto direto desde 1965,**com 2.667.597 votos,\ncontra 2.424.197 obtidos por Eliseu Resende, candidato do PDS.\n\nAo ser diplomado pelo presidente do TRE regional em 28 de dezembro, o\nfuturo governador centrou seu discurso na crítica à legislação eleitoral\nimposta pelo regime autoritário, repleta, em sua opinião, de “casuísmos\nimpertinentes” que dificultavam a ação dos partidos e dos candidatos.\nDestacou a necessidade de torná-la compatível com o novo ciclo político\nque se iniciava, no sentido de fortalecer e consolidar as instituições\ndemocráticas.\n\nEm fins de fevereiro de 1983, Tancredo anunciou a composição de seu\nsecretariado, que buscava representar, na exata medida de suas forças,\nas correntes políticas que o levaram ao poder. Na Secretaria de Governo\ne Coordenação Política colocou o amigo Renato Azeredo, substituído ao\nfalecer meses depois por outro pessedista, o deputado Carlos Cotta. Para\na Secretaria do Interior e Justiça escolheu Sílvio Abreu Filho. Para as\npastas da área econômica chamou Ronaldo Costa Couto (Planejamento) e\nLuís Rogério Mitraud (Fazenda), que, se não contavam com as simpatias da\nesquerda e do PMDB ortodoxo, tinham largo trânsito em Brasília, onde\npoderiam buscar financiamentos importantes para o governo. Atendendo os\nfazendeiros da região do Triângulo Mineiro, Tancredo indicou o\nconservador Arnaldo Rosa Prata para a Secretaria da Agricultura; para o\ngrupo do extinto PP reservou a Secretaria dos Transportes, entregue ao\ndeputado estadual Álvaro Antônio (ex-Arena), e a da Cultura, que coube\nao deputado José Aparecido de Oliveira. A área social ficou com o PMDB\nortodoxo: Otávio Elísio Alves de Brito na Educação, Ronan Tito no\nTrabalho e Dario Tavares na Saúde. Tancredo ainda aplacou a esquerda ao\nabrir vaga na Câmara para o deputado Luís Guedes, eleito com o apoio do\nPCdoB, que amargava uma suplência. Para a prefeitura de Belo Horizonte\nnomeou o vice-governador Hélio Garcia.\n\nNo dia 10 de março Tancredo Neves despediu-se de seu mandato legislativo\nno Senado. Em seu discurso, ressaltou os perigos da recessão econômica,\ncujo prolongamento, disse, “terminará por destruir o nosso sistema\nprodutivo, explodirá o nosso parque industrial, enfraquecerá nosso\nmercado, levará o desânimo às atividades agropecuárias”. O tema da crise\nfoi, igualmente, o fundamento de seu discurso de posse no palácio da\nLiberdade, cinco dias depois: “Sabemos, porque sentimos em nossa carne,\nque as atividades rurais estão imersas no desânimo do esforço sem\nresposta satisfatória e na angústia de intolerável endividamento.\nDesativam-se as empresas industriais, com o cortejo sinistro do\ndesemprego, que amplia a área da miséria, da dor e do desespero em\ntantos e tantos lares de Minas. O comércio sucumbe ao peso de fortes\nencargos sociais e financeiros, e os empresários assistem, confrangidos,\nà inflação corroer seu patrimônio, somado, tantas vezes, pelo\npersistente esforço de várias gerações. A máquina administrativa, cara e\nobsoleta, cada vez se distancia de sua finalidade, tornando-se lenta e\ndesumana. O crédito, escasso e oneroso para os pequenos e médios\nempreendedores, faz a opulência dos grandes e poderosos. A casa própria,\nsonho de todo trabalhador, é hoje seu flagelo.”\n\nTancredo recebera um estado endividado. As grandes obras, exceto as\nadministradas pela Prefeitura de Belo Horizonte, foram logo postas fora\nde cogitação. Com a arrecadação completamente comprometida pelo\npagamento de quatrocentos mil funcionários públicos, o governador\nestabeleceu como prioridade a recomposição do perfil da dívida. Já no\ninício de abril encontrou-se com o presidente João Figueiredo em\nBrasília para chamar a atenção para a preocupante situação econômica que\nhavia encontrado no estado: uma dívida de 1,2 bilhão de dólares, com o\nagravante de que um sexto desse montante deveria ser resgatado até o\nfinal do ano. Ressaltou que só em 1981 dez grandes empresas haviam\nencerrado suas atividades em Minas por força do processo recessivo a que\no país vinha sendo submetido, ocasionando a formação de contingentes de\ndesempregados numa extensão capaz de agravar os confrontos sociais,\ncujos efeitos seriam negativos para a reconquista da democracia.**Desse\nencontro resultaria a rolagem da dívida externa de Minas, o que permitiu\nao governo lançar-se na realização de empreendimentos de infra-estrutura\nvisando à ocupação de uma parcela considerável da mão-de-obra ociosa e,\ndeste modo, evitar a repetição em Minas dos distúrbios e saques que\nvinham então ocorrendo, em conseqüência da crise econômica, nas grandes\ncapitais como São Paulo e Rio.\n\nO governo também recorreu ao financiamento externo, sobretudo do Banco\nInteramericano de Desenvolvimento (BID) e do Banco Internacional de\nReconstrução e Desenvolvimento (BIRD). Segundo o secretário do\nPlanejamento do estado, Ronaldo Costa Couto, mais de 60% do dinheiro\ninvestido em Minas em sua gestão vieram desse esforço de captação\nexterna. Dentro de casa, Tancredo impôs novo ritmo à arrecadação de\nimpostos, estimulando os contribuintes através de campanhas\npublicitárias e de facilidades aos que cumpriam suas obrigações em dia\nou desejavam regularizá-las.\n\nNão obstante sua postura conciliadora, o governador não transigiu em seu\napego à legalidade. A polícia de Tancredo reprimiu piquetes e greves,\nembora o governador tenha recebido delegações de sindicalistas para\nconversar; o governo intermediou conflitos trabalhistas, mas fez cumprir\na Lei de Greve e impediu manifestações públicas fora dos recintos\npermitidos pela Secretaria de Segurança.\n\nParalelamente às tarefas administrativas, Tancredo desempenhou um papel\nde destaque na política nacional, participando ativamente dos debates e\narticulações organizadas****pela oposição com vistas à redemocratização\ndo país e ao reordenamento do sistema representativo. No decorrer de\n1983, proferiu várias conferências e discursos exortando o povo\nbrasileiro a persistir na luta pela convocação de uma assembléia\nnacional constituinte que substituísse a Carta em vigor, que “nos enche\nde vergonha perante os outros povos”. Associava o futuro das\ninstituições políticas ao comportamento da economia, cuja estabilidade,\nsegundo ele, não poderia suportar a incidência de uma pressão\ninflacionária da ordem de 150% ao ano. Defendia a conciliação nacional\ncomo a fórmula mais adequada de encaminhamento da transição política,\ndesde que conduzida sob a responsabilidade das agremiações partidárias\nlegitimamente representadas no Congresso. Pregava também a renegociação\nda dívida externa sem a interferência de fatores que pudessem afetar a\nsoberania nacional ou importar maiores sacrifícios aos segmentos sociais\nmais atingidos pela recessão, pelo desemprego e pelo achatamento\nsalarial.\n\nA campanha pelas eleições diretas e a formação da Aliança Democrática\n\nEm fins de 1983, o deputado Dante de Oliveira, do PMDB de Mato Grosso,\napresentou na Câmara um projeto de emenda constitucional restabelecendo\nas eleições diretas para presidente da República, prática extinta em\noutubro de 1965 pelo Ato Institucional nº 2, editado pelo marechal\nCastelo Branco. A emenda Dante de Oliveira, como ficou conhecida,\nmobilizou a opinião pública e as lideranças parlamentares de oposição,\nproduzindo também grande impacto no partido governista, em que crescia o\ndescontentamento com o governo do general João Batista Figueiredo. A\npartir de então, começou a ganhar corpo a proposta de estabelecimento de\num pacto político entre as correntes oposicionistas e os descontentes do\nPDS comprometidos com a retomada da legalidade com vistas a lançar um\ncandidato de consenso à presidência da República, em pleito direto a ser\nrealizado em novembro de 1984. Desde o início, Tancredo Neves foi\ncogitado para cumprir esse papel, devido principalmente à sua habilidade\nconciliatória e à sua visão moderada acerca do processo de transição\ndemocrática.\n\nDe janeiro a abril de 1984, os comícios em favor das eleições diretas em\ntodos os níveis reuniram multidões surpreendentes nas praças das\ncapitais e principais cidades do país (no conjunto, mais de 30 milhões\nde brasileiros, segundo estimativa de seus articuladores),\nconvertendo-se em um movimento nacional de rejeição à continuidade do\narbítrio.\n\nTancredo Neves participou com grande destaque de todas as manifestações.\nNo entanto, acreditando que o regime militar, mesmo combalido pelo\ncrescente desgaste nas áreas política e econômica, não deixaria de\nmobilizar todos os instrumentos de pressão de que dispunha para\nneutralizar a perspectiva de uma derrota no Congresso, não afastava a\npossibilidade de o PMDB disputar o pleito presidencial indireto na\nhipótese de se tornar inviável a obtenção de maioria absoluta para a\naprovação da emenda Dante de Oliveira.\n\nCom efeito, a amplitude nacional da campanha das Diretas Já e a\ncrescente projeção de seus líderes levaram o governo a endurecer. No dia\n24 de abril, véspera da votação da emenda na Câmara, o presidente\nFigueiredo decretou estado de emergência em Brasília e designou para seu\nexecutor o general Newton Cruz, chefe do Comando Militar do Planalto,\nconhecido como “linha dura”. A justificativa oficial para a mobilização\nda força policial no cerco ao Congresso e contra as manifestações\npró-diretas programadas foi a necessidade de defender os parlamentares\ndo que foi denominado de “coação popular”. Na realidade, os dispositivos\nrepressivos foram acionados não apenas com o objetivo de intimidar os\ncongressistas, mas especialmente para evitar que as manifestações\npopulares encontrassem eco junto aos parlamentares do PDS menos\nsubmissos em seus compromissos de fidelidade ao governo.\n\nA emenda Dante de Oliveira foi votada na Câmara dos Deputados no dia 25\nde abril de 1984, em sessão que durou 16 horas e na qual o PDS,\ncumprindo determinações do palácio do Planalto, retirou do plenário 113\nparlamentares de sua bancada. Mesmo assim, 298 congressistas votaram a\nfavor, 65 contra e três se abstiveram. Faltaram, portanto, apenas 22\nvotos favoráveis para que fosse atingido o total de 320 votos, dois\nterços da composição da Câmara, necessário à aprovação da emenda,\ncondição prévia para o seu posterior envio ao Senado.\n\nDesde 1968, quando parlamentares da Arena se aliaram ao MDB e negaram a\nsolicitação do governo para processar o deputado emedebista Márcio\nMoreira Alves, o que motivou, em represália, a edição do AI-5, esta fora\na primeira vez em que o instituto da fidelidade partidária entrara em\ncolapso sem suscitar reações punitivas do regime. Apesar de a\ndesobediência do PDS não ter sido suficiente para garantir a aprovação\nda emenda, o episódio certamente selou a divisão no seio da agremiação\ngovernista, fortalecendo os prognósticos em torno do êxito de uma\neventual candidatura Tancredo Neves no Colégio Eleitoral.\n\nPrevalecendo a opção autoritária (indireta) para a escolha do sucessor\nde Figueiredo em 1985, quatro candidatos se apresentaram para disputar a\nindicação pelo PDS: o vice-presidente Aureliano Chaves, o senador por\nPernambuco Marco Maciel, o general Mário Andreazza, ministro do\nInterior, e o deputado Paulo Maluf (SP). Para resolver o impasse, o\npresidente nacional do partido, senador José Sarney, com o apoio do\npresidente Figueiredo, propôs em junho desse ano a realização de\neleições prévias entre todos os filiados que ocupassem postos eletivos\nou cargos em diretórios, desde os municipais, de modo a se definir um\ncandidato de consenso a ser levado à convenção partidária marcada para\nsetembro, numa versão brasileira das eleições primárias americanas.\nContudo, a recusa de Maluf em participar deste tipo de consulta, que\nconsiderou um casuísmo de seus adversários para deter sua candidatura,\nfundamentada num trabalho dirigido diretamente aos 686\nconvencionais,****levou Figueiredo a retirar seu apoio à proposta. Tal\nrecuo permitiu a Maluf arregimentar forças para derrotar a proposta de\nrealização de prévias na reunião da diretório nacional do partido\nconvocada justamente para planejar a sua realização. O episódio\nculminaria com a renúncia de José Sarney da presidência do PDS,\nconcretizando a ruptura da unidade da agremiação governista.\n\nAté esse momento, Tancredo alimentara e apoiara ostensivamente a\ncandidatura de Aureliano Chaves, posição que decerto foi fundamental\npara garantir a adesão do vice-presidente à candidatura oposicionista\nquando este se viu sem chances de concorrer ao palácio do Planalto. A\ncostura deste apoio, conhecido como o “acordo de Minas”, foi iniciada\nainda na noite da renúncia de Sarney, quando este recebeu a visita do\ndeputado Ulisses Guimarães e do senador peemedebista Fernando Henrique\nCardoso e, confessando-se traído pelo presidente, deu o sinal de que ele\ne seu grupo se dispunham a apoiar um candidato da oposição.\n\nEm meio a essa crise político-institucional, o governo enviou mensagem\nao Congresso em fins de junho concedendo a prerrogativa da escolha\nuniversal para 1988. Insatisfeita, porém, com a contemporização\ngovernamental, a oposição contra-atacou com uma subemenda antecipando a\ndata da realização do pleito direto. Foi o bastante para que os comícios\npúblicos, esvaziados depois de 25 de abril, voltassem a agitar as praças\ndas principais capitais brasileiras. Ainda em junho, às vésperas da\nvotação da emenda Figueiredo, que regulamentava as eleições\npresidenciais no Colégio Eleitoral, o PMDB e os partidos aliados,\ninclusive os descontentes do PDS aglutinados em torno de Sarney,\nAureliano e Maciel, obtiveram destaque para a subemenda das diretas, o\nque levou o governo, temeroso de nova derrota no Congresso, a retirar\nsua emenda, produzindo novos impasses nas negociações.\n\nCom o intuito de deter o retrocesso da redemocratização, os governadores\ndo PMDB, sob a presidência do deputado Ulisses Guimarães, reuniram-se em\nBrasília no dia 29 de junho e decidiram lançar o nome de Tancredo Neves\nà disputa no Colégio Eleitoral. Quatro dias depois a Frente Liberal do\nPDS rompeu definitivamente com o governo federal, passando a atuar no\nCongresso e nas assembléias legislativas estaduais como bloco\nparlamentar independente e dando início às negociações com a oposição em\ntorno do lançamento da candidatura do governador de Minas à presidência.\nA formação da Frente Liberal implicou, automaticamente, as desistências\nde Aureliano Chaves e Marco Maciel da disputa pela indicação do PDS na\nconvenção partidária, ficando esta restrita aos candidatos Andreazza e\nMaluf.\n\nNo dia 14 de julho, no palácio Jaburu, sede da vice-presidência da\nRepública, foi firmado o pacto da Aliança Democrática para enfrentar a\ncaminhada de Paulo Maluf, o mais cotado dos pré-candidatos pedessitas,\nrumo ao palácio do Planalto. Participaram do encontro, pelo PMDB, os\nsenadores Pedro Simon, Afonso Camargo e Humberto Lucena, além dos\ndeputados Ulisses Guimarães e Freitas Nobre; pela Frente Liberal, o\nvice-presidente Aureliano Chaves, os senadores José Sarney, João Calmon,\nJorge Bornhausen, Marco Maciel e Guilherme Palmeira, e os deputados José\nLourenço, Fernando Bastos, Saulo Queirós, França Teixeira e Volnei\nSiqueira;****e pela dissidência do PDS, o presidente do diretório\nregional do Rio de Janeiro, Wellington Moreira Franco.\n\nO pacto foi consolidado em encontro realizado em Brasília no dia 7 de\nagosto, quando foram abordados os itens essenciais do programa do\ncandidato aliancista: constituinte, problemas sociais, eleições diretas,\ndívida externa, casa própria, pleno emprego, previdência social,\nliberdade sindical e estado de direito. Na ocasião, ficou decidido que a\nFrente Liberal faria a indicação do candidato à vice-presidência da\nRepública, recaindo a escolha no senador José Sarney. A coordenação da\ncampanha ficou a cargo de Ulisses Guimarães.\n\nConvencida de que os partidários de Andreazza, que recebera o apoio\noficial dos governadores pedessistas da Bahia, Maranhão, Rio Grande do\nSul, Paraíba, Piauí, Rio de Grande do Norte, Alagoas e Rondônia não\nabsorveriam a candidatura Maluf caso ela triunfasse na convenção do PDS,\na Aliança Democrática procurou ampliar suas bases onde o ministro do\nInterior buscava reforçar seus redutos (no Nordeste), mediante, entre\noutros recursos, a participação assídua de Tancredo nas reuniões da\nSudene.\n\nConforme o esperado, a vitória de Maluf sobre Andreazza na convenção do\nPDS, antecipada para 11 de agosto de 1984, veio somar forças à campanha\noposicionista, a que aderiu grande parte dos partidários do candidato\npedessista derrotado. No dia seguinte foi realizada a convenção do PMDB\nque homologou a chapa da Aliança Democrática para concorrer à\npresidência da República. Dos 791 delegados com direito a voto, 103 não\ncompareceram, ocasionando os seguintes resultados: Tancredo obteve 656\nvotos, contra 32 votos brancos ou nulos, e José Sarney, que, para\natender às exigências da legislação eleitoral, filiara-se\nprovisoriamente ao PMDB, já que a Frente Liberal não era um partido,\nobteve 543 votos contra 143 votos brancos e nulos.\n\nEm seu discurso de agradecimento pela indicação, o candidato defendeu a\nconciliação e a concórdia como meios de edificação e permanência da\nordem democrática; prometeu a recuperação do regime federativo como\nforma indissociável das práticas republicanas, e afirmou sua crença no\npotencial do Brasil para desenvolver uma economia pujante, tendo\ndefendido o fortalecimento das pequenas e médias empresas e a\nreformulação da Consolidação das Leis do Trabalho (CLT), desfigurada\npelo arbítrio.\n\nNo dia 14 de agosto, Tancredo reuniu seus assessores no palácio da\nLiberdade e anunciou sua renúncia ao governo de Minas Gerais. Assumiu o\ncargo o vice-governador Hélio Garcia, que remanejou o secretariado, nele\nincluindo elementos da Frente Liberal. Com esta estratégia, denominada\nde “união mineira”, foram isolados os poucos remanescentes do PDS no\nestado que permaneciam ao lado de Maluf.\n\nApós cumprir um mandato de 17 meses, Tancredo deixou um saldo positivo\nde oitocentos bilhões de cruzeiros na arrecadação fiscal. A dívida\nexterna do estado foi rolada em 70% e a economia mineira, depois de três\nanos com resultados negativos, encerrou o primeiro semestre de 1984 com\num crescimento de 2,6% do produto interno.**De acordo com relatório\napresentado pela Secretaria de Indústria e Comércio de Minas Gerais\nrelativo ao período final do governo de Tancredo Neves, de janeiro a\nagosto de 1984, comparativamente a igual período do ano anterior, o\nsetor manufatureiro mineiro obteve um crescimento de 13,84% e a expansão\nda produção de aço foi de 27%, tendo sido implantadas 21 novas\ndestilarias de álcool no estado. O volume de divisas obtidas com a\nexportação elevou-se em 18,5% e a receita alcançada com a arrecadação do\nICM totalizou 1,7 trilhão de cruzeiros, reconduzindo Minas à sua posição\nde terceira maior unidade da Federação no recolhimento daquele tributo.\n\nA campanha presidencial e a vitória no Colégio Eleitoral\n\nA sucessão presidencial não transcorreu sem reiteradas ameaças\ndestinadas a intranqüilizar o encaminhamento do processo eleitoral. A\ncrise fazia-se sentir no interior das forças armadas e entre o poder\nconstituído e o meio político e decorria de projetos que visavam\ncontrariar a mais provável decisão do Colégio Eleitoral em favor do\ncandidato da Aliança Democrática, que iniciava sua campanha com\nsucessivas declarações de adesão por parte de governadores nordestinos e\nde figuras significativas do empresariado. Apesar dos esforços de\nFigueiredo, que passou a incluir a presença de Maluf em atos oficiais do\ngoverno federal, numa tentativa de vencer as resistências contra o\nex-governador paulista que ainda persistiam no partido e em setores\nimportantes do regime, o candidato oficial não parecia capaz de se\nafirmar como uma real opção para o governo.\n\nOs antecedentes da crise militar, que chegou****a fomentar alguns\nindícios de ameaças à consolidação da candidatura Tancredo Neves,\nocorreram entre fins de fevereiro e meados de março de 1984, quando o\nalmirante Maximiano da Fonseca pediu demissão do Ministério da Marinha e\nfoi recebido apoteoticamente no Rio de Janeiro pela oficialidade\nincorporada da Armada. De acordo com entrevista concedida pelo ministro\nao Centro de Pesquisa e Documentação de História Contemporânea do Brasil\n(Cpdoc) em 1985, os motivos de sua exoneração foram inspirados por\nobjeções do general Otávio Medeiros, chefe do SNI, a uma solução civil\npara a sucessão do presidente Figueiredo, por entender que a afirmação\nde uma nova candidatura militar, oriunda da chamada comunidade de\ninformações, constituía a única forma capaz de dar sustentação ao\nconceito de segurança nacional que embasava os objetivos básicos do\nmovimento de 31 de março de 1964.\n\nSegundo a revista *Veja* de 28 de março de 1984, a principal razão da\nqueda de Maximiano teria sido o compromisso que ele assumira com a\nreposição do país nos limites da legalidade constitucional. No dia 16 de\nmarço, indagado a respeito de sua posição diante da campanha popular em\nfavor das eleições diretas, o ministro teria afirmado que “enquanto não\nhouver barulho ou baderna, está bem que o povo se manifeste”. À noite,\nrecebera um telefonema do general Rubem Ludwig, ministro-chefe do\nGabinete Militar, pedindo, em nome de Figueiredo, confirmação da\nentrevista. Maximiano não só confirmaria sua declaração como solicitaria\na Ludwig que marcasse o dia da entrega de sua carta de demissão ao\npresidente da República.\n\nA declaração do ministro, porém, por maior irritação que tivesse causado\nnos meios militares, certamente não teria sido suficiente para ocasionar\na saída do titular de uma pasta militar. Razão mais forte parece ter\nsido a entrevista publicada na época pela revista *Playboy*, na qual\nMaximiano informava sobre a existência de um plano, por ele elaborado,\nproporcionando à Marinha condições de bloquear quaisquer tentativas de\nreversão do projeto de abertura política. O ministro não fazia\nrevelações a respeito de um possível golpe em curso; afirmava apenas que\nsua iniciativa tivera um caráter preventivo, no sentido de evitar que a\nMarinha fosse surpreendida por acontecimentos adversos.\n\nMeses mais tarde, no dia 10 de agosto, às vésperas da convenção do PMDB,\nagentes da 1ª Delegacia Policial de Brasília prenderam quatro pessoas\nque colavam cartazes de propaganda do Partido Comunista do Brasil\n(PCdoB) apoiando Tancredo Neves. De madrugada, o titular da delegacia\nrecebeu a visita do tenente-coronel Arídio Mário de Sousa Filho exigindo\na soltura imediata dos presos, que eram na realidade um major, um\ncapitão e dois sargentos a serviço do Centro de Informações do Exército\n(Ciex), órgão chefiado pelo general Íris Lustosa e diretamente vinculado\nao gabinete do ministro do Exército.\n\nA partir de então, novos boatos foram disseminados em Brasília sugerindo\nque um poderoso setor das forças armadas ameaçava intervir no processo\neleitoral. Surgiram também notícias a respeito de um projeto de\nresistência ao suposto golpe em preparação, envolvendo inclusive a\ncomposição de um esquema defensivo com vistas a garantir a segurança\nfísica do candidato oposicionista em sua movimentação pelos estados,\napoiado em promessas de mobilização das polícias militares em Minas, São\nPaulo, Rio de Janeiro, Paraná e Goiás. Mas esse apoio não era\nsuficiente. Era preciso buscar sólida sustentação militar no Exército.\n\nAssim, no início de setembro, por iniciativa dos generais Reinaldo Melo\nde Almeida e Gustavo Morais Rego, Tancredo avistou-se com o\nex-presidente Ernesto Geisel em seu escritório na Norquisa, no Rio de\nJaneiro. Dele recebeu a garantia de que o Exército se manteria distante\ndo problema sucessório, cuja solução o país havia transferido à\nsociedade civil através dos partidos políticos representados no\nCongresso Nacional.\n\nNo dia 21 desse mês, os altos comandos das três forças armadas\nreuniram-se no Rio e em Brasília para analisar o desenvolvimento da\ncampanha sucessória, da qual a opinião pública vinha participando com\nsurpreendente intensidade. Desses encontros resultaram a divulgação de\nnotas oficiais das três forças. As do Exército e da Aeronáutica eram\nsemelhantes em suas conclusões: relacionavam “a crescente e preocupante\nradicalização política com o apoio ostensivo das organizações\nclandestinas de esquerda”, “a utilização, na campanha presidencial, de\ncalúnias, difamações e ofensas pessoais de toda natureza”, “a campanha\nde descrédito contra as autoridades civis e militares, conduzidas com o\nobjetivo de desacreditá-las perante a sociedade e dividi-las” e “a\nevidência dos riscos que a radicalização pode representar para a\nestabilidade do processo sucessório e para o próprio êxito do projeto de\nabertura política do governo”. A Marinha, ao contrário, limitou-se a\ncomunicar que a Armada se sentia “no dever de reafirmar junto à opinião\npública sua posição de fiel cumprimento das atribuições\nconstitucionais”.\n\nOs pronunciamentos das chefias militares, que demonstravam dissensões,\ndeixaram o meio político inseguro quanto a possíveis tentativas de\nintimidação da campanha oposicionista e de falta de legitimidade do\nprocesso sucessório. Com efeito, esta deve ter sido a intenção dos\nresponsáveis pela explosão que destruiu inteiramente as dependências de\num comitê de arregimentação política da Aliança Democrática em Porto\nAlegre no dia 21 de outubro. Contudo, em discurso pronunciado no dia\nseguinte, Tancredo procurou desencorajar as aspirações revanchistas,\nisentando as forças armadas de cumplicidade em atos que pudessem impedir\na reconciliação do país com a democracia.\n\nO pronunciamento de Tancredo, no entanto, não amenizou as precauções da\noposição. No dia 26 de outubro, a *Folha de S. Paulo* publicou matéria\nrelatando as providências do governo para a execução de medidas de\nemergência previstas para vigorar a partir de 2 ou 3 de janeiro do ano\nseguinte. Falava em prontidão na unidade de fuzileiros navais em\nBrasília, onde haviam sido observados exercícios de adestramento que\nfaziam prever o desencadeamento de ações repressivas.\n\nNo mesmo dia, nota da Conferência Nacional dos Bispos do Brasil (CNBB)\ndenunciou a existência de “bolsões militares e civis desconfiados de\npossíveis forças subversivas”, argüindo a necessidade de esclarecimento\ndessas suspeitas “à luz do dia, sem conchavos, sem reuniões secretas,\nsem conspirações”, porque “uma nação que se pretende civilizada não pode\naceitar golpes”.\n\nO tenente-brigadeiro Valdir Vasconcelos, chefe do Estado-Maior das\nForças Armadas (EMFA), também prestou declarações à imprensa procurando\naquietar os círculos políticos com a reafirmação de que as instituições\nmilitares não entrariam em qualquer espécie de articulação que pudesse\ndesviar a sucessão presidencial de seu trajeto normal. Em longa\nentrevista publicada na *Folha de S. Paulo* de 6 de novembro, o titular\ndo EMFA afirmou que as notícias de golpe não passavam de “especulações\nque só servem para intranqüilizar o povo”, assegurando que o país vivia\n“num regime democrático constitucional”.\n\nSegundo notícia veiculada pela revista *Veja*, em 23 de novembro o\nministro do Exército, general Válter Pires, teria mantido um encontro\nsecreto com o candidato da Aliança Democrática, assegurando-lhe que as\nforças armadas não interviriam no processo sucessório e expondo-lhe as\nmedidas que vinha implementando com vistas ao reequipamento e à\nmodernização do Exército. Em contrapartida, obtivera de Tancredo o\ncompromisso de que seu futuro governo não tomaria atitudes revanchistas\ncontra os militares comprometidos com o regime autoritário.\n\nNo mesmo dia do suposto****encontro, o ministro do Exército voltou a se\npronunciar em nota oficial liberada à imprensa: “O Exército mantém-se na\nfirme disposição de apoiar o projeto de abertura do presidente João\nFigueiredo, que deverá se consolidar com a eleição do futuro presidente\nda República, pelo Colégio Eleitoral, na forma da lei. A nação, que\nsempre contou com as forças armadas nos momentos decisivos de sua\nhistória, pode confiar que serão plenamente atendidos seus anseios de\npreservação das instituições democráticas.”\n\nCom as sucessivas declarações militares e a decisão do presidente\nFigueiredo de retirar o general Newton Cruz da chefia do Comando Militar\ndo Planalto e da 11ª Região Militar os ânimos começaram a serenar. O\nincêndio de parte do escritório da Aliança Democrática em Brasília, na\nmadrugada do dia 26 de novembro, porém, novamente veio abalar a\nconfiança da opinião pública quanto ao destino da abertura no país.\nTancredo Neves buscou amenizar a crise, desqualificando a ação como um\n“fator acidental destituído de conotações de origem política”.\n\nMas foi com o pronunciamento do presidente Figueiredo no dia 5 de\ndezembro, perante mais de 70 oficiais-generais das três forças — sem\ndúvida, o mais importante pronunciamento produzido em todo o ciclo da\nabertura política — que o meio político e os diversos segmentos da\nsociedade interessados na consolidação do processo democrático tiveram a\ncerteza de que a sucessão presidencial chegaria a seu desfecho sem os\ntropeços do veto militar. Estabelecendo íntima conexão entre a lealdade\nindividual aos poderes do Estado e a coexistência democrática dos\nagrupamentos sociais diversificados, Figueiredo conclamava a\noficialidade: “na disputa pelo poder, pela hegemonia econômica ou\nsocial, dentro dos limites da sã convivência, os homens reforçarão os\nlaços que viabilizam a sociedade, fortalecerão sua personalidade e\nconsolidarão seus valores.”\n\nCom o desenrolar da campanha, o partido governista também se empenhou na\nconstrução de obstáculos para interceptar a vitória do candidato da\nAliança Democrática. No dia 22 de outubro, o senador pedessista Moacir\nDalla, presidente da mesa diretora do Senado, responsável pela\nregulamentação e organização do pleito, baixou instruções tornando\nsecreta a eleição dos seis delegados de cada assembléia legislativa\nestadual que, juntamente com a totalidade dos membros do Senado e da\nCâmara, integrariam o Colégio Eleitoral em janeiro de 1985. A oposição\nimediatamente denunciou o casuísmo da medida, que desconsiderava o\nacordo firmado entre as lideranças partidárias facultando aos\nlegislativos estaduais a deliberação sobre a forma de votação, se aberta\nou secreta, não conseguindo, porém, mudá-la.\n\nO cerco à oposição levou também a que tropas do Comando Militar da\nAmazônia fossem deslocadas para São Luís para dar cobertura à ocupação\npela Polícia Federal da Assembléia Legislativa do Maranhão por ocasião\nda escolha dos delegados desta casa ao Colégio Eleitoral*.* Neste clima\nde pressão, após uma sessão agitada e pontilhada de sucessivos\nincidentes, os deputados maranhenses acabaram indicando seis\nrepesentantes malufistas. A decisão, contudo, foi contestada pelo\npresidente estadual do PDS, deputado Jaime Santana, ligado ao senador\nJosé Sarney e já integrado na dissidência liberal, que impetrou recurso\nna Justiça Eleitoral denunciando a visível coação exercida pela Polícia\nFederal e a prática de fraudes: 16 deputados estaduais favoráveis a\nTancredo não haviam recebido cédulas para votar. O recurso, julgado pelo\nTSE em 24 de dezembro, daria provimento à reclamação e anularia a\ndecisão da Assembléia. Realizada nova eleição, seriam indicados outros\nrepresentantes, dessa vez vinculados ao candidato oposicionista.\n\nEm 26 de outubro, os jornais noticiaram que a mesa do Senado\npreparava-se para impugnar a eleição dos representantes pedessitas das\nassembléias abertamente comprometidos com o candidato oposicionista.\nPara tanto, pretendia se utilizar de dispositivo estatutário,\ninvestindo-se da prerrogativa de acolher ou não as indicações dos\nlegislativos estaduais. No dia 6 de novembro, porém, em resposta à\nconsulta formulada pelo deputado Gerardo Renault (PDS-MG), o TSE decidiu\nque os membros do Colégio Eleitoral ficariam desobrigados do compromisso\nde fidelidade partidária. Discordando da posição do TSE, sob a alegação\nde que os mandatos parlamentares pertenciam aos partidos, o diretório\nnacional do PDS reuniu-se em 21 de novembro e fechou questão em torno da\nfidelidade, encaminhando ao TSE pedido de registro da ata da reunião,\nprecavendo-se assim contra possíveis conflitos na Justiça. Foram também\nlançadas ameaças de expulsão do partido, com a conseqüente perda de\nmandato parlamentar, àqueles que não acatassem as diretrizes baixadas\npela direção partidária. A imposição foi endossada pelo general Golberi\ndo Couto e Silva, partidário de Maluf, que em entrevista publicada na\n*Folha de S. Paulo* no dia seguinte afirmou textualmente: “Só assim os\ndissidentes votam com o partido.”\n\nNo dia 23, o PMDB e a Frente Liberal encaminharam ao TSE pedido de\nimpugnação da medida. Quatro dias depois este Tribunal ratificou a\nresolução adotada em 6 de novembro sobre a questão da fidelidade\npartidária e, finalmente, em 4 de dezembro, rejeitou o pedido do PDS de\narquivamento da ata, liquidando as aspirações de Maluf de sair vitorioso\nno Colégio Eleitoral.\n\nDesde então, os vestígios da crise sucessória começaram a empalidecer no\ncenário nacional. Os órgãos de comunicação passaram a dar maior ênfase a\nnotícias relacionadas com os programas de governo, discutindo as\npossibilidades de composição do novo ministério. O candidato Paulo Maluf\nainda tentou, sem sucesso, reverter o processo eleitoral com uma\nproposta de efeito, reabrindo no Congresso o debate em torno do pleito\ndireto, que ele combatera com energia por ocasião da votação da emenda\nDante de Oliveira, mas a oposição logo denunciou o caráter oportunista\nda proposta.\n\nUm dos mais importantes discursos de Tancredo Neves ainda na condição de\ncandidato foi pronunciado em 30 de novembro, no encerramento do I\nEncontro Nacional da Indústria, realizado no Rio de Janeiro. Defendeu a\nnecessidade imperativa de constituição de um pacto social entre governo,\nempresários e trabalhadores para que a democracia, em vez de um\nempreendimento de risco, se constituísse em um sistema de apaziguamento\ne de solução de conflitos sociais agravados e reprimidos por anos de\narbítrio. Para garantir esse retorno à legalidade e assegurar a sua\npermanência, pregou a convocação de uma assembléia nacional constituinte\npara substituir um estatuto autoritário, emanado de poder\nrevolucionário, por uma Carta que resulte da concepção de representantes\neleitos pela nação.\n\nEm 8 de janeiro de 1985, reunido com dirigentes do PMDB na Câmara dos\nDeputados, o candidato recebeu um volume de seiscentas páginas,\nintitulado *A Nova República,*termo por ele cunhado em dezembro de\n1984*,*contendo as sugestões do partido para um próximo programa de\ngoverno. Em seu discurso de agradecimento, Tancredo ressaltou o peso\npolítico nacional do PMDB, um “partido moderno, atuante e criador”, e\nenfatizou a importância das agremiações político-partidárias na\nformulação de projetos, compartilhando as responsabilidades\nadministrativas dos governos que ajudaram a instituir.\n\nEm 15 de janeiro, os membros do Colégio Eleitoral deram 480 votos a\nTancredo Neves e apenas 180 a Paulo Maluf, tendo sido registradas 17\nabstenções e nove ausências. Os cinco estados que mais contribuíram para\na vitória da Aliança Democrática foram Minas Gerais (57 votos), São\nPaulo (50), Rio de Janeiro (42), Paraná (37) e Bahia (35). Além dos\naliancistas, Tancredo recebeu os votos dos convencionais do PDT e de\ndissidentes do PDS e do PT.\n\nProclamados os resultados eleitorais pela mesa do Congresso, Tancredo\ndeclarou que a primeira tarefa de seu governo seria a de promover a\norganização institucional do Estado. Ressaltou a importância da\nconciliação, que “não exclui o confronto de idéias, a defesa de\ndoutrinas divergentes”, e concitou o país ao “grande mutirão nacional”\npara o qual “não há um de vós que possa ser dispensado”.\n\nNa primeira entrevista concedida após o pleito, o candidato eleito\ncriticou os desequilíbrios decorrentes da expansão inflacionária,\nobservando que as medidas de combate à deterioração da moeda e à\nelevação dos preços não deveriam se incompatibilizar com a aceleração do\ncrescimento econômico, mas sim proporcionar a criação de novos empregos,\nmelhor remuneração à força de trabalho e uma distribuição mais justa da\nrenda nacional. Afirmou que o reconhecimento da plena soberania do\nCongresso, associado a uma oposição permanente e livre, são atributos\nfundamentais para o êxito do grande projeto nacional de recuperação\ndemocrática e assegurou: “Vamos realizar uma obra que faça o homem\nbrasileiro acreditar na sua nação, confiar nela e confiar no seu\ngoverno.”\n\nA formação do ministério\n\nEntre fins de janeiro e princípios de fevereiro de 1985, Tancredo\nvisitou os Estados Unidos e vários países da Europa, numa viagem que,\npara analistas políticos, visava mostrar ao Ocidente que as elites\npolíticas brasileiras estavam suficientemente amadurecidas para\nconduzir, sem dramas e precipitações intempestivas, a substituição de um\nregime autoritário por uma organização democrática estável e\nconciliadora. Essa organização seria capaz de agregar não apenas as\nforças conservadoras como também as correntes representativas daquelas\náreas mais agredidas pela inquietação, pelo inconformismo e pela\nmarginalidade. O presidente eleito procuraria demonstrar, paralelamente,\nque a participação política produzida pela convivência dos antagonismos\nteria como indispensável corolário a reativação da economia, dando\namparo à redução dos atritos sociais em estado latente de fermentação. O\nBrasil havia mudado e as mudanças deveriam se fazer sentir inclusive nas\nmodalidades de negociações, desde o estabelecimento de acordos\ncomerciais até a fixação de compromissos mútuos em suas alianças de\ncunho político e militar.\n\nNa Itália, a base das conversações com o presidente Sandro Pertini e o\n*premier* Bettino Craxi fixou-se em torno de um programa de comércio\nexterno que vinha sendo examinado pela direção do Partido Socialista\nItaliano. Na França, a atenção do presidente eleito voltou-se para as\nnegociações com os associados do Clube de Paris relativas à dívida\nexterna brasileira. Na visita a Portugal, Tancredo avistou-se com o\npresidente Ramalho Eanes e com o primeiro-ministro socialista Mário\nSoares, recebeu o título de doutor*honoris causa* na Universidade de\nCoimbra e discursou na Assembléia da República, onde evocou a influência\nda civilização lusa na formação da nacionalidade brasileira. Dos\nentendimentos mantidos com o governo português ficou prevista a\ncolocação de produtos brasileiros no Mercado Comum, no qual Portugal e\nEspanha haviam ingressado recentemente. Neste último país, foi recebido\npelo rei Juan Carlos I e o *premier* Felipe González como se já\nestivesse no exercício do mandato, com as honras de chefe de Estado.\nTancredo interessou-se particularmente pelo funcionamento do Pacto de\nMoncloa, através do qual todas as facções da sociedade espanhola se\ncomprometeram a desenvolver uma forma de atuação política que não\ntransgredisse os fundamentos do propósito nacional de construção da\ndemocracia, implantada depois de mais de 40 anos de domínio franquista\nsobre as ruínas de uma guerra civil prolongada e catastrófica.\n\nFinalmente, em Washington, no auditório do National Press Club, o\npresidente eleito pronunciou o discurso mais importante de sua viagem,\nno qual focalizou o povo brasileiro como principal protagonista da\nredemocratização. Declarou ainda ser a recessão um fator de desestímulo\naos investimentos, afirmando a determinação de seu futuro governo no\nsentido de obter níveis significativos de crescimento e de implementar\numa política externa fruto de “consenso pluripartidário”.\n\nCom o regresso de Tancredo Neves ao Brasil nos primeiros dias de\nfevereiro, tiveram início as negociações políticas visando à\nconstituição do primeiro ministério da República civil. Embora os meios\nde comunicação tenham veiculado as mais variadas versões a respeito dos\nnomes que se julgavam mais credenciados na preferência do presidente,\nTancredo não se sentiu induzido a discuti-las. Entregou a coordenação do\nsetor econômico ao seu sobrinho Francisco Dornelles, já indicado para o\nMinistério da Fazenda, e assumiu, juntamente com Ulisses Guimarães,\npresidente nacional do PMDB, o comando da articulação política que\nconduziria à escolha dos titulares dos cargos relativos às áreas social,\ndiplomática e militar.\n\nNo dia 12 de março Tancredo concedeu a última entrevista coletiva como\npresidente eleito, que seria, na verdade, o último pronunciamento\npolítico de sua vida. Na ocasião, defendeu a contenção dos gastos\npúblicos, o combate à inflação sem prejuízo da expectativa de altas\ntaxas de crescimento econômico, a injeção de recursos suplementares para\no incremento da produção agrícola e a reformulação da Lei de Greve.\n\nNo mesmo dia foi anunciado o primeiro ministério da Nova República,\nconstituído dos seguintes nomes, oriundos dos partidos que formaram a\nAliança Democrática: Gabinete Civil, José Hugo Castelo Branco (MG);\nJustiça, Fernando Lira (PE); Relações Exteriores, Olavo Setúbal (SP);\nTrabalho, Almir Pazzianotto (SP); Indústria e Comércio, Roberto Gusmão\n(MG); Agricultura, Pedro Simon (RS); Minas e Energia, Aureliano Chaves\n(MG); Previdência Social, Valdir Pires (BA); Saúde, Carlos Santana (BA);\nEducação, Marco Maciel (PE); Assuntos Fundiários, Nélson Ribeiro (PA);\nAdministração, Aluísio Alves (RN); Habitação e Saneamento, Flávio\nPeixoto (GO); Desenvolvimento Regional, Ronaldo Costa Couto (MG);\nCultura, José Aparecido de Oliveira (MG); Transportes, Afonso Camargo\n(PR); Ciência e Tecnologia, Renato Archer (MA); Desburocratização, Paulo\nLustosa (CE); Gabinete Militar, general Rubem Bayma Denis; Exército,\ngeneral Leônidas Pires Gonçalves; Marinha, almirante Henrique Sabóia;\nAeronáutica, brigadeiro Júlio Otávio Moreira Lima; EMFA, almirante José\nMaria Amaral. Com a nomeação de José Aparecido para o governo de\nBrasília foi indicado para o Ministério da Cultura o professor Aluísio\nPimenta, de Minas Gerais.\n\nForam criados, portanto, sete novos ministérios: Assuntos Fundiários,\nAdministração, Habitação e Saneamento, Desenvolvimento Regional,\nCultura, Ciência e Tecnologia e Desburocratização. Quatro dos novos\nministros escolhidos haviam sido cassados por atos institucionais\neditados entre 1964 e 1968 pelo regime militar: Valdir Pires, José\nAparecido, Aluísio Alves e Renato Archer.\n\nO chefe do Gabinete Militar, que comandara a 4ª Divisão de Infantaria,\nem Belo Horizonte, no período em que Tancredo governava Minas Gerais,\nera filho do marechal Odílio Denis, que intercedeu pessoalmente junto ao\npresidente eleito em favor de sua nomeação. A escolha dos ministros da\nMarinha e do EMFA, almirantes com lideranças marcantes entre a\noficialidade naval, decorreu da pressuposição de que a solução\neliminaria constrangimentos que pudessem estremecer os objetivos de\npacificação da Armada. Na Aeronáutica não houve maiores contradições\npara a escolha do titular da pasta, uma vez que os índices de\npolitização do passado já se encontravam reduzidos há algum tempo. No\nExército, os complicadores que porventura poderiam se manifestar foram\naliviados pela liderança do ex-presidente Ernesto Geisel. Nesta força,\nos principais articuladores da reabertura política à base da candidatura\nTancredo Neves eram os generais Reinaldo Melo de Almeida e Gustavo\nMorais Rego, que se orientavam pela chamada linha geiselista. Da órbita\nde influência de Geisel saíram, portanto, o ministro do Exército,\ngeneral Leônidas Pires Gonçalves, e o ministro-chefe do SNI, general\nIvan de Sousa Mendes.\n\nA trajetória final\n\nEm 14 de março, véspera da posse, Tancredo Neves, ao lado de seus\nfamiliares, assistiu à missa em ação de graças celebrada em sua\nhomenagem no Santuário Dom Bosco, em Brasília, pelo arcebispo de Belo\nHorizonte, dom João Resende Costa. No mesmo dia à noite, o chefe do\nserviço médico da Câmara, doutor Renault Matos Ribeiro, foi chamado às\npressas para atender o presidente eleito, acometido de fortes dores\nabdominais. Diagnosticado de apendicite, Tancredo foi operado no\nHospital de Base de Brasília pelos médicos Renault Matos Ribeiro e\nPinheiro da Rocha aos 37 minutos do dia 15, dia em deveriam ocorrrer a\nposse e transmissão do cargo. Segundo informações transmitidas após a\ncirurgia, Tancredo padecia de diverticulite, doença que gera um quadro\nagudo, provocando dores semelhantes às crises de apendicite.\n\nDe acordo com depoimentos apurados pela imprensa, Tancredo vinha\nsentindo dores no abdome desde o dia 8. No dia 13, como o sofrimento\naumentava, o doutor Renault recomendou que o presidente se operasse, mas\nele se recusou. Tancredo teria pedido a seu médico que o sustentasse até\no momento da posse, para que o processo da sucessão não fosse\ninterrompido por qualquer acidente que propiciasse questionamentos\npolíticos ou impasses de interpretação técnica. A seu pedido, também, os\njornalistas teriam sido informados por Renault de que o presidente\nsofria meramente de uma faringite.\n\nAinda na madrugada do dia 15, enquanto o paciente era mantido isolado na\nUnidade de Tratamento Intensivo (UTI) do Hospital de Base, o meio\npolítico se mobilizava para tentar solucionar o impasse surgido a\nrespeito de quem assumiria a presidência em exercício: o vice-presidente\nJosé Sarney ou o presidente da Câmara, Ulisses Guimarães. Para os grupos\nmais radicais do PMDB, o deputado peemedebista seria a segunda pessoa na\nescala hierárquica da sucessão, mas o próprio Ulisses entendeu que vetar\na posse de Sarney, ignorando sua condição de companheiro de chapa de\nTancredo, seria o mesmo que invalidar a legitimidade da eleição\nverificada no Colégio Eleitoral. O argumento do presidente nacional do\nPMDB, escudado na opinião de constitucionalistas qualificados, acabou\nderrubando todas as dúvidas e versões levantadas.\n\nSegundo o jornal *O Globo*, um segundo passo das negociações foi\nconvencer o presidente Figueiredo a passar a presidência a Sarney, com\nquem estava rompido. Para tanto, Ulisses Guimarães se teria comprometido\ncom o ministro-chefe do Gabinete Civil de Figueiredo, Leitão de Abreu,\npartidário até então da posse do presidente da Câmara, de que não\nhaveria solenidade de transmissão do cargo, contornando-se assim o\nimpasse.\n\nJosé Sarney tomou posse como presidente da República perante o Congresso\nàs dez horas da manhã do mesmo dia 15, pronunciando o discurso elaborado\npela assessoria de Tancredo e por ele aprovado, cuja essência fixava-se\nna determinação das prioridades dos gastos públicos. O ministério\nescolhido por Tancredo três dias antes foi mantido.\n\nNão obstante o êxito da cirurgia, as conseqüências pós-operatórias não\nforam tranqüilizadoras: uma obstrução intestinal alarmou a equipe\nmédica, que sugeriu então uma segunda intervenção cirúrgica. Nove\nmédicos, de diferentes especialidades, foram convocados para emitir\nparecer a respeito do quadro que se apresentava e, por unanimidade,\nconcluíram pela necessidade de uma segunda operação.\n\nTal possibilidade inquietou de novo a área política. O governo\npreocupava-se em não deixar a população perceber algum indício mais\ngrave de anormalidade. A esquerda parecia propensa a iniciar nova\ncampanha pelas diretas, o que determinaria uma contestação da decisão do\nColégio Eleitoral, enquanto a direita possivelmente aguardava\nrepercussões dramáticas do episódio para provocar a regressão das\nconquistas que impulsionaram o advento da República civil.\n\nA segunda operação foi efetuada no próprio dia 20 pelos médicos Henrique\nVálter Pinotti, Francisco Pinheiro da Rocha e João Batista Alves. Os\nresultados anunciados provocaram manifestações de euforia por parte de\npolíticos, familiares e assessores diretos de Tancredo. Cogitou-se então\nde uma nova data para a posse que, segundo os noticiários, vinha sendo\nreclamada pelo próprio presidente eleito. Não obstante, esse momento de\notimismo foi conturbado por divergências no interior da equipe médica\nrelativas à avaliação das reações do paciente, tendo sido registradas\ntrocas de acusações nos jornais e na televisão. A controvérsia provocou\nconstrangimentos à família do presidente eleito e suscitou temores no\nmeio político.\n\nEnquanto isso, a recuperação de Tancredo entrava em retrocesso. Uma\ncrise circulatória levou à sua remoção para o Instituto do Coração do\nHospital das Clínicas de São Paulo, na capital paulista, onde foi\nsubmetido, em 26 de março, a uma terceira cirurgia, realizada pela\nequipe do doutor Henrique Pinotti. Nesse momento o país começou a tomar\nciência da gravidade do quadro. Numerosas igrejas, cultos e seitas\nreligiosas realizaram ritos ecumênicos em favor do restabelecimento da\nsaúde de Tancredo, tendo sido registradas manifestações populares de\napreço e estímulo em diversos estados.\n\nApós a terceira intervenção, as preocupações da equipe médica\nconvergiram para uma nova constatação: a existência de infecção\nhospitalar contraída pelo paciente durante o período de internamento no\nHospital de Base de Brasília. Para o combate à infecção foi utilizado um\nnovo tipo de antibiótico ainda não comercializado, mas nem assim o\norganismo do presidente apresentou sinais de reação.\n\nNo dia 2 de abril Tancredo enfrentou no Instituto do Coração a sua\nquarta intervenção cirúrgica, com a finalidade de corrigir uma “hérnia\ninguinal encarcerada no lado esquerdo do abdome” e deter um foco\ninfeccioso, conforme atestaram os boletins médicos. A partir de então a\nopinião pública passou a duvidar da fidelidade dos comunicados oficiais\nque anunciavam ausência de perigo vital no estado geral do presidente.\n\nNesse contexto, o ministro da Justiça, Fernando Lira, afirmou aos\njornais que o quadro assumira uma maior gravidade e que a área política\nse preparava para fortalecer o governo Sarney, procurando eliminar\ngradualmente seu caráter transitório.\n\nUma quinta operação, destinada a drenar um foco infeccioso no local da\nincisão, foi realizada pouco depois das 13 horas do mesmo dia 2. As\nesperanças e o otimismo foram substituídos por evasivas e pelo silêncio.\nPolíticos e familiares passaram a evitar tecer comentários sobre a\nsituação criada pela necessidade da nova cirurgia.\n\nNo dia 9 de abril Tancredo foi submetido a uma sexta operação. Segundo\nos médicos, uma traqueostomia destinada a evitar o desconforto originado\npela presença de um tubo orotraqueal que, se fosse usado por muito\ntempo, poderia provocar lesão no local. A equipe médica ainda imporia ao\npresidente uma sétima cirurgia, três dias depois, com o objetivo de\n“exploração e limpeza da cavidade abdominal”, ao final da qual foi\nconstatado o esgotamento das possibilidades de preservar a vida de\nTancredo. Pela primeira vez o porta-voz presidencial, jornalista Antônio\nBrito, falou em agravamento do quadro. Os médicos consideravam que todos\nos recursos existentes já haviam sido empregados, mas a resistência\nfísica do presidente, desde então mantido sob sedativos e com o auxílio\nde máquinas substituindo os pulmões e os rins, vez por outra surpreendia\nas pessoas diretamente envolvidas no drama, revitalizando os ânimos\nabatidos e fazendo renascer expectativas amortecidas.\n\nA partir de 15 de abril, no entanto, o meio político começou a tomar as\nprimeiras providências com o objetivo de sustentar a permanência da\ntransição democrática no caso da morte de Tancredo. Encontros entre\nUlisses, Sarney e líderes do PFL passaram a se suceder com freqüência,\nenquanto a imprensa internacional destacava em seus comentários ser o\nmomento uma prova para a consolidação das mudanças geradas pela\nfinalização do ciclo de dominação militar.\n\nNão obstante os esforços da equipe médica, tornou-se impossível\ncontrolar tanto o edema resultante da inflamação entre as artérias e os\nalvéolos pulmonares quanto a proliferação dos focos infecciosos que não\ncediam à pressão dos antibióticos. O organismo de Tancredo não esboçava\nquaisquer sintomas de reativação. Como recurso final foi chamado ao\nBrasil o especialista norte-americano Warren Mayron Zapol, que no dia 20\nde abril deu o seu diagnóstico definitivo: não havia mais o que fazer\npara salvar a vida do presidente.\n\nNa noite de 21 de abril, dia consagrado à descoberta do Brasil, ao\nmartírio de Tiradentes e à transferência da capital para Brasília,\nTancredo Neves faleceu, depois de cumprir um calvário de 34 dias. Após\nser embalsamado, seu corpo foi velado por toda a madrugada na capela do\nInstituto do Coração, na presença de parentes e amigos. Na manhã do dia\nseguinte, atendendo à solicitação do senador José Fragelli, o Congresso\nse reuniu extraordinariamente para anunciar a vacância do cargo e o seu\npreenchimento automático pelo vice-presidente José Sarney. Em\npronunciamento em cadeia de rádio e televisão, Sarney decretou feriado\nnacional e luto oficial por oito dias e garantiu que o seu programa\nseria o mesmo de Tancredo.\n\nAinda na manhã do dia 22, após a missa de corpo presente celebrada por\ndom Paulo Evaristo Arns, arcebispo metropolitano de São Paulo, no\nInstituto do Coração, o esquife presidencial, sobre um carro do corpo de\nbombeiros e coberto pela bandeira nacional, saiu em direção ao aeroporto\nde Congonhas, rumo a Brasília, acompanhado por dois milhões de pessoas.\nNo caminho, no obelisco do Parque do Ibirapuera, o presidente eleito\nrecebeu homenagem oficial do governo de São Paulo, do prefeito Mário\nCovas, do comando do II Exército e demais autoridades militares. Como\nhomengem póstuma a Tancredo, o Sindicato dos Metalúrgicos de São Paulo\ndeterminou a suspensão da greve da categoria em curso. Ao longo de todo\no trajeto pendiam das janelas das casas bandeiras brasileiras com tarjas\nnegras*.*\n\nNa capital da República, após um cortejo fúnebre que durou quatro horas,\nseguido por imensa multidão, o corpo de Tancredo foi velado e exposto à\nvisitação pública no palácio do Planalto, onde o arcebispo da cidade,\ndom José Freire Falcão, oficiou outra missa de corpo presente.\n\nNo dia 23 o corpo de Tancredo Neves chegou ao aeroporto de Pampulha, em\nBelo Horizonte, para receber no palácio da Liberdade as homenagens de\numa multidão calculada em torno de 1,8 milhão de pessoas. As cenas\nregistradas na capital mineira foram impressionantes. Tumultos na praça\nda Liberdade, provocados pela ansiedade popular em romper os cordões de\nisolamento, resultaram em quatro mortos e 271 feridos.\n\nFinalmente, no dia seguinte, 24 de abril, na presença de 50 mil pessoas,\nincluindo cinco presidentes estrangeiros e representantes de governos de\nvários países, Tancredo Neves foi enterrado com honras militares no\ncemitério da Igreja de São Francisco, em São João del Rei, sua terra\nnatal. Homem profundamente religioso, Tancredo era ministro\nvitalício-jubilado da venerável Ordem Terceira de São Francisco de\nAssis, na qual ingressou aos 16 anos. No cemitério discursaram o\npresidente José Sarney e o deputado Ulisses Guimarães. O presidente da\nCâmara emocionou os presentes ao afirmar: “Tancredo Neves, você foi duas\nvezes mais do que eleito, plebiscitado. Vivo, plebiscitado pela\nesperança para governar esta grande nação. Morto, plebiscitado pelas\nlágrimas, pelas preces, pela amargura e pelo pranto dos governantes que\nrestaram neste grande país.” O discurso de Sarney foi condensado na\nfrase: “Seu sonho será o nosso sonho”.\n\nQuase um ano após a morte de Tancredo, as divergências verificadas entre\nos membros da equipe médica que assistiu o presidente, e que teriam\ninfluído na orientação do tratamento aplicado, voltaram a ocupar espaço\nnos órgãos de comunicação com a decisão do Conselho Regional de Medicina\ndo Distrito Federal de submeter a julgamento ético os responsáveis pelas\nsete cirurgias efetuadas.\n\nAlém de reportagens que escreveu na juventude para o jornal *Estado de\nMinas* e *O Correio*, diário de São João del Rei, Tancredo foi autor de\n“O regime parlamentar e a realidade brasileira”, publicado na *Revista\nBrasileira de Estudos Políticos* (Belo Horizonte, UFMG, 1962), *O\npanorama mundial e a segurança nacional* (Rio de Janeiro, ESG, 1962), e\nde numerosos discursos e pareceres publicados em jornais, revistas e\nanais parlamentares. Em 24 de fevereiro de 1983 tomou posse, sucedendo a\nAlberto Deodato, na cadeira nº 12 da Academia Mineira de Letras,\npatrocinada por Alvarenga Peixoto.\n\nSobre a vida de Tancredo Neves foram produzidos o filme de\nlonga-metragem *A céu aberto*, de João Batista de Andrade, e a biografia\n*Tancredo Neves — a trajetória de um liberal* (1985), escrita por sua\nsobrinha Lucília de Almeida Neves Delgado e Vera Alice Cardoso a partir\nde depoimento dado pelo tio.\n\nTancredo Neves era casado com Risoleta Tolentino Neves, com quem teve\ntrês filhos. Sua filha Inês Maria foi casada com Aécio Cunha, deputado\nfederal por Minas entre 1963 e 1967 e membro, sucessivamente, do Partido\nRepublicano, da Arena e do PDS. Seu neto Aécio Neves foi constituinte em\n1987 e 1988 e deputado federal por Minas desde 1987. Seu sobrinho\nFrancisco Osvaldo Neves Dornelles foi ministro da Fazenda do governo de\nJosé Sarney em 1985, constituinte em 1987-1988. Exercendo mandato de\ndeputado federal pelo Rio de Janeiro desde 1987, ao longo desses anos\nfoi também ministro da Indústria e Comércio entre 1996 e 1998 e ministro\ndo Trabalho e Emprego a partir de 1999.\n\nO arquivo de Tancredo Neves encontra-se depositado no Cpdoc da Fundação\nGetulio Vargas.\n\nPlínio de Abreu Ramos/Patrícia Campos\n\n \n\nFONTES:*Almanaque Abril*(1975); ANDRADE, F. *Relação*;**ARQ. NAC.\n*Relação*;**BENEVIDES, M. *Governo Kubitschek*; CAFÉ FILHO, J.\n*Sindicato*;**CÂM. DEP. *Deputados*; CÂM. DEP. *Deputados brasileiros.\nRepertório* (6, 7 e 8); CÂM. DEP. *Relação nominal dos*\n*senhores*;**CISNEIROS, A. *Parlamentares*; COHN, G.\n*Petróleo*;**CONSULT. MAGALHÃES, B.; COSTA, M. *Cronologia*;*Diário*\n(15/7, 7 a 14/11, 14, 18 e 30/12/47); DULLES, J. *Getúlio*;*Encic.\nMirador*;**ENTREV. NICÁCIO, A.; *Estado de S. Paulo* (20/11/81); FED.\nESC. ISOLADAS DO EST. RJ. *Ministros*;**FICHÁRIO PESQ. M. AMORIM;\n*Globo*(28/9/61, 13/4 e 2/12/80, 27/7 e 27/9/81, 14/1/85 e\n2/12/90);*Grande encic.* *Delta*;*Jornal do Brasil*(7/7/79, 5/10/80,\n5/7/81 e 17/1/82); KUBITSCHEK, J. *Meu*(3); MACHADO, F. *Últimos*; MIN.\nFAZ. *Ministros*;**NÉRI, S. *16*;*Novo dic.* *de história*;*Perfil*(1972\ne 1980); *Rev. Arq.* *Públ. Mineiro*(12/76); SILVA, H. *1964*;**SOARES,\nE. *Instituições*;*Veja* (20/2/80); VIANA FILHO, L. *Governo*;**VÍTOR,\nM.*Cinco.*\n\n \n\n \n","ref":"FONTES:*Almanaque Abril*(1975); ANDRADE, F. *Relação*;**ARQ. NAC.\n*Relação*;**BENEVIDES, M. *Governo Kubitschek*; CAFÉ FILHO, J.\n*Sindicato*;**CÂM. DEP. *Deputados*; CÂM. DEP. *Deputados brasileiros.\nRepertório* (6, 7 e 8); CÂM. DEP. *Relação nominal dos*\n*senhores*;**CISNEIROS, A. *Parlamentares*; COHN, G.\n*Petróleo*;**CONSULT. MAGALHÃES, B.; COSTA, M. *Cronologia*;*Diário*\n(15/7, 7 a 14/11, 14, 18 e 30/12/47); DULLES, J. *Getúlio*;*Encic.\nMirador*;**ENTREV. NICÁCIO, A.; *Estado de S. Paulo* (20/11/81); FED.\nESC. ISOLADAS DO EST. RJ. *Ministros*;**FICHÁRIO PESQ. M. AMORIM;\n*Globo*(28/9/61, 13/4 e 2/12/80, 27/7 e 27/9/81, 14/1/85 e\n2/12/90);*Grande encic.* *Delta*;*Jornal do Brasil*(7/7/79, 5/10/80,\n5/7/81 e 17/1/82); KUBITSCHEK, J. *Meu*(3); MACHADO, F. *Últimos*; MIN.\nFAZ. *Ministros*;**NÉRI, S. *16*;*Novo dic.* *de história*;*Perfil*(1972\ne 1980); *Rev. Arq.* *Públ. Mineiro*(12/76); SILVA, H. *1964*;**SOARES,\nE. *Instituições*;*Veja* (20/2/80); VIANA FILHO, L. *Governo*;**VÍTOR,\nM.*Cinco.*\n\n \n\n \n","dic":"DHBB"}
