{"title":"NEWTON, José","cargoss":["Arcebispo"],"cargos_esp":["Brasília"],"datas_ini":[1960],"datas_fim":[1984],"estados":[0],"content":"**NEWTON, José**\n\n\\*religioso; arceb. Brasília 1960-1984.\n\n \n\n*José Newton de Almeida Batista Pereira nasceu em Niterói, então capital\ndo estado do Rio de Janeiro, no dia 16 de outubro de 1904, filho de\nBaltazar Bernardino Batista Pereira e de Maria Carolina de Almeida\nBatista Pereira.*\n\nFez o ginásio no Seminário Menor de São Paulo, como seminarista da\narquidiocese do Rio de Janeiro, e completou os estudos de filosofia e de\nteologia na Universidade Gregoriana, em Roma, licenciando-se em\nfilosofia em 1925. Ainda em Roma, ordenou-se sacerdote em outubro de\n1928 e no ano seguinte doutorou-se em teologia.\n\nEm 1930, de volta ao Rio de Janeiro, então Distrito Federal, foi\ndesignado vigário cooperador na paróquia de São João Batista da Lagoa.\nEm 1931 substituiu o vigário de Inhaúma, sendo depois nomeado pároco de\nOsvaldo Cruz, onde se estabeleceu durante dois anos. Em 1933 ocupou o\nmesmo posto em Paquetá e em 1936 passou a pároco de Santa Cruz,\nexercendo também em 1938 o cargo de diretor da Comissão Arquidiocesana\nde Santificação das Famílias. Permaneceu em Santa Cruz até 1940, quando\nassumiu a função de capelão da igreja de Nossa Senhora da Glória do\nOuteiro, tornando-se ainda professor do Seminário do Rio Comprido e\ndiretor arquidiocesano das vocações sacerdotais. Em 1941 tornou-se\ncapelão também do Colégio Notre Dame de Sion e em 1942 foi cônego\ncatedrático do cabido metropolitano.\n\nEm agosto de 1944 deixou o Rio de Janeiro, sendo sagrado bispo diocesano\nde Uruguaiana (RS), onde ficou até 1954, quando foi nomeado arcebispo\nmetropolitano de Diamantina (MG). Ocupou essa posição até 1960, ano em\nque foi nomeado arcebispo de Brasília (DF), a nova capital do país,\ninaugurada em abril e construída durante o governo do presidente\nJuscelino Kubitschek (1956-1960). Em 1963 foi nomeado vigário militar do\nBrasil e em 1967 recebeu o título de arcebispo metropolitano. Foi membro\nda Comissão Central da Conferência Nacional dos Bispos do Brasil (CNBB)\ne da Previdência do Clero, bem como dos congressos eucarísticos\ninternacionais.\n\nArcebispo de Brasília desde 1960, concordou com todos os governos que se\nsucederam desde Juscelino Kubitschek até os militares. Em 1979, ao\natingir 75 anos, conforme o decreto pontifício, colocou seu cargo à\ndisposição da Santa Sé.****No ano seguinte foi-lhe concedida a\naposentadoria, e foi substituído pelo arcebispo de Teresina, dom José\nFreire Falcão. Designado bispo emérito de Brasília, continuou exercendo\no sacerdócio e manteve o cargo de bispo castrense, vigário responsável\npela supervisão dos capelães militares do país.\n\nFaleceu em Brasília, aos 97 anos, no dia 11 de novembro de 2001.\n\nPublicou a obra *Voz do pastor*, constituída de oito volumes.\n\n*Bruno Marques*\n\n*(atualização)*\n\n \n\n \n\n**FONTES**: BARBOSA, D.D.L. *Canção Nova ;*CONFERÊNCIA NAC. BISPOS DO\nBRASIL; CURRIC. BIOG.; GARDEL, L. *Armoiries; Grande* *encic. Delta.*;\nPortal da Câmara dos Deputados. *Consulta.* Disponível em :\n\\<[http://www.camara.gov.br/sileg/](http://www.camara.gov.br/sileg/)\n\n[Prop](http://www.camara.gov.br/sileg/Prop)[\\_Detalhe.asp?id=169973](http://www.camara.gov.br/sileg/Prop_Detalhe.asp?id=169973)\\>.\nAcesso em : 01 set. 2009; *Veja*(7/3/84).\n\n \n\n                                                                                \n** **\n\n \n\n \n\n \n\n \n\n \n","ref":"","dic":"DHBB"}
