{"title":"NOGUEIRA, Adalício","cargoss":["Ministro do Supremo Tribunal Federal"],"cargos_esp":[0],"datas_ini":[1965],"datas_fim":[1972],"estados":[0],"autor":[0],"content":"**NOGUEIRA, Adalício**\n\n\\*magistrado; min. STF 1965-1972.\n\n \n\n*Adalício Coelho Nogueira* nasceu em Inhambupe (BA) no dia 13 de\nfevereiro de 1902, filho de Francisco da Silva Nogueira e de Maria\nCoelho Nogueira.\n\nDiplomou-se pela Faculdade de Direito da Bahia em 1924 e desse ano até\n1929 foi promotor público no estado, passando então a juiz de direito.\nEm 1943 tornou-se catedrático de direito romano na Faculdade de Direito\nda Bahia e, no ano seguinte, foi promovido a desembargador. Foi ainda\nprefeito de Salvador de fevereiro de 1945 a fevereiro de 1946. Presidiu\no Tribunal Regional Eleitoral baiano de 1950 a 1954 e, de 1962 a 1963,\nfoi presidente do Tribunal de Justiça do estado, ocasião em que chegou a\nocupar interinamente por três meses o cargo de governador, durante a\nausência do titular Juraci Magalhães (1959-1963).\n\nApós o movimento político-militar de 31 de março de 1964, foi nomeado\nministro do Supremo Tribunal Federal (STF) em novembro de 1965, função\nque exerceu até 1972.\n\nFoi membro da Academia Baiana de Letras e do Instituto Geográfico e\nHistórico da Bahia.\n\nFaleceu em 31 de agosto de 1990.\n\nEra casado com Maria Sá Nogueira, com quem teve cinco filhos.\n\nPublicou *Aspectos da pessoa física no direito romano*(tese, 1966),\n*Introdução ao estudo* *do direito romano* (1967)**e*Caminhos de um*\n*magistrado*(memórias, 1978), além de artigos jurídicos.\n\nFONTES: BALEEIRO, A. *Supremo*;**COUTINHO, A. *Brasil*;*Grande encic.\nDelta*; INF. SUPR. TRIB. FED.\n\n \n\n \n","ref":"FONTES: BALEEIRO, A. *Supremo*;**COUTINHO, A. *Brasil*;*Grande encic.\nDelta*; INF. SUPR. TRIB. FED.\n\n \n\n \n","dic":"DHBB"}
