{"title":"ARZUA, Ivo","cargoss":["Prefeito","Ministro da Agricultura"],"cargos_esp":["Curitiba",0],"datas_ini":[1963,1967],"datas_fim":[1967,1969],"estados":[0,0],"content":"**ARZUA, Ivo**\n\n\\*pref. Curitiba 1963-1967; min. Agric. 1967-1969.\n\n \n\n*Ivo Arzua Pereira* nasceu em Palmeira (PR) no dia 29 de abril de 1925,\nfilho de José da Silva Pereira e de Emília Arzua Pereira.\n\nFez o curso primário nos grupos escolares Jesuíno Marcondes, de\nPalmeira, e Barão do Rio Branco, de Curitiba, e concluiu o curso\nsecundário no Ginásio Paranaense, hoje Colégio Estadual do Paraná.\nCursou engenharia civil na Escola de Engenharia da Universidade do\nParaná, pela qual se diplomou em 1948.\n\nIngressou no serviço público em 1943, como desenhista auxiliar da\nSecretaria de Viação e Obras Públicas do Paraná. Transferiu-se em 1948\npara o Departamento Estadual de Estradas de Rodagem (DER), onde exerceu\nvários cargos, até ser nomeado, em 1953, superintendente da\nadministração do porto de Paranaguá. No ano seguinte, foi nomeado\nengenheiro-chefe da Comissão Especial de Obras do Centenário do estado,\nfunção em que concluiu, em Curitiba, o palácio Iguaçu, o Tribunal do\nJúri, a avenida Cândido de Abreu, a Biblioteca Pública e outros prédios,\nvoltando em seguida ao DER.\n\nEntre 1956 e 1959, foi diretor-administrativo da Diesel Máquinas S.A. Em\n1956 foi professor instrutor, assistente e ajunto da Universidade\nFederal do Paraná (UFPR) nas cadeiras de Estatística, Economia Política\ne Finanças. No ano de 1960 também lecionou Geometria Analítica e Cálculo\nNumérico. Entre 1961 e 1963 foi presidente do Instituto de Engenharia do\nParaná (IEP). Em 1961, foi designado assistente do diretor do\nDepartamento de Águas e Energia Elétrica do estado e, em seguida,\nassessor de organização e métodos do secretário da Fazenda do Paraná.\nVoltou em 1962 ao DER, de onde se demitiu para se candidatar à\nprefeitura de Curitiba, apoiado por uma coligação de partidos: Partido\nDemocrata Cristão (PDC), União Democrática Nacional (UDN), Partido\nTrabalhista Nacional (PTN) e Partido Libertador (PL).\n\nEleito em 7 de outubro de 1962, em agosto de 1963 participou do curso de\nsegurança nacional promovido em Curitiba pela Associação dos Diplomados\nda Escola Superior de Guerra (ADESG). Participou com destaque, em âmbito\nestadual, do movimento político-militar de 31 de março de 1964, tendo\nsido um dos fundadores da Aliança Renovadora Nacional (Arena), partido\nde sustentação do regime militar então instaurado no país. Foi também\nprofessor da Escola de Oficiais Especialistas e de Infantaria de Guarda\nda Aeronáutica (EOEG-M.Aer.).\n\nTerminando em 15 de novembro de 1966 seu mandato de prefeito de\nCuritiba, foi reconduzido ao cargo 15 dias depois por ato do governador\ndo estado, Paulo Pimentel, de acordo com a nova legislação, que\nsuprimira o pleito direto para a eleição dos prefeitos das capitais.\nEscolhido para ocupar a pasta da Agricultura pelo presidente eleito\nArtur da Costa e Silva, renunciou ao cargo para assumir o ministério na\ndata da posse do novo governo (15/3/1967).\n\nDurante sua gestão, o presidente Costa e Silva interveio (22/7/1968) no\nInstituto Brasileiro de Reforma Agrária (IBRA), afastando três diretores\nacusados de praticar irregularidades na compra de aviões para o órgão e\nem processos de desapropriação de terras no Paraná. No início de\nsetembro de 1968, foi criado por decreto o Grupo Executivo da Reforma\nAgrária (GERA), que só viria a funcionar no ano seguinte. Em termos\nimediatos, um corpo especial de trabalho da reforma agrária foi\nencarregado de estudar a incidência e a aplicação do Imposto Territorial\nRural, a revisão do Estatuto da Terra, novas formas de desapropriação e\nde regime de propriedade, e a fusão do IBRA com o Instituto Nacional de\nDesenvolvimento Agrário (INDA), que iria ocorrer em julho de 1970, dando\norigem ao Instituto Nacional de Colonização e Reforma Agrária (INCRA).\nEm 13 de dezembro de 1968, como membro do ministério, foi um dos\nsignatários do Ato Institucional nº 5 (AI-5).\n\nO primeiro resultado dos estudos realizados pelo Corpo Especial de\nTrabalho da Reforma Agrária foi a assinatura, em 27 de fevereiro de\n1969, do Ato Institucional nº 8 e de três decretos, regulamentando a\nreforma agrária e dispondo sobre a desapropriação de terras, a\nreestruturação do IBRA e do INDA e a criação da Associação de Reforma\nAgrária (ARA), destinada a promover o cooperativismo. Logo em seguida,\ncomeçou a funcionar o GERA. No dia 25 de abril de 1969, o presidente\nCosta e Silva assinou o Ato Institucional nº 9, que estabelecia as\ncondições para a realização da reforma agrária, facilitando, em relação\nà Emenda Constitucional nº 10, de 9 de novembro de 1964, o pagamento das\nterras desapropriadas, através da supressão da palavra “prévia” das\ncondições impostas às indenizações.\n\nAs áreas definidas como prioritárias para a execução da reforma agrária\nforam os estados onde, segundo as autoridades, havia tensões sociais:\nRio Grande do Sul, Ceará, Rio de Janeiro, Minas Gerais e Pernambuco. Em\njunho, durante visita ao Brasil, o diretor-geral da Organização para\nAlimentação e Agricultura da Organização das Nações Unidas (FAO — Food\nand Agriculture Organization) afirmou que o órgão apoiava integralmente\no projeto do governo brasileiro. No dia 10 de julho, em conferência\npronunciada na Academia Nacional de Polícia, Ivo Arzua afirmou que os\ngrupos de proprietários de terras, banqueiros e industriais, dispondo de\ncapitais e acesso aos órgãos de formação de opinião pública, saíam\nvitoriosos no jogo de pressões sobre os poderes governamentais, em\ndetrimento do desenvolvimento agrícola. Anunciou pouco depois, em\nagosto, que o GERA possuía a indicação de 198 municípios com grandes\npossibilidades para a execução da reforma agrária, mas esses municípios\nnão foram identificados. Ainda durante sua gestão, surgiram problemas\nligados à exportação do café, suscitando, em várias ocasiões, protestos\nde produtores.\n\nComo seus colegas de ministério, permaneceu no governo durante o período\nda junta militar, iniciado em 31 de agosto de 1969, e deixou o\nMinistério da Agricultura com a posse do general Emílio Garrastazu\nMédici, em 30 de outubro do mesmo ano, retirando-se da vida pública.\n\nDe 1969 a 1971 foi diretor-presidente da Companhia de Telecomunicações\ndo Paraná (Telepar) e presidiu também o conselho administrativo do Fundo\nNacional de Telefones. De 1970 a 1975 foi membro da Comissão de Ensino\nSuperior do Conselho Estadual de Educação. Em 1971 e 1972, foi diretor e\ndiretor-presidente, respectivamente, das construtoras Sinoda e\nBorichello. Passou a lecionar estatística no Departamento de Informática\nda Universidade Federal do Paraná e criou uma firma de engenharia, o\nGrupo Técnico Arzua (GTA), da qual se tornou diretor-superintendente.\n\nEm junho de 1974, anunciou seu desligamento da Arena. Em agosto de 1977,\ndefendeu a convocação de uma assembléia nacional constituinte. Em\ndezembro, incorporou-se ao grupo de signatários do AI-5 que passaram a\ndefender sua revogação. Em março de 1978, convidou o tenente-coronel\nTarcísio Nunes Ferreira a fazer, no Lions Club de Ponta Grossa (PR), um\ndiscurso, no qual o oficial pediu a total redemocratização do país, o\nque determinou a decretação de sua prisão. Arzua manifestou-lhe, então,\nseu apoio.\n\nEm dezembro de 1978, fez declarações contra a corrupção nas esferas\ngovernamentais, afirmando que as autoridades acusadas deveriam tomar a\niniciativa de pedir a abertura de inquéritos. Declarou ainda ter sido\nvoto vencido quando da edição do AI-5, pois votara a favor de um ato que\n“permitisse a convocação de uma constituinte imediatamente após o\nfechamento do Congresso”, e afirmou que “os governos revolucionários\ntêm-se mantido à distância do povo… e, por isso mesmo, as conquistas\npolíticas e sociais têm voltado à estaca zero”. Em janeiro de 1980,\nreiterou ser partidário da convocação de uma assembléia constituinte e\nmanifestou-se favorável à política de “abertura democrática” do\npresidente João Batista Figueiredo, mas declarou não pretender ingressar\nem nenhum dos novos partidos em formação por ser contrário à orientação\nda reforma partidária desencadeada pelo governo.\n\nSuperintendente e presidente do conselho diretor do Instituto de\nPrevidência e Assistência aos Servidores do Estado do Paraná de 1982 a\n1983, no exercício dessas funções promoveu a reorganização\nadministrativa do órgão, interiorizando seus serviços mediante a criação\nde coordenadorias e agências em vários municípios do estado.\n\nRetirando-se da vida pública, exerceu diversas atividades, como a\nparticipação na Comissão Nacional de Pólio Plus, responsável pela\nimplementação no Brasil do Programa Pólio Plus do Rotary International,\ne como fundador e presidente da Academia Cultural de Curitiba (ACCUR).\n\nEm 1986, foi professor visitante da Associação Paranaense de Ensino e\nCultura. No ano seguinte, tornou-se membro do Conselho de\nDesenvolvimento da Pontifícia Universidade Católica do Paraná (PUC-PR),\nonde permaneceu até 1997. Desde 1998 é acadêmico conselheiro da Academia\nNacional de Engenharia (ANE). Entre 1998 e 2001 foi presidente da\nConfederação Internacional das Misericórdias (Santas Casas). Embora\nafastado da política, continou escrevendo artigos e proferindo palestras\nsobre vários aspectos da administração pública ao longo da década de\n2000 e mantendo o website http://www.arzua.com.br/.\n\nCasado com Maria Helena Sotomaior Pereira, teve dois filhos.\n\nEscreveu *A estratégia do grande impulso*(1970), *Com licença, sr.\ncandidato — o desafio brasileiro*(1983), *Vamos continuar semeando*\n(1983), *A epopéia das Misericórdias* (1993), *Um sopro de eternidade*\n(1995, em co-autoria com seu irmão Arnaldo Arzua Pereira), *O jubileu do\ncristianismo ano 2000 e a bula Inter Gravíssimas* (2000) e *No século\nXXI e no milênio, há que continuar semeando...* (2001).\n\nMauro Malin\n\n \n\n \n\n**FONTES**: FIECHTER, G. *Regime; Grande* *encic. Delta; História do\nParaná*(3);*Jornal do* *Brasil*(28/8**e 16/12/77; 10/3 e 28/10/78 e\n18/1/80); KLEIN, L. *Cronologia;*MAGALHÃES, I.*Segundo; Súmulas;*Site\nIvo Arzua Pereira. Disponível em: \\<http://www.arzua.com.br\\>. Acesso\nem: 11 out. 2009.\n","ref":"","dic":"DHBB"}
