{"title":"NOGUEIRA, Rubem","cargoss":["Deputado federal","Deputado federal","Deputado federal"],"cargos_esp":[0,0,0],"datas_ini":[1967,1965,1961],"datas_fim":[1971,1965,1963],"estados":["BA","BA","BA"],"autor":[0],"content":"**NOGUEIRA, Rubem**\n\n\\*  dep. fed. BA 1961-1963, 1965 e 1967-1971.\n\n \n\n*Rubem Rodrigues* *Nogueira*nasceu em Serrinha (BA) no dia 13 de\nsetembro de 1913, filho de Luís Osório Rodrigues Nogueira e de Áurea\nRibeiro Nogueira.\n\nBacharelou-se em ciências jurídicas e sociais pela Faculdade de Direito\nda Universida­de da Bahia em 1937.\n\nIniciou sua carreira política elegendo-se, em janeiro de 1947, deputado\nà Assembléia Legislativa da Bahia na legenda do Partido de Representação\nPopular (PRP).  Em outubro de 1950 candidatou-se a deputado federal na\nlegenda da Coligação Baiana, formada pelo PRP, o Partido Social\nDemocrático (PSD) e o Partido Social Trabalhista (PST), conseguindo\napenas a terceira suplência. Deixando a As­sembléia em janeiro de 1951,\na partir desse ano tornou-se procurador-geral da Justiça do Estado da\nBahia, função que exerceria até 1954, quando se elegeu novamente\ndeputado à Assembléia Legislativa na legenda do PRP.\n\nEm 1956, tornou-se professor titular de introdução à ciência do direito\nna Faculdade de Direito da Pontifícia Universidade Católica (PUC) da\nBahia.\n\nDois anos depois, no mês de outubro, disputou uma cadei­ra na Câmara dos\nDeputados pela Bahia na legenda da Aliança Democrática Popular, for­mada\npelo PSD e o PRP, conseguindo a segunda suplência. Em janeiro de 1959\ndeixou a Assembléia Legislativa baiana e em fevereiro de 1961 assumiu o\nmandato de deputado federal. Participou da delegação de deputados que em\n1962 visitou Portugal e suas então colônias de Angola e Moçambique, a\nconvite do governo português. No pleito de outubro desse ano conseguiu a\nprimeira suplência de deputado federal pela Bahia na legenda da Aliança\nTrabalhista, formada pelo PRP, o Partido Trabalhista Brasileiro (PTB) e\no Parti­do Republicano (PR). Deixando a Câmara em janeiro de 1963,\nvoltou a exercer mandato em abril, maio, agosto e setembro desse ano, e\nde março a setembro de 1965*.*\n\nCom a extinção dos partidos políticos pelo Ato Institucional nº.2, em\noutubro de 1965, e a posterior instauração do bipartidarismo, filiou-se\nà Aliança Renovadora Nacional (Are­na), partido de sustentação do regime\nmilitar vigente no país desde abril de 1964. Nesse ano e no seguinte foi\nprocurador-­geral da Prefeitura de Salvador. Em novembro de 1966\nelegeu-se deputado federal pela Bahia na legenda da Arena, assumindo sua\ncadeira em fevereiro do ano seguinte. Deixou a Câmara dos Deputados em\njaneiro de 1971, ao concluir seu mandato.\n\nApós oito anos dedicados a atividades particulares, em 1979 Rubem\nNogueira assumiu o cargo de consultor do Ministério da Justiça, pasta\nentão comandada por Petrônio Portela, aí permanecendo até 1981, já na\ngestão de Ibrahim Abi-Ackel. Nesse período, segundo o biografado, foi\nele que deu o parecer baseado no qual foi redigido projeto de lei da\nanistia, assinada pelo presidente da República, general João Batista\nFigueiredo, em agosto de 1979.\n\nDe volta a Salvador, reassumiu a cátedra de professor titular da PUC da\nBahia, ocupando-a até 1991. A partir de então, dedicou-se à advocacia.\n\nTornou-se membro do Conselho da Ordem dos Advogados do Brasil (seção da\nBahia).\n\nCasou-se com Gilca Felloni de Matos No­gueira, com quem teve sete\nfilhos.\n\nEscreveu, além de artigos e textos publicados em revistas e coletâneas,\n*O advogado Rui Barbosa* (1949), *História de Rui\nBarbosa*(1954),*Pareceres do* *procurador-geral da Justiça*(1954),*Rui e\na* *técnica da advocacia*(1956), *Condições jurídi*­*cas das riquezas\nminerais do subsolo*(1960), *Greve e serviço público* (1966),\n*Introdução ao estudo do direito* (1978), *O homem e o muro: memórias\npolíticas e outras*(1997) e *Rui Barbosa, combatente da legalidade*\n(1999).\n\n \n\nFONTES: CÂM. DEP. *Deputados*; CÂM. DEP.*Deputados brasileiros.\nRepertório* (1967-1971)*;* *Grande encic. Delta*; INF. BIOG.; * *TRIB.\nSUP. ELEIT. *Dados*(1, 2, 3, 4 e 6).\n\n \n\n \n\n \n\n \n\n \n","ref":"FONTES: CÂM. DEP. *Deputados*; CÂM. DEP.*Deputados brasileiros.\nRepertório* (1967-1971)*;* *Grande encic. Delta*; INF. BIOG.; * *TRIB.\nSUP. ELEIT. *Dados*(1, 2, 3, 4 e 6).\n\n \n\n \n\n \n\n \n\n \n","dic":"DHBB"}
