{"title":"NOLASCO, Ângelo","cargoss":["Ministro da Marinha"],"cargos_esp":[0],"datas_ini":[1961],"datas_fim":[1962],"estados":[0],"autor":[0],"content":"**NOLASCO, Ângelo**\n\n\\*militar; min. Mar. 1961-1962.\n\n \n\n*Ângelo Nolasco de Almeida* nasceu no Rio de Janeiro, então Distrito\nFederal, no dia 13 de dezembro de 1905, filho de Teófilo Nolasco de\nAlmeida, oficial de Marinha e engenheiro civil, e de Zulmira Mascarenhas\nde Almeida.\n\nApós cursar o Ateneu Bôscoli e a Escola de Humanidades, sentou praça em\nmarço de 1923 ingressando na Escola Naval, da qual saiu guarda-marinha\nem janeiro de 1927. Em março e abril serviu no cruzador *Bahia*e em\nsetembro foi promovido a segundo-tenente, embarcando no mês seguinte no\nencouraçado *Minas Gerais*.**Em outubro de 1929 foi promovido a\nprimeiro-tenente e designado para o contratorpedeiro *Pará*,**no qual\npermaneceu até fevereiro de 1930.\n\nApós a Revolução de 1930, que conduziu Getúlio Vargas ao poder, serviu\nnos contratorpedeiros *Pará*e*Paraíba*,**de fevereiro a março de 1931, e\nno cruzador *Rio Grande do Sul*,**de março a abril seguintes. Neste\núltimo mês foi designado para o encouraçado *São Paulo*,**no qual ficou\naté dezembro, quando foi nomeado ajudante-de-ordens do diretor do\nArsenal de Marinha do Rio de Janeiro. Em 1932 participou das operações\nnavais de repressão à Revolução Constitucionalista, movimento armado de\noposição ao governo Vargas, deflagrado em São Paulo em julho e sufocado\nno início de outubro pelas forças legalistas.\n\nPromovido a capitão-tenente em novembro de 1932, ainda nesse mês deixou\no Arsenal de Marinha, voltando a servir no cruzador *Rio Grande do\nSul,*de janeiro de 1933 a maio de 1934, e no encouraçado *São Paulo*,\nentre julho e setembro deste último ano. Em março de 1937 foi designado\nchefe de máquinas do contratorpedeiro *Piauí*, no qual exerceu também as\nfunções de imediato, de abril a junho de 1938. De janeiro de 1939 a\nfevereiro de 1943 foi ajudante-de-ordens do presidente Getúlio Vargas e\ndepois subchefe interino do Gabinete Militar da Presidência da\nRepública, tendo passado a capitão-de-corveta no exercício deste último\ncargo.\n\nEm março de 1943 foi nomeado adido naval junto às embaixadas do Brasil\nna Argentina e no Uruguai, função que desempenhou por pouco mais de um\nano. De volta ao Brasil, foi designado em junho imediato do navio tênder\n*Belmonte*,**no qual serviu até março de 1946. Do mês seguinte a janeiro\nde 1947 comandou o contratorpedeiro*Beberibe*,**tendo ocupado\nsimultaneamente, de setembro a outubro de 1946, o comando interino da 2ª\nFlotilha de Contratorpedeiros. Em março de 1947 tornou-se secretário da\nchefia do Departamento Administrativo da Escola de Guerra Naval, em\ndezembro do mesmo ano foi promovido a capitão-de-fragata e, de maio a\njunho de 1948, ocupou a chefia daquele departamento.\n\nDe janeiro de 1949 a abril de 1951, foi chefe da**Divisão Militar do\nArsenal de Marinha do Rio de Janeiro. Nesse período, ainda em fevereiro\nde 1951, foi designado subchefe do gabinete do ministro da Marinha,\nalmirante Renato Guillobel, cargo que ocupou até maio de 1952, quando\npassou a chefe de gabinete. Em março de 1953 foi promovido a\ncapitão-de-mar-e-guerra e em junho de 1954 deixou suas funções para\nservir como adido naval da embaixada do Brasil na Espanha. Em novembro\nde 1955 retornou ao Rio de Janeiro e foi nomeado chefe do estado-maior\ndo I Distrito Naval (DN), sediado no Rio de Janeiro, onde permaneceu até\nabril de 1956. Em maio seguinte foi nomeado capitão-dos-portos do estado\nde São Paulo, cargo que deixou em agosto de 1957, um mês antes de\nassumir o comando do navio-transporte *Barroso Pereira*.\n\nEm janeiro de 1959 foi promovido a contra-almirante e designado subchefe\npara informações e operações do Estado-Maior da Armada (EMA).\nPosteriormente, ocupou a presidência da Comissão de Marinha Mercante,\nretornando em abril de 1961 às suas funções no EMA, que exercia no dia\n25 de agosto, quando o presidente Jânio Quadros renunciou.\n\nAprovada a Emenda Constitucional nº 4 e empossado João Goulart na\npresidência da República no dia 7 de setembro de 1961, ainda nesse mês\nÂngelo Nolasco foi nomeado ministro da Marinha do primeiro gabinete\nparlamentarista, chefiado por Tancredo Neves. Em abril de 1962, no\nexercício do cargo, foi promovido a vice-almirante, tendo permanecido no\nministério até 26 de junho seguinte, quando todo o gabinete renunciou em\nvirtude da radicalização da crise política no país.\n\nApós sair do Ministério da Marinha, onde foi substituído pelo almirante\nda reserva Heitor Doyle Maia, Ângelo Nolasco integrou o Conselho do\nAlmirantado, como membro conselheiro, e foi nomeado delegado da Marinha\nna Junta Interamericana de Defesa, em Washington, e assessor do\nembaixador brasileiro junto à Organização dos Estados Americanos (OEA),\nIlmar Pena Marinho. Em dezembro de 1965, já após o movimento\npolítico-militar de 1964 e durante o governo do marechal Humberto\nCastelo Branco, ao ser preterido na promoção a almirante, pediu\ntransferência para a reserva, sendo promovido, concomitantemente, a\nalmirante-de-esquadra e a almirante.\n\nEm 1986, concedeu entrevista ao setor de história oral do Centro de\nPesquisa e Documentação de História Contemporânea do Brasil (Cpdoc) da\nFundação Getulio Vargas do Rio de Janeiro.\n\nDurante sua carreira militar, fez ainda os cursos de especialização em\nmáquinas para oficiais, preliminar de comando e superior da Escola de\nGuerra Naval.\n\nFaleceu no Rio de Janeiro, no dia 8 de julho de 1996.\n\nEra casado com Neusa Saya Nolasco de Almeida. Não teve filhos.\n\n \n\nFONTES: CORRESP. SERV. DOC. GER. MAR.; CURRIC. BIOG.; *Encic.*\n*Mirador*;**ENTREV. BIOG.; *Grande encic. Delta*;**MIN. MAR.\n*Almanaque*(1965); PEIXOTO, A. *Getúlio*; SERV. DOC. GER. MARINHA.\n\n \n\n \n","ref":"FONTES: CORRESP. SERV. DOC. GER. MAR.; CURRIC. BIOG.; *Encic.*\n*Mirador*;**ENTREV. BIOG.; *Grande encic. Delta*;**MIN. MAR.\n*Almanaque*(1965); PEIXOTO, A. *Getúlio*; SERV. DOC. GER. MARINHA.\n\n \n\n \n","dic":"DHBB"}
