{"title":"NORMATON, Hary","cargoss":["Deputado federal"],"cargos_esp":[0],"datas_ini":[1959],"datas_fim":[1969],"estados":["SP"],"autor":[0],"content":"**NORMATON, Hary**\n\n\\*dep. fed. SP 1959-1969.\n\n \n\n*Hary Normanton* nasceu em Jundiaí (SP) no dia 19 de agosto de 1922,\nfilho de João Normanton Júnior e de Benedita Normanton.\n\nFerroviário, foi vereador em seu município natal por duas vezes,\nexercendo mandato de 1952 a 1958. Com o apoio de sua categoria,\ncandidatou-se a deputado federal por São Paulo no pleito de outubro\ndeste último ano, sendo eleito pela Aliança Popular Nacionalista —\ncoligação formada pelo Partido Socialista Brasileiro (PSB) e o Partido\nTrabalhista Nacional (PTN). Ao final dessa legislatura, iniciada em\nfevereiro de 1959, aliou-se a Ademar de Barros no combate à influência\ncomunista nos sindicatos.\n\nReeleito em outubro de 1962 pela Coligação Janista, formada pelo PTN e o\nMovimento Trabalhista Renovador (MTR), transferiu-se posteriormente para\no Partido Social Progressista (PSP), agremiação ademarista. Nesta\nlegislatura, participou da Comissão do Salário Mínimo em São Paulo.\n\nCom a extinção dos partidos políticos pelo Ato Institucional nº 2\n(27/10/1965) e a posterior instauração do bipartidarismo, filiou-se à\nAliança Renovadora Nacional (Arena), partido que dava sustentação\npolítica ao regime militar instaurado no país em abril de 1964. Dois\nanos depois, em novembro de 1966, foi mais uma vez reeleito para o\nLegislativo federal, permanecendo na Câmara até janeiro de 1969, quando\nteve seu mandato cassado por força do Ato Institucional nº 5, editado em\ndezembro do ano anterior.\n\nDeixando a política, retornou às oficinas da Ferrovias Paulistas S.A.\npara completar o tempo exigido para sua aposentadoria. Depois disso,\nrecolheu-se em sua chácara, onde se dedicou à criação de aves e ao\nplantio de flores e hortaliças.\n\nFaleceu em Jundiaí no dia 6 de janeiro de 1978, vitimado por um enfarte.\n\nEra casado com Ilda Pedroso Normanton, com quem teve dez filhos.\n\nPublicou *Salário-família*,*adicional por* *tempo de serviço,\nprêmio-assiduidade e licença-prêmio aos ferroviários da Cia. Paulista\nde* *Estrada de Ferro.*\n\n \n\nFONTES: ARQ. DEP. PESQ. JORNAL DO BRASIL; CÂM. DEP. *Deputados;*CÂM.\nDEP*. Deputa-dos brasileiros. Repertório* (1967-1971); INF. Alexandra\nNormanton; TRIB. SUP. ELEIT. *Dados*(4, 6 e 8).\n\n \n\n \n","ref":"FONTES: ARQ. DEP. PESQ. JORNAL DO BRASIL; CÂM. DEP. *Deputados;*CÂM.\nDEP*. Deputa-dos brasileiros. Repertório* (1967-1971); INF. Alexandra\nNormanton; TRIB. SUP. ELEIT. *Dados*(4, 6 e 8).\n\n \n\n \n","dic":"DHBB"}
