{"title":"NORONHA FILHO, Oscar","cargoss":["Deputado federal"],"cargos_esp":["GB"],"datas_ini":[1964],"datas_fim":[1967],"estados":[0],"autor":[0],"content":"**NORONHA FILHO, Oscar**\n\n\\*dep. fed. GB 1964-1967.\n\n*Oscar Noronha Filho***nasceu em Caxambu (MG) no dia 9 de janeiro de\n1916, filho de Oscar Noronha e de Ester Sá Noronha.\n\nCursou o secundário no Ginásio Sul Mineiro, em Itanhandu (MG).\nTransferindo-se para Belo Horizonte, tornou-se funcionário da prefeitura\nda capital mineira em 1936, na qual permaneceria até 1940.\nParalelamente, cursou a Faculdade de Direito da Universidade de Minas\nGerais, bacharelando-se em dezembro de 1939. Entre 1943 e 1944, serviu\nna Força Expedicionária Brasileira (FEB), durante a Segunda Guerra\nMundial.\n\nRadicado no Rio de Janeiro, então capital federal, foi escrevente\njuramentado do 16º Ofício de Notas e técnico de administração da\nPrefeitura do Distrito Federal.\n\nFiliado ao Partido Trabalhista Brasileiro (PTB), elegeu-se no pleito de\noutubro de 1962 suplente de deputado federal pela Guanabara na legenda\nda Aliança Socialista Trabalhista, coligação formada pelo PTB e o\nPartido Socialista Brasileiro (PSB). Em abril de 1964, logo após a\nvitória do movimento político-militar de março daquele ano, que depôs o\npresidente João Goulart (1961-1964), assumiu uma cadeira na Câmara dos\nDeputados, no lugar de Leonel Brizola, que tivera seu mandato cassado e\nseus direitos políticos suspensos pelo Ato Institucional nº 1. Com a\nextinção dos partidos políticos pelo Ato Institucional nº 2 (27/10/1965)\ne a posterior instauração do bipartidarismo, filiou-se ao Movimento\nDemocrático Brasileiro, agremiação de oposição ao regime militar.\nDurante sua permanência na Câmara apresentou inúmeros projetos, entre os\nquais destacaram-se o que garantia a isenção de impostos de exportação à\nprodução artesanal brasileira, o que definia os crimes de subversão e\ncorrupção, regulamentando as sanções previstas no Ato Institucional nº 1\n(9/4/1964), o que assegurava ao marido o direito de receber a pensão da\nmulher falecida, e o projeto que criava o Instituto Brasileiro de\nGerontologia. Defendeu também a criação, pela Organização das Nações\nUnidas (ONU), de uma entidade de amparo à velhice, e a manutenção da Lei\nde Imprensa vigente. Ainda nessa legislatura, integrou a Comissão de\nJustiça, foi suplente das comissões de Legislação Social e de Serviço\nPúblico e participou da Comissão Parlamentar de Inquérito (CPI) sobre o\nBanco de Habitação, criada por sua iniciativa.\n\nNo pleito de novembro de 1966 foi novamente eleito suplente de deputado\nfederal pela Guanabara na legenda do MDB, deixando a Câmara ao final da\nlegislatura, em janeiro do ano seguinte. Com a extinção do\nbipartidarismo em 29 de novembro de 1979 e a conseqüente reformulação\npartidária, filiou-se ao Partido Trabalhista Brasileiro (PTB), e nessa\nlegenda concorreu a uma cadeira na Câmara dos Deputados pelo estado do\nRio de Janeiro no pleito de novembro de 1982, obtendo apenas uma\nsuplência.\n\nNo final dos anos 1980 participou ativamente do Movimento de Mobilização\nNacional que viria a dar origem, em 1990, ao Partido da Mobilização\nNacional (PMN), do qual foi um dos fundadores. Vice-presidente nacional\nda agremiação entre 1990 e 1999, neste último ano tornou-se seu\npresidente nacional.\n\nCasou-se com Leda Maria de Albuquerque Noronha. Não teve filhos.\n\nFONTES: CÂM. DEP. *Anais*;**CÂM. DEP. *Deputados*;**CÂM. DEP. *Deputados\nbrasileiros. Repertório*(1946-1967); INF. BIOG.; *Jornal do\nBrasil*(5/11/66*)*; TRIB. SUP. ELEIT. *Dados* (6 e 8).\n\n \n","ref":"FONTES: CÂM. DEP. *Anais*;**CÂM. DEP. *Deputados*;**CÂM. DEP. *Deputados\nbrasileiros. Repertório*(1946-1967); INF. BIOG.; *Jornal do\nBrasil*(5/11/66*)*; TRIB. SUP. ELEIT. *Dados* (6 e 8).\n\n \n","dic":"DHBB"}
