{"title":"OLINTO, Bivar","cargoss":["Deputado federal"],"cargos_esp":[0],"datas_ini":[1963],"datas_fim":[1971],"estados":["PB"],"autor":[0],"content":"**OLINTO, Bivar**\n\n\\*dep. fed. PB 1963-1971.\n\n \n\n*Bivar Olinto de Melo e Silva* nasceu em Serra Negra (RN) no dia 1º de\njulho de 1903, filho de João Olinto de Melo e Silva e de Francisca\nOlinto de Holanda. Seu irmão Drault Ernâni de Melo e Silva foi senador\npela Paraíba em maio de 1952 e de junho a julho de 1954 e deputado\nfederal pelo mesmo estado de 1955 a 1963.\n\nProprietário agrícola, filiou-se ao Partido Social Democrático (PSD),\ntornando-se prefeito de Patos (PB) em 1945. Em outubro de 1954 elegeu-se\ndeputado estadual na Paraíba na mesma legenda, assumindo em fevereiro\nsua cadeira na Assembléia Legislativa, onde permaneceu até 1958, quando\nvoltou à Prefeitura Municipal de Patos. No pleito de outubro desse ano\nelegeu-se sexto suplente de deputado estadual na Paraíba, sempre na\nlegenda do PSD.\n\nEm outubro de 1962 foi eleito deputado federal por seu estado, ainda na\nmesma legenda, assumindo o mandato em fevereiro do ano seguinte. Após a\nvitória do movimento político-militar de 31 de março de 1964 que depôs o\npresidente João Goulart (1961-1964), a extinção dos partidos políticos\npelo Ato Institucional nº 2 (27/10/1965) e a posterior instauração do\nbipartidarismo, filiou-se ao Movimento Democrático Brasileiro (MDB),\npartido de oposição ao regime militar em voga no país, e, em novembro de\n1966, reelegeu-se deputado federal pela Paraíba na legenda desse\npartido. Deixando de concorrer a um novo mandato no pleito de novembro\nde 1970, permaneceu na Câmara dos Deputados até o final da legislatura,\nem janeiro de 1971.\n\nFaleceu no Rio de Janeiro no dia 26 de abril de 1980.\n\nEra casado com Antônia Gomes de Melo e Silva, com quem teve quatro\nfilhos.\n\n \n\n \n\nFONTES: CÂM. DEP. Deputados; Globo (27/4/80); Jornal do Brasil (1/5/80);\nSENADO. Relação; TRIB. SUP. ELEIT. Dados (3, 4, 6 e 8).\n\n \n","ref":"FONTES: CÂM. DEP. Deputados; Globo (27/4/80); Jornal do Brasil (1/5/80);\nSENADO. Relação; TRIB. SUP. ELEIT. Dados (3, 4, 6 e 8).\n\n \n","dic":"DHBB"}
