{"title":"OLIVEIRA NETO, Luís Camilo de","cargoss":["Reitor"],"cargos_esp":["UDF"],"datas_ini":[1939],"datas_fim":[1939],"estados":[0],"autor":[0],"content":"**OLIVEIRA NETO, Luís Camilo de**\n\n\\*reitor UDF 1939.****\n\n \n\n*Luís Camilo de Oliveira Neto* nasceu em Itabira do Mato Dentro (MG) no\ndia 9 de setembro de 1904, filho de João Camilo de Oliveira Torres e de\nRosa Assis de Oliveira Drummond. Seu irmão, João Camilo de Oliveira\nTorres, foi importante historiador.\n\nFormou-se em química industrial na Escola de Engenharia de Belo\nHorizonte em 1924 e aí se tornou professor de química inorgânica. Em\n1933, durante a interventoria de Gustavo Capanema, trabalhou como perito\nquímico na Secretaria do Interior e Justiça de Minas Gerais. Passou\nentão a dedicar-se ao estudo da história do Brasil, organizando e\ndirigindo a biblioteca da secretaria e iniciando suas pesquisas no\nArquivo Público Mineiro. Em 1934, ano em que Capanema foi nomeado\nministro da Educação, transferiu-se para o Rio de Janeiro, então\nDistrito Federal, passou a servir no Ministério da Educação e foi\nnomeado diretor da Casa de Rui Barbosa, onde elaborou o plano de\npublicação das obras completas do patrono da instituição. Em 1936 foi\nnomeado membro do Conselho Nacional de Educação por Gustavo Capanema.\n\nEm 13 de julho de 1937 foi designado por Afonso Pena Júnior, então\nreitor da Universidade do Distrito Federal, junto com Gilberto Freire,\nrepresentante da Universidade no Congresso de História da Expansão\nPortuguesa no Mundo. Aproveitou essa viagem para dar início as suas\npesquisas no Arquivo Nacional da Torre do Tombo, Arquivo Histórico\nColonial e Biblioteca Nacional de Lisboa.\n\nEm junho de 1938 tornou-se professor catedrático de história do Brasil\nda Universidade do Distrito Federal (UDF). A universidade fora criada em\n1935 sob a inspiração de Anísio Teixeira, então diretor do Departamento\nde Educação do Distrito Federal, com uma proposta inovadora: pretendia\nencorajar a pesquisa científica, literária e artística e “propagar as\naquisições da ciência e das artes, pelo ensino regular de suas escolas e\npelos cursos de extensão popular”. Seu objetivo era não apenas produzir\nprofissionais, mas também formar “os quadros intelectuais do país”. Num\ncontexto marcado por importantes confrontos ideológicos entre\nintegralistas, comunistas, socialistas, democratas, conservadores\ncatólicos e liberais, e pela disputa de espaço entre esses grupos para\nexpandir suas idéias e controlar o sistema educacional, a UDF logo iria\nenfrentar dificuldades, tornando-se alvo dos ataques dos movimentos\ncatólico e integralista.\n\nA crise na UDF teve início pouco depois de sua fundação, em decorrência\nda revolta comunista de novembro de 1935. Acusado de envolvimento no\nlevante, em dezembro seguinte Anísio Teixeira foi demitido de suas\nfunções. Foram também demitidos o reitor da UDF, Afrânio Peixoto, e\nvários professores. Assumiu a reitoria Afonso Pena Júnior, que tentou\nenfrentar os desafios e garantir a permanência dos professores. Em 1937\n— ano em que foi criada a Universidade do Brasil (5 de julho) e foi dado\no golpe do Estado Novo (10 de novembro) — Afonso Pena Júnior foi\nsubstituído por Alceu Amoroso Lima, que era ligado ao grupo intelectual\ncatólico e se opunha fortemente ao projeto educacional e às idéias de\nAnísio Teixeira, bem como à própria UDF. Amoroso Lima modificou a\nestrutura acadêmica e administrativa da universidade, o que pode ser\nvisto no Decreto nº 6.214, de 16 de maio de 1938, e em setembro desse\nano afastou-se da UDF para se dedicar aos projetos de ensino superior da\nIgreja Católica. Em 1939 assumiu a reitoria Luís Camilo de Oliveira\nNeto, que, além de professor de história, era diretor da Faculdade de\nPolítica e Economia e vice-reitor. Apesar de seus esforços para evitar o\nfechamento da UDF, esta foi extinta e seus quadros foram incorporados à\nFaculdade Nacional de Filosofia da Universidade do Brasil, então criada.\n\nEntre 1936-1940 foi membro do Conselho Nacional de Educação e, entre\n1940 e 1943, diretor do Serviço de Documentação e da Biblioteca do\nItamarati. Foi exonerado dessas funções por sua ativa participação na\nelaboração do texto-fusão do Manifesto dos mineiros, do qual foi\nsignatário. Originariamente intitulado *Manifesto ao povo mineiro* e\ndatado de 24 de outubro de 1943 — em homenagem à Revolução de 1930 —, o\ndocumento foi o primeiro pronunciamento público de setores liberais\ncontra o Estado Novo. Embora a repressão a seus signatários não tenha\nincluído prisões, violências ou qualquer tipo de punição policial,\nvários deles foram duramente atingidos por sanções em sua vida\nprofissional, sugeridas pelo ministro da Fazenda Sousa Costa e pelo\ninterventor em Minas Gerais, Benedito Valadares. Assim, com base no\nartigo 177 da Constituição de 1937, aqueles que trabalhavam em empresas\npúblicas foram demitidos ou aposentados; nos casos de empresas\nparticulares, o governo recorreu à pressão sobre os proprietários, em\ngeral com êxito.\n\nLuís Camilo de Oliveira Neto só retomou seu posto na chefia do Serviço\nde Documentação do Ministério das Relações Exteriores em 1945, com a\nqueda do Estado Novo e a redemocratização do país. Foi também diretor do\nBanco de Crédito Real de Minas Gerais e um dos fundadores e\ndiretor-presidente da Metal Leve.\n\nFaleceu no Rio de Janeiro em 3 de setembro de 1953.\n\nEra casado com Elsa Malheiro de Oliveira, com quem teve cinco filhos,\nentre os quais Luís Filipe de Oliveira Pena, deputado federal pelo PMDB\ndo Rio de Janeiro de 1979 a 1983; Maria Luísa Pena Moreira, formada em\nfilosofia e casada com Marcílio Marques Moreira, embaixador do Brasil\nnos Estados Unidos de 1986 a 1991 e ministro da Economia de 1991 a 1992;\ne Rosa Maria Pena, que foi casada com o cineasta Glauber Rocha.\n\nSua trajetória de vida mereceu artigos publicados em livros, revistas e\njornais, que foram reunidos por João Camilo de Oliveira Torres e Maria\nLuísa Pena Moreira em *Luís Camilo**de Oliveira Neto; história, cultura\n& liberdade*(1975).\n\n Alzira Alves de Abreu\n\n \n\nFONTES: INF. MARIA LUÍSA PENA MOREIRA; OLIVEIRA NETO, L. *História*.\n\n \n","ref":"FONTES: INF. MARIA LUÍSA PENA MOREIRA; OLIVEIRA NETO, L. *História*.\n\n \n","dic":"DHBB"}
