{"title":"OLIVEIRA, Alcebíades de","cargoss":["Deputado federal"],"cargos_esp":[0],"datas_ini":[1979],"datas_fim":[1983],"estados":["RS"],"autor":[0],"content":"**OLIVEIRA, Alcebíades de**\n\n\\*dep. fed. RS 1979-1983.\n\n \n\n*José Alcebíades de Oliveira* nasceu em Santo Ângelo (RS) no dia 31 de\ndezembro de 1931, filho de Manuel de Oliveira e de Ercília Rolim de\nOliveira.\n\nJornalista profissional, trabalhou como locutor nas rádios de Santo\nÂngelo e de São Sepé, localidade vizinha à sua cidade natal.\n\nEleito vereador em outubro de 1954, tomou posse no início do ano\nseguinte. Em outubro de 1958 foi reeleito, cumprindo seu mandato até\n1963. Foi também prefeito e vice-prefeito de Santo Ângelo, sendo\nescolhido um dos “dez prefeitos do ano”, em 1976.\n\nEntre 1977 e 1978, foi diretor-geral das Faculdades Integradas da\nFundação Missioneira de Ensino Superior. Neste último ano, concorreu nas\neleições de novembro a uma vaga na Câmara dos Deputados na legenda da\nAliança Renovadora Nacional (Arena), partido de apoio ao regime militar\ninstalado no país desde abril de 1964. Eleito, tomou posse em fevereiro\nde 1979 iniciando seu mandato de deputado federal. Neste último ano,\ntornou-se membro da Comissão de Comunicação e suplente da Comissão de\nTransportes da Câmara.\n\nCom o fim do bipartidarismo em novembro de 1979 e a posterior\nreorganização partidária, ingressou no Partido Democrático Social (PDS),\nlegenda sucessora da Arena. No ano seguinte, foi vice-presidente da\nComissão de Comunicação na Câmara e fez parte da Comissão Parlamentar de\nInquérito (CPI) instituída para analisar a situação do Instituto do\nPatrimônio Histórico e Artístico Nacional, tendo em vista a viabilização\nde uma política para sua defesa e conservação.\n\nEm 1981, deixou de integrar as comissões em que atuava desde o início do\nmandato. Em novembro do ano seguinte, candidatou-se novamente.\nDerrotado, deixou a Câmara em janeiro de 1983, ao fim da legislatura.\n\nFaleceu em Porto Alegre no dia 21 de agosto de 1985.\n\nEra casado com Jane Melo de Oliveira, com quem teve cinco filhos.\n\n \n\nFONTES: CÂM. DEP. *Deputados brasileiros. Repertório* (1979-1983);\n*Jornal do Brasil* (22/8/85).\n\n \n","ref":"FONTES: CÂM. DEP. *Deputados brasileiros. Repertório* (1979-1983);\n*Jornal do Brasil* (22/8/85).\n\n \n","dic":"DHBB"}
