{"title":"OLIVEIRA, Araken de","cargoss":["Presidente de associação ou confederação de empregados ou empregadores"],"cargos_esp":["Petrobras"],"datas_ini":[1974],"datas_fim":[1979],"estados":[0],"autor":[0],"content":"**OLIVEIRA, Araken de**\n\n\\*militar; pres. Petrobras 1974-1979.\n\n* *\n\n*Araken de Oliveira* nasceu no Rio de Janeiro, então Distrito Federal,\nno dia 18 de outubro de 1909, filho de um oficial da Marinha.\n\nApós cursar o Colégio Militar do Rio de Janeiro, sentou praça em março\nde 1928, quando ingressou na Escola Militar do Realengo, também na\ncapital federal. Declarado em janeiro de 1932 aspirante-a-oficial da\narma de artilharia, foi promovido a segundo-tenente em agosto do mesmo\nano, a primeiro-tenente em outubro do ano seguinte e a capitão em\nsetembro de 1938.\n\nDurante a Segunda Guerra Mundial (1939-1945) cursou o Command and\nGeneral Staff Officer Course, em Fort Leavenworth, no Kansas, EUA.\nIntegrante da Força Expedicionária Brasileira (FEB), seguiu para a\nItália, onde participou das operações de guerra como oficial de tiro do\n1º Grupo de Obuses. De volta ao Brasil, foi promovido a major em junho\nde 1945, a tenente-coronel em setembro de 1951 e a coronel em março de\n1956. Após o movimento político-militar que depôs o presidente João\nGoulart em 31 de março de 1964, alcançou a patente de general-de-brigada\nem novembro do mesmo ano.\n\nAo ser transferido para a reserva em abril de 1967, foi convidado a\ncontinuar no serviço público como chefe de gabinete do presidente do\nConselho Nacional do Petróleo (CNP), marechal Valdemar Levi Cardoso.\nNessa época fez um curso de planejamento de empresas na Pontifícia\nUniversidade Católica (PUC) do Rio de Janeiro. Quando o marechal Levi\nCardoso deixou a presidência do CNP em março de 1969, já no governo do\ngeneral Artur da Costa e Silva, Araken de Oliveira substituiu-o na\npresidência do órgão. Ocupou esse cargo até assumir a presidência da\nPetrobras, em outubro de 1974, no governo de Ernesto Geisel, em\nsubstituição ao almirante Floriano Peixoto Faria Lima, que fora\nescolhido para o governo do novo estado do Rio de Janeiro, resultante da\nfusão da Guanabara e do antigo estado do Rio.\n\nDurante sua gestão à frente da Petrobras, foram instituídos, em outubro\nde 1975, os contratos de risco com empresas estrangeiras para prospecção\nde petróleo na plataforma continental brasileira. Em conseqüência,\nassinou diversos desses contratos. Sua administração coincidiu ainda com\no período de grandes elevações nos preços internacionais do petróleo e\ncom as subseqüentes medidas tomadas pelo governo brasileiro para reduzir\no consumo do combustível. Deixou a Petrobras em março de 1979, quando,\ncom o início do governo do general João Batista Figueiredo, Shigeaki\nUeki assumiu a presidência da empresa.\n\nCursou ainda as escolas de Aperfeiçoamento de Oficiais e de Comando e\nEstado-Maior do Exército, nas quais foi instrutor, e Superior de Guerra,\nde cujo corpo permanente foi membro. Foi também oficial-de-gabinete do\nministro da Guerra.\n\nCasou-se com Ocirema Meireles de Oliveira, com quem teve dois filhos.\n\n \n\nFONTES: CORRESP. PETROBRAS; *Jornal* *do Brasil*(1/10/74, 27/4 e\n22/6/77); MIN. GUERRA*. Almanaque; Perfil*(1974).\n\n \n","ref":"FONTES: CORRESP. PETROBRAS; *Jornal* *do Brasil*(1/10/74, 27/4 e\n22/6/77); MIN. GUERRA*. Almanaque; Perfil*(1974).\n\n \n","dic":"DHBB"}
