{"title":"OLIVEIRA, Euclides Quandt de","cargoss":["Ministro das Comunicações"],"cargos_esp":[0],"datas_ini":[1974],"datas_fim":[1979],"estados":[0],"autor":[0],"content":"**OLIVEIRA, Euclides Quandt de**\n\n\\*militar; min. Comunic. 1974-1979.\n\n*Euclides Quandt de Oliveira* nasceu no Rio de Janeiro, então Distrito\nFederal, no dia 23 de novembro de 1919, filho de Inácio Francisco de\nOliveira e de Ida Quandt de Oliveira.\n\nFez os primeiros estudos na Escola Goiás, em sua cidade natal, entre\n1927 e 1931, cursando o secundário no Colégio Nacional do Rio de Janeiro\nentre 1932 e 1936.\n\nIngressou por concurso nos quadros da Marinha em 1937, cursando a Escola\nNaval do Rio de Janeiro, sendo declarado guarda-marinha em 1941. No ano\nseguinte, após viagem de instrução, foi nomeado segundo-tenente, três\nmeses após o Brasil ter declarado estado de guerra com a Alemanha, em\nvirtude da Segunda Guerra Mundial (1939-1945). Sua primeira comissão foi\nno tênder *Belmonte*, que estava de partida para o Nordeste, onde\npermaneceu como capitânea e oficina de reparos da Força Naval do\nNordeste, a qual tinha a responsabilidade das operações de guerra no\nmar, do Rio de Janeiro para o Norte.\n\nDurante 1943 trabalhou no Serviço de Comunicações do Comando da Força\nNaval do Nordeste, em Recife, tendo realizado duas viagens de escolta a\ncomboios marítimos, embarcado na corveta *Carioca*como oficial de ataque\nanti-submarino. Fez os cursos de combate a incêndios e de tática\nanti-submarino, no Centro de Treinamento de Recife. Ainda nesse ano,\nembarcou na corveta *Rio Branco*, onde permaneceu até julho de 1944,\ntambém nas escoltas de proteção, exercendo as funções de encarregado do\narmamento oficial de som e ataque submarino. No final de 1944 seguiu\npara os Estados Unidos, tendo feito cursos de técnica e ocupação de\npropulsão de navios e de introdução a radares, em Miami; e de motores na\nGeneral Motors Diesel School, em Cleveland.\n\nDe volta ao Brasil, foi instrutor de instalações elétricas de propulsão\nde navios, no Centro de Instrução de Natal, e, no início de 1945, foi\ndesignado encarregado das oficinas de radar e de motores diesel da Base\nNaval do Recife, quando obteve experiência na área eletrônica. Até o\nfinal do conflito (1945) participou ativamente de comissões em operações\nde guerra.\n\nApós o término da guerra, retornou ao Rio onde, em 1946, serviu no\nDepartamento Rádio da Diretoria de Navegação da Marinha, participando de\nsua transformação em Diretoria Eletrônica da Marinha. Durante um período\nde alguns meses, no início de 1947, foi posto à disposição do Ministério\ndas Relações Exteriores e adido ao Comitê Consultivo de Emergência para\na Defesa Política do Continente, com sede em Montevidéu. Em maio de 1947\nfoi designado para organizar e instalar a Escola de Eletrônica da\nMarinha, destinada à formação e aperfeiçoamento de oficiais e praças\nnesta especialidade. Durante aproximadamente quatro anos participou da\npreparação de programas de ensino, da elaboração de livros-texto e da\nadministração dos primeiros cursos, simultaneamente com a construção e\naparelhamento dos laboratórios. Como complemento ao seu trabalho fez o\ncurso de técnica de ensino da Escola de Instrutores do Centro de\nInstrução Almirante Wandenkolk.\n\nNo final de 1950, terminados os primeiros cursos de eletrônica para\noficiais e marinheiros, voltou a embarcar, sendo nomeado oficial de\nreparo eletrônico de um esquadrão de contratorpedeiros. No ano seguinte,\nfoi designado para servir no cruzador *Tamandaré*, que seria recebido da\nMarinha Americana no Arsenal da Marinha de Filadélfia. Nessa ocasião,\nfreqüentou os cursos de eletrônica e especial de radares no Centro de\nTreinamento de Great Lakes. No cruzador *Tamandaré*, onde serviu por\ntrês anos, exerceu a função de encarregado do reparo eletrônico e em\nseguida a de encarregado de comunicações.\n\nA partir de 1954 serviu na Diretoria de Eletrônica da Marinha nas\nfunções de encarregado das divisões de Radar e Sonar e de Treinamento do\ndepartamento de estudos. Em 1956 assumiu o comando do contratorpedeiro\n*Bracuí*. De 1957 a 1959 chefiou a Divisão de Eletricidade e Eletrônica\nda Comissão de Construção de Navios na Europa, sendo o responsável pelas\nespecificações e pelo projeto de modernização elétrica e eletrônica do\nrecém-adquirido porta-aviões*Minas Gerais*, em Londres e Haia (Holanda).\n\nDe retorno ao Brasil, entre 1959 e 1960, foi diretor da Escola de\nMarinha Mercante do Pará, em Belém. Em 1961 foi matriculado na Escola de\nGuerra Naval, completando o curso de comando e estado-maior. Após o\ncurso, foi designado para a chefia do Departamento Industrial da\nDiretoria de Eletrônica da Marinha. Paralelamente a esta atividade,\natendeu e completou o curso superior de comando daquela escola. Em 1963\ncomandou a Força de Patrulha Costeira Sul, sendo dois meses mais tarde\ndestituído desse comando por ter requerido sua desistência à Ordem do\nMérito Naval, como protesto contra a entrega dessa comenda a um\n“político antimilitar” — Leonel Brizola. Após ter ficado algum tempo\nagregado, sem comissão, foi designado coordenador da Diretoria de\nEletrônica da Marinha e, depois, Oficial de Logística do\nComando-em-Chefe da Esquadra.\n\nApós o movimento político-militar de 31 de março de 1964, que depôs o\npresidente João Goulart (1961-1964), desempenhou funções como adjunto da\nsubchefia da Marinha no Gabinete Militar da Presidência da República\nentre abril de 1964 e julho do ano seguinte, no governo do presidente\nHumberto Castelo Branco (1964-1967).\n\nComo presidente do Conselho Nacional de Telecomunicações (Contel) entre\njulho de 1965 e abril de 1967, orientou as comissões que negociaram e\nefetuaram as aquisições da Companhia Telefônica Brasileira (estados do\nRio, São Paulo, Minas Gerais e Espírito Santo) e da Companhia Telefônica\nNacional (Paraná e Rio Grande do Sul), bem como a elaboração das normas\ne especificações básicas para a construção e operação do Sistema\nNacional de Telecomunicações, a fixação das prioridades para a\nimplementação, pela Embratel, dos troncos interurbanos e internacionais.\nAinda durante sua administração, foram realizados entendimentos com\nsetores ligados à educação, para implantação de cursos técnicos de\ntelecomunicações, atualização dos existentes e incentivos a algumas\natividades universitárias em pesquisas referentes a telecomunicações.\n\nDurante a elaboração do anteprojeto da Constituição de 1967, o Contel\napresentou sugestão que foi aceita, sobre a parte de comunicações.\nQuandt de Oliveira foi eleito então, vice-presidente da Comissão\nInteramericana de Telecomunicações (Citel), chefiando a delegação do\nBrasil à segunda reunião da Comissão, em Washington, e integrou o grupo\nque preparou o programa e os termos de referência para a elaboração do\nprojeto da Rede Interamericana de Telecomunicações.\n\nAinda em 1967, deixou a presidência do Contel e retornou ao serviço na\nmarinha assumindo o comando do porta-aviões *Minas Gerais.*No ano\nseguinte chefiou o Departamento de Produção, na comissão de construção\nde navios da Marinha, no Rio. Em janeiro de 1969 solicitou transferência\npara a reserva, que foi assinada em março. Já na reserva, porém antes de\nser definitivamente desligado, participou das discussões finais e da\nassinatura, na Alemanha, do contrato de construção de navios varredores\nde minas.\n\nIniciou sua atividade na vida civil como diretor de Telecomunicações da\nSiemens do Brasil, cargo que exerceu de 1969 a 1972 e desse ano até 1974\nfoi presidente das Telecomunicações Brasileiras S.A. (Telebrás). Sob sua\npresidência foi estruturado o grupo empresarial Telebrás, elaborado o\nplanejamento da expansão das comunicações telefônicas no país, iniciada\nsua implementação, organizando um sistema de acompanhamento e controle\ndas atividades das empresas do Sistema Telebrás e iniciado um programa\nde pesquisas e desenvolvimento.\n\nDe 1974 a 1979, durante o governo de Ernesto Geisel, foi ministro das\nComunicações, tendo substituído Higino Corsetti (1969-1974). Em sua\ngestão foi implantado o serviço de telefonia móvel e terrestre, além de\niniciados estudos para a avaliação da conveniência ou não da implantação\nno país de um sistema de satélite doméstico de comunicações, para a\nelaboração da reforma do Código Nacional de Telecomunicações e a\ntransformação do Departamento Nacional de Telecomunicações (Dentel) em\nautarquia. Foi substituído no cargo em março de 1979 por Haroldo Correia\nde Matos.\n\nApós o término do governo Geisel, tornou-se presidente da Transit\nSemicondutores, empresa brasileira fabricante de semicondutores,\nempregando tecnologia desenvolvida na Universidade de São Paulo (USP).\nTendo exercido aquele cargo até 1980, quando a convite da Organização\ndas Nações Unidas para a Educação, a Ciência e a Cultura (UNESCO),\nintegrou um Grupo Especial de Assessoramento para acompanhar a\nimplantação das decisões sobre o direito das nações em desenvolvimento à\ndivulgação de notícias de seu interesse. Até 1982 participou então das\nreuniões semestrais daquele grupo que se realizavam em Quito.\n\nAinda neste período, de 1979 a 1983 participou do grupo de trabalho\nvinculado à Secretaria do Conselho de Segurança Nacional, que estudava a\nsituação da informática e da microeletrônica no Brasil. Após a criação\nda Secretaria Especial de Informática, foi nomeado membro do grupo de\nassessoramento de microeletrônica daquela secretaria.\n\nNo período de 1980 a 1983, foi diretor e, de 1983 a 1986, presidente da\nTelebrasil, associação de classe das telecomunicações, formadas por\nempresas estatais ou privadas do setor. A partir de 1981, atuou como\nconsultor independente em telecomunicações e desempenho empresarial,\ntendo prestado esses serviços a várias empresas, entre elas a Rádio Del\nRei, em Belo Horizonte; a Splice do Brasil; a Rádio e Televisão\nBandeirantes e a Editora de Catálogos Telefônicos do Brasil. Essa\nassessoria foi, durante um certo tempo, feita diretamente e, mais tarde,\natravés de empresa organizada especialmente para esse fim, a QDP\nConsultoria e Participações.\n\nNa TV Bandeirantes coordenou a implantação do sistema de transmissão,\nvia satélite, da programação para as afiliadas e prestou assessoria em\ndesempenho empresarial. Na Splice, prestou assessoria em organização\nindustrial, controles administrativos e análise de novos\nempreendimentos.\n\nDurante dez anos foi diretor da Splice Telecomunicações e Informática e\npresidente de uma de suas subsidiárias, a Selte — Serviços Elétricos\nTelefônicos do Brasil, construtora de redes telefônicas e elétricas. Na\nEditora de Catálogos Telefônicos do Brasil, prestou inicialmente\nassessoria geral. Em 1984 tornou-se membro do Conselho de Administração,\ncuja presidência assumiu em 1985. A razão social da empresa foi mudada\npara Editel — Listas Telefônicas S.A. Em 1996, deixou a presidência da\nEditel, permanecendo como membro do Conselho de Administração.\n\n Casou-se com Maria de Lurdes de Góis Monteiro de Oliveira, filha do\ngeneral Pedro Aurélio de Góis Monteiro, que foi revolucionário em 1930,\nministro da Guerra de 1934 a 1935 e de 1945 a 1946, chefe do\nEstado-Maior do Exército de 1937 a 1943, senador por Alagoas de 1947 a\n1951, chefe do Estado-Maior das Forças Armadas de 1951 a 1952 e ministro\ndo Superior Tribunal Militar de 1952 a 1956. Teve seis filhos.\n\nEscreveu *Renascem as comunicações, volume 1 - construindo a base*\n(1992) e *Renascem as comunicações, volume 2 – construção e operação do\nsistema* (2006).\n\n \n\nFONTES: CORRESP. MIN. COMUNIC.; CURRIC. BIOG.;  *Jornal do\nBrasil*(15/4/74**e 11/12/77); *Perfil* (1974 e 1975); SOARES, E.\n*Instituições*;*Súmulas*.\n\n \n","ref":"FONTES: CORRESP. MIN. COMUNIC.; CURRIC. BIOG.;  *Jornal do\nBrasil*(15/4/74**e 11/12/77); *Perfil* (1974 e 1975); SOARES, E.\n*Instituições*;*Súmulas*.\n\n \n","dic":"DHBB"}
