{"title":"OLIVEIRA, José Lopes de","cargoss":["Presidente do Banco Nacional da Habitação"],"cargos_esp":[0],"datas_ini":[1979],"datas_fim":[1983],"estados":[0],"autor":["Gustavo Lopes"],"content":"**OLIVEIRA, José Lopes de**\n\n\\*pres. BNH 1979-1983.\n\n*José Lopes de Oliveira* nasceu em Vitória em 10 de abril de 1927, filho\nde Ivan de Oliveira e Amélia Carlos Oliveira.\n\nIngressou no Banco do Brasil em 1948. Formou-se dois anos depois pela\nFaculdade de Direito da Universidade do Distrito Federal, no Rio de\nJaneiro. Em 1953, recebeu indicação direta do ministro Osvaldo Aranha\npara ser seu assistente no Ministério da Fazenda, permanecendo nessa\nfunção até 1954. Foi responsável pela reorganização das operações\norçamentárias e de câmbio do Banco do Brasil, redefinindo suas relações\ncom o Ministério da Fazenda. Entre 1956 e 1959, foi assessor dos\ndiretores executivos da Superintendência da Moeda e do Crédito (Sumoc).\nNesse órgão, em 1958, participou do Grupo Executivo da Indústria de\nConstrução Naval (Geicon). Em 1959, vinculou-se novamente ao Ministério\nda Fazenda, onde veio a integrar a assessoria técnica do ministro\nSebastião Pais Almeida, sendo o principal assessor para assuntos de\npolítica financeira. Entre 1960 e 1961, integrou-se à Junta\nAdministrativa da Caixa de Amortização.\n\nAinda em 1961 integrou a assessoria técnica do presidente do Banco do\nBrasil, na qual permaneceria durante os dois anos seguintes.\nSimultaneamente, na Sumoc, tornou-se relator do Plano de Padronização da\nContabilidade Bancária, posto que viria a ocupar durante os seis anos\nseguintes. Também na Sumoc, assumiu o cargo de inspetor de bancos,\ndesempenhando-o durante cinco anos. Em 1963, participou da assessoria\ntécnica dos ministros da Fazenda Carvalho Pinto e Nei Galvão. Em 1964,\napós o movimento político-militar que derrubou o presidente João Goulart\nem 31 de março, desempenhou a função de emissário pessoal do novo\npresidente da República, Castelo Branco, junto ao presidente da França,\nCharles de Gaulle, para a normalização das relações diplomáticas. Nesse\nmesmo ano, foi assessor do secretário-geral e do inspetor-geral da\nSumoc.\n\nEm 1966, ainda vinculado ao Banco do Brasil, desempenhou a chefia da\nContabilidade Geral. Nesse mesmo ano, redigiu a tese denominada “Bases\npara a estabilização monetária com crescimento econômico”, apresentada\npela Confederação Nacional do Comércio à Conferência das Classes\nProdutoras de São Paulo sobre a Realidade Brasileira.\n\nEm 1967 assumiu o cargo de diretor financeiro da Superintendência\nNacional da Marinha Mercante (Sunamam), promovendo uma revisão da\npolítica financeira da indústria da construção naval ao criar o Fundo de\nRefinanciamento da Marinha Mercante. Nesse mesmo ano, viajou ao México e\naos EUA para negociar a possibilidade de esses países comprarem navios\nconstruídos no Brasil e, no ano seguinte, esteve na Europa para obter\nempréstimos para o Ministério dos Transportes. Relator da reformulação\nda lei básica do Fundo da Marinha Mercante, publicada como decreto-lei\nem janeiro de 1969, durante o período em que esteve na direção da\nSunamam estreitou seu relacionamento com Mário Andreazza, ministro dos\nTransportes, ao qual a superintendência estava subordinada.\n\nEm 1970, deixou a direção da Sunamam e assumiu a presidência do\nInstituto de Resseguros do Brasil (IRB). Sua gestão foi marcada pela\nexpansão do instituto e do mercado segurador. Incentivou a fusão e\nincorporação de companhias como forma de dotar o sistema de maior\nsolidez. Em 1974, fundou a primeira subsidiária do IRB, em Londres, como\nparte da política de internacionalização do resseguro. Em 1977, fundou a\nUnited Americas Insurance Company (UAIC), companhia de resseguros\ncontrolada por capitais brasileiros e com sede em Nova Iorque, da qual\nfoi o primeiro presidente.\n\nConvidado a ocupar a presidência do Banco Nacional da Habitação (BNH)\npelo ministro do Interior, Mário Andreazza, assumiu o cargo em março de\n1979, no início da presidência de João Figueiredo, sucedendo Maurício\nSchulman. No mesmo mês, tornou-se titular da diretoria do Banco\nInteramericano de Poupança e Empréstimo (Biape), sediado em Caracas.\nAinda em 1979, passou a integrar o Conselho Fiscal da Companhia\nSiderúrgica Nacional (CSN).\n\nNo BNH deixou manifesta a intenção de ampliar a fiscalização sobre as\naplicações dos recursos da caderneta de poupança captados pelos agentes\nfinanceiros e a disposição contrária ao ingresso maciço de empresas\nestrangeiras na área da habitação. Caracterizou sua administração pelo\nsaneamento no mercado financeiro, obrigando as associações de poupança e\nempréstimo a transformarem-se em empresas de crédito imobiliário. Em\ndezembro de 1982, enfrentou uma denúncia feita pela imprensa acerca do\nfavorecimento da empresa Delfin Crédito Imobiliário numa negociação de\ndívidas com o BNH. Em novembro de 1983, ameaçou renunciar à presidência\ndo BNH, caso o governo não revisse a sua política salarial, um dos\nprincipais responsáveis pelo grande número de mutuários inadimplentes no\nSistema Financeiro de Habitação. Com a proximidade da sucessão, por via\nindireta, do presidente Figueiredo, não concordou com a subordinação do\nBNH aos compromissos de campanha de Andreazza. Pediu demissão em\ndezembro de 1983, sendo sucedido por Nélson da Mata. Ainda no mesmo ano,\nencerrou suas atividades governamentais deixando a presidência do\nConselho Fiscal da CSN e a diretoria do Biape.\n\nA partir de então, dedicou-se apenas a atividades privadas. De março de\n1984 a novembro de 1985, ocupou a vice-presidência do Banco de Comércio\ne Indústria de São Paulo S.A. — (Comind). Em 1991, tornou-se\nrepresentante no Brasil da Skandia International Insurance Co., maior\ngrupo segurador da Escandinávia. Em 1993 assumiu a presidência da\nAssociação Brasileira Beneficente de Reabilitação (ABBR), onde\npermaneceria até setembro de 1999. Em setembro de 1997, a Skandia vendeu\nsua carteira de negócios de seguros para a empresa alemã Hanover e desde\nentão passou a atuar como representante dessa empresa no Brasil.\n\nCasou-se com Zenita Ferrano de Oliveira, com quem teve quatro filhos.\n\nGustavo Lopes\n\nFONTES: CURRIC. BIOG.; *Globo*(11/11/79);**INF. BIOG.; *Jornal do\nBrasil* (12/8/81);*Veja* (12 e 26/1, 15/6 e 7/12/83).\n\n \n","ref":"FONTES: CURRIC. BIOG.; *Globo*(11/11/79);**INF. BIOG.; *Jornal do\nBrasil* (12/8/81);*Veja* (12 e 26/1, 15/6 e 7/12/83).\n\n \n","dic":"DHBB"}
