{"title":"OLIVEIRA, Moacir Veloso Cardoso de","cargoss":["Ministro do Trabalho","Ministro do Trabalho"],"cargos_esp":[0,0],"datas_ini":[1965,1964],"datas_fim":[1965,1964],"estados":[0,0],"autor":[0],"content":"**OLIVEIRA, Moacir Veloso Cardoso de**\n\n\\*min. Trab. 1964 e 1965.\n\n \n\n*Moacir Veloso Cardoso de Oliveira* nasceu em Vitória no dia 25 de julho\nde 1913, filho de Artur Cardoso de Oliveira e de Teresa Veloso de\nOliveira.\n\nFez os estudos primários na Escola Olavo Bilac e no Externato Pitanga,\nno Rio de Janeiro, então Distrito Federal, e os secundários no Externato\nSanto Inácio, na mesma cidade. Em 1933 bacharelou-se em ciências\njurídicas e sociais pela Faculdade de Direito do Rio de Janeiro,\ndoutorando-se em direito público pela mesma faculdade em 1935.\n\nFuncionário do Ministério do Trabalho, Indústria e Comércio a partir de\n1938, integrou diversas comissões técnicas e participou da elaboração da\nLei de Regulamentação e Implantação da Justiça do Trabalho. Em abril de\n1941 foi nomeado diretor-geral do Departamento Nacional da Previdência\nSocial (DNPS), cargo que ocupou até dezembro do ano seguinte. De 1942 a\n1944 participou da elaboração da Lei de Acidentes do Trabalho e de sua\nregulamentação. Em 1945 representou o Brasil no I Congresso\nPan-Americano de Serviço Social, realizado no Chile, visitando também,\nnessa ocasião, a Argentina e o Uruguai.\n\nApós o fim do Estado Novo (1937-1945), foi nomeado em janeiro de 1946\npelo ministro do Trabalho, Indústria e Comércio, Otacílio Negrão de\nLima, para ocupar mais uma vez o cargo de diretor-geral do DNPS, cargo\nque exerceu até novembro de 1948. Em 1950 tornou-se membro da Comissão\nPermanente de Direito Social do Ministério do Trabalho, onde\npermaneceria até 1960. Em 1955 foi nomeado chefe de gabinete do ministro\ndo Trabalho, Indústria e Comércio e de 1958 a 1959 foi\nassistente-técnico do ministério.\n\nApós o movimento político-militar de 31 de março de 1964, que depôs o\npresidente João Goulart (1961-1964), foi designado chefe do gabinete do\nministro do Trabalho, Arnaldo Sussekind. Desde 1962, após reforma\nadministrativa, o Ministério do Trabalho, Indústria e Comércio passara a\ndenominar-se Ministério do Trabalho e Previdência Social. De junho a\njulho de 1964 e de maio a julho de 1965, Moacir de Oliveira assumiu\ninterinamente a pasta do Trabalho. Ainda em 1965 deixou o cargo de chefe\nde gabinete e no ano seguinte tornou-se presidente da Comissão\nPermanente de Direito Social do ministério, tendo sido relator do\nprojeto que deu origem à Lei Orgânica da Previdência Social, cujo\nregulamento geral elaborou. Responsável por importantes modificações do\ndireito previdenciário brasileiro no final do governo do presidente\nHumberto Castelo Branco (1964-1967), foi confirmado no cargo em 1968.\n\nDedicando-se à legislação trabalhista, participou da elaboração da Lei\ndo Salário-Família e de seu regulamento geral, da Lei da Correção\nMonetária dos Débitos Trabalhistas e do projeto de lei de participação\ndos trabalhadores nos lucros das empresas. Foi também subsecretário de\nJustiça do Rio de Janeiro no governo de Floriano Peixoto Faria Lima\n(1975-1979).\n\nFoi ainda procurador e assistente-técnico da comissão organizadora do\nInstituto de Aposentadoria e Pensões dos Industriários e\noficial-de-gabinete da presidência do órgão. Exerceu também as funções\nde diretor do Departamento de Previdência Social do Conselho Nacional do\nTrabalho e de presidente da Junta Arquidiocesana da Ação Católica\nBrasileira no Rio de Janeiro. Foi ainda presidente da Confederação\nNacional das Congregações Marianas e membro da Opus Dei.\n\nProfessor de legislação social da Escola Técnica de Serviço Social e do\nInstituto de Direito Social do Rio de Janeiro, foi sócio do Centro Dom\nVital, um dos fundadores da Associação dos Diplomados da Escola Superior\nde Guerra (ADESG), representante do Brasil várias vezes nas reuniões da\nOrganização Internacional do Trabalho em Genebra, na Suíça, e professor\nde Direito do Trabalho e Doutrina Social da Igreja na Pontífica\nUniversidade Católica do Rio de Janeiro.\n\nFaleceu em São Lourenço (MG) no dia 28 de janeiro de 1992.\n\nFoi casado em primeiras núpcias com Maria José Campos Cardoso de\nOliveira, com quem teve três filhos. Era casado em segundas núpcias com\nAna Pereira Cardoso de Oliveira.\n\nAlém de artigos técnicos sobre trabalho e previdência social, publicou\n*Noções de legislação de previdência do trabalho* (1937).\n\n \n\nFONTES: CORRESP. MIN. TRAB.; COUTINHO, A. *Brasil*; *Encic. Mirador*;\nHIRSCHOWICZ, E. *Contemporâneos*; *Jornal do Brasil* (30/1/92); TORRES,\nJ. *História*.\n\n \n","ref":"FONTES: CORRESP. MIN. TRAB.; COUTINHO, A. *Brasil*; *Encic. Mirador*;\nHIRSCHOWICZ, E. *Contemporâneos*; *Jornal do Brasil* (30/1/92); TORRES,\nJ. *História*.\n\n \n","dic":"DHBB"}
