{"title":"OLIVEIRA, Oscar de","cargoss":["Presidente de associação ou confederação de empregados ou empregadores"],"cargos_esp":["CVRD"],"datas_ini":[1965],"datas_fim":[1967],"estados":[0],"autor":[0],"content":"**OLIVEIRA, Oscar de**\n\n\\*pres.CVRD 1965-1967.\n\n \n\n*Oscar de Oliveira* nasceu no Rio de Janeiro, então Distrito Federal, no\ndia 25 de janeiro de 1915, filho de Artur Moreira de Oliveira e de Lídia\nda Silva Miranda de Oliveira.\n\nCompletou os estudos secundários no Colégio Resende, no Rio de Janeiro,\nem 1930, e no ano seguinte iniciou carreira profissional na Société\nAnonyme du Gaz (SAG), empresa controlada pela Rio de Janeiro Tramway,\nLight and Power, ocupando ao longo dos seis anos subseqüentes os cargos\nde auxiliar de escrita, auxiliar de desenho e auxiliar técnico.\n\nFormado em engenharia civil e mecânica em 1936 pela Escola Politécnica\nda Universidade do Brasil, atual escola de engenharia da Universidade\nFederal do Rio de Janeiro (UFRJ), no ano seguinte foi nomeado engenheiro\nda SAG, atuando nos setores de fabricação, distribuição e utilização de\ngases combustíveis, inclusive em laboratórios de análise e pesquisas, e\nna chefia dos setores de medição e de emissão de gás sob alta pressão.\n\nEm 1938 voltou à escola em que se formara como professor-assistente da\ncadeira de botânica e zoologia tecnológicas. Em 1945, tornou-se\nprofessor catedrático interino da mesma cadeira e, em 1950, professor\nefetivo.\n\nMembro do conselho consultivo da Escola de Administração de Empresas da\nFundação Getulio Vargas (FGV), de São Paulo, e superintendente do\ndepartamento de relações públicas da Companhia de Carris, Luz e Força do\nRio de Janeiro (Light), doutorou-se em ciências físicas e naturais, em\n1953.\n\n Em 1954, a convite do presidente da Companhia Vale do Rio Doce,\nFrancisco Sá Lessa, assumiu a superintendência geral da empresa,\nocupando depois e sucessivamente as chefias da divisão comercial, da\ndivisão de estudos e planejamento, do departamento de mineração, além de\ndiretor eleito da companhia.\n\nPermaneceu na CVRD até 1959, tendo sido seu diretor eleito, até\ningressar na Companhia Auxiliar de Empresas de Mineração (Caemi),\nempresa de mineração capitaneada por Augusto Trajano de Azevedo Antunes,\nonde dirigiu e coordenou um projeto de mineração de ferro e outro de\ntransporte ferroviário, embarque marítimo e exportação de minérios.\n\nEm 1961, retornou à CVRD como diretor da área financeira. Neste mesmo\nano, foi eleito vice-presidente do Sindicato Nacional da Indústria de\nExtração de Ferro e Metais Básicos e assumiu a presidência da Companhia\nFerro e Aço de Vitória, postos de trabalho nos quais se manteria até\n1964. No ano de 1962, negociou em Tóquio, no Japão, o primeiro grande\ncontrato de exportação de minério brasileiro.\n\nMembro do conselho orientador do Instituto de Pesquisas e Estudos\nSociais (IPÊS), instituição financiada por empresários, participou\nativamente do movimento político-militar que derrubou o presidente João\nGoulart em 31 de março de 1964. Paralelamente, desenvolveu intensa\natuação na área acadêmica, e entre 1955 a 1965 foi chefe do departamento\nde Ciências Naturais da escola de engenharia da UFRJ, além de membro dos\nconselhos universitário, de pesquisa e departamental.\n\nAfastado junto com toda a diretoria da CVRD em abril de 1964, pelo\ngoverno do general Castelo Branco, foi convidado em dezembro daquele\nmesmo ano, pelo próprio presidente da República, a assumir a presidência\nda companhia, em substituição a Paulo José de Lima Vieira. Nomeado\ndiretor da escola de engenharia logo a seguir, atuou como decano, de\n1964 a 1965, responsável pela reforma universitária da UFRJ.\n\nLicenciado da direção da escola de engenharia, tomou posse na\npresidência da CVRD em janeiro de 1965. Na sua gestão foram inaugurados\no porto de Tubarão — fundamen-tal para a manutenção do contrato com os\njaponeses, interessados na aquisição de grandes quantidades de minério\nde ferro brasileiro; o ramal Costa Lacerda-Desembargador Drummond, da\nEstrada de Ferro Central do Brasil (EFCB), que permitiu a abertura de\nmercados na Bélgica e Luxemburgo; a subsidiária Itabira Internacional,\ncom sede nas Bahamas, destinada ao atendimento dos mercados\nnorte-americano e canadense; e a Seamar, Companhia de Navegação, na\nLibéria. Ao longo desse período, Oscar de Oliveira presidiu também a\nVale do Rio Doce Navegação (Docenave) e a Siderurgia Vatu, subsidiárias\nda CVRD.\n\nAinda em 1965, assumiu a presidência do Conselho Curador da Fundação\nMovimento Universitário de Desenvolvimento Econômico e Social (Mudes) e,\nno ano seguinte, a da União dos Escoteiros do Brasil.\n\nDeixou a presidência da CVRD em março de 1967, quando terminou o governo\nCastelo Branco, sendo substituído por Antônio Dias Leite. Sub-reitor de\npessoal e serviços gerais da UFRJ, em 1967 e 1968, presidiu o Centro de\nBiblioteconomia do IPÊS, no Rio de Janeiro, de 1967 a 1971. De 1967 a\n1974 foi assessor especial da presidência da CVRD. E de 1968 a 1974,\nsecretário-executivo do Conselho de Reitores das universidades\nbrasileiras.\n\nAposentado pela Vale em 1974, dedicou-se exclusivamente à docência\nuniversitária, tornando-se vice-reitor para assuntos de desenvolvimento\nda Pontifícia Universidade Católica (PUC) do Rio de Janeiro. No período\nde 1978 a 1982 foi diretor-adjunto da escola de engenharia e\ndiretor-presidente do seu escritório técnico.\n\nMembro do Conselho Técnico da Confederação Nacional de Comércio (CNC),\nem 1980, e representante dos professores titulares no Conselho de\nCoordenação do Centro de Tecnologia da UFRJ, de 1981 a 1983, além de\ndecano-substituto do Centro de Tecnologia da UFRJ, chefiou o\ndepartamento de tecnologia mecânica da escola de engenharia da UFRJ\nentre 1982 e 1983.\n\nAposentado pela UFRJ em 1983, tornou-se em 1985 membro do Conselho\nSuperior de Administração da Universidade Católica de Petrópolis (UCP) e\nprofessor emérito da UFRJ.\n\nNo decorrer de sua longa carreira profissional e acadêmica realizou mais\nde 90 viagens a diversos países, proferindo conferências e participando\nde seminários, simpósios e cursos, na qualidade de delegado, coordenador\nou organizador, principalmente na área de administração universitária.\nFez também muitas viagens de representação e a negócios.\n\nCasado com Eugênia Barbosa da Silva de Oliveira, teve nove filhos, entre\nos quais a atriz Cristiana de Oliveira.\n\nPublicou *Alguns aspectos do estudo das matérias-primas vegetais e\nanimais para indústria* e *Estágios da implantação da reforma\nuniversitária*, este último num suplemento especial sobre educação da\nrevista *Manchete*.\n\n \n\nFONTES:****CURRIC. BIOG.; INF. BIOG.\n\n \n","ref":"FONTES:****CURRIC. BIOG.; INF. BIOG.\n\n \n","dic":"DHBB"}
