{"title":"OLIVEIRA, Paranhos de","cargoss":["Deputado federal"],"cargos_esp":[0],"datas_ini":[1951],"datas_fim":[1955],"estados":["RJ"],"autor":[0],"content":"**OLIVEIRA, Paranhos de**\n\n\\*dep. fed. RJ 1951-1955.****\n\n*Daruiz Rosés Paranhos de Oliveira* nasceu em São Luís Gonzaga (RS) no\ndia 2 de novembro de 1904, filho de Domingos Paranhos de Oliveira e de\nFrutuosa Rosés.\n\nCursou o Instituto de Zootecnia de Viamão (RS), transferindo-se depois\npara o Rio de Janeiro, então Distrito Federal.\n\nNo pleito de outubro de 1950 elegeu-se deputado federal pelo Rio de\nJaneiro na legenda do Partido Trabalhista Brasileiro (PTB), assumindo o\nmandato em fevereiro do ano seguinte. Em 1952, porém, rompeu com o PTB,\ningressado no Partido Social Progressista (PSP), em cuja legenda\nreelegeu-se deputado federal pelo Rio de Janeiro em outubro de 1954.\nEncerrando o primeiro mandato em janeiro de 1955, não ocupou uma cadeira\nna legislatura que então se iniciou. Em outubro de 1958, elegeu-se\nsuplente de deputado federal pelo Rio de Janeiro na legenda do Partido\nSocial Democrático (PSD) e, em outubro de 1962, foi novamente eleito\nsuplente de deputado federal pelo mesmo estado, dessa vez na legenda do\nPSP.\n\nComerciante, foi membro da União dos Ferroviários do Brasil e do\nSindicato de Imóveis e Construções.\n\nFONTES: AUDRÁ, A. *Bancada;*CÂM. DEP. *Deputados;*CÂM. DEP. *Relação dos\ndep.;* CISNEIROS, A. *Parlamentares;* MACEDO, N. *Aspectos;*TRIB. SUP.\nELEIT. *Dados* (2, 3, 4 e 6).\n\n \n","ref":"FONTES: AUDRÁ, A. *Bancada;*CÂM. DEP. *Deputados;*CÂM. DEP. *Relação dos\ndep.;* CISNEIROS, A. *Parlamentares;* MACEDO, N. *Aspectos;*TRIB. SUP.\nELEIT. *Dados* (2, 3, 4 e 6).\n\n \n","dic":"DHBB"}
