{"title":"OLIVEIRA, Washington Osório de","cargoss":["Ministro do Supremo Tribunal Federal"],"cargos_esp":[0],"datas_ini":[1938],"datas_fim":[1940],"estados":[0],"autor":[0],"content":"**OLIVEIRA, Washington Osório de**\n\n\\*magistrado; min. STF 1938-1940.\n\n \n\n*Washington Osório de Oliveira* nasceu em Santa Maria Madalena (RJ) no\ndia 23 de março de 1873, filho de Joaquim Osório de Oliveira e de\nFelismina de Santana Oliveira.\n\nEstudou no Ateneu Sumidourense e no Ginásio de Ouro Preto, em Minas\nGerais, bacharelando-se em março de 1898 pela Faculdade de Direito de\nSão Paulo.\n\nEm outubro seguinte assumiu o cargo de promotor público de Piraju (SP),\nexercendo-o até agosto de 1908, quando passou a dedicar-se apenas à\nadvocacia. Em junho de 1914 foi designado pelo presidente Hermes da\nFonseca (1910-1914) juiz federal da 1ª Vara de São Paulo, função na qual\nfoi depois aposentado por motivos políticos. Em setembro de 1937 teve\nsua aposentadoria invalidada e foi reintegrado na magistratura. Nomeado\nem outubro do ano seguinte pelo presidente Getúlio Vargas ministro do\nSupremo Tribunal Federal (STF), aposentou-se nesse cargo em 1940.\n\nFoi ainda mesário da Santa Casa de Misericórdia de São Paulo e membro\nhonorário da Sociedade Científica de São Paulo.\n\nFaleceu na cidade de São Paulo em 1950.\n\nEra casado com Angelina Bravo de Oliveira, com quem teve seis filhos.\n\n \n\n \n\nFONTES: BALEEIRO, A. Supremo; COSTA, E. Grande; Grande encic. Delta;\nLAGO, L. Supremo; LEITE, A. História; Personalidades; SOC. BRAS.\nEXPANSÃO COMERCIAL. Quem; Who’s who in Latin.\n\n \n","ref":"FONTES: BALEEIRO, A. Supremo; COSTA, E. Grande; Grande encic. Delta;\nLAGO, L. Supremo; LEITE, A. História; Personalidades; SOC. BRAS.\nEXPANSÃO COMERCIAL. Quem; Who’s who in Latin.\n\n \n","dic":"DHBB"}
