{"title":"ONIAS, José","cargoss":["Deputado federal","Deputado federal"],"cargos_esp":[0,0],"datas_ini":[1967,1951],"datas_fim":[1971,1951],"estados":["SE","SE"],"autor":[0],"content":"**ONIAS, José**\n\n\\*dep. fed. SE 1951 e 1967-1971.\n\n \n\n*José Onias de Carvalho* nasceu em São José de Belmonte (PE) no dia 16\nde março de 1901, filho de Antônio Onias de Carvalho e de Maria da Luz\nOnias de Carvalho.\n\nApós concluir o curso secundário, transferiu-se para Sergipe,\ntornando-se piscicultor e proprietário rural, além de notário público e\ngerente do Banco do Comércio e Indústria desse estado.\n\nIniciou-se na política como prefeito do município de Propriá (SE), antes\nde tentar, no pleito de outubro de 1950, um mandato de deputado federal\npor Sergipe na legenda da Coligação Democrática Sergipana, formada pela\nUnião Democrática Nacional (UDN) e o Partido Social Trabalhista (PST).\nMalsucedido em seu intento, permaneceu como segundo suplente até maio de\n1951, vindo a ocupar uma cadeira na Câmara até dezembro seguinte.\n\nRadicando-se em Alagoas, disputou o pleito realizado em outubro de 1954\npara a Assembléia Legislativa do estado. Representando a UDN, obteve\napenas uma suplência. Contudo, assumiu o mandato logo no início da\nlegislatura, em fevereiro de 1955. Em 11 de setembro de 1957, quando os\ndeputados estaduais alagoanos tentavam votar o impedimento do governador\nSebastião Marinho Muniz Falcão (PSD), em face do clima de violência que\nimperava no estado, foi atingido por um tiro no pulmão. Transferido para\no Rio de Janeiro, foi submetido a tratamento médico. Após intervenção\nfederal, decretada pelo presidente Juscelino Kubitschek (1956-1961), e a\nfinalização do processo de *impeachment*, Muniz Falcão recorreu ao\nSupremo Tribunal Federal, que lhe deu ganho de causa, retornando ao\nExecutivo estadual em janeiro do ano seguinte.\n\nAinda em Alagoas, José Onias foi assessor do secretário de Justiça e\nSegurança Pública.\n\nDe volta a Sergipe, foi eleito deputado estadual na legenda da UDN,\nassumindo o mandato em fevereiro de 1959, e reelegeu-se em outubro de\n1962, já na legenda da Coligação Democrática, que reunia o Partido\nRepublicano (PR) e o Partido Democrata Cristão (PDC). Durante o primeiro\nano dessa legislatura, substituiu por um mês o governador eleito João\nSeixas Dória.\n\nCom a extinção dos partidos políticos pelo Ato Institucional nº 2 em\noutubro de 1965 e a posterior instauração do bipartidarismo, filiou-se à\nAliança Renovadora Nacional (Arena), agremiação que dava sustentação\npolítica ao regime militar instaurado no país em abril de 1964. Em\nnovembro de 1966 obteve a primeira suplência de deputado federal por\nSergipe na legenda desse partido, assumindo uma cadeira na Câmara em\nfevereiro de 1967, tão logo expirou seu mandato no Legislativo\nsergipano. No pleito de novembro de 1970, voltou a candidatar-se a uma\ncadeira na Assembléia Legislativa de Sergipe, sempre na legenda da\nArena, obtendo apenas a sexta suplência. Exerceu seu mandato de deputado\nfederal até janeiro de 1971, ao final da legislatura. Algum tempo\ndepois, acabou assumindo o mandato no Legislativo sergipano, aí\npermanecendo até 1975.\n\nAfastado do cenário político, em 1976 transferiu-se para Recife.\nPosteriormente, obteve sua aposentadoria como deputado.\n\nFaleceu em Olinda (PE), cidade onde fixara residência, em 13 de novembro\nde 1996.\n\nEra casado com Elisabete Torres Carvalho.\n\nPublicou *Memórias de um matuto sertanejo* (1983).\n\n \n\nFONTES: CÂM. DEP. *Deputados*; CÂM. DEP. *Deputados brasileiros.\nRepertório* (1967-1971); CISNEIROS, A. *Parlamentares*; INF. Clara Onias\nde Sá; TRIB. SUP. ELEIT. *Dados* (2, 3, 4, 6, 8 e 9).\n\n \n","ref":"FONTES: CÂM. DEP. *Deputados*; CÂM. DEP. *Deputados brasileiros.\nRepertório* (1967-1971); CISNEIROS, A. *Parlamentares*; INF. Clara Onias\nde Sá; TRIB. SUP. ELEIT. *Dados* (2, 3, 4, 6, 8 e 9).\n\n \n","dic":"DHBB"}
