{"title":"OURO PRETO, Carlos Silvestre de","cargoss":["Embaixador do Brasil - Alemanha","Embaixador do Brasil - Portugal","Embaixador do Brasil - Itália"],"cargos_esp":["Ocid",0,0],"datas_ini":[1962,1966,1982],"datas_fim":[1966,1970,1984],"estados":[0,0,0],"autor":[0],"content":"**OURO PRETO, Carlos Silvestre de**\n\n\\*diplomata; emb. Bras. Alemanha Ocid. 1962-1966; emb. Bras. Portugal\n1966-1970; emb. Bras. Itália 1982-1984.\n\n \n\n*Carlos Silvestre de Ouro Preto* nasceu na Alemanha no dia 31 de\ndezembro de 1916 — sendo registrado brasileiro de acordo com dispositivo\nconstitucional —, filho de Carlos Celso de Ouro Preto e de Maria Lúcia\nde Ouro Preto. Seu pai foi embaixador do Brasil no Chile de 1946 a 1950\ne na França de 1950 a 1953. Seu avô paterno, Afonso Celso de Assis\nFigueiredo, visconde de Ouro Preto, ocupou durante o Império os cargos\nde ministro da Marinha em 1865, da Fazenda em 1879 e 1889, e ainda em\n1889 foi o último presidente do Conselho de Ministros do imperador Pedro\nII. Seus irmãos Gil Roberto Fernando e Afonso Celso de Ouro Preto também\nseguiram a carreira diplomática.\n\nEm 1937 bacharelou-se em ciências jurídicas e sociais pela Faculdade\nNacional de Direito da Universidade do Brasil, ingressando nesse mesmo\nano na carreira diplomática como secretário de terceira classe. Em 1938\nfoi designado secretário da delegação brasileira à VIII Conferência\nInternacional Americana, realizada em Lima, no Peru, sendo nomeado em\n1940 vice-cônsul provisório do Brasil em Berlim, na Alemanha. Nesse\nmesmo ano foi efetivado na função, que exerceu até 1942, quando passou a\ndesempenhá-la na cidade do Porto, em Portugal.\n\nPromovido a secretário de segunda classe ainda em 1942, tornou-se no ano\nseguinte cônsul-adjunto naquela cidade. Ainda em 1943 foi removido para\nLisboa a fim de assumir o cargo de segundo-secretário da embaixada, que\nocupou até 1945. Nesse ano foi transferido para Havana, em Cuba,\nexercendo ainda provisoriamente a função de cônsul-adjunto em Montreal,\nno Canadá. Chegando a secretário de primeira classe, tornou-se de 1945 a\n1946 encarregado do consulado de Montreal e primeiro-secretário de\nembaixada em Havana. Em 1946 foi designado membro da delegação\nbrasileira à primeira reunião ordinária da Organização Provisória\nInternacional da Aviação Civil, realizada na capital canadense, e no ano\nseguinte foi nomeado secretário das comissões, da Confederação\nInteramericana para a Manutenção da Paz, e da Segurança no Continente.\n\nDe volta ao Brasil em 1948, passou a chefiar a Divisão de Material do\nItamarati, tornando-se em seguida auxiliar do secretário-geral daquele\nministério, no Rio de Janeiro, então Distrito Federal. Em 1949 foi\ndesignado presidente da Comissão de Concorrências do Itamarati e\nprimeiro-secretário e conselheiro comercial da missão brasileira junto à\nOrganização das Nações Unidas (ONU), em Nova Iorque. Promovido em 1950 a\nconselheiro de embaixada, continuou a exercer as mesmas funções junto a\nONU, tendo participado das delegações brasileiras à V Assembléia Geral e\nà Conferência Especial de Assistência Técnica daquela organização. De\n1951 a 1954 foi conselheiro da embaixada brasileira em Bogotá, na\nColômbia, sendo promovido neste último ano a ministro de segunda classe.\nDe 1954 a 1956 foi ministro-conselheiro em Bogotá, tendo sido por\ndiversas vezes encarregado de negócios na capital colombiana.\n\nMinistro-conselheiro e encarregado de negócios da embaixada brasileira\nem Viena, na Áustria, a partir de 1956, em 1958 regressou ao Brasil,\nassumindo de imediato o cargo de assistente do comando da Escola\nSuperior de Guerra (ESG). Nomeado em 1960 chefe da Divisão Política do\nItamarati, tornou-se membro da comissão responsável pela elaboração das\ninstruções para a delegação brasileira à reunião da comissão especial do\nconselho da Organização dos Estados Americanos (OEA) — Comitê dos 21 — e\ndelegado do Brasil ao terceiro período de sessões da comissão especial\npara estudo da formulação de novas medidas de cooperação econômica, em\nBogotá.\n\nNomeado em 1961 chefe-substituto do Departamento Político e Cultural do\nItamarati, foi efetivado como titular ainda nesse ano. Participou também\ndo Grupo de Trabalho de Quito, no Equador, encarregado do estudo da\nagenda provisória da XI Conferência Interamericana e da elaboração das\ninstruções para a delegação brasileira àquela conferência. Foi também,\nna mesma época, chefe do grupo de trabalho incumbido de elaborar e\nestudar a agenda das conversações dos presidentes do Brasil e da Itália.\n\nAinda em 1961 foi promovido a ministro de primeira classe, sendo\ncomissionado em janeiro do ano seguinte embaixador do Brasil na\nRepública Federal da Alemanha. No exercício de suas funções, foi\nsubchefe da delegação brasileira nas negociações realizadas em Bonn, em\n1963, referentes a assuntos de interesses dos dois países. Em junho de\n1966 assumiu a chefia da representação brasileira em Portugal, que\nocupou até janeiro de 1970, quando foi transferido para a embaixada do\nBrasil em Caracas, na Venezuela. Nessa cidade, ainda em 1970,\nparticipou, como delegado brasileiro, da IX Conferência da OEA e da\nreunião da Organização Internacional do Trabalho (OIT). Em 1972\ntornou-se embaixador do Brasil em Berna, na Suíça, onde permaneceu até\n1975.\n\nNomeado embaixador brasileiro na Itália, assumiu o posto em dezembro de\n1982, em substituição a Mário Gibson Barbosa. Permaneceu nessa função\naté junho de 1984, quando deixou o posto que viria a ser ocupado pelo\nembaixador Ramiro Saraiva Guerreiro em abril do ano seguinte.\n\nFaleceu no Rio de Janeiro em 22 de maio de 1985.\n\nEra casado com Ceres Gastal de Ouro Preto.\n\n \n\nFONTES: *Jornal do Brasil* (23/5/85); MIN. REL. EXT. *Almanaque*; MIN.\nREL. EXT. *Anuário* (1973).\n\n \n","ref":"FONTES: *Jornal do Brasil* (23/5/85); MIN. REL. EXT. *Almanaque*; MIN.\nREL. EXT. *Anuário* (1973).\n\n \n","dic":"DHBB"}
