{"title":"PAGANELLA, João ===============","cargoss":["Deputado federal"],"cargos_esp":[0],"datas_ini":[1983],"datas_fim":[1987],"estados":["SC"],"autor":[0],"content":"PAGANELLA, João\n===============\n\n\\* dep. fed. SC 1983-1987.\n\n \n\n*João Valvite Paganella* nasceu em Esmeralda (RS) no dia 10 de maio de\n1932, filho de Vitório Paganella e de Leontina Borges da Cunha\nPaganella.\n\nEstudou no Grupo Escolar de Esmeralda de 1938 a 1944, e no Ginásio São\nFrancisco, de 1946 a 1950, ambos em Vacaria (RS). Em 1951, matriculou-se\nno colégio Nossa Senhora do Carmo, em Caxias do Sul (RS), por onde\ngraduou-se técnico em contabilidade em 1954.\n\nBancário entre 1952 e 1955 e contador de 1955 a 1956, começou na\npolítica elegendo-se, em outubro de 1956, vereador em Chapecó (SC),\nexercendo o mandato, de 1957 a 1961. Voltou à Câmara Municipal em 1965,\nnovamente eleito na legenda da UDN e, em 1966, assumiu a presidência da\ncasa. Nessa condição, foi por alguns dias prefeito em exercício do\nmunicípio.  Nesse mesmo ano, bacharelou-se em ciências jurídicas e\nsociais pela Faculdade de Direito de Passo Fundo (RS).\n\nAinda em 1966, em decorrência da extinção do pluripartidarismo e da\ninstauração do bipartidarismo, determinadas pelo AI-2 (27/10/65),\ninscreveu-se na Aliança Renovadora Nacional (Arena), partido de apoio ao\nregime militar instalado no país em abril de 1964. Encerrou seu mandato\nde vereador em janeiro de 1969. Entre 1968 e 1973, lecionou no Colégio\nSão Francisco e na Fundação de Desenvolvimento do Ensino do Oeste\nCatarinense, ambos em Chapecó.\n\nEm 1972, elegeu-se vice-prefeito de Chapecó, na legenda da Arena, em\nchapa encabeçada por Altair Vagner, tomando posse em janeiro de  1973.\nParalelamente, dedicou-se a atividades empresariais, tendo sido fundador\ne um dos diretores da Extrafino, empresa do setor agroindustrial, entre\n1971 e 1975.\n\n                No início do governo de Antônio Carlos Konder Reis\n(1975-1979), foi nomeado secretário dos Negócios do Oeste. Exerceu o\ncargo durante toda a administração Konder Reis e ao longo do governo de\nJorge Bornhausen (1979-1982). Por ocasião da reformulação do quadro\npartidário que se seguiu à extinção do bipartidarismo (novembro de\n1979), inscreveu-se no Partido Democrático Social (PDS), que deu\ncontinuidade à linha política da extinta Arena.\n\nDesincompatibilizou-se do cargo de secretário em maio de 1982 para\ncandidatar-se, na legenda do PDS, a uma cadeira na Câmara dos Deputados.\nPassou a exercer, em seguida, o cargo de procurador fiscal do Estado de\nSanta Catarina, pelo qual se aposentou no final do mesmo ano. Em\nnovembro, foi eleito deputado federal por Santa Catarina, tomando posse\nem 1° de fevereiro de 1983.  Nesse mesmo ano, tornou-se membro dos\ndiretórios regional e nacional do PDS, nos quais permaneceria até 1985.\n\n                Nos primeiros meses de 1984 houve a campanha popular\npelo restabelecimento de eleições diretas para a escolha do sucessor do\ngeneral João Figueiredo (1979-1985) na presidência da República. No\nCongresso Nacional  tramitava o projeto de emenda constitucional\napresentada pelo deputado Dante de Oliveira (PMDB-MT), propondo o\nrestabelecimento do pleito direto para novembro de 1984.  No dia da\nvotação do projeto pela Câmara dos Deputados, em 25 de abril de 1984,\nJoão Paganella não compareceu ao plenário. A insuficiência de votos para\nque a emenda fosse encaminhada à apreciação do Senado resultou na\nmanutenção das eleições presidenciais pelo Colégio Eleitoral.\n\n                No dia 15 de janeiro de 1985, quando o Colégio Eleitoral\nse reuniu para escolher o presidente da República, obedecendo a\norientação de seu partido, Paganella votou em Paulo Maluf, candidato do\nPDS, que acabou derrotado pelo oposicionista Tancredo Neves, candidato\nda Aliança Liberal, coligação formada pelo Partido do Movimento\nDemocrático Brasileiro (PMDB) e pelos dissidentes do PDS. Tancredo,\ncontudo, por motivo de doença, não chegou a ser empossado, vindo a\nfalecer em 21 de abril de 1985. Seu substituto foi o vice José Sarney,\nque já vinha exercendo o cargo desde 15 de março.\n\nDurante o mandato de deputado federal, Paganella foi membro titular da\nComissão da Agricultura e Política Rural (1983-1987), da qual foi\nvice-presidente em 1984, da Comissão do Índio (1983-1984), da Comissão\nEspecial de Reforma Agrária (1984-1985), e suplente da Comissão da\nConstituição e Justiça (1984).  Nas eleições de novembro de 1986 tentou\na reeleição sem, contudo,  obter êxito.  Deixou a Câmara em janeiro de\n1987, ao final da legislatura.\n\n                Advogado especializado em direito administrativo, não\nvoltou a disputar eleições. Contudo, manteve seus vínculos com a\npolítica estadual e, em 1992, filiou-se ao Partido da Frente Liberal\n(PFL), liderado em Santa Catarina pelo ex-senador Jorge Bornhausen.\n\nCasou-se com Marlene Broilo Paganella, com quem teve cinco filhos.\n\nPublicou *Esmeralda, uma pequena contribuição à sua história* (1985)\n\n \n\nFONTES: ASSEMB. LEGISL. SC. *Dicionário político*;**CÂM. DEP. *Deputados\nbrasileiros. Repertório*(1983-1987);**CURRIC. BIOG.; INF. BIOG.\n","ref":"FONTES: ASSEMB. LEGISL. SC. *Dicionário político*;**CÂM. DEP. *Deputados\nbrasileiros. Repertório*(1983-1987);**CURRIC. BIOG.; INF. BIOG.\n","dic":"DHBB"}
