{"title":"PAGLIOLI, Eliseu","cargoss":["Ministro da Saúde"],"cargos_esp":[0],"datas_ini":[1962],"datas_fim":[1963],"estados":[0],"autor":[0],"content":"**PAGLIOLI, Eliseu**\n\n\\*min. Saúde 1962-1963.\n\n \n\n*Eliseu Paglioli* nasceu em Caxias do Sul (RS) no dia 28 de dezembro de\n1898, filho de Francisco Paglioli e de Jacomina d’Ambroz Paglioli.\n\nDiplomou-se pela Faculdade de Medicina de Porto Alegre, conquistando\nposteriormente a livre-docência em anatomia, obstetrícia, clínica\npropedêutica e cirúrgica e pediatria cirúrgica.\n\nPrefeito de Porto Alegre de janeiro a novembro de 1951, tornou-se\ndiretor do Instituto de Neurocirurgia, professor catedrático da\nFaculdade de Medicina de Porto Alegre e reitor da Universidade do Rio\nGrande do Sul.\n\nNomeado em setembro de 1962 ministro da Saúde do governo parlamentarista\nde João Goulart durante a gestão de Hermes Lima como primeiro-ministro,\nexerceu essa função até janeiro do ano seguinte. Posteriormente,\nretornou à reitoria da universidade, à frente da qual permaneceu até\nabril de 1964, quando se demitiu por considerar-se identificado com o\nregime deposto pelo movimento político-militar de 31 de março desse ano.\n\nDepois de deixar a reitoria, retornou ao exercício da medicina. Em\nfevereiro de 1978, manifestou-se favoravelmente a uma anistia ampla a\ntodos os professores da Universidade Federal do Rio Grande do Sul\ndemitidos ou punidos por atos de exceção, condenando as demissões\nocorridas em 1964, as quais denunciou como responsáveis pelo afastamento\ndos melhores professores e cientistas do Brasil.\n\nFaleceu em Porto Alegre no dia 22 de dezembro de 1985.\n\nFoi casado com Ada Beck Paglioli, já falecida, com quem teve quatro\nfilhos.\n\nPublicou, entre outras obras, *Ventriculografia cerebral*, *Hemostasia\ndo cérebro*, *Cirurgia craniencefálica* e *A foliculina no aparelho\ngenital feminino*.\n\n \n\nFONTES: COUTINHO, A. *Brasil*; *Encic. Mirador*; *Grande encic. Delta*;\n*Jornal do Brasil* (21/2/78 e 23/12/85); SOC. BRAS. EXPANSÃO COMERCIAL.\n*Quem*; VÍTOR, M. *Cinco*.\n\n \n","ref":"FONTES: COUTINHO, A. *Brasil*; *Encic. Mirador*; *Grande encic. Delta*;\n*Jornal do Brasil* (21/2/78 e 23/12/85); SOC. BRAS. EXPANSÃO COMERCIAL.\n*Quem*; VÍTOR, M. *Cinco*.\n\n \n","dic":"DHBB"}
