{"title":"PAGNONCELLI, Henrique","cargoss":["Deputado federal","Deputado federal","Deputado federal","Deputado federal"],"cargos_esp":[0,0,0,0],"datas_ini":[1958,1957,1956,1951],"datas_fim":[1959,1957,0,1954],"estados":["RS","RS","RS","RS"],"autor":[0],"content":"**PAGNONCELLI, Henrique**\n\n\\*dep. fed. RS 1951-1954, 1956, 1957 e 1958-1959.\n\n \n\n*Henrique Pagnoncelli* nasceu em Erechim (RS) no dia 30 de julho de\n1913, filho de Saule Pagnoncelli, rico imigrante italiano dono de\nempresas ligadas à moagem de trigo e de frigoríficos, e de Vincenza\nPagnoncelli, também italiana.\n\nCursou o Colégio Santo Antônio, em Garibaldi (RS), o Colégio\nArquidiocesano e o Ginásio Osvaldo Cruz. Bacharelou-se pela Faculdade de\nDireito de São Paulo, especializando-se em direito fiscal e economia.\nIntegrou o Sindicato dos Moageiros de Trigo do Rio Grande do Sul.\n\nCandidato derrotado a prefeito de Erechim em 1948, elegeu-se deputado\nfederal por seu estado no pleito de outubro de 1950, pela legenda do\nPartido Trabalhista Brasileiro (PTB), assumindo o mandato em fevereiro\ndo ano seguinte. Nas eleições de outubro de 1954, tornou a candidatar-se\na deputado federal pelo Rio Grande do Sul, sempre na legenda do PTB,\nobtendo apenas uma suplência. Concluiu seu primeiro mandato em dezembro\nde 1954 e voltou a ocupar uma cadeira na Câmara Federal em janeiro de\n1956, de setembro a novembro de 1957 e de fevereiro de 1958 a janeiro de\n1959, quando, ao final da legislatura, abandonou definitivamente a\nCâmara dos Deputados. Nesse período, alinhou-se a Fernando Ferrari na\ndisputa por este travada no interior do PTB com Leonel Brizola.\n\nRadicado no Rio de Janeiro desde o início de sua vida parlamentar,\nfaleceu nesta cidade em 16 de setembro de 1974.\n\nEra casado com Deliza de Paola Pagnoncelli, com quem teve sete filhos.\n\n \n\nFONTES: AUDRÁ, A. *Bancada*; CÂM. DEP. *Deputados*; CÂM. DEP. *Relação\ndos deputados*; CISNEIROS, A. *Parlamentares*; INF. FAM. DELIZA\nPAGNONCELLI; TRIB. SUP. ELEIT. *Dados* (2, 3 e 4).\n\n \n","ref":"FONTES: AUDRÁ, A. *Bancada*; CÂM. DEP. *Deputados*; CÂM. DEP. *Relação\ndos deputados*; CISNEIROS, A. *Parlamentares*; INF. FAM. DELIZA\nPAGNONCELLI; TRIB. SUP. ELEIT. *Dados* (2, 3 e 4).\n\n \n","dic":"DHBB"}
