{"title":"PAIS, Márcio","cargoss":["Deputado federal"],"cargos_esp":[0],"datas_ini":[1971],"datas_fim":[1975],"estados":["RJ"],"autor":[0],"content":"**PAIS, Márcio**\n\n\\*dep. fed. RJ 1971-1975.\n\n \n\n*Márcio Moreira Pais* nasceu em Campos (RJ) no dia 13 de julho de 1926,\nfilho de Manuel Pais Filho e de Maria Hermínia Moreira Pais.\n\nBacharelou-se em ciências jurídicas e sociais pela Faculdade de Direito\ndo Rio de Janeiro em 1967.\n\nProprietário rural dedicado à agricultura, elegeu-se deputado federal\npelo Rio de Janeiro no pleito de novembro de 1970 na legenda da Aliança\nRenovadora Nacional (Arena) — partido de sustentação do regime militar\ninstaurado no país em abril de 1964 —, assumindo o mandato em fevereiro\ndo ano seguinte. Durante essa legislatura, foi membro da Comissão de\nAgricultura e Política Rural e suplente da Comissão de Minas e Energia\nda Câmara dos Deputados. Candidatou-se novamente a deputado federal por\nseu estado em novembro de 1974, sempre na legenda da Arena, obtendo\napenas a terceira suplência. Deixou  a Câmara em janeiro de 1975.\n\nFoi também diretor do Departamento de Assistência Econômica à Lavoura,\npresidente do Instituto de Previdência Social do Estado do Rio de\nJaneiro e subchefe do gabinete civil do governo do Rio de Janeiro.\n\nFaleceu no dia 23 de junho de 1997.\n\nEra casado com Ranid de Castro Pais.\n\n \n\nFONTES: CÂM. DEP. Deputados; CÂM. DEP. *Deputados brasileiros.\nRepertório* (1971-1975); IPC. *Relação*; NÉRI, S. *16*; *Perfil* (1972).\n\n \n","ref":"FONTES: CÂM. DEP. Deputados; CÂM. DEP. *Deputados brasileiros.\nRepertório* (1971-1975); IPC. *Relação*; NÉRI, S. *16*; *Perfil* (1972).\n\n \n","dic":"DHBB"}
