{"title":"ÁTILA, Carlos","cargoss":["Ministro do Tribunal de Contas"],"cargos_esp":[0],"datas_ini":[1985],"datas_fim":[1998],"estados":[0],"autor":[0],"content":"**ÁTILA, Carlos**\n\n\\*diplomata; min. TCU 1985-1998.\n\n \n\n*Carlos Átila Álvares da Silva* nasceu em Nova Lima (MG) no dia 26 de\nmaio de 1938, filho de Joaquim de Oliveira Álvares da Silva e de Luísa\nAraújo Álvares da Silva.\n\nIniciou o curso ginasial no Colégio Arnaldo, em Belo Horizonte, em 1948,\nconcluindo-o no Instituto Princesa Isabel, no Rio de Janeiro, em 1953.\nNo ano seguinte, passou a estudar no Colégio Andrews, também no Rio,\nonde fez o curso clássico. Em 1957 ingressou na Faculdade de Direito da\nPontifícia Universidade Católica (PUC) do Rio de Janeiro, pela qual se\nbacharelou em 1961. A partir de 1960 iniciou também o curso de\npreparação à carreira de diplomata no Instituto Rio Branco, que concluiu\nigualmente em 1961.\n\n Como terceiro-secretário, foi assessor da Divisão de Pessoal do\nMinistério das Relações Exteriores (MRE) no biênio 1961-1962, e em 1962\nfoi oficial de gabinete do ministro das Relações Exteriores. No ano\nseguinte, integrou a Assessoria Técnica da Presidência da República. Em\n1964-1965 foi assessor da Divisão de Política Comercial, da Divisão de\nAtos Internacionais e da Divisão de Produtos de Base do MRE. Ainda em\n1964 fez um curso de extensão em lógica na Faculdade de Filosofia da\nPUC-Rio, foi assessor da delegação brasileira à Conferência das Nações\nUnidas para o Comércio e Desenvolvimento (Unctad), em Genebra,\nparticipou da delegação brasileira às reuniões dos comitês executivo e\nadministrativo e à Assembleia Geral da Aliança dos Produtores de Cacau,\nno Rio de Janeiro, e coordenou a delegação do Brasil ao seminário da\nComissão Econômica para a América Latina (CEPAL) de Peritos\nGovernamentais em Política Comercial, em Brasília.\n\nEm 1965 foi removido para em Buenos Aires, onde chefiou o setor\neconômico da embaixada do Brasil até 1968. Realizou duas missões em\n1965: foi delegado do Brasil à II Reunião da Junta do Acordo\nInternacional do Cacau, em Lagos, na Nigéria, e assessor da delegação\nbrasileira ao grupo de trabalho sobre preços e quotas da Conferência da\nOrganização das Nações Unidas (ONU) sobre o Acordo Internacional do\nCacau, em Nova Iorque. Promovido a segundo-secretário em 1966, nos dois\nanos seguintes assessorou a delegação brasileira à Comissão Especial\nBrasileiro-Argentina de Coordenação, em Buenos Aires.\n\nEntre 1968 e 1971, foi assessor da delegação permanente do Brasil junto\nà Associação Latino-Americana de Livre Comércio (ALALC), em Montevidéu.\nEm 1971, foi delegado à II Reunião Ordinária da Comissão Especial de\nConsulta e Negociação do Comitê Interamericano Econômico e Social, em\nPunta del Este, e à VII Reunião da Comissão Especial\nBrasileiro-Argentina de Coordenação, em Brasília. Chefe interino da\nDivisão de Programação para Promoção Comercial em 1971-1972, nesse\núltimo ano foi promovido a primeiro-secretário e efetivado na chefia da\nmesma divisão até 1973. Dirigiu o I e o II cursos de treinamento e\naperfeiçoamento para chefes de setores de promoção comercial das\nembaixadas do Brasil, em Brasília, em 1972-1973. Em 1975 tornou-se chefe\nda Divisão de Pessoal e coordenador do curso de prática diplomática e\nconsular do Instituto Rio Branco, em Brasília.\n\nDe 1978 a 1979, no governo Ernesto Geisel (1974-1979), foi assessor\nadjunto da Assessoria de Relações Públicas da Presidência da República.\nRemovido para Paris, aí chefiou o setor de promoção comercial da\nembaixada de 1979 a 1981, quando retornou o Brasil, foi promovido a\nministro de segunda classe e se tornou chefe de gabinete do ministro da\nEducação e Cultura. Ainda em 1981, no governo do general João Batista\nFigueiredo (1979-1985), foi nomeado secretário de Imprensa e Divulgação\nda Presidência da República. Foi porta-voz da Presidência até 1985,\nquando foi promovido a ministro de primeira classe e designado ministro\ndo Tribunal de Contas da União (TCU).\n\nEm 1989 foi delegado do TCU ao VIII Congresso Latino-Americano de\nEntidades Fiscalizadoras Superiores, na antiga Berlim Ocidental, e em\n1991 participou, como representante do TCU, do Seminário Internacional\nsobre Controle Externo da Fundação Alemã para Desenvolvimento\nInternacional.\n\nExerceu a presidência do TCU nos anos de 1992 e 1993, sendo que em 1992\nfoi representante do tribunal na reunião do conselho diretor da\nOrganização Latino-Americana e do Caribe de Entidades Fiscalizadoras\nSuperiores (Olacefs) e no XIV Congresso da International Organization of\nSuperior Audit Institutions (Intosai) em Washington. Em 1993 ocupou a\nsegunda-vice-presidência da Intosai e representou o TCU na reunião do\nconselho diretor da Olacefs, no comitê coordenador do X Congresso\nLatino-Americano de Entidades Fiscalizadoras Superiores, em San José, na\nCosta Rica, e na reunião do Conselho da Intosai, em Viena. Em 1995\nparticipou do II Congresso Internacional de Auditoria Integral, em\nBuenos Aires, e, no ano seguinte, da Reunião de Entidades de\nFiscalização Superior dos Países do Mercosul.\n\nDeixou o TCU em dezembro de 1998 e passou a trabalhar como advogado em\nBrasília. Em 2001 registrou, junto com seu filho e sócio Alexandre\nBoureau Álvares da Silva, a empresa Alambique da Cachaça do Ministro\nLtda., e passou a produzir a bebida.\n\nCasado com Tânia Boureau Álvares da Silva, teve um casal de filhos.\n\n \n\nFONTES: CURRIC. BIOG.; INF. BIOG.; TCU. *Dados*(1893-1990); Sítio\nCachaça do Ministro.\n\n \n\n \n","ref":"FONTES: CURRIC. BIOG.; INF. BIOG.; TCU. *Dados*(1893-1990); Sítio\nCachaça do Ministro.\n\n \n\n \n","dic":"DHBB"}
