{"title":"PAIXÃO, Lisandro Vieira da","cargoss":["Deputado federal","Deputado federal"],"cargos_esp":[0,0],"datas_ini":[1965,1963],"datas_fim":[1965,1963],"estados":["GO","GO"],"autor":[0],"content":"**PAIXÃO, Lisandro Vieira da**\n\n\\*dep. fed. GO 1963 e 1965.\n\n \n\n*Lisandro Vieira da Paixão* nasceu em Anicuns (GO) no dia 18 de julho de\n1925, filho de Luís Vieira da Paixão, agente dos Correios, e de Maria\nFrancisca da Paixão. Seu irmão, Francisco Vieira da Paixão, foi prefeito\nde Anicuns.\n\nEm 1955 formou-se em medicina pela Faculdade Fluminense de Medicina.\n\nIngressou na vida política em 1959 filiando-se ao Partido Trabalhista\nBrasileiro (PTB), do qual foi um dos fundadores no estado e presidente\naté 1962. No período 1961-1962 exerceu o cargo de superintendente médico\ndo Instituto de Aposentadoria e Pensões dos Comerciários (IAPC) em seu\nestado. Ainda em 1961 assumiu a presidência da Caixa Econômica Federal\nem Goiás.\n\nElegeu-se suplente de deputado federal por Goiás em outubro de 1962.\nExerceu o mandato de abril a setembro de 1963 e de março a outubro de\n1965. Com a eclosão do movimento político-militar de 31 de março de\n1964, que depôs o presidente João Goulart (1961-1964), ficou 45 dias\npreso sob acusação de subversão. No dia 27 de outubro de 1965 foi\noutorgado o Ato Institucional nº 2 (AI-2), que estabeleceu a eleição\nindireta para a presidência da República e dissolveu todos os partidos\npolíticos existentes, criando o bipartidarismo. Lisandro da Paixão\nfiliou-se ao Movimento Democrático Brasileiro (MDB), partido de oposição\nao regime militar. Em 1966, Lisandro Paixão teve seus diretos políticos\ncassados por ato do presidente Castelo Branco, deixando Goiás e\ntransferindo-se para o Rio de Janeiro, onde dedicou-se à medicina.\n\nDe volta a Goiás em 1974, tornou-se professor da Universidade Federal de\nGoiás. Com a decretação de anistia em 1976 teve os seus direitos\npolíticos restaurados e concorreu mais uma vez a uma cadeira na Câmara\ndos Deputados na legenda emedebista, nas eleições de 1978. Não conseguiu\nse eleger.\n\nCom o fim do bipartidarismo e a conseqüente reorganização partidária\ningressou no Partido do Movimento Democrático Brasileiro (PMDB). Nas\neleições de novembro de 1982, disputou uma vaga na Assembléia\nLegislativa de Goiás e mais uma vez não teve sucesso.\n\nSimpatizante de Leonel Brizola, que perdera a sigla do PTB para Ivete\nVargas, ingressou no Partido Democrático Trabalhista (PDT) fundado em\nsetembro de 1980 pelo grupo liderado por Brizola. Ocupou a presidência\ndo PDT no estado entre 1981 e 1982.\n\nNão voltou a disputar cargos eletivos, dedicando-se às atividades\nmédicas. Em 1999 deixou o PDT, filiou-se ao Partido Progressista\nSocialista (PPS) e tornou-se presidente do partido em Nova Glória (GO).\nAlém disso, ocupou o cargo de diretor médico de Nova Glória.\n\nFoi também fundador da Faculdade de Medicina e dono da Rádio Jornal de\nGoiás.\n\nLisandro Paixão casou-se com Edila Melo da Paixão, com quem teve quatro\nfilhos.\n\nFONTES: CÂM. DEP. *Deputados*; CÂM. DEP. *Deputados brasileiros*.\n*Repertório*(1946-1967); INF. BIOG.; TRIB. SUP. ELEIT. *Dados*(6).\n\n \n","ref":"FONTES: CÂM. DEP. *Deputados*; CÂM. DEP. *Deputados brasileiros*.\n*Repertório*(1946-1967); INF. BIOG.; TRIB. SUP. ELEIT. *Dados*(6).\n\n \n","dic":"DHBB"}
