{"title":"PALHANO, Aluísio","cargoss":["Presidente de associação ou confederação de empregados ou empregadores"],"cargos_esp":["Contec"],"datas_ini":[1963],"datas_fim":[1964],"estados":[0],"autor":[0],"content":"**PALHANO, Aluísio**\n\n\\*pres. Contec 1963-1964.\n\n \n\n*Aluísio Palhano Pedreira Ferreira* nasceu em Pirajuí (SP), filho de\nJoão Alves Pedreira Ferreira e de Henise Palhano.\n\nFuncionário do Banco do Brasil desde 1942, diplomou-se em direito em\n1948.\n\nPresidente do Sindicato dos Bancários do Rio de Janeiro por dois\nmandatos consecutivos, liderou em 1961 a greve geral de sua categoria em\ndefesa de aumento salarial e do 13º salário. Em agosto de 1963,\nelegeu-se presidente da Confederação Nacional dos Trabalhadores em\nEstabelecimentos de Crédito (Contec), associação sindical de âmbito\nnacional criada em julho de 1958. Nesse mesmo período, tornou-se um dos\ndirigentes do Comando Geral dos Trabalhadores (CGT), organização\nintersindical, também de âmbito nacional, fundada em 1962 com o objetivo\nde coordenar e dirigir o movimento sindical brasileiro.\n\nComo presidente da Contec, participou das campanhas reivindicatórias e\nem defesa das reformas de base, que caracterizaram o governo de João\nGoulart (1961-1964). Em fevereiro de 1964 assinou manifesto de\nconvocação para o comício presidido por Goulart, a ser realizado no dia\n13 de março seguinte em frente à estação da Central do Brasil, no Rio,\nem defesa das liberdades democráticas, da extensão do voto aos\nanalfabetos e soldados e da implementação das reformas de base. Em\nmarço, também como representante da Contec, participou de um congresso\nda Organização Internacional do Trabalho (OIT) na República Democrática\nAlemã, de onde regressou no dia 15, dois dias após o chamado Comício da\nCentral.\n\nCom a vitória do movimento político-militar que depôs o governo Goulart\nem 31 de março do mesmo ano, a Contec, assim como outras associações\nsindicais, sofreu intervenção do Ministério do Trabalho. No dia 10 de\nabril Palhano teve seus direitos políticos cassados pelo Ato\nInstitucional nº 1, editado no dia anterior. Em junho, solicitou asilo\npolítico na embaixada do México, país onde permaneceu até o final de\n1964 como editor do jornal dos exilados, Correio Brasiliense. Em\ndezembro, viajou para Cuba, onde trabalhou na Rádio de Havana, e, em\n1969, presidiu o congresso da Organização Latino-Americana de\nSolidariedade (OLAS).\n\nSegundo dossiê preparado pelo Comitê Brasileiro de Anistia do Rio de\nJaneiro (CBA-RJ) e a carta-denúncia do ex-presidente da União Nacional\ndos Estudantes (UNE), Altino Rodrigues Dantas Júnior, então detido por\nmotivos políticos no presídio Barro Branco, em São Paulo, Palhano\nretornou ao Brasil em 1970 como militante da organização clandestina\nVanguarda Popular Revolucionária (VPR), tendo sido preso no dia 9 de\nmaio do ano seguinte em São Paulo. Segundo essas fontes, foi torturado\nnas dependências do Centro de Informações da Marinha (Cenimar) e\ntransferido uma semana depois para o Departamento de Operações Internas\ndo Centro de Operações para a Defesa Interna (DOI-CODI) de São Paulo,\nórgão do II Exército onde, após novas torturas, veio a falecer no dia 21\nde maio de 1971.\n\nNo entanto, Aluísio Palhano foi dado oficialmente como desaparecido,\nsituação em que permaneceu, mesmo após a divulgação, em agosto de 1978,\ndas mencionadas denúncias.\n\nEra casado com Leda Pimenta Pedreira Ferreira, com quem teve dois\nfilhos.\n\n \n\n \n\nFONTES: CABRAL, R. Desaparecidos; CORRESP. CONF. NAC. TRAB. EMPRESAS DE\nCRÉDITO.\n\n \n","ref":"FONTES: CABRAL, R. Desaparecidos; CORRESP. CONF. NAC. TRAB. EMPRESAS DE\nCRÉDITO.\n\n \n","dic":"DHBB"}
