{"title":"PARENTE, Joaquim","cargoss":["Senador","Deputado federal"],"cargos_esp":[0,0],"datas_ini":[1959,1967],"datas_fim":[1967,1971],"estados":["PI","PI"],"autor":[0],"content":"**PARENTE, Joaquim**\n\n\\*sen. PI 1959-1967; dep. fed. PI 1967-1971.\n\n \n\n*Joaquim Santos* Parente nasceu em Bom Jesus da Gurguéia (PI) no dia 3\nde março de 1912, filho de Odilon Parente e de Raimunda Santos Parente.\n\nComerciante e industrial, realizou curso de especialização em construção\ncivil.\n\nNo pleito de outubro de 1958, elegeu-se senador pelo Piauí na legenda da\ncoligação formada pela União Democrática Nacional (UDN) e o Partido\nTrabalhista Brasileiro (PTB), assumindo o mandato em fevereiro de 1959.\nNos anos de 1964 e 1965, foi quarto-secretário do Senado, e, com a\nextinção dos partidos políticos pelo Ato Institucional nº 2 (27/10/1965)\ne a posterior instauração do bipartidarismo, filiou-se à Aliança\nRenovadora Nacional (Arena). Elegeu-se deputado federal por seu estado\nna legenda da Arena no pleito de novembro de 1966, assumindo o mandato\nem fevereiro de 1967, tão logo deixou o Senado. No pleito de novembro de\n1970, elegeu-se suplente de deputado federal pelo Piauí, sempre na\nlegenda da Arena. Deixou a Câmara em janeiro de 1971, não voltando a\nexercer o mandato.\n\nFaleceu no dia 15 de dezembro de 1974. Era casado com Regina Garcia\nParente.\n\n \n\n \n\nFONTES: CÂM. DEP. Deputados; CÂM. DEP. Deputados brasileiros. Repertório\n(6); Jornal do Brasil (16/12/74); Rev. Ciência Pol. (1966); SENADO.\nDados; SENADO. Relação; TRIB. SUP. ELEIT. Dados (9).\n\n \n","ref":"FONTES: CÂM. DEP. Deputados; CÂM. DEP. Deputados brasileiros. Repertório\n(6); Jornal do Brasil (16/12/74); Rev. Ciência Pol. (1966); SENADO.\nDados; SENADO. Relação; TRIB. SUP. ELEIT. Dados (9).\n\n \n","dic":"DHBB"}
