{"title":"PARIJÓS, Nélson","cargoss":["Constituinte","Deputado federal"],"cargos_esp":[0,0],"datas_ini":[1946,1946],"datas_fim":[1946,1959],"estados":[0,"PA"],"autor":[0],"content":"**PARIJÓS, Nélson**\n\n\\*const. 1946; dep. fed. PA 1946-1959.\n\n \n\n*Nélson da Silva Parijós* nasceu em Cametá (PA) no dia 19 de abril de\n1884, filho de Antônio Joaquim Alves da Silva, comerciante português, e\nde Genoveva Maria de Parijós e Silva.\n\nFez seus estudos no Seminário Menor Nossa Senhora do Carmo, no Colégio\nPará e Amazonas e no Liceu Paraense de Belém. Cursou em seguida a Escola\nAcadêmica do Porto, em Portugal, e formou-se em agronomia pela Escola\nSuperior de Agronomia de Gembioux, na Bélgica. Voltando ao Brasil,\nbacharelou-se em ciências jurídicas e sociais pela Faculdade de Direito\ndo Pará.\n\nRegressando à sua cidade natal, passou a se dedicar à cacauicultura e à\nexploração de castanhas. Em julho de 1911 ocupou o cargo de tesoureiro\nda municipalidade de sua cidade e organizou uma colônia de pescadores.\nFiliado ao Partido Republicano Federal, foi tabelião em Abaeté, atual\nAbaetetuba (PA), até 1920, retornando em seguida a Cametá e às\natividades de cacauicultor. Em 1926, no governo estadual de Dionísio\nBentes, tornou-se diretor do campo de cacau de Cametá, então criado. Ao\nfim de dois anos esse campo foi transformado na Estação Experimental de\nCacau, de caráter federal. Nessa época, Parijós foi ainda promotor\npúblico e chefe de polícia de Marabá (PA).\n\nVoltando a Cametá em 1930, depois da revolução que levou Getúlio Vargas\nao governo do país, integrou a Frente Única Paraense, organizada em 1934\npor elementos que se opunham ao interventor Joaquim de Magalhães Barata\ne que se constituiu na maior força política na região do rio Tocantins.\nDurante o governo constitucional de José Malcher (1935-1937) ocupou o\ncargo de prefeito de sua cidade natal.\n\nApós a extinção do Estado Novo em 29 de outubro de 1945, elegeu-se em\ndezembro do mesmo ano deputado à Assembléia Nacional Constituinte, na\nlegenda do Partido Social Democrático (PSD). Assumindo o mandato em\nfevereiro do ano seguinte, participou dos trabalhos constituintes e,\napós a promulgação da nova Constituição, em 18 de setembro de 1946,\npassou a exercer seu mandato ordinário. Durante essa legislatura foi\nmembro da Comissão Permanente de Obras Públicas, da Comissão Especial de\nPecuária e da Comissão de Valorização da Amazônia.\n\nEm outubro de 1950 tornou a se eleger deputado federal, ainda na legenda\ndo PSD. Em outubro de 1954, lançado pela Aliança Social Democrática,\nconstituída no Pará pelo PSD e pelo Partido de Representação Popular\n(PRP), reelegeu-se ainda uma vez. Deixou a Câmara dos Deputados em\njaneiro de 1959, ao final de seu mandato.\n\nFaleceu em Cametá no dia 5 de janeiro de 1970.\n\nEra casado com Dolores Nabiça, com quem teve três filhos, dos quais dois\n— Rui Parijós e Max Parijós — se tornaram deputados estaduais no Pará.\n\n \n\n \n\nFONTES: BORGES, R. Vultos; CÂM. DEP. Deputados; CÂM. DEP. Relação dos\ndep.; CISNEIROS, A. Parlamentares; Diário do Congresso Nacional; Grande\nencic. Delta; TRIB. SUP. ELEIT. Dados (1, 2 e 3).\n\n \n","ref":"FONTES: BORGES, R. Vultos; CÂM. DEP. Deputados; CÂM. DEP. Relação dos\ndep.; CISNEIROS, A. Parlamentares; Diário do Congresso Nacional; Grande\nencic. Delta; TRIB. SUP. ELEIT. Dados (1, 2 e 3).\n\n \n","dic":"DHBB"}
