{"title":"AUGUSTO, José","cargoss":["Deputado federal","Governador de estado ou do Distrito Federal","Senador","Deputado federal","Constituinte","Deputado federal","Presidente de associação ou confederação de empregados ou empregadores"],"cargos_esp":[0,0,0,0,0,0,"ACRJ"],"datas_ini":[1915,1924,1928,1935,1946,1946,1959],"datas_fim":[1923,1928,1930,1937,1946,1955,1961],"estados":["RN","RN","RN","RN",0,"RN",0],"autor":[0],"content":"**AUGUSTO, José**\n\n\\*dep. fed. RN 1915-1923; gov. RN 1924-1928; sen. RN 1928-1930; dep.\nfed. RN 1935-1937; const. 1946; dep. fed. RN 1946-1955; pres. ACRJ\n1959-1961.\n\n \n\n*José Augusto Bezerra de Medeiros* nasceu em Caicó (RN), no sertão de\nSeridó, região vizinha à Paraíba, em 22 de outubro de 1884, filho de\nManuel Augusto Bezerra de Araújo e de Cândida Olindina de Medeiros.\nPertencia a uma importante família de políticos, uma das oligarquias de\nseu estado. Seu avô materno, José Bernardo de Medeiros, chefe político\ndo Seridó por mais de três décadas no fim do Império e início da\nRepública, foi várias vezes deputado estadual e senador pelo Rio Grande\ndo Norte. Seu avô paterno, Silvino Bezerra de Araújo Galvão, foi, como o\noutro, deputado estadual e líder do Partido Republicano Federal (PRF),\nalém de vice-govermdor do estado entre 1892 e 1896. Seu pai, bacharel e\nprofessor em Caicó, foi deputado estadual. Seu tio Juvenal Lamartine de\nFaria foi vice-governador do estado de 1904 a 1906, deputado federal,\nsenador e governador do Rio Grande do Norte de 1928 a 1930. Seu irmão\nSilvino Bezerra Neto, desembargador, recusou-se a assumir a\ninterventoria federal no estado após a Revolução de 1930.\n\nFez os estudos primários em Caicó, com a mãe, em Natal e em Acari (RN),\ne o secundário no Ateneu Norte-Rio-Grandense, em Natal. Cursou em\nseguida a Faculdade de Direito de Recife entre 1901 e 1905, tendo sido o\norador de sua turma na solenidade de formatura.\n\nAinda estudante, em 1905, foi nomeado procurador interino da República\nno Rio Grande do Norte. Recém-formado, montou um escritório de advocacia\nem Natal. Em 1906, foi nomeado professor de história geral e do Brasil\nno Ateneu Norte-Rio-Grandense. Transferiu-se no ano seguinte para o Rio\nde Janeiro, então Distrito Federal, e aí foi nomeado inspetor do governo\nfederal junto ao Colégio Abílio. Regressando a Natal em 1908, tornou-se\nprofessor de geografia no Ateneu. No ano seguinte, passou a lecionar\ntambém instrução cívica e direito usual, assumindo em 1910 a direção do\nestabelecimento e da instrução pública estadual. Nomeado juiz de direito\nem Caicó em 1911, no ano seguinte foi chefe de polícia interino do\nestado. Obteve seu primeiro mandato parlamentar em 1913, quando se\nelegeu deputado estadual pelo PRF, tornando-se líder da maioria na\nAssembléia Legislativa do Rio Grande do Norte.\n\nNomeado secretário-geral do estado em 1914, no início do governo de\nJoaquim Ferreira Chaves, no ano seguinte se elegeu deputado à Assembléia\nConstituinte estadual e deputado federal pelo Rio Grande do Norte. Na\nCâmara dos Deputados, integrou a Comissão Permanente de Instrução\nPública, que chegou a presidir, e as comissões especiais de Código\nCivil, Legislação Social e Obras Contra as Secas. Estudioso dos\nproblemas educacionais, apresentou um projeto de reforma do ensino no\npaís, e em 1916 tornou-se membro da Liga Brasileira contra o\nAnalfabetismo. Jornalista desde a juventude, ingressou também na\nAssociação Brasileira de Imprensa em 1917. Em seu estado, colaborou com\no *Correio do Seridó,*de Caicó, e no Rio escreveu para o *Diário de\nNotícias, A Manhã* e *O Jornal.*\n\nReeleito deputado federal em 1918 e em 1921, José Augusto foi\nprimeiro-secretário da Câmara em 1921 e em 1922. Por essa época,\nparticipou do episódio das “cartas falsas” publicadas em outubro de 1921\nno *Correio da* *Manhã*e atribuídas a Artur Bernardes, candidato à\npresidência da República nas eleições de março de 1922. As cartas,\nsupostamente enviadas por Bernardes a Raul Soares, continham referências\ninjuriosas à hierarquia do Exército e acirraram a oposição militar ao\ncandidato mineiro. José Augusto defendeu Bernardes. Amigo do general\nAgostinho Gomes de Castro — presidente da comissão nomeada pelo Clube\nMilitar para fazer o exame pericial das cartas —, forneceu-lhe uma dúzia\nde documentos do próprio punho de Bernardes, de modo a tornar evidente a\nfalsificação. Não se sabe até que ponto sua iniciativa pesou nesse\nsentido, mas em dezembro de 1921 Gomes de Castro demitiu-se da comissão,\nque lhe parecia manter uma atitude preconcebida contra Bernardes. Este,\nde toda forma, no ano seguinte venceria as eleições.\n\nEm 1922, José Augusto participou da direção da Conferência Interestadual\nde Ensino Primário, realizada no Rio, e fundou a revista *A\nEducação,*que dirigiria até 1924. Ocupava a segunda vice-presidência da\nCâmara em 1923, quando Joaquim Ferreira Chaves quis voltar ao governo do\nRio Grande do Norte. Aliado a seu tio Juvenal Lamartine, também deputado\nfederal pelo Rio Grande do Norte, e apoiado por Bernardes, conseguiu\nfrustrar as pretensões de Ferreira Chaves, que já havia sido indicado\ncandidato na convenção do PRF, e elegeu-se ele mesmo para o cargo.\n\n \n\nNo governo do Rio Grande do Norte\n\nJosé Augusto assumiu o governo de seu estado em 1º de janeiro de 1924.\nFoi o primeiro governador a traçar um plano de reformas conhecido como\n“Reforma José Augusto”. Adotado em junho de 1924, o plano deu nova\ndistribuição aos serviços administrativos estaduais. O ano de 1924 foi\nmarcado também por grandes enchentes no Rio Grande do Norte. O socorro\nàs populações atingidas e as obras de reconstrução necessárias foram\ncusteados exclusivamente pelo Tesouro do estado, obrigado a\nendividar-se, e por iniciativas particulares, já que o governo federal\nnão teve condições de atender aos pedidos de auxílio.\n\nDurante sua gestão, José Augusto adotou pela primeira vez o voto secreto\nnas eleições estaduais e municipais. Elevou várias vilas à categoria de\ncidade, determinou a cobrança do Imposto Territorial assinou o decreto\nque colocou em vigor o Código de Processo Penal e criou a Diretoria\nGeral de Estatística do estado. Construiu ainda edifícios públicos na\ncapital e no interior, abriu estradas, realizou trabalhos de engenharia\nsanitária e ampliou o número de escolas. Em Natal, criou a Escola\nDoméstica, estabelecimento de ensino elogiado por seu alto padrão.\n\nAinda durante seu governo, nos dias 4 e 5 de fevereiro de 1926, a Coluna\nPrestes invadiu o Rio Grande do Norte, vinda do Ceará, assaltando as\natuais cidades de Pau dos Ferros e Luís Gomes para em seguida se\ninternar na Paraíba.\n\nEm 1º de janeiro de 1928, José Augusto foi substituído no governo por\nJuvenal Lamartine, assumindo a cadeira deste no Senado Federal, onde\nintegrou as comissões de Instrução Pública e de Constituição e Justiça.\nEm 1929 e 1930 dirigiu, no Rio, a *Revista* *Brasileira de\nEducação.*Neste último ano, foi reeleito senador pelo Rio Grande do\nNorte mas, com a dissolução do Congresso imposta pela vitória da\nRevolução de 1930, perdeu seu mandato.\n\n \n\nDa Revolução ao fim do Estado Novo (1930-1945)\n\nHostilizado pelo novo regime como figura da República Velha, incluído na\ncategoria dos “carcomidos”, José Augusto voltou a abrir seu escritório\nde advocacia no Rio, mas acabou se tornando corretor de seguros,\npassando a viajar pelo Norte e o Nordeste. Com a abertura de inquéritos\npela justiça revolucionária, sua atuação na vida pública foi\ninvestigada, mas nada foi apurado contra ele.\n\nEm 1932, conspirou no Nordeste em favor da Revolução Constitucionalista\nque eclodiu em São Paulo em julho do mesmo ano. Em fevereiro de 1933,\nfundou o Partido Popular (PP) do Rio Grande do Norte, que em maio\nseguinte elegeu três dos quatro deputados do estado à Assembléia\nNacional Constituinte, para desagrado do chefe do Governo Provisório,\nGetúlio Vargas. Contrariando as pretensões de seus correligionários,\nJosé Augusto não quis se candidatar à Constituinte para evitar reações\ndo poder central. Em contraposição às doutrinas fascistas e\ncorporativistas que se vinham difundindo no país, afirmava uma postura\nde liberal democrata. Contrário também à centralização de poderes nas\nmãos do chefe do governo federal, entre 1932 e 1934 publicou três livros\ndefendendo suas convicções: *A* *representação profissional nas*\n*democracias, O anteprojeto de Constituição* *em face da\ndemocracia*e*Porque sou parlamentarista.*\n\nEm outubro de 1934, o PP, em conflito com o interventor federal no Rio\nGrande do Norte, Mário Câmara, foi derrotado nas eleições parlamentares\npela Aliança Social, que congregava o Partido Social Democrático (PSD)\ndo Rio Grande do Norte, fundado pelo próprio Mário Câmara, e o Partido\nSocial Nacionalista (PSN) do Rio Grande do Norte, fundado por João Café\nFilho. O PP denunciou a ocorrência de fraudes nas eleições e, após\nrecurso ao Tribunal Superior Eleitoral (TSE), foram realizadas eleições\nsuplementares, em fevereiro de 1935. Ante a nova derrota do PP, outro\nrecurso foi interposto ao TSE, o qual determinou a realização de nova\napuração dos votos. Desta feita, a vitória foi dada ao PP e José Augusto\nfoi eleito deputado federal por seu estado, iniciando o mandato em maio\nde 1935.\n\nAs eleições haviam transcorrido em clima de grande violência, e José\nAugusto responsabilizou o governo de Mário Câmara pelo assassínio de\nsete correligionários seus. O candidato do PP ao governo do Rio Grande\ndo Norte, Rafael Fernandes Gurjão, foi eleito pela Assembléia\nLegislativa do estado em 29 de outubro de 1935, tomando posse na mesma\ndata. Menos de um mês depois, de 24 a 25 de novembro, foi deposto\ntemporariamente pela revolta comunista de Natal.\n\nNa Câmara dos Deputados, José Augusto foi vice-líder da oposição, e em\nmaio de 1937 discursou como representante de seu partido na convenção de\nlançamento da candidatura de José Américo de Almeida à presidência da\nRepública. Com a instauração do Estado Novo em novembro desse ano, teve\no mandato interrompido.\n\nMais um vez afastado da vida política, José Augusto retornou ao ramo de\nseguros e dedicou-se a problemas educacionais. Em 1940, tornou-se membro\nda comissão diretora e presidente da Subcomissão de Legislação Social e\ndo Departamento Cultural da Associação Comercial do Rio de Janeiro\n(ACRJ). Presidiu em 1942 o VIII Congresso Brasileiro de Educação,\nrealizado em Goiânia, e foi eleito presidente da Associação Brasileira\nde Educação (ABE), cargo que ainda ocupava em 1943, quando foi também\neleito vice-presidente do Centro Norte-Rio-Grandense do Rio de Janeiro.\nVice-presidente da comissão executiva do Instituto Nacional do Sal desde\nsua fundação em 1940, em 1945 tornou-se membro do Conselho de\nContribuintes do Ministério da Fazenda.\n\nJosé Augusto integrou a delegação de seu estado ao I Congresso\nBrasileiro de Escritores, promovido em São Paulo pela Associação\nBrasileira de Escritores (ABDE) em janeiro de 1945. Reunindo\npersonalidades do mundo da cultura, que adotaram uma posição clara em\nfavor das liberdades democráticas, o congresso foi uma das primeiras\nmanifestações do processo de redemocratização do país que culminaria com\no fim do Estado Novo e a deposição de Getúlio Vargas em outubro de 1945.\nA declaração de princípios aprovada por unanimidade pelos congressistas\nreivindicava a legalidade democrática, o sistema de governo eleito pelo\npovo mediante sufrágio universal, direto e secreto, e o pleno exercício\nda soberania popular.\n\n \n\nDe volta à política partidária (1945)\n\nNo ocaso do Estado Novo, José Augusto foi um dos fundadores da União\nDemocrática Nacional (UDN). Na reunião inaugural do partido, em abril de\n1945, foi eleito membro do diretório nacional provisório, composto por\n47 pessoas, e da Comissão de Orientação Política. Em agosto seguinte, na\nreunião que aprovou os estatutos da agremiação, elegeu-se membro da\nComissão Executiva da UDN, presidida por Otávio Mangabeira e integrada\nainda por João Carlos Machado, Carlos de Lima Cavalcanti, Odilon Braga,\nJuraci Magalhães, Valdemar Ferreira, Filipe Moreira Lima e Raul\nFernandes.\n\nEm seu livro *A campanha da UDN,*Virgílio de Melo Franco, então\nsecretário-geral do partido, conta que foi difícil obter as assinaturas\nde José Augusto, Juraci Magalhães, Lima Cavalcanti e Valdemar Ferreira\npara o documento em que os membros da Comissão Executiva se comprometiam\ncom o respeito e a fidelidade aos compromissos democráticos.\n\nEm dezembro de 1945, José Augusto se elegeu deputado à Assembléia\nNacional Constituinte pelo Rio Grande do Norte na legenda da UDN, tendo\nsido o candidato mais votado de seu estado, com 14.348 votos. Assumindo\nsua cadeira em fevereiro de 1946, exerceu na Assembléia as funções de\nvice-líder de seu partido e, promulgada a nova Constituição (18/9/1946),\npassou a exercer o mandato ordinário. Tornou-se sócio-benemérito da ACRJ\nem 1947. Ocupou a primeira vice-presidência da Câmara de 1948 a 1950 e,\nneste último ano, presidiu o Congresso Nacional de Educação, realizado\nno Rio, sendo mais uma vez eleito presidente da ABE. Reeleito deputado\nfederal no pleito de outubro de 1950 foi reconduzido à primeira\nvice-presidência da Câmara em 1951, e, na qualidade de parlamentarista\nhistórico, um dos mais antigos do país, foi um dos primeiros signatários\nda emenda constitucional apresentada por Raul Pilla em 1954 com o\nobjetivo de instituir o sistema parlamentarista de governo no Brasil.\nApresentada originalmente em 1949, a emenda foi subscrita por mais de\numa centena de parlamentares de vários partidos, mas acabou derrotada em\nplenário.\n\nComo deputado e senador, José Augusto sempre se ocupou dos problemas da\neducação no Brasil e especializou-se também nas questões do sal e do\nalgodão. Delegado do Brasil às reuniões da Assembléia Geral da\nOrganização das Nações Unidas (ONU) realizadas em Paris em 1951 e em\n1952, tentou mais uma vez a reeleição em outubro de 1954, sem sucesso.\nDeixando a Câmara dos Deputados em janeiro de 1955, voltou a trabalhar\nna iniciativa privada e tornou-se membro do Conselho Nacional de\nEconomia e dos conselhos técnicos da Confederação Rural Brasileira (CRB)\ne da Confederação Nacional do Comércio (CNC), além de vice-presidente da\nACRJ, cargo que ocupou até 1957. Nesse mesmo ano, foi novamente\npresidente da ABE e integrou a delegação do Brasil à Conferência\nEconômica da Organização dos Estados Americanos (OEA), realizada em\nBuenos Aires.\n\nPresidente do Conselho Nacional de Economia em 1956-1957, tornou-se\nmembro vitalício do conselho superior da Sociedade Nacional de\nAgricultura em 1958. Em 1959 foi eleito presidente da ACRJ — cargo que\nexerceria até 1961 —, da Federação das Associações Comerciais do Brasil\ne da Federação das Câmaras de Comércio Exterior no Brasil.\nVice-presidente do Conselho Nacional de Economia em 1963-1964, pertenceu\nao conselho técnico da CNC até 1966.\n\nJosé Augusto pertenceu a diversas associações brasileiras e\nestrangeiras, entre as quais o Instituto Histórico e Geográfico\nBrasileiro, a Federação Nacional das Sociedades de Educação, a Ordem e o\nInstituto dos Advogados do Brasil e as academias Norte-Rio-Grandense e\nCarioca de Letras.\n\nFaleceu no Rio de Janeiro, no dia 28 de maio de 1971.\n\nEra casado com Alice Godói Bezerra de Medeiros com quem teve cinco\nfilhos.\n\nAlém das obras citadas, publicou *Liga de* *ensino* (1911),*Pela\neducação nacional*(1918), *Eduquemo-nos*(1922),*Aos homens de bem*\n(1926),*A representação profissional nas democracias* (1933),*O\nanteprojeto da Constituição em face da democracia* (1934),*Porque sou\nparlamentarista*(1936)*Famílias seridoenses*(1940),*O sal e o* *algodão\nna economia potiguar*(1946),*Seridó* (1954),*A federação\nmundial*(1954),*Amaro* *Cavalcanti*(1956),*O Conselho Nacional de*\n*Economia*(1956),*Presidencialismo*versus *parlamentarismo*(1962) e *O\nRio Grande do* *Norte no Senado da República* (1968).\n\nMauro Malin\n\n \n\nFONTES: ABRANCHES, J. *Governos;*ARQ. GETÚLIO VARGAS; BARROS, E.\n*Associação; Boletim Min. Trab.* (5/36); CÂM. DEP. *Deputados;*CÂM. DEP.\n*Deputados brasileiros* (1946-1967); CÂM. DEP. *Deputados brasileiros.\nRepertório*(1947-1951, 1951-1955); CÂM. DEP. *Relação dos dep.;* CARONE,\nE. *República velha;*CASCUDO, L. *História;*CASCUDO, L. *História da\nAssembléia;*CAVALCANTI, T. *Cinco;*CISNEIROS, A. *Parlamentares;*CONF.\nNAC. COMÉRCIO (20);**CONG. BRAS. ESCRITORES I; CONSULT. MAGALHÃES B.;\nCORTÉS, C. *Homens;*COUTINHO, A. *Brasil; Diário de Notícias,*Rio\n(26/5/37); *Diário do Congresso* *Nacional;*FICHÁRIO PESQ. M. AMORIM;\nFRANCO, A. *Escalada;*FRANCO, J. *Campanha; Globo*(31/5/71); *Grande\nencic. Delta;*HIRSCHOWICZ, E. *Contemporâneos;* LEVINE, R.\n*Vargas;*LIMA, J. *Como;*LIRA, A. *Senado;*PEREIRA, O. *Que;\nPersonalidades;* *Rev. Ciência Pol.;*SILVA, G. *Constituinte;*SILVA, H.\n*1922;*SILVA, H. *1931;*SILVA, H. *1932;*SILVA, H. *1935;*SILVA, H.\n*1945;* SILVA, R. *Bacharéis;*SOC. BRAS. EXPANSÃO COMERCIAL. *Quem.*\n\n \n","ref":"FONTES: ABRANCHES, J. *Governos;*ARQ. GETÚLIO VARGAS; BARROS, E.\n*Associação; Boletim Min. Trab.* (5/36); CÂM. DEP. *Deputados;*CÂM. DEP.\n*Deputados brasileiros* (1946-1967); CÂM. DEP. *Deputados brasileiros.\nRepertório*(1947-1951, 1951-1955); CÂM. DEP. *Relação dos dep.;* CARONE,\nE. *República velha;*CASCUDO, L. *História;*CASCUDO, L. *História da\nAssembléia;*CAVALCANTI, T. *Cinco;*CISNEIROS, A. *Parlamentares;*CONF.\nNAC. COMÉRCIO (20);**CONG. BRAS. ESCRITORES I; CONSULT. MAGALHÃES B.;\nCORTÉS, C. *Homens;*COUTINHO, A. *Brasil; Diário de Notícias,*Rio\n(26/5/37); *Diário do Congresso* *Nacional;*FICHÁRIO PESQ. M. AMORIM;\nFRANCO, A. *Escalada;*FRANCO, J. *Campanha; Globo*(31/5/71); *Grande\nencic. Delta;*HIRSCHOWICZ, E. *Contemporâneos;* LEVINE, R.\n*Vargas;*LIMA, J. *Como;*LIRA, A. *Senado;*PEREIRA, O. *Que;\nPersonalidades;* *Rev. Ciência Pol.;*SILVA, G. *Constituinte;*SILVA, H.\n*1922;*SILVA, H. *1931;*SILVA, H. *1932;*SILVA, H. *1935;*SILVA, H.\n*1945;* SILVA, R. *Bacharéis;*SOC. BRAS. EXPANSÃO COMERCIAL. *Quem.*\n\n \n","dic":"DHBB"}
