{"title":"PASSOS, Darci  ==============","cargoss":["Deputado federal"],"cargos_esp":[0],"datas_ini":[1979],"datas_fim":[1987],"estados":["SP"],"autor":[0],"content":"PASSOS, Darci \n==============\n\n\\* dep. fed. SP 1979-1987.\n\n \n\n*Darci Paulillo dos Passos* nasceu na cidade de São Paulo no dia 12 de\nnovembro de 1929, filho de Gaspar Eugênio dos Passos e de Rosa Paulillo\ndos Passos.\n\nBacharelou-se em ciências jurídicas e sociais pela Universidade de São\nPaulo (USP) em 1953 e três anos depois foi trabalhar como oficial de\ngabinete do secretário de Justiça Queirós Filho. Em 1957 tornou-se\npromotor de justiça do estado de São Paulo. Em 1963 trabalhou como\nsecretário do gabinete do ministro do Trabalho Almino Afonso,\nparticipando, ainda naquele ano, da Conferência Interamericana de\nMinistros do Trabalho, realizada em Bogotá, na Colômbia.\n\nCom a vitória do movimento político-militar de 31 de março de 1964, que\nderrubou o presidente João Goulart, Darci Passos teve seus direitos\npolíticos suspensos pelo Ato Institucional nº 1, baixado no início de\nabril, o que ocasionou seu afastamento do cargo de promotor de justiça.\nEm 1965, tornou-se oficial de gabinete do presidente da Assembléia\nLegislativa Franco Montoro. Em 1967 concluiu o curso de economia da USP.\n\nA partir de então, dedicou-se ao exercício da advocacia e, no ano de\n1968 lecionou economia e estudos sociais no Colégio Estadual Vocacional\nOsvaldo Aranha, e história econômica do Brasil, na Faculdade de Economia\nda Pontifícia Universidade Católica de Campinas (SP). Em 1968 e 1969, \nlecionou  desenvolvimento econômico no Instituto de Medicina Preventiva,\nda Escola Paulista de Medicina.\n\nEm novembro de 1978, candidatou-se a uma cadeira na Câmara dos\nDeputados, na legenda da Movimento Democrático Brasileiro (MDB), partido\nde oposição ao regime militar. Eleito, assumiu o mandato no início do\nano seguinte participando dos trabalhos legislativos como membro titular\nda Comissão de Economia, Indústria e Comércio. Com o fim do\nbipartidarismo em novembro de 1979 e a conseqüente reformulação\npartidária, filiou-se ao Partido do Movimento Democrático Brasileiro\n(PMDB), agremiação sucessora do MDB.\n\nEm novembro de 1982, foi reeleito deputado federal. Assumindo o mandato\nem fevereiro seguinte, participou dos trabalhos legislativos como membro\ntitular da Comissão de Economia, Indústria e Comércio e membro suplente\nda Comissão de Trabalho e Legislação Social.\n\nEm 25 de abril de 1984 votou a favor da emenda Dante de Oliveira, que,\napresentada na Câmara dos Deputados, propunha o restabelecimento das\neleições diretas para presidente da República em novembro daquele ano.\nComo a emenda não obteve o número de votos indispensáveis à sua\naprovação — faltaram 22 para que o projeto pudesse ser encaminhado à\napreciação pelo Senado Federal —, no Colégio Eleitoral, reunido em 15 de\njaneiro de 1985, Darci Passos votou no candidato oposicionista Tancredo\nNeves, da Aliança Democrática, uma união do PMDB com a dissidência do\nPartido Democrático Social (PDS) abrigada na Frente Liberal. Tancredo\nfoi eleito, mas por motivo de doença não chegou a ser empossado na\npresidência, vindo a falecer em 21 de abril de 1985. Seu substituto foi\no vice José Sarney, que já vinha exercendo interinamente o cargo desde\n15 de março.\n\nEm novembro de 1986 Darci Passos candidatou-se à reeleição, na legenda\ndo PMDB, mas não logrou êxito, deixando a Câmara em janeiro do ano\nseguinte, ao final da legislatura. Mais tarde, deixou o PMDB e filiou-se\nao Partido dos Trabalhadores (PT). Não mais disputando nenhum cargo\neletivo, passou a dedicar-se exclusivamente à advocacia.\n\nCasou-se com Maria Silvia de Camargo Passos, com quem teve cinco filhos.\n\nPublicou *Problemas de desenvolvimento: necessidades e possibilidades do\nEstado de São Paulo* (1954).\n\n* *\n\nFONTES: ASSEMB. NAC. CONST. *Repertório* (1987-1988); CÂM. DEP.\n*Deputados brasileiros. Repertório*(1979-1983); CÂM. DEP. *Deputados\nbrasileiros. Repertório*(1983-1987); *Globo* (26/4/84, 16/1/85).\n","ref":"FONTES: ASSEMB. NAC. CONST. *Repertório* (1987-1988); CÂM. DEP.\n*Deputados brasileiros. Repertório*(1979-1983); CÂM. DEP. *Deputados\nbrasileiros. Repertório*(1983-1987); *Globo* (26/4/84, 16/1/85).\n","dic":"DHBB"}
