{"title":"PASSOS, Djalma","cargoss":["Deputado federal"],"cargos_esp":[0],"datas_ini":[1963],"datas_fim":[1967],"estados":["AM"],"autor":[0],"content":"**PASSOS, Djalma**\n\n\\*dep. fed. AM 1963-1967.\n\n \n\n*Djalma Vieira Passos* nasceu em Boca do Acre (AC) no dia 19 de julho de\n1923, filho do comerciante e arrendatário de seringais Diomedes Vieira\nPassos e de Joana Crispim de Sousa.\n\nEstudou no Colégio Estadual do Amazonas e em 1943 ingressou na Polícia\nMilitar do estado, instituição na qual permaneceria até 1955. Formado em\ndireito em 1951 pela Faculdade de Direito do Amazonas, em outubro de\n1954 elegeu-se vereador à Câmara Municipal de Manaus, exercendo o\nmandato entre 1955 e 1958. Eleito deputado estadual pelo Partido Social\nDemocrático (PSD) em outubro deste ano, assumiu um assento na Assembléia\nLegislativa amazonense no início de 1959. Em outubro de 1962, disputou\numa vaga na Câmara dos Deputados pelo Amazonas na legenda do Partido\nTrabalhista Brasileiro (PTB). Eleito, encerrou o mandato de deputado\nestadual em janeiro de 1963 e, no mês seguinte, assumiu sua cadeira na\nCâmara.\n\nEm conseqüência da extinção dos partidos políticos pelo Ato\nInstitucional nº 2 (27/10/1965) e da posterior instauração do\nbipartidarismo, filiou-se, em 1966, ao Movimento Democrático Brasileiro\n(MDB), partido de oposição ao regime militar instalado no país em abril\nde 1964. Candidato à reeleição no pleito de novembro de 1966, obteve\napenas a segunda suplência da bancada emedebista amazonense. Deixou a\nCâmara dos Deputados em janeiro de 1967, ao final da legislatura.\n\nDiretor da Coordenação do Desenvolvimento de Brasília (Codebrás) entre\nabril de 1967 e setembro de 1969, voltou a candidatar-se a deputado\nfederal pelo MDB nas eleições de novembro de 1970, ainda dessa vez\nconseguindo apenas a primeira suplência. Transferindo-se para a Aliança\nRenovadora Nacional (Arena), partido governista, disputou, por sua nova\nlegenda, um assento na Câmara dos Deputados no pleito de novembro de\n1974, sendo uma vez mais derrotado. Assessor jurídico da Secretaria de\nJustiça do Amazonas entre 1975 e 1976, no ano seguinte tornou-se\nsecretário-geral de Justiça do estado. Em novembro de 1978 tentou uma\nvaga no Senado na bancada do Amazonas, pela legenda arenista, mas não\nlogrou eleger-se.\n\nNo pleito de novembro de 1986, candidatou-se ao governo do estado do\nAmazonas pelo Partido Democrático Social (PDS), agremiação sucessora da\nArena, mas o Executivo estadual acabou sendo ocupado pelo candidato do\nPartido do Movimento Democrático Brasileiro (PMDB) Amazonino Mendes.\n\nDjalma Passos foi ainda presidente do PDS amazonense. Exerceu também as\natividades de escritor, jornalista e editor do *Jornal do Comércio*, do\nAmazonas. Dedicou-se também ao estudo da vida e obra de Joaquim Nabuco.\n\nFaleceu no Rio de Janeiro no dia 18 de junho de 1989.\n\nEra casado com Alcina Raposo Passos, com quem teve três filhos.\n\nPublicou *Poemas do tempo perdido* (1949), *As vozes amargas* (1952),\n*Tempo a distância* (1955), *Bazar de angústias* (1972),*Ocupação da\nAmazônia e outros problemas* (1974).\n\n \n\nFONTES: CÂM. DEP. *Anais*;**CÂM. DEP. *Deputados*; CÂM. DEP. *Deputados\nbrasileiros. Repertório*(1946-1967); INF. Amazonina Raposo Passos Teles\nde Sousa; TRIB. SUP. ELEIT. *Dados*(8 e 9).\n\n \n\n \n","ref":"FONTES: CÂM. DEP. *Anais*;**CÂM. DEP. *Deputados*; CÂM. DEP. *Deputados\nbrasileiros. Repertório*(1946-1967); INF. Amazonina Raposo Passos Teles\nde Sousa; TRIB. SUP. ELEIT. *Dados*(8 e 9).\n\n \n\n \n","dic":"DHBB"}
