{"title":"AUGUSTO, Roberto","cargoss":["Constituinte","Deputado federal"],"cargos_esp":[0,0],"datas_ini":[1987,1987],"datas_fim":[1988,1991],"estados":[0,"RJ"],"autor":[0],"content":"**AUGUSTO, Roberto**\n\n\\*const. 1987-1988; dep. fed. RJ 1987-1991.\n\n* *\n\n*Roberto Augusto Lopes* nasceu em Três Lagoas (MT) no dia 21 de maio de\n1931, filho de João Augusto Lopes e de Hermínia da Silva Lopes.\n\nJogador profissional de futebol, com passagem pelo Canto do Rio de\nNiterói (RJ) e Bangu Atlético Clube do Rio de Janeiro, encerrou sua\ncarreira no início dos anos 1960. Evangélico, foi diácono da Igreja\nPentecostal de Nova Vida de Niterói e, juntamente com Edir Macedo, um\ndos fundadores da Igreja Universal do Reino de Deus. Em 1979,\ntransferiu-se para São Paulo para ajudar na implantação da Universal no\nestado. Dois anos depois, formou-se em teologia pela Faculdade de\nTeologia Evangélica do Rio de Janeiro. Sagrando-se bispo, nos anos de\n1981 e 1983 representou a Universal em viagens a Jerusalém, em Israel.\nDe volta ao Rio em 1984, ocupou por dois anos o cargo de vice-reitor da\nFaculdade Teológica Universal do Reino de Deus, no Rio de Janeiro. Como\nradialista, apresentou um programa religioso diário na rádio Copacabana\ndo Rio de Janeiro, no qual combatia as outras religiões, sobretudo o\nespiritismo. Também tomou parte do programa *Despertar da Fé*,\ntransmitido diariamente pela TV Bandeirantes.\n\nFiliado ao Partido Democrático Social (PDS), transferiu-se mais tarde\npara o Partido Trabalhista Brasileiro (PTB), em cuja legenda\ncandidatou-se, em novembro de 1986, a uma vaga na Assembléia Nacional\nConstituinte (ANC) pelo Rio de Janeiro. Eleito com mais de 54 mil votos,\nfoi o deputado mais votado de seu partido. Empossado em fevereiro de\n1987 (ano em que retornou para a Igreja de Nova Vida), foi\nprimeiro-vice-presidente da Subcomissão da Família, do Menor e do Idoso,\nda Comissão da Família, da Educação, Cultura e Esportes, da Ciência e\nTecnologia e da Comunicação; e membro suplente da Subcomissão dos\nDireitos dos Trabalhadores e Servidores Públicos, da Comissão da Ordem\nSocial.\n\nDurante os trabalhos da Constituinte, votou contra o rompimento de\nrelações diplomáticas com países de orientação racista, a pena de morte,\na limitação do direito de propriedade, a legalização do aborto, a\nestabilidade no emprego, a legalização do jogo do bicho e a criação de\num fundo de apoio à reforma agrária. Pronunciou-se a favor do turno\nininterrupto de seis horas, do aviso prévio proporcional, da manutenção\nda unicidade sindical, da adoção do voto facultativo aos 16 anos, da\nnacionalização do subsolo e do mandato de cinco anos para o presidente\nJosé Sarney. Não tendo concorrido à reeleição em outubro de 1990,\nconcluiu o mandato em janeiro de 1991.\n\nAbandonando a carreira política, continuou exercendo as atividades de\nbispo da Igreja de Nova Vida.\n\nCasou-se com Geise Maria Rocha Garcia Lopes, com quem teve três filhos.\n\n \n\nFONTES: ASSEMB. NAC. CONST. *Repertório*(1987);**COELHO, J. & OLIVEIRA,\nA. *Nova*; *Folha de S. Paulo*(19/1/87); INF. BIOG.\n\n \n","ref":"FONTES: ASSEMB. NAC. CONST. *Repertório*(1987);**COELHO, J. & OLIVEIRA,\nA. *Nova*; *Folha de S. Paulo*(19/1/87); INF. BIOG.\n\n \n","dic":"DHBB"}
