{"title":"PAULA, José Armando Ribeiro de","cargoss":["Militar"],"cargos_esp":["interv"],"datas_ini":[1930],"datas_fim":[1930],"estados":["ES"],"autor":[0],"content":"**PAULA, José Armando Ribeiro de**\n\n\\*militar, interv. ES 1930.\n\n*José Armando Ribeiro de Paula* nasceu no estado do Rio de Janeiro em\n1873, filho de Jorge Ribeiro de Paula.\n\nSentou praça em março de 1890, ingressando na Escola Militar da Praia\nVermelha, no Rio de Janeiro, então Distrito Federal. Em dezembro de 1891\nfoi transferido para a Escola Tática e de Tiro de Rio Pardo (RS),\nretornando à capital federal em janeiro de 1893. Em novembro de 1894 foi\npromovido a segundo-tenente. Em abril do ano seguinte passou a servir no\n1º Batalhão de Engenharia na capital federal e em março de 1896 voltou à\nEscola Militar para concluir sua formação. Retornando em 1898 ao 1º\nBatalhão de Engenharia, nesse mesmo ano, com a criação da Escola Militar\ndo Brasil, passou a integrá-la na condição de aluno adido. Em março de\n1901 obteve o diploma de bacharel em matemática e ciências físicas.\n\nServiu a seguir no 28º Batalhão de Infantaria, no Paraná, e novamente, a\npartir de julho de 1901, no 1º Batalhão de Engenharia, onde desempenhou\nas funções de agente do rancho e ajudante do batalhão. Em fevereiro de\n1902 assumiu o comando da 4ª Companhia e no mês seguinte passou a\nintegrar o serviço de exploração, onde permaneceu até maio. Em seguida\nfoi auxiliar do serviço de escritório da Comissão Construtora da Estrada\nde Ferro Paraná-Mato Grosso, da qual desligou-se em setembro. Em 1903\natuou junto à Comissão Telegráfica de Guarapuava do Iguaçu (PR), tendo\nexercido as funções de tesoureiro da estrada de ferro e, a partir de\njunho, foi ajudante da Comissão Estratégica do Iguaçu. Em fevereiro de\n1907 assumiu a chefia dessa comissão, da qual desligou-se no mês de\nabril seguinte para apresentar- se ao comando do 5º Distrito Militar,\nsediado em Curitiba. Em outubro tornou-se auxiliar da Delegacia de\nEngenharia junto àquele comando.\n\nTransferido para a arma de engenharia em janeiro de 1908, em outubro\nseguinte foi promovido a primeiro-tenente. Foi classificado no 2º\nBatalhão de Engenharia em fevereiro de 1909 e em****setembro chegou ao\nposto de capitão. Em janeiro de 1910, assumiu o comando da 3ª Companhia\nde seu batalhão e, no mês de agosto, foi designado, por proposta do\nchefe do Estado-Maior do Exército (EME), para o Serviço de Estatística\nMilitar da Estrada de Ferro Noroeste do Brasil. Em 1911 atuou como\nauxiliar da Comissão de Obras do Mato Grosso, encarregado das obras da\nfortaleza de Coimbra. Em agosto de 1912 foi dispensado da comissão,\ntornando-se adido ao 1º Esquadrão do 2º Regimento de Cavalaria (2º RC),\nem Guarapuava. Em janeiro de 1913 foi nomeado pelo inspetor da região\npara examinar construções em Guarapuava. Desligado de seu regimento em\nmaio, foi incluído mais uma vez na 3ª Companhia do 2º Batalhão de\nEngenharia, no qual exerceu diversas funções, inclusive a de comando. Em\njunho de 1914 voltou a servir no 1º Esquadrão do 2º RC e em agosto\nretornou ao 2º Batalhão de Engenharia, cujo comando exerceu de novembro\ndesse ano a janeiro de 1915. À disposição da 4ª Região Militar (4ª RM),\nem 1916 foi adido ao 58º Batalhão de Caçadores (58º BC), sediado em\nNiterói, e ao 51º BC, sediado em São João del Rei. Em julho desse ano\nfoi nomeado para a Junta de Alistamento Militar em São Gonçalo (RJ) e,\nem janeiro de 1917, passou a atuar como auxiliar no Serviço de\nEngenharia de quartel-general da 5ª RM. Promovido a major em outubro\nseguinte, foi classificado no 5º Batalhão de Engenharia em São Gonçalo\n(RJ), que chegou a comandar. Passou a servir no 4º Batalhão de\nEngenharia, em Lorena (SP), tornando-se primeiro engenheiro-chefe em\nmarço de 1919 e comandante em novembro seguinte. Serviu na construção da\nestrada de ferro de Piquete (SP) a Itajubá (MG) e****em abril de 1921\natuou na Diretoria de Engenharia por ter sido transferido para o quadro\nsuplementar. Em novembro desse mesmo ano foi promovido a\ntenente-coronel. Chefe da 2ª Divisão da Diretoria de Engenharia a partir\nde janeiro de 1922, em março seguinte matriculou-se no curso de revisão\nda Escola de Estado-Maior do Exército. Desligado da escola em janeiro de\n1923, retornou à Diretoria de Engenharia, sendo promovido a coronel em\nsetembro seguinte. Em agosto de 1924 seguiu para o Rio Grande do Sul, à\ndisposição do comando da 3ª RM. Voltando a servir no 1º Batalhão de\nEngenharia, em junho de 1927 tornou-se adido ao gabinete da Diretoria de\nEngenharia.\n\nComandava o 3º BC, em Vitória, quando eclodiu a Revolução de 1930, no\ndia 3 de outubro. Dias após sua posse naquele comando foi nomeado\ninterventor no estado do Espírito Santo pelo presidente Washington Luís.\nNa ocasião, o estado estava sendo invadido pelas forças militares\nrevoltosas vindas de Minas Gerais e parecia urgente pôr termo à guerra\ncivil. A coluna revoltosa Campos do Amaral entrou em Vitória no dia 18\nde outubro de 1930 e não foi possível a José Armando Ribeiro de Paula\narticular a defesa. Sem o apoio do 3º BC, que aderiu à revolução, deixou\no governo do Espírito Santo e regressou ao Rio, a bordo do navio\n*Almirante Jaceguai.*Foi transferido para a reserva em março de 1931.\n\nCasou-se com Maria Rita Branco.\n\nFONTES: ARQ. MIN. EXÉRC.; DERENZI, L.*Biografia;*FURTADO, C.\n*Desenvolvimento*; NOVAIS, M. *História;*OLIVEIRA, J. *História.*\n\n \n","ref":"FONTES: ARQ. MIN. EXÉRC.; DERENZI, L.*Biografia;*FURTADO, C.\n*Desenvolvimento*; NOVAIS, M. *História;*OLIVEIRA, J. *História.*\n\n \n","dic":"DHBB"}
