{"title":"PAULINELLI, Alysson -------------------","cargoss":["Ministro da Agricultura","Constituinte","Deputado federal","Presidente de associação ou confederação de empregados ou empregadores"],"cargos_esp":[0,0,0,"CNA"],"datas_ini":[1974,1987,1987,1987],"datas_fim":[1979,1988,1991,1990],"estados":[0,0,"MG",0],"autor":[0],"content":"PAULINELLI, Alysson\n-------------------\n\n\\*min. Agric. 1974-1979; const. 1987-1988; dep. fed. MG 1987-1991; pres.\nCNA 1987-1990.\n\n \n\n*Alysson Paulinelli* nasceu em Bambuí (MG) em 10 de julho de 1936, filho\nde Antônio Paulinelli de Carvalho e de Adalgisa Luchesi Paulinelli. Seu\npai, engenheiro agrônomo, foi prefeito de Bambuí.\n\nFez o curso primário no Grupo Escolar José Alzamora e o secundário no\nGinásio Antero Torres, na cidade natal. Cursou o científico no Instituto\nGammon, em Lavras (MG), onde se formou, em 1959, engenheiro agrônomo\npela Escola Superior de Agricultura, da qual foi presidente do centro\nacadêmico entre 1956 e 1958. Em 1959 tornou-se professor de hidráulica,\nirrigação e drenagem da instituição, por cuja cadeira seria responsável\naté 1990. Fez estágios de aperfeiçoamento na Tennessee Valley Authority\n(Estados Unidos), no Chile e na Argentina.\n\nEntre 1966 e 1967 foi vice-diretor da escola e diretor de 1967 a 1971.\nDurante sua gestão triplicaria o número de alunos e professores. De 1968\na 1969 presidiu a Associação Brasileira de Educação Agrícola Superior.\nFoi conselheiro da Fundação João Pinheiro e do Centro de Tecnologia de\nMinas Gerais, além de presidente da junta administrativa da Associação\nde Crédito e Assistência Rural. Em 1969, a convite do governo dos\nEstados Unidos, visitou universidades e centros de pesquisa e produção.\nParticipou de congressos, conferências e reuniões em Chile, Argentina,\nUruguai e Paraguai.\n\nEntre 1971 e 1974, durante o governo de Rondon Pacheco, foi secretário\nde Agricultura. Pregou a renovação de métodos para a conquista de\nmelhores safras, conseguindo fazer do estado o maior plantador de café.\nPromoveu e participou de concentrações e reuniões com produtores rurais\nem 429 dos 722 municípios. Em 1973, a convite do governo da Inglaterra,\nparticipou do Agricultural Royal Show. Foi representante do Brasil na\ncomissão de assessores de educação agrícola superior do Instituto\nInteramericano de Ciências Agrícolas, da Organização dos Estados\nAmericanos (OEA).\n\nComo assessor do Conselho de Extensão Rural, passou a freqüentar\nregularmente, a partir do segundo semestre de 1973, o Ministério da\nAgricultura. Em 15 de março do ano seguinte – quando se iniciou o\ngoverno de Ernesto Geisel -, foi nomeado para a pasta. Indicou os\nproblemas do abastecimento interno como prioridades, afirmando ser\npossível não só alcançar a auto-suficiência na produção de trigo como\ntransformar o país em exportador.\n\nEm julho de 1974, reconheceu a existência de “ótimos projetos nacionais\npara o campo”, mas confirmou a disposição do governo de aceitar a\nparticipação do capital estrangeiro no setor agropecuário, diante da\nfalta de recursos para financiar todos os projetos existentes. Em maio\nde 1975, o Instituto Nacional de Colonização e Reforma Agrária (INCRA)\ncolocou à venda 1,4 milhão de hectares de terras na Amazônia, divididos\nem lotes de 66 mil ou 72 mil hectares, para projetos de colonização. A\noperação representou a marginalização dos desbravadores individuais, a\nquem se destinavam os lotes de no máximo três mil hectares anteriormente\nvendidos pelo INCRA.\n\nEm setembro de 1976, fez um balanço da primeira metade do governo\nGeisel, afirmando que a agricultura havia recebido tratamento\nprioritário. Apontava como prova o fato de que os investimentos haviam\nexperimentado notável crescimento, passando de 36 bilhões de cruzeiros\nem 1974 para 160 bilhões dois anos depois. Nessa mesma época, contestou\na tese de que as distorções fundiárias fossem responsáveis pelo atraso\nno desenvolvimento agropecuário do Nordeste e disse que “o governo não\npretende agir demagogicamente, quando se sabe que o problema não é a\nterra”.\n\nEm março de 1977 afirmou que os recursos destinados à política de\ngarantia de preços mínimos para os produtores rurais haviam aumentado em\ncerca de 1.000% nos três anos em que estava à frente do ministério,\npassando de 1,2 bilhão de cruzeiros em 1973 para 14,6 bilhões em 1976.\nEm julho do mesmo ano, quando o governo adotou medidas limitadoras da\nexpansão do crédito agrícola, retirou o subsídio para a compra de\nfertilizantes e decretou o confisco cambial para a soja, Paulinelli\ngarantiu que não se pretendia punir a agricultura.\n\nFoi um dos três ministros que, em março de 1978, concordaram em fazer\ndeclarações à imprensa sobre a questão da anistia, reivindicação\noposicionista que até então o governo se negara a atender. Admitiu que\nse poderia chegar a uma anistia ampla, ressaltando, entretanto, que\nqualquer debate sobre o problema seria prematuro enquanto não fosse\nencontrada a forma adequada de abertura política.\n\nEm outubro do mesmo ano, num artigo sobre os problemas da agricultura e\na política governamental, afirmou que “a distribuição de renda ainda não\nsatisfaz às exigências de uma sociedade moderadamente desenvolvida.\nPerduram contrastes, distorções e desequilíbrios regionais graves,\npersistem desafios à economia ainda vulnerável no Nordeste semi-árido,\nao desenvolvimento do ainda vazio trópico úmido da Amazônia, permanecem\nbolsões de pobreza em áreas decadentes do Centro-Sul”.\n\nDeixou o ministério no fim do governo Geisel, em 15 de março de 1979.\nFoi presidente do Banco do Estado de Minas Gerais (Bemge) de 1979 a\n1983, da Associação Brasileira de Bancos Comerciais Estaduais (Asbace)\nde 1980 a 1982, da Fiat Allis Latino-Americana de 1982 a 1986 e da\nSociedade Mineira de Agricultura de 1983 a 1986.\n\n Nesse ano, candidatou-se, em novembro, a deputado federal constituinte\nna legenda do Partido da Frente Liberal (PFL). Empossado em fevereiro do\nano seguinte, participou da Assembléia Nacional Constituinte - cuja\ncarta foi promulgada em 5 de outubro de 1988 -,****como titular da\nSubcomissão de Política Agrícola e Fundiária e da Reforma Agrária, da\nComissão da Ordem Econômica, e suplente da Subcomissão do Sistema\nEleitoral e Partidos Políticos, da Comissão da Organização Eleitoral,\nPartidária e Garantia das Instituições.\n\nVotou a favor da pena de morte, da unicidade sindical, do mandato de\ncinco anos para o presidente da República e da legalização do aborto e\nfoi contrário à limitação do direito de propriedade privada, à jornada\nsemanal de 40 horas, à instituição do voto facultativo aos 16 anos, à\nestatização do sistema financeiro e à desapropriação da propriedade\nprodutiva. Na discussão sobre sistema de governo, manifestou-se pelo\npresidencialismo.\n\nEmpossado na presidência da Confederação Nacional da Agricultura (CNA)\nem dezembro de1987, permaneceu à frente da entidade até 1990, quando\ncedeu o posto a Antônio de Salvo. Ainda em 1990,  foi presidente do\nComitê da Feira Osaka-Japão, cabendo-lhe coordenar a participação\nbrasileira. No pleito de outubro deste ano, candidatou-se ao Senado pela\nlegenda pefelista, não obtendo os votos necessários para assegurar-lhe o\nmandato. Deixou a Câmara Federal em janeiro de 1991, ao final da\nlegislatura.\n\nEm março de 1991, o governador Hélio Garcia (1991-1994) nomeou-o\nsecretário de Agricultura, Pecuária e Abastecimento. De 1992 a 1993\nexerceu a presidência do Fórum Nacional de Agricultura. Em dezembro de\n1994 deixou a secretaria.\n\nEm janeiro do ano seguinte, o sucessor de Garcia, Eduardo Azeredo\n(1995-1998), reconduziu-o ao cargo, no qual permaneceu até março de\n1998. Após deixá-lo, dedicou-se à empresa de consultoria Listen, em Belo\nHorizonte.\n\nProdutor rural, atuou como consultor em projetos agrícolas. Membro da\nAcademia Nacional de Engenharia, filiou-se ao Partido Social Democrático\n(PSD) após ter-se desligado do PFL.\n\nCasou-se com Helene de Barros Paulinelli, com quem teve cinco filhos.\n\n \n\nMauro Malin/Luís Otávio de Sousa/Rogério Barros\n===============================================\n\n \n\nFONTES: ANDRADE, F. *Relação*;**ASSEMB. NAC. CONST. *Repertório* (1987);\nCURRIC. BIOG;*Globo*(30/11/86); *Jornal do* *Brasil*(13 e 22/2/74, 20/3\ne 12/9/76, 23/8/77 e 25/3/78); *Perfil* (1974); *Súmulas*; *Veja*(27/2,\n10/4 e 3/7/74, 28/5/75, 1/9/76, 6/7/77 e 18/10/78); *Who’s who in\nBrazil*.\n","ref":"FONTES: ANDRADE, F. *Relação*;**ASSEMB. NAC. CONST. *Repertório* (1987);\nCURRIC. BIOG;*Globo*(30/11/86); *Jornal do* *Brasil*(13 e 22/2/74, 20/3\ne 12/9/76, 23/8/77 e 25/3/78); *Perfil* (1974); *Súmulas*; *Veja*(27/2,\n10/4 e 3/7/74, 28/5/75, 1/9/76, 6/7/77 e 18/10/78); *Who’s who in\nBrazil*.\n","dic":"DHBB"}
