{"title":"AURELIANO, Antônio","cargoss":["Deputado federal"],"cargos_esp":[0],"datas_ini":[1995],"datas_fim":[1997],"estados":["MG"],"autor":[0],"content":"**AURELIANO, Antônio**\n\n\\*dep. fed. MG 1995-1997.\n\n*Antônio Aureliano Sanches de Mendonça* nasceu em Itajubá (MG) no dia 13\nde janeiro de 1958, filho de Antônio Aureliano Chaves de Mendonça e de\nMinervina Sanches de Mendonça. Seu pai foi deputado federal (1967-1975),\ngovernador de Minas Gerais (1975-1978), vice-presidente da República\n(1979-1985) e ministro das Minas e Energia (1985-1989).\n\nEm sua adolescência, fez os cursos de prática de comércio no Colégio\nPré-Universitário em Brasília e de informática no Colégio Militar de\nBelo Horizonte. Estudante de agronomia da Universidade de Viçosa (MG) em\n1978, não completou o curso. Ingressou também no curso de administração\nda Associação de Ensino Unificado do Distrito Federal, não concluído.\n\nEm 1985 foi membro da comissão fundadora do Partido da Frente Liberal\n(PFL) Jovem, no Distrito Federal. No ano seguinte tornou-se presidente\ndo diretório jovem do PFL, permanecendo neste cargo até 1987. Em 1989\ningressou no Partido da Social Democracia Brasileira (PSDB), sendo\neleito membro do diretório estadual em Minas Gerais. Nesta legenda\ncandidatou-se a uma cadeira na Câmara dos Deputados por Minas Gerais no\npleito de outubro de 1990, obtendo apenas uma suplência.\n\nEm 1993, tornou-se secretário de Transportes do Distrito Federal no\ngoverno de Joaquim Roriz (1991-1995), permanecendo nesta função até o\nano seguinte. Durante sua gestão, fez viagem técnica aos Estados Unidos\ne ao Canadá. No pleito de outubro de 1994 disputou uma cadeira na Câmara\ndos Deputados, na legenda do PSDB, obtendo a segunda suplência. Em 3 de\nfevereiro de 1995, assumiu a vaga de Ademir Lucas, nomeado secretário de\nEsportes, Lazer e Turismo do governo de Eduardo Azeredo (1995-1998).\nParticipou dos trabalhos legislativos como membro titular da Comissão de\nAgricultura e Política Rural, das comissões especiais sobre Embarcação\nNacional, Navegação de Cabotagem e de Interior, sobre Débitos nas\nOperações de Crédito Rural e, como suplente, das comissões de Finanças e\nTributação e de Defesa Nacional.\n\nNas votações das emendas constitucionais propostas pelo governo Fernando\nHenrique Cardoso em 1995, votou a favor da mudança no conceito de\nempresa nacional e da quebra dos monopólios estatal nas\ntelecomunicações, dos estados na distribuição de gás canalizado, das\nembarcações nacionais na navegação de cabotagem e da Petrobras na\nexploração de petróleo. Ainda em 1995, votou favoravelmente à\nprorrogação do Fundo Social de Emergência (FSE), cujo nome foi alterado\npara Fundo de Estabilização Fiscal (FEF).\n\nNo ano legislativo de 1996, pronunciou-se a favor da criação da\nContribuição Provisória sobre Movimentação Financeira (CPMF), imposto\ndestinado a suprir o Ministério da Saúde de uma fonte extraordinária de\nrecursos.\n\nLicenciou-se da Câmara dos Deputados em 6 de fevereiro de 1997 para\nocupar o cargo de secretário de Transportes e Obras Públicas do governo\nde Minas Gerais. Em outubro de 1998, disputou mais uma vez uma vaga na\nCâmara dos Deputados, obtendo novamente uma suplência.\n\nEm outubro de 2006, ocupou a segunda suplência na candidatura vitoriosa\nde Eliseu Resende, do Democratas mineiro (DEM), ex-PFL, ao Senado.\n\nFoi também campeão brasiliense e brasileiro de judô e mineiro de *kart*,\nprofessor de judô e estagiário do Instituto Nacional de Pesos e Medidas.\nSócio-proprietário de duas empresas na área alimentícia, participou da\nrevisão técnica de projetos de transformação de motores à gasolina para\nálcool e da organização do Plano Nacional de Normatização, do Ministério\nda Indústria e Comércio.\n\nCasou-se com Matilde Maria de Neiva Couto Sanches de Mendonça, com quem\nteve cinco filhos.\n\n \n\n \n\nFONTES: CÂM. DEP. *Deputados brasileiros. Repertórios*(1991-1995,\n1995-1999); *Folha de S. Paulo* (31/1/95, 14/1/96, 30/1/97); TSE.\n*Eleições* (2006).\n","ref":"FONTES: CÂM. DEP. *Deputados brasileiros. Repertórios*(1991-1995,\n1995-1999); *Folha de S. Paulo* (31/1/95, 14/1/96, 30/1/97); TSE.\n*Eleições* (2006).\n","dic":"DHBB"}
