{"title":"PEÇANHA, Carlos","cargoss":["Deputado federal"],"cargos_esp":[0],"datas_ini":[1983],"datas_fim":[1987],"estados":["RJ"],"autor":[0],"content":"PEÇANHA, Carlos\n\n\\*dep. fed. RJ 1983-1987.\n\n*Carlos Ferreira Peçanha* nasceu em Campos (RJ), no dia 2 de dezembro de\n1930, filho de Cleveland Peçanha e de Carlota Ferreira Peçanha. Seu\nprimo, Teotônio Ferreira de Araújo Filho, retratado por José Cândido de\nCarvalho no romance *O coronel e o lobisomem*, foi vice-governador do\nantigo estado Rio de Janeiro e substituiu o titular, Paulo Torres, de\nagosto de 1966 a janeiro 1967.\n\nEm meados dos anos 1950 Carlos Peçanha tornou-se fiscal de rendas da\nFazenda do Estado do Rio de Janeiro. Estreou na vida política no pleito\nmunicipal de outubro de 1962 elegendo-se vereador da cidade natal.\nPresidente da Câmara Municipal de Campos no primeiro semestre de 1966,\nassumiu a prefeitura do município em julho, uma vez que o titular do\ncargo, o vice-prefeito Rockefeller de Lima, havia se\ndesincompatibilizado para disputar uma cadeira na Câmara dos Deputados.\nRenunciando ao cargo de vereador, Peçanha esteve à frente da prefeitura\naté janeiro de 1967, quando concluiu o mandato. Deste último ano até\n1982 participou do conselho das Centrais Elétricas Fluminenses (Celf) e\nocupou cargos públicos de confiança, tal como o de chefe de Inspetoria\nde Rendas em Campos.\n\nJá aposentado, no pleito de novembro de 1982 elegeu-se deputado federal\npelo Rio de Janeiro, na legenda do Partido do Movimento Democrático\nBrasileiro (PMDB), sendo o segundo mais votado do seu partido em todo o\nestado. Empossado em fevereiro de 1983, integrou a Comissão de\nTransportes.\n\nEm 25 de abril de 1984, votou a favor da emenda Dante de Oliveira, que\nprevia eleições diretas para presidente da República. Derrotada a\nproposição — faltaram 22 votos para que fosse elevada à apreciação do\nSenado — no Colégio Eleitoral, reunido em 15 de janeiro de 1985, Carlos\nPeçanha votou no candidato oposicionista Tancredo Neves, eleito pela\nAliança Democrática, uma união do PMDB com a dissidência do Partido\nDemocrático Social (PDS) abrigada na Frente Liberal. Doente, Tancredo\nNeves não chegou a ser empossado, vindo a falecer em 21 de abril de\n1985. Seu substituto foi o vice José Sarney, que já vinha exercendo o\ncargo interinamente desde 15 de março desse ano.\n\nComo deputado federal, Peçanha também votou a favor da legalização do\nPartido Comunista Brasileiro (PCB). Deixou a Câmara em janeiro de 1987,\nsem concorrer à reeleição.\n\nEm 1989, no governo de Wellington Moreira Franco (1987-1991), ocupou a\nvice-presidência da Companhia de Eletricidade do Rio de Janeiro (CERJ).\n\nAfastado da vida pública, manteve uma discreta atuação no Sindicato dos\nFiscais de Rendas do Estado do Rio de Janeiro.\n\nCarlos Peçanha formou-se pela faculdade de direito da Universidade\nFederal Fluminense (UFF).\n\nCasado com Latife Haddad, teve três filhos.\n\nFONTES: BELIDO, V. *Política*; CÂM. DEP. *Deputados brasileiros.*\n*Repertório* (1983-1987); ENTREV. BIOG.;*Globo*(26/4/84 e 16/1/85).\n\n \n","ref":"FONTES: BELIDO, V. *Política*; CÂM. DEP. *Deputados brasileiros.*\n*Repertório* (1983-1987); ENTREV. BIOG.;*Globo*(26/4/84 e 16/1/85).\n\n \n","dic":"DHBB"}
