{"title":"ADEODATO, Francisco","cargoss":["Deputado federal"],"cargos_esp":[0],"datas_ini":[1963],"datas_fim":[1967],"estados":["CE"],"autor":[0],"content":"**ADEODATO, Francisco**\n\n\\*dep. fed. CE 1963-1967.\n\n \n\n*Francisco Mendes Adeodato* nasceu em Sobral (CE) no dia 19 de junho de\n1927, filho de João Nogueira Adeodato e de Luzia Mendes Adeodato. Seu\npai foi deputado federal pelo Ceará entre 1946 e 1951.\n\nEstudou no Ginásio São João, no Colégio Marista e no Colégio Cearense,\nem Fortaleza, transferindo-se depois para o Colégio Estadual da Bahia e,\nfinalmente, para o Instituto Lafayette, no Rio de Janeiro (então\nDistrito Federal). Ingressou em seguida na Faculdade Fluminense de\nMedicina, pela qual se formou em 1954. Especializando-se em anestesia e\nem cirurgia cardiovascular, trabalhou nos hospitais Sousa Aguiar e Pedro\nErnesto, no Rio, antes de retornar a Fortaleza em 1958 para assumir a\ndireção do Departamento Estadual da Criança, cargo em que permaneceu até\n1962.\n\nNo pleito de outubro desse ano, elegeu-se primeiro suplente de deputado\nfederal pelo Ceará, com o apoio da aliança formada pelo Partido Social\nDemocrático, a União Democrática Nacional e o Partido Trabalhista\nNacional (PSD-UDN-PTN). Assumiu uma cadeira na Câmara em 16 de abril de\n1963, passando a compor a bancada do PTN. Em 20 de maio de 1964,\ntransferiu-se para o Partido Trabalhista Brasileiro (PTB).\n\nCom a extinção dos partidos pelo Ato Institucional nº 2 (27/10/1965) e a\nposterior implantação do bipartidarismo, filiou-se em 1966 à Aliança\nRenovadora Nacional (Arena), partido de sustentação ao regime militar\nvigente no país desde abril de 1964 e sob cuja legenda terminou seu\nmandato no final da legislatura (31/1/1967). Na Câmara, pertenceu à\nComissão de Saúde.\n\nSua atividade parlamentar caracterizou-se pela defesa de iniciativa\nprivada, admitindo, no entanto, o monopólio estatal do petróleo, da\nenergia elétrica, das telecomunicações e dos minérios atômicos. Foi\nfavorável a uma reforma agrária cooperativista, com a assistência\nintegral do Estado e sem qualquer característica coletivista. Defendeu\nainda o voto do analfabeto e dos praças das forças armadas, e combateu\nas propostas divorcistas.\n\nFaleceu no dia 15 de maio de 1998.\n\nFONTES: CÂM. DEP. *Anais*; CÂM. DEP. *Deputados brasileiros.\nRepertório* (1946-1967); CAMPOS, Q. *Fichário*; IPC. *Relação de\nparlamentares* (18/11/98).\n","ref":"FONTES: CÂM. DEP. *Anais*; CÂM. DEP. *Deputados brasileiros.\nRepertório* (1946-1967); CAMPOS, Q. *Fichário*; IPC. *Relação de\nparlamentares* (18/11/98).\n","dic":"DHBB"}
