{"title":"PEIXOTO, Carlos Fulgêncio da Cunha","cargoss":["Ministro do Supremo Tribunal Federal"],"cargos_esp":[0],"datas_ini":[1975],"datas_fim":[1981],"estados":[0],"autor":[0],"content":"**PEIXOTO, Carlos Fulgêncio da Cunha**\n\n\\*magistrado; min. STF 1975-1981.\n\n \n\n*Carlos Fulgêncio da Cunha Peixoto* nasceu em Teófilo Otoni (MG) no dia\n8 de dezembro de 1911, filho de Eustáquio da Cunha Peixoto e de Alzira\nFulgêncio Peixoto.\n\nEstudou no Colégio Arnaldo, no Ginásio Mineiro de Barbacena e no Ginásio\nde Teófilo Otoni. Transferiu-se depois para o Rio de Janeiro, então\nDistrito Federal, ingressando na Faculdade de Direito dessa cidade. De\nvolta a Minas Gerais, concluiu os estudos universitários na Faculdade de\nDireito do estado em 1935.\n\nAdvogado em Ibiá (MG), em 1946 foi nomeado consultor jurídico da\nSecretaria de Finanças de Minas Gerais. Exerceu essa função durante os\ngovernos de Mílton Campos (1947-1951), Juscelino Kubitschek (1951-1955)\ne José Francisco Bias Fortes (1956-1961), até o ano de 1958, quando foi\nnomeado desembargador do Tribunal de Justiça do estado, tornando-se\ndepois seu vice-presidente. Foi professor titular de direito comercial e\ndiretor da Faculdade de Direito da Pontifícia Universidade Católica de\nMinas Gerais.\n\nEm julho de 1975 foi nomeado pelo presidente da República, Ernesto\nGeisel, ministro do Supremo Tribunal Federal (STF) em substituição a\nAliomar Baleeiro, que se aposentara. Em março de 1978, juntamente com o\nministro Francisco Manuel Xavier de Albuquerque, votou pela\ninconstitucionalidade do artigo 62 da Lei Orgânica dos Partidos, que\nvetava a filiação partidária dos cidadãos punidos com suspensão de\ndireitos políticos por ato institucional. Discordando da maioria do STF,\nque aprovou o dispositivo, argumentou que o artigo 185 da Constituição\nnão tratava de filiação partidária, mas apenas de inelegibilidade.\n\nEm dezembro de 1981, deixou o STF, aposentando-se por limite de idade.\nEm março de 1983, com o início do governo de Tancredo Neves em****Minas\nGerais, foi nomeado secretário de Segurança Pública do estado.\n\nCunha Peixoto foi presidente do Instituto dos Advogados Brasileiros e\nredator-secretário da revista Minas Forense.\n\nFaleceu em Belo Horizonte no dia 22 de novembro de 1989.\n\nEra casado com Maria de Lurdes da Cunha Peixoto, com quem teve quatro\nfilhos.\n\nAutor de diversos artigos sobre direito financeiro e comercial\npublicados na *Revista Forense*, em *Minas Forense* e na *Revista dos\nTribunais*, escreveu *O cheque* (2v.) e *Sociedade por cotas de\nresponsabilidade limitada*.\n\n \n\nFONTES: COUTINHO, A. *Brasil*; INF. SUP. TRIB. FED.; *Jornal do Brasil*\n(24/6, 4 e 5/7/75, 9/3 e 16/7/78); SOC. BRAS. EXPANSÃO COMERCIAL.\n*Quem*; SUP. TRIB. FED. *Supremo*; *Veja* (23/12/81).\n\n \n","ref":"FONTES: COUTINHO, A. *Brasil*; INF. SUP. TRIB. FED.; *Jornal do Brasil*\n(24/6, 4 e 5/7/75, 9/3 e 16/7/78); SOC. BRAS. EXPANSÃO COMERCIAL.\n*Quem*; SUP. TRIB. FED. *Supremo*; *Veja* (23/12/81).\n\n \n","dic":"DHBB"}
