{"title":"ÁVILA, Cláudio","cargoss":["Constituinte","Deputado federal","Presidente de associação ou confederação de empregados ou empregadores"],"cargos_esp":[0,0,"Eletrobrás"],"datas_ini":[1987,1987,2001],"datas_fim":[1988,1991,2002],"estados":[0,"SC",0],"autor":[0],"content":"**ÁVILA, Cláudio**\n\n\\*const. 1987-1988; dep. fed. SC 1987-1991; pres. Eletrobrás 2001-2002\n\n*Cláudio Ávila da Silva* nasceu em Florianópolis no dia 2 de julho de\n1953, filho do advogado Renato Ramos da Silva e de Maria Mercedes Ávila\nda Silva. Seu pai, membro de uma das mais importantes famílias ligadas à\npolítica catarinense, foi secretário sem pasta do governo Celso Ramos\n(1961-1966) e senador por Santa Catarina de 1964 a 1967.\n\nAssumiu seu primeiro cargo público em maio de 1972, como chefe de\ngabinete da Secretaria de Justiça no governo de Colombo Sales\n(1971-1975). Em junho de 1974, tornou-se chefe do setor de estatística\ndo Banco do Estado de Santa Catarina (BESC) e aí permaneceu até março do\nano seguinte, quando Colombo encerrou sua gestão e passou o governo a\nAntônio Carlos Konder Reis (1975-1979).\n\nApós três meses na iniciativa privada, como assistente comercial da\nUsina de Açúcar Tijucas, retornou à administração pública em junho de\n1975, no posto de assessor da presidência do Banco de Desenvolvimento do\nEstado de Santa Catarina, aí permanecendo até o término do mandato do\ngovernador, em 15 de março de 1979. Nesse período, formou-se em\nadministração de empresas pela Escola Superior de Administração e\nGerência, de Florianópolis.\n\nSuperintendente da Fundação de Desenvolvimento do Estado de Santa\nCatarina de março de 1979 a fevereiro de 1982, em novembro desse ano\nelegeu-se deputado estadual na legenda do Partido Democrático Social\n(PDS). Iniciou o mandato em fevereiro de 1983, mas em 12 de abril\nlicenciou-se para assumiu a prefeitura de Florianópolis, nomeado pelo\nrecém-empossado governador Esperidião Amin (1983-1987). Na sucessão do\npresidente João Batista Figueiredo (1979-1985), aderiu à Frente Liberal,\ndissidência do PDS que apoiou a candidatura oposicionista de Tancredo\nNeves. Em virtude de sua posição, em janeiro de 1985 renunciou à\nprefeitura, transmitindo o cargo ao presidente da Câmara Municipal,\nAluísio Piazza, e retornou à Assembleia Legislativa, onde foi titular\ndas comissões de Finanças e de Serviços Públicos. Em novembro do ano\nseguinte, concorreu a uma vaga de deputado federal constituinte na\nlegenda do Partido da Frente Liberal (PFL), que ajudara a organizar em\nSanta Catarina. Eleito, assumiu o mandato em 1º de fevereiro de 1987.\n\nNa Constituinte, fez parte da Subcomissão da Educação, Cultura e\nEsportes, e das comissões da Família, de Ciência e Tecnologia, e da\nComunicação. Foi suplente da Subcomissão da Questão Urbana e de\nTransporte e da Comissão da Ordem Econômica. Apoiou o rompimento de\nrelações diplomáticas com países que praticassem políticas oficiais de\ndiscriminação racial; o mandado de segurança coletivo; o turno\nininterrupto de seis horas; a anistia aos micro e pequenos empresários,\ne o voto aos 16 anos. Votou contra a pena de morte; a estabilidade no\nemprego; a remuneração 50% superior para o trabalho extra; a limitação\ndo direito de propriedade privada; a jornada semanal de 40 horas; o\nlimite de 12% ao ano para os juros reais; o aviso prévio proporcional; a\nnacionalização do subsolo; a estatização do sistema financeiro; a\nproibição do comércio de sangue; a limitação dos encargos da dívida\nexterna; a criação de um fundo de apoio à reforma agrária; o mandato de\ncinco anos para o presidente José Sarney, e a legalização do jogo do\nbicho.\n\nLogo após a promulgação da nova Carta Constitucional (5/10/1988),\nlicenciou-se para tratar de assuntos particulares, sendo substituído\npelo suplente Estener Soratto. De volta à Câmara em janeiro de 1989,\nexerceu o mandato ordinário até o final da legislatura, em janeiro de\n1991, deixando de pleitear reeleição em outubro de 1990.\n\nEntre fevereiro de 1991 e fevereiro de 1993, foi assessor especial do\nsecretário-geral da Organização dos Estados Americanos (OEA), João\nClemente Baena Soares, em Washington (EUA). Em março de 1993, nomeado\npelo governador de Santa Catarina, Vílson Kleinübing (1991-1995),\nassumiu a Secretaria de Ciência e Tecnologia, Energia e Meio Ambiente.\nDeixou a secretaria em junho, para assumir o cargo de diretor-presidente\ndas Centrais Elétricas do Sul do Brasil (Eletrosul), empresa federal\ncontrolada pelas Centrais Elétricas Brasileiras (Eletrobrás).\n\nNo início de sua administração à frente da Eletrosul, tratou\nprioritariamente da retomada de projetos paralisados, em especial o\naproveitamento hidrelétrico de Itá, no rio Uruguai, firmando contrato\ncom um consórcio de quatro empresas privadas interessadas na implantação\ne exploração da usina. Homologado em 1995, o contrato com a Itá\nEnergética (Itasa) viabilizou o início das obras civis da hidrelétrica\nno ano seguinte. A Eletrosul também promoveu licitação para a seleção de\nparceiros no empreendimento hidrelétrico de Machadinho, no rio Pelotas,\nassinando contrato de compartilhamento da concessão do aproveitamento\ncom 11 empresas em janeiro de 1997. Entre as obras concluídas pela\nconcessionária federal durante sua gestão, merece destaque a\ntermelétrica de Jorge Lacerda IV, em Santa Catarina.\n\nA Eletrosul foi incluída no Programa Nacional de Desestatização (PND) em\nmaio de 1995 por decreto do presidente Fernando Henrique Cardoso. Em\noutubro de 1997, a Medida Provisória nº 1.531-11 autorizou o\ndesmembramento da companhia em uma empresa de geração e outra de\ntransmissão com o objetivo de permitir a privatização do segmento de\ngeração. Em dezembro do mesmo ano, os ativos de geração da Eletrosul\nforam transferidos para uma nova empresa, denominada Centrais Geradoras\ndo Sul do Brasil (Gerasul). À época da cisão, o parque gerador da\ncompanhia somava 3.719 MW de capacidade instalada. Com a privatização da\nGerasul em setembro de 1998, esse patrimônio passou ao controle da\nempresa belga Tractebel. Por sua vez, transformada numa empresa\nexclusivamente de transmissão, a Eletrosul mudou sua razão social para\nEmpresa Transmissora de Energia Elétrica do Sul do Brasil em dezembro de\n1998.\n\nCláudio Ávila permaneceu no comando da Eletrosul até abril de 2001,\nquando foi designado presidente da Eletrobrás em substituição ao\nengenheiro Firmino Ferreira Sampaio Neto. Sua posse na presidência da\nEletrobrás ocorreu às vésperas do lançamento da campanha de\nracionalização de consumo de energia elétrica, que foi programada pelo\nMinistério de Minas e Energia (MME) juntamente com outras ações\nemergenciais para minorar o quadro de desequilíbrio entre a oferta e a\ndemanda de eletricidade no país, em particular nas regiões Sudeste e\nNordeste, onde a situação era bastante crítica em decorrência do atraso\nde importantes obras de geração e transmissão e dos baixos índices\npluviométricos registrados nos primeiros meses do ano. Em maio de 2001,\no governo reconheceu a necessidade da implantação de um programa de\nracionamento, criando a Câmara de Gestão da Crise de Energia Elétrica\n(GCE). Iniciado em junho, o racionamento perduraria até fevereiro do ano\nseguinte, atingindo grande parte do território nacional.\n\nCláudio Ávila participou do Comitê de Revitalização do Modelo do Setor\nElétrico, criado em junho de 2001 pela GCE. Além da proposição de\nmedidas de aperfeiçoamento do marco regulatório, o comitê foi\nresponsável pela negociação do chamado Acordo Geral do Setor Elétrico,\noficializado em dezembro de 2001.\n\nDeixou a presidência da Eletrobrás em março de 2002, sendo substituído\ninterinamente pelo economista Nereu Ramos Neto até a designação do\nengenheiro Altino Ventura Filho como titular efetivo no mês seguinte.\nPassou então a atuar no setor privado, assumindo em meados de 2002 o\ncargo de vice-presidente da empresa catarinense Cerâmica Portobello\n\nCasado com Flávia Neto de Campos da Silva, teve dois filhos.\n\nFONTES: ASSEMB. NAC. CONST. *Repertório*(1987-1988); CACHAPUZ, P.B.\n*Panorama*; CÂM. DEP. *Deputados brasileiros. Repertório* (1991-1995);\nCOELHO, J. ; OLIVEIRA, A. *Nova;*INF. BIOG.; PIAZZA, W.F.*Dicionário*;\nPRESIDENTES.\n","ref":"FONTES: ASSEMB. NAC. CONST. *Repertório*(1987-1988); CACHAPUZ, P.B.\n*Panorama*; CÂM. DEP. *Deputados brasileiros. Repertório* (1991-1995);\nCOELHO, J. ; OLIVEIRA, A. *Nova;*INF. BIOG.; PIAZZA, W.F.*Dicionário*;\nPRESIDENTES.\n","dic":"DHBB"}
