{"title":"PERARO, Anselmo","cargoss":["Deputado federal"],"cargos_esp":[0],"datas_ini":[1983],"datas_fim":[1987],"estados":["PR"],"autor":[0],"content":"**PERARO, Anselmo**\n\n\\*dep. fed. PR 1983-1987.\n\n \n\n*Anselmo Santo Peraro* nasceu em Apucarana (PR) no dia 10 de novembro de\n1944, filho de Orlando Peraro e de Maria Carmem Peraro.\n\nPeraro é médico diplomado pela Faculdade Sul-Fluminense de Medicina\n(FUSF) da Universidade Severino Sombra (USS), estando inscrito sob o CRM\nde nº 4684. Além disso, disputou no pleito de novembro de 1982 uma vaga\nna Câmara dos Deputados na legenda do Partido do Movimento Democrático\nBrasileiro (PMDB). Foi empossado em fevereiro de 1983 e atuou nos\ntrabalhos legislativos como membro da Comissão de Saúde.\n\nEm 25 de abril de 1984, votou a favor da emenda Dante de Oliveira, que,\napresentada na Câmara dos Deputados, propôs o restabelecimento das\neleições diretas para presidente da República em novembro daquele ano\n(fruto das reivindicações civis pelas “diretas já”). Como a emenda não\nobteve o número de votos indispensáveis à sua aprovação — faltaram 22\npara que o projeto pudesse ser encaminhado à apreciação pelo Senado —,\nna disputa à presidência da República ocorrida no Colégio Eleitoral, em\n15 de janeiro de 1985, Anselmo Peraro votou em Tancredo Neves, candidato\nda Aliança Democrática — uma união do PMDB com a dissidência do Partido\nDemocrático Social (PDS) abrigada na Frente Liberal — em oposição ao\ncandidato do regime militar, Paulo Maluf, que acabou sendo derrotado.\nApesar de eleito, Tancredo Neves não chegou a ser empossado na\npresidência, vindo a falecer em 21 de abril de 1985. Seu substituto foi\no vice José Sarney, que já vinha exercendo interinamente o cargo desde\n15 de março.\n\nEm maio de 1986, Peraro transferiu-se do PMDB para o Partido Democrático\nTrabalhista (PDT), concorrendo à reeleição no pleito de novembro desse\nano. Contudo, obteve apenas uma suplência. Deixou a Câmara dos Deputados\nem janeiro de 1987, no fim da legislatura. Não participou, portanto, da\nAssembleia Nacional Constituinte que se iniciou na legislatura seguinte.\n\nDepois disso, retomou suas atividades de médico, limitando sua atuação\npolítica ao diretório municipal do PDT de Londrina (PR), cidade em que\npassou a residir. Paralelamente, tornou-se sócio da Peraro Construtora,\nnessa mesma cidade.\n\nAo longo de 2006, tentou retornar às atividades políticas articulando\nsua candidatura ao mandato de deputado federal pelo Partido\nSocial-Liberal (PSL). Entretanto, devido à falta de apoio das lideranças\ndo partido no Paraná, acabou renunciando ao direito de competir uma\nsemana antes da eleição. Assim, embora constasse nas listas de votação\ndivulgadas pelo Tribunal Regional Eleitoral no dia da eleição, terminou\nnão recebendo nenhum voto no pleito.\n\n Casou-se com Dirce Sonni Peraro, com quem teve dois filhos.\n\n \n\nFONTES: CÂM. DEP. *Deputados brasileiros*. *Repertó**rio* (1983-1987);\n*Globo* (26/4/84 e 16/6/85); INF. BIOG.; Portal CBN. Disponível em:\n\\<www.cbncuritiba.com.br/\\>.. Acesso em 14 dez. 09.\n\n \n","ref":"FONTES: CÂM. DEP. *Deputados brasileiros*. *Repertó**rio* (1983-1987);\n*Globo* (26/4/84 e 16/6/85); INF. BIOG.; Portal CBN. Disponível em:\n\\<www.cbncuritiba.com.br/\\>.. Acesso em 14 dez. 09.\n\n \n","dic":"DHBB"}
