{"title":"PERDIGÃO, Fenelon","cargoss":["Deputado federal"],"cargos_esp":[0],"datas_ini":[1935],"datas_fim":[1937],"estados":["PA"],"autor":[0],"content":"**PERDIGÃO, Fenelon**\n\n\\*militar; dep. fed.  PA 1935-1937.\n\n \n\n*             Fenelon Guilherme Perdigão*nasceu em Crato (CE) no dia 30\nde julho de 18? , filho de Eduardo Alencar Bomilcar Perdigão da Cunha e\nAurélia Perdigão.                             \n\n             Major do Exército, foi vice-pre­sidente do Clube Político\nBeneficente 24 de Outubro, associação criada em 1931 no Pará sob a\nliderança do interventor federal, o ma­jor Joaquim de Magalhães Barata,\ne por Abel Chermont visando garantir a concretização dos revolucionários\nde 1930. Exerceu seu mandato naquela agremiação de Janeiro de 1931 a\noutubro de 1933 e elegeu-se deputado federal pelo Pará no pleito de\noutubro de 1934, assumindo o mandato em maio do ano seguinte.\n\n             Em 11 de novembro de 1935, juntamen­te com diversos\ndeputados que condenavam a Lei de Segurança Nacional e a intensificação\nda repressão governamental  após  o fechamento da Aliança Nacional \nLibertadora (ANL), ocorrido em  julho desse ano, assinou o manifesto de\ncriação do Grupo Parlamentar Pró-Liberdades Populares. Defensor das\nliberdades constitucionais, esse núcleo parlamentar reivindicava também\no fechamento da Ação Integralista Brasileira (AIB).\n\n             Permaneceu na Câmara até novembro de 1937, quando o golpe\ndo Estado Novo suprimiu todos os órgãos  legislativos do país.\n\n             Afastado da política, tornou-se proprietário de cartório em\nBelém, e foi diretor do Matadouro Maguari.\n\n             Faleceu em Belém no dia 23 de setembro de 19?.\n\n             Era casado com Emília Paul Perdigão, de quem teve seis\nfilhos.\n\n \n\nFONTES: * Boletim Min. Trab*. (5/36); CÂM. DEP. *Deputados;* CRUZ,\nE.*História do* *Pará;* *Diário do congresso Nacional;* SILVA, H.\n*1935.*\n\n \n","ref":"FONTES: * Boletim Min. Trab*. (5/36); CÂM. DEP. *Deputados;* CRUZ,\nE.*História do* *Pará;* *Diário do congresso Nacional;* SILVA, H.\n*1935.*\n\n \n","dic":"DHBB"}
