{"title":"PERDIGÃO, Ivaldo","cargoss":["Deputado federal"],"cargos_esp":[0],"datas_ini":[1967],"datas_fim":[1971],"estados":["MA"],"autor":[0],"content":"**PERDIGÃO, Ivaldo**\n\n\\*dep. fed. MA 1967-1971.\n\n \n\n*Ivaldo Perdigão Freire* nasceu em São Luís no dia 19 de maio de 1917,\nfilho de Luís Tabosa Freire e de Francisca Perdigão Freire.\n\nDiplomou-se pela Faculdade de Ciências Médicas do Pará.\n\nMédico e professor, elegeu-se no pleito de outubro de 1958 deputado\nestadual no Maranhão na legenda das Oposições Coligadas, formadas pelo\nPartido Republicano (PR), o Partido Democrata Cristão (PDC) e a União\nDemocrática Nacional (UDN), assumindo o mandato em fevereiro do ano\nseguinte. Em outubro de 1962 reelegeu-se na legenda da mesma coligação\nque já contava então com a adesão do Partido Trabalhista Nacional (PTN).\n\nCom a extinção dos partidos políticos pelo Ato Institucional nº 2\n(27/10/1965) e a posterior instauração do bipartidarismo, filiou-se ao\nMovimento Democrático Brasileiro (MDB), partido de oposição ao regime\nmilitar instalado no país em abril de 1964. No pleito de novembro de\n1966, elegeu-se suplente de deputado federal por seu estado na legenda\ndesse partido. Em janeiro do ano seguinte encerrou seu mandato na\nAssembléia Legislativa maranhense, assumindo posteriormente uma cadeira\nna Câmara dos Deputados.\n\nAfastado do cenário político desde então, foi ainda superintendente do\nInstituto de Previdência e Assistência dos Servidores do Estado (IPASE),\nem Brasília.\n\nFaleceu em Brasília no dia 3 de setembro de 1976.\n\nEra casado com Maria dos Anjos Jorge Freire, com quem teve seis filhos.\n\n \n\nFONTES: CÂM. DEP. *Deputados brasileiros. Repertório* (1967-1971); INF.\nIlse Perdigão Freire; TRIB. SUP. ELEIT. *Dados* (4, 6 e 8).\n\n \n","ref":"FONTES: CÂM. DEP. *Deputados brasileiros. Repertório* (1967-1971); INF.\nIlse Perdigão Freire; TRIB. SUP. ELEIT. *Dados* (4, 6 e 8).\n\n \n","dic":"DHBB"}
