{"title":"PEREIRA JÚNIOR, Antônio José","cargoss":["Deputado federal","Constituinte"],"cargos_esp":[0,0],"datas_ini":[1926,1946],"datas_fim":[1926,1946],"estados":["MA",0],"autor":[0],"content":"**PEREIRA JÚNIOR, Antônio José**\n\n\\*magistrado; dep. fed. MA 1926; const. 1946.\n\n* *\n\n*Antônio José Pereira Júnior* nasceu em Alcântara (MA) no dia 24 de\nmarço de 1869.\n\nTransferindo-se para Pernambuco, ingressou na Faculdade de Direito do\nRecife, pela qual se bacharelou em 1890. De volta ao Maranhão, foi juiz\nde direito em São Luís e em Pinheiro e desembargador do Tribunal de\nJustiça do estado. Em 1926 foi eleito deputado federal pelo seu estado,\nexercendo o mandato de maio a dezembro desse ano. Depois da Revolução de\n1930, com a reconstitucionalização do país, elegeu-se em maio de 1933\nsuplente de deputado à Assembléia Nacional Constituinte (ANC) na legenda\nda União Republicana Maranhense, mas não chegou a exercer o mandato.\n\nCom o fim do Estado Novo (29/10/1945) e a conseqüente redemocratização\ndo país, nas eleições de dezembro de 1945 elegeu-se senador pelo\nMaranhão à ANC na legenda do Partido Social Democrático (PSD). Assumiu o\nmandato em fevereiro de 1946 e, já com problemas de saúde, pouco\nparticipou dos trabalhos de elaboração da nova Carta, não tendo mesmo\napresentado emendas ao projeto de Constituição.\n\nFaleceu no Rio de Janeiro, então Distrito Federal, no dia 5 de agosto de\n1946, em pleno exercício do mandato.\n\nPublicou *Gramática prática* (1924).\n\n \n\nFONTES: ASSEMB. NAC. CONST. (1934). *Anais* (1); BRAGA, S. *Quem foi\nquem*; CÂM. DEP. *Deputados*; MOREIRA, J. *Dic*.; SILVA, G.\n*Constituinte*; TRIB. SUP. ELEIT. *Dados* (1).\n\n \n","ref":"FONTES: ASSEMB. NAC. CONST. (1934). *Anais* (1); BRAGA, S. *Quem foi\nquem*; CÂM. DEP. *Deputados*; MOREIRA, J. *Dic*.; SILVA, G.\n*Constituinte*; TRIB. SUP. ELEIT. *Dados* (1).\n\n \n","dic":"DHBB"}
