{"title":"PEREIRA, Álvaro","cargoss":["Deputado federal"],"cargos_esp":[0],"datas_ini":[1992],"datas_fim":[1993],"estados":["MG"],"autor":[0],"content":"**PEREIRA, Álvaro**\n\n\\*dep. fed. MG 1992-1993.\n\n*Álvaro Rodrigues Pereira* nasceu em Coromandel (MG) no dia 10 de julho\nde 1952, filho de Ermiro Rodrigues Pereira e de Selva Silva Rodrigues.\n\nEm 1971, ingressou no curso de comunicação social da Universidade de\nBrasília (UnB) e, dois anos depois, já trabalhava como repórter político\nda revista *Veja*. Formado em 1974, atuou no periódico até 1978, quando\nfoi contratado pela Rede Globo de Televisão.\n\nComo repórter internacional da emissora, cobriu as eleições\npresidenciais de Ronald Reagan (1980), nos Estados Unidos; de Raul\nAlfonsin (1983) e Carlos Menem (1989), na Argentina; e de Julio\nSanguinetti (1984) e Luis Alberto Lacalle (1989), no Uruguai. Além\ndisso, fez a cobertura de viagens dos presidentes João Batista\nFigueiredo (1979-1985) e José Sarney (1985-1990) ao exterior.\n\nIniciou sua carreira política em 1990, filiando-se ao Partido da Social\nDemocracia Brasileira (PSDB), pelo qual, em outubro do mesmo ano,\ncandidatou-se a deputado federal por Minas Gerais para a legislatura\n1991-1995, obtendo apenas uma suplência.\n\nDeixou a Globo em 1992. Durante sua passagem pela emissora exerceu ainda\nas funções de repórter e editor de política do *Jornal nacional*,\ncomentarista político do *Jornal da Globo* e de editor e apresentador do\njornal *Bom dia Brasil*. Contratado pela Rede OM de Televisão, aí ocupou\no cargo de diretor regional e atuou como comentarista político, editor e\napresentador do programa *Debate nacional*.\n\nEm outubro de 1992, assumiu uma cadeira na Câmara Federal em\nsubstituição ao também suplente Otávio Elísio, que se declarou\nimpossibilitado de ocupar a vaga do titular Paulino Cícero, nomeado\nministro de Minas e Energia pelo presidente da República, Itamar Franco.\nComo deputado federal, Pereira foi membro da Comissão de Ciência e\nTecnologia, Comunicação e Informática da Câmara dos Deputados e\nparticipou da Comissão Parlamentar de Inquérito (CPI) mista criada para\ninvestigar denúncias de esterilização de mulheres no Brasil. Com o\nretorno do titular em dezembro de 1993, voltou à condição de suplente.\n\nNo pleito de outubro de 1994, disputou novo mandato de deputado federal,\nconquistando, mais uma vez, apenas uma suplência.\n\nEm 2001 cursou uma pós-graduação em marketing na Fundação Getúlio\nVargas, e passou a atuar como produtor independente com a empresa AP\nVídeo e Comunicação. \n\nCasou-se com Arilda Helena Gonçalves de Resende, com quem teve três\nfilhas.\n\nPublicou o livro *Cara ou Coroa: tudo o que você precisa saber sobre\nparlamentarismo, presidencialismo e monarquia*(1993) e *Depois de FHC:\npersonagens do cenário político analisam o governo Fernando Henrique\nCardoso e apontam alternativas para o Brasil* (2002).\n\nFONTES: *Almanaque Abril*(1990); CÂM. DEP. *Deputados brasileiros.\nRepertório* (1991-1995); CÂM. DEP. *Lista de suplentes* (1991-1995);\nPortal Memória Globo (14/2/04).\n\n \n","ref":"FONTES: *Almanaque Abril*(1990); CÂM. DEP. *Deputados brasileiros.\nRepertório* (1991-1995); CÂM. DEP. *Lista de suplentes* (1991-1995);\nPortal Memória Globo (14/2/04).\n\n \n","dic":"DHBB"}
