{"title":"PEREIRA, Augusto Públio","cargoss":["Deputado federal","Deputado federal"],"cargos_esp":[0,0],"datas_ini":[1960,1955],"datas_fim":[1960,1959],"estados":["BA","BA"],"autor":[0],"content":"**PEREIRA, Augusto Públio**\n\n\\*dep. fed. BA 1955-1959 e 1960.\n\n \n\n*Augusto Públio Pereira*, filiado ao Partido Social Democrático (PSD),\nelegeu-se em outubro de 1954 deputado federal pela Bahia na legenda da\nColigação Baiana, composta pelo PSD, o Partido de Representação Popular\n(PRP) e o Partido Libertador (PL).\n\nAssumindo o mandato em fevereiro de 1955, candidatou-se à reeleição em\noutubro de 1958, obtendo apenas uma suplência, dessa vez na legenda da\nAliança Democrática Popular, formada pelo PSD e o PRP. Encerrando seu\nprimeiro mandato em janeiro de 1959, retornou à Câmara em 29 de agosto\nde 1960, em substituição a Miguel Calmon du Pin e Almeida.\n\nFaleceu no dia 26 de novembro do mesmo ano, em pleno exercício do\nmandato.\n\n \n\n \n\nFONTES: CÂM. DEP. Deputados; CÂM. DEP. Deputados federais. Inventário;\nCÂM. DEP. Relação dos dep.; TRIB. SUP. ELEIT. Dados (3 e 4).\n\n \n","ref":"FONTES: CÂM. DEP. Deputados; CÂM. DEP. Deputados federais. Inventário;\nCÂM. DEP. Relação dos dep.; TRIB. SUP. ELEIT. Dados (3 e 4).\n\n \n","dic":"DHBB"}
