{"title":"AZAMBUJA, Hélio de Almeida","cargoss":["Comandante do IV Distrito Naval","Comandante do I Distrito Naval"],"cargos_esp":[0,0],"datas_ini":[1958,1962],"datas_fim":[1959,1964],"estados":[0,0],"autor":[0],"content":"**AZAMBUJA, Hélio de Almeida**\n\n\\*militar; comte. IV DN 1958-1959; comte. I DN 1962-1964.\n\n \n\n*Hélio de Almeida Azambuja* nasceu em Mato Grosso no dia 26 de janeiro\nde 1905.\n\nIngressou na Escola Naval em 1921, terminando o curso e sendo promovido\na segundo-tenente em outubro de 1925. Sucessivamente promovido a\nprimeiro-tenente (novembro de 1927), capitão-tenente (março de 1932) e\ncapitão-de-corveta (abril de 1941), durante a Segunda Guerra Mundial\nparticipou de operações da Marinha brasileira.\n\nPromovido a capitão-de-fragata em maio de 1946 e a\ncapitão-de-mar-e-guerra em 1952, ao longo de sua carreira na Marinha,\naté 1958, comandou os contratorpedeiros *Piauí, Mato* *Grosso*e*Marcílio\nDias;*foi assistente do comandante-em-chefe da Esquadra, adido naval em\nLima, Peru, chefe do estado-maior da Força de Contratorpedeiros e chefe\ndo estado-maior do I Distrito Naval (I DN), sediado no Rio de Janeiro.\nFoi ainda adjunto da divisão de assuntos políticos e chefe da divisão\nexecutiva do Curso Superior de Guerra.\n\nEm 13 de maio de 1958, foi nomeado comandante do IV Distrito Naval (IV\nDN), sediado em Belém. Promovido a contra-almirante em junho de 1958 e a\nvice-almirante em fevereiro do ano seguinte, deixou o comando do IV DN\nem junho de 1959.\n\nEm julho de 1962, assumiu o comando do I DN, permanecendo na função até\n7 de abril de 1964, afastando-se logo depois da vitória do movimento\npolítico-militar de março daquele ano.\n\nFez os cursos de especialização de armamento, de comando e superior na\nEscola de Guerra Naval e de informação estratégica e superior de guerra,\nna Escola Superior de Guerra.\n\nFaleceu no Rio de Janeiro no dia 1º de setembro de 1983.\n\n \n\nFONTES: CORRESP. SERV. DOC. GER. MAR.; MIN. MAR. *Almanaque*(1927 e\n1964).\n\n \n","ref":"FONTES: CORRESP. SERV. DOC. GER. MAR.; MIN. MAR. *Almanaque*(1927 e\n1964).\n\n \n","dic":"DHBB"}
