{"title":"PEREIRA, Edgar","cargoss":["Deputado federal"],"cargos_esp":[0],"datas_ini":[1959],"datas_fim":[1971],"estados":["BA"],"autor":[0],"content":"**PEREIRA, Edgar**\n\n\\*dep. fed. BA 1959-1971.\n\n \n\n*Edgar Agnelo Pereira* nasceu em Saúde (BA) no dia 2 de novembro de\n1914, filho de Albino Agnelo Pereira e de Maria Cândida Pereira.\n\nProprietário de terras, comerciante e banqueiro, filiado ao Partido\nSocial Democrático (PSD), foi prefeito municipal de Saúde por duas vezes\ne deputado à Assembléia Legislativa baiana nas legislaturas 1951-1955 e\n1955-1959.\n\nNo pleito de outubro de 1958, elegeu-se deputado federal na legenda da\nAliança Democrática Popular, composta pelo PSD e o Partido de\nRepresentação Popular (PRP). Assumindo o mandato em fevereiro de 1959,\nno pleito seguinte (7/10/1962) foi reconduzido à Câmara pela Aliança\nDemocrática Trabalhista Cristã, formada pelo PSD, o Partido Democrata\nCristão (PDC), o Partido Trabalhista Nacional (PTN), o Partido Social\nProgressista (PSP) e o Partido Socialista Brasileiro (PSB).\n\nEm conseqüência da extinção dos partidos políticos pelo Ato\nInstitucional nº 2 (27/10/1965) e da posterior instauração do\nbipartidarismo, filiou-se ao Movimento Democrático Brasileiro (MDB),\npartido de oposição ao regime militar instaurado no país em abril de\n1964, pelo qual tornou a reeleger-se no pleito de novembro de 1966,\npermanecendo na Câmara até o final de seu terceiro mandato (31/1/1971).\n\nAfastando-se da vida pública, passou a dedicar-se à sua fazenda em Saúde\ne à exploração de uma mina de ouro naquele mesmo município.\n\nFoi também diretor do Banco Mercantil do Nordeste.\n\nFaleceu em Salvador no dia 20 de abril de 1999.\n\nEra casado com Iraci Mota Pereira, com quem teve um filho.\n\n \n\nFONTES: CÂM. DEP. *Deputados brasileiros. Repertório* (1967-1971);\nCOUTINHO, A. *Brasil*; FLEISCHER, D. *Thirty*; INF. FAM.; TRIB. SUP.\nELEIT. *Dados* (4, 5 e 6).\n\n \n","ref":"FONTES: CÂM. DEP. *Deputados brasileiros. Repertório* (1967-1971);\nCOUTINHO, A. *Brasil*; FLEISCHER, D. *Thirty*; INF. FAM.; TRIB. SUP.\nELEIT. *Dados* (4, 5 e 6).\n\n \n","dic":"DHBB"}
