{"title":"PEREIRA, Jackson","cargoss":["Deputado federal"],"cargos_esp":[0],"datas_ini":[1991],"datas_fim":[1995],"estados":["CE"],"autor":[0],"content":"**PEREIRA, Jackson**\n\n\\*dep. fed. CE 1991-1995.\n\n \n\n*João Jackson de Albuquerque Pereira* nasceu em Fortaleza no dia 24 de\njunho de 1947, filho de Luís Crecêncio Pereira e de Elice de Albuquerque\nPereira.\n\nEm 1966, deixou incompleto o curso de administração de empresas na\nEscola de Administração do Ceará (EAC). Exerceu as profissões de\njornalista no Diário do Nordeste e de radialista na Rádio Assunção, em\nsua cidade natal. Em seguida, entre 1979 e 1990, foi bancário, tendo\nexercido o cargo de diretor administrativo financeiro do Banco do Ceará\nS.A. (Bancesa). Neste período, em 1989, participou de reunião do Fundo\nMonetário Internacional (FMI), a convite desta instituição, nos Estados\nUnidos, e filiou-se ao Partido da Reconstrução Nacional (PRN),\nagremiação que se formou em torno da candidatura vitoriosa de Fernando\nCollor de Melo para presidente da República nas eleições de\nnovembro/dezembro daquele ano.\n\nTransferindo-se do PRN para o Partido da Social Democracia Brasileira\n(PSDB), no pleito de outubro de 1990 elegeu-se deputado federal.\nEmpossado em fevereiro seguinte, atuou como vice-líder do PSDB na\nCâmara, tendo participado das comissões Especial do Projeto de Lei sobre\na Regulamentação do Sistema Financeiro Nacional, de 1991 a 1992, e\nEspecial dos Crimes de Responsabilidade do Presidente da República, em\n1992. No Congresso Nacional, integrou também a Comissão Mista (Câmara e\nSenado) de Planos, Orçamentos Públicos e Fiscalização, em 1992. Na\nsessão da Câmara dos Deputados do dia 29 de setembro de 1992, foi um dos\n38 parlamentares que votaram contra a abertura de processo de\n*impeachment* do presidente Fernando Collor de Melo, acusado de crime de\nresponsabilidade por ligações com um esquema de corrupção liderado pelo\nex-tesoureiro de sua campanha presidencial, Paulo César Farias. Collor\nfoi afastado da presidência após a votação do impeachment e acabou\nrenunciando ao mandato no dia 29 de dezembro seguinte, pouco antes da\nconclusão do processo pelo Senado. Com sua renúncia, Itamar Franco, vice\nem exercício desde 2 de outubro, foi efetivado na presidência.\n\nNa Câmara, Jackson atuou ainda na Comissão de Finanças e Tributação, de\n1991 a 1994, exercendo a primeira-vice-presidência em 1993; Comissão\nEspecial do Sistema Tributário Nacional, como vice-presidente, em 1993;\nComissão Especial da Legalidade do Jogo; e na Comissão Parlamentar de\nInquérito (CPI) sobre Denúncias de Irregularidades no Instituto Nacional\nde Assistência Médica da Previdência Social (INAMPS), em 1994. Ao longo\ndessa legislatura, votou a favor da criação do Fundo Social de\nEmergência (FSE), projeto aprovado que permitia ao governo retirar\nrecursos de áreas como saúde e educação para ter maior liberdade de\nadministração das verbas, e do fim do voto obrigatório, projeto\nrejeitado. Ainda entre 1993 e 1994, integrou missão junto à Organização\ndas Nações Unidas (ONU), em Nova Iorque.\n\nReeleito no pleito de outubro de 1994 — obteve a maioria dos votos de\nsuas bases eleitorais no vale do Jaguaribe, região norte, litoral leste\ne na capital —, encerrou aquele mandato em janeiro de 1995, iniciando o\nseguinte em fevereiro do mesmo ano. Em maio de 1995, como vice-líder do\nPSDB na Câmara e ex-relator da CPI da Previdência Social, criticou o\nministro da Saúde, Adib Jatene, por não reprimir as fraudes no Sistema\nÚnico de Saúde (SUS) através de um esquema de auditoria, deixando a\ntarefa para as secretarias estaduais. Para Jackson Pereira, aquela\natitude seria como “botar a raposa tomando conta do galinheiro”,\nfavorecendo assim fraudes no uso do dinheiro pelas secretarias. No mês\nseguinte, por ocasião da greve dos petroleiros, contrapôs-se à pesquisa\nrealizada pelo *Jornal do Brasil* em que 1/3 da população culpava o\ngoverno pela greve. Defendendo a posição adotada pelo governo de\nenfrentar a greve, garantiu que essa atitude teria o apoio da maioria da\npopulação e que a greve consolidaria a “tendência da maioria na Câmara e\nno Senado para aprovar o fim do monopólio da Petrobras na exploração do\npetróleo”.\n\nJackson Pereira foi ainda agente de viagem e sócio da Crevitur Ltda;\nmembro do Conselho Consultivo da Associação Brasileira de Bancos\nComerciais e Múltiplos, e da Associação Cearense de Imprensa;\ncolaborador como articulista de vários órgãos da imprensa nacional e\npresidente nacional da Câmara Júnior do Brasil.\n\nFaleceu em Fortaleza no dia 26 de julho de 1995, sendo substituído na\nCâmara por Ariosto Holanda.\n\nEra casado com Marta Maria de Castro Pereira, com quem teve cinco\nfilhos.\n\n \n\nFONTES: CÂM. DEP. *Deputados brasileiros. Repertório* (1995-1999);\n*Folha de S. Paulo* (18/9/94, 31/1 e 27/7/95); *Globo* (27/7/95);\n*Jornal do Brasil* (18/5 e 4/6/95); *Perfil parlamentar/IstoÉ.*\n\n \n","ref":"FONTES: CÂM. DEP. *Deputados brasileiros. Repertório* (1995-1999);\n*Folha de S. Paulo* (18/9/94, 31/1 e 27/7/95); *Globo* (27/7/95);\n*Jornal do Brasil* (18/5 e 4/6/95); *Perfil parlamentar/IstoÉ.*\n\n \n","dic":"DHBB"}
