{"title":"PEREIRA, José da Costa","cargoss":["Senador","Senador","Senador"],"cargos_esp":[0,0,0],"datas_ini":[1960,1956,1951],"datas_fim":[1960,1956,1955],"estados":["GO","GO","GO"],"autor":[0],"content":"**PEREIRA, José da Costa**\n\n\\*sen. GO 1951-1955, 1956 e 1960.\n\n* *\n\n*José da Costa Pereira nasceu em Orizona (GO) no dia 25 de março de\n1892, filho de José da Costa Pereira e de Placidina Carolina Amélia.*\n\nFez seus estudos secundários no Ginásio Diocesano de Uberaba (MG),\ndedicando-se posteriormente ao estudo de filologia.\n\nFazendeiro, durante o Estado Novo (1937-1945)****foi prefeito municipal\nde sua cidade e, no pleito de janeiro de 1947, elegeu-se suplente do\nsenador Pedro Ludovico Teixeira, eleito em dezembro de 1945 pelo estado\nde Goiás na legenda do Partido Social Democrático (PSD). Em março de\n1951 assumiu a cadeira de Pedro Ludovico, que fora eleito governador de\nGoiás em outubro de 1950, permanecendo no Senado até o fim de seu\nmandato, em janeiro de 1955.\n\nReeleito suplente do senador Pedro Ludovico em outubro de 1954, assumiu\no mandato de setembro a dezembro de 1956 e de outubro a dezembro de\n1960, quando deixou o Senado.\n\nAfastado da vida pública desde então, retornou a Orizona, onde passou a\nlecionar língua portuguesa no Ginásio Municipal.\n\nFaleceu em Hidrolândia (GO) no dia 1º de junho de 1991.\n\nEra casado com Adosinda Reis, com quem teve quatro filhos.\n\n \n\nFONTES: CISNEIROS, A. *Parlamentares*; INF. Crisólogo Costa; SENADO.\n*Relação*; TRIB. SUP. ELEIT. *Dados* (1 e 3).\n\n \n","ref":"FONTES: CISNEIROS, A. *Parlamentares*; INF. Crisólogo Costa; SENADO.\n*Relação*; TRIB. SUP. ELEIT. *Dados* (1 e 3).\n\n \n","dic":"DHBB"}
