{"title":"PEREIRA, Justino","cargoss":["Deputado federal"],"cargos_esp":[0],"datas_ini":[1967],"datas_fim":[1971],"estados":["PR"],"autor":[0],"content":"**PEREIRA, Justino**\n\n\\*dep. fed. PR 1967-1971.\n\n*José Justino Filgueiras Alves Pereira* nasceu em Miraí (MG) no dia 9 de\nsetembro de 1923, filho de Henrique Alves Pereira e de Josélia\nFilgueiras Alves Pereira.\n\nTransferindo-se para o Rio de Janeiro, então Distrito Federal, ingressou\nna Faculdade de Ciências Médicas, pela qual se diplomou em 1947.\n\nRadicado posteriormente no Paraná, elegeu-se vereador à Câmara Municipal\nde Ibiporã e, no pleito de outubro de 1958, alcançou uma suplência de\ndeputado estadual na legenda da Frente Democrática do Paraná, formada\npela União Democrática Nacional (UDN) e o Partido Republicano (PR). Não\nchegou a assumir o mandato nessa ocasião.\n\nSecretário de Saúde Pública do governo paranaense na gestão de Nei Braga\n(1961-1965), elegeu-se no pleito de outubro de 1962 deputado à\nAssembléia Legislativa do Paraná na legenda da UDN, assumindo o mandato\nem fevereiro do ano seguinte. Com a extinção dos partidos políticos pelo\nAto Institucional nº 2 (27/10/1965) e a posterior instauração do\nbipartidarismo, filiou-se à Aliança Renovadora Nacional (Arena). Nessa\nlegenda se elegeu deputado federal pelo Paraná no pleito de novembro de\n1966, assumindo o mandato em fevereiro do ano seguinte. Em novembro de\n1970 elegeu-se suplente de deputado federal por seu estado, sempre na\nlegenda da Arena.\n\nEm janeiro de 1971 deixou a Câmara dos Deputados, não voltando a exercer\no mandato.\n\nCasou-se com Ildeman de Figueiredo Alves.\n\nFONTES: CÂM. DEP. *Deputados;*CÂM. DEP. *Deputados brasileiros.\nRepertório*(6); TRIB. SUP. ELEIT. *Dados*(4, 6, 8 e 9).\n\n \n","ref":"FONTES: CÂM. DEP. *Deputados;*CÂM. DEP. *Deputados brasileiros.\nRepertório*(6); TRIB. SUP. ELEIT. *Dados*(4, 6, 8 e 9).\n\n \n","dic":"DHBB"}
