{"title":"PEREIRA, Luís (2)","cargoss":["Presidente de associação ou confederação de empregados ou empregadores","Presidente de associação ou confederação de empregados ou empregadores"],"cargos_esp":["CIESP-FIESP","CIB"],"datas_ini":[1931,1934],"datas_fim":[1935,1935],"estados":[0,0],"autor":[0],"content":"**PEREIRA, Luís (2)**\n\n\\*pres. CIESP-FIESP 1931-1935; pres. CIB 1934-1935.\n\n \n\n*Luís Tavares Alves Pereira* nasceu em Bajé (RS) no dia 4 de fevereiro\nde 1876, filho de Gervásio Alves Pereira e de Maria Cecília Tavares\nPereira.\n\nDiplomado em engenharia pela Escola Politécnica do Rio de Janeiro (então\nDistrito Federal) em 1898, trabalhou na dragagem da lagoa dos Patos e na\nconstrução do porto da cidade do Rio Grande, em seu estado natal, como\najudante do diretor-geral da Compagnie Française du Port de Rio Grande\ndo Sul.\n\nTransferiu-se mais tarde para São Paulo e dedicou-se à engenharia\nferroviária, trabalhando durante 42 anos na Cia. Paulista de Estradas de\nFerro, empresa da qual foi diretor e depois vice-presidente.\n\nEm 1931, foi eleito presidente do Centro das Indústrias do Estado de São\nPaulo (CIESP), substituindo Francisco Matarazzo, que ocupava o cargo\ndesde a fundação da entidade em 1928. Em maio de 1931, como decorrência\nda nova lei de sindicalização decretada em março, os industriais\npaulistas transformaram o CIESP em federação (FIESP), para que esta\npudesse acolher sindicatos patronais, além de firmas. Conservaram-se,\nentretanto, o caráter de associação civil do antigo CIESP e sua direção.\n\nQuando eclodiu a Revolução Constitucionalista em julho de 1932, em São\nPaulo, Luís Alves Pereira encontrava-se no Rio de Janeiro.\nImpossibilitado de regressar à capital paulista, foi substituído por\nRoberto Simonsen à frente da FIESP, que se constituiu em um dos mais\nfortes pontos de apoio ao movimento rebelde, assumindo a seu cargo a\nmobilização total do parque industrial paulista em apoio ao esforço de\nguerra.\n\nEm 25 de janeiro de 1933, integrou a delegação da FIESP na seção de\ninstalação da Confederação Industrial do Brasil (CIB), atual\nConfederação Nacional da Indústria, tornando-se um dos seus fundadores e\nsendo eleito vice-presidente na chapa encabeçada por Francisco de\nOliveira Passos, da Federação Industrial do Rio de Janeiro (FIRJ). No\nano seguinte, em nova eleição, tornou-se presidente, permanecendo no\ncargo até 1935, quando deixou também a presidência da FIESP. Em 1936\nintegrou o conselho deliberativo da CIB.\n\nComo empresário, dedicou-se ainda às seguintes atividades: presidente da\nCompanhia Brasileira de Materiais Ferroviários Pirelli S.A. e da Química\nIndustrial Barra do Piraí S.A.; vice-presidente da Cobrasma;\nrepresentante geral da Brasil Rey Co. no Brasil, e presidente do Banco\nFrancês e Italiano para a América do Sul.\n\nFaleceu em São Paulo no dia 16 de junho de 1960.\n\nSônia Dias\n\n \n\n \n\nFONTES: CONF. INDUSTRIAL DO BRASIL. Relatório; CONF. NAC. IND.; CONSULT.\nMAGALHÃES, B.; COUTINHO, A. Brasil; OLIVEIRA, C. CIESP.\n\n \n","ref":"FONTES: CONF. INDUSTRIAL DO BRASIL. Relatório; CONF. NAC. IND.; CONSULT.\nMAGALHÃES, B.; COUTINHO, A. Brasil; OLIVEIRA, C. CIESP.\n\n \n","dic":"DHBB"}
