{"title":"PEREIRA, Samuel Ribeiro Gomes","cargoss":["Comandante da III Zona Aérea","Comandante da IV Zona Aérea"],"cargos_esp":[0,0],"datas_ini":[1946,1948],"datas_fim":[1948,1949],"estados":[0,0],"autor":[0],"content":"**PEREIRA, Samuel Ribeiro Gomes**\n\n\\*militar; comte. III ZA 1946-1948; comte. IV ZA 1948-1949.\n\n*Samuel Ribeiro Gomes Pereira nasceu no dia 28 de agosto de 1892.*\n\nSentou praça em dezembro de 1909, ingressando na****Escola de Guerra de\nPorto Alegre. Aspirante da arma de artilharia em dezembro de 1919, foi\npromovido a segundo-tenente em abril de 1920 e a primeiro-tenente em\nmaio do ano seguinte. Ainda em 1921, concluiu o curso de observador\naéreo.\n\nPromovido a capitão em fevereiro de 1925, incorporou-se em novembro de\n1927 ao primeiro grupo de oficiais de artilharia transferidos para arma\nde aviação. Em junho de 1933 recebeu a patente de major, exercendo de\njulho desse ano a julho de 1935 o comando do 5º Regimento de Aviação,\ncom sede em Curitiba. Em maio deste último ano, juntamente com outros\noficiais, participou do vôo que acompanhou o então presidente da\nRepública, Getúlio Vargas, em sua visita ao Uruguai e à Argentina.\n\nEm dezembro de 1937 foi designado para o comando do 1º Regimento de\nAviação, sediado no Campo dos Afonsos, no Rio de Janeiro, então Distrito\nFederal, onde serviu até dezembro de 1938. Em 1940, tornou-se membro do\nConselho de Aeronáutica e diretor do Departamento de Aeronáutica Civil\n(DAC), ingressando na Força Aérea Brasileira (FAB) em 1941, quando da\ncriação do Ministério da Aeronáutica. Permaneceu à frente do DAC até\nfevereiro de 1942, quando foi designado adido aeronáutico à embaixada do\nBrasil no Peru. Em maio de 1946 retornou ao Brasil, sendo nomeado em\noutubro desse ano, já no posto de brigadeiro-do-ar, comandante da III\nZona Aérea (III ZA), com sede no Rio de Janeiro, em substituição ao\ncoronel-aviador Carlos Pfaltzgraff Brasil. Afastou-se do cargo em março\nde 1948, substituído pelo brigadeiro Armando de Sousa e Melo Araribóia,\ne assumiu em seguida o comando da IV Zona Aérea, sediada em São Paulo,\nonde serviu até março de 1949.\n\nFONTES: COMDO. AÉREO REGIONAL. III; MIN. GUERRA. *Almanaque*(1934);\nWANDERLEY, N. *História.*\n\n \n","ref":"FONTES: COMDO. AÉREO REGIONAL. III; MIN. GUERRA. *Almanaque*(1934);\nWANDERLEY, N. *História.*\n\n \n","dic":"DHBB"}
