{"title":"PERES, Aurélio","cargoss":["Deputado federal"],"cargos_esp":[0],"datas_ini":[1979],"datas_fim":[1987],"estados":["SP"],"autor":["Marcelo Costa"],"content":"**PERES, Aurélio**\n\n\\*dep. fed. SP 1979-1987.\n\n*Aurélio Peres* nasceu em Bilac (SP) no dia 31 de julho de 1939, filho\nde Antônio Peres e de Maria Cáceres.\n\nEm 1957 concluiu seus estudos de primeiro grau em Santa Fé do Sul (SP).\nEntre 1963 e 1965 fez o secundário no Seminário Arquidiocesano de\nRibeirão Preto (SP) e, ainda nesse ano, ingressou no curso de filosofia\ndo Seminário Central Maria Imaculada, em São Paulo, concluindo-o em\n1968. Entre 1969 e 1973 realizou cursos de torneiro mecânico, fresador e\nferramenteiro no Serviço Nacional de Aprendizagem Industrial (Senai) em\nSão Paulo.\n\nEm meados da década de 1970 passou a atuar na Pastoral Operária,\nentidade ligada às comunidades eclesiais de base (CEBs) da Igreja\nCatólica. Por sua militância nessa entidade, em setembro de 1974 foi\npreso e torturado no Departamento de Operações Internas — Centro de\nOperações para a Defesa Interna (DOI-CODI) do II Exército, sendo\nlibertado no mês seguinte por intermédio da Arquidiocese de São Paulo.\nAinda em 1974 tornou-se coordenador do Movimento do Custo de Vida na\ncapital paulista, cargo que exerceria até 1978.\n\nEm 1976, começou a trabalhar na fábrica de bicicletas Caloi, situada na\nregião de Santo Amaro, na Zona Sul da capital paulista, passando a\nmilitar na Oposição Sindical Metalúrgica de São Paulo.\n\nEm novembro de 1978, Peres candidatou-se a deputado federal por São\nPaulo, na legenda do Movimento Democrático Brasileiro (MDB), partido de\noposição ao regime militar instaurado no país em abril de 1964. Foi o\núnico parlamentar de origem operária eleito e assumiu o mandato em\nfevereiro. Participou dos trabalhos legislativos como membro titular das\ncomissões de Trabalho e Legislação Social e de Transportes, e suplente\ndas comissões de Agricultura e Política Rural, do Interior e de Defesa\ndo Consumidor. Com o fim do bipartidarismo em novembro de 1979 e a\nconseqüente reformulação partidária, filiou-se ao Partido do Movimento\nDemocrático Brasileiro (PMDB), agremiação que sucedeu o MDB.\n\nEm 1980, participou de algumas invasões de terras na Zona Sul da capital\npaulista, como a que ocorreu na fazenda Itaipu, que pertencia ao\nInstituto de Administração Financeira da Previdência e Assistência\nSocial (Iapas). No ano seguinte, candidatou-se à presidência do\nSindicato dos Metalúrgicos de São Paulo, sendo derrotado pelo então\npresidente Joaquim dos Santos Andrade.\n\nJá militando no clandestino Partido Comunista do Brasil (PCdoB),\nreelegeu-se em novembro de 1982 deputado federal por São Paulo,\niniciando novo mandato em março.\n\nEm abril de 1983, Peres foi acusado de ser um dos articuladores —\njuntamente com outros dirigentes do PCdoB e do Partido dos Trabalhadores\n(PT) — de uma passeata de desempregados iniciada em Santo Amaro e que se\ntransformou em um grande protesto popular com duração de três dias,\nocasionando saques a supermercados e lojas, tanto na região de Santo\nAmaro quanto na Zona Sul e no centro da capital paulista, e\nmanifestações na frente do palácio Bandeirantes, sede do governo do\nestado. Segundo a imprensa, como resultado da manifestação, cerca de\nduzentos estabelecimentos comerciais foram saqueados, 127 pessoas foram\nferidas e houve uma morte. Como representante parlamentar do PMDB, Peres\nculpou o governo federal e “o quadro generalizante de fome” pelos\nincidentes, mas também a “ala trotskista do PT e a direita, que se\nincorporaram a um movimento espontâneo de revolta para desestabilizar o\ngoverno estadual peemedebista de Franco Montoro”. Em julho seguinte, foi\nacusado, junto com outros parlamentares, de incitar uma invasão de terra\nem São José dos Campos (SP).\n\nEm 25 de abril de 1984, Peres votou a favor da emenda Dante de Oliveira,\nque propunha o restabelecimento das eleições diretas para presidente da\nRepública em novembro daquele ano. Como a emenda não obteve o número de\nvotos indispensáveis à sua aprovação — faltaram 22 para que o projeto\npudesse ser encaminhado à apreciação do Senado — no Colégio Eleitoral,\nreunido em 15 de janeiro de 1985, Aurélio Peres votou no candidato\noposicionista Tancredo Neves, eleito novo presidente da República pela\nAliança Democrática, uma união do PMDB com a dissidência do Partido\nDemocrático Social (PDS) abrigada na Frente Liberal. Contudo, por motivo\nde doença, Tancredo Neves não chegou a ser empossado na presidência,\nvindo a falecer em 21 de abril de 1985. Seu substituto no cargo foi o\nvice-presidente José Sarney, que já vinha exercendo a presidência\ninterinamente desde 15 de março desse ano.\n\nCom o retorno à legalidade do PCdoB em julho de 1985, Aurélio Peres\nfiliou-se a essa agremiação. Em maio do ano seguinte, integrou a missão\nparlamentar que participou da Primeira Assembléia Internacional pela\nDemocracia no Chile, sob forte pressão do regime do general Augusto\nPinochet.\n\nEm novembro de 1986 tentou reeleger-se deputado federal mas não foi\nbem-sucedido. Encerrou o mandato em janeiro de 1987, retornando para sua\nprofissão de metalúrgico na Caloi, onde permaneceu por apenas cinco\nmeses.\n\nJá afastado do PCdoB e da vida pública, em agosto desse ano começou a\ntrabalhar na estatal paulista de energia elétrica Eletropaulo, como\nfiscal de terras (patrimônio imobiliário), permanecendo nessa empresa\naté 1995, quando se aposentou.\n\nNo dia 11 de setembro de 2009 foi anistiado e indenizado pelo governo\nbrasileiro em função das torturas sofridas durante o regime militar.\n\nCasou-se com Maria da Conceição Peres, com quem teve dois filhos.\n\nMarcelo Costa\n\nFONTES: CÂM. DEP. *Deputados brasileiros. Repertório*(1983-1987);\n*Estado de S. Paulo* (20/11/86); *Folha de S. Paulo* (15/7/83); INF.\nBIOG.;*Jornal do Brasil* (21/11 e 23/12/78, 18/10/80, 30/5/81, 8/4/83 e\n1/9/85);**Portal do Ministério da Justiça – *Comissão de Anistia*;\n*Veja* (13/4/83, 18/7/84 e 28/5/86).\n\n \n","ref":"FONTES: CÂM. DEP. *Deputados brasileiros. Repertório*(1983-1987);\n*Estado de S. Paulo* (20/11/86); *Folha de S. Paulo* (15/7/83); INF.\nBIOG.;*Jornal do Brasil* (21/11 e 23/12/78, 18/10/80, 30/5/81, 8/4/83 e\n1/9/85);**Portal do Ministério da Justiça – *Comissão de Anistia*;\n*Veja* (13/4/83, 18/7/84 e 28/5/86).\n\n \n","dic":"DHBB"}
