{"title":"PERES, Gérson","cargoss":["Deputado federal","Deputado federal","Constituinte"],"cargos_esp":[0,0,0],"datas_ini":[2007,1983,1987],"datas_fim":[0,2003,1988],"estados":["PA","PA",0],"autor":["Gustavo Lopes"],"content":"**PERES, Gérson**\n\n\\*dep. fed. PA 1983-2003, 2007-; const. 1987-1988.\n\n*Gérson dos Santos Peres* nasceu em Cametá (PA) no dia 2 de maio de\n1931, filho de Romeu Duarte Peres e Joana dos Santos Peres.\n\nFormou-se em direito pela Universidade Federal do Pará, em Belém.\nIniciou sua vida política como militante do movimento estudantil.\n\nEm outubro de 1958 elegeu-se deputado estadual pelo Pará, na legenda do\nPartido Trabalhista Brasileiro (PTB). Trocou de partido no terceiro ano\nde mandato, indo para a União Democrática Nacional (UDN). Reelegeu-se\ndeputado estadual em outubro de 1962 e foi líder da UDN na Assembléia em\n1963 e 1964. Com a extinção dos partidos políticos e a instauração do\nbipartidarismo pelo Ato Institucional nº 2 (27/10/1965), optou por\nfiliar-se à Aliança Renovadora Nacional (Arena), partido de apoio ao\nregime militar instaurado no país em abril de 1964 e do qual se tornou\nlíder na Assembléia Legislativa.\n\nNas eleições de novembro de 1966 garantiu seu terceiro mandato\nconsecutivo como deputado estadual e permaneceu como líder arenista na\nAssembléia. Reelegeu-se em novembro de 1970 e novembro de 1974, sempre\npela Arena. Nas eleições indiretas de novembro de 1978 foi eleito\nvice-governador do Pará, em chapa encabeçada por Alacid Nunes. Sua\natuação na Arena lhe valeu o cargo de presidente do partido.\n\nCom o fim do bipartidarismo em novembro de 1979, filiou-se ao Partido\nDemocrático Social (PDS) e elegeu-se deputado federal pelo Pará em\nnovembro de 1982, assumindo o mandato em fevereiro de 1983 e\nintegrando-se à Comissão de Constituição e Justiça e à Comissão Especial\nde Reforma Agrária.\n\nEm 25 de abril de 1984 não compareceu à votação da emenda Dante de\nOliveira, que, apresentada na Câmara dos Deputados, propunha o\nrestabelecimento das eleições diretas para presidente da República no\nnovembro seguinte. Como a emenda não obteve o número de votos\nindispensáveis à sua aprovação — faltaram 22 para que o projeto pudesse\nser encaminhado à apreciação do Senado — no Colégio Eleitoral, reunido\nem 15 de janeiro de 1985, Peres votou no candidato do regime militar,\nPaulo Maluf, que acabou derrotado pelo oposicionista Tancredo Neves,\neleito novo presidente da República pela Aliança Democrática, uma união\ndo Partido do Movimento Democrático Brasileiro (PMDB) com a dissidência\ndo PDS abrigada na Frente Liberal. Tancredo Neves, contudo, morreu antes\nde ser empossado na presidência, em 21 de abril de 1985. Foi substituído\npelo vice, José Sarney, que já vinha exercendo o cargo interinamente\ndesde 15 de março.\n\nAinda em 1985, Peres tornou-se presidente do PDS do Pará — cargo que\nocuparia por dois anos — e ingressou na Comissão Parlamentar de\nInquérito sobre política mineral, na qual atuou até 1987. Em novembro de\n1986 elegeu-se deputado federal constituinte pelo Pará. Em 1º de\nfevereiro do ano seguinte assumiu sua cadeira na Assembléia Nacional\nConstituinte, participando da Comissão de Sistematização e, como\nsuplente, da Subcomissão dos Estados (da Comissão da Organização do\nEstado). Nas principais votações da Constituinte foi a favor do mandado\nde segurança coletivo, do aviso prévio proporcional, da unicidade\nsindical, da soberania popular, do voto aos 16 anos, do mandato de cinco\nanos para o presidente José Sarney, da anistia aos micro e pequenos\nempresários, das férias com 1/3 a mais de salário e da legalização do\njogo do bicho.\n\nVotou contra o rompimento das relações diplomáticas com países com\npolítica de discriminação racial, a pena de morte, a limitação do\ndireito de propriedade privada, a remuneração 50% superior para o\ntrabalho extra, a jornada semanal de 40 horas, o turno ininterrupto de\nseis horas, o presidencialismo, a estatização do sistema financeiro, a\nlimitação dos juros reais em 12% ao ano, a criação de um fundo de apoio\nà reforma agrária e a nacionalização do subsolo.\n\nCom a promulgação da nova Carta Constitucional, em 5 de outubro de 1988,\nvoltou a participar dos trabalhos legislativos ordinários, sendo membro\ntitular das comissões de Ciência e Tecnologia, Comunicação e\nInformática, de Constituição e Justiça e de Redação. Em 1989 assumiu a\nvice-liderança do PDS na Câmara.\n\nEm outubro de 1990 reelegeu-se novamente, na legenda do PDS. Empossado\nem fevereiro seguinte, deu continuidade a seus trabalhos na Comissão de\nConstituição e Justiça e de Redação, na qual atuou até 1994. Durante\nessa legislatura ocupou os postos de vice-líder do PDS na Câmara, nos\nanos de 1991 e 1993, e de primeiro-vice-líder, entre 1991 e 1992. Em 29\nde setembro deste último ano, quando exerceu a vice-presidência do\npartido, votou a favor do *impeachment* do presidente da República\nFernando Collor de Melo, acusado de crime de responsabilidade por\nligações com um esquema de corrupção liderado pelo ex-tesoureiro de sua\ncampanha presidencial, Paulo César Farias. Collor foi afastado da\npresidência logo após a votação na Câmara e renunciou ao mandato em 29\nde dezembro de 1992, pouco antes da conclusão do processo pelo Senado.\nCom a renúncia, foi efetivado na presidência o vice Itamar Franco, que\njá vinha exercendo o cargo interinamente desde 2 de outubro.\n\nCom a criação, em abril de 1993, do Partido Progressista Reformador\n(PPR) — resultado da fusão do PDS com o Partido Democrata Cristão (PDC)\n— passou a integrar os quadros da nova agremiação, assumindo a\nvice-liderança (em 1993) e a liderança do partido na Câmara (em\n1993-1994). Foi contrário à criação do Fundo Social de Emergência, que\npermitia ao governo retirar recursos de áreas como saúde e educação para\nter maior liberdade na administração das verbas, e ao fim do voto\nobrigatório. Ausentou-se à votação da emenda que propunha a criação do\nImposto Provisório sobre Movimentação Financeira (IPMF) — imposto de\n0,25% sobre transações bancárias.\n\nEm outubro de 1994 conquistou seu quarto mandato consecutivo como\ndeputado federal pelo Pará, desta vez na legenda do PPR. Empossado em\nfevereiro de 1995, logo no início do seu mandato votou contra a extinção\ndo Instituto de Previdência dos Congressistas (IPC). Foi vice-líder do\nPPR e membro da Comissão de Constituição e Justiça. Durante a votação\ndas emendas à Constituição encaminhadas pelo presidente Fernando\nHenrique Cardoso, a serem regulamentadas por lei, foi favorável ao fim\ndo monopólio estatal das telecomunicações, da Petrobras na exploração do\npetróleo e dos governos estaduais na distribuição de gás canalizado; à\npermissão para as embarcações estrangeiras operarem no transporte de\ncargas e passageiros entre portos do país; e ao fim das diferenciações\nlegais entre empresas nacionais e estrangeiras.\n\nEm agosto de 1995, em função da fusão do PPR com o Partido Progressista\n(PP), filiou-se ao Partido Progressista Brasileiro (PPB), do qual se\ntornou vice-líder.\n\nEm junho de 1996 votou contra a criação da Contribuição Provisória sobre\nMovimentação Financeira (CPMF), que substituiu o Imposto Provisório\nsobre Movimentação Financeira (IPMF). No mesmo ano, foi vice-líder do\nbloco PPB-PL.\n\nEm janeiro/fevereiro de 1997, votou a favor da emenda da reeleição para\npresidente, governadores e prefeitos. Em novembro seguinte,\npronunciou-se contrário à quebra da estabilidade do servidor público,\nitem da reforma administrativa.\n\nFoi reeleito em outubro de 1998, na legenda do PPB. Em novembro votou a\nfavor do teto de 1.200 reais para aposentadorias no setor público e do\nestabelecimento de idade mínima e tempo de contribuição para o setor\nprivado, itens que definiram a reforma da previdência. Iniciou novo\nmandato em fevereiro de 1999.\n\nNas eleições de outubro de 2002, candidatou-se a uma vaga no Senado\nFederal pelo estado do Pará, na legenda do PPB, mas não logrou êxito,\napesar de obter mais de 863 mil votos, sendo superado por Duciomar\nCosta, do Partido Social Democrático (PSD), e Ana Júlia, do Partido dos\nTrabalhadores (PT).\n\nDeixou a Câmara dos Deputados após o fim do seu mandato, em fevereiro de\n2003, e sem eguida passou a exercer, até março de 2006, o cargo de\nsecretário especial de estado de Promoção Social, no Pará, na gestão de\nSimão Jatene (2003-2007).\n\nNo pleito de 2006, Peres elegeu-se, novamente, deputado federal pelo\nestado do Pará, na legenda do Partido Progressista (PP), e tomou posse\ndo cargo em fevereiro de 2007. Neste mandato, foi titular das Comissões\nPermanentes de Constituição e Justiça e de Cidadania; e de Reforma\nPolítica; e das Comissões Especiais destinadas a regulamentar a edição\nde medidas provisórias, e a apreciar o projeto de Reforma Tributária.\n\nDurante sua trajetória político-profissional, participou na Itália de\ncurso de planificação e formação profissional, oferecido pela\nOrganização Internacional do Trabalho (OIT) e pela Organização das\nNações Unidas (ONU). Foi diretor regional do Pará do Serviço Nacional de\nAprendizagem Industrial (Senai), além de empresário do setor de\ncomunicações. Atuou também como jornalista nos periódicos paraenses *O\nLiberal*e *A província do Pará*\n\nCasou-se com Gracinda Dias Peres, com quem teve três filhos.\n\nEscreveu os seguintes livros: *Arena que somos, partido que\nseremos*;*Vitória de todos nós*;*Uma luta sem promessa*;*Hidrelétrica de\nTucuruí e eclusas agora*; *Os Camutás* e*Os últimos açaizeiros*.\n\nGustavo Lopes\n\nFONTES: *Boletim DIAP*, VIII (98); CÂM. DEP. *Deputados b**rasileiros.\nRepertório*(1995-1999); CÂM. DEP. *Perfil dos deputados.*(Disponível em:\n[http://www.camara.gov.br/internet/deputado/Dep\\_Detalhe.asp?id=526177](http://www.camara.gov.br/internet/deputado/Dep_Detalhe.asp?id=526177);\nacessado em: 6/10/2009); COELHO, J. & OLIVEIRA, A. *Nova*; CURRIC.\nBIOG.; *Folha de S.* *Paulo*(18/9/94, 14/1/96 e 29/9/98); *Perfil\nparlamentar/IstoÉ*.\n\n \n","ref":"FONTES: *Boletim DIAP*, VIII (98); CÂM. DEP. *Deputados b**rasileiros.\nRepertório*(1995-1999); CÂM. DEP. *Perfil dos deputados.*(Disponível em:\n[http://www.camara.gov.br/internet/deputado/Dep\\_Detalhe.asp?id=526177](http://www.camara.gov.br/internet/deputado/Dep_Detalhe.asp?id=526177);\nacessado em: 6/10/2009); COELHO, J. & OLIVEIRA, A. *Nova*; CURRIC.\nBIOG.; *Folha de S.* *Paulo*(18/9/94, 14/1/96 e 29/9/98); *Perfil\nparlamentar/IstoÉ*.\n\n \n","dic":"DHBB"}
