{"title":"PERES, Leopoldo","cargoss":["Constituinte","Deputado federal"],"cargos_esp":[0,0],"datas_ini":[1946,1946],"datas_fim":[1946,1948],"estados":[0,"AM"],"autor":[0],"content":"**PERES, Leopoldo**\n\n\\*const. 1946; dep. fed. AM 1946-1948.\n\n \n\n*Leopoldo Carpinteiro Peres* nasceu no engenho Pirapama, no município do\nCabo (PE), no dia 9 de agosto de 1901, filho de Manuel Carpinteiro Peres\ne de Maria da Paz de Gusmão Carpinteiro Peres.\n\nAos seis anos de idade transferiu-se com a família para Manaus, onde,\napós cursar o primário e o secundário, bacharelou-se pela Faculdade de\nDireito do Amazonas em 1922. Depois de formado, lecionou português e\nliteratura no Ginásio Amazonense e no Colégio Dom Bosco, na capital\namazonense.\n\nEm outubro de 1934 — após a Revolução de 1930 que levou Getúlio Vargas\nao poder — elegeu-se deputado à Assembléia Constituinte do Amazonas.\nEmpossado no início de 1935, com a promulgação da nova Constituição\nestadual em maio daquele ano, passou a exercer mandato ordinário até\nnovembro de 1937, quando, com a instauração do Estado Novo (1937-1945),\nos órgãos legislativos do país foram suprimidos. Posteriormente, foi\npresidente do Conselho Administrativo do estado do Amazonas. Durante\nesse período, foi ainda promotor de Justiça em Manaus e professor\ncatedrático de direito constitucional da Faculdade de Direito do\nAmazonas.\n\nNo pleito de dezembro de 1945 elegeu-se deputado pelo Amazonas à\nAssembléia Nacional Constituinte na legenda do Partido Social\nDemocrático (PSD). Assumindo a cadeira em fevereiro do ano seguinte,\nparticipou dos trabalhos constituintes e, com a promulgação da nova\nCarta (18/9/1946), passou a exercer o mandato ordinário. Durante a\nlegislatura integrou a Comissão Permanente de Constituição e Justiça e a\nComissão de Emendas à Constituição, além de ter presidido a Comissão de\nValorização da Amazônia. Na Câmara, defendeu a recuperação econômica da\nAmazônia e a indenização aos estados do Amazonas e do Pará pela criação\ndos territórios do Acre, em 1909, e de Guaporé (atual estado de\nRondônia), do Amapá e do Rio Branco (atual estado de Roraima), em 1943.\nAlém disso, foi o responsável pelo artigo 199 da Constituição, que criou\no Plano de Valorização da Amazônia.\n\nFoi ainda fundador e presidente da Associação Amazonense de Imprensa,\nsócio da Associação Brasileira de Imprensa (ABI) e secretário da\nAcademia Amazonense de Letras.\n\nFaleceu no****Rio de Janeiro, então Distrito Federal, quando relatava um\nprojeto na Comissão de Justiça da Câmara, no dia 26 de novembro de 1948.\n\nFoi casado com Lastênia de Vasconcelos Peres, como quem teve seis\nfilhos. Seu sobrinho, Leopoldo Peres Sobrinho foi deputado federal pelo\nAmazonas de 1963 a 1975.\n\nAlém de ter colaborado em jornais e revistas de Manaus e****do Rio de\nJaneiro, publicou Política e espírito do regime, União sagrada pelo\nBrasil e Getúlio Vargas: o homem e o chefe.\n\n \n\nFONTES: CÂM. DEP. *Deputados*; CÂM. DEP. *Relação dos dep*.; *Diário do\nCongresso* *Nacional*; FRANCO, A. *Escalada*; ROQUE, C. *Grande*.\n\n \n","ref":"FONTES: CÂM. DEP. *Deputados*; CÂM. DEP. *Relação dos dep*.; *Diário do\nCongresso* *Nacional*; FRANCO, A. *Escalada*; ROQUE, C. *Grande*.\n\n \n","dic":"DHBB"}
