{"title":"PINA, Geraldo de","cargoss":["Deputado federal","Deputado federal"],"cargos_esp":[0,0],"datas_ini":[1968,1963],"datas_fim":[1968,1967],"estados":["GO","GO"],"autor":[0],"content":"**PINA, Geraldo de**\n\n\\*dep. fed. GO 1963-1967 e 1968.\n\n \n\n*Geraldo d’Abadia de Pina*nasceu em Pirenópolis (GO) no dia 8 de maio de\n1925, filho de Luís d’Abadia de Pina e de Inácia Lopes de Pina.\n\nFazendeiro e engenheiro civil formado pela Universidade do Brasil, atual\nUniversidade Federal do Rio de Janeiro, em seu estado foi presidente das\nCentrais Elétricas de Goiás (Celg), diretor do Departamento de Estradas\nde Rodagem e secretário de Viação e Obras Públicas. Foi ainda\nengenheiro-chefe da Prefeitura do Distrito Federal, no Rio de Janeiro, e\ntrabalhou na construção de Brasília.\n\nNo pleito de outubro de 1962 elegeu-se deputado federal por Goiás na\nlegenda do Partido Social Democrático (PSD), assumindo o mandato em\nfevereiro do ano seguinte. Nessa legislatura integrou a Comissão de\nTransportes da Câmara dos Deputados. Com a extinção dos partidos\npolíticos pelo Ato Institucional nº 2 (27/10/1965) e a posterior\ninstauração do bipartidarismo, filiou-se à Aliança Renovadora Nacional\n(Arena), partido de apoio ao regime militar instaurado no país após a\ndeposição do presidente João Goulart, em 31 de março de 1964. Na legenda\nda Arena, elegeu-se suplente de deputado federal no pleito de novembro\nde 1966. Em janeiro de 1967 deixou a Câmara, voltando a ocupar uma\ncadeira no Legislativo federal de abril a agosto de 1968.\n\nRetirando-se da vida pública, passou a dedicar-se às atividades de sua\nconstrutora em Brasília, tendo sido responsável pela elaboração do plano\ndiretor de Anápolis (GO), cidade onde veio a falecer, vitimado por um\nenfarte, no dia 23 de julho de 1988.\n\nGeraldo de Pina era casado com Mariana Cabral de Pina e não teve filhos.\n\n \n\nFONTES: CÂM. DEP. *Deputados*; CÂM. DEP. *Deputados brasileiros.\nRepertório* (6); INF. Antônio de Pina; TRIB. SUP. ELEIT. *Dados* (6 e\n8).\n\n \n","ref":"FONTES: CÂM. DEP. *Deputados*; CÂM. DEP. *Deputados brasileiros.\nRepertório* (6); INF. Antônio de Pina; TRIB. SUP. ELEIT. *Dados* (6 e\n8).\n\n \n","dic":"DHBB"}
