{"title":"PINGARILHO, José Luís","cargoss":["Deputado federal"],"cargos_esp":[0],"datas_ini":[1935],"datas_fim":[1937],"estados":["PA"],"autor":[0],"content":"**PINGARILHO, José Luís**\n\n\\*dep. fed. PA 1935-1937.\n\n \n\n*José Luís da Silva Pingarilho* nasceu em Belém no dia 28 de novembro de\n1878, filho de Luís da Silva Pingarilho e de Virgínia da Silva\nPingarilho.\n\nCursou o Liceu Paraense e a Escola Militar.\n\nComerciante até 1929, foi um dos líderes da Revolução de 1930 em seu\nestado. Em dezembro de 1931, participou da fundação do Partido Liberal\n(PL) do Pará, liderado pelo interventor federal, major Joaquim de\nMagalhães Barata, tornando-se membro do primeiro diretório do partido.\n\nDiretor da Recebedoria de Rendas do Pará e oficial da Prefeitura\nMunicipal de Belém, elegeu-se em outubro de 1934 deputado federal por\nseu estado na legenda do PL, assumindo o mandato em maio do ano\nseguinte. Ainda em 1935, devido às violências cometidas contra o\ndeputado Genaro Ponte e Sousa, rompeu com a ala do Partido Liberal\nliderada por Magalhães Barata. Permaneceu na Câmara até novembro de\n1937, quando o advento do Estado Novo suprimiu todos os órgãos\nlegislativos do país.\n\nFoi membro do Conselho Administrativo do Pará e diretor da Fazenda\nMunicipal.\n\nFaleceu no dia 22 de agosto de 1956.\n\nEra casado com Maria de Nazaré Cardoso Pingarilho, de quem teve seis\nfilhos.\n\n \n\n \n\nFONTES: Boletim. Min. Trab. (5/36); CÂM. DEP. Deputados; CRUZ, E.\nHistória do Pará; Diário do Congresso Nacional; Personalidades; ROQUE,\nC. Grande.\n\n \n","ref":"FONTES: Boletim. Min. Trab. (5/36); CÂM. DEP. Deputados; CRUZ, E.\nHistória do Pará; Diário do Congresso Nacional; Personalidades; ROQUE,\nC. Grande.\n\n \n","dic":"DHBB"}
