{"title":"PINHEIRO FILHO, João","cargoss":["Revolucionário ou revoltoso","Constituinte"],"cargos_esp":[0,0],"datas_ini":[1930,1934],"datas_fim":[1930,1934],"estados":[0,0],"autor":[0],"content":"**PINHEIRO FILHO, João**\n\n\\*rev. 1930; const. 1934.\n\n \n\n*João Pinheiro da Silva Filho* nasceu em Caeté (MG), no dia 14 de\noutubro de 1902, filho de João Pinheiro da Silva e de Helena de Barros\nPinheiro. Seu pai foi um dos mais importantes líderes políticos mineiros\ndo período posterior à Proclamação da República, tendo governado Minas\nGerais em 1890 e de 1906 a 1908 e representado o estado na Câmara\nFederal de 1891 a 1893 e no Senado em 1905. Seu irmão Israel Pinheiro\nfoi constituinte de 1946, deputado federal de 1946 a 1956, prefeito de\nBrasília de 1960 a 1961 e governador de Minas Gerais de 1966 a 1971.\n\nFez os primeiros estudos em Belo Horizonte e os preparatórios no Ginásio\nMineiro, na mesma cidade. Formou-se em dezembro de 1923 pela Faculdade\nLivre de Direito de Minas Gerais.\n\nIniciando suas atividades profissionais, militou de 1923 a 1925 no foro\nda comarca de Frutal (MG). Em 1926 advogou em Barretes (SP) e no ano\nseguinte foi nomeado pelo governador de Minas Gerais, Antônio Carlos\nRibeiro de Andrada, delegado regional da Polícia Civil em Poços de\nCaldas (MG). Promovido em 1928 a delegado auxiliar, ainda nesse ano\ntornou-se prefeito comissionado de Poços de Caldas e representante do\ngoverno mineiro junto ao Instituto do Café do estado de São Paulo. No\nano seguinte viajou, a serviço do governo mineiro, à Europa e a países\ndo Oriente.\n\nPartidário da Aliança Liberal (1929-1930), participou da Revolução de\n1930, integrando o estado-maior das forças revolucionárias em Minas\nGerais. Em 1931 exonerou-se do cargo de delegado auxiliar, passando a se\ndedicar a atividades industriais na Companhia Metalúrgica Barbará,\npertencente à família de sua mulher, Marina Barbará Pinheiro. Membro do\nSindicato das Indústrias Metalúrgicas de Minas Gerais, foi indicado em\njunho de 1933 deputado à Assembléia Nacional Constituinte, na condição\nde representante dos empregadores. Empossado em novembro do mesmo ano,\nparticipou dos trabalhos constituintes e, após a promulgação da nova\nCarta (16/7/1934) e a eleição do presidente da República no dia\nseguinte, teve seu mandato estendido até maio de 1935. Ainda em 1934 foi\neleito quarto vice-presidente da Confederação das Indústrias do Brasil.\n\nAusente das atividades políticas durante o Estado Novo (1937-1945),\nintegrou de 1945 a 1946 o Conselho Nacional de Política Industrial e\nComercial. Em outubro de 1950 tornou-se membro do Conselho Nacional de\nEconomia, que presidiu interinamente de maio a outubro de 1951 e\nefetivamente dessa data a outubro de 1952, tendo colaborado na\nelaboração do seu regimento interno.\n\nComo industrial foi ainda acionista da Companhia Cerâmica João Pinheiro,\nfundada por seu pai em 1890. Dirigiu também a Empresa de Águas Lambari,\na South America Gold Areas Company, formada por capitais canadenses e\nbrasileiros e sediada em Toronto, no Canadá, a Companhia Geral de\nEmpreendimentos e a Transamerican Development Corporation, sediada em\nNova Iorque.\n\nSócio-fundador do Instituto Brasileiro de Cultura, colaborou em jornais\ne revistas, escrevendo artigos sobre temas econômicos, financeiros e\nsociológicos. Foi sócio da Associação Brasileira de Imprensa (ABI) e do\nPen Clube do Brasil.\n\nFaleceu no dia 10 de julho de 1956.\n\nDe seus quatro filhos destacou-se João Pinheiro Neto, jornalista e\nministro do Trabalho em 1962.\n\nPublicou Problemas brasileiros (1918).\n\n \n\n \n\nFONTES: CÂM. DEP. Deputados; CONF. INDUSTRIAL DO BRASIL. Relatório;\nGODINHO, V. Constituintes; HIRSCHOWICZ, E. Contemporâneos;\nPersonalidades; Rev. Cons. Nac. Econ.\n\n \n","ref":"FONTES: CÂM. DEP. Deputados; CONF. INDUSTRIAL DO BRASIL. Relatório;\nGODINHO, V. Constituintes; HIRSCHOWICZ, E. Contemporâneos;\nPersonalidades; Rev. Cons. Nac. Econ.\n\n \n","dic":"DHBB"}
