{"title":"PINHEIRO, Saramago","cargoss":["Deputado federal"],"cargos_esp":[0],"datas_ini":[1979],"datas_fim":[1987],"estados":["RJ"],"autor":[0],"content":"**PINHEIRO, Saramago**\n\n\\*dep. fed. RJ 1979-1987.\n\n*Evaldo* *Saramago* *Pinheiro* nasceu em Niterói (RJ), no dia 16 de\njulho de 1914, filho de Arnaldo Colens Pinheiro e de Palmira Saramago\nPinheiro.\n\nFez o curso secundário no Colégio Brasil, em sua cidade, e o superior no\nRio de Janeiro, então Distrito Federal, na Faculdade de Direito do\nCatete, atual faculdade de Direito da Universidade do Estado do Rio de\nJaneiro, onde se formou em 1935. Advogado em Itaguaí (RJ) e em Itaboraí\n(RJ), tornou-se conhecido como defensor dos lavradores pobres. Concluiu\na licenciatura em línguas neolatinas em 1940, na Faculdade Nacional de\nFilosofia, hoje faculdade de Letras da Universidade Federal do Rio de\nJaneiro (UFRJ). Em 1944 representou o Brasil na III Conferência\nInteramericana de Advogados realizada no México.\n\nFundador da União Democrática Nacional (UDN) no município de Itaboraí,\nem 1945, e líder do partido em Saquarema (RJ), no pleito de outubro de\n1947 elegeu-se deputado estadual pelo Rio de Janeiro. Empossado em\nfevereiro de 1948, deu início a uma carreira na Assembléia Legislativa\nque se prolongou até 1962.\n\nAtuou na malsucedida campanha do udenista José Eduardo do Prado Kelly ao\ngoverno do estado do Rio em 1950, vencida por Ernâni Amaral Peixoto,\ncandidato do Partido Social Democrático (PSD). Em 1958, quando a\nconvenção da UDN decidiu apoiar Roberto da Silveira, do Partido\nTrabalhista Brasileiro (PTB), à sucessão a Miguel Couto Filho\n(1955-1958), Saramago Pinheiro, então vice-presidente da UDN fluminense,\npercorreu todo o estado do Rio, tendo sido um dos artífices da vitória.\nEscolhido presidente da Assembléia Legislativa do Rio de Janeiro em\n1959, permaneceu no cargo até o ano seguinte.\n\nNo pleito de outubro de 1962 candidatou-se a vice-governador do Rio de\nJaneiro na chapa de Miguel Couto Filho, sendo derrotado por Badger da\nSilveira, do PTB.****\n\nAfastado do Legislativo de 1964 e 1966, ocupou a diretoria da Caixa\nEconômica Federal.\n\nCom a extinção dos partidos políticos pelo Ato Institucional nº 2, de 27\nde outubro de 1965, e o conseqüente estabelecimento do bipartidarismo,\nfiliou-se à Aliança Renovadora Nacional (Arena), partido de sustentação\ndo regime militar instaurado no país em abril do ano anterior. No pleito\nde****novembro de 1966 reelegeu-se deputado estadual pelo Rio de\nJaneiro. Assumindo o mandato em fevereiro de 1967, licenciou-se do cargo\nem 1968 para ocupar a Secretaria de Transportes e Comunicações no\ngoverno de Jeremias Fontes (1967-1971). Durante a gestão, implantou o\nsistema de aerobarcos no Rio de Janeiro.****Em novembro de 1970 foi mais\numa vez eleito deputado estadual na legenda da Arena.\n\nEmpossado em fevereiro de 1971, pediu nova licença, assumindo a\nSecretaria do Interior e Justiça do Rio de Janeiro no governo Raimundo\nPadilha (1971-1975), cargo que deixou em poucos meses devido a\ndesentendimentos com o chefe da Casa Civil, Mário****Griosci, retornando\nà presidência da Assembléia Legislativa até 1973.\n\nEm novembro de 1974 elegeu-se deputado estadual constituinte na legenda\nda Arena, ocupando a vice-presidência da comissão encarregada de\nelaborar o texto da Constituição do novo estado do Rio de Janeiro,\ncriado pela Lei Complementar nº 20, de 3 de junho de 1974, com a fusão\ndo antigo estado do Rio com a Guanabara.\n\nEm novembro de 1978 conquistou um mandato de deputado federal,\niniciando-o em fevereiro do ano seguinte. Com a aprovação da Lei\nOrgânica dos Partidos, em novembro de 1979, extinguindo o\nbipartidarismo, Saramago Pinheiro filiou-se ao Partido Democrático\nSocial (PDS), sucessor da Arena. Presidente da Comissão de Agricultura e\nPolítica Rural (1980) e vice-líder do governo João Figueiredo\n(1979-1985), participou ainda de uma comissão do Congresso Nacional\ncriada para verificar os efeitos dos agrotóxicos na vida da população.\n\nReeleito na legenda do PDS em novembro de 1982, na sessão de 25 de abril\nde 1984 votou contra a emenda Dante de Oliveira, que previa eleições\ndiretas para presidente da República. Derrotada a proposição — faltaram\n22 votos para que fosse levada à apreciação do Senado —, no Colégio\nEleitoral, reunido em 15 de janeiro de 1985, Saramago Pinheiro apoiou o\ncandidato oficial do governo, Paulo Maluf, derrotado pelo oposicionista\nTancredo Neves, eleito pela Aliança Democrática, uma união do PMDB com a\ndissidência do Partido Democrático Social (PDS) abrigada na Frente\nLiberal. Doente, Tancredo Neves não chegou a ser empossado, vindo a\nfalecer em 21 de abril de 1985. Seu substituto foi o vice José Sarney,\nque já vinha exercendo o cargo interinamente, desde 15 de março deste\nano.\n\nPresidente do PDS no Rio de Janeiro, em novembro de 1986 candidatou-se à\nAssembléia Nacional Constituinte, obtendo a terceira suplência. Deixou a\nCâmara ao término da legislatura, em janeiro de 1987.****\n\nFora da vida pública, mas sem desligar-se do partido, continuou no\nexercício da advocacia. Em abril de 1993, com a fusão do PDS com o\nPartido Democrata Cristão (PDC), ingressou no Partido Progressista\nReformador (PPR). Em agosto de 1995 filiou-se ao Partido Progressista\nBrasileiro (PPB), resultante da união do PPR com o Partido Progressista\n(PP).\n\nFundador da Cooperativa de Crédito Banco Agrícola de\nItaboraí,****vice-presidente da Associação Brasileira de Crédito e\nAssistência Rural, presidente da Associação de Crédito e Assistência\nRural do Rio de Janeiro, atual Empresa de Assistência Técnica e Extensão\nRural do Rio de Janeiro, diretor da Federação da Agricultura do Rio de\nJaneiro e da Confederação Nacional de Agricultura e presidente da\nFederação Fluminense das Associações Comerciais, Industriais e\nAgropastoris, presidiu ainda o Instituto de Previdência da Assembléia\nLegislativa do Rio de Janeiro e a Associação Cultural Brasil-Alemanha.\n\nEm 1999, o Núcleo de Memória Política Carioca e Fluminense, criado a\npartir de um convênio entre o Centro de Pesquisa e Documentação de\nHistória Contemporânea do Brasil (Cpdoc) e a Fundação Getulio Vargas\n(FGV), lançou o livro *Hamilton Xavier e Saramago Pinheiro:\ndepoimentos*.\n\nCasado com Maria de Lurdes Saramago Pinheiro, teve quatro filhos.\n\nGisela Moura/Márcia de Sousa\n\nFONTES: CÂM. DEP. *Deputados brasileiros. Repertório*(1979-1983);\nFERREIRA, M. M. *Hamilton Xavier*; *Jornal do Brasil* (20/11/78).\n\n \n","ref":"FONTES: CÂM. DEP. *Deputados brasileiros. Repertório*(1979-1983);\nFERREIRA, M. M. *Hamilton Xavier*; *Jornal do Brasil* (20/11/78).\n\n \n","dic":"DHBB"}
