{"title":"PINTO, Aldo","cargoss":["Deputado federal","Deputado federal","Deputado federal"],"cargos_esp":[0,0,0],"datas_ini":[1992,1991,1983],"datas_fim":[1995,1991,1987],"estados":["RS","RS","RS"],"autor":[0],"content":"**PINTO, Aldo**\n\n\\*dep. fed. RS 1983-1987, 1991 e 1992-1995.\n\n*Aldo Pinto da Silva* nasceu em Palmeira das Missões (RS) no dia 3 de\nfevereiro de 1939, filho de Aristóteles Pinto e de Otíbia Cavalheiro\nPinto.\n\nProprietário rural, ingressou na Faculdade de Agronomia da Universidade\nFederal do Rio Grande do Sul (UFRGS) em 1958, concluindo seus estudos em\n1961. Durante o período universitário, foi membro da União Estadual de\nEstudantes de seu estado.\n\nNo pleito de novembro de 1974 elegeu-se deputado estadual à Assembléia\ngaúcha pela legenda do Movimento Democrático Brasileiro (MDB), partido\nde oposição ao regime militar instaurado no país em abril de 1964.\nEmpossado em fevereiro de 1975, foi presidente e membro de várias\ncomissões especiais, vice-presidente das comissões de Agricultura e de\nPecuária e membro da Comissão Parlamentar de Inquérito (CPI) que\ninvestigou denúncias de irregularidades na Companhia Estadual de\nDesenvolvimento da Indústria e Comércio. Reeleito em novembro de 1978,\nainda pelo MDB, tornou-se membro da Comissão de Finanças e Planejamento.\n\nApós o fim do bipartidarismo em 29 de novembro de 1979 — ano em que\npresidiu o Ciclo de Estudos sobre Problemas Brasileiros —, e a\nconseqüente reorganização partidária, filiou-se ao Partido Democrático\nTrabalhista (PDT).\n\nNessa legislatura, foi vice-líder da bancada do PDT e presidiu a mesa e\na Comissão de Obras Públicas da Assembléia Legislativa. Em 1981, fez\nvárias viagens ao exterior como representante do parlamento gaúcho.\n\nNo pleito de novembro de 1982, elegeu-se deputado federal pelo Rio\nGrande do Sul na legenda do PDT. Assumindo sua cadeira em fevereiro do\nano seguinte, foi membro das comissões de Agricultura e Política Rural e\nde Economia, Indústria e Comércio da Câmara dos Deputados.\n\nNa sessão de 25 de abril de 1984, votou a favor da emenda Dante de\nOliveira, que propunha o restabelecimento de eleições diretas para a\npresidência da República em novembro desse ano. Como a emenda não obteve\na votação necessária para ser encaminhada ao Senado, decidiu apoiar, no\nColégio Eleitoral reunido a 15 de janeiro de 1985 para escolher o novo\npresidente do país, a candidatura do ex-governador de Minas Gerais\nTancredo Neves, lançada pela Aliança Democrática, coligação do Partido\ndo Movimento Democrático Brasileiro (PMDB) — sucessor do MDB — com a\ndissidência do Partido Democrático Social (PDS) denominada Frente\nLiberal.\n\nApesar da esmagadora vitória sobre o candidato governista Paulo Maluf,\nTancredo não chegou a assumir a presidência. Gravemente enfermo, foi\nsubstituído por seu vice, José Sarney, empossado interinamente em março\nde 1985 e efetivado no cargo em 21 de abril seguinte, quando o\nex-governador mineiro veio a falecer.\n\nEm novembro de 1986, Aldo Pinto candidatou-se ao governo do Rio Grande\ndo Sul na coligação formada pelo PDT e PDS, sendo derrotado por Pedro\nSimon, do PMDB. Deixou a Câmara em janeiro de 1987, ao final da\nlegislatura.\n\nRetornou à cena política no pleito de outubro de 1990, quando novamente\nelegeu-se para a Câmara dos Deputados na legenda do PDT gaúcho.\nEmpossado em fevereiro de 1991, no mês seguinte licenciou-se do mandato\npara exercer o cargo de secretário estadual de Agricultura, no governo\ndo pedetista Alceu Collares (1991-1995). Retornou à Câmara por um breve\nperíodo em dezembro de 1991 e, em definitivo, em maio de 1992. Durante o\nperíodo em que esteve na secretaria gaúcha, foi substituído no\nLegislativo federal pelo suplente Jorge Uequed, do Partido da Social\nDemocracia Brasileira (PSDB).\n\nEm 29 de setembro de 1992, votou a favor da abertura de um processo de\n*impeachment* — aprovada por 441 votos — contra o presidente Fernando\nCollor de Melo, acusado de crime de responsabilidade pela CPI que\ninvestigou denúncias de corrupção contra o ex-tesoureiro de sua campanha\npresidencial, Paulo César Farias. Afastado da chefia do Executivo após a\nvotação da Câmara, Collor acabou renunciando ao mandato em 29 de\ndezembro, antes da conclusão de seu julgamento pelo Senado. Foi\nsubstituído na presidência pelo vice Itamar Franco, que vinha ocupando o\ncargo interinamente desde o dia 2 de outubro.\n\nNas votações em que tomou parte durante essa legislatura, Aldo Pinto\nmanifestou-se contra a criação do Fundo Social de Emergência (FSE), o\nfim do voto obrigatório, a revisão do conceito de empresa nacional e a\ninstituição do Imposto Provisório sobre Movimentação Financeira (IPMF),\nque, ao lado do FSE, serviu para financiar o programa de estabilização\neconômica do governo federal.\n\nNo pleito de outubro de 1994, candidatou-se ao Senado na legenda\npedetista, mas não foi bem-sucedido. Deixou a Câmara dos Deputados em\njaneiro do ano seguinte, ao fim de seu mandato.\n\nCasou-se com Carmen Regina da Silva, com quem teve dois filhos.\n\nPublicou *I Ciclo de estudos sobre problemas brasileiros* (1979).\n\nFONTES: CÂM. DEP. *Deputados brasileiros. Repertório*(1991-1995); CÂM.\nDEP. *Lista de suplentes* (1991-1995); *Folha de S. Paulo*(18/9/94);\n*Globo*(26/4/84);*Perfil parlamentar/IstoÉ*.\n\n \n","ref":"FONTES: CÂM. DEP. *Deputados brasileiros. Repertório*(1991-1995); CÂM.\nDEP. *Lista de suplentes* (1991-1995); *Folha de S. Paulo*(18/9/94);\n*Globo*(26/4/84);*Perfil parlamentar/IstoÉ*.\n\n \n","dic":"DHBB"}
