{"title":"PINTO, Ariosto","cargoss":["Deputado federal","Revolucionário ou revoltoso"],"cargos_esp":[0,0],"datas_ini":[1927,1930],"datas_fim":[1930,1930],"estados":["RS",0],"autor":[0],"content":"**PINTO, Ariosto**\n\n\\*magistrado; dep. fed. RS 1927-1930; rev. 1930.\n\n \n\n*Ariosto Pinto de Araújo Correia* nasceu em Pelotas (RS) no ano de 1888,\nfilho de Alfredo Pinto de Araújo Correia e de Frederica Pinto de Araújo\nCorreia.\n\nFez os estudos preparatórios em Porto Alegre, onde se matriculou, em\n1905, na Faculdade de Direito. Transferiu-se depois para a Faculdade de\nDireito de Recife, pela qual se formou em 1909.\n\nApós sua formatura, retornou ao Rio Grande do Sul, onde foi nomeado juiz\ndistrital do município de Pinheiro Machado em 1911. No mesmo ano, foi\ndesignado promotor público em Cachoeira do Sul, sendo transferido para\nBajé em 1912. Permaneceu na promotoria desta comarca até 1914, quando\nfoi removido para Porto Alegre.\n\nEm 1918, foi nomeado chefe de polícia da capital gaúcha, cargo do qual\nse demitiu em 1921 ao ser eleito deputado à Câmara estadual. Integrou,\njuntamente com Getúlio Vargas e José Vasconcelos Pinto, a Comissão de\nConstituição e Poderes da Câmara estadual encarregada de apurar a\ncontagem final dos votos obtidos pelos candidatos à presidência do\nestado nas eleições de novembro de 1922. Em janeiro de 1923, a comissão\nproclamou a vitória de Antônio Augusto Borges de Medeiros para cumprir\nseu quinto mandato na presidência do estado, provocando a reação do\ncandidato derrotado, Joaquim Francisco de Assis Brasil, que liderou seus\nseguidores em uma rebelião contra o governo estadual, sustentando que\nhouvera fraude. Uma série de levantes ocorreu no estado, e a revolta se\nencerrou apenas em dezembro de 1923.\n\nReeleito deputado estadual em 1925, em 1927 Ariosto Pinto elegeu-se\ndeputado federal para a 13ª legislatura (1927-1929). Na Câmara Federal,\nfez parte da Comissão Legislativa e presidiu a Comissão do Código Rural.\n\nEm junho de 1929, representantes dos estados de Minas Gerais e do Rio\nGrande do Sul firmaram no Rio de Janeiro, então Distrito Federal, uma\naliança secreta, o Pacto do Hotel Glória, base da Aliança Liberal, em\nque ficaram acertados o veto de Minas à candidatura Júlio Prestes, a\ndesistência da candidatura mineira à presidência da República e a\napresentação de um candidato gaúcho, Getúlio Vargas ou Borges de\nMedeiros.\n\nApesar de se ter comprometido a não divulgar a existência do pacto, o\nlíder da bancada gaúcha na Câmara, João Neves da Fontoura, decidiu\nreunir seus liderados e comunicar-lhes o que havia sido decidido. Na\nreunião, realizada no apartamento ocupado por João Neves no mesmo Hotel\nGlória, apenas os deputados Ariosto Pinto e Sérgio de Oliveira opinaram\nfirmemente a favor do pacto. A partir de então, Ariosto Pinto passou a\ndefender na Câmara o programa da Aliança Liberal, tornando-se membro da\ncomissão executiva do movimento.\n\nEm setembro de 1929, Ariosto Pinto secretariou os trabalhos da convenção\nliberal que consagrou as candidaturas de Getúlio Vargas e João Pessoa à\npresidência e à vice-presidência da República, realizada no palácio\nTiradentes, no Rio de Janeiro. Com a intensificação da campanha\neleitoral, participou de uma série de comícios realizados em dezembro\npor deputados aliancistas às portas do palácio Tiradentes, já que os\nsituacionistas não permitiam que houvesse quorum para as sessões da\nCâmara.\n\nEm fevereiro de 1930, recebeu instruções de Osvaldo Aranha no sentido de\nintensificar a propaganda da Aliança Liberal na capital do país, onde a\ncampanha governista vinha sendo feita em grande escala. A Aliança\nLiberal, porém, encontrava-se em situação precária, e a orientação de\nOsvaldo Aranha não pôde ser seguida.\n\nApós as eleições de março, Osvaldo Aranha enviou Ariosto Pinto a Minas\nGerais como emissário junto ao presidente do estado, Antônio Carlos\nRibeiro de Andrada, para acompanhar as apurações. Durante sua\npermanência em Minas, Ariosto Pinto obteve de Antônio Carlos a garantia\nde que os mineiros continuariam a apoiar os gaúchos, apesar de só haver\ncompromisso entre os dois estados até o pleito de março. Ao final das\napurações, ocorreu a depuração dos paraibanos e a “degola” dos\nrepresentantes do Partido Republicano Mineiro. Os deputados aliancistas,\nentre eles Ariosto Pinto, denunciaram na Câmara as fraudes havidas nas\neleições.\n\nA revolução finalmente eclodiu no dia 3 de outubro, e no dia 24,\nenquanto as forças revolucionárias prosseguiam sua marcha em direção à\ncapital federal, uma junta governativa formada pelo almirante Isaías\nNoronha e pelos generais Augusto Tasso Fragoso e João de Deus Mena\nBarreto prendeu o presidente Washington Luís e assumiu o governo.\n\nNesse mesmo dia, Ariosto Pinto foi chamado ao forte de Copacabana pelo\ngeneral Mena Barreto, que o encarregou de comunicar a Getúlio Vargas que\na junta não aceitaria sua posse na qualidade de presidente eleito.\nAriosto Pinto concordou, mostrando-se favorável à formação de um governo\nprovisório. No dia 26, embarcou, juntamente com outros três emissários\nda junta, para Ponta Grossa (PR), onde se encontrava o chefe\nrevolucionário. Reunindo-se com Vargas ainda no mesmo dia, chegaram a um\nacordo e a junta acabou reconhecendo a vitória do movimento,\nsubordinando-se a ele. Na formação do primeiro gabinete revolucionário,\nAriosto Pinto foi convidado para ocupar a pasta da Justiça e Negócios\nInteriores, mas recusou, abandonando logo depois a vida\npolítico-partidária.\n\nEntre 1939 e 1954, Ariosto Pinto ocupou diversos cargos importantes na\nCaixa Econômica Federal, tendo sido presidente de seu conselho\nadministrativo de 1946 a 1954 e presidente da Caixa Econômica Federal do\nRio de Janeiro a partir de 1946.\n\nDurante vários anos, foi delegado da Federação das Associações\nComerciais do Rio Grande do Sul no Distrito Federal, tendo sido também\ndelegado da Federação Rural do Rio Grande do Sul. Era ainda membro da\nOrdem dos Advogados do Brasil.\n\nFaleceu no dia 23 de novembro de 1968.\n\nEra casado com Julieta Santayana Saibro Pinto.\n\nRegina da Luz Moreira\n\n \n\n \n\nFONTES: CONSULT. MAGALHÃES, B.; FONTOURA, J. Memórias; HIRSCHOWICZ, E.\nContemporâneos; MORAIS, A. Minas; NOGUEIRA FILHO, P. Ideais; PINTO, A.\nCaixa; SILVA, H. 1930.\n\n \n","ref":"FONTES: CONSULT. MAGALHÃES, B.; FONTOURA, J. Memórias; HIRSCHOWICZ, E.\nContemporâneos; MORAIS, A. Minas; NOGUEIRA FILHO, P. Ideais; PINTO, A.\nCaixa; SILVA, H. 1930.\n\n \n","dic":"DHBB"}
