{"title":"PINTO, Júlio de Castro","cargoss":["Deputado federal","Deputado federal"],"cargos_esp":[0,0],"datas_ini":[1960,1955],"datas_fim":[1960,1959],"estados":["MT","MT"],"autor":[0],"content":"**PINTO, Júlio de Castro**\n\n\\*magistrado; dep. fed. MT 1955-1959 e 1960.\n\n \n\n*Júlio Mário Abbott de Castro Pinto* nasceu em Campo Grande, então no\nestado de Mato Grosso e atual capital de Mato Grosso do Sul, no dia 27\nde novembro de 1914, filho de Júlio Mário de Castro Pinto e de Iná\nAbbott de Castro Pinto.\n\nBacharel pela Faculdade de Direito da Universidade do Rio de Janeiro,\nfoi promotor público da comarca de Três Lagoas (MS) entre 1937 e 1938.\nDo ano seguinte a 1940 exerceu a função de juiz de direito da comarca de\nParanaíba (MS) e de 1941 a 1942 foi tabelião em Campo Grande. Foi também\nprefeito de Alagoas (MS).\n\nDiretor-proprietário do jornal Gazeta do Comércio, de Três Lagoas, foi\neleito no pleito de outubro de 1950 deputado à Assembléia Legislativa de\nMato Grosso na legenda da União Democrática Nacional (UDN), assumindo o\nmandato em fevereiro do ano seguinte. Em outubro de 1954 foi eleito\ndeputado federal por Mato Grosso na mesma legenda, assumindo o mandato\nna Câmara em fevereiro do ano seguinte, logo após haver encerrado seu\nmandato estadual.\n\nNo pleito de outubro de 1958 foi eleito suplente de deputado federal por\nseu estado, sempre na legenda da UDN. Em janeiro de 1959 encerrou seu\nprimeiro mandato federal, reassumindo uma cadeira na Câmara dos\nDeputados no período de agosto a outubro de 1960.\n\nFaleceu em Três Lagoas (MS) no dia 31 de dezembro de 1985.\n\nEra casado com Nelly de Castro Pinto, com quem teve três filhos.\n\n \n\nFONTES: CÂM. DEP. *Deputados*; CÂM. DEP. *Deputados federais.\nInventário*; CÂM. DEP. *Relação dos dep*.; FLEISCHER, D. *Thirty*;\n*Globo* (4/1/86); *Jornal do Brasil* (6/1/86).\n\n \n","ref":"FONTES: CÂM. DEP. *Deputados*; CÂM. DEP. *Deputados federais.\nInventário*; CÂM. DEP. *Relação dos dep*.; FLEISCHER, D. *Thirty*;\n*Globo* (4/1/86); *Jornal do Brasil* (6/1/86).\n\n \n","dic":"DHBB"}
