{"title":"PINTO, Pereira  ","cargoss":["Deputado federal"],"cargos_esp":[0],"datas_ini":[1967],"datas_fim":[1969],"estados":["RJ"],"autor":[0],"content":"PINTO, Pereira  \n\n\\*dep. fed. RJ 1967-1969**.**\n\n*Antônio Carlos Pereira Pinto*nasceu em Campos (RJ) no dia 30 de agosto\nde 1927, filho de Jorge Pereira Pinto e de Alcinda Pereira Pinto.\n\nEletrotécnico, elegeu-se no pleito de outubro de 1962 deputado à\nAssembléia Legislativa do Rio de Janeiro na legenda do Partido\nTrabalhista Brasileiro (PTB), assumindo o mandato em fevereiro do ano\nseguinte. Com a extinção dos partidos políticos pelo Ato Institucional\nnº 2 (27/10/1965) e a posterior instauração do bipartidarismo, filiou-se\nao Movimento Democrático Brasileiro (MDB), partido de oposição ao regime\nmilitar instaurado no país em abril de 1964, e pelo qual candidatou-se\nem novembro de 1966 a deputado federal por seu estado, não obtendo\nêxito.\n\nParticipou da Frente Ampla, movimento político lançado oficialmente em\n28 de outubro de 1966, encabeçado por Carlos Lacerda, Juscelino\nKubitschek e João Goulart, a quem Pereira Pinto era pessoalmente ligado,\nque tinha por objetivo a luta pela plena restauração democrática no\nBrasil, por não concordar com as medidas políticas e econômicas tomadas\npelo regime militar instaurado no país em abril de 1964. Porém, em 5 de\nabril de 1968, todas as atividades da Frente Ampla (manifestações,\nreuniões, comícios, passeatas) seriam proibidas pelo então ministro da\nJustiça, Luís Antônio da Gama e Silva, que ordenaria à Polícia Federal a\ndetenção daqueles que violassem essa decisão.\n\nDeixando o Legislativo fluminense em janeiro de 1967, Pereira Pinto,\nassumiu uma cadeira na Câmara dos Deputados nos períodos de junho desse\nano a janeiro de 1968 e de março de 1968 a fevereiro de 1969, quando\nteve seu mandato cassado e seus direitos políticos suspensos pelo Ato\nInstitucional nº 5, editado em 13 de dezembro do ano anterior.\n\nEm 28 de agosto de 1979, com a decretação da Lei da Anistia, recuperou\nseus direitos políticos e, em 1981, foi um dos fundadores do Partido\nDemocrático Trabalhista (PDT), agremiação liderada nacionalmente por\nLeonel Brizola, participando da sua organização no norte do estado do\nRio de Janeiro. No ano de 1983, ocupou a Secretaria de Agricultura do\nRio de Janeiro no primeiro governo de Leonel Brizola (1983-1987), além\nde ter sido diretor-financeiro do Banco de Desenvolvimento do Estado do\nRio de Janeiro.\n\nNo pleito de novembro de 1986, concorreu a uma vaga de deputado estadual\nconstituinte pelo PDT, obtendo a primeira suplência. Em janeiro de 1989,\nassumiu no lugar de Anthony Garotinho na Assembléia Legislativa\nfluminense, empossado naquele mês na prefeitura de Campos. Reeleito\ndeputado estadual pelo PDT no pleito de outubro de 1990, iniciou o novo\nmandato em fevereiro de 1991. Deixou a Assembléia Legislativa do Rio de\nJaneiro em 31 de janeiro de 1995 ao término da legislatura, não tendo\nconcorrido à reeleição em outubro de 1994.\n\nAbandonando a carreira política, passou a exercer, a partir de 1999, o\ncargo de diretor-financeiro da Loterias do Estado do Rio de Janeiro\n(Loterj), na gestão do governador Anthony Garotinho (1999-2002).\n\nFoi casado com Sílvia Pimentel Pereira Pinto, com quem teve dois filhos.\nCasou-se em segundas núpcias com Maria Cecília Lamy.\n\nFONTES: ARQ. DEP. PESQ. JORNAL DO BRASIL; CÂM. DEP. *Deputados;* CÂM.\nDEP*. Deputados brasileiros*. *Repertório* (1967-1971); INF. BIOG.;\nTRIB. SUP. ELEIT. *Dados*(6 e 8).\n\n \n","ref":"FONTES: ARQ. DEP. PESQ. JORNAL DO BRASIL; CÂM. DEP. *Deputados;* CÂM.\nDEP*. Deputados brasileiros*. *Repertório* (1967-1971); INF. BIOG.;\nTRIB. SUP. ELEIT. *Dados*(6 e 8).\n\n \n","dic":"DHBB"}
