{"title":"PIRAGIBE, Mário","cargoss":["Deputado federal","Deputado federal"],"cargos_esp":[0,0],"datas_ini":[1950,1927],"datas_fim":[1951,1930],"estados":["DF","DF"],"autor":[0],"content":"**PIRAGIBE, Mário**\n\n\\*dep. fed. DF 1927-1930 e 1950-1951.\n\n \n\n*Mário Ferreira Piragibe* nasceu no Rio de Janeiro, então Distrito\nFederal, no dia 27 de setembro de 1883, filho de Alfredo Piragibe e de\nCândida Ferreira Piragibe. Seu irmão, o desembargador Vicente Ferreira\nPiragibe, foi presidente do Tribunal de Justiça do Distrito Federal.\n\nFormado em medicina, Mário Piragibe iniciou sua vida política em maio de\n1927, elegendo-se deputado federal. Exerceu o mandato até outubro de\n1930. No pleito de janeiro de 1947 elegeu-se suplente de deputado\nfederal, na legenda da União Democrática Nacional (UDN). Assumiu o\nmandato durante os meses de agosto de 1950 a janeiro de 1951, quando\ndeixou a Câmara, pois não conseguira se reeleger no pleito de outubro de\n1950.\n\nMário Piragibe foi ainda secretário de Finanças do governo do Distrito\nFederal.\n\nFaleceu em São Lourenço (MG) no ano de 1954.\n\nEra casado com Maria Luísa de Moura Brito Piragibe, com quem teve sete\nfilhos. Seu filho Luís Piragibe foi vereador no Rio de Janeiro. Seu neto\nMário João Piragibe Miguel candidatou-se no pleito de novembro de 1970\nmas não conseguiu se eleger deputado estadual no Rio de Janeiro pelo\nMovimento Democrático Brasileiro (MDB), partido de oposição ao regime\nmilitar instaurado no país em abril de 1964.\n\n \n\nFONTES: CÂM. DEP. *Deputados brasileiros* (1826-1976); CÂM. DEP.\n*Deputados brasileiros. Repertório* (1946-1967); INF. FAM. MÁRIO JOÃO\nPIRAGIBE.\n\n \n","ref":"FONTES: CÂM. DEP. *Deputados brasileiros* (1826-1976); CÂM. DEP.\n*Deputados brasileiros. Repertório* (1946-1967); INF. FAM. MÁRIO JOÃO\nPIRAGIBE.\n\n \n","dic":"DHBB"}
