{"title":"PITANGA, Praxedes","cargoss":["Deputado federal"],"cargos_esp":[0],"datas_ini":[1955],"datas_fim":[1959],"estados":["PB"],"autor":[0],"content":"**PITANGA, Praxedes**\n\n\\*dep. fed. PB 1955-1959.\n\n \n\n*Praxedes da Silva Pitanga* nasceu em Misericórdia, hoje Itaporanga\n(PB), no dia 3 de maio de 1900, filho de Maximiano da Silva Conserva e\nde Porfíria Ilovina Conserva. Seu nome foi uma homenagem do pai a um\namigo.\n\nEstudou no Colégio Pedro Américo, em Misericórdia, e no Liceu Paraibano,\nna capital do estado. Formou-se na Faculdade de Direito de Recife em\n1923.\n\nDurante o governo de João Pessoa (1928-1930) na Paraíba, foi deflagrada\nna cidade de Princesa (hoje Princesa Isabel) a Revolta de Princesa. O\nmovimento rebelde contra o governo estadual, em fevereiro de 1930, foi\nliderado por José Pereira Lima. Chefe político de Misericórdia, Pitanga\nlutou junto com o prefeito local contra os sublevados de Princesa,\nrepelindo os ataques à sua cidade natal.\n\nCom a vitória da Revolução de 1930, que levou Getúlio Vargas ao poder,\nJosé Américo de Almeida, então chefe revolucionário no Nordeste, nomeou\nPraxedes Pitanga, representando o Ministério Público, membro da comissão\njudiciária responsável pela apuração das responsabilidades dos\nex-rebeldes de Princesa. Terminado o inquérito, pediu exoneração da\ncomissão. O interventor federal Antenor Navarro (1930-1932) nomeou-o,\nentão, promotor público de Alagoa Grande (PB). Nessa cidade teve seu\ntrabalho dificultado, em virtude da assistência que dava aos camponeses\npobres prejudicados pelos grandes proprietários de terras, contrariando\nos interesses dos latifundiários.\n\nPediu para ser transferido para a comarca de Itabaiana (PB). Alguns\nmeses depois desentendeu-se com o juiz da comarca. Após sindicâncias do\nTribunal de Justiça do estado que lhe foram favoráveis e diante da falta\nde qualquer punição ao juiz, por interferência do secretário do\nInterior, Argemiro de Figueiredo, cunhado de um irmão do magistrado,\npediu demissão da promotoria de Itabaiana no final de 1933 e foi advogar\nna capital. No ano seguinte, Argemiro de Figueiredo assumiu o governo do\nestado e nomeou Praxedes Pitanga para a recém-criado Departamento de\nOrdem Política e Social (DOPS). No início de 1937, deixou o DOPS e foi\nnomeado pelo governador prefeito de Antenor Navarro (PB).\n\nCom a instauração do Estado Novo (10/11/1937), Argemiro de Figueiredo\npassou de governador a interventor, Pitanga foi exonerado da prefeitura\nde Antenor Navarro e nomeado prefeito de Misericórdia no dia 8 de\ndezembro do mesmo ano. Nesse período, diante da dificuldade em conseguir\nrecursos para o município, mudou o nome da cidade para Itaporanga.\nPermaneceu à frente do Executivo municipal até agosto de 1940, quando\npediu exoneração em solidariedade ao interventor, substituído por Rui\nCarneiro. Passou, então, a advogar no sertão paraibano e no Ceará.\nPosteriormente, abriu escritório de advocacia em Campina Grande.\n\nCom o fim do Estado Novo (29/10/1945) e a redemocratização do país,\nfiliou-se à União Democrática Nacional (UDN) e elegeu-se deputado\nestadual constituinte em janeiro de 1947. Em outubro de 1950, concorreu\na uma cadeira de deputado federal, mas só conseguiu uma suplência.\nDesligou-se da UDN e filiou-se ao Partido Trabalhista Brasileiro (PTB),\npelo qual elegeu-se prefeito de Itaporanga, em outubro de 1951. Durante\nsua administração, apesar das dificuldades criadas pelo governo de José\nAmérico, seu adversário político, fez grandes benfeitorias na cidade que\nmarcaram sua passagem pela prefeitura.\n\nCerto de que o PTB não alcançaria o quociente eleitoral necessário,\nretornou à UDN e nas eleições de outubro de 1954 elegeu-se\nprimeiro-suplente de deputado federal pela Paraíba. Com a eleição de\nArgemiro de Figueiredo para o Senado, Praxedes Pitanga assumiu uma\ncadeira na Câmara dos Deputados, em junho de 1955. Destacou-se no\ncombate à indústria da seca, provando, com documentos, que filhos de\nchefes políticos e apaniguados eram alistados como operários. Votou\ncontra o impeachment de Café Filho e Carlos Luz no episódio do 11 de\nnovembro, chefiado pelo então ministro da Guerra, general Henrique\nTeixeira Lott. Candidato à reeleição no pleito de outubro de 1958, pela\nColigação Nacionalista Libertadora, integrada pela UDN e o Partido\nLibertador (PL), obteve novamente uma suplência. Deixou a Câmara em 31\nde janeiro de 1959.\n\nFiliou-se novamente ao PTB e voltou a concorrer a uma cadeira de\ndeputado federal em outubro de 1962. Mais uma vez conquistou apenas uma\nsuplência e denunciou ao Tribunal Regional Eleitoral (TRE) a\ntransferência para outros candidatos de votos que lhe teriam sido dados\nem um outro município, mas a Justiça eleitoral não lhe deu ganho de\ncausa.\n\nCom a extinção dos partidos políticos pelo Ato Institucional nº 2\n(27/10/1965) e a instauração do bipartidarismo, filiou-se ao Movimento\nDemocrático Brasileiro (MDB), partido de oposição ao regime militar\ninstituído no país com o movimento político-militar de março de 1964,\nque depôs o presidente João Goulart (1961-1964). Na eleição de novembro\nde 1966, concorreu, mais uma vez, a uma cadeira na Câmara dos Deputados,\nmas foi o último colocado em sua nova legenda, tendo obtido apenas 13\nvotos.\n\nRetirou-se da política e retornou à promotoria em Itaporanga, onde\npassou dez anos, sendo depois removido para uma promotoria em Campina\nGrande (PB) e, posteriormente, para João Pessoa, onde ocupou o cargo de\nvice-procurador do estado. Aposentou-se como desembargador. A partir de\nentão passou a advogar na capital.\n\nFaleceu em João Pessoa no dia 27 de março de 1991.\n\nEra casado com Maria Regina Guedes Pereira Pitanga, com quem teve três\nfilhos.\n\nPublicou *Praxedes Pitanga: o destino, a luta, o tempo* (depoimento,\n1986).\n\nAlan Carneiro\n\n \n\nFONTES: CÂM. DEP. *Deputados*; CÂM. DEP. *Deputados brasileiros.\nRepertório*(1946-1967); INF. FAM.; PITANGA, P. *Destino*; TRIB. SUP.\nELEIT. *Dados* (3, 4, 6 e 8).\n\n \n","ref":"FONTES: CÂM. DEP. *Deputados*; CÂM. DEP. *Deputados brasileiros.\nRepertório*(1946-1967); INF. FAM.; PITANGA, P. *Destino*; TRIB. SUP.\nELEIT. *Dados* (3, 4, 6 e 8).\n\n \n","dic":"DHBB"}
