{"title":"PIZA, Vladmir de Toledo","cargoss":["Prefeito"],"cargos_esp":["São Paulo"],"datas_ini":[1956],"datas_fim":[1957],"estados":[0],"autor":[0],"content":"**PIZA, Vladmir de Toledo**\n\n\\*pref. São Paulo 1956-1957.\n\n \n\n*Vladimir de Toledo Piza* nasceu em Serra Negra (SP) no dia 25 de\ndezembro de 1905.\n\nFez seus estudos no Ginásio do Estado de São Paulo, e mais tarde,\ntransferindo-se para a capital da República, cursou a Faculdade de\nMedicina do Rio de Janeiro, pela qual se formou em 1929. De volta a seu\nestado natal, trabalhou como redator-chefe no Correio Paulistano, na\ncapital paulista.\n\nEm 1947, liderando um grupo de políticos remanescentes do antigo Partido\nRepublicano Paulista (PRP) — extinto em dezembro de 1937, logo após o\nadvento do Estado Novo passou a apoiar o então governador de São Paulo,\nAdemar de Barros, presidente do Partido Social Progressista (PSP).\n\nMédico pediatra, chegou a dirigir o Departamento de Saúde do estado e,\nem outubro de 1950, foi eleito deputado à Assembléia Legislativa\npaulista na legenda do Partido Trabalhista Brasileiro (PTB). Nessa mesma\nlegenda concorreu ao governo de São Paulo em outubro de 1954, porém,\ncontando apenas com o apoio de uma facção do PTB, que na ocasião se\nencontrava dividido em três grandes grupos, foi o último colocado no\npleito, com 79.383 votos. Os outros grupos do PTB apoiaram\nrespectivamente Jânio Quadros e Francisco Prestes Maia que, assim como\nAdemar de Barros, também disputaram a chefia do governo de São Paulo.\nCom a eleição de Jânio para governador e de José Porfírio da Paz para\nvice-governador, os cargos de prefeito e de vice-prefeito de São Paulo\nficaram vagos. Em 1955 realizaram-se eleições suplementares para\npreenchê-los, dando a vitória ao senador Juvenal Lino de Matos, que teve\ncomo vice-prefeito Toledo Piza. Em abril de 1956, quando Lino de Matos\nrenunciou à prefeitura para assumir o mandato de senador, Toledo Piza o\nsubstituiu na chefia do Executivo municipal.\n\nRealizando uma administração bastante agitada, Toledo Piza sofreu severa\noposição na Câmara Municipal e foi alvo de críticas contundentes de seus\npróprios correligionários, que o ameaçavam inclusive de expulsão do PTB.\nFoi acusado de “agente de desordem social” quando, discordando de um\nprojeto de autoria do vereador Marcos Málaga para diminuir os preços das\npassagens nos veículos da Companhia Municipal de Transportes Coletivos\n(CMTC), ameaçou reduzir os salários dos funcionários da empresa caso o\nprojeto fosse aprovado. Por outro lado, visando planejar o crescimento\ncoordenado e disciplinado da Grande São Paulo, contratou o dominicano\nfrancês Joseph Lebret para fazer uma pesquisa sobre a cidade, que\nresultou no primeiro plano que tratou os problemas de São Paulo de\nmaneira global, antevendo a formação da área metropolitana. Além disso,\nconcluiu as obras de várias pontes e viadutos, instituiu a\nmunicipalidade do ensino primário, mas se indispôs com a classe\nestudantil ao reprimir as passeatas realizadas durante sua gestão,\nencerrada afinal em abril de 1957.\n\nEm março de 1958, foi condenado pelo Tribunal Especial de Imprensa a\noito meses de prisão com sursis por dois anos no processo de calúnia\nmovido pelo então governador de São Paulo, Jânio Quadros, em virtude das\ndeclarações que prestara a um matutino paulista em março do ano anterior\nafirmando que Jânio chefiava “um dos mais corruptos e torpes sistemas\npolíticos que já existiram no país”. Seu advogado recorreu da sentença\njunto ao Tribunal de Alçada, alegando que o conteúdo da entrevista fora\nadulterado pela imprensa. Em agosto de 1960 retornou à Secretaria de\nSaúde de São Paulo, afastando-se da vida política.\n\nEm maio de 1962, o juiz da comarca de Bebedouro (SP) solicitou ao\nMinistério Público que apurasse a responsabilidade de Toledo Piza nas\nacusações que lhe fazia o médico Antônio Honório, de ter vendido\nfraudulentamente, através de sua empresa, Holding S.A., terrenos\nsituados na praia de Albardão, no Rio Grande do Sul, com a promessa de\nconstruir um grande balneário. A questão se tornou conhecida como o\n“conto do balneário”.\n\nFaleceu em São Paulo no dia 17 de outubro de 1999.\n\nEra casado com Estela de Toledo Piza, com quem teve três filhos.\n\nPublicou *O livro das mãezinhas* (1937, 3ª ed. 1940), *Depoimento*\n(1976), sobre sua administração à frente da prefeitura de São Paulo, *O\ndinheiro do Brasil* (1980), e *Por quem morreu Getúlio Vargas* (1998).\n\n \n\nFONTES: *Correio Paulistano* (18/3/58); *Encic. Mirador*; *Estado de S.\nPaulo* (9/5/69); *Jornal da Tarde* (25/1/79); LEITE, A. *História*;\nMELO, I. *Dic*.; TRIB. SUP. ELEIT. *Dados* (2); *Última Hora* (22/6/60).\n\n \n","ref":"FONTES: *Correio Paulistano* (18/3/58); *Encic. Mirador*; *Estado de S.\nPaulo* (9/5/69); *Jornal da Tarde* (25/1/79); LEITE, A. *História*;\nMELO, I. *Dic*.; TRIB. SUP. ELEIT. *Dados* (2); *Última Hora* (22/6/60).\n\n \n","dic":"DHBB"}
