{"title":"AZEVEDO, Mílton Pereira de","cargoss":["Revolucionário ou revoltoso","Interventor"],"cargos_esp":[0,0],"datas_ini":[1930,1941],"datas_fim":[1930,1942],"estados":[0,"SE"],"autor":[0],"content":"**AZEVEDO, Mílton Pereira de**\n\n\\*militar; rev. 1930; interv. SE 1941-1942.\n\n \n\n*Mílton Pereira de Azevedo* nasceu em Aquidabã (SE) no dia 25 de março\nde 1907, filho de José Pereira de Oliveira.\n\nSentou praça em março de 1925, ingressando na Escola Militar do\nRealengo, no Rio de Janeiro, então Distrito Federal, de onde saiu\naspirante em janeiro de 1929. Passando a servir no 19º Batalhão de\nCaçadores (19º BC) da 6ª Região Militar (6ª RM) sediada na Bahia, em\njulho de 1929 foi promovido a segundo-tenente. No mês seguinte foi\nnomeado membro da Comissão Examinadora de Tiros de Guerra no interior da\nBahia. Transferido para o 28º BC, em Aracaju, ainda em dezembro de 1929,\nem agosto do ano seguinte assumiu o comando da Companhia de\nMetralhadoras Mistas.\n\nParticipou da Revolução de outubro de 1930, comissionado no posto de\ntenente-coronel pelas forças revolucionárias do norte do Brasil. Durante\no governo do interventor Augusto Maynard Gomes (1930-1935), tomou parte\nna perseguição no interior de Sergipe ao grupo de cangaceiros liderados\npor Lampião. Nesse período foi promovido a primeiro-tenente em fevereiro\nde 1931. Em janeiro do ano seguinte tornou-se ajudante do estado-maior\ndo 28º BC. Com a eclosão da Revolução Constitucionalista em São Paulo,\nno mês de julho de 1932, embarcou com seu batalhão para Barra Mansa\n(RJ), onde se incorporou às forças legalistas, comandadas pelo general\nPedro Aurélio de Góis Monteiro. As tropas revolucionárias foram\nderrotadas em outubro de 1932.\n\nDe volta a seu estado, em julho de 1933 ocupou a função de ajudante do\n28º BC e em fevereiro do ano seguinte assumiu o comando da 3ª Companhia\ndo batalhão. Nomeado instrutor de infantaria da Escola Militar do\nRealengo em julho de 1934, matriculou-se na Escola Militar do Rio de\nJaneiro em agosto desse mesmo ano. Promovido a capitão ainda em outubro\nde 1934, retornou ao 28º BC como comandante da 1ª Companhia em fevereiro\nde 1935. Em dezembro desse ano teve sua transferência solicitada ao\npresidente Getúlio Vargas pelo interventor de Sergipe Erônides de\nCarvalho, sob alegação de não ser elemento de confiança do governo. O\npedido, contudo, não foi atendido e Mílton Pereira de Azevedo foi lotado\nem fevereiro do ano seguinte no Estado-maior do batalhão. Em maio de\n1939, já após a instauração do Estado Novo (10/11/1937), foi novamente\nnomeado instrutor de infantaria da Escola Militar e em junho passou a\nauxiliar de comandante do corpo de cadetes.\n\nEm fevereiro de 1940 matriculou-se na Escola de Armas e em outubro desse\nmesmo ano foi nomeado adjunto de direção de manobras do Curso de\nInfantaria. Em dezembro seguinte, estando à disposição do Ministério da\nJustiça e Negócios Interiores, ocupou a função de instrutor da Polícia\nMilitar do Rio de Janeiro.\n\nNomeado interventor federal em Sergipe, sucedeu a Erônides de Carvalho\nem julho de 1941. Permaneceu no cargo até março de 1942, quando foi\nsubstituído por Augusto Maynard Gomes. Foi promovido a major em dezembro\ndo ano seguinte e a tenente-coronel em setembro de 1950. Em setembro de\n1952 passou para o quadro suplementar geral e de abril a outubro do ano\nseguinte foi adido à Diretoria Geral de Pessoal. Nesse período, foi\nincurso no artigo 237 do Código Penal Militar, referente ao\nfavorecimento, por parte de comandantes, da prática de atos contra a\nadministração militar, respondeu a um processo-crime como\nco-participante das atividades subversivas ocorridas na 6ª RM. Retornou\ncomo adido do 28º BC da 6ª RM em outubro de 1953. Em março do ano\nseguinte foi nomeado chefe de uma sessão da Divisão de Mobilização da\nDiretoria Geral de Engenharia do Distrito Federal.\n\nEm março de 1955, foi promovido a coronel e, em julho desse mesmo ano,\ntransferiu-se para o Quartel-General da 6ª RM, até que em maio do ano\nseguinte foi nomeado chefe do Estado-maior dessa RM. Chefe de gabinete\nda Diretoria de Instrução do Exército do Distrito Federal em dezembro de\n1957, a partir de novembro do ano seguinte integrou também a Diretoria\nde Ensino e Formação. Ocupou a chefia de gabinete da Diretoria do\nPessoal da Ativa do Distrito Federal em abril de 1960. Em maio do ano\nseguinte foi transferido para o Quartel-General da 4ª RM, sediada em\nJuiz de Fora (MG), que passou a chefiar em junho. Assumiu o comando do\nCurso de Preparação de Oficiais da Reserva (CPOR) da 6ª RM, em outubro\nde 1962.\n\nFaleceu no dia 2 de fevereiro****de 1964.\n\n \n\nFONTES: ARQ. PÚBL. EST. SE; MIN. GUERRA. *Almanaque*(1950); POPPINO, R.\n*Federal;*****WYNNE, J. *História.*\n\n \n","ref":"FONTES: ARQ. PÚBL. EST. SE; MIN. GUERRA. *Almanaque*(1950); POPPINO, R.\n*Federal;*****WYNNE, J. *História.*\n\n \n","dic":"DHBB"}
