{"title":"POLETI, Ronaldo","cargoss":["Consultor-geral da República"],"cargos_esp":[0],"datas_ini":[1984],"datas_fim":[1985],"estados":[0],"autor":[0],"content":"**POLETI, Ronaldo**\n\n\\*consult.-ger. Rep. 1984-1985.\n\n \n\n*Ronaldo Rebelo de Brito Poleti* nasceu em Bauru (SP) no dia 31 de março\nde 1942, filho de Rebelo Poleti e de Zaida de Brito Poleti.\n\nEntre 1964 e 1965, foi assessor e chefe da seção de previdência social\nda Sociedade Algodoeira do Nordeste Brasileiro. Bacharelou-se em direito\npela Faculdade de Direito da Universidade de São Paulo (USP) em 1966, e\nnos dois anos seguintes fez curso de especialização em direito público,\ntambém na USP. Aprovado em concurso, em 1969 foi nomeado promotor\npúblico substituto, passando a integrar o Ministério Público de São\nPaulo e exercendo suas funções nas comarcas de Penápolis, Bilac, Santa\nFé do Sul, Santo André e São Paulo e nas curadorias de Acidentes de\nTrabalho e Massas Falidas.\n\nEm abril de 1970 foi nomeado assessor do ministro da Justiça****Alfredo\nBuzaid e em dezembro seguinte passou subchefe do gabinete do ministro.\nEm 1971 foi designado promotor público da comarca de Itaporanga (SP). De\nsetembro desse ano a abril de 1972 exerceu a chefia de gabinete do\nMinistério da Justiça, e em julho seguinte foi nomeado consultor\njurídico do ministério. Em 1973 foi designado promotor público da\ncomarca de Atibaia (SP) e representou o Brasil na Conferência\nPlenipotenciária Sul-Americana sobre Entorpecentes, realizada em Buenos\nAires. Em 1976 tornou-se promotor público de Itapetininga (SP), e, dois\nanos depois, promotor público de entrância especial em São Paulo.\n\nEm 1979, deixou a consultoria do Ministério da Justiça para assessorar o\nMinistério da Agricultura. Ainda no segundo semestre de 1979, ministrou\no curso de introdução à ciência do direito Universidade de Brasília\n(UnB) como professor convidado. A partir de 1981 tornou-se professor\ncolaborador da UnB e em março retornou à consultoria do Ministério da\nJustiça, assumindo em maio a direção da revista *Arquivos do Ministério\nda Justiça*. Em 1982 e 1983 fez o curso de especialização em direito\nconstitucional na UnB, passando a professor assistente da universidade a\npartir desse último ano. Ainda em fevereiro de 1983 assumiu a diretoria\ngeral da Secretaria do Supremo Tribunal Federal (STF) e em agosto foi\npromovido a procurador de Justiça do Estado de São Paulo, cargo do qual\nse aposentaria voluntariamente em 1994.\n\nNomeado consultor-geral da República em agosto de 1984, em substituição\na Paulo César Cataldo, exerceu o cargo até março de 1985, quando foi\nsubstituído por Darci Bessone. Em seguida, foi consultor jurídico do\nMinistério da Aeronáutica e assessor do Ministério da Educação, nas\ngestões de Marco Maciel (1985-1986) e de Jorge Bornhausen (1986-1987).\nVoltou a ser consultor jurídico do Ministério da Justiça em junho de\n1989 e, no ano seguinte, do Ministério da Aeronáutica, até março de\n1994. No mesmo período, deu continuidade à sua formação acadêmica\ncursando o mestrado na Faculdade de Direito da UnB, e defendendo em 1991\na dissertação intitulada “A vertente romanista da dicotomia direito\npúblico/privado”. Em 1993 foi nomeado coordenador do curso de mestrado\nem direito da UnB e em 1995 tornou-se professor adjunto da universidade.\n\nMembro fundador do Centro de Estudos de Direito Romano e Sistemas\nJurídicos da UnB, em 2002 foi eleito presidente da União dos Romanistas\nBrasileiros, sendo reeleito em 2004. Em 2007 obteve o título de doutor\nna Faculdade de Direito da UnB com a tese “Elementos para um conceito\njurídico de império”.\n\nCasou-se com Marisa Schützer del Nero Poleti, com quem teve quatro\nfilhos.\n\nAlém de artigos para a revista*Arquivos do Ministério da Justiça*,\npublicou *O decreto-lei na Constituição*(1982), *Legislativo e\nExecutivo* (1983), *Controle da constitucionalidade das leis* (1985),\n*Da Constituição à Constituinte*(1986), *A Constituição de 1934* (1986),\n*Introdução ao estudo do direito* (1988), *Introdução ao direito\n(1991)*,*Elementos de direito romano público e privado*(1996) e\n*Constituição anotada* (2009).\n\n \n\n \n\nFONTES: CURRIC. BIOG.; INF. BIOG; Livraria do Advogado Editora; UnB;\nCurrículo Lattes.\n\n \n","ref":"FONTES: CURRIC. BIOG.; INF. BIOG; Livraria do Advogado Editora; UnB;\nCurrículo Lattes.\n\n \n","dic":"DHBB"}
