{"title":"PONTES, Gercino Malagueta de","cargoss":["Constituinte","Deputado federal"],"cargos_esp":[0,0],"datas_ini":[1946,1946],"datas_fim":[1946,1951],"estados":[0,"PE"],"autor":[0],"content":"**PONTES, Gercino Malagueta de**\n\n\\*const. 1946; dep. fed. PE 1946-1951.\n\n \n\n*Gercino Malagueta de Pontes* nasceu em Caruaru (PE) no dia 15 de\ndezembro de 1894, filho de João Guilherme de Pontes e de Amélia\nMalagueta de Pontes. Seu pai foi destacado líder político em Pernambuco\ne senador estadual durante a República Velha.\n\nCursou o primário em sua cidade natal e concluiu o secundário no Ginásio\nPernambucano. Em 1912 ingressou na Escola de Engenharia de Recife e,\nainda estudante, trabalhou como auxiliar técnico da repartição de obras\npúblicas e saneamento do Estado de Pernambuco. Logo em seguida à sua\nformatura em abril de 1918, tornou-se diretor da filial da Companhia\nConstrutora em Concreto Armado, em Recife, e aí permaneceu até 1919,\nquando passou a dirigir a Usina Cucaú, no nordeste pernambucano. Em 1920\nfoi nomeado diretor da repartição de obras públicas e saneamento,\ndurante o governo de José Bezerra (1919-1922).\n\nEm 1921, após regressar da viagem que realizou à Argentina, Inglaterra,\nFrança e Alemanha, reassumiu a direção da usina e, com base em novas\ntécnicas adquiridas no exterior, deu início à implementação de medidas\nque resultaram na duplicação de sua capacidade de produção açucareira.\nEm 1932 deixou a direção da usina e assumiu a função de inspetor da\nCaixa Econômica Federal, tornando-se responsável por toda a região\nnordestina. Nessa mesma época empenhou-se na criação do Sindicato dos\nEngenheiros de Pernambuco, cuja primeira presidência veio a exercer.\n\nFoi secretário de Viação e Obras Públicas de Pernambuco durante a\ninterventoria de Agamenon Magalhães (1937-1945), tendo criado em sua\ngestão o Instituto Tecnológico de Pernambuco, a Caixa de Acidentes e a\nCooperativa de Consumo dos Servidores do Estado; além das comissões de\nestudos das quedas-d’água, da industrialização dos serviços de água e\nesgoto e das docas e obras do porto de Recife. Adepto do cooperativismo,\nincentivou a construção de casas, escolas e parques para operários, e\ntambém a de estradas de rodagem. Colaborador de diversos órgãos da\nimprensa pernambucana, idealizou e colocou em circulação o Boletim\nTécnico da Secretaria de Viação e Obras Públicas de Pernambuco.\n\nCom o fim do Estado Novo, foi eleito deputado constituinte por\nPernambuco na legenda do Partido Social Democrático (PSD) em 2 de\ndezembro de 1945. Participou dos trabalhos da Assembléia Nacional\nConstituinte, iniciados em fevereiro de 1946, como membro da Comissão de\nInvestigação Econômica e Social, tendo apresentado um relatório tratando\nda questão habitacional no Brasil. Em suas intervenções no plenário,\nconcentrou-se na defesa do aproveitamento hidrelétrico da cachoeira de\nPaulo Afonso, como meio de viabilizar o desenvolvimento industrial do\nNordeste. Entre as emendas que apresentou ao projeto de Constituição,\ndestaca-se a que suprimia a obrigatoriedade do pagamento da contribuição\nde melhoria para os proprietários que doassem terras para a realização\nde obras públicas.\n\nApós a promulgação da nova Carta, em 18 de setembro de 1946, passou a\nexercer o mandato legislativo ordinário, presidindo a Comissão de Viação\ne Obras Públicas durante o ano de 1947. Em fevereiro de 1948 deixou a\nCâmara para ocupar mais uma vez o cargo de secretário de Viação e Obras\nPúblicas de Pernambuco, no governo de Alexandre José Barbosa Lima\nSobrinho (1948-1951), exercendo esta função até março de 1949. No mês\nseguinte reassumiu sua cadeira na Câmara, onde permaneceu até o final da\nlegislatura, em janeiro de 1951.\n\nFoi superintendente da Rede Ferroviária do Nordeste.\n\nFaleceu em 31 de março de 1967.\n\n \n\nFONTES: BRAGA, S. *Quem foi quem*; CÂM. DEP. *Deputados*; CÂM. DEP.\n*Relação dos deputados*; CÂM. DEP. *Deputados brasileiros. Repertório*\n(1946-1967); *Grande encic. Delta*; SILVA, G. *Constituinte*.\n\n \n","ref":"FONTES: BRAGA, S. *Quem foi quem*; CÂM. DEP. *Deputados*; CÂM. DEP.\n*Relação dos deputados*; CÂM. DEP. *Deputados brasileiros. Repertório*\n(1946-1967); *Grande encic. Delta*; SILVA, G. *Constituinte*.\n\n \n","dic":"DHBB"}
