{"title":"PORTELA, Elói","cargoss":["Senador"],"cargos_esp":[0],"datas_ini":[1998],"datas_fim":[1998],"estados":["PI"],"autor":["Alan Carneiro"],"content":"**PORTELA, Elói**\n\n\\*sen. PI 1998.\n\n*Elói Portela Nunes Sobrinho*nasceu em Valença (PI), no dia 23 de\nsetembro de 1936, filho de Eustáquio Portela Nunes e de Maria Ferreira\nde Deus Nunes. Seu irmão Petrônio Portela Nunes foi governador do Piauí\nde 1963 a 1966, senador de 1967 a 1979 e ministro da Justiça de 1979 a\n1980. O outro irmão Lucídio Portela Nunes foi governador do estado de\n1979 a 1983 e senador de 1991 a 1999. Seus primos Flávio Portela\nMarcílio foi governador do Ceará de 1958 a 1959 e deputado federal pelo\nmesmo estado de 1963 a 1991; Tibério Barbosa Nunes, governador do Piauí\nde 1962 a 1963; Helvídio Nunes de Barros, governador do Piauí de 1967 a\n1970 e senador pelo mesmo estado de 1971 a 1987 e Djalma Martins Veloso,\ngovernador desse estado de 1978 a 1979.\n\nCursou o primário na Escola Modelo Artur Pedreira e o secundário no\nColégio Estadual do Piauí, ambos em Teresina. Em 1959, ainda estudante,\ningressou na política filiando-se à União Democrática Nacional (UDN) e,\nno mesmo ano, foi admitido no Instituto Brasileiro de Geografia e\nEstatística (IBGE), na função de assistente de laboratório. Mudou-se\npara o Rio de Janeiro e ingressou na Escola Nacional de Engenharia da\nUniversidade Federal do Rio de Janeiro (UFRJ), pela qual se formou\nengenheiro civil em 1962. No ano seguinte, tornou-se engenheiro de\nportos e vias navegáveis do Departamento Nacional de Portos e Vias\nNavegáveis (DNPVN). Em 1964, fez pós-graduação em portos, rios e canais\ne o curso de especialização em navegação marítima, navegação interior e\nobras hidráulicas também na Escola Nacional de Engenharia. No ano\nseguinte, assumiu a superintendência de administração do Porto de\nLaguna, em Santa Catarina, cargo que exerceu até 1968, quando voltou ao\nRio de Janeiro e fez os cursos, também de especialização, de organização\nadministrativa e política de transporte na Escola Brasileira de\nAdministração Pública (EBAP), da Fundação Getulio Vargas, e de operação\ne manutenção de portos e terminais marítimos no Instituto Superior do\nMar da Pontifícia Universidade Católica (PUC). No ano seguinte foi o\nengenheiro construtor do pátio de estacionamento do Aeroporto\nInternacional de Brasília.\n\nCom a instauração do movimento político-militar que depôs o presidente\nJoão Goulart (1961-1964) em abril de 1964, a extinção dos partidos\npolíticos pelo Ato Institucional nº 2 (27/10/1965) e a posterior\ninstauração do bipartidarismo, filiou-se à Aliança Renovadora Nacional\n(Arena), agremiação que dava sustentação política ao regime militar.\n\nLicenciou-se do serviço público e passou a atuar na iniciativa privada,\nna capital federal. Em 1970 tornou-se chefe da usina de pré-fabricação\nda Construtora Rabelo S.A., exercendo essa função até 1972. Nesse ano\nfoi transferido para Argel, na Argélia, onde, como engenheiro-chefe do\ncomplexo industrial de Sidi-Moussa, dirigiu a construção de uma fábrica\nde prédios pré-fabricados. Permaneceu nesse país africano até o ano\nseguinte, quando retornou ao Brasil. De 1974 a 1976 participou da\nconstrução do palácio Jaburu, residência oficial do vice-presidente da\nRepública em Brasília, e foi superintendente de obras da Construtora\nRabelo de 1975 a 1977.\n\nNesse último ano voltou ao serviço público, agora na Empresa de Portos\ndo Brasil S.A. (Portobrás), sucessora do DNPVN. Ainda em 1977 passou a\nintegrar o conselho deliberativo da Superintendência do Desenvolvimento\nda Pesca (Sudepe) como representante do Ministério dos Transportes, até\n1989, e o conselho de administração da Companhia Docas do Ceará, como\nrepresentante da Portobrás, cargo que deixou em 1985. Também em 1977\ncomeçou a trabalhar no Departamento de Planejamento da estatal e, em\n1979, assumiu a chefia. Permaneceu no cargo até 1983, quando deixou essa\nfunção para chefiar o Departamento de Engenharia Portuária, tornando-se\nresponsável por todas as obras do sistema portuário brasileiro. Dois\nanos depois tornou-se presidente do conselho fiscal da Companhia Docas\ndo Maranhão (Codomar). Exerceu esses dois cargos até 1987, quando passou\na diretor das áreas de planejamento e pesquisas tecnológicas,\nresponsável pela coordenação do Departamento de Planejamento do\nInstituto de Pesquisas Hidroviárias até 1989.\n\nCom o fim do bipartidarismo, em novembro de 1979, e a reformulação\npartidária, filiou-se ao Partido Democrático Social (PDS), sucessor da\nArena no apoio ao governo.\n\nEm 1988, Heráclito Fortes foi eleito prefeito de Teresina e nomeou Elói\nPortela presidente da Empresa Teresinense de Desenvolvimento Urbano\n(Eturb). Permaneceu nessa função até 1991. Nesse ano, foi atingido pelas\nreformas feitas pelo presidente da República, Fernando Collor\n(1990-1992) e demitido do cargo de engenheiro da Portobrás em virtude da\nextinção da empresa. Ainda em 1991, foi nomeado pelo governador Antônio\nde Freitas Neto (1991-1994) secretário estadual de Obras e Serviços\nPúblicos, responsável pela supervisão, implantação, construção,\nmanutenção e recuperação de toda a malha rodoviária do estado.\n\nEm abril de 1993, filiou-se ao Partido Progressista Reformador (PPR),\nresultado da fusão do PDS com o Partido Democrata Cristão (PDC). Deixou\na secretaria municipal em abril do ano seguinte,\ndesincompatibilizando-se do cargo para compor a chapa ao Senado, na\ncondição de suplente, pela coligação do PPR com o Partido da Frente\nLiberal (PFL). A chapa era encabeçada por Freitas Neto, que também\ndeixara o governo do estado na mesma ocasião. Elegeu-se\nprimeiro-suplente de senador.\n\nUma nova fusão ocorreu em agosto de 1995, quando o PPR e o Partido\nProgressista (PP) deram origem ao Partido Progressista Brasileiro (PPB).\nEm abril de 1998, com a criação do Ministério Extraordinário das\nReformas Institucionais pelo presidente da República, Fernando Henrique\nCardoso, e a nomeação do senador Freitas Neto para essa pasta, Portela\nassumiu uma cadeira no Senado, já filiado ao PPB. Integrou, como\ntitular, a Comissão de Infra-Estrutura, que chegou a presidir\ntemporariamente. Atuou como suplente na Comissão de Estudos Econômicos.\nParticipou ainda, como membro efetivo, da comissão especial que tratou\ndos efeitos da seca no Nordeste.\n\nIntegrou, como titular, a Comissão Mista de Orçamento e as comissões\nmistas de representação do Legislativo durante os recessos de julho e\ndezembro e, como suplente, a comissão especial destinada a investigar o\ndesemprego no Brasil. Permaneceu no Senado até o dia 1º de janeiro de\n1999, quando o ministério foi extinto e o titular reassumiu o mandato.\n\nEm 2006 esteve à frente do Conselho de Autoridade Portuária (CAP) dos\nportos de Belém, Vila do Conde e Santarém, todos no Pará.. No ano\nseguinte, tornou-se assessor da Secretaria dos Transportes do Piauí no\nsegundo governo de Wellington Dias (2007-).\n\nCasou-se com Corália Rodrigues Portela Nunes,****com quem teve três\nfilhos.\n\nAlan Carneiro\n\nFONTES: CURRIC. BIOG.; INF. BIOG;\n[http://www.piaui.pi.gov.br/materia.php?id=25859](http://www.piaui.pi.gov.br/materia.php?id=25859)\nacesso em 4/9/09.\n\n \n","ref":"FONTES: CURRIC. BIOG.; INF. BIOG;\n[http://www.piaui.pi.gov.br/materia.php?id=25859](http://www.piaui.pi.gov.br/materia.php?id=25859)\nacesso em 4/9/09.\n\n \n","dic":"DHBB"}
