{"title":"PORTELA, Lucídio","cargoss":["Governador de estado ou do Distrito Federal","Senador"],"cargos_esp":[0,0],"datas_ini":[1979,1991],"datas_fim":[1983,1999],"estados":["PI","PI"],"autor":[0],"content":"**PORTELA, Lucídio**\n\n\\*gov. PI 1979-1983; sen. PI 1991-1999.\n\n* *\n\n*Lucídio Portela Nunes*nasceu em Valença do Piauí (PI) no dia 8 de abril\nde 1922, filho de Eustáquio Portela Nunes e de Maria Ferreira de Deus\nNunes. Seu irmão Petrônio Portela Nunes foi governador do Piauí de 1963\na 1966, senador por esse estado de 1967 a 1979 e ministro da Justiça de\n1979 a 1980. Um outro irmão, Elói Portela Nunes, elegeu-se suplente do\nsenador Antônio de Freitas Neto em 1994, assumindo o mandato em abril de\n1998, na vaga aberta com a nomeação do titular para um ministério. Seus\nprimos Flávio Portela Marcílio foi governador do Ceará de 1958 a 1959 e\ndeputado federal pelo mesmo estado de 1963 a 1991; Tibério Barbosa Nunes\nfoi governador do Piauí de 1962 a 1963; Helvídio Nunes de Barros foi\ngovernador do Piauí de 1967 a 1970 e senador pelo mesmo estado de 1971 a\n1987 e Djalma Martins Veloso também foi governador desse estado de 1978\na 1979.\n\nMédico formado em 1947 pela Faculdade de Medicina da então Universidade\ndo Brasil, atual Universidade Federal do Rio de Janeiro (UFRJ), nesse\nmesmo ano fez um curso de aperfeiçoamento em radiologia na Faculdade\nNacional de Medicina, ainda no então Distrito Federal. No ano seguinte\nespecializou-se em tisiologia pelo Ministério da Saúde e ingressou no\nquadro médico da prefeitura da cidade do Rio de Janeiro, no qual\npermaneceu até 1949. De volta ao Piauí, montou sua clínica radiológica e\ntornou-se, nesse mesmo ano, diretor do recém-instalado pavilhão de\ntuberculose do Hospital Getúlio Vargas em Teresina. Em 1963 fez\npós-graduação em radiologia na Pontifícia Universidade Católica (PUC) do\nRio de Janeiro.\n\nIngressou na política filiando-se à União Democrática Nacional (UDN), da\nqual foi membro do seu diretório estadual. Após a vitória do movimento\npolítico-militar de 31 de março de 1964 que depôs o presidente João\nGoulart (1961-1964), a extinção dos partidos políticos pelo Ato\nInstitucional nº 2 (27/10/1965) e a posterior instauração do\nbipartidarismo, filiou-se à Aliança Renovadora Nacional (Arena),\ntornando-se membro do seu diretório regional e vice-presidente de sua\nexecutiva regional. Em maio de 1978 foi escolhido na convenção estadual\ncomo o candidato do partido ao governo do estado. No pleito indireto de\nsetembro desse ano foi eleito governador do estado, assumindo a chefia\ndo Executivo estadual em março do ano seguinte, em substituição ao\ngovernador Djalma Martins Veloso.\n\nCom a extinção do bipartidarismo em novembro de 1979 e a conseqüente\nreformulação partidária, filiou-se ao Partido Democrático Social (PDS),\nsucessor da Arena no apoio ao governo. Tornou-se vice-presidente dessa\nagremiação, assumindo mais tarde a presidência em seu estado. Permaneceu\nà frente do Executivo piauiense até março de 1983, quando passou o\ngoverno para Hugo Napoleão do Rego Neto, eleito novo governador no\npleito de novembro do ano anterior. Retomou suas atividades médicas e\nmanteve-se na articulação política de seu partido.\n\nPara viabilizar uma coligação para concorrer ao governo do estado no\npleito de 1986, Lucídio Portela integrou a chapa, encabeçada pelo\nex-governador Alberto Silva, na condição de candidato a vice-governador\nda aliança formada pelo PDS com o Partido do Movimento Democrático\nBrasileiro (PMDB), o Partido Comunista Brasileiro (PCB) e o Partido\nComunista do Brasil (PCdoB), que acabou saindo vitoriosa nas eleições de\nnovembro desse ano, derrotando Antônio de Freitas Neto, candidato da\ncoligação comandada pelo Partido da Frente Liberal (PFL).\n\nAssumindo seu novo cargo em março de 1987, em 1990 teve seu nome\nhomologado pela convenção do PDS para concorrer a uma cadeira no Senado.\nNo pleito de outubro desse ano elegeu-se senador pelo Piauí nessa\nlegenda, assumindo sua cadeira na Câmara Alta em fevereiro do ano\nseguinte. Tornou-se suplente da mesa diretora do Senado, membro titular\nda Comissão de Ética e das comissões permanentes de Assuntos Sociais e\nde Serviços de Infra-Estrutura e suplente da Comissão de Relações\nExteriores e Defesa Nacional, da Comissão de Assuntos Econômicos e da\nComissão de Fiscalização Financeira e Controle, além de membro titular\nda Comissão Mista de Orçamento do Congresso Nacional.\n\nAs denúncias de corrupção no governo do presidente Fernando Collor\n(1990-1992) feitas pelo seu irmão mais novo Pedro Collor em maio de 1992\nlevaram à instalação de uma comissão parlamentar de inquérito (CPI) no\nCongresso Nacional no mês seguinte. As conclusões dessa comissão levaram\nao envolvimento do presidente e foi pedido o seu *impeachment.*A Câmara\ndos Deputados aprovou a admissibilidade do afastamento do presidente em\n29 de setembro e o processo foi encaminhado ao Senado. No início do mês\nseguinte Collor deixou o governo, no qual foi substituído, em caráter\ninterino, pelo seu vice Itamar Franco.\n\nNo dia 29 de dezembro desse ano, pouco antes da votação, o presidente\nafastado apresentou sua renúncia à mesa dessa casa do Congresso, que o\nrecusou. Pouco depois, Lucídio Portela se absteve de votar, mas o\n*impeachment*foi aprovado pelo plenário da Câmara Alta. Em conseqüência,\nCollor teve os seus direitos políticos suspensos por oito anos. Com esse\nresultado, Itamar foi efetivado na chefia do Executivo brasileiro.\n\nCom a fusão do PDS com o Partido Democrata Cristão (PDC) em abril de\n1993, surgindo daí o Partido Progressista Reformador (PPR), filiou-se a\nessa nova agremiação. Nova fusão ocorreria em agosto de 1995, quando o\nPPR se fundiu com o Partido Progressista (PP), formando o Partido\nProgressista Brasileiro (PPB), ao qual Lucídio Portela se filiou.\n\nDentre as principais matérias votadas no Senado ao longo de 1995,\nLucídio Portela votou a favor da regulamentação do dispositivo\nconstitucional que fixava em 12% ao ano a taxa máxima de juros no país;\nda emenda constitucional que acabou com o monopólio dos estados na\ndistribuição do gás canalizado; do novo conceito de empresa nacional,\nque acabou com todas as diferenciações legais entre empresas brasileiras\ne estrangeiras; da emenda que tratava da navegação de cabotagem,\nacabando com a reserva de mercado das embarcações nacionais, permitindo\nque as estrangeiras passassem a operar no transporte de cargas e\npassageiros entre portos do país; do fim do monopólio estatal das\ntelecomunicações; do fim do monopólio da Petrobras na exploração do\npetróleo e da criação da Contribuição Provisória sobre Movimentação\nFinanceira (CPMF), que ficou conhecida como imposto do cheque. No ano\nseguinte passou a integrar, como membro efetivo, a Comissão de Educação\ndo Senado.\n\nEm dezembro de 1996, Lucídio foi um dos 29 senadores signatários de um\nrequerimento em que, juntamente com 213 deputados, pediam a criação de\numa nova CPI mista para investigar possíveis irregularidades no\nOrçamento da União. Porém, o governo, percebendo que se tratava de\nmanobra da oposição para impedir a aprovação da emenda da reeleição,\nconseguiu barrar a criação dessa CPI com o empenho do presidente do\nSenado, José Sarney (PMDB-AP), e do seu líder na casa, Élcio Álvares\n(PFL-ES), que convenceram sete senadores, dentre os quais Lucídio\nPortela, a retirar suas assinaturas do documento.\n\nQuando da votação em primeiro turno da emenda da reeleição no Senado em\njaneiro de 1997, mostrou-se favorável à reeleição do presidente e não à\ndos governadores e prefeitos. Para esses casos, defendeu que deveria ser\nfeita uma consulta popular, através de um plebiscito. Em fevereiro\nseguinte foi eleito quarto-secretário da mesa do Senado. No final de\nabril, apresentou emenda à reeleição modificando o texto aprovado na\nCâmara, através da qual obrigava governadores e prefeitos a se\ndesincompatibilizarem seis meses antes do pleito. A emenda da reeleição,\nentretanto, foi aprovada no Senado em maio, sem alteração, com voto\ncontrário do senador Lucídio Portela, sem que os ocupantes dos cargos em\nquestão fossem obrigados a deixar os respectivos postos.\n\nDeixando de concorrer à reeleição no pleito de outubro de 1998,\npermaneceu no Senado até o fim de janeiro do ano seguinte, quando se\nencerraram o seu mandato e a legislatura.\n\nFoi casado com Míriam Nogueira Portela Nunes, que foi constituinte de\n1987 a 1988 e deputada federal pelo Piauí de 1987 a 1991, com quem teve\ncinco filhos. Uma de suas filhas, Iracema, casou-se com Guilherme Melo,\nque foi governador do Piauí de 1994 a 1995, de quem mais tarde viria a\nse separar, para, posteriormente, casar-se com Ciro Nogueira Lima Filho,\neleito deputado federal pelo Piauí em 1994, reeleito em 1998, 2002 e\n2006.\n\nAlan Carneiro\n\n \n\nFONTES: *Estado de S. Paulo*(31/12/92 e 14/3/96); *Folha de S.\nPaulo*(14/1/96, 10/4 e 29/4/97); *Globo*(29/4 e 22/5/97); *Jornal do\nBrasil*(13/12/96, 5 e 6/2/97); SENADO. *Senadores*(1995-1999).\n\n \n","ref":"FONTES: *Estado de S. Paulo*(31/12/92 e 14/3/96); *Folha de S.\nPaulo*(14/1/96, 10/4 e 29/4/97); *Globo*(29/4 e 22/5/97); *Jornal do\nBrasil*(13/12/96, 5 e 6/2/97); SENADO. *Senadores*(1995-1999).\n\n \n","dic":"DHBB"}
