{"title":"PORTUGAL, Clotário","cargoss":["Interventor"],"cargos_esp":[0],"datas_ini":[1945],"datas_fim":[1946],"estados":["PR"],"autor":[0],"content":"**PORTUGAL, Clotário**\n\n\\*magistrado; interv. PR 1945-1946.\n\n* *\n\n*Clotário de Macedo Portugal* nasceu****em Campo Largo (PR) no dia 8 de\njunho de 1881, filho do tenente-coronel James Pinto de Azevedo Portugal\ne de Ana de Macedo Portugal.\n\nCursou o Ginásio Paranaense, em Curitiba, transferindo-se posteriormente\npara São Paulo, onde se bacharelou pela Faculdade de Direito em 1905.\n\nInspetor escolar na comarca de Tibaji (PR), foi ali nomeado promotor\npúblico em 1906, sendo removido no ano seguinte para Jaguariaíva (PR).\nNomeado juiz de direito de União de Vitória (PR) em 1911, em fevereiro\nde 1916 tornou-se procurador-geral da Justiça do Paraná, tendo\ndesempenhado ainda os cargos de juiz de direito em Palmeira, Rio Negro e\nCuritiba. Em novembro de 1920 foi novamente designado procurador-geral\nda Justiça do Paraná e, em 1928, como desembargador, tornou-se\npresidente do Tribunal de Justiça do estado. Diretor do foro local,\nchefe de polícia e corregedor-geral da Justiça, assumiu em 1932 a\nSecretaria dos Negócios da Fazenda, Interior, Justiça e Instrução\nPública do Paraná. Foi ainda catedrático de direito penal da Faculdade\nde Direito da Universidade do Paraná e exerceu por diversas vezes a\npresidência do Tribunal de Apelação do estado.\n\nOcupava mais uma vez o cargo de presidente do Tribunal de Justiça\nquando, em 29 de outubro de 1945, Getúlio Vargas foi deposto,\nextinguindo-se o Estado Novo. Nessa qualidade, no dia 3 de novembro\nseguinte recebeu o governo do estado das mãos do interventor Manuel\nRibas, sendo substituído em fevereiro de 1946 por Brasil Pinheiro\nMachado.\n\nFaleceu em Curitiba no dia 9 de fevereiro de 1947.\n\nEra casado com Anita de Macedo Portugal, com quem teve quatro filhos.\n\n \n\n \n\nFONTES: CORRESP. BIB. PÚBL. PR; Grande encic. Delta; POPPINO, R.\nFederal; SOTO-MAIOR, S. Galeria.\n\n \n","ref":"FONTES: CORRESP. BIB. PÚBL. PR; Grande encic. Delta; POPPINO, R.\nFederal; SOTO-MAIOR, S. Galeria.\n\n \n","dic":"DHBB"}
