{"title":"PRADO, Fábio da Silva","cargoss":["Prefeito"],"cargos_esp":["São Paulo"],"datas_ini":[1934],"datas_fim":[1938],"estados":[0],"autor":[0],"content":"**PRADO, Fábio da Silva**\n\n\\*pref. São Paulo 1934-1938.\n\n \n\n*Fábio da Silva Prado* nasceu na cidade de São Paulo no dia 25 de junho\nde 1887, filho de Martinho da Silva Prado Júnior e de Albertina Pinto\nPrado. Seu tio, o conselheiro Antônio Prado, foi deputado federal por\nSão Paulo, de 1869 a 1875 e de 1885 a 1887, ministro da Agricultura em\n1885, senador por São Paulo em 1887, constituinte em 1891, prefeito da\ncapital paulista de 1899 a 1910, diretor do Banco do Comércio e\nIndústria de São Paulo e fundador do Partido Democrático em 1926. Seu\nirmão, Martinho da Silva Prado Neto, foi deputado federal por São Paulo\nde 1935 a 1937.\n\nFez os estudos preparatórios com professores particulares e estudou na\nEscola Politécnica de Liège, na Bélgica, diplomando-se posteriormente em\nengenharia industrial.\n\nIndustrial, foi presidente da Companhia Imobiliária Morumbi, da Sambra,\nda Centro Ideal Ferroviário, da Gema, da Companhia Agrícola Santa Cruz,\nda Companhia Agrícola Romanópolis, da Segurança Imobiliária, da\nCompanhia Brasileira de Materiais Ferroviários, da Companhia de Terra\nNorte do Paraná, da Mármores Brasileiros Sambra, do Cotonifício Rodolfo\nCrespi, da Contendas e da Companhia de Terrenos e Melhoramentos de\nSantos, tendo ainda dirigido a Companhia Grandes Hotéis, a Companhia\nMojiana de Estradas de Ferro e a Companhia Cimento Maringá.\n\nDiretor do Banco Mercantil de São Paulo e da Federação das Indústrias do\nEstado de São Paulo (FIESP), participou como delegado dessa entidade da\nfundação da Confederação Industrial do Brasil, associação civil criada\nem janeiro de 1933 no Rio de Janeiro, então Distrito Federal, visando\ndefender os interesses dos diversos grupos empresariais do país. Foi\nsegundo-tesoureiro da primeira diretoria da entidade, que foi extinta em\nagosto de 1938 com a criação da Confederação Nacional da Indústria\n(CNI).\n\nIniciou sua vida política ao eleger-se vereador à Câmara Municipal de\nSão Paulo. Em 1934, durante a interventoria de Armando Sales, foi\nnomeado prefeito da capital paulista em substituição a Antônio Carlos de\nAssunção (1933-1934), destacando-se em sua administração a****criação\ndos departamentos de Assistência Social, de Parques Infantis e Cultural,\neste último entregue ao escritor Mário de Andrade. Deu****início também\nà construção do estádio do Pacaembu****e do túnel Nove de Julho, ativou\no funcionamento dos serviços de estatísticas municipais e patrocinou a\npublicação de vasta documentação do Arquivo Municipal, sob a direção de\nSérgio Milliet. Muitos de seus projetos de remodelação urbanística foram\naproveitados por seus sucessores. Após o advento do Estado Novo em\nnovembro de 1937, em abril do ano seguinte, quando José Joaquim Cardoso\nde Melo Neto transmitiu a interventoria a Ademar de Barros, deixou a\nprefeitura de São Paulo, sendo substituído por Paulo Barbosa Campos.\n\nMembro do conselho técnico de economia e finanças do Ministério da\nFazenda de 1941 a 1943, pertenceu ainda ao conselho da Companhia\nSiderúrgica Nacional (CSN), ao Instituto Histórico e Geográfico de São\nPaulo, à Sociedade Rural e à Sociedade Paulista de Escritores, tendo\nsido um dos fundadores da Sociedade de Etnografia e Folclore.\n\nFaleceu em São Paulo no dia 3 de março de 1963.\n\nEra casado com Renata Crespi da Silva Prado, filha de Rodolfo Crespi,\ngrande industrial brasileiro de origem italiana.\n\n \n\n \n\nFONTES: ARAÚJO, A. Chefes; CONF. INDUSTRIAL DO BRASIL. Relatório;\nCOUTINHO, A. Brasil; Efemérides paulistas (1963); Encic. Mirador; Grande\nencic. Delta; LEITE, A. História; LEVI, D. Família; MELO, L. Dic.; SOC.\nBRAS. EXPANSÃO COMERCIAL. Quem; Súmulas.\n\n \n","ref":"FONTES: ARAÚJO, A. Chefes; CONF. INDUSTRIAL DO BRASIL. Relatório;\nCOUTINHO, A. Brasil; Efemérides paulistas (1963); Encic. Mirador; Grande\nencic. Delta; LEITE, A. História; LEVI, D. Família; MELO, L. Dic.; SOC.\nBRAS. EXPANSÃO COMERCIAL. Quem; Súmulas.\n\n \n","dic":"DHBB"}
