{"title":"PRADO, Maurício Eugênio Xavier do","cargoss":["Comandante do VI Distrito Naval","Comandante do I Distrito Naval"],"cargos_esp":[0,0],"datas_ini":[1949,1953],"datas_fim":[1950,1953],"estados":[0,0],"autor":[0],"content":"**PRADO, Maurício Eugênio Xavier do**\n\n\\*militar; comte. VI DN 1949-1950; comte. I DN 1953.\n\n* *\n\n*Maurício Eugênio Xavier do Prado* nasceu no Rio de Janeiro, então\nDistrito Federal, no dia 7 de julho de 1892.\n\nIngressou na Escola Naval em abril de 1909, tornando-se segundo-tenente\nem janeiro de 1913. Durante a Primeira Guerra Mundial, participou de\nquase todas as operações do patrulhamento do litoral brasileiro a bordo\ndo encouraçado Floriano. Foi promovido a primeiro-tenente em setembro de\n1917, a capitão-tenente em fevereiro de 1923, a capitão-de-corveta em\njulho de 1933 e a capitão-de-fragata em janeiro de 1941.\n\nComo oficial superior, comandou o submarino F-5, o monitor Pernambuco, o\nsubmarino Tamoio, o tênder Ceará e o navio-tanque Marajó. Diretor de\nArmamento da Marinha, foi comandante da Flotilha de Submarinos e, em\ndezembro de 1944, recebeu a patente de capitão-de-mar-e-guerra, sendo\nnomeado em 1948 subchefe do Estado-Maior da Armada (EMA). Em março de\n1949 tornou-se comandante do VI Distrito Naval (VI DN), sediado em São\nPaulo, e, em julho desse ano, foi promovido a contra-almirante, deixando\nem agosto de 1950 o VI DN.\n\nSubchefe do Gabinete Militar do presidente Getúlio Vargas, no início do\nseu segundo governo constitucional (1951-1954), comandou a Força de\nContratorpedeiros e exerceu a função de comandante-em-chefe interino da\nEsquadra. Em janeiro de 1953 assumiu o comando do I DN, com sede no Rio\nde Janeiro, e, promovido a vice-almirante em agosto seguinte, permaneceu\nà frente do I DN até dezembro do mesmo ano. Almirante-de-esquadra em\n1954, foi novamente nomeado no ano seguinte subchefe do EMA. Diretor da\nEscola Naval e delegado da Marinha à Junta Interamericana de Defesa, em\nWashington, foi nomeado diretor-geral de Pessoal da Marinha em 1956.\n\nFaleceu no dia 14 de agosto de 1957.\n\n \n\n \n\nFONTES: CONSULT. MAGALHÃES, B.; CORRESP. SERV. DOC. GER. MAR.; Grande\nencic. Delta; MIN. MAR. Almanaque (1956).\n\n \n","ref":"FONTES: CONSULT. MAGALHÃES, B.; CORRESP. SERV. DOC. GER. MAR.; Grande\nencic. Delta; MIN. MAR. Almanaque (1956).\n\n \n","dic":"DHBB"}
