{"title":"PRADO, Silva","cargoss":["Revolucionário ou revoltoso","Deputado federal"],"cargos_esp":[0,0],"datas_ini":[1932,1959],"datas_fim":[1932,1961],"estados":[0,"SP"],"autor":[0],"content":"**PRADO, Silva**\n\n\\*rev. 1932; dep. fed. SP 1959-1961.\n\n* *\n\n*Francisco Gomes da Silva Prado* nasceu em Itatinga (SP) no dia 2 de\nmarço de 1912, filho de Francisco Gomes da Silva Prado e de Adelina\nLopes Prado.\n\nParticipou da Revolução Constitucionalista de 1932, servindo como\naspirante-a-oficial da arma de artilharia no 2º Grupo de Artilharia\nPesada, em São Paulo, sob o comando do então capitão Arci da Rocha\nNóbrega. Mais tarde aderiu à Ação Integralista Brasileira (AIB),\ntornando-se um ativo militante da campanha integralista. Em 1939\nbacharelou-se pela Faculdade de Direito de São Paulo.\n\nDurante a Segunda Guerra Mundial, integrou o contingente da Força\nExpedicionária Brasileira (FEB) enviado à Itália em 1944 para combater\nos fascistas, servindo como primeiro-tenente R/2 no 1º Grupo do 2º\nRegimento de Obuses Auto-Rebocado, sob o comando do general Osvaldo\nCordeiro de Farias. De volta ao Brasil, foi promovido a capitão R/2 e\nfoi um dos fundadores da Associação dos Ex-Combatentes, cuja presidência\nchegou a exercer.\n\nFoi procurador-chefe da Procuradoria Judicial do Departamento Jurídico\ndo Estado de São Paulo e, em 1953, foi nomeado secretário dos Negócios\nInternos e Jurídicos da Prefeitura Municipal de São Paulo durante a\ngestão de Jânio Quadros. Com a eleição de Jânio ao governo paulista em\noutubro de 1954, foi designado subchefe da Casa Civil do estado.\n\nEm outubro de 1958 candidatou-se a deputado federal por São Paulo na\nlegenda da Aliança Popular Nacionalista, constituída pelo Partido\nSocialista Brasileiro (PSB) e o Partido Trabalhista Nacional (PTN), mas\nobteve apenas uma suplência. Chegou a exercer o mandato de abril de 1959\na junho de 1960 e a partir de outubro desse ano até 25 de maio de 1961,\nquando veio a falecer em São Paulo. Durante esses períodos, participou\ndas comissões de Serviço Público e de Constituição e Justiça da Câmara\nFederal.\n\nFoi casado com Erozaik Aranha da Silva Prado, com quem teve dois filhos.\n\n \n\n \n\nFONTES: CÂM. DEP. Anais (1961-1 e 8); CÂM. DEP. Deputados; CÂM. DEP.\nSúmulas; DEP. PESQ. ESTADO DE SP; Diário Popular (25/5/61); TRIB. SUP.\nELEIT. Dados (4).\n\n \n","ref":"FONTES: CÂM. DEP. Anais (1961-1 e 8); CÂM. DEP. Deputados; CÂM. DEP.\nSúmulas; DEP. PESQ. ESTADO DE SP; Diário Popular (25/5/61); TRIB. SUP.\nELEIT. Dados (4).\n\n \n","dic":"DHBB"}
