{"title":"PROTÁSIO, Paulo","cargoss":["Presidente de associação ou confederação de empregados ou empregadores"],"cargos_esp":["ACRJ"],"datas_ini":[1989],"datas_fim":[1993],"estados":[0],"autor":[0],"content":"**PROTÁSIO, Paulo**\n\n\\*pres. ACRJ 1989-1993.\n\n \n\n*Paulo Manuel**Lenz César**Protásio* nasceu no Rio de Janeiro, então\nDistrito Federal, em 24 de maio de 1940, filho de Allynges Lenz César\nProtásio e de Tamires de Santa Isabel Protásio.\n\nCursou o primário no Colégio Brasileiro de Almeida, o ginasial no\nColégio Princesa Isabel e o científico no Padre Antônio Vieira, todos no\nRio de Janeiro. Em 1961 formou-se como instrutor do *training within\nindustry* (TWI), pelo Serviço Nacional de Aprendizagem Industrial\n(Senai). Nesse mesmo ano realizou o curso de Responsabilidade de Chefia,\ndo Instituto de Administração e Gerência (IAG) da Pontifícia\nUniversidade Católica do Rio de Janeiro (PUC-RJ). Ainda em 1961 iniciou\nsuas atividades como empresário, implantando a Consemp — Consultores de\nEmpresas Ltda.\n\nAtraído pelo jornalismo, ainda na faculdade fundou e coordenou o I Curso\nde Teoria e Prática de Jornalismo da Faculdade de Direito. Colaborou com\njornais do Rio e de São Paulo, tornando-se redator do Departamento de\nPropaganda do*Jornal do Brasil*, entre 1961 e 1962. No mesmo período\ncolaborou com o jornal *Diário de Notícias*, passando em seguida a\nredator de seu caderno econômico, bem como da parte econômica da revista\n*Mun**do Ilustrado*.\n\nA convite da Organização das Nações Unidas (ONU), em 1962 realizou\nestudos sobre problemas econômicos de regiões em desenvolvimento na\nComissão Econômica para a América Latina (Cepal), em Santiago do Chile,\nna sede da ONU, em Nova Iorque e em outras agências especializadas da\nONU, em Genebra e Roma. Nesse ano fez o curso de especialização em\npsicologia aplicada ao trabalho, no Instituto de Seleção e Orientação\nProfissional (Isop) da Fundação Getulio Vargas, no Rio de Janeiro.\n\nBacharel em direito pela Universidade do Estado da Guanabara (UEG, atual\nUerj) em 1963 — ano em que, a convite da Associação Latino-Americana de\nLivre Comércio (ALALC), participou de estudos sobre a integração do\nmercado centro-americano, na cidade do México —, em 1964 realizou o\ncurso PERT — Program Evaluation and Review Technique, da Escola Graduada\nde Negócios Públicos e Internacionais da Universidade de Pittsburgh a\nconvite do governo dos Estados Unidos. Ainda em 1964 promoveu, como\nmembro do grupo de trabalho do Centro Nacional de Produtividade\nIndustrial (Cenpi), da Confederação Nacional da Indústria, estudos sobre\na competitividade da indústria brasileira, criando um programa unificado\nde treinamento de dirigentes.\n\nNaquele mesmo ano fomentou junto ao governo do Espírito Santo, como\nconsultor, as bases de uma política de desenvolvimento industrial para o\nestado. Até 1965 tinha organizado e ajudado a criar 36 empresas\nindustriais, de comércio e de serviços, e atendido a igual número de\nreorganizações de pequenas, médias e grandes empresas em todo o\nterritório nacional. Em 1965 promoveu, por contratação, a reforma\nestrutural e organizacional da Federação das Indústrias do Estado da\nGuanabara e de seu Centro Industrial, e, com a criação do Grupo de\nServiço PMP, deu início à primeira franquia de serviços temporários no\nBrasil, através da Manpower.\n\nPor falta de uma legislação apropriada, estimulou a criação e aprovação\nde lei específica para a expansão do trabalho temporário no Brasil, com\no apoio institucional da Associação Comercial do Rio de Janeiro (ACRJ).\nCom seu Grupo de Serviço, promoveu o I Encontro Nacional de Empreiteiros\nde Obras Públicas, dando corpo à sua institucionalização nacional, e\norganizou a primeira e a segunda Conferência de Comercialização\nbrasileira, sendo a última originária do Conselho de Desenvolvimento\nComercial do Ministério da Indústria e Comércio.\n\nRealizou o curso de desenvolvimento e administração de franquias, pelo\nManpower Business Training Institute, em Milwaukee, Wisconsin, em 1965,\ne o de promoção comercial e marketing de exportação, pelo Centro\nInternacional de Comércio (GATT/UNCTAD), em Genebra (Suíça) e Turim\n(Itália), em 1968.\n\nEm 1970, fundou a GBC do Brasil Plastigráficos Ltda., uma *joint\nventure* com a General Binding Corporation. No mesmo ano lançou o\nprimeiro Consórcio Brasileiro de Exportação e participou da organização\nda Associação Brasileira de Exportadores (ABE), permanecendo como membro\nde sua diretoria.\n\nDurante o governo do presidente Emílio Garrastazu Médici e o primeiro\nano de mandato do presidente Ernesto Geisel, exerceu a secretaria\nexecutiva do Ministério da Indústria e do Comércio, de agosto de 1971\naté janeiro de 1975, acumulando esse cargo com o de presidente da\nEmpresa Brasileira de Turismo (Embratur). Nesse período, procurou\nvincular a divulgação das atrações turísticas brasileiras ao serviço de\npromoção comercial do Ministério das Relações Exteriores, ocupou a\npresidência da South America Travel Organization (Sato) e participou da\nformação da Organização Mundial de Turismo da ONU, tornando-se\nvice-presidente da entidade por um curto período.\n\nEm 1975, de volta à iniciativa privada, foi eleito presidente da\nAssociação Brasileira de Marketing e promoveu o primeiro Congresso\nBrasileiro de Marketing, em 1977. Nessa época, participou da criação do\nConselho Empresarial Brasil-Estados Unidos (Cebeu), transformou o seu\nGrupo de Serviço em uma *trading company* com o nome de BMI — Brasil\nMarketing Internacional S.A. e foi eleito membro da diretoria da World\nTrade Centers Association (WTCA), com sede em Nova Iorque, da qual seria\ndesignado, após 15 anos de serviços, diretor honorário.\n\nEm 1985, realizou no Rio de Janeiro a I Semana Rio Internacional, evento\nque incluiu a primeira Assembleia Mundial dos WTCs na América do Sul e a\nprimeira reunião da diretoria da recém-formada World Teleport\nAssociation (WTA), para a qual foi eleito representante sul-americano.\nPor delegação da WTCA, promoveu a implantação de WTCs nas principais\ncidades da América Latina. Em 1986 assumiu a presidência da Associação\nBrasileira das Empresas Comerciais Exportadoras (Abece), entidade que\nreunia as empresas *tradings* brasileiras.\n\nIndicado presidente da Câmara de Usuários da Superintendência Nacional\nde Marinha Mercante (Sunaman) em 1987, nesse mesmo ano presidiu a I\nReunião das Câmaras de Comércio e Indústria do Grupo 77, promovida pela\nUNCTAD e com o apoio do Ministério das Relações Exteriores, no Rio de\nJaneiro. Deu início, a partir de então, a um movimento de integração das\ncâmaras de comércio dos países em desenvolvimento, por meio de uma rede\nde comunicação permanente, sendo eleito presidente do grupo indicado\npelas câmaras de comércio para liderar a iniciativa. Ainda em 1987\norganizou e presidiu a Associação Latino-Americana de Comércio Exterior\n(Alat).\n\nEm 1989 foi eleito presidente da ACRJ para o biênio 1989-1991,\nsubstituindo Amauri Temporal, e reelegeu-se para o biênio 1991-1993. Ao\nlongo dessas duas gestões desenvolveu projetos como Câmara Rio,\nRiomania, Teleporto, World Trade Center, construção da Linha Vermelha,\nampliação do Aeroporto Internacional e outros já realizados ou em\nandamento, como tentativa de retomada do desenvolvimento da cidade do\nRio de Janeiro. Criou e implantou, com outras parcerias, a Associação\nBrasileira de Zonas de Processamento de Exportação (Abrazpe), tendo\ndesenvolvido e participado de projetos das ZPEs de Suape, São Luís, Rio\nde Janeiro e Imbituba. Eleito vice-presidente de Assuntos Internacionais\nda Confederação das Associações Comerciais do Brasil (CACB), passou a\nrepresentar o Brasil, pela CACB, na Câmara Interamericana de Arbitragem\nComercial, com sede em Washington.\n\nFoi nomeado, por decreto do presidente Fernando Collor de Melo, \nsecretário executivo da reunião da UNCED, conhecida como Rio-92, evento\nque reuniu no Rio de Janeiro mais de cem chefes de Estado e\npersonalidades do mundo inteiro, com o objetivo de reverter o quadro de\ndegradação do meio ambiente do planeta. Substituído na presidência da\nACRJ em 1993 por Humberto Mota, no ano seguinte, por portaria do\nministro dos Transportes, Alberto Goldman, foi nomeado coordenador do\nCorredor de Transporte Centro Sudeste, elaborando estudos sobre a\nmodernização das atividades portuárias voltados aos portos do Rio de\nJaneiro, e foi indicado, na representação da cidade do Rio de Janeiro,\npara a implantação do Conselho de Administração Portuária (CAP) da\nCompanhia Docas do Rio de Janeiro (CDRJ). Foi conselheiro, durante dois\nanos, da Rede Ferroviária Federal (RFFSA) e da CDRJ.\n\nAinda em 1994, ingressou, a convite do senador Nélson Carneiro, no\nPartido Progressista (PP), no qual permaneceu por pouco tempo, não\nvindo, depois, a manter nenhuma filiação partidária.\n\nEm 1995 desenvolveu, a partir da Reunião de Cúpula de Miami para a\nconstituição da Alca, um programa sul-americano de integração, com o\nnome de Rede Empresarial para a Integração Hemisférica (REIH) visando à\nintensificação de novos investimentos na região, pautando o movimento\ncom a criação de um novo mapa-múndi para o continente, colocando o\nBrasil e a América do Sul no centro do mundo.\n\nTrês anos depois, como presidente do Conselho de Comércio Exterior da\nAssociação Comercial do Rio de Janeiro, criou um mapa mundial onde o\nBrasil aparecia no centro do mundo para distribuição nas escolas\nmunicipais, dentro do projeto “O Brasil no Centro do Mundo”. Em\ndeclaração publicada no jornal *Folha de S. Paulo*, declarou que sua\nintenção com o movimento era lançar \"à sociedade o convite para\nidentificar a virada do milênio e do século e a ocorrência dos 500 anos\nde civilização brasileira como oportunidades únicas de mudança de\nperspectiva e transformação do país\".\n\nFoi um dos diretores do Conselho Empresarial Brasileiro para o\nDesenvolvimento Sustentado (CEBDS), organização não governamental\ncomposta por grandes grupos empresariais brasileiros e voltada para a\nconciliação das dimensões econômica, social e ambiental nas atividades\ndas empresas; entre os trabalhos desenvolvidos pela entidade destacou-se\no Mecanismo de Desenvolvimento Limpo. Fez parte ainda do Comissariado da\nExposição Universal de Hannover, na Alemanha, em 2000, cujo tema foi o\nmeio ambiente e desenvolvimento sustentável.\n\nOrganizou e tornou-se presidente, em 1999, da International Emissions\nTrading Association (Ieta) a partir dos contatos que manteve com a\nUNCTAD, após a realização da Rio 92, e em cooperação com o World\nBusiness Council for Sustainable Development (WBCSD ).\n\nEm 2005, assumiu a presidência da Associação Nacional dos Usuários do\nTransporte de Cargas (Anut) e, no mesmo período, tornou-se presidente da\nAssociação Brasileira das Empresas Comerciais Exportadoras (Abece). Em\njaneiro de 2006, com a criação da Câmara Temática de Transporte e\nLogística do Agronegócio do Ministério da Agricultura, Pecuária e\nAbastecimento, foi nomeado seu presidente, como representante do setor\nprivado.\n\nVice-presidente da Associação do Comércio Exterior do Brasil (AEB) desde\nsua fundação, além de grande benemérito da ACRJ. Manteve ainda o\nescritório Protásio Advogados e a direção geral da Brasil Marketing\nInternacional S. A. BMI.\n\nPublicou vários artigos, além dos livros *Mercosul: um atlas cultural,\nsocial e econômico* (1997) em parceria com Felix Peña e\n*Zona**i**nternacional de**s**erviços:**r**ede\npara**r**edes:**i**ntegrando a Amé**rica Latina*(2004) com Martius\nV.Rodrigues e Renilda O. de Almeida.\n\nCasou-se com Maria Letícia de Sousa Campos Protásio, com quem teve três\nfilhos.\n\n \n\nCristiano Sanches/Fabrícia Guimarães\n\n \n\nFONTES: CURRIC. BIOG.; *Folha de S**.**Paulo* (2/9/98, 24/3/00).\n\n \n","ref":"FONTES: CURRIC. BIOG.; *Folha de S**.**Paulo* (2/9/98, 24/3/00).\n\n \n","dic":"DHBB"}
