{"title":"QUADROS, Jânio","cargoss":["Prefeito","Governador de estado ou do Distrito Federal","Presidente da República","Prefeito"],"cargos_esp":["São Paulo",0,0,"São Paulo"],"datas_ini":[1953,1955,1961,1986],"datas_fim":[1954,1959,1961,1989],"estados":[0,"SP",0,0],"autor":[0],"content":"**QUADROS, Jânio**\n\n\\*pref. São Paulo 1953-1954; gov. SP 1955-1959; pres. Rep. 1961; pref.\nSão Paulo 1986-1989.\n\n \n\n*Jânio da Silva Quadros* nasceu em Campo Grande, no então estado de Mato\nGrosso e atualmente capital do Mato Grosso do Sul, no dia 25 de janeiro\nde 1917, filho do médico paranaense Gabriel Quadros e de Leonor da Silva\nQuadros.\n\nAinda criança, mudou-se junto com sua família para Curitiba, onde fez o\ncurso primário e parte do secundário no Ginásio Paranaense, onde foi\ncolega de Nei Braga, futuro governador do Paraná. Seu pai ingressou no\nPartido Republicano Paranaense (PRP), em cuja legenda foi eleito\ndeputado estadual. Com o triunfo da Revolução de 1930, Gabriel Quadros\nviajou para São Paulo e, depois de passar curtas temporadas nos\nmunicípios de Garça, Bauru e Cândido Mota, fixou-se na capital e mandou\nbuscar a família. Jânio foi matriculado no Colégio São Joaquim, em\nLorena (SP), mas em 1933 ingressou no Colégio Arquidiocesano, na cidade\nde São Paulo, onde concluiu os estudos secundários.\n\nEm 1935, aos 18 anos, passou a lecionar português e geografia em algumas\nescolas e ingressou na Faculdade de Direito, onde começou a participar\ndas atividades promovidas pelo Centro Acadêmico 11 de Agosto. No ano\nseguinte, resolvido a eleger-se secretário da entidade, fez uma campanha\nsingular: todos os dias ficava sentado num barril, em frente às arcadas\nda faculdade, com uma fita no chapéu onde escrevera: “Vote em Jânio.” Os\ncolegas acharam graça e votaram nele.\n\nAinda acadêmico, conheceu Eloá do Vale, de 15 anos, filha de um\nfarmacêutico amigo de seu pai. Logo que recebeu o diploma, casou-se com\nela. Montou, então, um pequeno escritório de advocacia no centro da\ncapital e começou a lecionar em dois colégios tradicionais — o Dante\nAlighieri e o Vera Cruz. Com o fim do Estado Novo e a reorganização\npartidária ocorrida em 1945, filiou-se ao comitê da União Democrática\nNacional (UDN) no bairro de Vila Mariana. No entanto, por não ter\nconseguido espaço nesse partido para concorrer a vereador nas eleições\nde 1947, candidatou-se na legenda do Partido Democrata Cristão (PDC),\ncom o apoio de pais e alunos do colégio Dante Alighieri.\n\nJânio obteve 1.704 votos, insuficientes para sua eleição. Porém, com a\nsuspensão do registro do Partido Comunista Brasileiro, então Partido\nComunista do Brasil, e a posterior cassação dos mandatos de seus\nparlamentares, sobraram muitas cadeiras na Câmara Municipal de São\nPaulo, onde o PCB possuía a maior bancada. Jânio foi um dos suplentes\nchamados a preencher esses lugares em 1948. Seu trabalho como vereador\nfoi muito decisivo para projetá-lo na vida política paulista, como\ndefensor intransigente da moralização administrativa e severo crítico do\ngoverno de Ademar de Barros, líder nacional do Partido Social\nProgressista (PSP).\n\nCom um estilo particular de oratória, sempre mal vestido e despenteado,\nencampava as reivindicações populares, visitando bairros pobres,\nassinando manifestos, escrevendo artigos para jornais e defendendo\ngrande número de proposições, requerimentos e projetos de lei. Obtinha\ncada vez mais espaços na imprensa, que cortejava. Certa vez apresentou\num projeto que isentava os jornalistas do pagamento do imposto predial.\nOs servidores municipais foram conquistados pelo abono de Natal, outra\nidéia do vereador Jânio.\n\nSeu prestígio cresceu tanto que em outubro de 1950 foi eleito deputado\nestadual, concorrendo novamente na pequena legenda do PDC, com a maior\nvotação do estado. Líder da bancada na Assembléia Legislativa, expulsou\ndo partido quatro deputados acusados de ligações com o governador Lucas\nNogueira Garcez, do PSP. No exercício do mandato, percorreu todo o\ninterior do estado, sempre insistindo na bandeira da moralização do\nserviço público e pedindo sugestões ao povo para resolver os problemas\nde cada região.\n\n \n\nNa prefeitura de São Paulo\n\nA capital paulista assistiu no início de 1953 à primeira campanha\neleitoral para a prefeitura em 23 anos, desde a Revolução de 1930. Jânio\nfoi lançado candidato do PDC em coligação com o Partido Socialista\nBrasileiro (PSB) e batizou sua campanha como Movimento 23 de Março, numa\nalusão à data do pleito. Seu lema, “O tostão contra o milhão”, procurava\nressaltar a desproporção dos recursos mobilizados em seu apoio em\nrelação aos que foram utilizados pelas máquinas políticas mais poderosas\ndo estado, especialmente o PSP. Com o apoio do velho líder político\npaulista Ataliba Leonel e de Olavo Fontoura, que lhe garantiu livre\nacesso à Rádio Cultura, e com**o espaço do jornal *A Hora* à**sua\ndisposição, Jânio concentrou seus ataques no desperdício de dinheiro\npúblico patrocinado pelo governo estadual do PSP, usando repetidamente o\nexemplo das obras em curso para os festejos do quarto centenário da\ncidade de São Paulo, que seria comemorado em 1954. Diante da sua\ninsistência em propor uma limpeza nos órgãos públicos, a vassoura\ncomeçou a ser usada por seus correligionários como símbolo da campanha.\n\nJânio foi beneficiado pela crise que surgiu no PSP, afastando Ademar de\nGarcez. O governador Lucas Garcez se afastava progressivamente do\nesquema ademarista que****o elegera e, baseado numa articulação\ninterpartidária, lançou seu secretário de Saúde, Francisco Antônio\nCardoso, para a prefeitura, completando a chapa com Fernando Nobre,\nindicado pelo Partido Trabalhista Brasileiro (PTB). Impossibilitado de\nlançar Ademar****de Barros Filho como****candidato de seu partido, o\nlíder do PSP passou a apoiar Jânio, inclusive financeiramente.\nA campanha conquistou ainda dissidentes do PTB, que indicaram José\nPorfírio da Paz para concorrer a vice-prefeito na chapa.\n\nJânio venceu por larga margem as principais máquinas partidárias locais,\nobtendo 285.155 votos contra 115.014 dados a Francisco Antônio Cardoso\n(PSP), 16.662 a André Nunes Júnior, do Partido Trabalhista Nacional\n(PTN), e 3.901 a Osvaldo Ortiz Monteiro, do Partido Social Trabalhista\n(PST). A surpresa dos meios políticos foi traduzida pelo então senador\nFrancisco de Assis Chateaubriand, dono dos Diários Associados: “Estamos\ndiante de um fenômeno dos mais impressionantes da vida política\nbrasileira. Vimos um homem sozinho derrotar o conjunto de oito partidos\nque dispunham de uma imensa rede radiofônica, da simpatia de poderosos\njornais e outros recursos de propaganda.”\n\nEm fins de março, logo após o pleito municipal, ocorreu em São Paulo a\nchamada greve dos trezentos mil, que fugiu ao controle do governo do\npresidente Getúlio Vargas. Coube ao governo estadual arcar com o ônus da\nrepressão ao movimento, que durou um mês e recebeu a solidariedade de\nJânio, interessado em enfraquecer as posições de Garcez e de Vargas e\npenetrar numa área até então privativa do ademarismo, do PTB e do PCB.\n\nJânio assumiu a prefeitura aos 36 anos e um dos seus primeiros atos foi\npromover demissões em massa de funcionários, iniciando uma cruzada\nmoralizadora que marcou sua gestão. Passou a visitar de surpresa\nrepartições públicas para apurar denúncias de irregularidades;\ninstitucionalizou o envio de memorandos e dos famosos “bilhetinhos”;\nregulamentou o uso de carros oficiais, proibindo sua circulação fora do\nhorário de serviço; investiu na recuperação de ônibus e bondes da\nCompanhia Municipal de Transportes Coletivos (CMTC); e nomeou o\nprofessor Carlos Alberto de Carvalho Pinto para a administração das\nfinanças municipais, conseguindo equilibrar o orçamento da prefeitura.\n\nEm 1954 Jânio e Porfírio da Paz se desincompatibilizaram dos seus cargos\npara se candidatarem a governador e vice-governador do estado.\n\nNo governo paulista\n\nA campanha eleitoral de 1954 para o governo de São Paulo foi marcada\npela polarização entre Ademar de Barros, apresentado pelo PSP, e Jânio\nQuadros, lançado pelo PDC em princípios de janeiro. Entretanto, não\nconcordando com a indicação de Antônio de Queirós Filho para seu\ncompanheiro de chapa, Jânio retirou sua candidatura no dia 31 desse mês,\nsendo acusado publicamente pelo PDC de fazer demagogia e fugir dos\ncompromissos partidários. Em dramática entrevista e em um manifesto\ndivulgado no dia 3 de fevereiro, o candidato se defendeu e revelou que\nse comprometera a entregar ao PDC a chefia de três secretarias, do\nInstituto de Previdência, do Banco do Estado e da Caixa Econômica.\n\nO PTN e o PSB mantiveram a candidatura de Jânio, cuja crescente\npenetração nos setores médios e populares representava uma ruptura\nprofunda com o tradicional clientelismo paternalista de Ademar. Segundo\no sociólogo Francisco Weffort, aquelas camadas não possuíam mais a\nexpectativa de obter proteção pessoal por parte das autoridades,\ndefinindo seu voto em função da esperança de obter um governo eficiente\ne voltado para a justiça social.\n\nEmbora Ademar fosse o líder do maior partido político do estado e ainda\ndetivesse influência sobre um grande número de prefeitos do interior,\nsua campanha se enfraqueceu muito devido ao lançamento da candidatura do\nengenheiro Francisco Prestes Maia, apoiada pelo governador Garcez, pela\nUDN e pelos partidos Social Democrático (PSD), Republicano (PR) e de\nRepresentação Popular (PRP). O PTB estava dividido em três grupos a\nrespeito da sucessão: o primeiro era favorável à participação no esquema\nde alianças articulado por Garcez, o segundo apoiava Jânio e o terceiro\npropunha o lançamento de uma candidatura própria. Contra a vontade do\nlíder trabalhista Hugo Borghi, que pretendia o lançamento de seu próprio\nnome, o PTB lançou oficialmente Vladimir de Toledo Piza para concorrer\nao governo, mas alguns setores do partido continuaram apoiando Jânio\nQuadros e indicaram Porfírio da Paz para vice-governador em sua chapa.\n\nJânio não tinha um programa definido, prometendo apenas trabalhar muito\ne “varrer” a corrupção dos órgãos públicos. Colocava-se publicamente\ncomo um homem sem partido: “O trabalhador da cidade e dos campos que me\nelegeu, humilde e sofredor, não me sujeita a qualquer partido, a\nqualquer grupo, a qualquer indivíduo. Sujeita-me tão-só e exclusivamente\nao bem comum.” Sua campanha foi marcada por comícios que enchiam praças\npara onde seguiam multidões com vassouras e velas acesas. Segundo Maria\nVitória Benevides, “os palanques transformavam-se em palcos de\ntragicomédias: Jânio tomava injeções em público, simulava desmaios e\ncomia sanduíches de mortadela levados nos bolsos. E era carregado nos\nombros do povo! Numa esdrúxula mistura de radicalismo e\n*kitsch*popularesco (um admirador udenista chegou a identificá-lo como\num misto de Lenin e Carlitos!), fazia violentos ou pitorescos discursos,\nnum português precioso de sílabas escandidas, e apoiado num visual que\nse tornaria típico: roupas surradas e em desalinho, cabelos compridos e\nbarba por fazer, ombros brilhantes de caspa”.\n\nJânio venceu as eleições de 1954 para o governo paulista com 660.264\nvotos contra 641.960 dados a Ademar, 492.518 a Prestes Maia e 79.783 a\nToledo Piza. Porfírio da Paz foi eleito vice-governador. A vitória sobre\no ademarismo só não foi completa porque Juvenal Lins de Matos, do PSP,\nderrotou Auro de Moura Andrade na disputa para o Senado e o PSP\ncontinuou majoritário na Assembléia Legislativa, seguido pelo PSD.\n\nEmpossado em 31 de janeiro de 1955, Jânio começou a desalojar o PSD da\nmáquina governamental e a empreender intensa campanha de desmoralização\npessoal e administrativa de Ademar. Além de transferir e demitir pessoas\nligadas ao PSP, reativou o processo aberto no ano anterior sobre a\ncompra irregular de automóveis Chevrolet durante o mandato de Ademar no\ngoverno paulista.\n\nJânio nomeou um secretariado em sua maioria desvinculado dos grandes\npartidos: Quintanilha Ribeiro (Gabinete Civil), Carlos Castilho Cabral\n(Trabalho), Carvalho Pinto (Finanças), Caetano Álvares (Viação),\nCarolina Ribeiro (Educação), Cruz Martins (Agricultura), José Adriano\nMarrey Júnior (Justiça), general Honorato Pradel (indicado pelo\nbrigadeiro Eduardo Gomes para a Secretaria de Segurança) e Scalamandré\nSobrinho (Saúde). Este último era deputado estadual da bancada do PTN e\nsua nomeação para o Executivo abriu uma vaga na Assembléia Legislativa\npara Gabriel Quadros, primeiro suplente desse partido e pai do\ngovernador. Antônio Sílvio Cunha Bueno, que disputara a vice-governança\nda chapa de Prestes Maia, aceitou a Secretaria de Governo.\n\nDesde o início do seu governo, Jânio procurou ampliar seu espaço\npolítico em nível nacional, estabelecendo contatos com o presidente João\nCafé Filho, que, empossado depois do suicídio de Getúlio Vargas,\norganizara um ministério de hegemonia udenista no qual se sobressaíam\nmilitares antigetulistas, como Juarez Távora (chefe do Gabinete\nMilitar), Eduardo Gomes (ministro da Aeronáutica) e Edmundo Amorim do\nVale (ministro da Marinha). Para negociar em melhores condições, Jânio\nlogo se proclamou candidato à presidência da República nas eleições\nprevistas para outubro de 1955, reafirmando essa intenção em 1º de\nabril. Entretanto, Juarez Távora, provável candidato da UDN, recebeu no\nRio nesse mesmo dia a visita de emissários de Jânio, que lhe\ntransmitiram a disposição do governador paulista de se retirar da\ndisputa e passar a apoiar Juarez em****troca da indicação do candidato à\nvice-presidência e da maior participação de São Paulo na administração\nfederal. Juarez respondeu que não poderia se comprometer antes de ouvir\na opinião dos chefes militares e de Café Filho. Interessado na proposta,\no presidente da República enviou a São Paulo o suplente de senador\nReginaldo Fernandes, da UDN do Rio Grande do Norte, para realizar as\nnegociações que resultaram, ainda no início de abril, no chamado acordo\nJânio-Café, que garantia ao governador paulista o direito de escolha dos\nministros da Fazenda e da Viação e Obras Públicas e do presidente do\nBanco do Brasil, em troca do seu apoio à chapa Juarez Távora-Bento\nMunhoz da Rocha.\n\nO acordo, porém, não foi bem recebido nas fileiras udenistas. Em 3 de\nabril, Juarez enviou cartas a Jânio e Café recusando a indicação de\nMunhoz da Rocha sem consulta prévia aos partidos aliados, ao mesmo tempo\nem que Clemente Mariani (presidente do Banco do Brasil) e os ministros\nEugênio Gudin (da Fazenda)**e Rodrigo Otávio Jordão Ramos (da Viação e\nObras Públicas) renunciaram, sendo substituídos por nomes indicados por\nJânio: Alcides Vidigal, José Maria Whitaker e Otávio Marcondes Ferraz,\nrespectivamente.\n\nA aproximação entre Jânio e Café criou condições mais propícias para o\ngoverno paulista realizar um trabalho de recuperação financeira do\nestado, pois o acordo firmado para a unificação e consolidação de suas\ndívidas garantiu o pagamento escalonado do débito de mais de oito\nbilhões de cruzeiros, que representavam cerca de 40% da receita prevista\nno orçamento.\n\nAs eleições presidenciais de outubro de 1955 foram vencidas por\nJuscelino Kubitschek e João Goulart, candidatos da coligação PSD-PTB e\nrepresentantes das forças políticas alijadas do poder com o suicídio de\nVargas no ano anterior. A UDN e setores das forças armadas se colocaram\nentão contra a posse dos eleitos, agravando assim a tensão. Em 8 de\nnovembro, Café Filho, acometido dias antes de um distúrbio\ncardiovascular, transferiu interinamente o poder para Carlos Luz,\npresidente da Câmara dos Deputados, membro****do PSD, mas muito ligado\nao udenismo. No dia 11 seguinte, os generais Henrique Teixeira Lott\n(ministro da Guerra demissionário) e Odílio Denis (comandante da Zona\nMilitar Leste, atual I Exército) lideraram um movimento militar visando,\nsegundo sua versão, barrar uma conspiração em preparo no governo para\nimpedir a posse dos eleitos.\n\nContando com a fidelidade da Marinha e da Aeronáutica, o presidente em\nexercício se refugiou no cruzador *Tamandaré*e rumou para Santos (SP),\npois esperava obter o apoio de Jânio para transformar São Paulo na\nprincipal base de operações das forças favoráveis ao governo,\nespecialmente a esquadra, a Força Pública (PM) paulista, a 2ª Divisão de\nInfantaria (2ª DI) e a IV Zona Aérea. Apesar de não se ter definido\nclaramente em relação ao conflito, Jânio não fez qualquer objeção às\nmanobras militares governistas em território paulista, coordenadas pelo\nbrigadeiro Eduardo Gomes. Entretanto, a ação dos generais Olímpio\nFalconière da Cunha (comandante da Zona Militar Centro, atual II\nExército) e Estênio Caio de Albuquerque Lima (comandante da 2ª Região\nMilitar), fiéis a Lott, frustrou a possibilidade de resistência e\ndefiniu a situação, tornando inócuo o encontro de Jânio com Eduardo\nGomes, às 15 horas do dia 11.\n\nNeste mesmo dia, a Câmara passou a buscar uma solução política para a\ncrise, discutindo a moção apresentada pela aliança PSD-PTB que,\ncom****base no artigo 79 da Constituição, declarava Carlos Luz impedido\nde exercer a presidência. O Congresso aprovou o impedimento e, seguindo\na ordem constitucional de sucessão, empossou o vice-presidente do\nSenado, Nereu Ramos, na chefia do governo. Tentando aproveitar-se desse\ndesfecho, o prefeito Lino de Matos e grupos paulistas de oposição\narticularam o afastamento de Jânio, mas o plano não obteve êxito, em\ngrande parte devido à não adesão do general Falconière.\n\nNo dia 12, Jânio e o presidente do Tribunal de Justiça de São Paulo\ndivulgaram manifesto afirmando que aguardavam o desenrolar dos\nacontecimentos, e se mantinham fiéis à legalidade constitucional.\nFalconière considerou essa declaração ambígua e exigiu um esclarecimento\ndo governo estadual, que acabou por se pronunciar publicamente a favor\ndo movimento político-militar chefiado pelo general Lott.\n\nA crise voltou a agravar-se no dia 21, quando Café Filho pleiteou sua\nvolta à presidência. Reunida em sessão extraordinária, a Câmara dos\nDeputados decidiu na madrugada do dia 22, por 179 votos contra 94, pelo\nafastamento definitivo do presidente, resultado confirmado pelo Senado\nhoras depois. Houve grande indignação entre os grupos que apoiavam Café\nFilho, levando Jânio a divulgar novo manifesto em que dizia: “Essa\ndecisão receberá um terrível julgamento da história.”\n\nCom a posse de Kubitschek em janeiro de 1956, começou a aplicação do\nPlano de Metas, voltado para acelerar a industrialização com base na\natração de capital estrangeiro para o país. São Paulo foi o estado mais\nbeneficiado com a implantação de novas indústrias e a concentração de\ncrédito, mas, apesar disso, Jânio permaneceu alinhado com a oposição\nudenista em relação a aspectos importantes da política econômica\nvigente. Apoiou em maio de 1957 o movimento dos cafeicultores paulistas,\nparanaenses e mineiros contra o confisco cambial, isto é, o pagamento de\num preço menor pelo dólar obtido com a exportação de café, com a\nretenção da diferença pelo governo federal como forma de diminuir o\ndéficit do balanço de pagamentos e financiar a industrialização. Os\nprodutores chegaram a programar duas vezes, com apoio de Jânio, a\nrealização de uma “marcha da produção” até o palácio do Catete, sede do\ngoverno federal, mas em ambos os casos a manifestação foi cancelada.\n\nA expansão econômica de São Paulo nesse período se refletiu no aumento\nda receita tributária do estado e na criação de condições favoráveis à\ndiminuição do déficit financeiro herdado dos governos anteriores. Com\nCarvalho Pinto na Secretaria de Finanças, a centralização administrativa\naumentou, passando a integrar no planejamento e controle governamentais\nas contas das autarquias e sociedades em que o estado participava como\nacionista. Ao mesmo tempo, as despesas públicas foram submetidas a um\ncontrole mais rígido, inclusive com a limitação da abertura de créditos\nadicionais, e os sistemas de arrecadação e fiscalização tributária foram\nreaparelhados para enfrentar o crônico problema da sonegação fiscal.\nEssas medidas não eliminaram o déficit, mas melhoraram sensivelmente a\nsituação das finanças públicas. A cotação dos títulos emitidos pelo\nTesouro do estado aumentou, o desempenho da Caixa Econômica de São Paulo\nmelhorou muito (voltando a apresentar superávits entre 1955 e 1958,\ndepois de nove anos de déficits consecutivos), o Banco do Estado de São\nPaulo elevou seu lucro líquido e a situação financeira da Companhia de\nArmazéns Gerais do Estado foi recuperada.\n\nNo último ano de sua gestão, Jânio obteve uma receita de 41,6 bilhões de\ncruzeiros, equivalente ao que havia sido arrecadado durante os quatros\nanos da gestão de Garcez. Mesmo assim, permaneceu existindo um déficit\nde 4,49 bilhões e uma dívida flutuante de 19 milhões. O governo Jânio\nconseguiu também aumentar em 1.775km a rede de estradas pavimentadas do\nestado, projetar diversas usinas hidrelétricas, realizar obras nas\nusinas de Salto Grande, Limoeiro, Euclides da Cunha, Barra Bonita,\nJurumirim e Graminha, e ampliar de forma considerável a rede de\nsaneamento básico e abastecimento de água.\n\nSegundo Alcindo Xavier, durante o governo Jânio houve grande limitação à\nliberdade de imprensa, sendo instalados 60 processos contra jornalistas\nsomente na comarca de São Paulo. No fim do seu mandato, Jânio articulou\na candidatura de Carvalho Pinto, lançado pelo PTN e o PSB e apoiado pela\nUDN, o PDC e o PR. Sua campanha foi baseada na imagem de administrador\neficiente e na promessa de combate à inflação, atribuída à corrupção e à\nirresponsabilidade administrativa do governo Kubitschek. Ademar de\nBarros foi novamente lançado pelo PSP, com o apoio dos comunistas e de\num setor do PTB, e Auro de Moura Andrade concorreu pelo PST. Ao mesmo\ntempo, Jânio foi lançado candidato a deputado federal pelo Paraná na\nlegenda do PTB. Havia dúvidas sobre a possibilidade de concorrer em\noutro estado sem se desincompatibilizar do cargo que exercia, mas o\nTribunal Superior Eleitoral (TSE) garantiu sua legenda. Jânio realizou\nentão alguns comícios no Paraná, suficientes para lhe garantir, em 3 de\noutubro de 1958, 78.810 votos, a maior votação proporcional do estado.\n\nA vitória de Carvalho Pinto — com 1.312.017 votos contra 1.105.017 dados\na Ademar e 170.627 a Auro — representou a continuidade do janismo em São\nPaulo. Segundo Alcindo Xavier, quem estava na capital paulista no dia da\nsucessão governamental, 31 de janeiro de 1959, “deve ter ficado admirado\nsem dúvida de que os festejos realizados então não tenham sido tanto em\nhomenagem ao novo governador, que iniciava seu mandato, porém,\nrepresentassem mais uma festiva despedida ao governador cujo mandato\nexpirava. As faixas das ruas, as inscrições nas paredes e nas calçadas\nsaudavam o sr. Jânio Quadros e não o sr. Carvalho Pinto. Mesmo\nautomóveis particulares ostentavam faixas janistas”.\n\nNo auge do seu prestígio, Jânio viajou para o exterior, não tendo\nparticipado de nenhuma sessão do Congresso.\n\nA campanha presidencial\n\nA campanha para a sucessão presidencial de 1960 foi realizada em um\nquadro alterado pelas transformações econômicas e sociais ocorridas\ndurante o governo de Kubitschek, cuja política desenvolvimentista\nprovocou um grande crescimento das cidades. Muitos sociólogos e\nestudiosos de ciências políticas assinalam o crescente divórcio, neste\nperíodo, entre as organizações políticas e as grandes massas urbanas que\nnão encontravam mais sua identidade nos grandes partidos até então\ndominantes, especialmente o PSD e a UDN. Assim, crescia o eleitorado do\nPTB e, ao mesmo tempo, aumentava o peso da classe média, ansiosa por\nsoluções para o problema da inflação e pelo combate à corrupção. Nessas\ncondições, foi sendo construído o mito Jânio Quadros, político desligado\ndos partidos e investido de um messianismo puritano e moralizador,\nexpresso em *slogans* como “Jânio vem aí” e símbolos como a vassoura.\n\nNo dia 20 de abril de 1959, um grupo liderado por Carlos Castilho\nCabral, ex-secretário do Trabalho do governo Jânio e um dos políticos\nque lhe eram mais próximos, reuniu-se na Associação Brasileira de\nImprensa (ABI) no Rio de Janeiro e fundou o Movimento Popular Jânio\nQuadros (MPJQ), lançando nessa ocasião a candidatura do ex-governador de\nSão Paulo à presidência da República. No dia seguinte, a convenção\nnacional do PTN, pequeno partido de expressão apenas paulista, escolheu\nJânio para disputar em sua legenda a sucessão de Kubitschek.\n\nNessa época, os grandes partidos começaram a mobilizar-se em torno da\nquestão sucessória. Juscelino tentou uma aproximação do PSD e do PTB com\na UDN, incentivando a candidatura de Juraci Magalhães, governador da\nBahia e presidente desta última agremiação. Entretanto, essa política\nfoi duramente criticada por Carlos Lacerda, um dos deputados federais\nudenistas de maior projeção, que, expressando uma posição existente em\ndiversos setores do partido, passou a exigir publicamente o apoio\nimediato a Jânio. Mesmo assim, Juraci insistia na própria candidatura,\nadvertindo para a descaracterização resultante do lançamento de um nome\nque não pertencia aos quadros partidários.\n\nFrustrada qualquer tentativa de aproximação entre UDN e PSD, este\npartido escolheu o marechal Henrique Lott como seu candidato e se voltou\npara recompor a aliança com o PTB. A dificuldade estava na escolha do\nvice-presidente. O nome natural para esse cargo dentro da área\ntrabalhista era o de João Goulart, que encontrava fortes resistências\nnos setores mais conservadores do PSD e nos meios militares. Apesar\ndisso, a 11ª convenção do PTB, em 1º de maio de 1959, aprovou o apoio à\nchapa Lott-Goulart.\n\nNessa época, a estrutura extrapartidária do MPJQ funcionava como\nprincipal suporte da candidatura de Jânio. Juarez Távora era o patrono\ndo movimento, Carvalho Pinto o presidente de honra e Castilho Cabral o\npresidente efetivo, enquanto Napoleão de Alencastro Guimarães\n(ex-ministro do Trabalho do governo Café Filho), João Dantas (diretor do\n*Diário de Notícias*)**e**Pedro Xavier de Araújo ocupavam as\nvice-presidências. Segundo Castilho Cabral, “a onda janista começava a\nrolar por todo o Brasil, enquanto os partidos se debatiam em suas\ncontradições e indecisões”. Em setembro, ele viajou para a Bahia a fim\nde oferecer a vice-presidência a Juraci Magalhães, composição preferida\npelo próprio Jânio. Lacerda enviou Raul Brunini para tentar impedir a\nconcretização dessa proposta, mas sua intervenção não foi necessária,\npois o governador da Bahia insistiu em disputar sua indicação para a\npresidência na convenção da UDN.\n\nJânio retornou da Europa no dia 21 de setembro de 1959 e iniciou\nimediatamente sua campanha, que já contava com a adesão do Partido\nLibertador (PL). Em 10 de outubro viajou para Aracaju a fim de\nparticipar de um encontro com governadores do Nordeste e tentar um\nacordo com Juraci, o que foi impossível. No dia 18, a convenção nacional\ndo PDC homologou a candidatura de Jânio e indicou para a\nvice-presidência Fernando Ferrari, dissidente do PTB e fundador do\nMovimento Trabalhista Renovador (MTR).\n\nEm meio a uma crise interna que provocou a renúncia de Lacerda à\nliderança da bancada da UDN na Câmara, a convenção nacional desse\npartido, reunida em 8 de novembro, apoiou a candidatura de Jânio por 205\nvotos contra 83 e escolheu Leandro Maciel, governador de Sergipe, para\ndisputar a vice-presidência. A UDN decidiu também proibir a participação\nde Fernando Ferrari na campanha que seria iniciada no Norte, abrindo\nassim uma crise que levou à renúncia de Jânio, sob a alegação de que sua\nproposta exigia um grau de unidade política ainda não alcançado. Com a\ndivulgação dessa notícia em 27 de novembro, o MPJQ se mobilizou e\nrecolheu em menos de uma semana 360 mil assinaturas pedindo a\nreconsideração daquela decisão, que foi também um dos motivos alegados\npor oficiais da Aeronáutica para promoverem a efêmera revolta de\nAragarças.\n\nEm 5 de dezembro de 1959, Jânio decidiu aceitar sua indicação, obtendo\nmaior autonomia em relação aos partidos que o apoiavam. A partir daí,\nfez campanha ao lado de Ferrari e chegou a estimular a criação dos\ncomitês Jan-Jan, que promoviam o voto em Jânio e João Goulart, conhecido\npelo apelido de Jango. Sempre defendendo a austeridade econômica e o\nsaneamento das finanças públicas, afastou-se um pouco dos limites\ndoutrinários da UDN. Em fevereiro de 1960, embarcou para Cuba a convite\nde Fidel Castro, levando em sua comitiva o senador Afonso Arinos de Melo\nFranco; os deputados federais José Aparecido de Oliveira, Carlos\nCastilho Cabral e Paulo de Tarso Santos; os deputados estaduais\npernambucanos Murilo Costa Rego e Francisco Julião; o deputado estadual\nbaiano Juraci Magalhães Júnior; o publicitário Augusto Marzagão; os\njornalistas João Dantas, Carlos Castelo Branco, Hélio Fernandes, Rui\nMarchucci, Carlos Mesquita, Luís Alberto Muniz Bandeira, Fernando\nSabino, Rubem Braga, Murilo Melo Filho e outros. Nessa ocasião, Jânio\ndefendeu a reforma agrária realizada em Cuba depois da revolução, o\nreatamento de relações diplomáticas com a União Soviética, o\nreconhecimento da República Popular da China e a legalização do PCB.\n\nO crescimento da campanha não impediu o surgimento de nova crise na UDN,\ncom a renúncia de Leandro Maciel em abril de 1960, em protesto contra o\nesvaziamento de sua candidatura no interior do próprio****partido. Em 9\nde junho de 1960, o diretório nacional escolheu o mineiro Mílton Campos\npara substituí-lo.\n\nAinda em 11 de maio, o PR aderiu à campanha de Jânio, cujo programa de\ngoverno pouco a pouco se definia, buscando compatibilizar o combate à\ninflação com a manutenção de altas taxas de crescimento econômico. Jânio\npropunha uma política externa independente que incluía o reatamento de\nrelações diplomáticas com os países socialistas, defendia o controle das\nremessas de lucros para o exterior, o fortalecimento da Petrobras e\natacava a corrupção e as “irresponsabilidades do presidente voador” —\nconforme se referia a Kubitschek. Essa campanha se distanciava muito das\nrealizadas até então pela UDN, mas, ainda assim, era apoiada pelo\nConselho Nacional das Classes Produtoras (Conclap), as principais\nassociações empresariais de São Paulo e importantes grupos industriais,\ncomo o Matarazzo e o Votorantim. Contava também com a simpatia dos\nmilitares identificados em campanhas anteriores com as candidaturas de\nEduardo Gomes e Juarez Távora e dos oficiais pertencentes à Cruzada\nDemocrática. Já a campanha de Lott enfrentava problemas com o pouco\nempenho de líderes do PSD, que se identificavam com a política econômica\nproposta por Jânio, e o visceral anticomunismo do candidato.\n\nJânio venceu as eleições de 3 de outubro de 1960 com 5.636.623 votos\n(correspondentes a 48% do total), contra 3.846.825 dados a Lott (32%) e\n2.195.709 a Ademar de Barros (20%). Setenta e oito por cento dos votos\nde Jânio foram obtidos no Rio de Janeiro, Rio Grande do Sul, Minas\nGerais e São Paulo. No mesmo pleito, João Goulart foi eleito\nvice-presidente com 4.547.010 votos, seguido de Mílton Campos com\n4.237.419 e Fernando Ferrari com 2.137.382. Ao mesmo tempo, a UDN\nconseguiu — sozinha ou em coligações — eleger seis dos 11 novos\ngovernadores: Luís Cavalcanti (Alagoas), Carlos Lacerda (Guanabara),\nNewton Belo (Maranhão), Fernando Correia da Costa (Mato Grosso), José de\nMagalhães Pinto (Minas Gerais) e Pedro Gondim (Paraíba). Entretanto, o\nCongresso Nacional, eleito em 1958, apresentava uma composição em que o\nPSD era majoritário com 35% das cadeiras, seguido pela UDN com 21%, o\nPTB com 20% e o PSP com 8%, configurando uma situação de conflito\npotencial entre Executivo e Legislativo.\n\nLogo depois de eleito, Jânio viajou para a Europa, retornando pouco\nantes de sua posse na presidência da República.\n\nA formação do governo\n\nJânio Quadros e João Goulart foram empossados em 31 de janeiro de 1961.\nContrariando a expectativa geral, o discurso de posse do presidente foi\ndiscreto e gentil, chegando a tecer elogios ao governo anterior. Porém,\nna noite desse mesmo dia, Jânio atacou violentamente o governo\nKubitschek através de cadeia nacional de rádio, atribuindo ao\nex-presidente a prática de nepotismo, ineficiência administrativa e\nresponsabilidade pelos altos índices de inflação e pela dívida externa\nde dois bilhões de dólares.\n\nO ministério de Jânio, composto por políticos da UDN e de outros\npartidos menos expressivos, foi considerado conservador pela imprensa. A\npasta da Fazenda foi entregue a Clemente Mariani (Fazenda), udenista\nbaiano, banqueiro e industrial, ex-ministro da Educação do governo de\nEurico Dutra e ex-presidente do Banco do Brasil no governo de Café\nFilho. No Ministério da Agricultura, Jânio pôs Romero Cabral da Costa,\nusineiro nordestino indicado por Cid Sampaio, então governador de\nPernambuco. Clóvis Pestana, pessedista gaúcho sem expressão nacional,\nocupou o de Viação e Obras Públicas. Edward Catete Pinheiro, filiado ao\nPTN, ficou com o da Saúde. A pasta da Educação coube ao político\nfluminense Brígido Tinoco, dissidente do PSD que entrou para o PSB.\nOscar Pedroso Horta, ex-secretário de Justiça do governo de São\nPaulo****na gestão de Jânio, foi para o Ministério da Justiça. Nas\nRelações Exteriores instalou o líder udenista Afonso Arinos de Melo\nFranco. A pasta de Minas e Energia coube ao também udenista João\nAgripino, da Paraíba. O mineiro Artur Bernardes Filho, do Partido\nRepublicano (PR), ganhou o Ministério da Indústria e Comércio. No\nTrabalho ficou o paulista Francisco Carlos de Castro Neves, filiado ao\nPDC e ligado a Fernando Ferrari; para o Gabinete Civil, Jânio nomeou o\namigo Francisco de Paula Quintanilha Ribeiro.\n\nNos ministérios e principais postos militares predominou a escolha de\nelementos ligados à Cruzada Democrática, que agrupava os oficiais\nadversários do grupo nacionalista. O general Odílio Denis foi nomeado\nministro da Guerra, porque, apesar de ter apoiado o movimento de 11 de\nnovembro de 1955, não se identificava mais com os partidários de Lott. O\nMinistério da Marinha coube ao almirante Sílvio Heck, ligado a Lacerda e\ncomandante do cruzador *Tamandaré*durante a viagem do ex-presidente\nCarlos Luz para Santos em 1955. O brigadeiro Gabriel Grün Moss, ligado a\nEduardo Gomes, foi nomeado para a pasta da Aeronáutica. A chefia do\nGabinete Militar foi confiada ao general Pedro Geraldo de Almeida,\nidentificado com o pensamento da Escola Superior de Guerra (ESG) e\nligado ao coronel Golberi do Couto e Silva, que passou a exercer a\nfunção de chefe de gabinete da secretaria geral do Conselho de Segurança\nNacional. A chefia do Estado-Maior das Forças Armadas (EMFA) coube ao\ngeneral Osvaldo Cordeiro de Farias.\n\nNo início do seu governo, Jânio tomou uma série de pequenas medidas que\nficaram famosas, destinadas a criar uma imagem de inovação dos costumes\ne saneamento moral: proibiu a realização de provas turfísticas em dias\núteis, as rinhas de briga de galo, a propaganda comercial em casas de\nespetáculo ou cinemas, os desfiles de *misses*com maiôs “cavados” e o\nuso de lança-perfumes nos bailes de carnaval; disciplinou o\nfuncionamento de jogos de cartas em sedes de clubes ou entidades; e\nregulamentou a participação de menores em programas de rádio e\ntelevisão. Sua cruzada se estendeu desde logo à administração pública.\nJá em 2**de**fevereiro de 1961, criou cinco comissões de sindicância\npresididas por militares para examinar a atuação das diretorias da\nSuperintendência do Plano de Valorização Econômica da Amazônia (SPVEA),\ndo Instituto Brasileiro de Geografia e Estatística (IBGE), do Instituto\nde Aposentadoria e Pensões dos Marítimos (IAPM), do Instituto de\nAposentadoria e Pensões dos Bancários (IAPB) e da Comissão Federal de\nAbastecimento e Preços (Cofap). Essa medida provocou apreensão dos meios\npolíticos, temerosos da aproximação entre Jânio e os militares e do\nenvolvimento****de nomes da administração de Kubitschek em****processos.\nApesar disso, Jânio não recuou do que denominava “obra de saneamento\nmoral da nação”, determinando mais tarde a abertura de inquéritos na\nSuperintendência da Moeda e do Crédito (Sumoc), na Rede Ferroviária\nFederal, na Companhia Siderúrgica Nacional, na Companhia Vale do Rio\nDoce e em outras repartições governamentais.\n\nO novo governo também investiu fortemente contra alguns direitos e\nregalias do funcionalismo público, começando por instituir, em****16 de\nfevereiro, horário integral de trabalho nas repartições federais, medida\nque seria revista em 8 de agosto. Decidido a realizar cortes nas\ndespesas da união com pessoal, Jânio assinou em 21 de fevereiro um\ndecreto exonerando, a partir de 31 de março seguinte, todos os\nfuncionários civis contratados pelo Executivo ou autarquias federais\ndepois de 1º de setembro do ano anterior. Com o mesmo****objetivo,\nreduziu as vantagens até então asseguradas ao pessoal militar ou do\nMinistério da Fazenda em missão no exterior e extinguiu os cargos de\nadidos aeronáuticos junto às representações diplomáticas brasileiras.\nOutro alvo das primeiras decisões do novo governo foi o contrabando, com\na formação, em 8 de março, de um grupo de trabalho diretamente vinculado\nà Presidência da República e incumbido de propor, no prazo de um mês,\nmedidas drásticas de combate a esse tipo de contravenção.\n\nDo ponto de vista administrativo, Jânio tentou uma maior centralização\nde poderes através da adoção de uma mecânica de decisões que diminuísse\no peso do Congresso Nacional e ampliasse a****esfera de competência da\nPresidência. Além disso, começou a promover reuniões com os governadores\npara discutir suas reivindicações. A primeira, realizada em\nFlorianópolis no dia 24 de março de 1961, contou com a presença de\nLeonel Brizola (do Rio Grande do Sul), Celso Ramos (de Santa Catarina) e\nNei Braga (do Paraná) e resultou na formação de um grupo de trabalho\nvoltado para estudar a viabilidade****de diversos projetos, como a\ncriação do Instituto Nacional do Pinho, do Conselho de Desenvolvimento\nRegional e do Banco Regional de Desenvolvimento, a extensão das estradas\nBR-35, BR-37, BR-14, e a construção de uma rodovia para o escoamento da\nprodução de café das regiões de Paranaguá e Paraná e a organização de\numa empresa mista de energia hidráulica.\n\nA segunda reunião com governadores foi realizada em 19 de abril com a\npresença de Fernando Correia da Costa (Mato Grosso), Mauro Borges\n(Goiás), Abelardo de Alvarenga Mafra (do então território de Rondônia,\nhoje estado) e José Altino Machado (Acre); Nela foi decidida a criação\nde uma escola de agronomia e uma faculdade de filosofia em Campo Grande\n(cidade natal do presidente); o aperfeiçoamento do transporte fluvial, a\nformação do Banco do Estado de Mato Grosso, a aplicação das verbas da\nSPVEA e da Superintendência de Valorização da Fronteira Sudoeste (SVFS);\na construção de uma refinaria de Petróleo em Cuiabá;****a liberação de\nverbas para a instalação de redes de água e esgoto em cidades de Goiás;\na concessão de créditos para a exploração da borracha em Rondônia e no\nAcre; a conclusão da BR-29 e da BR-30; e a****realização de obras\nurbanas em****Porto Velho.\n\nA terceira reunião foi realizada no dia 26 de maio em João Pessoa, com a\npresença de Pedro Gondim (Paraíba) e Cid Sampaio (Pernambuco),\nresultando na liberação de verbas federais para a Universidade da\nParaíba, os hospitais de João Pessoa e do Câncer, o Ginásio Industrial e\no programa de eletrificação de áreas rurais.\n\nFinalmente, Jânio encontrou-se em 29 de junho no Rio com Carlos Lacerda\n(Guanabara), Carvalho Pinto (São Paulo) e Celso Peçanha (Rio de\nJaneiro). O primeiro estado recebeu verbas para água, esgoto, favelas,\nhospitais, prevenção de enchentes, assistência ao menor, turismo,\npenitenciária, educação e indústria, num total de quatro bilhões****de\ncruzeiros. O estado do Rio foi contemplado com 1,3 bilhão de cruzeiros,\npara aplicar em programas de industrialização de frutas, instalação de\nfrigoríficos em Macaé, construção de uma fábrica de papel em Magé,\ncriação de escolas de agronomia, serviço social e filosofia em Campos e\nconstrução de uma usina termoelétrica também nesse município, além de\ntornar-se um estado prioritário para efeito de financiamento da Carteira\nde Colonização do Banco do Brasil. São Paulo recebeu 12 bilhões\ndestinados à usina de Urubupungá e quinhentos milhões para a instalação\nde cursos primários e técnicos.\n\nAtravés dessas reuniões e da instalação de subgabinetes da presidência\nda República em diversos estados, Jânio tentou reforçar os\nvínculos****diretos entre as diversas instâncias do Poder Executivo,\nchegando a formar o Serviço Nacional de Municípios (Senam) para levar\nesse processo até os poderes de âmbito local. Entretanto, essa\nperspectiva centralizadora contrastava com a ausência de um planejamento\neconômico global, já que a Comissão Nacional de Planejamento (Coplan) só\nveio a ser formulada pouco antes do fim do governo.\n\nCom o fortalecimento do movimento sindical e das ligas camponesas e o\ncrescimento dos conflitos sociais, começou a ganhar corpo um movimento\npolítico a favor das chamadas reformas de base e de uma reorganização\ninstitucional. O próprio Jânio enviou mensagem ao Congresso em março de\n1961 afirmando que “um corpo de leis adotadas para determinados estágios\nda nossa vida econômico-social, totalmente diversos do atual,\napresenta-se hoje como entrave ao desenvolvimento do país, estimulando a\nsua violação, direta ou indiretamente, através de construções engenhosas\ndos advogados, comerciantes e industriais, mas de legalidade\ndiscutíveis”. Entretanto, tendo contra si a maioria do Congresso,\narticulada em torno do bloco PSD-PTB-PSP, Jânio teve que negociar com\nsetores dissidentes desses partidos cada aspecto de seu projeto. Seu\ntrabalho foi facilitado pela fluidez do bloco majoritário, que produzia\ncomposições diversas de acordo com o assunto em pauta. Essas divisões\napareceram, por exemplo, em torno da proposta da política externa\nindependente e do controle da remessa de lucros para o exterior. O\npróprio movimento sindical estabeleceu relação ambígua com o governo,\napoiando a política externa, combatendo a econômica e divergindo, em sua\nmaioria, da proposta de abolição do imposto sindical, sustentada pelo\nministro Castro Neves.\n\nA política econômico-financeira\n\nA economia brasileira ainda experimentava em 1961 uma taxa de\ncrescimento em torno de 7% ao ano, mas as relações com o exterior\nacusavam um déficit crescente, a dívida externa aumentava e o déficit\norçamentário atingia ao ano a marca de 113 bilhões de cruzeiros, que\nseriam cobertos através da emissão de moeda, estimulando assim o\ncrescimento da inflação. Clemente Mariani, adepto da corrente\nmonetarista, definiu como principais metas da sua gestão a correção do\ndesequilíbrio orçamentário e do déficit do balanço de pagamentos, o que\nexigia contenção dos gastos públicos, restrição do crédito e estímulo às\nexportações. Segundo o ministro da Fazenda, era necessário reduzir\nimediatamente o déficit orçamentário para conseguir eliminá-lo nos\nexercícios seguintes, de modo a dispensar ou diminuir drasticamente as\nemissões, evitar o subsídio do câmbio de importações e adotar uma\npolítica cambial capaz de melhorar a situação do balanço de pagamentos,\nfacilitando a obtenção de novos créditos.\n\nEm 13 de março de 1961, Jânio anunciou os rumos de sua política\neconômica em discurso transmitido por uma cadeia de rádio e televisão:\n“Com um déficit potencial de 240 milhões de cruzeiros, a situação é mais\ndura do que se pensava... Daí os sacrifícios que pedi e continuarei\npedindo. As duas jornadas do funcionalismo, o corte de 30% nas despesas\nministeriais e autárquicas, o rigor imposto na direção das empresas\nindustriais do governo e, por isso, do povo, a redução dos gastos nas\nforças armadas, inclusive sua representação no exterior, a diminuição\ndos vencimentos dos diplomatas e a supressão dos escritórios comerciais\nsão exemplos de economia.” Anunciou também uma reforma cambial voltada\npara a eliminação da “mentira do câmbio” e prometeu rever a Lei\nAntitruste para torná-la mais efetiva: “O desenvolvimento econômico só é\nadmissível em ambiente de justiça social. A Lei Antitruste, a de reforma\nbancária, a de lucros extraordinários, a do imposto de renda e a de\nremessa de lucros, alguns exemplos, vão ser propostas ou revistas pelo\ngoverno. Dentro de pouco tempo, estarão encaminhadas ao Congresso\nNacional.”\n\nA reforma cambial anunciada por Jânio foi implementada através das\ninstruções nº 204, 205 e 208 da Sumoc, que aumentaram o preço do dólar\nde 90 para duzentos cruzeiros e suprimiram os subsídios para a\nimportação, unificando as taxas de câmbio. A Instrução nº 204 abriu\nexceções para a exportação de café e cacau e a importação de trigo,\npetróleo e derivados, papel e artigos de imprensa, fertilizantes,\ninseticidas e bens de produção sem similar nacional, e a Instrução nº\n205 substituiu o confisco cambial por uma contribuição fiscal de 22\ndólares por saca de café exportado. Mas, em junho de 1961, a Instrução\nnº 208 determinou a aplicação da taxa normal de câmbio nas operações com\ntodos aqueles produtos.\n\nEssa reforma cambial atendeu aos interesses do setor exportador e dos\ncredores internacionais, punindo fortemente os grupos nacionais que\nhaviam contraído financiamento externo durante a vigência da taxa\nanterior. O sistema anterior, baseado nas importações subvencionadas\natravés de taxas múltiplas, vinha sendo combatido pelo setor exportador,\ntransformado em financiador indireto do processo de industrialização.\nAlgumas indústrias, sobretudo as que até aí utilizavam insumos\nimportados com subvenção, tiveram que elevar preços, mas****esses\nreajustes significaram também um estímulo para a industrialização\nsubstitutiva de importações. Apesar da melhoria obtida na situação\norçamentária, a reforma cambial foi combatida pelos partidos de\noposição, especialmente os vinculados às causas trabalhistas, pois\nimplicou corte de subsídios para artigos essenciais de consumo popular\ncom o conseqüente aumento do custo de vida.\n\nEntretanto, esse conjunto de medidas do governo Jânio foi muito bem\nrecebido pelos credores estrangeiros e resultou em novos acordos\nfinanceiros negociados por Válter Moreira Sales, Roberto Campos, Miguel\nOsório de Almeida e João Dantas nos Estados Unidos, Alemanha, França,\nItália, Inglaterra, Holanda, Suíça e Suécia. O National Economic\nDevelopment Bank, o Export-Import Bank e outros credores do Brasil\naceitaram prorrogar pagamentos de parcelas da dívida e conceder novos\ncréditos no valor total de 726 milhões de dólares, sem contar o\nfinanciamento para a compra do trigo.\n\nEm 15 de março de 1961, Jânio enviou ao Congresso Nacional o projeto da\nnova lei antitruste e da criação da Comissão Administrativa de Defesa\nEconômica (CADE), vinculada ao Ministério da Justiça e voltada para\n“embaraçar a criação ou funcionamento de empresas que pretendam\nmonopolizar certa atividade, ou estabelecer a exclusividade de\ndeterminada produção, ou distribuição de mercadorias, com o objetivo de\ncontrolar o mercado interno”. O projeto encontrou resistências dentro do\npróprio primeiro escalão do governo e foi combatido também pela Conclap,\nque enviou memorial ao presidente da Câmara dos Deputados, Ranieri\nMazzilli, afirmando que “os maiores abusos do poder econômico neste país\nforam praticados até hoje pelo próprio Estado”.  A lei antitruste só\nseria aprovada durante o governo de João Goulart.\n\nNo dia 7 de julho, Jânio reuniu todo o seu ministério para estudar as\nreformas do imposto de renda e dos códigos penal, civil e de\ncontabilidade. À noite, anunciou ao país o envio ao Congresso do projeto\nde lei sobre a remessa de lucros para o exterior. Assim como o anterior,\neste projeto também suscitou grande polêmica dentro do próprio governo,\nonde Clemente Mariani propunha uma linha de favorecimento ao ingresso de\ncapital estrangeiro, oposta àquela defendida por João Agripino, ministro\nde Minas e Energia. A Lei da Remessa de Lucros só seria aprovada em\nsetembro de 1962, durante o governo João Goulart, na forma de um\nsubstitutivo apresentado pelo deputado Celso Brant, com características\nainda mais restritivas do que o projeto inicial enviado por Jânio.\n\nEm agosto, diante da elevação do custo de vida provocada pela reforma\ncambial e das dificuldades de conciliar o programa antiinflacionário de\nClemente Mariani com o crescimento da economia, Jânio chegou a criticar\nviolentamente seu ministro da Fazenda. Aproximou-se então****dos\neconomistas da escola desenvolvimentista, defensores da tese de que\nmedidas de combate à inflação tornavam-se inadequadas fora de um plano\nmais amplo, capaz de assegurar a ampliação dos investimentos públicos e\na continuidade do processo de industrialização. Clemente Mariani chegou\na enviar uma carta de demissão ao presidente, que solicitou sua\npermanência no cargo até a realização da Conferência de Punta del Este,\nno Uruguai, prevista para a primeira quinzena de agosto, com o\npatrocínio do Conselho Interamericano Econômico e Social. Concordando em\npermanecer até agosto, Mariani exerceria suas funções até o fim do\ngoverno de Jânio, no final desse mesmo mês.\n\nA política externa\n\nEnquanto Jânio Quadros desenvolvia uma política interna considerada\nconservadora e plenamente aceita pelos Estados Unidos, procurou afirmar\nno plano externo os princípios de uma política independente e aberta a\nrelações com todos os países do mundo. Essa orientação provocou\nprotestos de inúmeros setores e grupos que o apoiavam, inclusive os\njornais *O Globo, O Estado de S. Paulo* e*Tribuna da\nImprensa,*defensores da manutenção do alinhamento automático com os\nEstados Unidos.\n\nUm mês depois de sua posse, Jânio reuniu-se com Adolf Berle Junior,\nenviado especial do governo norte-americano, mas negou-se a apoiar a\nincursão armada que os Estados Unidos estavam preparando contra Cuba,\ndeclarando publicamente sua oposição a qualquer ação intervencionista. A\ninvasão foi realizada no dia 16 de abril, levando Jânio a afirmar: “O\nBrasil, reiterando sua decisão inabalável de defender neste continente e\nno mundo os princípios de autodeterminação dos povos e de absoluto\nrespeito à soberania das nações, manifesta a sua mais profunda apreensão\npelos acontecimentos que se desenrolam em****Cuba.” Apesar da derrota\ndas tropas invasoras, depois de dois dias de luta, o governo\nnorte-americano continuou a articular outras formas de pressão sobre\nCuba para preparar as condições de uma nova intervenção. O embaixador\nJohn Moors Cabot tentou insistentemente obter a concordância do governo\nbrasileiro para uma ação efetiva da Organização dos Estados Americanos\n(OEA) contra Cuba, mas não obteve êxito.\n\nJânio também levou adiante seu projeto de estabelecer relações com as\nnações do bloco socialista. De imediato, determinou o restabelecimento\nda validade dos passaportes brasileiros para estes países e enviou duas\nmissões comerciais ao Leste europeu: uma, chefiada por Paulo Leão de\nMoura, foi à União Soviética e a outra visitou a Bulgária, Hungria,\nRomênia, Iugoslávia e Albânia, sob a chefia de João Dantas. Em maio,\nJânio recebeu no palácio do Planalto a primeira missão comercial da\nRepública Popular da China enviada ao Brasil e o mesmo fato se repetiu\nem julho com a missão soviética de boa vontade, que pretendia\nincrementar o intercâmbio comercial e cultural. As primeiras\nprovidências para o reatamento diplomático entre os dois países\ncomeçaram a ser tomadas em 25 de julho, mas este processo só seria\nconcluído durante o governo Goulart.\n\nPretendendo ampliar a presença brasileira na África, o governo\nbrasileiro abriu embaixadas no Senegal, Gana, Nigéria e Zaire, ao mesmo\ntempo em que condenava implicitamente o colonialismo remanescente nesse\ncontinente, reafirmando sua posição a favor da autodeterminação dos\npovos. Apesar das posições contrárias ao intervencionismo, Jânio ficou\napreensivo com a aproximação da independência das Guianas e solicitou\npor escrito a vários auxiliares civis e militares a discussão de medidas\nvoltadas para evitar que esses países se tornassem comunistas e garantir\npara o Brasil a posição de mediador entre eles e as antigas metrópoles.\n\nAs relações entre os países americanos e os Estados Unidos foram\ndebatidas em agosto na reunião extraordinária do Conselho Interamericano\nEconômico e Social, conhecida como Conferência de Punta del Este. Na\ntentativa de impedir a repetição da revolução cubana, os Estados Unidos\nhaviam planejado aumentar sua ajuda econômica ao continente, lançando a\nAliança para o Progresso, programa que mobilizaria cerca de 20 bilhões\nde dólares no período de dez anos. Ao fim da reunião, Ernesto Che\nGuevara, ministro da Economia de Cuba (único país que não assinou a\nCarta de Punta del Este), viajou para a Argentina e, depois, para o\nBrasil a fim****de agradecer a posição tomada por esses dois países de\nimpedir a discussão de qualquer tema político na conferência. Jânio\naproveitou o encontro com Guevara em 18 de agosto para pedir, com êxito,\na libertação de 20 padres espanhóis presos em Cuba e discutir as\npossibilidades de intercâmbio comercial através dos países do Leste\neuropeu. No dia seguinte, condecorou o ministro cubano com a Ordem\nNacional do Cruzeiro do Sul, o que provocou a indignação dos setores\ncivis e militares mais conservadores. Em represália, Carlos Lacerda,\ncrítico contumaz da política externa de Jânio, entregou as chaves do\nestado da Guanabara ao líder anticastrista Manuel Antônio de Verona e\nvários oficiais devolveram ao governo suas condecorações.\n\nA renúncia\n\nPassados os primeiros seis meses do mandato, Jânio começou a amadurecer\na idéia de promover “uma reforma muito séria e profunda no país”,\nsegundo as palavras de Pedroso Horta. Em meados de agosto, o ministro da\nJustiça chegou a afirmar a Carlos Lacerda: “O Jânio acha que é\nimpossível governar com o Congresso e pretende fazer uma reforma na\nConstituição que reforce o Poder Executivo”, esclarecendo ainda que este\nprojeto exigiria a decretação de um estado de exceção. Na noite do dia\n24, o governador da Guanabara proferiu violento discurso pela televisão\nafirmando que fora convidado por Pedroso Horta para participar de um\ngolpe em apoio às reformas institucionais pretendidas pelo presidente:\n“A crise resume-se em uma trama palaciana, de homens medíocres, tentando\nresolver por meios ilegítimos as dificuldades do regime brasileiro. O\nmotivo do nosso protesto é a esperança de que o barulho de tantas vozes\nacorde a consciência do presidente da República que jaz adormecida no\nermo de Brasília... Constatei que não tinha o direito de silenciar\ndiante da trama. Quero ser, pois, o intérprete do povo carioca, que é a\nsentinela que deve alertar todos, mesmo com o sacrifício próprio.” Ainda\nsegundo a denúncia de Lacerda, o governo federal tentara obter seu apoio\npara, em seguida torná-lo intermediário junto ao ministro da\nAeronáutica, já que os titulares das pastas do Exército e da Marinha\nestavam cientes da idéia.\n\nA atitude de Lacerda causou grande impacto. Na madrugada do dia 25 de\nagosto, os deputados José Maria Alkmin e Paulo Lauro redigiram um\nrequerimento a Pascoal Ranieri Mazzilli, presidente da Câmara,\nsolicitando a convocação do ministro da Justiça e Negócios Interiores,\n“a fim de prestar, urgentemente, informações a esta casa do Congresso\nNacional sobre os fatos graves denunciados ontem pelo sr. governador da\nGuanabara através das estações de televisão e rádio daquele estado”. Ao\nmesmo tempo, começou a circular a notícia de que outras convocações\nseriam feitas, inclusive a do próprio presidente.\n\nJânio tomou conhecimento das denúncias de Lacerda às seis horas do dia\n25, através do *Correio Brasiliense.*Chamou então Quintanilha Ribeiro e\nmanifestou sua decisão de renunciar. Rumou em seguida para o palácio do\nPlanalto, sede do governo, onde encontrou o general Pedro Geraldo de\nAlmeida, que confirmou as informações e acrescentou que estava sendo\npreparado um manifesto de civis e militares em repúdio à política\nexterna do governo, além de uma devolução coletiva de medalhas de\noficiais superiores em protesto contra a condecoração de Che Guevara.\nJânio reafirmou sua disposição de renunciar, declarando: “A conspiração\nestá em marcha, mas vergar eu não vergo.” Depois de alguma relutância,\ndecidiu manter sua agenda normal, que previa seu comparecimento às oito\nhoras à cerimônia em homenagem ao Dia do Soldado, onde discursou em\ndefesa da sua política externa e procurou tranqüilizar os militares,\nreafirmando seu compromisso com os ideais democráticos e cristãos e\nrepudiando qualquer forma de “infiltração ideológica ou subversão\npolítica”.\n\nDe volta ao palácio do Planalto, informou a Pedroso Horta, Quintanilha\nRibeiro, José Aparecido de Oliveira e ao general Pedro Geraldo de\nAlmeida sua decisão de renunciar em caráter irrevogável, pedindo que o\ndeixassem sozinho para redigir seu último documento como presidente. Não\nhouve ponderações. Solicitou também o comparecimento dos ministros\nmilitares a seu gabinete e ouviu sem****se alterar seus pedidos para que\nrecuasse da decisão. Agradeceu em seguida a colaboração de todos e\nafirmou: “Minha última instrução, senhores ministros, é que mantenham a\nordem em todo o país. Tomem suas providências.” Ao deixar seu gabinete\nàs 10:25h, Jânio ordenou que o ministro da Justiça levasse o documento\nde renúncia ao Congresso Nacional às 15 horas e se comunicasse com os\ngovernadores a fim de garantir a manutenção da ordem em todo o país.\n\nA mensagem ao Congresso era formada de dois textos diferentes. O\nprimeiro, extremamente sucinto, dizia: “Nesta data, e por este\ninstrumento, deixando com o ministro da Justiça as razões de meu ato,\nrenuncio ao mandato de presidente da República. Brasília, 25 de agosto\nde 1961.” No anexo, explicava seu gesto: “Desejei um Brasil para os\nbrasileiros, afrontando, neste sonho, a corrupção, a mentira e a\ncovardia que subordinam os interesses gerais aos apetites e às ambições\nde grupos ou indivíduos, inclusive do exterior. Sinto-me, porém,\nesmagado. Forças terríveis levantam-se contra mim e me intrigam ou\ndifamam, até com a desculpa da colaboração. Se permanecesse, não\nmanteria a confiança e a tranqüilidade, ora quebradas, indispensáveis ao\nexercício da minha autoridade.” Depois de fazer alguns apelos e\nagradecimentos, o presidente encerrava o documento se dirigindo às\nforças armadas, “cuja conduta exemplar em todos os instantes, proclamo\nnesta oportunidade”.\n\nJânio embarcou em seguida em um avião que o conduziu à base aérea de\nCumbica, em São Paulo, onde recebeu visitas e telefonemas de vários\ngovernadores, inclusive Leonel Brizola, do Rio Grande do Sul,\ngarantindo-lhe apoio. Na *História do povo brasileiro,*escrita em\nparceria com o próprio Jânio, Afonso Arinos de Melo Franco afirmou: “A\ncrise deflagrada fora inevitável. Entendia o presidente, e com ele os\nministros mais diretamente ligados às instituições, que a administração\npública se fazia cada vez mais difícil, senão impossível. O governo\nencontrava-se desaparelhado para a obra a que se propusera, também\nporque lhe faltava a indispensável sustentação parlamentar. O mais grave\nera a discrepância entre as exigências político-administrativas do país,\nde um lado, e a débil estrutura político jurídica, constitucional e\nlegal, de outro. Havia tempos o próprio presidente, o ministro Pedroso\nHorta e os ministros militares — particularmente o general Denis, cujo\nprestígio no Exército era****incontestado —, convencidos dessa verdade,\nexaminavam fórmulas tendentes a fortalecer a autoridade governamental\nsem o sacrifício da mecânica democrática. O que aconteceu, então, foi se\nfrustrarem esses anseios de reforma institucional, ficando o governo à\nfrente do seguinte dilema: permitir seu aviltamento pela Câmara, que não\nse achava em consonância com o pensamento político do país, nem queria\nser o instrumento hábil para as reformas, até porque estava interessada\nem manter a estrutura e os privilégios vigentes, ou implantar a\nditadura. À ditadura, recusou-se o presidente.”\n\nEntretanto, no mesmo livro, Afonso Arinos sugere que o presidente tinha\nem mente um projeto diferente da renúncia pura e simples: “Seu\nraciocínio foi o seguinte: primeiro, operar-se-ia a renúncia; segundo,\nabrir-se-ia o vazio sucessório, visto que a João Goulart, distante na\nChina, não permitiriam as forças militares a posse, e destarte ficaria o\npaís acéfalo; terceiro, ou bem se passaria a uma fórmula em conseqüência\nda qual ele mesmo emergisse como primeiro mandatário, mas já dentro do\nnovo regime institucional, ou bem, sem ele, forças armadas se\nencarregariam de montar esse novo regime, cabendo, em conseqüência,\ndepois, a um outro cidadão — escolhido por qualquer via — presidir o\npaís sob novo esquema viável e operativo. Como, em tudo, o que importava\nera a reforma institucional, não o indivíduo ou os indivíduos que a\npromovessem, sacrificando-se ele ou não se sacrificando, o essencial\niria ser atingido. O plano, porém, falhou exatamente na vacilação dos\nchefes militares.”\n\nHá, entretanto, outras versões veiculadas por pessoas igualmente\npróximas de Jânio nessa época. Segundo Cordeiro de Farias, “a renúncia\nfoi apenas uma explosão emocional. Ele não se controlou diante das\ndificuldades do momento e renunciou. Ele não havia preparado nada. Basta\nver a surpresa que o gesto causou a seus auxiliares mais diretos como\nPedroso Horta, Quintanilha e José Aparecido”. O secretário de imprensa\nde Jânio, Carlos Castelo Branco, reproduziu assim as palavras do\npresidente na base aérea de Cumbica: “Não farei nada para voltar, mas\nconsidero minha volta inevitável. Dentro de três meses, se tanto, estará\nna rua, espontaneamente, o clamor pela reimplantação do nosso governo. O\nBrasil, no momento, precisa de três coisas: autoridade, capacidade de\ntrabalho, e coragem e rapidez nas decisões. Atrás de mim não fica\nninguém, mas ninguém, que reúna esses três requisitos.”\n\nA crise da sucessão\n\nRanieri Mazzilli tomou conhecimento do documento de renúncia do\npresidente em uma reunião com os três ministros militares, realizada\nainda no dia 25 no gabinete do general Denis. De volta à sede da Câmara,\nsoube que Auro de Moura Andrade, presidente em exercício do Senado,\nconvocara, em caráter extraordinário, uma sessão conjunta do Congresso\npara as 16:45h. A presença de 46 senadores e 230 deputados garantiu o\nquórum**necessário para a reunião, que durou apenas 20 minutos, pois,\nsegundo esclareceu Auro de Moura Andrade, a renúncia era um ato de\nvontade, cabendo ao Congresso apenas tomar conhecimento dela. O senador\nconcluiu afirmando que, em virtude da ausência do vice-presidente do\nterritório nacional, a chefia do governo federal passaria\nprovisoriamente ao presidente da Câmara dos Deputados, Ranieri Mazzilli,\ncuja posse estava marcada para as 17:15h no palácio do Planalto.\n\nEstava deflagrada uma grave crise política. A posse de João Goulart,\nentão em visita oficial à China, seria o desdobramento legal da\nrenúncia, mas enfrentava o veto dos três ministros militares, que o\nconsideravam comprometido com o movimento sindical e grupos de esquerda.\nAs primeiras tentativas de superar a crise ainda giravam em****torno de\nevitar a concretização da renúncia. Muitos líderes políticos, inclusive\nos governadores de Minas (Magalhães Pinto), São Paulo (Carvalho Pinto),\nParaná (Nei Braga) e Goiás (Mauro Borges), viajaram até a base de\nCumbica para tentar convencer Jânio a voltar atrás, mas não obtiveram\nêxito.\n\nNo próprio dia 25, ocorreram as primeiras manifestações populares e, a\npartir das 16:30h, os ferroviários da Leopoldina decretaram greve. No\ndia seguinte foram divulgados dois importantes manifestos: o primeiro,\nassinado por dirigentes sindicais da Guanabara, acusava as forças\ninternacionais e os grandes grupos econômicos pela renúncia e oferecia\ntodo o apoio para que Jânio retornasse ao poder; o segundo, assinado\npelos governadores do Espírito Santo, Goiás, Minas Gerais, Paraná, Piauí\ne São Paulo, exortava o Congresso a não aceitar a renúncia. Ao mesmo\ntempo, o governo da Guanabara estabeleceu censura aos jornais e colocou\nsuas forças de segurança em prontidão, quando o governo gaúcho começava\num****amplo movimento em****defesa da legalidade, isto é, da posse de\nJoão Goulart, apoiada também****pelo****marechal Lott, que foi preso\ndepois de divulgar um****manifesto a favor do respeito à Constituição.\n\nNo dia 27, o presidente demissionário embarcou em um navio com destino a\nLondres, levando os chefes militares a cogitarem de enviar um barco de\nguerra para forçar seu desembarque em Salvador, onde seria embarcado em\num avião militar de volta a Brasília. Este plano não foi concretizado.\nEm meio à ameaça de golpe, o Congresso continuou reunido, tomando\nconhecimento no dia 28 da mensagem enviada pelos ministros militares ao\nsenador Auro de Moura Andrade: “Na apreciação da atual situação criada\npela renúncia do presidente Jânio da Silva Quadros, os ministros\nmilitares, na qualidade de chefes das forças armadas e responsáveis pela\nordem interna, manifestaram a absoluta inconveniência, por motivos de\nsegurança nacional, do regresso ao país do vice-presidente João Belchior\nMarques Goulart.” Entretanto, essa posição não refletia um consenso\nentre os chefes militares mais importantes do país, pois****o general\nJosé Machado Lopes, comandante do III Exército, avisou ao general Denis\nque só receberia ordens do chefe constitucional das forças armadas, João\nGoulart. Também a maioria dos governadores se manifestou a favor da\nsucessão nos marcos legais, enquanto as manobras militares cresciam em\nintensidade.\n\nDiante do impasse que ameaçava se transformar em guerra civil, os\nparlamentares formaram uma comissão mista de seis senadores (Jefferson\nde Aguiar, Benedito Mário Calasans, Heribaldo Vieira, Argemiro\nFigueiredo, Manuel Novais e Camilo Nogueira da Gama) e seis deputados\n(Antônio Ferreira de Oliveira Brito, Paulo Fernandes, Plínio Salgado,\nPaulo Lauro, Antônio de Novais Filho e Alô Guimarães), encarregada de\ndar um parecer sobre o veto dos ministros militares e apresentar uma\nproposta de superação da crise. Desde o início, essa comissão se colocou\ncontra a aceitação do veto. Sabedores dessa inclinação, os ministros\nmilitares lançaram em 30 de agosto violento manifesto afirmando que\nGoulart sempre promovera agitações sociais e facilitara a infiltração\ncomunista e que, se assumisse a presidência “em um regime que atribui\nampla autoridade e poder pessoal ao chefe do governo”, o país iria\ncaminhar para “o caos, a anarquia e a luta civil”. Ainda segundo o\ndocumento, “as próprias forças armadas, infiltradas e domesticadas,\ntransformar-se-iam, como tem acontecido noutros países, em simples\nmilícias comunistas”.\n\nNessa mesma data, o Congresso aprovou, por 264 votos contra dez, o\nparecer da comissão mista, que recomendava a adoção do regime\nparlamentarista através de uma emenda constitucional como forma de\nviabilizar a posse de Goulart. Foi formada então uma comissão especial,\nsob a presidência do deputado Antônio Chagas Freitas, para formalizar a\nproposta de reforma da Constituição.\n\nJoão Goulart desembarcou em Porto Alegre em 1º de setembro, quando as\nmanobras militares ainda eram intensas, envolvendo efetivos das três\nforças armadas, das forças estaduais e de voluntários. No dia seguinte,\no Congresso aprovou o Ato Adicional, promulgado em 3 de setembro,\ngarantindo o mandato de Goulart até 31 de janeiro de 1966 em regime\nparlamentarista. Foi definida também a realização de um plebiscito “nove\nmeses antes do termo do atual período presidencial” para que o povo\ndecidisse sobre a manutenção do sistema parlamentarista ou a volta ao\npresidencialismo. Ante a concordância dos ministros militares com essa\nfórmula, Goulart foi finalmente empossado no dia 7 de setembro.\nEntretanto, a crise não foi solucionada, pois enquanto as forças\nreformistas tentavam antecipar o plebiscito sobre a volta do\npresidencialismo, os setores conservadores começavam a articular um\nmovimento político-militar para derrubar o novo governo. Ao mesmo tempo\no aprofundamento da crise econômica e os conflitos sociais contribuíam\ndecisivamente para a criação de uma atmosfera tensa em todo o país.\nNesse contexto, foram realizadas as eleições estaduais de outubro de\n1962.\n\nNovo confronto com o ademarismo\n\nJânio retornou da Europa a tempo de disputar o governo paulista e foi\nlançado pelo PTN e MTR, tendo José Vicente Faria Lima como companheiro\nde chapa. Entretanto, além do desgaste provocado pela renúncia, o\nex-presidente não conseguiu unir novamente as forças que o haviam\napoiado na eleição anterior, pois o governador Carvalho Pinto articulara\no lançamento da chapa José Bonifácio Coutinho Nogueira-Laudo Natel,\napoiada pela coligação PR-PDC-UDN-PTB-PRP. Outro elemento significativo\nem meio à profunda modificação do quadro político paulista depois da\nrenúncia era a recuperação de Ademar de Barros, mais uma vez lançado\ncandidato do PSP com o apoio do PSD e tendo Teotônio Monteiro de Barros\ncomo companheiro de chapa. Nessa época, Ademar assumia o papel de\ndefensor da ordem e da tranqüilidade sociais, ameaçadas “pelos fermentos\nda subversão” patrocinada, segundo os setores conservadores, pelo\ngoverno Goulart. O PSB fechou o espectro de candidaturas lançando a\nchapa Cid Franco-Remo Forli, sem nenhuma chance de vitória.\n\nAdemar venceu o pleito de outubro de 1962 por pequena margem,****obtendo\n1.249.414 votos contra 1.125.941 dados a Jânio, 722.823 a José Bonifácio\ne 35.653 a Cid Franco. No mesmo****pleito, Laudo Natel foi eleito\nvice-governador com 1.200.807 votos contra 944.604 dados a Faria Lima.\nSegundo pesquisa de Francisco Weffort, Jânio recebeu a maioria dos votos\nna****capital e, “no interior, tendia a ser mais votado quanto maior a\nimportância urbana e industrial” da região.\n\nCom****esse resultado, Jânio sofreu sua primeira derrota eleitoral e\nficou em uma posição relativamente marginal à vida política nacional até\na eclosão do movimento político-militar que derrubou o governo Goulart\nem 31 de março de 1964.\n\nA cassação e a retomada da atividade política\n\nOs chefes do movimento vitorioso indicaram o nome do general Humberto\nCastelo Branco para ocupar a presidência da República. Antes do\nreferendo formal do Congresso, o próprio Castelo solicitou a Jânio que\nredigisse um****documento pedindo apoio dos civis para sua investidura\nna chefia do governo. A concordância de Jânio e a posterior publicação\ndeste texto pela imprensa não impediram que, com base no Ato\nInstitucional nº 1 (AI-1), ele tivesse seus direitos políticos cassados\nem 10 de abril de 1964 por decisão do Comando Supremo da Revolução,\nintegrado pelo general Artur da Costa e Silva, o almirante Augusto\nRademaker e o brigadeiro Francisco de Assis Correia de Melo.\n\nJânio passou então a dedicar-se a atividades privadas. Foi coordenador\nde uma coleção intitulada *Gramática da língua portuguesa,* que**obteve\ngrande sucesso editorial; junto com Afonso Arinos de Melo Franco,\nescreveu a *História do povo brasileiro*,**publicada em 1967, e, com\nUbiratan Rosa, escreveu o *Dicionário prático da língua\nportuguesa;*participou de alguns escritórios de advocacia sediados na\ncapital paulista e exerceu atividades de consultoria a diversas\nempresas. Além disso, dedicou-se à pintura, chegando a realizar uma\nexposição de cerca de 40 obras em uma galeria paulista. Nesse período,\nparticipou da vida política de forma moderada e indireta, acompanhando\ncandidatos e distribuindo declarações à imprensa, assinadas por sua\nesposa Eloá Quadros. Em 1968, desrespeitou a proibição de fazer\npronunciamentos políticos e foi punido com um confinamento em Corumbá\n(MS), então no estado de Mato Grosso, por 120 dias, conforme portaria\nassinada pelo ministro da Justiça, Luís Antônio da Gama e Silva.\n\nCom a política de distensão implantada pelo presidente Ernesto Geisel a\npartir de 1974, Jânio voltou a aparecer com alguma freqüência no\nnoticiário político, respondendo a perguntas sobre seu mandato\npresidencial, emitindo opiniões sobre o movimento de 1964 ou tratando de\ntemas do momento. Criticava sistematicamente o bipartidarismo implantado\nno****país em 1966 e o regime militar, defendendo uma “democracia\nforte”, isto é, uma combinação entre regime centralizado e mecânica\ndemocrática. Em 1976, participou de um comício a favor de Antônio de\nSousa Neto, candidato à prefeitura de Guarujá na legenda da Aliança\nRenovadora Nacional (Arena), ocasião em que reiterou suas críticas ao\nregime, mas enalteceu a “figura límpida e pura do presidente Ernesto\nGeisel, um homem bom, decente, que qualquer um receberia em sua casa”.\nAo longo de 1977 e 1978, passou a defender a convocação de uma\nassembléia nacional constituinte que promovesse a institucionalização do\nmovimento de 1964 e implantasse a “democracia forte”.\n\nEm****entrevista à Rede Bandeirantes de Televisão em setembro de 1978,\nJânio defendeu a adoção do voto distrital e extensivo aos analfabetos.\nProsseguiu em 1979 alternando declarações de elogio e de crítica ao\ngoverno. Manifestou-se em julho desse ano contra a concessão da anistia\nampla, geral e irrestrita reivindicada pela oposição, defendendo que\nesse benefício não atingisse os acusados de ações armadas. Com o início\nda organização de novos partidos políticos no****segundo semestre de\n1979, manifestou simpatia pelo PTB e declarou que apoiaria sua\nreorganização desde que os comunistas fossem mantidos afastados e a\nreferência política do partido fossem as grandes democracias ocidentais.\nSempre ressaltando sua confiança no presidente João Figueiredo, que\nhavia sido empossado em março de 1979, denunciou sistematicamente a\n“infiltração comunista... articulada, inteligente, conduzida de maneira\nhábil, como os comunistas sabem fazer”.\n\nA sigla PTB passou a ser disputada por dois grupos rivais, um liderado\npor Ivete Vargas e o outro por Leonel Brizola. Jânio apoiou o primeiro\ngrupo, vitorioso na disputa pela sigla, ao mesmo tempo em que\nparticipava de articulações sobre a sucessão paulista, prevista para\n1982. Defensor de uma “oposição construtiva”, reuniu-se diversas vezes\ncom o ministro do Planejamento, Antônio Delfim Neto, recebendo duras\ncríticas de expressivos setores oposicionistas. Em 11 de junho de 1980,\nIvete Vargas aventou publicamente a possibilidade de que Jânio viesse a\nser o candidato petebista ao governo de São Paulo e, quatro dias depois,\no ex-presidente lançou o seu decálogo de propostas fundamentais para o\npaís: convocação de uma assembléia nacional constituinte; realização de\numa reforma agrária para fixar o homem à terra; controle das\nmultinacionais e disciplina da remessa de lucros; controle dos bancos\nprivados; adoção de um orçamento rigoroso; reforma do ensino, com a\nestatização do sistema educacional; liberdade sindical e negociação\ndireta entre empregados e patrões; criação de uma rigorosa lei de\nresponsabilidades que seria aplicada aos ocupantes de cargos públicos e\nestendida a outras situações, inclusive delitos de imprensa; reafirmação\nde uma política externa independente.\n\nJânio ingressou oficialmente no PTB em 15 de novembro de 1980, sendo\nlançado candidato ao governo paulista na convenção realizada pela\nagremiação em abril de 1981. Continuou a declarar-se admirador do\npresidente João Figueiredo, “um Hércules a sustentar sobre os ombros\ntoda essa estrutura da neodemocracia que ele promoveu”. Ao mesmo tempo\nem que tentava capitalizar o legado político de Getúlio Vargas e do\nantigo PTB, empreendeu esforços para aproximar-se do Partido Popular\n(PP), mantendo com esse fim sucessivos encontros com Olavo Setúbal, Miro\nTeixeira e Tancredo Neves. Em 18 de junho de 1981 sugeriu a fusão entre\no PTB e o PP, e a criação de um novo partido presidido por Tancredo,\nreafirmando essa proposta dois dias depois. Nessa ocasião, chegou a\nafirmar que se esse projeto não fosse realizado ingressaria no PP. Com a\ndivulgação da informação de que o governo proibiria coligações\npartidárias nas eleições de 1982, Jânio publicou um manifesto, em 26 de\njunho de 1981, comunicando seu afastamento do PTB e defendendo a fusão\nde todos os partidos de oposição. A partir daí, começou a aproximar-se\ndo Partido do Movimento Democrático Brasileiro (PMDB), alvo de muitos\nataques seus nos meses anteriores.\n\nEm 27 de agosto de 1981, depois de nova viagem à Inglaterra, Jânio\npreencheu sua ficha de filiação ao diretório do PMDB de Vila Maria, onde\nse localizava sua mais forte base de apoio na capital paulista. Seu\ningresso no PMDB foi facilitado pelo deputado estadual José Storopoli,\npresidente daquele diretório, que não consultou as direções regional e\nnacional. A decisão de Jânio provocou desde logo reações contrárias\ndentro do PMDB, com a multiplicação de moções de repúdio em outros\ndiretórios distritais e a decisão da comissão executiva regional, tomada\nem 13 de outubro, de considerá-lo inconveniente nos quadros partidários.\nO veredicto final passou para a comissão executiva nacional que, reunida\nno dia 20 seguinte, rejeitou a filiação de Jânio por 13 votos contra\ndois. Apenas o senador paulista Orestes Quércia e o então ex-deputado\nparanaense José de Alencar Furtado votaram a favor do ex-presidente,\nque, pouco depois, encaminhou recurso, em linguagem veemente, ao Supremo\nTribunal Federal.\n\nDepois de recusar convites dos partidos Democrático Trabalhista (PDT)\nliderado por Leonel Brizola e Democrático Republicano (PDR), que não\nchegou a obter registro definitivo na Justiça Eleitoral, Jânio se filiou\nnovamente ao PTB em 3 de novembro e, no fim desse mês, anunciou que\nconcorreria à Câmara dos Deputados e não ao governo paulista.\nEntretanto, voltou atrás dessa decisão e aceitou reassumir sua\ncandidatura nos moldes anteriores. No pleito de novembro de 1982,\nconcorreu ao governo de São Paulo na legenda do PTB, sofrendo aí a\nsegunda derrota eleitoral em toda sua carreira política, tendo sido o\nterceiro colocado, com Franco Montoro, do PMDB, em primeiro, e Reinaldo\nde Barros, do Partido Democrático Social (PDS), em segundo.\n\nDurante o ano de 1983, manteve-se afastado de uma atuação mais direta na\nvida política, vindo a manifestar suas posições por meio da imprensa em\nfevereiro de 1984, quando se desenrolava a campanha pelo retorno às\neleições diretas para a presidência da República*.* Na ocasião, fez\nrestrições à campanha das diretas por considerar que os comícios que se\nalastravam pelo país estavam “infiltrados de radicais, sobretudo\nmarxistas-leninistas”. Com relação à sucessão presidencial, inicialmente\nJânio manifestou apoio a Aureliano Chaves, em seguida expressou sua\naprovação ao nome de Paulo Maluf, para finalmente aderir à campanha de\nTancredo Neves.\n\nNesse mesmo ano, publicou o livro de ficção intitulado *Quinze contos*.\n\nEm 1985, retornou ao centro da política lançando-se candidato à\nprefeitura de São Paulo pelo PTB, no pleito de 15 de novembro desse ano.\nDurante a campanha, Jânio repetiu os gestos e o esquema que o elegeram\nem 1954. Foi flagrado com os sapatos trocados e com um quimono de\nsamurai que lhe presentearam em uma visita ao bairro da Liberdade,\nreduto de orientais. Declarou que ia colocar São Paulo em ordem com seus\nbilhetinhos e varrer a corrupção com sua vassoura, numa referência a\ndois dos símbolos da administração janista nos anos de 1950. Uma\nimportante estratégia de campanha foi o fato de ter encampado o anseio\ndos paulistanos por mais segurança, prometendo espalhar policiais em\ncada quarteirão da cidade.\n\nSeu principal adversário foi o candidato do PMDB, o senador Fernando\nHenrique Cardoso, favorito nas pesquisas de opinião. O embate entre\nJânio e Cardoso marcou a campanha com lances jocosos. Aproveitando-se de\nalgumas declarações polêmicas de Cardoso como a de que havia\nexperimentado um cigarro de maconha nos anos 1960 e que era “ateu,\ngraças a Deus”, Jânio reforçou o conteúdo moralista de seu estilo em\nvárias oportunidades. Numa delas, alertou os eleitores, em rede de\ntelevisão, para o perigo de Fernando Henrique, caso eleito, colocar\nmaconha na merenda das crianças. Em outra, reafirmou que acreditava em\nDeus e iria “governar com o povo e a cristandade”.\n\nNa verdade, segundo avaliação do deputado Gastone Righi do PTB e braço\ndireito de Jânio na campanha, o grande lance de Jânio foi ter conseguido\nos votos do centro à direita enquanto os do centro à esquerda ficaram\ndivididos entre Cardoso e o candidato do Partido dos Trabalhadores (PT),\nEduardo Matarazzo Suplici. Jânio obteve a adesão de alguns deputados do\nPartido da Frente Liberal (PFL), em troca de apoio à candidatura do\nministro das Relações Exteriores, Olavo Setúbal, para o governo de São\nPaulo.\n\nQuestionado sobre o programa de governo que iria adotar na prefeitura,\nrespondeu mais de uma vez: “Eu sou o programa.” Ao mesmo tempo, fez\nmuitas promessas e acabou definindo um programa “informal” que incluía o\nretorno dos velhos bondes, a criação de uma guarda municipal, a\nimplantação do monotrilho e a transferência da companhia do metrô para a\nprefeitura. Comprometeu-se, ainda, a criar subprefeituras a ele\ndiretamente subordinadas e não mais administrações regionais, que\nagiriam com total independência, inclusive orçamentária. A idéia era\nmanter uma administração municipal aberta à população como no passado,\nquando Jânio recebia as pessoas no seu gabinete, retomando as audiências\npúblicas, a exemplo do que fez quando prefeito em 1953.\n\nContrariando as pesquisas de opinião, a votação obtida por Jânio superou\na de Fernando Henrique Cardoso nas regiões norte e leste de São Paulo,\nas mais populosas e carentes, estabelecendo um recorde em Vila Maria,\nseu reduto eleitoral histórico, com 48,8% dos votos.\n\nNa prefeitura de São Paulo\n\nEm 1º de janeiro de 1986, logo após a cerimônia de posse, Jânio\ndirigiu-se ao seu gabinete, onde, na presença de jornalistas, desinfetou\ncom inseticida a cadeira do prefeito, na qual o seu adversário, Fernando\nHenrique Cardoso, havia posado perante fotógrafos que documentaram a\ncena durante a campanha eleitoral.\n\nSua administração foi marcada por medidas de impacto e por manifestações\nde protesto. Já nos primeiros meses de sua gestão, Jânio anunciou a\ndecisão de demitir 12 mil servidores municipais. Em reação, foi\nrealizada uma manifestação de protesto que reuniu cerca de mil\nfuncionários públicos em frente ao gabinete do prefeito, no parque\nIbirapuera. O objetivo era conseguir uma audiência com Jânio, visando a\nrevogação dos decretos que definiam a dispensa dos servidores. No dia\nseguinte, Jânio expediu memorando ao chefe da assessoria militar\nproibindo qualquer manifestação no parque Ibirapuera.\n\nOutra medida polêmica foi a apreensão e a destruição dos exemplares de\num fascículo da revista *Retrato do Brasil*e das edições dos *Programas\nde primeiro grau,* distribuídos gratuitamente às escolas da rede\nmunicipal e elaborados na administração do prefeito anterior, Mário\nCovas. A revista, que tratava do tema “Constituição e Assembléia\nNacional Constituinte”, dando ênfase à ampla participação popular, foi\nconsiderada por Jânio obra de “comunistas, comunistóides e inocentes\núteis”.\n\nA partir de abril de 1986 até o final de seu mandato, Jânio iniciou um\nprocesso de afastamentos temporários da prefeitura para tratar de\nproblemas de saúde de sua esposa, Eloá Quadros. Durante o primeiro\nperíodo de afastamento, de 10 de abril a 12 de julho de 1986, Jânio foi\nsubstituído pelo vice-prefeito Artur Alves Pinto.\n\nO ano de 1987 foi marcado por manifestações populares contra certas\nmedidas tomadas pelo prefeito. Em fevereiro, cerca de mil pessoas\nlideradas pelo Movimento dos Trabalhadores Rurais Sem Terra da Zona\nLeste de São Paulo concentraram-se em frente da prefeitura para\nreivindicar terras e financiamento para material de construção. Jânio\nmandou a polícia controlar a área e não recebeu os manifestantes. Outra\nmanifestação, em abril, reuniu dois mil servidores municipais no portão\nprincipal do Ibirapuera para reivindicar aumento salarial. Jânio\ninformou aos manifestantes que não atenderia ninguém enquanto houvesse\ngreve — realizada principalmente pelos setores de educação e saúde — e,\nno dia seguinte, assinou a demissão de quatrocentos trabalhadores que\nnão haviam retornado ao trabalho.\n\nEm maio, sucedendo outras licenças, o pedido de afastamento de Jânio\ncriou um problema jurídico, pois o vice-prefeito também pedira licença\npara ir ao exterior, desobrigando-se de assumir a prefeitura, o que o\nfaria perder o mandato de deputado estadual. Nesse período, o presidente\nda Câmara, Antônio Sampaio, o segundo na linha de substituição, estava\nhospitalizado. Assim, seguindo a Lei Orgânica dos Municípios, o cargo\nfoi ocupado pelo secretário dos Negócios Jurídicos, Cláudio Lembo.\n\nEm outubro, Jânio expediu memorando dirigido ao secretário municipal de\nCultura, Renato Ferrari, proibindo o ingresso de homossexuais na Escola\nMunicipal de Bailado, instituição que formava bailarinos desde 1940 e, à\népoca, contava com cerca de mil alunos. Para fazer cumprir a ordem, a\nGuarda Civil metropolitana cercou a escola, provocando protestos dos\npróprios alunos. Diante dessa reação e do pronunciamento de organizações\ncomo o Grupo de Apoio e Prevenção à AIDS (GAPA) e o grupo Lambda\n(Movimento pela Reorientação Sexual), Jânio ameaçou fechar a escola,\ncaso suas ordens não fossem cumpridas, e expulsar qualquer aluno que\ncriticasse suas determinações. A diretora da escola, Mariana Natal, que\ntambém era professora de balé da Penitenciária Feminina, não só acatou\nas ordens do prefeito, como divulgou uma lista eliminando 25 alunos\nclassificados como “anormais”.\n\nEm 1988, último ano de seu mandato, um balanço de sua administração\ninformava que Jânio realizara, entre outras obras, a pavimentação de\ncerca de 700km de vias, a instalação de luz em 91% da área habitada da\ncidade e a canalização de 11 córregos (das quais apenas duas foram\nconcluídas). Seu programa incluiu ainda a restauração do Teatro\nMunicipal, de outros três teatros e de 12 bibliotecas públicas,\nreurbanização do centro da cidade através de obras no vale do\nAnhangabaú, com a construção de calçadões, praças e áreas verdes. No\nsetor da saúde, Jânio Quadros inaugurou dois novos hospitais e recuperou\noutros seis, além de 58 unidades médicas. Na área habitacional,\ndesenvolveu um vasto programa de construção de habitações populares.\nPara evitar que a maior parte da arrecadação do município fosse gasta\ncom o pagamento do funcionalismo, Jânio fez uma lei determinando que\nesse comprometimento não poderia superar os 57%, congelando os salários\ndos servidores por quase um ano e meio.\n\nJânio concluiu seu mandato na prefeitura em dezembro de 1988, sendo\nsucedido por Luísa Erundina, do PT. Cumprindo a intenção declarada\nanteriormente de tornar irreversível as obras iniciadas em sua gestão,\nJânio deixou uma dívida de 150 milhões de dólares em pagamentos não\nefetuados às empreiteiras que executaram as obras de seu projeto viário,\nem especial a reurbanização do vale do Anhangabaú e os túneis sob o rio\nPinheiros e o parque Ibirapuera. Frente a esta situação, a administração\npetista anunciou a disposição de concluir as obras principais, em razão\ndos recursos econômicos já investidos e de seu adiantado estado de\nexecução, apesar de não considerá-las prioritárias, bem como de dar\ncontinuidade aos projetos de canalização dos córregos que se incluíam na\nchamada área social ao lado de obras ligadas à construção de creches,\nescolas e hospitais.\n\nEm abril de 1989, Jânio realizou viagem de turismo pela Europa e Oriente\nMédio, recebendo na ocasião convites de partidos políticos como o\nPartido Social Democrático (PSD) e o PFL que disputavam sua adesão para\nformar chapa na disputa à presidência da República. Após seu retorno ao\nBrasil, em maio, filiou-se ao PSD. Em seguida, o presidente do partido,\nLuís Pacce Filho, e o fundador e secretário-geral, o ex-ministro de\nMinas e Energia César Cals, anunciavam que tinham em Jânio o candidato\npreferencial para concorrer à presidência da República. Poucos dias\ndepois, Jânio anunciou publicamente a impossibilidade de disputar\nqualquer cargo público devido aos graves problemas de saúde que\nprejudicavam seu desempenho, reafirmando, contudo, que não abria mão da\ncondição de cidadão brasileiro. E assim o fez em dezembro de 1989,\nquando divulgou manifesto de apoio à candidatura Fernando Collor de\nMelo, candidato do Partido da Reconstrução Nacional (PRN), em que\nconvocava os janistas a fazerem o mesmo.\n\nEm novembro de 1990, já sofrendo problemas de saúde, Jânio foi abalado\npela morte de dona Eloá. Nos dois anos posteriores, seu estado de saúde\nagravou-se, vindo a falecer em 16 de fevereiro de 1992, em São Paulo.\nApós sua morte, uma comissão coordenada pelo vereador Miguel Colassuono,\nlíder do Partido Progressista Reformador (PPR) na Câmara Municipal de\nSão Paulo, iniciou, em agosto de 1993, estudos para construir um museu\nque reunisse o espólio material deixado por Jânio. Em março de 1996,\nficou decidida a construção de um memorial projetado pelo arquiteto\nOscar Niemeyer para abrigar livros, fotografias e outros documentos\npúblicos pertencentes a Jânio.\n\nJânio teve uma filha, Dirce Tutu Quadros, eleita deputada federal\nconstituinte pelo PTB, exercendo mandato no período 1987-1991.\n\nDois livros publicados em 1996 abordaram um tema que foi insistentemente\nrelembrado pelos jornais ao longo da vida pública de Jânio: a sua\nrenúncia à presidência da República. Lançada postumamente, *A renúncia\nde Jânio: um depoimento* foi escrita com base nas informações reunidas\npelo autor, o colunista político Carlos Castelo Branco, secretário de\nimprensa de Jânio no período da presidência. Já o livro organizado por\nseu neto, Jânio John Quadros Neto, e por Eduardo Lobo Botelho Gualazzi,\nintitulado *Jânio Quadros: memorial à história do Brasil*, trouxe, como\nnovidade, a confissão de Jânio sobre os motivos de sua renúncia à\npresidência, feita ao neto no quarto do hospital onde passou seus\núltimos dias. A renúncia fora uma estratégia política que não dera\nresultados. Jânio esperava que o povo, seguido pelos militares, não\naceitasse a sua renúncia e o reconduzisse ao poder, o que de fato não\naconteceu.\n\nEntre as obras que abordam mais diretamente sua trajetória política,\ndestacam-se: *Fenômeno Jânio Quadros* (1959), de Viriato de Castro;\n*Jânio, vida e carreira política* (1961), de José Iamashiro; *O 24 de\nagosto de Jânio Quadros* (1961, 2ª ed. 1981), de Luís Alberto Muniz\nBandeira; *JQ, Brasília e a grande crise*(1961) e *Anatomia da\nrenúncia*(1962), de Gileno de Carli; *Jânio deposto* (1962), de Moacir\nRibeiro; *Tempos de Jânio e outros tempos* (1962), de Carlos Castilho\nCabral; e *O governo Jânio Quadros* (1981), de Maria Vitória Benevides.\n\nAlém das obras citadas, escreveu *Curso prático da língua portuguesa e\nsua literatura* (6v., 1966) e*Os dois mundos das três Américas* (1972).\n\nJorge Miguel Mayer/Libânia Xavier\n\n \n\nFONTES: *Almanaque Abril* (1975 e 1976); *Almanaque Mundial* (1961 e\n1962); ARQ. DEP. PESQ. JORNAL DO BRASIL; BANDEIRA, L. *24;*BENEVIDES, M.\n*Governo Jânio*; CABRAL, C*. Tempos*;**CAFÉ FILHO, J. *Sindicato*;\nCARDOSO,**F.*Partidos*;*Correio da* *Manhã*(13/9/66);*EIeitos*; Encic.\nMirador; *Estado de S. Paulo* (18/2 e 22/10/54, 6/5/58, 21/4, 2 e\n22/10/81, 10/18/82, 30/1 e 4/3/86, 21/10/87, 21/8/88, 31/3/89);\nFERREIRA, O*. Crise*; *Folha de S. Paulo*(19/12/85, 18 e 30/1, 10/4,\n31/6, 3 e 16/12/86, 10/2/87, 1/7 e 19/11/88, 28/2, 3 e 17/3, 11/10, 2 e\n15/12/89, 28/7/90);*Globo*(17/11/79, 15/6/80, 26 e 27/1, 18 e 21/2,\n26/4, 24/5, 19/6, 7/7, 30/9, 21 e 24/10 e 11/11/81, 17/1 e 3/4/86, 25/4\ne 23/10/87, 28/2, 12 e 28/5, 23/6 e 1/11/89);*Grande encic. Delta*;\n*História*(22); IANNI, O*. Estado e planejamento*;*IstoÉ*(8/76);*Jornal\ndo Brasil*(7/4/74, 4/9 e 12/11/76, 30/10 e 12/12/77, 29/1 e 27/9/78,\n16/5, 3/7, 6/9 e 11/11/79, 25/1, 3 e 29/2, 22 e 29/5, 11/6, 26/8 e\n28/11/80, 21/2, 10 e 17/4, 10/5, 19 e 26/6, 5/8, 30/9, 1, 9, 14, 22, 23,\n29 e 30/10, 5, 12, 19 e 29/11, 2 e 6/12/81, 5/5/86, 22/4/87, 6/10/88);\nKUBITSCHEK, J. *Meu*;**LACERDA, C.*Depoimento*;**LEITE, A.\n*História*;**LEITE, A. *Páginas*;**LESSA, C.*Quinze*;**LOURENÇO,\nM.*Jânio*;**MIN. GUERRA. *Subsídios*;**NÉRI, S. *16*; NICOLAS, M.\n*Cem*;*Nosso*(5); *Novo Dic. de História;* OLIVEIRA,\nC.*Biografias;*PESQ. F. BARBOSA; QUADROS, J. *História*; *Realidade*;\nREIS JÚNIOR, P. *Presidentes*;*Rev. Bras. Estudos Pol.*(1965-18); *Rev.\nBrasiliense* (1958-2); *Rev. Civilização* *Brasileira*(1965-2); RIBEIRO,\nI.*Jânio*; SILVA, H. *1964*; SILVA, H.*História*;**SKIDMORE, T.\n*Brasil*;*Veja*(9/10, 17 e 27/11/68, 25/8/71, 20/3, 4/9, 6 e 20/11 e\n18/12/85); VÍTOR, M. *Cinco*; WROBEL, F. *Movimento.*\n\n \n","ref":"FONTES: *Almanaque Abril* (1975 e 1976); *Almanaque Mundial* (1961 e\n1962); ARQ. DEP. PESQ. JORNAL DO BRASIL; BANDEIRA, L. *24;*BENEVIDES, M.\n*Governo Jânio*; CABRAL, C*. Tempos*;**CAFÉ FILHO, J. *Sindicato*;\nCARDOSO,**F.*Partidos*;*Correio da* *Manhã*(13/9/66);*EIeitos*; Encic.\nMirador; *Estado de S. Paulo* (18/2 e 22/10/54, 6/5/58, 21/4, 2 e\n22/10/81, 10/18/82, 30/1 e 4/3/86, 21/10/87, 21/8/88, 31/3/89);\nFERREIRA, O*. Crise*; *Folha de S. Paulo*(19/12/85, 18 e 30/1, 10/4,\n31/6, 3 e 16/12/86, 10/2/87, 1/7 e 19/11/88, 28/2, 3 e 17/3, 11/10, 2 e\n15/12/89, 28/7/90);*Globo*(17/11/79, 15/6/80, 26 e 27/1, 18 e 21/2,\n26/4, 24/5, 19/6, 7/7, 30/9, 21 e 24/10 e 11/11/81, 17/1 e 3/4/86, 25/4\ne 23/10/87, 28/2, 12 e 28/5, 23/6 e 1/11/89);*Grande encic. Delta*;\n*História*(22); IANNI, O*. Estado e planejamento*;*IstoÉ*(8/76);*Jornal\ndo Brasil*(7/4/74, 4/9 e 12/11/76, 30/10 e 12/12/77, 29/1 e 27/9/78,\n16/5, 3/7, 6/9 e 11/11/79, 25/1, 3 e 29/2, 22 e 29/5, 11/6, 26/8 e\n28/11/80, 21/2, 10 e 17/4, 10/5, 19 e 26/6, 5/8, 30/9, 1, 9, 14, 22, 23,\n29 e 30/10, 5, 12, 19 e 29/11, 2 e 6/12/81, 5/5/86, 22/4/87, 6/10/88);\nKUBITSCHEK, J. *Meu*;**LACERDA, C.*Depoimento*;**LEITE, A.\n*História*;**LEITE, A. *Páginas*;**LESSA, C.*Quinze*;**LOURENÇO,\nM.*Jânio*;**MIN. GUERRA. *Subsídios*;**NÉRI, S. *16*; NICOLAS, M.\n*Cem*;*Nosso*(5); *Novo Dic. de História;* OLIVEIRA,\nC.*Biografias;*PESQ. F. BARBOSA; QUADROS, J. *História*; *Realidade*;\nREIS JÚNIOR, P. *Presidentes*;*Rev. Bras. Estudos Pol.*(1965-18); *Rev.\nBrasiliense* (1958-2); *Rev. Civilização* *Brasileira*(1965-2); RIBEIRO,\nI.*Jânio*; SILVA, H. *1964*; SILVA, H.*História*;**SKIDMORE, T.\n*Brasil*;*Veja*(9/10, 17 e 27/11/68, 25/8/71, 20/3, 4/9, 6 e 20/11 e\n18/12/85); VÍTOR, M. *Cinco*; WROBEL, F. *Movimento.*\n\n \n","dic":"DHBB"}
