{"title":"QUINAN, Lídia","cargoss":["Deputado federal"],"cargos_esp":[0],"datas_ini":[1995],"datas_fim":[2003],"estados":["GO"],"autor":[0],"content":"**QUINAN, Lídia**\n\n\\*dep. fed. GO 1995-2003.\n\n*Lídia Araújo Quinan* nasceu em Campinas (SP), no dia 16 de julho de\n1937, filha de Paulo Freire de Araújo e de Cira Nogueira de Araújo. Seu\npai foi deputado federal por Minas Gerais\n\nRadicada em Goiás desde 1955, dois anos depois formou-se pela Escola de\nEnfermagem Florence Nightingale, de Anápolis (GO). Em 1986 participou do\nI Seminário Estadual de Prevenção à Drogadição, do I Seminário Nacional\nda Paz, promovido pela Comunidade Bahá’i, e do I Congresso\nIbero-Latino-Americano de Geriatria e Gerontologia, em São Paulo.\n\nFiliada ao Partido do Movimento Democrático Brasileiro (PMDB) desde\n1980, foi indicada em 1993 para o diretório municipal de Anápolis,\nelegendo-se delegada do diretório nacional. Candidata a deputada federal\nnas eleições de outubro de 1994 obteve a maior votação do estado — pouco\nmais de cem mil votos —, sendo empossada na Câmara em fevereiro de 1995.\n\nTitular à Comissão de Educação, Cultura e Desporto, no tocante às\nemendas constitucionais propostas pelo governo Fernando Henrique Cardoso\nem 1995, votou a favor da extinção do monopólio estatal nos setores de\ntelecomunicações, exploração de petróleo, distribuição de gás canalizado\ne navegação de cabotagem; da mudança do conceito de empresa nacional; da\nprorrogação do Fundo Social de Emergência (FSE), rebatizado de Fundo de\nEstabilização Fiscal (FEF), que permitia ao governo gastar até 20% da\narrecadação vinculada às áreas de saúde e de educação.\n\nEm junho de 1996 votou a favor da criação da Contribuição Provisória\nsobre Movimentação Financeira (CPMF), que substituiu o Imposto\nProvisório sobre Movimentação Financeira (IPMF), fonte suplementar de\nrecursos destinados à saúde.\n\nEm janeiro/fevereiro de 1997 votou a favor da emenda que previa a\nreeleição de presidente da República, governadores e prefeitos, e em\nnovembro pela quebra da estabilidade do servidor público, item principal\nda reforma administrativa.\n\nReeleita no pleito de outubro de 1998, concorrendo pela legenda do PMDB\n— com 120.705 votos, foi mais uma vez a maior votação do estado — em\nnovembro votou a favor do teto de 1.200 reais, para aposentadorias no\nsetor público, e pelos critérios de idade e tempo de contribuição\nmínimo, para os trabalhadores no setor privado. Assumiu o novo mandato\nem fevereiro de 1999. Nesta legislatura, no ano de 2001, tornou-se\npresidenta da Comissão Especial - Asbesto e Amianto, foi suplente nas\ncomissões permanentes de educação (PEC nº 233/95) e de Combate à Pobreza\n(PEC nº 249/00); foi relatora e titular na comissão permanente do Plano\nNacional de Cultura (PEC nº 306/00); e foi titular da comissão\npermanente de Relação entre Entidades Públicas e Respectivas Entidades\nFechadas de Previdência Complementar (PLP nº 8/99).\n\n No ano de 2002 concorreu ao mesmo cargo, mas conseguiu eleger-se apenas\npara a suplência de seu partido. No ano de 2003 era Superintendente de\nAssistência Social ao Idoso da Secretaria de Cidadania e Trabalho do\nEstado de Goiás.\n\nPor ocasião do centenário da cidade de Anápolis, em agosto de 2007, foi\nconvidada para compor a mesa da Sessão Solene em homenagem ao município.\n\nLídia Quinan foi membro do conselho consultivo da Associação Comercial e\nIndustrial de Goiás e vice-presidente do grupo Onogás e da Onocrédito\nS.A., de Goiânia. Em 2007 foi denunciada pelo Ministério Público\nFederal, por meio de acusação de não ter fornecido os livros fiscais da\nempresa Onogás, nos anos de 1994 até 1996, assim como as declarações d\nIRPF, nos anos de 1996 e 1997, visando sonegação fiscal. No ano de 2009\nfoi considerada absolvida das acusações por não terem sido apresentadas\nprovas suficientes de que exercia a gerência da empresa durante o\nperíodo investigado. Sua defesa alegou que durante esse período ela\nexercia mandato eletivo\n\nFoi casada com Onofre Quinan, com quem teve quatro filhos. O marido foi\nvice-governador e governador de Goiás de 1983 a 1986, e de 1986 a 1987,\nrespectivamente, e senador de 1991 a 1998, quando faleceu.\n\nFONTES: CÂM. DEP. *Deputados brasileiros. Repertório*(1995-1999); *Folha\nde S. Paulo* (31/1/95, 14/1/96, 30/1/97, 29/9 e 6/11/98).\n","ref":"FONTES: CÂM. DEP. *Deputados brasileiros. Repertório*(1995-1999); *Folha\nde S. Paulo* (31/1/95, 14/1/96, 30/1/97, 29/9 e 6/11/98).\n","dic":"DHBB"}
