{"title":"QUINAN, Onofre","cargoss":["Governador de estado ou do Distrito Federal","Senador"],"cargos_esp":[0,0],"datas_ini":[1986,1991],"datas_fim":[1987,1998],"estados":["GO","GO"],"autor":[0],"content":"**QUINAN, Onofre**\n\n\\*gov. GO 1986-1987; sen. GO 1991-1998.\n\n* *\n\n*Onofre Quinan* nasceu em Vianópolis (GO) no dia 29 de outubro de 1926,\nfilho de Antônio José e de Jandira Bretas.\n\nEm 1950 fundou e tornou-se diretor comercial da firma Quinan & Cia.\nLtda., voltada para o comércio varejista de ferragens e ferramentas para\nagricultura. Introdutor do gás de cozinha em Goiás, em 1956 criou a\nOnogás S.A., empresa responsável pelo engarrafamento e distribuição do\nproduto no estado. Em 1972, com a incorporação da Quinan pela Onogás,\nnasceu a Onogás S.A. Comércio e Indústria, estabelecimento do qual\npassou a ser diretor-presidente.\n\nEm 1974, com quase 50 anos, matriculou-se num curso supletivo de\nprimeiro e segundo graus em Goiânia, formando-se no ano seguinte.\nIniciou sua carreira política em novembro de 1982, ao eleger-se\nvice-governador de Goiás na chapa do Partido do Movimento Democrático\nBrasileiro (PMDB), encabeçada por Íris Resende. Empossado em março\nseguinte, assumiu a chefia do Executivo estadual em fevereiro de 1986,\nquando Íris Resende se licenciou do cargo para ocupar a pasta da\nAgricultura no governo de José Sarney.\n\nAntes mesmo do término do mandato, no entanto, Onofre Quinan anunciou\nsua intenção de concorrer ao Senado no pleito de novembro de 1986. Se\nesta intenção se concretizasse, assumiria o governo do estado em seu\nlugar o presidente da Assembléia Legislativa, Eurico Barbosa, do PMDB.\nEm função das fortes pressões que sofreu de Resende e de seu candidato à\nsucessão estadual, o peemedebista Henrique Santillo — vencedor na\ndisputa com Mauro Borges, seu amigo pessoal, e que acabou\ncandidatando-se à vaga pelo Partido Democrático Cristão (PDC) —, Quinan\nresolveu reconsiderar, permanecendo no governo goiano até o final do\nmandato, em março de 1987. Nessa época, a Onogás S.A. já era a maior\ndistribuidora de gás da região Centro-Oeste e uma das principais\nrevendedoras de eletrodomésticos do Planalto Central.\n\nEleito senador por Goiás na legenda do PMDB em outubro de 1990, tomou\nposse em fevereiro seguinte e integrou como titular diversas comissões,\ndentre as quais as de Assuntos Econômicos e de Infra-Estrutura, Assuntos\nSociais, Serviços de Infra-Estrutura e de Fiscalização e Controle do\nSenado.\n\nDurante o ano de 1991, as denúncias de irregularidades no governo do\npresidente Fernando Collor de Melo (1990-1992) intensificaram-se,\natingindo o auge em maio de 1992, quando a revista *Veja* publicou uma\nentrevista em que Pedro Collor, irmão do presidente, denunciava a\nexistência de um esquema de corrupção no governo sob o comando de Paulo\nCésar Farias, o PC, ex-tesoureiro da campanha presidencial. Essa\ndenúncia levou o Congresso a instalar uma comissão parlamentar de\ninquérito (CPI), cujas conclusões levaram ao envolvimento do presidente\ne à solicitação do seu afastamento. Em 29 de setembro de 1992 a Câmara\ndos Deputados aprovou a abertura do processo de *impeachment* do\npresidente Collor, que foi afastado da presidência em outubro. Em 28 de\ndezembro de 1992 o processo foi votado no Senado, e Onofre Quinan\nmanifestou-se a favor do afastamento definitivo do presidente Collor,\nque havia renunciado ao mandato horas antes.\n\nNas votações das emendas constitucionais propostas pelo governo Fernando\nHenrique Cardoso em 1995, pronunciou-se a favor da quebra do monopólio\ndos estados na distribuição de gás canalizado e da quebra do monopólio\nestatal das telecomunicações e das embarcações nacionais na navegação de\ncabotagem. Votou contra o fim do monopólio da Petrobras na exploração de\npetróleo, a mudança no conceito de empresa nacional, e faltou à votação\nsobre a prorrogação do Fundo Social de Emergência (FSE), rebatizado de\nFundo de Estabilização Fiscal (FEF), que permitia que o governo gastasse\n20% da arrecadação de impostos sem que estas verbas ficassem\nobrigatoriamente vinculadas aos setores de saúde e educação.\n\nAfastado do Senado para tratamento de saúde, não votou a emenda da\nreeleição para presidente da República, governadores e prefeitos, nem a\nreforma administrativa.\n\nParalelamente às atividades políticas e empresariais, Onofre Quinan\nexerceu diversas atribuições em Anápolis (GO), tendo sido diretor da\nAssociação Comercial, secretário e presidente do Rotary Club e\nsócio-fundador do Clube dos Diretores Lojistas e do aeroclube da cidade.\n\nFaleceu em Brasília no dia 14 de janeiro de 1998, em pleno exercício do\nmandato. Sua vaga no Senado foi ocupada pelo suplente José Saad.\n\nEra casado com Lídia Araújo Quinan, eleita deputada federal pelo PMDB\ngoiano em 1994 e reeleita em 1998, com quem teve quatro filhos.\n\nPublicou *Guia administrativo* (1994).\n\n \n\nFONTES:****CURRIC. BIOG.; *Folha de S. Paulo* (11/5/86, 3/1/87, 14/1/96\ne 30/1/97); *Globo* (14/1/98); *Jornal do Brasil* (10/5/86); SENADO.\n*Dados biográficos* (1995).\n\n \n","ref":"FONTES:****CURRIC. BIOG.; *Folha de S. Paulo* (11/5/86, 3/1/87, 14/1/96\ne 30/1/97); *Globo* (14/1/98); *Jornal do Brasil* (10/5/86); SENADO.\n*Dados biográficos* (1995).\n\n \n","dic":"DHBB"}
