{"title":"QUINTELA, Carlos","cargoss":["Deputado federal"],"cargos_esp":[0],"datas_ini":[1967],"datas_fim":[1971],"estados":["RJ"],"autor":[0],"content":"**QUINTELA, Carlos**\n\n\\*dep. fed. RJ 1967-1971.\n\n*Carlos de Freitas Quintela*nasceu no Rio de Janeiro, então Distrito\nFederal, em 30 de março de 1917, filho de Álvaro de Oliveira Quintela e\nde Idalina de Freitas Quintela.\n\nFoi membro do conselho fiscal da Confederação Nacional do Comércio no\nperíodo 1954-1956, suplente do mesmo conselho fiscal no período de\n1956-1958 e primeiro diretor-secretário no período 1958-1960.\n\nEm novembro de 1966 foi eleito terceiro suplente de deputado federal\npelo estado do Rio de Janeiro na legenda da Aliança Renovadora Nacional\n(Arena) — partido de sustentação do regime militar instaurado no país em\nabril de 1964 —, tendo exercido integralmente o mandato na legislatura\nde 1967-1971.\n\nEra casado com Lílian Quintela, com quem teve duas filhas.\n\nFONTES: CÂM. DEP. *Deputados brasileiros.* *Repertório*(1967-1971); CÂM.\nDEP. *Deputados federais. Inventário;*CONF. NAC. COMÉRCIO. *20.*\n\n \n","ref":"FONTES: CÂM. DEP. *Deputados brasileiros.* *Repertório*(1967-1971); CÂM.\nDEP. *Deputados federais. Inventário;*CONF. NAC. COMÉRCIO. *20.*\n\n \n","dic":"DHBB"}
