{"title":"BACELAR, Rui","cargoss":["Deputado federal","Senador","Constituinte"],"cargos_esp":[0,0,0],"datas_ini":[1971,1987,1987],"datas_fim":[1987,1995,1988],"estados":["BA","BA",0],"autor":["Juliana Sousa"],"content":"**BACELAR, Rui**\n\n\\*dep. fed. BA 1971-1987; sen. BA 1987-1995; const. 1987-1988.\n\n*Joaquim Rui Paulilo Bacelar* nasceu em Entre Rios (BA) no dia 25 de\noutubro de 1935, filho de João de Sousa Bacelar e de Helena Paulilo\nBacelar. Seu irmão João Carlos Bacelar também seguiu a carreira\npolítica, tendo sido deputado federal pela Bahia entre 1987 e 1995 e\nretornado à Câmara como suplente em várias oportunidades até 2007.\n\nDiplomou-se em engenharia pela Escola Politécnica da Universidade da\nBahia em 1960. Especializou-se em pavimentação rodoviária no Instituto\nde Pesquisas Rodoviárias (IPR) e no Departamento Nacional de Estradas de\nRodagem (DNER). Fez ainda o curso de Highway Engineering do Bureau of\nPublic Roads dos EUA, entre 1961 e 1962.\n\nProprietário rural, em novembro de 1962 foi eleito vereador em sua\ncidade natal, na legenda da União Democrática Nacional (UDN), e exerceu\no mandato de 1963 a 1967. Com a extinção dos partidos políticos pelo Ato\nInstitucional nº 2, filiou-se à Aliança Renovadora Nacional (Arena),\npartido de sustentação ao regime militar vigente desde 1964. Nas\neleições de novembro de 1966, elegeu-se deputado à Assembleia\nLegislativa da Bahia, sendo empossado em fevereiro de 1967.\n\nEm novembro de 1970, elegeu-se deputado federal pela Bahia na legenda\narenista. Assumindo o mandato na Câmara dos Deputados em fevereiro de\n1971, integrou as comissões de Transportes, de Comunicações, de Obras\nPúblicas e a do Polígono das Secas. Reeleito em novembro de 1974,\ndurante o segundo mandato tornou a integrar a Comissão de Transportes,\nque presidiria em 1976, assim como a Comissão do Polígono das Secas. Em\n1977, apresentou um projeto de emenda constitucional polêmico, que\ninstituía o direito de voto ao analfabeto. O projeto foi aprovado e não\nrecebeu o veto do presidente da República, general Ernesto Geisel. No\nano seguinte, foi vice-líder do governo na Câmara e vice-presidente da\nComissão Parlamentar de Inquérito (CPI) sobre reajuste salarial.\n\nElegeu-se pela terceira vez consecutiva em novembro de 1978. Nesse\nmandato, iniciado em fevereiro de 1979, voltou a ocupar a presidência da\nComissão de Transportes da Câmara dos Deputados. Com o fim do\nbipartidarismo em novembro de 1979 e a consequente reorganização\npartidária, filiou-se ao Partido Democrático Social (PDS), que sucedeu à\nArena. Em novembro de 1982 foi mais uma vez reeleito para a Câmara dos\nDeputados, tomando posse em fevereiro de 1983. Nesse mesmo ano, liderou\num movimento no PDS a favor de uma distribuição mais democrática dos\ncargos de direção do partido. Liderou o grupo renovador “Participação”\nna convenção partidária, desafiando os dirigentes que vinham se\nrevezando desde a antiga Arena. O grupo não alcançou maioria absoluta\ndentro do partido, o que lhe possibilitaria indicar o presidente, mas\nconseguiu proporcionalidade na direção.\n\nEm 25 de abril de 1984 votou a favor da emenda Dante de Oliveira, que\npropunha o restabelecimento das eleições diretas para presidente da\nRepública em novembro daquele ano. Como a emenda não obteve o número de\nvotos indispensáveis à sua aprovação — faltaram 22 para que o projeto\npudesse ser encaminhado à apreciação do Senado Federal —, na eleição\nindireta feita pelo Colégio Eleitoral reunido em 15 de janeiro de 1985,\nvotou no candidato oposicionista Tancredo Neves, da Aliança Democrática,\nunião do Partido do Movimento Democrático Brasileiro (PMDB) com a\ndissidência do PDS abrigada na Frente Liberal. Tancredo foi leito, mas,\npor motivo de doença, não chegou a tomar posse na presidência, vindo a\nfalecer em 21 de abril. Seu substituto no cargo foi o vice José Sarney,\ninterino desde 15 de março.\n\nAinda em 1985, Rui Bacelar foi um dos fundadores do Partido da Frente\nLiberal (PFL) na Bahia, mas, ligado ao ministro Roberto Santos,\nabandonou o partido no ano seguinte, quando a legenda passou ao controle\ndo ministro Antônio Carlos Magalhães, seu adversário político.\nTransferiu-se então para o Partido do Movimento Democrático Brasileiro\n(PMDB), em 1986. Naquele ano, escolhido por Waldir Pires, candidato a\ngovernador da Bahia, lançou-se à disputa de uma das duas vagas de\nsenador constituinte e foi eleito, graças sobretudo à sua grande\npenetração eleitoral no interior do estado.\n\nConcluindo o mandato na Câmara em janeiro de 1987, tomou posse no Senado\nem 1º de fevereiro de 1987, quando tiveram início os trabalhos da\nAssembleia Nacional Constituinte (ANC). Na ANC, foi membro titular da\nSubcomissão da União, Distrito Federal e Territórios, da Comissão da\nOrganização do Estado, e suplente da Subcomissão do Poder Executivo, da\nComissão da Organização dos Poderes e Sistema de Governo. Sua principal\nproposta foi a defesa da redefinição do sistema tributário nacional.\nDefinindo-se como político de centro-esquerda, apresentou um discurso\nprogressista, defendendo, inclusive, a reforma agrária.\n\nNas principais votações da Constituinte, votou a favor do rompimento de\nrelações diplomáticas com países com política de discriminação racial,\ndo mandado de segurança coletivo, do turno ininterrupto de seis horas,\nda remuneração 50% superior para o trabalho extra, do aviso prévio\nproporcional, da soberania popular, do voto facultativo aos 16 anos, da\nnacionalização do subsolo, do limite de 12% ao ano para os juros reais,\nda criação de um fundo de apoio à reforma agrária e da desapropriação da\npropriedade produtiva. Manifestou-se contrário ao mandato de cinco anos\npara o presidente José Sarney, à pena de morte, à jornada semanal de 40\nhoras, ao presidencialismo, à estatização do sistema financeiro, à\nlimitação dos encargos da dívida externa, à anistia aos micro e pequenos\nempresários e à legalização do jogo do bicho. Absteve-se na votação da\ncriminalização do aborto e não esteve presente na votação relativa à\nunicidade sindical.\n\nInspirado na Constituição portuguesa de 1976, apresentou o projeto de\nmandado de injunção, que foi aprovado. Foi também de sua autoria a\nproposta de realizar eleições diretas para presidente da República 120\ndias após a promulgação da Constituição, em uma tentativa de encurtar o\nmandato do presidente José Sarney. Com a promulgação da nova carta\nconstitucional em 5 de outubro de 1988, passou a exercer o mandato\nordinário no Senado. Nas eleições de outubro de 1994, candidatou-se a\ndeputado federal na legenda do PMDB, mas não teve êxito. Deixou o Senado\nem janeiro de 1995, ao final da legislatura. Retirando-se da política,\npassou a se dedicar a atividades agropecuárias em suas fazendas na\nregião de Ilhéus.\n\nCasou-se com Matilde Barreiros Bacelar, com quem teve três filhas.\n\nPublicou *A luta para que o Nordeste deixe de ser uma área problema*,\n*Idéia aceita pelo presidente Geisel que beneficiou o rurícola\nbrasileiro*, *Homenagem a um líder*e*Os tempos mudaram*.\n\nJuliana Sousa\n\nFONTES: CÂM. DEP. *Deputados brasileiros. Repertório*(1971-1975,\n1975-1979, 1979-1983, 1983-1987);**COELHO, J. & OLIVEIRA, A. *Nova;\nCorreio* (30/11/86); FLEISCHER, D. *Thirty; Folha de S. Paulo*\n(19/1/87); *Globo*(26/4/84, 26/1/85); INF. FAM.; *IstoÉ/Senhor* (1991);\nNÉRI, S. *16; Perfil* (1972, 1980); TRIB. SUP. ELEIT. *Dados* (8).\n","ref":"FONTES: CÂM. DEP. *Deputados brasileiros. Repertório*(1971-1975,\n1975-1979, 1979-1983, 1983-1987);**COELHO, J. & OLIVEIRA, A. *Nova;\nCorreio* (30/11/86); FLEISCHER, D. *Thirty; Folha de S. Paulo*\n(19/1/87); *Globo*(26/4/84, 26/1/85); INF. FAM.; *IstoÉ/Senhor* (1991);\nNÉRI, S. *16; Perfil* (1972, 1980); TRIB. SUP. ELEIT. *Dados* (8).\n","dic":"DHBB"}
