{"title":"RAMOS, Cândido","cargoss":["Revolucionário ou revoltoso","Senador","Deputado federal"],"cargos_esp":[0,0,0],"datas_ini":[1930,1935,1935],"datas_fim":[1930,1935,1937],"estados":[0,"SC","SC"],"autor":[0],"content":"**RAMOS, Cândido**\n\n\\*rev. 1930; sen. SC 1935; dep. fed. SC 1935-1937.\n\n \n\n*Cândido de Oliveira Ramos* nasceu em Lajes (SC) no dia 11 de março de\n1889, filho de Henrique de Oliveira Ramos e de Maria Cândida Ramos. A\nfamília Ramos, especialmente a partir de 1930, exerceu grande influência\nna política de Santa Catarina. Entre seus parentes, destacaram-se Vidal\nRamos, governador do estado de 1902 a 1905 e de 1910 a 1914; Nereu\nRamos, governador de Santa Catarina de 1935 a 1937, interventor de 1937\na 1945, vice-presidente da República de 1946 a 1951 e presidente de 1955\na 1956; Celso Ramos, governador do estado de 1961 a 1966; Saulo Ramos,\ndeputado federal de 1951 a 1955 e senador de 1955 a 1963, e Joaquim\nRamos, deputado federal de 1947 a 1971.\n\nFormado em medicina, participou da Revolução de 1930 em seu estado. Após\na vitória do movimento, foi convidado pelo general Ptolomeu de Assis\nBrasil — nomeado interventor federal em Santa Catarina em novembro de\n1930 — para ser seu secretário. Em 1932, chegou a substituir\ntemporariamente o general Assis Brasil no cargo de interventor. No mesmo\nano, em outubro, o general deixou definitivamente a interventoria.\n\nCândido Ramos elegeu-se deputado federal no pleito de outubro de 1934, e\nem 1935 foi também eleito para o Senado pela Assembléia Constituinte de\nSanta Catarina. Entretanto, renunciou à sua cadeira de senador em julho\ndo mesmo ano, assumindo o mandato de deputado federal. Permaneceu na\nCâmara até 10 de novembro de 1937, quando a instauração do Estado Novo\nsuprimiu as câmaras legislativas do país.\n\nPassou, então, a dedicar-se à pecuária, na sua fazenda em Lajes. Um dos\nfundadores da Associação Rural de Lajes, foi seu primeiro\nvice-presidente, em 1939.\n\nFaleceu em Cannes, na França, em 23 de agosto de 1949.\n\nEra casado com Julieta de Oliveira Ramos.\n\nFoi condecorado pelo governo francês com a Cruz de Guerra e a Legião de\nHonra.\n\n \n\nFONTES: ASSEMB. LEGISL. SC. *Dicionário político*; CABRAL, O.\n*História*; CABRAL, O. *Era*; *Constituinte*; *Diário do Congresso\nNacional*; SENADO. *Anais* (4/5/35); SILVA, H. *1930*.\n\n \n","ref":"FONTES: ASSEMB. LEGISL. SC. *Dicionário político*; CABRAL, O.\n*História*; CABRAL, O. *Era*; *Constituinte*; *Diário do Congresso\nNacional*; SENADO. *Anais* (4/5/35); SILVA, H. *1930*.\n\n \n","dic":"DHBB"}
