{"title":"RAMOS, Hugo","cargoss":["Senador"],"cargos_esp":[0],"datas_ini":[1978],"datas_fim":[1983],"estados":["RJ"],"autor":[0],"content":"**RAMOS, Hugo**\n\n\\*sen. RJ 1978-1983.\n\n \n\n*Hugo Ramos Filho* nasceu em Florianópolis no dia 17 de setembro de\n1914, filho de Hugo Ramos e Juraci Fausto de Sousa Ramos. Seu avô\npaterno, Vidal Ramos, foi governador de Santa Catarina entre 1902 e 1905\ne entre 1910 e 1914, deputado federal (1906-1910 e 1927-1929) e senador\n(1914-1927 e 1935-1937) pelo mesmo estado. Seu tio paterno, Nereu Ramos,\nteve intensa vida política. Governador de Santa Catarina entre 1935 e\n1937, assumiu a interventoria no estado neste ano, permanecendo no cargo\naté 1945. Vice-presidente da República entre 1946 e 1951, presidiu o\npaís de novembro de 1955 a janeiro de 1956 e foi titular da pasta da\nJustiça entre 1956 e 1957.\n\nRadicado no Rio de Janeiro, então Distrito Federal, desde 1919,\ngraduou-se bacharel em direito em 1938 pela Faculdade de Direito de\nNiterói, tendo trabalhado durante algum tempo como serventuário da\nJustiça. Ingressou na vida política em 1946, ano em que se filiou ao\nPartido Social Democrático (PSD), em cuja legenda elegeu-se vereador à\nCâmara Municipal do Rio de Janeiro. Reeleito sucessivamente, em 1957\npresidiu a Câmara de Vereadores carioca. Em 1960, elegeu-se deputado\nestadual constituinte pela Guanabara, tendo sido vice-presidente da\ncomissão encarregada de elaborar a Constituição do novo estado,\nresultante da transferência da capital para Brasília em abril de 1960.\n\nApós ter concluído o mandato em 1962, retirou-se da política, retornando\nàs atividades de sua banca de advocacia. Em novembro de 1974, elegeu-se\nsuplente de senador pela Guanabara na legenda do Movimento Democrático\nBrasileiro (MDB), agremiação de oposição ao regime militar vigente no\npaís desde abril de 1964, criada a partir do Ato Institucional nº 2\n(17/10/1965), que extinguiu os partidos políticos existentes e instaurou\no bipartidarismo. Em decorrência do falecimento, em fevereiro de 1978,\ndo senador Danton Jobim, assumiu sua cadeira no Senado, onde participou\ndas comissões de Justiça e Segurança Nacional. Com o término do mandato,\nem janeiro de 1983, encerrou sua carreira política, voltando a advogar.\n\nFaleceu no Rio de Janeiro, no dia 31 de julho de 1993.\n\nEra casado com Diva Cavalcanti Caruso Ramos, com quem teve dois filhos.\nO mais velho, Gilberto Ramos, elegeu-se vice-prefeito do Rio de Janeiro\nem 1992, em chapa encabeçada por César Maia. Empossado em janeiro de\n1993, acumulou a vice-prefeitura com o cargo de secretário de\nAdministração do município do Rio de Janeiro. Deixou ambos os cargos em\ndezembro de 1996.\n\n \n\nFONTES: *Globo* (3/8/1993); INF. Assessoria de Gilberto Ramos; SENADO.\n*Dados biográficos* (1975-1983).\n\n \n","ref":"FONTES: *Globo* (3/8/1993); INF. Assessoria de Gilberto Ramos; SENADO.\n*Dados biográficos* (1975-1983).\n\n \n","dic":"DHBB"}
