{"title":"RAMOS, Romeu","cargoss":["Consultor-geral da República"],"cargos_esp":[0],"datas_ini":[1969],"datas_fim":[1974],"estados":[0],"autor":[0],"content":"**RAMOS, Romeu**\n\n\\*consult.-ger. Rep. 1969-1974.\n\n*Romeu de Almeida Ramos*nasceu em São Jerônimo (RS) no dia 15 de\nfevereiro de 1928.\n\nApós fazer o curso secundário nos colégios Rosário e Anchieta, ambos em\nPorto Alegre, ingressou na Faculdade de Direito dessa cidade. Ainda\nacadêmico, foi vereador em sua cidade natal na legenda do Partido\nLibertador (PL), a cujo diretório regional pertenceu até sua extinção.\nEm 1954 bacharelou-se passando a atuar no serviço público como advogado\ndo Departamento Autônomo de Estradas de Rodagem do Rio Grande do Sul e\nassessor da Secretaria do Interior, além de exercer o magistério como\nprofessor titular de direito tributário e de ciência das finanças da\nFaculdade de Direito da Pontifícia Universidade Católica da capital\ngaúcha.\n\nEm 1966 assumiu a Procuradoria da República no Rio Grande do Sul por\nconvocação do então ministro da Justiça Mem de Sá, afastando-se do cargo\nao ser nomeado consultor-geral da República em outubro de 1969, ao\ninício do governo do presidente Emílio Garrastazu Médici. Exerceu tais\nfunções até o final desse governo, em março de 1974, assumindo em\nseguida a presidência da Caixa Econômica do Rio Grande do Sul. Em maio\nde 1976 foi indicado pelo presidente da República, Ernesto Geisel, para\no cargo de ministro do Tribunal Federal de Recursos (TFR) e, em março do\nano seguinte, assumiu a Secretaria da Justiça de seu estado durante o\ngoverno de Sinval Guazzelli (1975-1979). No governo de José Augusto\nAmaral de Sousa, iniciado em 1979, ocupou a Secretaria de Minas e\nEnergia do Rio Grande do Sul.\n\nTornou-se membro do Instituto dos Advogados do Distrito Federal.\n\nFONTES: *Correio do Povo*(1/3 e 14/4/77); CORRESP. CONSULT. GER. REP*.;\nJornal do* *Brasil*(22/5/76 e 28/3/82); *Perfil*(1971).\n\n \n","ref":"FONTES: *Correio do Povo*(1/3 e 14/4/77); CORRESP. CONSULT. GER. REP*.;\nJornal do* *Brasil*(22/5/76 e 28/3/82); *Perfil*(1971).\n\n \n","dic":"DHBB"}
