{"title":"RAMOS, Teodoro Augusto","cargoss":["Prefeito"],"cargos_esp":["São Paulo"],"datas_ini":[1932],"datas_fim":[1933],"estados":[0],"autor":[0],"content":"**RAMOS, Teodoro Augusto**\n\n\\*pref. São Paulo 1932-1933.\n\n \n\n*Teodoro Augusto Ramos* nasceu na cidade de São Paulo no dia 26 de junho\nde 1895.\n\nCursou o secundário no Ginásio Anglo-Brasileiro, ingressando\nposteriormente no curso de engenharia civil da Escola Politécnica do Rio\nde Janeiro, onde colaborou na revista Didática. Formando-se em 1918,\nvoltou a sua cidade natal e tornou-se professor substituto da 1ª Seção\nda Escola Politécnica de São Paulo, que incluía matemática elementar,\ngeometria analítica e cálculo infinitesimal. Efetivado por concurso em\n1922, nesse mesmo ano dirigiu a seção de águas e fontes luminosas do\nParque Ipiranga.\n\nMembro do Conselho Nacional de Educação, depois da Revolução de 1930 foi\nsecretário estadual de Educação e Saúde Pública durante o governo do\ntenente João Alberto Lins de Barros, interventor federal em São Paulo de\nnovembro de 1930 a julho de 1931. Em 1932, assumiu as cadeiras de\nmecânica racional e cálculo vetorial da Escola Politécnica, as quais\niria reger durante toda sua vida. Depois da derrota da Revolução\nConstitucionalista, quando era interventor o general Valdomiro Lima\n(1932-1933), foi nomeado em dezembro de 1932 prefeito municipal de São\nPaulo. Ao findar o primeiro trimestre de 1933, em carta a Valdomiro Lima\ncomunicou sua demissão do cargo por divergir da política de gastos e\nobras públicas do governo. Nessa carta denunciou a situação deficitária\nda administração pública, aconselhando a suspensão de “todas as obras\npúblicas adiáveis” e a abolição integral “do início de obras, salvo as\nde urgente necessidade para São Paulo”. Segundo o mesmo documento, havia\naceito o cargo em 1932 com o objetivo de “contribuir para o reerguimento\neconômico e financeiro de São Paulo” e “para a pacificação dos espíritos\nentão muito exaltados, em virtude das últimas convulsões\nrevolucionárias”. Afirmou ainda que sua administração se caracterizou\npor “rigorosa moralidade na arrecadação da receita e aplicação da\ndespesa”, pela defesa do funcionalismo, dos interesses da prefeitura e\nda coletividade, por uma regulamentação dos serviços públicos e ainda\npela preocupação de só realizar as obras de necessidade urgente para São\nPaulo. Passou o cargo ao diretor de Obras e Viação, Artur Sabóia.\n\nEm 1934, quando foi criada a Universidade de São Paulo (USP), foi\nincumbido por Armando Sales, interventor no estado de 1933 a 1935, de\nescolher os catedráticos estrangeiros a serem contratados para a nova\nFaculdade de Filosofia, Ciências e Letras. Viajou à Europa com esse fim\ne no mesmo ano transferiu sua residência para o Rio de Janeiro, onde\nexerceu, por algum tempo, o cargo de diretor do Departamento Nacional de\nEnsino. Em 1936 regeu as cadeiras de vetores e geometria analítica,\ngeometria projetiva e nomografia na Escola Politécnica de São Paulo.\n\nFoi ainda engenheiro-chefe da Comissão de Saneamento da capital de São\nPaulo e chefe da Comissão de Obras Novas, dirigindo a parte final da\nconstrução da adutora de Rio Claro (SP).\n\nRepresentou o Brasil no I Congresso de Estradas de Rodagem de\nWashington.\n\nFaleceu no Rio de Janeiro no dia 5 de dezembro de 1937.\n\nFoi casado com Luísa Galvão, com quem teve três filhos.\n\nPublicou A teoria da relatividade e os raios espectrais do hidrogênio\n(1923), Leçons sur le calcule vectoriel (Paris, 1930), Introdução à\nmecânica dos quanta (conferências, 1931-1932), Estudos; ensino, ciências\nfísicas e matemática (1933), Representação aproximada de uma integral\nhiperelítica (1933).\n\n \n\n \n\nFONTES: ARAÚJO, A. Chefes; ARQ. OSVALDO ARANHA; Encic. Mirador; LEITE,\nA. História; MELO, L. Dic.; Personalidades.\n\n \n","ref":"FONTES: ARAÚJO, A. Chefes; ARQ. OSVALDO ARANHA; Encic. Mirador; LEITE,\nA. História; MELO, L. Dic.; Personalidades.\n\n \n","dic":"DHBB"}
