{"title":"REALE, Miguel","cargoss":["Reitor","Revolucionário ou revoltoso","Reitor"],"cargos_esp":["USP",0,"USP"],"datas_ini":[1949,1964,1969],"datas_fim":[1950,1964,1973],"estados":[0,0,0],"autor":[0],"content":"**REALE, Miguel**\n\n\\*mov. integralista; reitor USP 1949-1950; rev. 1964; reitor USP\n1969-1973.\n\n*Miguel Reale*nasceu em São Bento do Sapucaí (SP) no dia 6 de novembro\nde 1910, filho de Brás Giordano Reale e de Felicidade Vieira da Rosa\nGóis Chiaradia Reale.\n\nRealizou seus primeiros estudos em Itajubá (MG), mudando-se depois para\nSão Paulo, onde cursou o secundário no Instituto Médio Dante Alighieri e\ningressou em 1930 na Faculdade de Direito do Largo de São Francisco,\npela qual se formou em 1933. Nessa escola, participou ativamente da\npolítica e demais atividades extracurriculares desenvolvidas pelos\nestudantes, filiando-se à Ação Integralista Brasileira (AIB), agremiação\nde inspiração fascista fundada por Plínio Salgado (também natural de São\nBento do Sapucaí) e que, com o lema “Deus, pátria e família”, pregava a\nimplantação de um Estado corporativo-sindicalista no Brasil.\n\nJunto com um grupo de colegas, Reale tornou-se desde 1932 um dos\nprincipais colaboradores de Plínio, iniciando assim longa militância no\nmovimento integralista. Ainda jovem, destacou-se como teórico, dedicando\nseus estudos principalmente à questão do Estado, que concebia como tutor\nda vida social, opondo-se ao liberalismo e se identificando com a visão\nfascista do problema. Aos 23 anos, escreveu sobre esse tema seu primeiro\nlivro: *O Estado moderno,*publicado em 1934, pouco depois de sua\nformatura. Ainda em 1934, tornou-se um advogado militante, vindo a\npublicar, desde então, dezenas de pareceres e razões forenses.\n\nChefe do departamento nacional de doutrina da AIB e membro de seu\nconselho supremo, Reale era um dos encarregados da supervisão e da\ncensura a todos os artigos, livros, críticas, discursos e textos\nintegralistas, para que em nenhum momento os princípios do movimento e\nas orientações de Plínio fossem feridos. Organizou também cursos de\ndoutrina integralista e publicou vários artigos no jornal *A\nOfensiva,*órgão do movimento.\n\nPor indicação da convenção integralista realizada em 23 de abril de\n1933, concorreu no mês seguinte em São Paulo às eleições para a\nAssembléia Nacional Constituinte na legenda da AIB que, entretanto,\nsomou apenas dois mil sufrágios nesse primeiro teste eleitoral e não\nconseguiu eleger nenhum de seus quatro candidatos. Apesar desse revés, o\nmovimento continuou crescendo. Já em outubro, oitocentos militantes\nmarcharam pelas ruas de São Paulo com o sigma — símbolo integralista no\nbraço, “entre olhares curiosos e numerosos cumprimentos à romana dos\ntranseuntes”, conforme registrou um jornal da época.\n\nEm dezembro desse ano, Reale acompanhou Plínio Salgado e Gustavo Barroso\nem viagem ao Nordeste, onde proferiram conferências e fundaram núcleos\nda AIB, e em fevereiro e março de 1934 participou do primeiro congresso\nnacional integralista, realizado em Vitória, quando foram aprovados a\nestrutura interna e os estatutos do partido. Consolidou-se nesse\ncongresso o caráter da organização, dotada de uma direção única e\ncentralizada na figura do chefe supremo Plínio Salgado — que tinha sob\nsua responsabilidade direta os gabinetes civil e militar e o conselho\nnacional, além dos departamentos de finanças, propaganda, cultura\nartística, organização política, da milícia e de doutrina, onde estava\nReale. Considerado por Plínio “um grande valor” , ele liderava uma\nfacção mais ligada à experiência política que então se processava na\nItália e Portugal, enquanto Gustavo Barroso encabeçava a corrente mais\npróxima do nazismo alemão.\n\nEm setembro de 1934 acompanhou o chefe em outra viagem, dessa vez para\nfazer campanha integralista nos estados do Sul com vistas às eleições\nlegislativas estaduais e federais que se realizariam no mês seguinte.\nDurante todo o período de consolidação da AIB, Reale prosseguiu em suas\natividades intelectuais, escrevendo artigos e livros e pronunciando\nconferências, tornando-se, ao lado de Plínio Salgado e Gustavo Barroso,\num dos teóricos mais importantes do fascismo brasileiro.\n\nNa sua concepção, o integralismo pretendia “identificar Estado e povo,\nEstado e nação”, fundamentando a representação não em indivíduos ou\npartidos, mas: “a) em indivíduos unidos por laços biológicos e afetivos\n(famílias); b) em indivíduos unidos pela comunhão das atividades\nhabituais (sindicatos profissionais, de um lado; sociedades científicas,\nartísticas e religiosas, de outro — corporações).” Segundo ele, a\ndemocracia liberal era incapaz de resolver o problema da representação,\nentregando-a a partidos que “confundem os mais disparatados interesses à\nsombra de uma promessa de programa” e surgiam “quando há briga na\nfamília dos políticos”. Criticavam também o federalismo liberal, porque\nenfraquecia o poder central e conduzia a uma “refeudalização do Brasil”,\ne afirmava que o fascismo era uma “reação do Estado contra as\norganizações que o queriam absorver”.\n\nEm janeiro de 1936 Reale assumiu a direção da revista *Panorama,*centro\ndo pensamento político integralista, comparecendo também ao congresso da\nseção paulista da AIB, que reuniu representantes dos 259 núcleos da\nagremiação no estado. Nessa época, marcada pelo refluxo do movimento\ncomunista (derrotado em novembro do ano anterior), a AIB reforçou suas\npretensões legais e eleitorais. Foi então lançado um manifesto-programa\nque, segundo Reale, marcou nova e fundamental fase do integralismo.\n\nEm outubro desse ano, fundou em São Paulo o jornal *Ação* e em 1937,\nquando foi confirmado no cargo de secretário nacional de doutrina e\nestudos da AIB, era responsável por uma coluna no jornal *A Ofensiva.*O\ncrescimento do integralismo nesse período foi notório, embora, segundo\nEdgar Carone, seja exagerada a avaliação de seus chefes de que a AIB\npassara de duzentos mil para um milhão de membros, “no mínimo”, entre\n1934 e 1936. Nessa época, segundo Olbiano de Melo, a AIB possuía três\ndiferentes correntes internas de pensamento, os “burgueses”, os\n“antiimperialistas” e os “sindicalistas”, com a qual Reale se\nidentificava. O resultado do plebiscito interno realizado em maio de\n1937 para a escolha do candidato integralista às eleições para a\npresidência da República — previstas para outubro de 1938 — indicou,\nconforme foi divulgado oficialmente pela agremiação, 164 votos para\nReale, 1.397 dados a Gustavo Barroso e 846.554 para Plínio Salgado. No\ndia 14 do mês seguinte Reale integrou o grupo de 35 integralistas que\nvisitou o presidente Getúlio Vargas para oficializar a candidatura de\nPlínio.\n\nAs eleições, entretanto, foram suspensas e todos os partidos extintos\ncom o golpe chefiado pelo próprio Vargas que implantou o Estado Novo em\n10 de novembro de 1937. A AIB, que Plínio Salgado esperava transformar\nem partido oficial do novo regime, foi dissolvida no dia 3 de dezembro,\ndando lugar à Associação Brasileira de Cultura, da qual Miguel Reale\ntornou-se diretor de pesquisa.\n\nDiante desses acontecimentos, os integralistas se dividiram em duas\ntendências, uma de confronto e outra de conciliação com Vargas.\nFinalmente, seguindo as orientações de Plínio Salgado, terminaram\noptando pela preparação de um golpe de força contra o chefe do governo.\nDeflagrado com o apoio de oposicionistas liberais — e rapidamente\ndominado — em 11 de maio de 1938 no Distrito Federal, o levante não\ncontou com qualquer participação de Reale.\n\nSeguiu-se então um período de retração do integralismo, com a prisão e o\nexílio de muitos de seus líderes, entre os quais Plínio que, de\nPortugal, indicou Raimundo Padilha para substituí-lo na chefia do\nmovimento no Brasil. Em 1940, Padilha procurou articular-se com os\nchefes remanescentes, menos atingidos pelas medidas punitivas do\ngoverno, particularmente os de São Paulo, onde estava Miguel Reale.\nAmbos participaram, junto com Olbiano de Melo, Alfredo Buzaid, José\nLoureiro Júnior, Roland Corbisier, Cirilo Júnior e Mário Cabral, entre\noutros, de uma reunião realizada no bairro de Vila Mariana, na capital\npaulista, onde Padilha expôs a orientação de Plínio Salgado no sentido\nde promover uma aproximação com Vargas.\n\nAinda em 1940, no mês de setembro, Miguel Reale foi aprovado em concurso\npara professor catedrático de filosofia do direito na Universidade de\nSão Paulo (USP), com a tese *Fundamentos do direito*. Essa obra lançou\nas bases de sua teoria tridimensional do direito, que se tornaria\nbastante conhecida em todo o mundo. Em 1942, tornou-se membro do\nConselho Administrativo do Estado de São Paulo, cargo que ocuparia até\n1944.\n\nParalelamente à carreira acadêmica, Reale permaneceu nas fileiras do\nintegralismo, o qual, contudo, nunca mais recuperaria sua antiga força.\nA entrada do Brasil na Segunda Guerra Mundial ao lado das forças aliadas\nem 1942 obstruiu o trânsito dos integralistas, simpatizantes do Eixo\njunto ao governo, e fez com que crescessem as manifestações de repúdio\ncontra a sua presença na cena política. Miguel Reale foi um dos presos\ndurante a onda antiintegralista dessa época. Em seu depoimento à\npolícia, negou que o integralismo tivesse qualquer semelhança ideológica\ncom o nazi-fascismo.\n\nEntre 1945 e 1964\n\nCom o fim****do Estado Novo em 29 de outubro de 1945 e a reorganização\npolítica do país, Reale participou da comissão diretora do Partido\nPopular Sindicalista (PPS), ao lado de José Adriano Marrey Júnior\n(presidente do partido), Olavo de Oliveira (vice-presidente), João\nPacheco de Oliveira e Raimundo de Monte Arrais, entre outros. Em seu\nprograma, o PPS defendia a república federativa e dava prioridade à\nsolução dos problemas relativos à saúde, à educação e ao “soerguimento\neconômico do homem, garantindo-lhe as riquezas da terra, crédito e\ntransporte, dentro de uma democracia social e econômica fundada na\njustiça social”. Em 1946 o PPS uniu-se ao Partido Republicano\nProgressista e ao Partido Agrário Nacional, formando o Partido Social\nProgressista (PSP), presidido por Ademar de Barros, candidato vitorioso\nao governo paulista em 1947. Na sua gestão, Miguel Reale,\nvice-presidente do PSP, foi secretário de Justiça e Negócios Interiores\nde São Paulo.\n\nEm 1949, Reale foi um dos fundadores e tornou-se presidente do Instituto\nBrasileiro de Filosofia, entidade responsável pela edição da *Revista\nBrasileira de Filosofia*. Ainda em 1949, tornou-se reitor da USP,\nexercendo o cargo até o ano seguinte. Nesse período, reestruturou\ndiversos departamentos e institutos, e traçou o primeiro plano de\nexpansão universitária para o interior do estado, que começou pela\nimplantação da Faculdade de Medicina de Ribeirão Preto. Em 1950\ncandidatou-se, sem êxito, ao Senado, apoiado por uma dissidência do PSP\ne pelo Partido Trabalhista Nacional, ao qual se filiou no ano seguinte.\nNessa época, integrou a delegação brasileira à conferência da\nOrganização Internacional do Trabalho, em Genebra. Não teve atuação\npartidária entre 1953 e 1963, dedicando-se às atividades intelectuais.\nEm 1954 foi um dos fundadores da Sociedade Interamericana de Filosofia,\ninstituição que viria a presidir em duas ocasiões. Em 1957, 1959 e 1961,\nchefiou a delegação brasileira aos congressos interamericanos de\nFilosofia, realizados, respectivamente, em Santiago do Chile, Washington\ne Buenos Aires. No campo profissional, tornou-se consultor-geral da\nLight Serviços de Eletricidade S.A., em 1958.\n\nA crise dos primeiros anos da década de 1960 trouxe Reale de volta à\npolítica. Nesses anos, aguçou-se a polarização entre as forças que\ndefendiam reformas de cunho social e nacionalista, agrupadas\nprincipalmente em torno do programa de reformas de base (agrária,\nurbana, constitucional e de disciplina da ação do capital estrangeiro) e\ntendências de cunho conservador que reagiam a elas e enfatizavam a\nnecessidade de contenção das reivindicações trabalhistas, de defesa das\nformas tradicionais de propriedade e de liberdade de movimentos para o\ncapital estrangeiro.\n\nA renúncia do presidente Jânio Quadros em agosto de 1961 precipitou\ngrave crise em virtude da oposição dos ministros militares à posse de\nseu substituto legal, o vice-presidente João Goulart, comprometido com\nas reformas de base e o movimento sindical. Depois de intensos debates,\no Congresso Nacional aprovou no dia2 de setembro a Emenda Constitucional\nnº 4 que, instituindo o regime parlamentarista, viabilizou a sucessão no\nquadro da legalidade.\n\nCom Goulart na presidência a crise se aprofundou e as forças\nconservadoras tenderam cada vez mais a se agrupar em torno da\nperspectiva de depor o governo federal pela força. Nesse contexto,\napesar de não ter aprovado a candidatura — novamente vitoriosa de Ademar\nde Barros ao governo de São Paulo em 1962, Reale tornou a ocupar a\nSecretaria de Justiça do estado nos dois anos subseqüentes. Em\nentrevista à *Folha de S. Paulo*em 16 de janeiro de 1977, esclareceu que\naceitou o convite do governador eleito em 1962 “dada a necessidade de um\nentendimento amplo da classe política ante os rumos perigosos que\ntomavam os acontecimentos na esfera federal após o plebiscito que\nrestituiu [em 6 de janeiro de 1963] ao presidente João Goulart os\npoderes próprios do regime presidencialista”. Afirmou ainda que nesse\nperíodo esteve duas vezes com o presidente, expondo-lhe os perigos de\numa posição política com a qual o governo paulista não poderia\ncompactuar. Amigo e antigo correligionário na AIB do general Olímpio\nMourão Filho, então comandante da 2ª Região Militar, Reale confirmou que\n“estava a par de seu incansável trabalho de esclarecimento da área\nmilitar contra um golpe de mão de natureza filocomunista”.\n\nO governo paulista foi um dos principais pontos de apoio do movimento\npolítico-militar que em 31 de março de 1964 derrubou o presidente\nGoulart, e Reale foi elemento importante nas articulações que o\nantecederam. Por incumbência de Ademar de Barros estudou, junto com\nErnesto de Morais Leme, Alfredo Buzaid e Marotta Rangel, as providências\na serem tomadas pelos revolucionários no plano internacional para o\nreconhecimento do estado de beligerância no país caso uma guerra civil\nprolongada o exigisse. Reale permaneceu na Secretaria de Justiça de São\nPaulo até a deposição de Goulart.\n\nReale e o regime pós-1964\n\nEm 1968, foi convidado pelo presidente Artur da Costa e Silva para\nintegrar uma comissão de alto nível incumbida de estudar a reforma da\nConstituição de 1967. Foi o autor de várias e importantes proposições\nadotadas na emenda constitucional de 1969, promulgada pela junta militar\nque substituiu Costa e Silva, numa situação de endurecimento do regime\npolítico vigente sob a égide do Ato Institucional nº 5 de 13 de dezembro\nde 1968. Ainda em 1969 foi supervisor da Comissão Elaboradora e Revisora\ndo Código Civil Brasileiro, e assumiu novamente a reitoria da USP, onde\npermaneceu até 1973. Nessa gestão, implantou a reforma universitária e\nadministrativa, e completou a estrutura dos *campi*da capital e do\ninterior.\n\nNo biênio 1972-1973, foi também consultor do Ministério das Relações\nExteriores, colaborando na preparação do tratado com o Paraguai sobre a\nconstrução da usina hidrelétrica de Itaipu e a constituição da empresa\nbrasileiro-paraguaia Itaipu Binacional. Em 1974 foi nomeado pelo\npresidente da República, general Emílio Garrastazu Médici, para integrar\no Conselho Federal de Cultura, cargo que ocuparia por 15 anos. Ainda em\n1974, deixou o cargo de consultor-geral da Light, vindo a ocupar nesse\nmesmo ano a chefia da diretoria de coordenação da empresa em São Paulo,\nfunção que desempenharia até 1979.\n\nEm 1975, depois de rejeitar um lugar de ministro no Supremo Tribunal\nFederal, tomou posse na cadeira nº 14 da Academia Brasileira de Letras.\nFoi membro do conselho técnico da Fundação Mílton Campos de Pesquisas e\nEstudos Políticos, ligada ao partido governista Aliança Renovadora\nNacional (Arena), e colaborou em sua revista *Política.*\n\nReale defendeu a institucionalização do regime político instaurado no\npaís em 1964, inclusive com a adoção de uma anistia parcial e a\nsubstituição do Ato Institucional nº 5 por um conjunto de medidas “de\ndefesa do Estado” que pudessem ser incorporadas às regras do direito.\nAfirmava que “toda revolução, para assegurar seus ideais ou propósitos,\nsó atinge segurança efetiva no instante em que se institucionaliza, isto\né, quando as decisões deixam de ser puramente pessoais para se\nexpressarem através de um sistema transpessoal e objetivo de regras de\ndireito”. Em entrevista ao *Jornal do Brasil* de 28 de junho de 1978\nelogiou as negociações conduzidas pelo então senador Petrônio Portela\ncom vistas à introdução de reformas políticas, e admitiu ter colaborado\nna elaboração do projeto governamental em curso no campo institucional.\nCom efeito, importantes medidas propostas por ele a partir de 1977 foram\nposteriormente aplicadas pelo governo federal. Ainda em 1977, no mês de\noutubro, tornou-se membro da Academia Paulista de Letras.\n\nEm 1979 tornou-se consultor jurídico da presidência da Light Serviços de\nEletricidade S.A., posteriormente Eletricidade de São Paulo S.A.\nEletropaulo. Membro do conselho de administração desta empresa entre\nabril de 1981 e abril de 1985, integrou o conselho de administração da\nItaipu Binacional de junho de 1982 a março de 1997.\n\nEm 1985, passou a integrar a Comissão de Estudos Constitucionais,\npresidida por Afonso Arinos e composta por 50 integrantes, entre\njuristas, advogados, professores de direito etc. A comissão trabalhou\ndurante um ano e, em setembro de 1986, concluiu o anteprojeto de\nConstituição composto de 468 artigos. O texto serviu de subsídio à\nAssembléia Nacional Constituinte, que funcionou entre fevereiro de 1987\ne outubro de 1988.\n\nDurante sua longa trajetória intelectual Miguel Reale participou de um\ngrande número de congressos de filosofia no Brasil e no exterior. Membro\ndo Conselho Federal de Cultura, do Conselho Estadual de Educação do\nEstado de São Paulo, do Instituto dos Advogados de São Paulo e da\nAcademia Paulista de Letras, entre outros, e membro correspondente do\nInstituto Argentino de Filosofia Jurídica y Social e da International\nPhenomenological Society, possui uma vasta produção nos campos da\nciência política, direito e filosofia.\n\nFaleceu em São Paulo no dia 14 de abril de 2006.\n\nCasou-se com Filomena Pucci Reale, com quem teve três filhos. Seu filho,\nMiguel Reale Junior, foi ministro da Justiça no Governo Fernando\nHenrique Cardoso.\n\nSuas principais obras, além das já citadas, são as seguintes: *O\noperariado*e *o integralismo* (1934),*Formação da política burguesa*\n(1934), *O capitalismo internacional*(1935), *Atualidades de um mundo\nantigo*(1936), *Perspectivas integralistas* (1936), *O ABC* *do\nintegralismo*(1937),*Atualidades brasileiras* (1937, 2ª ed. 1983),*A\ndoutrina de Kant no Brasil*(1949),*Horizontes do* *direito e da história\n— estudo de filosofia do* *direito e da cultura*(1956),*Momentos\ndecisivos do pensamento nacional*(1958), *Teoria* *do direito e do\nEstado* (1960, 2ª ed.), *Fundamentos da teoria tridimensional do\ndireito* (1960),*Nos quadrantes do direito positivo* (1960),*Pluralismo\ne liberdade*(1960),*Imperativos da revolução*de *março*(1965), *O\ndireito como experiência: introdução à epistemologia\njurídica*(1968),*Democrata e revolução* (1968, 2ª ed.) *Da revolução à\ndemocracia* (1969, 2ª ed. 1977), *Direito\nadministrativo*(1969),*Problemas do nosso tempo*(1969),*Cem anos de*\n*crença do direito no Brasil (*1973), *Livros preliminares de\ndireito*(1973, 3ª ed.), *A filosofia* *do direito*(1978),*Política de\nontem e de hoje, Poemas da noite*(1980), *O homem e* *seus\nhorizontes*(1980, 2ª ed. 1997), *A filosofia na obra de Machado de\nAssis* (1982), *Direito natural/direito positivo* (1984), *Liberdade e\ndemocracia*(1987), *Aplicações da Constituição de 1988* (1990), *Face\noculta de Euclides da Cunha*(1993), *Estudos de filosofia brasileira*\n(1994), *Paradigmas da cultura contemporânea*(1996), *O Estado de\ndireito e o conflito das ideologias* (1998), *Das letras à filosofia*\n(1998).\n\nAmélia Coutinho\n\nFONTES: ACAD. BRAS. LETRAS. *Anuário*; BROXSON, E. *Plínio*; CARONE, E.\n*Estado;*CARONE, E. *República nova;*CHAGAS, C. *113;* CURRI. BIOG.;\n*Grande encic. Delta; Folha Online* (14/4/06); INF. BIOG.;\nINST*.*ESTUDOS BRAS.;  *Jornal* *do Brasil*(7/7/76, 28/6/78 e 15/11/80);\nLEITE, A. *História;*LEVINE, R. *Vargas;* MELO, L.*Dic.;*MELO, O*.\nMarcha;*MENESES, R. *Dic.;*NASSER, D.*Revolução; Novo dic. de*\n*história; Ofensiva; Perfil*(1972);*Política;* SÃO PAULO. *Quem*; SILVA,\nH*. 1935;*SILVA, H. *1938;*TAVARES, J. *Radicalização;* TRINDADE, H.\n*Integralismo;*UNIÃO NAC. ESTUDANTES. *Quinta*;*.*\n\n \n\n \n","ref":"FONTES: ACAD. BRAS. LETRAS. *Anuário*; BROXSON, E. *Plínio*; CARONE, E.\n*Estado;*CARONE, E. *República nova;*CHAGAS, C. *113;* CURRI. BIOG.;\n*Grande encic. Delta; Folha Online* (14/4/06); INF. BIOG.;\nINST*.*ESTUDOS BRAS.;  *Jornal* *do Brasil*(7/7/76, 28/6/78 e 15/11/80);\nLEITE, A. *História;*LEVINE, R. *Vargas;* MELO, L.*Dic.;*MELO, O*.\nMarcha;*MENESES, R. *Dic.;*NASSER, D.*Revolução; Novo dic. de*\n*história; Ofensiva; Perfil*(1972);*Política;* SÃO PAULO. *Quem*; SILVA,\nH*. 1935;*SILVA, H. *1938;*TAVARES, J. *Radicalização;* TRINDADE, H.\n*Integralismo;*UNIÃO NAC. ESTUDANTES. *Quinta*;*.*\n\n \n\n \n","dic":"DHBB"}
