{"title":"REBELO, Aarão","cargoss":["Constituinte","Deputado federal"],"cargos_esp":[0,0],"datas_ini":[1934,1962],"datas_fim":[1934,1962],"estados":[0,"SC"],"autor":[0],"content":"**REBELO, Aarão**\n\n\\*const. 1934; dep. fed. SC 1962.\n\n \n\n*Aarão Rabelo* nasceu em Itajaí (SC) no dia 26 de fevereiro de 1906,\nfilho de Alfredo José Rebelo e de Maria Cunha Rebelo.\n\nFreqüentou o Colégio Santo Antônio, em Blumenau (SC), e o Ginásio\nCatarinense, em Florianópolis. Cursou ainda o Ginásio Paranaense, em\nCuritiba, ingressando depois na Faculdade de Direito dessa capital, onde\nestudou até o segundo ano. Entre 1929 e 1930 — ano em que se bacharelou\npela Faculdade de Direito do Rio de Janeiro, então capital federal —\nparticipou do movimento da Aliança Liberal em Santa Catarina e no Rio de\nJaneiro através de comícios e da imprensa.\n\nDe volta a seu estado natal, foi inspetor do ensino federal e, de 1930 a\n1931, exerceu a função de secretário estadual da Fazenda e Obras\nPúblicas na gestão do interventor Ptolomeu de Assis Brasil. Ainda em\n1931, tornou-se procurador da Junta de Sanções.\n\nUm dos fundadores do Partido Liberal Catarinense (PLC), em maio de 1933\nelegeu-se deputado por Santa Catarina à Assembléia Nacional Constituinte\nna legenda dessa agremiação. Essa eleição foi anulada, mas, num segundo\npleito, Aarão Rebelo conseguiu assegurar o mandato, assumindo-o em\njaneiro de 1934. Participou dos trabalhos constituintes, combatendo\nsistematicamente a concessão de direitos políticos à mulher e chegando a\napresentar nesse sentido uma emenda ao projeto de Constituição. Devido a\nessa atitude, foi cognominado “o inimigo das mulheres”. Com a\npromulgação da nova Carta (17/7/1934), teve o mandato estendido até maio\nde 1935.\n\nDepois de longo afastamento da Câmara, em outubro de 1958 elegeu-se\nsegundo-suplente de deputado federal por Santa Catarina na legenda do\nPartido Social Democrático (PSD), ocupando uma cadeira na Câmara dos\nDeputados de agosto a novembro de 1962, quando deixou definitivamente a\ncasa.\n\nColaborou na *Gazeta do Povo*, de Curitiba, e na *Gazeta de Notícias*,\ndo Rio de Janeiro.\n\nFaleceu em Curitiba no dia 24 de março de 1989.\n\nEra casado com Julieta Brandão Rebelo, com quem teve dois filhos.\n\n \n\nFONTES: ARQ. GETÚLIO VARGAS; CABRAL, O. *Era*; CÂM. DEP. *Deputados*;\n*Câm. Dep. seus componentes*; GODINHO, V. *Constituintes*; INF. Péricles\nRebelo; TRIB. SUP. ELEIT. *Dados* (4 ).\n\n \n","ref":"FONTES: ARQ. GETÚLIO VARGAS; CABRAL, O. *Era*; CÂM. DEP. *Deputados*;\n*Câm. Dep. seus componentes*; GODINHO, V. *Constituintes*; INF. Péricles\nRebelo; TRIB. SUP. ELEIT. *Dados* (4 ).\n\n \n","dic":"DHBB"}
