{"title":"REBELO, José Pires","cargoss":["Deputado federal","Senador","Senador"],"cargos_esp":[0,0,0],"datas_ini":[1918,1935,1923],"datas_fim":[1923,1937,1923],"estados":["PI","PI","PI"],"autor":[0],"content":"**REBELO, José Pires**\n\n\\*dep. fed. PI 1918-1923; sen. PI 1923 e 1935-1937.\n\n \n\n*José Pires Rebelo* nasceu em Piripiri (PI) no dia 12 de setembro de\n1877, filho de Tomás Rebelo e de Lina Cassiano Pires Rebelo.\n\nRealizou os primeiros estudos na Bahia, em Recife, em Fortaleza e em\nTeresina. Em 1900 formou-se em engenharia civil pela Escola Politécnica\ndo Rio de Janeiro, no então Distrito Federal.\n\nComeçou a exercer a profissão como construtor de estradas em Pernambuco.\nFiliado ao Partido Liberal (PL), participou da Campanha Civilista,\nmovimento de caráter antimilitarista que promoveu entre 1909 e 1910 a\ncandidatura de Rui Barbosa à presidência da República, em oposição à do\nmarechal Hermes da Fonseca, vitorioso no pleito de março de 1910.\n\nEm dezembro de 1909, quando da sucessão do governador de seu estado,\nAnísio de Abreu, juntou-se ao grupo oposicionista, ao lado de Antônio\nRibeiro Gonçalves e Matias Olímpio. Esse grupo, no entanto, foi\nderrotado na eleição de março de 1910. Viajou então para o Rio de\nJaneiro, seguindo posteriormente para o Maranhão. Nesse estado voltou a\nexercer sua profissão, construindo uma estrada de ferro ao longo do rio\nItapicuruí. Alguns anos depois voltou à política no Piauí, participando\nda campanha eleitoral de Eurípedes de Aguiar, candidato oposicionista ao\ngoverno do estado, eleito no pleito de 1916.\n\nPrefeito de Teresina e diretor de Obras Públicas do Piauí, em 1918\nelegeu-se deputado federal por esse estado. Assumindo sua cadeira em\nmaio desse ano e reeleito em 1921, permaneceu na Câmara até 1923, quando\npassou a ocupar no Senado a vaga de Félix Pacheco, nomeado ministro das\nRelações Exteriores. Nesse mesmo ano deixou o Senado. Em 1929-1930\nparticipou da campanha da Aliança Liberal em torno da candidatura de\nGetúlio Vargas à presidência da República.\n\nEm maio de 1933, após a Revolução de 1930, candidatou-se à Assembléia\nNacional Constituinte, na legenda do Partido Republicano do Piauí,\noposicionista, obtendo apenas uma suplência. Em seguida foi eleito\nsenador pela Assembléia Constituinte do Piauí, assumindo sua cadeira em\nmaio de 1935. Segundo-secretário do Senado, permaneceu nessa casa até 10\nde novembro de 1937, quando o advento do Estado Novo (1937-1945)\ndissolveu os órgãos legislativos do país.\n\nEm fevereiro de 1945, já doente, lançou um manifesto ao povo piauiense\nconclamando-o a combater o regime do Estado Novo, derrubado em outubro\ndesse mesmo ano.\n\nFaleceu na cidade do Rio de Janeiro, no dia 1º de dezembro de 1947.\n\n \n\n \n\nFONTES: ARQ. OSVALDO ARANHA; Boletim Min. Trab.; Diário do Congresso\nNacional; Grande encic. Delta; Ilustração Brasileira (12/22); LIRA, A.\nSenado; SENADO. Anais (2/5/35); SENADO. Dados.\n\n \n","ref":"FONTES: ARQ. OSVALDO ARANHA; Boletim Min. Trab.; Diário do Congresso\nNacional; Grande encic. Delta; Ilustração Brasileira (12/22); LIRA, A.\nSenado; SENADO. Anais (2/5/35); SENADO. Dados.\n\n \n","dic":"DHBB"}
