{"title":"REGO, José Tavares Bordeaux","cargoss":["Comandante da III Zona Aérea"],"cargos_esp":[0],"datas_ini":[1969],"datas_fim":[1970],"estados":[0],"autor":[0],"content":"**REGO, José Tavares Bordeaux**\n\n\\*militar; comte. III ZA 1969-1970.\n\n \n\n*José Tavares Bordeaux Rego*****nasceu no Rio de Janeiro, então Distrito\nFederal, no dia 5 de julho de 1913.\n\nSentou praça na Escola Militar do Realengo em março****de 1933.\nDeclarado aspirante-a-oficial em janeiro de 1936, em setembro desse\nmesmo ano passou a segundo-tenente e, em dezembro do ano seguinte, a\nprimeiro-tenente. Integrou a arma de aviação do Exército.\n\nCom a criação do Ministério da Aeronáutica em janeiro de 1941,\ntransferiu-se nesse mesmo mês para esse novo ramo das forças armadas. Em\ndezembro foi promovido a capitão-aviador, passando a major-aviador em\njaneiro de 1945, a tenente-coronel-aviador em setembro de 1950, a\ncoronel-aviador em janeiro de 1957, a brigadeiro em novembro de 1964, e\na major-brigadeiro em fevereiro de 1969. Em abril desse ano foi nomeado\ncomandante da III Zona Aérea (III ZA), atual III Comando Aéreo Regional\n(III Comar), com sede no Rio de Janeiro, em substituição ao\nmajor-brigadeiro Newton Rubem Sholl Serpa. Exerceu essa função até abril\nde 1970, quando transferiu o cargo ao major-brigadeiro João Paulo\nMoreira Burnier.\n\nEm janeiro de 1972 assumiu o cargo de diretor do Departamento de Aviação\nCivil (DAC), em substituição ao tenente-brigadeiro-do-ar Henrique de\nCastro Neves e, em novembro desse mesmo ano, foi promovido a\ntenente-brigadeiro-do-ar. Permaneceu à frente do DAC até março de 1974,\nquando foi substituído pelo tenente-brigadeiro-do-ar Deoclécio Lima de\nSiqueira.\n\nFez os cursos de aviação militar (categorias A e B), de tática aérea, de\nestado-maior, de preparação de instrutor, superior de comando, superior\nde guerra e de aperfeiçoamento de oficiais aviadores. Nos Estados Unidos\nfez os cursos de revisão de instrução de vôo básico e avançado e o\nespecial de instrução básica de vôo.\n\nFaleceu no Rio de Janeiro no dia 1º de janeiro de 1988.\n\n \n\nFONTES: CORRESP. III COMDO. AÉREO REGIONAL; *Jornal do Brasil* (6/1/89);\nMIN. AER. *Almanaque* (1963 e 1974).\n\n \n","ref":"FONTES: CORRESP. III COMDO. AÉREO REGIONAL; *Jornal do Brasil* (6/1/89);\nMIN. AER. *Almanaque* (1963 e 1974).\n\n \n","dic":"DHBB"}
