{"title":"REHEM, Salomão","cargoss":["Deputado federal","Deputado federal"],"cargos_esp":[0,0],"datas_ini":[1962,1961],"datas_fim":[1962,1961],"estados":["BA","BA"],"autor":[0],"content":"**REHEM, Salomão**\n\n\\*dep. fed. BA 1961 e 1962.\n\n \n\n*Salomão do Nascimento Rehem* nasceu em Euclides da Cunha (BA) no dia 7\nde janeiro de 1907, filho de Joaquim Nascimento Rehem e Constança Dantas\nRehem. Seu primo, Antônio Olímpio Rehem da Silva, foi prefeito de\nItabuna (BA).\n\nIngressando na Polícia Militar da Bahia como recruta, em 1928 foi\npromovido a sargento. Dois anos depois, tornou-se oficial da corporação.\nEm 1931, foi transferido para o 2º Batalhão, sediado em Ilhéus, onde\ntornou-se comandante do 2º Pelotão. Em dezembro tornou-se delegado de\npolícia de Itabuna. Em 1932 tornou-se delegado especial em Ilhéus. Em\n1940 foi promovido ao posto de capitão. Cinco anos depois, em 1945,\ntornou-se major e, em 1947, foi nomeado chefe da Guarda Civil em\nSalvador.\n\nNo pleito de outubro de 1950, candidatou-se a deputado estadual na\nlegenda do Partido Republicano (PR). Eleito, exerceu o mandato de\nfevereiro de 1951 a janeiro de 1955. Reeleito em outubro de 1954,\ncumpriu seu segundo mandato na Assembléia Legislativa baiana entre 1955\ne 1959. Ainda em 1955, foi promovido a tenente-coronel.\n\nNo pleito de outubro de 1958, tentou uma vaga na Câmara dos Deputados,\nsempre na legenda do PR, mas obteve apenas a segunda suplência. Em 1960,\nfoi para a reserva no posto de coronel da Polícia Militar.\n\nExerceu o mandato de deputado federal pela Bahia de outubro a dezembro\nde 1961 e de maio a dezembro de 1962. Na eleição seguinte, realizada em\noutubro de 1962, elegeu-se quinto suplente de deputado federal na\nlegenda da Aliança Trabalhista, composta pelo PR, pelo Partido\nTrabalhista Brasileiro (PTB) e pelo Partido de Representação Popular\n(PRP).\n\nEntre 1965 e 1970, foi diretor do Instituto do Cacau.\n\nFuncionário da polícia baiana e produtor rural na Bahia, foi delegado\nregional em Ilhéus e no sul do estado e comandante da polícia baiana,\nalém de chefe da Casa Civil. Foi ainda membro da Cooperativa Central dos\nCacauicultores de Ilhéus e do Conselho Nacional dos Produtores de Cacau\n(CNPC).\n\nFaleceu em Ilhéus no dia 3 de março de 1991.\n\nEra casado com Idalzina Kruschewsky Rehem, com quem teve nove filhos.\nSeu sogro, José Kruschewsky, foi prefeito de Itabuna.\n\n \n\nFONTES: CÂM. DEP. *Deputados*; CÂM. DEP. *Deputados brasileiros.\nRepe*rtório (1946-1967); CÂM. DEP. *Súmulas*; INF. Vera Lúcia\nKruschewsky Rehem; TRIB. SUP. ELEIT. *Dados* (4 e 6).\n\n \n","ref":"FONTES: CÂM. DEP. *Deputados*; CÂM. DEP. *Deputados brasileiros.\nRepe*rtório (1946-1967); CÂM. DEP. *Súmulas*; INF. Vera Lúcia\nKruschewsky Rehem; TRIB. SUP. ELEIT. *Dados* (4 e 6).\n\n \n","dic":"DHBB"}
