{"title":"REIS, Fernando Antônio Roquete","cargoss":["Presidente de associação ou confederação de empregados ou empregadores"],"cargos_esp":["CVRD"],"datas_ini":[1974],"datas_fim":[1978],"estados":[0],"autor":[0],"content":"**REIS, Fernando Antônio Roquete**\n\n\\*pres. CVRD 1974-1978.\n\n \n\n*Fernando Antônio Roquete Reis* nasceu em Belo Horizonte****no dia 14 de\nnovembro de 1932, filho de Antero José dos Reis e Maria Vitória Roquete\nReis.\n\nEm 1958, bacharelou-se em economia pela Faculdade de Ciências Econômicas\nda Universidade Federal de Minas Gerais (UFMG). No ano seguinte,\nprosseguiu seus estudos acadêmicos na mesma universidade cursando\npós-graduação em análises econômicas, concluída em 1960. Ainda em 1959,\nfoi admitido como pesquisador e professor-assistente na UFMG, cargos nos\nquais permaneceria até 1962 e 1969, respectivamente.\n\nEm 1962, tornou-se economista da Associação Comercial de Minas Gerais.\nNo ano seguinte, fez um curso de extensão em desenvolvimento regional na\nUniversidade de Nuevo Leon, no México, e em julho desse mesmo ano foi\nadmitido como economista do Banco de Desenvolvimento de Minas Gerais.\nIniciou sua carreira dentro do banco como assessor do departamento de\nanálises e projetos e, ainda no mesmo ano foi promovido a chefe do\ndepartamento de estudos e planejamento. Em novembro de 1966, tornou-se\ntambém diretor do gabinete de planejamento e controle do Conselho\nEstadual de Desenvolvimento de Minas Gerais, onde permaneceria até\nnovembro de 1969. Em julho de 1967, foi empossado diretor adjunto do\nBanco de Desenvolvimento de Minas Gerais e, no mês seguinte, diretor.\n\nEm dezembro de 1969, tornou-se membro do Conselho Monetário Nacional e\ndiretor do Banco Central do Brasil, permanecendo em ambos os cargos até\nfevereiro de 1971.\n\nDe volta a Minas Gerais, foi titular da Secretaria de Fazenda do estado,\ncargo no qual permaneceu até março de 1974.\n\nNo mês seguinte, no início do mandato presidencial do general Ernesto\nGeisel, foi empossado na presidência da Companhia Vale do Rio Doce\n(CVRD), substituindo Raimundo Pereira Mascarenhas e permanecendo neste\ncargo até abril de 1978, quando Joel Mendes Rennó ocupou seu lugar. Sua\ngestão foi marcada por uma política de diversificação, já iniciada com\nMascarenhas: o desenvolvimento da Celulose Nipo-Brasileira (Cenibra);\ninvestimento nos programas florestais; a linha do fosfato, com a Valep e\na Valefértil; o fim da duplicação da linha da estrada de ferro Vitória a\nMinas; o início do projeto de Carajás; e as pesquisas com carvão\nvegetal. Outros dois fatos que marcaram sua passagem pela CVRD foram a\ncrise siderúrgica mundial e a compra da parte da United States Steel na\nAmazônia Mineração S.A., transação no valor de 50 milhões de dólares.\n\nLogo após deixar a CVRD assumiu a presidência da Barreto Trading, uma\nholding do grupo Café Solúvel Brasília, onde permaneceu até sua morte.\n\nFaleceu no Rio de Janeiro no dia 23 de junho de 1983.\n\nEra casado com Zilá Tostes Reis, com quem teve cinco filhos, e mais\ntarde com Vanda Maria Gouveia Roquete Reis, com quem teve duas filhas.\n\nPublicou os seguintes trabalhos: Elementos para uma teoria do\nplanejamento regional, na *Revista Brasileira de Ciências Sociais*\n(1963), *A economia açucareira em Minas Gerais* (1965), *A indústria\nmineira de cimento* (1965), *Diagnóstico da economia mineira*(1968),\n*Programa de desenvolvimento da pecuária de corte* (1969), *Bases para\numa estratégia de desenvolvimento*(1969), *Minas* (1972), além de\ndiversos artigos sobre finanças, tributação, política fiscal,\nfinanciamento do desenvolvimento etc. publicados em jornais e revistas.\n\n \n\nFONTES: CURRIC. BIOG.; INF. FAM. Zilá Tostes Reis; *Vale 40 anos.*\n\n \n\n \n","ref":"FONTES: CURRIC. BIOG.; INF. FAM. Zilá Tostes Reis; *Vale 40 anos.*\n\n \n\n \n","dic":"DHBB"}
