{"title":"REIS, Humberto","cargoss":["Deputado federal","Deputado federal"],"cargos_esp":[0,0],"datas_ini":[1960,1959],"datas_fim":[1960,0],"estados":["MG","MG"],"autor":[0],"content":"**REIS, Humberto**\n\n\\*dep. fed. MG 1959, 1960.\n\n*Humberto de Matos Reis* nasceu em São Luís no dia 23 de outubro de\n1919, filho de Carlos Humberto Reis e de Francisca de Matos Reis.\n\nIndustriário e funcionário do Instituto do Açúcar e do Álcool (IAA),\nelegeu-se vereador em Belo Horizonte pelo Partido Republicano (PR),\ntendo presidido a Câmara de janeiro de 1956 a janeiro de 1958. Em\noutubro do mesmo ano disputou uma cadeira de deputado federal por Minas\nGerais, mas obteve apenas uma suplência. Exerceu o mandato de 22 de\nabril a 7 de junho de 1959 e de 16 de agosto a 16 de outubro de 1960. Em\noutubro de 1962, voltou a disputar, sempre pelo PR, uma vaga na Câmara\ndos Deputados, mas conseguiu somente a quarta suplência.\n\nEm 1963, tornou-se chefe de gabinete do prefeito de Belo Horizonte,\nJorge Carone Filho, também do PR. Com o movimento político-militar de 31\nde março de 1964 que depôs o presidente João Goulart (1961-1964), Carone\nfoi afastado e com isso Humberto Reis deixou a chefia de gabinete.\n\nEm seguida, retornou às suas atividades no IAA, em Belo Horizonte, mas\ncontinuou vinculado ao PR até outubro de 1965, quando, pelo Ato\nInstitucional nº 2, foram extintos os partidos políticos então\nexistentes e instalado o bipartidarismo. Reis filiou-se então ao\nMovimento Democrático Brasileiro (MDB), partido de oposição ao regime\nmilitar, mas deixou de disputar cargos eletivos.\n\nAposentado pelo IAA, em 1977 foi nomeado pelo governador Aureliano\nChaves (1975-1978) diretor da Comissão de Desenvolvimento do Vale do\nJequitinhonha (Codevale), cargo que ocupou até 1978. Voltou à Codevale\nem 1982, atendendo a convite do governador Francelino Pereira\n(1979-1983). Com a posse de Tancredo Naves no governo de Minas Gerais em\nmarço de 1983, foi nomeado diretor-presidente da Codevale, sendo mantido\nneste cargo pelo governador Hélio Garcia (1984-1987). Em 1986, deixou a\npresidência da Codevale e assumiu o cargo de diretor da Fundação Clóvis\nSalgado, entidade assistencial que cuidava de menores. Posteriormente,\ntornou-se presidente da fundação, ocupando esse cargo até 1990.\n\nA partir de então, retirou-se para a vida privada. Veio a colaborar,\nmais tarde, com o jornal *Hoje em Dia*, de Belo Horizonte, atividade que\nse somou à de analista político da Rádio Itatiaia, desenvolvida desde\nmeados da década de 1980.\n\nFoi casado com Zilda Geralda Almeida, com quem teve três filhas.\nCasou-se pela segunda vez com Maria Auxiliadora Bastos Gomes.\n\nFONTES: CÂM. DEP. *Deputados brasileiros. Repertório*(1826-1976); CÂM.\nDEP. *Repertório biográfico* (1946-1967); INF. BIOG.\n\n \n","ref":"FONTES: CÂM. DEP. *Deputados brasileiros. Repertório*(1826-1976); CÂM.\nDEP. *Repertório biográfico* (1946-1967); INF. BIOG.\n\n \n","dic":"DHBB"}
