{"title":"REIS, Manuel","cargoss":["Deputado federal","Deputado federal","Deputado federal"],"cargos_esp":[0,0,0],"datas_ini":[1934,1919,1915],"datas_fim":[1935,1923,1914],"estados":["RJ","RJ","RJ"],"autor":[0],"content":"**REIS, Manuel**\n\n\\*dep. fed. RJ 1915-1914, 1919-1923 e 1934-1935.\n\n*Manuel Reis*nasceu em Nova Iguaçu (RJ) no dia 24 de dezembro de 1876,\nfilho de José Inácio dos Reis.\n\nBacharelou-se em ciências jurídicas e sociais e, de 1910 a 1912, durante\no governo de Hermes da Fonseca (1910-1914), foi secretário do ministro\nda Viação, José Joaquim Seabra, de quem foi grande amigo. Em seguida\nelegeu-se deputado federal por seu estado, ocupando uma cadeira na\nCâmara de 1912 a 1914. Foi ainda deputado à Assembléia Legislativa do\nRio de Janeiro, vereador à Câmara Municipal de sua cidade natal, a qual\npresidiu a partir de janeiro de 1916, e novamente deputado federal pelo\nRio de Janeiro de junho de 1919 até dezembro de 1923.\n\nNo pleito de maio de 1933 tentou eleger-se deputado à Assembléia\nNacional Constituinte por seu estado na legenda do Partido Popular\nRadical (PPR), mas obteve apenas uma suplência. Assumiu uma cadeira em\njulho de 1934, já após a promulgação da nova Carta (16/7/1934), e, com a\nprorrogação da legislatura, exerceu o mandato até maio do ano seguinte.\n\nFONTES: ABRANCHES, J. *Governos;*ASSEMB. NAC. CONST. 1934. *Anais;*CÂM.\nDEP.*Deputados;*CONSULT. MAGALHÃES, B.;*Diário do Congresso Nacional;\nIlustração* *Brasileira* (10/22).\n\n \n","ref":"FONTES: ABRANCHES, J. *Governos;*ASSEMB. NAC. CONST. 1934. *Anais;*CÂM.\nDEP.*Deputados;*CONSULT. MAGALHÃES, B.;*Diário do Congresso Nacional;\nIlustração* *Brasileira* (10/22).\n\n \n","dic":"DHBB"}
