{"title":"REIS, Marques dos","cargoss":["Constituinte","Ministro da Viação e Obras Públicas","Presidente do Banco do Brasil"],"cargos_esp":[0,0,0],"datas_ini":[1934,1934,1937],"datas_fim":[1934,1937,1945],"estados":[0,0,0],"autor":[0],"content":"**REIS, Marques dos**\n\n\\*const. 1934; min. Viação 1934-1937; pres. Bco. Bras. 1937-1945.\n\n \n\n*João Marques dos Reis*****nasceu em Salvador no dia 23 de junho de\n1890, filho do médico e professor de latim José Marques dos Reis e de\nJosefina Cândida Paraguaçu dos Reis.\n\nDepois de realizar seus primeiros estudos nos colégios Brasil, 3 de Maio\ne Carneiro, em sua cidade natal, ingressou na Faculdade de Direito da\nBahia, tendo sido o orador da turma que se formou em dezembro de 1909.\nRetornou a essa mesma escola como professor substituto de direito civil\nem setembro de 1917, tornando-se catedrático no mês\nseguinte,****por****concurso.\n\nDurante o governo de Francisco Marques de Góis Calmon (1924-1928),\nocupou durante um ano, a partir de agosto de 1924, os cargos de chefe de\npolícia e secretário de Segurança Pública da Bahia, representando o\nestado na Conferência Internacional de Polícia realizada em Nova Iorque\n(EUA) em maio de 1925.\n\nEm 1932 foi juiz substituto do Tribunal Regional Eleitoral da Bahia. O\nestado era governado pelo interventor Juraci Magalhães que, por ser\nmilitar e cearense, enfrentava oposição de políticos baianos, inclusive\nde alguns que se haviam identificado com a Revolução de 1930. Para\nestabelecer bases políticas, Juraci articulou-se com “coronéis” do\ninterior, sobretudo os do vale do São Francisco, e com uma parte da\nintelectualidade do estado, formando o Partido Social Democrático (PSD)\nda Bahia. Marques dos Reis foi um dos fundadores dessa agremiação, sendo\neleito através dela em março de 1933 para a Assembléia Nacional\nConstituinte que se reuniria a partir de 15 de novembro do mesmo****ano.\n\nNa Assembléia, integrou a Comissão Constitucional, conhecida como\n“Comissão dos 26”. Formada por um representante de cada estado e de cada\ngrupo profissional, ela estava encarregada de apresentar ao plenário,\ndentro do prazo de três meses, um substitutivo ao anteprojeto de texto\nconstitucional que o governo preparava através da chamada Comissão do\nItamarati para servir de base à discussão na Constituinte. A partir daí,\no conjunto dos deputados poderia propor emendas complementares.\n\nA crise aberta em janeiro de 1934 com a escolha de Antônio Garcia de\nMedeiros Neto para substituir o demissionário Osvaldo Aranha na função\nde líder da maioria, retardou os trabalhos, obrigando a que se buscasse\numa fórmula para a sua dinamização. Após várias reuniões com esse\nobjetivo, Marques dos Reis propôs que a comissão ficasse reduzida a\ncinco ou seis membros fixos, com os restantes organizados em grupos\nresponsáveis pelo estudo e elaboração de cada um dos capítulos do\nsubstitutivo.\n\nAprovada por maioria, essa proposta levou à formação da chamada Comissão\nRevisora, grupo fixo formado por Carlos Maximiliano (presidente), Levi\nCarneiro (vice-presidente), Raul Fernandes (relator-geral) e os\nredatores de cada capítulo do substitutivo. Marques dos Reis foi o\nrelator do capítulo dos direitos e deveres e participou dos trabalhos de\nconclusão do capítulo da nacionalidade, cidadania, inelegibilidade e\ndeclaração de direitos, feitos pela Comissão Revisora. Participou também\ndo estudo do capítulo sobre a organização do Judiciário, elaborado por\nLevi Carneiro.\n\nEm junho de 1934, quando as emendas apresentadas entravam em fase final\nde votação, o governo propôs a prorrogação dos mandatos dos deputados e\na transformação da Constituinte em Congresso ordinário, o que encontrou\nacirrada oposição por parte das bancadas de São Paulo, Pernambuco e\nBahia. Segundo pesquisa promovida por um vespertino carioca, Marques dos\nReis estava entre os 20 constituintes contrários a essas medidas em\nqualquer hipótese. Depois de grande polêmica, a solução encontrada foi a\nde prorrogar os mandatos até a expedição dos diplomas dos deputados que\nseriam eleitos em outubro do mesmo ano.\n\nEm 16 de julho de 1934, a Assembléia promulgou a Constituição e no dia\nseguinte elegeu Getúlio Vargas, chefe do Governo Provisório desde a\nRevolução de 1930, para a presidência da República, cumprindo assim as\nfunções para as quais havia sido convocada.\n\nPouco depois, Marques dos Reis renunciou ao seu mandato para assumir em\n25 de julho de 1934 o Ministério da Viação e Obras Públicas, onde deu\ncontinuidade aos trabalhos de eletrificação da Estrada de Ferro Central\ndo Brasil, promoveu obras nos portos e modernizou o aeroporto do Rio de\nJaneiro (então Distrito Federal). Em dezembro de 1935, participou de uma\nreunião ministerial onde se discutiram as causas do movimento armado de\ninspiração comunista ocorrido no mês anterior e os meios de impedir sua\nrepetição, pleiteando, em sua intervenção, rigorosa punição para os\nenvolvidos.\n\nEm 29 de novembro de 1937, 19 dias depois da decretação do Estado Novo,\ndeixou o ministério e foi nomeado para a presidência do Banco do Brasil,\nque ocupou até a queda de Getúlio Vargas em 29 de outubro de 1945.\nDurante esse período, acumulou os cargos de superintendente da Caixa de\nMobilização Bancária (Camob, 1943-1944) e da Caixa de Fiscalização e\nMobilização Bancária (1944-1945).\n\nJoão Marques dos Reis foi ainda diretor do Instituto Geográfico e\nHistórico da Bahia e presidente do Instituto dos Advogados da Bahia.\n\nFaleceu em Salvador no dia 15 de abril de 1950.\n\nFoi casado com Adelaide Arminda Fernandes Reis.\n\nPublicou discursos e trabalhos administrativos, entre os quais Inquérito\nna rede (1937).\n\nAmélia Coutinho\n\n \n\n \n\nFONTES: CÂM. DEP. Deputados; Encic. Mirador; GODINHO, V. Constituintes;\nMONTEIRO, F. Banco; MOREIRA, J. Dic.; MUSEU DO BANCO DO BRASIL; PEIXOTO,\nA. Getúlio; Rev. Arq. Públ. Mineiro; SILVA, H. 1935.\n\n \n","ref":"FONTES: CÂM. DEP. Deputados; Encic. Mirador; GODINHO, V. Constituintes;\nMONTEIRO, F. Banco; MOREIRA, J. Dic.; MUSEU DO BANCO DO BRASIL; PEIXOTO,\nA. Getúlio; Rev. Arq. Públ. Mineiro; SILVA, H. 1935.\n\n \n","dic":"DHBB"}
