{"title":"REIS, Sólon Borges dos","cargoss":["Deputado federal","Constituinte"],"cargos_esp":[0,0],"datas_ini":[1985,1987],"datas_fim":[1992,1988],"estados":["SP",0],"autor":["Marcelo Costa"],"content":"**REIS, Sólon Borges dos**\n\n**\\***dep. fed. SP 1985-1992; const. 1987-1988.\n\n*Sólon Borges dos Reis*nasceu em Casa Branca (SP) no dia 27 de julho de\n1917, filho de Júlio Borges e de Flávia Pezzuto Silva.\n\nEm 1936 tornou-se presidente da Associação Campineira de Imprensa,\npermanecendo no cargo até o ano seguinte. Em 1947 foi fundador e\npresidente da União Paulista de Educação e trabalhou também como\ncronista parlamentar dos Diários Associados na Constituinte e, no ano\nseguinte, na Assembléia Legislativa de São Paulo. Ainda em 1948\ntornou-se assistente-geral do ensino, exercendo esta função até 1950.\nNeste último ano, formou-se em direito pela atual Universidade do Estado\ndo Rio de Janeiro.\n\nEm 1954 tornou-se chefe do ensino secundário e normal, concluindo o\ncurso de pedagogia, na Universidade de São Paulo. No ano seguinte,\ntornou-se diretor-geral do Departamento de Educação de São Paulo,\npermanecendo nesta função até 1957. Ainda este ano, representando o\nmagistério, presidiu o V Congresso Americano de Educadores, realizado em\nMontevidéu no Uruguai, sendo eleito vice-presidente da respectiva\nconfederação. Lecionou administração escolar na Faculdade de Filosofia,\nCiências e Letras de Santos, atual Universidade Católica, em 1957 e\n1958.\n\nEm outubro de 1958 candidatou-se a uma cadeira na Assembléia Legislativa\nde São Paulo, na legenda do Partido Democrático Cristão (PDC). Eleito,\nassumiu o mandato no início do ano seguinte, participando dos trabalhos\nlegislativos como líder do partido na Assembléia. Ainda em 1959,\npresidiu o Encontro de Parlamentares de Todos os Continentes, realizado\nem Viena na Áustria. A partir de 1961 participou de diversos congressos\ninternacionais, a convite da Confederação Mundial de Organizações do\nProfessorado.\n\nEm 1962 licenciou-se do trabalho legislativo para assumir o cargo de\nsecretário estadual de Educação do governo Carlos Alberto Alves de\nCarvalho Pinto (1959-1963). Desincompatibilizando-se do cargo, em\noutubro foi reeleito deputado estadual, na legenda do PDC, assumindo o\nmandato no início de 1963 e participando dos trabalhos legislativos como\nlíder do partido na Assembléia Legislativa até 1965. No mesmo ano\ntornou-se membro da Comissão do Ano da Cooperação Internacional, do\nMinistério das Relações Exteriores. Com a extinção dos partidos\npolíticos pelo Ato Institucional nº 2 (27/10/1965) e a posterior\nimplantação do bipartidarismo, filiou-se à Aliança Renovadora Nacional\n(Arena), partido de apoio ao regime militar instaurado no país em abril\nde 1964. Em 1966 participou, como observador convidado, do congresso da\nNational Education Association, realizado em Nova Iorque, nos Estados\nUnidos.\n\nEm novembro de 1966 foi reeleito deputado estadual, na legenda da Arena.\nAssumindo o mandato no início do ano seguinte, participou dos trabalhos\nda reforma da Constituição estadual como relator-geral do projeto de\nreforma constitucional e relator dos capítulos “Educação e cultura” e\n“Segurança pública”, e dos trabalhos legislativos como membro das\ncomissões de Constituição e Justiça e de Serviço Civil, além de\npresidente da Comissão de Educação e Cultura. Reeleito em 1970 e 1974,\nfoi líder da Arena na Assembléia entre 1977 e 1980. Durante os dois\nmandatos, realizou diversas viagens ao exterior, participando de\nencontros e congressos sobre educação.\n\nNo pleito de novembro de 1978 candidatou-se a uma cadeira na Câmara dos\nDeputados por São Paulo, mas não logrou êxito. Com o fim do\nbipartidarismo em novembro de 1979 e a conseqüente reformulação\npartidária, filiou-se ao Partido Trabalhista Brasileiro (PTB). Tentando\nnovamente em novembro de 1982, obteve apenas a segunda suplência. No ano\nseguinte tornou-se membro do Conselho Estadual de Educação de São Paulo,\ncargo que exerceria até 1986. Em 1985 assumiu a direção de cultura do\nCentro do Professorado Paulista, instituição onde seria nos anos\nseguintes vice-presidente e presidente. Em novembro, assumiu seu mandato\nna Câmara no lugar do deputado Celso Amaral, sendo efetivado em março de\n1986, com a saída do deputado Mendonça Falcão. Participou dos trabalhos\nlegislativos como vice-líder do PTB, vice-presidente da Comissão de\nComunicação e Informática, membro titular da Comissão de Educação e\nCultura e suplente da Comissão de Relações Exteriores.\n\nAinda em 1986 realizou uma visita oficial a Cuba, participando do\nCongresso Internacional de Pedagogia, foi delegado do Brasil da União\nInterparlamentar na Conferência de Bangcoc na Tailândia e tornou-se\nsegundo vice-presidente da Ordem Nacional dos Escritores, cargo que\nexerceria até 1988.\n\nEm novembro de 1986 elegeu-se deputado federal constituinte, com a\nmaioria dos votos provenientes de sua base eleitoral junto ao magistério\npúblico, assumindo novo mandato em 1º de fevereiro de 1987, quando se\niniciaram os trabalhos da Assembléia Nacional Constituinte. Integrou,\ncomo membro titular, a Subcomissão da Educação, Cultura e Esportes, da\nComissão da Família, da Educação, Cultura e Esportes, da Ciência e\nTecnologia e da Comunicação, e a Comissão de Redação, sendo um dos 28\nparlamentares que deram forma final ao texto da nova constituição. Foi\ntambém suplente da Subcomissão do Sistema Eleitoral e Partidos\nPolíticos, da Comissão da Organização Eleitoral, Partidária e Garantia\ndas Instituições, e da Comissão de Sistematização. Contrário à proposta\ndo direito de voto aos 16 anos, Sólon apresentou um projeto de lei\nfixando nesta idade a maioridade civil e penal, alegando que “se terão\ndireitos, os jovens também terão deveres”.\n\nNas votações mais importantes na Constituinte, manifestou-se a favor da\npena de morte, do mandado de segurança coletivo, da estabilidade no\nemprego, da remuneração 50% superior para o trabalho extra, da jornada\nsemanal de 40 horas, do turno ininterrupto de seis horas, do aviso\nprévio proporcional, da unicidade sindical, da soberania popular e da\nnacionalização do subsolo. Votou contra a limitação do direito de\npropriedade privada, o presidencialismo, a estatização do sistema\nfinanceiro, a limitação dos encargos para a dívida externa, a criação de\num fundo de apoio à reforma agrária, a anistia aos micro e pequenos\nempresários, a legalização do jogo do bicho, a desapropriação da\npropriedade produtiva e o mandato de cinco anos para o presidente José\nSarney. Absteve-se nas votações sobre o aborto e voto aos 16 anos.\n\nApós a promulgação da nova Carta Constitucional em 5 de outubro de 1988,\nvoltou a participar dos trabalhos legislativos ordinários na Câmara dos\nDeputados, como primeiro vice-líder do PTB, membro titular da Comissão\nde Educação, Cultura, Esporte e Turismo e relator da Comissão\nParlamentar de Inquérito (CPI) destinada a investigar o destino de\naplicação pelo Ministério da Educação dos recursos provenientes da\nemenda Calmon.\n\nEm outubro de 1990 Sólon reelegeu-se deputado federal, assumindo novo\nmandato em fevereiro do ano seguinte. Participou dos trabalhos\nlegislativos como vice-líder do PTB na Câmara e segundo vice-presidente\nda Comissão de Educação, Cultura e Desporto.\n\nNa sessão da Câmara dos Deputados de 29 de setembro de 1992, votou a\nfavor do *impeachment* do presidente Fernando Collor de Melo, acusado de\ncrime de responsabilidade por ligações com um esquema de corrupção\nliderado pelo ex-tesoureiro de sua campanha presidencial, Paulo César\nFarias. Afastado da presidência logo após a votação na Câmara, Collor\nrenunciou ao mandato em 29 de dezembro de 1992, pouco antes da conclusão\ndo processo pelo Senado Federal, sendo efetivado na presidência da\nRepública o vice Itamar Franco, que já vinha exercendo o cargo\ninterinamente desde o dia 2 de outubro.\n\nEm outubro de 1992, Sólon elegeu-se vice-prefeito de São Paulo, na chapa\nencabeçada por Paulo Maluf. Desse modo, renunciou ao mandato na Câmara\nem 31 de dezembro de 1992, assumindo no dia seguinte a vice-prefeitura e\ntambém a Secretaria Municipal de Educação. Sua vaga na Câmara foi\nocupada por Maurício Najar.\n\nEm abril de 1993 a prefeitura paulistana foi acusada, por entidades de\ndireitos humanos ligadas à Igreja Católica, de acabar com mecanismos de\nassistência às pessoas carentes. Sólon defendeu o governo, declarando\nque as acusações “faziam parte de uma jogada política visando\ndesestabilizar o governo”. Por duas vezes ocupou a prefeitura de São\nPaulo por impedimento do titular (outubro a novembro de 1993 e abril a\nmaio de 1995).\n\nEm 31 de dezembro de 1996, deixou a vice-prefeitura e a secretaria,\nabandonando a carreira política. Tornou-se presidente da Academia\nPaulista de Educação e da Ordem dos Velhos Jornalistas de São Paulo,\nalém de diretor da Academia Paulista de Letras.\n\nAo longo de sua vida, foi também professor e diretor de escola no ensino\npúblico e particular, fundador da Associação dos Professores de Ensino\nOficial do Estado de São Paulo (APEOESP), sócio do Sindicato de\nJornalistas Profissionais do Estado de São Paulo, consultor jurídico,\ndiretor do departamento de cultura e vice-presidente da Ordem dos Velhos\nJornalistas de São Paulo e conselheiro da Associação Paulista de\nImprensa. Membro da União Brasileira de Escritores, da Academia Paulista\nde Jornalismo, da Academia Paulista de Educação e da Academia de Letras\nda Grande São Paulo, sócio emérito do Instituto Histórico Geográfico de\nSão Paulo, tornou-se membro do Centro do Professorado Paulista, do qual\nfoi presidente durante cerca de 40 anos. Fez curso de atualização em\ndireito constitucional na Faculdade de Direito do Largo de São\nFrancisco, em São Paulo.\n\nFaleceu na capital paulista no dia 9 de setembro de 2006.\n\nCasado com Adiléa Cunha Borges dos Reis desde 1994, teve uma filha.\n\nPublicou *Apostasia*(1937),*Poesias escolares*(1939),*Imprensa e\neducação*(1940),*Algumas considerações sobre programas\nescolares*(1941),*Geografia e história do Brasil para\nrecém-alfabetizados*(co-autoria, 1948),*Novas poesias\nescolares*(1948),*A maior herança*(1965),*Lira da América*(1973),*Crise\ncontemporânea da educação* (1978),*ABC da Constituinte*(1985),*Carrossel\ndo tempo*(1985),*Condição humana* (1985), *Educação política*\n(1988),*Poesias infantis* (1990),*Educação política — educação para a\nliberdade e para a responsabilidade*(1990), *Viagem*(poesia, 1996), *A\ncoruja* (livro infantil, 1996) e *Frutos* (livro infantil, 1996).\n\nMarcelo Costa\n\nFONTES: ASSEMB. NAC. CONST. *Repertório* (1987-1988); CÂM. DEP.\n*Deputados brasileiros. Repertório*(1991-1995);**COELHO, J. & OLIVEIRA,\nA.*Nova*; *Folha de S. Paulo* (19/1/87); *Globo* (30/9/92, 12/4/93);\nINF. BIOG.; *Jornal do Brasil* (17/8/88); *Perfil\nparlamentar/IstoÉ*(1991); Portal da ALESP.\n\n \n","ref":"FONTES: ASSEMB. NAC. CONST. *Repertório* (1987-1988); CÂM. DEP.\n*Deputados brasileiros. Repertório*(1991-1995);**COELHO, J. & OLIVEIRA,\nA.*Nova*; *Folha de S. Paulo* (19/1/87); *Globo* (30/9/92, 12/4/93);\nINF. BIOG.; *Jornal do Brasil* (17/8/88); *Perfil\nparlamentar/IstoÉ*(1991); Portal da ALESP.\n\n \n","dic":"DHBB"}
