{"title":"RESEGUE, José","cargoss":["Deputado federal"],"cargos_esp":[0],"datas_ini":[1963],"datas_fim":[1971],"estados":["SP"],"autor":[0],"content":"**RESEGUE, José**\n\n\\*dep. fed. SP 1963-1971.\n\n \n\n*José Jorge Resegue* nasceu em Bariri (SP) no dia 28 de fevereiro de\n1926, filho de Jorge Resegue e de Rosa Resegue.\n\nTransferindo-se para o Rio de Janeiro, então Distrito Federal, formou-se\npela Faculdade Nacional de Medicina da Universidade do Brasil.\n\nDe volta a seu estado, em 1962 foi prefeito de sua cidade natal e no\npleito de novembro desse mesmo ano, elegeu-se deputado federal por São\nPaulo na legenda da coligação formada pelo Partido Trabalhista\nBrasileiro (PTB) com o Partido Socialista Brasileiro (PSB). Assumindo o\nmandato em fevereiro de 1963, tornou-se membro das comissões de\nTransportes, Relações Exteriores e de Saúde da Câmara dos Deputados.\nApós o movimento político-militar de 31 de março de 1964, que depôs o\npresidente João Goulart (1961-1964), com a extinção dos partidos\npolíticos pelo Ato Institucional nº 2 (27/10/1965) e a posterior\ninstauração do bipartidarismo, filiou-se ao partido governista, a\nAliança Renovadora Nacional (Arena).\n\nEm novembro de 1966 deputado federal por São Paulo, já na legenda****da\nArena e, no pleito de novembro de 1970, novamente candidato, alcançou\napenas uma suplência, deixando a Câmara em****janeiro de 1971, ao final\nda legislatura.\n\nFaleceu no dia 8 de abril de 1992.\n\n \n\nFONTES: CÂM. DEP. *Deputados*; CÂM. DEP. *Deputados brasileiros.\nRepertório* (1963-1967 e 1967-1971); TRIB. SUP. ELEIT. *Dados* (6, 8 e\n9).\n\n \n","ref":"FONTES: CÂM. DEP. *Deputados*; CÂM. DEP. *Deputados brasileiros.\nRepertório* (1963-1967 e 1967-1971); TRIB. SUP. ELEIT. *Dados* (6, 8 e\n9).\n\n \n","dic":"DHBB"}
