{"title":"BAHURY, Miguel","cargoss":["Deputado federal"],"cargos_esp":[0],"datas_ini":[1959],"datas_fim":[1963],"estados":["MA"],"autor":[0],"content":"**BAHURY, Miguel**\n\n\\*dep. fed. MA 1959-1963.\n\n \n\n*Miguel Antônio Bahury* nasceu em São Luís no dia 26 de dezembro de\n1912, filho de Antônio João Bahury e de Carmem Abud Bahury.\n\nComerciante, industrial e jornalista, no pleito de outubro de 1958\nelegeu-se deputado federal pelo Maranhão, na legenda do Partido Social\nDemocrático (PSD), iniciando seu mandato em 1º de fevereiro de 1959.\nIntegrou a Comissão de Segurança Nacional e a Comissão de Orçamento,\nparticipando ainda de diversas comissões parlamentares de inquérito e\nmanifestando posição favorável ao regime parlamentarista.\n\nEm 24 de agosto de 1961, quando o governador do então estado da\nGuanabara Carlos Lacerda denunciou publicamente que o ministro da\nJustiça Oscar Horta lhe havia declarado que o presidente da República\nJânio Quadros preparava um golpe de Estado, Miguel Bahury apresentou à\nmesa da Câmara um requerimento solicitando a presença dos dois ao\nCongresso para prestarem esclarecimentos, além de propor a constituição\nde uma comissão para apurar as denúncias.\n\nEntretanto, o deputado José Maria Alkmin, líder da maioria, rejeitou\nessas medidas, encaminhando à mesa outro requerimento, datado do dia 25,\nno qual solicitava a convocação do ministro da Justiça para prestar\ninformações à Câmara. Foi esse o requerimento aprovado pelo plenário, e\nnessa mesma manhã (25/8/1961) Pedroso Horta distribuiu nota à imprensa\nrefutando as declarações de Lacerda. Ainda no dia 25, Jânio Quadros\nrenunciou à presidência da República.\n\nEm 1962, Miguel Bahury deixou o PSD para ingressar no Partido Social\nProgressista (PSP), em cuja legenda foi reeleito em outubro deputado\nfederal pelo Maranhão. Interessado em apurar as causas dos acidentes\naéreos, num dos quais falecera sua esposa Maria de Lurdes Meneses Bahury\ndois anos antes, ocupou a presidência da Comissão Parlamentar de\nInquérito que investigava a segurança dos vôos no Brasil.\n\nEm 3 de maio de 1963, faleceu num desastre aéreo ocorrido na capital de\nSão Paulo.\n\nFoi casado com Angelita Meneses Bahury, com quem teve três filhos. Do\nseu casamento com Maria de Lurdes, teve dois filhos.\n\n \n\nFONTES: CÂM. DEP. *Anais*(4 e 6); CÂM. DEP. *Deputados brasileiros*\n(1946-1967); COUTINHO, A. *Brasil*; INF. FAM.; *Jornal do Comércio,*Rio\n(5/5/63); VÍTOR, M. *Cinco.*\n\n \n","ref":"FONTES: CÂM. DEP. *Anais*(4 e 6); CÂM. DEP. *Deputados brasileiros*\n(1946-1967); COUTINHO, A. *Brasil*; INF. FAM.; *Jornal do Comércio,*Rio\n(5/5/63); VÍTOR, M. *Cinco.*\n\n \n","dic":"DHBB"}
