{"title":"RIBAS, Ardinal","cargoss":["Deputado federal"],"cargos_esp":[0],"datas_ini":[1971],"datas_fim":[1973],"estados":["PR"],"autor":[0],"content":"**RIBAS, Ardinal**\n\n\\*dep. fed. PR 1971-1973.\n\n \n\n*Ardinal Ribas* nasceu em Castro (PR) no dia 3 de julho de 1920, filho\nde João Barbosa Ribas e de Olga Moreira Ribas.\n\nFormou-se em contabilidade pela Escola Técnica de Comércio em 1944.\nIndustrial e técnico em telecomunicações, fundou e dirigiu a Sociedade\nTelefônica do Paraná e foi diretor da Empresa de Minérios do Paraná,\nalém da Florestadora e Reflorestadora de Maringá, no mesmo estado.\n\nEm novembro de 1970 elegeu-se deputado federal pelo Paraná na legenda da\nAliança Renovadora Nacional (Arena), partido de sustentação ao regime\nmilitar instalado no país em abril de 1964, assumindo sua cadeira em\nfevereiro de 1971. Nesse mesmo ano bacharelou-se em ciências jurídicas e\nsociais pela Faculdade de Direito de Curitiba. Durante sua permanência\nna Câmara, foi membro da Comissão de Minas e Energia e suplente das\ncomissões de Economia e de Transportes, Comunicações e Obras Públicas.\n\nFaleceu no dia 16 de março de 1973, em pleno exercício do mandato.\n\nEra casado com Teresa Cristina Ribas, com quem teve três filhos.\n\n \n\n \n\nFONTES: CÂM. DEP. Deputados; CÂM. DEP. Deputados brasileiros. Repertório\n(1971-1975); Perfil (1972); TRIB. SUP. ELEIT. Dados (9).\n\n \n","ref":"FONTES: CÂM. DEP. Deputados; CÂM. DEP. Deputados brasileiros. Repertório\n(1971-1975); Perfil (1972); TRIB. SUP. ELEIT. Dados (9).\n\n \n","dic":"DHBB"}
