{"title":"RIBAS, Félix","cargoss":["Deputado federal"],"cargos_esp":[0],"datas_ini":[1935],"datas_fim":[1937],"estados":["SP"],"autor":[0],"content":"**RIBAS, Félix**\n\n\\* dep. fed. SP 1935-1937.\n\n \n\n*Félix Bulcão Ribas* nasceu em São Paulo no dia 14 de janeiro de 1902,\nfilho de Emílio Marcondes Ribas, médico sanitarista, e de Maria Carolina\nBulcão Ribas.\n\nBacharel em direito pela Faculdade do Largo de São Francisco, em São\nPaulo, em 1932 participou da Revolução Constitucionalista, movimento de\noposição ao Governo Provisório chefiado por Getúlio Vargas, ocorrido em\nseu estado entre julho e outubro daquele ano.\n\n Eleito deputado federal por São Paulo em outubro de 1934, na legenda do\nPartido Republicano Paulista (PRP), exerceu o mandato de 3 de maio de\n1935 a 10 de novembro de 1937, quando o advento do Estado Novo suprimiu\nos órgãos legislativos do país.\n\nDiretor do Conselho Superior das Caixas Econômicas Federais a partir de\n1940, no ano seguinte passou a integrar o Conselho Federal de Comércio\nExterior, tornando-se membro da Câmara de Tarifas Aduaneiras e Tratados\nComerciais deste órgão. Em 1943, afastou-se do cargo de diretor e deixou\nde ser membro da Câmara de Tarifas, permanecendo por mais dois anos no\nConselho Federal de Comércio Exterior. Foi ainda promotor público na\ncidade de Bauru (SP), aposentando-se, posteriormente, como promotor do\nestado de São Paulo.\n\nFaleceu em sua cidade natal no dia 6 de outubro de 1972.\n\nEra casado com Elza Fausta Ribas.\n\n \n\nFONTES: *Boletim Min. Trab*. (5/36); CÂM. DEP. *Deputados*; *Diário do\nCongresso Nacional*; FICHÁRIO PESQ. M. AMORIM; INF. Carolina Ribas\nChaves.\n\n \n","ref":"FONTES: *Boletim Min. Trab*. (5/36); CÂM. DEP. *Deputados*; *Diário do\nCongresso Nacional*; FICHÁRIO PESQ. M. AMORIM; INF. Carolina Ribas\nChaves.\n\n \n","dic":"DHBB"}
