{"title":"RIBAS, José da Rocha","cargoss":["Constituinte","Deputado federal"],"cargos_esp":[0,0],"datas_ini":[1946,1946],"datas_fim":[1946,1951],"estados":[0,"PA"],"autor":[0],"content":"**RIBAS, José da Rocha**\n\n\\*const. 1946; dep. fed. PA 1946-1951.\n\n* *\n\n*José da Rocha Ribas* nasceu no Rio de Janeiro, então Distrito Federal,\nno dia 22 de julho de 1895, filho de Domingos Vilar Ribas e de Cecília\nda Rocha Ribas.\n\nFormado em odontologia pela Escola Livre de Odontologia do Rio de\nJaneiro em 1913, fez especialização na Universidade da Pensilvânia, na\nFiladélfia (EUA), concluindo o curso em 1916. Funcionário municipal e\ndelegado fiscal da Prefeitura do Rio de Janeiro, nos últimos anos do\nEstado Novo (1937-1945) teve uma atuação destacada na campanha pela\nreconstitucionalização do país. Transferindo-se para o Pará, em dezembro\nde 1945 elegeu-se deputado à Assembléia Nacional Constituinte por esse\nestado na legenda do Partido Social Democrático (PSD). Assumindo o\nmandato em fevereiro de 1946, participou dos trabalhos constituintes e,\ncom a promulgação da nova Carta (18/9/1946), passou a exercer o mandato\nordinário, tendo sido suplente da mesa da Câmara dos Deputados. Deixou\nessa casa ao final de seu mandato, em janeiro de 1951.\n\nAbandonando a carreira política, dedicou-se a negócios imobiliários,\ncomprando e vendendo terrenos na Barra da Tijuca, na cidade do Rio de\nJaneiro.\n\nFaleceu na cidade do Rio de Janeiro no dia 18 de setembro de 1964.\n\nEra casado com Guilhermina Bulcão Ribas, com quem teve duas filhas.\n\n \n\n \n\nFONTES: CÂM. DEP. Deputados; CÂM. DEP. Relação dos dep.; Diário do\nCongresso Nacional; INF. Marisa Bulcão Ribas Bokel; MACEDO, R.\nEfemérides; SILVA. G. Constituinte; TRIB. SUP. ELEIT. Dados (1).\n\n \n","ref":"FONTES: CÂM. DEP. Deputados; CÂM. DEP. Relação dos dep.; Diário do\nCongresso Nacional; INF. Marisa Bulcão Ribas Bokel; MACEDO, R.\nEfemérides; SILVA. G. Constituinte; TRIB. SUP. ELEIT. Dados (1).\n\n \n","dic":"DHBB"}
