{"title":"RIBEIRO JÚNIOR, Alfredo Augusto","cargoss":["Revolucionário ou revoltoso","Deputado federal"],"cargos_esp":[0,0],"datas_ini":[1924,1935],"datas_fim":[1924,1937],"estados":[0,"AM"],"autor":[0],"content":"**RIBEIRO JÚNIOR, Alfredo Augusto**\n\n\\*militar; rev. 1924; dep. fed. AM 1935-1937.\n\n \n\n*Alfredo Augusto Ribeiro Júnior* nasceu no dia 29 de abril de 1889,\nfilho de Alfredo Augusto Ribeiro.\n\nCursou a Escola de Guerra de Porto Alegre, onde sentou praça em março de\n1908. Aspirante-a-oficial em janeiro de 1911, foi promovido a\nsegundo-tenente em outubro de 1915 e a primeiro-tenente em abril de\n1920, quando fazia os cursos de infantaria e cavalaria. Em março de 1924\nfoi transferido para o 27º Batalhão de Caçadores, sediado em Manaus.\n\nLiderou, em 23 de julho de 1924, uma rebelião no Amazonas em apoio à\nrevolta tenentista deflagrada 18 dias antes em São Paulo e depois em\nSergipe em oposição ao governo do presidente Artur Bernardes. Ao lado de\nseus companheiros, Ribeiro Júnior sublevou a guarnição local do Exército\ne depôs o governador interino Turiano Meira, substituto de César do Rego\nMonteiro, que se encontrava no exterior. Os rebeldes instituíram então\num governo militar — cuja chefia foi entregue a Ribeiro Júnior —,\nnomearam novos membros para os postos de administração e lançaram um\nmanifesto ao povo amazonense explicando os motivos da revolta e os atos\ndo novo governo, documento que foi publicado no dia seguinte no Jornal\ndo Povo, o porta-voz do levante. Editaram ainda o jornal A Liberdade.\nBaixaram também um decreto criando o Imposto de Redenção, que consistia\nem levantar do Banco do Brasil parte dos depósitos pertencentes aos\n“decaídos”, que eram quantos tivessem contribuído para a manutenção da\nordem anterior. Expropriaram por fim o mercado e o matadouro da firma\ninglesa Manaus Market, postos sob a responsabilidade do novo governo de\nManaus.\n\nEm 28 de agosto o general João de Deus Mena Barreto chegou à capital\namazonense comandando uma expedição federal que, ao desembarcar,\ndirigiu-se ao palácio Rio Negro mandando prender Ribeiro Júnior, que não\nofereceu maiores resistências. Assumiu o governo militar o coronel\nRaimundo Barbosa em 31 de agosto de 1924, dando fim à revolta. Ribeiro\nJúnior foi condenado a três anos e nove meses de prisão pelo conselho da\nJustiça Militar da 8ª Região Militar (8ª RM), sediada em Belém.\nTransferido em 1926 para a prisão militar da ilha Grande, no litoral do\nRio de Janeiro, foi solto em fevereiro de 1927 e, em julho seguinte, foi\nreincorporado ao 27º Batalhão de Caçadores. Anistiado após a vitória da\nRevolução de 1930, obteve sua promoção a capitão com validade retroativa\na janeiro de 1926.\n\nEm maio de 1933 candidatou-se a deputado pelo Amazonas à Assembléia\nNacional Constituinte na legenda da coligação entre os partidos\nTrabalhista e Liberal, obtendo apenas uma suplência. Conseguiu eleger-se\nem outubro de 1934 deputado federal pelo Amazonas, ainda na legenda da\nAliança Trabalhista Liberal. O Partido Liberal do Amazonas, ao qual\npertencia, era uma tradicional organização oposicionista no estado,\ndefensora do federalismo e do voto proporcional e preocupada com os\nproblemas de colonização de terras devolutas. Seu órgão oficial era o\njornal A Nação. Exerceu o mandato de maio de 1935 a novembro de 1937,\nquando, com a instauração do Estado Novo, os órgãos legislativos do país\nforam suprimidos.\n\nRetornou então ao serviço ativo do Exército, sendo classificado na 7ª\nRM, sediada em Recife. Em maio de 1938 foi transferido para o 6º\nBatalhão de Caçadores, em Itapemiri (GO).\n\nFaleceu em 29 de junho de 1938.\n\n \n\n \n\nFONTES: ASSEMBL. NAC. CONST. 1934. Anais (1); BITTENCOURT, A. Dic.;\nBoletim Min. Trab. (5/36); CÂM. DEP. Deputados; Diário do Congresso\nNacional.\n\n \n","ref":"FONTES: ASSEMBL. NAC. CONST. 1934. Anais (1); BITTENCOURT, A. Dic.;\nBoletim Min. Trab. (5/36); CÂM. DEP. Deputados; Diário do Congresso\nNacional.\n\n \n","dic":"DHBB"}
