{"title":"RIBEIRO, Abraão","cargoss":["Prefeito"],"cargos_esp":["São Paulo"],"datas_ini":[1945],"datas_fim":[1947],"estados":[0],"autor":[0],"content":"**RIBEIRO, Abraão**\n\n\\*pref. São Paulo 1945-1947.\n\n* *\n\n*Abraão Ribeiro* nasceu em Santos (SP) no dia 17 de janeiro de 1883.\n\nIniciou os estudos em sua cidade natal com professores particulares,\nprosseguindo-os no Colégio João de Deus e no Instituto Ciências e\nLetras, na capital paulista.\n\nIngressou em 1901 na Faculdade de Direito de São Paulo, transferindo-se\nno ano seguinte para o Rio de Janeiro, então Distrito Federal, onde se\nmatriculou na Faculdade Livre de Ciências Jurídicas e Sociais. Formado\nem 1906, viajou no ano seguinte para a Europa, estudando direito penal,\ncivil e romano na Universidade de Berlim.\n\nDe volta ao Brasil em 1910, passou a exercer a advocacia na cidade de\nSão Paulo, onde foi eleito vereador. Após a Revolução de 1930 foi\nnomeado secretário de Justiça e, interinamente, de Segurança Pública por\nLaudo Camargo, interventor federal em São Paulo de julho a novembro de\n1931.\n\nCom a derrubada do Estado Novo em outubro de 1945, foi nomeado pelo\ninterventor Federal em São Paulo, José Carlos de Macedo Soares, para\nsubstituir Francisco Prestes Maia na prefeitura da capital, exercendo o\ncargo de novembro de 1945 a março de 1947, quando foi substituído por\nCristiano Stockler das Neves.\n\nCrítico, biógrafo e tradutor, colaborou na Tribuna de Santos, na Revista\ndo Arquivo Municipal e na Revista dos Tribunais. Foi catedrático de\ndireito criminal da extinta Universidade de São Paulo fundada por\nEduardo Guimarães, e, como advogado, trabalhou para empresas alemães\nestabelecidas em São Paulo.\n\nFaleceu no dia 27 de agosto de 1957.\n\nEra casado com Marta Schelesinger, com quem teve cinco filhos.\n\nPublicou Servidões de caminho, Martins Fontes, Queixa-crime, Defesa dos\ncabeças do movimento de 1924 e Traduções de Fausto.\n\n \n\n \n\nFONTES: ARAÚJO, A. Chefes; CONSULT. MAGALHÃES, B.; Encic. Mirador; MELO,\nL. Dic.; Personalidade; RICHARD NETO, G. Homens; SOC. BRAS. EXPANSÃO\nCOMERCIAL. Quem.\n\n \n","ref":"FONTES: ARAÚJO, A. Chefes; CONSULT. MAGALHÃES, B.; Encic. Mirador; MELO,\nL. Dic.; Personalidade; RICHARD NETO, G. Homens; SOC. BRAS. EXPANSÃO\nCOMERCIAL. Quem.\n\n \n","dic":"DHBB"}
