{"title":"RIBEIRO, Adalberto Jorge Rodrigues","cargoss":["Constituinte","Senador"],"cargos_esp":[0,0],"datas_ini":[1946,1946],"datas_fim":[1946,1951],"estados":[0,"PB"],"autor":[0],"content":"**RIBEIRO, Adalberto Jorge Rodrigues**\n\n\\*const. 1946; sen. PB 1946-1951.\n\n \n\n*Adalberto Jorge Rodrigues Ribeiro* nasceu em Recife no dia 23 de abril\nde 1885, filho de Antônio da Cruz Ribeiro e de Josefa Elvira Rodrigues\nRibeiro.\n\nEstudou em sua cidade natal no Colégio Salesiano, de 1892 a 1896, e no\nGinásio Pernambucano, de 1897 a 1903. Em 1908, bacharelou-se em ciências\njurídicas e sociais pela Faculdade de Direito de Recife. Esteve algum\ntempo no Espírito Santo, onde foi presidente do Conselho Municipal de\nVitória, e trabalhou também como advogado em Recife. Em 1934 radicou-se\nna Paraíba, tornando-se inspetor federal do ensino nesse estado. Ainda\nem outubro desse ano foi eleito deputado à Assembléia Constituinte\nparaibana e, assumindo sua cadeira em maio de 1935, tornou-se secretário\ndessa casa. Exerceu seu mandato até 10 de novembro de 1937, quando o\nadvento do Estado Novo suprimiu os órgãos legislativos do país.\n\nCom a redemocratização do país, em dezembro de 1945 elegeu-se senador\nconstituinte pela Paraíba na legenda da União Democrática Nacional\n(UDN), assumindo sua cadeira em fevereiro de 1946. Participou dos\ntrabalhos constituintes e, com a promulgação da nova Carta (18/9/1946),\npassou a exercer o mandato ordinário, tornando-se segundo suplente da\nComissão Diretora do Senado. Em outubro de 1947 votou contra o projeto\nvitorioso do senador Ivo d’Aquino que cancelava o registro do Partido\nComunista Brasileiro (PCB), então Partido Comunista do Brasil.\n\nRenunciou ao mandato em abril de 1951 para assumir o cargo de procurador\nda Prefeitura do Rio de Janeiro, então Distrito Federal, função na qual\nse aposentou.\n\nFoi presidente da seção da Paraíba da Ordem dos Advogados do Brasil e\nmembro do Instituto dos Advogados Brasileiros no mesmo estado.\n\nFaleceu na cidade do Rio de Janeiro no dia 24 de março de 1975.\n\nFoi casado com Otaviana Coutinho Ribeiro e, em segundas núpcias, com\nMaria Dolores Rocha. Teve seis filhos.\n\n \n\n \n\nFONTES: CISNEIROS, A. Parlamentares; Diário do Congresso Nacional;\nGALVÃO, F. Fechamento; Grande encic. Delta; Jornal do Brasil (25/3/75);\nSENADO. Relação; TRIB. SUP. ELEIT. Dados (1).\n\n \n","ref":"FONTES: CISNEIROS, A. Parlamentares; Diário do Congresso Nacional;\nGALVÃO, F. Fechamento; Grande encic. Delta; Jornal do Brasil (25/3/75);\nSENADO. Relação; TRIB. SUP. ELEIT. Dados (1).\n\n \n","dic":"DHBB"}
