{"title":"RIBEIRO, Armando Vidal Leite","cargoss":["Presidente de associação ou confederação de empregados ou empregadores"],"cargos_esp":["DNC"],"datas_ini":[1933],"datas_fim":[1935],"estados":[0],"autor":[0],"content":"**RIBEIRO, Armando Vidal Leite**\n\n\\*pres. DNC 1933-1935.\n\n \n\n*Armando Vidal Leite Ribeiro* nasceu em Petrópolis (RJ) no dia 13 de\njaneiro de 1888, filho de Fernando Vidal Leite Ribeiro, barão de Santa\nMargarida.\n\nTransferindo-se para o Rio de Janeiro, então Distrito Federal, ingressou\nna Faculdade de Direito dessa cidade, formando-se em ciências jurídicas\ne sociais em 1909.\n\nDe 1915 a 1922 foi delegado auxiliar de polícia na repressão contra\njogos e contravenções e nesse mesmo período redigiu, a pedido de Getúlio\nVargas, então deputado pelo Rio Grande do Sul, o projeto da Lei dos\nDireitos Autorais que ficou conhecido como Lei Getúlio Vargas. Foi\nprofessor catedrático da Escola Superior do Comércio, da Academia de\nAltos Estudos, criada pelo Instituto Histórico e Geográfico Brasileiro,\ne da Escola Normal.\n\nSócio do Instituto dos Advogados Brasileiros, em 1931 foi destinado\nrelator da comissão organizadora da Ordem dos Advogados do Brasil (OAB),\ntendo sido autor dos projetos de sua criação. Em 1932 presidiu o\nconselho nacional da OAB, integrando ainda em duas ocasiões seu conselho\nfederal, como representante de Pernambuco. Em fevereiro de 1933, durante\no governo de Getúlio Vargas, assumiu a presidência do Departamento\nNacional do Café (DNC), criado nessa ocasião em substituição ao Conselho\nNacional do Café. No ano seguinte participou da Conferência Econômica\nInternacional, realizada em Buenos Aires, e em 1935 foi substituído no\nDNC por Antônio Luís de Sousa Melo.\n\nPresidente do Banco da Prefeitura de 1953 a 1954 e diretor da Carteira\nde Crédito Agrícola, foi advogado do Banco de Crédito Mercantil, da\nCompanhia Siderúrgica Nacional, em Volta Redonda (RJ), secretário de\nFinanças e de Administração da Prefeitura do Rio de Janeiro e membro do\nConselho Federal do Comércio Exterior. Presidiu a Comissão de Direitos\nAutorais e integrou as sociedades brasileiras de Direito Internacional,\nde Criminologia e de Economia Política e os institutos Madrilenho de\nDireito Comparado e Brasileiro de Educação e Cultura. Foi ainda membro\nda International Law Association, da Associação Brasileira de Imprensa e\ndas sociedades brasileiras de Imprensa e de Autores Teatrais.\n\nRepresentou o Brasil em dois congressos sobre a propriedade literária em\nParis e em Washington e colaborou nas publicações Revista de Direito,\nRevista Judiciária, Revista Geral de Legislação, Jornal do Comércio e A\nÉpoca.\n\nFaleceu na cidade do Rio de Janeiro, no dia 13 de janeiro de 1982.\n\nFoi casado com Abelina Vidal, com quem teve uma filha.\n\nPublicou Consolidação das leis do processo civil e comercial (1913), A\nconvenção literária com a França (1915), A Ordem dos Advogados (1915), O\njogo, a administração e a justiça (1917), O trato, a lei (1933) e\nCorreção geral do foro (1933).\n\n \n\n \n\nFONTES: CONSULT. MAGALHÃES, B.; Globo (15/1/82); Jornal do Brasil\n(14/1/78, 15 e 19/1/82); VELHO SOBRINHO, J. Dic.\n\n \n","ref":"FONTES: CONSULT. MAGALHÃES, B.; Globo (15/1/82); Jornal do Brasil\n(14/1/78, 15 e 19/1/82); VELHO SOBRINHO, J. Dic.\n\n \n","dic":"DHBB"}
