{"title":"RIBEIRO, Darcy","cargoss":["Reitor","Ministro da Educação","Chefe do Gabinete Civil da Presidência da República","Senador"],"cargos_esp":["UnB",0,0,0],"datas_ini":[1961,1962,1963,1991],"datas_fim":[1962,1963,1964,1997],"estados":[0,0,0,"RJ"],"autor":[0],"content":"**RIBEIRO, Darcy**\n\n\\*reitor UnB 1961-1962; min. Educ. 1962-1963; ch. Gab. Civ. Pres. Rep.\n1963-1964; sen. RJ 1991-1997.\n\n \n\n*Darcy Ribeiro* nasceu na cidade de Montes Claros (MG) no dia 26 de\noutubro de 1922, filho do pequeno industrial Reginaldo Ribeiro dos\nSantos e da professora primária Josefina Augusta da Silveira Ribeiro,\ncujo trabalho como alfabetizadora marcou época na cidade. Em 1925, com a\nmorte de seu pai, Darcy foi morar com a mãe na casa de seus avós\nmaternos, também em Montes Claros.\n\nEm 1939 mudou-se para Belo Horizonte, onde ingressou na Faculdade de\nMedicina. No início da década de 1940 iniciou militância no Partido\nComunista Brasileiro (PCB), então Partido Comunista do Brasil (PCdoB).\nSem vocação para a carreira médica, abandonou a faculdade em 1943,\nretornando a Montes Claros. No ano seguinte, transferiu-se para a\ncapital paulista e matriculou-se na Escola de Sociologia e Política de\nSão Paulo, por onde se graduou em 1946, com especialização em etnologia.\n\nEm 1947 ingressou no Serviço de Proteção ao Índio (SPI), travando\ncontato com o marechal Cândido Mariano Rondon, então presidente do\nConselho Nacional de Proteção ao Índio. Nos anos seguintes, seus estudos\netnológicos levaram-no a viver longos períodos entre comunidades\nindígenas, como a dos cadiuéus, no sul do Mato Grosso, e a dos\nurubu-caapor, na floresta amazônica.\n\nEm 1950, a partir dos resultados de suas pesquisas etnológicas entre os\ncadiuéus, publicou o seu primeiro livro — *Religião e mitologia Kadiweu*\n— que lhe valeu na ocasião o Prêmio Fábio Prado, concedido pela União de\nLiteratura de São Paulo. Dois anos mais tarde, com o apoio do marechal\nRondon, assumiu a direção da seção de estudos do SPI. Dedicou-se então à\nintensa atividade, tanto no âmbito dos estudos científicos como no de\nassessoramento na formulação da política indigenista oficial.\nEmpenhou-se na elaboração de um projeto de lei que procurava garantir\naos índios a posse coletiva e inalienável de suas terras – proposta que,\nsob forte oposição, sequer chegou a ser apreciada pelo Congresso.\n\nPor sua iniciativa foi inaugurado em 1953, no Rio de Janeiro, o Museu do\nÍndio, apontado pela Organização das Nações Unidas para a Educação, a\nCiência e a Cultura (UNESCO) como modelo no setor etnológico, por ser o\nprimeiro do mundo a ser organizado com o objetivo de quebrar o\npreconceito com relação aos índios e difundir sua cultura. No Museu do\nÍndio organizou, em 1955, o primeiro curso de pós-graduação em\nantropologia cultural realizado no Brasil. Outro importante momento de\nseu trabalho no SPI foi a formulação de um projeto para a criação do\nParque Indígena do Xingu, que viria ser implantado anos mais tarde sob a\ndireção dos indianistas Orlando e Cláudio Vilas-Boas. Ainda em 1953,\ningressou como professor na Escola Brasileira de Administração Pública\n(EBAP), da Fundação Getulio Vargas, onde durante dois anos lecionou\netnologia brasileira.\n\nAfastado da militância comunista desde o início de seus estudos junto\naos índios, Darcy aproximou-se do trabalhismo na época do suicídio do\npresidente Getúlio Vargas, em 1954. Nesse mesmo ano, a convite da\nOrganização Internacional do Trabalho (OIT), realizou a sua primeira\nviagem à Europa, permanecendo dois meses na cidade suíça de Genebra,\nonde colaborou com os estudos ali desenvolvidos sobre os povos indígenas\nde todo o mundo.\n\nCom a eleição de Juscelino Kubitschek em outubro de 1955 para a\npresidência da República, Darcy Ribeiro foi convidado a colaborar na\nelaboração das diretrizes para o setor educacional do novo governo.\nTrabalhou então com o pedagogo Anísio Teixeira, que exerceria forte\ninfluência sobre a sua formação. Nessa época, deixou a direção da seção\nde estudos do SPI e passou a integrar o corpo docente da Faculdade\nNacional de Filosofia da Universidade do Brasil (atual Instituto de\nFilosofia e Ciências Sociais da Universidade Federal do Rio de Janeiro),\nficando responsável pelas cadeiras de etnologia brasileira e língua\ntupi-guarani.\n\nDesignado por Anísio Teixeira, Darcy Ribeiro passou a dirigir em 1957 a\ndivisão de estudos sociais do Centro Brasileiro de Pesquisas\nEducacionais (CBPE), vinculado ao Ministério da Educação. Ali orientou\npesquisas socioantropológicas sobre os efeitos sociais dos processos de\nindustrialização e urbanização no Brasil. Sob sua direção, o CBPE passou\na publicar a *Revista de Educação e Ciências Sociais*. Na mesma época\nparticipou ativamente, junto com Anísio Teixeira, da campanha em defesa\nda escola pública, procurando interferir no processo de elaboração da\nLei de Diretrizes e Bases para a Educação, em discussão no Congresso.\n\nEm 1959, através de um decreto presidencial, Darcy foi encarregado de\nplanejar a montagem da Universidade de Brasília (UnB), tarefa para a\nqual convocou um grupo de cientistas e pesquisadores, a maioria\npertencentes à Sociedade Brasileira para o Progresso da Ciência (SBPC).\nEm 1961, com a inauguração da UnB, Darcy foi nomeado seu primeiro\nreitor.\n\nA renúncia do presidente Jânio Quadros, ocorrida em agosto de 1961,\nabriu no país um intenso debate em torno da questão sucessória, uma vez\nque a posse do vice-presidente João Goulart era contestada por diversos\nsetores do governo e das forças armadas, devido às suas estreitas\nligações com o trabalhismo. Vetado pelos três ministros militares de\nJânio — o marechal Odílio Denis, da Guerra, o almirante Sílvio Heck, da\nMarinha, e o brigadeiro Gabriel Grün Moss, da Aeronáutica — Goulart\nacabou sendo empossado no dia 7 de setembro graças à aprovação, no dia\n2, da Emenda Constitucional nº 4, que implantou no país o regime\nparlamentarista, reduzindo os poderes do Executivo e ampliando os do\nCongresso.\n\n \n\nNo Ministério da Educação e no Gabinete Civil\n\nEm agosto de 1962, Darcy Ribeiro assumiu o Ministério da Educação e\nCultura em substituição a Roberto Lira, compondo o gabinete chefiado\npelo primeiro-ministro Hermes Lima. Deixou então a reitoria da UnB, onde\nfoi substituído por Anísio Teixeira. Como ministro da Educação, criou o\nFundo Nacional de Ensino e determinou a aplicação de 12% da receita da\nUnião no aperfeiçoamento e desenvolvimento do ensino, o que, embora\nconstitucionalmente previsto, só ocorreu de fato durante sua gestão.\n\nEm janeiro de 1963, por ocasião do retorno do país ao regime\npresidencialista, Darcy Ribeiro deixou o Ministério da Educação e\nCultura, onde foi substituído por Teotônio Monteiro de Barros Filho,\npara assumir a chefia do Gabinete Civil da Presidência da República, em\nsubstituição a Evandro Lins e Silva.\n\nO período presidencialista do governo Goulart transcorreu sob crescente\ninsatisfação de setores civis e militares, que acusavam o presidente de\nfavorecer a atuação de esquerdistas no governo, fator que, segundo esses\nmesmos setores, se constituía em ameaça à segurança nacional. O\ndescontentamento tornou-se mais agudo quando no dia 13 de março de 1964,\nem comício que reuniu milhares de trabalhadores na estação da Central do\nBrasil, no Rio de Janeiro, Goulart reafirmou seu propósito de implantar\nas chamadas reformas de base — agrária, administrativa, bancária e\nfiscal. O agravamento da crise político-institucional nos dias que se\nseguiram culminou com a deflagração do movimento político-militar que\ndepôs o presidente em 31 de março. Nessa ocasião Darcy foi um dos poucos\nmembros do governo a tentar organizar uma resistência em defesa do\nregime democrático. Diante, porém, da quase total ausência de disposição\ndos aliados de Goulart para resistir aos militares, Darcy deixou o país\nnos primeiros dias de abril e exilou-se no Uruguai. No dia 10 de abril\nfoi destituído de seus direitos políticos pelo Ato Institucional nº 1\n(AI-1), editado na véspera pelo Comando Supremo da Revolução, integrado\npelo general Artur da Costa e Silva, o almirante Augusto Rademaker e o\nbrigadeiro Francisco de Assis Correia de Melo. Também com base no AI-1,\nfoi demitido de seus cargos de professor da Universidade do Brasil e de\netnólogo do SPI.\n\n \n\nNo exílio\n\nNo exílio, lecionou antropologia na Universidade da República Oriental\ndo Uruguai, em Montevidéu, e desenvolveu uma série de trabalhos\nrelacionados com o sistema universitário, entre os quais a organização e\ndireção do Seminário de Reforma da Universidade da República e a\norganização da Enciclopédia de Cultura do Uruguai. Por essa época\ncomeçou a escrever os seus *Estudos de antropologia da civilização*,\nobra constituída por cinco volumes publicados ao longo de vários anos,\nna qual procurou estabelecer uma interpretação global do processo de\nformação dos povos americanos, particularmente o brasileiro, e das\ncausas de seu desenvolvimento desigual. O primeiro volume da série, *O\nprocesso civilizatório*, foi publicado em 1968, vindo em seguida: *As\nAméricas e a civilização*, *O dilema da América Latina*, *Os\nbrasileiros* e *Os índios e a civilização*.\n\nAinda em 1968, os processos que lhe eram movidos no Brasil pelo novo\nregime foram anulados pelo Supremo Tribunal Federal, o que lhe\npossibilitou retornar ao país em outubro. Por essa época, no entanto,\nacirrava-se o clima de polarização política entre o governo e a\noposição, culminando com a edição do AI-5 em 13 de dezembro. Logo em\nseguida à edição do ato, Darcy foi preso e indiciado sob a acusação de\ninfringir a Lei de Segurança Nacional. Permaneceu detido em unidade da\nMarinha até setembro do ano seguinte, quando foi afinal julgado e\nabsolvido pela Auditoria da Marinha do Rio de Janeiro.\n\nEm seguida, voltou a deixar o país, fixando-se em Caracas, na Venezuela,\nonde lecionou e organizou o projeto de reforma da Universidade Central\nda República. Em 1971, convidado pelo presidente chileno Salvador\nAllende para assessorá-lo, Darcy Ribeiro transferiu-se para aquele país,\nonde permaneceu até o ano seguinte, tendo trabalhado também como\nprofessor pesquisador do Instituto de Estudos Internacionais da\nUniversidade do Chile. Em seguida, transferiu-se para o Peru, onde\ncolaborou com o governo do general Juan Velasco Alvarado. Dirigiu o\nprograma de integração das universidades peruanas e trabalhou na\norganização do Centro de Participação Social, patrocinado pela\nOrganização das Nações Unidas (ONU).\n\nEm dezembro de 1974, vítima de um câncer pulmonar, foi autorizado pelo\ngoverno brasileiro a voltar ao país. Foi, então, submetido a uma\nintervenção cirúrgica para a extração de um dos pulmões. Permaneceu no\npaís durante apenas seis meses, tempo necessário para restabelecer-se.\nEm maio de 1975 retornou ao Peru. Posteriormente, elaborou estudos para\nuniversidades de diversos países latino-americanos e da Argélia.\n\nEm 1976 retornou definitivamente ao Brasil, fixando-se no Rio de\nJaneiro. No ano seguinte, participou da XXIX Reunião Anual da SBPC,\nrealizada em São Paulo, onde analisou o sistema educacional brasileiro e\nfez severas críticas ao Movimento Brasileiro de Alfabetização (Mobral),\ndeclarando que as verbas gastas por esse órgão para a alfabetização de\nadultos deveriam ser concentradas no ensino fundamental, uma vez que\nmilhares de crianças no país continuavam privadas de acesso à escola\nprimária, situação que, segundo Darcy, produziria uma nova geração de\nadultos analfabetos. Suas declarações repercutiram na imprensa, onde\nforam contestadas pelo então presidente do Mobral, Arlindo Lopes\nCorreia.\n\n \n\nRetorno à vida política\n\nCom o gradual processo de redemocratização da vida política nacional,\niniciado no governo do general Ernesto Geisel, Darcy Ribeiro passou a\nrealizar sucessivas conferências em universidades brasileiras,\nocupando-se particularmente da campanha em defesa dos povos indígenas e\ndenunciando como “falsa” a proposta de emancipação dos índios defendida\npelo governo militar. No início de 1979 publicou o seu primeiro romance,\n*Maíra*, logo traduzido para outros idiomas e sucessivamente reeditado\nem português.\n\nEm agosto daquele ano, o general João Batista Figueiredo — empossado em\nmarço na presidência da República — assinou lei concedendo anistia a\ntodos os punidos pelo regime instaurado no país em 1964. Favorecido pela\nmedida, Darcy Ribeiro foi em seguida reintegrado ao Instituto de\nFilosofia e Ciências Sociais da Universidade Federal do Rio de Janeiro,\nonde assumiu o cargo de diretor-adjunto do Programa de Pós-Graduação em\nCiências Sociais.\n\nEm novembro seguinte foram extintos os partidos políticos existentes no\npaís e traçadas as diretrizes para a instauração do pluripartidarismo,\niniciando-se as articulações para a formação de novas agremiações\npolíticas. Ao lado de Leonel Brizola, ex-governador do Rio Grande do\nSul, Darcy Ribeiro empenhou-se na reorganização do Partido Trabalhista\nBrasileiro (PTB), numa tentativa de reviver o trabalhismo anterior a\n1964. A sigla do PTB, porém, era também disputada pelo grupo político\nliderado pela ex-deputada paulista Ivete Vargas. Em maio de 1980, o\nTribunal Superior Eleitoral, em polêmica decisão, concedeu ao grupo de\nIvete Vargas o controle da histórica legenda trabalhista. A corrente\norganizada sob a liderança de Brizola adotou então o nome de Partido\nDemocrático Trabalhista (PDT), incorporando-se Darcy Ribeiro aos seus\nquadros.\n\nEm agosto de 1980, Darcy viajou à Holanda para participar do Tribunal\nBertrand Russel sobre crimes cometidos contra os índios na América\nLatina. Nessa ocasião, teceu fortes críticas à diretoria da Fundação\nNacional do Índio (Funai), que sucedeu o SPI, segundo ele entregue a “um\ngrupo de coronéis sem qualquer formação filosófica ou científica”. Por\nconta dessa declaração, Darcy teve o seu pedido de reintegração aos\nquadros da Funai indeferido pelo ministro do Interior, Mário Andreazza.\n\nAinda em 1979, foi eleito membro do conselho diretor da Faculdade\nLatino-Americana de Ciências Sociais (Flacso) e recebeu, em Paris, o\ntítulo de *doutor honoris* *causa* da Sorbonne, título que durante sua\nvida lhe foi concedido também por várias outras instituições, tais como\na Universidade de Copenhague, a Universidade da República Oriental do\nUruguai, a Universidade Central da Venezuela e a Universidade de\nBrasília.\n\n \n\nO Governo Leonel Brizola (1983-1986)\n\nEm março de 1982, Darcy Ribeiro foi lançado candidato a vice-governador\ndo Rio de Janeiro na legenda do PDT, na chapa encabeçada por Leonel\nBrizola. Realizado o pleito em novembro, a chapa pedetista sagrou-se\nvencedora com cerca de 34% dos votos válidos, derrotando outros quatro\nconcorrentes, entre os quais Wellington Moreira Franco, do Partido\nDemocrático Social (PDS), apoiado pelo governo federal, e Miro Teixeira,\ndo Partido do Movimento Democrático Brasileiro (PMDB), apoiado pelo\nentão governador fluminense Chagas Freitas.\n\nEmpossado como vice-governador, Darcy acumulou ainda no novo governo o\ncargo de secretário estadual de Ciência e Cultura, além de coordenar o\nPrograma Especial de Educação, cuja principal meta era a implantação dos\ncentros integrados de Educação Pública (CIEPs). Idealizados por Darcy,\nos CIEPs eram unidades de ensino básico voltadas prioritariamente para a\npopulação de baixa renda e previstas para funcionar em regime de turno\nintegral, onde as crianças, além da educação tradicional, recebiam ainda\nalimentação e assistência médica, e participavam de atividades de\ncultura e lazer. O projeto inicial do governo fluminense era o de\nconstruir quinhentos CIEPs ao longo de quatro anos, com investimentos\nsuperiores a um bilhão de dólares. Ao fim do governo, porém, somente 127\nunidades estavam em funcionamento. Segundo seus críticos, a implantação\ndos CIEPs, além de precária, se dava em detrimento das unidades\nescolares convencionais pertencentes ao governo do Estado, que sequer\nrecebiam os investimentos necessários à sua manutenção. Os\nrepresentantes sindicais dos profissionais da educação, por sua vez,\ncriticaram ostensivamente a política salarial adotada pelo governo\nestadual na área educacional, classificando-a como incompatível com um\nensino público de qualidade.\n\nEntre as iniciativas de Darcy Ribeiro neste período, destacam-se também:\na criação da Fábrica de Escolas, voltada para a implantação dos CIEPs; a\ncriação da Biblioteca Pública Estadual e da Casa de Cultura Laura Alvim;\no apoio à implantação da Casa França-Brasil; a construção do Sambódromo,\nprojetado pelo arquiteto Oscar Niemeyer e destinado à realização do\ndesfile oficial das escolas de samba, sendo ainda aproveitado no resto\ndo ano para abrigar escolas de primeiro e segundo graus.\n\n \n\nA candidatura ao governo fluminense\n\nEm 1986, com a proximidade das eleições para os governos estaduais, o\nPDT indicou o nome de Darcy Ribeiro à sucessão de Leonel Brizola. Para\ncompor a chapa como vice-governador, o partido apresentou o deputado\nestadual Cláudio Moacir, oriundo da ala chaguista do PMDB, adversária do\nPDT na política fluminense. Segundo Darcy, o PDT necessitava realizar\nalianças para vencer as eleições, devendo mesmo, em sua opinião, atuar\ncomo uma frente política empenhada prioritariamente na eleição de Leonel\nBrizola à presidência da República. A partir daí se tornaria um partido\nde características marcadamente ideológicas.\n\nIniciada a campanha eleitoral, logo se verificou a polarização da\ndisputa entre as candidaturas de Darcy Ribeiro e de Moreira Franco, que\ntrocara o PDS pelo PMDB e reunira em torno de seu nome uma ampla\ncoligação partidária. Moreira Franco centrou seu discurso de campanha no\ncombate à violência e nas críticas ao desempenho do governo de Brizola\nna área de segurança pública, acusando o PDT de ser conivente com o\ncrime organizado. Tais acusações ganharam maior dimensão quando, em 20\nde outubro, reunidos numa churrascaria do Rio, os chefes do jogo do\nbicho da cidade, na presença de Darcy e do candidato do PDT ao Senado,\nMarcelo Alencar, celebraram um pacto para ajudar o candidato pedetista a\nvencer as eleições. A adesão foi justificada por um dos chefes da\ncontravenção pelo fato de terem exercido suas atividades com\ntranqüilidade no governo Brizola. Darcy, por sua vez, nessa e em outras\nocasiões, classificou o jogo do bicho como legítima instituição da\ncultura carioca, ignorando as denúncias que associavam seus dirigentes\nao tráfico de armas e entorpecentes.\n\nRealizado o pleito em 15 de novembro, a vitória coube a Moreira Franco,\nque obteve uma vantagem de cerca de oitocentos mil votos sobre Darcy\nRibeiro, o segundo colocado.\n\nEm maio de 1987, convidado pelo governador Newton Cardoso, do PMDB,\nDarcy Ribeiro assumiu a secretaria extraordinária de Desenvolvimento\nSocial de Minas Gerais. Ao ser empossado no cargo, declarou que a sua\nprincipal meta era a construção de mil CIEPs em todo o estado, ao longo\ndos quatro anos do governo. Em setembro seguinte, no entanto, Darcy\nabandonou o cargo, acusando o governo mineiro de não levar a sério o\nprograma de instalação dos CIEPs.\n\nAinda em setembro Darcy foi convidado pelo governador de São Paulo,\nOrestes Quércia, do PMDB, para colaborar com Oscar Niemeyer no\nplanejamento cultural do Memorial da América Latina, inaugurado em\njaneiro de 1989.\n\nNa eleição presidencial de 1989, a primeira a se realizar por via direta\nno país após quase 30 anos, o PDT apresentou a candidatura de Leonel\nBrizola, seu principal dirigente. Darcy se empenhou na campanha\npresidencial do partido, percorrendo todo o Brasil. Sua principal tarefa\nfoi organizar grupos de intelectuais, sindicalistas, professores e\ntécnicos para discutir e elaborar, setor por setor, o programa de\ngoverno de Brizola. Realizado o primeiro turno do pleito em novembro, o\ncandidato pedetista obteve a terceira colocação, ficando de fora da\ndisputa do segundo turno, para o qual se habilitaram os dois candidatos\nmais votados — Fernando Collor de Melo, lançado pelo Partido da\nReconstrução Nacional (PRN), e Luís Inácio Lula da Silva, candidato do\nPartido dos Trabalhadores (PT). O PDT optou no segundo turno pelo apoio\na Lula, afinal derrotado por Fernando Collor em disputa marcada por\nacirrada polarização ideológica. Ainda em 1989, Darcy Ribeiro foi\ncondecorado pelo presidente cubano Fidel Castro com a medalha Haydée\nSantamaria, em comemoração aos 30 anos da Revolução Cubana e da Casa das\nAméricas, a mais importante editora daquele país.\n\n \n\nNo Senado\n\nEm outubro de 1990, Darcy Ribeiro foi eleito senador pelo estado do Rio\nde Janeiro na legenda do PDT, no mesmo pleito que reconduziu Leonel\nBrizola ao comando do Executivo fluminense. Darcy tomou posse no Senado\nem fevereiro do ano seguinte, para aquele que seria o único mandato\nlegislativo de toda a sua trajetória política.\n\nSua atividade parlamentar privilegiou temas relacionados à realidade\neducacional do país, em particular a elaboração da nova Lei de\nDiretrizes e Bases da Educação Nacional (LDB). Outra iniciativa\nimportante de Darcy no Senado foi a apresentação do projeto que deu\norigem à lei de transplantes de órgãos, segundo a qual todos aqueles\nque, em vida, não registrassem legalmente a sua condição de não-doadores\nde órgãos seriam considerados potenciais doadores após a morte. O\nprojeto invertia a legislação vigente, que considerava doadores apenas\naqueles que em vida manifestassem esse desejo através de documento\nregistrado em cartório, fator que se constituía em grave obstáculo à\nrealização de transplantes. Darcy apresentou, também, um projeto de lei\nde controle de substâncias viciantes que, ao estabelecer a\nobrigatoriedade dos fabricantes de cola industrial de adicionarem em sua\nfórmula uma substância atóxica, procurava combater o consumo da chamada\n“cola de sapateiro” pelos menores de rua.\n\nDarcy marcou sua atuação no Senado também por críticas à política de\nabertura econômica implementada pelo presidente Fernando Collor e\ncondenou o projeto governista de privatização das empresas estatais.\nSegundo o senador, somente as empresas inoperantes, que não\ndesempenhassem papel social ou econômico relevante, poderiam\neventualmente ser privatizadas, estando excluídas desse universo todas\naquelas cujo funcionamento sob controle do Estado fosse importante para\na autonomia nacional.\n\nA par de sua atividade como senador, Darcy colaborou com a administração\nde Leonel Brizola no governo do estado do Rio de Janeiro. Amplamente\nreconhecido como o principal nome do PDT na área educacional, recebeu de\nBrizola a incumbência de retomar o programa de implantação dos CIEPs e\nde coordenar a criação da Universidade Estadual do Norte Fluminense\n(UENF), no município de Campos, concebida para ser um centro gerador de\ntecnologia avançada, voltada para o apoio ao desenvolvimento econômico\ndo estado. Em setembro de 1991, Darcy licenciou-se de seu mandato no\nSenado para assumir a secretaria estadual de Projetos Especiais de\nEducação do governo fluminense, cujo principal objetivo era promover a\nretomada da implantação dos CIEPs, bem como colaborar na implantação de\nsua versão em âmbito federal, os centros integrados de Apoio à Criança\n(CIACs), criados pelo governo Collor. Sua cadeira no Senado foi então\nocupada pelo suplente Abdias do Nascimento, ligado ao movimento negro.\n\nNo comando de sua secretaria no governo fluminense, Darcy voltou a\nreceber críticas de entidades sindicais, setores da imprensa e\nparlamentares da oposição, que denunciaram o desequilíbrio na\ndistribuição das verbas destinadas à educação. Segundo essas críticas,\nao privilegiar a secretaria de Projetos Especiais e os CIEPs, o governo\ncondenava ao abandono as demais unidades escolares, que continuavam\nsubordinadas à Secretaria de Educação. O Sindicato Estadual dos\nProfissionais da Educação (SEPE), por sua vez, insistia na análise de\nque a implantação de um ensino público de qualidade era incompatível com\na realidade salarial imposta aos professores e demais trabalhadores do\nsetor educacional.\n\nEm 1992, já de volta ao Senado, Darcy votou favoravelmente à abertura de\num processo de *impeachment* do presidente Fernando Collor, acusado de\nenvolvimento com um esquema de corrupção na administração federal\ncomandado pelo empresário Paulo César Farias, seu amigo pessoal e\nex-tesoureiro da sua campanha eleitoral. Afastado pela Câmara dos\nDeputados em 29 de setembro, Collor foi julgado e condenado pelo Senado\nem 29 de dezembro, sendo definitivamente afastado da presidência e tendo\nseus direitos políticos cassados por oito anos, muito embora tenha\nrenunciado ao cargo horas antes da decisão dos senadores.\n\nEm outubro de 1992, Darcy Ribeiro foi eleito membro da Academia\nBrasileira de Letras, passando a ocupar a cadeira nº 11 a partir de\nabril do ano seguinte.\n\nEm 1994, o PDT lançou novamente a candidatura de Leonel Brizola à\npresidência da República, tendo Darcy Ribeiro como candidato a vice.\nBrizola manifestou então a sua intenção de, caso eleito, entregar o\nMinistério da Educação a Darcy, que ficaria responsável pela implantação\nda escola de turno integral em todo o território nacional. O pleito\npresidencial desse ano, porém, foi marcado pela polarização entre as\ncandidaturas de Lula, lançado pelo PT com o apoio de outras seis\nagremiações de esquerda, e a de Fernando Henrique Cardoso, lançado pelo\nPartido da Social Democracia Brasileira (PSDB), em aliança com o Partido\nda Frente Liberal (PFL) e o PTB. Realizado o pleito no mês de outubro,\nFernando Henrique sagrou-se vencedor já no primeiro turno da disputa,\ncom mais da metade dos votos válidos. A chapa Brizola-Darcy Ribeiro\nconquistou apenas a quinta colocação entre os oito concorrentes,\nrecebendo pouco mais de dois milhões de votos (3,2% do total dos votos\nválidos).\n\nEm dezembro daquele ano, Darcy Ribeiro foi internado em estado grave na\nUnidade de Terapia Intensiva do Hospital Samaritano, no Rio de Janeiro,\npara tratar-se de um câncer na próstata que espalhara-se em metástase\npara outros órgãos. Apesar da gravidade de seu quadro de saúde, Darcy\ndeixou o hospital sem ordem médica após cerca de um mês internado,\ndirigindo-se para sua casa de praia no município fluminense de Maricá.\nJustificou sua atitude pela necessidade de concluir o livro *O povo\nbrasileiro*, obra na qual trabalhou por cerca de 30 anos e com a qual\nprocurou oferecer a sua interpretação global sobre a formação da nação\nbrasileira, projeto esse que já havia resultado na elaboração dos cinco\nvolumes dos *Estudos de antropologia da civilização*. Em fevereiro\nseguinte retomou sua cadeira no Senado.\n\nPassou, então, a concentrar sua atividade na elaboração da nova Lei de\nDiretrizes e Bases da Educação Nacional (LDB). O projeto apresentado\nnesse sentido por Darcy substituiu um outro, preliminarmente aprovado na\nCâmara em 1993, cuja discussão se iniciara logo após a promulgação da\nConstituição de 1988 e arrastara-se por vários anos, envolvendo\nparlamentares e entidades representativas do setor educacional. O\nsubstitutivo do senador pedetista foi criticado por entidades como a\nConfederação Nacional dos Trabalhadores da Educação (CNTE), que\ncontestaram sua legitimidade por sobrepor-se ao debate até então\ntravado. Para Darcy, no entanto, a LDB aprovada na Câmara, ao\ncentralizar no âmbito federal as definições normativas sobre a\norganização educacional e submetê-las a conselhos corporativos,\ncongelava a estrutura da educação brasileira, considerada pelo senador\npedetista como sendo de má qualidade e incapaz de atualizar-se para\natender às novas demandas sociais e garantir os requisitos necessários\nao desenvolvimento nacional autônomo. Na sua avaliação, a LDB deveria\nassumir a forma de “um diploma legal sucinto, claro e genérico, para dar\nespaço ao exercício da autonomia tanto pelas escolas e universidades\ncomo pelos sistemas estaduais de ensino”. A nova lei abstinha-se de\ncriar conselhos com funções normativas por entender ser essa uma\nprerrogativa do Poder Executivo, que deveria ficar responsável ainda\npelo estabelecimento de critérios para uma avaliação nacional do ensino\nem todos os níveis.\n\nNo ensino fundamental, a principal novidade introduzida pela nova LDB\nfoi a exigência de formação universitária para todos os professores,\ninclusive os responsáveis pelo chamado curso primário — ou primeiro\nsegmento do primeiro grau — para os quais, até então, era exigido apenas\num curso de formação de professores, o curso normal, equivalente aos\ncursos técnicos de nível secundário. As instituições de ensino\nuniversitário, por sua vez, passaram a desfrutar de maior autonomia para\nestruturarem sua grade curricular, estando porém obrigadas a\napresentarem resultados satisfatórios nas avaliações de desempenho a\nserem regularmente promovidas pelo Ministério da Educação, sob pena de\nperderem seus registros de funcionamento.\n\nAplaudida pelo ministro da Educação Paulo Renato Sousa, a nova LDB foi\naprovada pelo Congresso em dezembro de 1996 e sancionada no mesmo mês\npelo presidente Fernando Henrique que, em homenagem ao senador\nfluminense, batizou-a de Lei Darcy Ribeiro.\n\nDarcy marcou também seu mandato no Senado pelas freqüentes críticas\ndirigidas ao governo do presidente Fernando Henrique Cardoso. Apesar de\ndeclarar-se amigo pessoal do presidente e admirador de sua trajetória\nintelectual, condenou sua opção por aliar-se aos partidos políticos\nsituados à direita do espectro político nacional. Criticou especialmente\no modelo econômico implantado pelo governo, segundo ele marcado pela\nsubmissão aos interesses do grande capital internacional e conduzido por\ntecnocratas insensíveis à realidade social do país. Apontou a abertura\nindiscriminada do país ao comércio externo como a principal causa do\naumento do desemprego, e denunciou o agravamento da concentração de\nrenda no Brasil como resultado da política econômica adotada pelo\ngoverno, comparável segundo ele à vigente no país durante o regime\nmilitar. Criticou com veemência as privatizações de empresas estatais,\nem particular a venda da Companhia Vale do Rio Doce, por ele\nclassificada como uma das mais bem-sucedidas empresas de mineração do\nmundo. Defendeu a realização da reforma agrária e classificou o\nMovimento dos Trabalhadores Rurais Sem Terra (MST) como um dos mais\nimportantes da história do Brasil.\n\nNas votações das emendas constitucionais propostas pelo governo,\nmanifestou-se contrário à quebra do monopólio estatal sobre a exploração\ndo petróleo e a distribuição de gás canalizado, à mudança no conceito de\nempresa nacional e à quebra do monopólio nacional sobre a navegação de\ncabotagem.\n\nDurante o ano de 1996 manteve uma coluna semanal no jornal *Folha de S.\nPaulo* e recebeu inúmeras homenagens. Em julho recebeu das mãos do\npresidente Fernando Henrique o Prêmio Anísio Teixeira, concedido pelo\ngoverno federal àqueles com atuação destacada na área educacional. Em\ndezembro foi agraciado com o Prêmio Sérgio Buarque de Holanda na\ncategoria ensaio social, concedido pela Biblioteca Nacional, pelo seu\nlivro *Diários índios*, publicado naquele ano, no qual relata sua\nexperiência junto aos índios urubu-caapor. Ainda em 1996 recebeu o\nPrêmio Interamericano de Educação Andrés Bello, concedido pela\nOrganização dos Estados Americanos (OEA). Em janeiro de 1997 foi\nagraciado com o título de “Homem de Idéias”, concedido pelo Jornal do\nBrasil.\n\nManteve por toda a sua trajetória o gosto pela polêmica e pelo combate\npolítico. Partidário do trabalhismo desde os anos 1950, exaltou sempre o\nlegado de Getúlio Vargas e o projeto político de João Goulart. Manteve\nestrita fidelidade política ao principal herdeiro do trabalhismo, o\ngovernador Leonel Brizola, a quem costumava referir-se como a “principal\ncabeça política do país”. Nessa mesma direção, cultivou uma irredutível\nhostilidade contra todos que se identificavam com o udenismo e com o\nregime militar. Declarou-se sempre um político de esquerda e alimentou a\nimagem de intelectual polêmico e irônico. Assumidamente vaidoso,\ncostumava dedicar fartos elogios à sua própria pessoa em entrevistas e\nartigos de jornais. Entre as idéias centrais de sua obra, estiveram\nsempre a denúncia da histórica exclusão social no Brasil e a procura de\ncaminhos para levar o país a desenvolver plenamente as potencialidades\nque acreditava existirem em estado latente na nação, impedidas de se\nrealizarem pelas opressões de origem colonial. Segundo seus críticos,\nporém, o pensamento de Darcy pecava pela excessiva “condescendência com\nos proscritos” e por um certo ufanismo ingênuo e generoso ao falar das\ncoisas brasileiras, como demonstraria a sua reiterada tendência a\nidentificar os índios brasileiros com a imagem romântica do bom selvagem\nrousseauniano.\n\nDarcy Ribeiro faleceu em 17 de fevereiro de 1997, na capital federal.\nSeu velório, realizado no Salão Negro do Congresso Nacional e,\nposteriormente, na sede da Academia Brasileira de Letras, no Rio de\nJaneiro, reuniu as principais lideranças da política brasileira e\nfluminense. Em atendimento a um desejo manifestado nos últimos tempos de\nvida, seu corpo foi encomendado pelo teólogo cristão Leonardo Boff,\namigo pessoal de Darcy, cujas contribuições à chamada “Teologia da\nLibertação” valeram-lhe a exclusão dos quadros da Igreja Católica,\nordenada pelo Vaticano.\n\nFoi casado com a antropóloga Berta Gleiser Ribeiro, co-autora de alguns\nde seus trabalhos sobre os indígenas, e posteriormente com Cláudia\nZarvos. Não teve filhos.\n\nAlém das obras citadas, publicou também *Línguas e culturas indígenas no\nBrasil* (1957), *Arte plumária dos índios Kaapor* (1957), *A política\nindigenista brasileira* (1962), *Plano orientador da Universidade de\nBrasília* (1962), *A universidade necessária* (1969), *Propuestas*\n(1970), *Configurações histórico-culturais dos povos americanos* (1970),\n*América Latina: a pátria grande* (1972), *Université des Sciences\nHumaines D’Alger* (1972), *La universidad peruana* (1974), *UnB —\ninvenção e descaminho* (1978), *Ensaios insólitos* (1979), *Sobre o\nóbvio* (1979), *Nossa escola é uma calamidade* (1984), *Aos trancos e\nbarrancos* (1985), *Suma etnológica brasileira* (1986, em colaboração\ncom Berta G. Ribeiro), *Testemunho* (1990), *A fundação do Brasil —\n1500/1700* (1992, em colaboração com Carlos de Araújo Moreira Neto),\n*Universidade do terceiro milênio — plano orientador da Universidade\nEstadual do Norte Fluminense* (1993), *O Brasil como problema* (1995),\n*Noções de coisas* (1995, com ilustrações de Ziraldo), e *Confissões*\n(1997), além dos romances: *O mulo* (1981), *Utopia selvagem* (1982 ) e\n*Migo* (1988).\n\nCláudia Galvão atualização\n\n \n\nFONTES: ARQ. DEP. PESQ. Jornal do Brasil; *Estado de S. Paulo* (16/9/62,\n21/10/86, 26 e 29/6/95, 24/2, 14/3, 24/7 e 17/8/96, 18/2/97); *Folha de\nS. Paulo* (7/12/88, 9/10/92, 4, 9 e 29/5/94, 8/1, 14 e 16/2, 23/6/95,\n14/1, 12/2, 25/3, 1 e 10/6, 16, 21 e 23/12/96, 19/2/97); *Globo*\n(21/11/85, 25/11/92, 16/4, 5/9/93, 8/4/94, 15/1, 19 e 26/2/95, 9/2 e\n18/12/96, 19/1/97); *Grande encic. Delta*; INF. ASSES. BIOG.; *Jornal do\nBrasil* (7/4/74, 12, 15, 16 e 24/7, 19/9/77, 15/6, 9/11/78, 27/7/80,\n14/3/81, 6/7/82, 27/1/86, 16/9/87, 8 e 30/8/91, 6/6 e 11/7/93, 30/12/94,\n5 e 18/1 e 3/6/95, 15/2, 11/8 e 23/12/96, 25/1 e 19/2/97); MAGALHÃES, L.\n*Segundo*; *Perfil parlamentar/ IstoÉ* (1991); RIBEIRO, D. *Confissões*;\nRIBEIRO, D. *O Povo*; RIBEIRO, D. *Testemunho*; SEGANFREDO, S. *UNE*;\n*Tribuna da Imprensa* (8/5/95); *Veja* (22/1 e 25/11/80, 16/2/81,\n18/1/95); VÍTOR, M. *Cinco*.\n\n \n","ref":"FONTES: ARQ. DEP. PESQ. Jornal do Brasil; *Estado de S. Paulo* (16/9/62,\n21/10/86, 26 e 29/6/95, 24/2, 14/3, 24/7 e 17/8/96, 18/2/97); *Folha de\nS. Paulo* (7/12/88, 9/10/92, 4, 9 e 29/5/94, 8/1, 14 e 16/2, 23/6/95,\n14/1, 12/2, 25/3, 1 e 10/6, 16, 21 e 23/12/96, 19/2/97); *Globo*\n(21/11/85, 25/11/92, 16/4, 5/9/93, 8/4/94, 15/1, 19 e 26/2/95, 9/2 e\n18/12/96, 19/1/97); *Grande encic. Delta*; INF. ASSES. BIOG.; *Jornal do\nBrasil* (7/4/74, 12, 15, 16 e 24/7, 19/9/77, 15/6, 9/11/78, 27/7/80,\n14/3/81, 6/7/82, 27/1/86, 16/9/87, 8 e 30/8/91, 6/6 e 11/7/93, 30/12/94,\n5 e 18/1 e 3/6/95, 15/2, 11/8 e 23/12/96, 25/1 e 19/2/97); MAGALHÃES, L.\n*Segundo*; *Perfil parlamentar/ IstoÉ* (1991); RIBEIRO, D. *Confissões*;\nRIBEIRO, D. *O Povo*; RIBEIRO, D. *Testemunho*; SEGANFREDO, S. *UNE*;\n*Tribuna da Imprensa* (8/5/95); *Veja* (22/1 e 25/11/80, 16/2/81,\n18/1/95); VÍTOR, M. *Cinco*.\n\n \n","dic":"DHBB"}
