{"title":"RIBEIRO, Fernando Ernesto Carneiro","cargoss":["Comandante do II Distrito Naval","Comandante-em-chefe da Esquadra"],"cargos_esp":[0,0],"datas_ini":[1974,1977],"datas_fim":[1977,1978],"estados":[0,0],"autor":[0],"content":"**RIBEIRO, Fernando Ernesto Carneiro**\n\n\\*militar; comte. II DN 1974-1977; comte.-em-ch. Esq. 1977-1978.\n\n \n\n*Fernando Ernesto Carneiro Ribeiro* nasceu em Salvador no dia 24 de\nnovembro de 1920, filho de Helvécio Carneiro Ribeiro e de Amélia\nFernandes Carneiro.\n\nEm sua cidade natal, estudou no Ginásio Carneiro Ribeiro.\nTransferindo-se depois para o Rio de Janeiro, então capital federal,\ningressou na Escola Naval em março de 1938, da qual saiu guarda-marinha\nem julho de 1943. Promovido a segundo-tenente em fevereiro de 1944,\nparticipou, durante a Segunda Guerra Mundial (1939-1945), de operações\nde patrulha e escolta de comboios no Atlântico Sul.\n\nChegou a primeiro-tenente em abril de 1945 e a capitão-tenente em março\nde 1948. Em dezembro de 1950, concluiu o curso de especialização de\nartilharia para oficiais, sendo promovido a capitão-de-corveta em\nfevereiro de 1954. Em julho de 1957, assumiu o comando do rebocador\n*Triunfo* e, em fevereiro de 1959, foi promovido a capitão-de-fragata.\nConcluiu o curso de comando da Escola de Guerra Naval em dezembro\nseguinte, tornando-se, em fevereiro de 1960, encarregado do Escritório\nTécnico Administrativo de Aratu, em Salvador.\n\nEm abril de 1964, assumiu o comando do navio-oficina *Belmonte* e do\nDestacamento de Manutenção da Esquadra, conhecido como *Trem da\nEsquadra*. Promovido a capitão-de-mar-e-guerra em maio de 1966, no mês\nseguinte foi designado para chefiar o Estado-Maior da Força de\nTransporte da Marinha. Em fevereiro de 1968, assumiu o cargo de\ncomandante do porta-aviões *Minas Gerais*, no qual permaneceu até abril\ndo ano seguinte. Ao deixar esse comando, foi nomeado adido naval e\nmilitar, em Londres, e adido naval em Estocolmo e Oslo, Suécia, funções\nque exerceu até maio de 1971.\n\nPromovido a contra-almirante em março deste último ano, em julho\nseguinte assumiu o comando da Força Aeronaval. Nessa função, ocupou,\ninterinamente, o cargo de comandante-em-chefe da Esquadra. Em abril de\n1974, assumiu o comando do II Distrito Naval, em Salvador, sendo\npromovido a vice-almirante em novembro desse mesmo ano. Permaneceu à\nfrente do II Distrito Naval até março de 1977, quando assumiu, como\nefetivo, a função de comandante-em-chefe da Esquadra, no Rio de Janeiro,\nem substituição ao almirante Roberto Mário Monnerat. Ocupou este cargo\naté abril do ano seguinte, sendo sucedido pelo almirante Newton Braga de\nFaria. Assumindo em seguida a Diretoria de Ensino da Marinha, foi\npromovido a almirante-de-esquadra em novembro de 1978.\n\nNo mês seguinte, foi nomeado diretor-geral de Pessoal da Marinha e, em\nmarço de 1979, designado para a diretoria-geral de Material. Assumiu a\npresidência do Clube Naval, no Rio de Janeiro, em junho seguinte,\nsucedendo ao almirante Paulo de Bonoso Duarte Pinto. Em janeiro de 1980,\nassumiu o cargo de comandante de Operações Navais, no qual permaneceu\naté abril de 1981, quando completou seu tempo de permanência na ativa e\npassou à reserva.\n\nDois meses depois, deixou também a presidência do Clube Naval,\ntransmitindo o cargo ao almirante Newton Braga de Faria. Voltou a\nconcorrer à presidência da instituição em maio de 1985, sendo no entanto\nderrotado pelo almirante Paulo de Bonoso Duarte Pinto.\n\nDurante sua vida militar, fez ainda diversos cursos nos Estados Unidos e\no curso de armação e agenciamento de navios da Fundação de Estudos do\nMar, na Pontifícia Universidade Católica do Rio de Janeiro.\n\nFaleceu em Houston, Estados Unidos, em 16 de março de 1996.\n\nEra casado com Hilda da Costa Carneiro Ribeiro, com quem teve dois\nfilhos.\n\n \n\nFONTES: CURRIC. BIOG.; *Globo* (15/4 e 1/5/81); INF. FAM. Hilda Ribeiro;\n*Jornal do Brasil* (10/12/76, 13 e 17/3/77, 26/11 e 8/12/78, 9/3/79,\n1/5/81, 28/2/85); MIN. MAR. *Almanaque* (1971 e 1972).\n\n \n","ref":"FONTES: CURRIC. BIOG.; *Globo* (15/4 e 1/5/81); INF. FAM. Hilda Ribeiro;\n*Jornal do Brasil* (10/12/76, 13 e 17/3/77, 26/11 e 8/12/78, 9/3/79,\n1/5/81, 28/2/85); MIN. MAR. *Almanaque* (1971 e 1972).\n\n \n","dic":"DHBB"}
