{"title":"RIBEIRO, Mendes","cargoss":["Constituinte","Deputado federal"],"cargos_esp":[0,0],"datas_ini":[1987,1987],"datas_fim":[1988,1995],"estados":[0,"RS"],"autor":[0],"content":"**RIBEIRO, Mendes**\n\n\\*jornalista; const. 1987-1988; dep. fed. RS 1987-1995.\n\n \n\n*Jorge Alberto Mendes Ribeiro* nasceu no dia 14 de julho de 1919 em\nPorto Alegre, filho de Fernando Mendes Ribeiro e Alice Beck Mendes\nRibeiro. Seu filho, Jorge Alberto Mendes Ribeiro Filho, elegeu-se\ndeputado federal em outubro de 1994, reelegendo-se quatro anos depois.\n\nRealizou os estudos primários e secundários nos colégios Cruzeiro do\nSul, Júlio de Castilhos e Dores. Formado em jornalismo e em filosofia\npela Pontifícia Universidade Católica (PUC) de Porto Alegre,\nposteriormente bacharelou-se em ciências jurídicas e sociais pela\nUniversidade do Vale do Rio dos Sinos (Unisinos).\n\nIniciou sua carreira jornalística em 1952, no jornal *Folha da\nTarde*.****Nas eleições de outubro de 1958, concorreu a uma cadeira na\nAssembléia Legislativa do Rio Grande do Sul na legenda da União\nDemocrática Nacional (UDN), obtendo apenas uma suplência. Com o\nafastamento do deputado Poti Medeiros, assumiu o mandato em 1962,\nexercendo a liderança do partido.\n\nEm novembro deste mesmo ano, candidatou-se a uma vaga na Câmara\nMunicipal de Porto Alegre, na legenda do Movimento Trabalhista Renovador\n(MTR). Eleito, iniciou o mandato em fevereiro de 1963, após concluir o\nmandato estadual. Vice-presidente da mesa, presidente da Comissão de\nFinanças, exerceu também a liderança do MTR. Ainda em 1963, deixou a\n*Folha da Tarde* para trabalhar no jornal *Zero Hora*. No ano seguinte,\nrenunciou ao mandato de vereador, após a vitória do movimento\npolítico-militar de 31 de março de 1964, que depôs o presidente João\nGoulart.\n\nAfastado temporariamente do cenário político, entre os anos de 1964 e\n1985 atuou como****professor de teoria geral de processo, direito\nconstitucional e técnica de rádio e jornal, tendo sido fundador da\nFaculdade de Comunicação Social da Unisinos. Neste período, apresentou\nprogramas diários na *Rádio* e *TV Gaúcha*.\n\nNas eleições de novembro de 1986, candidatou-se a uma vaga na Câmara dos\nDeputados na legenda do Partido do Movimento Democrático Brasileiro\n(PMDB). Eleito com a maior votação da história do Rio Grande do Sul —\n325.173 votos —, assumiu seu lugar na Assembléia Nacional Constituinte\nem fevereiro seguinte. Votou a favor do rompimento de relações\ndiplomáticas com países com política de discriminação racial, do mandado\nde segurança coletivo, da pluralidade sindical, da soberania popular, do\nvoto aos 16 anos, da nacionalização do subsolo, da proibição do comércio\nde sangue, da limitação dos encargos da dívida externa, da anistia aos\nmicro e pequenos empresários, da desapropriação da propriedade\nprodutiva, do aborto e da estabilidade no emprego. Colocou-se contra a\npena de morte, a limitação da propriedade produtiva, a remuneração 50%\nsuperior para o trabalho extra, a jornada semanal de 40 horas, a\nunicidade sindical, o presidencialismo, o mandato de cinco anos para o\npresidente José Sarney, a criação de um fundo de apoio à reforma agrária\ne a legalização do jogo do bicho.\n\nCom a promulgação da Constituição em 5 de outubro de 1988, retomou sua\ncadeira na Câmara dos Deputados. Integrou as comissões de Ciência e\nTecnologia (1989) e de Constituição e Justiça e de Redação (1989-1991).\n\nReeleito no pleito de outubro de 1990, foi o deputado mais votado do\nPMDB com 109.744 votos. Assumindo em fevereiro seguinte, foi suplente da\nComissão de Ciência e Tecnologia, Comunicação e Informática.\n\nAcompanhando a maioria dos deputados, votou favoravelmente, em 29 de\nsetembro de 1992, à abertura do processo de *impeachment* contra o\npresidente da República, Fernando Collor de Melo, acusado de crime de\nresponsabilidade pela Comissão Parlamentar de Inquérito (CPI) que\ninvestigou denúncias de corrupção contra o ex-tesoureiro de sua campanha\npresidencial, Paulo César Farias. Afastado da chefia do Executivo após a\nvotação na Câmara, Collor acabou renunciando ao mandato em 29 de\ndezembro seguinte, antes mesmo da conclusão de seu julgamento pelo\nSenado Federal. Foi substituído na presidência pelo vice Itamar Franco,\nque vinha ocupando o cargo interinamente desde o dia 2 de outubro.\n\nEm 1992, Mendes Ribeiro deixou o *Zero Hora* e passou a escrever para o\n*Correio do****Povo*, veículo no qual permaneceria até o fim da vida.\n\nEm outubro de 1994, perdeu a indicação do PMDB para o governo do estado\npara Antônio Brito. Deixou a Câmara em janeiro de 1995, ao término da\nlegislatura.\n\nAfastando-se definitivamente da vida pública, voltou a exercer a\nadvocacia. De 1995 a 1997, foi professor de direito da Universidade\nLuterana do Brasil (Ulbra), localizada na cidade de Canoas (RS).\n\nDiretor do departamento de Direito e Comunicação Social do Instituto dos\nAdvogados do Rio Grande do Sul e presidente da Escola Superior Osvaldo\nVergara, da Ordem dos Advogados do Brasil (OAB), foi também fundador e\nprimeiro diretor da *Rádio Guaíba*. Além disso, atuou como colunista nos\njornais *Correio Brasiliense*, em *O Estado**de S. Paulo* e na *Folha de\nS. Paulo*.        \n\nVitimado pelo câncer, faleceu em Porto Alegre no dia 9 de julho de 1999.\n\nEra casado com Marlene Garcez Mendes Ribeiro. Em primeiras núpcias, foi\ncasado com Teresinha Portanova Mendes Ribeiro, com quem teve quatro\nfilhos.\n\nPublicou *O repórter da Constituinte* e *Amor, causa e conseqüência*,\nambos em 1986, e *Amor ao infinito* (1988).\n\nGisela de Araújo Moura/Márcia de Sousa\n\n \n\nFONTES: ASSEMB. NAC. CONST. *Repertório* (1987-1988); *Correio\nBrasiliense* (19/1/87); *Estado de S. Paulo* (11/7/99); *Folha de S.\nPaulo* (19/1/87); INF. FAM.\n\n \n","ref":"FONTES: ASSEMB. NAC. CONST. *Repertório* (1987-1988); *Correio\nBrasiliense* (19/1/87); *Estado de S. Paulo* (11/7/99); *Folha de S.\nPaulo* (19/1/87); INF. FAM.\n\n \n","dic":"DHBB"}
