{"title":"RIBEIRO, Osvaldo","cargoss":["Deputado federal"],"cargos_esp":[0],"datas_ini":[1959],"datas_fim":[1961],"estados":["BA"],"autor":[0],"content":"**RIBEIRO, Osvaldo**\n\n\\*dep. fed. BA 1959-1961.\n\n* *\n\n*Osvaldo Ribeiro de Oliveira* nasceu em São Gonçalo dos Campos (BA) no\ndia 27 de abril de 1915.\n\nCursou os ginásios Antônio Vieira e São Salvador, na capital baiana,\nvindo a formar-se pela Faculdade de Direito da Bahia.\n\nDedicou-se à magistratura, foi fiscal do Departamento de Crédito\nAgrícola e Industrial (DCAI) do Banco do Brasil e advogado em seu\nestado.\n\nIngressando na política, candidatou-se, com o apoio da Aliança\nDemocrática Popular (ADP), integrada pelo Partido Social Democrático\n(PSD), ao qual era filiado, e o Partido de Representação Popular (PRP),\na um mandato de deputado federal pela Bahia no pleito de outubro de\n1958. Eleito, assumiu sua cadeira em fevereiro de 1959 e durante a\nlegislatura atuou principalmente nos órgãos técnicos da Câmara.\n\nFaleceu na cidade do Rio de Janeiro no dia 11 de fevereiro de 1961, em\npleno exercício do mandato.\n\n \n\n \n\nFONTES: CÂM. DEP. Anais (1960-1); CÂM. DEP. Relação dos dep.; CAMPOS, Q.\nFichário; Jornal do Comércio, Rio (28/2/61); TRIB. SUP. ELEIT. Dados\n(4).\n\n \n","ref":"FONTES: CÂM. DEP. Anais (1960-1); CÂM. DEP. Relação dos dep.; CAMPOS, Q.\nFichário; Jornal do Comércio, Rio (28/2/61); TRIB. SUP. ELEIT. Dados\n(4).\n\n \n","dic":"DHBB"}
