{"title":"RIBEIRO, Ricardo","cargoss":["Deputado federal"],"cargos_esp":[0],"datas_ini":[1983],"datas_fim":[1987],"estados":["SP"],"autor":[0],"content":"**RIBEIRO, Ricardo**\n\n\\*dep. fed. SP 1983-1987.\n\n*Ricardo Cristiano Ribeiro* nasceu em Ribeirão Preto (SP) no dia 17 de\njulho de 1940, filho da Jean Cristiano Indella Ribeiro e de Alice\nRibeiro.\n\nFiliado ao Partido Trabalhista Brasileiro (PTB), elegeu-se deputado\nfederal em novembro de 1982. Empossado em fevereiro seguinte, participou\ndas atividades legislativas como titular da Comissão de Finanças da\nCâmara dos Deputados.\n\nEm 25 de abril de 1984 votou a favor da emenda Dante de Oliveira, que,\napresentada na Câmara dos Deputados, propôs o restabelecimento das\neleições diretas para presidente da República em novembro daquele ano.\nComo a emenda não obteve o número de votos indispensáveis à sua\naprovação — faltaram 22 para que o projeto pudesse ser encaminhado à\napreciação pelo Senado Federal — no Colégio Eleitoral, reunido em 15 de\njaneiro de 1985, Ricardo Ribeiro votou no candidato oposicionista\nTancredo Neves, eleito novo presidente da República pela Aliança\nDemocrática, uma união do Partido do Movimento Democrático Brasileiro\n(PMDB) com a dissidência do Partido Democrático Social (PDS) abrigada na\nFrente Liberal. Contudo, por motivo de doença, Tancredo Neves não chegou\na ser empossado na presidência, vindo a falecer em 21 de abril de 1985.\nSeu substituto no cargo foi o vice José Sarney, que já vinha exercendo\ninterinamente o cargo desde 15 de março.\n\nFiliando-se ao Partido da Frente Liberal (PFL), Ricardo Ribeiro disputou\num novo mandato de deputado federal em novembro de 1986 mas não\nconseguiu se eleger. Deixou a Câmara Federal ao final da legislatura, em\njaneiro de 1987.\n\nAbandonando a carreira política, dedicou-se às atividades pecuárias em\nRibeirão Preto até meados de 1996. Em outubro de 1997, assumiu a\npresidência do Botafogo de Ribeirão Preto, tendo sido reeleito para mais\num biênio em outubro de 1999.\n\nNas eleições municipais de 2004 candidatou-se a vereador de Ribeirão\nPreto pela legenda do PMDB, contudo não logrou êxito.\n\nCasou-se com Elmara Lúcia Bonini Ribeiro, com quem teve cinco filhas.\n\nFONTES: CÂM. DEP. *Deputados brasileiros. Repertório*(1983-1987)*;\nGlobo* (26/4/84, 16/1/85); TSE. *Eleições* (2004).\n\n \n","ref":"FONTES: CÂM. DEP. *Deputados brasileiros. Repertório*(1983-1987)*;\nGlobo* (26/4/84, 16/1/85); TSE. *Eleições* (2004).\n\n \n","dic":"DHBB"}
