{"title":"RICUPERO, Rubens","cargoss":["Embaixador do Brasil - junto","Embaixador do Brasil - EUA","min Meio Amb e Amazônia Legal","Ministro da Fazenda","Embaixador do Brasil - Itália"],"cargos_esp":["à ONU e ao GATT, Genebra,",0,0,0,0],"datas_ini":[1987,1991,1993,1994,1995],"datas_fim":[1991,1992,1994,1994,1995],"estados":[0,0,0,0,0],"autor":["Susana Delgado","Gloria Moraes"],"content":"**RICUPERO, Rubens**\n\n\\*diplomata; emb. Bras. junto à ONU e ao GATT, Genebra, 1987-1991; emb.\nBras. EUA 1991-1992; min. Meio Amb. e Amazônia Legal 1993-1994; min.\nFaz. 1994; emb. Bras. Itália 1995.\n\n*Rubens Ricupero* nasceu em São Paulo no dia 1º de março de 1937, filho\nde João Ricupero e Assunta J. Ricupero, numa família de imigrantes\nitalianos, tendo crescido no Brás, um dos bairros mais italianos da\ncapital paulista.\n\nEstudou no Colégio de Nossa Senhora do Carmo, dos irmãos maristas, onde\nrecebeu sua formação católica.  Congregado mariano, participou de obras\nsociais da Igreja em favelas de São Paulo. Aluno da Faculdade de Direito\ndo Largo de São Francisco, da Universidade de São Paulo, durante o curso\nfoi membro da Conferência Vicentina. Formado em direito na turma de\n1959, um ano antes havia ingressado no curso de preparação à carreira\ndiplomática do Instituto Rio Branco.\n\nNomeado terceiro-secretário em 1961, foi um dos primeiros diplomatas a\ntrabalhar em Brasília, onde chegou em março daquele ano, como\noficial-de-gabinete do ministro das Relações Exteriores, Afonso Arinos,\ne assessor do chefe do Serviço de Relações com o Congresso Nacional.\n\nTransferido para Viena em 1963, exerceu, no ano seguinte, a função de\nencarregado do serviço consular e foi promovido a segundo-secretário em\noutubro do mesmo ano. Na capital austríaca, fez estágio na Agência\nInternacional de Energia Atômica (AIEA). Removido para Buenos Aires em\n1966, aí serviu até 1969, onde exerceu a função de chefe do Serviço de\nPromoção Comercial de 1967 a 1969. Atuou também como membro da comissão\nespecial Brasil-Argentina de coordenação de 1968 a 1969. Neste último\nano foi transferido para Quito, Equador, como encarregado de negócios da\nembaixada brasileira. Promovido a primeiro-secretário em setembro de\n1970, atuou como observador da XI Reunião da Comissão Permanente do\nPacífico Sul e delegado da II Reunião Plenária da Comissão Mista\nBrasil-Equador.\n\nRegressou ao Brasil em 1971 como chefe da Divisão de Difusão Cultural do\nMinistério das Relações Exteriores (1971-1974), e organizou no ano\nseguinte a conferência especializada sobre a Aplicação da Ciência e\nTecnologia ao Desenvolvimento da América Latina. Deixou a chefia da\ndivisão para servir como conselheiro na embaixada do Brasil em\nWashington (1974-1977). Nesse mesmo ano foi delegado da III Reunião do\nConselho Coordenador do Programa O Homem e a Biosfera, no âmbito da\nUNESCO, realizada na capital americana. De volta ao Brasil, em 1977,\npara chefiar a Divisão da América Meridional-II do Ministério das\nRelações Exteriores, como ministro de 2ª classe na carreira diplomática\nfoi um dos principais negociadores do Tratado de Cooperação Amazônica,\nassinado em 1978, em Brasília.\n\nEm 1979 passou a ensinar teoria das relações internacionais na\nUniversidade de Brasília e, no ano seguinte, história das relações\ninternacionais do Brasil, no Instituto Rio Branco (lecionaria nessas\nduas instituições até 1994). Designado chefe do Departamento das\nAméricas (1980-1985), foi promovido em 1982 a ministro de 1ª classe, o\nposto mais alto da carreira diplomática e, nesse mesmo ano, ocupou a\nchefia da Reunião para Análise do Intercâmbio Comercial Brasil-Peru, foi\ndelegado do Brasil e secretário-geral da conferência da XIII Reunião\nOrdinária dos Chanceleres dos Países da Bacia do Prata. Durante esses\nanos (1982-1985), participou de numerosas delegações em visitas\npresidenciais e de conferências sobre temas relativos às relações entre\no Brasil e os países das Américas, havendo igualmente representado o MRE\nno Conselho de Administração da Itaipu Binacional entre 1982 e 1983.\n\nNesse último ano participou, como chefe, da I Reunião do Conselho de\nCooperação Amazônica, realizada em Lima, no Peru, foi delegado da XIV\nReunião Ordinária de Ministros das Relações Exteriores dos Países da\nBacia do Prata, realizada em Assunção, no Paraguai, da II Reunião de\nChanceleres do Tratado de Cooperação Amazônica, realizada em Cáli, na\nColômbia, bem como da Reunião do Sistema Econômico Latino-Americano,\npreparatória da VI Conferência das Nações Unidas sobre Comércio e\nDesenvolvimento (UNCTAD), realizada em Cartagena, também na Colômbia.\n\nEm 1984, tornou-se, em caráter particular, assessor para a política\nexterior do então candidato, mais tarde presidente-eleito Tancredo\nNeves, tendo o acompanhado na sua viagem ao Vaticano, Itália, França,\nPortugal, Espanha, Estados Unidos, México e Argentina, entre fins de\njaneiro e meados de fevereiro de 1985. Durante o governo de José Sarney\n(1985-1989), foi subchefe da Casa Civil da Presidência da República e\nassessor especial do presidente entre 1986 e 1987. Neste último ano foi\ntransferido, já na qualidade de embaixador, para representar o Brasil\njunto ao Acordo Geral sobre Tarifas e Comércio (GATT), em Genebra,\nSuíça, onde serviria até 1991. De 1989 a 1991, atuou no GATT como\npresidente do Grupo Informal de Países em Desenvolvimento, do Comitê de\nComércio e Desenvolvimento, do conselho e da assembléia das partes\ncontratantes daquele órgão. Apesar de sua grande habilidade de\ndiplomata, mostrou-se no GATT um veemente crítico das práticas\nprotecionistas dos Estados Unidos e dos subsídios concedidos pela\nComunidade Européia para estimular suas exportações.\n\nPor indicação de Tancredo Neves foi nomeado subchefe da Casa Civil da\nPresidência da República, tendo, a princípio, permanecido no cargo no\ngoverno de José Sarney (1985-1989), o qual nomeou-o, em seguida,\n assessor especial do presidente (1986-1987). Nesse último ano foi\ntransferido, já na qualidade de embaixador, para representar o Brasil\njunto às organizações da ONU sediadas em Genebra, Suíça, e junto ao\nAcordo Geral sobre Tarifas e Comércio (GATT), onde serviria até 1991. De\n1989 a 1991, ocupou os seguintes cargos eletivos: presidente e porta-voz\ndo Grupo Informal de Países em Desenvolvimento (1989-1991), presidente\ndo Comitê de Comércio e Desenvolvimento do GATT (1989), presidente do\nConselho dos Representantes (1990) e presidente das Partes Contratantes\ndaquele órgão. Teve de enfrentar as sanções ilegais adotadas pelo\ngoverno norte-americano contra importações brasileiras, sob o pretexto\nde que o Brasil não oferecia proteção de patentes a medicamentos\nestrangeiros, mostrando-se veemente crítico das práticas unilaterais e\nilegais dos Estados Unidos nesse caso e do protecionismo americano em\ngeral, assim como dos subsídios concedidos pela Comunidade Econômica\nEuropéia para estimular suas exportações agrícolas. Durante as\nnegociações da Rodada Uruguai de Negociações Comerciais, iniciadas em\n1987 e terminadas em 1993, foi um dos defensores da necessidade de\nconceder um tratamento especial mais favorável aos países em\ndesenvolvimento, corrigindo assim as numerosas assimetrias do sistema\nmundial de comércio em detrimento dos países mais pobres.\n\nParalelamente ao trabalho no GATT, Ricupero acumulou as funções de\nRepresentante do Brasil junto à Conferência de Desarmamento, junto à\nComissão de Direitos Humanos das Nações Unidas e em relação à\nOrganização Internacional do Trabalho (OIT), Organização Mundial de\nSaúde (OMS), Organização Mundial de Propriedade Intelectual (OMPI) e\ndemais agências especializadas das Nações Unidas com sede em Genebra. \n\nEm setembro de 1991, no governo de Fernando Collor de Melo (1990-1991),\nRicupero, então dono de grande prestígio dentro e fora do país, foi\nnomeado para o posto considerado o mais importante do serviço\ndiplomático brasileiro, o de embaixador nos Estados Unidos, em\nsubstituição a Marcílio Marques Moreira. Chegou a Washington no momento\nem que o fracasso do plano antiinflacionário da ex-ministra da Economia\nZélia Cardoso de Melo e as denúncias conducentes ao processo de\n*impeachment*do presidente Fernando Collor haviam debilitado,\nconsideravelmente, a posição oficial e a imagem pública do Brasil nos\nEstados Unidos. Dedicou-se, por conseguinte, a intenso trabalho de\ndiplomacia pública, a fim de combater a deterioração das expectativas\neconômicas e políticas em relação ao Brasil, realizando grande número de\nconferências e seminários em universidades, fundações de pesquisas,\nórgãos de imprensa.\n\nAo mesmo tempo, enfrentou alguns desafios junto ao governo de\nWashington, entre eles a renovação do acordo de tecnologia do Brasil com\nos Estados Unidos, cuja vigência estava para vencer em novembro de 1991.\nSegundo as autoridades americanas, a renovação do acordo estaria\ncondicionada à aprovação de legislação, pelo governo brasileiro,\nrelativa às patentes industriais, prevista no projeto do novo Código de\nPropriedade Industrial enviado pelo presidente Collor ao Congresso, no\nprimeiro semestre de 1991. A exigência norte-americana fora reiterada no\ninício do mês agosto do mesmo ano, durante encontro em Washington do\nvice-presidente Itamar Franco com o assessor especial do presidente\namericano George Bush para assuntos de ciência e tecnologia, Alan\nBromley.\n\nOutro desafio que exigiu imediata participação de Ricupero foi a questão\nda dívida externa, cujas negociações estavam em andamento com o Fundo\nMonetário Internacional (FMI) e os bancos credores. A preocupação de\nRicupero já aparecia no texto do discurso que apresentou na solenidade\nde entrega de credenciais ao governo americano, quando destacou a\nimperiosa necessidade de colaboração dos EUA no esforço do Brasil para\nsair da crise econômica, mediante o aumento de investimentos no país e o\napoio nas negociações referentes ao equacionamento da dívida externa. O\nproblema das barreiras americanas à transferência de alta tecnologia ao\nBrasil também ocupou sua pauta de prioridades, com vistas à superação\ndas restrições iniciais, inspiradas na resistência do Brasil em atender\nalgumas das exigências americanas para a cessão de tecnologia mais\nsofisticada, entre elas a adesão do país ao Tratado de Não-Proliferação\nNuclear.\n\nNo período em que permaneceu em Washington, foi chefe da delegação do\nBrasil ante a Comissão de Direitos Humanos das Nações Unidas e da\ndelegação do Brasil ante a Conferência de Desarme, e acumulou os cargos\nde representante governamental pelo Brasil no Banco Mundial, no FMI e no\nBanco Africano de Desenvolvimento. Foi chamado temporariamente ao Rio de\nJaneiro, a fim de atuar como presidente do Comitê de Finanças da\nConferência das Nações Unidas sobre o Meio Ambiente e Desenvolvimento,\nrealizada em meados de 1992. Deve-se a esse Comitê a redação e aprovação\ndo capítulo 33 da Agenda 21 da Conferência.\n\nPermaneceu na capital americana até setembro de 1993, sendo substituído\npelo diplomata Paulo Tarso Flecha de Lima, pois logo após o chamado\n“massacre dos Ianomâmis”, em Roraima, na fronteira com a Venezuela, o\npresidente Itamar Franco decidiu criar um ministério especial,\nconvidando-o a chefiá-lo em razão de sua anterior experiência no Tratado\nde Cooperação Amazônica. Assim, de volta ao Brasil, assumiu, no dia 16\ndaquele mês, o recém-criado Ministério Extraordinário da Articulação de\nAções da Amazônia Legal, a convite do presidente Itamar Franco\n(1992-1994), logo em seguida integrado ao Ministério do Meio Ambiente,\ncriado em outubro do ano anterior, tendo substituído o senador paraense\nFernando Coutinho Jorge. Na cerimônia de posse, defendeu a necessidade\nde uma política específica para a Amazônia, por meio da coordenação e\nharmonização de uma estratégia comum que aproveitasse as sinergias entre\nas iniciativas muitas vezes contraditórias e descoordenadas de vários\nórgãos federais e ministérios atuantes na área.\n\nEssa preocupação se manifestou na primeira reunião do Conselho Nacional\nda Amazônia Legal, órgão criado por decreto presidencial na mesma\nocasião da fusão dos dois ministérios. Realizada em dezembro de 1993, a\nreunião foi instalada pelo presidente Itamar Franco, que apresentou sua\nvisão da política federal para a Amazônia e o papel que o governo\nfederal poderia desempenhar na promoção do desenvolvimento sustentável\nda região. Para Ricupero, essa questão deveria estar permanentemente\nvinculada à idéia de justiça. Para poder sustentar-se, o desenvolvimento\ndeveria ser ambiental e socialmente viável. A construção do Brasil, e\nmais especificamente a da região amazônica, deveria estar orientada no\nsentido de que o “crescimento econômico contribua para multiplicar as\noportunidades, democratizando-as, e para harmonizar as relações\nsociais”. Segundo o ministro, esse seria o melhor caminho, “desde que as\nopções produtivas e tecnológicas tivessem sempre como parâmetro básico o\nimperativo da preservação ambiental”. Acentuou, de modo particular, a\ncentralidade de um esforço prioritário para desenvolver e ampliar o\nconhecimento científico sobre uma região onde é extremamente delicado o\nequilíbrio ecológico, sustentando que um dos principais problemas na\nregião é a ausência, até hoje, de uma tecnologia produtiva  adaptada às\ncondições amazônicas e capaz, não só de permitir atividades econômicas\nrentáveis, mas a sustentabilidade ecológica e a saúde pública da\npopulação amazônica.\n\nEm relação à mineração e ao garimpo, o ministro propôs a aprovação de\nlegislação moderna que permitisse uma ação integrada, envolvendo\ndiversos ministérios, pois a legislação vigente carecia da votação de\nlei complementar que regulamentasse as reservas de garimpagem, criadas\npela Constituição de 1988. Outro ponto destacado pelo ministro foi o da\nproteção territorial, defendendo a presença das forças armadas na\nregião, sem tombar no exagerado temor de supostas ameaças estrangeiras,\numa vez que os maiores estragos realizados contra a floresta sempre\nprovieram de grileiros, latifundiários, garimpeiros, madeireiros\nilegais, em sua esmagadora maioria brasileiros.\n\nAlém das tentativas de equacionamento dessas dificuldades, Ricupero\nenfrentou também o problema da escassez de recursos. Para viabilizar os\nprojetos de sua pasta, viajou, em outubro de 1993, a Washington e a\nGenebra, onde discutiu propostas para a área ambiental e,\nprincipalmente, negociou a liberação de recursos para o país. Em\nWashington, conseguiu a prorrogação do prazo de desembolso de 117\nmilhões de dólares do Banco Mundial ao governo brasileiro, relativo ao\nPrograma Nacional do Meio Ambiente, que estava prestes a ser cancelado.\n\nEm 5 de abril de 1994, apenas sete meses depois de assumir o Ministério\ndo Meio Ambiente e da Amazônia Legal, Ricupero foi substituído por\nHenrique Brandão Cavalcanti, passando a ocupar o cargo de ministro da\nFazenda no lugar de Fernando Henrique Cardoso, que deixara o ministério\npara se candidatar à presidência da República.\n\nÀ frente da nova pasta, deu continuidade à implantação do Plano Real,\nprograma de estabilização da economia brasileira posto em prática, de\nforma gradativa, no último ano do governo Itamar Franco. Anunciado em 28\nde fevereiro de 1994 por Fernando Henrique, o plano consistiu,\ninicialmente, na introdução da Unidade Referencial de Valor (URV) como\npadrão de transição dos preços para a nova moeda, o real, que passou a\nvigorar em 1º de julho seguinte, em substituição ao cruzeiro real.\n\nAntes mesmo de iniciar sua gestão na Fazenda, Ricupero redigiu artigos\nsobre assuntos relacionados ao plano de estabilização que constituíram\num bom resumo do que pensava em matéria econômica. Para Ricupero, o\npapel do governo Itamar Franco era, principalmente, preparar terreno\npara que seu sucessor concluísse a estabilização econômica e retomasse\nos necessários investimentos no país. Em artigo, intitulado “Cidadania e\ninflação”, reforçava sua tese: “Embora não exclua outras ações de\nsentido social, nada poderá trazer benefícios mais rápidos ao conjunto\nda população, inclusive aos mais carentes, do que a estabilidade da\neconomia.” Buscou sempre deixar claro que a estabilidade era apenas “o\ninício do começo”, isto é, que a estabilidade era a condição da\npossibilidade de edificar sociedade justa e próspera no Brasil, não\ndevendo ser confundida com esse trabalho de construção. Em outra imagem\nque utilizou com freqüência, afirmava que a estabilidade era como o\n“pedestal de um monumento”. Este último, um projeto nacional de solução\naos atrasos e desequilíbrios brasileiros, deveria repousar sobre a\nestabilidade, mas ia muito além dela.\n\nAfinado com a equipe de Fernando Henrique Cardoso, o novo ministro\nconsiderava o plano a melhor alternativa de combate à inflação, embora\ndefendesse um “movimento nacional para a estabilização da economia” que\ngarantisse o apoio político necessário ao plano. Para isso, atribuiu ao\nfornecimento de informação abundante, clara e objetiva à opinião pública\nimportância pelo menos igual, senão superior, às qualidades técnicas\nintrínsecas do Plano Real. Como a hiperinflação era um imposto\ndevastador que atingia, sobretudo, os mais pobres e vulneráveis, aqueles\nque não podiam se defender por meio do “overnight” ou de remessas para o\nexterior, era indispensável que essa maioria da população considerasse a\nestabilidade como sua própria causa. Nesse sentido, o então ministro\nrecorreu ao uso, a cada dez dias, de rede nacional de TV para esclarecer\nas pessoas a respeito da cada etapa do plano, proporcionando conselhos\npráticos relativos à nova moeda, à volta do valor para as moedas de\nmetal, como seria feita a troca de dinheiro velho pelo novo, os prazos,\na prudência em relação a juros demasiado altos ou antecipação de compras\netc.\n\nO momento decisivo do Plano Real ocorreu com a introdução do novo padrão\nmonetário nos dias 1º, 2 e 3 de julho de 1994. Em todo o território\nnacional a troca de moedas se deu sem incidentes nem problemas. O Real\nfoi o primeiro dos inúmeros planos brasileiros contra a inflação que não\nfoi acompanhado por pacotes guardados em segredo até a última hora: tudo\nfoi anunciado e explicado de antemão. Tampouco teve congelamento de\npreços, confisco de poupança ou outras medidas de choque. Embora tivesse\nde defrontar-se com apreciável ceticismo quanto à possibilidade de\nrestaurar um mínimo de estabilidade de preços em país que há décadas\nsomente conhecia a inflação acelerada com indexação, o Real teve êxito\nem conquistar o apoio da população e se tornou a experiência de maior\nêxito de todos os planos de estabilização do Brasil moderno.   \n\nAo assumir o Ministério da Fazenda, Ricupero tinha fixado três\nprioridades imediatas para sua gestão, além da batalha principal pela\nestabilização de preços: a aprovação da medida provisória que criou a\nURV; a aprovação do Orçamento de 1994 pelo Congresso Nacional; e a\nconclusão da revisão constitucional nos itens ligados ao saneamento das\ncontas públicas, como a reforma tributária, o capítulo sobre a\nprevidência e a flexibilização dos monopólios.\n\nRicupero teve que lidar com desafios perigosos, entre os quais a\ncontenção da alta de preços que em março de 1994 chegara a ultrapassar a\ntaxa de 45%, a manutenção do ajuste fiscal, contendo os gastos e\ncontornando as reivindicações por mais verbas feitas pelos ministérios e\npelos movimentos de reivindicação de aumentos de funcionários militares\ne civis, a conversão das tarifas e dos contratos públicos para a URV, a\ngarantia da não-desvalorização da nova moeda (lastro do real) e o\nequacionamento da dívida externa, por meio de acordos com os credores\nprivados e o FMI.\n\nNo dia 3 de setembro de 1994, enquanto aguardava a gravação de uma\nentrevista para o *Jornal da Globo*, nos estúdios da rede Globo, em\nBrasília, Ricupero e o jornalista Carlos Monforte tiveram conversa\ninformal por cerca de meia hora, na qual Ricupero emitiu opiniões\npessoais sobre economia, índice inflacionário e campanha eleitoral. Na\nocasião, proferiu a frase: “O que é ruim a gente esconde, o que é bom a\ngente mostra.” A conversa acabou indo ao ar via antenas parabólicas e\nteve grande repercussão na mídia, culminando com o pedido de demissão do\nministro no dia seguinte. Para substituí-lo no Ministério da Fazenda foi\nindicado Ciro Gomes.\n\nEm novembro de 1994, depois de sua saída da pasta da Fazenda, a Comissão\nde Relações Exteriores do Senado aprovou, por unanimidade, a indicação\nde Ricupero para embaixador do Brasil na Itália. Em março de 1995, após\nseu nome ter sido aprovado pelo plenário do Senado, assumiu a embaixada\nbrasileira em Roma. Em setembro do mesmo ano, tornou-se secretário-geral\nda UNCTAD (Conferência das Nações Unidas sobre o Comércio e o\nDesenvolvimento), com sede em Genebra, a convite do então\nSecretário-Geral da ONU, Boutros Galli e depois de sua aprovação pela\nAssembléia Geral das Nações Unidas. Fundada em 1964, em grande parte\ndevido à ação do economista latino-americano Raul Prebisch, a UNCTAD\ntornou-se, entre todas as organizações econômicas multilaterais, a única\ntotalmente comprometida com a perspectiva dos países em desenvolvimento\ne o ponto focal, no sistema da ONU, para a ajuda aos “pobres dentre os\npobres”, os chamados LDCs em inglês (Least Developed Countries ou Países\nde Menor Desenvolvimento Relativo), 49 países de pobreza extrema, dos\nquais 33 africanos.\n\nAo retornar a Genebra em setembro de 1995, o novo secretário-geral\nencontrou a UNCTAD sob forte assédio e campanha de desprestígio\nconduzida pelos Estados Unidos e os países mais ricos. Encorajados pelo\nfim do socialismo e consequente enfraquecimento da resistência à\nliderança inconteste norte-americana, esses países alegavam que a\nglobalização triunfante e a criação da Organização Mundial de Comércio\n(OMC), em 1994, tornavam a existência da UNCTAD totalmente\ndesnecessária. O desafio central de Ricupero foi deter tal ofensiva,\nmostrando que era mais urgente do que nunca dispor de uma organização\nque garantisse voz e presença aos membros mais frágeis da comunidade\ninternacional. Para isso, a UNCTAD teve de ser “reinventada”,\nconquistando alto prestígio acadêmico pelas análises que conduziu dos\ndesequilíbrios e assimetrias do sistema econômico internacional, em\nespecial da série de Relatórios sobre Comércio e Desenvolvimento, que\nanteciparam como a década de 1990 seria caracterizada pela frequência,\nintensidade e poder destrutivo das crises monetárias e financeiras. A\ninstituição demonstrou igualmente como o sistema mundial de comércio\nestava fortemente enviesado contra os interesses dos mais fracos,\nproibindo, por exemplo, os incentivos à indústria, do interesse das\neconomias em vias de incipiente industrialização, mas considerando\nlegais os gigantescos subsídios à produção agrícola utilizados pelas\neconomias ricas da Europa, EUA e Japão.\n\nA UNCTAD contribuiu de forma acentuada para elevar o nível de\nconscientização acerca das distorções e excessos da economia\nglobalizada. Alertou para a conveniência de que a liberalização\ncomercial se fizesse de modo gradual, sem por em risco a\nindustrialização, processo indispensável para sair do\nsubdesenvolvimento. Advertiu quanto aos perigos de uma prematura e\nexagerada liberalização financeira, alerta que, infelizmente, não\nsensibilizou os países ricos promotores dessa liberalização, com\nresultados perniciosos para os países que acabaram vítimas das graves\ncrises que se seguiram, culminando com a de 2008. Essa mais recente\ncrise, a pior dos últimos 70 anos, confirmou em larga medida os\nvaticínios e análises da UNCTAD, abrindo caminho a uma abordagem mais\nequilibrada dos problemas econômicos e desmoralizando o “fundamentalismo\nde mercado” combatido pela Organização. \n\n Em setembro de 2004, após a grande conferência mundial da UNCTAD,\nrealizada em São Paulo em junho daquele ano, Ricupero se aposentou da\nONU. No ano seguinte retornou ao Brasil, onde se tornou diretor da\nFaculdade de Economia e Relações Internacionais da Fundação Armando\nÁlvares Penteado (FAAP), em São Paulo. Dedica-se hoje às atividades\nacadêmicas e intelectuais, mediante a preparação de estudos, escritos,\ncolaboração na imprensa, participação em seminários e conferências, em\nconselhos de entidades ambientais, culturais e artísticas, como a\nFundação Brasileira de Desenvolvimento Sustentável, no Rio de Janeiro, a\nBienal de São Paulo, o Museu Afro Brasil e o Instituto Fernand Braudel\nde Economia Mundial, de São Paulo, do qual se tornou presidente. \n\nCasou-se com Marisa Parolari Ricupero, com quem teve quatro filhos\n\nPublicou *Visões do Brasil* (1995), *José Maria da Silva Paranhos, barão\ndo Rio Branco — uma biografia fotográfica (1845-1995)* (1995, reeditado\ne ampliado em 2005), *O ponto ótimo da crise* (1998), *Rio Branco: o\nBrasil no mundo*(2000);*O Brasil e o dilema da\nglobalização*(2001);*Esperança e Ação (*2002);*Folha explica a\nALCA*(2003),*O problema da abertura dos portos*(2008), além de textos e\nartigos sobre relações internacionais, problemas do desenvolvimento\neconômico, comércio internacional e história da diplomacia, publicados\nem coletâneas e revistas especializadas.\n\nSusana Delgado/Gloria Moraes\n\nFONTES: *Estado de S. Paulo* (15/9/93); *Folha de S. Paulo*(30/9 e\n16/10/93); *Globo* (26/11/93, 8/2, 28 e 30/3 e 6/4/94); *Jornal do\nBrasil* (29/8/91, 20/12/93, 22/1, 13/4 e 24/11/94, 6/9/97); MIN. REL.\nEXT. *Anuário do pessoal*; ONU. *International Computing Centre.*\nInternet; *Veja* (6/4 e 7/9/94).\n\n \n","ref":"FONTES: *Estado de S. Paulo* (15/9/93); *Folha de S. Paulo*(30/9 e\n16/10/93); *Globo* (26/11/93, 8/2, 28 e 30/3 e 6/4/94); *Jornal do\nBrasil* (29/8/91, 20/12/93, 22/1, 13/4 e 24/11/94, 6/9/97); MIN. REL.\nEXT. *Anuário do pessoal*; ONU. *International Computing Centre.*\nInternet; *Veja* (6/4 e 7/9/94).\n\n \n","dic":"DHBB"}
