{"title":"RIOS, José","cargoss":["Deputado federal","Deputado federal","Deputado federal","Deputado federal","Deputado federal"],"cargos_esp":[0,0,0,0,0],"datas_ini":[1965,1963,1962,1960,1959],"datas_fim":[1965,1964,0,0,0],"estados":["MA","MA","MA","MA","MA"],"autor":[0],"content":"**RIOS, José**\n\n\\*dep. fed. MA 1959, 1960, 1962, 1963-1964 e 1965.\n\n*José Damião de Sousa Rios*****nasceu em São Luís no dia 7 de maio de\n1922.\n\nIniciou seus estudos no Liceu Maranhense e, transferindo-se para o Rio\nde Janeiro, então Distrito Federal, concluiu o curso secundário nos\ncolégios Pedro II e Santo Inácio. Ingressou no curso de ciências\njurídicas e sociais da Pontifícia Universidade Católica (PUC),\nbacharelando-se pela Faculdade de Direito da Universidade do Rio de\nJaneiro. Em seguida realizou cursos de extensão universitária sobre\ndireito rodoviário e sobre finanças e orçamento, esse último na Escola\nBrasileira de Administração Pública da Fundação Getulio Vargas.\n\nFoi procurador do Departamento Nacional de Estradas de Rodagem e, de\nvolta a seu estado, tornou-se chefe de carteira do Banco do Estado do\nMaranhão.\n\nEm outubro de 1958 candidatou-se a deputado federal pelo Maranhão na\nlegenda do Partido Social Democrático (PSD), obtendo uma suplência.\nOcupou uma cadeira na Câmara de maio a dezembro de 1959, de julho a\noutubro de 1960 e novamente de fevereiro a agosto de 1962. No exercício\nde seu mandato aceitou o reatamento, efetivado em novembro de 1961, das\nrelações comerciais e diplomáticas com a União Soviética, rompidas desde\n1947, e foi a favor dos princípios de autodeterminação e\nnão-intervenção. No pleito de outubro de 1962, mais uma vez candidato na\nlegenda do PSD, alcançou nova suplência, ocupando uma cadeira a partir\nde maio de 1963. Durante sua permanência na Câmara participou\nprincipalmente de órgãos técnicos e foi favorável ao intervencionismo\neconômico e ao monopólio estatal nos ramos básicos da economia. Apoiou\nainda a reforma agrária cooperativista, com desapropriação dos\nlatifúndios improdutivos e assistência do Estado ao homem do campo, e as\nreformas eleitoral, bancária, administrativa e tributária. Deixou a\nCâmara em junho de 1964, já após o movimento político-militar de março\ndesse ano, e voltou a ocupar uma cadeira de setembro a outubro de 1965.\n\nFONTES: CÂM. DEP. *Deputados;*CAMPOS, Q. Fichário;****TRIB. SUP. ELEIT.\n*Dados*(4 e 6).\n\n \n","ref":"FONTES: CÂM. DEP. *Deputados;*CAMPOS, Q. Fichário;****TRIB. SUP. ELEIT.\n*Dados*(4 e 6).\n\n \n","dic":"DHBB"}
