{"title":"BALTAR, Antônio ===============","cargoss":["Senador"],"cargos_esp":[0],"datas_ini":[1960],"datas_fim":[1961],"estados":["PE"],"autor":[0],"content":"BALTAR, Antônio\n===============\n\n\\*  sen. PE 1960-1961.\n\n \n\n*Antônio Bezerra Baltar*nasceu em Recife no dia 16 de agosto de 1915,\nfilho de Abelardo Ferreira Baltar e de Otília de Andra­de Bezerra\nBaltar.\n\nEstudou no Colégio Nóbrega, ingressando depois na Escola de Engenharia\nda Universi­dade do Recife, pela qual se formou em 1938.\n\nEngenheiro do Instituto de Previdência dos Servidores do Estado de\nPernambuco de 1939 a 1943, da Associação Brasileira de Cimento Portland\ne do Departamento Nacio­nal de Estradas de Rodagem, lecionou no curso de\narquitetura da Escola da Belas-Artes de Pernambuco e na Escola de\nEngenharia onde estudara.  Tornou-se depois professor catedrático dos\ndois estabelecimentos.\n\nNo pleito de outubro de 1958, elegeu-se suplente do senador Antônio de\nBarros Carva­lho na legenda das Oposições Coligadas Uni­das de\nPernambuco, coligação composta pelo Partido Trabalhista Brasileiro\n(PTB), a União Democrática Nacional (UDN), o Partido So­cial\nProgressista (PSP), o Partido Trabalhista Nacional (PTN) e o Partido\nSocialista Brasilei­ro (PSB).  Convocado, exerceu o mandato de 20 de\njunho de 1960 a 1º. de fevereiro de 1961, período em que Barros Carvalho\nocu­pou a pasta da Agricultura, no final do governo de Juscelino\nKubitschek.\n\nDeixando o Senado, retornou ao magistério superior em Pernambuco até ser\naposentado pelo Ato Institucional n º1, baixado em 9 de abril de 1964,\npelo regime militar recém-instalado e que afastara do poder o presidente\nJoão Goulart (1961-1964). Em 1965, atendendo a convite de técnicos da\nComissão Econômica para a América Latina (Cepal), transferiu-se para\nSantiago do Chile, sede da entidade. Aí permaneceu até 1977, quando se\naposentou. Nesse mesmo ano, fixou residência no Canadá, onde ficou até\n1981. De volta ao Brasil ainda em 1981 - já beneficiado pela lei da\nanistia decretada pelo presidente da República, general João Batista\nFigjueiredo, em agosto de 1979 -, foi reintegrado aos quadros da\nUniversidade Federal de Pernambuco (UFPe), onde lecionou até 1983. Neste\nano, aposentou-se por idade.\n\nNo final da década de 1990, foi eleito professor emérito da UFPE pelo\nConselho Técnico-Administrativo da instituição.\n\nFoi casado com Maria Isaura de Andrade Lima Baltar, já falecida, com\nquem teve sete filhos.\n\nAlém de discursos, conferências, teses e relatórios, publicou inúmeras\nobras sobre ar­quitetura, urbanismo e engenharia.\n\n \n\nFONTES: COUTINHO, A. *Brasil;*SENADO. *Dados; SENADO.  Relação;*SOC. \nBRAS. EXPANSÃO COMERCIAL.  *Quem;*TRIB. SUP. ELEIT. *Dados (4).*\n\n \n\n \n","ref":"FONTES: COUTINHO, A. *Brasil;*SENADO. *Dados; SENADO.  Relação;*SOC. \nBRAS. EXPANSÃO COMERCIAL.  *Quem;*TRIB. SUP. ELEIT. *Dados (4).*\n\n \n\n \n","dic":"DHBB"}
