{"title":"ROCHA, Nunes","cargoss":["Deputado federal"],"cargos_esp":[0],"datas_ini":[1975],"datas_fim":[1979],"estados":["MT"],"autor":[0],"content":"**ROCHA, Nunes**\n\n\\*dep. fed.  MT 1975-1979.\n\n \n\n*Joaquim Nunes Rocha*nasceu em Tocanti­nópolis (TO), então no estado de\nGoiás, no dia 7 de junho de 1916, filho de Francisco Ferreira Nunes e de\nMaria André da Rocha.\n\nRadicando-se no estado de Mato Grosso, em 1947 foi vereador em Poxoréu e\nno ano se­guinte tornou-se presidente da União Demo­crática Nacional\n(UDN) nessa cidade. Farmacêutico e pecuarista, foi prefeito de Poxoréu\nentre 1951 e 1954.\n\nEm outubro de 1962 candida­tou-se a deputado estadual em Mato Grosso na\nlegenda da UDN, obtendo uma suplência. Assumiu uma cadeira na Assembléia\nLegislativa em 1964. Após o movimento político-militar de 31 de março\ndesse ano, com a extinção dos partidos políticos pelo Ato Institucional\nnº. 2 em outubro de 1965 e a posterior instauração do bipartidarismo,\nfiliou-se à Aliança Renovadora Nacional (Arena), partido gover­nista.\nNessa legenda elegeu-se deputado estadual em novembro de 1966.\n\nEm 1969 bacharelou-se em ciências jurí­dicas e sociais pela Faculdade de\nDireito da Universidade Federal de Mato Grosso. Foi reeleito em novembro\nde 1970, e atuou como líder da Arena na Assembléia em 1971 e 1972.  Em\nnovembro de 1974 foi eleito deputado federal, assumindo o mandato em\nfevereiro de 1975. Nessa legisla­tura foi membro da Comissão de Finanças\nda Câmara. Em novembro de 1978 candidatou-se ao Senado, mas não\nconseguiu  eleger-se. Deixou a Câmara dos Deputados ao final da\nlegislatura, em janeiro de 1979.\n\nCom o fim do bipartidarismo em novembro de 1979 e a conseqüente\nreorganização partidária, filiou-se ao Partido Trabalhista Brasileiro\n(PTB). Radicando-se em Brasília, tornou-se procurador-geral da\nSuperintendência de Desenvolvimento do Centro-Oeste, cargo que  ocupou\naté 1985, quando retornou a seu estado e passou a prestar assessoria\njurídica gratuita para a população.\n\nEm novembro de 1988, disputou o cargo de prefeito de Poxoréu  mas não\nfoi eleito. Em 1990, concorreu a uma vaga na Assembléia Legislativa, sem\nsucesso.\n\nDedicou-se então à advocacia e em 1999 tornou-se presidente do diretório\ndo PTB em Poxoréu.  Desempenhou ainda a função de promotor de justiça.\n\nCasou-se com Irantina Ribeiro Rocha, com quem teve sete filhos. Um\ndeles, Louremberg Nunes Rocha, foi deputado federal por Mato Grosso\nentre 1979 e 1983 e senador entre 1987 e 1995.\n\n \n\nFONTES: CÂM. DEP. *Deputados;*CÂM. DEP. *Deputados brasileiros. \nRepertório*(1975-1979); INF. BIOG.;  NÉRI, S. *16; Súmulas;*TRIB. SUP.\nELEIT. *Dados* (6, 8 e 9).\n\n \n","ref":"FONTES: CÂM. DEP. *Deputados;*CÂM. DEP. *Deputados brasileiros. \nRepertório*(1975-1979); INF. BIOG.;  NÉRI, S. *16; Súmulas;*TRIB. SUP.\nELEIT. *Dados* (6, 8 e 9).\n\n \n","dic":"DHBB"}
