{"title":"RODRIGUES, Afrânio","cargoss":["Deputado federal"],"cargos_esp":[0],"datas_ini":[1961],"datas_fim":[1963],"estados":["MG"],"autor":[0],"content":"**RODRIGUES, Afrânio**\n\n\\*dep. fed. MG 1961-1963.\n\n*Afrânio Rodrigues da Cunha* nasceu em Araguari (MG) no dia 13 de maio\nde 1907, filho de Eduardo Rodrigues da Cunha e de Amália Ambrosina de\nOliveira.\n\nTrabalhou como gerente das Casas Pernambucanas e posteriormente abriu\numa firma comercial em Araguari. Durante a Revolução de 1930, ajudou na\narticulação das forças do movimento da região do Triângulo Mineiro com\nas dos estados de São Paulo e Goiás. Em outubro de 1954, elegeu-se\nprefeito de Uberlândia (MG). Empossado no início do ano seguinte, teve\ncomo principais ações de seu governo o saneamento financeiro da Santa\nCasa de Misericórdia e a localização no município do 15º Distrito\nFlorestal e de uma Companhia do 12º Regimento de Infantaria.\n\nNo pleito de outubro de 1958, obteve a quarta suplência de deputado\nfederal pela legenda do Partido Social Democrático (PSD) mineiro,\nassumindo uma cadeira na Câmara em 27 de fevereiro de 1961. Novamente\ncandidato nas eleições de outubro de 1962, obteve desta vez a sétima\nsuplência. Deixando a Câmara em janeiro de 1963, a ela não retornou na\nlegislatura de 1963-1967.\n\nCasou-se com Dorama Agel da Cunha.\n\nFONTES: CÂM. DEP. *Deputados*; CÂM. DEP. *Deputados brasileiros.\nRepertório* (1946-1967); CÂM*.*DEP. *Súmulas*; *Rev. Arq. Públ. Mineiro*\n(12/76); TRIB. SUP. ELEIT. *Dados* (6).\n\n \n","ref":"FONTES: CÂM. DEP. *Deputados*; CÂM. DEP. *Deputados brasileiros.\nRepertório* (1946-1967); CÂM*.*DEP. *Súmulas*; *Rev. Arq. Públ. Mineiro*\n(12/76); TRIB. SUP. ELEIT. *Dados* (6).\n\n \n","dic":"DHBB"}
