{"title":"RODRIGUES, Ari","cargoss":["Deputado federal"],"cargos_esp":[0],"datas_ini":[1967],"datas_fim":[1971],"estados":["AC"],"autor":[0],"content":"**RODRIGUES, Ari**\n\n\\*dep. fed. AC 1967-1971.\n\n*Ari Rodrigues*nasceu em Vacaria (RS) no dia 4 de agosto de 1922, filho\nde Alfredo Schereschewsky e de Alaíde Rodrigues Schereschewsky.\n\nIngressou na política filiando-se ao Movimento Democrático Brasileiro\n(MDB), partido de oposição ao regime militar instaurado no país após a\nvitória do movimento político-militar de 31 de março de 1964 que depôs o\npresidente João Goulart (1961-1964), em cuja legenda concorreu a uma\ncadeira de deputado federal pelo Acre no pleito de novembro de 1966, mas\nsó obteve a segunda suplência. Assumindo o mandato em 1967, permaneceu\nna Câmara dos Deputados até o final de janeiro de 1971, quando se\nencerraram o seu mandato e a legislatura.\n\nFONTES: CÂM. DEP. *Deputados brasileiros.* *Repertório*(1967-1971); CÂM.\nDEP. *Deputados federais. Inventário;*TRIB. SUP. ELEIT. *Dados* (8).\n\n \n","ref":"FONTES: CÂM. DEP. *Deputados brasileiros.* *Repertório*(1967-1971); CÂM.\nDEP. *Deputados federais. Inventário;*TRIB. SUP. ELEIT. *Dados* (8).\n\n \n","dic":"DHBB"}
