{"title":"RODRIGUES, Filemon","cargoss":["Deputado federal","Deputado federal","Deputado federal"],"cargos_esp":[0,0,0],"datas_ini":[1995,1994,2003],"datas_fim":[2003,1995,2007],"estados":["MG","MG","PB"],"autor":[0],"content":"**RODRIGUES, Filemon**\n\n\\*dep. fed. MG 1994-1995, 1995-2003; dep. fed. PB 2003-2007.\n\n*Filemon Rodrigues da Silva* nasceu em Mamanguape (PB), no dia 19 de\njunho de 1942, filho de Antônio Maximino Rodrigues e de Rosa Maria da\nConceição.\n\nDe formação evangélica, atuou como missionário na Bolívia, entre 1964 e\n1969, e na Espanha, de 1970 a 1975. Em 1974, formou-se como teólogo no\nInstituto Ebenezer, no Rio de Janeiro. Como instrutor evangélico,\nparticipou de diversos seminários realizados nos Estados Unidos, na\nSuécia, em Portugal e no Peru.\n\nIniciou carreira política em 1982, filiando-se ao Partido do Movimento\nDemocrático Brasileiro (PMDB), e depois de quatro anos, ao Partido\nTrabalhista Brasileiro (PTB). Em 1986, exerceu o cargo de diretor\nadministrativo da Secretaria de Educação de Minas Gerais, na gestão do\ngovernador Hélio Garcia (1984-1987).\n\nEm 1988, nomeado secretário-adjunto de Educação pelo governador Newton\nCardoso (1987-1991), durante um ano acumulou a função com a de\nsuperintendente de Planejamento e Orçamento da Secretaria de Educação.\nEm 1990, desligou-se do governo estadual para candidatar-se a uma\ncadeira de deputado federal na legenda do PTB, obtendo uma suplência. De\nvolta ao serviço público, assumiu a direção administrativa e financeira\ndo Centro Tecnológico de Minas Gerais (Cetec).\n\nIngressou na Câmara em agosto de 1994, pouco antes do fim da legislatura\n1991-1995, em substituição a José Ulisses de Oliveira, que se licenciara\npara integrar o secretariado do segundo governo de Hélio Garcia\n(1991-1995).\n\nEleito para a Câmara Federal pelo PTB de Minas Gerais em outubro de\n1994, e empossado em fevereiro do ano seguinte, Filemon Rodrigues\nparticipou das atividades parlamentares como titular das comissões de\nOrçamento e de Viação e Transportes. Ao longo da legislatura votou a\nfavor da abolição do monopólio nos setores de telecomunicações,\ndistribuição de gás canalizado e navegação de cabotagem. Também apoiou a\nprorrogação do Fundo Social de Emergência (FSE), rebatizado de Fundo de\nEstabilização Fiscal (FEF), que permitia ao governo gastar até 20% dos\nrecursos vinculados às áreas de saúde e de educação. Na sessão que\naprovou a extinção do conceito de empresa nacional absteve-se. E foi\ncontra à extinção do controle do estado na exploração do petróleo.\n\nEm maio de 1996, em meio às discussões sobre a reforma da Previdência,\napresentou emenda a uma medida provisória do governo federal prevendo o\nrepasse de cerca de novecentos milhões de reais do Banco do Brasil para\na Construtora Mendes Júnior, justificando sua iniciativa pelo fato de o\nbanco ter sido avalista de uma negociação entre a empresa e o governo do\nIraque durante a Guerra do Golfo, em 1991. Estabelecido o acordo, as\nmáquinas da construtora serviram como garantia de pagamento do petróleo\nimportado pelo país na época.\n\nEm julho, foi a favor da criação da Contribuição Provisória sobre\nMovimentação Financeira (CPMF), fonte suplementar de recursos destinados\nà saúde.\n\nEm 1997, votou a favor da emenda constitucional que autorizou a\nreeleição do presidente da República, dos governadores e dos prefeitos e\ncontra a que pôs fim à estabilidade dos funcionários públicos.\n\nReeleito em outubro de 1998, sempre pela legenda do PTB, votou no\nprimeiro turno, a favor, e no segundo, contra à fixação do teto de 1.200\nreais para a aposentadoria dos servidores públicos, e estabeleceu idade\ne tempo de contribuição para os trabalhadores do setor privado.\n\nIniciou novo mandato na Câmara dos Deputados em fevereiro de 1999. Nesse\nmesmo ano retornou ao PMDB, permanecendo neste partido até 2000, ano em\nque se filiou ao Partido Liberal (PL). Ainda em 2000, votou a favor da\ncriação da Lei de Responsabilidade Fiscal e em 2002 também se pronunciou\na favor da prorrogação da CPMF até 2004.\n\nMudou seu domicílio eleitoral para João Pessoa e no pleito de 2002 foi\neleito deputado federal pelo estado da Paraíba na legenda do PL. Assumiu\nseu mandato em fevereiro de 2003 e ainda nesse ano voltou para o PTB,\nintegrando a bancada de sustentação do governo de Luís Inácio Lula da\nSilva (2003- ). Nessa condição, votou a favor da reforma da Previdência\ne da reforma tributária.\n\nDe 2004 a 2006 presidiu a Comissão de Viação e Transportes.\n\nCasado com Celeida Miranda Rodrigues da Silva, teve quatro filhos.\n\nFONTES: CÂM. DEP. *Deputados brasileiros. Repertório*(1995-1999,\n1999-2003 e 2003-2007); *Estado de S. Paulo* (16/5/96); *Folha de S.\nPaulo* (14/1/96, 30/1/97, 5/2 e 6/11/98).\n","ref":"FONTES: CÂM. DEP. *Deputados brasileiros. Repertório*(1995-1999,\n1999-2003 e 2003-2007); *Estado de S. Paulo* (16/5/96); *Folha de S.\nPaulo* (14/1/96, 30/1/97, 5/2 e 6/11/98).\n","dic":"DHBB"}
