{"title":"ROLIM, Francisco","cargoss":["Deputado federal"],"cargos_esp":[0],"datas_ini":[1989],"datas_fim":[1991],"estados":["PB"],"autor":[0],"content":"**ROLIM, Francisco**\n\n\\*dep. fed. PB 1989-1991.\n\n* *\n\n*Francisco Matias Rolim* nasceu em Umari (CE) no dia 6 de dezembro de\n1922, filho de Matias Duarte Passos e de Angelina Duarte Rolim.\n\nEm 1932, junto com a família, transferiu-se para Cajazeiras (PB).\nFreqüentou a escola até o segundo grau, dedicando-se ao comércio, à\nindústria e à agropecuária.\n\nIngressou na política em 1950, filiando-se ao Partido Social Democrático\n(PSD), em cuja legenda foi eleito vereador em Cajazeiras em outubro de\n1958. Em 1960 tornou-se presidente da Câmara Municipal, cargo que ocupou\naté o final da legislatura. Em outubro de 1962 reelegeu-se vereador na\nmesma legenda. Iniciou novo mandato em janeiro de 1963 e nesse mesmo ano\ndesligou-se do PSD, filiando-se à União Democrática Nacional (UDN), em\ncuja legenda elegeu-se prefeito de Cajazeiras em 11 de agosto seguinte.\nRenunciando ao mandato de vereador, assumiu a prefeitura no dia 30 de\nnovembro, em substituição a Otacílio Jurema. Como prefeito melhorou os\nserviços de telefonia e construiu escolas.\n\nCom a extinção dos partidos políticos pelo Ato Institucional nº 2\n(27/10/1965) e a posterior instauração do bipartidarismo, filiou-se, em\n1967, à Aliança Renovadora Nacional (Arena), partido de sustentação do\nregime militar instituído no país após a vitória do movimento\npolítico-militar de 31 de março de 1964, que depôs o presidente João\nGoulart (1961-1964). O novo governo unificou as datas das eleições\nmunicipais e, com isso, Chico Rolim, como ficou conhecido, teve o seu\nmandato prorrogado por 14 meses. Ele ficou na prefeitura até 31 de\njaneiro de 1969, quando passou o cargo a Epitácio Leite Rolim e\nafastou-se da política. No mês seguinte, vendeu algumas de suas\npropriedades em Cajazeiras e transferiu-se com toda a família para São\nLuís do Maranhão, onde expandiu sua atividade comercial. Manteve, porém,\nseu domicílio eleitoral naquela cidade paraibana. Em 1972, após\ndissuadir as lideranças políticas de Cajazeiras da tentativa de lançá-lo\ncandidato a prefeito nas eleições daquele ano, Chico Rolim participou\nativamente das articulações para a candidatura de Antônio Quirino,\nex-diretor do colégio estadual, que acabou se elegendo.\n\n Convencido pelas lideranças políticas locais e, principalmente, pela\ninterferência do governador Ivan Bichara (1975-1978), retornou à\nParaíba, embora mantendo negócios no Maranhão, e voltou a disputar a\nprefeitura de Cajazeiras, elegendo-se, em novembro de 1976, na legenda\nda Arena. Com a extinção do bipartidarismo em novembro de 1979 e a\nconseqüente reorganização partidária, filiou-se, em 1980, ao Partido\nDemocrático Social (PDS), sucessor da Arena no apoio ao governo. Durante\nesse segundo mandato de prefeito, investiu nos serviços de saneamento\nbásico, na saúde e na educação. Para enfrentar os efeitos da seca e\ncontando com recursos mínimos dos interessados e máquinas da prefeitura,\nconstruiu cerca de 89 açudes para os produtores.\n\nCom a suspensão das eleições de novembro desse ano para que houvesse\ncoincidência de todos os mandatos do país, e a conseqüente prorrogação\nde todos os mandatos municipais que se encontravam em vigor, permaneceu\nà frente da prefeitura até janeiro de 1983, quando findou o seu mandato\ne passou o poder, pela segunda vez, a Epitácio Leite Rolim. Em 1986,\ndesligando-se do PDS e filiando-se ao Partido do Movimento Democrático\nBrasileiro (PMDB), concorreu a uma cadeira de deputado federal\nconstituinte pela Paraíba, obtendo, contudo, apenas uma suplência.\n\nEm 1988 desligou-se do PMDB e ingressou no Partido Socialista Brasileiro\n(PSB). Em dezembro, o deputado federal Cássio Cunha Lima, que em\nnovembro se elegera prefeito de Campina Grande (PB), renunciou ao\nmandato, e Francisco Rolim assumiu sua vaga na Câmara, no dia 3 de\njaneiro de 1989. No ano seguinte Rolim deixou o PSB e filiou-se ao\nPartido Social Cristão (PSC), em cuja legenda concorreu a novo mandato\nem outubro de 1990, mas não conseguiu se eleger. Permaneceu na Câmara\ndos Deputados até janeiro do ano seguinte, quando se encerrou a\nlegislatura. A partir de então passou a se dedicar ao comércio, à\nindústria e à agropecuária.\n\nEm outubro de 2009, residia em sua fazenda em Cajazeiras, no sertão\nparaibano.\n\nCasou-se com Teresa Augusta Rolim, com quem teve três filhos.\n\nPublicou *Do miolo do sertão; a história de Chico Rolim* (1988).\n\n \n\nFONTES: CÂM. DEP.*Deputados brasileiros* (*suplemento* 1987-1991); CÂM.\nDEP. e *Repertório*(1991-1995); DUARTE, S. M. *Do miolo*. INF. BIOG.\n","ref":"FONTES: CÂM. DEP.*Deputados brasileiros* (*suplemento* 1987-1991); CÂM.\nDEP. e *Repertório*(1991-1995); DUARTE, S. M. *Do miolo*. INF. BIOG.\n","dic":"DHBB"}
