{"title":"BARATA, Rui Guilherme","cargoss":["Deputado federal"],"cargos_esp":[0],"datas_ini":[1957],"datas_fim":[1959],"estados":["PA"],"autor":[0],"content":"**BARATA, Rui Guilherme**\n\n\\*dep. fed. PA 1957-1959.\n\n \n\n*Rui Guilherme Paratininga Barata* nasceu em Santarém (PA) no dia 25 de\njunho de 1920, filho de Alarico Barata e de Maria José Paratininga\nBarata. Seu pai, advogado, foi membro do Conselho da Superintendência do\nPlano de Valorização Econômica da Amazônia (SPVEA) e procurador fiscal\ndo Pará.\n\nAdvogado, jornalista, historiador e professor, em Belém estudou nos\nColégios Nazaré e Pais de Carvalho e cursou a Faculdade de Direito da\nUniversidade Federal do Pará, bacharelando-se em 1943.\n\nCom o fim do Estado Novo (1937-1945) em 29 de outubro de 1945 e a\nconseqüente redemocratização do país, foram criados novos partidos\npolíticos e elaborada uma nova Constituição, que veio a ser promulgada\nem 18 de setembro de 1946. Em 19 de janeiro do ano seguinte foram\nrealizadas eleições para as assembléias legislativas e suplementares\npara o Senado. Rui Barata concorreu a uma cadeira de deputado estadual\nna legenda do Partido Social Democrático (PSD). Eleito, foi empossado em\nmaio seguinte.\n\nDesligando-se do PSD, filiou-se ao Partido Social Progressista (PSP),\nliderado nacionalmente pelo ex-governador paulista Ademar de Barros\n(1947-1951). No pleito de outubro de 1950 foi reeleito na legenda da\nColigação Democrática Paraense, formada, além do PSP, pela União\nDemocrática Nacional (UDN), Partido Social Trabalhista (PST) e Partido\nLibertador (PL).\n\nNo pleito de outubro de 1954 concorreu a uma cadeira na Câmara dos\nDeputados, na legenda do PSP, conseguindo alcançar a primeira suplência.\nCom isso, deixou a Assembléia Legislativa do Pará em janeiro do ano\nseguinte, ocupando uma cadeira na Câmara dos Deputados somente no dia 22\nde novembro de 1957.\n\nNo pleito de outubro de 1958 voltou a concorrer a uma cadeira de\ndeputado estadual na legenda da Coligação Democrática Paraense, formada\npelo PSP e pelo Partido Socialista Brasileiro (PSB), conseguindo apenas\na oitava suplência. Terminando seu mandato de deputado federal em 31 de\njaneiro de 1959, ao final da legislatura, deixou a Câmara dos Deputados.\n\nPassou então, a desenvolver intensa atividade cultural em seu estado.\nProfessor de literatura da Universidade Federal do Pará, foi também\npoeta e compositor, tendo várias músicas de sucesso gravadas pela\ncantora Fafá de Belém.\n\nFoi também procurador-geral do Estado do Pará.\n\nFaleceu em São Paulo no dia 23 de abril de 1990.\n\nEra casado com Norma Soares Barata, com quem teve quatro filhos.\n\nPublicou *Anjos dos abismos* (poesias, 1943) e *A linha imaginária*\n(poesias, 1951).\n\n \n\nFONTES: CÂM. DEP. *Deputados*; CÂM. DEP. *Deputados brasileiros.\nRepertório* (1946-1967); *Jornal do Brasil* (24/4/90); Meneses, R.\n*Dic*.; TRIB. SUP. ELEIT. *Dados* (1, 2, 3 e 4).\n\n \n","ref":"FONTES: CÂM. DEP. *Deputados*; CÂM. DEP. *Deputados brasileiros.\nRepertório* (1946-1967); *Jornal do Brasil* (24/4/90); Meneses, R.\n*Dic*.; TRIB. SUP. ELEIT. *Dados* (1, 2, 3 e 4).\n\n \n","dic":"DHBB"}
