{"title":"ROMAGNOLLI, Ênio","cargoss":["Deputado federal"],"cargos_esp":[0],"datas_ini":[1967],"datas_fim":[1971],"estados":["PR"],"autor":[0],"content":"**ROMAGNOLLI, Ênio**\n\n\\*dep. fed. PR 1967-1971.\n\n \n\n*Ênio Romagnolli* nasceu em Varginha (MG) no dia 4 de julho de 1928,\nfilho de Mário Romagnolli e de Iolanda Romagnolli.\n\nComerciante, radicou-se no Paraná, onde iniciou sua carreira política\ncomo vereador à Câmara Municipal de Cruzeiro do Oeste e prefeito de\nUmuarama. Em novembro de 1966 elegeu-se deputado federal por esse estado\nna legenda da Aliança Renovadora Nacional (Arena), partido de\nsustentação ao regime militar instaurado no Brasil em abril de 1964,\nassumindo sua cadeira em fevereiro do ano seguinte. Deixou a Câmara dos\nDeputados em janeiro de 1971, ao final de seu mandato.\n\nTransferindo-se para Mato Grosso, foi assassinado em Colider no dia 12\nde março de 1982, em conseqüência de uma disputa pela posse de terras.\n\nEra casado com Celina Gavassi Romagnolli, com quem teve cinco filhos.\n\n \n\nFONTES: CÂM. DEP. *Deputados*; CÂM. DEP. *Deputados brasileiros.\nRepertório* (1967-1971); INF. FAM.; TRIB. SUP. ELEIT. *Dados* (8).\n\n \n","ref":"FONTES: CÂM. DEP. *Deputados*; CÂM. DEP. *Deputados brasileiros.\nRepertório* (1967-1971); INF. FAM.; TRIB. SUP. ELEIT. *Dados* (8).\n\n \n","dic":"DHBB"}
