{"title":"BARBALHO, Arnaldo Rodrigues","cargoss":["Presidente de associação ou confederação de empregados ou empregadores"],"cargos_esp":["Eletrobrás"],"datas_ini":[1978],"datas_fim":[1979],"estados":[0],"autor":["Gisela Moura","Paulo Brandi"],"content":"**BARBALHO, Arnaldo Rodrigues**\n\n\\*pres. Eletrobrás 1978-1979.\n\n \n\n*Arnaldo Rodrigues Barbalho* nasceu em Recife no dia 31 de dezembro de\n1923, filho de Eduardo de Almeida Barbalho Júnior e de Alice Rodrigues\nBarbalho.\n\nCursou a Escola de Engenharia de Pernambuco (EEP), obtendo o diploma de\nengenheiro civil em 1947 e o grau de bacharel em engenharia mecânica em\n1948. Lecionou como professor assistente na mesma escola em 1949,\nviajando no ano seguinte para a França a fim de realizar estágio\npatrocinado pelo governo daquele país.\n\nEm 1952 trabalhou no Departamento de Águas e Energia (DAE) de\nPernambuco, participando da elaboração dos estudos iniciais para a\neletrificação de várias cidades do interior do estado com a energia da\nusina de Paulo Afonso, obra da Companhia Hidro Elétrica do São Francisco\n(CHESF), em adiantado estágio de construção. Aprovado por concurso,\npassou a lecionar na EEP como livre-docente, tornando-se professor\ncatedrático em 1953, o mais jovem na história da escola. Paralelamente\nàs suas atividades docentes, formou-se em engenharia elétrica também\npela EEP em 1955. Antes disso, participou de comissão incumbida de\navaliar a implantação de ônibus elétricos na capital.\n\nEm 1956 realizou curso de técnica em altas tensões com o professor Jean\nLagasse, da École Nationale Supérieure d’Energie Électrique, em\nToulouse, na França. Retornou ao Brasil em 1957, assumindo o cargo de\ndiretor da EEP. No mesmo ano, tornou-se colaborador direto do governador\nde Pernambuco, general Osvaldo Cordeiro de Farias, sendo nomeado\nsecretário de Viação e Obras Públicas. Atuou como secretário durante os\núltimos dois anos da administração de Cordeiro de Farias.\n\nEm 1959 doutorou-se em termodinâmica e motores pela EEP e também\ntrabalhou como diretor industrial da Companhia Manufatora de Tecidos do\nNorte, proprietária da Fábrica Tacaruna, em Pernambuco.\n\nFoi diretor técnico, em 1961, da Companhia de Transportes Urbanos de\nRecife, contribuindo para a implantação da rede de ônibus elétricos da\ncapital. Em 1962, foi designado administrador judicial da Pernambuco\nTramways & Power Company Ltd., concessionária dos serviços de\neletricidade, gás e transporte coletivo em Recife, encampada sem\nindenização pelo governo estadual. A encampação ocorreu num quadro de\ncrescente animosidade contra a Pernambuco Tramways, subsidiária do grupo\nnorte-americano American & Foreign Power Company. O estado de Pernambuco\npleiteava a reversão dos bens e instalações da companhia, sem\nindenização, nos termos do contrato de concessão vencido em julho de\n1962.\n\nApós a mudança do regime político em 1964, Barbalho foi chamado a\norganizar a Companhia de Eletricidade de Pernambuco (Celpe). A empresa\nfoi constituída em fevereiro de 1965, sob controle do governo estadual,\nincorporando três anos depois o acervo da Pernambuco Tramways. Barbalho\nintegrou a diretoria da Celpe desde a data de sua fundação até fevereiro\nde 1970, sem prejuízo de suas atividades docentes. Em 1966, foi chefe de\ndepartamento da EEP, já então vinculada à Universidade Federal de\nPernambuco (Ufpe), cargo que voltaria a ocupar em 1973. Convidado pelo\ngovernador Eraldo Gueiros (1971-1975), assumiu em 1971 a Secretaria de\nPlanejamento e Coordenação Geral de Pernambuco, permanecendo à frente da\npasta até 1974.\n\nEm decorrência da posse do governo chefiado pelo general Ernesto Geisel,\ntransferiu-se para Brasília ainda em 1974, ocupando o cargo de\nsecretário-geral do Ministério das Minas e Energia. Representou o\ntitular da pasta, Shigeaki Ueki, nas negociações com autoridades e\ndirigentes de empresas alemãs que resultaram na assinatura do programa\nde cooperação industrial para a energia nuclear, em outubro de 1974.\nEssas negociações definiram pontos básicos do programa de\ndesenvolvimento nuclear do governo Geisel, servindo de preâmbulo para o\nacordo firmado com a República Federal da Alemanha em junho do ano\nseguinte. Barbalho foi uma das primeiras autoridades convocadas pela\nComissão Parlamentar de Inquérito (CPI) do Senado que investigou o\nAcordo Nuclear Brasil-Alemanha, tendo prestado depoimento em 11 de\noutubro de 1978.\n\nDeixou a secretaria geral do ministério em fevereiro de 1978 para ocupar\na presidência da CHESF, no lugar de André Dias de Arruda Falcão, morto\nem acidente aéreo. Permaneceu no cargo apenas três meses, já que em maio\nfoi empossado na presidência das Centrais Elétricas Brasileiras\n(Eletrobrás), substituindo Antônio Carlos Magalhães, que renunciara ao\ncomando da *holding* federal para disputar as eleições para o governo da\nBahia.\n\nFoi durante a sua gestão à frente da Eletrobrás que ocorreu a polêmica\ncompra da Light Serviços de Eletricidade, consumando-se a quase completa\nestatização do setor de energia elétrica. Em 28 de dezembro de 1978, sem\na prévia audiência do Congresso, o presidente Ernesto Geisel aprovou a\ncompra com base em exposição de motivos assinada por Ueki e pelos\nministros Mário Henrique Simonsen (Fazenda) e Élcio Costa Couto\n(interino do Planejamento). Duas semanas depois, a operação foi\nconcretizada. Segundo a revista *Veja*, Barbalho foi chamado a\nparticipar da transação somente no momento do acerto final.\n\nEm março de 1979, com a posse do general João Batista Figueiredo na\npresidência da República, Barbalho transmitiu seu cargo na Eletrobrás\npara Maurício Schulman, retornando ao comando da CHESF, em substituição\na Alberto Costa Guimarães. Em dezembro do mesmo ano, cedeu seu posto na\nCHESF a Luís Carlos Meneses e reassumiu a secretaria geral das Minas e\nEnergia, a convite do ministro César Cals. Ocupou o cargo até o final do\nmandato presidencial de Figueiredo, em março de 1985, não voltando a\ndesempenhar funções públicas.\n\nFaleceu em Recife no dia 4 de janeiro de 2008.\n\nPublicou *Energia e desenvolvimento no Brasil* (Centro da Memória da\nEletricidade, 1987), em colaboração com Marta Helena Barbalho, além de\nvários trabalhos nas áreas de engenharia mecânica e elétrica.\n\nCasou-se com Maria Ângela de Siqueira Cavalcanti Barbalho, com quem teve\ncinco filhos.\n\nGisela Moura/Paulo Brandi\n\nFONTES: ARNALDO; CELPE. *Relatório*(1965, 1970); CHESF. *50\nanos;*CURRIC. BIOG.;**LIGHT; OLIVEIRA, R. *Chesf: gênese;*PANDOLFI, D.\n*Pernambuco;*PRESIDENTES*;*RELATÓRIO da CPI (1983); *Veja* (3/1/79).\n","ref":"FONTES: ARNALDO; CELPE. *Relatório*(1965, 1970); CHESF. *50\nanos;*CURRIC. BIOG.;**LIGHT; OLIVEIRA, R. *Chesf: gênese;*PANDOLFI, D.\n*Pernambuco;*PRESIDENTES*;*RELATÓRIO da CPI (1983); *Veja* (3/1/79).\n","dic":"DHBB"}
