{"title":"RONDON, Joaquim Vicente                                        ","cargoss":["Deputado federal"],"cargos_esp":["GR"],"datas_ini":[1955],"datas_fim":[1959],"estados":[0],"autor":[0],"content":"**RONDON, Joaquim Vicente                                        **\n\n\\* militar; dep. fed. GR 1955-1959.\n\n*Joaquim Vicente Rondon*nasceu em Cuiabá no dia 5 de abril de 1900,\nfilho de José Mamede da Silva Rondon e de Ana Isabel das Neves Rondon.\nSeu tio paterno, marechal Cândido Mariano da Silva Rondon.\n\nEstudou no Liceu Cuiabano e, mais tarde, ingressou na Escola Militar do\nRealengo, no Rio de Janeiro, então Distrito Federal. Ao longo da sua\ncarreira militar, fez os cursos da Escola de Aperfeiçoamento de\nOficiais, da Escola do Estado-Maior e da Escola Superior de Guerra.\n\nEm fevereiro de 1946, assumiu o governo do território federal de\nGuaporé, hoje estado de Rondônia, substituindo a Aluísio Pinheiro\nFerreira. Permaneceu no cargo até outubro de 1947.\n\nElegeu-se deputado federal em outubro de 1954 pelo território de\nGuaporé, hoje Rondônia, na legenda do Partido Social Democrático (PSD).\nExerceu o mandato de 1º de fevereiro de 1955 a 31 de janeiro de 1959.\n\nFaleceu em 1979.\n\nFONTES: CÂM. DEP. *Deputados;* CÂM. DEP. *Deputados brasileiros.\nRepertório* (1946-1967); TRIB.**SUP. ELEIT. *Dados*(3).\n\n \n","ref":"FONTES: CÂM. DEP. *Deputados;* CÂM. DEP. *Deputados brasileiros.\nRepertório* (1946-1967); TRIB.**SUP. ELEIT. *Dados*(3).\n\n \n","dic":"DHBB"}
