{"title":"ROSA, João","cargoss":["Deputado federal"],"cargos_esp":[0],"datas_ini":[1991],"datas_fim":[1992],"estados":["MG"],"autor":[0],"content":"**ROSA, João**\n\n\\*dep. fed. MG 1991-1992.\n\n*João Batista Rosa* nasceu em Estiva (MG) no dia 29 de janeiro de 1933,\nfilho do comerciante Benedito José da Rosa e de Belisária Custódio Rosa.\n\nRealizou os estudos secundários no Colégio São José, de Pouso Alegre, em\nMinas Gerais e, mais tarde, bacharelou-se em direito pela Pontifícia\nUniversidade Católica de São Paulo.\n\nIniciou sua atividade política em outubro de 1958, quando foi eleito\nvereador em Estiva na legenda da UDN (União Democrática Nacional).\nEmpossado em janeiro seguinte, presidiu a Câmara durante todo o mandato,\nencerrado no início de 1963.\n\nCom a promulgação do Ato Institucional nº 2 (AI-2) pelo presidente\nHumberto Castelo Branco, em outubro de 1965, e a conseqüente\nsubstituição do sistema partidário então existente pelo bipartidarismo,\nfiliou-se à recém-criada Aliança Renovadora Nacional (Arena), partido de\nsustentação do regime militar instaurado no país em abril de 1964, e\nnessa legenda elegeu-se prefeito de Pouso Alegre (MG) em novembro de\n1976. Tomou posse em janeiro seguinte e três anos depois, em decorrência\ndo fim do bipartidarismo (21/11/1979), filiou-se ao Partido Democrático\nSocial (PDS), que aglutinou os antigos membros da Arena.\n\nEm setembro de 1980, assim como todos os outros prefeitos, Rosa teve o\nmandato prorrogado pelo Congresso Nacional por dois anos. Em 1981,\ntornou-se delegado do PDS em Pouso Alegre e, no ano seguinte, deixou a\nprefeitura para disputar uma vaga de deputado estadual.\n\nEleito em novembro de 1982, assumiu em fevereiro seguinte, logo\ntornando-se um dos vice-líderes da bancada do PDS na Assembléia. No\ndecorrer deste mandato, transferiu-se para o Partido da Frente Liberal\n(PFL) e, em seguida, para o Partido do Movimento Democrático Brasileiro\n(PMDB), em cuja legenda reelegeu-se deputado estadual em novembro de\n1986.\n\nEmpossado em fevereiro seguinte, Rosa foi presidente das comissões de\nConstituição e Justiça e de Direitos e Garantias Fundamentais da\nAssembléia. Além disso, integrou a comissão encarregada da elaboração do\nprojeto da Constituição estadual e foi titular da Comissão de Assuntos\nda Superintendência do Desenvolvimento do Nordeste (Sudene) e Estímulos\nFiscais e da Comissão Constitucional.\n\nEm outubro de 1990, elegeu-se deputado federal na legenda do PMDB.\nAssumindo o mandato em fevereiro seguinte, participou das atividades\nparlamentares como titular da Comissão de Constituição e Justiça e de\nRedação e como um dos vice-líderes de seu partido na Câmara.\n\nNa sessão de 29 de setembro de 1992, votou a favor da abertura do\nprocesso de *impeachment* do presidente Fernando Collor de Melo, acusado\nde crime de responsabilidade por ter-se envolvido num esquema de\ncorrupção comandado por Paulo César Farias, tesoureiro de sua campanha\neleitoral. Em 2 de outubro, o vice Itamar Franco assumiu interinamente a\npresidência, após a Câmara aprovar o afastamento de Collor. Com o\nprocesso ainda em andamento no Senado, e vislumbrando escassas\npossibilidades de recuperar o cargo, Collor renunciaria ao mandato, em\n29 de dezembro, esperando livrar-se de uma pena de oito anos de\ninelegibilidade, manobra afinal frustrada. Acolhida a renúncia, Itamar\nfoi efetivado na chefia do Executivo.\n\nAinda em outubro de 1992, João Rosa foi eleito prefeito Pouso Alegre.\nRenunciou ao mandato de deputado em dezembro e no dia 1° de janeiro de\n1993 foi empossado à frente da Prefeitura. Deixou o cargo em 1° de\njaneiro de 1997, dedicando-se então à família, à advocacia e à produção\nrural em Pouso Alegre.\n\nFoi ainda fundador e presidente da Associação dos Municípios do Médio\nSapucaí durante dois mandatos consecutivos e membro da Academia de\nCiencias Humanísticas y Relaciones dos Estados Unidos Mexicanos e da\nAssociação Científica da Ordem Soberana dos Cavaleiros do Ouro.\n\nAdvogado por mais de 20 anos, também trabalhou como professor\nuniversitário e como funcionário do departamento jurídico da Prefeitura\nMunicipal de São Paulo.\n\nCasado com Magui Maria Pascoal Rosa, teve quatro filhos.\n\nPublicou *Curso de direito constitucional* e foi autor de diversos\nensaios jurídicos e políticos.\n\n \n\nFONTES: ASSEMB. LEGISL. MG. *Dicionário biográfico*; CÂM. DEP.\n*Deputados brasileiros. Repertório* (1991-1995);*Globo* (30/9/92);\nPortal da ASSEMB. LEGISL. MG.  *20 anos da Constituição Mineira*.\n\n \n","ref":"FONTES: ASSEMB. LEGISL. MG. *Dicionário biográfico*; CÂM. DEP.\n*Deputados brasileiros. Repertório* (1991-1995);*Globo* (30/9/92);\nPortal da ASSEMB. LEGISL. MG.  *20 anos da Constituição Mineira*.\n\n \n","dic":"DHBB"}
