{"title":"ROURE, Agenor de","cargoss":["Secretário-geral da Presidência da República","Ministro do Tribunal de Contas","Ministro da Fazenda"],"cargos_esp":[0,0,0],"datas_ini":[1919,1922,1930],"datas_fim":[1922,1934,1930],"estados":[0,0,0],"autor":[0],"content":"**ROURE, Agenor de**\n\n\\*jornalista; secr. Pres. Rep. 1919-1922; min. TCU 1922-1934; min. Faz.\n1930.\n\n \n\n*Agenor Lafayette de Roure* nasceu em Nova Friburgo (RJ) no dia 28 de\nfevereiro de 1870, filho de Ernesto de Roure, fazendeiro, e de Angelina\nde Roure, ambos suíços.\n\nConcluídos os preparatórios, foi para o Rio de Janeiro, onde se formou\nem odontologia. Não chegou, porém, a exercer a profissão: dedicou-se ao\njornalismo, no qual se iniciou com pouco mais de 20 anos, como revisor\ndo Jornal do Brasil, tornando-se depois redator e secretário desse\nperiódico.\n\nFoi redator da Gazeta de Notícias de 1892 a 1893, ano em que foi nomeado\nredator de debates do Senado Federal. Transferido para a Câmara dos\nDeputados em 1894, ali galgou todos os postos, até chegar a oficial de\nata, secretário do presidente e chefe da secretaria. Ainda em 1894,\nsecretariou A Notícia. Foi cronista parlamentar de O País em 1895 e, a\npartir de 1898, exerceu o cargo de redator-secretário da Tribuna, onde\npermaneceu durante quatro anos. Em 1904, começou a trabalhar no Jornal\ndo Comércio como redator parlamentar, cargo que exerceu até 1919.\n\nEm 1917, tornou-se membro do Instituto Histórico e Geográfico Brasileiro\n(IHGB), do qual viria a ser, mais tarde (1924), sócio honorário.\n\nEm agosto de 1919, por indicação de Tobias Monteiro, foi convidado para\nsecretário da Presidência da República por Epitácio Pessoa. Na ocasião,\nexercia o cargo de chefe da secretaria da Câmara. Durante três anos e\nmeio, cooperou assiduamente com o chefe do governo. Na biografia de\nEpitácio feita por sua filha, Laurita Pessoa Raja Gabaglia, Roure foi\ndefinido como “o intermediário quase obrigatório entre o presidente e a\nlegião dos cidadãos que a este recorrem por escrito ou pessoalmente”. A\nimprensa carioca da época, por sua vez, criticou sua modéstia pessoal,\nafirmando ter ele um ar “de quem pede desculpas de ser o secretário da\npresidência”.\n\nEm 6 de novembro de 1922, foi nomeado, por Epitácio Pessoa, que então\ndeixava o governo, ministro do Tribunal de Contas da União (TCU), cuja\npresidência viria a ocupar anos depois (1931-1933).\n\nDe 25 de outubro a 4 de novembro de 1930, respondeu interinamente pelo\nMinistério da Fazenda da junta governativa que assumira o poder após a\ndeposição de Washington Luís (1926-1930). Por não se considerar\npolítico, não aceitou continuar no cargo, nele permanecendo somente até\na nomeação de José Maria Whitaker.\n\nEm 1931, foi membro da Comissão de Estudos Financeiros e Econômicos dos\nEstados e Municípios.\n\nParticipou, de novembro de 1932 a maio de 1933, da Comissão\nConstitucional presidida por Afrânio de Melo Franco e incumbida da\nelaboração do anteprojeto de Constituição que seria apreciado pela\nAssembléia Nacional Constituinte reunida em 1933-1934.\n\nAposentado como ministro do TCU, por motivo de doença, em outubro de\n1934, fixou residência em Petrópolis, onde veio a falecer em 17 de março\nde 1935.\n\nFoi casado com Antônia Gurgel do Amaral.\n\nPublicou ensaios na Revista do Instituto Histórico e Geográfico\nBrasileiro, conferências e o verbete “História econômica e financeira”,\nno Dicionário histórico, geográfico e etnográfico do Brasil. Escreveu\ntambém: Concurso literário (contos, 1894), Formação constitucional do\nBrasil (1914), Formação do direito orçamentário brasileiro (1916), A\nConstituinte republicana (2v, 1918-1920), Epitácio Pessoa no juízo de\nseus contemporâneos (1925) e Orçamento: comentários ao Código de\nContabilidade (1926).\n\nSônia Dias\n\n \n\n \n\nFONTES: CONSULT. MAGALHÃES, B.; GABAGLIA, L. Epitácio; Grande encic.\nDelta; Jornal do Comércio, Rio; VELHO SOBRINHO, J. Dic.\n\n \n","ref":"FONTES: CONSULT. MAGALHÃES, B.; GABAGLIA, L. Epitácio; Grande encic.\nDelta; Jornal do Comércio, Rio; VELHO SOBRINHO, J. Dic.\n\n \n","dic":"DHBB"}
