{"title":"BARBIERI, Leonardo","cargoss":["Deputado federal"],"cargos_esp":[0],"datas_ini":[1955],"datas_fim":[1959],"estados":["SP"],"autor":[0],"content":"**BARBIERI, Leonardo**\n\n\\*dep. fed. SP 1955-1959.\n\n \n\n*Leonardo Barbieri* nasceu em Araraquara (SP) no dia 6 de maio de 1921,\nfilho de Rafael Barbieri e de Ida Benatti Barbieri. Seu primo Marcelo\nBarbieri foi eleito deputado federal por São Paulo em outubro de 1990.\n\nRealizou seus estudos primários no Grupo Escolar Carlos Batista\nMagalhães, em sua cidade natal; o secundário no Colégio Dante Alighieri,\nem São Paulo; e o colegial e pré-jurídico no Instituto Lafayette, no Rio\nde Janeiro, então Distrito Federal. Ingressou na Faculdade de Direito da\nUniversidade do Brasil, atual Universidade Federal do Rio de Janeiro,\nformando-se em 1944. Passou a exercer orientação em matéria jurídica\npara a firma comercial Casa Barbieri, de propriedade de sua família.\n\nNo pleito de outubro de 1950 elegeu-se vice-prefeito de Araraquara, na\nchapa encabeçada por Antônio Tavares de Pereira Lima, assumindo o\nmandato em janeiro do ano seguinte. Desincompatibilizou-se do cargo e\ndisputou as eleições para a Câmara dos Deputados, em outubro de 1954,\npelo Partido Social Progressista (PSP), sendo bem-sucedido. Deixou o\ncargo de vice-prefeito em janeiro do ano seguinte e assumiu sua cadeira\nno Legislativo federal, tendo cumprido seu mandato de 19 de fevereiro de\n1955 a 31 de janeiro de 1959. Em 1956 ocupou o posto de\nsegundo-secretário da Câmara e foi também presidente da Comissão de\nServiço Público Civil. Tentou a reeleição no pleito de outubro de 1958,\npelo PSP, mas não obteve sucesso.\n\nEm outubro de 1962 elegeu-se deputado estadual por São Paulo, na legenda\ndo PSP, assumindo o mandato em janeiro do ano seguinte. Em conseqüência\nda extinção dos partidos políticos pelo Ato Institucional nº 2\n(27/10/1965) e da posterior instauração do bipartidarismo, filiou-se em\n1966 ao Movimento Democrático Brasileiro (MDB), partido de oposição ao\nregime militar instaurado no país em abril de 1964, legenda pela qual\nfoi reeleito em outubro de 1966, assumindo novo mandato em janeiro de\n1967. Deixou a Assembléia Legislativa de São Paulo em janeiro de 1971.\nEm janeiro de 1976 assumiu o cargo de assessor técnico legislativo da\nCasa, exercendo esta atividade até sua morte, ocorrida na capital\npaulista, no dia 7 de dezembro de 1983.\n\nEra casado com Lenora Sílvia Miranda Barbieri, com quem teve quatro\nfilhos.\n\n \n\nFONTES: CÂM. DEP. *Deputados*; CÂM. DEP. *Deputados brasileiros*\n(1946-1967); CÂM. DEP. *Relação dos dep.;* CORTÉS, C. *Homens*; INF.\nBIOG.; *Rev. Ciência Pol*. (1966); TRIB. SUP. ELEIT. *Dados* (3).\n\n \n","ref":"FONTES: CÂM. DEP. *Deputados*; CÂM. DEP. *Deputados brasileiros*\n(1946-1967); CÂM. DEP. *Relação dos dep.;* CORTÉS, C. *Homens*; INF.\nBIOG.; *Rev. Ciência Pol*. (1966); TRIB. SUP. ELEIT. *Dados* (3).\n\n \n","dic":"DHBB"}
