{"title":"SÁ, Carvalho ============","cargoss":["Deputado federal","Deputado federal"],"cargos_esp":[0,0],"datas_ini":[1949,1948],"datas_fim":[1950,1949],"estados":["BA","BA"],"autor":[0],"content":"SÁ, Carvalho\n============\n\n\\* dep. fed. BA 1948-1949, 1949-1950.\n\n \n\n*João de Carvalho Sá* nasceu em Jeremoabo (BA) no dia 9 de fevereiro de\n1907, filho de João Gonçalves de Sá, fazendeiro, prefeito de Jeremoabo,\nsenador estadual, vice-governador e deputado federal, e de Lígia de\nCarvalho Sá.\n\nEstudou no Colégio Marista de Salvador, formando-se em 1929 pela\nFaculdade de Direito da Bahia. No ano seguinte, foi nomeado promotor de\njustiça em Jeremoabo, transferindo-se para Castro Alves (BA) dois anos\ndepois. Em 1937 foi para Salvador, onde assumiu o cargo recém-criado de\npromotor da justiça militar do estado. Acumulou ainda o cargo de\nsubprocurador da Fazenda estadual.\n\nElegeu-se suplente de deputado pela Bahia à Assembléia Nacional\nConstituinte em dezembro de 1945, na legenda do Partido Social\nDemocrático (PSD). Foi nomeado, nesse ínterim, membro do conselho\nadministrativo do estado, permanecendo no cargo durante a interventoria\nde Guilherme Carneiro da Rocha Marback (1946). Logo em seguida, foi\nprocurador da prefeitura municipal de Salvador. Exerceu o mandato de\ndeputado federal, durante a legislatura ordinária que se seguiu à\npromulgação da nova Carta constitucional, de maio de 1948 a janeiro de\n1949 e de maio de 1949 a janeiro de 1950.\n\nNo pleito de outubro de 1950, foi eleito para a Assembléia Legislativa\nbaiana, pelo PSD, cumprindo o mandato de 1951 a 1955.\n\nNesse último ano, mudou-se para Jeremoabo, dedicando-se às suas\npropriedades no município. Assumiu a prefeitura local em 1964, em\nvirtude da cassação do mandato do prefeito Bento Nolasco de Carvalho,\nseu companheiro de partido, pelo movimento político-militar que derrubou\no presidente João Goulart em 31 de março de 1964. Permaneceu no cargo\naté o fim do mandato, em janeiro de 1967.\n\nNovamente prefeito de Jeremoabo entre 1977 e 1983, nesse último ano\nvoltou a residir em Salvador, onde ocupou de novo a promotoria de\njustiça do estado.\n\nCasou-se com Ildete Costa de Carvalho Sá, com quem teve cinco filhos. Um\ndeles, João Sá, eleito sucessivamente presidente da Associação Comercial\nda Bahia, sendo a última em agosto de 1999.\n\n \n\nFONTES: CÂM. DEP. *Deputados*;**CÂM. DEP. *Deputados* *brasileiros.\nRepertório*(1946-1967); INF. BIOG.; TRIB. SUP. ELEIT. *Dados*(1).\n\n \n","ref":"FONTES: CÂM. DEP. *Deputados*;**CÂM. DEP. *Deputados* *brasileiros.\nRepertório*(1946-1967); INF. BIOG.; TRIB. SUP. ELEIT. *Dados*(1).\n\n \n","dic":"DHBB"}
