{"title":"SÁ, Válter","cargoss":["Deputado federal","Deputado federal","Deputado federal","Deputado federal","Deputado federal"],"cargos_esp":[0,0,0,0,0],"datas_ini":[1967,1958,1957,1956,1951],"datas_fim":[1967,1958,0,0,1955],"estados":["CE","CE","CE","CE","CE"],"autor":[0],"content":"**SÁ, Válter**\n\n\\*dep. fed. CE 1951-1955, 1956, 1957, 1958 e 1967.\n\n \n\n \n\n*Válter Bezerra de Sá* nasceu em Fortaleza no dia 25 de dezembro de\n1908, filho de Joaquim de Sá e de Ana Bezerra de Sá.\n\nCursou o Colégio Militar do Ceará e bacharelou-se em ciências jurídicas\ne sociais pela Faculdade de Direito de seu estado.\n\nProprietário rural, executou o serviço de canalização de águas e esgotos\nda cidade do Crato (CE) e a dragagem, o enrocamento e o aterro do porto\nde Mucuripe, também no Ceará.\n\nElegeu-se deputado federal pelo Ceará em outubro de 1950, na legenda do\nPartido Social Progressista (PSP), assumindo sua cadeira na Câmara em\nfevereiro de 1951. Eleito primeiro suplente no pleito de outubro de\n1954, deixou a Câmara ao término do seu primeiro mandato, em janeiro de\n1955, e voltou a assumir uma cadeira de março a julho desse ano, de\nabril a junho de 1956, de fevereiro a julho de 1957, de fevereiro a maio\nde 1958 e em junho desse mesmo ano.\n\nNo pleito de outubro de 1958, novamente candidatou-se a deputado federal\npelo Ceará na legenda da Coligação Democrática, que reunia o PSP, a\nUnião Democrática Nacional (UDN), o Partido Republicano (PR) e o Partido\nTrabalhista Nacional (PTN), mas alcançou apenas a quarta suplência, não\ntendo exercido o mandato.\n\nNão se candidatou no pleito de 1962, voltando à atuação política apenas\nem novembro de 1966, quando foi eleito deputado federal pelo Ceará, na\nlegenda da Aliança Renovadora Nacional (Arena). Assumiu seu mandato em\nfevereiro de 1967 e, pouco depois, no dia 18 de maio desse ano, faleceu\nem Brasília.\n\nFoi casado com Laís Bezerra de Sá, com quem teve três filhos.\n\n \n\n \n\nFONTES: CÂM. DEP. Deputados; CÂM. DEP. Deputados brasileiros. Repertório\n(6); CÂM. DEP. Relação dos dep.; CISNEIROS, A. Parlamentares; TRIB. SUP.\nELEIT. Dados (2, 3, 4 e 8).\n\n \n","ref":"FONTES: CÂM. DEP. Deputados; CÂM. DEP. Deputados brasileiros. Repertório\n(6); CÂM. DEP. Relação dos dep.; CISNEIROS, A. Parlamentares; TRIB. SUP.\nELEIT. Dados (2, 3, 4 e 8).\n\n \n","dic":"DHBB"}
