{"title":"SABENÇA, Alcides","cargoss":["Constituinte","Deputado federal"],"cargos_esp":[0,0],"datas_ini":[1946,1946],"datas_fim":[1946,1947],"estados":[0,"RJ"],"autor":[0],"content":"**SABENÇA, Alcides**\n\n\\*const. 1946; dep. fed. RJ 1946-1947.\n\n \n\n*Alcides Rodrigues Sabença* nasceu em Barra do Piraí (RJ) no dia 12 de\ndezembro de 1915, filho de Antônio Rodrigues Sabença e de Ester Malafaia\nSabença.\n\nEm 1931 ingressou no Partido Comunista Brasileiro (PCB), então Partido\nComunista do Brasil. Trabalhava como carpinteiro em 1933, quando se\nelegeu secretário do Sindicato dos Operários na Construção Civil de\nBarra do Piraí, cargo que ocuparia durante dois mandatos. Em 1934\nparticipou de diversos movimentos, como membro da Juventude Estudantil\nOperária Popular. Em 1935 filiou-se à Aliança Nacional Libertadora\n(ANL), movimento criado em março desse ano para lutar contra o fascismo,\no imperialismo, o latifúndio e a miséria, e que congregava elementos dos\nmais diversos escalões sociais, desde operários até algumas patentes\nmilitares. Em julho, a ANL foi posta na ilegalidade, mas continuou\nfuncionando pela ação do PCB, liderado por Luís Carlos Prestes, e só\ndeixou de atuar após a Revolta Comunista de novembro de 1935. Em 1936\nparticipou do Congresso Trabalhista, realizado em Niterói, então capital\ndo estado do Rio de Janeiro.\n\nA partir do início da Segunda Guerra Mundial (1939-1945), participou dos\nmovimentos que forçaram o governo a declarar guerra aos países do Eixo\n(Alemanha, Itália e Japão) e a enviar uma força expedicionária à Itália,\no que acabou acontecendo. Com a entrada do Brasil na guerra, tornou-se\nsecretário da Comissão de Ajuda à Força Expedicionária Brasileira (FEB).\n\nNo fim do Estado Novo (1937-1945) elegeu-se secretário-político do\ncomitê distrital do PCB de Volta Redonda (RJ) e, após a deposição do\npresidente Getúlio Vargas, em outubro de 1945, elegeu-se em dezembro\ndeputado por seu estado à Assembléia Nacional Constituinte, na legenda\ndo PCB. Assumiu o mandato em fevereiro de 1946 e, junto com outros\ndeputados, assinou uma proposição do PCB à Assembléia, constando de 15\npontos. Os comunistas defendiam a convocação de ministros sem a\ncomunicação prévia dos assuntos, a extensão do voto aos analfabetos,\nsoldados e marinheiros, a decretação do estado de sítio apenas em caso\nde agressão estrangeira e a autonomia do Distrito Federal, combatendo\ntambém a abertura de quaisquer exceções à proibição do trabalho de\nmenores.\n\nApós a promulgação da nova Carta (18/9/1946), passou a exercer o mandato\nordinário. Nessa legislatura analisou a situação dos trabalhadores\nrurais e da economia no campo e estudou o problema dos empregados da\nCantareira, no Rio de Janeiro (então Distrito Federal), e da Fábrica\nEletro-Aço São Caetano. Deixou a Câmara em setembro de 1947, quatro\nmeses após o cancelamento do registro do PCB.\n\nAinda em 1946 trabalhou na Companhia Siderúrgica Nacional (CSN), em\nVolta Redonda, e foi um dos fundadores do Sindicato dos Trabalhadores\nnas Indústrias Metalúrgicas, Mecânicas e de Material Elétrico de Barra\nMansa (RJ).\n\nFaleceu em Volta Redonda (RJ) no dia 7 de março de 1986.\n\nEra casado com Renê Sabença, com quem teve nove filhos.\n\n \n\nFONTES: *Bancada*; CÂM. DEP. *Deputados* (1946-1967); CÂM. DEP. *Relação\ndos dep*.; *Grande encic. Delta*; *Jornal do Brasil* (8/3/86); SILVA, G.\n*Constituinte*.\n\n \n","ref":"FONTES: *Bancada*; CÂM. DEP. *Deputados* (1946-1967); CÂM. DEP. *Relação\ndos dep*.; *Grande encic. Delta*; *Jornal do Brasil* (8/3/86); SILVA, G.\n*Constituinte*.\n\n \n","dic":"DHBB"}
