{"title":"SABÓIA, Celso","cargoss":["Deputado federal"],"cargos_esp":[0],"datas_ini":[1983],"datas_fim":[1987],"estados":["PR"],"autor":[0],"content":"**SABÓIA, Celso**\n\n\\*dep. fed. PR 1983-1987.\n\n \n\n*Celso da Costa Sabóia* nasceu em Rio Negro (PR) em 8 de setembro de\n1917, filho de Flávio Sabóia e de América da Costa Sabóia.\n\nFormado pela Escola de Agronomia da Universidade Federal do Paraná em\n1939, foi técnico em administração e funcionário de carreira do Banco do\nBrasil e do Banco Central; diretor-superintendente e presidente do Banco\ndo Estado do Paraná; presidente do conselho das empresas do conglomerado\nBanestado; diretor da carteira de crédito agrícola do Banco Central;\nmembro do Conselho de Administração do Banco Regional de Desenvolvimento\ne do Banco de Desenvolvimento do Estado do Paraná (Badep).\n\nEm novembro de 1982 disputou e venceu a eleição para deputado federal na\nlegenda do Partido do Movimento Democrático Brasileiro (PMDB), tomando\nposse em fevereiro de 1983. Em 25 de abril de 1984, votou a favor da\nemenda Dante de Oliveira, que, apresentada na Câmara dos Deputados,\npropôs o restabelecimento das eleições diretas para presidente da\nRepública em novembro daquele ano. Como a emenda não obteve o número de\nvotos indispensáveis à sua aprovação — faltaram 22 para que o projeto\npudesse ser enviado ao Senado —, no Colégio Eleitoral reunido em 15 de\njaneiro de 1985, Celso Sabóia votou no candidato oposicionista Tancredo\nNeves, que derrotou Paulo Maluf, candidato do Partido Democrático Social\n(PDS), que apoiava o regime militar.\n\nNão concorreu à reeleição em novembro de 1986, deixando a Câmara dos\nDeputados em janeiro de 1987.  Entre março e outubro de 1987, foi\ndiretor do Banco Regional de Desenvolvimento do Extremo Sul (Brde), e de\nnovembro de 1987 a março de 1990, diretor-presidente do Badep.\n\nEm novembro de 1995, foi eleito membro suplente do Conselho de\nAdministração do Banco Regional de Desenvolvimento do Extremo Sul (Brde)\nsendo efetivado no cargo em junho de 1997, ocupando o posto durante os\ndois mandatos de Jaime Lerner no governo do estado (1995-1999,\n1999-2003). Em março de 2003 o novo governador eleito, Roberto Requião,\npublicou decreto exonerando Sabóia do cargo.  \n\nApós o término de seu mandato no BRDE não mais ocupou cargos públicos,\nvindo a falecer na cidade de Curitiba em agosto de 2003.\n\nCasou-se com Cléa Catta Preta Sabóia, com quem teve três filhos.\n\nFONTES: CÂM. DEP. *Deputados brasileiros. Repertório* (1983-1987); INF.\nBIOG.; *Globo* (26/4/84 e 16/1/85); *Estado do Paraná* (28/8/03).\n","ref":"FONTES: CÂM. DEP. *Deputados brasileiros. Repertório* (1983-1987); INF.\nBIOG.; *Globo* (26/4/84 e 16/1/85); *Estado do Paraná* (28/8/03).\n","dic":"DHBB"}
