{"title":"SABÓIA, Palhano de","cargoss":["Deputado federal"],"cargos_esp":[0],"datas_ini":[1963],"datas_fim":[1964],"estados":["CE"],"autor":[0],"content":"**SABÓIA, Palhano de**\n\n\\*religioso; dep. fed. CE 1963-1964.\n\n \n\n*José Palhano de Sabóia* nasceu em Crateús (CE) em 1922, filho de Júlio\nde Sabóia e de Maria de Jesus Palhano de Sabóia.\n\nSacerdote de grande atuação no norte do Ceará, iniciou sua carreira\npolítica ao se eleger prefeito do município de Sobral (CE) em 1958,\nderrotando o “coronel” Chico Monte e seu poderoso grupo político. Por\nassumir posições que muitas vezes contrastavam com o sacerdócio, foi\nacusado pelos católicos ortodoxos de Sobral de pecar contra sua condição\nreligiosa. Durante o governo João Goulart (1961-1964), obteve a\nconcessão da Rádio Tupinambá de Sobral.\n\nNo pleito de outubro de 1962, foi eleito deputado federal pelo Ceará na\nlegenda da União pelo Ceará, que reunia o Partido Social Democrático\n(PSD) e a União Democrática Nacional (UDN). Assumiu sua cadeira em\nfevereiro de 1963 e posteriormente transferiu-se para o Partido\nTrabalhista Brasileiro (PTB). Após o movimento político-militar de março\nde 1964, teve seu mandato cassado em 13 de junho seguinte com base no\nAto Institucional nº 1, sendo obrigado a abandonar a Câmara.\n\nEm novembro de 1976, foi suspenso de ordens por ter acusado o bispo de\nSobral, dom Valfrido Teixeira, de acobertar o furto de imagens do Museu\nDiocesano Sobralense. Em março do ano seguinte, manifestou ao arcebispo\nde Fortaleza, cardeal Aluísio Lorscheider, seu desejo de reintegrar-se à\nIgreja.\n\nFaleceu em Fortaleza no dia 18 de maio de 1982.\n\n \n\n \n\nFONTES: ARQ. DEP. PESQ. JORNAL DO BRASIL; CÂM. DEP. Anais; CÂM. DEP.\nDeputados; GIRÃO, R. Ceará; IstoÉ (26/5/ 82); Jornal do Brasil (20/3/77\ne 19/5/82); TRIB. SUP. ELEIT. Dados (6).\n\n \n","ref":"FONTES: ARQ. DEP. PESQ. JORNAL DO BRASIL; CÂM. DEP. Anais; CÂM. DEP.\nDeputados; GIRÃO, R. Ceará; IstoÉ (26/5/ 82); Jornal do Brasil (20/3/77\ne 19/5/82); TRIB. SUP. ELEIT. Dados (6).\n\n \n","dic":"DHBB"}
