{"title":"SALLY, José","cargoss":["Deputado federal"],"cargos_esp":[0],"datas_ini":[1967],"datas_fim":[1976],"estados":["RJ"],"autor":[0],"content":"**SALLY, José**\n\n\\*dep. fed. RJ 1967-1976.\n\n \n\n*José Sally* nasceu em Itaocara (RJ) no dia 3 de abril de 1913, filho de\nAntônio Elias Sally e****de Rosa Sally.\n\nEm 1937, bacharelou-se em ciências jurídicas e sociais pela Faculdade de\nDireito de Niterói.\n\nIngressou na política elegendo-se deputado à Assembléia Legislativa do\nRio de Janeiro em outubro de 1950, na legenda do Partido Social\nDemocrático (PSD). Assumiu sua cadeira em fevereiro do ano seguinte e em\noutubro de 1954 reelegeu-se deputado estadual, o mesmo acontecendo no\npleito de outubro de 1958. Nesse mesmo ano, foi nomeado conselheiro da\nOrdem dos Advogados do Brasil, seção fluminense, cargo que ocupou até\n1962.\n\nEm outubro de 1962, foi mais uma vez reeleito deputado estadual, ainda\nna legenda do PSD. Durante sua permanência na Assembléia Legislativa\nfluminense, foi líder do governo e membro da Comissão de Justiça. Com a\nextinção dos partidos políticos pelo Ato Institucional nº 2, de 27 de\noutubro de 1965, e a posterior instauração do bipartidarismo, filiou-se\nà Aliança Renovadora Nacional (Arena), tendo sido membro da comissão\nexecutiva estadual do partido.\n\nNo pleito de novembro de 1966, foi eleito deputado federal pelo Rio de\nJaneiro, na legenda da Arena. Encerrando seu mandato de deputado\nestadual em janeiro de 1967, assumiu sua cadeira na Câmara dos Deputados\nem fevereiro do mesmo ano e durante essa legislatura foi membro da\nComissão de Constituição e Justiça. Em novembro de 1970 reelegeu-se\ndeputado federal, tornando-se, na nova legislatura, suplente da Comissão\nde Serviço Público da Câmara. Foi reeleito deputado federal em novembro\nde 1974, ainda na legenda da Arena, participando, enquanto membro, da\nComissão de Constituição e Justiça e, enquanto suplente, da Comissão de\nTrabalho e Legislação Social da Câmara.\n\nFaleceu antes do término do mandato, em São Gonçalo (RJ), no dia 8 de\nmaio de 1976.\n\nFoi casado com Amparo de Araújo Sally, com quem teve um filho.\n\n \n\n \n\nFONTES: CÂM. DEP. Deputados; CÂM. DEP. Deputados brasileiros. Repertório\n(6, 7 e 8); Jornal do Brasil (10/5/76); NÉRI, S. 16; Perfil (1972);\nTRIB. SUP. ELEIT. Dados (2, 3, 4, 6, 8 e 9).\n\n \n","ref":"FONTES: CÂM. DEP. Deputados; CÂM. DEP. Deputados brasileiros. Repertório\n(6, 7 e 8); Jornal do Brasil (10/5/76); NÉRI, S. 16; Perfil (1972);\nTRIB. SUP. ELEIT. Dados (2, 3, 4, 6, 8 e 9).\n\n \n","dic":"DHBB"}
