{"title":"SALMORIA, Odilon","cargoss":["Deputado federal"],"cargos_esp":[0],"datas_ini":[1983],"datas_fim":[1987],"estados":["SC"],"autor":[0],"content":"**SALMORIA, Odilon**\n\n\\*dep. fed. SC 1983-1987.\n\n* *\n\n*Odilon Sebastião Salmoria* nasceu em Videira (SC) no dia 11 de julho de\n1946, filho de Américo Salmoria e de Clarice Pacheco Salmoria.\n\nApós concluir os primeiros estudos em sua cidade natal, transferiu-se\npara Curitiba, onde cursou o segundo grau. Em 1970 bacharelou-se em\nciências jurídicas e sociais pela Faculdade de Direito de Passo Fundo,\nno Rio Grande do Sul.\n\nIniciou sua atuação na política partidária em 1972, filiando-se à\nAliança Renovadora Nacional (Arena), partido de sustentação ao regime\nmilitar instalado no país em abril de 1964. Em 1973 transferiu-se para o\nMovimento Democrático Brasileiro (MDB), e após a extinção do\nbipartidarismo em novembro de 1979, e a consequente reorganização\npartidária, se inscreveu no Partido do Movimento Democrático Brasileiro\n(PMDB), que deu continuidade à linha política do extinto MDB.\n\nNo pleito de novembro de 1982 foi eleito deputado federal por Santa\nCatarina na legenda do PMDB. Assumindo o mandato em fevereiro de 1983,\nparticipou dos trabalhos legislativos como vice-presidente da Comissão\nde Economia, membro da Comissão de Indústria e Comércio e suplente da\nComissão de Relações Exteriores. Nesse período, foi membro do diretório\nnacional do partido.\n\nNa sessão da Câmara dos Deputados de 25 de abril de 1984, destinada à\nvotação da emenda Dante de Oliveira, que propunha a realização de\neleições diretas para presidente da República em novembro daquele ano,\nfoi favorável à proposta, que foi afinal derrotada. Na eleição do novo\npresidente da República pelo Colégio Eleitoral, reunido em 15 de janeiro\nde 1985, votou no oposicionista Tancredo Neves, lançado pela Aliança\nDemocrática, união do PMDB com a dissidência do Partido Democrático\nSocial (PDS) abrigada na Frente Liberal, que derrotou o candidato do\nregime militar, Paulo Maluf. Entretanto, Tancredo não chegou a assumir a\npresidência, vindo a falecer em 21 de abril. O vice, José Sarney, que\ndesde 15 de março vinha exercendo interinamente o cargo, foi efetivado\nna chefia do Executivo federal.\n\nAinda em 1985, Odilon Salmoria passou a integrar a recém-criada Comissão\nde Informática da Câmara, onde exerceu o mandato até o final****da\nlegislatura, em 31 de janeiro de 1987. De março seguinte a março de 1988\nfoi secretário de Ciência e Tecnologia e Minas e Energia de Santa\nCatarina, no governo de seu correligionário Pedro Ivo Campos. A partir\nde então, voltou-se para as atividades empresariais em Santa Catarina,\nocupando cargos de direção em diversas empresas de sua propriedade,\nentre as quais a Videcar Ltda. Revenda Volkswagen e a Companhia de\nMelhoramentos de Videira, ambas em Videira, a Veículos Real Ltda., em\nCampos Novos, a Videcar Caminhões Ltda., em Joaçaba, e a Videcross\nComércio de Motos Ltda., em Caçador.\n\nCasou-se com Sandra Salmoria.\n\n \n\nFONTES:**ASSEMB. LEGISL. SC. *Dicionário político*; CÂM. DEP. *Deputados\nbrasileiros. Repertório* (1983-1987); INF. BIOG.\n\n \n","ref":"FONTES:**ASSEMB. LEGISL. SC. *Dicionário político*; CÂM. DEP. *Deputados\nbrasileiros. Repertório* (1983-1987); INF. BIOG.\n\n \n","dic":"DHBB"}
