{"title":"SAMPAIO, Mário Orlando Ribeiro","cargoss":["Comandante Militar"],"cargos_esp":["Planalto "],"datas_ini":[1985],"datas_fim":[1986],"estados":[0],"content":"**SAMPAIO, Mário Orlando Ribeiro**\n\n\\*militar; comte Mil. Planalto  1985-1986.\n\n \n\n                *Mário Orlando Ribeiro Sampaio* nasceu no Rio de\nJaneiro, então Distrito Federal, no dia 2 de setembro de 1924, filho do\ngeneral de exército Raimundo Sampaio e de Maria da Conceição Ribeiro\nSampaio.\n\n                Sentou praça em março de 1942, em São Paulo, na Escola\nPreparatória de Cadetes, saindo aspirante a oficial na arma de cavalaria\nem agosto de 1945. Em novembro deste mesmo ano obteve a patente de\nsegundo-tenente, tendo chegado a primeiro-tenente em dezembro de 1947.  \nCapitão desde julho de 1951, cursou, nos anos de 1953 e 1954, a Escola\nde Aperfeiçoamento de Oficiais (ESAO), tendo ingressado na Escola de\nComando e Estado-Maior do Exército (ECEME) em 1956. Concluiu este curso\nno ano de 1958, já como major, patente à qual fora promovido em abril de\n1957. De janeiro a novembro de 1959 comandou a 4ª Divisão de Cavalaria,\ntendo assumido neste mesmo mês o comando da 9ª Região Militar. Em\njaneiro de 1961 deixou o cargo para assumir, no mês seguinte, a\nDiretoria de Instrução do Exército, onde permaneceu até setembro deste\nmesmo ano.\n\n                Secretário geral do Conselho de Segurança Nacional de\nsetembro de 1961 a agosto de 1963, em 1962 esteve na  República Federal\nda Alemanha, onde freqüentou o curso de aperfeiçoamento de informações.\nServiu no Estado-Maior do Exército de agosto de 1963 até abril de 1964,\nquando, após a deposição do presidente João Goulart (1962 - 1964), foi\ndesignado para servir na chefia da Secretaria do Serviço Nacional de\nInformações (SNI), na qual permaneceria até março de 1968.\nTenente-coronel em abril de 1965, em 1968 fez o curso de informações da\nEscola Superior de Guerra (ESG). Passou a coronel em abril de 1970,\nvindo a comandar o Regimento de Reconhecimento Mecanizado de julho deste\nano até dezembro de 1971. Passou para o comando do 15º Regimento de\nCavalaria Mecanizado, de janeiro de 1972 a fevereiro de 1973. Voltou à\nchefia da Secretaria do SNI, em março de 1973, cargo em que permaneceu\naté  dezembro de 1975. Adido das forças armadas na embaixada brasileira\nno Egito entre janeiro de 1976 e  janeiro de 1978, regressou em seguida\nao Brasil, tendo sido promovido a general de brigada em março deste ano.\n\n                Em fevereiro de 1980, assumiu o comando da 4ª Região\nMilitar, em Juiz de Fora (MG), cargo que havia sido ocupado por seu pai,\n40 anos antes, deixando o comando da 8ª Brigada Mecanizada, em Pelotas\n(RS). Em novembro de 1983 ascendeu a  general-de-divisão. Nesta patente,\nem janeiro de 1985, foi designado comandante militar do Planalto, em\nsubstituição ao general Newton Cruz. Comentando as eleições para a\nAssembléia Nacional Constituinte marcadas para novembro de 1986, que\nreiterava o fim do ciclo de presidentes militares inaugurado em 1964 e\nencerrado com posse de José Sarney em março de 1985, declarou que elas\nmarcavam apenas o fim de uma etapa, pois nada mudaria após a\ntransferência do poder aos civis. Afinal, a “norma de conduta” do\nExército sempre havia sido “o respeito à Constituição”. Deixou a chefia\ndo Comando Militar do Planalto em novembro de 1986, passando-a ao\ngeneral Pedro Luís de Araújo Braga.\n\n                Ao longo de sua carreira militar, foi instrutor da\nEscola de Sargentos das Armas e da Academia Militar das Agulhas Negras.\nFoi ainda representante do Estado-Maior do Exército no conselho diretor\ndo Instituto Brasileiro de Geografia e Estatística. Como oficial\ngeneral, foi chefe do Centro de Informações do Exército, diretor de\nPatrimônio e comandante do CMP/11ª Região Militar\n\n                Casou-se com Elvira Sampaio.\n\n \n\nFONTES : CURRIC. BIOG.; MIN. EXERC. *Almanaque* (1984); *Estado de S.\nPaulo* (12/1/85); *Globo* (2/2/80, 12/1/85).\n","ref":"","dic":"DHBB"}
