{"title":"SAMPAIO, Plínio Arruda","cargoss":["Deputado federal","Deputado federal","Constituinte"],"cargos_esp":[0,0,0],"datas_ini":[1985,1963,1987],"datas_fim":[1990,1964,1988],"estados":["SP","SP",0],"autor":["Marcelo Costa"],"content":"**SAMPAIO, Plínio Arruda**\n\n\\*dep. fed. SP 1963-1964, 1985-1990; const. 1987-1988.\n\n*Plínio Soares de Arruda Sampaio*nasceu na cidade de São Paulo no dia 26\nde julho de 1930, filho de João Batista de Arruda Sampaio e de Maria\nAparecida Soares de Arruda Sampaio.\n\nCursou o Ginásio Perdizes e o Colégio Rio Branco, bacharelando-se pela\nFaculdade de Direito da Universidade de São Paulo (USP) em 1954, ano em\nque ingressou no Ministério Público, em Sertãozinho (SP). Mais tarde foi\npromotor de Justiça de Pindamonhangaba (SP), servindo ainda como\npromotor adido ao gabinete da Secretaria Estadual de Justiça.\n\nFoi presidente da Juventude Universitária Católica (JUC), associação\ncivil reconhecida nacionalmente em julho de 1950 pela hierarquia\neclesiástica como setor da Ação Católica Brasileira (ACB), com o\nobjetivo de difundir os ensinamentos da Igreja no meio universitário. Em\n1959 tornou-se subchefe da Casa Civil e coordenador do plano de ação no\ngoverno de Carlos Alberto Alves de Carvalho Pinto (1959-1963). Em 1961,\ncomo pré-candidato do Partido Democrata Cristão (PDC) à prefeitura de\nSão Paulo numa coligação comandada por Carvalho Pinto, liderava as\npesquisas de opinião quando teve sua indicação vetada pelo presidente\nJânio Quadros (1961), em razão do rompimento político entre Carvalho\nPinto e o presidente. Plínio acabou apoiando a candidatura vencedora de\nFrancisco Prestes Maia.\n\nEm abril daquele ano assumiu o cargo de secretário dos Negócios Internos\ne Jurídicos da Prefeitura de São Paulo, na gestão de Prestes Maia\n(1961-1965). Cinco meses depois demitiu-se, juntamente com todo o\nsecretariado, alegando discordar da reforma do secretariado que estava\nsendo proposta pelo prefeito com o objetivo de melhorar seu\nrelacionamento com a Câmara de Vereadores. Junto com Diogo Gaspar, foi\nassessor do presidente João Goulart (1961-1964).\n\nMembro do PDC, teve sua candidatura a deputado federal por São Paulo em\noutubro de 1962 apoiada pela Aliança Eleitoral pela Família. Na ocasião,\ncomprometeu-se a lutar pela justiça social cristã sem transigir com o\ncomunismo ou o socialismo, mas sem compromissos com “os erros do\ncapitalismo liberal, individualista e desumano”. Foi eleito na legenda\nda coligação do PDC com o Partido Rural Trabalhista (PRT) e a União\nDemocrática Nacional (UDN), assumindo sua cadeira na Câmara dos\nDeputados em fevereiro de 1963.\n\nA partir de abril daquele ano, passou a ser vice-líder do PDC na Câmara\ne foi também relator da Comissão Especial de Reforma Agrária, membro\ntitular das comissões de Economia e de Política Agrícola e integrou a\nFrente Parlamentar Nacionalista. Permaneceu na Câmara até o dia 10 de\nabril de 1964, quando foi cassado pelo Ato Institucional nº 1 (AI-1),\neditado no dia anterior pela junta militar que assumiu o governo com a\ndeposição de Goulart, tendo seus direitos políticos suspensos por dez\nanos.\n\nEm seguida exilou-se no Chile, onde dirigiu o Departamento de\nAdministração de Reforma Agrária do Instituto de Capacitación e\nInvestigación en Reforma Agraria (ICIRA) — programa conjunto da\nOrganização das Nações Unidas para a Alimentação e a Agricultura (FAO) e\ndo governo chileno —, permanecendo até 1970. Posteriormente\ntransferiu-se para os Estados Unidos, onde continuou a trabalhar naquele\nórgão da ONU e concluiu o curso de mestrado em desenvolvimento econômico\nna Universidade de Cornell em 1975. No ano seguinte voltou ao Brasil,\npassando a trabalhar na Fundação Getulio Vargas (FGV), em São Paulo. Em\njaneiro de 1977 foi um dos sócios-fundadores do Centro de Estudos de\nCultura Contemporânea (Cedec).\n\nÀs vésperas da indicação do novo prefeito de São Paulo pelo governador\ndo estado, Paulo Salim Maluf (1979-1982), sugeriu que o Movimento\nDemocrático Brasileiro (MDB), partido de oposição ao regime militar,\nfizesse ampla consulta popular para dar base à elaboração de um programa\nde obras e serviços a ser cumprido pelo prefeito, sob pena de este\nperder os votos do MDB na Câmara de Vereadores. Em junho de 1981\nfiliou-se ao Partido dos Trabalhadores (PT), tendo afirmado que este era\no partido que oferecia maiores condições de se executar um trabalho na\nbase da sociedade, sendo viável por ter nascido dos líderes mais lúcidos\nda classe trabalhadora. Foi professor da Pontifícia Universidade\nCatólica (PUC) de São Paulo e membro da comissão executiva estadual do\nPT nesse estado.\n\nNo pleito de novembro de 1982 candidatou-se a deputado federal por São\nPaulo na legenda do PT, obtendo a primeira suplência. Com a licença do\ndeputado federal Eduardo Suplicy para candidatar-se à prefeitura de São\nPaulo em novembro de 1985, Plínio assumiu o mandato na Câmara dos\nDeputados, participando dos trabalhos legislativos como membro titular\nda Comissão de Reforma Agrária.\n\nPleiteando a candidatura ao governo de São Paulo em novembro de 1986,\nteve seu nome preterido no partido em favor de Eduardo Suplicy. Com\nisso, candidatou-se à reeleição, sendo o segundo candidato mais votado\ndo partido em São Paulo. Representando a ala moderada do PT e tendo sido\napoiado por setores progressistas da Igreja Católica, tais como a\nConferência Nacional dos Bispos do Brasil (CNBB), as comunidades\neclesiais de base (CEBs) e diversas pastorais, assumiu o mandato em\nfevereiro de 1987, quando tiveram início os trabalhos da Assembléia\nNacional Constituinte. Na Constituinte, foi vice-líder do PT, relator da\nSubcomissão do Poder Judiciário e do Ministério Público, da Comissão de\nOrganização dos Poderes e Sistema de Governo (o único relator do PT e\ndos partidos de esquerda), membro titular da Comissão de Sistematização,\nda Comissão de Redação e suplente da Subcomissão dos Municípios e\nRegiões, da Comissão da Organização do Estado. Sua proposta de criação\nde um tribunal constitucional como a mais alta corte da estrutura\njudiciária brasileira, em substituição ao Supremo Tribunal Federal\n(STF), criou polêmica junto aos magistrados e acabou sendo retirada do\nrelatório.\n\nIntegrando o bloco suprapartidário de articulação da Igreja Católica\ncomo membro da comissão de acompanhamento da CNBB na Constituinte, nas\nsuas votações mais importantes pronunciou-se a favor da limitação do\ndireito de propriedade privada, do mandado de segurança coletivo, da\nlegalização do aborto, da estabilidade no emprego, da remuneração 50%\nsuperior para o trabalho extra, da jornada semanal de 40 horas, do turno\nininterrupto de seis horas, do aviso prévio proporcional ao tempo de\ntrabalho quando da demissão de um trabalhador, da pluralidade sindical,\nda soberania popular, do presidencialismo, da estatização do sistema\nfinanceiro, do limite de 12% ao ano para os juros reais, da criação de\num fundo de apoio à reforma agrária, da anistia a dívidas de micro e\npequenos empresários e da desapropriação inclusive de propriedades\nrurais produtivas para a reforma agrária. Votou contra a pena de morte,\na legalização do jogo do bicho e o mandato de cinco anos para o\npresidente José Sarney. Recebeu nota dez na avaliação do Departamento\nIntersindical de Assessoria Parlamentar (DIAP) sobre a atuação dos\nconstituintes.\n\nEm agosto de 1987 a imprensa noticiou com destaque sua inclusão numa\nlista dos chamados “marajás” (funcionários públicos com altos salários),\ndivulgada pelo governador paulista Orestes Quércia (1987-1991). Segundo\nPlínio, sua inclusão, aproveitando o fato de ele ser ex-procurador da\nJustiça de São Paulo, teve o objetivo de prejudicar o PT. No ano\nseguinte disputou a indicação do partido para concorrer à prefeitura de\nSão Paulo no pleito de novembro de 1988, representando os setores\nmoderados do PT e tendo o apoio de expressivos líderes regionais e\nnacionais do partido, tais como o presidente Luís Inácio Lula da Silva e\nJosé Dirceu. Na prévia realizada pelo PT em junho daquele ano foi\nderrotado pela então deputada estadual Luísa Erundina, representante dos\nsetores mais à esquerda do partido, passando a apoiar sua candidatura,\nafinal vencedora. Com a vitória de Erundina, tornou-se coordenador do\ngrupo de trabalho que preparou as metas da administração municipal.\n\nCotado para assumir a Secretaria de Planejamento do município, preferiu\ndisputar a liderança do PT na Câmara dos Deputados em dezembro de 1988,\ntendo obtido sucesso ao derrotar o deputado federal paulista José\nGenoíno por oito votos a três. Como um dos principais articuladores do\napoio do Partido Democrático Trabalhista (PDT) e do Partido da Social\nDemocracia Brasileira (PSDB) a Lula no segundo turno das eleições\npresidenciais em dezembro de 1989, foi indicado para disputar o governo\nestadual de São Paulo no pleito de outubro de 1990. Em maio daquele ano\nrepresentou o PT, como observador no encontro da Internacional\nSocialista, no Cairo.\n\nOficializada sua candidatura ao governo ainda em maio, em convenção\nestadual, em setembro de 1990 renunciou ao seu mandato na Câmara dos\nDeputados, assumindo em seu lugar o então vice-prefeito de São Paulo,\nLuís Eduardo Greenhalgh. Plínio disputou o pleito de outubro de 1990\npela coligação União Democrática Popular, integrada pelo PT, o Partido\nSocialista Brasileiro (PSB), o Partido Comunista Brasileiro (PCB) e o\nPartido Comunista do Brasil (PCdoB). Derrotado pelo candidato do Partido\ndo Movimento Democrático Brasileiro (PMDB), Luís Antônio Fleury Filho,\nconseguiu apenas a quarta colocação.\n\nCotado para disputar a presidência do PT no 10º Encontro Nacional do\npartido, realizado em Guarapari em agosto de 1995, paradoxalmente com o\napoio dos setores mais à esquerda do PT, acabou recusando o convite.\nAinda naquele ano tornou-se membro da Secretaria Agrária Nacional do PT.\nEm dezembro de 1996 lançou o jornal *Correio da Cidadania* e, em maio do\nano seguinte, participou do IX Fórum Nacional no Banco Nacional do\nDesenvolvimento Econômico e Social (BNDES).\n\nEm 2005, em meio à crise política que marcou o governo do presidente\nLuiz Inácio Lula da Silva, popularmente conhecida como “mensalão”, na\nqual estiveram envolvidos membros da direção do PT, Plínio Sampaio\ndesligou-se do partido alegando não concordar com seus rumos políticos,\ne ajudou a fundar o Partido Socialismo e Liberdade (Psol), do qual se\ntornou uma das principais lideranças. Por essa legenda candidatou-se ao\ngoverno do estado de São Paulo nas eleições de 2006, mas não obteve\nêxito.\n\nFoi também consultor da FAO, presidente da Associação Brasileira de\nReforma Agrária (Abra), membro da direção nacional do PT, do Fórum\nNacional pela Reforma Agrária, da Comissão de Justiça e Paz da\nArquidiocese de São Paulo e conselheiro da Fundação Cásper Líbero.\n\nCasou-se com Marieta Azevedo de Arruda Sampaio, com quem teve seis\nfilhos.\n\nPublicou *Capital estrangeiro na agricultura brasileira* e *Construindo\no poder popular*.\n\nMarcelo Costa\n\nFONTES: ARQ. DEP. PESQ. JORNAL DO BRASIL; ASSEMB. NAC. CONST.\n*Repertório* (1987-1988); CÂM. DEP. *Deputados;*CÂM. DEP. *Relação\nnominal dos senhores*; COELHO, J. & OLIVEIRA, A. *Nova*; DEP. PESQ.\nESTADO SP; *Estado de S.* *Paulo*(11/4 e 22/9/61, 23/9/62, 23/5/64,\n25/4/73, 5/6/81, 20 e 22/4/88, 31/1, 27/5 e 14/9/90 e 10/12/96); *Folha\nde S. Paulo* (5/6/81, 5/11/82, 4/6, 23/7, 28/9 e 31/12/86, 22 e 25/5 e\n27/10/87, 20, 26 e 29/4, 11/5, 9 e 13/6 e 7/12/88, 25/12/89, 15 e 19/1,\n20 e 28/5, 22/7 e 5/9/90, 25/2/94, 16/8 e 16/9/95 e 8/7/96); *Globo*\n(8/3, 27 e 28/5 e 3/6/87, 7/12/88, 22/11/89, 23/1 e 19/5/97); *IstoÉ*\n(11/7/90); *Jornal do Brasil*(7/4/74, 29/1/79, 7/6/82, 6/8/85, 11/5/87,\n20/11 e 8/12/88, 26/1 e 9/10/90 e 19/8/95); TRIB. SUP. ELEIT.\n*Dados*(6); *Veja* (23/11/88).\n\n","ref":"FONTES: ARQ. DEP. PESQ. JORNAL DO BRASIL; ASSEMB. NAC. CONST.\n*Repertório* (1987-1988); CÂM. DEP. *Deputados;*CÂM. DEP. *Relação\nnominal dos senhores*; COELHO, J. & OLIVEIRA, A. *Nova*; DEP. PESQ.\nESTADO SP; *Estado de S.* *Paulo*(11/4 e 22/9/61, 23/9/62, 23/5/64,\n25/4/73, 5/6/81, 20 e 22/4/88, 31/1, 27/5 e 14/9/90 e 10/12/96); *Folha\nde S. Paulo* (5/6/81, 5/11/82, 4/6, 23/7, 28/9 e 31/12/86, 22 e 25/5 e\n27/10/87, 20, 26 e 29/4, 11/5, 9 e 13/6 e 7/12/88, 25/12/89, 15 e 19/1,\n20 e 28/5, 22/7 e 5/9/90, 25/2/94, 16/8 e 16/9/95 e 8/7/96); *Globo*\n(8/3, 27 e 28/5 e 3/6/87, 7/12/88, 22/11/89, 23/1 e 19/5/97); *IstoÉ*\n(11/7/90); *Jornal do Brasil*(7/4/74, 29/1/79, 7/6/82, 6/8/85, 11/5/87,\n20/11 e 8/12/88, 26/1 e 9/10/90 e 19/8/95); TRIB. SUP. ELEIT.\n*Dados*(6); *Veja* (23/11/88).\n\n","dic":"DHBB"}
