{"title":"SANTANA, Mílton Soares","cargoss":["Deputado federal"],"cargos_esp":[0],"datas_ini":[1949],"datas_fim":[1951],"estados":["DF"],"autor":[0],"content":"**SANTANA, Mílton Soares**\n\n\\*dep. fed. DF 1949-1951.\n\n*Mílton Soares Santana*nasceu no Estado da Bahia no dia 25 de março de\n1904, filho de Alfredo Soares e de Herondina de Sant’Anna Soares.\n\nFuncionário autárquico, elegeu-se em dezembro de 1945 suplente de\ndeputado pelo Distrito Federal à Assembléia Nacional Constituinte, na\nlegenda do Partido Trabalhista Brasileiro (PTB). Assumiu o mandato\ndurante a legislatura ordinária que se seguiu à promulgação da nova\nConstituição, em julho de 1949. Em outubro de 1950, tentou se reeleger\ndeputado federal, não obtendo sucesso. Deixou a Câmara em janeiro de\n1951, ao final da legislatura.\n\nFONTES: CÂM. DEP. *Deputados;* CÂM. DEP. *Deputados brasileiros.\nRepertório* (1946-1967);**TRIB. SUP. ELEIT. *Dados* (1).\n\n \n","ref":"FONTES: CÂM. DEP. *Deputados;* CÂM. DEP. *Deputados brasileiros.\nRepertório* (1946-1967);**TRIB. SUP. ELEIT. *Dados* (1).\n\n \n","dic":"DHBB"}
