{"title":"SANTOS, Moacir Amaral","cargoss":["Revolucionário ou revoltoso","Ministro do Supremo Tribunal Federal"],"cargos_esp":[0,0],"datas_ini":[1932,1967],"datas_fim":[1932,1972],"estados":[0,0],"autor":[0],"content":"**SANTOS, Moacir Amaral**\n\n\\*magistrado; rev. 1932; min. STF 1967-1972.\n\n \n\n*Moacir Amaral Santos* nasceu em Capivari (SP) no dia 25 de julho de\n1902, filho de José Estêvão dos Santos e de Branca Elisa Vaz do Amaral\nSantos.\n\nBacharelou-se pela Faculdade de Direito de São Paulo em 1925, passando a\nexercer a advocacia em Piracicaba (SP). Retornou à capital do estado no\ninício da década de 1930 e combateu junto às forças paulistas na\nRevolução Constitucionalista de 1932. Com a derrota do movimento, foi\npreso com o comandante do seu batalhão, o coronel Odilon Aquino de\nOliveira.\n\nEm 1945 participou da fundação da União Democrática Nacional (UDN), à\nqual permaneceria vinculado até a extinção do partido em 1965.\n\nEspecializando-se em direito processual civil, tornou-se livre-docente\ndessa cadeira na Faculdade de Direito da Universidade de São Paulo em\n1953 e conquistou a cátedra quatro anos depois. Lecionou a mesma matéria\nna Universidade Mackenzie. Foi também diretor-geral da Câmara Municipal\nde São Paulo e procurador de terras nessa mesma cidade.\n\nSeu escritório de advocacia com Alfredo Cecílio Lopes adquiriu grande\nprestígio e tornou-se tradicional ponto de encontro de udenistas\npaulistanos. Destacou-se em grande número de questões e desempenhou\nimportante papel na constituição da Companhia Siderúrgica Paulista\n(Cosipa), através da elaboração de seus estatutos.\n\nNo dia 6 de outubro de 1967 foi nomeado ministro do Supremo Tribunal\nFederal (STF) pelo presidente da República Artur da Costa e Silva\n(1967-1969), permanecendo no cargo até 25 de julho de 1972, quando foi\naposentado por limite de idade.\n\nDurante sua permanência na capital federal, inaugurou e manteve na\nUniversidade de Brasília um seminário de direito processual.\n\nDe volta a São Paulo, retornou às atividades em seu escritório, então\ndirigido por seu filho.\n\nFoi membro do Instituto dos Advogados de São Paulo.\n\nFaleceu em São Paulo no dia 16 de outubro de 1983.\n\nFoi casado com Elisa Prado Amaral Santos, com quem teve um filho.\n\nPublicou Prova judiciária no cível e comercial; Da responsabilidade dos\nproprietários dos terrenos sobre as construções clandestinamente\nlevantadas pelos comissários compradores; É a ação prevista no artigo\n202 nº XI, letra “a”, do Código de Processo Civil, de natureza real?;\nÍndices alfabéticos da lei de organização municipal e do regimento da\nCâmara Municipal de São Paulo; Direito usual para engenheiros; Da\nreconvenção; Das condições da ação no despacho saneador; Primeiras\nlinhas de direito processual civil e Comentários ao Código de Processo\ncivil.\n\n \n\n \n\nFONTES: COUTINHO, A. Brasil; ENTREV. BIOG.; Estado de S. Paulo (18/10/\n83).\n\n \n","ref":"FONTES: COUTINHO, A. Brasil; ENTREV. BIOG.; Estado de S. Paulo (18/10/\n83).\n\n \n","dic":"DHBB"}
