{"title":"SANTOS, Plínio Ribeiro dos","cargoss":["Deputado federal"],"cargos_esp":[0],"datas_ini":[1955],"datas_fim":[1959],"estados":["MG"],"autor":[0],"content":"**SANTOS, Plínio Ribeiro dos**\n\n\\*dep. fed. MG 1955-1959.\n\n \n\n*Plínio Ribeiro dos Santos* nasceu em Montes Claros (MG) no dia 16 de\nmaio de 1892, filho de Simão Ribeiro dos Santos e de Deolinda da Silva\nSantos.\n\nCursou o secundário no Colégio Benjamin Dias, em Belo Horizonte, e\nformou-se, em 1925, pela Faculdade Livre de Medicina de Minas Gerais.\nDurante o período universitário, fora servidor público estadual. Após\nsua formatura, retornou à sua terra natal, onde passou a clinicar e\nfundou a Casa de Saúde Santa Teresinha. Neste período, foi um dos\nprimeiros profissionais a detectar a existência da doença de Chagas na\nregião.\n\nEm outubro de 1954, obteve uma suplência de deputado federal por Minas\nGerais pela legenda do Partido Social Democrático (PSD), assumindo o\nmandato em março de 1955. Durante a legislatura, formulou projeto de lei\ninstituindo a campanha nacional contra a doença de Chagas. No pleito de\noutubro de 1958, tornou a conseguir uma suplência de deputado federal.\nTerminado o primeiro mandato (31/1/1959), deixou a Câmara, à qual não\nretornou na legislatura seguinte.\n\nEm Montes Claros, participou da organização da Sociedade Educação e\nCultura, voltada para os estudos dos achados arqueológicos do norte de\nMinas, e foi diretor-fundador da Escola Normal, atual Colégio Estadual\nDr. Plínio Ribeiro, do Rotary Club e da Associação Comercial do\nmunicípio. Além disso, tornou-se fazendeiro e proprietário da Fábrica de\nTecidos Santa Helena.\n\nFaleceu em sua cidade natal no dia 8 de dezembro de 1967.\n\nEra casado com Felismina Pimenta Ribeiro.\n\n \n\nFONTES: ASSEMB. LEGISL. MG. *Dicionário biográfico*; CÂM. DEP.\n*Deputados*; *Rev. Arq. Públ. Mineiro* (12/76), TRIB. SUP. ELEIT.\n*Dados* (3 e 4).\n\n \n","ref":"FONTES: ASSEMB. LEGISL. MG. *Dicionário biográfico*; CÂM. DEP.\n*Deputados*; *Rev. Arq. Públ. Mineiro* (12/76), TRIB. SUP. ELEIT.\n*Dados* (3 e 4).\n\n \n","dic":"DHBB"}
