{"title":"SANTOS, Ribeiro dos","cargoss":["Deputado federal","Presidente de associação ou confederação de empregados ou empregadores"],"cargos_esp":[0,"CNI"],"datas_ini":[1951,1954],"datas_fim":[1959,1956],"estados":["BA",0],"autor":[0],"content":"**SANTOS, Ribeiro dos**\n\n\\*dep. fed. BA 1951-1959; pres. CNI 1954-1956.\n\n \n\n*Augusto Viena Ribeiro dos Santos* nasceu em Salvador no dia 29 de\njaneiro de 1917, filho de Álvaro Ribeiro dos Santos e de Dinorá Viana\nRibeiro dos Santos.\n\nFez os estudos secundários no Rio de Janeiro, então Distrito Federal,\ncursando os colégios São Bento e Santo Inácio. Formou-se pela Faculdade\nde Medicina da Bahia.\n\nDiretor-presidente da Companhia Salvador de Seguros a partir de 1938, em\noutubro de 1950 foi eleito deputado federal pela Bahia na legenda da\nAliança Democrática, integrada pela União Democrática Nacional (UDN),\npelo Partido Republicano (PR), ao qual era filiado, o Partido Socialista\nBrasileiro (PSB), o Partido Social Progressista (PSP) e o Partido\nDemocrata Cristão (PDC). Foi empossado em fevereiro de 1951.\n\nSecretário da Confederação Nacional da Indústria (CNI) a partir de\nnovembro de 1952, tornou-se vice-líder do PR na Câmara em fevereiro de\n1953. No ano seguinte foi eleito presidente da CNI, em substituição a\nEuvaldo Lodi. Reeleito deputado federal em outubro de 1954, agora na\nlegenda da Aliança Republicana Cristã, integrada pelo PR e o PDC,\ndurante essa legislatura integrou a Comissão de Economia da Câmara, como\nmembro efetivo, e a Comissão da Bacia do São Francisco, como suplente.\nDeixou a presidência da CNI em 1956, transmitindo o cargo a Lídio\nLunardi. Tentou a reeleição na legenda do PR em outubro de 1958, mas\nobteve apenas uma suplência. Concluído o mandato em janeiro de 1959, não\nretornou à Câmara.\n\nEm 1972 integrou a comissão organizadora da III Conferência Nacional das\nClasses Produtoras (III Conclap), conclave realizado em março do mesmo\nano no Museu de Arte Moderna do Rio de Janeiro, reunindo mais de 1.500\nempresários, diretores e executivos de todos os estados do país. O\nencontro teve como tema geral “a empresa em face do desenvolvimento\nsócio-econômico nacional” e, como objetivos, a integração do\nempresariado brasileiro dentro de uma política de classe, assim como a\nfixação de estratégias operacionais para a conjugação da ação da empresa\ne do Estado, e a afirmação da posição das chamadas classes produtoras no\ncontexto das decisões e realizações nacionais. O seu resultado mais\nimportante foi a divulgação da Carta econômica da Guanabara.\n\nComo empresário, Augusto Viana Ribeiro dos Santos foi também presidente\ndo Sindicato da Indústria de Fiação e Tecelagem e da Federação das\nIndústrias do Estado da Bahia, membro do conselho nacional do Serviço\nSocial da Indústria (Sesi), presidente do conselho regional do Sesi da\nBahia e do conselho regional do Serviço Nacional de Aprendizagem\nIndustrial (Senai) da Bahia, além de diretor da Companhia Empório\nIndustrial do Norte, da Urbania Companhia Nacional de Seguros e da\nUrbania Capitalização. Como médico, dirigiu o Hospital da Sagrada\nFamília.\n\nFaleceu na cidade de São Paulo no dia 20 de fevereiro de 1981.\n\n \n\n \n\nFONTES: CÂM. DEP. Deputados; CÂM. DEP. Relação dos dep.; CÂM. DEP.\nRelação nominal dos senhores; CISNEIROS, A. Parlamentares;****CONF. NAC.\nIND.; CORTÉS, C. Homens; Jornal****do Brasil (22/2/80); TRIB. SUP.\nELEIT. Dados (2, 3 e 4).\n\n \n","ref":"FONTES: CÂM. DEP. Deputados; CÂM. DEP. Relação dos dep.; CÂM. DEP.\nRelação nominal dos senhores; CISNEIROS, A. Parlamentares;****CONF. NAC.\nIND.; CORTÉS, C. Homens; Jornal****do Brasil (22/2/80); TRIB. SUP.\nELEIT. Dados (2, 3 e 4).\n\n \n","dic":"DHBB"}
