{"title":"SANTOS, Sousa","cargoss":["Deputado federal"],"cargos_esp":[0],"datas_ini":[1963],"datas_fim":[1973],"estados":["PI"],"autor":[0],"content":"**SANTOS, Sousa**\n\n\\*dep. fed. PI 1963-1973.\n\n \n\n*Manuel de Sousa Santos*****nasceu no Piauí no dia 23 de dezembro de\n1918, filho****de Arsênio Marcos de Sousa Santos e de Laura Paraguaçu de\nSousa Santos.\n\nIndustrial, elegeu-se deputado federal pelo Piauí no pleito de outubro\nde 1962 na legenda das Oposições Coligadas, que reuniam o Partido Social\nDemocrático (PSD), a União Democrática Nacional (UDN) e o Partido\nDemocrata Cristão (PDC). Assumiu sua cadeira na Câmara dos Deputados em\nfevereiro do ano seguinte. Após o movimento político-militar de março de\n1964, com a extinção dos partidos políticos pelo Ato Institucional nº 2\n(27/10/1965) e a posterior instauração do bipartidarismo, filiou-se à\nAliança Renovadora Nacional (Arena) e nessa legenda foi reeleito\ndeputado federal pelo Piauí no pleito de novembro de 1966. No pleito\nseguinte, de novembro de 1970, elegeu-se mais uma vez à Câmara dos\nDeputados por seu estado ainda na legenda da Arena. Nessa legislatura\nfoi vice-presidente da Comissão de Finanças, membro da Comissão Especial\npara Integração dos Povos da Comunidade de Língua Portuguesa e suplente\ndas comissões de Relações Exteriores, de Segurança Nacional e de\nAgricultura e Política Rural da Câmara.\n\nFaleceu em julho de 1973 em pleno exercício de seu mandato.\n\nFoi casado com Noeme Parente Santos, com quem teve uma filha.\n\n \n\n \n\nFONTES: CÂM. DEP. Deputados; CÂM. DEP. Deputados brasileiros. Repertório\n(6 e 7); CÂM. DEP. Deputados federais. Inventário; TRIB. SUP. ELEIT.\nDados (6, 8 e 9).\n\n \n","ref":"FONTES: CÂM. DEP. Deputados; CÂM. DEP. Deputados brasileiros. Repertório\n(6 e 7); CÂM. DEP. Deputados federais. Inventário; TRIB. SUP. ELEIT.\nDados (6, 8 e 9).\n\n \n","dic":"DHBB"}
