{"title":"AFONSO, Emiliano Estanislau","cargoss":["Interventor"],"cargos_esp":[0],"datas_ini":[1945],"datas_fim":[1946],"estados":["AM"],"autor":[0],"content":"**AFONSO, Emiliano Estanislau**\n\n\\*magistrado; interv.****AM 1945-1946.\n\n* *\n\n*Emiliano Estanislau Afonso* nasceu em Soledade (PB) no dia 2 de junho\nde 1881, filho de Gerôncio Estanislau Afonso e de Maria Amélia Castor de\nAraújo.\n\nFormou-se pela Faculdade de Direito de Pernambuco.\n\nTransferindo-se para o estado do Amazonas, ingressou na magistratura.\nPresidia em 1945 o Tribunal de Justiça do Amazonas. Com a deposição de\nVargas em 29 de outubro de 1945, os governos estaduais foram ocupados\npelos chefes do Poder Judiciário local. Assim, exerceu a interventoria\nno Amazonas de 7 de novembro de 1945 a 16 de fevereiro de 1946.\n\nFoi ainda desembargador e, por diversas vezes, chefe de Polícia. Não\nchegou a se candidatar a nenhum cargo público.\n\nFaleceu em Manaus no dia 22 de agosto de 1961.\n\nEra casado com sua prima, Cléa Rita de Miranda Estanislau Afonso, com\nquem teve sete filhos.\n\n \n\nFONTES: *Grande encic. Delta*; INF. FAM.; POPPINO, *R. Federal*.\n\n \n","ref":"FONTES: *Grande encic. Delta*; INF. FAM.; POPPINO, *R. Federal*.\n\n \n","dic":"DHBB"}
