{"title":"SCANAGATTA, Jaci","cargoss":["Constituinte","Deputado federal"],"cargos_esp":[0,0],"datas_ini":[1987,1987],"datas_fim":[1988,1991],"estados":[0,"PR"],"autor":[0],"content":"**SCANAGATTA, Jaci**\n\n\\*const. 1987-1988; dep. fed. PR 1987-1991.\n\n \n\n*Jaci Miguel Scanagatta* nasceu em Erechim (RS) em 27 de setembro de\n1934, filho de Fiorelo Luciano Scanagatta e Mística Berta Scanagatta.\n\nCursou o segundo grau. Transferiu-se para Santa Catarina, onde\ndedicou-se à atividade madeireira. Em 1954 estabeleceu-se em\nFlorianópolis. Cinco anos depois fixou-se em Cascavel (PR), à procura de\nnovas fronteiras para exploração de madeiras. Em outubro de 1965\nelegeu-se vice-prefeito de Cascavel na legenda da Aliança Renovadora\nNacional (Arena), partido de sustentação do regime militar instalado no\npaís em abril de 1964.\n\nAfastou-se da política entre 1970 e 1976, quando elegeu-se prefeito de\nCascavel 1976. Com o fim do bipartidarismo, em 29 de novembro de 1979,\ningressou no Partido Democrático Social (PDS). Ao final do mandato,\nafastou-se mais uma vez da carreira política. Voltou a candidatar-se em\nnovembro de 1986 e elegeu-se deputado federal constituinte, agora na\nlegenda do Partido da Frente Liberal (PFL).\n\nFoi indicado membro titular da Subcomissão dos Negros, Populações\nIndígenas, Pessoas Deficientes e Minorias, da Comissão da Ordem Social,\ne suplente da Subcomissão da União, Distrito Federal e Territórios, e da\nComissão da Organização do Estado. Nas principais votações da Assembléia\nNacional Constituinte votou contra o rompimento de relações diplomáticas\ncom países onde vigora política de discriminação racial, a limitação do\ndireito de propriedade privada, o mandado de segurança coletivo, a\nremuneração 50% superior para o trabalho extra, a jornada semanal de 40\nhoras, o turno ininterrupto de seis horas, a unicidade sindical, a\nsoberania popular, o voto aos 16 anos, o limite de 12% ao ano para os\njuros reais, a limitação dos encargos da dívida externa, a criação de um\nfundo de apoio à reforma agrária e a desapropriação da propriedade\nprodutiva. Votou a favor da pena de morte, do presidencialismo, do\nmandato de cinco anos para o presidente José Sarney e da legalização do\njogo do bicho.\n\nCom a promulgação da nova Constituição, em 05 de outubro de 1988, voltou\na participar dos trabalhos legislativos ordinários. Encerrou seu mandato\nna Câmara dos Deputados em janeiro de 1991. Não tentou a reeleição, mas\ncontinuou filiado ao PFL e atuando na política de Cascavel. Coordenou na\nregião a campanha vitoriosa de Jaime Lerner ao governo do Paraná em\noutubro de 1994. Em maio de 1998 assumiu a presidência do PFL de\nCascavel.\n\nNos anos seguintes afastou-se da militância partidária dedicando-se\nprimordialmente às atividades empresariais na região de Cascavel\nadministrando as propriedades do grupo Scanagatta. Foi também\nproprietário da emissora de rádio CBN inaugurada em Cascavel a partir de\n2007 e da empreiteira Petrocon e da concessionária Camagril, loja de\nimplementos agrícolas da Massey Ferguson localizada na mesma cidade.\n\nEm agosto de 2007, depois de sete anos sem partido, Scanagatta filiou-se\nao PDT, sendo mencionado em várias pesquisas de opinião como potencial\ncandidato à prefeito da cidade no pleito de outubro de 2008. Chegou ser\nlançado pré-candidato à prefeitura da cidade por alguns\ncorreligionários, entretanto acabou sendo preterido em seu partido pelo\ncandidato Edgard Bueno, que venceu as eleições com 50.915 votos (34,8%\ndos votos válidos).\n\nApós o fracasso na tentativa de candidatar-se à prefeitura de Cascavel,\nretornou à administração de seu conglomerado empresarial e de suas\npropriedades agrícolas.  \n\nCasou-se com Irma Scanagatta, com quem teve quatro filhos.\n\n \n\nFONTES: ASSEMB. NAC. CONST. *Repertório* (1987-1988); COELHO, J. &\nOLIVEIRA, A. *Nova*; http://www.cbncascavel.com.br (acesso em:\n14/12/2009); http://www.camagril.com.br/ (acesso em: 14/12/2009).\n\n \n","ref":"FONTES: ASSEMB. NAC. CONST. *Repertório* (1987-1988); COELHO, J. &\nOLIVEIRA, A. *Nova*; http://www.cbncascavel.com.br (acesso em:\n14/12/2009); http://www.camagril.com.br/ (acesso em: 14/12/2009).\n\n \n","dic":"DHBB"}
