{"title":"SCHERER, Vicente","cargoss":["Arcebispo"],"cargos_esp":["Porto Alegre"],"datas_ini":[1946],"datas_fim":[1981],"estados":[0],"autor":[0],"content":"**SCHERER, Vicente**\n\n\\*religioso; arceb. Porto Alegre 1946-1981.\n\n \n\n*Alfredo Vicente Scherer* nasceu em Bom Princípio, município de São\nSebastião do Caí (RS), em 5 de fevereiro de 1903, filho de Pedro Scherer\ne de Ana Offermann Scherer.\n\nFez os estudos preliminares no Colégio Paroquial de Bom Princípio. Aos\n11 anos ingressou no Seminário Provincial de São Leopoldo (RS), onde\nconcluiu o curso secundário e iniciou seus estudos teológicos. Em 1924\ningressou na Pontifícia Universidade Gregoriana, em Roma, onde se\ndoutorou em teologia. Recebeu a sua ordenação sacerdotal em abril de\n1926.\n\nNo ano seguinte retornou ao Brasil e, em janeiro de 1928, foi nomeado\nsecretário particular do arcebispo de Porto Alegre, dom João Becker.\nComo secretário, atuou na paróquia de Guaíba dirigida por seu irmão, o\ncônego Estanislau Scherer, e organizou as paróquias de Barra do Ribeiro\ne de Tapes, no interior do estado.\n\nCom o início da Revolução de Outubro de 1930, liderada por Getúlio\nVargas, valendo-se de sua condição de secretário particular de dom João\nBecker, convenceu o arcebispo a enviá-lo para Itararé (SP), onde estavam\nas forças gaúchas, para atuar como capelão militar das tropas\nrevolucionárias, as quais acompanhou até o Rio de Janeiro.\n\nApós a vitória do movimento, retornou a Porto Alegre e reassumiu suas\nfunções de secretário, que desempenhou até 1934. Em março de 1935\ntornou-se vigário da paróquia de São Geraldo, bairro de Porto Alegre de\ngrande concentração operária, o que lhe possibilitou travar contato com\nos problemas vividos pelos trabalhadores. Permaneceu à frente dessa\nparóquia até 1945.\n\nEleito bispo, foi nomeado em junho de 1946 bispo-auxiliar da\narquidiocese de Porto Alegre. Com a morte de dom João Becker, ocorrida\nnaquele mesmo mês, assumiu provisoriamente a direção da arquidiocese por\neleição do Cabido Metropolitano. Em dezembro desse mesmo ano foi nomeado\npelo papa Pio XII arcebispo de Porto Alegre, sendo confirmado\ndefinitivamente no cargo em fevereiro de 1947, quando dom Carlos\nChiarlo, núncio apostólico no Brasil, lhe conferiu a ordenação\nepiscopal. Dois anos mais tarde planejou e dirigiu os trabalhos do 5º\nCongresso Eucarístico Nacional, em Porto Alegre.\n\nEm 1952 integrou a comissão central para a criação da Conferência\nNacional dos Bispos do Brasil (CNBB) e, após sua fundação em outubro\ndaquele ano, foi eleito para dirigir um dos seus organismos, o\nSecretariado Nacional do Apostolado dos Leigos.\n\nÀ frente da arquidiocese de Porto Alegre, criou em 1957 o Secretariado\nde Ação Social, que edificou e dirigiu a Cidade de Deus, constituída de\ncasas para populações carentes. Em fevereiro de 1961 instituiu a\nSociedade Fraterno Auxílio, destinada a proporcionar assistência aos\nsacerdotes diocesanos inválidos por enfermidade ou velhice. Construiu,\nnas localidades de Bom Princípio e Arroio do Meio, dois seminários para\nmenores e organizou o seminário de maiores na localidade de Viamão.\nErigiu a Escola Normal Rural Estrela da Manhã, destinada à formação de\nprofessores rurais, e reformou o antigo prédio do seminário de Porto\nAlegre, adaptando-o às funções de residência episcopal e sede da Cúria\nMetropolitana.\n\nEm junho de 1961 iniciou o programa radiofônico semanal *A voz do\npastor*, em que se dirigia à população gaúcha, e que era transmitido\ntodas as segundas-feiras pela Rádio Difusora de Porto Alegre. Em seu\nprimeiro pronunciamento nesse programa, abordou o problema social do\nmenor abandonado, afirmando que “a causa verdadeira e última do abandono\ne da delinqüência da infância e da juventude está na desorganização da\nfamília”.\n\nCom a renúncia do presidente Jânio Quadros em 25 de agosto de 1961 e o\nveto dos principais chefes militares a que o seu substituto\nconstitucional, o vice-presidente João Goulart, fosse empossado na\npresidência da República, desencadeou-se uma grave crise política no\npaís. No Rio Grande do Sul, o governador Leonel Brizola, cunhado de João\nGoulart e fiel à Constituição, organizou um movimento de resistência à\noposição militar lançando a “campanha da legalidade”, com o objetivo de\nassegurar a posse do vice-presidente. O general José Machado Lopes,\ncomandante do III Exército, sediado em Porto Alegre, recebeu ordens do\nministro da Guerra, general Odílio Denis, para atacar o palácio do\ngoverno estadual e terminar com a campanha.\n\nAtendendo ao pedido de Neusa Brizola, esposa do governador, dom Vicente\nScherer compareceu ao palácio, afirmando que “seria capaz de sentar em\nfrente ao palácio se houvesse o ataque”. A partir desse momento, o\narcebispo se ofereceu para atuar como mediador entre as duas partes. Sua\nparticipação contribuiu decisivamente para que o clima de guerra\nreinante na capital gaúcha fosse desfeito. O general Machado Lopes\nintegrou-se ao movimento em favor da posse de Goulart, declarando que\nnão cumpriria as ordens ministeriais. Com isso, o III Exército\ncolocava-se em confronto com o poder central. No início de setembro de\n1961, como forma de contornar a ameaça de guerra civil, foi adotado,\npelo Congresso, o regime parlamentarista, garantindo-se, com isso, a\nposse de João Goulart na presidência da República, no dia 7 daquele mês.\n\nNo fim de 1961, com o apoio do governador Brizola, crescia no Rio Grande\ndo Sul o movimento de agricultores sem terra visando a uma reforma\nagrária. Contrapondo-se a esse movimento, dom Vicente Scherer fundou a\nFrente Agrária Gaúcha (FAG), para organizar os trabalhadores do campo\ncontrários à reforma agrária. Mais tarde, essa frente congregaria todos\nos sindicatos rurais do estado, dando origem à Federação dos\nTrabalhadores na Agricultura (Fetag) do Rio Grande do Sul.\n\nEm outubro de 1962, foi designado membro da Comissão Doutrinária para a\nFé e os Costumes, que trabalhou na preparação de importantes documentos\npara o Concílio Ecumênico Vaticano II, aberto pelo papa João XXIII.\nNesse mesmo mês, quando do início do concílio, foi eleito pelos padres\nconciliares para integrar a Comissão Teológica.\n\nEm 1966, dois anos após a eclosão do movimento político-militar de 31 de\nmarço de 1964, que depôs o presidente João Goulart, ocorriam no país\nlutas generalizadas do movimento estudantil contra a política do\ngoverno. Nessa época, em julho, quando dom Vicente Scherer ainda se\nencontrava à frente do Secretariado Nacional do Apostolado dos Leigos da\nCNBB, realizou-se o XIV Conselho Nacional da Juventude Universitária\nCatólica (JUC). Nesse encontro, os congressistas, aprofundando\ntendências esboçadas em 1962, quando boa parte de seus membros havia\ncriado a Ação Popular (AP) — organização política que tinha como\nobjetivo a transformação radical da sociedade brasileira num sentido\nsocialista —, aprovaram resolução definitiva de ruptura com a hierarquia\nda Igreja. Pela nova resolução, não mais se reconheciam como Ação\nCatólica ou qualquer forma de organização que se definisse como extensão\ndo apostolado hierárquico. Após o rompimento, o prelado gaúcho divulgou\ndocumento aos arcebispos do Brasil assinalando a inconformidade das\naspirações da Ação Popular com a linha pastoral da Igreja.\n\nAinda em 1966 dom Vicente desagradou ao regime militar ao ler sua\npalestra no programa A voz do pastor na missa pelas vítimas da Intentona\nComunista, na qual advertia: “Não é só com armas que se vence o\ncomunismo, é preciso organização social, é preciso pão na mesa.”\n\nEm 1967, participou do sínodo dos bispos em Roma, como um dos\nrepresentantes brasileiros, e, em fevereiro de 1968, foi nomeado, pelo\npapa Paulo VI, membro da Sagrada Congregação para os Bispos. Cardeal em\nabril de 1969, no mês seguinte, por nomeação do papa Paulo VI, passou a\nintegrar a Sagrada Congregação para a Evangelização dos Povos. Nesse\nmesmo ano tornou-se secretário da CNBB para a região Sul-3.\n\nNo fim de 1970, com a nomeação de dom Agnelo Rossi, presidente em\nexercício da CNBB, para o cargo de prefeito da Sagrada Congregação para\nEvangelização dos Povos, com sede no Vaticano, dom Vicente Scherer,\nvice-presidente da entidade, ocupou interinamente a presidência,\npermanecendo no cargo até fevereiro de 1971, quando então foram\nconvocadas eleições para o preenchimento dos cargos titulares. Nessas\neleições, concorreu, com o apoio dos conservadores, à presidência da\nCNBB, obtendo no pleito apenas 65 votos, contra os 105 dados a dom\nAluísio Lorscheider. Para secretário-geral foi eleito dom Ivo\nLorscheiter, bispo-auxiliar da arquidiocese de Porto Alegre e primo de\ndom Aluísio.\n\nPor ocasião do I Encontro Nacional de Comunidades de Base, realizado sob\no lema “Igreja que nasce do povo pelo Espírito Santo”, em janeiro de\n1975, em Vitória, dom Vicente condenou as teses defendidas no encontro\npelas suas características “antieclesiais e anticristãs”. Segundo o\ncardeal, essas teses se afastavam “cada vez mais da genuína doutrina\ncristã e católica e evidenciam sua identificação com as diretrizes\nfundamentais do sistema ideológico do marxismo”. Em uma alocução\nradiofônica feita no programa *A voz do pastor*em dezembro de 1976,\ncriticou o documento divulgado pela Comissão Representativa da CNBB sob\no título *Comunicado pastoral ao povo de Deus*,**no qual se denunciavam\nos assassinatos dos padres Rodolfo Lunkenbein — em meio a um conflito\nentre fazendeiros e índios em julho em Mato Grosso — e João Penido\nBurnier — morto numa delegacia do povoado de Ribeirão Bonito, em Barra\ndo Garças (MT), ao reclamar contra a prisão e a tortura sofridas por\nduas mulheres — e o seqüestro do bispo de Nova Iguaçu, dom Adriano\nHipólito. Nessa ocasião, o prelado gaúcho afirmou que o documento\n“procurava fomentar uma crise entre a Igreja e o governo no Brasil,\natravés de uma campanha apaixonada e caluniosa”.\n\nEm 31 de dezembro de 1979, quando saía dos estúdios da Rádio Difusora,\nonde acabara de gravar seu programa, foi seqüestrado no centro de Porto\nAlegre por dois homens. Golpeado a faca várias vezes, foi humilhado\npelos assaltantes que o obrigaram a se despir completamente e o\nabandonaram em lugar ermo. O episódio teve enorme repercussão e mereceu\ncondenação por parte de várias personalidades e autoridades no país. O\npróprio ministro da Justiça, Petrônio Portela, afirmou ter sido o\ncardeal “alvo de um ato de terror, sem contudo poder concluir pela\nconotação política de grupos radicais de direita ou de esquerda”. Essa\ndúvida deveu-se à onda de violência reinante no país, praticada por\ngrupos armados de extrema direita contra autoridades eclesiásticas, que\njá haviam atacado os bispos dom Adriano Hipólito, dom Luciano Mendes de\nAlmeida e dom Estêvão Avelar.\n\nDepois do seqüestro, declarou que “reagiria a bala contra os assaltantes\nse tivesse uma arma”. A declaração gerou muita polêmica na imprensa,\npela possibilidade de vir a ser interpretada como uma recomendação para\nque as pessoas andassem armadas. Tal fato provocou a intervenção de dom\nIvo Lorscheiter, então presidente da CNBB, que, em favor do religioso,\nobservou: “Deus põe a pessoa no mundo com vida, e o ser humano deve\ndefender essa vida.”\n\nNo início de janeiro de 1980 foi divulgado em Madri, pelo jornal *El\nPaís,*um documento secreto da Sagrada Congregação para a Doutrina da Fé,\nsediada em Roma, pelo qual se concluía que dom Vicente Scherer e dom\nUmberto Mozzoni, na época núncio apostólico no Brasil, tinham sido os\nresponsáveis, em 1972, pelo pedido de avaliação, por aquela congregação,\ndo livro *Jesus Cristo libertador,* de Leonardo Boff, padre e teólogo\nbrasileiro idealizador da Teologia da Libertação, publicado naquele ano\ne considerado pouco ortodoxo. Após a avaliação, a Congregação para a\nDoutrina da Fé recomendara a Boff mais prudência em relação às suas\nfuturas publicações.\n\nDe visita ao Brasil, o cardeal Agnelo Rossi, prefeito da Sagrada\nCongregação para a Evangelização dos Povos, em Roma, advertiu, em\nentrevista em abril de 1981, que estava sendo gravado na Europa, em\nfitas cassete, por alguns teólogos da libertação, um programa de\nevangelização de conteúdo marxista destinado à politização das\ncomunidades eclesiais de base (CEBs) no Brasil. Em seguida, em\ncomunicado de Roma, dom Agnelo Rossi confirmou e documentou a\nadvertência. No mês seguinte, no Brasil, depois de ouvir as gravações no\nVaticano, dom Vicente Scherer corroborou a denúncia afirmando que\nconsiderava o programa “uma grosseira blasfêmia, deturpação de tudo\nquanto existe de sagrado nos Evangelhos” e que, portanto, “não\npermitiria a divulgação das fitas nas comunidades eclesiais de base do\nRio Grande do Sul”.\n\nSempre fiel****ao lema “Sou enviado para evangelizar”, inscrito em seu\nescudo episcopal, voltou a repudiar o envolvimento de padres e bispos\ncom a atividade política. Assim, quando, em julho de 1981,\naproximadamente seiscentas famílias de agricultores sem terras,\nacampadas desde fevereiro em Ronda Alta (RS), decidiram não aceitar\npropostas do governo de transferência para outras regiões, criticou a\nparticipação, nesse movimento, do bispo de São Félix do Araguaia, dom\nPedro Casaldáliga, e de outros religiosos ligados à Comissão Pastoral da\nTerra (CPT).\n\nAos 75 anos, conforme orientação seguida pela Igreja Católica,\nencaminhou ao papa Paulo VI seu pedido de renúncia à direção do\narcebispado de Porto Alegre. Entretanto, esperou três anos para que\nfosse aceito seu afastamento, que só ocorreu em 16 de setembro de 1981,\nquando foi substituído por dom Cláudio Colling, bispo de Passo Fundo\n(RS), o primeiro bispo que ordenou.\n\nEm seguida retirou-se para trabalhar como auxiliar do capelão do\nHospital Divina Providência, em Porto Alegre, e como padre de uma vila\nde operários nas imediações do hospital. Em janeiro de 1982 assumiu o\ncargo de provedor da Santa Casa de Misericórdia, único hospital de\nindigentes do estado, com a missão de resolver os graves problemas\nfinanceiros da instituição.\n\nAtravés de seu programa radiofônico continuou se manifestando\npublicamente diante dos acontecimentos. Assim, durante o governo militar\ndo general Figueiredo (1979-1985), em janeiro de 1983 condenou as\n“mordomias e as dispendiosas viagens ao exterior de membros do governo”\nque não eram “entendidas pelo povo”. Em contrapartida observou que o\nexemplo deveria partir do governo, que declarara que aquele ano seria de\n“graves dificuldades e pesados sacrifícios”.\n\nDois meses mais tarde, ao comentar a “despolitização” da Igreja em\nconseqüência da abertura, anunciada pelo presidente da CNBB, dom Ivo\nLorscheiter, considerou que a democratização seria “apenas uma\nreferência à fase nacional em que entramos; as circunstâncias mudam, mas\no norte, os princípios da Igreja, ficam sempre os mesmos. Nós não temos\ne não teremos soluções para oferecer em matéria de política e de\neconomia, mas temos a obrigação de defender a justiça e os direitos\nhumanos em qualquer circunstância, sem partidarismos”.\n\nEm abril, lembrando a aproximação do Dia do Trabalho e o centenário da\nmorte de Karl Marx, reconheceu neste “a tomada de consciência que seus\nescritos despertaram na classe trabalhadora contra as injustiças\nintoleráveis e as explorações de que eram vítimas indefesas no início da\nera industrial e o são infelizmente ainda hoje em grande escala”. Como\num dos expoentes da corrente conservadora da Igreja, condenou, contudo,\no sistema ideológico marxista, porque “submete o homem\nincondicionalmente ao partido e ao Estado, que dele dispõem\nsoberanamente para o êxito e o triunfo da causa comunista”.\n\nEm julho de 1985, apoiou o protesto da Conferência Episcopal da\nNicarágua, formalizado à CNBB, denunciando a ingerência religiosa\nbrasileira em assuntos internos do país. Quanto às referências feitas no\ndocumento à atuação de dom Pedro Casaldáliga e de dom Paulo Evaristo\nArns, condenou a interferência de padres brasileiros em questões\nestritamente peculiares de uma determinada nação, se recusando contudo a\njulgar as atitudes dos dois religiosos.\n\nPor ocasião da comemoração dos duzentos anos da Revolução Francesa, em\nmarço de 1989, no seu programa de rádio definiu os líderes daquela\nrevolução como “desvairados e delirantes”, observando que os donos do\npoder deveriam se “prevenir para evitar iniciativas violentas e injustas\nde multidões desesperadas e revoltadas” como aquela.\n\nFaleceu em 9 de março de 1996, de insuficiência respiratória, na capital\ngaúcha. Seu corpo foi enterrado na nave lateral da Catedral\nMetropolitana de Porto Alegre.\n\n \n\nFONTES: BALEM, J. *Bispos*;**CONFERÊNCIA NAC. BISPOS DO BRASIL;\nCOUTINHO, A*. Brasil*;*Encic. Mirador*;*Estado de S. Paulo* (3/4 e\n28/12/76, 8/2/77, 5/10 e 16/12/80, 13/5, 16/6, 24/7, 9/8, 3, 16 e 17/9,\n6, 9 e 13/12/81); GARDEL, L. *Armoiries*;*Globo* (8/2/77, 2/1/80, 16/6,\n24/7 e 16/9/81 e 3/1/82);*Grande encic. Delta.*\n\n \n\n \n","ref":"FONTES: BALEM, J. *Bispos*;**CONFERÊNCIA NAC. BISPOS DO BRASIL;\nCOUTINHO, A*. Brasil*;*Encic. Mirador*;*Estado de S. Paulo* (3/4 e\n28/12/76, 8/2/77, 5/10 e 16/12/80, 13/5, 16/6, 24/7, 9/8, 3, 16 e 17/9,\n6, 9 e 13/12/81); GARDEL, L. *Armoiries*;*Globo* (8/2/77, 2/1/80, 16/6,\n24/7 e 16/9/81 e 3/1/82);*Grande encic. Delta.*\n\n \n\n \n","dic":"DHBB"}
