{"title":"SERPA, Ivan da Silveira","cargoss":["Comandante do II Distrito Naval","Chefe do Estado-Maior da Armada","Ministro da Marinha"],"cargos_esp":[0,0,0],"datas_ini":[1987,1992,1992],"datas_fim":[1988,1992,1994],"estados":[0,0,0],"autor":[0],"content":"**SERPA, Ivan da Silveira**\n\n\\*militar; comte. II DN 1987-1988; ch. EMA 1992; min. Mar. 1992-1994.\n\n* *\n\n*Ivan da Silveira Serpa***nasceu no Rio de Janeiro, então Distrito\nFederal,**no dia 30 de dezembro de 1932, filho de Gastão da Silveira\nSerpa e de Ida de Carvalho Serpa.\n\nAspirante à Marinha de Guerra, ingressou na Escola Naval em fevereiro de\n1949, sendo promovido a guarda-marinha do corpo de Armada em janeiro de\n1953, e em março do ano seguinte a segundo-tenente. Designado para\nservir a bordo do cruzador *Barroso* em maio de 1955, foi promovido a\nprimeiro-tenente em outubro. Deixou o navio em dezembro de 1957, para\nfrequentar o curso de comunicações navais que concluiria dois anos\ndepois. Primeiro-tenente desde novembro de 1958, serviu no Estado-Maior\nda Armada (EMA) de janeiro a novembro de 1959, quando assumiu a função\nde instrutor do Centro de Adestramento Almirante Marques de Leão.\n\nApós ter feito o curso de guerra antissubmarina, nos Estados Unidos, e\njá desligado das tarefas de instrução, tornou-se ajudante de ordens do\ncomando do estado-maior da Armada. Chefe de departamento do\ncontratorpedeiro *Pernambuco*, em julho de 1962, em dezembro foi\npromovido a capitão de corveta. Em 1963, voltou aos Estados Unidos, onde\nfez o curso de tática antissubmarina, e em novembro foi designado para o\nCentro de Instrução Almirante Wandenkolk. Transferido para o\nestado-maior da Armada em abril de 1964, e designado instrutor da\nAcademia Naval (EUA) em agosto de 1966, e da Escola Naval (RJ) em\noutubro de 1967, foi promovido a capitão de fragata em dezembro desse\nano. De fevereiro de 1969 a janeiro de 1970, fez o curso de comando de\nestado-maior na Escola de Guerra Naval (EGN).\n\nEm março de 1970, foi designado para o comando do Centro de Instrução\nAlmirante Tamandaré. Nomeado oficial do estado-maior da Esquadra em\nmarço de 1971, em dezembro recebeu o comando do contratorpedeiro\n*Piauí*. Estagiário da Escola Superior de Guerra (ESG), de março a\ndezembro de 1973, foi promovido ao posto de capitão de mar e guerra. De\nmarço de 1974 a janeiro de 1975, fez o curso superior de guerra naval na\nEGN, assumindo em março a chefia do estado-maior da força de\ncontratorpedeiros. Chefe do estado-maior do II Distrito Naval, sediado\nem Salvador, em maio de 1976, um ano depois se tornou comandante do\nesquadrão de contratorpedeiros, até setembro de 1978, quando assumiu o\ncargo de vice-diretor da Escola Naval.\n\nSubchefe do Comando de Operações Navais em julho de 1980, em novembro\nfoi promovido contra-almirante. De janeiro de 1983 a fevereiro de 1984,\nexerceu o comando da força de contratorpedeiros. Diretor da Escola Naval\naté março de 1985, já como vice-almirante assumiu em abril a diretoria\nde ensino da Marinha.\n\nVice-chefe do estado-maior da Armada um ano depois, foi nomeado\ncomandante do II DN em abril de 1987, e em agosto de 1988 designado\ncomandante em chefe da esquadra. Promovido a almirante de esquadra em\nmarço de 1990, no mês seguinte assumiu a diretoria-geral de pessoal da\nMarinha. Comandante de Operações Navais e diretor-geral de navegação em\njunho de 1991, em maio de 1992 foi nomeado chefe do estado-maior da\nArmada.\n\nTransferido para a reserva, em outubro de 1992 tornou-se ministro da\nMarinha no governo de Itamar Franco (1992-1994). Crítico do Ministério\nde Defesa, na sua opinião incapaz de solucionar o problema da falta de\nrecursos, mas que em contrapartida poderia provocar o surgimento dentro\ndos quartéis de milícias ligadas aos vários segmentos envolvidos na\ndisputa pelo poder, Ivan Serpa argumentava que somente necessidades\nmilitares, e não políticas, deveriam determinar a criação do órgão.\n\nEm 12 de dezembro de 1993, atendendo à solicitação do ministro da\nJustiça, Maurício Correia, Serpa encaminhou-lhe documento confidencial\nrevelando que diversas pessoas entre as 144 dadas como desaparecidas\nhaviam sido mortas depois de presas pelos órgãos de repressão política,\ndurante o regime militar. O documento dizia ainda que a Marinha possuía\ninformações sobre a atuação no Brasil da Agência Central de Inteligência\n(CIA) norte-americana e que militares brasileiros chegaram a efetuar\nprisões na Argentina.\n\nEm 1994, o ministro Serpa declarou aos jornais que a responsabilidade\npela crescente onda de criminalidade e violência no Rio de Janeiro cabia\nao governador Leonel Brizola (1991-1995). Destacando a ineficácia da\npolícia, frisou que a ação das forças armadas no estado só poderia durar\nalgum tempo, jamais ser permanente.\n\nEm 1º de janeiro de 1995, passou a pasta ao almirante de esquadra Mauro\nCésar Pereira, novo ministro da Marinha do governo Fernando Henrique\nCardoso. Em seguida, por dois anos, foi conselheiro militar da missão\nmilitar brasileira junto à ONU.\n\nCasou-se com Solange Garcia Lopes, com quem teve dois filhos.\n\nFONTES:**ARQ. MIN. MAR.; *Folha de S. Paulo* (12/12/93); *Globo*\n(3/10/92); *Jornal do Brasil* (18/11/92).\n\n \n","ref":"FONTES:**ARQ. MIN. MAR.; *Folha de S. Paulo* (12/12/93); *Globo*\n(3/10/92); *Jornal do Brasil* (18/11/92).\n\n \n","dic":"DHBB"}
