{"title":"SETÚBAL, Laerte","cargoss":["Deputado federal"],"cargos_esp":[0],"datas_ini":[1935],"datas_fim":[1937],"estados":["SP"],"autor":[0],"content":"**SETÚBAL, Laerte**\n\n\\*dep. fed. SP 1935-1937.\n\n \n\n*Laerte Setúbal* nasceu em Tatuí (SP) no dia 13 de setembro de 1888,\nfilho de Antônio de Oliveira Nobre Setúbal e de Maria Teresa Nobre\nSetúbal. Seu irmão, Paulo Setúbal, foi jornalista e escritor.\n\nEstudou no Ginásio do Estado e bacharelou-se em ciências jurídicas e\nsociais pela Faculdade de Direito de São Paulo em 1910, iniciando suas\natividades profissionais no ano seguinte.\n\nNo pleito de outubro de 1934 foi eleito deputado federal por São Paulo,\nna legenda do Partido Republicano Paulista (PRP), ocupando uma cadeira\nna Câmara dos Deputados de maio de 1935 a novembro de 1937, quando o\nadvento do Estado Novo (1937-1945) suprimiu os órgãos legislativos do\npaís. Em junho de 1937 foi um dos fundadores da União Democrática\nBrasileira (UDB), legenda extinta pelo Decreto nº 37, de dezembro do\nmesmo ano, também após a instalação do Estado Novo. Passou então a\ntrabalhar como advogado em escritório próprio.\n\nFoi membro do Instituto dos Advogados e colaborador dos Diários\nAssociados e da Revista dos Tribunais.\n\nFaleceu em Valinhos (SP) no dia 28 de novembro de 1967.\n\nEra casado com Maria Júlia de Toledo Setúbal, com quem teve quatro\nfilhos, entre eles o empresário paulista Laerte Setúbal Filho, que foi\ndiretor da Federação das Indústrias do Estado de São Paulo (FIESP) e\npresidente da Associação dos Exportadores Brasileiros (AEB). Seu\nsobrinho, Olavo Setúbal, foi prefeito da cidade de São Paulo de 1975 a\n1979 e ministro das Relações Exteriores entre 1985 e 1986, durante o\ngoverno de José Sarney (1985-1990).\n\n \n\nFONTES: *Boletim Min. Trab*. (5/36); *Diário do Congresso Nacional*;\nINF. FAM.; *Jornal do Brasil* (17/9/78); LEITE, A. *História*;\n*Personalidades*.\n\n \n","ref":"FONTES: *Boletim Min. Trab*. (5/36); *Diário do Congresso Nacional*;\nINF. FAM.; *Jornal do Brasil* (17/9/78); LEITE, A. *História*;\n*Personalidades*.\n\n \n","dic":"DHBB"}
