{"title":"SIFFERT, Geraldo","cargoss":["Deputado federal"],"cargos_esp":["GB"],"datas_ini":[1962],"datas_fim":[1963],"estados":[0],"autor":[0],"content":"**SIFFERT, Geraldo**\n\n\\* militar; dep. fed. GB 1962-1963.\n\n** **\n\n*Geraldo Siffert*nasceu em Porto Novo da Cunha (MG), no dia 18 de agosto\nde 1912, filho de Pantaleão Siffert e de Augusta Georg Siffert.\n\nRealizou seus estudos no Ginásio 28 de Setembro, no Rio de Janeiro,\nentão Distrito Federal, e na Escola Militar de Realengo, também no Rio\nde Janeiro, formando-se em engenharia metalúrgica em 1936.\n\nIniciou sua vida política em 1954, quando candidatou-se a uma vaga na\nCâmara dos Deputados, pela legenda do Partido Social Progressista (PSP),\nnão conseguindo se eleger. No pleito de outubro de 1958 conseguiu se\neleger suplente de deputado federal, pela legenda da União Democrática\nNacional (UDN). Assumiu o mandato em novembro de 1962, exercendo-o até\njaneiro do ano seguinte, quando deixou a Câmara, não tendo conseguido a\nreeleição no pleito de outubro de 1962, pela legenda udenista.\n\nComo militar alcançou a patente de general-de-brigada.\n\n \n\nFONTES: CÂM. DEP. *Deputados brasileiros. Repertório*(1826-1976 e\n1946-1967).\n\n \n","ref":"FONTES: CÂM. DEP. *Deputados brasileiros. Repertório*(1826-1976 e\n1946-1967).\n\n \n","dic":"DHBB"}
