{"title":"SILVA, Bento de Barros Machado da","cargoss":["Chefe do Estado-Maior da Armada"],"cargos_esp":[0],"datas_ini":[1930],"datas_fim":[1932],"estados":[0],"autor":[0],"content":"**SILVA, Bento de Barros Machado da**\n\n\\*militar; ch. EMA 1930-1932.\n\n \n\n*Bento de Barros Machado da Silva* nasceu no Rio de Janeiro, então\ncapital do Império, no dia 15 de setembro de 1872.\n\nSentou praça na Marinha em dezembro de 1889 ingressando na Escola Naval.\nFoi promovido sucessivamente a segundo-tenente em novembro de 1893, a\nprimeiro-tenente em novembro do ano seguinte, a capitão-tenente em\ndezembro de 1896, a capitão-de-corveta em maio de 1909 e, finalmente, a\ncapitão-de-fragata em maio de 1914. De novembro de 1918 a julho do ano\nseguinte exerceu a subchefia do Gabinete Militar do presidente Delfim\nMoreira, alcançando o posto de capitão-de-mar-e-guerra em janeiro de\n1920.\n\nApós a Revolução de 1930, durante o Governo Provisório de Getúlio\nVargas, voltou à subchefia do Gabinete Militar da Presidência da\nRepública, função que exerceu de novembro a dezembro de 1930. Nesse\nmesmo mês, já no posto de contra-almirante, foi nomeado chefe do\nEstado-Maior da Armada (EMA), ali permanecendo até novembro de 1932.\n\nFaleceu no Rio de Janeiro, então Distrito Federal, no dia 6 de novembro\nde 1938.\n\nPublicou A comissão do Benjamim Constant à ilha da Trindade em 1897\n(1902) e As conquistas geográficas do século XIX (1903).\n\n \n\n \n\nFONTES: CONSULT. MAGALHÃES, B.; MIN. MAR. Almanaque; RIBEIRO FILHO, J.\nDic.\n\n \n","ref":"FONTES: CONSULT. MAGALHÃES, B.; MIN. MAR. Almanaque; RIBEIRO FILHO, J.\nDic.\n\n \n","dic":"DHBB"}
