{"title":"SILVA, Célio","cargoss":["Consultor-geral da República"],"cargos_esp":[0],"datas_ini":[1990],"datas_fim":[1992],"estados":[0],"autor":[0],"content":"**SILVA, Célio**\n\n\\*consult.-geral Rep. 1990-1992.\n\n \n\n*Célio Silva* nasceu na cidade de São Paulo no dia 29 de março de 1925,\nfilho de Brasílio Silva e de Joana Caputi Silva.\n\nBacharelou-se em direito pela Faculdade de Direito da Universidade de\nSão Paulo em 1950 e exerceu a advocacia na capital paulista até 1960. Em\njaneiro do ano seguinte, transferiu-se para Brasília, pouco depois da\ninauguração da nova capital do país, tornando-se procurador do Distrito\nFederal (DF). Procurador fiscal do DF entre 1961 e 1964, tornou-se nesse\núltimo ano procurador-geral do DF, cargo que exerceu até 1966. Ainda em\n1966, tornou-se ministro do Tribunal Superior Eleitoral (TSE) na classe\nde jurista, permanecendo no cargo até 1972.\n\nProsseguindo em sua carreira na Procuradoria do DF, aposentou-se como\nsubprocurador-geral em 1989. Em 15 de março de 1990, assumiu o cargo de\nconsultor-geral da República, atendendo a convite do presidente Fernando\nCollor de Melo (1990-1992), empossado naquele dia. Substituiu no cargo o\njurista Clóvis Ferro Costa.\n\nEm 29 de setembro de 1992, a Câmara dos Deputados aprovou o\n*impeachment* do presidente Fernando Collor, acusado de crime de\nresponsabilidade por ligações com um esquema de corrupção liderado pelo\nex-tesoureiro de sua campanha presidencial, Paulo César Farias. Afastado\nda presidência logo após a votação na Câmara, Collor renunciou ao\nmandato em 29 de dezembro desse ano, pouco antes da conclusão do\nprocesso pelo Senado Federal, sendo efetivado na presidência da\nRepública o vice Itamar Franco, que já vinha exercendo o cargo\ninterinamente desde o dia 2 de outubro. Com o afastamento de Collor,\nCélio Silva deixou a Consultoria-Geral da República ainda em outubro,\nsendo substituído por José de Castro Ferreira. A partir dessa data,\nCélio Silva passou a advogar em escritório próprio.\n\nCasou-se com Maria Teresa Neves da Silva, com quem teve três filhos.\n\n \n\n \n\nFONTES: INF. BIOG.; INF. CONSULT. GERAL DA REPÚBLICA.\n\n \n","ref":"FONTES: INF. BIOG.; INF. CONSULT. GERAL DA REPÚBLICA.\n\n \n","dic":"DHBB"}
