{"title":"AFONSO, Manuel","cargoss":["Deputado federal"],"cargos_esp":[0],"datas_ini":[1983],"datas_fim":[1987],"estados":["AL"],"autor":[0],"content":"**AFONSO, Manuel**\n\n\\*dep. fed. AL 1983-1987.\n\n \n\n*Manuel Afonso de Melo Neto* nasceu em Maceió no dia 20 de abril de\n1943, filho de José Afonso de Melo e de Josefa Holanda de Melo. Seu tio\nArnon de Melo foi governador de Alagoas (1951-1956) e senador pelo mesmo\nestado (1963-1981). Seu primo, Fernando Collor de Melo, foi deputado\nfederal por Alagoas (1983-1986), governador do estado (1987-1989) e\npresidente da República (1990-1992); em 2007 iniciou o mandato de\nsenador por Alagoas.\n\nBacharel em ciências jurídicas e sociais pela Faculdade de Direito da\nUniversidade Federal de Alagoas, em 1962 Manuel Afonso iniciou sua vida\npública como oficial legislativo da Assembléia Legislativa do estado. Em\nnovembro de 1972 elegeu-se vereador em Maceió na legenda do Movimento\nDemocrático Brasileiro (MDB), partido de oposição ao regime militar\nvigente no país desde 1964. Assumindo uma cadeira na Câmara Municipal no\ninício do ano seguinte, foi eleito presidente da Comissão de Justiça. Em\n1974 tornou-se vice-líder do MDB e candidatou-se, no mês de novembro, a\numa cadeira na Assembléia Legislativa. Vitorioso, iniciou o mandato de\ndeputado estadual em fevereiro do ano seguinte, quando também se tornou\nvice-presidente do MDB alagoano. Nessa legislatura, foi terceiro e\nprimeiro-secretário da Assembléia. Reeleito deputado estadual em\nnovembro de 1978, assumiu seu segundo mandato em fevereiro de 1979. Após\no fim do bipartidarismo, em novembro desse ano, e a conseqüente\nreorganização partidária, filiou-se ao Partido do Movimento Democrático\nBrasileiro (PMDB), agremiação que sucedeu ao MDB.\n\nEm novembro de 1982, elegeu-se deputado federal na legenda do PMDB.\nEmpossado em fevereiro de 1983, foi membro da Comissão de Economia,\nIndústria e Comércio e suplente das comissões de Relações Exteriores e\nde Agricultura e Política Rural da Câmara dos Deputados. Em 25 de abril\nde 1984, votou favoravelmente à emenda Dante de Oliveira, que propunha o\nrestabelecimento das eleições diretas para presidente da República em\nnovembro daquele ano. Como a emenda não obteve os votos suficientes para\nser encaminhada ao Senado Federal, votou no Colégio Eleitoral, reunido a\n15 de janeiro de 1985, no ex-governador de Minas Gerais Tancredo Neves.\nEleito com uma expressiva vantagem sobre o candidato governista Paulo\nMaluf, Tancredo não chegaria, contudo, a ser empossado. Gravemente\nenfermo, em 15 de março foi substituído na presidência pelo vice José\nSarney, que foi efetivado no cargo em 21 de abril, quando o\nex-governador mineiro veio a falecer.****\n\nManuel Afonso disputou novo mandato em novembro de 1986, obtendo apenas\numa suplência. Deixou com isso a Câmara dos Deputados no final da\nlegislatura, em janeiro do ano seguinte, e passou a dedicar-se às\natividades de advogado e empresário na área de distribuição de\ncombustíveis. No pleito de outubro de 2008 disputou o cargo de prefeito\nde São Miguel dos Milagres (AL) na legenda do Partido Social Cristão\n(PSC), mas não teve sucesso.\n\nCasou-se com Rosa Maria Leão de Melo, com quem teve dois filhos.\n\n \n\nFONTES: ASSEMB. NAC. CONST. *Repertório* (1987-1988); CÂM. DEP.\n*Deputados brasileiros. Repertório* (1983-1987); *Globo*(26/4/84 e\n16/1/85); INF. BIOG.\n","ref":"FONTES: ASSEMB. NAC. CONST. *Repertório* (1987-1988); CÂM. DEP.\n*Deputados brasileiros. Repertório* (1983-1987); *Globo*(26/4/84 e\n16/1/85); INF. BIOG.\n","dic":"DHBB"}
