{"title":"BARCELOS, Aníbal","cargoss":["Governador de estado ou do Distrito Federal","Constituinte","Deputado federal","Governador de estado ou do Distrito Federal","Prefeito"],"cargos_esp":[0,0,0,0,"Macapá"],"datas_ini":[1979,1987,1987,1991,1997],"datas_fim":[1985,1988,1991,1995,2001],"estados":["AP",0,"AP","AP",0],"autor":["Marcelo Costa"],"content":"**BARCELOS, Aníbal**\n\n\\*militar; gov. AP 1979-1985; const. 1987-1988; dep. fed. AP 1987-1991;\ngov. AP 1991-1995; pref. Macapá 1997-2001.\n\n*Aníbal Barcelos* nasceu em Campos (RJ) no dia 10 de julho de 1918,\nfilho de Manuel Barcelos Filho e de Minervina Barcelos.\n\nEm 1939 concluiu o curso de oficial da Marinha na Escola de Guerra\nNaval, no Rio de Janeiro, então Distrito Federal.\n\nEm 1952 foi encarregado do departamento de convés do navio-escola *Duque\nde Caxias* em missão de merecimento por se tratar de viagem ao exterior\npara instrução de guardas-marinhas. Quatro anos depois foi membro da\ncomissão que visitou os Estados Unidos a fim de observar os métodos\nusados no comando de adestramento da Marinha norte-americana.\n\nAté o movimento político-militar de 31 de março de 1964, foi\nsimpatizante da União Democrática Nacional (UDN) e posteriormente da\nAliança Renovadora Nacional (Arena), partido de apoio ao regime militar.\n\nEm 1970, tornou-se supervisor do ensino profissional marítimo do\nMinistério da Marinha, no Rio de Janeiro, permanecendo no cargo até\n1974. Neste último ano, passou a ser diretor administrativo e financeiro\nde empresas públicas da Marinha, no Rio de Janeiro, função que ocupou\naté 1979.\n\nAinda nesse ano, foi indicado pelo ministro do Interior do governo João\nBatista Figueiredo (1979-1985), Mário Andreazza — com quem construiu uma\nsólida amizade cultivada desde o tempo em que ambos administraram uma\nempresa privada carioca —, para assumir o governo do então território do\nAmapá. Com a extinção do bipartidarismo em dezembro, filiou-se ao\nPartido Democrático Social (PDS), legenda que sucedeu à Arena. Em 1981,\nfoi para a reserva como vice-almirante.\n\nSeu governo estabeleceu como “meta número um” a transformação do\nterritório do Amapá em estado, apesar de seu projeto ter sido duramente\ncriticado, tanto pelo Partido do Movimento Democrático Brasileiro (PMDB)\nquanto pelo seu ex-aliado, deputado federal Paulo Guerra, do PDS.\nSegundo estes, o território perderia o auxílio financeiro do governo\nfederal, responsável pela sustentação da rede de ensino público e pelo\npagamento do funcionalismo. Não obstante as críticas, ergueu a sede da\nAssembléia Legislativa do Amapá, embora o então território não pudesse\neleger deputados estaduais, o que lhe rendeu uma ação popular movida\npelo PMDB por gasto indevido do dinheiro público, sendo, no entanto,\nabsolvido ao provar que “era dever do interventor criar condições para a\ntransformação do território em estado”. Em julho de 1985, deixou o\ngoverno do território.\n\nNo pleito de novembro do ano seguinte, foi eleito deputado federal\nconstituinte pelo Amapá — o mais votado do território, com 20% do total\n— na legenda do Partido da Frente Liberal (PFL), em coligação com o\nPartido Democrático Trabalhista (PDT). Assumindo o mandato em fevereiro\nde 1987, participou dos trabalhos na Assembléia Nacional Constituinte\ncomo membro titular da Subcomissão da União, Distrito Federal e\nTerritórios, da Comissão da Organização do Estado, e da Comissão de\nSistematização e suplente da Subcomissão dos Direitos dos Trabalhadores\ne Servidores Públicos da Comissão da Ordem Social. Apresentou várias\nemendas à Constituição, entre elas a criação do estado do Amapá e a\ncontagem em dobro dos cinco primeiros anos de tempo de serviço no\nestado.\n\nNas votações mais importantes na Constituinte, pronunciou-se contra o\nmandado de segurança coletivo, a jornada semanal de 40 horas, o turno\nininterrupto de seis horas, a soberania popular, a nacionalização do\nsubsolo, a estatização do sistema financeiro, a limitação dos juros em\n12% ao ano, a limitação dos encargos da dívida externa, a desapropriação\nda propriedade produtiva e o direito irrestrito de greve; e votou a\nfavor da proteção ao emprego contra demissão sem justa causa, do aviso\nprévio proporcional, da unicidade sindical, do presidencialismo, da\nlegalização do jogo do bicho e do mandato de cinco anos para o\npresidente José Sarney. Após a promulgação da nova Carta constitucional\nem 5 de outubro de 1988, passou a participar dos trabalhos legislativos\nordinários.\n\nNo pleito de outubro de 1990, candidatou-se ao governo do estado do\nAmapá, emancipado pela nova Constituição, na legenda do Partido da\nReconstrução Nacional (PRN), na coligação Frente Liberal de\nReconstrução, formada pelo PRN, PFL e Partido Liberal (PL). Com o apoio\npolítico do presidente Fernando Collor de Melo e de Gílton Garcia, foi\nnomeado governador do Amapá por Collor em maio desse ano, e o apoio\nfinanceiro do empreiteiro Henrique Almeida, candidato vitorioso ao\nSenado nesse ano, derrotou no segundo turno o candidato do Partido dos\nTrabalhadores (PT), Gílson Rocha, tornando-se o primeiro governador\neleito diretamente no estado. Depois de deixar a Câmara dos Deputados em\njaneiro de 1991, ao final da legislatura, assumiu o mandato em março,\nocasião em que o novo estado foi oficialmente instalado.\n\nEm 15 de abril de 1993, foi afastado do cargo pelos partidos de oposição\nna Assembléia Legislativa, que acataram denúncia da Central Única dos\nTrabalhadores (CUT) do Amapá de crime de responsabilidade por\nsuperfaturamento de obras e compras de serviços feitos pelo governo do\nestado desde 1991. Entretanto, no dia seguinte, foi mantido no cargo por\numa liminar concedida pelo Tribunal de Justiça do Estado.\n\nDeixou o governo do Amapá em 1º de janeiro de 1995, transferindo o cargo\npara João Alberto Capiberibe, do Partido Socialista Brasileiro (PSB). Em\nabril, a Assembléia Legislativa do Amapá rejeitou, por 16 votos a zero,\nas contas do exercício de 1993 e o Tribunal de Contas do Amapá detectou\numa série de irregularidades em sua administração. Em outubro de 1996,\nfoi eleito prefeito de Macapá, na legenda do PFL. Assumiu a chefia do\nExecutivo da capital amapaense em 1º de janeiro de 1997.\n\nTentou reeleger-se para o cargo nas eleições de 2000, mas ficou em\nterceiro lugar na disputa eleitoral que foi vencida pelo petista João\nHenrique Pimentel. Deixou a prefeitura em janeiro de 2001.\n\nEm 2004, Aníbal Barcelos foi eleito vereador em Macapá, mas em 2006, seu\nnome figurou na lista divulgada pelo TCU (Tribunal de Contas da União)\nque relacionava as pessoas que haviam sido condenadas por\nirregularidades insanáveis na prestação de contas do dinheiro público e\nque, portanto, tornavam-se inelegíveis. Em 2008, ao final do seu mandato\nna Câmara dos Vereadores do Amapá, Aníbal Barcelos encerrou sua carreira\npolítica.\n\nRealizou os cursos superiores de guerra naval, comando do Estado-Maior e\nsuperior de comando. Foi também presidente da comissão de ciclagem do\nArsenal de Marinha do Rio de Janeiro e observador da secretaria geral da\nMarinha junto ao III Simpósio Interamericano sobre Aplicações Pacíficas\nda Energia Nuclear.\n\nCasou-se com Maria Cerqueira Barcelos, com quem teve dois filhos. Um\ndeles, Sérgio Barcelos, foi deputado federal por duas legislaturas\n(1991-1999) e reeleito em outubro de 1998, sempre na legenda do PFL. Seu\nneto, Alexandre Barcelos, elegeu-se deputado estadual pelo PFL em\noutubro de 1998 e reelegeu-se, pela mesma legenda, nos pleitos de 2002 e\n2006.\n\nPublicou *Amapá agora* (1985).\n\nMarcelo Costa\n\nFONTES: ASSEMB. NAC. CONST.*Repertório*(1987-1988); COELHO, J. &\nOLIVEIRA, A. *Nova*; *Estado de S. Paulo* (2/11/82, 5/10 e 30/12/90,\n3/1/91); *Folha de S. Paulo* (27/11/90, 1, 2 e 3/1/91, 15/9/93); *Globo*\n(16/9/93, 10/10/98);*Jornal do Brasil* (4/10/90, 2/1/91, 30/4/95);\n*Perfil parlamentar/IstoÉ; Veja* (24/3/82); *Lista de**inelegíveis\ndivulgada pelo TCU*(07/2006)\n\n \n","ref":"FONTES: ASSEMB. NAC. CONST.*Repertório*(1987-1988); COELHO, J. &\nOLIVEIRA, A. *Nova*; *Estado de S. Paulo* (2/11/82, 5/10 e 30/12/90,\n3/1/91); *Folha de S. Paulo* (27/11/90, 1, 2 e 3/1/91, 15/9/93); *Globo*\n(16/9/93, 10/10/98);*Jornal do Brasil* (4/10/90, 2/1/91, 30/4/95);\n*Perfil parlamentar/IstoÉ; Veja* (24/3/82); *Lista de**inelegíveis\ndivulgada pelo TCU*(07/2006)\n\n \n","dic":"DHBB"}
