{"title":"SILVA, Glauco Lessa de Abreu e","cargoss":["Diretor do Departamento Administrativo do Serviço Público","Ministro do Tribunal de Contas"],"cargos_esp":[0,0],"datas_ini":[1969,1974],"datas_fim":[1974,1978],"estados":[0,0],"autor":[0],"content":"**SILVA, Glauco Lessa de Abreu e**\n\n\\*dir. DASP 1969-1974; min. TCU 1974-1978.\n\n \n\n*Glauco Antônio Lessa de Abreu e Silva* nasceu em Belo Horizonte no dia\n3 de junho de 1914, filho de José Álvares de Abreu e Silva e de Graciema\nLessa.\n\nFoi fiscal da Carteira de Crédito Agrícola e Industrial do Banco do\nBrasil S.A., em 1943. Técnico em administração pertencente ao quadro de\npessoal do Hospital dos Servidores do Estado (HSE), formou-se pela\nEscola Brasileira de Administração Pública (EBAP), da Fundação Getulio\nVargas (FGV), no Rio de Janeiro, então Distrito Federal. Foi bolsista do\nInstituto de Negócios Interamericanos nos Estados Unidos e da Escola de\nAdministração Pública da Universidade de Porto Rico.\n\nAtuou como****professor de fundamentos de administração pública do curso\nde formação de chefes e assessores do Instituto de Previdência e\nAssistência aos Servidores do Estado (IPASE). Nesse órgão, ocupou ainda\na chefia da seção de estatística da Divisão de Pesquisas do Departamento\nde Assistência, representando-o junto ao Departamento Administrativo do\nServiço Público (DASP) no estudo do Plano de Assistência ao Funcionário\ne sua família, em 1955. Foi membro efetivo da comissão destinada a\npromover os estudos preliminares e conclusivos junto ao DASP relativos\nao Plano de Classificação, antes e após a sua transformação em lei\n(1960), e membro da comissão instituída a fim de organizar o quadro\ndefinitivo de pessoal do IPASE.\n\nNo HSE, exerceu os cargos de chefe do Serviço de Pessoal e de diretor da\nDivisão Administrativa. Foi membro do grupo de trabalho, por indicação e\ncomo representante do Ministério do Planejamento e Coordenação Geral,\ninstituído com o fim especial de acelerar os trabalhos de implantação da\nreforma administrativa, e desempenhou a função de coordenador do Plano\nde Descentralização Regional da reforma administrativa, em 1967.\n\nEm abril de 1969, como secretário executivo da Comissão de Reforma\nAdministrativa do Pessoal Civil, passou a responder pela diretoria geral\ndo DASP, sucedendo a Belmiro Siqueira. No exercício dessa função,\nparticipou em 1972 da II Reunião das Organizações Rodoviárias — Reunião\nda International Road Federation, e, no ano seguinte, do I Ciclo de\nPalestras da comissão de coordenação e implementação de técnicas\nfinanceiras do Ministério da Fazenda e do Ministério do Planejamento. Em\nmarço de 1974, afastou-se da direção do DASP, sendo substituído por\nDarci Duarte Siqueira. Em seguida, passou a assistente do ministro do\nPlanejamento, Mário Henrique Simonsen.\n\nTornou-se, em abril de 1974, ministro do Tribunal de Contas da União\n(TCU), nomeado pelo presidente da República, general Ernesto Geisel,\nvindo a ser vice-presidente do órgão****em 1976, e seu****presidente em\n1977, em substituição ao ministro Wagner Estelita Campos. Em março de\n1978 aposentou-se no TCU, passando a exercer a função de diretor\nfinanceiro da Transbrasil.\n\nFoi ainda professor-assistente do curso de organização e administração\nhospitalares do Ministério da Saúde.\n\nFaleceu no dia 30 de maio de 2000.\n\nPublicou diversos artigos em revistas de administração e serviço\npúblico.\n\n \n\nFONTES: ASSEMB. LEGISL. MG. *Dicionário biográfico*; *Globo* (29/6/00);\n*Jornal do Brasil* (13/3/78); *Perfil* (1972 e 1974); TCU. *Dados*\n(1893-1990).\n\n \n","ref":"FONTES: ASSEMB. LEGISL. MG. *Dicionário biográfico*; *Globo* (29/6/00);\n*Jornal do Brasil* (13/3/78); *Perfil* (1972 e 1974); TCU. *Dados*\n(1893-1990).\n\n \n","dic":"DHBB"}
