{"title":"SILVA, Hugo","cargoss":["Interventor"],"cargos_esp":[0],"datas_ini":[1946],"datas_fim":[1947],"estados":["RJ"],"autor":[0],"content":"**SILVA, Hugo**\n\n\\*militar; interv. RJ 1946-1947.\n\n*Hugo Silva*nasceu em Porto Alegre no dia 8 de dezembro de 1900, filho\nde Gabriel Silva e de Alzira Macalão Silva.\n\nSentou praça em maio de 1918 na Escola Militar de sua cidade natal,\nsaindo aspirante-a-oficial da arma de artilharia em janeiro de 1921. Em\nmaio do mesmo ano foi promovido a segundo-tenente. Recebendo em outubro\nde 1922 a patente de primeiro-tenente, participou dos movimentos\nrevolucionários de São Paulo de 1924 a 1927. Em agosto de 1931 chegou a\ncapitão.\n\nApós formar-se em 1934 pela Faculdade de Medicina do Rio Grande do Sul,\npassou a trabalhar no serviço de oftalmologia e otorrinolaringologia da\nSanta Casa de Misericórdia de Porto Alegre e da Beneficência Portuguesa\nde seu estado. Recebeu a patente de major em dezembro de 1938 e a de\ntenente-coronel em junho de 1943. Tornando-se coronel em junho de 1946,\ncomandou o 1º Batalhão de Caçadores (1º BC), sediado em Petrópolis (RJ),\naté ser nomeado, em setembro do mesmo ano, pelo presidente da República,\ngeneral Eurico Gaspar Dutra, interventor federal no estado do Rio de\nJaneiro. Ocupou esse cargo até fevereiro do ano seguinte, quando foi\nsubstituído pelo então secretário do Interior e Justiça do mesmo estado,\nFrancisco de Paula Lupério Santos. Em 1952, ainda como coronel, chefiou\no estado-maior da 6ª Região Militar (6ª RM), em Salvador, ali\npermanecendo até 1954. De 1955 a 1966 exerceu a função de representante\ndo Ministério da Guerra no Conselho Nacional de Economia, sendo\nposteriormente transferido para a reserva com a patente de\ngeneral-de-divisão.\n\nAo longo de sua carreira militar, fez os cursos da Escola de Infantaria,\nda Escola de Aperfeiçoamento de Oficiais, da Escola de Estado-Maior, da\nEscola de Motomecanização, da Escola de Guerra Naval e da Escola\nSuperior de Guerra (ESG). Pertenceu à Associação Médica Brasileira\n(AMB), à Associação Médica do Estado do Rio de Janeiro (AMERJ) e à\nSociedade de Hipnose Médica. Além de suas atividades militares e\nmédicas, atuou na imprensa, tendo sido colaborador do jornal *Luta\nDemocrática* e**membro da Associação Brasileira de Imprensa (ABI). Foi\nainda presidente da Caixa Econômica do estado do Rio de Janeiro.\n\nCasou-se com Valentina Fonseca e Silva, com quem teve três filhos.\n\nPublicou *O comando de Caxias na Guerra* *do Paraguai* (1951).\n\nFONTES: CORRESP. GOV. EST. RJ; COUTINHO, A. *Brasil; Encic.\nMirador;*LACOMBE, L. *Chefes;*MIN. GUERRA. *Almanaque;* MOREIRA, J.\n*Dic.*\n\n \n","ref":"FONTES: CORRESP. GOV. EST. RJ; COUTINHO, A. *Brasil; Encic.\nMirador;*LACOMBE, L. *Chefes;*MIN. GUERRA. *Almanaque;* MOREIRA, J.\n*Dic.*\n\n \n","dic":"DHBB"}
