{"title":"SILVA, Jonas Carlos da","cargoss":["Deputado federal","Deputado federal","Deputado federal"],"cargos_esp":[0,0,0],"datas_ini":[1967,1965,1962],"datas_fim":[1969,1965,0],"estados":["CE","CE","CE"],"autor":[0],"content":"**SILVA, Jonas Carlos da**\n\n\\*dep. fed. CE 1962, 1965 e 1967-1969.\n\n \n\n*Jonas Carlos da Silva*****nasceu em Almino Afonso (RN) no dia 27 de\nsetembro de 1909, filho de Antônio Carlos da Silva e de Francisca\nFerreira Carlos.\n\nProprietário de terras, comerciante e industrial, iniciou sua carreira\npolítica elegendo-se em outubro de 1958 sétimo suplente de deputado\nfederal pelo Ceará, na legenda das Oposições Coligadas, formadas pelo\nPartido Social Democrático (PSD), o Partido Trabalhista Brasileiro (PTB)\ne o Partido de Representação Popular (PRP). Ocupou uma cadeira na Câmara\nem maio de 1962 e, em outubro desse ano, elegeu-se sexto suplente de\ndeputado federal, na legenda do PTB, tendo exercido mandato de maio a\njunho de 1965.\n\nCom a extinção dos partidos políticos pelo Ato Institucional nº 2, de\noutubro de 1965, e a posterior instauração do bipartidarismo, filiou-se\nà Aliança Renovadora Nacional (Arena), partido de apoio ao governo.\nNessa legenda, elegeu-se em novembro de 1966 deputado federal pelo\nCeará, assumindo uma cadeira na Câmara em fevereiro do ano seguinte.\nDurante essa legislatura, foi membro das comissões de Economia e de\nServiço Social da Câmara. Em novembro de 1970 reelegeu-se, ainda na\nlegenda da Arena, voltando a ser membro da Comissão de Economia e\ntornando-se suplente da Comissão de Serviço Público. Em novembro de 1974\nvoltou a concorrer à reeleição, obtendo apenas a primeira suplência.\nEncerrando seu mandato anterior em janeiro de 1975, tornou a assumir uma\ncadeira na Câmara a partir de junho do mesmo ano. Em novembro de 1978\nconseguiu apenas a oitava suplência de deputado federal e, deixando a\nCâmara em janeiro de 1979, não voltou a assumir mandato.\n\nFoi o fundador da Loteria Estadual do Ceará.\n\nFaleceu em Fortaleza em maio de 1979.\n\nFoi casado com Josefa Carlos Pereira, com quem teve três filhos.\n\n \n\n \n\nFONTES: CÂM. DEP. Deputados; CÂM. DEP. Deputados brasileiros. Repertório\n(6 e 9); Jornal do Brasil (28/5/79); NÉRI, S. 16; Perfil (1972); TRIB.\nSUP. ELEIT. Dados (4, 6, 8 e 9).\n\n \n","ref":"FONTES: CÂM. DEP. Deputados; CÂM. DEP. Deputados brasileiros. Repertório\n(6 e 9); Jornal do Brasil (28/5/79); NÉRI, S. 16; Perfil (1972); TRIB.\nSUP. ELEIT. Dados (4, 6, 8 e 9).\n\n \n","dic":"DHBB"}
