{"title":"SILVA, José de Azevedo","cargoss":["Chefe do Departamento Geral de Serviços do Exército"],"cargos_esp":[0],"datas_ini":[1974],"datas_fim":[1976],"estados":[0],"autor":[0],"content":"**SILVA, José de Azevedo**\n\n\\*militar; ch. Depto. Ger. Serv. Ex. 1974-1976.\n\n*José de Azevedo Silva* nasceu no Rio de Janeiro, então Distrito\nFederal, no dia 17 de agosto de 1911.\n\nApós concluir o curso do Colégio Militar de sua cidade natal, sentou\npraça em abril de 1931, ingressando na****Escola Militar do Realengo,\ntambém no Rio. Designado aspirante-a-oficial da arma de artilharia em\njaneiro de 1934, foi promovido a segundo-tenente em agosto do mesmo ano,\na primeiro-tenente em setembro de 1936, a capitão em agosto de 1940, a\nmajor em março de 1948, a tenente-coronel em outubro de 1952 e a coronel\nem agosto de 1960. Chegando ao posto de general-de-brigada em novembro\nde 1966, comandou a Artilharia Divisionária da 1ª Divisão do Exército.\nEm março de 1971 recebeu a patente de general-de-divisão e, em julho de\n1974, a de general-de-exército. Nesse mesmo mês foi nomeado chefe do\nDepartamento Geral de Serviços do Exército, passando, nessa condição, a\nintegrar o Alto Comando. Permaneceu nesse cargo até março de 1976,\nquando foi transferido para a reserva, sendo substituído por Tácito\nTeófilo Gaspar de Oliveira.\n\nAo longo de sua carreira militar, cursou a Escola de Aperfeiçoamento de\nOficiais (EsAO), a Escola de Estado-Maior, a Escola Superior de Guerra\n(ESG) e o Army Command and General Staff College, nos Estados Unidos,\nonde fez o curso de comando e estado-maior. Foi ainda por duas vezes\ninstrutor da Escola de Comando e Estado-Maior do Exército, comandante da\n6ª Divisão do Exército, diretor de Extensão e Especialização e\nvice-chefe do Departamento de Ensino e Pesquisas do Exército.\n\nCasou-se com Guilhermina Silva, com quem teve uma filha.\n\nFONTES: *Jornal do Brasil* (1/8/74, 5 e 12/3/76); MIN. GUERRA.\n*Almanaque.*\n\n \n","ref":"FONTES: *Jornal do Brasil* (1/8/74, 5 e 12/3/76); MIN. GUERRA.\n*Almanaque.*\n\n \n","dic":"DHBB"}
