{"title":"SILVA, José Faustino dos Santos e","cargoss":["Interventor"],"cargos_esp":[0],"datas_ini":[1946],"datas_fim":[1947],"estados":["PA"],"autor":[0],"content":"**SILVA, José Faustino dos Santos e**\n\n\\*militar; interv. PA 1946-1947.\n\n*José Faustino dos Santos e Silva*****nasceu no dia 8 de março de 1884.\n\nSentou praça em maio de 1904, saindo aspirante-a-oficial em janeiro de\n1909. Foi promovido sucessivamente a segundo-tenente em novembro de\n1911, a primeiro-tenente em fevereiro de 1918, a capitão em março de\n1922 e a major em abril de 1930. Após a Revolução de Outubro desse ano,\nteve seu nome indicado, entre outros militares, por Juarez Távora, para\nocupar a interventoria federal do Piauí, após a deposição de Humberto de\nAreia Leão, causada por um levante em janeiro de 1931.\n\nEm dezembro de 1936 recebeu a patente de tenente-coronel e, em agosto de\n1941, a de coronel. Durante o governo do general Eurico Gaspar Dutra\n(1946-1951), foi nomeado em dezembro de 1946 interventor federal no\nPará, permanecendo nesse cargo até março do ano seguinte. Em 1948\nassumiu a diretoria do Banco da Amazônia, que exerceu até 1950.\n\nAo longo de sua carreira militar, fez os cursos de infantaria, de\ncavalaria e de engenharia civil e militar, além da Escola de\nAperfeiçoamento de Oficiais (EsAO).         \n\nFoi ainda chefe da Companhia de Construção e Tiro de Marambaia.\n\nFONTES: ARQ. OSVALDO ARANHA; CASTELO BRANCO FILHO, M.\n*Depoimento;*CORRESP. GOV. EST. PA; *Encic. Mirador;* *Grande encic.\nDelta;*MIN. GUERRA. *Almanaque;*ROQUE, C. *Grande.*\n\n \n","ref":"FONTES: ARQ. OSVALDO ARANHA; CASTELO BRANCO FILHO, M.\n*Depoimento;*CORRESP. GOV. EST. PA; *Encic. Mirador;* *Grande encic.\nDelta;*MIN. GUERRA. *Almanaque;*ROQUE, C. *Grande.*\n\n \n","dic":"DHBB"}
