{"title":"SILVA, José Francisco da","cargoss":["Presidente de associação ou confederação de empregados ou empregadores"],"cargos_esp":["Contag"],"datas_ini":[1968],"datas_fim":[1986],"estados":[0],"autor":[0],"content":"**SILVA, José Francisco da**\n\n\\*pres. Contag 1968-1986.\n\n \n\n*José Francisco da Silva* nasceu em Orobó (PE) no dia 28 de setembro de\n1939, filho de Manuel Francisco da Silva e de Maria Severina da\nConceição.\n\nPequeno arrendatário de terras em seu município natal, transferiu-se,\naos 20 anos, para a zona canavieira, indo morar no engenho Trigueiro, no\nmunicípio de Vicência. Ingressou no sindicalismo rural e participou\nativamente da fundação do Sindicato dos Trabalhadores Rurais de Vicência\npor volta de 1961, tendo sido escolhido delegado sindical. Em 1962 foi\neleito secretário desse sindicato e em 1964 chegou à sua presidência,\nnela permanecendo até 1966, quando foi escolhido secretário da Federação\ndos Trabalhadores na Agricultura do Estado de Pernambuco (Fetape). Em\n1968 elegeu-se presidente da Confederação Nacional dos Trabalhadores na\nAgricultura (Contag), derrotando o interventor que ocupava o cargo desde\no movimento político-militar de 31 de março de 1964, que depôs o\npresidente João Goulart. Reelegeu-se em 1971 e 1974.\n\nRepresentou em 1975 os trabalhadores na delegação brasileira à\nConferência da Organização Internacional do Trabalho (OIT), na Suíça.\nNesse mesmo ano prestou depoimento na Comissão Parlamentar de Inquérito\n(CPI) sobre o Programa de Redistribuição de Terras do Norte e Nordeste\n(Proterra), criado em 1971. Nessa ocasião enfatizou a necessidade de uma\nreforma agrária em face da situação do trabalhador rural brasileiro,\nalém de mostrar que o Proterra não havia conseguido modificar os\nsistemas de posse e uso da terra vigentes no Norte e no Nordeste.\n\nFoi um dos 13 presidentes de confederações nacionais de empregados e\ntrabalhadores a ir a Brasília em março de 1976 levar ao presidente\nErnesto Geisel (1974-1979) a reivindicação no sentido de que fossem\nconservados, nas diversas instâncias da Justiça do Trabalho, os\nrepresentantes classistas. Em maio desse mesmo ano compareceu ao almoço\noferecido pelas confederações de trabalhadores brasileiros à delegação\nda American Federation of Labor-Congress of Industrial Organizations\n(AFL-CIO) em visita ao Brasil, ao qual esteve presente também o adido\ntrabalhista da embaixada dos Estados Unidos no Brasil, James Shea.\n\nReeleito presidente da Contag em 1977, tornou a ressaltar a necessidade\nde uma reforma agrária e de liberdade e autonomia sindicais no III\nCongresso dos Trabalhadores Rurais, em maio de 1979. Nesse congresso\nforam definidas como prioridades a retomada das lutas coletivas e a\nredemocratização do Brasil e do movimento sindical.\n\nDefensor de posseiros, religiosos e líderes sindicais vítimas da\nviolência no campo e da adoção de um amplo programa de reforma agrária,\nem 1980 José Francisco foi enquadrado na Lei de Segurança Nacional\n(LSN), sob alegação de ter participado de ato público em Brasiléia (AC)\npelo assassinato do líder sindical Wilson de Sousa Pinheiro. Ainda nesse\nano, foi mais uma vez eleito presidente da Contag, o que se repetiu em\n1982.\n\nNo IV Congresso Nacional dos Trabalhadores, em 1985, no qual foi\ndefinido o sistema de eleição para diretoria em congressos, José\nFrancisco foi eleito para seu sexto mandato na presidência da Contag,\niniciado em maio do ano seguinte. Em abril de 1989, deixou a presidência\nda entidade, sendo substuído por Aluísio Carneiro. Nesse mesmo ano, foi\nescolhido pelos filiados da Contag ministro classista do Tribunal\nSuperior do Trabalho (TST). Reeleito em 1992, permaneceu no TST até\n1995. Ainda em 1995, de volta a Pernambuco integrou, a convite, a\nassessoria especial do governador Miguel Arrais. A fim de concorrer à\nprefeitura de Orobó, afastou-se da assessoria.\n\nEleito pela coligação dos partidos Socialista Brasileiro (PSB),\nDemocrático Trabalhista (PDT) e da Social Democracia Brasileira (PSDB),\nseu lema na prefeitura foi “Mutirão pela Cidadania”, visando a educação,\na saúde e a produção. Em julho de 2000 candidatou-se à reeleição, dessa\nvez pela coligação do PSB, Partido Popular Socialista (PPS), Partido dos\nTrabalhadores (PT) e Partido Comunista do Brasil (PCdoB).\n\n \n\n \n\nFONTES: Agência Brasil (20/5/04); CONF. NAC. TRAB. AGRIC. *Lutas*; INF.\nBIOG.; *Jornal do Brasil*(5/3 e 8/8/76 e 22/5/79); *Jornal dos Trab.\nComércio do Brasil* (5/76); *Movimento,*SP (18/8/75).\n\n \n","ref":"FONTES: Agência Brasil (20/5/04); CONF. NAC. TRAB. AGRIC. *Lutas*; INF.\nBIOG.; *Jornal do Brasil*(5/3 e 8/8/76 e 22/5/79); *Jornal dos Trab.\nComércio do Brasil* (5/76); *Movimento,*SP (18/8/75).\n\n \n","dic":"DHBB"}
