{"title":"SILVA, José Trindade da Fonseca e","cargoss":["Deputado federal"],"cargos_esp":[0],"datas_ini":[1954],"datas_fim":[1959],"estados":["GO"],"autor":[0],"content":"**SILVA, José Trindade da Fonseca e**\n\n\\*religioso; dep. fed. GO 1954-1959.\n\n \n\n*José Trindade da Fonseca e Silva* nasceu em Jaraguá (GO) no dia 7 de\njunho de 1904, filho de Ernesto Camargo da Fonseca e de Ernestina Luísa\nda Silva Fonseca.\n\nFez seus estudos no Ginásio Diocesano Santa Cruz de Goiás, passando em\nseguida para o Seminário de Mariana (MG), onde se ordenou padre em 1930.\n\nIniciou sua vida política candidatando-se, nas eleições de outubro de\n1950, a deputado federal pelo seu estado, na legenda do Partido Social\nDemocrático. Tendo obtido apenas a segunda suplência, assumiu uma\ncadeira na Câmara dos Deputados em maio de 1954, em conseqüência da\nrenúncia de Paulo Fleury. Foi secretário de Educação de Goiás entre 1951\ne 1954, na gestão do governador Pedro Ludovico Teixeira (1951-1954). Em\noutubro desse ano conseguiu eleger-se deputado na mesma legenda,\npermanecendo na Câmara até janeiro de 1959, ao encerrar-se a\nlegislatura.\n\nAlcançando a dignidade de cônego, tornou-se secretário particular do\narcebispo de Goiás e secretário do arcebispado. Ao longo de sua vida\neclesiástica, foi vigário de diversas paróquias e diretor de ginásios\ncatólicos, tendo construído vários estabelecimentos de ensino e\nmatrizes. No período de 1959 a 1961 foi diretor do Banco de Goiás e\npresidente do Serviço Social Rural de Goiás.\n\nFaleceu em 27 de fevereiro de 1962.         \n\nPublicou *Poliantéia* (1945), sobre as realizações do arcebispo dom\nEmanuel Gomes de Oliveira, e *Lugares e pessoas* (1958).\n\n \n\nFONTES: CÂM. DEP. *Deputados*; CÂM. DEP. *Relação dos dep*.; CÂM.DEP.\n*Deputados* *brasileiros. Repertório* (1946-1967); CISNEIROS, A.\n*Parlamentares*; TRIB. SUP. ELEIT. *Dados* (2 e 3).\n\n \n","ref":"FONTES: CÂM. DEP. *Deputados*; CÂM. DEP. *Relação dos dep*.; CÂM.DEP.\n*Deputados* *brasileiros. Repertório* (1946-1967); CISNEIROS, A.\n*Parlamentares*; TRIB. SUP. ELEIT. *Dados* (2 e 3).\n\n \n","dic":"DHBB"}
