{"title":"SILVA, Lindolfo","cargoss":["Presidente de associação ou confederação de empregados ou empregadores"],"cargos_esp":["Contag"],"datas_ini":[1963],"datas_fim":[1964],"estados":[0],"autor":[0],"content":"**SILVA, Lindolfo**\n\n\\*pres. Contag 1963-1964.\n\n \n\n*Lindolfo Silva*****nasceu em Barra do Piraí (RJ) no dia 25 de novembro\nde 1924, filho de Lindolfo Silva e de Januária Carlos de Araújo, seu pai\noperário da Estrada de Ferro Central do Brasil e sua mãe trabalhadora\nagrícola, ambos arrendatários expulsos de suas terras.\n\nEm 1940, veio morar com uma tia em Bangu, subúrbio do Rio de Janeiro.\nDois anos mais tarde, começou a trabalhar no centro da cidade, onde\ntomou contato com o Partido Comunista Brasileiro, então Partido\nComunista do Brasil (PCB). Mesmo não sendo filiado, cooperou com o\npartido nas eleições de 1945 e 1946. No ano seguinte, filiou-se à\nagremiação, que pouco depois seria novamente colocada na ilegalidade,\nchegando a ser membro do seu comitê central.\n\nParticipou da organização da I Conferência Nacional de Lavradores e\nTrabalhadores Agrícolas, realizada em São Paulo em 1953. No ano\nseguinte, foi um dos fundadores e primeiro presidente da União dos\nLavradores e Trabalhadores Agrícolas do Brasil (ULTAB), organização\nvinculada ao PCB, que tinha como objetivo lutar pela melhoria das\ncondições de trabalho nas zonas rurais. Em 1955, voltou a trabalhar no\ncampo, dirigindo sua atenção para os chamados “boias-frias”, categoria\nde trabalhadores do campo empregados nas épocas das safras nas fazendas\ne sem qualquer espécie de assistência das leis trabalhistas.\n\nEm novembro de 1961, representou a ULTAB num congresso de trabalhadores\nagrícolas realizado em Belo Horizonte, conseguindo, em 1963, que o\nMinistério do Trabalho aprovasse o Estatuto do Trabalhador Rural, que\nregulamentou o trabalho no campo. Em dezembro do mesmo ano, com a\ntransformação da ULTAB em Confederação Nacional dos Trabalhadores na\nAgricultura (Contag), foi eleito seu primeiro presidente. Essa entidade,\nreconhecida em janeiro de 1964 pelo presidente João Goulart e\nconsolidada de acordo com as leis trabalhistas e o Estatuto do\nTrabalhador Rural, reunia assalariados agrícolas e trabalhadores\nautônomos, isto é, parceiros e arrendatários, assim como sindicatos de\npequenos proprietários, empregados diaristas e mensalistas.\n\nLindolfo Silva foi também membro do Comando Geral dos Trabalhadores\n(CGT). Em janeiro de 1962, mudou-se com a família para o Rio de Janeiro,\ne no ano seguinte passou a ocupar o cargo de presidente da Contag, e no\nexercício de seu mandato, assinou um manifesto aos trabalhadores e ao\npovo em geral, convocando-os para o comício marcado para 13 de março de\n1964 na Central do Brasil, no Rio, em defesa da implantação das reformas\nde base, do respeito às liberdades democráticas e sindicais e da\nextensão do direito de voto aos analfabetos e soldados. Representando a\nconfederação de que era presidente e, oficiosamente, o PCB, foi um dos\noradores desse comício, presidido pelo próprio presidente da República.\n\nApós o movimento político-militar que depôs o presidente João Goulart em\n31 de março, foi destituído da presidência da Contag, que teve sua sede\ninvadida. A partir de 1964, trabalhou na reconstrução do PCB, mesmo sob\nos intensos ataques sofridos pelo partido. Nesse período, foi condenado\na cinco anos de reclusão no caso das cadernetas de Luís Carlos Prestes.\nFoi cassado em fevereiro de 1967, com base no Ato Institucional nº 2, de\noutubro de 1965. Em 1972, foi novamente condenado por seu trabalho na\norganização do partido na Volkswagen e, por orientação do PCB, deixou o\nBrasil em 1973, estabelecendo-se em Praga, na Tchecoslováquia, onde\nintegrou o secretariado da União Internacional dos Trabalhadores\nAgrícolas. Permaneceu em Praga durante todo o tempo de exílio, viajando\nocasionalmente a trabalho à África e à América Latina.\n\nBeneficiado pela Lei da Anistia, decretada em agosto de 1979 pelo\npresidente João Figueiredo, voltou ao Brasil no mês seguinte,\ndesembarcando em São Paulo juntamente com oito exilados. Ainda em 1979,\nretomou seu trabalho na seção sindical do PCB, ainda na clandestinidade,\ne aposentou-se como jornalista em dezembro. Além disso, assumiu a\neditoria de campo do jornal Correio Sindical de Unidade e permaneceu no\nConselho da União Internacional dos Trabalhadores na Agricultura,\nFlorestas e Plantações (UISTAFP).\n\nEm setembro de 1984, fundou, junto com outros companheiros, o Instituto\nCultural Roberto Morena, e em 1986, deixou o Conselho da UISTAFP. Na\ndécada de 1990, por conta de um tratamento de câncer que afetou as\ncélulas cerebrais, viu-se obrigado a afastar-se do Instituto, que com\nsua ausência acabou por desaparecer, mas continuou participando das\nreuniões do PCB. Por conta do agravamento de sua doença, afastou-se de\nsuas atividades políticas em dezembro de 1998. Nessa data, internou-se\nnuma clínica para idosos, em São Paulo. Em julho de 2000, ainda\nencontrava-se internado.\n\nCasou-se com Herondina Ferreira Arruda com quem teve três filhos.\nContraiu segundas núpcias com Esperança Cardona, com quem teve duas\nfilhas.\n\n \n\nFONTES: BEZERRA, G. *Memórias*(2);*Globo*(21/9/79);*PCB*.\n\n \n","ref":"FONTES: BEZERRA, G. *Memórias*(2);*Globo*(21/9/79);*PCB*.\n\n \n","dic":"DHBB"}
