{"title":"SILVA, Luciano Pereira da","cargoss":["Deputado federal","Consultor-geral da República"],"cargos_esp":[0,0],"datas_ini":[1912,1950],"datas_fim":[1914,1951],"estados":["AM",0],"autor":[0],"content":"**SILVA, Luciano Pereira da**\n\n\\*dep. fed. AM 1912-1914; consult.-ger. Rep. 1950-1951.\n\n \n\n*Luciano Pereira da Silva* nasceu no Piauí em 1885.\n\nBacharelando-se em ciências jurídicas e sociais pela Faculdade de\nDireito do Recife, elegeu-se posteriormente deputado estadual no\nAmazonas e deputado federal pelo mesmo estado para a legislatura de 1912\na 1914. Consultor jurídico do Ministério da Agricultura, foi presidente\ne relator das comissões que elaboraram os anteprojetos dos códigos\nFlorestal, Rural e de Minas, respectivamente em 1923, 1942 e 1944.\n\nDurante o governo do general Eurico Gaspar Dutra (1946-1951), exerceu as\nfunções de consultor-geral da República, cargo que assumiu em junho de\n1950, em substituição a Haroldo Teixeira Valadão. Em março de 1951, no\ninício do segundo governo de Getúlio Vargas (1951-1954), foi substituído\npor Carlos Medeiros Silva.\n\nFaleceu na cidade do Rio de Janeiro no dia 16 de julho de 1975.\n\nTeve cinco filhos.\n\n \n\n \n\nFONTES: Câm. Dep. seus componentes; CORRESP. CONSULT. GER. REP.; Jornal\ndo Brasil (17 e 18/7/75).\n\n \n","ref":"FONTES: Câm. Dep. seus componentes; CORRESP. CONSULT. GER. REP.; Jornal\ndo Brasil (17 e 18/7/75).\n\n \n","dic":"DHBB"}
