{"title":"SILVA, Martins e","cargoss":["Constituinte","Deputado federal"],"cargos_esp":[0,0],"datas_ini":[1934,1935],"datas_fim":[1934,1937],"estados":[0,"PA"],"autor":[0],"content":"**SILVA, Martins e**\n\n\\*const. 1934; dep. fed. PA 1935-1937.\n\n \n\n*Luís Martins e Silva*****nasceu em Mauá (PA) no dia 5 de novembro de\n1898, filho de Eduardo Frutuoso Martins e Silva e de Joana Adelaide\nMartins e Silva.\n\nCursou o primário no Colégio São Carlos, no Porto, em Portugal, e o\nsecundário no Colégio Progresso Brasil e nos ginásios paraenses Pais de\nCarvalho e Nossa Senhora do Carmo, onde concluiu os preparatórios.\n\nEm 1917 ingressou na imprensa como repórter no jornal O Tempo, além de\nexercer a função de secretário do Serviço de Profilaxia Rural e Doenças\nVenéreas. Ainda nesse ano fundou a Liga contra a Lepra durante o governo\nde Lauro Sodré (1917-1921), além de tentar fundar uma escola\nprofissional para repórteres em Belém. Em 1918 tornou-se presidente da\nLiga Nacionalista do Pará, cargo que ocuparia até 1930. Também em 1918\nincentivou o movimento em prol da mulher operária, associando-se então a\nnúcleos sindicais. Matriculado em 1919 na Faculdade de Medicina do Pará,\nem 1922 iniciou as campanhas de assistência aos leprosos da colônia\nparaense de Tocunduba e de profilaxia e assistência ao mal venéreo,\ntornando-se um dos fundadores do Asilo de Madalena, também no Pará.\n\nNo ano seguinte transferiu-se para o Rio de Janeiro, então Distrito\nFederal, passando à condição de interno do Hospital Hahnnemanniano. Em\n1924 matriculou-se na Faculdade Hahnnemanniana de Medicina, também na\ncapital federal, cujo curso não concluiu em virtude de dificuldades\nfinanceiras. Ainda no Rio de Janeiro, atuou em 1928 como interno do\nHospital São Sebastião, regressando em seguida ao Pará para dar início a\numa campanha de assistência à infância de seu estado. Em 1930 liderou a\nparalisação de todas as atividades em Belém por três dias úteis devido\nao descumprimento da promessa de assistência social às classes que\nliderava.\n\nApós a Revolução de 1930 tornou-se, em 1932, chefe do Departamento de\nNegócios Municipais durante a interventoria de Joaquim Magalhães Cardoso\nBarata (1930-1935). No pleito de julho de 1933 elegeu-se deputado\nclassista, como representante dos empregados do livro e jornal, à\nAssembléia Nacional Constituinte, assumindo o mandato em novembro do\nmesmo ano. Durante os trabalhos constituintes destacou-se na elaboração\nda legislação trabalhista e, após promulgada a nova Carta (16/7/1934) e\na eleição do presidente da República no dia seguinte, teve o mandato\nestendido até maio de 1935. Ainda em 1934 supervisionou no Pará a\nfundação de um partido trabalhista, sendo também autor de um projeto que\nestabelecia oito horas de trabalho para os marítimos. Nesse mesmo ano\ntornou-se presidente da Federação do Trabalho do Pará, bem como do\nPartido Social Trabalhista Nacional.\n\nEm 1934 elegeu-se deputado federal profissional, iniciando novo mandato\nem maio do ano seguinte. Autor do projeto de criação da Casa Doméstica\nem 1936, em junho de 1937 fundou e presidiu o Partido Social Democrático\n(PSD) do Pará. Nesse mesmo ano, na Câmara dos Deputados, foi autor dos\nprojetos de criação da Casa dos Trabalhadores do Brasil, da Casa do\nJornaleiro, do Instituto de Pesca e da Casa do Escoteiro, além de um\noutro sobre a navegação na Amazônia. Exerceu o mandato até novembro de\n1937, quando o Estado Novo suprimiu todos os órgãos legislativos do\npaís. Desapontado com os rumos que tomara o país, abandonou\ndefinitivamente a política partidária, fixando residência no Rio de\nJaneiro, onde passou a exercer as funções de secretário e inspetor do\nJuizado de Menores.\n\nFundador do Partido Proletário, foi correspondente especial de O Globo,\nno Rio de Janeiro, redator e gerente do Estado do Pará, secretário de\nredação do Diário do Pará, diretor proprietário de O Combate, em Belém,\nsecretário de redação da Folha do Norte e redator do Diário do Povo,\nambos também na capital paraense, e redator de O Jornal, no Rio de\nJaneiro. Foi ainda presidente da Casa do Pará no Rio de Janeiro e da\nFederação Brasileira de Trabalho.\n\nFaleceu na cidade do Rio de Janeiro em 1970.\n\n \n\n \n\nFONTES: Boletim Min. Trab.; BORGES, R. Vultos; CÂM. DEP. Deputados;\nCRUZ, E. História do Pará; Diário do Congresso Nacional; GODINHO, V.\nConstituintes; HIRSCHOWICZ, E. Contemporâneos.\n\n \n","ref":"FONTES: Boletim Min. Trab.; BORGES, R. Vultos; CÂM. DEP. Deputados;\nCRUZ, E. História do Pará; Diário do Congresso Nacional; GODINHO, V.\nConstituintes; HIRSCHOWICZ, E. Contemporâneos.\n\n \n","dic":"DHBB"}
