{"title":"SILVA, Murilo Vasco do Vale e","cargoss":["Comandante do V Distrito Naval","comte -em-ch Esquadra","Chefe do Estado-Maior das Forças Armadas"],"cargos_esp":[0,0,0],"datas_ini":[1963,1966,1969],"datas_fim":[1964,1967,1971],"estados":[0,0,0],"autor":[0],"content":"**SILVA, Murilo Vasco do Vale e**\n\n\\*militar; comte. V DN 1963-1964; comte.-em-ch. Esquadra 1966-1967; ch.\nEMFA 1969-1971.\n\n \n\n*Murilo Vasco do Vale e Silva* nasceu no Rio de Janeiro, então Distrito\nFederal, no dia 31 de agosto de 1907, filho****de Manuel Joaquim da\nSilva e de Agostina do Vale Silva.\n\nSentou praça na Escola Naval do Rio de Janeiro em abril de 1925. Foi\npromovido a segundo-tenente em outubro de 1929, a primeiro-tenente em\nagosto de 1931, a capitão-tenente em outubro de 1933, a\ncapitão-de-corveta em janeiro de 1944 e a capitão-de-fragata em setembro\nde 1949. Participou da delegação brasileira à Junta Interamericana de\nDefesa em Washington, de setembro de 1952 a outubro de 1953, e foi\npromovido a capitão-de-mar-e-guerra em março de 1954, realizando o curso\nda Escola de Comando e Estado-Maior do Exército (ECEME) em 1955. Foi\nvice-diretor da Escola de Guerra Naval no Rio de Janeiro de fevereiro de\n1958 a 1959 e tornou-se comandante da base naval de Salvador em abril\ndesse ano. Promovido a contra-almirante em novembro de 1959, deixou\nSalvador no mês seguinte.\n\nDe março de 1960 a janeiro de 1961 cursou a Escola Superior de Guerra\n(ESG) no Rio de Janeiro, assumindo em seguida o Comando do Estado-Maior\nConjunto das Forças Armadas (CEMCFA), onde permaneceu até fevereiro de\n1963. No mês seguinte foi nomeado comandante do V Distrito Naval (V DN),\ncom sede em Florianópolis, substituindo o contra-almirante Jurandir da\nCosta Müller Campos. Em setembro de 1964, foi promovido a vice-almirante\ne em dezembro deixou o comando do V DN, sendo substituído pelo\ncontra-almirante Áureo Dantas Torres. Em janeiro de 1965 tornou-se\nvice-chefe do Estado-Maior da Armada (EMA), permanecendo no cargo até\nmarço de 1966, quando assumiu o posto de comandante-em-chefe da\nEsquadra, em substituição ao almirante-de-esquadra Sílvio Monteiro\nMurtinho. Foi promovido a almirante-de-esquadra em dezembro.\n\nDeixou o comando da Esquadra em março de 1967, passando o cargo para o\nvice-almirante Mário Cavalcanti Albuquerque, para assumir a presidência\nda Comissão Militar Mista Brasil-Estados Unidos em abril, onde\npermaneceu até outubro de 1969. Nesse mês foi nomeado chefe do\nEstado-Maior das Forças Armadas (EMFA), em substituição ao general\nOrlando Geisel. Exerceu essa chefia****até setembro de 1971, dando lugar\nao general Idálio Sardenberg. Em seu período na Marinha, realizou ainda\nos cursos de máquinas, básico de comando e superior da Escola de Guerra\nNaval. Cursou ainda a Escola Politécnica Especial.\n\nFaleceu na cidade do Rio de Janeiro no dia 31 de janeiro de 1980.\n\nEra casado com Hilda do Vale Silva, com quem teve um filho.\n\n \n\n \n\nFONTES: CORRESP. ESTADO-MAIOR DAS FORÇAS ARMADAS; CORRESP. SERV. DOC.\nGER. MAR.; Jornal do Brasil (31/10/75, 1 e 7/2/80); MIN. MAR. Almanaque;\nPerfil (1971).\n\n \n","ref":"FONTES: CORRESP. ESTADO-MAIOR DAS FORÇAS ARMADAS; CORRESP. SERV. DOC.\nGER. MAR.; Jornal do Brasil (31/10/75, 1 e 7/2/80); MIN. MAR. Almanaque;\nPerfil (1971).\n\n \n","dic":"DHBB"}
