{"title":"SILVA, Rui","cargoss":["Deputado federal"],"cargos_esp":[0],"datas_ini":[1979],"datas_fim":[1983],"estados":["SP"],"autor":[0],"content":"**SILVA, Rui**\n\n\\*dep. fed. SP 1979-1983.\n\n*Rui Silva* nasceu em Palmital (SP) no dia 14 de janeiro de 1928, filho\nde Antônio Viana Silva e de Antônia Binatto Silva.\n\nIndustrial, pecuarista e comerciante, foi prefeito de Assis (SP) entre\n1964 e 1966 pelo Partido Social Progressista (PSP).\n\nEm novembro de 1966 foi eleito deputado estadual na legenda da Aliança\nRenovadora Nacional (Arena), partido de sustentação do regime militar\ninstaurado no país em abril de 1964, assumindo o mandato em fevereiro de\n1967. Foi reeleito para a Assembléia Legislativa em novembro de 1970 e\n1974. Na legislatura 1975-1979, ocupou a pasta de Esportes e Turismo do\ngoverno Paulo Egídio Martins.\n\nEm novembro de 1978 elegeu-se deputado federal. Com a extinção do\nbipartidarismo em novembro de 1979 e a conseqüente reorganização\npartidária, ingressou no Partido Democrático Social (PDS), agremiação\nque deu continuidade à extinta Arena. Durante o mandato, foi membro da\nComissão de Economia, Indústria e Comércio, de Relações Exteriores e\nsuplente da Comissão de Finanças e Transportes da Câmara dos Deputados.\n\nNão se candidatou à reeleição em novembro de 1982 e deixou a Câmara em\njaneiro do ano seguinte, ao final da legislatura. Abandonando a carreira\npolítica, dedicou-se a atividades agropecuárias.\n\nFoi assassinado na capital paulista no dia 3 de fevereiro de 2002.\n\nCasado com Maria Helena de Oliveira Silva, teve dois filhos.\n\n \n\nFONTES: CÂM. DEP. *Deputados brasileiros. Repertório* (1979-1983);\nPortal da ALESP; TRIB. SUP. ELEIT. *Dados* (8, 9 e 11).\n\n \n\n \n","ref":"FONTES: CÂM. DEP. *Deputados brasileiros. Repertório* (1979-1983);\nPortal da ALESP; TRIB. SUP. ELEIT. *Dados* (8, 9 e 11).\n\n \n\n \n","dic":"DHBB"}
