{"title":"SILVEIRA, Luís","cargoss":["Deputado federal","Deputado federal"],"cargos_esp":[0,0],"datas_ini":[1947,1918],"datas_fim":[1950,1930],"estados":["AL","AL"],"autor":[0],"content":"SILVEIRA, Luís\n\n\\*dep. fed. AL 1918-1930 e 1947-1950.\n\n \n\n*Luís Magalhães da Silveira* nasceu em Recife no dia 22 de outubro de\n1869, filho de José Luís da Silveira e Henriqueta Magalhães da Silveira.\n\nJornalista, foi deputado federal por Alagoas durante a República Velha\nem quatro legislaturas de 1918 a 1929. Reeleito em março de 1930, teve\nseu mandato suspenso em outubro, quando os órgãos legislativos do país\nforam suspensos devido à Revolução de 1930.\n\nEm dezembro de 1945, com a queda do Estado Novo, elegeu-se suplente de\ndeputado à Assembléia Nacional Constituinte por Alagoas, na legenda do\nPartido Social Democrático (PSD). Assumiu o mandato apenas após a\npromulgação (setembro de 1946) da nova Constituição, ocupando uma\ncadeira na Câmara em julho de 1947. Durante a legislatura, integrou a\nComissão do Serviço Público Civil.\n\nFoi também secretário de Fazenda do estado.\n\nFaleceu no dia 5 de março de 1950, em pleno exercício do mandato.\n\n \n\nFONTES: CÂM. DEP. *Deputados*; CÂM. DEP. *Deputados brasileiros.\nRepertório* (1964-1967); *Diário do Congresso Nacional*; TRIB. SUP.\nELEIT. *Dados* (1).\n\n \n","ref":"FONTES: CÂM. DEP. *Deputados*; CÂM. DEP. *Deputados brasileiros.\nRepertório* (1964-1967); *Diário do Congresso Nacional*; TRIB. SUP.\nELEIT. *Dados* (1).\n\n \n","dic":"DHBB"}
