{"title":"SOARES, Gérson de Macedo","cargoss":["Comandante do III Distrito Naval","Chefe do Estado-Maior da Armada"],"cargos_esp":[0,0],"datas_ini":[1955,1957],"datas_fim":[1956,1957],"estados":[0,0],"autor":[0],"content":"**SOARES, Gérson de Macedo**\n\n\\*militar; comte. III DN 1955-1956; ch. EMA 1957.\n\n \n\n*Gérson de Macedo Soares* nasceu na chácara das Palmeiras, em Cabuçu,\nestação do Méier, no Rio de Janeiro, então Distrito Federal, no dia 23\nde março de 1894, filho de Brotero Frederico de Macedo Soares,\nengenheiro, e de Carolina Pires de Macedo Soares. Sua família teve\nmarcante influência na vida política e cultural do país, a começar por\nseu avô, Joaquim Mariano de Azevedo Soares, fazendeiro e expoente da\naristocracia rural fluminense. O conselheiro Antônio Joaquim de Macedo\nSoares, seu tio, foi ministro do Supremo Tribunal Federal (STF) de 1892\na 1905. Vários de seus primos destacaram-se na vida política: José\nEduardo de Macedo Soares foi deputado federal de 1915 a 1923, deputado à\nConstituinte de 1934 e senador de 1935 a 1937; José Carlos de Macedo\nSoares foi deputado à Constituinte de 1934, ministro das Relações\nExteriores de 1934 a 1937 e de 1955 a 1958, ministro da Justiça em 1937\ne interventor federal em São Paulo de 1945 a 1947; José Roberto de\nMacedo Soares foi embaixador no Uruguai entre 1945 e 1951; José Cássio\nde Macedo Soares foi deputado federal de 1935 a 1937; Edmundo de Macedo\nSoares e Silva foi ministro da Viação e Obras Públicas em 1946,\ngovernador do estado do Rio de Janeiro entre 1947 e 1951 e ministro da\nIndústria e Comércio de 1967 a 1969; José Armando de Macedo Soares\nAfonseca foi deputado federal à Constituinte em 1946 e Hélio de Macedo\nSoares e Silva foi deputado federal entre 1951 e 1955.\n\nSentou praça na Escola Naval do Rio de Janeiro em abril de 1912. Em\njaneiro de 1916 foi promovido a segundo-tenente e designado para viajar\nà Holanda com o objetivo de buscar os carvoeiros Mearim e Pindari, bem\ncomo a cábrea Paraguaçu. Seguiu até a Inglaterra em meio à Primeira\nGuerra Mundial (1914-1918), encontrando os portos ingleses bloqueados\npor ação dos alemães.\n\nFoi promovido a primeiro-tenente em julho de 1918. Em setembro de 1924\ntornou-se capitão-tenente. Entre 1928 e 1930, comandou a Escola de\nAprendizes-Marinheiros do Paraná, em Paranaguá. Durante a Revolução\nConstitucionalista deflagrada em São Paulo em julho de 1932, foi\nimediato no contratorpedeiro Mato Grosso na repressão ao movimento,\nderrotado em outubro desse ano.\n\nEm agosto de 1934 foi promovido a capitão-de-corveta. No ano seguinte\ntornou-se oficial de tiro da Esquadra, no estado-maior do almirante Raul\nTavares, comandante-em-chefe da Esquadra. Em dezembro de 1942 foi\npromovido a capitão-de-fragata.\n\nDurante a Segunda Guerra Mundial (1939-1945), chefiou o estado-maior do\nalmirante Alfredo Carlos Soares Dutra, comandante da Força Naval do\nNordeste, em operações de guerra. Comandou o contratorpedeiro Mato\nGrosso e a corveta Caravelas. Passou a capitão-de-mar-e-guerra em maio\nde 1946. De abril de 1949 a junho de 1953 representou o Ministério da\nMarinha no Conselho Nacional de Petróleo (CNP).\n\nEm 1950 foi encarregado do Escritório de Compras da Marinha em\nWashington. No ano seguinte cursou a Escola de Guerra Naval e foi\npromovido, em maio, a contra-almirante. Foi então designado presidente\nda Comissão de Recebimento dos Cruzadores Barroso e Tamandaré em\nFiladélfia (EUA), retornando ao Brasil em 1952.\n\nEm outubro de 1954 foi promovido a vice-almirante. De fevereiro do ano\nseguinte até junho de 1956 comandou o III Distrito Naval, no lugar de\nAmérico Jacques Mascarenhas da Silveira. Foi substituído por Heitor\nBatista Coelho, ao deixar esse posto. No ano seguinte tornou-se\ninspetor-geral da Marinha. Almirante-de-esquadra, foi designado chefe do\nEstado-Maior da Armada (EMA) em outubro de 1957 no lugar de Renato de\nAlmeida Guillobel, exercendo essa função por apenas dez dias.\nSubstituiu-o Antônio Maria de Carvalho.\n\nDurante sua carreira na Marinha foi também instrutor de guardas-marinha\nno encouraçado São Paulo e do curso de artilharia para oficiais. Foi\nimediato do cruzador Rio Grande do Sul, do navio-escola José Bonifácio e\ndo navio-tanque Marajó. Comandou ainda o Centro de Instruções Almirante\nWandenkolk, o encouraçado Minas Gerais, a Flotilha de Caça-Submarinos e,\ninterinamente, a Flotilha de Submarinos. Foi diretor de Armamento da\nMarinha. Fez também os cursos de artilharia e de comando.\n\nRepresentou a Marinha no Conselho de Segurança Nacional, como\nadjunto-chefe do gabinete da secretaria. Serviu no Estado-Maior das\nForças Armadas, na subchefia da Marinha. Foi ainda capitão dos portos no\nParaná e presidente da Comissão Mista de Levantamentos Cartográficos.\n\nColaborou nos jornais O Mercantil, de Santos Dumont (MG), Gazeta de\nAngra (RJ), Jornal do Brasil (RJ) e Jornal do Comércio (Recife). Fundou\ne redigiu as revistas O Marujo e A Marinha em Revista.\n\nEra sócio do Pen Clube do Brasil, da Sociedade Brasileira de Geografia e\nda Associação Brasileira de Imprensa (ABI).\n\nFaleceu no dia 19 de março de 1968.\n\nFoi casado com Iara de Almeida Macedo Soares, com quem teve três filhos.\n\nPublicou A ação da Marinha na revolução paulista de 1924 (1932), 15 dias\nnas prisões do Estado e O contratorpedeiro baleado.\n\n \n\n \n\nFONTES: ANDREA, J. Marinha; CONSULT. MAGALHÃES, B.; CORRESP. SERV. DOC.\nGER. MAR.; COUTINHO, A. Brasil; Histórico; MIN. MAR. Almanaque (1959);\nRIBEIRO FILHO, J. Dic.\n\n \n","ref":"FONTES: ANDREA, J. Marinha; CONSULT. MAGALHÃES, B.; CORRESP. SERV. DOC.\nGER. MAR.; COUTINHO, A. Brasil; Histórico; MIN. MAR. Almanaque (1959);\nRIBEIRO FILHO, J. Dic.\n\n \n","dic":"DHBB"}
