{"title":"SOARES, José Cássio de Macedo","cargoss":["Deputado federal"],"cargos_esp":[0],"datas_ini":[1935],"datas_fim":[1937],"estados":["SP"],"autor":[0],"content":"**SOARES, José Cássio de Macedo**\n\n\\*dep. fed. SP 1935-1937.\n\n \n\n*José Cássio de Macedo Soares* nasceu em Piratininga (SP) no ano de\n1889, filho de José Eduardo de Macedo Soares, empresário e professor, e\nde Cândida Azevedo Sodré de Macedo Soares. Sua família teve atuação\ndestacada na vida política e cultural do país: seu avô, Joaquim Mariano\nde Azevedo Soares, foi fazendeiro e aristocrata rural fluminense e seu\ntio, o conselheiro Antônio Joaquim de Macedo Soares, foi ministro do\nSupremo Tribunal Federal (STF) de 1892 a 1905. Entre seus irmãos\nsobressaíram José Carlos de Macedo Soares, deputado à Constituinte de\n1934, ministro das Relações Exteriores de 1934 a 1937 e de 1955 a 1958,\nministro da Justiça em 1937 e interventor federal em São Paulo de 1945 a\n1947; José Eduardo de Macedo Soares, jornalista, deputado federal pelo\nRio de Janeiro de 1915 a 1923, deputado à Constituinte de 1934 e senador\npelo Rio de Janeiro de 1935 a 1937, e José Roberto de Macedo Soares,\ndiplomata e embaixador no Uruguai entre 1945 e 1951. Destacaram-se ainda\nseus primos Edmundo de Macedo Soares e Silva, ministro de Viação e Obras\nPúblicas em 1946, governador do estado do Rio de Janeiro entre 1947 e\n1951 e ministro da Indústria e Comércio em 1967, José Armando de Macedo\nSoares e Afonseca, deputado federal à Constituinte de 1946, e Hélio de\nMacedo Soares e Silva, deputado federal entre 1951 e 1955.\n\nFormou-se pela Escola de Farmácia e Odontologia de São Paulo em 1908 e\npela Faculdade de Medicina do Rio de Janeiro em 1913.\n\nProfessor do curso de medicina da Universidade de São Paulo, em outubro\nde 1934 foi eleito deputado federal por seu estado na legenda do Partido\nConstitucionalista. Assumindo sua cadeira em maio de 1935, permaneceu na\nCâmara até 10 de novembro de 1937, quando o advento do Estado Novo\nsuprimiu os órgãos legislativos do país.\n\nSuperintendente da companhia de seguros A São Paulo e presidente da\nCompanhia Agrícola Araquá, foi também diretor da Sociedade Rural\nBrasileira e da Federação dos Criadores de Bovinos. Organizou uma escola\nprofissional feminina no Asilo Santo Antônio de Araras e exerceu ainda\nas funções de diretor-tesoureiro do Instituto D. Ana Rosa e de diretor\ndo Departamento de Assistência Social.\n\nSócio-benemérito da Sociedade de Medicina e Cirurgia, foi membro da\nSanta Casa de Misericórdia de Santos, do Conselho Consultivo do Estado\nde São Paulo, da Comissão das Obras da Catedral de São Paulo e do\nInstituto Histórico e Geográfico de seu estado.\n\nFaleceu em 1963.\n\nPublicou Estudo da história da lepra em São Paulo (1925).\n\n \n\n \n\nFONTES: CÂM. DEP. Deputados; DEP. PESQ. ESTADO SP; Diário do Congresso\nNacional; LEITE, A. História; MELO, L. Dic.\n\n \n","ref":"FONTES: CÂM. DEP. Deputados; DEP. PESQ. ESTADO SP; Diário do Congresso\nNacional; LEITE, A. História; MELO, L. Dic.\n\n \n","dic":"DHBB"}
