{"title":"SOARES, Raimundo","cargoss":["Deputado federal"],"cargos_esp":[0],"datas_ini":[1960],"datas_fim":[1962],"estados":["RN"],"autor":[0],"content":"**SOARES, Raimundo**\n\n\\*dep. fed. RN 1960-1962.\n\n*Raimundo Soares de Sousa*nasceu em Caraúbas (RN) no dia 19 de junho de\n1920, filho de Silvério Soares de Sousa, que era advogado, desembargador\ne professor em Mossoró.\n\nRealizou os cursos primário e secundário em Mossoró (RN) e em Natal e o\npré-jurídico no Ginásio Pernambucano de Recife, concluindo-o em 1938. Em\n1943 formou-se pela Faculdade de Direito de Recife\n\nIniciou suas atividades profissionais como promotor de Justiça nas\ncomarcas de Jardim do Seridó, Ceará Mirim e Areia Branca, todas no Rio\nGrande do Norte, sendo convocado nesse período para prestar o serviço\nmilitar em virtude da participação brasileira na Segunda Guerra Mundial\n(1939-1945). Desmobilizado quando já se iniciava o processo de\ndesagregação do Estado Novo (1937-1945), participou, no início de 1945,\nda fundação da Esquerda Democrática, denominação dada a um grupo de\npolíticos e intelectuais de tendências predominantemente socialistas,\nque se reuniu para consolidar, num só movimento, a oposição comum ao\nEstado Novo e ao presidente Getúlio Vargas. Pouco tempo depois ligou-se\nà União Democrática Nacional (UDN), partido político de oposição a\nVargas.\n\nEm 1946 instalou seu escritório de advocacia em Mossoró, elegendo-se, em\noutubro de 1954, suplente de deputado estadual no Rio Grande do Norte,\nna legenda da Aliança Democrata Cristã, constituída pela UDN e o Partido\nDemocrata Cristão (PDC). Em outubro de 1958, candidatou-se a deputado\nfederal pelo Rio Grande do Norte, na legenda da Frente Democrática\nNacional, que reunia a UDN, o Partido Social Trabalhista (PST) e o\nPartido Trabalhista Nacional (PTN). Obteve uma suplência e exerceu o\nmandato em maio de 1960, de abril a agosto de 1961 e de maio a novembro\nde 1962, sendo autor de um projeto de lei aprovado pela Câmara que\nalterou a redação do artigo 143 do Código do Processo Civil e deu\ncompetência aos juízes de primeira instância para o processo de mandado\nde segurança, quando a autoridade local fosse apontada como co-autora.\nFoi também de sua autoria a proposição que permitia ao juiz manter no\nuso da terra, em caso de parceria, o colono ameaçado de expulsão pelo\nproprietário, até a decisão final da causa. Em novembro de 1962, votou a\nfavor da Emenda Constitucional nº 5, que ampliou a participação dos\nmunicípios na renda tributária nacional.\n\nDe acordo com o jornal *Correio Brasiliense,*na edição de 20 de agosto\nde 1962, Raimundo Soares encarava a questão da reforma agrária sob o\nprincípio de que a área agrícola até então ocupada deveria ser\naumentada. Respeitando o instituto da propriedade privada, dentro dos\nreferidos limites, considerava que o Estado deveria desapropriar a terra\nimprodutiva, com vistas a uma reestruturação da propriedade fundiária\nque redistribuísse a terra e ampliasse a área cultivada, dando aos\ncolonos garantia de crédito, de assistência técnico-educacional, de\ntransporte e de amparo médico-sanitário.\n\nEra favorável à cédula única, ao direito de voto para os analfabetos e à\nrealização de um referendo sobre o parlamentarismo no início de 1965,\nconforme previa a emenda constitucional que o implantara em setembro de\n1961. Considerava também que o aspecto mais importante a ser modificado\nnas eleições se referia aos abusos do poder econômico no processo\ndemocrático, prejudicando a autenticidade do voto popular. Aceitava o\ndirigismo estatal no campo econômico, como supletivo e corretivo da\niniciativa privada, e defendia o monopólio estatal do petróleo, da\nenergia elétrica, dos transportes ferroviários e marítimos, sendo a\nfavor de sua ampliação, no interesse da segurança nacional ou na\niminência de novas concentrações monopolistas privadas. Era ainda\ncontrário ao capital estrangeiro espoliativo, que deveria ser policiado,\ne defendia a criação de condições para o ingresso e reinvestimento desse\ncapital quando atendessem ao interesse econômico nacional. Ainda segundo\na mesma edição do *Correio Brasiliense,*era favorável a uma reforma\nbancária que ampliasse o crédito às atividades produtivas, a juros\nbaixos e prazos longos, com maior atenção à lavoura e à pecuária,\neliminando assim o crédito aproveitado na especulação.\n\nMunicipalista, preconizava uma ênfase à assistência educacional e\nsanitária, com a ampliação da rede hospitalar, do ensino técnico,\nagrícola e industrial no interior do país e o aumento do número de\nescolas de artesanato. Considerava necessária uma reforma que adaptasse\na Constituição às novas condições trazidas pelo desenvolvimento, desde\nque realizada pelo Poder Legislativo ordinário. No plano da política\ninternacional, apoiava o respeito aos princípios da não-intervenção e de\nautodeterminação, mas também a obediência aos acordos firmados pelo\ngoverno brasileiro e a preservação do país no bloco ocidental.\n\nDeixando a Câmara, elegeu-se prefeito de Mossoró, e tornou-se diretor da\nCompanhia Federal de Seguros, sendo, em 1974, um dos 12 políticos\ncogitados para o governo do estado, em substituição a José Cortez\nPereira de Araújo. A escolha, no entanto, recaiu em Tarcísio Maia,\neleito indiretamente e empossado em março de 1975.\n\nFoi também professor catedrático de psicologia do Instituto de\nSociologia da Faculdade de Ciências Econômicas de Mossoró.\n\nFONTES: CÂM. DEP. *Deputados brasileiros. Repertório*(1946-1967)*;*CÂM.\nDEP. *Súmulas;*CAMPOS, Q. *Fichário;*NÉRI, S. *16;*TRIB. SUP. ELEIT.\n*Dados*(3 e 4).\n\n \n","ref":"FONTES: CÂM. DEP. *Deputados brasileiros. Repertório*(1946-1967)*;*CÂM.\nDEP. *Súmulas;*CAMPOS, Q. *Fichário;*NÉRI, S. *16;*TRIB. SUP. ELEIT.\n*Dados*(3 e 4).\n\n \n","dic":"DHBB"}
