{"title":"SOBRAL, Teodoro","cargoss":["Interventor","Deputado federal","Deputado federal","Deputado federal"],"cargos_esp":[0,0,0,0],"datas_ini":[1946,1950,1949,1947],"datas_fim":[1946,1950,1949,1948],"estados":["PI","PI","PI","PI"],"autor":[0],"content":"**SOBRAL, Teodoro**\n\n\\*interv. PI 1946; dep. fed. PI 1947-1948, 1949 e 1950.\n\n \n\n*Teodoro Ferreira Sobral* nasceu em Amarante (PI) no dia 10 de janeiro\nde 1891, filho de Manuel Ferreira da Silva Sobral e de Hermínia Paiva\nSobral.\n\nFarmacêutico, com a queda do Estado Novo (29/10/1945) e a conseqüente\nredemocratização do país, no pleito de dezembro de 1945 concorreu a uma\ncadeira na Assembléia Nacional Constituinte pelo Piauí na legenda do\nPartido Social Democrático (PSD), mas ficou apenas com a primeira\nsuplência.\n\nApós a promulgação da Constituição (18/9/1946) e a transformação da\nConstituinte em Congresso ordinário, em 11 de outubro seguinte assumiu o\ncargo de interventor federal no Piauí nomeado pelo presidente Eurico\nGaspar Dutra (1946-1951) para substituir Manuel Sotero Vaz da Silveira.\nLicenciou-se de 9 de novembro até 9 de dezembro do mesmo ano, quando foi\nsubstituído, interinamente, por Raimundo de Brito Melo. Reassumindo\nneste último mês, permaneceu à frente da interventoria até 17 de março\nde 1947, quando foi substituído, em caráter interino, por Valdir de\nFigueiredo Gonçalves. Ocupou uma cadeira na Câmara dos Deputados de\nnovembro de 1947 a março de 1948, de junho a outubro de 1949 e de agosto\na novembro de 1950, deixando de concorrer a qualquer cargo eletivo no\npleito de outubro deste último ano.\n\nFaleceu em 1973.\n\n \n\nFONTES: CÂM. DEP. *Deputados*; CÂM. DEP. *Deputados brasileiros.\nRepertório*(1946-1967); CÂM. DEP. *Relação dos dep*.; REGO NETO, H.\n*Fatos*; TRIB. SUP. ELEIT. *Dados* (1).\n\n \n","ref":"FONTES: CÂM. DEP. *Deputados*; CÂM. DEP. *Deputados brasileiros.\nRepertório*(1946-1967); CÂM. DEP. *Relação dos dep*.; REGO NETO, H.\n*Fatos*; TRIB. SUP. ELEIT. *Dados* (1).\n\n \n","dic":"DHBB"}
