{"title":"BARRETO, Cesário","cargoss":["Deputado federal"],"cargos_esp":[0],"datas_ini":[1979],"datas_fim":[1983],"estados":["CE"],"autor":[0],"content":"**BARRETO, Cesário**\n\n\\*dep. fed. CE 1979-1983.\n\n \n\n*Cesário Barreto Lima* nasceu em Sobral (CE) no dia 6 de dezembro de\n1920, filho de Francisco das Chagas Barreto Lima e Maria Cesarina Lima.\n\nComerciante e fazendeiro, formou-se perito-contador na Escola de\nComércio Dom José, em Sobral.\n\nElegeu-se prefeito de sua cidade natal nas eleições municipais de 1962,\nassumindo o cargo em março de 1963, e permaneceu à frente da Prefeitura\nde Sobral até março de 1967.\n\nNo pleito de novembro de 1978 elegeu-se deputado federal pelo Ceará na\nlegenda da Aliança Renovadora Nacional (Arena), partido que apoiava o\nregime militar, implantado no país em abril de 1964, e que fora criado\npelo Ato Institucional nº 2 de 27 de outubro de 1965, que extinguira os\npartidos políticos e instaurara o bipartidarismo. Foi empossado em\nfevereiro de 1979, e em novembro, com a extinção do bipartidarismo e a\nconseqüente reformulação partidária, filiou-se Partido Democrático\nSocial (PDS), agremiação que deu continuidade à Arena. Na Câmara dos\nDeputados integrou a Comissão de Economia, Indústria e Comércio e foi\nsuplente da Comissão de Transportes. Deixou a Câmara em janeiro de 1983,\nao final da legislatura, sem ter concorrido à reeleição no pleito de\nnovembro do ano anterior. Embora tenha deixado de disputar mandatos\neletivos por motivo de saúde, continuou atuando nos bastidores da\npolítica de Sobral.\n\nFaleceu em Fortaleza em 17 de janeiro de 1995.\n\nEra casado com Maria Tamar Pierre Barreto, com que teve seis filhos.\n\n \n\nFONTES:****CÂM. DEP. *Deputados brasileiros. Repertório* (1979-1983);\nINF. FAM.\n\n \n","ref":"FONTES:****CÂM. DEP. *Deputados brasileiros. Repertório* (1979-1983);\nINF. FAM.\n\n \n","dic":"DHBB"}
