{"title":"SOUSA, Genaro Ponte e","cargoss":["Deputado federal"],"cargos_esp":[0],"datas_ini":[1935],"datas_fim":[1937],"estados":["PA"],"autor":[0],"content":"**SOUSA, Genaro Ponte e**\n\n\\*dep. fed. PA 1935-1937.\n\n \n\n*Genaro Ponte e Sousa* nasceu em Belém no dia 2 de fevereiro de 1894.\n\nApós estudar no Instituto Amazônia e no Ginásio Pais de Carvalho, em\nBelém, ingressou na Faculdade Livre de Direito do Pará, pela qual se\nformou em 1919.\n\nAdvogado ativo, foi promotor público em Belém, procurador fiscal da\nFazenda do estado, chefe do contencioso da Prefeitura Municipal de Belém\ne secretário do Interior e Justiça do Pará.\n\nEm outubro de 1934, elegeu-se deputado federal pelo Pará, iniciando o\nmandato em maio do ano seguinte. Na Câmara, integrou o Grupo Parlamentar\nPró-Liberdades Populares, que em novembro de 1935 lançou um manifesto\nopondo-se à Lei de Segurança Nacional aprovada pelo Congresso em abril.\nExerceu o mandato até 10 de novembro de 1937, quando a instauração do\nEstado Novo suprimiu todas as câmaras legislativas do país.\n\nFoi autor de uma série de peças de teatro, especialmente revistas\nteatrais, como Tapioca, Está esticando, Disfarça e passa, Ou vai ou\nracha, Assacu, Quebra-peito, Onde estará o burro e Mistérios de New\nYork.\n\nPertencia à Sociedade Brasileira de Autores Teatrais, ao Instituto\nHistórico e Geográfico do Pará e ao Instituto da Ordem dos Advogados do\nPará.\n\nFaleceu no Rio de Janeiro, em 8 de agosto de 1945.\n\n \n\n \n\nFONTES: CÂM. DEP. Deputados; MACEDO, R. Efemérides; Personalidades;\nSILVA, H. 1935; SOUSA, J. Teatro.\n\n \n","ref":"FONTES: CÂM. DEP. Deputados; MACEDO, R. Efemérides; Personalidades;\nSILVA, H. 1935; SOUSA, J. Teatro.\n\n \n","dic":"DHBB"}
