{"title":"BARRETO, Edmundo Muniz","cargoss":["ch pol","Ministro do Supremo Tribunal Federal","Procurador-geral da República"],"cargos_esp":[0,0,0],"datas_ini":[1901,1910,1911],"datas_fim":[1902,1931,1919],"estados":["DF",0,0],"autor":[0],"content":"**BARRETO, Edmundo Muniz**\n\n\\*ch. pol. DF 1901-1902; min. STF 1910-1931; proc.-ger. Rep. 1911-1919.\n\n \n\n*Edmundo Muniz Barreto* nasceu no Rio de Janeiro, então capital do\nImpério, em 19 de maio de 1864, filho de Orosimbo Muniz Barreto, oficial\nda Marinha, e de Isidora Muniz Barreto.\n\nCursou a Faculdade de Direito de São Paulo, onde fundou, na última\nsérie, o Grupo Abolicionista Acadêmico, bacharelando-se em 1884.\n\nIniciou sua carreira em maio de 1886, quando foi nomeado juiz municipal\ne de órfãos em São Borja (RS), passando, em junho de 1888, a terceiro\njuiz substituto da Corte do Império. Após a proclamação da República,\ntornou-se juiz de direito na comarca de São Borja, cargo que deixou no\nano seguinte para assumir as funções de pretor da Justiça na 17ª\nPretoria do Distrito Federal. Em janeiro de 1892 foi transferido para a\n7ª Pretoria e em agosto de 1894 foi designado juiz do Tribunal Civil e\nCriminal, chegando a presidir esse órgão.\n\nNomeado pelo presidente Manuel de Campos Sales, em agosto de 1901, chefe\nde polícia do Distrito Federal, permaneceu nesse posto até o final do\ngoverno, em novembro de 1902. Em abril de 1904 participou da fundação da\nAssociação dos Funcionários Públicos Civis, sendo o primeiro a presidir\na entidade. Designado desembargador da Corte de Apelação em janeiro de\n1905, nesse ano deixou o Tribunal Civil e Criminal. Exerceu suas novas\nfunções até dezembro de 1910, quando se tornou ministro do Supremo\nTribunal Federal (STF).\n\nEm setembro de 1911 assumiu o cargo de procurador-geral da República,\nentão privativo de ministro do STF, ocupando-o até julho de 1919. Nesse\nperíodo dedicou-se intensamente às atividades da Associação dos\nFuncionários Públicos Civis, tendo sido criado, por iniciativa sua, o\nInstituto Muniz Barreto, destinado a amparar os filhos dos membros da\nassociação. Em 1922, além de participar do congresso jurídico\ncomemorativo da independência do Brasil, onde reivindicou a criação do\nmandado de segurança como complemento do *habeas*-*corpus,*foi aclamado,\nno mês de dezembro, presidente da Associação dos Funcionários Civis.\n\nApós a Revolução de 1930, foi aposentado discricionariamente, junto com\noutros cinco ministros do STF, por decreto do Governo Provisório de\nGetúlio Vargas datado de fevereiro de 1931. Afastado do STF, passou a\ncolaborar na imprensa do Distrito Federal, escrevendo artigos para o\n*Jornal do Comércio* sobre assuntos jurídicos.\n\nFaleceu no Rio de Janeiro em 18 de novembro de 1934.\n\nFoi casado com Emili do Paço William Muniz Barreto.\n\nPublicou *O* *território do Acre perante o* *STF*(1929), onde defendia\nos interesses do Acre contra os do estado do Amazonas, então sustentados\npor Rui Barbosa.\n\n \n\n \n\nFONTES: BALEEIRO, A. *Supremo;*COSTA, E*. Grandes*; *Grande encic.\nDelta;*LAGO, L. *Supremo;*MACEDO, R. *Efemérides;*MOREIRA, J.\n*Dic.;*ROQUE, C*. Grande*; SILVA, H. *1931.*\n\n \n","ref":"FONTES: BALEEIRO, A. *Supremo;*COSTA, E*. Grandes*; *Grande encic.\nDelta;*LAGO, L. *Supremo;*MACEDO, R. *Efemérides;*MOREIRA, J.\n*Dic.;*ROQUE, C*. Grande*; SILVA, H. *1931.*\n\n \n","dic":"DHBB"}
