{"title":"SOUSA, José Honorato de","cargoss":["Constituinte","Deputado federal"],"cargos_esp":[0,0],"datas_ini":[1934,1935],"datas_fim":[1934,1937],"estados":[0,"GO"],"autor":[0],"content":"**SOUSA, José Honorato de**\n\n\\*const. 1934; dep. fed. GO 1935-1937.\n\n*José Honorato da Silva e Sousa*nasceu no dia 2 de maio de 1898 em Goiás\nVelho, então capital do estado de Goiás, filho do desembargador Vicente\nMiguel da Silva Abreu e de Eugênia Fleury e Silva. Seu pai foi deputado\nfederal por Goiás entre 1935 e 1937 e seu irmão, Paulo Fleury, também\nfoi deputado federal por Goiás (1951-1954).\n\nDe família tradicional de Goiás, fez seus estudos iniciais no Ginásio\ndos Maristas, em Uberaba (MG), passando para o Liceu Salesiano em Cuiabá\ne, posteriormente, para o Liceu de Goiás. Ingressou na Faculdade de\nCiências Jurídicas de seu estado, formando-se em dezembro de 1920.\n\nAdvogado e jornalista, iniciou-se na vida política como militante do\nPartido Republicano de Goiás, combatendo o governo de Brasil Ramos\nCaiado (1925-1929). Redator da *Voz* *do Povo,*jornal da capital do\nestado, empenhou-se na divulgação da campanha da Aliança Liberal\n(1929-1930). Nessa época foi nomeado procurador de Getúlio Vargas e de\nJoão Pessoa, candidatos da Aliança Liberal à presidência e à\nvice-presidência da República, para fiscalizar as eleições de março de\n1930 e, mais tarde, acompanhar a apuração das mesmas em Goiás.\n\nDurante a Revolução de 1930 colocou-se ao lado de Carlos Pinheiro Chagas\ne à frente de um batalhão de civis e militares que invadiu o estado,\nproveniente de Minas Gerais. Com a queda do governo de Humberto Martins\nRibeiro (1929-1930) e a posse do interventor Pinheiro Chagas\n(27/10/1930), foi nomeado secretário do Interior e Justiça de Goiás.\nExerceu o cargo durante dois anos, nele sendo mantido na gestão do\ninterventor Pedro Ludovico Teixeira (1930-1932). Reformou nessa época o\nensino primário e normal de seu estado e instituiu a cadeira de história\nde Goiás nos estabelecimentos de ensino estadual.\n\nTomou parte na fundação do Partido Social Republicano (PSR) de seu\nestado, criado em janeiro de 1933, tornando-se membro de seu diretório\ncentral. Nessa legenda foi eleito em maio de 1933 deputado à Assembléia\nNacional Constituinte por Goiás. Assumindo sua cadeira em novembro do\nmesmo ano, participou ativamente dos trabalhos constituintes,\nprincipalmente nas emendas referentes ao Poder Judiciário e em defesa da\nmudança da capital da República para o planalto de Goiás. Após a\npromulgação da nova Carta no dia 16 de julho de 1934, teve seu mandato\nestendido até maio de 1935. Reeleito deputado federal em outubro de\n1934, permaneceu na Câmara até 10 de novembro de 1937, quando o advento\ndo Estado Novo suprimiu os órgãos legislativos do país.\n\nFoi ainda diretor de *O Social,*jornal editado em Goiás, e pertenceu ao\nInstituto Geográfico do estado, do qual foi um dos fundadores.\n\nCasou-se com Natália da Silva e Sousa.\n\nFONTES: CÂM. DEP. *Deputados; Câm. Dep.* *seus componentes;*GODINHO,\nV.*Constituintes; Grande encic. Delta.*\n\n \n","ref":"FONTES: CÂM. DEP. *Deputados; Câm. Dep.* *seus componentes;*GODINHO,\nV.*Constituintes; Grande encic. Delta.*\n\n \n","dic":"DHBB"}
