{"title":"SOUSA, Pompeu de","cargoss":["Constituinte","Senador"],"cargos_esp":[0,0],"datas_ini":[1987,1987],"datas_fim":[1988,1991],"estados":[0,"DF"],"autor":[0],"content":"**SOUSA, Pompeu de**\n\n\\*jornalista; const. 1987-1988; sen. DF 1987-1991.\n\n* *\n\n*Roberto Pompeu de Sousa Brasil* nasceu em Redenção (CE), no dia 22 de\nmarço de 1914, filho de Antônio Pompeu de Sousa Brasil e de Olímpia\nMagalhães de Sousa Brasil.\n\nFormado em psicologia e sociologia pela antiga Universidade do Brasil,\natual Universidade Federal do Rio de Janeiro (UFRJ), foi professor de\nportuguês no Colégio Pedro II e na Escola Amaro Cavalcanti (1936-1938),\ne de técnica de Jornalismo, no curso da Faculdade Nacional de Filosofia,\natual Faculdade de Comunicação da UFRJ (1945), participou da criação da\nAssociação Brasileira de Escritores (1945) e da União dos Trabalhadores\nIntelectuais (1946). Na área política foi um dos fundadores da União\nDemocrática Nacional (UDN) e do Partido Socialista Brasileiro (PSB),\nambos dissolvidos pelo regime militar, que instituiu o bipartidarismo\n(Ato Institucional nº 2, de 27/10/1965).\n\nRedator e fundador dos jornais *Meio Dia*e*Diário Carioca*, no Rio de\nJaneiro, e do *DC-Brasília*, durante o regime parlamentar (1961-1963)\nexerceu a chefia do Serviço de Imprensa do Conselho de Ministros.\nPresidente do grupo de trabalho que elaborou a regulamentação da\natividade profissional de jornalista (Decreto nº 1.177/62), e o Estatuto\ndo Jornalista (Decreto nº 1.176/62), participou da fundação da\nUniversidade de Brasília (UnB), (1964).\n\nConferencista convidado pelo British Council para transmitir a\nexperiência da UnB a sete novas universidades da Grã-Bretanha, fez parte\nda delegação brasileira que discutiu “a reforma e a renovação” do acordo\ncultural entre os governos do Brasil e do Reino Unido. De volta ao\nBrasil, integrou-se ao grupo de trabalho criado pelos ministérios das\nRelações Exteriores e da Educação e Cultura para “estudar a situação das\nresidências universitárias brasileiras no exterior, seu funcionamento,\ncoordenação de atividades e regulamentação”. No final de 1964 foi\ndesligado da cadeira de professor-titular da UnB por motivos políticos.\n\nNa década de 1970 atuou em diversos comitês na luta por liberdades\ndemocráticas e pela anistia, tendo presidido a Comissão de Liberdade de\nImprensa do Sindicato dos Jornalistas Profissionais do Distrito Federal,\no Comitê de Anistia, o Conselho de Defesa da Paz. Representante da ABI\nno Conselho Superior de Censura, presidiu a Comissão de Intelectuais e\nArtistas, criada pelo Ministério da Justiça, que redigiu o anteprojeto\nde lei de defesa da liberdade de expressão.\n\nCom a extinção do bipartidarismo em novembro de 1979, e a conseqüente\nreformulação partidária, filiou-se ao Partido do Movimento Democrático\nBrasileiro (PMDB). Secretário de Educação e Cultura no governo de José\nAparecido (1985-1988) no Distrito Federal,****desincompatibilizou-se do\ncargo para disputar as eleições de novembro de 1986.\n\nEleito senador na legenda do PMDB, assumiu a cadeira em fevereiro de\n1987, quando tiveram início os trabalhos da Assembléia Nacional\nConstituinte (ANC). Foi titular da Subcomissão da Ciência e Tecnologia e\nda Comunicação, da Comissão da Família, da Educação, Cultura e Esportes,\nda Ciência e Tecnologia e da Comunicação, e suplente da Subcomissão da\nUnião, Distrito Federal e Territórios, da Comissão da Organização do\nEstado, além de titular da Comissão do Distrito Federal.\n\nNas principais votações do período, votou a favor da limitação do\ndireito de propriedade, da nacionalização do subsolo, da estatização do\nsistema financeiro, da anistia aos micro e pequenos empresários, do\nlimite de 12% ao ano para os juros reais, da soberania popular, do\nmandado de segurança coletivo, do voto facultativo aos 16 anos, da\njornada semanal de 40 horas, do turno ininterrupto de seis horas, da\nremuneração 50% superior para o trabalho extra, do aviso prévio\nproporcional, da unicidade sindical, da criação de um fundo de apoio à\nreforma agrária, da desapropriação da propriedade produtiva, da\nproibição do comércio de sangue. E contra a pena de morte, o\npresidencialismo, o mandato de cinco anos para o então presidente José\nSarney, a demissão sem justa causa e a legalização do jogo do bicho.\n\nJornalista com passagem pelos principais órgãos da imprensa nacional,\nfoi diretor da Editora Abril em São Paulo e em Brasília; presidente do\nSindicato de Escritores do Distrito Federal e da representação da ABI em\nBrasília; membro da Associação Brasileira de Educação;\ndiretor-administrativo da Sociedade de Habitações Econômicas de\nBrasília; integrante do conselho consultivo da Companhia Nacional de\nÁlcalis; conselheiro de imprensa da Companhia Siderúrgica Nacional. Na\nUnB, dirigiu a Faculdade de Comunicação de Massa, o Centro de Extensão\nCultural, o Seminário Permanente de Problemas Brasileiros, o Seminário\nPermanente das Estruturas Docentes, o Centro de Teledifusão\nUniversitária e o Instituto Central de Letras (interino).\n\nFaleceu em Brasília no dia 11 de junho de 1991.\n\nEra casado com Otília Pompeu de Sousa Brasil, com quem teve seis filhos.\n\n \n\nFONTES: ASSEMB. NAC. CONST. *Repertório* (1987-1988); COELHO, J. &\nOLIVEIRA, A. *Nova*.\n\n \n","ref":"FONTES: ASSEMB. NAC. CONST. *Repertório* (1987-1988); COELHO, J. &\nOLIVEIRA, A. *Nova*.\n\n \n","dic":"DHBB"}
