{"title":"SOUSA, Vílson de","cargoss":["Constituinte","Deputado federal"],"cargos_esp":[0,0],"datas_ini":[1987,1987],"datas_fim":[1988,1991],"estados":[0,"SC"],"autor":[0],"content":"**SOUSA, Vílson de**\n\n\\*const. 1987-1988; dep. fed. SC 1987-1991.\n\n* *\n\n*Vílson Luís de Sousa* nasceu em Luís Alves (SC) no dia 29 de abril de\n1951, filho de Rodolfo Francisco de Sousa e de Adelina Clara Hess de\nSousa.\n\nFez o curso de direito na Fundação Universidade Regional de Blumenau\n(FURB) entre 1975 e 1978. Em 1980, lecionou as disciplinas instituições\nde direito e direito comercial naquela universidade. Pós-graduou-se em\ndireito, também na FURB, nos anos de 1983 e 1984 e em seguida ingressou\nna pós-graduação em política na Universidade Federal de Santa Catarina\n(UFSC), em Florianópolis, concluindo o curso em 1985. Nesse mesmo\nperíodo, cursou o mestrado em direito do Estado e ciências políticas,\ntambém na UFSC. Tornou-se membro, ainda em 1985, do colegiado do curso\nde pós-graduação em direito da UFSC.\n\nFiliado ao Partido do Movimento Democrático Brasileiro (PMDB), integrou\no diretório da agremiação em Blumenau. No biênio 1984-1985, foi membro\ndo conselho curador da seção catarinense da Fundação Pedroso Horta,\nligada ao PMDB.\n\nEm novembro de 1986, candidatou-se a deputado federal constituinte.\nEleito com 66.400 votos, a segunda maior votação do seu partido e do\nestado, assumiu o mandato em 1º de fevereiro de 1987, quando tiveram\ninício os trabalhos da Assembleia Nacional Constituinte. Foi titular da\nSubcomissão da União, Distrito Federal e Territórios, da Comissão da\nOrganização do Estado (1987), e suplente da Comissão de Sistematização\n(1987-1988). Nas principais votações da Constituinte, pronunciou-se a\nfavor do rompimento diplomático com países com política de discriminação\nracial, da limitação do direito de propriedade privada, do mandado de\nsegurança coletivo, do aborto, da estabilidade no emprego, da jornada\nsemanal de 40 horas, do turno ininterrupto de seis horas, do aviso\nprévio proporcional, da unicidade sindical, do voto aos 16 anos, da\nnacionalização do subsolo, da estatização do sistema financeiro, do\nlimite de 12% ao ano para os juros reais, da proibição do comércio de\nsangue, da limitação para os encargos da dívida e da criação de um fundo\nde apoio à reforma agrária. Foi contrário à pena de morte, ao\npresidencialismo, ao mandato de cinco anos para o presidente José Sarney\ne à legalização do jogo do bicho.\n\nCom a promulgação da nova Constituição em 5 de outubro de 1988, voltou a\nparticipar dos trabalhos legislativos ordinários da Câmara dos\nDeputados. Ainda em 1988, participou da fundação em Santa Catarina do\nPartido da Social Democracia Brasileira (PSDB). Sem concorrer à\nreeleição no pleito de outubro de 1990, deixou a Câmara dos Deputados em\njaneiro do ano seguinte, ao final da legislatura.\n\nDedicou-se à advocacia em Blumenau até retornar à política em 1992. Em\noutubro concorreu ao cargo de vice-prefeito de Blumenau na chapa\nencabeçada por Renato Viana (PSDB). Vitorioso, tomou posse em janeiro do\nano seguinte. Deixou a vice-prefeitura ao término do mandato em 31 de\ndezembro de 1996, voltando a advogar.\n\nFoi também membro das comissões de Direitos Humanos e de Estudos\nConstitucionais da Ordem dos Advogados do Brasil (OAB), seção Santa\nCatarina.\n\nCasou-se com Lindauria Isabel Mees de Sousa, com quem teve três filhos.\n\nPublicou *Tensão constituinte* (1986).\n\n \n\nFONTES: ASSEMB. NAC. CONST. *Repertório* (1987-1988); COELHO, J. &\nOLIVEIRA, A. *Nova*; INF. BIOG.\n\n \n","ref":"FONTES: ASSEMB. NAC. CONST. *Repertório* (1987-1988); COELHO, J. &\nOLIVEIRA, A. *Nova*; INF. BIOG.\n\n \n","dic":"DHBB"}
