{"title":"STÁBILE, Amauri","cargoss":["Ministro da Agricultura"],"cargos_esp":[0],"datas_ini":[1979],"datas_fim":[1984],"estados":[0],"autor":["Sinclair Cechine"],"content":"**STÁBILE, Amauri**\n\n\\*min. Agric. 1979-1984.\n\n \n\n*Ângelo Amauri Stábile* nasceu em São Paulo no dia 22 de março de 1927,\nfilho de Francisco Stábile e de Francisca Banillo Stábile.\n\nFez o curso secundário no Colégio Paraisense, em São Sebastião do\nParaíso (MG), e o superior na Faculdade de Ciências Econômicas da\nUniversidade de São Paulo (USP) em 1950. Ingressou no First National\nCity Bank em 1950, afastando-se 18 anos depois, quando ocupava o cargo\nde gerente. De 1969 a 1970 exerceu as funções de diretor adjunto no\nBanco da Lavoura de Minas Gerais (1969-1970), presidente do Banco do\nEstado de Minas Gerais (1970-1971), integrante da diretoria da 1ª Região\nda Carteira de Crédito Rural do Banco do Estado de São Paulo (1971-1972)\ne diretor do Banco do Brasil (1972-1974), retornou à diretoria do\nBanespa (1974-1975), tornando-se diretor superintendente da Sharp\nFinanceira, Crédito, Financiamento e Investimentos, e vice-presidente da\nSharp Indústria de Componentes Eletrônicos (1976-1979).\n\nNomeado para a secretaria geral do Ministério da Agricultura pelo então\nministro Antônio Delfim Neto em março de 1979, assumiu a pasta no dia 15\nde agosto, a convite do presidente João Batista Figueiredo (1979-1985),\nquando Delfim substituiu Mário Henrique Simonsen na Secretaria de\nPlanejamento.\n\nNo início da gestão propôs ao Congresso a criação do imposto territorial\nrural progressivo, segundo o princípio básico de que quanto mais a terra\nfosse fértil e mal-aproveitada, maior seria a taxação; inversamente,\nquanto melhor fosse o aproveitamento da propriedade, menor a tributação.\nNa mesma época, junto com o então ministro do Interior, Mário Andreazza,\napresentou projeto de lei que previa a criação do Programa\nEcológico-Econômico para a Amazônia Brasileira.\n\nEm março de 1980 foi acusado de envolvimento na aquisição pela Sharp de\num milhão de hectares de terras da Cooperativa Central Regional Iguaçu\ndo Paraná. Na tribuna da Câmara, o deputado Hélio Duque, do Partido do\nMovimento Democrático Brasileiro (PMDB), denunciou Amauri Stábile e seu\nfilho Ronaldo como integrantes da administração da empresa. Havia também\numa questão de soberania nacional: a operação estaria encobrindo a venda\nde terras para grupos estrangeiros, o que feria a Constituição Federal.\nDe fato, a Sharp mantinha vínculos com a empresa japonesa Sharp\nCorporation. Em defesa do ministro da Agricultura, o Instituto Nacional\nde Colonização e Reforma Agrária (Incra) divulgou nota, argumentando que\na Sharp estava sob controle acionário nacional e que Amauri Stábile não\nfazia mais parte de sua direção.\n\nLogo depois, uma sugestão sua para que a Igreja destinasse os imóveis\nrurais que possuía a projetos de colonização foi recebida com críticas\npor parte da Comissão Pastoral da Terra, órgão da Conferência Nacional\ndos Bispos do Brasil (CNBB).\n\nAlvo de ação popular impetrada pelo Centro de Conservação da Natureza em\nmaio de 1982, por ter autorizado ilegalmente a realização de pesquisas\nminerais na reserva biológica de Trombetas, no Pará, o final de sua\npassagem pelo ministério foi marcado pelo “escândalo da Capemi” — Caixa\nde Pecúlios, Pensões e Montepios Beneficente — posta sob intervenção\nfederal em fevereiro de 1983, e cuja falência seria decretada em maio,\nprejudicando um milhão de mutuários e quatro milhões de dependentes. O\ncaso remontava a junho de 1980, quando uma comissão de licitação do\nInstituto Brasileiro de Desenvolvimento Florestal apontou a empresa como\nvencedora da concorrência para o desmatamento e exploração comercial da\nárea que seria inundada pelo lago da usina hidrelétrica de Tucuruí, no\nPará. Embora não fosse experiente no ramo madeireiro e tivesse\napresentado documentação insuficiente em termos do edital, a Capemi\nvenceu a licitação e recebeu do Banco Nacional de Crédito Cooperativo,\nsubordinado ao ministério da Agricultura, o aval para um empréstimo\nexterno no valor de cem milhões de dólares.\n\nNo início de 1983, de um total 67 mil hectares a empresa só havia\nexplorado mil. O empreendimento resultou em desastre econômico pelo não\naproveitamento da madeira; desastre ecológico pelo imenso volume de\nmaterial orgânico alagado; desastre financeiro, com indenizações\nmilionárias pagas ao grupo francês Lazard-Frères e a pessoas ligadas ao\nchefe do Serviço Nacional de Informações (SNI) em Brasília, general\nNewton Cruz, entre as quais o jornalista Alexandre von Baungarten, anos\nmais tarde assassinado no Rio de Janeiro.\n\nEm maio de 1983 a Câmara instituiu uma comissão parlamentar de inquérito\n(CPI) no curso da qual travaram debates acalorados o vice-líder do\ngoverno, deputado Edson Lobão (PDS-MA), e o deputado Sebastião Curió\n(PDS-PA). O primeiro declarou que ficara “mais ou menos provado que\nStábile não tinha responsabilidade sobre os desvios de recursos que\nviriam a beneficiar os parentes do general Newton Cruz”, enquanto o\nsegundo obteve o número de votos suficiente para excluir do relatório\nfinal da comissão quatro parágrafos que incriminavam o chefe do SNI.\n\nEm março de 1984, antes desse desfecho, Amauri Stábile pediu exoneração\ndo Ministério da Agricultura, passando o cargo para o até então diretor\ndo Banco do Brasil e secretário executivo do Projeto Carajás, Nestor\nJost. Em 27 de junho de 1984 a CPI recomendou a instauração de processo\ncriminal contra o ex-ministro, acusando-o de “prevaricação por omissão”.\nDiante do fato, Stábile declarou ser pobre e estar desempregado. “Se\nocorreram irregularidades na minha gestão”, disse ele, “não tomei\nconhecimento e muito menos me beneficiei”.\n\nDe volta ao grupo Sharp, presidiu a SB Internacional, empresa\nresponsável pela captação de financiamentos externos destinados à compra\nde componentes eletrônicos. Em 1995, gerenciou um projeto em parceria\ncom a Sharp Corporation, para intensificar a atuação da Sharp do Brasil\nnas áreas financeira, de *marketing*, comercial e de produção. Em maio\ntornou-se presidente do conselho de administração do grupo Sharp,\npermanecendo apenas três meses no cargo. Em 1996 desligou-se dos\nnegócios e acabou fixando residência em Nova Iorque, nos Estados Unidos\nda América, onde fez pós-graduação em economia. Nessa cidade, constituiu\na empresa de consultoria Bras Consult e tornou-se membro diretor da\nBrazilian-American Chamber of Commerce.\n\nFoi casado com Zuleide Moura Stábile, com quem teve três filhos.\n\n*Sinclair Cechine*\n\nFONTES: ASSEMB. LEGISL. MG. *Dicionário biográfico*; *Estado de S.\nPaulo* (8/6/84); INF. JOSÉ CARLOS MARÇAL; *IstoÉ/Senhor*(3/5/95);\n*Jornal do Brasil* (16/9/83 e 9/6/84);\n[www.brazilcham.com](http://www.brazilcham.com/)\n\n \n\n \n","ref":"FONTES: ASSEMB. LEGISL. MG. *Dicionário biográfico*; *Estado de S.\nPaulo* (8/6/84); INF. JOSÉ CARLOS MARÇAL; *IstoÉ/Senhor*(3/5/95);\n*Jornal do Brasil* (16/9/83 e 9/6/84);\n[www.brazilcham.com](http://www.brazilcham.com/)\n\n \n\n \n","dic":"DHBB"}
