{"title":"STEINBRUCH, Júlia =================","cargoss":["Deputado federal"],"cargos_esp":[0],"datas_ini":[1967],"datas_fim":[1969],"estados":["RJ"],"autor":[0],"content":"STEINBRUCH, Júlia\n=================\n\n\\*dep. fed. RJ 1967-1969.\n\n \n\n*Júlia Vaena Steinbruch*****nasceu no Rio de Janeiro, então Distrito\nFederal, no dia 28 de maio de 1933, filha****de Luciano Vaena e de Clara\nVaena.\n\nBacharelou-se em ciências jurídicas e so­ciais em 1956 e doutorou-se em\ndireito crimi­nal em 1958 no Rio de Janeiro.\n\nFoi procuradora de primeira categoria do Serviço de Assistência Médica\nDomiciliar de Urgência.\n\nIniciou sua carreira política elegendo-se depu­tada federal pelo Rio de\nJaneiro no pleito de novembro de 1966, na legenda do Movimento\nDemocrático Brasileiro (MDB) - partido de oposição ao regime militar\ninstaurado no país em abril de 1964 -, sendo, na ocasião, a deputada\nmais votada do Brasil. Assumindo sua cadeira em fevereiro de 1967,\napresentou como parlamentar vários projetos de lei, entre eles, um que\ntornava obrigatória a educação sexual nas escolas, e outro instituindo o\nsalário família. Dei­xou a Câmara dos Deputados no dia 11 de setembro de\n1969, quando teve seu mandato cassado e seus direitos políticos\nsuspensos por dez anos, com ba­se no Ato Institucional n °. 5 editado \nem   dezembro do ano anterior.\n\nBeneficiada pela Lei de Anistia sancionada pelo presidente João\nFigueiredo no dia 28 de agosto de 1979, voltou à atividade política. Com\na extinção do bipartidarismo em 29 de novembro de 1979 e a conseqüente\nreformu­lação partidária, filiou-se ao Partido Trabalhis­ta Brasileiro,\nliderado por Ivete Vargas, integrando sua comissão executiva provisória\nno Rio de Janeiro.\n\nEm 1981, retornou à Procuradoria Geral do Instituto de Administração\nFinanceira da Previdência e Assistência Social, sendo nomeada, em 1985,\npresidente da 6^a^ turma do Conselho de Recursos da Previdência Social.\n\nAposentando-se como procuradora em 1990, não mais se candidatou a cargos\npúblicos.\n\nJúlia Steinbruch foi casada com Aarão Steinbruch, falecido em 1992, com\nquem teve três filhos.   Seu marido foi deputado federal pelo Rio de\nJaneiro de 1959 a 1963 e senador pelo mesmo estado de 1963 a 1969,\nquando teve seu mandato cassado pelo regime militar,  e vereador à\nCâmara Municipal do Rio de Janeiro entre 1989 e 1992.\n\n \n\nFONTES:  ARQ.  DEP.  PESQ.  JORNAL DO BRASIL; CÂM.  DEP. \n*Deputados;*CÂM.  DEP. *Deputados brasileiros.  Repertório*(1967-1971);\nINF. BIOG.\n\n \n","ref":"FONTES:  ARQ.  DEP.  PESQ.  JORNAL DO BRASIL; CÂM.  DEP. \n*Deputados;*CÂM.  DEP. *Deputados brasileiros.  Repertório*(1967-1971);\nINF. BIOG.\n\n \n","dic":"DHBB"}
