{"title":"STEINBRUCH, Mílton ==================","cargoss":["Deputado federal"],"cargos_esp":[0],"datas_ini":[1975],"datas_fim":[1979],"estados":["RJ"],"autor":[0],"content":"STEINBRUCH, Mílton\n==================\n\n\\*dep. fed. RJ 1975-1979.\n\n \n\n*Mílton Steinbruch Lomacinsky* nasceu no Rio de Janeiro, então Distrito\nFederal, no dia 6 de maio de 1942, filho de Marcos Lomacinsky e de\nAmália Steinbruch Lomacinsky, ambos de origem judaica.  Seu tio, Aarão\nSteinbruch, foi deputado federal pelo Rio de Janeiro de 1959 a 1963,\nsenador de 1963 a 1969 e vereador na capital do  estado, de 1988 a 1992.\n\nMílton Steinbruch estudou no Colégio Anglo-Americano, no Rio, e em 1963\nfez especialização em língua inglesa no Mississipi Southem College, em\nHattiesburg, Mississipi, nos Estados Unidos.  De volta ao Brasil,\ntrabalhou como repórter na revista Fatos e Fotos, em 1964, sendo\npromovido a assistente de diretor no ano seguinte, e depois a chefe de\nreportagem.\n\nBacharelou-se pela Faculdade de Direito da Universidade do Estado da\nGuanabara em 1966 e fez ainda o curso de mercado de capitais.\n\nIniciou sua carreira política no pleito de novembro de 1974, quando\nelegeu-se deputado federal pelo novo estado do Rio, que resultaria da\nfusão da Guanabara com o antigo estado do Rio de Janeiro, na legenda do\nMovimento Democrático Brasileiro (MDB), partido de oposição ao regime\nmilitar instaurado no país em abril de 1964.  Assumiu sua cadeira em\nfevereiro de 1975 e, durante seu mandato, apresentou na Câmara projetos\nampliando os benefícios dos trabalhadores e favorecendo os empreiteiros\nde obras públicas.  Em seus discursos elogiou o 13° salário, criticou a\nadministração da cidade do Rio de Janeiro e homenageou Francisco Negrão\nde Lima, governador da Guanabara de 1965 a 1971.  Condenou ainda a\naplicação do Ato Institucional n°. 5 e protestou contra a censura à\nimprensa e o voto brasileiro, na Organização das Nações Unidas, sendo\nfavorável à classificação do sionismo como forma de racismo.\n\nMembro das comissões de Finanças e de Agricultura, Ciência e Tecnologia,\nfoi relator de 15 projetos de lei.  Atuou ainda como suplente da\nComissão de Agricultura e Política Rural.  No pleito de novembro de 1978\ntentou se reeleger, mas obteve apenas uma suplência, deixando a Câmara\nem janeiro do ano seguinte.\n\nApós o fim do bipartidarismo em novembro de 1979, filiou-se ao Partido\ndo Movimento Democrático Brasileiro (PMDB), legenda que sucedeu ao MDB.\nEm 1980, assumiu o cargo de assessor da presidência do Banco do Estado\nde São Paulo, função que exerceria por cinco anos. Deixou o PMDB em\n1982, transferindo-se para o Partido Liberal (PL).\n\nEleito secretário-geral do PL em 1986, no pleito de novembro desse ano\ncandidatou-se a deputado federal constituinte pelo Rio de Janeiro.\nObtendo novamente apenas uma suplência, ainda em 1986 assumiu o cargo de\nassessor de João Dória Júnior, na presidência da Empresa Brasileira de\nTurismo (Embratur), tornando-se delegado da companhia em Brasília, no\nano de 1988. Durante sua passagem pela Embratur desempenhou ainda as\nfunções de diretor de operações e de diretor de planejamento, sendo\nnomeado presidente da empresa em 1989.\n\nNas eleições de outubro de 1990, candidatou-se mais uma vez a deputado\nfederal pelo PL, mas também não conseguiu se eleger. Dois anos depois,\nfoi nomeado delegado regional do Trabalho do Rio de Janeiro. Tornando-se\nmembro da Academia Teresopolitana de Letras em junho de 1995, no mês\nseguinte passou a exercer o cargo de delegado regional da Fundação\nCentro Nacional de Segurança, Higiene e Medicina do Trabalho. Em\nsetembro de 1998, nomeado pelo presidente da República, Fernando\nHenrique Cardoso, assumiu o cargo de juiz classista no Tribunal Regional\ndo Trabalho do Rio de Janeiro.\n\n Solteiro, Mílton Steinbruch não teve filhos.\n\n \n\nFONTES: CÂM. DEP. *Deputados*; CÂM.  DEP. *Deputados brasileiros. \nRepertório* (1975-1979 e 1979-1983); CURRÍC. BIOG.; *Globo* (24/2/86);\nINF. BIOG.; NÉRI, S. *16*.\n\n \n","ref":"FONTES: CÂM. DEP. *Deputados*; CÂM.  DEP. *Deputados brasileiros. \nRepertório* (1975-1979 e 1979-1983); CURRÍC. BIOG.; *Globo* (24/2/86);\nINF. BIOG.; NÉRI, S. *16*.\n\n \n","dic":"DHBB"}
