{"title":"BARRETO, Mena","cargoss":["Comandante da 1ª Região Militar","insp 1º Grupo de RMs","Membro de junta governativa","Interventor","Ministro do Supremo Tribunal Militar"],"cargos_esp":[0,0,"prov",0,0],"datas_ini":[1924,1926,1930,1931,1931],"datas_fim":[1926,1931,1930,1931,1933],"estados":[0,0,0,"RJ",0],"autor":[0],"content":"**BARRETO, Mena**\n\n\\*militar; comte. 1ª RM 1924-1926; insp. 1º Grupo de RMs 1926-1931;\njunta gov. prov. 1930; interv. RJ 1931; min. STM 1931-1933.\n\n \n\n*João de Deus Mena Barreto* nasceu em Porto Alegre no dia 30 de junho de\n1874, filho do general José Luís Mena Barreto, então inspetor dos Corpos\nde Artilharia do Rio Grande do Sul, e de Rita de Cássia Mena Barreto.\nDesde o século XVIII, muitos membros da sua família seguiram a carreira\nmilitar e cerca de 15 deles atingiram o generalato. O iniciador dessa\ntradição foi o marechal João de Deus Barreto Pereira Pinto (1769-1849),\nvisconde de São Gabriel, um dos colonizadores do Rio Grande do Sul.\n\nMena Barreto ingressou na Escola Tática e de Tiro de Rio Pardo (RS) em\njaneiro de 1890. Em maio desse ano, junto com seus colegas, integrou-se\nà guarda palaciana que se manteve fiel ao presidente estadual Francisco\nda Silva Tavares, tentando debelar o movimento de protesto contra a\nviolenta repressão a um comício republicano que comemorava o segundo\naniversário da abolição da escravatura. Na seqüência dos acontecimentos,\no governo estadual foi derrubado, iniciando-se um período de\ninstabilidade política em que o poder foi ocupado por vários presidentes\nde curto exercício até a ascensão de Júlio de Castilhos em 1892.\n\nEm janeiro de 1893, Mena Barreto pediu para ser excluído do corpo de\nalunos da academia militar. Designado para servir no 4º Batalhão de\nInfantaria, sediado em São Gabriel (RS), participou do combate à\nRevolução Federalista, guerra civil que conflagrou o Rio Grande do Sul,\nSanta Catarina e Paraná entre fevereiro de 1893 e agosto de 1895. O\nconflito envolveu amplas forças militares locais, opondo os insurretos\nfederalistas (chamados de “maragatos”) ao governo estadual de Júlio de\nCastilhos, republicano, o qual contava com o apoio do marechal Floriano\nPeixoto, presidente da República. Em setembro de 1893, Mena Barreto foi\nintegrado à 1ª Brigada de Linha, comandada pelo coronel Tomás Thompson\nFlores e vinculada à Divisão do Norte, participando de diversos combates\ncontra os federalistas em terras gaúchas. Depois da vitória dos\nrepublicanos, foi comissionado no posto de alferes.\n\nEm março de 1898, ingressou na Escola Militar do Brasil, no Rio de\nJaneiro (então Distrito Federal), sendo promovido a tenente em setembro\nde 1900. Dois meses depois, casou-se com Ernestina Estela Noronha Mena\nBarreto, descendente de uma família com grande tradição na Marinha de\nGuerra, com quem veio a ter três filhos. Em junho de 1904, lotado no 32º\nBatalhão de Infantaria, integrou as forças expedicionárias enviadas para\na Amazônia com a missão de consolidar a situação militar na região após\na resolução, no ano anterior, da chamada Questão do Acre, disputa\nfronteiriça que opunha o Brasil à Bolívia desde o século XVIII. Em\nnovembro de 1904, foi promovido a capitão.\n\nEm novembro de 1910, Mena Barreto participou da repressão à revolta do\nBatalhão Naval da ilha das Cobras, no Rio de Janeiro, que ocorreu dias\ndepois da Revolta da Chibata, liderada pelo marinheiro João Cândido em\nprotesto contra os baixos vencimentos e os castigos corporais que,\nembora abolidos por lei, ainda eram praticados na Armada. Assim como\noutras manifestações ocorridas no mesmo período, a rebelião dos\nmarinheiros e fuzileiros navais foi duramente reprimida.\n\nMena Barreto foi promovido a major por merecimento em agosto de 1911 e,\nno mês seguinte, tornou-se adjunto do ministro da Guerra, marechal\nAntônio Adolfo da Fontoura Mena Barreto, seu tio. Mesmo depois da\nsubstituição do ministro, ocorrida em março de 1912, permaneceu algum\ntempo nesse cargo, até ser atendido o seu pedido de exoneração.\nTransferiu-se em seguida para o Rio Grande do Sul, onde foi nomeado\nprofessor adjunto de física e química do Colégio Militar de Porto\nAlegre. Retornou ao Distrito Federal no ano seguinte, sendo promovido a\ntenente-coronel em janeiro de 1915 e nomeado para comandar o 4º\nRegimento de Infantaria, sediado em Curitiba.\n\nEm fevereiro de 1918, Mena Barreto foi encarregado de organizar em Belo\nHorizonte o 59º Batalhão de Caçadores (futuro 12º Regimento de\nInfantaria). No mês seguinte, recebeu a patente de coronel e assumiu o\ncomando do 3º Regimento de Infantaria, no Rio de Janeiro. Promovido a\ngeneral-de-brigada em setembro de 1921, foi nomeado dois meses depois\ninspetor de infantaria da 1ª e 2ª regiões militares, situadas,\nrespectivamente, no Distrito Federal e em São Paulo.\n\nEm fevereiro de 1922 tornou-se comandante da 2ª Brigada de Infantaria.\nNesse posto, enfrentou a revolta deflagrada no Rio de Janeiro e em Mato\nGrosso em 5 de julho de 1922, primeiro de uma série de levantes\npromovidos pela jovem oficialidade do Exército os “tenentes” — na década\nde 1920. Na capital federal, a sublevação envolveu o forte de\nCopacabana, efetivos da Vila Militar e a Escola Militar, sendo debelada\nno mesmo dia. Mena Barreto chefiou pessoalmente um destacamento\nincumbido de deter o avanço dos cadetes da Escola Militar no bairro\ncarioca do Méier.\n\nEm julho de 1924, irrompeu em São Paulo nova revolta tenentista,\nacompanhada de sublevações de solidariedade em guarnições de Sergipe e\ndo Amazonas. Mena Barreto foi então nomeado comandante-em-chefe do\nchamado Destacamento do Norte, organizado para combater, em Manaus, a\nsublevação do 27º Batalhão de Caçadores, liderada pelos tenentes Joaquim\nCardoso de Magalhães Barata e Alfredo Augusto Ribeiro Júnior. A\nexpedição mobilizou cerca de três mil homens, que partiram do Rio de\nJaneiro a bordo do cruzador *Barroso,*dos couraçados *São\nPaulo*e*Floriano* e do paquete *Poconé,*que conduziu Mena Barreto.\n\nNo dia 23 de julho, o 26º Batalhão de Caçadores, de Belém, também se\nrebelou sob a liderança do capitão Augusto Assis de Vasconcelos,\ntravando violentos combates com as forças policiais do estado. Quando a\nexpedição legalista chegou à cidade, em 11 de agosto, a revolta já havia\nsido sufocada, mas, mesmo assim, Mena Barreto assumiu o comando da 8ª\nRegião Militar, ali sediada, e tomou providências no sentido de\nconsolidar a situação militar local antes de prosseguir viagem para o\nAmazonas.\n\nA caminho de Manaus, ainda em território paraense, as tropas legalistas\nocuparam a cidade de Santarém no dia 23 de agosto, efetuando prisões.\nNesse período, os revoltosos amazonenses haviam deposto o presidente\nestadual Turiano Meira, formando uma junta governativa presidida pelo\ntenente Ribeiro Júnior. O movimento obteve grande apoio da população\nlocal, mas as forças federais, chegadas em Manaus no dia 28 depois de\nderrotar os revolucionários em Óbidos (PA), destituíram a junta e\nprenderam seus integrantes, sem encontrar resistência significativa.\nComo o presidente deposto se recusasse a reassumir, Mena Barreto\ndesignou o coronel Raimundo Barbosa para o cargo de governador militar\ndo estado.\n\nEm outubro de 1924, Mena Barreto substituiu interinamente o general\nAlfredo Ribeiro da Costa no comando da 1ª Região Militar, sediada no\nDistrito Federal, sendo efetivado nesse posto em dezembro, logo após\nreceber a patente de general-de-divisão. No ano seguinte, por sugestão\nsua, foi instituído o Dia do Soldado, comemorado anualmente na data de\nnascimento do duque de Caxias, 25 de agosto. Mena Barreto exonerou-se do\ncomando da 1ª RM em março de 1926 para não ter que cumprir a decisão do\nSupremo — hoje Superior — Tribunal Militar (STM) que concedeu\n*habeas-corpus*ao major José Pessoa, comandante interino do 1º Regimento\nde Cavalaria, o qual havia sido punido por razões disciplinares. Em seu\nlugar, tomou posse o general Otávio de Azeredo Coutinho.\n\nAinda em 1926, foi eleito presidente do Clube Militar, dando início ao\nprocesso de normalização das atividades dessa entidade, que havia sido\nfechada em 1922 pelo presidente Epitácio Pessoa. Ao final de seu\nprimeiro mandato, foi lançada a *Revista do Clube* *Militar.*Reeleito no\nano seguinte, patrocinou modificações nos estatutos da entidade que\nresultaram na extensão do mandato das diretorias para dois anos, na\nadoção da eleição direta em assembléias para o preenchimento desses\ncargos e na proibição de reeleição aos membros de diretorias e\nconselhos.\n\n \n\nNa Revolução de 1930\n\nNomeado inspetor do 1º Grupo de Regiões Militares em novembro de 1926,\nMena Barreto ainda ocupava essa função quando foi deflagrada, em 3 de\noutubro de 1930, a revolução que derrubou o presidente Washington Luís.\nSegundo seu filho, João de Deus Noronha Mena Barreto, ele não foi\ninformado das articulações revolucionárias, mas outras fontes afirmam\nque emissários gaúchos buscaram com antecedência sua adesão ao\nmovimento, sem obter êxito. Iniciada a insurreição, Mena Barreto foi\nprocurado pelo chefe do seu estado-maior, coronel Bertoldo Klinger, que,\nem nome de um grupo de jovens oficiais, solicitou sua intervenção no\nsentido de conseguir a cessação das hostilidades.\n\nNas semanas seguintes à eclosão do levante, a situação militar evoluiu\nem diversas regiões do país de forma claramente favorável aos\nrevolucionários. Nesse contexto, oficiais de alta patente lotados no\nDistrito Federal passaram a articular, sob a liderança de Mena Barreto,\num golpe militar contra o governo. Com o objetivo de preservar a\nhierarquia, decidiu-se que a chefia do movimento deveria ser entregue ao\noficial mais graduado do Exército, general Augusto Tasso Fragoso, que,\nentretanto, declinou do convite. Em seguida, o general Alexandre\nHenrique Vieira Leal também se negou a aderir, colocando Mena Barreto na\ncondição de detentor de mais alta patente entre os que concordavam com o\nmovimento, cabendo a ele, dessa forma, chefiar as operações.\n\nOs tenentes Valdemar e João de Deus, filhos e ajudantes-de-ordens de\nMena Barreto, efetivaram os contatos com a oficialidade, ao mesmo tempo\nem que começaram a ser colhidas assinaturas para um manifesto que seria\napresentado ao presidente da República, intimando-o a renunciar. A\nligação com a Marinha foi feita pelo próprio Mena Barreto, através do\ncontra-almirante José Isaías de Noronha, parente de sua mulher. Na manhã\ndo dia 23, acompanhado de seu filho Paulo Emílio, Mena Barreto procurou\no general Tasso Fragoso, reiterando o convite para liderar o ato da\ndeposição de Washington Luís. Dessa vez, Tasso Fragoso concordou,\nficando encarregado dos entendimentos com outros generais em serviço no\nDistrito Federal.\n\nNa noite de 23 de outubro, depois de passadas as senhas para o início do\nlevante, Mena Barreto e Tasso Fragoso se encontraram no forte de\nCopacabana e coordenaram os preparativos finais, recebendo as primeiras\nadesões ao movimento. Na manhã seguinte se dirigiram para o palácio\nGuanabara, residência oficial do presidente, a fim de intimá-lo a\nrenunciar, apresentando-lhe garantias de respeito à sua integridade.\nWashington Luís se recusou a deixar o governo. Formou-se então uma junta\ngovernativa provisória, que, presidida por Tasso Fragoso e composta por\nMena Barreto e Isaías de Noronha, entrou em contato com o cardeal\nSebastião Leme, o qual se dispôs a servir de intermediário e a conceder\nasilo em seu palácio para o presidente. Às cinco horas da tarde do dia\n24 de outubro, Washington Luís consentiu em se retirar, sendo conduzido\npara o forte de Copacabana.\n\nNo mesmo dia, a junta enviou o primeiro de uma série de telegramas a\nGetúlio Vargas, líder nacional das forças revolucionárias, propondo a\nsuspensão das hostilidades. O estado-maior revolucionário, pouco seguro\ndas intenções da junta, enviou Osvaldo Aranha, Lindolfo Collor e\nHerculino Cascardo para negociarem as condições da transferência do\npoder a Vargas e ordenou que os destacamentos rebeldes continuassem\navançando em direção ao Rio de Janeiro com o objetivo de garantir a\nvitória da revolução. No dia 3 de novembro, Vargas assumiu a chefia do\nGoverno Provisório.\n\nDurante o curto período em que esteve no poder, a junta governativa\nnomeou um ministério provisório, dispensou os reservistas convocados nos\núltimos dias do governo de Washington Luís, desmilitarizou a Rede\nFerroviária Sul Mineira, autorizou o reinício das operações bancárias,\nabriu uma linha de crédito para o combate à febre amarela e renovou\nparte dos comandos militares, entre outras medidas.\n\nDepois da posse de Vargas, Mena Barreto foi mantido como inspetor do 1º\nGrupo de Regiões Militares e, a partir de maio de 1931, acumulou esse\ncargo com o de interventor federal no Rio de Janeiro, substituindo\nPlínio Casado. Entretanto, suas divergências em relação ao Código dos\nInterventores, publicado em agosto, levaram-no a pedir exoneração três\nmeses depois, sendo substituído pelo coronel Pantaleão da Silva Pessoa\ne, em seguida, nomeado ministro do STM.\n\nMena Barreto manteve posição de neutralidade diante da Revolução\nConstitucionalista de São Paulo deflagrada em julho de 1932, embora seus\ndois filhos e seu amigo Bertoldo Klinger estivessem envolvidos no\nlevante. No mês de setembro, interveio nas negociações para a cessação\ndas hostilidades que resultaram no armistício assinado no dia 2 de\noutubro, com a rendição das forças paulistas.\n\nFaleceu no Rio de Janeiro em 25 de março de 1933, em pleno exercício de\nsuas funções no STM.\n\nSua biografia está incluída nas obras redigidas por seu filho João de\nDeus Noronha Mena Barreto, intituladas *Os Mena Barreto, seis* *gerações\nde soldados — 1769-1950*(1950) e *Ainda os Mena Barreto\n1919-1969*(1971).\n\nRenato Lemos\n\n \n\n \n\nFONTES: ALMEIDA, A.*Dic*.; BARBOSA, R. *História;*BARRETO, J.\n*Ainda;*BARRETO, J. *Mena;*BEHAR, E. *Vultos;*BIJOS, G. *Clube; Câm.\nDep. seus componentes;*CARNEIRO, G. *História;*CONSULT. MAGALHÃES, B*.;\nCorreio da Manhã*(26/3/33)*; Correio do Povo*(27/12/30); CORRESP. MIN.\nTRAB.; CORRESP. SECRET. GER. EXÉRC.; CORRESP. SUP. TRIB. MILITAR;\nCORTÉS, C*. Homens;*COUTINHO, A. *Brasil; Encic. Mirador;*FONTOURA, J.\n*Memórias; Grande encic. Delta;*INST. NAC. LIVRO. *Índice; Jornal do\nBrasil*(26/3/33); *Jornal do Comércio,*Rio (26/3/73); LACOMBE, L.\n*Chefes;*LAGO, L. *Conselheiros;*LEITE, A. *História;*MORAIS, A.\n*Minas;*NOGUEIRA FILHO, P. *Ideais;*PEIXOTO, A. *Getúlio;*POPPINO, R.\n*Federal;*SILVA, H. *1922;* SILVA, H. *1926;*SILVA, H. *1931;*SILVA, H.\n*1932;*SILVA, H. *1933; Tarde*(27/3/33).\n\n \n","ref":"FONTES: ALMEIDA, A.*Dic*.; BARBOSA, R. *História;*BARRETO, J.\n*Ainda;*BARRETO, J. *Mena;*BEHAR, E. *Vultos;*BIJOS, G. *Clube; Câm.\nDep. seus componentes;*CARNEIRO, G. *História;*CONSULT. MAGALHÃES, B*.;\nCorreio da Manhã*(26/3/33)*; Correio do Povo*(27/12/30); CORRESP. MIN.\nTRAB.; CORRESP. SECRET. GER. EXÉRC.; CORRESP. SUP. TRIB. MILITAR;\nCORTÉS, C*. Homens;*COUTINHO, A. *Brasil; Encic. Mirador;*FONTOURA, J.\n*Memórias; Grande encic. Delta;*INST. NAC. LIVRO. *Índice; Jornal do\nBrasil*(26/3/33); *Jornal do Comércio,*Rio (26/3/73); LACOMBE, L.\n*Chefes;*LAGO, L. *Conselheiros;*LEITE, A. *História;*MORAIS, A.\n*Minas;*NOGUEIRA FILHO, P. *Ideais;*PEIXOTO, A. *Getúlio;*POPPINO, R.\n*Federal;*SILVA, H. *1922;* SILVA, H. *1926;*SILVA, H. *1931;*SILVA, H.\n*1932;*SILVA, H. *1933; Tarde*(27/3/33).\n\n \n","dic":"DHBB"}
