{"title":"TAVARES, Cristina","cargoss":["Deputado federal","Constituinte"],"cargos_esp":[0,0],"datas_ini":[1979,1987],"datas_fim":[1991,1988],"estados":["PE",0],"autor":[0],"content":"**TAVARES, Cristina**\n\n\\*dep. fed. PE 1979-1991; const. 1987-1988.\n\n \n\n*Maria Cristina de Lima Tavares Correia* nasceu em Garanhuns (PE) no dia\n10 de junho de 1936, filha de José Alves Tavares Correia e Maria Mercês\nde Lima Tavares Correia.\n\nEm 1955 bacharelou-se em línguas neolatinas pela Faculdade de Filosofia\ndo Recife. Exerceu, no entanto, a carreira jornalística atuando no\nJornal do Comércio e no Diário de Pernambuco. Ainda como jornalista\nprofissional, trabalhou na Visão Editorial (1973-1975) e na J. Câmara\nIrmãos (1975-1976).\n\nIniciou sua carreira política em 1978, quando se candidatou a uma vaga\nna Câmara dos Deputados, nas eleições de setembro daquele ano. Eleita\npela legenda do Movimento Democrático Brasileiro (MDB),****partido de\noposição ao regime militar instalado em abril de 1964, foi empossada em\nfevereiro de 1979. Nessa legislatura, atuou como vice-presidente da\nComissão de Comunicação e titular das comissões parlamentares de\ninquérito (CPIs) sobre as cheias do rio São Francisco, sobre a\ncomercialização do café brasileiro e sobre fome, desnutrição e falta de\nsaúde na população de baixa renda no Brasil. Após a extinção do\nbipartidarismo e a conseqüente reformulação partidária, ocorrida em\nnovembro de 1979, tornou-se vice-líder do Partido do Movimento\nDemocrático Brasileiro (PMDB). Durante essa legislatura foi ainda\nrelatora do Simpósio sobre Informática, da Comissão de Ciência e\nTecnologia, e do Simpósio Censura: Histórico, Situação e Solução, da\nComissão de Comunicação. Em 1980, integrou a delegação de parlamentares\nque visitou Cuba e a delegação que visitou as festividades do quarto\naniversário da revolução sandinista, na Nicarágua.\n\nReelegeu-se deputada federal nas eleições de novembro de 1982, na\nlegenda do PMDB. Empossada em fevereiro do ano seguinte, ainda nesse ano\nfundou o Centro de Estudos Políticos e Sociais Teotônio Vilela. Na\nCâmara dos Deputados, integrou as comissões de Economia, Indústria e\nComércio, de Comunicação e de Comunicação e Informática. Em 25 de abril\nde 1984, votou a favor da emenda Dante de Oliveira, apresentada na\nCâmara dos Deputados, que propôs o restabelecimento das eleições diretas\npara presidente da República em novembro daquele ano. Como a emenda não\nobteve o número de votos indispensáveis à aprovação — faltaram 22 para\nque o projeto pudesse ser encaminhado à apreciação pelo Senado — no\nColégio Eleitoral, reunido em 15 de janeiro de 1985, votou no candidato\noposicionista Tancredo Neves, eleito presidente da República pela\nAliança Democrática, união do PMDB com a dissidência do Partido\nDemocrático Social (PDS) abrigada na Frente Liberal. Contudo, Tancredo\nNeves não chegou a ser empossado na presidência, vindo a falecer em 21\nde abril de 1985. Assumiu o cargo o vice José Sarney, que já o exercia\ninterinamente desde de 15 de março desse ano.****Ainda em 1985,****fez\nparte da delegação brasileira que compareceu ao Seminário sobre Dívida\nExterna, em Havana, Cuba.\n\nNas eleições de novembro de 1986 elegeu-se deputada federal\nconstituinte, na legenda do PMDB. Iniciou seu mandato em 1º de fevereiro\nde 1987, quando tiveram início os trabalhos da Assembléia Nacional\nConstituinte. Ainda nesse ano, integrou a delegação brasileira que\nparticipou da LXXVII Conferência Interparlamentar, na Nicarágua.\n\nNo decorrer dos trabalhos constitucionais, foi relatora da Subcomissão\nde Ciência e Tecnologia e da Comunicação, da Comissão da Família, da\nEducação, Cultura e Esportes, da Ciência e Tecnologia e da Comunicação,\nalém de titular da Comissão de Sistematização, e suplente da Subcomissão\nda Nacionalidade, da Soberania e das Relações Internacionais, da\nComissão da Soberania e dos Direitos e Garantias do Homem e da Mulher.\n\nNas votações mais significativas da Constituinte, manifestou-se a favor\ndo rompimento de relações diplomáticas com países mantenedores de\npolíticas de discriminação racial, da limitação do direito de\npropriedade privada, do mandado de segurança coletivo, da remuneração\n50% superior para o trabalho extra, da jornada semanal de 40 horas, do\nturno ininterrupto de seis horas, do aviso prévio proporcional, da\nunicidade sindical, da soberania popular, do voto aos 16 anos, da\nproibição do comércio de sangue, da limitação dos encargos da dívida\nexterna, da criação de fundo de apoio à reforma agrária, da anistia aos\nmicro e pequenos empresários e da desapropriação da propriedade\nprodutiva. Votou contra a pena de morte, a pluralidade sindical, o\npresidencialismo e o mandato de cinco anos para José Sarney. Faltou às\nvotações de quase todo o segundo turno por causa de câncer na mama, e\nchegou a se licenciar do mandato para fazer tratamento no exterior.\n\nAo longo de sua atuação na Constituinte, destacou-se pelas articulações\ncom setores nacionalistas, em defesa da Lei de Informática, pela defesa\nda revisão do Código Nacional de Telecomunicações e pelas mudanças no\nregime de propriedade dos meios de comunicação. Também defendeu as\nprincipais bandeiras do movimento feminista, como a legalização do\naborto, a instalação obrigatória de creches nas empresas e a ampliação\ndos direitos da mulher trabalhadora.\n\nPertencente à facção mais à esquerda do PMDB, deixou o partido em junho\nde 1988, para ser uma das fundadoras do Partido da Social Democracia\nBrasileira (PSDB), constituído naquele mês. No PSDB, integrou a Comissão\nDiretora Nacional Provisória, escolhida em 25 de junho de 1988, data da\nfundação do partido.\n\nCom a promulgação da nova Carta Constitucional em 5 de outubro de 1988,\nCristina Tavares voltou a participar dos trabalhos legislativos\nordinários na Câmara. Posteriormente, rompeu com o PSDB, quando o\npartido escolheu o ex-governador de Pernambuco, Roberto Magalhães —\negresso do Partido da Frente Liberal, agremiação de corte nitidamente\nconservador — para compor a chapa encabeçada por Mário Covas, na eleição\npresidencial de novembro de 1989. No decorrer da campanha que antecedeu\na primeira escolha de presidente da República pelo voto direto após\nintervalo de 29 anos, a deputada pernambucana lançou manifesto nos\njornais de maior circulação do país declarando-se favorável à\ncandidatura de Leonel Brizola, do Partido Democrático Trabalhista (PDT).\n\nFiliando-se ao PDT, candidatou-se à reeleição no pleito de outubro de\n1990, por essa legenda, mas não teve êxito. Deixou a Câmara dos\nDeputados em janeiro de 1991, ao final da legislatura. Passou a presidir\na seção regional do Instituto Alberto Pasqualini em Pernambuco,\norganismo de estudos políticos ligado ao PDT.\n\nSolteira, faleceu em 23 de fevereiro de 1992, em Houston (EUA), vítima\nde câncer.\n\nPublicou: *Cristina Tavares Correia, repórter* (1978), C*onversações com\nArraes* (1979), *Informática: a batalha do século XXI* (em co-autoria\ncom Mílton Seligman,1984), *Informática e a Nova República* (1985),\n*Onde está o meu filho?* (co-autoria com Chico de Assis, Gilvandrio\nFilho, Glória Brandão e Jodeval Duarte, 1985) e *A última célula*\n(1990).\n\nAlexandra Toste/Sérgio Montalvão\n\n \n\nFONTES:****ASSEMB. NAC. CONST. *Repertório* (1987-1988); CÂM. DEP.\n*Deputados brasileiros. Repertório* (1983-1987); *Globo* (26/4/84 e\n16/1/85); *Jornal do Brasil*(20/8/89, 24/2/92); *Veja* (4/2/87).\n\n \n","ref":"FONTES:****ASSEMB. NAC. CONST. *Repertório* (1987-1988); CÂM. DEP.\n*Deputados brasileiros. Repertório* (1983-1987); *Globo* (26/4/84 e\n16/1/85); *Jornal do Brasil*(20/8/89, 24/2/92); *Veja* (4/2/87).\n\n \n","dic":"DHBB"}
