{"title":"TAVARES, José =============","cargoss":["Deputado federal","Constituinte"],"cargos_esp":[0,0],"datas_ini":[1983,1988],"datas_fim":[1990,1988],"estados":["PR",0],"autor":[0],"content":"TAVARES, José\n=============\n\n\\* dep. fed. PR 1983-1990; const. 1988.\n\n \n\n*José Tavares da Silva Neto* nasceu em Bela Vista do Paraíso (PR), no\ndia 22 de maio de 1949, filho de João Tavares da Silva e de Isaura Brás\nTavares.\n\nDelegado de polícia em Londrina (PR), formou-se em direito pela\nFaculdade de Ciências Jurídicas e Sociais da Universidade Estadual de\nLondrina, em 1973.\n\nEm 1978, disputou uma vaga na Assembléia Legislativa do Paraná na\nlegenda do Movimento Democrático Brasileiro (MDB), partido que\ncongregava as forças de oposição ao regime militar instaurado no país em\nabril de 1964. Eleito com os votos dos municípios de Londrina,\nArapongas, Astorga e Sertanópolis, tomou posse em fevereiro de 1979. Com\no fim do bipartidarismo, em novembro daquele ano, e a conseqüente\nreformulação partidária, filiou-se ao Partido do Movimento Democrático\nBrasileiro (PMDB), que deu continuidade à linha política do MDB. Na\nAssembléia, atuou como presidente da Comissão de Segurança Pública e\ntitular da Comissão de Constituição e Justiça.\n\nEm novembro de 1982, elegeu-se deputado federal pelo Paraná. No mandato\niniciado em fevereiro de 1983, tornou-se membro da Comissão de\nConstituição e Justiça e segundo vice-presidente da Comissão de\nSegurança Nacional. Foi ainda titular da Comissão Parlamentar de\nInquérito (CPI) sobre as relações econômicas entre Brasil e Polônia.\n\nEm 25 de abril de 1984, votou a favor da emenda Dante de Oliveira, que\npropunha o restabelecimento de eleições diretas para presidente da\nRepública em novembro daquele ano. Porém, a emenda foi rejeitada. No\nColégio Eleitoral, reunido em 15 de janeiro de 1985,  votou em Tancredo\nNeves, candidato da Aliança Democrática – coligação do PMDB com a\ndissidência do PDS abrigada na Frente Liberal – que disputava a\npresidência com o candidato do regime militar, Paulo Maluf, derrotado.\nMas Tancredo Neves não chegou a tomar posse, porque ficou gravemente\ndoente e morreu em 21 de abril  do mesmo ano. Assumiu o vice José\nSarney, que já exercia o cargo interinamente desde 15 de março.\n\nJosé Tavares elegeu-se deputado federal constituinte no pleito de\nnovembro de 1986. Empossado em 1º de fevereiro de 1987, foi presidente\nda Subcomissão de Defesa do Estado, da Sociedade e de sua Segurança, da\nComissão da Organização Eleitoral, Partidária e de Garantia das\nInstituições. Foi ainda suplente da Subcomissão do Sistema financeiro, e\ndas comissões do Sistema Tributário, Orçamento e Finanças e de\nSistematização.\n\nNas principais votações da Assembléia Constituinte posicionou-se a favor\ndo rompimento de relações diplomáticas com países  com política de\ndiscriminação racial, do mandado de segurança coletivo, da proteção ao\ntrabalhador contra demissão sem justa causa, do turno ininterrupto de\nseis horas, do aviso prévio proporcional, do aborto, da unicidade\nsindical, da soberania popular, do voto aos 16 anos, da nacionalização\ndo subsolo, da proibição do comércio de sangue, da limitação dos\nencargos da dívida externa e da anistia aos micro e pequenos\nempresários. Votou contra a pena de morte, a limitação do direito de\npropriedade privada, a jornada semanal de 40 horas, o presidencialismo,\na estatização do sistema financeiro, o mandato de cinco anos para\nSarney, a criação de um fundo de apoio à reforma agrária, a legalização\ndo jogo do bicho e a desapropriação da propriedade produtiva.\n\nCom a promulgação da nova Constituição, em 5 de outubro de 1988,\ncontinuou no exercício regular de seu mandato. Em outubro de 1990,\ncandidatou-se a deputado estadual. Eleito, deixou a Câmara em janeiro de\n1991, ao final de seu mandato.\n\nNo ano seguinte, a convite do governador Roberto Requião, assumiu a\nSecretaria de Justiça do Paraná, cargo em que permaneceu até 1994. Em\noutubro, reelegeu-se deputado estadual. Durante 1998, já no governo de\nJaime Lerner, esteve à frente da Secretaria de Proteção e Defesa do\nConsumidor. Neste mesmo ano, filiou-se ao Partido Trabalhista Brasileiro\n(PTB). Deixou a Assembléia Legislativa em janeiro de 1999 e logo depois\nfoi nomeado secretário de Justiça do segundo governo de Jaime Lerner.\n\nCasou-se com Marilene Tozoni Tavares da Silva com quem teve três filhos.\n\n \n\nFONTES: ASSEMB. NAC. CONST. *Repertório* (1987-1988); CÂM. DEP.\n*Deputados Brasileiros. Repertório (1983-1987)*; INF. BIOG.\n\n \n","ref":"FONTES: ASSEMB. NAC. CONST. *Repertório* (1987-1988); CÂM. DEP.\n*Deputados Brasileiros. Repertório (1983-1987)*; INF. BIOG.\n\n \n","dic":"DHBB"}
