{"title":"TAVARES, Levi  ==============","cargoss":["Deputado federal"],"cargos_esp":[0],"datas_ini":[1963],"datas_fim":[1971],"estados":["SP"],"autor":[0],"content":"TAVARES, Levi \n==============\n\n\\* religioso; dep. fed. SP 1963-1971.\n\n \n\n*Levi Gonçalves Tavares*** **nasceu em Juiz de Fora (MG) no dia 30 de\nagosto de 1932, filho de Levi Airlie Tavares e de Abiael Gonçalves\nTavares.\n\nFez seus primeiros estudos nos colégios Piracicabano e Caetano de\nCampos, ambos em Piracicaba (SP). Cursou dois anos de química industrial\ne em 1956 doutorou-se pela Facul­dade de Teologia de São Paulo.\n\nMinistro evangélico, foi favorável ao  reata­mento, em novembro de 1961,\ndas relações diplomáticas e comerciais com a União Sovié­tica, rompidas,\ndesde fins de outubro de 1947. Nas eleições de outubro de 1962 elegeu-se\nde­putado federal por São Paulo na legenda do Partido Social Democrático\n(PSD). Assumiu sua cadeira na Câmara em fevereiro de 1963, tornando-se\nsuplente da Comissão de Finan­ças.  Durante a legislatura apoiou uma \nrefor­ma constitucional que propiciasse uma reforma agrária com\nassistência plena do Estado aos lavradores e experiências coletivistas;\numa reforma bancária, com a criação dos bancos dos municípios e do Banco\nAgrário Nacional, que também facilitasse a reforma agrária, e uma\nreforma tributária com medidas que re­duzissem a evasão tributária que\nvinha ocorrendo no país. Defendeu ainda a criação de um órgão de\nplanejamento e a unificação****das pastas militares.\n\nApós o movimento político-militar de 31 de março de 1964, que depôs o\npresidente João Goulart (1961-1964), com a extinção dos partidos\npolíticos pelo Ato Institucional nº. 2 (27/10/1965) e a posterior\ninstauração do bipartida­rismo, filiou-se ao Movimento Democrático\nBrasileiro (MDB), partido de oposição ao regime militar. Vice-líder de\nseu partido na Câmara dos Deputados a partir de maio de 1966, foi\nreeleito nas eleições de novembro desse ano, atuando na nova legislatura\ncomo membro da Comissão de Relações Exteriores e vice-presidente da\nComissão de Transportes. Nas eleições de novembro de 1970 obteve uma\nsuplência de deputado federal, sempre na legenda da Arena, e em janeiro\nde 1971, ao final da legislatura, deixou a Câmara dos Deputados. Com a\nextinção do bipartidarismo em novembro de 1979 e a conseqüente\nreformulação partidá­ria, em 1983 filiou-se ao Partido Democrático\nTrabalhista (PDT). Abandonando a vida pública, reassumiu suas atividades\ncomo pastor evangélico da Igreja Metodista do Brasil.\n\nCasou-se com Maria do Carmo Lino Tava­res, com quem teve três filhos.\n\nPublicou *Minha pátria para Cristo.*\n\n \n\nFONTES: CÂM. DEP. *Deputados;*CÂM.  DEP. *Deputados brasileiros. \nRepertório*(1967-1971, 1975-1979 e 1979-1983); CÂM. DEP. *Relação\nnominal dos senhores;* CAMPOS, Q. *Fichário*; INF. BIOG.\n\n \n","ref":"FONTES: CÂM. DEP. *Deputados;*CÂM.  DEP. *Deputados brasileiros. \nRepertório*(1967-1971, 1975-1979 e 1979-1983); CÂM. DEP. *Relação\nnominal dos senhores;* CAMPOS, Q. *Fichário*; INF. BIOG.\n\n \n","dic":"DHBB"}
