{"title":"BARRETO, Plínio","cargoss":["Governador de estado ou do Distrito Federal","Revolucionário ou revoltoso","Constituinte","Deputado federal"],"cargos_esp":["prov",0,0,0],"datas_ini":[1930,1932,1946,1946],"datas_fim":[1930,1932,1946,1951],"estados":["SP",0,0,"SP"],"autor":[0],"content":"**BARRETO, Plínio**\n\n\\*jornalista; gov. prov. SP 1930; rev. 1932; const. 1946; dep. fed. SP\n1946-1951.\n\n \n\n*Plínio Barreto* nasceu em Campinas (SP) no dia 20 de junho de 1882,\nfilho de José de Morais Barreto e de Vicência Augusta Barreto.\n\nApós ter iniciado os estudos no seminário episcopal de Campinas, foi\ntransferido para o Colégio São Paulo, na capital do estado. Ingressou em\n1899 na Faculdade de Direito de São Paulo, formando-se em 1902. Ainda\nestudante, empregou-se como revisor no jornal *O* *Estado de S.\nPaulo,*passando para a redação por volta de 1898.\n\nApós formar-se, seguiu para Araras, no interior de São Paulo, por\nsugestão de Júlio de Mesquita, proprietário e editor-chefe do jornal\nonde trabalhava. Nessa cidade, desempenhou simultaneamente as funções de\nadvogado e de jornalista até 1909. Retornando a São Paulo, passou a\nmanter no jornal a seção “Crônicas forenses”, onde escrevia sobre os\nprincipais julgamentos ocorridos no Tribunal de Justiça. Estas crônicas\nforam reunidas em 1912 em um livro publicado sob o mesmo título da\ncoluna.\n\nEm fevereiro de 1912, fundou a *Revista* *dos Tribunais*e em 1916,\njuntamente com Júlio de Mesquita e Alfredo Pujol, assumiu a direção da\n*Revista do Brasil.*Durante os dois anos em que esse grupo se manteve na\ndireção da revista, nela colaboraram intelectuais importantes, como\nCapistrano de Abreu, Roquette Pinto, Oliveira Viana, Oliveira Lima,\nRocha Pombo, Medeiros de Albuquerque e outros. Em 1918, passou a direção\nda revista a Monteiro Lobato.\n\nAo mesmo tempo em que se dedicava ao jornalismo político, Plínio Barreto\ntambém era crítico literário, condição em que se manteve afastado da\ncorrente renovadora que promoveu a Semana de Arte Moderna, combatendo o\nmodernismo ao longo de muitos anos.\n\nA partir do início da década de 1920, tornou-se, na esfera do direito\nprivado, um dos advogados mais ilustres e mais requisitados de São\nPaulo. Era membro da Liga Nacionalista, organização criada em 1917, que\ndefendia o serviço militar obrigatório e o voto secreto. *O Estado de S.\nPaulo*dava à liga, de cuja direção fazia parte Júlio de Mesquita Filho,\no mais amplo apoio.\n\nEm 1926, Plínio Barreto assumiu a direção do *Diário da Noite,*fundado\nno ano anterior por Léo Vaz e Mariano Costa e depois adquirido por Assis\nChateaubriand. Após a morte de Júlio de Mesquita em 1927, assumiu o\ncargo de redator-chefe de *O Estado de S. Paulo.*No mesmo ano, começou a\ntrabalhar como consultor jurídico da Irmandade da Santa Casa de\nMisericórdia.\n\nCom a vitória da Revolução de 1930, o presidente do estado de São Paulo,\nJúlio Prestes, abandonou o palácio dos Campos Elíseos e o general\nHastínfilo de Moura assumiu o governo por poucos dias (24 a 28 de\noutubro), organizando um secretariado composto de membros do Partido\nDemocrático de São Paulo. Plínio Barreto foi designado secretário de\nJustiça e Segurança Pública, mantendo-se no cargo, tal como todo o\nsecretariado, depois do fim do governo do general Hastínfilo. No\nconturbado período que se seguiu, conhecido como “governo dos 40 dias”,\ntornou-se cada vez mais aguda a crise entre as elites políticas\npaulistas e o governo federal.\n\nInicialmente, José Maria Whitaker foi o chefe do governo paulista. Logo,\nporém, assumiu o Ministério da Fazenda, e Plínio Barreto tornou-se\ngovernador provisório de São Paulo, cargo que ocupou apenas de 6 a 25 de\nnovembro de 1930. No mesmo período, o tenente João Alberto Lins de\nBarros, um dos líderes da revolução, ocupava o posto de delegado\nrevolucionário no estado, controlando as forças militares locais.\n\nO momento era extremamente agitado. As elites políticas paulistas\nopunham-se ao governo federal e a seu representante no governo do\nestado, João Alberto. Sucediam-se greves operárias, que João Alberto\nprocurava contornar através de concessões, como o aumento de 5% nos\nsalários e a redução do número de horas de trabalho para 40 por semana.\nAo mesmo tempo, o governo criou a Comissão de Organização Municipal e a\nDelegacia Revolucionária de Ordem Política e Social, enquanto a\nSecretaria de Segurança Pública era separada da Secretaria de Justiça.\nEssas medidas se destinavam a agilizar a repressão política que dominou\no estado nesse período.\n\nNo dia 25 de novembro, João Alberto assumiu o posto de interventor\nfederal em São Paulo. Plínio Barreto retornou ao cargo de secretário de\nJustiça, nele permanecendo até a renúncia coletiva do secretariado, no\ndia 5 de dezembro de 1930.\n\nA crise em São Paulo continuava grave, e numa tentativa de apaziguar a\nsituação decidiu-se, em julho de 1931, que João Alberto seria exonerado.\nEm entendimentos realizados entre Osvaldo Aranha, Getúlio Vargas e o\npróprio João Alberto, ficou decidida a indicação de Plínio Barreto para\na interventoria. Com isso, pretendia-se obter o apoio do Partido\nDemocrático. De fato, o nome de Plínio Barreto contava com a adesão de\ndiversas entidades empresariais e classistas, como associações\nagrícolas, comerciais e industriais e o Instituto dos Advogados, sem\ncontar o jornal *O Estado* *de S. Paulo.*\n\nEntretanto, entre os setores revolucionários mais radicais, Plínio\nBarreto era encarado com desconfiança. Contra ele havia um artigo que\npublicara em julho de 1922 em *O Estado* *de S. Paulo,*criticando os 18\ndo Forte (“Heróis? Não!”), o que provocou protestos quando seu nome\ncomeçou a ser cogitado. O principal adversário de sua indicação era\nMiguel Costa, chefe da Legião Revolucionária e comandante da Força\nPública. Julgando impossível governar tendo contra si a Força Pública do\nestado, e não conseguindo obter o afastamento de Miguel Costa, que\npossuía sólido prestígio junto às autoridades federais, Plínio Barreto\ndesistiu do cargo no dia 23 de julho, em carta endereçada a Osvaldo\nAranha. João Alberto exonerou-se no dia 24, assumindo a interventoria\nLaudo de Camargo.\n\nEm 1932, Plínio Barreto apoiou o movimento constitucionalista de São\nPaulo. Então presidente do Instituto dos Advogados de São Paulo, em\nagosto de 1932 conclamou, pelo rádio, seus colegas a aderirem ao\nmovimento. Depois, assumiu a chefia do serviço de censura das forças\npaulistas.\n\nApós a derrota da Revolução de 1932, foi preso no Rio de Janeiro em\noutubro e posto em liberdade poucos dias depois. Retornando a São Paulo,\nretomou suas atividades de advogado e redator-chefe de *O Estado de S.\nPaulo*.****Em 1934, deu seu apoio à candidatura de Armando de Sales\nOliveira, eleito governador de São Paulo em outubro do mesmo ano.\n\nPouco depois do início do Estado Novo, nos primeiros meses de 1938,\nJúlio de Mesquita Filho e Armando Sales partiram para o exílio. Plínio\nBarreto continuou como redator-chefe de *O Estado de S. Paulo*até 1940,\nquando o governo promoveu uma intervenção mais direta na redação do\njornal. Mantendo-se em constante oposição aos governos de interventores\ne ao governo federal, Plínio Barreto passou então a colaborar com o\n*Diário de São* *Paulo,*pertencente à cadeia dos Diários Associados de\nAssis Chateaubriand.\n\nEm 1945, foi eleito deputado à Assembléia Nacional Constituinte na\nlegenda da União Democrática Nacional (UDN). Participou ativamente da\nelaboração da nova Constituição. Permanecendo na Câmara como deputado\nfederal, foi vice-presidente da Comissão de Constituição e Justiça e\npresidente da comissão de inquérito sobre atos delituosos da ditadura.\nSua atuação parlamentar voltou-se muito para a legislação trabalhista e\na organização dos tribunais do trabalho. Elaborou também um projeto de\nlei propondo a equiparação da mulher ao homem frente ao direito civil.\nEmbora fosse anticomunista, manifestou-se na Câmara contra a cassação\ndos parlamentares comunistas em 1947.\n\nEm novembro desse mesmo ano, candidatou-se à vice-governança do estado\nde São Paulo em pleito no qual se elegeriam os representantes para as\ncâmaras municipais do estado, quatro deputados federais e o\nvice-governador. Ademar de Barros já fora eleito governador em janeiro.\nPlínio Barreto foi apoiado pela UDN e pelo Partido Socialista\nBrasileiro, sendo entretanto derrotado pelo deputado Luís Gonzaga\nNovelli Júnior, genro do presidente Eurico Gaspar Dutra e apoiado por\nAdemar e pelo Partido Social Progressista.\n\nRetornou à Câmara, permanecendo até o final de seu mandato, em janeiro\nde 1951. Mesmo morando no Rio de Janeiro, continuava a colaborar\ndiariamente para *O Estado de* *S. Paulo.*\n\nVoltou para São Paulo em 1951, retornando à chefia de redação do jornal\ne à advocacia. Promoveu ainda a organização da seção paulista da Ordem\ndos Advogados do Brasil.\n\nEm junho de 1958, foi eleito por unanimidade para a Academia Paulista de\nLetras, mas não chegou a tomar posse de sua cadeira por ter falecido\npouco depois, no dia 28 de junho de 1958.\n\nFoi casado com Celina Pacheco Barreto, com quem teve dois filhos.\n\nAlém de conferências, artigos e ensaios sobre temas políticos, jurídicos\ne literários, publicou: *Crônicas forenses*(1912),*Vida forense* (1922),\n*Cem anos de cultura jurídica no Brasil* (1922),*Injúrias impressas*\n(1924),*Os acontecimentos de julho de 1924*(1925),*Questões\ncriminais*(1927),*O público*(1931),*Um paranóico de grande tomo*(1932) e\n*O convento de* *São Francisco e a Faculdade de Direito de São*\n*Paulo*(1933).\n\nJorge Miguel Mayer\n\n \n\n \n\nFONTES: ARAÚJO, A. *Chefes;*ARQ. GETÚLIO VARGAS; CÂM. DEP.\n*Deputados;*CÂM*.*DEP. *Relação dos dep.;*CARONE, E. *República nova;\nDiário do Congresso Nacional*;*Efemérides Paulistas; Encic. Mirador;*\nFIGUEIREDO, E. *Contribuição;* FLYNN, P. *Legião; Grande encic. Delta;*\n*Grande encic. portuguesa;*INST. HIST. GEOG. BRAS.; INST. NAC. LIVRO.\n*Índice;* JARDIM, R. *Aventura; Jornal do Comércio,* Rio (20/10/45);\nLEITE, A. *História;*LEITE, A*. Páginas;*MELO, L. *Dic.*; MENESES, R.\n*Dic.;*NOGUEIRA FILHO, P. *Ideais; Personalidades;*SOC. BRAS. EXPANSÃO\nCOMERCIAL. *Quem; Who’s who in Latin.*\n\n \n","ref":"FONTES: ARAÚJO, A. *Chefes;*ARQ. GETÚLIO VARGAS; CÂM. DEP.\n*Deputados;*CÂM*.*DEP. *Relação dos dep.;*CARONE, E. *República nova;\nDiário do Congresso Nacional*;*Efemérides Paulistas; Encic. Mirador;*\nFIGUEIREDO, E. *Contribuição;* FLYNN, P. *Legião; Grande encic. Delta;*\n*Grande encic. portuguesa;*INST. HIST. GEOG. BRAS.; INST. NAC. LIVRO.\n*Índice;* JARDIM, R. *Aventura; Jornal do Comércio,* Rio (20/10/45);\nLEITE, A. *História;*LEITE, A*. Páginas;*MELO, L. *Dic.*; MENESES, R.\n*Dic.;*NOGUEIRA FILHO, P. *Ideais; Personalidades;*SOC. BRAS. EXPANSÃO\nCOMERCIAL. *Quem; Who’s who in Latin.*\n\n \n","dic":"DHBB"}
