{"title":"TÁVORA, Fernandes","cargoss":["Revolucionário ou revoltoso","Governador de estado ou do Distrito Federal","Interventor","Constituinte","Deputado federal","Constituinte","Deputado federal","Senador","Senador"],"cargos_esp":[0,"prov",0,0,0,0,0,0,0],"datas_ini":[1930,1930,1930,1934,1935,1946,1946,1955,1947],"datas_fim":[1930,1930,1931,1934,1937,1946,1947,1963,1951],"estados":[0,"CE","CE",0,"CE",0,"CE","CE","CE"],"autor":[0],"content":"**TÁVORA, Fernandes**\n\n\\*rev. 1930; gov. prov. CE 1930; interv. CE 1930-1931; const. 1934; dep.\nfed. CE 1935-1937; const. 1946; dep. fed. CE 1946-1947; sen. CE\n1947-1951 e 1955-1963.\n\n \n\n*Manuel do Nascimento Fernandes Távora* nasceu na fazenda Embargo, em\nJaguaribe (CE), no dia 21 de março de 1877, filho de Joaquim Antônio do\nNascimento e de Clara Fernandes Távora do Nascimento. Segundo os\nbiógrafos da família, sua mãe estaria ligada à nobreza de Portugal. Seu\nantepassado mais ilustre teria sido o marquês de Távora, que, perseguido\npor Pombal em 1759, se refugiou no sertão do Ceará. Sua família\nconsolidou grande tradição na política interiorana do estado graças à\noposição que moveram seus representantes à oligarquia dos Acióli,\ndominante na República Velha. Seu tio por linha materna, Belisário\nTávora, foi chefe de polícia do Distrito Federal no governo do marechal\nHermes da Fonseca (1910-1914). Seu irmão Juarez Távora participou da\nRevolta de 1924, em São Paulo, integrou a Coluna Prestes e teve atuação\nfundamental na Revolução de 1930, tornando-se a partir de então ministro\nda Viação (1930) e da Agricultura (1932-1934), candidato à presidência\nda República (1955), deputado federal pela Guanabara (1963-1964) e\nnovamente ministro da Viação (1964-1967). Seu outro irmão, Joaquim\nTávora, participou do levante tenentista de Mato Grosso em 1922 e morreu\nem combate na Revolução de 1924, em São Paulo.\n\nFernandes Távora iniciou os estudos primários em sua terra natal em\n1884, concluindo-os no Seminário Menor em Crato (CE), no ano de 1889.\nCursou o secundário entre 1889 e 1896 no Ginásio Benjamim Constant,\nnesta última cidade, no Instituto de Humanidades, em Fortaleza, e no\nGinásio Pernambucano, em Recife. Ingressou na Faculdade de Medicina da\nBahia em 1897, viajando depois para o Rio de Janeiro, então Distrito\nFederal, a fim de continuar o curso nessa cidade. Diplomou-se em março\nde 1903, três anos depois de graduar-se também em farmácia pela\nFaculdade do Rio de Janeiro. Sua tese de doutoramento levou o\ntítulo****de Telepatia e, em seus primeiros anos de atividade\nprofissional, clinicou na região amazônica e no Ceará.\n\nViajou para a Europa em 1908 e, quando de seu regresso ao país,\nparticipou ativamente no Ceará da Campanha Civilista, movimento que\npromoveu, em 1909-1910, a candidatura de Rui Barbosa à presidência da\nRepública, em oposição à do marechal Hermes da Fonseca. A campanha\nassumiu um caráter antimilitarista, mas, ao fim, o candidato militar foi\neleito em março de 1910.\n\nEm março de 1913, Fernandes Távora foi eleito deputado estadual no\nCeará, exercendo o mandato até julho de 1914, ano em que retornou à\nEuropa. Em 1918, elegeu-se novamente deputado estadual para um mandato\nque foi até julho de 1920, e, de 1919 a 1921, lecionou línguas no\nColégio Militar do Ceará. Liderou em seu estado a Reação Republicana,\nmovimento que promoveu de 1921 a 1922 a candidatura de Nilo Peçanha à\npresidência da República em oposição à de Artur Bernardes, afinal eleito\nem março de 1922.\n\nDe 1920 a 1925, foi diretor e redator-chefe do jornal A Tribuna, que\ncombatia Artur Bernardes e era acusado de “usar linguagem insultuosa ao\ngoverno federal e pregar a revolução, encarregando-se seus redatores de\ntransmitir para os estados do Norte as notícias tendenciosas que vão\npublicando diariamente”. Quando, em dezembro de 1925, a Coluna Prestes\ninvadiu o Piauí, ameaçando o Ceará, foi decretado o estado de sítio na\nregião e o jornal foi fechado. Segundo conta Fernandes Távora no livro\nAlgo de minha vida, o jornal fechou porque não aceitava a censura do\ngoverno. Com o fechamento de A Tribuna, Fernandes Távora foi obrigado a\nexilar-se na Europa.\n\nEm 1928, de volta ao Ceará, Fernandes Távora recepcionou no mês de julho\na caravana do Partido Democrático Nacional (PDN), liderada por Joaquim\nFrancisco de Assis Brasil, que visitou os estados do norte do país e\nconstituiu em quase todos eles grupos incumbidos de organizar localmente\no PDN. Fernandes Távora foi o fundador do Partido Democrático do Ceará.\n\nEm janeiro de 1930, Fernandes Távora recepcionou também a caravana da\nAliança Liberal, frente única formada em junho de 1929 pelas forças de\noposição — que lançou a candidatura de Getúlio Vargas à presidência da\nRepública para concorrer com o candidato governista Júlio Prestes. A\ncaravana, liderada por João Batista Luzardo, Agamenon Magalhães, Paulo\nDuarte, Meneses Barreto, Augusto de Lima e outros, tinha como lema de\nseus comícios dois itens fundamentais: o voto secreto e a anistia.\nFernandes Távora foi o fundador da Aliança Liberal no Ceará. Em março de\n1930, realizaram-se as eleições presidenciais, saindo vencedor Júlio\nPrestes.\n\n \n\nDa Revolução de 1930 ao Estado Novo\n\nNo dia 3 de outubro de 1930, eclodiu no Rio Grande do Sul a revolução\nque iria depor Washington Luís. Em 8 de outubro, caiu o governo do\nCeará, tendo o presidente estadual José Matos Peixoto abandonado seu\nposto ante a aproximação do 23º Batalhão de Caçadores, procedente de\nSousa (PB). Fernandes Távora, que se achava preso, foi libertado e\nassumiu o governo do estado, à frente do qual permaneceu\nprovisoriamente. Em 24 de outubro, Washington Luís foi deposto no Rio de\nJaneiro e, em 3 de novembro, Vargas assumiu a chefia do Governo\nProvisório da República.\n\nEm 14 de novembro, Fernandes Távora foi nomeado interventor federal no\nCeará. Seu irmão Juarez Távora, que liderava a revolução no Norte e no\nNordeste, tornou-se conhecido nesse período inicial do novo regime como\no “vice-rei do Norte”. Os Acióli e demais grupos oligárquicos cearenses\nperderam sua hegemonia política, que passou às mãos da família Távora. O\nnovo interventor pretendia implantar uma política tenentista contrária\naos grupos dominantes do passado, baixando para tanto decretos como o\nque reduziu os aluguéis e incentivando a Legião Revolucionária. Acabou,\nentretanto, por entrar em choque com a guarnição do Exército sediada em\nFortaleza, sendo por isso exonerado do governo em setembro de 1931,\nquando foi substituído pelo capitão Roberto Carneiro de Mendonça.\n\nSegundo Juarez Távora em seu livro Uma vida e muitas lutas, a\ndivergência entre a corrente tenentista e Fernandes Távora remontava à\ndata da posse deste, pois, desde a preparação da revolução no Ceará,\nficara acertada a designação do major João Silva Leal, do Colégio\nMilitar de Fortaleza, para assumir o governo do estado após a vitória do\nmovimento. Para resolver a questão, em setembro de 1931 foi constituída\numa comissão especial integrada por Osvaldo Aranha, ministro da Justiça,\no general Pedro Aurélio de Góis Monteiro e Pedro Ernesto Batista,\ninterventor no Distrito Federal, a qual, embora isentando de culpa\nFernandes Távora, julgou mais acertado que o Governo Provisório\naceitasse sua exoneração.\n\nEm 1932, Fernandes Távora foi médico inspetor das caixas de\naposentadoria e pensões.\n\nPor sua vez, o capitão Carneiro de Mendonça procurou desde o início\nmanter uma eqüidistância das forças políticas do Ceará. Esses grupos, no\nentanto, logo se dividiram: de um lado, os representantes locais do\nClube 3 de Outubro, organização tenentista, fundaram o Partido Social\nDemocrático (PSD) no Ceará, dirigido por Fernandes Távora, o major João\nSilva Leal, Demócrito Rocha e outros; e de outro, as oligarquias\ntradicionais uniram-se na Liga Eleitoral Católica (LEC) do Ceará, que se\nconverteu em partido político. Enquanto isso, os Acióli, líderes do\nantigo Partido Republicano Conservador, organizaram o Partido\nRepublicano Nacionalista do Ceará.\n\nEm maio de 1933, ao se realizarem as eleições para a Assembléia Nacional\nConstituinte, Fernandes Távora foi um dos deputados eleitos pelo Ceará\nna legenda do PSD. Foi também escolhido líder da bancada cearense e\nsegundo-secretário da mesa da Constituinte durante a quarta sessão\npreparatória da Assembléia, realizada no dia 13 de novembro do mesmo\nano, dois dias antes de sua instalação. Na mesma ocasião, Antônio Carlos\nRibeiro de Andrada foi eleito presidente da Assembléia e Osvaldo Aranha\nfoi escolhido líder da maioria.\n\nJá no final de dezembro, entretanto, Osvaldo Aranha renunciou à sua\nposição. Em 12 de janeiro de 1934, sob a presidência de Antônio Carlos,\nos líderes das diversas bancadas se reuniram para tratar da questão.\nFernandes Távora, Cristóvão Barcelos, Alfredo de Arruda Câmara, Valdemar\nFalcão e Generoso Ponce Filho manifestaram-se favoravelmente a Antônio\nGarcia de Medeiros Neto, finalmente escolhido para ocupar o lugar de\nOsvaldo Aranha.\n\nEm fevereiro, Medeiros Neto apresentou uma indicação propondo a inversão\nda ordem dos trabalhos na Assembléia, ou seja, sugerindo que primeiro\nfosse eleito o presidente da República, votando-se depois a\nConstituição. A Comissão de Polícia da Assembléia aprovou em princípio a\nindicação por três votos contra dois. Votaram a favor Antônio Carlos,\nClementino Lisboa e Fernandes Távora. Em março, contudo, a Comissão de\nPolícia apresentou seu parecer definitivo, rejeitando a Indicação\nMedeiros Neto e substituindo-a pela Fórmula Simões Lopes, que garantia a\nvotação da Constituição antes da eleição do presidente. Em junho de\n1934, Fernandes Távora participou da reunião no Gabinete de Antônio\nCarlos, juntamente com os líderes das principais correntes, quando ficou\ndefinitivamente afastada a hipótese da transformação da Assembléia em\nCâmara legislativa ordinária.\n\nEm 16 de julho de 1934 foi promulgada a nova Constituição e no dia\nseguinte Getúlio Vargas foi eleito presidente da República. No mês de\noutubro, realizaram-se as eleições para a Câmara Federal e para as\nassembléias constituintes estaduais. O PSD do Ceará fez 13 deputados\nestaduais e quatro federais — entre os quais Fernandes Távora, ficando\nem minoria na Assembléia estadual. Em junho do ano seguinte, o PSD\nrompeu com o governo federal porque este passou a apoiar seus\nadversários políticos. Estremecido com os governos estadual e federal,\nFernandes Távora, a pedido de Juarez, iria apoiar a candidatura Armando\nSales, lançada para disputar as eleições presidenciais previstas para\n1938. Armando Sales disputava o mandato presidencial com o candidato\noficioso, José Américo de Almeida, e com o líder integralista Plínio\nSalgado.\n\nFernandes Távora exerceu seu mandato de deputado federal até 10 de\nnovembro de 1937, quando o golpe do Estado Novo fechou o Congresso e\ncancelou as eleições presidenciais.\n\n \n\nA redemocratização\n\nEm princípios de 1945, as correntes de oposição a Vargas iniciaram uma\nsérie de contatos visando uma articulação política mais ampla e efetiva.\nEm abril, foi organizado o diretório nacional da União Democrática\nNacional (UDN), tendo Fernandes Távora participado de sua primeira\nreunião, quando foram nomeadas as comissões para a elaboração do\nprimeiro projeto de estatutos do partido. Foi então escolhido membro da\ncomissão de estudos de saúde pública. Távora era partidário da\ncandidatura de Eduardo Gomes, que disputaria as eleições presidenciais\ncom Eurico Dutra, candidato do PSD.\n\nEm outubro de 1945, Vargas foi deposto por um golpe militar que\ndeterminou a extinção do Estado Novo. No dia 2 de dezembro, ao mesmo\ntempo em que Eurico Dutra era eleito presidente da República, Fernandes\nTávora elegeu-se deputado à Assembléia Nacional Constituinte pelo Ceará\nna legenda da UDN. Com a promulgação da nova Carta (18/9/1946) e a\ntransformação da Assembléia em Congresso ordinário, permaneceu na Câmara\ndos Deputados até abril de 1947, quando se afastou por ter sido eleito\nem janeiro senador pelo Ceará na legenda do Partido Trabalhista\nBrasileiro (PTB), para um mandato que se encerraria em janeiro de 1951.\n\nEm outubro de 1947, Fernandes Távora defendeu o projeto do senador Ivo\nd’Aquino que determinava a extinção dos mandatos dos parlamentares do\nPartido Comunista Brasileiro, então Partido Comunista do Brasil (PCB),\ncujo registro havia sido cassado em maio daquele ano. Dias depois, o\nprojeto foi aprovado, sendo cassados em janeiro de 1948 os mandatos de\ntodos os parlamentares comunistas.\n\nMembro da Comissão de Trabalho e Previdência Social do Senado durante\nessa legislatura, Fernandes Távora elegeu-se novamente senador por seu\nestado em 1954 na legenda da coligação entre o PTB, a UDN e o Partido\nRepublicano (PR). Em abril de 1955, realizou-se a Convenção Nacional da\nUDN, elegendo-se Mílton Campos para a presidência e Juraci Magalhães,\nAdauto Lúcio Cardoso e Fernandes Távora para as vice-presidências do\npartido.\n\nEm 11 de novembro de 1955, um movimento militar liderado pelo general\nHenrique Teixeira Lott, visando barrar uma conspiração em preparo no\ngoverno e assegurar a posse do presidente eleito Juscelino Kubitschek,\ndepôs o presidente em exercício Carlos Luz e entregou a chefia da nação\na Nereu Ramos. Quando o presidente João Café Filho, licenciado por\nmotivo de saúde, tentou recuperar seu posto, o Congresso votou seu\nimpedimento. Fernandes Távora votou contra a medida, que acabou sendo\naprovada.\n\nFernandes Távora exerceu o mandato de senador até o final da\nlegislatura, em janeiro de 1963. Foi membro do Instituto Histórico e\nGeográfico do Ceará e da Academia de Letras do Ceará.\n\nFaleceu em Fortaleza em 23 de setembro de 1973.\n\nFoi casado com Carlota Augusta de Morais Fernandes Távora. Seu filho\nVirgílio Távora foi ministro da Viação e Obras Públicas (1961-1962),\ngovernador do Ceará (1963-1966), deputado federal (1967-1971), senador\n(1971-1979) pelo Ceará e novamente governador daquele estado (1979).\n\nPublicou as seguintes obras: O preço da liberdade (1930), Estado mental\ndo padre Cícero (1943), Personalidade moral e mental do padre Ibiapina\n(1946), Como poderemos resolver o problema do petróleo no Brasil (1949),\nPalavras de protesto e de saudade (discursos, 1960), Algo de minha vida\n(1961), Idéias e perfis (1967) e Fenômenos de metapsíquica.\n\nA seu respeito, Francisco Alves de Andrade e Castro escreveu Humanismo\nde um pioneiro, Fernandes Távora numa interpretação biográfica (1971).\n\nRobert Pechman\n\n \n\n \n\nFONTES: Boletim Min. Trab. (5/36); CÂM. DEP. Deputados; CÂM. DEP.\nRelação dos dep.; Câm Dep. seus componentes; COSTA, M. Cronologia;\nDiário do Congresso Nacional; FRANCO, A. Escalada; FUND. GETULIO VARGAS.\nCronologia da Assembléia; GALVÃO, F. Fechamento; GIRÃO, R. Ceará;\nGODINHO, V. Constituintes; Grande encic. Delta; MENESES, R. Dic.;\nNABUCO, C. Vida; PEIXOTO, A. Getúlio; POPPINO, R. Federal; SENADO.\nRelação; SILVA, G. Constituinte; SILVA, H. 1945; TÁVORA, J. Vida;\nTÁVORA, M. Algo.\n\n \n","ref":"FONTES: Boletim Min. Trab. (5/36); CÂM. DEP. Deputados; CÂM. DEP.\nRelação dos dep.; Câm Dep. seus componentes; COSTA, M. Cronologia;\nDiário do Congresso Nacional; FRANCO, A. Escalada; FUND. GETULIO VARGAS.\nCronologia da Assembléia; GALVÃO, F. Fechamento; GIRÃO, R. Ceará;\nGODINHO, V. Constituintes; Grande encic. Delta; MENESES, R. Dic.;\nNABUCO, C. Vida; PEIXOTO, A. Getúlio; POPPINO, R. Federal; SENADO.\nRelação; SILVA, G. Constituinte; SILVA, H. 1945; TÁVORA, J. Vida;\nTÁVORA, M. Algo.\n\n \n","dic":"DHBB"}
