{"title":"TEBET, Ramez","cargoss":["Governador de estado ou do Distrito Federal","Senador","Ministro da Integração Nacional","Senador"],"cargos_esp":[0,0,"Nac",0],"datas_ini":[1986,1995,2001,2001],"datas_fim":[1987,2001,2001,2006],"estados":["MS","MS",0,"MS"],"autor":[0],"content":"TEBET, Ramez\n\n\\*gov. MS 1986-1987; sen. MS 1995**-2001; min. Integr. Nac. 2001;\nsen.****MS 2001-2006.**\n\n*Ramez Tebet* nasceu em Três Lagoas, então Mato Grosso, no dia 7 de\nnovembro de 1936, filho de Taufic Tebet e de Angelina Jaime Tebet.\n\nBacharelou-se em ciências jurídicas e sociais pela Universidade do\nBrasil (atual Universidade Federal do Rio de Janeiro), em 1959. De volta\na seu estado natal, exerceu o cargo de promotor de Justiça entre os anos\nde 1961 e 1964.\n\nIngressou na vida política elegendo-se prefeito de Três Lagoas na\nlegenda do MDB, partido de oposição ao regime militar instaurado no país\nem abril de 1964, em novembro de 1974 e assumindo a prefeitura em\njaneiro do ano seguinte. Ainda em 1975 tornou-se professor da\nUniversidade Federal de Mato Grosso (UFMT), onde permaneceria até 1978.\n\nEm **11 de** outubro de 1977, foi aprovada **pelo presidente da\nRepública, general Ernesto Geisel, a Lei Complementar** **n° 31** que\ndividiu o estado do Mato Grosso em norte e sul. O norte, tendo Cuiabá\ncomo capital, continuou a se chamar Mato Grosso e o sul, chamado Mato\nGrosso do Sul, passou a ter como capital Campo Grande. **Em novembro,**\nRamez Tebet foi eleito deputado **constituinte** na legenda do MDB de\nMato Grosso do Sul. Deixando a prefeitura em dezembro, ocupou a cadeira\nna Assembleia Legislativa em **1° de janeiro**de 1979. **Logo no início,\nassumiu a função de secretário de Justiça e tornou-se relator da\nprimeira Constituição do recém-criado estado de Mato Grosso do Sul.\nQuando houve a promulgação da Carta Magna, em 13 de junho de 1979, a\nAssembleia Constituinte passou a ser denominada Assembleia Legislativa\ne, junto com a mudança terminológica, os deputados que até aquele\nmomento eram chamados constituintes tornaram-se deputados estaduais.**\n\nCom a extinção do bipartidarismo em 29 de novembro de 1979 e a\nconsequente reformulação partidária, filiou-se ao Partido do Movimento\nDemocrático Brasileiro (PMDB). Nessa legenda foi eleito em 1982\nvice-governador do Mato Grosso do Sul, na gestão de Wilson Martins\n(1983-1986). Deixando a Assembleia estadual em janeiro de 1983, foi\nempossado em março seguinte. Nesse período foi relator da primeira\nConstituição de Mato Grosso do Sul.\n\nAssumiu o governo do Mato Grosso do Sul em maio de 1986, quando Wilson\nMartins deixou o cargo para disputar uma vaga no Senado. Em março de\n1987, passou o governo para seu sucessor, Marcelo Miranda. Ainda nesse\nano ocupou a direção da Superintendência do Desenvolvimento da Região\nCentro-Oeste (Sudeco), função que exerceria até **1989.**\n\nVice-presidente do diretório regional do PMDB, foi eleito senador em\noutubro de 1994, tendo como base eleitoral a sua cidade natal. Empossado\nem fevereiro do ano seguinte, tornou-se titular das comissões de\nAssuntos Econômicos, de Relações Exteriores, de Fiscalização e Controle\ne de Constituição, Justiça e Cidadania.\n\nDurante a votação das emendas constitucionais enviadas ao Congresso pelo\nExecutivo, acompanhou a orientação da base parlamentar governista e foi\na favor da abolição do monopólio estatal nas telecomunicações e na\nexploração do petróleo. Também foi favorável à abertura da navegação de\ncabotagem às embarcações estrangeiras e ao fim de todas as diferenças\njurídicas entre as empresas de capital nacional e aquelas de outros\npaíses. Votou contra o fim do monopólio dos governos estaduais na\ndistribuição do gás canalizado.\n\nEm maio de 1995 veio a público uma série de denúncias apresentada pelo\ndeputado Fernando Gabeira, do Partido Verde (PV), e outros parlamentares\nsobre o contrato entre o governo brasileiro e a empresa norte-americana\nRaytheon para equipar o Sistema de Vigilância da Amazônia (Sivam),\nprojeto governamental que visava monitorar o espaço físico da Amazônia\nLegal brasileira mediante um sistema integrado de radares e sofisticados\nequipamentos de comunicação, meteorologia e sensoreamento remoto. Para\ninvestigar as denúncias sobre superfaturamento, corrupção e fraudes\ncontra a Previdência Social que a empresa vencedora teria praticado, foi\ninstalada uma comissão especial no Senado tendo como relator Ramez\nTebet. Em novembro, Ramez Tebet divulgou o parecer final afirmando que\nnão havia indícios de irregularidades nem comprovação do envolvimento do\nMinistério da Aeronáutica, da Secretaria de Assuntos Estratégicos, da\nembaixada brasileira nos Estados Unidos e das empresas nacionais e\ninternacionais em caminhos escusos na escolha da vencedora.\n\nEm maio de 1997 votou a favor da emenda da reeleição para presidente da\nRepública, governadores e prefeitos. Em março de 1998 foi a favor da\nemenda constitucional da reforma administrativa, que dentre suas várias\nmedidas permitiu o fim da estabilidade dos servidores civis.****\n\nEm 1999, assumiu a relatoria geral do Orçamento no Senado **e buscou\ncaracterizar os abusos sexuais cometidos contra crianças e adolescentes\ncomo crimes hediondos. Em março deste mesmo ano, o presidente do Senado\nAntônio Carlos Magalhães (PFL-BA) requereu a criação de uma Comissão\nParlamentar de Inquérito (CPI) destinada a investigar denúncias de\nirregularidades praticadas por alguns representantes dos tribunais\nregionais, superiores e de justiça. No ano seguinte, Ramez Tebet passou\na presidir esta CPI do Judiciário, que resultou em quatro renúncias,\nalguns arquivamentos de processos e na cassação do senador Luís Estevão\n(PMDB-DF), acusado de participar de um esquema de desvio de 169 milhões\nde reais das obras do Tribunal Regional do Trabalho (TRT) de São Paulo.\nAinda no ano 2000 tornou-se vice-presidente da Comissão de Constituição,\nJustiça e Cidadania do Senado.**\n\n**Em 2001 participou do Conselho de Ética que investigou o envolvimento\nde Antônio Carlos Magalhães e de José Roberto Arruda (PSDB-DF) na quebra\ndo sigilo do painel eletrônico de votação do Senado, na sessão realizada\nno ano 2000 em que foi cassado o mandato do senador Luís Estevão. **\n\n**Em junho de 2001, atendendo a um pedido do então presidente Fernando\nHenrique Cardoso, tornou-se ministro da Integração Nacional, vindo a\nocupar a pasta deixada pelo senador Fernando Bezerra (PTB-RN). Em seu\ndiscurso de entrada no Ministério, prometeu desenvolver o interior,\nbuscar soluções para a seca no nordeste e lutar contra as desigualdades\nregionais. Três meses depois, teve que deixar seu cargo para assumir a\npresidência do Senado.**\n\n** **\n\n**Presidente do Senado**\n\n** **\n\n**A vaga na presidência do Senado surgiu após a renúncia de Jáder\nBarbalho (PMDB-PA). Ainda no ano 2000 a imprensa começou a divulgar uma\nsérie de denúncias de corrupção e enriquecimento ilícito do senador\nJáder Barbalho, propiciado pelo desvio de verbas destinadas à\nSuperintendência de Desenvolvimento da Amazônia (Sudam). A despeito\ndessas acusações, em fevereiro de 2001 Jáder foi eleito presidente do\nSenado. No entanto, no mês de setembro acabou renunciando, para evitar\nque a continuidade no processo por quebra de decoro parlamentar\ninstaurado contra ele no Conselho de Ética resultasse na cassação de seu\nmandato, o que acarretaria a perda de seus direitos políticos por oito\nanos.**\n\n**Assim, ainda em setembro, Ramez Tebet foi eleito presidente do Senado.\nSua indicação foi resultado de uma decisão quase unânime do PMDB,\npartido que possuía maior bancada na Casa. O único voto contrário foi do\nsenador peemedebista e atualmente vice-presidente da República José\nAlencar.**\n\n**Como presidente do Senado, Tebet deu continuidade a alguns projetos\nfixados no início de seu mandato, entre os quais a instituição da\n“tipificação do crime de tortura”; a possibilidade dos filhos dos\ncidadãos empregados de utilizarem os recursos do Fundo de Garantia do\nTempo de Serviço (FGTS) de seus pais para custear seus estudos; a\napresentação do “rito sumário para desapropriação”, no que tange à\nquestão da terra; a mudança no conceito de “empresa nacional”; a\nsugestão de uma lei obrigando a gratuidade na emissão da primeira\ncarteira de identidade; a determinação de uma nova idade para que o\nservidor público pudesse se beneficiar da aposentadoria compulsória.\nPara esse último projeto, Ramez Tebet justificou que a legislação não\nacompanhou os avanços da ciência e o consequente aumento na expectativa\nde vida dos brasileiros. Assim, defendeu a proposta de emenda\nconstitucional que elevasse de 70 para 75 anos a idade para este tipo de\naposentadoria. Também aproveitou para sugerir que em casos de\naposentadoria voluntária, proporcional ao tempo de contribuição, a idade\nfosse de 65 anos para as mulheres e 70 anos para os homens.      **\n\n**Em outubro de 2002, disputou novamente as eleições para o Senado\nFederal pela legenda do PMDB. Conquistando mais de setecentos e trinta\nmil votos, foi reeleito senador e entrou para a história como o político\nque mais recebeu votos em Mato Grosso do Sul. **\n\n**Antes de entregar a presidência do Senado ao seu sucessor José Sarney\n(PMDB-AP) em janeiro de 2003, deu posse ao novo presidente da República\nLuís Inácio Lula da Silva. No mês de fevereiro, assumiu seu segundo\nmandato de senador.**\n\n** **\n\n** **\n\n**                                Segundo mandato de senador**\n\n**Neste mandato, tornou-se presidente da Comissão de Assuntos Econômicos\n(CAE) no biênio 2003/2004. Durante sua gestão, 88 projetos foram\naprovados, entre os quais o que previa a nova Lei de Falências, que foi\ndenominada de Lei de Recuperação de Empresa; a renovação do Código\nTributário Nacional; a parceria público-privada (PPP) que estabeleceu\nnormas de licitação e contratação de serviços em locais públicos; e as\nnormas de segurança e fiscalização dos produtos geneticamente\nmodificados (biossegurança).**\n\n**Em setembro de 2005 defendeu um projeto de emenda constitucional que\nprevia mudança no tempo de recesso parlamentar. Ao invés do direito de\nrecesso de 90 dias, sugeriu a diminuição para 30 dias, igual ao tempo de\nférias permitido a qualquer trabalhador no Brasil.**\n\n**Sua trajetória política foi fatalmente interrompida no dia 17 de\nnovembro de 2006. Sofrendo de câncer no fígado e com dificuldades\nrespiratórias, Ramez Tebet faleceu em sua residência em Campo Grande.\nSua cadeira no Senado foi ocupada pelo seu primeiro suplente Valter\nPereira de Oliveira (PMDB). Em virtude de sua morte, foi decretado luto\noficial de três dias na capital de Mato Grosso do Sul e também no\nmunicípio de Três Lagoas.**\n\n**Era casado** com Fairte Nassar Tebet, com quem teve quatro filhos.\n**Sua filha Simone Nassar Tebet, também filiada ao PMDB, elegeu-se\ndeputada estadual nas eleições de 2002, prefeita de Três Lagoas em\noutubro de 2004 e reelegendo-se quatro anos depois.**\n\nFONTES: *Estado de S. Paulo* (8/2 e 16/5/96); *Folha de S. Paulo*\n(29/9/98); SENADO.*Dados biográficos*(1995);\n[www.agenciabrasil.gov.br](http://www.agenciabrasil.gov.br/) (Reportagem\nde 18/11/06. Acesso em 21/10/09);\n[www.al.ms.gov.br](http://www.al.ms.gov.br/) (Acesso em 22/10/09);\n[www.diap.ps5.com.br](http://www.diap.ps5.com.br/) (Acesso em 23/10/09);\n[www.direito2.com.br](http://www.direito2.com.br/) (Reportagens de\n7/12/99, 23/5/00 e 26/6/01. Acesso em 22/10/09);\n[www.folhadaregiao.com.br](http://www.folhadaregiao.com.br/) (Reportagem\nde 18/11/06. Acesso em 21/10/09);\n[www.folha.uol.com.br](http://www.folha.uol.com.br/) (Reportagem de\n18/11/06. Acesso em 21/10/09);\n[www.g1.globo.com](http://www.g1.globo.com/) (Reportagens de 30/9/05,\n17/3, 21/3 e 18/11/06. Acesso em 21/10/09);\n[www.noticias.uol.com.br](http://www.noticias.uol.com.br/) (Reportagem\nde 30/7/09. Acesso em 22/10/09);\n[www.portalms.com.br](http://www.portalms.com.br/) (Acesso em 22/10/09);\n[www.pt.wikipedia.org](http://www.pt.wikipedia.org/) (Acesso em 20, 22 e\n23/10/09) [www.senado.gov.br](http://www.senado.gov.br/) (Acesso em\n22/10/09); [www.terra.com.br](http://www.terra.com.br/) (Reportagem de\n25/4/01. Acesso em 23/10/09);\n[www.treslagoas.ms.gov.br](http://www.treslagoas.ms.gov.br/) (Reportagem\nde 22/1/07. Acesso em 26/10/09);\n[www.tse.gov.br](http://www.tse.gov.br/) (Acesso em 22/10/09).\n\n \n","ref":"FONTES: *Estado de S. Paulo* (8/2 e 16/5/96); *Folha de S. Paulo*\n(29/9/98); SENADO.*Dados biográficos*(1995);\n[www.agenciabrasil.gov.br](http://www.agenciabrasil.gov.br/) (Reportagem\nde 18/11/06. Acesso em 21/10/09);\n[www.al.ms.gov.br](http://www.al.ms.gov.br/) (Acesso em 22/10/09);\n[www.diap.ps5.com.br](http://www.diap.ps5.com.br/) (Acesso em 23/10/09);\n[www.direito2.com.br](http://www.direito2.com.br/) (Reportagens de\n7/12/99, 23/5/00 e 26/6/01. Acesso em 22/10/09);\n[www.folhadaregiao.com.br](http://www.folhadaregiao.com.br/) (Reportagem\nde 18/11/06. Acesso em 21/10/09);\n[www.folha.uol.com.br](http://www.folha.uol.com.br/) (Reportagem de\n18/11/06. Acesso em 21/10/09);\n[www.g1.globo.com](http://www.g1.globo.com/) (Reportagens de 30/9/05,\n17/3, 21/3 e 18/11/06. Acesso em 21/10/09);\n[www.noticias.uol.com.br](http://www.noticias.uol.com.br/) (Reportagem\nde 30/7/09. Acesso em 22/10/09);\n[www.portalms.com.br](http://www.portalms.com.br/) (Acesso em 22/10/09);\n[www.pt.wikipedia.org](http://www.pt.wikipedia.org/) (Acesso em 20, 22 e\n23/10/09) [www.senado.gov.br](http://www.senado.gov.br/) (Acesso em\n22/10/09); [www.terra.com.br](http://www.terra.com.br/) (Reportagem de\n25/4/01. Acesso em 23/10/09);\n[www.treslagoas.ms.gov.br](http://www.treslagoas.ms.gov.br/) (Reportagem\nde 22/1/07. Acesso em 26/10/09);\n[www.tse.gov.br](http://www.tse.gov.br/) (Acesso em 22/10/09).\n\n \n","dic":"DHBB"}
