{"title":"TEIXEIRA, Aluísio =================","cargoss":["Deputado federal","Constituinte"],"cargos_esp":[0,0],"datas_ini":[1983,1987],"datas_fim":[1990,1988],"estados":["RJ",0],"autor":[0],"content":"TEIXEIRA, Aluísio\n=================\n\n\\*dep. fed. RJ 1983-1990; const. 1987-1988.\n\n \n\n*Aluísio Maria Teixeira Filho* nasceu no Rio de Janeiro, então Distrito\nFederal, no dia 1º de setembro de 1944, filho do desembargador Aluísio\nMaria Teixeira e de Ieda Martins Maria Teixeira. Seu avô, Paulo Dias\nMartins, foi deputado federal entre 1935 e 1937.\n\nEntre 1965 e 1968, Aluísio Teixeira foi auxiliar técnico e engenheiro da\nSuperintendência de Urbanização e Saneamento do Estado da Guanabara\n(Sursan). Formado em engenharia pela Pontifícia Universidade Católica\n(PUC) do Rio de Janeiro em 1967, foi também engenheiro-chefe do 6º\nDistrito de Obras, na Lagoa, e administrador regional de Copacabana, no\nperíodo de 1971 a 1974. Atuou ainda como colaborador do jornal *O Dia*.\nEm 1972, formou-se em administração pela Faculdade de Administração de\nEmpresas da Universidade Estadual do Rio de Janeiro (UERJ).\n\nSeguidor da liderança política de Antônio de Pádua Chagas Freitas –\ngovernador do estado da Guanabara (1971-1975) e mais tarde governador do\nRio de Janeiro (1979-1983) –, no pleito de novembro de 1974 elegeu-se\ndeputado estadual na legenda do Movimento Democrático Brasileiro (MDB),\npartido de oposição ao regime militar instaurado no país em abril de\n1964, pelo novo estado do Rio de Janeiro, que resultou da fusão da\nGuanabara com o antigo estado do Rio.\n\nEmpossado em fevereiro de 1975, no ano seguinte formou-se em direito\npela Faculdade de Direito Cândido Mendes. No pleito de novembro de 1978,\nfoi reeleito deputado estadual na legenda peemedebista, assumindo sua\ncadeira em fevereiro do ano seguinte. Com a extinção do bipartidarismo\nem novembro de 1979, e a conseqüente reorganização partidária, filiou-se\nao Partido do Movimento Democrático Brasileiro (PMDB), agremiação que\nsucedeu ao MDB.\n\nEm novembro de 1982 elegeu-se deputado federal. Empossado em fevereiro\ndo ano seguinte, tornou-se presidente da Comissão de Redação da Câmara.\n\nEm 25 de abril de 1984, votou a favor da emenda Dante de Oliveira, que\npropunha a volta das eleições diretas para presidente da República em\nnovembro daquele ano. Como a emenda não obteve a votação necessária para\nser encaminhada ao Senado, decidiu apoiar, no Colégio Eleitoral reunido\na 15 de janeiro de 1985 para escolher o novo presidente do país, a chapa\nvitoriosa Tancredo Neves/José Sarney lançada pela Aliança Democrática,\ncoligação do PMDB com a dissidência do Partido Democrático Social (PDS)\ndenominada Frente Liberal. Tancredo, no entanto, não chegou a assumir o\ncargo em 15 de março de 1985, data marcada para sua posse. Acometido por\numa grave enfermidade, veio a falecer em 21 de abril seguinte, sendo\nsubstituído na presidência por Sarney.\n\nNo pleito de novembro de 1986, elegeu-se deputado federal e participou\ndos trabalhos da Assembléia Nacional Constituinte. Empossado em\nfevereiro seguinte, tornou-se membro titular da Subcomissão do Poder\nExecutivo, da Comissão da Organização dos Poderes e Sistema de Governo,\ne suplente da Subcomissão dos Direitos e Garantias Individuais, da\nComissão da Soberania e dos Direitos e Garantias do Homem e da Mulher.\n\nAinda em 1987, com o apoio do governador Wellington Moreira Franco\n(1987-1991), substituiu o deputado Paulo Ramos na coordenadoria da\nbancada federal do PMDB fluminense na Constituinte. Durante as\nprincipais votações do período, votou a favor do rompimento de relações\ndiplomáticas com países de orientação racista, da adoção da pena de\nmorte, da manutenção da unicidade sindical e do sistema\npresidencialista, da nacionalização do subsolo, do mandato de cinco anos\npara o presidente José Sarney, da anistia aos micro e pequenos\nempresários e da legalização do jogo do bicho. Votou contra a\nremuneração 50% superior para o trabalho extra, a jornada semanal de 40\nhoras, a criação de um fundo de apoio à reforma agrária, a\ndesapropriação da propriedade produtiva e a estabilidade no emprego. Com\na promulgação da nova Carta em 5 de outubro de 1988, continuou no\nexercício de seu mandato ordinário como deputado federal.\n\nEm dezembro de 1990, renunciou ao mandato para assumir uma cadeira no\nConselho de Contas dos Municípios do Rio de Janeiro, órgão criado pela\nConstituinte estadual de 1989, e sua vaga na Câmara foi então ocupada\npelo suplente Jorge Gama.\n\nCom a extinção do conselho em agosto de 1991, retirou-se da vida\npública, passando a se dedicar às atividades de empresário do ramo\nhoteleiro.\n\nSolteiro, Aluísio Teixeira teve dois filhos.\n\n \n\nFONTES: ASSEMB. NAC. CONST. *Repertório*(1987-1988);**COELHO, J. &\nOLIVEIRA, A. * Nova*;*Globo* (15/8/85 e 8/4/87); INF. BIOG.; *Jornal do\nBrasil* (23/11/74; 20/1 e 4/4/87).\n","ref":"FONTES: ASSEMB. NAC. CONST. *Repertório*(1987-1988);**COELHO, J. &\nOLIVEIRA, A. * Nova*;*Globo* (15/8/85 e 8/4/87); INF. BIOG.; *Jornal do\nBrasil* (23/11/74; 20/1 e 4/4/87).\n","dic":"DHBB"}
