{"title":"TEIXEIRA, João","cargoss":["Deputado federal"],"cargos_esp":[0],"datas_ini":[1991],"datas_fim":[1995],"estados":["MT"],"autor":[0],"content":"**TEIXEIRA, João**\n\n\\*dep. fed. MT 1991-1995.\n\n* *\n\n*João Batista Teixeira Santos* nasceu em Montes Claros (MG) no dia 5 de\nmaio de 1956, filho de Luís Augusto dos Santos e de Diva Teixeira\nSantos.\n\nConcluiu o segundo grau no Colégio Militar de Belo Horizonte em 1973.\nFez também os cursos técnicos em contabilidade e mecanografia.\n\nTransferiu-se para o Mato Grosso em 1976 como integrante da Indeco S.A.,\nempresa encarregada de fundar e colonizar as cidades de Alta Floresta,\nParanaíba e Apiacás, situadas no norte do estado.\n\nNo pleito de novembro de 1982, elegeu-se vereador do município de Alta\nFloresta na legenda do Partido Democrático Social (PDS). Nesse mesmo\nano, tornou-se líder do governo na Câmara municipal. No pleito de\nnovembro de 1986, elegeu-se deputado estadual constituinte já na sua\nnova agremiação, o Partido da Frente Liberal (PFL). Assumiu o mandato em\nmarço de 1987, vindo a ocupar o cargo de terceiro-secretário da mesa.\nIntegrou a Comissão de Constituição e Justiça.\n\nEm outubro de 1990, elegeu-se deputado federal na legenda do PFL,\nassumindo o mandato em fevereiro de 1991, tendo integrado a Comissão de\nDefesa do Consumidor, Meio Ambiente e Minorias. Em 1991, ocupou a\nvice-liderança do bloco do governo na Câmara dos Deputados.\n\nNa sessão da Câmara dos Deputados de 29 de setembro de 1992, ausentou-se\nda votação que instituiu a abertura de processo de *impeachment*contra o\npresidente Fernando Collor, que foi acusado de crime de responsabilidade\npor ligações com um esquema de corrupção liderado pelo ex-tesoureiro de\nsua campanha presidencial, Paulo César Farias. Afastado da presidência\nlogo após a votação na Câmara, renunciou ao mandato em 29 de dezembro de\n1992, pouco antes da conclusão do processo pelo Senado, sendo efetivado\nna presidência da República o vice Itamar Franco, que já vinha exercendo\no cargo, interinamente, desde o dia 2 de outubro.\n\nNo pleito de outubro de 1994, João Teixeira disputou uma vaga para a\nAssembleia Legislativa de Mato Grosso na legenda do Partido Liberal\n(PL), conseguindo apenas uma suplência. Deixou a Câmara dos Deputados em\njaneiro de 1995, ao final da legislatura.\n\nNo pleito municipal de outubro de 1996 disputou uma vaga na Câmara de\nVereadores de Cuiabá, mas não obteve êxito.\n\nCasou-se com Maria Aparecida Silva Santos, com quem teve quatro filhos.\n\n \n\nFONTES: CÂM. DEP. *Deputados brasileiros*(1991-1995); *Globo* (30/9/92);\nINF. Maçao Tadano; TRIB. SUP. ELEIT. *Resultados* (1994).\n\n \n","ref":"FONTES: CÂM. DEP. *Deputados brasileiros*(1991-1995); *Globo* (30/9/92);\nINF. Maçao Tadano; TRIB. SUP. ELEIT. *Resultados* (1994).\n\n \n","dic":"DHBB"}
