{"title":"TEIXEIRA, Pedro","cargoss":["Senador"],"cargos_esp":[0],"datas_ini":[1992],"datas_fim":[1994],"estados":["DF"],"autor":[0],"content":"**TEIXEIRA, Pedro**\n\n\\*jornalista; sen. DF 1992-1994.\n\n \n\n*Pedro Henrique Teixeira* nasceu em 4 de novembro de 1936 em Além\nParaíba (MG).\n\nAdvogado, jornalista e oficial de registro de imóveis, tornou-se chefe\nda sucursal do jornal Correio da Manhã em 1959, passando, no ano\nseguinte, a repórter político deste órgão de imprensa, cargo que\nexerceria até 1963. Ainda em 1960 tornou-se funcionário do Tribunal de\nJustiça, função na qual permaneceu até 1964, quando entrou para o\nTribunal Regional Eleitoral do Distrito Federal. Deixou este tribunal em\n1967, ano em que se tornou oficial de Registro de Protesto de Títulos de\nBrasília.\n\nEntre 1969 e 1971 foi presidente do conselho superior da Associação\nComercial do Distrito Federal. Filiado ao Partido Democrático\nTrabalhista (PDT) em 1988, seria também representante do PDT-DF junto ao\ndiretório nacional entre 1988 e 1992. Ainda em 1988 tornou-se presidente\nda comissão executiva do PDT-DF, cargo que exerceu até 1990. Ao longo de\n1991 exerceu o cargo de secretário-geral do PDT-DF.\n\nOficial de Registro de Imóveis, em 1992 tornou-se diretor jurídico da\nAssociação de Imprensa do Distrito Federal, função na qual permaneceu\naté 1993.\n\nElegeu-se primeiro suplente de Maurício Correia, eleito senador pelo\nDistrito Federal na legenda do Partido Democrático Trabalhista (PDT), no\npleito de novembro de 1986. Exerceu o mandato no Senado de 6 de outubro\nde 1992 a março de 1994, período em que Correia exerceu o cargo de\nministro da Justiça no governo Itamar Franco (1992-1994). No Senado\nFederal foi titular das comissões de Relações Exteriores e Defesa\nNacional, de Assuntos Sociais e de Serviços de Infra-Estrutura.\n\nFaleceu em Brasília no início de janeiro de 1999.\n\n \n\nFONTES: *Jornal do Senado* (11/1/99); SENADO. *Dados biográficos*.\n\n \n","ref":"FONTES: *Jornal do Senado* (11/1/99); SENADO. *Dados biográficos*.\n\n \n","dic":"DHBB"}
