{"title":"TELES, Aírton Mendonça","cargoss":["Deputado federal"],"cargos_esp":[0],"datas_ini":[1955],"datas_fim":[1959],"estados":["SE"],"autor":[0],"content":"**TELES, Aírton Mendonça**\n\n\\*dep. fed. SE 1955-1959.\n\n \n\n*Aírton Mendonça Teles* nasceu em Itabaiana (SE) no dia 7 de outubro de\n1924, filho de Manuel Francisco Teles e de Maria Mendonça Teles.\n\nEstudou no Colégio Tobias Barreto, em Aracaju, de 1934 a 1939, e no\nColégio Marista de Salvador, de 1940 a 1941, ingressando em seguida na\nFaculdade de Medicina da Bahia, pela qual se formou em 1947. Em seguida,\ntrabalhou no Hospital de Cirurgia de Aracaju.\n\nNo pleito de outubro de 1950, elegeu-se deputado à Assembléia\nLegislativa de Sergipe na legenda do Partido Social Democrático (PSD),\nassumindo o mandato em fevereiro de 1951. No pleito seguinte, de outubro\nde 1954, elegeu-se primeiro suplente de deputado federal por Sergipe na\nlegenda da Aliança Social Democrática, coligação entre o PSD, o Partido\nSocialista Brasileiro (PSB) e o Partido Republicano (PR). Deixando a\nAssembléia estadual em janeiro de 1955, assumiu o novo mandato em 22 de\njunho de 1955. Permaneceu na Câmara dos Deputados até o fim da\nlegislatura (31/1/1959).\n\nFaleceu num acidente aéreo no dia 24 de junho de 1960, quando voltava de\nBrasília para o Rio de Janeiro. O avião caiu na baía de Guanabara,\nmomentos antes de aterrissar.\n\nEra casado com Aída do Prado Leite Teles, com quem teve uma filha.\n\n \n\nFONTES: CÂM. DEP. *Deputados*; COUTINHO, A. *Brasil*; INF. Carmem Leite\nTeles Silveira; SOC. BRAS. EXPANSÃO COMERCIAL. *Quem*; TRIB. SUP. ELEIT.\n*Dados* (3).\n\n \n","ref":"FONTES: CÂM. DEP. *Deputados*; COUTINHO, A. *Brasil*; INF. Carmem Leite\nTeles Silveira; SOC. BRAS. EXPANSÃO COMERCIAL. *Quem*; TRIB. SUP. ELEIT.\n*Dados* (3).\n\n \n","dic":"DHBB"}
