{"title":"TEMPORAL, Amauri","cargoss":["Presidente de associação ou confederação de empregados ou empregadores"],"cargos_esp":["ACRJ"],"datas_ini":[1985],"datas_fim":[1989],"estados":[0],"autor":[0],"content":"**TEMPORAL, Amauri**\n\n\\*pres. ACRJ 1985-1989.\n\n \n\n*Amauri Temporal* nasceu em Recife no dia 27 de abril de 1938, filho dos\nempresários Átila Temporal e Maria Alice Temporal.\n\nFez o curso primário no Colégio Ateneu São Luís e o ginasial e o\ncientífico no Colégio Santo Antônio Maria Zaccaria, ambos no Rio de\nJaneiro. Dirigiu sua formação para a área industrial, tendo estagiado na\nTemporal S.A. Indústria de Isolantes Térmicos e Refratários e realizado\ncursos técnicos e estágios na Inglaterra, de 1954 a 1955. Neste último\nmesmo ano, tornou-se sócio-gerente da empresa. Em 1960, fez novo curso\nde especialização no exterior, desta vez nos Estados Unidos. Diretor\nindustrial da Temporal desde 1964, em 1972 cursou o Royal Holloway\nCollege, em Surrey, Inglaterra, na área de refratários. Participou,\nainda, dos ciclos de extensão da Escola Superior de Guerra, entre 1977 e\n1979.\n\nAcumulando diversas funções, de 1979 a 1980 foi membro do Conselho\nFiscal da Companhia de Desenvolvimento Industrial do Estado do Rio de\nJaneiro e, em 1982, tornou-se diretor-presidente da Riopart —\nParticipações e Empreendimentos S.A. à frente da qual permaneceria até\n1992.\n\nEm 1985, foi eleito presidente da Confederação das Associações\nComerciais do Brasil (CACB). Ao ser empossado no cargo, assumiu\nautomaticamente as presidências da Associação Comercial do Rio de\nJaneiro (ACRJ) e da Federação das Associações Comerciais, Industriais e\nAgropastoris do Rio de Janeiro (FACIARJ). Sucedendo a Rui Barreto nas\ntrês entidades, em 1987 foi reeleito para mais dois anos de mandato.\nDeixou assim a presidência da CACB em 1989, tendo conseguido eleger seu\nsucessor, o empresário César Rogério Valente.\n\nNa eleição desse ano, uma reforma nos estatutos da CACB, da ACRJ e da\nFACIARJ determinou que as entidades passassem a eleger separadamente\nseus próprios presidentes. Contrário à decisão, o ex-presidente da CACB,\nRui Barreto, impetrou uma ação na Justiça e conseguiu impedir a posse de\nCésar Valente. Foram mantidas, no entanto, as eleições na ACRJ e na\nFACIARJ. Enquanto a confederação era submetida a uma intervenção\njudicial de três anos, Paulo Protásio foi eleito presidente da ACRJ. Em\nprotesto contra a decisão da Justiça, Valente anunciou a criação da\nConfederação Nacional das Associações Comerciais, da qual tornou-se\npresidente.\n\nDepois de sua gestão à frente da CACB, Amauri Temporal foi indicado\npresidente honorário da Confederação. Além disso, tornou-se membro dos\nconselhos Superior e de Estudos Estratégicos da ACRJ e grande benemérito\nda entidade.\n\nEm fins de abril de 1990, foi preso pela Polícia Federal, juntamente com\nsua mãe, presidente da Temporal, e seu irmão, diretor da empresa.\nMantido em prisão domiciliar, sob a acusação de apropriação indébita e\nsonegação de impostos, Temporal declarou que estava sendo usado como\n“bode expiatório” pelo governo do presidente Fernando Collor de Melo.\nDias depois, no entanto, teve sua prisão e de sua família revogada pelo\nTribunal Regional Federal (TRF).\n\nEm 1995, tornou-se diretor da FTX Consultoria Econômica. Dois anos\ndepois, assumiu o cargo de diretor do Centro Internacional de Negócios\nda Firjan e tornou-se membro do Conselho Consultivo da Câmara de\nComércio Ítalo-Brasileira e do Conselho Superior da Fundação Centro de\nEstudos de Comércio Exterior. Em 1998, foi eleito presidente da Comissão\nde Comércio do Capítulo Brasileiro do Conselho Empresarial\nBrasil-Estados Unidos e, em dezembro do ano seguinte, passou a integrar\no Fórum de Líderes do Mercado Comum do Sul, do Instituto Fórum de\nLíderes Empresariais da Gazeta Mercantil.\n\nAo longo de sua carreira, foi ainda primeiro vice-presidente do Centro\nIndustrial do Rio de Janeiro e *chairman* do Comitê de Negócios da\nBritish Chamber of Commerce in Brazil.\n\nCasou-se com Ana Margareta Temporal, com quem teve dois filhos.**\n\nPublicou *Liberdade sempre* (1989), *De vinhos e rosas*(1992) e *Bom\nTempo na França (2004)*, além de mais de 250 artigos e *papers*.\nProferiu também várias palestras no Brasil e no exterior, sempre\ntratando de temas relacionados ao comércio e à indústria.\n\n \n\n \n\nFONTES: CURRIC. BIOG.;*Estado de S. Paulo* (28/4/90); *Globo*(7/1 e\n14/10/86, 18/9/91); INF. BIOG.; *Jornal do Brasil (*3/4/87, 5 e 15/5/90,\n16/9/91); Estante Virtual.\n\n \n","ref":"FONTES: CURRIC. BIOG.;*Estado de S. Paulo* (28/4/90); *Globo*(7/1 e\n14/10/86, 18/9/91); INF. BIOG.; *Jornal do Brasil (*3/4/87, 5 e 15/5/90,\n16/9/91); Estante Virtual.\n\n \n","dic":"DHBB"}
