{"title":"TERRA, Marcial","cargoss":["Revolucionário ou revoltoso","Revolucionário ou revoltoso","Deputado federal","Deputado federal","Deputado federal"],"cargos_esp":[0,0,0,0,0],"datas_ini":[1930,1932,1966,1963,1960],"datas_fim":[1930,1932,1967,1964,0],"estados":[0,0,"RS","RS","RS"],"autor":[0],"content":"**TERRA, Marcial**\n\n\\*rev. 1930; rev. 1932; dep. fed. RS 1960, 1963-1964 e 1966-1967.\n\n \n\n*Marcial Gonçalves Terra* nasceu em Tupanciretã (RS) no ano de 1889.\n\nProprietário de terras e pecuarista, foi chefe político do município\nonde nasceu, ao lado do coronel José Libindo Viana, entre outros. Foi\nmembro do Partido Republicano Rio-Grandense (PRR) e participou\nativamente da Revolução de 1930, comandando em outubro o movimento\nliberal da região da serra, no Rio Grande do Sul.\n\nParticipou em 1932 da tentativa de criação do exército\nconstitucionalista em seu estado, sendo assessorado por Lindolfo Collor\n— ministro do Trabalho —, sob as ordens de Raul Pilla e de Antônio\nAugusto Borges de Medeiros. Essa tropa era formada por quatrocentos\nhomens, entre os quais João Batista Luzardo e Glicério Alves. Marcial\nTerra comandava a região dos municípios de Santo Ângelo, Santiago do\nBoqueirão e São Luís. Com Lindolfo Collor e outros, participou da\ntentativa de sabotagem da linha férrea de Santa Maria e Tupanciretã.\nCercado em Santiago do Boqueirão, foi derrotado em setembro de 1932,\nabrigando-se em seguida na casa de Viriato Vargas, intermediário em\nvárias rendições de chefes rebeldes.\n\nNas eleições suplementares de janeiro de 1947, Marcial Terra\ncandidatou-se a deputado estadual no Rio Grande do Sul na legenda do\nPartido Social Democrático (PSD), obtendo uma suplência. No mesmo ano\nassumiu uma cadeira na Assembléia Legislativa gaúcha, substituindo o\ntitular Oscar Carneiro da Fontoura. Concluiu seu mandato em janeiro de\n1951. No pleito de outubro de 1958 obteve uma suplência de deputado\nfederal pelo Rio Grande do Sul na legenda do PSD, chegando a assumir o\nmandato durante o mês de junho de 1960. Nas eleições de outubro de 1962,\ncandidatou-se mais uma vez à Câmara dos Deputados, obtendo de novo\napenas uma suplência. Exerceu o mandato de março de 1963 a fevereiro de\n1964 e, com a extinção dos partidos políticos pelo Ato Institicional\nnº 2 (27/10/1965) e a posterior instauração do bipartidarismo, filiou-se\nà Aliança Renovadora Nacional (Arena). Voltou a assumir sua cadeira na\nCâmara de abril a agosto de 1966. Conseguindo novamente uma suplência em\nnovembro desse mesmo ano, onde permaneceu até janeiro de 1967.\n\nFaleceu em sua fazenda, no município de Rio Pardo (RS), no dia 23 de\nabril de 1981.\n\nFoi casado com Otacília Correia Terra, com quem teve 11 filhos.\n\n \n\n \n\nFONTES: Álbum; CÂM. DEP. Deputados; ENTREV. PEIXOTO, A.; Jornal do\nBrasil (24/4/81); SILVA, H. 1930; SILVA, H. 1932; TRIB. SUP. ELEIT.\nDados (1, 4 e 6).\n\n \n","ref":"FONTES: Álbum; CÂM. DEP. Deputados; ENTREV. PEIXOTO, A.; Jornal do\nBrasil (24/4/81); SILVA, H. 1930; SILVA, H. 1932; TRIB. SUP. ELEIT.\nDados (1, 4 e 6).\n\n \n","dic":"DHBB"}
