{"title":"TINOCO, Francisco de Sá","cargoss":["Senador","Deputado federal"],"cargos_esp":[0,"RJ1959"],"datas_ini":[1947,1961],"datas_fim":[1957,1961],"estados":["RJ",0],"autor":[0],"content":"**TINOCO, Francisco de Sá**\n\n\\*sen.****RJ 1947-1957; dep. fed. RJ****1959 e 1961.\n\n \n\n*Francisco de Sá Tinoco* nasceu em Itaperuna (RJ) no dia 11 de outubro\nde 1908, filho de Reinaldo Tinoco Lacerda e de Arminda Tinoco Lacerda.\n\nProprietário rural e comerciante, elegeu-se senador pelo Rio de Janeiro\nna legenda do Partido Social Democrático (PSD) nas eleições\nsuplementares de janeiro de 1947. Iniciando o mandato em março do mesmo\nano, foi membro das comissões de Agricultura, Indústria e Comércio e\nMista de Investigação da Produção Agrícola e Respectivo Financiamento.\nReeleito no pleito de outubro de 1950, novamente na legenda do PSD,\ndeixou o Senado em setembro de 1957, tendo sido substituído por José\nMoreira Bastos Filho.\n\nEm 1958 tornou-se ministro do Tribunal de Contas do Estado do Rio. No\npleito de outubro desse ano candidatou-se à Câmara dos Deputados na\nlegenda da Aliança Popular Nacionalista, formada pelo Partido Democrata\nCristão (PDC), o Partido Trabalhista Brasileiro (PTB), o Partido\nSocialista Brasileiro (PSB) e o Partido Republicano (PR). Tendo obtido a\nterceira suplência, assumiu o mandato de deputado federal nos períodos\nde setembro a novembro de 1959 e de fevereiro a março de 1961.\n\nFoi fundador e presidente da Social Rural e da Cooperativa Agrícola,\nambas de Itaperuna. Foi também diretor da Associação Comercial de\nItaperuna e ministro do Tribunal de Contas do Estado da Guanabara.\n\nFaleceu no dia 12 de julho de 1965.\n\nEra casado com Maria Eglantina Conceição Ferraz Tinoco, com quem teve um\nfilho.\n\n \n\n \n\nFONTES: CÂM. DEP. Deputados brasileiros. Repertório (1946-1967);\nCISNEIROS, A. Parlamentares; Diário do Congresso Nacional; SENADO.\nRelação; TRIB. SUP. ELEIT. Dados (1, 2 e 4).\n\n \n","ref":"FONTES: CÂM. DEP. Deputados brasileiros. Repertório (1946-1967);\nCISNEIROS, A. Parlamentares; Diário do Congresso Nacional; SENADO.\nRelação; TRIB. SUP. ELEIT. Dados (1, 2 e 4).\n\n \n","dic":"DHBB"}
