{"title":"TINOCO, José","cargoss":["Constituinte","Deputado federal"],"cargos_esp":[0,0],"datas_ini":[1987,1987],"datas_fim":[1988,1991],"estados":[0,"PE"],"autor":[0],"content":"**TINOCO, José**\n\n\\*const. 1987-1988; dep. fed. PE 1987-1991.\n\n*José Tinoco Machado de Albuquerque* nasceu em Recife no dia 23 de\ndezembro de 1937, filho de Jorge Feliciano de Albuquerque e Maria Alice\nTinoco M. de Albuquerque.\n\nFormou-se em medicina pela Universidade Federal de Pernambuco (Ufpe), em\n1964. No mesmo ano visitou os Estados Unidos da América, a convite do\nDepartamento de Estado norte-americano. No ano seguinte mudou-se para\nGaranhuns (PE) e tornou-se médico-cirurgião do Instituto Nacional de\nAssistência Médica da Previdência Social (INAMPS) e da Secretaria de\nSaúde do estado de Pernambuco. Em 1967 tornou-se chefe do setor de\nacidentes de trabalho do INAMPS, permanecendo no cargo até 1974. Em 1969\nfundou em Garanhuns a Casa de Saúde e Maternidade Nossa Senhora do\nPerpétuo Socorro. Dois anos depois, formou-se em estudos sociais pela\nfaculdade de filosofia daquela cidade.\n\nEm 1974, ainda em Garanhuns, ocupou a presidência do diretório municipal\nda Aliança Renovadora Nacional (Arena),****partido de sustentação do\nregime militar instalado no país em abril de 1964. Em 1976, tornou-se\nprofessor de medicina legal da Faculdade de Direito de Caruaru,\npermanecendo nesta ocupação por dois anos. Em novembro de 1976,\nelegeu-se vice-prefeito de Garanhuns. Assumiu seu mandato em fevereiro\nseguinte e, no mesmo ano, tornou-se secretário municipal de Saúde, cargo\nque ocuparia até 1979. Em setembro de 1978, candidatou-se a deputado\nestadual em Pernambuco, sendo bem-sucedido.\n\nAssumiu sua cadeira na Assembléia Legislativa de Pernambuco em fevereiro\nde 1979. Em novembro, com a extinção do bipartidarismo e a conseqüente\nreformulação partidária, filiou-se ao Partido Democrático Social (PDS),\nlegenda que sucedeu a Arena em seu apoio ao regime militar. Entre 1979 e\n1982, licenciou-se do mandato de deputado estadual para exercer o cargo\nde secretário do Trabalho e Ação Social do estado de Pernambuco, no\ngoverno de Marcos Maciel.\n\nEm novembro de 1982, reelegeu-se para o seu segundo mandato na\nAssembléia Legislativa pernambucana. Sua votação concentrou-se na região\ndo agreste meridional, especialmente Garanhuns. Assumindo a sua cadeira\nem fevereiro de 1983, tornou-se líder do governo Roberto Magalhães no\nlegislativo estadual, posto em que permaneceu até o ano seguinte. A\npartir de então, ocupou a vice-presidência da Comissão de Finanças e\nOrçamentos. Em 1985, tornou-se presidente da Comissão de Ciência,\nTecnologia e Informática e participou da Comissão de Finanças e\nOrçamento.\n\nNas eleições de novembro de 1986, disputou uma cadeira na Assembléia\nNacional Constituinte, desta vez na legenda do Partido da Frente Liberal\n(PFL). Eleito, assumiu o mandato em fevereiro de 1987. No decorrer dos\ntrabalhos constitucionais, foi membro titular da Subcomissão de\nTributos, Participação e Distribuição das Receitas, da Comissão do\nSistema Tributário, Orçamento e Finanças, e suplente da Comissão de\nSistematização.\n\nNas votações mais significativas da Constituinte, manifestou-se a favor\nda nacionalização do subsolo, da limitação dos juros reais em 12% ao\nano, do direito de voto aos 16 anos, do sistema político\npresidencialista e do mandato de cinco anos para o presidente Sarney.\nVotou contra o acréscimo de 50% na remuneração do trabalho extra, a\njornada semanal de 40 horas, a unicidade sindical, a demissão sem justa\ncausa, o mandado de segurança coletivo, a criação de um fundo de apoio à\nreforma agrária, a desapropriação de terras produtivas, a limitação do\ndireito de propriedade privada, a limitação dos encargos da dívida\nexterna, a anistia aos micro e pequenos empresários, a pena de morte, a\nlegalização do aborto, o rompimento de relações diplomáticas com países\nmantenedores de políticas de discriminação racial, a soberania popular e\na proibição do comércio de sangue.\n\nCom a promulgação da nova carta constitucional, em 5 de outubro de 1988,\nvoltou a participar dos trabalhos legislativos ordinários na Câmara do\nDep.****Concorreu à reeleição em outubro de 1990, mas não foi\nbem-sucedido, alcançando a última suplência entre todos os candidatos do\nPFL naquele pleito. Deixou a Câmara dos Deputados em janeiro de 1991, ao\ntérmino****da legislatura.\n\nContinuou filiado ao PFL, ligado ao grupo do vice-presidente Marco\nMaciel, tendo ocupado cargos na administração pública estadual e\nfederal, sempre ligados à área médica. Assim, foi diretor do Laboratório\nFarmacêutico de Pernambuco, órgão ligado à Secretaria de Saúde de\nPernambuco, representante da Central de Medicamentos (Ceme) e\nsuperintendente do Instituto Nacional de Seguridade Social (INSS) em\nPernambuco. Em 1998, foi chefe de gabinete do ministro da Previdência\nSocial, Waldeck Ornelas.\n\nDesde então, embora filiado ao PFL, passou a se dedicar apenas à\nadministração da casa de saúde de sua propriedade, em Garanhuns.\n\nCasou-se com Fernanda Maria Tinoco Branco de Albuquerque, com quem teve\nquatro filhos.\n\nGustavo Lopes/Cláudia Montalvão\n\nFONTES:****ASSEMB. NAC. CONST. *Repertório*(1987-1988); COELHO, J. &\nOLIVEIRA, A. *Nova*; *Folha de S. Paulo* (19/1/87); INF. BIOG.\n\n \n","ref":"FONTES:****ASSEMB. NAC. CONST. *Repertório*(1987-1988); COELHO, J. &\nOLIVEIRA, A. *Nova*; *Folha de S. Paulo* (19/1/87); INF. BIOG.\n\n \n","dic":"DHBB"}
