{"title":"TINOCO, Luís","cargoss":["Senador"],"cargos_esp":[0],"datas_ini":[1950],"datas_fim":[1955],"estados":["ES"],"autor":[0],"content":"**TINOCO, Luís**\n\n\\*sen. ES 1950-1955.\n\n \n\n*Luís Tinoco da Fonseca* nasceu em Campos (RJ) no dia 20 de outubro de\n1887, filho de Carlos José da Fonseca e de Jesuína Tinoco da Fonseca.\n\nFez o curso secundário no Liceu de Humanidades de Campos e diplomou-se\npela Faculdade de Medicina do Rio de Janeiro em 1912, especializando-se\nem clínica médica.\n\nIniciou a vida política como prefeito de Cachoeiro do Itapemirim (ES).\nEm maio de 1933 elegeu-se segundo suplente de deputado à Assembléia\nNacional Constituinte pelo Espírito Santo, na legenda do Partido da\nLavoura, não tendo exercido o mandato. Em outubro do ano seguinte\nelegeu-se deputado à Assembléia Constituinte do Espírito Santo,\nassumindo o mandato em maio de 1935. Participou dos trabalhos\nconstituintes e, com a promulgação da nova Carta estadual, passou a\nexercer o mandato ordinário. Permaneceu na Assembléia capixaba até o dia\n10 de novembro de 1937, quando o advento do Estado Novo (1937-1945)\nsuprimiu todos os órgãos legislativos do país.\n\nCom a desagregação do Estado Novo e a reconstitucionalização do país,\nelegeu-se no pleito de dezembro de 1945 segundo suplente de deputado à\nAssembléia Nacional Constituinte pelo Espírito Santo, na legenda da\nUnião Democrática Nacional (UDN), não tendo assumido, entretanto, o\nmandato. Nas eleições de janeiro de 1947 elegeu-se suplente do senador\npelo Espírito Santo, Henrique de Novais, na legenda do Partido Social\nDemocrático (PSD). Exerceu o mandato, em****razão do falecimento daquele\nsenador, de abril de 1950 até janeiro de 1955.\n\nLuís Tinoco foi médico-legista da polícia do Espírito Santo e médico de\nhigiene no mesmo estado.\n\nFaleceu no Rio de Janeiro no dia 21 de setembro de 1968.\n\nEra casado com Jacira Vieira da Fonseca, com quem teve oito filhos.\n\nPublicou *Proteínas no líquido céfalo-raquidiano* (tese de formatura).\n\n \n\nFONTES: ASSEMB. NAC. CONST. 1934. *Anais*; CISNEIROS, A.\n*Parlamentares*; *Grande encic. portuguesa*; INF. Luís Carlos Tinoco da\nFonseca; SENADO. *Relação*; SILVA, H. *1935*.\n\n \n","ref":"FONTES: ASSEMB. NAC. CONST. 1934. *Anais*; CISNEIROS, A.\n*Parlamentares*; *Grande encic. portuguesa*; INF. Luís Carlos Tinoco da\nFonseca; SENADO. *Relação*; SILVA, H. *1935*.\n\n \n","dic":"DHBB"}
