{"title":"TOLEDO, Maurício","cargoss":["Deputado federal"],"cargos_esp":[0],"datas_ini":[1971],"datas_fim":[1975],"estados":["SP"],"autor":[0],"content":"**TOLEDO, Maurício**\n\n\\*  dep. fed.  SP 1971-1975.\n\n \n\n*Maurício Leite de Toledo* nasceu em Juiz de Fora (MG) no dia 23 de\njaneiro de 1924, filho de Antônio Eufrásio de Toledo e de Maria do Carmo\nLeite de Toledo.\n\nRadicado no inte­rior de São Paulo, trabalhou como advogado e professor \ne diretor da Faculdade de Direito de Bauru. Iniciou sua carreira\npolíti­ca assumindo uma cadeira de vereador à Câ­mara Municipal de Bauru\n(SP), em 1964. No pleito de novembro de 1966 elegeu-se su­plente de\ndeputado federal pelo estado de São Paulo na legenda da Aliança\nRenovadora Nacional (Arena), não chegando a assumir uma cadeira.  Deixou\na Câmara Municipal de Bauru em 1968.\n\nEm novembro de 1970 foi eleito deputa­do federal pelo estado de São\nPaulo na le­genda da Arena, assumindo sua cadeira em fevereiro do ano\nseguinte.  Nessa legislatura foi membro das comissões de Educação e\nCultura e de Valorização Econômica da Amazônia e suplente das comissões\nde Cons­tituição e Justiça e de Legislação Social.  No pleito de\nnovembro de 1974 elegeu-se 24°. suplente de deputado federal pelo mesmo\nes­tado e legenda, deixando a Câmara dos De­putados em janeiro de 1975. \nEm novembro do ano seguinte candidatou-se a vice-prefeito de Bauru na\nsegunda sublegenda da Arena, mas não foi bem sucedido.\n\n                Abandonando a carreira política, fixou residência em\nAraçatuba (SP), onde passou a lecionar direito constitucional na\nFaculdade de Direito da cidade, pertencente à Instituição Toledo de\nEnsino (ITE), entidade de ensino superior com estabelecimentos também em\nBauru e Presidente Prudente (SP), de propriedade de sua família. Mais\ntarde, tornou-se presidente da ITE e diretor geral das unidades de\nAraçatuba. Maurício Toledo desempenhava essas atividades em fevereiro de\n2000.\n\n                 Foi casado com Maria Inês  Henriques Toledo, com quem\nteve um filho. Viúvo, casou-se pela segunda vez com Rute da Costa\nToledo.\n\n \n\nFONTES: CÂM.  DEP.  *Deputados*;**CÂM. DEP.*  Deputados brasileiros. \nRepertório*(1971-1975); INF. BIOG.; *Jornal do Brasil*(28/6/76); NÉRI,\nS. *16*; *Per­fil* (1972); TRIB.  SUP.  ELEIT.  *Dados*(8 e 9).\n\n \n","ref":"FONTES: CÂM.  DEP.  *Deputados*;**CÂM. DEP.*  Deputados brasileiros. \nRepertório*(1971-1975); INF. BIOG.; *Jornal do Brasil*(28/6/76); NÉRI,\nS. *16*; *Per­fil* (1972); TRIB.  SUP.  ELEIT.  *Dados*(8 e 9).\n\n \n","dic":"DHBB"}
