{"title":"TORRECILA, Otávio","cargoss":["Deputado federal"],"cargos_esp":[0],"datas_ini":[1979],"datas_fim":[1983],"estados":["SP"],"autor":[0],"content":"**TORRECILA, Otávio**\n\n\\*dep. fed. SP 1979-1983.\n\n*Otávio Torrecila* nasceu em Gália (SP) no dia 20 de julho de 1939,\nfilho de Gabriel Torrecila e de Eufêmia Maioral.\n\nEm 1964 tornou-se presidente do Centro Social dos Guardas Civis do\nEstado de São Paulo — seção Marília, cargo que exerceria até 1970. No\npleito de novembro de 1968 foi eleito vereador à Câmara Municipal de\nMarília, pela legenda do Movimento Democrático Brasileiro (MDB), partido\nde oposição ao regime militar instaurado no país em abril de 1964.\nEleito em 1969 presidente da Associação Profissional dos Trabalhadores\nde Segurança e Vigilância do Estado de São Paulo, assumiu o mandato na\nCâmara no início deste ano, participando dos trabalhos legislativos como\nprimeiro-secretário (1970-1971) e vice-presidente (1972). Reeleito no\npleito de novembro de 1972, foi segundo-secretário (1973-1974),\nnovamente primeiro-secretário (1975-1976), líder do MDB e membro das\ncomissões de Finanças e Orçamento e de Obras e Serviços Públicos.\n\nEm 1976 deixou a presidência da Associação Profissional dos\nTrabalhadores de Segurança e Vigilância do Estado de São Paulo e\nbacharelou-se em ciências jurídicas e sociais pela Faculdade de Direito\nde Marília. No pleito de novembro de 1978, candidatou-se a uma cadeira\nna Câmara dos Deputados por São Paulo, pela legenda do MDB. Eleito,\nassumiu o mandato em fevereiro do ano seguinte, participando dos\ntrabalhos legislativos como membro titular da Comissão de Trabalho e\nLegislação Social e suplente das comissões de Segurança Nacional e de\nTransportes. Com o fim do bipartidarismo em novembro de 1979 e a\nconseqüente reformulação partidária, filiou-se ao Partido Democrático\nSocial (PDS). Candidato derrotado a uma cadeira na Assembléia\nLegislativa paulista no pleito de novembro de 1982, deixou a Câmara em\njaneiro do ano seguinte, ao final da legislatura.\n\nNomeado agente regional do Instituto Nacional de Seguridade Social\n(INSS) em Marília em janeiro de 1984, desempenhou essas funções até\ndezembro seguinte.\n\nFiliado ao Partido Trabalhista Brasileiro (PTB) em 1985, em novembro do\nano seguinte disputou uma cadeira de deputado federal constituinte, mas\nnão foi bem-sucedido. Assessor do deputado estadual Joseph Zuza a partir\nde 1994, filiou-se em 1996 ao Partido Republicano Progressista (PRP),\npor cuja legenda candidatou-se, no mês de outubro, a vereador à Câmara\nMunicipal de Marília, mas não logrou se eleger . Em outubro de 1998,\ncandidatou-se a deputado federal pelo PRP, mas novamente não foi\nbem-sucedido.\n\nFez os cursos de criminologia na Sociedade Brasileira de Direito\nCriminal e de direito processual civil na Faculdade de Direito de\nMarília.\n\nCasou-se com Ivete Pessoa Torrecila, com quem teve uma filha.\n\n \n\nFONTES: CÂM. DEP. *Deputados brasileiros. Repertório*(1979-1983); INF.\nIvete Torrecila.\n\n \n","ref":"FONTES: CÂM. DEP. *Deputados brasileiros. Repertório*(1979-1983); INF.\nIvete Torrecila.\n\n \n","dic":"DHBB"}
