{"title":"TORRES, Fernando","cargoss":["Deputado federal"],"cargos_esp":[0],"datas_ini":[1995],"datas_fim":[1999],"estados":["AL"],"autor":[0],"content":"**TORRES, Fernando**\n\n\\*dep. fed. AL 1995-1999.\n\n \n\n*José Fernando Torres* nasceu em Rio Largo (AL) em 17 de janeiro de\n1952, filho de José Fernandes Torres e Iracema Vilar Torres. Seu irmão\nRoberto Torres foi constituinte (1987-1988) e deputado federal por\nAlagoas entre 1987 e 1995.\n\nGraduado em ciências contábeis pela Universidade Federal de Alagoas em\n1975, a partir de 1980 foi representante da Associação dos Fornecedores\nde Cana de Açúcar de Alagoas durante dois anos. Em 1982 filiou-se ao\nPartido do Movimento Democrático Brasileiro (PMDB).\n\nNo ano seguinte foi gerente-geral das Usinas Reunidas Seresta, cargo que\nocupou até 1988. Em 1986, liderou o movimento de criação do município de\nTeotônio Vilela, elegendo-se prefeito do novo município em novembro de\n1988, na legenda do PMDB. Foi empossado no cargo em janeiro do ano\nseguinte. Em 1992, lançou um candidato para sucedê-lo na prefeitura de\nTeotônio Vilela, concorrendo, nessa mesma chapa, a vice-prefeito. Eleito\nem outubro, já filiado ao Partido da Social Democracia Brasileira\n(PSDB), assumiu o cargo em janeiro de 1993, mas foi cassado ainda nesse\nano, por força da Lei das Inelegibilidades, que impedia a reeleição (um\nvice-prefeito pode tornar-se, a qualquer momento, prefeito).\n\nMembro do conselho fiscal do PSDB de Alagoas em 1994, elegeu-se deputado\nfederal no pleito de novembro, assumindo uma cadeira na Câmara dos\nDeputados em fevereiro de 1995.\n\nNas votações das emendas constitucionais propostas pelo governo Fernando\nHenrique Cardoso em 1995, seguiu a orientação do seu partido, votando a\nfavor da quebra do monopólio dos estados na distribuição de gás\ncanalizado, da mudança no conceito de empresa nacional, do fim do\nmonopólio estatal das telecomunicações, da prorrogação do Fundo Social\nde Emergência (FSE), rebatizado de Fundo de Estabilização Fiscal (FEF),\nque permitia que o governo gastasse 20% da arrecadação de impostos sem\nque estas verbas ficassem obrigatoriamente vinculadas aos setores de\nsaúde e educação, da quebra do monopólio das embarcações nacionais na\nnavegação de cabotagem e do fim do monopólio da Petrobras na exploração\nde petróleo.\n\nEm junho de 1996, votou contrariamente à criação da Contribuição\nProvisória sobre Movimentação Financeira (CPMF) — que substituiu o\nImposto Provisório sobre Movimentação Financeira (IPMF) —, imposto de\n0,2% sobre transações bancárias criado como fonte complementar de\nrecursos para a saúde.\n\nEm janeiro/fevereiro de 1997, manifestou-se a favor da emenda da\nreeleição para presidente da República, governadores e prefeitos. Em\nnovembro, Fernando Torres pronunciou-se a favor da quebra da\nestabilidade do servidor público, item da reforma administrativa.\n\nEm novembro de 1998, votou a favor do teto de 1.200 reais para\naposentadorias no setor público e do estabelecimento de idade mínima e\ntempo de contribuição para o setor privado, itens que definiram a\nreforma da previdência. Deixou a Câmara dos Deputados em janeiro de\n1999, não tendo disputado a reeleição no pleito de outubro do ano\nanterior.\n\nCasou-se com Maria Fernanda Quintela Brandão Vilela, filha de Teotônio\nVilela, senador por Alagoas de 1967 a 1983, e irmã de Teotônio Vilela\nFilho que foi constituinte entre 1987-1988, tornando-se senador desde\n1987. Teve com a esposa seis filhos.\n\n \n\nFONTES: CÂM. DEP. *Deputados brasileiros. Repertório*(1995-1999); *Folha\nde S. Paulo* (29/9/98)*.*\n\n \n","ref":"FONTES: CÂM. DEP. *Deputados brasileiros. Repertório*(1995-1999); *Folha\nde S. Paulo* (29/9/98)*.*\n\n \n","dic":"DHBB"}
