{"title":"TORRES, Maurício Dantas","cargoss":["Comandante do I Distrito Naval","comte -em-ch Esquadra"],"cargos_esp":[0,0],"datas_ini":[1967,1968],"datas_fim":[1968,1969],"estados":[0,0],"autor":[0],"content":"**TORRES, Maurício Dantas**\n\n\\*militar; comte. I DN 1967-1968; comte.-em-ch. Esquadra 1968-1969.\n\n* *\n\n*Maurício Dantas Torres* nasceu no Rio de Janeiro, então Distrito\nFederal, no dia 31 de março de 1912.\n\nIniciou sua carreira militar ingressando na Escola Naval e tornando-se\nguarda-marinha em abril de 1928. Foi promovido a segundo-tenente em\noutubro de 1932, a primeiro-tenente em abril de 1934, a capitão-tenente\nem janeiro de 1937, a capitão-de-corveta em dezembro de 1944, a\ncapitão-de-fragata em março de 1952, a capitão-de-mar-e-guerra em\nnovembro de 1957 e a contra-almirante em dezembro de 1964, comandando\nnesse posto a Força de Transportes da Marinha.\n\nPromovido a vice-almirante em setembro de 1966, foi comandante do I\nDistrito Naval, sediado no Rio, a partir de abril de 1967, em\nsubstituição ao vice-almirante Mauro Ballousier. Em agosto de 1968,\npassou esse comando ao vice-almirante José de Carvalho Jordão e assumiu\no cargo de comandante-em-chefe da  Esquadra, em substituição ao\nvice-almirante Mário Cavalcanti de Albuquerque. Ainda em 1968 tornou-se\npresidente do Clube Naval, cargo que ocuparia até 1973. Promovido a\nalmirante-de-esquadra em novembro de 1969, no mês seguinte transmitiu o\ncomando-em-chefe da Esquadra ao vice-almirante José de Carvalho Jordão.\nComo almirante-de-esquadra foi diretor-geral de Navegação da Marinha.\n\nTransferiu-se para a reserva em 1974, ocupando mais tarde a presidência\nda Confederação Brasileira de Vela e Motor e, em 1979, a da Companhia\nAuxiliar de Empresas Elétricas Brasileiras (CAEEB).\n\nNa Escola de Guerra Naval concluiu o curso de comando e estado-maior, o\ncurso preliminar e o curso superior de guerra naval. Concluiu também o\ncurso de tática anti-submarina para comandante e imediato.\n\nFaleceu em Belo Horizonte no dia 24 de abril de 1983.\n\nEra casado com Maria Nazaré do Amaral Torres, com quem teve um filho.\n\n \n\n \n\nFONTES: CORRESP. SERV. DOC. GER. MAR.; Globo (25/4/83); MIN. MAR.\nAlmanaque.\n\n \n","ref":"FONTES: CORRESP. SERV. DOC. GER. MAR.; Globo (25/4/83); MIN. MAR.\nAlmanaque.\n\n \n","dic":"DHBB"}
