{"title":"TORRES, Weimar","cargoss":["Deputado federal"],"cargos_esp":[0],"datas_ini":[1967],"datas_fim":[1969],"estados":["MT"],"autor":[0],"content":"**TORRES, Weimar**\n\n\\*dep. fed. MT 1967-1969.\n\n \n\n*Weimar Gonçalves Torres* nasceu em Ponta Porã (MS), então no estado de\nMato Grosso, no dia 6 de dezembro de 1922, filho de José Rangel Torres e\nde Dionísia Torres.\n\nBacharelou-se em ciências jurídicas e sociais pela Faculdade de Direito\nda Universidade do Brasil em 1947.\n\nJornalista e serventuário da Justiça, ingressou na política elegendo-se\nvereador à Câmara Municipal de Dourados (MS) em outubro de 1950.\nEmpossado em 1951, reelegeu-se vereador em 1954. No pleito de outubro de\n1958 elegeu-se deputado à Assembléia Legislativa de Mato Grosso, na\nlegenda do Partido Social Democrático (PSD). Voltou a eleger-se deputado\nestadual, no pleito de outubro de 1962, novamente na legenda do PSD.\n\nCom a extinção dos partidos políticos pelo Ato Institucional nº 2\n(27/10/1965) e a posterior instauração do bipartidarisino, filiou-se à\nAliança Renovadora Nacional (Arena), em cuja legenda elegeu-se deputado\nfederal pelo Mato Grosso no pleito de novembro de 1966.\n\nWeimar Torres foi fundador do jornal O Progresso.\n\nFaleceu no dia 14 de setembro de 1969, vítima de um desastre de avião,\nnão tendo completado seu mandato na Câmara.\n\nFoi casado com Adiles do Amaral Torres.\n\nTeve publicado postumamente a obra Meus versos.\n\n \n\n \n\nFONTES: CÂM. DEP. Deputados; CÂM. DEP. Deputados brasileiros. Repertório\n(6); MENDONÇA, R. Dic.; TRIB. SUP. ELEIT. Dados (4, 6 e 8).\n\n \n","ref":"FONTES: CÂM. DEP. Deputados; CÂM. DEP. Deputados brasileiros. Repertório\n(6); MENDONÇA, R. Dic.; TRIB. SUP. ELEIT. Dados (4, 6 e 8).\n\n \n","dic":"DHBB"}
