{"title":"TOSTES, João","cargoss":["Deputado federal"],"cargos_esp":[0],"datas_ini":[1935],"datas_fim":[1937],"estados":["MG"],"autor":[0],"content":"**TOSTES, João**\n\n\\*dep. fed. MG 1935-1937.\n\n \n\n*João Resende Tostes* nasceu em Juiz de Fora (MG) no dia 24 de dezembro\nde 1885. Publicação da Câmara dos Deputados e a Revista do Arquivo\nPúblico Mineiro registram-no como José Resende Tostes.\n\nNo pleito de 14 de outubro de 1934 elegeu-se deputado federal na legenda\ndo Partido Progressista de Minas Gerais, exercendo o mandato de 3 de\nmaio de 1935 a 10 de novembro de 1937, quando o advento do Estado Novo\nsuprimiu os órgãos legislativos do país.\n\nFaleceu em 6 de outubro de 1949.\n\n \n\n \n\nFONTES: Boletim Min. Trab. (5/36); CÂM. DEP. Deputados; CONSULT.\nMAGALHÃES, B.; CONSULT. RAMOS, P.; Diário do Congresso Nacional; Rev.\nArq. Públ. Mineiro (12/ 76).\n\n \n","ref":"FONTES: Boletim Min. Trab. (5/36); CÂM. DEP. Deputados; CONSULT.\nMAGALHÃES, B.; CONSULT. RAMOS, P.; Diário do Congresso Nacional; Rev.\nArq. Públ. Mineiro (12/ 76).\n\n \n","dic":"DHBB"}
