{"title":"TOVAR, Jair","cargoss":["Deputado federal","Diretor do Departamento Administrativo do Serviço Público"],"cargos_esp":[0,0],"datas_ini":[1935,1954],"datas_fim":[1937,1955],"estados":["ES",0],"autor":[0],"content":"**TOVAR, Jair**\n\n\\*dep. fed. ES 1935-1937; dir. DASP 1954-1955.\n\n \n\n*Jair Tovar* nasceu em Vitória no dia 5 de maio de 1896, filho de João\nLuís de Albuquerque Tovar e de Julieta Batalha Tovar.\n\nRealizou seus estudos primários no Ateneu Santos Pinto e em seguida\nestudou no Ginásio Espírito-Santense, ambos em Vitória. Em 1917\nbacharelou-se em ciências jurídicas e sociais pela Faculdade Livre de\nDireito do Rio de Janeiro, então Distrito Federal.\n\nIngressou na vida pública como praticante de segunda classe na Diretoria\nGeral dos Correios. Advogado, foi procurador-geral do município de\nVitória, procurador-geral do estado do Espírito Santo, presidente do\nConselho Penitenciário do mesmo estado, procurador-geral da Justiça do\nTrabalho e consultor jurídico do Ministério da Agricultura. A partir de\n1934 integrou o conselho federal da Ordem dos Advogados do Brasil.\nParticipou também da elaboração do anteprojeto da Constituição do\nEspírito Santo em 1934, da elaboração dos projetos das leis orgânicas\ncomplementares, da elaboração do Código de Processo de Trabalho, do\nRepouso Remunerado, da fundação da Companhia de Eletricidade de Manaus,\nda regulamentação do Instituto Nacional de Imigração e Colonização e do\ncumprimento do Acordo de Resgate Franco-Brasileiro.\n\nNo pleito de outubro de 1934 elegeu-se deputado federal pelo Espírito\nSanto, na legenda do Partido Social Democrático (PSD). Assumindo a\ncadeira em maio de 1935, participou dos trabalhos das comissões de\nConstituição e Justiça e de Legislação Social. Nos trabalhos\nparlamentares foi ainda relator-geral do Código do Ar e do Código de\nÁguas, tendo contribuído também na elaboração do Código de Processo.\n\nParticipou do Congresso Nacional de Direito em 1935 e do Congresso de\nDireito Constitucional comemorativo do nascimento de Rui Barbosa. Em\nmaio de 1937 foi delegado das Oposições Coligadas à convenção para\nlançamento da candidatura de José Américo de Almeida. Teve seu mandato\nextinto no dia 10 de novembro de 1937, quando o advento do Estado Novo\nsuprimiu os órgãos legislativos do país.\n\nParticipou do Congresso Jurídico Nacional em 1943. Foi diretor-geral do\nDepartamento de Administração do Serviço Público (DASP) de setembro de\n1954 a novembro de 1955, sucedendo a Arísio de Viana e sendo substituído\npor João Guilheme de Aragão. Procurador da Fazenda Nacional, assumiu\ninterinamente, em março de 1958, a Procuradoria Geral da Fazenda. Foi\nprofessor de direito civil na Faculdade de Direito da Universidade do\nEspírito Santo e de direito constitucional na Universidade do Distrito\nFederal. Lecionou também nas faculdades de Direito da Universidade do\nBrasil e da Pontifícia Universidade Católica do Rio de Janeiro. Foi\ndiretor e redator-chefe do *Correio Capixaba*e colaborou para o *Diário*\n*da Manhã,*no Espírito Santo. Foi também membro da Academia\nEspírito-Santense de Letras, do Instituto Histórico e Geográfico do\nEspírito Santo e do Instituto Brasileiro de Educação e Cultura, junto ao\nMinistério das Relações Exteriores.\n\nFaleceu no Rio de Janeiro no dia 19 de janeiro de 1984.\n\nEra casado com Ester Neves Tovar, com quem teve quatro filhos.\n\nPublicou *No país dos incas*(viagens),*Trigo velho*(crônicas),*Versos\nantigos, Presença* *do advogado, Pareceres administrativos, Direito das\náguas, Vendas de ascendentes e descendentes, Promessa de compra e\nvenda,*além de diversas monografias de assuntos jurídicos, notadamente\nem matérias relativas ao direito das águas.\n\n \n\nFONTES: *Boletim Min. Trab.*(5/36);**CÂM. DEP. *Deputados*;**CONSULT.\nMAGALHÃES, B.;*Diário de Notícias,*Rio (26/5/37); *Diário* *do Congresso\nNacional*;*******Jornal do Brasil*****(20/1/84).\n\n \n\n \n","ref":"FONTES: *Boletim Min. Trab.*(5/36);**CÂM. DEP. *Deputados*;**CONSULT.\nMAGALHÃES, B.;*Diário de Notícias,*Rio (26/5/37); *Diário* *do Congresso\nNacional*;*******Jornal do Brasil*****(20/1/84).\n\n \n\n \n","dic":"DHBB"}
