{"title":"TRAVASSOS, Plínio de Freitas","cargoss":["Procurador-geral da República"],"cargos_esp":[0],"datas_ini":[1949],"datas_fim":[1957],"estados":[0],"autor":[0],"content":"**TRAVASSOS, Plínio de Freitas**\n\n\\*magistrado; proc.-ger. Rep. 1949-1957.\n\n \n\n*Plínio de Freitas Travassos*****nasceu em Niterói, então capital do\nestado do Rio de Janeiro, no dia 1º de agosto de 1893, filho do\nengenheiro Godofredo de Freitas Travassos e de Deodata Coelho Bastos de\nFreiras Travassos.\n\nCursou o primário e o secundário em sua cidade natal, ingressando em\n1909 na Faculdade de Ciências Jurídicas e Sociais do Rio de Janeiro, no\nentão Distrito Federal, onde se formou em 1913.\n\nIniciou suas atividades profissionais como advogado em Niterói.\nTrabalhou como delegado auxiliar da polícia do estado do Rio de Janeiro\nde 1916 a 1921. Neste último ano foi nomeado procurador em Niterói —\nfunção que exerceria até 1939 e no Distrito Federal e designado em\ncomissão para atuar em delicados processos de sedição. Em 1924 tornou-se\nmembro do Conselho Penitenciário do Estado do Rio de Janeiro, condição\nem que se manteria também até 1939.\n\nEm novembro de 1937, após a instauração do Estado Novo e a promulgação,\nainda nesse mês, de uma nova Constituição, foi designado para integrar a\nComissão Revisora instituída em decorrência do parágrafo único do artigo\n18 das “Disposições transitórias” do texto constitucional. Em 1939 foi\nnomeado procurador regional da República no Distrito Federal e membro da\nprimeira Comissão Revisora de Títulos de Terras da Fazenda Nacional.\nDepois de extinto o Estado Novo (29/ 10/1945), passou a integrar, em\n1946, o Conselho de Terras da União. Designado em setembro de 1949,\ndurante o governo do presidente Eurico G. Dutra (1946-1951), para\nsubstituir Luís Gallotti como procurador-geral da República, permaneceu\nno cargo durante as presidências de Getúlio Vargas (1951-1954), João\nCafé Filho (1954-1955), Carlos Luz (1955), Nereu Ramos (1955-1956) e\nJuscelino Kubitschek (1956-1961). Em fevereiro de 1957 deixou\nespontaneamente o cargo, sendo substituído por Carlos Medeiros Silva.\n\nFoi membro da Comissão Permanente do Livro do Mérito, do Instituto dos\nAdvogados Fluminenses e do Instituto dos Advogados do Distrito Federal e\nintegrou o conselho da seção fluminense da Ordem dos Advogados do Brasil\n(OAB).\n\nFaleceu em Brasília, no dia 25 de janeiro de 1962.\n\nCasou-se com Maria Celina da Franca de Freitas Travassos, com quem teve\nquatro filhos.\n\n \n\n \n\nFONTES: CARMO, J. Ministros; CONSULT. MAGALHÃES, B.; CORRESP. PROC. GER.\nREP.; CORTÉS, C. Homens; HIRSCHOWICZ, E. Contemporâneos.\n\n \n","ref":"FONTES: CARMO, J. Ministros; CONSULT. MAGALHÃES, B.; CORRESP. PROC. GER.\nREP.; CORTÉS, C. Homens; HIRSCHOWICZ, E. Contemporâneos.\n\n \n","dic":"DHBB"}
