{"title":"BARROS, Eugênio de","cargoss":["Governador de estado ou do Distrito Federal","Senador"],"cargos_esp":[0,0],"datas_ini":[1951,1959],"datas_fim":[1956,1967],"estados":["MA","MA"],"autor":[0],"content":"**BARROS, Eugênio de**\n\n\\*gov. MA 1951-1956; sen. MA 1959-1967.\n\n* *\n\n*Eugênio de Barros* nasceu em Matões (MA) no dia 13 de novembro de 1898,\nfilho de Balbino de Barros e de Hermelinda de Azevedo Ramos.\n\nEm outubro de 1950, foi eleito governador do Maranhão na legenda do\nPartido Social Trabalhista (PST) — liderado no estado por Vitorino\nFreire — derrotando o até então vice-governador Saturnino Belo. Sua\nvitória, porém, contestada pelas forças adversárias, não foi reconhecida\nde imediato. Devido à disputa que se desencadeou e à morte repentina de\nSaturnino Belo em 16 de janeiro de 1951, o governo do estado foi\nentregue no dia 31 de janeiro pelo governador em fim de mandato,\nSebastião Archer, ao desembargador Traiaú Rodrigues Moreira, presidente\ndo Tribunal de Justiça. Descartada a necessidade de eleições\nsuplementares com a morte de Saturnino Belo, Eugênio de Barros foi\nempossado em fevereiro de 1951. No mês seguinte, entretanto, em\nconseqüência da forte pressão oposicionista que continuou se\ndesenvolvendo, passou o governo ao deputado César Alexandre Aboud, que\nhavia sido eleito, mediante acordo, novo presidente da Assembléia\nLegislativa. O desentendimento político prosseguiu, entretanto,\nmotivando a intervenção do general Edgardino Pinto, comandante da 8ª\nRegião Militar. Superada a questão, Eugênio de Barros reassumiu o\ngoverno maranhense em setembro de 1951, tendo como vice-governador\nRenato Archer, tenente da Marinha e filho do ex-governador Sebastião\nArcher.\n\nApós o pleito de outubro de 1955 para o governo do Maranhão, uma nova\ncrise se instalou diante da reivindicação de vitória eleitoral pelas\nfacções concorrentes. Em janeiro de 1956, não estando ainda concluídas\nas apurações, Eugênio de Barros transmitiu o cargo ao deputado Alderico\nNovais Machado, vice-presidente da Assembléia Legislativa, que renunciou\npouco tempo depois. Foi empossado, então, o deputado Eurico Bartolomeu\nRibeiro, vice-presidente em exercício daquela casa.\n\nNas eleições de outubro de 1958, Eugênio de Barros elegeu-se senador,\ndessa vez na legenda do Partido Social Democrático (PSD). Foi presidente\ndo diretório regional do PSD do Maranhão e membro do diretório nacional\ndo partido. Com a extinção dos partidos políticos pelo Ato Institucional\nnº 2 (27/10/1965) e a posterior instauração do bipartidarismo, filiou-se\nà Aliança Renovadora Nacional (Arena), agremiação situacionista.\n\nEm novembro de 1966, foi novamente candidato ao Senado, dividindo a\nlegenda com seu companheiro de partido Clodomir Millet, que acabou\nvitorioso. Eugênio de Barros exerceu o mandato até o final da\nlegislatura, em janeiro de 1967.\n\nAlém da política, dedicou-se à indústria.\n\nFoi casado com Rosalina Pinto de Barros.\n\n \n\nFONTES: *Encic. Mirador; Grande encic. Delta;*HIPÓLITO, L. *Campanha;\nJornal do Brasil* (16/10/66); MAGALHÃES, B. *Artur;*SENADO*.\nDados;*SENADO*. Relação.*\n\n \n","ref":"FONTES: *Encic. Mirador; Grande encic. Delta;*HIPÓLITO, L. *Campanha;\nJornal do Brasil* (16/10/66); MAGALHÃES, B. *Artur;*SENADO*.\nDados;*SENADO*. Relação.*\n\n \n","dic":"DHBB"}
