{"title":"VALANDRO, Serafim","cargoss":["Presidente de associação ou confederação de empregados ou empregadores"],"cargos_esp":["ACRJ"],"datas_ini":[1930],"datas_fim":[1933],"estados":[0],"autor":[0],"content":"**VALANDRO, Serafim**\n\n\\*pres. ACRJ 1930-1933.\n\n \n\n*Serafim Valandro* nasceu em Santa Maria da Boca do Monte, hoje Santa\nMaria (RS), no dia 1º de outubro de 1883.\n\nAté 1909 residiu em sua cidade natal, dedicando-se ao comércio, ao\njornalismo e à política, tendo sido membro destacado do Partido\nFederalista. Essa agremiação, que se opunha, no âmbito estadual, ao\nPartido Republicano Rio-Grandense (PRR), veio a dissolver-se em 1928, e\nseus membros se incorporaram ao Partido Libertador, criado nesse ano.\n\nEm 1909, Serafim Valandro mudou-se para o Rio de Janeiro, então Distrito\nFederal. Aí ligou-se ao comércio de charque e de cereais, tendo fundado\num estabelecimento comercial com seu nome. Em 1922, foi designado\nrepresentante da Associação Comercial de Santa Maria junto à Federação\ndas Associações Comerciais do Brasil (FACB). A princípio exerceu o\nmandato interinamente, em substituição a Mário Petrucci. Efetivado mais\ntarde, foi indicado também como representante de Cachoeira do Sul (RS).\n\nSegundo o Jornal do Comércio, embora atuasse discretamente, toda vez que\nse discutia na federação qualquer proposta de louvor a atos políticos\ndos governantes, Serafim Valandro pedia que constasse da ata o seu voto\ncontrário. Em 1929, foi eleito diretor da Associação Comercial do Rio de\nJaneiro (ACRJ), durante a gestão de Ernesto Pereira Carneiro.\n\nIdentificada com a situação deposta pela Revolução de 1930, a diretoria\nda ACRJ entrou em crise e quase todos os seus membros renunciaram aos\ncargos. Serafim Valandro, considerado “correligionário histórico” dos\nprincipais líderes gaúchos do movimento vitorioso, foi então escolhido\npara compor a junta governativa da associação. Sua atuação nesse posto\nconduziu-o, ainda em 1930, à presidência da ACRJ e da FACB.\n\nNo exercício desses cargos, combateu o tabelamento de gêneros\nalimentícios e resolveu numerosos casos tributários, visando a\nharmonizar o interesse do fisco e o dos contribuintes. Também solucionou\nquestões orçamentárias, de férias e de sindicalização.\n\nEm fins de 1931, Serafim Valandro, na qualidade de presidente da FACB e\nda ACRJ, e João Daudt d’Oliveira, diretor dessa associação, lançaram a\nidéia de criar um partido político que reunisse todo o empresariado. Por\nocasião da Revolução Constitucionalista de 1932, desenvolveu intensa\natividade em favor da cessação do conflito armado, mobilizando para\ntanto associações comerciais, industriais, agrícolas e culturais. Em\nnovembro de 1932, com ampla participação de várias associações\nindustriais, viria a ser fundado o Partido Economista do Brasil, do qual\nValandro e João Daudt se tornaram presidentes.\n\nEm 1933, segundo o Jornal do Comércio, não permitiu a apresentação de\nsua candidatura à Assembléia Nacional Constituinte pelo Partido\nEconomista do Distrito Federal, embora fosse presidente de sua comissão\nexecutiva. Afirmou nessa oportunidade que não desempenharia mandatos\npolíticos, pois não desejava exercer atividade fora do âmbito de sua\nclasse. No entanto, eliminada a possibilidade de Valandro ser candidato\npartidário, os delegados do comércio elegeram-no à sua revelia, pois não\nera delegado-eleitor — representante profissional de sua categoria à\nConstituinte, com votação expressiva.\n\nSerafim Valandro, contudo, não chegou a tomar posse de seu mandato de\ndeputado: em 21 de setembro de 1933, faleceu no Rio de Janeiro, vítima\nde um aneurisma.\n\nFoi membro do Conselho Superior da Sociedade Nacional de Agricultura, do\nConselho Consultivo da Cidade do Rio de Janeiro e do Conselho de\nContribuintes. Quando faleceu, acumulava a presidência da ACRJ e da FACB\ncom a do conselho fiscal do Banco do Brasil. Era, ainda, membro do\nconselho de emissão do mesmo banco.\n\nEra casado com Corina Portinho Valandro, com quem teve três filhas.\n\nSônia Dias\n\n \n\n \n\nFONTES: ARQ. GETÚLIO VARGAS; ASSEMB. NAC. CONST. 1934. Anais (1);\nBARROS, E. Associação; CONSULT. MAGALHÃES, B.; ENTREV. PEIXOTO, A.;\nGODINHO, V. Constituintes; Jornal do Comércio, Rio (22/9/33).\n\n \n","ref":"FONTES: ARQ. GETÚLIO VARGAS; ASSEMB. NAC. CONST. 1934. Anais (1);\nBARROS, E. Associação; CONSULT. MAGALHÃES, B.; ENTREV. PEIXOTO, A.;\nGODINHO, V. Constituintes; Jornal do Comércio, Rio (22/9/33).\n\n \n","dic":"DHBB"}
