{"title":"VALOIS, Aurino","cargoss":["Deputado federal"],"cargos_esp":[0],"datas_ini":[1959],"datas_fim":[1971],"estados":["PE"],"autor":[0],"content":"**VALOIS, Aurino**\n\n\\*dep. fed. PE 1959-1971.\n\n \n\n*Aurino do Nascimento Valois* nasceu em Vitória de Santo Antão (PE) no\ndia 12 de junho de 1918, filho de Eurico do Nascimento Valois e de\nCorina Gibson Valois.\n\nBacharelou-se pela Faculdade de Direito de Recife em 1945. Professor,\nescrevente e tabelião público no 2º Tabelionato de Notas e Protestos em\nsua cidade natal, foi eleito deputado à Assembléia Legislativa\npernambucana no pleito de outubro de 1950, na legenda do Partido\nTrabalhista Brasileiro (PTB). Nas eleições de outubro de 1954 obteve uma\nsuplência de deputado estadual, mas, convocado, exerceu o mandato desde\no início da legislatura, em fevereiro de 1955, exercendo a função de\nprimeiro-secretário da mesa diretora.\n\nNo pleito de outubro de 1958 foi eleito deputado federal por Pernambuco\nna legenda do PTB, assumindo sua cadeira em fevereiro de 1959, tão logo\nfindou seu mandato no Legislativo estadual. Reeleito nas eleições de\noutubro de 1962, com a extinção dos partidos políticos pelo Ato\nInstitucional nº 2 (27/10/1965) e a posterior instauração do\nbipartidarismo, filiou-se à Aliança Renovadora Nacional (Arena), partido\nde sustentação do regime militar instalado no país em abril de 1964.\nNessa legenda foi novamente eleito no pleito de novembro de 1966,\ntornando-se líder da bancada estadual de seu partido e presidente da\nComissão Parlamentar de Inquérito (CPI) sobre a febre aftosa no Brasil.\nRequereu também a instalação de uma CPI para estudar os problemas da\nlavoura cafeeira e foi o inspirador da lei que dava nova estrutura ao\nInstituto do Açúcar e do Álcool. Pioneiro em Pernambuco de um processo\nde reforma agrária que beneficiasse os pequenos agricultores, defendeu\nainda em sua vida pública os postulados da Igreja Protestante no Brasil\ne de suas organizações sociais.\n\nObtendo apenas uma suplência no pleito de novembro de 1970, deixou a\nCâmara ao final de seu mandato em janeiro de 1971. Ainda nesse ano,\ntornou-se assessor político do escritório de Pernambuco em Brasília, por\nnomeação do então governador do estado, Eraldo Gueiros. Em 1975, passou\na integrar a diretoria da Companhia Vale do Rio Doce, cargo que ocupou\naté morrer.\n\nFaleceu em Brasília no dia 2 de abril de 1989.\n\nEra casado com Natália de Andrade Valois, com quem teve quatro filhos.\n\n \n\nFONTES: CÂM. DEP. *Deputados*; CÂM. DEP. *Deputados brasileiros.\nRepertório* (1963-1967 e 1967-1971); INF. João Domingos Valois de Moura;\nTRIB. SUP. ELEIT. *Dados* (4).\n\n \n","ref":"FONTES: CÂM. DEP. *Deputados*; CÂM. DEP. *Deputados brasileiros.\nRepertório* (1963-1967 e 1967-1971); INF. João Domingos Valois de Moura;\nTRIB. SUP. ELEIT. *Dados* (4).\n\n \n","dic":"DHBB"}
