{"title":"VÁLTER, Valdir ==============","cargoss":["Deputado federal"],"cargos_esp":[0],"datas_ini":[1979],"datas_fim":[1983],"estados":["RS"],"autor":[0],"content":"VÁLTER, Valdir\n==============\n\n\\*dep. fed. RS 1979-1983.\n\n \n\n*Váldir Válter* nasceu em Santa Maria (RS), no dia 24 de setembro de\n1933, filho de José Casimiro Válter e de Albina Luísa Válter.\n\nCursou o primário no Grupo Escolar 22 de Março, em Santo Ângelo (RS), e\no secundário no Ginásio Comercial Soares de Barros, em Ijuí (RS).\nDiplomou-se em contabilidade no Colégio Comercial Soares de Barros,\nnesse mesmo município.\n\nIniciou a vida política em Santo Augusto (RS), elegendo-se vereador \npelo Partido Trabalhista Brasileiro (PTB) em 1958. Licenciado durante\ntoda a legislatura, exerceu a Secretaria de Obras. Reelegeu-se em\nnovembro de 1963.\n\nEm 1964 tornou-se funcionário do Instituto Brasileiro de Geografia e\nEstatística (IBGE), em Ijuí, onde também atuava como repórter esportivo,\nredator e locutor da Rádio Progresso. \n\nEm novembro de 1968 elegeu-se prefeito de Santo Augusto pela legenda do\nMovimento Democrático Brasileiro (MDB), partido de oposição ao regime\nmilitar instaurado no país desde abril de 1964. Deputado estadual eleito\nem novembro do ano seguinte, renunciou à Prefeitura, assumindo uma\ncadeira na Assembléia Legislativa gaúcha em fevereiro de 1971.\n\nEm novembro de 1974 foi reeleito deputado estadual e em novembro de 1978\nconquistou um mandato de deputado federal. Titular da Comissão de\nRelações Exteriores e suplente das comissões de Trabalho e Legislação\nSocial e de Constituição e Justiça, com o fim do bipartidarismo em 29 de\nnovembro de 1979, e a  conseqüente reformulação partidária ingressou no\nPartido do Movimento Democrático Brasileiro (PMDB), sucessor do MDB.\n\nEm 31 de março de 1981 discursou em plenário, criticando as comemorações\noficiais do aniversário do regime militar, programadas pelo governo João\nBatista Figueiredo. Em abril voltou à tribuna, protestando contra a\nsupressão de seu pronunciamento no *Diário do Congresso Nacional*.\n\nCriticou mais uma vez o regime em março de 1982, afirmando que os\ncandidatos apoiados pelo governo federal obtinham favores e vantagens da\nmáquina administrativa. “Todo o regime de arbítrio quando se aproxima do\nfim perde totalmente a compostura”, disse ele. Apontando a TV Nacional\nde Brasília como favorecedora dos candidatos oficiais, especialmente o\nministro Jair Soares, da Previdência Social, que postulava o governo do\nRio Grande do Sul, declarou que o próprio presidente Figueiredo\nincentivava essa prática.\n\nCandidato à reeleição em novembro de 1982, foi malsucedido, deixando a\nCâmara Federal ao término da legislatura, em janeiro de 1983.\n\nDiretor-geral da Assembléia Legislativa do Rio Grande do Sul\n(1983-1984), depois procurador-geral (1985-1987),****exerceu as\nsecretarias de Justiça e de Segurança Pública do  Rio Grande do Sul, no\ngoverno Pedro Simon (1987-1990). Com a desincompatibilização de Simon,\npara disputar uma vaga no Senado Federal, e a posse do vice-governador\nSinval Guazzelli (1990-1991), Valdir Válter assumiu a secretaria de\nTransportes.\n\nBacharel em ciências jurídicas e sociais pela Universidade Federal do\nRio Grande do Sul, depois de afastar-se da vida pública exerceu a\nadvocacia em Porto Alegre.\n\n Viúvo de Maria Elisabete Válter, teve com ela três filhos.\n\n \n\nFONTES: CÂM. DEP. *Deputados brasileiros. Repertório* (1979-1983);\n*Folha de São Paulo* (24/4/81 e 30/3/82); INF. BIOG.\n","ref":"FONTES: CÂM. DEP. *Deputados brasileiros. Repertório* (1979-1983);\n*Folha de São Paulo* (24/4/81 e 30/3/82); INF. BIOG.\n","dic":"DHBB"}
