{"title":"VALVERDE, Miguel","cargoss":["Arcebispo"],"cargos_esp":["Olinda e Recife"],"datas_ini":[1922],"datas_fim":[1951],"estados":[0],"autor":[0],"content":"**VALVERDE, Miguel**\n\n\\*religioso; arceb. Olinda e Recife 1922-1951.\n\n* *\n\n*Miguel de Lima Valverde* nasceu em Santo Amaro (BA) no dia 29 de\nsetembro de 1872, filho de Antônio Severiano de Lima Valverde e de\nHermelinda Carolina de Lima Valverde.\n\nEm 5 de fevereiro de 1885 entrou para o Seminário da Bahia, onde\nconcluiu os preparatórios e estudou filosofia e teologia. Em 1890,\nrecebeu sua primeira tonsura e, em 1892, as ordens menores. Subdiácono\nem 1893, passou a diácono no ano seguinte, e, em 1895, foi ordenado\npadre (presbítero).\n\nEm abril de 1896, foi nomeado capelão do asilo Conde Pereira Marinho, da\ncongregação das irmãs dorotéias. No ano seguinte, viria a ser designado\nconfessor da mesma ordem. Mais tarde promovido a cônego da Sé (Catedral\nde Salvador), tornou-se vigário-geral da Arquidiocese Primaz em\nfevereiro de 1908.\n\nEscolhido pela Santa Sé para a diocese de Santa Maria da Boca do Monte,\nhoje Santa Maria (RS), dom Miguel foi sagrado bispo em outubro de 1911 e\nempossado no dia 7 de janeiro de 1912. Durante seu episcopado gaúcho,\nescreveu algumas cartas pastorais, numa das quais lançou o movimento que\nresultou na criação do Seminário Diocesano (Seminário Menor de Santa\nMaria), por ele fundado em 1914 e considerado sua principal obra na\ndiocese, em virtude da escassez do clero. Também instituiu 14 paróquias\ne três curatos.\n\nEm 14 de fevereiro de 1922, pela bula Hodie Nos, o papa Pio XI nomeou-o\npara a arquidiocese de Olinda e Recife, a qual, desde 1921, vinha sendo\ngovernada pelo deão Pereira Alves, como vigário capitular, em virtude da\ntransferência de dom Sebastião Leme para a cidade do Rio de Janeiro. Dom\nMiguel tomou posse do novo cargo no dia 23 de julho de 1922.\n\n \n\nAção pastoral\n\nLogo de início, empenhou-se na criação de uma imprensa católica,\nacentuando sua importância em pastoral de março de 1923 e instituindo o\n“dia pró-Tribuna”, a fim de transformar o hebdomadário A Tribuna em um\njornal diário. A necessidade de estimular uma imprensa religiosa que,\nsegundo suas palavras, “defendesse e propagasse os princípios\ncatólicos”, foi consubstanciada através da criação da Associação da Boa\nImprensa, sociedade civil entregue a leigos e instalada ainda em 1923, e\nda fundação, em 1925, do Boletim Mensal, órgão oficial da arquidiocese,\nem substituição a O Mês do Clero.\n\nQuanto ao descanso dominical, um de seus temas preferidos, em maio de\n1924, quando não havia qualquer legislação sobre o assunto, dom Miguel\nassinou um acordo com representantes da classe comercial para o\nfechamento do comércio nos domingos e dias santos. Mais tarde (1931), os\nempregados desse setor fizeram ao arcebispo uma grande manifestação pelo\nbenefício que lhes prestara.\n\nEm 1926, inaugurou a escola e as oficinas do padre Machado, no bairro do\nBrum, em Recife, e, em junho de 1927, criou em cada paróquia conselhos\nde fábrica, constituídos por leigos encarregados da administração dos\nbens e do patrimônio.\n\nA ação pastoral de dom Miguel deu especial ênfase à disseminação da\ndoutrina religiosa, apoiando particularmente a criação de núcleos de\njovens e estimulando a organização de Ação Católica na arquidiocese.\nTendo manifestado, em 1928, seu desejo de dispor de um padre “versado em\nsociologia” para colocar à frente da obra em que se empenhava, veio a\nimplantar depois os círculos operários, entregues aos cuidados do padre\nCosta Carvalho. Em 1929, promoveu assembléias gerais da Confederação das\nAssociações Católicas e da Obra das Vocações Sacerdotais, além de ter\nrealizado a sessão preparatória da União dos Operários Católicos.\n\nA Juventude Católica Feminina de Pernambuco, criada em dezembro de 1932,\nfoi a primeira entidade brasileira nos moldes da Ação Católica Italiana\nque, mais tarde, Pio XI universalizou. Em 1933, dom Miguel reorganizou a\nConfederação das Associações Católicas e, em julho de 1934, mandou\nfundar associações missionárias. Em circular de novembro de 1935,\nreferiu-se à criação de associações de Ação Católica nas paróquias.\nEstas associações foram fundadas e iniciaram seus cursos em março do ano\nseguinte. Em abril de 1937, instalou as juntas dos diversos ramos da\nAção Católica, a qual já funcionava amplamente na arquidiocese de Olinda\ne Recife quando foi oficializada em todo o país (1936). De janeiro a\nmarço de 1938, o padre Leopoldo Brentano, fundador dos Círculos\nOperários no Rio Grande do Sul, permaneceu na capital pernambucana. Mais\ntarde (1947), dom Miguel viria a criar a União Missionária do Clero.\n\nEm relação à catequese, desde 1924 dom Miguel adotou sucessivas\nprovidências. Nesse ano, uniformizou o texto do catecismo paroquial e o\ndo ministrado pelos colégios católicos. Mais tarde, deu permissão para\nque o ensino religioso se desse também nas escolas públicas. Em julho de\n1934, iniciaram-se as aulas de religião na Escola Normal. Em 1936, dom\nMiguel baixou uma circular com instruções****sobre o ensino religioso\nnas escolas.\n\nTambém nesse período, iniciou-se o Curso Anchieta para catequistas, a\ncargo da Cruzada das Educadoras Católicas e, em outubro de 1937,\nrealizou-se a****Semana Pedagógica da Cruzada das Educadoras Católicas,\ncom a finalidade de preparar o II Congresso Católico de Educação. Em\nnovembro do mesmo ano, dom Miguel criou o Departamento Catequético\nArquidiocesano. Em outubro de 1943, realizou-se em Recife o Tríduo\nCatequético. Em maio de 1946, dom Miguel regulamentou o ensino religioso\nnas escolas e, finalmente, em 1950, lançou na arquidiocese uma “maratona\ncatequética”.\n\nAo longo de mais de 20 anos, dom Miguel realizou grande número de obras\nde construção para a arquidiocese. Em 1929, promoveu a reforma e\nrestauração, concluída em 1934, da igreja Madre de Deus. Em 1930,\ninaugurou o Lar Sacerdotal e, em setembro de 1934, o prédio da Pequena\nCruzada, na estrada de Água Fria. Em 1936, sagrou a nova matriz da\nparóquia de Belém e, em maio de 1938, inaugurou a matriz do Arraial. Em\n1941, reinaugurou a igreja das Fronteiras. Em novembro de 1944, nomeou\numa comissão para a restauração do convento de Santo Amaro, em\nSerinhaém, e, em 1950, instituiu outra comissão para a construção, em\nCamaragibe, de um mosteiro para as carmelitas que, desde 1925, residiam\nno Recife.\n\nDurante seu arcebispado, dom Miguel efetuou várias viagens, ora em\nvisitas pastorais às paróquias a ele subordinadas, ora a Roma, em\nvisitas ad limina, comuns ao seu cargo. Também participou de congressos\ne reuniões eclesiásticas, não só em Recife, mas ainda em outras cidades\ndo Brasil e do exterior. Assim, em agosto de 1934, viajou para o\nCongresso Eucarístico de Buenos Aires. Em 1939, foi ao Rio de Janeiro\npara tratar do Congresso Eucarístico Nacional, que, presidido por ele,\nveio a realizar-se no Recife, de 1º a 8 de setembro do mesmo ano. Anos\nmais tarde, em 1945, presidiu o Congresso Eucarístico de Maceió.\n\n \n\nPronunciamentos políticos\n\nAlém das atividades especificamente religiosas desenvolvidas por dom\nMiguel, algumas considerações de teor político foram incluídas em várias\nde suas exortações quaresmais. O arcebispo, inclusive, emprestou seu\napoio a organizações diretamente ligadas à política nacional.\n\nDurante a Revolução de 1930 ordenou, em 19 de outubro, “orações pela paz\nno Brasil”. No dia 25 do mesmo****mês, publicou um comunicado sobre a\npaz, tendo também associado sua Igreja aos “júbilos” pelo término da\nRevolução de 1930.\n\nNa exortação quaresmal de 18 de fevereiro de 1931, pediu aos fiéis que\nobedecessem às leis e que, na família, na Igreja ou no Estado,\nrespeitassem a autoridade. Esta, segundo disse, é sagrada, já que foi\natribuída por Deus aos homens. “Suprima-se da sociedade o poder que a\nrege e logo teremos a desordem, a anarquia, o caos”, afirmou então dom\nMiguel. Para o arcebispo, os homens só não teriam de obedecer à\nautoridade quando lhes fosse exigida alguma coisa que, abertamente,\n“repugnasse ao direito natural ou divino, porque é igualmente vedado\npraticar tudo o que violar a lei natural ou a vontade de Deus”.\n\nPor ocasião da Revolução de 1932, dom Miguel ordenou, em 23 de julho\ndesse ano, orações “pela paz no Brasil”. Em novembro de 1933, pediu que\nse rezasse “pela Assembléia Constituinte Nacional”. Através da Liga\nEleitoral Católica pernambucana, procurou influir na eleição de\nrepresentantes à Constituinte.\n\nEm exortação quaresmal de 1936, referiu-se ao “levante comunista de\nnovembro” do ano anterior, o qual, em sua opinião, “por um triz não\nsubverteu a ordem em todo o país, fazendo-nos retrogradar de quatro\nséculos de civilização cristã”. Dom Miguel afirmou, ainda, que o\nsocialismo “é essencialmente anticristão” e que o comunismo é “a revolta\ndos instintos contra a razão, do homem contra Deus”. Na mesma exortação,\no arcebispo disse ter incentivado a organização da Ação Católica na\narquidiocese para sanar a “crise das consciências” e conseguir\ntransformar o meio social “paganizado”.\n\nNa quaresma de 1942, dom Miguel advertiu contra o espiritismo e os\n“perigos” das seitas protestantes, ao mesmo tempo em que, associando-se\nàs preocupações com a Segunda Guerra Mundial, dispensou os fiéis do\njejum e da abstinência. Em junho, antes mesmo da Pastoral Coletiva do\nEpiscopado Nacional, reservou à guerra um capítulo — “Deus e a Pátria” —\ndas resoluções dos bispos de sua província eclesiástica. Além disso,\napoiou as atividades da Legião Brasileira de Assistência e da\nOrganização de Defesa Civil. Em outubro, interessou o clero e os fiéis\nna campanha de fomento agrícola, a que prestou significativo apoio.\n\nEm maio de 1944, dom Miguel reiterou a ordem de orações pela paz e, no\ndia 25 de janeiro de 1946, aprovou a reorganização da Liga Eleitoral\nCatólica, que reiniciou suas atividades depois do Estado Novo. Na\nexortação quaresmal desse ano, voltou a invectivar contra o comunismo:\n“Numa campanha astuta e insidiosa propala-se..., entre o nosso povo\nsimples e sem cultura suficiente para discernir a serpente que se oculta\npor baixo da folhagem verdosa,... que o comunismo nada tem contra a\nreligião e tão-somente procura melhorar, em futuro próximo, as precárias\ncondições de vida do nosso povo pobre e sofredor. As promessas são\nsedutoras... Urge... [que] se desfaça a ilusão que está fascinando a\nmuita gente.... Com um tal sistema haverá mais lugar para a vida\nreligiosa e cristã?”\n\nDom Miguel retomou o assunto em suas mensagens anuais de 1947 e 1949,\nnuma das quais afirmou que, se conseguisse dominar o mundo, o comunismo\nacabaria com a riqueza pessoal: “Todos ficariam pobres. Abastados seriam\nsomente os funcionários do Estado, dono e possuidor de todos os bens.\nOra, ser pobre e livre é bem melhor do que ser escravo. A pobreza nunca\nfoi um opróbrio.”\n\nEm 1950, teve sua última reunião com a Ação Católica, numa assembléia de\ntoda a Juventude Operária Católica Arquidiocesana. Em fevereiro de 1951,\nfez sua derradeira exortação quaresmal.\n\nFaleceu no dia 7 de maio de 1951.\n\nAo longo de seus 29 anos de episcopado pernambucano, dom Miguel criou 19\nparóquias, instalou o Seminário de Pau d’Alho e promoveu a instalação da\ndiocese do Caruaru, que havia sido criada pelo papa Pio XII em agosto de\n1948.\n\nDom Miguel Valverde escreveu quatro cartas pastorais e várias exortações\nquaresmais. Em 1972, no centenário de seu nascimento, a Sociedade\nCultural Paulo VI, de Recife, organizou e editou a obra Dom Miguel de\nLima Valverde — in memoriam.\n\nSônia Dias\n\n \n\n \n\nFONTES: CONFERÊNCIA NAC. BISPOS DO BRASIL; GARDEL, L. Armoiries; Jornal\ndo Comércio, Rio (7/5/51); SOC. CULT. PAULO VI. Dom Miguel.\n\n \n","ref":"FONTES: CONFERÊNCIA NAC. BISPOS DO BRASIL; GARDEL, L. Armoiries; Jornal\ndo Comércio, Rio (7/5/51); SOC. CULT. PAULO VI. Dom Miguel.\n\n \n","dic":"DHBB"}
