{"title":"VASCONCELOS, Aluísio","cargoss":["Constituinte","Deputado federal","Presidente de associação ou confederação de empregados ou empregadores"],"cargos_esp":[0,0,"Eletrobrás"],"datas_ini":[1987,1987,2005],"datas_fim":[1988,1995,2007],"estados":[0,"MG",0],"autor":[0],"content":"**VASCONCELOS, Aluísio**\n\n\\*const. 1987-1988; dep. fed. MG 1987-1995; pres. Eletrobrás 2005-2007.\n\n*Aluísio Marcos Vasconcelos Novais* nasceu em Ponte Nova (MG) no dia 5\nde dezembro de 1942, filho do agrônomo Catulino Novais e de Irene\nVasconcelos Novais. Seus tios, Geraldo Vasconcelos e Fábio Vasconcelos\nforam, respectivamente, deputado federal (1959-1963) e deputado estadual\n(1967-1983), e seu irmão, Ronaldo Vasconcelos Novais, foi vereador em\nBelo Horizonte (1983-1987), deputado estadual (1987-1999) e deputado\nfederal (1999-2006).\n\nEm 1960, concluiu seus estudos secundários no Colégio Santo Antônio em\nBelo Horizonte e no ano seguinte iniciou o curso de engenharia, com\nespecialidade nas áreas mecânica e elétrica, na Universidade de Minas\nGerais, atual Universidade Federal de Minas Gerais (UFMG), concluindo-o\nem 1965. Ainda estudante, ingressou no Partido Social Democrático (PSD),\nem que permaneceu até o advento do bipartidarismo decorrente do Ato\nInstitucional nº 2 (AI-2) de 27 de outubro de 1965. Então, filiou-se ao\nMovimento Democrático Brasileiro (MDB), partido de oposição ao regime\nmilitar instaurado no país em abril de 1964.\n\nEm 1965, ingressou na Centrais Elétricas de Minas Gerais (Cemig), atual\nCompanhia Energética de Minas Gerais (Cemig). Completou sua formação na\nUniversidade de Pádua, Itália, e em Charleston, Estados Unidos. Deixou a\nCemig em 1971 para trabalhar na Brown Boveri Company, tornando-se\ngerente regional da empresa em Minas Gerais. A par das atividades nesta\nempresa, prestou serviços de consultoria para o Instituto de\nDesenvolvimento Integrado de Minas Gerais (Indi) e a firma Arthur D.\nLittle.\n\nEm 1977, tornou-se vice-presidente do Conselho Federal de Engenharia,\nArquitetura e Agronomia (Confea). Com o fim do bipartidarismo em\nnovembro de 1979 e a consequente reformulação partidária, filiou-se ao\nPartido do Movimento Democrático Brasileiro (PMDB). Foi presidente do\nConselho Regional de Engenharia, Arquitetura e Agronomia de Minas Gerais\n(Crea-MG) em 1981 e presidente da Sociedade Mineira de Engenheiros (SME)\nno biênio 1981-1982. Presidiu a Comissão de Ampliação e Reconstrução de\nPrédios Escolares (Carpe) da Secretaria de Educação de Minas Gerais\nentre 1983 e 1986, durante os governos de Tancredo Neves (1983-1984) e\nHélio Garcia (1984-1987).\n\nNo pleito de novembro de 1986, candidatou-se a deputado federal\nconstituinte. Eleito, assumiu o mandato em 1º de fevereiro do ano\nseguinte, quando tiveram início os trabalhos da Assembleia Nacional\nConstituinte. Membro titular da Subcomissão da Ciência e Tecnologia e da\nComunicação, da Comissão da Família, da Educação, Cultura e Esportes, da\nCiência e Tecnologia e da Comunicação, e suplente da Subcomissão dos\nDireitos Políticos, dos Direitos Coletivos e Garantias, da Comissão da\nSoberania e dos Direitos e Garantias do Homem e da Mulher, nas votações\nmais importantes pronunciou-se a favor do mandado de segurança coletivo,\ndo aborto, do turno ininterrupto de seis horas, da unicidade sindical,\nda soberania popular, da proibição do comércio de sangue, da limitação\ndos encargos para a dívida externa, da anistia aos micro e pequenos\nempresários, do mandato de cinco anos para o presidente José Sarney.\nVotou contra a pena de morte, a limitação do direito de propriedade\nprivada, a remuneração 50% superior para o trabalho extra, a jornada\nsemanal de 40 horas, o aviso prévio proporcional, o pluralismo sindical,\no presidencialismo, a estatização do sistema financeiro, o limite de 12%\nao ano para os juros reais e se absteve de opinar sobre o voto aos 16\nanos.\n\nCom a promulgação da nova Carta Constitucional em 5 de outubro de 1988,\npassou a participar dos trabalhos legislativos ordinários da Câmara,\ncomo membro titular da Comissão de Ciência e Tecnologia, Comunicação e\nInformática e suplente da Comissão de Minas e Energia. Embora tenha sido\num dos maiores contestadores do esquema de alianças montado nas eleições\nmunicipais de 1988 por Newton Cardoso (1987-1991), que apoiou candidatos\nde vários partidos, muitas vezes em detrimento do PMDB, foi convidado em\ndezembro para assumir o cargo de secretário do Gabinete Civil do governo\nmineiro. Assim, em janeiro de 1989 licenciou-se do mandato na Câmara dos\nDeputados. Retornou à Câmara ainda no mesmo ano e em 1990 viajou a\nWashington para participar do Seminário Interparlamentar sobre Meio\nAmbiente.\n\nReeleito no pleito de outubro, assumiu novo mandato em fevereiro de\n1991, participando dos trabalhos legislativos como\nprimeiro-vice-presidente da Comissão de Ciência, Tecnologia, Comunicação\ne Informática. Com destacada atuação na Comissão, apresentou, em maio de\n1991, substitutivo ao projeto de lei do II Plano Nacional de Informática\ne Automação (Planin II). Entre outras medidas, o substitutivo alterava o\nperíodo de vigência da reserva de informática, prorrogando-o por mais um\nano e incumbindo o Fórum de Acompanhamento da Política de Informática de\nfiscalizá-lo, e dobrava os recursos a fundo perdido destinados à\npesquisa e capacitação profissional.\n\nNa sessão da Câmara dos Deputados de 29 de setembro de 1992, votou a\nfavor da abertura do processo de *impeachment* do presidente Fernando\nCollor de Melo, acusado de crime de responsabilidade por envolvimento\nnuma rede de corrupção comandada por Paulo César Farias, tesoureiro de\nsua campanha eleitoral. Assumiu interinamente a presidência, tão logo a\nCâmara dos Deputados aprovou o afastamento de Collor, o vice Itamar\nFranco. Em 29 de dezembro, pouco antes da votação no Senado Federal,\nCollor renunciou ao mandato e Itamar Franco foi efetivado na presidência\nda República.\n\nNessa legislatura, votou favoravelmente à criação do Imposto Provisório\nsobre Movimentação Financeira (IPMF), contribuição de 0,25% que incidiu\nsobre operações bancárias, e à emenda que criou o Fundo Social de\nEmergência (FSE), que concedeu ao Executivo federal uma margem de\nautonomia na alocação de recursos, autorizando-o a aplicar verbas\ninicialmente previstas para os ministérios da Saúde e da Educação em\noutras áreas. Ausentou-se da sessão que rejeitou o fim do voto\nobrigatório.\n\nEm abril de 1994, coube-lhe coordenar um movimento suprapartidário, que\nexcluía apenas o Partido dos Trabalhadores (PT), o Partido Comunista do\nBrasil (PCdoB) e o Partido Socialista Brasileiro (PSB), cujo objetivo\nera propor ao Congresso Nacional a extinção dos monopólios estatais,\nsobretudo o das telecomunicações. Vice-líder do PMDB à época, o\nparlamentar mineiro declarou ser “totalmente favorável à quebra do\nmonopólio das telecomunicações porque não podemos mais continuar a viver\ncom o atual atraso que é devido ao fracasso do poder concedente\n(União)”.\n\nTentou a reeleição no pleito de outubro de 1994 e obteve uma suplência.\nDeixou a Câmara dos Deputados ao final da legislatura em 31 de janeiro\nde 1995.\n\nEm janeiro de 1999, em seguida à posse do ex-presidente Itamar Franco no\ngoverno de Minas, foi nomeado diretor da Cemig. Assumiu a diretoria de\nDistribuição da concessionária e, em outubro do mesmo ano,\ncumulativamente, a diretoria de Produção e Transmissão, em decorrência\nda destituição dos diretores que representavam os sócios minoritários\nestrangeiros da empresa. Ocupou a diretoria de Operação da Cemig em 2000\ne, nos dois anos seguintes, a diretoria de Distribuição e\nComercialização, tendo sido responsável pela criação da Efficientia,\nsubsidiária da Cemig, com atuação em serviços de eficiência energética.\n\nFoi nomeado diretor técnico da Companhia Brasileira de Trens Urbanos\n(CBTU) em janeiro de 2003 no início do governo Luís Inácio Lula da\nSilva. Exerceu o cargo até maio do ano seguinte, quando passou a\nintegrar a diretoria da Centrais Elétricas Brasileiras (Eletrobrás), na\ncondição de diretor de Projetos Especiais e Desenvolvimento Tecnológico\ne Empresarial.\n\nEm 11 de julho de 2005, assumiu interinamente a presidência da\nEletrobrás, em substituição ao engenheiro Silas Rondeau nomeado para o\nministério de Minas e Energia na mesma ocasião, sendo efetivado no cargo\nem 29 de julho pelo Conselho de Administração da empresa.\n\nDurante sua gestão, as empresas do grupo Eletrobrás tiveram participação\ndestacada nos leilões de compra de energia elétrica de novos\nempreendimentos de geração realizados em dezembro de 2005 e outubro de\n2006, arrematando em parceria com outras empresas ou isoladamente as\nconcessões dos aproveitamentos hidrelétricos de Baguari, Simplício,\nBatalha, Passo São João, Mauá e Dardanelos. Obteve o ingresso de Furnas\nnos consórcios responsáveis pelos empreendimentos hidrelétricos de Foz\ndo Chapecó e Serra do Facão e a assinatura do acordo de reestruturação\nsocietária da participação da Eletrobrás no consórcio Investco,\nresponsável pela exploração da concessão da hidrelétrica Lajeado (Luís\nEduardo Magalhães). Defendeu também, sem êxito, a reorganização\nsocietária e administrativa do grupo Eletrobrás e mudanças na legislação\ne no estatuto da empresa federal com o objetivo de permitir sua\nparticipação em projetos de geração e transmissão de energia no\nexterior. Em 2 de janeiro de 2007, deixou a presidência da estatal,\nsendo substituído em caráter interino pelo engenheiro Valter Cardeal. Em\nabril do mesmo ano, assumiu a presidência da Alstom Brasil, Ltda.,\nempresa multinacional fabricante de turbinas, geradores, equipamentos de\ntransmissão e de distribuição e material de transporte metroviário.\n\nCasou-se com Nanci Nilo Vasconcelos Novais, com quem teve três filhos.\n\nPublicou *Aproveitamentos hidrelétricos no Brasil* (1968),\n*Desenvolvimento econômico de Minas Gerais — sumário* (1972) e *Função\nsocial da engenharia* (1981).\n\nMarcelo Costa/Rogério de Barros/Paulo Brandi\n\nFONTES: ASSEMB. LEGISL. MG. *Dicionário biográfico;*ASSEMB. NAC.\nCONST.*Repertório*(1987-1988); CÂM. DEP. *Deputados brasileiros.\nRepertório*(1991-1995 e 1995-1999); Cemig. Relatório anual (1999 a\n2002); COELHO, J. & OLIVEIRA, A. *Nova*;**Eletrobrás. Relatório anual\n(2005 a 2007); *Estado de S. Paulo* (8/10/99); *Folha de S. Paulo*\n(19/1/87); *Globo*(15/5/91, 30/9/92, 2/4/94, 8/10/99);**INF. BIOGR. ;\n*Jornal do Brasil* (27/4/87 e 14/12/88); *Olho no voto/Folha de S.\nPaulo* (18/9/94);*Perfil parlamentar/Istoé*; Portal da Constituição\nCidadã http://www2.camara.gov.br/constituicao20anos.\n\n \n","ref":"FONTES: ASSEMB. LEGISL. MG. *Dicionário biográfico;*ASSEMB. NAC.\nCONST.*Repertório*(1987-1988); CÂM. DEP. *Deputados brasileiros.\nRepertório*(1991-1995 e 1995-1999); Cemig. Relatório anual (1999 a\n2002); COELHO, J. & OLIVEIRA, A. *Nova*;**Eletrobrás. Relatório anual\n(2005 a 2007); *Estado de S. Paulo* (8/10/99); *Folha de S. Paulo*\n(19/1/87); *Globo*(15/5/91, 30/9/92, 2/4/94, 8/10/99);**INF. BIOGR. ;\n*Jornal do Brasil* (27/4/87 e 14/12/88); *Olho no voto/Folha de S.\nPaulo* (18/9/94);*Perfil parlamentar/Istoé*; Portal da Constituição\nCidadã http://www2.camara.gov.br/constituicao20anos.\n\n \n","dic":"DHBB"}
