{"title":"VASCONCELOS, Francisco de Paula Assis","cargoss":["Interventor"],"cargos_esp":[0],"datas_ini":[1930],"datas_fim":[1934],"estados":["AC"],"autor":[0],"content":"**VASCONCELOS, Francisco de Paula Assis**\n\n\\*interv. AC 1930-1934.\n\n*Francisco de Paula Assis Vasconcelos*,**delegado de polícia durante o\ngoverno de Hermes da Fonseca (1910-1914), foi nomeado logo após a\nRevolução de 1930 interventor federal no Acre pelo presidente Getúlio\nVargas, tomando posse em dezembro de 1930 em substituição a Hugo Ribeiro\nCarneiro (1927-1930). Sua administração suscitou críticas de setores\npolíticos locais, como os centrados em torno do jornal *Folha do\nAcre,*que procuraram obter sua substituição junto ao ministro da\nJustiça, Osvaldo Aranha. Permaneceu no cargo até setembro de 1934,\nquando foi substituído por José Moreira Castelo Branco Sobrinho.\n\nFONTES: ARQ. OSVALDO ARANHA; *Encic.* *Mirador;*PEIXOTO, A.\n*Getúlio;*POPPINO, R. *Federal.*\n\n \n","ref":"FONTES: ARQ. OSVALDO ARANHA; *Encic.* *Mirador;*PEIXOTO, A.\n*Getúlio;*POPPINO, R. *Federal.*\n\n \n","dic":"DHBB"}
