{"title":"VASCONCELOS, Herbert","cargoss":["Deputado federal"],"cargos_esp":[0],"datas_ini":[1951],"datas_fim":[1955],"estados":["SP"],"autor":[0],"content":"**VASCONCELOS, Herbert**\n\n\\*militar; dep. fed. SP 1951-1955.\n\n \n\n*Herbert Maia de Vasconcelos* nasceu em Sete Lagoas (MG) no dia 14 de\njunho de 1888, filho de Filipe de Castro e Vasconcelos e de Loiola Maia\nVasconcelos.\n\nApós diplomar-se pela Faculdade de Medicina do Rio de Janeiro, então\nDistrito Federal, ingressou, em dezembro de 1917, no serviço de saúde do\nExército, ocupando a patente de primeiro-tenente. Concluiu o curso de\naperfeiçoamento da Escola de Saúde em 1921, assim como o curso de\ncardiologia e tisiologia. Promovido a capitão em julho de 1922, logo em\nseguida participou ao lado das forças legalistas da repressão à Revolta\nde 5 de Julho de 1924, ocorrida em São Paulo. Major em 1936 e\ntenente-coronel em agosto de 1941, durante a Segunda Guerra Mundial\norganizou um plano preventivo de socorro à população de Recife, que\nesteve várias vezes ameaçada pelo perigo de ataques aéreos. Nessa\nocasião organizou e foi o diretor do Hospital Militar daquela cidade,\ntendo também chefiado interinamente o serviço de saúde da 7ª Região\nMilitar (7ª RM).\n\nAo fim do conflito mundial, exerceu o cargo de vice-diretor do Hospital\nCentral do Exército, onde foram recolhidos e tratados quase dois mil\nexpedicionários que regressaram feridos ao Brasil. Em dezembro de 1945\nfoi promovido a coronel e dois anos depois foi nomeado chefe do serviço\nde saúde da 2ª RM. Exerceu ainda os cargos de diretor do Hospital\nMilitar de São Paulo e de secretário de Saúde Pública e Assistência\nSocial do estado de São Paulo, sendo promovido em 1948 a\ngeneral-de-brigada e passando pouco depois para a reserva.\n\nNo pleito de outubro de 1950 elegeu-se suplente de deputado federal por\nSão Paulo na legenda do Partido Social Progressista (PSP), tendo sido,\nao longo do período legislativo, convocado inúmeras vezes. Quando das\ndiscussões a respeito da criação da Petrobras, participou de uma\ncomissão especial da Câmara dos Deputados encarregada de examinar e dar\nparecer sobre as 32 emendas propostas pelo Senado ao projeto da União\nDemocrática Nacional (UDN). A comissão manifestou-se, de modo geral,\npela manutenção do projeto inicial, não aceitando as emendas que\npossibilitavam o controle da Petrobras pela iniciativa privada. A Câmara\naprovou os pareceres da comissão e, finalmente, em outubro de 1953,\nGetúlio Vargas sancionou a lei resultante do Projeto nº 2.004, relativa\nà política do petróleo e à criação da Petrobras.\n\nTentou a reeleição em outubro de 1954, ainda na legenda do PSP,\nalcançando apenas uma suplência. Abandonando então a vida parlamentar,\nnão assumiu mais nenhum cargo público, dedicando-se somente ao exercício\nda medicina.\n\nFaleceu em São Paulo no dia 24 de outubro de 1978.\n\nEra casado com Noêmia Guimarães Vasconcelos, com quem teve duas filhas.\n\n \n\nFONTES: CISNEIROS, A. *Parlamentares*; COHN, G. *Petróleo*; INF. Lílian\nGuimarães de Vasconcelos; DEP. PESQ. ESTADO DE SÃO PAULO; TRIB. SUP.\nELEIT. *Dados* (2 e 3).\n\n \n","ref":"FONTES: CISNEIROS, A. *Parlamentares*; COHN, G. *Petróleo*; INF. Lílian\nGuimarães de Vasconcelos; DEP. PESQ. ESTADO DE SÃO PAULO; TRIB. SUP.\nELEIT. *Dados* (2 e 3).\n\n \n","dic":"DHBB"}
