{"title":"BARROS, José Maria Siqueira de ==============================","cargoss":["Presidente de associação ou confederação de empregados ou empregadores"],"cargos_esp":["Eletrobrás"],"datas_ini":[1990],"datas_fim":[1992],"estados":[0],"autor":[0],"content":"BARROS, José Maria Siqueira de\n==============================\n\n\\* pres. Eletrobrás 1990-1992.\n\n \n\n*José Maria Siqueira de Barros* nasceu em Cachoeira Paulista (SP) no dia\n2 de agosto de 1937 , filho de José Benedito de Barros e de Ilca\nSiqueira de Barros.\n\nIniciou o curso primário em grupo escolar de sua cidade natal,\ntransferindo-se em 1944 para o Colégio São Bento, no Rio de Janeiro. Fez\no curso ginasial no Colégio São Joaquim, em Lorena (SP), entre 1948 e\n1951, e o colegial no Instituto de Educação Conselheiro Rodrigues Alves,\nem Guaratinguetá (SP), entre 1952 e 1955.\n\nEm 1958, foi admitido na Escola de Engenharia Mackenzie, em São Paulo,\ndiplomando-se engenheiro civil e elétrico em 1962. Ainda na faculdade,\ntrabalhou na firma Construção e Comércio Obras Ltda., realizando\ncálculos estruturais e fiscalizando obras.\n\nIngressou em 1963 na Companhia Hidrelétrica do Rio Pardo (Cherp),\nempresa pertencente ao governo paulista, absorvida pela Centrais\nElétricas de São Paulo (CESP) no fim de 1966, juntamente com outras\ncompanhias públicas estaduais congêneres. Participou da construção da\nusina de Graminha (depois denominada Caconde), passando a integrar o\nquadro de engenheiros da CESP no momento da constituição dessa empresa,\nonde ocuparia o cargo de chefe do departamento de custos, medições,\ncontratos e pagamentos.\n\nEm 1975, transferiu-se para a Companhia do Metropolitano de São Paulo,\nascendendo à condição de presidente da empresa em março de 1979, por\nindicação de Paulo Maluf, que iniciava então seu primeiro mandato como\ngovernador de São Paulo. Siqueira de Barros exerceu esse cargo durante\n18 meses, tendo prestado serviços de consultoria, na mesma época, à\ndiretoria financeira da Itaipu Binacional.\n\nFoi nomeado secretário de Transportes pelo governador Paulo Maluf em\nagosto de 1980, permanecendo no cargo até março de 1982. Tornou-se então\nassessor do ministro do Planejamento, Antônio Delfim Neto, ao mesmo\ntempo em que Maluf, candidato às eleições parlamentares de novembro,\npreparava sua saída do governo paulista. Atuou como assessor de Delfim\nNeto até o final do mandato do presidente João Figueiredo em março de\n1985. Neste ano, desligou-se do Metrô paulista e constituiu a firma\nEnbar Assessoria e Participações S. C. Ltda., especializada na prestação\nde serviços na área de engenharia comercial.\n\nEm março de 1985, voltou à cena pública como presidente da Companhia do\nMetropolitano do Rio de Janeiro, credenciado pela experiência e\nconfiança conquistada junto a grandes empreiteiras durante sua passagem\npela companhia paulista e pela secretaria de Transportes de São Paulo.\n\nApós a posse de Fernando Collor de Melo na presidência da República em\nmarço de 1990, foi chamado a presidir a Centrais Elétricas Brasileiras\nS. A. (Eletrobrás), superando outros nomes de maior prestígio no setor\nde energia elétrica. Vinculada à Secretaria Nacional de Energia do\nMinistério da Infra-Estrutura, segundo o novo organograma da\nadministração federal, a Eletrobrás atuava como *holding* das empresas\nfederais de energia elétrica, exercendo múltiplas funções como agente\nexecutivo da política governamental no setor.\n\nSiqueira de Barros assumiu o lugar de Mário Bhering como presidente da\nEletrobrás em 1º de junho de 1990, permanecendo à frente da *holding* ao\nlongo da administração Collor. Sua gestão foi marcada pelo agravamento\nda crise econômico-financeira das empresas do sistema Eletrobrás e das\nconcessionárias controladas pelos governos estaduais, pelo fracasso da\ntentativa de mudanças institucionais no setor, articulada pela\nSecretaria Nacional de Energia, pela redução significativa do quadro de\npessoal da *holding* e pelas denúncias de irregularidades no tratamento\nda questão das dívidas com empreiteiros e fornecedores de bens e\nserviços.\n\nA crise financeira do setor de energia elétrica irrompeu com toda a\nintensidade no segundo semestre de 1990, concomitantemente com o malogro\ndo plano de estabilização econômica do governo Collor. Estabeleceu-se\numa cadeia de inadimplência que provocou a quase completa desarticulação\nfinanceira do setor. As empresas estaduais acumularam enorme débito\ncorrespondente ao não pagamento da energia suprida pelas geradoras\nfederais e pela Itaipu Binacional, que, por sua vez, deixaram de pagar o\nserviço da dívida junto à Eletrobrás. Sem esses pagamentos, a Eletrobrás\ntambém interrompeu o serviço da dívida junto ao Tesouro Nacional. Ao\nmesmo tempo, firmas de construção, fornecedores de bens de capital e\nempresas de consultoria tornaram-se credores de vultosas faturas,\nalgumas vencidas desde 1988. Essa situação levou à quase completa\nparalisação das obras no âmbito da Eletrobrás.\n\nEm outubro de 1990, o presidente Fernando Collor nomeou grupo de\ntrabalho, composto por representantes dos Ministérios da Economia e da\nInfra-Estrutura e da Secretaria de Assuntos Estratégicos, com o objetivo\nde proceder ao levantamento do valor da dívida da Eletrobrás com\nfornecedores de bens e serviços. No fim de novembro, antes de qualquer\nrecomendação do grupo de trabalho, Siqueira de Barros reuniu a diretoria\nda Eletrobrás para a aprovação de um empréstimo de cerca de 25 milhões\nde dólares à subsidiária Centrais Elétricas do Norte do Brasil\n(Eletronorte), destinado ao pagamento de atrasados à construtora Andrade\nGutierrez. Segundo denúncia do jornalista Jânio de Freitas, divulgada\npela *Folha de São Paulo*, a ordem para liberação dos recursos teria\npartido do presidente Collor. Posteriormente, outros jornalistas\napontaram um vínculo entre essa operação e o esquema de corrupção\nmontado por Paulo César Farias, conhecido como PC, tesoureiro da\ncampanha eleitoral de Collor, revelando que a Andrade Gutierrez\ndepositara 1,7 milhão de dólares na conta bancária da firma de\nconsultoria de PC, entre junho e setembro de 1990.\n\nO programa de investimentos da Eletrobrás foi diretamente afetado pela\ninadimplência do setor. Os recursos disponíveis foram basicamente\ndirecionados para a retomada da construção da usina de Xingó, a cargo da\nCompanhia Hidro Elétrica do São Francisco (Chesf), subsidiária atuante\nna região Nordeste. Em meio a sucessivas greves que mobilizaram a quase\ntotalidade dos 50 mil trabalhadores do setor elétrico federal, a\nEletrobrás e suas subsidiárias lançaram um programa de reforma\nadministrativa, visando à redução de 30% do quadro de pessoal. Além de\nestimular a saída de empregados mediante o pagamento de indenizações,\nSiqueira de Barros promoveu centenas de demissões na *holding* ao longo\nde sua gestão.\n\nEm 1991, o programa de obras de geração permaneceu paralisado,\nexcetuando Xingó. Em dezembro, numa tentativa de regularizar as relações\ncomerciais entre as concessionárias, o governo promulgou o Decreto n.º\n409, estipulando que as parcelas devidas ao suprimento de Itaipu e às\nempresas federais seriam segregadas na conta de energia ao consumidor\nfinal e apropriadas automaticamente pela Eletrobrás. O decreto acabou\nvirando letra morta devido à resistência das concessionárias estaduais\nde maior porte, atuantes nas regiões Sudeste e Sul, notadamente a CESP.\n\nEmbora enfraquecido pelo afastamento do ministro João Santana em abril\nde 1992, Siqueira de Barros foi mantido no cargo de presidente da\nEletrobrás. Em agosto, duas subsidiárias da Eletrobrás ‑ a Light\nServiços de Eletricidade e a Espírito Santo Centrais Elétricas (Escelsa)\n‑ foram incluídas no Programa Nacional de Desestatização (PND). Em\noutubro, após a aprovação pela Câmara dos Deputados da abertura do\nprocesso de *impeachment* de Collor (29/9/92) e a sua substituição na\npresidência pelo vice-presidente Itamar Franco, no dia 2, o engenheiro\nEliseu Resende assumiu o lugar de Siqueira de Barros na Eletrobrás.\n\nAo deixar a presidência da Eletrobrás, Siqueira de Barros voltou à CESP\ncomo assessor da presidência, onde permaneceria até 1995, quando se\ndemitiu para dar lugar à administração designada pelo novo governador\nMário Covas. Nessa oportunidade aposentou-se, vindo a trabalhar\nnovamente na Enbar Assessoria e Participações, bem como na Public\nQuadras Esportivas Ltda., esta última também constituída por ele.\n\nCasou-se com Marta Maria Machado de Barros, com quem teve quatro filhos.\n\n \n\n*Paulo Brandi/Sérgio Lamarão*\n\n \n\nFONTES: CURRIC. BIOG.;**ELETROBRÁS.*Relatório de diret; Folha de São\nPaulo*(30/11 e 4/12/90, 21/3/92);**INF. BIOG.; *Jornal do Brasil*\n(21/5/91); KRIEGER, G. *Todos.*\n","ref":"FONTES: CURRIC. BIOG.;**ELETROBRÁS.*Relatório de diret; Folha de São\nPaulo*(30/11 e 4/12/90, 21/3/92);**INF. BIOG.; *Jornal do Brasil*\n(21/5/91); KRIEGER, G. *Todos.*\n","dic":"DHBB"}
