{"title":"VASCONCELOS, Jarbas","cargoss":["Deputado federal","Deputado federal","Prefeito","Prefeito","Governador de estado ou do Distrito Federal","Senador"],"cargos_esp":[0,0,"Recife","Recife",0,0],"datas_ini":[1983,1975,1993,1986,1999,2007],"datas_fim":[1986,1979,1997,1989,2006,0],"estados":["PE","PE",0,0,"PE","PE"],"autor":[0],"content":"**VASCONCELOS, Jarbas**\n\n\\*dep. fed. PE 1975-1979 e 1983-1986; pref. Recife 1986-1989 e\n1993-1997; gov. PE 1999-2006; sen. PE 2007-.\n\n \n\n*Jarbas de Andrade Vasconcelos***nasceu em Vicência (PE) em 23 de agosto\nde 1942, filho de Carlindo de Morais Vasconcelos e de Áurea de Andrade\nVasconcelos.\n\nFoi assessor jurídico da Assembléia Legislativa de Pernambuco em 1962.\nEm 1964, ingressou na Faculdade de Direito da Universidade Católica de\nPernambuco, bacharelando-se em 1968. Em seguida foi professor-assistente\nda cadeira de teoria geral do Estado na Faculdade de Direito de Caruaru\n(PE). Atuou também como advogado trabalhista em Recife.\n\nIngressou na vida política em 1969 como secretário-geral da seção\npernambucana do Movimento Democrático Brasileiro (MDB), partido de\noposição ao regime militar implantado no país em abril de 1964. Nesta\nlegenda foi eleito deputado estadual em Pernambuco no pleito de novembro\nde 1970, assumindo a cadeira em fevereiro do ano seguinte. Integrou\nentão a Comissão de Constituição e Justiça da Assembléia Legislativa\npernambucana, exercendo ainda, a partir de 1973, a liderança da oposição\nnaquela casa.\n\nEm julho de 1971 participou do segundo encontro nacional do MDB, ocasião\nem que propôs maior empenho do partido na luta pela convocação de uma\nassembléia nacional constituinte. A proposta não foi aceita pela cúpula\ndo partido e deu origem a uma divisão interna no MDB, marcada pela\noposição entre as alas “moderada” e “autêntica”. Jarbas posicionou-se,\nentão, ao lado do grupo “autêntico”.\n\nEm novembro de 1974, elegeu-se deputado federal por seu estado na\nlegenda do MDB, tomando posse em fevereiro do ano seguinte. Na Câmara\ndos Deputados foi membro da Comissão de Constituição e Justiça e\nsuplente da Comissão do Polígono das Secas. Paralelamente, assumiu a\npresidência do diretório regional emedebista em Pernambuco.\n\nCandidato da oposição pernambucana ao Senado no pleito de novembro de\n1978, não conseguiu eleger-se. Segundo denunciou então à imprensa, a\nvitória de Nilo Coelho, candidato do partido situacionista, a Aliança\nRenovadora Nacional (Arena), só foi possível devido às fraudes e\nviolências ocorridas no dia da eleição.\n\nEm janeiro de 1979, Jarbas Vasconcelos concluiu seu mandato de deputado\nfederal. Recusou, então, o convite para substituir o deputado Tales\nRamalho como secretário da comissão executiva nacional do MDB,\npreferindo continuar dando prioridade ao seu trabalho partidário em\nPernambuco. Ainda em 1979, declarou-se favorável à filiação de\ncomunistas ao MDB e defendeu a legalização do Partido Comunista\nBrasileiro (PCB). Em meio aos debates em torno das possíveis\nalternativas de reforma política, promovidos a partir do início do\ngoverno do general João Figueiredo, voltou a defender a convocação de\numa assembléia nacional constituinte como saída para a crise política e\ninstitucional brasileira. Tal posicionamento mais uma vez o colocou em\nchoque com os setores mais moderados de seu partido, que preferiam\nconcentrar esforços na aprovação de emendas à ordem constitucional\nvigente.\n\nCom a extinção do bipartidarismo em 29 de novembro de 1979 e a\nconseqüente reformulação partidária, filiou-se ao Partido do Movimento\nDemocrático Brasileiro (PMDB), que sucedeu o MDB. Nessa legenda voltou a\neleger-se para a Câmara dos Deputados no pleito de novembro de 1982,\nassumindo o mandato em fevereiro do ano seguinte.\n\nEm 25 de abril de 1984 votou a favor da emenda Dante de Oliveira, que,\napresentada na Câmara dos Deputados, propôs o restabelecimento das\neleições diretas para presidente da República em novembro daquele ano.\nComo a emenda não obteve o número de votos indispensáveis à sua\naprovação — faltaram 22 para que o projeto pudesse ser encaminhado à\napreciação pelo Senado —, Jarbas Vasconcelos recusou-se a participar da\nvotação no Colégio Eleitoral, reunido em 15 de janeiro de 1985, por\nconsiderar que somente a eleição direta conferiria legitimidade ao novo\ngoverno. Apesar da recusa de Jarbas Vasconcelos e de alguns outros\nparlamentares oposicionistas em participar do Colégio Eleitoral, o\npleito indireto foi realizado, resultando na vitória de Tancredo Neves,\neleito novo presidente da República pela Aliança Democrática, uma união\ndo PMDB com a dissidência do Partido Democrático Social (PDS) abrigada\nna Frente Liberal. Contudo, Tancredo Neves não chegou a ser empossado na\npresidência, vindo a falecer em 21 de abril de 1985. Seu substituto no\ncargo foi o vice José Sarney, que já vinha exercendo interinamente o\ncargo desde 15 de março desse ano.\n\nEm 1985, Jarbas Vasconcelos pleiteou a indicação do seu partido para\nconcorrer à prefeitura de Recife, naquela que seria a primeira eleição\ndireta para prefeitos de capitais estaduais após o término do regime\nmilitar. Sua pretensão, porém, esbarrou na candidatura do também\ndeputado federal Sérgio Murilo, representante da ala moderada do\npartido, que o derrotou na convenção peemedebista. Com o apoio de\nimportantes personalidades da ala progressista do PMDB pernambucano,\ncomo o ex-governador e então deputado federal Miguel Arrais e o ministro\nda Justiça Fernando Lira, Jarbas Vasconcelos transferiu-se, em julho de\n1985, para o Partido Socialista Brasileiro (PSB), legenda na qual\ndisputou a eleição para a prefeitura de Recife.\n\nDurante a campanha, apresentou-se como um “peemedebista histórico” e\nassumiu o compromisso de realizar uma administração voltada para a\nmelhoria da qualidade de vida da população carente. Incluiu com destaque\nem seu programa de governo o combate ao desemprego, a construção de\nmercados públicos e o apoio à difusão das feiras-livres como forma de\nenfrentar a alta do custo de vida na capital pernambucana. Apesar de\ncontar com pouco tempo no horário eleitoral gratuito de rádio e\ntelevisão, Jarbas Vasconcelos venceu o pleito realizado em 15 de\nnovembro. Empossado em janeiro de 1986, retornou logo em seguida ao PMDB\ne apoiou a eleição de Miguel Arrais ao governo estadual, ocorrida em\nnovembro seguinte. No início de 1987, porém, surgiram os primeiros\nsinais de estremecimento nas relações entre Jarbas e Arrais.\n\nSeu governo na capital pernambucana foi marcado pela descentralização\nadministrativa através do programa “Prefeitura nos Bairros”, que\nestabelecia um canal de comunicação permanente entre o prefeito e as\nassociações de moradores, que passaram a ter a oportunidade de influir\nna determinação das prioridades da administração e na fiscalização da\naplicação dos recursos públicos. Através de um banco de dados\ninformatizado, foram franqueadas aos moradores da cidade informações\nsobre a prefeitura e a aplicação dos recursos disponíveis. Além disso, o\ncontribuinte tinha acesso aos valores gastos em todas as obras da\nprefeitura, ao orçamento de cada secretaria e a informações de utilidade\npública. O programa “Mesa Popular”, por sua vez, procurava tornar\nacessíveis à população de baixa renda os alimentos da cesta básica,\nvendidos a preço de custo em postos espalhados pela cidade. Apesar dos\nelevados índices de aprovação popular à sua gestão na prefeitura,\napontados pelos institutos de pesquisa, Jarbas não conseguiu fazer com\nque o seu candidato à sucessão, o deputado estadual Marcos Cunha (PMDB),\nvencesse o pleito realizado em novembro de 1988, sendo derrotado pelo\ncandidato do Partido da Frente Liberal (PFL), Joaquim Francisco. Em\njaneiro do ano seguinte, Jarbas Vasconcelos finalizou seu mandato à\nfrente da prefeitura de Recife.\n\nEm 1989, naquela que seria a primeira eleição direta para presidente da\nRepública após 21 anos de regime militar, Jarbas Vasconcelos assumiu a\npresidência do PMDB, durante os meses em que se desenrolou a campanha\neleitoral, substituindo o deputado Ulisses Guimarães, que se afastara do\ncargo para disputar a presidência da República. Apesar de o PMDB ser\nentão o partido de maior estrutura orgânica do país, Ulisses terminou o\nprimeiro turno da votação na sétima posição. No segundo turno da\ndisputa, que reuniu os dois candidatos mais votados — Fernando Collor de\nMelo, ex-governador alagoano lançado pelo Partido da Reconstrução\nNacional (PRN), e o petista Luís Inácio Lula da Silva, lançado pela\nFrente Brasil Popular — Partido dos Trabalhadores (PT)-PSB-Partido\nComunista do Brasil (PCdoB) —, Jarbas Vasconcelos foi um dos primeiros\nlíderes políticos de fora da Frente Brasil Popular a manifestar apoio a\nLula. Defendeu, porém, que o programa de governo do candidato petista\nincorporasse propostas preconizadas pelos setores liberais da sociedade.\nEm dezembro de 1989, após uma disputa acirrada e fortemente marcada pela\npolarização ideológica, Fernando Collor foi eleito por uma pequena\nmargem de votos.\n\nEm janeiro de 1990, Jarbas Vasconcelos iniciou articulações junto às\nforças políticas de Pernambuco visando o lançamento de sua candidatura\nao governo do estado. Apesar das resistências colocadas pelo governador\nMiguel Arrais, seu nome foi formalizado pelo PMDB em março daquele ano,\nrecebendo ainda a adesão do Partido da Social Democracia Brasileira\n(PSDB), PSB, PCB, PCdoB e Partido Democrático Trabalhista (PDT).\nRealizado o pleito em outubro, foi derrotado pelo candidato do PFL,\nJoaquim Francisco, que recebera o apoio do presidente Collor. Jarbas\nrecusou-se, então, a reconhecer a vitória do candidato pefelista,\ndenunciando a ocorrência de irregularidades em 110 das 127 zonas\neleitorais do estado.\n\nEm outubro de 1992 voltou a concorrer à prefeitura de Recife,\nelegendo-se com facilidade já no primeiro turno da disputa. Logo que os\nresultados do pleito foram conhecidos, declarou apoio ao recém-instalado\ngoverno do presidente Itamar Franco e prometeu promover o entendimento\ncom o governador Joaquim Francisco. Seu segundo mandato procurou\nreeditar as ações que tiveram sucesso na gestão anterior, entre as quais\na adoção do programa “Prefeitura nos Bairros”.\n\nEm abril de 1993, com a renúncia do ex-governador paulista Orestes\nQuércia à presidência nacional do PMDB, Jarbas, que era então\nvice-presidente da agremiação, apresentou o seu nome para o posto. Suas\npretensões, porém, não se efetivaram, uma vez que o estatuto do PMDB\nproibia que a presidência do partido fosse exercida por ocupantes de\ncargos executivos. Em setembro daquele ano reiterou seu apoio ao governo\nItamar Franco, mas advertiu que a falta de um projeto de combate\ndecidido à inflação acabaria por afastar o PMDB da base governista.\n\nNo início de 1994, teve seu nome cogitado por importantes lideranças\npolíticas de Pernambuco para concorrer novamente ao governo do estado\nnas eleições previstas para o mês de outubro, simultaneamente à sucessão\npresidencial. Optou, porém, por concluir seu mandato à frente da\nprefeitura recifense. Ainda em maio daquele ano, por discordar do\nlançamento de candidatura própria do PMDB à presidência da República,\ndeixou a agremiação. Aliou-se então ao candidato do PSDB, Fernando\nHenrique Cardoso, lançado por uma coligação que incluía ainda o PFL e o\nPartido Trabalhista Brasileiro (PTB), tendo inclusive integrado o\ncomando nacional da campanha. Respaldado pelo sucesso do plano de\nestabilização financeira — o Plano Real — implantado sob sua direção\nenquanto ministro da Fazenda do governo Itamar Franco, Fernando Henrique\nvenceu a eleição já no primeiro turno da disputa.\n\nEm seguida, Jarbas passou a articular sua entrada no PSDB, contando para\nisso com o apoio de importantes líderes nacionais do partido, tais como\nJosé Serra e Sérgio Mota, respectivamente ministros do Planejamento e\ndas Comunicações, além do próprio presidente Fernando Henrique Cardoso.\nPara a disputa do governo pernambucano em 1998, o prefeito de Recife\ntencionava reeditar em torno do seu nome a aliança entre PSDB e PFL,\nnúcleo básico de sustentação da candidatura presidencial de Fernando\nHenrique em 1994. Sua entrada no PSDB, porém, foi inviabilizada pela\nresistência da seção pernambucana do partido, controlada pelo grupo do\ndeputado Wilson Campos, que pretendia fazer de seu filho, o senador\nCarlos Wilson, candidato da agremiação à sucessão estadual.\n\nEm maio de 1996, após dois anos sem partido, Jarbas retornou ao PMDB.\nDedicou-se, então, à articulação de uma aliança entre o PMDB e o PFL em\ntorno da candidatura do deputado Roberto Magalhães à sua sucessão na\nprefeitura da capital pernambucana, recebendo em troca o compromisso dos\npefelistas de apoiar o seu nome na disputa estadual em 1998. Esse acordo\nteve ampla repercussão, visto serem PMDB e PFL antigos adversários na\npolítica de Pernambuco. Segundo Jarbas Vasconcelos, um dos mais\ndestacados representantes históricos da esquerda pernambucana, a aliança\ncom o PFL justificava-se exatamente pela diluição ideológica que passara\na dominar o cenário político nacional e internacional. Realizadas as\neleições municipais em outubro daquele ano, Roberto Magalhães abriu\nlarga vantagem sobre os demais candidatos, definindo a disputa já no\nprimeiro turno. Ao terminar seu mandato, Jarbas Vasconcelos desfrutava\nnovamente de altos índices de aprovação popular à sua administração,\nsendo com freqüência apontado pelas sondagens de opinião pública como o\nprefeito mais popular das capitais brasileiras. Esse sucesso foi\ncreditado por muitos à sua atuação na área social e pelo fato de\nescolher pessoas ligadas aos movimentos sociais e populares para compor\no terceiro e o quarto escalões de seu governo. Segundo o próprio Jarbas,\nseu bom desempenho se devia ao controle das despesas da prefeitura, ao\ndiálogo continuamente mantido com os diversos segmentos sociais do\nmunicípio e à coesão de sua equipe de governo.\n\nAinda durante o governo do presidente Fernando Henrique Cardoso, o nome\nde Jarbas Vasconcelos por mais de uma vez foi cogitado para assumir um\nministério. A rejeição do PSDB pernambucano bem como a falta de unidade\ndo próprio PMDB em torno de seu nome acabaram, contudo, por inviabilizar\nsua indicação.\n\nEm outubro de 1998 disputou o governo de Pernambuco à frente de uma\ncoligação que reunia o PMDB, o PFL, o Partido Progressista Brasileiro\n(PPB) e outras agremiações menores, denominada “União por Pernambuco”.\nElegeu-se já no primeiro turno da disputa com cerca de 65% dos votos\nválidos, derrotando o governador Miguel Arrais, que tentava a reeleição,\npor uma diferença de mais de um milhão de votos. Em janeiro do ano\nseguinte, tomou posse no governo pernambucano, em uma cerimônia que não\ncontou com a presença do ex-governador para lhe passar o cargo.\n\nDurante seu primeiro ano de governo, Jarbas Vasconcelos dedicou-se\nespecialmente a reajustar as contas do estado, a realizar obras de\ninfra-estrutura para atrair investimentos e a concluir o processo de\nprivatização da Companhia Elétrica de Pernambuco (CELPE), iniciado\ndurante o governo de Miguel Arraes. Em fevereiro de 2000, a CELPE foi\nleiloada  e gerou recursos da ordem de 1 bilhão de dólares para os\ncofres do estado de Pernambuco, o que permitiu dar início a uma série de\nobras de infra-estrutura, destacando-se as obras em barragens e adutoras\nno interior do estado e a duplicação da BR 232, estrada federal de\nligação entre Recife e Caruaru, que foi a maior e mais visível obra do\nprimeiro mandato do governo Jarbas Vasconcelos.\n\nEm julho de 2000, foi implantado em Recife o Porto Digital, que\nconsistia em um pólo de desenvolvimento de softwares reconhecido como o\nmaior parque tecnológico do Brasil, em termos de faturamento e número de\nempresas.\n\nNa área social implantou o Programa Governo nos Municípios, que permitiu\nàs lideranças da sociedade civil, dentro de cada uma das 12\nmicro-regiões em que o estado foi dividido, participar da definição das\nações e das obras consideradas estratégicas para o desenvolvimento\nlocal.  Durante este seu primeiro mandato, o Programa Governo nos\nMunicípios priorizou, especialmente, a realização de obras de\ninfra-estrutura para o desenvolvimento regional. Outro programa que se\ndestacou na área social foi o Projeto Renascer, voltado para o combate à\npobreza rural, tendo como principal estratégia incentivar e empreender a\nconcepção do desenvolvimento local, com o objetivo de superar a\nvulnerabilidade dos segmentos mais pobres da zona rural pernambucana.\n\nApós declinar do convite para compor a chapa do tucano José Serra à\nPresidência da República como seu vice, nas eleições de 2002, Jarbas\nVasconcelos optou por disputar a reeleição ao cargo. Foi reeleito ainda\nno primeiro turno, com 60,41% dos votos válidos, contra os 34,1% dos\nvotos obtidos por Humberto Sérgio Costa Lima (PT), segundo candidato\nmais votado,  e deu início ao novo mandato em janeiro de 2003. Dentre as\nprincipais iniciativas do seu segundo governo, esteve a complementação\ndas obras de infra-estrutura no complexo industrial portuário de Suape,\ndestacando-se, em 2005, o início das obras de construção da Refinaria\nGeneral José Inácio Abreu e Lima, resultado de uma parceria entre a\nPetrobras e a Petróleos da Venezuela S. A. (PDVSA), tendo em vista a\nconstrução da primeira refinaria do país projetada para processar\npetróleo pesado, com capacidade para gerar 200 mil barris de petróleo\npor dia. Além disso, os investimentos no porto de Suape viabilizaram\noutros dois grandes empreendimentos: a construção do estaleiro\nHemisfério Sul e do Pólo de Poliéster. Na área social, deu continuidade\nàs realizações dos programas Governo nos municípios e Renascer.\n\n Em março de 2006, renunciou ao cargo, que passou a ser ocupado pelo\nentão vice-governador Mendonça Filho (PFL), para se candidatar ao Senado\nFederal nas eleições de outubro daquele ano. Elegeu-se senador pelo\nestado de Pernambuco, na legenda do PMDB, e tomou posse do cargo em\nfevereiro de 2007. Apesar do PMDB integrar a base governista do segundo\nGoverno Luis Inácio Lula da Silva (2007-2011), Vasconcelos\ncaracterizou-se por assumir uma postura independente em relação às\ndecisões do Executivo e do seu partido.\n\nEm março de 2007, logo no inicio do segundo mandato do presidente Luis\nInácio Lula da Silva, fez um pronunciamento na tribuna do Senado Federal\napresentando críticas à reforma ministerial proposta pelo presidente,\ndestacando, especialmente, a sua demora para anunciar os nomes\nescolhidos e a falta de rigidez para cobrar destes as metas\nestabelecidas para as pastas que viriam a ocupar.\n\nEm 2007, foi uma das principais vozes a favor da renúncia ou cassação do\nmandato do presidente do Senado, o peemedebista Renan Calheiros, que em\nmaio daquele ano teve seu nome envolvido em denúncias de corrupção.\nTitular da Comissão de Constituição e Justiça do Senado (CCJ),\nVasconcelos foi destituído de sua vaga na Comissão, em outubro de 2007,\nconforme decisão do então líder do PMDB, Valdir Raup, que na mesma\nocasião também afastou da comissão o senador Pedro Simon (PMDB), sob\nalegação de que ambos votavam sempre contra os interesses da bancada do\npartido. A retirada dos chamados “históricos” do PMDB da CCJ causou\nreação em setores do PMDB e de outros partidos da oposição, e  alimentou\no movimento contra Renan Calheiros no Senado, que passou a ser apontado\ncomo articulador da manobra para retirar Vasconcelos e Simon da CCJ.\nDepois de sofrer forte pressão por parte de parlamentares de diferentes\npartidos que apoiavam o retorno dos dois peemedebistas à Comissão,\nValdir Raupp reconsiderou sua decisão e convidou Jarbas e Simon a\nreintegrarem a CCJ. Em novembro, Renan Calheiros renunciou à presidência\ndo Senado.\n\nAinda em 2007, a bancada do PMDB, então o maior partido da base\ngovernista no Senado, decidiu votar a favor da prorrogação até 2011 da\nContribuição Provisória sobre a Movimentação Financeira (CPMF), mas\ninsistindo para que a alíquota do imposto fosse reduzida já a partir de\n2008. Jarbas Vasconcelos, entretanto, não se submeteu à decisão e votou\ncontra a prorrogação do imposto.\n\nEm fevereiro de 2009, em entrevista à *Veja,*Vasconcelos afirmou que boa\nparte do seu partido era composta por corruptos e classificou a eleição\ndo peemedebista José Sarney à presidência do Senado como um “completo\nretrocesso”. Além disso, fez críticas ao recém-escolhido líder do PMDB\nno Senado, Renan Calheiros. Após a divulgação de suas declarações, a\ncúpula do PMDB se reuniu para avaliar se deveria puni-lo. A direção do\npartido decidiu ignorar formalmente as declarações de Vasconcelos, que\nforam classificadas pela Executiva Nacional do PMDB como um “desabafo”,\nao qual não se deveria dar maior relevo. Em março, em discurso na\ntribuna do Senado, Vasconcelos retomou as acusações feitas na *Veja*. Em\nseguida, foi novamente afastado da CCJ agora por Renan Calheiros, que se\nvaleu do fato de que Jarbas Vasconcelos não havia encaminhado ao partido\no pedido para integrar a CCJ, ao contrário do senador Francisco\nDornelles, do Partido Progressista (PP), escolhido para a vaga. Após ser\nnotificado do afastamento, Vasconcelos também deixou todas as comissões\npermanentes do Senado de que participava, entre elas a de Relações\nExteriores, Educação e Direitos Humanos. Afirmou ainda que não aceitaria\nqualquer indicação do seu nome para outras comissões pelo líder\npeemedebista, Renan Calheiros.\n\nCasou-se com Neide de Andrade Vasconcelos, com quem teve duas filhas.\n\nEscreveu *Uma análise da economia canavieira de Pernambuco*(1972) e\n*Plaqueta — liberdade e desenvolvimento* (1973).\n\nAndré Couto/Adrianna Setemy  (atualização)\n\n \n\nFONTES: *Brasil Extra* (10/85); CÂM. DEP. *Deputados;*CÂM. DEP.\n*Deputados brasileiros. R**epertório*(1975-1979);**COSTA, Célia &\nPANDOLFI, Dulce. *Projeto Memória Viva:*depoimentos sobre a política\npernambucana. Pernambuco: ALEPE, 2007. *Diário de Pernambuco*(31/3/2006;\ndisponível em: http://www.pernambuco.com/diario/2006/03/31/especial.asp;\nacessado em: 7/10/2009); *Estado de S. Paulo* (18/4 e 7/5/94);\n*Estadão.com.br.*(15/2/2009; disponível em:\nhttp://www.estadao.com.br/noticias/nacional,pmdb-decide-amanha-se-pune-jarbas-vasconcelos,324387,0.htm;\nacessado em: 15/2/2009); * Folha de S. Paulo* (31/12/96 e 15/7/98);\n*Folha on line.*(3/3/2009; disponível em:\nhttp://www1.folha.uol.com.br/folha/brasil/ult96u528779.shtml; acessado\nem: 8/10/2009; *Globo* (23/9/93, 5/2 e 14/4/94, 2/1 e 5/3/97); *O Globo \non line* (11/10/2007; disponível em:\nhttp://oglobo.globo.com/pais/moreno/posts/2007/10/11/lider-do-pmdb-convida-jarbas-simon-de-volta-ccj-76813.asp;\nacessado em: 8/10/2009);*Jornal* *do Brasil*(18/11/74, 2/7, 15/9 e\n2/11/77, 19/3, 13 e 20/8, 1/10, 11/11 e 1/12/78, 27, 28 e 30/1, 2 e\n14/2, 9 e 23/4, 31/7, 28/8, 20 e 30/9/79, 19/1/80, 18/11/85, 27/10/86,\n26/4/87, 5/10/92, 14/3/94, 14/4/95, 19/5 e 10/9/96); *JB on\nline.*(4/10/2008, 11/10/2008, 3/3/2009; disponível em:\nhttp://jbonline.terra.com.br/extra/2007/10/04/e041014104.html; acessado\nem: 8/10/2009);**NÉRI, S. *16;* SUAPE. *Histórico.*(Disponível em:\nhttp://www.suape.pe.gov.br/complexo\\_historico.asp; acessado em:\n1/12/2009); TRIB. SUP. ELEIT.*Dados*(9); TRIB. SUP. ELEIT.\n*Relação*(1998);*Veja*(27/11/74).\n\n \n","ref":"FONTES: *Brasil Extra* (10/85); CÂM. DEP. *Deputados;*CÂM. DEP.\n*Deputados brasileiros. R**epertório*(1975-1979);**COSTA, Célia &\nPANDOLFI, Dulce. *Projeto Memória Viva:*depoimentos sobre a política\npernambucana. Pernambuco: ALEPE, 2007. *Diário de Pernambuco*(31/3/2006;\ndisponível em: http://www.pernambuco.com/diario/2006/03/31/especial.asp;\nacessado em: 7/10/2009); *Estado de S. Paulo* (18/4 e 7/5/94);\n*Estadão.com.br.*(15/2/2009; disponível em:\nhttp://www.estadao.com.br/noticias/nacional,pmdb-decide-amanha-se-pune-jarbas-vasconcelos,324387,0.htm;\nacessado em: 15/2/2009); * Folha de S. Paulo* (31/12/96 e 15/7/98);\n*Folha on line.*(3/3/2009; disponível em:\nhttp://www1.folha.uol.com.br/folha/brasil/ult96u528779.shtml; acessado\nem: 8/10/2009; *Globo* (23/9/93, 5/2 e 14/4/94, 2/1 e 5/3/97); *O Globo \non line* (11/10/2007; disponível em:\nhttp://oglobo.globo.com/pais/moreno/posts/2007/10/11/lider-do-pmdb-convida-jarbas-simon-de-volta-ccj-76813.asp;\nacessado em: 8/10/2009);*Jornal* *do Brasil*(18/11/74, 2/7, 15/9 e\n2/11/77, 19/3, 13 e 20/8, 1/10, 11/11 e 1/12/78, 27, 28 e 30/1, 2 e\n14/2, 9 e 23/4, 31/7, 28/8, 20 e 30/9/79, 19/1/80, 18/11/85, 27/10/86,\n26/4/87, 5/10/92, 14/3/94, 14/4/95, 19/5 e 10/9/96); *JB on\nline.*(4/10/2008, 11/10/2008, 3/3/2009; disponível em:\nhttp://jbonline.terra.com.br/extra/2007/10/04/e041014104.html; acessado\nem: 8/10/2009);**NÉRI, S. *16;* SUAPE. *Histórico.*(Disponível em:\nhttp://www.suape.pe.gov.br/complexo\\_historico.asp; acessado em:\n1/12/2009); TRIB. SUP. ELEIT.*Dados*(9); TRIB. SUP. ELEIT.\n*Relação*(1998);*Veja*(27/11/74).\n\n \n","dic":"DHBB"}
