{"title":"VASCONCELOS, João de Sousa","cargoss":["Presidente de associação ou confederação de empregados ou empregadores"],"cargos_esp":["CNC"],"datas_ini":[1954],"datas_fim":[1956],"estados":[0],"autor":[0],"content":"**VASCONCELOS, João de Sousa**\n\n\\*pres. CNC 1954-1956.\n\n \n\n*João de Sousa Vasconcelos* nasceu em Campina Grande (PB) no dia 27 de\nmarço de 1898, filho de José Dias de Vasconcelos e de Maria Olímpia de\nSousa Vasconcelos.\n\nDepois de concluir o curso de contabilidade no Liceu Paraibano, na\ncidade da Paraíba (atual João Pessoa), retornou a Campina Grande, onde\niniciou suas atividades no comércio e na política. Em 1924, fundou a\nfirma Araújo Rique e Cia. em sociedade com João Rique e João Araújo, e\ntornou-se segundo-secretário do Conselho Municipal da cidade, órgão\ncorrespondente às atuais câmaras de vereadores. No ano seguinte, sem\nprejuízo de suas funções municipais, passou a atuar como adjunto do\npromotor da comarca local, e em 1926 foi fundador da Associação\nComercial de Campina Grande, tornando-se primeiro-secretário da\ndiretoria provisória então constituída.\n\nJoão de Sousa Vasconcelos apoiou a Aliança Liberal em 1930 e permaneceu\nno Conselho Municipal de Campina Grande até sua extinção, provocada pela\nrevolução vitoriosa de outubro desse ano. Em 1934, foi eleito deputado à\nAssembléia Constituinte estadual que se reuniu no ano seguinte, sendo\nescolhido para o cargo de primeiro-secretário. Manteve-se nessa função\ndurante a legislatura ordinária seguinte, suprimida com a implantação do\nEstado Novo em 10 de novembro de 1937.\n\nEntre 1940 e 1943, fez parte do Departamento Administrativo e do\nConselho Consultivo do Estado da Paraíba, além de colaborar nos jornais\nA Noite, A União, O Combate, Correio da Manhã e A Imprensa, de João\nPessoa. Participou do I Congresso Brasileiro de Economia, organizado em\n1943 pela Associação Comercial do Rio de Janeiro (então Distrito\nFederal), do I Congresso Brasileiro da Indústria em 1944 e da I\nConferência Nacional das Classes Produtoras em 1945. Nesse ano, com o\nprocesso de desagregação do Estado Novo e o conseqüente surgimento dos\nnovos partidos políticos, vinculou-se à União Democrática Nacional\n(UDN).\n\nTransferiu-se para o Rio de Janeiro em 1948. De 1952 a 1954, foi\nsecretário da Confederação Nacional do Comércio (CNC), sendo eleito em\nseguida presidente dessa entidade para o período 1954-1956. Como\natribuição desse cargo, exerceu também a presidência dos conselhos\nnacionais do Serviço Social do Comércio (Sesc) e do Serviço Nacional de\nAprendizagem Comercial (Senac). Durante seu mandato, manifestou a\npermanente oposição da CNC às “obras suntuárias” realizadas pelo governo\ne ao processo inflacionário, além de lutar pela atração dos capitais\nestrangeiros e a organização do crédito. Criou também o conselho de\nturismo da CNC, instituiu o Dia Nacional do Comerciante e assinou, em\nnome do governo brasileiro, acordo de assistência técnica ao turismo com\no Ponto IV, órgão oficial norte-americano.\n\nEm 1957, representou o Brasil na Organização Internacional do Trabalho\n(OIT), em Genebra, em nome dos empregadores. Nos anos seguintes, voltou\na participar ativamente da CNC, exercendo as funções de\nsegundo-diretor-tesoureiro (1958-1960), membro do conselho fiscal (1962)\ne terceiro-diretor-tesoureiro (1964). Em 1966, ingressou no conselho\ntécnico da entidade, organismo que veio a presidir mais tarde.\n\nJoão de Sousa Vasconcelos foi ainda diretor e sócio benemérito da\nAssociação Comercial do Rio de Janeiro (ACRJ), vice-presidente do\nConselho Interamericano de Comércio e Produção (CICYP), fundador da\nAcademia de Comércio de João Pessoa, e colaborador dos jornais A\nPalavra, O Correio de Campina e Diário de Pernambuco. Como empresário,\nfoi presidente da Cia. Comércio e Prensagem de Algodão (com atuação na\nParaíba e no Rio de Janeiro), diretor da Cia. Comissária e Exportadora\nde Algodão (Rio e São Paulo), além de fundador e presidente da firma\nparaibana Sibrasil, mais tarde Brascorda (Brasil Cordas S.A.).\n\nFaleceu no Rio de Janeiro em 21 de junho de 1972.\n\nCasou-se com Severina de Araújo Vasconcelos, com quem teve sete filhos.\n\nDeixou publicadas as seguintes obras: Problemas e necessidades da\nParaíba (1931), Notas da Europa (coletânea de artigos publicados em A\nImprensa, 1937) e uma coletânea de discursos, artigos e conferências\npublicada pela CNC e as associações comerciais de Campina Grande, João\nPessoa e Rio de Janeiro.\n\nSônia Dias\n\n \n\n \n\nFONTES: ALMEIDA, E. História; CONF. NAC. COMÉRCIO. 20; CONSULT.\nMAGALHÃES, B.; CORRESP. CONF. NAC. COMÉRCIO; CURRIC. BIOG.\n\n \n","ref":"FONTES: ALMEIDA, E. História; CONF. NAC. COMÉRCIO. 20; CONSULT.\nMAGALHÃES, B.; CORRESP. CONF. NAC. COMÉRCIO; CURRIC. BIOG.\n\n \n","dic":"DHBB"}
