{"title":"VASCONCELOS, Meira de","cargoss":["Comandante da 1ª Região Militar"],"cargos_esp":[0],"datas_ini":[1938],"datas_fim":[1939],"estados":[0],"autor":[0],"content":"**VASCONCELOS, Meira de**\n\n\\*militar; comte. 1ª RM 1938-1939.\n\n \n\n*José Meira de Vasconcelos* nasceu em Sousa (PB) no dia 24 de abril de\n1878.\n\nSentou praça em fevereiro de 1895 e deu baixa no mês seguinte,\nalistando-se novamente em fevereiro de 1896. Alferes-aluno em fevereiro\nde 1902, foi promovido a segundo-tenente de cavalaria em janeiro de 1907\ne a primeiro-tenente em março de 1909.\n\nRecebeu a patente de capitão em abril de 1917, ano em que assumiu o\ncomando de um esquadrão no Rio Grande do Sul. Em 1920, ingressou no\ncurso de Estado-Maior do Exército. Elevado, em outubro de 1922, à\npatente de major, entre 1924 e 1925 participou no Paraná do combate aos\nrevoltosos do Segundo 5 de Julho. O movimento, liderado pelo general\nIsidoro Dias Lopes, visava a deposição do presidente Artur Bernardes,\ntendo dominado a capital paulista por quase um mês. Seus integrantes\nretiraram-se em seguida para o oeste do Paraná. Em abril de 1925,\nreuniram-se nessa região aos rebeldes gaúchos, para formar a Coluna\nPrestes.\n\nEm junho de 1926, Meira de Vasconcelos alcançou a patente de\ntenente-coronel. Após chefiar o gabinete do general Tasso Fragoso, foi\npromovido a coronel em julho de 1928, assumindo em seguida o comando da\nBrigada de Cavalaria do Rio Grande do Sul.\n\nEm 1930, tinha conhecimento das articulações que se processavam para\ndepor o presidente Washington Luís. Em outubro desse ano, encontrava-se\nem Bajé (RS).\n\nColaborou, em 1934, com A Ofensiva, semanário integralista que circulou\na partir de maio desse ano.\n\nEm setembro de 1934, foi promovido a general-de-brigada. Em dezembro de\n1935, participou da reunião de generais realizada no Rio de Janeiro em\nconseqüência do levante comunista ocorrido em novembro. O objetivo do\nencontro era o exame da situação pela qual passava o país, bem como a\ndiscussão da insuficiência, para punir os revoltosos, das leis\nrepressivas existentes. Além dos generais João Gomes Ribeiro Filho,\nministro da Guerra, Pedro Aurélio de Góis Monteiro, chefe do\nEstado-Maior do Exército, e Eurico Gaspar Dutra, comandante da 1ª Região\nMilitar (1ª RM), toda a alta cúpula do Exército estava presente.\n\nNessa reunião, Meira de Vasconcelos opinou no sentido de que fosse dada\nao governo, durante curto prazo, uma lei de exceção para punir com\nseveridade os responsáveis pelo levante. Também sugeriu que a\nConstituição recebesse emendas de forma a prever medidas rigorosas de\nrepressão aos que atentassem contra a segurança nacional. Como os demais\npresentes, apoiou o ministro da Guerra para que agisse junto aos poderes\ncompetentes no sentido de punir os atos praticados o mais rapidamente\npossível e com base em penas superiores às previstas na legislação então\nvigente.\n\nEm agosto de 1937, substituiu no comando da 5ª RM o general João Guedes\nda Fontoura, afastado do posto devido ao seu apoio à candidatura do\noposicionista Armando de Sales Oliveira à sucessão presidencial. Em\nfevereiro de 1938, foi promovido a general-de-divisão e, em 15 de julho\ndesse ano, assumiu o comando da 1ª RM, sediada no Rio de Janeiro, então\nDistrito Federal, tendo permanecido nesse posto até 12 de junho de 1939.\n\nDuas semanas mais tarde, no dia 26 de junho, tomou posse na presidência\ndo Clube Militar, conquistada em eleições às quais concorrera\nencabeçando chapa única. Perto do final de sua gestão, previsto para\njunho de 1941, teve seu mandato prorrogado por mais três anos, deixando\no cargo apenas em 1944.\n\nAo longo de sua carreira, Meira de Vasconcelos também chefiou a 2ª\nSubseção do Estado-Maior do Exército, comandou a 8ª RM, sediada em\nBelém, e foi inspetor do 1º Grupo de Regiões Militares, função que\nexerceu até março de 1942, quando foi transferido para a reserva.\n\nFaleceu no Rio de Janeiro em 1959.\n\nRenato Lemos\n\n \n\n \n\nFONTES: Almanaque da PB; BIJOS, G. Clube; BITTENCOURT, L. Homens 2;\nCARONE, E. República nova; LAGO, L. Generais; LAGO, L. Relação; LEVINE,\nR. Vargas; MIN. GUERRA. Almanaque; Ofensiva; SILVA, H. 1937.\n\n \n","ref":"FONTES: Almanaque da PB; BIJOS, G. Clube; BITTENCOURT, L. Homens 2;\nCARONE, E. República nova; LAGO, L. Generais; LAGO, L. Relação; LEVINE,\nR. Vargas; MIN. GUERRA. Almanaque; Ofensiva; SILVA, H. 1937.\n\n \n","dic":"DHBB"}
