{"title":"VAZ, Wilson","cargoss":["Deputado federal"],"cargos_esp":[0],"datas_ini":[1983],"datas_fim":[1987],"estados":["MG"],"autor":[0],"content":"**VAZ, Wilson**\n\n\\*dep. fed. MG 1983-1987.\n\n*Wilson Vaz*nasceu em Colatina (ES) no dia 12 de maio de 1928, filho de\nHonório Vaz Júnior e de Amélia Rocha Vaz.\n\nMudou-se para Governador Valadares (MG), onde tornou-se comerciante e\nempresário. Filiado ao Partido Social Progressista (PSP), em outubro de\n1962 foi eleito vereador. Com a instauração do bipartidarismo pelo Ato\nInstitucional nº 2 (AI-2), assinado em 27 de outubro de 1965, fundou no\nmunicípio o Movimento Democrático Brasileiro (MDB), partido de oposição\nao regime militar instituído no país em abril de 1964. Deixou a Câmara\nde Vereadores em janeiro de 1967, ao final da legislatura.\n\nEm novembro de 1978, disputou uma cadeira na Assembléia Legislativa de\nMinas Gerais e foi empossado em fevereiro do ano seguinte. A extinção do\nbipartidarismo e a reorganização do quadro partidário, em novembro de\n1979, levaram-no a ingressar no Partido Popular (PP), liderado\nnacionalmente por Tancredo Neves. Permaneceu no partido até fevereiro de\n1982, quando a agremiação foi incorporada ao Partido do Movimento\nDemocrático Brasileiro (PMDB), que aglutinara os remanescentes do MDB.\nAcompanhando a maioria dos correligionários, Wilson Vaz aderiu à legenda\npeemedebista.\n\nDurante a legislatura 1979-1983, foi vice-presidente e membro da\nComissão de Fiscalização Financeira e Tomada de Contas da Assembléia\nLegislativa mineira. Na eleição de novembro de 1982, elegeu-se deputado\nfederal. Na Câmara, atuou na Comissão de Fiscalização Financeira e\nTomada de Contas e, como suplente, na Comissão de Finanças.\n\nEm 25 de abril de 1984, votou a favor da emenda Dante de Oliveira, que\npropunha o restabelecimento de eleições diretas para presidente da\nRepública em novembro daquele ano. Rejeitada a emenda, o governo\nconvocou o Colégio Eleitoral para escolher, pelo voto indireto, em 15 de\njaneiro do ano seguinte, o sucessor do presidente João Batista\nFigueiredo. Wilson Vaz votou em Tancredo Neves, candidato vitorioso da\nAliança Democrática, coligação oposicionista que uniu o PMDB à\ndissidência do Partido Democrático Social (PDS) reunida na Frente\nLiberal. Tancredo venceu Paulo Maluf, candidato governista, mas não\nchegou a tomar posse porque ficou gravemente doente e morreu em 21 de\nabril de 1985. Assumiu o vice-presidente José Sarney, que já vinha\nexercendo interinamente a chefia do Executivo desde 15 de março.\n\nDerrotado no pleito de outubro de 1986, quando disputou uma vaga na\nAssembléia Nacional Constituinte, Wilson Vaz deixou a Câmara no início\nde 1987, ao final da legislatura. Com o objetivo de disputar as eleições\nde outubro de 1990, juntou recursos em um fundo de *overnight*. Em março\nfoi surpreendido pelo confisco imposto pelo governo de Fernando Collor\nde Melo (1990-1992). Indignado e sem dinheiro, decidiu abandonar a\npolítica e dedicar-se aos negócios particulares.\n\nViúvo, teve cinco filhos.\n\nFONTES: ASSEMB. LEGISL. MG. *Dicionário biográfico;*CÂM. DEP. *Deputados\nbrasileiros. Repertório*(10); *Globo* (26/4/84 e 16/1/85); INF. BIOG.;\n*Jornal do Brasil* (18/3/90).\n\n \n","ref":"FONTES: ASSEMB. LEGISL. MG. *Dicionário biográfico;*CÂM. DEP. *Deputados\nbrasileiros. Repertório*(10); *Globo* (26/4/84 e 16/1/85); INF. BIOG.;\n*Jornal do Brasil* (18/3/90).\n\n \n","dic":"DHBB"}
