{"title":"VELASCO, Paulo de","cargoss":["Deputado federal"],"cargos_esp":[0],"datas_ini":[1995],"datas_fim":[2003],"estados":["SP"],"autor":["Cristiano Sanches","Marcelo Costa"],"content":"**VELASCO, Paulo de**\n\n\\*dep. fed. SP 1995-2003.\n\n*Paulo César Marques de Velasco* nasceu em Curvelo (MG) no dia 10 de\nfevereiro de 1937, filho de Antônio José de Velasco Júnior e de Dora\nViana Marques Velasco.\n\nEstabelecido no Rio de Janeiro como profissional da área de comunicação,\ndurante o ano de 1964 trabalhou em noticiários das rádios Guanabara e\nCarioca, bem como no programa *Mesa redonda*, capitaneado por Gílson\nAmado, da TV Continental, passando a integrar, no ano seguinte, a equipe\nde telejornalismo da TV Tupi.\n\nFez curso de inglês na Universidade de Berkeley, na Califórnia (EUA), em\n1969, tendo viajado, neste ano e no seguinte, em missão cultural ao\nChile, enviado pelo Itamarati. No período que se seguiu, deu\nprosseguimento aos estudos nas áreas de direito e comunicações.\n\nFuncionário do Banco do Estado do Rio de Janeiro (Banerj) a partir de\n1970, integrado à diretoria de recursos humanos, em 1976 tornou-se\ngerente-geral do banco, tendo coordenado a unificação do Banco do Estado\nda Guanabara (BEG) com o Banco do Estado do Rio de Janeiro (Berj). Foi\ndiretor da Serviços Gerais e Empreendimentos Ltda., de 1979 a 1985,\nquando assumiu a diretoria da Interplan. No ano seguinte ocupou\ncumulativamente os cargos de gerente de treinamento e gerente comercial\nda Gold Invest, Indústria e Comércio de Ouro S.A., assumindo em 1987 a\nfunção de superintendente comercial da Zurich Trade do Brasil S.A.\n\nAinda em 1987, tornou-se pastor evangélico da Igreja Universal do Reino\nde Deus, da qual seria secretário-geral suplente. No mesmo ano, além de\nparticipações diversas no meio radiofônico, foi debatedor do programa\n*Canal livre*, tendo atuado, já em 1989, no programa *Nei Gonçalves\nDias*, ambos veiculados pela Rede Bandeirantes de Televisão.\n\nTambém em 1989, filiou-se ao Partido da Reconstrução Nacional (PRN),\nagremiação criada para dar sustentação à candidatura vitoriosa de\nFernando Collor de Melo à presidência da República no pleito de\nnovembro/dezembro daquele ano. Foi diretor-geral da Rádio Ipanema e do\nprograma *Do outro lado da cidade*, veiculado pela Rádio São Paulo, que\nproduziu e apresentou até 1990, ano em assumiu o cargo\nde****comentarista político do programa *Record em notícias*,\ncumulativamente com o de diretor administrativo e financeiro da Rede\nRecord de Rádio e Televisão, de propriedade da Igreja Universal do Reino\nde Deus.\n\nEleito deputado à Assembléia Legislativa de São Paulo em outubro de\n1990, logo após iniciar o mandato, em fevereiro de 1991, desligou-se do\nPRN para ingressar no Partido Social Trabalhista (PST), onde permaneceu\npouco tempo, filiando-se ao Partido Social Democrático (PSD). No mesmo\nano, já como representante do PSD, integrou a Comissão Parlamentar de\nInquérito (CPI) que apurou fatos relacionados à violência física\nperpetrada contra crianças e adolescentes no estado, assumiu a\nvice-liderança do seu partido na Assembléia paulista e participou dos\ntrabalhos legislativos como membro das comissões de Promoção Social e de\nTransporte e Comunicações.\n\nEm 1993, tornou-se primeiro-secretário do Conselho de Pastores de São\nPaulo e presidente da Comissão de Ética do Conselho Nacional de Pastores\ndo Brasil. No ano seguinte, além de participar da CPI instaurada na\nAssembléia paulista para apurar a ocorrência de atividades ilícitas\nligadas ao jogo do bicho, tornou-se segundo-vice-presidente da executiva\nnacional do PSD.\n\nEleito deputado federal em outubro de 1994, com a maioria dos votos\nproveniente de sua base eleitoral na Grande São Paulo, assumiu o mandato\nem fevereiro do ano seguinte, tornando-se membro das comissões de\nConstituição e Justiça, de Direitos Humanos, de Relações Exteriores e de\nDefesa Nacional da Câmara dos Deputados.\n\nNas votações das emendas constitucionais enviadas ao Legislativo pelo\ngoverno Fernando Henrique Cardoso, foi favorável à distribuição de gás\ncanalizado, à abertura da navegação de cabotagem à concorrência\ninternacional, ao fim de todas as diferenciações legais entre empresas\nbrasileiras e estrangeiras, à abolição do monopólio estatal nas\ntelecomunicações e à prorrogação do Fundo Social de Emergência (FSE),\nrebatizado de Fundo de Estabilização Fiscal (FEF), que permitia ao\ngoverno gastar 20% da arrecadação de impostos sem vinculação obrigatória\naos setores de saúde e educação. Opôs-se, todavia, à quebra do monopólio\nestatal na exploração do petróleo.\n\nEm fevereiro de 1996, assumiu o cargo de secretário-geral da Igreja\nUniversal do Reino de Deus, após a divulgação de um vídeo pela Rede\nGlobo de Televisão, em que membros da igreja apareciam esbanjando\nrecursos arrecadados de fiéis e o bispo Honorílton Gonçalves, então\nsecretário-geral, protagonizava****cenas de simulação sexual.\n\nNa atuação parlamentar, votou a favor da criação da Contribuição\nProvisória sobre Movimentação Financeira (CPMF), taxa de 0,2% sobre as\ntransações bancárias, estabelecida em junho do mesmo ano como fonte\ncomplementar de recursos para a saúde, e que substituiu o Imposto\nProvisório sobre Movimentação Financeira (IPMF). Ainda em 1996, integrou\na Comissão de Viação e Transportes da Câmara dos Deputados.\n\nEm janeiro/fevereiro de 1997, apoiou a emenda da reeleição para\npresidente da República, governadores e prefeitos. Em julho seguinte,\ndesligou-se do PSD e se filiou ao Partido da Reedificação da Ordem\nNacional (Prona), objetivando candidatar-se à reeleição por um partido\ndotado de maior estrutura, que ficaria com mais um deputado federal,\nampliando assim a sustentação política da candidatura presidencial de\nEnéias Carneiro no pleito de outubro de 1998. Ainda em julho, negou que\ndeputados ligados à Igreja Universal tivessem fechado um acordo com o\ngoverno federal para votarem a favor da quebra da estabilidade dos\nservidores públicos. Pelo suposto acordo, a Receita Federal não autuaria\na Igreja, em uma grande soma, por sonegação fiscal. Em novembro, Paulo\nde Velasco votou a favor da quebra da estabilidade do servidor público,\nitem da reforma administrativa.\n\nReeleito em outubro de 1998, desta vez na legenda do Prona, permaneceu\nno exercício parlamentar, tendo votado, no mês de novembro, a favor do\nteto de 1.200 reais para aposentadorias no setor público e do\nestabelecimento de idade mínima e tempo de contribuição no setor\nprivado, itens que definiram a reforma da previdência. Logo após tomar\nposse no novo mandato, em fevereiro de 1999, desligou-se do Prona para\ningressar no Partido Social Trabalhista (PST) e tornou-se líder do\npartido até 2000. Ainda em 1999 realizou um curso de especialização em\nPolíticas Públicas na Escola de Políticas Públicas e Governo na\nUniversidade Federal do Rio de Janeiro (UFRJ). Em 2000 filiou-se ao\nPartido Social Liberal (PSL), e foi vice-líder do partido de 2000 a\n2002. Em outubro desse último ano, disputou o mandato de deputado\nestadual na legenda do PSL, mas não obteve êxito. Deixou a Câmara dos\nDeputados em janeiro de 2003.\n\nEm maio de 2006, após investigação conduzida junto com o Ministério\nPúblico, a Polícia Federal deflagrou a chamada Operação Sanguessuga,\npara desarticular um esquema de fraudes em licitações para a compra, com\ndinheiro público, de ambulâncias superfaturadas, possibilitado pela\napresentação de emendas ao Orçamento por parlamentares. Entre os\nacusados figurou o nome de Velasco. Devido a essa investigação, em\nagosto, o Ministério Público do Mato Grosso apresentou denúncia contra\nVelasco à Justiça.\n\nAlém das mais diversas participações em congressos e seminários, foi\ndiretor do Lions Club do Brasil, no Rio de Janeiro, e vice-presidente da\nSociedade Pestalozzi de São Paulo. Foi também conferencista em vários\nfóruns de teologia, bem como no Encontro de Prefeitos do Paraná e de\nSanta Catarina, em Curitiba, e na Marcha para Jesus, em Brasília.\n\nCasou-se com Leni Reis Marques de Velasco, com quem teve quatro filhas.\n\nCristiano Sanches/Marcelo Costa\n\nFONTES: CÂM. DEP. *Deputados brasileiros. Repertório*(1995-1999);*Folha\nde S. Paulo* (1 e 11/7/97, 29/9, 31/8/06 e *Especial* 6/11/98, 3/2/99);\nGlobo (5/2/96 e 10/10/98);*Jornal do Brasil* (15/6/97);*Olho no\nCongresso/Folha de S. Paulo*(31/1/95 e 14/1/96); Portal da Fundação\nSEADE; TRIB. REG. ELEIT. SP. *Relação* (1998).\n\n \n","ref":"FONTES: CÂM. DEP. *Deputados brasileiros. Repertório*(1995-1999);*Folha\nde S. Paulo* (1 e 11/7/97, 29/9, 31/8/06 e *Especial* 6/11/98, 3/2/99);\nGlobo (5/2/96 e 10/10/98);*Jornal do Brasil* (15/6/97);*Olho no\nCongresso/Folha de S. Paulo*(31/1/95 e 14/1/96); Portal da Fundação\nSEADE; TRIB. REG. ELEIT. SP. *Relação* (1998).\n\n \n","dic":"DHBB"}
