{"title":"VELOSO, Haroldo","cargoss":["Deputado federal"],"cargos_esp":[0],"datas_ini":[1967],"datas_fim":[1969],"estados":["PA"],"autor":[0],"content":"**VELOSO, Haroldo**\n\n\\*militar; rev. Jacareacanga; rev. Aragarças; dep. fed. PA 1967-1969.\n\n \n\n*Haroldo Coimbra Veloso* nasceu no Rio de Janeiro, então Distrito\nFederal, no dia 4 de julho de 1920, filho de Paulo Veloso e de Diva\nCoimbra Veloso.\n\nSentou praça em abril de 1939, ingressando na Escola Militar do\nRealengo, no Rio. Em setembro de 1942, foi declarado aspirante-aviador,\njá no âmbito da recém-criada Força Aérea Brasileira (FAB), sendo\npromovido a primeiro-tenente-aviador em novembro de 1944 e a\ncapitão-aviador em maio de 1946. Fez o curso de engenharia aérea e em\nabril de 1951 foi promovido a major-aviador.\n\n \n\nA Revolta de Jacareacanga\n\nApós o suicídio de Getúlio Vargas (24/8/1954), delineou-se o quadro\nsucessório com a indicação, pelo Partido Social Democrático (PSD), da\ncandidatura do então governador de Minas Gerais, Juscelino Kubitschek.\nLogo em seguida, estabeleceu-se a aliança entre o PSD e o Partido\nTrabalhista Brasileiro (PTB), sendo João Goulart indicado candidato à\nvice-presidência. Essa aliança fez recrudescer a oposição da União\nDemocrática Nacional (UDN) e levou alguns chefes militares a se\nmanifestarem contra a candidatura de Goulart, acusado de esquerdista. Ao\nmesmo tempo, o setor mais radical da UDN pregava um golpe de Estado para\nimpedir as eleições, que, todavia, foram realizadas em outubro de 1955,\ndando a vitória a Juscelino Kubitschek e João Goulart.\n\nEm 9 de novembro seguinte, com o afastamento do presidente João Café\nFilho por motivo de saúde, o governo foi assumido pelo presidente da\nCâmara dos Deputados, Carlos Luz, que havia sido contrário à candidatura\nde Juscelino. No dia 11, o general Henrique Teixeira Lott, ministro da\nGuerra demissionário, liderou um movimento militar que provocou o\nimpedimento de Carlos Luz, acusado de aderir a uma conspiração em\npreparo no âmbito do governo para impedir a posse dos eleitos,\nempossando na chefia da nação o vice-presidente do Senado, Nereu Ramos.\nFicou assim garantida a posse de Juscelino e Goulart, que ocorreu em 31\nde janeiro de 1956, apesar dos protestos da UDN e do descontentamento de\nalguns segmentos das forças armadas.\n\nHaroldo Veloso representava um setor da Aeronáutica descontente com o\nregime desde a primeira derrota do brigadeiro Eduardo Gomes, em 1945, e\nsensível às pregações udenistas. Assim, em 1956, liderou a Revolta de\nJacareacanga, lugarejo situado no município de Itaituba (PA), próximo à\nfronteira com o Amazonas e a 300km de Manaus. O levante, de oposição à\ncorrente militar que patrocinou o Movimento do 11 de Novembro de 1955,\nvisava destituir o presidente e o vice-presidente recém-empossados.\n\nNo dia 11 de fevereiro de 1956, Haroldo Veloso partiu do Parque da\nAeronáutica dos Afonsos, no Rio de Janeiro, apoderando-se, com outros\ncompanheiros, de um avião bimotor Beechcraft repleto de armas,\nexplosivos e bombas descarregadas, com destino à base de Cachimbo, no\nPará. A meta final, no entanto, era Jacareacanga, às margens do rio\nTapajós, onde pretendiam estabelecer seu quartel-general. Chegando a\nessa localidade, apossaram-se da estação de rádio da Aeronáutica e\npassaram a comandar o pequeno destacamento militar e os trabalhadores\ncivis, além de ampliarem a resistência armando índios e seringueiros que\nresidiam nas proximidades. Uma semana depois receberam a adesão do major\nPaulo Vítor da Silva e interditaram as cidades paraenses de Itaituba,\nBelterra e Santarém por meio de tambores de gasolina vazios, colocados\nno rio Tapajós. O domínio de Santarém causou grandes transtornos à vida\nda região, pois a cidade era um ponto importante para a navegação\nfluvial e também a base onde se reabasteciam os aviões comerciais que\nfaziam a linha Belém-Manaus.\n\nAo tomar providências para reprimir a rebelião, contando com o Exército\ne um pequeno número de oficiais-aviadores, Juscelino Kubitschek sentiu\nenormes dificuldades para organizar suas forças. Tanto o ministro da\nAeronáutica, brigadeiro Vasco Alves Seco, quanto um comandante da\nMarinha, em Belém, recusaram-se a cooperar com o governo na repressão à\nrevolta. Nos dias subseqüentes, muitos membros de bases aéreas de\nSalvador, Belém e Fortaleza chegaram a ser presos por se solidarizarem\ncom Haroldo Veloso. A imprensa udenista divulgou amplamente o fato, que\nconsiderou uma evidência da falta de apoio do novo governo.\n\nNo dia 27 de fevereiro, o confronto entre a tropa legalista da\nAeronáutica e elementos civis ligados a Veloso causou a fuga dos líderes\nda revolta. Dois dias depois, encontrado em seu refúgio às margens do\nrio Tapajós, Haroldo Veloso foi preso e conduzido a Santarém, onde ficou\ndetido a bordo do navio Getúlio Vargas. Levado para Belém, respondeu a\ninquérito policial-militar enquanto permanecia preso no Parque da\nAeronáutica. Seus companheiros José Lameirão e Paulo Vítor fugiram num\navião C-47 com destino a Santa Cruz de la Sierra, na Bolívia, onde\npediram asilo.\n\nNo dia seguinte à prisão de Veloso, 1º de março de 1956, Juscelino\nKubitschek enviou ao Congresso o anteprojeto de lei que concedia anistia\ngeral a todos os que tivessem conspirado contra o governo desde 10 de\nnovembro de 1955. Com a anistia, o presidente conseguiu conter os\nsetores militares, aos quais não interessavam represálias e\ninvestigações de sobre quem conspirava ou não contra o governo. Ao mesmo\ntempo, ao impedir a radicalização dos conflitos, Juscelino\napresentava-se como o presidente da paz e da concórdia, mantendo os\nudenistas na função específica de oposição direitista e radical. Em 20\nde janeiro de 1958, já reintegrado em suas atividades na Aeronáutica,\nHaroldo Veloso foi promovido a tenente-coronel-aviador.\n\n \n\nA Revolta de Aragarças\n\nNo final do governo Kubitschek, já articulada a sucessão presidencial,\nJânio Quadros apresentava-se como o único candidato capaz de derrotar a\ncoligação entre o PSD e o PTB, que se achava no poder. Apesar de\napartidário, Jânio Quadros contava com o apoio da UDN e dos setores\nmilitares descontentes com o rumo político assumido pelo governo\nKubitschek, inclusive o setor da Aeronáutica que participara da Revolta\nde Jacareacanga.\n\nEm 25 de novembro de 1959, a renúncia de Jânio como candidato às\neleições presidenciais de 1960 e a suspeita de uma conspiração de\nesquerda que seria liderada por Leonel Brizola geraram outra crise\nmilitar — a Revolta de Aragarças. Haroldo Veloso participou também desse\nmovimento liderado por João Paulo Burnier. No dia 2 de dezembro de 1959,\napoderou-se de um avião de linha comercial em pleno vôo e obrigou a\ntripulação a levar o aparelho à localidade de Aragarças (GO), de onde os\nrevoltosos iniciariam uma luta para derrubar Kubitschek e evitar um\ngolpe contra o candidato Jânio Quadros, depois eleito. A revolta\nenvolveu uns poucos aderentes e foi debelada em três dias. Ainda no\ngoverno Kubitschek, Haroldo Veloso foi novamente anistiado e\nreincorporado à FAB.\n\n \n\nApós 1964\n\nConsumada a vitória do movimento político-militar de 31 de março de\n1964, que destituiu o presidente João Goulart, Haroldo Veloso requereu\nsua entrada para a reserva remunerada como brigadeiro. Em novembro do\nmesmo ano, fez vôos rasantes sobre o palácio do governo goiano, onde o\ngovernador Mauro Borges resistia ao ato de cassação de seu mandato,\ndecretado pelo governo do marechal Humberto Castelo Branco.\n\nCom a edição do Ato Institucional nº 2 (26/10/1965) e a posterior\ninstauração do bipartidarismo, Veloso filiou-se à Aliança Renovadora\nNacional (Arena), de orientação governista. No pleito de novembro de\n1966, elegeu-se deputado federal pelo Pará na legenda da Arena com\n12.156 votos, o que lhe conferiu o sétimo lugar na bancada paraense. A\ncidade de Santarém, próxima de Jacareacanga e de Aragarças, foi seu\nmaior reduto eleitoral. Ocupou uma cadeira na Câmara em fevereiro de\n1967.\n\nEm 1968, em Santarém, à frente de pessoas da cidade, marchou sobre a\nprefeitura local para devolvê-la ao prefeito, que fora afastado por\ndecisão da Câmara de Vereadores e havia ganho recurso em instância\nsuperior. Diante dessa manifestação pública, o delegado de Santarém deu\nordem de fogo, causando a morte de três pessoas e deixando Haroldo\nVeloso ferido.\n\nAo longo de seu mandato, Veloso denunciou a existência, na Amazônia, de\naeroportos clandestinos que serviam a empresas estrangeiras.\n\nFaleceu no Rio de Janeiro em 22 de outubro de 1969.\n\nFoi casado com Maria de Lurdes Leal Veloso.\n\n \n\n \n\nFONTES: CÂM. DEP. Deputados; CÂM. DEP. Deputados brasileiros. Repertório\n(6); CARNEIRO, G. História; Grande encic. Delta; KUBITSCHEK, J. Meu;\nMIN. AER. Almanaque (1963); WANDERLEY, N. História.\n\n \n","ref":"FONTES: CÂM. DEP. Deputados; CÂM. DEP. Deputados brasileiros. Repertório\n(6); CARNEIRO, G. História; Grande encic. Delta; KUBITSCHEK, J. Meu;\nMIN. AER. Almanaque (1963); WANDERLEY, N. História.\n\n \n","dic":"DHBB"}
