{"title":"VELOSO, Nílton","cargoss":["Deputado federal"],"cargos_esp":[0],"datas_ini":[1983],"datas_fim":[1987],"estados":["MG"],"autor":[0],"content":"**VELOSO, Nílton**\n\n\\*dep. fed. MG 1983-1987.\n\n \n\n*Nílton Moreira Veloso* nasceu em Belo Horizonte no dia 18 de maio de\n1920, filho do industrial Sila Moss Veloso e de Maria Carmelita Moreira\nVeloso.\n\nComeçou sua trajetória empresarial ainda jovem, tornando-se, em 1940,\npresidente da Veloso S.A. — Comércio e Indústria Gráfica, cargo que\nocuparia durante 38 anos.\n\nIniciou sua carreira política em setembro de 1947, ao eleger-se vereador\nem Belo Horizonte, na legenda da União Democrática Nacional (UDN), sendo\nempossado no cargo em dezembro seguinte. Dois anos mais tarde,****atuou\ncomo presidente da editora responsável pela publicação do matutino\n*Diário de Minas*.\n\nDeixando a Câmara de Belo Horizonte em 31 de janeiro de 1951, ao final\nde seu mandato, três anos depois assumiu a presidência do Sindicato da\nIndústria Gráfica de Minas, função que desempenhou até 1962. Em 1956,\nfoi indicado para presidir a Federação do Comércio do Estado de Minas\nGerais e, no ano seguinte, tornou-se membro dos diretórios municipal de\nBelo Horizonte e estadual da UDN, nos quais permaneceria até 1965. Em\n1958 foi eleito presidente do Sindicato do Comércio Lojista de Belo\nHorizonte, cargo que ocupou por dez anos. Em 1959 participou, como\nrepresentante do comércio brasileiro, da reunião da Organização\nInternacional do Trabalho (OIT) e, no ano seguinte, esteve presente à X\nConferência Internacional de Serviço Social, realizada na cidade de\nRoma, na Itália.\n\nEm 1961, deixou a presidência da Federação do Comércio do Estado de\nMinas Gerais (FCE-MG). Tornou-se membro da comissão executiva nacional\nda Universidade do Trabalho no governo de Jânio Quadros (1961) e diretor\ndas Usinas Siderúrgicas de Minas Gerais (Usiminas), cuja função exerceu\naté 1963, quando assumiu a presidência da Caixa Econômica do Estado de\nMinas Gerais no governo de José de Magalhães Pinto (1961-1966). Ainda em\n1963, foi eleito presidente do diretório estadual da UDN em Minas\nGerais, por cuja atribuição responderia até 1965. Em 1964, tornou-se\nmembro do conselho de administração do Banco Nacional da Habitação, ao\nqual esteve ligado por nove anos.\n\nCom a instauração pelo governo militar do sistema político bipartidário\nem outubro de 1965, filiou-se à Aliança Renovadora Nacional (Arena),\npartido de sustentação do regime militar instalado no país em abril do\nano anterior. Em janeiro de 1966, ao final da gestão de Magalhães Pinto,\ndeixou a presidência da Caixa Econômica mineira. Ainda no mesmo ano,\ncompareceu à XIII Conferência Internacional de Serviço Social, sediada\nem Washington (EUA) e à III Reunião Interamericana dos Países Americanos\nmembros da OIT, realizada em Otawa, no Canadá, como delegado patronal do\npaís.\n\nFoi presidente do conselho de administração de O Diário, periódico de\norientação católica publicado em Belo Horizonte entre 1966 e 1968. Neste\núltimo ano realizou um curso de especialização na World Saving and Loan\nAssociation, em Los Angeles, nos Estados Unidos, e foi indicado\nsecretário-geral da Arena na capital mineira, função que desempenhou até\n1970.\n\nEm 1969 tornou-se presidente da Associação Brasileira de Entidades de\nCrédito Imobiliário e Poupança (ABECIP), cabendo-lhe exercer dois\nmandatos, o primeiro até 1972 e, o segundo, de 1973 a 1977. De 1971 a\n1972, foi presidente da União Interamericana de Poupança e Empréstimo\npara Habitação, função à qual voltaria entre 1978 e 1979. No ano de\n1974, fez uma viagem à Alemanha Ocidental para estudar o sistema de\npoupança e empréstimo daquele país.\n\nCom a extinção do bipartidarismo em 29 de novembro de 1979 e a\nconseqüente reformulação partidária, filiou-se ao Partido Democrático\nSocial (PDS), agremiação que aglutinou os remanescentes da Arena. No ano\nseguinte, voltou a ocupar a presidência da FCE-MG, na qual permaneceu\ndurante seis anos. Em 1981, participou de uma missão comercial\nbrasileira ao sudoeste da Ásia como representante do Ministério das\nRelações Exteriores.\n\nEm novembro de 1982, elegeu-se deputado federal, tomando posse no início\ndo ano seguinte. Nílton Veloso não compareceu à sessão da Câmara dos\nDeputados de 25 de abril de 1984 que apreciou a emenda Dante de\nOliveira, visando restabelecer as eleições diretas para presidente da\nRepública, marcando-as para novembro seguinte. Constatada a\ninsuficiência de votos para que a emenda fosse enviada ao Senado\nFederal, convocou-se, em 15 de janeiro de 1985, o Colégio Eleitoral. Deu\no seu voto a Tancredo Neves, eleito presidente da República pela Aliança\nDemocrática, coligação do Partido do Movimento Democrático Brasileiro\n(PMDB) com a dissidência do PDS abrigada na Frente Liberal, que derrotou\nPaulo Maluf, lançado pela legenda pedessista. Acometido por uma grave\nenfermidade, que o vitimou em 21 de abril de 1985, Tancredo Neves não\nchegou a ser empossado na presidência. Substituiu-o no cargo o vice,\nJosé Sarney.\n\nNílton Veloso****deixou a Câmara dos Deputados em janeiro de 1987, ao\ntérmino da legislatura, não tendo concorrido a um novo mandato em\noutubro do ano anterior.****Durante a legislatura 1983-1987, integrou a\nComissão do Interior e foi suplente da Comissão de Economia, Indústria e\nComércio.\n\nAo longo de sua vida profissional, dirigiu várias empresas e\ninstituições financeiras. Além disso, foi presidente do Grupo Economisa,\ndo Conselho Estadual de Habitação de Minas Gerais, dos conselhos\nnacionais do Serviço Social do Comércio (Sesc) e do Serviço Nacional de\nAprendizagem Comercial (Senac), da seção mineira da Legião Brasileira de\nAssistência (LBA), da Federação Mineira de Voleibol e da Escola de\nTradutores e Intérpretes de Belo Horizonte, da qual também fora\nfundador, ocupando ainda os cargos de diretor de esportes especializados\ne conselheiro do Clube Atlético Mineiro.\n\nUm dos fundadores do Banco Interamericano de Poupança e Empréstimo em\nCaracas, Venezuela, e da Cooperativa Habitacional de Minas Gerais, foi\nainda diretor da Fazenda Municipal de Belo Horizonte e vice-presidente\nda Confederação Nacional do Comércio e da Federação das Indústrias do\nestado de Minas Gerais.\n\nFaleceu em Belo Horizonte no dia 30 de setembro de 1994.\n\nEra casado com Sara Fernandes Veloso, com quem teve três filhos.\n\nPublicou *Sistema de poupança e empréstimo nos Estados Unidos* (15v.).\n\nLuís Otávio Gomes de Sousa/Rogério Alves de Barros\n\n \n\nFONTES: ASSEMB. LEGISL. MG. *Dicionário biográfico*; CÂM. DEP.\n*Deputados brasileiros. Repertório* (1983-1987); *Diário da Tarde*\n(1/10/94); *Globo* (26/4/84 e 16/1/85).\n\n \n","ref":"FONTES: ASSEMB. LEGISL. MG. *Dicionário biográfico*; CÂM. DEP.\n*Deputados brasileiros. Repertório* (1983-1987); *Diário da Tarde*\n(1/10/94); *Globo* (26/4/84 e 16/1/85).\n\n \n","dic":"DHBB"}
