{"title":"VELOSO, Pedro Leão (pres. ACRJ)","cargoss":["Presidente de associação ou confederação de empregados ou empregadores"],"cargos_esp":["ACRJ"],"datas_ini":[1975],"datas_fim":[1978],"estados":[0],"autor":[0],"content":"**VELOSO, Pedro Leão (pres. ACRJ)**\n\n\\*pres. ACRJ 1975-1978.\n\n \n\n*Pedro Leão Veloso Wähmann* nasceu no Rio de Janeiro, então Distrito\nFederal, no dia 8 de fevereiro de 1911, filho de João Frederico Wähmann\ne de Antonieta Leão Veloso Wähmann. Na família de sua mãe, destacaram-se\nPedro Leão Veloso, que foi presidente das províncias do Espírito Santo\n(1859-1860), Alagoas (1860-1861), Maranhão (1861), Rio Grande do Norte\n(1861-1863), Piauí (1863-1864), Pará (1867-1868) e Ceará (1867-1868),\nsenador pela Bahia em 1878, ministro do Império de 1882 a 1883 e\nconselheiro de Estado em 1889; Pedro Leão Veloso Filho, deputado federal\nde 1906 a 1917 e redator-chefe do Correio da Manhã, sob o pseudônimo de\nGil Vidal, e Pedro Leão Veloso Neto, embaixador brasileiro na Itália de\n1939 a 1941, ministro das Relações Exteriores de 1944 a 1946 e\nrepresentante do Brasil no Conselho de Segurança da Organização das\nNações Unidas (ONU) de 1946 a 1947.\n\nPedro Leão Veloso ingressou em 1922 no Colégio Militar do Rio de\nJaneiro, na capital da República, e concluiu os estudos em 1927. Em 1957\ndiplomou-se pela Escola Superior de Guerra (ESG), na mesma cidade.\nIniciou sua vida profissional como funcionário do Banco do Brasil,\ntornando-se posteriormente superintendente da filial da Vemag S.A. —\nVeículos e Máquinas Agrícolas. Foi diretor da Roots Motores, da Gávea\nS.A. Veículos e Máquinas, da Companhia Predial Guanabara, da Companhia\nFinanciadora Brasileira (Cofibrás), do Banco Novo Mundo e da Nobre\nFernandes S.A.\n\nVice-presidente da Associação Comercial do Rio de Janeiro (ACRJ), foi\nnomeado em junho de 1975 para substituir Raul de Góis (1971-1975) na\npresidência da entidade.\n\nFoi presidente do Sindicato do Comércio Varejista de Automóveis e Peças\ndo estado da Guanabara, vice-presidente da Associação Nacional de\nMáquinas, Veículos, Acessórios e Peças (ANMVAP), membro da Federação do\nComércio Varejista do Rio de Janeiro, do conselho executivo do Serviço\nSocial do Comércio (Sesc), do conselho de representantes da Federação do\nComércio e do Clube Comercial do Rio de Janeiro.\n\nFaleceu no Rio de Janeiro no dia 13 de outubro de 1982.\n\nEra casado com Alair Fernandes Wähmann, com quem teve quatro filhos.\n\n \n\n \n\nFONTES: COUTINHO, A. Brasil; CURRIC. BIOG.; Grande encic. Delta; Jornal\ndo Brasil (20/6/75 e 18/10/82); SOC. BRAS. EXPANSÃO COMERCIAL. Quem;\nWho’s who in Brazil.\n\n \n","ref":"FONTES: COUTINHO, A. Brasil; CURRIC. BIOG.; Grande encic. Delta; Jornal\ndo Brasil (20/6/75 e 18/10/82); SOC. BRAS. EXPANSÃO COMERCIAL. Quem;\nWho’s who in Brazil.\n\n \n","dic":"DHBB"}
