{"title":"VENTUROLLI, Sílvio  ===================","cargoss":["Deputado federal","Deputado federal"],"cargos_esp":[0,0],"datas_ini":[1972,1971],"datas_fim":[1979,1971],"estados":["SP","SP"],"autor":[0],"content":"VENTUROLLI, Sílvio \n===================\n\n\\* dep. fed. SP 1971 e 1972-1979.\n\n* *\n\n*Sílvio José Venturolli*nasceu em Corumbataí (SP) no dia 4 de fevereiro\nde 1930, filho de Sílvio Venturolli e de Mariana Zancheta Venturolli.\n\nFez os primeiros estudos no Colégio Santo Antônio, em Limeira (SP),\ntransferindo-se depois para Rio Claro (SP), onde freqüentou o Instituto\nde Educação Joaquim Ribeiro e a Escola Técnica de Comércio Professor\nArtur Bilac. Em 1950 tornou-se professor do Instituto de Educação Manuel\nBento da Cruz, onde exerceria o cargo de diretor em 1963. No ano\nseguinte formou-se em matemática pela Faculdade de Filosofia, Ciências e\nLetras da Universidade de Campinas (SP). Professor de matemática e de\nestatística na Escola Técnica de Comércio D. Pedro II, fez um curso de\nextensão universitária na Fundação Getúlio Vargas (FGV), no Rio de\nJaneiro, em 1953.\n\nFoi vice-prefeito de Araçatuba (SP) de 1960 a 1963, tendo assumido em\ncaráter interino o Executivo municipal em 1962. Posteriormente, entre\n1964 e 1969, foi prefeito do mesmo município.\n\nEm novembro de 1970 elegeu-se deputado federal por São Paulo na legenda\nda Aliança Renovadora Nacional (Arena), partido de apoio ao regime\nmilitar instaurado no país em abril de 1964, assumindo a cadeira em\nfevereiro de 1971. Licenciou-se por pouco tempo, voltando a exercer o\nmandato entre abril e dezembro de 1971 e de maio do ano seguinte até o\nfinal da legislatura.  Nesse período, participou das comissões de\nSegurança Na­cional e  de Desenvolvimento da Região Sul, e como\nsuplente, da Comissão de Saúde. \n\nReeleito em novembro de 1974, ainda na legenda da Arena, continuou\nparticipando da Comissão de Segurança Nacional e foi suplente da\nComissão de Educação e Cultura. Novamente candidato à reeleição, em\nnovembro de 1978, ficou entre os suplentes, deixando a Câmara em \nfevereiro de 1979.\n\nCom o fim do bipartidarismo, em novembro de 1979, e a conseqüente\nreformulação partidária, filiou-se ao Partido Democrático Social (PDS),\nagremiação sucessora da Arena.\n\nNo pleito de novembro de 1982 candidatou-se à prefeitura de Araçatuba,\npela legenda do PDS, mas não obteve sucesso, recolhendo-se à vida\nprivada\n\nEm 1988 participou da campanha vitoriosa da esposa, Germínia Dolce\nVenturolli, à prefeitura de Araçatuba, na legenda do Partido Democrático\nTrabalhista (PDT). De 1989 a 1992 foi secretário de Assuntos Gerais,\ncoordenando toda a atividade política do governo municipal. Retornou em\n1996, para ajudar na reeleição de Germínia, desta vez na legenda do\nPartido Republicano Progressista (PRP). Em fevereiro de 1997 assumiu a\nchefia de gabinete da Prefeitura.\n\nSílvio Venturolli foi diretor Regional de Ensino, em Araçatuba, de 1979\na 1982.\n\nTeve quatro filhos. Seu genro, Fernando Gomes Perri, foi vereador de\nAraçatuba, entre 1989 e 1993.\n\n.\n\nFONTES: CÂM. DEP. *Deputados*;**CÂM. DEP.*Deputados brasileiros.\nRepertório*(1971-1975 e 1975-1979); INF. BIOG.; NÉRI, S.\n*16*;*Perfil*(1972).\n","ref":"FONTES: CÂM. DEP. *Deputados*;**CÂM. DEP.*Deputados brasileiros.\nRepertório*(1971-1975 e 1975-1979); INF. BIOG.; NÉRI, S.\n*16*;*Perfil*(1972).\n","dic":"DHBB"}
