{"title":"VERSIANI, José Inácio Caldeira","cargoss":["Presidente de associação ou confederação de empregados ou empregadores"],"cargos_esp":["CIRJ"],"datas_ini":[1966],"datas_fim":[1969],"estados":[0],"autor":[0],"content":"**VERSIANI, José Inácio Caldeira**\n\n\\*pres. CIRJ 1966-1969.\n\n \n\n*José Inácio Caldeira Versiani* nasceu em Bocaiúva (MG) no dia 18 de\nabril de 1898.\n\nFormou-se pela Escola de Engenharia do Rio de Janeiro, na capital da\nRepública.\n\nDiretor da Companhia Brasileira de Fósforos, presidiu o Sindicato\nNacional das Indústrias de Fósforos e o Centro das Indústrias de\nFósforos. Foi presidente do conselho regional do Serviço Nacional de\nAprendizagem Industrial (Senai) do estado da Guanabara e diretor do\nServiço Social da Indústria (Sesi) carioca. Atuou ainda como secretário\nda Indústria do Ministério do Trabalho, Indústria e Comércio, condição\nem que integrou várias delegações patronais em congressos e conferências\ndo Brasil e no exterior, como a Conferência Internacional do Trabalho,\nna Suíça.\n\nEm 1966 elegeu-se presidente da Federação das Indústrias do Estado da\nGuanabara (Fiega) e do Centro Industrial do Rio de Janeiro (CIRJ), em\nsubstituição a José Bento Ribeiro Dantas. Em sua gestão foi criado o\nInstituto de Desenvolvimento da Guanabara, atual Instituto de\nDesenvolvimento Empresarial e Gerencial, destinado a realizar estudos\npesquisas e projetos com o objetivo de estimular o desenvolvimento\neconômico do estado. Reeleito em 1968 para a presidência da Fiega e do\nCIRJ, promoveu estudos de viabilidade para a fusão dos antigos estados\nda Guanabara e do Rio de Janeiro — que seria efetivada em março de 1975\n—, aperfeiçoou os departamentos econômico e jurídico das duas entidades\ne o Centro de Produtividade Industrial da Guanabara e criou o Serviço de\nComércio Exterior. Representou a Fiega e o CIRJ junto à Confederação\nNacional da Indústria (CNI).\n\nFaleceu na cidade do Rio de Janeiro em 19 de setembro de 1969, em pleno\nexercício do mandato de presidente da Fiega e do CIRJ. Foi substituído\npor Mário Leão Ludolf.\n\n \n\n \n\nFONTES: Exame (30/1/80); Jornal do Brasil (8/3/75); WEID, E.\nApontamentos.\n\n \n","ref":"FONTES: Exame (30/1/80); Jornal do Brasil (8/3/75); WEID, E.\nApontamentos.\n\n \n","dic":"DHBB"}
