{"title":"VIANA, Agripino Abranches","cargoss":["Presidente de associação ou confederação de empregados ou empregadores"],"cargos_esp":["CVRD"],"datas_ini":[1987],"datas_fim":[1990],"estados":[0],"autor":[0],"content":"**VIANA, Agripino Abranches**\n\n\\*pres. CVRD 1987-1990.\n\n \n\n*Agripino Abranches Viana* nasceu em Pedra do Anta (MG), antigo distrito\nde Viçosa, em 9 de junho de 1934, filho de Agripino da Silva Viana e de\nMaria de Barros Abranches Viana, agricultores da Zona da Mata mineira.\n\nIniciou seus estudos primários em Teixeiras (MG), no Grupo Escolar\nAntônio Carlos. O curso secundário foi concluído em 1954, no Colégio de\nViçosa (MG). Em 1959, formou-se engenheiro agrônomo pela Escola Superior\nde Agricultura da Universidade Rural do Estado de Minas Gerais, em\nViçosa (atual Universidade Federal de Viçosa). No ano seguinte tornou-se\nsupervisor do escritório da Associação de Crédito e Assistência Rural,\nem Barbacena (MG), onde permaneceu até fevereiro de 1961, ano em que\ningressou como professor de olericultura da universidade pela qual se\ndiplomou.\n\nEm 1962 especializou-se em fitotecnia, também na Escola Superior da\nAgricultura. Nesse mesmo ano, foi nomeado para a chefia da seção de\nhorticultura do Instituto Agronômico do Oeste (hoje Instituto de\nPesquisas e Experimentação Agropecuária do Centro-Oeste), em Sete Lagoas\n(MG). Em 1965, foi admitido como gerente-geral da Companhia Progresso do\nAmapá, com a função de orientar a implantação de projetos\nagroindustriais e administrar fazendas e granjas. Como base para a\nprodução agrícola e pecuária, desenvolveu um amplo programa de\nexperimentação agrícola, visando a um melhor conhecimento das condições\ndaquela região.\n\nEm novembro de 1967 tornou-se responsável pela execução do Projeto de\nDesenvolvimento da Produção Agropecuária-USAID (Aliança para o\nProgresso-Governo do Território do Amapá). Nesse projeto, colaborou no\nplanejamento da montagem de misturadores de rações e comercialização de\nrações e produtos animais. Aí permaneceu até março de 1968, quando se\ndesligou do projeto e da Companhia Progresso do Amapá. Um mês depois,\nfoi nomeado diretor técnico da Óleos do Pará S.A., ficando encarregado\nde planejar a implantação da indústria de óleos no Pará, projeto\naprovado pela Superintendência do Desenvolvimento da Amazônia (Sudam).\nRespondeu também pela supervisão geral da operação da fazenda-modelo da\nempresa. Permaneceu até novembro de 1969, quando regressou a Minas\nGerais.\n\nEm março de 1970, foi admitido como técnico do setor de agroindústria do\nInstituto de Desenvolvimento Industrial de Minas Gerais, onde elaborou\nestudos de viabilidade. Atuou também na promoção de oportunidades de\ninvestimento e na assistência a investidores nacionais e estrangeiros\ninteressados em atividades empresariais em Minas. Em maio do ano\nseguinte, assumiu a presidência da Companhia de Armazéns e Silos do\nEstado de Minas Gerais, onde ficou até dezembro de 1973.\n\nEm janeiro do ano seguinte, foi eleito presidente do instituto, cargo no\nqual permaneceu até março de 1975. Ainda em março, assumiu a Secretaria\nde Agricultura de Minas Gerais, a convite do governador Aureliano\nChaves, recém-empossado. No início de 1976, fundou, com dois sócios, a\nBuritis Agropecuária.\n\nPermaneceu na secretaria até o fim da administração de Aureliano, em\n1979. Por força do cargo, ocupou a presidência dos conselhos de\nadministração da Companhia de Armazéns e Silos, dos Frigoríficos de\nMinas Gerais S.A., da Companhia Agrícola, da Fundação Rural Mineira —\nColonização e Desenvolvimento, das Centrais de Abastecimento, do\nInstituto de Saúde Animal, da Empresa de Pesquisas Agropecuárias e da\nEmpresa de Assistência Técnica e Extensão Rural, criados em sua gestão.\n\nA partir de abril de 1979, tornou-se assessor especial da presidência da\nCompanhia Vale do Rio Doce (CVRD), convidado por Eliezer Batista, então\npresidente. Suas atividades principais relacionavam-se à coordenação do\nPrograma do Corredor de Exportação Goiás-Minas-Espírito Santos, do\nProjeto Cerrados, do Projeto Corredor de Exportação da Estrada de Ferro\nCarajás e dos projetos florestais e de desenvolvimento regional nas\náreas onde a CVRD operava. Ocuparia esse cargo até maio de 1985. De 1981\na 1982 ocupou cumulativamente o cargo de diretor da Florestas Rio Doce\nS.A., empresa subsidiária da CVRD.\n\nEm maio de 1985, foi designado diretor de Madeira, Celulose e Meio\nAmbiente, incluindo em suas atribuições a área de proteção ambiental da\nReserva de Desenvolvimento do Vale do Rio Doce. Atuou também como\nsecretário executivo do Grupo de Estudos e Assessoramento sobre o Meio\nAmbiente. Foi nomeado vice-presidente e membro do conselho de\nadministração em abril do ano seguinte, durante a gestão de Raimundo\nMascarenhas. Dois meses depois, foi eleito diretor do Instituto\nBrasileiro de Mineração. Em setembro de 1987, com a morte de\nMascarenhas, foi empossado presidente, acumulando as funções de\npresidente do Conselho de Administração da Vale do Rio Doce Navegação\nS.A. (Docenave).\n\nPermaneceu no cargo até abril de 1990, sendo substituído por Wilson\nBrumer, indicado pelo presidente Fernando Collor. Aposentado pela CVRD,\ndedicou-se à sua firma de consultoria técnica na área de mineração.\n\nFaleceu em Belo Horizonte no dia 6 de agosto de 1995.\n\nEra casado com Valéria Dorofeeff Viana, com quem teve três filhos.\n\nAlexandra Toste\n\n \n\nFONTES:****CURRIC. BIOG.;*****Mineração e Metalurgia* (6/89).\n\n \n","ref":"FONTES:****CURRIC. BIOG.;*****Mineração e Metalurgia* (6/89).\n\n \n","dic":"DHBB"}
