{"title":"BARROS, Monteiro de","cargoss":["Deputado federal"],"cargos_esp":[0],"datas_ini":[1971],"datas_fim":[1975],"estados":["SP"],"autor":[0],"content":"**BARROS, Monteiro de**\n\n\\*dep. fed. SP 1971-1975.\n\n \n\n*Sebastião Monteiro de Barros* nasceu em Barretos (SP) no dia 14 de\ndezembro de 1930, filho de João Monteiro de Barros e de Inês Monteiro de\nBarros.\n\nEm sua juventude, serviu na cavalaria do Centro de Preparação de\nOficiais da Reserva (CPOR) em Curitiba. Diplomou-se pela Faculdade de\nEngenharia da Universidade do Paraná em 1955. Fez ainda curso de\npsicologia e direção em São Paulo no ano de 1963 e curso de extensão\nuniversitária na Faculdade de Higiene de São Paulo em 1966.\n\nDiretor de Obras de Saneamento da Secretaria de Serviços de Obras\nPúblicas de 1960 a 1967 e diretor-geral do Departamento de Águas e\nEsgotos de São Paulo de 1964 a 1965, elegeu-se deputado federal por São\nPaulo em novembro de 1970, na legenda da Aliança Renovadora Nacional\n(Arena), partido de apoio ao regime militar instaurado no país em abril\nde 1964, tendo cumprido o mandato de fevereiro de 1971 a janeiro de\n1975.\n\nNa Câmara, foi membro efetivo da Comissão de Orçamento e suplente (1971)\nda Comissão de Transportes, Comunicações e Obras Públicas. Foi ainda o\nrelator da comissão especial destinada a estudar globalmente o problema\nda poluição ambiental. Não candidatando-se à reeleição no pleito de\nnovembro de 1974, deixou a Câmara em janeiro do ano seguinte, ao final\nda legislatura.\n\nNo pleito de novembro de 1976 elegeu-se vice-prefeito de Barretos, pela\nlegenda da Arena, na chapa encabeçada por Melek Zaiden Geraige. Assumiu\no mandato no início do ano seguinte, permanecendo no cargo até 1982, em\nvirtude da aprovação, em setembro de 1980, no Congresso Nacional, da\nprorrogação dos mandatos executivos municipais. Entre 1982 e 1983 foi\ndiretor da empresa estatal Fundação das Instâncias Minerais do Estado de\nSão Paulo. Deixando a vida pública, passou a cuidar de seus negócios\nparticulares.\n\nFoi presidente do Barretos Esporte Clube.\n\nFaleceu em Barretos no dia 24 de setembro de 1994.\n\nEra casado com Idalina de Oliveira Pereira Monteiro de Barros, com quem\nteve dois filhos.\n\nPublicou *Organização de obras públicas: métodos de execução e\nfiscalização* (1965).\n\n \n\nFONTES: CÂM. DEP. *Deputados*; CÂM. DEP. *Deputados brasileiros.\nRepertório* (1971-1975); INF. FAM.\n\n \n","ref":"FONTES: CÂM. DEP. *Deputados*; CÂM. DEP. *Deputados brasileiros.\nRepertório* (1971-1975); INF. FAM.\n\n \n","dic":"DHBB"}
