{"title":"VIANA, Evandro Mendes","cargoss":["Senador"],"cargos_esp":[0],"datas_ini":[1948],"datas_fim":[1951],"estados":["MA"],"autor":[0],"content":"**VIANA, Evandro Mendes**\n\n\\*sen. MA 1948-1951.\n\n* *\n\n*Evandro Mendes Viana* nasceu em São Luís no dia 21 de agosto de 1907,\nfilho de Godofredo Mendes Viana e de Joviliana de Sousa Barreto Mendes\nViana. Seu pai foi senador pelo Maranhão e presidente desse estado de\n1922 a 1926. Seu irmão, Antônio Barreto Mendes Viana, foi embaixador do\nBrasil na França, de 1964 a 1966, e no Chile, de 1966 a 1967.\n\nDepois de fazer seus estudos primários e secundários no Maranhão,\ntransferiu-se para o Rio de Janeiro, então Distrito Federal, ingressando\nna Faculdade Nacional de Direito. Ainda estudante, tornou-se revisor de\ndebates do Senado em 1928. Em 1930, além de diplomar-se em técnico de\nadministração, bacharelou-se em ciências jurídicas e sociais.\n\nApós a Revolução de 1930, foi nomeado em 1932, pelo presidente do estado\nde Minas Gerais, Olegário Maciel, prefeito de Tiradentes (MG), tendo\nexercido esse cargo até o ano seguinte. Em 1934 foi nomeado inspetor do\nensino secundário do Distrito Federal, cargo que exerceu, a partir de\nabril de 1935, simultaneamente ao de auxiliar de anais do Senado.\nDeixando a Inspetoria de Ensino em 1937, foi designado para o\nDepartamento de Propaganda e Difusão Cultural, onde atuou como\nsecretário do diretor-geral, Lourival Fontes. Promovido em 1940, por\ndecreto presidencial, a oficial administrativo classe K, tornou-se em\n1942 secretário do diretor do Departamento de Imprensa e Propaganda\n(DIP), major Antônio José Coelho dos Reis. Chegando à classe L em sua\ncarreira de oficial administrativo em 1943, foi nomeado dois anos depois\ndiretor do Serviço de Administração do Senado.\n\nApós a extinção do Estado Novo (1937-1945), foi promovido em outubro de\n1946 a oficial do Legislativo, classe M, por ato da Assembléia Nacional\nConstituinte, instalada em fevereiro daquele ano. Ainda em outubro foi\nnomeado secretário da Comissão de Finanças do Senado. Na eleição\nsuplementar de janeiro de 1947 elegeu-se suplente de senador pelo\nMaranhão, na legenda do Partido Proletário do Brasil (PPB), na chapa\nencabeçada por José Neiva de Sousa. Passando para a classe N em 1948, em\njulho desse mesmo ano ocupou uma cadeira no Senado, substituindo o\ntitular, afastado por motivo de doença. Assumiu então a presidência da\nComissão de Educação e Cultura e tornou-se membro da Comissão de\nConstituição e Justiça. Promovido à classe O em 1950, foi, ainda nesse\nano, indicado para a Comissão de Orçamento do Senado e reclassificado no\npadrão PL-Z. Em janeiro de 1951 deixou sua cadeira no Senado,\nreassumindo suas funções administrativas na mesma casa. Em 1955 foi\nnomeado titular da diretoria de comissões e integrante da banca\nexaminadora do concurso para motorista do Senado. No ano seguinte\ntornou-se membro da banca examinadora do concurso para assessor\nlegislativo nos setores de economia, transportes e viação.\n\nDurante o governo de Juscelino Kubitschek (1956-1961), em 1959, foi\nnomeado vice-diretor da Diretoria Geral Legislativa, sendo promovido\nnesse mesmo ano a diretor de divisão padrão PL-I. Nesse cargo integrou,\ncomo representante do Senado, a Comissão das Solenidades de Instalação\ndo Governo Federal em Brasília. Em abril de 1960, já na nova capital\nfederal, foi designado para substituir interinamente o diretor da\nsecretaria geral do Senado, Luís Nabuco, tornando-se em maio seguinte\ntitular do cargo.\n\nEm 1962 foi designado presidente da comissão de orçamento encarregada de\nreceber as propostas apresentadas por firmas do estado da Guanabara para\nfornecimento de extintores de incêndio, e membro da comissão de\nclassificação de cargos da secretaria do Senado. No ano seguinte\npresidiu a comissão incumbida de proceder à realização de provas\npsicotécnicas para motoristas e guardas de segurança do Senado e em 1970\ntornou-se presidente da comissão de recebimento de propostas relativas à\nconcorrência pública para a construção do anexo II do Senado. Em 1972\nfoi designado vice-presidente da comissão permanente de licitações do\nSenado e presidente da banca examinadora do teste de seleção pública\npara as funções de mecanógrafo e de auxiliar de plenário e da comissão\nde estudo do anteprojeto de lei destinado a alterar o quadro de pessoal\ndo Senado. Em 1974 passou a integrar o conselho de supervisão do Centro\nde Processamento de Dados do Senado (Prodasen).\n\nExerceu suas atividades como funcionário do Senado até 1977, ano em que\nse aposentou.\n\nFaleceu no Rio de Janeiro no dia 3 de janeiro de 1988.\n\nEra casado com Otília Newlands Mendes Viana, com quem teve duas filhas.\n\n \n\nFONTES: *Congresso* (1948); COUTINHO, A. *Brasil*; HIRSCHOWICZ, E.\n*Contemporâneos*; INF. Márcia Mendes Viana; SENADO. *Dados*; SENADO.\n*Relação*; TRIB. SUP. ELEIT. *Dados* (1).\n\n \n","ref":"FONTES: *Congresso* (1948); COUTINHO, A. *Brasil*; HIRSCHOWICZ, E.\n*Contemporâneos*; INF. Márcia Mendes Viana; SENADO. *Dados*; SENADO.\n*Relação*; TRIB. SUP. ELEIT. *Dados* (1).\n\n \n","dic":"DHBB"}
