{"title":"BARROS, Morais","cargoss":["Deputado federal"],"cargos_esp":[0],"datas_ini":[1957],"datas_fim":[1958],"estados":["SP"],"autor":[0],"content":"**BARROS, Morais**\n\n\\*dep. fed. SP 1957-1958.\n\n \n\n*Hermann de Morais Barros* nasceu na cidade de São Paulo, no dia 30 de\nsetembro de 1907, filho de Antônio de Morais Barros e de Isaura A.\nMorais Barros. Seu pai foi deputado estadual pelo Partido Republicano\nPaulista (PRP); o avô paterno, Manuel de Morais e Barros, fundador do\nPartido Republicano, em Itu, no ano de 1870, e senador; o tio-avô,\nPrudente José de Morais Barros, presidente da República (1894-1898),\npresidente do estado de São Paulo, senador e deputado federal; o tio\npaterno, Paulo de Morais Barros, ministro da Viação, senador e deputado\nfederal; o primo, Prudente de Morais Filho, deputado federal\n(1912-1926).\n\nFormado pela faculdade de direito da Universidade de São Paulo (USP), em\n1931, Hermann de Morais Barros iniciou a militância política em 1926,\ningressando no Partido Democrático (PD).\n\nEm 1932 assumiu a chefia de gabinete do secretário da Fazenda de São\nPaulo, o seu tio paterno Paulo de Morais Barros. Com a fundação da União\nDemocrática Nacional (UDN), em 1945, filiou-se a esta agremiação,\ntornando-se membro do diretório de São Paulo.\n\nEm 1950 foi nomeado diretor-gerente da Companhia Melhoramentos Norte do\nParaná, empresa de colonização de terras. No pleito de outubro\ncandidatou-se a deputado federal pela legenda da UDN, obtendo uma\nsuplência. Fez nova tentativa em outubro de 1954, ainda pela UDN, com\nidêntico resultado. Desta vez, porém, exerceu o mandato em duas\noportunidades: de 23 de abril a 31 de julho de 1957 e de 10 e 26 de\nmarço de 1958.\n\nDeixando a Câmara e não concorrendo mais a cargos eletivos, em meados da\ndécada de 1960 tornou-se conselheiro do Banco Itaú. Em 1981 retornou à\nCompanhia Melhoramentos Norte do Paraná como superintendente, até maio\nde 1992, e daí em diante na condição de membro do conselho consultivo da\nempresa.\n\nFaleceu na cidade de São Paulo, no dia 25 de julho de 1994.\n\nCasado com Maria Galvão de Morais Barros, teve uma filha.\n\n \n\nFONTES: CÂM. DEP. *Deputados brasileiros* (1826-1876); CÂM. DEP.\n*Deputados brasileiros* (1946-1967); INF. FAM.\n\n \n","ref":"FONTES: CÂM. DEP. *Deputados brasileiros* (1826-1876); CÂM. DEP.\n*Deputados brasileiros* (1946-1967); INF. FAM.\n\n \n","dic":"DHBB"}
