{"title":"VIANA, José ===========","cargoss":["Deputado federal","Constituinte"],"cargos_esp":[0,0],"datas_ini":[1987,1987],"datas_fim":[1991,1988],"estados":["RO",0],"autor":[0],"content":"VIANA, José\n===========\n\n\\* dep. fed. RO 1987-1991; const. 1987-1988.\n\n \n\n*José Viana dos Santos* nasceu em Barra do Mendes (BA) em 9 de junho de\n1928, filho de Miguel Viana dos Santos e de Ana Rita de Oliveira.\n\nLogo após transferir-se para a cidade de São Paulo, em 1949, ingressou\nna Escola Técnica de Comércio Frederico Glozanan, pela qual se formou em\n1954. Ainda nesse ano, mudou-se para Nortelândia (MT), onde passou a\ntrabalhar num cartório de registro civil e num escritório de\ncontabilidade. Em 1957, tornou-se escrivão na delegacia e,\nposteriormente, delegado, cargo que ocupou durante alguns anos.\n\nDepois de residir em outros municípios de Mato Grosso por curtos espaços\nde tempo, fixou-se, em 1963, em Dom Aquino, onde instalou um escritório\nde contabilidade. Com a instauração do regime militar em abril do ano\nseguinte, foi levado para o 16º BC de Cuiabá, ficando preso para\naveriguação durante 18 dias. Livre de qualquer acusação, permaneceu no\nexercício de suas atividades durante os anos seguintes, instalando,\ninclusive, um novo escritório de contabilidade em Jaciara.\n\nEm 1972, transferiu-se para Rondônia, palco de disputas de terras\nnaquela época. Denunciando o assassinato de posseiros na região e\nopondo-se a Teodorico Gaíva, governador do território – Rondônia só se\ntransformaria em estado em dezembro de 1981 – , filiou-se em 1974 ao\nMovimento Democrático Brasileiro (MDB), partido de oposição ao regime\nmilitar. Depois de tornar-se primeiro-secretário do partido, elegeu-se\nvereador em Porto Velho em novembro de 1976, participando dos trabalhos\nlegislativos como primeiro-secretário e presidente da Câmara.\n\nEm novembro de 1982, disputou a prefeitura de Ji-Paraná pelo Partido do\nMovimento Democrático Brasileiro (PMDB), herdeiro do MDB, mas não foi\nbem sucedido. Devido à prorrogação dos mandatos municipais em 1980 –\npara que houvesse coincidência entre os mandatos estaduais e municipais,\ntanto no Executivo como no Legislativo –, permaneceu na vereança de\nPorto Velho até o início de 1983.\n\nPastor protestante, em novembro de 1986 foi eleito deputado federal\nconstituinte, com apoio da Igreja Assembléia de Deus e de outras igrejas\nevangélicas. Assumindo o mandato em fevereiro do ano seguinte,\nparticipou dos trabalhos na Assembléia Nacional Constituinte como\ntitular da Subcomissão dos Direitos e Garantias Individuais, da Comissão\nda Soberania e dos Direitos e Garantias do Homem e da Mulher, e suplente\nda Subcomissão dos Municípios e Regiões, da Comissão da Organização do\nEstado.\n\nNas votações mais importantes, votou a favor do mandado de segurança\ncoletivo, da unicidade sindical, da soberania popular, do voto aos 16\nanos, da nacionalização do subsolo, da limitação dos juros em 12% ao\nano, da desapropriação da propriedade produtiva, do presidencialismo e\ndo mandato de cinco anos para o presidente José Sarney; e contra a pena\nde morte, a limitação do direito de propriedade privada, a estabilidade\nno emprego, a remuneração 50% superior para o trabalho extra, a jornada\nsemanal de 40 horas, a estatização do sistema financeiro e a legalização\ndo jogo do bicho.****\n\nCom a promulgação da nova Carta constitucional em 5 de outubro de 1988,\npassou a exercer o mandato ordinário na Câmara, tornando-se membro da\nComissão de Agricultura.\n\nEm outubro de 1990 concorreu à reeleição pelo Partido da Mobilização\nNacional (PMN), obtendo apenas a terceira suplência. Deixou a Câmara em\njaneiro do ano seguinte, no fim da legislatura. Em seguida, ingressou no\nPartido Liberal (PL), aí permanecendo durante aproximadamente seis\nmeses. Posteriormente, voltou a filiar-se ao PMDB e em 1994 tornou-se\nmembro do Partido Trabalhista Brasileiro  (PTB), também por pouco tempo.\nAinda em 1994, tornou-se assessor parlamentar da Assembléia Legislativa.\nTrês anos depois, em janeiro de 1997, foi nomeado ouvidor de Ji-Paraná,\ncargo que exerceu até novembro de 1998. Ainda nesse mês, assumiu, também\npor nomeação, a direção de Recursos Humanos do município. Em maio do ano\nseguinte aposentou-se pela Assembléia Legislativa, permanecendo somente\ncom suas funções em Ji-Paraná.\n\nExerceu a atividade de contador e foi membro e segundo vice-presidente\ndo diretório regional do PMDB.\n\nCasou-se com Idália Viana de Oliveira, com quem teve uma filha.\n\n \n\nFONTES: ASSEMB. NAC. CONST. *Repertório* (1987-1988); CURRÍC. BIOG.;\nINF. BIOG.; COELHO, J. & OLIVEIRA, A. *Nova*; *Folha de São Paulo*\n(19/1/87).\n","ref":"FONTES: ASSEMB. NAC. CONST. *Repertório* (1987-1988); CURRÍC. BIOG.;\nINF. BIOG.; COELHO, J. & OLIVEIRA, A. *Nova*; *Folha de São Paulo*\n(19/1/87).\n","dic":"DHBB"}
