{"title":"VIANA, Wildy","cargoss":["Deputado federal"],"cargos_esp":[0],"datas_ini":[1979],"datas_fim":[1987],"estados":["AC"],"autor":[0],"content":"**VIANA, Wildy**\n\n\\*dep. fed. AC 1979-1987.\n\n \n\n*Wildy Viana das Neves* nasceu em Brasiléia (AC) no dia 26 de abril de\n1929, filho de Virgílio Viana das Neves e de Sebastiana Lopes Viana.\n\nRadiotelegrafista, ingressou na política em 1963, pouco depois de o Acre\nter-se tornado um estado da Federação, filiando-se à União Democrática\nNacional (UDN), em cuja legenda foi eleito vereador de Rio Branco. Com a\nextinção dos partidos políticos, conforme determinação do Ato\nInstitucional nº 2 (27/10/1965), e a posterior instauração do\nbipartidarismo, optou pela Aliança Renovadora Nacional (Arena), partido\nque dava sustentação ao regime militar.\n\nEm janeiro de 1966, eleito presidente da Câmara de Vereadores, assumiu a\nchefia do Executivo municipal logo após a cassação do prefeito Aníbal\nMiranda. Em julho, desincompatibilizou-se do cargo para concorrer a uma\ncadeira no Legislativo estadual. Eleito no pleito de novembro de 1966,\nrenunciou à sua cadeira de vereador em janeiro de 1967 para assumir seu\nmandato na Assembléia Legislativa em fevereiro seguinte. Permaneceria\nnessa casa por três legislaturas seguidas, até janeiro de 1979.\n\nEm novembro de 1978 foi eleito deputado federal pelo Acre na legenda da\nArena. Assumindo sua cadeira na Câmara dos Deputados em fevereiro do ano\nseguinte, tornou-se titular da Comissão de Serviço Público, da qual se\ntornaria vice-presidente em 1982. Com a extinção do bipartidarismo em\nnovembro de 1979 e a conseqüente reorganização do quadro partidário,\nfiliou-se no ano seguinte ao Partido Democrático Social (PDS), sucessor\nda Arena no apoio ao governo. Ainda em 1980, atuou como suplente da\nComissão de Agricultura e Política Rural.\n\nNo pleito de novembro de 1982 conseguiu reeleger-se deputado federal,\niniciando novo mandato em fevereiro do ano seguinte, fazendo parte da\nComissão de Agricultura e Política Rural e, como suplente, da Comissão\nde Serviço Público.\n\nNa sessão que a Câmara dos deputados realizou em 25 de abril de 1984,\nvotou a favor da emenda Dante de Oliveira, que restabelecia eleições\ndiretas para presidente da República já em novembro desse ano. Rejeitada\na proposição — faltaram 22 votos para que fosse encaminhada à apreciação\ndo Senado —, no Colégio Eleitoral reunido em 15 de janeiro de 1985 Wildy\nvotou no candidato oficial do regime, Paulo Maluf, derrotado pelo\noposicionista Tancredo Neves, do Partido do Movimento Democrático\nBrasileiro (PMDB), apoiado pelos dissidentes do PDS, abrigados na Frente\nLiberal. Doente, Tancredo não chegou a tomar posse, vindo a falecer no\ndia 21 de abril de 1985. Seu substituto foi o vice, José Sarney, que já\nvinha exercendo as funções interinamente, desde 15 de março.\n\nNão tendo concorrido à reeleição em novembro de 1986, deixou a Câmara\ndos Deputados ao término da legislatura, no fim de janeiro do ano\nseguinte, quando também se encerrou o seu mandato.\n\nDesde então, afastou-se das atividades político-partidárias, mas passou\na acompanhar de perto a trajetória de dois de seus quatro filhos com\nSílvia Falcão Macedo das Neves, Jorge Viana e Sebastião Viana, conhecido\ncomo Tião Viana, ambos filiados ao Partido dos Trabalhadores (PT). O\nprimeiro foi prefeito de Rio Branco entre 1993 e 1996 e governador do\nAcre de 1999 a 2007; o segundo elegeu-se senador em 1998, reelegendo-se\nem 2006. Seu cunhado, Joaquim Falcão Macedo, foi deputado federal pelo\nAcre de 1967 a 1968 e de 1971 a 1975, tendo governado o estado de 1979 a\n1983.\n\nEm setembro de 2009, ano em que Wildy Viana completou 80 anos, foram\ncomemoradas os 50 anos de seu casamento com Sílvia Falcão Macedo das\nNeves. \n\n               \n\nFONTES: CÂM. DEP. *Deputados brasileiros. Repertório*(1979-1983 e\n1983-1987); INF. BIOG.; *Globo* (26/4/84 e 16/1/85); *A Tribuna*\n(29/09/09).\n\n \n","ref":"FONTES: CÂM. DEP. *Deputados brasileiros. Repertório*(1979-1983 e\n1983-1987); INF. BIOG.; *Globo* (26/4/84 e 16/1/85); *A Tribuna*\n(29/09/09).\n\n \n","dic":"DHBB"}
