{"title":"VICENTINHO","cargoss":["Presidente de associação ou confederação de empregados ou empregadores","Deputado federal"],"cargos_esp":["CUT",0],"datas_ini":[1994,2003],"datas_fim":[2000,0],"estados":[0,"SP"],"autor":[0],"content":"**VICENTINHO**\n\n\\*pres. CUT 1994-2000; dep. fed. SP 2003-\n\n \n\n*Vicente Paulo da Silva*, conhecido como *Vicentinho*, nasceu no sítio\nMaravilha, no município de Santa Cruz (RN), no dia 8 de abril de 1956,\nfilho dos agricultores Francisco Germano da Silva e Maria Jerônimo da\nSilva.\n\nQuando tinha poucos meses de idade, sua família transferiu-se para Acari\n(RN). Desde criança trabalhou no campo ajudando os pais. Ingressou na\nescola tardiamente, deixando de estudar em 1970, quando frequentava a\nquinta série do primeiro grau, para trabalhar na construção de estradas\ne açudes nas frentes de emergência criadas pelo governo federal durante\nas secas que periodicamente assolam o sertão do Nordeste brasileiro. Em\nseguida, trabalhou como entregador de pão e na construção civil,\npassando a integrar o grupo de jovens da Igreja Católica local. Aos 18\nanos obteve seu primeiro emprego registrado em carteira de trabalho, na\nempresa Mineradora Maracajá.\n\nEm 1976 migrou para São Paulo, dois dias após seu primeiro casamento,\ncom Josefa Santana da Silva. Seu destino foi São Bernardo do Campo, no\nABC paulista , pólo original da indústria automobilística brasileira.\nAlojado por parentes maternos, depois de um mês de trabalho como lavador\nde automóveis conseguiu emprego na Metalúrgica Tamet, filiando-se, em\n1977, ao Sindicato dos Metalúrgicos de São Bernardo do Campo e Diadema.\nEm 1978 foi admitido na Mercedes-Benz do Brasil, localizada em Diadema,\ncomo inspetor de qualidade. Na ocasião, aproximou-se do líder sindical\nDjalma Bom, que o incentivou a participar da retomada das greves da\ncategoria. Em 1979, frequentou o supletivo do primeiro grau no próprio\nsindicato, recebendo no ano seguinte o certificado de conclusão emitido\npelo Curso Santa Inês, de São Bernardo do Campo.\n\nO fim dos anos 1970 e o início dos anos 1980 foram marcados por intensa\natividade político-sindical dos metalúrgicos do ABC, liderados por Luís\nInácio Lula da Silva, o que sedimentou a criação, em 1980, do Partido\ndos Trabalhadores (PT), e da Comissão Pró-Central Única dos\nTrabalhadores (CUT), em 1981. Nesse último ano, lutando contra os\nproblemas de dicção que tinha, Vicentinho subiu num palanque e fez seu\nprimeiro discurso para uma multidão. Ainda em 1981 foi eleito\nvice-presidente do sindicato, na diretoria encabeçada por Jair\nMeneghelli, em substituição à diretoria presidida por Lula, que fora\nafastada pelo governo do general João Batista Figueiredo (1979-1985). No\nano seguinte foi enquadrado na Lei de Segurança Nacional. Em longo\nprocesso movido pelo Estado contra Jair Meneguelli, que em ato público\nhavia classificado o presidente Figueiredo de canalha, passou de\ntestemunha a réu.\n\nEnquanto o processo se desenrolava, participou da fundação da CUT, em\nagosto de 1983, quando foi eleito presidente da CUT-Regional do ABC. No\nmesmo ano, foi um dos líderes da primeira greve geral nacional\ndeflagrada durante o regime militar, e seu sindicato uma vez mais sofreu\nintervenção. Em 1984, foi proclamada a sentença que o condenou a um ano\nde reclusão, mas a seguir a condenação foi anulada pelo Supremo Tribunal\nFederal (STF), abrindo-se uma crise entre os poderes Executivo e\nJudiciário. No mesmo ano foi suspensa a intervenção no sindicato, e\nVicentinho passou a ocupar o cargo de segundo-secretário.\n\nAo longo de 1984, foi sistematicamente preso e intimidado pelos agentes\nda polícia política quando participava de greves ou de manifestações em\nportas de fábricas. Nos anos seguintes, já durante o governo de José\nSarney (1985-1990), o primeiro presidente civil após o fim do regime\nmilitar, esteve à frente de greves e mesas de negociação, defendendo\nreposições salariais, até mesmo trimestrais, para compensar as perdas\nprovocadas pelos elevados índices de inflação.\n\nEm 1987 elegeu-se presidente do Sindicato dos Metalúrgicos de São\nBernardo do Campo e Diadema, que contava na ocasião com 80 mil\nassociados e era o principal sustentáculo da CUT, que tinha como maior\nrival na disputa pela hegemonia do movimento sindical brasileiro a\nCentral Geral dos Trabalhadores (CGT), criada em março de 1986. A CGT\nera presidida por Joaquim dos Santos Andrade, o Joaquinzão, e tinha como\nbase principal o Sindicato dos Metalúrgicos de São Paulo.\n\nVicentinho sempre defendeu a independência dos sindicatos e de seus\ndirigentes em relação aos partidos políticos, pronunciando frases como:\n“O sindicato não é correia de transmissão de um partido”, ou “Nunca tive\nfiliação partidária (embora) não exista ninguém mais petista do que eu”.\nReagindo à transposição para os sindicatos de discussões ideológicas\ninternas dos grupos marxistas, afirmava: “Sou socialista mas não sou\nbesta. Me preocupam a Maria e o João, e não Lênin, Trotski ou Marx.”\nTais declarações não o impediram de engajar-se ativamente na campanha de\nLula, candidato da frente de esquerda liderada pelo PT às eleições\npresidenciais de 1989. O pleito foi vencido por Fernando Collor de Melo,\ndo Partido da Reconstrução Nacional (PRN), que, no segundo turno,\nrealizado em dezembro, derrotou o candidato petista.\n\nCom a posse de Collor em 15 de março de 1990, ano em que seria reeleito\npresidente do sindicato, Vicentinho iniciou a construção de seu perfil\nde líder sindical propenso a dar um crédito inicial aos governantes,\nprovocando descontentamentos e oposição acirrada nos meios sindicais.\nFoi assim após o anúncio do Plano Collor I, duramente criticado pelo PT\ne pela maior parte da esquerda e que mereceu do líder sindical a\nafirmação: “por se tratar de um governo novo, havia parado para pensar\nse a coisa não poderia dar certo.” Indo além das afirmações, aceitou o\nconvite do novo presidente para negociar um pacto social, incluindo\nempresariado e sindicatos, em favor da estabilização da economia do\npaís. Nas negociações, os sindicatos eram representados pela CUT e pelas\nduas centrais sindicais que resultaram da divisão interna da CGT,\nprocesso iniciado no final de 1988 — a Confederação Geral dos\nTrabalhadores, liderada por Antônio Rogério Magri, e a Central Geral dos\nTrabalhadores, dirigida por Joaquinzão.\n\nEm 1992, Vicentinho participou ativamente das câmaras setoriais da\nindústria automobilística, nas quais defendia garantias para o poder de\ncompra dos salários e o emprego dos trabalhadores. No entanto, os\nsalários foram perdendo valor e as empresas começaram a demitir em larga\nescala. Isso o levou, assim como a seu sindicato e à CUT, a mudar\nsubstancialmente a linha de atuação, rompendo as negociações e ampliando\nalianças com setores da sociedade civil descontentes com o governo\nCollor. No mesmo ano de 1992, Vicentinho e a CUT tiveram papel destacado\nnas mobilizações populares que redundaram na abertura do processo de\n*impeachment* do presidente, acusado de envolvimento numa ampla rede de\ncorrupção no interior do governo, aprovada pela Câmara dos Deputados em\nsetembro. Substituído pelo vice-presidente Itamar Franco em 2 de\noutubro, Collor renunciou ao cargo em 29 de dezembro, mesmo dia em que o\nSenado aprovou seu *impeachment*. Ainda no dia 29, Itamar foi confirmado\nna presidência da Republica.\n\nCom a posse do novo presidente, foram retomadas as negociações acerca do\npacto social e das câmaras setoriais. Em 1993 os sindicatos de\nmetalúrgicos de Santo André e de São Bernardo do Campo e Diadema\nfundiram-se, dando origem ao Sindicato dos Metalúrgicos do ABC, cujo\nprimeiro presidente eleito foi Vicentinho.\n\nEm fevereiro de 1994 o governo, por meio do então ministro da Fazenda\nFernando Henrique Cardoso, anunciou o Plano Real, que viria a ser\nimplantado em 1º de julho daquele ano. Prevendo recessão econômica e\nconsequentes arrocho salarial e desemprego, a CUT, a CGT e a Força\nSindical (FS) — criada em 1991 por Luís Antônio Medeiros e apoiada por\nJoaquinzão, que acabou por dissolver a Central Única dos Trabalhadores —\nreagiram, convocando os trabalhadores para uma greve nacional,\ndeflagrada com êxito no dia 23 de março nas áreas metropolitanas de São\nPaulo, Rio de Janeiro e Salvador.\n\n \n\nPresidente da CUT\n\n \n\nEm maio de 1994, no VI Congresso da CUT, Vicentinho foi eleito\npresidente da entidade como candidato da corrente moderada Articulação,\nem substituição a Jair Meneguelli, que iria concorrer a deputado federal\nnas eleições de outubro. Nesse mesmo pleito, em outubro de 1994, Lula\ncandidatou-se mais uma vez à presidência da República. O engajamento de\nVicentinho na campanha de Lula provocou denúncias de crime eleitoral,\nsob a alegação de que o Sindicato dos Metalúrgicos do ABC havia cedido\nindevidamente carros de som ao candidato do PT. Lula foi novamente\nderrotado, dessa vez por Fernando Henrique Cardoso, do Partido da Social\nDemocracia Brasileira (PSDB), encabeçando uma coligação que incluía o\nPartido da Frente Liberal (PFL) e o Partido Trabalhista Brasileiro\n(PTB).\n\nEm janeiro de 1995, Vicentinho declarou que, sem renunciar às lutas em\ndefesa do salário e do emprego, a CUT passaria a priorizar o\nfortalecimento do trabalho junto às bases, o fortalecimento interno da\nentidade e a aproximação cada vez maior com os setores sociais atingidos\npelos grandes problemas brasileiros. Referiu-se, também, às lutas por\nganhos de produtividade e pela participação nos lucros das empresas. A\npartir dessas referências, passou a manifestar-se sistematicamente sobre\nquestões mais gerais, como o fenômeno da globalização da economia, as\nprivatizações de empresas estatais, o sucateamento da indústria\nnacional, a questão fundiária brasileira, o Movimento dos Trabalhadores\nRurais Sem Terra (MST), a violência no campo, o racismo e a situação do\nnegro no país, as secas no Nordeste e os saques populares a estoques de\nalimentos, as mazelas da educação, a qualificação profissional dos\ntrabalhadores etc.\n\nTais tomadas de posição eram, em geral, acompanhadas de ações práticas.\nPor exemplo, em março de 1995 Vicentinho propôs ao presidente Fernando\nHenrique Cardoso debater a reforma previdenciária com a condição de que\no governo retirasse todas as propostas até então enviadas ao Congresso\nNacional. Anunciou também que a CUT fechava questão contra a quebra do\nmonopólio da Petrobras e contra a privatização das empresas de\ntelecomunicações. Pouco depois, a CUT endossou a greve nacional dos\npetroleiros, iniciada no dia 3 de maio, sob o comando da Frente Única\ndos Petroleiros (FUP). Os grevistas reivindicavam o cumprimento de\nacordos trabalhistas anteriores, que vinham sendo desrespeitados, e a\nmanutenção do monopólio da Petrobras na exploração do petróleo. A greve\nfoi considerada abusiva pelo Tribunal Superior do Trabalho (TST), e o\npresidente Fernando Henrique determinou a demissão de líderes, o corte\nde salário dos grevistas e a invasão das refinarias por tropas do\nExército. A greve durou um mês e acabou por dividir o movimento sindical\ncongregado pela CUT, isolando as lideranças mais moderadas.\n\nAs divisões internas na CUT se acirraram no início de 1996, quando\nVicentinho endossou o acordo sobre a reforma da Previdência acertado\nentre o governo e as centrais sindicais. Pelo acordo, a aposentadoria\ndeixaria de ser por tempo de serviço e passaria a ser por tempo de\ncontribuição; teria fim, também, a estabilidade dos servidores públicos\n— temas considerados inegociáveis por amplos setores de base da CUT.\nDiversas correntes internas da CUT e parlamentares do PT e de outros\npartidos de oposição passaram a exigir a retratação de Vicentinho, que\nchegou a ser chamado pejorativamente, por seus adversários no movimento\nsindical, de “ministro sem pasta de Fernando Henrique”. A crise foi\nesvaziada no dia 14 de fevereiro, quando, em plena solenidade de\nformalização do acordo, o presidente da CUT recusou-se a assiná-lo,\nalegando a inclusão, no documento final, de cláusulas que privilegiavam\nos parlamentares e os governadores.\n\nEm abril, por ocasião do massacre de 19 trabalhadores sem-terra em\nEldorado dos Carajás (PA), Vicentinho encontrou-se com o presidente\nFernando Henrique Cardoso para relatar sua visita ao local e pedir\nprovidências urgentes para acelerar a reforma agrária no país.\n\nNo fim do mês, aceitou convite da Federação das Indústrias de São Paulo\n(FIESP) e da Confederação Nacional das Indústrias (CNI) para, em\nconjunto com as demais centrais sindicais, discutir a convocação de uma\ngreve geral contra as altas taxas de juros que levavam a economia à\nrecessão e contra a abertura da economia às empresas estrangeiras. A\ngreve com os empresários acabou sendo descartada, mas a CUT iniciou, com\na Força Sindical e a CGT, um movimento de convocação para uma greve\ngeral contra o desemprego, pela recuperação do poder aquisitivo do\nsalário mínimo, pela manutenção das conquistas trabalhistas na\nConstituição, pela reforma agrária, pela punição aos responsáveis pelos\nfrequentes assassinatos de trabalhadores sem-terra, entre outras\nbandeiras. A greve, realizada em 21 de junho, teve a adesão de 12\nmilhões de trabalhadores em todo o país, número considerado abaixo das\nexpectativas pela grande imprensa.\n\nEm agosto de 1996 Vicentinho foi eleito presidente do Instituto Sindical\nInteramericano pela Igualdade Racial (Isiir), composto pela CUT, a CGT,\na FS, a Organização Regional Interamericana do Trabalho (ORIT) e a\ncentral norte-americana ALF-CIO.\n\nAinda em 1996, o governo encaminhou ao Congresso Nacional projeto de lei\ncomplementar que facilitava a demissão de empregados pelas empresas,\nampliando o conceito de justa causa, com base nas dificuldades\nfinanceiras da empresa e na necessidade de modernização tecnológica.\nVicentinho reagiu, ameaçando denunciar o governo à Organização\nInternacional do Trabalho (OIT) por violar a Convenção nº 158, de 1985,\ne fazendo greve de fome em Brasília, no mês de novembro. Em dezembro,\nrecebido pelo papa em Roma, reafirmou as denúncias.\n\nEm janeiro de 1997, inscreveu-se no Telecurso 2000, curso supletivo do\nsegundo grau, via televisão, que viria a concluir no ano seguinte.\n\nEm julho seguinte, frustrou os planos do secretário-geral da CUT, o\nbancário João Vaccari Neto, também de sua corrente interna do PT, a\ndenominada Articulação, ao decidir concorrer à reeleição, desistindo de\numa possível candidatura a deputado federal nas eleições de 1998. Sua\nreeleição no 6º Congresso da entidade implicou uma composição inédita ao\ndeslocar Vaccari para a vice-presidência, fazendo com que, pela primeira\nvez desde a fundação da entidade, o cargo não fosse ocupado por um\ntrabalhador rural. Em que pese ter sido eleito com a maioria absoluta\ndos votos, Vicentinho não conseguiu evitar divisões internas na CUT e\naté mesmo na sua corrente, a Articulação, de onde surgiram as tendências\nmais à esquerda entre os bancários e outros sindicalistas que passaram a\nse intitular independentes.\n\nEm 1998, figurou como primeiro suplente na chapa de Eduardo Suplicy, que\nfoi eleito para o Senado na legenda petista. No entanto, não chegaria\nassumir o mandato.\n\nDurante sua segunda gestão na presidência da CUT, o número de\ntrabalhadores representados pela central saltou de 4,1 milhões em 1997,\npara seis milhões em 1999.\n\nNesse último ano, Vicentinho iniciou o curso de direito na Universidade\nBandeirante (Uniban), em São Bernardo do Campo, ao mesmo tempo que\ncontinuava a exercer as funções de presidente da CUT, de membro da\ndiretoria executiva do Sindicato dos Metalúrgicos do ABC e de presidente\ndo ISIIR, além de manter seu vínculo de trabalho com a Mercedes-Benz do\nBrasil.\n\nEm outubro de 1999, a CUT liderou e organizou junto com a Força Sindical\numa greve geral, com o objetivo de protestar contra o governo Fernando\nHenrique. Entre outras reivindicações, os grevistas exigiram a suspensão\nda dívida externa brasileira, o fim do acordo com o Fundo Monetário\nInternacional (FMI) e o aumento do salário mínimo para 180 reais.\n\nNo início de 2000, Vicentinho licenciou-se da presidência da CUT para\npoder concorrer, na legenda do PT, à prefeitura de São Bernardo do\nCampo. Não logrou êxito na eleição, perdendo para Maurício Soares. Nesse\nmesmo ano, foi reconhecido como sindicalista do século pelo Almanaque\nAbril 2000.\n\n \n\nDeputado federal\n\n \n\nNa eleição de 2002, foi eleito deputado federal por São Paulo na legenda\npetista, sendo o quinto mais votado no estado, com 250 mil votos. Em\n2003 desligou-se da montadora Mercedes-Benz do Brasil, assumiu o mandato\nna Câmara dos Deputados e durante os trabalhos legislativos, além de se\nenvolver nas questões ligadas ao mundo do trabalho, foi um dos\nparlamentares que fomentaram e criaram a Frente Parlamentar da Igualdade\nRacial.\n\nAinda em 2003, apresentou proposta de emenda constitucional que\ninstituía a liberdade sindical e acabava de forma gradual com o imposto\nsindical obrigatório. Também nesse ano concluiu o curso de direito.\nPouco depois, foi garoto propaganda de uma polêmica campanha\npublicitária da Universidade Bandeirantes (Uniban), um dos maiores\ngrupos privados de ensino superior de São Paulo. O Fórum das Seis,\nentidade que reúne os sindicatos de professores e funcionários das três\nuniversidades estaduais paulistas (USP, Uicamp e Unesp), manifestou seu\nrepúdio ao ato de Vicentinho.\n\nEm 2004 foi eleito presidente da Comissão Especial da Reforma Sindical e\nTrabalhista. Concorreu novamente à eleição para prefeito de São Bernardo\ndo Campo, perdendo dessa vez para o candidato do Partido Socialista\nBrasileiro (PSB), William Dib. Também em 2004 recebeu o Prêmio\nInternacional de Reconhecimento pelo Apoio à Luta contra o Apartheid.\nAinda nessa legislatura foi titular da Comissão Permanente de Trabalho,\nAdministração e Serviço Público da Câmara.\n\nEm 2006 foi reeleito deputado federal por São Paulo na legenda do PT. Na\nlegislatura iniciada em 2007 confirmou sua presença em várias frentes\nparlamentares, entre elas a da Defesa do Meio Ambiente e a da Defesa da\nMicro e Pequena Empresa. Manteve-se como um dos principais articuladores\nda Frente Parlamentar de Igualdade Racial, atuando com forte empenho\npela aprovação do Projeto de Lei nº 6.264, conhecido como Estatuto\nRacial.\n\nEm 2007 foi eleito um dos vice-líderes da bancada do PT. Foi relator do\nprojeto de lei que oficializou o funcionamento das centrais sindicais e\napresentou também o Projeto de Lei nº 285/07, que propôs o seguro-fiança\nem contratos de locação de imóveis. Nesse mesmo ano, obteve o\nreconhecimento como um dos cem melhores parlamentares e um dos 30\nmelhores debatedores no Congresso Nacional, conforme o DIAP.\n\nTeve quatro filhos de seu primeiro casamento. Com sua segunda esposa,\nRoseli Oneide Zerbinato da Silva, teve dois filhos. Teve também uma\nfilha com Elisete Rocha de Oliveira.\n\n \n\n*Maria Cristina Guido/Sinclair Cechine/Orson Camargo*\n\n \n\nFONTES: *Estado de S. Paulo* (28/5/95, 19/1, 1 e 11/2, 3/3, 25 e 26/4,\n22/6/96 e 9/3/97); *Folha de S. Paulo*, 14 e 15/1, 11/2, 29/3, 15/4, 13\ne 14/5 e 4/6/95, 19 e 26/1, 8, 19 e 28/2, 22/6, 23/10 e 11/11/96 e\n18/8/97, 24/07/1998, 24/09/1999, 08/10/1999, 19/10/2002, 22/04/2003,\n12/06/2003,  01/09/2003, 24/06/2004, 04/10/2004, 18/05/2005, 29/07/2007,\n22/09/2007, 08/03/2008. Disponível em \\<www.folha.uol.com.br \\>, acesso\nem 10/07/2009. *Globo* (12/2, 17/3, 26/5 e 8/6/95, 17 e 28/1, 8 e 28/3,\n1 e 22/6/96); INF. SECRETARIA NACIONAL DA CUT; *Jornal do Brasil* (28/2,\n17/3, 13 e 14/5 , 15/6 e 4/7/95, 19, 20, 21, 24, 26, 27 e 28/1, 7 e\n28/3, 26/4, 2/5, 22/6, 4/9 e 14/11/96 e 18/8/97);*Veja* (13/2 e\n23/10/91, 12/8/92, 10 e 31/5/95, 31/1, 14/2 e 26/6/96). Site do portal\nDemocracia \\<[www.democracia.com.br](http://www.democracia.com.br/)\\>,\nacesso em 04/06/2009. Site do Partido dos Trabalhadores\n\\<[www.pt.org.br](http://www.pt.org.br/)\\>, acesso em 03/06/2009. Site\ndo Deputado Vicentinho\n\\<[www.vicentinho.org.br](http://www.vicentinho.org.br/)\\>, acesso em\n10/06/2009. Site da Câmara dos Deputados\n\\<[www.camara.gov.br](http://www.camara.gov.br/)\\>, acesso em\n04/06/2009. Site da Fundação Seade-SP\n\\<[www.seade.gov.br](http://www.seade.gov.br/)\\>, acesso em 02/07/2009.\nSite da Associação dos Docentes da Universidade de São Paulo\n\\<[www.adusp.org.br](http://www.adusp.org.br/)\\>, acesso em 28/07/2009.\nSite da Central Única dos Trabalhadores\n\\<[www.cut.org.br](http://www.cut.org.br/)\\>, acesso em 09/06/2009. Site\nda Fundação Perseu Abramo \\<[www.fpa.org.br](http://www.fpa.org.br/)\\>,\nacesso em 12/06/2009. Site do Departamento Intersindical de Assessoria\nParlamentar \\<[www.diap.org.br](http://www.diap.org.br/)\\>, acesso em\n07/07/2009.\n\n* *\n\n* *\n","ref":"FONTES: *Estado de S. Paulo* (28/5/95, 19/1, 1 e 11/2, 3/3, 25 e 26/4,\n22/6/96 e 9/3/97); *Folha de S. Paulo*, 14 e 15/1, 11/2, 29/3, 15/4, 13\ne 14/5 e 4/6/95, 19 e 26/1, 8, 19 e 28/2, 22/6, 23/10 e 11/11/96 e\n18/8/97, 24/07/1998, 24/09/1999, 08/10/1999, 19/10/2002, 22/04/2003,\n12/06/2003,  01/09/2003, 24/06/2004, 04/10/2004, 18/05/2005, 29/07/2007,\n22/09/2007, 08/03/2008. Disponível em \\<www.folha.uol.com.br \\>, acesso\nem 10/07/2009. *Globo* (12/2, 17/3, 26/5 e 8/6/95, 17 e 28/1, 8 e 28/3,\n1 e 22/6/96); INF. SECRETARIA NACIONAL DA CUT; *Jornal do Brasil* (28/2,\n17/3, 13 e 14/5 , 15/6 e 4/7/95, 19, 20, 21, 24, 26, 27 e 28/1, 7 e\n28/3, 26/4, 2/5, 22/6, 4/9 e 14/11/96 e 18/8/97);*Veja* (13/2 e\n23/10/91, 12/8/92, 10 e 31/5/95, 31/1, 14/2 e 26/6/96). Site do portal\nDemocracia \\<[www.democracia.com.br](http://www.democracia.com.br/)\\>,\nacesso em 04/06/2009. Site do Partido dos Trabalhadores\n\\<[www.pt.org.br](http://www.pt.org.br/)\\>, acesso em 03/06/2009. Site\ndo Deputado Vicentinho\n\\<[www.vicentinho.org.br](http://www.vicentinho.org.br/)\\>, acesso em\n10/06/2009. Site da Câmara dos Deputados\n\\<[www.camara.gov.br](http://www.camara.gov.br/)\\>, acesso em\n04/06/2009. Site da Fundação Seade-SP\n\\<[www.seade.gov.br](http://www.seade.gov.br/)\\>, acesso em 02/07/2009.\nSite da Associação dos Docentes da Universidade de São Paulo\n\\<[www.adusp.org.br](http://www.adusp.org.br/)\\>, acesso em 28/07/2009.\nSite da Central Única dos Trabalhadores\n\\<[www.cut.org.br](http://www.cut.org.br/)\\>, acesso em 09/06/2009. Site\nda Fundação Perseu Abramo \\<[www.fpa.org.br](http://www.fpa.org.br/)\\>,\nacesso em 12/06/2009. Site do Departamento Intersindical de Assessoria\nParlamentar \\<[www.diap.org.br](http://www.diap.org.br/)\\>, acesso em\n07/07/2009.\n\n* *\n\n* *\n","dic":"DHBB"}
