{"title":"VIDIGAL, Alcides da Costa","cargoss":["Revolucionário ou revoltoso","Deputado federal","Presidente do Banco do Brasil"],"cargos_esp":[0,0,0],"datas_ini":[1932,1954,1955],"datas_fim":[1932,1954,1955],"estados":[0,"SP",0],"autor":[0],"content":"**VIDIGAL, Alcides da Costa**\n\n\\*rev. 1932; dep. fed. SP 1954; pres. Bco. Bras. 1955.\n\n \n\n*Alcides da Costa Vidigal* nasceu na cidade de São Paulo no dia 1º de\nagosto de 1895, filho de Afrodísio Vidigal e de Luísa Benvinda da Costa\nVidigal. Seu irmão, Gastão Vidigal, foi deputado classista representando\nos empregadores do comércio de 1935 a 1937 e ministro da Fazenda em\n1946.\n\nRealizou os primeiros estudos no Grupo Escolar Prudente de Morais e no\nGinásio São Bento, entre 1906 e 1911, diplomando-se em 1916 pela\nFaculdade de Direito da Universidade de São Paulo. Durante sua vida\nuniversitária foi primeiro-secretário do Centro Acadêmico XI de Agosto e\nmembro da primeira biblioteca circular da sua faculdade.\n\nFoi inspetor federal do Ginásio de Campinas de 1916 a 1920, curador das\nvítimas de acidentes do trabalho entre 1920 e 1924 e procurador de banco\nde 1927 a 1931.\n\nParticipou da Revolução Constitucionalista de 1932, irrompida em São\nPaulo, tendo sido secretário da comissão executiva da Campanha do Ouro,\norganizada para financiar as ações dos rebeldes paulistas. Diretor do\nBanco de São Paulo de 1934 a 1937, em 1936 tornou-se consultor jurídico\nda Bolsa de Valores do estado e em 1941 foi nomeado diretor da Caixa\nEconômica Federal em São Paulo, cargo que exerceria até 1945. De 1943 a\n1945 integrou também o conselho administrativo e em 1949 foi nomeado\npresidente da Caixa Econômica Federal de São Paulo.\n\nNas eleições de outubro e 1950 elegeu-se suplente de deputado federal\npor São Paulo na legenda do Partido Social Democrático (PSD). Em 1953\npassou a presidir o Instituto dos Advogados de São Paulo e a integrar o\nTribunal de Ética da Ordem dos Advogados. De junho a novembro de 1954\nocupou uma cadeira na Câmara dos Deputados.\n\nEm abril de 1955 foi nomeado presidente do Banco do Brasil, sucedendo a\nClemente Mariani, que se exonerara do cargo no dia 5 de abril, por\ndiscordar dos termos do chamado Acordo Jânio Quadros-Café Filho. Segundo\nesse acordo, Jânio Quadros, então governador de São Paulo (1955-1958),\ndeveria desistir de sua candidatura à presidência da República em favor\nda de Juarez Távora, apoiada pelo presidente Café Filho (1954-1955). Em\ntroca, os paulistas teriam sua presença assegurada em dois ministérios e\nna presidência do Banco do Brasil. Alcides Vidigal deixou o cargo em\noutubro do mesmo ano.\n\nFoi superintendente da Companhia Brasileira de Material Ferroviário e da\nsucursal de São Paulo da Companhia de Seguros Minas Brasil, diretor da\nsociedade Construtora de Imóveis, diretor-presidente da construtora de\nimóveis Casa Bancária, vice-presidente da Companhia Industrial São\nPaulo-Rio e presidente da Fábrica de Tecidos Labor, da Companhia Vidigal\nPrado Comissária Exportadora e da Vidigal Aranha Comissionária\nExportadora.\n\nCasou-se em primeiras núpcias com Tercília Camargo Vidigal, e em\nsegundas núpcias com Maria da Costa Carvalho Vidigal. Teve 13 filhos.\n\nPublicou Legislação social (1925) e Acidentes do trabalho (1935).\n\n \n\n \n\nFONTES: CAFÉ FILHO, J. Sindicato; CÂM. DEP. Deputados; COUTINHO, A.\nBrasil; MELO, L. Dic.; MONTEIRO, F. Banco; MUSEU DO BANCO DO BRASIL;\nSOC. BRAS. EXPANSÃO COMERCIAL. Quem.\n\n \n","ref":"FONTES: CAFÉ FILHO, J. Sindicato; CÂM. DEP. Deputados; COUTINHO, A.\nBrasil; MELO, L. Dic.; MONTEIRO, F. Banco; MUSEU DO BANCO DO BRASIL;\nSOC. BRAS. EXPANSÃO COMERCIAL. Quem.\n\n \n","dic":"DHBB"}
