{"title":"AGUIAR, João","cargoss":["Constituinte","Deputado federal"],"cargos_esp":[0,0],"datas_ini":[1946,1946],"datas_fim":[1946,1951],"estados":[0,"PR"],"autor":[0],"content":"**AGUIAR, João**\n\n\\*const. 1946; dep. fed. PR 1946-1951.\n\n \n\n*João Aguiar* nasceu em Ribeirão Preto (SP) no dia 9 de julho de 1893,\nfilho de João Carlos de Aguiar e de Elisa Correia de Aguiar.\n\nDepois de cursar o Ginásio Estadual, em sua cidade natal, formou-se pela\nEscola de Agronomia de Piracicaba (SP), em 1918.\n\nTransferindo-se para o Paraná, foi agropecuarista e industrial neste\nestado e prefeito de Jacarezinho entre 1928 e 1930. Elegeu-se deputado\nestadual em outubro de 1934, vindo a exercer o mandato entre maio de\n1935 e 10 de novembro de 1937, quando o golpe do Estado Novo suprimiu os\nórgãos legislativos do país.\n\nEm 1945 foi eleito deputado federal constituinte pelo Paraná na legenda\ndo Partido Social Democrático (PSD). Promulgada a Constituição e\ntransformada a Assembléia em Câmara ordinária, pertenceu à Comissão\nPermanente de Tomada de Contas em 1948. Tentou a reeleição no pleito de\noutubro de 1950, pelo PSD, mas não foi bem-sucedido. Deixou a Câmara em\n31 de janeiro de 1951, ao término da legislatura.\n\nFoi membro do Conselho Consultivo do Departamento Nacional do Café.\n\nFaleceu em Jacarezinho no dia 20 de dezembro de 1986.\n\nSolteiro, não teve filhos.\n\n\\\n FONTES: CÂM. DEP. *Deputados*; *Diário do Congresso Nacional*; *Grande\nencic. Delta*; INF. BIOG.; SILVA, G. *Constituinte*.\n\n \n","ref":" FONTES: CÂM. DEP. *Deputados*; *Diário do Congresso Nacional*; *Grande\nencic. Delta*; INF. BIOG.; SILVA, G. *Constituinte*.\n\n \n","dic":"DHBB"}
