{"title":"VILAS-BOAS, Antônio Martins","cargoss":["Ministro do Supremo Tribunal Federal"],"cargos_esp":[0],"datas_ini":[1957],"datas_fim":[1966],"estados":[0],"autor":[0],"content":"**VILAS-BOAS, Antônio Martins**\n\n\\*magistrado; min. STF 1957-1966.\n\n \n\n*Antônio Martins Vilas Boas* nasceu em Guiricema, município de Visconde\ndo Rio Branco (MG), no dia 15 de novembro de 1896, filho de Albino\nMartins Vilas Boas e de Cecília de Paiva Vilas Boas.\n\nRealizou os estudos primários em sua terra natal, cumprindo os de nível\ncolegial no Ginásio São José, em Ubá (MG), e no Ginásio Gramery, em Juiz\nde Fora (MG). Após os preparatórios, realizados em Belo Horizonte,\nmatriculou-se na Faculdade Livre de Direito de Minas Gerais, pela qual\nse diplomou em 1923. Ainda durante o curso universitário, trabalhou como\ntelegrafista na antiga Repartição dos Correios e Telégrafos da capital\nmineira, onde teve como colegas os futuros presidente e vice-presidente\nda República, Juscelino Kubitschek e José Maria Alkmin.\n\nFoi promotor de justiça e delegado de polícia da comarca de Patos, atual\nPatos de Minas (MG), em 1924 e, nesse mesmo ano, casou-se com Alda\nFonseca Vilas Boas. Nomeado juiz municipal de Miraí (MG) em 1927 e\nprefeito da cidade balneária de Araxá (MG) em 1930, foi procurador\nfederal em Minas Gerais em 1931, e procurador-geral do estado entre 1932\ne 1936, passando depois a desempenhar ali as funções de juiz do Tribunal\nde Justiça. Em 1939, conquistou a cátedra de direito civil da Faculdade\nde Direito de Minas Gerais com a tese Dos efeitos das nulidades em\nmatéria de casamento.\n\nCom a deposição de Getúlio Vargas em 29 de outubro de 1945, todos os\ninterventores federais nos estados foram substituídos por autoridades\njudiciárias, tendo sido o desembargador Nísio Batista de Oliveira\nnomeado interventor em Minas Gerais. Vilas Boas foi designado secretário\nde Finanças, cargo no qual tomou posse em 5 de novembro de 1945, nele\npermanecendo durante a curta gestão do interventor, que se estendeu\napenas até 1º de janeiro do ano seguinte. Após deixar esse posto, Vilas\nBoas voltou a exercer suas funções de juiz do Tribunal de Justiça de\nMinas Gerais até 13 de fevereiro de 1957, quando foi nomeado pelo\npresidente Kubitschek ministro do Supremo Tribunal Federal (STF) em\nsubstituição a Edgar Costa, que se aposentara em janeiro daquele ano.\n\nComo ministro do STF, Vilas Boas votou favoravelmente à transferência\ndesse órgão para Brasília, o que de fato se consumou a partir de abril\nde 1960. Participou de diversos julgamentos de importância política,\ncomo ocorreu em 18 de setembro de 1957, quando votou a favor das\nrepresentações dos diretórios regionais do Partido Socialista Brasileiro\n(PSB) e do Partido Republicano (PR), bem como da deputada Almerinda\nMagalhães Arantes, contra o Ato Constitucional nº 1, promulgado em maio\nde 1957 pela Assembléia Legislativa de Goiás, prorrogando por mais um\nano os mandatos do governador, do vice-governador e dos prefeitos desse\nestado. A votação do STF processou-se por unanimidade.\n\nComo os demais membros do STF, em 20 de novembro de 1957 Vilas Boas\nconcluiu pela constitucionalidade da Lei Federal nº 1.079, de 10 de\nabril de 1950, com base na qual a Assembléia Legislativa de Alagoas\nmovera um processo de impeachment contra o governador do estado,\nSebastião Marinho Muniz Falcão, afastado do cargo sob a acusação de\ncrime de responsabilidade. No julgamento desse mesmo recurso,\nentretanto, os membros do STF concluíram pela inconstitucionalidade da\nescolha dos representantes da Assembléia Legislativa alagoana para o\ntribunal que julgara o governador, daí resultando a volta deste ao poder\nem 1958 e o cumprimento de seu mandato até 31 de janeiro de 1961.\n\nEmbora voto vencido, Vilas Boas participou também de outro julgamento\nimportante, em que o STF negou a representação de 19 de janeiro de 1961\napresentada pelo procurador-geral da República Cândido de Oliveira Neto.\nEm seu recurso, este afirmava a inconstitucionalidade do Ato\nConstitucional nº 1, elaborado pela Assembléia Legislativa e\nConstituinte do estado da Guanabara em 29 de dezembro de 1960, segundo o\nqual a Assembléia exerceria em toda a plenitude e com exclusividade as\nfunções de Poder Legislativo do novo estado e, além disso, enquanto não\nfosse votada a organização jurídica e administrativa do mesmo,\nlegislaria sobre a administração da cidade do Rio de Janeiro. O\nprocurador-geral argüía ainda a inconstitucionalidade dos atos do\ngovernador da Guanabara baseados no Ato Constitucional nº 1.\n\nOutro julgamento de grande repercussão nacional de que participou Vilas\nBoas foi o do pedido de habeas-corpus formulado pelo ex-governador do\nParaná, Moisés Lupion, que fora acusado de crime de peculato perante o\nTribunal de Justiça daquele estado e tivera decretada sua prisão\npreventiva. A votação, que concluiu pela negação do pedido do\nex-governador paranaense, ocorreu em 31 de maio de 1961, tendo Vilas\nBoas votado favoravelmente à solicitação feita por Lupion.\n\nTendo integrado em 1960 como juiz substituto o Tribunal Superior\nEleitoral (TSE), Vilas Boas dele se tornou membro efetivo em 1963.\nExerceu a presidência dessa corte de 9 de março de 1965 a 15 de novembro\nde 1966, quando se aposentou como ministro do STF por haver alcançado o\nlimite de idade constitucional.\n\nMembro do Instituto dos Advogados e da Sociedade Mineira de Agricultura,\nVilas Boas foi ainda presidente do Conselho Estadual da Igreja Batista.\n\nFaleceu no dia 10 de novembro de 1987.\n\nEra casado com Alda Fonseca Vilas Boas, com quem teve seis filhos.\n\nEscreveu *Do casamento putativo*.\n\nJorge Miguel Mayer\n\n \n\nFONTES: BALEEIRO, A. *Supremo*; CORTÉS, C. *Homens*; COSTA, E.\n*Grandes*; *Grande encic. Delta*; INF. SUP. TRIB. FED.; *Rev. Arq. Públ.\nMineiro* (12/76).\n\n \n","ref":"FONTES: BALEEIRO, A. *Supremo*; CORTÉS, C. *Homens*; COSTA, E.\n*Grandes*; *Grande encic. Delta*; INF. SUP. TRIB. FED.; *Rev. Arq. Públ.\nMineiro* (12/76).\n\n \n","dic":"DHBB"}
