{"title":"VILAS-BOAS, Gérson","cargoss":["Deputado federal"],"cargos_esp":[0],"datas_ini":[1989],"datas_fim":[1991],"estados":["SE"],"autor":[0],"content":"**VILAS-BOAS, Gérson**\n\n\\*dep. fed. SE 1989-1991.\n\n \n\n*Gérson Vilas-Boas* nasceu em Laje (BA) no dia 1º de novembro de 1934,\nfilho de Manoel Marcelino Vilas-Boas e de Rosa Peixoto Vilas-Boas.\n\nFez o curso secundário no Colégio Taylor-Egídio, de Jaguaquara (BA),\nonde em 1956 iniciou a carreira de professor. Estudou teologia no\nSeminário Teológico Batista do Norte do Brasil (1959-1962). Diretor do\nprograma *Voz batista de Sergipe*, na Rádio Liberdade (1964) foi nomeado\npastor da Igreja Betel, em Aracaju. Presidente da junta executiva da\nConvenção Batista de Sergipe e membro da junta administrativa do\nSeminário Teológico Batista do Norte do Brasil (1965-1966), tesoureiro\nda União de Ministros Evangélicos de Aracaju (1967), deu continuidade ao\nseu trabalho na emissora, assumindo o programa *O caminho da verdade*\n(1967-1973).\n\nIntegrante das comissões executivas da Convenção Batista Nacional e da\nConvenção Batista Missionária do Nordeste (1968-1969), secretário da\nUnião de Ministros Evangélicos de Sergipe e vice-presidente do Grêmio\nEstudantil D. Luciano Cabral Duarte (1970), cursou filosofia na\nUniversidade Católica de Pernambuco. Contratado pela Secretaria de\nEducação e Cultura de Aracaju lecionou organização social e política do\nBrasil e educação moral e cívica, tornando-se professor de psicologia do\nSeminário Teológico Evangélico Batista Nacional, em Belo Horizonte\n(1971). Diplomado em pedagogia pela Universidade Federal de Sergipe,\nespecializou-se em orientação educacional (1972).\n\nDepois de obter a pós-graduação em informação ocupacional pela Fundação\nGetulio Vargas, do Rio de Janeiro (1975), e em psicologia, pela\nFaculdade de Educação da UFS (1976), assumiu a direção e produção do\nprograma *Cristo*, *o caminho da vida*, na TV Atalaia (1978). Professor\nde metodologia do ensino na Faculdade Pio X, de Aracaju (1979), e\npresidente do diretório regional da Sociedade Bíblica do Brasil\n(1981-1988), lecionou psicologia (1982) e biblioteconomia (1983) na\nFaculdade Tiradentes, de Aracaju. Presidente da União dos Ministros\nEvangélicos de Sergipe, pastor da Igreja Batista Ebenezer, em Brasília,\ne secretário-geral da Convenção Batista Nacional, assumiu a presidência\nda Sociedade Evangélica Beneficente Ebenezer, no Distrito Federal, e do\nConselho de Planejamento Evangélico e Execução — Sergipe-Alagoas, em\nAracaju (1985).\n\nIniciou a carreira política em novembro de 1986, candidatando-se à\nCâmara dos Deputados pela legenda do Partido do Movimento Democrático\nBrasileiro (PMDB). Suplente, ocupou entre janeiro e agosto de 1989 a\nvaga do deputado Acival Gomes, que se licenciara para assumir a\nSecretaria de Obras, Transportes e Energia de Sergipe. Presidente da\nAssociação Cultural, Educacional e Social de Base, em Brasília, nas\neleições de outubro de 1990 tentou mais uma vez eleger-se deputado\nfederal, obtendo de novo uma suplência.\n\nEm outubro de 1994 foi malsucedido na terceira tentativa de conquistar\num mandato federal. Dois anos depois conseguiu eleger-se vereador de\nAracaju, pela legenda do Partido Social Cristão (PSC), assumindo o\nmandato em janeiro de 1997. Em outubro de 1998, ainda pelo PSC, tentou\nsem êxito uma cadeira na Assembléia Legislativa de Sergipe.\n\nNo pleito de 2000, concorreu a uma vaga para a Câmara de Vereadores de\nAracaju pelo PSC, mas não obteve êxito. Nas eleições municipais de 2004\ncandidatou-se mais uma vez a vereador de Aracaju na legenda do PSC e\nobteve uma suplência. Em outubro de 2006, filiado ao Partido Verde (PV),\ndisputou por essa legenda uma vaga na Câmara dos Deputados por Sergipe,\nmas não foi eleito.\n\nDe volta ao PMDB, no pleito de 2008 candidatou a vereador de Aracaju e\nnão foi eleito.\n\n \n\nCasou-se com Nádia Fraga Vilas-Boas, com quem teve duas filhas.\n\n \n\nFONTES: CÂM. DEP. *Deputados brasileiros. Repertório* (1991-1995); INF.\nBIOG, [www.tse.gov.br](http://www.tse.gov.br/) acesso em 15/11/09\n\n \n","ref":"FONTES: CÂM. DEP. *Deputados brasileiros. Repertório* (1991-1995); INF.\nBIOG, [www.tse.gov.br](http://www.tse.gov.br/) acesso em 15/11/09\n\n \n","dic":"DHBB"}
