{"title":"BARROS, Reinaldo de","cargoss":["Prefeito"],"cargos_esp":["São Paulo"],"datas_ini":[1979],"datas_fim":[1982],"estados":[0],"content":"**BARROS, Reinaldo de**\n\n\\*pref. São Paulo 1979-1982.\n\n* *\n\n*Reynaldo Emygdio de Barros* nasceu na cidade de São Paulo no dia 14 de\nmaio de 1931, filho de Antônio Emídio de Barros Filho e de Maria\nAntonieta Ferreira de Barros. Seu pai foi suplente do senador paulista\nLino de Matos e assumiu sua cadeira no Senado de junho de 1955 a abril\nde 1956. Seu tio Geraldo Pereira de Barros foi deputado federal por São\nPaulo de 1963 a 1967. Outro tio, Ademar de Barros, foi interventor em\nSão Paulo (1938-1941) e duas vezes governador do estado (1947-1951 e\n1963-1966). Seu primo Antônio Mendes de Barros foi deputado federal por\nSão Paulo entre 1963 e 1967. Outro primo, Ademar de Barros Filho, foi\ndeputado federal entre 1967 e 1983, constituinte entre 1987 e 1988, e\nnovamente deputado federal entre 1987 e 1991 e entre 1995 e 1999.\n\nFormado em engenharia civil pela Escola Politécnica da Universidade de\nSão Paulo (USP) em 1953, trabalhou dez anos na iniciativa privada como\nempresário do ramo de de tecidos e como diretor do Banco Líder de Minas\nGerais e membro do Conselho de Administração do Banco Geral do Comércio.\nApós 1963 foi diretor-financeiro e presidente das Centrais Elétricas de\nUrubupungá S.A. (Celusa), uma das empresas que posteriormente formaram a\nCompanhia Energética de São Paulo S.A. (CESP), da qual o governo\npaulista detinha o controle acionário. Durante sua passagem pela Celusa,\nangariou junto ao Banco Interamericano de Desenvolvimento (BID) recursos\npara a construção das usinas de Ilha Solteira e Jupiá. De 1968 a 1971,\nno governo de Roberto Abreu Sodré, presidiu o Instituto de Previdência\ndo Estado de São Paulo (IPESP), e em 1975, na gestão de Paulo Egídio\nMartins, foi presidente da Companhia de Saneamento Básico do Estado de\nSão Paulo (Sabesp).\n\nEm junho de 1979, a Assembléia Legislativa de São Paulo, em sessão\nextraordinária, ratificou a indicação de seu nome, feita pelo governador\nPaulo Maluf, para a prefeitura da capital paulista. Durante a votação, o\nchamado “grupo autêntico” do Movimento Democrático Brasileiro (MDB),\npartido que abrigava a oposição a Maluf e ao regime militar instaurado\nno país em abril de 1964, denunciou uma tentativa de suborno por parte\ndos aliados do governo em troca de votos para Reinaldo de Barros. Na\nocasião, a bancada emedebista, que era maioria, dividiu-se, o que acabou\npermitindo a aprovação de seu nome como prefeito de São Paulo, em\nsubstituição a Olavo Setúbal.\n\nEmpossado na prefeitura em julho de 1979, após a extinção do\nbipartidarismo em novembro desse ano e a consequente reorganização\npartidária, ingressou no Partido Democrático Social (PDS), de apoio ao\nregime militar. Na prefeitura, sofreu dura oposição do movimento popular\norganizado, que, no fim da década de 1970 e no início dos anos 1980,\ndespontara em São Paulo com força bastante considerável. Denunciou\ndiversas vezes aqueles que classificava como “agitadores do povo”,\nafirmando que fazia diferença entre os movimentos “reivindicatórios” e\nos “induzidos”. Sua forma de fazer política foi identificada pela\noposição com o velho ademarismo (de seu tio Ademar de Barros),\nconsiderado populista e demagógico.\n\nEm maio de 1981, na festa de seu 50º aniversário — que, segundo a\noposição, teria sido financiada com recursos públicos —, foi lançado\npré-candidato à sucessão de Maluf no governo do estado. Apoiado por\nantigos ademaristas e por alguns líderes do PDS, foi indicado candidato\na governador na convenção do partido, em 1982. Na ocasião, houve\ndenúncias de que teria utilizado a máquina administrativa da prefeitura\nem benefício próprio.\n\nDerrotado no pleito de novembro de 1982 por Franco Montoro, do Partido\ndo Movimento Democrático Brasileiro (PMDB), permaneceu afastado da vida\npública até 1986, quando, convidado pelo prefeito Jânio Quadros, assumiu\na Secretaria Municipal de Vias Públicas da capital paulista. Ficou pouco\ntempo no cargo, pois em novembro do mesmo ano integrou, como vice de\nMaluf, a chapa do PDS que concorreu ao governo de São Paulo.  Tendo sido\nsua chapa derrotada — o eleito foi Orestes Qúercia, do PMDB —, passou\nnovo período afastado da política e só veio a ocupar cargo público em\njaneiro de 1993, quando foi mais uma vez foi nomeado secretário de Vias\nPúblicas de São Paulo pelo prefeito Paulo Maluf, que tinha sido eleito\nem outubro do ano anterior. Mesmo antes de empossado, já anunciou a\norientação do governo eleito, tornando público que iria endividar a\ncidade para fazer as obras que a administração petista de Luísa Erundina\n(1989-1993) não realizara. Passou a acumular também a Secretaria de\nServiços e Obras e a presidência da Empresa Municipal de Urbanização\n(Emurb).\n\nCom a eleição de Celso Pitta, afilhado político de Maluf, para a\nprefeitura paulistana em novembro de 1996, e sua posse em 1º de janeiro\nde 1997, foi mantido nos cargos que ocupava. Dias depois declarou que a\nsituação do comércio ambulante era tão complicada que era melhor “tirar\no povo das ruas”. Em março, o jornal *O Estado de S. Paulo* denunciou\nque a Secretaria de Serviços e Obras tinha contratado em 1994, sem\nlicitação, a empresa Logos Engenharia, de propriedade de um tio de\nReinaldo de Barros, para implantar um sistema informatizado de controle\ndo lixo destinado aos aterros sanitários, aos incineradores e às usinas\nde compostagem de São Paulo. A alegação da prefeitura para que não\ntivesse sido aberta concorrência era que apenas aquela empresa teria\ncapacidade técnica para prestar o serviço. Embora o contrato tenha sido\naprovado por unanimidade pelo Tribunal de Contas do Município (TCM), o\nMinistério Público caracterizou a contratação como “improbidade\nadministrativa” e apresentou liminar com o objetivo de afastar Reinaldo\nde Barros do cargo e pôr seus bens em disponibilidade. Em setembro de\n1997, a 3ª Vara de Fazenda Pública de São Paulo julgou procedente a ação\ne condenou a empresa Logos e o secretário municipal a ressarcirem os\ncofres públicos. Desde então, afastou-se da vida pública.\n\nAgricultor e pecuarista, adquiriu propriedades rurais nos estados de São\nPaulo e Mato Grosso. Foi, também, piloto civil do Ministério da\nAeronáutica.\n\nFaleceu em São Paulo no dia 11 de fevereiro de 2011.\n\nFoi casadp com Maria do Carmo Padovan de Barros, com quem teve três\nfilhos. Um deles, Reinaldo de Barros Filho, foi eleito deputado estadual\nem 1994 na legenda do Partido Progressista Reformador (PPR), e reeleito\nem outubro de 1998, na legenda do Partido Progressista Brasileiro (PPB).\n\n \n\nLuís Otávio de Sousa/Marcelo Costa\n\n \n\n**FONTES**: *Estado de S. Paulo*(15, 16, 3 e 6/12/81, 5, 8, 11, 21 e\n15/6/97, 8/10/98, 16/2/11); *Folha de S. Paulo* (15/5, 14/6, 8/7, 10/9 e\n10/12/81, 20/11/92, 3/12/96, 22/3 e 17/9/97); *Jornal do Brasil* (1/2,\n30/6, 11, 13/7 e 11/11/96); *Manchete*(21/7/79, 22/3/80); *Olho na\nAssembléia/Jornal do Brasil*(14/3/95).\n\n \n\n \n","ref":"","dic":"DHBB"}
