{"title":"VIVEIROS, Lúcia ===============","cargoss":["Deputado federal"],"cargos_esp":[0],"datas_ini":[1979],"datas_fim":[1987],"estados":["PA"],"autor":[0],"content":"VIVEIROS, Lúcia\n===============\n\n\\* dep. fed. PA 1979-1987.\n\n \n\n*Lúcia Daltro Viveiros* nasceu em Belém no dia 13 de abril de 1935,\nfilha de Geraldo Daltro da Silveira e Zenaide Lopes Daltro.\n\nAssessora da Comissão de Abastecimento e Preços do Pará (Coap) em 1951 e\nassistente técnica do Departamento Nacional de Estradas de Rodagem\n(DNER), formou-se, em 1959, em engenharia civil pela Escola de\nEngenharia do Pará. Ao longo do curso, desenvolveu outras atividades,\ntendo sido fundadora, em 1954, do núcleo da Legião da Boa Vontade (LBV)\nem  Belém, instituição da qual tornou-se mantenedora e presidente. Em\n1956, estreou *Futebol da Caridade*, na Rádio Clube do Pará, por\niniciativa da LBV-Belém, programa que permaneceria no ar até 1971.\n\nTornou-se professora da cadeira de geometria descritiva em 1965 na\nEscola de Engenharia do Pará, mesmo ano em que fundou a organização\nOposição da Mulher Paraense por uma Vida Melhor. Três anos depois,\nformou-se em arquitetura pela Universidade Federal do Pará. Fez ainda\ncursos de especialização em urbanismo, arquitetura de interiores,\npintura e decoração.\n\nNa década de 1970, concentrou seus esforços na luta pela defesa dos\ndireitos da mulher. Em 1972, levou ao pela Rádio Guajará o programa *A\nVoz da Mulher Paraense*, que chegaria ao fim em 1987 depois de passar a\nser apresentado na Rádio Marajoara a partir de 1976. Em 1975, foi\nfundadora e presidente da Legião da Mulher Paraense (Lempa) –\ninstituição filantrópica de amparo às mulheres, crianças, idosos\ncarentes e doentes – promovendo assistência jurídica e social em geral.\nEm 1978, apresentou na TV Guajará o programa *Presença da Mulher*, além\nde fundar a Frente Nacional da Assistência ao Povo.\n\nJá bastante conhecida do eleitorado paraense, no pleito de novembro de\n1978 candidatou-se a uma vaga na Câmara dos Deputados, na legenda do\nMovimento Democrático Brasileiro (MDB), partido de oposição ao regime\nmilitar instaurado no país em abril de 1964. Eleita com uma expressiva\nvotação, tomou posse em fevereiro de 1979, vindo a integrar a Comissão\ndo Interior e exercendo a suplência da Comissão de Comunicação\n(1979-1982). Com a aprovação da Lei Orgânica dos Partidos, que extinguiu\no bipartidarismo em dezembro de 1979, filiou-se ao Partido Popular (PP).\n\nTerceira suplente da mesa na Câmara dos Deputados, foi a primeira mulher\nna história do Parlamento brasileiro a presidir algumas vezes a Câmara\ndurante o período 1981-1983. Em março de 1981, manifestou-se contra o\nprojeto de lei complementar do Executivo que propunha a criação do\nterritório de Carajás, cujas terras seriam desmembradas do Pará.\nSuplente da Comissão de Relações Exteriores entre 1982 e 1983, integrou,\nneste último ano, a Comissão do Interior.\n\nCom a incorporação do PP ao Partido do Movimento Democrático Brasileiro\n(PMDB) em fevereiro de 1982, acabou ingressando no Partido Democrático\nSocial (PDS). Foi reeleita, em novembro, como a candidata mais votada em\ntodo o estado com 62 mil votos. Nesse novo mandato, que assumiu em\nfevereiro do ano seguinte, foi coordenadora do movimento feminino do\nPDS. Durante a legislatura, apresentou emenda que propunha a criação do\nMinistério da Mulher e da Criança, projeto que obrigava a construção de\ncreches nas instalações do Banco Nacional de Habitação (BNH). Propôs\ntambém que a mulher e o homem fossem considerados chefes da sociedade\nconjugal, medida posteriormente adotada pelo Código Civil Brasileiro, a\ncriação de escolas agrícolas de ensino médio no Pará e no Brasil e a\ngratuidade nos transportes urbanos para pessoas com mais de 60 anos.\n\nEm 25 de abril de 1984, votou a favor da emenda Dante de Oliveira, que\npropunha o restabelecimento das eleições diretas para presidente da\nRepública em novembro daquele ano, mas que não obteve o número de votos\nindispensáveis à sua aprovação – faltaram 22 para que o projeto pudesse\nser encaminhado à apreciação pelo Senado Federal. No Colégio Eleitoral\nreunido em 15 de janeiro de 1985, Lúcia Viveiros votou no candidato do\nregime militar, Paulo Maluf, que acabou sendo derrotado pelo\noposicionista Tancredo Neves, eleito novo presidente da República pela\nAliança Democrática, uma união do PMDB com a dissidência do PDS abrigada\nna Frente Liberal. Contudo, Tancredo Neves, por motivos de saúde, não\nchegou a ser empossado na presidência, vindo a falecer em 21 de abril de\n1985. Seu substituto no cargo foi o vice José Sarney, que já vinha\nexercendo interinamente o cargo desde 15 de março deste ano.\n\nFiliando-se ao Partido da Frente Liberal (PFL), que se formara depois da\nvitória de Tancredo Neves no Colégio Eleitoral, Lúcia Viveiros tentou a\nreeleição no pleito de novembro de 1986. Obtendo apenas uma suplência,\ndeixou a Câmara em janeiro de 1987, ao término da legislatura e do seu\nmandato.\n\nAfastada da vida pública, passou a dedicar-se prioritariamente às\natividades desenvolvidas pela Lempa. Em março de 1998, decidiu ampliar\nos objetivos da instituição, transformando-a no Instituto Holístico\nSemente Amazônica (IHSA), uma entidade também sem fins lucrativos\nconcebida dentro dos preceitos da Universidade Holística Internacional\n(Unipaz), tendo como meta principal a proteção e o resgate cultural da\nAmazônia.\n\nPublicou as obras *Nossa luta no Parlamento II* (1980) e\n*Amazônia*(1984).\n\nFoi casada com Júlio Costa de Viveiros, falecido em 1987, deputado\nfederal pelo Pará de 1971 a 1979, com quem teve uma filha.\n\n \n\nFONTES: CÂM. DEP.*Deputados brasileiros. Repertório*(1979-1983 e\n1983-1987); *Estado de São Paulo* (19/3/81); *Globo* (19 e  24/3/81,\n26/4/84 e 16/1/85); INF. BIOG.; *Jornal do Brasil* (6/4/86).\n","ref":"FONTES: CÂM. DEP.*Deputados brasileiros. Repertório*(1979-1983 e\n1983-1987); *Estado de São Paulo* (19/3/81); *Globo* (19 e  24/3/81,\n26/4/84 e 16/1/85); INF. BIOG.; *Jornal do Brasil* (6/4/86).\n","dic":"DHBB"}
