{"title":"VUOLO, Vicente","cargoss":["Deputado federal","Senador"],"cargos_esp":[0,0],"datas_ini":[1975,1979],"datas_fim":[1979,1983],"estados":["MT","MT"],"autor":["Cristiane Jalles"],"content":"**VUOLO, Vicente**\n\n\\*dep. fed. MT 1975-1979; sen. MT 1979-1983.\n\n \n\n*Vicente Emílio Vuolo*nasceu em Cuiabá no dia 3 de outubro de 1929,\nfilho do italiano Francesco Palmieri Vuolo e de Adalgisa Rosa Vuolo.\n\nBacharelou-se em ciências jurídicas e sociais pela Universidade Federal\ndo Rio de Janeiro (UFRJ) em 1956.\n\nEm 1957, tornou-se chefe de polícia do governador João Ponce de Arruda\n(1956-1961). Primeiro promotor de justiça em Cuiabá, ocupou também a\nProcuradoria da República no estado e a Procuradoria Regional Eleitoral,\nalém de membro do Conselho Penitenciário de Mato Grosso. Nas eleições de\noutubro do ano seguinte, elegeu-se deputado à Assembléia Legislativa do\nseu estado na legenda do Partido Social Democrático (PSD), assumindo o\nmandato em fevereiro de 1959. Foi vice-líder do PSD entre 1959 e 1961,\nprefeito de Cuiabá de 1962 a 1966 e consultor jurídico do estado. Com a\nextinção dos partidos políticos pelo Ato Institucional nº. 2\n(27/10/1965) e a posterior instauração do bipartidarismo, filiou-se à\nAliança Renovadora Nacional (Arena). Nessa legenda, foi mais uma vez\neleito no pleito de novembro de 1970, exercendo a vice-presidência da\nmesa da Assembléia entre 1973 e 1974. Ainda nessa legislatura, foi\npresidente da comissão especial pró-solução do problema energético da\nregião norte e leste mato-grossense.\n\nEm novembro de 1974, foi eleito deputado federal pelo estado de Mato\nGrosso na legenda da Arena, assumindo o mandato em fevereiro de 1975.\nNesse mesmo ano, passou a integrar a Comissão de Trabalho e Legislação\nSocial e, como suplente, a Comissão de Transportes da Câmara. Em 1975,\napresentou um projeto que previa a inclusão da construção de uma\nferrovia interligando São Paulo-Rubinéia (SP)-Aparecida do Taboado\n(MS)-Rondonópolis (MT)-Cuiabá (MT) no Plano Nacional de Viação. No ano\nseguinte, o projeto foi sancionado pelo então presidente da República,\nErnesto Geisel.\n\nNas eleições de novembro de 1978, foi eleito senador, assumindo o\nmandato em fevereiro do ano seguinte, após ter deixado em janeiro a\nCâmara Federal. Foi presidente e vice-presidente da Comissão de\nTransportes, Comunicações e Obras Públicas e membro da Comissão de\nJustiça. Durante o mandato de senador, continuou na batalha pela\nferrovia e conseguiu um convênio entre a União e o estado de São Paulo,\nonde cada um participaria com 50% dos recursos para a construção de uma\nponte rodoferroviária sobre o rio Paraná, em São Paulo, principal\nobstáculo para o desenvolvimento do projeto.\n\nCom a extinção do bipartidarismo em novembro de 1979 e a conseqüente\nreformulação partidária, filiou-se ao partido governista, o Partido\nDemocrático Social (PDS).\n\nNas eleições de novembro de 1982, concorreu a uma cadeira no Senado\nFederal, na sublegenda do PDS, sendo derrotado no pleito por Roberto\nCampos, do mesmo partido. Em fevereiro de 1984, ao formalizar sua adesão\nao Partido do Movimento Democrático Brasileiro (PMDB), afirmou que foi\ntraído pelo PDS, ao preterir seu nome como candidato ao Senado, dando\napoio e colocando a máquina do Estado a serviço do ex-embaixador Roberto\nCampos.\n\nEm 1986, chegou a anunciar e lançar sua candidatura pelo PMDB ao Senado.\nNo entanto, renunciou à candidatura em outubro alegando motivos de\nsaúde. Ao comunicar essa decisão, Vuolo reiterou total apoio ao\ncandidato do partido ao governo estadual, Carlos Bezerra. Paralelamente,\ncircularam informações de que Vuolo estaria ressentido com o partido por\nnão ter conseguido incluir o nome de um dos seus filhos na lista de\ncandidatos proporcionais aprovados pela convenção.\n\nAfastado dos cargos eletivos, mas permanecendo na luta pela construção\nda ferrovia, em 1988 Vicente Vuolo participou de um simpósio onde\nconseguiu convencer o chamado “rei da soja”, Olacir de Morais, a\ndesistir da construção de uma ponte na localidade de Colômbia (SP), na\ndivisa de São Paulo com Minas Gerais, para lutarem pelo projeto\noriginariamente apresentado por Vuolo e pela utilização de tecnologia\nitaliana. Ainda nesse período, Orestes Quércia, governador do estado de\nSão Paulo, lançou a pedra fundamental da construção da ponte. No ano\nseguinte, o então presidente José Sarney assinou o contrato de concessão\nda Ferronorte, de propriedade do grupo Itamarati sob o comando de Olacir\nde Morais, que objetivava a construção de uma ferrovia no Centro-Oeste\nbrasileiro.\n\nEm 1995, com o início do primeiro governo de Fernando Henrique Cardoso,\nas obras da construção da ponte pararam em função do veto do então\nministro do Planejamento, José Serra, à verba orçamentária destinada à\nconclusão da obra. Ainda nesse ano, Vuolo organizou várias manifestações\npelo asfaltamento da rodovia MT-100, que cumpria o papel de ligação com\na ponte rodoferroviária.\n\nNesse ínterim, Vuolo organizou várias manifestações pela retomada das\nobras, além de lançar um manifesto, em 1997, lido na íntegra pelo então\ndeputado federal matogrossense Gilnei Viana, na Câmara dos Deputados,\nque pedia o fim da quebra de contrato por parte do governo federal.\nPosteriormente, os recursos para a conclusão da obra foram liberados\npelo governo de Fernando Henrique Cardoso, através do programa Brasil em\nAção, que reunia as previsões orçamentárias do governo federal. Nesse\nmesmo ano, liderou um protesto pela pavimentação da rodovia MS-306, que,\njuntamente com a obra na MT-100, proporcionaria um novo acesso a São\nPaulo e a integração nacional.\n\nAinda em 1997, foi aprovado pela Assembléia Legislativa de Mato Grosso o\nprojeto de autoria do deputado Wilson Santos, que deu o nome de Senador\nVuolo ao trecho da ferrovia que corta o estado do Mato Grosso e sob a\nautoria do deputado sul-matogrossense também deu seu nome aos trechos de\nAparecida do Taboado-Inocência-Chapadão do Sul-Costa Rica, todos no Mato\nGrosso do Sul. Em virtude de sua dedicação à causa da ferrovia, recebeu\ndiversas homenagens, entre elas a medalha de Mérito Ferroviário,\nconcedida pela Rede Ferroviária Nacional, e o título de senador\nhonorário do Oeste Paulista, da Associação dos Municípios do Oeste\nPaulista.\n\nFaleceu em Brasília no dia 20 de maio de 2001.\n\nEra casado com Leide da Costa Vuolo, com quem teve três filhos.\n\nCristiane Jalles\n\nFONTES: CÂM. DEP. *Deputados;*CÂM. DEP. *Deputados brasileiros.\nRepertório*(1975-1979); *Estado de S. Paulo* (16/2/84); *Jornal do\nBrasil*(11/10/86); NÉRI, S. *16; Perfil*(1980); *Revista da\nFIESP.*(Especial 8/99); TRIB. SUP. ELEIT. *Dados*(4 e 9); TRIB. SUP.\nELEIT. *Dados* (1990). Agência Senado (22/5/2001).\n","ref":"FONTES: CÂM. DEP. *Deputados;*CÂM. DEP. *Deputados brasileiros.\nRepertório*(1975-1979); *Estado de S. Paulo* (16/2/84); *Jornal do\nBrasil*(11/10/86); NÉRI, S. *16; Perfil*(1980); *Revista da\nFIESP.*(Especial 8/99); TRIB. SUP. ELEIT. *Dados*(4 e 9); TRIB. SUP.\nELEIT. *Dados* (1990). Agência Senado (22/5/2001).\n","dic":"DHBB"}
