{"title":"WANDERLEY, Alberto Lavenère","cargoss":["Comandante da 7ª Região Militar"],"cargos_esp":[0],"datas_ini":[1929],"datas_fim":[1930],"estados":[0],"autor":[0],"content":"**WANDERLEY, Alberto Lavenère**\n\n\\*militar; comte. 7ª RM 1929-1930.\n\n \n\n*Alberto Lavenère Wanderley* nasceu em Maceió no dia 21 de novembro de\n1870, filho de Estanislau Wanderley, funcionário da Alfândega e alferes\nda Guarda Nacional, e de Amélie Lavenère.\n\nAssentou praça em Alagoas em fevereiro de 1889, matriculando-se no mesmo\nano no curso preparatório da Escola Militar da Corte, no Rio de Janeiro.\nPor ocasião dos acontecimentos que resultaram na Proclamação da\nRepública em 15 de novembro do mesmo ano, os alunos da escola, entre\neles Lavenère, enviaram ao líder republicano Benjamim Constant,\nex-professor do estabelecimento, um documento no qual lhe prometiam\ntotal apoio.\n\nEm dezembro de 1889, após a Proclamação da República, Lavenère fazia\nparte do corpo de alunos da escola que seguiu para São Cristóvão,\naquartelando-se no 2º Regimento de Artilharia de Campanha.\n\nEm 1890, regressou à escola, concluindo o curso preparatório em\nfevereiro do ano seguinte. Em março, foi transferido para a Escola\nMilitar de Porto Alegre. Retornou ao Rio, então Distrito Federal, em\nfevereiro de 1892, tornando a ingressar na Escola Militar, onde concluiu\no segundo ano do curso geral.\n\nEm janeiro de 1893, foi promovido a alferes-aluno e em abril foi\nclassificado no forte de São Bento, no Rio de Janeiro. Com a eclosão da\nRevolta da Armada contra o governo de Floriano Peixoto em setembro do\nmesmo ano, participou dos combates que se travaram entre a guarnição do\nforte de São Bento e belonaves da esquadra revoltosa.\n\nEm 1894, foi promovido a segundo-tenente e, em abril do ano seguinte,\nfoi incluído no 3º Regimento de Artilharia de Campanha, sediado em São\nPaulo. Retornou ao Rio de Janeiro no início de 1896 e retomou o curso\ngeral da Escola Militar, que concluiu em 1896, recebendo também o grau\nde bacharel em ciências e completando o curso das três armas.\n\nPromovido a primeiro-tenente de artilharia em outubro de 1898,\nmatriculou-se no curso especial, que veio a concluir no início de 1900.\nAinda no mesmo ano, classificado no 5º Regimento de Artilharia de\nCampanha (RAC), no Rio de Janeiro, foi designado para praticar na\nFábrica de Cartuchos e Artefatos de Guerra.\n\nNomeado instrutor da Escola Militar em 1902, desligou-se da Fábrica de\nCartuchos. Em 1903, pediu dispensa do cargo de instrutor da escola e\nreintegrou-se ao 5º RAC. Ainda no mesmo ano, foi nomeado auxiliar da\nDelegacia da Direção Geral de Engenharia do comando do 3º Distrito\nMilitar, em Salvador, ficando incluído no 5º Batalhão de Artilharia de\nPosição na capital baiana. Ainda em 1903, casou-se no Rio de Janeiro com\nLaurentina Freire Wanderley.\n\nEm 1904, foi nomeado ajudante da comissão construtora do Sanatório de\nCampos do Jordão (SP), permanecendo no cargo até o início de 1908.\nPromovido a capitão em 1908 e transferido para a arma de engenharia,\nseguiu para Mato Grosso em fevereiro de 1909, classificado no 5º\nBatalhão de Engenharia e nomeado ajudante da Comissão de Linhas\nTelegráficas Estratégicas de Mato Grosso e do Amazonas. Elevado em junho\ndesse ano ao comando do batalhão e à chefia da comissão, em julho de\n1910 foi nomeado chefe de grupo da Fábrica de Pólvora sem Fumaça, no Rio\nde Janeiro.\n\nEm 1912, foi nomeado assistente do general comandante da Brigada Mista\nProvisória, sendo promovido a major em dezembro do mesmo ano. No início\ndo ano seguinte, seguiu para o Rio Grande do Sul, onde assumiu o cargo\nde primeiro-engenheiro, e depois o de chefe da construção da Estrada de\nFerro Cruz Alta-Ijuí. De 1916 a 1918, exerceu o cargo de fiscal do\nColégio Militar, no Rio de Janeiro. Em 1919 foi promovido a\ntenente-coronel e participou de uma missão mista Brasil-Uruguai como\nprimeiro-engenheiro. Em 1921, foi nomeado chefe do serviço de engenharia\ne comunicações da 2ª Região Militar, em São Paulo. No ano seguinte,\nassumiu o comando do 1º Batalhão Ferroviário, em Cruz Alta (RS),\nassumindo ao mesmo tempo a chefia da Estrada de Ferro Cruz Alta-Porto\nLucena.\n\nPromovido a coronel em 1923, foi nomeado nesse mesmo ano chefe de\ngabinete da Diretoria de Engenharia do Exército, posto em que permaneceu\naté 1928. Em outubro desse ano foi promovido a general-de-brigada, sendo\nnomeado comandante da 7ª Região Militar, em Recife, em janeiro de 1929.\n\nCom o assassínio de João Pessoa em fins de julho de 1930 e o conseqüente\nagravamento da situação na Paraíba, o comando da 7ª RM foi transferido\npara o 22º Batalhão de Caçadores, na capital paraibana, para manter-se\nmais próximo dos acontecimentos. Ao mesmo tempo, Juarez Távora também\nhavia escolhido a Paraíba para centralizar, no Nordeste, a revolução que\nse preparava no país.\n\nNo dia 3 de outubro de 1930, data da eclosão do movimento, as ações\nmilitares deveriam ser iniciadas à tarde. Juarez Távora, porém, decidiu\nretardar de algumas horas o início do levante na Paraíba. Desse modo,\nhouve tempo para que chegassem ao 22º BC telegramas comunicando a\ninsurreição de outras guarnições federais, ocorrida na hora aprazada. O\ntenente Agildo Barata, revolucionário que servia no 22º BC, interceptou\nos telegramas, mas o último destes chegou à noite ao coronel Maurício\nCardoso, comandante da unidade, e ao general Lavenère Wanderley,\ntrazendo a notícia da revolução em Porto Alegre.\n\nOs dois oficiais estavam reunidos para debater a situação quando, nas\nprimeiras horas da madrugada no dia 4 de outubro, os revoltosos,\nmilitares e civis, atacaram o 22º BC com o apoio do tenente Juraci\nMagalhães, que se encontrava na unidade. Após alguns combates, os\nrebeldes conseguiram controlar a situação. Na troca de tiros, o general\nLavenère foi atingido no ventre, sendo encaminhado ao Hospital Santa\nIsabel, onde foi operado imediatamente mas veio a falecer ainda na noite\ndo dia 4 de outubro de 1930.\n\nSegundo Ademar Vidal, duas horas antes de morrer ainda disse: “Coisas da\npolítica...”\n\nFoi promovido post mortem a general-de-divisão no dia 15 de outubro de\n1930.\n\nAlberto Lavenère Wanderley era pai de Nélson Lavenère Wanderley, também\nmilitar, ministro da Aeronáutica em 1964 e chefe do Estado-Maior das\nForças Armadas de 1966 a 1968.\n\nRobert Pechman\n\n \n\n \n\nFONTES: ARQ. MIN. EXÉRC.; CARNEIRO, G. História; SILVA, H. 1930.\n\n \n","ref":"FONTES: ARQ. MIN. EXÉRC.; CARNEIRO, G. História; SILVA, H. 1930.\n\n \n","dic":"DHBB"}
