{"title":"BARROS, Silva","cargoss":["Deputado federal"],"cargos_esp":[0],"datas_ini":[1971],"datas_fim":[1975],"estados":["RJ"],"autor":[0],"content":"**BARROS, Silva**\n\n\\*dep. fed. RJ 1971-1975.\n\n* *\n\n*José da Silva Barros* nasceu em Juazeiro do Norte (CE), em 10 de julho\nde 1924, filho de Josué da Silva Barros e de Virgínia da Silva Barros.\n\nAinda criança, transferiu-se com a família para o estado do Rio de\nJaneiro, onde fixou residência no município de Duque de Caxias. Aí\npassou a trabalhar como bancário no Banco do Estado do Rio de Janeiro\n(Banerj).\n\nEm 1957, elegeu-se vereador em Duque de Caxias, exercendo dois mandatos,\nde 1958 a 1966, sendo presidente da Câmara Municipal de 1959 a 1960, e\nprimeiro-secretário de 1960 a 1961.\n\nEm 1966, elegeu-se suplente de deputado estadual pelo MDB, exercendo o\nmandato em 1968.\n\nEm 1970, desta vez pela Aliança Renovadora Nacional (Arena), partido da\nsituação no governo militar, elegeu-se deputado federal, cumprindo todo\no mandato (1971-1975). Nessa legislatura, foi membro da Comissão de\nLegislação Social e suplente da Comissão de Orçamento.\n\nCandidato à reeleição em 1974, obteve apenas uma suplência.\n\nAposentou-se como bancário do Banerj.\n\nCasou-se com Maria Helena da Silva Barros, com quem teve três filhas.\n\n \n\nFONTES: CÂM. DEP. *Deputados;*CÂM. DEP. *Deputados brasileiros.\nRepertório*(1971-1975); INF. BIOG.; NÉRI, S. *16*; TRIB. SUP. ELEIT.\n*Dados*(8).\n\n \n","ref":"FONTES: CÂM. DEP. *Deputados;*CÂM. DEP. *Deputados brasileiros.\nRepertório*(1971-1975); INF. BIOG.; NÉRI, S. *16*; TRIB. SUP. ELEIT.\n*Dados*(8).\n\n \n","dic":"DHBB"}
