{"title":"WHATELY, Mário","cargoss":["Revolucionário ou revoltoso","Constituinte"],"cargos_esp":[0,0],"datas_ini":[1932,1934],"datas_fim":[1932,1934],"estados":[0,0],"autor":[0],"content":"**WHATELY, Mário**\n\n\\*rev. 1932; const. 1934.\n\n \n\n*Mário Tomás Whately* nasceu na cidade de São Paulo no dia 16 de abril\nde 1885, filho de Tomás Whately e de Estefânia Pereira Barreto Whately.\n\nRealizou os primeiros estudos na Escola Americana e no Mackenzie\nCollege, ambos na capital paulista, concluindo os preparatórios em 1904.\nIngressou na Escola Politécnica de São Paulo, em cujos gabinetes de\nquímica orgânica e mineral trabalhou em 1909 como auxiliar, formando-se\nem engenharia em dezembro de 1911. No mesmo ano tornou-se engenheiro da\nEstrada de Ferro Central do Brasil. Em 1915 passou a engenheiro da\nDiretoria de Obras Públicas da Secretaria de Viação de São Paulo, no\ngoverno de Altino Arantes. Ingressou no magistério em 1918, como\nprofessor da Escola Politécnica de São Paulo, condição em que\npermaneceria até 1924, quando fez concurso para professor catedrático.\nEm 1922 chefiou a comissão encarregada da construção das obras do\nCentenário da Independência do Brasil.\n\nDurante a Revolução de 1930 foi designado para dirigir os trabalhos de\nentrincheiramento na fronteira sul do estado de São Paulo, destinados a\nbarrar a marcha dos revolucionários provenientes do Sul do país. Tomou\nparte ativa na Revolução Constitucionalista, deflagrada em São Paulo em\njulho de 1932, como major de engenharia da Força Pública do estado.\nLutou de Itararé a Bauru, e em seguida retornou à Escola Politécnica\npara chefiar o Serviço de Material Bélico. O movimento foi, contudo,\nderrotado em outubro do mesmo ano pelas forças legalistas.\n\nFiliado ao Partido Republicano Paulista (PRP), elegeu-se, em maio de\n1933, deputado por São Paulo à Assembléia Nacional Constituinte na\nlegenda da Chapa Única por São Paulo Unido, coligação formada pelo PRP e\no Partido Democrático (PD). Empossado em novembro de 1933, participou\ndos trabalhos constituintes e, após a promulgação da nova Carta\n(16/7/1934) e a eleição do presidente da República no dia seguinte, teve\nseu mandato prorrogado até maio de 1935.\n\nChefe da firma Mário Whately e Cia., localizada em São Paulo, realizou\nno estado as seguintes obras: construção da estrada de ferro Morro\nAgudo, do parque do estado, do Instituto Biológico, do emissário de\nesgoto do rio Tietê, da linha adutora de águas de Santo Amaro a São\nPaulo, de diversos trechos da estrada de ferro Sorocabana e da primeira\npacking house no Brasil. Trabalhou também na Companhia de Pavimentação e\nObras Públicas de São Paulo.\n\nColaborou em diversos jornais e revistas de seu estado e do Rio de\nJaneiro.\n\nAssociou-se ao Instituto de Engenheiros Civis da França e à Association\nInternationale de Ponts et Cherpentes.\n\nFaleceu em 1943.\n\nFoi casado com Ilze R. Whately.\n\nPublicou Estudos técnico-experimentais das condições de resistência da\nestrutura metálica do viaduto do Chá (1928), Notas sobre o cálculo de\ntabuleiros de pontes de concreto armado, tendo em conta os movimentos\nenvolventes (1936), Normas para rodovias estaduais (1943) e Plano de\nfinanciamento para as obras de melhoramentos e avaliação da rede\nrodoviária do estado de São Paulo.\n\n \n\n \n\nFONTES: ARQ. GETÚLIO VARGAS; ASSEMB. NAC. CONST. 1934. Anais (1); CÂM.\nDEP. Deputados; Câm. Dep. seus componentes; Gazeta, SP (19/6/58);\nGODINHO, V. Constituintes; LEITE, A. História; MELO, L. Dic.\n\n \n","ref":"FONTES: ARQ. GETÚLIO VARGAS; ASSEMB. NAC. CONST. 1934. Anais (1); CÂM.\nDEP. Deputados; Câm. Dep. seus componentes; Gazeta, SP (19/6/58);\nGODINHO, V. Constituintes; LEITE, A. História; MELO, L. Dic.\n\n \n","dic":"DHBB"}
