{"title":"WILSON, Pedro","cargoss":["Deputado federal","Deputado federal","Prefeito"],"cargos_esp":[0,0,"Goiânia"],"datas_ini":[2007,1995,2001],"datas_fim":[0,2000,2004],"estados":["GO","GO",0],"content":"**WILSON, Pedro**\n\n\\*dep. fed. GO 1995-2000, 2007-; pref. Goiânia 2001-2004\n\n \n\n*Pedro**Wilson Guimarães* nasceu em Marzagão (GO) no dia 24 de fevereiro\nde 1942, filho de Pedro Luís Guimarães e de Maria José de Oliveira.\n\nEstudou sociologia e direito na Universidade Federal de Goiás (Ufgo),\ntendo iniciado ambos os cursos em 1965, concluindo-os em 1968 e 1969,\nrespectivamente.\n\nSua vida política foi iniciada no movimento estudantil que combateu o\nregime militar instaurado no país em abril de 1964. Pedro Wilson foi\nlíder de grêmios e presidente do Centro Acadêmico XI de Maio, da\nFaculdade de Direito da Ufgo. Coordenou as representações de seu estado\nno Congresso da União Nacional dos Estudantes (UNE), em 1965, e presidiu\no Congresso da União Estadual dos Estudantes (UEE) em 1968. Nesse\nperíodo participou da Ação Católica Estudantil e da Ação Popular (AP),\norganização política de âmbito nacional, de matriz católica, fundada em\n1962, e que defendia a transformação radical da estrutura brasileira, em\nsua passagem do capitalismo para o socialismo.\n\nApós a formatura, Pedro Wilson tornou-se professor universitário em\nGoiânia e continuou integrando a AP. Com a eclosão do movimento pela\nabertura política em 1979, Pedro Wilson tornou-se presidente do Comitê\nGoiano pela Anistia, organização que lutava pela anistia ampla geral e\nirrestrita aos perseguidos pelo regime militar, que culminou com a\nassinatura da Lei da Anistia em 28 de agosto de 1979, pelo presidente da\nRepública, general João Figueiredo.\n\nIniciou suas atividades partidárias em 1980 ao filiar-se ao recém-criado\nPartido dos Trabalhadores (PT), tendo sido um dos fundadores do partido\nem Goiânia. No mesmo ano assumiu o cargo de assessor da Arquidiocese de\nGoiânia e o de presidente da Comissão de Justiça e Paz de Goiás,\nsociedade civil autônoma denominada oficialmente Pontifícia Comissão de\nJustiça e Paz, criada no ano de 1972 em São Paulo, para a defesa dos\ndireitos humanos, que denunciou sobretudo as torturas praticadas nos\nporões do regime militar.\n\nEm 1981 tornou-se presidente da sessão goiana do PT, cargo que deixaria\num ano depois para assumir o de secretário-geral estadual do partido, e\nque exerceu simultaneamente com o de coordenador de campanha eleitoral\ndo PT. Em 1983 deixou a secretaria geral, assumindo no ano seguinte a\npresidência da organização não-governamental (ONG) Instituto Brasil\nCentral, em Goiânia, e a reitoria da Universidade Católica de Goiás, que\nocupou entre 1985 a 1988.\n\nCoordenador da campanha eleitoral do PT goiano em 1986, foi dirigente do\nConselho de Reitores das Universidades Brasileiras (CRUB), no biênio\n1987-1988. Neste último ano deixou a presidência da Comissão de Justiça\ne Paz e a reitoria da Ufgo, voltando a assumir a presidência do PT de\nGoiás para um mandato de dois anos (até 1989). Assumiu a coordenação do\nMovimento Nacional de Direitos Humanos (MNDH) de Brasília, em 1990.\n\nEm 1992 tornou-se membro da coordenação estadual do Movimento pela Ética\nna Política e da Ação da Cidadania contra a Fome e pela Vida, de Goiás,\nque consistiu em comitês para a entrega de alimentos aos marginalizados\ndo país que contou com o apoio de políticos, universidades, empresas e\npersonalidades que haviam participado do Movimento pela Ética na\nPolítica nesse mesmo ano.\n\nEm novembro de 1992 elegeu-se vereador em Goiânia na legenda do PT.\nEmpossado na Câmara Municipal em fevereiro de 1993 foi, além de líder da\nbancada do partido, presidente da Comissão de Educação e Cultura em\n1994. Tornou-se, ainda, vice-presidente do PT em seu estado.\n\nEm 1994 desligou-se de diversos compromissos — a assessoria da\nArquidiocese, a presidência do Instituto Brasil Central e o Movimento\npela Ética na Política e a Ação da Cidadania contra a Fome e pela Vida —\npara se dedicar à campanha eleitoral por uma vaga na Câmara dos\nDeputados, por Goiás, na legenda do PT. Eleito, tendo por base eleitoral\nGoiânia e municípios vizinhos, assumiu o mandato de deputado federal em\nfevereiro de 1995, depois de renunciar ao mandato de vereador.\n\nMembro efetivo da Comissão de Educação, Cultura e Desporto em 1995, ao\nlongo daquele ano, durante o processo de votação das emendas\nconstitucionais enviadas pelo Executivo, seguiu a orientação de seu\npartido votando contra ou tentando obstruir as principais propostas de\ninteresse do governo Fernando Henrique Cardoso. Dessa forma, opôs-se à\nabolição do monopólio estatal nas telecomunicações e na exploração do\npetróleo; à abertura da navegação de cabotagem às embarcações\nestrangeiras, à extinção do conceito de empresa nacional e à criação do\nFundo Social de Emergência (FSE).\n\nPré-candidato à prefeitura de Goiânia nas eleições municipais de outubro\nde 1996, Pedro Wilson acabou sendo preterido por Wadi Camárcio na\ndisputa interna do partido.\n\nEm junho de 1996 votou contra a criação da Contribuição Provisória sobre\nMovimentação Financeira (CPMF) — que substituiu o Imposto Provisório\nsobre Movimentação Financeira (IPMF) —, imposto de 0,2% sobre transações\nbancárias criado como fonte complementar de recursos para a saúde.\n\nEm janeiro/fevereiro de 1997 votou contra a emenda da reeleição para\npresidente da República, governadores e prefeitos. Em novembro,\npronunciou-se desfavoravelmente à quebra da estabilidade do servidor\npúblico, item da reforma administrativa.\n\nNo pleito de outubro de 1998, reelegeu-se deputado federal na legenda\npetista. Em novembro, votou contra o teto de 1.200 reais para\naposentadorias no setor público e o estabelecimento de idade mínima e\ntempo de contribuição para o setor privado, itens que definiram a\nreforma da previdência. Assumiu o novo mandato em fevereiro de 1999.\n\nEm outubro de 2000 elegeu-se prefeito de Goiânia pelo PT, tomando posse\nem janeiro do ano seguinte. Em 2004 foi candidato a reeleição tendo\nsido, ainda no primeiro turno, derrotado por Íris Resende, do Partido do\nMovimento Democrático Brasileiro (PMDB).\n\nEm 2006, Pedro Wilson elegeu-se novamente deputado federal por Goiás. Na\nnova legislatura, tornou-se titular da Comissão de Direitos Humanos e\nMinorias (CDHM), da Comissão de Legislação Participativa (CLP), da\ncomissão especial destinada a proferir parecer ao Projeto Lei nº 1921,\nde 1999, do Senado Federal, que, entre outras providências, instituía a\ntarifa social de energia elétrica para consumidores de baixa renda e da\nComissão Representativa do Congresso Nacional.\n\nCasou-se com Maria Teresa Canezin Guimarães, com quem teve duas filhas.\n\n*Sônia Zylberberg/Cristiane Jalles*\n\n* *\n\n* *\n\n \n\n**FONTES**: CÂM. DEP. *Deputados brasileiros*. Repertório (1995-2009);\n*Folha de S. Paulo* (11/2 e 3/5/96, Especial 6/11/98); *Olho no\nCongresso/Folha de S. Paulo* (31/1/95 e 14/1/96): *Olho no vot**o/Folha\nde S. Paulo* (29/9/98); *Popular* (online) 22 ago. 1999. Disponível em :\n\\<[http://www. opopular.com.br](http://www.%20opopular.com.br/)\\>.\nAcesso em : 30 out. 2009; Portal da Câmara dos Deputados. Disponível em\n: \\<[http://www.camara.gov.br](http://www.camara.gov.br/)\\>. Acesso em :\n30 out. 2009; Portal do TSE. Disponível em : \\<[http://\nwww.tse.gov.br](http://%20www.tse.gov.br/)\\>. Acesso em : 30 out. 2009;\nPortal IBOPE. Disponível em : \\<[http://www.\nibope.com.br](http://www.%20ibope.com.br/)\\>. Acesso em : 30 out. 2009;\nPortal Serpes. Disponível em : \\<[http://www.serpes.\ncom.br](http://www.serpes.%20com.br/)\\>. Acesso em : 30 out. 2009.\n","ref":"","dic":"DHBB"}
