{"title":"WOLFFENBÜTTEL, Frederico João","cargoss":["Constituinte","Deputado federal"],"cargos_esp":[0,0],"datas_ini":[1934,1935],"datas_fim":[1934,1937],"estados":[0,"RS"],"autor":[0],"content":"**WOLFFENBÜTTEL, Frederico João**\n\n\\*const. 1934; dep. fed. RS 1935-1937.\n\n \n\n*Frederico João Wolffenbüttel* nasceu em São Leopoldo (RS) no dia 18 de\ndezembro de 1875, filho de Henrique Wolffenbüttel e de Augusta\nWolffenbüttel.\n\nFez os primeiros estudos no Colégio Nossa Senhora da Conceição,\ndiplomando-se pela Faculdade de Medicina da Universidade do Rio de\nJaneiro em janeiro de 1901.\n\nFoi um dos fundadores do Partido Republicano Liberal, em cuja legenda\nelegeu-se deputado à Assembléia Nacional Constituinte pelo Rio Grande do\nSul no pleito de maio de 1933. Empossado em novembro seguinte,\nparticipou dos trabalhos constituintes e, após a promulgação da nova\nCarta, em 16 de julho de 1934, teve seu mandato estendido até maio de\n1935. No pleito de outubro de 1934 foi eleito deputado federal pelo Rio\nGrande do Sul, na mesma legenda, iniciando novo mandato em maio de 1935.\nPermaneceu na Câmara dos Deputados até o dia 10 de novembro de 1937,\nquando o advento do Estado Novo (1937-1945) suprimiu todos os órgãos\nlegislativos do país.\n\nFaleceu em Porto Alegre, no dia 30 de novembro de 1953.\n\nEra casado com Idalina Paulina Blauth Wolffenbüttel, com quem teve dois\nfilhos.\n\n \n\nFONTES: *Álbum*; *Boletim Min. Trab*. (5/36); *Diário do Congresso\nNacional*; GODINHO, V. *Constituintes*; INF. Ari Wolffenbüttel; MIN.\nGUERRA. *Almanaque*.\n\n \n","ref":"FONTES: *Álbum*; *Boletim Min. Trab*. (5/36); *Diário do Congresso\nNacional*; GODINHO, V. *Constituintes*; INF. Ari Wolffenbüttel; MIN.\nGUERRA. *Almanaque*.\n\n \n","dic":"DHBB"}
