{"title":"YUNES, José","cargoss":["Deputado federal","Constituinte"],"cargos_esp":[0,0],"datas_ini":[1988,1988],"datas_fim":[1988,1988],"estados":["SP",0],"autor":["Adrianna Setemy"],"content":"**YUNES, José**\n\n\\*dep. fed. SP 1988; const. 1988.\n\n*José Yunes* nasceu na cidade de São Paulo no dia 23 de agosto de 1936,\nfilho de Said Habid Yunes e de Josefina Massabki Yunes.\n\nFez o curso ginasial no Colégio Santo Agostinho e o clássico no Colégio\nSão Luís. Ingressou na Faculdade de Direito da Universidade de São Paulo\n(USP), e entre 1958 e 1961 foi diretor do Centro Acadêmico XI de Agosto.\nAinda durante a graduação, foi membro do movimento universitário de\ndesfavelamento e, em 1960, quando da fundação Brasília, participou da\nprimeira caravana de integração nacional. Em 1961, concluiu seu curso\nuniversitário.\n\nDurante a década de 1960 realizou vários cursos de especialização em El\nSalvador, Venezuela, México e Estados Unidos e, na década seguinte, fez\nvárias viagens profissionais e de estudos aos Estados Unidos, Canadá,\nEuropa e Oriente Médio. Em 1975 participou do I Seminário Internacional\nsobre Investimentos no Brasil, realizado em Salzburg, na Áustria. No ano\nseguinte tornou-se assessor especial do secretário da Fazenda do estado\nde São Paulo, permanecendo no cargo até 1977. Organizou e participou do\nseminário sobre a nova Lei das Sociedades Anônimas, realizado em São\nPaulo, e fez o curso de direito processual civil, promovido pelo\nInstituto dos Advogados Brasileiros, com a colaboração da Pontifícia\nUniversidade Católica (PUC) de São Paulo.\n\nEm novembro de 1978 candidatou-se a uma cadeira na Assembleia\nLegislativa de São Paulo, na legenda do Movimento Democrático Brasileiro\n(MDB), partido de oposição ao regime militar instaurado no país em abril\nde 1964. Eleito, assumiu o mandato em fevereiro de 1979, participando\ndos trabalhos legislativos como presidente da comissão de inquérito\nsobre a realidade orçamentária do estado e membro titular das comissões\nde Constituição e Justiça e de Trabalho da Constituição. Com o fim do\nbipartidarismo em novembro deste ano, filiou-se ao Partido do Movimento\nDemocrático Brasileiro (PMDB), agremiação que sucedeu ao MDB. Foi membro\ntitular da comissão de inquérito sobre possíveis irregularidades na\nViação Aérea São Paulo (VASP).\n\nNo pleito de novembro de 1982 foi reeleito e no ano seguinte participou\ndos trabalhos legislativos como membro titular das comissões de\ninquérito sobre denúncias referentes à má aplicação de recursos do\npetróleo por parte de empresas estatais, em especial a Paulipetro, e\nsobre irregularidades nos órgãos da administração pública direta e\nindireta.\n\nEm 25 de abril de 1984 foi votada a emenda Dante de Oliveira, que,\napresentada na Câmara dos Deputados, propunha o restabelecimento das\neleições diretas para presidente da República em novembro daquele ano.\nComo a emenda não foi aprovada — faltaram 22 votos para que o projeto\npudesse ser encaminhado à apreciação do Senado Federal —, a eleição foi\nfeita por via indireta. Como delegado da Assembleia Legislativa de São\nPaulo ao Colégio Eleitoral, reunido em 15 de janeiro de 1985, votou no\ncandidato oposicionista Tancredo Neves, que foi eleito. Contudo, por\nmotivo de doença, Tancredo Neves não chegou a ser empossado na\npresidência, vindo a falecer em 21 de abril. Seu substituto foi o vice\nJosé Sarney, que já vinha exercendo interinamente o cargo desde 15 de\nmarço.\n\nDurante a década de 1980, José Yunes realizou várias viagens ao exterior\ncomo membro de delegações empresariais e oficiais. No pleito de novembro\nde 1986 candidatou-se a deputado federal constituinte, na legenda do\nPMDB, obtendo a quarta suplência. Com a nomeação do deputado Roberto\nRolemberg para a Secretaria de Governo do estado de São Paulo, no\ngoverno de Orestes Quércia (1987-1991), assumiu o mandato em 11 de julho\nde 1988, participando dos trabalhos da Assembléia Nacional Constituinte\nno segundo turno de votações. Assinou a nova Carta Constitucional,\npromulgada em 5 de outubro, passando em seguida a participar dos\ntrabalhos legislativos ordinários na Câmara dos Deputados. Em 21 de\ndezembro de 1988 deixou a Câmara dos Deputados. Não voltou a se\ncandidatar a nenhum cargo eletivo, passando a dirigir o escritório de\nadvocacia José Yunes & Associados. Foi também conselheiro e membro da\nComissão de Ética da Ordem dos Advogados do Brasil (OAB), seção de São\nPaulo, de janeiro de 1998 a dezembro de 2000.\n\nLecionou, como professor-assistente, na cadeira de introdução à ciência\ndo direito, na PUC de São Paulo. Foi ainda colaborador nos estudos do\nprojeto de lei que instituiu o Banco Nacional da Habitação (BNH).\n\nCasou-se com Célia Mariz de Oliveira Yunes, com quem teve cinco filhos.\n\nPublicou *Uma lufada que abalou São Paulo*.\n\n \n\n*Adrianna Setemy*\n\nFONTES: ASSEMB. NAC. CONST.*Repertório*(1987-1988); COELHO, J. &\nOLIVEIRA, A. *Nova*; CURRIC. BIOG.;*Globo* (16/1/85); Portal da OAB-SP.\n","ref":"FONTES: ASSEMB. NAC. CONST.*Repertório*(1987-1988); COELHO, J. &\nOLIVEIRA, A. *Nova*; CURRIC. BIOG.;*Globo* (16/1/85); Portal da OAB-SP.\n","dic":"DHBB"}
