{"title":"BARROSO, Régis ==============","cargoss":["Deputado federal"],"cargos_esp":[0],"datas_ini":[1967],"datas_fim":[1971],"estados":["CE"],"autor":[0],"content":"BARROSO, Régis\n==============\n\n\\* dep. fed.  CE 1967-1971.\n\n \n\n*Francisco Régis Monte Barroso*nasceu em Fortaleza no dia 4 de agosto de\n1941, filho de José Parsifal Barroso e de Raimunda Olga Monte Barro­so.\nSeu pai foi deputado Federal pelo Ceará (1951-1955), ministro da\nAgricultura (1956) e do Trabalho (1956-1958), senador (1955-­1959),\ngovernador do estado (1959-1963) e novamente deputado federal\n(1971-1979). Seu avô paterno, Hermínio Barroso,  foi deputado federal\npelo Ceará de 1918 a 1920, e seu avô materno, Francisco Monte, foi\nconstituinte de 1946 e deputado fe­deral pelo Ceará entre 1946 e1963.\n\nEm 1959, aos 18 anos, Régis foi nomeado por seu pai oficial-de-gabinete\ndo governo do esta­do do Ceará. No ano seguinte formou-se em inglês no\nEnglish Language Institut, da Universidade de Michigan (EUA). Em 1961,\ntor­nou-se chefe da Casa Civil do governo esta­dual, cargo em que\npermaneceu até o fim do mandato paterno (1963). Ainda em 1962 assumiu o\ncargo de diretor superintendente de Monteiro Refrigerantes S. A. e foi\nnomeado inspetor fazendário para assuntos de exportação da Secretaria da\nFazenda do Ceará.\n\nBacharel pela Faculdade de Direito do Ceará em 1965, um ano depois\nconcluiu o doutorado em direito público e privado pela Faculdade de\nDireito da Universidade Federal do Ceará (UFCE), e tornou-se\nin­dustrial.\n\nProcurador efetivo da Companhia de Água e Esgoto do Estado do Ceará em\n1966, no pleito de novembro deste ano elegeu-se deputado federal por seu\nesta­do na legenda da Aliança Renovadora Nacio­nal (Arena), partido de\nsustentação ao regime militar vigente no país desde abril de 1964. \nAssumindo o mandato em fevereiro de 1967, foi membro titular das\ncomissões de Legislação Social, de Transportes e de Educação. Não\ncandidatou-se à reeleição em novembro de 1970, deixando a Câmara em\njaneiro de 1971, ao final da legislatura.\n\n                Não retornando à política, passou a se dedicar\nexclusivamente a atividades empresariais. Ainda em 1971 assumiu a\ndireção da Distribuidora de Bebidas Ltda. (Disbrel), e da Companhia de\nDesenvolvimento da Pesca (Cepesca), permanecendo neste último cargo até\n1975. Diretor gerente da Corretora Verdes Mares entre 1971 e 1977, foi\nvice-presidente da Fundação Educacional Edson Queirós (Unifor) de 1971 a\n1975. Entre 1972 e 1974, foi diretor da Estamparia e Esmaltação do\nNordeste S/A (Esmaltec), e diretor da Téco-mecânica Nordeste S/A\n(Tecnorte). \n\n                Vice-presidente da Bolsa de Valores do Ceará entre 1973\ne 1975, nesse último ano assumiu a presidência do órgão, na qual\npermaneceria até 1977.\n\n                Paralelamente a essas atividades, exerceu cargos de\ndireção em entidades de representação da classe empresarial cearense e\nem órgãos do governo estadual. Em  1973 tornou-se vice-presidente e\ndelegado do Sindicato das Indústrias de Bebidas, Águas Minerais e\nCervejas  do Estado do Ceará. Entre 1975 e 1979 foi diretor de Crédito\ndo Banco de Desenvolvimento do Estado do Ceará. Em 1983, tornou-se\npresidente do Sindicato, aí permanecendo até 1988. Vice-presidente da\nFederação das Indústrias do Ceará no período de 1978 a 1984,  foi também\nseu diretor entre 1992 e 1994. Foi também diretor da seção cearense do\nServiço Nacional da Indústria entre 1978 e 1984 e do Centro Industrial\ndo Ceará entre 1981 e 1987, retornando ao cargo no período 1994-1996.\n\n                Em fevereiro de 2000, era diretor de três empresas do\nsetor de bebidas, de uma empresa de mineração  e de uma empresa\nagropecuária.\n\nFoi casado com Mara Queirós, com quem teve um filho.  Casou-se pela\nsegunda vez com Heloísa Nóbrega, de quem teve uma filha. Viúvo, casou-se\ncom Teresa Cristina Ferreira Barroso.\n\n \n\nFONTES: CÂM. DEP. *Deputados;*CÂM. DEP. *Deputados brasileiros. \nRepertório*(1967-1971);**CURRIC. BIOG.; INF. FAM.\n\n \n","ref":"FONTES: CÂM. DEP. *Deputados;*CÂM. DEP. *Deputados brasileiros. \nRepertório*(1967-1971);**CURRIC. BIOG.; INF. FAM.\n\n \n","dic":"DHBB"}
