{"title":"BASTOS, Alberto de Lemos","cargoss":["juiz TSN"],"cargos_esp":[0],"datas_ini":[1936],"datas_fim":[1939],"estados":[0],"autor":[0],"content":"**BASTOS, Alberto de Lemos**\n\n\\*militar; juiz TSN 1936-1939.\n\n \n\n*Alberto de Lemos Bastos* nasceu em Londres, na Inglaterra, no dia 8 de\nsetembro de 1881, filho de Inocêncio de Lemos Basto e Lina Ferreira de\nLemos Basto.\n\nIngressou na Escola Naval como aspirante a guarda-marinha em janeiro de\n1898. Após concluir o curso, foi promovido a segundo-tenente em abril de\n1902 e a primeiro-tenente em setembro do ano seguinte. Fez o curso de\nminas e torpedos da Escola de Defesa Submarina em 1908.\n\nCapitão-tenente em fevereiro de 1911, fez o curso de submersíveis da\nEscola de Submarinos em 1917, sendo promovido a capitão-de-corveta em\nsetembro de 1921. Três anos depois, fez o curso da Escola Naval de\nGuerra. Em maio de 1931, passou a capitão-de-fragata. No início de 1933\nfoi designado para comandar uma força naval cuja missão era garantir a\nsoberania brasileira na região fronteiriça com o Peru e a Colômbia,\npaíses envolvidos em disputa pelo território de Letícia. No mês de\nmarço, a Liga das Nações, visando a que o conflito não tomasse maiores\nproporções, propôs aos países beligerantes a formação de uma comissão\nsob sua égide que ficasse incumbida de administrar Letícia pelo prazo de\num ano. Aceita a proposta, Lemos Basto foi o representante brasileiro na\ncomissão, integrada ainda por um norte-americano e um espanhol.\n\nPromovido a capitão-de-mar-e-guerra em julho de 1933, em setembro de\n1936 foi nomeado, pelo presidente Getúlio Vargas, juiz do Tribunal de\nSegurança Nacional (TSN), instalado para o julgamento dos implicados na\nRevolta de 1935. No dia 7 de maio de 1937, o TSN — presidido pelo\ndesembargador Frederico de Barros Barreto e integrado por Lemos Bastos,\nLuís Carlos da Costa Neto, Antônio Pereira Braga e Raul Machado — julgou\nos principais acusados do levante comunista, entre os quais Luís Carlos\nPrestes e Agildo Barata.\n\nEm junho de 1938, já durante o Estado Novo (1937-1945), como membro do\nmesmo tribunal, julgou os implicados no Putsch integralista que\nirrompera em maio anterior, sob a liderança dos integralistas e com o\napoio dos oposicionistas liberais. O movimento, que visava à deposição\nde Getúlio Vargas, resumiu-se praticamente a um assalto frustrado ao\npalácio Guanabara, residência oficial do presidente da República.\nContra-almirante em dezembro de 1939, assumiu posteriormente o comando\nda Escola Naval, integrando em 1941 o Conselho do Almirantado. Durante a\nSegunda Guerra Mundial (1939-1945), com a declaração de guerra do Brasil\nà Alemanha e à Itália em 31 de agosto de 1942 e a criação de comandos\nnavais com o objetivo de propiciar uma defesa mais eficaz do litoral\nbrasileiro, foi designado chefe do Comando Naval do Leste, sediado em\nSalvador e abrangendo a costa dos estados de Sergipe, Bahia e Espírito\nSanto. Permaneceu no cargo até o término do conflito em 1945. Nesse\nperíodo, em dezembro de 1943, foi promovido a vice-almirante. Passou à\nreserva remunerada em outubro de 1945 e foi reformado em fevereiro de\n1950.\n\nEntre fevereiro de 1951 e novembro de 1954, foi presidente da Comissão\nde Marinha Mercante e diretor do Lóide Brasileiro.\n\nFaleceu no dia 3 de março de 1968.\n\n \n\nFONTES: ARQ. GETÚLIO VARGAS; GAMA, A. *Marinha*; MIN. MAR. *Almanaque*\n(1934, 1945); MIN. MAR. *Serv. doc.: seção de arquivo*; SILVA, H.\n*1937*.\n\n \n","ref":"FONTES: ARQ. GETÚLIO VARGAS; GAMA, A. *Marinha*; MIN. MAR. *Almanaque*\n(1934, 1945); MIN. MAR. *Serv. doc.: seção de arquivo*; SILVA, H.\n*1937*.\n\n \n","dic":"DHBB"}
