{"title":"BASTOS, Ataíde","cargoss":["Deputado federal","Deputado federal","Deputado federal"],"cargos_esp":[0,0,0],"datas_ini":[1958,1956,1951],"datas_fim":[1958,1957,1955],"estados":["MT","MT","MT"],"autor":[0],"content":"**BASTOS, Ataíde**\n\n\\*dep. fed. MT 1951-1955, 1956-1957, 1958.\n\n*Ataíde Lima Bastos* nasceu em Cuiabá no dia 29 de novembro de 1896,\nfilho de Francisco de Paula Araújo Bastos e de Herzila Lima Bastos.\n\nCursou a Faculdade de Medicina e Farmácia do Rio de Janeiro,\nespecializando-se em clínica pediátrica.\n\nExerceu em Cuiabá as funções de médico da Escola Industrial, professor\ndo Ginásio do Estado e da Escola Normal e funcionário do Departamento de\nSaúde Estadual e do Serviço Sanitário Rural.\n\nNo pleito de outubro de 1950, elegeu-se deputado federal por Mato Grosso\nna legenda da União Democrática Nacional (UDN), assumindo o mandato em\nfevereiro de 1951.\n\nEm outubro de 1954, obteve uma suplência de deputado federal pelo mesmo\npartido e estado. Deixando a Câmara ao final de seu primeiro mandato\n(31/1/1955), tornou a ocupar uma cadeira de deputado federal nos\nperíodos de 2 de agosto de 1956 a 3 de fevereiro de 1957, de 25 de março\na 3 de junho e de 13 de junho a 15 de agosto de 1957 e de 9 de abril a\n18 de setembro de 1958.\n\nFoi membro da Associação Médica de Mato Grosso.\n\nFONTES: CÂM. DEP. *Deputados*; CÂM. DEP. *Relação dos dep.*; CISNEIROS,\nA. *Parlamentares*; TRIB. SUP. ELEIT. *Dados* (2 e 3).\n\n \n","ref":"FONTES: CÂM. DEP. *Deputados*; CÂM. DEP. *Relação dos dep.*; CISNEIROS,\nA. *Parlamentares*; TRIB. SUP. ELEIT. *Dados* (2 e 3).\n\n \n","dic":"DHBB"}
