{"title":"BATISTA, Eliezer ----------------","cargoss":["Presidente de associação ou confederação de empregados ou empregadores","Ministro das Minas e Energia","Presidente de associação ou confederação de empregados ou empregadores","min SAE"],"cargos_esp":["CVRD",0,"CVRD",0],"datas_ini":[1961,1962,1979,1992],"datas_fim":[1964,1963,1986,1992],"estados":[0,0,0,0],"autor":[0],"content":"BATISTA, Eliezer\n----------------\n\n\\* pres. CVRD 1961-1964; min. Minas e En. 1962-1963; pres. CVRD\n1979-1986; min. SAE 1992.\n\n \n\n*Eliezer Batista da Silva*nasceu em Nova Era (MG) em 4 de maio de 1924,\nfilho de José Batista da Silva e Maria da Natividade Pereira.\n\n                Formou-se em 1948 pela Escola de Enge­nharia da\nUniversidade do Paraná e, no ano seguinte, ingressou como engenheiro na\nCom­panhia Vale do Rio Doce. Trabalhando no Departamento de Construções\nda Estrada de Ferro Vitória-Minas, realizou, na região de Governador\nValadares (MG), a remodelação de seu traçado e inaugu­rou variantes.\nOcupou, posteriormen­te, os cargos de chefe do Departamento da Via\nPermanente (1951) e de assistente de engenharia (1957). Em maio de 1959,\nfoi nomeado superintendente da estrada.\n\nEm 1961, o presidente Jânio Quadros o convidou para a direção da\nCompanhia Vale do Rio Doce, que assumiu em abril, em substituição a\nFrancisco de Sá Lessa.****Já como presiden­te, fez cursos de\nespecializa­ção profissional nos Estados Unidos, Inglater­ra, Suécia,\nAlemanha, França, Noruega e Bélgica. Encontrava-se no exercício dessa\nfun­ção quando, em 18 de setembro de 1962, durante o período\nparlamentarista do governo João Goulart, foi nomeado ministro das Minas\ne Energia em substituição a João Mangabeira. Integrava o gabinete\nprovisório che­fiado****por Hermes Lima (1962-1963).\n\nDepois do plebiscito de 6 de janeiro de 1963 que restabeleceu o regime\npresidencialis­ta, Goulart recuperou os poderes atribuídos ao presidente\npela Consti­tuição de 1946, que havia perdido em parte com a instituição\ndo regime parlamentarista em 1961. Como decorrência, recompôs o\nministério, mantendo alguns dos titulares, en­tre os quais Eliezer, que\ncontinuou a acumular a pasta das Minas e Energia com a direção da\nCompanhia Vale do Rio Doce.\n\nEm abril de 1963, partici­pou de uma comissão interministerial, criada\npelo presidente em substituição à Comissão de Nacionalização das\nEmpresas Concessionárias do Serviço Público (Conesp), para estudar e\nproce­der à compra das subsidiárias da Bond and Share, pertencente ao\ngrupo Ameri­can and Foreign Power Company, e da Interna­tional Telephone\nand Telegraph (ITT). As ne­gociações entre o governo e a Amforp se\ndesen­volveram ao longo de todo o mês de abril, ten­do resultado em um\nacordo que previa a com­pra dos bens da companhia americana por 135\nmilhões de dólares, 75% dos quais deveriam ser reinvestidos no\npaís****em empresas que não operassem no ramo dos serviços públicos. O\nacordo provocou forte oposição dos setores nacionalistas mais radicais,\nque consideravam esse preço exorbi­tante e lesivo aos interesses do\npaís. Os setores udenistas, liderados pelo governador da Guanabara,\nCarlos Lacerda, também criticaram a posição do governo, aproveitando a\nocasião para denunciar o encaminhamento da compra da Companhia\nTelefônica Brasileira (CTB), subsidiária da Light, cujo patrimônio, a\nseu ver, fora supera­valiado pelos técnicos do governo federal. A reação\nprovocada pelo acordo com a Amforp levou à criação de uma comissão\nparlamentar de inquérito sobre o assunto e à suspensão das negociações\npara a compra das concessionárias de serviços públicos até então em\nandamento.\n\nComo ministro, foi tam­bém presidente do Conselho Nacional de Minas e\nEnergia e da Comissão de Exportação de Materiais Estratégicos. Em 18 de\njunho de 1963 foi substituído no ministério por Oliveira Brito. Com a\ndeposição de Goulart pelo movimento político-militar de 31 de março de\n1964, foi afastado da presidên­cia da Vale, sendo sucedido por Paulo\nJosé de Lima Vieira.\n\nDe maio desse ano a junho de 1968, foi diretor-presidente da Minerações\nBrasileiras Reunidas S/A, no Rio de Janeiro. Depois disso, seguiu para\nNova Iorque onde assumiu a vice-presidência da Itabira lnternational\nCom­pany. Em outubro de 1968, foi nomeado diretor da Itabira Eisenerz\nGMPH, com sede em Dusseldorf, na Alemanha Ocidental, posto no qual\nper­maneceria até junho de 1974, quando foi encerrada a atividade da\nempre­sa. Ainda em 1968, com a fundação da Rio Doce Internacional S/A,\nsubsidiária da Vale com sede em Bruxelas, foi designado presidente da\nempresa.\n\nA partir****do governo de Rondon Pacheco (1971-1975) em Minas Gerais,\npassou****a atuar também como consultor e promotor de negócios para o\ngoverno mineiro, quando várias indústrias de bens de capital se\ninstalaram no estado.  No governo de Aurelia­no Chaves (1975-1978), essa\ncontribuição cresceu. Também nos anos 1970, dirigiu uma faculdade com\nOtávio Lacombe, presidente da Paranapanema, uma das maiores mineradoras\ndo país. Situada no Rio de Janeiro, a instituição empregou vários\nprofessores perseguidos pelo regime militar (1964-1985).\n\nEm março de 1979, com o início do governo João Figueiredo, voltou a\npresidir a Companhia Vale do Rio Doce, substituindo Joel Mendes Rennó.\nPor conta disso, afastou-se da direção da Rio Doce Internacional. Na\népoca, o novo ministro das Minas e Energia, César Cals, havia declarado\nà imprensa que, tendo em vista o importante papel exercido pelos\nminé­rios na balança de pagamentos, a necessidade de o país equilibrá-la\ne o inesperado aumento das possibilidades brasileiras de exportação de\nmatérias-primas, a Vale do Rio Doce passaria a concentrar suas\natividades, até então diversi­ficadas, no minério de ferro e em\nCarajás.  Simultaneamente, todas as demais atividades da empresa seriam\ntransferidas para o setor privado, como o reflorestamento e a produção\nde celulose, desenvolvidas, respectivamente, pela Florisbra e a Celulose\nNipo-Brasileira S.A. (Cenibra), associações da Vale com empresas\njaponesas.\n\nO Projeto Ferro Carajás, que previa a extração de minério na serra de\nCarajás, no Sul do Pará, havia sido relegado a se­gundo plano desde que\na United States Steel (US Steel) desfizera a sociedade com a empresa\nbrasileira.  Com a nova orientação, no entanto, foram investidos 3,8\nbilhões de dólares só no projeto do minério de ferro. As pesquisas\ndesenvolvidas pela empresa na região indica­ram que ali também havia\ncobre de bom teor, manganês - um mineral de alto valor estratégico usado\npela siderurgia -, níquel, bauxita (a matéria-prima do alumínio),\ncassi­terita (de onde vem o estanho) e ouro, entre outros minérios. Com\nbase nessas pesquisas, o governo desenvolveu um projeto maior, o\nPrograma Grande Carajás, diri­gido por um conselho interministerial. \nSegun­do o economista Sérgio Quintela, em declara­ção ao *Jornal do\nBrasil*de 23 de agosto de 1981, \"o Grande Carajás nasceu da concepção\nestratégica de Eliezer Batista... para o aprovei­tamento integrado das\nriquezas hidroelétricas, minerais, agrícolas e florestais da região,\nbuscando tirar o máximo partido da infra-es­trutura no minério de ferro\n(ferrovia de 900 km e porto de águas profundas de São Luís) e da\ncarência mundial de certos produtos meta­lúrgicos e agrícolas\".\n\nFreqüentemente confundido com o Pro­grama Grande Carajás, o Projeto\nFerro Carajás representou a primeira iniciativa de exploração das\nriquezas da província mineral dos Carajás, abrangendo áreas do Pará até\no Xingu, Goiás e Maranhão. De acordo com o cronograma, o minério de\nferro de alta qualidade começaria a ser expor­tado a partir de 1985.\n\nEm julho de 1981, rebatendo as críticas de que a Vale estaria\ncomprometen­do o minério de ferro de Carajás a preços aviltantes,\nrespondeu à impren­sa que, na verdade, os preços estavam muito abaixo\ndos encontrados no mercado interna­cional, mas esse fato se explicava\npela necessi­dade de a empresa gerar divisas.\n\nNo mês seguinte, o Conselho Interministe­rial do Projeto Grande Carajás\naprovou a concessão de vários incentivos fiscais ao proje­to da Vale do\nRio Doce, destacando-se a isenção, por dez anos, do imposto de renda e\ndos adicionais não-restituíveis, a isenção do Imposto sobre Produtos\nIndustrializados (IPI) e a manutenção do crédito-prêmio, referente à\naquisição  de matérias-primas, produtos inter­mediários e material de\nembalagem, para a aquisição de equipamentos nacionais, bem como isenção\ndo Imposto sobre Circulação de Mercadorias (ICM). Paralelamente ao de\nCarajás, a Vale do Rio Doce veio desenvolvendo dois outros projetos -\nAlumínio do Brasil (Albrás) e Alunorte (Alumina) - em parceria com o\nconsórcio japonês Nalco.****\n\n                Permaneceu à frente da Vale até abril de 1986, já no\ngoverno José Sarney (1985-1990). Durante sua passagem pela companhia,\nfoi também presidente do conselho de administração. Após deixar a\npresidência da empresa, reassumiu a direção da Rio Doce Internacional.\n\nNo início de 1990, recusou convite para integrar a equipe ministerial do\npresidente Fernando Collor (1990-1992). Mais tarde, contudo, aceitou\ncolaborar informalmente com o governo e, em abril de 1992, assumiu a\nSecretaria de Assuntos Estratégicos (SAE), em substituição a Pedro Paulo\nLeoni Ramos.\n\nUma de suas primeiras medidas como ministro foi desvincular a SAE das\natribuições anteriormente exercidas pelo Serviço Nacional de Informações\n(SNI), que havia sido um dos principais aliados da política de repressão\ndo regime militar. Procurando estabelecer novas funções para a\nsecretaria, vinculadas aos problemas do desenvolvimento econômico,\ncoordenou um estudo sobre a crise do setor elétrico. Defendendo a\nintegração dos sistemas sul-americanos, o trabalho apontou a necessidade\nde retomada do projeto de construção do gasoduto Brasil-Bolívia. Visto\ncomo opção tanto para os problemas de poluição ambiental quanto para as\nameaças de racionamento de energia, o gasoduto foi objeto da assinatura\nde um protocolo de intenções entre Collor e o presidente boliviano,\nJaime Paz Zamora (1989-1993), sendo sua construção iniciada durante as\ngestões de Fernando Henrique Cardoso (1995-1998) e Gonzalo Sánchez de\nLozada (1993-1997).\n\nDeixou a SAE em outubro de 1992, após a aprovação, pela Câmara, da\nabertura do processo de *impeachment* de Collor. Foi substituído por\nMário César Flores. No início de 1997, com Rafael de Almeida Magalhães,\nErling Lorentzen e Félix de Bulhões, foi um dos fundadores do Conselho\nEmpresarial Brasileiro de Desenvolvimento Sustentado (CEBDS).\n\nAinda nesse último ano, envolveu-se nos debates sobre a venda da\nCompanhia Vale do Rio Doce. Contrário ao modelo de privatização em bloco\nadotado pelo governo, sugeriu o desmembramento da estatal e sua venda\npor áreas de atuação. Segundo afirmou, isso evitaria a formação de\nmonopólios e aumentaria o valor da empresa. Em conseqüência de suas\ncríticas, chegou a ser acusado por membros do governo de ter sido o\nresponsável pela divulgação à imprensa de um relatório sobre a\ndescoberta de novas jazidas em Carajás, de valor ainda desconhecido.\nObjeto de uma reportagem publicada pelo jornal *O Estado de São  Paulo*\nem janeiro de 1997, o caso serviu como pretexto para as ações impetradas\npela oposição contra a venda da Vale.\n\n                Em fins de abril, deixou a presidência da Rio Doce\nInternacional, assumindo uma cadeira no Conselho Coordenador de Ações\nFederais do Rio de Janeiro, da Federação das Indústrias do estado\n(Firjan). Coordenou o projeto Infra-Estrutura de Longo Alcance de\nDesenvolvimento Sustentado - Rio Século 21. Após o leilão da Vale -\nvencido em maio daquele ano por um consórcio liderado pelo grupo Vicunha\n-, negou convite para integrar a nova diretoria da empresa.\n\n                Em julho de 1997, tornou-se membro do conselho de\nadministração das Indústrias Klabin, assumindo, no mês seguinte, um\nassento no conselho de desenvolvimento estratégico do grupo Inepar.\n\n                Em 1998, integrou também o conselho de administração da\nSharp do Brasil S.A. No segundo governo Fernando Henrique Cardoso,\niniciado em janeiro do ano seguinte, tornou-se membro do Conselho\nCoordenador das Ações Federais no Rio de Janeiro, órgão ligado à\npresidência da República. \n\n                Único brasileiro a receber o título de *honoris causa*\nda Academia Russa de  Ciências, foi ainda professor cate­drático de\neconomia política, estatística e finanças na Escola Politécnica do\nEspírito Santo. Adepto das teses desenvolvimentistas, recuperou, no\nplano intelectual, as idéias do ex-ministro da Fazenda Lucas Lopes,\nchamando freqüentemente a atenção para a importância dos problemas de\ninfra-estrutura e do desenvolvimento sustentável na formulação dos\nplanejamentos econômicos.\n\nCasou-se com a alemã Juta Fuhrken, com quem teve sete filhos.\n\nPublicou *Infra-estrutura para o desenvolvimento sustentado e integração\nda América do Sul*(1997).\n\n \n\n### Renato Lemos\n\n \n\nFONTES: BANDEIRA, L. *Governo; Encic.* *Mirador*; *Estado* *de São\nPaulo* (1**e 5/8/81, 23/5/82, 30/9/96); FICHÁ­RIO PESQ. M. AMORIM;\n*Folha de São Paulo* (29/8/82, 24/11/93, 7/7 e 27/8/97); *Globo*\n(23/8/92, 29/5/94, 2, 29/4, 19/5 e 15/9/97); INF. BIOG.; INF. BIOG.;\n*Jornal do Brasil*(21/1/79, 31/7 e 23/8/81, 5/9/82, 10 e 13/11/96, 30/1,\n16/3, 29/4 e 10/5/97);*Jornal do Comércio,* Rio\n(25/1/63);*Veja*(25/4/79, 30/4/97); VÍTOR, M. *Cinco.*\n","ref":"FONTES: BANDEIRA, L. *Governo; Encic.* *Mirador*; *Estado* *de São\nPaulo* (1**e 5/8/81, 23/5/82, 30/9/96); FICHÁ­RIO PESQ. M. AMORIM;\n*Folha de São Paulo* (29/8/82, 24/11/93, 7/7 e 27/8/97); *Globo*\n(23/8/92, 29/5/94, 2, 29/4, 19/5 e 15/9/97); INF. BIOG.; INF. BIOG.;\n*Jornal do Brasil*(21/1/79, 31/7 e 23/8/81, 5/9/82, 10 e 13/11/96, 30/1,\n16/3, 29/4 e 10/5/97);*Jornal do Comércio,* Rio\n(25/1/63);*Veja*(25/4/79, 30/4/97); VÍTOR, M. *Cinco.*\n","dic":"DHBB"}
