{"title":"BATISTA, Melo","cargoss":["Comandante do IV Distrito Naval","Ministro da Marinha"],"cargos_esp":[0,0],"datas_ini":[1959,1964],"datas_fim":[1960,1965],"estados":[0,0],"autor":[0],"content":"**BATISTA, Melo**\n\n\\*militar; comte. IV DN 1959-1960; min. Mar. 1964-1965.\n\n \n\n*Ernesto de Melo Batista* nasceu em Natal no dia 15 de dezembro de 1907,\nfilho do engenheiro João Luís Batista e de Maria Leopoldina de Melo\nBatista.\n\nIngressou em 1925 na Escola Naval, saindo guarda-marinha em 1929.\nTornou-se segundo-tenente em outubro desse mesmo ano, primeiro-tenente\nem agosto de 1931, capitão-tenente em agosto de 1933 e\ncapitão-de-corveta em maio de 1943.\n\nDurante a Segunda Guerra Mundial (1939-1945), serviu na missão naval\nbrasileira em Miami, nos Estados Unidos, onde se especializou em\nsubmarinos. Após regressar ao Brasil, promoveu a criação do Centro de\nTática Anti-Submarina e, em seguida, foi nomeado chefe da comissão\nconstrutora de navios de guerra no Japão, onde esteve por algum tempo.\nEm julho de 1949, foi promovido a capitão-de-fragata e, em janeiro de\n1954, a capitão-de-mar-e-guerra, chegando a contra-almirante em março de\n1959. Entre maio de 1959 e novembro de 1960, comandou o IV Distrito\nNaval (DN), sediado em Belém (PA), sendo promovido a vice-almirante em\nfevereiro de 1964.\n\nApós a vitória do movimento político-militar que depôs o presidente João\nGoulart no dia 31 de março desse ano, e a posse do marechal Humberto\nCastelo Branco na presidência da República em 15 de abril, Melo Batista\nfoi nomeado, em 20 de abril, ministro da Marinha, em substituição ao\nalmirante Augusto Rademaker. Os ministérios da Marinha e da Aeronáutica\nvinham-se hostilizando desde a aquisição, ainda no governo do presidente\nJuscelino Kubitschek (1965-1961), do porta-aviões *Minas Gerais*.**A\nMarinha pleiteava a criação de uma aviação naval, considerada ilegal\npela Aeronáutica.\n\nSegundo Luís Viana Filho, o presidente Castelo Branco estava disposto a\ndebelar a crise, intenção essa transmitida a Melo Batista ao convidá-lo\npara o ministério. Entretanto, a situação agravou-se em agosto de 1964,\npor ocasião das manobras da Operação Unitas — treinamento tático que\nreunia forças navais de vários países sob a coordenação dos Estados\nUnidos —, quando a presença de aviões no convés do *Minas\nGerais*,**autorizada pelo próprio presidente da República, despertou\nprotestos por parte de oficiais da Força Aérea.\n\nAinda segundo a fonte citada, tentando contornar o incidente, Castelo\nBranco orientou Melo Batista no sentido de que a lei fosse cumprida,\nisto é, de que a aviação atuasse como “uma corporação única, subordinada\nao Ministério da Aeronáutica”. Castelo Branco sugeria que a “aviação\nembarcada fosse constituída de meios da Marinha e da FAB”. Em\nconseqüência, demitiu-se o diretor-geral da Aeronáutica da Marinha, o\nalmirante José Saldanha da Gama.\n\nAinda nessa ocasião, uma comissão da Marinha que analisou o problema\nconcluiu por formular violentas críticas à ação governamental. No dia 5\nde dezembro, um helicóptero da Marinha foi metralhado por oficiais da\nAeronáutica acantonados em Tramandaí (RS). Cinco dias depois, Castelo\nBranco reuniu-se com Melo Batista e o ministro da Aeronáutica, Nélson\nLavenère Wanderley, para discutir o incidente. Como resultado do\nencontro, o general Valdemar Levi Cardoso foi nomeado para apurar os\nfatos. Descontente com a decisão presidencial de resolver o problema por\nato do Executivo, Lavenère Wanderley exonerou-se do cargo no dia 14 de\ndezembro do mesmo ano.\n\nA crise implicou também a demissão do novo ministro da Aeronáutica,\nMárcio de Sousa Melo, substituído pelo brigadeiro Eduardo Gomes. Devido\nà crescente inquietação na Marinha, Melo Batista exonerou-se por sua vez\nno dia 15 de janeiro de 1965, alegando ser impossível convencer sua\noficialidade de que lhe seriam vedadas “a posse e o emprego de meios\naéreos próprios para operações no mar”. Para substituí-lo, foi designado\no almirante Paulo Bosísio. Ao transmitir o cargo, Melo Batista\npronunciou um contundente discurso em que explicava as razões de seu\npedido de exoneração, não tendo sido preso apenas graças à solidariedade\ndos colegas presentes ao ato.\n\nSomente em maio de 1965 a crise foi definitivamente resolvida. Com a\ncolaboração das duas armas, sancionou-se a lei que concedeu à\nAeronáutica o pessoal necessário às operações da aviação embarcada.\n\nApesar do veemente discurso que proferiu e de sua atitude contrária a\nCastelo Branco durante a crise, Melo Batista atingiu o posto de\nalmirante-de-esquadra em outubro de 1968, já durante o governo do\ngeneral Artur da Costa e Silva. Em 1969, por ocasião da sucessão de\nCosta e Silva, quando o país se encontrava sob o governo da junta\nmilitar e surgia o nome do general Emílio Garrastazu Médici como a opção\npresidencial mais provável, Melo Batista voltou a manifestar sua\ninsatisfação, emitindo no dia 2 de outubro uma crítica ao sistema de\nescolha do candidato à presidência da República e afirmando que se\ntratava apenas de “um golpe militar a frio sem qualquer base legal ou\nmoral”. E acrescentava: “O país só poderá sair desta situação por uma\ncontestação de força (...) a não ser que se escute os chefes militares\ncomo Dutra, Denis, Pena Boto, Sodré, Heck e Eduardo Gomes.” Frisava\nainda o militar que a Marinha e a Aeronáutica se limitavam a acatar a\ndecisão do Exército.\n\nCom base no Ato Institucional nº 17, de 14 de outubro de 1969, que\npermitiu a transferência para a reserva por tempo determinado dos\nmilitares que houvessem atentado o viessem a atentar contra a coesão das\nforça armadas, Melo Batista foi suspenso de suas atividades, dois dias\ndepois, pelo período de um ano.\n\nFaleceu no Rio de Janeiro no dia 14 de outubro de 1973.\n\nEra casado com Lígia Varela de Melo Batista, com quem teve três filhos.\n\nDeixou vários trabalhos técnicos, depois arquivados no Estado-Maior da\nArmada, tendo realizado ainda os cursos da Escola de Guerra Naval e da\nEscola Superior de Guerra.\n\n \n\nFONTES: CHAGAS, C.*113*; CONSULT. MAGALHÃES, B.; CORRESP. SERV. DOC.\nGER. MAR.; *Encic. Mirador*;*****Jornal do Brasil* (21/10/73); MIN. MAR.\n*Almanaque*(1969); VIANA FILHO, L. *Governo.*\n\n \n","ref":"FONTES: CHAGAS, C.*113*; CONSULT. MAGALHÃES, B.; CORRESP. SERV. DOC.\nGER. MAR.; *Encic. Mirador*;*****Jornal do Brasil* (21/10/73); MIN. MAR.\n*Almanaque*(1969); VIANA FILHO, L. *Governo.*\n\n \n","dic":"DHBB"}
