{"title":"BATISTA, Válter","cargoss":["Deputado federal"],"cargos_esp":[0],"datas_ini":[1964],"datas_fim":[1967],"estados":["SE"],"autor":[0],"content":"**BATISTA, Válter**\n\n\\*dep. fed. SE 1964-1967.\n\n \n\n*Válter de Assis Ferreira Batista* elegeu-se em outubro de 1962 suplente\nde deputado federal por Sergipe na legenda da Aliança Social\nDemocrática, coligação do Partido Social Democrático (PSD) com o Partido\nRepublicano (PR), exercendo o mandato de 15 de setembro de 1964 a 31 de\njaneiro de 1967.\n\nDurante a legislatura, em conseqüência da extinção dos partidos\npolíticos pelo Ato Institucional nº 2 (27/10/1965) e da posterior\ninstauração do bipartidarismo, filiou-se em 1966 ao Movimento\nDemocrático Brasileiro (MDB), partido de oposição ao regime militar\ninstaurado no país em abril de 1964.\n\nFaleceu no dia 16 de janeiro de 1998.\n\n \n\nFONTES: CÂM. DEP. *Deputados*; CÂM. DEP. *Deputados brasileiros.\nRepertório* (1963-1967); IPC. *Relação de parlamentares* (18/11/1998);\nTRIB. SUP. ELEIT. *Dados* (6).\n\n \n","ref":"FONTES: CÂM. DEP. *Deputados*; CÂM. DEP. *Deputados brasileiros.\nRepertório* (1963-1967); IPC. *Relação de parlamentares* (18/11/1998);\nTRIB. SUP. ELEIT. *Dados* (6).\n\n \n","dic":"DHBB"}
