{"title":"BAYMA, Antônio Alexandre","cargoss":["Senador"],"cargos_esp":[0],"datas_ini":[1951],"datas_fim":[1954],"estados":["MA"],"autor":[0],"content":"**BAYMA, Antônio Alexandre**\n\n\\*sen. MA 1951-1954.\n\n \n\n*Antônio Alexandre Bayma* nasceu em Codó (MA) no dia 17 de abril de\n1903, filho de Manuel****Ferreira Bayma e de Maria Gertrudes Brandão\nBayma.\n\nApós realizar os primeiros estudos na Escola Primária Filomena Moreira,\nem sua cidade natal, iniciou o curso secundário no Colégio Francisco de\nPaula, em São Luís, transferindo-se depois para o Colégio Anchieta, de\nNova Friburgo (RJ), e prestando exames no Colégio Pedro II, do Rio de\nJaneiro, então Distrito Federal. Formou-se em 1930 pela Escola de Minas\nde Ouro Preto (MG), especializando-se em mineralogia e construção civil.\n\nIniciou sua vida pública em 1933 como prefeito de São Luís, permanecendo\nno cargo até 1935, quando foi eleito vereador. Com o advento do Estado\nNovo em 10 de novembro de 1937 e a supressão de todos os órgãos\nlegislativos do país, passou a trabalhar como engenheiro do estado,\nexercendo as funções de diretor de Obras Públicas, diretor da Estrada de\nFerro São Luís-Teresina e administrador do Serviço de Águas, Esgotos e\nTração Elétrica de São Luís.\n\nEm janeiro de 1947, após a redemocratização do país, foi novamente\neleito para a Câmara Municipal de São Luís e, no pleito de outubro de\n1950, elegeu-se senador pelo Maranhão na legenda do Partido Social\nTrabalhista (PST), liderado no estado por Vitorino Freire. Tomou posse\nem março de 1951, exercendo o mandato até dezembro de 1954, quando\nrenunciou, com o suplente Newton de Barros Belo, para permitir a eleição\nde Assis Chateaubriand ao Senado pelo Maranhão.\n\nFaleceu no dia 4 de setembro de 1959.\n\nEra casado com Anita Koblitz Bayma, com quem teve três filhos.\n\n \n\nFONTES: CISNEIROS, A. *Parlamentares; Jornal do Brasil* (5 e 9/9/59,\n20/6/66); SENADO. *Relação;*SOC. BRAS. EXPANSÃO COMERCIAL. *Quem.*\n\n \n","ref":"FONTES: CISNEIROS, A. *Parlamentares; Jornal do Brasil* (5 e 9/9/59,\n20/6/66); SENADO. *Relação;*SOC. BRAS. EXPANSÃO COMERCIAL. *Quem.*\n\n \n","dic":"DHBB"}
