{"title":"BECK, Mariano","cargoss":["Deputado federal"],"cargos_esp":[0],"datas_ini":[1967],"datas_fim":[1969],"estados":["RS"],"autor":[0],"content":"**BECK, Mariano**\n\n\\*dep. fed. RS 1967-1969.\n\n \n\n*José Mariano de Freiras Beck* nasceu em Santa Maria (RS) no dia 24 de\nfevereiro de 1922, filho de Hermínio Beck e de Lucília Lima Beck.\n\nProfessor primário e secundário, além de pecuarista, bacharelou-se pela\nFaculdade de Direito da Universidade do Rio Grande do Sul em 1945.\nOcupou interinamente a prefeitura municipal de Tupanciretã (RS).\n\nAssistente jurídico e chefe de gabinete da Secretaria Estadual de\nEducação e Cultura, assumiu interinamente o cargo de secretário em 1953,\nno governo Ernesto Dornelles, substituindo Júlio Marino de Carvalho. Foi\nainda secretário interino de Interior e Justiça e de Agricultura,\nIndústria e Comércio.\n\nNo pleito de outubro de 1954, elegeu-se deputado à Assembléia\nLegislativa do Rio Grande do Sul na legenda do Partido Trabalhista\nBrasileiro (PTB), deixando o cargo de secretário e exercendo o mandato a\npartir de fevereiro de 1955. Tentou a reeleição no pleito de outubro de\n1958, ficando apenas com uma suplência, mas retomou à Assembléia, cuja\nvice-presidência ocupou na legislatura iniciada em 1959.\n\nVoltou a ocupar a Secretaria da Educação no governo de Leonel Brizola,\nexercendo o cargo de 1959 a 1961. No período, exerceu ainda, em caráter\ninterino, o cargo de secretário de Interior e Justiça do estado.\n\nApós o movimento político-militar de 31 de março de 1964 e com a\nextinção dos partidos políticos pelo Ato Institucional nº 2 (27/10/1965)\ne a posterior instauração do bipartidarismo, filiou-se ao Movimento\nDemocrático Brasileiro (MDB), partido de oposição ao regime militar, em\ncuja legenda se elegeu deputado federal pelo Rio Grande do Sul no pleito\nde novembro de 1966. Participou da Frente Ampla, coalizão oposicionista\nque reunia políticos de destaque marginalizados pelo novo regime. Ocupou\numa cadeira na Câmara de fevereiro de 1967 ao dia 16 de janeiro de 1969,\nquando teve seu mandato cassado e seus direitos políticos suspensos com\nbase no Ato Institucional nº 5, editado em 13 de dezembro de 1968.\n\nEm 1981, foi eleito presidente da seção gaúcha da Ordem dos Advogados do\nBrasil. No exercício do cargo, presidiu a comissão especial que\ninvestigou o seqüestro dos uruguaios Lílian Celiberti e Universindo Díaz\npor militares uruguaios em Porto Alegre. A comissão concluiu que houve\nparticipação de elementos dos órgãos de repressão do governo do Rio\nGrande do Sul na operação.\n\nMariano Beck faleceu em Porto Alegre no dia 22 de dezembro de 1987.\n\nEra casado com Maria da Glória Martins Costa de Freitas Beck, com quem\nteve sete filhos.\n\n \n\nFONTES: ARQ. DEP. PESQ. JORNAL DO BRASIL; CÂM. DEP. *Deputados*; CÂM.\nDEP. *Deputados brasileiros. Repertório* (1967-1971); COUTINHO, A.\n*Brasil*; FERREIRA FILHO, A. *História*; *Veja* (6/1/88).\n\n \n","ref":"FONTES: ARQ. DEP. PESQ. JORNAL DO BRASIL; CÂM. DEP. *Deputados*; CÂM.\nDEP. *Deputados brasileiros. Repertório* (1967-1971); COUTINHO, A.\n*Brasil*; FERREIRA FILHO, A. *História*; *Veja* (6/1/88).\n\n \n","dic":"DHBB"}
