{"title":"BELINATI, Valdmir","cargoss":["Deputado federal"],"cargos_esp":[0],"datas_ini":[1979],"datas_fim":[1983],"estados":["PR"],"autor":[0],"content":"**BELINATI, Valdmir**\n\n\\*dep. fed. PR 1979-1983.\n\n \n\n*Valdmir Belinati* nasceu em Cornélio Procópio (PR) no dia 4 de junho de\n1950, filho de José Mariosi Belinati e de Helena Casemiro Belinati. Seu\nirmão, Antônio Belinati, foi várias vezes deputado estadual, deputado\nfederal (1975-1977) e três vezes prefeito de Londrina (PR) (1977-1982,\n1989-1993, 1997-2000). Sua cunhada, Emília de Sales Belinati, também foi\ndeputada estadual, além de vice-governadora do Paraná entre 1995 e 2003,\nnas duas gestões do governador Jaime Lerner.\n\nEstudante de medicina na Universidade Estadual de Londrina, começou na\npolítica disputando em novembro de 1972 uma vaga na Câmara Municipal\ndessa cidade na legenda do Movimento Democrático Brasileiro (MDB),\npartido de oposição ao regime militar vigente no país desde abril de\n1964. Foi o mais jovem e o mais votado vereador da história da cidade.\nAssumiu o mandato em fevereiro de 1973 e formou-se em medicina no final\nde 1974. Reeleito em novembro de 1976, novamente como o mais votado, no\nmandato iniciado em 1977 foi líder da bancada do MDB e presidente das\ncomissões de Saúde, Saneamento e Assistência Social, de Redação e de\nAgricultura. Foi ainda membro da Comissão de Planejamento Urbano e autor\ndo projeto de criação da Comissão de Ecologia e Proteção ao Meio\nAmbiente, que veio a presidir.\n\nEm novembro de 1978 foi eleito deputado federal pelo Paraná, com a\nterceira maior votação do MDB. Assumindo o mandato na Câmara dos\nDeputados em fevereiro de 1979, presidiu o 1º Simpósio Regional de\nEcologia e Proteção ao Meio Ambiente, integrou a Comissão de Relações\nExteriores e foi suplente da Comissão de Saúde. Participou ainda de\ndiversas comissões especiais, tendo apresentado trabalhos em simpósios\nsobre a indústria farmacêutica e a política nacional de saúde. Com a\nextinção do bipartidarismo em 29 de novembro de 1979 e a posterior\nreformulação partidária, filiou-se ao Partido do Movimento Democrático\nBrasileiro (PMDB). Deixou a Câmara dos Deputados em janeiro de 1983, sem\nter concorrido à reeleição. Em seguida, foi diretor da Companhia\nBrasileira de Alimentos (Cobal), coordenador de Ciências da Saúde do\nConselho Nacional de Desenvolvimento Científico e Tecnológico (CNPq) e\nmembro da comissão executiva da Comissão Interministerial de\nPlanejamento e Coordenação dos Ministérios da Saúde, da Previdência e da\nEducação (Ciplan).\n\nEm 1985 ingressou na Johns Hopkins University, em Baltimore (EUA), onde\nconcluiu o mestrado em saúde pública e os créditos do doutorado.\nSecretário de Saúde (1989-1990) e secretário-geral (1991-1992) da\nprefeitura de Londrina durante a gestão de Antônio Belinati, seu irmão,\nassumiu em 1994 a superintendência do Instituto de Previdência do Estado\n(IPE) no governo de Roberto Requião (1991-1994). Também em 1994,\ndefendeu tese de doutorado sobre avaliação de serviços de saúde na\nUniversidade de São Paulo (USP).\n\nEm janeiro de 1997, quando do retorno do irmão à prefeitura de Londrina,\ntornou-se diretor da Sercomtel S.A. Telecomunicações, permanecendo no\ncargo até a cassação do mandato de Antônio Belinati em junho de 2000.\nNão se candidatou mais a cargos eletivos, dedicando-se ao exercício de\nsuas atividades profissionais como médico cardiologista e angiologista\nem uma clínica particular na cidade de Londrina.\n\nPublicou *Prioridades básicas brasileiras no setor de medicamentos e\nindústrias farmacêuticas*,*Doença meningocócica — situação epidêmica no\nParaná* (1976), *Estudo clínico, eletro e epidemiológico da doença de\nChagas em doadores de sangue no norte do Paraná* (1976), *Valor\nnutritivo dos produtos hortifrutigranjeiros* (1980) e *Avaliação crítica\ndo aumento da capacidade operativa dos serviços de saúde ao nível\nprimário, Londrina 1986–1992*(tese de doutorado, USP, 1994).**\n\n \n\nFONTES: CÂM. DEP. *Deputados brasileiros. Repertório*(1979-1983); *Folha\nde Londrina* (23/8/09); INF. BIOG.; *Jornal do Estado* (20/5/05).\n\n \n","ref":"FONTES: CÂM. DEP. *Deputados brasileiros. Repertório*(1979-1983); *Folha\nde Londrina* (23/8/09); INF. BIOG.; *Jornal do Estado* (20/5/05).\n\n \n","dic":"DHBB"}
