{"title":"BELO, Saturnino","cargoss":["Interventor"],"cargos_esp":[0],"datas_ini":[1946],"datas_fim":[1947],"estados":["MA"],"autor":[0],"content":"**BELO, Saturnino**\n\n\\*interv. MA 1946-1947.\n\n \n\n*Saturnino Belo*nasceu em São Luís.\n\nIngressou jovem no comércio como empregado da firma Jorge Santos e\ntransferiu-se depois para a firma Francisco Aguiar e Cia., uma das mais\nimportantes da capital maranhense, conseguindo aí elevar-se à condição\nde sócio.\n\nNo pleito de outubro de 1934, elegeu-se deputado à Constituinte do\nMaranhão, participando da elaboração da nova carta estadual e exercendo\no mandato até 10 de novembro de 1937, quando o golpe do Estado Novo\nsuprimiu todos os órgãos legislativos do país.\n\nCom a desagregação do Estado Novo e a reorganização partidária promovida\nem 1945, filiou-se ao Partido Social Democrático (PSD), liderado no\nMaranhão por Vitorino Freire. No pleito de dezembro desse ano, elegeu-se\nsuplente de deputado à Assembléia Nacional Constituinte na legenda do\nPSD. Em 12 de fevereiro de 1946, por indicação de Vitorino Freire, foi\nnomeado pelo presidente Eurico Dutra interventor no Maranhão em\nsubstituição ao desembargador Eleasar Soares Campos.\n\nDurante a campanha para as eleições de janeiro de 1947, ocorreu uma\nséria dissensão no PSD maranhense. Não aceitando a candidatura de\nGenésio Rego ao governo do estado, lançada pelo diretório do partido,\nVitorino Freire, Saturnino Belo e Sebastião Archer afastaram-se da\nagremiação à frente de um grupo de dissidentes e fundaram a seção\nestadual do Partido Proletário do Brasil (PPB). Concorrendo na legenda\ndo PPB, Sebastião Archer e Saturnino Belo foram eleitos,\nrespectivamente, governador e vice-governador.\n\nEm 10 de abril de 1947 Saturnino Belo deixou a interventoria, passando o\npoder a João Pires Ferreira, presidente da Assembléia estadual. Em 14 de\nabril, tomou posse como vice-governador, ao lado de Sebastião Archer. Em\n28 de julho, a Assembléia Constituinte do Maranhão aprovou a quarta\nconstituição do estado.\n\nCandidato ao governo do Maranhão nas eleições de outubro de 1950,\nSaturnino Belo foi derrotado por Eugênio de Barros, que concorreu na\nlegenda do Partido Social Trabalhista (PST). Devido à disputa pelo\nreconhecimento do eleito e à morte inesperada de Saturnino Belo em São\nLuís, no dia 16 de janeiro de 1951, o governo do estado foi entregue no\ndia 31 de janeiro ao desembargador Traiaú Rodrigues Moreira, presidente\ndo Tribunal de Justiça. Eugênio de Barros só tomou posse em 28 de\nfevereiro de 1951.\n\nSaturnino Belo foi casado com Maria Lúcia Belo, com quem teve dois\nfilhos.\n\n \n\nFONTES: *Encic. Mirador*;*Jornal do Comércio,*Rio (17/1/51); MEIRELES,\nM. *História;* TRIB. SUP. ELEIT. *Dados*(1**e 2).\n\n \n","ref":"FONTES: *Encic. Mirador*;*Jornal do Comércio,*Rio (17/1/51); MEIRELES,\nM. *História;* TRIB. SUP. ELEIT. *Dados*(1**e 2).\n\n \n","dic":"DHBB"}
