{"title":"BENTES, Asdrúbal ================","cargoss":["Constituinte","Deputado federal","Deputado federal"],"cargos_esp":[0,0,0],"datas_ini":[1987,1997,1987],"datas_fim":[1988,1999,1991],"estados":[0,"PA","PA"],"autor":[0],"content":"BENTES, Asdrúbal\n================\n\n\\* const. 1987-1988; dep. fed. PA 1987-1991 e 1997-1999.\n\n \n\n*Asdrúbal Mendes Bentes* nasceu em Humaitá (AM) no dia 27 de julho de\n1939, filho de Valquíria do Prado Mendes.\n\nApós transferir-se para Belém, em 1958 ingressou na Faculdade de Direito\nda atual Universidade Federal do Pará, bacharelando-se em 1962. Em 1965,\ntornou-se procurador do Tribunal de Contas do estado. Em 1976 filiou-se\nà Aliança Renovadora Nacional (Arena), partido de apoio ao regime\nmilitar instaurado no país em abril de 1964, após a deposição do\npresidente João Goulart (1961-1964) pelo movimento político-militar de\n31 de março desse ano. Com a extinção do bipartidarismo em novembro de\n1979 e a conseqüente reformulação partidária, filiou-se no ano seguinte\nao Partido do Movimento Democrático Brasileiro (PMDB), principal força\nde oposição ao regime vigente.\n\nEm 1983, foi nomeado prefeito de Salinópolis (PA), município considerado\nárea de segurança nacional. Dois anos depois, deixou esse cargo e foi\nindicado para a presidência do Grupo Executivo das Terras do\nAraguaia-Tocantins (GETAT), em Marabá (PA). Neste cargo, administrou\nconflitos fundiários e problemas do garimpo em Serra Pelada, tendo\nparticipado da fundação da primeira sucursal da União Democrática\nRuralista (UDR) no Pará, entidade que reunia grandes proprietários de\nterras e que se opunha à reforma agrária. Permaneceu no GETAT até 1986,\nquando se desincompatibilizou do cargo para concorrer a cargo eletivo.\n\nEm novembro desse ano, elegeu-se deputado federal constituinte pelo Pará\nna legenda do Partido do Movimento Democrático Brasileiro (PMDB),\nassumindo sua cadeira em 1^º^ de fevereiro de 1987. No mesmo dia, foi\ninstalada a Assembléia Nacional Constituinte (ANC), na qual foi titular\nda Subcomissão de Defesa do Estado, da Sociedade e de sua Segurança, da\nComissão da Organização Eleitoral, Partidária e Garantia das\nInstituições, da qual foi primeiro-vice-presidente, além de suplente da\nSubcomissão dos Estados, da Comissão da Organização do Estado.\n\nDurante os trabalhos de elaboração da nova carta, Bentes votou a favor\ndo rompimento de relações diplomáticas com países com política de\ndiscriminação racial, do mandado de segurança coletivo, do turno\nininterrupto de seis horas, do aviso prévio proporcional, do voto aos 16\nanos, da unicidade sindical, do presidencialismo, do mandato de cinco\nanos para o então presidente José Sarney (1985-1990), da criação de um\nfundo de apoio à reforma agrária e da legalização do jogo do bicho.\nVotou contra a pena de morte, a limitação do direito de propriedade\nprivada, a desapropriação da propriedade produtiva, a limitação dos\nencargos da dívida externa, a jornada de 40 horas semanais e a\nestatização do sistema financeiro. Em fevereiro de 1988, foi considerado\no parlamentar recordista de pedidos de verbas.\n\nCom a promulgação da nova Constituição em 5 de outubro de 1988, passou a\nexercer somente o seu mandato ordinário. No pleito de outubro de 1990\nconcorreu a novo mandato de deputado federal, mas só obteve uma\nsuplência. Permaneceu na Câmara até o fim de janeiro de 1991, quando se\nencerraram o seu mandato e a legislatura. Concorreu novamente à Câmara\nna mesma legenda no pleito de outubro de 1994, quando ficou como segundo\nsuplente. Voltou a exercer mandato federal em janeiro de 1997, ocupando\na vaga aberta com a renúncia do deputado Paulo Titan, que havia sido\neleito prefeito de Castanhal (PA) no pleito de outubro do ano anterior.\nTornou-se membro titular da comissão de Constituição e Justiça.\n\nEm janeiro de 1997, Asdrúbal votou a favor do projeto de emenda\nconstitucional que permitia a reeleição de presidente da República,\ngovernadores e prefeitos, ratificando sua posição no mês seguinte,\nquando foi aprovada em segundo turno de votação na Câmara. Em novembro\ndesse mesmo ano, votou a favor da prorrogação por mais 11 meses da\nContribuição Provisória sobre Movimentação Financeira (CPMF) – conhecida\ncomo imposto do cheque – fixada em 0,2%, como fonte complementar de\nrecursos para a saúde e contra o projeto de Reforma Administrativa do\ngoverno que, ao ser aprovado, acabou com a estabilidade do servidor\npúblico.\n\nNo pleito de outubro de 1998 disputou novo mandato, mas novamente obteve\napenas uma suplência. Em novembro seguinte, votou a favor do projeto do\ngoverno de reforma da Previdência que estabeleceu um valor máximo para\naposentadorias no setor público, bem como a idade mínima e o tempo de\ncontribuição no setor privado. Permaneceu na Câmara dos Deputados até o\nfim de janeiro de 1999, quando se encerraram o seu mandato e a\nlegislatura.\n\nCasou-se com Maria de Lurdes Rego Cordeiro, com quem teve quatro filhos.\n\n \n\nFONTES: ASSEMB. NAC. CONST.*Repertório*(1987-1988); *Boletim do\nDIAP,*VIII (n. 98); COELHO, J. & OLIVEIRA, A. *Nova*; *Folha de São\nPaulo*(6/2/88, 5/2 e 29/9/98).**\n","ref":"FONTES: ASSEMB. NAC. CONST.*Repertório*(1987-1988); *Boletim do\nDIAP,*VIII (n. 98); COELHO, J. & OLIVEIRA, A. *Nova*; *Folha de São\nPaulo*(6/2/88, 5/2 e 29/9/98).**\n","dic":"DHBB"}
