{"title":"BENTES, Paulo de Meneses","cargoss":["Deputado federal","Deputado federal","Deputado federal","Deputado federal"],"cargos_esp":[0,0,0,0],"datas_ini":[1949,1958,1957,1955],"datas_fim":[1951,1958,1957,0],"estados":["AM","PA","PA","PA"],"autor":[0],"content":"**BENTES, Paulo de Meneses**\n\n\\*dep. fed. AM 1949-1951; dep. fed. PA 1955, 1957 e 1958.\n\n \n\n*Paulo de Meneses Bentes* nasceu em Manaus no dia 19 de agosto de 1908,\nfilho de Antônio da Gama Bentes e de Ester de Meneses Bentes.\n\nAdvogado e engenheiro agrônomo, no pleito de dezembro de 1945 elegeu-se\nsuplente de deputado à Assembléia Nacional Constituinte pelo Amazonas na\nlegenda da União Democrática Nacional (UDN), partido que ajudou a\nfundar. Assumiu o mandato somente após a transformação da Constituinte\nem Congresso ordinário, atuando na Câmara de novembro de 1949 a janeiro\nde 1951.\n\nNo pleito de outubro de 1954, elegeu-se deputado federal pelo Pará na\nlegenda da Aliança Social Democrática, coligação formada pelo Partido\nSocial Democrático (PSD) e o Partido de Representação Popular (PRP).\nExerceu o mandato de fevereiro a março de 1955, de agosto a dezembro de\n1957 e de março a junho de 1958, participando na Câmara das comissões de\nRelações Exteriores, Finanças e Valorização da Amazônia. Foi autor do\nprojeto de aposentadoria aos 30 anos de serviço e da proposição de\nserviço militar obrigatório para as mulheres. Nas eleições de outubro de\n1958, concorreu novamente à Câmara dos Deputados, dessa vez pelo Rio de\nJaneiro, então Distrito Federal, obtendo apenas uma suplência. Em 1959,\ndirigiu o Banco da Amazônia.\n\nEm 1966, ao ser promovida a reorganização partidária dentro dos moldes\ndo bipartidarismo, foi um dos fundadores do partido de oposição ao\ngoverno, o Movimento Democrático Brasileiro (MDB). No período de março\nde 1975 a março de 1977, foi assessor especial do secretário de\nSegurança do Rio de Janeiro, general Osvaldo Domingues.\n\nPaulo de Meneses Bentes foi ainda jornalista, escritor e poeta. Foi\nmembro fundador da Academia Acreana de Letras e da Academia Carioca de\nLetras e pertenceu à Associação das Academias de Letras do Brasil e à\nSociedade de Homens de Letras do Brasil. Foi diretor da Superintendência\nde Valorização Econômica da Amazônia (SPVEA), da Colônia Agrícola\nNacional do Pará, da Fundação Zoobotânica de Brasília e da Colônia\nAgrícola de Jaguaquara, na Bahia. Foi também procurador da****Justiça\nEleitoral no Acre e fundador da Legião Amazônica, entidade destinada à\ndefesa dos recursos naturais da região.\n\nFaleceu no Rio de Janeiro em 5 (ou 6) de dezembro de 1979.\n\nEra casado com Carmem Dolores de Sisnando Bentes, com quem teve seis\nfilhos.\n\nAlém de lançar as revistas*Academia de Letras do Acre*e*A Selva*,\npublicou várias obras sobre a Amazônia, entre as quais *O outro Brasil,\nTavares Bastos e a Amazônia, Parongo*e *A hiléia.*\n\n \n\n \n\nFONTES: CÂM. DEP. *Deputados;*CÂM. DEP. *Relação dos dep*.; COUTINHO, A.\n*Brasil; Globo* (7/12/79*); Jornal do Brasil* (15/3/79); TRIB. SUP.\nELEIT. *Dados*(2, 3, 4 e 6).\n\n \n","ref":"FONTES: CÂM. DEP. *Deputados;*CÂM. DEP. *Relação dos dep*.; COUTINHO, A.\n*Brasil; Globo* (7/12/79*); Jornal do Brasil* (15/3/79); TRIB. SUP.\nELEIT. *Dados*(2, 3, 4 e 6).\n\n \n","dic":"DHBB"}
