{"title":"BENTO, Rubem","cargoss":["Deputado federal"],"cargos_esp":[0],"datas_ini":[1991],"datas_fim":[1995],"estados":["RR"],"autor":[0],"content":"**BENTO, Rubem**\n\n\\*dep. fed. RR 1991-1995.\n\n*Rubem da Silva Bento* nasceu em Bacabal (MA) no dia 5 de junho de 1942,\nfilho de Rubens de Sousa Bento e de Maria Lídia da Silva Bento.\nDescendente de tradicional família na política de Roraima, é irmão de\nBarac da Silva Bento, prefeito de Boa Vista de 1989 a 1993.\n\nIngressou na Escola Técnica Sólon de Lucena, em Manaus, no ano de 1959,\ndiplomando-se técnico em contabilidade em 1961. Exerceu a profissão de\nbancário de 1979 a 1984, tendo chegado a diretor do Banco de Roraima, em\nBoa Vista. Tornou-se em seguida diretor da Companhia de Desenvolvimento\nde Roraima, onde permaneceu até 1985, quando retornou à diretoria do\nBanco de Roraima e começou a atuar como secretário-geral do Partido da\nFrente Liberal (PFL) naquele território. Em 1987 voltou à direção da\nCompanhia de Desenvolvimento até 1988, ano em que foi eleito, no pleito\nde novembro, vereador à Câmara Municipal de Boa Vista, na legenda do\nPFL. Em 1989, passou de secretário-geral a primeiro-vice-presidente do\nPFL de Roraima, tornando-se ainda líder do governo na Câmara. No ano\nseguinte, participou das comissões de Justiça e Redação, de Obras e\nServiço Público, de Educação, Cultura, Saúde e Assistência Social, e de\nDefesa do Consumidor.\n\nNas eleições de outubro de 1990, concorreu na legenda do PFL a uma\ncadeira na Câmara dos Deputados já pelo novo estado de Roraima.\nVitorioso nas urnas, concluiu seu mandato de vereador em janeiro de 1991\ne, no mês seguinte, tomou posse como deputado federal. Ainda em 1991,\natuou na Comissão de Educação, Cultura e Desportos e foi vice-presidente\nda Comissão Parlamentar de Inquérito (CPI) sobre a Reforma\nAdministrativa.\n\nNa Câmara, em 29 de setembro de 1992, votou a favor da abertura do\nprocesso de *impeachment* do presidente Fernando Collor de Melo, acusado\nde crime de responsabilidade por ligações com um esquema de corrupção\nliderado pelo ex-tesoureiro de sua campanha presidencial, Paulo César\nFarias. Collor foi afastado da presidência da República e, em 29 de\ndezembro, pouco antes da conclusão do processo pelo Senado Federal,\nrenunciou ao mandato, sendo efetivado no cargo o vice Itamar Franco, que\ndesde 2 de outubro vinha ocupando interinamente as funções.\n\nAinda nesta legislatura, Rubem Bento votou a favor da criação do Imposto\nProvisório sobre Movimentações Financeiras (IPMF), fixado em de 0,25%\nsobre as transações bancárias, como fonte complementar de recursos para\na saúde, bem como do Fundo Social de Emergência (FSE), que permitia ao\ngoverno gastar 20% da arrecadação de impostos sem destiná-los\nobrigatoriamente aos setores de saúde e educação, mas se pronunciou\ncontra o fim do voto obrigatório. Em janeiro de 1995, ao concluir seu\nmandato, deixou a Câmara dos Deputados.\n\nCasou-se com Valbélia Nazaré Baraúna Bento, com quem teve quatro filhos.\n\nFONTES: CÂM. DEP. *Deputados brasileiros. Repertório*(1991-1995); *Folha\nde S. Paulo*(18/9/94).\n\n \n","ref":"FONTES: CÂM. DEP. *Deputados brasileiros. Repertório*(1991-1995); *Folha\nde S. Paulo*(18/9/94).\n\n \n","dic":"DHBB"}
