{"title":"BÉRARD, Mário =============","cargoss":["Presidente de associação ou confederação de empregados ou empregadores"],"cargos_esp":["Banco do Brasil"],"datas_ini":[1988],"datas_fim":[1990],"estados":[0],"autor":[0],"content":"BÉRARD, Mário\n=============\n\n\\*pres. Banco do Brasil 1988-1990.\n\n \n\n*Mário Jorge Gusmão Bérard* nasceu em Maceió no dia 27 de fevereiro de\n1942, filho de Daniel Bérard e Emília Gusmão Bérard.\n\nIniciou seus estudos no Colégio Marista de Alagoas, onde concluiu o\nprimeiro grau em 1953. Prosseguiu com os estudos secundários no Colégio\nEstadual de Alagoas. Em 1959 foi admitido na Universidade Federal de\nAlagoas, bacharelando-se em direito em 1964.\n\nMário Bérard começou sua carreira profissional em 1963 como\nsócio-gerente da Bérard – Corretora de Títulos e Valores Mobiliários\nLtda. Tornou-se diretor-técnico da Companhia de Desenvolvimento de\nAlagoas (Codeal) entre 1967 e 1969, no governo de Antônio Simão Lamenha\nFilho, e sócio-gerente da empresa Projetos Técnicos S.A entre 1969 e\n1970. Nesse último ano, ingressou no curso de economia da Universidade\nFederal de Alagoas, abandonando-o no último semestre de 1973. Em 1971,\nna gestão do governador Afrânio Lages, ocupou o cargo de secretário de\nPlanejamento e ainda no mesmo ano e até 1975 o de secretário de Fazenda.\nEm 1973 ocupou interinamente o cargo de secretário de Viação e Obras\nPúblicas.\n\nAtuou como superintendente de implementação de programas de pesquisa do\nConselho Nacional de Pesquisas (CNPq) entre 1975 e 1979. Durante esse\nperíodo, foi representante do CNPq no conselho deliberativo da\nSuperintendência de Desenvolvimento da Amazônia (Sudam). Em 1979 foi\nnomeado secretário geral adjunto do Ministério da Fazenda, cargo que\ndesempenhou até 1983. Nesse ano, tornou-se chefe de gabinete da\nSecretaria Geral do Ministério da Fazenda.\n\nComo representante do Ministério da Fazenda participou dos seminários\nsobre política tributária e sobre inspeção fiscal na Fundação Alemã para\no Desenvolvimento Internacional, em Berlim, e da reunião do Fundo\nMonetário Internacional, realizada em Washington em 1985. Ainda como\nrepresentante do ministério, atuou também no conselho deliberativo da\nSuperintendência de Desenvolvimento do Nordeste (Sudene); na comissão\nespecial de desestatização; no Conselho Nacional de Meio Ambiente\n(Conama); no comitê interministerial de acompanhamento da execução dos\norçamentos públicos (Comor); na comissão marítima nacional (Comana); na\ncomissão interministerial de acompanhamento das finanças de estados,\nmunicípios e capitais (Ciafem); no conselho nacional de desenvolvimento\nurbano; nos conselhos fiscais da Petroquisa-Petrobrás Química S.A., da\nSiderbrás e do projeto Grande Carajás. \n\nEntre 1985 e 1988 assumiu diversas funções na Caixa Econômica Federal.\nFoi vice-presidente de planejamento e controle, diretor financeiro e\ncoordenador da incorporação do Banco Nacional de Habitação - BNH. Foi\nainda representante da Caixa Econômica Federal nos conselhos de\nadministração da Companhia Nacional de Seguros (Sasse), do Comitê\nBrasileiro de Construção Civil (Cobracon), da Cobra Computadores e\nSistemas Brasileiros e do conselho consultivo do Paço Imperial, no Rio\nde Janeiro.\n\nBérard era secretário-geral do Ministério da Fazenda quando foi\nconvidado a ocupar a presidência do Banco do Brasil em março de 1988, no\ngoverno do presidente José Sarney (1985-1990). Substituindo Camilo\nCalazans, defendeu uma nova imagem para o Banco do Brasil frente à\nsociedade e ao mercado financeiro, tornando-o uma instituição de\ninvestimento, e não apenas de repasse de recursos. Na sua gestão, o\nBanco do Brasil teve que arcar com o impacto da anistia da correção\nmonetária das dívidas dos micro e pequenos empresários contraídas\ndurante a implantação, em fevereiro de 1986, do plano de estabilização\neconômica, conhecido como Plano Cruzado, sobre o sistema financeiro e o\nTesouro Nacional.\n\nComo presidente do Banco do Brasil participou de diversas missões no\nexterior, entre elas das reuniões com administradores do Banco do\nBrasil, em Roma, Paris e Londres; com o Fundo Monetário Internacional e\ncom o Banco Mundial, em Berlim; com o Banco Interamericano de\nDesenvolvimento, em Caracas, e do seminário de conversão da dívida\nexterna do Brasil, em Nova Iorque.\n\nAo deixar a presidência do Banco do Brasil em março de 1990, ao final do\ngoverno Sarney, foi substituído por Alberto Policaro. Em 1990 e 1991,\ntornou-se respectivamente, diretor da IAT-Companhia de Comércio Exterior\ne diretor presidente da Eudmarco S.A. Serviços e Comércio Internacional,\nambas localizadas em São Paulo.\n\nBérard foi ainda conselheiro da Empresa Brasileira de Aeronáutica\n(Embraer), do Serviço Federal de Processamento de Dados (Serpro), da\nItaipu Binacional, da Fundação E. J. Zerbini, em São Paulo, e membro do\nconselho fiscal da Fundação Teatro Municipal do Rio de Janeiro, além de\nmembro titular do conselho curador da Fundação Nacional Pró-Memória.\n\nFoi casado com Gertrudes Perez Lopes Bérard, com quem teve quatro\nfilhos, e em segunda núpcias com Maria Evelina de Faria Pereira Penha\nBérard, com quem teve mais duas filhas.****\n\n* *\n\nAna Cristina Sá/Susana Cesa Delgado\n-----------------------------------\n\n \n\nFONTES: Arq. Museu Hist. Banco do Brasil; CURRIC. BIOG.; *Folha de São\nPaulo* (20/7/88, 26/4/89)*Gazeta Mercantil*(20, 26, 27/7 e 18/8/89);\n*Jornal do Brasil* (21/4 e 20/7/88, 6/11/89).\n","ref":"FONTES: Arq. Museu Hist. Banco do Brasil; CURRIC. BIOG.; *Folha de São\nPaulo* (20/7/88, 26/4/89)*Gazeta Mercantil*(20, 26, 27/7 e 18/8/89);\n*Jornal do Brasil* (21/4 e 20/7/88, 6/11/89).\n","dic":"DHBB"}
