{"title":"BERCHT, Egon","cargoss":["Deputado federal","Deputado federal","Deputado federal"],"cargos_esp":[0,0,0],"datas_ini":[1961,1960,1959],"datas_fim":[1961,1960,0],"estados":["PR","PR","PR"],"autor":[0],"content":"**BERCHT, Egon**\n\n\\*dep. fed. PR 1959, 1960 e 1961.\n\n \n\n*Egon Bercht* nasceu em Porto Alegre no dia 20 de maio de 1910, filho de\nErnesto Augusto Bercht e de Corina Bercht.\n\nEstudou no Colégio Farroupilha e no Ginásio Rosano, onde cursou\ncontabilidade.\n\nComerciante e empresário do setor madeireiro, candidatou-se a deputado\nfederal pelo Paraná na legenda do Partido Trabalhista Brasileiro (PTB),\nem 3 de outubro de 1958. Obteve uma suplência, vindo a exercer o mandato\nnos períodos de 15 de maio de 1959 a 10 de setembro de 1959, de 8 de\njunho de 1960 a 29 de agosto de 1960 e de 16 de agosto de 1961 a 20 de\nnovembro de 1961. Após essa data, abandonou definitivamente a política,\npassando a dedicar-se apenas a suas atividades empresariais.\n\nFaleceu em Porto Alegre no dia 3 de outubro de 1986.\n\nEra casado com Elma Bercht, com quem teve três filhos.\n\n \n\nFONTES: CÂM. DEP. *Deputados*; CÂM. DEP. *Deputados brasileiros.\nRepertório* (1959-1963); INF. FAM.; TRIB. SUP. ELEIT. *Dados* (4).\n\n \n","ref":"FONTES: CÂM. DEP. *Deputados*; CÂM. DEP. *Deputados brasileiros.\nRepertório* (1959-1963); INF. FAM.; TRIB. SUP. ELEIT. *Dados* (4).\n\n \n","dic":"DHBB"}
