{"title":"BERNARDI, Renato","cargoss":["Deputado federal","Constituinte"],"cargos_esp":[0,0],"datas_ini":[1983,1987],"datas_fim":[1991,1988],"estados":["PR",0],"autor":[0],"content":"**BERNARDI, Renato**\n\n\\*dep. fed. PR 1983-1991; const. 1987-1988.\n\n \n\n*Renato Bernardi* nasceu em Ibirá (SP), no dia 12 de abril de 1937,\nfilho de Ernesto Bernardi e de Helena Orsi.\n\nFormado em filosofia pelo Colégio Máximo Palofino, de Santa Maria (RS) e\nem geografia e história pela Universidade Católica do Paraná, obteve o\ngrau de mestre em geografia e história pelo Centro de Estudos\nUniversitários de Londrina.\n\nIniciou a carreira política em novembro de 1964, elegendo-se vereador de\nMaringá (PR) na legenda do Movimento Democrático Brasileiro (MDB),\npartido de oposição ao regime militar. Empossado em fevereiro do ano\nseguinte, presidiu a Comissão de Educação. Vice-prefeito do município,\neleito em novembro de 1968, deixou o cargo para tomar posse na\nSecretaria Municipal de Educação (1973-1974).\n\nNas eleições de novembro de 1978, conquistou o mandato de deputado\nestadual. Presidente da Comissão de Ecologia e Meio Ambiente, com a\nextinção do bipartidarismo, em novembro de 1979, e a conseqüente\nreformulação partidária, filiou-se ao Partido do Movimento Democrático\nBrasileiro (PMDB), sucessor do MDB. Líder do partido (1980-1981) e\ntitular da Comissão de Justiça, retomou a Comissão de Ecologia e Meio\nAmbiente (1981-1982).\n\nNo pleito de novembro de 1982 elegeu-se deputado federal pelo Paraná.\nTitular das comissões do Interior (1983-1984) e de Defesa do Consumidor\n(1984), na sessão de 25 de abril de 1984, votou a favor da emenda Dante\nde Oliveira, que previa eleições diretas para presidente da República.\nDerrotada a proposição — faltaram 22 votos para que fosse levada à\napreciação do Senado — no Colégio Eleitoral, reunido em 15 de janeiro de\n1985, Renato Bernardi apoiou o candidato oposicionista Tancredo Neves,\neleito pela Aliança Democrática, uma união do PMDB com a dissidência do\nPartido Democrático Social (PDS) abrigada na Frente Liberal. Doente,\nTancredo Neves não chegou a ser empossado, vindo a falecer em 21 de\nabril de 1985. Seu substituto foi o vice José Sarney, que já vinha\nexercendo o cargo interinamente desde 15 de março desse ano.\n\nElegeu-se deputado federal constituinte em novembro de 1986. Titular da\nSubcomissão dos Estados, da Comissão da Organização do Estado, e já\nfiliado ao Partido da Frente Liberal (PFL), votou a favor da soberania\npopular, do mandado de segurança coletivo, do aborto, da limitação do\ndireito de propriedade, da nacionalização do subsolo, da proibição do\ncomércio de sangue, da jornada semanal de 40 horas, do turno\nininterrupto de seis horas, da unicidade sindical, do voto facultativo\naos 16 anos, do presidencialismo, do mandato de cinco anos para o\npresidente José Sarney. E contra a pena de morte, a estatização do\nsistema financeiro, o limite de 12% ao ano para os juros reais, a\nlimitação dos encargos da dívida externa, a criação de um fundo de apoio\nà reforma agrária.\n\nSem disputar a reeleição, deixou a Câmara dos Deputados ao término da\nlegislatura, em janeiro de 1991.\n\nProfessor da Universidade Estadual de Maringá, Renato Bernardi publicou\nMaringá — geografia regional (1964).\n\nFaleceu no dia 27 de novembro de 1996.\n\nEra casado com Elza Marques Bernardi.\n\n \n\nFONTES: ASSEMB. NAC. CONST. *Repertório* (1987); COELHO, J. & OLIVEIRA,\nA. *Nova*.\n\n \n","ref":"FONTES: ASSEMB. NAC. CONST. *Repertório* (1987); COELHO, J. & OLIVEIRA,\nA. *Nova*.\n\n \n","dic":"DHBB"}
