{"title":"BERTOLI, Lyrio","cargoss":["Deputado federal"],"cargos_esp":[0],"datas_ini":[1963],"datas_fim":[1971],"estados":["PR"],"autor":[0],"content":"**BERTOLI, Lyrio**\n\n\\*dep. fed. PR 1963-1971.\n\n \n\nLyrio Bertoli nasceu em Taió (PR) no dia 16 de junho de 1930, filho de\nJosé Luís Bertoli e de Amélia Bertoli.\n\nDiplomou-se técnico em contabilidade pela Escola Técnica Rio Branco, em\nCascavel (PR), e advogado pela Faculdade de Direito da Universidade do\nParaná. Fez ainda curso de planejamento governamental na Universidade de\nBrasília.\n\nNo pleito de outubro de 1962, candidatou-se com sucesso a uma vaga na\nCâmara dos Deputados pelo Paraná, na legenda do Partido Social\nDemocrático (PSD), tornando-se o primeiro deputado federal eleito pelo\noeste paranaense. Assumiu o mandato em fevereiro de 1963, visitando na\nqualidade de deputado federal a Espanha em 1964 e Israel em 1965, a\nconvite dos respectivos governos.\n\nEm conseqüência da extinção dos partidos políticos pelo Ato\nInstitucional nº 2 (27/10/1965) e da posterior instauração do\nbipartidarismo, filiou-se à Aliança Renovadora Nacional (Arena), partido\nde sustentação ao regime militar instaurado no país em abril de 1964.\nPor essa legenda reelegeu-se deputado federal em novembro de 1966,\niniciando novo mandato em fevereiro de 1967.\n\nNa Câmara dos Deputados participou como titular das Comissões de\nEconomia e Orçamento, e foi membro da CPI de Produção Mineral, tendo\nsido ainda suplente das Comissões de Finanças e Segurança Nacional.\nCandidato a mais um mandato em novembro de 1970, não foi bem-sucedido,\ndeixando a Câmara em janeiro de 1971.\n\nDeixando a carreira política, dedicou-se ao exercício da advocacia e à\nadministração de empresas. Vice-presidente do banco paraguaio, Banco del\nParaná, nos anos de 1985 e 1986, radicou-se em Foz do Iguaçu (PR), onde\ntornou-se presidente da Academia de Cultura de Foz do Iguaçu, exercendo\no mandato até o ano 2000. Após essa data não teve mais atuação na vida\npública.\n\nCasou-se com Amália Teresa Galafassi Bertoli, com quem teve três filhos.\n\n \n\nFONTES: CÂM. DEP. *Deputados;*CÂM. DEP. *Deputados brasileiros.\nRepertórios* (1963-1967, 1967-1971); INF. BIOG.\n\n \n","ref":"FONTES: CÂM. DEP. *Deputados;*CÂM. DEP. *Deputados brasileiros.\nRepertórios* (1963-1967, 1967-1971); INF. BIOG.\n\n \n","dic":"DHBB"}
