{"title":"BEZ, Edinho","cargoss":["Deputado federal","Deputado federal"],"cargos_esp":[0,0],"datas_ini":[2005,1995],"datas_fim":[0,2003],"estados":["SC","SC"],"autor":[0],"content":"**BEZ, Edinho**\n\n\\*dep. fed. SC 1995-2003 e 2005-\n\n \n\n*Edson Bez de Oliveira* nasceu em Gravatal (SC) no dia 6 de março de\n1950, filho de Sílvio João de Oliveira e de Artemísia Bez de Oliveira.\n\nEntre 1969 e 1971 fez o curso de técnico de contabilidade na Escola\nTécnica de Comércio de Tubarão (SC). Em 1971, já formado, começou a\ntrabalhar em três locais distintos, em sua cidade natal: como auxiliar\nde escritório do Grupo Gravatal, no qual ficaria até o ano seguinte;\ncomo professor da Escola Básica Professora Geraldina Maria Tavares,\nfunção que exerceria até 1974; e como contador do Escritório do Edinho,\nno qual permaneceria até 1976. Em 1972, iniciou o curso de ciências\ncontábeis na Universidade do Sul de Santa Catarina, em Tubarão, que\nconcluiria em 1975. Entre 1972 e 1973 chefiou o escritório do Instituto\nNacional de Colonização e Reforma Agrária (Incra) de Gravatal, e ainda\nem 1973 ingressou nos quadros da Caixa Econômica Federal (CEF) como\ngerente da agência de Criciúma (SC), cargo que ocuparia até 1991.\n\nIniciou sua trajetória política em 1985 filiando-se ao Partido do\nMovimento Democrático Brasileiro (PMDB). Nessa legenda elegeu-se\ndeputado estadual no pleito de outubro de 1990. Empossado na Assembleia\nLegislativa em fevereiro de 1991, foi membro das comissões de Trabalho e\nServiço Público (1991-1994), de Defesa do Consumidor (1994) e de Viação,\nTransportes e Desenvolvimento Urbano e Rural, que chegou a presidir nos\nbiênios 1991-1992 e 1993-1994, tendo ainda participado de diversas\ncomissões especiais.\n\nEm outubro de 1994, com base eleitoral no sul do estado, concorreu a uma\nvaga na Câmara dos Deputados na legenda do PMDB e foi eleito. Assumiu o\nmandato em fevereiro de 1995, vindo a integrar, como membro titular, a\nComissão de Finanças e Tributação e, como suplente, a Comissão de Minas\ne Energia. Participou ainda de várias comissões especiais. Durante a\nvotação das emendas constitucionais enviadas ao Congresso Nacional pelo\nExecutivo em 1995, acompanhou a orientação da base parlamentar\ngovernista, manifestando-se favoravelmente à abolição do monopólio\nestatal nas telecomunicações e na exploração do petróleo e do monopólio\ndos governos estaduais na distribuição do gás canalizado. Votou também a\nfavor da abertura da navegação de cabotagem às embarcações estrangeiras\ne do fim de todas as diferenças jurídicas entre as empresas de capital\nnacional e aquelas de outros países.\n\nEm junho de 1996, votou a favor da criação da Contribuição Provisória\nsobre Movimentação Financeira (CPMF) — que substituiu o Imposto\nProvisório sobre Movimentação Financeira (IPMF) —, tributo de 0,2% sobre\ntransações****bancárias criado como fonte complementar de recursos para\na saúde. Em janeiro/fevereiro de 1997, votou a favor da emenda da\nreeleição para presidente da República, governadores e prefeitos. Em\nnovembro, pronunciou-se favoravelmente à quebra da estabilidade do\nservidor público, item da reforma administrativa. Ainda nesse ano,\nintegrou como titular, Comissão Externa da Questão Portuária Nacional,\nda qual se tornou presidente, e fez nova viagem aos EUA e a países da\nEuropa para conhecer o sistema financeiro e os mercados de capitais,\nimobiliário e de seguros dessas nações.****\n\nNo pleito de outubro de 1998 candidatou-se à reeleição na legenda do\nPMDB, sendo bem-sucedido. Em novembro, faltou à votação do teto de 1.200\nreais para aposentadorias no setor público. Porém votou contra o\nestabelecimento de idade mínima e tempo de contribuição para o setor\nprivado, itens que definiram a reforma da Previdência. Participou,\ntambém em 1998, de uma missão de estudos ao Japão, destinada a conhecer\nos aspectos gerais do sistema financeiro e do cooperativismo de crédito\nvigentes naquele país. Iniciando o novo mandato em fevereiro de 1999,\nintegrou a Comissão de Finanças e Tributação e participou de diversos\ncongressos que trataram da reforma tributária. Em 2000 votou a favor da\npromulgação da Lei de Responsabilidade Fiscal (LRF) e, em 2002, da\nprorrogação da CPMF.\n\nEm outubro de 2002 foi reeleito deputado federal na legenda do PMDB, mas\nem janeiro de 2003 licenciou-se para assumir a Secretaria de Estado de\nTransportes e Obras. Participou a partir desse período do conselho\nadministrativo do Departamento de Transportes e Terminais (Deter). Foi\ntambém designado presidente do conselho administrativo do Porto de São\nFrancisco do Sul e membro do Conselho Estadual da Articulação do\nComércio Exterior (Ceacex) e do Conselho de Desenvolvimento e Integração\nSul (Codesul). Em fevereiro, deixou a secretaria e foi empossado na\nCâmara dos Deputados, passando a integrar as comissões permanentes de\nTrabalho, Administração e Serviço Público, de Turismo e Desportos e de\nViação e Transportes, além das frentes parlamentares de Defesa do Carvão\nMineral, de Apoio à Polícia Rodoviária Federal e de Habitação e\nDesenvolvimento Urbano. Em março, licenciou-se do mandato e foi nomeado\nsecretário de Infraestrutura do Estado de Santa Catarina. Ainda em 2003,\ntornou-se delegado nacional do PMDB e vice-presidente da Fundação\nUlysses Guimarães.\n\nEm abril de 2005, reassumiu a cadeira na Câmara dos Deputados, e em\noutubro de 2006 foi reeleito. Iniciou novo mandato em fevereiro de 2007\ne foi escolhido vice-líder do bloco partidário formado pelo PMDB, pelo\nPartido Trabalhista Brasileiro (PTB), pelo Partido Social Cristão (PSC)\ne pelo Partido Trabalhista Cristão (PTC).\n\n Casou-se com Vitemária Mendonça de Oliveira, com quem teve três\nfilhos.****\n\n \n\nFONTES: CÂM. DEP. *Deputados brasileiros. Repertório*(1995-1999,\n1999-2003, 2003-2007, 2007-2011); *Diário Catarinense*(7/10/98); *Folha\nde S. Paulo*(31/1/95, 14/1/96, 29/9 e 6/11/98); INF. BIOG.\n\n \n","ref":"FONTES: CÂM. DEP. *Deputados brasileiros. Repertório*(1995-1999,\n1999-2003, 2003-2007, 2007-2011); *Diário Catarinense*(7/10/98); *Folha\nde S. Paulo*(31/1/95, 14/1/96, 29/9 e 6/11/98); INF. BIOG.\n\n \n","dic":"DHBB"}
