{"title":"BEZERRA, Clóvis","cargoss":["Governador de estado ou do Distrito Federal"],"cargos_esp":[0],"datas_ini":[1982],"datas_fim":[1983],"estados":["PB"],"autor":["Alan Carneiro"],"content":"**BEZERRA, Clóvis**\n\n\\*gov. PB 1982-1983.\n\n*Clóvis Bezerra Cavalcanti* nasceu no Sítio Mundo Novo, município de\nBananeiras (PB), em 9 de julho de 1911, filho de Augusto Bezerra\nCavalcanti e de Maria das Mercês Rocha Bezerra Cavalcanti. Seu primo\nOdon Bezerra Cavalcanti foi revolucionário de 1930, constituinte de\n1934, deputado federal pela Paraíba de 1935 a 1937 e interventor federal\nem seu estado em 1946. Outro primo, Rivando Bezerra Cavalcanti, foi\npresidente do Tribunal de Justiça da Paraíba e chegou a ocupar o governo\ndo estado de 14 de maio a 16 de junho de 1986.\n\nClóvis Bezerra cursou o primário no Instituto Bananeirense, em sua\ncidade natal, e o ginasial no Colégio Diocesano Pio X e no antigo Liceu\nParaibano na Cidade da Paraíba, atual João Pessoa. Transferindo-se para\nRecife em 1930, ingressou na Faculdade de Medicina da Universidade de\nPernambuco e formou-se em dezembro de 1935.\n\nNo ano seguinte ingressou no serviço público, nomeado médico da Saúde\nPública pelo então governador da Paraíba, Argemiro de Figueiredo\n(1935-1937). Chefiou o posto de higiene de Bananeiras, que atendia a\ntoda a região do brejo paraibano. Em novembro de 1937, dois dias antes\nda instauração do Estado Novo (10/11/1937), foi designado\ntemporariamente para a chefia do Serviço de Endemias Rurais da Paraíba e\nparticipou de várias campanhas sanitárias no interior do estado.\n\nCom o fim da Segunda Guerra Mundial, em maio de 1945, e o\nenfraquecimento do Estado Novo, o Brasil começou a viver um processo de\nredemocratização. Surgiram novos partidos políticos e Bezerra filiou-se\nà União Democrática Nacional (UDN). No dia 7 de novembro foi nomeado\nprefeito de sua cidade natal pelo então interventor da Paraíba, Severino\nMontenegro (1945-1946), que chegara a essa condição por ser o presidente\ndo Tribunal de Justiça do estado.\n\nEm setembro de 1946 foi promulgada a nova Constituição e Bezerra\ncandidatou-se a uma cadeira na Constituinte estadual, elegendo-se\ndeputado no pleito de 19 de janeiro de 1947. Na Assembléia Legislativa,\nintegrou, como membro efetivo, a Comissão de Educação e Saúde Pública\naté o ano seguinte, quando assumiu a segunda secretaria da mesa diretora\nda Assembléia, para a qual foi reconduzido em 1949.\n\nEm outubro de 1950 reelegeu-se deputado estadual. Voltou a se eleger em\noutubro de 1954 e durante essa legislatura ocupou, em 1956, a primeira\nsecretaria da mesa diretora da Assembléia, tendo sido reconduzido ao\ncargo no ano seguinte. Conseguiu mais uma reeleição no pleito de outubro\nde 1958. Mais uma vez foi escolhido primeiro-secretário da mesa diretora\npara o biênio 1959-1961, quando deixou essa função e passou a integrar a\nComissão de Finanças.\n\nReeleito em outubro de 1962, ainda na legenda da UDN, no início de novo\nperíodo legislativo, em janeiro do ano seguinte, ocupou a presidência da\nmesa diretora da Assembléia Legislativa até janeiro de 1965. Foi\nvice-presidente do diretório regional da UDN, exercendo a presidência em\nvárias oportunidades, e líder do partido.\n\nCom a extinção dos partidos políticos pelo Ato Institucional nº 2\n(27/10/1965) e a conseqüente instauração do bipartidarismo, filiou-se à\nAliança Renovadora Nacional (Arena), partido de apoio ao regime militar\ninstaurado em abril de 1964, após a deposição do presidente João Goulart\n(1961-1964). Em seguida, assumiu a presidência da Comissão Executiva\nestadual do partido e, nessa condição, organizou os diretórios\nmunicipais nos 171 municípios do estado.\n\nNo pleito de outubro de 1966, obteve sua sétima eleição consecutiva para\ndeputado estadual. Iniciando mais um período legislativo em janeiro do\nano seguinte, foi eleito presidente da casa. Nessa condição, assumiu o\ngoverno do estado, interinamente, em substituição ao governador João\nAgripino (1966-1971), de 7 de junho a 5 de julho de 1967. Reconduzido à\npresidência da Assembléia Legislativa em janeiro de 1969, voltou a\nexercer o governo do estado de 5 a 24 de fevereiro. Em 1º de outubro\ndesse ano deixou a presidência da comissão executiva estadual da Arena.\n\nEm maio de 1970, foi escolhido pelo então presidente da República Emílio\nGarrastazu Médici (1969-1974) para compor, na condição de\nvice-governador, a chapa da Arena encabeçada pelo ex-deputado e ministro\ndo Superior Tribunal Militar (STM) Ernâni Sátiro. Eleito pela Assembléia\nLegislativa em 3 de outubro desse ano, encerrou seu mandato de deputado\nestadual em janeiro do ano seguinte, ao final da legislatura, e em 15 de\nmarço assumiu o cargo de vice-governador. Durante todo o período do\ngoverno de Ernâni Sátiro (1971-1975) esteve à frente do governo\nparaibano apenas em uma oportunidade, no dia 17 de fevereiro de 1972,\npor menos de 24 horas, para inaugurar o Grupo Escolar Capitulina Sátiro,\nmãe do governador.\n\nEm 1974 foi escolhido, na convenção do seu partido, para compor, como\nsuplente, a chapa para o Senado, encabeçada pelo ex-deputado estadual\nAluísio Campos. Na eleição de novembro desse ano foram derrotados pelos\ncandidatos do Movimento Democrático Brasileiro (MDB), Rui Carneiro,\neleito senador, tendo Ivandro Moura Cunha Lima como suplente.\n\nConcluindo seu mandato em março de 1975, com a ascensão de Ivan Bichara\n(1975-1978) ao governo do estado, em substituição a Ernâni Sátiro,\nClóvis Bezerra foi nomeado secretário de Saúde e, três dias depois,\ndiretor executivo da Fundação de Saúde do Estado da Paraíba (Fusepe).\nPermaneceu nos dois cargos até 29 de maio de 1978, quando se\ndesincompatibilizou por ter sido mais uma vez escolhido candidato a\nvice-governador na chapa da Arena. O convite foi feito pelo então\npresidente Ernesto Geisel (1974-1979). O candidato a governador era o\nsecretário de Educação da Paraíba, Tarcísio Buriti. Confirmados os dois\nnomes pela convenção do partido, no dia 1º de setembro foram eleitos\nindiretamente pelo Colégio Eleitoral formado pela Assembléia Legislativa\ne delegados do partido.\n\nBezerra assumiu o mandato em 15 de março de 1979 e exerceu o cargo de\nvice-governador até maio de 1982, quando, com a renúncia de Tarcísio\nBuriti para concorrer a uma cadeira de deputado federal, foi efetivado\nno governo do estado. Procurou dar continuidade a todas as obras\niniciadas pelo antecessor e construiu em tempo recorde, na BR-230, a\nsede da Sociedade Anônima de Eletrificação da Paraíba (Saelpa),\nconcessionária de distribuição de energia no estado. Conseguiu uma\neconomia significativa aos cofres estaduais com a devolução de diversos\nprédios alugados em vários pontos de João Pessoa e prosseguiu os\ntrabalhos de ampliação do Aeroporto Castro Pinto na capital do estado.\n\nPermaneceu à frente do Executivo estadual até 15 de março de 1983,\nquando assumiu o governador Wilson Braga, eleito no pleito de novembro\ndo ano anterior. Não voltou a concorrer a qualquer cargo eletivo.\n\nClóvis Bezerra faleceu em João Pessoa, no dia 26 de fevereiro de 2003.\n\nEra casado com Maria de Lurdes Ataíde Bezerra Cavalcanti, com quem teve\ntrês filhos, um dos quais, Afrânio Bezerra Cavalcanti, foi deputado\nestadual na Paraíba de 1979 a 1995.\n\nAlan Carneiro\n\nFONTES: ASSEMB. LEGISL. PB.; CURRIC. BIOG.; INF. FAM. AFRÂNIO BEZERRA;\nTRIB. SUP. ELEIT. *Dados* (1, 2, 3, 4, 6, 8 e 11);\ngeraldofreire.uol.com.br/conteudoPrimeirapagina2802.2.htm\n\n \n\n \n","ref":"FONTES: ASSEMB. LEGISL. PB.; CURRIC. BIOG.; INF. FAM. AFRÂNIO BEZERRA;\nTRIB. SUP. ELEIT. *Dados* (1, 2, 3, 4, 6, 8 e 11);\ngeraldofreire.uol.com.br/conteudoPrimeirapagina2802.2.htm\n\n \n\n \n","dic":"DHBB"}
