{"title":"BEZERRA, Fernando -----------------","cargoss":["Senador","Presidente de associação ou confederação de empregados ou empregadores"],"cargos_esp":[0,"CNI"],"datas_ini":[1995,1995],"datas_fim":[0,1998],"estados":["RN",0],"autor":[0],"content":"BEZERRA, Fernando\n-----------------\n\n\\* sen. RN 1995-  ; pres. CNI 1995-1998.\n\n \n\n*                Fernando Luís Gonçalves Bezerra*nasceu em Santa Cruz\n(RN) no dia 20 de fevereiro de 1941, filho de João Bianor Bezerra e de\nHermila Gonçalves Bezerra.\n\nCursou a Escola de Engenharia da Universidade Federal do Rio Grande do\nNorte (UFRN), onde em 1963 foi vice-presidente do diretório acadêmico\nFerro Cardoso. Em 1965 tornou-se vice-presidente do diretório central\ndos estudantes da UFRN, época em que se formou engenheiro civil. No ano\nseguinte foi para os Estados Unidos, onde fez pós-graduação em\nengenharia econômica e administração de negócios na Universidade de\nUtah.\n\n                De volta ao Brasil, em 1966 ingressou como engenheiro no\nDepartamento de Estradas de Rodagem (DER) do Rio Grande do Norte. No ano\nseguinte, assumiu a direção-geral do DER, cargo que acumulou com a\nchefia da Divisão de Planejamento do órgão, onde ficaria até 1971. Ainda\nem 1967 tornou-se membro do Conselho Rodoviário estadual e, no ano\nseguinte, assumiu a presidência do Clube de Engenharia de seu estado.\n\n                Foi responsável técnico por projetos e obras executados\npela Ecocil - Empresa de Construções Civis Ltda., empresa de sua\npropriedade, a partir de 1971, no Rio Grande do Norte, no Distrito\nFederal, em Pernambuco, na Paraíba, no Ceará, no Rio de Janeiro, em São\nPaulo, em Goiás e em Alagoas.\n\n                Em 1979 foi eleito presidente da Federação das\nIndústrias do Estado do Rio Grande do Norte, cargo que ocuparia até\n1994, e que acumulou com a presidência dos conselhos regionais do\nServiço Social da Indústria (Sesi) e do Serviço Nacional de Aprendizagem\nIndustrial (Senai), além de participar do Conselho Superior do Instituto\nEuvaldo Lódi, da Confederação Nacional da Indústria. Em\n1980**,**tornou-se****diretor e primeiro-tesoureiro da Confederação\nNacional da Indústria (CNI), funções que desempenharia até\n1995**.**No****período 1981-1990**,** foi ainda membro do Conselho de\nAdministração do Banco do Nordeste do Brasil (BNB), representando as\nclasses empresariais da região. \n\n                Em outubro de 1990, elegeu-se suplente de senador pelo\nRio Grande do Norte na legenda do Partido do Movimento Democrático\nBrasileiro (PMDB), na chapa que teve como titular Garibaldi Alves\nFilho**.**Em****janeiro de 1995 assumiu o mandato, em virtude de\nGaribaldi ter sido empossado no governo do estado**.** No Senado, foi\nmembro titular da Comissão de Assuntos Econômicos e da Comissão de\nServiços de Infra-estrutura, e suplente da Comissão de Assuntos Sociais\ne da Comissão de Relações Exteriores e Defesa Nacional.\n\n                Entre maio de 1995 e junho de 1996 participou\nintensamente dos trabalhos da Comissão de Assuntos Econômicos, tendo\nsido relator do projeto de lei sobre propriedade industrial, a chamada\nLei de Patentes. Bezerra esteve no centro dos debates sobre o assunto,\npor ter proposto alterações ao projeto do senador paraibano Nei Suassuna\n(PMDB), aprovado na Comissão de Constituição e Justiça. As alterações\npropostas por Bezerra no substitutivo incluíam o *pipeline*, um\nmecanismo de patenteamento retroativo para produtos farmacêuticos,\nalimentícios e de química fina, que, até então, não eram patenteados no\nBrasil. Dessa forma, evitavam-se retaliações comerciais por parte do\ngoverno norte-americano. Em contrapartida, o substitutivo foi alvo de\nprotestos dos representantes da Associação dos Laboratórios\nFarmacêuticos Nacionais (Alanac) e do representante da Associação\nBrasileira de Química Fina (Abifina), que advertiram que a adoção do\n*pipeline* traria prejuízos financeiros e provocaria o fechamento de\nindústrias do ramo. Depois de passar por todos os trâmites, o\nsubstitutivo, apoiado pelo governo, foi aprovado em votação simbólica no\nSenado.\n\n                No segundo semestre de 1995 Bezerra lançou sua\ncandidatura à presidência da CNI. Entre os compromissos assumidos na\ncampanha, ressaltou a disposição de ampliar a participação da entidade\nna discussão sobre as reformas no Congresso, enfatizando a necessidade\nde uma reforma tributária urgente. Eleito para o período 1995-1998,\ntomou posse em outubro de 1995, substituindo Mário Amato. Na ocasião,\nassumiu o compromisso de lutar pelo aumento da representatividade da\nCNI, buscando tornar-se, enquanto presidente da entidade, um\ninterlocutor junto ao governo federal na formulação de políticas ligadas\nà atividade industrial. Por força do cargo, assumiu também a presidência\ndo Conselho Nacional do Senai e do Departamento Nacional do Sesi, assim\ncomo a presidência do Conselho Superior do Instituto Euvaldo Lódi.\n\n                Em maio de 1996 reuniu cerca de 2.500 empresários em\nBrasília para entregar ao presidente da República o documento intitulado\n“Brasil indústria, competitividade para crescer”, que reunia as\nprincipais reivindicações dos empresários. Em declaração à imprensa,\nBezerra posicionou-se favoravelmente ao plano de estabilização econômica\ndo governo Fernando Henrique Cardoso - o Plano Real -, mas reclamou do\ngoverno maior empenho para promover uma queda mais vigorosa nas taxas de\njuros, em benefício das empresas nacionais.\n\n                No mês de maio de 1998 afastou-se de suas atividades\ncomo presidente da CNI para dedicar-se à sua campanha para a reeleição\nao Senado. Foi substituído no cargo por João Artur Donato. Em outubro de\n1998, reelegeu-se senador pelo PMDB, tendo iniciado o novo mandato em\nfevereiro do ano seguinte.\n\n                Empresário do setor da construção civil em Natal,\ntornou-se proprietário de um *shopping center* na capital potiguar e,\ntambém, de uma firma mineradora de xilita (tungstênio) e de outra\nexploradora de ouro.\n\n                Casou-se com Cândida Maria de Araújo Bezerra, com quem\nteve quatro filhos.\n\n \n\nLibânia Xavier\n==============\n\n \n\nFONTES: *Estado de São Paulo* (29/5, 8/6, 1 e 10/10/95, 19/5/96,\n27/5/98);*Globo* (30/5/95);*Jornal do Brasil* (1/3 e 19/10/96).\n","ref":"FONTES: *Estado de São Paulo* (29/5, 8/6, 1 e 10/10/95, 19/5/96,\n27/5/98);*Globo* (30/5/95);*Jornal do Brasil* (1/3 e 19/10/96).\n","dic":"DHBB"}
