{"title":"ALBERTO, Álvaro","cargoss":["Presidente de associação ou confederação de empregados ou empregadores"],"cargos_esp":["CNPq"],"datas_ini":[1951],"datas_fim":[1955],"estados":[0],"autor":[0],"content":"**ALBERTO, Álvaro**\n\n\\*militar; pres. CNPq 1951-1955.\n\n \n\n*Álvaro Alberto da Mota e Silva*nasceu no Rio de Janeiro, então capital\ndo Império, em 22 de abril de 1889, filho do professor Álvaro Alberto da\nSilva e de Maria Teixeira da Mota e Silva. Sua irmã, Armanda Álvaro\nAlberto, educadora, foi responsável pela introdução de novos métodos de\nensino no país e, em 1935, exerceu a presidência da União Feminina do\nBrasil, movimento filiado à Aliança Nacional Libertadora (ANL).\n\nÁlvaro Alberto recebeu a educação primária e secundária na casa de seus\npais. No período de 1906 a 1910, cursou a Escola Naval, tornando-se\nguarda-marinha em 1909. Ingressou em seguida na Escola Politécnica do\nRio de Janeiro, onde se diplomou engenheiro, completando posteriormente\nseus estudos na École Centrale Technique, em Bruxelas.\n\nPromovido a segundo-tenente em janeiro de 1910, tomou parte, em novembro\ndesse ano, na repressão à Revolta da Chibata, liderada pelo marinheiro\nJoão Cândido em protesto contra a utilização de castigos corporais nos\nnavios da Armada e reivindicando melhoria de vencimentos para a\nmarujada. Depois de receber a patente de primeiro-tenente em março de\n1914, Álvaro Alberto permaneceu junto à Esquadra por mais dois anos,\ntendo servido no navio-escola *Benjamim Constant,*na Escola Modelo de\nAprendizes-Marinheiros, situada no Rio Grande do Norte, nos encouraçados\n*Deodoro, Floriano*e*Minas Gerais,*no cruzador *Rio Grande do Sul*e no\ndestróier *Alagoas.*\n\nEm 1916 foi indicado para integrar o corpo docente da Escola Naval,\ntornando-se instrutor e depois catedrático do Departamento\nFísico-Químico desse estabelecimento, lecionando pólvora e explosivos,\nquímica e noções de metalurgia. Em 1919, enviado para servir em Angra\ndos Reis (RJ), começou a colaborar com os trabalhos pedagógicos\niniciados por sua irmã nessa localidade, que resultaram na criação, em\n1921, da Escola Proletária de Meriti — depois denominada Escola Regional\nde Meriti. Situada em território de Nova Iguaçu (RJ) que hoje pertence\nao município de Duque de Caxias, a escola utilizava métodos modernos de\nensino e era voltada para atender à população pobre.\n\nÁlvaro Alberto foi presidente da Sociedade Brasileira de Química de 1920\na 1928. Nesse período, integrou a delegação que representou o Brasil nas\ncomemorações do centenário da Independência do México em agosto de 1921,\nsendo promovido a capitão-tenente três meses depois. De 1924 a 1936, foi\ndelegado brasileiro na Union Internationale de Chimie Pure et Appliquée,\ncom sede em Paris. Promovido a capitão-de-corveta em 5 de julho de 1932,\nlecionou na Escola Técnica do Exército entre 1935 e 1937, período em que\nganhou a patente de capitão-de-fragata. Durante a Segunda Guerra\nMundial, desenvolveu um método para a fabricação dos estabilizantes\nquímicos contralite e acordite, até então dominada exclusivamente pelos\nalemães.\n\n \n\nÁlvaro Alberto e a política nuclear brasileira\n\n \n\nEstudioso das questões relativas à utilização da energia nuclear e de\nsuas implicações sobre as relações internacionais, depois da Segunda\nGuerra Mundial, Álvaro Alberto formulou sua tese das “compensações\nespecíficas”, defendendo que os países possuidores de matérias-primas\nnucleares não deveriam negociá-las apenas em troca de compensações\nfinanceiras, devendo exigir o fornecimento de reatores e outras\ninstalações atômicas, além do acesso à tecnologia necessária à sua\nfabricação e manejo.\n\nRepresentante brasileiro na Comissão de Energia Atômica da Organização\ndas Nações Unidas (ONU), seu nome foi indicado por unanimidade para a\npresidência desse organismo no biênio 1946-1947. No ano seguinte, de\nvolta ao Brasil, recebeu do Congresso Nacional o posto honorário de\ncontra-almirante e assumiu a chefia da comissão incumbida pelo\npresidente da República, Eurico Gaspar Dutra, de elaborar um anteprojeto\npara a criação do Conselho Nacional de Pesquisas (CNPq), incorporando a\nprodução científica à área de controle do Estado. Apresentado como um\n“estado-maior da ciência, da técnica e da indústria”, “capaz de traçar\nrumos seguros aos trabalhos de pesquisas científicas e tecnológicas no\npaís, desenvolvendo-os e coordenando-os de modo sistemático”, o CNPq\nteve sua formação aprovada pelo Parlamento e sancionada em 1951 pelo\npresidente Getúlio Vargas. Sua criação esteve desde o início\nexplicitamente relacionada com o desenvolvimento de pesquisas na área da\nenergia nuclear, considerada “imperativo da segurança nacional” e\nsujeita ao monopólio estatal. Por outro lado, a tese das “compensações\nespecíficas” foi aceita oficialmente pelo governo brasileiro e passou a\norientar toda a política de exportações de minérios atômicos do país.\n\nNomeado para presidir o novo órgão diretamente subordinado à Presidência\nda República, Álvaro Alberto desenvolveu uma ativa campanha de defesa da\nnacionalização de todas as minas de tório e urânio, minerais radioativos\nde uso mais freqüente na produção de energia nuclear. Esse conjunto de\norientações, definido em pleno curso da guerra fria, contrariava\nfrontalmente a política norte-americana de concentração dos recursos\nestratégicos do bloco ocidental nos Estados Unidos. Esse país, alertado\npela explosão da primeira bomba atômica da União Soviética em 1949 e a\neclosão da guerra da Coréia em junho de 1950, endureceu suas posições,\ndeclarando Álvaro Alberto *persona non grata*e apelando para que a\nOrganização dos Estados Americanos intercedesse junto ao Brasil.\n\nEssas pressões obtiveram resultados, com a criação, em fevereiro de\n1952, da Comissão de Exportação de Materiais Estratégicos (CEME) que,\nvinculada ao Ministério das Relações Exteriores, absorveu as atribuições\ndo CNPq em relação à venda de urânio, tório e seus compostos,\ncontornando assim o bloqueio desse órgão a operações deste tipo sem que\nocorressem “compensações específicas”. Com efeito, essa transferência de\nresponsabilidades — realizada durante uma viagem de Álvaro Alberto aos\nEstados Unidos, interinamente substituído pelo coronel Armando Dubois\nFerreira — criou as condições para a assinatura de um acordo de\nexportação de minerais atômicos sem que fossem observadas as exigências\ndefendidas pelo titular do CNPq, sob a alegação de que aqueles materiais\neram imprescindíveis para o esforço de guerra desenvolvido pelos Estados\nUnidos na Coréia. Mais tarde, comentou-se ter sido essa a solução\nconciliatória encontrada para evitar o envio de tropas brasileiras ao\nteatro da guerra, solicitado pelos norte-americanos.\n\nO Conselho de Segurança Nacional só tomou conhecimento desse acordo sete\nmeses depois de sua assinatura, que implicava o fornecimento pelo\nBrasil, no período de três anos, de um total de 7.500 toneladas de\nmonazita, além de igual quantidade de minerais conhecidos como\nterras-raras, especialmente sais de cério. Pouco depois do início das\nexportações oficiais, noticiou-se a existência de contrabando de grande\nquantidade de areias monazíticas de Guarapari (ES), o que levou à\naprovação de medidas disciplinadoras pelo governo federal em 3 de julho\nde 1952.\n\nEm 12 de outubro desse ano, o CNPq definiu seu ponto de vista sobre\ncombustíveis nucleares, escolhendo o urânio enriquecido como\nmatéria-prima fundamental dos reatores atômicos a serem implantados no\nBrasil para fins de pesquisa e produção de energia. Em novembro de 1953,\no presidente Vargas aprovou a política de implantação da indústria\nnuclear no país. Diante das dificuldades existentes para o\nestabelecimento de uma colaboração nesse campo com os Estados Unidos,\nque não aceitavam as medidas nacionalistas adotadas pela Comissão de\nEnergia Atômica do Brasil, o governo buscou diversificar seus contatos\nno exterior.\n\nÁlvaro Alberto realizou entendimentos secretos com cientistas alemães,\nque resultaram na compra de três ultracentrifugadores destinados à\nprodução de urânio enriquecido e na formação de uma comissão de\ncientistas e industriais desse país para estudar a hipótese de\ndesenvolver no Brasil a fabricação desses aparelhos. Em gestão reservada\njunto ao presidente Vargas, Álvaro Alberto chegou a levantar 80 mil\ndólares para financiar esse projeto. Na mesma época, outra missão do\nCNPq, chefiada pelo químico Alexandre Girotto, conseguiu obter na França\ntecnologia e financiamento para a extração de urânio na região de Poços\nde Caldas (MG).\n\nNessa ocasião, as relações com os Estados Unidos no terreno de energia\nnuclear tornaram-se mais tensas porque, depois de receber as 7.500\ntoneladas de monazita no primeiro ano de vigência do acordo celebrado em\n1952, esse país desinteressou-se pela aquisição das terras-raras,\ndesdobramento previsto para os dois anos seguintes. Álvaro Alberto\nprotestou, invocando a “responsabilidade moral da outra parte\nsignatária”, e os dois governos reabriram o processo de negociações que\nresultou, por proposta do Departamento de Estado norte-americano, na\ntroca de mais cinco mil toneladas de monazita e igual quantidade de\nsulfato sódico e terras-raras brasileiras, a serem entregues em dois\nanos, por cem mil toneladas de trigo norte-americano, embarcadas\nimediatamente. A assinatura desse novo acordo foi feita no dia 20 de\nagosto de 1954, durante a grave crise política que levaria, dias depois,\nao suicídio do presidente Getúlio Vargas.\n\nO CNPq só tomou conhecimento da operação contratada no dia 3 de setembro\n— depois da posse de Café Filho na presidência da República — e,\nprotestando violentamente contra ela, propôs sua revogação, ao mesmo\ntempo que o governo norte-americano anunciava novamente que não se\ninteressava pela aquisição das terras-raras. Diante dos protestos\nbrasileiros, o Departamento de Estado fez nova proposta, que incluía a\nvenda de quinhentas mil toneladas de trigo norte-americano. Entretanto,\no produto chegou deteriorado ao Brasil, o que provocou enorme indignação\nno Congresso e na imprensa do país.\n\nEm fins de 1954, Álvaro Alberto pediu autorização ao governo brasileiro\npara importar os três ultracentrifugadores recém-concluídos,\nencomendados à Alemanha de maneira sigilosa. O Itamarati foi encarregado\nde coordenar a operação de transporte, mas o vazamento do segredo\nprovocou a mobilização, em menos de 12 horas, de forças militares\nnorte-americanas estacionadas na Alemanha, que impediram o embarque dos\naparelhos. Eles ficaram retidos até o fim da ocupação desse país pelas\nforças anglo-franco-americanas, em 1956.\n\nEm 2 de março de 1955, em pleno curso desses acontecimentos, que tiveram\nenorme repercussão no Brasil, Álvaro Alberto foi promovido a\nvice-almirante. No intenso debate parlamentar estabelecido em torno\ndesses fatos, surgiram denúncias sobre a interferência estrangeira nos\nnegócios internos do Brasil e as pressões para a assinatura de acordos\ncontrários aos interesses nacionais, além de acusações de que\nfuncionários do Estado teriam sido subornados. No auge dessas\ndiscussões, Álvaro Alberto demitiu-se da presidência do CNPq.\n\nOs ultracentrifugadores, depois de passarem longo tempo encaixotados,\nforam levados para o Instituto de Pesquisas Tecnológicas, em São Paulo,\nonde chegaram a produzir urânio puro. Depois, ficaram abandonados e\nforam emparedados em reforma ocorrida nas instalações desse centro. O\nprojeto de construção de usinas em Poços de Caldas também foi\nabandonado.\n\nInventor dos explosivos rupturita e alexandrinita e das tintas\nantivegetativas polivalentes, Álvaro Alberto introduziu no Brasil a\nanálise dimensional e foi presidente da Academia Brasileira de Ciências.\n\nFaleceu no Rio de Janeiro, no dia 31 de janeiro de 1976.\n\nEra casado com Teresa Otero Álvaro Alberto.\n\nPublicou *Racionalização das equações a* *“n” radicais quadrados sem\ntermos racionais.* (1916), *O problema das palavras e sua solução*\n*atual*(1939, 2v.), *A contribuição dos jesuítas* *para as ciências\nfísicas*(1940),*À margem da* *ciência*(1960-1972, 4v.), *Ciência e\ntecnologia*(1962) e*Notas e comunicações*(1962).\n\nA seu respeito, foi publicado no ano 2000 o ensaio biográfico *Álvaro\nAlberto*, de Elias dos Santos Bigio.\n\n \n\nFONTES: COUTINHO, A. *Brasil*;*Grande encic. Delta;*HIRSCHOWICZ, E.\n*Contemporâneos*;*Jornal do Brasil*(15/12/75, 1/2/76); VELHO SOBRINHO,\nJ. *Dicionário.*\n\n \n","ref":"FONTES: COUTINHO, A. *Brasil*;*Grande encic. Delta;*HIRSCHOWICZ, E.\n*Contemporâneos*;*Jornal do Brasil*(15/12/75, 1/2/76); VELHO SOBRINHO,\nJ. *Dicionário.*\n\n \n","dic":"DHBB"}
