{"title":"BINS, Alberto","cargoss":["Prefeito"],"cargos_esp":["Porto Alegre"],"datas_ini":[1928],"datas_fim":[1937],"estados":[0],"autor":[0],"content":"**BINS, Alberto**\n\n\\*pref. Porto Alegre 1928-1937.\n\n \n\n*Alberto Bins* nasceu em Porto Alegre no dia 2 de dezembro de 1869,\nfilho do alfaiate imigrante alemão Matias José Bins e de Elisa Sehl.\n\nFez os estudos secundários no Ginásio Nossa Senhora da Conceição, em São\nLeopoldo (RS). Em 1886 viajou com a família para a Alemanha, tendo\nrealizado ali e na Inglaterra cursos de aperfeiçoamento industrial. Com\na morte do pai, regressou ao Brasil no ano seguinte.\n\nNo início de 1888 associou-se a Miguel Friederichs para fundar a firma\nBins & Friederichs, que negociava com ferro bruto e materiais de\nconstrução, tendo anexo uma oficina de cantaria e mármores. Liquidada\nesta última em 1890, abandonou pouco depois o comércio para dedicar-se à\nindústria metalúrgica, adquirindo em 1893 o acervo da firma José Berta,\nfabricante dos cofres Berta, depois Fábrica Metalúrgica Berta, da qual\nfoi diretor-presidente.\n\nAinda em 1893, quando eclodiu a Revolução Federalista, apoiou Júlio de\nCastilhos, velho amigo de seu pai e então presidente do Rio Grande do\nSul. O conflito, que opôs os federalistas (maragatos) aos republicanos\ncastilhistas (chimangos), conflagrou o Rio Grande do Sul, Santa Catarina\ne o Paraná entre fevereiro de 1893 e agosto de 1895, terminando com a\nvitória dos republicanos. Nessa época, Alberto Bins recebeu de Júlio de\nCastilhos o título de major da Guarda Nacional, submetendo-se, durante\nparte de 1894, a um curso de treinamento militar prestado no Clube\nRepublicano.\n\nNomeado em 1908 conselheiro municipal de Porto Alegre, ocupou o cargo\naté 1913, elegendo-se em 1918 deputado estadual na legenda do Partido\nRepublicano Rio-Grandense (PRR). Reeleito sucessivamente, exerceu o\nmandato até 1923. Terminada a Revolução de 1923, foi eleito em outubro\ndo ano seguinte vice-intendente municipal de Porto Alegre.\nParalelamente, passou a dedicar-se à lavoura do arroz e tornou-se\npresidente da Associação Comercial de Porto Alegre, condição em que\norganizou em 1927, juntamente com vários outros teuto-brasileiros, o\nSindicato dos Plantadores de Arroz, mais tarde Instituto do Arroz do Rio\nGrande do Sul, convertendo-se no primeiro diretor do órgão. Ainda em\n1927 fundou, também com teuto-brasileiros, a Viação Aérea Rio-Grandense\n(Varig), primeira empresa aérea comercial a operar no país. Organizada\ncom participação do Condor Syndicat, sediado em Berlim, a Varig utilizou\ninicialmente hidroaviões para fazer a ligação entre Porto Alegre,\nPelotas e Rio Grande, principais portos do estado.\n\nDeixando a vice-intendência da capital gaúcha em outubro de 1928, nesse\nmesmo mês foi eleito intendente municipal. Tomou posse em seguida, em\nsubstituição a Otávio Rocha, e, após a revolução de outubro de 1930, no\nmês de dezembro, passou a ostentar o título de prefeito de Porto Alegre.\n\nFavorável à legislação e ao sistema trabalhistas caracterizados pelo\ncontrole governamental, introduzidos por Getúlio Vargas através do\nMinistério do Trabalho, em 1931 colaborou com Antônio Jacob Renner na\ncriação do Centro de Indústria Têxtil, implantado em Porto Alegre. No\nano seguinte integrou um grupo empenhado em fundar uma nova agremiação\npolítica, mas acabou por associar-se à iniciativa do interventor gaúcho\nJosé Antônio Flores da Cunha (1930-1935), que resultou na criação, em\nnovembro desse mesmo ano, do Partido Republicano Liberal (PRL). Em 1935\natuou ainda como comissário da Grande Exposição do Centenário\nFarroupilha.\n\nDurante sua gestão como administrador da capital gaúcha, empreendeu a\nmodernização da cidade, implantando o fornecimento de água potável\nexpandindo a rede de água encanada e de esgotos, alongando e\npavimentando ruas e triplicando a capacidade de geração de energia\nelétrica.\n\nApós o advento do Estado Novo em 10 de novembro de 1937, a que deu seu\napoio, deixou no dia 17 desse mesmo mês a prefeitura de Porto Alegre e\npassou a dedicar-se exclusivamente ao trabalho na direção da\nmetalúrgica, tentando recuperar os prejuízos impostos a seu patrimônio\npor força das atividades político-administrativas. O novo interventor\nfederal no Rio Grande do Sul, general Manuel de Cerqueira Daltro Filho,\no acusou de apoderar-se de fundos públicos. Bins devolveu o dinheiro\nreclamado, demonstrando em seguida sua inocência em *As contas do\nComissariado Geral da* *Exposição Farroupilha e a atuação do respectivo\ncomissário*(1938).\n\nPresidente honorário da Federação das Associações Comerciais do Rio\nGrande do Sul e do Centro de Indústria Fabril do Rio Grande do Sul, era\nproprietário da Granja e Plantação de Arroz Santa Clotilde, em Viamão\n(RS), e da Granja Progresso, tendo presidido também o conselho fiscal da\nVarig, empresa junto à qual atuou ainda como fiscal do governo gaúcho.\n\nFoi major da reserva.\n\nFaleceu em Porto Alegre no dia 20 de abril de 1957.\n\nEra casado com Clotilde Christoffel Bins, com que teve cinco filhos.\n\nAlém de folhetos referentes à administração municipal de Porto Alegre,\npublicou *A Exposição do Centenário Farroupilha* (1936).\n\n \n\n \n\nFONTES: *Álbum;* CORRESP. CONF. NAC. TRAB. TRANSP. MARÍTIMOS; FERREIRA\nFILHO, A. *História;*HIRSCHOWICZ, E. *Contemporâneos;*LOVE, J.\n*Regionalismo;* *Personalidades;*SOC. BRAS. EXPANSÃO COMERCIAL.\n*Quem;*SPALDING, V. *Construtores;*VELHO SOBRINHO, J. *Dic.*\n\n \n","ref":"FONTES: *Álbum;* CORRESP. CONF. NAC. TRAB. TRANSP. MARÍTIMOS; FERREIRA\nFILHO, A. *História;*HIRSCHOWICZ, E. *Contemporâneos;*LOVE, J.\n*Regionalismo;* *Personalidades;*SOC. BRAS. EXPANSÃO COMERCIAL.\n*Quem;*SPALDING, V. *Construtores;*VELHO SOBRINHO, J. *Dic.*\n\n \n","dic":"DHBB"}
