{"title":"BISCAIA, Antônio","cargoss":["Deputado federal"],"cargos_esp":[0],"datas_ini":[1956],"datas_fim":[1958],"estados":["PR"],"autor":[0],"content":"**BISCAIA, Antônio**\n\n\\*dep. fed. PR 1956-1958.\n\n \n\n*Antônio Chalbaud Biscaia* nasceu em Curitiba no dia 12 de junho de\n1909, filho de João dos Santos Biscaia e de Josefina Chalbaud Biscaia.\n\nEstudou no Colégio Júlio Teodorico e no Ginásio Paranaense,\nbacharelando-se pela Faculdade de Direito do Paraná em 1933.\n\nDirigiu a revista Paraná Judiciário a partir de 1942. Elegeu-se suplente\nde deputado à Assembléia Constituinte do Paraná no pleito de janeiro de\n1947 e à Assembléia Legislativa em outubro de 1950.\n\nProfessor de direito comercial na Faculdade de Direito da atual\nUniversidade Federal do Paraná (1952-1953) e professor titular da mesma\ndisciplina na Faculdade de Direito da Pontifícia Universidade Católica\ndo Paraná, a partir de 1952, nas eleições de outubro de 1954\ncandidatou-se a deputado federal pelo Paraná na legenda do Partido\nTrabalhista Brasileiro (PTB), obtendo novamente apenas uma suplência.\nContudo, assumiu a cadeira de abril de 1956 a junho de 1957, em\nsubstituição ao deputado Mário Gomes da Silva, e de julho de 1957 a\nagosto de 1958, quando foi membro da Comissão de Finanças da Câmara dos\nDeputados e presidente da Comissão Parlamentar de Inquérito (CPI) para\napurar as deficiências do sistema penitenciário do Distrito Federal.\n\nFoi promotor público nos municípios paranaenses de Carlópolis, Morretes,\nTomazina, Palmeira e Curitiba. Como advogado, atuou no Departamento de\nGeografia, Terras e Colonização do Paraná, tendo sido consultor e chefe\ndo departamento jurídico da Secretaria de Viação e Obras Públicas, e\nconsultor jurídico, chefe de gabinete e titular da Secretaria de\nAgricultura do Paraná. Foi membro e presidente substituto da Comissão de\nServiço Público do Paraná. Ocupou o cargo de procurador-geral do estado\nno período em que se efetuaram a organização e a classificação****do\nfuncionalismo público paranaense. Integrou também o quadro especial da\nConsultoria Geral do Estado do Paraná.\n\nEm 1964, tornou-se presidente da Caixa de Assistência dos Advogados da\nOrdem dos Advogados do Brasil, seção Paraná, cargo que ocuparia até a\nsua morte. No ano seguinte, tornou-se diretor jurídico do Fundo\nMunicipal de Telefones, como representante da classe dos advogados,\nexercendo o cargo até 1973.\n\nFaleceu em Curitiba no dia 4 de outubro de 1982.\n\nEra casado com Francisca Odete Castellano Biscaia, com quem teve cinco\nfilhos.\n\nTornou-se sócio efetivo do Centro de Letras do Paraná e da Associação\nParanaense de Letras. Foi presidente da Federação das Congregações\nMarianas do Paraná durante mais de dez anos.\n\n \n\nFONTES: CÂM. DEP. *Deputados*; CÂM. DEP. *Deputados brasileiros.\nRepertório* (1955-1959); NICOLAS, M. *Cem*.\n\n \n","ref":"FONTES: CÂM. DEP. *Deputados*; CÂM. DEP. *Deputados brasileiros.\nRepertório* (1955-1959); NICOLAS, M. *Cem*.\n\n \n","dic":"DHBB"}
