{"title":"BITTENCOURT, Alexínio","cargoss":["Presidente de associação ou confederação de empregados ou empregadores"],"cargos_esp":["CNP"],"datas_ini":[1956],"datas_fim":[1958],"estados":[0],"autor":[0],"content":"**BITTENCOURT, Alexínio**\n\n\\*militar; pres. CNP 1956-1958.\n\n \n\n*José Alexínio Bittencourt* nasceu no dia 17 de julho de 1905.\n\nSentou praça em março de 1923 e, depois de cursar a Escola Militar do\nRealengo, no Rio de Janeiro, então Distrito Federal, foi declarado\naspirante em janeiro de 1929. Em julho seguinte foi promovido a\nsegundo-tenente, em fevereiro de 1931 a primeiro-tenente e em outubro de\n1934 a capitão.\n\nNo ano de 1935, ocupava o comando de uma companhia de metralhadoras no\n3º Regimento de Infantaria (3º RI), sediado na Praia Vermelha, no Rio,\nquando irrompeu a Revolta Comunista promovida pela Aliança Nacional\nLibertadora (ANL). Deflagrado em Natal e em Recife nos dias 23 e 24 de\nnovembro e aí rapidamente debelado, o movimento eclodiu na madrugada do\ndia 27 no Rio de Janeiro, conflagrando o 3º RI e a Escola de Aviação\nMilitar do Campo dos Afonsos. Integrando a resistência legalista,\nAlexínio Bittencourt foi ferido logo no início dos combates, que\nterminaram no mesmo dia, após intenso bombardeio das tropas\ngovernamentais.\n\nEm setembro de 1944 foi promovido a major, em setembro de 1950 a\ntenente-coronel e em julho de 1954 atingiu o posto de coronel. Embora\nintegrasse a ala conservadora das forças armadas, participou, no início\nde 1955, do Movimento Militar Constitucionalista (MMC), articulada no\ninterior do Exército sob a liderança de seu irmão, o coronel José\nAlberto Bittencourt. O MMC tinha por objetivo criar condições para\ngarantir as eleições presidenciais em outubro desse ano e assegurar\nposteriormente a posse dos eleitos, ambas ameaçadas pela ação coordenada\nde setores militares e parlamentares — sobretudo da União Democrática\nNacional (UDN). Com a eleição de Juscelino Kubitschek para a presidência\nda República e sua posse em janeiro de 1956 — garantida pela vitória do\nmovimento militar de 11 de novembro de 1955, liderado pelo general\nHenrique Teixeira Lott — Alexínio Bittencourt foi nomeado presidente do\nConselho Nacional do Petróleo (CNP).\n\nExercia suas funções no CNP quando, em março de 1958, foi realizada a\nrevisão do tratado firmado****em 1938 entre o Brasil e a Bolívia para\nregulamentar a exploração do petróleo boliviano pelo Brasil. Dessa\nrevisão resultou a Ata de Roboré — documento composto de 29 notas\nreversais — que modificou o tratado anterior, vedando a participação das\nempresas estatais brasileiras na exploração do petróleo da Bolívia e\nreservando-a aos grupos privados. Essa nova orientação conferida à\npolítica do petróleo suscitou sérias divergências em amplos setores da\nvida nacional. Enquanto o presidente da Petrobras, coronel Janari Nunes,\nse opunha ao novo acordo, reivindicando a exclusividade na exploração\npara a empresa estatal, Alexínio Bittencourt defendeu os termos do\ntratado e formalizou suas críticas à posição de Janari Nunes em um\ndocumento que enviou ao presidente Kubitschek. O Relatório Alexínio —\ncomo se tornou conhecido — denunciava ainda a atuação “altamente\nentreguista” do presidente do Banco Nacional de Desenvolvimento\nEconômico (BNDE), Roberto Campos, que estaria condicionando a\ncolaboração desse órgão com o projeto Roboré à participação da firma\nestrangeira Pan American Land & Oil Co. Em vista dessas denúncias, foi\ninstaurada uma comissão parlamentar de inquérito que comprovou a\nprocedência das acusações, provocando a destituição do presidente do\nBNDE pelo chefe do governo.\n\nPor outro lado, a contradição entre as posições defendidas por Janari\nNunes e por Alexínio Bittencourt foi avaliada por uma comissão que deu\nparecer favorável à tese do presidente da Petrobras, amplamente apoiado\npor entidades de cunho nacionalista. No entanto, preferindo uma solução\nconciliatória para a questão, em fins de 1958 Juscelino Kubitschek\nexonerou ao mesmo tempo os presidentes da Petrobras e do CNP. Em 1963, o\ntratado para a exploração do petróleo boliviano voltaria a vigorar\nsegundo o texto original de 1938 e a Petrobras obteria a exclusividade\npara operar no exterior. A empresa, contudo, jamais iniciou qualquer\natividade de extração na Bolívia.\n\nApós sua saída do CNP, Alexínio Bittencourt integrou a Comissão do\nNordeste, constituída por elementos do Estado-Maior das Forças Armadas\n(EMFA) para o estudo e o planejamento de obras contra as secas com base\nnas conclusões da missão secreta desenvolvida pelo coronel Orlando\nRamagem. Essa comissão formulou o Relatório Ramagem — documento\ninteiramente identificado com a corrente nacionalista do Exército — que\nsomente foi divulgado em 1961, durante o governo de Jânio Quadros. A\npartir desse trabalho, intensificou-se a participação de militares na\nSuperintendência do Desenvolvimento do Nordeste (Sudene).\n\nAlexínio Bittencourt fez os cursos de infantaria e da Escola de Armas do\nEstado-Maior.\n\nFaleceu em 13 de maio de 1961.\n\nEra casado com Delza Fróis da Cruz Bittencourt.\n\n \n\nFONTES: BANDEIRA, L. *Presença*; BENEVIDES, M. *Governo Kubitschek*;\nMIN. GUERRA. *Almanaque* (1958); SILVA, H. *1935*.\n\n \n","ref":"FONTES: BANDEIRA, L. *Presença*; BENEVIDES, M. *Governo Kubitschek*;\nMIN. GUERRA. *Almanaque* (1958); SILVA, H. *1935*.\n\n \n","dic":"DHBB"}
