{"title":"BITTENCOURT, Macedo","cargoss":["Deputado federal"],"cargos_esp":[0],"datas_ini":[1935],"datas_fim":[1937],"estados":["SP"],"autor":[0],"content":"**BITTENCOURT, Macedo**\n\n\\*dep. fed. SP 1935-1937.\n\n \n\n*Heitor de Macedo Bittencourt* nasceu em Ribeirão Preto (SP) no dia 15\nde outubro de 1895, filho de Joaquim Macedo Bittencourt e de Amélia de\nMoura Bittencourt. Seu pai foi prefeito de Ribeirão Preto e ministro do\nTribunal de Contas do Estado de São Paulo.\n\nEstudou no Ginásio de Ribeirão Preto e bacharelou-se pela Faculdade de\nDireito de São Paulo.\n\nSempre em seu estado, foi inspetor federal do ginásio do estado em\nRibeirão Preto, delegado de polícia em Salesópolis, promotor público em\nApiaí e em Sertãozinho, então distrito do município de Ribeirão Preto.\n\nEm 14 de outubro de 1934, foi eleito deputado federal na legenda do\nPartido Republicano Paulista (PRP), exercendo o mandato de 3 de maio de\n1935 a 10 de novembro de 1937, quando o advento do Estado Novo suprimiu\nas câmaras legislativas do país.\n\nDeixando a vida política, fez carreira no Judiciário paulista,\naposentando-se como procurador do estado em agosto de 1960.\n\nFaleceu em São Paulo no dia 23 de julho de 1967.\n\nEra casado com Heloísa Maciel Bittencourt, com quem adotou três filhos.\n\nFoi autor de trabalhos jurídicos e artigos esparsos em jornais e\nrevistas.\n\n \n\nFONTES: *Boletim Min. Trab*. (5/36); CÂM. DEP. *Deputados*; *Diário do\nCongresso* *Nacional*; INF. FAM.; LEITE, A. *História*;\n*Personalidades*.\n\n \n","ref":"FONTES: *Boletim Min. Trab*. (5/36); CÂM. DEP. *Deputados*; *Diário do\nCongresso* *Nacional*; INF. FAM.; LEITE, A. *História*;\n*Personalidades*.\n\n \n","dic":"DHBB"}
