{"title":"BITTENCOURT, Randolfo =====================","cargoss":["Deputado federal"],"cargos_esp":[0],"datas_ini":[1983],"datas_fim":[1987],"estados":["AM"],"autor":[0],"content":"BITTENCOURT, Randolfo\n=====================\n\n\\* dep. fed. AM 1983-1987.\n\n \n\n*Randolfo de Sousa Bittencourt* nasceu em Manaus em 5 de dezembro de\n1938, filho de Sérgio Augusto Pará Bittencourt e de Adélia de Sousa\nBittencourt.\n\nCursou a Faculdade de Direito do Amazonas, pela qual se bacharelou em\nciências jurídicas e sociais em 1961. No ano seguinte, fez curso de\nespecialização em administração pública na Escola Brasileira de\nAdministração Pública (EBAP), da Fundação Getúlio Vargas, no Rio de\nJaneiro\n\nEm 1965 assumiu o cargo de procurador jurídico do Departamento de\nEstradas de Rodagem (DER) do Amazonas e o de secretário-executivo da\nComissão de Reforma Administrativa do estado. No ano seguinte, tornou-se\nprofessor da Escola de Serviço Público do Amazonas. Em 1967 assumiu a\ndiretoria administrativa do DER, função que ocupou até o ano seguinte.\nEm 1969 tornou-se integrante do Conselho Estadual de Cultura, no qual\npermaneceu até 1971.\n\nFez o curso de antropologia cultural na Universidade do Amazonas em\n1975. Dois anos depois tornou-se professor titular e vice-diretor da\nFaculdade de Estudos Sociais, em cuja função permaneceu até 1979. No ano\nseguinte deixou a função de professor da Escola de Serviço Público do\nAmazonas.\n\nIniciou a carreira política filiando-se ao Partido do Movimento\nDemocrático Brasileiro (PMDB) e elegendo-se deputado federal em 15 de\nnovembro de 1982. Foi titular da Comissão de Educação e Cultura e\nsuplente da Comissão do Interior, em 1983.\n\nAinda no início dessa legislatura, o deputado Dante de Oliveira\n(PMDB-MT) apresentou na Câmara um projeto de emenda constitucional\nrestabelecendo eleições diretas para a presidência da República  no ano\nseguinte. Encampado pelas oposições, esse projeto proporcionou o\ndesencadeamento de uma campanha nacional, conhecida como diretas-já. Em\nvotação realizada em 25 de abril de 1984, com voto favorável de\nRandolfo, por falta de 22 votos a emenda não foi aprovada, o que a\nimpediu de ser enviada para apreciação do Senado.\n\nCom esse resultado, o próximo presidente da República que substituiria\nJoão Figueiredo (1979-1985) seria eleito por via indireta. Para\nconcorrer com os candidatos governistas Paulo Maluf e Flávio Marcílio\n(vice), os partidos de oposição, com exceção do Partido dos\nTrabalhadores (PT), liderados pelo PMDB, e a Frente Liberal, dissidência\nda agremiação governista, o Partido Democrático Social (PDS), reunidos\nna Aliança Democrática, lançaram o governador de Minas Gerais, Tancredo\nNeves, e o senador maranhense José Sarney. Na eleição realizada no\nColégio Eleitoral em 15 de janeiro de 1985, com voto favorável de\nRandolfo, a vitória coube aos candidatos oposicionistas. A doença do\npresidente eleito na véspera da posse fez com que o vice assumisse, em\ncaráter interino, em 15 de março desse ano, sendo efetivado no mês\nseguinte, após a morte do titular.\n\nEm fevereiro de 1986 Randolfo licenciou-se para assumir a Secretaria de\nEducação e Cultura no governo de Gilberto Mestrinho (1983-1987). Foi\nsubstituído pelo suplente Arlindo Augusto dos Santos Porto. Permaneceu\nna secretaria até maio seguinte, quando se desincompatibilizou para\nconcorrer à reeleição e em seguida reassumiu sua cadeira na Câmara.\n\nEm 15 de novembro de 1986, conseguiu apenas uma suplência para a\nAssembléia Nacional Constituinte. Desligou-se do partido e retornou às\nsuas atividades na Universidade do Amazonas. Não mais concorreu a\nqualquer cargo público eletivo. Posteriormente, tornou-se presidente de\numa organização não-governamental (ONG) suprapartidária denominada Fórum\nBrasil Século 21.\n\nCasou-se com Olinda Maria Gonçalves Bittencourt, com quem teve quatro\nfilhos.\n\nPublicou*A* *formação profissional do administrador*(1974); *Recursos\nhumanos e mercado de trabalho*(1974);*Teoria e técnica de relações\npúblicas*(1976).\n\n* *\n\nFONTES: CÂM. DEP. *Deputados brasileiros. Repertório*(1983-1987);\n*Globo*(26/4/84, 16/1/85); INF. BIOG.\n","ref":"FONTES: CÂM. DEP. *Deputados brasileiros. Repertório*(1983-1987);\n*Globo*(26/4/84, 16/1/85); INF. BIOG.\n","dic":"DHBB"}
