{"title":"BLAY, Eva =========","cargoss":["Senador","Senador"],"cargos_esp":[0,0],"datas_ini":[1995,1992],"datas_fim":[1995,1994],"estados":["SP","SP"],"autor":[0],"content":"BLAY, Eva\n=========\n\n\\* sen. SP 1992-1994 e 1995.\n\n \n\n                *Eva Alterman Blay* nasceu na cidade de São Paulo no dia\n4 de junho de 1937, filha de Moyses Lejb Alterman e de Eta Reaboi\nAlterman.\n\n                Bacharel em sociologia pela Universidade de São Paulo\n(USP), integrou o quadro docente da sua faculdade de filosofia, letras e\nciências humanas, em 1961, obtendo os títulos de mestrado, em 1969,\ndoutorado, em 1973, e livre-docência, em 1985.\n\n                Voltada para o estudo das condições de vida das\nmulheres, subsidiou as atividades de sindicatos, associações de direitos\ncivis e, sobretudo, entidades feministas. Como presidente do Conselho\nEstadual da Condição Feminina de São Paulo, no governo Franco Montoro\n(1983-1987), criou a primeira Delegacia de Defesa da Mulher do país.\n\n                Filiada ao Partido do Movimento Democrático Brasileiro\n(PMDB), elegeu-se suplente do Fernando Henrique Cardoso, em 1986. Dois\nanos depois, participou da fundação do Partido da Social Democracia\nBrasileira (PSDB), criado a partir de uma dissidência do PMDB.\n\n                Em 1992, esteve em Viena, na Áustria, realizando\ntrabalho para a Organização das Nações Unidas (ONU) sobre a condição de\nvida das mulheres em diversos países. Em outubro deste ano, com a\nnomeação do senador Fernando Henrique Cardoso para o Ministério das\nRelações Exteriores do governo Itamar Franco (1992-1994), Eva Blay tomou\nposse no Senado.\n\nNo Parlamento procurou destacar os altos índices de mortalidade feminina\ndurante os períodos de gravidez, parto e pós-parto, e defendeu a\ndestinação de mais recursos públicos para o combate a essa realidade.\nApresentou projeto de lei dispondo sobre a descriminalização do aborto,\nsegundo o qual a interrupção da gravidez seria de livre decisão da\ngestante até a 12ª semana de gestação, prevendo-se ainda essa\npossibilidade até a 25ª semana no caso de comprovação de patologia que\ncomprometesse a saúde física ou mental da gestante, ou ainda a qualquer\nmomento da gravidez, em caso de risco de vida para a mulher. Segundo Eva\nBlay, a prática do aborto deveria ser tratada como uma questão de foro\níntimo da mulher, e sua descriminalização, na realidade, apenas\nlegalizaria uma situação de fato vigente no país. Ainda de acordo com a\nsenadora, essa realidade deveria ser encarada pelo Estado como um\nproblema de saúde pública. Duramente criticado e combatido por entidades\ncontrárias ao aborto, em especial o segmento dito carismático da Igreja\nCatólica, seu projeto não chegou a ser apreciado pelo Senado.  \n\n                O que dizia respeito à adoção do planejamento familiar\nteve melhor sorte, e foi aprovado por unanimidade, determinando a\nesterilização voluntária da mulher através de métodos aprovados pelo\nMinistério da Saúde, bem como a garantia de plena informação a todos\nsobre os métodos conceptivos e anticonceptivos.\n\n                Devido ao retorno de Fernando Henrique ao Congresso,\ndeixou o Senado em abril de 1994, disputando em outubro, pelo PSDB\npaulista, uma vaga na Câmara Federal. Sem obter êxito, regressou ao\nSenado em virtude da posse do titular na presidência da República,\nexercendo o mandato de 1º a 31 de janeiro de 1995, quando se encerrou a\nlegislatura.\n\n                De volta à atividade docente na USP escreveu para\nrevistas acadêmicas e participou de conferências no Brasil e no exterior\nsobre a condição feminina. Em 1996 concluiu curso de pós-doutorado em\nciências sociais na École de Hautes  Études en Sciences Sociales, em\nParis.\n\n                Casada com Júlio Blay, teve dois filhos.\n\n                Publicou *Trabalho domesticado: a mulher na indústria\npaulista*(1978);*As prefeitas* (1981); *A luta pelo espaço* (1985);\n*Immigrazione europea e borghi operai a San Paolo* (1987); *Perfil da\nmulher brasileira* (1990); *Gênero e universidade* (1992).\n\n \n\nFONTES: *Dia* (20/10/92); *Estado de São Paulo*(17/1, 9/5 e 28/8/94); \n*Folha de São Paulo* (25/3 e 5/7/94); INF. BIOG.\n\n \n","ref":"FONTES: *Dia* (20/10/92); *Estado de São Paulo*(17/1, 9/5 e 28/8/94); \n*Folha de São Paulo* (25/3 e 5/7/94); INF. BIOG.\n\n \n","dic":"DHBB"}
