{"title":"BOAVENTURA, Sinval ==================","cargoss":["Deputado federal"],"cargos_esp":[0],"datas_ini":[1967],"datas_fim":[1978],"estados":["MG"],"autor":[0],"content":"BOAVENTURA, Sinval\n==================\n\n\\* dep. fed. MG 1967-1978.\n\n* *\n\n*Sinval Boaventura*****nasceu em Rio Paranaíba (MG), então distrito de\nSão Gotardo, no dia 12 de julho de 1923, filho do proprietário rural\nVigilato Gonçalves Boaventura e de Maria do Amor Divino Rocha.\n\nRealizou o curso secundário no Ginásio São Geraldo, em sua cidade natal.\nEm 1947, nomeado pelo governador Milton Campos (1947-1951), assumiu a\nprefeitura de Rio Paranaíba. Filiado à União Democrática Nacional (UDN),\nfoi reconduzido ao cargo em outubro de 1950, desta vez eleito\ndiretamente. Encerrou o seu mandato em 1954 e, quatro anos depois,\ntornou-se delegado de polícia em Arapuá (MG), função que exerceu até\n1959.\n\nProprietário agrícola em Minas e Goiás, participou do processo de\nconstrução da nova capital do país, Brasília, montando uma firma que\nalugava tratores e máquinas às empreiteiras. De volta a Minas Gerais,\nelegeu-se deputado estadual pela UDN no pleito de outubro de 1962,\nassumindo o mandato em fevereiro seguinte.\n\nCom a extinção dos partidos políticos pelo Ato Institucional n^o^ 2\n(AI-2), de outubro de 1965, e a conseqüente instauração do\nbipartidarismo, filiou-se à Aliança Renovadora Nacional (Arena), partido\nde apoio ao regime militar instalado após o golpe a deposição do\npresidente João Goulart (31/3/1964). Como deputado estadual, presidiu a\nComissão de Transportes, Comunicações e Obras Públicas da Assembléia\nmineira e integrou as comissões de Finanças e Orçamento e Tomada de\nContas, de Assuntos Municipais e Interestaduais e de Segurança Pública.\n\nEm novembro de 1966, elegeu-se deputado federal por Minas Gerais pela\nlegenda da Arena, iniciando o mandato em fevereiro de 1967, após deixar\na Assembléia mineira. Reeleito em novembro de 1970, pela mesma legenda,\nintegrou durante a nova legislatura as comissões de Transportes,\nComunicações e Obras Públicas, Especial para Integração dos Povos da\nComunidade de Língua Portuguesa e de Segurança Nacional da Câmara, tendo\nsido ainda suplente da Comissão de Agricultura e Política Rural. Foi\ndelegado à I Conferência de Reforma Agrária e Colonização da América\nLatina, realizada em 1972 na Colômbia.\n\nEm novembro de 1974, já no governo do general Ernesto Geisel\n(1974-1979), voltou a eleger-se deputado federal por Minas Gerais,\nsempre pela legenda arenista, tornando-se presidente da Comissão de\nSegurança Nacional e permanecendo como suplente na Comissão de\nAgricultura e Política Rural. Seu terceiro mandato foi marcado por\npronunciamentos no plenário da Câmara que receberam grande cobertura da\nimprensa. Em outubro de 1976, acusou o ministro da Indústria e Comércio,\nSevero Gomes, de ter tendências “socialistas e estatizantes”, contrárias\naos “objetivos permanentes da Revolução de 1964”, e de fazer, juntamente\ncom o senador Roberto Saturnino Braga, do partido oposicionista\nMovimento Democrático Brasileiro (MDB), o jogo das esquerdas. Suas\ncríticas estenderam-se ao ministro das Relações Exteriores, Antônio\nAzeredo da Silveira, que estaria imprimindo à política externa\nbrasileira certa independência face aos Estados Unidos.\n\nEm dezembro de 1976, deixou clara sua discordância em relação à\norientação política do governo Geisel e da direção da Arena, fazendo\npronunciamentos que o levaram a ser considerado como um dos principais\nporta-vozes dos grupos políticos e militares contrários ao processo de\nliberalização institucional em curso no país. Apesar das evidências,\ndesmentiu manter qualquer ligação com setores militares descontentes,\nespecialmente com o ministro do Exército, general Sílvio Frota, tido\ncomo um dos líderes da ala radical de direita das forças armadas. Como\nreflexo de suas críticas ao governo, foi afastado, em março de 1977, da\nComissão de Segurança Nacional pelo líder da Arena na Câmara, deputado\nJosé Bonifácio, passando a integrar a Comissão de Fiscalização\nFinanceira e Tomada de Contas.\n\nNo final de maio, seu nome voltou aos jornais. Na ocasião, acusava o\ndeputado federal Marcos Tito, do MDB mineiro, de ter lido no plenário da\nCâmara, no dia 24 daquele mês, um discurso que utilizava trechos de um\nmanifesto publicado no jornal *A Voz Operária,*órgão do proscrito\nPartido Comunista Brasileiro (PCB). Ainda em maio, afirmou que o país\nvivia um clima político semelhante ao de 1968, que levara à edição do\nAto Institucional n^o^ 5 (AI-5), e acusou “uma parte do MDB” de\n“radicalizar posições, imaginando ter condições de derrubar o regime”.\nEm 14 de junho, o presidente Geisel, lançando mão do AI-5, cassou o\nmandato do deputado Marcos Tito e suspendeu seus direitos políticos por\ndez anos.\n\nEm entrevista concedida em junho de 1977 ao semanário *Isto* *É*,\nBoaventura admitiu estar apoiando a candidatura do general Sílvio Frota\nà sucessão de Geisel, tema que vinha sendo discutido no Congresso apesar\nda oposição da direção nacional da Arena, que julgava o debate\nprematuro. Em agosto seguinte, referindo-se à questão sucessória,\ndeclarou que se sujeitaria às deliberações da Arena, mas manifestou-se\ncontrário à aventada candidatura do general Dilermano Monteiro,\ncomandante do II Exército, sediado em São Paulo, por julgá-lo\ncomplacente com as esquerdas. No mesmo mês, criticou a proposta da\noposição de se restaurar o estado de direito no país através da\nconvocação de uma Assembléia Nacional Constituinte. Sinval não admitia a\nrevogação, mesmo parcial, do AI-5. Ainda em agosto, Sinval Boaventura\nfoi objeto de denúncia apresentada à comissão parlamentar de inquérito\nque investigava irregularidades no sistema fundiário do país. Era\nacusado pelo deputado estadual Alziro Gomes, da Arena goiana, de\npraticar a grilagem em****terras do norte de Goiás, usando de violência\npara expulsar cerca de duzentas famílias de posseiros.\n\nVoltando ao tema da sucessão presidencial, Boaventura informou, em\nsetembro, que havia na Câmara cerca de 40 deputados arenistas favoráveis\nà candidatura Sílvio Frota, entre os quais José Wilson Siqueira Campos,\nde Goiás, Alexandre Machado, do Rio Grande do Sul, Sílvio****Venturoli,\nde São Paulo, e Carlos Alberto de Oliveira, de Pernambuco. No início de\noutubro, os parlamentares integrantes do chamado esquema “frotista”\nreuniram-se com o general da reserva Jaime Portela, ex-chefe do Gabinete\nMilitar no governo marechal Artur da Costa e Silva (1967-1969) e\nencarregado de estabelecer ligações entre militares e políticos no\nsentido de fortalecer a candidatura Frota. Ficou estabelecido na reunião\nque os deputados se revezariam na tribuna da Câmara em sucessivos\ndiscursos destinados a manter vivo o nome de Frota para a sucessão\npresidencial. No dia 12 de outubro, culminando uma série de atritos e\ndiscordâncias entre o ministro do Exército e o presidente da República,\nFrota foi demitido do cargo. Boaventura acatou publicamente a decisão de\nGeisel e daí em diante passou a defender a antecipação da eleição\npresidencial indireta de 15 de outubro para 15 de março de 1978 a fim de\nque o futuro presidente pudesse mais rapidamente promover a reforma\npolítica e a instauração do pluripartidarismo, questões que vinham sendo\ndebatidas no Congresso.\n\nApós um encontro com o general Golberi do Couto e Silva, considerado o\nideólogo e a “eminência parda” do regime, anunciou, em maio de 1978, que\nnão concorreria à reeleição em novembro seguinte, esclarecendo que sua\ndecisão de deixar a política não tinha qualquer relação com o “caso\nFrota” e que naquele momento apoiava o candidato oficial à sucessão de\nGeisel, general João Batista Figueiredo. Em outubro de 1978, renunciou\nao mandato de deputado federal para tornar-se diretor da Carteira de\nCâmbio do Banco do Estado de Minas Gerais S. A. Secretário de Governo de\nGoiás nos meses de março e abril de 1983, nesse último mês, foi nomeado,\npelo governador Ari Valadão, presidente da Caixa Econômica de Goiás,\ncargo que ocupou até março de 1983. Nesse ano, desligou-se do Partido\nDemocrático Social (PDS), agremiação que deu continuidade à linha de\natuação da Arena, após a extinção do bipartidarismo em novembro de 1979.\n\nRadicado em Goiás, afastou-se da vida pública, dedicando-se às\natividades de agricultor e pecuarista desenvolvidas em fazendas de sua\npropriedade, localizadas nos municípios de Itapuranga e Goiás.\n\nEm outubro de 1992, voltou ao cenário político, elegendo-se prefeito de\nItapuranga pela legenda do Partido Social Trabalhista (PST). Exerceu o\nmandato de 1993 a 1996. Nesse período, em 1993, deixou o PST e ingressou\nno Partido do Movimento Democrático Brasileiro (PMDB). Em 1999, mudou\numa vez mais de legenda, filiando-se ao Partido Progressista Brasileiro\n(PPB).\n\nCasou-se com Odete Maria da Conceição, com quem teve quatro filhos.\n\n \n\nFONTES: ASSEMB. LEGISL. MG. *Dicionário biográfico*; CURRIC. BIOG.;\n*Folha de São Paulo*(31/10/76); *Isto É* (8/6/77); *Jornal do\nBrasil*(9/10 e 15/12/76, 27/5, 15, 24/8, 6/9 e 14/10/77, 10/5/78).\n","ref":"FONTES: ASSEMB. LEGISL. MG. *Dicionário biográfico*; CURRIC. BIOG.;\n*Folha de São Paulo*(31/10/76); *Isto É* (8/6/77); *Jornal do\nBrasil*(9/10 e 15/12/76, 27/5, 15, 24/8, 6/9 e 14/10/77, 10/5/78).\n","dic":"DHBB"}
