{"title":"BOGÉA, Raimundo","cargoss":["Deputado federal"],"cargos_esp":[0],"datas_ini":[1967],"datas_fim":[1971],"estados":["MA"],"autor":[0],"content":"**BOGÉA, Raimundo**\n\n\\*dep. fed. MA 1967-1971.\n\n* *\n\n*Raimundo Rodrigues Bogéa* nasceu em Grajaú (MA) no dia 24 de outubro de\n1918, filho de Pedro Fernandes Bogéa e de Antônia Rodrigues Bogéa. Seu\nprimo Antenor Américo Mourão Bogéa foi constituinte de 1946 e deputado\nfederal pelo Maranhão de 1946 a 1955.****\n\nEleito em outubro de 1950 deputado à Assembléia Legislativa do Maranhão\nna legenda do Partido Social Trabalhista (PST), exerceu o mandato de\nfevereiro de 1951 a janeiro de 1955. Tornou a se eleger deputado\nestadual no pleito de outubro de 1958, dessa vez na legenda das\nOposições Coligadas, que reuniam a União Democrática Nacional (UDN), o\nPartido Democrata Cristão (PDC) e o Partido Republicano (PR). Em 1959\nbacharelou-se em ciências jurídicas e sociais pela Faculdade de Direito\ndo Maranhão.\n\nReeleito em outubro de 1962 na legenda do Partido Social Democrático\n(PSD), após a vitória do movimento político-militar de 31 de março de\n1964 que depôs o presidente João Goulart (1961-1964), a extinção dos\npartidos políticos pelo Ato Institucional nº 2 (27/10/1965) e a\nposterior instauração do bipartidarismo, filiou-se à Aliança Renovadora\nNacional (Arena), partido de apoio ao regime militar vigente no país, em\ncuja legenda foi eleito deputado federal pelo Maranhão no pleito de\nnovembro de 1966.\n\nConcluindo seu mandato na Assembléia Legislativa maranhense em janeiro\nde 1967, no mês seguinte assumiu uma cadeira na Câmara dos Deputados.\nDevido à constatação de que era portador do mal de Alzheimer, Raimundo\nBogéa não concorreu à reeleição no pleito de novembro de 1970.\nPermaneceu no Legislativo Federal até o fim de janeiro do ano seguinte,\nquando se encerraram o seu mandato e a legislatura.\n\nDesiludido com os rumos que o país havia tomado após a instauração do\nAto Institucional nº 5 (AI-5), em 1968, e abalado com a morte de seu pai\n- seu maior incentivador na vida pública – em junho de 1971, decidiu\nafastar-se da política, não concorrendo mais a nenhum cargo eletivo.\nAinda neste ano, transferiu-se para Goiás, estado no qual permaneceu até\n1973, retornando em seguida para São Luís, onde ainda residia em outubro\nde 2009.\n\nCasou-se com Graça de Maria Morais Bogéa, com quem teve quatro filhos.\n\nFONTES: CÂM. DEP. *Deputados**;*CÂM. DEP. *Deputados**brasileiros.\nRepertório*(1967-1971); **INF. FAM**.; TRIB. SUP. ELEIT. *Dados* (8).\n\n \n\n\\\n \\\n\n","ref":"FONTES: CÂM. DEP. *Deputados**;*CÂM. DEP. *Deputados**brasileiros.\nRepertório*(1967-1971); **INF. FAM**.; TRIB. SUP. ELEIT. *Dados* (8).\n\n \n\n\\\n \\\n\n","dic":"DHBB"}
