{"title":"BONNA, Edson","cargoss":["Deputado federal"],"cargos_esp":[0],"datas_ini":[1971],"datas_fim":[1979],"estados":["PA"],"autor":[0],"content":"**BONNA, Edson**\n\n\\*militar; dep. fed. PA 1971-1979.\n\n \n\n*Edson Burlamaqui Simões Bonna* nasceu em Belém no dia 1º de setembro de\n1924, filho de Antônio Bonna e de Eunice Burlamaqui Simões Bonna. Newton\nBurlamaqui Barreira foi militar, vice-governador do Pará (1970-1974) e\ndeputado federal pelo Pará (1975-1979); Newton Burlamaqui de Miranda,\nvice-governador do Pará (1961-1964), e José Edson Burlamaqui de Miranda,\ndeputado federal (1963-1967), todos seus primos.\n\nEngenheiro aeronáutico diplomado em 1951 pelo Instituto Tecnológico da\nAeronáutica (ITA), de São José dos Campos (SP), Edson Bonna formou-se em\nengenharia civil pela Escola de Engenharia da Universidade do Pará em\n1955. Fez ainda os cursos de especialização em solos e pavimentação pelo\nDepartamento Nacional de Estradas de Rodagem (DNER) em 1960 e engenharia\nrodoviária pelo Instituto de Pesquisas Rodoviárias em 1965.\n\nEm novembro de 1970, elegeu-se deputado federal pelo Pará na legenda da\nAliança Renovadora Nacional (Arena), assumindo a cadeira em fevereiro do\nano seguinte. Ainda em 1971, tornou-se suplente da Comissão de\nValorização Econômica da Amazônia, membro efetivo da Comissão de\nOrçamento e quarto suplente da mesa da Câmara Federal.\n\nReeleito em novembro de 1974, a partir do ano seguinte foi suplente da\nComissão de Comunicações e titular da Comissão de Ciência e Tecnologia\nda Câmara. Candidato à reeleição em novembro de 1978, não teve êxito nas\nurnas, deixando a Câmara Federal ao fim de seu segundo mandato\n(31/1/1979).\n\nEm maio de 1979 tornou-se diretor financeiro da Alumina do Brasil S.A.\n(Albrás), empresa do grupo da Companhia Vale do Rio Doce (CVRD), cargo\nque ocupou até 1981. Dois anos mais tarde, ingressou nas Centrais\nElétricas do Norte do Brasil S.A. (Eletronorte), empresa sediada em\nBrasília e integrante da holding estatal Centrais Elétricas Brasileiras\nS.A. (Eletrobrás), como assessor da presidência.\n\nFaleceu no dia 9 de setembro de 1986.\n\nEra casado com Santusa Jugurta Bonna, com quem teve seis filhos.\n\n \n\nFONTES: CÂM. DEP. *Deputados*; CÂM. DEP. *Deputados brasileiros.\nRepertórios* (1971-1975, 1975-1979); *Jornal do Brasil* (15/11/78);\nNÉRI, S. *16*; *Perfil* (1972).\n\n \n","ref":"FONTES: CÂM. DEP. *Deputados*; CÂM. DEP. *Deputados brasileiros.\nRepertórios* (1971-1975, 1975-1979); *Jornal do Brasil* (15/11/78);\nNÉRI, S. *16*; *Perfil* (1972).\n\n \n","dic":"DHBB"}
