{"title":"BORGES, Josafá","cargoss":["Deputado federal"],"cargos_esp":[0],"datas_ini":[1963],"datas_fim":[1967],"estados":["BA"],"autor":[0],"content":"**BORGES, Josafá**\n\n\\*dep. fed. BA 1963-1967.\n\n*Josafá Carlos Borges* nasceu em 12 de maio de 1915 em Frei Paulo (SE),\nfilho de Manuel Carlos Borges e Joana Cândida Borges.\n\nCursou engenharia. Ocupou a Secretaria de Viação e Obras Públicas da\nBahia no governo de Antônio Balbino (1955-1959) e a Secretaria Estadual\nda Fazenda no governo de Juraci Magalhães (1959-1963).\n\nEm outubro de 1962, elegeu-se deputado federal pela Bahia na legenda da\nAliança Democrática Trabalhista Cristã, formada pelo Partido Social\nDemocrático (PSD), ao qual era filiado —, o Partido Democrata Cristão\n(PDC), o Partido Trabalhista Nacional (PTN), o Partido Social\nProgressista (PSP) e o Partido Socialista Brasileiro (PSB).\n\nAssumiu o mandato em fevereiro de 1963. Em conseqüência da extinção dos\npartidos políticos pelo Ato Institucional nº 2 (27/10/1965) e a\nposterior instauração do bipartidarismo, filiou-se ao Movimento\nDemocrático Brasileiro (MDB), partido de oposição ao regime militar\ninstalado no país em abril de 1964, em cuja legenda concorreu à\nreeleição em novembro de 1966, obtendo apenas uma suplência. Deixou a\nCâmara ao fim de seu primeiro mandato (31/1/1967), a ela não retornando\nna legislatura seguinte.\n\nFONTES: CÂM. DEP. *Anais*; CÂM. DEP. *Deputados*; CÂM. DEP. *Deputados\nbrasileiros* (1946-1967); MELO, A. *Cartilha*; TRIB. SUP. ELEIT. *Dados*\n(6 e 8).\n\n \n","ref":"FONTES: CÂM. DEP. *Anais*; CÂM. DEP. *Deputados*; CÂM. DEP. *Deputados\nbrasileiros* (1946-1967); MELO, A. *Cartilha*; TRIB. SUP. ELEIT. *Dados*\n(6 e 8).\n\n \n","dic":"DHBB"}
