{"title":"BORGES, Paulo","cargoss":["Deputado federal"],"cargos_esp":[0],"datas_ini":[1979],"datas_fim":[1987],"estados":["GO"],"autor":[0],"content":"**BORGES, Paulo**\n\n\\*dep. fed. GO 1979-1987.\n\n \n\n*Paulo Borges Teixeira* nasceu em Rio Verde (GO), no dia 2 de março de\n1927, filho de Pedro Ludovico Teixeira e de Gercina Borges Teixeira. O\npai, revolucionário de 1930, foi duas vezes interventor e governador de\nGoiás, além de duas vezes eleito para o Senado, e constituinte em 1946.\nO avô materno, Antônio Martins Borges, rico fazendeiro e comerciante,\ntambém ocupou uma cadeira de senador. O irmão Mauro Borges elegeu-se\ndeputado federal em duas legislaturas, entre as quais exerceu o governo\ndo estado, tendo sido afastado pelo regime militar, e encerrou a vida\npública como senador.\n\nBacharel em ciências jurídicas e sociais pela Faculdade de Direito da\nUniversidade Federal de Goiás, Paulo Borges foi serventuário da justiça\ne auxiliar do escritório de expansão comercial do Brasil em Bonn, então\ncapital da República Federal da Alemanha, entre 1956 e 1957. De volta ao\nBrasil, retomou as suas atividades como tabelião.\n\nAs tradições familiares o levaram a concorrer, em novembro de 1978, a\numa vaga na Câmara dos Deputados, na legenda do Movimento Democrático\nBrasileiro (MDB), partido de oposição ao regime militar instaurado no\npaís em abril de 1964. Eleito, tomou posse em fevereiro do ano seguinte.\nPermaneceu no MDB até a extinção do bipartidarismo, em 29 de novembro de\n1979, quando ingressou no Partido do Movimento Democrático Brasileiro\n(PMDB), sucessor do MDB. Membro da Comissão de Transportes, realizou\nviagens à União Soviética (1980) e ao Iraque (1981), ambas a convite dos\nrespectivos governos.\n\nEm novembro de 1982 concorreu à reeleição, obtendo a segunda suplência.\nCom o afastamento do titular José Freire, assumiu o mandato, em 1983,\nintegrando a Comissão do Interior. Na sessão que a Câmara dos Deputados\nrealizou em 25 de abril de 1984, votou a favor da emenda Dante de\nOliveira, que propunha o restabelecimento das eleições diretas para\npresidente da República já em novembro. Derrotada a proposição —\nfaltaram 22 votos para que o projeto pudesse ser encaminhado à\napreciação pelo Senado Federal — no Colégio Eleitoral, reunido em 15 de\njaneiro de 1985, Paulo Borges votou no candidato oposicionista Tancredo\nNeves, eleito presidente da República na legenda da Aliança Democrática,\numa união do PMDB com a dissidência do Partido Democrático Social (PDS),\nabrigada na Frente Liberal, que derrotou Paulo Maluf, candidato oficial\ndo regime. Contudo, Tancredo não chegou a ser empossado, vindo a falecer\nem 21 de abril de 1985. Seu substituto foi o vice José Sarney, que já\nvinha exercendo interinamente o cargo, desde 15 de março deste ano.\n\nEm junho, na sessão que decidia sobre a regulamentação das eleições\nmunicipais marcadas para novembro, Paulo Borges foi flagrado votando\npela segunda vez, o que lhe valeu uma advertência formal, proferida pela\nmesa diretora da Câmara. No ano de 1986, juntamente com seu irmão Mauro\nBorges, abandonou o PMDB, tornando-se um dos fundadores do Partido\nDemocrata Cristão (PDC) no estado de Goiás. Deixou a Câmara dos\nDeputados ao término da legislatura, em janeiro de 1987, após ter-se\ncandidatado à reeleição, em novembro do ano anterior, conseguindo apenas\numa suplência. Retornou às atividades de tabelião, em Goiânia, e em 1989\nassumiu a vaga de Jales Fontoura, que se licenciara a fim de tratar de\nassuntos particulares. Depois disso, não voltou a disputar cargos\neletivos, dedicando-se às atividades de tabelião.\n\nFaleceu em Goiânia, no dia 1º de junho de 1996.\n\nEra casado com Márcia Melo Rosa Teixeira, com quem teve quatro filhos.\n\n \n\nFONTES: CÂM. DEP. *Deputados brasileiros. Repertório* (1979-1983,\n1983-1987); INF. FAM.; *Jornal do Brasil* (28/6/85).\n\n \n","ref":"FONTES: CÂM. DEP. *Deputados brasileiros. Repertório* (1979-1983,\n1983-1987); INF. FAM.; *Jornal do Brasil* (28/6/85).\n\n \n","dic":"DHBB"}
