{"title":"BORGES, Veloso","cargoss":["Constituinte","Senador"],"cargos_esp":[0,0],"datas_ini":[1934,1935],"datas_fim":[1934,1937],"estados":[0,"PB"],"autor":[0],"content":"**BORGES, Veloso**\n\n\\*const. 1934; sen. PB 1935-1937.\n\n \n\n*Manuel Veloso Borges* nasceu em Pilar (PB) em 11 de abril de 1885,\nfilho de Anísio Pereira Borges e de Virgínia Veloso Borges. Seu irmão\nVirgínio Veloso Borges foi senador pela Paraíba de 1952 a 1955.\n\nDiplomou-se em 1908 pela Faculdade de Medicina da Bahia. Sua tese de\ndoutoramento intitulou-se Conceito atual da psicose maníaco-depressiva.\n\nEm 1929 elegeu-se deputado estadual, tornando-se líder do governo Álvaro\nde Carvalho na Assembléia Legislativa. Com a vitória da Revolução de\n1930, que depôs o presidente Washington Luís e levou Getúlio Vargas ao\npoder, todos os órgãos legislativos do país foram extintos e,\nconseqüentemente, Veloso Borges perdeu o mandato. Com a\nreconstitucionalização, em maio de 1933 elegeu-se deputado à Assembléia\nNacional Constituinte pelo Partido Progressista da Paraíba, do qual era\nvice-presidente. Promulgada a Constituição em 16 de julho de 1934, teve\nseu mandato prorrogado até maio de 1935.\n\nAinda em outubro de 1934, foram eleitas as assembléias constituintes\nestaduais, encarregadas de eleger o governador e dois senadores.\nInstalada a Constituinte paraibana no início de 1935, foi eleito\nsenador, exercendo o mandato de maio de 1935 a 10 de novembro de 1937,\nquando o golpe do Estado Novo suprimiu todos os órgãos legislativos do\npaís.\n\nFoi tesoureiro da Confederação Nacional da Indústria de novembro de 1952\na novembro de 1954. Atuou como construtor da rodovia Sapé-Mamanguape e\nadquiriu o controle acionário da Companhia de Tecidos Paraibana. Foi\nindustrial e banqueiro no Rio de Janeiro, então Distrito Federal, e\npresidente da Associação Comercial da Paraíba. adquiriu com os irmãos a\nfábrica Deodoro, na capital federal, onde permaneceu como industrial,\nnão mais concorrendo a cargos políticos.\n\nFaleceu no Rio de Janeiro no dia 27 de abril de 1959.\n\nEra casado com Andréia Marques Veloso Borges, com quem teve três filhas.\n\n \n\nFONTES: ASSEMB. NAC. CONST. 1934. *Anais*; *Boletim Min. Trab*. (5/36);\nCÂM. DEP. *Deputados*; CONF. NAC. IND.; *Diário do Congresso Nacional*;\nGODINHO, V. *Constituintes*; SENADO. *Anais* (1935).\n\n \n","ref":"FONTES: ASSEMB. NAC. CONST. 1934. *Anais*; *Boletim Min. Trab*. (5/36);\nCÂM. DEP. *Deputados*; CONF. NAC. IND.; *Diário do Congresso Nacional*;\nGODINHO, V. *Constituintes*; SENADO. *Anais* (1935).\n\n \n","dic":"DHBB"}
