{"title":"BORGES, Virgínio Veloso","cargoss":["Senador"],"cargos_esp":[0],"datas_ini":[1952],"datas_fim":[1955],"estados":["PB"],"autor":[0],"content":"**BORGES, Virgínio Veloso**\n\n\\*sen. PB 1952-1955.\n\n \n\n*Virgínio Veloso Borges* nasceu em Pilar (PB) no dia 27 de março de\n1886, filho de Anísio Pereira Borges e de Virgínia Veloso Borges. Seu\nirmão Manuel Veloso Borges foi constituinte de 1934 e senador pela\nParaíba de 1935 a 1937.****\n\nCursou o Liceu Paraibano, na capital do estado, e diplomou-se pela\nFaculdade de Farmácia e Medicina da Bahia em 1907.\n\nTrabalhou como farmacêutico no estado do Amazonas em 1908, apicultor em\nsua cidade natal (1908-1918), chefe da firma Borges, Carvalho e\nCompanhia, no Rio de Janeiro (1918-1923), diretor da firma Veloso e\nCompanhia, na Paraíba (1923-1926), presidente da Cia. Tecidos Paraibana\n(1926-1947), diretor-presidente da Cia. Deodoro Industrial a partir de\n1936, presidente da Cisal do Brasil S.A. e diretor vice-presidente do\nBanco Aliança do Rio de Janeiro.\n\nEm virtude da renúncia do senador Adalberto Ribeiro e do falecimento de\nseu suplente, Epitácio Pessoa Cavalcanti de Albuquerque, em 1951, foi\neleito em 1952, em pleito suplementar, senador pela Paraíba na legenda\ndo Partido Social Democrático (PSD), exercendo o mandato de janeiro de\n1952 a janeiro de 1955. No pleito de outubro de 1958, candidatou-se,\npela coligação formada pelo Partido Libertador (PL) com a União\nDemocrática Nacional (UDN), a suplente de senador de José Américo de\nAlmeida, a quem sempre foi ligado politicamente, mas não conseguiu se\neleger. Em seguida, abandonou a política e dedicou-se às suas atividades\nempresariais.\n\nFaleceu no Rio de Janeiro no dia 18 de fevereiro de 1966.\n\nEra casado com Priscila Freire Veloso Borges, com quem teve cinco\nfilhos. Sua filha Germana Veloso Borges foi casada com João Úrsulo\nRibeiro Coutinho Filho, que foi constituinte de 1946 e deputado federal\npela Paraíba de 1946 a 1951 e de 1955 a 1963.\n\n \n\nFONTES: CISNEIROS, A. *Parlamentares*; SENADO. *Relação*; SOC. BRAS.\nEXPANSÃO COMERCIAL. *Quem*; TRIB. SUP. ELEIT. *Dados* (1, 2 e 4); *Who’s\nwho in Brazilian*.\n\n \n","ref":"FONTES: CISNEIROS, A. *Parlamentares*; SENADO. *Relação*; SOC. BRAS.\nEXPANSÃO COMERCIAL. *Quem*; TRIB. SUP. ELEIT. *Dados* (1, 2 e 4); *Who’s\nwho in Brazilian*.\n\n \n","dic":"DHBB"}
