{"title":"BOTELHO, Anísio","cargoss":["Comandante da IV Zona Aérea","Ministro da Aeronáutica"],"cargos_esp":[0,0],"datas_ini":[1963,1963],"datas_fim":[1963,1964],"estados":[0,0],"autor":[0],"content":"**BOTELHO, Anísio**\n\n\\*militar; comte. IV ZA 1963; min. Aer. 1963-1964.\n\n \n\n*Anísio Botelho* nasceu em Cuiabá no dia 31 de dezembro de 1908, filho\nde Aniceto Pinto Botelho e de Leodomila Lima de Almeida Botelho.\n\nSentou praça em abril de 1926 ao ingressar na Escola Militar do\nRealengo, no Rio de Janeiro, então Distrito Federal, tendo pertencido à\nquarta turma de cadetes que, em novembro de 1930, foram declarados\naspirantes-a-oficiais da arma de aviação.\n\nPromovido a segundo-tenente em junho do ano seguinte, chegou a\nprimeiro-tenente em junho de 1933 e a capitão em junho de 1934. Com a\ncriação do Ministério da Aeronáutica em janeiro de 1941, passou a\nintegrar a Força Aérea Brasileira (FAB) no posto de capitão aviador,\nsendo promovido a major-aviador em dezembro do mesmo ano. De março do\nano seguinte a outubro de 1944 comandou a Base Aérea de São Paulo (Campo\nde Marte), alcançando nesse ínterim o posto de tenente-coronel aviador\nem fevereiro de 1944. De outubro desse ano a abril de 1945 exerceu o\ncomando do 2º Regimento de Aviação, no Campo de Marte, assumindo em\nfevereiro do ano seguinte o comando do 1º Grupo de Patrulha, sediado em\nBelém, que ocupou até março de 1947.\n\nPromovido a coronel-aviador em setembro de 1950, foi nomeado comandante\nda Escola de Especialistas de Guaratinguetá (SP), sendo o primeiro a\nocupar este posto. Em 1953, chefiou a Comissão de Compras, em Washington\n(EUA). Foi chefe de gabinete do ministro da Aeronáutica,\nmajor-brigadeiro Vasco Alves Seco, de 1955 a 1956. Tornou-se\nbrigadeiro-do-ar em julho do ano seguinte, sendo designado comandante do\nComando de Transporte Aéreo (Comta), cargo que deixou em janeiro de\n1961. Promovido a major-brigadeiro no ano seguinte, em 1963 assumiu o\ncomando da IV Zona Aérea (IV ZA), com sede em São Paulo, pela qual\nrespondeu até junho do mesmo ano.\n\nAo constituir o segundo ministério da fase presidencialista de seu\ngoverno, o presidente João Goulart (1961-1964) nomeou Anísio Botelho, em\njunho de 1963, ministro da Aeronáutica em substituição ao brigadeiro\nReinaldo Joaquim Ribeiro de Carvalho Filho. Botelho teve problemas na\norganização do gabinete diante da situação de confronto existente na\nforça aérea. Em setembro de 1963, desencadeou-se, em Brasília, o\nmovimento chamado de Revolta dos Sargentos, com participação de\nelementos da Marinha e da Aeronáutica, e logo dominado.\n\nEm outubro do mesmo ano, a imprensa divulgou trechos de uma entrevista\ndo governador da Guanabara, Carlos Lacerda, a um jornal norte-americano\nna qual afirmava que o governo de Goulart poderia cair antes do fim do\nano, estando os militares preocupados diante das alternativas de que\nseria “melhor tutelá-lo, colocá-lo sob controle até o término de seu\nmandato ou destituí-lo agora mesmo”. Os ministros militares — brigadeiro\nAnísio Botelho, da Aeronáutica, general Jair Dantas Ribeiro, da Guerra,\ne almirante Sílvio Mota, da Marinha — consideraram a entrevista\ninjuriosa às forças armadas e, em nota conjunta, taxaram a atitude de\nLacerda de ato impatriótico, passando a exigir a decretação do estado de\nsítio e a punição do governador. Diante disso, Goulart encaminhou\nmensagem ao Congresso solicitando que a medida fosse adotada em todo o\nterritório nacional. A reduzida receptividade a essa providência, porém,\nlevou-o a retirar o pedido.\n\nNo dia 31 de março de 1964, um movimento político-militar depôs Goulart,\nempossando na chefia da nação uma junta militar autodenominada Comando\nSupremo da Revolução, constituída pelo general Artur da Costa e Silva, o\nbrigadeiro Francisco de Assis Correia de Melo e o almirante Augusto\nRademaker, sendo o exercício formal da presidência confiado a Pascoal\nRanieri Mazzilli, presidente da Câmara dos Deputados. Anísio Botelho\npermaneceu à frente do Ministério da Aeronáutica até o dia 4 de abril do\nmesmo ano, quando foi substituído pelo brigadeiro Francisco de Assis\nCorreia de Melo.\n\nNo dia 13 do mesmo mês passou para a reserva e, no dia seguinte, teve\nseus direitos políticos suspensos pelo prazo de dez anos por decisão do\nComando Supremo da Revolução, com base no Ato Institucional nº 1 (AI-1),\nque, editado no dia 9 de abril de 1964 pela junta militar que substituiu\nGoulart, constituiu o primeiro elemento formalizador das transformações\npolíticas introduzidas pelo movimento de 31 de março. O AI-1 permitiu\npunições extralegais de adversários do novo regime — cassações,\ndemissões, expulsões —, determinando ainda a eleição indireta do\npresidente da República e transferindo para o Executivo importantes\natribuições do Legislativo.\n\nDurante sua carreira militar fez, ainda, os cursos de aperfeiçoamento de\noficiais da Aeronáutica, de estado-maior e superior de comando dessa\nforça.\n\nFaleceu no Rio de Janeiro no dia 7 de março de 1986.\n\nEra casado com Sotair Fernandes Botelho, com quem teve dois filhos.\n\n \n\nFONTES: *Diário Oficial* (14/4/64); *Encic. Mirador*; *Grande encic.\nDelta*; MIN. AER. *Almanaque* (1963); SOUSA, J. *Ministros*; VÍTOR, M.\n*Cinco*; WANDERLEY, N. *História*.\n\n \n","ref":"FONTES: *Diário Oficial* (14/4/64); *Encic. Mirador*; *Grande encic.\nDelta*; MIN. AER. *Almanaque* (1963); SOUSA, J. *Ministros*; VÍTOR, M.\n*Cinco*; WANDERLEY, N. *História*.\n\n \n","dic":"DHBB"}
