{"title":"BOTELHO, Mendes ===============","cargoss":["Deputado federal","Constituinte"],"cargos_esp":[0,0],"datas_ini":[1983,1987],"datas_fim":[1995,1988],"estados":["SP",0],"autor":[0],"content":"BOTELHO, Mendes\n===============\n\n\\* dep. fed. SP 1983-1995; const. 1987-1988.\n\n \n\n*José Mendes Botelho*nasceu em Brasília de Minas (MG) no dia 7 de maio\nde 1942, filho de Cristóvão Alves Botelho e de Percelina Mendes Botelho.\n\nEm 1968 bacharelou-se engenheiro mecânico pela Universidade Católica de\nBelo Horizonte.\n\nEm novembro de 1976, elegeu-se vereador à Câmara Municipal de Santo\nAndré (SP) na legenda do Movimento Democrático Brasileiro (MDB), partido\nde oposição ao regime militar instaurado no país em abril de 1964, sendo\nempossado em fevereiro de 1977. Funcionário da Rede Ferroviária Federal,\nno mesmo ano tornou-se presidente do Sindicato dos Ferroviários do\nEstado de São Paulo, cargo que ocuparia até 1983.\n\nCom o fim do bipartidarismo em novembro de 1979, filiou-se ao Partido\nTrabalhista Brasileiro (PTB). No pleito de novembro de 1982 concorreu a\numa vaga na Câmara dos Deputados. Eleito, assumiu o mandato em fevereiro\ndo ano seguinte. Neste período foi vice-presidente da Comissão de\nTransportes e suplente da Comissão de Defesa do Consumidor (1983).\n\nEm 25 de abril de 1984 votou a favor da emenda Dante de Oliveira, que,\napresentada na Câmara dos Deputados, propôs o restabelecimento das\neleições diretas para presidente da República em novembro daquele ano.\nComo a emenda não obteve o número de votos indispensáveis à sua\naprovação – faltaram 22 para que o projeto pudesse ser encaminhado à\napreciação pelo Senado –, no Colégio Eleitoral, reunido em 15 de janeiro\nde 1985, Mendes Botelho votou no candidato oposicionista Tancredo Neves,\neleito novo presidente da República pela Aliança Democrática, uma união\ndo Partido do Movimento Democrático Brasileiro (PMDB) com a dissidência\ndo Partido Democrático Social (PDS) abrigada na Frente Liberal. Contudo,\npor motivo de doença, Tancredo Neves não chegou a ser empossado na\npresidência, vindo a falecer em 21 de abril de 1985. Seu substituto no\ncargo foi o vice José Sarney, que já vinha exercendo interinamente o\ncargo desde 15 de março deste ano.\n\nMendes Botelho votou a favor do projeto que proibia a demissão do\ntrabalhador sem justa causa. Durante esta legislatura, declarou-se ainda\nfavorável à convocação de uma Assembléia Nacional Constituinte, à\nlegalização do aborto, à reforma agrária e ao voto vinculado, e contra a\ncensura, a legalização do jogo e o voto distrital.\n\nEm novembro de 1986 elegeu-se deputado federal constituinte na legenda\ndo PTB, iniciando novo mandato em fevereiro do ano seguinte, quando\ntiveram início os trabalhos da Constituinte. Foi membro titular da\nSubcomissão dos Direitos dos Trabalhadores e Servidores Públicos, da\nComissão da Ordem Social; e suplente da Subcomissão da União, Distrito\nFederal e Territórios, da Comissão da Organização do Estado.\n\nNas principais votações da Constituinte, pronunciou-se contra o\nrompimento de relações diplomáticas com países com política de\ndiscriminação racial, o mandato de cinco anos para Sarney, a limitação\ndos encargos da dívida externa, a criação de um fundo de apoio à reforma\nagrária e a anistia aos micro e pequenos empresários. Votou a favor da\nlimitação do direito de propriedade privada, do mandado de segurança\ncoletivo, da legalização do aborto, da estabilidade no emprego, da\nremuneração 50% superior para o trabalho extra, da jornada semanal de 40\nhoras, do turno ininterrupto de seis horas, do aviso prévio\nproporcional, da unicidade sindical, da soberania popular, do voto aos\n16 anos, do presidencialismo, do limite de 12% ao ano para os juros\nreais, da proibição do comércio de sangue, da legalização do jogo do\nbicho e da desapropriação da propriedade produtiva. Na defesa dos\ndireitos sociais apresentou as seguintes prioridades: regulamentação do\ndireito de greve, reformulação do ensino, defesa do consumidor, proteção\nao meio ambiente e normatização de sistema único de saúde. No campo\neconômico defendeu propostas nacionalistas, como a participação do\nEstado na economia e a reforma agrária.\n\nApós a promulgação da nova Carta Constitucional (5 de outubro de 1988),\nvoltou a participar dos trabalhos legislativos ordinários na Câmara dos\nDeputados como segundo suplente da mesa, membro titular das comissões de\nTrabalho, de Transportes, de Viação, Transportes, Desenvolvimento Urbano\ne Interior, e suplente da Comissão de Defesa Nacional. Reeleito em\noutubro de 1990, assumiu novo mandato em fevereiro seguinte.\n\nNa sessão da Câmara dos Deputados de 29 de setembro de 1992, votou pela\nabertura do processo de *impeachment* do presidente Fernando Collor de\nMelo, acusado de crime de responsabilidade por ligações com um esquema\nde corrupção liderado pelo ex-tesoureiro de sua campanha presidencial,\nPaulo César Farias. Afastado da presidência logo após a votação na\nCâmara, Collor renunciou ao mandato em 29 de dezembro de 1992, pouco\nantes da conclusão do processo pelo Senado, sendo efetivado na\npresidência da República o vice Itamar Franco, que já vinha exercendo o\ncargo interinamente desde o dia 2 de outubro.\n\nNão disputando a reeleição no pleito de outubro de 1994, Mendes Botelho\ndeixou a Câmara em janeiro seguinte, ao final da legislatura.\n\nFoi também professor de matemática e estatística do Instituto de Ensino\nSuperior do Senador Fláquer, em Santo André (SP), e secretário-geral da\nFederação Nacional dos Ferroviários.\n\nCasou-se com Diva Marilena de Araújo Botelho, com quem teve três filhos.\n\n \n\nNara Santana\n------------\n\n \n\nFONTES: CÂM. DEP. *Deputados brasileiros. Repertório*(1991-1995);\nCOELHO, J. & OLIVEIRA, A. *Nova*; *Folha de São Paulo*(19/1/87); *Globo*\n(26/4/84, 16/1/85); *Perfil parlamentar/Isto É.*\n","ref":"FONTES: CÂM. DEP. *Deputados brasileiros. Repertório*(1991-1995);\nCOELHO, J. & OLIVEIRA, A. *Nova*; *Folha de São Paulo*(19/1/87); *Globo*\n(26/4/84, 16/1/85); *Perfil parlamentar/Isto É.*\n","dic":"DHBB"}
