{"title":"BOTELHO, Sílvio","cargoss":["Deputado federal","Deputado federal","Deputado federal"],"cargos_esp":[0,0,0],"datas_ini":[1978,1971,1966],"datas_fim":[1978,1975,0],"estados":["RR","RR","RR"],"autor":[0],"content":"**BOTELHO, Sílvio**\n\n\\*dep. fed. RR 1966, 1971-1975 e 1978.\n\n*Sílvio Lofego Botelho* nasceu em Iúna (ES) no dia 11 de agosto de 1917,\nfilho de Augusto Afonso Botelho e de Rosina Lofego Botelho.\n\nDiplomou-se pela Faculdade Fluminense de Medicina, em Niterói, em 1944,\nretornou ao Espírito Santo, e transferiu-se depois para o território de\nRio Branco, que a partir de 1962 teve o nome alterado para Roraima. Lá\nexerceu a medicina, tendo sido médico perito do Instituto Nacional de\nPrevidência Social (INPS) e diretor da Assistência à Maternidade e à\nInfância da Divisão de Saúde, além de diretor de vários hospitais. Foi\nainda diretor-substituto da Divisão de Educação do território, e\nprofessor de ciências naturais e de puericultura e enfermagem da Escola\nNormal Monteiro Lobato, em Boa Vista. Finalmente, foi presidente do\nConselho Penitenciário, secretário-geral do governo do território e\ngovernador substituto.\n\nFiliado ao Partido Social Democrático (PSD), candidatou-se a deputado\nfederal por Roraima em outubro de 1962, com o apoio da coligação\nformada, além do PSD, pelo Partido Socialista Brasileiro (PSB) e a União\nDemocrática Nacional (UDN). Obteve a segunda suplência, vindo a ocupar\numa cadeira na Câmara de abril a agosto de 1966. Nessa ocasião, em\nconsequência da extinção dos partidos políticos pelo Ato Institucional\nnº 2 (27/10/1965) e da instauração do bipartidarismo, filiou-se à\nAliança Renovadora Nacional (Arena), partido de sustentação ao regime\nmilitar.\n\nEm novembro de 1970, elegeu-se deputado federal por Roraima na legenda\nda Arena. Retornando à Câmara em fevereiro de 1971, foi vice-presidente\nda Comissão de Saúde e suplente da Comissão de Legislação Social. No\npleito de novembro de 1974 tentou reeleger-se e obteve uma suplência.\nDeixou a Câmara ao final da legislatura, em janeiro de 1975, mas voltou\na ela como suplente, vindo a falecer no exercício do mandato, em 11 de\nnovembro de 1978, em Brasília.\n\nCasado com Flora Pereira Botelho, teve cinco filhos. Um deles, Augusto\nBotelho, foi eleito senador em 2002, com mandato de 2003 a 2011.\n\n \n\nFONTES: CÂM. DEP. *Deputados;*CÂM. DEP. *Deputados brasileiros.\nRepertório*(1971-1975): NÉRI, S.*16;* *Perfil*(1972).\n\n \n","ref":"FONTES: CÂM. DEP. *Deputados;*CÂM. DEP. *Deputados brasileiros.\nRepertório*(1971-1975): NÉRI, S.*16;* *Perfil*(1972).\n\n \n","dic":"DHBB"}
