{"title":"BRAGA, Antônio Pereira","cargoss":["juiz TSN"],"cargos_esp":[0],"datas_ini":[1936],"datas_fim":[1945],"estados":[0],"autor":[0],"content":"**BRAGA, Antônio Pereira**\n\n\\*magistrado; juiz TSN 1936-1945.\n\n*Antônio Pereira Braga,*advogado e magistrado, foi nomeado juiz do\nTribunal de Segurança Nacional (TSN) quando da criação deste órgão pelo\npresidente Getúlio Vargas em setembro de 1936, especificamente para\njulgar os implicados na Revolta Comunista de 1935.\n\nEm maio de 1937 participou como juiz daquele tribunal, então presidido\npelo desembargador Frederico de Barros Barreto, do julgamento do\nprimeiro grupo de acusados de liderar a Revolta de 1935. A maioria dos\nréus recusou defender-se, alegando ser o TSN um tribunal de exceção, o\nque obrigou à designação de advogados dativos pela Ordem dos Advogados\ndo Brasil (OAB) para fazê-lo. Nesse julgamento Antônio Pereira Braga\ndeclarou-se impedido de julgar o deputado João Mangabeira em virtude de\nsua amizade com o réu, que foi, afinal, condenado.\n\nEm julho ainda de 1937, por ocasião do julgamento do segundo grupo de\nindiciados na insurreição de 1935, jurou suspeição quanto ao julgamento\nde Maurício de Lacerda. Em dezembro desse mesmo ano, após a instituição\ndo Estado Novo, baseado nas provas dos autos, absolveu o comerciário\nJosé Monte Júnior, menor de idade, da acusação de divulgar panfletos do\nPartido Comunista Brasileiro, então Partido Comunista do Brasil (PCB). O\nTSN reviu, entretanto, essa sentença, condenando o acusado. A partir de\nmaio de 1938, após o assalto ao palácio Guanabara — principal episódio\ndo levante integralista então detonado —, o TSN passaria a julgar também\nintegralistas e opositores do governo em geral.\n\nEm agosto de 1940, quando a polícia do governo paulista acusou o jornal\n*O Estado de* *S. Paulo*de sediar uma conspiração contra o governo\nfederal, negou-se a julgar Armando Sales, Otávio Mangabeira e Paulo\nNogueira Filho, que, mesmo estando no exílio, foram acusados de\nparticipar do movimento. O pleno do TSN não aceitou sua decisão,\ndevolvendo-lhe o processo para que fosse julgado. Procedeu então ao\njulgamento, que resultou na absolvição dos réus, condenados mais tarde,\ntodavia, pelo pleno do TSN. Esse episódio resultou em intervenção do\ngoverno naquele jornal, situação que persistiria até dezembro de 1945.\n\nCom a deposição de Vargas em 29 de outubro de 1945 e o fim do Estado\nNovo, o TSN foi extinto em novembro.\n\nPublicou *Concessão de terras*(1921).\n\nFONTES: CAMPOS, R. *Tribunal*;**CARNEIRO, G. *História*;**MOREIRA, J.\n*Dic.*; OLIVEIRA, M. *História*;**SILVA, H. *1937*.\n\n \n","ref":"FONTES: CAMPOS, R. *Tribunal*;**CARNEIRO, G. *História*;**MOREIRA, J.\n*Dic.*; OLIVEIRA, M. *História*;**SILVA, H. *1937*.\n\n \n","dic":"DHBB"}
