{"title":"BRAGA, Mendonça","cargoss":["Deputado federal"],"cargos_esp":[0],"datas_ini":[1951],"datas_fim":[1959],"estados":["AL"],"autor":[0],"content":"**BRAGA, Mendonça**\n\n\\*magistrado; dep. fed. AL 1951-1959.\n\n \n\n*José Caralâmpio de Mendonça Braga* nasceu em Camarajibe (AL) no dia 16\nde abril de 1904, filho de Francisco Rodrigues Braga e de Antônia de\nMendonça Braga. Seus primos, Antônio Saturnino de Mendonça Júnior e\nAntônio Saturnino de Mendonça Neto, foram, respectivamente, deputado\nfederal em 1951-1954 e 1956 e 1957; e entre 1979 e 1983.\n\nCursou o Colégio 15 de Março, em Maceió, e ingressou depois na Faculdade\nde Direito de Recife, pela qual se diplomou.\n\nProfessor de direito penal e civil na Faculdade de Direito de Alagoas,\nfoi delegado auxiliar e chefe de polícia do estado. Foi também\nprocurador dos feitos da Fazenda, juiz de direito, juiz de menores e\ndiretor da Imprensa Oficial de Alagoas. Dirigiu ainda o Jornal de\nAlagoas.\n\nEm janeiro de 1947, elegeu-se deputado à Assembléia Legislativa do\nestado na legenda do Partido Social Democrático (PSD), exercendo a\nliderança da maioria na Câmara estadual durante seu mandato.\n\nEleito deputado federal por Alagoas no pleito de outubro de 1950, dessa\nvez na legenda do Partido Social Trabalhista (PST), assumiu uma cadeira\nna Câmara Federal em fevereiro de 1951. Durante a legislatura, filiou-se\nao Partido Trabalhista Brasileiro (PTB).\n\nCandidato à reeleição em outubro de 1954, obteve apenas uma suplência,\nna legenda das Oposições Coligadas de Alagoas, coalizão formada pelo\nPTB, o PSD, o Partido Social Progressista (PSP), o Partido Democrata\nCristão (PDC), o Partido Republicano (PR) e o Partido Socialista\nBrasileiro (PSB). Contudo, exerceu o mandato durante toda a legislatura,\nque se estendeu de fevereiro de 1955 a janeiro de 1959.\n\nNovamente candidato à reeleição no pleito de outubro de 1958, dessa vez\nna legenda da Frente Democrática Trabalhista, coligação do PTB e do PSD\ncom o Partido de Representação Popular (PRP), tornou a ficar na\nsuplência. Não mais retornou à Câmara, após deixá-la em janeiro de 1959.\n\nNo ano seguinte foi indicado como representante brasileiro do Instituto\nBrasileiro do Café (IBC) em Roma (Itália), onde permaneceu até 1962. De\nvolta ao Brasil, tornou-se responsável pelo setor jurídico do Centro de\nProcessamento de Dados do Estado do Rio de Janeiro, em Niterói (RJ).\nPermaneceu nessa chefia até 1968. Entre julho deste ano e agosto de\n1971, integrou o Conselho Administrativo da Defesa Econômica (CADE).\nAposentou-se depois que deixou o CADE.\n\nFaleceu na cidade do Rio de Janeiro, no dia 7 de julho de 1982.\n\nEra casado com Maria Aída Wücherer de Mendonça Braga, com quem teve três\nfilhos.\n\n \n\nFONTES: CÂM. DEP. *Deputados*; CÂM. DEP. *Deputados brasileiros*\n(1946-1967); CÂM. DEP. *Relação dos dep*.; CISNEIROS, A.\n*Parlamentares*; INF. FAM.; TRIB. SUP. ELEIT. *Dados* (1, 2, 3 e 4).\n\n \n","ref":"FONTES: CÂM. DEP. *Deputados*; CÂM. DEP. *Deputados brasileiros*\n(1946-1967); CÂM. DEP. *Relação dos dep*.; CISNEIROS, A.\n*Parlamentares*; INF. FAM.; TRIB. SUP. ELEIT. *Dados* (1, 2, 3 e 4).\n\n \n","dic":"DHBB"}
