{"title":"BRANCO, Celso","cargoss":["Deputado federal","Deputado federal"],"cargos_esp":[0,0],"datas_ini":[1960,1956],"datas_fim":[1963,1959],"estados":["SC","SC"],"autor":[0],"content":"**BRANCO, Celso**\n\n\\*dep. fed. SC 1956-1959 e 1960-1963.\n\n \n\n*Celso Ramos Branco* nasceu em Lajes (SC) no dia 7 de abril de 1909,\nfilho de José Rubens Branco e de Maria Clara Ramos Branco.\n\nFez o curso primário em sua cidade natal, onde também iniciou o\nginasial, concluído em 1929 no Colégio Catarinense, em Florianópolis. No\nano seguinte ingressou na Faculdade de Direito do Paraná,\nbacharelando-se em 1935. Foi promotor público da comarca de\nPrudentópolis (PR) e, em 1939, passou a advogar em Lajes, onde tornou-se\ndelegado regional de polícia, cargo que ocuparia até 1942. Após a\npromulgação da Constituição estadual, em julho de 1947, foi eleito\nvereador à Câmara Municipal de Lajes. No pleito de outubro de 1950\nelegeu-se deputado estadual na legenda da União Democrática Nacional\n(UDN) com 3.700 votos, iniciando seu mandato em 1º de fevereiro de 1951.\n\nEm outubro de 1954 concorreu às eleições para deputado federal por Santa\nCatarina, sempre na legenda da UDN, sendo eleito primeiro suplente com\n9.418 votos. Entre 1954 e 1956, no governo de Irineu Bornhausen, foi\nsecretário do Interior e Justiça do estado. Em fevereiro de 1956, quando\nJorge Lacerda deixou a Câmara dos Deputados para ocupar o governo\ncatarinense, Celso Branco assumiu o mandato como suplente, participando\nda Comissão de Serviço Público e de diversas comissões parlamentares de\ninquérito.\n\nNo pleito de outubro de 1958 elegeu-se segundo suplente de deputado\nfederal novamente pela UDN, com 12.476 votos. Em janeiro do ano seguinte\nencerrou o seu primeiro mandato na Câmara, retornando em julho de 1960\npara ocupar a cadeira vaga com a morte de Afonso Wanderley Júnior. Nessa\nsegundo mandato, foi membro das comissões de Legislação Social, de Minas\ne Energia, de Transportes e Comunicações e de Obras Públicas, exercendo\no mandato até o final da legislatura, em janeiro de 1963.\n\nFaleceu em Lajes no dia 14 de novembro de 1996.\n\nEra casado com Isolina Lamborgi Branco, com quem teve três filhos.\n\nEscreveu Da representação e mandado de segurança (1955).\n\n \n\n \n\nFONTES: CABRAL, O. Breve; CÂM. DEP. Deputados; CÂM. DEP. Deputados\nbrasileiros (1946-1967); Grande encic. Delta; INF. FAM.; SENADO. Dados.\n\n \n","ref":"FONTES: CABRAL, O. Breve; CÂM. DEP. Deputados; CÂM. DEP. Deputados\nbrasileiros (1946-1967); Grande encic. Delta; INF. FAM.; SENADO. Dados.\n\n \n","dic":"DHBB"}
