{"title":"BRANDÃO, Avelar","cargoss":["Arcebispo"],"cargos_esp":["Salvador"],"datas_ini":[1971],"datas_fim":[1986],"estados":[0],"autor":[0],"content":"**BRANDÃO, Avelar**\n\n\\*religioso; arceb. Salvador 1971-1986.\n\n \n\n*Avelar Brandão Vilela* nasceu em Viçosa (AL) no dia 13 de junho de\n1912, filho de Elias Brandão Vilela e de Isabel Brandão Vilela. Seu\nirmão Teotônio Vilela foi senador por Alagoas de 1967 a 1983. Seu primo,\nOtávio Brandão, foi líder comunista desde os primórdios da organização\ndo movimento no Brasil em 1922.\n\nEstudou no seminário de Aracaju, ordenando-se nessa mesma cidade em\noutubro de 1935. Desenvolveu ainda outras atividades no estado de\nSergipe, lecionando português, literatura luso-brasileira e psicologia\nno Colégio Estadual.\n\nEscolhido bispo de Petrolina (PE) em junho de 1946, foi sagrado em\noutubro do mesmo ano, tomando posse em dezembro como terceiro bispo\ndaquela cidade do sertão pernambucano. Criou em Petrolina a Escola de\nEconomia Doméstica, ampliou as instalações do Colégio Dom Bosco e\nconstruiu a praça Malan.\n\n \n\nArcebispo de Teresina\n\nEm novembro de 1955, dom Avelar Brandão foi feito arcebispo de Teresina,\ntomando posse em maio do ano seguinte. No decorrer da década de 1960, a\npar de sua atuação à frente da arquidiocese da capital piauiense,\ncomeçou a sobressair-se dentro da Conferência Nacional dos Bispos do\nBrasil (CNBB), entidade máxima da Igreja brasileira e principal\narticuladora de sua política no país, tendo participado de diversos\neventos religiosos no país e no exterior.\n\nNo final de 1964, durante a segunda sessão do Concílio Vaticano II,\nrealizada em Roma, foi escolhido primeiro vice-presidente da CNBB em\neleições que renovaram toda a direção da entidade. O resultado desse\npleito representou o afastamento dos bispos renovadores, liderados por\ndom Hélder Câmara, arcebispo de Olinda e Recife, um dos principais\ncargos da CNBB. Em outubro do ano seguinte, ainda em Roma, foi eleito\ndelegado da CNBB junto ao Conselho Episcopal Latino-Americano (Celam),\norganismo da Igreja sediado em Bogotá, na Colômbia, que congrega bispos\nde todos os países da América Latina, visando a uma ação evangélica e\npastoral comum. No mês seguinte foi eleito vice-presidente do Celam, em\nassembléia geral reunida na Santa Sé.\n\nEm outubro de 1966 presidiu o encontro do Celam realizado em Mar del\nPlata, na Argentina. O tema dessa reunião foi “A presença ativa da\nIgreja no desenvolvimento e na integração da América Latina”. Na\noportunidade, foi eleito por unanimidade presidente do organismo para\ncompletar o mandato que expiraria em 1967. Reeleito nesse ano presidente\ndo Celam para o biênio 1967-1968, ainda em 1967 presidiu a comissão que\nfez a entrega oficial dos documentos de Mar del Plata ao\nsecretário-geral da Organização das Nações Unidas (ONU), U Thant, e ao\npresidente da Organização dos Estados Americanos (OEA), em Nova Iorque.\nEntre 26 de agosto e 6 de setembro de 1968 presidiu também a II\nConferência Episcopal Latino-Americana (II Celam), realizada em Medelín,\nna Colômbia, tendo participado como moderador nos debates. Dessa reunião\nresultou um documento que lançou as bases para uma doutrina social da\nIgreja fundamentada na opção preferencial pelos pobres. Essa doutrina,\nconhecida como “teologia da libertação”, passou a exercer grande\ninfluência sobre o trabalho pastoral na América Latina.\n\nNo início dos anos 1970, durante o governo do general Emílio Garrastazu\nMédici (1969-1974), o regime militar intensificou a repressão, com a\nprática de torturas de presos políticos e detenções arbitrárias,\ninclusive de sacerdotes católicos, em resposta à luta armada iniciada\npelas organizações de esquerda. Em outubro de 1970, forças de segurança\ninvadiram o Instituto Brasileiro de Desenvolvimento (Ibrades), centro\njesuíta para treinamento de ativistas de escalão inferior, e detiveram\ndom Aluísio Lorscheider, secretário-geral da CNBB.\n\nEm decorrência de protesto da CNBB sobre o episódio do Ibrades, e por\nsugestão de Cândido Mendes de Almeida, assessor da entidade e\nex-secretário-geral da seção brasileira da Comissão Pontifícia Justiça e\nPaz, foi criado um fórum para discussão de temas como censura e\nrepressão, denominado Comissão Bipartite, com o objetivo central de\nevitar a deterioração das relações Igreja-Estado no país. Os encontros\nda comissão foram iniciados em novembro seguinte, no Rio de Janeiro, e\nreuniram a cúpula da Igreja Católica brasileira no período, representada\npor dom Avelar Brandão e pelos bispos dom Aluísio Lorscheider, dom Ivo\nLorscheiter e dom Lucas Moreira Neves, entre outras lideranças\nreligiosas, e oficiais das forças armadas, incluindo militares do\nServiço Nacional de Informações (SNI) e do Centro de Informações do\nExército (CIE), coordenados pelo chefe do Estado-Maior do Exército\n(EME), general Antônio Carlos da Silva Murici.\n\nOs grupos religioso e leigo da Comissão Bipartite centraram-se\ninicialmente na discussão do teor de documentos episcopais sobre\ndireitos humanos e desigualdades sociais. A tentativa de solucionar o\nconflito entre o ativismo das bases católicas, inspirado na teologia da\nlibertação, e a repressão justificada pela doutrina da segurança\nnacional manifestou-se desde o início dos encontros, em 3 de novembro,\nquando dom Avelar perguntou: “onde termina a justiça social e começa a\nsubversão?”. Mais tarde, a comissão seria utilizada pelos religiosos\npara a defesa dos direitos humanos, por intermédio da apresentação de\ndenúncias, bem como de exigências de informações sobre prisões, tortura\ne desaparecimento de presos políticos. Os encontros entre bispos e\nmilitares, no total de 24, estender-se-iam até agosto de 1974 e seriam\nmantidos em segredo até o ano de 1992, quando da divulgação de\ndepoimento e dos documentos pessoais do general Murici, e em 1996, em\npesquisa realizada pelo historiador norte-americano Kenneth Serbin.\n\nDom Avelar Brandão deixou Teresina em março de 1971, depois de quase 16\nanos nesse arcebispado, assumindo, em seguida, a arquidiocese de\nSalvador, em substituição a dom Eugênio Sales. Durante o longo período\nde permanência na capital piauiense, entre outras iniciativas e\nrealizações, participou da criação da Faculdade Católica de Filosofia do\nPiauí, da Escola de Odontologia e do projeto de criação da Universidade\nFundação do Piauí, para onde, posteriormente, foi transferida a\nFaculdade de Filosofia e seu patrimônio. Foi ainda, por dez anos,\npresidente da Campanha Nacional da Comunidade, seção do Piauí,\nimplantando 30 ginásios no estado. Fundou a Ação Social Arquidiocesana\n(ASA), através da qual foram criados dezenas de centros sociais,\nbeneficiando cerca de quatro mil alunos. Ainda no setor educacional,\nfundou diversas escolas de alfabetização em convênio com o Movimento de\nEducação de Base (MEB), espalhadas pelos municípios da arquidiocese.\nFundador da Rádio Pioneira de Teresina, defendeu a implantação do\nprojeto de colonização do vale do rio Gurguéia, revelando-se favorável à\nconstrução da usina hidrelétrica de Boa Esperança, no rio Parnaíba.\n\n \n\nArcebispo de Salvador\n\nDom Avelar Brandão tomou posse como 23º arcebispo de Salvador e primaz\ndo Brasil em 30 de maio de 1971, sendo reeleito ainda nesse ano\nvice-presidente da CNBB para um novo mandato de quatro anos. Nessa\ngestão presidiu as comissões de Ação Social, de Opinião Pública e\nNacional do Clero e o Serviço de Colaboração Apostólica Internacional\n(SCAI), organismo da CNBB. Em 1973 foi feito cardeal pelo papa Paulo VI\nno consistório de 5 de março, com os títulos de São Bonifácio e Santo\nAleixo.\n\nDesignado no início do ano seguinte vice-presidente do conselho geral da\nComissão Pontifícia para a América Latina (CAL), órgão que atua em\nestreita conexão com o Celam e cuja finalidade é dar assistência aos\nprogramas religiosos do continente, em novembro do mesmo ano concorreu à\npresidência da CNBB, sendo porém derrotado por dom Aluísio Lorscheider,\narcebispo de Fortaleza, que logrou reeleger-se. Ainda em 1974 tornou-se\nmembro da Sagrada Congregação para a Educação Apostólica, com sede no\nVaticano, sendo designado em janeiro do ano seguinte pelo papa Paulo VI\nconsultor da Comissão Pontifícia para a América Latina.\n\nAinda na década de 1970, diversos acontecimentos políticos no Brasil\nenvolvendo religiosos suscitaram manifestação pública de autoridades da\nIgreja. Por desenvolverem um trabalho pastoral cujo conteúdo de crítica\nsocial se apresentava mais explícito ou por adotarem um posicionamento\nclaro de apoio aos movimentos de reivindicação populares, muitos\nreligiosos foram alvo de acusações e de repressão. Dom Avelar procurou\nadotar sempre uma atitude moderada, ainda que crítica, em suas\ndeclarações sobre o governo. Em meados de 1976, os assassinatos dos\npadres João Bosco Penido Burnier, da prelazia de São Félix do Araguaia\n(MT), e de Rodolfo Lunkenbein, missionário que atuava entre os índios da\naldeia merure, também em Mato Grosso, ganharam dimensão nacional. O\nprimeiro teve origem nos protestos do padre Burnier contra as torturas\ninfligidas a duas mulheres pela polícia de Ribeirão Bonito (MT). O\nsegundo assassinato ocorreu quando o padre Lunkenbein efetuava a\ndemarcação das terras dos indígenas, tendo sido alvejado num tiroteio\nque também vitimou o chefe bororo Lourenço.\n\nNessa mesma época, dom Adriano Hipólito, bispo de Nova Iguaçu (RJ), foi\nseqüestrado por desconhecidos nas proximidades da sede da CNBB no Rio de\nJaneiro e ameaçado de morte. Pronunciando-se a respeito desses fatos,\ndom Avelar admitiu a possibilidade de haver setores da sociedade\n“incomodados com as posições assumidas por determinadas áreas da\nIgreja”, mas negou a existência de “qualquer tipo de infiltração\nmarxista entre o clero brasileiro”. Lamentando o que ocorrera em Mato\nGrosso e no Rio de Janeiro, atribuiu maior gravidade ao atentado sofrido\npelo bispo de Nova Iguaçu pela evidência de sua premeditação, enquanto o\nassassinato dos padres em Mato Grosso poderia ter resultado de um\nimpulso momentâneo. Ao mesmo tempo, reprovou a reação da população de\nRibeirão Bonito, que destruiu a cadeia onde ocorreram as agressões às\nmulheres.\n\nEm abril de 1977, quando setores da sociedade brasileira faziam críticas\nao regime de exceção em vigor desde a edição do Ato Institucional nº 5,\nem 13 de dezembro de 1968, e a oposição liberal acenava com propostas de\nredemocratização, dom Avelar defendeu a fixação de prazos definidos para\n“as forças armadas devolverem aos civis a responsabilidade de dirigir a\nnação”. Por outro lado, negou a existência de crise no relacionamento\nentre a Igreja e o Estado. Segundo o arcebispo, “a Igreja não quer ser o\nEstado, e o Estado não quer ser a Igreja”. Em maio desse mesmo ano,\nverbalizando a posição da Igreja em sua oração radiofônica diária,\ncriticou a política de planejamento familiar que o Brasil vinha\nadotando, a qual previa o emprego de dispositivos intra-uterinos e\npílulas anticoncepcionais.\n\nEm outubro de 1977, reafirmando sua posição moderada, dom Avelar foi\ncontrário à difusão, na Arquidiocese de Salvador, do documento Pela\njustiça e pela libertação, elaborado com o apoio da Arquidiocese de São\nPaulo. Esse documento, que denunciava as perseguições e agressões\ncometidas contra religiosos no exercício de seu trabalho pastoral, era\nsubscrito por várias entidades cristãs e leigas. Respondendo às críticas\nrecebidas pela sua decisão de não permitir a circulação desse documento\nem sua arquidiocese, o cardeal emitiu uma nota de esclarecimento na qual\nrechaçava “qualquer menção de desapreço” à Igreja de São Paulo, ao mesmo\ntempo em que afirmava sua independência em relação a qualquer tipo de\nmovimento particular. Dom Avelar ressaltava ainda o caráter “mais\npastoral do que político de sua atitude”, manifestando “a vontade de ver\no Brasil sair de seu impasse institucional sem açodamento”.\n\nEm fevereiro de 1978, quando a questão da anistia era tema de debates no\ncenário político nacional, o arcebispo defendeu em Salvador “a revisão\nimediata das sanções e penas imputadas a um grande número de brasileiros\nno período posterior a 1964, dentro de um processo gradualista que\nreconduzisse à reconciliação nacional”.\n\nEm 1979 participou como delegado brasileiro do III Celam, realizado\nentre janeiro e fevereiro em Puebla, no México, e que reuniu bispos\ndelegados de todos os países da América Latina. Os resultados dessa\nreunião foram esperados com grande expectativa devido à repercussão que\nnecessariamente teriam nos caminhos a serem seguidos nos trabalhos\npastorais. O arcebispo de Salvador se manifestou sempre em tom moderado\nnas declarações que antecederam o encontro, especialmente em suas\nreferências ao II Celam, reunido em Medellín. Embora reafirmando sua\nidentificação com os resultados daquele conclave, dom Avelar admitiu\nestar distanciado dos que enfatizavam seus aspectos ideológicos. Em\nlinhas gerais, as teses aprovadas em Medellín foram ratificadas em\nPuebla.\n\nEm julho do mesmo ano, pouco antes da votação do projeto de anistia —\nencaminhado ao Congresso Nacional pelo general João Batista Figueiredo,\nque assumira a presidência da República em março anterior —, dom Avelar\nrevelou-se favorável a uma “anistia total”. Dizendo-se sem elementos à\nmão para avaliar como iria ocorrer o retorno dos exilados ao Brasil,\nassegurou, no entanto, que “estava havendo um sinal positivo por parte\ndo governo” e que acreditava que estes, ao voltarem, “estivessem também\nmuito conscientes da responsabilidade que assumiam”.\n\nEm outubro de 1979 oficializou sua posição nos debates em torno da\npossível legalização do Partido Comunista Brasileiro (PCB), afirmando\nque entre comunismo e cristianismo há pontos claros e insofismáveis de\ndiscordância filosófica. Quanto à possível legalização do PCB, lembrou a\n“tendência atual das democracias” de “fazê-lo conviver com o corpo\nsocial”, deixando claro, porém, que, “no caso específico brasileiro, não\nse devia forçar esse caminho, em especial naquele momento de gradual\nredemocratização”.\n\nEm novembro seguinte, dom Avelar oficiou missa solene na\ncatedral-basílica de Salvador, a convite do governo baiano e dos\ncomandos militares sediados na cidade, em memória da revolta comunista\nde 1935. Na homilia proferida nessa ocasião, condenou o comunismo “ateu\nou não”, salientando ao mesmo tempo não acreditar que “o anticomunismo\npuro e simples” trouxesse “solução alguma para os problemas da\nhumanidade”. Para o arcebispo, não se tratava de “ser apenas contra”,\nmas sim de ser “a favor do homem, preocupando-se com todos os seus\nproblemas”. Para ele, o “grande desafio do Ocidente” seria “acabar com\nas marginalizações e bolsões de miséria”. Ainda em novembro de 1979 foi\nextinto o bipartidarismo, abrindo-se caminho para o retorno ao\npluripartidarismo e consolidando-se mais caracteristicamente o processo\nda redemocratização.\n\nPor ocasião da visita do papa João Paulo II, em julho de 1980, ao Brasil\n— e, em particular, à Bahia —, dom Avelar chamou atenção para o fato de\nque a mesma “não deveria render dividendos políticos aos governantes\nencarregados da recepção”. Observou ainda que “não seria digno qualquer\ntipo de movimento que pretendesse transformar João Paulo II em arauto de\nsuas idéias especiais e seus programas ideológicos”.\n\nNesse mesmo ano ocorreu o episódio da expulsão do país do padre italiano\nVítor Miracapillo, pároco da diocese de Palmares (PE). O motivo foi sua\nrecusa em celebrar missa comemorativa do dia nacional da Independência,\nalegando, entre outros fatores, “que o povo pobre e oprimido da região\nnão gozava de um mínimo de independência”. Nessa época, as relações\nentre Igreja e Estado no Brasil atravessavam uma fase de particular\ntensão, motivada pela divulgação do projeto do governo conhecido como\nEstatuto do Estrangeiro — um conjunto de normas reguladoras das\natividades públicas dos estrangeiros no Brasil —, que afetava, em\nespecial, a autonomia dos missionários religiosos. Dom Avelar\nmanifestou-se fortemente contrário tanto àquele estatuto quanto à\nexpulsão do padre Miracapillo, apontando, porém, “o caminho do diálogo\nentre governo e clero” como “a melhor forma de encaminhar a solução do\nproblema”. Em dezembro de 1980, em uma de suas orações dominicais, o\narcebispo de Salvador declarou-se temeroso em relação ao destino das\ncomunidades eclesiais de base (CEBs), no sentido de que estas haviam\npassado a constituir unicamente “grupos políticos com pouca consistência\neclesial e evangélica”. Ao contrário, pregou “a preservação da\nidentidade das CEBs com a índole da Igreja, a fim de se resguardarem das\ninfluências político-partidárias e ideológicas”.\n\nPor ocasião da divulgação, em janeiro de 1981, de uma entrevista\nbastante polêmica concedida por dom Valdir Calheiros, bispo de Volta\nRedonda (RJ), o cardeal arcebispo de Salvador manifestou-se favorável à\nliberdade de expressão dos membros da Igreja, não vendo na discordância\nde opinião entre estes “sinal de desunião ou de detrimento da unidade”.\nO cardeal refutou ainda as acusações de que o bispo de Volta Redonda\nteria defendido a luta armada como solução para os problemas do povo\nbrasileiro. Quanto ao apoio explícito que aquele bispo teria dado ao\nPartido dos Trabalhadores (PT) — partido político recém-criado,\ncongregando grande parte das principais novas lideranças sindicais —,\ndom Avelar lembrou “o direito de cada um de expor o seu pensamento e de\nfazer comentários sobre os problemas de interesse coletivo”.\n\nNo mês seguinte, ao comentar a condenação dos 13 ex-dirigentes sindicais\nencabeçados por Luís Inácio da Silva, o Lula, envolvidos nas greves dos\nmetalúrgicos ocorridas durante o ano anterior na região do ABC de São\nPaulo, o cardeal primaz do Brasil defendeu a revisão da Lei de Segurança\nNacional, declarando-se “a favor do direito de greve ao se esgotarem\ntodos os recursos de diálogo para uma solução pacífica”. Manifestou,\nporém, “confiança na sinceridade do presidente João Figueiredo e na\nmanutenção do processo de abertura democrática”.\n\nEm setembro de 1981, outro episódio envolveu religiosos estrangeiros com\na Justiça Militar. Os padres franceses Aristides Camio e Francisco\nGourion, da diocese de Conceição de Araguaia (PA), foram presos e\nresponsabilizados pelos conflitos ocorridos entre posseiros e agentes da\npolícia federal. O cardeal Avelar Brandão recusou-se a comentar a\ndecisão do Superior Tribunal Militar que negou o habeas-corpus impetrado\nem favor dos dois religiosos, afirmando “não ter elementos para um exame\ndetalhado da questão”. Nesse mesmo mês, ao final de uma reunião\nextraordinária do conselho presbiterial da Arquidiocese de Salvador, dom\nAvelar anunciou a intenção dessa arquidiocese de publicar uma cartilha\nde orientação política a ser incorporada ao trabalho pastoral.\n\nEm junho de 1982 defendeu a urgente reformulação da Constituição.\nReferiu-se na mesma ocasião à Lei dos Estrangeiros, que prejudicava\nreligiosos estrangeiros, esquecendo-se todo o bem feito por eles no\nBrasil. No seu entender, o texto da lei fora aprimorado pela CNBB, mas a\nsituação ainda era difícil, pelos excessos de segurança.\n\nEm setembro de 1983 pronunciou-se sobre o papel da Igreja no processo de\nconsultas que o presidente João Figueiredo efetuava no sentido de\norientar a sua sucessão. Na sua opinião, a Igreja deveria ser ouvida\npara a definição dos critérios que iriam presidir a escolha do sucessor.\n\nEm 15 de janeiro de 1985, Tancredo Neves foi eleito presidente da\nRepública pelo Colégio Eleitoral, sucedendo o general João Figueiredo.\nTancredo, contudo, adoeceu às vésperas da posse, assumindo o cargo o\nvice José Sarney, que, com a morte de Tancredo em 21 de abril, foi\nefetivado na presidência. Tinha início, assim, o governo da chamada Nova\nRepública e da transição para o regime democrático.\n\nDurante a 24ª Assembléia Geral da CNBB, realizada em abril de 1986 e\ntendo como tema central “As exigências cristãs de uma nova ordem\nconstitucional”, dom Avelar Brandão fez um apelo a todos os segmentos da\nsociedade brasileira para que fosse aceita a reforma agrária, visto que\ntratava-se de um plano moderado, pois, caso contrário, as conseqüências\nseriam sérias para o país. Dirigiu-se também ao presidente José Sarney,\npedindo o fim das milícias privadas de proprietários rurais e advertindo\nque elas poderiam se tornar, em pouco tempo, “um governo dentro do\ngoverno”. Quanto ao relacionamento entre Igreja e governo, afirmou que,\nnem a Igreja encampava o governo da Nova República, nem o governo se\naproveitava da Igreja, que não era ingênua para aceitar qualquer tipo de\ninstrumentalização. No encerramento do encontro, a CNBB divulgou um\ndocumento com reivindicações e sugestões do episcopado para a futura\nAssembléia Nacional Constituinte. No mês seguinte, comprometeu-se em\nnome da Igreja a se manter vigilante e, junto ao povo, elaborar\npropostas a serem encaminhadas aos constituintes, para que a\nConstituição não se tornasse obra de uma elite, mas o reflexo das\ngrandes aspirações das populações mais carentes.\n\nAs relações entre Igreja e governo tornaram-se críticas ainda em maio,\nquando dom Ivo Lorscheiter, presidente da CNBB, qualificou o governo de\n“fascista”. O presidente Sarney resolveu então antecipar sua visita ao\npapa João Paulo II, em um gesto político que foi interpretado como\nexpressão de seu descontentamento com a atuação da cúpula da CNBB e de\numa pequena parte do clero brasileiro.\n\nEm junho, dom Avelar Brandão anunciou o lançamento de uma cartilha para\norientar os cristãos sobre as eleições para a Assembléia Nacional\nConstituinte, marcadas para novembro. Reconheceu que a cartilha estava\nsendo divulgada num clima desfavorável, quando havia uma tendência de se\natacar a Igreja de forma irresponsável, em função do apoio desta à\nreforma agrária. No mês seguinte, durante a primeira reunião do grupo de\ntrabalho encarregado de elaborar propostas para conter a violência no\npaís, no Ministério da Justiça, dom Avelar Brandão reforçou seu pedido\npor uma reforma agrária realista e abrangente, conjugada a uma ação\ngovernamental prudente, segura e eficaz. Advertiu ainda que a simples\npregação da paz sem a justiça poderia esclerosar as legítimas aspirações\ndo povo de Deus, em marcha pelos caminhos da história.\n\nEm agosto, dirigindo-se ao presidente Sarney, declarou que ao Estado\ncabia a missão de desenvolver o bem público e à Igreja, a missão\nreligiosa de ser a consciência ética da sociedade. Respeitar esses\nlimites, segundo o arcebispo, seria a maneira de evitar confusão de\ncompetências.\n\nEm setembro viajou a Recife, convidado pelo sociólogo Gilberto Freire,\npara fazer uma conferência na Fundação Joaquim Nabuco sobre o tema\n“Igreja e mudança social”. Defendeu a teologia da libertação,\nqualificando-a de legítima, válida, necessária e oportuna, porém,\nobservou que duas condições tinham sido estabelecidas pela Igreja: o\nconteúdo das propostas deveria ser orientado pela doutrina social da\nIgreja, assim como os métodos de análise social e de ação programática\ndeveriam evitar toda e qualquer ambigüidade com outros métodos que\npudessem conduzir o processo à violência armada, à eliminação das\nliberdades individuais ou ainda à concentração absoluta do poder.\n\nFaleceu em Salvador no dia 19 de dezembro de 1986. Foi substituído, no\narcebispado de Salvador, por dom Lucas Moreira Alves.\n\nSeu sobrinho Teotônio Vilela Filho, a exemplo do pai, também seguiu a\ncarreira política. Tornou-se constituinte (1987-1988) e senador por\nAlagoas a partir de 1987.\n\n \n\n \n\nFONTES: CONFERÊNCIA NAC. BISPOS DO BRASIL; *Estado de S. Paulo*\n(20/1/81, 21/6 e 21/12/86, 3/3/96); ESTADO MAIOR EXÉRC. *História*;\n*Folha de S. Paulo* (16/8/83, 11/4 e 7/7/86, 7/6/98); GARDEL, L.\n*Armoiries*; *Globo* (18/9/83, 9/5 e 23/8/86); *Grande encic. Delta*;\n*IstoÉ* (23/6/82); *Jornal do Brasil* (17/1/75, 12, 22 e 28/10/76, 17/5\ne 1/10/77, 10/6, 12/9, 14, 27/11 e 13/12/78, 16/2, 24/10 e 2/12/79,\n19/5, 9/11 e 5/12/80, 5/1, 12/2, 27/3, 10/4, 22/6 e 14/7/81, 17/9/86);\nMATOS, J. *Perfis*; *Veja* (2/11/77, 20/12/78).\n\n \n","ref":"FONTES: CONFERÊNCIA NAC. BISPOS DO BRASIL; *Estado de S. Paulo*\n(20/1/81, 21/6 e 21/12/86, 3/3/96); ESTADO MAIOR EXÉRC. *História*;\n*Folha de S. Paulo* (16/8/83, 11/4 e 7/7/86, 7/6/98); GARDEL, L.\n*Armoiries*; *Globo* (18/9/83, 9/5 e 23/8/86); *Grande encic. Delta*;\n*IstoÉ* (23/6/82); *Jornal do Brasil* (17/1/75, 12, 22 e 28/10/76, 17/5\ne 1/10/77, 10/6, 12/9, 14, 27/11 e 13/12/78, 16/2, 24/10 e 2/12/79,\n19/5, 9/11 e 5/12/80, 5/1, 12/2, 27/3, 10/4, 22/6 e 14/7/81, 17/9/86);\nMATOS, J. *Perfis*; *Veja* (2/11/77, 20/12/78).\n\n \n","dic":"DHBB"}
