{"title":"BRANT, Vinícius Caldeira","cargoss":["Presidente da União Nacional dos Estudantes"],"cargos_esp":[0],"datas_ini":[1962],"datas_fim":[1963],"estados":[0],"autor":[0],"content":"**BRANT, Vinícius Caldeira**\n\n\\*pres. UNE 1962-1963.\n\n \n\n*Vinícius José Nogueira Caldeira Brant* nasceu em Belo Horizonte no dia\n23 de março de 1941, filho de Leônidas Vinícius Caldeira Brant e de\nNeusa Nogueira Caldeira Brant, descendente de uma tradicional família\nmineira. Seu tio-avô Augusto Mário Caldeira Brant foi deputado federal\npor Minas Gerais de 1921 a 1922, participou das revoluções de 1930 e\n1932, foi presidente do Banco do Brasil entre 1930 e 1931 e novamente\nfoi deputado federal na Constituinte de 1946 e de 1946 a 1951.\n\nCursou o primário no Colégio São Paulo e o secundário no Colégio\nEstadual de Minas Gerais, ambos em sua cidade natal, e ingressou em\nseguida na Faculdade de Ciências Econômicas da Universidade de Minas\nGerais. Neste período, participou ativamente de movimentos sociais e\npolíticos, tendo sido assessor de sindicatos operários e de associações\nde bairro, além de participar da formação das Ligas Camponesas. Também\ncolaborou em diversos órgãos da imprensa local, com artigos, traduções e\nreportagens. Foi presidente da Liga da Juventude Trabalhista, ligada ao\nPartido Trabalhista Brasileiro (PTB), e posteriormente ajudou a formar o\nMovimento Revolucionário Tiradentes (MRT), ligado às Ligas Camponesas.\n\nNo movimento estudantil atuou na Juventude Estudantil Católica (JEC) e\nna Juventude Universitária Católica (JUC). Em julho de 1962 foi eleito\npresidente da União Nacional dos Estudantes (UNE) por ocasião do seu XXV\nCongresso, sucedendo a Aldo Arantes (1961-1962). Iniciou sua gestão no\nmês seguinte e procurou dar continuidade à greve iniciada em junho, com\no objetivo de obter a participação plural dos estudantes, com direito a\nvoto, nos órgãos colegiados de decisão das universidades, na base de\n1/3. A chamada “greve de 1/3” já se estendia por dois meses, em pleno\nclima de radicalização das tensões políticas que marcaram o governo do\npresidente João Goulart (1961-1964). Ainda em agosto de 1962, diante do\nagravamento da crise política nacional, a diretoria da UNE convocou um\nconselho extraordinário que deliberou pela suspensão da greve. Apesar\ndas tensões e do desgaste que provocou, a greve chegou a obter vitórias\nparciais, ficando consagrado o direito de representação plural nos\nórgãos colegiados em todas as universidades e faculdades do país e tendo\na proporção de 1/3 em algumas delas.\n\nSua gestão à frente da UNE, ao lado de dar continuidade à campanha pela\nreforma universitária, associou-se ao movimento mais geral pelas então\nchamadas “reformas de base”, integrando-se numa corrente mais ampla que\nveio a congregar sindicatos, parlamentares nacionalistas, militares\nprogressistas e outros segmentos de esquerda, constituindo, em 1963, a\nFrente de Mobilização Popular. Ainda esse ano, participou da reunião,\nrealizada em Salvador, de fundação da Ação Popular (AP), organização\npolítica de natureza não-confessional embora com predominância de\nmilitantes católicos, cuja orientação definiu-se desde logo como\nrevolucionária de esquerda. Em julho de 1963, durante o XXVI Congresso\nda UNE, passou a presidência para José Serra (1963-1964).\n\nCompletando suas graduações em sociologia, política e administração\npública, em fevereiro de 1964 viajou para a Europa, fixando-se em Paris,\nonde fez cursos de pós-graduação na École Pratique des Hautes Études, ao\nmesmo tempo que colaborou em pesquisas no Centre National de la\nRecherche Scientifique (CNRS). Com o movimento político-militar de março\ndeste ano, que depôs o presidente João Goulart, passou a atuar,\nparalelamente às atividades acadêmicas, em articulações de apoio\ninternacional às atividades da resistência democrática brasileira.\nParticipou, em 1965, como observador convidado do Seminário\nAfro-Asiático em Argel, no ano seguinte, como delegado da Conferência\nTricontinental e em 1967 da Conferência da Organização Latino-Americana\nde Solidariedade (OLAS), estas duas últimas realizadas em Havana, Cuba.\n\nEm setembro de 1967 retornou ao Brasil, passando a atuar nos movimentos\nde resistência ao regime militar. Inicialmente integrou-se à AP, da qual\nse desligou alguns meses depois em virtude de divergências de orientação\npolítica, vindo a participar, em 1968, da criação do Partido\nRevolucionário dos Trabalhadores (PRT). De setembro de 1970 a outubro de\n1973, permaneceu preso no Rio de Janeiro e em São Paulo.\n\nConvidado pelo sociólogo e então presidente do Centro Brasileiro de\nAnálise e Planejamento (Cebrap), Fernando Henrique Cardoso, em janeiro\nde 1974 começou a trabalhar como pesquisador associado desta\ninstituição, na qual viria a ocupar o cargo de coordenador de pesquisas\ne programas e, em 1983, o de membro do Conselho de Orientação\nCientífica. Em 1976 foi um dos sócios-fundadores do Centro de Estudos de\nCultura Contemporânea (Cedec), em São Paulo.\n\nEm 1979 foi um dos fundadores do Partido dos Trabalhadores (PT), em cuja\nlegenda concorreu a uma cadeira na Câmara de Vereadores de São Paulo no\npleito de novembro de 1982, obtendo apenas uma suplência. No ano\nseguinte, foi eleito presidente da Associação Profissional dos\nSociólogos do Estado de São Paulo, que posteriormente se transformaria\nno Sindicato dos Sociólogos do Estado de São Paulo, o qual também\npresidiria entre 1986 e 1989. Ainda em 1983, participou da fundação da\nCentral Única dos Trabalhadores (CUT).\n\nEm 1992, foi aprovado em concurso para professor titular do Departamento\nde Sociologia e Antropologia da Universidade Federal de Minas Gerais\n(UFMG), mudando-se para Belo Horizonte. Ali, além de ministrar aulas nos\ncursos de graduação e de pós-graduação, orientar teses e participar de\npesquisas, criou o Grupo de Pesquisa em Sociologia do Trabalho e\ndedicou-se à montagem de um banco de dados sobre o trabalho no Brasil.\n\nFaleceu em São Paulo no dia 25 de maio de 1999, dias após uma\nintervenção cirúrgica no Hospital das Clínicas, decorrente da descoberta\nde um câncer no estômago.\n\nFoi casado e teve uma filha.\n\nPublicou muitos artigos e vários livros sobre temas ligados à sociologia\ndo trabalho, editados em português, espanhol, francês e inglês, entre\neles a trilogia coordenada a pedido da Comissão de Justiça e Paz de São\nPaulo, *São Paulo 1975: crescimento e pobreza*, *São Paulo: o povo em\nmovimento*, e *São Paulo: trabalhar e viver*, *Paulínia: petróleo e\npolítica* (1990) e a tese *O trabalho encarcerado* (1994).\n\n \n\nFONTES: BRANT, V. *Tributo*; *Globo* (26/5/99); INF. BIOG.; POERNER, A.\n*Poder*; *Veja* (30/5/79).\n\n \n","ref":"FONTES: BRANT, V. *Tributo*; *Globo* (26/5/99); INF. BIOG.; POERNER, A.\n*Poder*; *Veja* (30/5/79).\n\n \n","dic":"DHBB"}
