{"title":"ALBUQUERQUE, José Lins de","cargoss":["Deputado federal"],"cargos_esp":[0],"datas_ini":[1983],"datas_fim":[1984],"estados":["AM"],"autor":[0],"content":"**ALBUQUERQUE, José Lins de**\n\n\\* dep. fed. AM 1983-1984.\n\n* *\n\n*José de Jesus Lins de Albuquerque* nasceu em Fonte Boa (AM) no dia 15\nde março de 1948, filho de Belarmino Gomes de Albuquerque e de Naide\nLins de Albuquerque. Seu irmão Átila Lins de Albuquerque foi deputado\nfederal pelo Amazonas eleito em 1990 e reeleito em 1994 e 1998.\n\nMédico, formou-se pela Faculdade de Medicina do Estado do Amazonas, com\npós-graduação em administração hospitalar.               \n\nIniciou sua carreira política filiando-se ao Partido Democrático Social\n(PDS), em cuja legenda foi eleito deputado federal pelo Amazonas nas\neleições de 15 de novembro de 1982. Assumindo sua cadeira na Câmara dos\nDeputados em fevereiro do ano seguinte, tornou-se membro titular da\nComissão de Trabalho e Legislação Social e suplente da Comissão de\nSaúde.\n\nNo início dessa legislatura, o deputado Dante de Oliveira (PMDB-MT)\napresentou projeto de emenda constitucional que restabelecia as eleições\ndiretas para presidente da República no ano seguinte. Encampado pelas\noposições, o projeto desencadeou uma campanha nacional que ficou\nconhecida como Diretas Já. Na sessão da Câmara dos Deputados de 25 de\nabril de 1984, o deputado José Lins de Albuquerque votou contra a emenda\nDante de Oliveira, que acabou não sendo aprovada por falta de 22 votos,\nfato que impediu seu envio para apreciação do Senado.\n\nCom esse resultado, ficou estabelecido que seria eleito pelo pleito\nindireto o presidente da República que substituiria João Figueiredo\n(1979-1985). A falta de consenso para escolher seus candidatos, entre os\nvários postulantes à condição de candidato oficial, causou uma cisão no\npartido do governo e os dissidentes formaram a Frente Liberal. Para\nresolver o impasse, o PDS realizou sua convenção em agosto seguinte, na\nqual o deputado Paulo Maluf derrotou o então ministro do Interior Mário\nAndreazza. Na mesma oportunidade, o deputado cearense Flávio Marcílio\nvenceu o então governador de Alagoas Divaldo Suruagi e se tornou o\ncandidato a vice de Maluf.\n\nPara concorrer com os candidatos da situação, os partidos de oposição,\ncom exceção do Partido dos Trabalhadores (PT), liderados pelo PMDB, e a\nFrente Liberal, reunidos na Aliança Democrática, lançaram o governador\nde Minas Gerais Tancredo Neves e o ex-presidente do PDS e senador pelo\nMaranhão José Sarney como seus respectivos candidatos a presidente e a\nvice-presidente da República. Porém, em novembro de 1984, José Lins\nrenunciou ao mandato de deputado federal por ter sido nomeado\nconselheiro do Tribunal de Contas de Manaus, fato que impediu sua\nparticipação no Colégio Eleitoral de 15 de janeiro de 1985 que elegeria\nTancredo Neves para a presidência da República. Sua cadeira na Câmara\ndos Deputados foi ocupada pelo suplente Ubaldino Meireles.\n\nJosé Lins de Albuquerque foi diretor de fiscalização orçamentária do\nTribunal de Contas do Estado do Amazonas, diretor do Hospital Getúlio\nVargas em Manaus e coordenador da assistência hospitalar de seu estado.\nFoi ainda presidente do Instituto de Previdência do Amazonas,\nsubsecretário e secretário de saúde do estado.\n\nFaleceu em Manaus no dia 17 de fevereiro de 1996.\n\nEra casado com Maria de Nazaré Rocha de Albuquerque, com quem teve três\nfilhos.\n\n \n\nFONTES: CÂM. DEP. *Deputados brasileiros. Repertório* (1983-1987);\n*Globo* (26/4/84).\n\n \n","ref":"FONTES: CÂM. DEP. *Deputados brasileiros. Repertório* (1983-1987);\n*Globo* (26/4/84).\n\n \n","dic":"DHBB"}
