{"title":"BRASIL, Nestor Penha","cargoss":["Revolucionário ou revoltoso","Comandante do III Exército","Chefe do Departamento de Produção e Obras"],"cargos_esp":[0,0,0],"datas_ini":[1932,1961,1962],"datas_fim":[1932,1962,1963],"estados":[0,0,0],"autor":[0],"content":"**BRASIL, Nestor Penha**\n\n\\*militar; rev. 1932; comte. III Ex. 1961-1962; ch. Depto. Prod. e Obras\nEx. 1962-1963.\n\n \n\n*Nestor Penha Brasil* nasceu no Rio de Janeiro, então Distrito Federal,\nno dia 13 de maio de 1900, filho de Zaqueu Penha Brasil e de Maria\nCatarina de Faria Penha Brasil.\n\nSentou praça em fevereiro de 1917, ingressando na Escola Militar do\nRealengo, no Rio, de onde saiu aspirante-a-oficial da arma de artilharia\nem dezembro de 1919. Em fevereiro do ano seguinte passou a servir no 1º\nGrupo de Artilharia a Cavalo, sediado em Itaqui (RS), e ainda em abril\nde 1920 foi promovido a segundo-tenente. Transferido para o 4º Regimento\nde Artilharia Montada, localizado em Itu (SP), em março de 1921, em maio\nseguinte recebeu a patente de primeiro-tenente. Permaneceu****em Itu até\njaneiro de 1922 e entre junho do ano seguinte e março de 1925 serviu\nna****Vila Militar, no Rio.\n\nDepois de fazer o curso da Escola de Aperfeiçamento de Oficiais entre\nmarço e dezembro de 1925, foi designado para participar das operações de\nrepressão à Coluna Prestes, movimento rebelde formado em abril desse ano\ne liderado por Luís Carlos Prestes e Miguel Costa. Tomou parte na\nperseguição movida pelas tropas legais à coluna, tendo passado os três\nprimeiros meses de 1926 no Nordeste do país. Retornando ao Rio, no final\nde março de 1926 iniciou o curso da Escola de Estado-Maior e em outubro\ndo ano seguinte passou a capitão. Concluindo o curso da Escola de\nEstado-Maior em novembro de 1928, em janeiro do ano seguinte foi\ndesignado professor-estagiário e auxiliar de ensino da mesma escola.\nPosicionou-se contra a Revolução de 1930, movimento que resultou na\ndeposição do presidente Washington Luís (24/10/1930) e na posse de\nGetúlio Vargas na chefia do Governo Provisório (3/11/1930).\n\nDeixando a Escola de Estado-Maior em abril de 1932, em julho seguinte\ndesertou do Exército para apoiar a Revolução Constitucionalista de São\nPaulo, movimento armado de oposição a Getúlio e que lutava pela\nreconstitucionalização do país. Com a derrota dos paulistas em início de\noutubro de 1932, foi punido pelas autoridades militares, sendo reformado\nadministrativamente em agosto de 1933. Retornando ao serviço ativo em\njaneiro de 1934, serviu em Juiz de Fora (MG), na 4ª Região Militar, no\nquartel-general da 4ª Divisão de Infantaria (4ª DI), entre junho e\nsetembro desse ano. Adjunto do estado-maior da inspetoria do 2º Grupo de\nRegiões Militares, sediado em Porto Alegre, de setembro de 1934 a maio\nde 1935, exerceu cumulativamente****—****entre janeiro e maio de 1935 —\na chefia da 4ª Divisão do Departamento Militar e o cargo de instrutor de\nartilharia antiaérea.\n\nEm julho****de 1935 tornou-se oficial-de-gabinete do ministro da Guerra,\ngeneral João Gomes Ribeiro Filho, e em setembro desse mesmo ano foi\npromovido a major. Deixou o Ministério da Guerra em outubro de 1936,\nseguindo para Paris, onde cursou a Escola Superior de Guerra. Retornando\nao Brasil em novembro de 1938, voltou a integrar os quadros da Escola de\nEstado-Maior em****dezembro de 1939, como instrutor do curso de\nartilharia. Deixou essa função em dezembro de 1941 e nesse mesmo mês\nrecebeu a patente de tenente-coronel.\n\nDurante o ano de 1942 exerceu diversos cargos na Escola de Estado-Maior:\nsubdiretor de ensino no mês****de janeiro, instrutor-chefe de tática\ngeral e estado-maior entre janeiro e junho e instrutor-chefe do segundo\nano da escola de julho a novembro. Entre dezembro de 1942 e junho de\n1943 comandou o 7º Grupo de Artilharia, sediado em Olinda (PE). Com a\nconstituição da 1ª Divisão de Infantaria Expedicionária (1ª DIE) em\nagosto de 1943, o governo brasileiro definiu sua participação na Segunda\nGuerra Mundial (1939-1945) ao lado dos países aliados. Penha Brasil\nintegrou o terceiro grupo de Artilharia Divisionária da 1ª DIE,\nconhecida como Força Expedicionária Brasileira (FEB). Durante essa fase\nde estruturação, a exemplo de vários oficiais brasileiros, foi enviado\naos Estados Unidos para fazer cursos em bases militares\nnorte-americanas, retornando ao Brasil no final de outubro. Ainda em\n1943, criou e organizou o Núcleo de Formação e Treinamento de\nPára-Quedistas do Exército.\n\nEntre janeiro e junho de 1944 foi chefe da 3ª Seção do Estado-Maior da\nArtilharia Divisionária da FEB. Designado em julho seguinte para a\nchefia do Estado-Maior daquela unidade, em 22 de****setembro embarcou\npara a Itália, integrando o 2º Escalão, comandado pelo general Osvaldo\nCordeiro de****Farias. Em novembro de 1944**,**já no teatro de\noperações, voltou a chefiar a 3ª Seção do Estado-Maior, função que\ndesempenhou até abril de 1945. Neste último mês, foi designado subchefe\ndo Estado-Maior, cargo que exerceu até seu retorno ao Brasil, em junho\nde 1945. Nesse mesmo mês, foi promovido a coronel e entre setembro e\nnovembro seguintes esteve na Europa, a convite do governo\nnorte-americano.\n\nComandante do Núcleo de Formação e Treinamento de Pára-Quedistas do\nExército entre março de 1946 e dezembro de 1948, no mês seguinte assumiu\no comando da Escola de Pára-Quedistas. Ainda em janeiro de 1949,\nconcluiu o curso de pára-quedismo, obtendo o registro de pára-quedista\nmilitar. Permaneceu à frente da escola até agosto de 1952, mês em que\nfoi promovido a general-de-brigada. Em abril de 1953, tornou-se\ncomandante do Núcleo da Divisão Aeroterrestre e entre julho e dezembro\ndo ano seguinte exerceu cumulativamente o comando da Guarnição da Vila\nMilitar. Deixou o Núcleo da Divisão Aeroterrestre em fevereiro de 1955 e\nnesse mesmo mês iniciou o curso superior de guerra da Escola Superior de\nGuerra (ESG), que concluiu em novembro de 1955. Neste último\nmês****assumiu o comando da Artilharia Divisionária da 2ª DI, sediada em\nSão Paulo, e, em julho de 1956, tornou-se comandante dessa mesma DI. Em\nabril de 1958 foi promovido a general-de-divisão e em janeiro do ano\nseguinte foi transferido para o Rio de Janeiro, tornando-se diretor da\nArtilharia de Costa e Artilharia Antiaérea. Permaneceu nesse cargo até\noutubro de 1961, quando assumiu o comando do III Exército, sediado em\nPorto Alegre, substituindo o general José Machado Lopes. Em junho de\n1962 passou o comando ao general Jair Dantas Ribeiro e no mês seguinte\ntornou-se chefe do Departamento de Produção e Obras do Exército, no\nlugar do general Otacílio Terra Ururaí. Ainda em agosto de 1962 foi\npromovido a general-de-exército e, em janeiro do ano seguinte deixou o\ndepartamento passando a presidir a Comissão Militar Mista Brasil-Estados\nUnidos.\n\nDurante sua carreira militar fez ainda o curso de observação e\nartilharia para oficiais superiores nos Estados Unidos, chegando a\nmestre de salto pára-quedista, título alcançado em Fort Still, em\nOklahoma.\n\nFaleceu no Rio de Janeiro no dia 21 de maio de 1964, sendo\npromovido*post mortem* ao posto de marechal, em 22 de junho do mesmo\nano.\n\nEscreveu vários livros técnicos sobre tática de artilharia, tática geral\ne organização de grandes unidades.\n\n \n\n \n\nFONTES: ARQ. MIN. EXÉRC.; CORRESP. SECRET. GER. EXÉRC.; *Jornal do\nComércio,*Rio (22/5/64); *Rev. Inst. Hist. Geog.* *Bras.*\n\n \n","ref":"FONTES: ARQ. MIN. EXÉRC.; CORRESP. SECRET. GER. EXÉRC.; *Jornal do\nComércio,*Rio (22/5/64); *Rev. Inst. Hist. Geog.* *Bras.*\n\n \n","dic":"DHBB"}
