{"title":"BRITO, Flávio","cargoss":["Presidente de associação ou confederação de empregados ou empregadores","Senador","Senador"],"cargos_esp":["CNA",0,0],"datas_ini":[1967,1969,1967],"datas_fim":[1987,1975,1968],"estados":[0,"AM","AM"],"autor":[0],"content":"**BRITO, Flávio**\n\n\\*pres. CNA 1967-1987; sen. AM 1967-1968, 1969-1975.\n\n \n\n*Flávio da Costa Brito* nasceu em Manaus no dia 1º de outubro de 1914,\nfilho de José Ramalho de Brito e de Helena da Costa Brito.\n\nEmpresário agrícola, Flávio Brito passou a fazer parte, em 1955, da\nComissão Federal de Abastecimento e Preços (Cofap). Em 1957, foi nomeado\nintegrante da Comissão Nacional de Agricultura e incumbido de\nrepresentar a União Nacional das Cooperativas (Unasco) na Comissão\nNacional de Política Agrária, ambas vinculadas ao Ministério da\nAgricultura. No ano seguinte, ingressou na Comissão Permanente de\nCooperativismo e assumiu a presidência da União das Cooperativas do\nentão Distrito Federal, no Rio de Janeiro.\n\nEm 1961, foi nomeado representante da lavoura no conselho consultivo do\nInstituto Nacional de Imigração e Colonização (INIC) e eleito presidente\ndo conselho nacional do Serviço Social Rural. Tornou-se, em 1962,\ndiretor da Confederação Rural Brasileira e, um ano depois,\ndiretor-técnico da Sociedade Nacional de Agricultura (SNA), cargos que\nocuparia até 1967. Em 1964, representou a SNA junto ao Conselho Nacional\nConsultivo da Agricultura. Membro do conselho consultivo da Aliança\nBrasileira de Cooperativas a partir de 1965, foi nomeado pelo presidente\nHumberto Castelo Branco (1964-1967), ainda nesse ano, para integrar o\nconselho técnico do Instituto Brasileiro de Reforma Agrária (IBRA), no\nqual permaneceria****até 1969.\n\nNo pleito de 15 de novembro de 1966, compôs como suplente a chapa\nencabeçada por Álvaro Maia, candidato da Aliança Renovadora Nacional\n(Arena), partido de suporte institucional ao regime militar instaurado\nno país em abril de 1964, que conquistou uma vaga no Senado pelo\nAmazonas. Durante a legislatura, iniciada em fevereiro de 1967, Flávio\nBrito cumpriu interinamente o mandato entre junho desse ano e janeiro do\nano seguinte, voltando ao Senado de maio a dezembro de 1968.\n\nEleito para a presidência da Confederação Nacional da Agricultura (CNA)\nainda em 1967, iniciou longa permanência à frente da entidade, à qual\nseria reconduzido sucessivas vezes para mandatos de três anos. Em 1969,\nassumiu também a presidência da Fundação Coopercotia, situada na cidade\nde Cotia (SP).\n\nCom a morte de Álvaro Maia em novembro de 1969, Flávio Brito passou a\nocupar, em caráter efetivo, uma das cadeiras arenistas no Senado,\nassumindo, no ano seguinte, a presidência da Comissão de Agricultura da\nCasa. Designado pelo presidente Emílio Garrastazu Médici (1969-1974),\nrepresentou o Brasil na 54ª sessão da Conferência Internacional do\nTrabalho realizada em Genebra, na Suíça.\n\nVice-presidente da Comissão de Segurança Nacional do Senado entre 1971 e\n1972, membro da mesa diretora da III Conferência Nacional das Classes\nProdutoras (Conclap), realizada em 1972 no Rio de Janeiro, vice-líder da\nArena no Senado em 1973 e 1974, Flávio Brito não conseguiu renovar\nseu****mandato no pleito de 15 de novembro de 1974, sendo derrotado por\nEvandro Carreira, candidato do Movimento Democrático Brasileiro (MDB),\npartido de oposição ao regime militar.\n\nEm setembro de 1976, na condição de presidente da CNA, teve uma\naudiência com o presidente Ernesto Geisel (1974-1979) na qual acusou\nbispos da Igreja Católica e missionários indigenistas, ligados à\nConferência Nacional dos Bispos do Brasil (CNBB), de estarem “levando\nverdadeiro tumulto ao campo, jogando empregados contra empregadores e\nincentivando posseiros profissionais a invadirem propriedades,\nprincipalmente nos estados do Acre, Pará e Mato Grosso”. Disse ainda ao\npresidente da República que “no clero também [havia] comunistas, assim\ncomo entre os apóstolos existia um judas”, e sugeriu que os órgãos de\ninformação do governo apurassem as denúncias que trazia, capazes,\nsegundo ele, de caracterizar “verdadeira agitação no meio rural”.\n\nFlávio Brito declarou, em novembro de 1977, que “a retenção e o corte\nnas linhas de crédito rural fizeram com que todo o setor registrasse uma\naguda descapitalização, principalmente nas áreas pioneiras, como a\nAmazônia, que exigiu grandes investimentos particulares. O corte no\ncrédito veio também agravar os problemas sociais do homem do campo,\nhavendo choques constantes entre patrões e empregados”, ressaltou.\n\nTendo conquistado novos mandatos trienais de presidente da CNA em agosto\nde 1979 e em agosto de 1982, candidatou-se novamente à reeleição em\njulho de 1985, ocasião em que foi derrotado, por apenas um voto de\ndiferença, por Alysson Paulinelli, que fora ministro da Agricultura do\npresidente Ernesto Geisel (1974-1979). Insatisfeito com o resultado,\nBrito recorreu à Justiça do Trabalho contra a impugnação dos votos dos\ndelegados do Rio de Janeiro e Espírito Santo que lhe garantiriam a\nvitória. Apesar de o recurso não ter sido acatado, acabou permanecendo à\nfrente da entidade patronal.\n\nDurante o seminário de Reforma e Justiça Agrárias, em agosto seguinte,\ndeclarou que o Plano Nacional de Reforma Agrária era “um monstrengo de\nlei” que o governo pretendia impingir. Elaborado pelo Instituto Nacional\nde Colonização e Reforma Agrária (Incra) sem ouvir os representantes das\nsociedades agrícolas, o documento, protestou, resultaria na\nregulamentação da profissão de “invasores de terras”. Todavia, em\nsetembro, ao ser empossado em seu novo mandato, em cerimônia que contou\ncom a presença do presidente da República José Sarney (1985-1990),\nFlávio Brito assumiu outra postura e declarou que apoiaria o governo na\nimplantação da reforma agrária.\n\nTendo deixado a presidência da CNA em dezembro de 1987, quando foi\nsubstituído por Alysson Paulinelli, em janeiro do ano seguinte foi\nacusado, juntamente com o ex-secretário de Agricultura da Paraíba, Elzir\nNogueira Matos, e o presidente da Federação da Agricultura do Amazonas,\nEurípedes Ferreira Lins, de desviar verba da CNA. As acusações foram\nbaseadas em auditoria realizada pelo Ministério do Trabalho, que\nconstatou várias irregularidades.\n\nFlávio Brito faleceu em Brasília em abril de 1999.\n\n \n\nFONTES: *Estado de S. Paulo* (14/3 e 11/9/85 e 15/1/86); *Folha de S.\nPaulo* (17/7 e 1/8/85); *Globo* (11/1/86); INF. BIOG.; *Jornal do\nBrasil* (16 e 17/7/85 e 28/7/88).\n\n \n","ref":"FONTES: *Estado de S. Paulo* (14/3 e 11/9/85 e 15/1/86); *Folha de S.\nPaulo* (17/7 e 1/8/85); *Globo* (11/1/86); INF. BIOG.; *Jornal do\nBrasil* (16 e 17/7/85 e 28/7/88).\n\n \n","dic":"DHBB"}
