{"title":"BRITO, Gratuliano","cargoss":["Interventor","Deputado federal"],"cargos_esp":[0,0],"datas_ini":[1932,1935],"datas_fim":[1934,1937],"estados":["PB","PB"],"autor":[0],"content":"**BRITO, Gratuliano**\n\n\\*interv. PB 1932-1934; dep. fed. PB 1935-1937.\n\n \n\n*Gratuliano da Costa Brito* nasceu em São João do Cariri (PB) no dia 6\nde setembro de 1905, filho do desembargador Inácio Costa Brito e de\nMaria Madalena Leal de Brito.\n\nFez o curso primário no Colégio Nossa Senhora das Neves, na cidade da\nParaíba, atual João Pessoa, e o secundário no Colégio Pio X e no Liceu\nParaibano, também na capital do estado. Bacharelou-se em ciências\njurídicas e sociais pela Faculdade de Direito de Recife em 1926.\n\nEm janeiro de 1927 foi nomeado pelo presidente da Paraíba, João\nSuassuna, para a promotoria da cidade de Patos. Mais tarde, já no\ngoverno de João Pessoa (1928-1930), exerceu a função de delegado geral\nda polícia no estado. Em 1930 filiou-se à Aliança Liberal, movimento\norganizado para promover as candidaturas de Getúlio Vargas e de João\nPessoa à sucessão presidencial. Após a revolução de outubro desse ano\nfoi designado pelo novo governo, chefiado por Getúlio Vargas, para\nintegrar a Comissão Corregedora da Justiça Federal na Paraíba.\n\nDurante a administração de Antenor Navarro, nomeado interventor federal\nna Paraíba em novembro de 1930, Gratuliano integrou, ao lado — entre\noutros — do tenente Ernesto Geisel, o Conselho Consultivo, órgão que\nassessorava a interventoria. Mais tarde ocupou a Secretaria do Interior\ne Segurança Pública, em substituição a Odon Cavalcanti. Em abril de 1932\nassumiu interinamente a interventoria, após o falecimento de Navarro em\ndesastre de avião, e no mês de junho seguinte foi efetivado como\ninterventor federal na Paraíba. Durante seu governo foi inaugurado o\nporto de Cabedelo, cujas obras haviam sido iniciadas na gestão de\nAntenor Navarro. Organizou ainda as polícias militar e civil e\nreestruturou o sistema de arrecadação do estado.\n\nEleito deputado federal na legenda do Partido Progressista (PP) da\nParaíba em outubro de 1934, em dezembro seguinte deixou a interventoria,\nsendo substituído por Argemiro de Figueiredo, eleito pela Assembléia\nConstituinte paraibana e empossado em janeiro de 1935. Assumiu sua\ncadeira na Câmara dos Deputados em maio de 1935, aí permanecendo até 10\nde novembro de 1937, quando o golpe do Estado Novo suprimiu todos os\nórgãos legislativos do país. Na Câmara foi membro da Comissão de\nFinanças e Orçamento, tendo sido durante três anos o relator do\norçamento do Ministério da Guerra.\n\nAfastado da vida política, ainda em 1937 fixou residência no Rio de\nJaneiro, então Distrito Federal, atuando como delegado da Associação\nComercial da Paraíba junto à Federação das Associações Comerciais do\nBrasil. Dedicou-se também a atividades jornalísticas e empresariais,\ntornando-se diretor-presidente da Companhia Editora Americana, empresa\nproprietária das revistas *A Cena Muda, Esporte Ilustrado, Revista da\nSemana,*entre outras.\n\nA partir de março de 1948, tornou-se representante da Paraíba junto ao\nConselho Consultivo da Companhia Hidro Elétrica do São Francisco\n(CHESF), função que desempenhou até abril de 1951. Entre setembro de\n1964 e agosto de 1977 integrou o Conselho Administrativo de Defesa da\nEconomia (CADE). Foi ainda membro da Associação Brasileira de Imprensa.\n\nFaleceu no Rio de Janeiro no dia 27 de janeiro de 1982.\n\nEra casado com Adelaide Machado de Brito, com quem teve três filhos.\n\n \n\n \n\nFONTES: CÂM. DEP. *Deputados;*CÂM. DEP. *Relação dos dep.;*NÓBREGA, A.\n*Chefes;* PEIXOTO, A. *Getúlio;*PINTO, L. *Fundamentos;*POPPINO, R.\n*Federal;*SOC. BRAS. EXPANSÃO COMERCIAL. *Quem*(3).\n\n \n","ref":"FONTES: CÂM. DEP. *Deputados;*CÂM. DEP. *Relação dos dep.;*NÓBREGA, A.\n*Chefes;* PEIXOTO, A. *Getúlio;*PINTO, L. *Fundamentos;*POPPINO, R.\n*Federal;*SOC. BRAS. EXPANSÃO COMERCIAL. *Quem*(3).\n\n \n","dic":"DHBB"}
