{"title":"ALBUQUERQUE, Pires e","cargoss":["Ministro do Supremo Tribunal Federal","Procurador-geral da República"],"cargos_esp":[0,0],"datas_ini":[1917,1919],"datas_fim":[1931,1931],"estados":[0,0],"autor":[0],"content":"**ALBUQUERQUE, Pires e**\n\n\\*magistrado; min. STF 1917-1931; proc.-ger. Rep. 1919-1931.\n\n \n\n*Antônio Joaquim Pires de Carvalho e Albuquerque* nasceu em Rio Fundo\n(BA) no dia 5 de fevereiro de 1865, filho de Garcia Dias D’Ávila Pires\nde Carvalho e Albuquerque, deputado e senador estadual na Bahia, e de\nMaria de Argolo Pires. Descendia de importantes famílias tradicionais\nbaianas, os D’Ávila e os Pires de Carvalho e Albuquerque: seu avô\npaterno e homônimo foi barão e visconde com grandeza da Torre de Garcia\nD’Ávila, e seus tios-avós, irmãos deste, também receberam títulos de\nnobreza no Império, destacando-se no período: Joaquim Pires de Carvalho\ne Albuquerque, visconde de Pirajá, e Francisco Estêvão Pires de Carvalho\ne Albuquerque, barão de Jaguaribe.\n\nBacharel pela Faculdade de Direito de Recife em 1886, fez carreira de\npromotor público na Bahia entre 1887 e 1890, em Salvador e nas cidades\nde Maracás, Alagoinhas e São Francisco.\n\nDeputado à Assembléia Constituinte baiana de 1891, teve seu mandato\nestendido até 1893 com a transformação desta assembléia em Câmara\nestadual ordinária. Reeleito em 1894, continuou deputado estadual até\n1896.\n\nNomeado juiz federal no estado do Rio de Janeiro em 1897, foi removido\nem março de 1904 para a recém-criada 2ª Vara do então Distrito Federal.\nDe 1913 a 1914, serviu no tribunal arbitral que resolveu a questão dos\nlimites entre Minas Gerais e Espírito Santo, e em maio de 1917 o\npresidente da República Venceslau Brás nomeou-o ministro do Supremo\nTribunal Federal (STF).\n\nEm 1919, foi um dos relatores do pedido *de habeas-corpus*impetrado pelo\ngeneral Coriolano de Carvalho e Silva em favor de Rui Barbosa, candidato\nderrotado por Epitácio Pessoa nas eleições presidenciais de abril\ndaquele ano. O pedido argumentava que Epitácio não poderia ser\nconsiderado eleito, por ter sido declarado inválido para o serviço\npúblico e por ter portado condecoração estrangeira. O STF, porém, não\naprovou o pedido. Em agosto de 1919, poucos dias após sua posse,\nEpitácio nomeou Pires e Albuquerque procurador-geral da República, cargo\natribuído na época obrigatoriamente a um ministro do STF.\n\nEm 1920, presidiu o tribunal arbitral que decidiu a questão de limites\nentre Goiás e Mato Grosso, e em 1928, na qualidade de procurador-geral\nda República, foi acusado pelo jornalista José Eduardo de Macedo Soares,\ndiretor-responsável do *Diário Carioca,*de ter substituído e adulterado\nseu parecer no recurso extraordinário interposto pela Companhia\nTelefônica. Em seguida, Macedo Soares foi condenado por injúria, decisão\nconfirmada pelo STF.\n\nCom a vitória da Revolução de 1930 e a constituição do Governo\nProvisório, Pires e Albuquerque foi um dos seis ministros do STF\naposentados compulsoriamente, através de decreto (18/2/1931) que reduzia\no número de juízes daquela corte para nove. Na mesma data, foi\naposentado compulsoriamente do cargo de procurador-geral da República.\nEm sua defesa, publicou *Crime e castigo de um* *magistrado.*\n\nFaleceu no Rio de Janeiro em 3 de setembro de 1954.\n\nSeu filho, o capitão-de-mar-e-guerra Garcia D’Ávila Pires de Carvalho e\nAlbuquerque, comandava o encouraçado *Bahia*quando a embarcação explodiu\nem operação de guerra em julho de 1945, matando-o e a grande parte da\ntripulação. Outro dos descendentes da família, o general Válter Pires de\nCarvalho e Albuquerque, foi nomeado ministro do Exército em 1979.\n\n \n\nFONTES: BALEEIRO, A. *Supremo;*CONSULT. MAGALHÃES, B.; CORRESP. PROC.\nGER. REP.; COSTA, E. *Efemérides;*COSTA, E. *Grandes; Encic. Mirador;\nGrande encic. Delta.*\n\n \n","ref":"FONTES: BALEEIRO, A. *Supremo;*CONSULT. MAGALHÃES, B.; CORRESP. PROC.\nGER. REP.; COSTA, E. *Efemérides;*COSTA, E. *Grandes; Encic. Mirador;\nGrande encic. Delta.*\n\n \n","dic":"DHBB"}
