{"title":"BUAIZ, Vítor","cargoss":["Constituinte","Deputado federal","Prefeito","Governador de estado ou do Distrito Federal"],"cargos_esp":[0,0,"Vitória",0],"datas_ini":[1987,1987,1989,1995],"datas_fim":[1988,1989,1993,1999],"estados":[0,"ES",0,"ES"],"content":"**BUAIZ, Vítor**\n\n\\*const. 1987-1988; dep. fed. ES 1987-1989; pref. Vitória 1989-1993;\ngov. ES 1995-1999.\n\n* *\n\n*Vítor Buaiz* nasceu em Vitória em 19 de agosto de 1943, filho de José\nSalim Buaiz e de Adélia Jacob Buaiz.\n\nFormado em medicina pela Universidade Federal do Espírito Santo (UFES)\nem 1967, no ano seguinte fez curso de especialização em clínica médica\nna Universidade Federal do Rio de Janeiro (UFRJ). Iniciou sua carreira\nprofissional em 1969, passando a trabalhar quase exclusivamente em\ninstituições públicas. Foi médico da Secretaria de Estado de Saúde e da\nAdministração do Porto de Vitória entre 1969 e 1971, e do Instituto\nNacional de Assistência Médica e Previdência Social (INAMPS), a partir\nde 1969. No ano seguinte tornou-se coordenador do Ambulatório de\nEsquitossomose do Hospital das Clínicas da UFES, em 1971 foi contratado\ncomo auxiliar de ensino na UFES e em 1974 tornou-se secretário do Centro\nde Estudos do Hospital das Clínicas.\n\nSua inserção na política capixaba iniciou-se na década de 1970, quando\ncomeçou a participar de entidades de classe e sindicatos.\nSecretário-geral da Associação dos Médicos (1970-1972 e 1974-1976) e\nprimeiro presidente do Sindicato dos Médicos do Espírito Santo\n(1978-1981), participou também da fundação do Partido dos Trabalhadores\n(PT) no estado, em 1980. Foi vice-presidente da Associação Nacional dos\nMédicos (1981-1984) e delegado da Associação Médica do Espírito Santo\njunto à Associação Médica Brasileira (AMB) (1985-1987). Também nesse\nperíodo consolidou sua carreira docente na UFES: em 1979, através de\nconcurso público, passou a professor-assistente, e em 1985 a\nprofessor-adjunto.\n\nEm novembro de 1982 disputou uma vaga na Câmara dos Deputados na legenda\ndo PT, mas não foi eleito. Três anos depois concorreu à prefeitura de\nVitória. Embora não tenha sido eleito, sua votação — 26% dos votos — foi\nconsiderada surpreendente. Ficou em segundo lugar na disputa, sendo\nderrotado pelo candidato do Partido do Movimento Democrático Brasileiro\n(PMDB), Hermes Laranja. Em 1986 candidatou-se pela segunda vez a uma\ncadeira na Câmara dos Deputados, pautando sua campanha por um discurso\nde oposição ao governo federal orientado pela corrente sindicalista do\nPT. Defendeu a ampliação do direito de greve, a participação dos\nempregados nos lucros das empresas e a redução da jornada de trabalho.\nNo pleito de novembro foi afinal eleito, com mais de 79 mil votos —\ncerca de 76% do total obtido pelo PT no estado. Foi também o terceiro\ncandidato mais votado no Espírito Santo.\n\nEmpossado em 1º de fevereiro de 1987, quando foi instalada a Assembleia\nNacional Constituinte, participou ativamente do processo de discussão\nentão desencadeado. Membro titular da Subcomissão dos Municípios e\nRegiões, da Comissão da Organização do Estado, e suplente da Subcomissão\nde Saúde, Seguridade e Meio Ambiente, da Comissão da Ordem Social, votou\na favor do rompimento de relações diplomáticas com países com política\nde discriminação racial, da limitação do direito de propriedade privada,\ndo mandado de segurança coletivo, da legalização do aborto, da\nremuneração 50% superior para o trabalho extra, da jornada semanal de 40\nhoras, do turno ininterrupto de seis horas, do aviso prévio\nproporcional, da pluralidade sindical, da soberania popular, do voto aos\n16 anos, do presidencialismo, da nacionalização do subsolo, da\nestatização do sistema financeiro, do limite de 12% ao ano para os juros\nreais, da proibição do comércio de sangue, da limitação dos encargos da\ndívida externa, da criação de um fundo de apoio à reforma agrária e da\ndesapropriação da propriedade produtiva. Votou contra a pena de morte, o\nmandato de cinco anos para o presidente José Sarney e a legalização do\njogo do bicho.\n\n \n\nPrefeito e governador\n\nNovamente candidato à prefeitura de Vitória em novembro de 1988, dessa\nvez foi bem-sucedido. Deixou sua vaga na Câmara dos Deputados para Maria\nde Lourdes Savignon, primeira suplente do PT, e tomou posse como\nprefeito em 1º de janeiro de 1989. Sua gestão foi pontuada por medidas\npolêmicas. Logo após tomar posse, assinou um decreto proibindo quaisquer\npagamentos com recursos do Tesouro, com exceção da folha de pessoal, e\nordenou a revisão de todos os contratos firmados por seu antecessor\nHermes Laranja com empreiteiras e fornecedores. Entrou em confronto com\na Câmara de Vereadores ao recusar-se a repassar a contribuição devida\npela administração municipal ao Instituto de Aposentadoria dos\nVereadores de Vitória, que garantia aposentadoria vitalícia de\nparlamentares com mais de seis anos de mandato. Resolução de 1977\ndeterminava que 75% da dotação orçamentária do Instituto viessem da\ncontribuição da prefeitura. Em represália à decisão do prefeito, em\nmarço de 1989 a Câmara ameaçou pedir seu *impeachment*.\n\nNo plano partidário, Vítor Buaiz — oriundo da tendência petista\nArticulação — passou sua gestão em disputas com as alas radicais do PT\nno estado, que desejavam ter maior influência nas decisões do prefeito.\nOs problemas com a bancada levaram-no, inclusive, a licenciar-se do\ncargo durante dois meses, no início de 1990. Buaiz só conseguiu retomar\no controle da situação política no partido em abril, quando a corrente\nArticulação elegeu 14 dos 26 membros do diretório e o novo presidente\nmunicipal do partido. Concluiu seu mandato em janeiro de 1993, sem\nconseguir fazer seu sucessor na prefeitura de Vitória. Mais uma vez as\ndissensões internas do PT capixaba contribuíram para a derrota nas\nurnas. O candidato vitorioso foi Luís Veloso Lucas, do Partido da Social\nDemocracia Brasileira (PSDB). Ainda em 1993, após a conclusão de seu\nmandato, Buaiz especializou-se em gastroenterologia na AMB.\n\nEm 1994, candidatou-se a governador do Espírito Santo na legenda do PT,\nenfrentando três outros candidatos: Dejair Camata, o cabo Camata, da\ncoligação formada pelos partidos Social Democrático (PSD) e da\nReconstrução Nacional (PRN); Max Mauro, que havia governado o estado\nentre 1987 e 1991, lançado pelo Partido da Mobilização Nacional (PMN); e\nRose de Freitas, do PSDB. Durante a campanha eleitoral, tornou públicas\nem seus pronunciamentos as divergências ideológicas com o PT. Criticou a\npolítica restritiva de alianças do partido e o que considerou sua\nimpossibilidade, naquele momento, de perceber que nem sempre suas\nbandeiras políticas estavam de acordo com os anseios da sociedade.\nSugeriu que se prestasse mais atenção às demandas populares e lembrou\nque a população não votava em partidos, mas em candidatos.\n\nNo primeiro turno das eleições, realizado em outubro, foi apoiado pela\nFrente Unidade Popular, que congregou, além do PT, o Partido Comunista\ndo Brasil (PCdoB), o Partido Socialista Brasileiro (PSB) e o PMDB.\nObteve o apoio explícito da deputada federal peemedebista Rita Camata,\ncampeã de votos por duas legislaturas consecutivas. A campanha para o\nsegundo turno incorporou o apoio de um amplo leque de partidos que se\nuniram para derrotar a candidatura do cabo Camata, ex-policial militar\nacusado de ter pertencido a grupos de extermínio. A Frente Unidade\nPopular passou a ser composta também pelo PSDB, pelo PMN, pelo Partido\nDemocrático Trabalhista (PDT), pelo Partido Popular Socialista (PPS),\npelo Partido Comunista Brasileiro (PCB), pelo Partido Verde (PV) e pelo\nPartido Liberal (PL). Buaiz obteve ainda o apoio do presidente Fernando\nHenrique Cardoso, eleito no primeiro turno, e de artistas e intelectuais\ncomo Chico Buarque, Gilberto Gil, Mário Lago, Leandro Konder e Luís\nPinguelli Rosa. A imprensa assinalou o ineditismo do apoio presidencial\na um candidato do PT, contrapondo-o à ausência de Luís Inácio Lula da\nSilva, presidente do PT, nos palanques da campanha no Espírito Santo.\nBuaiz, no entanto, atribuiu o fato à decisão da executiva nacional do\npartido e do próprio Lula de fazer campanha em estados onde o PT tivesse\nsaído vitorioso na campanha presidencial de 1994. Registre-se ainda o\nfato de que a votação no segundo turno aconteceu sob proteção da Polícia\nFederal, solicitada pelo PT — que suspeitava da possibilidade de fraude\n— ao Tribunal Regional Eleitoral (TRT) e, posteriormente, ao Tribunal\nSuperior Eleitoral (TST). Vítor Buaiz foi eleito com cerca de 59% dos\nvotos válidos e iniciou seu governo em janeiro de 1995.\n\nDo ponto de vista administrativo, o primeiro biênio de governo Buaiz foi\nmarcado por uma série de crises envolvendo o esgotamento da capacidade\nfinanceira do estado em honrar seus compromissos, especialmente o\npagamento do funcionalismo público, e em investir em áreas básicas para\no desenvolvimento estadual. A situação financeira do estado, próxima da\ninadimplência, ocasionou vários desdobramentos no plano das soluções\nadministrativas, econômicas, políticas e ideológicas.\n\nÀ ameaça permanente de greve dos funcionários públicos, causada pelo\natraso nos pagamentos dos salários, e a uma efetiva greve de médicos\niniciada em outubro de 1995, o governador respondeu com a decretação, em\nmarço de 1996, do estado de emergência na saúde pública do Espírito\nSanto e a intervenção, por 90 dias, em quatro hospitais particulares e\nfilantrópicos, para reordenar o atendimento de emergência à população.\nComo solução para os problemas gerados pelo excesso de funcionários\npúblicos, que, segundo estimativas, consumiam 94% da arrecadação do\nestado em março de 1996, Buaiz propôs, já em 1995, uma reforma\nadministrativa que incluísse a demissão de funcionários, a supressão de\nbenefícios e a redução dos salários dos “marajás” do funcionalismo\nestadual.\n\nSua maneira de encarar e solucionar os problemas no estado custou-lhe o\napoio de seu próprio partido. Acusado por alguns setores do PT de\nabandonar as premissas partidárias e assumir o neoliberalismo como\nperspectiva de governo, Buaiz respondeu que frente às imposições\ncolocadas por um cargo executivo não cabiam posições sectárias.\nParalelamente a um afastamento gradual das teses defendidas pelo PT,\naproximou-se do PSDB e do presidente da República. Em 1995, o governo\nfederal apoiou o saneamento do Banco do Estado do Espírito Santo\n(Banestes) promovido por Buaiz. Em contrapartida, no ano seguinte o\ngovernador capixaba considerou legítima a tese da reeleição do\npresidente Fernando Henrique Cardoso. Em março de 1997, uma vez mais\nentrou em conflito aberto com o PT, que o acusou de nomear para a\nSecretaria de Segurança do estado um policial comprometido com grupos de\nextermínio. O agravamento das tensões no interior do partido levou-o a\nretirar-se do PT em agosto de 1997, e a ingressar no mês seguinte no PV.\n\nSem ter concorrido à reeleição outubro de 1998, transmitiu o governo\ncapixaba em 1º de janeiro de 1999 ao sucessor José Inácio Ferreira, do\nPSDB.\n\nCasou-se com Maria de Lourdes Lordello Buaiz, com quem teve três filhos.\n\nEliane Holanda\n\n** **\n\n**FONTES**: ASSEMB. NAC. CONST. *Repertório*(1987); COELHO J. ;\nOLIVEIRA, A. *Nova; Folha de S. Paulo*(15/7/98).\n\n \n","ref":"","dic":"DHBB"}
