{"title":"BUENO, Bias","cargoss":["Deputado federal","Deputado federal"],"cargos_esp":[0,0],"datas_ini":[1935,1927],"datas_fim":[1937,1930],"estados":["SP","SP"],"autor":[0],"content":"**BUENO, Bias**\n\n\\*dep. fed. SP 1927-1930 e 1935-1937.\n\n* *\n\n*Antônio Bias da Costa Bueno* nasceu em Pindamonhangaba (SP) no dia 12\nde abril de 1883, filho de Antônio Dino Bueno, presidente do estado de\nSão Paulo em 1927.\n\nAdvogado formado pela Escola de Direito de São Paulo, foi deputado\nestadual.\n\nEleito deputado federal por São Paulo, assumiu em 3 de maio de 1927 e\npermaneceu na Câmara até 24 de outubro de 1930, quando os mandatos foram\ninterrompidos pela vitória do movimento revolucionário.\n\nRadicado em Santos (SP), foi procurador fiscal da Câmara, delegado\nregional de polícia e um dos chefes do departamento legal da Companhia\nConstrutora de Santos.\n\nEm outubro de 1934 foi eleito deputado federal na legenda do Partido\nRepublicano Paulista (PRP), ocupando a cadeira de maio de 1935 a 10 de\nnovembro de 1937, quando o advento do Estado Novo suprimiu todas as\ncâmaras legislativas do país.\n\nEscreveu vários trabalhos forenses.\n\nFoi casado com Regina de Miranda, com quem teve quatro filhos.\n\nFONTES: *Boletim Min. Trab.*(5/36); CÂM. DEP*. Deputados; Diário do\nCongresso Nacional; Grande encic. Delta;*LEITE, A. *História;*\n*Personalidades.*\n\n \n","ref":"FONTES: *Boletim Min. Trab.*(5/36); CÂM. DEP*. Deputados; Diário do\nCongresso Nacional; Grande encic. Delta;*LEITE, A. *História;*\n*Personalidades.*\n\n \n","dic":"DHBB"}
