{"title":"BURITI, Tarcísio","cargoss":["Governador de estado ou do Distrito Federal","Deputado federal","Governador de estado ou do Distrito Federal"],"cargos_esp":[0,0,0],"datas_ini":[1979,1983,1987],"datas_fim":[1982,1987,1991],"estados":["PB","PB","PB"],"autor":["Alan Carneiro"],"content":"BURITI, Tarcísio\n\n\\*gov. PB 1979-1982; dep. fed. PB 1983-1987; gov. PB 1987-1991.\n\nTarcísio de Miranda Buriti nasceu em João Pessoa no dia 28 de novembro\nde 1938, filho de Luís Gonzaga de Albuquerque Buriti e de Maria José de\nMiranda Buriti.\n\nAdvogado e professor universitário, em 1961 bacharelou-se em ciências\njurídicas e sociais pela Faculdade de Direito da Universidade da\nParaíba. No ano seguinte foi nomeado promotor público, função que\nexerceu até 1963. Nesse ano, seguiu para a França, onde iniciou o curso\nde sociologia na Universidade de Poitiers, concluindo-o em 1964, ano em\nque iniciou o doutorado em ciência política no Instituto Universitário\nde Altos Estudos Internacionais de Genebra, na Suíça, que concluiu em\n1967. De volta ao Brasil, em 1968 foi nomeado chefe de gabinete do\nreitor da Universidade Federal da Paraíba (Ufpb), permanecendo nesse\ncargo até 1971. No ano seguinte tornou-se diretor da Faculdade de\nDireito da Ufpb, em cuja função permaneceu até 1974.\n\nCom a ascensão de Ivan Bichara ao governo da Paraíba em março de 1975,\nTarcísio Buriti foi nomeado secretário estadual de Educação. Seu\ntrabalho à frente dessa secretaria lhe proporcionou um espaço na corrida\npela sucessão estadual. Três anos depois, no final de abril de 1978,\nquando da escolha dos candidatos pela Aliança Renovadora Nacional\n(Arena), partido de sustentação do regime militar implantado no país em\nabril de 1964, ao qual estava filiado, teve o seu nome indicado para\nsubstituir Bichara. Essa indicação causou descontentamento no meio\narenista, pois o nome de Buriti não constava de qualquer lista de\nprováveis candidatos, sendo os mais cotados o deputado federal Antônio\nMariz e o senador Mílton Cabral.\n\nRealizada a convenção da Arena em junho de 1978, mesmo enfrentando um\nesquema comandado pelo candidato dissidente, o deputado Antônio Mariz,\nseu nome foi confirmado pelos convencionais do partido por 152 votos\ncontra 124.\n\nCom apoio do palácio do Planalto, Buriti foi eleito governador da\nParaíba, via Colégio Eleitoral estadual, no dia 1º de setembro de 1978.\nPassou, então, a articular no partido um nome para disputar a segunda\nvaga ao Senado, já que a primeira estava garantida com a eleição do\n“biônico” Mílton Cabral. O escolhido foi o próprio Ivan Bichara, que\nhavia se desincompatibilizado do cargo de governador em agosto com esse\nobjetivo. Sua candidatura, contudo, acentuou ainda mais o\ndescontentamento arenista e, no pleito de novembro seguinte, Bichara\nacabou sendo derrotado pelo deputado Humberto Lucena, candidato\noposicionista do Movimento Democrático Brasileiro (MDB).\n\nTarcísio Buriti assumiu o governo da Paraíba no dia 15 de março de 1979,\nem substituição a Dorgival Terceiro Neto, que era vice de Ivan Bichara e\nhavia assumido o governo em agosto do ano anterior. Na oportunidade, ao\nreferir-se a como seria sua relação com o MDB, declarou que não\ncompreendia democracia sem oposição aguerrida e fiscalizadora dos atos\ngovernamentais e reconheceu aos parlamentares oposicionistas o direito\nde crítica ao governo, o que não era fato corrente em tempos de regime\nmilitar. Em entrevista concedida um mês após sua posse, na qual fez um\nbalanço sobre os seus 30 dias de governo, Buriti declarou-se favorável\nao voto do analfabeto, à anistia, que se concretizaria no final de\nagosto, e a eleições diretas em todos os níveis.\n\nAinda em 1979, o governo encaminhou ao Congresso um projeto de\nreformulação partidária. Buriti defendeu maior abertura e flexibilização\ndo projeto, que restringia a arregimentação de novos partidos. Para ele,\na criação de novas agremiações partidárias deveria ser livre e\nindependente. Com a extinção do bipartidarismo em novembro desse ano e a\nconseqüente reformulação partidária, filiou-se ao Partido Democrático\nSocial (PDS), sucessor da Arena no apoio ao governo.\n\nDesde sua posse, resolveu partir para uma correção de rumos na\nadministração da Paraíba. Dentre os principais problemas do estado, os\nmais graves eram os dos setores econômico e de segurança. Para atenuar o\nprimeiro, procurou contratar empréstimos que lhe permitissem criar novos\nempregos e solucionar graves problemas de saúde pública, eletrificação\nrural, abastecimento de água e construção de estradas vicinais para\nescoamento da produção agrícola. Na área da segurança pública, enfrentou\nos desmandos da Polícia Militar no estado, procurando torná-la uma\ninstituição que só poderia agir no irrestrito respeito à lei, e acabou\ncom a impunidade das gangues organizadas que comandavam assaltos e\ncometiam assassinatos no alto sertão paraibano.\n\nEm outubro de 1980, quando começava a aquecer o debate sobre eleições\ndiretas para prefeitos das capitais e governadores, Buriti manifestou-se\nfavorável a elas, “desde que os mecanismos da nova legislação eleitoral\npudessem vincular a eleição de prefeito com a de governador, com o\nobjetivo de sempre haver coincidência das duas autoridades dentro do\nmesmo partido”. Em janeiro do ano seguinte, em entrevista ao jornal *O\nEstado de S. Paulo*, manifestou-se favorável à convocação de uma\nAssembléia Nacional Constituinte, justificando que problema mais\ndelicado fora o da concessão da anistia, que implicava o retorno de\nlíderes proscritos pela Revolução e, mesmo assim, foi absorvido pelo\nregime; propôs a execução das cartas-programas dos partidos como um meio\nde combate ao clientelismo político e defendeu a alternância no poder.\n\nTido como um socialdemocrata, suas posições desagradavam a forças\npoderosas do PDS e, por isso, constituía-se sempre no pivô de constantes\ncrises que abalavam o partido, o que acabava dificultando a afirmação de\nsua liderança nas hostes pedessistas. Permaneceu à frente do Executivo\nda Paraíba até 14 de maio de 1982, quando o transferiu ao\nvice-governador Clóvis Bezerra Cavalcanti, desincompatibilizando-se do\ncargo para concorrer a uma cadeira na Câmara dos Deputados na legenda do\nPDS.\n\nNo pleito de novembro desse ano, obteve 173.107 votos, cerca de 18% dos\nvotos, a maior votação até então registrada no estado. Foi o primeiro\npolítico paraibano a garantir sua eleição apenas em João Pessoa, onde\nobteve 36 mil votos, reduto tradicionalmente oposicionista. Confirmada\nsua eleição, voltou a defender eleição direta para a presidência da\nRepública e que o governo federal deveria estabelecer um tratamento\ndiferenciado para o Nordeste. Assumindo seu mandato em fevereiro do ano\nseguinte, tornou-se membro titular da Comissão de Relações Exteriores e\nsuplente da Comissão de Constituição e Justiça da Câmara. Suas posições\npolíticas de cunho progressista logo o levaram a se integrar ao\nmovimento rebelde Participação, existente no PDS.\n\nNo início de 1983, o deputado mato-grossense Dante de Oliveira, do\nPartido do Movimento Democrático Brasileiro (PMDB), apresentou na Câmara\num projeto de emenda constitucional restabelecendo eleições diretas para\na presidência da República no ano seguinte. Encampado pelas oposições,\nesse projeto proporcionou o desencadeamento de uma campanha nacional\nnesse sentido, que ficou conhecida como Diretas Já. Em abril de 1984,\npoucos dias antes da votação da emenda, o deputado Tarcísio Buriti\ndeclarou-se convicto, pela extensão do movimento das diretas e sua\nrepercussão no Legislativo, de que a emenda Dante de Oliveira seria\naprovada pela Câmara, caso o PDS não fechasse questão sobre a matéria.\nDisse ainda que, se a emenda fosse rejeitada, haveria frustração\nabsoluta na sociedade brasileira e o governo não teria condições de\nimpor as candidaturas de Paulo Maluf ou Mário Andreazza pela via\nindireta. Acrescentou, porém, que, caso fosse mantido o sistema\nindireto, somente um nome, o do vice-presidente da República, então no\nexercício da presidência, Aureliano Chaves, teria condições de obter o\nconsenso, pois possuía canais de diálogo com a oposição e a sociedade.\n\nEmbora o PDS tivesse fechado questão e a maioria dos deputados se\nausentado da votação na sessão da Câmara de 25 de abril de 1984, Buriti,\ncontrariando a determinação partidária, votou a favor da emenda Dante de\nOliveira, que, por falta de 22 votos, acabou não sendo aprovada e, com\nisso, ficou impedida de ser enviada para apreciação do Senado.\n\nCom esse resultado, o próximo presidente da República seria mesmo eleito\npor via indireta. A falta de consenso quanto à forma de escolha do\ncandidato oficial provocou uma cisão no PDS e o grupo dissidente formou\na Frente Liberal. Para definir essa questão, o partido realizou em\nagosto seguinte sua convenção, na qual o deputado Paulo Maluf derrotou o\nentão ministro do Interior Mário Andreazza. Para compor a chapa\ngovernista, na mesma convenção o deputado cearense Flávio Marcílio\nganhou a disputa para o cargo de vice-presidente, ao derrotar o então\ngovernador de Alagoas Divaldo Suruagi.\n\nPara concorrer com os candidatos da situação, os partidos de oposição\nliderados pelo PMDB, e a Frente Liberal, reunidos na Aliança\nDemocrática, lançaram o então governador de Minas Gerais, Tancredo\nNeves, e o então senador maranhense e ex-presidente do PDS José Sarney,\nrespectivamente, para presidente e vice-presidente da República. Na\nvotação do Colégio Eleitoral para a sucessão do presidente João\nFigueiredo em 15 de janeiro de 1985, Tarcísio Buriti votou em Tancredo\nNeves, que derrotou Paulo Maluf.\n\nCom a transformação da Frente Liberal em agremiação política, o Partido\nda Frente Liberal (PFL), ainda nesse mês, Buriti passou a coordenar o\nprocesso de formação dessa nova agremiação na Paraíba. Em fevereiro\nseguinte, com a entrada de Wilson Braga, seu principal adversário\npolítico no estado, no PFL, desligou-se desse partido e passou a apoiar\no Partido Trabalhista Brasileiro (PTB), ao qual prometeu se filiar e, em\ncuja legenda, disputaria o governo estadual no pleito de novembro do ano\nseguinte.\n\nA doença de Tancredo, na véspera de sua posse, fez com que o vice José\nSarney assumisse o poder, em caráter interino, no dia 15 de março desse\nmesmo ano e fosse efetivado no mês seguinte, após a morte do titular.\nCom o fim do ciclo de presidentes militares impostos pelo regime\ninstaurado em abril de 1964, foram restabelecidas eleições diretas nas\ncapitais e municípios considerados áreas de segurança nacional durante o\nregime militar. Nas****eleições municipais de novembro de 1985 para a\nprefeitura de João Pessoa, Buriti apoiou o candidato do PTB, Marcus\nOdilon Ribeiro Coutinho, usineiro, pertencente a uma das famílias mais\nricas do estado, que acabou sendo derrotado pelo candidato do PMDB,\nAntônio Carneiro Arnaud, apoiado pelo então governador Wilson Braga.\nPosteriormente, Buriti transferiu-se para o PMDB.\n\nDefinindo-se como um político de centro-esquerda, foi indicado pelo seu\nnovo partido candidato ao governo da Paraíba. Esse era um período em que\no PMDB procurava capitalizar os frutos colhidos até então com o sucesso\ndo Plano Cruzado, um plano de estabilização econômica lançado pelo\ngoverno em fevereiro desse ano, com o objetivo de conter a escalada\ninflacionária. Nessa oportunidade, manifestando-se sobre temas variados\nda conjuntura política do momento, disse que o governo do presidente\nJosé Sarney (1985-1990) havia consolidado a democracia com a convocação\nda Assembléia Nacional Constituinte, a total liberdade de imprensa e a\nlegalização dos partidos políticos clandestinos. Manifestou-se também\nfavorável ao aperfeiçoamento da lei de greve para garantir “maior espaço\npara pressão da classe trabalhadora”. Disse ainda ser contrário ao\ndomínio do Estado no meio de produção e favorável à livre iniciativa na\neconomia.\n\nOpinando sobre vários temas que seriam discutidos na Constituinte,\ndefendeu um mandato de cinco anos para o presidente da República José\nSarney, a pluralidade sindical e se disse favorável ao presidencialismo,\nà atuação externa e interna das forças armadas e à reforma agrária\nsomente em terras improdutivas. Durante a campanha, prometeu priorizar\nas áreas de segurança pública, agricultura e indústria, além de\ndescentralizar a administração estadual. Com esse discurso, no pleito de\nnovembro de 1986, com o PMDB encabeçando uma coligação formada pelo\nPartido Comunista do Brasil (PCdoB), o Partido Comunista Brasileiro\n(PCB) e o Partido Socialista Brasileiro (PSB), Buriti se elegeu\ngovernador da Paraíba com 755.625 votos (51,9% do eleitorado),\nderrotando o senador Marcondes Gadelha, lançado pela Aliança Trabalhista\nLiberal, coligação formada pelo PDS, PFL, PTB e partidos menores.\n\nConfirmada sua eleição, prometeu fazer um governo sem revanchismos e\nvoltado para o crescimento da economia do estado, através do\nfortalecimento das pequenas e microempresas, atraindo novos\ninvestimentos, fatores estes necessários e indispensáveis à geração de\nnovos empregos. Sob o ponto de vista político-partidário, disse que sua\nvitória iria provocar o desmantelamento da estrutura do PDS-PFL, que\n“mostrou não ter mais condição de se impor ao povo pela sua liderança,\nporque perdeu todo o respeito”, referindo-se ao seu maior adversário, o\nex-governador Wilson Braga, derrotado nesse pleito quando tinha como\ncerta uma cadeira no Senado.\n\nConcluindo seu mandato na Câmara dos Deputados em janeiro de 1987, ao\nfinal da legislatura, em 15 de março seguinte Buriti assumiu o governo\nda Paraíba em substituição a Mílton Cabral. O fato marcante da\ntransmissão do cargo foi a ausência do ex-governador. Ele havia sido\nacusado por Buriti de ser o responsável pelo “caos mais grave, em termos\nfinanceiros e morais, de toda a história do estado”. Em represália às\ncríticas, recusou-se a passar o cargo ao sucessor, o que acabou sendo\nfeito pelo seu vice Antônio Gomes. Outro detalhe da posse foram as\nhomenagens póstumas ao vice-governador eleito Raimundo Asfora, que havia\nsido encontrado morto nove dias antes com um tiro na cabeça.\n\nTarcísio Buriti encontrou todo o funcionalismo estadual em greve por\naumento salarial e pela regularização no pagamento dos seus vencimentos.\nEm seu discurso de posse, anunciou que o primeiro ato de seu governo\nseria o restabelecimento dos poderes constitucionais do Tribunal de\nContas do Estado (TCE). Com essa medida, segundo disse, pretendia\ngarantir ao TCE seu pleno poder de fiscalização, cassado,\narbitrariamente, pelos ex-governadores Wilson Braga e Mílton Cabral,\npara evitar a descoberta do desvio de recursos e de favorecimento\npolítico através de verbas públicas.\n\nSeu programa de austeridade administrativa incluía medidas para a\ndesacumulação, por funcionários estaduais, de 40 mil empregos públicos,\na proibição de novas nomeações, a redução das assessorias do\nsecretariado e a demissão sumária de funcionários nomeados a partir de\n17 de junho de 1986. Porém, pouco depois de sua posse, já no final de\nmarço, um dia após haver baixado decreto anulando a contratação de cerca\nde 28 mil funcionários públicos, o governador Tarcísio Buriti assinou\noutro, recontratando todos os demitidos. Para essa reintegração, Buriti\nconsiderou a “grave repercussão social que decorreria da desvinculação\ndesse contingente do serviço público”.\n\nQuanto à acumulação de cargos, o governo, através de sua Secretaria de\nAdministração, mandou publicar no *Diário Oficial do Estado* uma lista\ncom mais de 7.400 nomes de funcionários “acumuladores”. Entre eles\nencontravam-se os dos ex-governadores Pedro Gondim e Dorgival Terceiro\nNeto, o de um conselheiro do TCE, além de ex-secretários e de\nex-deputados. Para estudar e resolver estes casos, Buriti nomeou uma\ncomissão que deu prazo de 10 dias para os envolvidos se justificarem.\nCom relação à dívida de 250 milhões de cruzados que o estado tinha com a\nCaixa Econômica Federal (CEF), o governador conseguiu prorrogá-la por\ndois anos, mas ainda teria que resolver como o estado pagaria cerca de\n40 milhões de dólares aos bancos internacionais ainda em 1987.\n\nEm maio seguinte, criticou a cúpula do PMDB pela nomeação de um\npefelista, o ex-prefeito de Recife Joaquim Francisco Cavalcanti, para o\nMinistério do Interior, de vital importância para a política nordestina.\nNa sua avaliação, o cargo deveria caber ao seu partido que, devido a um\nacordo feito pelo presidente da agremiação, Ulisses Guimarães, ficou com\na chefia do Gabinete Civil. Em setembro, em entrevista ao jornal *O\nEstado de S. Paulo*, defendeu a privatização de todas as estatais como\nsaída para resolução dos problemas brasileiros, pois o Estado é\nsabidamente um mau gestor e as empresas eram quase todas deficitárias,\ntornando-se grandes geradoras do déficit público.\n\nEm fevereiro de 1988 encaminhou à Assembléia Legislativa seu anteprojeto\nde reforma administrativa. Dentro do seu plano, das 24 secretarias então\nexistentes, 12 seriam extintas e os secretários remanescentes, que, pela\nlegislação em vigor no estado, poderiam ter, cada um, mais de 30\nassessores em seus gabinetes, passariam a contar com os serviços de\napenas cinco. Durante o seu primeiro ano de governo, dos 171 prefeitos\nda Paraíba, 77 foram denunciados por corrupção e Buriti decretou\nintervenção em cinco municípios. Em dezembro de 1988, para controlar um\nmovimento de insubordinação na Polícia Militar (PM), Buriti conseguiu\nque a Assembléia Legislativa aprovasse um projeto de lei subordinando a\ncorporação à Secretaria de Segurança Pública do Estado. Com isso,\npretendia acabar com os conflitos de competência entre as polícias Civil\ne Militar. O movimento estava sendo comandado pelo coronel do Exército\nMarden Alves da Costa, ex-comandante da PM, que havia sido exonerado\npelo governador poucos dias antes.\n\nEm fevereiro de 1989, por ocasião da eleição da nova mesa da Assembléia\nLegislativa, Buriti sofreu um grande revés, quando o deputado Severino\nRamalho Leite, do PMDB, candidato à presidência do Legislativo apoiado\npelo governador, foi derrotado pelo dissidente João Fernandes, também do\nPMDB, que tinha apoio dos partidos de oposição Democrático Trabalhista\n(PDT), Socialista Brasileiro (PSB), PDS, PFL e parte do PL. Isso fez com\nque Buriti perdesse a maioria que tinha no Legislativo e, diante da\ninexistência do vice-governador, desistiu de sua indicação para ministro\ndo Supremo Tribunal Federal (STF), para evitar que o governo fosse\npraticamente entregue ao seu maior adversário político e inimigo\npessoal, o então prefeito de João Pessoa, Wilson Braga, que, certamente,\nelegeria um político do seu grupo para ocupar um mandato-tampão no\nExecutivo estadual.\n\nEm maio seguinte, com a indefinição no PMDB sobre quem seria o candidato\ndo partido à presidência da República e o crescimento da candidatura do\nex-governador de Alagoas Fernando Collor, do Partido da Reconstrução\nNacional (PRN), Buriti aderiu a essa candidatura. Posteriormente, já em\nagosto de 1989, passou a ser acusado de estar perseguindo,\npoliticamente, os deputados estaduais do PMDB que se recusavam a aderir\nà candidatura de Collor. Depois, deixou esse partido e se filiou ao PRN.\n\nEm outubro desse ano, o presidente da Assembléia Legislativa, João\nFernandes, pediu ao STF que desse como vago o cargo de governador da\nParaíba, depois que Buriti se recusou a assinar a nova Constituição\nestadual, por contestar, entre outros artigos, a redução do quórum de\ndois terços para metade mais um para que o Legislativo pudesse decretar\no *impeachment* do governador. Para impedir sua cassação, conseguiu uma\nliminar do Tribunal de Justiça do estado. Como o presidente da\nAssembléia pediu ao STF o cancelamento dessa liminar, Buriti impetrou um\nrecurso na Suprema Corte para garanti-la por 180 dias.\n\nAinda no final de 1989, a crise financeira do estado persistia. Segundo\no governador, ela era provocada pelo excessivo número de funcionários\npúblicos no estado, que atingia um total de 86 mil servidores, mesmo com\na demissão de 32 mil ao longo de seus três anos de mandato, consumindo\ntoda a arrecadação estadual. Diante dessa situação, o estado não tinha\ncomo fazer investimentos com recursos próprios e todas as obras do\ngoverno eram financiadas com empréstimos.\n\nEm outubro de 1990, Ronaldo Cunha Lima, candidato do PMDB ao governo do\nestado, classificou-se para a disputa do segundo turno, no qual derrotou\nseu adversário Wilson Braga. Pouco antes de assumir o governo, viu o\nBanco Central (BC) decretar a falência do Banco do Estado da Paraíba\n(Paraiban). Esse fato levou o governador Tarcísio Buriti a romper com o\npresidente Fernando Collor (1990-1992) e pouco depois deixar o PRN. Por\noutro lado, precisava de autorização da Assembléia Legislativa para\nfazer um empréstimo bancário para pagamento do funcionalismo público.\nCunha Lima, recém-eleito mas ainda não empossado, tinha maioria na\nAssembléia e influenciou os deputados para que não autorizassem o\nempréstimo. Com isso, Buriti acabou concluindo o mandato com o pagamento\ndos servidores atrasado quatro meses e rompeu com seu sucessor.\n\nDesde então, iniciou-se um período de divergências políticas entre o\ngovernador e o seu antecessor. Cunha Lima passou a creditar a Buriti a\nculpa pelo fechamento do Paraiban, enquanto este passou a criticar a\nadministração daquele. As relações entre os dois tornaram-se ainda mais\ntensas em agosto de 1993, quando Buriti acusou o filho do governador,\nCássio Cunha Lima, então à frente da Superintendência do Desenvolvimento\ndo Nordeste (Sudene), de autorizar a liberação de verbas de forma\nirregular.\n\nO uso político dessas denúncias acabou causando um sério incidente entre\no governador e Buriti. Em 5 de novembro de 1993, Cunha Lima, sentindo-se\nofendido por uma entrevista concedida pelo seu adversário à TV O\nNorte*,*na qual criticava a atuação de Cássio à frente da Sudene,\ndirigiu-se a um restaurante na praia de Tambaú, em João Pessoa, onde se\nencontrava Tarcísio Buriti, e fez vários disparos contra seu desafeto,\nferindo-o no rosto e no ombro. Buriti permaneceu vários dias internado,\nmas acabou se recuperando totalmente dos ferimentos.\n\nFiliando-se ao Partido Progressista Brasileiro (PPB), após algum tempo\nfora das disputas políticas, voltou a concorrer a cargo eletivo no\npleito de outubro de 1998, quando disputou uma cadeira no Senado nessa\nlegenda, mas não conseguiu se eleger.\n\nBuriti foi ainda presidente do Conselho Estadual de Cultura, professor\nuniversitário na UFPB e na Faculdade de Direito de Recife da\nUniversidade Federal de Pernambuco, presidente do Instituto Brasileiro\nde Filosofia, seção da Paraíba, e membro do Conselho da Ordem dos\nAdvogados do Brasil, seção da Paraíba.\n\nFALECEU EM SÃO PAULO no dia 8 de julho de 2003. (VER Publicação no DSF\nde 09/07/2003 - página 17330)\n\nCasou-se com Glauce Maria Navarro Buriti, com quem teve quatro filhos.\nSeu sobrinho Ivan Buriti foi deputado federal pela Paraíba de 1991 a\n1995.\n\nAlan Carneiro\n\nFONTES: CÂM. DEP. *Deputados brasileiros. Repertório*(1983-1987);\n*Estado de S. Paulo*(18/1 e 22/2/81, 17/1/82, 14/4/84, 19/11/86, 1/4,\n4/5 e 6/9/87, 27/2/88, 28/3/89); *Folha de S. Paulo*(10/8, 14/9 e\n12/10/86, 15/3 e 16/3/87, 5/5, 4/8 e 18/10/89); *Globo*(10/10 e\n13/12/80, 26/4/84, 23/11/86, 16, 28/3 e 4/4/87, 13/5/88, 7/11/93);\n*História da Paraíba em Fascículos*(17); *Jornal do Brasil*(2/9/78,\n16/3, 17/4 e 28/10/79, 14/9/80, 2/12/82, 22/4/84, 27/2/85, 6/4/86,\n16/3/87, 5, 6 e 2/2/88, 7/10 e 28/12/89, 6/11/93); TRIB. REG. ELEIT. PB.\n*Relação* (1986, 1998); TRIB. SUP. ELEIT. *Resultado*(1998); *Veja*\n(3/5, 6/9 e 27/9/78, 24/1 e 11/4/79).\n\n \n","ref":"FONTES: CÂM. DEP. *Deputados brasileiros. Repertório*(1983-1987);\n*Estado de S. Paulo*(18/1 e 22/2/81, 17/1/82, 14/4/84, 19/11/86, 1/4,\n4/5 e 6/9/87, 27/2/88, 28/3/89); *Folha de S. Paulo*(10/8, 14/9 e\n12/10/86, 15/3 e 16/3/87, 5/5, 4/8 e 18/10/89); *Globo*(10/10 e\n13/12/80, 26/4/84, 23/11/86, 16, 28/3 e 4/4/87, 13/5/88, 7/11/93);\n*História da Paraíba em Fascículos*(17); *Jornal do Brasil*(2/9/78,\n16/3, 17/4 e 28/10/79, 14/9/80, 2/12/82, 22/4/84, 27/2/85, 6/4/86,\n16/3/87, 5, 6 e 2/2/88, 7/10 e 28/12/89, 6/11/93); TRIB. REG. ELEIT. PB.\n*Relação* (1986, 1998); TRIB. SUP. ELEIT. *Resultado*(1998); *Veja*\n(3/5, 6/9 e 27/9/78, 24/1 e 11/4/79).\n\n \n","dic":"DHBB"}
