{"title":"BURNETT, José  ","cargoss":["Deputado federal","Deputado federal","Deputado federal"],"cargos_esp":[0,0,0],"datas_ini":[1991,1983,1963],"datas_fim":[1995,1987,1971],"estados":["MA","MA","MA"],"autor":[0],"content":"**BURNETT, José  **\n\n\\*dep. fed. MA 1963-1971, 1983-1987 e 1991-1995.\n\n*José Ramalho Burnett da Silva* nasceu em São Luís no dia 24 de janeiro\nde 1924, filho de Antônio Carlos Burnett da Silva e de Felizarda Ramalho\nda Silva.\n\nIniciou seus estudos superiores em 1944, quando ingressou na\nFaculdade****de Direito de São Luís, pela qual se bacharelou em ciências\njurídicas e sociais em 1949. No ano seguinte tornou-se procurador fiscal\nde São Luís, função que exerceu até 1956, pois em 1957 assumiu o cargo\nde procurador-geral da Justiça do estado. Nesse mesmo ano foi nomeado\nprefeito da capital maranhense, exercendo essa função, juntamente com a\nde procurador-geral do estado, até o ano seguinte, quando foi nomeado\nsecretário estadual do Interior e Justiça pelo governador José de Matos\nCarvalho (1957-1961). Mesmo com o fim do governo de Matos Carvalho em\njaneiro de 1961, Burnett foi mantido no cargo pelo novo governador\nNewton Belo (1961-1965). Permaneceu na função até o ano seguinte, quando\nse desincompatibilizou para concorrer a mandato eletivo.\n\nFiliando-se ao Partido Social Democrático (PSD), no pleito de outubro de\n1962 foi eleito deputado federal pelo Maranhão nessa legenda, assumindo\nsua cadeira na Câmara dos Deputados em fevereiro do ano seguinte, na\nqual tornou-se membro titular da Comissão de Constituição e Justiça.\n\nApós a vitória do movimento político-militar de 31 de março de 1964 que\ndepôs o presidente João Goulart (1961-1964),****a extinção dos partidos\npolíticos pelo Ato Institucional nº 2 (27/10/1965) e a posterior\ninstauração do bipartidarismo, filiou-se ao Movimento Democrático\nBrasileiro (MDB), partido de oposição ao regime militar vigente no país,\nem cuja legenda foi reeleito em novembro de 1966. Iniciando novo período\nlegislativo em fevereiro do ano seguinte, manteve-se como membro titular\nda Comissão de Constituição e Justiça. Tentou nova reeleição no pleito\nde novembro de 1970, mas, nesta oportunidade, o MDB elegeu apenas o\ndeputado Domingos Freitas Diniz, e Burnett ficou como primeiro suplente.\nPermaneceu na Câmara dos Deputados até o fim de janeiro de 1971, quando\nse encerraram o seu mandato e a legislatura, não tendo retornado no\nperíodo seguinte.\n\nA partir de então passou a atuar na iniciativa privada, tornando-se,\nainda em 1971, diretor administrativo e financeiro da Prospec S.A.\nGeologia, Prospecções e Aerofotogrametria, no Rio de Janeiro, da qual um\ndos proprietários era o ex-deputado maranhense Renato Archer, função que\nexerceu até 1974. Nesse ano, deixou a Prospec e transferiu-se para a\nGypsolite do Brasil S.A., também no Rio de Janeiro, na qual assumiu o\ncargo de diretor-presidente. Permaneceu nessa empresa até 1977, quando\nassumiu a direção da Agrima S.A., de propriedade do ex-senador\nmaranhense Remi Archer, sempre no Rio. Exerceu essa função até o início\nde 1979, quando o recém-eleito governador João Castelo, ao assumir a\nchefia do Executivo maranhense em março desse ano, nomeou o ex-deputado\nJosé Burnett para ser o secretário-chefe do seu Gabinete Civil.\n\nCom a extinção do bipartidarismo em novembro desse ano e a conseqüente\nreformulação partidária, filiou-se no ano seguinte ao Partido\nDemocrático Social (PDS), agremiação que sucedeu a Aliança Renovadora\nNacional (Arena) no apoio ao governo. Em 1981 Burnett deixou a\nsecretaria do Gabinete Civil por ter sido nomeado conselheiro do\nTribunal de Contas do Estado (TCE). Permaneceu nessa corte até o ano\nseguinte, quando se desincompatibilizou da mesma para concorrer a\nmandato eletivo.\n\nNo pleito de novembro de 1982 voltou a ser eleito deputado federal pelo\nMaranhão na legenda do PDS. Assumindo sua cadeira na Câmara dos\nDeputados em fevereiro do ano seguinte, tornou-se membro titular da\nComissão de Constituição e Justiça.\n\nNo início dessa legislatura, o deputado mato-grossense Dante de\nOliveira, do Partido do Movimento Democrático Brasileiro (PMDB),\napresentou na Câmara um projeto de emenda constitucional restabelecendo\neleições diretas para a presidência da República em 1984. Encampado\npelas oposições, esse projeto proporcionou o desencadeamento de uma\ncampanha nacional nesse sentido que ficou conhecida como Diretas Já. Na\nsessão da Câmara dos Deputados do dia 25 de abril de 1984, o deputado\nJosé Burnett votou contra a emenda, que acabou não sendo aprovada por\nfalta de 22 votos, fato que impediu o seu envio para apreciação do\nSenado.\n\nCom esse resultado, ficou definido que o sucessor do presidente João\nFigueiredo (1979-1985) seria mesmo eleito por via indireta. Vários eram\nos postulantes à condição de candidato oficial do partido governista. A\nfalta de consenso quanto à forma de escolha provocou uma cisão no\npartido e os dissidentes formaram a Frente Liberal. Para resolver esse\nimpasse, o PDS realizou sua convenção em agosto com os dois candidatos\nremanescentes da disputa interna. Na oportunidade, José Burnett votou no\ndeputado paulista Paulo Maluf, que derrotou o então ministro do Interior\nMário Andreazza, enquanto, na mesma convenção, o deputado cearense\nFlávio Marcílio venceu o então governador alagoano Divaldo Suruagi e\nganhou a condição de candidato a vice-presidente.\n\nDefinidos os candidatos governistas, os partidos de oposição, com\nexceção do Partido dos Trabalhadores (PT), liderados pelo PMDB, e a\nFrente Liberal, reunidos na Aliança Democrática, lançaram o então\ngovernador de Minas Gerais, Tancredo Neves, e o então senador pelo\nMaranhão, José Sarney, como seus respectivos candidatos à presidência e\nà vice-presidência da República. Na reunião do Colégio Eleitoral em 15\nde janeiro de 1985, o deputado José Burnett ratificou seu voto em Paulo\nMaluf, que foi derrotado por Tancredo Neves. Porém, a doença de Tancredo\nna véspera de sua posse permitiu que o vice José Sarney assumisse o\npoder, em caráter interino, no dia 15 de março desse ano e fosse\nefetivado no mês seguinte, após a morte do titular.\n\nNas eleições de novembro de 1986, Burnett concorreu a uma cadeira de\nsenador constituinte pelo Maranhão, na legenda das Oposições Coligadas,\nque o PDS integrava, mas não conseguiu se eleger. Permaneceu na Câmara\ndos Deputados até o fim de janeiro do ano seguinte, quando se encerraram\no seu mandato e a legislatura.\n\nCom o surgimento do Partido da Reconstrução Nacional (PRN) em 1989,\nlegenda que abrigou a candidatura de Fernando Collor à presidência da\nRepública nas eleições desse ano, Burnett filiou-se a essa agremiação.\nNo pleito de outubro de 1990 voltou a ser eleito deputado federal pelo\nMaranhão em sua nova legenda, assumindo sua cadeira na Câmara dos\nDeputados em fevereiro do ano seguinte. Tornou-se membro titular da\nComissão de Constituição e Justiça e de Redação e suplente da Comissão\nde Trabalho, Administração e Serviço Público, além de membro titular da\ncomissão especial destinada a oferecer à mesa diretora estudos e\nsugestões objetivando o aperfeiçoamento dos trabalhos administrativos e\nlegislativos da Câmara.\n\nAs denúncias de irregularidades no governo do presidente Fernando Collor\n(1990-1992), veiculadas na imprensa, com maior freqüência, ao longo do\nano anterior, atingiram o clímax em maio desse ano, quando a revista\n*Veja*publicou uma entrevista de Pedro Collor, irmão do presidente, na\nqual denunciava a existência de um esquema de corrupção no governo sob o\ncomando de Paulo César Farias, o PC, ex-tesoureiro da campanha\npresidencial. Essa denúncia fez com que o Congresso Nacional instalasse\numa CPI no mês seguinte. As conclusões dessa comissão levaram ao\nenvolvimento do presidente e foi pedido o seu afastamento. Na sessão da\nCâmara dos Deputados de 29 de setembro de 1992, com voto contrário do\ndeputado José Burnett, foi aprovada a admissibilidade de abertura do\nprocesso de *impeachment***do presidente.**Esse resultado fez com que\nCollor deixasse o poder no início de outubro seguinte, no qual foi\nsubstituído, em caráter interino, pelo vice-presidente Itamar Franco. No\njulgamento do processo no Senado no dia 29 de dezembro desse mesmo ano,\no presidente afastado apresentou sua renúncia, que não foi aceita pela\nmesa dessa casa do Congresso. Em seguida, o plenário da Câmara Alta\naprovou o afastamento definitivo do presidente, que, em conseqüência,\nteve os seus direitos políticos suspensos por oito anos. Diante desse\nresultado, Itamar foi efetivado na chefia do Executivo brasileiro.\n\nDentre as principais matérias votadas na Câmara ao longo dessa\nlegislatura, Burnett votou a favor da criação do Fundo Social de\nEmergência, contra o fim do voto obrigatório e faltou à votação do\nprojeto que criava o Imposto Provisório sobre Movimentação Financeira\n(IPMF), que ficou conhecido como imposto do cheque.\n\nDiante dos problemas de saúde que enfrentava, não concorreu à reeleição\nno pleito de outubro de 1994. Permaneceu na Câmara dos Deputados até o\nfim de janeiro de 1995, quando se encerraram o seu mandato e a\nlegislatura.\n\nAfastando-se da política, transferiu-se para o Rio de Janeiro.\n\nEm 2008, de volta ao Maranhão, foi coordenador da campanha eleitoral de\nJoão Castelo, candidato do Partido da Social Democracia Brasileira\n(PSDB), eleito prefeito de São Luís em outubro daquele ano.\n\nCasou-se com Maria de Nazaré Paula Barros Burnett da Silva, com quem\nteve dois filhos.\n\nAlan Carneiro *(atualização)*\n\n \n\nFONTES: CÂM. DEP. *Deputados**;*CÂM. DEP. *Deputados**brasileiros.\nRepertórios*(1967-1971, 1983-1987 e 1991-1995); *Globo* (26/4/84,\n16/1/85, 30/9/92); INF. FAM.\n\n \n","ref":"FONTES: CÂM. DEP. *Deputados**;*CÂM. DEP. *Deputados**brasileiros.\nRepertórios*(1967-1971, 1983-1987 e 1991-1995); *Globo* (26/4/84,\n16/1/85, 30/9/92); INF. FAM.\n\n \n","dic":"DHBB"}
