{"title":"CABRAL, Antônio dos Santos","cargoss":["Arcebispo"],"cargos_esp":["Belo Horizonte"],"datas_ini":[1922],"datas_fim":[1956],"estados":[0],"autor":[0],"content":"**CABRAL, Antônio dos Santos**\n\n\\*religioso; arceb. Belo Horizonte 1922-1956.\n\n \n\n*Antônio dos Santos Cabral* nasceu em Propriá (SE) no dia 8 de outubro\nde 1884, filho do coronel Antônio dos Santos Cabral e de Amélia Maria da\nGlória Cabral.\n\nFez os estudos primários em Natal e iniciou os secundários em Salvador,\nonde, em fevereiro de 1899, ingressou no Seminário Arquiepiscopal de\nSanta Teresa, aí concluindo o curso. Em 1904 recebeu a tonsura clerical\ne, como tonsurado, pregou seu primeiro sermão em novembro desse ano, na\nfesta de Santa Cecília em Propriá. Em 1905 foram-lhe conferidas as\nordens menores e, no ano seguinte, as de subdiácono, de diácono e as\núltimas ordens. Ordenado presbítero em novembro de 1907, na cidade de\nSalvador, por dom Jerônimo Tomé, regressou em seguida à sua cidade\nnatal, onde rezou sua primeira missa em 24 de novembro de 1907, na mesma\nigreja em que fora batizado.\n\nEm janeiro do ano seguinte foi nomeado vigário da paróquia de Propriá\ncomo coadjutor do cônego Rosa Passos, a quem substituiu como pároco por\nocasião do falecimento deste em 17 de março de 1908. Em 4 de agosto de\n1912 foi elevado a cônego, assumindo então o lugar de primeiro\npresbítero no cabido da catedral de Aracaju. Ainda no mesmo ano recebeu\nas insígnias de monsenhor.\n\nTendo-lhe sido já conferido o título de camareiro secreto de Sua\nSantidade o papa Bento XV, em 1º de setembro de 1917 foi nomeado, por\nbreve pontifício, bispo de Natal, como sucessor de dom Joaquim Antônio\nde Almeida, que havia sido o primeiro bispo daquela diocese. Sagrado\nbispo na Catedral Metropolitana do Rio de Janeiro em 14 de abril de 1918\npelo cardeal dom Joaquim Arcoverde de Albuquerque Cavalcanti, tomou\nposse do bispado no dia 30 de maio do mesmo ano. Como bispo de Natal,\nempenhou-se no restabelecimento da estrada de ferro Mossoró e da linha\nde navegação do Lóide Brasileiro para os pequenos portos do Rio Grande\ndo Norte. Deve-se igualmente à sua influência a fundação de várias\ninstituições, como a Escola de Comércio de Natal e o Instituto de\nProteção às Moças Solteiras, ambos em 1919, e o Curso Comercial Feminino\ne a Sociedade Propagadora do Ensino Popular, no ano seguinte. Entre as\ninstituições religiosas e obras pias que fundou e incentivou contam-se a\nCongregação Mariana de Moços e o Círculo de Operários Católicos, ambos\ncriados em 1918, o dia da boa imprensa (18 de janeiro de 1919), o\nSeminário de São Pedro, fundado em 15 de fevereiro de 1919, e o Pão de\nSanto Antônio, criado no ano seguinte. Dom Antônio Cabral foi também\nresponsável pela criação do órgão oficial da diocese, o *Boletim de\nNatal,*lançado em março de 1919, organizando ainda, em junho de 1920, a\nComissão Central das Obras da Nova Catedral. Entre 1918 e 1922 criou na\ndiocese oito novas paróquias e 30 escolas paroquiais.\n\nEm 21 de novembro de 1921, o papa Ben-to XV transferiu dom Antônio\nCabral para a diocese de Belo Horizonte, recém-criada por efeito do\ndesmembramento da arquidiocese de Mariana. Chegou à capital mineira em\n30 de abril de 1922, tomou posse do bispado na igreja de São José e\ninstalou a catedral na igreja da Boa Viagem. No ano seguinte fundou, com\n27 alunos, o Seminário do Coração Eucarístico de Jesus, que viria a se\ntornar o maior da América do Sul. Em 1º de fevereiro de 1924, o papa Pio\nX elevou Belo Horizonte a arquidiocese, sendo dom Antônio Cabral sagrado\nseu primeiro arcebispo. No ano seguinte, o novo arcebispo realizou uma\nviagem à Europa, tendo visitado a Holanda, Portugal, Espanha, França,\nBélgica, Itália, Suíça e Alemanha.\n\nEm 1930 foi inaugurado o primeiro edifício do atual Seminário\nEucarístico, que já contava então com 176 alunos. Quando, em 1932,\ncompletaram-se 25 anos de sacerdócio de dom Antônio Cabral, um dos\nmomentos mais significativos das comemorações foi a realização do\nCongresso da Imprensa Católica, durante o qual surgiu a idéia da\npublicação de um diário católico. A partir de 1935, dom Antônio Cabral\nfavoreceu o desenvolvimento da Ação Católica em sua arquidiocese,\nincentivando a participação dos leigos no apostolado da Igreja. Sua\nimplantação em todo o país pelo cardeal-arcebispo do Rio de Janeiro, dom\nSebastião Leme, se deu em resposta às solicitações do papa Pio XI no\nsentido de que fossem fundadas em todo o mundo associações leigas\nvinculadas à Igreja, fora de qualquer filiação política, com a “tarefa\nde evangelizar as nações”, de modo a “estabelecer o reino universal de\nJesus Cristo”. Ainda em 1935 teve início a publicação de *O Diário,*que\nse tornaria o maior diário católico do Brasil.\n\nEm 1936 realizou-se o II Congresso Eucarístico Nacional em Belo\nHorizonte e, no ano seguinte, dom Antônio Cabral instituiu a Obra da\nAdoração Perpétua na catedral da Boa Viagem. Sempre empenhado em\norganizar a vida paroquial e em estimular o apostolado nos bairros e\nvilas, o arcebispo de Belo Horizonte criou em 1949 a Ação Social\nArquidiocesana, cuja finalidade era estudar, difundir e levar à prática\na doutrina social da Igreja na arquidiocese. Em outubro de 1952 esteve\npresente à sessão de instalação da Conferência Nacional dos Bispos do\nBrasil (CNBB), tendo sido eleito suplente de sua comissão permanente.\nEssa organização foi criada com o objetivo de “coordenar e subsidiar as\natividades de orientação religiosa, de beneficência, de filantropia e\nassistência social” em todo o território nacional, representando uma\ntentativa de centralizar o poder da Igreja, que se encontrava fracionado\nem dezenas de dioceses espalhadas pelo país.\n\nAlém das obras e instituições mencionadas, dom Antônio Cabral, ao longo\ndos 36 anos durante os quais esteve à frente da arquidiocese de Belo\nHorizonte, criou o Colégio Arquidiocesano (futuro Instituto\nArquidiocesano de Educação), o Colégio de Nova Lima, o Sínodo Diocesano,\no palácio Cristo Rei, o Congresso das Vocações Sacerdotais, a Casa Cura\nD’Ars e diversas faculdades que dariam origem à Pontifícia Universidade\nCatólica (PUC) de Minas Gerais em 1958.\n\nEm junho de 1956, dom Antônio Cabral sofreu um derrame cerebral, ficando\nimpedido de exercer suas atividades pastorais. A direção da arquidiocese\npassou então ao bispo auxiliar dom Geraldo de Morais Penido, na\nqualidade de administrador apostólico. Em 30 de novembro de 1957 foi\neste substituído por dom João Resende Costa, que assumiu a arquidiocese\ncom o título de arcebispo coadjutor com direito à sucessão e\nadministrador apostólico *sede plena.*\n\nFoi ainda membro titular da Academia de Letras do Ceará e membro\nhonorário do Instituto Histórico e Geográfico de Minas Gerais.\n\nFaleceu em Belo Horizonte no dia 15 de novembro de 1967.\n\nDentre as diversas cartas pastorais que escreveu, destacam-se a Carta\npastoral do bispo de Natal saudando seus diocesanos (1918), a Carta\npastoral do primeiro bispo de Belo Horizonte saudando seus diocesanos\n(1922), a Pastoral sobre a Igreja e o ensino e a Pastoral sobre a ação\ncatólica.\n\n \n\n \n\nFONTES: CASCUDO, L. *História;*CONFERÊNCIA NAC. BISPOS DO BRASIL;\nGARDEL, L. *Armoiries; Grande encic. Delta*; GUARANÁ, M. *Dic*.;\nHIRSCHOWICZ, E. *Contemporâneos; Minas Gerais*(17/11/67); VELHO\nSOBRINHO, J. *Dic.*\n\n \n","ref":"FONTES: CASCUDO, L. *História;*CONFERÊNCIA NAC. BISPOS DO BRASIL;\nGARDEL, L. *Armoiries; Grande encic. Delta*; GUARANÁ, M. *Dic*.;\nHIRSCHOWICZ, E. *Contemporâneos; Minas Gerais*(17/11/67); VELHO\nSOBRINHO, J. *Dic.*\n\n \n","dic":"DHBB"}
