{"title":"CABRAL, Hugo","cargoss":["Deputado federal"],"cargos_esp":[0],"datas_ini":[1955],"datas_fim":[1959],"estados":["PR"],"autor":[0],"content":"**CABRAL, Hugo**\n\n\\*dep. fed. PR 1955-1959.\n\n \n\n*Hugo Cabral* nasceu em Fortaleza no dia5 de março de 1889, filho de\nLamênio Cabral e de Angelita Marinho de Góis.\n\nAinda jovem, transferiu-se para o Rio de Janeiro, então Distrito\nFederal, onde exerceu diversas atividades, fixando-se afinal como\ncorretor de câmbio.\n\nMais tarde, mudou-se para Londrina (PR), onde adquiriu terras em que\npassou a plantar café e a criar gado, tornando-se um dos maiores\npecuaristas da região. Constituindo-se em líder político, foi\nresponsável pela fundação de diversos clubes e associações em Londrina;\nfiliado à União Democrática Nacional (UDN), assumiu a presidência do\ndiretório regional do partido, e se elegeu prefeito do município.\n\nEm outubro de 1954, elegeu-se deputado federal pelo Paraná na legenda da\nUDN. Empossado na Câmara em fevereiro de 1955, integrou a Frente\nParlamentar Agrária, que cuidava principalmente de questões ligadas à\npecuária e à agricultura. Decidiu não tentar a reeleição em outubro de\n1958, e deixou a Câmara dos Deputados ao final de seu mandato\n(31/1/1959), resolvido a deixar a política.\n\nFoi ainda representante dos cafeicultores paranaenses na junta\nadministrativa do Instituto Brasileiro do Café (IBC), e exerceu o cargo\nde secretário de Viação e Obras Públicas do Paraná.\n\nFaleceu em setembro de 1962.\n\n \n\nFONTES: CÂM. DEP. Anais (1962-20); CÂM. DEP. Deputados; CÂM. DEP.\nDeputados federais. Inventário; CÂM. DEP. Relação dos dep.; SANTOS, J.\nCearense; TRIB. SUP. ELEIT. Dados (3).\n\n \n","ref":"FONTES: CÂM. DEP. Anais (1962-20); CÂM. DEP. Deputados; CÂM. DEP.\nDeputados federais. Inventário; CÂM. DEP. Relação dos dep.; SANTOS, J.\nCearense; TRIB. SUP. ELEIT. Dados (3).\n\n \n","dic":"DHBB"}
