{"title":"ALCÂNTARA, Francisco Augusto Simas de","cargoss":["Comandante do II Distrito Naval","Chefe do Estado-Maior da Armada"],"cargos_esp":[0,0],"datas_ini":[1964,1972],"datas_fim":[1965,1973],"estados":[0,0],"autor":[0],"content":"**ALCÂNTARA, Francisco Augusto Simas de**\n\n\\*militar; comte. II DN 1964-1965; ch. EMA 1972-1973.\n\n \n\n*Francisco Augusto Simas de Alcântara* nasceu no Rio de Janeiro, então\nDistrito Federal, em 22 de fevereiro de 1909.\n\nIngressando na Marinha, cursou a Escola Naval e foi sucessivamente\npromovido a guarda-marinha (1927), segundo-tenente (1931),\nprimeiro-tenente (1933), capitão-tenente (outubro de 1935),\ncapitão-de-fragata (abril de 1951), capitão-de-mar-e-guerra (dezembro de\n1955) e contra-almirante (agosto de 1961).\n\nComandou o II Distrito Naval, sediado em Salvador, de 8 de julho de 1964\na 28 de julho de 1965. Em 31 de dezembro desse ano, foi promovido a\nvice-almirante.\n\nVice-chefe do Estado-Maior da Armada (EMA) em 1967, foi promovido a\nalmirante-de-esquadra, em 20 de novembro de 1969, e designado chefe do\nEMA, em fevereiro de 1972, permanecendo no cargo até abril do ano\nseguinte.\n\nDurante sua carreira, freqüentou os cursos de Aperfeiçoamento de\nArmamento, de Tática Anti-Submarina e da Escola Superior de Guerra, em\nnível de estado-maior. Cursou ainda a Escola de Guerra Naval.\n\nApós passar para a reserva, dedicou-se à iniciativa privada. Foi\ndiretor-presidente da Helistone — Indústria e Comércio de Hélices S.A. e\nda Pina — Intercâmbio Comercial Industrial e Pesca S.A.\n\nMorreu no Rio de Janeiro, em 21 de outubro de 1976.\n\n \n\nFONTES: *Boletim de Oficiais*(1972); CORRESP. SERV. DOC. GER. MAR.;\n*Jornal do* *Brasil (*26/10/76*);*MIN. MAR.\n*Almanaque*(1970);*Perfil*(1972*).*\n\n \n","ref":"FONTES: *Boletim de Oficiais*(1972); CORRESP. SERV. DOC. GER. MAR.;\n*Jornal do* *Brasil (*26/10/76*);*MIN. MAR.\n*Almanaque*(1970);*Perfil*(1972*).*\n\n \n","dic":"DHBB"}
