{"title":"CÂMARA, Antônio","cargoss":["Deputado federal","Constituinte"],"cargos_esp":[0,0],"datas_ini":[1983,1987],"datas_fim":[1991,1988],"estados":["RN",0],"autor":[0],"content":"**CÂMARA, Antônio**\n\n\\*dep. fed. RN 1983-1991; const. 1987-1988.\n\n*Antônio Severiano da Câmara Filho* nasceu em João Câmara (RN), no dia\n13 de junho de 1938, filho de Antônio Severiano da Câmara e de Maria\nAmélia Soares da Câmara.\n\nEm 1964 bacharelou-se em ciências jurídicas e sociais pela Faculdade de\nDireito da Universidade Federal do Rio Grande do Norte (UFRN). Dois anos\ndepois, em novembro de 1966, foi eleito deputado estadual pela legenda\ndo Movimento Democrático Brasileiro (MDB), partido de oposição ao regime\nmilitar instaurado no país em abril de 1964, e, a partir de então,\nsucessivamente nas eleições de 1970, 1974 e 1978.\n\nFoi segundo-vice-presidente da Assembléia Legislativa, líder do partido\n(1979) e membro efetivo da Comissão de Economia e Justiça.\n\nEm novembro de 1979, com a extinção do bipartidarismo e a conseqüente\nreformulação partidária, filiou-se ao Partido do Movimento Democrático\nBrasileiro (PMDB), herdeiro do MDB.\n\nSecretário-geral do partido em 1982, denunciou ao Tribunal Regional\nEleitoral (TRE) do Rio Grande do Norte o crime praticado pelo secretário\ndo Interior e Justiça, Manuel de Brito, e pelo presidente do Banco do\nDesenvolvimento do Estado, Efren de Lima, que haviam permitido o uso das\nrepartições que dirigiam durante a campanha eleitoral. Numa decisão\ninédita, o TRE acolheu a denúncia e encaminhou o processo à Procuradoria\nda República.\n\nNas eleições de novembro de 1982 foi eleito deputado federal, assumindo\no cargo em fevereiro de 1983, um mês depois de encerrado seu mandato\nestadual. Ao longo da legislatura, foi titular da Comissão de Economia,\nIndústria e Comércio e suplente da Comissão de Agricultura e Política\nRural.\n\nEm 25 de abril de 1984 votou a favor da emenda Dante de Oliveira, que\nprevia o restabelecimento de eleições diretas para presidente da\nRepública já em novembro daquele ano. Derrotada a proposição — faltaram\n22 votos para que o projeto pudesse ser encaminhado à apreciação do\nSenado Federal —, Antônio Câmara apoiou o candidato oposicionista,\nTancredo Neves, na reunião do Colégio Eleitoral de 15 de janeiro de\n1985. Eleito pela Aliança Democrática, uma união do PMDB com a\ndissidência do Partido Democrático Social (PDS), abrigada na Frente\nLiberal, Tancredo não chegou a ser empossado, vindo a falecer em 21 de\nabril de 1985 por motivo de doença. Nesta ocasião, fora efetivamente\nsubstituído pelo vice José Sarney, que já vinha exercendo interinamente\na presidência desde 15 de março do mesmo ano.\n\nNo pleito de novembro de 1986, foi eleito deputado federal constituinte\npela legenda do PMDB, iniciando o mandato em 1º de fevereiro do ano\nseguinte. Presidiu o diretório estadual do partido no biênio 1987-1988.\n\nSegundo-vice-presidente da Subcomissão dos Direitos e Garantias\nIndividuais, foi suplente da Subcomissão da Família, do Menor e do Idoso\ne das comissões de Educação, Cultura e Esportes; Ciência e Tecnologia; e\nComunicação. Votou contra o rompimento de relações diplomáticas com\npaíses que praticassem políticas de discriminação racial, a pena de\nmorte, a limitação do direito de propriedade, a jornada semanal de 40\nhoras, a pluralidade sindical, a estatização do sistema financeiro. Em\ncontrapartida, apoiou a proteção do emprego contra demissão sem justa\ncausa, o turno ininterrupto de seis horas, o aviso prévio proporcional,\na soberania popular, o voto aos 16 anos, o presidencialismo, a\nnacionalização do subsolo, o limite de 12% ao ano para os juros reais, a\nproibição do comércio de sangue, a desapropriação da propriedade\nprodutiva. Tendo votado a favor do mandato de cinco anos para o\npresidente José Sarney, ausentou-se das sessões em que foram debatidos o\nmandado de segurança coletivo, o limite para os encargos da dívida\nexterna, a descriminalização do aborto e criação de um fundo de apoio à\nreforma agrária.\n\nCom a promulgação da nova Carta Constitucional, em 5 de outubro de 1988,\nintegrou-se aos trabalhos legislativos ordinários, deixando a Câmara em\nfevereiro de 1991, sem disputar reeleição.\n\nAinda em 1991, tornou-se conselheiro do Tribunal de Contas do Rio Grande\ndo Norte, onde presidiu a Primeira Câmara, em 1994; a Segunda Câmara, em\n1995; e o próprio tribunal, em 1997-1998. Em 1999, foi indicado\nconselheiro corregedor, com mandato previsto até o ano 2000.\n\nCasado com Marli Andrade Alecrim Câmara, teve quatro filhos.\n\nFONTES: CÂM. DEP. *Deputados brasileiros. Repertório* (1983-1987);\nCOELHO, J. & OLIVEIRA, A.*Nova*; *Folha de S. Paulo*(19/1/87); INF.\nBIOG.; TRIB. REG. ELEIT. RN; *Veja* (14/7/82).\n\n \n","ref":"FONTES: CÂM. DEP. *Deputados brasileiros. Repertório* (1983-1987);\nCOELHO, J. & OLIVEIRA, A.*Nova*; *Folha de S. Paulo*(19/1/87); INF.\nBIOG.; TRIB. REG. ELEIT. RN; *Veja* (14/7/82).\n\n \n","dic":"DHBB"}
