{"title":"CÂMARA, Hélder","cargoss":["Arcebispo"],"cargos_esp":["Olinda e Recife"],"datas_ini":[1964],"datas_fim":[1985],"estados":[0],"autor":[0],"content":"**CÂMARA, Hélder**\n\n\\*religioso; mov. integralista; arceb. Olinda e Recife 1964-1985.\n\n \n\n*Hélder Pessoa Câmara* nasceu em Fortaleza no dia 7 de fevereiro de\n1909, filho de João Câmara Filho e de Adelaide Pessoa Câmara.\n\nEntrou para o seminário arquidiocesano de sua cidade natal em 1923 e\nmais tarde fez os exames preparatórios de filosofia e teologia.\nOrdenou-se padre em agosto de 1931 em Fortaleza.\n\nAinda em 1931, organizou a Juventude Operária Cristã, que se ligou à\nLegião Cearense do Trabalho (LCT), criada pelo tenente Severino Sombra.\nA LCT, inspirada no salazarismo português, pretendia ser uma organização\nde associações populares e profissionais destinada à defesa dos\ntrabalhadores, tendo por metas a economia distributiva e o regime\ncorporativo. No ano seguinte, com a prisão e exílio de Severino Sombra,\nque aderira à Revolução Constitucionalista de 1932, assumiu, juntamente\ncom Jeová Mota, a chefia da organização. Ainda naquele ano a LCT, que\nchegou a ter grande número de adeptos em Fortaleza e no interior do\nCeará, uniu-se à Ação Integralista Brasileira (AIB), agremiação difusora\ndos ideais do integralismo. Este movimento político de extrema-direita,\ninspirado no fascismo que ganhava vulto na Europa, pregava uma rígida\norganização da sociedade com base nos princípios de disciplina e\nhierarquia. Apresentava-se, ainda, como vanguarda nacionalista na luta\ncontra o comunismo, o capitalismo internacional e a liberal-democracia,\ne tinha como principal ideólogo Plínio Salgado. O movimento encontrava\ntolerância junto à Igreja Católica, uma vez que se apresentava como\nsolução possível para enfrentar a luta de classes e a expansão do\ncomunismo.\n\nA pedido de Plínio Salgado e com autorização de seu superior, o\narcebispo de Fortaleza, dom Manuel da Silva Pimentel, o padre Hélder\nassumiu a chefia do setor de educação da AIB no Ceará. Nessa época, ao\nparticipar no Rio de Janeiro do Congresso Católico de Educação,\nclassificou como de conteúdo comunista um manifesto lançado pela\nAssociação Brasileira de Educação (ABE), da qual faziam parte Anísio\nTeixeira e Manuel Lourenço Filho. Durante sua permanência no Rio,\npronunciou conferências sobre os valores espirituais do integralismo no\nColégio Santo Inácio, arregimentando alunos para o movimento.\n\nQuando o Brasil se preparava para eleger a Assembléia Constituinte de\n1933, a Liga Eleitoral Católica (LEC), fundada em 1932 pelo cardeal dom\nSebastião Leme, arcebispo do Rio de Janeiro, conclamou os eleitores a\nvotarem em candidatos de quaisquer partidos, com a condição de que eles\nse propusessem a defender no Congresso a Constituição proclamada em nome\nde Deus, o ensino da religião nas escolas, a assistência religiosa nas\nforças armadas e a combater o divórcio. Apenas no Ceará a LEC se\ntransformou em partido político. O padre Hélder, a pedido do arcebispo\nde Fortaleza, percorreu o estado fazendo campanha eleitoral, com o\nslogan: “Um voto para a LEC é um voto para Nosso Senhor Jesus Cristo.” A\nLEC do Ceará saiu amplamente vitoriosa no pleito de maio de 1933,\nelegendo seus seis candidatos. Nas eleições de outubro de 1934, a LEC\nelegeu o maior número de deputados federais e estaduais do Ceará. Além\ndisso, seu candidato ao governo estadual, Francisco de Meneses Pimentel,\nfoi eleito pela Assembléia Legislativa cearense.\n\nIniciado o novo governo, o padre Hélder foi convidado para assumir o\ncargo de diretor do Departamento de Educação do Ceará, em 1935. Em\nconseqüência de desentendimentos com Meneses Pimentel, contudo, pediu\ndemissão no ano seguinte. Francisco Campos — que naquele ano de 1936\nassumira a Secretaria de Educação do Distrito Federal — convidou-o para\no cargo de assistente-técnico de Educação do Distrito Federal. Com a\npermissão do seu superior, dom Hélder mudou-se, então, para o Rio de\nJaneiro.\n\n \n\nNo Rio de Janeiro (1936-1964)\n\nSubordinado a partir de 1936 ao cardeal dom Sebastião Leme, o padre\nHélder foi solicitado a se afastar de qualquer atividade política e,\nconseqüentemente, do integralismo. Acolheu o pedido de seu superior e\nfoi designado diretor-técnico do ensino de religião da arquidiocese, com\na missão de implantar o ensino religioso nas escolas públicas do Rio de\nJaneiro.\n\nEm princípios de 1937 Everardo Backheuser, diretor do Instituto de\nPesquisas Educacionais do Distrito Federal, nomeou-o chefe da seção de\nMedidas e Programas. Com a proximidade das eleições de janeiro de 1938\npara a presidência da República, Getúlio Vargas, apoiado pelo ministro\nda Guerra, Eurico Dutra, e pelo chefe do Estado-Maior do Exército,\ngeneral Pedro Aurélio de Góis Monteiro, fechou em 10 de novembro de 1937\nas duas casas do Congresso e outorgou nova Constituição, de caráter mais\ncentralista e autoritário, sob pretexto de conter a ameaça comunista,\ninstalando dessa forma o Estado Novo (1937-1945). Através de contatos\ncom Francisco Campos e depois com o próprio Vargas, Plínio Salgado tomou\nconhecimento e apoiou as diversas etapas do golpe de 1937. Em seguida,\nprocurou o padre Hélder e pediu-lhe que, com a devida autorização do\ncardeal, fizesse parte do conselho supremo da AIB, composto de 12\nmembros. Consultado, o cardeal Leme autorizou-o a aceitar, com a\ncondição de que fosse uma espécie de assistente eclesiástico. Plínio\nSalgado concordou com a condição, mas, a cada discurso do padre Hélder,\nos jornais integralistas o anunciavam como membro do conselho supremo da\nAIB.\n\nEm conseqüência disso, o padre Hélder afastou-se do partido que, a\nexemplo das demais agremiações políticas, em 3 de dezembro daquele mesmo\nano de 1937, foi fechado por ordem de Vargas. Anos mais tarde, dom\nHélder classificaria a sua passagem pelo integralismo como “um erro de\njuventude” e explicaria que “o aspecto social não era o forte de meus\nmestres (no seminário). Tanto assim que a nossa visão era a de que o\nmundo se dividiria entre direita e esquerda, entre capitalismo e\ncomunismo. E nos sopravam, discretamente, que dos males, o menor. Pouco\na pouco foi fácil ver que não era verdadeiro este embate”.\n\nNos anos seguintes, dom Hélder dedicou-se à educação. Participou e foi\naprovado num concurso aberto por Gustavo Capanema, ministro da Educação\ne Cultura, para técnico de educação, uma vez que exercia o cargo sem ser\ndiplomado. Depois do Estado Novo, recebeu em 1946, durante a presidência\ndo general Eurico Dutra, a autorização do cardeal dom Jaime de Barros\nCâmara, arcebispo do Rio desde 1943, para demitir-se do Ministério da\nEducação. Dom Jaime quis, naquele mesmo ano, fazê-lo seu bispo-auxiliar,\nmas o processo para elevá-lo a bispo foi dificultado pela nunciatura\napostólica, que preveniu o Vaticano contra a inconveniência de tal\nmedida. Segundo informou a nunciatura, haveria protestos pelo fato de o\ncardeal ter como auxiliar um bispo integralista. O papa realmente negou\na nomeação, que só seria concedida seis anos depois.\n\nEm 1947 o padre Hélder organizou o secretariado nacional da Ação\nCatólica Brasileira (ACB). Este movimento, difundido mundialmente a\npartir da autorização dada em 1934 pelo papa Pio XI, tinha por objetivo\nintegrar leigos e a Igreja e fora implantado no Brasil em 1935 pelo\ncardeal Leme.\n\nNomeado primeiro assistente-geral da ACB, cargo que ocuparia até 1962, a\npartir de 1949 o padre Hélder dirigiu a Revista Catequética, colaborando\ntambém com as revistas Ação Católica, Assistente Eclesiástico e Revista\nEclesiástica Brasileira.\n\nComo conselheiro privado do núncio dom Carlo Chiarlo e, mais tarde, a\npartir de 1954, de seu sucessor, dom Armando Lombardi, dom Hélder\ntrabalhou pela criação da Conferência Nacional dos Bispos do Brasil\n(CNBB). A idéia surgiu em conseqüência dos problemas gerados pelas\npróprias condições do país, com as dioceses se multiplicando e cada\nbispo envolvido por numerosos problemas. Era necessária, no entendimento\nde dom Hélder, a criação de um órgão que estivesse a serviço do povo,\natravés da Igreja ou de seus bispos. Na qualidade de assistente-geral da\nACB, dom Hélder foi encarregado pelo núncio dom Carlo Chiarlo de estudar\ne comentar as 18 teses selecionadas para o Congresso de Leigos,\nrealizado no Vaticano em 1950, ao qual compareceu. Ao final do seu\nparecer acrescentou a seguinte frase: “Isto será impraticável sem a\ncriação da Conferência dos Bispos do Brasil.” Durante sua permanência em\nRoma, manteve encontros com o responsável pela criação de organismos\ndesse tipo, o secretário de Estado do Vaticano, monsenhor Giovanni\nMontini, que seria eleito papa em 1963 com o nome de Paulo VI.\n\nEm princípios de 1952 chegou do Vaticano a permissão para a criação da\nCNBB. Em março do mesmo ano, o padre Hélder foi eleito bispo-auxiliar do\nRio de Janeiro, tendo sido sagrado em abril e imediatamente empossado.\nFinalmente, ao ser criada a CNBB em outubro de 1952, foi eleito\nsecretário-geral da organização, enquanto dom Carlos Carmelo de\nVasconcelos Mota, cardeal-arcebispo de São Paulo, foi seu presidente. Ao\nse iniciarem em 1954 os preparativos para o XXXVI Congresso Eucarístico\nInternacional, que teria lugar no Rio de Janeiro no ano seguinte, dom\nHélder foi designado organizador do evento. A Igreja e o governo na\nocasião mantinham uma estreita colaboração e o presidente Getúlio Vargas\ndesignou oficialmente o embaixador João Coelho Lisboa como homem de\nligação entre a administração e a arquidiocese, para auxiliar esta\núltima em tudo o que se relacionasse com o congresso.\n\nDurante a crise que precedeu o suicídio do presidente Vargas, em agosto\nde 1954, o cardeal dom Jaime Câmara procurou manter uma posição neutra.\nDom Hélder, juntamente com o cardeal, visitou Getúlio Vargas no palácio\ndo Catete dias antes de sua morte. Dentro da mesma linha de neutralidade\ne apoio ao governo constituído, adotada pela Igreja na época, dom Hélder\nfoi um dos primeiros a visitar João Café Filho como presidente da\nRepública, logo que este foi empossado. Falando em seu nome e no do\ncardeal, lamentou o suicídio de Vargas e referiu-se ao “espírito de\ncolaboração que os animava ante a árdua tarefa da presidência na\nmanutenção da ordem e na preservação do regime”.\n\nEm abril de 1955 foi promovido a arcebispo-coadjutor do Rio de Janeiro.\nFoi secretário-geral do Congresso Eucarístico Internacional, realizado\nem julho, e teve participação efetiva na I Conferência Geral do\nEpiscopado Latino-Americano, realizada também no Rio entre 25 de julho e\n7 de agosto de 1955, durante a qual foi decidida a criação do Conselho\nEpiscopal Latino-Americano (Celam). Ainda em 1955 passou a integrar o\nConselho Nacional de Educação, que se tornou mais tarde o Conselho\nFederal de Educação, órgão ligado ao Ministério de Educação e Cultura,\nresponsável, em última instância, pelas questões relativas ao ensino no\npaís.\n\nEm 1956, criou a organização civil Cruzada de São Sebastião, que se\npropunha a “urbanizar, humanizar e cristianizar” as favelas da cidade do\nRio de janeiro, contando, para isso, com o auxílio de campanhas públicas\nde arrecadação e de doações de negociantes, cooperativas e entidades\ngovernamentais. Em menos de um ano construiu os primeiros conjuntos\nhabitacionais da cidade, o que lhe custou críticas de setores da\nsociedade, já que esses imóveis se localizavam na Zona Sul do Rio de\nJaneiro, em bairros valorizados, como o conjunto construído no Leblon.\nEm janeiro de 1956, dom Hélder organizou o I Congresso Geral das Favelas\nCariocas, no Teatro João Caetano.\n\nEm 1958 foi delegado do Brasil à I Reunião do Celam, realizada em\nBogotá, Colômbia, onde foram discutidos problemas da Igreja na América\nLatina. Em 1959 fundou o Banco da Providência, que se propunha a atuar\nno que foi chamado de “faixa da miséria”, recolhendo e distribuindo para\npessoas necessitadas alimentos, remédios, roupas e dinheiro, além de\ndar-lhes orientação para trabalho, moradia e educação. Para o seu\nfuncionamento foi necessário desenvolver iniciativas que proporcionassem\nrecursos financeiros. No mesmo ano, o setor encarregado de roupas e\ncalçados promoveu um bazar que, na época, rendeu uma pequena fortuna.\nDesse bazar surgiu a idéia de se promover anualmente a Feira da\nProvidência, que angariaria fundos para o banco e contaria com o apoio\nda arquidiocese.\n\nEm 1960, dom Hélder foi eleito segundo-vice-presidente do Celam. Em\njaneiro de 1962, por sua iniciativa e através da Cruzada, foi inaugurado\no Centro de Abastecimento São Sebastião, na avenida Brasil, no Rio. No\nmesmo ano integrou a Comissão para Disciplina do Clero, preparatória do\nConcílio Vaticano II, convocado pelo papa João XXIII. Após exaustivos\ntrabalhos de organização e seleção de temas a serem debatidos, o\nconcílio foi aberto no dia 11 de outubro de 1962 e teria a duração de\ntrês anos. Até então a convocação dos bispos, cardeais e teólogos para\numa reunião conciliar tinha por finalidade definir artigos de fé como\ndogmas e da moral adotada e prescrita. João XXIII, entretanto, pregava\numa reformulação na forma de apresentar a fé cristã ao mundo moderno,\nonde a ciência e a crítica tivessem acesso. A preocupação era sempre\ncolocar o homem no centro das discussões e a religião católica em face\ndas exigências do mundo, enquadrando cada povo na sua realidade\npolítica, social e econômica. A visão de João XXIII, e mais tarde do seu\nsucessor Paulo VI, foi de preservar a cultura cristã no essencial e\napreciar os aspectos relativos à mutabilidade do progresso humano.\n\nEssa reestruturação da Igreja levou tanto os religiosos quanto os leigos\na uma reconsideração de seus valores e campo de atuação. A Igreja deixou\nclara sua opção pelos pobres e uma intenção de trabalhar com eles e não\napenas para eles. Dom Hélder, consciente desta opção e compartilhando da\nnova visão da Igreja, percebeu seu distanciamento das idéias\nconservadoras do seu superior, o cardeal dom Jaime Câmara. Os dois\ndivergiam frontalmente em questões importantes, sobretudo as de temática\nsocial. Pediu, então, e obteve, seu afastamento do Rio de Janeiro. Em\nprincípios de março de 1964, chegou a ordem de transferência.\n\nNo decorrer daquele mês agravou-se a crise política no país. Poucos dias\ndepois do comício da Central, realizado em 13 de março de 1964, em favor\ndas reformas de base e presidido pelo presidente João Goulart, numa de\nsuas últimas aparições como chefe do governo, o cardeal-arcebispo de São\nPaulo, Carlos Carmelo de Vasconcelos Mota, na qualidade de presidente da\nCNBB, e dom Hélder, na de secretário-geral, avistaram-se com o\npresidente no palácio Laranjeiras. Os dois religiosos procuraram\n“prevenir o presidente contra uma atitude precipitada e lhe mostraram a\nfalta de um plano sério de reformas das estruturas, a falta de um plano\npara o estabelecimento de um verdadeiro socialismo humano”, além do\nperigo de uma reação da extrema-direita. A cobertura dada pela imprensa\nao encontro sugeriu que a CNBB apoiava as reformas propostas pelo\ngoverno.\n\nCom a vitória do movimento político-militar que derrubou Goulart em 31\nde março, houve uma alteração significativa na orientação até então\nvigente na CNBB. Dom Carmelo Mota foi transferido da Arquidiocese de São\nPaulo para a de Aparecida do Norte, ao passo que dom Hélder foi afastado\nda secretaria-geral da entidade. Em abril, foi feito arcebispo de Olinda\ne Recife pelo papa Paulo VI, devido à morte de dom Carlos Coelho, até\nentão titular daquela arquidiocese. Recebeu o pálio arquiepiscopal\ndiretamente das mãos do papa, durante a III Sessão do Concílio, que\nainda estava em andamento.\n\n \n\nEm Olinda e Recife\n\nOs desentendimentos do arcebispo de Olinda e Recife com as autoridades\nmilitares começaram logo depois de sua chegada a Pernambuco, quando dom\nHélder foi acusado de proteger padres suspeitos de subversão, entre os\nquais dom José Lamartine e os padres Almeri e Sena. Ainda em 1964 dom\nHélder deixou a secretaria-geral da CNBB, sendo substituído por dom José\nGonçalves da Costa, e assumiu a secretaria da Ação Social daquela\nentidade. Em maio de 1965 promoveu, em Recife, um seminário regional do\nNordeste, que discutiu propostas de desenvolvimento da região e a\nformação de sacerdotes. Sua exposição na abertura do seminário abordou\nlongamente a questão do desenvolvimento do Nordeste e do papel da Igreja\nna sua promoção. Suas palavras não foram bem recebidas pelo governo e\npelo próprio presidente, marechal Humberto Castelo Branco.\n\nEm 31 de março de 1966 dom Hélder recusou-se a celebrar uma missa em\ncomemoração ao segundo aniversário do movimento de 1964. No final de\njulho, em informação secreta para difusão a todos os comandos a ele\nsubordinados, o general Itiberê Gouveia do Amaral, comandante da 10ª\nRegião Militar (10ª RM), sediada em Fortaleza, lhe fez violentas\nacusações. O Jornal do Brasil publicou as acusações na íntegra, no dia\n14 de agosto de 1966. O general responsabilizava dom Hélder pela\n“desagregação do rebanho católico em conseqüência de suas atitudes” e o\nacusava de ser esquerdista, ligado à Ação Popular (AP), organização\npolítica criada em junho de 1962 por jovens católicos, com o objetivo de\npromover a transformação radical da estrutura brasileira “em sua\npassagem do capitalismo para o socialismo”. O documento concluía\nafirmando que os comunistas consideravam a Igreja Católica desorganizada\nem Pernambuco e em condições maduras para um trabalho de infiltração.\n\nTais informações teriam sido conseqüência de um documento, datado de 14\nde julho de 1966, da Regional Nordeste II, com sede em Recife, assinado\npelos bispos daquela divisão da CNBB. O documento era uma declaração\ndirigida à Ação Católica Operária, à Ação Católica Rural e à Juventude\nAgrária Católica, tratando de um manifesto dessas organizações que\ndenunciava injustiças contra trabalhadores da região. No dia da\npublicação da informação secreta, o presidente Humberto Castelo Branco,\nque se encontrava em Pernambuco, avistou-se com dom Hélder para discutir\no incidente. O encontro foi, nas palavras do arcebispo, cordial,\ndeixando a impressão de que o presidente “realmente desejava pôr termo à\nsérie de equívocos que haviam surgido entre os militares e os bispos do\nNordeste”.\n\nNo dia seguinte, o discurso do presidente fez alusões à declaração dos\nbispos que pareceram a dom Hélder “injustas e indisfarçáveis”, fato que\no levou a escrever uma carta a Castelo Branco, lembrando que a Operação\nEsperança, então desenvolvida pela Igreja no Nordeste, vinha oferecendo\n“colaboração a órgãos como a Superintendência do Desenvolvimento do\nNordeste (Sudene) e a Cooperativa de Habitação Popular (Cohab)”. E fazia\nmenção a “intrigas que encontraram nas palavras de Vossa Excelência\nexcelente ponto de partida”. Na ocasião, vários setores da Igreja se\nmostraram solidários a dom Hélder. O arcebispo de Goiânia denunciou como\nsubversivos os oficiais que o criticavam. Dom José Nílton Batista\nPereira, arcebispo de Brasília, declarou existir uma “mentalidade\nsectária empenhada em desacreditar a hierarquia, o clero e os\ncatólicos”. Ainda no dia 24 de agosto foi divulgado, no Rio de Janeiro,\num manifesto assinado por 17 eclesiásticos e centenas de leigos,\nsolidarizando-se com dom Hélder e os prelados do Nordeste. Em Nova\nFriburgo (RJ), o bispo Dom Clemente Isnard declarou que a independência\ndos bispos, “se violada, deixará de ser um assunto interno brasileiro\npara se tornar um atentado à liberdade religiosa garantida pela Carta da\nONU”. Em setembro de 1966, em encontro com jornalistas estrangeiros no\nRio, dom Hélder declarou que o incidente do Nordeste fora “um conflito\nde idéias e não de homens”.\n\nEm agosto de 1967, já no governo do marechal Artur da Costa e Silva, dom\nHélder proclamou perante a Assembléia Legislativa de Pernambuco “a\nnecessidade de uma América Latina livre, não apenas no plano político,\nmas também no plano econômico”, afirmando sua convicção que “só a ação\nsocial da Igreja poderá fazer fracassar a revolução violenta no\nNordeste”. Em 30 de novembro, a comissão central da CNBB publicou um\nmanifesto que, ao mesmo tempo em que condenava a subversão,\nsolidarizava-se com “nossos irmãos bispos, padres e leigos, no momento\nem que são vítimas da incompreensão e da injustiça no cumprimento de um\ntrabalho apostólico autêntico”.\n\nEm 1968 o conflito entre Igreja e governo se acentuou ainda mais. Em\njaneiro, o bispo de Santo André, uma das cidades da zona industrial de\nSão Paulo, declarou publicamente: “Uma revolução armada pode ser lícita\nquando reina a opressão e quando vigoram salários de fome.” No mês\nseguinte, dom Hélder fez eco a esta afirmação ao condenar a existência\nde um regime que se assemelhava ao feudalismo do Nordeste, afirmando ao\nmesmo tempo sua “convicção na marcha inelutável do socialismo”, ao qual\na Igreja pode oferecer “a mística da fraternidade universal,\nincomparavelmente superior à mística estreita do materialismo\nhistórico”. Em julho, a IX Assembléia da CNBB terminou com um apelo às\nreformas, à não-violência e a um retorno às liberdades individuais. No\nmês de setembro, dom Hélder foi delegado oficial do episcopado\nbrasileiro à II Assembléia-Geral do Celam, realizada em Medellin, na\nColômbia. Na reunião, em que adquiriu incomparável destaque por suas\nenérgicas posições em favor dos pobres, tomou posição em favor do\ndesenvolvimento econômico e da promoção humana nos países pobres do\nTerceiro Mundo. Em novembro do mesmo ano, lançou, no estado de Alagoas,\no movimento Ação, Justiça e Paz, que pregava a luta contra as estruturas\narcaicas da região e do país, sobretudo as estruturas agrária e\neducacional. O governo, a despeito dos protestos, iniciou uma série de\nmedidas repressivas contra o clero, movendo através da imprensa intensa\ncampanha destinada a apresentar os prelados progressistas como elementos\nmais preocupados em desenvolver atividades políticas do que propriamente\nreligiosas.\n\nAinda em 1968 dom Hélder deixou a secretaria da Ação Social da CNBB e\nassumiu a presidência da Regional Nordeste II. Na ocasião, passou também\na integrar a comissão representativa da CNBB. Leigos e religiosos com\nquem trabalhou nesse período sofreram as mais diversas pressões. Essas\npressões ganharam força com o clima de insegurança instalado a partir da\nedição do Ato Institucional nº 5, em 13 de dezembro de 1968. Em maio de\n1969, o padre Antônio Henrique Pereira Neto, coordenador da Pastoral da\nJuventude no Recife e assessor do arcebispo, foi seqüestrado, torturado\ne assassinado em Recife, sendo o crime atribuído a extremistas de\ndireita.\n\nAinda em 1969 dom Hélder recebeu três prêmios: o Memorial Juan XXIII, na\nEspanha; o Martin Luther King, nos Estados Unidos; e o Internacional\nViareggio da Paz, na Itália.\n\nEm maio de 1970, no palácio dos Esportes, em Paris, dom Hélder fez uma\nconferência para mais de dez mil pessoas, relatando a situação em que se\nencontrava o Brasil e denunciando casos de tortura de presos políticos,\ntodos comprovados pela Comissão Internacional de Juristas. Ele afirmou\ndepois: “O que fiz foi defender a justiça. Se combato as injustiças\nquando são cometidas em qualquer parte do mundo, por que haveria de me\ncalar quando essas injustiças e arbitrariedades se passam dentro do meu\npaís?” De volta ao Brasil, dom Hélder enfrentou uma forte campanha\natravés da imprensa. Recebeu vários ataques, entre eles os do sociólogo\nGilberto Freire, que o acusou de aliado do comunismo internacional; os\ndo deputado gaúcho Clóvis Stenzel, da Aliança Renovadora Nacional\n(Arena), partido que apoiava o regime militar; e os do governador de São\nPaulo, Roberto Abreu Sodré. Em outubro, membros do Tribunal Regional\nEleitoral (TRE) de São Paulo proibiram que fosse ao ar parte de um vídeo\ngravado pelo vice-governador de São Paulo, Hilário Torloni, então\ncandidato da Arena ao Senado, em que ele fazia a defesa de dom Hélder\ndas acusações de Sodré. Em seguida, o arcebispo foi proibido de\ndiscursar no país, assim como de falar no rádio e na televisão. A\nimprensa, controlada pelo governo, foi proibida de mencionar seu nome,\nsituação que se manteve nos anos seguintes.\n\nMas dom Hélder recebeu um grande número de convites para falar no\nexterior, iniciando uma série de viagens principalmente por países da\nEuropa e da América do Norte. Os temas mais tratados em suas\nconferências eram os problemas sociais e econômicos do Terceiro Mundo, a\natuação das empresas multinacionais e a repressão movida pelos governos\ntotalitários. Nas suas palestras, sempre assumiu posição em favor dos\npaíses subdesenvolvidos e responsabilizou o capitalismo pela situação de\nmiséria em que esses países viviam. Dom Hélder nunca visitou um país do\nbloco comunista, porque, segundo ele, “não teria ali a liberdade de\nfalar o que quero”. Também nunca participou, em país nenhum, de\nmanifestações promovidas por partidos políticos. Segundo afirmou, partiu\npara o exterior porque se convenceu de que “hoje, de tal maneira os\nproblemas humanos têm uma escala mundial que não adiantaria querer a\nmudança das estruturas injustas que esmagam quase três quartos da\nhumanidade trabalhando apenas no Brasil”. Suas viagens foram realizadas\ncom a autorização do papa Paulo VI e de acordo com um programa por ambos\nestabelecido. Foi fixado em cinco o número de viagens por ano, e sempre\nque recebia um convite, dom Hélder só o aceitava depois de consultar o\nbispo responsável pelo lugar a ser visitado.\n\nEm 1974, foi delegado do episcopado brasileiro ao III Sínodo dos Bispos,\nrealizado em Roma. No mesmo ano foi indicado para receber o Prêmio Nobel\nda Paz, concedido anualmente pelo Parlamento da Noruega. Ficou acertado,\npor todos os jurados, que o prêmio lhe seria conferido. No entanto, dois\ndos cinco membros do júri terminaram por se demitir, declarando\npublicamente que os três outros haviam sucumbido a “pressões\ninconfessáveis”, traindo os compromissos prévios em torno do nome de dom\nHélder Câmara. Em reação, organizações de jovens noruegueses levantaram,\ncom donativos populares, uma importância superior ao dobro daquela\nconferida pelo prêmio, dando a dom Hélder o Prêmio Popular da Paz. O\nmesmo fizeram os jovens de Frankfurt, na então Alemanha Federal. Anos\nmais tarde, em 1997, o livro Dom Hélder Câmara: entre o poder e a\nprofecia, de Nélson Piletti e Válter Praxedes, revelaria as manobras do\ngoverno Médici para sabotar a candidatura de dom Hélder à premiação. Por\nintermédio da representação diplomática brasileira em Oslo, na época\nchefiada pelo embaixador Jaime de Sousa Gomes, e com a colaboração do\nempresário norueguês Tore Munch, que tinha negócios no Brasil, foi\ndesencadeada uma campanha difamatória na imprensa norueguesa contra o\nreligioso brasileiro e foram feitas pressões sobre os integrantes do\nComitê Nobel.\n\nEm fevereiro de 1977, dom Hélder participou da reunião da CNBB realizada\nem Itaici (SP), quando foi publicado o documento Exigência cristã de uma\nordem política. Em dezembro, depois de sete anos de silêncio no Brasil,\npronunciou um discurso na Faculdade de Direito de Recife, sobre o tema\n“Direitos humanos no mundo atual”.\n\nEm 1978, em entrevista à revista Veja, defendeu a implantação de um\nsistema político capaz de dar fim às estruturas injustas. Segundo ele,\nnenhum dos diferentes capitalismos deixa de colocar o lucro acima do\nhomem, o que leva a esmagamentos horríveis. Continuando, afirmava: “O\ngrave é que ao pensarmos em socialismo humano, que salve efetivamente a\npessoa humana e não esmague a liberdade a pretexto de assegurar a\nigualdade, a pior contrapropaganda vem da Rússia e da China.”\nAcrescentou ainda que, “ao lado do inaceitável socialismo materialista,\nhá lugar para socialismos que, de modo algum, se prendem ao materialismo\ndialético e ao ateísmo militante”. Concluindo, afirmou que “a Igreja vai\nadmitir que o cristão tente um socialismo que, sem a ilusão de realizar\nparaísos na terra, evite um mundo de oprimidos e opressores”.\n\nNo ano seguinte dom Hélder participou da III Assembléia do Celam em\nPuebla, no México. Quando da viagem de João Paulo II ao Brasil, em 1980,\nrecebeu do papa um longo elogio pelo seu trabalho junto aos pobres de\nRecife. Em sua diocese, que contava com cerca de três milhões de\ncatólicos espalhados nos oito municípios que compunham a zona\nmetropolitana de Recife, criou dez paróquias, organizou o Conselho\nPresbiterial e o Conselho Pastoral.\n\nEm abril de 1983, dom Hélder recebeu o prêmio Niwano da Paz, por seu\ntrabalho em favor dos pobres e por sua vida dedicada à valorização da\ndignidade humana, à libertação da opressão e da pobreza e à promoção da\ncooperação religiosa com outros países. Concedido pela Fundação Niwano,\numa das principais organizações budistas do Japão, ele foi escolhido\ndentre 48 personalidades religiosas de todo o mundo, das igrejas\nCatólica, Protestante e Budista.\n\nNeste mesmo ano, em julho, estando prevista sua aposentadoria para\nfevereiro de 1984, viajou a Roma levando uma lista com os nomes de três\nbispos para que o papa João Paulo II escolhesse, dentre os indicados, o\nseu substituto. Nesta ocasião, sugeriu para a sua despedida da\narquidiocese a apresentação no Brasil da Sinfonia dos dois mundos, uma\npeça de teatro de sua autoria, na qual estaria sintetizada toda a sua\nfilosofia pastoral.\n\nEm agosto, em declaração sobre a abertura política no Brasil, ressaltou\nque embora os exilados estivessem voltando e o Parlamento atuasse “com\numa clara presença da oposição”, mantinha-se em vigor a Lei de Segurança\nNacional. Criticando o presidente da República, general João Batista\nFigueiredo, por ter utilizado o Conselho de Segurança Nacional para o\nlançamento de seu terceiro pacote econômico, cobrou o compromisso do\npresidente, também lembrado pela CNBB, de discutir os pacotes com o\npovo, declarando que este manifestaria sua preferência pela “moratória à\namarração ao Fundo Monetário Internacional (FMI)”. Defendeu o\nredimensionamento da economia por intermédio do rompimento com o FMI,\nque considerava um órgão “defensor da hegemonia dos países\nindustrializados, sobretudo do sistema bancário”.\n\nAinda no ano de 1983, em dezembro, Maurice Béjart, um dos nomes mais\nexpressivos da dança contemporânea, estreou em Bruxelas o balé Missa\npara o tempo futuro, baseado em texto de dom Hélder sobre a massificação\ndo homem.\n\nNo ano seguinte, com a criação da Fundação das Obras de Frei Francisco,\ndom Hélder passou a se dedicar à entidade, que tinha como objetivo\najudar os pobres.\n\nO início de 1984 foi marcado por uma campanha em favor da aprovação pelo\nCongresso da emenda Dante de Oliveira, que previa a imediata realização\nde eleições diretas para a Presidência da República. A proposta, porém,\nfoi derrotada na Câmara dos Deputados em abril, tendo início, em\nseguida, os entendimentos que culminaram, em janeiro do ano seguinte, na\neleição no Colégio Eleitoral, da chapa oposicionista formada por\nTancredo Neves e José Sarney, candidatos respectivamente a presidente e\na vice-presidente da República. Em 15 de março de 1985, a posse de\nSarney, determinada pela doença do presidente eleito, marcou a\nconsolidação do processo de transição democrática no país, com o retorno\nde um civil à presidência da República. Na ocasião, dom Hélder lembrou a\nimportância da consciência da necessidade da reforma agrária como forma\nde evitar a violência e, mais tarde, considerou a realização da\nAssembléia Constituinte “uma felicidade pois nos livrará de decretos,\nleis e atos institucionais”.\n\nEm 22 de abril, Sarney seria confirmado na presidência, em virtude da\nmorte, na véspera, de Tancredo Neves.\n\nPor ocasião das comemorações do bicentenário da Declaração dos Direitos\nHumanos, em maio de 1985, dom Hélder participou da conferência\ninternacional organizada pelo presidente francês François Mitterrand.\nOptando pela sessão do colóquio que tratava das obrigações do Estado\npara com os direitos humanos, dom Hélder criticou o primado da segurança\nnacional que, no caso brasileiro, havia justificado a prática de\ntorturas e os seqüestros políticos.\n\nNo dia 15 de julho de 1985, dom Hélder aposentou-se do cargo de\narcebispo de Olinda e Recife, sendo substituído pelo bispo de Paracatu\n(MG), dom José Cardoso Sobrinho, da ala conservadora da Igreja. Naquela\nocasião, elogiou o Plano Nacional de Reforma Agrária do governo Sarney,\nfazendo uma ressalva de que este não seria suficiente: “Como um bom\ncomeço, vale, depois a gente vai completando.” Após a aposentadoria,\npermaneceu como arcebispo emérito de Olinda e Recife.\n\nDurante a sua gestão na arquidiocese, foi responsável pela organização\ndo Banco da Previdência de Pernambuco.\n\nMesmo aposentado, continuou atuante. Assim, em encontro promovido pelas\nComunidades Universitárias de Base, em agosto de 1985, que reuniu jovens\nligados a paróquias de São Paulo e militantes da Pastoral Universitária,\ndom Hélder advertiu os participantes sobre os perigos da corrida\narmamentista, sobre a dívida externa brasileira e sobre as injustiças\nsociais, e manifestou a esperança que depositava na juventude\nbrasileira.\n\nEm maio de 1986, ao ser condecorado com a Ordem do Rio Branco, no\nItamarati, pelo chefe do Gabinete Militar, general Rubens Bayma Denis,\ndom Hélder comentou: “Eu não mudei. Mas se isto está acontecendo é sinal\nde que alguma coisa mudou.” Dois meses depois, iniciou no município de\nPalmares (PE) uma pregação sobre a Assembléia Constituinte, que se\nestendeu por todo o país até as vésperas das eleições de 15 de novembro.\nAconselhou o povo “a fiscalizar a Constituinte, antes, durante e depois\nque ela for eleita”.\n\nEm dezembro do mesmo ano, foi homenageado pela Prefeitura de Roma com o\nPrêmio Roma-Brasília, Cidade da Paz. Na ocasião, dom Hélder fez votos de\nque o continente latino-americano, no ano 2000, fosse um conjunto de\npaíses livres e fraternos, sem qualquer imperialismo, externo ou\ninterno.\n\nEm fevereiro de 1988, recusou-se a assinar um documento da Comissão\nPró-Diretas da Ordem dos Advogados do Brasil de Pernambuco (OAB-PE), que\nexigia a realização de eleições presidenciais, ainda naquele ano,\nargumentando que o fundamental seria “o equacionamento dos problemas do\npaís já”, condição sem a qual o sucessor de Sarney “não resistiria nem\nseis meses”.\n\nEm agosto seguinte, faltando menos de um ano para a prescrição do crime\ncometido em maio de 1969, que resultou na morte de seu assessor, padre\nAntônio Henrique, dom Hélder pediu o arquivamento definitivo do\nprocesso, declarando não mais acreditar em punições.\n\nDurante a campanha eleitoral, em outubro, dom Hélder apareceu no horário\neleitoral gratuito dos dois candidatos à prefeitura de Recife — Marcos\nCunha, do Partido do Movimento Democrático Brasileiro (PMDB), e Joaquim\nFrancisco Cavalcanti, do Partido da Frente Liberal (PFL) — não pedindo\nvotos para qualquer deles, mas apenas solicitando que a população\nvotasse no dia 15 de novembro. No mês seguinte, anunciou que percorreria\no país, mais uma vez, para combater a apatia e o pessimismo expresso na\nidéia de voto nulo. Ainda em novembro, condenou o filme A última\ntentação de Cristo, de Martin Scorsese, por enfocar de maneira\ndesrespeitosa a figura de Jesus Cristo.\n\nAo completar 80 anos, em fevereiro de 1989, dom Hélder recebeu uma\nmensagem de congratulações do papa e foram realizadas missas em sua\nhomenagem em Olinda e no Rio de Janeiro. Em entrevista coletiva\nconcedida na ocasião, negou que houvesse uma divisão entre conservadores\ne progressistas na CNBB, elogiou a atuação do papa, defendeu novamente a\nreforma agrária e condenou o que classificou de estrelismo dos\ndirigentes políticos. Rebateu, ainda, as acusações de que a Igreja\nestaria se desviando da ação pastoral ao dar prioridade a ações\npolíticas, e afirmou: “A política não é só um direito, mas um dever. A\nIgreja deve exercitar a política como forma de externar nossa\npreocupação com melhores condições humanas.”\n\nAutor de mais de 17 livros, alguns traduzidos em mais de dez idiomas,\ndoutor honoris causa por mais de 30 universidades brasileiras, em agosto\nde 1989 seu nome foi sugerido como candidato à vaga do escritor José\nCândido Carvalho na Academia Brasileira de Letras (ABL). No mesmo mês,\nparticipou junto com o papa João Paulo II de um congresso na Espanha que\nteve como tema a exploração do Cone Sul da América Latina.\n\nAinda em agosto, deflagrou-se uma crise entre a Comissão de Justiça e\nPaz da Arquidiocese de Olinda e Recife e o seu substituto, o arcebispo\ndom José Cardoso. Este último teria se recusado a receber os posseiros\ndo Engenho Pitanga — que defendiam a manutenção no engenho do padre\nescocês Tiago Torlby, afastado por sua vinculação com a Comissão\nPastoral da Terra, considerada ilegal por dom José — e chamado a polícia\npara retirar os camponeses da arquidiocese. A Comissão de Justiça e Paz,\nao repudiar a atitude do arcebispo através da imprensa, foi proibida de\nse manifestar. Dom Hélder, ressalvando que não gostaria de se indispor\ncom o arcebispo, observou que ninguém calaria a Comissão de Justiça e\nPaz.\n\nDois meses mais tarde foram fechados, por ordem do Vaticano, dois\nseminários que tinham sido criados por dom Hélder, considerados\nprogressistas, no Nordeste. Defendendo os seminários, dom Hélder\ndefiniu-os como “instituições sérias, honestas e boas”. Na mesma época,\nretirou sua candidatura à ABL.\n\nApós a posse de Fernando Collor de Melo na presidência da República, em\nmarço de 1990, dom Hélder pediu a “união do povo para retomar o caminho\nda prosperidade”, declarou-se confiante nas medidas econômicas propostas\npelo novo governo e defendeu a promoção da reforma agrária “sem ódio e\nsem violência”. No ano seguinte, numa entrevista no programa Roda viva,\nda TV Cultura, dom Hélder Câmara afirmou que o Brasil deveria ter como\nmeta a erradicação da miséria e da pobreza absoluta, até o ano 2000.\n\nEm outubro de 1995, foi assinado um convênio entre a Fundação Roberto\nMarinho e a Fundação das Obras do Frei Francisco, para patrocinar o\ntrabalho de organização do acervo de dom Hélder. Em março do ano\nseguinte, dom Hélder recebeu mais um prêmio, dessa vez da Organização\ndas Nações Unidas (ONU), por sua atuação em prol dos pobres em Recife.\n\nDom Hélder faleceu em Recife em 27 de agosto de 1999. Compareceram ao\nseu enterro, realizado em Olinda, cerca de três mil pessoas, entre as\nquais religiosos, políticos e representantes de grupos ligados à defesa\ndos direitos humanos.\n\nAutor de vasta obra, dom Hélder escreveu *Revolução dentro da paz*\n(1968, traduzido para holandês, alemão, inglês, coreano, francês e\nitaliano), *Terzo Mondo defraudato* (1968, traduzido para francês e\ninglês), *Spirale de violence* (1970), *Pour arriver à temps* (1970,\ntraduzido para espanhol, italiano, alemão, holandês, sueco, inglês e\ngrego), *Le désert est fertile* (1971, traduzido para espanhol,\nitaliano, holandês, alemão, inglês, coreano e português), *Prier pour\nles riches* (1972, traduzido para alemão), *Cristianismo, socialismo,\ncapitalismo*(1973), *Um olhar sobre a cidade* (1976), *Les conversions\nd’un evêque*(1977, traduzido para italiano, alemão e inglês), *Mil\nrazões para viver* (1978, traduzido para francês), *Renouveau dans\nl’esprit et services de l’homme* (1979, traduzido para italiano, inglês\ne português), e *Nossa Senhora no meu caminho* (1981). Teve, no período\nde 1966 a 1981, 66 apostilas publicadas no Brasil e 148 no exterior.\n\nDom Hélder tornou-se uma figura mundialmente conhecida e sobre ele e seu\ntrabalho, foram publicadas as seguintes obras, além do livro já citado:\n*Dom Hélder, la violence d’un pacifique*, de José Broucker (1969), *Une\njournée avec dom Hélder*, de José Broucker (1970), *Hélder Câmara —\nBrasil; um Vietnam católico?*, de José Caynela (1970), *Hélder Câmara in\nNederland*, de Fritz Warten-Weiler (1970), *La voix du monde sans voix*,\nde Gladys Weigner e Bernhard Hoosbaugger (1971), *Hélder Câmara\nl’arcevescovo rosso*, de José Gonzales (1971), *Dom Hélder, o bispo da\nesperança*, de Marcos de Castro (1978), *L’echevêque des favelles*, de\nRobert Lafond, *Os caminhos de Dom Hélder* (1983), de Marcos Cirano,\n*Dom Hélder, pastor e profeta* (1984), do Instituto de Teologia do\nRecife, e *Uma vida para os pobres — a espiritualidade de dom Hélder\nCâmara*, de Nelmo Roque Ten Kathen.\n\nVerônica Veloso atualização\n\n \n\nFONTES: ALBUQUERQUE, J. *Cearenses no Rio e em SP*; CACHAPUZ, P.\n*Cronologia*; CAFÉ FILHO, J. *Sindicato*; CONFERÊNCIA NAC. BISPOS DO\nBRASIL; CORTÉS, C. *Homens*; *Estado de S. Paulo* (26/8, 28/10/88, 11/2,\n3/89); Encic. Mirador; FIECHTER, G. *Regime*; *Folha de S. Paulo*\n(13/11/83, 26/8/85, 10/5/87, 29/10/88, 22/1, 3, 4/2, 31/8, 20/10/89,\n18/3/96, 20/7/97, 28/8/99); GARDEL, L. *Armoiries*; GIRÃO, R. *Ceará*;\n*Globo* (8/4, 31/5, 31/7/83, 15/7/85, 28/5, 20/7/86, 29/11/87, 9/3, 17,\n26/8, 29/10, 26/12/88, 10, 15/2/89, 25/3/90, 3/8, 21/10/95); Grande\nencic. Delta; Grande encic. portuguesa; *IstoÉ* (8/2/84); *Jornal do\nBrasil* (21/8, 20/11/83, 2/3/84, 17/2, 11/4/85, 7/11/86, 7/2, 5,\n9/11/88, 10, 13/2, 3, 10, 17/8, 7/10/89); LEVINE, R. *Vargas*;\nMAGALHÃES, I. *Segundo*; *Rev. Inst. Hist. Geog. Bras.*; SILVA, H.\n*1935*; SILVA, H. *1938*; TAVARES, J. *Radicalização*; *Veja* (13/9/89,\n30/4/97, 28/8, 29/8/99); VIANA FILHO, L. *Governo*.\n\n \n","ref":"FONTES: ALBUQUERQUE, J. *Cearenses no Rio e em SP*; CACHAPUZ, P.\n*Cronologia*; CAFÉ FILHO, J. *Sindicato*; CONFERÊNCIA NAC. BISPOS DO\nBRASIL; CORTÉS, C. *Homens*; *Estado de S. Paulo* (26/8, 28/10/88, 11/2,\n3/89); Encic. Mirador; FIECHTER, G. *Regime*; *Folha de S. Paulo*\n(13/11/83, 26/8/85, 10/5/87, 29/10/88, 22/1, 3, 4/2, 31/8, 20/10/89,\n18/3/96, 20/7/97, 28/8/99); GARDEL, L. *Armoiries*; GIRÃO, R. *Ceará*;\n*Globo* (8/4, 31/5, 31/7/83, 15/7/85, 28/5, 20/7/86, 29/11/87, 9/3, 17,\n26/8, 29/10, 26/12/88, 10, 15/2/89, 25/3/90, 3/8, 21/10/95); Grande\nencic. Delta; Grande encic. portuguesa; *IstoÉ* (8/2/84); *Jornal do\nBrasil* (21/8, 20/11/83, 2/3/84, 17/2, 11/4/85, 7/11/86, 7/2, 5,\n9/11/88, 10, 13/2, 3, 10, 17/8, 7/10/89); LEVINE, R. *Vargas*;\nMAGALHÃES, I. *Segundo*; *Rev. Inst. Hist. Geog. Bras.*; SILVA, H.\n*1935*; SILVA, H. *1938*; TAVARES, J. *Radicalização*; *Veja* (13/9/89,\n30/4/97, 28/8, 29/8/99); VIANA FILHO, L. *Governo*.\n\n \n","dic":"DHBB"}
