{"title":"CÂMARA, Jaime","cargoss":["Arcebispo"],"cargos_esp":["Rio de Janeiro"],"datas_ini":[1943],"datas_fim":[1971],"estados":[0],"autor":[0],"content":"**CÂMARA, Jaime**\n\n**\\***religioso; arceb. Rio de Janeiro 1943-1971.\n\n \n\n*Jaime de Barros Câmara* nasceu em São José (SC) no dia 3 de julho de\n1894, filho de Joaquim Xavier de Oliveira Câmara e de Ana de Barros\nCâmara. Pertencente a uma modesta família local, cedo viu-se órfão de\npai, o que mais ainda agravou a situação financeira da família: foi com\nesforço que Ana Câmara educou os cinco filhos.\n\nApós fazer os estudos primários em sua cidade natal, Jaime Câmara\ningressou em 1906 no Ginásio Catarinense de Florianópolis, onde concluiu\no curso ginasial em 1912. No ano seguinte iniciou-se no magistério,\ndando aulas nesse mesmo colégio, no qual exerceu também as funções de\nadministrador. Em 1914, transferiu-se para a cidade gaúcha de São\nLeopoldo, onde ingressou no Seminário de Nossa Senhora da Conceição,\npelo qual se diplomou, cinco anos depois, em filosofia e teologia.\n\nEm 1º de janeiro de 1920, Jaime de Barros Câmara foi ordenado padre em\ncerimônia realizada na catedral Metropolitana de Florianópolis, tendo\ncelebrado sua primeira missa no dia seguinte, na igreja de São José. Sua\nvida sacerdotal desenvolveu-se a partir de então em Santa Catarina,\niniciando-se com a substituição do cura da catedral de Florianópolis por\num curto período de tempo. Depois disso, Jaime Câmara foi coadjutor da\nparóquia de Tijucas (SC) — onde exerceu o cargo de presidente da\nsociedade que dirigia o hospital municipal —, capelão das Irmãs da\nDivina Providência, cura da catedral Metropolitana, capelão do Hospital\nde Caridade de Florianópolis e secretário do bispado dessa cidade. Em\n1927, com a criação do Seminário Menor de Azambuja, no município de\nBrusque (SC), foi nomeado seu primeiro reitor, função que desempenharia\naté 1935. Dois anos depois dessa indicação, foi designado cônego.\n\n \n\nA diocese de Mossoró e a arquidiocese de Belém do Pará\n\nEm junho de 1935, Jaime Câmara foi nomeado monsenhor. No final do ano,\nem 19 de dezembro, tornou-se o primeiro bispo de Mossoró (RN), por\nnomeação do papa Pio XI, que criara essa diocese em junho de 1934.\nRecebeu contudo sua sagração episcopal somente em 2 de fevereiro de\n1936, tomando posse na diocese em abril e aí passando a desenvolver uma\nlinha de atuação preocupada basicamente com dois aspectos: o das\nvocações e o da ação social junto aos trabalhadores das salinas locais.\n\nEm relação às vocações, dom Jaime procurou intensificar o recrutamento\nde religiosos, determinando, entre uma de suas primeiras medidas, a\nfundação e a edificação de um novo seminário, do qual foi também o\nprimeiro reitor e professor. Inaugurado em 2 de fevereiro de 1937 com 24\nalunos, esse seminário em três anos duplicaria seu número de internos.\n\nO segundo aspecto da atuação de dom Jaime em Mossoró visava promover a\naproximação entre a Igreja e os trabalhadores das salinas de modo a\nevitar a propagação na comunidade das idéias de esquerda. Para tanto,\nfoi criado o Círculo Operário de Mossoró, um tipo de associação civil de\ntrabalhadores, de inspiração católica, que começou a surgir em todo o\npaís durante a década de 1930.\n\nSegundo alguns autores, dom Jaime teria chegado a participar ativamente\ndo movimento integralista como bispo de Mossoró, o que não é\nreferendado, entretanto, pela maioria dos historiadores.\n\nDom Jaime consagrou-se, ainda em sua diocese, a outras instituições de\ncaráter assistencial, tendo sido responsável pela construção do Asilo\nAmantino Câmara, edificado com a herança deixada por seu irmão, que\nfalecera recentemente no Rio de Janeiro, e pela organização da Ação\nCatólica local.\n\nDom Jaime permaneceu em Mossoró até 18 de setembro de 1941, quando foi\ntransferido para a Arquidiocese de Belém do Pará, na qual tomou posse em\n1º de janeiro de 1942. Durante sua breve permanência na capital\nparaense, desenvolveu ação semelhante à que desempenhara no Rio Grande\ndo Norte: ampliou o seminário local, comprou para a cúria o Ginásio\nProgresso Paraense e a sede do Círculo Operário. Organizou ainda, por\nocasião do Congresso Eucarístico de Manaus, uma peregrinação fluvial,\nque, ao longo de 11 dias, levou para a capital amazonense o Santíssimo\nSacramento.\n\n \n\nA Arquidiocese do Rio de Janeiro\n\nEm 17 de outubro de 1942, a morte do cardeal dom Sebastião Leme, que se\ndestacara à frente do episcopado brasileiro, deixou vaga a Arquidiocese\ndo Rio de Janeiro (então Distrito Federal), que permaneceu sem titular\ndurante quase um ano. Em 3 de julho de 1943, dom Jaime foi nomeado pelo\nVaticano para suceder a dom Leme, mas só tomou posse na Cúria\nMetropolitana em 15 de setembro. Segundo Ralph Della Cava, sua indicação\npara a arquidiocese representou, na realidade, o colapso da liderança\ncriada por seu antecessor: “Com o tempo, até mesmo o poderoso movimento\nque Leme colocou em ação para centralizar a hierarquia sob o comando dos\nsuperiores do Rio se desmantelou. O poder eclesiástico, como de costume,\nrefluiu novamente para as dioceses isoladas e seus ocupantes.”\n\nA atuação de dom Jaime na arquidiocese foi assinalada, mais uma vez,\npela atenção dada à questão da formação sacerdotal, da qual resultou a\nreformulação material e intelectual do Seminário do Rio de Janeiro. As\nnovas instalações do estabelecimento permitiram a realização, pela\nprimeira vez, de um congresso nacional de reitores de seminários, em\njaneiro de 1948. Por outro lado, dom Jaime deu ênfase ao ensino\nreligioso, quer ministrando pessoalmente aulas de religião no Instituto\nde Educação da Prefeitura do Distrito Federal, quer estimulando os\ncursos de formação catequética já existentes. Datam dessa época seus\ncontatos com diversas unidades militares — entre as quais as academias\ndo Exército, da Marinha e da Aeronáutica —, para as quais preparou, e\nmuitas vezes chegou mesmo a presidir, as celebrações da Páscoa.\n\nAinda nesse sentido, dom Jaime deu continuidade ao projeto iniciado por\ndom Sebastião Leme, do qual resultaria a criação da Pontifícia\nUniversidade Católica (PUC) do Rio de Janeiro. Desde 1940, haviam sido\ncriadas no Rio as faculdades católicas de Direito e Filosofia, cujo\nreitor era o padre Leonel Franca. Em 1946, com a agregação do Instituto\nSocial e a criação da Escola Politécnica, as faculdades católicas\nobtiveram autorização do governo federal para se organizarem numa\nuniversidade, cujos estatutos foram então aprovados. Em janeiro do ano\nseguinte, coroando os esforços conjuntos de dom Jaime e do padre Leonel\nFranca, a Santa Sé, por intermédio da Sagrada Congregação dos Seminários\ne Universidades, concedeu à Universidade Católica do Rio de Janeiro a\nprerrogativa de universidade pontifícia.\n\n \n\nO cardinalato\n\nAinda no início de 1946, dom Jaime viajou para****Roma, onde foi eleito\ne proclamado cardeal presbítero no consistório realizado em 18 de\nfevereiro, tendo recebido de Pio XII o anel e o chapéu cardinalícios.\nCouberam-lhe os títulos de São Bonifácio e de Santo Aleixo. Dom Jaime\ntornou-se dessa forma o terceiro cardeal-arcebispo do Rio de Janeiro,\npassando nesse mesmo ano a integrar e a presidir a comissão episcopal\npara a Ação Católica Brasileira (ACB), cuja reformulação promoveu.\nImplantada em 1935 pelo cardeal Leme, em resposta às solicitações do\npapa Pio XI no sentido de que fossem criadas em todos os países\nassociações leigas vinculadas à Igreja, sem qualquer filiação política e\nencarregadas de promover a “evangelização das nações”, a ACB já vinha\napresentando, bem antes da morte de dom Leme, em 1942, sinais de\ndeclínio, evidenciados na pequena mobilização que conseguira provocar.\nDurante o ano de 1946, foram elaborados, com o auxilio da comissão\nepiscopal, os novos estatutos da associação, que, aprovados pelo\nVaticano, foram adotados no I Congresso da ACB, realizado no Rio de\nJaneiro nos meses de maio-junho.\n\nEm 1947, a Cúria Metropolitana, desejando implantar um jornal matutino,\npediu permissão à diretoria do *Correio da Noite*para imprimir o novo\nórgão em suas oficinas. O proprietário do *Correio da Noite,*Mário\nMagalhães, preferiu contudo fazer uma contraproposta, colocando seu\njornal à venda, o que foi aceito pela cúria. O *Correio da Noite,* no\nentanto, permaneceu pouco tempo sob a orientação da Arquidiocese do Rio\nde Janeiro, que acabou por vendê-lo a Luís Gama Filho.\n\nEm 1948, dom Jaime participou do Congresso Eucarístico Nacional,\nexercendo as funções de legado pontifício. No início do ano seguinte,\npronunciou-se contra a condenação do cardeal primaz da Hungria,\nmonsenhor József Mindszenty, à prisão perpétua, como inimigo do\nsocialismo. A condenação levou dom Jaime a promover no Rio de Janeiro\numa procissão do Santíssimo Sacramento, em solidariedade ao prelado\nhúngaro. Entre 1950 e 1952, dom Jaime foi, sucessivamente, vigário\ncastrense das tropas brasileiras de terra, mar e ar (1950), bispo\nordinário para os católicos de ritos orientais no Brasil (1952), legado\n*ad latere*ao Congresso Eucarístico Nacional, realizado em Porto Alegre,\ne legado pontifício ao Congresso Interamericano de Educadoras Católicas\n(1952).\n\n \n\nA criação da CNBB\n\nAinda em 1952, em outubro, ultimaram-se os trabalhos para a criação da\nConferência Nacional dos Bispos do Brasil (CNBB), idéia lançada em 1949\npelo núncio apostólico dom Carlo Chiari e desenvolvida desde então pela\nACB. No dia 14, dom Jaime participou da primeira sessão da reunião\nextraordinária de instalação da CNBB, que representou a concretização do\nanteprojeto elaborado durante o Congresso Mundial de Leigos, realizado\nem Roma em 1950. Nesse congresso, um dos principais defensores da idéia\nda CNBB foi o monsenhor Montini, na época assessor do sumo pontífice e\nque mais tarde se tornaria o papa Paulo VI. Durante a reunião de 14 de\noutubro de 1952, realizada no palácio São Joaquim, sede da arquidiocese\ndo Rio, foi ainda eleita uma comissão permanente, presidida por dom\nCarlos Carmelo de Vasconcelos Mota, responsável pela direção do novo\nórgão. Para a secretaria geral foi nomeado o recém-escolhido\nbispo-auxiliar da arquidiocese do Rio, dom Hélder Câmara.\n\nDois anos depois de sua criação, e principalmente após a chegada do novo\nnúncio apostólico, monsenhor Armando Lombardi, em 1954, a CNBB tornou-se\no porta-voz mais autorizado da Igreja Católica no Brasil, função\ntradicionalmente desempenhada pelo arcebispo do Rio de Janeiro. Segundo\nRalph Della Cava, a partir de 1954, a CNBB, e não dom Jaime de Barros\nCâmara, “tornou-se o verdadeiro sucessor do cardeal Leme, enquanto o\nsecretário-geral da CNBB, dom Hélder Câmara, emergiu como o líder de\nfato da Igreja brasileira”. Politicamente, contudo, o cardeal-arcebispo\ndo Rio reteve considerável poder em suas mãos, já que representava a ala\nconservadora da Igreja Católica do Brasil.\n\nO ano de 1954 foi politicamente marcado por grande agitação, já que, em\noutubro, seriam realizadas as eleições para o Legislativo, o que\ninstabilizava ainda mais o governo de Getúlio Vargas, às voltas com um\nvigoroso acirramento da campanha oposicionista. Para dom Jaime, foi um\nano de intensos preparativos, pois em 1955 a arquidiocese do Rio\npromoveria o XXXVI Congresso Eucarístico Internacional. Em fins de\njulho, através de seu programa radiofônico *A voz do pastor*, dom Jaime\nintensificou suas críticas à administração do Distrito Federal, que\ndemorava em conceder o terreno para a construção do altar-monumento\ndestinado às cerimônias do Congresso Eucarístico.\n\nPoucos dias depois, instalou-se a crise final do governo Vargas,\noriginada com o atentado, ocorrido na rua Toneleros no dia 5 de agosto,\ncontra o jornalista de oposição Carlos Lacerda, durante o qual foi\nassassinado o major-aviador Rubens Vaz, que o acompanhava na ocasião. A\ndivulgação de informações sobre o envolvimento da guarda pessoal de\nVargas no crime gerou diversos rumores sobre sua renúncia. Em meio a\ntais boatos, dom Jaime dirigiu-se no dia 10 de agosto ao palácio do\nCatete, com o intuito, segundo alguns autores, de sondar o presidente da\nRepública sobre as possibilidades de sua renúncia. Negando tal\ndisposição, Vargas comunicou-lhe também sua decisão de dar\nprosseguimento ao inquérito sobre o atentado da Toneleros.\n\nDois dias mais tarde, dom Jaime celebrou, na igreja da Candelária, a\nmissa de sétimo dia em intenção do major Rubens Vaz, à qual compareceram\nautoridades civis e militares, além de grande massa popular. Após a\ncelebração, sucederam-se, no centro da cidade, manifestações populares\ncontra o governo Vargas e o Partido Trabalhista Brasileiro (PTB). O\nprosseguimento das investigações acabou por comprovar as ligações dos\nassassinos com membros do corpo de segurança de Vargas, levando ao\nacirramento da campanha contra o presidente, que se suicidou no dia 24\nde agosto.\n\nEm 1955, realizou-se no Rio, com extrema pompa, o XXXVI Congresso\nEucarístico Internacional, além da Conferência Geral do Episcopado\nLatino-Americano. Reunida entre 25 de julho e 4 de agosto, essa\nconferência decidiu a criação do Conselho Episcopal Latino-Americano\n(Celam), para o qual dom Jaime foi eleito presidente, função que\nexerceria até 1960.\n\n \n\nAtuação na sucessão presidencial de 1955\n\nA questão da sucessão presidencial durante o ano de 1955 concorreu\ndecisivamente para a manutenção da instabilidade política. Realizado o\npleito em outubro — precedido já de boatos sobre a preparação de um\ngolpe —, a tensão aumentou ao se configurar a vitória de Juscelino\nKubitschek e João Goulart, candidatos do Partido Social Democrático\n(PSD) e do PTB. Em 11 de novembro, um movimento encabeçado pelos\ngenerais Henrique Teixeira Lott e Odílio Denis depôs o presidente\ninterino Carlos Luz — o presidente João Café Filho encontrava-se em\nlicença médica —, sob a suspeita de que este estivesse ligado aos\n“golpistas” que planejavam impedir a posse do presidente eleito.\n\nSubstituído no governo por Nereu Ramos, Carlos Luz, que se refugiara no\ncruzador *Tamandaré,*retornou ao Rio no dia 13, decidido a ler um\nmanifesto na Câmara dos Deputados, cuja presidência exercia quando da\ndoença de Café Filho. Na madrugada do dia seguinte, foi procurado por\ndom Jaime de Barros Câmara, acompanhado por dom Hélder Câmara. O\ncardeal-arcebispo do Rio de Janeiro, como emissário do novo governo,\ntentou convencer o presidente deposto a não fazer seu pronunciamento na\nCâmara, já que a sua presença naquela casa poderia provocar\nmanifestações contrárias, inclusive ataques pessoais por parte dos\ncomunistas. Carlos Luz, no entanto, negou que houvesse tal perigo, razão\npela qual não desistiria do pronunciamento, afinal realizado naquele\nmesmo dia.\n\nTendo recebido alta de seus médicos, Café Filho procurou, no dia 21 de\nnovembro, retomar a presidência. Na noite desse dia, dom Jaime foi\nprocurado no palácio São Joaquim pelo general Juarez Távora, que lhe\nsugeriu intervir junto a Lott e a Nereu Ramos no sentido de que estes\ngarantissem a volta de Café Filho como a melhor saída para a situação\nque ele, Juarez, considerava de ilegalidade. Dom Jaime, em resposta,\ncomprometeu-se a examinar o que seria possível tentar nesse sentido. Não\nchegou, contudo, a tomar qualquer iniciativa, já que, desde cedo, os\ntanques do Exército vinham ocupando as imediações do palácio do Catete,\nbem como da residência de Café Filho, em Copacabana.\n\nDois dias mais tarde, quando o Congresso votava o impedimento de Café\nFilho, dom Jaime foi procurado pelo empresário Rui Gomes de Almeida,\npresidente da Associação Comercial do Rio de Janeiro (ACRJ), o qual,\ncomo representante das classes produtoras, veio lhe pedir o apoio da\nIgreja para harmonizar as cisões que haviam aflorado no interior das\nforças armadas com o movimento de 11 de novembro. Ciente de que o\nempresário já vinha mantendo contatos com o general Henrique Lott, o\nbrigadeiro Eduardo Gomes e o almirante Amorim do Vale — ministros das\npastas militares na ocasião daquele movimento e defensores, os dois\núltimos, de posições opostas à do primeiro —, dom Jaime garantiu-lhe o\napoio da Igreja e elaborou uma mensagem de pacificação dirigida aos\nchefes militares.\n\n \n\nA CNBB e a crise na Igreja\n\nEntre 1958 e 1963, dom Jaime de Barros Câmara exerceu a presidência da\nCNBB em substituição a dom Carlos Carmelo de Vasconcelos Mota, que\nocupara o cargo desde a criação do órgão, em 1952. Nessa instituição, no\nentanto, a figura de maior projeção continuou sendo a de seu\nsecretário-geral, dom Hélder Câmara, que liderava a ala progressista da\nIgreja brasileira. Em 1959, dom Hélder deixou as funções de\nbispo-auxiliar do Rio de Janeiro, permanecendo contudo na CNBB. Por sua\ninfluência, em 1962 a CNBB expediria veemente pronunciamento em apoio às\nreformas de base, sugerindo inclusive a desapropriação de terras rurais\npara posterior redistribuição.\n\nEm 1960, realizou-se no Rio um congresso da Juventude Universitária\nCatólica (JUC) — associação civil católica reconhecida nacionalmente\npela hierarquia eclesiástica em 1950 com a finalidade de difundir os\nensinamentos e a doutrina da Igreja no meio universitário —, durante o\nqual foram aprovadas (embora tenham sido muito criticadas) novas\ndiretrizes para o movimento, representando a consolidação da preocupação\ncom as questões de caráter social: entre outros pontos, foi proposta a\n“luta contra o subdesenvolvimento e contra a primazia do capital sobre o\ntrabalho, em prol da reforma agrária e do controle estatal dos setores\nde base da economia”. A adoção de tais diretrizes, no entanto, provocou\ndivergências entre alguns dos integrantes da JUC, bem como entre membros\nda hierarquia eclesiástica. Dom Jaime de Barros Câmara chegou mesmo a\nrecusar o convite que lhe fora feito pela JUC para que celebrasse a\nmissa de encerramento do congresso.\n\nEm janeiro de 1961, tomou posse o novo presidente da República, Jânio\nQuadros, que, em seu breve período de governo, procurou adotar uma\npolítica externa mais independente, de neutralidade em relação à guerra\nfria que se instalara após o último conflito mundial. Algumas de suas\natitudes, no entanto, como o apoio à discussão na Organização das Nações\nUnidas (ONU) sobre a admissão da China comunista e a declaração de que o\ngoverno vinha estudando o reatamento das relações diplomáticas com a\nURSS (rompidas desde 1947), provocaram a reação dos setores mais\nconservadores da sociedade.\n\nEm meados de julho, Jânio Quadros recebeu no palácio do Planalto, em\nBrasília, a Missão Soviética de Boa Vontade, cujo objetivo era\nincrementar o intercâmbio comercial e cultural entre o Brasil e a URSS.\nEsse fato, associado à nova política de reaproximação com alguns dos\npaíses do Leste europeu, levou à intensificação da campanha\noposicionista, cuja principal corrente era liderada por Carlos Lacerda,\ngovernador da Guanabara, pelos jornalistas Roberto Marinho, de *O\nGlobo,* e**Júlio de Mesquita Filho, de *O Estado* *de S. Paulo*e**pelo\ncardeal-arcebispo do Rio de Janeiro. Dom Jaime, cujas preleções pelo\nrádio, através do programa *A voz do pastor,* vinham sendo de há muito\npublicadas na seção católica do *Jornal do Comércio,* já havia\nconseguido, nessa ocasião, garantir sua influência sobre grande parte da\nIgreja e dos católicos.\n\nNo dia 25 de agosto de 1961, Jânio Quadros, após seis meses de governo,\napresentou seu pedido de renúncia. No dia seguinte, dom Jaime publicou\num manifesto alertando para****a necessidade de se respeitar a\nConstituição, de modo a evitar que a renúncia do presidente fosse\naproveitada para qualquer alteração da ordem pública.\n\nEm 1963, a maioria da hierarquia eclesiástica parecia estar convencida\nde que a agitação que se fazia para a aprovação das reformas sociais\nfavoreceria, inevitavelmente, a implantação do comunismo no país. Nesse\nsentido, um grupo de bispos e arcebispos, entre os quais dom Vicente\nScherer, dom Agnelo Rossi e dom Eugênio Sales, além de dom Jaime, enviou\numa carta a dom Cândido Pandim, que, desde 1962, vinha substituindo dom\nHélder no cargo de assistente nacional da ACB, solicitando que os\nassistentes eclesiásticos da Ação Católica Brasileira “formassem a\nconsciência dos militantes no ensino autêntico da Igreja e de sua\ndoutrina social”, conservando-se afastados de “certas correntes\nideológicas em voga nos meios do laicato”. A mensagem revelava, por fim,\no temor da Igreja ante a radicalização do movimento católico.\n\nAinda por essa época, dom Jaime foi um dos principais incentivadores da\nvinda para o Brasil do padre Patrick Peyton — considerado por Ralph\nDella Cava como a alternativa do catolicismo norte-americano para o\nreverendo Billy Graham e como o responsável pela realização de “milagres\npela fé nas****Filipinas”.****O padre Peyton implantou no Brasil a\nCruzada do Rosário em Família, organização que congregava devotos que\nparticipavam em massa de congressos eucarísticos e promoviam campanhas\nanticomunistas. A Cruzada do Rosário em Família acabou por tornar-se um\ndos instrumentos de mobilização da classe média nas cidades contra o\ngoverno de João Goulart, muito embora sua interferência em questões\npolíticas só tenha aflorado quando da realização de uma grande\nconcentração no Rio de Janeiro que contou com o apoio dos bispos\nconservadores, entre os quais dom Jaime.\n\nEm 19 de março de 1964, seis dias após o comício presidido por Goulart\nna estação da Central do Brasil, no Rio de Janeiro — e durante o qual\nGoulart assinou alguns decretos preliminares relativos a reformas\nsociais —, quinhentas mil pessoas desfilaram em São Paulo na Marcha da\nFamília com Deus pela Liberdade, em protesto contra tais decretos,\natendendo à convocação de uma frente de organizações conservadoras,\nentre as quais se incluía a Cruzada do Rosário em Família. Uma semana\ndepois, o arcebispado do Rio, através de sua Confederação Católica,\nconvocou todas as associações a ela filiadas (entre as quais a Cruzada\ndo Rosário em Família e os Círculos Operários Católicos) e organizou\noutra marcha em oposição a Goulart. No dia 31 de março, eclodiu o\nmovimento político-militar que depôs o presidente da República. A marcha\ncarioca saiu às ruas no dia 2 de abril, já caracterizada como uma\n“marcha da vitória”.\n\n \n\nO pós-1964\n\nDurante o ano de 1964, a Arquidiocese do Rio de Janeiro decidiu\nconstruir uma nova catedral Metropolitana. No início de 1965, em\ncerimônia realizada no dia 19 de janeiro no palácio São Joaquim, foram\ninstaladas as comissões encarregadas da construção do novo templo. A\ncerimônia contou com a presença do governador da Guanabara, Carlos\nLacerda, que também compareceu ao lançamento, no dia seguinte, da pedra\nfundamental da futura catedral.\n\nA partir do movimento de março de 1964 começaram a se multiplicar os\nconflitos entre a Igreja e o Estado, à medida que evoluíam o pensamento\nsocial católico, as formas de aplicá-lo e as formas de organização\nnecessárias para essa aplicação. Explicitamente, esses conflitos se\nconcretizaram, entre outros pontos, na análise da doutrina social da\nIgreja e da sua inconformidade com a doutrina do regime militar e no\nenvolvimento de padres e leigos na luta — a partir de determinado\nmomento, clandestina — contra o govemo.\n\nEm março de 1968, durante os incidentes ocorridos no restaurante do\nCalabouço, envolvendo estudantes e a Polícia Militar do Rio, foi morto\ncom um tiro no peito o secundarista Edson Luís de Lima Souto. Sua morte\nmarcou, após quase quatro anos de silêncio, o início de uma nova fase de\nmanifestações estudantis, que atingiu várias cidades. A missa de sétimo\ndia de Edson Luís foi celebrada na igreja da Candelária, que permaneceu\ncercada por forte dispositivo policial. Prevendo agressões — na parte da\nmanhã já haviam ocorrido choques entre a cavalaria e as pessoas que\nsaíam da igreja —, o vigário-geral do Rio, dom José de Castro Pinto, e\nmais 15 padres, ainda paramentados, deixaram a igreja de mãos dadas à\nfrente dos estudantes, de modo a impedir novos choques. Novas\nparticipações de religiosos em manifestações políticas ocorreram quando\nda realização, no Rio, das passeatas conhecidas como dos Cem Mil — no\ndia 26 de junho, em protesto contra o governo, apoiando o movimento\nestudantil —, e dos 50 Mil — no dia 4 de julho, em protesto pelo\nfracasso da tentativa de diálogo entre o governo e a Comissão Popular da\nAssembléia dos Cem Mil.\n\nNo início de dezembro de 1968, foram presos em Belo Horizonte três\npadres franceses e um diácono brasileiro em vias de se ordenar,\nimplicados em atividades subversivas, segundo a conclusão do Inquérito\nPolicial-Militar (IPM) ali instalado para apurar os movimentos da\nJuventude Operária Católica (JOC). A JOC era uma associação civil\ncatólica reconhecida nacionalmente pela hierarquia eclesiástica desde\n1948 como setor especializado da ACB destinado à difusão dos\nensinamentos da Igreja no meio operário. Essa prisão ampliou em muito a\ncrise já latente entre a Igreja e governo, pois trouxe para os detidos a\nsolidariedade de dezenas de bispos e padres, proporcionando mesmo uma\ncerta união entre os religiosos conservadores e progressistas. No Rio,\nno dia 13, dom Jaime de Barros Câmara convocou a imprensa para divulgar\no texto que seria lido nas missas da Guanabara no domingo seguinte, em\nque declarava “plena e irrestrita solidariedade à Igreja de Belo\nHorizonte”. Nesse texto, o cardeal-arcebispo afirmava ainda que “a\nIgreja de Cristo aqui no Brasil não poderia deixar de ser fiel à sua\nmissão, mesmo e principalmente quando a incompreensão e a insensatez\ntentam impedi-la de atuar e ser fiel”. Doze horas depois, na noite do\ndía 13, foi editado, pelo presidente Artur da Costa e Silva, o Ato\nInstitucional nº 5 (AI-5).\n\nEm 13 de maio de 1969, foi divulgado um manifesto, assinado por 80\npadres da arquidiocese do Rio de Janeiro, em que era ressaltada “a\nobediência à hierarquia da Igreja como expressão válida e indispensável\nda nossa fé”. Esse documento, lançado inicialmente em São Paulo pelo\nmovimento Fé e Disciplina, mostrava-se ainda contrário aos padres que,\n“voluntária ou involuntariamente, [estavam] indo de encontro à ordem\nvigente”.\n\nEm 1º de janeiro de 1970, dom Jaime comemorou em Florianópolis o jubileu\nde ouro de sua sagração sacerdotal.\n\nEm outubro desse ano, menos de um mês antes das eleições parlamentares,\na polícia política do Rio invadiu a sede nacional da JOC, prendendo sete\npadres e vários leigos, o que provocou a imediata mobilização da CNBB.\nNo Rio, dom Jaime, que normalmente se mantinha afastado de tais\nepisódios, procurou obter audiências com o ministro do Exército, general\nOrlando Geisel, e com o comandante do I Exército, general Siseno\nSarmento, que oficialmente se manifestaram propensos à limitação do\nconflito.\n\nNo início de 1971, dom Jaime viajou a Belo Horizonte para participar da\nreunião da CNBB. Durante o encontro, procurou seus colegas, pedindo-lhes\nsua adesão, a um abaixo-assinado em defesa do sacramento da confissão,\naparentemente abalado pela decisão do papa Paulo VI de abolir a\nconfissão auricular de pequenos pecados. Segundo um de seus biógrafos,\nesse ato de aparente indisciplina de dom Jaime traduzia sua preocupação\nmaior com a tradição da Igreja. Isso não o impedia, contudo, de se\ntornar o mais firme defensor dos novos métodos, desde que o Vaticano\ninsistisse na mudança.\n\nNa manhã de 16 de fevereiro, dom Jaime foi homenageado pelos bispos da\nCNBB pelo seu aniversário de cardinalato, o que lhe provocou, pela\nemoção, as primeiras dores cardíacas. Apesar do repouso que lhe fora\nrecomendado pelo médico, dom Jaime manteve sua decisão de viajar para\nAparecida do Norte (SP), onde rezaria missa com dom Carlos Carmelo de\nVasconcelos Mota, arcebispo daquela cidade e que, como ele, fora elevado\nao cardinalato em 1946. No dia 18 de fevereiro de 1971, depois de\ncelebrar a missa, dom Jaime tornou a ter problemas cardíacos, vindo a\nfalecer no mesmo dia, ainda em Aparecida do Norte.\n\nDom Jaime de Barros Câmara foi membro do Sacro Colégio dos Cardeais da\nSanta Sé e do Instituto Histórico e Geográfico Brasileiro. Pertenceu\ntambém às congregações dos seminários, das universidades de estudo e da\nFábrica de São Pedro e da Cúria Romana. Foi doutor *honoris causa*da\nFaculdade de Filosofia da PUC do Rio de Janeiro.\n\nEntre as diversas obras por ele publicadas, incluem-se: *Apontamentos de\nhistória* *eclesiástica*(1942),*Manifesto do episcopado* *sobre o\nproblema político e a questão social* *do Brasil*(1945),*Compêndio de\nteologia pastoral oferecido aos seminaristas do Brasil* (1948), *O clero\nem retiro espiritual* (1955)*,* *Compêndio de teologia pastoral*(1955),\n*O sacerdote em viagem*(1956), *Problemas* (1963),*Os grandes campeões\nda fé* (1966) e *Reflexões para religiosos em* *viagem*(2v., 1968).\n\nRegina da Luz Moreira\n\n \n\n \n\nFONTES: *Almanaque mundial*(1969); ALVES, M. *Igreja;*BARROS, E.\n*Associação;* CÂM. DEP. *Anais*(1958-2); CARNEIRO, G.*História;*CASCUDO,\nL. *História;*CONFERÊNCIA NAC. BISPOS DO BRASIL; CONY, C. *Quem;*CORTÉS,\nC. *Homens;*COSTA, M. *Cronologia;*COUTINHO, A. *Brasil;*DELLA CAVA, R.\n*Igreja;*DULLES, J. *Getúlio;* *Encic. Mirador; Encic.\nUniversal;*GARDEL, L*. Armoiries; Grande encic. Delta; Grande* *encic.\nportuguesa;*HIRSCHOWICZ, E. *Contemporâneos;*INST. HIST. GEOG. BRAS.\n*Dic.;*INST. NAC. LIVRO. *Índice;*JAMUNDÁ, T. *Catarinenses; Jornal do\nBrasil* (13/5/69); LEITE, A.*****Páginas;*LEVINE, R. *Vargas;*MACHADO,\nF. *Últimos;*MAGALHÃES, I*. Segundo; Manchete*(20/4 e 21/12/68); *Rev.\nInst. Hist. Geog. Bras.;*SCHBERT, G. *Província;*SILVA, Z. *Perfis;*\nSKIDMORE, T. *Brasil;*SOC. BRAS. EXPANSÃO COMERCIAL. *Quem;*TÁVORA, J.\n*Vida;*TIAGO, A. *História;*TODARO, M. *Pastores; Veja*(11/9,**11 e\n18/12/68; 24/2/71); VÍTOR, M. *Cinco.*\n\n \n","ref":"FONTES: *Almanaque mundial*(1969); ALVES, M. *Igreja;*BARROS, E.\n*Associação;* CÂM. DEP. *Anais*(1958-2); CARNEIRO, G.*História;*CASCUDO,\nL. *História;*CONFERÊNCIA NAC. BISPOS DO BRASIL; CONY, C. *Quem;*CORTÉS,\nC. *Homens;*COSTA, M. *Cronologia;*COUTINHO, A. *Brasil;*DELLA CAVA, R.\n*Igreja;*DULLES, J. *Getúlio;* *Encic. Mirador; Encic.\nUniversal;*GARDEL, L*. Armoiries; Grande encic. Delta; Grande* *encic.\nportuguesa;*HIRSCHOWICZ, E. *Contemporâneos;*INST. HIST. GEOG. BRAS.\n*Dic.;*INST. NAC. LIVRO. *Índice;*JAMUNDÁ, T. *Catarinenses; Jornal do\nBrasil* (13/5/69); LEITE, A.*****Páginas;*LEVINE, R. *Vargas;*MACHADO,\nF. *Últimos;*MAGALHÃES, I*. Segundo; Manchete*(20/4 e 21/12/68); *Rev.\nInst. Hist. Geog. Bras.;*SCHBERT, G. *Província;*SILVA, Z. *Perfis;*\nSKIDMORE, T. *Brasil;*SOC. BRAS. EXPANSÃO COMERCIAL. *Quem;*TÁVORA, J.\n*Vida;*TIAGO, A. *História;*TODARO, M. *Pastores; Veja*(11/9,**11 e\n18/12/68; 24/2/71); VÍTOR, M. *Cinco.*\n\n \n","dic":"DHBB"}
