{"title":"CÂMARA, Severiano da","cargoss":["Senador"],"cargos_esp":[0],"datas_ini":[1947],"datas_fim":[1948],"estados":["RN"],"autor":[0],"content":"**CÂMARA, Severiano da**\n\n\\*sen. RN 1947-1948.\n\n \n\n*João Severiano da Câmara* nasceu em Taipu (RN) no dia 8 de março de\n1895.\n\nFazendeiro, criador de gado e plantador de algodão, exportador e\nindustrial, foi figura de projeção política no Rio Grande do Norte,\ndesempenhando papel fundamental na criação e no desenvolvimento do\nmunicípio de Baixa Verde, do qual foi o primeiro prefeito.\n\nEleito deputado à Assembléia Constituinte do Rio Grande do Norte no\npleito de outubro de 1934 na legenda do Partido Popular (PP), do qual\nera um dos chefes políticos em seu estado, foi um dos signatários da\nConstituição estadual de 22 de fevereiro de 1936, mas teve seu mandato\nextinto com a decretação do Estado Novo em novembro de 1937. Influente\nem vários municípios, elegeu-se senador federal em janeiro de 1947 na\nlegenda do Partido Social Democrático (PSD), do qual havia sido um dos\nfundadores no estado, assumindo o mandato em março do mesmo ano. Era um\ndos nomes cogitados para concorrer ao governo do estado quando faleceu\nem Natal no dia 12 de dezembro de 1948.\n\n \n\n \n\nFONTES:****CASCUDO, L. *História;*CASCUDO,****L. *História da\nAssembléia;*SENADO. *Relação;*****SILVA, R. *Bacharéis;*TRIB. SUP.\nELEIT.*****Dados* (1)*.*\n\n \n","ref":"FONTES:****CASCUDO, L. *História;*CASCUDO,****L. *História da\nAssembléia;*SENADO. *Relação;*****SILVA, R. *Bacharéis;*TRIB. SUP.\nELEIT.*****Dados* (1)*.*\n\n \n","dic":"DHBB"}
