{"title":"CAMMAROSANO, Millo","cargoss":["Deputado federal","Deputado federal"],"cargos_esp":[0,0],"datas_ini":[1964,1963],"datas_fim":[1967,1963],"estados":["SP","SP"],"autor":[0],"content":"**CAMMAROSANO, Millo**\n\n\\*dep. fed. SP 1963 e 1964-1967.\n\n \n\n*Millo Cammarosano* nasceu em Boa Esperança do Sul (SP) no dia 24 de\noutubro de 1913, filho de Rafael Cammarosano e de Angiolina Guzzo\nCammarosano. Sua irmã, Regtalina Cammarosano, foi vereadora nesta\ncidade.\n\nMillo Cammarosano realizou seus estudos primário e secundário em\nAraraquara e ingressou na Faculdade de Direito da Universidade de São\nPaulo, formando-se em 1936. Iniciou suas atividades profissionais em\nRibeirão Preto e posteriormente em Santo André, como advogado da Junta\nComercial desta cidade. No pleito de outubro de 1952, elegeu-se vereador\nde Santo André, exercendo o mandato até o início de 1957.\n\nNo pleito de outubro de 1962 foi eleito deputado federal por São Paulo,\nna legenda do Partido Republicano (PR), exercendo o mandato de 1º de\nfevereiro a 31 de novembro de 1963 e de 19 de junho de 1964 a 31 de\njaneiro de 1967. Segundo a Câmara dos Deputados, ocupou sua cadeira\ntambém pelas legendas do Partido Trabalhista Brasileiro (PTB) e Partido\nDemocrata Cristão (PDC).\n\nEm conseqüência da extinção dos partidos políticos pelo Ato\nInstitucional nº 2 (27/10/1965) e da posterior instauração do\nbipartidarismo, filiou-se em 1966 à Aliança Renovadora Nacional (Arena),\npartido de apoio ao regime militar instaurado no país em abril de 1964.\nPor esta legenda, tentou a reeleição no pleito de outubro de 1966, mas\nnão obteve sucesso, deixando a Câmara em janeiro do ano seguinte e\nretomando sua atividade de advogado.\n\nFaleceu em Santo André no dia 17 de dezembro de 1977.\n\nFoi casado com Élida Vicentina Fusco Cammarosano, com quem teve três\nfilhos. Um deles, Marli Maria Cammarosano Kopczynski, foi vereadora em\nSanto André, pelo Partido da Social Democracia Brasileira (PSDB) entre\n1993 e 1997. Seu cunhado, José Félix dos Santos, foi prefeito de Boa\nEsperança do Sul.\n\n \n\nFONTES: CÂM. DEP. *Anais*; CÂM. DEP. *Deputados*; CÂM. DEP. *Deputados\nfederais. Inventário*; INF. Viúva BIOG.; TRIB. SUP. ELEIT. *Dados* (6).\n\n \n","ref":"FONTES: CÂM. DEP. *Anais*; CÂM. DEP. *Deputados*; CÂM. DEP. *Deputados\nfederais. Inventário*; INF. Viúva BIOG.; TRIB. SUP. ELEIT. *Dados* (6).\n\n \n","dic":"DHBB"}
