{"title":"CAMPOS, Aluísio","cargoss":["Deputado federal","Constituinte"],"cargos_esp":[0,0],"datas_ini":[1983,1987],"datas_fim":[1991,1988],"estados":["PB",0],"autor":["Alan Carneiro"],"content":"**CAMPOS, Aluísio**\n\n\\*dep. fed. PB 1983-1991; const. 1987-1988.\n\n* *\n\n*Aluísio Afonso Campos* nasceu em Campina Grande (PB) no dia 8 de\ndezembro de 1914, filho de Afonso Rodrigues de Sousa Campos e de\nPorfíria Montenegro Campos.\n\nAdministrador de empresa, advogado e pecuarista, bacharelou-se em\nciências jurídicas e sociais pela Faculdade de Direito do Recife.\n\nIniciou sua vida política elegendo-se deputado estadual em 14 de outubro\nde 1934, na legenda do Partido Progressista (PP) da Paraíba, liderado\npor José Américo de Almeida. Assumindo sua cadeira na Assembléia em maio\nde 1935, exerceu seu mandato até 10 de novembro de 1937, quando, com a\ninstalação do Estado Novo, foram extintos todos os órgãos legislativos\ndo país.\n\nCom o fim do Estado Novo em 29 de outubro de 1945 e a conseqüente\nredemocratização do país, foi elaborada uma nova Constituição,\npromulgada em 18 de setembro de 1946, e surgiram novos partidos\npolíticos. Aluísio Campos filiou-se ao Partido Socialista Brasileiro\n(PSB), no qual se elegeu deputado estadual nas eleições suplementares de\n11 de março de 1951, tendo sido o único candidato da legenda a ser\neleito.\n\nAssumindo sua cadeira na Assembléia Legislativa nesse mesmo mês, deixou\nde concorrer à reeleição no pleito de outubro de 1954, por ter sido\nindicado para assumir uma diretoria do Banco do Nordeste do Brasil.\nDeixou a Assembléia paraibana em janeiro do ano seguinte, quando\nterminou a legislatura, assumindo em seguida o cargo naquela\ninstituição.\n\nEm 1959, com a criação do Conselho de Desenvolvimento do Nordeste\n(Codeno), tornou-se o seu secretário executivo. No mesmo ano, cursou a\nEscola Superior de Guerra (ESG), no Rio de Janeiro. Criada a\nSuperintendência do Desenvolvimento do Nordeste (Sudene), em dezembro,\ntornou-se consultor jurídico e membro do conselho deliberativo.\n\nApós o movimento político-militar de 31 de março de 1964 que depôs o\npresidente João Goulart (1961-1964), deixou a Sudene. Com a extinção dos\npartidos políticos pelo Ato Institucional nº 2 (27/10/1965) e a\ninstituição do bipartidarismo, filiou-se à Aliança Renovadora Nacional\n(Arena), partido de apoio ao regime militar. No ano seguinte foi o\ncandidato arenista ao Senado, tendo sido derrotado pelo oposicionista\nRui Carneiro, do Movimento Democrático Brasileiro (MDB). Em 1967, deixou\na diretoria do Banco do Nordeste. Em 1974, foi novamente escolhido para\nconcorrer a uma vaga no Senado, voltando a ser derrotado por Rui\nCarneiro.\n\nCom o processo de abertura política do então presidente da República\nJoão Batista Figueiredo (1979-1985) em curso, foi promovida uma nova\nreformulação partidária com a extinção do bipartidarismo em novembro de\n1979 e a criação de novas agremiações políticas. No ano seguinte,\nfiliou-se ao Partido Popular (PP), liderado por Tancredo Neves. Com a\nfusão do PP ao Partido do Movimento Democrático Brasileiro (PMDB) em\nfevereiro de 1982, Aluísio Campos filiou-se a esta agremiação.\n\nVoltou a concorrer a cargo eletivo no pleito de novembro desse ano,\nquando se elegeu deputado federal na legenda do PMDB, tendo sua base\neleitoral em Campina Grande. Assumindo o mandato em fevereiro de 1983,\ntornou-se membro titular da Comissão de Constituição e Justiça e\nsuplente da Comissão do Interior da Câmara dos Deputados.\n\nNo final de 1983, o deputado Dante de Oliveira (PMDB-MT) apresentou na\nCâmara um projeto de emenda constitucional restabelecendo eleições\ndiretas para a presidência da República já no ano seguinte. Encampado\npelas oposições, esse projeto proporcionou o desencadeamento de uma\ncampanha nacional pela volta dos pleitos diretos. Na sessão da Câmara de\n25 de abril de 1984, apesar do voto favorável do deputado Aluísio\nCampos, a emenda, por falta de 22 votos, não obteve quórum necessário à\nsua aprovação, o que permitiria o seu envio para apreciação do Senado.\n\nCom esse resultado, o próximo presidente da República seria mesmo eleito\npor via indireta. Para concorrer com os candidatos da situação Paulo\nMaluf e Flávio Marcílio, os partidos de oposição, com exceção do Partido\ndos Trabalhadores (PT), e a Frente Liberal — dissidência da agremiação\ngovernista, o Partido Democrático Social (PDS) — se reuniram na Aliança\nDemocrática e lançaram Tancredo Neves, então governador de Minas Gerais,\ne José Sarney, então senador pelo Maranhão, candidatos, respectivamente,\nà presidência e à vice-presidência da República. No Colégio Eleitoral,\nem 15 de janeiro de 1985, Aluísio Campos votou em Tancredo, que derrotou\nMaluf. Mas o presidente eleito indiretamente adoeceu na véspera da posse\ne quem assumiu o poder no dia 15 de março foi o vice José Sarney, que\nacabou sendo efetivado no mês seguinte, após a morte do titular.\n\nAluísio Campos tornou-se, em 1985, presidente da Comissão de\nConstituição e Justiça, função que exerceria até janeiro de 1987. Em\nnovembro de 1986, reelegeu-se deputado federal. Assumindo seu mandato em\nfevereiro do ano seguinte, com a instalação da Assembléia Nacional\nConstituinte, passou a integrar, como suplente, a Subcomissão da União,\nDistrito Federal e Territórios, da Comissão da Organização do Estado, e\ntornou-se primeiro vice-presidente da Comissão de Sistematização.\n\nVotou a favor do rompimento de relações diplomáticas com os países com\npolítica de discriminação racial, do mandado de segurança coletivo, da\nproteção ao emprego contra a despedida sem justa causa, do turno\nininterrupto de seis horas, do aviso prévio proporcional, da unicidade\nsindical, do voto aos 16 anos, da nacionalização do subsolo, do limite\nde 12% ao ano para os juros reais, da proibição do comércio de sangue,\ndo mandato de cinco anos para o então presidente José Sarney (1985-1990)\ne da criação de um fundo de apoio à reforma agrária. Votou contra a pena\nde morte, o aborto, a remuneração 50% superior para o trabalho extra, a\npluralidade sindical, o presidencialismo, a estatização do sistema\nfinanceiro, a anistia aos micro e pequenos empresários, a legalização do\njogo do bicho e a desapropriação da propriedade produtiva.\n\nCom a promulgação da Constituição em 5 de outubro de 1988, Aluísio\nCampos continuou a exercer o seu mandato ordinário. Deixando de\nconcorrer a nova reeleição no pleito de outubro de 1990, permaneceu na\nCâmara dos Deputados até janeiro do ano seguinte, quando se encerraram o\nseu mandato e a legislatura. Não voltou a concorrer a cargos públicos.\n\nFoi ainda assessor jurídico da Comissão Mista Brasil-Estados Unidos,\nchefe do departamento jurídico do então Banco Nacional de\nDesenvolvimento Econômico (BNDE), advogado da consultoria jurídica do\nBanco do Brasil e membro da Comissão Nacional de Reforma Agrária.\n\nFaleceu em Campina Grande no dia 16 de junho de 2002.\n\nEra casado com Inalda Lobo Campos. Não teve filhos.\n\nEscreveu *Direito e transformação social* (1935), *Realidade e\ndesenvolvimento do Nordeste* (1950), *Aspectos jurídicos dos\nfinanciamentos industriais* (1953), *Fundamentos e objetivos da Operação\nNordeste* (1959), *Estrutura a financiamento da Sudene* (1962),\n*Administração e controle das empresas governamentais* (1978),\n*Responsabilidade dos administradores em empresa pública e sociedade de\neconomia mista; o problema institucional* (1984), *Mandamentos da Nova\nRepública*(1986).\n\nAlan Carneiro\n\nFONTES: ASSEMB. LEGISL. MG. *Dicionário biográfico*; ASSEMB.\nNAC*.*CONST. *Repertório*(1987); CÂM. DEP. *Deputados brasileiros.\nRepertório* (1983-1987); COELHO, J. & OLIVEIRA, A. *Nova*; *Folha de S.\nPaulo* (19/1/87); *Globo* (26/06/02); *História da Paraíba em\nfascículos* (17); TRIB. SUP. ELEIT. *Dados* (2 e 11).\n\n \n\n \n","ref":"FONTES: ASSEMB. LEGISL. MG. *Dicionário biográfico*; ASSEMB.\nNAC*.*CONST. *Repertório*(1987); CÂM. DEP. *Deputados brasileiros.\nRepertório* (1983-1987); COELHO, J. & OLIVEIRA, A. *Nova*; *Folha de S.\nPaulo* (19/1/87); *Globo* (26/06/02); *História da Paraíba em\nfascículos* (17); TRIB. SUP. ELEIT. *Dados* (2 e 11).\n\n \n\n \n","dic":"DHBB"}
